Trial 7 finished with value: 0.3841998140289928 and parameters: {'mnb_alpha': 0.35000000000000003, 'mnb_fit_prior': False}. Best is trial 2 with value: 0.384844.
Trial 0 finished with value: 0.3841998140289928 and parameters: {'mnb_alpha': 0.2, 'mnb_fit_prior': False}. Best is trial 2 with value: 0.384844.
Trial 2 finished with value: 0.38484354706828566 and parameters: {'mnb_alpha': 0.0, 'mnb_fit_prior': True}. Best is trial 2 with value: 0.384844.
Trial 6 finished with value: 0.3841766551360142 and parameters: {'mnb_alpha': 1.0, 'mnb_fit_prior': True}. Best is trial 2 with value: 0.384844.
Trial 10 finished with value: 0.3841766551360142 and parameters: {'mnb_alpha': 0.75, 'mnb_fit_prior': True}. Best is trial 2 with value: 0.384844.
Trial 8 finished with value: 0.3841998140289928 and parameters: {'mnb_alpha': 0.5, 'mnb_fit_prior': False}. Best is trial 2 with value: 0.384844.
Trial 15 finished with value: 0.3841766551360142 and parameters: {'mnb_alpha': 0.9500000000000001, 'mnb_fit_prior': False}. Best is trial 2 with value: 0.384844.
Trial 9 finished with value: 0.3841766551360142 and parameters: {'mnb_alpha': 0.75, 'mnb_fit_prior': True}. Best is trial 2 with value: 0.384844.
Trial 13 finished with value: 0.3841766551360142 and parameters: {'mnb_alpha': 1.0, 'mnb_fit_prior': False}. Best is trial 2 with value: 0.384844.
Trial 14 finished with value: 0.3841766551360142 and parameters: {'mnb_alpha': 0.9, 'mnb_fit_prior': True}. Best is trial 2 with value: 0.384844.
Trial 11 finished with value: 0.3841998140289928 and parameters: {'mnb_alpha': 0.2, 'mnb_fit_prior': True}. Best is trial 2 with value: 0.384844.
Trial 12 finished with value: 0.3841766551360142 and parameters: {'mnb_alpha': 0.7000000000000001, 'mnb_fit_prior': False}. Best is trial 2 with value: 0.384844.
Trial 16 finished with value: 0.38484354706828566 and parameters: {'mnb_alpha': 0.0, 'mnb_fit_prior': False}. Best is trial 16 with value: 0.384844.
Trial 22 finished with value: 0.38484354706828566 and parameters: {'mnb_alpha': 0.0, 'mnb_fit_prior': False}. Best is trial 22 with value: 0.384844.
Trial 17 finished with value: 0.38484354706828566 and parameters: {'mnb_alpha': 0.0, 'mnb_fit_prior': False}. Best is trial 22 with value: 0.384844.
Trial 20 finished with value: 0.38484354706828566 and parameters: {'mnb_alpha': 0.0, 'mnb_fit_prior': False}. Best is trial 22 with value: 0.384844.
Trial 19 finished with value: 0.38484354706828566 and parameters: {'mnb_alpha': 0.0, 'mnb_fit_prior': False}. Best is trial 23 with value: 0.384844.
Trial 23 finished with value: 0.38484354706828566 and parameters: {'mnb_alpha': 0.0, 'mnb_fit_prior': False}. Best is trial 23 with value: 0.384844.
Trial 18 finished with value: 0.38484354706828566 and parameters: {'mnb_alpha': 0.0, 'mnb_fit_prior': True}. Best is trial 23 with value: 0.384844.
Trial 21 finished with value: 0.38484354706828566 and parameters: {'mnb_alpha': 0.0, 'mnb_fit_prior': True}. Best is trial 23 with value: 0.384844.
Trial 24 finished with value: 0.38423437530304067 and parameters: {'mnb_alpha': 0.05, 'mnb_fit_prior': True}. Best is trial 2 with value: 0.384844.
Trial 25 finished with value: 0.38421133911073435 and parameters: {'mnb_alpha': 0.15000000000000002, 'mnb_fit_prior': True}. Best is trial 2 with value: 0.384844.
Trial 26 finished with value: 0.38421133911073435 and parameters: {'mnb_alpha': 0.15000000000000002, 'mnb_fit_prior': True}. Best is trial 2 with value: 0.384844.
Trial 30 finished with value: 0.38421133911073435 and parameters: {'mnb_alpha': 0.15000000000000002, 'mnb_fit_prior': True}. Best is trial 2 with value: 0.384844.
Trial 29 finished with value: 0.3841998140289928 and parameters: {'mnb_alpha': 0.2, 'mnb_fit_prior': True}. Best is trial 2 with value: 0.384844.
Trial 28 finished with value: 0.38421133911073435 and parameters: {'mnb_alpha': 0.15000000000000002, 'mnb_fit_prior': True}. Best is trial 2 with value: 0.384844.
Trial 27 finished with value: 0.38421133911073435 and parameters: {'mnb_alpha': 0.15000000000000002, 'mnb_fit_prior': True}. Best is trial 2 with value: 0.384844.
Trial 31 finished with value: 0.38421133911073435 and parameters: {'mnb_alpha': 0.15000000000000002, 'mnb_fit_prior': True}. Best is trial 2 with value: 0.384844.
Trial 32 finished with value: 0.38421133911073435 and parameters: {'mnb_alpha': 0.15000000000000002, 'mnb_fit_prior': True}. Best is trial 2 with value: 0.384844.
A new study created in RDB with name: PassiveAggressiveClassifier_59d7b7e2
Trial 5 finished with value: 0.4224288938309267 and parameters: {'pac_C': 893.4182720887834, 'pac_early_stopping': True, 'pac_validation_fraction': 0.25, 'pac_n_iter_no_change': 10}. Best is trial 5 with value: 0.422429.
Trial 4 finished with value: 0.4224288938309267 and parameters: {'pac_C': 0.0001723323717804979, 'pac_early_stopping': True, 'pac_validation_fraction': 0.25, 'pac_n_iter_no_change': 10}. Best is trial 4 with value: 0.422429.
Trial 7 finished with value: 0.4224288938309267 and parameters: {'pac_C': 2.0901071615367885, 'pac_early_stopping': True, 'pac_validation_fraction': 0.25, 'pac_n_iter_no_change': 10}. Best is trial 4 with value: 0.422429.
Trial 0 finished with value: 0.4224288938309267 and parameters: {'pac_C': 0.09965776570674376, 'pac_early_stopping': True, 'pac_validation_fraction': 0.25, 'pac_n_iter_no_change': 10}. Best is trial 0 with value: 0.422429.
Trial 3 finished with value: 0.4224288938309267 and parameters: {'pac_C': 332.60390945085913, 'pac_early_stopping': True, 'pac_validation_fraction': 0.25, 'pac_n_iter_no_change': 10}. Best is trial 0 with value: 0.422429.
Trial 6 finished with value: 0.4224288938309267 and parameters: {'pac_C': 0.00013377526644128097, 'pac_early_stopping': True, 'pac_validation_fraction': 0.25, 'pac_n_iter_no_change': 10}. Best is trial 0 with value: 0.422429.
Trial 1 finished with value: 0.4224288938309267 and parameters: {'pac_C': 0.0002801122606088306, 'pac_early_stopping': True, 'pac_validation_fraction': 0.25, 'pac_n_iter_no_change': 10}. Best is trial 0 with value: 0.422429.
Trial 2 finished with value: 0.4224288938309267 and parameters: {'pac_C': 4.237945062910093e-06, 'pac_early_stopping': True, 'pac_validation_fraction': 0.25, 'pac_n_iter_no_change': 10}. Best is trial 0 with value: 0.422429.
Trial 9 finished with value: 0.4224288938309267 and parameters: {'pac_C': 9.82847470093474e-06, 'pac_early_stopping': True, 'pac_validation_fraction': 0.25, 'pac_n_iter_no_change': 10}. Best is trial 0 with value: 0.422429.
Trial 8 finished with value: 0.4224288938309267 and parameters: {'pac_C': 0.0927805649990811, 'pac_early_stopping': True, 'pac_validation_fraction': 0.25, 'pac_n_iter_no_change': 10}. Best is trial 0 with value: 0.422429.
Trial 10 finished with value: 0.4224288938309267 and parameters: {'pac_C': 1.0782600807882698e-06, 'pac_early_stopping': True, 'pac_validation_fraction': 0.25, 'pac_n_iter_no_change': 10}. Best is trial 0 with value: 0.422429.
Trial 11 finished with value: 0.4224288938309267 and parameters: {'pac_C': 3.157551134783288e-06, 'pac_early_stopping': True, 'pac_validation_fraction': 0.25, 'pac_n_iter_no_change': 10}. Best is trial 0 with value: 0.422429.
Trial 12 finished with value: 0.4224288938309267 and parameters: {'pac_C': 2.433307674583783, 'pac_early_stopping': True, 'pac_validation_fraction': 0.25, 'pac_n_iter_no_change': 10}. Best is trial 0 with value: 0.422429.
Trial 13 finished with value: 0.4224288938309267 and parameters: {'pac_C': 181.74525188667528, 'pac_early_stopping': True, 'pac_validation_fraction': 0.25, 'pac_n_iter_no_change': 10}. Best is trial 0 with value: 0.422429.
Trial 14 finished with value: 0.4224288938309267 and parameters: {'pac_C': 0.005399122990212347, 'pac_early_stopping': True, 'pac_validation_fraction': 0.25, 'pac_n_iter_no_change': 10}. Best is trial 0 with value: 0.422429.
Trial 15 finished with value: 0.4224288938309267 and parameters: {'pac_C': 0.00021281006555073318, 'pac_early_stopping': True, 'pac_validation_fraction': 0.25, 'pac_n_iter_no_change': 10}. Best is trial 0 with value: 0.422429.
Trial 17 finished with value: 0.4224288938309267 and parameters: {'pac_C': 1.8125388779886185, 'pac_early_stopping': True, 'pac_validation_fraction': 0.25, 'pac_n_iter_no_change': 10}. Best is trial 0 with value: 0.422429.
Trial 16 finished with value: 0.4224288938309267 and parameters: {'pac_C': 0.0009777705141577704, 'pac_early_stopping': True, 'pac_validation_fraction': 0.25, 'pac_n_iter_no_change': 10}. Best is trial 0 with value: 0.422429.
Trial 18 finished with value: 0.4224288938309267 and parameters: {'pac_C': 0.008544750957292397, 'pac_early_stopping': True, 'pac_validation_fraction': 0.25, 'pac_n_iter_no_change': 10}. Best is trial 0 with value: 0.422429.
Trial 19 finished with value: 0.4224288938309267 and parameters: {'pac_C': 0.007571802088734244, 'pac_early_stopping': True, 'pac_validation_fraction': 0.25, 'pac_n_iter_no_change': 10}. Best is trial 0 with value: 0.422429.
Trial 20 finished with value: 0.4224288938309267 and parameters: {'pac_C': 0.0044588427115310825, 'pac_early_stopping': True, 'pac_validation_fraction': 0.25, 'pac_n_iter_no_change': 10}. Best is trial 0 with value: 0.422429.
Trial 21 finished with value: 0.4224288938309267 and parameters: {'pac_C': 0.014725110473076558, 'pac_early_stopping': True, 'pac_validation_fraction': 0.25, 'pac_n_iter_no_change': 10}. Best is trial 0 with value: 0.422429.
Trial 22 finished with value: 0.4224288938309267 and parameters: {'pac_C': 0.010573766263451039, 'pac_early_stopping': True, 'pac_validation_fraction': 0.25, 'pac_n_iter_no_change': 10}. Best is trial 0 with value: 0.422429.
A new study created in RDB with name: Perceptron_59d7b7e2
Trial 0 finished with value: 0.02086975562336861 and parameters: {'p_penalty': 'elasticnet', 'p_alpha': 7.725302880148794e-05, 'p_eta0': 2.0, 'p_early_stopping': True, 'p_validation_fraction': 0.25, 'p_n_iter_no_change': 10}. Best is trial 0 with value: 0.0208698.
Trial 3 finished with value: 0.2844441188051378 and parameters: {'p_penalty': 'elasticnet', 'p_alpha': 0.1084609788688286, 'p_eta0': 1.0, 'p_early_stopping': True, 'p_validation_fraction': 0.25, 'p_n_iter_no_change': 10}. Best is trial 3 with value: 0.284444.
Trial 2 finished with value: 0.2096008367988791 and parameters: {'p_penalty': 'elasticnet', 'p_alpha': 5.814615563305383e-06, 'p_eta0': 2.0, 'p_early_stopping': True, 'p_validation_fraction': 0.25, 'p_n_iter_no_change': 10}. Best is trial 3 with value: 0.284444.
Trial 1 finished with value: 0.29304364203255756 and parameters: {'p_penalty': 'elasticnet', 'p_alpha': 4.410480466302567e-06, 'p_eta0': 1.0, 'p_early_stopping': True, 'p_validation_fraction': 0.25, 'p_n_iter_no_change': 10}. Best is trial 1 with value: 0.293044.
Trial 4 finished with value: 0.4648759895573 and parameters: {'p_penalty': 'elasticnet', 'p_alpha': 0.3406999551159543, 'p_eta0': 1.0, 'p_early_stopping': True, 'p_validation_fraction': 0.25, 'p_n_iter_no_change': 10}. Best is trial 4 with value: 0.464876.
Trial 6 finished with value: 0.28247232737954847 and parameters: {'p_penalty': 'elasticnet', 'p_alpha': 0.037560519130894664, 'p_eta0': 0.5, 'p_early_stopping': True, 'p_validation_fraction': 0.25, 'p_n_iter_no_change': 10}. Best is trial 4 with value: 0.464876.
Trial 5 finished with value: 0.2844441188051378 and parameters: {'p_penalty': 'elasticnet', 'p_alpha': 0.1141152465553545, 'p_eta0': 0.5, 'p_early_stopping': True, 'p_validation_fraction': 0.25, 'p_n_iter_no_change': 10}. Best is trial 4 with value: 0.464876.
Trial 7 finished with value: 0.2823262111048717 and parameters: {'p_penalty': 'elasticnet', 'p_alpha': 1.7164076146940184e-06, 'p_eta0': 0.5, 'p_early_stopping': True, 'p_validation_fraction': 0.25, 'p_n_iter_no_change': 10}. Best is trial 4 with value: 0.464876.
Trial 8 finished with value: 0.05403042800248884 and parameters: {'p_penalty': 'elasticnet', 'p_alpha': 6.1004048774316335e-06, 'p_eta0': 2.0, 'p_early_stopping': True, 'p_validation_fraction': 0.25, 'p_n_iter_no_change': 10}. Best is trial 4 with value: 0.464876.
Trial 10 finished with value: 0.2844441188051378 and parameters: {'p_penalty': 'elasticnet', 'p_alpha': 0.00034437611479750405, 'p_eta0': 1.0, 'p_early_stopping': True, 'p_validation_fraction': 0.25, 'p_n_iter_no_change': 10}. Best is trial 4 with value: 0.464876.
Trial 13 finished with value: 0.03829022399758928 and parameters: {'p_penalty': 'elasticnet', 'p_alpha': 0.004209951842269661, 'p_eta0': 1.5, 'p_early_stopping': True, 'p_validation_fraction': 0.25, 'p_n_iter_no_change': 10}. Best is trial 4 with value: 0.464876.
Trial 12 finished with value: 0.020991275702586177 and parameters: {'p_penalty': 'elasticnet', 'p_alpha': 0.00012775923533113638, 'p_eta0': 1.0, 'p_early_stopping': True, 'p_validation_fraction': 0.25, 'p_n_iter_no_change': 10}. Best is trial 4 with value: 0.464876.
Trial 9 finished with value: 0.42214908773783894 and parameters: {'p_penalty': 'elasticnet', 'p_alpha': 0.004771417656224404, 'p_eta0': 1.0, 'p_early_stopping': True, 'p_validation_fraction': 0.25, 'p_n_iter_no_change': 10}. Best is trial 4 with value: 0.464876.
Trial 14 finished with value: 0.3279074329732933 and parameters: {'p_penalty': 'elasticnet', 'p_alpha': 0.01976389431805606, 'p_eta0': 0.5, 'p_early_stopping': True, 'p_validation_fraction': 0.25, 'p_n_iter_no_change': 10}. Best is trial 4 with value: 0.464876.
Trial 11 finished with value: 0.04272702009322813 and parameters: {'p_penalty': 'elasticnet', 'p_alpha': 0.06547896542348268, 'p_eta0': 0.5, 'p_early_stopping': True, 'p_validation_fraction': 0.25, 'p_n_iter_no_change': 10}. Best is trial 4 with value: 0.464876.
Trial 16 finished with value: 0.2108194716308641 and parameters: {'p_penalty': 'elasticnet', 'p_alpha': 0.000560623270513284, 'p_eta0': 1.0, 'p_early_stopping': True, 'p_validation_fraction': 0.25, 'p_n_iter_no_change': 10}. Best is trial 4 with value: 0.464876.
Trial 15 finished with value: 0.37544137455420584 and parameters: {'p_penalty': 'elasticnet', 'p_alpha': 1.4338052651811783e-05, 'p_eta0': 1.0, 'p_early_stopping': True, 'p_validation_fraction': 0.25, 'p_n_iter_no_change': 10}. Best is trial 4 with value: 0.464876.
Trial 17 finished with value: 0.34116587551358524 and parameters: {'p_penalty': 'elasticnet', 'p_alpha': 0.006042138281416874, 'p_eta0': 1.5, 'p_early_stopping': True, 'p_validation_fraction': 0.25, 'p_n_iter_no_change': 10}. Best is trial 4 with value: 0.464876.
Trial 20 finished with value: 0.07399138544370873 and parameters: {'p_penalty': 'elasticnet', 'p_alpha': 0.9944679673371608, 'p_eta0': 1.5, 'p_early_stopping': True, 'p_validation_fraction': 0.25, 'p_n_iter_no_change': 10}. Best is trial 4 with value: 0.464876.
Trial 19 finished with value: 0.13081717042097754 and parameters: {'p_penalty': 'elasticnet', 'p_alpha': 0.004908536423220871, 'p_eta0': 1.5, 'p_early_stopping': True, 'p_validation_fraction': 0.25, 'p_n_iter_no_change': 10}. Best is trial 4 with value: 0.464876.
Trial 21 finished with value: 0.07399138544370873 and parameters: {'p_penalty': 'elasticnet', 'p_alpha': 0.855932173866957, 'p_eta0': 1.5, 'p_early_stopping': True, 'p_validation_fraction': 0.25, 'p_n_iter_no_change': 10}. Best is trial 4 with value: 0.464876.
Trial 22 finished with value: 0.12388641062088446 and parameters: {'p_penalty': 'elasticnet', 'p_alpha': 0.5025918634755334, 'p_eta0': 1.5, 'p_early_stopping': True, 'p_validation_fraction': 0.25, 'p_n_iter_no_change': 10}. Best is trial 4 with value: 0.464876.
Trial 18 finished with value: 0.2844441188051378 and parameters: {'p_penalty': 'elasticnet', 'p_alpha': 0.7329593018853479, 'p_eta0': 1.5, 'p_early_stopping': True, 'p_validation_fraction': 0.25, 'p_n_iter_no_change': 10}. Best is trial 4 with value: 0.464876.
Trial 23 finished with value: 0.07399138544370873 and parameters: {'p_penalty': 'elasticnet', 'p_alpha': 0.8488748558192698, 'p_eta0': 1.5, 'p_early_stopping': True, 'p_validation_fraction': 0.25, 'p_n_iter_no_change': 10}. Best is trial 4 with value: 0.464876.
Trial 24 finished with value: 0.2056471681357457 and parameters: {'p_penalty': 'elasticnet', 'p_alpha': 0.003039766847051847, 'p_eta0': 1.5, 'p_early_stopping': True, 'p_validation_fraction': 0.25, 'p_n_iter_no_change': 10}. Best is trial 4 with value: 0.464876.
Trial 27 finished with value: 0.2844441188051378 and parameters: {'p_penalty': 'elasticnet', 'p_alpha': 0.7498908301653086, 'p_eta0': 1.5, 'p_early_stopping': True, 'p_validation_fraction': 0.25, 'p_n_iter_no_change': 10}. Best is trial 4 with value: 0.464876.
Trial 28 finished with value: 0.004784091341900866 and parameters: {'p_penalty': 'elasticnet', 'p_alpha': 2.196693251135345e-05, 'p_eta0': 1.0, 'p_early_stopping': True, 'p_validation_fraction': 0.25, 'p_n_iter_no_change': 10}. Best is trial 4 with value: 0.464876.
Trial 29 finished with value: 0.1773878272821597 and parameters: {'p_penalty': 'elasticnet', 'p_alpha': 0.0020311122179889375, 'p_eta0': 1.0, 'p_early_stopping': True, 'p_validation_fraction': 0.25, 'p_n_iter_no_change': 10}. Best is trial 4 with value: 0.464876.
Trial 25 finished with value: 0.2844441188051378 and parameters: {'p_penalty': 'elasticnet', 'p_alpha': 0.0030808067487362173, 'p_eta0': 1.5, 'p_early_stopping': True, 'p_validation_fraction': 0.25, 'p_n_iter_no_change': 10}. Best is trial 4 with value: 0.464876.
Trial 26 finished with value: 0.2844441188051378 and parameters: {'p_penalty': 'elasticnet', 'p_alpha': 0.6531827528118225, 'p_eta0': 1.5, 'p_early_stopping': True, 'p_validation_fraction': 0.25, 'p_n_iter_no_change': 10}. Best is trial 4 with value: 0.464876.
A new study created in RDB with name: QuadraticDiscriminantAnalysis_59d7b7e2
Trial 5 finished with value: 0.8959405588555578 and parameters: {'qda_reg_param': 0.45, 'qda_tol': 5.81491185836831e-05}. Best is trial 5 with value: 0.895941.
Trial 4 finished with value: 0.8776816513824245 and parameters: {'qda_reg_param': 0.9500000000000001, 'qda_tol': 4.178673241566715e-06}. Best is trial 5 with value: 0.906292.
Trial 3 finished with value: 0.9062922688902247 and parameters: {'qda_reg_param': 0.15000000000000002, 'qda_tol': 0.0005608525264360642}. Best is trial 3 with value: 0.906292.
Trial 6 finished with value: 0.9073081783954601 and parameters: {'qda_reg_param': 0.1, 'qda_tol': 0.00018271671644563508}. Best is trial 6 with value: 0.907308.
Trial 0 finished with value: 0.8880056295866787 and parameters: {'qda_reg_param': 0.8, 'qda_tol': 2.0625339142471627e-06}. Best is trial 6 with value: 0.907308.
Trial 2 finished with value: 0.905848436475046 and parameters: {'qda_reg_param': 0.30000000000000004, 'qda_tol': 9.820522041902377e-05}. Best is trial 6 with value: 0.907308.
Trial 7 finished with value: 0.8712101843086053 and parameters: {'qda_reg_param': 0.0, 'qda_tol': 4.3126874602092504e-05}. Best is trial 6 with value: 0.907308.
Trial 1 finished with value: 0.8879634640551044 and parameters: {'qda_reg_param': 0.8500000000000001, 'qda_tol': 1.1838018820416218e-05}. Best is trial 6 with value: 0.907308.
Trial 8 finished with value: 0.9062922688902247 and parameters: {'qda_reg_param': 0.15000000000000002, 'qda_tol': 1.1383997207014586e-05}. Best is trial 6 with value: 0.907308.
Trial 9 finished with value: 0.8879634640551044 and parameters: {'qda_reg_param': 0.8500000000000001, 'qda_tol': 0.00011385864198350698}. Best is trial 6 with value: 0.907308.
Trial 11 finished with value: 0.905848436475046 and parameters: {'qda_reg_param': 0.2, 'qda_tol': 3.432222585214194e-05}. Best is trial 6 with value: 0.907308.
Trial 10 finished with value: 0.8902004936721672 and parameters: {'qda_reg_param': 0.6000000000000001, 'qda_tol': 1.9440415641272245e-05}. Best is trial 6 with value: 0.907308.
Trial 12 finished with value: 0.905848436475046 and parameters: {'qda_reg_param': 0.25, 'qda_tol': 0.0001063239777801493}. Best is trial 6 with value: 0.907308.
Trial 14 finished with value: 0.9005129068031295 and parameters: {'qda_reg_param': 0.4, 'qda_tol': 4.813169013943567e-06}. Best is trial 6 with value: 0.907308.
Trial 13 finished with value: 0.9073081783954601 and parameters: {'qda_reg_param': 0.1, 'qda_tol': 0.0002646968236992305}. Best is trial 6 with value: 0.907308.
Trial 15 finished with value: 0.8712101843086053 and parameters: {'qda_reg_param': 0.0, 'qda_tol': 3.0310678869421537e-06}. Best is trial 6 with value: 0.907308.
Trial 16 finished with value: 0.905848436475046 and parameters: {'qda_reg_param': 0.25, 'qda_tol': 0.0001205616366474031}. Best is trial 6 with value: 0.907308.
Trial 17 finished with value: 0.8902004936721672 and parameters: {'qda_reg_param': 0.6000000000000001, 'qda_tol': 0.0007609333274229049}. Best is trial 6 with value: 0.907308.
Trial 19 finished with value: 0.8712101843086053 and parameters: {'qda_reg_param': 0.0, 'qda_tol': 0.0007508972197532172}. Best is trial 18 with value: 0.907471.
Trial 18 finished with value: 0.9074710020951025 and parameters: {'qda_reg_param': 0.05, 'qda_tol': 0.0007674638672836251}. Best is trial 18 with value: 0.907471.
Trial 20 finished with value: 0.8712101843086053 and parameters: {'qda_reg_param': 0.0, 'qda_tol': 0.0007285119510853439}. Best is trial 18 with value: 0.907471.
