Trial 22 finished with value: 0.418140026134891 and parameters: {'compnb_alpha': 1.0, 'compnb_fit_prior': True, 'compnb_norm': False}. Best is trial 0 with value: 0.41814.
Trial 23 finished with value: 0.418140026134891 and parameters: {'compnb_alpha': 1.0, 'compnb_fit_prior': True, 'compnb_norm': False}. Best is trial 0 with value: 0.41814.
Trial 18 finished with value: 0.418140026134891 and parameters: {'compnb_alpha': 1.0, 'compnb_fit_prior': True, 'compnb_norm': False}. Best is trial 0 with value: 0.41814.
Trial 24 finished with value: 0.418140026134891 and parameters: {'compnb_alpha': 0.65, 'compnb_fit_prior': False, 'compnb_norm': False}. Best is trial 0 with value: 0.41814.
Trial 26 finished with value: 0.418140026134891 and parameters: {'compnb_alpha': 0.9, 'compnb_fit_prior': True, 'compnb_norm': False}. Best is trial 0 with value: 0.41814.
Trial 28 finished with value: 0.418140026134891 and parameters: {'compnb_alpha': 0.8500000000000001, 'compnb_fit_prior': True, 'compnb_norm': False}. Best is trial 0 with value: 0.41814.
Trial 27 finished with value: 0.418140026134891 and parameters: {'compnb_alpha': 0.8500000000000001, 'compnb_fit_prior': True, 'compnb_norm': False}. Best is trial 0 with value: 0.41814.
Trial 29 finished with value: 0.418140026134891 and parameters: {'compnb_alpha': 0.8500000000000001, 'compnb_fit_prior': True, 'compnb_norm': False}. Best is trial 0 with value: 0.41814.
Trial 25 finished with value: 0.418140026134891 and parameters: {'compnb_alpha': 0.8500000000000001, 'compnb_fit_prior': True, 'compnb_norm': False}. Best is trial 0 with value: 0.41814.
A new study created in RDB with name: DecisionTreeClassifier_59d7b7e2
Trial 0 finished with value: 0.9693380894796314 and parameters: {'dtc_criterion': 'entropy', 'dtc_splitter': 'random', 'dtc_min_samples_split': 38, 'dtc_min_samples_leaf': 13, 'dtc_max_features': 26}. Best is trial 0 with value: 0.969338.
Trial 3 finished with value: 0.9382023143992356 and parameters: {'dtc_criterion': 'entropy', 'dtc_splitter': 'random', 'dtc_min_samples_split': 46, 'dtc_min_samples_leaf': 32, 'dtc_max_features': 10}. Best is trial 0 with value: 0.969338.
Trial 2 finished with value: 0.9678375247700927 and parameters: {'dtc_criterion': 'entropy', 'dtc_splitter': 'random', 'dtc_min_samples_split': 4, 'dtc_min_samples_leaf': 43, 'dtc_max_features': 21}. Best is trial 0 with value: 0.969338.
Trial 7 finished with value: 0.9915908644966248 and parameters: {'dtc_criterion': 'entropy', 'dtc_splitter': 'random', 'dtc_min_samples_split': 11, 'dtc_min_samples_leaf': 32, 'dtc_max_features': 25}. Best is trial 7 with value: 0.991591.
Trial 6 finished with value: 0.9915330478940446 and parameters: {'dtc_criterion': 'gini', 'dtc_splitter': 'best', 'dtc_min_samples_split': 45, 'dtc_min_samples_leaf': 16, 'dtc_max_features': 22}. Best is trial 7 with value: 0.991591.
Trial 5 finished with value: 0.9917337105530349 and parameters: {'dtc_criterion': 'gini', 'dtc_splitter': 'best', 'dtc_min_samples_split': 2, 'dtc_min_samples_leaf': 23, 'dtc_max_features': 42}. Best is trial 5 with value: 0.991734.
Trial 1 finished with value: 0.9917191067921585 and parameters: {'dtc_criterion': 'gini', 'dtc_splitter': 'best', 'dtc_min_samples_split': 23, 'dtc_min_samples_leaf': 6, 'dtc_max_features': 47}. Best is trial 5 with value: 0.991734.
Trial 4 finished with value: 0.9916494403126479 and parameters: {'dtc_criterion': 'gini', 'dtc_splitter': 'best', 'dtc_min_samples_split': 6, 'dtc_min_samples_leaf': 44, 'dtc_max_features': 50}. Best is trial 5 with value: 0.991734.
Trial 8 finished with value: 0.9916769363512067 and parameters: {'dtc_criterion': 'entropy', 'dtc_splitter': 'random', 'dtc_min_samples_split': 40, 'dtc_min_samples_leaf': 47, 'dtc_max_features': 40}. Best is trial 5 with value: 0.991734.
Trial 9 finished with value: 0.9631580303089904 and parameters: {'dtc_criterion': 'entropy', 'dtc_splitter': 'random', 'dtc_min_samples_split': 11, 'dtc_min_samples_leaf': 29, 'dtc_max_features': 4}. Best is trial 5 with value: 0.991734.
Trial 10 finished with value: 0.9885433350520779 and parameters: {'dtc_criterion': 'entropy', 'dtc_splitter': 'random', 'dtc_min_samples_split': 5, 'dtc_min_samples_leaf': 48, 'dtc_max_features': 39}. Best is trial 5 with value: 0.991734.
Trial 11 finished with value: 0.991787197909166 and parameters: {'dtc_criterion': 'entropy', 'dtc_splitter': 'best', 'dtc_min_samples_split': 35, 'dtc_min_samples_leaf': 39, 'dtc_max_features': 32}. Best is trial 11 with value: 0.991787.
Trial 13 finished with value: 0.8569980298443332 and parameters: {'dtc_criterion': 'gini', 'dtc_splitter': 'best', 'dtc_min_samples_split': 12, 'dtc_min_samples_leaf': 45, 'dtc_max_features': 7}. Best is trial 11 with value: 0.991787.
Trial 12 finished with value: 0.9915315052595696 and parameters: {'dtc_criterion': 'gini', 'dtc_splitter': 'best', 'dtc_min_samples_split': 26, 'dtc_min_samples_leaf': 48, 'dtc_max_features': 40}. Best is trial 11 with value: 0.991787.
Trial 16 finished with value: 0.9832137182488897 and parameters: {'dtc_criterion': 'entropy', 'dtc_splitter': 'random', 'dtc_min_samples_split': 23, 'dtc_min_samples_leaf': 13, 'dtc_max_features': 16}. Best is trial 11 with value: 0.991787.
Trial 15 finished with value: 0.9910695933276421 and parameters: {'dtc_criterion': 'entropy', 'dtc_splitter': 'best', 'dtc_min_samples_split': 23, 'dtc_min_samples_leaf': 19, 'dtc_max_features': 6}. Best is trial 11 with value: 0.991787.
Trial 14 finished with value: 0.991604016441208 and parameters: {'dtc_criterion': 'gini', 'dtc_splitter': 'best', 'dtc_min_samples_split': 16, 'dtc_min_samples_leaf': 30, 'dtc_max_features': 30}. Best is trial 11 with value: 0.991787.
Trial 17 finished with value: 0.9913224081360822 and parameters: {'dtc_criterion': 'gini', 'dtc_splitter': 'best', 'dtc_min_samples_split': 22, 'dtc_min_samples_leaf': 20, 'dtc_max_features': 37}. Best is trial 11 with value: 0.991787.
Trial 18 finished with value: 0.9915968420152728 and parameters: {'dtc_criterion': 'gini', 'dtc_splitter': 'best', 'dtc_min_samples_split': 23, 'dtc_min_samples_leaf': 2, 'dtc_max_features': 49}. Best is trial 11 with value: 0.991787.
Trial 21 finished with value: 0.9916405249791949 and parameters: {'dtc_criterion': 'gini', 'dtc_splitter': 'best', 'dtc_min_samples_split': 32, 'dtc_min_samples_leaf': 23, 'dtc_max_features': 33}. Best is trial 11 with value: 0.991787.
Trial 20 finished with value: 0.9915217930933299 and parameters: {'dtc_criterion': 'gini', 'dtc_splitter': 'best', 'dtc_min_samples_split': 32, 'dtc_min_samples_leaf': 21, 'dtc_max_features': 32}. Best is trial 11 with value: 0.991787.
Trial 19 finished with value: 0.9914335668774652 and parameters: {'dtc_criterion': 'gini', 'dtc_splitter': 'best', 'dtc_min_samples_split': 33, 'dtc_min_samples_leaf': 22, 'dtc_max_features': 32}. Best is trial 11 with value: 0.991787.
A new study created in RDB with name: ExtraTreeClassifier_59d7b7e2
Trial 4 finished with value: 0.9517464288278115 and parameters: {'etc_criterion': 'entropy', 'etc_min_samples_split': 2, 'etc_min_samples_leaf': 8, 'etc_max_features': 21}. Best is trial 4 with value: 0.951746.
Trial 1 finished with value: 0.9679643423477663 and parameters: {'etc_criterion': 'entropy', 'etc_min_samples_split': 3, 'etc_min_samples_leaf': 34, 'etc_max_features': 21}. Best is trial 1 with value: 0.967964.
Trial 6 finished with value: 0.9916064519149909 and parameters: {'etc_criterion': 'entropy', 'etc_min_samples_split': 10, 'etc_min_samples_leaf': 1, 'etc_max_features': 23}. Best is trial 6 with value: 0.991606.
Trial 0 finished with value: 0.9914752567183542 and parameters: {'etc_criterion': 'entropy', 'etc_min_samples_split': 21, 'etc_min_samples_leaf': 50, 'etc_max_features': 38}. Best is trial 6 with value: 0.991606.
Trial 5 finished with value: 0.9915808805712719 and parameters: {'etc_criterion': 'entropy', 'etc_min_samples_split': 3, 'etc_min_samples_leaf': 8, 'etc_max_features': 18}. Best is trial 6 with value: 0.991606.
Trial 7 finished with value: 0.9909562876429838 and parameters: {'etc_criterion': 'gini', 'etc_min_samples_split': 32, 'etc_min_samples_leaf': 31, 'etc_max_features': 25}. Best is trial 6 with value: 0.991606.
Trial 2 finished with value: 0.9914619574238083 and parameters: {'etc_criterion': 'gini', 'etc_min_samples_split': 42, 'etc_min_samples_leaf': 6, 'etc_max_features': 49}. Best is trial 6 with value: 0.991606.
Trial 3 finished with value: 0.967941634561122 and parameters: {'etc_criterion': 'entropy', 'etc_min_samples_split': 13, 'etc_min_samples_leaf': 40, 'etc_max_features': 30}. Best is trial 6 with value: 0.991606.
Trial 8 finished with value: 0.9916468083464302 and parameters: {'etc_criterion': 'gini', 'etc_min_samples_split': 29, 'etc_min_samples_leaf': 18, 'etc_max_features': 35}. Best is trial 8 with value: 0.991647.
Trial 9 finished with value: 0.9432493758861956 and parameters: {'etc_criterion': 'entropy', 'etc_min_samples_split': 48, 'etc_min_samples_leaf': 17, 'etc_max_features': 33}. Best is trial 8 with value: 0.991647.
Trial 11 finished with value: 0.28451101414015956 and parameters: {'etc_criterion': 'entropy', 'etc_min_samples_split': 2, 'etc_min_samples_leaf': 12, 'etc_max_features': 3}. Best is trial 8 with value: 0.991647.
Trial 14 finished with value: 0.9874510914809754 and parameters: {'etc_criterion': 'gini', 'etc_min_samples_split': 11, 'etc_min_samples_leaf': 2, 'etc_max_features': 5}. Best is trial 8 with value: 0.991647.
Trial 12 finished with value: 0.9914521318473107 and parameters: {'etc_criterion': 'entropy', 'etc_min_samples_split': 2, 'etc_min_samples_leaf': 14, 'etc_max_features': 28}. Best is trial 13 with value: 0.991694.
Trial 13 finished with value: 0.991694479680796 and parameters: {'etc_criterion': 'entropy', 'etc_min_samples_split': 25, 'etc_min_samples_leaf': 6, 'etc_max_features': 34}. Best is trial 13 with value: 0.991694.
Trial 10 finished with value: 0.9913199616367504 and parameters: {'etc_criterion': 'entropy', 'etc_min_samples_split': 46, 'etc_min_samples_leaf': 40, 'etc_max_features': 50}. Best is trial 13 with value: 0.991694.
Trial 15 finished with value: 0.98344185938812 and parameters: {'etc_criterion': 'gini', 'etc_min_samples_split': 19, 'etc_min_samples_leaf': 38, 'etc_max_features': 34}. Best is trial 13 with value: 0.991694.
Trial 16 finished with value: 0.9914075612594201 and parameters: {'etc_criterion': 'gini', 'etc_min_samples_split': 10, 'etc_min_samples_leaf': 5, 'etc_max_features': 13}. Best is trial 13 with value: 0.991694.
Trial 17 finished with value: 0.9909097096342069 and parameters: {'etc_criterion': 'gini', 'etc_min_samples_split': 31, 'etc_min_samples_leaf': 22, 'etc_max_features': 11}. Best is trial 13 with value: 0.991694.
Trial 18 finished with value: 0.9915355356527827 and parameters: {'etc_criterion': 'gini', 'etc_min_samples_split': 30, 'etc_min_samples_leaf': 22, 'etc_max_features': 41}. Best is trial 13 with value: 0.991694.
Trial 19 finished with value: 0.9912764782560731 and parameters: {'etc_criterion': 'gini', 'etc_min_samples_split': 30, 'etc_min_samples_leaf': 19, 'etc_max_features': 43}. Best is trial 13 with value: 0.991694.
Trial 22 finished with value: 0.9887868707409583 and parameters: {'etc_criterion': 'gini', 'etc_min_samples_split': 33, 'etc_min_samples_leaf': 23, 'etc_max_features': 41}. Best is trial 13 with value: 0.991694.
Trial 23 finished with value: 0.991371854175252 and parameters: {'etc_criterion': 'gini', 'etc_min_samples_split': 32, 'etc_min_samples_leaf': 22, 'etc_max_features': 42}. Best is trial 13 with value: 0.991694.
Trial 21 finished with value: 0.9915355356527827 and parameters: {'etc_criterion': 'gini', 'etc_min_samples_split': 32, 'etc_min_samples_leaf': 22, 'etc_max_features': 41}. Best is trial 13 with value: 0.991694.
Trial 20 finished with value: 0.991371854175252 and parameters: {'etc_criterion': 'gini', 'etc_min_samples_split': 33, 'etc_min_samples_leaf': 22, 'etc_max_features': 42}. Best is trial 13 with value: 0.991694.
Trial 24 finished with value: 0.9901052535010172 and parameters: {'etc_criterion': 'gini', 'etc_min_samples_split': 36, 'etc_min_samples_leaf': 23, 'etc_max_features': 42}. Best is trial 13 with value: 0.991694.
Trial 25 finished with value: 0.9916936766298785 and parameters: {'etc_criterion': 'gini', 'etc_min_samples_split': 33, 'etc_min_samples_leaf': 23, 'etc_max_features': 43}. Best is trial 13 with value: 0.991694.
Trial 26 finished with value: 0.9918385154031935 and parameters: {'etc_criterion': 'gini', 'etc_min_samples_split': 38, 'etc_min_samples_leaf': 18, 'etc_max_features': 45}. Best is trial 26 with value: 0.991839.
Trial 27 finished with value: 0.9915834053243594 and parameters: {'etc_criterion': 'gini', 'etc_min_samples_split': 39, 'etc_min_samples_leaf': 27, 'etc_max_features': 37}. Best is trial 26 with value: 0.991839.
Trial 28 finished with value: 0.991529361349768 and parameters: {'etc_criterion': 'entropy', 'etc_min_samples_split': 39, 'etc_min_samples_leaf': 1, 'etc_max_features': 35}. Best is trial 26 with value: 0.991861.
Trial 29 finished with value: 0.9918605092623306 and parameters: {'etc_criterion': 'entropy', 'etc_min_samples_split': 39, 'etc_min_samples_leaf': 12, 'etc_max_features': 35}. Best is trial 29 with value: 0.991861.
A new study created in RDB with name: ExtraTreesClassifier_59d7b7e2
Trial 0 finished with value: 0.9915415325019288 and parameters: {'etsc_n_estimators': 60, 'etsc_criterion': 'entropy', 'etsc_min_samples_split': 15, 'etsc_min_samples_leaf': 12, 'etsc_max_features': 22, 'etsc_bootstrap': False}. Best is trial 0 with value: 0.991542.
Trial 6 finished with value: 0.9596072114620449 and parameters: {'etsc_n_estimators': 190, 'etsc_criterion': 'entropy', 'etsc_min_samples_split': 34, 'etsc_min_samples_leaf': 35, 'etsc_max_features': 5, 'etsc_bootstrap': False}. Best is trial 0 with value: 0.991542.
Trial 7 finished with value: 0.9914870260671517 and parameters: {'etsc_n_estimators': 70, 'etsc_criterion': 'entropy', 'etsc_min_samples_split': 48, 'etsc_min_samples_leaf': 1, 'etsc_max_features': 33, 'etsc_bootstrap': True}. Best is trial 0 with value: 0.991542.
Trial 4 finished with value: 0.9909860017601607 and parameters: {'etsc_n_estimators': 110, 'etsc_criterion': 'entropy', 'etsc_min_samples_split': 28, 'etsc_min_samples_leaf': 29, 'etsc_max_features': 20, 'etsc_bootstrap': False}. Best is trial 0 with value: 0.991542.
Trial 3 finished with value: 0.9885018246540701 and parameters: {'etsc_n_estimators': 190, 'etsc_criterion': 'entropy', 'etsc_min_samples_split': 38, 'etsc_min_samples_leaf': 25, 'etsc_max_features': 12, 'etsc_bootstrap': True}. Best is trial 0 with value: 0.991542.
Trial 5 finished with value: 0.9915416484938764 and parameters: {'etsc_n_estimators': 100, 'etsc_criterion': 'gini', 'etsc_min_samples_split': 42, 'etsc_min_samples_leaf': 5, 'etsc_max_features': 28, 'etsc_bootstrap': False}. Best is trial 5 with value: 0.991542.
Trial 10 finished with value: 0.991240883104062 and parameters: {'etsc_n_estimators': 60, 'etsc_criterion': 'entropy', 'etsc_min_samples_split': 22, 'etsc_min_samples_leaf': 13, 'etsc_max_features': 18, 'etsc_bootstrap': True}. Best is trial 5 with value: 0.991542.
Trial 12 finished with value: 0.39138198457528506 and parameters: {'etsc_n_estimators': 100, 'etsc_criterion': 'entropy', 'etsc_min_samples_split': 27, 'etsc_min_samples_leaf': 20, 'etsc_max_features': 1, 'etsc_bootstrap': True}. Best is trial 5 with value: 0.991542.
Trial 2 finished with value: 0.9911809292370171 and parameters: {'etsc_n_estimators': 190, 'etsc_criterion': 'entropy', 'etsc_min_samples_split': 46, 'etsc_min_samples_leaf': 18, 'etsc_max_features': 18, 'etsc_bootstrap': True}. Best is trial 5 with value: 0.991542.
Trial 9 finished with value: 0.9899419407644368 and parameters: {'etsc_n_estimators': 120, 'etsc_criterion': 'gini', 'etsc_min_samples_split': 4, 'etsc_min_samples_leaf': 47, 'etsc_max_features': 14, 'etsc_bootstrap': False}. Best is trial 5 with value: 0.991542.
Trial 13 finished with value: 0.9911881619710052 and parameters: {'etsc_n_estimators': 60, 'etsc_criterion': 'entropy', 'etsc_min_samples_split': 46, 'etsc_min_samples_leaf': 27, 'etsc_max_features': 23, 'etsc_bootstrap': True}. Best is trial 5 with value: 0.991542.
Trial 16 finished with value: 0.9915510141833156 and parameters: {'etsc_n_estimators': 50, 'etsc_criterion': 'entropy', 'etsc_min_samples_split': 4, 'etsc_min_samples_leaf': 6, 'etsc_max_features': 23, 'etsc_bootstrap': True}. Best is trial 16 with value: 0.991551.
Trial 8 finished with value: 0.9915773101759879 and parameters: {'etsc_n_estimators': 90, 'etsc_criterion': 'entropy', 'etsc_min_samples_split': 50, 'etsc_min_samples_leaf': 38, 'etsc_max_features': 43, 'etsc_bootstrap': False}. Best is trial 8 with value: 0.991577.
Trial 1 finished with value: 0.9915646154579977 and parameters: {'etsc_n_estimators': 170, 'etsc_criterion': 'entropy', 'etsc_min_samples_split': 13, 'etsc_min_samples_leaf': 18, 'etsc_max_features': 33, 'etsc_bootstrap': False}. Best is trial 8 with value: 0.991577.
Trial 11 finished with value: 0.9906649795598595 and parameters: {'etsc_n_estimators': 200, 'etsc_criterion': 'gini', 'etsc_min_samples_split': 49, 'etsc_min_samples_leaf': 35, 'etsc_max_features': 20, 'etsc_bootstrap': True}. Best is trial 8 with value: 0.991577.
Trial 15 finished with value: 0.9914658837772272 and parameters: {'etsc_n_estimators': 150, 'etsc_criterion': 'entropy', 'etsc_min_samples_split': 13, 'etsc_min_samples_leaf': 10, 'etsc_max_features': 33, 'etsc_bootstrap': False}. Best is trial 8 with value: 0.991577.
Trial 14 finished with value: 0.9914587905248561 and parameters: {'etsc_n_estimators': 200, 'etsc_criterion': 'gini', 'etsc_min_samples_split': 3, 'etsc_min_samples_leaf': 47, 'etsc_max_features': 27, 'etsc_bootstrap': False}. Best is trial 8 with value: 0.991577.
Trial 17 finished with value: 0.9915954015226176 and parameters: {'etsc_n_estimators': 150, 'etsc_criterion': 'gini', 'etsc_min_samples_split': 40, 'etsc_min_samples_leaf': 2, 'etsc_max_features': 43, 'etsc_bootstrap': False}. Best is trial 17 with value: 0.991595.
Trial 18 finished with value: 0.9915799948253001 and parameters: {'etsc_n_estimators': 150, 'etsc_criterion': 'gini', 'etsc_min_samples_split': 13, 'etsc_min_samples_leaf': 4, 'etsc_max_features': 42, 'etsc_bootstrap': False}. Best is trial 17 with value: 0.991595.
Trial 20 finished with value: 0.9915471208614604 and parameters: {'etsc_n_estimators': 150, 'etsc_criterion': 'gini', 'etsc_min_samples_split': 2, 'etsc_min_samples_leaf': 43, 'etsc_max_features': 50, 'etsc_bootstrap': False}. Best is trial 17 with value: 0.991595.
Trial 21 finished with value: 0.9914862858436203 and parameters: {'etsc_n_estimators': 150, 'etsc_criterion': 'gini', 'etsc_min_samples_split': 13, 'etsc_min_samples_leaf': 40, 'etsc_max_features': 48, 'etsc_bootstrap': False}. Best is trial 17 with value: 0.991595.
Trial 19 finished with value: 0.9915201319788928 and parameters: {'etsc_n_estimators': 160, 'etsc_criterion': 'gini', 'etsc_min_samples_split': 4, 'etsc_min_samples_leaf': 1, 'etsc_max_features': 48, 'etsc_bootstrap': False}. Best is trial 17 with value: 0.991595.
Trial 22 finished with value: 0.9916002567555674 and parameters: {'etsc_n_estimators': 150, 'etsc_criterion': 'gini', 'etsc_min_samples_split': 15, 'etsc_min_samples_leaf': 48, 'etsc_max_features': 49, 'etsc_bootstrap': False}. Best is trial 22 with value: 0.9916.
Trial 23 finished with value: 0.9914249787306676 and parameters: {'etsc_n_estimators': 150, 'etsc_criterion': 'gini', 'etsc_min_samples_split': 15, 'etsc_min_samples_leaf': 46, 'etsc_max_features': 50, 'etsc_bootstrap': False}. Best is trial 22 with value: 0.9916.
Trial 24 finished with value: 0.9915243595440987 and parameters: {'etsc_n_estimators': 150, 'etsc_criterion': 'entropy', 'etsc_min_samples_split': 13, 'etsc_min_samples_leaf': 42, 'etsc_max_features': 48, 'etsc_bootstrap': False}. Best is trial 22 with value: 0.9916.
Trial 25 finished with value: 0.991600374291865 and parameters: {'etsc_n_estimators': 140, 'etsc_criterion': 'gini', 'etsc_min_samples_split': 34, 'etsc_min_samples_leaf': 41, 'etsc_max_features': 49, 'etsc_bootstrap': False}. Best is trial 25 with value: 0.9916.
Trial 26 finished with value: 0.9915417643310814 and parameters: {'etsc_n_estimators': 140, 'etsc_criterion': 'gini', 'etsc_min_samples_split': 22, 'etsc_min_samples_leaf': 4, 'etsc_max_features': 50, 'etsc_bootstrap': False}. Best is trial 25 with value: 0.9916.
Trial 29 finished with value: 0.9915270116002118 and parameters: {'etsc_n_estimators': 130, 'etsc_criterion': 'gini', 'etsc_min_samples_split': 34, 'etsc_min_samples_leaf': 7, 'etsc_max_features': 41, 'etsc_bootstrap': False}. Best is trial 25 with value: 0.9916.
Trial 27 finished with value: 0.9916334016004311 and parameters: {'etsc_n_estimators': 140, 'etsc_criterion': 'gini', 'etsc_min_samples_split': 23, 'etsc_min_samples_leaf': 1, 'etsc_max_features': 42, 'etsc_bootstrap': False}. Best is trial 27 with value: 0.991633.
Trial 28 finished with value: 0.9914888214117393 and parameters: {'etsc_n_estimators': 140, 'etsc_criterion': 'gini', 'etsc_min_samples_split': 34, 'etsc_min_samples_leaf': 1, 'etsc_max_features': 43, 'etsc_bootstrap': False}. Best is trial 27 with value: 0.991633.
A new study created in RDB with name: GaussianNB_59d7b7e2
Trial 2 finished with value: 0.2844441188051378 and parameters: {'gnb_var_smoothing': 393.5320423642684}. Best is trial 2 with value: 0.284444.
Trial 1 finished with value: 0.3953608949876451 and parameters: {'gnb_var_smoothing': 0.00010356452132040515}. Best is trial 3 with value: 0.765197.
Trial 0 finished with value: 0.4660925703210601 and parameters: {'gnb_var_smoothing': 0.45268385036546754}. Best is trial 3 with value: 0.765197.
