Trial 10 finished with value: 0.926327024505978 and parameters: {'lsvc_pcs_kernel_gamma': 761.0733419852787, 'lsvc_pcs_kernel_n_components': 50, 'lsvc_pcs_degree': 2, 'lsvc_pcs_dual': False, 'lsvc_pcs_C': 1.7954428381716868e-06, 'lsvc_pcs_max_iter': 2000}. Best is trial 2 with value: 0.949788.
Trial 11 finished with value: 0.9437116125775098 and parameters: {'lsvc_pcs_kernel_gamma': 268.9984751676975, 'lsvc_pcs_kernel_n_components': 50, 'lsvc_pcs_degree': 2, 'lsvc_pcs_dual': False, 'lsvc_pcs_C': 274.80634422978665, 'lsvc_pcs_max_iter': 2000}. Best is trial 2 with value: 0.949788.
Trial 12 finished with value: 0.9731028216646951 and parameters: {'lsvc_pcs_kernel_gamma': 22.8157913486158, 'lsvc_pcs_kernel_n_components': 50, 'lsvc_pcs_degree': 2, 'lsvc_pcs_dual': False, 'lsvc_pcs_C': 0.007427172598356171, 'lsvc_pcs_max_iter': 2000}. Best is trial 12 with value: 0.973103.
Trial 13 finished with value: 0.9725486086809939 and parameters: {'lsvc_pcs_kernel_gamma': 64.96365049766929, 'lsvc_pcs_kernel_n_components': 100, 'lsvc_pcs_degree': 2, 'lsvc_pcs_dual': False, 'lsvc_pcs_C': 0.006262235710788179, 'lsvc_pcs_max_iter': 2000}. Best is trial 12 with value: 0.973103.
Trial 14 finished with value: 0.9366461234992812 and parameters: {'lsvc_pcs_kernel_gamma': 98.34787265807263, 'lsvc_pcs_kernel_n_components': 50, 'lsvc_pcs_degree': 2, 'lsvc_pcs_dual': False, 'lsvc_pcs_C': 0.004070741668653144, 'lsvc_pcs_max_iter': 2000}. Best is trial 12 with value: 0.973103.
Trial 15 finished with value: 0.939961354260939 and parameters: {'lsvc_pcs_kernel_gamma': 52.55110565453554, 'lsvc_pcs_kernel_n_components': 100, 'lsvc_pcs_degree': 2, 'lsvc_pcs_dual': False, 'lsvc_pcs_C': 0.007457591586754352, 'lsvc_pcs_max_iter': 2000}. Best is trial 12 with value: 0.973103.
Trial 16 finished with value: 0.9587315374562748 and parameters: {'lsvc_pcs_kernel_gamma': 0.7925247486483918, 'lsvc_pcs_kernel_n_components': 50, 'lsvc_pcs_degree': 2, 'lsvc_pcs_dual': False, 'lsvc_pcs_C': 0.00035752821680126257, 'lsvc_pcs_max_iter': 2000}. Best is trial 12 with value: 0.973103.
Trial 17 finished with value: 0.9600075163698452 and parameters: {'lsvc_pcs_kernel_gamma': 43.724207396944394, 'lsvc_pcs_kernel_n_components': 100, 'lsvc_pcs_degree': 2, 'lsvc_pcs_dual': False, 'lsvc_pcs_C': 1.8090346157210986e-05, 'lsvc_pcs_max_iter': 2000}. Best is trial 12 with value: 0.973103.
Trial 18 finished with value: 0.924213013355958 and parameters: {'lsvc_pcs_kernel_gamma': 968.7078315338273, 'lsvc_pcs_kernel_n_components': 100, 'lsvc_pcs_degree': 2, 'lsvc_pcs_dual': False, 'lsvc_pcs_C': 0.028586372443969194, 'lsvc_pcs_max_iter': 2000}. Best is trial 12 with value: 0.973103.
Trial 19 finished with value: 0.929811919596161 and parameters: {'lsvc_pcs_kernel_gamma': 3.6056599761146195, 'lsvc_pcs_kernel_n_components': 50, 'lsvc_pcs_degree': 2, 'lsvc_pcs_dual': False, 'lsvc_pcs_C': 0.0023453636646754857, 'lsvc_pcs_max_iter': 2000}. Best is trial 12 with value: 0.973103.
Trial 20 finished with value: 0.9754393716466747 and parameters: {'lsvc_pcs_kernel_gamma': 0.12767406172791018, 'lsvc_pcs_kernel_n_components': 150, 'lsvc_pcs_degree': 2, 'lsvc_pcs_dual': False, 'lsvc_pcs_C': 0.06431514819898762, 'lsvc_pcs_max_iter': 2000}. Best is trial 20 with value: 0.975439.
Trial 21 finished with value: 0.9089506001120561 and parameters: {'lsvc_pcs_kernel_gamma': 0.0629625950712345, 'lsvc_pcs_kernel_n_components': 150, 'lsvc_pcs_degree': 2, 'lsvc_pcs_dual': False, 'lsvc_pcs_C': 0.08893502964919953, 'lsvc_pcs_max_iter': 2000}. Best is trial 20 with value: 0.975439.
A new study created in RDB with name: LinearSVC_RBFSampler_59d7b7e2
Trial 0 finished with value: 0.2844441188051378 and parameters: {'lsvc_rbfs_kernel_gamma': 1.9966684055444344, 'lsvc_rbfs_kernel_n_components': 100, 'lsvc_rbfs_dual': False, 'lsvc_rbfs_C': 12.703408471505547, 'lsvc_rbfs_max_iter': 2000}. Best is trial 0 with value: 0.284444.
Trial 1 finished with value: 0.2844441188051378 and parameters: {'lsvc_rbfs_kernel_gamma': 0.013158757160423397, 'lsvc_rbfs_kernel_n_components': 100, 'lsvc_rbfs_dual': False, 'lsvc_rbfs_C': 38.26311008514177, 'lsvc_rbfs_max_iter': 2000}. Best is trial 0 with value: 0.284444.
Trial 2 finished with value: 0.2844441188051378 and parameters: {'lsvc_rbfs_kernel_gamma': 29.685279005719, 'lsvc_rbfs_kernel_n_components': 50, 'lsvc_rbfs_dual': False, 'lsvc_rbfs_C': 0.0013157907182020482, 'lsvc_rbfs_max_iter': 2000}. Best is trial 0 with value: 0.284444.
Trial 3 finished with value: 0.2844441188051378 and parameters: {'lsvc_rbfs_kernel_gamma': 69.93575013914548, 'lsvc_rbfs_kernel_n_components': 150, 'lsvc_rbfs_dual': False, 'lsvc_rbfs_C': 0.008658987852000479, 'lsvc_rbfs_max_iter': 2000}. Best is trial 0 with value: 0.284444.
Trial 4 finished with value: 0.2844441188051378 and parameters: {'lsvc_rbfs_kernel_gamma': 422.027046991433, 'lsvc_rbfs_kernel_n_components': 150, 'lsvc_rbfs_dual': False, 'lsvc_rbfs_C': 7.316103150081251e-05, 'lsvc_rbfs_max_iter': 2000}. Best is trial 0 with value: 0.284444.
Trial 5 finished with value: 0.2844441188051378 and parameters: {'lsvc_rbfs_kernel_gamma': 120.11015078672439, 'lsvc_rbfs_kernel_n_components': 50, 'lsvc_rbfs_dual': False, 'lsvc_rbfs_C': 2.9788055930929204e-06, 'lsvc_rbfs_max_iter': 2000}. Best is trial 0 with value: 0.284444.
Trial 6 finished with value: 0.2844441188051378 and parameters: {'lsvc_rbfs_kernel_gamma': 309.2803538599943, 'lsvc_rbfs_kernel_n_components': 150, 'lsvc_rbfs_dual': False, 'lsvc_rbfs_C': 0.0010952781521220921, 'lsvc_rbfs_max_iter': 2000}. Best is trial 0 with value: 0.284444.
Trial 7 finished with value: 0.2844441188051378 and parameters: {'lsvc_rbfs_kernel_gamma': 0.0013352583510614403, 'lsvc_rbfs_kernel_n_components': 150, 'lsvc_rbfs_dual': False, 'lsvc_rbfs_C': 0.3048003947478405, 'lsvc_rbfs_max_iter': 2000}. Best is trial 0 with value: 0.284444.
Trial 8 finished with value: 0.2844441188051378 and parameters: {'lsvc_rbfs_kernel_gamma': 0.025730020835463222, 'lsvc_rbfs_kernel_n_components': 100, 'lsvc_rbfs_dual': False, 'lsvc_rbfs_C': 1.37016264558332, 'lsvc_rbfs_max_iter': 2000}. Best is trial 0 with value: 0.284444.
Trial 9 finished with value: 0.2844441188051378 and parameters: {'lsvc_rbfs_kernel_gamma': 0.0012635745874070917, 'lsvc_rbfs_kernel_n_components': 150, 'lsvc_rbfs_dual': False, 'lsvc_rbfs_C': 6.307992444847783, 'lsvc_rbfs_max_iter': 2000}. Best is trial 0 with value: 0.284444.
Trial 10 finished with value: 0.2844441188051378 and parameters: {'lsvc_rbfs_kernel_gamma': 2.43958503165823, 'lsvc_rbfs_kernel_n_components': 100, 'lsvc_rbfs_dual': False, 'lsvc_rbfs_C': 688.4569472434314, 'lsvc_rbfs_max_iter': 2000}. Best is trial 0 with value: 0.284444.
Trial 11 finished with value: 0.2844441188051378 and parameters: {'lsvc_rbfs_kernel_gamma': 0.16574449900450974, 'lsvc_rbfs_kernel_n_components': 100, 'lsvc_rbfs_dual': False, 'lsvc_rbfs_C': 237.45396353917621, 'lsvc_rbfs_max_iter': 2000}. Best is trial 0 with value: 0.284444.
Trial 12 finished with value: 0.2844441188051378 and parameters: {'lsvc_rbfs_kernel_gamma': 2.3677197676176047, 'lsvc_rbfs_kernel_n_components': 100, 'lsvc_rbfs_dual': False, 'lsvc_rbfs_C': 17.919876827617244, 'lsvc_rbfs_max_iter': 2000}. Best is trial 0 with value: 0.284444.
Trial 13 finished with value: 0.2844441188051378 and parameters: {'lsvc_rbfs_kernel_gamma': 0.043672714662197215, 'lsvc_rbfs_kernel_n_components': 50, 'lsvc_rbfs_dual': False, 'lsvc_rbfs_C': 38.09396419262198, 'lsvc_rbfs_max_iter': 2000}. Best is trial 0 with value: 0.284444.
Trial 14 finished with value: 0.2844441188051378 and parameters: {'lsvc_rbfs_kernel_gamma': 0.39865896175047494, 'lsvc_rbfs_kernel_n_components': 100, 'lsvc_rbfs_dual': False, 'lsvc_rbfs_C': 0.19894111104679954, 'lsvc_rbfs_max_iter': 2000}. Best is trial 0 with value: 0.284444.
Trial 15 finished with value: 0.2844441188051378 and parameters: {'lsvc_rbfs_kernel_gamma': 10.557445823076653, 'lsvc_rbfs_kernel_n_components': 100, 'lsvc_rbfs_dual': False, 'lsvc_rbfs_C': 37.318541243316744, 'lsvc_rbfs_max_iter': 2000}. Best is trial 0 with value: 0.284444.
Trial 16 finished with value: 0.2844441188051378 and parameters: {'lsvc_rbfs_kernel_gamma': 0.008910854107976261, 'lsvc_rbfs_kernel_n_components': 50, 'lsvc_rbfs_dual': False, 'lsvc_rbfs_C': 0.03920356765703065, 'lsvc_rbfs_max_iter': 2000}. Best is trial 0 with value: 0.284444.
Trial 17 finished with value: 0.2844441188051378 and parameters: {'lsvc_rbfs_kernel_gamma': 0.30356815880762705, 'lsvc_rbfs_kernel_n_components': 100, 'lsvc_rbfs_dual': False, 'lsvc_rbfs_C': 0.2173773011844713, 'lsvc_rbfs_max_iter': 2000}. Best is trial 0 with value: 0.284444.
Trial 18 finished with value: 0.2844441188051378 and parameters: {'lsvc_rbfs_kernel_gamma': 10.927355309961305, 'lsvc_rbfs_kernel_n_components': 100, 'lsvc_rbfs_dual': False, 'lsvc_rbfs_C': 179.84875450343156, 'lsvc_rbfs_max_iter': 2000}. Best is trial 0 with value: 0.284444.
Trial 19 finished with value: 0.2844441188051378 and parameters: {'lsvc_rbfs_kernel_gamma': 0.0058584594318759195, 'lsvc_rbfs_kernel_n_components': 50, 'lsvc_rbfs_dual': False, 'lsvc_rbfs_C': 1.6425176654740652, 'lsvc_rbfs_max_iter': 2000}. Best is trial 0 with value: 0.284444.
Trial 20 finished with value: 0.2844441188051378 and parameters: {'lsvc_rbfs_kernel_gamma': 0.21649539905309273, 'lsvc_rbfs_kernel_n_components': 100, 'lsvc_rbfs_dual': False, 'lsvc_rbfs_C': 0.01375993734685989, 'lsvc_rbfs_max_iter': 2000}. Best is trial 0 with value: 0.284444.
Trial 21 finished with value: 0.2844441188051378 and parameters: {'lsvc_rbfs_kernel_gamma': 3.5050700486348787, 'lsvc_rbfs_kernel_n_components': 100, 'lsvc_rbfs_dual': False, 'lsvc_rbfs_C': 243.72405680765087, 'lsvc_rbfs_max_iter': 2000}. Best is trial 0 with value: 0.284444.
A new study created in RDB with name: MLPClassifier_59d7b7e2
sklearn.model_selection.train_test_split: running accelerated version on CPU
sklearn.model_selection.train_test_split: fallback to original Scikit-learn
sklearn.model_selection.train_test_split: running accelerated version on CPU
sklearn.model_selection.train_test_split: fallback to original Scikit-learn
sklearn.model_selection.train_test_split: running accelerated version on CPU
sklearn.model_selection.train_test_split: fallback to original Scikit-learn
sklearn.model_selection.train_test_split: running accelerated version on CPU
sklearn.model_selection.train_test_split: fallback to original Scikit-learn
sklearn.model_selection.train_test_split: running accelerated version on CPU
sklearn.model_selection.train_test_split: running accelerated version on CPU
sklearn.model_selection.train_test_split: running accelerated version on CPU
sklearn.model_selection.train_test_split: fallback to original Scikit-learn
sklearn.model_selection.train_test_split: fallback to original Scikit-learn
sklearn.model_selection.train_test_split: fallback to original Scikit-learn
sklearn.model_selection.train_test_split: running accelerated version on CPU
sklearn.model_selection.train_test_split: fallback to original Scikit-learn
Trial 4 finished with value: 0.8584510632743709 and parameters: {'mlpc_hidden_layer_count': 1, 'mlpc_learning_rate': 'adaptive', 'mlpc_learning_rate_init': 0.018131147534054, 'mplc_max_iter': 2000}. Best is trial 4 with value: 0.858451.
sklearn.model_selection.train_test_split: running accelerated version on CPU
sklearn.model_selection.train_test_split: fallback to original Scikit-learn
Trial 5 finished with value: 0.2844441188051378 and parameters: {'mlpc_hidden_layer_count': 1, 'mlpc_learning_rate': 'adaptive', 'mlpc_learning_rate_init': 0.3665909193823299, 'mplc_max_iter': 2000}. Best is trial 4 with value: 0.858451.
sklearn.model_selection.train_test_split: running accelerated version on CPU
sklearn.model_selection.train_test_split: fallback to original Scikit-learn
Trial 6 finished with value: 0.2844441188051378 and parameters: {'mlpc_hidden_layer_count': 1, 'mlpc_learning_rate': 'constant', 'mlpc_learning_rate_init': 0.1344629442429478, 'mplc_max_iter': 2000}. Best is trial 4 with value: 0.858451.
sklearn.model_selection.train_test_split: running accelerated version on CPU
sklearn.model_selection.train_test_split: fallback to original Scikit-learn
Trial 2 finished with value: 0.9905350078576282 and parameters: {'mlpc_hidden_layer_count': 1, 'mlpc_learning_rate': 'constant', 'mlpc_learning_rate_init': 1.2300452417545185e-05, 'mplc_max_iter': 2000}. Best is trial 2 with value: 0.990535.
sklearn.model_selection.train_test_split: running accelerated version on CPU
sklearn.model_selection.train_test_split: fallback to original Scikit-learn
Trial 9 finished with value: 0.7179557142977616 and parameters: {'mlpc_hidden_layer_count': 2, 'mlpc_learning_rate': 'constant', 'mlpc_learning_rate_init': 0.0023336621063409653, 'mplc_max_iter': 2000}. Best is trial 2 with value: 0.990535.
sklearn.model_selection.train_test_split: running accelerated version on CPU
sklearn.model_selection.train_test_split: fallback to original Scikit-learn
Trial 3 finished with value: 0.2844441188051378 and parameters: {'mlpc_hidden_layer_count': 3, 'mlpc_learning_rate': 'invscaling', 'mlpc_learning_rate_init': 0.4380472851349647, 'mplc_max_iter': 2000}. Best is trial 2 with value: 0.990535.
sklearn.model_selection.train_test_split: running accelerated version on CPU
sklearn.model_selection.train_test_split: fallback to original Scikit-learn
Trial 0 finished with value: 0.8184706626763758 and parameters: {'mlpc_hidden_layer_count': 3, 'mlpc_learning_rate': 'adaptive', 'mlpc_learning_rate_init': 0.0011409968973461315, 'mplc_max_iter': 2000}. Best is trial 2 with value: 0.990535.
sklearn.model_selection.train_test_split: running accelerated version on CPU
sklearn.model_selection.train_test_split: fallback to original Scikit-learn
Trial 1 finished with value: 0.9897614517234862 and parameters: {'mlpc_hidden_layer_count': 1, 'mlpc_learning_rate': 'invscaling', 'mlpc_learning_rate_init': 3.4018851377744776e-06, 'mplc_max_iter': 2000}. Best is trial 2 with value: 0.990535.
sklearn.model_selection.train_test_split: running accelerated version on CPU
sklearn.model_selection.train_test_split: fallback to original Scikit-learn
Trial 13 finished with value: 0.9880305923634942 and parameters: {'mlpc_hidden_layer_count': 1, 'mlpc_learning_rate': 'adaptive', 'mlpc_learning_rate_init': 0.0008925971487293495, 'mplc_max_iter': 2000}. Best is trial 2 with value: 0.990535.
sklearn.model_selection.train_test_split: running accelerated version on CPU
sklearn.model_selection.train_test_split: fallback to original Scikit-learn
Trial 14 finished with value: 0.4656965210025522 and parameters: {'mlpc_hidden_layer_count': 2, 'mlpc_learning_rate': 'invscaling', 'mlpc_learning_rate_init': 0.0038520780774544787, 'mplc_max_iter': 2000}. Best is trial 2 with value: 0.990535.
sklearn.model_selection.train_test_split: running accelerated version on CPU
sklearn.model_selection.train_test_split: fallback to original Scikit-learn
Trial 8 finished with value: 0.9387470926008341 and parameters: {'mlpc_hidden_layer_count': 3, 'mlpc_learning_rate': 'adaptive', 'mlpc_learning_rate_init': 4.4097363635060155e-05, 'mplc_max_iter': 2000}. Best is trial 2 with value: 0.990535.
sklearn.model_selection.train_test_split: running accelerated version on CPU
sklearn.model_selection.train_test_split: fallback to original Scikit-learn
Trial 11 finished with value: 0.2844441188051378 and parameters: {'mlpc_hidden_layer_count': 3, 'mlpc_learning_rate': 'adaptive', 'mlpc_learning_rate_init': 0.5517403472613582, 'mplc_max_iter': 2000}. Best is trial 2 with value: 0.990535.
sklearn.model_selection.train_test_split: running accelerated version on CPU
sklearn.model_selection.train_test_split: fallback to original Scikit-learn
Trial 7 finished with value: 0.9886826660233007 and parameters: {'mlpc_hidden_layer_count': 2, 'mlpc_learning_rate': 'constant', 'mlpc_learning_rate_init': 0.00036712175763060087, 'mplc_max_iter': 2000}. Best is trial 2 with value: 0.990535.
sklearn.model_selection.train_test_split: running accelerated version on CPU
sklearn.model_selection.train_test_split: fallback to original Scikit-learn
Trial 12 finished with value: 0.430567788009028 and parameters: {'mlpc_hidden_layer_count': 3, 'mlpc_learning_rate': 'adaptive', 'mlpc_learning_rate_init': 0.008353552000622398, 'mplc_max_iter': 2000}. Best is trial 2 with value: 0.990535.
sklearn.model_selection.train_test_split: running accelerated version on CPU
sklearn.model_selection.train_test_split: fallback to original Scikit-learn
Trial 10 finished with value: 0.9879874341470888 and parameters: {'mlpc_hidden_layer_count': 2, 'mlpc_learning_rate': 'adaptive', 'mlpc_learning_rate_init': 4.8798277892082254e-06, 'mplc_max_iter': 2000}. Best is trial 2 with value: 0.990535.
sklearn.model_selection.train_test_split: running accelerated version on CPU
sklearn.model_selection.train_test_split: fallback to original Scikit-learn
Trial 18 finished with value: 0.9262250548808135 and parameters: {'mlpc_hidden_layer_count': 2, 'mlpc_learning_rate': 'constant', 'mlpc_learning_rate_init': 1.1756206272028735e-06, 'mplc_max_iter': 2000}. Best is trial 2 with value: 0.990535.
sklearn.model_selection.train_test_split: running accelerated version on CPU
sklearn.model_selection.train_test_split: fallback to original Scikit-learn
Trial 23 finished with value: 0.9900575532843043 and parameters: {'mlpc_hidden_layer_count': 1, 'mlpc_learning_rate': 'invscaling', 'mlpc_learning_rate_init': 4.440993333145248e-05, 'mplc_max_iter': 2000}. Best is trial 2 with value: 0.990535.
sklearn.model_selection.train_test_split: running accelerated version on CPU
sklearn.model_selection.train_test_split: fallback to original Scikit-learn
Trial 20 finished with value: 0.9891242020479194 and parameters: {'mlpc_hidden_layer_count': 1, 'mlpc_learning_rate': 'invscaling', 'mlpc_learning_rate_init': 2.5620572702285225e-06, 'mplc_max_iter': 2000}. Best is trial 2 with value: 0.990535.
sklearn.model_selection.train_test_split: running accelerated version on CPU
sklearn.model_selection.train_test_split: fallback to original Scikit-learn
Trial 19 finished with value: 0.9879350398567694 and parameters: {'mlpc_hidden_layer_count': 2, 'mlpc_learning_rate': 'constant', 'mlpc_learning_rate_init': 4.263191250293113e-06, 'mplc_max_iter': 2000}. Best is trial 2 with value: 0.990535.
sklearn.model_selection.train_test_split: running accelerated version on CPU
sklearn.model_selection.train_test_split: fallback to original Scikit-learn
Trial 17 finished with value: 0.9877070587862272 and parameters: {'mlpc_hidden_layer_count': 2, 'mlpc_learning_rate': 'constant', 'mlpc_learning_rate_init': 3.59830576660108e-06, 'mplc_max_iter': 2000}. Best is trial 2 with value: 0.990535.
sklearn.model_selection.train_test_split: running accelerated version on CPU
sklearn.model_selection.train_test_split: fallback to original Scikit-learn
Trial 22 finished with value: 0.9850978501236677 and parameters: {'mlpc_hidden_layer_count': 1, 'mlpc_learning_rate': 'invscaling', 'mlpc_learning_rate_init': 1.6614074217468148e-06, 'mplc_max_iter': 2000}. Best is trial 2 with value: 0.990535.
sklearn.model_selection.train_test_split: running accelerated version on CPU
sklearn.model_selection.train_test_split: fallback to original Scikit-learn
Trial 21 finished with value: 0.9851710026869147 and parameters: {'mlpc_hidden_layer_count': 1, 'mlpc_learning_rate': 'invscaling', 'mlpc_learning_rate_init': 1.243426350458075e-06, 'mplc_max_iter': 2000}. Best is trial 2 with value: 0.990535.
Trial 24 finished with value: 0.9897923828967254 and parameters: {'mlpc_hidden_layer_count': 1, 'mlpc_learning_rate': 'invscaling', 'mlpc_learning_rate_init': 6.193129180273982e-05, 'mplc_max_iter': 2000}. Best is trial 2 with value: 0.990535.
Trial 26 finished with value: 0.9866852353838464 and parameters: {'mlpc_hidden_layer_count': 1, 'mlpc_learning_rate': 'invscaling', 'mlpc_learning_rate_init': 4.410896713133335e-05, 'mplc_max_iter': 2000}. Best is trial 2 with value: 0.990535.
Trial 28 finished with value: 0.9817762060909159 and parameters: {'mlpc_hidden_layer_count': 1, 'mlpc_learning_rate': 'invscaling', 'mlpc_learning_rate_init': 3.561211977465757e-05, 'mplc_max_iter': 2000}. Best is trial 2 with value: 0.990535.
Trial 27 finished with value: 0.9849453113298131 and parameters: {'mlpc_hidden_layer_count': 1, 'mlpc_learning_rate': 'invscaling', 'mlpc_learning_rate_init': 4.880819994741552e-05, 'mplc_max_iter': 2000}. Best is trial 2 with value: 0.990535.
Trial 25 finished with value: 0.9906253303184642 and parameters: {'mlpc_hidden_layer_count': 1, 'mlpc_learning_rate': 'invscaling', 'mlpc_learning_rate_init': 3.0004780971187198e-05, 'mplc_max_iter': 2000}. Best is trial 25 with value: 0.990625.
Trial 15 finished with value: 0.9885740747580196 and parameters: {'mlpc_hidden_layer_count': 3, 'mlpc_learning_rate': 'constant', 'mlpc_learning_rate_init': 2.347197829999146e-06, 'mplc_max_iter': 2000}. Best is trial 25 with value: 0.990625.
Trial 16 finished with value: 0.9888571577321138 and parameters: {'mlpc_hidden_layer_count': 3, 'mlpc_learning_rate': 'invscaling', 'mlpc_learning_rate_init': 7.889579711787779e-05, 'mplc_max_iter': 2000}. Best is trial 25 with value: 0.990625.
A new study created in RDB with name: MultinomialNB_59d7b7e2
Trial 3 finished with value: 0.3841766551360142 and parameters: {'mnb_alpha': 0.8, 'mnb_fit_prior': True}. Best is trial 4 with value: 0.384211.
Trial 4 finished with value: 0.3841998140289928 and parameters: {'mnb_alpha': 0.30000000000000004, 'mnb_fit_prior': False}. Best is trial 4 with value: 0.384211.
Trial 1 finished with value: 0.3841766551360142 and parameters: {'mnb_alpha': 1.0, 'mnb_fit_prior': True}. Best is trial 4 with value: 0.384211.
Trial 5 finished with value: 0.38421133911073435 and parameters: {'mnb_alpha': 0.1, 'mnb_fit_prior': False}. Best is trial 5 with value: 0.384844.
