A new study created in RDB with name: AdaBoostClassifier_59d7b7e2
Trial 1 finished with value: 0.5830927546766471 and parameters: {'abc_n_estimators': 25, 'abc_learning_rate': 0.0004209337870035769}. Best is trial 1 with value: 0.583093.
Trial 4 finished with value: 0.5830927546766471 and parameters: {'abc_n_estimators': 50, 'abc_learning_rate': 2.5695628955134164e-06}. Best is trial 1 with value: 0.583093.
Trial 5 finished with value: 0.5830927546766471 and parameters: {'abc_n_estimators': 50, 'abc_learning_rate': 0.00012117826235296942}. Best is trial 1 with value: 0.583093.
Trial 3 finished with value: 0.7581185821475852 and parameters: {'abc_n_estimators': 55, 'abc_learning_rate': 0.04670162227470618}. Best is trial 3 with value: 0.758119.
Trial 0 finished with value: 0.5830927546766471 and parameters: {'abc_n_estimators': 75, 'abc_learning_rate': 3.426700051266045e-05}. Best is trial 3 with value: 0.758119.
Trial 10 finished with value: 0.5830927546766471 and parameters: {'abc_n_estimators': 25, 'abc_learning_rate': 0.00042093020885969806}. Best is trial 3 with value: 0.758119.
Trial 2 finished with value: 0.5830927546766471 and parameters: {'abc_n_estimators': 80, 'abc_learning_rate': 0.0009222558716422043}. Best is trial 3 with value: 0.758119.
Trial 7 finished with value: 0.7581185821475852 and parameters: {'abc_n_estimators': 85, 'abc_learning_rate': 0.038119140508221516}. Best is trial 3 with value: 0.758119.
Trial 6 finished with value: 0.7083154749910884 and parameters: {'abc_n_estimators': 90, 'abc_learning_rate': 0.061409546618960316}. Best is trial 3 with value: 0.758119.
Trial 9 finished with value: 0.5830927546766471 and parameters: {'abc_n_estimators': 40, 'abc_learning_rate': 0.00029903723575426473}. Best is trial 3 with value: 0.758119.
Trial 11 finished with value: 0.7128750257008201 and parameters: {'abc_n_estimators': 55, 'abc_learning_rate': 0.06859649538543972}. Best is trial 3 with value: 0.758119.
Trial 8 finished with value: 0.5830927546766471 and parameters: {'abc_n_estimators': 95, 'abc_learning_rate': 2.44216139843799e-06}. Best is trial 3 with value: 0.758119.
Trial 14 finished with value: 0.5830927546766471 and parameters: {'abc_n_estimators': 40, 'abc_learning_rate': 0.0016291696477505045}. Best is trial 3 with value: 0.758119.
Trial 12 finished with value: 0.7266493841638412 and parameters: {'abc_n_estimators': 55, 'abc_learning_rate': 0.03103517232482921}. Best is trial 3 with value: 0.758119.
Trial 15 finished with value: 0.5830927546766471 and parameters: {'abc_n_estimators': 65, 'abc_learning_rate': 2.358581337336305e-05}. Best is trial 3 with value: 0.758119.
Trial 17 finished with value: 0.6924464027420278 and parameters: {'abc_n_estimators': 65, 'abc_learning_rate': 0.836921820418286}. Best is trial 3 with value: 0.758119.
Trial 16 finished with value: 0.7246034468560911 and parameters: {'abc_n_estimators': 65, 'abc_learning_rate': 0.9331420544607666}. Best is trial 3 with value: 0.758119.
Trial 13 finished with value: 0.6780904586700144 and parameters: {'abc_n_estimators': 85, 'abc_learning_rate': 0.8462870927630504}. Best is trial 3 with value: 0.758119.
Trial 18 finished with value: 0.6924953909770776 and parameters: {'abc_n_estimators': 70, 'abc_learning_rate': 0.8606506166826263}. Best is trial 3 with value: 0.758119.
Trial 19 finished with value: 0.7151140653826701 and parameters: {'abc_n_estimators': 70, 'abc_learning_rate': 0.5604274367361648}. Best is trial 3 with value: 0.758119.
Trial 20 finished with value: 0.7108787416219234 and parameters: {'abc_n_estimators': 70, 'abc_learning_rate': 0.5333392113458099}. Best is trial 3 with value: 0.758119.
Trial 21 finished with value: 0.6927055441205004 and parameters: {'abc_n_estimators': 70, 'abc_learning_rate': 0.8184310943723374}. Best is trial 3 with value: 0.758119.
Trial 22 finished with value: 0.6924953909770776 and parameters: {'abc_n_estimators': 70, 'abc_learning_rate': 0.8666294102300633}. Best is trial 3 with value: 0.758119.
Trial 24 finished with value: 0.6743506838844658 and parameters: {'abc_n_estimators': 80, 'abc_learning_rate': 0.0055402470215411715}. Best is trial 3 with value: 0.758119.
Trial 23 finished with value: 0.6767177643424716 and parameters: {'abc_n_estimators': 100, 'abc_learning_rate': 0.0064729303834549804}. Best is trial 3 with value: 0.758119.
Trial 25 finished with value: 0.6767177643424716 and parameters: {'abc_n_estimators': 100, 'abc_learning_rate': 0.0067526301184393156}. Best is trial 3 with value: 0.758119.
Trial 26 finished with value: 0.7265383302838903 and parameters: {'abc_n_estimators': 100, 'abc_learning_rate': 0.00831362004410092}. Best is trial 3 with value: 0.758119.
Trial 27 finished with value: 0.6767177643424716 and parameters: {'abc_n_estimators': 100, 'abc_learning_rate': 0.006718830566342345}. Best is trial 3 with value: 0.758119.
Trial 28 finished with value: 0.7266493841638412 and parameters: {'abc_n_estimators': 100, 'abc_learning_rate': 0.012618508451702558}. Best is trial 3 with value: 0.758119.
A new study created in RDB with name: AdaGradClassifier_59d7b7e2
Trial 2 finished with value: 0.2774964960882568 and parameters: {'agc_alpha': 132.53853121197042, 'agc_l1_ratio': 0.1, 'agc_loss': 'smooth_hinge'}. Best is trial 0 with value: 0.845375.
Trial 3 finished with value: 0.73459940022966 and parameters: {'agc_alpha': 0.16473475243015065, 'agc_l1_ratio': 1.0, 'agc_loss': 'log'}. Best is trial 1 with value: 0.845375.
Trial 7 finished with value: 0.46223335688743306 and parameters: {'agc_alpha': 38.143006387598994, 'agc_l1_ratio': 0.4, 'agc_loss': 'squared_hinge'}. Best is trial 3 with value: 0.845375.
Trial 1 finished with value: 0.8453745273756506 and parameters: {'agc_alpha': 0.007354233847024975, 'agc_l1_ratio': 1.0, 'agc_loss': 'perceptron'}. Best is trial 1 with value: 0.845375.
Trial 6 finished with value: 0.5193280868525757 and parameters: {'agc_alpha': 8.023531836142613, 'agc_l1_ratio': 0.2, 'agc_loss': 'log'}. Best is trial 1 with value: 0.845375.
Trial 5 finished with value: 0.7049071114366285 and parameters: {'agc_alpha': 1.4308918560277566, 'agc_l1_ratio': 0.7000000000000001, 'agc_loss': 'hinge'}. Best is trial 1 with value: 0.845375.
Trial 0 finished with value: 0.42787321355154223 and parameters: {'agc_alpha': 26.861873522515697, 'agc_l1_ratio': 0.30000000000000004, 'agc_loss': 'perceptron'}. Best is trial 1 with value: 0.845375.
Trial 4 finished with value: 0.7783774610074211 and parameters: {'agc_alpha': 0.020999170236052685, 'agc_l1_ratio': 0.7000000000000001, 'agc_loss': 'log'}. Best is trial 1 with value: 0.845375.
Trial 13 finished with value: 0.4209144640631822 and parameters: {'agc_alpha': 473.6652348963254, 'agc_l1_ratio': 0.30000000000000004, 'agc_loss': 'hinge'}. Best is trial 1 with value: 0.845375.
Trial 15 finished with value: 0.606184125301282 and parameters: {'agc_alpha': 0.23327291379496076, 'agc_l1_ratio': 0.7000000000000001, 'agc_loss': 'log'}. Best is trial 1 with value: 0.845375.
Trial 14 finished with value: 0.5395819104125444 and parameters: {'agc_alpha': 60.05202546808644, 'agc_l1_ratio': 0.0, 'agc_loss': 'log'}. Best is trial 1 with value: 0.845375.
Trial 9 finished with value: 0.5419959403944312 and parameters: {'agc_alpha': 8.162213632634423, 'agc_l1_ratio': 0.1, 'agc_loss': 'squared'}. Best is trial 1 with value: 0.845375.
Trial 10 finished with value: 0.5258829254554455 and parameters: {'agc_alpha': 19.558078817197046, 'agc_l1_ratio': 0.0, 'agc_loss': 'smooth_hinge'}. Best is trial 1 with value: 0.845375.
Trial 11 finished with value: 0.5056862892119339 and parameters: {'agc_alpha': 0.8254022549810224, 'agc_l1_ratio': 0.6000000000000001, 'agc_loss': 'smooth_hinge'}. Best is trial 1 with value: 0.845375.
Trial 8 finished with value: 0.5487684103040746 and parameters: {'agc_alpha': 53.84135686978433, 'agc_l1_ratio': 0.1, 'agc_loss': 'squared_hinge'}. Best is trial 1 with value: 0.845375.
Trial 12 finished with value: 0.5407922416263918 and parameters: {'agc_alpha': 149.52819674598175, 'agc_l1_ratio': 0.0, 'agc_loss': 'hinge'}. Best is trial 1 with value: 0.845375.
Trial 19 finished with value: 0.949921528313887 and parameters: {'agc_alpha': 0.0022867230809450793, 'agc_l1_ratio': 1.0, 'agc_loss': 'modified_huber'}. Best is trial 20 with value: 0.951062.
Trial 20 finished with value: 0.9510617321130583 and parameters: {'agc_alpha': 0.00292407993837613, 'agc_l1_ratio': 1.0, 'agc_loss': 'modified_huber'}. Best is trial 20 with value: 0.951062.
Trial 17 finished with value: 0.9510554617468638 and parameters: {'agc_alpha': 0.0014863604888351854, 'agc_l1_ratio': 1.0, 'agc_loss': 'modified_huber'}. Best is trial 20 with value: 0.951062.
Trial 16 finished with value: 0.9510168308354098 and parameters: {'agc_alpha': 0.002845938455591657, 'agc_l1_ratio': 1.0, 'agc_loss': 'modified_huber'}. Best is trial 20 with value: 0.951062.
Trial 18 finished with value: 0.9371295945139895 and parameters: {'agc_alpha': 0.004546716079417484, 'agc_l1_ratio': 1.0, 'agc_loss': 'perceptron'}. Best is trial 20 with value: 0.951062.
Trial 21 finished with value: 0.9510535346760441 and parameters: {'agc_alpha': 0.001497426383800964, 'agc_l1_ratio': 1.0, 'agc_loss': 'modified_huber'}. Best is trial 20 with value: 0.951062.
A new study created in RDB with name: BalancedBaggingClassifier_59d7b7e2
Trial 4 finished with value: 0.885927619862536 and parameters: {'bbc_n_estimators': 16, 'bbc_max_features': 1, 'bbc_bootstrap': False, 'bbc_sampling_strategy': 'all'}. Best is trial 4 with value: 0.885928.
Trial 6 finished with value: 0.9916725144470336 and parameters: {'bbc_n_estimators': 10, 'bbc_max_features': 19, 'bbc_bootstrap': False, 'bbc_sampling_strategy': 'not minority'}. Best is trial 6 with value: 0.991673.
Trial 2 finished with value: 0.2844441188051378 and parameters: {'bbc_n_estimators': 16, 'bbc_max_features': 1, 'bbc_bootstrap': False, 'bbc_sampling_strategy': 'not majority'}. Best is trial 6 with value: 0.991673.
Trial 7 finished with value: 0.9090056472519392 and parameters: {'bbc_n_estimators': 9, 'bbc_max_features': 8, 'bbc_bootstrap': True, 'bbc_sampling_strategy': 'majority'}. Best is trial 6 with value: 0.991673.
Trial 10 finished with value: 0.9873483002524459 and parameters: {'bbc_n_estimators': 5, 'bbc_max_features': 14, 'bbc_bootstrap': False, 'bbc_sampling_strategy': 'not minority'}. Best is trial 6 with value: 0.991673.
Trial 3 finished with value: 0.9918273675409719 and parameters: {'bbc_n_estimators': 20, 'bbc_max_features': 18, 'bbc_bootstrap': False, 'bbc_sampling_strategy': 'all'}. Best is trial 3 with value: 0.991827.
Trial 1 finished with value: 0.9917629619391931 and parameters: {'bbc_n_estimators': 10, 'bbc_max_features': 27, 'bbc_bootstrap': False, 'bbc_sampling_strategy': 'not majority'}. Best is trial 3 with value: 0.991827.
Trial 0 finished with value: 0.9917337652729857 and parameters: {'bbc_n_estimators': 7, 'bbc_max_features': 48, 'bbc_bootstrap': True, 'bbc_sampling_strategy': 'majority'}. Best is trial 3 with value: 0.991827.
Trial 8 finished with value: 0.991595344519568 and parameters: {'bbc_n_estimators': 11, 'bbc_max_features': 50, 'bbc_bootstrap': False, 'bbc_sampling_strategy': 'all'}. Best is trial 3 with value: 0.991827.
Trial 5 finished with value: 0.991749644095513 and parameters: {'bbc_n_estimators': 10, 'bbc_max_features': 50, 'bbc_bootstrap': True, 'bbc_sampling_strategy': 'majority'}. Best is trial 3 with value: 0.991827.
Trial 15 finished with value: 0.9917641597764192 and parameters: {'bbc_n_estimators': 6, 'bbc_max_features': 31, 'bbc_bootstrap': False, 'bbc_sampling_strategy': 'majority'}. Best is trial 3 with value: 0.991827.
Trial 16 finished with value: 0.9914193619973658 and parameters: {'bbc_n_estimators': 11, 'bbc_max_features': 26, 'bbc_bootstrap': True, 'bbc_sampling_strategy': 'all'}. Best is trial 3 with value: 0.991827.
Trial 13 finished with value: 0.9915653206910514 and parameters: {'bbc_n_estimators': 10, 'bbc_max_features': 46, 'bbc_bootstrap': False, 'bbc_sampling_strategy': 'not majority'}. Best is trial 3 with value: 0.991827.
Trial 9 finished with value: 0.9916048233363969 and parameters: {'bbc_n_estimators': 15, 'bbc_max_features': 26, 'bbc_bootstrap': True, 'bbc_sampling_strategy': 'majority'}. Best is trial 3 with value: 0.991827.
Trial 12 finished with value: 0.9917937002869592 and parameters: {'bbc_n_estimators': 18, 'bbc_max_features': 22, 'bbc_bootstrap': True, 'bbc_sampling_strategy': 'not majority'}. Best is trial 3 with value: 0.991827.
Trial 17 finished with value: 0.9917804722624446 and parameters: {'bbc_n_estimators': 20, 'bbc_max_features': 34, 'bbc_bootstrap': False, 'bbc_sampling_strategy': 'all'}. Best is trial 3 with value: 0.991827.
Trial 14 finished with value: 0.9917947338403059 and parameters: {'bbc_n_estimators': 14, 'bbc_max_features': 50, 'bbc_bootstrap': False, 'bbc_sampling_strategy': 'majority'}. Best is trial 3 with value: 0.991827.
Trial 18 finished with value: 0.991780888906032 and parameters: {'bbc_n_estimators': 20, 'bbc_max_features': 33, 'bbc_bootstrap': False, 'bbc_sampling_strategy': 'all'}. Best is trial 3 with value: 0.991827.
Trial 19 finished with value: 0.9918262021070372 and parameters: {'bbc_n_estimators': 20, 'bbc_max_features': 35, 'bbc_bootstrap': False, 'bbc_sampling_strategy': 'all'}. Best is trial 3 with value: 0.991827.
Trial 20 finished with value: 0.9917804722624446 and parameters: {'bbc_n_estimators': 20, 'bbc_max_features': 34, 'bbc_bootstrap': False, 'bbc_sampling_strategy': 'all'}. Best is trial 3 with value: 0.991827.
Trial 21 finished with value: 0.991703685835406 and parameters: {'bbc_n_estimators': 20, 'bbc_max_features': 37, 'bbc_bootstrap': False, 'bbc_sampling_strategy': 'all'}. Best is trial 3 with value: 0.991827.
Trial 25 finished with value: 0.9885114161316635 and parameters: {'bbc_n_estimators': 14, 'bbc_max_features': 14, 'bbc_bootstrap': False, 'bbc_sampling_strategy': 'not minority'}. Best is trial 3 with value: 0.991827.
Trial 24 finished with value: 0.99144954743574 and parameters: {'bbc_n_estimators': 14, 'bbc_max_features': 40, 'bbc_bootstrap': False, 'bbc_sampling_strategy': 'all'}. Best is trial 3 with value: 0.991827.
Trial 11 finished with value: 0.9919231501212853 and parameters: {'bbc_n_estimators': 20, 'bbc_max_features': 49, 'bbc_bootstrap': True, 'bbc_sampling_strategy': 'not majority'}. Best is trial 11 with value: 0.991923.
Trial 26 finished with value: 0.991535824850795 and parameters: {'bbc_n_estimators': 18, 'bbc_max_features': 41, 'bbc_bootstrap': False, 'bbc_sampling_strategy': 'all'}. Best is trial 11 with value: 0.991923.
Trial 22 finished with value: 0.9916805787595872 and parameters: {'bbc_n_estimators': 20, 'bbc_max_features': 36, 'bbc_bootstrap': True, 'bbc_sampling_strategy': 'all'}. Best is trial 11 with value: 0.991923.
Trial 27 finished with value: 0.991535824850795 and parameters: {'bbc_n_estimators': 18, 'bbc_max_features': 41, 'bbc_bootstrap': False, 'bbc_sampling_strategy': 'all'}. Best is trial 11 with value: 0.991923.
Trial 28 finished with value: 0.991556939040297 and parameters: {'bbc_n_estimators': 18, 'bbc_max_features': 43, 'bbc_bootstrap': False, 'bbc_sampling_strategy': 'all'}. Best is trial 11 with value: 0.991923.
Trial 29 finished with value: 0.991535824850795 and parameters: {'bbc_n_estimators': 18, 'bbc_max_features': 41, 'bbc_bootstrap': False, 'bbc_sampling_strategy': 'all'}. Best is trial 11 with value: 0.991923.
Trial 23 finished with value: 0.9905114133225824 and parameters: {'bbc_n_estimators': 19, 'bbc_max_features': 18, 'bbc_bootstrap': True, 'bbc_sampling_strategy': 'not majority'}. Best is trial 11 with value: 0.991923.
A new study created in RDB with name: BalancedRandomForestClassifier_59d7b7e2
sklearn.ensemble.RandomForestClassifier.predict: fallback to original Scikit-learn
sklearn.ensemble.RandomForestClassifier.predict_proba: fallback to original Scikit-learn
Trial 2 finished with value: 0.9914122966829287 and parameters: {'brf_n_estimators': 100, 'brf_criterion': 'gini', 'brf_min_samples_split': 16, 'brf_min_samples_leaf': 14, 'brf_max_features': 13, 'brf_bootstrap': False}. Best is trial 2 with value: 0.991412.
sklearn.ensemble.RandomForestClassifier.predict: fallback to original Scikit-learn
sklearn.ensemble.RandomForestClassifier.predict_proba: fallback to original Scikit-learn
Trial 5 finished with value: 0.9910722734428393 and parameters: {'brf_n_estimators': 120, 'brf_criterion': 'entropy', 'brf_min_samples_split': 39, 'brf_min_samples_leaf': 34, 'brf_max_features': 38, 'brf_bootstrap': False}. Best is trial 2 with value: 0.991412.
sklearn.ensemble.RandomForestClassifier.predict: fallback to original Scikit-learn
sklearn.ensemble.RandomForestClassifier.predict_proba: fallback to original Scikit-learn
sklearn.ensemble.RandomForestClassifier.predict: fallback to original Scikit-learn
sklearn.ensemble.RandomForestClassifier.predict_proba: fallback to original Scikit-learn
Trial 6 finished with value: 0.9913357530227156 and parameters: {'brf_n_estimators': 150, 'brf_criterion': 'entropy', 'brf_min_samples_split': 24, 'brf_min_samples_leaf': 42, 'brf_max_features': 11, 'brf_bootstrap': False}. Best is trial 2 with value: 0.991412.
sklearn.ensemble.RandomForestClassifier.predict: fallback to original Scikit-learn
sklearn.ensemble.RandomForestClassifier.predict_proba: fallback to original Scikit-learn
Trial 1 finished with value: 0.9913365565853814 and parameters: {'brf_n_estimators': 150, 'brf_criterion': 'gini', 'brf_min_samples_split': 11, 'brf_min_samples_leaf': 38, 'brf_max_features': 21, 'brf_bootstrap': True}. Best is trial 2 with value: 0.991412.
sklearn.ensemble.RandomForestClassifier.predict: fallback to original Scikit-learn
sklearn.ensemble.RandomForestClassifier.predict_proba: fallback to original Scikit-learn
sklearn.ensemble.RandomForestClassifier.predict: fallback to original Scikit-learn
sklearn.ensemble.RandomForestClassifier.predict_proba: fallback to original Scikit-learn
Trial 8 finished with value: 0.9917142535658294 and parameters: {'brf_n_estimators': 50, 'brf_criterion': 'entropy', 'brf_min_samples_split': 16, 'brf_min_samples_leaf': 4, 'brf_max_features': 44, 'brf_bootstrap': False}. Best is trial 8 with value: 0.991714.
Trial 7 finished with value: 0.9914804821398658 and parameters: {'brf_n_estimators': 180, 'brf_criterion': 'entropy', 'brf_min_samples_split': 2, 'brf_min_samples_leaf': 12, 'brf_max_features': 2, 'brf_bootstrap': False}. Best is trial 8 with value: 0.991714.
sklearn.ensemble.RandomForestClassifier.predict: fallback to original Scikit-learn
sklearn.ensemble.RandomForestClassifier.predict_proba: fallback to original Scikit-learn
Trial 3 finished with value: 0.9910736336640981 and parameters: {'brf_n_estimators': 150, 'brf_criterion': 'entropy', 'brf_min_samples_split': 4, 'brf_min_samples_leaf': 35, 'brf_max_features': 49, 'brf_bootstrap': False}. Best is trial 8 with value: 0.991714.
Trial 0 finished with value: 0.9914992780884878 and parameters: {'brf_n_estimators': 180, 'brf_criterion': 'gini', 'brf_min_samples_split': 50, 'brf_min_samples_leaf': 36, 'brf_max_features': 28, 'brf_bootstrap': True}. Best is trial 8 with value: 0.991714.
sklearn.ensemble.RandomForestClassifier.predict: fallback to original Scikit-learn
sklearn.ensemble.RandomForestClassifier.predict_proba: fallback to original Scikit-learn
Trial 4 finished with value: 0.9915815916142294 and parameters: {'brf_n_estimators': 190, 'brf_criterion': 'entropy', 'brf_min_samples_split': 34, 'brf_min_samples_leaf': 11, 'brf_max_features': 35, 'brf_bootstrap': False}. Best is trial 8 with value: 0.991714.
sklearn.ensemble.RandomForestClassifier.predict: fallback to original Scikit-learn
sklearn.ensemble.RandomForestClassifier.predict_proba: fallback to original Scikit-learn
sklearn.ensemble.RandomForestClassifier.predict: fallback to original Scikit-learn
sklearn.ensemble.RandomForestClassifier.predict_proba: fallback to original Scikit-learn
sklearn.ensemble.RandomForestClassifier.predict: fallback to original Scikit-learn
sklearn.ensemble.RandomForestClassifier.predict_proba: fallback to original Scikit-learn
Trial 12 finished with value: 0.9914439991748533 and parameters: {'brf_n_estimators': 50, 'brf_criterion': 'gini', 'brf_min_samples_split': 9, 'brf_min_samples_leaf': 20, 'brf_max_features': 20, 'brf_bootstrap': False}. Best is trial 8 with value: 0.991714.
Trial 9 finished with value: 0.9914364796006163 and parameters: {'brf_n_estimators': 80, 'brf_criterion': 'gini', 'brf_min_samples_split': 6, 'brf_min_samples_leaf': 39, 'brf_max_features': 31, 'brf_bootstrap': False}. Best is trial 8 with value: 0.991714.
Trial 13 finished with value: 0.9917756291396801 and parameters: {'brf_n_estimators': 50, 'brf_criterion': 'gini', 'brf_min_samples_split': 7, 'brf_min_samples_leaf': 4, 'brf_max_features': 33, 'brf_bootstrap': True}. Best is trial 13 with value: 0.991776.
sklearn.ensemble.RandomForestClassifier.predict: fallback to original Scikit-learn
sklearn.ensemble.RandomForestClassifier.predict_proba: fallback to original Scikit-learn
sklearn.ensemble.RandomForestClassifier.predict: fallback to original Scikit-learn
sklearn.ensemble.RandomForestClassifier.predict_proba: fallback to original Scikit-learn
Trial 17 finished with value: 0.9916092689551289 and parameters: {'brf_n_estimators': 50, 'brf_criterion': 'entropy', 'brf_min_samples_split': 24, 'brf_min_samples_leaf': 1, 'brf_max_features': 49, 'brf_bootstrap': True}. Best is trial 13 with value: 0.991776.
