Trial 21 finished with value: 0.8902004936721672 and parameters: {'qda_reg_param': 0.6000000000000001, 'qda_tol': 0.0006360223160634938}. Best is trial 18 with value: 0.907471.
A new study created in RDB with name: RandomForestClassifier_59d7b7e2
sklearn.ensemble.RandomForestClassifier.fit: fallback to original Scikit-learn
sklearn.ensemble.RandomForestClassifier.fit: running accelerated version on CPU
sklearn.ensemble.RandomForestClassifier.fit: running accelerated version on CPU
sklearn.ensemble.RandomForestClassifier.fit: running accelerated version on CPU
sklearn.ensemble.RandomForestClassifier.fit: running accelerated version on CPU
sklearn.ensemble.RandomForestClassifier.fit: running accelerated version on CPU
sklearn.ensemble.RandomForestClassifier.fit: running accelerated version on CPU
sklearn.ensemble.RandomForestClassifier.fit: fallback to original Scikit-learn
sklearn.ensemble.RandomForestClassifier.predict: running accelerated version on CPU
Trial 5 finished with value: 0.9918501428935931 and parameters: {'rfc_criterion': 'gini', 'rfc_n_estimators': 30, 'rfc_min_samples_split': 13, 'rfc_min_samples_leaf': 17, 'rfc_max_features': 3, 'rfc_bootstrap': False}. Best is trial 5 with value: 0.99185.
sklearn.ensemble.RandomForestClassifier.fit: fallback to original Scikit-learn
sklearn.ensemble.RandomForestClassifier.predict: running accelerated version on CPU
sklearn.ensemble.RandomForestClassifier.predict: running accelerated version on CPU
Trial 1 finished with value: 0.9917771324876428 and parameters: {'rfc_criterion': 'gini', 'rfc_n_estimators': 140, 'rfc_min_samples_split': 43, 'rfc_min_samples_leaf': 27, 'rfc_max_features': 7, 'rfc_bootstrap': False}. Best is trial 5 with value: 0.99185.
sklearn.ensemble.RandomForestClassifier.fit: fallback to original Scikit-learn
Trial 6 finished with value: 0.9918677195033673 and parameters: {'rfc_criterion': 'gini', 'rfc_n_estimators': 110, 'rfc_min_samples_split': 5, 'rfc_min_samples_leaf': 1, 'rfc_max_features': 17, 'rfc_bootstrap': False}. Best is trial 6 with value: 0.991868.
sklearn.ensemble.RandomForestClassifier.fit: running accelerated version on CPU
sklearn.ensemble.RandomForestClassifier.predict: fallback to original Scikit-learn
sklearn.ensemble.RandomForestClassifier.predict_proba: fallback to original Scikit-learn
sklearn.ensemble.RandomForestClassifier.predict: running accelerated version on CPU
Trial 9 finished with value: 0.9914048322818395 and parameters: {'rfc_criterion': 'entropy', 'rfc_n_estimators': 10, 'rfc_min_samples_split': 8, 'rfc_min_samples_leaf': 11, 'rfc_max_features': 8, 'rfc_bootstrap': True}. Best is trial 6 with value: 0.991868.
sklearn.ensemble.RandomForestClassifier.fit: fallback to original Scikit-learn
Trial 4 finished with value: 0.9916656379207053 and parameters: {'rfc_criterion': 'gini', 'rfc_n_estimators': 90, 'rfc_min_samples_split': 34, 'rfc_min_samples_leaf': 3, 'rfc_max_features': 35, 'rfc_bootstrap': True}. Best is trial 6 with value: 0.991868.
sklearn.ensemble.RandomForestClassifier.fit: fallback to original Scikit-learn
sklearn.ensemble.RandomForestClassifier.predict: running accelerated version on CPU
Trial 7 finished with value: 0.9918519940722941 and parameters: {'rfc_criterion': 'gini', 'rfc_n_estimators': 120, 'rfc_min_samples_split': 48, 'rfc_min_samples_leaf': 42, 'rfc_max_features': 27, 'rfc_bootstrap': False}. Best is trial 6 with value: 0.991868.
sklearn.ensemble.RandomForestClassifier.fit: fallback to original Scikit-learn
sklearn.ensemble.RandomForestClassifier.predict: running accelerated version on CPU
Trial 3 finished with value: 0.9917813012620562 and parameters: {'rfc_criterion': 'gini', 'rfc_n_estimators': 150, 'rfc_min_samples_split': 38, 'rfc_min_samples_leaf': 20, 'rfc_max_features': 45, 'rfc_bootstrap': False}. Best is trial 6 with value: 0.991868.
sklearn.ensemble.RandomForestClassifier.fit: fallback to original Scikit-learn
sklearn.ensemble.RandomForestClassifier.predict: fallback to original Scikit-learn
sklearn.ensemble.RandomForestClassifier.predict_proba: fallback to original Scikit-learn
Trial 2 finished with value: 0.9914127899211568 and parameters: {'rfc_criterion': 'entropy', 'rfc_n_estimators': 50, 'rfc_min_samples_split': 38, 'rfc_min_samples_leaf': 4, 'rfc_max_features': 15, 'rfc_bootstrap': False}. Best is trial 6 with value: 0.991868.
sklearn.ensemble.RandomForestClassifier.fit: fallback to original Scikit-learn
sklearn.ensemble.RandomForestClassifier.predict: fallback to original Scikit-learn
sklearn.ensemble.RandomForestClassifier.predict_proba: fallback to original Scikit-learn
sklearn.ensemble.RandomForestClassifier.predict: running accelerated version on CPU
Trial 10 finished with value: 0.9917418900897746 and parameters: {'rfc_criterion': 'gini', 'rfc_n_estimators': 190, 'rfc_min_samples_split': 15, 'rfc_min_samples_leaf': 4, 'rfc_max_features': 35, 'rfc_bootstrap': True}. Best is trial 6 with value: 0.991868.
sklearn.ensemble.RandomForestClassifier.fit: running accelerated version on CPU
Trial 8 finished with value: 0.9915967582690541 and parameters: {'rfc_criterion': 'entropy', 'rfc_n_estimators': 40, 'rfc_min_samples_split': 36, 'rfc_min_samples_leaf': 24, 'rfc_max_features': 23, 'rfc_bootstrap': False}. Best is trial 6 with value: 0.991868.
sklearn.ensemble.RandomForestClassifier.fit: running accelerated version on CPU
sklearn.ensemble.RandomForestClassifier.predict: running accelerated version on CPU
Trial 16 finished with value: 0.991771132688146 and parameters: {'rfc_criterion': 'gini', 'rfc_n_estimators': 10, 'rfc_min_samples_split': 21, 'rfc_min_samples_leaf': 10, 'rfc_max_features': 20, 'rfc_bootstrap': True}. Best is trial 6 with value: 0.991868.
sklearn.ensemble.RandomForestClassifier.fit: running accelerated version on CPU
sklearn.ensemble.RandomForestClassifier.predict: running accelerated version on CPU
Trial 17 finished with value: 0.9917610547181552 and parameters: {'rfc_criterion': 'gini', 'rfc_n_estimators': 80, 'rfc_min_samples_split': 23, 'rfc_min_samples_leaf': 37, 'rfc_max_features': 18, 'rfc_bootstrap': False}. Best is trial 6 with value: 0.991868.
sklearn.ensemble.RandomForestClassifier.fit: running accelerated version on CPU
sklearn.ensemble.RandomForestClassifier.predict: running accelerated version on CPU
Trial 18 finished with value: 0.9917612826468893 and parameters: {'rfc_criterion': 'gini', 'rfc_n_estimators': 100, 'rfc_min_samples_split': 48, 'rfc_min_samples_leaf': 45, 'rfc_max_features': 31, 'rfc_bootstrap': False}. Best is trial 6 with value: 0.991868.
sklearn.ensemble.RandomForestClassifier.fit: running accelerated version on CPU
sklearn.ensemble.RandomForestClassifier.predict: fallback to original Scikit-learn
sklearn.ensemble.RandomForestClassifier.predict_proba: fallback to original Scikit-learn
sklearn.ensemble.RandomForestClassifier.predict: running accelerated version on CPU
Trial 0 finished with value: 0.9898492712755036 and parameters: {'rfc_criterion': 'entropy', 'rfc_n_estimators': 200, 'rfc_min_samples_split': 9, 'rfc_min_samples_leaf': 33, 'rfc_max_features': 6, 'rfc_bootstrap': True}. Best is trial 6 with value: 0.991868.
sklearn.ensemble.RandomForestClassifier.fit: running accelerated version on CPU
Trial 19 finished with value: 0.991716192986523 and parameters: {'rfc_criterion': 'gini', 'rfc_n_estimators': 130, 'rfc_min_samples_split': 49, 'rfc_min_samples_leaf': 49, 'rfc_max_features': 30, 'rfc_bootstrap': False}. Best is trial 6 with value: 0.991868.
sklearn.ensemble.RandomForestClassifier.predict: running accelerated version on CPU
Trial 20 finished with value: 0.9917534459571575 and parameters: {'rfc_criterion': 'gini', 'rfc_n_estimators': 130, 'rfc_min_samples_split': 2, 'rfc_min_samples_leaf': 49, 'rfc_max_features': 29, 'rfc_bootstrap': False}. Best is trial 6 with value: 0.991868.
sklearn.ensemble.RandomForestClassifier.predict: fallback to original Scikit-learn
sklearn.ensemble.RandomForestClassifier.predict_proba: fallback to original Scikit-learn
Trial 13 finished with value: 0.9913599711586022 and parameters: {'rfc_criterion': 'entropy', 'rfc_n_estimators': 40, 'rfc_min_samples_split': 42, 'rfc_min_samples_leaf': 10, 'rfc_max_features': 27, 'rfc_bootstrap': False}. Best is trial 6 with value: 0.991868.
sklearn.ensemble.RandomForestClassifier.predict: running accelerated version on CPU
Trial 21 finished with value: 0.9917754331825007 and parameters: {'rfc_criterion': 'gini', 'rfc_n_estimators': 130, 'rfc_min_samples_split': 2, 'rfc_min_samples_leaf': 49, 'rfc_max_features': 26, 'rfc_bootstrap': False}. Best is trial 6 with value: 0.991868.
sklearn.ensemble.RandomForestClassifier.predict: fallback to original Scikit-learn
sklearn.ensemble.RandomForestClassifier.predict_proba: fallback to original Scikit-learn
Trial 15 finished with value: 0.9916564528876972 and parameters: {'rfc_criterion': 'entropy', 'rfc_n_estimators': 70, 'rfc_min_samples_split': 5, 'rfc_min_samples_leaf': 37, 'rfc_max_features': 44, 'rfc_bootstrap': False}. Best is trial 6 with value: 0.991868.
sklearn.ensemble.RandomForestClassifier.predict: fallback to original Scikit-learn
sklearn.ensemble.RandomForestClassifier.predict_proba: fallback to original Scikit-learn
Trial 14 finished with value: 0.9915826388294477 and parameters: {'rfc_criterion': 'entropy', 'rfc_n_estimators': 120, 'rfc_min_samples_split': 8, 'rfc_min_samples_leaf': 24, 'rfc_max_features': 22, 'rfc_bootstrap': False}. Best is trial 6 with value: 0.991868.
sklearn.ensemble.RandomForestClassifier.predict: fallback to original Scikit-learn
sklearn.ensemble.RandomForestClassifier.predict_proba: fallback to original Scikit-learn
Trial 11 finished with value: 0.991511639038864 and parameters: {'rfc_criterion': 'entropy', 'rfc_n_estimators': 160, 'rfc_min_samples_split': 21, 'rfc_min_samples_leaf': 39, 'rfc_max_features': 32, 'rfc_bootstrap': True}. Best is trial 6 with value: 0.991868.
sklearn.ensemble.RandomForestClassifier.predict: fallback to original Scikit-learn
sklearn.ensemble.RandomForestClassifier.predict_proba: fallback to original Scikit-learn
Trial 12 finished with value: 0.9917333126773511 and parameters: {'rfc_criterion': 'entropy', 'rfc_n_estimators': 120, 'rfc_min_samples_split': 16, 'rfc_min_samples_leaf': 39, 'rfc_max_features': 42, 'rfc_bootstrap': False}. Best is trial 6 with value: 0.991868.
A new study created in RDB with name: RidgeClassifier_59d7b7e2
Trial 1 finished with value: 0.9047439555188416 and parameters: {'rc_C': 3.626024874268785, 'rc_tol': 0.00399070657576857}. Best is trial 1 with value: 0.904744.
Trial 0 finished with value: 0.9047439555188416 and parameters: {'rc_C': 2.9182942808397854e-06, 'rc_tol': 0.00014658179566406907}. Best is trial 0 with value: 0.904744.
Trial 3 finished with value: 0.9041933218145332 and parameters: {'rc_C': 125.99944597907627, 'rc_tol': 0.007031879314704455}. Best is trial 0 with value: 0.904744.
Trial 2 finished with value: 0.9047439555188416 and parameters: {'rc_C': 0.0367619008233605, 'rc_tol': 0.0075454779611816075}. Best is trial 0 with value: 0.904744.
Trial 4 finished with value: 0.9047439555188416 and parameters: {'rc_C': 0.00042841102846646884, 'rc_tol': 0.0008024906797181126}. Best is trial 0 with value: 0.904744.
Trial 7 finished with value: 0.9040045594499272 and parameters: {'rc_C': 7738.603097857332, 'rc_tol': 0.008636368419824236}. Best is trial 0 with value: 0.904744.
Trial 5 finished with value: 0.9047439555188416 and parameters: {'rc_C': 0.01760005123877361, 'rc_tol': 0.0001921403894219474}. Best is trial 0 with value: 0.904744.
Trial 6 finished with value: 0.9047439555188416 and parameters: {'rc_C': 3.8728890181993734, 'rc_tol': 0.0026504510013367027}. Best is trial 0 with value: 0.904744.
Trial 11 finished with value: 0.9047439555188416 and parameters: {'rc_C': 0.0002428993897899992, 'rc_tol': 0.0002003926962360448}. Best is trial 0 with value: 0.904744.
Trial 15 finished with value: 0.901127676361314 and parameters: {'rc_C': 22516.49735835552, 'rc_tol': 0.00041778094969524175}. Best is trial 0 with value: 0.904744.
Trial 13 finished with value: 0.9047439555188416 and parameters: {'rc_C': 0.0015179348944613894, 'rc_tol': 0.0004120428985261274}. Best is trial 0 with value: 0.904744.
Trial 9 finished with value: 0.9047439555188416 and parameters: {'rc_C': 2.0831586639754204e-05, 'rc_tol': 0.0005897173843538518}. Best is trial 0 with value: 0.904744.
Trial 10 finished with value: 0.9047439555188416 and parameters: {'rc_C': 0.008457051921276205, 'rc_tol': 0.00010365545171741365}. Best is trial 0 with value: 0.904744.
Trial 12 finished with value: 0.9009857032700154 and parameters: {'rc_C': 703190.2800086634, 'rc_tol': 0.0005728740374073537}. Best is trial 0 with value: 0.904744.
Trial 14 finished with value: 0.8538659896347106 and parameters: {'rc_C': 162905.07555924816, 'rc_tol': 0.009491222238230634}. Best is trial 0 with value: 0.904744.
Trial 8 finished with value: 0.9047439555188416 and parameters: {'rc_C': 0.1458891937350172, 'rc_tol': 0.00014285539579926272}. Best is trial 0 with value: 0.904744.
Trial 16 finished with value: 0.9047439555188416 and parameters: {'rc_C': 3.045055863284443e-06, 'rc_tol': 0.0017441618938105448}. Best is trial 0 with value: 0.904744.
Trial 20 finished with value: 0.9047439555188416 and parameters: {'rc_C': 1.4395289383097194e-06, 'rc_tol': 0.001973655279052315}. Best is trial 0 with value: 0.904744.
Trial 21 finished with value: 0.9047439555188416 and parameters: {'rc_C': 1.4776962843008813e-06, 'rc_tol': 0.002425909850039637}. Best is trial 0 with value: 0.904744.
Trial 19 finished with value: 0.9047439555188416 and parameters: {'rc_C': 1.413551173578522e-06, 'rc_tol': 0.002611224820919129}. Best is trial 0 with value: 0.904744.
Trial 17 finished with value: 0.9045689309592932 and parameters: {'rc_C': 10.544468396594084, 'rc_tol': 0.0020257259746819917}. Best is trial 0 with value: 0.904744.
Trial 23 finished with value: 0.9046830741462173 and parameters: {'rc_C': 9.435192250945546, 'rc_tol': 0.0024870657966462113}. Best is trial 0 with value: 0.904744.
Trial 22 finished with value: 0.9047439555188416 and parameters: {'rc_C': 2.2446160706811184e-06, 'rc_tol': 0.0019758786859257528}. Best is trial 0 with value: 0.904744.
Trial 18 finished with value: 0.9047439555188416 and parameters: {'rc_C': 3.7160094442303523e-06, 'rc_tol': 0.0020111173409591196}. Best is trial 0 with value: 0.904744.
Trial 24 finished with value: 0.9047439555188416 and parameters: {'rc_C': 1.2544616266679824e-06, 'rc_tol': 0.0003167131598099062}. Best is trial 0 with value: 0.904744.
Trial 30 finished with value: 0.9047439555188416 and parameters: {'rc_C': 0.00011324766846758575, 'rc_tol': 0.0012463670659553989}. Best is trial 0 with value: 0.904744.
Trial 29 finished with value: 0.9047439555188416 and parameters: {'rc_C': 4.65904598395222e-05, 'rc_tol': 0.0012823776275251466}. Best is trial 0 with value: 0.904744.
Trial 28 finished with value: 0.9047439555188416 and parameters: {'rc_C': 7.469241309647121e-05, 'rc_tol': 0.0010346988357007474}. Best is trial 0 with value: 0.904744.
Trial 31 finished with value: 0.9047439555188416 and parameters: {'rc_C': 5.570368232550322e-05, 'rc_tol': 0.0010589123309915393}. Best is trial 0 with value: 0.904744.
Trial 26 finished with value: 0.9047439555188416 and parameters: {'rc_C': 3.9831416238445016e-05, 'rc_tol': 0.0012106542489664508}. Best is trial 0 with value: 0.904744.
Trial 25 finished with value: 0.9047439555188416 and parameters: {'rc_C': 5.9726353428827136e-05, 'rc_tol': 0.001309055338501585}. Best is trial 0 with value: 0.904744.
Trial 27 finished with value: 0.9047439555188416 and parameters: {'rc_C': 4.0432582566967094e-05, 'rc_tol': 0.0012106982323913254}. Best is trial 0 with value: 0.904744.
Trial 32 finished with value: 0.9047439555188416 and parameters: {'rc_C': 5.5751511539944466e-05, 'rc_tol': 0.004579891266931345}. Best is trial 0 with value: 0.904744.
Trial 33 finished with value: 0.9047439555188416 and parameters: {'rc_C': 0.0013247868298393755, 'rc_tol': 0.0007822792421512567}. Best is trial 0 with value: 0.904744.
A new study created in RDB with name: RUSBoostClassifier_59d7b7e2
Trial 1 finished with value: 0.10117121198760491 and parameters: {'rusbc_n_estimators': 25, 'rusbc_learning_rate': 2.038040670653369e-05, 'rusbc_sampling_strategy': 'not minority'}. Best is trial 1 with value: 0.101171.
Trial 2 finished with value: 0.8474132483112449 and parameters: {'rusbc_n_estimators': 25, 'rusbc_learning_rate': 0.012303288489868771, 'rusbc_sampling_strategy': 'not minority'}. Best is trial 2 with value: 0.847413.
Trial 4 finished with value: 0.10117121198760491 and parameters: {'rusbc_n_estimators': 75, 'rusbc_learning_rate': 1.1241799744695997e-05, 'rusbc_sampling_strategy': 'not minority'}. Best is trial 2 with value: 0.847413.
Trial 7 finished with value: 0.12231775321658918 and parameters: {'rusbc_n_estimators': 75, 'rusbc_learning_rate': 2.4589450760099502e-05, 'rusbc_sampling_strategy': 'not minority'}. Best is trial 2 with value: 0.847413.
Trial 8 finished with value: 0.10117121198760491 and parameters: {'rusbc_n_estimators': 50, 'rusbc_learning_rate': 1.1851197769893623e-06, 'rusbc_sampling_strategy': 'not minority'}. Best is trial 2 with value: 0.847413.
Trial 0 finished with value: 0.7610310380160312 and parameters: {'rusbc_n_estimators': 50, 'rusbc_learning_rate': 0.26588391872472594, 'rusbc_sampling_strategy': 'not majority'}. Best is trial 2 with value: 0.847413.
Trial 5 finished with value: 0.9237863482389447 and parameters: {'rusbc_n_estimators': 100, 'rusbc_learning_rate': 0.0056874618972112155, 'rusbc_sampling_strategy': 'all'}. Best is trial 5 with value: 0.923786.
Trial 6 finished with value: 0.8615260655246076 and parameters: {'rusbc_n_estimators': 75, 'rusbc_learning_rate': 0.29840045821174144, 'rusbc_sampling_strategy': 'not majority'}. Best is trial 5 with value: 0.923786.
Trial 10 finished with value: 0.10117121198760491 and parameters: {'rusbc_n_estimators': 75, 'rusbc_learning_rate': 2.349628460122227e-06, 'rusbc_sampling_strategy': 'not minority'}. Best is trial 5 with value: 0.923786.
Trial 11 finished with value: 0.9240990235115991 and parameters: {'rusbc_n_estimators': 75, 'rusbc_learning_rate': 0.006411501800350354, 'rusbc_sampling_strategy': 'all'}. Best is trial 11 with value: 0.924099.
Trial 12 finished with value: 0.31229924485982147 and parameters: {'rusbc_n_estimators': 50, 'rusbc_learning_rate': 3.0012033178072167e-06, 'rusbc_sampling_strategy': 'not majority'}. Best is trial 11 with value: 0.924099.
Trial 3 finished with value: 0.3083464227585943 and parameters: {'rusbc_n_estimators': 100, 'rusbc_learning_rate': 8.662757817317085e-05, 'rusbc_sampling_strategy': 'majority'}. Best is trial 11 with value: 0.924099.
Trial 15 finished with value: 0.10117121198760491 and parameters: {'rusbc_n_estimators': 50, 'rusbc_learning_rate': 1.2257024858241522e-06, 'rusbc_sampling_strategy': 'not minority'}. Best is trial 11 with value: 0.924099.
Trial 14 finished with value: 0.8763319363106605 and parameters: {'rusbc_n_estimators': 75, 'rusbc_learning_rate': 0.5919284743552929, 'rusbc_sampling_strategy': 'all'}. Best is trial 11 with value: 0.924099.
Trial 13 finished with value: 0.10117121198760491 and parameters: {'rusbc_n_estimators': 100, 'rusbc_learning_rate': 1.252639006774547e-06, 'rusbc_sampling_strategy': 'all'}. Best is trial 11 with value: 0.924099.
Trial 9 finished with value: 0.3083464227585943 and parameters: {'rusbc_n_estimators': 100, 'rusbc_learning_rate': 1.0481620667532696e-05, 'rusbc_sampling_strategy': 'majority'}. Best is trial 11 with value: 0.924099.
Trial 18 finished with value: 0.5747537916230977 and parameters: {'rusbc_n_estimators': 100, 'rusbc_learning_rate': 0.001488067809251309, 'rusbc_sampling_strategy': 'all'}. Best is trial 11 with value: 0.924099.
Trial 19 finished with value: 0.6366845557095607 and parameters: {'rusbc_n_estimators': 100, 'rusbc_learning_rate': 0.0019871619353267465, 'rusbc_sampling_strategy': 'all'}. Best is trial 11 with value: 0.924099.
Trial 16 finished with value: 0.31229924485982147 and parameters: {'rusbc_n_estimators': 75, 'rusbc_learning_rate': 1.1748913976176564e-06, 'rusbc_sampling_strategy': 'not majority'}. Best is trial 11 with value: 0.924099.
Trial 20 finished with value: 0.8651432417723571 and parameters: {'rusbc_n_estimators': 100, 'rusbc_learning_rate': 0.0034869143598789533, 'rusbc_sampling_strategy': 'all'}. Best is trial 11 with value: 0.924099.
Trial 21 finished with value: 0.8651432417723571 and parameters: {'rusbc_n_estimators': 100, 'rusbc_learning_rate': 0.003413508457570597, 'rusbc_sampling_strategy': 'all'}. Best is trial 11 with value: 0.924099.
Trial 22 finished with value: 0.6366845557095607 and parameters: {'rusbc_n_estimators': 100, 'rusbc_learning_rate': 0.0032950067227138645, 'rusbc_sampling_strategy': 'all'}. Best is trial 11 with value: 0.924099.
Trial 23 finished with value: 0.6366845557095607 and parameters: {'rusbc_n_estimators': 100, 'rusbc_learning_rate': 0.0028247167515008703, 'rusbc_sampling_strategy': 'all'}. Best is trial 11 with value: 0.924099.
Trial 17 finished with value: 0.3013147453657114 and parameters: {'rusbc_n_estimators': 100, 'rusbc_learning_rate': 0.0005487942112608204, 'rusbc_sampling_strategy': 'majority'}. Best is trial 11 with value: 0.924099.
Trial 24 finished with value: 0.9211436583435888 and parameters: {'rusbc_n_estimators': 100, 'rusbc_learning_rate': 0.011481157482208489, 'rusbc_sampling_strategy': 'all'}. Best is trial 11 with value: 0.924099.
Trial 28 finished with value: 0.7083154749910884 and parameters: {'rusbc_n_estimators': 75, 'rusbc_learning_rate': 0.041859990367996, 'rusbc_sampling_strategy': 'all'}. Best is trial 11 with value: 0.924099.
Trial 29 finished with value: 0.757867433949254 and parameters: {'rusbc_n_estimators': 75, 'rusbc_learning_rate': 0.03571417549153383, 'rusbc_sampling_strategy': 'all'}. Best is trial 11 with value: 0.924099.
