Trial 13 finished with value: 0.9045171792659163 and parameters: {'lda_solver': 'lsqr', 'lda_n_components': 3, 'lda_tol': 0.001}. Best is trial 0 with value: 0.904744.
Trial 12 finished with value: 0.9045171792659163 and parameters: {'lda_solver': 'eigen', 'lda_n_components': 3, 'lda_tol': 0.001}. Best is trial 0 with value: 0.904744.
Trial 14 finished with value: 0.9045171792659163 and parameters: {'lda_solver': 'eigen', 'lda_n_components': 2, 'lda_tol': 0.0001}. Best is trial 0 with value: 0.904744.
Trial 15 finished with value: 0.9045171792659163 and parameters: {'lda_solver': 'eigen', 'lda_n_components': 4, 'lda_tol': 0.001}. Best is trial 0 with value: 0.904744.
Trial 17 finished with value: 0.9047439555188416 and parameters: {'lda_solver': 'svd', 'lda_n_components': 4}. Best is trial 0 with value: 0.904744.
Trial 18 finished with value: 0.9047439555188416 and parameters: {'lda_solver': 'svd', 'lda_n_components': 4}. Best is trial 0 with value: 0.904744.
Trial 19 finished with value: 0.9047439555188416 and parameters: {'lda_solver': 'svd', 'lda_n_components': 4}. Best is trial 0 with value: 0.904744.
Trial 20 finished with value: 0.9047439555188416 and parameters: {'lda_solver': 'svd', 'lda_n_components': 4}. Best is trial 0 with value: 0.904744.
Trial 16 finished with value: 0.9045171792659163 and parameters: {'lda_solver': 'eigen', 'lda_n_components': 4, 'lda_tol': 1e-05}. Best is trial 0 with value: 0.904744.
Trial 21 finished with value: 0.9047439555188416 and parameters: {'lda_solver': 'svd', 'lda_n_components': 4}. Best is trial 0 with value: 0.904744.
Trial 24 finished with value: 0.9047439555188416 and parameters: {'lda_solver': 'svd', 'lda_n_components': 2}. Best is trial 0 with value: 0.904744.
Trial 23 finished with value: 0.9047439555188416 and parameters: {'lda_solver': 'svd', 'lda_n_components': 4}. Best is trial 0 with value: 0.904744.
Trial 22 finished with value: 0.9047439555188416 and parameters: {'lda_solver': 'svd', 'lda_n_components': 4}. Best is trial 0 with value: 0.904744.
Trial 26 finished with value: 0.9047439555188416 and parameters: {'lda_solver': 'svd', 'lda_n_components': 4}. Best is trial 0 with value: 0.904744.
Trial 25 finished with value: 0.9047439555188416 and parameters: {'lda_solver': 'svd', 'lda_n_components': 4}. Best is trial 0 with value: 0.904744.
Trial 28 finished with value: 0.9047439555188416 and parameters: {'lda_solver': 'svd', 'lda_n_components': 4}. Best is trial 0 with value: 0.904744.
Trial 29 finished with value: 0.9047439555188416 and parameters: {'lda_solver': 'svd', 'lda_n_components': 4}. Best is trial 0 with value: 0.904744.
Trial 27 finished with value: 0.9047439555188416 and parameters: {'lda_solver': 'svd', 'lda_n_components': 4}. Best is trial 0 with value: 0.904744.
Trial 30 finished with value: 0.9047439555188416 and parameters: {'lda_solver': 'svd', 'lda_n_components': 3}. Best is trial 0 with value: 0.904744.
A new study created in RDB with name: LinearSVC_59d7b7e2
Trial 0 finished with value: 0.8284426111861535 and parameters: {'lsvc_dual': False, 'lsvc_C': 0.0002486865315035488, 'lsvc_max_iter': 2000}. Best is trial 0 with value: 0.828443.
Trial 1 finished with value: 0.8250330615794362 and parameters: {'lsvc_dual': False, 'lsvc_C': 3.880811120854948e-05, 'lsvc_max_iter': 2000}. Best is trial 0 with value: 0.828443.
Trial 2 finished with value: 0.8291082003026318 and parameters: {'lsvc_dual': False, 'lsvc_C': 5.3589801492541516e-05, 'lsvc_max_iter': 2000}. Best is trial 2 with value: 0.829108.
Trial 3 finished with value: 0.8279377620957482 and parameters: {'lsvc_dual': False, 'lsvc_C': 0.008280607207469285, 'lsvc_max_iter': 2000}. Best is trial 2 with value: 0.829108.
Trial 4 finished with value: 0.8279502575535633 and parameters: {'lsvc_dual': False, 'lsvc_C': 4.463901482437601, 'lsvc_max_iter': 2000}. Best is trial 2 with value: 0.829108.
Trial 5 finished with value: 0.8725867882576065 and parameters: {'lsvc_dual': False, 'lsvc_C': 1.549643338455796e-05, 'lsvc_max_iter': 2000}. Best is trial 5 with value: 0.872587.
Trial 6 finished with value: 0.8277177138880207 and parameters: {'lsvc_dual': False, 'lsvc_C': 1.5069343326131062e-05, 'lsvc_max_iter': 2000}. Best is trial 5 with value: 0.872587.
Trial 7 finished with value: 0.8787083776200268 and parameters: {'lsvc_dual': False, 'lsvc_C': 0.006542989178396994, 'lsvc_max_iter': 2000}. Best is trial 7 with value: 0.878708.
Trial 8 finished with value: 0.8813382462154865 and parameters: {'lsvc_dual': False, 'lsvc_C': 225.0382055858736, 'lsvc_max_iter': 2000}. Best is trial 8 with value: 0.881338.
Trial 9 finished with value: 0.8786438719466794 and parameters: {'lsvc_dual': False, 'lsvc_C': 29.463919881428033, 'lsvc_max_iter': 2000}. Best is trial 8 with value: 0.881338.
Trial 10 finished with value: 0.8278711729145337 and parameters: {'lsvc_dual': False, 'lsvc_C': 760.3099465611753, 'lsvc_max_iter': 2000}. Best is trial 8 with value: 0.881338.
Trial 11 finished with value: 0.8726429037336838 and parameters: {'lsvc_dual': False, 'lsvc_C': 0.11910175633264154, 'lsvc_max_iter': 2000}. Best is trial 8 with value: 0.881338.
Trial 12 finished with value: 0.8795195549984984 and parameters: {'lsvc_dual': False, 'lsvc_C': 0.013726671819740329, 'lsvc_max_iter': 2000}. Best is trial 8 with value: 0.881338.
Trial 13 finished with value: 0.8771372556043515 and parameters: {'lsvc_dual': False, 'lsvc_C': 0.41124616750167703, 'lsvc_max_iter': 2000}. Best is trial 8 with value: 0.881338.
Trial 14 finished with value: 0.8276285001462351 and parameters: {'lsvc_dual': False, 'lsvc_C': 625.295238513518, 'lsvc_max_iter': 2000}. Best is trial 8 with value: 0.881338.
Trial 15 finished with value: 0.878539362641466 and parameters: {'lsvc_dual': False, 'lsvc_C': 0.001715011020112217, 'lsvc_max_iter': 2000}. Best is trial 8 with value: 0.881338.
Trial 16 finished with value: 0.8736300667316684 and parameters: {'lsvc_dual': False, 'lsvc_C': 1.5224544379706576e-06, 'lsvc_max_iter': 2000}. Best is trial 8 with value: 0.881338.
Trial 17 finished with value: 0.8286974049923415 and parameters: {'lsvc_dual': False, 'lsvc_C': 2.3648212287052495, 'lsvc_max_iter': 2000}. Best is trial 8 with value: 0.881338.
Trial 18 finished with value: 0.8812487038688841 and parameters: {'lsvc_dual': False, 'lsvc_C': 37.48206310512235, 'lsvc_max_iter': 2000}. Best is trial 8 with value: 0.881338.
Trial 19 finished with value: 0.8265798504811953 and parameters: {'lsvc_dual': False, 'lsvc_C': 60.64043552839116, 'lsvc_max_iter': 2000}. Best is trial 8 with value: 0.881338.
Trial 20 finished with value: 0.8272774012868772 and parameters: {'lsvc_dual': False, 'lsvc_C': 65.99515097140242, 'lsvc_max_iter': 2000}. Best is trial 8 with value: 0.881338.
Trial 21 finished with value: 0.8260719194717994 and parameters: {'lsvc_dual': False, 'lsvc_C': 0.0771983192189389, 'lsvc_max_iter': 2000}. Best is trial 8 with value: 0.881338.
Trial 22 finished with value: 0.8787257720995887 and parameters: {'lsvc_dual': False, 'lsvc_C': 1.6137733432031105, 'lsvc_max_iter': 2000}. Best is trial 8 with value: 0.881338.
A new study created in RDB with name: LinearSVC_AdditiveChi2Sampler_59d7b7e2
Trial 0 finished with value: 0.9895422615964787 and parameters: {'lsvc_ac2s_kernel_sample_steps': 2, 'lsvc_ac2s_dual': False, 'lsvc_ac2s_C': 316.34717438864953, 'lsvc_ac2s_max_iter': 2000}. Best is trial 0 with value: 0.989542.
Trial 1 finished with value: 0.9895642415526378 and parameters: {'lsvc_ac2s_kernel_sample_steps': 2, 'lsvc_ac2s_dual': False, 'lsvc_ac2s_C': 11.342925631823404, 'lsvc_ac2s_max_iter': 2000}. Best is trial 1 with value: 0.989564.
Trial 2 finished with value: 0.8672827365166329 and parameters: {'lsvc_ac2s_kernel_sample_steps': 1, 'lsvc_ac2s_dual': False, 'lsvc_ac2s_C': 0.06057744883630742, 'lsvc_ac2s_max_iter': 2000}. Best is trial 1 with value: 0.989564.
Trial 3 finished with value: 0.9868072038564987 and parameters: {'lsvc_ac2s_kernel_sample_steps': 2, 'lsvc_ac2s_dual': False, 'lsvc_ac2s_C': 0.00018430893146751686, 'lsvc_ac2s_max_iter': 2000}. Best is trial 1 with value: 0.989564.
Trial 4 finished with value: 0.9896344157522496 and parameters: {'lsvc_ac2s_kernel_sample_steps': 2, 'lsvc_ac2s_dual': False, 'lsvc_ac2s_C': 0.036691336514977684, 'lsvc_ac2s_max_iter': 2000}. Best is trial 4 with value: 0.989634.
Trial 5 finished with value: 0.9896111603045619 and parameters: {'lsvc_ac2s_kernel_sample_steps': 2, 'lsvc_ac2s_dual': False, 'lsvc_ac2s_C': 3.8779580231483037, 'lsvc_ac2s_max_iter': 2000}. Best is trial 4 with value: 0.989634.
Trial 6 finished with value: 0.8668807907763076 and parameters: {'lsvc_ac2s_kernel_sample_steps': 1, 'lsvc_ac2s_dual': False, 'lsvc_ac2s_C': 0.2981107968982281, 'lsvc_ac2s_max_iter': 2000}. Best is trial 4 with value: 0.989634.
Trial 7 finished with value: 0.86790446574453 and parameters: {'lsvc_ac2s_kernel_sample_steps': 1, 'lsvc_ac2s_dual': False, 'lsvc_ac2s_C': 0.12392446698233947, 'lsvc_ac2s_max_iter': 2000}. Best is trial 4 with value: 0.989634.
Trial 8 finished with value: 0.9891222644354128 and parameters: {'lsvc_ac2s_kernel_sample_steps': 3, 'lsvc_ac2s_dual': False, 'lsvc_ac2s_C': 19.072164638953865, 'lsvc_ac2s_max_iter': 2000}. Best is trial 4 with value: 0.989634.
Trial 9 finished with value: 0.8677073966174814 and parameters: {'lsvc_ac2s_kernel_sample_steps': 1, 'lsvc_ac2s_dual': False, 'lsvc_ac2s_C': 1.0706818203433104, 'lsvc_ac2s_max_iter': 2000}. Best is trial 4 with value: 0.989634.
Trial 10 finished with value: 0.9870244700400713 and parameters: {'lsvc_ac2s_kernel_sample_steps': 3, 'lsvc_ac2s_dual': False, 'lsvc_ac2s_C': 0.00016708995375459804, 'lsvc_ac2s_max_iter': 2000}. Best is trial 4 with value: 0.989634.
Trial 11 finished with value: 0.9178978693652339 and parameters: {'lsvc_ac2s_kernel_sample_steps': 2, 'lsvc_ac2s_dual': False, 'lsvc_ac2s_C': 1.1241962304139199e-06, 'lsvc_ac2s_max_iter': 2000}. Best is trial 4 with value: 0.989634.
Trial 12 finished with value: 0.9887761559988129 and parameters: {'lsvc_ac2s_kernel_sample_steps': 2, 'lsvc_ac2s_dual': False, 'lsvc_ac2s_C': 0.0021853354466165376, 'lsvc_ac2s_max_iter': 2000}. Best is trial 4 with value: 0.989634.
Trial 13 finished with value: 0.9889549375731296 and parameters: {'lsvc_ac2s_kernel_sample_steps': 2, 'lsvc_ac2s_dual': False, 'lsvc_ac2s_C': 0.005830342169775176, 'lsvc_ac2s_max_iter': 2000}. Best is trial 4 with value: 0.989634.
Trial 14 finished with value: 0.9894874823671387 and parameters: {'lsvc_ac2s_kernel_sample_steps': 2, 'lsvc_ac2s_dual': False, 'lsvc_ac2s_C': 457.45367513920075, 'lsvc_ac2s_max_iter': 2000}. Best is trial 4 with value: 0.989634.
Trial 15 finished with value: 0.9894802453853492 and parameters: {'lsvc_ac2s_kernel_sample_steps': 2, 'lsvc_ac2s_dual': False, 'lsvc_ac2s_C': 6.010083857672397, 'lsvc_ac2s_max_iter': 2000}. Best is trial 4 with value: 0.989634.
Trial 16 finished with value: 0.9888224061316268 and parameters: {'lsvc_ac2s_kernel_sample_steps': 3, 'lsvc_ac2s_dual': False, 'lsvc_ac2s_C': 0.006770076957724879, 'lsvc_ac2s_max_iter': 2000}. Best is trial 4 with value: 0.989634.
Trial 17 finished with value: 0.9895642415526378 and parameters: {'lsvc_ac2s_kernel_sample_steps': 2, 'lsvc_ac2s_dual': False, 'lsvc_ac2s_C': 2.2091549312472285, 'lsvc_ac2s_max_iter': 2000}. Best is trial 4 with value: 0.989634.
Trial 18 finished with value: 0.9894337693449569 and parameters: {'lsvc_ac2s_kernel_sample_steps': 2, 'lsvc_ac2s_dual': False, 'lsvc_ac2s_C': 39.06568344349095, 'lsvc_ac2s_max_iter': 2000}. Best is trial 4 with value: 0.989634.
Trial 19 finished with value: 0.9873462831086482 and parameters: {'lsvc_ac2s_kernel_sample_steps': 3, 'lsvc_ac2s_dual': False, 'lsvc_ac2s_C': 0.00022544775620810995, 'lsvc_ac2s_max_iter': 2000}. Best is trial 4 with value: 0.989634.
Trial 20 finished with value: 0.9335665286782907 and parameters: {'lsvc_ac2s_kernel_sample_steps': 2, 'lsvc_ac2s_dual': False, 'lsvc_ac2s_C': 8.317563363685909e-06, 'lsvc_ac2s_max_iter': 2000}. Best is trial 4 with value: 0.989634.
Trial 21 finished with value: 0.9895490564838856 and parameters: {'lsvc_ac2s_kernel_sample_steps': 2, 'lsvc_ac2s_dual': False, 'lsvc_ac2s_C': 50.35346240882358, 'lsvc_ac2s_max_iter': 2000}. Best is trial 4 with value: 0.989634.
A new study created in RDB with name: LinearSVC_Nystroem_59d7b7e2
Trial 0 finished with value: 0.2844441188051378 and parameters: {'lsvc_nystroem_kernel_gamma': 0.0010961922141914063, 'lsvc_nystroem_kernel_n_components': 100, 'lsvc_nystroem_dual': False, 'lsvc_nystroem_C': 1.4485082863567466e-05, 'lsvc_nystroem_max_iter': 2000}. Best is trial 0 with value: 0.284444.
Trial 1 finished with value: 0.2844441188051378 and parameters: {'lsvc_nystroem_kernel_gamma': 0.34525221086055213, 'lsvc_nystroem_kernel_n_components': 100, 'lsvc_nystroem_dual': False, 'lsvc_nystroem_C': 0.00011008550830372082, 'lsvc_nystroem_max_iter': 2000}. Best is trial 0 with value: 0.284444.
Trial 2 finished with value: 0.2844441188051378 and parameters: {'lsvc_nystroem_kernel_gamma': 32.62338588856398, 'lsvc_nystroem_kernel_n_components': 100, 'lsvc_nystroem_dual': False, 'lsvc_nystroem_C': 9.418920638226263e-05, 'lsvc_nystroem_max_iter': 2000}. Best is trial 0 with value: 0.284444.
Trial 3 finished with value: 0.2844441188051378 and parameters: {'lsvc_nystroem_kernel_gamma': 9.36450493037853, 'lsvc_nystroem_kernel_n_components': 50, 'lsvc_nystroem_dual': False, 'lsvc_nystroem_C': 4.474830470947596e-06, 'lsvc_nystroem_max_iter': 2000}. Best is trial 0 with value: 0.284444.
Trial 4 finished with value: 0.2844441188051378 and parameters: {'lsvc_nystroem_kernel_gamma': 0.3545807567854298, 'lsvc_nystroem_kernel_n_components': 100, 'lsvc_nystroem_dual': False, 'lsvc_nystroem_C': 0.034539689740355206, 'lsvc_nystroem_max_iter': 2000}. Best is trial 0 with value: 0.284444.
Trial 5 finished with value: 0.2844441188051378 and parameters: {'lsvc_nystroem_kernel_gamma': 102.24230315293045, 'lsvc_nystroem_kernel_n_components': 150, 'lsvc_nystroem_dual': False, 'lsvc_nystroem_C': 6.123356471461583, 'lsvc_nystroem_max_iter': 2000}. Best is trial 0 with value: 0.284444.
Trial 6 finished with value: 0.2844441188051378 and parameters: {'lsvc_nystroem_kernel_gamma': 5.166634967726371, 'lsvc_nystroem_kernel_n_components': 50, 'lsvc_nystroem_dual': False, 'lsvc_nystroem_C': 6.521528654066971e-05, 'lsvc_nystroem_max_iter': 2000}. Best is trial 0 with value: 0.284444.
Trial 7 finished with value: 0.36674665343562923 and parameters: {'lsvc_nystroem_kernel_gamma': 0.0025531447048818432, 'lsvc_nystroem_kernel_n_components': 150, 'lsvc_nystroem_dual': False, 'lsvc_nystroem_C': 99.19912218682349, 'lsvc_nystroem_max_iter': 2000}. Best is trial 7 with value: 0.366747.
Trial 8 finished with value: 0.2844441188051378 and parameters: {'lsvc_nystroem_kernel_gamma': 147.15755171666075, 'lsvc_nystroem_kernel_n_components': 100, 'lsvc_nystroem_dual': False, 'lsvc_nystroem_C': 0.00031501637013734503, 'lsvc_nystroem_max_iter': 2000}. Best is trial 7 with value: 0.366747.
Trial 9 finished with value: 0.2844441188051378 and parameters: {'lsvc_nystroem_kernel_gamma': 1.1529664209596455, 'lsvc_nystroem_kernel_n_components': 50, 'lsvc_nystroem_dual': False, 'lsvc_nystroem_C': 4.627987699773021e-06, 'lsvc_nystroem_max_iter': 2000}. Best is trial 7 with value: 0.366747.
Trial 10 finished with value: 0.378610589328408 and parameters: {'lsvc_nystroem_kernel_gamma': 0.0022285947400340197, 'lsvc_nystroem_kernel_n_components': 150, 'lsvc_nystroem_dual': False, 'lsvc_nystroem_C': 764.5126173471464, 'lsvc_nystroem_max_iter': 2000}. Best is trial 10 with value: 0.378611.
Trial 11 finished with value: 0.38950485953470376 and parameters: {'lsvc_nystroem_kernel_gamma': 0.00188793504383917, 'lsvc_nystroem_kernel_n_components': 150, 'lsvc_nystroem_dual': False, 'lsvc_nystroem_C': 702.2602212087486, 'lsvc_nystroem_max_iter': 2000}. Best is trial 11 with value: 0.389505.
Trial 12 finished with value: 0.30735096369617676 and parameters: {'lsvc_nystroem_kernel_gamma': 0.0169309624501235, 'lsvc_nystroem_kernel_n_components': 150, 'lsvc_nystroem_dual': False, 'lsvc_nystroem_C': 752.844225393873, 'lsvc_nystroem_max_iter': 2000}. Best is trial 11 with value: 0.389505.
Trial 13 finished with value: 0.2983940816179656 and parameters: {'lsvc_nystroem_kernel_gamma': 0.02567902329374056, 'lsvc_nystroem_kernel_n_components': 150, 'lsvc_nystroem_dual': False, 'lsvc_nystroem_C': 2.379262882847074, 'lsvc_nystroem_max_iter': 2000}. Best is trial 11 with value: 0.389505.
Trial 14 finished with value: 0.30608680231078766 and parameters: {'lsvc_nystroem_kernel_gamma': 0.014965583753211206, 'lsvc_nystroem_kernel_n_components': 150, 'lsvc_nystroem_dual': False, 'lsvc_nystroem_C': 6.874778520858276, 'lsvc_nystroem_max_iter': 2000}. Best is trial 11 with value: 0.389505.
Trial 15 finished with value: 0.2844441188051378 and parameters: {'lsvc_nystroem_kernel_gamma': 894.004502366655, 'lsvc_nystroem_kernel_n_components': 150, 'lsvc_nystroem_dual': False, 'lsvc_nystroem_C': 726.3992937392597, 'lsvc_nystroem_max_iter': 2000}. Best is trial 11 with value: 0.389505.
Trial 16 finished with value: 0.32626690887808896 and parameters: {'lsvc_nystroem_kernel_gamma': 0.003478337274774511, 'lsvc_nystroem_kernel_n_components': 150, 'lsvc_nystroem_dual': False, 'lsvc_nystroem_C': 0.12831706687744415, 'lsvc_nystroem_max_iter': 2000}. Best is trial 11 with value: 0.389505.
Trial 17 finished with value: 0.29223378957784163 and parameters: {'lsvc_nystroem_kernel_gamma': 0.06286847397153485, 'lsvc_nystroem_kernel_n_components': 150, 'lsvc_nystroem_dual': False, 'lsvc_nystroem_C': 53.36547484047913, 'lsvc_nystroem_max_iter': 2000}. Best is trial 11 with value: 0.389505.
Trial 18 finished with value: 0.2844441188051378 and parameters: {'lsvc_nystroem_kernel_gamma': 0.12030602306957443, 'lsvc_nystroem_kernel_n_components': 150, 'lsvc_nystroem_dual': False, 'lsvc_nystroem_C': 0.0016248919869973396, 'lsvc_nystroem_max_iter': 2000}. Best is trial 11 with value: 0.389505.
Trial 19 finished with value: 0.3108120086911735 and parameters: {'lsvc_nystroem_kernel_gamma': 0.005788941577524521, 'lsvc_nystroem_kernel_n_components': 100, 'lsvc_nystroem_dual': False, 'lsvc_nystroem_C': 0.8451242328654202, 'lsvc_nystroem_max_iter': 2000}. Best is trial 11 with value: 0.389505.
Trial 20 finished with value: 0.33028741225400204 and parameters: {'lsvc_nystroem_kernel_gamma': 0.006053405221103801, 'lsvc_nystroem_kernel_n_components': 150, 'lsvc_nystroem_dual': False, 'lsvc_nystroem_C': 45.446090918247464, 'lsvc_nystroem_max_iter': 2000}. Best is trial 11 with value: 0.389505.
Trial 21 finished with value: 0.40739178774225543 and parameters: {'lsvc_nystroem_kernel_gamma': 0.0012026240896608155, 'lsvc_nystroem_kernel_n_components': 150, 'lsvc_nystroem_dual': False, 'lsvc_nystroem_C': 93.85149441364821, 'lsvc_nystroem_max_iter': 2000}. Best is trial 21 with value: 0.407392.
A new study created in RDB with name: LinearSVC_PolynomialCountSketch_59d7b7e2
Trial 0 finished with value: 0.9299378026308704 and parameters: {'lsvc_pcs_kernel_gamma': 0.053265963371417646, 'lsvc_pcs_kernel_n_components': 100, 'lsvc_pcs_degree': 2, 'lsvc_pcs_dual': False, 'lsvc_pcs_C': 0.0002849078452385463, 'lsvc_pcs_max_iter': 2000}. Best is trial 0 with value: 0.929938.
Trial 1 finished with value: 0.9439783408481643 and parameters: {'lsvc_pcs_kernel_gamma': 0.023301134937710192, 'lsvc_pcs_kernel_n_components': 50, 'lsvc_pcs_degree': 2, 'lsvc_pcs_dual': False, 'lsvc_pcs_C': 101.78902531739429, 'lsvc_pcs_max_iter': 2000}. Best is trial 1 with value: 0.943978.
Trial 2 finished with value: 0.9497883716848519 and parameters: {'lsvc_pcs_kernel_gamma': 18.77982140196794, 'lsvc_pcs_kernel_n_components': 100, 'lsvc_pcs_degree': 2, 'lsvc_pcs_dual': False, 'lsvc_pcs_C': 0.4542056033542883, 'lsvc_pcs_max_iter': 2000}. Best is trial 2 with value: 0.949788.
Trial 3 finished with value: 0.9056447117681593 and parameters: {'lsvc_pcs_kernel_gamma': 7.23675659785052, 'lsvc_pcs_kernel_n_components': 150, 'lsvc_pcs_degree': 2, 'lsvc_pcs_dual': False, 'lsvc_pcs_C': 2.3925692922447306, 'lsvc_pcs_max_iter': 2000}. Best is trial 2 with value: 0.949788.
Trial 4 finished with value: 0.9217874637692428 and parameters: {'lsvc_pcs_kernel_gamma': 5.383287777327079, 'lsvc_pcs_kernel_n_components': 150, 'lsvc_pcs_degree': 2, 'lsvc_pcs_dual': False, 'lsvc_pcs_C': 38.4680835680886, 'lsvc_pcs_max_iter': 2000}. Best is trial 2 with value: 0.949788.
Trial 5 finished with value: 0.9107709388236765 and parameters: {'lsvc_pcs_kernel_gamma': 0.0037771128476490564, 'lsvc_pcs_kernel_n_components': 150, 'lsvc_pcs_degree': 2, 'lsvc_pcs_dual': False, 'lsvc_pcs_C': 0.23116040699896326, 'lsvc_pcs_max_iter': 2000}. Best is trial 2 with value: 0.949788.
Trial 6 finished with value: 0.9213935690485139 and parameters: {'lsvc_pcs_kernel_gamma': 1.021520932838854, 'lsvc_pcs_kernel_n_components': 50, 'lsvc_pcs_degree': 2, 'lsvc_pcs_dual': False, 'lsvc_pcs_C': 0.00014470085569743418, 'lsvc_pcs_max_iter': 2000}. Best is trial 2 with value: 0.949788.
Trial 7 finished with value: 0.9382599661745544 and parameters: {'lsvc_pcs_kernel_gamma': 0.009223570226793681, 'lsvc_pcs_kernel_n_components': 100, 'lsvc_pcs_degree': 2, 'lsvc_pcs_dual': False, 'lsvc_pcs_C': 0.8940565872040732, 'lsvc_pcs_max_iter': 2000}. Best is trial 2 with value: 0.949788.
Trial 8 finished with value: 0.9193799182962074 and parameters: {'lsvc_pcs_kernel_gamma': 0.5403891536372023, 'lsvc_pcs_kernel_n_components': 150, 'lsvc_pcs_degree': 2, 'lsvc_pcs_dual': False, 'lsvc_pcs_C': 2.76166278214506, 'lsvc_pcs_max_iter': 2000}. Best is trial 2 with value: 0.949788.
Trial 9 finished with value: 0.9309821606829735 and parameters: {'lsvc_pcs_kernel_gamma': 0.0024681208966655776, 'lsvc_pcs_kernel_n_components': 100, 'lsvc_pcs_degree': 2, 'lsvc_pcs_dual': False, 'lsvc_pcs_C': 2.0560129752619374, 'lsvc_pcs_max_iter': 2000}. Best is trial 2 with value: 0.949788.
