Trial 12 finished with value: 0.7417998522355809 and parameters: {'xgbc_n_estimators': 160, 'xgbc_use_label_encoder': False, 'xgbc_learning_rate': 0.00016632854632138026, 'xgbc_booster': 'gblinear', 'xgbc_gamma': 0.0352606615689793}. Best is trial 7 with value: 0.991664.
Trial 13 finished with value: 0.9901607869296077 and parameters: {'xgbc_n_estimators': 200, 'xgbc_use_label_encoder': False, 'xgbc_learning_rate': 0.01031967599386452, 'xgbc_booster': 'gbtree', 'xgbc_gamma': 0.006648184707571859}. Best is trial 7 with value: 0.991664.
Trial 14 finished with value: 0.9916036940412166 and parameters: {'xgbc_n_estimators': 50, 'xgbc_use_label_encoder': False, 'xgbc_learning_rate': 0.8421532251063867, 'xgbc_booster': 'gbtree', 'xgbc_gamma': 0.00077702888898272}. Best is trial 7 with value: 0.991664.
Trial 15 finished with value: 0.9915494490427059 and parameters: {'xgbc_n_estimators': 70, 'xgbc_use_label_encoder': False, 'xgbc_learning_rate': 0.3986951411633736, 'xgbc_booster': 'gbtree', 'xgbc_gamma': 0.0017789951664253939}. Best is trial 7 with value: 0.991664.
Trial 16 finished with value: 0.9874143495593114 and parameters: {'xgbc_n_estimators': 20, 'xgbc_use_label_encoder': False, 'xgbc_learning_rate': 0.028434177486182946, 'xgbc_booster': 'gbtree', 'xgbc_gamma': 0.00011246233124179298}. Best is trial 7 with value: 0.991664.
Trial 17 finished with value: 0.9917790380320912 and parameters: {'xgbc_n_estimators': 40, 'xgbc_use_label_encoder': False, 'xgbc_learning_rate': 0.6046294128924173, 'xgbc_booster': 'gbtree', 'xgbc_gamma': 1.9378458750072943e-05}. Best is trial 17 with value: 0.991779.
Trial 4 finished with value: 0.9872397701116491 and parameters: {'xgbc_n_estimators': 180, 'xgbc_use_label_encoder': False, 'xgbc_learning_rate': 1.6626310608988372e-05, 'xgbc_booster': 'dart', 'xgbc_gamma': 0.5122936384596308}. Best is trial 17 with value: 0.991779.
Trial 19 finished with value: 0.987391581259032 and parameters: {'xgbc_n_estimators': 90, 'xgbc_use_label_encoder': False, 'xgbc_learning_rate': 0.004018016369875327, 'xgbc_booster': 'gbtree', 'xgbc_gamma': 1.2894314935772475e-05}. Best is trial 17 with value: 0.991779.
Trial 18 finished with value: 0.9874143495593114 and parameters: {'xgbc_n_estimators': 180, 'xgbc_use_label_encoder': False, 'xgbc_learning_rate': 0.0032743017419890373, 'xgbc_booster': 'gbtree', 'xgbc_gamma': 1.2330748252618293e-05}. Best is trial 17 with value: 0.991779.
Trial 21 finished with value: 0.9913722951526162 and parameters: {'xgbc_n_estimators': 30, 'xgbc_use_label_encoder': False, 'xgbc_learning_rate': 0.12752334130727883, 'xgbc_booster': 'gbtree', 'xgbc_gamma': 1.1005772816013656e-06}. Best is trial 17 with value: 0.991779.
Trial 20 finished with value: 0.9915420724739176 and parameters: {'xgbc_n_estimators': 130, 'xgbc_use_label_encoder': False, 'xgbc_learning_rate': 0.14843372404806285, 'xgbc_booster': 'gbtree', 'xgbc_gamma': 5.911031099399433e-05}. Best is trial 17 with value: 0.991779.
Trial 10 finished with value: 0.9872397701116491 and parameters: {'xgbc_n_estimators': 200, 'xgbc_use_label_encoder': False, 'xgbc_learning_rate': 1.2625548056435025e-05, 'xgbc_booster': 'dart', 'xgbc_gamma': 4.2095123077231975e-05}. Best is trial 17 with value: 0.991779.
Trial 24 finished with value: 0.9915030269510672 and parameters: {'xgbc_n_estimators': 50, 'xgbc_use_label_encoder': False, 'xgbc_learning_rate': 0.7451308294025691, 'xgbc_booster': 'gbtree', 'xgbc_gamma': 0.0006743707584583458}. Best is trial 17 with value: 0.991779.
Trial 25 finished with value: 0.9914695621370567 and parameters: {'xgbc_n_estimators': 80, 'xgbc_use_label_encoder': False, 'xgbc_learning_rate': 0.10490610758495013, 'xgbc_booster': 'gbtree', 'xgbc_gamma': 0.0003427997918031635}. Best is trial 17 with value: 0.991779.
Trial 11 finished with value: 0.9872397701116491 and parameters: {'xgbc_n_estimators': 170, 'xgbc_use_label_encoder': False, 'xgbc_learning_rate': 1.4320477595854255e-06, 'xgbc_booster': 'dart', 'xgbc_gamma': 0.000497193898081835}. Best is trial 17 with value: 0.991779.
Trial 22 finished with value: 0.9913966763782275 and parameters: {'xgbc_n_estimators': 130, 'xgbc_use_label_encoder': False, 'xgbc_learning_rate': 0.1521519142392535, 'xgbc_booster': 'dart', 'xgbc_gamma': 0.000155358931475009}. Best is trial 17 with value: 0.991779.
Trial 23 finished with value: 0.9914541668660843 and parameters: {'xgbc_n_estimators': 130, 'xgbc_use_label_encoder': False, 'xgbc_learning_rate': 0.06999805499639682, 'xgbc_booster': 'dart', 'xgbc_gamma': 0.0003228151009366473}. Best is trial 17 with value: 0.991779.
