Trial 25 finished with value: 0.712623877502489 and parameters: {'rusbc_n_estimators': 100, 'rusbc_learning_rate': 0.020953169283968554, 'rusbc_sampling_strategy': 'all'}. Best is trial 11 with value: 0.924099.
Trial 26 finished with value: 0.7128750257008201 and parameters: {'rusbc_n_estimators': 100, 'rusbc_learning_rate': 0.050188009065106565, 'rusbc_sampling_strategy': 'all'}. Best is trial 11 with value: 0.924099.
Trial 27 finished with value: 0.7083154749910884 and parameters: {'rusbc_n_estimators': 100, 'rusbc_learning_rate': 0.04089753587838108, 'rusbc_sampling_strategy': 'all'}. Best is trial 11 with value: 0.924099.
A new study created in RDB with name: SGDClassifier_59d7b7e2
Trial 4 finished with value: 0.07399138544370873 and parameters: {'sgdc_loss': 'modified_huber', 'sgdc_penalty': 'elasticnet', 'sgdc_alpha': 0.09792272145844305, 'sgdc_l1_ratio': 0.4, 'sgdc_learning_rate': 'constant', 'sgdc_eta0': 66.4708632099011, 'sgdc_early_stopping': True, 'sgdc_validation_fraction': 0.25, 'sgdc_n_iter_no_change': 10}. Best is trial 4 with value: 0.0739914.
Trial 7 finished with value: 0.00128765656199791 and parameters: {'sgdc_loss': 'modified_huber', 'sgdc_penalty': 'elasticnet', 'sgdc_alpha': 661.7504221317631, 'sgdc_l1_ratio': 0.0, 'sgdc_learning_rate': 'constant', 'sgdc_eta0': 19.594257660119407, 'sgdc_early_stopping': True, 'sgdc_validation_fraction': 0.25, 'sgdc_n_iter_no_change': 10}. Best is trial 4 with value: 0.0739914.
Trial 3 finished with value: 0.2225001924998294 and parameters: {'sgdc_loss': 'hinge', 'sgdc_penalty': 'elasticnet', 'sgdc_alpha': 5.103561402618334, 'sgdc_l1_ratio': 1.0, 'sgdc_learning_rate': 'constant', 'sgdc_eta0': 0.07068466135975536, 'sgdc_early_stopping': True, 'sgdc_validation_fraction': 0.25, 'sgdc_n_iter_no_change': 10}. Best is trial 3 with value: 0.2225.
Trial 5 finished with value: 0.5482216595753924 and parameters: {'sgdc_loss': 'modified_huber', 'sgdc_penalty': 'elasticnet', 'sgdc_alpha': 0.00013175745031012941, 'sgdc_l1_ratio': 0.8, 'sgdc_learning_rate': 'constant', 'sgdc_eta0': 0.004364309287068608, 'sgdc_early_stopping': True, 'sgdc_validation_fraction': 0.25, 'sgdc_n_iter_no_change': 10}. Best is trial 5 with value: 0.548222.
Trial 6 finished with value: 0.5903568107504779 and parameters: {'sgdc_loss': 'log', 'sgdc_penalty': 'elasticnet', 'sgdc_alpha': 0.017766187194085414, 'sgdc_l1_ratio': 1.0, 'sgdc_learning_rate': 'optimal', 'sgdc_eta0': 0.3730317592813799, 'sgdc_early_stopping': True, 'sgdc_validation_fraction': 0.25, 'sgdc_n_iter_no_change': 10}. Best is trial 6 with value: 0.590357.
Trial 1 finished with value: 0.4603522378074482 and parameters: {'sgdc_loss': 'hinge', 'sgdc_penalty': 'elasticnet', 'sgdc_alpha': 0.00017183838671116787, 'sgdc_l1_ratio': 0.8, 'sgdc_learning_rate': 'constant', 'sgdc_eta0': 0.0036109350148352836, 'sgdc_early_stopping': True, 'sgdc_validation_fraction': 0.25, 'sgdc_n_iter_no_change': 10}. Best is trial 6 with value: 0.590357.
Trial 9 finished with value: 0.020686184019662112 and parameters: {'sgdc_loss': 'squared_hinge', 'sgdc_penalty': 'elasticnet', 'sgdc_alpha': 8.723845748825338, 'sgdc_l1_ratio': 0.6000000000000001, 'sgdc_learning_rate': 'constant', 'sgdc_eta0': 0.012895277277490484, 'sgdc_early_stopping': True, 'sgdc_validation_fraction': 0.25, 'sgdc_n_iter_no_change': 10}. Best is trial 6 with value: 0.590357.
Trial 12 finished with value: 0.5668042297487635 and parameters: {'sgdc_loss': 'modified_huber', 'sgdc_penalty': 'elasticnet', 'sgdc_alpha': 2.4229420599557877e-06, 'sgdc_l1_ratio': 0.8, 'sgdc_learning_rate': 'optimal', 'sgdc_eta0': 0.2704327333272831, 'sgdc_early_stopping': True, 'sgdc_validation_fraction': 0.25, 'sgdc_n_iter_no_change': 10}. Best is trial 6 with value: 0.590357.
Trial 13 finished with value: 0.5434965304907599 and parameters: {'sgdc_loss': 'squared_hinge', 'sgdc_penalty': 'elasticnet', 'sgdc_alpha': 0.006394067899710556, 'sgdc_l1_ratio': 0.0, 'sgdc_learning_rate': 'optimal', 'sgdc_eta0': 0.0097886874496182, 'sgdc_early_stopping': True, 'sgdc_validation_fraction': 0.25, 'sgdc_n_iter_no_change': 10}. Best is trial 6 with value: 0.590357.
Trial 11 finished with value: 0.5827823549471114 and parameters: {'sgdc_loss': 'hinge', 'sgdc_penalty': 'elasticnet', 'sgdc_alpha': 1.0106017397044147e-05, 'sgdc_l1_ratio': 0.8, 'sgdc_learning_rate': 'optimal', 'sgdc_eta0': 0.14999689392838958, 'sgdc_early_stopping': True, 'sgdc_validation_fraction': 0.25, 'sgdc_n_iter_no_change': 10}. Best is trial 6 with value: 0.590357.
Trial 14 finished with value: 0.28871258734165833 and parameters: {'sgdc_loss': 'modified_huber', 'sgdc_penalty': 'elasticnet', 'sgdc_alpha': 0.998445950708307, 'sgdc_l1_ratio': 0.6000000000000001, 'sgdc_learning_rate': 'invscaling', 'sgdc_eta0': 0.8886313597406307, 'sgdc_early_stopping': True, 'sgdc_validation_fraction': 0.25, 'sgdc_n_iter_no_change': 10}. Best is trial 6 with value: 0.590357.
Trial 16 finished with value: 0.00128765656199791 and parameters: {'sgdc_loss': 'modified_huber', 'sgdc_penalty': 'elasticnet', 'sgdc_alpha': 2.501423848561195, 'sgdc_l1_ratio': 0.0, 'sgdc_learning_rate': 'constant', 'sgdc_eta0': 35.89464035142983, 'sgdc_early_stopping': True, 'sgdc_validation_fraction': 0.25, 'sgdc_n_iter_no_change': 10}. Best is trial 6 with value: 0.590357.
Trial 17 finished with value: 0.430559180675681 and parameters: {'sgdc_loss': 'log', 'sgdc_penalty': 'elasticnet', 'sgdc_alpha': 0.049208266758877045, 'sgdc_l1_ratio': 0.4, 'sgdc_learning_rate': 'invscaling', 'sgdc_eta0': 3.5974169571920833, 'sgdc_early_stopping': True, 'sgdc_validation_fraction': 0.25, 'sgdc_n_iter_no_change': 10}. Best is trial 6 with value: 0.590357.
Trial 20 finished with value: 0.5658926270942382 and parameters: {'sgdc_loss': 'log', 'sgdc_penalty': 'elasticnet', 'sgdc_alpha': 1.7692668399974379e-06, 'sgdc_l1_ratio': 1.0, 'sgdc_learning_rate': 'optimal', 'sgdc_eta0': 594.1385063369663, 'sgdc_early_stopping': True, 'sgdc_validation_fraction': 0.25, 'sgdc_n_iter_no_change': 10}. Best is trial 6 with value: 0.590357.
Trial 2 finished with value: 0.39066121378614727 and parameters: {'sgdc_loss': 'squared_hinge', 'sgdc_penalty': 'elasticnet', 'sgdc_alpha': 21.63704058081621, 'sgdc_l1_ratio': 0.6000000000000001, 'sgdc_learning_rate': 'adaptive', 'sgdc_eta0': 0.013748560952512822, 'sgdc_early_stopping': True, 'sgdc_validation_fraction': 0.25, 'sgdc_n_iter_no_change': 10}. Best is trial 6 with value: 0.590357.
Trial 22 finished with value: 0.6123237899860017 and parameters: {'sgdc_loss': 'hinge', 'sgdc_penalty': 'elasticnet', 'sgdc_alpha': 0.0012728480769796757, 'sgdc_l1_ratio': 1.0, 'sgdc_learning_rate': 'optimal', 'sgdc_eta0': 0.11797790811749717, 'sgdc_early_stopping': True, 'sgdc_validation_fraction': 0.25, 'sgdc_n_iter_no_change': 10}. Best is trial 22 with value: 0.612324.
Trial 8 finished with value: 0.6169616591594609 and parameters: {'sgdc_loss': 'hinge', 'sgdc_penalty': 'elasticnet', 'sgdc_alpha': 1.6810134231245861, 'sgdc_l1_ratio': 1.0, 'sgdc_learning_rate': 'adaptive', 'sgdc_eta0': 0.07878474057340959, 'sgdc_early_stopping': True, 'sgdc_validation_fraction': 0.25, 'sgdc_n_iter_no_change': 10}. Best is trial 8 with value: 0.616962.
Trial 10 finished with value: 0.38387675075065186 and parameters: {'sgdc_loss': 'hinge', 'sgdc_penalty': 'elasticnet', 'sgdc_alpha': 4.409379859183909, 'sgdc_l1_ratio': 0.0, 'sgdc_learning_rate': 'adaptive', 'sgdc_eta0': 0.1907426675028767, 'sgdc_early_stopping': True, 'sgdc_validation_fraction': 0.25, 'sgdc_n_iter_no_change': 10}. Best is trial 8 with value: 0.616962.
Trial 15 finished with value: 0.37181309704171644 and parameters: {'sgdc_loss': 'log', 'sgdc_penalty': 'elasticnet', 'sgdc_alpha': 449.7486966761655, 'sgdc_l1_ratio': 0.6000000000000001, 'sgdc_learning_rate': 'adaptive', 'sgdc_eta0': 0.004099754051736087, 'sgdc_early_stopping': True, 'sgdc_validation_fraction': 0.25, 'sgdc_n_iter_no_change': 10}. Best is trial 8 with value: 0.616962.
Trial 23 finished with value: 0.6253324974853941 and parameters: {'sgdc_loss': 'log', 'sgdc_penalty': 'elasticnet', 'sgdc_alpha': 0.002159474675964156, 'sgdc_l1_ratio': 1.0, 'sgdc_learning_rate': 'optimal', 'sgdc_eta0': 0.0010287385195820813, 'sgdc_early_stopping': True, 'sgdc_validation_fraction': 0.25, 'sgdc_n_iter_no_change': 10}. Best is trial 23 with value: 0.625332.
Trial 0 finished with value: 0.2844441188051378 and parameters: {'sgdc_loss': 'log', 'sgdc_penalty': 'elasticnet', 'sgdc_alpha': 597.8879879864428, 'sgdc_l1_ratio': 0.8, 'sgdc_learning_rate': 'adaptive', 'sgdc_eta0': 12.205045770954968, 'sgdc_early_stopping': True, 'sgdc_validation_fraction': 0.25, 'sgdc_n_iter_no_change': 10}. Best is trial 23 with value: 0.625332.
Trial 28 finished with value: 0.6412200587171544 and parameters: {'sgdc_loss': 'hinge', 'sgdc_penalty': 'elasticnet', 'sgdc_alpha': 0.0014034674113394946, 'sgdc_l1_ratio': 1.0, 'sgdc_learning_rate': 'optimal', 'sgdc_eta0': 0.0012443809352951527, 'sgdc_early_stopping': True, 'sgdc_validation_fraction': 0.25, 'sgdc_n_iter_no_change': 10}. Best is trial 28 with value: 0.64122.
Trial 21 finished with value: 0.6654742231477798 and parameters: {'sgdc_loss': 'hinge', 'sgdc_penalty': 'elasticnet', 'sgdc_alpha': 0.00050998674908133, 'sgdc_l1_ratio': 1.0, 'sgdc_learning_rate': 'adaptive', 'sgdc_eta0': 0.08583211273861088, 'sgdc_early_stopping': True, 'sgdc_validation_fraction': 0.25, 'sgdc_n_iter_no_change': 10}. Best is trial 21 with value: 0.665474.
Trial 18 finished with value: 0.664337093737026 and parameters: {'sgdc_loss': 'log', 'sgdc_penalty': 'elasticnet', 'sgdc_alpha': 1.4486684952962478e-06, 'sgdc_l1_ratio': 1.0, 'sgdc_learning_rate': 'adaptive', 'sgdc_eta0': 4.451534263440509, 'sgdc_early_stopping': True, 'sgdc_validation_fraction': 0.25, 'sgdc_n_iter_no_change': 10}. Best is trial 21 with value: 0.665474.
Trial 29 finished with value: 0.18696015183456915 and parameters: {'sgdc_loss': 'hinge', 'sgdc_penalty': 'elasticnet', 'sgdc_alpha': 0.30774342413235445, 'sgdc_l1_ratio': 1.0, 'sgdc_learning_rate': 'optimal', 'sgdc_eta0': 0.0010150817131110324, 'sgdc_early_stopping': True, 'sgdc_validation_fraction': 0.25, 'sgdc_n_iter_no_change': 10}. Best is trial 21 with value: 0.665474.
Trial 24 finished with value: 0.6748511127988084 and parameters: {'sgdc_loss': 'hinge', 'sgdc_penalty': 'elasticnet', 'sgdc_alpha': 0.0018151329803217002, 'sgdc_l1_ratio': 1.0, 'sgdc_learning_rate': 'adaptive', 'sgdc_eta0': 0.0012651337629307096, 'sgdc_early_stopping': True, 'sgdc_validation_fraction': 0.25, 'sgdc_n_iter_no_change': 10}. Best is trial 24 with value: 0.674851.
Trial 25 finished with value: 0.6636177294351976 and parameters: {'sgdc_loss': 'hinge', 'sgdc_penalty': 'elasticnet', 'sgdc_alpha': 0.001663805572572878, 'sgdc_l1_ratio': 1.0, 'sgdc_learning_rate': 'adaptive', 'sgdc_eta0': 0.0010890233445050147, 'sgdc_early_stopping': True, 'sgdc_validation_fraction': 0.25, 'sgdc_n_iter_no_change': 10}. Best is trial 24 with value: 0.674851.
Trial 19 finished with value: 0.6645256278499546 and parameters: {'sgdc_loss': 'log', 'sgdc_penalty': 'elasticnet', 'sgdc_alpha': 2.5606254083308756e-06, 'sgdc_l1_ratio': 1.0, 'sgdc_learning_rate': 'adaptive', 'sgdc_eta0': 5.839305338127199, 'sgdc_early_stopping': True, 'sgdc_validation_fraction': 0.25, 'sgdc_n_iter_no_change': 10}. Best is trial 24 with value: 0.674851.
Trial 27 finished with value: 0.6871097982576211 and parameters: {'sgdc_loss': 'log', 'sgdc_penalty': 'elasticnet', 'sgdc_alpha': 0.0013719267547128763, 'sgdc_l1_ratio': 0.2, 'sgdc_learning_rate': 'adaptive', 'sgdc_eta0': 0.001169677729742828, 'sgdc_early_stopping': True, 'sgdc_validation_fraction': 0.25, 'sgdc_n_iter_no_change': 10}. Best is trial 27 with value: 0.68711.
Trial 26 finished with value: 0.6638139358496323 and parameters: {'sgdc_loss': 'hinge', 'sgdc_penalty': 'elasticnet', 'sgdc_alpha': 0.0006560294465329254, 'sgdc_l1_ratio': 1.0, 'sgdc_learning_rate': 'adaptive', 'sgdc_eta0': 0.03818067625848469, 'sgdc_early_stopping': True, 'sgdc_validation_fraction': 0.25, 'sgdc_n_iter_no_change': 10}. Best is trial 27 with value: 0.68711.
A new study created in RDB with name: VeryFastDecisionRulesClassifier_59d7b7e2
Trial 3 finished with value: 0.9551650477223521 and parameters: {'vfdrc_ordered_rules': True, 'vfdrc_grace_period': 100, 'vfdrc_tie_threshold': 0.5, 'vfdrc_rule_prediction': 'first_hit', 'vfdrc_max_rules': 20, 'vfdrc_expand_criterion': 'foil_gain', 'vfdrc_remove_poor_atts': True}. Best is trial 3 with value: 0.955165.
Trial 4 finished with value: 0.9912212362545387 and parameters: {'vfdrc_ordered_rules': True, 'vfdrc_grace_period': 300, 'vfdrc_tie_threshold': 0.6000000000000001, 'vfdrc_rule_prediction': 'weighted_sum', 'vfdrc_max_rules': 40, 'vfdrc_expand_criterion': 'info_gain', 'vfdrc_remove_poor_atts': False}. Best is trial 4 with value: 0.991221.
Trial 2 finished with value: 0.9913405931104826 and parameters: {'vfdrc_ordered_rules': True, 'vfdrc_grace_period': 200, 'vfdrc_tie_threshold': 0.9, 'vfdrc_rule_prediction': 'first_hit', 'vfdrc_max_rules': 25, 'vfdrc_expand_criterion': 'info_gain', 'vfdrc_remove_poor_atts': False}. Best is trial 2 with value: 0.991341.
Trial 0 finished with value: 0.6454007918534377 and parameters: {'vfdrc_ordered_rules': True, 'vfdrc_grace_period': 400, 'vfdrc_tie_threshold': 0.45, 'vfdrc_rule_prediction': 'weighted_sum', 'vfdrc_max_rules': 35, 'vfdrc_expand_criterion': 'hellinger', 'vfdrc_remove_poor_atts': False}. Best is trial 2 with value: 0.991341.
Trial 7 finished with value: 0.8594641237310942 and parameters: {'vfdrc_ordered_rules': True, 'vfdrc_grace_period': 350, 'vfdrc_tie_threshold': 0.30000000000000004, 'vfdrc_rule_prediction': 'weighted_max', 'vfdrc_max_rules': 30, 'vfdrc_expand_criterion': 'hellinger', 'vfdrc_remove_poor_atts': False}. Best is trial 2 with value: 0.991341.
Trial 5 finished with value: 0.945185413585416 and parameters: {'vfdrc_ordered_rules': False, 'vfdrc_grace_period': 350, 'vfdrc_tie_threshold': 0.1, 'vfdrc_rule_prediction': 'first_hit', 'vfdrc_max_rules': 20, 'vfdrc_expand_criterion': 'info_gain', 'vfdrc_remove_poor_atts': False}. Best is trial 2 with value: 0.991341.
Trial 1 finished with value: 0.8599858717610657 and parameters: {'vfdrc_ordered_rules': False, 'vfdrc_grace_period': 200, 'vfdrc_tie_threshold': 0.75, 'vfdrc_rule_prediction': 'weighted_max', 'vfdrc_max_rules': 20, 'vfdrc_expand_criterion': 'info_gain', 'vfdrc_remove_poor_atts': False}. Best is trial 2 with value: 0.991341.
Trial 9 finished with value: 0.606589715500819 and parameters: {'vfdrc_ordered_rules': True, 'vfdrc_grace_period': 150, 'vfdrc_tie_threshold': 0.8500000000000001, 'vfdrc_rule_prediction': 'weighted_sum', 'vfdrc_max_rules': 15, 'vfdrc_expand_criterion': 'hellinger', 'vfdrc_remove_poor_atts': True}. Best is trial 2 with value: 0.991341.
Trial 11 finished with value: 0.8515807713683815 and parameters: {'vfdrc_ordered_rules': True, 'vfdrc_grace_period': 150, 'vfdrc_tie_threshold': 0.45, 'vfdrc_rule_prediction': 'weighted_sum', 'vfdrc_max_rules': 20, 'vfdrc_expand_criterion': 'foil_gain', 'vfdrc_remove_poor_atts': True}. Best is trial 2 with value: 0.991341.
Trial 10 finished with value: 0.9915163628918938 and parameters: {'vfdrc_ordered_rules': True, 'vfdrc_grace_period': 400, 'vfdrc_tie_threshold': 0.9500000000000001, 'vfdrc_rule_prediction': 'weighted_sum', 'vfdrc_max_rules': 25, 'vfdrc_expand_criterion': 'info_gain', 'vfdrc_remove_poor_atts': True}. Best is trial 10 with value: 0.991516.
Trial 6 finished with value: 0.9485170781851154 and parameters: {'vfdrc_ordered_rules': False, 'vfdrc_grace_period': 100, 'vfdrc_tie_threshold': 0.25, 'vfdrc_rule_prediction': 'weighted_sum', 'vfdrc_max_rules': 30, 'vfdrc_expand_criterion': 'info_gain', 'vfdrc_remove_poor_atts': True}. Best is trial 10 with value: 0.991516.
Trial 8 finished with value: 0.6053435449254854 and parameters: {'vfdrc_ordered_rules': False, 'vfdrc_grace_period': 400, 'vfdrc_tie_threshold': 0.0, 'vfdrc_rule_prediction': 'weighted_sum', 'vfdrc_max_rules': 10, 'vfdrc_expand_criterion': 'foil_gain', 'vfdrc_remove_poor_atts': False}. Best is trial 10 with value: 0.991516.
Trial 13 finished with value: 0.4950746956839633 and parameters: {'vfdrc_ordered_rules': False, 'vfdrc_grace_period': 250, 'vfdrc_tie_threshold': 0.0, 'vfdrc_rule_prediction': 'weighted_sum', 'vfdrc_max_rules': 15, 'vfdrc_expand_criterion': 'hellinger', 'vfdrc_remove_poor_atts': True}. Best is trial 10 with value: 0.991516.
Trial 12 finished with value: 0.9059448697575218 and parameters: {'vfdrc_ordered_rules': False, 'vfdrc_grace_period': 200, 'vfdrc_tie_threshold': 0.1, 'vfdrc_rule_prediction': 'first_hit', 'vfdrc_max_rules': 15, 'vfdrc_expand_criterion': 'foil_gain', 'vfdrc_remove_poor_atts': True}. Best is trial 10 with value: 0.991516.
Trial 14 finished with value: 0.6653463553961163 and parameters: {'vfdrc_ordered_rules': False, 'vfdrc_grace_period': 250, 'vfdrc_tie_threshold': 0.35000000000000003, 'vfdrc_rule_prediction': 'weighted_max', 'vfdrc_max_rules': 40, 'vfdrc_expand_criterion': 'hellinger', 'vfdrc_remove_poor_atts': True}. Best is trial 10 with value: 0.991516.
Trial 15 finished with value: 0.9918415902398642 and parameters: {'vfdrc_ordered_rules': True, 'vfdrc_grace_period': 150, 'vfdrc_tie_threshold': 0.30000000000000004, 'vfdrc_rule_prediction': 'weighted_max', 'vfdrc_max_rules': 40, 'vfdrc_expand_criterion': 'info_gain', 'vfdrc_remove_poor_atts': False}. Best is trial 15 with value: 0.991842.
Trial 16 finished with value: 0.6072188113768175 and parameters: {'vfdrc_ordered_rules': False, 'vfdrc_grace_period': 300, 'vfdrc_tie_threshold': 0.45, 'vfdrc_rule_prediction': 'first_hit', 'vfdrc_max_rules': 15, 'vfdrc_expand_criterion': 'hellinger', 'vfdrc_remove_poor_atts': True}. Best is trial 15 with value: 0.991842.
Trial 17 finished with value: 0.8923355605218588 and parameters: {'vfdrc_ordered_rules': False, 'vfdrc_grace_period': 400, 'vfdrc_tie_threshold': 1.0, 'vfdrc_rule_prediction': 'weighted_sum', 'vfdrc_max_rules': 10, 'vfdrc_expand_criterion': 'info_gain', 'vfdrc_remove_poor_atts': True}. Best is trial 15 with value: 0.991842.
Trial 19 finished with value: 0.989264395523213 and parameters: {'vfdrc_ordered_rules': True, 'vfdrc_grace_period': 250, 'vfdrc_tie_threshold': 1.0, 'vfdrc_rule_prediction': 'first_hit', 'vfdrc_max_rules': 30, 'vfdrc_expand_criterion': 'info_gain', 'vfdrc_remove_poor_atts': True}. Best is trial 15 with value: 0.991842.
Trial 20 finished with value: 0.989264395523213 and parameters: {'vfdrc_ordered_rules': True, 'vfdrc_grace_period': 250, 'vfdrc_tie_threshold': 1.0, 'vfdrc_rule_prediction': 'first_hit', 'vfdrc_max_rules': 30, 'vfdrc_expand_criterion': 'info_gain', 'vfdrc_remove_poor_atts': True}. Best is trial 15 with value: 0.991842.
Trial 18 finished with value: 0.989264395523213 and parameters: {'vfdrc_ordered_rules': True, 'vfdrc_grace_period': 250, 'vfdrc_tie_threshold': 1.0, 'vfdrc_rule_prediction': 'first_hit', 'vfdrc_max_rules': 30, 'vfdrc_expand_criterion': 'info_gain', 'vfdrc_remove_poor_atts': True}. Best is trial 15 with value: 0.991842.
Trial 21 finished with value: 0.989264395523213 and parameters: {'vfdrc_ordered_rules': True, 'vfdrc_grace_period': 250, 'vfdrc_tie_threshold': 1.0, 'vfdrc_rule_prediction': 'first_hit', 'vfdrc_max_rules': 30, 'vfdrc_expand_criterion': 'info_gain', 'vfdrc_remove_poor_atts': True}. Best is trial 15 with value: 0.991842.
A new study created in RDB with name: XGBClassifier_59d7b7e2
Trial 3 finished with value: 0.6949265464263396 and parameters: {'xgbc_n_estimators': 10, 'xgbc_use_label_encoder': False, 'xgbc_learning_rate': 2.07653873454451e-05, 'xgbc_booster': 'gblinear', 'xgbc_gamma': 0.22671186513327285}. Best is trial 3 with value: 0.694927.
Trial 2 finished with value: 0.904753158385941 and parameters: {'xgbc_n_estimators': 110, 'xgbc_use_label_encoder': False, 'xgbc_learning_rate': 0.03716995398187815, 'xgbc_booster': 'gblinear', 'xgbc_gamma': 0.6271466908387336}. Best is trial 2 with value: 0.904753.
Trial 0 finished with value: 0.9872397701116491 and parameters: {'xgbc_n_estimators': 60, 'xgbc_use_label_encoder': False, 'xgbc_learning_rate': 3.313505370615692e-06, 'xgbc_booster': 'gbtree', 'xgbc_gamma': 4.330543129749256e-06}. Best is trial 0 with value: 0.98724.
Trial 5 finished with value: 0.9914811755725231 and parameters: {'xgbc_n_estimators': 50, 'xgbc_use_label_encoder': False, 'xgbc_learning_rate': 0.4410688891764449, 'xgbc_booster': 'gbtree', 'xgbc_gamma': 0.000656104432278572}. Best is trial 5 with value: 0.991481.
Trial 1 finished with value: 0.9872397701116491 and parameters: {'xgbc_n_estimators': 90, 'xgbc_use_label_encoder': False, 'xgbc_learning_rate': 4.189378787587197e-05, 'xgbc_booster': 'gbtree', 'xgbc_gamma': 0.00013915382042876763}. Best is trial 5 with value: 0.991481.
Trial 8 finished with value: 0.735410803640742 and parameters: {'xgbc_n_estimators': 110, 'xgbc_use_label_encoder': False, 'xgbc_learning_rate': 0.0001717121292097451, 'xgbc_booster': 'gblinear', 'xgbc_gamma': 1.9492775017737973e-06}. Best is trial 5 with value: 0.991481.
Trial 7 finished with value: 0.9916642499217347 and parameters: {'xgbc_n_estimators': 120, 'xgbc_use_label_encoder': False, 'xgbc_learning_rate': 0.4251910286561371, 'xgbc_booster': 'gbtree', 'xgbc_gamma': 0.0002161003665435954}. Best is trial 7 with value: 0.991664.
Trial 9 finished with value: 0.9872397701116491 and parameters: {'xgbc_n_estimators': 130, 'xgbc_use_label_encoder': False, 'xgbc_learning_rate': 3.8270470398761357e-05, 'xgbc_booster': 'dart', 'xgbc_gamma': 3.4151460990137385e-05}. Best is trial 7 with value: 0.991664.
Trial 6 finished with value: 0.987430427654197 and parameters: {'xgbc_n_estimators': 150, 'xgbc_use_label_encoder': False, 'xgbc_learning_rate': 0.00036606914665857754, 'xgbc_booster': 'dart', 'xgbc_gamma': 0.8152183762063173}. Best is trial 7 with value: 0.991664.
