Trial 19 finished with value: 0.9915786905749213 and parameters: {'brf_n_estimators': 50, 'brf_criterion': 'entropy', 'brf_min_samples_split': 20, 'brf_min_samples_leaf': 1, 'brf_max_features': 47, 'brf_bootstrap': True}. Best is trial 13 with value: 0.991776.
sklearn.ensemble.RandomForestClassifier.predict: fallback to original Scikit-learn
sklearn.ensemble.RandomForestClassifier.predict_proba: fallback to original Scikit-learn
sklearn.ensemble.RandomForestClassifier.predict: fallback to original Scikit-learn
sklearn.ensemble.RandomForestClassifier.predict_proba: fallback to original Scikit-learn
Trial 18 finished with value: 0.9916866356940865 and parameters: {'brf_n_estimators': 70, 'brf_criterion': 'entropy', 'brf_min_samples_split': 31, 'brf_min_samples_leaf': 2, 'brf_max_features': 44, 'brf_bootstrap': True}. Best is trial 13 with value: 0.991776.
sklearn.ensemble.RandomForestClassifier.predict: fallback to original Scikit-learn
sklearn.ensemble.RandomForestClassifier.predict_proba: fallback to original Scikit-learn
Trial 16 finished with value: 0.9914821776447623 and parameters: {'brf_n_estimators': 90, 'brf_criterion': 'entropy', 'brf_min_samples_split': 24, 'brf_min_samples_leaf': 33, 'brf_max_features': 22, 'brf_bootstrap': False}. Best is trial 13 with value: 0.991776.
sklearn.ensemble.RandomForestClassifier.predict: fallback to original Scikit-learn
sklearn.ensemble.RandomForestClassifier.predict_proba: fallback to original Scikit-learn
sklearn.ensemble.RandomForestClassifier.predict: fallback to original Scikit-learn
sklearn.ensemble.RandomForestClassifier.predict_proba: fallback to original Scikit-learn
Trial 11 finished with value: 0.9914976968610691 and parameters: {'brf_n_estimators': 180, 'brf_criterion': 'entropy', 'brf_min_samples_split': 50, 'brf_min_samples_leaf': 1, 'brf_max_features': 4, 'brf_bootstrap': True}. Best is trial 13 with value: 0.991776.
Trial 10 finished with value: 0.9913034026363814 and parameters: {'brf_n_estimators': 190, 'brf_criterion': 'entropy', 'brf_min_samples_split': 42, 'brf_min_samples_leaf': 43, 'brf_max_features': 4, 'brf_bootstrap': True}. Best is trial 13 with value: 0.991776.
Trial 14 finished with value: 0.9913656627527014 and parameters: {'brf_n_estimators': 170, 'brf_criterion': 'entropy', 'brf_min_samples_split': 48, 'brf_min_samples_leaf': 28, 'brf_max_features': 4, 'brf_bootstrap': False}. Best is trial 13 with value: 0.991776.
sklearn.ensemble.RandomForestClassifier.predict: fallback to original Scikit-learn
sklearn.ensemble.RandomForestClassifier.predict_proba: fallback to original Scikit-learn
sklearn.ensemble.RandomForestClassifier.predict: fallback to original Scikit-learn
sklearn.ensemble.RandomForestClassifier.predict_proba: fallback to original Scikit-learn
sklearn.ensemble.RandomForestClassifier.predict: fallback to original Scikit-learn
sklearn.ensemble.RandomForestClassifier.predict_proba: fallback to original Scikit-learn
Trial 20 finished with value: 0.9917383302904215 and parameters: {'brf_n_estimators': 80, 'brf_criterion': 'gini', 'brf_min_samples_split': 17, 'brf_min_samples_leaf': 1, 'brf_max_features': 43, 'brf_bootstrap': True}. Best is trial 13 with value: 0.991776.
Trial 21 finished with value: 0.9911264363033525 and parameters: {'brf_n_estimators': 80, 'brf_criterion': 'gini', 'brf_min_samples_split': 15, 'brf_min_samples_leaf': 26, 'brf_max_features': 39, 'brf_bootstrap': True}. Best is trial 13 with value: 0.991776.
Trial 15 finished with value: 0.9911413295734213 and parameters: {'brf_n_estimators': 170, 'brf_criterion': 'entropy', 'brf_min_samples_split': 13, 'brf_min_samples_leaf': 16, 'brf_max_features': 43, 'brf_bootstrap': True}. Best is trial 13 with value: 0.991776.
sklearn.ensemble.RandomForestClassifier.predict: fallback to original Scikit-learn
sklearn.ensemble.RandomForestClassifier.predict_proba: fallback to original Scikit-learn
Trial 22 finished with value: 0.9910354905585385 and parameters: {'brf_n_estimators': 80, 'brf_criterion': 'gini', 'brf_min_samples_split': 15, 'brf_min_samples_leaf': 50, 'brf_max_features': 39, 'brf_bootstrap': True}. Best is trial 13 with value: 0.991776.
sklearn.ensemble.RandomForestClassifier.predict: fallback to original Scikit-learn
sklearn.ensemble.RandomForestClassifier.predict_proba: fallback to original Scikit-learn
sklearn.ensemble.RandomForestClassifier.predict: fallback to original Scikit-learn
sklearn.ensemble.RandomForestClassifier.predict_proba: fallback to original Scikit-learn
Trial 24 finished with value: 0.9909817014202255 and parameters: {'brf_n_estimators': 70, 'brf_criterion': 'gini', 'brf_min_samples_split': 12, 'brf_min_samples_leaf': 50, 'brf_max_features': 41, 'brf_bootstrap': True}. Best is trial 13 with value: 0.991776.
Trial 25 finished with value: 0.9909817014202255 and parameters: {'brf_n_estimators': 70, 'brf_criterion': 'gini', 'brf_min_samples_split': 14, 'brf_min_samples_leaf': 50, 'brf_max_features': 41, 'brf_bootstrap': True}. Best is trial 13 with value: 0.991776.
sklearn.ensemble.RandomForestClassifier.predict: fallback to original Scikit-learn
sklearn.ensemble.RandomForestClassifier.predict_proba: fallback to original Scikit-learn
Trial 23 finished with value: 0.9909124434422029 and parameters: {'brf_n_estimators': 110, 'brf_criterion': 'gini', 'brf_min_samples_split': 14, 'brf_min_samples_leaf': 48, 'brf_max_features': 40, 'brf_bootstrap': True}. Best is trial 13 with value: 0.991776.
sklearn.ensemble.RandomForestClassifier.predict: fallback to original Scikit-learn
sklearn.ensemble.RandomForestClassifier.predict_proba: fallback to original Scikit-learn
sklearn.ensemble.RandomForestClassifier.predict: fallback to original Scikit-learn
sklearn.ensemble.RandomForestClassifier.predict_proba: fallback to original Scikit-learn
sklearn.ensemble.RandomForestClassifier.predict: fallback to original Scikit-learn
sklearn.ensemble.RandomForestClassifier.predict_proba: fallback to original Scikit-learn
sklearn.ensemble.RandomForestClassifier.predict: fallback to original Scikit-learn
sklearn.ensemble.RandomForestClassifier.predict_proba: fallback to original Scikit-learn
Trial 27 finished with value: 0.9911040286405233 and parameters: {'brf_n_estimators': 70, 'brf_criterion': 'gini', 'brf_min_samples_split': 14, 'brf_min_samples_leaf': 50, 'brf_max_features': 38, 'brf_bootstrap': True}. Best is trial 13 with value: 0.991776.
Trial 26 finished with value: 0.991019874315658 and parameters: {'brf_n_estimators': 110, 'brf_criterion': 'gini', 'brf_min_samples_split': 15, 'brf_min_samples_leaf': 50, 'brf_max_features': 41, 'brf_bootstrap': True}. Best is trial 13 with value: 0.991776.
Trial 28 finished with value: 0.9917467457161641 and parameters: {'brf_n_estimators': 70, 'brf_criterion': 'gini', 'brf_min_samples_split': 15, 'brf_min_samples_leaf': 7, 'brf_max_features': 42, 'brf_bootstrap': True}. Best is trial 13 with value: 0.991776.
Trial 29 finished with value: 0.9910115569318502 and parameters: {'brf_n_estimators': 70, 'brf_criterion': 'gini', 'brf_min_samples_split': 19, 'brf_min_samples_leaf': 50, 'brf_max_features': 33, 'brf_bootstrap': True}. Best is trial 13 with value: 0.991776.
A new study created in RDB with name: BernoulliNB_59d7b7e2
Trial 6 finished with value: 0.07399138544370873 and parameters: {'bnb_alpha': 0.0, 'bnb_binarize': 0.45, 'bnb_fit_prior': False}. Best is trial 6 with value: 0.0739914.
Trial 2 finished with value: 0.820286900220342 and parameters: {'bnb_alpha': 0.4, 'bnb_binarize': 0.7000000000000001, 'bnb_fit_prior': False}. Best is trial 1 with value: 0.820287.
Trial 1 finished with value: 0.820286900220342 and parameters: {'bnb_alpha': 0.9500000000000001, 'bnb_binarize': 0.5, 'bnb_fit_prior': False}. Best is trial 1 with value: 0.820287.
Trial 0 finished with value: 0.8468527798566332 and parameters: {'bnb_alpha': 0.30000000000000004, 'bnb_binarize': 0.2, 'bnb_fit_prior': True}. Best is trial 5 with value: 0.846879.
Trial 5 finished with value: 0.846879304059287 and parameters: {'bnb_alpha': 0.1, 'bnb_binarize': 0.75, 'bnb_fit_prior': True}. Best is trial 5 with value: 0.846879.
Trial 4 finished with value: 0.8468527798566332 and parameters: {'bnb_alpha': 0.9, 'bnb_binarize': 0.15000000000000002, 'bnb_fit_prior': True}. Best is trial 5 with value: 0.846879.
Trial 3 finished with value: 0.820286900220342 and parameters: {'bnb_alpha': 0.8500000000000001, 'bnb_binarize': 0.25, 'bnb_fit_prior': False}. Best is trial 5 with value: 0.846879.
Trial 7 finished with value: 0.820286900220342 and parameters: {'bnb_alpha': 0.55, 'bnb_binarize': 0.25, 'bnb_fit_prior': False}. Best is trial 5 with value: 0.846879.
Trial 8 finished with value: 0.8468527798566332 and parameters: {'bnb_alpha': 0.8, 'bnb_binarize': 0.1, 'bnb_fit_prior': True}. Best is trial 5 with value: 0.846879.
Trial 9 finished with value: 0.8468527798566332 and parameters: {'bnb_alpha': 1.0, 'bnb_binarize': 0.45, 'bnb_fit_prior': True}. Best is trial 5 with value: 0.846879.
Trial 10 finished with value: 0.8468527798566332 and parameters: {'bnb_alpha': 0.9500000000000001, 'bnb_binarize': 0.65, 'bnb_fit_prior': True}. Best is trial 5 with value: 0.846879.
Trial 13 finished with value: 0.820286900220342 and parameters: {'bnb_alpha': 1.0, 'bnb_binarize': 0.15000000000000002, 'bnb_fit_prior': False}. Best is trial 5 with value: 0.846879.
Trial 12 finished with value: 0.7941632140503269 and parameters: {'bnb_alpha': 1.0, 'bnb_binarize': 1.0, 'bnb_fit_prior': True}. Best is trial 5 with value: 0.846879.
Trial 14 finished with value: 0.8468527798566332 and parameters: {'bnb_alpha': 0.8500000000000001, 'bnb_binarize': 0.2, 'bnb_fit_prior': True}. Best is trial 5 with value: 0.846879.
Trial 11 finished with value: 0.820286900220342 and parameters: {'bnb_alpha': 0.75, 'bnb_binarize': 0.15000000000000002, 'bnb_fit_prior': False}. Best is trial 5 with value: 0.846879.
Trial 15 finished with value: 0.820286900220342 and parameters: {'bnb_alpha': 0.6000000000000001, 'bnb_binarize': 0.25, 'bnb_fit_prior': False}. Best is trial 5 with value: 0.846879.
Trial 16 finished with value: 0.820286900220342 and parameters: {'bnb_alpha': 0.35000000000000003, 'bnb_binarize': 0.30000000000000004, 'bnb_fit_prior': False}. Best is trial 5 with value: 0.846879.
Trial 17 finished with value: 0.8468527798566332 and parameters: {'bnb_alpha': 0.15000000000000002, 'bnb_binarize': 0.9, 'bnb_fit_prior': True}. Best is trial 5 with value: 0.846879.
Trial 21 finished with value: 0.8468527798566332 and parameters: {'bnb_alpha': 0.15000000000000002, 'bnb_binarize': 0.9500000000000001, 'bnb_fit_prior': True}. Best is trial 5 with value: 0.846879.
Trial 19 finished with value: 0.8468527798566332 and parameters: {'bnb_alpha': 0.2, 'bnb_binarize': 0.9, 'bnb_fit_prior': True}. Best is trial 5 with value: 0.846879.
Trial 22 finished with value: 0.8468527798566332 and parameters: {'bnb_alpha': 0.15000000000000002, 'bnb_binarize': 0.9, 'bnb_fit_prior': True}. Best is trial 5 with value: 0.846879.
Trial 20 finished with value: 0.8468527798566332 and parameters: {'bnb_alpha': 0.15000000000000002, 'bnb_binarize': 0.9, 'bnb_fit_prior': True}. Best is trial 5 with value: 0.846879.
Trial 18 finished with value: 0.8468527798566332 and parameters: {'bnb_alpha': 0.15000000000000002, 'bnb_binarize': 0.9, 'bnb_fit_prior': True}. Best is trial 5 with value: 0.846879.
Trial 23 finished with value: 0.8468527798566332 and parameters: {'bnb_alpha': 0.15000000000000002, 'bnb_binarize': 0.9, 'bnb_fit_prior': True}. Best is trial 5 with value: 0.846879.
Trial 24 finished with value: 0.846879304059287 and parameters: {'bnb_alpha': 0.1, 'bnb_binarize': 0.0, 'bnb_fit_prior': True}. Best is trial 24 with value: 0.846879.
Trial 25 finished with value: 0.8468527798566332 and parameters: {'bnb_alpha': 0.2, 'bnb_binarize': 0.0, 'bnb_fit_prior': True}. Best is trial 5 with value: 0.846879.
Trial 28 finished with value: 0.07399138544370873 and parameters: {'bnb_alpha': 0.0, 'bnb_binarize': 0.75, 'bnb_fit_prior': True}. Best is trial 5 with value: 0.846879.
Trial 27 finished with value: 0.07399138544370873 and parameters: {'bnb_alpha': 0.0, 'bnb_binarize': 0.0, 'bnb_fit_prior': True}. Best is trial 5 with value: 0.846879.
Trial 29 finished with value: 0.07399138544370873 and parameters: {'bnb_alpha': 0.0, 'bnb_binarize': 0.75, 'bnb_fit_prior': True}. Best is trial 5 with value: 0.846879.
Trial 26 finished with value: 0.07399138544370873 and parameters: {'bnb_alpha': 0.0, 'bnb_binarize': 0.0, 'bnb_fit_prior': True}. Best is trial 5 with value: 0.846879.
A new study created in RDB with name: CDClassifier_59d7b7e2
Trial 1 finished with value: 0.9047058204139466 and parameters: {'cdc_loss': 'squared', 'cdc_penalty': 'l2', 'cdc_C': 270.05245600065666, 'cdc_alpha': 0.0026985728051145174, 'cdc_selection': 'cyclic'}. Best is trial 1 with value: 0.904706.
Trial 3 finished with value: 0.9034013210570218 and parameters: {'cdc_loss': 'log', 'cdc_penalty': 'l2', 'cdc_C': 0.03339447451065733, 'cdc_alpha': 0.10148446555624585, 'cdc_selection': 'uniform'}. Best is trial 1 with value: 0.904706.
Trial 5 finished with value: 0.9047058204139466 and parameters: {'cdc_loss': 'squared', 'cdc_penalty': 'l2', 'cdc_C': 1.6057895634387371, 'cdc_alpha': 0.06735654714726291, 'cdc_selection': 'cyclic'}. Best is trial 1 with value: 0.904706.
Trial 7 finished with value: 0.9047058204139466 and parameters: {'cdc_loss': 'squared', 'cdc_penalty': 'l2', 'cdc_C': 0.0722396285502132, 'cdc_alpha': 0.1508244250513258, 'cdc_selection': 'uniform'}. Best is trial 1 with value: 0.952226.
Trial 6 finished with value: 0.9522263948828233 and parameters: {'cdc_loss': 'squared_hinge', 'cdc_penalty': 'l1', 'cdc_C': 26.55112304687146, 'cdc_alpha': 154.99740696812665, 'cdc_selection': 'cyclic'}. Best is trial 6 with value: 0.952226.
Trial 0 finished with value: 0.8425951392387289 and parameters: {'cdc_loss': 'log', 'cdc_penalty': 'l1', 'cdc_C': 0.0021958553751835917, 'cdc_alpha': 12.839510935832296, 'cdc_selection': 'uniform'}. Best is trial 1 with value: 0.952226.
Trial 2 finished with value: 0.9246988499895054 and parameters: {'cdc_loss': 'squared_hinge', 'cdc_penalty': 'l1/l2', 'cdc_C': 20.948045318522535, 'cdc_alpha': 0.7258586508129203, 'cdc_selection': 'uniform'}. Best is trial 6 with value: 0.952226.
Trial 8 finished with value: 0.899037390609772 and parameters: {'cdc_loss': 'modified_huber', 'cdc_penalty': 'l1/l2', 'cdc_C': 6.660165504350817, 'cdc_alpha': 0.06767165070595221, 'cdc_selection': 'uniform'}. Best is trial 6 with value: 0.952226.
Trial 4 finished with value: 0.12388641062088446 and parameters: {'cdc_loss': 'squared', 'cdc_penalty': 'l1/l2', 'cdc_C': 0.011341274279805757, 'cdc_alpha': 155.38443162065988, 'cdc_selection': 'uniform'}. Best is trial 6 with value: 0.952226.
Trial 9 finished with value: 0.9043367710387782 and parameters: {'cdc_loss': 'squared_hinge', 'cdc_penalty': 'l2', 'cdc_C': 0.0062299978177542065, 'cdc_alpha': 2.807205012149027, 'cdc_selection': 'uniform'}. Best is trial 6 with value: 0.952226.
Trial 10 finished with value: 0.9437568455056132 and parameters: {'cdc_loss': 'log', 'cdc_penalty': 'l1', 'cdc_C': 10.106423523831912, 'cdc_alpha': 54.172937565675795, 'cdc_selection': 'cyclic'}. Best is trial 6 with value: 0.952226.
Trial 12 finished with value: 0.9047058204139466 and parameters: {'cdc_loss': 'squared', 'cdc_penalty': 'l2', 'cdc_C': 0.0935783622521438, 'cdc_alpha': 0.0029015268419718397, 'cdc_selection': 'cyclic'}. Best is trial 6 with value: 0.952226.
Trial 11 finished with value: 0.9516486670808776 and parameters: {'cdc_loss': 'modified_huber', 'cdc_penalty': 'l2', 'cdc_C': 0.002768761537648717, 'cdc_alpha': 0.010864034799425385, 'cdc_selection': 'cyclic'}. Best is trial 6 with value: 0.952226.
Trial 14 finished with value: 0.00128765656199791 and parameters: {'cdc_loss': 'log', 'cdc_penalty': 'l2', 'cdc_C': 26.156032523211955, 'cdc_alpha': 0.005394354533564468, 'cdc_selection': 'cyclic'}. Best is trial 6 with value: 0.952226.
Trial 15 finished with value: 0.9439667372244748 and parameters: {'cdc_loss': 'log', 'cdc_penalty': 'l1', 'cdc_C': 26.427395588011223, 'cdc_alpha': 161.40143495622493, 'cdc_selection': 'cyclic'}. Best is trial 6 with value: 0.952226.
Trial 16 finished with value: 0.8753004457926267 and parameters: {'cdc_loss': 'squared_hinge', 'cdc_penalty': 'l1/l2', 'cdc_C': 0.01041148326151792, 'cdc_alpha': 0.025800318636219146, 'cdc_selection': 'uniform'}. Best is trial 6 with value: 0.952226.
Trial 13 finished with value: 0.07399138544370873 and parameters: {'cdc_loss': 'squared', 'cdc_penalty': 'l1/l2', 'cdc_C': 0.20442633221614448, 'cdc_alpha': 0.18402732456022844, 'cdc_selection': 'cyclic'}. Best is trial 6 with value: 0.952226.
Trial 18 finished with value: 0.9474493966327007 and parameters: {'cdc_loss': 'modified_huber', 'cdc_penalty': 'l1', 'cdc_C': 628.5661789584086, 'cdc_alpha': 735.4516749150812, 'cdc_selection': 'cyclic'}. Best is trial 6 with value: 0.952226.
Trial 17 finished with value: 0.9480223858962683 and parameters: {'cdc_loss': 'modified_huber', 'cdc_penalty': 'l1', 'cdc_C': 404.31681735398166, 'cdc_alpha': 438.30742353102346, 'cdc_selection': 'cyclic'}. Best is trial 6 with value: 0.952226.
Trial 19 finished with value: 0.9481374811942757 and parameters: {'cdc_loss': 'modified_huber', 'cdc_penalty': 'l1', 'cdc_C': 666.9601431938747, 'cdc_alpha': 702.7424368444578, 'cdc_selection': 'cyclic'}. Best is trial 6 with value: 0.954952.
Trial 20 finished with value: 0.9496888362228734 and parameters: {'cdc_loss': 'modified_huber', 'cdc_penalty': 'l1', 'cdc_C': 706.4348652220485, 'cdc_alpha': 539.6280138658012, 'cdc_selection': 'cyclic'}. Best is trial 6 with value: 0.954952.
Trial 21 finished with value: 0.9520590625560326 and parameters: {'cdc_loss': 'modified_huber', 'cdc_penalty': 'l1', 'cdc_C': 590.4436614208026, 'cdc_alpha': 867.4017385140096, 'cdc_selection': 'cyclic'}. Best is trial 6 with value: 0.954952.
Trial 22 finished with value: 0.9549519302413246 and parameters: {'cdc_loss': 'modified_huber', 'cdc_penalty': 'l1', 'cdc_C': 664.3384914999438, 'cdc_alpha': 848.5100177751872, 'cdc_selection': 'cyclic'}. Best is trial 22 with value: 0.954952.
A new study created in RDB with name: ComplementNB_59d7b7e2
Trial 1 finished with value: 0.418140026134891 and parameters: {'compnb_alpha': 0.9, 'compnb_fit_prior': True, 'compnb_norm': False}. Best is trial 1 with value: 0.41814.
Trial 3 finished with value: 0.418140026134891 and parameters: {'compnb_alpha': 0.75, 'compnb_fit_prior': False, 'compnb_norm': False}. Best is trial 1 with value: 0.41814.
Trial 7 finished with value: 0.418140026134891 and parameters: {'compnb_alpha': 0.25, 'compnb_fit_prior': False, 'compnb_norm': False}. Best is trial 1 with value: 0.41814.
Trial 6 finished with value: 0.418140026134891 and parameters: {'compnb_alpha': 0.5, 'compnb_fit_prior': True, 'compnb_norm': False}. Best is trial 1 with value: 0.41814.
Trial 0 finished with value: 0.418140026134891 and parameters: {'compnb_alpha': 0.75, 'compnb_fit_prior': True, 'compnb_norm': False}. Best is trial 0 with value: 0.41814.
Trial 2 finished with value: 0.418140026134891 and parameters: {'compnb_alpha': 0.35000000000000003, 'compnb_fit_prior': True, 'compnb_norm': False}. Best is trial 0 with value: 0.41814.
Trial 4 finished with value: 0.418140026134891 and parameters: {'compnb_alpha': 0.6000000000000001, 'compnb_fit_prior': False, 'compnb_norm': False}. Best is trial 0 with value: 0.41814.
Trial 5 finished with value: 0.4181364617997549 and parameters: {'compnb_alpha': 0.8, 'compnb_fit_prior': True, 'compnb_norm': True}. Best is trial 0 with value: 0.41814.
Trial 8 finished with value: 0.418140026134891 and parameters: {'compnb_alpha': 0.35000000000000003, 'compnb_fit_prior': True, 'compnb_norm': False}. Best is trial 0 with value: 0.41814.
Trial 13 finished with value: 0.418140026134891 and parameters: {'compnb_alpha': 1.0, 'compnb_fit_prior': False, 'compnb_norm': False}. Best is trial 0 with value: 0.41814.
Trial 11 finished with value: 0.4180723565736698 and parameters: {'compnb_alpha': 0.15000000000000002, 'compnb_fit_prior': False, 'compnb_norm': True}. Best is trial 0 with value: 0.41814.
Trial 12 finished with value: 0.4181364617997549 and parameters: {'compnb_alpha': 0.45, 'compnb_fit_prior': True, 'compnb_norm': True}. Best is trial 0 with value: 0.41814.
Trial 9 finished with value: 0.3649747495333992 and parameters: {'compnb_alpha': 0.0, 'compnb_fit_prior': False, 'compnb_norm': True}. Best is trial 0 with value: 0.41814.
Trial 14 finished with value: 0.418140026134891 and parameters: {'compnb_alpha': 0.75, 'compnb_fit_prior': False, 'compnb_norm': False}. Best is trial 0 with value: 0.41814.
Trial 10 finished with value: 0.418140026134891 and parameters: {'compnb_alpha': 0.7000000000000001, 'compnb_fit_prior': True, 'compnb_norm': False}. Best is trial 0 with value: 0.41814.
Trial 15 finished with value: 0.4181364617997549 and parameters: {'compnb_alpha': 0.35000000000000003, 'compnb_fit_prior': True, 'compnb_norm': True}. Best is trial 0 with value: 0.41814.
Trial 16 finished with value: 0.418140026134891 and parameters: {'compnb_alpha': 0.1, 'compnb_fit_prior': True, 'compnb_norm': False}. Best is trial 0 with value: 0.41814.
Trial 17 finished with value: 0.418140026134891 and parameters: {'compnb_alpha': 1.0, 'compnb_fit_prior': True, 'compnb_norm': False}. Best is trial 0 with value: 0.41814.
Trial 19 finished with value: 0.418140026134891 and parameters: {'compnb_alpha': 1.0, 'compnb_fit_prior': True, 'compnb_norm': False}. Best is trial 0 with value: 0.41814.
Trial 20 finished with value: 0.418140026134891 and parameters: {'compnb_alpha': 1.0, 'compnb_fit_prior': True, 'compnb_norm': False}. Best is trial 0 with value: 0.41814.
Trial 21 finished with value: 0.418140026134891 and parameters: {'compnb_alpha': 0.9, 'compnb_fit_prior': True, 'compnb_norm': False}. Best is trial 0 with value: 0.41814.
