Trial 7 finished with value: 0.6696294581842411 and parameters: {'gnb_var_smoothing': 1.164112060182942e-07}. Best is trial 3 with value: 0.765197.
Trial 3 finished with value: 0.7651966220995982 and parameters: {'gnb_var_smoothing': 3.426807083842993e-09}. Best is trial 3 with value: 0.765197.
Trial 5 finished with value: 0.418180217987376 and parameters: {'gnb_var_smoothing': 2.713955353401477e-05}. Best is trial 3 with value: 0.846688.
Trial 4 finished with value: 0.4889047177533818 and parameters: {'gnb_var_smoothing': 5.190530325356079e-06}. Best is trial 3 with value: 0.846688.
Trial 6 finished with value: 0.8466877773395726 and parameters: {'gnb_var_smoothing': 1.6298403863510592e-10}. Best is trial 6 with value: 0.846688.
Trial 8 finished with value: 0.41854085975120847 and parameters: {'gnb_var_smoothing': 2.5538567933827078e-05}. Best is trial 6 with value: 0.846688.
Trial 9 finished with value: 0.8465855050400053 and parameters: {'gnb_var_smoothing': 1.055368773649322e-11}. Best is trial 6 with value: 0.846688.
Trial 12 finished with value: 0.2844441188051378 and parameters: {'gnb_var_smoothing': 80.59051200870309}. Best is trial 6 with value: 0.846688.
Trial 13 finished with value: 0.4021113570115769 and parameters: {'gnb_var_smoothing': 2.028111607807097}. Best is trial 6 with value: 0.846688.
Trial 11 finished with value: 0.4954070138858866 and parameters: {'gnb_var_smoothing': 4.578813311519458e-06}. Best is trial 6 with value: 0.846688.
Trial 14 finished with value: 0.2844441188051378 and parameters: {'gnb_var_smoothing': 164.14593904775543}. Best is trial 6 with value: 0.846688.
Trial 10 finished with value: 0.8531441313438012 and parameters: {'gnb_var_smoothing': 5.226750605485029e-10}. Best is trial 10 with value: 0.853144.
Trial 15 finished with value: 0.8466495576337942 and parameters: {'gnb_var_smoothing': 1.043852468798546e-10}. Best is trial 10 with value: 0.853144.
Trial 16 finished with value: 0.8465855050400053 and parameters: {'gnb_var_smoothing': 8.922613768799831e-12}. Best is trial 10 with value: 0.853144.
Trial 17 finished with value: 0.8466648170068484 and parameters: {'gnb_var_smoothing': 2.7141454895600674e-12}. Best is trial 10 with value: 0.853144.
Trial 19 finished with value: 0.8466648170068484 and parameters: {'gnb_var_smoothing': 1.1474343781012663e-12}. Best is trial 22 with value: 0.861087.
Trial 18 finished with value: 0.8466648170068484 and parameters: {'gnb_var_smoothing': 1.9727523477626402e-12}. Best is trial 23 with value: 0.861087.
Trial 20 finished with value: 0.8466648170068484 and parameters: {'gnb_var_smoothing': 3.690685391690149e-12}. Best is trial 23 with value: 0.861087.
Trial 23 finished with value: 0.8610868995390716 and parameters: {'gnb_var_smoothing': 1.1397261663924377e-09}. Best is trial 23 with value: 0.861087.
Trial 22 finished with value: 0.8610792879659802 and parameters: {'gnb_var_smoothing': 1.1700271035256994e-09}. Best is trial 23 with value: 0.861087.
Trial 21 finished with value: 0.8528697250987682 and parameters: {'gnb_var_smoothing': 1.504881199126508e-09}. Best is trial 23 with value: 0.861087.
Trial 24 finished with value: 0.7742648330528706 and parameters: {'gnb_var_smoothing': 2.7464894351929008e-09}. Best is trial 23 with value: 0.861087.
Trial 25 finished with value: 0.7817018409994573 and parameters: {'gnb_var_smoothing': 2.549809115721956e-09}. Best is trial 23 with value: 0.861087.
Trial 26 finished with value: 0.6796078131571233 and parameters: {'gnb_var_smoothing': 9.212904353408319e-08}. Best is trial 23 with value: 0.861087.
Trial 29 finished with value: 0.6824842628292083 and parameters: {'gnb_var_smoothing': 8.907586561590203e-08}. Best is trial 23 with value: 0.861087.
Trial 28 finished with value: 0.7256976092252486 and parameters: {'gnb_var_smoothing': 6.165742965377878e-08}. Best is trial 23 with value: 0.861087.
Trial 27 finished with value: 0.6958729254032309 and parameters: {'gnb_var_smoothing': 7.711927998385066e-08}. Best is trial 23 with value: 0.861087.
A new study created in RDB with name: HistGradientBoostingClassifier_59d7b7e2
Trial 2 finished with value: 0.9916417300344752 and parameters: {'hgbc_learning_rate': 0.2477445537287421, 'hgbc_max_iter': 2000, 'hgbc_min_samples_leaf': 4, 'hgbc_l2_regularization': 0.8, 'hgbc_max_bins': 63, 'hgbc_early_stopping': True, 'hgbc_validation_fraction': 0.25, 'hgbc_n_iter_no_change': 10}. Best is trial 2 with value: 0.991642.
Trial 3 finished with value: 0.9916645142933037 and parameters: {'hgbc_learning_rate': 0.057408634324705145, 'hgbc_max_iter': 2000, 'hgbc_min_samples_leaf': 1, 'hgbc_l2_regularization': 0.8, 'hgbc_max_bins': 63, 'hgbc_early_stopping': True, 'hgbc_validation_fraction': 0.25, 'hgbc_n_iter_no_change': 10}. Best is trial 3 with value: 0.991665.
Trial 4 finished with value: 0.9915348872746714 and parameters: {'hgbc_learning_rate': 0.04350399253650977, 'hgbc_max_iter': 2000, 'hgbc_min_samples_leaf': 13, 'hgbc_l2_regularization': 0.6000000000000001, 'hgbc_max_bins': 127, 'hgbc_early_stopping': True, 'hgbc_validation_fraction': 0.25, 'hgbc_n_iter_no_change': 10}. Best is trial 3 with value: 0.991665.
Trial 9 finished with value: 0.9916491483958059 and parameters: {'hgbc_learning_rate': 0.7051552705400642, 'hgbc_max_iter': 2000, 'hgbc_min_samples_leaf': 33, 'hgbc_l2_regularization': 0.6000000000000001, 'hgbc_max_bins': 127, 'hgbc_early_stopping': True, 'hgbc_validation_fraction': 0.25, 'hgbc_n_iter_no_change': 10}. Best is trial 3 with value: 0.991665.
Trial 11 finished with value: 0.9917478975237536 and parameters: {'hgbc_learning_rate': 0.27788158890102665, 'hgbc_max_iter': 2000, 'hgbc_min_samples_leaf': 21, 'hgbc_l2_regularization': 0.0, 'hgbc_max_bins': 255, 'hgbc_early_stopping': True, 'hgbc_validation_fraction': 0.25, 'hgbc_n_iter_no_change': 10}. Best is trial 11 with value: 0.991748.
Trial 12 finished with value: 0.9916195117219755 and parameters: {'hgbc_learning_rate': 0.35475332090555856, 'hgbc_max_iter': 2000, 'hgbc_min_samples_leaf': 27, 'hgbc_l2_regularization': 0.8, 'hgbc_max_bins': 63, 'hgbc_early_stopping': True, 'hgbc_validation_fraction': 0.25, 'hgbc_n_iter_no_change': 10}. Best is trial 11 with value: 0.991748.
Trial 10 finished with value: 0.9914206682982459 and parameters: {'hgbc_learning_rate': 0.06351005223105495, 'hgbc_max_iter': 2000, 'hgbc_min_samples_leaf': 35, 'hgbc_l2_regularization': 0.8, 'hgbc_max_bins': 127, 'hgbc_early_stopping': True, 'hgbc_validation_fraction': 0.25, 'hgbc_n_iter_no_change': 10}. Best is trial 11 with value: 0.991748.
Trial 14 finished with value: 0.9706615611059073 and parameters: {'hgbc_learning_rate': 0.7188178017494044, 'hgbc_max_iter': 2000, 'hgbc_min_samples_leaf': 44, 'hgbc_l2_regularization': 0.2, 'hgbc_max_bins': 127, 'hgbc_early_stopping': True, 'hgbc_validation_fraction': 0.25, 'hgbc_n_iter_no_change': 10}. Best is trial 11 with value: 0.991748.
Trial 15 finished with value: 0.9915494105080623 and parameters: {'hgbc_learning_rate': 0.21326065613306738, 'hgbc_max_iter': 2000, 'hgbc_min_samples_leaf': 25, 'hgbc_l2_regularization': 0.2, 'hgbc_max_bins': 255, 'hgbc_early_stopping': True, 'hgbc_validation_fraction': 0.25, 'hgbc_n_iter_no_change': 10}. Best is trial 11 with value: 0.991748.
Trial 8 finished with value: 0.9915039972613682 and parameters: {'hgbc_learning_rate': 0.033334046734536625, 'hgbc_max_iter': 2000, 'hgbc_min_samples_leaf': 30, 'hgbc_l2_regularization': 0.0, 'hgbc_max_bins': 255, 'hgbc_early_stopping': True, 'hgbc_validation_fraction': 0.25, 'hgbc_n_iter_no_change': 10}. Best is trial 11 with value: 0.991748.
Trial 7 finished with value: 0.9915267421518729 and parameters: {'hgbc_learning_rate': 0.01403764439302559, 'hgbc_max_iter': 2000, 'hgbc_min_samples_leaf': 13, 'hgbc_l2_regularization': 0.2, 'hgbc_max_bins': 127, 'hgbc_early_stopping': True, 'hgbc_validation_fraction': 0.25, 'hgbc_n_iter_no_change': 10}. Best is trial 11 with value: 0.991748.
Trial 13 finished with value: 0.9916025494000212 and parameters: {'hgbc_learning_rate': 0.04699300501145413, 'hgbc_max_iter': 2000, 'hgbc_min_samples_leaf': 35, 'hgbc_l2_regularization': 0.0, 'hgbc_max_bins': 255, 'hgbc_early_stopping': True, 'hgbc_validation_fraction': 0.25, 'hgbc_n_iter_no_change': 10}. Best is trial 11 with value: 0.991748.
Trial 5 finished with value: 0.9916479675736699 and parameters: {'hgbc_learning_rate': 0.008564718356963376, 'hgbc_max_iter': 2000, 'hgbc_min_samples_leaf': 20, 'hgbc_l2_regularization': 1.0, 'hgbc_max_bins': 255, 'hgbc_early_stopping': True, 'hgbc_validation_fraction': 0.25, 'hgbc_n_iter_no_change': 10}. Best is trial 11 with value: 0.991748.
Trial 1 finished with value: 0.9915034940471702 and parameters: {'hgbc_learning_rate': 0.0031860556033652086, 'hgbc_max_iter': 2000, 'hgbc_min_samples_leaf': 13, 'hgbc_l2_regularization': 0.6000000000000001, 'hgbc_max_bins': 255, 'hgbc_early_stopping': True, 'hgbc_validation_fraction': 0.25, 'hgbc_n_iter_no_change': 10}. Best is trial 11 with value: 0.991748.
Trial 6 finished with value: 0.9916487312614505 and parameters: {'hgbc_learning_rate': 0.002609943311841453, 'hgbc_max_iter': 2000, 'hgbc_min_samples_leaf': 20, 'hgbc_l2_regularization': 0.6000000000000001, 'hgbc_max_bins': 63, 'hgbc_early_stopping': True, 'hgbc_validation_fraction': 0.25, 'hgbc_n_iter_no_change': 10}. Best is trial 11 with value: 0.991748.
Trial 21 finished with value: 0.9915957449192859 and parameters: {'hgbc_learning_rate': 0.10386149672703096, 'hgbc_max_iter': 2000, 'hgbc_min_samples_leaf': 2, 'hgbc_l2_regularization': 0.4, 'hgbc_max_bins': 63, 'hgbc_early_stopping': True, 'hgbc_validation_fraction': 0.25, 'hgbc_n_iter_no_change': 10}. Best is trial 11 with value: 0.991748.
Trial 0 finished with value: 0.9915574791064596 and parameters: {'hgbc_learning_rate': 0.0014139219693214142, 'hgbc_max_iter': 2000, 'hgbc_min_samples_leaf': 6, 'hgbc_l2_regularization': 0.2, 'hgbc_max_bins': 63, 'hgbc_early_stopping': True, 'hgbc_validation_fraction': 0.25, 'hgbc_n_iter_no_change': 10}. Best is trial 11 with value: 0.991748.
Trial 22 finished with value: 0.9915499484303978 and parameters: {'hgbc_learning_rate': 0.11951123767324671, 'hgbc_max_iter': 2000, 'hgbc_min_samples_leaf': 4, 'hgbc_l2_regularization': 1.0, 'hgbc_max_bins': 63, 'hgbc_early_stopping': True, 'hgbc_validation_fraction': 0.25, 'hgbc_n_iter_no_change': 10}. Best is trial 11 with value: 0.991748.
Trial 16 finished with value: 0.9916338577932309 and parameters: {'hgbc_learning_rate': 0.0017047232960886185, 'hgbc_max_iter': 2000, 'hgbc_min_samples_leaf': 6, 'hgbc_l2_regularization': 0.6000000000000001, 'hgbc_max_bins': 127, 'hgbc_early_stopping': True, 'hgbc_validation_fraction': 0.25, 'hgbc_n_iter_no_change': 10}. Best is trial 11 with value: 0.991748.
Trial 18 finished with value: 0.991572079492635 and parameters: {'hgbc_learning_rate': 0.0022222252956950917, 'hgbc_max_iter': 2000, 'hgbc_min_samples_leaf': 1, 'hgbc_l2_regularization': 1.0, 'hgbc_max_bins': 63, 'hgbc_early_stopping': True, 'hgbc_validation_fraction': 0.25, 'hgbc_n_iter_no_change': 10}. Best is trial 11 with value: 0.991748.
Trial 19 finished with value: 0.9915497183043493 and parameters: {'hgbc_learning_rate': 0.001602245243172377, 'hgbc_max_iter': 2000, 'hgbc_min_samples_leaf': 3, 'hgbc_l2_regularization': 1.0, 'hgbc_max_bins': 63, 'hgbc_early_stopping': True, 'hgbc_validation_fraction': 0.25, 'hgbc_n_iter_no_change': 10}. Best is trial 11 with value: 0.991748.
Trial 20 finished with value: 0.99153461885138 and parameters: {'hgbc_learning_rate': 0.0016448398757589614, 'hgbc_max_iter': 2000, 'hgbc_min_samples_leaf': 2, 'hgbc_l2_regularization': 0.4, 'hgbc_max_bins': 63, 'hgbc_early_stopping': True, 'hgbc_validation_fraction': 0.25, 'hgbc_n_iter_no_change': 10}. Best is trial 11 with value: 0.991748.
Trial 17 finished with value: 0.9915106738899494 and parameters: {'hgbc_learning_rate': 0.002793204089557327, 'hgbc_max_iter': 2000, 'hgbc_min_samples_leaf': 15, 'hgbc_l2_regularization': 0.0, 'hgbc_max_bins': 255, 'hgbc_early_stopping': True, 'hgbc_validation_fraction': 0.25, 'hgbc_n_iter_no_change': 10}. Best is trial 11 with value: 0.991748.
A new study created in RDB with name: LGBMClassifier_59d7b7e2
Trial 3 finished with value: 0.9837815727203935 and parameters: {'lgbm_num_leaves': 7, 'lgbm_learning_rate': 0.006542141986710064, 'lgbm_n_estimators': 70, 'lgbm_reg_alpha': 0.65, 'lgbm_reg_lambda': 0.6000000000000001}. Best is trial 3 with value: 0.983782.
Trial 6 finished with value: 0.991344511941666 and parameters: {'lgbm_num_leaves': 15, 'lgbm_learning_rate': 0.004615733875341178, 'lgbm_n_estimators': 80, 'lgbm_reg_alpha': 0.8500000000000001, 'lgbm_reg_lambda': 0.25}. Best is trial 6 with value: 0.991345.
Trial 5 finished with value: 0.2844441188051378 and parameters: {'lgbm_num_leaves': 31, 'lgbm_learning_rate': 1.3994614239687362e-05, 'lgbm_n_estimators': 80, 'lgbm_reg_alpha': 0.35000000000000003, 'lgbm_reg_lambda': 0.0}. Best is trial 6 with value: 0.991345.
Trial 0 finished with value: 0.9915047274809035 and parameters: {'lgbm_num_leaves': 63, 'lgbm_learning_rate': 0.03268284337970725, 'lgbm_n_estimators': 90, 'lgbm_reg_alpha': 0.35000000000000003, 'lgbm_reg_lambda': 0.4}. Best is trial 0 with value: 0.991505.
Trial 1 finished with value: 0.9915954397461081 and parameters: {'lgbm_num_leaves': 127, 'lgbm_learning_rate': 0.02162207765513771, 'lgbm_n_estimators': 100, 'lgbm_reg_alpha': 0.8, 'lgbm_reg_lambda': 0.8500000000000001}. Best is trial 1 with value: 0.991595.
Trial 9 finished with value: 0.2844441188051378 and parameters: {'lgbm_num_leaves': 63, 'lgbm_learning_rate': 2.5471088241784818e-05, 'lgbm_n_estimators': 10, 'lgbm_reg_alpha': 1.0, 'lgbm_reg_lambda': 0.05}. Best is trial 1 with value: 0.991595.
Trial 8 finished with value: 0.2844441188051378 and parameters: {'lgbm_num_leaves': 127, 'lgbm_learning_rate': 0.00022215081817676972, 'lgbm_n_estimators': 30, 'lgbm_reg_alpha': 0.2, 'lgbm_reg_lambda': 0.8500000000000001}. Best is trial 1 with value: 0.991595.
Trial 7 finished with value: 0.4361737675463697 and parameters: {'lgbm_num_leaves': 15, 'lgbm_learning_rate': 0.5840396903630913, 'lgbm_n_estimators': 130, 'lgbm_reg_alpha': 0.30000000000000004, 'lgbm_reg_lambda': 0.65}. Best is trial 1 with value: 0.991595.
Trial 4 finished with value: 0.9870901197401357 and parameters: {'lgbm_num_leaves': 7, 'lgbm_learning_rate': 0.007109480064917334, 'lgbm_n_estimators': 140, 'lgbm_reg_alpha': 0.4, 'lgbm_reg_lambda': 0.9}. Best is trial 1 with value: 0.991595.
Trial 14 finished with value: 0.9823434265728194 and parameters: {'lgbm_num_leaves': 7, 'lgbm_learning_rate': 0.019815232704238177, 'lgbm_n_estimators': 20, 'lgbm_reg_alpha': 0.8500000000000001, 'lgbm_reg_lambda': 0.6000000000000001}. Best is trial 1 with value: 0.991595.
Trial 12 finished with value: 0.2844441188051378 and parameters: {'lgbm_num_leaves': 15, 'lgbm_learning_rate': 1.9385397516695364e-05, 'lgbm_n_estimators': 30, 'lgbm_reg_alpha': 0.65, 'lgbm_reg_lambda': 0.1}. Best is trial 1 with value: 0.991595.
Trial 2 finished with value: 0.744324335596141 and parameters: {'lgbm_num_leaves': 7, 'lgbm_learning_rate': 0.27422821852097945, 'lgbm_n_estimators': 150, 'lgbm_reg_alpha': 0.9, 'lgbm_reg_lambda': 0.05}. Best is trial 1 with value: 0.991595.
Trial 15 finished with value: 0.2844441188051378 and parameters: {'lgbm_num_leaves': 7, 'lgbm_learning_rate': 1.1924325800808548e-06, 'lgbm_n_estimators': 70, 'lgbm_reg_alpha': 0.45, 'lgbm_reg_lambda': 0.8}. Best is trial 1 with value: 0.991595.
Trial 13 finished with value: 0.9917798141272407 and parameters: {'lgbm_num_leaves': 31, 'lgbm_learning_rate': 0.5802747719209824, 'lgbm_n_estimators': 110, 'lgbm_reg_alpha': 0.25, 'lgbm_reg_lambda': 0.2}. Best is trial 13 with value: 0.99178.
Trial 10 finished with value: 0.2844441188051378 and parameters: {'lgbm_num_leaves': 127, 'lgbm_learning_rate': 6.254356872461801e-06, 'lgbm_n_estimators': 140, 'lgbm_reg_alpha': 0.15000000000000002, 'lgbm_reg_lambda': 0.75}. Best is trial 13 with value: 0.99178.
Trial 11 finished with value: 0.2844441188051378 and parameters: {'lgbm_num_leaves': 127, 'lgbm_learning_rate': 4.2113143137995415e-05, 'lgbm_n_estimators': 170, 'lgbm_reg_alpha': 0.5, 'lgbm_reg_lambda': 0.65}. Best is trial 13 with value: 0.99178.
Trial 16 finished with value: 0.2844441188051378 and parameters: {'lgbm_num_leaves': 7, 'lgbm_learning_rate': 1.1164737980350556e-06, 'lgbm_n_estimators': 160, 'lgbm_reg_alpha': 0.25, 'lgbm_reg_lambda': 0.6000000000000001}. Best is trial 13 with value: 0.99178.
Trial 17 finished with value: 0.2844441188051378 and parameters: {'lgbm_num_leaves': 127, 'lgbm_learning_rate': 1.287591793265234e-06, 'lgbm_n_estimators': 190, 'lgbm_reg_alpha': 0.05, 'lgbm_reg_lambda': 1.0}. Best is trial 13 with value: 0.99178.
Trial 18 finished with value: 0.9918403046165568 and parameters: {'lgbm_num_leaves': 127, 'lgbm_learning_rate': 0.22730924905184202, 'lgbm_n_estimators': 200, 'lgbm_reg_alpha': 0.6000000000000001, 'lgbm_reg_lambda': 0.35000000000000003}. Best is trial 18 with value: 0.99184.
Trial 19 finished with value: 0.9919168541047582 and parameters: {'lgbm_num_leaves': 127, 'lgbm_learning_rate': 0.09843467380438248, 'lgbm_n_estimators': 190, 'lgbm_reg_alpha': 0.0, 'lgbm_reg_lambda': 0.35000000000000003}. Best is trial 19 with value: 0.991917.
Trial 20 finished with value: 0.9915958970961152 and parameters: {'lgbm_num_leaves': 31, 'lgbm_learning_rate': 0.08616105869217634, 'lgbm_n_estimators': 180, 'lgbm_reg_alpha': 0.0, 'lgbm_reg_lambda': 1.0}. Best is trial 19 with value: 0.991917.
Trial 21 finished with value: 0.9918483880357118 and parameters: {'lgbm_num_leaves': 127, 'lgbm_learning_rate': 0.11764876015274492, 'lgbm_n_estimators': 200, 'lgbm_reg_alpha': 0.0, 'lgbm_reg_lambda': 0.35000000000000003}. Best is trial 19 with value: 0.991917.
Trial 22 finished with value: 0.9917642309921286 and parameters: {'lgbm_num_leaves': 31, 'lgbm_learning_rate': 0.17390049146928932, 'lgbm_n_estimators': 200, 'lgbm_reg_alpha': 0.0, 'lgbm_reg_lambda': 1.0}. Best is trial 19 with value: 0.991917.
Trial 25 finished with value: 0.9916033142001738 and parameters: {'lgbm_num_leaves': 31, 'lgbm_learning_rate': 0.12557556856237478, 'lgbm_n_estimators': 110, 'lgbm_reg_alpha': 0.6000000000000001, 'lgbm_reg_lambda': 0.35000000000000003}. Best is trial 19 with value: 0.991917.
Trial 23 finished with value: 0.9918558857614862 and parameters: {'lgbm_num_leaves': 31, 'lgbm_learning_rate': 0.1123141364514708, 'lgbm_n_estimators': 200, 'lgbm_reg_alpha': 0.0, 'lgbm_reg_lambda': 1.0}. Best is trial 19 with value: 0.991917.
Trial 24 finished with value: 0.9918020459038595 and parameters: {'lgbm_num_leaves': 31, 'lgbm_learning_rate': 0.10897437916401732, 'lgbm_n_estimators': 190, 'lgbm_reg_alpha': 0.0, 'lgbm_reg_lambda': 1.0}. Best is trial 19 with value: 0.991917.
Trial 26 finished with value: 0.9917796300101892 and parameters: {'lgbm_num_leaves': 31, 'lgbm_learning_rate': 0.14187612959628285, 'lgbm_n_estimators': 200, 'lgbm_reg_alpha': 0.55, 'lgbm_reg_lambda': 0.35000000000000003}. Best is trial 19 with value: 0.991917.
Trial 28 finished with value: 0.3347767923855815 and parameters: {'lgbm_num_leaves': 31, 'lgbm_learning_rate': 0.9073141107250785, 'lgbm_n_estimators': 200, 'lgbm_reg_alpha': 0.15000000000000002, 'lgbm_reg_lambda': 0.35000000000000003}. Best is trial 19 with value: 0.991917.
Trial 27 finished with value: 0.9918098748050889 and parameters: {'lgbm_num_leaves': 127, 'lgbm_learning_rate': 0.08868127883333005, 'lgbm_n_estimators': 200, 'lgbm_reg_alpha': 0.0, 'lgbm_reg_lambda': 0.4}. Best is trial 19 with value: 0.991917.
Trial 29 finished with value: 0.9918631639462956 and parameters: {'lgbm_num_leaves': 127, 'lgbm_learning_rate': 0.12608295389125163, 'lgbm_n_estimators': 200, 'lgbm_reg_alpha': 0.1, 'lgbm_reg_lambda': 0.35000000000000003}. Best is trial 19 with value: 0.991917.
A new study created in RDB with name: LinearDiscriminantAnalysis_59d7b7e2
Trial 0 finished with value: 0.9047439555188416 and parameters: {'lda_solver': 'svd', 'lda_n_components': 3}. Best is trial 0 with value: 0.904744.
Trial 5 finished with value: 0.9047439555188416 and parameters: {'lda_solver': 'svd', 'lda_n_components': 1}. Best is trial 0 with value: 0.904744.
Trial 6 finished with value: 0.9045171792659163 and parameters: {'lda_solver': 'lsqr', 'lda_n_components': 2, 'lda_tol': 0.0001}. Best is trial 0 with value: 0.904744.
Trial 1 finished with value: 0.9047439555188416 and parameters: {'lda_solver': 'svd', 'lda_n_components': 3}. Best is trial 0 with value: 0.904744.
Trial 2 finished with value: 0.9047439555188416 and parameters: {'lda_solver': 'svd', 'lda_n_components': 2}. Best is trial 0 with value: 0.904744.
Trial 3 finished with value: 0.9045171792659163 and parameters: {'lda_solver': 'eigen', 'lda_n_components': 2, 'lda_tol': 0.0001}. Best is trial 0 with value: 0.904744.
Trial 4 finished with value: 0.9045171792659163 and parameters: {'lda_solver': 'eigen', 'lda_n_components': 3, 'lda_tol': 1e-05}. Best is trial 0 with value: 0.904744.
Trial 7 finished with value: 0.9045171792659163 and parameters: {'lda_solver': 'eigen', 'lda_n_components': 1, 'lda_tol': 0.0001}. Best is trial 0 with value: 0.904744.
Trial 8 finished with value: 0.9045171792659163 and parameters: {'lda_solver': 'lsqr', 'lda_n_components': 4, 'lda_tol': 0.001}. Best is trial 0 with value: 0.904744.
Trial 9 finished with value: 0.9045171792659163 and parameters: {'lda_solver': 'lsqr', 'lda_n_components': 1, 'lda_tol': 0.001}. Best is trial 0 with value: 0.904744.
Trial 10 finished with value: 0.9047439555188416 and parameters: {'lda_solver': 'svd', 'lda_n_components': 2}. Best is trial 0 with value: 0.904744.
Trial 11 finished with value: 0.9045171792659163 and parameters: {'lda_solver': 'lsqr', 'lda_n_components': 3, 'lda_tol': 1e-05}. Best is trial 0 with value: 0.904744.
