[32m[I 2022-10-20 14:48:40,480][0m Trial 50 finished with value: 0.4224288938309267 and parameters: {'pac_C': 0.04709575470166378, 'pac_early_stopping': True, 'pac_validation_fraction': 0.25, 'pac_n_iter_no_change': 10}. Best is trial 0 with value: 0.422429.[0m
[32m[I 2022-10-20 14:48:41,125][0m Trial 51 finished with value: 0.4224288938309267 and parameters: {'pac_C': 0.6251704086934936, 'pac_early_stopping': True, 'pac_validation_fraction': 0.25, 'pac_n_iter_no_change': 10}. Best is trial 0 with value: 0.422429.[0m
[32m[I 2022-10-20 14:48:41,770][0m Trial 52 finished with value: 0.4224288938309267 and parameters: {'pac_C': 0.49925214657260003, 'pac_early_stopping': True, 'pac_validation_fraction': 0.25, 'pac_n_iter_no_change': 10}. Best is trial 0 with value: 0.422429.[0m
[32m[I 2022-10-20 14:48:42,584][0m Trial 53 finished with value: 0.4224288938309267 and parameters: {'pac_C': 0.3951421007513929, 'pac_early_stopping': True, 'pac_validation_fraction': 0.25, 'pac_n_iter_no_change': 10}. Best is trial 0 with value: 0.422429.[0m
[32m[I 2022-10-20 14:48:42,851][0m Trial 54 finished with value: 0.4224288938309267 and parameters: {'pac_C': 884.8258618459824, 'pac_early_stopping': True, 'pac_validation_fraction': 0.25, 'pac_n_iter_no_change': 10}. Best is trial 0 with value: 0.422429.[0m
[32m[I 2022-10-20 14:48:43,523][0m Trial 55 finished with value: 0.4224288938309267 and parameters: {'pac_C': 0.000647594016967028, 'pac_early_stopping': True, 'pac_validation_fraction': 0.25, 'pac_n_iter_no_change': 10}. Best is trial 0 with value: 0.422429.[0m
[32m[I 2022-10-20 14:48:58,357][0m Trial 56 finished with value: 0.4224288938309267 and parameters: {'pac_C': 0.0009715427646399486, 'pac_early_stopping': True, 'pac_validation_fraction': 0.25, 'pac_n_iter_no_change': 10}. Best is trial 0 with value: 0.422429.[0m
[32m[I 2022-10-20 14:48:58,989][0m Trial 57 finished with value: 0.4224288938309267 and parameters: {'pac_C': 0.0011166952438793163, 'pac_early_stopping': True, 'pac_validation_fraction': 0.25, 'pac_n_iter_no_change': 10}. Best is trial 0 with value: 0.422429.[0m
[32m[I 2022-10-20 14:48:59,466][0m Trial 58 finished with value: 0.4224288938309267 and parameters: {'pac_C': 0.001052433420372724, 'pac_early_stopping': True, 'pac_validation_fraction': 0.25, 'pac_n_iter_no_change': 10}. Best is trial 0 with value: 0.422429.[0m
[32m[I 2022-10-20 14:49:00,126][0m Trial 59 finished with value: 0.4224288938309267 and parameters: {'pac_C': 0.0019739488674045988, 'pac_early_stopping': True, 'pac_validation_fraction': 0.25, 'pac_n_iter_no_change': 10}. Best is trial 0 with value: 0.422429.[0m
[32m[I 2022-10-20 14:49:01,032][0m Trial 60 finished with value: 0.4224288938309267 and parameters: {'pac_C': 0.0013557022158797302, 'pac_early_stopping': True, 'pac_validation_fraction': 0.25, 'pac_n_iter_no_change': 10}. Best is trial 0 with value: 0.422429.[0m
[32m[I 2022-10-20 14:49:01,475][0m Trial 61 finished with value: 0.4224288938309267 and parameters: {'pac_C': 586.8502531541369, 'pac_early_stopping': True, 'pac_validation_fraction': 0.25, 'pac_n_iter_no_change': 10}. Best is trial 0 with value: 0.422429.[0m
[32m[I 2022-10-20 14:49:02,027][0m Trial 62 finished with value: 0.4224288938309267 and parameters: {'pac_C': 0.0014535380951204314, 'pac_early_stopping': True, 'pac_validation_fraction': 0.25, 'pac_n_iter_no_change': 10}. Best is trial 0 with value: 0.422429.[0m
[32m[I 2022-10-20 14:49:02,454][0m Trial 63 finished with value: 0.4224288938309267 and parameters: {'pac_C': 98.40703253425818, 'pac_early_stopping': True, 'pac_validation_fraction': 0.25, 'pac_n_iter_no_change': 10}. Best is trial 0 with value: 0.422429.[0m
[32m[I 2022-10-20 14:49:17,213][0m Trial 64 finished with value: 0.4224288938309267 and parameters: {'pac_C': 99.04481563232903, 'pac_early_stopping': True, 'pac_validation_fraction': 0.25, 'pac_n_iter_no_change': 10}. Best is trial 0 with value: 0.422429.[0m
[32m[I 2022-10-20 14:49:18,123][0m Trial 65 finished with value: 0.4224288938309267 and parameters: {'pac_C': 52.820396288773935, 'pac_early_stopping': True, 'pac_validation_fraction': 0.25, 'pac_n_iter_no_change': 10}. Best is trial 0 with value: 0.422429.[0m
[32m[I 2022-10-20 14:49:18,604][0m Trial 66 finished with value: 0.4224288938309267 and parameters: {'pac_C': 27.431487996964236, 'pac_early_stopping': True, 'pac_validation_fraction': 0.25, 'pac_n_iter_no_change': 10}. Best is trial 0 with value: 0.422429.[0m
[32m[I 2022-10-20 14:49:19,253][0m Trial 67 finished with value: 0.4224288938309267 and parameters: {'pac_C': 32.39600752065322, 'pac_early_stopping': True, 'pac_validation_fraction': 0.25, 'pac_n_iter_no_change': 10}. Best is trial 0 with value: 0.422429.[0m
[32m[I 2022-10-20 14:49:20,215][0m Trial 68 finished with value: 0.4224288938309267 and parameters: {'pac_C': 53.79077267992388, 'pac_early_stopping': True, 'pac_validation_fraction': 0.25, 'pac_n_iter_no_change': 10}. Best is trial 0 with value: 0.422429.[0m
[32m[I 2022-10-20 14:49:20,311][0m Trial 69 finished with value: 0.4224288938309267 and parameters: {'pac_C': 3.485286260384819e-05, 'pac_early_stopping': True, 'pac_validation_fraction': 0.25, 'pac_n_iter_no_change': 10}. Best is trial 0 with value: 0.422429.[0m
[32m[I 2022-10-20 14:49:21,038][0m Trial 70 finished with value: 0.4224288938309267 and parameters: {'pac_C': 1.8623782633339345e-05, 'pac_early_stopping': True, 'pac_validation_fraction': 0.25, 'pac_n_iter_no_change': 10}. Best is trial 0 with value: 0.422429.[0m
[32m[I 2022-10-20 14:49:21,693][0m Trial 71 finished with value: 0.4224288938309267 and parameters: {'pac_C': 2.679553505108644e-05, 'pac_early_stopping': True, 'pac_validation_fraction': 0.25, 'pac_n_iter_no_change': 10}. Best is trial 0 with value: 0.422429.[0m
[32m[I 2022-10-20 14:49:36,107][0m Trial 72 finished with value: 0.4224288938309267 and parameters: {'pac_C': 4.575678370026052e-05, 'pac_early_stopping': True, 'pac_validation_fraction': 0.25, 'pac_n_iter_no_change': 10}. Best is trial 0 with value: 0.422429.[0m
[32m[I 2022-10-20 14:49:37,007][0m Trial 73 finished with value: 0.4224288938309267 and parameters: {'pac_C': 6.0438427453422064e-05, 'pac_early_stopping': True, 'pac_validation_fraction': 0.25, 'pac_n_iter_no_change': 10}. Best is trial 0 with value: 0.422429.[0m
[32m[I 2022-10-20 14:49:37,467][0m Trial 74 finished with value: 0.4224288938309267 and parameters: {'pac_C': 3.881548365753359e-05, 'pac_early_stopping': True, 'pac_validation_fraction': 0.25, 'pac_n_iter_no_change': 10}. Best is trial 0 with value: 0.422429.[0m
[32m[I 2022-10-20 14:49:38,131][0m Trial 75 finished with value: 0.4224288938309267 and parameters: {'pac_C': 4.63616253900732e-05, 'pac_early_stopping': True, 'pac_validation_fraction': 0.25, 'pac_n_iter_no_change': 10}. Best is trial 0 with value: 0.422429.[0m
[32m[I 2022-10-20 14:49:39,216][0m Trial 76 finished with value: 0.4224288938309267 and parameters: {'pac_C': 5.399715926219258e-06, 'pac_early_stopping': True, 'pac_validation_fraction': 0.25, 'pac_n_iter_no_change': 10}. Best is trial 0 with value: 0.422429.[0m
[32m[I 2022-10-20 14:49:39,692][0m Trial 77 finished with value: 0.4224288938309267 and parameters: {'pac_C': 6.950079457050096e-05, 'pac_early_stopping': True, 'pac_validation_fraction': 0.25, 'pac_n_iter_no_change': 10}. Best is trial 0 with value: 0.422429.[0m
[32m[I 2022-10-20 14:49:40,243][0m Trial 78 finished with value: 0.4224288938309267 and parameters: {'pac_C': 0.15594172131224016, 'pac_early_stopping': True, 'pac_validation_fraction': 0.25, 'pac_n_iter_no_change': 10}. Best is trial 0 with value: 0.422429.[0m
[32m[I 2022-10-20 14:49:40,815][0m Trial 79 finished with value: 0.4224288938309267 and parameters: {'pac_C': 0.1623692975519419, 'pac_early_stopping': True, 'pac_validation_fraction': 0.25, 'pac_n_iter_no_change': 10}. Best is trial 0 with value: 0.422429.[0m
[32m[I 2022-10-20 14:49:54,880][0m Trial 80 finished with value: 0.4224288938309267 and parameters: {'pac_C': 0.08459890934309475, 'pac_early_stopping': True, 'pac_validation_fraction': 0.25, 'pac_n_iter_no_change': 10}. Best is trial 0 with value: 0.422429.[0m
[32m[I 2022-10-20 14:49:55,962][0m Trial 81 finished with value: 0.4224288938309267 and parameters: {'pac_C': 0.2593545014079652, 'pac_early_stopping': True, 'pac_validation_fraction': 0.25, 'pac_n_iter_no_change': 10}. Best is trial 0 with value: 0.422429.[0m
[32m[I 2022-10-20 14:49:56,704][0m Trial 82 finished with value: 0.4224288938309267 and parameters: {'pac_C': 0.2696587383714565, 'pac_early_stopping': True, 'pac_validation_fraction': 0.25, 'pac_n_iter_no_change': 10}. Best is trial 0 with value: 0.422429.[0m
[32m[I 2022-10-20 14:49:57,267][0m Trial 83 finished with value: 0.4224288938309267 and parameters: {'pac_C': 0.3246155361151903, 'pac_early_stopping': True, 'pac_validation_fraction': 0.25, 'pac_n_iter_no_change': 10}. Best is trial 0 with value: 0.422429.[0m
[32m[I 2022-10-20 14:49:58,125][0m Trial 84 finished with value: 0.4224288938309267 and parameters: {'pac_C': 0.2581287398109146, 'pac_early_stopping': True, 'pac_validation_fraction': 0.25, 'pac_n_iter_no_change': 10}. Best is trial 0 with value: 0.422429.[0m
[32m[I 2022-10-20 14:49:58,873][0m Trial 85 finished with value: 0.4224288938309267 and parameters: {'pac_C': 0.00034417588225731663, 'pac_early_stopping': True, 'pac_validation_fraction': 0.25, 'pac_n_iter_no_change': 10}. Best is trial 0 with value: 0.422429.[0m
[32m[I 2022-10-20 14:49:59,443][0m Trial 86 finished with value: 0.4224288938309267 and parameters: {'pac_C': 0.0005309736549941339, 'pac_early_stopping': True, 'pac_validation_fraction': 0.25, 'pac_n_iter_no_change': 10}. Best is trial 0 with value: 0.422429.[0m
[32m[I 2022-10-20 14:50:00,179][0m Trial 87 finished with value: 0.4224288938309267 and parameters: {'pac_C': 0.0005345185800631628, 'pac_early_stopping': True, 'pac_validation_fraction': 0.25, 'pac_n_iter_no_change': 10}. Best is trial 0 with value: 0.422429.[0m
[32m[I 2022-10-20 14:50:13,933][0m Trial 88 finished with value: 0.4224288938309267 and parameters: {'pac_C': 0.000490255220501714, 'pac_early_stopping': True, 'pac_validation_fraction': 0.25, 'pac_n_iter_no_change': 10}. Best is trial 0 with value: 0.422429.[0m
[32m[I 2022-10-20 14:50:14,854][0m Trial 89 finished with value: 0.4224288938309267 and parameters: {'pac_C': 0.00028362524062220903, 'pac_early_stopping': True, 'pac_validation_fraction': 0.25, 'pac_n_iter_no_change': 10}. Best is trial 0 with value: 0.422429.[0m
[32m[I 2022-10-20 14:50:15,759][0m Trial 90 finished with value: 0.4224288938309267 and parameters: {'pac_C': 0.0002888651299198052, 'pac_early_stopping': True, 'pac_validation_fraction': 0.25, 'pac_n_iter_no_change': 10}. Best is trial 0 with value: 0.422429.[0m
[32m[I 2022-10-20 14:50:16,372][0m Trial 91 finished with value: 0.4224288938309267 and parameters: {'pac_C': 0.0002977967939233322, 'pac_early_stopping': True, 'pac_validation_fraction': 0.25, 'pac_n_iter_no_change': 10}. Best is trial 0 with value: 0.422429.[0m
[32m[I 2022-10-20 14:50:17,259][0m Trial 92 finished with value: 0.4224288938309267 and parameters: {'pac_C': 0.0003847082138165132, 'pac_early_stopping': True, 'pac_validation_fraction': 0.25, 'pac_n_iter_no_change': 10}. Best is trial 0 with value: 0.422429.[0m
[32m[I 2022-10-20 14:50:17,793][0m Trial 93 finished with value: 0.4224288938309267 and parameters: {'pac_C': 817.1392135892628, 'pac_early_stopping': True, 'pac_validation_fraction': 0.25, 'pac_n_iter_no_change': 10}. Best is trial 0 with value: 0.422429.[0m
[32m[I 2022-10-20 14:50:18,328][0m Trial 94 finished with value: 0.4224288938309267 and parameters: {'pac_C': 0.0012128288047027127, 'pac_early_stopping': True, 'pac_validation_fraction': 0.25, 'pac_n_iter_no_change': 10}. Best is trial 0 with value: 0.422429.[0m
[32m[I 2022-10-20 14:50:18,872][0m Trial 95 finished with value: 0.4224288938309267 and parameters: {'pac_C': 0.0015642354645667822, 'pac_early_stopping': True, 'pac_validation_fraction': 0.25, 'pac_n_iter_no_change': 10}. Best is trial 0 with value: 0.422429.[0m
[32m[I 2022-10-20 14:50:28,557][0m Trial 96 finished with value: 0.4224288938309267 and parameters: {'pac_C': 0.0018022569356094845, 'pac_early_stopping': True, 'pac_validation_fraction': 0.25, 'pac_n_iter_no_change': 10}. Best is trial 0 with value: 0.422429.[0m
[32m[I 2022-10-20 14:50:29,176][0m Trial 97 finished with value: 0.4224288938309267 and parameters: {'pac_C': 0.0017493362293816597, 'pac_early_stopping': True, 'pac_validation_fraction': 0.25, 'pac_n_iter_no_change': 10}. Best is trial 0 with value: 0.422429.[0m
[32m[I 2022-10-20 14:50:29,678][0m Trial 98 finished with value: 0.4224288938309267 and parameters: {'pac_C': 0.0018078944953724575, 'pac_early_stopping': True, 'pac_validation_fraction': 0.25, 'pac_n_iter_no_change': 10}. Best is trial 0 with value: 0.422429.[0m
[32m[I 2022-10-20 14:50:30,074][0m Trial 99 finished with value: 0.4224288938309267 and parameters: {'pac_C': 141.8475614378064, 'pac_early_stopping': True, 'pac_validation_fraction': 0.25, 'pac_n_iter_no_change': 10}. Best is trial 0 with value: 0.422429.[0m
[32m[I 2022-10-20 14:50:30,136][0m Study finished.[0m
[32m[I 2022-10-20 14:50:30,214][0m --------------------------------------------------------------------------------[0m
[32m[I 2022-10-20 14:50:30,214][0m --------------------               Perceptron               --------------------[0m
[32m[I 2022-10-20 14:50:30,214][0m --------------------------------------------------------------------------------[0m
[32m[I 2022-10-20 14:50:30,246][0m A new study created in RDB with name: Perceptron_b4f53b70[0m
[32m[I 2022-10-20 14:50:30,246][0m Study started.[0m
[32m[I 2022-10-20 14:50:43,656][0m Trial 4 finished with value: 0.18191330700160876 and parameters: {'p_penalty': 'elasticnet', 'p_alpha': 0.005971107570267404, 'p_eta0': 0.5, 'p_early_stopping': True, 'p_validation_fraction': 0.25, 'p_n_iter_no_change': 10}. Best is trial 4 with value: 0.181913.[0m
[32m[I 2022-10-20 14:50:43,846][0m Trial 5 finished with value: 0.14359706807573844 and parameters: {'p_penalty': 'elasticnet', 'p_alpha': 0.002210577801808577, 'p_eta0': 1.0, 'p_early_stopping': True, 'p_validation_fraction': 0.25, 'p_n_iter_no_change': 10}. Best is trial 4 with value: 0.181913.[0m
[32m[I 2022-10-20 14:50:45,042][0m Trial 6 finished with value: 0.03537517450273689 and parameters: {'p_penalty': 'elasticnet', 'p_alpha': 4.825661838755819e-06, 'p_eta0': 1.5, 'p_early_stopping': True, 'p_validation_fraction': 0.25, 'p_n_iter_no_change': 10}. Best is trial 4 with value: 0.181913.[0m
[32m[I 2022-10-20 14:50:45,218][0m Trial 0 finished with value: 0.2844441188051378 and parameters: {'p_penalty': 'elasticnet', 'p_alpha': 0.0005622715804196519, 'p_eta0': 0.5, 'p_early_stopping': True, 'p_validation_fraction': 0.25, 'p_n_iter_no_change': 10}. Best is trial 0 with value: 0.284444.[0m
[32m[I 2022-10-20 14:50:47,007][0m Trial 7 finished with value: 0.28247232737954847 and parameters: {'p_penalty': 'elasticnet', 'p_alpha': 0.037507448704766085, 'p_eta0': 0.5, 'p_early_stopping': True, 'p_validation_fraction': 0.25, 'p_n_iter_no_change': 10}. Best is trial 0 with value: 0.284444.[0m
[32m[I 2022-10-20 14:50:47,499][0m Trial 2 finished with value: 0.4244437649449533 and parameters: {'p_penalty': 'elasticnet', 'p_alpha': 0.0012451809891964561, 'p_eta0': 1.0, 'p_early_stopping': True, 'p_validation_fraction': 0.25, 'p_n_iter_no_change': 10}. Best is trial 2 with value: 0.424444.[0m
[32m[I 2022-10-20 14:50:49,165][0m Trial 1 finished with value: 0.3601442647286006 and parameters: {'p_penalty': 'elasticnet', 'p_alpha': 2.605583098422162e-06, 'p_eta0': 1.0, 'p_early_stopping': True, 'p_validation_fraction': 0.25, 'p_n_iter_no_change': 10}. Best is trial 2 with value: 0.424444.[0m
[32m[I 2022-10-20 14:50:50,271][0m Trial 3 finished with value: 0.22051267899644086 and parameters: {'p_penalty': 'elasticnet', 'p_alpha': 1.5573562001816933e-06, 'p_eta0': 0.5, 'p_early_stopping': True, 'p_validation_fraction': 0.25, 'p_n_iter_no_change': 10}. Best is trial 2 with value: 0.424444.[0m
[32m[I 2022-10-20 14:50:57,005][0m Trial 8 finished with value: 0.18206995240811077 and parameters: {'p_penalty': 'elasticnet', 'p_alpha': 0.0023683669013071906, 'p_eta0': 2.0, 'p_early_stopping': True, 'p_validation_fraction': 0.25, 'p_n_iter_no_change': 10}. Best is trial 2 with value: 0.424444.[0m
[32m[I 2022-10-20 14:50:57,366][0m Trial 9 finished with value: 0.1260283506389089 and parameters: {'p_penalty': 'elasticnet', 'p_alpha': 0.00564911972431472, 'p_eta0': 2.0, 'p_early_stopping': True, 'p_validation_fraction': 0.25, 'p_n_iter_no_change': 10}. Best is trial 2 with value: 0.424444.[0m
[32m[I 2022-10-20 14:51:00,566][0m Trial 13 finished with value: 0.12388641062088446 and parameters: {'p_penalty': 'elasticnet', 'p_alpha': 0.0021625237595196333, 'p_eta0': 2.0, 'p_early_stopping': True, 'p_validation_fraction': 0.25, 'p_n_iter_no_change': 10}. Best is trial 2 with value: 0.424444.[0m
[32m[I 2022-10-20 14:51:00,660][0m Trial 10 finished with value: 0.2844441188051378 and parameters: {'p_penalty': 'elasticnet', 'p_alpha': 1.61268105511406e-06, 'p_eta0': 0.5, 'p_early_stopping': True, 'p_validation_fraction': 0.25, 'p_n_iter_no_change': 10}. Best is trial 2 with value: 0.424444.[0m
[32m[I 2022-10-20 14:51:02,525][0m Trial 12 finished with value: 0.2844441188051378 and parameters: {'p_penalty': 'elasticnet', 'p_alpha': 0.0801311802562706, 'p_eta0': 1.5, 'p_early_stopping': True, 'p_validation_fraction': 0.25, 'p_n_iter_no_change': 10}. Best is trial 2 with value: 0.424444.[0m
[32m[I 2022-10-20 14:51:02,635][0m Trial 11 finished with value: 0.3913904720081685 and parameters: {'p_penalty': 'elasticnet', 'p_alpha': 1.5622591480636508e-06, 'p_eta0': 2.0, 'p_early_stopping': True, 'p_validation_fraction': 0.25, 'p_n_iter_no_change': 10}. Best is trial 2 with value: 0.424444.[0m
[32m[I 2022-10-20 14:51:04,654][0m Trial 14 finished with value: 0.2844441188051378 and parameters: {'p_penalty': 'elasticnet', 'p_alpha': 0.0015041770450634618, 'p_eta0': 1.5, 'p_early_stopping': True, 'p_validation_fraction': 0.25, 'p_n_iter_no_change': 10}. Best is trial 2 with value: 0.424444.[0m
[32m[I 2022-10-20 14:51:05,896][0m Trial 15 finished with value: 0.283316871250476 and parameters: {'p_penalty': 'elasticnet', 'p_alpha': 0.0041084003000711, 'p_eta0': 1.5, 'p_early_stopping': True, 'p_validation_fraction': 0.25, 'p_n_iter_no_change': 10}. Best is trial 2 with value: 0.424444.[0m
[32m[I 2022-10-20 14:51:11,794][0m Trial 16 finished with value: 0.2844441188051378 and parameters: {'p_penalty': 'elasticnet', 'p_alpha': 0.5328505377831337, 'p_eta0': 0.5, 'p_early_stopping': True, 'p_validation_fraction': 0.25, 'p_n_iter_no_change': 10}. Best is trial 2 with value: 0.424444.[0m
[32m[I 2022-10-20 14:51:12,268][0m Trial 17 finished with value: 0.020511437484507684 and parameters: {'p_penalty': 'elasticnet', 'p_alpha': 8.738561133579784e-05, 'p_eta0': 1.5, 'p_early_stopping': True, 'p_validation_fraction': 0.25, 'p_n_iter_no_change': 10}. Best is trial 2 with value: 0.424444.[0m
[32m[I 2022-10-20 14:51:13,915][0m Trial 18 finished with value: 0.11276731151953699 and parameters: {'p_penalty': 'elasticnet', 'p_alpha': 9.231051821251868e-05, 'p_eta0': 1.0, 'p_early_stopping': True, 'p_validation_fraction': 0.25, 'p_n_iter_no_change': 10}. Best is trial 2 with value: 0.424444.[0m
[32m[I 2022-10-20 14:51:16,020][0m Trial 19 finished with value: 0.2844441188051378 and parameters: {'p_penalty': 'elasticnet', 'p_alpha': 5.704947100401428e-05, 'p_eta0': 1.0, 'p_early_stopping': True, 'p_validation_fraction': 0.25, 'p_n_iter_no_change': 10}. Best is trial 2 with value: 0.424444.[0m
[32m[I 2022-10-20 14:51:17,649][0m Trial 21 finished with value: 0.2844441188051378 and parameters: {'p_penalty': 'elasticnet', 'p_alpha': 7.68354458031823e-05, 'p_eta0': 1.5, 'p_early_stopping': True, 'p_validation_fraction': 0.25, 'p_n_iter_no_change': 10}. Best is trial 2 with value: 0.424444.[0m
[32m[I 2022-10-20 14:51:18,326][0m Trial 20 finished with value: 0.11303975794352439 and parameters: {'p_penalty': 'elasticnet', 'p_alpha': 6.772321185282184e-05, 'p_eta0': 1.5, 'p_early_stopping': True, 'p_validation_fraction': 0.25, 'p_n_iter_no_change': 10}. Best is trial 2 with value: 0.424444.[0m
[32m[I 2022-10-20 14:51:20,179][0m Trial 22 finished with value: 0.021341041827885467 and parameters: {'p_penalty': 'elasticnet', 'p_alpha': 5.1082721929418904e-05, 'p_eta0': 1.0, 'p_early_stopping': True, 'p_validation_fraction': 0.25, 'p_n_iter_no_change': 10}. Best is trial 2 with value: 0.424444.[0m
[32m[I 2022-10-20 14:51:20,987][0m Trial 23 finished with value: 0.2844441188051378 and parameters: {'p_penalty': 'elasticnet', 'p_alpha': 6.54933599795028e-05, 'p_eta0': 1.0, 'p_early_stopping': True, 'p_validation_fraction': 0.25, 'p_n_iter_no_change': 10}. Best is trial 2 with value: 0.424444.[0m
[32m[I 2022-10-20 14:51:24,998][0m Trial 24 finished with value: 0.021106459884472968 and parameters: {'p_penalty': 'elasticnet', 'p_alpha': 4.486083984842549e-05, 'p_eta0': 1.0, 'p_early_stopping': True, 'p_validation_fraction': 0.25, 'p_n_iter_no_change': 10}. Best is trial 2 with value: 0.424444.[0m
[32m[I 2022-10-20 14:51:25,872][0m Trial 25 finished with value: 0.20770655285204492 and parameters: {'p_penalty': 'elasticnet', 'p_alpha': 2.1391425457814303e-05, 'p_eta0': 1.0, 'p_early_stopping': True, 'p_validation_fraction': 0.25, 'p_n_iter_no_change': 10}. Best is trial 2 with value: 0.424444.[0m
