[32m[I 2022-10-20 14:53:38,727][0m Trial 98 finished with value: 0.22794418908762293 and parameters: {'p_penalty': 'elasticnet', 'p_alpha': 0.005974845347283127, 'p_eta0': 1.5, 'p_early_stopping': True, 'p_validation_fraction': 0.25, 'p_n_iter_no_change': 10}. Best is trial 54 with value: 0.508084.[0m
[32m[I 2022-10-20 14:53:39,181][0m Trial 97 finished with value: 0.14350708960654274 and parameters: {'p_penalty': 'elasticnet', 'p_alpha': 0.0008242558899551381, 'p_eta0': 1.0, 'p_early_stopping': True, 'p_validation_fraction': 0.25, 'p_n_iter_no_change': 10}. Best is trial 54 with value: 0.508084.[0m
[32m[I 2022-10-20 14:53:39,275][0m Trial 99 finished with value: 0.44799041962810715 and parameters: {'p_penalty': 'elasticnet', 'p_alpha': 0.006198735967043926, 'p_eta0': 1.5, 'p_early_stopping': True, 'p_validation_fraction': 0.25, 'p_n_iter_no_change': 10}. Best is trial 54 with value: 0.508084.[0m
[32m[I 2022-10-20 14:53:39,338][0m Study finished.[0m
[32m[I 2022-10-20 14:53:39,432][0m --------------------------------------------------------------------------------[0m
[32m[I 2022-10-20 14:53:39,432][0m --------------------     QuadraticDiscriminantAnalysis      --------------------[0m
[32m[I 2022-10-20 14:53:39,432][0m --------------------------------------------------------------------------------[0m
[32m[I 2022-10-20 14:53:39,463][0m A new study created in RDB with name: QuadraticDiscriminantAnalysis_b4f53b70[0m
[32m[I 2022-10-20 14:53:39,463][0m Study started.[0m
[32m[I 2022-10-20 14:53:52,290][0m Trial 0 finished with value: 0.9074710020951025 and parameters: {'qda_reg_param': 0.05, 'qda_tol': 0.0005963135720153288}. Best is trial 0 with value: 0.907471.[0m
[32m[I 2022-10-20 14:53:52,290][0m Trial 2 finished with value: 0.8776816513824245 and parameters: {'qda_reg_param': 0.9500000000000001, 'qda_tol': 1.5312073313953224e-05}. Best is trial 0 with value: 0.907471.[0m
[32m[I 2022-10-20 14:53:52,557][0m Trial 1 finished with value: 0.8880056295866787 and parameters: {'qda_reg_param': 0.7000000000000001, 'qda_tol': 4.068018784691713e-05}. Best is trial 0 with value: 0.907471.[0m
[32m[I 2022-10-20 14:53:52,654][0m Trial 7 finished with value: 0.8880056295866787 and parameters: {'qda_reg_param': 0.7000000000000001, 'qda_tol': 3.8823857103488075e-05}. Best is trial 0 with value: 0.907471.[0m
[32m[I 2022-10-20 14:53:52,881][0m Trial 3 finished with value: 0.8712101843086053 and parameters: {'qda_reg_param': 0.0, 'qda_tol': 2.1774429680063765e-05}. Best is trial 0 with value: 0.907471.[0m
[32m[I 2022-10-20 14:53:52,959][0m Trial 6 finished with value: 0.905848436475046 and parameters: {'qda_reg_param': 0.30000000000000004, 'qda_tol': 0.00030386343663946794}. Best is trial 0 with value: 0.907471.[0m
[32m[I 2022-10-20 14:53:52,959][0m Trial 5 finished with value: 0.8904294450741927 and parameters: {'qda_reg_param': 0.65, 'qda_tol': 8.40743312949536e-05}. Best is trial 0 with value: 0.907471.[0m
[32m[I 2022-10-20 14:53:53,416][0m Trial 4 finished with value: 0.8902004936721672 and parameters: {'qda_reg_param': 0.55, 'qda_tol': 6.7926370823283265e-06}. Best is trial 0 with value: 0.907471.[0m
[32m[I 2022-10-20 14:54:04,598][0m Trial 9 finished with value: 0.905848436475046 and parameters: {'qda_reg_param': 0.2, 'qda_tol': 0.0003558589360215956}. Best is trial 0 with value: 0.907471.[0m
[32m[I 2022-10-20 14:54:04,598][0m Trial 8 finished with value: 0.8902004936721672 and parameters: {'qda_reg_param': 0.6000000000000001, 'qda_tol': 2.077690382301321e-06}. Best is trial 0 with value: 0.907471.[0m
[32m[I 2022-10-20 14:54:05,099][0m Trial 11 finished with value: 0.905848436475046 and parameters: {'qda_reg_param': 0.25, 'qda_tol': 0.000498208041043326}. Best is trial 0 with value: 0.907471.[0m
[32m[I 2022-10-20 14:54:05,364][0m Trial 10 finished with value: 0.8880056295866787 and parameters: {'qda_reg_param': 0.75, 'qda_tol': 7.750527793688035e-05}. Best is trial 0 with value: 0.907471.[0m
[32m[I 2022-10-20 14:54:06,011][0m Trial 14 finished with value: 0.9005129068031295 and parameters: {'qda_reg_param': 0.4, 'qda_tol': 0.0006919546278287366}. Best is trial 0 with value: 0.907471.[0m
[32m[I 2022-10-20 14:54:06,139][0m Trial 12 finished with value: 0.9073081783954601 and parameters: {'qda_reg_param': 0.1, 'qda_tol': 2.2610827528273844e-05}. Best is trial 0 with value: 0.907471.[0m
[32m[I 2022-10-20 14:54:06,233][0m Trial 13 finished with value: 0.9062922688902247 and parameters: {'qda_reg_param': 0.15000000000000002, 'qda_tol': 1.72939924291586e-05}. Best is trial 0 with value: 0.907471.[0m
[32m[I 2022-10-20 14:54:06,613][0m Trial 15 finished with value: 0.9074710020951025 and parameters: {'qda_reg_param': 0.05, 'qda_tol': 0.00040829377491186585}. Best is trial 0 with value: 0.907471.[0m
[32m[I 2022-10-20 14:54:13,509][0m Trial 16 finished with value: 0.9074710020951025 and parameters: {'qda_reg_param': 0.05, 'qda_tol': 0.0005750321900563094}. Best is trial 0 with value: 0.907471.[0m
[32m[I 2022-10-20 14:54:14,533][0m Trial 17 finished with value: 0.8712101843086053 and parameters: {'qda_reg_param': 0.0, 'qda_tol': 0.0009030519231175981}. Best is trial 0 with value: 0.907471.[0m
[32m[I 2022-10-20 14:54:17,603][0m Trial 18 finished with value: 0.905848436475046 and parameters: {'qda_reg_param': 0.30000000000000004, 'qda_tol': 0.00019190718560623695}. Best is trial 0 with value: 0.907471.[0m
[32m[I 2022-10-20 14:54:18,162][0m Trial 19 finished with value: 0.905848436475046 and parameters: {'qda_reg_param': 0.30000000000000004, 'qda_tol': 0.0009841640874374143}. Best is trial 0 with value: 0.907471.[0m
[32m[I 2022-10-20 14:54:18,528][0m Trial 20 finished with value: 0.8712101843086053 and parameters: {'qda_reg_param': 0.0, 'qda_tol': 0.00015193181644962414}. Best is trial 0 with value: 0.907471.[0m
[32m[I 2022-10-20 14:54:18,763][0m Trial 22 finished with value: 0.8712101843086053 and parameters: {'qda_reg_param': 0.0, 'qda_tol': 0.00015107975314132714}. Best is trial 0 with value: 0.907471.[0m
[32m[I 2022-10-20 14:54:19,516][0m Trial 21 finished with value: 0.8712101843086053 and parameters: {'qda_reg_param': 0.0, 'qda_tol': 0.00015144902762285613}. Best is trial 0 with value: 0.907471.[0m
[32m[I 2022-10-20 14:54:19,921][0m Trial 23 finished with value: 0.9074710020951025 and parameters: {'qda_reg_param': 0.05, 'qda_tol': 0.00019073575292290012}. Best is trial 0 with value: 0.907471.[0m
[32m[I 2022-10-20 14:54:23,357][0m Trial 25 finished with value: 0.9005129068031295 and parameters: {'qda_reg_param': 0.4, 'qda_tol': 0.0001674552430621688}. Best is trial 0 with value: 0.907471.[0m
[32m[I 2022-10-20 14:54:23,778][0m Trial 24 finished with value: 0.9046965589752098 and parameters: {'qda_reg_param': 0.35000000000000003, 'qda_tol': 0.00019596495067410885}. Best is trial 0 with value: 0.907471.[0m
[32m[I 2022-10-20 14:54:28,164][0m Trial 26 finished with value: 0.8959405588555578 and parameters: {'qda_reg_param': 0.45, 'qda_tol': 0.00015188359585688714}. Best is trial 0 with value: 0.907471.[0m
[32m[I 2022-10-20 14:54:31,264][0m Trial 29 finished with value: 0.9073081783954601 and parameters: {'qda_reg_param': 0.1, 'qda_tol': 0.000330740650977594}. Best is trial 0 with value: 0.907471.[0m
[32m[I 2022-10-20 14:54:31,725][0m Trial 27 finished with value: 0.8776816513824245 and parameters: {'qda_reg_param': 0.9500000000000001, 'qda_tol': 0.0001313241064629697}. Best is trial 0 with value: 0.907471.[0m
[32m[I 2022-10-20 14:54:31,741][0m Trial 28 finished with value: 0.9073081783954601 and parameters: {'qda_reg_param': 0.1, 'qda_tol': 0.00018952067242359978}. Best is trial 0 with value: 0.907471.[0m
[32m[I 2022-10-20 14:54:32,912][0m Trial 30 finished with value: 0.8959405588555578 and parameters: {'qda_reg_param': 0.45, 'qda_tol': 0.00040557440324187486}. Best is trial 0 with value: 0.907471.[0m
[32m[I 2022-10-20 14:54:33,199][0m Trial 31 finished with value: 0.9005129068031295 and parameters: {'qda_reg_param': 0.4, 'qda_tol': 0.00041199544184787644}. Best is trial 0 with value: 0.907471.[0m
[32m[I 2022-10-20 14:54:34,831][0m Trial 32 finished with value: 0.9062922688902247 and parameters: {'qda_reg_param': 0.15000000000000002, 'qda_tol': 0.0005723742532109071}. Best is trial 0 with value: 0.907471.[0m
[32m[I 2022-10-20 14:54:34,831][0m Trial 33 finished with value: 0.9073081783954601 and parameters: {'qda_reg_param': 0.1, 'qda_tol': 0.000543500739001157}. Best is trial 0 with value: 0.907471.[0m
[32m[I 2022-10-20 14:54:38,176][0m Trial 34 finished with value: 0.9062922688902247 and parameters: {'qda_reg_param': 0.15000000000000002, 'qda_tol': 0.0005989706265549998}. Best is trial 0 with value: 0.907471.[0m
[32m[I 2022-10-20 14:54:43,931][0m Trial 36 finished with value: 0.905848436475046 and parameters: {'qda_reg_param': 0.2, 'qda_tol': 7.487808105856945e-05}. Best is trial 0 with value: 0.907471.[0m
[32m[I 2022-10-20 14:54:44,700][0m Trial 35 finished with value: 0.905848436475046 and parameters: {'qda_reg_param': 0.2, 'qda_tol': 6.172800640415659e-05}. Best is trial 0 with value: 0.907471.[0m
[32m[I 2022-10-20 14:54:45,513][0m Trial 37 finished with value: 0.905848436475046 and parameters: {'qda_reg_param': 0.2, 'qda_tol': 6.923451166818252e-05}. Best is trial 0 with value: 0.907471.[0m
[32m[I 2022-10-20 14:54:46,478][0m Trial 38 finished with value: 0.9062922688902247 and parameters: {'qda_reg_param': 0.15000000000000002, 'qda_tol': 0.000661425555979512}. Best is trial 0 with value: 0.907471.[0m
[32m[I 2022-10-20 14:54:46,839][0m Trial 39 finished with value: 0.9062922688902247 and parameters: {'qda_reg_param': 0.15000000000000002, 'qda_tol': 0.0006389442606032858}. Best is trial 0 with value: 0.907471.[0m
[32m[I 2022-10-20 14:54:47,606][0m Trial 41 finished with value: 0.905848436475046 and parameters: {'qda_reg_param': 0.2, 'qda_tol': 8.515884622481308e-05}. Best is trial 0 with value: 0.907471.[0m
[32m[I 2022-10-20 14:54:47,930][0m Trial 40 finished with value: 0.905848436475046 and parameters: {'qda_reg_param': 0.2, 'qda_tol': 8.25082815407217e-05}. Best is trial 0 with value: 0.907471.[0m
[32m[I 2022-10-20 14:54:49,608][0m Trial 42 finished with value: 0.8879634640551044 and parameters: {'qda_reg_param': 0.8500000000000001, 'qda_tol': 6.221981873728897e-05}. Best is trial 0 with value: 0.907471.[0m
[32m[I 2022-10-20 14:54:53,599][0m Trial 43 finished with value: 0.8879634640551044 and parameters: {'qda_reg_param': 0.8500000000000001, 'qda_tol': 0.0002502563056543319}. Best is trial 0 with value: 0.907471.[0m
[32m[I 2022-10-20 14:54:54,947][0m Trial 44 finished with value: 0.9074710020951025 and parameters: {'qda_reg_param': 0.05, 'qda_tol': 0.0002997213517780376}. Best is trial 0 with value: 0.907471.[0m
[32m[I 2022-10-20 14:54:57,282][0m Trial 45 finished with value: 0.9074710020951025 and parameters: {'qda_reg_param': 0.05, 'qda_tol': 8.755637491755305e-06}. Best is trial 0 with value: 0.907471.[0m
[32m[I 2022-10-20 14:54:59,429][0m Trial 46 finished with value: 0.9074710020951025 and parameters: {'qda_reg_param': 0.05, 'qda_tol': 0.000256239169672161}. Best is trial 0 with value: 0.907471.[0m
[32m[I 2022-10-20 14:54:59,601][0m Trial 47 finished with value: 0.8879634640551044 and parameters: {'qda_reg_param': 0.8500000000000001, 'qda_tol': 8.093839209174976e-06}. Best is trial 0 with value: 0.907471.[0m
[32m[I 2022-10-20 14:55:00,865][0m Trial 48 finished with value: 0.9074710020951025 and parameters: {'qda_reg_param': 0.05, 'qda_tol': 9.161934961294908e-06}. Best is trial 0 with value: 0.907471.[0m
[32m[I 2022-10-20 14:55:01,490][0m Trial 49 finished with value: 0.9074710020951025 and parameters: {'qda_reg_param': 0.05, 'qda_tol': 8.341456536373152e-06}. Best is trial 0 with value: 0.907471.[0m
[32m[I 2022-10-20 14:55:02,093][0m Trial 50 finished with value: 0.9074710020951025 and parameters: {'qda_reg_param': 0.05, 'qda_tol': 0.0002798419378200494}. Best is trial 0 with value: 0.907471.[0m
[32m[I 2022-10-20 14:55:04,693][0m Trial 52 finished with value: 0.9074710020951025 and parameters: {'qda_reg_param': 0.05, 'qda_tol': 6.169623893841851e-06}. Best is trial 0 with value: 0.907471.[0m
[32m[I 2022-10-20 14:55:05,061][0m Trial 51 finished with value: 0.9074710020951025 and parameters: {'qda_reg_param': 0.05, 'qda_tol': 9.659056140050757e-06}. Best is trial 0 with value: 0.907471.[0m
[32m[I 2022-10-20 14:55:07,946][0m Trial 53 finished with value: 0.9074710020951025 and parameters: {'qda_reg_param': 0.05, 'qda_tol': 0.00029499155851142806}. Best is trial 0 with value: 0.907471.[0m
[32m[I 2022-10-20 14:55:10,091][0m Trial 54 finished with value: 0.9074710020951025 and parameters: {'qda_reg_param': 0.05, 'qda_tol': 8.218753538294581e-06}. Best is trial 0 with value: 0.907471.[0m
[32m[I 2022-10-20 14:55:12,729][0m Trial 55 finished with value: 0.9074710020951025 and parameters: {'qda_reg_param': 0.05, 'qda_tol': 2.183852683282878e-06}. Best is trial 0 with value: 0.907471.[0m
[32m[I 2022-10-20 14:55:13,867][0m Trial 57 finished with value: 0.9074710020951025 and parameters: {'qda_reg_param': 0.05, 'qda_tol': 3.672889625765881e-06}. Best is trial 0 with value: 0.907471.[0m
[32m[I 2022-10-20 14:55:14,337][0m Trial 56 finished with value: 0.9073081783954601 and parameters: {'qda_reg_param': 0.1, 'qda_tol': 3.88631819848466e-06}. Best is trial 0 with value: 0.907471.[0m
[32m[I 2022-10-20 14:55:15,256][0m Trial 58 finished with value: 0.9074710020951025 and parameters: {'qda_reg_param': 0.05, 'qda_tol': 4.6108924711652134e-06}. Best is trial 0 with value: 0.907471.[0m
[32m[I 2022-10-20 14:55:16,713][0m Trial 59 finished with value: 0.9073081783954601 and parameters: {'qda_reg_param': 0.1, 'qda_tol': 3.769733222626453e-06}. Best is trial 0 with value: 0.907471.[0m
[32m[I 2022-10-20 14:55:17,870][0m Trial 60 finished with value: 0.9073081783954601 and parameters: {'qda_reg_param': 0.1, 'qda_tol': 3.856565860491701e-06}. Best is trial 0 with value: 0.907471.[0m
[32m[I 2022-10-20 14:55:19,638][0m Trial 61 finished with value: 0.9073081783954601 and parameters: {'qda_reg_param': 0.1, 'qda_tol': 4.136207552581095e-06}. Best is trial 0 with value: 0.907471.[0m
[32m[I 2022-10-20 14:55:21,544][0m Trial 62 finished with value: 0.905848436475046 and parameters: {'qda_reg_param': 0.25, 'qda_tol': 3.1729863093250046e-06}. Best is trial 0 with value: 0.907471.[0m
[32m[I 2022-10-20 14:55:23,941][0m Trial 63 finished with value: 0.905848436475046 and parameters: {'qda_reg_param': 0.25, 'qda_tol': 3.860504511133837e-06}. Best is trial 0 with value: 0.907471.[0m
[32m[I 2022-10-20 14:55:24,544][0m Trial 64 finished with value: 0.905848436475046 and parameters: {'qda_reg_param': 0.25, 'qda_tol': 4.49127034574452e-06}. Best is trial 0 with value: 0.907471.[0m
[32m[I 2022-10-20 14:55:25,799][0m Trial 65 finished with value: 0.905848436475046 and parameters: {'qda_reg_param': 0.25, 'qda_tol': 1.3336343795321727e-06}. Best is trial 0 with value: 0.907471.[0m
[32m[I 2022-10-20 14:55:28,170][0m Trial 66 finished with value: 0.905848436475046 and parameters: {'qda_reg_param': 0.25, 'qda_tol': 1.3460303558041381e-06}. Best is trial 0 with value: 0.907471.[0m
[32m[I 2022-10-20 14:55:29,711][0m Trial 67 finished with value: 0.905848436475046 and parameters: {'qda_reg_param': 0.25, 'qda_tol': 1.1610582891907942e-06}. Best is trial 0 with value: 0.907471.[0m
[32m[I 2022-10-20 14:55:30,579][0m Trial 68 finished with value: 0.8712101843086053 and parameters: {'qda_reg_param': 0.0, 'qda_tol': 1.2167757086194747e-05}. Best is trial 0 with value: 0.907471.[0m
[32m[I 2022-10-20 14:55:31,862][0m Trial 69 finished with value: 0.8712101843086053 and parameters: {'qda_reg_param': 0.0, 'qda_tol': 1.3246643229646887e-05}. Best is trial 0 with value: 0.907471.[0m
[32m[I 2022-10-20 14:55:32,785][0m Trial 70 finished with value: 0.8712101843086053 and parameters: {'qda_reg_param': 0.0, 'qda_tol': 0.0008741266629814832}. Best is trial 0 with value: 0.907471.[0m
[32m[I 2022-10-20 14:55:35,913][0m Trial 71 finished with value: 0.8712101843086053 and parameters: {'qda_reg_param': 0.0, 'qda_tol': 2.6507447304436833e-05}. Best is trial 0 with value: 0.907471.[0m
[32m[I 2022-10-20 14:55:36,745][0m Trial 72 finished with value: 0.8712101843086053 and parameters: {'qda_reg_param': 0.0, 'qda_tol': 1.3157944361223921e-05}. Best is trial 0 with value: 0.907471.[0m
[32m[I 2022-10-20 14:55:37,212][0m Trial 73 finished with value: 0.8712101843086053 and parameters: {'qda_reg_param': 0.0, 'qda_tol': 1.283904687275303e-05}. Best is trial 0 with value: 0.907471.[0m
[32m[I 2022-10-20 14:55:40,102][0m Trial 74 finished with value: 0.8712101843086053 and parameters: {'qda_reg_param': 0.0, 'qda_tol': 1.3690727762327028e-05}. Best is trial 0 with value: 0.907471.[0m
[32m[I 2022-10-20 14:55:41,916][0m Trial 75 finished with value: 0.8712101843086053 and parameters: {'qda_reg_param': 0.0, 'qda_tol': 0.0008292460709526761}. Best is trial 0 with value: 0.907471.[0m
[32m[I 2022-10-20 14:55:43,261][0m Trial 76 finished with value: 0.8712101843086053 and parameters: {'qda_reg_param': 0.0, 'qda_tol': 2.6828312973556022e-05}. Best is trial 0 with value: 0.907471.[0m
[32m[I 2022-10-20 14:55:44,195][0m Trial 77 finished with value: 0.8902004936721672 and parameters: {'qda_reg_param': 0.55, 'qda_tol': 3.175197080966661e-05}. Best is trial 0 with value: 0.907471.[0m
[32m[I 2022-10-20 14:55:44,819][0m Trial 78 finished with value: 0.8712101843086053 and parameters: {'qda_reg_param': 0.0, 'qda_tol': 2.780030609349378e-05}. Best is trial 0 with value: 0.907471.[0m
[32m[I 2022-10-20 14:55:48,108][0m Trial 79 finished with value: 0.9062922688902247 and parameters: {'qda_reg_param': 0.15000000000000002, 'qda_tol': 0.000237218719434582}. Best is trial 0 with value: 0.907471.[0m
[32m[I 2022-10-20 14:55:48,315][0m Trial 80 finished with value: 0.8904294450741927 and parameters: {'qda_reg_param': 0.65, 'qda_tol': 0.00010379408907072653}. Best is trial 0 with value: 0.907471.[0m
[32m[I 2022-10-20 14:55:48,315][0m Trial 81 finished with value: 0.9062922688902247 and parameters: {'qda_reg_param': 0.15000000000000002, 'qda_tol': 0.00011842843992134269}. Best is trial 0 with value: 0.907471.[0m
[32m[I 2022-10-20 14:55:50,970][0m Trial 82 finished with value: 0.9062922688902247 and parameters: {'qda_reg_param': 0.15000000000000002, 'qda_tol': 0.00011570468466587299}. Best is trial 0 with value: 0.907471.[0m
[32m[I 2022-10-20 14:55:52,532][0m Trial 83 finished with value: 0.9062922688902247 and parameters: {'qda_reg_param': 0.15000000000000002, 'qda_tol': 0.00023403564673708558}. Best is trial 0 with value: 0.907471.[0m
[32m[I 2022-10-20 14:55:55,210][0m Trial 84 finished with value: 0.9062922688902247 and parameters: {'qda_reg_param': 0.15000000000000002, 'qda_tol': 0.00011157235860259518}. Best is trial 0 with value: 0.907471.[0m
[32m[I 2022-10-20 14:55:56,023][0m Trial 86 finished with value: 0.9062922688902247 and parameters: {'qda_reg_param': 0.15000000000000002, 'qda_tol': 0.0004463870727665891}. Best is trial 0 with value: 0.907471.[0m
[32m[I 2022-10-20 14:55:56,821][0m Trial 85 finished with value: 0.9062922688902247 and parameters: {'qda_reg_param': 0.15000000000000002, 'qda_tol': 0.00044540224316726444}. Best is trial 0 with value: 0.907471.[0m
[32m[I 2022-10-20 14:56:00,580][0m Trial 87 finished with value: 0.9073081783954601 and parameters: {'qda_reg_param': 0.1, 'qda_tol': 0.0004460540016637226}. Best is trial 0 with value: 0.907471.[0m
[32m[I 2022-10-20 14:56:01,213][0m Trial 88 finished with value: 0.9073081783954601 and parameters: {'qda_reg_param': 0.1, 'qda_tol': 0.0004573044346210691}. Best is trial 0 with value: 0.907471.[0m
[32m[I 2022-10-20 14:56:02,316][0m Trial 89 finished with value: 0.9073081783954601 and parameters: {'qda_reg_param': 0.1, 'qda_tol': 0.00043704527450583945}. Best is trial 0 with value: 0.907471.[0m
[32m[I 2022-10-20 14:56:04,400][0m Trial 90 finished with value: 0.9073081783954601 and parameters: {'qda_reg_param': 0.1, 'qda_tol': 1.912921809373043e-05}. Best is trial 0 with value: 0.907471.[0m
[32m[I 2022-10-20 14:56:05,523][0m Trial 91 finished with value: 0.9074710020951025 and parameters: {'qda_reg_param': 0.05, 'qda_tol': 0.0004487386422962098}. Best is trial 0 with value: 0.907471.[0m
[32m[I 2022-10-20 14:56:07,187][0m Trial 92 finished with value: 0.9074710020951025 and parameters: {'qda_reg_param': 0.05, 'qda_tol': 9.142988893194882e-06}. Best is trial 0 with value: 0.907471.[0m
[32m[I 2022-10-20 14:56:08,258][0m Trial 94 finished with value: 0.9074710020951025 and parameters: {'qda_reg_param': 0.05, 'qda_tol': 1.8124930708362184e-05}. Best is trial 0 with value: 0.907471.[0m
[32m[I 2022-10-20 14:56:09,121][0m Trial 93 finished with value: 0.9074710020951025 and parameters: {'qda_reg_param': 0.05, 'qda_tol': 1.9689954124938292e-05}. Best is trial 0 with value: 0.907471.[0m
[32m[I 2022-10-20 14:56:11,192][0m Trial 95 finished with value: 0.9074710020951025 and parameters: {'qda_reg_param': 0.05, 'qda_tol': 5.71956965486161e-06}. Best is trial 0 with value: 0.907471.[0m
[32m[I 2022-10-20 14:56:11,208][0m Trial 96 finished with value: 0.9074710020951025 and parameters: {'qda_reg_param': 0.05, 'qda_tol': 6.09144331664392e-06}. Best is trial 0 with value: 0.907471.[0m
[32m[I 2022-10-20 14:56:12,098][0m Trial 97 finished with value: 0.9074710020951025 and parameters: {'qda_reg_param': 0.05, 'qda_tol': 5.683725694983723e-06}. Best is trial 0 with value: 0.907471.[0m
[32m[I 2022-10-20 14:56:12,569][0m Trial 98 finished with value: 0.9074710020951025 and parameters: {'qda_reg_param': 0.05, 'qda_tol': 5.971817567721068e-06}. Best is trial 0 with value: 0.907471.[0m
