[32m[I 2022-10-20 15:12:27,037][0m Trial 38 finished with value: 0.9047439555188416 and parameters: {'rc_C': 1.923496422140934e-05, 'rc_tol': 0.005592614777722926}. Best is trial 40 with value: 0.904744.[0m
[32m[I 2022-10-20 15:12:27,037][0m Trial 34 finished with value: 0.9047439555188416 and parameters: {'rc_C': 1.3973773746487154e-05, 'rc_tol': 0.005987063435637532}. Best is trial 40 with value: 0.904744.[0m
[32m[I 2022-10-20 15:12:27,100][0m Trial 39 finished with value: 0.9047439555188416 and parameters: {'rc_C': 1.8553661894311038e-05, 'rc_tol': 0.0064006116350499844}. Best is trial 40 with value: 0.904744.[0m
[32m[I 2022-10-20 15:12:27,100][0m Trial 35 finished with value: 0.9047439555188416 and parameters: {'rc_C': 1.4722398360969934e-05, 'rc_tol': 0.005703148001139747}. Best is trial 40 with value: 0.904744.[0m
[32m[I 2022-10-20 15:12:27,381][0m Trial 37 finished with value: 0.9047439555188416 and parameters: {'rc_C': 1.68393551557286e-05, 'rc_tol': 0.00624176516891739}. Best is trial 40 with value: 0.904744.[0m
[32m[I 2022-10-20 15:12:29,576][0m Trial 42 finished with value: 0.9047439555188416 and parameters: {'rc_C': 0.0006687187611613777, 'rc_tol': 0.008738108037566621}. Best is trial 42 with value: 0.904744.[0m
[32m[I 2022-10-20 15:12:29,795][0m Trial 43 finished with value: 0.9046830741462173 and parameters: {'rc_C': 9.709798747330213, 'rc_tol': 0.00943767264221118}. Best is trial 3 with value: 0.904744.[0m
[32m[I 2022-10-20 15:12:29,889][0m Trial 45 finished with value: 0.9047439555188416 and parameters: {'rc_C': 0.00039410439183292287, 'rc_tol': 0.009570764818532158}. Best is trial 47 with value: 0.904744.[0m
[32m[I 2022-10-20 15:12:29,967][0m Trial 47 finished with value: 0.9047439555188416 and parameters: {'rc_C': 5.784405124055523, 'rc_tol': 0.009944154487452598}. Best is trial 47 with value: 0.904744.[0m
[32m[I 2022-10-20 15:12:30,045][0m Trial 48 finished with value: 0.9047439555188416 and parameters: {'rc_C': 0.0005890416771054814, 'rc_tol': 0.009890365914471505}. Best is trial 48 with value: 0.904744.[0m
[32m[I 2022-10-20 15:12:30,045][0m Trial 44 finished with value: 0.9047439555188416 and parameters: {'rc_C': 5.670894526911982, 'rc_tol': 0.009318635394406465}. Best is trial 48 with value: 0.904744.[0m
[32m[I 2022-10-20 15:12:30,045][0m Trial 41 finished with value: 0.9043863195767216 and parameters: {'rc_C': 21.704716465036274, 'rc_tol': 0.008621996059996381}. Best is trial 48 with value: 0.904744.[0m
[32m[I 2022-10-20 15:12:30,302][0m Trial 46 finished with value: 0.9047439555188416 and parameters: {'rc_C': 0.0005057562975749141, 'rc_tol': 0.009376375571210427}. Best is trial 48 with value: 0.904744.[0m
[32m[I 2022-10-20 15:12:32,177][0m Trial 49 finished with value: 0.9047439555188416 and parameters: {'rc_C': 4.98958604098927e-06, 'rc_tol': 0.009916165088674453}. Best is trial 49 with value: 0.904744.[0m
[32m[I 2022-10-20 15:12:32,555][0m Trial 50 finished with value: 0.9047439555188416 and parameters: {'rc_C': 5.1971008184649906e-06, 'rc_tol': 0.0028309504820457267}. Best is trial 50 with value: 0.904744.[0m
[32m[I 2022-10-20 15:12:32,798][0m Trial 56 finished with value: 0.9047439555188416 and parameters: {'rc_C': 4.921881764684817e-06, 'rc_tol': 0.0028514109107788937}. Best is trial 56 with value: 0.904744.[0m
[32m[I 2022-10-20 15:12:32,908][0m Trial 51 finished with value: 0.9047439555188416 and parameters: {'rc_C': 1.0331353183531608e-06, 'rc_tol': 0.0029520065228748576}. Best is trial 56 with value: 0.904744.[0m
[32m[I 2022-10-20 15:12:32,986][0m Trial 53 finished with value: 0.9047439555188416 and parameters: {'rc_C': 5.0816271715856404e-06, 'rc_tol': 0.002499995966236765}. Best is trial 56 with value: 0.904744.[0m
[32m[I 2022-10-20 15:12:32,986][0m Trial 52 finished with value: 0.9047439555188416 and parameters: {'rc_C': 3.819470953874703e-06, 'rc_tol': 0.0026794062454535013}. Best is trial 56 with value: 0.904744.[0m
[32m[I 2022-10-20 15:12:33,143][0m Trial 54 finished with value: 0.9047439555188416 and parameters: {'rc_C': 3.0841860542068858e-06, 'rc_tol': 0.002576856774155539}. Best is trial 56 with value: 0.904744.[0m
[32m[I 2022-10-20 15:12:33,236][0m Trial 55 finished with value: 0.9047439555188416 and parameters: {'rc_C': 5.068684600766191e-06, 'rc_tol': 0.00261331812345686}. Best is trial 56 with value: 0.904744.[0m
[32m[I 2022-10-20 15:12:34,117][0m Trial 57 finished with value: 0.9047439555188416 and parameters: {'rc_C': 4.4453402342092846e-06, 'rc_tol': 0.0010741059318138705}. Best is trial 57 with value: 0.904744.[0m
[32m[I 2022-10-20 15:12:35,359][0m Trial 58 finished with value: 0.9047439555188416 and parameters: {'rc_C': 3.9499353918636435e-06, 'rc_tol': 0.0011350896635902263}. Best is trial 58 with value: 0.904744.[0m
[32m[I 2022-10-20 15:12:35,658][0m Trial 61 finished with value: 0.9047439555188416 and parameters: {'rc_C': 0.06944618815754514, 'rc_tol': 0.0009114172463406463}. Best is trial 61 with value: 0.904744.[0m
[32m[I 2022-10-20 15:12:35,752][0m Trial 63 finished with value: 0.9047439555188416 and parameters: {'rc_C': 0.037733356798449885, 'rc_tol': 0.001019817463229779}. Best is trial 64 with value: 0.904744.[0m
[32m[I 2022-10-20 15:12:35,830][0m Trial 64 finished with value: 0.9047439555188416 and parameters: {'rc_C': 0.034704563304300454, 'rc_tol': 0.0007949398612756892}. Best is trial 64 with value: 0.904744.[0m
[32m[I 2022-10-20 15:12:35,846][0m Trial 60 finished with value: 0.9047439555188416 and parameters: {'rc_C': 0.0035763864991277547, 'rc_tol': 0.0036222351260019247}. Best is trial 64 with value: 0.904744.[0m
[32m[I 2022-10-20 15:12:35,972][0m Trial 62 finished with value: 0.9047439555188416 and parameters: {'rc_C': 0.002722238543321777, 'rc_tol': 0.0007884646315301864}. Best is trial 64 with value: 0.904744.[0m
[32m[I 2022-10-20 15:12:35,972][0m Trial 59 finished with value: 0.9047439555188416 and parameters: {'rc_C': 0.07039790152741773, 'rc_tol': 0.0011546699534294056}. Best is trial 64 with value: 0.904744.[0m
[32m[I 2022-10-20 15:12:36,547][0m Trial 65 finished with value: 0.8892732136614788 and parameters: {'rc_C': 971170.3888937487, 'rc_tol': 0.0036341266319531015}. Best is trial 3 with value: 0.904744.[0m
[32m[I 2022-10-20 15:12:37,704][0m Trial 66 finished with value: 0.9047439555188416 and parameters: {'rc_C': 0.02675118425036463, 'rc_tol': 0.0007395419601211782}. Best is trial 66 with value: 0.904744.[0m
[32m[I 2022-10-20 15:12:38,467][0m Trial 70 finished with value: 0.9047439555188416 and parameters: {'rc_C': 2.1530095989766248e-05, 'rc_tol': 0.005362189921046903}. Best is trial 70 with value: 0.904744.[0m
[32m[I 2022-10-20 15:12:38,545][0m Trial 72 finished with value: 0.9047439555188416 and parameters: {'rc_C': 1.7734345739884845e-05, 'rc_tol': 0.005912685585295372}. Best is trial 72 with value: 0.904744.[0m
[32m[I 2022-10-20 15:12:38,545][0m Trial 69 finished with value: 0.9047439555188416 and parameters: {'rc_C': 1.8247337810481953e-05, 'rc_tol': 0.005487195720926341}. Best is trial 72 with value: 0.904744.[0m
[32m[I 2022-10-20 15:12:38,545][0m Trial 71 finished with value: 0.9047439555188416 and parameters: {'rc_C': 4.2251917414831934e-05, 'rc_tol': 0.0058906450741708465}. Best is trial 72 with value: 0.904744.[0m
[32m[I 2022-10-20 15:12:38,704][0m Trial 67 finished with value: 0.9047439555188416 and parameters: {'rc_C': 1.6639874220110133e-05, 'rc_tol': 0.006090036721718486}. Best is trial 72 with value: 0.904744.[0m
[32m[I 2022-10-20 15:12:38,766][0m Trial 68 finished with value: 0.9047439555188416 and parameters: {'rc_C': 1.6785751750109576e-05, 'rc_tol': 0.005527801363339318}. Best is trial 72 with value: 0.904744.[0m
[32m[I 2022-10-20 15:12:38,986][0m Trial 73 finished with value: 0.9047439555188416 and parameters: {'rc_C': 4.178948379019873e-05, 'rc_tol': 0.0016582441578256184}. Best is trial 73 with value: 0.904744.[0m
[32m[I 2022-10-20 15:12:39,777][0m Trial 74 finished with value: 0.9047439555188416 and parameters: {'rc_C': 1.8551883279092238e-05, 'rc_tol': 0.005495612816040091}. Best is trial 74 with value: 0.904744.[0m
[32m[I 2022-10-20 15:12:41,189][0m Trial 75 finished with value: 0.9047439555188416 and parameters: {'rc_C': 0.00020003625264367056, 'rc_tol': 0.0022573865614338353}. Best is trial 3 with value: 0.904744.[0m
[32m[I 2022-10-20 15:12:41,189][0m Trial 77 finished with value: 0.9041933218145332 and parameters: {'rc_C': 188.3777262515686, 'rc_tol': 0.002089039834834663}. Best is trial 3 with value: 0.904744.[0m
[32m[I 2022-10-20 15:12:41,189][0m Trial 76 finished with value: 0.9047439555188416 and parameters: {'rc_C': 2.2196432453121355, 'rc_tol': 0.0022094720941414105}. Best is trial 3 with value: 0.904744.[0m
[32m[I 2022-10-20 15:12:41,518][0m Trial 78 finished with value: 0.9041933218145332 and parameters: {'rc_C': 330.9140287552975, 'rc_tol': 0.0020762180550225997}. Best is trial 3 with value: 0.904744.[0m
[32m[I 2022-10-20 15:12:41,596][0m Trial 80 finished with value: 0.9041933218145332 and parameters: {'rc_C': 169.94746080331583, 'rc_tol': 0.0022682271391290813}. Best is trial 3 with value: 0.904744.[0m
[32m[I 2022-10-20 15:12:41,675][0m Trial 79 finished with value: 0.9041933218145332 and parameters: {'rc_C': 113.46869801220497, 'rc_tol': 0.0024126825504159535}. Best is trial 3 with value: 0.904744.[0m
[32m[I 2022-10-20 15:12:41,771][0m Trial 81 finished with value: 0.9041933218145332 and parameters: {'rc_C': 149.79539549149928, 'rc_tol': 0.0021014023071136575}. Best is trial 3 with value: 0.904744.[0m
[32m[I 2022-10-20 15:12:42,085][0m Trial 82 finished with value: 0.9047439555188416 and parameters: {'rc_C': 0.00021688024954457614, 'rc_tol': 0.0022457778551450676}. Best is trial 82 with value: 0.904744.[0m
[32m[I 2022-10-20 15:12:43,944][0m Trial 83 finished with value: 0.9047439555188416 and parameters: {'rc_C': 0.001106732360696277, 'rc_tol': 0.007176476740587759}. Best is trial 84 with value: 0.904744.[0m
[32m[I 2022-10-20 15:12:44,006][0m Trial 84 finished with value: 0.9047439555188416 and parameters: {'rc_C': 0.666107192035107, 'rc_tol': 0.0070348975905774325}. Best is trial 84 with value: 0.904744.[0m
[32m[I 2022-10-20 15:12:44,304][0m Trial 88 finished with value: 0.9047439555188416 and parameters: {'rc_C': 0.0002049004055955601, 'rc_tol': 0.007034443924669636}. Best is trial 88 with value: 0.904744.[0m
[32m[I 2022-10-20 15:12:44,434][0m Trial 87 finished with value: 0.9047439555188416 and parameters: {'rc_C': 0.0012796033997099475, 'rc_tol': 0.006798361642242419}. Best is trial 88 with value: 0.904744.[0m
[32m[I 2022-10-20 15:12:44,513][0m Trial 85 finished with value: 0.9047439555188416 and parameters: {'rc_C': 0.0011309647426733071, 'rc_tol': 0.006991280981484947}. Best is trial 88 with value: 0.904744.[0m
[32m[I 2022-10-20 15:12:44,591][0m Trial 86 finished with value: 0.9047439555188416 and parameters: {'rc_C': 0.0013278664304190702, 'rc_tol': 0.007045927035060212}. Best is trial 88 with value: 0.904744.[0m
[32m[I 2022-10-20 15:12:44,685][0m Trial 89 finished with value: 0.9047439555188416 and parameters: {'rc_C': 0.0011143552758120427, 'rc_tol': 0.006819665126037067}. Best is trial 90 with value: 0.904744.[0m
[32m[I 2022-10-20 15:12:44,766][0m Trial 90 finished with value: 0.9047439555188416 and parameters: {'rc_C': 0.00021714292290807814, 'rc_tol': 0.007414325347909202}. Best is trial 90 with value: 0.904744.[0m
[32m[I 2022-10-20 15:12:46,007][0m Trial 91 finished with value: 0.9047439555188416 and parameters: {'rc_C': 6.525071379745739e-06, 'rc_tol': 0.0030475753499233406}. Best is trial 92 with value: 0.904744.[0m
[32m[I 2022-10-20 15:12:46,085][0m Trial 92 finished with value: 0.9047439555188416 and parameters: {'rc_C': 5.8252238706769124e-06, 'rc_tol': 0.0029134137650773397}. Best is trial 92 with value: 0.904744.[0m
[32m[I 2022-10-20 15:12:46,948][0m Trial 93 finished with value: 0.9047439555188416 and parameters: {'rc_C': 0.10144139821745503, 'rc_tol': 0.0017104169794495306}. Best is trial 93 with value: 0.904744.[0m
[32m[I 2022-10-20 15:12:47,120][0m Trial 94 finished with value: 0.9047439555188416 and parameters: {'rc_C': 0.1663147155863846, 'rc_tol': 0.0014660002741940065}. Best is trial 94 with value: 0.904744.[0m
[32m[I 2022-10-20 15:12:47,214][0m Trial 95 finished with value: 0.9047439555188416 and parameters: {'rc_C': 6.753909195183636e-06, 'rc_tol': 0.001426055778110596}. Best is trial 95 with value: 0.904744.[0m
[32m[I 2022-10-20 15:12:47,292][0m Trial 97 finished with value: 0.9047439555188416 and parameters: {'rc_C': 0.00614409746965873, 'rc_tol': 0.001452336642030261}. Best is trial 97 with value: 0.904744.[0m
[32m[I 2022-10-20 15:12:47,355][0m Trial 96 finished with value: 0.9047439555188416 and parameters: {'rc_C': 0.1342844093293849, 'rc_tol': 0.0012422820047628532}. Best is trial 97 with value: 0.904744.[0m
[32m[I 2022-10-20 15:12:47,433][0m Trial 98 finished with value: 0.9047439555188416 and parameters: {'rc_C': 0.16781997007976174, 'rc_tol': 0.0013648794164936775}. Best is trial 98 with value: 0.904744.[0m
[32m[I 2022-10-20 15:12:47,780][0m Trial 99 finished with value: 0.9047439555188416 and parameters: {'rc_C': 0.0035829222274869374, 'rc_tol': 0.0013449350964261852}. Best is trial 99 with value: 0.904744.[0m
[32m[I 2022-10-20 15:12:47,842][0m Study finished.[0m
[32m[I 2022-10-20 15:12:47,905][0m --------------------------------------------------------------------------------[0m
[32m[I 2022-10-20 15:12:47,905][0m --------------------           RUSBoostClassifier           --------------------[0m
[32m[I 2022-10-20 15:12:47,905][0m --------------------------------------------------------------------------------[0m
[32m[I 2022-10-20 15:12:47,937][0m A new study created in RDB with name: RUSBoostClassifier_b4f53b70[0m
[32m[I 2022-10-20 15:12:47,952][0m Study started.[0m
[32m[I 2022-10-20 15:13:08,474][0m Trial 4 finished with value: 0.9237863585696133 and parameters: {'rusbc_n_estimators': 25, 'rusbc_learning_rate': 0.025688645364365287, 'rusbc_sampling_strategy': 'not minority'}. Best is trial 4 with value: 0.923786.[0m
[32m[I 2022-10-20 15:13:18,016][0m Trial 2 finished with value: 0.31229924485982147 and parameters: {'rusbc_n_estimators': 25, 'rusbc_learning_rate': 0.00011173488570811953, 'rusbc_sampling_strategy': 'not majority'}. Best is trial 4 with value: 0.923786.[0m
[32m[I 2022-10-20 15:13:27,138][0m Trial 0 finished with value: 0.10117121198760491 and parameters: {'rusbc_n_estimators': 50, 'rusbc_learning_rate': 5.853414125802623e-06, 'rusbc_sampling_strategy': 'all'}. Best is trial 4 with value: 0.923786.[0m
[32m[I 2022-10-20 15:13:38,465][0m Trial 9 finished with value: 0.10117121198760491 and parameters: {'rusbc_n_estimators': 25, 'rusbc_learning_rate': 1.4560980171618567e-05, 'rusbc_sampling_strategy': 'not minority'}. Best is trial 4 with value: 0.923786.[0m
[32m[I 2022-10-20 15:13:46,254][0m Trial 1 finished with value: 0.12231775321658918 and parameters: {'rusbc_n_estimators': 75, 'rusbc_learning_rate': 0.0002846530431326341, 'rusbc_sampling_strategy': 'not minority'}. Best is trial 4 with value: 0.923786.[0m
[32m[I 2022-10-20 15:13:46,811][0m Trial 6 finished with value: 0.5744209402138118 and parameters: {'rusbc_n_estimators': 75, 'rusbc_learning_rate': 0.0011972873918977393, 'rusbc_sampling_strategy': 'not minority'}. Best is trial 4 with value: 0.923786.[0m
[32m[I 2022-10-20 15:13:49,985][0m Trial 5 finished with value: 0.3013147453657114 and parameters: {'rusbc_n_estimators': 50, 'rusbc_learning_rate': 0.0002425186045483534, 'rusbc_sampling_strategy': 'majority'}. Best is trial 4 with value: 0.923786.[0m
[32m[I 2022-10-20 15:14:00,134][0m Trial 10 finished with value: 0.3083464227585943 and parameters: {'rusbc_n_estimators': 25, 'rusbc_learning_rate': 0.0001331459608308873, 'rusbc_sampling_strategy': 'majority'}. Best is trial 4 with value: 0.923786.[0m
[32m[I 2022-10-20 15:14:20,076][0m Trial 11 finished with value: 0.5744209402138118 and parameters: {'rusbc_n_estimators': 50, 'rusbc_learning_rate': 0.0013486132838852094, 'rusbc_sampling_strategy': 'all'}. Best is trial 4 with value: 0.923786.[0m
[32m[I 2022-10-20 15:14:41,323][0m Trial 16 finished with value: 0.760756523503783 and parameters: {'rusbc_n_estimators': 25, 'rusbc_learning_rate': 0.06455901410875363, 'rusbc_sampling_strategy': 'all'}. Best is trial 4 with value: 0.923786.[0m
[32m[I 2022-10-20 15:14:43,707][0m Trial 8 finished with value: 0.19503017521830396 and parameters: {'rusbc_n_estimators': 75, 'rusbc_learning_rate': 0.008614869302705759, 'rusbc_sampling_strategy': 'majority'}. Best is trial 4 with value: 0.923786.[0m
[32m[I 2022-10-20 15:14:52,815][0m Trial 13 finished with value: 0.7581185821475852 and parameters: {'rusbc_n_estimators': 50, 'rusbc_learning_rate': 0.07282118712328971, 'rusbc_sampling_strategy': 'not majority'}. Best is trial 4 with value: 0.923786.[0m
[32m[I 2022-10-20 15:14:54,693][0m Trial 7 finished with value: 0.3083464227585943 and parameters: {'rusbc_n_estimators': 100, 'rusbc_learning_rate': 4.403419509594429e-06, 'rusbc_sampling_strategy': 'majority'}. Best is trial 4 with value: 0.923786.[0m
[32m[I 2022-10-20 15:14:55,215][0m Trial 3 finished with value: 0.3083464227585943 and parameters: {'rusbc_n_estimators': 100, 'rusbc_learning_rate': 4.9781814033726365e-06, 'rusbc_sampling_strategy': 'majority'}. Best is trial 4 with value: 0.923786.[0m
[32m[I 2022-10-20 15:14:55,731][0m Trial 14 finished with value: 0.3083464227585943 and parameters: {'rusbc_n_estimators': 50, 'rusbc_learning_rate': 4.699296634279935e-06, 'rusbc_sampling_strategy': 'majority'}. Best is trial 4 with value: 0.923786.[0m
[32m[I 2022-10-20 15:15:16,260][0m Trial 20 finished with value: 0.6883541153859062 and parameters: {'rusbc_n_estimators': 25, 'rusbc_learning_rate': 0.9520583895998307, 'rusbc_sampling_strategy': 'all'}. Best is trial 4 with value: 0.923786.[0m
[32m[I 2022-10-20 15:15:16,777][0m Trial 21 finished with value: 0.6743092526558221 and parameters: {'rusbc_n_estimators': 25, 'rusbc_learning_rate': 0.6896657682626635, 'rusbc_sampling_strategy': 'all'}. Best is trial 4 with value: 0.923786.[0m
[32m[I 2022-10-20 15:15:17,328][0m Trial 22 finished with value: 0.6743092526558221 and parameters: {'rusbc_n_estimators': 25, 'rusbc_learning_rate': 0.7070907015623267, 'rusbc_sampling_strategy': 'all'}. Best is trial 4 with value: 0.923786.[0m
[32m[I 2022-10-20 15:15:21,832][0m Trial 15 finished with value: 0.8246871215238659 and parameters: {'rusbc_n_estimators': 100, 'rusbc_learning_rate': 0.15262607958606608, 'rusbc_sampling_strategy': 'all'}. Best is trial 4 with value: 0.923786.[0m
[32m[I 2022-10-20 15:15:37,209][0m Trial 23 finished with value: 0.9422876172131923 and parameters: {'rusbc_n_estimators': 25, 'rusbc_learning_rate': 0.04589992629257535, 'rusbc_sampling_strategy': 'all'}. Best is trial 23 with value: 0.942288.[0m
[32m[I 2022-10-20 15:15:37,973][0m Trial 24 finished with value: 0.9233809935234104 and parameters: {'rusbc_n_estimators': 25, 'rusbc_learning_rate': 0.028961400935040654, 'rusbc_sampling_strategy': 'not minority'}. Best is trial 23 with value: 0.942288.[0m
[32m[I 2022-10-20 15:15:38,916][0m Trial 25 finished with value: 0.9208656654546435 and parameters: {'rusbc_n_estimators': 25, 'rusbc_learning_rate': 0.04037792403221853, 'rusbc_sampling_strategy': 'not minority'}. Best is trial 23 with value: 0.942288.[0m
[32m[I 2022-10-20 15:15:51,286][0m Trial 12 finished with value: 0.6649143793096409 and parameters: {'rusbc_n_estimators': 100, 'rusbc_learning_rate': 0.01444154198565855, 'rusbc_sampling_strategy': 'majority'}. Best is trial 23 with value: 0.942288.[0m
[32m[I 2022-10-20 15:15:59,383][0m Trial 28 finished with value: 0.8474132483112449 and parameters: {'rusbc_n_estimators': 25, 'rusbc_learning_rate': 0.01193776675297329, 'rusbc_sampling_strategy': 'not minority'}. Best is trial 23 with value: 0.942288.[0m
[32m[I 2022-10-20 15:16:04,569][0m Trial 18 finished with value: 0.8979424831845224 and parameters: {'rusbc_n_estimators': 100, 'rusbc_learning_rate': 0.8186948283018073, 'rusbc_sampling_strategy': 'all'}. Best is trial 23 with value: 0.942288.[0m
[32m[I 2022-10-20 15:16:14,168][0m Trial 19 finished with value: 0.13600812304790302 and parameters: {'rusbc_n_estimators': 100, 'rusbc_learning_rate': 0.9786206811537393, 'rusbc_sampling_strategy': 'all'}. Best is trial 23 with value: 0.942288.[0m
[32m[I 2022-10-20 15:16:17,925][0m Trial 27 finished with value: 0.9240990235115991 and parameters: {'rusbc_n_estimators': 50, 'rusbc_learning_rate': 0.009613908751749752, 'rusbc_sampling_strategy': 'not minority'}. Best is trial 23 with value: 0.942288.[0m
[32m[I 2022-10-20 15:16:19,988][0m Trial 29 finished with value: 0.8473039533570059 and parameters: {'rusbc_n_estimators': 50, 'rusbc_learning_rate': 0.006211475615505371, 'rusbc_sampling_strategy': 'not minority'}. Best is trial 23 with value: 0.942288.[0m
[32m[I 2022-10-20 15:16:32,105][0m Trial 30 finished with value: 0.8473039533570059 and parameters: {'rusbc_n_estimators': 50, 'rusbc_learning_rate': 0.005348434102021106, 'rusbc_sampling_strategy': 'not minority'}. Best is trial 23 with value: 0.942288.[0m
[32m[I 2022-10-20 15:16:39,683][0m Trial 31 finished with value: 0.6366845557095607 and parameters: {'rusbc_n_estimators': 50, 'rusbc_learning_rate': 0.004007167939711968, 'rusbc_sampling_strategy': 'not minority'}. Best is trial 23 with value: 0.942288.[0m
[32m[I 2022-10-20 15:16:39,777][0m Trial 17 finished with value: 0.6884030966000916 and parameters: {'rusbc_n_estimators': 100, 'rusbc_learning_rate': 0.8900201205891546, 'rusbc_sampling_strategy': 'not majority'}. Best is trial 23 with value: 0.942288.[0m
