[32m[I 2022-10-20 15:34:51,376][0m Trial 58 finished with value: 0.6605325877717038 and parameters: {'sgdc_loss': 'modified_huber', 'sgdc_penalty': 'elasticnet', 'sgdc_alpha': 7.590633802695213e-06, 'sgdc_l1_ratio': 0.0, 'sgdc_learning_rate': 'adaptive', 'sgdc_eta0': 86.95393012544993, 'sgdc_early_stopping': True, 'sgdc_validation_fraction': 0.25, 'sgdc_n_iter_no_change': 10}. Best is trial 55 with value: 0.672345.[0m
[32m[I 2022-10-20 15:34:53,217][0m Trial 61 finished with value: 0.655652987546698 and parameters: {'sgdc_loss': 'modified_huber', 'sgdc_penalty': 'elasticnet', 'sgdc_alpha': 9.29564120341707e-06, 'sgdc_l1_ratio': 0.6000000000000001, 'sgdc_learning_rate': 'adaptive', 'sgdc_eta0': 213.09653863188555, 'sgdc_early_stopping': True, 'sgdc_validation_fraction': 0.25, 'sgdc_n_iter_no_change': 10}. Best is trial 55 with value: 0.672345.[0m
[32m[I 2022-10-20 15:35:01,919][0m Trial 60 finished with value: 0.6598864160592757 and parameters: {'sgdc_loss': 'modified_huber', 'sgdc_penalty': 'elasticnet', 'sgdc_alpha': 1.0918576372227216e-05, 'sgdc_l1_ratio': 0.0, 'sgdc_learning_rate': 'adaptive', 'sgdc_eta0': 104.95708393834745, 'sgdc_early_stopping': True, 'sgdc_validation_fraction': 0.25, 'sgdc_n_iter_no_change': 10}. Best is trial 55 with value: 0.672345.[0m
[32m[I 2022-10-20 15:35:29,183][0m Trial 63 finished with value: 0.6644096907092708 and parameters: {'sgdc_loss': 'modified_huber', 'sgdc_penalty': 'elasticnet', 'sgdc_alpha': 4.011060445671096e-06, 'sgdc_l1_ratio': 0.0, 'sgdc_learning_rate': 'adaptive', 'sgdc_eta0': 163.37842775249482, 'sgdc_early_stopping': True, 'sgdc_validation_fraction': 0.25, 'sgdc_n_iter_no_change': 10}. Best is trial 55 with value: 0.672345.[0m
[32m[I 2022-10-20 15:35:46,009][0m Trial 71 finished with value: 0.4981692977425085 and parameters: {'sgdc_loss': 'hinge', 'sgdc_penalty': 'elasticnet', 'sgdc_alpha': 9.21071537924821e-05, 'sgdc_l1_ratio': 0.6000000000000001, 'sgdc_learning_rate': 'optimal', 'sgdc_eta0': 42.67997086325881, 'sgdc_early_stopping': True, 'sgdc_validation_fraction': 0.25, 'sgdc_n_iter_no_change': 10}. Best is trial 55 with value: 0.672345.[0m
[32m[I 2022-10-20 15:36:03,867][0m Trial 65 finished with value: 0.6651101955771012 and parameters: {'sgdc_loss': 'hinge', 'sgdc_penalty': 'elasticnet', 'sgdc_alpha': 3.7493051292806992e-06, 'sgdc_l1_ratio': 0.0, 'sgdc_learning_rate': 'adaptive', 'sgdc_eta0': 161.67969120810835, 'sgdc_early_stopping': True, 'sgdc_validation_fraction': 0.25, 'sgdc_n_iter_no_change': 10}. Best is trial 55 with value: 0.672345.[0m
[32m[I 2022-10-20 15:36:10,578][0m Trial 64 finished with value: 0.6611283208342121 and parameters: {'sgdc_loss': 'modified_huber', 'sgdc_penalty': 'elasticnet', 'sgdc_alpha': 2.9384027304410984e-06, 'sgdc_l1_ratio': 0.0, 'sgdc_learning_rate': 'adaptive', 'sgdc_eta0': 216.59069072909062, 'sgdc_early_stopping': True, 'sgdc_validation_fraction': 0.25, 'sgdc_n_iter_no_change': 10}. Best is trial 55 with value: 0.672345.[0m
[32m[I 2022-10-20 15:36:47,894][0m Trial 66 finished with value: 0.6658625347635018 and parameters: {'sgdc_loss': 'modified_huber', 'sgdc_penalty': 'elasticnet', 'sgdc_alpha': 3.2652273681396917e-06, 'sgdc_l1_ratio': 0.6000000000000001, 'sgdc_learning_rate': 'adaptive', 'sgdc_eta0': 307.3727564903951, 'sgdc_early_stopping': True, 'sgdc_validation_fraction': 0.25, 'sgdc_n_iter_no_change': 10}. Best is trial 55 with value: 0.672345.[0m
[32m[I 2022-10-20 15:37:29,443][0m Trial 68 finished with value: 0.6702459402682548 and parameters: {'sgdc_loss': 'modified_huber', 'sgdc_penalty': 'elasticnet', 'sgdc_alpha': 2.9202893176290976e-06, 'sgdc_l1_ratio': 0.6000000000000001, 'sgdc_learning_rate': 'adaptive', 'sgdc_eta0': 222.95007871921348, 'sgdc_early_stopping': True, 'sgdc_validation_fraction': 0.25, 'sgdc_n_iter_no_change': 10}. Best is trial 55 with value: 0.672345.[0m
[32m[I 2022-10-20 15:37:32,633][0m Trial 67 finished with value: 0.6695974756636515 and parameters: {'sgdc_loss': 'modified_huber', 'sgdc_penalty': 'elasticnet', 'sgdc_alpha': 2.898541882565219e-06, 'sgdc_l1_ratio': 0.6000000000000001, 'sgdc_learning_rate': 'adaptive', 'sgdc_eta0': 249.12791445690291, 'sgdc_early_stopping': True, 'sgdc_validation_fraction': 0.25, 'sgdc_n_iter_no_change': 10}. Best is trial 55 with value: 0.672345.[0m
[32m[I 2022-10-20 15:37:41,834][0m Trial 69 finished with value: 0.672167944724546 and parameters: {'sgdc_loss': 'hinge', 'sgdc_penalty': 'elasticnet', 'sgdc_alpha': 3.313267912142179e-06, 'sgdc_l1_ratio': 0.6000000000000001, 'sgdc_learning_rate': 'adaptive', 'sgdc_eta0': 283.7858452874324, 'sgdc_early_stopping': True, 'sgdc_validation_fraction': 0.25, 'sgdc_n_iter_no_change': 10}. Best is trial 55 with value: 0.672345.[0m
[32m[I 2022-10-20 15:37:45,181][0m Trial 70 finished with value: 0.5282235363632112 and parameters: {'sgdc_loss': 'hinge', 'sgdc_penalty': 'elasticnet', 'sgdc_alpha': 0.00010070943295320173, 'sgdc_l1_ratio': 0.6000000000000001, 'sgdc_learning_rate': 'adaptive', 'sgdc_eta0': 330.1349429305267, 'sgdc_early_stopping': True, 'sgdc_validation_fraction': 0.25, 'sgdc_n_iter_no_change': 10}. Best is trial 55 with value: 0.672345.[0m
[32m[I 2022-10-20 15:37:46,288][0m Trial 77 finished with value: 0.07399138544370873 and parameters: {'sgdc_loss': 'modified_huber', 'sgdc_penalty': 'elasticnet', 'sgdc_alpha': 1.320367678848897, 'sgdc_l1_ratio': 0.6000000000000001, 'sgdc_learning_rate': 'constant', 'sgdc_eta0': 345.7482886670464, 'sgdc_early_stopping': True, 'sgdc_validation_fraction': 0.25, 'sgdc_n_iter_no_change': 10}. Best is trial 55 with value: 0.672345.[0m
[32m[I 2022-10-20 15:38:24,002][0m Trial 74 finished with value: 0.6690851270029013 and parameters: {'sgdc_loss': 'hinge', 'sgdc_penalty': 'elasticnet', 'sgdc_alpha': 8.207311409727115e-05, 'sgdc_l1_ratio': 0.6000000000000001, 'sgdc_learning_rate': 'adaptive', 'sgdc_eta0': 7.385245298914482, 'sgdc_early_stopping': True, 'sgdc_validation_fraction': 0.25, 'sgdc_n_iter_no_change': 10}. Best is trial 55 with value: 0.672345.[0m
[32m[I 2022-10-20 15:38:26,784][0m Trial 72 finished with value: 0.6413351334353683 and parameters: {'sgdc_loss': 'hinge', 'sgdc_penalty': 'elasticnet', 'sgdc_alpha': 1.871630014149902e-05, 'sgdc_l1_ratio': 0.6000000000000001, 'sgdc_learning_rate': 'adaptive', 'sgdc_eta0': 402.82698480365576, 'sgdc_early_stopping': True, 'sgdc_validation_fraction': 0.25, 'sgdc_n_iter_no_change': 10}. Best is trial 55 with value: 0.672345.[0m
[32m[I 2022-10-20 15:38:44,570][0m Trial 73 finished with value: 0.49380496127056234 and parameters: {'sgdc_loss': 'hinge', 'sgdc_penalty': 'elasticnet', 'sgdc_alpha': 0.00010280224586354631, 'sgdc_l1_ratio': 0.6000000000000001, 'sgdc_learning_rate': 'adaptive', 'sgdc_eta0': 342.2865689442476, 'sgdc_early_stopping': True, 'sgdc_validation_fraction': 0.25, 'sgdc_n_iter_no_change': 10}. Best is trial 55 with value: 0.672345.[0m
[32m[I 2022-10-20 15:38:55,692][0m Trial 75 finished with value: 0.6527317978157605 and parameters: {'sgdc_loss': 'hinge', 'sgdc_penalty': 'elasticnet', 'sgdc_alpha': 0.0008134430140108318, 'sgdc_l1_ratio': 0.6000000000000001, 'sgdc_learning_rate': 'adaptive', 'sgdc_eta0': 6.348567277676991, 'sgdc_early_stopping': True, 'sgdc_validation_fraction': 0.25, 'sgdc_n_iter_no_change': 10}. Best is trial 55 with value: 0.672345.[0m
[32m[I 2022-10-20 15:40:13,144][0m Trial 76 finished with value: 0.5302932818189291 and parameters: {'sgdc_loss': 'modified_huber', 'sgdc_penalty': 'elasticnet', 'sgdc_alpha': 0.0001050265757432003, 'sgdc_l1_ratio': 0.6000000000000001, 'sgdc_learning_rate': 'adaptive', 'sgdc_eta0': 312.5511344403021, 'sgdc_early_stopping': True, 'sgdc_validation_fraction': 0.25, 'sgdc_n_iter_no_change': 10}. Best is trial 55 with value: 0.672345.[0m
[32m[I 2022-10-20 15:40:24,381][0m Trial 80 finished with value: 0.6799983363723583 and parameters: {'sgdc_loss': 'modified_huber', 'sgdc_penalty': 'elasticnet', 'sgdc_alpha': 2.1341970234216487e-05, 'sgdc_l1_ratio': 0.6000000000000001, 'sgdc_learning_rate': 'adaptive', 'sgdc_eta0': 68.85736863495468, 'sgdc_early_stopping': True, 'sgdc_validation_fraction': 0.25, 'sgdc_n_iter_no_change': 10}. Best is trial 80 with value: 0.679998.[0m
[32m[I 2022-10-20 15:40:36,802][0m Trial 78 finished with value: 0.6376773205786572 and parameters: {'sgdc_loss': 'modified_huber', 'sgdc_penalty': 'elasticnet', 'sgdc_alpha': 1.873266898240712e-05, 'sgdc_l1_ratio': 0.6000000000000001, 'sgdc_learning_rate': 'adaptive', 'sgdc_eta0': 503.22118454129793, 'sgdc_early_stopping': True, 'sgdc_validation_fraction': 0.25, 'sgdc_n_iter_no_change': 10}. Best is trial 80 with value: 0.679998.[0m
[32m[I 2022-10-20 15:40:42,056][0m Trial 79 finished with value: 0.646480887385506 and parameters: {'sgdc_loss': 'modified_huber', 'sgdc_penalty': 'elasticnet', 'sgdc_alpha': 2.1276719201096116e-05, 'sgdc_l1_ratio': 0.6000000000000001, 'sgdc_learning_rate': 'adaptive', 'sgdc_eta0': 389.0304003279829, 'sgdc_early_stopping': True, 'sgdc_validation_fraction': 0.25, 'sgdc_n_iter_no_change': 10}. Best is trial 80 with value: 0.679998.[0m
[32m[I 2022-10-20 15:40:45,188][0m Trial 82 finished with value: 0.666628908109522 and parameters: {'sgdc_loss': 'hinge', 'sgdc_penalty': 'elasticnet', 'sgdc_alpha': 8.364291357685483e-05, 'sgdc_l1_ratio': 0.6000000000000001, 'sgdc_learning_rate': 'adaptive', 'sgdc_eta0': 5.313747098848055, 'sgdc_early_stopping': True, 'sgdc_validation_fraction': 0.25, 'sgdc_n_iter_no_change': 10}. Best is trial 80 with value: 0.679998.[0m
[32m[I 2022-10-20 15:40:47,206][0m Trial 84 finished with value: 0.6664259850745329 and parameters: {'sgdc_loss': 'hinge', 'sgdc_penalty': 'elasticnet', 'sgdc_alpha': 2.1992558127992308e-05, 'sgdc_l1_ratio': 0.6000000000000001, 'sgdc_learning_rate': 'adaptive', 'sgdc_eta0': 0.2072174500938011, 'sgdc_early_stopping': True, 'sgdc_validation_fraction': 0.25, 'sgdc_n_iter_no_change': 10}. Best is trial 80 with value: 0.679998.[0m
[32m[I 2022-10-20 15:40:54,002][0m Trial 87 finished with value: 0.4799216633051505 and parameters: {'sgdc_loss': 'modified_huber', 'sgdc_penalty': 'elasticnet', 'sgdc_alpha': 2.102848890818029e-05, 'sgdc_l1_ratio': 0.4, 'sgdc_learning_rate': 'invscaling', 'sgdc_eta0': 0.20004973894261063, 'sgdc_early_stopping': True, 'sgdc_validation_fraction': 0.25, 'sgdc_n_iter_no_change': 10}. Best is trial 80 with value: 0.679998.[0m
[32m[I 2022-10-20 15:41:01,625][0m Trial 81 finished with value: 0.6715362185815726 and parameters: {'sgdc_loss': 'hinge', 'sgdc_penalty': 'elasticnet', 'sgdc_alpha': 2.0742505425440116e-05, 'sgdc_l1_ratio': 0.6000000000000001, 'sgdc_learning_rate': 'adaptive', 'sgdc_eta0': 58.48107381079377, 'sgdc_early_stopping': True, 'sgdc_validation_fraction': 0.25, 'sgdc_n_iter_no_change': 10}. Best is trial 80 with value: 0.679998.[0m
[32m[I 2022-10-20 15:41:02,297][0m Trial 83 finished with value: 0.673794604957721 and parameters: {'sgdc_loss': 'hinge', 'sgdc_penalty': 'elasticnet', 'sgdc_alpha': 2.2826322686942862e-05, 'sgdc_l1_ratio': 0.6000000000000001, 'sgdc_learning_rate': 'adaptive', 'sgdc_eta0': 5.388963394197099, 'sgdc_early_stopping': True, 'sgdc_validation_fraction': 0.25, 'sgdc_n_iter_no_change': 10}. Best is trial 80 with value: 0.679998.[0m
[32m[I 2022-10-20 15:42:08,675][0m Trial 85 finished with value: 0.6646071568200855 and parameters: {'sgdc_loss': 'hinge', 'sgdc_penalty': 'elasticnet', 'sgdc_alpha': 1.8081730038096305e-05, 'sgdc_l1_ratio': 0.6000000000000001, 'sgdc_learning_rate': 'adaptive', 'sgdc_eta0': 0.21952273188799845, 'sgdc_early_stopping': True, 'sgdc_validation_fraction': 0.25, 'sgdc_n_iter_no_change': 10}. Best is trial 80 with value: 0.679998.[0m
[32m[I 2022-10-20 15:43:02,882][0m Trial 86 finished with value: 0.6623969421254051 and parameters: {'sgdc_loss': 'modified_huber', 'sgdc_penalty': 'elasticnet', 'sgdc_alpha': 1.9244143517060338e-05, 'sgdc_l1_ratio': 0.4, 'sgdc_learning_rate': 'adaptive', 'sgdc_eta0': 60.554580139613506, 'sgdc_early_stopping': True, 'sgdc_validation_fraction': 0.25, 'sgdc_n_iter_no_change': 10}. Best is trial 80 with value: 0.679998.[0m
[32m[I 2022-10-20 15:43:21,382][0m Trial 95 finished with value: 0.6971621178660139 and parameters: {'sgdc_loss': 'hinge', 'sgdc_penalty': 'elasticnet', 'sgdc_alpha': 5.1328941365487325e-05, 'sgdc_l1_ratio': 0.4, 'sgdc_learning_rate': 'optimal', 'sgdc_eta0': 134.05043180524797, 'sgdc_early_stopping': True, 'sgdc_validation_fraction': 0.25, 'sgdc_n_iter_no_change': 10}. Best is trial 95 with value: 0.697162.[0m
[32m[I 2022-10-20 15:43:21,713][0m Trial 89 finished with value: 0.6187811950656407 and parameters: {'sgdc_loss': 'modified_huber', 'sgdc_penalty': 'elasticnet', 'sgdc_alpha': 5.635581728225327e-05, 'sgdc_l1_ratio': 0.4, 'sgdc_learning_rate': 'adaptive', 'sgdc_eta0': 150.03461265578034, 'sgdc_early_stopping': True, 'sgdc_validation_fraction': 0.25, 'sgdc_n_iter_no_change': 10}. Best is trial 95 with value: 0.697162.[0m
[32m[I 2022-10-20 15:43:29,147][0m Trial 88 finished with value: 0.666303263333486 and parameters: {'sgdc_loss': 'hinge', 'sgdc_penalty': 'elasticnet', 'sgdc_alpha': 6.117579758488597e-06, 'sgdc_l1_ratio': 0.6000000000000001, 'sgdc_learning_rate': 'adaptive', 'sgdc_eta0': 61.00008240001676, 'sgdc_early_stopping': True, 'sgdc_validation_fraction': 0.25, 'sgdc_n_iter_no_change': 10}. Best is trial 95 with value: 0.697162.[0m
[32m[I 2022-10-20 15:43:33,332][0m Trial 90 finished with value: 0.6456634342187894 and parameters: {'sgdc_loss': 'modified_huber', 'sgdc_penalty': 'elasticnet', 'sgdc_alpha': 5.199819590408947e-05, 'sgdc_l1_ratio': 0.4, 'sgdc_learning_rate': 'adaptive', 'sgdc_eta0': 69.04236411435117, 'sgdc_early_stopping': True, 'sgdc_validation_fraction': 0.25, 'sgdc_n_iter_no_change': 10}. Best is trial 95 with value: 0.697162.[0m
[32m[I 2022-10-20 15:43:35,441][0m Trial 91 finished with value: 0.6689860487407975 and parameters: {'sgdc_loss': 'modified_huber', 'sgdc_penalty': 'elasticnet', 'sgdc_alpha': 4.727211014416226e-05, 'sgdc_l1_ratio': 0.6000000000000001, 'sgdc_learning_rate': 'adaptive', 'sgdc_eta0': 50.128745009847435, 'sgdc_early_stopping': True, 'sgdc_validation_fraction': 0.25, 'sgdc_n_iter_no_change': 10}. Best is trial 95 with value: 0.697162.[0m
[32m[I 2022-10-20 15:43:39,368][0m Trial 92 finished with value: 0.6595268145216177 and parameters: {'sgdc_loss': 'modified_huber', 'sgdc_penalty': 'elasticnet', 'sgdc_alpha': 4.586437114427314e-05, 'sgdc_l1_ratio': 0.6000000000000001, 'sgdc_learning_rate': 'adaptive', 'sgdc_eta0': 65.06358646692458, 'sgdc_early_stopping': True, 'sgdc_validation_fraction': 0.25, 'sgdc_n_iter_no_change': 10}. Best is trial 95 with value: 0.697162.[0m
[32m[I 2022-10-20 15:43:39,747][0m Trial 93 finished with value: 0.6623803546593517 and parameters: {'sgdc_loss': 'hinge', 'sgdc_penalty': 'elasticnet', 'sgdc_alpha': 4.443635447267236e-05, 'sgdc_l1_ratio': 0.4, 'sgdc_learning_rate': 'adaptive', 'sgdc_eta0': 70.10199424999217, 'sgdc_early_stopping': True, 'sgdc_validation_fraction': 0.25, 'sgdc_n_iter_no_change': 10}. Best is trial 95 with value: 0.697162.[0m
[32m[I 2022-10-20 15:43:41,038][0m Trial 96 finished with value: 0.45964217430666837 and parameters: {'sgdc_loss': 'hinge', 'sgdc_penalty': 'elasticnet', 'sgdc_alpha': 4.850484925777736e-05, 'sgdc_l1_ratio': 0.4, 'sgdc_learning_rate': 'optimal', 'sgdc_eta0': 117.75736973917634, 'sgdc_early_stopping': True, 'sgdc_validation_fraction': 0.25, 'sgdc_n_iter_no_change': 10}. Best is trial 95 with value: 0.697162.[0m
[32m[I 2022-10-20 15:43:42,387][0m Trial 97 finished with value: 0.42893377690040563 and parameters: {'sgdc_loss': 'hinge', 'sgdc_penalty': 'elasticnet', 'sgdc_alpha': 0.0001682710895962962, 'sgdc_l1_ratio': 0.4, 'sgdc_learning_rate': 'optimal', 'sgdc_eta0': 10.743090528805183, 'sgdc_early_stopping': True, 'sgdc_validation_fraction': 0.25, 'sgdc_n_iter_no_change': 10}. Best is trial 95 with value: 0.697162.[0m
[32m[I 2022-10-20 15:43:47,791][0m Trial 98 finished with value: 0.4772037889103788 and parameters: {'sgdc_loss': 'hinge', 'sgdc_penalty': 'elasticnet', 'sgdc_alpha': 0.00018793511256832063, 'sgdc_l1_ratio': 0.4, 'sgdc_learning_rate': 'optimal', 'sgdc_eta0': 125.3092108368792, 'sgdc_early_stopping': True, 'sgdc_validation_fraction': 0.25, 'sgdc_n_iter_no_change': 10}. Best is trial 95 with value: 0.697162.[0m
[32m[I 2022-10-20 15:43:52,199][0m Trial 99 finished with value: 0.5704784182568435 and parameters: {'sgdc_loss': 'hinge', 'sgdc_penalty': 'elasticnet', 'sgdc_alpha': 6.40876232378739e-06, 'sgdc_l1_ratio': 0.8, 'sgdc_learning_rate': 'optimal', 'sgdc_eta0': 10.615137339933566, 'sgdc_early_stopping': True, 'sgdc_validation_fraction': 0.25, 'sgdc_n_iter_no_change': 10}. Best is trial 95 with value: 0.697162.[0m
[32m[I 2022-10-20 15:44:13,392][0m Trial 94 finished with value: 0.6650297802939383 and parameters: {'sgdc_loss': 'hinge', 'sgdc_penalty': 'elasticnet', 'sgdc_alpha': 5.367835794904045e-05, 'sgdc_l1_ratio': 0.4, 'sgdc_learning_rate': 'adaptive', 'sgdc_eta0': 10.68945985124185, 'sgdc_early_stopping': True, 'sgdc_validation_fraction': 0.25, 'sgdc_n_iter_no_change': 10}. Best is trial 95 with value: 0.697162.[0m
[32m[I 2022-10-20 15:44:13,454][0m Study finished.[0m
[32m[I 2022-10-20 15:44:13,548][0m --------------------------------------------------------------------------------[0m
[32m[I 2022-10-20 15:44:13,548][0m --------------------    VeryFastDecisionRulesClassifier     --------------------[0m
[32m[I 2022-10-20 15:44:13,548][0m --------------------------------------------------------------------------------[0m
[32m[I 2022-10-20 15:44:13,579][0m A new study created in RDB with name: VeryFastDecisionRulesClassifier_b4f53b70[0m
[32m[I 2022-10-20 15:44:13,595][0m Study started.[0m
[32m[I 2022-10-20 15:55:30,886][0m Trial 3 finished with value: 0.9357468421274073 and parameters: {'vfdrc_ordered_rules': True, 'vfdrc_grace_period': 300, 'vfdrc_tie_threshold': 0.30000000000000004, 'vfdrc_rule_prediction': 'weighted_sum', 'vfdrc_max_rules': 25, 'vfdrc_expand_criterion': 'foil_gain', 'vfdrc_remove_poor_atts': True}. Best is trial 3 with value: 0.935747.[0m
[32m[I 2022-10-20 15:57:35,482][0m Trial 7 finished with value: 0.6240868905898825 and parameters: {'vfdrc_ordered_rules': False, 'vfdrc_grace_period': 300, 'vfdrc_tie_threshold': 0.25, 'vfdrc_rule_prediction': 'weighted_max', 'vfdrc_max_rules': 30, 'vfdrc_expand_criterion': 'hellinger', 'vfdrc_remove_poor_atts': False}. Best is trial 3 with value: 0.935747.[0m
[32m[I 2022-10-20 15:58:02,045][0m Trial 4 finished with value: 0.9693791016163141 and parameters: {'vfdrc_ordered_rules': True, 'vfdrc_grace_period': 300, 'vfdrc_tie_threshold': 1.0, 'vfdrc_rule_prediction': 'weighted_sum', 'vfdrc_max_rules': 10, 'vfdrc_expand_criterion': 'info_gain', 'vfdrc_remove_poor_atts': True}. Best is trial 4 with value: 0.969379.[0m
[32m[I 2022-10-20 15:58:05,703][0m Trial 6 finished with value: 0.6035969442050936 and parameters: {'vfdrc_ordered_rules': True, 'vfdrc_grace_period': 350, 'vfdrc_tie_threshold': 0.8, 'vfdrc_rule_prediction': 'weighted_sum', 'vfdrc_max_rules': 10, 'vfdrc_expand_criterion': 'hellinger', 'vfdrc_remove_poor_atts': True}. Best is trial 4 with value: 0.969379.[0m
[32m[I 2022-10-20 15:58:23,205][0m Trial 5 finished with value: 0.8689556060620452 and parameters: {'vfdrc_ordered_rules': False, 'vfdrc_grace_period': 300, 'vfdrc_tie_threshold': 0.6000000000000001, 'vfdrc_rule_prediction': 'weighted_max', 'vfdrc_max_rules': 25, 'vfdrc_expand_criterion': 'info_gain', 'vfdrc_remove_poor_atts': False}. Best is trial 4 with value: 0.969379.[0m
[32m[I 2022-10-20 15:58:57,208][0m Trial 2 finished with value: 0.8391400314078021 and parameters: {'vfdrc_ordered_rules': False, 'vfdrc_grace_period': 400, 'vfdrc_tie_threshold': 0.6000000000000001, 'vfdrc_rule_prediction': 'weighted_sum', 'vfdrc_max_rules': 20, 'vfdrc_expand_criterion': 'foil_gain', 'vfdrc_remove_poor_atts': True}. Best is trial 4 with value: 0.969379.[0m
[32m[I 2022-10-20 15:59:31,563][0m Trial 1 finished with value: 0.7722388067695696 and parameters: {'vfdrc_ordered_rules': False, 'vfdrc_grace_period': 150, 'vfdrc_tie_threshold': 0.55, 'vfdrc_rule_prediction': 'first_hit', 'vfdrc_max_rules': 15, 'vfdrc_expand_criterion': 'foil_gain', 'vfdrc_remove_poor_atts': True}. Best is trial 4 with value: 0.969379.[0m
[32m[I 2022-10-20 15:59:57,077][0m Trial 0 finished with value: 0.606951613902319 and parameters: {'vfdrc_ordered_rules': False, 'vfdrc_grace_period': 400, 'vfdrc_tie_threshold': 0.45, 'vfdrc_rule_prediction': 'weighted_max', 'vfdrc_max_rules': 10, 'vfdrc_expand_criterion': 'hellinger', 'vfdrc_remove_poor_atts': False}. Best is trial 4 with value: 0.969379.[0m
[32m[I 2022-10-20 16:01:37,016][0m Trial 8 finished with value: 0.9553063602442846 and parameters: {'vfdrc_ordered_rules': False, 'vfdrc_grace_period': 400, 'vfdrc_tie_threshold': 0.4, 'vfdrc_rule_prediction': 'weighted_sum', 'vfdrc_max_rules': 20, 'vfdrc_expand_criterion': 'info_gain', 'vfdrc_remove_poor_atts': True}. Best is trial 4 with value: 0.969379.[0m
[32m[I 2022-10-20 16:10:28,275][0m Trial 9 finished with value: 0.9838043688208807 and parameters: {'vfdrc_ordered_rules': True, 'vfdrc_grace_period': 200, 'vfdrc_tie_threshold': 0.35000000000000003, 'vfdrc_rule_prediction': 'weighted_sum', 'vfdrc_max_rules': 35, 'vfdrc_expand_criterion': 'info_gain', 'vfdrc_remove_poor_atts': False}. Best is trial 9 with value: 0.983804.[0m
[32m[I 2022-10-20 16:12:12,248][0m Trial 12 finished with value: 0.6118306697398949 and parameters: {'vfdrc_ordered_rules': False, 'vfdrc_grace_period': 300, 'vfdrc_tie_threshold': 0.8500000000000001, 'vfdrc_rule_prediction': 'weighted_max', 'vfdrc_max_rules': 30, 'vfdrc_expand_criterion': 'hellinger', 'vfdrc_remove_poor_atts': False}. Best is trial 9 with value: 0.983804.[0m
