[32m[I 2022-10-20 01:46:22,820][0m Trial 91 finished with value: 0.2844441188051378 and parameters: {'agc_alpha': 377.6861760150234, 'agc_l1_ratio': 0.8, 'agc_loss': 'modified_huber'}. Best is trial 4 with value: 0.951137.[0m
[32m[I 2022-10-20 01:46:23,023][0m Trial 93 finished with value: 0.7441977402125274 and parameters: {'agc_alpha': 0.19853859463269521, 'agc_l1_ratio': 0.8, 'agc_loss': 'modified_huber'}. Best is trial 4 with value: 0.951145.[0m
[32m[I 2022-10-20 01:46:23,102][0m Trial 94 finished with value: 0.9248051225976532 and parameters: {'agc_alpha': 0.0027247340091085524, 'agc_l1_ratio': 0.8, 'agc_loss': 'modified_huber'}. Best is trial 95 with value: 0.951145.[0m
[32m[I 2022-10-20 01:46:23,102][0m Trial 95 finished with value: 0.9511445188500821 and parameters: {'agc_alpha': 0.0013294549543817775, 'agc_l1_ratio': 0.8, 'agc_loss': 'squared_hinge'}. Best is trial 95 with value: 0.951145.[0m
[32m[I 2022-10-20 01:46:35,894][0m Trial 96 finished with value: 0.924974894297307 and parameters: {'agc_alpha': 0.001408107728105718, 'agc_l1_ratio': 0.9, 'agc_loss': 'modified_huber'}. Best is trial 95 with value: 0.951145.[0m
[32m[I 2022-10-20 01:46:35,894][0m Trial 98 finished with value: 0.9340763593005285 and parameters: {'agc_alpha': 0.001380032629479563, 'agc_l1_ratio': 0.9, 'agc_loss': 'modified_huber'}. Best is trial 95 with value: 0.951145.[0m
[32m[I 2022-10-20 01:46:35,957][0m Trial 97 finished with value: 0.9035524819853752 and parameters: {'agc_alpha': 0.0013274688703980378, 'agc_l1_ratio': 0.9, 'agc_loss': 'squared'}. Best is trial 95 with value: 0.951145.[0m
[32m[I 2022-10-20 01:46:36,378][0m Trial 99 finished with value: 0.9034971905181 and parameters: {'agc_alpha': 0.0014180217822946646, 'agc_l1_ratio': 0.9, 'agc_loss': 'squared'}. Best is trial 95 with value: 0.951145.[0m
[32m[I 2022-10-20 01:46:36,441][0m Study finished.[0m
[32m[I 2022-10-20 01:46:36,519][0m --------------------------------------------------------------------------------[0m
[32m[I 2022-10-20 01:46:36,519][0m --------------------       BalancedBaggingClassifier        --------------------[0m
[32m[I 2022-10-20 01:46:36,519][0m --------------------------------------------------------------------------------[0m
[32m[I 2022-10-20 01:46:36,550][0m A new study created in RDB with name: BalancedBaggingClassifier_b4f53b70[0m
[32m[I 2022-10-20 01:46:36,550][0m Study started.[0m
[32m[I 2022-10-20 01:46:46,112][0m Trial 4 finished with value: 0.9915263928068987 and parameters: {'bbc_n_estimators': 7, 'bbc_max_features': 25, 'bbc_bootstrap': True, 'bbc_sampling_strategy': 'not minority'}. Best is trial 4 with value: 0.991526.[0m
[32m[I 2022-10-20 01:46:46,441][0m Trial 6 finished with value: 0.9675193927574905 and parameters: {'bbc_n_estimators': 9, 'bbc_max_features': 6, 'bbc_bootstrap': True, 'bbc_sampling_strategy': 'not minority'}. Best is trial 4 with value: 0.991526.[0m
[32m[I 2022-10-20 01:46:48,601][0m Trial 5 finished with value: 0.9243712193177599 and parameters: {'bbc_n_estimators': 12, 'bbc_max_features': 3, 'bbc_bootstrap': True, 'bbc_sampling_strategy': 'not minority'}. Best is trial 4 with value: 0.991526.[0m
[32m[I 2022-10-20 01:46:50,892][0m Trial 3 finished with value: 0.9917187759637333 and parameters: {'bbc_n_estimators': 6, 'bbc_max_features': 33, 'bbc_bootstrap': True, 'bbc_sampling_strategy': 'majority'}. Best is trial 3 with value: 0.991719.[0m
[32m[I 2022-10-20 01:46:56,420][0m Trial 1 finished with value: 0.9916566855059684 and parameters: {'bbc_n_estimators': 13, 'bbc_max_features': 41, 'bbc_bootstrap': True, 'bbc_sampling_strategy': 'all'}. Best is trial 3 with value: 0.991719.[0m
[32m[I 2022-10-20 01:46:58,529][0m Trial 7 finished with value: 0.991702323825643 and parameters: {'bbc_n_estimators': 18, 'bbc_max_features': 19, 'bbc_bootstrap': True, 'bbc_sampling_strategy': 'not minority'}. Best is trial 3 with value: 0.991719.[0m
[32m[I 2022-10-20 01:46:58,623][0m Trial 2 finished with value: 0.9916394871966407 and parameters: {'bbc_n_estimators': 15, 'bbc_max_features': 40, 'bbc_bootstrap': True, 'bbc_sampling_strategy': 'not minority'}. Best is trial 3 with value: 0.991719.[0m
[32m[I 2022-10-20 01:46:58,781][0m Trial 0 finished with value: 0.9915347723392932 and parameters: {'bbc_n_estimators': 11, 'bbc_max_features': 27, 'bbc_bootstrap': True, 'bbc_sampling_strategy': 'majority'}. Best is trial 3 with value: 0.991719.[0m
[32m[I 2022-10-20 01:47:00,792][0m Trial 9 finished with value: 0.9916472048131946 and parameters: {'bbc_n_estimators': 10, 'bbc_max_features': 32, 'bbc_bootstrap': True, 'bbc_sampling_strategy': 'all'}. Best is trial 3 with value: 0.991719.[0m
[32m[I 2022-10-20 01:47:06,330][0m Trial 15 finished with value: 0.9835910105444214 and parameters: {'bbc_n_estimators': 15, 'bbc_max_features': 7, 'bbc_bootstrap': False, 'bbc_sampling_strategy': 'all'}. Best is trial 3 with value: 0.991719.[0m
[32m[I 2022-10-20 01:47:07,226][0m Trial 11 finished with value: 0.9917487264448925 and parameters: {'bbc_n_estimators': 13, 'bbc_max_features': 20, 'bbc_bootstrap': False, 'bbc_sampling_strategy': 'not majority'}. Best is trial 11 with value: 0.991749.[0m
[32m[I 2022-10-20 01:47:08,559][0m Trial 12 finished with value: 0.9872744259465291 and parameters: {'bbc_n_estimators': 11, 'bbc_max_features': 10, 'bbc_bootstrap': True, 'bbc_sampling_strategy': 'not minority'}. Best is trial 11 with value: 0.991749.[0m
[32m[I 2022-10-20 01:47:12,277][0m Trial 16 finished with value: 0.9914801401635629 and parameters: {'bbc_n_estimators': 9, 'bbc_max_features': 20, 'bbc_bootstrap': True, 'bbc_sampling_strategy': 'not minority'}. Best is trial 11 with value: 0.991749.[0m
[32m[I 2022-10-20 01:47:12,638][0m Trial 8 finished with value: 0.9496726062627044 and parameters: {'bbc_n_estimators': 18, 'bbc_max_features': 10, 'bbc_bootstrap': True, 'bbc_sampling_strategy': 'not majority'}. Best is trial 11 with value: 0.991749.[0m
[32m[I 2022-10-20 01:47:14,758][0m Trial 18 finished with value: 0.9915452119589335 and parameters: {'bbc_n_estimators': 6, 'bbc_max_features': 16, 'bbc_bootstrap': False, 'bbc_sampling_strategy': 'not majority'}. Best is trial 11 with value: 0.991749.[0m
[32m[I 2022-10-20 01:47:18,187][0m Trial 17 finished with value: 0.9915267523801309 and parameters: {'bbc_n_estimators': 5, 'bbc_max_features': 47, 'bbc_bootstrap': False, 'bbc_sampling_strategy': 'not majority'}. Best is trial 11 with value: 0.991749.[0m
[32m[I 2022-10-20 01:47:19,804][0m Trial 14 finished with value: 0.9781594465602205 and parameters: {'bbc_n_estimators': 12, 'bbc_max_features': 16, 'bbc_bootstrap': True, 'bbc_sampling_strategy': 'not majority'}. Best is trial 11 with value: 0.991749.[0m
[32m[I 2022-10-20 01:47:22,989][0m Trial 19 finished with value: 0.9916373284313046 and parameters: {'bbc_n_estimators': 6, 'bbc_max_features': 50, 'bbc_bootstrap': False, 'bbc_sampling_strategy': 'not majority'}. Best is trial 11 with value: 0.991749.[0m
[32m[I 2022-10-20 01:47:23,824][0m Trial 20 finished with value: 0.9915874671613275 and parameters: {'bbc_n_estimators': 5, 'bbc_max_features': 49, 'bbc_bootstrap': False, 'bbc_sampling_strategy': 'not majority'}. Best is trial 11 with value: 0.991749.[0m
[32m[I 2022-10-20 01:47:25,374][0m Trial 10 finished with value: 0.99172708158602 and parameters: {'bbc_n_estimators': 17, 'bbc_max_features': 31, 'bbc_bootstrap': True, 'bbc_sampling_strategy': 'majority'}. Best is trial 11 with value: 0.991749.[0m
[32m[I 2022-10-20 01:47:27,345][0m Trial 22 finished with value: 0.9917946969686297 and parameters: {'bbc_n_estimators': 5, 'bbc_max_features': 48, 'bbc_bootstrap': False, 'bbc_sampling_strategy': 'majority'}. Best is trial 22 with value: 0.991795.[0m
[32m[I 2022-10-20 01:47:29,779][0m Trial 21 finished with value: 0.9918023042899959 and parameters: {'bbc_n_estimators': 7, 'bbc_max_features': 49, 'bbc_bootstrap': False, 'bbc_sampling_strategy': 'majority'}. Best is trial 21 with value: 0.991802.[0m
[32m[I 2022-10-20 01:47:34,342][0m Trial 13 finished with value: 0.9916184669481094 and parameters: {'bbc_n_estimators': 18, 'bbc_max_features': 44, 'bbc_bootstrap': False, 'bbc_sampling_strategy': 'not majority'}. Best is trial 21 with value: 0.991802.[0m
[32m[I 2022-10-20 01:47:42,445][0m Trial 23 finished with value: 0.9916760928520693 and parameters: {'bbc_n_estimators': 14, 'bbc_max_features': 31, 'bbc_bootstrap': False, 'bbc_sampling_strategy': 'majority'}. Best is trial 21 with value: 0.991802.[0m
[32m[I 2022-10-20 01:47:47,550][0m Trial 29 finished with value: 0.9917870896773738 and parameters: {'bbc_n_estimators': 8, 'bbc_max_features': 43, 'bbc_bootstrap': False, 'bbc_sampling_strategy': 'majority'}. Best is trial 21 with value: 0.991802.[0m
[32m[I 2022-10-20 01:47:47,992][0m Trial 24 finished with value: 0.9917647473593906 and parameters: {'bbc_n_estimators': 15, 'bbc_max_features': 34, 'bbc_bootstrap': False, 'bbc_sampling_strategy': 'majority'}. Best is trial 21 with value: 0.991802.[0m
[32m[I 2022-10-20 01:47:49,810][0m Trial 30 finished with value: 0.9918023779648142 and parameters: {'bbc_n_estimators': 8, 'bbc_max_features': 37, 'bbc_bootstrap': False, 'bbc_sampling_strategy': 'majority'}. Best is trial 30 with value: 0.991802.[0m
[32m[I 2022-10-20 01:47:51,567][0m Trial 25 finished with value: 0.9917647473593906 and parameters: {'bbc_n_estimators': 15, 'bbc_max_features': 34, 'bbc_bootstrap': False, 'bbc_sampling_strategy': 'majority'}. Best is trial 30 with value: 0.991802.[0m
[32m[I 2022-10-20 01:47:53,245][0m Trial 26 finished with value: 0.9918023042899959 and parameters: {'bbc_n_estimators': 15, 'bbc_max_features': 36, 'bbc_bootstrap': False, 'bbc_sampling_strategy': 'majority'}. Best is trial 30 with value: 0.991802.[0m
[32m[I 2022-10-20 01:47:58,099][0m Trial 31 finished with value: 0.9918023779648142 and parameters: {'bbc_n_estimators': 8, 'bbc_max_features': 38, 'bbc_bootstrap': False, 'bbc_sampling_strategy': 'majority'}. Best is trial 30 with value: 0.991802.[0m
[32m[I 2022-10-20 01:48:02,510][0m Trial 32 finished with value: 0.9918023779648142 and parameters: {'bbc_n_estimators': 8, 'bbc_max_features': 37, 'bbc_bootstrap': False, 'bbc_sampling_strategy': 'majority'}. Best is trial 30 with value: 0.991802.[0m
[32m[I 2022-10-20 01:48:04,034][0m Trial 33 finished with value: 0.9917871265749812 and parameters: {'bbc_n_estimators': 8, 'bbc_max_features': 39, 'bbc_bootstrap': False, 'bbc_sampling_strategy': 'majority'}. Best is trial 30 with value: 0.991802.[0m
[32m[I 2022-10-20 01:48:04,926][0m Trial 34 finished with value: 0.9918023779648142 and parameters: {'bbc_n_estimators': 8, 'bbc_max_features': 37, 'bbc_bootstrap': False, 'bbc_sampling_strategy': 'majority'}. Best is trial 30 with value: 0.991802.[0m
[32m[I 2022-10-20 01:48:06,872][0m Trial 35 finished with value: 0.9918023779648142 and parameters: {'bbc_n_estimators': 8, 'bbc_max_features': 38, 'bbc_bootstrap': False, 'bbc_sampling_strategy': 'majority'}. Best is trial 30 with value: 0.991802.[0m
[32m[I 2022-10-20 01:48:07,170][0m Trial 28 finished with value: 0.9917871265749812 and parameters: {'bbc_n_estimators': 20, 'bbc_max_features': 39, 'bbc_bootstrap': False, 'bbc_sampling_strategy': 'majority'}. Best is trial 30 with value: 0.991802.[0m
[32m[I 2022-10-20 01:48:09,552][0m Trial 27 finished with value: 0.9917035971983817 and parameters: {'bbc_n_estimators': 20, 'bbc_max_features': 31, 'bbc_bootstrap': False, 'bbc_sampling_strategy': 'majority'}. Best is trial 30 with value: 0.991802.[0m
[32m[I 2022-10-20 01:48:10,958][0m Trial 36 finished with value: 0.991802341135726 and parameters: {'bbc_n_estimators': 10, 'bbc_max_features': 38, 'bbc_bootstrap': False, 'bbc_sampling_strategy': 'majority'}. Best is trial 30 with value: 0.991802.[0m
[32m[I 2022-10-20 01:48:12,906][0m Trial 37 finished with value: 0.9917947706953253 and parameters: {'bbc_n_estimators': 9, 'bbc_max_features': 37, 'bbc_bootstrap': False, 'bbc_sampling_strategy': 'majority'}. Best is trial 30 with value: 0.991802.[0m
[32m[I 2022-10-20 01:48:15,052][0m Trial 38 finished with value: 0.9918023779648142 and parameters: {'bbc_n_estimators': 8, 'bbc_max_features': 38, 'bbc_bootstrap': False, 'bbc_sampling_strategy': 'majority'}. Best is trial 30 with value: 0.991802.[0m
[32m[I 2022-10-20 01:48:17,183][0m Trial 44 finished with value: 0.9918013367601507 and parameters: {'bbc_n_estimators': 10, 'bbc_max_features': 27, 'bbc_bootstrap': False, 'bbc_sampling_strategy': 'all'}. Best is trial 30 with value: 0.991802.[0m
[32m[I 2022-10-20 01:48:18,457][0m Trial 45 finished with value: 0.9918552058913175 and parameters: {'bbc_n_estimators': 7, 'bbc_max_features': 27, 'bbc_bootstrap': False, 'bbc_sampling_strategy': 'all'}. Best is trial 45 with value: 0.991855.[0m
[32m[I 2022-10-20 01:48:22,218][0m Trial 39 finished with value: 0.9919710754931604 and parameters: {'bbc_n_estimators': 8, 'bbc_max_features': 28, 'bbc_bootstrap': False, 'bbc_sampling_strategy': 'majority'}. Best is trial 39 with value: 0.991971.[0m
[32m[I 2022-10-20 01:48:23,192][0m Trial 46 finished with value: 0.9915738663551837 and parameters: {'bbc_n_estimators': 7, 'bbc_max_features': 42, 'bbc_bootstrap': False, 'bbc_sampling_strategy': 'all'}. Best is trial 39 with value: 0.991971.[0m
[32m[I 2022-10-20 01:48:26,497][0m Trial 40 finished with value: 0.9919640017269512 and parameters: {'bbc_n_estimators': 10, 'bbc_max_features': 27, 'bbc_bootstrap': False, 'bbc_sampling_strategy': 'majority'}. Best is trial 39 with value: 0.991971.[0m
[32m[I 2022-10-20 01:48:27,687][0m Trial 48 finished with value: 0.9915738663551837 and parameters: {'bbc_n_estimators': 7, 'bbc_max_features': 42, 'bbc_bootstrap': False, 'bbc_sampling_strategy': 'all'}. Best is trial 39 with value: 0.991971.[0m
[32m[I 2022-10-20 01:48:28,412][0m Trial 41 finished with value: 0.991979708577013 and parameters: {'bbc_n_estimators': 10, 'bbc_max_features': 28, 'bbc_bootstrap': False, 'bbc_sampling_strategy': 'majority'}. Best is trial 41 with value: 0.99198.[0m
[32m[I 2022-10-20 01:48:28,711][0m Trial 42 finished with value: 0.991979708577013 and parameters: {'bbc_n_estimators': 10, 'bbc_max_features': 28, 'bbc_bootstrap': False, 'bbc_sampling_strategy': 'majority'}. Best is trial 41 with value: 0.99198.[0m
[32m[I 2022-10-20 01:48:29,166][0m Trial 49 finished with value: 0.9918552058913175 and parameters: {'bbc_n_estimators': 7, 'bbc_max_features': 27, 'bbc_bootstrap': False, 'bbc_sampling_strategy': 'all'}. Best is trial 41 with value: 0.99198.[0m
[32m[I 2022-10-20 01:48:29,339][0m Trial 50 finished with value: 0.9916676474017219 and parameters: {'bbc_n_estimators': 6, 'bbc_max_features': 25, 'bbc_bootstrap': False, 'bbc_sampling_strategy': 'all'}. Best is trial 41 with value: 0.99198.[0m
[32m[I 2022-10-20 01:48:30,130][0m Trial 43 finished with value: 0.9919640017269512 and parameters: {'bbc_n_estimators': 10, 'bbc_max_features': 27, 'bbc_bootstrap': False, 'bbc_sampling_strategy': 'majority'}. Best is trial 41 with value: 0.99198.[0m
[32m[I 2022-10-20 01:48:32,808][0m Trial 47 finished with value: 0.991817629354647 and parameters: {'bbc_n_estimators': 7, 'bbc_max_features': 42, 'bbc_bootstrap': False, 'bbc_sampling_strategy': 'majority'}. Best is trial 41 with value: 0.99198.[0m
[32m[I 2022-10-20 01:48:36,942][0m Trial 51 finished with value: 0.991573003711331 and parameters: {'bbc_n_estimators': 11, 'bbc_max_features': 24, 'bbc_bootstrap': False, 'bbc_sampling_strategy': 'all'}. Best is trial 41 with value: 0.99198.[0m
[32m[I 2022-10-20 01:48:37,083][0m Trial 52 finished with value: 0.9918013029920162 and parameters: {'bbc_n_estimators': 10, 'bbc_max_features': 26, 'bbc_bootstrap': False, 'bbc_sampling_strategy': 'all'}. Best is trial 41 with value: 0.99198.[0m
[32m[I 2022-10-20 01:48:38,132][0m Trial 53 finished with value: 0.991573003711331 and parameters: {'bbc_n_estimators': 11, 'bbc_max_features': 24, 'bbc_bootstrap': False, 'bbc_sampling_strategy': 'all'}. Best is trial 41 with value: 0.99198.[0m
[32m[I 2022-10-20 01:48:38,867][0m Trial 54 finished with value: 0.991573003711331 and parameters: {'bbc_n_estimators': 11, 'bbc_max_features': 24, 'bbc_bootstrap': False, 'bbc_sampling_strategy': 'all'}. Best is trial 41 with value: 0.99198.[0m
[32m[I 2022-10-20 01:48:42,111][0m Trial 58 finished with value: 0.9915273223890451 and parameters: {'bbc_n_estimators': 11, 'bbc_max_features': 23, 'bbc_bootstrap': False, 'bbc_sampling_strategy': 'not minority'}. Best is trial 41 with value: 0.99198.[0m
[32m[I 2022-10-20 01:48:43,927][0m Trial 55 finished with value: 0.9914420191947875 and parameters: {'bbc_n_estimators': 11, 'bbc_max_features': 23, 'bbc_bootstrap': True, 'bbc_sampling_strategy': 'not minority'}. Best is trial 41 with value: 0.99198.[0m
[32m[I 2022-10-20 01:48:44,147][0m Trial 56 finished with value: 0.9914420191947875 and parameters: {'bbc_n_estimators': 11, 'bbc_max_features': 23, 'bbc_bootstrap': True, 'bbc_sampling_strategy': 'not minority'}. Best is trial 41 with value: 0.99198.[0m
[32m[I 2022-10-20 01:48:44,414][0m Trial 57 finished with value: 0.9914420191947875 and parameters: {'bbc_n_estimators': 11, 'bbc_max_features': 23, 'bbc_bootstrap': True, 'bbc_sampling_strategy': 'not minority'}. Best is trial 41 with value: 0.99198.[0m
[32m[I 2022-10-20 01:48:51,486][0m Trial 61 finished with value: 0.9913541114003516 and parameters: {'bbc_n_estimators': 9, 'bbc_max_features': 29, 'bbc_bootstrap': True, 'bbc_sampling_strategy': 'not minority'}. Best is trial 41 with value: 0.99198.[0m
[32m[I 2022-10-20 01:48:53,426][0m Trial 60 finished with value: 0.9914359036742832 and parameters: {'bbc_n_estimators': 12, 'bbc_max_features': 23, 'bbc_bootstrap': True, 'bbc_sampling_strategy': 'not minority'}. Best is trial 41 with value: 0.99198.[0m
[32m[I 2022-10-20 01:48:54,037][0m Trial 59 finished with value: 0.9914305252502579 and parameters: {'bbc_n_estimators': 12, 'bbc_max_features': 29, 'bbc_bootstrap': True, 'bbc_sampling_strategy': 'not minority'}. Best is trial 41 with value: 0.99198.[0m
[32m[I 2022-10-20 01:48:55,513][0m Trial 62 finished with value: 0.9914305252502579 and parameters: {'bbc_n_estimators': 12, 'bbc_max_features': 29, 'bbc_bootstrap': True, 'bbc_sampling_strategy': 'not minority'}. Best is trial 41 with value: 0.99198.[0m
[32m[I 2022-10-20 01:48:59,238][0m Trial 66 finished with value: 0.9915308789493117 and parameters: {'bbc_n_estimators': 9, 'bbc_max_features': 29, 'bbc_bootstrap': False, 'bbc_sampling_strategy': 'majority'}. Best is trial 41 with value: 0.99198.[0m
[32m[I 2022-10-20 01:49:02,192][0m Trial 68 finished with value: 0.9915505315648193 and parameters: {'bbc_n_estimators': 9, 'bbc_max_features': 29, 'bbc_bootstrap': False, 'bbc_sampling_strategy': 'all'}. Best is trial 41 with value: 0.99198.[0m
[32m[I 2022-10-20 01:49:02,740][0m Trial 69 finished with value: 0.9915505315648193 and parameters: {'bbc_n_estimators': 9, 'bbc_max_features': 29, 'bbc_bootstrap': False, 'bbc_sampling_strategy': 'all'}. Best is trial 41 with value: 0.99198.[0m
[32m[I 2022-10-20 01:49:03,319][0m Trial 70 finished with value: 0.9915419480367871 and parameters: {'bbc_n_estimators': 9, 'bbc_max_features': 20, 'bbc_bootstrap': False, 'bbc_sampling_strategy': 'all'}. Best is trial 41 with value: 0.99198.[0m
[32m[I 2022-10-20 01:49:04,213][0m Trial 71 finished with value: 0.9915986556697262 and parameters: {'bbc_n_estimators': 6, 'bbc_max_features': 18, 'bbc_bootstrap': False, 'bbc_sampling_strategy': 'all'}. Best is trial 41 with value: 0.99198.[0m
[32m[I 2022-10-20 01:49:04,369][0m Trial 65 finished with value: 0.9915211552463895 and parameters: {'bbc_n_estimators': 12, 'bbc_max_features': 29, 'bbc_bootstrap': False, 'bbc_sampling_strategy': 'majority'}. Best is trial 41 with value: 0.99198.[0m
[32m[I 2022-10-20 01:49:07,514][0m Trial 63 finished with value: 0.9914908445993195 and parameters: {'bbc_n_estimators': 12, 'bbc_max_features': 29, 'bbc_bootstrap': True, 'bbc_sampling_strategy': 'majority'}. Best is trial 41 with value: 0.99198.[0m
[32m[I 2022-10-20 01:49:08,958][0m Trial 64 finished with value: 0.9914908445993195 and parameters: {'bbc_n_estimators': 12, 'bbc_max_features': 29, 'bbc_bootstrap': True, 'bbc_sampling_strategy': 'majority'}. Best is trial 41 with value: 0.99198.[0m
[32m[I 2022-10-20 01:49:09,649][0m Trial 67 finished with value: 0.9914160685481397 and parameters: {'bbc_n_estimators': 12, 'bbc_max_features': 30, 'bbc_bootstrap': False, 'bbc_sampling_strategy': 'majority'}. Best is trial 41 with value: 0.99198.[0m
[32m[I 2022-10-20 01:49:17,885][0m Trial 74 finished with value: 0.9916113768912984 and parameters: {'bbc_n_estimators': 10, 'bbc_max_features': 32, 'bbc_bootstrap': False, 'bbc_sampling_strategy': 'majority'}. Best is trial 41 with value: 0.99198.[0m
[32m[I 2022-10-20 01:49:20,332][0m Trial 79 finished with value: 0.9917565154939691 and parameters: {'bbc_n_estimators': 7, 'bbc_max_features': 33, 'bbc_bootstrap': False, 'bbc_sampling_strategy': 'majority'}. Best is trial 41 with value: 0.99198.[0m
[32m[I 2022-10-20 01:49:22,351][0m Trial 77 finished with value: 0.9917648208587467 and parameters: {'bbc_n_estimators': 10, 'bbc_max_features': 33, 'bbc_bootstrap': False, 'bbc_sampling_strategy': 'majority'}. Best is trial 41 with value: 0.99198.[0m
[32m[I 2022-10-20 01:49:23,135][0m Trial 75 finished with value: 0.9917795193397404 and parameters: {'bbc_n_estimators': 13, 'bbc_max_features': 32, 'bbc_bootstrap': False, 'bbc_sampling_strategy': 'majority'}. Best is trial 41 with value: 0.99198.[0m
