[32m[I 2022-10-20 16:12:29,045][0m Trial 16 finished with value: 0.9048319594240176 and parameters: {'vfdrc_ordered_rules': False, 'vfdrc_grace_period': 350, 'vfdrc_tie_threshold': 0.2, 'vfdrc_rule_prediction': 'first_hit', 'vfdrc_max_rules': 25, 'vfdrc_expand_criterion': 'info_gain', 'vfdrc_remove_poor_atts': False}. Best is trial 9 with value: 0.983804.[0m
[32m[I 2022-10-20 16:12:38,025][0m Trial 14 finished with value: 0.9012901561892285 and parameters: {'vfdrc_ordered_rules': True, 'vfdrc_grace_period': 350, 'vfdrc_tie_threshold': 0.8, 'vfdrc_rule_prediction': 'first_hit', 'vfdrc_max_rules': 15, 'vfdrc_expand_criterion': 'info_gain', 'vfdrc_remove_poor_atts': True}. Best is trial 9 with value: 0.983804.[0m
[32m[I 2022-10-20 16:13:19,846][0m Trial 11 finished with value: 0.6450906516418902 and parameters: {'vfdrc_ordered_rules': True, 'vfdrc_grace_period': 250, 'vfdrc_tie_threshold': 0.8500000000000001, 'vfdrc_rule_prediction': 'first_hit', 'vfdrc_max_rules': 25, 'vfdrc_expand_criterion': 'hellinger', 'vfdrc_remove_poor_atts': False}. Best is trial 9 with value: 0.983804.[0m
[32m[I 2022-10-20 16:13:42,334][0m Trial 13 finished with value: 0.715140012241008 and parameters: {'vfdrc_ordered_rules': True, 'vfdrc_grace_period': 400, 'vfdrc_tie_threshold': 0.15000000000000002, 'vfdrc_rule_prediction': 'weighted_sum', 'vfdrc_max_rules': 30, 'vfdrc_expand_criterion': 'hellinger', 'vfdrc_remove_poor_atts': True}. Best is trial 9 with value: 0.983804.[0m
[32m[I 2022-10-20 16:16:17,589][0m Trial 15 finished with value: 0.9049337505026642 and parameters: {'vfdrc_ordered_rules': True, 'vfdrc_grace_period': 200, 'vfdrc_tie_threshold': 0.55, 'vfdrc_rule_prediction': 'first_hit', 'vfdrc_max_rules': 25, 'vfdrc_expand_criterion': 'foil_gain', 'vfdrc_remove_poor_atts': True}. Best is trial 9 with value: 0.983804.[0m
[32m[I 2022-10-20 16:23:21,361][0m Trial 19 finished with value: 0.6053435449254854 and parameters: {'vfdrc_ordered_rules': True, 'vfdrc_grace_period': 200, 'vfdrc_tie_threshold': 0.0, 'vfdrc_rule_prediction': 'weighted_sum', 'vfdrc_max_rules': 40, 'vfdrc_expand_criterion': 'info_gain', 'vfdrc_remove_poor_atts': False}. Best is trial 9 with value: 0.983804.[0m
[32m[I 2022-10-20 16:24:24,351][0m Trial 17 finished with value: 0.6053435449254854 and parameters: {'vfdrc_ordered_rules': True, 'vfdrc_grace_period': 150, 'vfdrc_tie_threshold': 0.0, 'vfdrc_rule_prediction': 'first_hit', 'vfdrc_max_rules': 40, 'vfdrc_expand_criterion': 'info_gain', 'vfdrc_remove_poor_atts': False}. Best is trial 9 with value: 0.983804.[0m
[32m[I 2022-10-20 16:24:24,398][0m Trial 10 finished with value: 0.9546719588899443 and parameters: {'vfdrc_ordered_rules': False, 'vfdrc_grace_period': 100, 'vfdrc_tie_threshold': 0.15000000000000002, 'vfdrc_rule_prediction': 'first_hit', 'vfdrc_max_rules': 25, 'vfdrc_expand_criterion': 'info_gain', 'vfdrc_remove_poor_atts': True}. Best is trial 9 with value: 0.983804.[0m
[32m[I 2022-10-20 16:25:26,742][0m Trial 20 finished with value: 0.9911677405324946 and parameters: {'vfdrc_ordered_rules': True, 'vfdrc_grace_period': 200, 'vfdrc_tie_threshold': 0.05, 'vfdrc_rule_prediction': 'weighted_sum', 'vfdrc_max_rules': 40, 'vfdrc_expand_criterion': 'info_gain', 'vfdrc_remove_poor_atts': False}. Best is trial 20 with value: 0.991168.[0m
[32m[I 2022-10-20 16:27:49,846][0m Trial 18 finished with value: 0.6053435449254854 and parameters: {'vfdrc_ordered_rules': True, 'vfdrc_grace_period': 200, 'vfdrc_tie_threshold': 0.0, 'vfdrc_rule_prediction': 'weighted_sum', 'vfdrc_max_rules': 40, 'vfdrc_expand_criterion': 'info_gain', 'vfdrc_remove_poor_atts': False}. Best is trial 20 with value: 0.991168.[0m
[32m[I 2022-10-20 16:28:44,090][0m Trial 24 finished with value: 0.987324208483352 and parameters: {'vfdrc_ordered_rules': True, 'vfdrc_grace_period': 100, 'vfdrc_tie_threshold': 0.9500000000000001, 'vfdrc_rule_prediction': 'weighted_sum', 'vfdrc_max_rules': 40, 'vfdrc_expand_criterion': 'info_gain', 'vfdrc_remove_poor_atts': False}. Best is trial 20 with value: 0.991168.[0m
[32m[I 2022-10-20 16:29:00,740][0m Trial 22 finished with value: 0.6053435449254854 and parameters: {'vfdrc_ordered_rules': True, 'vfdrc_grace_period': 150, 'vfdrc_tie_threshold': 0.0, 'vfdrc_rule_prediction': 'weighted_sum', 'vfdrc_max_rules': 40, 'vfdrc_expand_criterion': 'info_gain', 'vfdrc_remove_poor_atts': False}. Best is trial 20 with value: 0.991168.[0m
[32m[I 2022-10-20 16:29:38,619][0m Trial 21 finished with value: 0.6053435449254854 and parameters: {'vfdrc_ordered_rules': True, 'vfdrc_grace_period': 150, 'vfdrc_tie_threshold': 0.0, 'vfdrc_rule_prediction': 'weighted_sum', 'vfdrc_max_rules': 40, 'vfdrc_expand_criterion': 'info_gain', 'vfdrc_remove_poor_atts': False}. Best is trial 20 with value: 0.991168.[0m
[32m[I 2022-10-20 16:32:18,327][0m Trial 25 finished with value: 0.9814917667364738 and parameters: {'vfdrc_ordered_rules': True, 'vfdrc_grace_period': 250, 'vfdrc_tie_threshold': 1.0, 'vfdrc_rule_prediction': 'weighted_sum', 'vfdrc_max_rules': 35, 'vfdrc_expand_criterion': 'info_gain', 'vfdrc_remove_poor_atts': False}. Best is trial 20 with value: 0.991168.[0m
[32m[I 2022-10-20 16:32:19,651][0m Trial 23 finished with value: 0.6053435449254854 and parameters: {'vfdrc_ordered_rules': True, 'vfdrc_grace_period': 100, 'vfdrc_tie_threshold': 0.0, 'vfdrc_rule_prediction': 'weighted_sum', 'vfdrc_max_rules': 40, 'vfdrc_expand_criterion': 'info_gain', 'vfdrc_remove_poor_atts': False}. Best is trial 20 with value: 0.991168.[0m
[32m[I 2022-10-20 16:33:05,620][0m Trial 26 finished with value: 0.9814917667364738 and parameters: {'vfdrc_ordered_rules': True, 'vfdrc_grace_period': 250, 'vfdrc_tie_threshold': 1.0, 'vfdrc_rule_prediction': 'weighted_sum', 'vfdrc_max_rules': 35, 'vfdrc_expand_criterion': 'info_gain', 'vfdrc_remove_poor_atts': False}. Best is trial 20 with value: 0.991168.[0m
[32m[I 2022-10-20 16:33:38,995][0m Trial 27 finished with value: 0.9838043688208807 and parameters: {'vfdrc_ordered_rules': True, 'vfdrc_grace_period': 200, 'vfdrc_tie_threshold': 0.35000000000000003, 'vfdrc_rule_prediction': 'weighted_sum', 'vfdrc_max_rules': 35, 'vfdrc_expand_criterion': 'info_gain', 'vfdrc_remove_poor_atts': False}. Best is trial 20 with value: 0.991168.[0m
[32m[I 2022-10-20 16:35:30,585][0m Trial 29 finished with value: 0.9676927629479986 and parameters: {'vfdrc_ordered_rules': True, 'vfdrc_grace_period': 100, 'vfdrc_tie_threshold': 0.7000000000000001, 'vfdrc_rule_prediction': 'weighted_sum', 'vfdrc_max_rules': 35, 'vfdrc_expand_criterion': 'info_gain', 'vfdrc_remove_poor_atts': False}. Best is trial 20 with value: 0.991168.[0m
[32m[I 2022-10-20 16:36:16,255][0m Trial 28 finished with value: 0.9814917667364738 and parameters: {'vfdrc_ordered_rules': True, 'vfdrc_grace_period': 250, 'vfdrc_tie_threshold': 1.0, 'vfdrc_rule_prediction': 'weighted_sum', 'vfdrc_max_rules': 35, 'vfdrc_expand_criterion': 'info_gain', 'vfdrc_remove_poor_atts': False}. Best is trial 20 with value: 0.991168.[0m
[32m[I 2022-10-20 16:38:57,416][0m Trial 30 finished with value: 0.9681526133253976 and parameters: {'vfdrc_ordered_rules': True, 'vfdrc_grace_period': 100, 'vfdrc_tie_threshold': 0.35000000000000003, 'vfdrc_rule_prediction': 'weighted_sum', 'vfdrc_max_rules': 35, 'vfdrc_expand_criterion': 'info_gain', 'vfdrc_remove_poor_atts': False}. Best is trial 20 with value: 0.991168.[0m
[32m[I 2022-10-20 16:39:14,106][0m Trial 31 finished with value: 0.9681526133253976 and parameters: {'vfdrc_ordered_rules': True, 'vfdrc_grace_period': 100, 'vfdrc_tie_threshold': 0.35000000000000003, 'vfdrc_rule_prediction': 'weighted_sum', 'vfdrc_max_rules': 35, 'vfdrc_expand_criterion': 'info_gain', 'vfdrc_remove_poor_atts': False}. Best is trial 20 with value: 0.991168.[0m
[32m[I 2022-10-20 16:40:32,077][0m Trial 32 finished with value: 0.9676927629479986 and parameters: {'vfdrc_ordered_rules': True, 'vfdrc_grace_period': 100, 'vfdrc_tie_threshold': 0.7000000000000001, 'vfdrc_rule_prediction': 'weighted_sum', 'vfdrc_max_rules': 35, 'vfdrc_expand_criterion': 'info_gain', 'vfdrc_remove_poor_atts': False}. Best is trial 20 with value: 0.991168.[0m
[32m[I 2022-10-20 16:41:20,373][0m Trial 36 finished with value: 0.9492015228866574 and parameters: {'vfdrc_ordered_rules': True, 'vfdrc_grace_period': 150, 'vfdrc_tie_threshold': 0.45, 'vfdrc_rule_prediction': 'weighted_max', 'vfdrc_max_rules': 35, 'vfdrc_expand_criterion': 'foil_gain', 'vfdrc_remove_poor_atts': False}. Best is trial 20 with value: 0.991168.[0m
[32m[I 2022-10-20 16:41:45,072][0m Trial 33 finished with value: 0.9676927629479986 and parameters: {'vfdrc_ordered_rules': True, 'vfdrc_grace_period': 100, 'vfdrc_tie_threshold': 0.7000000000000001, 'vfdrc_rule_prediction': 'weighted_sum', 'vfdrc_max_rules': 35, 'vfdrc_expand_criterion': 'info_gain', 'vfdrc_remove_poor_atts': False}. Best is trial 20 with value: 0.991168.[0m
[32m[I 2022-10-20 16:42:47,562][0m Trial 34 finished with value: 0.9681526133253976 and parameters: {'vfdrc_ordered_rules': True, 'vfdrc_grace_period': 100, 'vfdrc_tie_threshold': 0.35000000000000003, 'vfdrc_rule_prediction': 'weighted_sum', 'vfdrc_max_rules': 35, 'vfdrc_expand_criterion': 'info_gain', 'vfdrc_remove_poor_atts': False}. Best is trial 20 with value: 0.991168.[0m
[32m[I 2022-10-20 16:42:57,642][0m Trial 35 finished with value: 0.9676927629479986 and parameters: {'vfdrc_ordered_rules': True, 'vfdrc_grace_period': 100, 'vfdrc_tie_threshold': 0.7000000000000001, 'vfdrc_rule_prediction': 'weighted_sum', 'vfdrc_max_rules': 35, 'vfdrc_expand_criterion': 'info_gain', 'vfdrc_remove_poor_atts': False}. Best is trial 20 with value: 0.991168.[0m
[32m[I 2022-10-20 16:43:29,903][0m Trial 37 finished with value: 0.9770005881626296 and parameters: {'vfdrc_ordered_rules': True, 'vfdrc_grace_period': 150, 'vfdrc_tie_threshold': 0.1, 'vfdrc_rule_prediction': 'weighted_max', 'vfdrc_max_rules': 35, 'vfdrc_expand_criterion': 'foil_gain', 'vfdrc_remove_poor_atts': False}. Best is trial 20 with value: 0.991168.[0m
[32m[I 2022-10-20 16:47:21,691][0m Trial 38 finished with value: 0.9905320860756549 and parameters: {'vfdrc_ordered_rules': True, 'vfdrc_grace_period': 200, 'vfdrc_tie_threshold': 0.45, 'vfdrc_rule_prediction': 'weighted_sum', 'vfdrc_max_rules': 35, 'vfdrc_expand_criterion': 'info_gain', 'vfdrc_remove_poor_atts': False}. Best is trial 20 with value: 0.991168.[0m
[32m[I 2022-10-20 16:48:01,270][0m Trial 41 finished with value: 0.9372719447658866 and parameters: {'vfdrc_ordered_rules': True, 'vfdrc_grace_period': 200, 'vfdrc_tie_threshold': 0.45, 'vfdrc_rule_prediction': 'weighted_sum', 'vfdrc_max_rules': 30, 'vfdrc_expand_criterion': 'foil_gain', 'vfdrc_remove_poor_atts': False}. Best is trial 20 with value: 0.991168.[0m
[32m[I 2022-10-20 16:48:07,624][0m Trial 39 finished with value: 0.9372719447658866 and parameters: {'vfdrc_ordered_rules': True, 'vfdrc_grace_period': 200, 'vfdrc_tie_threshold': 0.45, 'vfdrc_rule_prediction': 'weighted_max', 'vfdrc_max_rules': 30, 'vfdrc_expand_criterion': 'foil_gain', 'vfdrc_remove_poor_atts': False}. Best is trial 20 with value: 0.991168.[0m
[32m[I 2022-10-20 16:49:39,614][0m Trial 40 finished with value: 0.9372719447658866 and parameters: {'vfdrc_ordered_rules': True, 'vfdrc_grace_period': 200, 'vfdrc_tie_threshold': 0.45, 'vfdrc_rule_prediction': 'weighted_max', 'vfdrc_max_rules': 30, 'vfdrc_expand_criterion': 'foil_gain', 'vfdrc_remove_poor_atts': False}. Best is trial 20 with value: 0.991168.[0m
[32m[I 2022-10-20 16:53:17,585][0m Trial 42 finished with value: 0.9429586769605443 and parameters: {'vfdrc_ordered_rules': True, 'vfdrc_grace_period': 200, 'vfdrc_tie_threshold': 0.1, 'vfdrc_rule_prediction': 'weighted_sum', 'vfdrc_max_rules': 30, 'vfdrc_expand_criterion': 'foil_gain', 'vfdrc_remove_poor_atts': False}. Best is trial 20 with value: 0.991168.[0m
[32m[I 2022-10-20 16:53:19,714][0m Trial 45 finished with value: 0.9372719447658866 and parameters: {'vfdrc_ordered_rules': True, 'vfdrc_grace_period': 200, 'vfdrc_tie_threshold': 0.45, 'vfdrc_rule_prediction': 'weighted_sum', 'vfdrc_max_rules': 30, 'vfdrc_expand_criterion': 'foil_gain', 'vfdrc_remove_poor_atts': False}. Best is trial 20 with value: 0.991168.[0m
[32m[I 2022-10-20 16:53:35,537][0m Trial 43 finished with value: 0.9429586769605443 and parameters: {'vfdrc_ordered_rules': True, 'vfdrc_grace_period': 200, 'vfdrc_tie_threshold': 0.1, 'vfdrc_rule_prediction': 'weighted_max', 'vfdrc_max_rules': 30, 'vfdrc_expand_criterion': 'foil_gain', 'vfdrc_remove_poor_atts': False}. Best is trial 20 with value: 0.991168.[0m
[32m[I 2022-10-20 16:53:36,120][0m Trial 44 finished with value: 0.9068405677655568 and parameters: {'vfdrc_ordered_rules': True, 'vfdrc_grace_period': 200, 'vfdrc_tie_threshold': 0.5, 'vfdrc_rule_prediction': 'weighted_max', 'vfdrc_max_rules': 30, 'vfdrc_expand_criterion': 'foil_gain', 'vfdrc_remove_poor_atts': False}. Best is trial 20 with value: 0.991168.[0m
[32m[I 2022-10-20 16:57:03,388][0m Trial 47 finished with value: 0.6518929086662223 and parameters: {'vfdrc_ordered_rules': False, 'vfdrc_grace_period': 200, 'vfdrc_tie_threshold': 0.5, 'vfdrc_rule_prediction': 'weighted_sum', 'vfdrc_max_rules': 40, 'vfdrc_expand_criterion': 'hellinger', 'vfdrc_remove_poor_atts': False}. Best is trial 20 with value: 0.991168.[0m
[32m[I 2022-10-20 17:02:48,761][0m Trial 48 finished with value: 0.9791231276870708 and parameters: {'vfdrc_ordered_rules': True, 'vfdrc_grace_period': 200, 'vfdrc_tie_threshold': 0.25, 'vfdrc_rule_prediction': 'weighted_sum', 'vfdrc_max_rules': 40, 'vfdrc_expand_criterion': 'info_gain', 'vfdrc_remove_poor_atts': False}. Best is trial 20 with value: 0.991168.[0m
[32m[I 2022-10-20 17:03:06,896][0m Trial 49 finished with value: 0.987807085349532 and parameters: {'vfdrc_ordered_rules': True, 'vfdrc_grace_period': 250, 'vfdrc_tie_threshold': 0.55, 'vfdrc_rule_prediction': 'weighted_sum', 'vfdrc_max_rules': 40, 'vfdrc_expand_criterion': 'info_gain', 'vfdrc_remove_poor_atts': False}. Best is trial 20 with value: 0.991168.[0m
[32m[I 2022-10-20 17:03:25,793][0m Trial 46 finished with value: 0.9567334883449194 and parameters: {'vfdrc_ordered_rules': False, 'vfdrc_grace_period': 200, 'vfdrc_tie_threshold': 0.5, 'vfdrc_rule_prediction': 'weighted_sum', 'vfdrc_max_rules': 30, 'vfdrc_expand_criterion': 'foil_gain', 'vfdrc_remove_poor_atts': False}. Best is trial 20 with value: 0.991168.[0m
[32m[I 2022-10-20 17:15:28,627][0m Trial 53 finished with value: 0.6288023755961998 and parameters: {'vfdrc_ordered_rules': False, 'vfdrc_grace_period': 250, 'vfdrc_tie_threshold': 0.25, 'vfdrc_rule_prediction': 'weighted_sum', 'vfdrc_max_rules': 40, 'vfdrc_expand_criterion': 'hellinger', 'vfdrc_remove_poor_atts': True}. Best is trial 20 with value: 0.991168.[0m
[32m[I 2022-10-20 17:16:01,875][0m Trial 51 finished with value: 0.9157646164437412 and parameters: {'vfdrc_ordered_rules': False, 'vfdrc_grace_period': 250, 'vfdrc_tie_threshold': 0.55, 'vfdrc_rule_prediction': 'weighted_sum', 'vfdrc_max_rules': 40, 'vfdrc_expand_criterion': 'info_gain', 'vfdrc_remove_poor_atts': False}. Best is trial 20 with value: 0.991168.[0m
[32m[I 2022-10-20 17:17:07,501][0m Trial 52 finished with value: 0.6288023755961998 and parameters: {'vfdrc_ordered_rules': False, 'vfdrc_grace_period': 250, 'vfdrc_tie_threshold': 0.25, 'vfdrc_rule_prediction': 'weighted_sum', 'vfdrc_max_rules': 40, 'vfdrc_expand_criterion': 'hellinger', 'vfdrc_remove_poor_atts': True}. Best is trial 20 with value: 0.991168.[0m
[32m[I 2022-10-20 17:20:19,714][0m Trial 50 finished with value: 0.882007905611659 and parameters: {'vfdrc_ordered_rules': False, 'vfdrc_grace_period': 250, 'vfdrc_tie_threshold': 0.25, 'vfdrc_rule_prediction': 'weighted_sum', 'vfdrc_max_rules': 40, 'vfdrc_expand_criterion': 'info_gain', 'vfdrc_remove_poor_atts': False}. Best is trial 20 with value: 0.991168.[0m
[32m[I 2022-10-20 17:20:27,589][0m Trial 57 finished with value: 0.8719843500793572 and parameters: {'vfdrc_ordered_rules': False, 'vfdrc_grace_period': 300, 'vfdrc_tie_threshold': 0.6000000000000001, 'vfdrc_rule_prediction': 'weighted_sum', 'vfdrc_max_rules': 40, 'vfdrc_expand_criterion': 'info_gain', 'vfdrc_remove_poor_atts': True}. Best is trial 20 with value: 0.991168.[0m
[32m[I 2022-10-20 17:20:27,621][0m Trial 56 finished with value: 0.9157646164437412 and parameters: {'vfdrc_ordered_rules': False, 'vfdrc_grace_period': 250, 'vfdrc_tie_threshold': 0.6000000000000001, 'vfdrc_rule_prediction': 'weighted_sum', 'vfdrc_max_rules': 40, 'vfdrc_expand_criterion': 'info_gain', 'vfdrc_remove_poor_atts': True}. Best is trial 20 with value: 0.991168.[0m
[32m[I 2022-10-20 17:21:32,994][0m Trial 54 finished with value: 0.8931130477596404 and parameters: {'vfdrc_ordered_rules': False, 'vfdrc_grace_period': 250, 'vfdrc_tie_threshold': 0.25, 'vfdrc_rule_prediction': 'weighted_sum', 'vfdrc_max_rules': 40, 'vfdrc_expand_criterion': 'info_gain', 'vfdrc_remove_poor_atts': True}. Best is trial 20 with value: 0.991168.[0m
[32m[I 2022-10-20 17:22:56,393][0m Trial 55 finished with value: 0.9157646164437412 and parameters: {'vfdrc_ordered_rules': False, 'vfdrc_grace_period': 250, 'vfdrc_tie_threshold': 0.6000000000000001, 'vfdrc_rule_prediction': 'weighted_sum', 'vfdrc_max_rules': 40, 'vfdrc_expand_criterion': 'info_gain', 'vfdrc_remove_poor_atts': True}. Best is trial 20 with value: 0.991168.[0m
[32m[I 2022-10-20 17:24:25,071][0m Trial 59 finished with value: 0.9914267211972886 and parameters: {'vfdrc_ordered_rules': True, 'vfdrc_grace_period': 300, 'vfdrc_tie_threshold': 0.30000000000000004, 'vfdrc_rule_prediction': 'weighted_sum', 'vfdrc_max_rules': 40, 'vfdrc_expand_criterion': 'info_gain', 'vfdrc_remove_poor_atts': True}. Best is trial 59 with value: 0.991427.[0m
[32m[I 2022-10-20 17:24:59,024][0m Trial 58 finished with value: 0.987807085349532 and parameters: {'vfdrc_ordered_rules': True, 'vfdrc_grace_period': 250, 'vfdrc_tie_threshold': 0.6000000000000001, 'vfdrc_rule_prediction': 'weighted_sum', 'vfdrc_max_rules': 40, 'vfdrc_expand_criterion': 'info_gain', 'vfdrc_remove_poor_atts': True}. Best is trial 59 with value: 0.991427.[0m
[32m[I 2022-10-20 17:25:50,346][0m Trial 60 finished with value: 0.9913793437598339 and parameters: {'vfdrc_ordered_rules': True, 'vfdrc_grace_period': 300, 'vfdrc_tie_threshold': 0.65, 'vfdrc_rule_prediction': 'weighted_sum', 'vfdrc_max_rules': 20, 'vfdrc_expand_criterion': 'info_gain', 'vfdrc_remove_poor_atts': False}. Best is trial 59 with value: 0.991427.[0m
[32m[I 2022-10-20 17:28:25,194][0m Trial 64 finished with value: 0.9793233417383215 and parameters: {'vfdrc_ordered_rules': True, 'vfdrc_grace_period': 150, 'vfdrc_tie_threshold': 0.4, 'vfdrc_rule_prediction': 'first_hit', 'vfdrc_max_rules': 20, 'vfdrc_expand_criterion': 'info_gain', 'vfdrc_remove_poor_atts': False}. Best is trial 59 with value: 0.991427.[0m
[32m[I 2022-10-20 17:28:54,375][0m Trial 63 finished with value: 0.9760840841155233 and parameters: {'vfdrc_ordered_rules': True, 'vfdrc_grace_period': 150, 'vfdrc_tie_threshold': 0.9, 'vfdrc_rule_prediction': 'first_hit', 'vfdrc_max_rules': 20, 'vfdrc_expand_criterion': 'info_gain', 'vfdrc_remove_poor_atts': False}. Best is trial 59 with value: 0.991427.[0m
[32m[I 2022-10-20 17:29:09,379][0m Trial 61 finished with value: 0.9913793437598339 and parameters: {'vfdrc_ordered_rules': True, 'vfdrc_grace_period': 300, 'vfdrc_tie_threshold': 0.4, 'vfdrc_rule_prediction': 'weighted_sum', 'vfdrc_max_rules': 20, 'vfdrc_expand_criterion': 'info_gain', 'vfdrc_remove_poor_atts': False}. Best is trial 59 with value: 0.991427.[0m
[32m[I 2022-10-20 17:29:33,618][0m Trial 62 finished with value: 0.9052503348809701 and parameters: {'vfdrc_ordered_rules': True, 'vfdrc_grace_period': 150, 'vfdrc_tie_threshold': 0.30000000000000004, 'vfdrc_rule_prediction': 'first_hit', 'vfdrc_max_rules': 15, 'vfdrc_expand_criterion': 'info_gain', 'vfdrc_remove_poor_atts': False}. Best is trial 59 with value: 0.991427.[0m
[32m[I 2022-10-20 17:31:29,601][0m Trial 65 finished with value: 0.9760028354635677 and parameters: {'vfdrc_ordered_rules': True, 'vfdrc_grace_period': 150, 'vfdrc_tie_threshold': 0.9, 'vfdrc_rule_prediction': 'first_hit', 'vfdrc_max_rules': 15, 'vfdrc_expand_criterion': 'info_gain', 'vfdrc_remove_poor_atts': False}. Best is trial 59 with value: 0.991427.[0m
[32m[I 2022-10-20 17:31:36,791][0m Trial 66 finished with value: 0.9652776905970238 and parameters: {'vfdrc_ordered_rules': True, 'vfdrc_grace_period': 350, 'vfdrc_tie_threshold': 0.30000000000000004, 'vfdrc_rule_prediction': 'first_hit', 'vfdrc_max_rules': 20, 'vfdrc_expand_criterion': 'info_gain', 'vfdrc_remove_poor_atts': True}. Best is trial 59 with value: 0.991427.[0m
[32m[I 2022-10-20 17:32:58,951][0m Trial 67 finished with value: 0.9913793437598339 and parameters: {'vfdrc_ordered_rules': True, 'vfdrc_grace_period': 300, 'vfdrc_tie_threshold': 0.9500000000000001, 'vfdrc_rule_prediction': 'first_hit', 'vfdrc_max_rules': 20, 'vfdrc_expand_criterion': 'info_gain', 'vfdrc_remove_poor_atts': True}. Best is trial 59 with value: 0.991427.[0m
[32m[I 2022-10-20 17:34:04,597][0m Trial 68 finished with value: 0.9913793437598339 and parameters: {'vfdrc_ordered_rules': True, 'vfdrc_grace_period': 300, 'vfdrc_tie_threshold': 0.9500000000000001, 'vfdrc_rule_prediction': 'first_hit', 'vfdrc_max_rules': 20, 'vfdrc_expand_criterion': 'info_gain', 'vfdrc_remove_poor_atts': True}. Best is trial 59 with value: 0.991427.[0m
[32m[I 2022-10-20 17:34:54,150][0m Trial 69 finished with value: 0.9914203653804865 and parameters: {'vfdrc_ordered_rules': True, 'vfdrc_grace_period': 300, 'vfdrc_tie_threshold': 0.9, 'vfdrc_rule_prediction': 'weighted_sum', 'vfdrc_max_rules': 15, 'vfdrc_expand_criterion': 'info_gain', 'vfdrc_remove_poor_atts': True}. Best is trial 59 with value: 0.991427.[0m
