[32m[I 2022-10-20 14:28:12,963][0m Trial 80 finished with value: 0.990187784388852 and parameters: {'mlpc_hidden_layer_count': 1, 'mlpc_learning_rate': 'invscaling', 'mlpc_learning_rate_init': 8.773712021947162e-06, 'mplc_max_iter': 2000}. Best is trial 56 with value: 0.991054.[0m
[32m[I 2022-10-20 14:28:13,234][0m sklearn.model_selection.train_test_split: running accelerated version on CPU[0m
[32m[I 2022-10-20 14:28:13,281][0m sklearn.model_selection.train_test_split: fallback to original Scikit-learn[0m
[32m[I 2022-10-20 14:29:45,549][0m Trial 74 finished with value: 0.9894279222995814 and parameters: {'mlpc_hidden_layer_count': 2, 'mlpc_learning_rate': 'adaptive', 'mlpc_learning_rate_init': 0.0001573153742427717, 'mplc_max_iter': 2000}. Best is trial 56 with value: 0.991054.[0m
[32m[I 2022-10-20 14:29:45,840][0m sklearn.model_selection.train_test_split: running accelerated version on CPU[0m
[32m[I 2022-10-20 14:29:45,872][0m sklearn.model_selection.train_test_split: fallback to original Scikit-learn[0m
[32m[I 2022-10-20 14:29:59,591][0m Trial 84 finished with value: 0.2844441188051378 and parameters: {'mlpc_hidden_layer_count': 1, 'mlpc_learning_rate': 'invscaling', 'mlpc_learning_rate_init': 0.8001848034392851, 'mplc_max_iter': 2000}. Best is trial 56 with value: 0.991054.[0m
[32m[I 2022-10-20 14:29:59,831][0m sklearn.model_selection.train_test_split: running accelerated version on CPU[0m
[32m[I 2022-10-20 14:29:59,879][0m sklearn.model_selection.train_test_split: fallback to original Scikit-learn[0m
[32m[I 2022-10-20 14:30:24,773][0m Trial 76 finished with value: 0.9884466924269006 and parameters: {'mlpc_hidden_layer_count': 2, 'mlpc_learning_rate': 'adaptive', 'mlpc_learning_rate_init': 0.00016419360728949487, 'mplc_max_iter': 2000}. Best is trial 56 with value: 0.991054.[0m
[32m[I 2022-10-20 14:30:25,031][0m sklearn.model_selection.train_test_split: running accelerated version on CPU[0m
[32m[I 2022-10-20 14:30:25,078][0m sklearn.model_selection.train_test_split: fallback to original Scikit-learn[0m
[32m[I 2022-10-20 14:30:52,080][0m Trial 82 finished with value: 0.9884055682512001 and parameters: {'mlpc_hidden_layer_count': 1, 'mlpc_learning_rate': 'adaptive', 'mlpc_learning_rate_init': 9.330898678736635e-06, 'mplc_max_iter': 2000}. Best is trial 56 with value: 0.991054.[0m
[32m[I 2022-10-20 14:30:52,312][0m sklearn.model_selection.train_test_split: running accelerated version on CPU[0m
[32m[I 2022-10-20 14:30:52,356][0m sklearn.model_selection.train_test_split: fallback to original Scikit-learn[0m
[32m[I 2022-10-20 14:31:53,192][0m Trial 77 finished with value: 0.9881689324188568 and parameters: {'mlpc_hidden_layer_count': 2, 'mlpc_learning_rate': 'adaptive', 'mlpc_learning_rate_init': 0.0001370153236068057, 'mplc_max_iter': 2000}. Best is trial 56 with value: 0.991054.[0m
[32m[I 2022-10-20 14:31:53,462][0m sklearn.model_selection.train_test_split: running accelerated version on CPU[0m
[32m[I 2022-10-20 14:31:53,510][0m sklearn.model_selection.train_test_split: fallback to original Scikit-learn[0m
[32m[I 2022-10-20 14:32:34,089][0m Trial 83 finished with value: 0.9887203453401489 and parameters: {'mlpc_hidden_layer_count': 1, 'mlpc_learning_rate': 'invscaling', 'mlpc_learning_rate_init': 1.2522954311103361e-05, 'mplc_max_iter': 2000}. Best is trial 56 with value: 0.991054.[0m
[32m[I 2022-10-20 14:32:34,313][0m sklearn.model_selection.train_test_split: running accelerated version on CPU[0m
[32m[I 2022-10-20 14:32:34,361][0m sklearn.model_selection.train_test_split: fallback to original Scikit-learn[0m
[32m[I 2022-10-20 14:34:34,887][0m Trial 85 finished with value: 0.9903074449035816 and parameters: {'mlpc_hidden_layer_count': 1, 'mlpc_learning_rate': 'invscaling', 'mlpc_learning_rate_init': 2.9521780173008676e-05, 'mplc_max_iter': 2000}. Best is trial 56 with value: 0.991054.[0m
[32m[I 2022-10-20 14:34:35,149][0m sklearn.model_selection.train_test_split: running accelerated version on CPU[0m
[32m[I 2022-10-20 14:34:35,196][0m sklearn.model_selection.train_test_split: fallback to original Scikit-learn[0m
[32m[I 2022-10-20 14:36:07,800][0m Trial 86 finished with value: 0.9898176225886918 and parameters: {'mlpc_hidden_layer_count': 1, 'mlpc_learning_rate': 'invscaling', 'mlpc_learning_rate_init': 3.0057101998794092e-05, 'mplc_max_iter': 2000}. Best is trial 56 with value: 0.991054.[0m
[32m[I 2022-10-20 14:36:08,042][0m sklearn.model_selection.train_test_split: running accelerated version on CPU[0m
[32m[I 2022-10-20 14:36:08,074][0m sklearn.model_selection.train_test_split: fallback to original Scikit-learn[0m
[32m[I 2022-10-20 14:37:43,320][0m Trial 91 finished with value: 0.9885673365650313 and parameters: {'mlpc_hidden_layer_count': 1, 'mlpc_learning_rate': 'invscaling', 'mlpc_learning_rate_init': 3.285958353175834e-05, 'mplc_max_iter': 2000}. Best is trial 56 with value: 0.991054.[0m
[32m[I 2022-10-20 14:37:43,571][0m sklearn.model_selection.train_test_split: running accelerated version on CPU[0m
[32m[I 2022-10-20 14:37:43,618][0m sklearn.model_selection.train_test_split: fallback to original Scikit-learn[0m
[32m[I 2022-10-20 14:37:54,726][0m Trial 87 finished with value: 0.9900935613693213 and parameters: {'mlpc_hidden_layer_count': 1, 'mlpc_learning_rate': 'invscaling', 'mlpc_learning_rate_init': 2.9147329599036307e-05, 'mplc_max_iter': 2000}. Best is trial 56 with value: 0.991054.[0m
[32m[I 2022-10-20 14:37:54,965][0m sklearn.model_selection.train_test_split: running accelerated version on CPU[0m
[32m[I 2022-10-20 14:37:55,012][0m sklearn.model_selection.train_test_split: fallback to original Scikit-learn[0m
[32m[I 2022-10-20 14:38:26,900][0m Trial 89 finished with value: 0.9903301319359794 and parameters: {'mlpc_hidden_layer_count': 1, 'mlpc_learning_rate': 'invscaling', 'mlpc_learning_rate_init': 3.1957265057803e-05, 'mplc_max_iter': 2000}. Best is trial 56 with value: 0.991054.[0m
[32m[I 2022-10-20 14:38:27,135][0m sklearn.model_selection.train_test_split: running accelerated version on CPU[0m
[32m[I 2022-10-20 14:38:27,183][0m sklearn.model_selection.train_test_split: fallback to original Scikit-learn[0m
[32m[I 2022-10-20 14:39:10,506][0m Trial 88 finished with value: 0.9907333254782127 and parameters: {'mlpc_hidden_layer_count': 1, 'mlpc_learning_rate': 'invscaling', 'mlpc_learning_rate_init': 1.07328261455944e-05, 'mplc_max_iter': 2000}. Best is trial 56 with value: 0.991054.[0m
[32m[I 2022-10-20 14:39:10,738][0m sklearn.model_selection.train_test_split: running accelerated version on CPU[0m
[32m[I 2022-10-20 14:39:10,786][0m sklearn.model_selection.train_test_split: fallback to original Scikit-learn[0m
[32m[I 2022-10-20 14:40:49,036][0m Trial 94 finished with value: 0.9844336299928361 and parameters: {'mlpc_hidden_layer_count': 1, 'mlpc_learning_rate': 'constant', 'mlpc_learning_rate_init': 8.32511435470334e-05, 'mplc_max_iter': 2000}. Best is trial 56 with value: 0.991054.[0m
[32m[I 2022-10-20 14:40:49,273][0m sklearn.model_selection.train_test_split: running accelerated version on CPU[0m
[32m[I 2022-10-20 14:40:49,321][0m sklearn.model_selection.train_test_split: fallback to original Scikit-learn[0m
[32m[I 2022-10-20 14:40:59,335][0m Trial 95 finished with value: 0.9882863804595474 and parameters: {'mlpc_hidden_layer_count': 1, 'mlpc_learning_rate': 'constant', 'mlpc_learning_rate_init': 8.65435757308271e-05, 'mplc_max_iter': 2000}. Best is trial 56 with value: 0.991054.[0m
[32m[I 2022-10-20 14:40:59,604][0m sklearn.model_selection.train_test_split: running accelerated version on CPU[0m
[32m[I 2022-10-20 14:40:59,653][0m sklearn.model_selection.train_test_split: fallback to original Scikit-learn[0m
[32m[I 2022-10-20 14:41:04,401][0m Trial 92 finished with value: 0.9895275263586774 and parameters: {'mlpc_hidden_layer_count': 1, 'mlpc_learning_rate': 'invscaling', 'mlpc_learning_rate_init': 3.0393910567231142e-05, 'mplc_max_iter': 2000}. Best is trial 56 with value: 0.991054.[0m
[32m[I 2022-10-20 14:42:05,864][0m Trial 90 finished with value: 0.9896332169371945 and parameters: {'mlpc_hidden_layer_count': 1, 'mlpc_learning_rate': 'invscaling', 'mlpc_learning_rate_init': 5.161617167336854e-06, 'mplc_max_iter': 2000}. Best is trial 56 with value: 0.991054.[0m
[32m[I 2022-10-20 14:42:58,126][0m Trial 97 finished with value: 0.9884775898159863 and parameters: {'mlpc_hidden_layer_count': 1, 'mlpc_learning_rate': 'invscaling', 'mlpc_learning_rate_init': 7.281552768906355e-05, 'mplc_max_iter': 2000}. Best is trial 56 with value: 0.991054.[0m
[32m[I 2022-10-20 14:44:06,941][0m Trial 96 finished with value: 0.9899317599172679 and parameters: {'mlpc_hidden_layer_count': 1, 'mlpc_learning_rate': 'constant', 'mlpc_learning_rate_init': 1.5941290848073373e-05, 'mplc_max_iter': 2000}. Best is trial 56 with value: 0.991054.[0m
[32m[I 2022-10-20 14:44:33,608][0m Trial 93 finished with value: 0.9896064113838471 and parameters: {'mlpc_hidden_layer_count': 1, 'mlpc_learning_rate': 'invscaling', 'mlpc_learning_rate_init': 4.921015412845189e-06, 'mplc_max_iter': 2000}. Best is trial 56 with value: 0.991054.[0m
[32m[I 2022-10-20 14:44:41,548][0m Trial 98 finished with value: 0.9892693383380098 and parameters: {'mlpc_hidden_layer_count': 1, 'mlpc_learning_rate': 'invscaling', 'mlpc_learning_rate_init': 1.771023691252717e-05, 'mplc_max_iter': 2000}. Best is trial 56 with value: 0.991054.[0m
[32m[I 2022-10-20 14:45:36,057][0m Trial 75 finished with value: 0.9841779840985451 and parameters: {'mlpc_hidden_layer_count': 2, 'mlpc_learning_rate': 'adaptive', 'mlpc_learning_rate_init': 1.0524220622942843e-06, 'mplc_max_iter': 2000}. Best is trial 56 with value: 0.991054.[0m
[32m[I 2022-10-20 14:45:49,650][0m Trial 99 finished with value: 0.9908201192009221 and parameters: {'mlpc_hidden_layer_count': 1, 'mlpc_learning_rate': 'invscaling', 'mlpc_learning_rate_init': 1.7748092791232577e-05, 'mplc_max_iter': 2000}. Best is trial 56 with value: 0.991054.[0m
[32m[I 2022-10-20 14:45:49,718][0m Study finished.[0m
[32m[I 2022-10-20 14:45:49,811][0m --------------------------------------------------------------------------------[0m
[32m[I 2022-10-20 14:45:49,811][0m --------------------             MultinomialNB              --------------------[0m
[32m[I 2022-10-20 14:45:49,811][0m --------------------------------------------------------------------------------[0m
[32m[I 2022-10-20 14:45:49,890][0m A new study created in RDB with name: MultinomialNB_b4f53b70[0m
[32m[I 2022-10-20 14:45:49,890][0m Study started.[0m
[32m[I 2022-10-20 14:45:52,342][0m Trial 5 finished with value: 0.3841766551360142 and parameters: {'mnb_alpha': 0.65, 'mnb_fit_prior': False}. Best is trial 6 with value: 0.384844.[0m
[32m[I 2022-10-20 14:45:52,405][0m Trial 7 finished with value: 0.3841998140289928 and parameters: {'mnb_alpha': 0.25, 'mnb_fit_prior': False}. Best is trial 6 with value: 0.384844.[0m
[32m[I 2022-10-20 14:45:52,499][0m Trial 6 finished with value: 0.38484354706828566 and parameters: {'mnb_alpha': 0.0, 'mnb_fit_prior': False}. Best is trial 6 with value: 0.384844.[0m
[32m[I 2022-10-20 14:45:52,499][0m Trial 3 finished with value: 0.3841998140289928 and parameters: {'mnb_alpha': 0.5, 'mnb_fit_prior': False}. Best is trial 6 with value: 0.384844.[0m
[32m[I 2022-10-20 14:45:52,639][0m Trial 4 finished with value: 0.3841766551360142 and parameters: {'mnb_alpha': 0.7000000000000001, 'mnb_fit_prior': True}. Best is trial 6 with value: 0.384844.[0m
[32m[I 2022-10-20 14:45:52,639][0m Trial 1 finished with value: 0.3841881809986997 and parameters: {'mnb_alpha': 0.6000000000000001, 'mnb_fit_prior': False}. Best is trial 6 with value: 0.384844.[0m
[32m[I 2022-10-20 14:45:52,702][0m Trial 0 finished with value: 0.3841766551360142 and parameters: {'mnb_alpha': 0.8500000000000001, 'mnb_fit_prior': False}. Best is trial 6 with value: 0.384844.[0m
[32m[I 2022-10-20 14:45:52,843][0m Trial 2 finished with value: 0.38421133911073435 and parameters: {'mnb_alpha': 0.15000000000000002, 'mnb_fit_prior': True}. Best is trial 6 with value: 0.384844.[0m
[32m[I 2022-10-20 14:45:55,279][0m Trial 9 finished with value: 0.3841998140289928 and parameters: {'mnb_alpha': 0.45, 'mnb_fit_prior': True}. Best is trial 6 with value: 0.384844.[0m
[32m[I 2022-10-20 14:45:55,390][0m Trial 15 finished with value: 0.38423437530304067 and parameters: {'mnb_alpha': 0.05, 'mnb_fit_prior': True}. Best is trial 6 with value: 0.384844.[0m
[32m[I 2022-10-20 14:45:55,468][0m Trial 13 finished with value: 0.3841998140289928 and parameters: {'mnb_alpha': 0.25, 'mnb_fit_prior': True}. Best is trial 6 with value: 0.384844.[0m
[32m[I 2022-10-20 14:45:55,562][0m Trial 11 finished with value: 0.3841881809986997 and parameters: {'mnb_alpha': 0.55, 'mnb_fit_prior': False}. Best is trial 6 with value: 0.384844.[0m
[32m[I 2022-10-20 14:45:55,562][0m Trial 12 finished with value: 0.3841766551360142 and parameters: {'mnb_alpha': 0.9500000000000001, 'mnb_fit_prior': True}. Best is trial 6 with value: 0.384844.[0m
[32m[I 2022-10-20 14:45:55,703][0m Trial 8 finished with value: 0.38421133911073435 and parameters: {'mnb_alpha': 0.15000000000000002, 'mnb_fit_prior': False}. Best is trial 6 with value: 0.384844.[0m
[32m[I 2022-10-20 14:45:55,781][0m Trial 14 finished with value: 0.3841766551360142 and parameters: {'mnb_alpha': 0.9, 'mnb_fit_prior': False}. Best is trial 6 with value: 0.384844.[0m
[32m[I 2022-10-20 14:45:55,781][0m Trial 10 finished with value: 0.3841766551360142 and parameters: {'mnb_alpha': 0.65, 'mnb_fit_prior': True}. Best is trial 6 with value: 0.384844.[0m
[32m[I 2022-10-20 14:45:58,192][0m Trial 16 finished with value: 0.38484354706828566 and parameters: {'mnb_alpha': 0.0, 'mnb_fit_prior': True}. Best is trial 16 with value: 0.384844.[0m
[32m[I 2022-10-20 14:45:58,428][0m Trial 18 finished with value: 0.38484354706828566 and parameters: {'mnb_alpha': 0.0, 'mnb_fit_prior': True}. Best is trial 21 with value: 0.384844.[0m
[32m[I 2022-10-20 14:45:58,522][0m Trial 20 finished with value: 0.38423437530304067 and parameters: {'mnb_alpha': 0.05, 'mnb_fit_prior': True}. Best is trial 21 with value: 0.384844.[0m
[32m[I 2022-10-20 14:45:58,600][0m Trial 22 finished with value: 0.38484354706828566 and parameters: {'mnb_alpha': 0.0, 'mnb_fit_prior': True}. Best is trial 22 with value: 0.384844.[0m
[32m[I 2022-10-20 14:45:58,600][0m Trial 19 finished with value: 0.38484354706828566 and parameters: {'mnb_alpha': 0.0, 'mnb_fit_prior': True}. Best is trial 22 with value: 0.384844.[0m
[32m[I 2022-10-20 14:45:58,679][0m Trial 17 finished with value: 0.38484354706828566 and parameters: {'mnb_alpha': 0.0, 'mnb_fit_prior': True}. Best is trial 22 with value: 0.384844.[0m
[32m[I 2022-10-20 14:45:58,741][0m Trial 21 finished with value: 0.38484354706828566 and parameters: {'mnb_alpha': 0.0, 'mnb_fit_prior': True}. Best is trial 22 with value: 0.384844.[0m
[32m[I 2022-10-20 14:45:58,897][0m Trial 23 finished with value: 0.38484354706828566 and parameters: {'mnb_alpha': 0.0, 'mnb_fit_prior': True}. Best is trial 23 with value: 0.384844.[0m
[32m[I 2022-10-20 14:46:01,104][0m Trial 24 finished with value: 0.3841998140289928 and parameters: {'mnb_alpha': 0.35000000000000003, 'mnb_fit_prior': True}. Best is trial 6 with value: 0.384844.[0m
[32m[I 2022-10-20 14:46:01,632][0m Trial 26 finished with value: 0.3841998140289928 and parameters: {'mnb_alpha': 0.35000000000000003, 'mnb_fit_prior': True}. Best is trial 6 with value: 0.384844.[0m
[32m[I 2022-10-20 14:46:01,632][0m Trial 31 finished with value: 0.3841998140289928 and parameters: {'mnb_alpha': 0.35000000000000003, 'mnb_fit_prior': True}. Best is trial 6 with value: 0.384844.[0m
[32m[I 2022-10-20 14:46:01,788][0m Trial 27 finished with value: 0.3841998140289928 and parameters: {'mnb_alpha': 0.35000000000000003, 'mnb_fit_prior': True}. Best is trial 6 with value: 0.384844.[0m
[32m[I 2022-10-20 14:46:01,788][0m Trial 28 finished with value: 0.3841998140289928 and parameters: {'mnb_alpha': 0.35000000000000003, 'mnb_fit_prior': True}. Best is trial 6 with value: 0.384844.[0m
[32m[I 2022-10-20 14:46:01,851][0m Trial 29 finished with value: 0.3841998140289928 and parameters: {'mnb_alpha': 0.35000000000000003, 'mnb_fit_prior': True}. Best is trial 6 with value: 0.384844.[0m
[32m[I 2022-10-20 14:46:01,992][0m Trial 25 finished with value: 0.3841998140289928 and parameters: {'mnb_alpha': 0.35000000000000003, 'mnb_fit_prior': True}. Best is trial 6 with value: 0.384844.[0m
[32m[I 2022-10-20 14:46:02,086][0m Trial 30 finished with value: 0.3841998140289928 and parameters: {'mnb_alpha': 0.30000000000000004, 'mnb_fit_prior': True}. Best is trial 6 with value: 0.384844.[0m
[32m[I 2022-10-20 14:46:03,880][0m Trial 32 finished with value: 0.3841998140289928 and parameters: {'mnb_alpha': 0.2, 'mnb_fit_prior': True}. Best is trial 6 with value: 0.384844.[0m
[32m[I 2022-10-20 14:46:04,555][0m Trial 37 finished with value: 0.38421133911073435 and parameters: {'mnb_alpha': 0.15000000000000002, 'mnb_fit_prior': True}. Best is trial 6 with value: 0.384844.[0m
[32m[I 2022-10-20 14:46:04,649][0m Trial 38 finished with value: 0.38421133911073435 and parameters: {'mnb_alpha': 0.15000000000000002, 'mnb_fit_prior': True}. Best is trial 6 with value: 0.384844.[0m
[32m[I 2022-10-20 14:46:04,649][0m Trial 36 finished with value: 0.38421133911073435 and parameters: {'mnb_alpha': 0.15000000000000002, 'mnb_fit_prior': True}. Best is trial 6 with value: 0.384844.[0m
[32m[I 2022-10-20 14:46:04,805][0m Trial 35 finished with value: 0.38421133911073435 and parameters: {'mnb_alpha': 0.15000000000000002, 'mnb_fit_prior': True}. Best is trial 6 with value: 0.384844.[0m
[32m[I 2022-10-20 14:46:04,900][0m Trial 33 finished with value: 0.38421133911073435 and parameters: {'mnb_alpha': 0.15000000000000002, 'mnb_fit_prior': True}. Best is trial 6 with value: 0.384844.[0m
[32m[I 2022-10-20 14:46:04,900][0m Trial 34 finished with value: 0.38421133911073435 and parameters: {'mnb_alpha': 0.15000000000000002, 'mnb_fit_prior': True}. Best is trial 6 with value: 0.384844.[0m
[32m[I 2022-10-20 14:46:04,900][0m Trial 39 finished with value: 0.38421133911073435 and parameters: {'mnb_alpha': 0.15000000000000002, 'mnb_fit_prior': True}. Best is trial 6 with value: 0.384844.[0m
[32m[I 2022-10-20 14:46:06,700][0m Trial 40 finished with value: 0.38421133911073435 and parameters: {'mnb_alpha': 0.1, 'mnb_fit_prior': True}. Best is trial 6 with value: 0.384844.[0m
[32m[I 2022-10-20 14:46:07,505][0m Trial 43 finished with value: 0.38423437530304067 and parameters: {'mnb_alpha': 0.05, 'mnb_fit_prior': False}. Best is trial 6 with value: 0.384844.[0m
[32m[I 2022-10-20 14:46:07,599][0m Trial 44 finished with value: 0.3841766551360142 and parameters: {'mnb_alpha': 0.8, 'mnb_fit_prior': False}. Best is trial 6 with value: 0.384844.[0m
[32m[I 2022-10-20 14:46:07,677][0m Trial 42 finished with value: 0.38423437530304067 and parameters: {'mnb_alpha': 0.05, 'mnb_fit_prior': False}. Best is trial 6 with value: 0.384844.[0m
[32m[I 2022-10-20 14:46:07,755][0m Trial 47 finished with value: 0.38423437530304067 and parameters: {'mnb_alpha': 0.05, 'mnb_fit_prior': False}. Best is trial 6 with value: 0.384844.[0m
[32m[I 2022-10-20 14:46:07,772][0m Trial 45 finished with value: 0.3841766551360142 and parameters: {'mnb_alpha': 0.75, 'mnb_fit_prior': False}. Best is trial 6 with value: 0.384844.[0m
[32m[I 2022-10-20 14:46:07,899][0m Trial 46 finished with value: 0.3841766551360142 and parameters: {'mnb_alpha': 0.75, 'mnb_fit_prior': False}. Best is trial 6 with value: 0.384844.[0m
[32m[I 2022-10-20 14:46:07,978][0m Trial 41 finished with value: 0.38423437530304067 and parameters: {'mnb_alpha': 0.05, 'mnb_fit_prior': False}. Best is trial 6 with value: 0.384844.[0m
[32m[I 2022-10-20 14:46:08,118][0m Trial 48 finished with value: 0.38423437530304067 and parameters: {'mnb_alpha': 0.05, 'mnb_fit_prior': True}. Best is trial 6 with value: 0.384844.[0m
[32m[I 2022-10-20 14:46:10,345][0m Trial 49 finished with value: 0.38484354706828566 and parameters: {'mnb_alpha': 0.0, 'mnb_fit_prior': False}. Best is trial 49 with value: 0.384844.[0m
[32m[I 2022-10-20 14:46:10,801][0m Trial 54 finished with value: 0.38484354706828566 and parameters: {'mnb_alpha': 0.0, 'mnb_fit_prior': False}. Best is trial 54 with value: 0.384844.[0m
[32m[I 2022-10-20 14:46:10,817][0m Trial 52 finished with value: 0.38484354706828566 and parameters: {'mnb_alpha': 0.0, 'mnb_fit_prior': False}. Best is trial 54 with value: 0.384844.[0m
[32m[I 2022-10-20 14:46:10,974][0m Trial 53 finished with value: 0.38484354706828566 and parameters: {'mnb_alpha': 0.0, 'mnb_fit_prior': False}. Best is trial 55 with value: 0.384844.[0m
[32m[I 2022-10-20 14:46:10,974][0m Trial 50 finished with value: 0.38484354706828566 and parameters: {'mnb_alpha': 0.0, 'mnb_fit_prior': False}. Best is trial 55 with value: 0.384844.[0m
[32m[I 2022-10-20 14:46:10,990][0m Trial 51 finished with value: 0.38484354706828566 and parameters: {'mnb_alpha': 0.0, 'mnb_fit_prior': False}. Best is trial 55 with value: 0.384844.[0m
[32m[I 2022-10-20 14:46:10,990][0m Trial 55 finished with value: 0.38484354706828566 and parameters: {'mnb_alpha': 0.0, 'mnb_fit_prior': False}. Best is trial 55 with value: 0.384844.[0m
[32m[I 2022-10-20 14:46:11,272][0m Trial 56 finished with value: 0.38484354706828566 and parameters: {'mnb_alpha': 0.0, 'mnb_fit_prior': False}. Best is trial 56 with value: 0.384844.[0m
[32m[I 2022-10-20 14:46:13,117][0m Trial 57 finished with value: 0.38421133911073435 and parameters: {'mnb_alpha': 0.1, 'mnb_fit_prior': False}. Best is trial 6 with value: 0.384844.[0m
