[32m[I 2022-10-20 03:56:44,936][0m Trial 87 finished with value: 0.9916259721696242 and parameters: {'etsc_n_estimators': 160, 'etsc_criterion': 'entropy', 'etsc_min_samples_split': 2, 'etsc_min_samples_leaf': 22, 'etsc_max_features': 28, 'etsc_bootstrap': False}. Best is trial 79 with value: 0.991694.[0m
[32m[I 2022-10-20 03:56:48,727][0m Trial 88 finished with value: 0.991588237450408 and parameters: {'etsc_n_estimators': 160, 'etsc_criterion': 'entropy', 'etsc_min_samples_split': 12, 'etsc_min_samples_leaf': 22, 'etsc_max_features': 27, 'etsc_bootstrap': False}. Best is trial 79 with value: 0.991694.[0m
[32m[I 2022-10-20 03:56:58,923][0m Trial 95 finished with value: 0.9915659825651245 and parameters: {'etsc_n_estimators': 50, 'etsc_criterion': 'entropy', 'etsc_min_samples_split': 3, 'etsc_min_samples_leaf': 30, 'etsc_max_features': 25, 'etsc_bootstrap': False}. Best is trial 79 with value: 0.991694.[0m
[32m[I 2022-10-20 03:57:17,582][0m Trial 96 finished with value: 0.9915064065806604 and parameters: {'etsc_n_estimators': 70, 'etsc_criterion': 'entropy', 'etsc_min_samples_split': 2, 'etsc_min_samples_leaf': 26, 'etsc_max_features': 25, 'etsc_bootstrap': False}. Best is trial 79 with value: 0.991694.[0m
[32m[I 2022-10-20 03:57:19,318][0m Trial 97 finished with value: 0.9915586015954884 and parameters: {'etsc_n_estimators': 70, 'etsc_criterion': 'entropy', 'etsc_min_samples_split': 3, 'etsc_min_samples_leaf': 31, 'etsc_max_features': 25, 'etsc_bootstrap': False}. Best is trial 79 with value: 0.991694.[0m
[32m[I 2022-10-20 03:57:19,866][0m Trial 99 finished with value: 0.9915579600683464 and parameters: {'etsc_n_estimators': 60, 'etsc_criterion': 'entropy', 'etsc_min_samples_split': 4, 'etsc_min_samples_leaf': 31, 'etsc_max_features': 25, 'etsc_bootstrap': False}. Best is trial 79 with value: 0.991694.[0m
[32m[I 2022-10-20 03:57:20,116][0m Trial 98 finished with value: 0.9915572754333549 and parameters: {'etsc_n_estimators': 60, 'etsc_criterion': 'entropy', 'etsc_min_samples_split': 2, 'etsc_min_samples_leaf': 18, 'etsc_max_features': 30, 'etsc_bootstrap': False}. Best is trial 79 with value: 0.991694.[0m
[32m[I 2022-10-20 03:57:28,118][0m Trial 92 finished with value: 0.9916411875953095 and parameters: {'etsc_n_estimators': 170, 'etsc_criterion': 'entropy', 'etsc_min_samples_split': 31, 'etsc_min_samples_leaf': 22, 'etsc_max_features': 28, 'etsc_bootstrap': False}. Best is trial 79 with value: 0.991694.[0m
[32m[I 2022-10-20 03:57:31,453][0m Trial 94 finished with value: 0.9915640393093259 and parameters: {'etsc_n_estimators': 170, 'etsc_criterion': 'entropy', 'etsc_min_samples_split': 31, 'etsc_min_samples_leaf': 30, 'etsc_max_features': 29, 'etsc_bootstrap': False}. Best is trial 79 with value: 0.991694.[0m
[32m[I 2022-10-20 03:57:31,719][0m Trial 93 finished with value: 0.9914897637896005 and parameters: {'etsc_n_estimators': 170, 'etsc_criterion': 'entropy', 'etsc_min_samples_split': 31, 'etsc_min_samples_leaf': 22, 'etsc_max_features': 29, 'etsc_bootstrap': False}. Best is trial 79 with value: 0.991694.[0m
[32m[I 2022-10-20 03:57:31,782][0m Study finished.[0m
[32m[I 2022-10-20 03:57:31,860][0m --------------------------------------------------------------------------------[0m
[32m[I 2022-10-20 03:57:31,860][0m --------------------               GaussianNB               --------------------[0m
[32m[I 2022-10-20 03:57:31,860][0m --------------------------------------------------------------------------------[0m
[32m[I 2022-10-20 03:57:31,891][0m A new study created in RDB with name: GaussianNB_b4f53b70[0m
[32m[I 2022-10-20 03:57:31,891][0m Study started.[0m
[32m[I 2022-10-20 03:57:34,539][0m Trial 7 finished with value: 0.2844441188051378 and parameters: {'gnb_var_smoothing': 42.9599754404068}. Best is trial 6 with value: 0.391126.[0m
[32m[I 2022-10-20 03:57:34,633][0m Trial 2 finished with value: 0.8466100590509933 and parameters: {'gnb_var_smoothing': 1.9204110123931585e-11}. Best is trial 2 with value: 0.84661.[0m
[32m[I 2022-10-20 03:57:34,711][0m Trial 1 finished with value: 0.780788031958432 and parameters: {'gnb_var_smoothing': 2.7271418597482328e-08}. Best is trial 2 with value: 0.84661.[0m
[32m[I 2022-10-20 03:57:34,805][0m Trial 3 finished with value: 0.39389382868117 and parameters: {'gnb_var_smoothing': 0.00032504150160148727}. Best is trial 0 with value: 0.853559.[0m
[32m[I 2022-10-20 03:57:34,805][0m Trial 6 finished with value: 0.39112634082550823 and parameters: {'gnb_var_smoothing': 0.016682357826079183}. Best is trial 2 with value: 0.853559.[0m
[32m[I 2022-10-20 03:57:34,805][0m Trial 0 finished with value: 0.8535585632676487 and parameters: {'gnb_var_smoothing': 5.471340066703854e-10}. Best is trial 0 with value: 0.853559.[0m
[32m[I 2022-10-20 03:57:34,805][0m Trial 4 finished with value: 0.6114518162943887 and parameters: {'gnb_var_smoothing': 2.3861159165034194e-07}. Best is trial 2 with value: 0.853559.[0m
[32m[I 2022-10-20 03:57:34,805][0m Trial 5 finished with value: 0.3690940795639041 and parameters: {'gnb_var_smoothing': 0.05795059588036172}. Best is trial 2 with value: 0.853559.[0m
[32m[I 2022-10-20 03:57:37,293][0m Trial 8 finished with value: 0.38304395346749875 and parameters: {'gnb_var_smoothing': 0.029582935426076082}. Best is trial 0 with value: 0.853559.[0m
[32m[I 2022-10-20 03:57:37,590][0m Trial 9 finished with value: 0.3949723748869257 and parameters: {'gnb_var_smoothing': 0.0031179483942116427}. Best is trial 0 with value: 0.853559.[0m
[32m[I 2022-10-20 03:57:37,857][0m Trial 11 finished with value: 0.2844441188051378 and parameters: {'gnb_var_smoothing': 211.21545195658004}. Best is trial 0 with value: 0.853559.[0m
[32m[I 2022-10-20 03:57:37,935][0m Trial 10 finished with value: 0.852014498933173 and parameters: {'gnb_var_smoothing': 4.454687057664095e-10}. Best is trial 0 with value: 0.853559.[0m
[32m[I 2022-10-20 03:57:37,951][0m Trial 13 finished with value: 0.2844441188051378 and parameters: {'gnb_var_smoothing': 31.50271061100874}. Best is trial 0 with value: 0.853559.[0m
[32m[I 2022-10-20 03:57:37,951][0m Trial 14 finished with value: 0.7933058827444766 and parameters: {'gnb_var_smoothing': 2.3548273257780082e-09}. Best is trial 0 with value: 0.853559.[0m
[32m[I 2022-10-20 03:57:38,170][0m Trial 15 finished with value: 0.8466648170068484 and parameters: {'gnb_var_smoothing': 2.7107486897404986e-12}. Best is trial 0 with value: 0.853559.[0m
[32m[I 2022-10-20 03:57:38,170][0m Trial 12 finished with value: 0.8466100590509933 and parameters: {'gnb_var_smoothing': 1.812258630987612e-11}. Best is trial 0 with value: 0.853559.[0m
[32m[I 2022-10-20 03:57:39,609][0m Trial 16 finished with value: 0.8475952616634713 and parameters: {'gnb_var_smoothing': 2.352902662102472e-10}. Best is trial 0 with value: 0.853559.[0m
[32m[I 2022-10-20 03:57:40,360][0m Trial 17 finished with value: 0.8466648170068484 and parameters: {'gnb_var_smoothing': 1.112121247286176e-12}. Best is trial 0 with value: 0.853559.[0m
[32m[I 2022-10-20 03:57:40,766][0m Trial 18 finished with value: 0.4889047177533818 and parameters: {'gnb_var_smoothing': 5.189468115995748e-06}. Best is trial 0 with value: 0.853559.[0m
[32m[I 2022-10-20 03:57:40,986][0m Trial 21 finished with value: 0.5114154145331598 and parameters: {'gnb_var_smoothing': 1.9212628335335633e-06}. Best is trial 0 with value: 0.853559.[0m
[32m[I 2022-10-20 03:57:41,220][0m Trial 22 finished with value: 0.49300836442814644 and parameters: {'gnb_var_smoothing': 4.835671636083838e-06}. Best is trial 0 with value: 0.853559.[0m
[32m[I 2022-10-20 03:57:41,220][0m Trial 20 finished with value: 0.5013665975806025 and parameters: {'gnb_var_smoothing': 2.595662771411245e-06}. Best is trial 0 with value: 0.853559.[0m
[32m[I 2022-10-20 03:57:41,377][0m Trial 23 finished with value: 0.4994078051714 and parameters: {'gnb_var_smoothing': 2.8998628375453915e-06}. Best is trial 0 with value: 0.853559.[0m
[32m[I 2022-10-20 03:57:41,456][0m Trial 19 finished with value: 0.5940989932420923 and parameters: {'gnb_var_smoothing': 4.639303055645649e-07}. Best is trial 0 with value: 0.853559.[0m
[32m[I 2022-10-20 03:57:42,161][0m Trial 24 finished with value: 0.548063871291374 and parameters: {'gnb_var_smoothing': 1.1468404427108575e-06}. Best is trial 0 with value: 0.853559.[0m
[32m[I 2022-10-20 03:57:42,804][0m Trial 25 finished with value: 0.4965906423787377 and parameters: {'gnb_var_smoothing': 4.20583511176177e-06}. Best is trial 0 with value: 0.853559.[0m
[32m[I 2022-10-20 03:57:43,509][0m Trial 26 finished with value: 0.48728516009185846 and parameters: {'gnb_var_smoothing': 5.376628412487605e-06}. Best is trial 0 with value: 0.853559.[0m
[32m[I 2022-10-20 03:57:43,884][0m Trial 27 finished with value: 0.8610716763712453 and parameters: {'gnb_var_smoothing': 1.2348489392009863e-09}. Best is trial 27 with value: 0.861072.[0m
[32m[I 2022-10-20 03:57:44,229][0m Trial 28 finished with value: 0.861140180033394 and parameters: {'gnb_var_smoothing': 8.339625374422043e-10}. Best is trial 28 with value: 0.86114.[0m
[32m[I 2022-10-20 03:57:44,355][0m Trial 29 finished with value: 0.8591715846212937 and parameters: {'gnb_var_smoothing': 1.484377557212763e-09}. Best is trial 28 with value: 0.86114.[0m
[32m[I 2022-10-20 03:57:44,528][0m Trial 31 finished with value: 0.8611249571168337 and parameters: {'gnb_var_smoothing': 9.331442912954858e-10}. Best is trial 28 with value: 0.86114.[0m
[32m[I 2022-10-20 03:57:44,606][0m Trial 30 finished with value: 0.8578300486297067 and parameters: {'gnb_var_smoothing': 7.098718764448507e-10}. Best is trial 28 with value: 0.86114.[0m
[32m[I 2022-10-20 03:57:45,093][0m Trial 32 finished with value: 0.85688536423656 and parameters: {'gnb_var_smoothing': 6.880184385886752e-10}. Best is trial 28 with value: 0.86114.[0m
[32m[I 2022-10-20 03:57:45,485][0m Trial 33 finished with value: 0.8086190364652449 and parameters: {'gnb_var_smoothing': 2.00169785792197e-09}. Best is trial 28 with value: 0.86114.[0m
[32m[I 2022-10-20 03:57:46,126][0m Trial 34 finished with value: 0.8559826665044751 and parameters: {'gnb_var_smoothing': 6.595667694345962e-10}. Best is trial 28 with value: 0.86114.[0m
[32m[I 2022-10-20 03:57:46,657][0m Trial 35 finished with value: 0.7704770112646269 and parameters: {'gnb_var_smoothing': 2.859036339670047e-09}. Best is trial 28 with value: 0.86114.[0m
[32m[I 2022-10-20 03:57:47,080][0m Trial 37 finished with value: 0.7970442990162517 and parameters: {'gnb_var_smoothing': 1.7326936008708448e-08}. Best is trial 28 with value: 0.86114.[0m
[32m[I 2022-10-20 03:57:47,080][0m Trial 36 finished with value: 0.8017660267025706 and parameters: {'gnb_var_smoothing': 1.1926087995915636e-08}. Best is trial 28 with value: 0.86114.[0m
[32m[I 2022-10-20 03:57:47,487][0m Trial 39 finished with value: 0.7960553492541913 and parameters: {'gnb_var_smoothing': 7.33846702302415e-09}. Best is trial 28 with value: 0.86114.[0m
[32m[I 2022-10-20 03:57:47,487][0m Trial 38 finished with value: 0.7985626744354335 and parameters: {'gnb_var_smoothing': 1.6108584186897984e-08}. Best is trial 28 with value: 0.86114.[0m
[32m[I 2022-10-20 03:57:47,925][0m Trial 40 finished with value: 0.7944062204098199 and parameters: {'gnb_var_smoothing': 1.9828127304627523e-08}. Best is trial 28 with value: 0.86114.[0m
[32m[I 2022-10-20 03:57:48,269][0m Trial 41 finished with value: 0.7864183207625648 and parameters: {'gnb_var_smoothing': 2.4302146011132685e-08}. Best is trial 28 with value: 0.86114.[0m
[32m[I 2022-10-20 03:57:48,725][0m Trial 42 finished with value: 0.7951778930579058 and parameters: {'gnb_var_smoothing': 1.879692522137652e-08}. Best is trial 28 with value: 0.86114.[0m
[32m[I 2022-10-20 03:57:49,290][0m Trial 43 finished with value: 0.7312963789044346 and parameters: {'gnb_var_smoothing': 5.721246305654254e-08}. Best is trial 28 with value: 0.86114.[0m
[32m[I 2022-10-20 03:57:49,915][0m Trial 44 finished with value: 0.8466471422011803 and parameters: {'gnb_var_smoothing': 3.538007603594946e-11}. Best is trial 28 with value: 0.86114.[0m
[32m[I 2022-10-20 03:57:49,994][0m Trial 45 finished with value: 0.8466586300948068 and parameters: {'gnb_var_smoothing': 5.7973261488715176e-11}. Best is trial 28 with value: 0.86114.[0m
[32m[I 2022-10-20 03:57:50,447][0m Trial 46 finished with value: 0.8466418440571831 and parameters: {'gnb_var_smoothing': 3.279581018726788e-11}. Best is trial 28 with value: 0.86114.[0m
[32m[I 2022-10-20 03:57:50,557][0m Trial 47 finished with value: 0.8466533319612347 and parameters: {'gnb_var_smoothing': 5.181185940542689e-11}. Best is trial 28 with value: 0.86114.[0m
[32m[I 2022-10-20 03:57:50,872][0m Trial 48 finished with value: 0.8466533319612347 and parameters: {'gnb_var_smoothing': 4.898526320398752e-11}. Best is trial 28 with value: 0.86114.[0m
[32m[I 2022-10-20 03:57:51,154][0m Trial 49 finished with value: 0.8466586300948068 and parameters: {'gnb_var_smoothing': 5.356094356979188e-11}. Best is trial 28 with value: 0.86114.[0m
[32m[I 2022-10-20 03:57:51,561][0m Trial 50 finished with value: 0.8466683366167941 and parameters: {'gnb_var_smoothing': 3.935227428769244e-11}. Best is trial 28 with value: 0.86114.[0m
[32m[I 2022-10-20 03:57:51,999][0m Trial 51 finished with value: 0.8466533319612347 and parameters: {'gnb_var_smoothing': 5.3016853372561095e-11}. Best is trial 28 with value: 0.86114.[0m
[32m[I 2022-10-20 03:57:52,735][0m Trial 53 finished with value: 0.39639960295492555 and parameters: {'gnb_var_smoothing': 9.605956441086391e-05}. Best is trial 28 with value: 0.86114.[0m
[32m[I 2022-10-20 03:57:52,735][0m Trial 52 finished with value: 0.6585616252969877 and parameters: {'gnb_var_smoothing': 1.547154001627622e-07}. Best is trial 28 with value: 0.86114.[0m
[32m[I 2022-10-20 03:57:53,345][0m Trial 54 finished with value: 0.8466391059328663 and parameters: {'gnb_var_smoothing': 4.806169044626513e-12}. Best is trial 28 with value: 0.86114.[0m
[32m[I 2022-10-20 03:57:53,361][0m Trial 55 finished with value: 0.39897189770963 and parameters: {'gnb_var_smoothing': 8.293817933033477e-05}. Best is trial 28 with value: 0.86114.[0m
[32m[I 2022-10-20 03:57:53,737][0m Trial 56 finished with value: 0.41597898278525514 and parameters: {'gnb_var_smoothing': 5.384202697031099e-05}. Best is trial 28 with value: 0.86114.[0m
[32m[I 2022-10-20 03:57:53,988][0m Trial 57 finished with value: 0.39719094637041874 and parameters: {'gnb_var_smoothing': 9.110630857357845e-05}. Best is trial 28 with value: 0.86114.[0m
[32m[I 2022-10-20 03:57:54,426][0m Trial 58 finished with value: 0.6761350031917366 and parameters: {'gnb_var_smoothing': 9.662465524396599e-08}. Best is trial 28 with value: 0.86114.[0m
[32m[I 2022-10-20 03:57:54,786][0m Trial 59 finished with value: 0.8466391059328663 and parameters: {'gnb_var_smoothing': 4.36181735569307e-12}. Best is trial 28 with value: 0.86114.[0m
[32m[I 2022-10-20 03:57:55,459][0m Trial 60 finished with value: 0.8466391059328663 and parameters: {'gnb_var_smoothing': 4.759558573704092e-12}. Best is trial 28 with value: 0.86114.[0m
[32m[I 2022-10-20 03:57:55,459][0m Trial 61 finished with value: 0.8537831124753786 and parameters: {'gnb_var_smoothing': 5.606844420369548e-10}. Best is trial 28 with value: 0.86114.[0m
[32m[I 2022-10-20 03:57:56,226][0m Trial 62 finished with value: 0.8483288780562402 and parameters: {'gnb_var_smoothing': 2.7307302220868326e-10}. Best is trial 28 with value: 0.86114.[0m
[32m[I 2022-10-20 03:57:56,304][0m Trial 63 finished with value: 0.8477707347270639 and parameters: {'gnb_var_smoothing': 2.4617315996678017e-10}. Best is trial 28 with value: 0.86114.[0m
[32m[I 2022-10-20 03:57:56,524][0m Trial 64 finished with value: 0.8481716183174183 and parameters: {'gnb_var_smoothing': 2.6451509725728873e-10}. Best is trial 28 with value: 0.86114.[0m
[32m[I 2022-10-20 03:57:56,869][0m Trial 65 finished with value: 0.8491730833508632 and parameters: {'gnb_var_smoothing': 3.11902575706992e-10}. Best is trial 28 with value: 0.86114.[0m
[32m[I 2022-10-20 03:57:57,307][0m Trial 66 finished with value: 0.8476484771301112 and parameters: {'gnb_var_smoothing': 2.379054688447653e-10}. Best is trial 28 with value: 0.86114.[0m
[32m[I 2022-10-20 03:57:57,558][0m Trial 67 finished with value: 0.8485082703074774 and parameters: {'gnb_var_smoothing': 2.809677010453417e-10}. Best is trial 28 with value: 0.86114.[0m
[32m[I 2022-10-20 03:57:58,311][0m Trial 69 finished with value: 0.8493742449525248 and parameters: {'gnb_var_smoothing': 3.181016897711826e-10}. Best is trial 28 with value: 0.86114.[0m
[32m[I 2022-10-20 03:57:58,311][0m Trial 68 finished with value: 0.8486265695392576 and parameters: {'gnb_var_smoothing': 2.8769818831206083e-10}. Best is trial 28 with value: 0.86114.[0m
[32m[I 2022-10-20 03:57:59,047][0m Trial 71 finished with value: 0.8610945110915752 and parameters: {'gnb_var_smoothing': 1.0873680766679216e-09}. Best is trial 28 with value: 0.86114.[0m
[32m[I 2022-10-20 03:57:59,250][0m Trial 70 finished with value: 0.8610945110915752 and parameters: {'gnb_var_smoothing': 1.0999978664068748e-09}. Best is trial 28 with value: 0.86114.[0m
[32m[I 2022-10-20 03:57:59,391][0m Trial 72 finished with value: 0.8611249571168337 and parameters: {'gnb_var_smoothing': 9.095644807292691e-10}. Best is trial 28 with value: 0.86114.[0m
[32m[I 2022-10-20 03:57:59,720][0m Trial 73 finished with value: 0.8184070595940653 and parameters: {'gnb_var_smoothing': 1.6753141695713691e-09}. Best is trial 28 with value: 0.86114.[0m
[32m[I 2022-10-20 03:58:00,191][0m Trial 74 finished with value: 0.8610792879659802 and parameters: {'gnb_var_smoothing': 1.1640024063806866e-09}. Best is trial 28 with value: 0.86114.[0m
[32m[I 2022-10-20 03:58:00,458][0m Trial 75 finished with value: 0.7679696957262829 and parameters: {'gnb_var_smoothing': 4.663048538531903e-09}. Best is trial 28 with value: 0.86114.[0m
[32m[I 2022-10-20 03:58:01,054][0m Trial 77 finished with value: 0.8610716763712453 and parameters: {'gnb_var_smoothing': 1.4261775890703097e-09}. Best is trial 28 with value: 0.86114.[0m
[32m[I 2022-10-20 03:58:01,258][0m Trial 76 finished with value: 0.8610716763712453 and parameters: {'gnb_var_smoothing': 1.3489368797320777e-09}. Best is trial 28 with value: 0.86114.[0m
[32m[I 2022-10-20 03:58:01,822][0m Trial 78 finished with value: 0.8084781504120181 and parameters: {'gnb_var_smoothing': 2.0184853814395034e-09}. Best is trial 28 with value: 0.86114.[0m
[32m[I 2022-10-20 03:58:02,091][0m Trial 79 finished with value: 0.7647108523649155 and parameters: {'gnb_var_smoothing': 3.756115382885638e-09}. Best is trial 28 with value: 0.86114.[0m
[32m[I 2022-10-20 03:58:02,311][0m Trial 80 finished with value: 0.7785003343501611 and parameters: {'gnb_var_smoothing': 2.6735563823882586e-09}. Best is trial 28 with value: 0.86114.[0m
[32m[I 2022-10-20 03:58:02,641][0m Trial 81 finished with value: 0.7688307221203001 and parameters: {'gnb_var_smoothing': 4.7614086962739145e-09}. Best is trial 28 with value: 0.86114.[0m
[32m[I 2022-10-20 03:58:03,000][0m Trial 82 finished with value: 0.7812344612348029 and parameters: {'gnb_var_smoothing': 2.5632489924557053e-09}. Best is trial 28 with value: 0.86114.[0m
[32m[I 2022-10-20 03:58:03,298][0m Trial 83 finished with value: 0.8085908623392755 and parameters: {'gnb_var_smoothing': 2.0088378540532462e-09}. Best is trial 28 with value: 0.86114.[0m
[32m[I 2022-10-20 03:58:03,676][0m Trial 84 finished with value: 0.3940123864832037 and parameters: {'gnb_var_smoothing': 0.1480206940851671}. Best is trial 28 with value: 0.86114.[0m
[32m[I 2022-10-20 03:58:04,039][0m Trial 85 finished with value: 0.5890001811009041 and parameters: {'gnb_var_smoothing': 5.049191247853367e-07}. Best is trial 28 with value: 0.86114.[0m
[32m[I 2022-10-20 03:58:04,540][0m Trial 86 finished with value: 0.40479977582556387 and parameters: {'gnb_var_smoothing': 1.8792839407017228}. Best is trial 28 with value: 0.86114.[0m
[32m[I 2022-10-20 03:58:04,932][0m Trial 87 finished with value: 0.7461894543956384 and parameters: {'gnb_var_smoothing': 4.5374592889725396e-08}. Best is trial 28 with value: 0.86114.[0m
[32m[I 2022-10-20 03:58:05,089][0m Trial 88 finished with value: 0.8465908009254123 and parameters: {'gnb_var_smoothing': 1.240972655976041e-11}. Best is trial 28 with value: 0.86114.[0m
[32m[I 2022-10-20 03:58:05,511][0m Trial 89 finished with value: 0.7478808605549898 and parameters: {'gnb_var_smoothing': 4.3548865150623013e-08}. Best is trial 28 with value: 0.86114.[0m
[32m[I 2022-10-20 03:58:05,792][0m Trial 90 finished with value: 0.4200263026727087 and parameters: {'gnb_var_smoothing': 1.4231430926146125}. Best is trial 28 with value: 0.86114.[0m
[32m[I 2022-10-20 03:58:06,091][0m Trial 91 finished with value: 0.42077026075806007 and parameters: {'gnb_var_smoothing': 0.6707879883769646}. Best is trial 28 with value: 0.86114.[0m
[32m[I 2022-10-20 03:58:06,498][0m Trial 92 finished with value: 0.5801245209773773 and parameters: {'gnb_var_smoothing': 5.952589865278647e-07}. Best is trial 28 with value: 0.86114.[0m
[32m[I 2022-10-20 03:58:06,857][0m Trial 93 finished with value: 0.8466763066226962 and parameters: {'gnb_var_smoothing': 1.2192341694026337e-10}. Best is trial 28 with value: 0.86114.[0m
[32m[I 2022-10-20 03:58:07,248][0m Trial 94 finished with value: 0.7432787861045494 and parameters: {'gnb_var_smoothing': 4.832092265362489e-08}. Best is trial 28 with value: 0.86114.[0m
[32m[I 2022-10-20 03:58:07,501][0m Trial 95 finished with value: 0.3949314742346582 and parameters: {'gnb_var_smoothing': 0.0036243699423387306}. Best is trial 28 with value: 0.86114.[0m
