[32m[I 2022-10-20 15:10:53,800][0m Trial 71 finished with value: 0.9918401207063572 and parameters: {'rfc_criterion': 'gini', 'rfc_n_estimators': 60, 'rfc_min_samples_split': 36, 'rfc_min_samples_leaf': 16, 'rfc_max_features': 34, 'rfc_bootstrap': False}. Best is trial 74 with value: 0.991999.[0m
[32m[I 2022-10-20 15:10:54,501][0m sklearn.ensemble.RandomForestClassifier.fit: running accelerated version on CPU[0m
[32m[I 2022-10-20 15:10:55,465][0m sklearn.ensemble.RandomForestClassifier.predict: running accelerated version on CPU[0m
[32m[I 2022-10-20 15:10:55,997][0m sklearn.ensemble.RandomForestClassifier.predict: running accelerated version on CPU[0m
[32m[I 2022-10-20 15:10:57,185][0m Trial 76 finished with value: 0.9918837630825953 and parameters: {'rfc_criterion': 'gini', 'rfc_n_estimators': 40, 'rfc_min_samples_split': 39, 'rfc_min_samples_leaf': 15, 'rfc_max_features': 24, 'rfc_bootstrap': False}. Best is trial 74 with value: 0.991999.[0m
[32m[I 2022-10-20 15:10:57,545][0m sklearn.ensemble.RandomForestClassifier.predict: running accelerated version on CPU[0m
[32m[I 2022-10-20 15:10:57,843][0m sklearn.ensemble.RandomForestClassifier.fit: running accelerated version on CPU[0m
[32m[I 2022-10-20 15:10:58,179][0m Trial 77 finished with value: 0.9919450319542238 and parameters: {'rfc_criterion': 'gini', 'rfc_n_estimators': 40, 'rfc_min_samples_split': 39, 'rfc_min_samples_leaf': 22, 'rfc_max_features': 21, 'rfc_bootstrap': False}. Best is trial 74 with value: 0.991999.[0m
[32m[I 2022-10-20 15:10:58,872][0m sklearn.ensemble.RandomForestClassifier.fit: running accelerated version on CPU[0m
[32m[I 2022-10-20 15:10:59,733][0m Trial 75 finished with value: 0.9918684693620078 and parameters: {'rfc_criterion': 'gini', 'rfc_n_estimators': 50, 'rfc_min_samples_split': 37, 'rfc_min_samples_leaf': 16, 'rfc_max_features': 26, 'rfc_bootstrap': False}. Best is trial 74 with value: 0.991999.[0m
[32m[I 2022-10-20 15:11:00,479][0m sklearn.ensemble.RandomForestClassifier.fit: running accelerated version on CPU[0m
[32m[I 2022-10-20 15:11:05,391][0m sklearn.ensemble.RandomForestClassifier.predict: running accelerated version on CPU[0m
[32m[I 2022-10-20 15:11:06,611][0m Trial 82 finished with value: 0.9919293818225132 and parameters: {'rfc_criterion': 'gini', 'rfc_n_estimators': 10, 'rfc_min_samples_split': 35, 'rfc_min_samples_leaf': 23, 'rfc_max_features': 20, 'rfc_bootstrap': False}. Best is trial 74 with value: 0.991999.[0m
[32m[I 2022-10-20 15:11:07,277][0m sklearn.ensemble.RandomForestClassifier.fit: running accelerated version on CPU[0m
[32m[I 2022-10-20 15:11:07,521][0m sklearn.ensemble.RandomForestClassifier.predict: running accelerated version on CPU[0m
[32m[I 2022-10-20 15:11:08,150][0m sklearn.ensemble.RandomForestClassifier.predict: running accelerated version on CPU[0m
[32m[I 2022-10-20 15:11:08,853][0m sklearn.ensemble.RandomForestClassifier.predict: running accelerated version on CPU[0m
[32m[I 2022-10-20 15:11:09,148][0m sklearn.ensemble.RandomForestClassifier.predict: running accelerated version on CPU[0m
[32m[I 2022-10-20 15:11:09,169][0m Trial 80 finished with value: 0.9919141127999876 and parameters: {'rfc_criterion': 'gini', 'rfc_n_estimators': 30, 'rfc_min_samples_split': 35, 'rfc_min_samples_leaf': 23, 'rfc_max_features': 21, 'rfc_bootstrap': False}. Best is trial 74 with value: 0.991999.[0m
[32m[I 2022-10-20 15:11:09,865][0m sklearn.ensemble.RandomForestClassifier.fit: running accelerated version on CPU[0m
[32m[I 2022-10-20 15:11:10,025][0m Trial 79 finished with value: 0.9918456417363317 and parameters: {'rfc_criterion': 'gini', 'rfc_n_estimators': 30, 'rfc_min_samples_split': 35, 'rfc_min_samples_leaf': 18, 'rfc_max_features': 25, 'rfc_bootstrap': False}. Best is trial 74 with value: 0.991999.[0m
[32m[I 2022-10-20 15:11:10,443][0m sklearn.ensemble.RandomForestClassifier.predict: running accelerated version on CPU[0m
[32m[I 2022-10-20 15:11:10,743][0m sklearn.ensemble.RandomForestClassifier.fit: running accelerated version on CPU[0m
[32m[I 2022-10-20 15:11:11,079][0m Trial 78 finished with value: 0.9919450319542238 and parameters: {'rfc_criterion': 'gini', 'rfc_n_estimators': 40, 'rfc_min_samples_split': 39, 'rfc_min_samples_leaf': 22, 'rfc_max_features': 21, 'rfc_bootstrap': False}. Best is trial 74 with value: 0.991999.[0m
[32m[I 2022-10-20 15:11:11,363][0m sklearn.ensemble.RandomForestClassifier.predict: running accelerated version on CPU[0m
[32m[I 2022-10-20 15:11:11,378][0m sklearn.ensemble.RandomForestClassifier.predict: running accelerated version on CPU[0m
[32m[I 2022-10-20 15:11:11,754][0m sklearn.ensemble.RandomForestClassifier.fit: running accelerated version on CPU[0m
[32m[I 2022-10-20 15:11:11,886][0m Trial 83 finished with value: 0.9917630879756079 and parameters: {'rfc_criterion': 'gini', 'rfc_n_estimators': 20, 'rfc_min_samples_split': 44, 'rfc_min_samples_leaf': 19, 'rfc_max_features': 19, 'rfc_bootstrap': False}. Best is trial 74 with value: 0.991999.[0m
[32m[I 2022-10-20 15:11:12,461][0m sklearn.ensemble.RandomForestClassifier.fit: running accelerated version on CPU[0m
[32m[I 2022-10-20 15:11:12,625][0m sklearn.ensemble.RandomForestClassifier.predict: running accelerated version on CPU[0m
[32m[I 2022-10-20 15:11:12,934][0m Trial 81 finished with value: 0.9918601710450314 and parameters: {'rfc_criterion': 'gini', 'rfc_n_estimators': 40, 'rfc_min_samples_split': 38, 'rfc_min_samples_leaf': 23, 'rfc_max_features': 23, 'rfc_bootstrap': False}. Best is trial 74 with value: 0.991999.[0m
[32m[I 2022-10-20 15:11:13,188][0m sklearn.ensemble.RandomForestClassifier.predict: running accelerated version on CPU[0m
[32m[I 2022-10-20 15:11:13,435][0m Trial 85 finished with value: 0.9917624132104156 and parameters: {'rfc_criterion': 'gini', 'rfc_n_estimators': 10, 'rfc_min_samples_split': 44, 'rfc_min_samples_leaf': 19, 'rfc_max_features': 19, 'rfc_bootstrap': False}. Best is trial 74 with value: 0.991999.[0m
[32m[I 2022-10-20 15:11:13,841][0m Trial 84 finished with value: 0.9917858005524162 and parameters: {'rfc_criterion': 'gini', 'rfc_n_estimators': 20, 'rfc_min_samples_split': 45, 'rfc_min_samples_leaf': 19, 'rfc_max_features': 18, 'rfc_bootstrap': False}. Best is trial 74 with value: 0.991999.[0m
[32m[I 2022-10-20 15:11:14,356][0m sklearn.ensemble.RandomForestClassifier.fit: running accelerated version on CPU[0m
[32m[I 2022-10-20 15:11:14,543][0m sklearn.ensemble.RandomForestClassifier.fit: running accelerated version on CPU[0m
[32m[I 2022-10-20 15:11:14,627][0m sklearn.ensemble.RandomForestClassifier.fit: running accelerated version on CPU[0m
[32m[I 2022-10-20 15:11:15,078][0m Trial 86 finished with value: 0.9918003438780447 and parameters: {'rfc_criterion': 'gini', 'rfc_n_estimators': 10, 'rfc_min_samples_split': 45, 'rfc_min_samples_leaf': 19, 'rfc_max_features': 18, 'rfc_bootstrap': False}. Best is trial 74 with value: 0.991999.[0m
[32m[I 2022-10-20 15:11:15,396][0m sklearn.ensemble.RandomForestClassifier.predict: running accelerated version on CPU[0m
[32m[I 2022-10-20 15:11:15,728][0m Trial 87 finished with value: 0.9918524175341813 and parameters: {'rfc_criterion': 'gini', 'rfc_n_estimators': 10, 'rfc_min_samples_split': 44, 'rfc_min_samples_leaf': 28, 'rfc_max_features': 20, 'rfc_bootstrap': False}. Best is trial 74 with value: 0.991999.[0m
[32m[I 2022-10-20 15:11:16,106][0m sklearn.ensemble.RandomForestClassifier.predict: running accelerated version on CPU[0m
[32m[I 2022-10-20 15:11:16,106][0m sklearn.ensemble.RandomForestClassifier.fit: running accelerated version on CPU[0m
[32m[I 2022-10-20 15:11:16,511][0m sklearn.ensemble.RandomForestClassifier.fit: running accelerated version on CPU[0m
[32m[I 2022-10-20 15:11:17,207][0m Trial 89 finished with value: 0.9918979630752863 and parameters: {'rfc_criterion': 'gini', 'rfc_n_estimators': 10, 'rfc_min_samples_split': 39, 'rfc_min_samples_leaf': 27, 'rfc_max_features': 18, 'rfc_bootstrap': False}. Best is trial 74 with value: 0.991999.[0m
[32m[I 2022-10-20 15:11:17,932][0m sklearn.ensemble.RandomForestClassifier.fit: running accelerated version on CPU[0m
[32m[I 2022-10-20 15:11:18,127][0m Trial 88 finished with value: 0.9918695242455448 and parameters: {'rfc_criterion': 'gini', 'rfc_n_estimators': 20, 'rfc_min_samples_split': 44, 'rfc_min_samples_leaf': 29, 'rfc_max_features': 17, 'rfc_bootstrap': False}. Best is trial 74 with value: 0.991999.[0m
[32m[I 2022-10-20 15:11:18,883][0m sklearn.ensemble.RandomForestClassifier.fit: running accelerated version on CPU[0m
[32m[I 2022-10-20 15:11:26,492][0m sklearn.ensemble.RandomForestClassifier.predict: running accelerated version on CPU[0m
[32m[I 2022-10-20 15:11:28,426][0m Trial 90 finished with value: 0.9918218807706829 and parameters: {'rfc_criterion': 'gini', 'rfc_n_estimators': 40, 'rfc_min_samples_split': 40, 'rfc_min_samples_leaf': 27, 'rfc_max_features': 15, 'rfc_bootstrap': False}. Best is trial 74 with value: 0.991999.[0m
[32m[I 2022-10-20 15:11:29,161][0m sklearn.ensemble.RandomForestClassifier.fit: running accelerated version on CPU[0m
[32m[I 2022-10-20 15:11:30,416][0m sklearn.ensemble.RandomForestClassifier.predict: running accelerated version on CPU[0m
[32m[I 2022-10-20 15:11:32,329][0m Trial 92 finished with value: 0.9919594086669511 and parameters: {'rfc_criterion': 'gini', 'rfc_n_estimators': 40, 'rfc_min_samples_split': 40, 'rfc_min_samples_leaf': 25, 'rfc_max_features': 16, 'rfc_bootstrap': False}. Best is trial 74 with value: 0.991999.[0m
[32m[I 2022-10-20 15:11:33,005][0m sklearn.ensemble.RandomForestClassifier.fit: running accelerated version on CPU[0m
[32m[I 2022-10-20 15:11:33,174][0m sklearn.ensemble.RandomForestClassifier.predict: running accelerated version on CPU[0m
[32m[I 2022-10-20 15:11:35,093][0m Trial 91 finished with value: 0.991876580356595 and parameters: {'rfc_criterion': 'gini', 'rfc_n_estimators': 40, 'rfc_min_samples_split': 39, 'rfc_min_samples_leaf': 29, 'rfc_max_features': 30, 'rfc_bootstrap': False}. Best is trial 74 with value: 0.991999.[0m
[32m[I 2022-10-20 15:11:35,776][0m sklearn.ensemble.RandomForestClassifier.fit: running accelerated version on CPU[0m
[32m[I 2022-10-20 15:11:38,800][0m sklearn.ensemble.RandomForestClassifier.predict: running accelerated version on CPU[0m
[32m[I 2022-10-20 15:11:40,712][0m sklearn.ensemble.RandomForestClassifier.predict: running accelerated version on CPU[0m
[32m[I 2022-10-20 15:11:40,827][0m Trial 95 finished with value: 0.9918230197670501 and parameters: {'rfc_criterion': 'gini', 'rfc_n_estimators': 40, 'rfc_min_samples_split': 39, 'rfc_min_samples_leaf': 26, 'rfc_max_features': 30, 'rfc_bootstrap': False}. Best is trial 74 with value: 0.991999.[0m
[32m[I 2022-10-20 15:11:41,496][0m sklearn.ensemble.RandomForestClassifier.predict: running accelerated version on CPU[0m
[32m[I 2022-10-20 15:11:42,189][0m Trial 94 finished with value: 0.9919375873606476 and parameters: {'rfc_criterion': 'gini', 'rfc_n_estimators': 40, 'rfc_min_samples_split': 40, 'rfc_min_samples_leaf': 21, 'rfc_max_features': 16, 'rfc_bootstrap': False}. Best is trial 74 with value: 0.991999.[0m
[32m[I 2022-10-20 15:11:43,427][0m Trial 96 finished with value: 0.9918927138868562 and parameters: {'rfc_criterion': 'gini', 'rfc_n_estimators': 40, 'rfc_min_samples_split': 40, 'rfc_min_samples_leaf': 21, 'rfc_max_features': 30, 'rfc_bootstrap': False}. Best is trial 74 with value: 0.991999.[0m
[32m[I 2022-10-20 15:11:43,768][0m sklearn.ensemble.RandomForestClassifier.predict: running accelerated version on CPU[0m
[32m[I 2022-10-20 15:11:45,368][0m Trial 93 finished with value: 0.9918379034248276 and parameters: {'rfc_criterion': 'gini', 'rfc_n_estimators': 40, 'rfc_min_samples_split': 39, 'rfc_min_samples_leaf': 27, 'rfc_max_features': 30, 'rfc_bootstrap': False}. Best is trial 74 with value: 0.991999.[0m
[32m[I 2022-10-20 15:11:45,907][0m sklearn.ensemble.RandomForestClassifier.predict: running accelerated version on CPU[0m
[32m[I 2022-10-20 15:11:46,498][0m sklearn.ensemble.RandomForestClassifier.predict: running accelerated version on CPU[0m
[32m[I 2022-10-20 15:11:46,561][0m sklearn.ensemble.RandomForestClassifier.predict: running accelerated version on CPU[0m
[32m[I 2022-10-20 15:11:46,812][0m Trial 99 finished with value: 0.991883637237601 and parameters: {'rfc_criterion': 'gini', 'rfc_n_estimators': 30, 'rfc_min_samples_split': 41, 'rfc_min_samples_leaf': 21, 'rfc_max_features': 22, 'rfc_bootstrap': False}. Best is trial 74 with value: 0.991999.[0m
[32m[I 2022-10-20 15:11:47,142][0m Trial 98 finished with value: 0.9918640749318215 and parameters: {'rfc_criterion': 'gini', 'rfc_n_estimators': 40, 'rfc_min_samples_split': 41, 'rfc_min_samples_leaf': 21, 'rfc_max_features': 12, 'rfc_bootstrap': False}. Best is trial 74 with value: 0.991999.[0m
[32m[I 2022-10-20 15:11:47,252][0m Trial 97 finished with value: 0.9918927138868562 and parameters: {'rfc_criterion': 'gini', 'rfc_n_estimators': 40, 'rfc_min_samples_split': 42, 'rfc_min_samples_leaf': 21, 'rfc_max_features': 30, 'rfc_bootstrap': False}. Best is trial 74 with value: 0.991999.[0m
[32m[I 2022-10-20 15:12:10,442][0m sklearn.ensemble.RandomForestClassifier.predict: fallback to original Scikit-learn[0m
[32m[I 2022-10-20 15:12:10,458][0m sklearn.ensemble.RandomForestClassifier.predict_proba: fallback to original Scikit-learn[0m
[32m[I 2022-10-20 15:12:12,388][0m Trial 49 finished with value: 0.991826113342058 and parameters: {'rfc_criterion': 'entropy', 'rfc_n_estimators': 200, 'rfc_min_samples_split': 2, 'rfc_min_samples_leaf': 4, 'rfc_max_features': 44, 'rfc_bootstrap': False}. Best is trial 74 with value: 0.991999.[0m
[32m[I 2022-10-20 15:12:12,450][0m Study finished.[0m
[32m[I 2022-10-20 15:12:12,529][0m --------------------------------------------------------------------------------[0m
[32m[I 2022-10-20 15:12:12,529][0m --------------------            RidgeClassifier             --------------------[0m
[32m[I 2022-10-20 15:12:12,529][0m --------------------------------------------------------------------------------[0m
[32m[I 2022-10-20 15:12:12,560][0m A new study created in RDB with name: RidgeClassifier_b4f53b70[0m
[32m[I 2022-10-20 15:12:12,575][0m Study started.[0m
[32m[I 2022-10-20 15:12:15,187][0m Trial 3 finished with value: 0.9047439555188416 and parameters: {'rc_C': 0.003953227900512884, 'rc_tol': 0.003589529261221941}. Best is trial 3 with value: 0.904744.[0m
[32m[I 2022-10-20 15:12:15,203][0m Trial 1 finished with value: 0.8545298964693725 and parameters: {'rc_C': 135327.7513382384, 'rc_tol': 0.0018538206996977474}. Best is trial 3 with value: 0.904744.[0m
[32m[I 2022-10-20 15:12:15,332][0m Trial 7 finished with value: 0.9047439555188416 and parameters: {'rc_C': 0.008315040524271965, 'rc_tol': 0.0001357793696855542}. Best is trial 3 with value: 0.904744.[0m
[32m[I 2022-10-20 15:12:15,410][0m Trial 4 finished with value: 0.9047439555188416 and parameters: {'rc_C': 0.2771899314709899, 'rc_tol': 0.0006575951614972302}. Best is trial 3 with value: 0.904744.[0m
[32m[I 2022-10-20 15:12:15,472][0m Trial 5 finished with value: 0.9047439555188416 and parameters: {'rc_C': 0.002203172078557567, 'rc_tol': 0.0020302228581884013}. Best is trial 3 with value: 0.904744.[0m
[32m[I 2022-10-20 15:12:15,582][0m Trial 6 finished with value: 0.9047439555188416 and parameters: {'rc_C': 0.08246410267357512, 'rc_tol': 0.0007648243325551414}. Best is trial 3 with value: 0.904744.[0m
[32m[I 2022-10-20 15:12:15,644][0m Trial 0 finished with value: 0.9043863195767216 and parameters: {'rc_C': 19.572901948835586, 'rc_tol': 0.00017630532984468675}. Best is trial 3 with value: 0.904744.[0m
[32m[I 2022-10-20 15:12:15,707][0m Trial 2 finished with value: 0.8539724728221388 and parameters: {'rc_C': 160984.58051106747, 'rc_tol': 0.0013166939548670106}. Best is trial 3 with value: 0.904744.[0m
[32m[I 2022-10-20 15:12:18,002][0m Trial 8 finished with value: 0.9041933218145332 and parameters: {'rc_C': 1017.6912980666526, 'rc_tol': 0.0005341515835687891}. Best is trial 3 with value: 0.904744.[0m
[32m[I 2022-10-20 15:12:18,272][0m Trial 10 finished with value: 0.9047439555188416 and parameters: {'rc_C': 0.9773471052723274, 'rc_tol': 0.002597477918150232}. Best is trial 3 with value: 0.904744.[0m
[32m[I 2022-10-20 15:12:18,354][0m Trial 12 finished with value: 0.9047439555188416 and parameters: {'rc_C': 0.007029802612888594, 'rc_tol': 0.0029427419604827957}. Best is trial 3 with value: 0.904744.[0m
[32m[I 2022-10-20 15:12:18,354][0m Trial 14 finished with value: 0.9047439555188416 and parameters: {'rc_C': 0.01565483864695941, 'rc_tol': 0.0019247660766301383}. Best is trial 3 with value: 0.904744.[0m
[32m[I 2022-10-20 15:12:18,542][0m Trial 11 finished with value: 0.8533334308329067 and parameters: {'rc_C': 190362.09214676023, 'rc_tol': 0.0002469965274821793}. Best is trial 3 with value: 0.904744.[0m
[32m[I 2022-10-20 15:12:18,542][0m Trial 9 finished with value: 0.9047439555188416 and parameters: {'rc_C': 0.5640674678772689, 'rc_tol': 0.00035686518895539386}. Best is trial 3 with value: 0.904744.[0m
[32m[I 2022-10-20 15:12:18,542][0m Trial 15 finished with value: 0.8530271551353137 and parameters: {'rc_C': 209779.13513213198, 'rc_tol': 0.0005520860249656875}. Best is trial 3 with value: 0.904744.[0m
[32m[I 2022-10-20 15:12:18,776][0m Trial 13 finished with value: 0.9047439555188416 and parameters: {'rc_C': 2.3642902873614654e-06, 'rc_tol': 0.0015670656146252902}. Best is trial 3 with value: 0.904744.[0m
[32m[I 2022-10-20 15:12:19,894][0m Trial 16 finished with value: 0.9041286410923747 and parameters: {'rc_C': 2175.6754128292177, 'rc_tol': 0.0002457026059623912}. Best is trial 3 with value: 0.904744.[0m
[32m[I 2022-10-20 15:12:21,032][0m Trial 17 finished with value: 0.9047439555188416 and parameters: {'rc_C': 9.232831919565526e-05, 'rc_tol': 0.006368174691082999}. Best is trial 18 with value: 0.904744.[0m
[32m[I 2022-10-20 15:12:21,032][0m Trial 18 finished with value: 0.9047439555188416 and parameters: {'rc_C': 0.00013509440795759242, 'rc_tol': 0.008093648684328228}. Best is trial 18 with value: 0.904744.[0m
[32m[I 2022-10-20 15:12:21,298][0m Trial 19 finished with value: 0.9047439555188416 and parameters: {'rc_C': 0.00012420817128277925, 'rc_tol': 0.008327516139933962}. Best is trial 22 with value: 0.904744.[0m
[32m[I 2022-10-20 15:12:21,314][0m Trial 22 finished with value: 0.9047439555188416 and parameters: {'rc_C': 4.6478942485352604e-05, 'rc_tol': 0.008366768087806628}. Best is trial 22 with value: 0.904744.[0m
[32m[I 2022-10-20 15:12:21,457][0m Trial 20 finished with value: 0.9047439555188416 and parameters: {'rc_C': 1.2698573043679236e-05, 'rc_tol': 0.007162301770672389}. Best is trial 23 with value: 0.904744.[0m
[32m[I 2022-10-20 15:12:21,457][0m Trial 21 finished with value: 0.9047439555188416 and parameters: {'rc_C': 8.223913430593932e-05, 'rc_tol': 0.007706718504174033}. Best is trial 23 with value: 0.904744.[0m
[32m[I 2022-10-20 15:12:21,597][0m Trial 23 finished with value: 0.9047439555188416 and parameters: {'rc_C': 4.7101767985745915e-05, 'rc_tol': 0.007835080237684717}. Best is trial 23 with value: 0.904744.[0m
[32m[I 2022-10-20 15:12:22,164][0m Trial 24 finished with value: 0.9047439555188416 and parameters: {'rc_C': 1.99246712627904e-06, 'rc_tol': 0.009190651227820265}. Best is trial 24 with value: 0.904744.[0m
[32m[I 2022-10-20 15:12:23,955][0m Trial 29 finished with value: 0.9047439555188416 and parameters: {'rc_C': 3.821261063300027e-06, 'rc_tol': 0.00114593608934687}. Best is trial 29 with value: 0.904744.[0m
[32m[I 2022-10-20 15:12:24,049][0m Trial 26 finished with value: 0.9047439555188416 and parameters: {'rc_C': 1.0031877177138825e-06, 'rc_tol': 0.004608746489064709}. Best is trial 30 with value: 0.904744.[0m
[32m[I 2022-10-20 15:12:24,049][0m Trial 30 finished with value: 0.9047439555188416 and parameters: {'rc_C': 1.2673541827918826e-06, 'rc_tol': 0.004402303240807986}. Best is trial 30 with value: 0.904744.[0m
[32m[I 2022-10-20 15:12:24,211][0m Trial 25 finished with value: 0.9047439555188416 and parameters: {'rc_C': 1.3358377501488812e-06, 'rc_tol': 0.00451390449089941}. Best is trial 30 with value: 0.904744.[0m
[32m[I 2022-10-20 15:12:24,290][0m Trial 31 finished with value: 0.9047439555188416 and parameters: {'rc_C': 1.8676242413215393e-06, 'rc_tol': 0.0041012334669799}. Best is trial 31 with value: 0.904744.[0m
[32m[I 2022-10-20 15:12:24,290][0m Trial 27 finished with value: 0.9047439555188416 and parameters: {'rc_C': 1.5690586141764502e-06, 'rc_tol': 0.004580118897731279}. Best is trial 31 with value: 0.904744.[0m
[32m[I 2022-10-20 15:12:24,433][0m Trial 28 finished with value: 0.9047439555188416 and parameters: {'rc_C': 1.1350956561258372e-06, 'rc_tol': 0.004114023018370602}. Best is trial 31 with value: 0.904744.[0m
[32m[I 2022-10-20 15:12:24,652][0m Trial 32 finished with value: 0.9047439555188416 and parameters: {'rc_C': 0.0008161880642536527, 'rc_tol': 0.00444951781573481}. Best is trial 32 with value: 0.904744.[0m
[32m[I 2022-10-20 15:12:26,709][0m Trial 33 finished with value: 0.9047439555188416 and parameters: {'rc_C': 2.4754830972084285e-05, 'rc_tol': 0.006452222271725989}. Best is trial 33 with value: 0.904744.[0m
[32m[I 2022-10-20 15:12:26,943][0m Trial 36 finished with value: 0.9047439555188416 and parameters: {'rc_C': 2.3228174970084752e-05, 'rc_tol': 0.005930614806736011}. Best is trial 40 with value: 0.904744.[0m
[32m[I 2022-10-20 15:12:27,037][0m Trial 40 finished with value: 0.9047439555188416 and parameters: {'rc_C': 0.0005673581826721475, 'rc_tol': 0.006028021071920186}. Best is trial 40 with value: 0.904744.[0m
