[32m[I 2022-10-20 12:08:45,845][0m Trial 27 finished with value: 0.2844441188051378 and parameters: {'lsvc_rbfs_kernel_gamma': 0.0020160311760835073, 'lsvc_rbfs_kernel_n_components': 150, 'lsvc_rbfs_dual': False, 'lsvc_rbfs_C': 0.08677195935467372, 'lsvc_rbfs_max_iter': 2000}. Best is trial 0 with value: 0.284444.[0m
[32m[I 2022-10-20 12:08:55,072][0m Trial 28 finished with value: 0.2844441188051378 and parameters: {'lsvc_rbfs_kernel_gamma': 12.883525513357705, 'lsvc_rbfs_kernel_n_components': 100, 'lsvc_rbfs_dual': False, 'lsvc_rbfs_C': 11.975992990534916, 'lsvc_rbfs_max_iter': 2000}. Best is trial 0 with value: 0.284444.[0m
[32m[I 2022-10-20 12:09:01,006][0m Trial 29 finished with value: 0.2844441188051378 and parameters: {'lsvc_rbfs_kernel_gamma': 928.6301831114647, 'lsvc_rbfs_kernel_n_components': 50, 'lsvc_rbfs_dual': False, 'lsvc_rbfs_C': 0.00397522379081996, 'lsvc_rbfs_max_iter': 2000}. Best is trial 0 with value: 0.284444.[0m
[32m[I 2022-10-20 12:09:13,940][0m Trial 30 finished with value: 0.2844441188051378 and parameters: {'lsvc_rbfs_kernel_gamma': 0.7360735217459802, 'lsvc_rbfs_kernel_n_components': 150, 'lsvc_rbfs_dual': False, 'lsvc_rbfs_C': 0.36883251466140676, 'lsvc_rbfs_max_iter': 2000}. Best is trial 0 with value: 0.284444.[0m
[32m[I 2022-10-20 12:09:25,519][0m Trial 31 finished with value: 0.2844441188051378 and parameters: {'lsvc_rbfs_kernel_gamma': 11.593074100394878, 'lsvc_rbfs_kernel_n_components': 150, 'lsvc_rbfs_dual': False, 'lsvc_rbfs_C': 0.034494548666203606, 'lsvc_rbfs_max_iter': 2000}. Best is trial 0 with value: 0.284444.[0m
[32m[I 2022-10-20 12:09:31,376][0m Trial 32 finished with value: 0.2844441188051378 and parameters: {'lsvc_rbfs_kernel_gamma': 755.4443665101744, 'lsvc_rbfs_kernel_n_components': 50, 'lsvc_rbfs_dual': False, 'lsvc_rbfs_C': 0.010111072329258713, 'lsvc_rbfs_max_iter': 2000}. Best is trial 0 with value: 0.284444.[0m
[32m[I 2022-10-20 12:09:37,069][0m Trial 33 finished with value: 0.2844441188051378 and parameters: {'lsvc_rbfs_kernel_gamma': 0.7893044129932671, 'lsvc_rbfs_kernel_n_components': 50, 'lsvc_rbfs_dual': False, 'lsvc_rbfs_C': 10.105882617852666, 'lsvc_rbfs_max_iter': 2000}. Best is trial 0 with value: 0.284444.[0m
[32m[I 2022-10-20 12:09:49,482][0m Trial 34 finished with value: 0.2844441188051378 and parameters: {'lsvc_rbfs_kernel_gamma': 68.76256420284568, 'lsvc_rbfs_kernel_n_components': 150, 'lsvc_rbfs_dual': False, 'lsvc_rbfs_C': 0.4543456483347557, 'lsvc_rbfs_max_iter': 2000}. Best is trial 0 with value: 0.284444.[0m
[32m[I 2022-10-20 12:09:58,871][0m Trial 35 finished with value: 0.2844441188051378 and parameters: {'lsvc_rbfs_kernel_gamma': 0.02893956021224008, 'lsvc_rbfs_kernel_n_components': 100, 'lsvc_rbfs_dual': False, 'lsvc_rbfs_C': 5.5628330893255026e-05, 'lsvc_rbfs_max_iter': 2000}. Best is trial 0 with value: 0.284444.[0m
[32m[I 2022-10-20 12:10:20,124][0m Trial 36 finished with value: 0.2844441188051378 and parameters: {'lsvc_rbfs_kernel_gamma': 0.004076484084099009, 'lsvc_rbfs_kernel_n_components': 150, 'lsvc_rbfs_dual': False, 'lsvc_rbfs_C': 215.7896069486613, 'lsvc_rbfs_max_iter': 2000}. Best is trial 0 with value: 0.284444.[0m
[32m[I 2022-10-20 12:10:30,885][0m Trial 37 finished with value: 0.2844441188051378 and parameters: {'lsvc_rbfs_kernel_gamma': 336.8313165261052, 'lsvc_rbfs_kernel_n_components': 100, 'lsvc_rbfs_dual': False, 'lsvc_rbfs_C': 72.77253204867351, 'lsvc_rbfs_max_iter': 2000}. Best is trial 0 with value: 0.284444.[0m
[32m[I 2022-10-20 12:10:44,966][0m Trial 38 finished with value: 0.2844441188051378 and parameters: {'lsvc_rbfs_kernel_gamma': 0.1452118081080949, 'lsvc_rbfs_kernel_n_components': 150, 'lsvc_rbfs_dual': False, 'lsvc_rbfs_C': 2.7072954073151707, 'lsvc_rbfs_max_iter': 2000}. Best is trial 0 with value: 0.284444.[0m
[32m[I 2022-10-20 12:11:01,625][0m Trial 39 finished with value: 0.2844441188051378 and parameters: {'lsvc_rbfs_kernel_gamma': 0.03384311671984644, 'lsvc_rbfs_kernel_n_components': 150, 'lsvc_rbfs_dual': False, 'lsvc_rbfs_C': 662.7288628978021, 'lsvc_rbfs_max_iter': 2000}. Best is trial 0 with value: 0.284444.[0m
[32m[I 2022-10-20 12:11:14,918][0m Trial 40 finished with value: 0.2844441188051378 and parameters: {'lsvc_rbfs_kernel_gamma': 0.009529389168106002, 'lsvc_rbfs_kernel_n_components': 100, 'lsvc_rbfs_dual': False, 'lsvc_rbfs_C': 0.0010489857208165671, 'lsvc_rbfs_max_iter': 2000}. Best is trial 0 with value: 0.284444.[0m
[32m[I 2022-10-20 12:11:24,660][0m Trial 41 finished with value: 0.2844441188051378 and parameters: {'lsvc_rbfs_kernel_gamma': 299.19609876275143, 'lsvc_rbfs_kernel_n_components': 100, 'lsvc_rbfs_dual': False, 'lsvc_rbfs_C': 17.036603266778737, 'lsvc_rbfs_max_iter': 2000}. Best is trial 0 with value: 0.284444.[0m
[32m[I 2022-10-20 12:11:36,352][0m Trial 42 finished with value: 0.2844441188051378 and parameters: {'lsvc_rbfs_kernel_gamma': 129.81503836960727, 'lsvc_rbfs_kernel_n_components': 150, 'lsvc_rbfs_dual': False, 'lsvc_rbfs_C': 0.0013715751573969927, 'lsvc_rbfs_max_iter': 2000}. Best is trial 0 with value: 0.284444.[0m
[32m[I 2022-10-20 12:11:47,964][0m Trial 43 finished with value: 0.2844441188051378 and parameters: {'lsvc_rbfs_kernel_gamma': 126.92713236799457, 'lsvc_rbfs_kernel_n_components': 150, 'lsvc_rbfs_dual': False, 'lsvc_rbfs_C': 0.09957279770850394, 'lsvc_rbfs_max_iter': 2000}. Best is trial 0 with value: 0.284444.[0m
[32m[I 2022-10-20 12:12:08,260][0m Trial 44 finished with value: 0.2844441188051378 and parameters: {'lsvc_rbfs_kernel_gamma': 0.0035323955723651087, 'lsvc_rbfs_kernel_n_components': 150, 'lsvc_rbfs_dual': False, 'lsvc_rbfs_C': 0.11252494392301654, 'lsvc_rbfs_max_iter': 2000}. Best is trial 0 with value: 0.284444.[0m
[32m[I 2022-10-20 12:12:30,604][0m Trial 45 finished with value: 0.2844441188051378 and parameters: {'lsvc_rbfs_kernel_gamma': 0.002644120494987292, 'lsvc_rbfs_kernel_n_components': 150, 'lsvc_rbfs_dual': False, 'lsvc_rbfs_C': 1.1985090289237144, 'lsvc_rbfs_max_iter': 2000}. Best is trial 0 with value: 0.284444.[0m
[32m[I 2022-10-20 12:12:39,505][0m Trial 46 finished with value: 0.2844441188051378 and parameters: {'lsvc_rbfs_kernel_gamma': 27.185843394054224, 'lsvc_rbfs_kernel_n_components': 100, 'lsvc_rbfs_dual': False, 'lsvc_rbfs_C': 14.485496332765086, 'lsvc_rbfs_max_iter': 2000}. Best is trial 0 with value: 0.284444.[0m
[32m[I 2022-10-20 12:12:48,857][0m Trial 47 finished with value: 0.2844441188051378 and parameters: {'lsvc_rbfs_kernel_gamma': 475.2100639152067, 'lsvc_rbfs_kernel_n_components': 100, 'lsvc_rbfs_dual': False, 'lsvc_rbfs_C': 5.122986926506179, 'lsvc_rbfs_max_iter': 2000}. Best is trial 0 with value: 0.284444.[0m
[32m[I 2022-10-20 12:12:54,796][0m Trial 48 finished with value: 0.2844441188051378 and parameters: {'lsvc_rbfs_kernel_gamma': 660.1809437429067, 'lsvc_rbfs_kernel_n_components': 50, 'lsvc_rbfs_dual': False, 'lsvc_rbfs_C': 0.003777722428723109, 'lsvc_rbfs_max_iter': 2000}. Best is trial 0 with value: 0.284444.[0m
[32m[I 2022-10-20 12:13:00,662][0m Trial 49 finished with value: 0.2844441188051378 and parameters: {'lsvc_rbfs_kernel_gamma': 2.189060702913854, 'lsvc_rbfs_kernel_n_components': 50, 'lsvc_rbfs_dual': False, 'lsvc_rbfs_C': 0.004155524158030714, 'lsvc_rbfs_max_iter': 2000}. Best is trial 0 with value: 0.284444.[0m
[32m[I 2022-10-20 12:13:06,744][0m Trial 50 finished with value: 0.2844441188051378 and parameters: {'lsvc_rbfs_kernel_gamma': 0.3522353457463645, 'lsvc_rbfs_kernel_n_components': 50, 'lsvc_rbfs_dual': False, 'lsvc_rbfs_C': 0.4398388316874141, 'lsvc_rbfs_max_iter': 2000}. Best is trial 0 with value: 0.284444.[0m
[32m[I 2022-10-20 12:13:18,926][0m Trial 51 finished with value: 0.2844441188051378 and parameters: {'lsvc_rbfs_kernel_gamma': 11.566459023340219, 'lsvc_rbfs_kernel_n_components': 150, 'lsvc_rbfs_dual': False, 'lsvc_rbfs_C': 0.024112391845687652, 'lsvc_rbfs_max_iter': 2000}. Best is trial 0 with value: 0.284444.[0m
[32m[I 2022-10-20 12:13:24,752][0m Trial 52 finished with value: 0.2844441188051378 and parameters: {'lsvc_rbfs_kernel_gamma': 718.9472207938911, 'lsvc_rbfs_kernel_n_components': 50, 'lsvc_rbfs_dual': False, 'lsvc_rbfs_C': 0.008324122193193118, 'lsvc_rbfs_max_iter': 2000}. Best is trial 0 with value: 0.284444.[0m
[32m[I 2022-10-20 12:13:30,937][0m Trial 53 finished with value: 0.2844441188051378 and parameters: {'lsvc_rbfs_kernel_gamma': 842.4813897638695, 'lsvc_rbfs_kernel_n_components': 50, 'lsvc_rbfs_dual': False, 'lsvc_rbfs_C': 0.011533896093627337, 'lsvc_rbfs_max_iter': 2000}. Best is trial 0 with value: 0.284444.[0m
[32m[I 2022-10-20 12:13:36,935][0m Trial 54 finished with value: 0.2844441188051378 and parameters: {'lsvc_rbfs_kernel_gamma': 1.0774836360433127, 'lsvc_rbfs_kernel_n_components': 50, 'lsvc_rbfs_dual': False, 'lsvc_rbfs_C': 0.040544065700547555, 'lsvc_rbfs_max_iter': 2000}. Best is trial 0 with value: 0.284444.[0m
[32m[I 2022-10-20 12:13:42,806][0m Trial 55 finished with value: 0.2844441188051378 and parameters: {'lsvc_rbfs_kernel_gamma': 1.1015476677447775, 'lsvc_rbfs_kernel_n_components': 50, 'lsvc_rbfs_dual': False, 'lsvc_rbfs_C': 0.2545275218101579, 'lsvc_rbfs_max_iter': 2000}. Best is trial 0 with value: 0.284444.[0m
[32m[I 2022-10-20 12:13:55,437][0m Trial 56 finished with value: 0.2844441188051378 and parameters: {'lsvc_rbfs_kernel_gamma': 55.16683509946889, 'lsvc_rbfs_kernel_n_components': 150, 'lsvc_rbfs_dual': False, 'lsvc_rbfs_C': 0.5468838557231325, 'lsvc_rbfs_max_iter': 2000}. Best is trial 0 with value: 0.284444.[0m
[32m[I 2022-10-20 12:14:08,656][0m Trial 57 finished with value: 0.2844441188051378 and parameters: {'lsvc_rbfs_kernel_gamma': 6.161676745591921, 'lsvc_rbfs_kernel_n_components': 150, 'lsvc_rbfs_dual': False, 'lsvc_rbfs_C': 0.9694628264647854, 'lsvc_rbfs_max_iter': 2000}. Best is trial 0 with value: 0.284444.[0m
[32m[I 2022-10-20 12:14:13,166][0m Trial 58 finished with value: 0.2844441188051378 and parameters: {'lsvc_rbfs_kernel_gamma': 69.11658173288768, 'lsvc_rbfs_kernel_n_components': 50, 'lsvc_rbfs_dual': False, 'lsvc_rbfs_C': 4.683168031912345e-06, 'lsvc_rbfs_max_iter': 2000}. Best is trial 0 with value: 0.284444.[0m
[32m[I 2022-10-20 12:14:18,873][0m Trial 59 finished with value: 0.2844441188051378 and parameters: {'lsvc_rbfs_kernel_gamma': 29.823457047766688, 'lsvc_rbfs_kernel_n_components': 50, 'lsvc_rbfs_dual': False, 'lsvc_rbfs_C': 7.515884212241623e-05, 'lsvc_rbfs_max_iter': 2000}. Best is trial 0 with value: 0.284444.[0m
[32m[I 2022-10-20 12:14:25,325][0m Trial 60 finished with value: 0.2844441188051378 and parameters: {'lsvc_rbfs_kernel_gamma': 0.08800289856318046, 'lsvc_rbfs_kernel_n_components': 50, 'lsvc_rbfs_dual': False, 'lsvc_rbfs_C': 415.7343494732576, 'lsvc_rbfs_max_iter': 2000}. Best is trial 0 with value: 0.284444.[0m
[32m[I 2022-10-20 12:14:34,605][0m Trial 61 finished with value: 0.2844441188051378 and parameters: {'lsvc_rbfs_kernel_gamma': 381.0208866498541, 'lsvc_rbfs_kernel_n_components': 100, 'lsvc_rbfs_dual': False, 'lsvc_rbfs_C': 216.46689835987615, 'lsvc_rbfs_max_iter': 2000}. Best is trial 0 with value: 0.284444.[0m
[32m[I 2022-10-20 12:14:43,720][0m Trial 62 finished with value: 0.2844441188051378 and parameters: {'lsvc_rbfs_kernel_gamma': 0.18742313697839955, 'lsvc_rbfs_kernel_n_components': 100, 'lsvc_rbfs_dual': False, 'lsvc_rbfs_C': 5.606668419602504, 'lsvc_rbfs_max_iter': 2000}. Best is trial 0 with value: 0.284444.[0m
[32m[I 2022-10-20 12:14:59,062][0m Trial 63 finished with value: 0.2844441188051378 and parameters: {'lsvc_rbfs_kernel_gamma': 0.029516450525416505, 'lsvc_rbfs_kernel_n_components': 150, 'lsvc_rbfs_dual': False, 'lsvc_rbfs_C': 44.97695292425495, 'lsvc_rbfs_max_iter': 2000}. Best is trial 0 with value: 0.284444.[0m
[32m[I 2022-10-20 12:15:15,667][0m Trial 64 finished with value: 0.2844441188051378 and parameters: {'lsvc_rbfs_kernel_gamma': 0.03249742035471811, 'lsvc_rbfs_kernel_n_components': 150, 'lsvc_rbfs_dual': False, 'lsvc_rbfs_C': 818.7306297314151, 'lsvc_rbfs_max_iter': 2000}. Best is trial 0 with value: 0.284444.[0m
[32m[I 2022-10-20 12:15:32,982][0m Trial 65 finished with value: 0.2844441188051378 and parameters: {'lsvc_rbfs_kernel_gamma': 0.01852265886429568, 'lsvc_rbfs_kernel_n_components': 150, 'lsvc_rbfs_dual': False, 'lsvc_rbfs_C': 188.99307254381537, 'lsvc_rbfs_max_iter': 2000}. Best is trial 0 with value: 0.284444.[0m
[32m[I 2022-10-20 12:15:43,237][0m Trial 66 finished with value: 0.2844441188051378 and parameters: {'lsvc_rbfs_kernel_gamma': 0.008949967355919637, 'lsvc_rbfs_kernel_n_components': 100, 'lsvc_rbfs_dual': False, 'lsvc_rbfs_C': 4.766472749415878e-05, 'lsvc_rbfs_max_iter': 2000}. Best is trial 0 with value: 0.284444.[0m
[32m[I 2022-10-20 12:15:54,697][0m Trial 67 finished with value: 0.2844441188051378 and parameters: {'lsvc_rbfs_kernel_gamma': 0.0811808310647557, 'lsvc_rbfs_kernel_n_components': 100, 'lsvc_rbfs_dual': False, 'lsvc_rbfs_C': 39.43709789422905, 'lsvc_rbfs_max_iter': 2000}. Best is trial 0 with value: 0.284444.[0m
[32m[I 2022-10-20 12:16:07,029][0m Trial 68 finished with value: 0.2844441188051378 and parameters: {'lsvc_rbfs_kernel_gamma': 0.013004303144013758, 'lsvc_rbfs_kernel_n_components': 100, 'lsvc_rbfs_dual': False, 'lsvc_rbfs_C': 159.763627752801, 'lsvc_rbfs_max_iter': 2000}. Best is trial 0 with value: 0.284444.[0m
[32m[I 2022-10-20 12:16:19,908][0m Trial 69 finished with value: 0.2844441188051378 and parameters: {'lsvc_rbfs_kernel_gamma': 0.007381008691744329, 'lsvc_rbfs_kernel_n_components': 100, 'lsvc_rbfs_dual': False, 'lsvc_rbfs_C': 376.47260342056035, 'lsvc_rbfs_max_iter': 2000}. Best is trial 0 with value: 0.284444.[0m
[32m[I 2022-10-20 12:16:28,920][0m Trial 70 finished with value: 0.2844441188051378 and parameters: {'lsvc_rbfs_kernel_gamma': 289.8734960052934, 'lsvc_rbfs_kernel_n_components': 100, 'lsvc_rbfs_dual': False, 'lsvc_rbfs_C': 0.0008024270512815412, 'lsvc_rbfs_max_iter': 2000}. Best is trial 0 with value: 0.284444.[0m
[32m[I 2022-10-20 12:16:34,891][0m Trial 71 finished with value: 0.2844441188051378 and parameters: {'lsvc_rbfs_kernel_gamma': 0.3844381126661694, 'lsvc_rbfs_kernel_n_components': 50, 'lsvc_rbfs_dual': False, 'lsvc_rbfs_C': 1.109210800457842, 'lsvc_rbfs_max_iter': 2000}. Best is trial 0 with value: 0.284444.[0m
[32m[I 2022-10-20 12:16:40,819][0m Trial 72 finished with value: 0.2844441188051378 and parameters: {'lsvc_rbfs_kernel_gamma': 506.9340271753803, 'lsvc_rbfs_kernel_n_components': 50, 'lsvc_rbfs_dual': False, 'lsvc_rbfs_C': 0.01783479273047746, 'lsvc_rbfs_max_iter': 2000}. Best is trial 0 with value: 0.284444.[0m
[32m[I 2022-10-20 12:16:46,917][0m Trial 73 finished with value: 0.2844441188051378 and parameters: {'lsvc_rbfs_kernel_gamma': 1.9774343561344918, 'lsvc_rbfs_kernel_n_components': 50, 'lsvc_rbfs_dual': False, 'lsvc_rbfs_C': 0.00490278110879574, 'lsvc_rbfs_max_iter': 2000}. Best is trial 0 with value: 0.284444.[0m
[32m[I 2022-10-20 12:16:53,092][0m Trial 74 finished with value: 0.2844441188051378 and parameters: {'lsvc_rbfs_kernel_gamma': 518.3407594134686, 'lsvc_rbfs_kernel_n_components': 50, 'lsvc_rbfs_dual': False, 'lsvc_rbfs_C': 0.020280060202979296, 'lsvc_rbfs_max_iter': 2000}. Best is trial 0 with value: 0.284444.[0m
[32m[I 2022-10-20 12:16:59,386][0m Trial 75 finished with value: 0.2844441188051378 and parameters: {'lsvc_rbfs_kernel_gamma': 893.6531879217806, 'lsvc_rbfs_kernel_n_components': 50, 'lsvc_rbfs_dual': False, 'lsvc_rbfs_C': 0.007734391291002668, 'lsvc_rbfs_max_iter': 2000}. Best is trial 0 with value: 0.284444.[0m
[32m[I 2022-10-20 12:17:05,814][0m Trial 76 finished with value: 0.2844441188051378 and parameters: {'lsvc_rbfs_kernel_gamma': 0.32490002995078276, 'lsvc_rbfs_kernel_n_components': 50, 'lsvc_rbfs_dual': False, 'lsvc_rbfs_C': 0.061065306399500884, 'lsvc_rbfs_max_iter': 2000}. Best is trial 0 with value: 0.284444.[0m
[32m[I 2022-10-20 12:17:11,939][0m Trial 77 finished with value: 0.2844441188051378 and parameters: {'lsvc_rbfs_kernel_gamma': 3.7932522609166814, 'lsvc_rbfs_kernel_n_components': 50, 'lsvc_rbfs_dual': False, 'lsvc_rbfs_C': 0.002142715025601553, 'lsvc_rbfs_max_iter': 2000}. Best is trial 0 with value: 0.284444.[0m
[32m[I 2022-10-20 12:17:17,889][0m Trial 78 finished with value: 0.2844441188051378 and parameters: {'lsvc_rbfs_kernel_gamma': 1.4235762960157174, 'lsvc_rbfs_kernel_n_components': 50, 'lsvc_rbfs_dual': False, 'lsvc_rbfs_C': 0.21558405630108213, 'lsvc_rbfs_max_iter': 2000}. Best is trial 0 with value: 0.284444.[0m
[32m[I 2022-10-20 12:17:23,883][0m Trial 79 finished with value: 0.2844441188051378 and parameters: {'lsvc_rbfs_kernel_gamma': 1.1288523826599937, 'lsvc_rbfs_kernel_n_components': 50, 'lsvc_rbfs_dual': False, 'lsvc_rbfs_C': 0.23716924089891908, 'lsvc_rbfs_max_iter': 2000}. Best is trial 0 with value: 0.284444.[0m
[32m[I 2022-10-20 12:17:35,326][0m Trial 80 finished with value: 0.2844441188051378 and parameters: {'lsvc_rbfs_kernel_gamma': 4.783790465289925, 'lsvc_rbfs_kernel_n_components': 150, 'lsvc_rbfs_dual': False, 'lsvc_rbfs_C': 0.7800089692029031, 'lsvc_rbfs_max_iter': 2000}. Best is trial 0 with value: 0.284444.[0m
[32m[I 2022-10-20 12:17:39,769][0m Trial 81 finished with value: 0.2844441188051378 and parameters: {'lsvc_rbfs_kernel_gamma': 81.48320671651355, 'lsvc_rbfs_kernel_n_components': 50, 'lsvc_rbfs_dual': False, 'lsvc_rbfs_C': 2.8344138384054666e-06, 'lsvc_rbfs_max_iter': 2000}. Best is trial 0 with value: 0.284444.[0m
[32m[I 2022-10-20 12:17:44,272][0m Trial 82 finished with value: 0.2844441188051378 and parameters: {'lsvc_rbfs_kernel_gamma': 47.16523368609862, 'lsvc_rbfs_kernel_n_components': 50, 'lsvc_rbfs_dual': False, 'lsvc_rbfs_C': 1.3353177816579644e-06, 'lsvc_rbfs_max_iter': 2000}. Best is trial 0 with value: 0.284444.[0m
[32m[I 2022-10-20 12:17:48,791][0m Trial 83 finished with value: 0.2844441188051378 and parameters: {'lsvc_rbfs_kernel_gamma': 23.975717165068218, 'lsvc_rbfs_kernel_n_components': 50, 'lsvc_rbfs_dual': False, 'lsvc_rbfs_C': 7.142006261476326e-06, 'lsvc_rbfs_max_iter': 2000}. Best is trial 0 with value: 0.284444.[0m
[32m[I 2022-10-20 12:17:54,965][0m Trial 84 finished with value: 0.2844441188051378 and parameters: {'lsvc_rbfs_kernel_gamma': 92.11489312936222, 'lsvc_rbfs_kernel_n_components': 50, 'lsvc_rbfs_dual': False, 'lsvc_rbfs_C': 9.53894750927258e-05, 'lsvc_rbfs_max_iter': 2000}. Best is trial 0 with value: 0.284444.[0m
[32m[I 2022-10-20 12:18:00,700][0m Trial 85 finished with value: 0.2844441188051378 and parameters: {'lsvc_rbfs_kernel_gamma': 190.50916158678746, 'lsvc_rbfs_kernel_n_components': 50, 'lsvc_rbfs_dual': False, 'lsvc_rbfs_C': 0.0002557222431522152, 'lsvc_rbfs_max_iter': 2000}. Best is trial 0 with value: 0.284444.[0m
[32m[I 2022-10-20 12:18:06,041][0m Trial 86 finished with value: 0.2844441188051378 and parameters: {'lsvc_rbfs_kernel_gamma': 7.525061387939266, 'lsvc_rbfs_kernel_n_components': 50, 'lsvc_rbfs_dual': False, 'lsvc_rbfs_C': 2.194527715595505e-05, 'lsvc_rbfs_max_iter': 2000}. Best is trial 0 with value: 0.284444.[0m
[32m[I 2022-10-20 12:18:17,248][0m Trial 87 finished with value: 0.2844441188051378 and parameters: {'lsvc_rbfs_kernel_gamma': 0.11450909260160246, 'lsvc_rbfs_kernel_n_components': 100, 'lsvc_rbfs_dual': False, 'lsvc_rbfs_C': 1.804822879583843, 'lsvc_rbfs_max_iter': 2000}. Best is trial 0 with value: 0.284444.[0m
[32m[I 2022-10-20 12:18:31,372][0m Trial 88 finished with value: 0.2844441188051378 and parameters: {'lsvc_rbfs_kernel_gamma': 0.22244945184027592, 'lsvc_rbfs_kernel_n_components': 150, 'lsvc_rbfs_dual': False, 'lsvc_rbfs_C': 7.3487054618161975, 'lsvc_rbfs_max_iter': 2000}. Best is trial 0 with value: 0.284444.[0m
[32m[I 2022-10-20 12:18:43,826][0m Trial 89 finished with value: 0.2844441188051378 and parameters: {'lsvc_rbfs_kernel_gamma': 39.558089742929255, 'lsvc_rbfs_kernel_n_components': 150, 'lsvc_rbfs_dual': False, 'lsvc_rbfs_C': 33.87418585651198, 'lsvc_rbfs_max_iter': 2000}. Best is trial 0 with value: 0.284444.[0m
[32m[I 2022-10-20 12:18:59,523][0m Trial 90 finished with value: 0.2844441188051378 and parameters: {'lsvc_rbfs_kernel_gamma': 0.05186708843721663, 'lsvc_rbfs_kernel_n_components': 150, 'lsvc_rbfs_dual': False, 'lsvc_rbfs_C': 706.8816797798672, 'lsvc_rbfs_max_iter': 2000}. Best is trial 0 with value: 0.284444.[0m
[32m[I 2022-10-20 12:19:16,319][0m Trial 91 finished with value: 0.2844441188051378 and parameters: {'lsvc_rbfs_kernel_gamma': 0.021858062484035976, 'lsvc_rbfs_kernel_n_components': 150, 'lsvc_rbfs_dual': False, 'lsvc_rbfs_C': 228.57638599338938, 'lsvc_rbfs_max_iter': 2000}. Best is trial 0 with value: 0.284444.[0m
[32m[I 2022-10-20 12:19:28,738][0m Trial 92 finished with value: 0.2844441188051378 and parameters: {'lsvc_rbfs_kernel_gamma': 0.02553149242550289, 'lsvc_rbfs_kernel_n_components': 100, 'lsvc_rbfs_dual': False, 'lsvc_rbfs_C': 405.96610382525444, 'lsvc_rbfs_max_iter': 2000}. Best is trial 0 with value: 0.284444.[0m
[32m[I 2022-10-20 12:19:39,732][0m Trial 93 finished with value: 0.2844441188051378 and parameters: {'lsvc_rbfs_kernel_gamma': 0.051786597711716016, 'lsvc_rbfs_kernel_n_components': 100, 'lsvc_rbfs_dual': False, 'lsvc_rbfs_C': 371.74203868643207, 'lsvc_rbfs_max_iter': 2000}. Best is trial 0 with value: 0.284444.[0m
[32m[I 2022-10-20 12:19:49,774][0m Trial 94 finished with value: 0.2844441188051378 and parameters: {'lsvc_rbfs_kernel_gamma': 0.08428292543839372, 'lsvc_rbfs_kernel_n_components': 100, 'lsvc_rbfs_dual': False, 'lsvc_rbfs_C': 37.04512935561236, 'lsvc_rbfs_max_iter': 2000}. Best is trial 0 with value: 0.284444.[0m
[32m[I 2022-10-20 12:20:02,242][0m Trial 95 finished with value: 0.2844441188051378 and parameters: {'lsvc_rbfs_kernel_gamma': 0.015191024581647467, 'lsvc_rbfs_kernel_n_components': 100, 'lsvc_rbfs_dual': False, 'lsvc_rbfs_C': 139.0801998821436, 'lsvc_rbfs_max_iter': 2000}. Best is trial 0 with value: 0.284444.[0m
