[32m[I 2022-10-20 03:58:07,627][0m Trial 96 finished with value: 0.8466557487388974 and parameters: {'gnb_var_smoothing': 1.322134035814465e-10}. Best is trial 28 with value: 0.86114.[0m
[32m[I 2022-10-20 03:58:07,877][0m Trial 97 finished with value: 0.7962416058119495 and parameters: {'gnb_var_smoothing': 7.382836585057234e-09}. Best is trial 28 with value: 0.86114.[0m
[32m[I 2022-10-20 03:58:08,002][0m Trial 98 finished with value: 0.8466495576337942 and parameters: {'gnb_var_smoothing': 9.930591086210231e-11}. Best is trial 28 with value: 0.86114.[0m
[32m[I 2022-10-20 03:58:08,143][0m Trial 99 finished with value: 0.8466763066226962 and parameters: {'gnb_var_smoothing': 1.2133671225274985e-10}. Best is trial 28 with value: 0.86114.[0m
[32m[I 2022-10-20 03:58:08,206][0m Study finished.[0m
[32m[I 2022-10-20 03:58:08,300][0m --------------------------------------------------------------------------------[0m
[32m[I 2022-10-20 03:58:08,300][0m --------------------     HistGradientBoostingClassifier     --------------------[0m
[32m[I 2022-10-20 03:58:08,300][0m --------------------------------------------------------------------------------[0m
[32m[I 2022-10-20 03:58:08,331][0m A new study created in RDB with name: HistGradientBoostingClassifier_b4f53b70[0m
[32m[I 2022-10-20 03:58:08,346][0m Study started.[0m
[32m[I 2022-10-20 03:58:18,322][0m Trial 1 finished with value: 0.9894307907172631 and parameters: {'hgbc_learning_rate': 0.9203886131945614, 'hgbc_max_iter': 2000, 'hgbc_min_samples_leaf': 5, 'hgbc_l2_regularization': 0.4, 'hgbc_max_bins': 255, 'hgbc_early_stopping': True, 'hgbc_validation_fraction': 0.25, 'hgbc_n_iter_no_change': 10}. Best is trial 1 with value: 0.989431.[0m
[32m[I 2022-10-20 03:58:23,162][0m Trial 0 finished with value: 0.9914210932189916 and parameters: {'hgbc_learning_rate': 0.6212380506322308, 'hgbc_max_iter': 2000, 'hgbc_min_samples_leaf': 40, 'hgbc_l2_regularization': 0.4, 'hgbc_max_bins': 127, 'hgbc_early_stopping': True, 'hgbc_validation_fraction': 0.25, 'hgbc_n_iter_no_change': 10}. Best is trial 0 with value: 0.991421.[0m
[32m[I 2022-10-20 03:58:23,834][0m Trial 2 finished with value: 0.7414506337046562 and parameters: {'hgbc_learning_rate': 0.863419141008518, 'hgbc_max_iter': 2000, 'hgbc_min_samples_leaf': 26, 'hgbc_l2_regularization': 0.0, 'hgbc_max_bins': 255, 'hgbc_early_stopping': True, 'hgbc_validation_fraction': 0.25, 'hgbc_n_iter_no_change': 10}. Best is trial 0 with value: 0.991421.[0m
[32m[I 2022-10-20 03:58:34,968][0m Trial 3 finished with value: 0.9915878322260875 and parameters: {'hgbc_learning_rate': 0.23244588605695973, 'hgbc_max_iter': 2000, 'hgbc_min_samples_leaf': 34, 'hgbc_l2_regularization': 1.0, 'hgbc_max_bins': 63, 'hgbc_early_stopping': True, 'hgbc_validation_fraction': 0.25, 'hgbc_n_iter_no_change': 10}. Best is trial 3 with value: 0.991588.[0m
[32m[I 2022-10-20 03:58:36,928][0m Trial 8 finished with value: 0.9916655262431348 and parameters: {'hgbc_learning_rate': 0.318287662654015, 'hgbc_max_iter': 2000, 'hgbc_min_samples_leaf': 35, 'hgbc_l2_regularization': 0.4, 'hgbc_max_bins': 127, 'hgbc_early_stopping': True, 'hgbc_validation_fraction': 0.25, 'hgbc_n_iter_no_change': 10}. Best is trial 8 with value: 0.991666.[0m
[32m[I 2022-10-20 03:58:49,244][0m Trial 4 finished with value: 0.9916026645552372 and parameters: {'hgbc_learning_rate': 0.13434958304672914, 'hgbc_max_iter': 2000, 'hgbc_min_samples_leaf': 11, 'hgbc_l2_regularization': 0.6000000000000001, 'hgbc_max_bins': 63, 'hgbc_early_stopping': True, 'hgbc_validation_fraction': 0.25, 'hgbc_n_iter_no_change': 10}. Best is trial 8 with value: 0.991666.[0m
[32m[I 2022-10-20 03:58:58,734][0m Trial 10 finished with value: 0.9915262395092429 and parameters: {'hgbc_learning_rate': 0.20765854005151038, 'hgbc_max_iter': 2000, 'hgbc_min_samples_leaf': 37, 'hgbc_l2_regularization': 0.0, 'hgbc_max_bins': 255, 'hgbc_early_stopping': True, 'hgbc_validation_fraction': 0.25, 'hgbc_n_iter_no_change': 10}. Best is trial 8 with value: 0.991666.[0m
[32m[I 2022-10-20 03:59:03,571][0m Trial 9 finished with value: 0.9915138502178691 and parameters: {'hgbc_learning_rate': 0.17343635656843753, 'hgbc_max_iter': 2000, 'hgbc_min_samples_leaf': 40, 'hgbc_l2_regularization': 0.0, 'hgbc_max_bins': 127, 'hgbc_early_stopping': True, 'hgbc_validation_fraction': 0.25, 'hgbc_n_iter_no_change': 10}. Best is trial 8 with value: 0.991666.[0m
[32m[I 2022-10-20 04:00:38,309][0m Trial 5 finished with value: 0.9916181480026197 and parameters: {'hgbc_learning_rate': 0.027578403059658852, 'hgbc_max_iter': 2000, 'hgbc_min_samples_leaf': 16, 'hgbc_l2_regularization': 0.2, 'hgbc_max_bins': 63, 'hgbc_early_stopping': True, 'hgbc_validation_fraction': 0.25, 'hgbc_n_iter_no_change': 10}. Best is trial 8 with value: 0.991666.[0m
[32m[I 2022-10-20 04:01:40,763][0m Trial 16 finished with value: 0.9915279290210962 and parameters: {'hgbc_learning_rate': 0.06450484497663216, 'hgbc_max_iter': 2000, 'hgbc_min_samples_leaf': 41, 'hgbc_l2_regularization': 0.4, 'hgbc_max_bins': 127, 'hgbc_early_stopping': True, 'hgbc_validation_fraction': 0.25, 'hgbc_n_iter_no_change': 10}. Best is trial 8 with value: 0.991666.[0m
[32m[I 2022-10-20 04:02:13,113][0m Trial 13 finished with value: 0.9915717706795731 and parameters: {'hgbc_learning_rate': 0.018680110757168335, 'hgbc_max_iter': 2000, 'hgbc_min_samples_leaf': 20, 'hgbc_l2_regularization': 0.4, 'hgbc_max_bins': 255, 'hgbc_early_stopping': True, 'hgbc_validation_fraction': 0.25, 'hgbc_n_iter_no_change': 10}. Best is trial 8 with value: 0.991666.[0m
[32m[I 2022-10-20 04:05:08,556][0m Trial 12 finished with value: 0.9915414163552199 and parameters: {'hgbc_learning_rate': 0.00914645584442362, 'hgbc_max_iter': 2000, 'hgbc_min_samples_leaf': 34, 'hgbc_l2_regularization': 0.2, 'hgbc_max_bins': 255, 'hgbc_early_stopping': True, 'hgbc_validation_fraction': 0.25, 'hgbc_n_iter_no_change': 10}. Best is trial 8 with value: 0.991666.[0m
[32m[I 2022-10-20 04:05:30,759][0m Trial 7 finished with value: 0.9915490629232804 and parameters: {'hgbc_learning_rate': 0.012858926661847, 'hgbc_max_iter': 2000, 'hgbc_min_samples_leaf': 25, 'hgbc_l2_regularization': 0.0, 'hgbc_max_bins': 255, 'hgbc_early_stopping': True, 'hgbc_validation_fraction': 0.25, 'hgbc_n_iter_no_change': 10}. Best is trial 8 with value: 0.991666.[0m
[32m[I 2022-10-20 04:06:32,421][0m Trial 6 finished with value: 0.9916253349185578 and parameters: {'hgbc_learning_rate': 0.0074660914060299234, 'hgbc_max_iter': 2000, 'hgbc_min_samples_leaf': 50, 'hgbc_l2_regularization': 0.2, 'hgbc_max_bins': 63, 'hgbc_early_stopping': True, 'hgbc_validation_fraction': 0.25, 'hgbc_n_iter_no_change': 10}. Best is trial 8 with value: 0.991666.[0m
[32m[I 2022-10-20 04:07:15,343][0m Trial 20 finished with value: 0.9915952867496719 and parameters: {'hgbc_learning_rate': 0.04303269403551962, 'hgbc_max_iter': 2000, 'hgbc_min_samples_leaf': 17, 'hgbc_l2_regularization': 0.8, 'hgbc_max_bins': 63, 'hgbc_early_stopping': True, 'hgbc_validation_fraction': 0.25, 'hgbc_n_iter_no_change': 10}. Best is trial 8 with value: 0.991666.[0m
[32m[I 2022-10-20 04:17:15,017][0m Trial 17 finished with value: 0.9915048422093753 and parameters: {'hgbc_learning_rate': 0.0038084081665345566, 'hgbc_max_iter': 2000, 'hgbc_min_samples_leaf': 50, 'hgbc_l2_regularization': 0.8, 'hgbc_max_bins': 127, 'hgbc_early_stopping': True, 'hgbc_validation_fraction': 0.25, 'hgbc_n_iter_no_change': 10}. Best is trial 8 with value: 0.991666.[0m
[32m[I 2022-10-20 04:18:16,994][0m Trial 14 finished with value: 0.9914802814788253 and parameters: {'hgbc_learning_rate': 0.0013178911142297366, 'hgbc_max_iter': 2000, 'hgbc_min_samples_leaf': 50, 'hgbc_l2_regularization': 0.4, 'hgbc_max_bins': 127, 'hgbc_early_stopping': True, 'hgbc_validation_fraction': 0.25, 'hgbc_n_iter_no_change': 10}. Best is trial 8 with value: 0.991666.[0m
[32m[I 2022-10-20 04:18:45,288][0m Trial 11 finished with value: 0.9915654303248613 and parameters: {'hgbc_learning_rate': 0.0015870159393279618, 'hgbc_max_iter': 2000, 'hgbc_min_samples_leaf': 32, 'hgbc_l2_regularization': 0.2, 'hgbc_max_bins': 127, 'hgbc_early_stopping': True, 'hgbc_validation_fraction': 0.25, 'hgbc_n_iter_no_change': 10}. Best is trial 8 with value: 0.991666.[0m
[32m[I 2022-10-20 04:19:03,494][0m Trial 15 finished with value: 0.9915646257974772 and parameters: {'hgbc_learning_rate': 0.0010565704249585993, 'hgbc_max_iter': 2000, 'hgbc_min_samples_leaf': 13, 'hgbc_l2_regularization': 0.4, 'hgbc_max_bins': 63, 'hgbc_early_stopping': True, 'hgbc_validation_fraction': 0.25, 'hgbc_n_iter_no_change': 10}. Best is trial 8 with value: 0.991666.[0m
[32m[I 2022-10-20 04:21:14,731][0m Trial 18 finished with value: 0.9915953632820486 and parameters: {'hgbc_learning_rate': 0.0035027587303276715, 'hgbc_max_iter': 2000, 'hgbc_min_samples_leaf': 22, 'hgbc_l2_regularization': 0.2, 'hgbc_max_bins': 63, 'hgbc_early_stopping': True, 'hgbc_validation_fraction': 0.25, 'hgbc_n_iter_no_change': 10}. Best is trial 8 with value: 0.991666.[0m
[32m[I 2022-10-20 04:24:53,975][0m Trial 19 finished with value: 0.9915950183482779 and parameters: {'hgbc_learning_rate': 0.0022054135969877256, 'hgbc_max_iter': 2000, 'hgbc_min_samples_leaf': 23, 'hgbc_l2_regularization': 0.8, 'hgbc_max_bins': 63, 'hgbc_early_stopping': True, 'hgbc_validation_fraction': 0.25, 'hgbc_n_iter_no_change': 10}. Best is trial 8 with value: 0.991666.[0m
[32m[I 2022-10-20 04:25:33,387][0m Trial 21 finished with value: 0.9915875257503904 and parameters: {'hgbc_learning_rate': 0.0022192466812735586, 'hgbc_max_iter': 2000, 'hgbc_min_samples_leaf': 49, 'hgbc_l2_regularization': 0.8, 'hgbc_max_bins': 63, 'hgbc_early_stopping': True, 'hgbc_validation_fraction': 0.25, 'hgbc_n_iter_no_change': 10}. Best is trial 8 with value: 0.991666.[0m
[32m[I 2022-10-20 04:27:00,808][0m Trial 22 finished with value: 0.9914199293782026 and parameters: {'hgbc_learning_rate': 0.001602090867690113, 'hgbc_max_iter': 2000, 'hgbc_min_samples_leaf': 50, 'hgbc_l2_regularization': 0.6000000000000001, 'hgbc_max_bins': 127, 'hgbc_early_stopping': True, 'hgbc_validation_fraction': 0.25, 'hgbc_n_iter_no_change': 10}. Best is trial 8 with value: 0.991666.[0m
[32m[I 2022-10-20 04:29:29,136][0m Trial 27 finished with value: 0.9915268962256475 and parameters: {'hgbc_learning_rate': 0.007347101243830246, 'hgbc_max_iter': 2000, 'hgbc_min_samples_leaf': 45, 'hgbc_l2_regularization': 0.6000000000000001, 'hgbc_max_bins': 127, 'hgbc_early_stopping': True, 'hgbc_validation_fraction': 0.25, 'hgbc_n_iter_no_change': 10}. Best is trial 8 with value: 0.991666.[0m
[32m[I 2022-10-20 04:30:00,959][0m Trial 30 finished with value: 0.9916412755821001 and parameters: {'hgbc_learning_rate': 0.02592711581847875, 'hgbc_max_iter': 2000, 'hgbc_min_samples_leaf': 45, 'hgbc_l2_regularization': 0.2, 'hgbc_max_bins': 63, 'hgbc_early_stopping': True, 'hgbc_validation_fraction': 0.25, 'hgbc_n_iter_no_change': 10}. Best is trial 8 with value: 0.991666.[0m
[32m[I 2022-10-20 04:31:00,700][0m Trial 32 finished with value: 0.9916489969481241 and parameters: {'hgbc_learning_rate': 0.07757661448510357, 'hgbc_max_iter': 2000, 'hgbc_min_samples_leaf': 43, 'hgbc_l2_regularization': 0.2, 'hgbc_max_bins': 63, 'hgbc_early_stopping': True, 'hgbc_validation_fraction': 0.25, 'hgbc_n_iter_no_change': 10}. Best is trial 8 with value: 0.991666.[0m
[32m[I 2022-10-20 04:31:34,871][0m Trial 25 finished with value: 0.9916251045205565 and parameters: {'hgbc_learning_rate': 0.00545908907957669, 'hgbc_max_iter': 2000, 'hgbc_min_samples_leaf': 45, 'hgbc_l2_regularization': 0.6000000000000001, 'hgbc_max_bins': 63, 'hgbc_early_stopping': True, 'hgbc_validation_fraction': 0.25, 'hgbc_n_iter_no_change': 10}. Best is trial 8 with value: 0.991666.[0m
[32m[I 2022-10-20 04:32:04,848][0m Trial 33 finished with value: 0.991664060576853 and parameters: {'hgbc_learning_rate': 0.07854200212870541, 'hgbc_max_iter': 2000, 'hgbc_min_samples_leaf': 30, 'hgbc_l2_regularization': 0.2, 'hgbc_max_bins': 63, 'hgbc_early_stopping': True, 'hgbc_validation_fraction': 0.25, 'hgbc_n_iter_no_change': 10}. Best is trial 8 with value: 0.991666.[0m
[32m[I 2022-10-20 04:32:15,550][0m Trial 31 finished with value: 0.9915881376078302 and parameters: {'hgbc_learning_rate': 0.02325674947439181, 'hgbc_max_iter': 2000, 'hgbc_min_samples_leaf': 4, 'hgbc_l2_regularization': 0.2, 'hgbc_max_bins': 63, 'hgbc_early_stopping': True, 'hgbc_validation_fraction': 0.25, 'hgbc_n_iter_no_change': 10}. Best is trial 8 with value: 0.991666.[0m
[32m[I 2022-10-20 04:32:33,963][0m Trial 34 finished with value: 0.9916636806165977 and parameters: {'hgbc_learning_rate': 0.08145270383281886, 'hgbc_max_iter': 2000, 'hgbc_min_samples_leaf': 29, 'hgbc_l2_regularization': 0.2, 'hgbc_max_bins': 63, 'hgbc_early_stopping': True, 'hgbc_validation_fraction': 0.25, 'hgbc_n_iter_no_change': 10}. Best is trial 8 with value: 0.991666.[0m
[32m[I 2022-10-20 04:32:41,261][0m Trial 26 finished with value: 0.9916251045205565 and parameters: {'hgbc_learning_rate': 0.004974541845522577, 'hgbc_max_iter': 2000, 'hgbc_min_samples_leaf': 45, 'hgbc_l2_regularization': 0.6000000000000001, 'hgbc_max_bins': 63, 'hgbc_early_stopping': True, 'hgbc_validation_fraction': 0.25, 'hgbc_n_iter_no_change': 10}. Best is trial 8 with value: 0.991666.[0m
[32m[I 2022-10-20 04:32:42,047][0m Trial 36 finished with value: 0.9916719330775463 and parameters: {'hgbc_learning_rate': 0.4414591374583654, 'hgbc_max_iter': 2000, 'hgbc_min_samples_leaf': 30, 'hgbc_l2_regularization': 0.0, 'hgbc_max_bins': 127, 'hgbc_early_stopping': True, 'hgbc_validation_fraction': 0.25, 'hgbc_n_iter_no_change': 10}. Best is trial 36 with value: 0.991672.[0m
[32m[I 2022-10-20 04:32:58,894][0m Trial 38 finished with value: 0.99167219702961 and parameters: {'hgbc_learning_rate': 0.3544662216461745, 'hgbc_max_iter': 2000, 'hgbc_min_samples_leaf': 29, 'hgbc_l2_regularization': 0.2, 'hgbc_max_bins': 63, 'hgbc_early_stopping': True, 'hgbc_validation_fraction': 0.25, 'hgbc_n_iter_no_change': 10}. Best is trial 38 with value: 0.991672.[0m
[32m[I 2022-10-20 04:32:59,520][0m Trial 35 finished with value: 0.9916109976508298 and parameters: {'hgbc_learning_rate': 0.09066266168381257, 'hgbc_max_iter': 2000, 'hgbc_min_samples_leaf': 27, 'hgbc_l2_regularization': 0.2, 'hgbc_max_bins': 63, 'hgbc_early_stopping': True, 'hgbc_validation_fraction': 0.25, 'hgbc_n_iter_no_change': 10}. Best is trial 38 with value: 0.991672.[0m
[32m[I 2022-10-20 04:33:03,220][0m Trial 37 finished with value: 0.9916736894348399 and parameters: {'hgbc_learning_rate': 0.35112609074826356, 'hgbc_max_iter': 2000, 'hgbc_min_samples_leaf': 29, 'hgbc_l2_regularization': 0.0, 'hgbc_max_bins': 127, 'hgbc_early_stopping': True, 'hgbc_validation_fraction': 0.25, 'hgbc_n_iter_no_change': 10}. Best is trial 37 with value: 0.991674.[0m
[32m[I 2022-10-20 04:33:04,647][0m Trial 39 finished with value: 0.9637911015262416 and parameters: {'hgbc_learning_rate': 0.38228904591735213, 'hgbc_max_iter': 2000, 'hgbc_min_samples_leaf': 29, 'hgbc_l2_regularization': 0.0, 'hgbc_max_bins': 127, 'hgbc_early_stopping': True, 'hgbc_validation_fraction': 0.25, 'hgbc_n_iter_no_change': 10}. Best is trial 37 with value: 0.991674.[0m
[32m[I 2022-10-20 04:33:18,005][0m Trial 42 finished with value: 0.982204274582622 and parameters: {'hgbc_learning_rate': 0.4164384682364066, 'hgbc_max_iter': 2000, 'hgbc_min_samples_leaf': 37, 'hgbc_l2_regularization': 0.0, 'hgbc_max_bins': 127, 'hgbc_early_stopping': True, 'hgbc_validation_fraction': 0.25, 'hgbc_n_iter_no_change': 10}. Best is trial 37 with value: 0.991674.[0m
[32m[I 2022-10-20 04:33:18,174][0m Trial 43 finished with value: 0.8795040105038165 and parameters: {'hgbc_learning_rate': 0.7140717123436381, 'hgbc_max_iter': 2000, 'hgbc_min_samples_leaf': 37, 'hgbc_l2_regularization': 0.0, 'hgbc_max_bins': 127, 'hgbc_early_stopping': True, 'hgbc_validation_fraction': 0.25, 'hgbc_n_iter_no_change': 10}. Best is trial 37 with value: 0.991674.[0m
[32m[I 2022-10-20 04:33:21,001][0m Trial 40 finished with value: 0.9915676873678644 and parameters: {'hgbc_learning_rate': 0.45576424226272244, 'hgbc_max_iter': 2000, 'hgbc_min_samples_leaf': 29, 'hgbc_l2_regularization': 0.0, 'hgbc_max_bins': 127, 'hgbc_early_stopping': True, 'hgbc_validation_fraction': 0.25, 'hgbc_n_iter_no_change': 10}. Best is trial 37 with value: 0.991674.[0m
[32m[I 2022-10-20 04:33:23,447][0m Trial 41 finished with value: 0.991642519444868 and parameters: {'hgbc_learning_rate': 0.41889222987969377, 'hgbc_max_iter': 2000, 'hgbc_min_samples_leaf': 30, 'hgbc_l2_regularization': 0.0, 'hgbc_max_bins': 127, 'hgbc_early_stopping': True, 'hgbc_validation_fraction': 0.25, 'hgbc_n_iter_no_change': 10}. Best is trial 37 with value: 0.991674.[0m
[32m[I 2022-10-20 04:33:42,038][0m Trial 47 finished with value: 0.9915653540287936 and parameters: {'hgbc_learning_rate': 0.27999958129168756, 'hgbc_max_iter': 2000, 'hgbc_min_samples_leaf': 33, 'hgbc_l2_regularization': 0.4, 'hgbc_max_bins': 127, 'hgbc_early_stopping': True, 'hgbc_validation_fraction': 0.25, 'hgbc_n_iter_no_change': 10}. Best is trial 37 with value: 0.991674.[0m
[32m[I 2022-10-20 04:33:42,038][0m Trial 45 finished with value: 0.9916656007117597 and parameters: {'hgbc_learning_rate': 0.4017859707078199, 'hgbc_max_iter': 2000, 'hgbc_min_samples_leaf': 34, 'hgbc_l2_regularization': 0.0, 'hgbc_max_bins': 127, 'hgbc_early_stopping': True, 'hgbc_validation_fraction': 0.25, 'hgbc_n_iter_no_change': 10}. Best is trial 37 with value: 0.991674.[0m
[32m[I 2022-10-20 04:33:47,601][0m Trial 44 finished with value: 0.991665040547875 and parameters: {'hgbc_learning_rate': 0.34344245366790294, 'hgbc_max_iter': 2000, 'hgbc_min_samples_leaf': 33, 'hgbc_l2_regularization': 0.0, 'hgbc_max_bins': 127, 'hgbc_early_stopping': True, 'hgbc_validation_fraction': 0.25, 'hgbc_n_iter_no_change': 10}. Best is trial 37 with value: 0.991674.[0m
[32m[I 2022-10-20 04:33:52,223][0m Trial 46 finished with value: 0.9916031236400225 and parameters: {'hgbc_learning_rate': 0.2702835718226089, 'hgbc_max_iter': 2000, 'hgbc_min_samples_leaf': 33, 'hgbc_l2_regularization': 0.0, 'hgbc_max_bins': 127, 'hgbc_early_stopping': True, 'hgbc_validation_fraction': 0.25, 'hgbc_n_iter_no_change': 10}. Best is trial 37 with value: 0.991674.[0m
[32m[I 2022-10-20 04:34:00,764][0m Trial 49 finished with value: 0.9915738716365404 and parameters: {'hgbc_learning_rate': 0.6069319680217657, 'hgbc_max_iter': 2000, 'hgbc_min_samples_leaf': 26, 'hgbc_l2_regularization': 0.0, 'hgbc_max_bins': 127, 'hgbc_early_stopping': True, 'hgbc_validation_fraction': 0.25, 'hgbc_n_iter_no_change': 10}. Best is trial 37 with value: 0.991674.[0m
[32m[I 2022-10-20 04:34:01,323][0m Trial 50 finished with value: 0.9062441713381776 and parameters: {'hgbc_learning_rate': 0.961296684087335, 'hgbc_max_iter': 2000, 'hgbc_min_samples_leaf': 26, 'hgbc_l2_regularization': 0.0, 'hgbc_max_bins': 127, 'hgbc_early_stopping': True, 'hgbc_validation_fraction': 0.25, 'hgbc_n_iter_no_change': 10}. Best is trial 37 with value: 0.991674.[0m
[32m[I 2022-10-20 04:34:05,991][0m Trial 51 finished with value: 0.6056162679497258 and parameters: {'hgbc_learning_rate': 0.9583971986983968, 'hgbc_max_iter': 2000, 'hgbc_min_samples_leaf': 26, 'hgbc_l2_regularization': 0.0, 'hgbc_max_bins': 127, 'hgbc_early_stopping': True, 'hgbc_validation_fraction': 0.25, 'hgbc_n_iter_no_change': 10}. Best is trial 37 with value: 0.991674.[0m
[32m[I 2022-10-20 04:34:20,869][0m Trial 28 finished with value: 0.9916024340911604 and parameters: {'hgbc_learning_rate': 0.0071290956560976825, 'hgbc_max_iter': 2000, 'hgbc_min_samples_leaf': 46, 'hgbc_l2_regularization': 0.2, 'hgbc_max_bins': 63, 'hgbc_early_stopping': True, 'hgbc_validation_fraction': 0.25, 'hgbc_n_iter_no_change': 10}. Best is trial 37 with value: 0.991674.[0m
[32m[I 2022-10-20 04:34:30,794][0m Trial 53 finished with value: 0.9915959350976465 and parameters: {'hgbc_learning_rate': 0.15176161075610736, 'hgbc_max_iter': 2000, 'hgbc_min_samples_leaf': 36, 'hgbc_l2_regularization': 0.2, 'hgbc_max_bins': 255, 'hgbc_early_stopping': True, 'hgbc_validation_fraction': 0.25, 'hgbc_n_iter_no_change': 10}. Best is trial 37 with value: 0.991674.[0m
[32m[I 2022-10-20 04:34:33,895][0m Trial 48 finished with value: 0.991628311380323 and parameters: {'hgbc_learning_rate': 0.14899332026156895, 'hgbc_max_iter': 2000, 'hgbc_min_samples_leaf': 36, 'hgbc_l2_regularization': 0.0, 'hgbc_max_bins': 127, 'hgbc_early_stopping': True, 'hgbc_validation_fraction': 0.25, 'hgbc_n_iter_no_change': 10}. Best is trial 37 with value: 0.991674.[0m
[32m[I 2022-10-20 04:34:38,067][0m Trial 54 finished with value: 0.9915945948831086 and parameters: {'hgbc_learning_rate': 0.16947873048323708, 'hgbc_max_iter': 2000, 'hgbc_min_samples_leaf': 35, 'hgbc_l2_regularization': 0.2, 'hgbc_max_bins': 255, 'hgbc_early_stopping': True, 'hgbc_validation_fraction': 0.25, 'hgbc_n_iter_no_change': 10}. Best is trial 37 with value: 0.991674.[0m
[32m[I 2022-10-20 04:34:51,111][0m Trial 58 finished with value: 0.9326241590992774 and parameters: {'hgbc_learning_rate': 0.6538457371526005, 'hgbc_max_iter': 2000, 'hgbc_min_samples_leaf': 40, 'hgbc_l2_regularization': 0.0, 'hgbc_max_bins': 127, 'hgbc_early_stopping': True, 'hgbc_validation_fraction': 0.25, 'hgbc_n_iter_no_change': 10}. Best is trial 37 with value: 0.991674.[0m
[32m[I 2022-10-20 04:34:55,408][0m Trial 56 finished with value: 0.9915820793042228 and parameters: {'hgbc_learning_rate': 0.21749378850900597, 'hgbc_max_iter': 2000, 'hgbc_min_samples_leaf': 35, 'hgbc_l2_regularization': 0.4, 'hgbc_max_bins': 127, 'hgbc_early_stopping': True, 'hgbc_validation_fraction': 0.25, 'hgbc_n_iter_no_change': 10}. Best is trial 37 with value: 0.991674.[0m
