[32m[I 2022-10-20 13:40:20,582][0m Trial 26 finished with value: 0.9889144854294368 and parameters: {'mlpc_hidden_layer_count': 3, 'mlpc_learning_rate': 'constant', 'mlpc_learning_rate_init': 1.1280887117080072e-05, 'mplc_max_iter': 2000}. Best is trial 32 with value: 0.990458.[0m
[32m[I 2022-10-20 13:40:20,836][0m sklearn.model_selection.train_test_split: running accelerated version on CPU[0m
[32m[I 2022-10-20 13:40:20,883][0m sklearn.model_selection.train_test_split: fallback to original Scikit-learn[0m
[32m[I 2022-10-20 13:40:33,506][0m Trial 27 finished with value: 0.988996524635944 and parameters: {'mlpc_hidden_layer_count': 3, 'mlpc_learning_rate': 'constant', 'mlpc_learning_rate_init': 1.2351012477378152e-05, 'mplc_max_iter': 2000}. Best is trial 32 with value: 0.990458.[0m
[32m[I 2022-10-20 13:40:33,744][0m sklearn.model_selection.train_test_split: running accelerated version on CPU[0m
[32m[I 2022-10-20 13:40:33,794][0m sklearn.model_selection.train_test_split: fallback to original Scikit-learn[0m
[32m[I 2022-10-20 13:42:04,200][0m Trial 38 finished with value: 0.99022797663738 and parameters: {'mlpc_hidden_layer_count': 1, 'mlpc_learning_rate': 'constant', 'mlpc_learning_rate_init': 2.7339035682684624e-05, 'mplc_max_iter': 2000}. Best is trial 32 with value: 0.990458.[0m
[32m[I 2022-10-20 13:42:04,436][0m sklearn.model_selection.train_test_split: running accelerated version on CPU[0m
[32m[I 2022-10-20 13:42:04,471][0m sklearn.model_selection.train_test_split: fallback to original Scikit-learn[0m
[32m[I 2022-10-20 13:42:06,700][0m Trial 40 finished with value: 0.9821444044910198 and parameters: {'mlpc_hidden_layer_count': 1, 'mlpc_learning_rate': 'constant', 'mlpc_learning_rate_init': 0.0005209735675752622, 'mplc_max_iter': 2000}. Best is trial 32 with value: 0.990458.[0m
[32m[I 2022-10-20 13:42:06,946][0m sklearn.model_selection.train_test_split: running accelerated version on CPU[0m
[32m[I 2022-10-20 13:42:06,993][0m sklearn.model_selection.train_test_split: fallback to original Scikit-learn[0m
[32m[I 2022-10-20 13:43:33,318][0m Trial 42 finished with value: 0.988366819077212 and parameters: {'mlpc_hidden_layer_count': 1, 'mlpc_learning_rate': 'constant', 'mlpc_learning_rate_init': 0.000529574291382297, 'mplc_max_iter': 2000}. Best is trial 32 with value: 0.990458.[0m
[32m[I 2022-10-20 13:43:33,563][0m sklearn.model_selection.train_test_split: running accelerated version on CPU[0m
[32m[I 2022-10-20 13:43:33,595][0m sklearn.model_selection.train_test_split: fallback to original Scikit-learn[0m
[32m[I 2022-10-20 13:43:56,571][0m Trial 29 finished with value: 0.9895606033895322 and parameters: {'mlpc_hidden_layer_count': 3, 'mlpc_learning_rate': 'constant', 'mlpc_learning_rate_init': 7.206774865776154e-06, 'mplc_max_iter': 2000}. Best is trial 32 with value: 0.990458.[0m
[32m[I 2022-10-20 13:43:56,806][0m sklearn.model_selection.train_test_split: running accelerated version on CPU[0m
[32m[I 2022-10-20 13:43:56,853][0m sklearn.model_selection.train_test_split: fallback to original Scikit-learn[0m
[32m[I 2022-10-20 13:44:38,241][0m Trial 41 finished with value: 0.9888410728199178 and parameters: {'mlpc_hidden_layer_count': 1, 'mlpc_learning_rate': 'constant', 'mlpc_learning_rate_init': 0.00036137861851284666, 'mplc_max_iter': 2000}. Best is trial 32 with value: 0.990458.[0m
[32m[I 2022-10-20 13:44:38,501][0m sklearn.model_selection.train_test_split: running accelerated version on CPU[0m
[32m[I 2022-10-20 13:44:38,548][0m sklearn.model_selection.train_test_split: fallback to original Scikit-learn[0m
[32m[I 2022-10-20 13:45:11,543][0m Trial 46 finished with value: 0.9812796153599177 and parameters: {'mlpc_hidden_layer_count': 1, 'mlpc_learning_rate': 'constant', 'mlpc_learning_rate_init': 0.0002409079357636637, 'mplc_max_iter': 2000}. Best is trial 32 with value: 0.990458.[0m
[32m[I 2022-10-20 13:45:11,762][0m sklearn.model_selection.train_test_split: running accelerated version on CPU[0m
[32m[I 2022-10-20 13:45:11,809][0m sklearn.model_selection.train_test_split: fallback to original Scikit-learn[0m
[32m[I 2022-10-20 13:45:21,073][0m Trial 44 finished with value: 0.9880744010683464 and parameters: {'mlpc_hidden_layer_count': 1, 'mlpc_learning_rate': 'constant', 'mlpc_learning_rate_init': 0.0017795807981219648, 'mplc_max_iter': 2000}. Best is trial 32 with value: 0.990458.[0m
[32m[I 2022-10-20 13:45:21,322][0m sklearn.model_selection.train_test_split: running accelerated version on CPU[0m
[32m[I 2022-10-20 13:45:21,369][0m sklearn.model_selection.train_test_split: fallback to original Scikit-learn[0m
[32m[I 2022-10-20 13:45:48,342][0m Trial 43 finished with value: 0.9869592404756798 and parameters: {'mlpc_hidden_layer_count': 1, 'mlpc_learning_rate': 'constant', 'mlpc_learning_rate_init': 0.00042185825641989774, 'mplc_max_iter': 2000}. Best is trial 32 with value: 0.990458.[0m
[32m[I 2022-10-20 13:45:48,593][0m sklearn.model_selection.train_test_split: running accelerated version on CPU[0m
[32m[I 2022-10-20 13:45:48,640][0m sklearn.model_selection.train_test_split: fallback to original Scikit-learn[0m
[32m[I 2022-10-20 13:45:59,636][0m Trial 45 finished with value: 0.9866593416694369 and parameters: {'mlpc_hidden_layer_count': 1, 'mlpc_learning_rate': 'constant', 'mlpc_learning_rate_init': 0.0003088008922453313, 'mplc_max_iter': 2000}. Best is trial 32 with value: 0.990458.[0m
[32m[I 2022-10-20 13:45:59,871][0m sklearn.model_selection.train_test_split: running accelerated version on CPU[0m
[32m[I 2022-10-20 13:45:59,921][0m sklearn.model_selection.train_test_split: fallback to original Scikit-learn[0m
[32m[I 2022-10-20 13:46:07,400][0m Trial 47 finished with value: 0.9415710982325897 and parameters: {'mlpc_hidden_layer_count': 1, 'mlpc_learning_rate': 'adaptive', 'mlpc_learning_rate_init': 0.003663136456389707, 'mplc_max_iter': 2000}. Best is trial 32 with value: 0.990458.[0m
[32m[I 2022-10-20 13:46:07,619][0m sklearn.model_selection.train_test_split: running accelerated version on CPU[0m
[32m[I 2022-10-20 13:46:07,674][0m sklearn.model_selection.train_test_split: fallback to original Scikit-learn[0m
[32m[I 2022-10-20 13:48:00,250][0m Trial 48 finished with value: 0.9878630049844841 and parameters: {'mlpc_hidden_layer_count': 1, 'mlpc_learning_rate': 'constant', 'mlpc_learning_rate_init': 0.0020460095303452544, 'mplc_max_iter': 2000}. Best is trial 32 with value: 0.990458.[0m
[32m[I 2022-10-20 13:48:00,485][0m sklearn.model_selection.train_test_split: running accelerated version on CPU[0m
[32m[I 2022-10-20 13:48:00,532][0m sklearn.model_selection.train_test_split: fallback to original Scikit-learn[0m
[32m[I 2022-10-20 13:48:41,799][0m Trial 39 finished with value: 0.9898061317467014 and parameters: {'mlpc_hidden_layer_count': 1, 'mlpc_learning_rate': 'constant', 'mlpc_learning_rate_init': 3.881547839536499e-06, 'mplc_max_iter': 2000}. Best is trial 32 with value: 0.990458.[0m
[32m[I 2022-10-20 13:48:42,071][0m sklearn.model_selection.train_test_split: running accelerated version on CPU[0m
[32m[I 2022-10-20 13:48:42,117][0m sklearn.model_selection.train_test_split: fallback to original Scikit-learn[0m
[32m[I 2022-10-20 13:49:28,974][0m Trial 49 finished with value: 0.9897866044851432 and parameters: {'mlpc_hidden_layer_count': 1, 'mlpc_learning_rate': 'constant', 'mlpc_learning_rate_init': 0.0014685771407157028, 'mplc_max_iter': 2000}. Best is trial 32 with value: 0.990458.[0m
[32m[I 2022-10-20 13:49:29,228][0m sklearn.model_selection.train_test_split: running accelerated version on CPU[0m
[32m[I 2022-10-20 13:49:29,260][0m sklearn.model_selection.train_test_split: fallback to original Scikit-learn[0m
[32m[I 2022-10-20 13:49:32,231][0m Trial 50 finished with value: 0.987530661152116 and parameters: {'mlpc_hidden_layer_count': 1, 'mlpc_learning_rate': 'constant', 'mlpc_learning_rate_init': 0.0017471539519225675, 'mplc_max_iter': 2000}. Best is trial 32 with value: 0.990458.[0m
[32m[I 2022-10-20 13:49:32,466][0m sklearn.model_selection.train_test_split: running accelerated version on CPU[0m
[32m[I 2022-10-20 13:49:32,513][0m sklearn.model_selection.train_test_split: fallback to original Scikit-learn[0m
[32m[I 2022-10-20 13:51:52,109][0m Trial 51 finished with value: 0.9901022570224963 and parameters: {'mlpc_hidden_layer_count': 1, 'mlpc_learning_rate': 'constant', 'mlpc_learning_rate_init': 2.514399085886995e-05, 'mplc_max_iter': 2000}. Best is trial 32 with value: 0.990458.[0m
[32m[I 2022-10-20 13:51:52,376][0m sklearn.model_selection.train_test_split: running accelerated version on CPU[0m
[32m[I 2022-10-20 13:51:52,407][0m sklearn.model_selection.train_test_split: fallback to original Scikit-learn[0m
[32m[I 2022-10-20 13:52:21,030][0m Trial 52 finished with value: 0.9903665732092128 and parameters: {'mlpc_hidden_layer_count': 1, 'mlpc_learning_rate': 'invscaling', 'mlpc_learning_rate_init': 2.115230687245601e-05, 'mplc_max_iter': 2000}. Best is trial 32 with value: 0.990458.[0m
[32m[I 2022-10-20 13:52:21,274][0m sklearn.model_selection.train_test_split: running accelerated version on CPU[0m
[32m[I 2022-10-20 13:52:21,307][0m sklearn.model_selection.train_test_split: fallback to original Scikit-learn[0m
[32m[I 2022-10-20 13:53:00,446][0m Trial 53 finished with value: 0.9904570282602416 and parameters: {'mlpc_hidden_layer_count': 1, 'mlpc_learning_rate': 'invscaling', 'mlpc_learning_rate_init': 2.321220176266348e-05, 'mplc_max_iter': 2000}. Best is trial 32 with value: 0.990458.[0m
[32m[I 2022-10-20 13:53:00,681][0m sklearn.model_selection.train_test_split: running accelerated version on CPU[0m
[32m[I 2022-10-20 13:53:00,727][0m sklearn.model_selection.train_test_split: fallback to original Scikit-learn[0m
[32m[I 2022-10-20 13:53:08,844][0m Trial 57 finished with value: 0.9871488533097368 and parameters: {'mlpc_hidden_layer_count': 1, 'mlpc_learning_rate': 'invscaling', 'mlpc_learning_rate_init': 2.293293029371847e-05, 'mplc_max_iter': 2000}. Best is trial 32 with value: 0.990458.[0m
[32m[I 2022-10-20 13:53:09,105][0m sklearn.model_selection.train_test_split: running accelerated version on CPU[0m
[32m[I 2022-10-20 13:53:09,140][0m sklearn.model_selection.train_test_split: fallback to original Scikit-learn[0m
[32m[I 2022-10-20 13:55:51,631][0m Trial 59 finished with value: 0.9851012064465892 and parameters: {'mlpc_hidden_layer_count': 1, 'mlpc_learning_rate': 'invscaling', 'mlpc_learning_rate_init': 2.1496688053102536e-05, 'mplc_max_iter': 2000}. Best is trial 32 with value: 0.990458.[0m
[32m[I 2022-10-20 13:55:51,882][0m sklearn.model_selection.train_test_split: running accelerated version on CPU[0m
[32m[I 2022-10-20 13:55:51,914][0m sklearn.model_selection.train_test_split: fallback to original Scikit-learn[0m
[32m[I 2022-10-20 13:58:39,945][0m Trial 56 finished with value: 0.9910542178067993 and parameters: {'mlpc_hidden_layer_count': 1, 'mlpc_learning_rate': 'invscaling', 'mlpc_learning_rate_init': 2.3152249462093616e-05, 'mplc_max_iter': 2000}. Best is trial 56 with value: 0.991054.[0m
[32m[I 2022-10-20 13:58:40,186][0m sklearn.model_selection.train_test_split: running accelerated version on CPU[0m
[32m[I 2022-10-20 13:58:40,218][0m sklearn.model_selection.train_test_split: fallback to original Scikit-learn[0m
[32m[I 2022-10-20 14:01:04,269][0m Trial 55 finished with value: 0.989721572649194 and parameters: {'mlpc_hidden_layer_count': 1, 'mlpc_learning_rate': 'invscaling', 'mlpc_learning_rate_init': 3.601702368354947e-06, 'mplc_max_iter': 2000}. Best is trial 56 with value: 0.991054.[0m
[32m[I 2022-10-20 14:01:04,536][0m sklearn.model_selection.train_test_split: running accelerated version on CPU[0m
[32m[I 2022-10-20 14:01:04,584][0m sklearn.model_selection.train_test_split: fallback to original Scikit-learn[0m
[32m[I 2022-10-20 14:02:21,555][0m Trial 54 finished with value: 0.9893810717165777 and parameters: {'mlpc_hidden_layer_count': 1, 'mlpc_learning_rate': 'invscaling', 'mlpc_learning_rate_init': 2.6672922984540034e-06, 'mplc_max_iter': 2000}. Best is trial 56 with value: 0.991054.[0m
[32m[I 2022-10-20 14:02:21,790][0m sklearn.model_selection.train_test_split: running accelerated version on CPU[0m
[32m[I 2022-10-20 14:02:21,821][0m sklearn.model_selection.train_test_split: fallback to original Scikit-learn[0m
[32m[I 2022-10-20 14:02:39,627][0m Trial 58 finished with value: 0.9886327432819437 and parameters: {'mlpc_hidden_layer_count': 1, 'mlpc_learning_rate': 'constant', 'mlpc_learning_rate_init': 2.916522249239713e-06, 'mplc_max_iter': 2000}. Best is trial 56 with value: 0.991054.[0m
[32m[I 2022-10-20 14:02:39,861][0m sklearn.model_selection.train_test_split: running accelerated version on CPU[0m
[32m[I 2022-10-20 14:02:39,909][0m sklearn.model_selection.train_test_split: fallback to original Scikit-learn[0m
[32m[I 2022-10-20 14:05:34,924][0m Trial 60 finished with value: 0.989485716350338 and parameters: {'mlpc_hidden_layer_count': 1, 'mlpc_learning_rate': 'invscaling', 'mlpc_learning_rate_init': 3.1677310920379465e-06, 'mplc_max_iter': 2000}. Best is trial 56 with value: 0.991054.[0m
[32m[I 2022-10-20 14:05:35,183][0m sklearn.model_selection.train_test_split: running accelerated version on CPU[0m
[32m[I 2022-10-20 14:05:35,230][0m sklearn.model_selection.train_test_split: fallback to original Scikit-learn[0m
[32m[I 2022-10-20 14:06:09,299][0m Trial 61 finished with value: 0.9887806788863818 and parameters: {'mlpc_hidden_layer_count': 1, 'mlpc_learning_rate': 'invscaling', 'mlpc_learning_rate_init': 2.9624458476980333e-06, 'mplc_max_iter': 2000}. Best is trial 56 with value: 0.991054.[0m
[32m[I 2022-10-20 14:06:09,550][0m sklearn.model_selection.train_test_split: running accelerated version on CPU[0m
[32m[I 2022-10-20 14:06:09,598][0m sklearn.model_selection.train_test_split: fallback to original Scikit-learn[0m
[32m[I 2022-10-20 14:06:33,913][0m Trial 63 finished with value: 0.9879782077561369 and parameters: {'mlpc_hidden_layer_count': 1, 'mlpc_learning_rate': 'invscaling', 'mlpc_learning_rate_init': 3.399148356936519e-06, 'mplc_max_iter': 2000}. Best is trial 56 with value: 0.991054.[0m
[32m[I 2022-10-20 14:06:34,169][0m sklearn.model_selection.train_test_split: running accelerated version on CPU[0m
[32m[I 2022-10-20 14:06:34,233][0m sklearn.model_selection.train_test_split: fallback to original Scikit-learn[0m
[32m[I 2022-10-20 14:07:12,800][0m Trial 62 finished with value: 0.9902268759348767 and parameters: {'mlpc_hidden_layer_count': 1, 'mlpc_learning_rate': 'invscaling', 'mlpc_learning_rate_init': 3.686315648982905e-06, 'mplc_max_iter': 2000}. Best is trial 56 with value: 0.991054.[0m
[32m[I 2022-10-20 14:07:13,036][0m sklearn.model_selection.train_test_split: running accelerated version on CPU[0m
[32m[I 2022-10-20 14:07:13,068][0m sklearn.model_selection.train_test_split: fallback to original Scikit-learn[0m
[32m[I 2022-10-20 14:09:38,767][0m Trial 70 finished with value: 0.9843586139096099 and parameters: {'mlpc_hidden_layer_count': 1, 'mlpc_learning_rate': 'invscaling', 'mlpc_learning_rate_init': 6.946703021079123e-05, 'mplc_max_iter': 2000}. Best is trial 56 with value: 0.991054.[0m
[32m[I 2022-10-20 14:09:39,005][0m sklearn.model_selection.train_test_split: running accelerated version on CPU[0m
[32m[I 2022-10-20 14:09:39,052][0m sklearn.model_selection.train_test_split: fallback to original Scikit-learn[0m
[32m[I 2022-10-20 14:09:46,792][0m Trial 69 finished with value: 0.9865768036795801 and parameters: {'mlpc_hidden_layer_count': 1, 'mlpc_learning_rate': 'invscaling', 'mlpc_learning_rate_init': 4.9061509931011306e-05, 'mplc_max_iter': 2000}. Best is trial 56 with value: 0.991054.[0m
[32m[I 2022-10-20 14:09:47,028][0m sklearn.model_selection.train_test_split: running accelerated version on CPU[0m
[32m[I 2022-10-20 14:09:47,067][0m sklearn.model_selection.train_test_split: fallback to original Scikit-learn[0m
[32m[I 2022-10-20 14:09:57,068][0m Trial 68 finished with value: 0.987701112111461 and parameters: {'mlpc_hidden_layer_count': 1, 'mlpc_learning_rate': 'invscaling', 'mlpc_learning_rate_init': 4.68612216528263e-05, 'mplc_max_iter': 2000}. Best is trial 56 with value: 0.991054.[0m
[32m[I 2022-10-20 14:09:57,321][0m sklearn.model_selection.train_test_split: running accelerated version on CPU[0m
[32m[I 2022-10-20 14:09:57,363][0m sklearn.model_selection.train_test_split: fallback to original Scikit-learn[0m
[32m[I 2022-10-20 14:14:16,546][0m Trial 65 finished with value: 0.988312733096698 and parameters: {'mlpc_hidden_layer_count': 1, 'mlpc_learning_rate': 'invscaling', 'mlpc_learning_rate_init': 2.5666854758652567e-06, 'mplc_max_iter': 2000}. Best is trial 56 with value: 0.991054.[0m
[32m[I 2022-10-20 14:14:16,817][0m sklearn.model_selection.train_test_split: running accelerated version on CPU[0m
[32m[I 2022-10-20 14:14:16,849][0m sklearn.model_selection.train_test_split: fallback to original Scikit-learn[0m
[32m[I 2022-10-20 14:14:29,086][0m Trial 73 finished with value: 0.2844441188051378 and parameters: {'mlpc_hidden_layer_count': 2, 'mlpc_learning_rate': 'invscaling', 'mlpc_learning_rate_init': 0.0927104190848415, 'mplc_max_iter': 2000}. Best is trial 56 with value: 0.991054.[0m
[32m[I 2022-10-20 14:14:29,322][0m sklearn.model_selection.train_test_split: running accelerated version on CPU[0m
[32m[I 2022-10-20 14:14:29,370][0m sklearn.model_selection.train_test_split: fallback to original Scikit-learn[0m
[32m[I 2022-10-20 14:16:16,225][0m Trial 64 finished with value: 0.9843829237798125 and parameters: {'mlpc_hidden_layer_count': 1, 'mlpc_learning_rate': 'invscaling', 'mlpc_learning_rate_init': 1.0832385027641173e-06, 'mplc_max_iter': 2000}. Best is trial 56 with value: 0.991054.[0m
[32m[I 2022-10-20 14:16:16,507][0m sklearn.model_selection.train_test_split: running accelerated version on CPU[0m
[32m[I 2022-10-20 14:16:16,555][0m sklearn.model_selection.train_test_split: fallback to original Scikit-learn[0m
[32m[I 2022-10-20 14:17:37,397][0m Trial 67 finished with value: 0.9871704904196953 and parameters: {'mlpc_hidden_layer_count': 2, 'mlpc_learning_rate': 'invscaling', 'mlpc_learning_rate_init': 5.286848947042608e-05, 'mplc_max_iter': 2000}. Best is trial 56 with value: 0.991054.[0m
[32m[I 2022-10-20 14:17:37,635][0m sklearn.model_selection.train_test_split: running accelerated version on CPU[0m
[32m[I 2022-10-20 14:17:37,683][0m sklearn.model_selection.train_test_split: fallback to original Scikit-learn[0m
[32m[I 2022-10-20 14:18:45,677][0m Trial 72 finished with value: 0.9732039359496044 and parameters: {'mlpc_hidden_layer_count': 2, 'mlpc_learning_rate': 'invscaling', 'mlpc_learning_rate_init': 4.623581693759718e-05, 'mplc_max_iter': 2000}. Best is trial 56 with value: 0.991054.[0m
[32m[I 2022-10-20 14:18:45,927][0m sklearn.model_selection.train_test_split: running accelerated version on CPU[0m
[32m[I 2022-10-20 14:18:45,973][0m sklearn.model_selection.train_test_split: fallback to original Scikit-learn[0m
[32m[I 2022-10-20 14:19:46,435][0m Trial 66 finished with value: 0.9842026160318695 and parameters: {'mlpc_hidden_layer_count': 1, 'mlpc_learning_rate': 'invscaling', 'mlpc_learning_rate_init': 1.0527213045102201e-06, 'mplc_max_iter': 2000}. Best is trial 56 with value: 0.991054.[0m
[32m[I 2022-10-20 14:19:46,692][0m sklearn.model_selection.train_test_split: running accelerated version on CPU[0m
[32m[I 2022-10-20 14:19:46,725][0m sklearn.model_selection.train_test_split: fallback to original Scikit-learn[0m
[32m[I 2022-10-20 14:21:32,577][0m Trial 78 finished with value: 0.9860021966599184 and parameters: {'mlpc_hidden_layer_count': 1, 'mlpc_learning_rate': 'adaptive', 'mlpc_learning_rate_init': 0.0001446176140400201, 'mplc_max_iter': 2000}. Best is trial 56 with value: 0.991054.[0m
[32m[I 2022-10-20 14:21:32,829][0m sklearn.model_selection.train_test_split: running accelerated version on CPU[0m
[32m[I 2022-10-20 14:21:32,877][0m sklearn.model_selection.train_test_split: fallback to original Scikit-learn[0m
[32m[I 2022-10-20 14:24:30,195][0m Trial 71 finished with value: 0.9843499206046727 and parameters: {'mlpc_hidden_layer_count': 1, 'mlpc_learning_rate': 'invscaling', 'mlpc_learning_rate_init': 1.033779813430062e-06, 'mplc_max_iter': 2000}. Best is trial 56 with value: 0.991054.[0m
[32m[I 2022-10-20 14:24:30,439][0m sklearn.model_selection.train_test_split: running accelerated version on CPU[0m
[32m[I 2022-10-20 14:24:30,487][0m sklearn.model_selection.train_test_split: fallback to original Scikit-learn[0m
[32m[I 2022-10-20 14:27:07,650][0m Trial 79 finished with value: 0.9900189076526076 and parameters: {'mlpc_hidden_layer_count': 1, 'mlpc_learning_rate': 'adaptive', 'mlpc_learning_rate_init': 7.846368739700267e-06, 'mplc_max_iter': 2000}. Best is trial 56 with value: 0.991054.[0m
[32m[I 2022-10-20 14:27:07,884][0m sklearn.model_selection.train_test_split: running accelerated version on CPU[0m
[32m[I 2022-10-20 14:27:07,931][0m sklearn.model_selection.train_test_split: fallback to original Scikit-learn[0m
[32m[I 2022-10-20 14:28:12,058][0m Trial 81 finished with value: 0.9900605239990821 and parameters: {'mlpc_hidden_layer_count': 1, 'mlpc_learning_rate': 'invscaling', 'mlpc_learning_rate_init': 1.6935509219940584e-05, 'mplc_max_iter': 2000}. Best is trial 56 with value: 0.991054.[0m
[32m[I 2022-10-20 14:28:12,395][0m sklearn.model_selection.train_test_split: running accelerated version on CPU[0m
[32m[I 2022-10-20 14:28:12,428][0m sklearn.model_selection.train_test_split: fallback to original Scikit-learn[0m
