[32m[I 2022-10-20 15:21:55,190][0m Trial 9 finished with value: 0.5106645279784664 and parameters: {'sgdc_loss': 'hinge', 'sgdc_penalty': 'elasticnet', 'sgdc_alpha': 0.001741592115564848, 'sgdc_l1_ratio': 0.6000000000000001, 'sgdc_learning_rate': 'optimal', 'sgdc_eta0': 106.31392800822722, 'sgdc_early_stopping': True, 'sgdc_validation_fraction': 0.25, 'sgdc_n_iter_no_change': 10}. Best is trial 7 with value: 0.579762.[0m
[32m[I 2022-10-20 15:21:57,470][0m Trial 10 finished with value: 0.594113558920827 and parameters: {'sgdc_loss': 'squared_hinge', 'sgdc_penalty': 'elasticnet', 'sgdc_alpha': 166.10756934835555, 'sgdc_l1_ratio': 0.2, 'sgdc_learning_rate': 'optimal', 'sgdc_eta0': 0.38758619820466195, 'sgdc_early_stopping': True, 'sgdc_validation_fraction': 0.25, 'sgdc_n_iter_no_change': 10}. Best is trial 10 with value: 0.594114.[0m
[32m[I 2022-10-20 15:21:58,659][0m Trial 13 finished with value: 0.408339467750265 and parameters: {'sgdc_loss': 'modified_huber', 'sgdc_penalty': 'elasticnet', 'sgdc_alpha': 1.3640597762776437e-05, 'sgdc_l1_ratio': 0.6000000000000001, 'sgdc_learning_rate': 'optimal', 'sgdc_eta0': 0.2675756617596706, 'sgdc_early_stopping': True, 'sgdc_validation_fraction': 0.25, 'sgdc_n_iter_no_change': 10}. Best is trial 10 with value: 0.594114.[0m
[32m[I 2022-10-20 15:21:59,478][0m Trial 14 finished with value: 0.4245302718359545 and parameters: {'sgdc_loss': 'log', 'sgdc_penalty': 'elasticnet', 'sgdc_alpha': 12.057193540952866, 'sgdc_l1_ratio': 0.6000000000000001, 'sgdc_learning_rate': 'invscaling', 'sgdc_eta0': 0.015680330080273877, 'sgdc_early_stopping': True, 'sgdc_validation_fraction': 0.25, 'sgdc_n_iter_no_change': 10}. Best is trial 10 with value: 0.594114.[0m
[32m[I 2022-10-20 15:22:03,968][0m Trial 15 finished with value: 0.1423863612585006 and parameters: {'sgdc_loss': 'hinge', 'sgdc_penalty': 'elasticnet', 'sgdc_alpha': 0.00015596862897396648, 'sgdc_l1_ratio': 0.0, 'sgdc_learning_rate': 'constant', 'sgdc_eta0': 0.5564468972787471, 'sgdc_early_stopping': True, 'sgdc_validation_fraction': 0.25, 'sgdc_n_iter_no_change': 10}. Best is trial 10 with value: 0.594114.[0m
[32m[I 2022-10-20 15:22:09,974][0m Trial 16 finished with value: 0.4878194258998859 and parameters: {'sgdc_loss': 'modified_huber', 'sgdc_penalty': 'elasticnet', 'sgdc_alpha': 31.642362276199723, 'sgdc_l1_ratio': 0.6000000000000001, 'sgdc_learning_rate': 'optimal', 'sgdc_eta0': 0.0011007898690302837, 'sgdc_early_stopping': True, 'sgdc_validation_fraction': 0.25, 'sgdc_n_iter_no_change': 10}. Best is trial 10 with value: 0.594114.[0m
[32m[I 2022-10-20 15:23:27,125][0m Trial 17 finished with value: 0.20024817153802868 and parameters: {'sgdc_loss': 'log', 'sgdc_penalty': 'elasticnet', 'sgdc_alpha': 637.2442774760061, 'sgdc_l1_ratio': 0.0, 'sgdc_learning_rate': 'adaptive', 'sgdc_eta0': 0.013577363672371919, 'sgdc_early_stopping': True, 'sgdc_validation_fraction': 0.25, 'sgdc_n_iter_no_change': 10}. Best is trial 10 with value: 0.594114.[0m
[32m[I 2022-10-20 15:23:33,035][0m Trial 18 finished with value: 0.6648543286096584 and parameters: {'sgdc_loss': 'squared_hinge', 'sgdc_penalty': 'elasticnet', 'sgdc_alpha': 441.1406658840069, 'sgdc_l1_ratio': 1.0, 'sgdc_learning_rate': 'adaptive', 'sgdc_eta0': 0.03479083520731838, 'sgdc_early_stopping': True, 'sgdc_validation_fraction': 0.25, 'sgdc_n_iter_no_change': 10}. Best is trial 18 with value: 0.664854.[0m
[32m[I 2022-10-20 15:23:41,851][0m Trial 1 finished with value: 0.6671648772847323 and parameters: {'sgdc_loss': 'hinge', 'sgdc_penalty': 'elasticnet', 'sgdc_alpha': 5.20536393509036e-06, 'sgdc_l1_ratio': 0.0, 'sgdc_learning_rate': 'adaptive', 'sgdc_eta0': 12.479663720273805, 'sgdc_early_stopping': True, 'sgdc_validation_fraction': 0.25, 'sgdc_n_iter_no_change': 10}. Best is trial 1 with value: 0.667165.[0m
[32m[I 2022-10-20 15:23:45,167][0m Trial 8 finished with value: 0.6716789128251682 and parameters: {'sgdc_loss': 'modified_huber', 'sgdc_penalty': 'elasticnet', 'sgdc_alpha': 7.082173497838458e-05, 'sgdc_l1_ratio': 0.6000000000000001, 'sgdc_learning_rate': 'adaptive', 'sgdc_eta0': 8.80778534671445, 'sgdc_early_stopping': True, 'sgdc_validation_fraction': 0.25, 'sgdc_n_iter_no_change': 10}. Best is trial 8 with value: 0.671679.[0m
[32m[I 2022-10-20 15:23:47,600][0m Trial 22 finished with value: 0.5524696697347821 and parameters: {'sgdc_loss': 'squared_hinge', 'sgdc_penalty': 'elasticnet', 'sgdc_alpha': 0.010075564865861383, 'sgdc_l1_ratio': 1.0, 'sgdc_learning_rate': 'invscaling', 'sgdc_eta0': 7.878964245947998, 'sgdc_early_stopping': True, 'sgdc_validation_fraction': 0.25, 'sgdc_n_iter_no_change': 10}. Best is trial 8 with value: 0.671679.[0m
[32m[I 2022-10-20 15:24:09,800][0m Trial 19 finished with value: 0.6652416867425132 and parameters: {'sgdc_loss': 'squared_hinge', 'sgdc_penalty': 'elasticnet', 'sgdc_alpha': 0.0003690278661919768, 'sgdc_l1_ratio': 1.0, 'sgdc_learning_rate': 'adaptive', 'sgdc_eta0': 2.1419394642954868, 'sgdc_early_stopping': True, 'sgdc_validation_fraction': 0.25, 'sgdc_n_iter_no_change': 10}. Best is trial 8 with value: 0.671679.[0m
[32m[I 2022-10-20 15:24:14,056][0m Trial 11 finished with value: 0.5383504721078901 and parameters: {'sgdc_loss': 'squared_hinge', 'sgdc_penalty': 'elasticnet', 'sgdc_alpha': 9.089987377610251e-05, 'sgdc_l1_ratio': 0.4, 'sgdc_learning_rate': 'adaptive', 'sgdc_eta0': 184.23914970194136, 'sgdc_early_stopping': True, 'sgdc_validation_fraction': 0.25, 'sgdc_n_iter_no_change': 10}. Best is trial 8 with value: 0.671679.[0m
[32m[I 2022-10-20 15:24:18,429][0m Trial 21 finished with value: 0.6650320404923808 and parameters: {'sgdc_loss': 'squared_hinge', 'sgdc_penalty': 'elasticnet', 'sgdc_alpha': 315.02042206027056, 'sgdc_l1_ratio': 1.0, 'sgdc_learning_rate': 'adaptive', 'sgdc_eta0': 7.234409375492666, 'sgdc_early_stopping': True, 'sgdc_validation_fraction': 0.25, 'sgdc_n_iter_no_change': 10}. Best is trial 8 with value: 0.671679.[0m
[32m[I 2022-10-20 15:24:18,602][0m Trial 20 finished with value: 0.6634368304653651 and parameters: {'sgdc_loss': 'squared_hinge', 'sgdc_penalty': 'elasticnet', 'sgdc_alpha': 787.6833947212177, 'sgdc_l1_ratio': 1.0, 'sgdc_learning_rate': 'adaptive', 'sgdc_eta0': 8.688906801785807, 'sgdc_early_stopping': True, 'sgdc_validation_fraction': 0.25, 'sgdc_n_iter_no_change': 10}. Best is trial 8 with value: 0.671679.[0m
[32m[I 2022-10-20 15:25:05,235][0m Trial 23 finished with value: 0.2713006493755783 and parameters: {'sgdc_loss': 'squared_hinge', 'sgdc_penalty': 'elasticnet', 'sgdc_alpha': 835.2472227845026, 'sgdc_l1_ratio': 0.4, 'sgdc_learning_rate': 'adaptive', 'sgdc_eta0': 0.057493824849145427, 'sgdc_early_stopping': True, 'sgdc_validation_fraction': 0.25, 'sgdc_n_iter_no_change': 10}. Best is trial 8 with value: 0.671679.[0m
[32m[I 2022-10-20 15:25:47,719][0m Trial 24 finished with value: 0.655669705723002 and parameters: {'sgdc_loss': 'hinge', 'sgdc_penalty': 'elasticnet', 'sgdc_alpha': 0.7074447742639912, 'sgdc_l1_ratio': 1.0, 'sgdc_learning_rate': 'adaptive', 'sgdc_eta0': 6.566220779085137, 'sgdc_early_stopping': True, 'sgdc_validation_fraction': 0.25, 'sgdc_n_iter_no_change': 10}. Best is trial 8 with value: 0.671679.[0m
[32m[I 2022-10-20 15:25:57,383][0m Trial 26 finished with value: 0.6717421404917574 and parameters: {'sgdc_loss': 'hinge', 'sgdc_penalty': 'elasticnet', 'sgdc_alpha': 6.438773912264046e-05, 'sgdc_l1_ratio': 0.4, 'sgdc_learning_rate': 'adaptive', 'sgdc_eta0': 6.197696851850899, 'sgdc_early_stopping': True, 'sgdc_validation_fraction': 0.25, 'sgdc_n_iter_no_change': 10}. Best is trial 26 with value: 0.671742.[0m
[32m[I 2022-10-20 15:26:20,774][0m Trial 29 finished with value: 0.6623732742788115 and parameters: {'sgdc_loss': 'hinge', 'sgdc_penalty': 'elasticnet', 'sgdc_alpha': 2.0077401079834768e-05, 'sgdc_l1_ratio': 0.4, 'sgdc_learning_rate': 'adaptive', 'sgdc_eta0': 1.7749488269249598, 'sgdc_early_stopping': True, 'sgdc_validation_fraction': 0.25, 'sgdc_n_iter_no_change': 10}. Best is trial 26 with value: 0.671742.[0m
[32m[I 2022-10-20 15:26:22,790][0m Trial 25 finished with value: 0.45766732304552304 and parameters: {'sgdc_loss': 'hinge', 'sgdc_penalty': 'elasticnet', 'sgdc_alpha': 4.8693696988035615e-05, 'sgdc_l1_ratio': 0.4, 'sgdc_learning_rate': 'adaptive', 'sgdc_eta0': 793.8941154491898, 'sgdc_early_stopping': True, 'sgdc_validation_fraction': 0.25, 'sgdc_n_iter_no_change': 10}. Best is trial 26 with value: 0.671742.[0m
[32m[I 2022-10-20 15:26:49,004][0m Trial 27 finished with value: 0.43957396949618355 and parameters: {'sgdc_loss': 'hinge', 'sgdc_penalty': 'elasticnet', 'sgdc_alpha': 4.607966907056656e-05, 'sgdc_l1_ratio': 0.4, 'sgdc_learning_rate': 'adaptive', 'sgdc_eta0': 996.0479878874539, 'sgdc_early_stopping': True, 'sgdc_validation_fraction': 0.25, 'sgdc_n_iter_no_change': 10}. Best is trial 26 with value: 0.671742.[0m
[32m[I 2022-10-20 15:26:59,657][0m Trial 28 finished with value: 0.5085376723409422 and parameters: {'sgdc_loss': 'hinge', 'sgdc_penalty': 'elasticnet', 'sgdc_alpha': 3.1816356728285036e-05, 'sgdc_l1_ratio': 0.4, 'sgdc_learning_rate': 'adaptive', 'sgdc_eta0': 800.3694112433207, 'sgdc_early_stopping': True, 'sgdc_validation_fraction': 0.25, 'sgdc_n_iter_no_change': 10}. Best is trial 26 with value: 0.671742.[0m
[32m[I 2022-10-20 15:27:00,369][0m Trial 30 finished with value: 0.439553709867222 and parameters: {'sgdc_loss': 'hinge', 'sgdc_penalty': 'elasticnet', 'sgdc_alpha': 4.679520358585065e-05, 'sgdc_l1_ratio': 0.4, 'sgdc_learning_rate': 'adaptive', 'sgdc_eta0': 949.927510223043, 'sgdc_early_stopping': True, 'sgdc_validation_fraction': 0.25, 'sgdc_n_iter_no_change': 10}. Best is trial 26 with value: 0.671742.[0m
[32m[I 2022-10-20 15:27:43,955][0m Trial 31 finished with value: 0.5470698181981793 and parameters: {'sgdc_loss': 'hinge', 'sgdc_penalty': 'elasticnet', 'sgdc_alpha': 2.8228463453205834e-05, 'sgdc_l1_ratio': 0.4, 'sgdc_learning_rate': 'adaptive', 'sgdc_eta0': 601.1850050507182, 'sgdc_early_stopping': True, 'sgdc_validation_fraction': 0.25, 'sgdc_n_iter_no_change': 10}. Best is trial 26 with value: 0.671742.[0m
[32m[I 2022-10-20 15:28:18,437][0m Trial 33 finished with value: 0.6587376072963536 and parameters: {'sgdc_loss': 'hinge', 'sgdc_penalty': 'elasticnet', 'sgdc_alpha': 3.4909926988715397e-05, 'sgdc_l1_ratio': 0.4, 'sgdc_learning_rate': 'adaptive', 'sgdc_eta0': 33.7913028393954, 'sgdc_early_stopping': True, 'sgdc_validation_fraction': 0.25, 'sgdc_n_iter_no_change': 10}. Best is trial 26 with value: 0.671742.[0m
[32m[I 2022-10-20 15:28:26,246][0m Trial 32 finished with value: 0.5280205325270036 and parameters: {'sgdc_loss': 'hinge', 'sgdc_penalty': 'elasticnet', 'sgdc_alpha': 3.067538756686856e-05, 'sgdc_l1_ratio': 0.4, 'sgdc_learning_rate': 'adaptive', 'sgdc_eta0': 665.1577980400638, 'sgdc_early_stopping': True, 'sgdc_validation_fraction': 0.25, 'sgdc_n_iter_no_change': 10}. Best is trial 26 with value: 0.671742.[0m
[32m[I 2022-10-20 15:28:58,655][0m Trial 35 finished with value: 0.6674045619386189 and parameters: {'sgdc_loss': 'hinge', 'sgdc_penalty': 'elasticnet', 'sgdc_alpha': 1.5627903921861687e-06, 'sgdc_l1_ratio': 0.0, 'sgdc_learning_rate': 'adaptive', 'sgdc_eta0': 26.93511617517247, 'sgdc_early_stopping': True, 'sgdc_validation_fraction': 0.25, 'sgdc_n_iter_no_change': 10}. Best is trial 26 with value: 0.671742.[0m
[32m[I 2022-10-20 15:29:11,320][0m Trial 34 finished with value: 0.6552073541031086 and parameters: {'sgdc_loss': 'hinge', 'sgdc_penalty': 'elasticnet', 'sgdc_alpha': 2.084476472532641e-06, 'sgdc_l1_ratio': 0.0, 'sgdc_learning_rate': 'adaptive', 'sgdc_eta0': 617.6966011620652, 'sgdc_early_stopping': True, 'sgdc_validation_fraction': 0.25, 'sgdc_n_iter_no_change': 10}. Best is trial 26 with value: 0.671742.[0m
[32m[I 2022-10-20 15:29:18,960][0m Trial 36 finished with value: 0.6638427405261094 and parameters: {'sgdc_loss': 'hinge', 'sgdc_penalty': 'elasticnet', 'sgdc_alpha': 1.2016608396277132e-06, 'sgdc_l1_ratio': 0.0, 'sgdc_learning_rate': 'adaptive', 'sgdc_eta0': 27.866816624937652, 'sgdc_early_stopping': True, 'sgdc_validation_fraction': 0.25, 'sgdc_n_iter_no_change': 10}. Best is trial 26 with value: 0.671742.[0m
[32m[I 2022-10-20 15:29:25,652][0m Trial 43 finished with value: 0.12388641062088446 and parameters: {'sgdc_loss': 'modified_huber', 'sgdc_penalty': 'elasticnet', 'sgdc_alpha': 4.301210519393577e-06, 'sgdc_l1_ratio': 0.0, 'sgdc_learning_rate': 'constant', 'sgdc_eta0': 22.415194045698815, 'sgdc_early_stopping': True, 'sgdc_validation_fraction': 0.25, 'sgdc_n_iter_no_change': 10}. Best is trial 26 with value: 0.671742.[0m
[32m[I 2022-10-20 15:29:33,392][0m Trial 44 finished with value: 0.4470218417329335 and parameters: {'sgdc_loss': 'modified_huber', 'sgdc_penalty': 'elasticnet', 'sgdc_alpha': 6.5277552700412295e-06, 'sgdc_l1_ratio': 0.2, 'sgdc_learning_rate': 'constant', 'sgdc_eta0': 3.2524317688905082, 'sgdc_early_stopping': True, 'sgdc_validation_fraction': 0.25, 'sgdc_n_iter_no_change': 10}. Best is trial 26 with value: 0.671742.[0m
[32m[I 2022-10-20 15:29:35,002][0m Trial 38 finished with value: 0.6664444197011655 and parameters: {'sgdc_loss': 'log', 'sgdc_penalty': 'elasticnet', 'sgdc_alpha': 1.0913803977829886e-06, 'sgdc_l1_ratio': 0.0, 'sgdc_learning_rate': 'adaptive', 'sgdc_eta0': 2.986279536984356, 'sgdc_early_stopping': True, 'sgdc_validation_fraction': 0.25, 'sgdc_n_iter_no_change': 10}. Best is trial 26 with value: 0.671742.[0m
[32m[I 2022-10-20 15:29:40,690][0m Trial 37 finished with value: 0.6616142586206378 and parameters: {'sgdc_loss': 'log', 'sgdc_penalty': 'elasticnet', 'sgdc_alpha': 4.1696947375154415e-06, 'sgdc_l1_ratio': 0.0, 'sgdc_learning_rate': 'adaptive', 'sgdc_eta0': 35.98743291437007, 'sgdc_early_stopping': True, 'sgdc_validation_fraction': 0.25, 'sgdc_n_iter_no_change': 10}. Best is trial 26 with value: 0.671742.[0m
[32m[I 2022-10-20 15:29:43,392][0m Trial 45 finished with value: 0.42399138061319214 and parameters: {'sgdc_loss': 'modified_huber', 'sgdc_penalty': 'elasticnet', 'sgdc_alpha': 0.028453448795586967, 'sgdc_l1_ratio': 0.2, 'sgdc_learning_rate': 'invscaling', 'sgdc_eta0': 2.919881490498775, 'sgdc_early_stopping': True, 'sgdc_validation_fraction': 0.25, 'sgdc_n_iter_no_change': 10}. Best is trial 26 with value: 0.671742.[0m
[32m[I 2022-10-20 15:29:50,844][0m Trial 46 finished with value: 0.4976859509855611 and parameters: {'sgdc_loss': 'log', 'sgdc_penalty': 'elasticnet', 'sgdc_alpha': 0.0044035744445323904, 'sgdc_l1_ratio': 0.8, 'sgdc_learning_rate': 'invscaling', 'sgdc_eta0': 3.487843384294974, 'sgdc_early_stopping': True, 'sgdc_validation_fraction': 0.25, 'sgdc_n_iter_no_change': 10}. Best is trial 26 with value: 0.671742.[0m
[32m[I 2022-10-20 15:29:53,799][0m Trial 47 finished with value: 0.2844441188051378 and parameters: {'sgdc_loss': 'modified_huber', 'sgdc_penalty': 'elasticnet', 'sgdc_alpha': 0.0037640249402291783, 'sgdc_l1_ratio': 0.8, 'sgdc_learning_rate': 'invscaling', 'sgdc_eta0': 15.327487277302911, 'sgdc_early_stopping': True, 'sgdc_validation_fraction': 0.25, 'sgdc_n_iter_no_change': 10}. Best is trial 26 with value: 0.671742.[0m
[32m[I 2022-10-20 15:30:07,381][0m Trial 39 finished with value: 0.6657622462558939 and parameters: {'sgdc_loss': 'log', 'sgdc_penalty': 'elasticnet', 'sgdc_alpha': 1.2712579262778673e-06, 'sgdc_l1_ratio': 0.8, 'sgdc_learning_rate': 'adaptive', 'sgdc_eta0': 3.380990925206399, 'sgdc_early_stopping': True, 'sgdc_validation_fraction': 0.25, 'sgdc_n_iter_no_change': 10}. Best is trial 26 with value: 0.671742.[0m
[32m[I 2022-10-20 15:30:40,548][0m Trial 40 finished with value: 0.6651508873464183 and parameters: {'sgdc_loss': 'log', 'sgdc_penalty': 'elasticnet', 'sgdc_alpha': 1.0660117448290056e-06, 'sgdc_l1_ratio': 0.8, 'sgdc_learning_rate': 'adaptive', 'sgdc_eta0': 2.7909121431258774, 'sgdc_early_stopping': True, 'sgdc_validation_fraction': 0.25, 'sgdc_n_iter_no_change': 10}. Best is trial 26 with value: 0.671742.[0m
[32m[I 2022-10-20 15:30:48,985][0m Trial 41 finished with value: 0.6599973073504686 and parameters: {'sgdc_loss': 'log', 'sgdc_penalty': 'elasticnet', 'sgdc_alpha': 0.00042803059195403655, 'sgdc_l1_ratio': 0.8, 'sgdc_learning_rate': 'adaptive', 'sgdc_eta0': 2.5562768480126024, 'sgdc_early_stopping': True, 'sgdc_validation_fraction': 0.25, 'sgdc_n_iter_no_change': 10}. Best is trial 26 with value: 0.671742.[0m
[32m[I 2022-10-20 15:31:03,415][0m Trial 53 finished with value: 0.4230330650992027 and parameters: {'sgdc_loss': 'log', 'sgdc_penalty': 'elasticnet', 'sgdc_alpha': 0.0002606613401231866, 'sgdc_l1_ratio': 0.2, 'sgdc_learning_rate': 'optimal', 'sgdc_eta0': 0.8617152311867678, 'sgdc_early_stopping': True, 'sgdc_validation_fraction': 0.25, 'sgdc_n_iter_no_change': 10}. Best is trial 26 with value: 0.671742.[0m
[32m[I 2022-10-20 15:31:07,641][0m Trial 54 finished with value: 0.546766784200158 and parameters: {'sgdc_loss': 'hinge', 'sgdc_penalty': 'elasticnet', 'sgdc_alpha': 0.0001485855353051342, 'sgdc_l1_ratio': 0.2, 'sgdc_learning_rate': 'optimal', 'sgdc_eta0': 0.8103003655378247, 'sgdc_early_stopping': True, 'sgdc_validation_fraction': 0.25, 'sgdc_n_iter_no_change': 10}. Best is trial 26 with value: 0.671742.[0m
[32m[I 2022-10-20 15:31:34,424][0m Trial 42 finished with value: 0.6677156034178272 and parameters: {'sgdc_loss': 'modified_huber', 'sgdc_penalty': 'elasticnet', 'sgdc_alpha': 2.6648998063594906e-06, 'sgdc_l1_ratio': 0.0, 'sgdc_learning_rate': 'adaptive', 'sgdc_eta0': 18.916593744620315, 'sgdc_early_stopping': True, 'sgdc_validation_fraction': 0.25, 'sgdc_n_iter_no_change': 10}. Best is trial 26 with value: 0.671742.[0m
[32m[I 2022-10-20 15:32:12,807][0m Trial 48 finished with value: 0.666869795149107 and parameters: {'sgdc_loss': 'log', 'sgdc_penalty': 'elasticnet', 'sgdc_alpha': 1.1522918796946314e-06, 'sgdc_l1_ratio': 0.2, 'sgdc_learning_rate': 'adaptive', 'sgdc_eta0': 3.6849547797939217, 'sgdc_early_stopping': True, 'sgdc_validation_fraction': 0.25, 'sgdc_n_iter_no_change': 10}. Best is trial 26 with value: 0.671742.[0m
[32m[I 2022-10-20 15:32:13,510][0m Trial 49 finished with value: 0.5616637642594912 and parameters: {'sgdc_loss': 'log', 'sgdc_penalty': 'elasticnet', 'sgdc_alpha': 0.0019642232999333973, 'sgdc_l1_ratio': 0.8, 'sgdc_learning_rate': 'adaptive', 'sgdc_eta0': 15.15267214782692, 'sgdc_early_stopping': True, 'sgdc_validation_fraction': 0.25, 'sgdc_n_iter_no_change': 10}. Best is trial 26 with value: 0.671742.[0m
[32m[I 2022-10-20 15:32:15,933][0m Trial 51 finished with value: 0.6646927095832926 and parameters: {'sgdc_loss': 'log', 'sgdc_penalty': 'elasticnet', 'sgdc_alpha': 1.076664055428005e-06, 'sgdc_l1_ratio': 0.2, 'sgdc_learning_rate': 'adaptive', 'sgdc_eta0': 1.1976651469203616, 'sgdc_early_stopping': True, 'sgdc_validation_fraction': 0.25, 'sgdc_n_iter_no_change': 10}. Best is trial 26 with value: 0.671742.[0m
[32m[I 2022-10-20 15:32:18,877][0m Trial 52 finished with value: 0.6517321208351511 and parameters: {'sgdc_loss': 'log', 'sgdc_penalty': 'elasticnet', 'sgdc_alpha': 0.0003995782345620182, 'sgdc_l1_ratio': 0.2, 'sgdc_learning_rate': 'adaptive', 'sgdc_eta0': 1.0064285737135983, 'sgdc_early_stopping': True, 'sgdc_validation_fraction': 0.25, 'sgdc_n_iter_no_change': 10}. Best is trial 26 with value: 0.671742.[0m
[32m[I 2022-10-20 15:32:29,137][0m Trial 50 finished with value: 0.6662249692685713 and parameters: {'sgdc_loss': 'log', 'sgdc_penalty': 'elasticnet', 'sgdc_alpha': 1.0505984733094449e-06, 'sgdc_l1_ratio': 0.2, 'sgdc_learning_rate': 'adaptive', 'sgdc_eta0': 13.518604683565467, 'sgdc_early_stopping': True, 'sgdc_validation_fraction': 0.25, 'sgdc_n_iter_no_change': 10}. Best is trial 26 with value: 0.671742.[0m
[32m[I 2022-10-20 15:32:42,665][0m Trial 62 finished with value: 0.28249362382342064 and parameters: {'sgdc_loss': 'modified_huber', 'sgdc_penalty': 'elasticnet', 'sgdc_alpha': 9.417526246176057e-06, 'sgdc_l1_ratio': 0.6000000000000001, 'sgdc_learning_rate': 'constant', 'sgdc_eta0': 90.84384636630078, 'sgdc_early_stopping': True, 'sgdc_validation_fraction': 0.25, 'sgdc_n_iter_no_change': 10}. Best is trial 26 with value: 0.671742.[0m
[32m[I 2022-10-20 15:33:27,538][0m Trial 56 finished with value: 0.665917654830238 and parameters: {'sgdc_loss': 'modified_huber', 'sgdc_penalty': 'elasticnet', 'sgdc_alpha': 1.0621509940156049e-05, 'sgdc_l1_ratio': 0.0, 'sgdc_learning_rate': 'adaptive', 'sgdc_eta0': 16.597774233408867, 'sgdc_early_stopping': True, 'sgdc_validation_fraction': 0.25, 'sgdc_n_iter_no_change': 10}. Best is trial 26 with value: 0.671742.[0m
[32m[I 2022-10-20 15:33:27,986][0m Trial 55 finished with value: 0.672345187974724 and parameters: {'sgdc_loss': 'hinge', 'sgdc_penalty': 'elasticnet', 'sgdc_alpha': 1.1067521357131533e-05, 'sgdc_l1_ratio': 0.2, 'sgdc_learning_rate': 'adaptive', 'sgdc_eta0': 90.06702918839876, 'sgdc_early_stopping': True, 'sgdc_validation_fraction': 0.25, 'sgdc_n_iter_no_change': 10}. Best is trial 55 with value: 0.672345.[0m
[32m[I 2022-10-20 15:34:05,241][0m Trial 57 finished with value: 0.6699132287618869 and parameters: {'sgdc_loss': 'modified_huber', 'sgdc_penalty': 'elasticnet', 'sgdc_alpha': 8.758898792431958e-06, 'sgdc_l1_ratio': 0.6000000000000001, 'sgdc_learning_rate': 'adaptive', 'sgdc_eta0': 169.5066149188692, 'sgdc_early_stopping': True, 'sgdc_validation_fraction': 0.25, 'sgdc_n_iter_no_change': 10}. Best is trial 55 with value: 0.672345.[0m
[32m[I 2022-10-20 15:34:50,650][0m Trial 59 finished with value: 0.6625794694096503 and parameters: {'sgdc_loss': 'modified_huber', 'sgdc_penalty': 'elasticnet', 'sgdc_alpha': 1.0757630186660558e-05, 'sgdc_l1_ratio': 0.0, 'sgdc_learning_rate': 'adaptive', 'sgdc_eta0': 60.814706473751684, 'sgdc_early_stopping': True, 'sgdc_validation_fraction': 0.25, 'sgdc_n_iter_no_change': 10}. Best is trial 55 with value: 0.672345.[0m
