[32m[I 2022-10-20 03:43:05,015][0m Trial 18 finished with value: 0.9914723603608688 and parameters: {'etsc_n_estimators': 180, 'etsc_criterion': 'gini', 'etsc_min_samples_split': 49, 'etsc_min_samples_leaf': 1, 'etsc_max_features': 49, 'etsc_bootstrap': True}. Best is trial 16 with value: 0.991635.[0m
[32m[I 2022-10-20 03:43:09,385][0m Trial 17 finished with value: 0.991418710256678 and parameters: {'etsc_n_estimators': 200, 'etsc_criterion': 'entropy', 'etsc_min_samples_split': 46, 'etsc_min_samples_leaf': 1, 'etsc_max_features': 46, 'etsc_bootstrap': True}. Best is trial 16 with value: 0.991635.[0m
[32m[I 2022-10-20 03:43:18,030][0m Trial 21 finished with value: 0.9914470116613332 and parameters: {'etsc_n_estimators': 160, 'etsc_criterion': 'entropy', 'etsc_min_samples_split': 46, 'etsc_min_samples_leaf': 39, 'etsc_max_features': 50, 'etsc_bootstrap': True}. Best is trial 16 with value: 0.991635.[0m
[32m[I 2022-10-20 03:43:19,927][0m Trial 20 finished with value: 0.9915163304392475 and parameters: {'etsc_n_estimators': 180, 'etsc_criterion': 'entropy', 'etsc_min_samples_split': 45, 'etsc_min_samples_leaf': 41, 'etsc_max_features': 50, 'etsc_bootstrap': True}. Best is trial 16 with value: 0.991635.[0m
[32m[I 2022-10-20 03:43:23,463][0m Trial 19 finished with value: 0.9915085634685327 and parameters: {'etsc_n_estimators': 190, 'etsc_criterion': 'entropy', 'etsc_min_samples_split': 46, 'etsc_min_samples_leaf': 38, 'etsc_max_features': 48, 'etsc_bootstrap': True}. Best is trial 16 with value: 0.991635.[0m
[32m[I 2022-10-20 03:43:28,804][0m Trial 24 finished with value: 0.9914783226232166 and parameters: {'etsc_n_estimators': 120, 'etsc_criterion': 'gini', 'etsc_min_samples_split': 43, 'etsc_min_samples_leaf': 31, 'etsc_max_features': 37, 'etsc_bootstrap': True}. Best is trial 16 with value: 0.991635.[0m
[32m[I 2022-10-20 03:44:45,820][0m Trial 32 finished with value: 0.9914973883503687 and parameters: {'etsc_n_estimators': 140, 'etsc_criterion': 'gini', 'etsc_min_samples_split': 39, 'etsc_min_samples_leaf': 7, 'etsc_max_features': 28, 'etsc_bootstrap': True}. Best is trial 16 with value: 0.991635.[0m
[32m[I 2022-10-20 03:44:48,397][0m Trial 30 finished with value: 0.9915259676496976 and parameters: {'etsc_n_estimators': 140, 'etsc_criterion': 'gini', 'etsc_min_samples_split': 37, 'etsc_min_samples_leaf': 9, 'etsc_max_features': 38, 'etsc_bootstrap': True}. Best is trial 16 with value: 0.991635.[0m
[32m[I 2022-10-20 03:44:50,849][0m Trial 31 finished with value: 0.991533575608213 and parameters: {'etsc_n_estimators': 140, 'etsc_criterion': 'gini', 'etsc_min_samples_split': 38, 'etsc_min_samples_leaf': 7, 'etsc_max_features': 36, 'etsc_bootstrap': True}. Best is trial 16 with value: 0.991635.[0m
[32m[I 2022-10-20 03:44:54,024][0m Trial 28 finished with value: 0.9915639689757392 and parameters: {'etsc_n_estimators': 170, 'etsc_criterion': 'gini', 'etsc_min_samples_split': 38, 'etsc_min_samples_leaf': 8, 'etsc_max_features': 36, 'etsc_bootstrap': True}. Best is trial 16 with value: 0.991635.[0m
[32m[I 2022-10-20 03:45:06,356][0m Trial 25 finished with value: 0.9915086028587449 and parameters: {'etsc_n_estimators': 200, 'etsc_criterion': 'gini', 'etsc_min_samples_split': 40, 'etsc_min_samples_leaf': 32, 'etsc_max_features': 50, 'etsc_bootstrap': True}. Best is trial 16 with value: 0.991635.[0m
[32m[I 2022-10-20 03:45:14,429][0m Trial 27 finished with value: 0.9914943566586211 and parameters: {'etsc_n_estimators': 200, 'etsc_criterion': 'gini', 'etsc_min_samples_split': 41, 'etsc_min_samples_leaf': 14, 'etsc_max_features': 39, 'etsc_bootstrap': True}. Best is trial 16 with value: 0.991635.[0m
[32m[I 2022-10-20 03:45:15,843][0m Trial 29 finished with value: 0.9915791016462577 and parameters: {'etsc_n_estimators': 180, 'etsc_criterion': 'gini', 'etsc_min_samples_split': 39, 'etsc_min_samples_leaf': 13, 'etsc_max_features': 40, 'etsc_bootstrap': True}. Best is trial 16 with value: 0.991635.[0m
[32m[I 2022-10-20 03:45:28,031][0m Trial 26 finished with value: 0.9915097702311289 and parameters: {'etsc_n_estimators': 200, 'etsc_criterion': 'gini', 'etsc_min_samples_split': 37, 'etsc_min_samples_leaf': 15, 'etsc_max_features': 50, 'etsc_bootstrap': True}. Best is trial 16 with value: 0.991635.[0m
[32m[I 2022-10-20 03:45:29,236][0m Trial 36 finished with value: 0.9914952172963992 and parameters: {'etsc_n_estimators': 50, 'etsc_criterion': 'gini', 'etsc_min_samples_split': 22, 'etsc_min_samples_leaf': 14, 'etsc_max_features': 41, 'etsc_bootstrap': True}. Best is trial 16 with value: 0.991635.[0m
[32m[I 2022-10-20 03:45:58,833][0m Trial 33 finished with value: 0.9914263134077613 and parameters: {'etsc_n_estimators': 110, 'etsc_criterion': 'gini', 'etsc_min_samples_split': 37, 'etsc_min_samples_leaf': 12, 'etsc_max_features': 38, 'etsc_bootstrap': True}. Best is trial 16 with value: 0.991635.[0m
[32m[I 2022-10-20 03:46:04,058][0m Trial 34 finished with value: 0.9914721195314161 and parameters: {'etsc_n_estimators': 110, 'etsc_criterion': 'gini', 'etsc_min_samples_split': 20, 'etsc_min_samples_leaf': 12, 'etsc_max_features': 42, 'etsc_bootstrap': True}. Best is trial 16 with value: 0.991635.[0m
[32m[I 2022-10-20 03:46:21,954][0m Trial 37 finished with value: 0.9915025917148191 and parameters: {'etsc_n_estimators': 110, 'etsc_criterion': 'gini', 'etsc_min_samples_split': 21, 'etsc_min_samples_leaf': 14, 'etsc_max_features': 41, 'etsc_bootstrap': True}. Best is trial 16 with value: 0.991635.[0m
[32m[I 2022-10-20 03:46:44,720][0m Trial 40 finished with value: 0.9915466746517572 and parameters: {'etsc_n_estimators': 110, 'etsc_criterion': 'gini', 'etsc_min_samples_split': 21, 'etsc_min_samples_leaf': 24, 'etsc_max_features': 42, 'etsc_bootstrap': True}. Best is trial 16 with value: 0.991635.[0m
[32m[I 2022-10-20 03:46:48,132][0m Trial 35 finished with value: 0.991532478981702 and parameters: {'etsc_n_estimators': 170, 'etsc_criterion': 'gini', 'etsc_min_samples_split': 22, 'etsc_min_samples_leaf': 13, 'etsc_max_features': 42, 'etsc_bootstrap': True}. Best is trial 16 with value: 0.991635.[0m
[32m[I 2022-10-20 03:46:52,786][0m Trial 38 finished with value: 0.9913807440580532 and parameters: {'etsc_n_estimators': 170, 'etsc_criterion': 'gini', 'etsc_min_samples_split': 22, 'etsc_min_samples_leaf': 12, 'etsc_max_features': 29, 'etsc_bootstrap': True}. Best is trial 16 with value: 0.991635.[0m
[32m[I 2022-10-20 03:47:06,477][0m Trial 41 finished with value: 0.9914816116555741 and parameters: {'etsc_n_estimators': 170, 'etsc_criterion': 'gini', 'etsc_min_samples_split': 33, 'etsc_min_samples_leaf': 24, 'etsc_max_features': 29, 'etsc_bootstrap': True}. Best is trial 16 with value: 0.991635.[0m
[32m[I 2022-10-20 03:47:13,409][0m Trial 39 finished with value: 0.991532478981702 and parameters: {'etsc_n_estimators': 170, 'etsc_criterion': 'gini', 'etsc_min_samples_split': 20, 'etsc_min_samples_leaf': 13, 'etsc_max_features': 42, 'etsc_bootstrap': True}. Best is trial 16 with value: 0.991635.[0m
[32m[I 2022-10-20 03:47:31,508][0m Trial 42 finished with value: 0.991478990323452 and parameters: {'etsc_n_estimators': 170, 'etsc_criterion': 'gini', 'etsc_min_samples_split': 33, 'etsc_min_samples_leaf': 23, 'etsc_max_features': 27, 'etsc_bootstrap': True}. Best is trial 16 with value: 0.991635.[0m
[32m[I 2022-10-20 03:47:34,444][0m Trial 43 finished with value: 0.9914342748669701 and parameters: {'etsc_n_estimators': 170, 'etsc_criterion': 'entropy', 'etsc_min_samples_split': 31, 'etsc_min_samples_leaf': 23, 'etsc_max_features': 27, 'etsc_bootstrap': True}. Best is trial 16 with value: 0.991635.[0m
[32m[I 2022-10-20 03:47:53,572][0m Trial 44 finished with value: 0.991610643078509 and parameters: {'etsc_n_estimators': 170, 'etsc_criterion': 'entropy', 'etsc_min_samples_split': 31, 'etsc_min_samples_leaf': 22, 'etsc_max_features': 28, 'etsc_bootstrap': True}. Best is trial 16 with value: 0.991635.[0m
[32m[I 2022-10-20 03:48:30,188][0m Trial 45 finished with value: 0.9916187047135517 and parameters: {'etsc_n_estimators': 170, 'etsc_criterion': 'entropy', 'etsc_min_samples_split': 34, 'etsc_min_samples_leaf': 19, 'etsc_max_features': 28, 'etsc_bootstrap': False}. Best is trial 16 with value: 0.991635.[0m
[32m[I 2022-10-20 03:48:44,165][0m Trial 46 finished with value: 0.991566020225161 and parameters: {'etsc_n_estimators': 180, 'etsc_criterion': 'entropy', 'etsc_min_samples_split': 33, 'etsc_min_samples_leaf': 19, 'etsc_max_features': 29, 'etsc_bootstrap': False}. Best is trial 16 with value: 0.991635.[0m
[32m[I 2022-10-20 03:48:45,139][0m Trial 47 finished with value: 0.991664476576734 and parameters: {'etsc_n_estimators': 180, 'etsc_criterion': 'entropy', 'etsc_min_samples_split': 34, 'etsc_min_samples_leaf': 17, 'etsc_max_features': 27, 'etsc_bootstrap': False}. Best is trial 47 with value: 0.991664.[0m
[32m[I 2022-10-20 03:48:54,472][0m Trial 48 finished with value: 0.9915574024498576 and parameters: {'etsc_n_estimators': 180, 'etsc_criterion': 'entropy', 'etsc_min_samples_split': 34, 'etsc_min_samples_leaf': 5, 'etsc_max_features': 26, 'etsc_bootstrap': False}. Best is trial 47 with value: 0.991664.[0m
[32m[I 2022-10-20 03:49:00,818][0m Trial 49 finished with value: 0.9914885118081976 and parameters: {'etsc_n_estimators': 180, 'etsc_criterion': 'entropy', 'etsc_min_samples_split': 34, 'etsc_min_samples_leaf': 4, 'etsc_max_features': 25, 'etsc_bootstrap': False}. Best is trial 47 with value: 0.991664.[0m
[32m[I 2022-10-20 03:49:15,274][0m Trial 51 finished with value: 0.9916030472965371 and parameters: {'etsc_n_estimators': 150, 'etsc_criterion': 'entropy', 'etsc_min_samples_split': 35, 'etsc_min_samples_leaf': 4, 'etsc_max_features': 32, 'etsc_bootstrap': False}. Best is trial 47 with value: 0.991664.[0m
[32m[I 2022-10-20 03:49:16,119][0m Trial 50 finished with value: 0.9915648948130809 and parameters: {'etsc_n_estimators': 180, 'etsc_criterion': 'entropy', 'etsc_min_samples_split': 29, 'etsc_min_samples_leaf': 4, 'etsc_max_features': 24, 'etsc_bootstrap': False}. Best is trial 47 with value: 0.991664.[0m
[32m[I 2022-10-20 03:49:17,203][0m Trial 52 finished with value: 0.991572808529693 and parameters: {'etsc_n_estimators': 150, 'etsc_criterion': 'entropy', 'etsc_min_samples_split': 29, 'etsc_min_samples_leaf': 4, 'etsc_max_features': 22, 'etsc_bootstrap': False}. Best is trial 47 with value: 0.991664.[0m
[32m[I 2022-10-20 03:49:29,680][0m Trial 55 finished with value: 0.99146000447456 and parameters: {'etsc_n_estimators': 80, 'etsc_criterion': 'entropy', 'etsc_min_samples_split': 8, 'etsc_min_samples_leaf': 17, 'etsc_max_features': 23, 'etsc_bootstrap': False}. Best is trial 47 with value: 0.991664.[0m
[32m[I 2022-10-20 03:49:44,053][0m Trial 57 finished with value: 0.9914446947156819 and parameters: {'etsc_n_estimators': 80, 'etsc_criterion': 'entropy', 'etsc_min_samples_split': 29, 'etsc_min_samples_leaf': 20, 'etsc_max_features': 22, 'etsc_bootstrap': False}. Best is trial 47 with value: 0.991664.[0m
[32m[I 2022-10-20 03:49:54,621][0m Trial 53 finished with value: 0.9915506179216558 and parameters: {'etsc_n_estimators': 150, 'etsc_criterion': 'entropy', 'etsc_min_samples_split': 30, 'etsc_min_samples_leaf': 18, 'etsc_max_features': 24, 'etsc_bootstrap': False}. Best is trial 47 with value: 0.991664.[0m
[32m[I 2022-10-20 03:50:06,060][0m Trial 54 finished with value: 0.9905903859162548 and parameters: {'etsc_n_estimators': 150, 'etsc_criterion': 'entropy', 'etsc_min_samples_split': 29, 'etsc_min_samples_leaf': 27, 'etsc_max_features': 23, 'etsc_bootstrap': False}. Best is trial 47 with value: 0.991664.[0m
[32m[I 2022-10-20 03:50:17,682][0m Trial 56 finished with value: 0.9915055652191147 and parameters: {'etsc_n_estimators': 150, 'etsc_criterion': 'entropy', 'etsc_min_samples_split': 28, 'etsc_min_samples_leaf': 17, 'etsc_max_features': 23, 'etsc_bootstrap': False}. Best is trial 47 with value: 0.991664.[0m
[32m[I 2022-10-20 03:50:36,005][0m Trial 58 finished with value: 0.991359138495129 and parameters: {'etsc_n_estimators': 150, 'etsc_criterion': 'entropy', 'etsc_min_samples_split': 29, 'etsc_min_samples_leaf': 27, 'etsc_max_features': 22, 'etsc_bootstrap': False}. Best is trial 47 with value: 0.991664.[0m
[32m[I 2022-10-20 03:50:56,952][0m Trial 59 finished with value: 0.9916335798672452 and parameters: {'etsc_n_estimators': 150, 'etsc_criterion': 'entropy', 'etsc_min_samples_split': 29, 'etsc_min_samples_leaf': 27, 'etsc_max_features': 32, 'etsc_bootstrap': False}. Best is trial 47 with value: 0.991664.[0m
[32m[I 2022-10-20 03:50:58,521][0m Trial 60 finished with value: 0.9915195439918795 and parameters: {'etsc_n_estimators': 150, 'etsc_criterion': 'entropy', 'etsc_min_samples_split': 24, 'etsc_min_samples_leaf': 20, 'etsc_max_features': 32, 'etsc_bootstrap': False}. Best is trial 47 with value: 0.991664.[0m
[32m[I 2022-10-20 03:51:13,460][0m Trial 61 finished with value: 0.9915958825990159 and parameters: {'etsc_n_estimators': 150, 'etsc_criterion': 'entropy', 'etsc_min_samples_split': 25, 'etsc_min_samples_leaf': 20, 'etsc_max_features': 34, 'etsc_bootstrap': False}. Best is trial 47 with value: 0.991664.[0m
[32m[I 2022-10-20 03:51:25,845][0m Trial 62 finished with value: 0.9914966984291476 and parameters: {'etsc_n_estimators': 150, 'etsc_criterion': 'entropy', 'etsc_min_samples_split': 25, 'etsc_min_samples_leaf': 16, 'etsc_max_features': 33, 'etsc_bootstrap': False}. Best is trial 47 with value: 0.991664.[0m
[32m[I 2022-10-20 03:52:01,968][0m Trial 66 finished with value: 0.9915347584634662 and parameters: {'etsc_n_estimators': 130, 'etsc_criterion': 'entropy', 'etsc_min_samples_split': 34, 'etsc_min_samples_leaf': 20, 'etsc_max_features': 32, 'etsc_bootstrap': False}. Best is trial 47 with value: 0.991664.[0m
[32m[I 2022-10-20 03:52:01,968][0m Trial 63 finished with value: 0.991481354956672 and parameters: {'etsc_n_estimators': 190, 'etsc_criterion': 'entropy', 'etsc_min_samples_split': 35, 'etsc_min_samples_leaf': 27, 'etsc_max_features': 33, 'etsc_bootstrap': False}. Best is trial 47 with value: 0.991664.[0m
[32m[I 2022-10-20 03:52:11,904][0m Trial 64 finished with value: 0.9914888600343604 and parameters: {'etsc_n_estimators': 190, 'etsc_criterion': 'entropy', 'etsc_min_samples_split': 25, 'etsc_min_samples_leaf': 16, 'etsc_max_features': 32, 'etsc_bootstrap': False}. Best is trial 47 with value: 0.991664.[0m
[32m[I 2022-10-20 03:52:21,486][0m Trial 65 finished with value: 0.9915728711386358 and parameters: {'etsc_n_estimators': 190, 'etsc_criterion': 'entropy', 'etsc_min_samples_split': 26, 'etsc_min_samples_leaf': 20, 'etsc_max_features': 32, 'etsc_bootstrap': False}. Best is trial 47 with value: 0.991664.[0m
[32m[I 2022-10-20 03:52:25,289][0m Trial 67 finished with value: 0.9915950849891852 and parameters: {'etsc_n_estimators': 130, 'etsc_criterion': 'entropy', 'etsc_min_samples_split': 25, 'etsc_min_samples_leaf': 29, 'etsc_max_features': 33, 'etsc_bootstrap': False}. Best is trial 47 with value: 0.991664.[0m
[32m[I 2022-10-20 03:52:40,581][0m Trial 69 finished with value: 0.9916018498347984 and parameters: {'etsc_n_estimators': 130, 'etsc_criterion': 'entropy', 'etsc_min_samples_split': 25, 'etsc_min_samples_leaf': 33, 'etsc_max_features': 32, 'etsc_bootstrap': False}. Best is trial 47 with value: 0.991664.[0m
[32m[I 2022-10-20 03:52:50,876][0m Trial 70 finished with value: 0.991554639109471 and parameters: {'etsc_n_estimators': 130, 'etsc_criterion': 'entropy', 'etsc_min_samples_split': 36, 'etsc_min_samples_leaf': 33, 'etsc_max_features': 31, 'etsc_bootstrap': False}. Best is trial 47 with value: 0.991664.[0m
[32m[I 2022-10-20 03:53:04,365][0m Trial 68 finished with value: 0.9916027029061689 and parameters: {'etsc_n_estimators': 190, 'etsc_criterion': 'entropy', 'etsc_min_samples_split': 35, 'etsc_min_samples_leaf': 16, 'etsc_max_features': 32, 'etsc_bootstrap': False}. Best is trial 47 with value: 0.991664.[0m
[32m[I 2022-10-20 03:53:25,997][0m Trial 72 finished with value: 0.9915701717544191 and parameters: {'etsc_n_estimators': 130, 'etsc_criterion': 'entropy', 'etsc_min_samples_split': 17, 'etsc_min_samples_leaf': 34, 'etsc_max_features': 31, 'etsc_bootstrap': False}. Best is trial 47 with value: 0.991664.[0m
[32m[I 2022-10-20 03:53:31,330][0m Trial 71 finished with value: 0.9916013478067384 and parameters: {'etsc_n_estimators': 130, 'etsc_criterion': 'entropy', 'etsc_min_samples_split': 26, 'etsc_min_samples_leaf': 33, 'etsc_max_features': 34, 'etsc_bootstrap': False}. Best is trial 47 with value: 0.991664.[0m
[32m[I 2022-10-20 03:53:44,347][0m Trial 73 finished with value: 0.9915262305289992 and parameters: {'etsc_n_estimators': 130, 'etsc_criterion': 'entropy', 'etsc_min_samples_split': 17, 'etsc_min_samples_leaf': 29, 'etsc_max_features': 35, 'etsc_bootstrap': False}. Best is trial 47 with value: 0.991664.[0m
[32m[I 2022-10-20 03:53:45,261][0m Trial 74 finished with value: 0.9914886162403619 and parameters: {'etsc_n_estimators': 130, 'etsc_criterion': 'entropy', 'etsc_min_samples_split': 16, 'etsc_min_samples_leaf': 33, 'etsc_max_features': 30, 'etsc_bootstrap': False}. Best is trial 47 with value: 0.991664.[0m
[32m[I 2022-10-20 03:54:16,462][0m Trial 75 finished with value: 0.9916565539932218 and parameters: {'etsc_n_estimators': 160, 'etsc_criterion': 'entropy', 'etsc_min_samples_split': 16, 'etsc_min_samples_leaf': 32, 'etsc_max_features': 35, 'etsc_bootstrap': False}. Best is trial 47 with value: 0.991664.[0m
[32m[I 2022-10-20 03:54:23,884][0m Trial 76 finished with value: 0.9915494382857907 and parameters: {'etsc_n_estimators': 160, 'etsc_criterion': 'entropy', 'etsc_min_samples_split': 36, 'etsc_min_samples_leaf': 33, 'etsc_max_features': 30, 'etsc_bootstrap': False}. Best is trial 47 with value: 0.991664.[0m
[32m[I 2022-10-20 03:54:40,271][0m Trial 77 finished with value: 0.9915482810728552 and parameters: {'etsc_n_estimators': 160, 'etsc_criterion': 'entropy', 'etsc_min_samples_split': 32, 'etsc_min_samples_leaf': 25, 'etsc_max_features': 35, 'etsc_bootstrap': False}. Best is trial 47 with value: 0.991664.[0m
[32m[I 2022-10-20 03:54:55,354][0m Trial 78 finished with value: 0.9915428975314244 and parameters: {'etsc_n_estimators': 160, 'etsc_criterion': 'entropy', 'etsc_min_samples_split': 32, 'etsc_min_samples_leaf': 34, 'etsc_max_features': 35, 'etsc_bootstrap': False}. Best is trial 47 with value: 0.991664.[0m
[32m[I 2022-10-20 03:55:06,920][0m Trial 79 finished with value: 0.9916935349536138 and parameters: {'etsc_n_estimators': 160, 'etsc_criterion': 'entropy', 'etsc_min_samples_split': 32, 'etsc_min_samples_leaf': 25, 'etsc_max_features': 30, 'etsc_bootstrap': False}. Best is trial 79 with value: 0.991694.[0m
[32m[I 2022-10-20 03:55:12,615][0m Trial 80 finished with value: 0.9916935349536138 and parameters: {'etsc_n_estimators': 160, 'etsc_criterion': 'entropy', 'etsc_min_samples_split': 32, 'etsc_min_samples_leaf': 25, 'etsc_max_features': 30, 'etsc_bootstrap': False}. Best is trial 79 with value: 0.991694.[0m
[32m[I 2022-10-20 03:55:22,037][0m Trial 82 finished with value: 0.9915043951591694 and parameters: {'etsc_n_estimators': 160, 'etsc_criterion': 'entropy', 'etsc_min_samples_split': 32, 'etsc_min_samples_leaf': 50, 'etsc_max_features': 27, 'etsc_bootstrap': False}. Best is trial 79 with value: 0.991694.[0m
[32m[I 2022-10-20 03:55:27,577][0m Trial 81 finished with value: 0.9916935349536138 and parameters: {'etsc_n_estimators': 160, 'etsc_criterion': 'entropy', 'etsc_min_samples_split': 31, 'etsc_min_samples_leaf': 25, 'etsc_max_features': 30, 'etsc_bootstrap': False}. Best is trial 79 with value: 0.991694.[0m
[32m[I 2022-10-20 03:55:36,815][0m Trial 83 finished with value: 0.9901249697927382 and parameters: {'etsc_n_estimators': 160, 'etsc_criterion': 'entropy', 'etsc_min_samples_split': 12, 'etsc_min_samples_leaf': 25, 'etsc_max_features': 19, 'etsc_bootstrap': False}. Best is trial 79 with value: 0.991694.[0m
[32m[I 2022-10-20 03:55:56,126][0m Trial 86 finished with value: 0.9915496678829259 and parameters: {'etsc_n_estimators': 100, 'etsc_criterion': 'entropy', 'etsc_min_samples_split': 11, 'etsc_min_samples_leaf': 22, 'etsc_max_features': 27, 'etsc_bootstrap': False}. Best is trial 79 with value: 0.991694.[0m
[32m[I 2022-10-20 03:56:01,685][0m Trial 84 finished with value: 0.9915133011916691 and parameters: {'etsc_n_estimators': 160, 'etsc_criterion': 'entropy', 'etsc_min_samples_split': 13, 'etsc_min_samples_leaf': 25, 'etsc_max_features': 27, 'etsc_bootstrap': False}. Best is trial 79 with value: 0.991694.[0m
[32m[I 2022-10-20 03:56:02,859][0m Trial 85 finished with value: 0.9900881710898923 and parameters: {'etsc_n_estimators': 160, 'etsc_criterion': 'entropy', 'etsc_min_samples_split': 12, 'etsc_min_samples_leaf': 22, 'etsc_max_features': 20, 'etsc_bootstrap': False}. Best is trial 79 with value: 0.991694.[0m
[32m[I 2022-10-20 03:56:29,246][0m Trial 90 finished with value: 0.9916249056985966 and parameters: {'etsc_n_estimators': 100, 'etsc_criterion': 'entropy', 'etsc_min_samples_split': 2, 'etsc_min_samples_leaf': 22, 'etsc_max_features': 28, 'etsc_bootstrap': False}. Best is trial 79 with value: 0.991694.[0m
[32m[I 2022-10-20 03:56:39,022][0m Trial 91 finished with value: 0.9915572754333549 and parameters: {'etsc_n_estimators': 100, 'etsc_criterion': 'entropy', 'etsc_min_samples_split': 31, 'etsc_min_samples_leaf': 23, 'etsc_max_features': 28, 'etsc_bootstrap': False}. Best is trial 79 with value: 0.991694.[0m
[32m[I 2022-10-20 03:56:42,010][0m Trial 89 finished with value: 0.9901249697927382 and parameters: {'etsc_n_estimators': 160, 'etsc_criterion': 'entropy', 'etsc_min_samples_split': 9, 'etsc_min_samples_leaf': 25, 'etsc_max_features': 19, 'etsc_bootstrap': False}. Best is trial 79 with value: 0.991694.[0m
