[32m[I 2022-10-20 04:43:56,572][0m Trial 84 finished with value: 0.6855100579406033 and parameters: {'lgbm_num_leaves': 7, 'lgbm_learning_rate': 0.645952164800013, 'lgbm_n_estimators': 160, 'lgbm_reg_alpha': 0.35000000000000003, 'lgbm_reg_lambda': 0.9500000000000001}. Best is trial 78 with value: 0.991993.[0m
[32m[I 2022-10-20 04:43:57,215][0m Trial 85 finished with value: 0.9918712097882438 and parameters: {'lgbm_num_leaves': 31, 'lgbm_learning_rate': 0.6250514818002466, 'lgbm_n_estimators': 170, 'lgbm_reg_alpha': 0.35000000000000003, 'lgbm_reg_lambda': 0.9500000000000001}. Best is trial 78 with value: 0.991993.[0m
[32m[I 2022-10-20 04:43:59,577][0m Trial 86 finished with value: 0.5439710306575929 and parameters: {'lgbm_num_leaves': 7, 'lgbm_learning_rate': 0.6485966723227901, 'lgbm_n_estimators': 170, 'lgbm_reg_alpha': 0.35000000000000003, 'lgbm_reg_lambda': 0.9500000000000001}. Best is trial 78 with value: 0.991993.[0m
[32m[I 2022-10-20 04:44:00,313][0m Trial 89 finished with value: 0.9914349095037491 and parameters: {'lgbm_num_leaves': 7, 'lgbm_learning_rate': 0.3291655972014562, 'lgbm_n_estimators': 90, 'lgbm_reg_alpha': 0.6000000000000001, 'lgbm_reg_lambda': 0.9500000000000001}. Best is trial 78 with value: 0.991993.[0m
[32m[I 2022-10-20 04:44:01,443][0m Trial 87 finished with value: 0.9914580574947842 and parameters: {'lgbm_num_leaves': 7, 'lgbm_learning_rate': 0.6454304789776288, 'lgbm_n_estimators': 160, 'lgbm_reg_alpha': 0.25, 'lgbm_reg_lambda': 0.9500000000000001}. Best is trial 78 with value: 0.991993.[0m
[32m[I 2022-10-20 04:44:03,189][0m Trial 91 finished with value: 0.9917493863127832 and parameters: {'lgbm_num_leaves': 31, 'lgbm_learning_rate': 0.31674447609283696, 'lgbm_n_estimators': 90, 'lgbm_reg_alpha': 0.6000000000000001, 'lgbm_reg_lambda': 0.9500000000000001}. Best is trial 78 with value: 0.991993.[0m
[32m[I 2022-10-20 04:44:04,091][0m Trial 90 finished with value: 0.9918254201126057 and parameters: {'lgbm_num_leaves': 31, 'lgbm_learning_rate': 0.3765372864893676, 'lgbm_n_estimators': 100, 'lgbm_reg_alpha': 0.6000000000000001, 'lgbm_reg_lambda': 0.9}. Best is trial 78 with value: 0.991993.[0m
[32m[I 2022-10-20 04:44:10,197][0m Trial 92 finished with value: 0.9916411996023 and parameters: {'lgbm_num_leaves': 31, 'lgbm_learning_rate': 0.14457832943098536, 'lgbm_n_estimators': 90, 'lgbm_reg_alpha': 0.6000000000000001, 'lgbm_reg_lambda': 0.9}. Best is trial 78 with value: 0.991993.[0m
[32m[I 2022-10-20 04:44:12,251][0m Trial 93 finished with value: 0.9915110240528826 and parameters: {'lgbm_num_leaves': 31, 'lgbm_learning_rate': 0.13861608924630225, 'lgbm_n_estimators': 90, 'lgbm_reg_alpha': 0.25, 'lgbm_reg_lambda': 0.9}. Best is trial 78 with value: 0.991993.[0m
[32m[I 2022-10-20 04:44:12,756][0m Trial 94 finished with value: 0.9916258320116075 and parameters: {'lgbm_num_leaves': 31, 'lgbm_learning_rate': 0.14698337911030035, 'lgbm_n_estimators': 90, 'lgbm_reg_alpha': 0.15000000000000002, 'lgbm_reg_lambda': 0.5}. Best is trial 78 with value: 0.991993.[0m
[32m[I 2022-10-20 04:44:17,971][0m Trial 95 finished with value: 0.9916574335350191 and parameters: {'lgbm_num_leaves': 31, 'lgbm_learning_rate': 0.15680676911515173, 'lgbm_n_estimators': 120, 'lgbm_reg_alpha': 0.6000000000000001, 'lgbm_reg_lambda': 0.9}. Best is trial 78 with value: 0.991993.[0m
[32m[I 2022-10-20 04:44:18,476][0m Trial 96 finished with value: 0.9916647778352728 and parameters: {'lgbm_num_leaves': 31, 'lgbm_learning_rate': 0.15015237797396994, 'lgbm_n_estimators': 120, 'lgbm_reg_alpha': 0.6000000000000001, 'lgbm_reg_lambda': 0.8500000000000001}. Best is trial 78 with value: 0.991993.[0m
[32m[I 2022-10-20 04:44:19,195][0m Trial 97 finished with value: 0.9915737583737788 and parameters: {'lgbm_num_leaves': 31, 'lgbm_learning_rate': 0.13834999488497696, 'lgbm_n_estimators': 120, 'lgbm_reg_alpha': 0.6000000000000001, 'lgbm_reg_lambda': 0.8500000000000001}. Best is trial 78 with value: 0.991993.[0m
[32m[I 2022-10-20 04:44:25,443][0m Trial 98 finished with value: 0.9915966538844138 and parameters: {'lgbm_num_leaves': 31, 'lgbm_learning_rate': 0.15763628855244424, 'lgbm_n_estimators': 170, 'lgbm_reg_alpha': 0.25, 'lgbm_reg_lambda': 0.9}. Best is trial 78 with value: 0.991993.[0m
[32m[I 2022-10-20 04:44:25,600][0m Trial 99 finished with value: 0.9918102057341219 and parameters: {'lgbm_num_leaves': 31, 'lgbm_learning_rate': 0.16339695961584982, 'lgbm_n_estimators': 170, 'lgbm_reg_alpha': 0.4, 'lgbm_reg_lambda': 0.8500000000000001}. Best is trial 78 with value: 0.991993.[0m
[32m[I 2022-10-20 04:44:25,662][0m Study finished.[0m
[32m[I 2022-10-20 04:44:25,725][0m --------------------------------------------------------------------------------[0m
[32m[I 2022-10-20 04:44:25,740][0m --------------------       LinearDiscriminantAnalysis       --------------------[0m
[32m[I 2022-10-20 04:44:25,740][0m --------------------------------------------------------------------------------[0m
[32m[I 2022-10-20 04:44:25,756][0m A new study created in RDB with name: LinearDiscriminantAnalysis_b4f53b70[0m
[32m[I 2022-10-20 04:44:25,772][0m Study started.[0m
[32m[I 2022-10-20 04:44:31,856][0m Trial 6 finished with value: 0.9047439555188416 and parameters: {'lda_solver': 'svd', 'lda_n_components': 1}. Best is trial 6 with value: 0.904744.[0m
[32m[I 2022-10-20 04:44:32,578][0m Trial 1 finished with value: 0.9047439555188416 and parameters: {'lda_solver': 'svd', 'lda_n_components': 4}. Best is trial 1 with value: 0.904744.[0m
[32m[I 2022-10-20 04:44:32,578][0m Trial 4 finished with value: 0.9045171792659163 and parameters: {'lda_solver': 'lsqr', 'lda_n_components': 3, 'lda_tol': 0.0001}. Best is trial 1 with value: 0.904744.[0m
[32m[I 2022-10-20 04:44:33,254][0m Trial 2 finished with value: 0.9045171792659163 and parameters: {'lda_solver': 'lsqr', 'lda_n_components': 3, 'lda_tol': 0.001}. Best is trial 1 with value: 0.904744.[0m
[32m[I 2022-10-20 04:44:33,789][0m Trial 5 finished with value: 0.9045171792659163 and parameters: {'lda_solver': 'lsqr', 'lda_n_components': 2, 'lda_tol': 0.001}. Best is trial 1 with value: 0.904744.[0m
[32m[I 2022-10-20 04:44:34,479][0m Trial 0 finished with value: 0.9045171792659163 and parameters: {'lda_solver': 'eigen', 'lda_n_components': 4, 'lda_tol': 1e-05}. Best is trial 1 with value: 0.904744.[0m
[32m[I 2022-10-20 04:44:34,871][0m Trial 3 finished with value: 0.9045171792659163 and parameters: {'lda_solver': 'eigen', 'lda_n_components': 2, 'lda_tol': 1e-05}. Best is trial 1 with value: 0.904744.[0m
[32m[I 2022-10-20 04:44:35,012][0m Trial 7 finished with value: 0.9045171792659163 and parameters: {'lda_solver': 'eigen', 'lda_n_components': 2, 'lda_tol': 0.001}. Best is trial 1 with value: 0.904744.[0m
[32m[I 2022-10-20 04:44:37,748][0m Trial 9 finished with value: 0.9047439555188416 and parameters: {'lda_solver': 'svd', 'lda_n_components': 4}. Best is trial 1 with value: 0.904744.[0m
[32m[I 2022-10-20 04:44:38,414][0m Trial 8 finished with value: 0.9045171792659163 and parameters: {'lda_solver': 'eigen', 'lda_n_components': 2, 'lda_tol': 1e-05}. Best is trial 1 with value: 0.904744.[0m
[32m[I 2022-10-20 04:44:40,246][0m Trial 11 finished with value: 0.9045171792659163 and parameters: {'lda_solver': 'lsqr', 'lda_n_components': 2, 'lda_tol': 0.001}. Best is trial 1 with value: 0.904744.[0m
[32m[I 2022-10-20 04:44:40,550][0m Trial 15 finished with value: 0.9047439555188416 and parameters: {'lda_solver': 'svd', 'lda_n_components': 3}. Best is trial 15 with value: 0.904744.[0m
[32m[I 2022-10-20 04:44:42,204][0m Trial 14 finished with value: 0.9045171792659163 and parameters: {'lda_solver': 'lsqr', 'lda_n_components': 3, 'lda_tol': 0.0001}. Best is trial 15 with value: 0.904744.[0m
[32m[I 2022-10-20 04:44:42,637][0m Trial 10 finished with value: 0.9045171792659163 and parameters: {'lda_solver': 'eigen', 'lda_n_components': 4, 'lda_tol': 0.0001}. Best is trial 15 with value: 0.904744.[0m
[32m[I 2022-10-20 04:44:43,061][0m Trial 16 finished with value: 0.9047439555188416 and parameters: {'lda_solver': 'svd', 'lda_n_components': 1}. Best is trial 16 with value: 0.904744.[0m
[32m[I 2022-10-20 04:44:44,340][0m Trial 12 finished with value: 0.9045171792659163 and parameters: {'lda_solver': 'eigen', 'lda_n_components': 3, 'lda_tol': 1e-05}. Best is trial 16 with value: 0.904744.[0m
[32m[I 2022-10-20 04:44:44,435][0m Trial 13 finished with value: 0.9045171792659163 and parameters: {'lda_solver': 'eigen', 'lda_n_components': 3, 'lda_tol': 1e-05}. Best is trial 16 with value: 0.904744.[0m
[32m[I 2022-10-20 04:44:47,401][0m Trial 17 finished with value: 0.9047439555188416 and parameters: {'lda_solver': 'svd', 'lda_n_components': 4}. Best is trial 17 with value: 0.904744.[0m
[32m[I 2022-10-20 04:44:50,475][0m Trial 18 finished with value: 0.9047439555188416 and parameters: {'lda_solver': 'svd', 'lda_n_components': 1}. Best is trial 19 with value: 0.904744.[0m
[32m[I 2022-10-20 04:44:50,475][0m Trial 19 finished with value: 0.9047439555188416 and parameters: {'lda_solver': 'svd', 'lda_n_components': 1}. Best is trial 19 with value: 0.904744.[0m
[32m[I 2022-10-20 04:44:54,438][0m Trial 21 finished with value: 0.9047439555188416 and parameters: {'lda_solver': 'svd', 'lda_n_components': 1}. Best is trial 21 with value: 0.904744.[0m
[32m[I 2022-10-20 04:44:54,438][0m Trial 20 finished with value: 0.9047439555188416 and parameters: {'lda_solver': 'svd', 'lda_n_components': 1}. Best is trial 21 with value: 0.904744.[0m
[32m[I 2022-10-20 04:44:55,917][0m Trial 22 finished with value: 0.9047439555188416 and parameters: {'lda_solver': 'svd', 'lda_n_components': 1}. Best is trial 24 with value: 0.904744.[0m
[32m[I 2022-10-20 04:44:55,996][0m Trial 24 finished with value: 0.9047439555188416 and parameters: {'lda_solver': 'svd', 'lda_n_components': 1}. Best is trial 24 with value: 0.904744.[0m
[32m[I 2022-10-20 04:44:56,074][0m Trial 23 finished with value: 0.9047439555188416 and parameters: {'lda_solver': 'svd', 'lda_n_components': 1}. Best is trial 24 with value: 0.904744.[0m
[32m[I 2022-10-20 04:44:56,674][0m Trial 25 finished with value: 0.9047439555188416 and parameters: {'lda_solver': 'svd', 'lda_n_components': 4}. Best is trial 25 with value: 0.904744.[0m
[32m[I 2022-10-20 04:44:59,586][0m Trial 26 finished with value: 0.9047439555188416 and parameters: {'lda_solver': 'svd', 'lda_n_components': 4}. Best is trial 26 with value: 0.904744.[0m
[32m[I 2022-10-20 04:44:59,681][0m Trial 27 finished with value: 0.9047439555188416 and parameters: {'lda_solver': 'svd', 'lda_n_components': 4}. Best is trial 27 with value: 0.904744.[0m
[32m[I 2022-10-20 04:45:05,302][0m Trial 30 finished with value: 0.9047439555188416 and parameters: {'lda_solver': 'svd', 'lda_n_components': 2}. Best is trial 30 with value: 0.904744.[0m
[32m[I 2022-10-20 04:45:06,464][0m Trial 32 finished with value: 0.9047439555188416 and parameters: {'lda_solver': 'svd', 'lda_n_components': 2}. Best is trial 32 with value: 0.904744.[0m
[32m[I 2022-10-20 04:45:06,624][0m Trial 29 finished with value: 0.9047439555188416 and parameters: {'lda_solver': 'svd', 'lda_n_components': 1}. Best is trial 32 with value: 0.904744.[0m
[32m[I 2022-10-20 04:45:09,884][0m Trial 28 finished with value: 0.9047439555188416 and parameters: {'lda_solver': 'svd', 'lda_n_components': 1}. Best is trial 32 with value: 0.904744.[0m
[32m[I 2022-10-20 04:45:10,644][0m Trial 31 finished with value: 0.9047439555188416 and parameters: {'lda_solver': 'svd', 'lda_n_components': 2}. Best is trial 34 with value: 0.904744.[0m
[32m[I 2022-10-20 04:45:10,723][0m Trial 34 finished with value: 0.9047439555188416 and parameters: {'lda_solver': 'svd', 'lda_n_components': 4}. Best is trial 35 with value: 0.904744.[0m
[32m[I 2022-10-20 04:45:10,739][0m Trial 33 finished with value: 0.9047439555188416 and parameters: {'lda_solver': 'svd', 'lda_n_components': 4}. Best is trial 35 with value: 0.904744.[0m
[32m[I 2022-10-20 04:45:10,802][0m Trial 35 finished with value: 0.9047439555188416 and parameters: {'lda_solver': 'svd', 'lda_n_components': 4}. Best is trial 35 with value: 0.904744.[0m
[32m[I 2022-10-20 04:45:16,546][0m Trial 36 finished with value: 0.9047439555188416 and parameters: {'lda_solver': 'svd', 'lda_n_components': 3}. Best is trial 36 with value: 0.904744.[0m
[32m[I 2022-10-20 04:45:18,382][0m Trial 37 finished with value: 0.9047439555188416 and parameters: {'lda_solver': 'svd', 'lda_n_components': 3}. Best is trial 37 with value: 0.904744.[0m
[32m[I 2022-10-20 04:45:18,460][0m Trial 39 finished with value: 0.9047439555188416 and parameters: {'lda_solver': 'svd', 'lda_n_components': 3}. Best is trial 39 with value: 0.904744.[0m
[32m[I 2022-10-20 04:45:19,190][0m Trial 38 finished with value: 0.9047439555188416 and parameters: {'lda_solver': 'svd', 'lda_n_components': 3}. Best is trial 39 with value: 0.904744.[0m
[32m[I 2022-10-20 04:45:19,628][0m Trial 41 finished with value: 0.9045171792659163 and parameters: {'lda_solver': 'lsqr', 'lda_n_components': 1, 'lda_tol': 0.0001}. Best is trial 1 with value: 0.904744.[0m
[32m[I 2022-10-20 04:45:19,644][0m Trial 42 finished with value: 0.9045171792659163 and parameters: {'lda_solver': 'lsqr', 'lda_n_components': 1, 'lda_tol': 0.0001}. Best is trial 1 with value: 0.904744.[0m
[32m[I 2022-10-20 04:45:19,644][0m Trial 40 finished with value: 0.9045171792659163 and parameters: {'lda_solver': 'lsqr', 'lda_n_components': 1, 'lda_tol': 0.0001}. Best is trial 1 with value: 0.904744.[0m
[32m[I 2022-10-20 04:45:19,863][0m Trial 43 finished with value: 0.9045171792659163 and parameters: {'lda_solver': 'lsqr', 'lda_n_components': 1, 'lda_tol': 0.0001}. Best is trial 1 with value: 0.904744.[0m
[32m[I 2022-10-20 04:45:20,615][0m Trial 44 finished with value: 0.9045171792659163 and parameters: {'lda_solver': 'lsqr', 'lda_n_components': 1, 'lda_tol': 0.0001}. Best is trial 1 with value: 0.904744.[0m
[32m[I 2022-10-20 04:45:22,014][0m Trial 45 finished with value: 0.9045171792659163 and parameters: {'lda_solver': 'lsqr', 'lda_n_components': 1, 'lda_tol': 0.0001}. Best is trial 1 with value: 0.904744.[0m
[32m[I 2022-10-20 04:45:22,186][0m Trial 46 finished with value: 0.9045171792659163 and parameters: {'lda_solver': 'lsqr', 'lda_n_components': 1, 'lda_tol': 0.0001}. Best is trial 1 with value: 0.904744.[0m
[32m[I 2022-10-20 04:45:22,813][0m Trial 47 finished with value: 0.9045171792659163 and parameters: {'lda_solver': 'lsqr', 'lda_n_components': 1, 'lda_tol': 0.0001}. Best is trial 1 with value: 0.904744.[0m
[32m[I 2022-10-20 04:45:26,021][0m Trial 48 finished with value: 0.9047439555188416 and parameters: {'lda_solver': 'svd', 'lda_n_components': 4}. Best is trial 48 with value: 0.904744.[0m
[32m[I 2022-10-20 04:45:31,185][0m Trial 51 finished with value: 0.9047439555188416 and parameters: {'lda_solver': 'svd', 'lda_n_components': 4}. Best is trial 51 with value: 0.904744.[0m
[32m[I 2022-10-20 04:45:31,560][0m Trial 53 finished with value: 0.9047439555188416 and parameters: {'lda_solver': 'svd', 'lda_n_components': 4}. Best is trial 53 with value: 0.904744.[0m
[32m[I 2022-10-20 04:45:31,653][0m Trial 49 finished with value: 0.9047439555188416 and parameters: {'lda_solver': 'svd', 'lda_n_components': 4}. Best is trial 53 with value: 0.904744.[0m
[32m[I 2022-10-20 04:45:31,653][0m Trial 50 finished with value: 0.9047439555188416 and parameters: {'lda_solver': 'svd', 'lda_n_components': 4}. Best is trial 53 with value: 0.904744.[0m
[32m[I 2022-10-20 04:45:31,826][0m Trial 52 finished with value: 0.9047439555188416 and parameters: {'lda_solver': 'svd', 'lda_n_components': 4}. Best is trial 53 with value: 0.904744.[0m
[32m[I 2022-10-20 04:45:33,144][0m Trial 54 finished with value: 0.9045171792659163 and parameters: {'lda_solver': 'eigen', 'lda_n_components': 2, 'lda_tol': 0.001}. Best is trial 1 with value: 0.904744.[0m
[32m[I 2022-10-20 04:45:33,536][0m Trial 55 finished with value: 0.9045171792659163 and parameters: {'lda_solver': 'eigen', 'lda_n_components': 2, 'lda_tol': 0.001}. Best is trial 1 with value: 0.904744.[0m
[32m[I 2022-10-20 04:45:35,120][0m Trial 56 finished with value: 0.9045171792659163 and parameters: {'lda_solver': 'eigen', 'lda_n_components': 2, 'lda_tol': 0.001}. Best is trial 1 with value: 0.904744.[0m
[32m[I 2022-10-20 04:45:36,095][0m Trial 57 finished with value: 0.9045171792659163 and parameters: {'lda_solver': 'eigen', 'lda_n_components': 4, 'lda_tol': 0.001}. Best is trial 1 with value: 0.904744.[0m
[32m[I 2022-10-20 04:45:38,862][0m Trial 58 finished with value: 0.9045171792659163 and parameters: {'lda_solver': 'eigen', 'lda_n_components': 4, 'lda_tol': 0.001}. Best is trial 63 with value: 0.904744.[0m
[32m[I 2022-10-20 04:45:38,862][0m Trial 63 finished with value: 0.9047439555188416 and parameters: {'lda_solver': 'svd', 'lda_n_components': 4}. Best is trial 63 with value: 0.904744.[0m
[32m[I 2022-10-20 04:45:38,862][0m Trial 59 finished with value: 0.9045171792659163 and parameters: {'lda_solver': 'eigen', 'lda_n_components': 4, 'lda_tol': 0.001}. Best is trial 63 with value: 0.904744.[0m
[32m[I 2022-10-20 04:45:42,071][0m Trial 60 finished with value: 0.9045171792659163 and parameters: {'lda_solver': 'eigen', 'lda_n_components': 4, 'lda_tol': 0.001}. Best is trial 63 with value: 0.904744.[0m
[32m[I 2022-10-20 04:45:42,277][0m Trial 64 finished with value: 0.9047439555188416 and parameters: {'lda_solver': 'svd', 'lda_n_components': 1}. Best is trial 64 with value: 0.904744.[0m
[32m[I 2022-10-20 04:45:42,371][0m Trial 65 finished with value: 0.9047439555188416 and parameters: {'lda_solver': 'svd', 'lda_n_components': 4}. Best is trial 65 with value: 0.904744.[0m
[32m[I 2022-10-20 04:45:42,638][0m Trial 62 finished with value: 0.9045171792659163 and parameters: {'lda_solver': 'eigen', 'lda_n_components': 4, 'lda_tol': 0.001}. Best is trial 65 with value: 0.904744.[0m
[32m[I 2022-10-20 04:45:43,093][0m Trial 61 finished with value: 0.9045171792659163 and parameters: {'lda_solver': 'eigen', 'lda_n_components': 4, 'lda_tol': 0.001}. Best is trial 65 with value: 0.904744.[0m
[32m[I 2022-10-20 04:45:48,014][0m Trial 67 finished with value: 0.9047439555188416 and parameters: {'lda_solver': 'svd', 'lda_n_components': 2}. Best is trial 68 with value: 0.904744.[0m
[32m[I 2022-10-20 04:45:48,014][0m Trial 68 finished with value: 0.9047439555188416 and parameters: {'lda_solver': 'svd', 'lda_n_components': 2}. Best is trial 68 with value: 0.904744.[0m
[32m[I 2022-10-20 04:45:48,014][0m Trial 66 finished with value: 0.9047439555188416 and parameters: {'lda_solver': 'svd', 'lda_n_components': 2}. Best is trial 68 with value: 0.904744.[0m
[32m[I 2022-10-20 04:45:54,643][0m Trial 73 finished with value: 0.9047439555188416 and parameters: {'lda_solver': 'svd', 'lda_n_components': 2}. Best is trial 73 with value: 0.904744.[0m
[32m[I 2022-10-20 04:45:54,643][0m Trial 70 finished with value: 0.9047439555188416 and parameters: {'lda_solver': 'svd', 'lda_n_components': 2}. Best is trial 73 with value: 0.904744.[0m
[32m[I 2022-10-20 04:45:54,643][0m Trial 72 finished with value: 0.9047439555188416 and parameters: {'lda_solver': 'svd', 'lda_n_components': 2}. Best is trial 73 with value: 0.904744.[0m
[32m[I 2022-10-20 04:45:54,643][0m Trial 71 finished with value: 0.9047439555188416 and parameters: {'lda_solver': 'svd', 'lda_n_components': 2}. Best is trial 73 with value: 0.904744.[0m
[32m[I 2022-10-20 04:45:54,706][0m Trial 69 finished with value: 0.9047439555188416 and parameters: {'lda_solver': 'svd', 'lda_n_components': 2}. Best is trial 73 with value: 0.904744.[0m
[32m[I 2022-10-20 04:46:00,183][0m Trial 74 finished with value: 0.9047439555188416 and parameters: {'lda_solver': 'svd', 'lda_n_components': 2}. Best is trial 74 with value: 0.904744.[0m
[32m[I 2022-10-20 04:46:00,433][0m Trial 75 finished with value: 0.9047439555188416 and parameters: {'lda_solver': 'svd', 'lda_n_components': 2}. Best is trial 76 with value: 0.904744.[0m
[32m[I 2022-10-20 04:46:00,433][0m Trial 76 finished with value: 0.9047439555188416 and parameters: {'lda_solver': 'svd', 'lda_n_components': 2}. Best is trial 76 with value: 0.904744.[0m
[32m[I 2022-10-20 04:46:07,275][0m Trial 79 finished with value: 0.9047439555188416 and parameters: {'lda_solver': 'svd', 'lda_n_components': 3}. Best is trial 81 with value: 0.904744.[0m
[32m[I 2022-10-20 04:46:07,275][0m Trial 80 finished with value: 0.9047439555188416 and parameters: {'lda_solver': 'svd', 'lda_n_components': 3}. Best is trial 81 with value: 0.904744.[0m
[32m[I 2022-10-20 04:46:07,416][0m Trial 78 finished with value: 0.9047439555188416 and parameters: {'lda_solver': 'svd', 'lda_n_components': 3}. Best is trial 81 with value: 0.904744.[0m
[32m[I 2022-10-20 04:46:10,552][0m Trial 81 finished with value: 0.9047439555188416 and parameters: {'lda_solver': 'svd', 'lda_n_components': 3}. Best is trial 81 with value: 0.904744.[0m
[32m[I 2022-10-20 04:46:10,818][0m Trial 77 finished with value: 0.9047439555188416 and parameters: {'lda_solver': 'svd', 'lda_n_components': 3}. Best is trial 81 with value: 0.904744.[0m
[32m[I 2022-10-20 04:46:11,573][0m Trial 82 finished with value: 0.9047439555188416 and parameters: {'lda_solver': 'svd', 'lda_n_components': 3}. Best is trial 84 with value: 0.904744.[0m
[32m[I 2022-10-20 04:46:11,573][0m Trial 83 finished with value: 0.9047439555188416 and parameters: {'lda_solver': 'svd', 'lda_n_components': 3}. Best is trial 84 with value: 0.904744.[0m
[32m[I 2022-10-20 04:46:11,714][0m Trial 84 finished with value: 0.9047439555188416 and parameters: {'lda_solver': 'svd', 'lda_n_components': 3}. Best is trial 84 with value: 0.904744.[0m
