[32m[I 2022-10-20 03:38:26,309][0m Trial 77 finished with value: 0.418140026134891 and parameters: {'compnb_alpha': 0.15000000000000002, 'compnb_fit_prior': False, 'compnb_norm': False}. Best is trial 0 with value: 0.41814.[0m
[32m[I 2022-10-20 03:38:26,309][0m Trial 82 finished with value: 0.418140026134891 and parameters: {'compnb_alpha': 0.15000000000000002, 'compnb_fit_prior': False, 'compnb_norm': False}. Best is trial 0 with value: 0.41814.[0m
[32m[I 2022-10-20 03:38:26,450][0m Trial 79 finished with value: 0.418140026134891 and parameters: {'compnb_alpha': 0.15000000000000002, 'compnb_fit_prior': False, 'compnb_norm': False}. Best is trial 0 with value: 0.41814.[0m
[32m[I 2022-10-20 03:38:26,513][0m Trial 80 finished with value: 0.418140026134891 and parameters: {'compnb_alpha': 0.15000000000000002, 'compnb_fit_prior': False, 'compnb_norm': False}. Best is trial 0 with value: 0.41814.[0m
[32m[I 2022-10-20 03:38:28,320][0m Trial 83 finished with value: 0.418140026134891 and parameters: {'compnb_alpha': 0.15000000000000002, 'compnb_fit_prior': False, 'compnb_norm': False}. Best is trial 0 with value: 0.41814.[0m
[32m[I 2022-10-20 03:38:28,806][0m Trial 84 finished with value: 0.418140026134891 and parameters: {'compnb_alpha': 1.0, 'compnb_fit_prior': False, 'compnb_norm': False}. Best is trial 0 with value: 0.41814.[0m
[32m[I 2022-10-20 03:38:29,229][0m Trial 85 finished with value: 0.418140026134891 and parameters: {'compnb_alpha': 0.35000000000000003, 'compnb_fit_prior': True, 'compnb_norm': False}. Best is trial 0 with value: 0.41814.[0m
[32m[I 2022-10-20 03:38:29,448][0m Trial 86 finished with value: 0.418140026134891 and parameters: {'compnb_alpha': 0.30000000000000004, 'compnb_fit_prior': True, 'compnb_norm': False}. Best is trial 0 with value: 0.41814.[0m
[32m[I 2022-10-20 03:38:29,448][0m Trial 90 finished with value: 0.418140026134891 and parameters: {'compnb_alpha': 0.35000000000000003, 'compnb_fit_prior': True, 'compnb_norm': False}. Best is trial 0 with value: 0.41814.[0m
[32m[I 2022-10-20 03:38:29,464][0m Trial 89 finished with value: 0.418140026134891 and parameters: {'compnb_alpha': 0.35000000000000003, 'compnb_fit_prior': True, 'compnb_norm': False}. Best is trial 0 with value: 0.41814.[0m
[32m[I 2022-10-20 03:38:29,464][0m Trial 88 finished with value: 0.418140026134891 and parameters: {'compnb_alpha': 0.35000000000000003, 'compnb_fit_prior': True, 'compnb_norm': False}. Best is trial 0 with value: 0.41814.[0m
[32m[I 2022-10-20 03:38:29,714][0m Trial 87 finished with value: 0.418140026134891 and parameters: {'compnb_alpha': 0.35000000000000003, 'compnb_fit_prior': True, 'compnb_norm': False}. Best is trial 0 with value: 0.41814.[0m
[32m[I 2022-10-20 03:38:30,153][0m Trial 91 finished with value: 0.418140026134891 and parameters: {'compnb_alpha': 0.35000000000000003, 'compnb_fit_prior': True, 'compnb_norm': False}. Best is trial 0 with value: 0.41814.[0m
[32m[I 2022-10-20 03:38:31,588][0m Trial 92 finished with value: 0.418140026134891 and parameters: {'compnb_alpha': 0.35000000000000003, 'compnb_fit_prior': True, 'compnb_norm': False}. Best is trial 0 with value: 0.41814.[0m
[32m[I 2022-10-20 03:38:31,933][0m Trial 93 finished with value: 0.418140026134891 and parameters: {'compnb_alpha': 0.55, 'compnb_fit_prior': False, 'compnb_norm': False}. Best is trial 0 with value: 0.41814.[0m
[32m[I 2022-10-20 03:38:32,152][0m Trial 96 finished with value: 0.418140026134891 and parameters: {'compnb_alpha': 0.55, 'compnb_fit_prior': False, 'compnb_norm': False}. Best is trial 0 with value: 0.41814.[0m
[32m[I 2022-10-20 03:38:32,152][0m Trial 94 finished with value: 0.418140026134891 and parameters: {'compnb_alpha': 0.55, 'compnb_fit_prior': False, 'compnb_norm': False}. Best is trial 0 with value: 0.41814.[0m
[32m[I 2022-10-20 03:38:32,293][0m Trial 97 finished with value: 0.418140026134891 and parameters: {'compnb_alpha': 0.55, 'compnb_fit_prior': False, 'compnb_norm': False}. Best is trial 0 with value: 0.41814.[0m
[32m[I 2022-10-20 03:38:32,293][0m Trial 99 finished with value: 0.418140026134891 and parameters: {'compnb_alpha': 0.55, 'compnb_fit_prior': False, 'compnb_norm': False}. Best is trial 0 with value: 0.41814.[0m
[32m[I 2022-10-20 03:38:32,293][0m Trial 98 finished with value: 0.418140026134891 and parameters: {'compnb_alpha': 0.55, 'compnb_fit_prior': False, 'compnb_norm': False}. Best is trial 0 with value: 0.41814.[0m
[32m[I 2022-10-20 03:38:32,481][0m Trial 95 finished with value: 0.418140026134891 and parameters: {'compnb_alpha': 0.55, 'compnb_fit_prior': False, 'compnb_norm': False}. Best is trial 0 with value: 0.41814.[0m
[32m[I 2022-10-20 03:38:32,544][0m Study finished.[0m
[32m[I 2022-10-20 03:38:32,622][0m --------------------------------------------------------------------------------[0m
[32m[I 2022-10-20 03:38:32,622][0m --------------------         DecisionTreeClassifier         --------------------[0m
[32m[I 2022-10-20 03:38:32,622][0m --------------------------------------------------------------------------------[0m
[32m[I 2022-10-20 03:38:32,653][0m A new study created in RDB with name: DecisionTreeClassifier_b4f53b70[0m
[32m[I 2022-10-20 03:38:32,669][0m Study started.[0m
[32m[I 2022-10-20 03:38:33,547][0m Trial 6 finished with value: 0.5830063118982048 and parameters: {'dtc_criterion': 'gini', 'dtc_splitter': 'random', 'dtc_min_samples_split': 5, 'dtc_min_samples_leaf': 10, 'dtc_max_features': 2}. Best is trial 6 with value: 0.583006.[0m
[32m[I 2022-10-20 03:38:33,910][0m Trial 4 finished with value: 0.4926131332700408 and parameters: {'dtc_criterion': 'gini', 'dtc_splitter': 'best', 'dtc_min_samples_split': 49, 'dtc_min_samples_leaf': 46, 'dtc_max_features': 4}. Best is trial 6 with value: 0.583006.[0m
[32m[I 2022-10-20 03:38:34,256][0m Trial 3 finished with value: 0.9916316441494685 and parameters: {'dtc_criterion': 'entropy', 'dtc_splitter': 'random', 'dtc_min_samples_split': 6, 'dtc_min_samples_leaf': 2, 'dtc_max_features': 10}. Best is trial 3 with value: 0.991632.[0m
[32m[I 2022-10-20 03:38:34,382][0m Trial 2 finished with value: 0.9915920527922204 and parameters: {'dtc_criterion': 'entropy', 'dtc_splitter': 'random', 'dtc_min_samples_split': 42, 'dtc_min_samples_leaf': 13, 'dtc_max_features': 40}. Best is trial 3 with value: 0.991632.[0m
[32m[I 2022-10-20 03:38:34,586][0m Trial 7 finished with value: 0.9653597224995716 and parameters: {'dtc_criterion': 'gini', 'dtc_splitter': 'best', 'dtc_min_samples_split': 2, 'dtc_min_samples_leaf': 3, 'dtc_max_features': 18}. Best is trial 3 with value: 0.991632.[0m
[32m[I 2022-10-20 03:38:34,853][0m Trial 1 finished with value: 0.99152145602855 and parameters: {'dtc_criterion': 'entropy', 'dtc_splitter': 'best', 'dtc_min_samples_split': 24, 'dtc_min_samples_leaf': 21, 'dtc_max_features': 35}. Best is trial 0 with value: 0.99175.[0m
[32m[I 2022-10-20 03:38:34,853][0m Trial 0 finished with value: 0.9917501565699266 and parameters: {'dtc_criterion': 'entropy', 'dtc_splitter': 'best', 'dtc_min_samples_split': 42, 'dtc_min_samples_leaf': 6, 'dtc_max_features': 34}. Best is trial 0 with value: 0.99175.[0m
[32m[I 2022-10-20 03:38:35,166][0m Trial 5 finished with value: 0.9918402190571304 and parameters: {'dtc_criterion': 'gini', 'dtc_splitter': 'best', 'dtc_min_samples_split': 42, 'dtc_min_samples_leaf': 37, 'dtc_max_features': 48}. Best is trial 5 with value: 0.99184.[0m
[32m[I 2022-10-20 03:38:35,244][0m Trial 9 finished with value: 0.2844441188051378 and parameters: {'dtc_criterion': 'gini', 'dtc_splitter': 'random', 'dtc_min_samples_split': 28, 'dtc_min_samples_leaf': 34, 'dtc_max_features': 2}. Best is trial 5 with value: 0.99184.[0m
[32m[I 2022-10-20 03:38:35,526][0m Trial 8 finished with value: 0.9915567731756948 and parameters: {'dtc_criterion': 'entropy', 'dtc_splitter': 'best', 'dtc_min_samples_split': 20, 'dtc_min_samples_leaf': 32, 'dtc_max_features': 25}. Best is trial 5 with value: 0.99184.[0m
[32m[I 2022-10-20 03:38:35,823][0m Trial 12 finished with value: 0.2844441188051378 and parameters: {'dtc_criterion': 'gini', 'dtc_splitter': 'best', 'dtc_min_samples_split': 45, 'dtc_min_samples_leaf': 49, 'dtc_max_features': 1}. Best is trial 5 with value: 0.99184.[0m
[32m[I 2022-10-20 03:38:36,012][0m Trial 10 finished with value: 0.9914951005813554 and parameters: {'dtc_criterion': 'gini', 'dtc_splitter': 'best', 'dtc_min_samples_split': 19, 'dtc_min_samples_leaf': 21, 'dtc_max_features': 20}. Best is trial 5 with value: 0.99184.[0m
[32m[I 2022-10-20 03:38:36,168][0m Trial 11 finished with value: 0.9917638973114568 and parameters: {'dtc_criterion': 'entropy', 'dtc_splitter': 'random', 'dtc_min_samples_split': 7, 'dtc_min_samples_leaf': 14, 'dtc_max_features': 33}. Best is trial 5 with value: 0.99184.[0m
[32m[I 2022-10-20 03:38:36,529][0m Trial 14 finished with value: 0.9679546466543487 and parameters: {'dtc_criterion': 'entropy', 'dtc_splitter': 'random', 'dtc_min_samples_split': 12, 'dtc_min_samples_leaf': 18, 'dtc_max_features': 17}. Best is trial 5 with value: 0.99184.[0m
[32m[I 2022-10-20 03:38:36,780][0m Trial 16 finished with value: 0.9667761537827118 and parameters: {'dtc_criterion': 'gini', 'dtc_splitter': 'random', 'dtc_min_samples_split': 46, 'dtc_min_samples_leaf': 19, 'dtc_max_features': 17}. Best is trial 5 with value: 0.99184.[0m
[32m[I 2022-10-20 03:38:37,031][0m Trial 13 finished with value: 0.9915802572905024 and parameters: {'dtc_criterion': 'gini', 'dtc_splitter': 'best', 'dtc_min_samples_split': 39, 'dtc_min_samples_leaf': 26, 'dtc_max_features': 22}. Best is trial 5 with value: 0.99184.[0m
[32m[I 2022-10-20 03:38:37,250][0m Trial 15 finished with value: 0.9917626245100568 and parameters: {'dtc_criterion': 'entropy', 'dtc_splitter': 'best', 'dtc_min_samples_split': 35, 'dtc_min_samples_leaf': 49, 'dtc_max_features': 40}. Best is trial 5 with value: 0.99184.[0m
[32m[I 2022-10-20 03:38:37,594][0m Trial 17 finished with value: 0.9915737773778959 and parameters: {'dtc_criterion': 'gini', 'dtc_splitter': 'best', 'dtc_min_samples_split': 33, 'dtc_min_samples_leaf': 45, 'dtc_max_features': 46}. Best is trial 5 with value: 0.99184.[0m
[32m[I 2022-10-20 03:38:37,844][0m Trial 20 finished with value: 0.9914428926933972 and parameters: {'dtc_criterion': 'entropy', 'dtc_splitter': 'random', 'dtc_min_samples_split': 36, 'dtc_min_samples_leaf': 37, 'dtc_max_features': 49}. Best is trial 5 with value: 0.99184.[0m
[32m[I 2022-10-20 03:38:38,063][0m Trial 18 finished with value: 0.9917649574778657 and parameters: {'dtc_criterion': 'entropy', 'dtc_splitter': 'best', 'dtc_min_samples_split': 36, 'dtc_min_samples_leaf': 39, 'dtc_max_features': 50}. Best is trial 5 with value: 0.99184.[0m
[32m[I 2022-10-20 03:38:38,293][0m Trial 19 finished with value: 0.9919405295424999 and parameters: {'dtc_criterion': 'entropy', 'dtc_splitter': 'best', 'dtc_min_samples_split': 33, 'dtc_min_samples_leaf': 38, 'dtc_max_features': 50}. Best is trial 19 with value: 0.991941.[0m
[32m[I 2022-10-20 03:38:38,293][0m Trial 21 finished with value: 0.9914346248475914 and parameters: {'dtc_criterion': 'gini', 'dtc_splitter': 'random', 'dtc_min_samples_split': 35, 'dtc_min_samples_leaf': 38, 'dtc_max_features': 48}. Best is trial 19 with value: 0.991941.[0m
[32m[I 2022-10-20 03:38:38,575][0m Trial 22 finished with value: 0.991491952966004 and parameters: {'dtc_criterion': 'entropy', 'dtc_splitter': 'random', 'dtc_min_samples_split': 33, 'dtc_min_samples_leaf': 39, 'dtc_max_features': 50}. Best is trial 19 with value: 0.991941.[0m
[32m[I 2022-10-20 03:38:38,827][0m Trial 23 finished with value: 0.9916753205334641 and parameters: {'dtc_criterion': 'entropy', 'dtc_splitter': 'random', 'dtc_min_samples_split': 31, 'dtc_min_samples_leaf': 40, 'dtc_max_features': 45}. Best is trial 19 with value: 0.991941.[0m
[32m[I 2022-10-20 03:38:39,035][0m Trial 24 finished with value: 0.9914371432204696 and parameters: {'dtc_criterion': 'entropy', 'dtc_splitter': 'random', 'dtc_min_samples_split': 32, 'dtc_min_samples_leaf': 41, 'dtc_max_features': 49}. Best is trial 19 with value: 0.991941.[0m
[32m[I 2022-10-20 03:38:39,272][0m Trial 25 finished with value: 0.991491952966004 and parameters: {'dtc_criterion': 'entropy', 'dtc_splitter': 'random', 'dtc_min_samples_split': 13, 'dtc_min_samples_leaf': 39, 'dtc_max_features': 50}. Best is trial 19 with value: 0.991941.[0m
[32m[I 2022-10-20 03:38:39,525][0m Trial 26 finished with value: 0.9906895684787256 and parameters: {'dtc_criterion': 'entropy', 'dtc_splitter': 'random', 'dtc_min_samples_split': 12, 'dtc_min_samples_leaf': 28, 'dtc_max_features': 33}. Best is trial 19 with value: 0.991941.[0m
[32m[I 2022-10-20 03:38:40,072][0m Trial 27 finished with value: 0.9917706808774684 and parameters: {'dtc_criterion': 'entropy', 'dtc_splitter': 'best', 'dtc_min_samples_split': 28, 'dtc_min_samples_leaf': 40, 'dtc_max_features': 42}. Best is trial 19 with value: 0.991941.[0m
[32m[I 2022-10-20 03:38:40,275][0m Trial 28 finished with value: 0.9918039819793378 and parameters: {'dtc_criterion': 'entropy', 'dtc_splitter': 'best', 'dtc_min_samples_split': 28, 'dtc_min_samples_leaf': 42, 'dtc_max_features': 42}. Best is trial 19 with value: 0.991941.[0m
[32m[I 2022-10-20 03:38:40,275][0m Trial 30 finished with value: 0.991898038939325 and parameters: {'dtc_criterion': 'entropy', 'dtc_splitter': 'best', 'dtc_min_samples_split': 29, 'dtc_min_samples_leaf': 29, 'dtc_max_features': 44}. Best is trial 19 with value: 0.991941.[0m
[32m[I 2022-10-20 03:38:40,733][0m Trial 29 finished with value: 0.9917609320744357 and parameters: {'dtc_criterion': 'entropy', 'dtc_splitter': 'best', 'dtc_min_samples_split': 29, 'dtc_min_samples_leaf': 28, 'dtc_max_features': 43}. Best is trial 19 with value: 0.991941.[0m
[32m[I 2022-10-20 03:38:40,953][0m Trial 31 finished with value: 0.991776647573181 and parameters: {'dtc_criterion': 'entropy', 'dtc_splitter': 'best', 'dtc_min_samples_split': 27, 'dtc_min_samples_leaf': 29, 'dtc_max_features': 41}. Best is trial 19 with value: 0.991941.[0m
[32m[I 2022-10-20 03:38:41,140][0m Trial 32 finished with value: 0.9917090329625128 and parameters: {'dtc_criterion': 'entropy', 'dtc_splitter': 'best', 'dtc_min_samples_split': 39, 'dtc_min_samples_leaf': 29, 'dtc_max_features': 43}. Best is trial 19 with value: 0.991941.[0m
[32m[I 2022-10-20 03:38:41,359][0m Trial 33 finished with value: 0.9916445556189817 and parameters: {'dtc_criterion': 'entropy', 'dtc_splitter': 'best', 'dtc_min_samples_split': 39, 'dtc_min_samples_leaf': 31, 'dtc_max_features': 42}. Best is trial 19 with value: 0.991941.[0m
[32m[I 2022-10-20 03:38:41,531][0m Trial 34 finished with value: 0.9918331092877827 and parameters: {'dtc_criterion': 'entropy', 'dtc_splitter': 'best', 'dtc_min_samples_split': 40, 'dtc_min_samples_leaf': 30, 'dtc_max_features': 42}. Best is trial 19 with value: 0.991941.[0m
[32m[I 2022-10-20 03:38:42,079][0m Trial 36 finished with value: 0.991643621586761 and parameters: {'dtc_criterion': 'gini', 'dtc_splitter': 'best', 'dtc_min_samples_split': 23, 'dtc_min_samples_leaf': 29, 'dtc_max_features': 36}. Best is trial 19 with value: 0.991941.[0m
[32m[I 2022-10-20 03:38:42,079][0m Trial 35 finished with value: 0.991574762965718 and parameters: {'dtc_criterion': 'gini', 'dtc_splitter': 'best', 'dtc_min_samples_split': 40, 'dtc_min_samples_leaf': 33, 'dtc_max_features': 36}. Best is trial 19 with value: 0.991941.[0m
[32m[I 2022-10-20 03:38:42,172][0m Trial 37 finished with value: 0.9916594593724612 and parameters: {'dtc_criterion': 'gini', 'dtc_splitter': 'best', 'dtc_min_samples_split': 41, 'dtc_min_samples_leaf': 31, 'dtc_max_features': 37}. Best is trial 19 with value: 0.991941.[0m
[32m[I 2022-10-20 03:38:42,579][0m Trial 38 finished with value: 0.9915505408629349 and parameters: {'dtc_criterion': 'entropy', 'dtc_splitter': 'best', 'dtc_min_samples_split': 23, 'dtc_min_samples_leaf': 32, 'dtc_max_features': 37}. Best is trial 19 with value: 0.991941.[0m
[32m[I 2022-10-20 03:38:42,861][0m Trial 39 finished with value: 0.9915852038961708 and parameters: {'dtc_criterion': 'entropy', 'dtc_splitter': 'best', 'dtc_min_samples_split': 24, 'dtc_min_samples_leaf': 34, 'dtc_max_features': 36}. Best is trial 19 with value: 0.991941.[0m
[32m[I 2022-10-20 03:38:43,196][0m Trial 40 finished with value: 0.9917433701470028 and parameters: {'dtc_criterion': 'entropy', 'dtc_splitter': 'best', 'dtc_min_samples_split': 23, 'dtc_min_samples_leaf': 35, 'dtc_max_features': 37}. Best is trial 19 with value: 0.991941.[0m
[32m[I 2022-10-20 03:38:43,196][0m Trial 41 finished with value: 0.9916928965369507 and parameters: {'dtc_criterion': 'entropy', 'dtc_splitter': 'best', 'dtc_min_samples_split': 22, 'dtc_min_samples_leaf': 35, 'dtc_max_features': 36}. Best is trial 19 with value: 0.991941.[0m
[32m[I 2022-10-20 03:38:43,553][0m Trial 42 finished with value: 0.9915852038961708 and parameters: {'dtc_criterion': 'entropy', 'dtc_splitter': 'best', 'dtc_min_samples_split': 24, 'dtc_min_samples_leaf': 34, 'dtc_max_features': 36}. Best is trial 19 with value: 0.991941.[0m
[32m[I 2022-10-20 03:38:43,935][0m Trial 43 finished with value: 0.9917496607891703 and parameters: {'dtc_criterion': 'entropy', 'dtc_splitter': 'best', 'dtc_min_samples_split': 50, 'dtc_min_samples_leaf': 35, 'dtc_max_features': 28}. Best is trial 19 with value: 0.991941.[0m
[32m[I 2022-10-20 03:38:44,155][0m Trial 44 finished with value: 0.9916311406438348 and parameters: {'dtc_criterion': 'entropy', 'dtc_splitter': 'best', 'dtc_min_samples_split': 44, 'dtc_min_samples_leaf': 35, 'dtc_max_features': 30}. Best is trial 19 with value: 0.991941.[0m
[32m[I 2022-10-20 03:38:44,248][0m Trial 45 finished with value: 0.9916311406438348 and parameters: {'dtc_criterion': 'entropy', 'dtc_splitter': 'best', 'dtc_min_samples_split': 50, 'dtc_min_samples_leaf': 35, 'dtc_max_features': 30}. Best is trial 19 with value: 0.991941.[0m
[32m[I 2022-10-20 03:38:44,546][0m Trial 46 finished with value: 0.9915206782598798 and parameters: {'dtc_criterion': 'entropy', 'dtc_splitter': 'best', 'dtc_min_samples_split': 44, 'dtc_min_samples_leaf': 24, 'dtc_max_features': 31}. Best is trial 19 with value: 0.991941.[0m
[32m[I 2022-10-20 03:38:44,641][0m Trial 47 finished with value: 0.9917227294324059 and parameters: {'dtc_criterion': 'entropy', 'dtc_splitter': 'best', 'dtc_min_samples_split': 50, 'dtc_min_samples_leaf': 24, 'dtc_max_features': 30}. Best is trial 19 with value: 0.991941.[0m
[32m[I 2022-10-20 03:38:45,065][0m Trial 48 finished with value: 0.9915723853965965 and parameters: {'dtc_criterion': 'entropy', 'dtc_splitter': 'best', 'dtc_min_samples_split': 48, 'dtc_min_samples_leaf': 42, 'dtc_max_features': 31}. Best is trial 19 with value: 0.991941.[0m
[32m[I 2022-10-20 03:38:45,222][0m Trial 49 finished with value: 0.9916090005493862 and parameters: {'dtc_criterion': 'entropy', 'dtc_splitter': 'best', 'dtc_min_samples_split': 50, 'dtc_min_samples_leaf': 43, 'dtc_max_features': 46}. Best is trial 19 with value: 0.991941.[0m
[32m[I 2022-10-20 03:38:45,522][0m Trial 50 finished with value: 0.9916090005493862 and parameters: {'dtc_criterion': 'entropy', 'dtc_splitter': 'best', 'dtc_min_samples_split': 43, 'dtc_min_samples_leaf': 43, 'dtc_max_features': 46}. Best is trial 19 with value: 0.991941.[0m
[32m[I 2022-10-20 03:38:46,100][0m Trial 51 finished with value: 0.9916090005493862 and parameters: {'dtc_criterion': 'entropy', 'dtc_splitter': 'best', 'dtc_min_samples_split': 43, 'dtc_min_samples_leaf': 43, 'dtc_max_features': 46}. Best is trial 19 with value: 0.991941.[0m
[32m[I 2022-10-20 03:38:46,100][0m Trial 53 finished with value: 0.9917491826617959 and parameters: {'dtc_criterion': 'gini', 'dtc_splitter': 'best', 'dtc_min_samples_split': 47, 'dtc_min_samples_leaf': 43, 'dtc_max_features': 46}. Best is trial 19 with value: 0.991941.[0m
[32m[I 2022-10-20 03:38:46,100][0m Trial 52 finished with value: 0.9915665249466077 and parameters: {'dtc_criterion': 'gini', 'dtc_splitter': 'best', 'dtc_min_samples_split': 47, 'dtc_min_samples_leaf': 24, 'dtc_max_features': 46}. Best is trial 19 with value: 0.991941.[0m
[32m[I 2022-10-20 03:38:46,647][0m Trial 55 finished with value: 0.9917491826617959 and parameters: {'dtc_criterion': 'gini', 'dtc_splitter': 'best', 'dtc_min_samples_split': 18, 'dtc_min_samples_leaf': 43, 'dtc_max_features': 46}. Best is trial 19 with value: 0.991941.[0m
[32m[I 2022-10-20 03:38:46,851][0m Trial 54 finished with value: 0.9916494403126479 and parameters: {'dtc_criterion': 'gini', 'dtc_splitter': 'best', 'dtc_min_samples_split': 19, 'dtc_min_samples_leaf': 44, 'dtc_max_features': 46}. Best is trial 19 with value: 0.991941.[0m
[32m[I 2022-10-20 03:38:47,164][0m Trial 56 finished with value: 0.9916672340004088 and parameters: {'dtc_criterion': 'gini', 'dtc_splitter': 'best', 'dtc_min_samples_split': 37, 'dtc_min_samples_leaf': 46, 'dtc_max_features': 39}. Best is trial 19 with value: 0.991941.[0m
[32m[I 2022-10-20 03:38:47,257][0m Trial 57 finished with value: 0.9914970661565111 and parameters: {'dtc_criterion': 'gini', 'dtc_splitter': 'best', 'dtc_min_samples_split': 30, 'dtc_min_samples_leaf': 47, 'dtc_max_features': 47}. Best is trial 19 with value: 0.991941.[0m
[32m[I 2022-10-20 03:38:47,556][0m Trial 58 finished with value: 0.9916966209914685 and parameters: {'dtc_criterion': 'gini', 'dtc_splitter': 'best', 'dtc_min_samples_split': 26, 'dtc_min_samples_leaf': 46, 'dtc_max_features': 40}. Best is trial 19 with value: 0.991941.[0m
[32m[I 2022-10-20 03:38:48,096][0m Trial 61 finished with value: 0.9915996854462653 and parameters: {'dtc_criterion': 'entropy', 'dtc_splitter': 'best', 'dtc_min_samples_split': 30, 'dtc_min_samples_leaf': 47, 'dtc_max_features': 40}. Best is trial 19 with value: 0.991941.[0m
