[32m[I 2022-10-20 03:39:07,350][0m Trial 40 finished with value: 0.9913935087052574 and parameters: {'etc_criterion': 'entropy', 'etc_min_samples_split': 8, 'etc_min_samples_leaf': 27, 'etc_max_features': 45}. Best is trial 26 with value: 0.992029.[0m
[32m[I 2022-10-20 03:39:07,778][0m Trial 41 finished with value: 0.9913945106456004 and parameters: {'etc_criterion': 'entropy', 'etc_min_samples_split': 11, 'etc_min_samples_leaf': 28, 'etc_max_features': 45}. Best is trial 26 with value: 0.992029.[0m
[32m[I 2022-10-20 03:39:08,060][0m Trial 43 finished with value: 0.9913945106456004 and parameters: {'etc_criterion': 'entropy', 'etc_min_samples_split': 7, 'etc_min_samples_leaf': 28, 'etc_max_features': 45}. Best is trial 26 with value: 0.992029.[0m
[32m[I 2022-10-20 03:39:08,060][0m Trial 42 finished with value: 0.9912800132555843 and parameters: {'etc_criterion': 'entropy', 'etc_min_samples_split': 27, 'etc_min_samples_leaf': 28, 'etc_max_features': 44}. Best is trial 26 with value: 0.992029.[0m
[32m[I 2022-10-20 03:39:08,373][0m Trial 44 finished with value: 0.9915837388979127 and parameters: {'etc_criterion': 'entropy', 'etc_min_samples_split': 27, 'etc_min_samples_leaf': 21, 'etc_max_features': 39}. Best is trial 26 with value: 0.992029.[0m
[32m[I 2022-10-20 03:39:09,001][0m Trial 48 finished with value: 0.9916480825598153 and parameters: {'etc_criterion': 'entropy', 'etc_min_samples_split': 26, 'etc_min_samples_leaf': 7, 'etc_max_features': 38}. Best is trial 26 with value: 0.992029.[0m
[32m[I 2022-10-20 03:39:09,001][0m Trial 47 finished with value: 0.9916030574449737 and parameters: {'etc_criterion': 'entropy', 'etc_min_samples_split': 26, 'etc_min_samples_leaf': 7, 'etc_max_features': 39}. Best is trial 26 with value: 0.992029.[0m
[32m[I 2022-10-20 03:39:09,064][0m Trial 46 finished with value: 0.9915914658271308 and parameters: {'etc_criterion': 'entropy', 'etc_min_samples_split': 27, 'etc_min_samples_leaf': 6, 'etc_max_features': 40}. Best is trial 26 with value: 0.992029.[0m
[32m[I 2022-10-20 03:39:09,206][0m Trial 45 finished with value: 0.9915914658271308 and parameters: {'etc_criterion': 'entropy', 'etc_min_samples_split': 27, 'etc_min_samples_leaf': 6, 'etc_max_features': 40}. Best is trial 26 with value: 0.992029.[0m
[32m[I 2022-10-20 03:39:09,598][0m Trial 49 finished with value: 0.991660619302889 and parameters: {'etc_criterion': 'gini', 'etc_min_samples_split': 25, 'etc_min_samples_leaf': 7, 'etc_max_features': 39}. Best is trial 26 with value: 0.992029.[0m
[32m[I 2022-10-20 03:39:09,787][0m Trial 50 finished with value: 0.9915006417423619 and parameters: {'etc_criterion': 'gini', 'etc_min_samples_split': 36, 'etc_min_samples_leaf': 7, 'etc_max_features': 39}. Best is trial 26 with value: 0.992029.[0m
[32m[I 2022-10-20 03:39:10,037][0m Trial 51 finished with value: 0.9917136506945041 and parameters: {'etc_criterion': 'gini', 'etc_min_samples_split': 42, 'etc_min_samples_leaf': 7, 'etc_max_features': 39}. Best is trial 26 with value: 0.992029.[0m
[32m[I 2022-10-20 03:39:10,209][0m Trial 52 finished with value: 0.9918793973229763 and parameters: {'etc_criterion': 'gini', 'etc_min_samples_split': 37, 'etc_min_samples_leaf': 6, 'etc_max_features': 41}. Best is trial 26 with value: 0.992029.[0m
[32m[I 2022-10-20 03:39:10,835][0m Trial 54 finished with value: 0.9901851748496205 and parameters: {'etc_criterion': 'gini', 'etc_min_samples_split': 42, 'etc_min_samples_leaf': 24, 'etc_max_features': 31}. Best is trial 26 with value: 0.992029.[0m
[32m[I 2022-10-20 03:39:10,898][0m Trial 53 finished with value: 0.9914376702003966 and parameters: {'etc_criterion': 'gini', 'etc_min_samples_split': 42, 'etc_min_samples_leaf': 19, 'etc_max_features': 30}. Best is trial 26 with value: 0.992029.[0m
[32m[I 2022-10-20 03:39:10,898][0m Trial 56 finished with value: 0.9914050291881903 and parameters: {'etc_criterion': 'gini', 'etc_min_samples_split': 42, 'etc_min_samples_leaf': 18, 'etc_max_features': 30}. Best is trial 26 with value: 0.992029.[0m
[32m[I 2022-10-20 03:39:10,960][0m Trial 55 finished with value: 0.9916234353837634 and parameters: {'etc_criterion': 'gini', 'etc_min_samples_split': 35, 'etc_min_samples_leaf': 17, 'etc_max_features': 31}. Best is trial 26 with value: 0.992029.[0m
[32m[I 2022-10-20 03:39:11,179][0m Trial 57 finished with value: 0.9915168514708742 and parameters: {'etc_criterion': 'gini', 'etc_min_samples_split': 41, 'etc_min_samples_leaf': 18, 'etc_max_features': 29}. Best is trial 26 with value: 0.992029.[0m
[32m[I 2022-10-20 03:39:11,524][0m Trial 58 finished with value: 0.9915766776634036 and parameters: {'etc_criterion': 'entropy', 'etc_min_samples_split': 41, 'etc_min_samples_leaf': 18, 'etc_max_features': 30}. Best is trial 26 with value: 0.992029.[0m
[32m[I 2022-10-20 03:39:11,854][0m Trial 59 finished with value: 0.991408836992665 and parameters: {'etc_criterion': 'entropy', 'etc_min_samples_split': 37, 'etc_min_samples_leaf': 18, 'etc_max_features': 31}. Best is trial 26 with value: 0.992029.[0m
[32m[I 2022-10-20 03:39:12,073][0m Trial 60 finished with value: 0.9913834161627805 and parameters: {'etc_criterion': 'gini', 'etc_min_samples_split': 42, 'etc_min_samples_leaf': 24, 'etc_max_features': 32}. Best is trial 26 with value: 0.992029.[0m
[32m[I 2022-10-20 03:39:12,763][0m Trial 61 finished with value: 0.9914591675998753 and parameters: {'etc_criterion': 'entropy', 'etc_min_samples_split': 48, 'etc_min_samples_leaf': 1, 'etc_max_features': 34}. Best is trial 26 with value: 0.992029.[0m
[32m[I 2022-10-20 03:39:12,826][0m Trial 62 finished with value: 0.9916511663921425 and parameters: {'etc_criterion': 'gini', 'etc_min_samples_split': 21, 'etc_min_samples_leaf': 1, 'etc_max_features': 35}. Best is trial 26 with value: 0.992029.[0m
[32m[I 2022-10-20 03:39:12,904][0m Trial 65 finished with value: 0.9918229118572935 and parameters: {'etc_criterion': 'entropy', 'etc_min_samples_split': 48, 'etc_min_samples_leaf': 14, 'etc_max_features': 35}. Best is trial 26 with value: 0.992029.[0m
[32m[I 2022-10-20 03:39:12,904][0m Trial 64 finished with value: 0.9916369826832879 and parameters: {'etc_criterion': 'entropy', 'etc_min_samples_split': 29, 'etc_min_samples_leaf': 1, 'etc_max_features': 35}. Best is trial 26 with value: 0.992029.[0m
[32m[I 2022-10-20 03:39:12,982][0m Trial 63 finished with value: 0.9915902818186665 and parameters: {'etc_criterion': 'entropy', 'etc_min_samples_split': 22, 'etc_min_samples_leaf': 1, 'etc_max_features': 34}. Best is trial 26 with value: 0.992029.[0m
[32m[I 2022-10-20 03:39:13,201][0m Trial 66 finished with value: 0.9916511663921425 and parameters: {'etc_criterion': 'gini', 'etc_min_samples_split': 21, 'etc_min_samples_leaf': 1, 'etc_max_features': 35}. Best is trial 26 with value: 0.992029.[0m
[32m[I 2022-10-20 03:39:13,749][0m Trial 67 finished with value: 0.9915633853095398 and parameters: {'etc_criterion': 'entropy', 'etc_min_samples_split': 30, 'etc_min_samples_leaf': 15, 'etc_max_features': 42}. Best is trial 26 with value: 0.992029.[0m
[32m[I 2022-10-20 03:39:13,843][0m Trial 68 finished with value: 0.9915633853095398 and parameters: {'etc_criterion': 'entropy', 'etc_min_samples_split': 30, 'etc_min_samples_leaf': 15, 'etc_max_features': 42}. Best is trial 26 with value: 0.992029.[0m
[32m[I 2022-10-20 03:39:14,610][0m Trial 69 finished with value: 0.9915927622227875 and parameters: {'etc_criterion': 'entropy', 'etc_min_samples_split': 48, 'etc_min_samples_leaf': 14, 'etc_max_features': 42}. Best is trial 26 with value: 0.992029.[0m
[32m[I 2022-10-20 03:39:14,610][0m Trial 71 finished with value: 0.9916188704924371 and parameters: {'etc_criterion': 'entropy', 'etc_min_samples_split': 48, 'etc_min_samples_leaf': 4, 'etc_max_features': 42}. Best is trial 26 with value: 0.992029.[0m
[32m[I 2022-10-20 03:39:14,814][0m Trial 73 finished with value: 0.9916695590002771 and parameters: {'etc_criterion': 'entropy', 'etc_min_samples_split': 48, 'etc_min_samples_leaf': 14, 'etc_max_features': 47}. Best is trial 26 with value: 0.992029.[0m
[32m[I 2022-10-20 03:39:14,986][0m Trial 72 finished with value: 0.9916188704924371 and parameters: {'etc_criterion': 'entropy', 'etc_min_samples_split': 48, 'etc_min_samples_leaf': 4, 'etc_max_features': 42}. Best is trial 26 with value: 0.992029.[0m
[32m[I 2022-10-20 03:39:15,080][0m Trial 74 finished with value: 0.9915927622227875 and parameters: {'etc_criterion': 'entropy', 'etc_min_samples_split': 48, 'etc_min_samples_leaf': 14, 'etc_max_features': 42}. Best is trial 26 with value: 0.992029.[0m
[32m[I 2022-10-20 03:39:15,159][0m Trial 70 finished with value: 0.9915927622227875 and parameters: {'etc_criterion': 'entropy', 'etc_min_samples_split': 48, 'etc_min_samples_leaf': 14, 'etc_max_features': 42}. Best is trial 26 with value: 0.992029.[0m
[32m[I 2022-10-20 03:39:15,519][0m Trial 76 finished with value: 0.9913195547678625 and parameters: {'etc_criterion': 'entropy', 'etc_min_samples_split': 50, 'etc_min_samples_leaf': 4, 'etc_max_features': 22}. Best is trial 26 with value: 0.992029.[0m
[32m[I 2022-10-20 03:39:15,833][0m Trial 75 finished with value: 0.9915524018829953 and parameters: {'etc_criterion': 'entropy', 'etc_min_samples_split': 48, 'etc_min_samples_leaf': 5, 'etc_max_features': 47}. Best is trial 26 with value: 0.992029.[0m
[32m[I 2022-10-20 03:39:16,490][0m Trial 78 finished with value: 0.99159844235114 and parameters: {'etc_criterion': 'entropy', 'etc_min_samples_split': 33, 'etc_min_samples_leaf': 16, 'etc_max_features': 47}. Best is trial 26 with value: 0.992029.[0m
[32m[I 2022-10-20 03:39:16,631][0m Trial 77 finished with value: 0.9914118126495569 and parameters: {'etc_criterion': 'entropy', 'etc_min_samples_split': 33, 'etc_min_samples_leaf': 16, 'etc_max_features': 48}. Best is trial 26 with value: 0.992029.[0m
[32m[I 2022-10-20 03:39:16,819][0m Trial 82 finished with value: 0.9916940277664399 and parameters: {'etc_criterion': 'entropy', 'etc_min_samples_split': 32, 'etc_min_samples_leaf': 22, 'etc_max_features': 47}. Best is trial 26 with value: 0.992029.[0m
[32m[I 2022-10-20 03:39:16,912][0m Trial 81 finished with value: 0.9914688631985918 and parameters: {'etc_criterion': 'entropy', 'etc_min_samples_split': 33, 'etc_min_samples_leaf': 22, 'etc_max_features': 48}. Best is trial 26 with value: 0.992029.[0m
[32m[I 2022-10-20 03:39:16,928][0m Trial 80 finished with value: 0.991779022914556 and parameters: {'etc_criterion': 'entropy', 'etc_min_samples_split': 50, 'etc_min_samples_leaf': 22, 'etc_max_features': 48}. Best is trial 26 with value: 0.992029.[0m
[32m[I 2022-10-20 03:39:16,991][0m Trial 79 finished with value: 0.991513247148664 and parameters: {'etc_criterion': 'entropy', 'etc_min_samples_split': 32, 'etc_min_samples_leaf': 9, 'etc_max_features': 48}. Best is trial 26 with value: 0.992029.[0m
[32m[I 2022-10-20 03:39:17,508][0m Trial 83 finished with value: 0.9914688631985918 and parameters: {'etc_criterion': 'entropy', 'etc_min_samples_split': 34, 'etc_min_samples_leaf': 22, 'etc_max_features': 48}. Best is trial 26 with value: 0.992029.[0m
[32m[I 2022-10-20 03:39:17,727][0m Trial 84 finished with value: 0.9918491508769761 and parameters: {'etc_criterion': 'entropy', 'etc_min_samples_split': 38, 'etc_min_samples_leaf': 9, 'etc_max_features': 47}. Best is trial 26 with value: 0.992029.[0m
[32m[I 2022-10-20 03:39:18,227][0m Trial 85 finished with value: 0.9917727347635844 and parameters: {'etc_criterion': 'entropy', 'etc_min_samples_split': 33, 'etc_min_samples_leaf': 21, 'etc_max_features': 50}. Best is trial 26 with value: 0.992029.[0m
[32m[I 2022-10-20 03:39:18,556][0m Trial 86 finished with value: 0.9915010140178829 and parameters: {'etc_criterion': 'entropy', 'etc_min_samples_split': 46, 'etc_min_samples_leaf': 12, 'etc_max_features': 50}. Best is trial 26 with value: 0.992029.[0m
[32m[I 2022-10-20 03:39:18,885][0m Trial 87 finished with value: 0.9916194510474801 and parameters: {'etc_criterion': 'entropy', 'etc_min_samples_split': 50, 'etc_min_samples_leaf': 9, 'etc_max_features': 50}. Best is trial 26 with value: 0.992029.[0m
[32m[I 2022-10-20 03:39:18,948][0m Trial 90 finished with value: 0.991375624292848 and parameters: {'etc_criterion': 'entropy', 'etc_min_samples_split': 46, 'etc_min_samples_leaf': 9, 'etc_max_features': 50}. Best is trial 26 with value: 0.992029.[0m
[32m[I 2022-10-20 03:39:19,042][0m Trial 89 finished with value: 0.9915010140178829 and parameters: {'etc_criterion': 'entropy', 'etc_min_samples_split': 46, 'etc_min_samples_leaf': 12, 'etc_max_features': 50}. Best is trial 26 with value: 0.992029.[0m
[32m[I 2022-10-20 03:39:19,120][0m Trial 88 finished with value: 0.9914349095037491 and parameters: {'etc_criterion': 'entropy', 'etc_min_samples_split': 44, 'etc_min_samples_leaf': 12, 'etc_max_features': 50}. Best is trial 26 with value: 0.992029.[0m
[32m[I 2022-10-20 03:39:19,355][0m Trial 91 finished with value: 0.9916358063635861 and parameters: {'etc_criterion': 'entropy', 'etc_min_samples_split': 38, 'etc_min_samples_leaf': 9, 'etc_max_features': 37}. Best is trial 26 with value: 0.992029.[0m
[32m[I 2022-10-20 03:39:19,591][0m Trial 92 finished with value: 0.9916965823476275 and parameters: {'etc_criterion': 'entropy', 'etc_min_samples_split': 46, 'etc_min_samples_leaf': 3, 'etc_max_features': 50}. Best is trial 26 with value: 0.992029.[0m
[32m[I 2022-10-20 03:39:19,981][0m Trial 93 finished with value: 0.9916956746983364 and parameters: {'etc_criterion': 'entropy', 'etc_min_samples_split': 44, 'etc_min_samples_leaf': 20, 'etc_max_features': 49}. Best is trial 26 with value: 0.992029.[0m
[32m[I 2022-10-20 03:39:20,122][0m Trial 94 finished with value: 0.9915590888523093 and parameters: {'etc_criterion': 'entropy', 'etc_min_samples_split': 44, 'etc_min_samples_leaf': 20, 'etc_max_features': 44}. Best is trial 26 with value: 0.992029.[0m
[32m[I 2022-10-20 03:39:20,607][0m Trial 96 finished with value: 0.9918366412726684 and parameters: {'etc_criterion': 'entropy', 'etc_min_samples_split': 38, 'etc_min_samples_leaf': 3, 'etc_max_features': 37}. Best is trial 26 with value: 0.992029.[0m
[32m[I 2022-10-20 03:39:20,607][0m Trial 97 finished with value: 0.9918208714911837 and parameters: {'etc_criterion': 'entropy', 'etc_min_samples_split': 38, 'etc_min_samples_leaf': 20, 'etc_max_features': 37}. Best is trial 26 with value: 0.992029.[0m
[32m[I 2022-10-20 03:39:20,607][0m Trial 98 finished with value: 0.9914844625601685 and parameters: {'etc_criterion': 'entropy', 'etc_min_samples_split': 37, 'etc_min_samples_leaf': 20, 'etc_max_features': 44}. Best is trial 26 with value: 0.992029.[0m
[32m[I 2022-10-20 03:39:20,794][0m Trial 95 finished with value: 0.9918366412726684 and parameters: {'etc_criterion': 'entropy', 'etc_min_samples_split': 38, 'etc_min_samples_leaf': 3, 'etc_max_features': 37}. Best is trial 26 with value: 0.992029.[0m
[32m[I 2022-10-20 03:39:20,857][0m Trial 99 finished with value: 0.9918208714911837 and parameters: {'etc_criterion': 'entropy', 'etc_min_samples_split': 37, 'etc_min_samples_leaf': 20, 'etc_max_features': 37}. Best is trial 26 with value: 0.992029.[0m
[32m[I 2022-10-20 03:39:20,919][0m Study finished.[0m
[32m[I 2022-10-20 03:39:20,997][0m --------------------------------------------------------------------------------[0m
[32m[I 2022-10-20 03:39:20,997][0m --------------------          ExtraTreesClassifier          --------------------[0m
[32m[I 2022-10-20 03:39:20,997][0m --------------------------------------------------------------------------------[0m
[32m[I 2022-10-20 03:39:21,029][0m A new study created in RDB with name: ExtraTreesClassifier_b4f53b70[0m
[32m[I 2022-10-20 03:39:21,029][0m Study started.[0m
[32m[I 2022-10-20 03:39:28,869][0m Trial 4 finished with value: 0.37246686217241654 and parameters: {'etsc_n_estimators': 70, 'etsc_criterion': 'gini', 'etsc_min_samples_split': 18, 'etsc_min_samples_leaf': 30, 'etsc_max_features': 1, 'etsc_bootstrap': False}. Best is trial 4 with value: 0.372467.[0m
[32m[I 2022-10-20 03:39:40,412][0m Trial 1 finished with value: 0.959137982268067 and parameters: {'etsc_n_estimators': 90, 'etsc_criterion': 'entropy', 'etsc_min_samples_split': 12, 'etsc_min_samples_leaf': 48, 'etsc_max_features': 5, 'etsc_bootstrap': False}. Best is trial 1 with value: 0.959138.[0m
[32m[I 2022-10-20 03:40:02,743][0m Trial 7 finished with value: 0.9915265105246451 and parameters: {'etsc_n_estimators': 90, 'etsc_criterion': 'gini', 'etsc_min_samples_split': 13, 'etsc_min_samples_leaf': 1, 'etsc_max_features': 18, 'etsc_bootstrap': True}. Best is trial 7 with value: 0.991526.[0m
[32m[I 2022-10-20 03:40:10,688][0m Trial 0 finished with value: 0.9914819526729683 and parameters: {'etsc_n_estimators': 90, 'etsc_criterion': 'entropy', 'etsc_min_samples_split': 6, 'etsc_min_samples_leaf': 50, 'etsc_max_features': 30, 'etsc_bootstrap': True}. Best is trial 7 with value: 0.991526.[0m
[32m[I 2022-10-20 03:40:17,765][0m Trial 8 finished with value: 0.9914583929000476 and parameters: {'etsc_n_estimators': 90, 'etsc_criterion': 'gini', 'etsc_min_samples_split': 32, 'etsc_min_samples_leaf': 10, 'etsc_max_features': 19, 'etsc_bootstrap': False}. Best is trial 7 with value: 0.991526.[0m
[32m[I 2022-10-20 03:40:20,618][0m Trial 9 finished with value: 0.9849031952953996 and parameters: {'etsc_n_estimators': 140, 'etsc_criterion': 'entropy', 'etsc_min_samples_split': 5, 'etsc_min_samples_leaf': 28, 'etsc_max_features': 8, 'etsc_bootstrap': False}. Best is trial 7 with value: 0.991526.[0m
[32m[I 2022-10-20 03:40:43,956][0m Trial 12 finished with value: 0.9911720418473429 and parameters: {'etsc_n_estimators': 60, 'etsc_criterion': 'gini', 'etsc_min_samples_split': 4, 'etsc_min_samples_leaf': 18, 'etsc_max_features': 18, 'etsc_bootstrap': True}. Best is trial 7 with value: 0.991526.[0m
[32m[I 2022-10-20 03:40:45,121][0m Trial 5 finished with value: 0.9913811385208502 and parameters: {'etsc_n_estimators': 150, 'etsc_criterion': 'entropy', 'etsc_min_samples_split': 26, 'etsc_min_samples_leaf': 22, 'etsc_max_features': 23, 'etsc_bootstrap': False}. Best is trial 7 with value: 0.991526.[0m
[32m[I 2022-10-20 03:40:47,176][0m Trial 6 finished with value: 0.9915871796571754 and parameters: {'etsc_n_estimators': 160, 'etsc_criterion': 'entropy', 'etsc_min_samples_split': 30, 'etsc_min_samples_leaf': 1, 'etsc_max_features': 29, 'etsc_bootstrap': True}. Best is trial 6 with value: 0.991587.[0m
[32m[I 2022-10-20 03:40:52,354][0m Trial 3 finished with value: 0.9910949416770731 and parameters: {'etsc_n_estimators': 190, 'etsc_criterion': 'gini', 'etsc_min_samples_split': 31, 'etsc_min_samples_leaf': 17, 'etsc_max_features': 23, 'etsc_bootstrap': True}. Best is trial 6 with value: 0.991587.[0m
[32m[I 2022-10-20 03:40:53,206][0m Trial 2 finished with value: 0.991504074419962 and parameters: {'etsc_n_estimators': 120, 'etsc_criterion': 'entropy', 'etsc_min_samples_split': 15, 'etsc_min_samples_leaf': 13, 'etsc_max_features': 39, 'etsc_bootstrap': False}. Best is trial 6 with value: 0.991587.[0m
[32m[I 2022-10-20 03:41:11,013][0m Trial 11 finished with value: 0.9915319021062541 and parameters: {'etsc_n_estimators': 90, 'etsc_criterion': 'entropy', 'etsc_min_samples_split': 27, 'etsc_min_samples_leaf': 45, 'etsc_max_features': 45, 'etsc_bootstrap': True}. Best is trial 6 with value: 0.991587.[0m
[32m[I 2022-10-20 03:41:12,474][0m Trial 15 finished with value: 0.9908454840742736 and parameters: {'etsc_n_estimators': 60, 'etsc_criterion': 'gini', 'etsc_min_samples_split': 31, 'etsc_min_samples_leaf': 8, 'etsc_max_features': 14, 'etsc_bootstrap': False}. Best is trial 6 with value: 0.991587.[0m
[32m[I 2022-10-20 03:41:24,180][0m Trial 10 finished with value: 0.9914415344393155 and parameters: {'etsc_n_estimators': 190, 'etsc_criterion': 'entropy', 'etsc_min_samples_split': 26, 'etsc_min_samples_leaf': 4, 'etsc_max_features': 13, 'etsc_bootstrap': False}. Best is trial 6 with value: 0.991587.[0m
[32m[I 2022-10-20 03:41:26,231][0m Trial 16 finished with value: 0.9916345576057266 and parameters: {'etsc_n_estimators': 70, 'etsc_criterion': 'gini', 'etsc_min_samples_split': 30, 'etsc_min_samples_leaf': 18, 'etsc_max_features': 31, 'etsc_bootstrap': True}. Best is trial 16 with value: 0.991635.[0m
[32m[I 2022-10-20 03:41:27,893][0m Trial 14 finished with value: 0.9833327668656165 and parameters: {'etsc_n_estimators': 160, 'etsc_criterion': 'entropy', 'etsc_min_samples_split': 27, 'etsc_min_samples_leaf': 21, 'etsc_max_features': 8, 'etsc_bootstrap': True}. Best is trial 16 with value: 0.991635.[0m
[32m[I 2022-10-20 03:42:15,140][0m Trial 13 finished with value: 0.9915942468732755 and parameters: {'etsc_n_estimators': 180, 'etsc_criterion': 'gini', 'etsc_min_samples_split': 30, 'etsc_min_samples_leaf': 11, 'etsc_max_features': 40, 'etsc_bootstrap': True}. Best is trial 16 with value: 0.991635.[0m
[32m[I 2022-10-20 03:42:36,288][0m Trial 23 finished with value: 0.9914417670714989 and parameters: {'etsc_n_estimators': 120, 'etsc_criterion': 'gini', 'etsc_min_samples_split': 46, 'etsc_min_samples_leaf': 37, 'etsc_max_features': 32, 'etsc_bootstrap': True}. Best is trial 16 with value: 0.991635.[0m
[32m[I 2022-10-20 03:42:59,043][0m Trial 22 finished with value: 0.9914716941688154 and parameters: {'etsc_n_estimators': 160, 'etsc_criterion': 'gini', 'etsc_min_samples_split': 44, 'etsc_min_samples_leaf': 37, 'etsc_max_features': 34, 'etsc_bootstrap': True}. Best is trial 16 with value: 0.991635.[0m
