[32m[I 2022-10-20 15:16:40,578][0m Trial 26 finished with value: 0.7128750257008201 and parameters: {'rusbc_n_estimators': 100, 'rusbc_learning_rate': 0.05611069664106611, 'rusbc_sampling_strategy': 'not minority'}. Best is trial 23 with value: 0.942288.[0m
[32m[I 2022-10-20 15:16:45,514][0m Trial 32 finished with value: 0.7292517845597898 and parameters: {'rusbc_n_estimators': 50, 'rusbc_learning_rate': 0.1869010731922741, 'rusbc_sampling_strategy': 'not minority'}. Best is trial 23 with value: 0.942288.[0m
[32m[I 2022-10-20 15:16:54,353][0m Trial 33 finished with value: 0.6366845557095607 and parameters: {'rusbc_n_estimators': 50, 'rusbc_learning_rate': 0.004005186178760168, 'rusbc_sampling_strategy': 'not minority'}. Best is trial 23 with value: 0.942288.[0m
[32m[I 2022-10-20 15:16:58,142][0m Trial 34 finished with value: 0.6366845557095607 and parameters: {'rusbc_n_estimators': 50, 'rusbc_learning_rate': 0.004099231324339552, 'rusbc_sampling_strategy': 'not minority'}. Best is trial 23 with value: 0.942288.[0m
[32m[I 2022-10-20 15:16:59,592][0m Trial 35 finished with value: 0.6366845557095607 and parameters: {'rusbc_n_estimators': 50, 'rusbc_learning_rate': 0.0034276776511296568, 'rusbc_sampling_strategy': 'not minority'}. Best is trial 23 with value: 0.942288.[0m
[32m[I 2022-10-20 15:16:59,970][0m Trial 38 finished with value: 0.7079045302346562 and parameters: {'rusbc_n_estimators': 25, 'rusbc_learning_rate': 0.20249983188449414, 'rusbc_sampling_strategy': 'not minority'}. Best is trial 23 with value: 0.942288.[0m
[32m[I 2022-10-20 15:16:59,970][0m Trial 37 finished with value: 0.7082165302079808 and parameters: {'rusbc_n_estimators': 25, 'rusbc_learning_rate': 0.19979550417232605, 'rusbc_sampling_strategy': 'not minority'}. Best is trial 23 with value: 0.942288.[0m
[32m[I 2022-10-20 15:17:01,058][0m Trial 39 finished with value: 0.7082165302079808 and parameters: {'rusbc_n_estimators': 25, 'rusbc_learning_rate': 0.22722318086900797, 'rusbc_sampling_strategy': 'not minority'}. Best is trial 23 with value: 0.942288.[0m
[32m[I 2022-10-20 15:17:05,444][0m Trial 40 finished with value: 0.9237863585696133 and parameters: {'rusbc_n_estimators': 25, 'rusbc_learning_rate': 0.025275561764017178, 'rusbc_sampling_strategy': 'not minority'}. Best is trial 23 with value: 0.942288.[0m
[32m[I 2022-10-20 15:17:14,613][0m Trial 41 finished with value: 0.9237863585696133 and parameters: {'rusbc_n_estimators': 25, 'rusbc_learning_rate': 0.022978257296942698, 'rusbc_sampling_strategy': 'not minority'}. Best is trial 23 with value: 0.942288.[0m
[32m[I 2022-10-20 15:17:29,950][0m Trial 42 finished with value: 0.5564018915280566 and parameters: {'rusbc_n_estimators': 25, 'rusbc_learning_rate': 0.025405425239986283, 'rusbc_sampling_strategy': 'not majority'}. Best is trial 23 with value: 0.942288.[0m
[32m[I 2022-10-20 15:17:32,479][0m Trial 43 finished with value: 0.6183326556145199 and parameters: {'rusbc_n_estimators': 25, 'rusbc_learning_rate': 0.024750772022319865, 'rusbc_sampling_strategy': 'not majority'}. Best is trial 23 with value: 0.942288.[0m
[32m[I 2022-10-20 15:18:04,004][0m Trial 36 finished with value: 0.7660300171546219 and parameters: {'rusbc_n_estimators': 75, 'rusbc_learning_rate': 0.22080030477960483, 'rusbc_sampling_strategy': 'not majority'}. Best is trial 23 with value: 0.942288.[0m
[32m[I 2022-10-20 15:18:29,128][0m Trial 49 finished with value: 0.12231775321658918 and parameters: {'rusbc_n_estimators': 75, 'rusbc_learning_rate': 0.0004937676333650957, 'rusbc_sampling_strategy': 'not minority'}. Best is trial 23 with value: 0.942288.[0m
[32m[I 2022-10-20 15:18:32,063][0m Trial 50 finished with value: 0.5744209402138118 and parameters: {'rusbc_n_estimators': 75, 'rusbc_learning_rate': 0.0007210923591268382, 'rusbc_sampling_strategy': 'not minority'}. Best is trial 23 with value: 0.942288.[0m
[32m[I 2022-10-20 15:18:34,371][0m Trial 45 finished with value: 0.6190337450318066 and parameters: {'rusbc_n_estimators': 75, 'rusbc_learning_rate': 0.015741918662096843, 'rusbc_sampling_strategy': 'not majority'}. Best is trial 23 with value: 0.942288.[0m
[32m[I 2022-10-20 15:18:35,303][0m Trial 44 finished with value: 0.6522935146780118 and parameters: {'rusbc_n_estimators': 75, 'rusbc_learning_rate': 0.023405104115881575, 'rusbc_sampling_strategy': 'not majority'}. Best is trial 23 with value: 0.942288.[0m
[32m[I 2022-10-20 15:18:36,701][0m Trial 46 finished with value: 0.6522935146780118 and parameters: {'rusbc_n_estimators': 75, 'rusbc_learning_rate': 0.023015172720358364, 'rusbc_sampling_strategy': 'not majority'}. Best is trial 23 with value: 0.942288.[0m
[32m[I 2022-10-20 15:18:39,087][0m Trial 47 finished with value: 0.6190337450318066 and parameters: {'rusbc_n_estimators': 75, 'rusbc_learning_rate': 0.016978470434179445, 'rusbc_sampling_strategy': 'not majority'}. Best is trial 23 with value: 0.942288.[0m
[32m[I 2022-10-20 15:18:49,765][0m Trial 52 finished with value: 0.10117121198760491 and parameters: {'rusbc_n_estimators': 25, 'rusbc_learning_rate': 1.2709144593129806e-06, 'rusbc_sampling_strategy': 'not minority'}. Best is trial 23 with value: 0.942288.[0m
[32m[I 2022-10-20 15:18:50,394][0m Trial 48 finished with value: 0.6191178388448183 and parameters: {'rusbc_n_estimators': 75, 'rusbc_learning_rate': 0.02194408526267207, 'rusbc_sampling_strategy': 'not majority'}. Best is trial 23 with value: 0.942288.[0m
[32m[I 2022-10-20 15:18:52,834][0m Trial 53 finished with value: 0.8474132483112449 and parameters: {'rusbc_n_estimators': 25, 'rusbc_learning_rate': 0.01466677537327477, 'rusbc_sampling_strategy': 'not minority'}. Best is trial 23 with value: 0.942288.[0m
[32m[I 2022-10-20 15:18:55,422][0m Trial 54 finished with value: 0.7580196373644776 and parameters: {'rusbc_n_estimators': 25, 'rusbc_learning_rate': 0.09460700919371462, 'rusbc_sampling_strategy': 'not minority'}. Best is trial 23 with value: 0.942288.[0m
[32m[I 2022-10-20 15:19:02,935][0m Trial 51 finished with value: 0.5744209402138118 and parameters: {'rusbc_n_estimators': 75, 'rusbc_learning_rate': 0.0007402877884666807, 'rusbc_sampling_strategy': 'not minority'}. Best is trial 23 with value: 0.942288.[0m
[32m[I 2022-10-20 15:19:07,649][0m Trial 55 finished with value: 0.7413636211860511 and parameters: {'rusbc_n_estimators': 25, 'rusbc_learning_rate': 0.09698074741842154, 'rusbc_sampling_strategy': 'majority'}. Best is trial 23 with value: 0.942288.[0m
[32m[I 2022-10-20 15:19:09,749][0m Trial 56 finished with value: 0.3013147453657114 and parameters: {'rusbc_n_estimators': 25, 'rusbc_learning_rate': 0.0020912888820653498, 'rusbc_sampling_strategy': 'majority'}. Best is trial 23 with value: 0.942288.[0m
[32m[I 2022-10-20 15:19:10,911][0m Trial 58 finished with value: 0.7578446050201629 and parameters: {'rusbc_n_estimators': 25, 'rusbc_learning_rate': 0.08651941774760781, 'rusbc_sampling_strategy': 'not minority'}. Best is trial 23 with value: 0.942288.[0m
[32m[I 2022-10-20 15:19:11,403][0m Trial 59 finished with value: 0.7580196373644776 and parameters: {'rusbc_n_estimators': 25, 'rusbc_learning_rate': 0.09597153020803126, 'rusbc_sampling_strategy': 'not minority'}. Best is trial 23 with value: 0.942288.[0m
[32m[I 2022-10-20 15:19:12,030][0m Trial 57 finished with value: 0.3083464227585943 and parameters: {'rusbc_n_estimators': 25, 'rusbc_learning_rate': 1.2294624510351589e-05, 'rusbc_sampling_strategy': 'majority'}. Best is trial 23 with value: 0.942288.[0m
[32m[I 2022-10-20 15:19:25,489][0m Trial 60 finished with value: 0.609540850886039 and parameters: {'rusbc_n_estimators': 25, 'rusbc_learning_rate': 0.07837776392676077, 'rusbc_sampling_strategy': 'majority'}. Best is trial 23 with value: 0.942288.[0m
[32m[I 2022-10-20 15:19:28,006][0m Trial 61 finished with value: 0.3013147453657114 and parameters: {'rusbc_n_estimators': 25, 'rusbc_learning_rate': 0.002059785707254945, 'rusbc_sampling_strategy': 'majority'}. Best is trial 23 with value: 0.942288.[0m
[32m[I 2022-10-20 15:19:28,964][0m Trial 63 finished with value: 0.12231775321658918 and parameters: {'rusbc_n_estimators': 25, 'rusbc_learning_rate': 0.0017341382063069412, 'rusbc_sampling_strategy': 'all'}. Best is trial 23 with value: 0.942288.[0m
[32m[I 2022-10-20 15:19:30,965][0m Trial 64 finished with value: 0.9422876172131923 and parameters: {'rusbc_n_estimators': 25, 'rusbc_learning_rate': 0.048300937201309777, 'rusbc_sampling_strategy': 'all'}. Best is trial 23 with value: 0.942288.[0m
[32m[I 2022-10-20 15:19:32,229][0m Trial 65 finished with value: 0.8473039533570059 and parameters: {'rusbc_n_estimators': 25, 'rusbc_learning_rate': 0.009204638605993687, 'rusbc_sampling_strategy': 'all'}. Best is trial 23 with value: 0.942288.[0m
[32m[I 2022-10-20 15:19:32,561][0m Trial 66 finished with value: 0.5747537916230977 and parameters: {'rusbc_n_estimators': 25, 'rusbc_learning_rate': 0.007808569798668222, 'rusbc_sampling_strategy': 'all'}. Best is trial 23 with value: 0.942288.[0m
[32m[I 2022-10-20 15:19:33,542][0m Trial 67 finished with value: 0.9422876172131923 and parameters: {'rusbc_n_estimators': 25, 'rusbc_learning_rate': 0.048467489077323386, 'rusbc_sampling_strategy': 'all'}. Best is trial 23 with value: 0.942288.[0m
[32m[I 2022-10-20 15:19:35,228][0m Trial 62 finished with value: 0.3013147453657114 and parameters: {'rusbc_n_estimators': 25, 'rusbc_learning_rate': 0.002183789134442009, 'rusbc_sampling_strategy': 'majority'}. Best is trial 23 with value: 0.942288.[0m
[32m[I 2022-10-20 15:19:46,709][0m Trial 68 finished with value: 0.8473039533570059 and parameters: {'rusbc_n_estimators': 25, 'rusbc_learning_rate': 0.00822300081786735, 'rusbc_sampling_strategy': 'all'}. Best is trial 23 with value: 0.942288.[0m
[32m[I 2022-10-20 15:19:49,473][0m Trial 69 finished with value: 0.9208656654546435 and parameters: {'rusbc_n_estimators': 25, 'rusbc_learning_rate': 0.04079158594515492, 'rusbc_sampling_strategy': 'all'}. Best is trial 23 with value: 0.942288.[0m
[32m[I 2022-10-20 15:19:50,388][0m Trial 70 finished with value: 0.9208788608305586 and parameters: {'rusbc_n_estimators': 25, 'rusbc_learning_rate': 0.05258009522962885, 'rusbc_sampling_strategy': 'not minority'}. Best is trial 23 with value: 0.942288.[0m
[32m[I 2022-10-20 15:19:52,156][0m Trial 71 finished with value: 0.760756523503783 and parameters: {'rusbc_n_estimators': 25, 'rusbc_learning_rate': 0.037178199355868455, 'rusbc_sampling_strategy': 'all'}. Best is trial 23 with value: 0.942288.[0m
[32m[I 2022-10-20 15:19:54,016][0m Trial 72 finished with value: 0.9422876172131923 and parameters: {'rusbc_n_estimators': 25, 'rusbc_learning_rate': 0.04358843555599484, 'rusbc_sampling_strategy': 'all'}. Best is trial 23 with value: 0.942288.[0m
[32m[I 2022-10-20 15:20:11,774][0m Trial 78 finished with value: 0.9204155952125804 and parameters: {'rusbc_n_estimators': 25, 'rusbc_learning_rate': 0.41655789727889975, 'rusbc_sampling_strategy': 'all'}. Best is trial 23 with value: 0.942288.[0m
[32m[I 2022-10-20 15:20:13,216][0m Trial 73 finished with value: 0.712623877502489 and parameters: {'rusbc_n_estimators': 50, 'rusbc_learning_rate': 0.04137033286846911, 'rusbc_sampling_strategy': 'all'}. Best is trial 23 with value: 0.942288.[0m
[32m[I 2022-10-20 15:20:14,256][0m Trial 74 finished with value: 0.7578446050201629 and parameters: {'rusbc_n_estimators': 50, 'rusbc_learning_rate': 0.03788385991590161, 'rusbc_sampling_strategy': 'all'}. Best is trial 23 with value: 0.942288.[0m
[32m[I 2022-10-20 15:20:15,908][0m Trial 75 finished with value: 0.9123593078687006 and parameters: {'rusbc_n_estimators': 50, 'rusbc_learning_rate': 0.3989723931393373, 'rusbc_sampling_strategy': 'all'}. Best is trial 23 with value: 0.942288.[0m
[32m[I 2022-10-20 15:20:27,048][0m Trial 76 finished with value: 0.8980839734085045 and parameters: {'rusbc_n_estimators': 50, 'rusbc_learning_rate': 0.4068254943460249, 'rusbc_sampling_strategy': 'all'}. Best is trial 23 with value: 0.942288.[0m
[32m[I 2022-10-20 15:20:30,220][0m Trial 77 finished with value: 0.9054322402420361 and parameters: {'rusbc_n_estimators': 50, 'rusbc_learning_rate': 0.3851131172750178, 'rusbc_sampling_strategy': 'all'}. Best is trial 23 with value: 0.942288.[0m
[32m[I 2022-10-20 15:20:32,061][0m Trial 79 finished with value: 0.8973918946515008 and parameters: {'rusbc_n_estimators': 50, 'rusbc_learning_rate': 0.4556830592194147, 'rusbc_sampling_strategy': 'all'}. Best is trial 23 with value: 0.942288.[0m
[32m[I 2022-10-20 15:20:34,358][0m Trial 80 finished with value: 0.7622532617192974 and parameters: {'rusbc_n_estimators': 50, 'rusbc_learning_rate': 0.14778507697459672, 'rusbc_sampling_strategy': 'all'}. Best is trial 23 with value: 0.942288.[0m
[32m[I 2022-10-20 15:20:34,924][0m Trial 83 finished with value: 0.7150428769894351 and parameters: {'rusbc_n_estimators': 25, 'rusbc_learning_rate': 0.15467768318935474, 'rusbc_sampling_strategy': 'all'}. Best is trial 23 with value: 0.942288.[0m
[32m[I 2022-10-20 15:20:36,809][0m Trial 84 finished with value: 0.7151418217725427 and parameters: {'rusbc_n_estimators': 25, 'rusbc_learning_rate': 0.1274599400732443, 'rusbc_sampling_strategy': 'all'}. Best is trial 23 with value: 0.942288.[0m
[32m[I 2022-10-20 15:20:47,973][0m Trial 85 finished with value: 0.760756523503783 and parameters: {'rusbc_n_estimators': 25, 'rusbc_learning_rate': 0.06254844781612509, 'rusbc_sampling_strategy': 'all'}. Best is trial 23 with value: 0.942288.[0m
[32m[I 2022-10-20 15:20:50,928][0m Trial 86 finished with value: 0.7082165302079808 and parameters: {'rusbc_n_estimators': 25, 'rusbc_learning_rate': 0.14481035201835515, 'rusbc_sampling_strategy': 'all'}. Best is trial 23 with value: 0.942288.[0m
[32m[I 2022-10-20 15:20:51,213][0m Trial 81 finished with value: 0.7108161508353147 and parameters: {'rusbc_n_estimators': 50, 'rusbc_learning_rate': 0.13605787741749983, 'rusbc_sampling_strategy': 'all'}. Best is trial 23 with value: 0.942288.[0m
[32m[I 2022-10-20 15:20:52,394][0m Trial 87 finished with value: 0.7151418217725427 and parameters: {'rusbc_n_estimators': 25, 'rusbc_learning_rate': 0.1210282879102766, 'rusbc_sampling_strategy': 'all'}. Best is trial 23 with value: 0.942288.[0m
[32m[I 2022-10-20 15:20:52,614][0m Trial 82 finished with value: 0.890748235890696 and parameters: {'rusbc_n_estimators': 50, 'rusbc_learning_rate': 0.36392785645389075, 'rusbc_sampling_strategy': 'all'}. Best is trial 23 with value: 0.942288.[0m
[32m[I 2022-10-20 15:20:54,788][0m Trial 88 finished with value: 0.8474132483112449 and parameters: {'rusbc_n_estimators': 25, 'rusbc_learning_rate': 0.012025714769945099, 'rusbc_sampling_strategy': 'not minority'}. Best is trial 23 with value: 0.942288.[0m
[32m[I 2022-10-20 15:20:55,292][0m Trial 89 finished with value: 0.9454849031902076 and parameters: {'rusbc_n_estimators': 25, 'rusbc_learning_rate': 0.0592497522234994, 'rusbc_sampling_strategy': 'not minority'}. Best is trial 89 with value: 0.945485.[0m
[32m[I 2022-10-20 15:20:57,351][0m Trial 90 finished with value: 0.12231775321658918 and parameters: {'rusbc_n_estimators': 25, 'rusbc_learning_rate': 7.39829387753419e-05, 'rusbc_sampling_strategy': 'not minority'}. Best is trial 89 with value: 0.945485.[0m
[32m[I 2022-10-20 15:21:08,638][0m Trial 91 finished with value: 0.10117121198760491 and parameters: {'rusbc_n_estimators': 25, 'rusbc_learning_rate': 6.596503090801867e-05, 'rusbc_sampling_strategy': 'not minority'}. Best is trial 89 with value: 0.945485.[0m
[32m[I 2022-10-20 15:21:11,636][0m Trial 92 finished with value: 0.8474132483112449 and parameters: {'rusbc_n_estimators': 25, 'rusbc_learning_rate': 0.01232623368663486, 'rusbc_sampling_strategy': 'not minority'}. Best is trial 89 with value: 0.945485.[0m
[32m[I 2022-10-20 15:21:11,934][0m Trial 93 finished with value: 0.8474132483112449 and parameters: {'rusbc_n_estimators': 25, 'rusbc_learning_rate': 0.011994252236237131, 'rusbc_sampling_strategy': 'not minority'}. Best is trial 89 with value: 0.945485.[0m
[32m[I 2022-10-20 15:21:12,458][0m Trial 94 finished with value: 0.10117121198760491 and parameters: {'rusbc_n_estimators': 25, 'rusbc_learning_rate': 5.555567208333272e-05, 'rusbc_sampling_strategy': 'not minority'}. Best is trial 89 with value: 0.945485.[0m
[32m[I 2022-10-20 15:21:12,897][0m Trial 95 finished with value: 0.8474132483112449 and parameters: {'rusbc_n_estimators': 25, 'rusbc_learning_rate': 0.01115476977707387, 'rusbc_sampling_strategy': 'not minority'}. Best is trial 89 with value: 0.945485.[0m
[32m[I 2022-10-20 15:21:14,109][0m Trial 96 finished with value: 0.9233809935234104 and parameters: {'rusbc_n_estimators': 25, 'rusbc_learning_rate': 0.029186780357851654, 'rusbc_sampling_strategy': 'not minority'}. Best is trial 89 with value: 0.945485.[0m
[32m[I 2022-10-20 15:21:14,190][0m Trial 97 finished with value: 0.10117121198760491 and parameters: {'rusbc_n_estimators': 25, 'rusbc_learning_rate': 5.5443095768664935e-05, 'rusbc_sampling_strategy': 'not minority'}. Best is trial 89 with value: 0.945485.[0m
[32m[I 2022-10-20 15:21:14,955][0m Trial 98 finished with value: 0.9237863585696133 and parameters: {'rusbc_n_estimators': 25, 'rusbc_learning_rate': 0.026877406352255453, 'rusbc_sampling_strategy': 'not minority'}. Best is trial 89 with value: 0.945485.[0m
[32m[I 2022-10-20 15:21:19,046][0m Trial 99 finished with value: 0.9237863585696133 and parameters: {'rusbc_n_estimators': 25, 'rusbc_learning_rate': 0.03197031684253673, 'rusbc_sampling_strategy': 'not minority'}. Best is trial 89 with value: 0.945485.[0m
[32m[I 2022-10-20 15:21:19,109][0m Study finished.[0m
[32m[I 2022-10-20 15:21:19,190][0m --------------------------------------------------------------------------------[0m
[32m[I 2022-10-20 15:21:19,190][0m --------------------             SGDClassifier              --------------------[0m
[32m[I 2022-10-20 15:21:19,190][0m --------------------------------------------------------------------------------[0m
[32m[I 2022-10-20 15:21:19,221][0m A new study created in RDB with name: SGDClassifier_b4f53b70[0m
[32m[I 2022-10-20 15:21:19,221][0m Study started.[0m
[32m[I 2022-10-20 15:21:32,713][0m Trial 3 finished with value: 0.4305699400577346 and parameters: {'sgdc_loss': 'modified_huber', 'sgdc_penalty': 'elasticnet', 'sgdc_alpha': 0.15267157923235658, 'sgdc_l1_ratio': 0.8, 'sgdc_learning_rate': 'constant', 'sgdc_eta0': 0.0025078459298761716, 'sgdc_early_stopping': True, 'sgdc_validation_fraction': 0.25, 'sgdc_n_iter_no_change': 10}. Best is trial 3 with value: 0.43057.[0m
[32m[I 2022-10-20 15:21:34,366][0m Trial 2 finished with value: 0.1864445454414337 and parameters: {'sgdc_loss': 'modified_huber', 'sgdc_penalty': 'elasticnet', 'sgdc_alpha': 67.21405672040125, 'sgdc_l1_ratio': 0.8, 'sgdc_learning_rate': 'optimal', 'sgdc_eta0': 15.191671592350904, 'sgdc_early_stopping': True, 'sgdc_validation_fraction': 0.25, 'sgdc_n_iter_no_change': 10}. Best is trial 3 with value: 0.43057.[0m
[32m[I 2022-10-20 15:21:35,197][0m Trial 5 finished with value: 0.42041739920280596 and parameters: {'sgdc_loss': 'modified_huber', 'sgdc_penalty': 'elasticnet', 'sgdc_alpha': 1.9312122826460605e-06, 'sgdc_l1_ratio': 0.2, 'sgdc_learning_rate': 'constant', 'sgdc_eta0': 118.36258223308563, 'sgdc_early_stopping': True, 'sgdc_validation_fraction': 0.25, 'sgdc_n_iter_no_change': 10}. Best is trial 3 with value: 0.43057.[0m
[32m[I 2022-10-20 15:21:35,739][0m Trial 4 finished with value: 0.4785028291149237 and parameters: {'sgdc_loss': 'modified_huber', 'sgdc_penalty': 'elasticnet', 'sgdc_alpha': 7.890442987505909, 'sgdc_l1_ratio': 0.2, 'sgdc_learning_rate': 'optimal', 'sgdc_eta0': 1.5545843067221365, 'sgdc_early_stopping': True, 'sgdc_validation_fraction': 0.25, 'sgdc_n_iter_no_change': 10}. Best is trial 4 with value: 0.478503.[0m
[32m[I 2022-10-20 15:21:36,166][0m Trial 0 finished with value: 0.5227448953152063 and parameters: {'sgdc_loss': 'modified_huber', 'sgdc_penalty': 'elasticnet', 'sgdc_alpha': 0.0038749476667301547, 'sgdc_l1_ratio': 0.2, 'sgdc_learning_rate': 'optimal', 'sgdc_eta0': 176.46407646060092, 'sgdc_early_stopping': True, 'sgdc_validation_fraction': 0.25, 'sgdc_n_iter_no_change': 10}. Best is trial 0 with value: 0.522745.[0m
[32m[I 2022-10-20 15:21:40,009][0m Trial 6 finished with value: 0.5443440382497323 and parameters: {'sgdc_loss': 'hinge', 'sgdc_penalty': 'elasticnet', 'sgdc_alpha': 7.480326470758793e-06, 'sgdc_l1_ratio': 0.2, 'sgdc_learning_rate': 'invscaling', 'sgdc_eta0': 0.5602039989739013, 'sgdc_early_stopping': True, 'sgdc_validation_fraction': 0.25, 'sgdc_n_iter_no_change': 10}. Best is trial 6 with value: 0.544344.[0m
[32m[I 2022-10-20 15:21:44,063][0m Trial 7 finished with value: 0.5797619691237733 and parameters: {'sgdc_loss': 'squared_hinge', 'sgdc_penalty': 'elasticnet', 'sgdc_alpha': 0.0005994855161482915, 'sgdc_l1_ratio': 1.0, 'sgdc_learning_rate': 'invscaling', 'sgdc_eta0': 48.75706095892632, 'sgdc_early_stopping': True, 'sgdc_validation_fraction': 0.25, 'sgdc_n_iter_no_change': 10}. Best is trial 7 with value: 0.579762.[0m
[32m[I 2022-10-20 15:21:49,790][0m Trial 12 finished with value: 0.00128765656199791 and parameters: {'sgdc_loss': 'squared_hinge', 'sgdc_penalty': 'elasticnet', 'sgdc_alpha': 0.3761158724095771, 'sgdc_l1_ratio': 0.8, 'sgdc_learning_rate': 'constant', 'sgdc_eta0': 62.30028819967111, 'sgdc_early_stopping': True, 'sgdc_validation_fraction': 0.25, 'sgdc_n_iter_no_change': 10}. Best is trial 7 with value: 0.579762.[0m
