[32m[I 2022-10-20 02:01:18,101][0m Trial 15 finished with value: 0.8468527798566332 and parameters: {'bnb_alpha': 1.0, 'bnb_binarize': 0.6000000000000001, 'bnb_fit_prior': True}. Best is trial 1 with value: 0.846879.[0m
[32m[I 2022-10-20 02:01:18,303][0m Trial 11 finished with value: 0.8203045408599223 and parameters: {'bnb_alpha': 0.15000000000000002, 'bnb_binarize': 0.45, 'bnb_fit_prior': False}. Best is trial 1 with value: 0.846879.[0m
[32m[I 2022-10-20 02:01:20,489][0m Trial 16 finished with value: 0.8203045408599223 and parameters: {'bnb_alpha': 0.25, 'bnb_binarize': 0.0, 'bnb_fit_prior': False}. Best is trial 1 with value: 0.846879.[0m
[32m[I 2022-10-20 02:01:20,771][0m Trial 17 finished with value: 0.07399138544370873 and parameters: {'bnb_alpha': 0.0, 'bnb_binarize': 0.25, 'bnb_fit_prior': True}. Best is trial 1 with value: 0.846879.[0m
[32m[I 2022-10-20 02:01:21,497][0m Trial 23 finished with value: 0.07399138544370873 and parameters: {'bnb_alpha': 0.0, 'bnb_binarize': 0.2, 'bnb_fit_prior': True}. Best is trial 1 with value: 0.846879.[0m
[32m[I 2022-10-20 02:01:21,497][0m Trial 19 finished with value: 0.07399138544370873 and parameters: {'bnb_alpha': 0.0, 'bnb_binarize': 0.2, 'bnb_fit_prior': True}. Best is trial 1 with value: 0.846879.[0m
[32m[I 2022-10-20 02:01:21,497][0m Trial 20 finished with value: 0.846879304059287 and parameters: {'bnb_alpha': 0.05, 'bnb_binarize': 0.2, 'bnb_fit_prior': True}. Best is trial 1 with value: 0.846879.[0m
[32m[I 2022-10-20 02:01:21,798][0m Trial 21 finished with value: 0.846879304059287 and parameters: {'bnb_alpha': 0.05, 'bnb_binarize': 0.2, 'bnb_fit_prior': True}. Best is trial 1 with value: 0.846879.[0m
[32m[I 2022-10-20 02:01:21,892][0m Trial 22 finished with value: 0.846879304059287 and parameters: {'bnb_alpha': 0.05, 'bnb_binarize': 0.2, 'bnb_fit_prior': True}. Best is trial 1 with value: 0.846879.[0m
[32m[I 2022-10-20 02:01:22,017][0m Trial 18 finished with value: 0.846879304059287 and parameters: {'bnb_alpha': 0.05, 'bnb_binarize': 0.15000000000000002, 'bnb_fit_prior': True}. Best is trial 1 with value: 0.846879.[0m
[32m[I 2022-10-20 02:01:23,279][0m Trial 24 finished with value: 0.8468527798566332 and parameters: {'bnb_alpha': 0.4, 'bnb_binarize': 0.2, 'bnb_fit_prior': True}. Best is trial 1 with value: 0.846879.[0m
[32m[I 2022-10-20 02:01:23,842][0m Trial 25 finished with value: 0.07399138544370873 and parameters: {'bnb_alpha': 0.0, 'bnb_binarize': 0.2, 'bnb_fit_prior': True}. Best is trial 1 with value: 0.846879.[0m
[32m[I 2022-10-20 02:01:24,927][0m Trial 29 finished with value: 0.8468527798566332 and parameters: {'bnb_alpha': 0.2, 'bnb_binarize': 0.30000000000000004, 'bnb_fit_prior': True}. Best is trial 1 with value: 0.846879.[0m
[32m[I 2022-10-20 02:01:25,005][0m Trial 28 finished with value: 0.8468527798566332 and parameters: {'bnb_alpha': 0.15000000000000002, 'bnb_binarize': 0.35000000000000003, 'bnb_fit_prior': True}. Best is trial 1 with value: 0.846879.[0m
[32m[I 2022-10-20 02:01:25,084][0m Trial 26 finished with value: 0.8468527798566332 and parameters: {'bnb_alpha': 0.15000000000000002, 'bnb_binarize': 0.30000000000000004, 'bnb_fit_prior': True}. Best is trial 1 with value: 0.846879.[0m
[32m[I 2022-10-20 02:01:25,084][0m Trial 30 finished with value: 0.8468527798566332 and parameters: {'bnb_alpha': 0.4, 'bnb_binarize': 0.30000000000000004, 'bnb_fit_prior': True}. Best is trial 1 with value: 0.846879.[0m
[32m[I 2022-10-20 02:01:25,147][0m Trial 27 finished with value: 0.8468527798566332 and parameters: {'bnb_alpha': 0.4, 'bnb_binarize': 0.30000000000000004, 'bnb_fit_prior': True}. Best is trial 1 with value: 0.846879.[0m
[32m[I 2022-10-20 02:01:25,303][0m Trial 31 finished with value: 0.8468527798566332 and parameters: {'bnb_alpha': 0.2, 'bnb_binarize': 0.30000000000000004, 'bnb_fit_prior': True}. Best is trial 1 with value: 0.846879.[0m
[32m[I 2022-10-20 02:01:25,584][0m Trial 32 finished with value: 0.8468527798566332 and parameters: {'bnb_alpha': 0.2, 'bnb_binarize': 0.30000000000000004, 'bnb_fit_prior': True}. Best is trial 1 with value: 0.846879.[0m
[32m[I 2022-10-20 02:01:26,040][0m Trial 33 finished with value: 0.8468527798566332 and parameters: {'bnb_alpha': 0.2, 'bnb_binarize': 0.30000000000000004, 'bnb_fit_prior': True}. Best is trial 1 with value: 0.846879.[0m
[32m[I 2022-10-20 02:01:28,271][0m Trial 36 finished with value: 0.846879304059287 and parameters: {'bnb_alpha': 0.1, 'bnb_binarize': 0.1, 'bnb_fit_prior': True}. Best is trial 36 with value: 0.846879.[0m
[32m[I 2022-10-20 02:01:28,365][0m Trial 35 finished with value: 0.846879304059287 and parameters: {'bnb_alpha': 0.1, 'bnb_binarize': 0.0, 'bnb_fit_prior': True}. Best is trial 36 with value: 0.846879.[0m
[32m[I 2022-10-20 02:01:28,380][0m Trial 34 finished with value: 0.846879304059287 and parameters: {'bnb_alpha': 0.1, 'bnb_binarize': 0.1, 'bnb_fit_prior': True}. Best is trial 36 with value: 0.846879.[0m
[32m[I 2022-10-20 02:01:28,537][0m Trial 38 finished with value: 0.846879304059287 and parameters: {'bnb_alpha': 0.1, 'bnb_binarize': 0.1, 'bnb_fit_prior': True}. Best is trial 38 with value: 0.846879.[0m
[32m[I 2022-10-20 02:01:28,625][0m Trial 39 finished with value: 0.846879304059287 and parameters: {'bnb_alpha': 0.1, 'bnb_binarize': 0.1, 'bnb_fit_prior': True}. Best is trial 39 with value: 0.846879.[0m
[32m[I 2022-10-20 02:01:28,727][0m Trial 37 finished with value: 0.846879304059287 and parameters: {'bnb_alpha': 0.1, 'bnb_binarize': 0.1, 'bnb_fit_prior': True}. Best is trial 39 with value: 0.846879.[0m
[32m[I 2022-10-20 02:01:28,868][0m Trial 40 finished with value: 0.846879304059287 and parameters: {'bnb_alpha': 0.1, 'bnb_binarize': 0.1, 'bnb_fit_prior': True}. Best is trial 41 with value: 0.846879.[0m
[32m[I 2022-10-20 02:01:28,946][0m Trial 41 finished with value: 0.846879304059287 and parameters: {'bnb_alpha': 0.1, 'bnb_binarize': 0.1, 'bnb_fit_prior': True}. Best is trial 41 with value: 0.846879.[0m
[32m[I 2022-10-20 02:01:31,478][0m Trial 44 finished with value: 0.8468527798566332 and parameters: {'bnb_alpha': 0.30000000000000004, 'bnb_binarize': 0.4, 'bnb_fit_prior': True}. Best is trial 1 with value: 0.846879.[0m
[32m[I 2022-10-20 02:01:31,603][0m Trial 42 finished with value: 0.8468527798566332 and parameters: {'bnb_alpha': 0.30000000000000004, 'bnb_binarize': 0.4, 'bnb_fit_prior': True}. Best is trial 1 with value: 0.846879.[0m
[32m[I 2022-10-20 02:01:31,745][0m Trial 45 finished with value: 0.8468527798566332 and parameters: {'bnb_alpha': 0.75, 'bnb_binarize': 0.0, 'bnb_fit_prior': True}. Best is trial 1 with value: 0.846879.[0m
[32m[I 2022-10-20 02:01:32,168][0m Trial 46 finished with value: 0.8468527798566332 and parameters: {'bnb_alpha': 0.30000000000000004, 'bnb_binarize': 0.0, 'bnb_fit_prior': True}. Best is trial 1 with value: 0.846879.[0m
[32m[I 2022-10-20 02:01:32,269][0m Trial 47 finished with value: 0.8468527798566332 and parameters: {'bnb_alpha': 0.75, 'bnb_binarize': 0.0, 'bnb_fit_prior': True}. Best is trial 1 with value: 0.846879.[0m
[32m[I 2022-10-20 02:01:32,269][0m Trial 49 finished with value: 0.8468527798566332 and parameters: {'bnb_alpha': 0.8, 'bnb_binarize': 0.0, 'bnb_fit_prior': True}. Best is trial 1 with value: 0.846879.[0m
[32m[I 2022-10-20 02:01:32,269][0m Trial 48 finished with value: 0.8468527798566332 and parameters: {'bnb_alpha': 0.8, 'bnb_binarize': 0.05, 'bnb_fit_prior': True}. Best is trial 1 with value: 0.846879.[0m
[32m[I 2022-10-20 02:01:32,660][0m Trial 43 finished with value: 0.8468527798566332 and parameters: {'bnb_alpha': 0.75, 'bnb_binarize': 0.0, 'bnb_fit_prior': True}. Best is trial 1 with value: 0.846879.[0m
[32m[I 2022-10-20 02:01:34,577][0m Trial 50 finished with value: 0.8468527798566332 and parameters: {'bnb_alpha': 0.8500000000000001, 'bnb_binarize': 0.15000000000000002, 'bnb_fit_prior': True}. Best is trial 1 with value: 0.846879.[0m
[32m[I 2022-10-20 02:01:34,717][0m Trial 51 finished with value: 0.820286900220342 and parameters: {'bnb_alpha': 0.8, 'bnb_binarize': 0.05, 'bnb_fit_prior': False}. Best is trial 1 with value: 0.846879.[0m
[32m[I 2022-10-20 02:01:35,551][0m Trial 52 finished with value: 0.820286900220342 and parameters: {'bnb_alpha': 0.5, 'bnb_binarize': 0.15000000000000002, 'bnb_fit_prior': False}. Best is trial 1 with value: 0.846879.[0m
[32m[I 2022-10-20 02:01:35,787][0m Trial 55 finished with value: 0.8203045408599223 and parameters: {'bnb_alpha': 0.25, 'bnb_binarize': 0.15000000000000002, 'bnb_fit_prior': False}. Best is trial 1 with value: 0.846879.[0m
[32m[I 2022-10-20 02:01:35,896][0m Trial 53 finished with value: 0.820286900220342 and parameters: {'bnb_alpha': 0.5, 'bnb_binarize': 0.15000000000000002, 'bnb_fit_prior': False}. Best is trial 1 with value: 0.846879.[0m
[32m[I 2022-10-20 02:01:35,959][0m Trial 57 finished with value: 0.820286900220342 and parameters: {'bnb_alpha': 0.5, 'bnb_binarize': 0.15000000000000002, 'bnb_fit_prior': False}. Best is trial 1 with value: 0.846879.[0m
[32m[I 2022-10-20 02:01:36,022][0m Trial 54 finished with value: 0.820286900220342 and parameters: {'bnb_alpha': 0.55, 'bnb_binarize': 0.15000000000000002, 'bnb_fit_prior': False}. Best is trial 1 with value: 0.846879.[0m
[32m[I 2022-10-20 02:01:36,037][0m Trial 56 finished with value: 0.8203045408599223 and parameters: {'bnb_alpha': 0.25, 'bnb_binarize': 0.15000000000000002, 'bnb_fit_prior': False}. Best is trial 1 with value: 0.846879.[0m
[32m[I 2022-10-20 02:01:36,933][0m Trial 58 finished with value: 0.8203045408599223 and parameters: {'bnb_alpha': 0.1, 'bnb_binarize': 0.1, 'bnb_fit_prior': False}. Best is trial 1 with value: 0.846879.[0m
[32m[I 2022-10-20 02:01:37,890][0m Trial 59 finished with value: 0.8468527798566332 and parameters: {'bnb_alpha': 0.5, 'bnb_binarize': 0.15000000000000002, 'bnb_fit_prior': True}. Best is trial 1 with value: 0.846879.[0m
[32m[I 2022-10-20 02:01:38,467][0m Trial 60 finished with value: 0.846879304059287 and parameters: {'bnb_alpha': 0.05, 'bnb_binarize': 0.15000000000000002, 'bnb_fit_prior': True}. Best is trial 60 with value: 0.846879.[0m
[32m[I 2022-10-20 02:01:39,062][0m Trial 61 finished with value: 0.846879304059287 and parameters: {'bnb_alpha': 0.05, 'bnb_binarize': 0.25, 'bnb_fit_prior': True}. Best is trial 61 with value: 0.846879.[0m
[32m[I 2022-10-20 02:01:39,471][0m Trial 64 finished with value: 0.846879304059287 and parameters: {'bnb_alpha': 0.05, 'bnb_binarize': 0.25, 'bnb_fit_prior': True}. Best is trial 65 with value: 0.846879.[0m
[32m[I 2022-10-20 02:01:39,471][0m Trial 63 finished with value: 0.846879304059287 and parameters: {'bnb_alpha': 0.05, 'bnb_binarize': 0.25, 'bnb_fit_prior': True}. Best is trial 65 with value: 0.846879.[0m
[32m[I 2022-10-20 02:01:39,471][0m Trial 65 finished with value: 0.846879304059287 and parameters: {'bnb_alpha': 0.05, 'bnb_binarize': 0.55, 'bnb_fit_prior': True}. Best is trial 65 with value: 0.846879.[0m
[32m[I 2022-10-20 02:01:39,550][0m Trial 62 finished with value: 0.846879304059287 and parameters: {'bnb_alpha': 0.05, 'bnb_binarize': 0.25, 'bnb_fit_prior': True}. Best is trial 65 with value: 0.846879.[0m
[32m[I 2022-10-20 02:01:40,098][0m Trial 66 finished with value: 0.846879304059287 and parameters: {'bnb_alpha': 0.05, 'bnb_binarize': 0.25, 'bnb_fit_prior': True}. Best is trial 66 with value: 0.846879.[0m
[32m[I 2022-10-20 02:01:40,335][0m Trial 67 finished with value: 0.846879304059287 and parameters: {'bnb_alpha': 0.05, 'bnb_binarize': 0.25, 'bnb_fit_prior': True}. Best is trial 67 with value: 0.846879.[0m
[32m[I 2022-10-20 02:01:41,943][0m Trial 68 finished with value: 0.846879304059287 and parameters: {'bnb_alpha': 0.05, 'bnb_binarize': 0.25, 'bnb_fit_prior': True}. Best is trial 68 with value: 0.846879.[0m
[32m[I 2022-10-20 02:01:42,289][0m Trial 69 finished with value: 0.846879304059287 and parameters: {'bnb_alpha': 0.05, 'bnb_binarize': 0.55, 'bnb_fit_prior': True}. Best is trial 69 with value: 0.846879.[0m
[32m[I 2022-10-20 02:01:42,681][0m Trial 70 finished with value: 0.8468527798566332 and parameters: {'bnb_alpha': 0.15000000000000002, 'bnb_binarize': 0.5, 'bnb_fit_prior': True}. Best is trial 1 with value: 0.846879.[0m
[32m[I 2022-10-20 02:01:43,089][0m Trial 74 finished with value: 0.07399138544370873 and parameters: {'bnb_alpha': 0.0, 'bnb_binarize': 0.55, 'bnb_fit_prior': True}. Best is trial 1 with value: 0.846879.[0m
[32m[I 2022-10-20 02:01:43,105][0m Trial 73 finished with value: 0.8468527798566332 and parameters: {'bnb_alpha': 0.15000000000000002, 'bnb_binarize': 0.6000000000000001, 'bnb_fit_prior': True}. Best is trial 1 with value: 0.846879.[0m
[32m[I 2022-10-20 02:01:43,230][0m Trial 72 finished with value: 0.8468527798566332 and parameters: {'bnb_alpha': 0.15000000000000002, 'bnb_binarize': 0.55, 'bnb_fit_prior': True}. Best is trial 1 with value: 0.846879.[0m
[32m[I 2022-10-20 02:01:43,230][0m Trial 71 finished with value: 0.8468527798566332 and parameters: {'bnb_alpha': 0.15000000000000002, 'bnb_binarize': 0.55, 'bnb_fit_prior': True}. Best is trial 1 with value: 0.846879.[0m
[32m[I 2022-10-20 02:01:43,701][0m Trial 75 finished with value: 0.8468527798566332 and parameters: {'bnb_alpha': 0.15000000000000002, 'bnb_binarize': 0.1, 'bnb_fit_prior': True}. Best is trial 1 with value: 0.846879.[0m
[32m[I 2022-10-20 02:01:44,092][0m Trial 76 finished with value: 0.8468527798566332 and parameters: {'bnb_alpha': 0.15000000000000002, 'bnb_binarize': 0.05, 'bnb_fit_prior': True}. Best is trial 1 with value: 0.846879.[0m
[32m[I 2022-10-20 02:01:45,429][0m Trial 77 finished with value: 0.8468527798566332 and parameters: {'bnb_alpha': 0.15000000000000002, 'bnb_binarize': 0.05, 'bnb_fit_prior': True}. Best is trial 1 with value: 0.846879.[0m
[32m[I 2022-10-20 02:01:45,797][0m Trial 78 finished with value: 0.8468527798566332 and parameters: {'bnb_alpha': 0.15000000000000002, 'bnb_binarize': 0.1, 'bnb_fit_prior': True}. Best is trial 1 with value: 0.846879.[0m
[32m[I 2022-10-20 02:01:46,710][0m Trial 79 finished with value: 0.846879304059287 and parameters: {'bnb_alpha': 0.1, 'bnb_binarize': 0.05, 'bnb_fit_prior': True}. Best is trial 81 with value: 0.846879.[0m
[32m[I 2022-10-20 02:01:46,810][0m Trial 81 finished with value: 0.846879304059287 and parameters: {'bnb_alpha': 0.1, 'bnb_binarize': 0.05, 'bnb_fit_prior': True}. Best is trial 81 with value: 0.846879.[0m
[32m[I 2022-10-20 02:01:46,884][0m Trial 82 finished with value: 0.846879304059287 and parameters: {'bnb_alpha': 0.1, 'bnb_binarize': 0.05, 'bnb_fit_prior': True}. Best is trial 82 with value: 0.846879.[0m
[32m[I 2022-10-20 02:01:46,965][0m Trial 83 finished with value: 0.846879304059287 and parameters: {'bnb_alpha': 0.1, 'bnb_binarize': 0.75, 'bnb_fit_prior': True}. Best is trial 83 with value: 0.846879.[0m
[32m[I 2022-10-20 02:01:47,028][0m Trial 80 finished with value: 0.846879304059287 and parameters: {'bnb_alpha': 0.1, 'bnb_binarize': 0.75, 'bnb_fit_prior': True}. Best is trial 83 with value: 0.846879.[0m
[32m[I 2022-10-20 02:01:47,254][0m Trial 84 finished with value: 0.846879304059287 and parameters: {'bnb_alpha': 0.1, 'bnb_binarize': 0.8, 'bnb_fit_prior': True}. Best is trial 84 with value: 0.846879.[0m
[32m[I 2022-10-20 02:01:47,756][0m Trial 85 finished with value: 0.846879304059287 and parameters: {'bnb_alpha': 0.1, 'bnb_binarize': 0.05, 'bnb_fit_prior': True}. Best is trial 85 with value: 0.846879.[0m
[32m[I 2022-10-20 02:01:49,096][0m Trial 86 finished with value: 0.846879304059287 and parameters: {'bnb_alpha': 0.1, 'bnb_binarize': 0.1, 'bnb_fit_prior': True}. Best is trial 86 with value: 0.846879.[0m
[32m[I 2022-10-20 02:01:49,967][0m Trial 87 finished with value: 0.07399138544370873 and parameters: {'bnb_alpha': 0.0, 'bnb_binarize': 0.1, 'bnb_fit_prior': True}. Best is trial 1 with value: 0.846879.[0m
[32m[I 2022-10-20 02:01:50,202][0m Trial 90 finished with value: 0.07399138544370873 and parameters: {'bnb_alpha': 0.0, 'bnb_binarize': 0.1, 'bnb_fit_prior': True}. Best is trial 1 with value: 0.846879.[0m
[32m[I 2022-10-20 02:01:50,202][0m Trial 88 finished with value: 0.07399138544370873 and parameters: {'bnb_alpha': 0.0, 'bnb_binarize': 0.1, 'bnb_fit_prior': True}. Best is trial 1 with value: 0.846879.[0m
[32m[I 2022-10-20 02:01:50,202][0m Trial 89 finished with value: 0.07399138544370873 and parameters: {'bnb_alpha': 0.0, 'bnb_binarize': 0.1, 'bnb_fit_prior': True}. Best is trial 1 with value: 0.846879.[0m
[32m[I 2022-10-20 02:01:50,202][0m Trial 91 finished with value: 0.07399138544370873 and parameters: {'bnb_alpha': 0.0, 'bnb_binarize': 0.1, 'bnb_fit_prior': True}. Best is trial 1 with value: 0.846879.[0m
[32m[I 2022-10-20 02:01:50,456][0m Trial 92 finished with value: 0.07399138544370873 and parameters: {'bnb_alpha': 0.0, 'bnb_binarize': 1.0, 'bnb_fit_prior': True}. Best is trial 1 with value: 0.846879.[0m
[32m[I 2022-10-20 02:01:50,660][0m Trial 93 finished with value: 0.07399138544370873 and parameters: {'bnb_alpha': 0.0, 'bnb_binarize': 0.35000000000000003, 'bnb_fit_prior': True}. Best is trial 1 with value: 0.846879.[0m
[32m[I 2022-10-20 02:01:51,537][0m Trial 94 finished with value: 0.07399138544370873 and parameters: {'bnb_alpha': 0.0, 'bnb_binarize': 0.25, 'bnb_fit_prior': True}. Best is trial 1 with value: 0.846879.[0m
[32m[I 2022-10-20 02:01:52,466][0m Trial 95 finished with value: 0.8468527798566332 and parameters: {'bnb_alpha': 0.2, 'bnb_binarize': 0.2, 'bnb_fit_prior': True}. Best is trial 1 with value: 0.846879.[0m
[32m[I 2022-10-20 02:01:52,590][0m Trial 96 finished with value: 0.8468527798566332 and parameters: {'bnb_alpha': 0.2, 'bnb_binarize': 0.2, 'bnb_fit_prior': True}. Best is trial 1 with value: 0.846879.[0m
[32m[I 2022-10-20 02:01:52,590][0m Trial 97 finished with value: 0.8468527798566332 and parameters: {'bnb_alpha': 0.2, 'bnb_binarize': 0.2, 'bnb_fit_prior': True}. Best is trial 1 with value: 0.846879.[0m
[32m[I 2022-10-20 02:01:52,747][0m Trial 98 finished with value: 0.8468527798566332 and parameters: {'bnb_alpha': 0.2, 'bnb_binarize': 0.2, 'bnb_fit_prior': True}. Best is trial 1 with value: 0.846879.[0m
[32m[I 2022-10-20 02:01:52,825][0m Trial 99 finished with value: 0.8468527798566332 and parameters: {'bnb_alpha': 0.2, 'bnb_binarize': 0.2, 'bnb_fit_prior': True}. Best is trial 1 with value: 0.846879.[0m
[32m[I 2022-10-20 02:01:52,888][0m Study finished.[0m
[32m[I 2022-10-20 02:01:52,966][0m --------------------------------------------------------------------------------[0m
[32m[I 2022-10-20 02:01:52,966][0m --------------------              CDClassifier              --------------------[0m
[32m[I 2022-10-20 02:01:52,966][0m --------------------------------------------------------------------------------[0m
[32m[I 2022-10-20 02:01:52,997][0m A new study created in RDB with name: CDClassifier_b4f53b70[0m
[32m[I 2022-10-20 02:01:52,997][0m Study started.[0m
[32m[I 2022-10-20 02:05:09,895][0m Trial 5 finished with value: 0.9047058204139466 and parameters: {'cdc_loss': 'squared', 'cdc_penalty': 'l2', 'cdc_C': 23.51030934512363, 'cdc_alpha': 0.9082980086589211, 'cdc_selection': 'uniform'}. Best is trial 5 with value: 0.904706.[0m
[32m[I 2022-10-20 02:06:07,997][0m Trial 3 finished with value: 0.8888483636799324 and parameters: {'cdc_loss': 'log', 'cdc_penalty': 'l1', 'cdc_C': 4.249835709382178, 'cdc_alpha': 0.032187895784657, 'cdc_selection': 'uniform'}. Best is trial 5 with value: 0.904706.[0m
[32m[I 2022-10-20 02:06:30,794][0m Trial 2 finished with value: 0.9517565471555183 and parameters: {'cdc_loss': 'log', 'cdc_penalty': 'l2', 'cdc_C': 0.13791860614055704, 'cdc_alpha': 32.49584972013372, 'cdc_selection': 'cyclic'}. Best is trial 2 with value: 0.951757.[0m
[32m[I 2022-10-20 02:06:34,018][0m Trial 8 finished with value: 0.951664912007631 and parameters: {'cdc_loss': 'modified_huber', 'cdc_penalty': 'l2', 'cdc_C': 5.881327956845581, 'cdc_alpha': 10.61123880901234, 'cdc_selection': 'cyclic'}. Best is trial 2 with value: 0.951757.[0m
[32m[I 2022-10-20 02:07:02,801][0m Trial 7 finished with value: 0.904753158385941 and parameters: {'cdc_loss': 'squared_hinge', 'cdc_penalty': 'l2', 'cdc_C': 618.5930407617644, 'cdc_alpha': 893.616371251773, 'cdc_selection': 'uniform'}. Best is trial 2 with value: 0.951757.[0m
[32m[I 2022-10-20 02:08:16,554][0m Trial 11 finished with value: 0.8982793640884882 and parameters: {'cdc_loss': 'modified_huber', 'cdc_penalty': 'l1', 'cdc_C': 371.19996290398984, 'cdc_alpha': 0.01838122068479984, 'cdc_selection': 'uniform'}. Best is trial 9 with value: 0.952429.[0m
[32m[I 2022-10-20 02:08:16,617][0m Trial 9 finished with value: 0.9524286960018887 and parameters: {'cdc_loss': 'squared_hinge', 'cdc_penalty': 'l1', 'cdc_C': 45.89853911524882, 'cdc_alpha': 439.40769308040336, 'cdc_selection': 'cyclic'}. Best is trial 9 with value: 0.952429.[0m
[32m[I 2022-10-20 02:08:17,916][0m Trial 0 finished with value: 0.07399138544370873 and parameters: {'cdc_loss': 'squared', 'cdc_penalty': 'l1/l2', 'cdc_C': 3.976701562104145, 'cdc_alpha': 0.4959724173657265, 'cdc_selection': 'uniform'}. Best is trial 9 with value: 0.952429.[0m
[32m[I 2022-10-20 02:08:31,035][0m Trial 1 finished with value: 0.07399138544370873 and parameters: {'cdc_loss': 'squared', 'cdc_penalty': 'l1/l2', 'cdc_C': 67.28481393239883, 'cdc_alpha': 0.41506146277667966, 'cdc_selection': 'cyclic'}. Best is trial 9 with value: 0.952429.[0m
[32m[I 2022-10-20 02:08:36,963][0m Trial 10 finished with value: 0.904753158385941 and parameters: {'cdc_loss': 'squared_hinge', 'cdc_penalty': 'l1', 'cdc_C': 0.7440654084569241, 'cdc_alpha': 0.011814058035326803, 'cdc_selection': 'uniform'}. Best is trial 9 with value: 0.952429.[0m
