[32m[I 2022-10-20 01:49:23,135][0m Trial 76 finished with value: 0.9917723542250582 and parameters: {'bbc_n_estimators': 13, 'bbc_max_features': 33, 'bbc_bootstrap': False, 'bbc_sampling_strategy': 'majority'}. Best is trial 41 with value: 0.99198.[0m
[32m[I 2022-10-20 01:49:23,432][0m Trial 78 finished with value: 0.9917648208587467 and parameters: {'bbc_n_estimators': 10, 'bbc_max_features': 33, 'bbc_bootstrap': False, 'bbc_sampling_strategy': 'majority'}. Best is trial 41 with value: 0.99198.[0m
[32m[I 2022-10-20 01:49:29,049][0m Trial 84 finished with value: 0.9916908923529348 and parameters: {'bbc_n_estimators': 6, 'bbc_max_features': 27, 'bbc_bootstrap': False, 'bbc_sampling_strategy': 'not majority'}. Best is trial 41 with value: 0.99198.[0m
[32m[I 2022-10-20 01:49:29,691][0m Trial 85 finished with value: 0.9916908923529348 and parameters: {'bbc_n_estimators': 6, 'bbc_max_features': 27, 'bbc_bootstrap': False, 'bbc_sampling_strategy': 'not majority'}. Best is trial 41 with value: 0.99198.[0m
[32m[I 2022-10-20 01:49:33,277][0m Trial 80 finished with value: 0.9919329701922268 and parameters: {'bbc_n_estimators': 7, 'bbc_max_features': 27, 'bbc_bootstrap': False, 'bbc_sampling_strategy': 'majority'}. Best is trial 41 with value: 0.99198.[0m
[32m[I 2022-10-20 01:49:34,297][0m Trial 81 finished with value: 0.9920706368391796 and parameters: {'bbc_n_estimators': 6, 'bbc_max_features': 26, 'bbc_bootstrap': False, 'bbc_sampling_strategy': 'majority'}. Best is trial 81 with value: 0.992071.[0m
[32m[I 2022-10-20 01:49:37,140][0m Trial 83 finished with value: 0.9921088456452316 and parameters: {'bbc_n_estimators': 6, 'bbc_max_features': 27, 'bbc_bootstrap': False, 'bbc_sampling_strategy': 'majority'}. Best is trial 83 with value: 0.992109.[0m
[32m[I 2022-10-20 01:49:41,456][0m Trial 86 finished with value: 0.9917870527630935 and parameters: {'bbc_n_estimators': 7, 'bbc_max_features': 46, 'bbc_bootstrap': False, 'bbc_sampling_strategy': 'majority'}. Best is trial 83 with value: 0.992109.[0m
[32m[I 2022-10-20 01:49:41,895][0m Trial 87 finished with value: 0.9917870527630935 and parameters: {'bbc_n_estimators': 7, 'bbc_max_features': 46, 'bbc_bootstrap': False, 'bbc_sampling_strategy': 'majority'}. Best is trial 83 with value: 0.992109.[0m
[32m[I 2022-10-20 01:49:50,983][0m Trial 92 finished with value: 0.9917716931775225 and parameters: {'bbc_n_estimators': 5, 'bbc_max_features': 26, 'bbc_bootstrap': False, 'bbc_sampling_strategy': 'majority'}. Best is trial 83 with value: 0.992109.[0m
[32m[I 2022-10-20 01:49:54,071][0m Trial 82 finished with value: 0.9919567841352592 and parameters: {'bbc_n_estimators': 13, 'bbc_max_features': 26, 'bbc_bootstrap': False, 'bbc_sampling_strategy': 'majority'}. Best is trial 83 with value: 0.992109.[0m
[32m[I 2022-10-20 01:49:56,987][0m Trial 89 finished with value: 0.9894905816363041 and parameters: {'bbc_n_estimators': 5, 'bbc_max_features': 21, 'bbc_bootstrap': False, 'bbc_sampling_strategy': 'majority'}. Best is trial 83 with value: 0.992109.[0m
[32m[I 2022-10-20 01:49:57,160][0m Trial 88 finished with value: 0.9892132557257196 and parameters: {'bbc_n_estimators': 7, 'bbc_max_features': 21, 'bbc_bootstrap': False, 'bbc_sampling_strategy': 'majority'}. Best is trial 83 with value: 0.992109.[0m
[32m[I 2022-10-20 01:49:59,400][0m Trial 90 finished with value: 0.9894905816363041 and parameters: {'bbc_n_estimators': 5, 'bbc_max_features': 21, 'bbc_bootstrap': False, 'bbc_sampling_strategy': 'majority'}. Best is trial 83 with value: 0.992109.[0m
[32m[I 2022-10-20 01:50:03,232][0m Trial 91 finished with value: 0.9894905816363041 and parameters: {'bbc_n_estimators': 5, 'bbc_max_features': 21, 'bbc_bootstrap': False, 'bbc_sampling_strategy': 'majority'}. Best is trial 83 with value: 0.992109.[0m
[32m[I 2022-10-20 01:50:11,883][0m Trial 96 finished with value: 0.9918102057341219 and parameters: {'bbc_n_estimators': 14, 'bbc_max_features': 35, 'bbc_bootstrap': False, 'bbc_sampling_strategy': 'majority'}. Best is trial 83 with value: 0.992109.[0m
[32m[I 2022-10-20 01:50:12,120][0m Trial 95 finished with value: 0.9918102057341219 and parameters: {'bbc_n_estimators': 14, 'bbc_max_features': 35, 'bbc_bootstrap': False, 'bbc_sampling_strategy': 'majority'}. Best is trial 83 with value: 0.992109.[0m
[32m[I 2022-10-20 01:50:13,738][0m Trial 93 finished with value: 0.9915635872831631 and parameters: {'bbc_n_estimators': 5, 'bbc_max_features': 25, 'bbc_bootstrap': False, 'bbc_sampling_strategy': 'majority'}. Best is trial 83 with value: 0.992109.[0m
[32m[I 2022-10-20 01:50:16,017][0m Trial 94 finished with value: 0.9894905816363041 and parameters: {'bbc_n_estimators': 5, 'bbc_max_features': 21, 'bbc_bootstrap': False, 'bbc_sampling_strategy': 'majority'}. Best is trial 83 with value: 0.992109.[0m
[32m[I 2022-10-20 01:50:16,564][0m Trial 72 finished with value: 0.9914228850639027 and parameters: {'bbc_n_estimators': 13, 'bbc_max_features': 20, 'bbc_bootstrap': False, 'bbc_sampling_strategy': 'majority'}. Best is trial 83 with value: 0.992109.[0m
[32m[I 2022-10-20 01:50:17,440][0m Trial 73 finished with value: 0.9914228850639027 and parameters: {'bbc_n_estimators': 13, 'bbc_max_features': 20, 'bbc_bootstrap': False, 'bbc_sampling_strategy': 'majority'}. Best is trial 83 with value: 0.992109.[0m
[32m[I 2022-10-20 01:50:23,512][0m Trial 98 finished with value: 0.9918048770136487 and parameters: {'bbc_n_estimators': 6, 'bbc_max_features': 25, 'bbc_bootstrap': False, 'bbc_sampling_strategy': 'majority'}. Best is trial 83 with value: 0.992109.[0m
[32m[I 2022-10-20 01:50:27,251][0m Trial 97 finished with value: 0.9917407019828189 and parameters: {'bbc_n_estimators': 16, 'bbc_max_features': 27, 'bbc_bootstrap': False, 'bbc_sampling_strategy': 'majority'}. Best is trial 83 with value: 0.992109.[0m
[32m[I 2022-10-20 01:50:42,906][0m Trial 99 finished with value: 0.9917433148990386 and parameters: {'bbc_n_estimators': 14, 'bbc_max_features': 25, 'bbc_bootstrap': False, 'bbc_sampling_strategy': 'majority'}. Best is trial 83 with value: 0.992109.[0m
[32m[I 2022-10-20 01:50:42,953][0m Study finished.[0m
[32m[I 2022-10-20 01:50:43,031][0m --------------------------------------------------------------------------------[0m
[32m[I 2022-10-20 01:50:43,031][0m --------------------     BalancedRandomForestClassifier     --------------------[0m
[32m[I 2022-10-20 01:50:43,031][0m --------------------------------------------------------------------------------[0m
[32m[I 2022-10-20 01:50:43,062][0m A new study created in RDB with name: BalancedRandomForestClassifier_b4f53b70[0m
[32m[I 2022-10-20 01:50:43,062][0m Study started.[0m
[32m[I 2022-10-20 01:51:02,107][0m sklearn.ensemble.RandomForestClassifier.predict: fallback to original Scikit-learn[0m
[32m[I 2022-10-20 01:51:02,107][0m sklearn.ensemble.RandomForestClassifier.predict_proba: fallback to original Scikit-learn[0m
[32m[I 2022-10-20 01:51:05,509][0m Trial 6 finished with value: 0.9915274715988811 and parameters: {'brf_n_estimators': 50, 'brf_criterion': 'entropy', 'brf_min_samples_split': 41, 'brf_min_samples_leaf': 6, 'brf_max_features': 13, 'brf_bootstrap': True}. Best is trial 6 with value: 0.991527.[0m
[32m[I 2022-10-20 01:51:08,457][0m sklearn.ensemble.RandomForestClassifier.predict: fallback to original Scikit-learn[0m
[32m[I 2022-10-20 01:51:08,457][0m sklearn.ensemble.RandomForestClassifier.predict_proba: fallback to original Scikit-learn[0m
[32m[I 2022-10-20 01:51:12,123][0m Trial 4 finished with value: 0.9915052628986426 and parameters: {'brf_n_estimators': 60, 'brf_criterion': 'gini', 'brf_min_samples_split': 19, 'brf_min_samples_leaf': 13, 'brf_max_features': 32, 'brf_bootstrap': False}. Best is trial 6 with value: 0.991527.[0m
[32m[I 2022-10-20 01:51:13,035][0m sklearn.ensemble.RandomForestClassifier.predict: fallback to original Scikit-learn[0m
[32m[I 2022-10-20 01:51:13,050][0m sklearn.ensemble.RandomForestClassifier.predict_proba: fallback to original Scikit-learn[0m
[32m[I 2022-10-20 01:51:17,401][0m Trial 5 finished with value: 0.9915878182001443 and parameters: {'brf_n_estimators': 80, 'brf_criterion': 'gini', 'brf_min_samples_split': 36, 'brf_min_samples_leaf': 1, 'brf_max_features': 1, 'brf_bootstrap': True}. Best is trial 5 with value: 0.991588.[0m
[32m[I 2022-10-20 01:51:25,574][0m sklearn.ensemble.RandomForestClassifier.predict: fallback to original Scikit-learn[0m
[32m[I 2022-10-20 01:51:25,590][0m sklearn.ensemble.RandomForestClassifier.predict_proba: fallback to original Scikit-learn[0m
[32m[I 2022-10-20 01:51:28,884][0m Trial 8 finished with value: 0.9910810687847815 and parameters: {'brf_n_estimators': 50, 'brf_criterion': 'entropy', 'brf_min_samples_split': 44, 'brf_min_samples_leaf': 28, 'brf_max_features': 35, 'brf_bootstrap': True}. Best is trial 5 with value: 0.991588.[0m
[32m[I 2022-10-20 01:51:34,767][0m sklearn.ensemble.RandomForestClassifier.predict: fallback to original Scikit-learn[0m
[32m[I 2022-10-20 01:51:34,767][0m sklearn.ensemble.RandomForestClassifier.predict_proba: fallback to original Scikit-learn[0m
[32m[I 2022-10-20 01:51:39,323][0m sklearn.ensemble.RandomForestClassifier.predict: fallback to original Scikit-learn[0m
[32m[I 2022-10-20 01:51:39,339][0m sklearn.ensemble.RandomForestClassifier.predict_proba: fallback to original Scikit-learn[0m
[32m[I 2022-10-20 01:51:40,184][0m Trial 2 finished with value: 0.9917102277507849 and parameters: {'brf_n_estimators': 130, 'brf_criterion': 'entropy', 'brf_min_samples_split': 42, 'brf_min_samples_leaf': 5, 'brf_max_features': 23, 'brf_bootstrap': False}. Best is trial 2 with value: 0.99171.[0m
[32m[I 2022-10-20 01:51:40,449][0m sklearn.ensemble.RandomForestClassifier.predict: fallback to original Scikit-learn[0m
[32m[I 2022-10-20 01:51:40,465][0m sklearn.ensemble.RandomForestClassifier.predict_proba: fallback to original Scikit-learn[0m
[32m[I 2022-10-20 01:51:44,471][0m Trial 7 finished with value: 0.9914523410601698 and parameters: {'brf_n_estimators': 140, 'brf_criterion': 'gini', 'brf_min_samples_split': 41, 'brf_min_samples_leaf': 37, 'brf_max_features': 26, 'brf_bootstrap': False}. Best is trial 2 with value: 0.99171.[0m
[32m[I 2022-10-20 01:51:45,980][0m Trial 1 finished with value: 0.9911411519742265 and parameters: {'brf_n_estimators': 140, 'brf_criterion': 'entropy', 'brf_min_samples_split': 15, 'brf_min_samples_leaf': 13, 'brf_max_features': 44, 'brf_bootstrap': True}. Best is trial 2 with value: 0.99171.[0m
[32m[I 2022-10-20 01:51:53,755][0m sklearn.ensemble.RandomForestClassifier.predict: fallback to original Scikit-learn[0m
[32m[I 2022-10-20 01:51:53,755][0m sklearn.ensemble.RandomForestClassifier.predict_proba: fallback to original Scikit-learn[0m
[32m[I 2022-10-20 01:52:01,116][0m Trial 3 finished with value: 0.9914589140850182 and parameters: {'brf_n_estimators': 180, 'brf_criterion': 'entropy', 'brf_min_samples_split': 10, 'brf_min_samples_leaf': 12, 'brf_max_features': 23, 'brf_bootstrap': False}. Best is trial 2 with value: 0.99171.[0m
[32m[I 2022-10-20 01:52:09,148][0m sklearn.ensemble.RandomForestClassifier.predict: fallback to original Scikit-learn[0m
[32m[I 2022-10-20 01:52:09,164][0m sklearn.ensemble.RandomForestClassifier.predict_proba: fallback to original Scikit-learn[0m
[32m[I 2022-10-20 01:52:17,154][0m Trial 0 finished with value: 0.9916401867855791 and parameters: {'brf_n_estimators': 200, 'brf_criterion': 'entropy', 'brf_min_samples_split': 25, 'brf_min_samples_leaf': 3, 'brf_max_features': 48, 'brf_bootstrap': False}. Best is trial 2 with value: 0.99171.[0m
[32m[I 2022-10-20 01:52:22,165][0m sklearn.ensemble.RandomForestClassifier.predict: fallback to original Scikit-learn[0m
[32m[I 2022-10-20 01:52:22,165][0m sklearn.ensemble.RandomForestClassifier.predict_proba: fallback to original Scikit-learn[0m
[32m[I 2022-10-20 01:52:23,480][0m sklearn.ensemble.RandomForestClassifier.predict: fallback to original Scikit-learn[0m
[32m[I 2022-10-20 01:52:23,480][0m sklearn.ensemble.RandomForestClassifier.predict_proba: fallback to original Scikit-learn[0m
[32m[I 2022-10-20 01:52:24,027][0m sklearn.ensemble.RandomForestClassifier.predict: fallback to original Scikit-learn[0m
[32m[I 2022-10-20 01:52:24,043][0m sklearn.ensemble.RandomForestClassifier.predict_proba: fallback to original Scikit-learn[0m
[32m[I 2022-10-20 01:52:25,531][0m sklearn.ensemble.RandomForestClassifier.predict: fallback to original Scikit-learn[0m
[32m[I 2022-10-20 01:52:25,546][0m sklearn.ensemble.RandomForestClassifier.predict_proba: fallback to original Scikit-learn[0m
[32m[I 2022-10-20 01:52:26,032][0m Trial 14 finished with value: 0.9911295417669225 and parameters: {'brf_n_estimators': 110, 'brf_criterion': 'gini', 'brf_min_samples_split': 27, 'brf_min_samples_leaf': 35, 'brf_max_features': 2, 'brf_bootstrap': False}. Best is trial 2 with value: 0.99171.[0m
[32m[I 2022-10-20 01:52:27,785][0m Trial 13 finished with value: 0.9917173727807655 and parameters: {'brf_n_estimators': 100, 'brf_criterion': 'entropy', 'brf_min_samples_split': 25, 'brf_min_samples_leaf': 3, 'brf_max_features': 22, 'brf_bootstrap': False}. Best is trial 13 with value: 0.991717.[0m
[32m[I 2022-10-20 01:52:28,208][0m sklearn.ensemble.RandomForestClassifier.predict: fallback to original Scikit-learn[0m
[32m[I 2022-10-20 01:52:28,208][0m sklearn.ensemble.RandomForestClassifier.predict_proba: fallback to original Scikit-learn[0m
[32m[I 2022-10-20 01:52:28,678][0m Trial 10 finished with value: 0.9909362733868384 and parameters: {'brf_n_estimators': 150, 'brf_criterion': 'gini', 'brf_min_samples_split': 28, 'brf_min_samples_leaf': 24, 'brf_max_features': 46, 'brf_bootstrap': False}. Best is trial 13 with value: 0.991717.[0m
[32m[I 2022-10-20 01:52:30,747][0m Trial 11 finished with value: 0.9915511452909535 and parameters: {'brf_n_estimators': 140, 'brf_criterion': 'gini', 'brf_min_samples_split': 29, 'brf_min_samples_leaf': 9, 'brf_max_features': 32, 'brf_bootstrap': False}. Best is trial 13 with value: 0.991717.[0m
[32m[I 2022-10-20 01:52:33,727][0m sklearn.ensemble.RandomForestClassifier.predict: fallback to original Scikit-learn[0m
[32m[I 2022-10-20 01:52:33,727][0m sklearn.ensemble.RandomForestClassifier.predict_proba: fallback to original Scikit-learn[0m
[32m[I 2022-10-20 01:52:35,202][0m Trial 9 finished with value: 0.9914447766985642 and parameters: {'brf_n_estimators': 180, 'brf_criterion': 'entropy', 'brf_min_samples_split': 46, 'brf_min_samples_leaf': 10, 'brf_max_features': 46, 'brf_bootstrap': False}. Best is trial 13 with value: 0.991717.[0m
[32m[I 2022-10-20 01:52:38,274][0m Trial 15 finished with value: 0.9910108037464547 and parameters: {'brf_n_estimators': 80, 'brf_criterion': 'entropy', 'brf_min_samples_split': 33, 'brf_min_samples_leaf': 35, 'brf_max_features': 39, 'brf_bootstrap': False}. Best is trial 13 with value: 0.991717.[0m
[32m[I 2022-10-20 01:53:08,343][0m sklearn.ensemble.RandomForestClassifier.predict: fallback to original Scikit-learn[0m
[32m[I 2022-10-20 01:53:08,343][0m sklearn.ensemble.RandomForestClassifier.predict_proba: fallback to original Scikit-learn[0m
[32m[I 2022-10-20 01:53:08,390][0m sklearn.ensemble.RandomForestClassifier.predict: fallback to original Scikit-learn[0m
[32m[I 2022-10-20 01:53:08,390][0m sklearn.ensemble.RandomForestClassifier.predict_proba: fallback to original Scikit-learn[0m
[32m[I 2022-10-20 01:53:08,828][0m sklearn.ensemble.RandomForestClassifier.predict: fallback to original Scikit-learn[0m
[32m[I 2022-10-20 01:53:08,828][0m sklearn.ensemble.RandomForestClassifier.predict_proba: fallback to original Scikit-learn[0m
[32m[I 2022-10-20 01:53:09,674][0m sklearn.ensemble.RandomForestClassifier.predict: fallback to original Scikit-learn[0m
[32m[I 2022-10-20 01:53:09,689][0m sklearn.ensemble.RandomForestClassifier.predict_proba: fallback to original Scikit-learn[0m
[32m[I 2022-10-20 01:53:09,971][0m sklearn.ensemble.RandomForestClassifier.predict: fallback to original Scikit-learn[0m
[32m[I 2022-10-20 01:53:09,971][0m sklearn.ensemble.RandomForestClassifier.predict_proba: fallback to original Scikit-learn[0m
[32m[I 2022-10-20 01:53:10,284][0m sklearn.ensemble.RandomForestClassifier.predict: fallback to original Scikit-learn[0m
[32m[I 2022-10-20 01:53:10,284][0m sklearn.ensemble.RandomForestClassifier.predict_proba: fallback to original Scikit-learn[0m
[32m[I 2022-10-20 01:53:11,563][0m Trial 19 finished with value: 0.9913594955601553 and parameters: {'brf_n_estimators': 100, 'brf_criterion': 'entropy', 'brf_min_samples_split': 49, 'brf_min_samples_leaf': 49, 'brf_max_features': 16, 'brf_bootstrap': False}. Best is trial 13 with value: 0.991717.[0m
[32m[I 2022-10-20 01:53:12,268][0m Trial 17 finished with value: 0.9913821611123613 and parameters: {'brf_n_estimators': 110, 'brf_criterion': 'entropy', 'brf_min_samples_split': 50, 'brf_min_samples_leaf': 49, 'brf_max_features': 15, 'brf_bootstrap': False}. Best is trial 13 with value: 0.991717.[0m
[32m[I 2022-10-20 01:53:12,834][0m sklearn.ensemble.RandomForestClassifier.predict: fallback to original Scikit-learn[0m
[32m[I 2022-10-20 01:53:12,834][0m sklearn.ensemble.RandomForestClassifier.predict_proba: fallback to original Scikit-learn[0m
[32m[I 2022-10-20 01:53:12,943][0m Trial 20 finished with value: 0.9914742625375036 and parameters: {'brf_n_estimators': 100, 'brf_criterion': 'entropy', 'brf_min_samples_split': 50, 'brf_min_samples_leaf': 21, 'brf_max_features': 15, 'brf_bootstrap': False}. Best is trial 13 with value: 0.991717.[0m
[32m[I 2022-10-20 01:53:13,837][0m Trial 16 finished with value: 0.9908813502391459 and parameters: {'brf_n_estimators': 120, 'brf_criterion': 'gini', 'brf_min_samples_split': 11, 'brf_min_samples_leaf': 23, 'brf_max_features': 43, 'brf_bootstrap': False}. Best is trial 13 with value: 0.991717.[0m
[32m[I 2022-10-20 01:53:14,152][0m Trial 18 finished with value: 0.9914130524373115 and parameters: {'brf_n_estimators': 110, 'brf_criterion': 'entropy', 'brf_min_samples_split': 2, 'brf_min_samples_leaf': 47, 'brf_max_features': 16, 'brf_bootstrap': False}. Best is trial 13 with value: 0.991717.[0m
[32m[I 2022-10-20 01:53:14,543][0m Trial 12 finished with value: 0.9912237386552766 and parameters: {'brf_n_estimators': 200, 'brf_criterion': 'gini', 'brf_min_samples_split': 5, 'brf_min_samples_leaf': 13, 'brf_max_features': 47, 'brf_bootstrap': False}. Best is trial 13 with value: 0.991717.[0m
[32m[I 2022-10-20 01:53:17,945][0m Trial 21 finished with value: 0.991420335847568 and parameters: {'brf_n_estimators': 100, 'brf_criterion': 'entropy', 'brf_min_samples_split': 4, 'brf_min_samples_leaf': 46, 'brf_max_features': 16, 'brf_bootstrap': False}. Best is trial 13 with value: 0.991717.[0m
[32m[I 2022-10-20 01:53:20,551][0m sklearn.ensemble.RandomForestClassifier.predict: fallback to original Scikit-learn[0m
[32m[I 2022-10-20 01:53:20,551][0m sklearn.ensemble.RandomForestClassifier.predict_proba: fallback to original Scikit-learn[0m
[32m[I 2022-10-20 01:53:26,133][0m Trial 22 finished with value: 0.9914287609910974 and parameters: {'brf_n_estimators': 110, 'brf_criterion': 'entropy', 'brf_min_samples_split': 50, 'brf_min_samples_leaf': 47, 'brf_max_features': 17, 'brf_bootstrap': False}. Best is trial 13 with value: 0.991717.[0m
[32m[I 2022-10-20 01:53:45,652][0m sklearn.ensemble.RandomForestClassifier.predict: fallback to original Scikit-learn[0m
[32m[I 2022-10-20 01:53:45,668][0m sklearn.ensemble.RandomForestClassifier.predict_proba: fallback to original Scikit-learn[0m
[32m[I 2022-10-20 01:53:48,161][0m sklearn.ensemble.RandomForestClassifier.predict: fallback to original Scikit-learn[0m
[32m[I 2022-10-20 01:53:48,177][0m sklearn.ensemble.RandomForestClassifier.predict_proba: fallback to original Scikit-learn[0m
[32m[I 2022-10-20 01:53:50,106][0m Trial 26 finished with value: 0.9914061772215395 and parameters: {'brf_n_estimators': 80, 'brf_criterion': 'entropy', 'brf_min_samples_split': 35, 'brf_min_samples_leaf': 19, 'brf_max_features': 23, 'brf_bootstrap': True}. Best is trial 13 with value: 0.991717.[0m
[32m[I 2022-10-20 01:53:53,158][0m Trial 24 finished with value: 0.9914669739757489 and parameters: {'brf_n_estimators': 90, 'brf_criterion': 'entropy', 'brf_min_samples_split': 17, 'brf_min_samples_leaf': 19, 'brf_max_features': 22, 'brf_bootstrap': False}. Best is trial 13 with value: 0.991717.[0m
[32m[I 2022-10-20 01:53:54,035][0m sklearn.ensemble.RandomForestClassifier.predict: fallback to original Scikit-learn[0m
[32m[I 2022-10-20 01:53:54,051][0m sklearn.ensemble.RandomForestClassifier.predict_proba: fallback to original Scikit-learn[0m
[32m[I 2022-10-20 01:53:59,935][0m Trial 23 finished with value: 0.9914285889439546 and parameters: {'brf_n_estimators': 110, 'brf_criterion': 'entropy', 'brf_min_samples_split': 2, 'brf_min_samples_leaf': 19, 'brf_max_features': 16, 'brf_bootstrap': False}. Best is trial 13 with value: 0.991717.[0m
[32m[I 2022-10-20 01:54:14,475][0m sklearn.ensemble.RandomForestClassifier.predict: fallback to original Scikit-learn[0m
[32m[I 2022-10-20 01:54:14,491][0m sklearn.ensemble.RandomForestClassifier.predict_proba: fallback to original Scikit-learn[0m
[32m[I 2022-10-20 01:54:19,016][0m sklearn.ensemble.RandomForestClassifier.predict: fallback to original Scikit-learn[0m
[32m[I 2022-10-20 01:54:19,016][0m sklearn.ensemble.RandomForestClassifier.predict_proba: fallback to original Scikit-learn[0m
[32m[I 2022-10-20 01:54:19,562][0m sklearn.ensemble.RandomForestClassifier.predict: fallback to original Scikit-learn[0m
[32m[I 2022-10-20 01:54:19,562][0m sklearn.ensemble.RandomForestClassifier.predict_proba: fallback to original Scikit-learn[0m
