[32m[I 2022-10-20 17:37:29,140][0m Trial 70 finished with value: 0.9914203653804865 and parameters: {'vfdrc_ordered_rules': True, 'vfdrc_grace_period': 300, 'vfdrc_tie_threshold': 0.65, 'vfdrc_rule_prediction': 'weighted_sum', 'vfdrc_max_rules': 15, 'vfdrc_expand_criterion': 'info_gain', 'vfdrc_remove_poor_atts': True}. Best is trial 59 with value: 0.991427.[0m
[32m[I 2022-10-20 17:38:12,877][0m Trial 72 finished with value: 0.9914203653804865 and parameters: {'vfdrc_ordered_rules': True, 'vfdrc_grace_period': 300, 'vfdrc_tie_threshold': 0.65, 'vfdrc_rule_prediction': 'weighted_sum', 'vfdrc_max_rules': 15, 'vfdrc_expand_criterion': 'info_gain', 'vfdrc_remove_poor_atts': True}. Best is trial 59 with value: 0.991427.[0m
[32m[I 2022-10-20 17:38:27,664][0m Trial 71 finished with value: 0.9914203653804865 and parameters: {'vfdrc_ordered_rules': True, 'vfdrc_grace_period': 300, 'vfdrc_tie_threshold': 0.65, 'vfdrc_rule_prediction': 'weighted_sum', 'vfdrc_max_rules': 15, 'vfdrc_expand_criterion': 'info_gain', 'vfdrc_remove_poor_atts': True}. Best is trial 59 with value: 0.991427.[0m
[32m[I 2022-10-20 17:38:50,268][0m Trial 74 finished with value: 0.9693791016163141 and parameters: {'vfdrc_ordered_rules': True, 'vfdrc_grace_period': 300, 'vfdrc_tie_threshold': 0.65, 'vfdrc_rule_prediction': 'weighted_sum', 'vfdrc_max_rules': 10, 'vfdrc_expand_criterion': 'info_gain', 'vfdrc_remove_poor_atts': True}. Best is trial 59 with value: 0.991427.[0m
[32m[I 2022-10-20 17:39:08,928][0m Trial 73 finished with value: 0.9693791016163141 and parameters: {'vfdrc_ordered_rules': True, 'vfdrc_grace_period': 300, 'vfdrc_tie_threshold': 0.65, 'vfdrc_rule_prediction': 'weighted_sum', 'vfdrc_max_rules': 10, 'vfdrc_expand_criterion': 'info_gain', 'vfdrc_remove_poor_atts': True}. Best is trial 59 with value: 0.991427.[0m
[32m[I 2022-10-20 17:39:46,731][0m Trial 77 finished with value: 0.9913793437598339 and parameters: {'vfdrc_ordered_rules': True, 'vfdrc_grace_period': 300, 'vfdrc_tie_threshold': 0.9500000000000001, 'vfdrc_rule_prediction': 'first_hit', 'vfdrc_max_rules': 20, 'vfdrc_expand_criterion': 'info_gain', 'vfdrc_remove_poor_atts': True}. Best is trial 59 with value: 0.991427.[0m
[32m[I 2022-10-20 17:40:46,278][0m Trial 75 finished with value: 0.9913793437598339 and parameters: {'vfdrc_ordered_rules': True, 'vfdrc_grace_period': 300, 'vfdrc_tie_threshold': 0.4, 'vfdrc_rule_prediction': 'first_hit', 'vfdrc_max_rules': 20, 'vfdrc_expand_criterion': 'info_gain', 'vfdrc_remove_poor_atts': True}. Best is trial 59 with value: 0.991427.[0m
[32m[I 2022-10-20 17:43:16,996][0m Trial 76 finished with value: 0.9913793437598339 and parameters: {'vfdrc_ordered_rules': True, 'vfdrc_grace_period': 300, 'vfdrc_tie_threshold': 0.8, 'vfdrc_rule_prediction': 'first_hit', 'vfdrc_max_rules': 20, 'vfdrc_expand_criterion': 'info_gain', 'vfdrc_remove_poor_atts': True}. Best is trial 59 with value: 0.991427.[0m
[32m[I 2022-10-20 17:44:56,135][0m Trial 78 finished with value: 0.9913793437598339 and parameters: {'vfdrc_ordered_rules': True, 'vfdrc_grace_period': 300, 'vfdrc_tie_threshold': 0.9500000000000001, 'vfdrc_rule_prediction': 'first_hit', 'vfdrc_max_rules': 20, 'vfdrc_expand_criterion': 'info_gain', 'vfdrc_remove_poor_atts': True}. Best is trial 59 with value: 0.991427.[0m
[32m[I 2022-10-20 17:45:43,054][0m Trial 83 finished with value: 0.9012901561892285 and parameters: {'vfdrc_ordered_rules': True, 'vfdrc_grace_period': 350, 'vfdrc_tie_threshold': 0.8500000000000001, 'vfdrc_rule_prediction': 'weighted_sum', 'vfdrc_max_rules': 15, 'vfdrc_expand_criterion': 'info_gain', 'vfdrc_remove_poor_atts': True}. Best is trial 59 with value: 0.991427.[0m
[32m[I 2022-10-20 17:46:15,547][0m Trial 81 finished with value: 0.8604502217722374 and parameters: {'vfdrc_ordered_rules': True, 'vfdrc_grace_period': 350, 'vfdrc_tie_threshold': 0.8, 'vfdrc_rule_prediction': 'first_hit', 'vfdrc_max_rules': 10, 'vfdrc_expand_criterion': 'info_gain', 'vfdrc_remove_poor_atts': True}. Best is trial 59 with value: 0.991427.[0m
[32m[I 2022-10-20 17:46:15,562][0m Trial 79 finished with value: 0.9693791016163141 and parameters: {'vfdrc_ordered_rules': True, 'vfdrc_grace_period': 300, 'vfdrc_tie_threshold': 0.75, 'vfdrc_rule_prediction': 'first_hit', 'vfdrc_max_rules': 10, 'vfdrc_expand_criterion': 'info_gain', 'vfdrc_remove_poor_atts': True}. Best is trial 59 with value: 0.991427.[0m
[32m[I 2022-10-20 17:46:50,956][0m Trial 82 finished with value: 0.9012901561892285 and parameters: {'vfdrc_ordered_rules': True, 'vfdrc_grace_period': 350, 'vfdrc_tie_threshold': 0.75, 'vfdrc_rule_prediction': 'first_hit', 'vfdrc_max_rules': 15, 'vfdrc_expand_criterion': 'info_gain', 'vfdrc_remove_poor_atts': True}. Best is trial 59 with value: 0.991427.[0m
[32m[I 2022-10-20 17:47:21,091][0m Trial 80 finished with value: 0.9693791016163141 and parameters: {'vfdrc_ordered_rules': True, 'vfdrc_grace_period': 300, 'vfdrc_tie_threshold': 0.75, 'vfdrc_rule_prediction': 'first_hit', 'vfdrc_max_rules': 10, 'vfdrc_expand_criterion': 'info_gain', 'vfdrc_remove_poor_atts': True}. Best is trial 59 with value: 0.991427.[0m
[32m[I 2022-10-20 17:48:43,523][0m Trial 84 finished with value: 0.9012901561892285 and parameters: {'vfdrc_ordered_rules': True, 'vfdrc_grace_period': 350, 'vfdrc_tie_threshold': 0.8, 'vfdrc_rule_prediction': 'first_hit', 'vfdrc_max_rules': 15, 'vfdrc_expand_criterion': 'info_gain', 'vfdrc_remove_poor_atts': True}. Best is trial 59 with value: 0.991427.[0m
[32m[I 2022-10-20 17:50:57,123][0m Trial 85 finished with value: 0.9012901561892285 and parameters: {'vfdrc_ordered_rules': True, 'vfdrc_grace_period': 350, 'vfdrc_tie_threshold': 0.75, 'vfdrc_rule_prediction': 'first_hit', 'vfdrc_max_rules': 15, 'vfdrc_expand_criterion': 'info_gain', 'vfdrc_remove_poor_atts': True}. Best is trial 59 with value: 0.991427.[0m
[32m[I 2022-10-20 17:53:11,744][0m Trial 86 finished with value: 0.9012901561892285 and parameters: {'vfdrc_ordered_rules': True, 'vfdrc_grace_period': 350, 'vfdrc_tie_threshold': 0.65, 'vfdrc_rule_prediction': 'weighted_sum', 'vfdrc_max_rules': 15, 'vfdrc_expand_criterion': 'info_gain', 'vfdrc_remove_poor_atts': True}. Best is trial 59 with value: 0.991427.[0m
[32m[I 2022-10-20 17:53:46,870][0m Trial 87 finished with value: 0.6246027889142144 and parameters: {'vfdrc_ordered_rules': True, 'vfdrc_grace_period': 350, 'vfdrc_tie_threshold': 0.75, 'vfdrc_rule_prediction': 'first_hit', 'vfdrc_max_rules': 15, 'vfdrc_expand_criterion': 'hellinger', 'vfdrc_remove_poor_atts': True}. Best is trial 59 with value: 0.991427.[0m
[32m[I 2022-10-20 17:56:33,475][0m Trial 88 finished with value: 0.9012901561892285 and parameters: {'vfdrc_ordered_rules': True, 'vfdrc_grace_period': 350, 'vfdrc_tie_threshold': 0.75, 'vfdrc_rule_prediction': 'weighted_sum', 'vfdrc_max_rules': 15, 'vfdrc_expand_criterion': 'info_gain', 'vfdrc_remove_poor_atts': True}. Best is trial 59 with value: 0.991427.[0m
[32m[I 2022-10-20 17:56:50,672][0m Trial 89 finished with value: 0.9012901561892285 and parameters: {'vfdrc_ordered_rules': True, 'vfdrc_grace_period': 350, 'vfdrc_tie_threshold': 0.9, 'vfdrc_rule_prediction': 'weighted_sum', 'vfdrc_max_rules': 15, 'vfdrc_expand_criterion': 'info_gain', 'vfdrc_remove_poor_atts': True}. Best is trial 59 with value: 0.991427.[0m
[32m[I 2022-10-20 17:57:54,529][0m Trial 90 finished with value: 0.9914203653804865 and parameters: {'vfdrc_ordered_rules': True, 'vfdrc_grace_period': 300, 'vfdrc_tie_threshold': 0.65, 'vfdrc_rule_prediction': 'weighted_sum', 'vfdrc_max_rules': 15, 'vfdrc_expand_criterion': 'info_gain', 'vfdrc_remove_poor_atts': True}. Best is trial 59 with value: 0.991427.[0m
[32m[I 2022-10-20 17:59:23,101][0m Trial 91 finished with value: 0.9914203653804865 and parameters: {'vfdrc_ordered_rules': True, 'vfdrc_grace_period': 300, 'vfdrc_tie_threshold': 0.9500000000000001, 'vfdrc_rule_prediction': 'first_hit', 'vfdrc_max_rules': 15, 'vfdrc_expand_criterion': 'info_gain', 'vfdrc_remove_poor_atts': True}. Best is trial 59 with value: 0.991427.[0m
[32m[I 2022-10-20 18:00:46,403][0m Trial 92 finished with value: 0.6846266553497882 and parameters: {'vfdrc_ordered_rules': True, 'vfdrc_grace_period': 300, 'vfdrc_tie_threshold': 0.9500000000000001, 'vfdrc_rule_prediction': 'first_hit', 'vfdrc_max_rules': 25, 'vfdrc_expand_criterion': 'hellinger', 'vfdrc_remove_poor_atts': True}. Best is trial 59 with value: 0.991427.[0m
[32m[I 2022-10-20 18:00:50,391][0m Trial 95 finished with value: 0.9913784226036281 and parameters: {'vfdrc_ordered_rules': True, 'vfdrc_grace_period': 300, 'vfdrc_tie_threshold': 0.9, 'vfdrc_rule_prediction': 'first_hit', 'vfdrc_max_rules': 25, 'vfdrc_expand_criterion': 'info_gain', 'vfdrc_remove_poor_atts': True}. Best is trial 59 with value: 0.991427.[0m
[32m[I 2022-10-20 18:00:51,977][0m Trial 93 finished with value: 0.6846266553497882 and parameters: {'vfdrc_ordered_rules': True, 'vfdrc_grace_period': 300, 'vfdrc_tie_threshold': 0.65, 'vfdrc_rule_prediction': 'first_hit', 'vfdrc_max_rules': 25, 'vfdrc_expand_criterion': 'hellinger', 'vfdrc_remove_poor_atts': True}. Best is trial 59 with value: 0.991427.[0m
[32m[I 2022-10-20 18:00:52,480][0m Trial 94 finished with value: 0.6846266553497882 and parameters: {'vfdrc_ordered_rules': True, 'vfdrc_grace_period': 300, 'vfdrc_tie_threshold': 0.4, 'vfdrc_rule_prediction': 'weighted_sum', 'vfdrc_max_rules': 25, 'vfdrc_expand_criterion': 'hellinger', 'vfdrc_remove_poor_atts': True}. Best is trial 59 with value: 0.991427.[0m
[32m[I 2022-10-20 18:00:53,373][0m Trial 96 finished with value: 0.9913784226036281 and parameters: {'vfdrc_ordered_rules': True, 'vfdrc_grace_period': 300, 'vfdrc_tie_threshold': 0.4, 'vfdrc_rule_prediction': 'weighted_sum', 'vfdrc_max_rules': 25, 'vfdrc_expand_criterion': 'info_gain', 'vfdrc_remove_poor_atts': True}. Best is trial 59 with value: 0.991427.[0m
[32m[I 2022-10-20 18:00:53,482][0m Trial 97 finished with value: 0.9913784226036281 and parameters: {'vfdrc_ordered_rules': True, 'vfdrc_grace_period': 300, 'vfdrc_tie_threshold': 0.4, 'vfdrc_rule_prediction': 'weighted_sum', 'vfdrc_max_rules': 25, 'vfdrc_expand_criterion': 'info_gain', 'vfdrc_remove_poor_atts': True}. Best is trial 59 with value: 0.991427.[0m
[32m[I 2022-10-20 18:00:53,670][0m Trial 98 finished with value: 0.9913784226036281 and parameters: {'vfdrc_ordered_rules': True, 'vfdrc_grace_period': 300, 'vfdrc_tie_threshold': 0.65, 'vfdrc_rule_prediction': 'weighted_sum', 'vfdrc_max_rules': 25, 'vfdrc_expand_criterion': 'info_gain', 'vfdrc_remove_poor_atts': True}. Best is trial 59 with value: 0.991427.[0m
[32m[I 2022-10-20 18:00:53,813][0m Trial 99 finished with value: 0.9913784226036281 and parameters: {'vfdrc_ordered_rules': True, 'vfdrc_grace_period': 300, 'vfdrc_tie_threshold': 0.4, 'vfdrc_rule_prediction': 'weighted_sum', 'vfdrc_max_rules': 25, 'vfdrc_expand_criterion': 'info_gain', 'vfdrc_remove_poor_atts': True}. Best is trial 59 with value: 0.991427.[0m
[32m[I 2022-10-20 18:00:53,876][0m Study finished.[0m
[32m[I 2022-10-20 18:00:53,970][0m --------------------------------------------------------------------------------[0m
[32m[I 2022-10-20 18:00:53,970][0m --------------------             XGBClassifier              --------------------[0m
[32m[I 2022-10-20 18:00:53,970][0m --------------------------------------------------------------------------------[0m
[32m[I 2022-10-20 18:00:54,001][0m A new study created in RDB with name: XGBClassifier_b4f53b70[0m
[32m[I 2022-10-20 18:00:54,017][0m Study started.[0m
[32m[I 2022-10-20 18:01:26,380][0m Trial 0 finished with value: 0.6949265464263396 and parameters: {'xgbc_n_estimators': 30, 'xgbc_use_label_encoder': False, 'xgbc_learning_rate': 3.2482681912328536e-05, 'xgbc_booster': 'gblinear', 'xgbc_gamma': 0.0001566539098643615}. Best is trial 0 with value: 0.694927.[0m
[32m[I 2022-10-20 18:02:36,882][0m Trial 1 finished with value: 0.987430427654197 and parameters: {'xgbc_n_estimators': 30, 'xgbc_use_label_encoder': False, 'xgbc_learning_rate': 0.0037732602634787675, 'xgbc_booster': 'gbtree', 'xgbc_gamma': 2.2084868742590753e-06}. Best is trial 1 with value: 0.98743.[0m
[32m[I 2022-10-20 18:04:35,755][0m Trial 3 finished with value: 0.9913568312602029 and parameters: {'xgbc_n_estimators': 70, 'xgbc_use_label_encoder': False, 'xgbc_learning_rate': 0.06038587045336019, 'xgbc_booster': 'gbtree', 'xgbc_gamma': 0.11335282667816388}. Best is trial 3 with value: 0.991357.[0m
[32m[I 2022-10-20 18:05:23,247][0m Trial 5 finished with value: 0.9874143495593114 and parameters: {'xgbc_n_estimators': 50, 'xgbc_use_label_encoder': False, 'xgbc_learning_rate': 0.013605548713982112, 'xgbc_booster': 'gbtree', 'xgbc_gamma': 9.904461753840917e-06}. Best is trial 3 with value: 0.991357.[0m
[32m[I 2022-10-20 18:07:20,086][0m Trial 7 finished with value: 0.8279257270269365 and parameters: {'xgbc_n_estimators': 120, 'xgbc_use_label_encoder': False, 'xgbc_learning_rate': 0.004610484878494476, 'xgbc_booster': 'gblinear', 'xgbc_gamma': 1.1732816698443527e-06}. Best is trial 3 with value: 0.991357.[0m
[32m[I 2022-10-20 18:07:46,067][0m Trial 4 finished with value: 0.9917014547815588 and parameters: {'xgbc_n_estimators': 140, 'xgbc_use_label_encoder': False, 'xgbc_learning_rate': 0.633910613686876, 'xgbc_booster': 'gbtree', 'xgbc_gamma': 0.28047797537366986}. Best is trial 4 with value: 0.991701.[0m
[32m[I 2022-10-20 18:08:12,305][0m Trial 2 finished with value: 0.9872397701116491 and parameters: {'xgbc_n_estimators': 40, 'xgbc_use_label_encoder': False, 'xgbc_learning_rate': 0.00019191886970271275, 'xgbc_booster': 'dart', 'xgbc_gamma': 8.004928694822966e-05}. Best is trial 4 with value: 0.991701.[0m
[32m[I 2022-10-20 18:08:18,322][0m Trial 8 finished with value: 0.8282840138327892 and parameters: {'xgbc_n_estimators': 60, 'xgbc_use_label_encoder': False, 'xgbc_learning_rate': 0.010072526299902585, 'xgbc_booster': 'gblinear', 'xgbc_gamma': 0.012666925970748871}. Best is trial 4 with value: 0.991701.[0m
[32m[I 2022-10-20 18:11:28,647][0m Trial 11 finished with value: 0.7133150414742317 and parameters: {'xgbc_n_estimators': 190, 'xgbc_use_label_encoder': False, 'xgbc_learning_rate': 5.5633348977956376e-05, 'xgbc_booster': 'gblinear', 'xgbc_gamma': 0.37519722197998906}. Best is trial 4 with value: 0.991701.[0m
[32m[I 2022-10-20 18:13:40,309][0m Trial 6 finished with value: 0.9872397701116491 and parameters: {'xgbc_n_estimators': 160, 'xgbc_use_label_encoder': False, 'xgbc_learning_rate': 7.986929425566346e-05, 'xgbc_booster': 'gbtree', 'xgbc_gamma': 9.636017152020818e-05}. Best is trial 4 with value: 0.991701.[0m
[32m[I 2022-10-20 18:14:47,106][0m Trial 9 finished with value: 0.9914892068599217 and parameters: {'xgbc_n_estimators': 160, 'xgbc_use_label_encoder': False, 'xgbc_learning_rate': 0.2386158514498929, 'xgbc_booster': 'gbtree', 'xgbc_gamma': 0.08430819558624249}. Best is trial 4 with value: 0.991701.[0m
[32m[I 2022-10-20 18:15:36,915][0m Trial 10 finished with value: 0.9872397701116491 and parameters: {'xgbc_n_estimators': 130, 'xgbc_use_label_encoder': False, 'xgbc_learning_rate': 7.134475779701726e-05, 'xgbc_booster': 'gbtree', 'xgbc_gamma': 0.00034653217913084295}. Best is trial 4 with value: 0.991701.[0m
[32m[I 2022-10-20 18:19:19,197][0m Trial 14 finished with value: 0.9915421877438927 and parameters: {'xgbc_n_estimators': 130, 'xgbc_use_label_encoder': False, 'xgbc_learning_rate': 0.8198791403798069, 'xgbc_booster': 'gbtree', 'xgbc_gamma': 0.017834471125560834}. Best is trial 4 with value: 0.991701.[0m
[32m[I 2022-10-20 18:45:43,931][0m Trial 12 finished with value: 0.987240373149578 and parameters: {'xgbc_n_estimators': 100, 'xgbc_use_label_encoder': False, 'xgbc_learning_rate': 1.005041097174076e-06, 'xgbc_booster': 'dart', 'xgbc_gamma': 4.5754391726254505e-06}. Best is trial 4 with value: 0.991701.[0m
[32m[I 2022-10-20 18:49:20,864][0m Trial 17 finished with value: 0.9914363446088245 and parameters: {'xgbc_n_estimators': 90, 'xgbc_use_label_encoder': False, 'xgbc_learning_rate': 0.4206228769705124, 'xgbc_booster': 'gbtree', 'xgbc_gamma': 0.005416479993619889}. Best is trial 4 with value: 0.991701.[0m
[32m[I 2022-10-20 18:50:43,622][0m Trial 16 finished with value: 0.9915269347010502 and parameters: {'xgbc_n_estimators': 100, 'xgbc_use_label_encoder': False, 'xgbc_learning_rate': 0.579643903460823, 'xgbc_booster': 'dart', 'xgbc_gamma': 0.008964244618390262}. Best is trial 4 with value: 0.991701.[0m
[32m[I 2022-10-20 18:54:19,751][0m Trial 18 finished with value: 0.9916871105186343 and parameters: {'xgbc_n_estimators': 150, 'xgbc_use_label_encoder': False, 'xgbc_learning_rate': 0.9701638912365566, 'xgbc_booster': 'gbtree', 'xgbc_gamma': 0.007680983833998183}. Best is trial 4 with value: 0.991701.[0m
[32m[I 2022-10-20 18:58:16,049][0m Trial 19 finished with value: 0.9914313526182066 and parameters: {'xgbc_n_estimators': 150, 'xgbc_use_label_encoder': False, 'xgbc_learning_rate': 0.051623874952893965, 'xgbc_booster': 'gbtree', 'xgbc_gamma': 0.7517718493307551}. Best is trial 4 with value: 0.991701.[0m
[32m[I 2022-10-20 19:01:08,559][0m Trial 13 finished with value: 0.9872397701116491 and parameters: {'xgbc_n_estimators': 120, 'xgbc_use_label_encoder': False, 'xgbc_learning_rate': 2.603620906925277e-06, 'xgbc_booster': 'dart', 'xgbc_gamma': 0.006874680294911385}. Best is trial 4 with value: 0.991701.[0m
[32m[I 2022-10-20 19:03:54,424][0m Trial 20 finished with value: 0.9916480825598153 and parameters: {'xgbc_n_estimators': 200, 'xgbc_use_label_encoder': False, 'xgbc_learning_rate': 0.06791520752658126, 'xgbc_booster': 'gbtree', 'xgbc_gamma': 0.9871152263954879}. Best is trial 4 with value: 0.991701.[0m
[32m[I 2022-10-20 19:07:33,917][0m Trial 21 finished with value: 0.9915271651919777 and parameters: {'xgbc_n_estimators': 200, 'xgbc_use_label_encoder': False, 'xgbc_learning_rate': 0.09031663906439465, 'xgbc_booster': 'gbtree', 'xgbc_gamma': 0.0017664784531470972}. Best is trial 4 with value: 0.991701.[0m
[32m[I 2022-10-20 19:10:46,404][0m Trial 22 finished with value: 0.9916326742871705 and parameters: {'xgbc_n_estimators': 200, 'xgbc_use_label_encoder': False, 'xgbc_learning_rate': 0.07685820773284392, 'xgbc_booster': 'gbtree', 'xgbc_gamma': 0.0011926116708149788}. Best is trial 4 with value: 0.991701.[0m
[32m[I 2022-10-20 19:14:03,047][0m Trial 23 finished with value: 0.987430427654197 and parameters: {'xgbc_n_estimators': 180, 'xgbc_use_label_encoder': False, 'xgbc_learning_rate': 0.0009248454377040154, 'xgbc_booster': 'gbtree', 'xgbc_gamma': 0.001090912308317854}. Best is trial 4 with value: 0.991701.[0m
[32m[I 2022-10-20 19:15:56,561][0m Trial 24 finished with value: 0.99148777206229 and parameters: {'xgbc_n_estimators': 180, 'xgbc_use_label_encoder': False, 'xgbc_learning_rate': 0.11255819742567091, 'xgbc_booster': 'gbtree', 'xgbc_gamma': 0.09852077928239529}. Best is trial 4 with value: 0.991701.[0m
[32m[I 2022-10-20 19:18:11,449][0m Trial 25 finished with value: 0.9914583541563474 and parameters: {'xgbc_n_estimators': 170, 'xgbc_use_label_encoder': False, 'xgbc_learning_rate': 0.19577271921944933, 'xgbc_booster': 'gbtree', 'xgbc_gamma': 0.15728828768159706}. Best is trial 4 with value: 0.991701.[0m
[32m[I 2022-10-20 19:21:28,448][0m Trial 26 finished with value: 0.9914653784171755 and parameters: {'xgbc_n_estimators': 170, 'xgbc_use_label_encoder': False, 'xgbc_learning_rate': 0.1891990864211034, 'xgbc_booster': 'gbtree', 'xgbc_gamma': 0.09513418540406476}. Best is trial 4 with value: 0.991701.[0m
[32m[I 2022-10-20 19:23:02,386][0m Trial 27 finished with value: 0.9915791465459741 and parameters: {'xgbc_n_estimators': 150, 'xgbc_use_label_encoder': False, 'xgbc_learning_rate': 0.2493986260062872, 'xgbc_booster': 'gbtree', 'xgbc_gamma': 0.8680357765803676}. Best is trial 4 with value: 0.991701.[0m
[32m[I 2022-10-20 19:24:19,905][0m Trial 28 finished with value: 0.9914264369197473 and parameters: {'xgbc_n_estimators': 140, 'xgbc_use_label_encoder': False, 'xgbc_learning_rate': 0.962309957521909, 'xgbc_booster': 'gbtree', 'xgbc_gamma': 0.9287534754971016}. Best is trial 4 with value: 0.991701.[0m
[32m[I 2022-10-20 19:26:18,049][0m Trial 31 finished with value: 0.8909224774348933 and parameters: {'xgbc_n_estimators': 120, 'xgbc_use_label_encoder': False, 'xgbc_learning_rate': 0.025315785265790706, 'xgbc_booster': 'gblinear', 'xgbc_gamma': 0.0306851866313239}. Best is trial 4 with value: 0.991701.[0m
[32m[I 2022-10-20 19:28:52,074][0m Trial 29 finished with value: 0.9913722951526162 and parameters: {'xgbc_n_estimators': 140, 'xgbc_use_label_encoder': False, 'xgbc_learning_rate': 0.0246168907828541, 'xgbc_booster': 'gbtree', 'xgbc_gamma': 0.027683443614411274}. Best is trial 4 with value: 0.991701.[0m
[32m[I 2022-10-20 19:30:02,559][0m Trial 15 finished with value: 0.9918475441715843 and parameters: {'xgbc_n_estimators': 160, 'xgbc_use_label_encoder': False, 'xgbc_learning_rate': 0.8555856341263185, 'xgbc_booster': 'dart', 'xgbc_gamma': 0.015538236880335813}. Best is trial 15 with value: 0.991848.[0m
[32m[I 2022-10-20 19:30:22,886][0m Trial 30 finished with value: 0.9913722951526162 and parameters: {'xgbc_n_estimators': 140, 'xgbc_use_label_encoder': False, 'xgbc_learning_rate': 0.025046991059000028, 'xgbc_booster': 'gbtree', 'xgbc_gamma': 0.039632956078283176}. Best is trial 15 with value: 0.991848.[0m
[32m[I 2022-10-20 20:29:06,904][0m Trial 32 finished with value: 0.987430427654197 and parameters: {'xgbc_n_estimators': 140, 'xgbc_use_label_encoder': False, 'xgbc_learning_rate': 0.0005343556101118974, 'xgbc_booster': 'dart', 'xgbc_gamma': 0.29016516924273805}. Best is trial 15 with value: 0.991848.[0m
