[32m[I 2022-10-20 21:01:22,385][0m Trial 35 finished with value: 0.9916031617861727 and parameters: {'xgbc_n_estimators': 180, 'xgbc_use_label_encoder': False, 'xgbc_learning_rate': 0.966280608125239, 'xgbc_booster': 'dart', 'xgbc_gamma': 0.25489462454208855}. Best is trial 15 with value: 0.991848.[0m
[32m[I 2022-10-20 21:01:24,250][0m Trial 34 finished with value: 0.9916341605620685 and parameters: {'xgbc_n_estimators': 180, 'xgbc_use_label_encoder': False, 'xgbc_learning_rate': 0.9821359824706296, 'xgbc_booster': 'dart', 'xgbc_gamma': 0.25090205745911176}. Best is trial 15 with value: 0.991848.[0m
[32m[I 2022-10-20 21:02:21,577][0m Trial 37 finished with value: 0.991355812286967 and parameters: {'xgbc_n_estimators': 10, 'xgbc_use_label_encoder': False, 'xgbc_learning_rate': 0.4123781096390083, 'xgbc_booster': 'dart', 'xgbc_gamma': 0.0025318332115589915}. Best is trial 15 with value: 0.991848.[0m
[32m[I 2022-10-20 21:08:36,513][0m Trial 33 finished with value: 0.987430427654197 and parameters: {'xgbc_n_estimators': 180, 'xgbc_use_label_encoder': False, 'xgbc_learning_rate': 0.0010957332264933987, 'xgbc_booster': 'dart', 'xgbc_gamma': 0.24195266670356314}. Best is trial 15 with value: 0.991848.[0m
[32m[I 2022-10-20 21:10:46,539][0m Trial 40 finished with value: 0.951916657751193 and parameters: {'xgbc_n_estimators': 160, 'xgbc_use_label_encoder': False, 'xgbc_learning_rate': 0.2738174016901959, 'xgbc_booster': 'gblinear', 'xgbc_gamma': 0.000356600697483513}. Best is trial 15 with value: 0.991848.[0m
[32m[I 2022-10-20 22:02:26,025][0m Trial 36 finished with value: 0.9915275479667329 and parameters: {'xgbc_n_estimators': 180, 'xgbc_use_label_encoder': False, 'xgbc_learning_rate': 0.4184430976333479, 'xgbc_booster': 'dart', 'xgbc_gamma': 0.0024021311425344916}. Best is trial 15 with value: 0.991848.[0m
[32m[I 2022-10-20 22:16:06,286][0m Trial 38 finished with value: 0.9915350020553072 and parameters: {'xgbc_n_estimators': 160, 'xgbc_use_label_encoder': False, 'xgbc_learning_rate': 0.3596193944840709, 'xgbc_booster': 'dart', 'xgbc_gamma': 0.0037090066951507364}. Best is trial 15 with value: 0.991848.[0m
[32m[I 2022-10-20 22:21:15,599][0m Trial 39 finished with value: 0.9872397701116491 and parameters: {'xgbc_n_estimators': 160, 'xgbc_use_label_encoder': False, 'xgbc_learning_rate': 1.0443915785923307e-05, 'xgbc_booster': 'dart', 'xgbc_gamma': 0.00319198495795649}. Best is trial 15 with value: 0.991848.[0m
[32m[I 2022-10-20 23:01:56,558][0m Trial 41 finished with value: 0.9916564149416912 and parameters: {'xgbc_n_estimators': 200, 'xgbc_use_label_encoder': False, 'xgbc_learning_rate': 0.13017036708527388, 'xgbc_booster': 'dart', 'xgbc_gamma': 0.003219374754296769}. Best is trial 15 with value: 0.991848.[0m
[32m[I 2022-10-20 23:01:56,637][0m Study finished.[0m
[32m[I 2022-10-20 23:01:57,675][0m Optimization finished.[0m
