[32m[I 2022-10-20 08:03:29,284][0m Trial 99 finished with value: 0.3539562847268242 and parameters: {'lsvc_nystroem_kernel_gamma': 0.0019105304984771115, 'lsvc_nystroem_kernel_n_components': 100, 'lsvc_nystroem_dual': False, 'lsvc_nystroem_C': 25.073451282079443, 'lsvc_nystroem_max_iter': 2000}. Best is trial 53 with value: 0.392506.[0m
[32m[I 2022-10-20 08:03:29,347][0m Study finished.[0m
[32m[I 2022-10-20 08:03:29,425][0m --------------------------------------------------------------------------------[0m
[32m[I 2022-10-20 08:03:29,425][0m --------------------    LinearSVC_PolynomialCountSketch     --------------------[0m
[32m[I 2022-10-20 08:03:29,425][0m --------------------------------------------------------------------------------[0m
[32m[I 2022-10-20 08:03:29,456][0m A new study created in RDB with name: LinearSVC_PolynomialCountSketch_b4f53b70[0m
[32m[I 2022-10-20 08:03:29,472][0m Study started.[0m
[32m[I 2022-10-20 08:05:22,123][0m Trial 0 finished with value: 0.96832634297201 and parameters: {'lsvc_pcs_kernel_gamma': 0.6237200909324433, 'lsvc_pcs_kernel_n_components': 50, 'lsvc_pcs_degree': 2, 'lsvc_pcs_dual': False, 'lsvc_pcs_C': 0.19151395554667194, 'lsvc_pcs_max_iter': 2000}. Best is trial 0 with value: 0.968326.[0m
[32m[I 2022-10-20 08:06:46,819][0m Trial 1 finished with value: 0.9150815338084339 and parameters: {'lsvc_pcs_kernel_gamma': 0.612104834080644, 'lsvc_pcs_kernel_n_components': 50, 'lsvc_pcs_degree': 2, 'lsvc_pcs_dual': False, 'lsvc_pcs_C': 2.0150245644672843e-06, 'lsvc_pcs_max_iter': 2000}. Best is trial 0 with value: 0.968326.[0m
[32m[I 2022-10-20 08:09:29,627][0m Trial 2 finished with value: 0.9760253921246137 and parameters: {'lsvc_pcs_kernel_gamma': 0.01747791379199934, 'lsvc_pcs_kernel_n_components': 150, 'lsvc_pcs_degree': 2, 'lsvc_pcs_dual': False, 'lsvc_pcs_C': 0.00011868304581606118, 'lsvc_pcs_max_iter': 2000}. Best is trial 2 with value: 0.976025.[0m
[32m[I 2022-10-20 08:11:54,729][0m Trial 3 finished with value: 0.9296966779759919 and parameters: {'lsvc_pcs_kernel_gamma': 26.980505924963587, 'lsvc_pcs_kernel_n_components': 150, 'lsvc_pcs_degree': 2, 'lsvc_pcs_dual': False, 'lsvc_pcs_C': 0.36379874351569624, 'lsvc_pcs_max_iter': 2000}. Best is trial 2 with value: 0.976025.[0m
[32m[I 2022-10-20 08:14:21,619][0m Trial 4 finished with value: 0.9876434099684929 and parameters: {'lsvc_pcs_kernel_gamma': 0.04007433108910727, 'lsvc_pcs_kernel_n_components': 100, 'lsvc_pcs_degree': 2, 'lsvc_pcs_dual': False, 'lsvc_pcs_C': 0.007731662052369056, 'lsvc_pcs_max_iter': 2000}. Best is trial 4 with value: 0.987643.[0m
[32m[I 2022-10-20 08:17:54,223][0m Trial 5 finished with value: 0.9423046687542364 and parameters: {'lsvc_pcs_kernel_gamma': 151.36888269480414, 'lsvc_pcs_kernel_n_components': 150, 'lsvc_pcs_degree': 2, 'lsvc_pcs_dual': False, 'lsvc_pcs_C': 0.008542322119928667, 'lsvc_pcs_max_iter': 2000}. Best is trial 4 with value: 0.987643.[0m
[32m[I 2022-10-20 08:19:53,622][0m Trial 6 finished with value: 0.9236817383431738 and parameters: {'lsvc_pcs_kernel_gamma': 4.409083871955693, 'lsvc_pcs_kernel_n_components': 50, 'lsvc_pcs_degree': 2, 'lsvc_pcs_dual': False, 'lsvc_pcs_C': 173.57764778206484, 'lsvc_pcs_max_iter': 2000}. Best is trial 4 with value: 0.987643.[0m
[32m[I 2022-10-20 08:21:45,206][0m Trial 7 finished with value: 0.9203091025123098 and parameters: {'lsvc_pcs_kernel_gamma': 0.3883965623267058, 'lsvc_pcs_kernel_n_components': 50, 'lsvc_pcs_degree': 2, 'lsvc_pcs_dual': False, 'lsvc_pcs_C': 0.00163583631809324, 'lsvc_pcs_max_iter': 2000}. Best is trial 4 with value: 0.987643.[0m
[32m[I 2022-10-20 08:24:06,966][0m Trial 8 finished with value: 0.9581753409554254 and parameters: {'lsvc_pcs_kernel_gamma': 0.0063235612270514585, 'lsvc_pcs_kernel_n_components': 50, 'lsvc_pcs_degree': 2, 'lsvc_pcs_dual': False, 'lsvc_pcs_C': 0.6639082184215792, 'lsvc_pcs_max_iter': 2000}. Best is trial 4 with value: 0.987643.[0m
[32m[I 2022-10-20 08:25:32,400][0m Trial 9 finished with value: 0.9423395829455701 and parameters: {'lsvc_pcs_kernel_gamma': 1.4214470423731527, 'lsvc_pcs_kernel_n_components': 50, 'lsvc_pcs_degree': 2, 'lsvc_pcs_dual': False, 'lsvc_pcs_C': 2.7656863375020397, 'lsvc_pcs_max_iter': 2000}. Best is trial 4 with value: 0.987643.[0m
[32m[I 2022-10-20 08:27:56,857][0m Trial 10 finished with value: 0.9288030772575624 and parameters: {'lsvc_pcs_kernel_gamma': 0.001324204244773442, 'lsvc_pcs_kernel_n_components': 100, 'lsvc_pcs_degree': 2, 'lsvc_pcs_dual': False, 'lsvc_pcs_C': 1.8554119363844528e-05, 'lsvc_pcs_max_iter': 2000}. Best is trial 4 with value: 0.987643.[0m
[32m[I 2022-10-20 08:30:11,281][0m Trial 11 finished with value: 0.9311282923178905 and parameters: {'lsvc_pcs_kernel_gamma': 0.025404021706465132, 'lsvc_pcs_kernel_n_components': 100, 'lsvc_pcs_degree': 2, 'lsvc_pcs_dual': False, 'lsvc_pcs_C': 0.0005209808407657133, 'lsvc_pcs_max_iter': 2000}. Best is trial 4 with value: 0.987643.[0m
[32m[I 2022-10-20 08:33:26,346][0m Trial 12 finished with value: 0.9400148437606161 and parameters: {'lsvc_pcs_kernel_gamma': 0.030360996395707423, 'lsvc_pcs_kernel_n_components': 150, 'lsvc_pcs_degree': 2, 'lsvc_pcs_dual': False, 'lsvc_pcs_C': 8.60773176615826e-05, 'lsvc_pcs_max_iter': 2000}. Best is trial 4 with value: 0.987643.[0m
[32m[I 2022-10-20 08:36:15,295][0m Trial 13 finished with value: 0.9350976637615669 and parameters: {'lsvc_pcs_kernel_gamma': 0.0619156057333228, 'lsvc_pcs_kernel_n_components': 100, 'lsvc_pcs_degree': 2, 'lsvc_pcs_dual': False, 'lsvc_pcs_C': 0.013579711885963104, 'lsvc_pcs_max_iter': 2000}. Best is trial 4 with value: 0.987643.[0m
[32m[I 2022-10-20 08:38:57,685][0m Trial 14 finished with value: 0.9244052335533192 and parameters: {'lsvc_pcs_kernel_gamma': 0.0013674550262057267, 'lsvc_pcs_kernel_n_components': 150, 'lsvc_pcs_degree': 2, 'lsvc_pcs_dual': False, 'lsvc_pcs_C': 5.828510891972714e-05, 'lsvc_pcs_max_iter': 2000}. Best is trial 4 with value: 0.987643.[0m
[32m[I 2022-10-20 08:41:31,218][0m Trial 15 finished with value: 0.9714487836401264 and parameters: {'lsvc_pcs_kernel_gamma': 0.10494016999492307, 'lsvc_pcs_kernel_n_components': 100, 'lsvc_pcs_degree': 2, 'lsvc_pcs_dual': False, 'lsvc_pcs_C': 1.8250722163320438e-06, 'lsvc_pcs_max_iter': 2000}. Best is trial 4 with value: 0.987643.[0m
[32m[I 2022-10-20 08:43:29,544][0m Trial 16 finished with value: 0.9391055910165494 and parameters: {'lsvc_pcs_kernel_gamma': 0.0075151936104523994, 'lsvc_pcs_kernel_n_components': 100, 'lsvc_pcs_degree': 2, 'lsvc_pcs_dual': False, 'lsvc_pcs_C': 0.0005773401201784463, 'lsvc_pcs_max_iter': 2000}. Best is trial 4 with value: 0.987643.[0m
[32m[I 2022-10-20 08:46:22,933][0m Trial 17 finished with value: 0.968968766213825 and parameters: {'lsvc_pcs_kernel_gamma': 0.009671939439196312, 'lsvc_pcs_kernel_n_components': 150, 'lsvc_pcs_degree': 2, 'lsvc_pcs_dual': False, 'lsvc_pcs_C': 152.62780872199494, 'lsvc_pcs_max_iter': 2000}. Best is trial 4 with value: 0.987643.[0m
[32m[I 2022-10-20 08:49:02,352][0m Trial 18 finished with value: 0.9807117743841259 and parameters: {'lsvc_pcs_kernel_gamma': 735.0501329599027, 'lsvc_pcs_kernel_n_components': 100, 'lsvc_pcs_degree': 2, 'lsvc_pcs_dual': False, 'lsvc_pcs_C': 17.655119512751085, 'lsvc_pcs_max_iter': 2000}. Best is trial 4 with value: 0.987643.[0m
[32m[I 2022-10-20 08:51:14,672][0m Trial 19 finished with value: 0.981186006551101 and parameters: {'lsvc_pcs_kernel_gamma': 468.02058433797504, 'lsvc_pcs_kernel_n_components': 100, 'lsvc_pcs_degree': 2, 'lsvc_pcs_dual': False, 'lsvc_pcs_C': 10.736527939319048, 'lsvc_pcs_max_iter': 2000}. Best is trial 4 with value: 0.987643.[0m
[32m[I 2022-10-20 08:53:54,981][0m Trial 20 finished with value: 0.9338880452931387 and parameters: {'lsvc_pcs_kernel_gamma': 12.493430500856974, 'lsvc_pcs_kernel_n_components': 100, 'lsvc_pcs_degree': 2, 'lsvc_pcs_dual': False, 'lsvc_pcs_C': 16.91533693409861, 'lsvc_pcs_max_iter': 2000}. Best is trial 4 with value: 0.987643.[0m
[32m[I 2022-10-20 08:56:45,830][0m Trial 21 finished with value: 0.9851295371318929 and parameters: {'lsvc_pcs_kernel_gamma': 635.6834362638496, 'lsvc_pcs_kernel_n_components': 100, 'lsvc_pcs_degree': 2, 'lsvc_pcs_dual': False, 'lsvc_pcs_C': 870.2267568684906, 'lsvc_pcs_max_iter': 2000}. Best is trial 4 with value: 0.987643.[0m
[32m[I 2022-10-20 08:58:56,670][0m Trial 22 finished with value: 0.9440026709390205 and parameters: {'lsvc_pcs_kernel_gamma': 980.7959091440475, 'lsvc_pcs_kernel_n_components': 100, 'lsvc_pcs_degree': 2, 'lsvc_pcs_dual': False, 'lsvc_pcs_C': 665.9050236058315, 'lsvc_pcs_max_iter': 2000}. Best is trial 4 with value: 0.987643.[0m
[32m[I 2022-10-20 09:01:16,894][0m Trial 23 finished with value: 0.9688322675171426 and parameters: {'lsvc_pcs_kernel_gamma': 148.09963466185098, 'lsvc_pcs_kernel_n_components': 100, 'lsvc_pcs_degree': 2, 'lsvc_pcs_dual': False, 'lsvc_pcs_C': 975.4763987509202, 'lsvc_pcs_max_iter': 2000}. Best is trial 4 with value: 0.987643.[0m
[32m[I 2022-10-20 09:03:53,087][0m Trial 24 finished with value: 0.9323229254164396 and parameters: {'lsvc_pcs_kernel_gamma': 148.25720937304942, 'lsvc_pcs_kernel_n_components': 100, 'lsvc_pcs_degree': 2, 'lsvc_pcs_dual': False, 'lsvc_pcs_C': 7.045842448676177, 'lsvc_pcs_max_iter': 2000}. Best is trial 4 with value: 0.987643.[0m
[32m[I 2022-10-20 09:06:24,270][0m Trial 25 finished with value: 0.9329085024702766 and parameters: {'lsvc_pcs_kernel_gamma': 60.31393801888015, 'lsvc_pcs_kernel_n_components': 100, 'lsvc_pcs_degree': 2, 'lsvc_pcs_dual': False, 'lsvc_pcs_C': 0.04780991390131111, 'lsvc_pcs_max_iter': 2000}. Best is trial 4 with value: 0.987643.[0m
[32m[I 2022-10-20 09:09:02,098][0m Trial 26 finished with value: 0.9832269106440891 and parameters: {'lsvc_pcs_kernel_gamma': 3.846484930548358, 'lsvc_pcs_kernel_n_components': 100, 'lsvc_pcs_degree': 2, 'lsvc_pcs_dual': False, 'lsvc_pcs_C': 118.30332189608762, 'lsvc_pcs_max_iter': 2000}. Best is trial 4 with value: 0.987643.[0m
[32m[I 2022-10-20 09:10:48,044][0m Trial 27 finished with value: 0.9557645437208657 and parameters: {'lsvc_pcs_kernel_gamma': 2.514011755127827, 'lsvc_pcs_kernel_n_components': 100, 'lsvc_pcs_degree': 2, 'lsvc_pcs_dual': False, 'lsvc_pcs_C': 200.93968138500512, 'lsvc_pcs_max_iter': 2000}. Best is trial 4 with value: 0.987643.[0m
[32m[I 2022-10-20 09:14:12,177][0m Trial 28 finished with value: 0.9320318896503135 and parameters: {'lsvc_pcs_kernel_gamma': 0.27011986598146154, 'lsvc_pcs_kernel_n_components': 100, 'lsvc_pcs_degree': 2, 'lsvc_pcs_dual': False, 'lsvc_pcs_C': 74.9743746196905, 'lsvc_pcs_max_iter': 2000}. Best is trial 4 with value: 0.987643.[0m
[32m[I 2022-10-20 09:15:43,843][0m Trial 29 finished with value: 0.9533487897855483 and parameters: {'lsvc_pcs_kernel_gamma': 7.325216303020358, 'lsvc_pcs_kernel_n_components': 50, 'lsvc_pcs_degree': 2, 'lsvc_pcs_dual': False, 'lsvc_pcs_C': 0.08254553618378908, 'lsvc_pcs_max_iter': 2000}. Best is trial 4 with value: 0.987643.[0m
[32m[I 2022-10-20 09:17:58,229][0m Trial 30 finished with value: 0.9316575093089653 and parameters: {'lsvc_pcs_kernel_gamma': 0.16819240318764458, 'lsvc_pcs_kernel_n_components': 100, 'lsvc_pcs_degree': 2, 'lsvc_pcs_dual': False, 'lsvc_pcs_C': 1.3498490299190289, 'lsvc_pcs_max_iter': 2000}. Best is trial 4 with value: 0.987643.[0m
[32m[I 2022-10-20 09:21:25,326][0m Trial 31 finished with value: 0.9737854033348506 and parameters: {'lsvc_pcs_kernel_gamma': 421.4288975611869, 'lsvc_pcs_kernel_n_components': 100, 'lsvc_pcs_degree': 2, 'lsvc_pcs_dual': False, 'lsvc_pcs_C': 23.149464705333692, 'lsvc_pcs_max_iter': 2000}. Best is trial 4 with value: 0.987643.[0m
[32m[I 2022-10-20 09:24:04,275][0m Trial 32 finished with value: 0.983974827365721 and parameters: {'lsvc_pcs_kernel_gamma': 336.72042598394864, 'lsvc_pcs_kernel_n_components': 100, 'lsvc_pcs_degree': 2, 'lsvc_pcs_dual': False, 'lsvc_pcs_C': 48.67644423938611, 'lsvc_pcs_max_iter': 2000}. Best is trial 4 with value: 0.987643.[0m
[32m[I 2022-10-20 09:26:30,785][0m Trial 33 finished with value: 0.9736073689003725 and parameters: {'lsvc_pcs_kernel_gamma': 46.20839382998555, 'lsvc_pcs_kernel_n_components': 100, 'lsvc_pcs_degree': 2, 'lsvc_pcs_dual': False, 'lsvc_pcs_C': 51.09888144911843, 'lsvc_pcs_max_iter': 2000}. Best is trial 4 with value: 0.987643.[0m
[32m[I 2022-10-20 09:29:21,695][0m Trial 34 finished with value: 0.9311673184913165 and parameters: {'lsvc_pcs_kernel_gamma': 0.7765811799367637, 'lsvc_pcs_kernel_n_components': 100, 'lsvc_pcs_degree': 2, 'lsvc_pcs_dual': False, 'lsvc_pcs_C': 359.8792157119666, 'lsvc_pcs_max_iter': 2000}. Best is trial 4 with value: 0.987643.[0m
[32m[I 2022-10-20 09:31:49,359][0m Trial 35 finished with value: 0.9213084852974759 and parameters: {'lsvc_pcs_kernel_gamma': 17.727147701912823, 'lsvc_pcs_kernel_n_components': 150, 'lsvc_pcs_degree': 2, 'lsvc_pcs_dual': False, 'lsvc_pcs_C': 0.0038658280844184813, 'lsvc_pcs_max_iter': 2000}. Best is trial 4 with value: 0.987643.[0m
[32m[I 2022-10-20 09:34:50,517][0m Trial 36 finished with value: 0.9257652898051736 and parameters: {'lsvc_pcs_kernel_gamma': 233.77180781264323, 'lsvc_pcs_kernel_n_components': 100, 'lsvc_pcs_degree': 2, 'lsvc_pcs_dual': False, 'lsvc_pcs_C': 0.2380425535976075, 'lsvc_pcs_max_iter': 2000}. Best is trial 4 with value: 0.987643.[0m
[32m[I 2022-10-20 09:36:56,346][0m Trial 37 finished with value: 0.9263949483466591 and parameters: {'lsvc_pcs_kernel_gamma': 47.69833241972262, 'lsvc_pcs_kernel_n_components': 50, 'lsvc_pcs_degree': 2, 'lsvc_pcs_dual': False, 'lsvc_pcs_C': 64.17135542308752, 'lsvc_pcs_max_iter': 2000}. Best is trial 4 with value: 0.987643.[0m
[32m[I 2022-10-20 09:39:37,150][0m Trial 38 finished with value: 0.9303694981107394 and parameters: {'lsvc_pcs_kernel_gamma': 2.1068245793537987, 'lsvc_pcs_kernel_n_components': 150, 'lsvc_pcs_degree': 2, 'lsvc_pcs_dual': False, 'lsvc_pcs_C': 2.815994515167027, 'lsvc_pcs_max_iter': 2000}. Best is trial 4 with value: 0.987643.[0m
[32m[I 2022-10-20 09:41:44,571][0m Trial 39 finished with value: 0.9727250167627479 and parameters: {'lsvc_pcs_kernel_gamma': 70.49186005201442, 'lsvc_pcs_kernel_n_components': 50, 'lsvc_pcs_degree': 2, 'lsvc_pcs_dual': False, 'lsvc_pcs_C': 0.14009207507366708, 'lsvc_pcs_max_iter': 2000}. Best is trial 4 with value: 0.987643.[0m
[32m[I 2022-10-20 09:44:21,312][0m Trial 40 finished with value: 0.9286223687181955 and parameters: {'lsvc_pcs_kernel_gamma': 6.0102190259504065, 'lsvc_pcs_kernel_n_components': 100, 'lsvc_pcs_degree': 2, 'lsvc_pcs_dual': False, 'lsvc_pcs_C': 401.3577128838917, 'lsvc_pcs_max_iter': 2000}. Best is trial 4 with value: 0.987643.[0m
[32m[I 2022-10-20 09:46:19,225][0m Trial 41 finished with value: 0.9655785467945033 and parameters: {'lsvc_pcs_kernel_gamma': 409.81904827070025, 'lsvc_pcs_kernel_n_components': 100, 'lsvc_pcs_degree': 2, 'lsvc_pcs_dual': False, 'lsvc_pcs_C': 122.69078353674323, 'lsvc_pcs_max_iter': 2000}. Best is trial 4 with value: 0.987643.[0m
[32m[I 2022-10-20 09:48:38,513][0m Trial 42 finished with value: 0.9242748923598153 and parameters: {'lsvc_pcs_kernel_gamma': 303.46853048612314, 'lsvc_pcs_kernel_n_components': 100, 'lsvc_pcs_degree': 2, 'lsvc_pcs_dual': False, 'lsvc_pcs_C': 9.68114066423682, 'lsvc_pcs_max_iter': 2000}. Best is trial 4 with value: 0.987643.[0m
[32m[I 2022-10-20 09:50:48,463][0m Trial 43 finished with value: 0.9325527949089 and parameters: {'lsvc_pcs_kernel_gamma': 106.89744525787866, 'lsvc_pcs_kernel_n_components': 100, 'lsvc_pcs_degree': 2, 'lsvc_pcs_dual': False, 'lsvc_pcs_C': 0.012192386805144005, 'lsvc_pcs_max_iter': 2000}. Best is trial 4 with value: 0.987643.[0m
[32m[I 2022-10-20 09:52:45,541][0m Trial 44 finished with value: 0.9695027195530277 and parameters: {'lsvc_pcs_kernel_gamma': 501.1271686436498, 'lsvc_pcs_kernel_n_components': 100, 'lsvc_pcs_degree': 2, 'lsvc_pcs_dual': False, 'lsvc_pcs_C': 0.5897343228541689, 'lsvc_pcs_max_iter': 2000}. Best is trial 4 with value: 0.987643.[0m
[32m[I 2022-10-20 09:55:01,059][0m Trial 45 finished with value: 0.9178009529766701 and parameters: {'lsvc_pcs_kernel_gamma': 0.002632510790040627, 'lsvc_pcs_kernel_n_components': 100, 'lsvc_pcs_degree': 2, 'lsvc_pcs_dual': False, 'lsvc_pcs_C': 44.90976951480405, 'lsvc_pcs_max_iter': 2000}. Best is trial 4 with value: 0.987643.[0m
[32m[I 2022-10-20 09:57:09,670][0m Trial 46 finished with value: 0.9813193728457281 and parameters: {'lsvc_pcs_kernel_gamma': 26.970160037140648, 'lsvc_pcs_kernel_n_components': 50, 'lsvc_pcs_degree': 2, 'lsvc_pcs_dual': False, 'lsvc_pcs_C': 3.7467897876798695, 'lsvc_pcs_max_iter': 2000}. Best is trial 4 with value: 0.987643.[0m
[32m[I 2022-10-20 09:58:57,354][0m Trial 47 finished with value: 0.9395294831442543 and parameters: {'lsvc_pcs_kernel_gamma': 11.549616443107242, 'lsvc_pcs_kernel_n_components': 50, 'lsvc_pcs_degree': 2, 'lsvc_pcs_dual': False, 'lsvc_pcs_C': 2.2513597329296458, 'lsvc_pcs_max_iter': 2000}. Best is trial 4 with value: 0.987643.[0m
[32m[I 2022-10-20 10:00:32,708][0m Trial 48 finished with value: 0.9226216458140979 and parameters: {'lsvc_pcs_kernel_gamma': 26.54272310263155, 'lsvc_pcs_kernel_n_components': 50, 'lsvc_pcs_degree': 2, 'lsvc_pcs_dual': False, 'lsvc_pcs_C': 0.001398159791463853, 'lsvc_pcs_max_iter': 2000}. Best is trial 4 with value: 0.987643.[0m
[32m[I 2022-10-20 10:02:00,292][0m Trial 49 finished with value: 0.9670923002467103 and parameters: {'lsvc_pcs_kernel_gamma': 3.429399096146258, 'lsvc_pcs_kernel_n_components': 50, 'lsvc_pcs_degree': 2, 'lsvc_pcs_dual': False, 'lsvc_pcs_C': 195.84814606145883, 'lsvc_pcs_max_iter': 2000}. Best is trial 4 with value: 0.987643.[0m
[32m[I 2022-10-20 10:05:18,957][0m Trial 50 finished with value: 0.9741121474210827 and parameters: {'lsvc_pcs_kernel_gamma': 0.3672747702817472, 'lsvc_pcs_kernel_n_components': 150, 'lsvc_pcs_degree': 2, 'lsvc_pcs_dual': False, 'lsvc_pcs_C': 0.021770116881865538, 'lsvc_pcs_max_iter': 2000}. Best is trial 4 with value: 0.987643.[0m
[32m[I 2022-10-20 10:07:59,435][0m Trial 51 finished with value: 0.9575586444390463 and parameters: {'lsvc_pcs_kernel_gamma': 745.0299559517914, 'lsvc_pcs_kernel_n_components': 100, 'lsvc_pcs_degree': 2, 'lsvc_pcs_dual': False, 'lsvc_pcs_C': 4.862976968278728, 'lsvc_pcs_max_iter': 2000}. Best is trial 4 with value: 0.987643.[0m
[32m[I 2022-10-20 10:09:59,352][0m Trial 52 finished with value: 0.9389676615373703 and parameters: {'lsvc_pcs_kernel_gamma': 257.556747769395, 'lsvc_pcs_kernel_n_components': 50, 'lsvc_pcs_degree': 2, 'lsvc_pcs_dual': False, 'lsvc_pcs_C': 23.9665123102842, 'lsvc_pcs_max_iter': 2000}. Best is trial 4 with value: 0.987643.[0m
[32m[I 2022-10-20 10:12:20,265][0m Trial 53 finished with value: 0.9832157445974998 and parameters: {'lsvc_pcs_kernel_gamma': 1.3316763733840993, 'lsvc_pcs_kernel_n_components': 100, 'lsvc_pcs_degree': 2, 'lsvc_pcs_dual': False, 'lsvc_pcs_C': 487.88611544526105, 'lsvc_pcs_max_iter': 2000}. Best is trial 4 with value: 0.987643.[0m
[32m[I 2022-10-20 10:15:41,784][0m Trial 54 finished with value: 0.9436605023392222 and parameters: {'lsvc_pcs_kernel_gamma': 0.9643969663467946, 'lsvc_pcs_kernel_n_components': 100, 'lsvc_pcs_degree': 2, 'lsvc_pcs_dual': False, 'lsvc_pcs_C': 415.8934494131243, 'lsvc_pcs_max_iter': 2000}. Best is trial 4 with value: 0.987643.[0m
[32m[I 2022-10-20 10:18:28,237][0m Trial 55 finished with value: 0.9551427639401604 and parameters: {'lsvc_pcs_kernel_gamma': 1.5016186591271297, 'lsvc_pcs_kernel_n_components': 150, 'lsvc_pcs_degree': 2, 'lsvc_pcs_dual': False, 'lsvc_pcs_C': 781.7840362571662, 'lsvc_pcs_max_iter': 2000}. Best is trial 4 with value: 0.987643.[0m
[32m[I 2022-10-20 10:20:35,815][0m Trial 56 finished with value: 0.9817347816566883 and parameters: {'lsvc_pcs_kernel_gamma': 0.05320674538545945, 'lsvc_pcs_kernel_n_components': 100, 'lsvc_pcs_degree': 2, 'lsvc_pcs_dual': False, 'lsvc_pcs_C': 106.15775761101341, 'lsvc_pcs_max_iter': 2000}. Best is trial 4 with value: 0.987643.[0m
[32m[I 2022-10-20 10:22:47,455][0m Trial 57 finished with value: 0.9299230991246997 and parameters: {'lsvc_pcs_kernel_gamma': 0.06500531905972887, 'lsvc_pcs_kernel_n_components': 100, 'lsvc_pcs_degree': 2, 'lsvc_pcs_dual': False, 'lsvc_pcs_C': 282.3528967190446, 'lsvc_pcs_max_iter': 2000}. Best is trial 4 with value: 0.987643.[0m
[32m[I 2022-10-20 10:25:13,930][0m Trial 58 finished with value: 0.9485257799464593 and parameters: {'lsvc_pcs_kernel_gamma': 0.016117362327356433, 'lsvc_pcs_kernel_n_components': 100, 'lsvc_pcs_degree': 2, 'lsvc_pcs_dual': False, 'lsvc_pcs_C': 1.2035208604412343e-05, 'lsvc_pcs_max_iter': 2000}. Best is trial 4 with value: 0.987643.[0m
[32m[I 2022-10-20 10:27:52,216][0m Trial 59 finished with value: 0.9238356302120002 and parameters: {'lsvc_pcs_kernel_gamma': 0.05458069266905813, 'lsvc_pcs_kernel_n_components': 100, 'lsvc_pcs_degree': 2, 'lsvc_pcs_dual': False, 'lsvc_pcs_C': 108.7619258873903, 'lsvc_pcs_max_iter': 2000}. Best is trial 4 with value: 0.987643.[0m
[32m[I 2022-10-20 10:30:08,865][0m Trial 60 finished with value: 0.9578710311689481 and parameters: {'lsvc_pcs_kernel_gamma': 0.0044943686738350384, 'lsvc_pcs_kernel_n_components': 100, 'lsvc_pcs_degree': 2, 'lsvc_pcs_dual': False, 'lsvc_pcs_C': 0.00546372437843517, 'lsvc_pcs_max_iter': 2000}. Best is trial 4 with value: 0.987643.[0m
[32m[I 2022-10-20 10:32:48,711][0m Trial 61 finished with value: 0.9802101496036189 and parameters: {'lsvc_pcs_kernel_gamma': 0.5366812008204617, 'lsvc_pcs_kernel_n_components': 100, 'lsvc_pcs_degree': 2, 'lsvc_pcs_dual': False, 'lsvc_pcs_C': 38.89628438055754, 'lsvc_pcs_max_iter': 2000}. Best is trial 4 with value: 0.987643.[0m
