[32m[I 2022-10-20 10:35:02,096][0m Trial 62 finished with value: 0.9736561644855312 and parameters: {'lsvc_pcs_kernel_gamma': 0.023548472936881015, 'lsvc_pcs_kernel_n_components': 100, 'lsvc_pcs_degree': 2, 'lsvc_pcs_dual': False, 'lsvc_pcs_C': 542.2788750841062, 'lsvc_pcs_max_iter': 2000}. Best is trial 4 with value: 0.987643.[0m
[32m[I 2022-10-20 10:37:36,244][0m Trial 63 finished with value: 0.9238708591853495 and parameters: {'lsvc_pcs_kernel_gamma': 0.1744048059457993, 'lsvc_pcs_kernel_n_components': 100, 'lsvc_pcs_degree': 2, 'lsvc_pcs_dual': False, 'lsvc_pcs_C': 103.76079034770191, 'lsvc_pcs_max_iter': 2000}. Best is trial 4 with value: 0.987643.[0m
[32m[I 2022-10-20 10:39:17,187][0m Trial 64 finished with value: 0.9529685850992482 and parameters: {'lsvc_pcs_kernel_gamma': 1.3898145181330264, 'lsvc_pcs_kernel_n_components': 100, 'lsvc_pcs_degree': 2, 'lsvc_pcs_dual': False, 'lsvc_pcs_C': 979.2120199783739, 'lsvc_pcs_max_iter': 2000}. Best is trial 4 with value: 0.987643.[0m
[32m[I 2022-10-20 10:40:57,695][0m Trial 65 finished with value: 0.9720431883257293 and parameters: {'lsvc_pcs_kernel_gamma': 5.120367309252832, 'lsvc_pcs_kernel_n_components': 100, 'lsvc_pcs_degree': 2, 'lsvc_pcs_dual': False, 'lsvc_pcs_C': 214.90281234506978, 'lsvc_pcs_max_iter': 2000}. Best is trial 4 with value: 0.987643.[0m
[32m[I 2022-10-20 10:43:02,674][0m Trial 66 finished with value: 0.9542168822019489 and parameters: {'lsvc_pcs_kernel_gamma': 0.04664485850868912, 'lsvc_pcs_kernel_n_components': 100, 'lsvc_pcs_degree': 2, 'lsvc_pcs_dual': False, 'lsvc_pcs_C': 23.18923261259329, 'lsvc_pcs_max_iter': 2000}. Best is trial 4 with value: 0.987643.[0m
[32m[I 2022-10-20 10:45:31,840][0m Trial 67 finished with value: 0.9222311570137132 and parameters: {'lsvc_pcs_kernel_gamma': 29.130859898076068, 'lsvc_pcs_kernel_n_components': 100, 'lsvc_pcs_degree': 2, 'lsvc_pcs_dual': False, 'lsvc_pcs_C': 0.00018346997664430643, 'lsvc_pcs_max_iter': 2000}. Best is trial 4 with value: 0.987643.[0m
[32m[I 2022-10-20 10:47:18,553][0m Trial 68 finished with value: 0.9193979070666329 and parameters: {'lsvc_pcs_kernel_gamma': 0.12644154192069001, 'lsvc_pcs_kernel_n_components': 50, 'lsvc_pcs_degree': 2, 'lsvc_pcs_dual': False, 'lsvc_pcs_C': 71.22281566444312, 'lsvc_pcs_max_iter': 2000}. Best is trial 4 with value: 0.987643.[0m
[32m[I 2022-10-20 10:49:10,623][0m Trial 69 finished with value: 0.9543573020450419 and parameters: {'lsvc_pcs_kernel_gamma': 10.667726499891373, 'lsvc_pcs_kernel_n_components': 100, 'lsvc_pcs_degree': 2, 'lsvc_pcs_dual': False, 'lsvc_pcs_C': 5.203693396129836, 'lsvc_pcs_max_iter': 2000}. Best is trial 4 with value: 0.987643.[0m
[32m[I 2022-10-20 10:51:26,195][0m Trial 70 finished with value: 0.936999208714865 and parameters: {'lsvc_pcs_kernel_gamma': 0.013775780499883355, 'lsvc_pcs_kernel_n_components': 100, 'lsvc_pcs_degree': 2, 'lsvc_pcs_dual': False, 'lsvc_pcs_C': 13.511705561473521, 'lsvc_pcs_max_iter': 2000}. Best is trial 4 with value: 0.987643.[0m
[32m[I 2022-10-20 10:54:35,319][0m Trial 71 finished with value: 0.9308167592756081 and parameters: {'lsvc_pcs_kernel_gamma': 945.5152402203296, 'lsvc_pcs_kernel_n_components': 100, 'lsvc_pcs_degree': 2, 'lsvc_pcs_dual': False, 'lsvc_pcs_C': 192.25880474010933, 'lsvc_pcs_max_iter': 2000}. Best is trial 4 with value: 0.987643.[0m
[32m[I 2022-10-20 10:56:58,575][0m Trial 72 finished with value: 0.9474674046572255 and parameters: {'lsvc_pcs_kernel_gamma': 154.70249506227978, 'lsvc_pcs_kernel_n_components': 100, 'lsvc_pcs_degree': 2, 'lsvc_pcs_dual': False, 'lsvc_pcs_C': 34.033668587298074, 'lsvc_pcs_max_iter': 2000}. Best is trial 4 with value: 0.987643.[0m
[32m[I 2022-10-20 10:59:04,947][0m Trial 73 finished with value: 0.9228200728400984 and parameters: {'lsvc_pcs_kernel_gamma': 3.414909270728059, 'lsvc_pcs_kernel_n_components': 100, 'lsvc_pcs_degree': 2, 'lsvc_pcs_dual': False, 'lsvc_pcs_C': 418.18055066349893, 'lsvc_pcs_max_iter': 2000}. Best is trial 4 with value: 0.987643.[0m
[32m[I 2022-10-20 11:01:20,311][0m Trial 74 finished with value: 0.9387298167067004 and parameters: {'lsvc_pcs_kernel_gamma': 547.607231875692, 'lsvc_pcs_kernel_n_components': 100, 'lsvc_pcs_degree': 2, 'lsvc_pcs_dual': False, 'lsvc_pcs_C': 99.6996433913435, 'lsvc_pcs_max_iter': 2000}. Best is trial 4 with value: 0.987643.[0m
[32m[I 2022-10-20 11:03:32,764][0m Trial 75 finished with value: 0.935651658762334 and parameters: {'lsvc_pcs_kernel_gamma': 87.11140520117898, 'lsvc_pcs_kernel_n_components': 100, 'lsvc_pcs_degree': 2, 'lsvc_pcs_dual': False, 'lsvc_pcs_C': 1.1144062557902834, 'lsvc_pcs_max_iter': 2000}. Best is trial 4 with value: 0.987643.[0m
[32m[I 2022-10-20 11:07:31,965][0m Trial 76 finished with value: 0.9320766596621362 and parameters: {'lsvc_pcs_kernel_gamma': 191.5505619787431, 'lsvc_pcs_kernel_n_components': 150, 'lsvc_pcs_degree': 2, 'lsvc_pcs_dual': False, 'lsvc_pcs_C': 10.002826084571206, 'lsvc_pcs_max_iter': 2000}. Best is trial 4 with value: 0.987643.[0m
[32m[I 2022-10-20 11:10:08,919][0m Trial 77 finished with value: 0.9634460668854615 and parameters: {'lsvc_pcs_kernel_gamma': 292.3775577261729, 'lsvc_pcs_kernel_n_components': 100, 'lsvc_pcs_degree': 2, 'lsvc_pcs_dual': False, 'lsvc_pcs_C': 0.04042595261753759, 'lsvc_pcs_max_iter': 2000}. Best is trial 4 with value: 0.987643.[0m
[32m[I 2022-10-20 11:12:33,546][0m Trial 78 finished with value: 0.9676701050768973 and parameters: {'lsvc_pcs_kernel_gamma': 616.4022563619238, 'lsvc_pcs_kernel_n_components': 100, 'lsvc_pcs_degree': 2, 'lsvc_pcs_dual': False, 'lsvc_pcs_C': 51.86453350743489, 'lsvc_pcs_max_iter': 2000}. Best is trial 4 with value: 0.987643.[0m
[32m[I 2022-10-20 11:15:11,530][0m Trial 79 finished with value: 0.933089784393394 and parameters: {'lsvc_pcs_kernel_gamma': 120.41700172431092, 'lsvc_pcs_kernel_n_components': 100, 'lsvc_pcs_degree': 2, 'lsvc_pcs_dual': False, 'lsvc_pcs_C': 0.0018819223183576587, 'lsvc_pcs_max_iter': 2000}. Best is trial 4 with value: 0.987643.[0m
[32m[I 2022-10-20 11:17:07,724][0m Trial 80 finished with value: 0.9194472246650867 and parameters: {'lsvc_pcs_kernel_gamma': 382.0905549603953, 'lsvc_pcs_kernel_n_components': 100, 'lsvc_pcs_degree': 2, 'lsvc_pcs_dual': False, 'lsvc_pcs_C': 595.2989157813256, 'lsvc_pcs_max_iter': 2000}. Best is trial 4 with value: 0.987643.[0m
[32m[I 2022-10-20 11:20:19,891][0m Trial 81 finished with value: 0.9186134183084083 and parameters: {'lsvc_pcs_kernel_gamma': 782.2586896405803, 'lsvc_pcs_kernel_n_components': 100, 'lsvc_pcs_degree': 2, 'lsvc_pcs_dual': False, 'lsvc_pcs_C': 3.476254173194759, 'lsvc_pcs_max_iter': 2000}. Best is trial 4 with value: 0.987643.[0m
[32m[I 2022-10-20 11:22:57,866][0m Trial 82 finished with value: 0.9418153914204223 and parameters: {'lsvc_pcs_kernel_gamma': 0.49243747168136287, 'lsvc_pcs_kernel_n_components': 100, 'lsvc_pcs_degree': 2, 'lsvc_pcs_dual': False, 'lsvc_pcs_C': 21.874499563001795, 'lsvc_pcs_max_iter': 2000}. Best is trial 4 with value: 0.987643.[0m
[32m[I 2022-10-20 11:24:52,622][0m Trial 83 finished with value: 0.9707932269464168 and parameters: {'lsvc_pcs_kernel_gamma': 354.4591172159802, 'lsvc_pcs_kernel_n_components': 100, 'lsvc_pcs_degree': 2, 'lsvc_pcs_dual': False, 'lsvc_pcs_C': 6.6487002257630605, 'lsvc_pcs_max_iter': 2000}. Best is trial 4 with value: 0.987643.[0m
[32m[I 2022-10-20 11:27:38,399][0m Trial 84 finished with value: 0.9698645594547908 and parameters: {'lsvc_pcs_kernel_gamma': 39.75318580005695, 'lsvc_pcs_kernel_n_components': 100, 'lsvc_pcs_degree': 2, 'lsvc_pcs_dual': False, 'lsvc_pcs_C': 13.237456688930399, 'lsvc_pcs_max_iter': 2000}. Best is trial 4 with value: 0.987643.[0m
[32m[I 2022-10-20 11:30:05,652][0m Trial 85 finished with value: 0.9380569776016568 and parameters: {'lsvc_pcs_kernel_gamma': 0.27976197843657463, 'lsvc_pcs_kernel_n_components': 100, 'lsvc_pcs_degree': 2, 'lsvc_pcs_dual': False, 'lsvc_pcs_C': 255.60775156711662, 'lsvc_pcs_max_iter': 2000}. Best is trial 4 with value: 0.987643.[0m
[32m[I 2022-10-20 11:32:41,675][0m Trial 86 finished with value: 0.9590472716952313 and parameters: {'lsvc_pcs_kernel_gamma': 197.9456286588666, 'lsvc_pcs_kernel_n_components': 100, 'lsvc_pcs_degree': 2, 'lsvc_pcs_dual': False, 'lsvc_pcs_C': 159.21728711122626, 'lsvc_pcs_max_iter': 2000}. Best is trial 4 with value: 0.987643.[0m
[32m[I 2022-10-20 11:34:08,485][0m Trial 87 finished with value: 0.9203923772444239 and parameters: {'lsvc_pcs_kernel_gamma': 7.75738707189819, 'lsvc_pcs_kernel_n_components': 50, 'lsvc_pcs_degree': 2, 'lsvc_pcs_dual': False, 'lsvc_pcs_C': 38.43731604169756, 'lsvc_pcs_max_iter': 2000}. Best is trial 4 with value: 0.987643.[0m
[32m[I 2022-10-20 11:36:58,411][0m Trial 88 finished with value: 0.9546031590701008 and parameters: {'lsvc_pcs_kernel_gamma': 0.03329659944416473, 'lsvc_pcs_kernel_n_components': 100, 'lsvc_pcs_degree': 2, 'lsvc_pcs_dual': False, 'lsvc_pcs_C': 1.623944697606281, 'lsvc_pcs_max_iter': 2000}. Best is trial 4 with value: 0.987643.[0m
[32m[I 2022-10-20 11:39:38,965][0m Trial 89 finished with value: 0.9419694886465358 and parameters: {'lsvc_pcs_kernel_gamma': 988.4592258177637, 'lsvc_pcs_kernel_n_components': 100, 'lsvc_pcs_degree': 2, 'lsvc_pcs_dual': False, 'lsvc_pcs_C': 61.971898898833665, 'lsvc_pcs_max_iter': 2000}. Best is trial 4 with value: 0.987643.[0m
[32m[I 2022-10-20 11:41:54,081][0m Trial 90 finished with value: 0.9304960202802038 and parameters: {'lsvc_pcs_kernel_gamma': 0.08395393466908929, 'lsvc_pcs_kernel_n_components': 100, 'lsvc_pcs_degree': 2, 'lsvc_pcs_dual': False, 'lsvc_pcs_C': 0.06736482110818946, 'lsvc_pcs_max_iter': 2000}. Best is trial 4 with value: 0.987643.[0m
[32m[I 2022-10-20 11:44:39,902][0m Trial 91 finished with value: 0.921709720378078 and parameters: {'lsvc_pcs_kernel_gamma': 0.6440734761251777, 'lsvc_pcs_kernel_n_components': 100, 'lsvc_pcs_degree': 2, 'lsvc_pcs_dual': False, 'lsvc_pcs_C': 35.17727291642331, 'lsvc_pcs_max_iter': 2000}. Best is trial 4 with value: 0.987643.[0m
[32m[I 2022-10-20 11:46:51,761][0m Trial 92 finished with value: 0.9787520791338812 and parameters: {'lsvc_pcs_kernel_gamma': 2.078763461301073, 'lsvc_pcs_kernel_n_components': 100, 'lsvc_pcs_degree': 2, 'lsvc_pcs_dual': False, 'lsvc_pcs_C': 89.80965965440419, 'lsvc_pcs_max_iter': 2000}. Best is trial 4 with value: 0.987643.[0m
[32m[I 2022-10-20 11:49:28,361][0m Trial 93 finished with value: 0.9286984465349479 and parameters: {'lsvc_pcs_kernel_gamma': 1.0422972155633503, 'lsvc_pcs_kernel_n_components': 100, 'lsvc_pcs_degree': 2, 'lsvc_pcs_dual': False, 'lsvc_pcs_C': 351.81746246650226, 'lsvc_pcs_max_iter': 2000}. Best is trial 4 with value: 0.987643.[0m
[32m[I 2022-10-20 11:51:44,298][0m Trial 94 finished with value: 0.9776576955331341 and parameters: {'lsvc_pcs_kernel_gamma': 19.31871848645677, 'lsvc_pcs_kernel_n_components': 100, 'lsvc_pcs_degree': 2, 'lsvc_pcs_dual': False, 'lsvc_pcs_C': 0.023409237390085748, 'lsvc_pcs_max_iter': 2000}. Best is trial 4 with value: 0.987643.[0m
[32m[I 2022-10-20 11:53:39,359][0m Trial 95 finished with value: 0.9268682016782491 and parameters: {'lsvc_pcs_kernel_gamma': 519.0783910649617, 'lsvc_pcs_kernel_n_components': 100, 'lsvc_pcs_degree': 2, 'lsvc_pcs_dual': False, 'lsvc_pcs_C': 17.970148380695598, 'lsvc_pcs_max_iter': 2000}. Best is trial 4 with value: 0.987643.[0m
[32m[I 2022-10-20 11:55:57,912][0m Trial 96 finished with value: 0.9379559691838514 and parameters: {'lsvc_pcs_kernel_gamma': 0.1783425148285668, 'lsvc_pcs_kernel_n_components': 100, 'lsvc_pcs_degree': 2, 'lsvc_pcs_dual': False, 'lsvc_pcs_C': 123.82984380505668, 'lsvc_pcs_max_iter': 2000}. Best is trial 4 with value: 0.987643.[0m
[32m[I 2022-10-20 11:58:39,320][0m Trial 97 finished with value: 0.9493357624154957 and parameters: {'lsvc_pcs_kernel_gamma': 0.009813578735712524, 'lsvc_pcs_kernel_n_components': 100, 'lsvc_pcs_degree': 2, 'lsvc_pcs_dual': False, 'lsvc_pcs_C': 0.43454083093337875, 'lsvc_pcs_max_iter': 2000}. Best is trial 4 with value: 0.987643.[0m
[32m[I 2022-10-20 12:01:44,129][0m Trial 98 finished with value: 0.9406829871393942 and parameters: {'lsvc_pcs_kernel_gamma': 0.040218933306174424, 'lsvc_pcs_kernel_n_components': 100, 'lsvc_pcs_degree': 2, 'lsvc_pcs_dual': False, 'lsvc_pcs_C': 634.8648924654279, 'lsvc_pcs_max_iter': 2000}. Best is trial 4 with value: 0.987643.[0m
[32m[I 2022-10-20 12:03:08,684][0m Trial 99 finished with value: 0.9751932776393136 and parameters: {'lsvc_pcs_kernel_gamma': 235.11664694399406, 'lsvc_pcs_kernel_n_components': 50, 'lsvc_pcs_degree': 2, 'lsvc_pcs_dual': False, 'lsvc_pcs_C': 8.55227705422957, 'lsvc_pcs_max_iter': 2000}. Best is trial 4 with value: 0.987643.[0m
[32m[I 2022-10-20 12:03:08,746][0m Study finished.[0m
[32m[I 2022-10-20 12:03:08,856][0m --------------------------------------------------------------------------------[0m
[32m[I 2022-10-20 12:03:08,856][0m --------------------          LinearSVC_RBFSampler          --------------------[0m
[32m[I 2022-10-20 12:03:08,856][0m --------------------------------------------------------------------------------[0m
[32m[I 2022-10-20 12:03:08,966][0m A new study created in RDB with name: LinearSVC_RBFSampler_b4f53b70[0m
[32m[I 2022-10-20 12:03:08,981][0m Study started.[0m
[32m[I 2022-10-20 12:03:22,106][0m Trial 0 finished with value: 0.2844441188051378 and parameters: {'lsvc_rbfs_kernel_gamma': 191.5655577783354, 'lsvc_rbfs_kernel_n_components': 150, 'lsvc_rbfs_dual': False, 'lsvc_rbfs_C': 0.031545405901288084, 'lsvc_rbfs_max_iter': 2000}. Best is trial 0 with value: 0.284444.[0m
[32m[I 2022-10-20 12:03:31,733][0m Trial 1 finished with value: 0.2844441188051378 and parameters: {'lsvc_rbfs_kernel_gamma': 0.5804639179355113, 'lsvc_rbfs_kernel_n_components': 100, 'lsvc_rbfs_dual': False, 'lsvc_rbfs_C': 5.236861764173174e-05, 'lsvc_rbfs_max_iter': 2000}. Best is trial 0 with value: 0.284444.[0m
[32m[I 2022-10-20 12:03:40,628][0m Trial 2 finished with value: 0.2844441188051378 and parameters: {'lsvc_rbfs_kernel_gamma': 370.86435021580996, 'lsvc_rbfs_kernel_n_components': 100, 'lsvc_rbfs_dual': False, 'lsvc_rbfs_C': 2.1392186369318766, 'lsvc_rbfs_max_iter': 2000}. Best is trial 0 with value: 0.284444.[0m
[32m[I 2022-10-20 12:03:49,928][0m Trial 3 finished with value: 0.2844441188051378 and parameters: {'lsvc_rbfs_kernel_gamma': 0.23846318068137545, 'lsvc_rbfs_kernel_n_components': 150, 'lsvc_rbfs_dual': False, 'lsvc_rbfs_C': 2.476515389185499e-06, 'lsvc_rbfs_max_iter': 2000}. Best is trial 0 with value: 0.284444.[0m
[32m[I 2022-10-20 12:03:57,132][0m Trial 4 finished with value: 0.2844441188051378 and parameters: {'lsvc_rbfs_kernel_gamma': 0.015654255986716374, 'lsvc_rbfs_kernel_n_components': 50, 'lsvc_rbfs_dual': False, 'lsvc_rbfs_C': 3.439876606670641, 'lsvc_rbfs_max_iter': 2000}. Best is trial 0 with value: 0.284444.[0m
[32m[I 2022-10-20 12:04:03,037][0m Trial 5 finished with value: 0.2844441188051378 and parameters: {'lsvc_rbfs_kernel_gamma': 682.0407167004518, 'lsvc_rbfs_kernel_n_components': 50, 'lsvc_rbfs_dual': False, 'lsvc_rbfs_C': 1.990125739622691, 'lsvc_rbfs_max_iter': 2000}. Best is trial 0 with value: 0.284444.[0m
[32m[I 2022-10-20 12:04:08,948][0m Trial 6 finished with value: 0.2844441188051378 and parameters: {'lsvc_rbfs_kernel_gamma': 140.70209250689913, 'lsvc_rbfs_kernel_n_components': 50, 'lsvc_rbfs_dual': False, 'lsvc_rbfs_C': 0.3366507150772913, 'lsvc_rbfs_max_iter': 2000}. Best is trial 0 with value: 0.284444.[0m
[32m[I 2022-10-20 12:04:18,344][0m Trial 7 finished with value: 0.2844441188051378 and parameters: {'lsvc_rbfs_kernel_gamma': 0.13111289084862718, 'lsvc_rbfs_kernel_n_components': 100, 'lsvc_rbfs_dual': False, 'lsvc_rbfs_C': 1.1556338503307073, 'lsvc_rbfs_max_iter': 2000}. Best is trial 0 with value: 0.284444.[0m
[32m[I 2022-10-20 12:04:24,413][0m Trial 8 finished with value: 0.2844441188051378 and parameters: {'lsvc_rbfs_kernel_gamma': 2.9082166547401678, 'lsvc_rbfs_kernel_n_components': 50, 'lsvc_rbfs_dual': False, 'lsvc_rbfs_C': 0.1429815892081916, 'lsvc_rbfs_max_iter': 2000}. Best is trial 0 with value: 0.284444.[0m
[32m[I 2022-10-20 12:04:40,239][0m Trial 9 finished with value: 0.2844441188051378 and parameters: {'lsvc_rbfs_kernel_gamma': 0.06054940522104032, 'lsvc_rbfs_kernel_n_components': 150, 'lsvc_rbfs_dual': False, 'lsvc_rbfs_C': 846.2450720834426, 'lsvc_rbfs_max_iter': 2000}. Best is trial 0 with value: 0.284444.[0m
[32m[I 2022-10-20 12:04:51,792][0m Trial 10 finished with value: 0.2844441188051378 and parameters: {'lsvc_rbfs_kernel_gamma': 17.76271517093313, 'lsvc_rbfs_kernel_n_components': 150, 'lsvc_rbfs_dual': False, 'lsvc_rbfs_C': 0.0025053343311493208, 'lsvc_rbfs_max_iter': 2000}. Best is trial 0 with value: 0.284444.[0m
[32m[I 2022-10-20 12:05:06,530][0m Trial 11 finished with value: 0.2844441188051378 and parameters: {'lsvc_rbfs_kernel_gamma': 0.001025306892774909, 'lsvc_rbfs_kernel_n_components': 100, 'lsvc_rbfs_dual': False, 'lsvc_rbfs_C': 0.00030537358366663873, 'lsvc_rbfs_max_iter': 2000}. Best is trial 0 with value: 0.284444.[0m
[32m[I 2022-10-20 12:05:16,902][0m Trial 12 finished with value: 0.2844441188051378 and parameters: {'lsvc_rbfs_kernel_gamma': 6.960083854033519, 'lsvc_rbfs_kernel_n_components': 150, 'lsvc_rbfs_dual': False, 'lsvc_rbfs_C': 9.396291003032326e-06, 'lsvc_rbfs_max_iter': 2000}. Best is trial 0 with value: 0.284444.[0m
[32m[I 2022-10-20 12:05:26,685][0m Trial 13 finished with value: 0.2844441188051378 and parameters: {'lsvc_rbfs_kernel_gamma': 58.197523832547056, 'lsvc_rbfs_kernel_n_components': 100, 'lsvc_rbfs_dual': False, 'lsvc_rbfs_C': 0.0005232231851124739, 'lsvc_rbfs_max_iter': 2000}. Best is trial 0 with value: 0.284444.[0m
[32m[I 2022-10-20 12:05:36,361][0m Trial 14 finished with value: 0.2844441188051378 and parameters: {'lsvc_rbfs_kernel_gamma': 0.5181174932535072, 'lsvc_rbfs_kernel_n_components': 100, 'lsvc_rbfs_dual': False, 'lsvc_rbfs_C': 0.008517577244601397, 'lsvc_rbfs_max_iter': 2000}. Best is trial 0 with value: 0.284444.[0m
[32m[I 2022-10-20 12:05:47,479][0m Trial 15 finished with value: 0.2844441188051378 and parameters: {'lsvc_rbfs_kernel_gamma': 1.9290474936865085, 'lsvc_rbfs_kernel_n_components': 150, 'lsvc_rbfs_dual': False, 'lsvc_rbfs_C': 2.325020552436345e-05, 'lsvc_rbfs_max_iter': 2000}. Best is trial 0 with value: 0.284444.[0m
[32m[I 2022-10-20 12:05:56,656][0m Trial 16 finished with value: 0.2844441188051378 and parameters: {'lsvc_rbfs_kernel_gamma': 27.963724801477234, 'lsvc_rbfs_kernel_n_components': 100, 'lsvc_rbfs_dual': False, 'lsvc_rbfs_C': 0.0001928933151813884, 'lsvc_rbfs_max_iter': 2000}. Best is trial 0 with value: 0.284444.[0m
[32m[I 2022-10-20 12:06:13,921][0m Trial 17 finished with value: 0.2844441188051378 and parameters: {'lsvc_rbfs_kernel_gamma': 0.010625610940439524, 'lsvc_rbfs_kernel_n_components': 150, 'lsvc_rbfs_dual': False, 'lsvc_rbfs_C': 0.01587712886892492, 'lsvc_rbfs_max_iter': 2000}. Best is trial 0 with value: 0.284444.[0m
[32m[I 2022-10-20 12:06:26,687][0m Trial 18 finished with value: 0.2844441188051378 and parameters: {'lsvc_rbfs_kernel_gamma': 4.693204434125355, 'lsvc_rbfs_kernel_n_components': 150, 'lsvc_rbfs_dual': False, 'lsvc_rbfs_C': 106.38912851033415, 'lsvc_rbfs_max_iter': 2000}. Best is trial 0 with value: 0.284444.[0m
[32m[I 2022-10-20 12:06:35,959][0m Trial 19 finished with value: 0.2844441188051378 and parameters: {'lsvc_rbfs_kernel_gamma': 45.97545152813659, 'lsvc_rbfs_kernel_n_components': 100, 'lsvc_rbfs_dual': False, 'lsvc_rbfs_C': 0.0005581248575760711, 'lsvc_rbfs_max_iter': 2000}. Best is trial 0 with value: 0.284444.[0m
[32m[I 2022-10-20 12:06:57,027][0m Trial 20 finished with value: 0.2844441188051378 and parameters: {'lsvc_rbfs_kernel_gamma': 0.004372796974779256, 'lsvc_rbfs_kernel_n_components': 150, 'lsvc_rbfs_dual': False, 'lsvc_rbfs_C': 0.042711761408076726, 'lsvc_rbfs_max_iter': 2000}. Best is trial 0 with value: 0.284444.[0m
[32m[I 2022-10-20 12:07:13,901][0m Trial 21 finished with value: 0.2844441188051378 and parameters: {'lsvc_rbfs_kernel_gamma': 0.03847200909700526, 'lsvc_rbfs_kernel_n_components': 150, 'lsvc_rbfs_dual': False, 'lsvc_rbfs_C': 81.43385829491392, 'lsvc_rbfs_max_iter': 2000}. Best is trial 0 with value: 0.284444.[0m
[32m[I 2022-10-20 12:07:23,427][0m Trial 22 finished with value: 0.2844441188051378 and parameters: {'lsvc_rbfs_kernel_gamma': 228.3363209120304, 'lsvc_rbfs_kernel_n_components': 100, 'lsvc_rbfs_dual': False, 'lsvc_rbfs_C': 64.58317491217116, 'lsvc_rbfs_max_iter': 2000}. Best is trial 0 with value: 0.284444.[0m
[32m[I 2022-10-20 12:07:44,513][0m Trial 23 finished with value: 0.2844441188051378 and parameters: {'lsvc_rbfs_kernel_gamma': 0.001398754443486246, 'lsvc_rbfs_kernel_n_components': 150, 'lsvc_rbfs_dual': False, 'lsvc_rbfs_C': 0.002225566020226795, 'lsvc_rbfs_max_iter': 2000}. Best is trial 0 with value: 0.284444.[0m
[32m[I 2022-10-20 12:08:04,300][0m Trial 24 finished with value: 0.2844441188051378 and parameters: {'lsvc_rbfs_kernel_gamma': 0.00619353719534469, 'lsvc_rbfs_kernel_n_components': 150, 'lsvc_rbfs_dual': False, 'lsvc_rbfs_C': 0.09673108181755628, 'lsvc_rbfs_max_iter': 2000}. Best is trial 0 with value: 0.284444.[0m
[32m[I 2022-10-20 12:08:13,168][0m Trial 25 finished with value: 0.2844441188051378 and parameters: {'lsvc_rbfs_kernel_gamma': 141.9080865858614, 'lsvc_rbfs_kernel_n_components': 100, 'lsvc_rbfs_dual': False, 'lsvc_rbfs_C': 22.233213815308027, 'lsvc_rbfs_max_iter': 2000}. Best is trial 0 with value: 0.284444.[0m
[32m[I 2022-10-20 12:08:24,719][0m Trial 26 finished with value: 0.2844441188051378 and parameters: {'lsvc_rbfs_kernel_gamma': 156.48851961160508, 'lsvc_rbfs_kernel_n_components': 150, 'lsvc_rbfs_dual': False, 'lsvc_rbfs_C': 0.0036734842854331995, 'lsvc_rbfs_max_iter': 2000}. Best is trial 0 with value: 0.284444.[0m
