[32m[I 2022-10-20 01:59:06,074][0m Trial 67 finished with value: 0.9914435142730156 and parameters: {'brf_n_estimators': 90, 'brf_criterion': 'gini', 'brf_min_samples_split': 45, 'brf_min_samples_leaf': 4, 'brf_max_features': 41, 'brf_bootstrap': True}. Best is trial 41 with value: 0.991808.[0m
[32m[I 2022-10-20 01:59:06,971][0m Trial 62 finished with value: 0.9917248795279291 and parameters: {'brf_n_estimators': 150, 'brf_criterion': 'entropy', 'brf_min_samples_split': 26, 'brf_min_samples_leaf': 4, 'brf_max_features': 27, 'brf_bootstrap': False}. Best is trial 41 with value: 0.991808.[0m
[32m[I 2022-10-20 01:59:11,009][0m sklearn.ensemble.RandomForestClassifier.predict: fallback to original Scikit-learn[0m
[32m[I 2022-10-20 01:59:11,009][0m sklearn.ensemble.RandomForestClassifier.predict_proba: fallback to original Scikit-learn[0m
[32m[I 2022-10-20 01:59:11,040][0m sklearn.ensemble.RandomForestClassifier.predict: fallback to original Scikit-learn[0m
[32m[I 2022-10-20 01:59:11,056][0m sklearn.ensemble.RandomForestClassifier.predict_proba: fallback to original Scikit-learn[0m
[32m[I 2022-10-20 01:59:12,122][0m sklearn.ensemble.RandomForestClassifier.predict: fallback to original Scikit-learn[0m
[32m[I 2022-10-20 01:59:12,138][0m sklearn.ensemble.RandomForestClassifier.predict_proba: fallback to original Scikit-learn[0m
[32m[I 2022-10-20 01:59:14,340][0m Trial 70 finished with value: 0.9917630189189186 and parameters: {'brf_n_estimators': 70, 'brf_criterion': 'gini', 'brf_min_samples_split': 37, 'brf_min_samples_leaf': 4, 'brf_max_features': 39, 'brf_bootstrap': False}. Best is trial 41 with value: 0.991808.[0m
[32m[I 2022-10-20 01:59:15,154][0m Trial 69 finished with value: 0.9915129778143943 and parameters: {'brf_n_estimators': 90, 'brf_criterion': 'gini', 'brf_min_samples_split': 42, 'brf_min_samples_leaf': 7, 'brf_max_features': 42, 'brf_bootstrap': True}. Best is trial 41 with value: 0.991808.[0m
[32m[I 2022-10-20 01:59:15,530][0m sklearn.ensemble.RandomForestClassifier.predict: fallback to original Scikit-learn[0m
[32m[I 2022-10-20 01:59:15,546][0m sklearn.ensemble.RandomForestClassifier.predict_proba: fallback to original Scikit-learn[0m
[32m[I 2022-10-20 01:59:17,157][0m Trial 66 finished with value: 0.991611616642542 and parameters: {'brf_n_estimators': 120, 'brf_criterion': 'gini', 'brf_min_samples_split': 26, 'brf_min_samples_leaf': 3, 'brf_max_features': 32, 'brf_bootstrap': True}. Best is trial 41 with value: 0.991808.[0m
[32m[I 2022-10-20 01:59:18,592][0m sklearn.ensemble.RandomForestClassifier.predict: fallback to original Scikit-learn[0m
[32m[I 2022-10-20 01:59:18,592][0m sklearn.ensemble.RandomForestClassifier.predict_proba: fallback to original Scikit-learn[0m
[32m[I 2022-10-20 01:59:19,141][0m Trial 71 finished with value: 0.991603989558654 and parameters: {'brf_n_estimators': 60, 'brf_criterion': 'gini', 'brf_min_samples_split': 39, 'brf_min_samples_leaf': 7, 'brf_max_features': 40, 'brf_bootstrap': False}. Best is trial 41 with value: 0.991808.[0m
[32m[I 2022-10-20 01:59:22,293][0m Trial 72 finished with value: 0.9915579209372499 and parameters: {'brf_n_estimators': 60, 'brf_criterion': 'gini', 'brf_min_samples_split': 29, 'brf_min_samples_leaf': 7, 'brf_max_features': 31, 'brf_bootstrap': False}. Best is trial 41 with value: 0.991808.[0m
[32m[I 2022-10-20 01:59:26,527][0m sklearn.ensemble.RandomForestClassifier.predict: fallback to original Scikit-learn[0m
[32m[I 2022-10-20 01:59:26,527][0m sklearn.ensemble.RandomForestClassifier.predict_proba: fallback to original Scikit-learn[0m
[32m[I 2022-10-20 01:59:30,215][0m Trial 73 finished with value: 0.9916564100842312 and parameters: {'brf_n_estimators': 70, 'brf_criterion': 'gini', 'brf_min_samples_split': 29, 'brf_min_samples_leaf': 7, 'brf_max_features': 31, 'brf_bootstrap': False}. Best is trial 41 with value: 0.991808.[0m
[32m[I 2022-10-20 01:59:30,887][0m sklearn.ensemble.RandomForestClassifier.predict: fallback to original Scikit-learn[0m
[32m[I 2022-10-20 01:59:30,887][0m sklearn.ensemble.RandomForestClassifier.predict_proba: fallback to original Scikit-learn[0m
[32m[I 2022-10-20 01:59:33,946][0m sklearn.ensemble.RandomForestClassifier.predict: fallback to original Scikit-learn[0m
[32m[I 2022-10-20 01:59:33,946][0m sklearn.ensemble.RandomForestClassifier.predict_proba: fallback to original Scikit-learn[0m
[32m[I 2022-10-20 01:59:34,337][0m Trial 75 finished with value: 0.9915429412070391 and parameters: {'brf_n_estimators': 60, 'brf_criterion': 'gini', 'brf_min_samples_split': 29, 'brf_min_samples_leaf': 7, 'brf_max_features': 25, 'brf_bootstrap': False}. Best is trial 41 with value: 0.991808.[0m
[32m[I 2022-10-20 01:59:37,945][0m Trial 74 finished with value: 0.9916266290727408 and parameters: {'brf_n_estimators': 70, 'brf_criterion': 'gini', 'brf_min_samples_split': 29, 'brf_min_samples_leaf': 7, 'brf_max_features': 25, 'brf_bootstrap': False}. Best is trial 41 with value: 0.991808.[0m
[32m[I 2022-10-20 01:59:40,779][0m sklearn.ensemble.RandomForestClassifier.predict: fallback to original Scikit-learn[0m
[32m[I 2022-10-20 01:59:40,779][0m sklearn.ensemble.RandomForestClassifier.predict_proba: fallback to original Scikit-learn[0m
[32m[I 2022-10-20 01:59:44,380][0m Trial 77 finished with value: 0.9918140640577487 and parameters: {'brf_n_estimators': 60, 'brf_criterion': 'gini', 'brf_min_samples_split': 19, 'brf_min_samples_leaf': 1, 'brf_max_features': 38, 'brf_bootstrap': False}. Best is trial 77 with value: 0.991814.[0m
[32m[I 2022-10-20 01:59:44,646][0m sklearn.ensemble.RandomForestClassifier.predict: fallback to original Scikit-learn[0m
[32m[I 2022-10-20 01:59:44,677][0m sklearn.ensemble.RandomForestClassifier.predict_proba: fallback to original Scikit-learn[0m
[32m[I 2022-10-20 01:59:47,200][0m sklearn.ensemble.RandomForestClassifier.predict: fallback to original Scikit-learn[0m
[32m[I 2022-10-20 01:59:47,216][0m sklearn.ensemble.RandomForestClassifier.predict_proba: fallback to original Scikit-learn[0m
[32m[I 2022-10-20 01:59:48,391][0m Trial 76 finished with value: 0.9918760214118723 and parameters: {'brf_n_estimators': 70, 'brf_criterion': 'gini', 'brf_min_samples_split': 19, 'brf_min_samples_leaf': 7, 'brf_max_features': 39, 'brf_bootstrap': False}. Best is trial 76 with value: 0.991876.[0m
[32m[I 2022-10-20 01:59:49,550][0m sklearn.ensemble.RandomForestClassifier.predict: fallback to original Scikit-learn[0m
[32m[I 2022-10-20 01:59:49,550][0m sklearn.ensemble.RandomForestClassifier.predict_proba: fallback to original Scikit-learn[0m
[32m[I 2022-10-20 01:59:49,644][0m sklearn.ensemble.RandomForestClassifier.predict: fallback to original Scikit-learn[0m
[32m[I 2022-10-20 01:59:49,660][0m sklearn.ensemble.RandomForestClassifier.predict_proba: fallback to original Scikit-learn[0m
[32m[I 2022-10-20 01:59:50,709][0m Trial 78 finished with value: 0.991670527744256 and parameters: {'brf_n_estimators': 70, 'brf_criterion': 'gini', 'brf_min_samples_split': 28, 'brf_min_samples_leaf': 1, 'brf_max_features': 39, 'brf_bootstrap': False}. Best is trial 76 with value: 0.991876.[0m
[32m[I 2022-10-20 01:59:53,001][0m Trial 79 finished with value: 0.9916630121538855 and parameters: {'brf_n_estimators': 70, 'brf_criterion': 'gini', 'brf_min_samples_split': 29, 'brf_min_samples_leaf': 2, 'brf_max_features': 45, 'brf_bootstrap': False}. Best is trial 76 with value: 0.991876.[0m
[32m[I 2022-10-20 01:59:53,283][0m Trial 80 finished with value: 0.9916093980023969 and parameters: {'brf_n_estimators': 70, 'brf_criterion': 'gini', 'brf_min_samples_split': 34, 'brf_min_samples_leaf': 1, 'brf_max_features': 24, 'brf_bootstrap': False}. Best is trial 76 with value: 0.991876.[0m
[32m[I 2022-10-20 02:00:00,937][0m sklearn.ensemble.RandomForestClassifier.predict: fallback to original Scikit-learn[0m
[32m[I 2022-10-20 02:00:00,937][0m sklearn.ensemble.RandomForestClassifier.predict_proba: fallback to original Scikit-learn[0m
[32m[I 2022-10-20 02:00:02,961][0m sklearn.ensemble.RandomForestClassifier.predict: fallback to original Scikit-learn[0m
[32m[I 2022-10-20 02:00:02,961][0m sklearn.ensemble.RandomForestClassifier.predict_proba: fallback to original Scikit-learn[0m
[32m[I 2022-10-20 02:00:04,530][0m Trial 81 finished with value: 0.9918140329155583 and parameters: {'brf_n_estimators': 70, 'brf_criterion': 'gini', 'brf_min_samples_split': 20, 'brf_min_samples_leaf': 1, 'brf_max_features': 44, 'brf_bootstrap': False}. Best is trial 76 with value: 0.991876.[0m
[32m[I 2022-10-20 02:00:06,771][0m Trial 82 finished with value: 0.9915800972866201 and parameters: {'brf_n_estimators': 70, 'brf_criterion': 'gini', 'brf_min_samples_split': 36, 'brf_min_samples_leaf': 2, 'brf_max_features': 34, 'brf_bootstrap': False}. Best is trial 76 with value: 0.991876.[0m
[32m[I 2022-10-20 02:00:12,457][0m sklearn.ensemble.RandomForestClassifier.predict: fallback to original Scikit-learn[0m
[32m[I 2022-10-20 02:00:12,473][0m sklearn.ensemble.RandomForestClassifier.predict_proba: fallback to original Scikit-learn[0m
[32m[I 2022-10-20 02:00:16,671][0m Trial 83 finished with value: 0.9915953881887134 and parameters: {'brf_n_estimators': 80, 'brf_criterion': 'gini', 'brf_min_samples_split': 34, 'brf_min_samples_leaf': 1, 'brf_max_features': 44, 'brf_bootstrap': False}. Best is trial 76 with value: 0.991876.[0m
[32m[I 2022-10-20 02:00:17,156][0m sklearn.ensemble.RandomForestClassifier.predict: fallback to original Scikit-learn[0m
[32m[I 2022-10-20 02:00:17,187][0m sklearn.ensemble.RandomForestClassifier.predict_proba: fallback to original Scikit-learn[0m
[32m[I 2022-10-20 02:00:21,125][0m Trial 84 finished with value: 0.9917673966331396 and parameters: {'brf_n_estimators': 80, 'brf_criterion': 'entropy', 'brf_min_samples_split': 19, 'brf_min_samples_leaf': 1, 'brf_max_features': 36, 'brf_bootstrap': False}. Best is trial 76 with value: 0.991876.[0m
[32m[I 2022-10-20 02:00:21,501][0m sklearn.ensemble.RandomForestClassifier.predict: fallback to original Scikit-learn[0m
[32m[I 2022-10-20 02:00:21,501][0m sklearn.ensemble.RandomForestClassifier.predict_proba: fallback to original Scikit-learn[0m
[32m[I 2022-10-20 02:00:25,347][0m Trial 85 finished with value: 0.991888902475946 and parameters: {'brf_n_estimators': 80, 'brf_criterion': 'gini', 'brf_min_samples_split': 11, 'brf_min_samples_leaf': 2, 'brf_max_features': 38, 'brf_bootstrap': False}. Best is trial 85 with value: 0.991889.[0m
[32m[I 2022-10-20 02:00:25,645][0m sklearn.ensemble.RandomForestClassifier.predict: fallback to original Scikit-learn[0m
[32m[I 2022-10-20 02:00:25,645][0m sklearn.ensemble.RandomForestClassifier.predict_proba: fallback to original Scikit-learn[0m
[32m[I 2022-10-20 02:00:25,994][0m sklearn.ensemble.RandomForestClassifier.predict: fallback to original Scikit-learn[0m
[32m[I 2022-10-20 02:00:25,994][0m sklearn.ensemble.RandomForestClassifier.predict_proba: fallback to original Scikit-learn[0m
[32m[I 2022-10-20 02:00:26,369][0m sklearn.ensemble.RandomForestClassifier.predict: fallback to original Scikit-learn[0m
[32m[I 2022-10-20 02:00:26,369][0m sklearn.ensemble.RandomForestClassifier.predict_proba: fallback to original Scikit-learn[0m
[32m[I 2022-10-20 02:00:28,851][0m Trial 86 finished with value: 0.9911183683636313 and parameters: {'brf_n_estimators': 80, 'brf_criterion': 'gini', 'brf_min_samples_split': 20, 'brf_min_samples_leaf': 39, 'brf_max_features': 44, 'brf_bootstrap': False}. Best is trial 85 with value: 0.991889.[0m
[32m[I 2022-10-20 02:00:29,478][0m Trial 87 finished with value: 0.991654737116083 and parameters: {'brf_n_estimators': 80, 'brf_criterion': 'entropy', 'brf_min_samples_split': 20, 'brf_min_samples_leaf': 3, 'brf_max_features': 38, 'brf_bootstrap': False}. Best is trial 85 with value: 0.991889.[0m
[32m[I 2022-10-20 02:00:30,029][0m Trial 88 finished with value: 0.9917086739095428 and parameters: {'brf_n_estimators': 80, 'brf_criterion': 'entropy', 'brf_min_samples_split': 21, 'brf_min_samples_leaf': 3, 'brf_max_features': 38, 'brf_bootstrap': False}. Best is trial 85 with value: 0.991889.[0m
[32m[I 2022-10-20 02:00:39,073][0m sklearn.ensemble.RandomForestClassifier.predict: fallback to original Scikit-learn[0m
[32m[I 2022-10-20 02:00:39,073][0m sklearn.ensemble.RandomForestClassifier.predict_proba: fallback to original Scikit-learn[0m
[32m[I 2022-10-20 02:00:39,542][0m sklearn.ensemble.RandomForestClassifier.predict: fallback to original Scikit-learn[0m
[32m[I 2022-10-20 02:00:39,558][0m sklearn.ensemble.RandomForestClassifier.predict_proba: fallback to original Scikit-learn[0m
[32m[I 2022-10-20 02:00:41,832][0m Trial 91 finished with value: 0.9916459987766314 and parameters: {'brf_n_estimators': 50, 'brf_criterion': 'gini', 'brf_min_samples_split': 19, 'brf_min_samples_leaf': 3, 'brf_max_features': 49, 'brf_bootstrap': False}. Best is trial 85 with value: 0.991889.[0m
[32m[I 2022-10-20 02:00:41,894][0m sklearn.ensemble.RandomForestClassifier.predict: fallback to original Scikit-learn[0m
[32m[I 2022-10-20 02:00:41,910][0m sklearn.ensemble.RandomForestClassifier.predict_proba: fallback to original Scikit-learn[0m
[32m[I 2022-10-20 02:00:43,210][0m Trial 89 finished with value: 0.9918127014868334 and parameters: {'brf_n_estimators': 80, 'brf_criterion': 'gini', 'brf_min_samples_split': 11, 'brf_min_samples_leaf': 3, 'brf_max_features': 48, 'brf_bootstrap': False}. Best is trial 85 with value: 0.991889.[0m
[32m[I 2022-10-20 02:00:45,832][0m Trial 90 finished with value: 0.9917897760865927 and parameters: {'brf_n_estimators': 80, 'brf_criterion': 'gini', 'brf_min_samples_split': 11, 'brf_min_samples_leaf': 3, 'brf_max_features': 50, 'brf_bootstrap': False}. Best is trial 85 with value: 0.991889.[0m
[32m[I 2022-10-20 02:00:51,173][0m sklearn.ensemble.RandomForestClassifier.predict: fallback to original Scikit-learn[0m
[32m[I 2022-10-20 02:00:51,173][0m sklearn.ensemble.RandomForestClassifier.predict_proba: fallback to original Scikit-learn[0m
[32m[I 2022-10-20 02:00:52,240][0m sklearn.ensemble.RandomForestClassifier.predict: fallback to original Scikit-learn[0m
[32m[I 2022-10-20 02:00:52,240][0m sklearn.ensemble.RandomForestClassifier.predict: fallback to original Scikit-learn[0m
[32m[I 2022-10-20 02:00:52,240][0m sklearn.ensemble.RandomForestClassifier.predict_proba: fallback to original Scikit-learn[0m
[32m[I 2022-10-20 02:00:52,256][0m sklearn.ensemble.RandomForestClassifier.predict_proba: fallback to original Scikit-learn[0m
[32m[I 2022-10-20 02:00:53,858][0m Trial 94 finished with value: 0.9916452146534401 and parameters: {'brf_n_estimators': 50, 'brf_criterion': 'gini', 'brf_min_samples_split': 11, 'brf_min_samples_leaf': 3, 'brf_max_features': 49, 'brf_bootstrap': False}. Best is trial 85 with value: 0.991889.[0m
[32m[I 2022-10-20 02:00:54,814][0m Trial 95 finished with value: 0.9917139292608076 and parameters: {'brf_n_estimators': 50, 'brf_criterion': 'gini', 'brf_min_samples_split': 11, 'brf_min_samples_leaf': 5, 'brf_max_features': 49, 'brf_bootstrap': False}. Best is trial 85 with value: 0.991889.[0m
[32m[I 2022-10-20 02:00:54,814][0m Trial 96 finished with value: 0.9917139292608076 and parameters: {'brf_n_estimators': 50, 'brf_criterion': 'gini', 'brf_min_samples_split': 11, 'brf_min_samples_leaf': 5, 'brf_max_features': 49, 'brf_bootstrap': False}. Best is trial 85 with value: 0.991889.[0m
[32m[I 2022-10-20 02:00:55,143][0m sklearn.ensemble.RandomForestClassifier.predict: fallback to original Scikit-learn[0m
[32m[I 2022-10-20 02:00:55,158][0m sklearn.ensemble.RandomForestClassifier.predict_proba: fallback to original Scikit-learn[0m
[32m[I 2022-10-20 02:00:57,230][0m sklearn.ensemble.RandomForestClassifier.predict: fallback to original Scikit-learn[0m
[32m[I 2022-10-20 02:00:57,230][0m sklearn.ensemble.RandomForestClassifier.predict_proba: fallback to original Scikit-learn[0m
[32m[I 2022-10-20 02:00:57,324][0m Trial 92 finished with value: 0.9910809309677227 and parameters: {'brf_n_estimators': 80, 'brf_criterion': 'gini', 'brf_min_samples_split': 20, 'brf_min_samples_leaf': 41, 'brf_max_features': 48, 'brf_bootstrap': False}. Best is trial 85 with value: 0.991889.[0m
[32m[I 2022-10-20 02:00:59,139][0m Trial 93 finished with value: 0.9911186915855149 and parameters: {'brf_n_estimators': 80, 'brf_criterion': 'gini', 'brf_min_samples_split': 20, 'brf_min_samples_leaf': 39, 'brf_max_features': 38, 'brf_bootstrap': False}. Best is trial 85 with value: 0.991889.[0m
[32m[I 2022-10-20 02:01:02,755][0m sklearn.ensemble.RandomForestClassifier.predict: fallback to original Scikit-learn[0m
[32m[I 2022-10-20 02:01:02,770][0m sklearn.ensemble.RandomForestClassifier.predict_proba: fallback to original Scikit-learn[0m
[32m[I 2022-10-20 02:01:03,333][0m sklearn.ensemble.RandomForestClassifier.predict: fallback to original Scikit-learn[0m
[32m[I 2022-10-20 02:01:03,333][0m sklearn.ensemble.RandomForestClassifier.predict_proba: fallback to original Scikit-learn[0m
[32m[I 2022-10-20 02:01:03,911][0m Trial 97 finished with value: 0.9917138667917503 and parameters: {'brf_n_estimators': 60, 'brf_criterion': 'gini', 'brf_min_samples_split': 10, 'brf_min_samples_leaf': 5, 'brf_max_features': 47, 'brf_bootstrap': False}. Best is trial 85 with value: 0.991889.[0m
[32m[I 2022-10-20 02:01:04,474][0m Trial 98 finished with value: 0.9916759291722005 and parameters: {'brf_n_estimators': 60, 'brf_criterion': 'gini', 'brf_min_samples_split': 10, 'brf_min_samples_leaf': 5, 'brf_max_features': 48, 'brf_bootstrap': False}. Best is trial 85 with value: 0.991889.[0m
[32m[I 2022-10-20 02:01:10,039][0m sklearn.ensemble.RandomForestClassifier.predict: fallback to original Scikit-learn[0m
[32m[I 2022-10-20 02:01:10,054][0m sklearn.ensemble.RandomForestClassifier.predict_proba: fallback to original Scikit-learn[0m
[32m[I 2022-10-20 02:01:11,133][0m Trial 99 finished with value: 0.9917825787066418 and parameters: {'brf_n_estimators': 90, 'brf_criterion': 'gini', 'brf_min_samples_split': 11, 'brf_min_samples_leaf': 5, 'brf_max_features': 47, 'brf_bootstrap': False}. Best is trial 85 with value: 0.991889.[0m
[32m[I 2022-10-20 02:01:11,195][0m Study finished.[0m
[32m[I 2022-10-20 02:01:11,273][0m --------------------------------------------------------------------------------[0m
[32m[I 2022-10-20 02:01:11,273][0m --------------------              BernoulliNB               --------------------[0m
[32m[I 2022-10-20 02:01:11,273][0m --------------------------------------------------------------------------------[0m
[32m[I 2022-10-20 02:01:11,305][0m A new study created in RDB with name: BernoulliNB_b4f53b70[0m
[32m[I 2022-10-20 02:01:11,305][0m Study started.[0m
[32m[I 2022-10-20 02:01:14,156][0m Trial 0 finished with value: 0.820286900220342 and parameters: {'bnb_alpha': 0.65, 'bnb_binarize': 0.65, 'bnb_fit_prior': False}. Best is trial 0 with value: 0.846853.[0m
[32m[I 2022-10-20 02:01:14,312][0m Trial 4 finished with value: 0.8468527798566332 and parameters: {'bnb_alpha': 0.35000000000000003, 'bnb_binarize': 0.9, 'bnb_fit_prior': True}. Best is trial 4 with value: 0.846879.[0m
[32m[I 2022-10-20 02:01:14,375][0m Trial 5 finished with value: 0.820286900220342 and parameters: {'bnb_alpha': 0.6000000000000001, 'bnb_binarize': 0.35000000000000003, 'bnb_fit_prior': False}. Best is trial 4 with value: 0.846879.[0m
[32m[I 2022-10-20 02:01:14,438][0m Trial 6 finished with value: 0.8468527798566332 and parameters: {'bnb_alpha': 1.0, 'bnb_binarize': 0.8500000000000001, 'bnb_fit_prior': True}. Best is trial 4 with value: 0.846879.[0m
[32m[I 2022-10-20 02:01:14,500][0m Trial 2 finished with value: 0.820286900220342 and parameters: {'bnb_alpha': 0.45, 'bnb_binarize': 0.8500000000000001, 'bnb_fit_prior': False}. Best is trial 1 with value: 0.846879.[0m
[32m[I 2022-10-20 02:01:14,594][0m Trial 3 finished with value: 0.820286900220342 and parameters: {'bnb_alpha': 0.65, 'bnb_binarize': 0.4, 'bnb_fit_prior': False}. Best is trial 1 with value: 0.846879.[0m
[32m[I 2022-10-20 02:01:14,673][0m Trial 1 finished with value: 0.846879304059287 and parameters: {'bnb_alpha': 0.1, 'bnb_binarize': 0.05, 'bnb_fit_prior': True}. Best is trial 1 with value: 0.846879.[0m
[32m[I 2022-10-20 02:01:14,767][0m Trial 7 finished with value: 0.820286900220342 and parameters: {'bnb_alpha': 0.55, 'bnb_binarize': 0.45, 'bnb_fit_prior': False}. Best is trial 1 with value: 0.846879.[0m
[32m[I 2022-10-20 02:01:17,364][0m Trial 8 finished with value: 0.820286900220342 and parameters: {'bnb_alpha': 0.9, 'bnb_binarize': 0.05, 'bnb_fit_prior': False}. Best is trial 1 with value: 0.846879.[0m
[32m[I 2022-10-20 02:01:17,521][0m Trial 9 finished with value: 0.8203045408599223 and parameters: {'bnb_alpha': 0.05, 'bnb_binarize': 0.65, 'bnb_fit_prior': False}. Best is trial 1 with value: 0.846879.[0m
[32m[I 2022-10-20 02:01:17,960][0m Trial 10 finished with value: 0.820286900220342 and parameters: {'bnb_alpha': 0.30000000000000004, 'bnb_binarize': 0.7000000000000001, 'bnb_fit_prior': False}. Best is trial 14 with value: 0.846879.[0m
[32m[I 2022-10-20 02:01:18,038][0m Trial 13 finished with value: 0.8468527798566332 and parameters: {'bnb_alpha': 0.2, 'bnb_binarize': 0.05, 'bnb_fit_prior': True}. Best is trial 1 with value: 0.846879.[0m
[32m[I 2022-10-20 02:01:18,038][0m Trial 12 finished with value: 0.8203045408599223 and parameters: {'bnb_alpha': 0.1, 'bnb_binarize': 0.9500000000000001, 'bnb_fit_prior': False}. Best is trial 14 with value: 0.846879.[0m
[32m[I 2022-10-20 02:01:18,038][0m Trial 14 finished with value: 0.846879304059287 and parameters: {'bnb_alpha': 0.05, 'bnb_binarize': 0.1, 'bnb_fit_prior': True}. Best is trial 1 with value: 0.846879.[0m
