[32m[I 2022-10-20 01:54:21,158][0m Trial 25 finished with value: 0.9912921367403649 and parameters: {'brf_n_estimators': 160, 'brf_criterion': 'entropy', 'brf_min_samples_split': 2, 'brf_min_samples_leaf': 19, 'brf_max_features': 23, 'brf_bootstrap': True}. Best is trial 13 with value: 0.991717.[0m
[32m[I 2022-10-20 01:54:23,272][0m sklearn.ensemble.RandomForestClassifier.predict: fallback to original Scikit-learn[0m
[32m[I 2022-10-20 01:54:23,272][0m sklearn.ensemble.RandomForestClassifier.predict_proba: fallback to original Scikit-learn[0m
[32m[I 2022-10-20 01:54:25,276][0m Trial 28 finished with value: 0.9916781880718512 and parameters: {'brf_n_estimators': 160, 'brf_criterion': 'entropy', 'brf_min_samples_split': 22, 'brf_min_samples_leaf': 2, 'brf_max_features': 23, 'brf_bootstrap': False}. Best is trial 13 with value: 0.991717.[0m
[32m[I 2022-10-20 01:54:26,052][0m Trial 27 finished with value: 0.9916847226374551 and parameters: {'brf_n_estimators': 160, 'brf_criterion': 'entropy', 'brf_min_samples_split': 23, 'brf_min_samples_leaf': 1, 'brf_max_features': 24, 'brf_bootstrap': False}. Best is trial 13 with value: 0.991717.[0m
[32m[I 2022-10-20 01:54:28,732][0m sklearn.ensemble.RandomForestClassifier.predict: fallback to original Scikit-learn[0m
[32m[I 2022-10-20 01:54:28,748][0m sklearn.ensemble.RandomForestClassifier.predict_proba: fallback to original Scikit-learn[0m
[32m[I 2022-10-20 01:54:30,470][0m Trial 29 finished with value: 0.9916709919841354 and parameters: {'brf_n_estimators': 170, 'brf_criterion': 'entropy', 'brf_min_samples_split': 21, 'brf_min_samples_leaf': 1, 'brf_max_features': 25, 'brf_bootstrap': True}. Best is trial 13 with value: 0.991717.[0m
[32m[I 2022-10-20 01:54:36,205][0m Trial 30 finished with value: 0.9917169473252068 and parameters: {'brf_n_estimators': 160, 'brf_criterion': 'entropy', 'brf_min_samples_split': 22, 'brf_min_samples_leaf': 1, 'brf_max_features': 24, 'brf_bootstrap': True}. Best is trial 13 with value: 0.991717.[0m
[32m[I 2022-10-20 01:54:51,859][0m sklearn.ensemble.RandomForestClassifier.predict: fallback to original Scikit-learn[0m
[32m[I 2022-10-20 01:54:51,859][0m sklearn.ensemble.RandomForestClassifier.predict_proba: fallback to original Scikit-learn[0m
[32m[I 2022-10-20 01:54:54,250][0m sklearn.ensemble.RandomForestClassifier.predict: fallback to original Scikit-learn[0m
[32m[I 2022-10-20 01:54:54,250][0m sklearn.ensemble.RandomForestClassifier.predict_proba: fallback to original Scikit-learn[0m
[32m[I 2022-10-20 01:54:58,609][0m Trial 31 finished with value: 0.99170698155594 and parameters: {'brf_n_estimators': 160, 'brf_criterion': 'entropy', 'brf_min_samples_split': 22, 'brf_min_samples_leaf': 1, 'brf_max_features': 9, 'brf_bootstrap': False}. Best is trial 13 with value: 0.991717.[0m
[32m[I 2022-10-20 01:55:01,265][0m Trial 32 finished with value: 0.9916013896106382 and parameters: {'brf_n_estimators': 160, 'brf_criterion': 'entropy', 'brf_min_samples_split': 22, 'brf_min_samples_leaf': 3, 'brf_max_features': 8, 'brf_bootstrap': False}. Best is trial 13 with value: 0.991717.[0m
[32m[I 2022-10-20 01:55:04,460][0m sklearn.ensemble.RandomForestClassifier.predict: fallback to original Scikit-learn[0m
[32m[I 2022-10-20 01:55:04,476][0m sklearn.ensemble.RandomForestClassifier.predict_proba: fallback to original Scikit-learn[0m
[32m[I 2022-10-20 01:55:12,629][0m Trial 33 finished with value: 0.9915882174684988 and parameters: {'brf_n_estimators': 170, 'brf_criterion': 'entropy', 'brf_min_samples_split': 22, 'brf_min_samples_leaf': 2, 'brf_max_features': 7, 'brf_bootstrap': True}. Best is trial 13 with value: 0.991717.[0m
[32m[I 2022-10-20 01:55:16,671][0m sklearn.ensemble.RandomForestClassifier.predict: fallback to original Scikit-learn[0m
[32m[I 2022-10-20 01:55:16,687][0m sklearn.ensemble.RandomForestClassifier.predict_proba: fallback to original Scikit-learn[0m
[32m[I 2022-10-20 01:55:22,985][0m Trial 36 finished with value: 0.9916402594626577 and parameters: {'brf_n_estimators': 130, 'brf_criterion': 'entropy', 'brf_min_samples_split': 24, 'brf_min_samples_leaf': 5, 'brf_max_features': 10, 'brf_bootstrap': False}. Best is trial 13 with value: 0.991717.[0m
[32m[I 2022-10-20 01:55:25,236][0m sklearn.ensemble.RandomForestClassifier.predict: fallback to original Scikit-learn[0m
[32m[I 2022-10-20 01:55:25,252][0m sklearn.ensemble.RandomForestClassifier.predict_proba: fallback to original Scikit-learn[0m
[32m[I 2022-10-20 01:55:25,973][0m sklearn.ensemble.RandomForestClassifier.predict: fallback to original Scikit-learn[0m
[32m[I 2022-10-20 01:55:25,973][0m sklearn.ensemble.RandomForestClassifier.predict_proba: fallback to original Scikit-learn[0m
[32m[I 2022-10-20 01:55:29,984][0m sklearn.ensemble.RandomForestClassifier.predict: fallback to original Scikit-learn[0m
[32m[I 2022-10-20 01:55:29,984][0m sklearn.ensemble.RandomForestClassifier.predict_proba: fallback to original Scikit-learn[0m
[32m[I 2022-10-20 01:55:30,719][0m Trial 37 finished with value: 0.9916727517394683 and parameters: {'brf_n_estimators': 130, 'brf_criterion': 'entropy', 'brf_min_samples_split': 31, 'brf_min_samples_leaf': 6, 'brf_max_features': 28, 'brf_bootstrap': False}. Best is trial 13 with value: 0.991717.[0m
[32m[I 2022-10-20 01:55:31,725][0m Trial 38 finished with value: 0.9916411845551878 and parameters: {'brf_n_estimators': 130, 'brf_criterion': 'entropy', 'brf_min_samples_split': 24, 'brf_min_samples_leaf': 5, 'brf_max_features': 10, 'brf_bootstrap': True}. Best is trial 13 with value: 0.991717.[0m
[32m[I 2022-10-20 01:55:36,788][0m sklearn.ensemble.RandomForestClassifier.predict: fallback to original Scikit-learn[0m
[32m[I 2022-10-20 01:55:36,804][0m sklearn.ensemble.RandomForestClassifier.predict_proba: fallback to original Scikit-learn[0m
[32m[I 2022-10-20 01:55:37,513][0m Trial 35 finished with value: 0.9916791417146246 and parameters: {'brf_n_estimators': 170, 'brf_criterion': 'entropy', 'brf_min_samples_split': 19, 'brf_min_samples_leaf': 6, 'brf_max_features': 9, 'brf_bootstrap': False}. Best is trial 13 with value: 0.991717.[0m
[32m[I 2022-10-20 01:55:45,592][0m Trial 34 finished with value: 0.9915637141439707 and parameters: {'brf_n_estimators': 200, 'brf_criterion': 'entropy', 'brf_min_samples_split': 23, 'brf_min_samples_leaf': 2, 'brf_max_features': 10, 'brf_bootstrap': False}. Best is trial 13 with value: 0.991717.[0m
[32m[I 2022-10-20 01:55:47,439][0m sklearn.ensemble.RandomForestClassifier.predict: fallback to original Scikit-learn[0m
[32m[I 2022-10-20 01:55:47,439][0m sklearn.ensemble.RandomForestClassifier.predict_proba: fallback to original Scikit-learn[0m
[32m[I 2022-10-20 01:55:52,697][0m sklearn.ensemble.RandomForestClassifier.predict: fallback to original Scikit-learn[0m
[32m[I 2022-10-20 01:55:52,728][0m sklearn.ensemble.RandomForestClassifier.predict_proba: fallback to original Scikit-learn[0m
[32m[I 2022-10-20 01:55:53,757][0m Trial 39 finished with value: 0.9915350685750173 and parameters: {'brf_n_estimators': 130, 'brf_criterion': 'entropy', 'brf_min_samples_split': 31, 'brf_min_samples_leaf': 6, 'brf_max_features': 8, 'brf_bootstrap': True}. Best is trial 13 with value: 0.991717.[0m
[32m[I 2022-10-20 01:55:59,363][0m Trial 40 finished with value: 0.9917098055053909 and parameters: {'brf_n_estimators': 130, 'brf_criterion': 'entropy', 'brf_min_samples_split': 14, 'brf_min_samples_leaf': 6, 'brf_max_features': 29, 'brf_bootstrap': True}. Best is trial 13 with value: 0.991717.[0m
[32m[I 2022-10-20 01:56:04,606][0m sklearn.ensemble.RandomForestClassifier.predict: fallback to original Scikit-learn[0m
[32m[I 2022-10-20 01:56:04,606][0m sklearn.ensemble.RandomForestClassifier.predict_proba: fallback to original Scikit-learn[0m
[32m[I 2022-10-20 01:56:11,284][0m Trial 41 finished with value: 0.9918081534721198 and parameters: {'brf_n_estimators': 130, 'brf_criterion': 'entropy', 'brf_min_samples_split': 14, 'brf_min_samples_leaf': 6, 'brf_max_features': 31, 'brf_bootstrap': True}. Best is trial 41 with value: 0.991808.[0m
[32m[I 2022-10-20 01:56:14,781][0m sklearn.ensemble.RandomForestClassifier.predict: fallback to original Scikit-learn[0m
[32m[I 2022-10-20 01:56:14,781][0m sklearn.ensemble.RandomForestClassifier.predict_proba: fallback to original Scikit-learn[0m
[32m[I 2022-10-20 01:56:21,351][0m Trial 42 finished with value: 0.9914903134309716 and parameters: {'brf_n_estimators': 130, 'brf_criterion': 'entropy', 'brf_min_samples_split': 31, 'brf_min_samples_leaf': 7, 'brf_max_features': 30, 'brf_bootstrap': True}. Best is trial 41 with value: 0.991808.[0m
[32m[I 2022-10-20 01:56:45,817][0m sklearn.ensemble.RandomForestClassifier.predict: fallback to original Scikit-learn[0m
[32m[I 2022-10-20 01:56:45,817][0m sklearn.ensemble.RandomForestClassifier.predict_proba: fallback to original Scikit-learn[0m
[32m[I 2022-10-20 01:56:48,612][0m sklearn.ensemble.RandomForestClassifier.predict: fallback to original Scikit-learn[0m
[32m[I 2022-10-20 01:56:48,612][0m sklearn.ensemble.RandomForestClassifier.predict_proba: fallback to original Scikit-learn[0m
[32m[I 2022-10-20 01:56:52,491][0m sklearn.ensemble.RandomForestClassifier.predict: fallback to original Scikit-learn[0m
[32m[I 2022-10-20 01:56:52,491][0m sklearn.ensemble.RandomForestClassifier.predict_proba: fallback to original Scikit-learn[0m
[32m[I 2022-10-20 01:56:53,571][0m Trial 44 finished with value: 0.9914668200657886 and parameters: {'brf_n_estimators': 190, 'brf_criterion': 'entropy', 'brf_min_samples_split': 13, 'brf_min_samples_leaf': 9, 'brf_max_features': 20, 'brf_bootstrap': True}. Best is trial 41 with value: 0.991808.[0m
[32m[I 2022-10-20 01:56:55,105][0m sklearn.ensemble.RandomForestClassifier.predict: fallback to original Scikit-learn[0m
[32m[I 2022-10-20 01:56:55,105][0m sklearn.ensemble.RandomForestClassifier.predict_proba: fallback to original Scikit-learn[0m
[32m[I 2022-10-20 01:56:56,121][0m Trial 43 finished with value: 0.9913677845728625 and parameters: {'brf_n_estimators': 200, 'brf_criterion': 'entropy', 'brf_min_samples_split': 13, 'brf_min_samples_leaf': 9, 'brf_max_features': 19, 'brf_bootstrap': True}. Best is trial 41 with value: 0.991808.[0m
[32m[I 2022-10-20 01:56:57,775][0m sklearn.ensemble.RandomForestClassifier.predict: fallback to original Scikit-learn[0m
[32m[I 2022-10-20 01:56:57,791][0m sklearn.ensemble.RandomForestClassifier.predict_proba: fallback to original Scikit-learn[0m
[32m[I 2022-10-20 01:56:58,432][0m Trial 47 finished with value: 0.991474570594496 and parameters: {'brf_n_estimators': 150, 'brf_criterion': 'entropy', 'brf_min_samples_split': 13, 'brf_min_samples_leaf': 9, 'brf_max_features': 20, 'brf_bootstrap': True}. Best is trial 41 with value: 0.991808.[0m
[32m[I 2022-10-20 01:56:59,017][0m sklearn.ensemble.RandomForestClassifier.predict: fallback to original Scikit-learn[0m
[32m[I 2022-10-20 01:56:59,017][0m sklearn.ensemble.RandomForestClassifier.predict_proba: fallback to original Scikit-learn[0m
[32m[I 2022-10-20 01:57:00,180][0m sklearn.ensemble.RandomForestClassifier.predict: fallback to original Scikit-learn[0m
[32m[I 2022-10-20 01:57:00,180][0m sklearn.ensemble.RandomForestClassifier.predict_proba: fallback to original Scikit-learn[0m
[32m[I 2022-10-20 01:57:01,977][0m Trial 45 finished with value: 0.9914669124629721 and parameters: {'brf_n_estimators': 200, 'brf_criterion': 'entropy', 'brf_min_samples_split': 13, 'brf_min_samples_leaf': 9, 'brf_max_features': 20, 'brf_bootstrap': True}. Best is trial 41 with value: 0.991808.[0m
[32m[I 2022-10-20 01:57:03,158][0m Trial 48 finished with value: 0.9914516883995698 and parameters: {'brf_n_estimators': 150, 'brf_criterion': 'entropy', 'brf_min_samples_split': 13, 'brf_min_samples_leaf': 11, 'brf_max_features': 20, 'brf_bootstrap': True}. Best is trial 41 with value: 0.991808.[0m
[32m[I 2022-10-20 01:57:05,118][0m Trial 49 finished with value: 0.9914746933397806 and parameters: {'brf_n_estimators': 120, 'brf_criterion': 'entropy', 'brf_min_samples_split': 13, 'brf_min_samples_leaf': 10, 'brf_max_features': 30, 'brf_bootstrap': True}. Best is trial 41 with value: 0.991808.[0m
[32m[I 2022-10-20 01:57:06,136][0m Trial 46 finished with value: 0.9914595922690654 and parameters: {'brf_n_estimators': 190, 'brf_criterion': 'entropy', 'brf_min_samples_split': 17, 'brf_min_samples_leaf': 15, 'brf_max_features': 20, 'brf_bootstrap': True}. Best is trial 41 with value: 0.991808.[0m
[32m[I 2022-10-20 01:57:15,101][0m sklearn.ensemble.RandomForestClassifier.predict: fallback to original Scikit-learn[0m
[32m[I 2022-10-20 01:57:15,116][0m sklearn.ensemble.RandomForestClassifier.predict_proba: fallback to original Scikit-learn[0m
[32m[I 2022-10-20 01:57:21,606][0m Trial 50 finished with value: 0.9914825953881773 and parameters: {'brf_n_estimators': 140, 'brf_criterion': 'entropy', 'brf_min_samples_split': 13, 'brf_min_samples_leaf': 15, 'brf_max_features': 20, 'brf_bootstrap': True}. Best is trial 41 with value: 0.991808.[0m
[32m[I 2022-10-20 01:57:48,961][0m sklearn.ensemble.RandomForestClassifier.predict: fallback to original Scikit-learn[0m
[32m[I 2022-10-20 01:57:48,961][0m sklearn.ensemble.RandomForestClassifier.predict_proba: fallback to original Scikit-learn[0m
[32m[I 2022-10-20 01:57:51,451][0m sklearn.ensemble.RandomForestClassifier.predict: fallback to original Scikit-learn[0m
[32m[I 2022-10-20 01:57:51,451][0m sklearn.ensemble.RandomForestClassifier.predict_proba: fallback to original Scikit-learn[0m
[32m[I 2022-10-20 01:57:51,655][0m sklearn.ensemble.RandomForestClassifier.predict: fallback to original Scikit-learn[0m
[32m[I 2022-10-20 01:57:51,670][0m sklearn.ensemble.RandomForestClassifier.predict_proba: fallback to original Scikit-learn[0m
[32m[I 2022-10-20 01:57:54,490][0m Trial 51 finished with value: 0.9911261434527332 and parameters: {'brf_n_estimators': 140, 'brf_criterion': 'entropy', 'brf_min_samples_split': 15, 'brf_min_samples_leaf': 13, 'brf_max_features': 35, 'brf_bootstrap': True}. Best is trial 41 with value: 0.991808.[0m
[32m[I 2022-10-20 01:57:55,010][0m sklearn.ensemble.RandomForestClassifier.predict: fallback to original Scikit-learn[0m
[32m[I 2022-10-20 01:57:55,010][0m sklearn.ensemble.RandomForestClassifier.predict_proba: fallback to original Scikit-learn[0m
[32m[I 2022-10-20 01:57:56,107][0m sklearn.ensemble.RandomForestClassifier.predict: fallback to original Scikit-learn[0m
[32m[I 2022-10-20 01:57:56,123][0m sklearn.ensemble.RandomForestClassifier.predict_proba: fallback to original Scikit-learn[0m
[32m[I 2022-10-20 01:57:56,374][0m Trial 54 finished with value: 0.9911489021425605 and parameters: {'brf_n_estimators': 120, 'brf_criterion': 'gini', 'brf_min_samples_split': 8, 'brf_min_samples_leaf': 15, 'brf_max_features': 36, 'brf_bootstrap': True}. Best is trial 41 with value: 0.991808.[0m
[32m[I 2022-10-20 01:57:56,499][0m Trial 55 finished with value: 0.9916129001656007 and parameters: {'brf_n_estimators': 120, 'brf_criterion': 'gini', 'brf_min_samples_split': 17, 'brf_min_samples_leaf': 16, 'brf_max_features': 29, 'brf_bootstrap': True}. Best is trial 41 with value: 0.991808.[0m
[32m[I 2022-10-20 01:58:00,728][0m Trial 53 finished with value: 0.9910264803746011 and parameters: {'brf_n_estimators': 140, 'brf_criterion': 'gini', 'brf_min_samples_split': 17, 'brf_min_samples_leaf': 16, 'brf_max_features': 34, 'brf_bootstrap': True}. Best is trial 41 with value: 0.991808.[0m
[32m[I 2022-10-20 01:58:00,994][0m sklearn.ensemble.RandomForestClassifier.predict: fallback to original Scikit-learn[0m
[32m[I 2022-10-20 01:58:00,994][0m sklearn.ensemble.RandomForestClassifier.predict_proba: fallback to original Scikit-learn[0m
[32m[I 2022-10-20 01:58:01,952][0m sklearn.ensemble.RandomForestClassifier.predict: fallback to original Scikit-learn[0m
[32m[I 2022-10-20 01:58:01,968][0m sklearn.ensemble.RandomForestClassifier.predict_proba: fallback to original Scikit-learn[0m
[32m[I 2022-10-20 01:58:02,375][0m Trial 52 finished with value: 0.9913764749594226 and parameters: {'brf_n_estimators': 150, 'brf_criterion': 'gini', 'brf_min_samples_split': 8, 'brf_min_samples_leaf': 11, 'brf_max_features': 37, 'brf_bootstrap': True}. Best is trial 41 with value: 0.991808.[0m
[32m[I 2022-10-20 01:58:06,869][0m Trial 57 finished with value: 0.9914677926945946 and parameters: {'brf_n_estimators': 140, 'brf_criterion': 'gini', 'brf_min_samples_split': 7, 'brf_min_samples_leaf': 29, 'brf_max_features': 27, 'brf_bootstrap': True}. Best is trial 41 with value: 0.991808.[0m
[32m[I 2022-10-20 01:58:08,078][0m Trial 56 finished with value: 0.9912846628424393 and parameters: {'brf_n_estimators': 140, 'brf_criterion': 'gini', 'brf_min_samples_split': 8, 'brf_min_samples_leaf': 14, 'brf_max_features': 37, 'brf_bootstrap': True}. Best is trial 41 with value: 0.991808.[0m
[32m[I 2022-10-20 01:58:19,014][0m sklearn.ensemble.RandomForestClassifier.predict: fallback to original Scikit-learn[0m
[32m[I 2022-10-20 01:58:19,014][0m sklearn.ensemble.RandomForestClassifier.predict_proba: fallback to original Scikit-learn[0m
[32m[I 2022-10-20 01:58:21,736][0m sklearn.ensemble.RandomForestClassifier.predict: fallback to original Scikit-learn[0m
[32m[I 2022-10-20 01:58:21,736][0m sklearn.ensemble.RandomForestClassifier.predict_proba: fallback to original Scikit-learn[0m
[32m[I 2022-10-20 01:58:24,175][0m sklearn.ensemble.RandomForestClassifier.predict: fallback to original Scikit-learn[0m
[32m[I 2022-10-20 01:58:24,175][0m sklearn.ensemble.RandomForestClassifier.predict_proba: fallback to original Scikit-learn[0m
[32m[I 2022-10-20 01:58:24,677][0m Trial 58 finished with value: 0.9917762240639042 and parameters: {'brf_n_estimators': 140, 'brf_criterion': 'gini', 'brf_min_samples_split': 9, 'brf_min_samples_leaf': 3, 'brf_max_features': 36, 'brf_bootstrap': True}. Best is trial 41 with value: 0.991808.[0m
[32m[I 2022-10-20 01:58:25,115][0m Trial 61 finished with value: 0.9915876020306098 and parameters: {'brf_n_estimators': 60, 'brf_criterion': 'gini', 'brf_min_samples_split': 26, 'brf_min_samples_leaf': 4, 'brf_max_features': 33, 'brf_bootstrap': False}. Best is trial 41 with value: 0.991808.[0m
[32m[I 2022-10-20 01:58:28,542][0m Trial 60 finished with value: 0.991716763991877 and parameters: {'brf_n_estimators': 70, 'brf_criterion': 'gini', 'brf_min_samples_split': 26, 'brf_min_samples_leaf': 4, 'brf_max_features': 27, 'brf_bootstrap': False}. Best is trial 41 with value: 0.991808.[0m
[32m[I 2022-10-20 01:58:30,502][0m sklearn.ensemble.RandomForestClassifier.predict: fallback to original Scikit-learn[0m
[32m[I 2022-10-20 01:58:30,502][0m sklearn.ensemble.RandomForestClassifier.predict_proba: fallback to original Scikit-learn[0m
[32m[I 2022-10-20 01:58:34,469][0m Trial 63 finished with value: 0.991694214988321 and parameters: {'brf_n_estimators': 70, 'brf_criterion': 'entropy', 'brf_min_samples_split': 26, 'brf_min_samples_leaf': 4, 'brf_max_features': 26, 'brf_bootstrap': False}. Best is trial 41 with value: 0.991808.[0m
[32m[I 2022-10-20 01:58:36,258][0m sklearn.ensemble.RandomForestClassifier.predict: fallback to original Scikit-learn[0m
[32m[I 2022-10-20 01:58:36,274][0m sklearn.ensemble.RandomForestClassifier.predict_proba: fallback to original Scikit-learn[0m
[32m[I 2022-10-20 01:58:40,397][0m Trial 64 finished with value: 0.9917919178865006 and parameters: {'brf_n_estimators': 70, 'brf_criterion': 'entropy', 'brf_min_samples_split': 26, 'brf_min_samples_leaf': 3, 'brf_max_features': 32, 'brf_bootstrap': False}. Best is trial 41 with value: 0.991808.[0m
[32m[I 2022-10-20 01:58:45,455][0m sklearn.ensemble.RandomForestClassifier.predict: fallback to original Scikit-learn[0m
[32m[I 2022-10-20 01:58:45,455][0m sklearn.ensemble.RandomForestClassifier.predict_proba: fallback to original Scikit-learn[0m
[32m[I 2022-10-20 01:58:50,149][0m Trial 65 finished with value: 0.9916486902661877 and parameters: {'brf_n_estimators': 90, 'brf_criterion': 'entropy', 'brf_min_samples_split': 27, 'brf_min_samples_leaf': 4, 'brf_max_features': 32, 'brf_bootstrap': False}. Best is trial 41 with value: 0.991808.[0m
[32m[I 2022-10-20 01:58:51,198][0m sklearn.ensemble.RandomForestClassifier.predict: fallback to original Scikit-learn[0m
[32m[I 2022-10-20 01:58:51,198][0m sklearn.ensemble.RandomForestClassifier.predict_proba: fallback to original Scikit-learn[0m
[32m[I 2022-10-20 01:58:51,999][0m sklearn.ensemble.RandomForestClassifier.predict: fallback to original Scikit-learn[0m
[32m[I 2022-10-20 01:58:52,015][0m sklearn.ensemble.RandomForestClassifier.predict_proba: fallback to original Scikit-learn[0m
[32m[I 2022-10-20 01:58:54,303][0m Trial 68 finished with value: 0.9915798916150937 and parameters: {'brf_n_estimators': 50, 'brf_criterion': 'gini', 'brf_min_samples_split': 40, 'brf_min_samples_leaf': 4, 'brf_max_features': 41, 'brf_bootstrap': False}. Best is trial 41 with value: 0.991808.[0m
[32m[I 2022-10-20 01:58:58,411][0m Trial 59 finished with value: 0.9915131025490859 and parameters: {'brf_n_estimators': 150, 'brf_criterion': 'gini', 'brf_min_samples_split': 26, 'brf_min_samples_leaf': 4, 'brf_max_features': 27, 'brf_bootstrap': True}. Best is trial 41 with value: 0.991808.[0m
[32m[I 2022-10-20 01:59:00,530][0m sklearn.ensemble.RandomForestClassifier.predict: fallback to original Scikit-learn[0m
[32m[I 2022-10-20 01:59:00,530][0m sklearn.ensemble.RandomForestClassifier.predict_proba: fallback to original Scikit-learn[0m
[32m[I 2022-10-20 01:59:01,800][0m sklearn.ensemble.RandomForestClassifier.predict: fallback to original Scikit-learn[0m
[32m[I 2022-10-20 01:59:01,800][0m sklearn.ensemble.RandomForestClassifier.predict_proba: fallback to original Scikit-learn[0m
