[32m[I 2022-10-20 14:51:27,385][0m Trial 26 finished with value: 0.06983726061632749 and parameters: {'p_penalty': 'elasticnet', 'p_alpha': 2.0699074712175912e-05, 'p_eta0': 1.0, 'p_early_stopping': True, 'p_validation_fraction': 0.25, 'p_n_iter_no_change': 10}. Best is trial 2 with value: 0.424444.[0m
[32m[I 2022-10-20 14:51:31,020][0m Trial 27 finished with value: 0.2844441188051378 and parameters: {'p_penalty': 'elasticnet', 'p_alpha': 1.4311667580250109e-05, 'p_eta0': 2.0, 'p_early_stopping': True, 'p_validation_fraction': 0.25, 'p_n_iter_no_change': 10}. Best is trial 2 with value: 0.424444.[0m
[32m[I 2022-10-20 14:51:31,654][0m Trial 28 finished with value: 0.2844441188051378 and parameters: {'p_penalty': 'elasticnet', 'p_alpha': 1.2842061500320285e-05, 'p_eta0': 1.0, 'p_early_stopping': True, 'p_validation_fraction': 0.25, 'p_n_iter_no_change': 10}. Best is trial 2 with value: 0.424444.[0m
[32m[I 2022-10-20 14:51:31,937][0m Trial 29 finished with value: 0.15023857551970676 and parameters: {'p_penalty': 'elasticnet', 'p_alpha': 9.800788459598808e-06, 'p_eta0': 1.0, 'p_early_stopping': True, 'p_validation_fraction': 0.25, 'p_n_iter_no_change': 10}. Best is trial 2 with value: 0.424444.[0m
[32m[I 2022-10-20 14:51:34,389][0m Trial 30 finished with value: 0.11014607546646599 and parameters: {'p_penalty': 'elasticnet', 'p_alpha': 8.66340215332994e-06, 'p_eta0': 1.0, 'p_early_stopping': True, 'p_validation_fraction': 0.25, 'p_n_iter_no_change': 10}. Best is trial 2 with value: 0.424444.[0m
[32m[I 2022-10-20 14:51:35,239][0m Trial 31 finished with value: 0.08276468731221172 and parameters: {'p_penalty': 'elasticnet', 'p_alpha': 7.2391592286649564e-06, 'p_eta0': 1.0, 'p_early_stopping': True, 'p_validation_fraction': 0.25, 'p_n_iter_no_change': 10}. Best is trial 2 with value: 0.424444.[0m
[32m[I 2022-10-20 14:51:39,046][0m Trial 33 finished with value: 0.295637322710892 and parameters: {'p_penalty': 'elasticnet', 'p_alpha': 0.0003630233260799126, 'p_eta0': 2.0, 'p_early_stopping': True, 'p_validation_fraction': 0.25, 'p_n_iter_no_change': 10}. Best is trial 2 with value: 0.424444.[0m
[32m[I 2022-10-20 14:51:40,256][0m Trial 32 finished with value: 0.2844441188051378 and parameters: {'p_penalty': 'elasticnet', 'p_alpha': 0.0005352483096380915, 'p_eta0': 1.0, 'p_early_stopping': True, 'p_validation_fraction': 0.25, 'p_n_iter_no_change': 10}. Best is trial 2 with value: 0.424444.[0m
[32m[I 2022-10-20 14:51:40,730][0m Trial 34 finished with value: 0.20236699353128187 and parameters: {'p_penalty': 'elasticnet', 'p_alpha': 0.0003860477676668583, 'p_eta0': 2.0, 'p_early_stopping': True, 'p_validation_fraction': 0.25, 'p_n_iter_no_change': 10}. Best is trial 2 with value: 0.424444.[0m
[32m[I 2022-10-20 14:51:44,147][0m Trial 35 finished with value: 0.031704046050076595 and parameters: {'p_penalty': 'elasticnet', 'p_alpha': 0.0003182349111756128, 'p_eta0': 1.0, 'p_early_stopping': True, 'p_validation_fraction': 0.25, 'p_n_iter_no_change': 10}. Best is trial 2 with value: 0.424444.[0m
[32m[I 2022-10-20 14:51:46,544][0m Trial 37 finished with value: 0.021003116936646717 and parameters: {'p_penalty': 'elasticnet', 'p_alpha': 0.0003487433614301384, 'p_eta0': 2.0, 'p_early_stopping': True, 'p_validation_fraction': 0.25, 'p_n_iter_no_change': 10}. Best is trial 2 with value: 0.424444.[0m
[32m[I 2022-10-20 14:51:47,281][0m Trial 36 finished with value: 0.020443645586433273 and parameters: {'p_penalty': 'elasticnet', 'p_alpha': 0.0003047956370763368, 'p_eta0': 2.0, 'p_early_stopping': True, 'p_validation_fraction': 0.25, 'p_n_iter_no_change': 10}. Best is trial 2 with value: 0.424444.[0m
[32m[I 2022-10-20 14:51:48,935][0m Trial 38 finished with value: 0.2844441188051378 and parameters: {'p_penalty': 'elasticnet', 'p_alpha': 0.00033660027230855455, 'p_eta0': 0.5, 'p_early_stopping': True, 'p_validation_fraction': 0.25, 'p_n_iter_no_change': 10}. Best is trial 2 with value: 0.424444.[0m
[32m[I 2022-10-20 14:51:50,448][0m Trial 39 finished with value: 0.12988232461642452 and parameters: {'p_penalty': 'elasticnet', 'p_alpha': 0.0005245271908046107, 'p_eta0': 0.5, 'p_early_stopping': True, 'p_validation_fraction': 0.25, 'p_n_iter_no_change': 10}. Best is trial 2 with value: 0.424444.[0m
[32m[I 2022-10-20 14:51:51,883][0m Trial 40 finished with value: 0.14255497737532324 and parameters: {'p_penalty': 'elasticnet', 'p_alpha': 0.0003421191677501331, 'p_eta0': 2.0, 'p_early_stopping': True, 'p_validation_fraction': 0.25, 'p_n_iter_no_change': 10}. Best is trial 2 with value: 0.424444.[0m
[32m[I 2022-10-20 14:51:54,782][0m Trial 41 finished with value: 0.02137131519774218 and parameters: {'p_penalty': 'elasticnet', 'p_alpha': 0.00039854268289617477, 'p_eta0': 2.0, 'p_early_stopping': True, 'p_validation_fraction': 0.25, 'p_n_iter_no_change': 10}. Best is trial 2 with value: 0.424444.[0m
[32m[I 2022-10-20 14:51:58,664][0m Trial 42 finished with value: 0.2942460302697324 and parameters: {'p_penalty': 'elasticnet', 'p_alpha': 1.4281876638415077e-06, 'p_eta0': 2.0, 'p_early_stopping': True, 'p_validation_fraction': 0.25, 'p_n_iter_no_change': 10}. Best is trial 2 with value: 0.424444.[0m
[32m[I 2022-10-20 14:51:59,350][0m Trial 43 finished with value: 0.11847970711030822 and parameters: {'p_penalty': 'elasticnet', 'p_alpha': 2.1128604356031847e-06, 'p_eta0': 2.0, 'p_early_stopping': True, 'p_validation_fraction': 0.25, 'p_n_iter_no_change': 10}. Best is trial 2 with value: 0.424444.[0m
[32m[I 2022-10-20 14:52:01,780][0m Trial 44 finished with value: 0.25654520024533994 and parameters: {'p_penalty': 'elasticnet', 'p_alpha': 1.2096252417193722e-06, 'p_eta0': 2.0, 'p_early_stopping': True, 'p_validation_fraction': 0.25, 'p_n_iter_no_change': 10}. Best is trial 2 with value: 0.424444.[0m
[32m[I 2022-10-20 14:52:04,562][0m Trial 46 finished with value: 0.20721365699675268 and parameters: {'p_penalty': 'elasticnet', 'p_alpha': 2.5757194060487197e-06, 'p_eta0': 2.0, 'p_early_stopping': True, 'p_validation_fraction': 0.25, 'p_n_iter_no_change': 10}. Best is trial 2 with value: 0.424444.[0m
[32m[I 2022-10-20 14:52:06,600][0m Trial 47 finished with value: 0.2052253520827679 and parameters: {'p_penalty': 'elasticnet', 'p_alpha': 2.115370880983442e-06, 'p_eta0': 2.0, 'p_early_stopping': True, 'p_validation_fraction': 0.25, 'p_n_iter_no_change': 10}. Best is trial 2 with value: 0.424444.[0m
[32m[I 2022-10-20 14:52:07,011][0m Trial 48 finished with value: 0.1694690829732355 and parameters: {'p_penalty': 'elasticnet', 'p_alpha': 1.568675116422815e-06, 'p_eta0': 0.5, 'p_early_stopping': True, 'p_validation_fraction': 0.25, 'p_n_iter_no_change': 10}. Best is trial 2 with value: 0.424444.[0m
[32m[I 2022-10-20 14:52:07,543][0m Trial 45 finished with value: 0.3050367555836725 and parameters: {'p_penalty': 'elasticnet', 'p_alpha': 1.0633106679922327e-06, 'p_eta0': 0.5, 'p_early_stopping': True, 'p_validation_fraction': 0.25, 'p_n_iter_no_change': 10}. Best is trial 2 with value: 0.424444.[0m
[32m[I 2022-10-20 14:52:11,738][0m Trial 49 finished with value: 0.44772801299105164 and parameters: {'p_penalty': 'elasticnet', 'p_alpha': 1.3885248999140952e-06, 'p_eta0': 0.5, 'p_early_stopping': True, 'p_validation_fraction': 0.25, 'p_n_iter_no_change': 10}. Best is trial 49 with value: 0.447728.[0m
[32m[I 2022-10-20 14:52:12,554][0m Trial 50 finished with value: 0.2844441188051378 and parameters: {'p_penalty': 'elasticnet', 'p_alpha': 1.1569186729793436e-06, 'p_eta0': 2.0, 'p_early_stopping': True, 'p_validation_fraction': 0.25, 'p_n_iter_no_change': 10}. Best is trial 49 with value: 0.447728.[0m
[32m[I 2022-10-20 14:52:13,210][0m Trial 51 finished with value: 0.1967869879691067 and parameters: {'p_penalty': 'elasticnet', 'p_alpha': 2.9287045677838635e-06, 'p_eta0': 2.0, 'p_early_stopping': True, 'p_validation_fraction': 0.25, 'p_n_iter_no_change': 10}. Best is trial 49 with value: 0.447728.[0m
[32m[I 2022-10-20 14:52:16,708][0m Trial 52 finished with value: 0.059375701653233026 and parameters: {'p_penalty': 'elasticnet', 'p_alpha': 3.0411380413589592e-06, 'p_eta0': 1.5, 'p_early_stopping': True, 'p_validation_fraction': 0.25, 'p_n_iter_no_change': 10}. Best is trial 49 with value: 0.447728.[0m
[32m[I 2022-10-20 14:52:20,565][0m Trial 54 finished with value: 0.5080844485837339 and parameters: {'p_penalty': 'elasticnet', 'p_alpha': 4.266621958091784e-06, 'p_eta0': 1.5, 'p_early_stopping': True, 'p_validation_fraction': 0.25, 'p_n_iter_no_change': 10}. Best is trial 54 with value: 0.508084.[0m
[32m[I 2022-10-20 14:52:20,723][0m Trial 53 finished with value: 0.2844441188051378 and parameters: {'p_penalty': 'elasticnet', 'p_alpha': 0.016749448316031056, 'p_eta0': 1.5, 'p_early_stopping': True, 'p_validation_fraction': 0.25, 'p_n_iter_no_change': 10}. Best is trial 54 with value: 0.508084.[0m
[32m[I 2022-10-20 14:52:23,727][0m Trial 55 finished with value: 0.2836994612300956 and parameters: {'p_penalty': 'elasticnet', 'p_alpha': 0.012705390637890125, 'p_eta0': 1.5, 'p_early_stopping': True, 'p_validation_fraction': 0.25, 'p_n_iter_no_change': 10}. Best is trial 54 with value: 0.508084.[0m
[32m[I 2022-10-20 14:52:26,189][0m Trial 56 finished with value: 0.2965050263982169 and parameters: {'p_penalty': 'elasticnet', 'p_alpha': 4.4738955792820186e-06, 'p_eta0': 0.5, 'p_early_stopping': True, 'p_validation_fraction': 0.25, 'p_n_iter_no_change': 10}. Best is trial 54 with value: 0.508084.[0m
[32m[I 2022-10-20 14:52:26,549][0m Trial 59 finished with value: 0.18220040314598604 and parameters: {'p_penalty': 'elasticnet', 'p_alpha': 0.008614989989691664, 'p_eta0': 0.5, 'p_early_stopping': True, 'p_validation_fraction': 0.25, 'p_n_iter_no_change': 10}. Best is trial 54 with value: 0.508084.[0m
[32m[I 2022-10-20 14:52:27,369][0m Trial 58 finished with value: 0.19185147886454448 and parameters: {'p_penalty': 'elasticnet', 'p_alpha': 3.965668358714199e-06, 'p_eta0': 0.5, 'p_early_stopping': True, 'p_validation_fraction': 0.25, 'p_n_iter_no_change': 10}. Best is trial 54 with value: 0.508084.[0m
[32m[I 2022-10-20 14:52:29,974][0m Trial 60 finished with value: 0.471887097038542 and parameters: {'p_penalty': 'elasticnet', 'p_alpha': 0.01063569945297573, 'p_eta0': 0.5, 'p_early_stopping': True, 'p_validation_fraction': 0.25, 'p_n_iter_no_change': 10}. Best is trial 54 with value: 0.508084.[0m
[32m[I 2022-10-20 14:52:31,248][0m Trial 57 finished with value: 0.1110102063794333 and parameters: {'p_penalty': 'elasticnet', 'p_alpha': 5.1275738441205085e-06, 'p_eta0': 0.5, 'p_early_stopping': True, 'p_validation_fraction': 0.25, 'p_n_iter_no_change': 10}. Best is trial 54 with value: 0.508084.[0m
[32m[I 2022-10-20 14:52:35,597][0m Trial 62 finished with value: 0.28655515997927605 and parameters: {'p_penalty': 'elasticnet', 'p_alpha': 4.947874050518047e-06, 'p_eta0': 0.5, 'p_early_stopping': True, 'p_validation_fraction': 0.25, 'p_n_iter_no_change': 10}. Best is trial 54 with value: 0.508084.[0m
[32m[I 2022-10-20 14:52:39,112][0m Trial 61 finished with value: 0.2624798272803215 and parameters: {'p_penalty': 'elasticnet', 'p_alpha': 5.136366051036488e-06, 'p_eta0': 0.5, 'p_early_stopping': True, 'p_validation_fraction': 0.25, 'p_n_iter_no_change': 10}. Best is trial 54 with value: 0.508084.[0m
[32m[I 2022-10-20 14:52:39,520][0m Trial 63 finished with value: 0.2844441188051378 and parameters: {'p_penalty': 'elasticnet', 'p_alpha': 4.966675017019081e-06, 'p_eta0': 0.5, 'p_early_stopping': True, 'p_validation_fraction': 0.25, 'p_n_iter_no_change': 10}. Best is trial 54 with value: 0.508084.[0m
[32m[I 2022-10-20 14:52:41,021][0m Trial 66 finished with value: 0.21669895319831914 and parameters: {'p_penalty': 'elasticnet', 'p_alpha': 5.632381594601872e-06, 'p_eta0': 0.5, 'p_early_stopping': True, 'p_validation_fraction': 0.25, 'p_n_iter_no_change': 10}. Best is trial 54 with value: 0.508084.[0m
[32m[I 2022-10-20 14:52:43,099][0m Trial 67 finished with value: 0.0012872840382361047 and parameters: {'p_penalty': 'elasticnet', 'p_alpha': 0.10021357736337748, 'p_eta0': 0.5, 'p_early_stopping': True, 'p_validation_fraction': 0.25, 'p_n_iter_no_change': 10}. Best is trial 54 with value: 0.508084.[0m
[32m[I 2022-10-20 14:52:43,783][0m Trial 65 finished with value: 0.1300065208070656 and parameters: {'p_penalty': 'elasticnet', 'p_alpha': 4.79501917454427e-06, 'p_eta0': 0.5, 'p_early_stopping': True, 'p_validation_fraction': 0.25, 'p_n_iter_no_change': 10}. Best is trial 54 with value: 0.508084.[0m
[32m[I 2022-10-20 14:52:46,660][0m Trial 64 finished with value: 0.17641496188374708 and parameters: {'p_penalty': 'elasticnet', 'p_alpha': 4.974529148641181e-06, 'p_eta0': 0.5, 'p_early_stopping': True, 'p_validation_fraction': 0.25, 'p_n_iter_no_change': 10}. Best is trial 54 with value: 0.508084.[0m
[32m[I 2022-10-20 14:52:47,937][0m Trial 68 finished with value: 0.4366600589184191 and parameters: {'p_penalty': 'elasticnet', 'p_alpha': 0.042682614097190534, 'p_eta0': 0.5, 'p_early_stopping': True, 'p_validation_fraction': 0.25, 'p_n_iter_no_change': 10}. Best is trial 54 with value: 0.508084.[0m
[32m[I 2022-10-20 14:52:52,475][0m Trial 69 finished with value: 0.143550338557009 and parameters: {'p_penalty': 'elasticnet', 'p_alpha': 0.17157327642193132, 'p_eta0': 0.5, 'p_early_stopping': True, 'p_validation_fraction': 0.25, 'p_n_iter_no_change': 10}. Best is trial 54 with value: 0.508084.[0m
[32m[I 2022-10-20 14:52:54,350][0m Trial 70 finished with value: 0.2823323263932321 and parameters: {'p_penalty': 'elasticnet', 'p_alpha': 0.0011188175351163772, 'p_eta0': 0.5, 'p_early_stopping': True, 'p_validation_fraction': 0.25, 'p_n_iter_no_change': 10}. Best is trial 54 with value: 0.508084.[0m
[32m[I 2022-10-20 14:52:56,461][0m Trial 71 finished with value: 0.1674331457597636 and parameters: {'p_penalty': 'elasticnet', 'p_alpha': 0.04291161105789666, 'p_eta0': 0.5, 'p_early_stopping': True, 'p_validation_fraction': 0.25, 'p_n_iter_no_change': 10}. Best is trial 54 with value: 0.508084.[0m
[32m[I 2022-10-20 14:52:56,993][0m Trial 74 finished with value: 0.17948449441710268 and parameters: {'p_penalty': 'elasticnet', 'p_alpha': 0.0008922022856519828, 'p_eta0': 1.5, 'p_early_stopping': True, 'p_validation_fraction': 0.25, 'p_n_iter_no_change': 10}. Best is trial 54 with value: 0.508084.[0m
[32m[I 2022-10-20 14:52:57,119][0m Trial 72 finished with value: 0.0012872840382361047 and parameters: {'p_penalty': 'elasticnet', 'p_alpha': 0.07432142665369519, 'p_eta0': 1.5, 'p_early_stopping': True, 'p_validation_fraction': 0.25, 'p_n_iter_no_change': 10}. Best is trial 54 with value: 0.508084.[0m
[32m[I 2022-10-20 14:52:58,271][0m Trial 73 finished with value: 0.4229224251089866 and parameters: {'p_penalty': 'elasticnet', 'p_alpha': 0.0010250421623703302, 'p_eta0': 1.5, 'p_early_stopping': True, 'p_validation_fraction': 0.25, 'p_n_iter_no_change': 10}. Best is trial 54 with value: 0.508084.[0m
[32m[I 2022-10-20 14:53:00,616][0m Trial 75 finished with value: 0.42312519122226805 and parameters: {'p_penalty': 'elasticnet', 'p_alpha': 0.0019079569839840888, 'p_eta0': 1.5, 'p_early_stopping': True, 'p_validation_fraction': 0.25, 'p_n_iter_no_change': 10}. Best is trial 54 with value: 0.508084.[0m
[32m[I 2022-10-20 14:53:03,772][0m Trial 76 finished with value: 0.04272702009322813 and parameters: {'p_penalty': 'elasticnet', 'p_alpha': 0.04377461696758905, 'p_eta0': 1.5, 'p_early_stopping': True, 'p_validation_fraction': 0.25, 'p_n_iter_no_change': 10}. Best is trial 54 with value: 0.508084.[0m
[32m[I 2022-10-20 14:53:07,363][0m Trial 78 finished with value: 0.09369952648141319 and parameters: {'p_penalty': 'elasticnet', 'p_alpha': 0.0032434662628623217, 'p_eta0': 1.0, 'p_early_stopping': True, 'p_validation_fraction': 0.25, 'p_n_iter_no_change': 10}. Best is trial 54 with value: 0.508084.[0m
[32m[I 2022-10-20 14:53:10,169][0m Trial 80 finished with value: 0.20566895443837643 and parameters: {'p_penalty': 'elasticnet', 'p_alpha': 0.003711270263800725, 'p_eta0': 1.0, 'p_early_stopping': True, 'p_validation_fraction': 0.25, 'p_n_iter_no_change': 10}. Best is trial 54 with value: 0.508084.[0m
[32m[I 2022-10-20 14:53:10,454][0m Trial 79 finished with value: 0.143550338557009 and parameters: {'p_penalty': 'elasticnet', 'p_alpha': 0.03261720589123797, 'p_eta0': 1.0, 'p_early_stopping': True, 'p_validation_fraction': 0.25, 'p_n_iter_no_change': 10}. Best is trial 54 with value: 0.508084.[0m
[32m[I 2022-10-20 14:53:11,082][0m Trial 81 finished with value: 0.0008105986752113407 and parameters: {'p_penalty': 'elasticnet', 'p_alpha': 0.00016205774205190005, 'p_eta0': 1.0, 'p_early_stopping': True, 'p_validation_fraction': 0.25, 'p_n_iter_no_change': 10}. Best is trial 54 with value: 0.508084.[0m
[32m[I 2022-10-20 14:53:11,744][0m Trial 82 finished with value: 0.14352255497184907 and parameters: {'p_penalty': 'elasticnet', 'p_alpha': 0.004082345659539922, 'p_eta0': 1.0, 'p_early_stopping': True, 'p_validation_fraction': 0.25, 'p_n_iter_no_change': 10}. Best is trial 54 with value: 0.508084.[0m
[32m[I 2022-10-20 14:53:12,447][0m Trial 77 finished with value: 0.2844441188051378 and parameters: {'p_penalty': 'elasticnet', 'p_alpha': 0.03498728255375093, 'p_eta0': 1.5, 'p_early_stopping': True, 'p_validation_fraction': 0.25, 'p_n_iter_no_change': 10}. Best is trial 54 with value: 0.508084.[0m
[32m[I 2022-10-20 14:53:13,699][0m Trial 83 finished with value: 0.3143801560046884 and parameters: {'p_penalty': 'elasticnet', 'p_alpha': 0.004412385645977619, 'p_eta0': 1.5, 'p_early_stopping': True, 'p_validation_fraction': 0.25, 'p_n_iter_no_change': 10}. Best is trial 54 with value: 0.508084.[0m
[32m[I 2022-10-20 14:53:17,051][0m Trial 84 finished with value: 0.1307429944692322 and parameters: {'p_penalty': 'elasticnet', 'p_alpha': 0.0030315438930027918, 'p_eta0': 1.5, 'p_early_stopping': True, 'p_validation_fraction': 0.25, 'p_n_iter_no_change': 10}. Best is trial 54 with value: 0.508084.[0m
[32m[I 2022-10-20 14:53:20,698][0m Trial 85 finished with value: 0.17923362204094362 and parameters: {'p_penalty': 'elasticnet', 'p_alpha': 0.00019271766490827781, 'p_eta0': 1.5, 'p_early_stopping': True, 'p_validation_fraction': 0.25, 'p_n_iter_no_change': 10}. Best is trial 54 with value: 0.508084.[0m
[32m[I 2022-10-20 14:53:23,485][0m Trial 86 finished with value: 0.2009989072014078 and parameters: {'p_penalty': 'elasticnet', 'p_alpha': 0.0016474367529306338, 'p_eta0': 1.5, 'p_early_stopping': True, 'p_validation_fraction': 0.25, 'p_n_iter_no_change': 10}. Best is trial 54 with value: 0.508084.[0m
[32m[I 2022-10-20 14:53:25,206][0m Trial 89 finished with value: 0.12388641062088446 and parameters: {'p_penalty': 'elasticnet', 'p_alpha': 0.002146917815175583, 'p_eta0': 1.5, 'p_early_stopping': True, 'p_validation_fraction': 0.25, 'p_n_iter_no_change': 10}. Best is trial 54 with value: 0.508084.[0m
[32m[I 2022-10-20 14:53:25,206][0m Trial 87 finished with value: 0.2844441188051378 and parameters: {'p_penalty': 'elasticnet', 'p_alpha': 0.00012917914588301356, 'p_eta0': 1.5, 'p_early_stopping': True, 'p_validation_fraction': 0.25, 'p_n_iter_no_change': 10}. Best is trial 54 with value: 0.508084.[0m
[32m[I 2022-10-20 14:53:25,365][0m Trial 90 finished with value: 0.20386300811451769 and parameters: {'p_penalty': 'elasticnet', 'p_alpha': 0.002328549310651258, 'p_eta0': 1.5, 'p_early_stopping': True, 'p_validation_fraction': 0.25, 'p_n_iter_no_change': 10}. Best is trial 54 with value: 0.508084.[0m
[32m[I 2022-10-20 14:53:26,264][0m Trial 88 finished with value: 0.2844441188051378 and parameters: {'p_penalty': 'elasticnet', 'p_alpha': 0.0015028971941572994, 'p_eta0': 1.5, 'p_early_stopping': True, 'p_validation_fraction': 0.25, 'p_n_iter_no_change': 10}. Best is trial 54 with value: 0.508084.[0m
[32m[I 2022-10-20 14:53:27,004][0m Trial 91 finished with value: 0.12388641062088446 and parameters: {'p_penalty': 'elasticnet', 'p_alpha': 0.0019617422132582035, 'p_eta0': 1.5, 'p_early_stopping': True, 'p_validation_fraction': 0.25, 'p_n_iter_no_change': 10}. Best is trial 54 with value: 0.508084.[0m
[32m[I 2022-10-20 14:53:30,336][0m Trial 92 finished with value: 0.20208810423974372 and parameters: {'p_penalty': 'elasticnet', 'p_alpha': 0.0017086541208747041, 'p_eta0': 1.5, 'p_early_stopping': True, 'p_validation_fraction': 0.25, 'p_n_iter_no_change': 10}. Best is trial 54 with value: 0.508084.[0m
[32m[I 2022-10-20 14:53:36,376][0m Trial 93 finished with value: 0.4239852986873677 and parameters: {'p_penalty': 'elasticnet', 'p_alpha': 0.0020417028102076348, 'p_eta0': 1.5, 'p_early_stopping': True, 'p_validation_fraction': 0.25, 'p_n_iter_no_change': 10}. Best is trial 54 with value: 0.508084.[0m
[32m[I 2022-10-20 14:53:37,443][0m Trial 94 finished with value: 0.2844441188051378 and parameters: {'p_penalty': 'elasticnet', 'p_alpha': 0.0008287251125559942, 'p_eta0': 1.5, 'p_early_stopping': True, 'p_validation_fraction': 0.25, 'p_n_iter_no_change': 10}. Best is trial 54 with value: 0.508084.[0m
[32m[I 2022-10-20 14:53:38,002][0m Trial 96 finished with value: 0.021200059216612974 and parameters: {'p_penalty': 'elasticnet', 'p_alpha': 0.0009167267000493803, 'p_eta0': 1.0, 'p_early_stopping': True, 'p_validation_fraction': 0.25, 'p_n_iter_no_change': 10}. Best is trial 54 with value: 0.508084.[0m
[32m[I 2022-10-20 14:53:38,240][0m Trial 95 finished with value: 0.4649880515332671 and parameters: {'p_penalty': 'elasticnet', 'p_alpha': 0.006288102126910039, 'p_eta0': 1.0, 'p_early_stopping': True, 'p_validation_fraction': 0.25, 'p_n_iter_no_change': 10}. Best is trial 54 with value: 0.508084.[0m
