[32m[I 2022-10-20 12:20:15,896][0m Trial 96 finished with value: 0.2844441188051378 and parameters: {'lsvc_rbfs_kernel_gamma': 0.008710792988093614, 'lsvc_rbfs_kernel_n_components': 100, 'lsvc_rbfs_dual': False, 'lsvc_rbfs_C': 46.924856886435606, 'lsvc_rbfs_max_iter': 2000}. Best is trial 0 with value: 0.284444.[0m
[32m[I 2022-10-20 12:20:26,782][0m Trial 97 finished with value: 0.2844441188051378 and parameters: {'lsvc_rbfs_kernel_gamma': 0.013042158841002708, 'lsvc_rbfs_kernel_n_components': 100, 'lsvc_rbfs_dual': False, 'lsvc_rbfs_C': 132.48514293802674, 'lsvc_rbfs_max_iter': 2000}. Best is trial 0 with value: 0.284444.[0m
[32m[I 2022-10-20 12:20:41,094][0m Trial 98 finished with value: 0.2844441188051378 and parameters: {'lsvc_rbfs_kernel_gamma': 0.0060686842588496825, 'lsvc_rbfs_kernel_n_components': 100, 'lsvc_rbfs_dual': False, 'lsvc_rbfs_C': 89.59067842258683, 'lsvc_rbfs_max_iter': 2000}. Best is trial 0 with value: 0.284444.[0m
[32m[I 2022-10-20 12:20:53,329][0m Trial 99 finished with value: 0.2844441188051378 and parameters: {'lsvc_rbfs_kernel_gamma': 0.02102675450365417, 'lsvc_rbfs_kernel_n_components': 100, 'lsvc_rbfs_dual': False, 'lsvc_rbfs_C': 57.61943196052727, 'lsvc_rbfs_max_iter': 2000}. Best is trial 0 with value: 0.284444.[0m
[32m[I 2022-10-20 12:20:53,391][0m Study finished.[0m
[32m[I 2022-10-20 12:20:53,469][0m --------------------------------------------------------------------------------[0m
[32m[I 2022-10-20 12:20:53,469][0m --------------------             MLPClassifier              --------------------[0m
[32m[I 2022-10-20 12:20:53,469][0m --------------------------------------------------------------------------------[0m
[32m[I 2022-10-20 12:20:53,501][0m A new study created in RDB with name: MLPClassifier_b4f53b70[0m
[32m[I 2022-10-20 12:20:53,517][0m Study started.[0m
[32m[I 2022-10-20 12:20:53,829][0m sklearn.model_selection.train_test_split: running accelerated version on CPU[0m
[32m[I 2022-10-20 12:20:53,896][0m sklearn.model_selection.train_test_split: fallback to original Scikit-learn[0m
[32m[I 2022-10-20 12:20:53,959][0m sklearn.model_selection.train_test_split: running accelerated version on CPU[0m
[32m[I 2022-10-20 12:20:54,007][0m sklearn.model_selection.train_test_split: fallback to original Scikit-learn[0m
[32m[I 2022-10-20 12:20:54,007][0m sklearn.model_selection.train_test_split: running accelerated version on CPU[0m
[32m[I 2022-10-20 12:20:54,073][0m sklearn.model_selection.train_test_split: fallback to original Scikit-learn[0m
[32m[I 2022-10-20 12:20:54,105][0m sklearn.model_selection.train_test_split: running accelerated version on CPU[0m
[32m[I 2022-10-20 12:20:54,191][0m sklearn.model_selection.train_test_split: fallback to original Scikit-learn[0m
[32m[I 2022-10-20 12:20:54,215][0m sklearn.model_selection.train_test_split: running accelerated version on CPU[0m
[32m[I 2022-10-20 12:20:54,230][0m sklearn.model_selection.train_test_split: running accelerated version on CPU[0m
[32m[I 2022-10-20 12:20:54,246][0m sklearn.model_selection.train_test_split: running accelerated version on CPU[0m
[32m[I 2022-10-20 12:20:54,301][0m sklearn.model_selection.train_test_split: fallback to original Scikit-learn[0m
[32m[I 2022-10-20 12:20:54,317][0m sklearn.model_selection.train_test_split: running accelerated version on CPU[0m
[32m[I 2022-10-20 12:20:54,380][0m sklearn.model_selection.train_test_split: fallback to original Scikit-learn[0m
[32m[I 2022-10-20 12:20:54,437][0m sklearn.model_selection.train_test_split: fallback to original Scikit-learn[0m
[32m[I 2022-10-20 12:20:54,519][0m sklearn.model_selection.train_test_split: fallback to original Scikit-learn[0m
[32m[I 2022-10-20 12:23:12,289][0m Trial 7 finished with value: 0.952062211279477 and parameters: {'mlpc_hidden_layer_count': 1, 'mlpc_learning_rate': 'constant', 'mlpc_learning_rate_init': 0.008291524934087965, 'mplc_max_iter': 2000}. Best is trial 7 with value: 0.952062.[0m
[32m[I 2022-10-20 12:23:12,576][0m sklearn.model_selection.train_test_split: running accelerated version on CPU[0m
[32m[I 2022-10-20 12:23:12,626][0m sklearn.model_selection.train_test_split: fallback to original Scikit-learn[0m
[32m[I 2022-10-20 12:26:05,866][0m Trial 0 finished with value: 0.2844441188051378 and parameters: {'mlpc_hidden_layer_count': 2, 'mlpc_learning_rate': 'invscaling', 'mlpc_learning_rate_init': 0.4703415431879102, 'mplc_max_iter': 2000}. Best is trial 7 with value: 0.952062.[0m
[32m[I 2022-10-20 12:26:06,121][0m sklearn.model_selection.train_test_split: running accelerated version on CPU[0m
[32m[I 2022-10-20 12:26:06,169][0m sklearn.model_selection.train_test_split: fallback to original Scikit-learn[0m
[32m[I 2022-10-20 12:29:00,282][0m Trial 1 finished with value: 0.9466418903266356 and parameters: {'mlpc_hidden_layer_count': 2, 'mlpc_learning_rate': 'constant', 'mlpc_learning_rate_init': 0.0010576118710390126, 'mplc_max_iter': 2000}. Best is trial 7 with value: 0.952062.[0m
[32m[I 2022-10-20 12:29:00,573][0m sklearn.model_selection.train_test_split: running accelerated version on CPU[0m
[32m[I 2022-10-20 12:29:00,605][0m sklearn.model_selection.train_test_split: fallback to original Scikit-learn[0m
[32m[I 2022-10-20 12:29:42,721][0m Trial 5 finished with value: 0.6930951008525398 and parameters: {'mlpc_hidden_layer_count': 3, 'mlpc_learning_rate': 'invscaling', 'mlpc_learning_rate_init': 0.004178552322564083, 'mplc_max_iter': 2000}. Best is trial 7 with value: 0.952062.[0m
[32m[I 2022-10-20 12:29:42,968][0m sklearn.model_selection.train_test_split: running accelerated version on CPU[0m
[32m[I 2022-10-20 12:29:43,002][0m sklearn.model_selection.train_test_split: fallback to original Scikit-learn[0m
[32m[I 2022-10-20 12:29:45,061][0m Trial 3 finished with value: 0.2844441188051378 and parameters: {'mlpc_hidden_layer_count': 3, 'mlpc_learning_rate': 'adaptive', 'mlpc_learning_rate_init': 0.18066538627300083, 'mplc_max_iter': 2000}. Best is trial 7 with value: 0.952062.[0m
[32m[I 2022-10-20 12:29:45,310][0m sklearn.model_selection.train_test_split: running accelerated version on CPU[0m
[32m[I 2022-10-20 12:29:45,357][0m sklearn.model_selection.train_test_split: fallback to original Scikit-learn[0m
[32m[I 2022-10-20 12:31:08,708][0m Trial 9 finished with value: 0.2844441188051378 and parameters: {'mlpc_hidden_layer_count': 2, 'mlpc_learning_rate': 'invscaling', 'mlpc_learning_rate_init': 0.0327636813193331, 'mplc_max_iter': 2000}. Best is trial 7 with value: 0.952062.[0m
[32m[I 2022-10-20 12:31:08,958][0m sklearn.model_selection.train_test_split: running accelerated version on CPU[0m
[32m[I 2022-10-20 12:31:08,995][0m sklearn.model_selection.train_test_split: fallback to original Scikit-learn[0m
[32m[I 2022-10-20 12:31:33,973][0m Trial 11 finished with value: 0.7836337808491046 and parameters: {'mlpc_hidden_layer_count': 1, 'mlpc_learning_rate': 'constant', 'mlpc_learning_rate_init': 0.011566451353228238, 'mplc_max_iter': 2000}. Best is trial 7 with value: 0.952062.[0m
[32m[I 2022-10-20 12:31:34,215][0m sklearn.model_selection.train_test_split: running accelerated version on CPU[0m
[32m[I 2022-10-20 12:31:34,269][0m sklearn.model_selection.train_test_split: fallback to original Scikit-learn[0m
[32m[I 2022-10-20 12:31:36,193][0m Trial 12 finished with value: 0.7457083478520137 and parameters: {'mlpc_hidden_layer_count': 1, 'mlpc_learning_rate': 'constant', 'mlpc_learning_rate_init': 0.01995549439041793, 'mplc_max_iter': 2000}. Best is trial 7 with value: 0.952062.[0m
[32m[I 2022-10-20 12:31:36,452][0m sklearn.model_selection.train_test_split: running accelerated version on CPU[0m
[32m[I 2022-10-20 12:31:36,499][0m sklearn.model_selection.train_test_split: fallback to original Scikit-learn[0m
[32m[I 2022-10-20 12:31:58,851][0m Trial 8 finished with value: 0.2844441188051378 and parameters: {'mlpc_hidden_layer_count': 3, 'mlpc_learning_rate': 'invscaling', 'mlpc_learning_rate_init': 0.26344491625505934, 'mplc_max_iter': 2000}. Best is trial 7 with value: 0.952062.[0m
[32m[I 2022-10-20 12:31:59,097][0m sklearn.model_selection.train_test_split: running accelerated version on CPU[0m
[32m[I 2022-10-20 12:31:59,144][0m sklearn.model_selection.train_test_split: fallback to original Scikit-learn[0m
[32m[I 2022-10-20 12:34:55,386][0m Trial 4 finished with value: 0.9862012874551482 and parameters: {'mlpc_hidden_layer_count': 1, 'mlpc_learning_rate': 'constant', 'mlpc_learning_rate_init': 1.7764103406646471e-06, 'mplc_max_iter': 2000}. Best is trial 4 with value: 0.986201.[0m
[32m[I 2022-10-20 12:34:55,642][0m sklearn.model_selection.train_test_split: running accelerated version on CPU[0m
[32m[I 2022-10-20 12:34:55,690][0m sklearn.model_selection.train_test_split: fallback to original Scikit-learn[0m
[32m[I 2022-10-20 12:39:28,297][0m Trial 6 finished with value: 0.9759674566748522 and parameters: {'mlpc_hidden_layer_count': 3, 'mlpc_learning_rate': 'invscaling', 'mlpc_learning_rate_init': 1.6028723554736684e-05, 'mplc_max_iter': 2000}. Best is trial 4 with value: 0.986201.[0m
[32m[I 2022-10-20 12:39:28,558][0m sklearn.model_selection.train_test_split: running accelerated version on CPU[0m
[32m[I 2022-10-20 12:39:28,590][0m sklearn.model_selection.train_test_split: fallback to original Scikit-learn[0m
[32m[I 2022-10-20 12:41:15,340][0m Trial 14 finished with value: 0.9356573057441523 and parameters: {'mlpc_hidden_layer_count': 2, 'mlpc_learning_rate': 'adaptive', 'mlpc_learning_rate_init': 0.0006271431732707798, 'mplc_max_iter': 2000}. Best is trial 4 with value: 0.986201.[0m
[32m[I 2022-10-20 12:41:15,620][0m sklearn.model_selection.train_test_split: running accelerated version on CPU[0m
[32m[I 2022-10-20 12:41:15,668][0m sklearn.model_selection.train_test_split: fallback to original Scikit-learn[0m
[32m[I 2022-10-20 12:45:41,325][0m Trial 2 finished with value: 0.9895549470386156 and parameters: {'mlpc_hidden_layer_count': 2, 'mlpc_learning_rate': 'constant', 'mlpc_learning_rate_init': 0.00027020170280399265, 'mplc_max_iter': 2000}. Best is trial 2 with value: 0.989555.[0m
[32m[I 2022-10-20 12:45:41,620][0m sklearn.model_selection.train_test_split: running accelerated version on CPU[0m
[32m[I 2022-10-20 12:45:41,668][0m sklearn.model_selection.train_test_split: fallback to original Scikit-learn[0m
[32m[I 2022-10-20 12:50:47,216][0m Trial 10 finished with value: 0.9883774128333254 and parameters: {'mlpc_hidden_layer_count': 2, 'mlpc_learning_rate': 'constant', 'mlpc_learning_rate_init': 0.00014365232809777115, 'mplc_max_iter': 2000}. Best is trial 2 with value: 0.989555.[0m
[32m[I 2022-10-20 12:50:47,455][0m sklearn.model_selection.train_test_split: running accelerated version on CPU[0m
[32m[I 2022-10-20 12:50:47,502][0m sklearn.model_selection.train_test_split: fallback to original Scikit-learn[0m
[32m[I 2022-10-20 12:52:55,343][0m Trial 17 finished with value: 0.9870839840036071 and parameters: {'mlpc_hidden_layer_count': 1, 'mlpc_learning_rate': 'adaptive', 'mlpc_learning_rate_init': 1.4996564539818765e-06, 'mplc_max_iter': 2000}. Best is trial 2 with value: 0.989555.[0m
[32m[I 2022-10-20 12:52:55,597][0m sklearn.model_selection.train_test_split: running accelerated version on CPU[0m
[32m[I 2022-10-20 12:52:55,645][0m sklearn.model_selection.train_test_split: fallback to original Scikit-learn[0m
[32m[I 2022-10-20 12:56:34,711][0m Trial 19 finished with value: 0.9871292324427631 and parameters: {'mlpc_hidden_layer_count': 1, 'mlpc_learning_rate': 'invscaling', 'mlpc_learning_rate_init': 1.9883935598739825e-06, 'mplc_max_iter': 2000}. Best is trial 2 with value: 0.989555.[0m
[32m[I 2022-10-20 12:56:34,996][0m sklearn.model_selection.train_test_split: running accelerated version on CPU[0m
[32m[I 2022-10-20 12:56:35,029][0m sklearn.model_selection.train_test_split: fallback to original Scikit-learn[0m
[32m[I 2022-10-20 12:56:54,221][0m Trial 20 finished with value: 0.9897656302550161 and parameters: {'mlpc_hidden_layer_count': 1, 'mlpc_learning_rate': 'constant', 'mlpc_learning_rate_init': 4.832236959597112e-06, 'mplc_max_iter': 2000}. Best is trial 20 with value: 0.989766.[0m
[32m[I 2022-10-20 12:56:54,475][0m sklearn.model_selection.train_test_split: running accelerated version on CPU[0m
[32m[I 2022-10-20 12:56:54,507][0m sklearn.model_selection.train_test_split: fallback to original Scikit-learn[0m
[32m[I 2022-10-20 13:02:41,357][0m Trial 21 finished with value: 0.9823204516143896 and parameters: {'mlpc_hidden_layer_count': 2, 'mlpc_learning_rate': 'constant', 'mlpc_learning_rate_init': 6.729708272344163e-05, 'mplc_max_iter': 2000}. Best is trial 20 with value: 0.989766.[0m
[32m[I 2022-10-20 13:02:41,632][0m sklearn.model_selection.train_test_split: running accelerated version on CPU[0m
[32m[I 2022-10-20 13:02:41,691][0m sklearn.model_selection.train_test_split: fallback to original Scikit-learn[0m
[32m[I 2022-10-20 13:05:05,097][0m Trial 15 finished with value: 0.9896876821984714 and parameters: {'mlpc_hidden_layer_count': 3, 'mlpc_learning_rate': 'constant', 'mlpc_learning_rate_init': 6.527666654366713e-06, 'mplc_max_iter': 2000}. Best is trial 20 with value: 0.989766.[0m
[32m[I 2022-10-20 13:05:05,434][0m sklearn.model_selection.train_test_split: running accelerated version on CPU[0m
[32m[I 2022-10-20 13:05:05,480][0m sklearn.model_selection.train_test_split: fallback to original Scikit-learn[0m
[32m[I 2022-10-20 13:05:22,992][0m Trial 16 finished with value: 0.9882459374684472 and parameters: {'mlpc_hidden_layer_count': 3, 'mlpc_learning_rate': 'adaptive', 'mlpc_learning_rate_init': 1.1420427908777882e-05, 'mplc_max_iter': 2000}. Best is trial 20 with value: 0.989766.[0m
[32m[I 2022-10-20 13:05:23,305][0m sklearn.model_selection.train_test_split: running accelerated version on CPU[0m
[32m[I 2022-10-20 13:05:23,349][0m sklearn.model_selection.train_test_split: fallback to original Scikit-learn[0m
[32m[I 2022-10-20 13:08:34,813][0m Trial 18 finished with value: 0.9873705103066575 and parameters: {'mlpc_hidden_layer_count': 2, 'mlpc_learning_rate': 'adaptive', 'mlpc_learning_rate_init': 1.8533909924309965e-06, 'mplc_max_iter': 2000}. Best is trial 20 with value: 0.989766.[0m
[32m[I 2022-10-20 13:08:35,091][0m sklearn.model_selection.train_test_split: running accelerated version on CPU[0m
[32m[I 2022-10-20 13:08:35,139][0m sklearn.model_selection.train_test_split: fallback to original Scikit-learn[0m
[32m[I 2022-10-20 13:09:07,089][0m Trial 24 finished with value: 0.980538901555137 and parameters: {'mlpc_hidden_layer_count': 2, 'mlpc_learning_rate': 'constant', 'mlpc_learning_rate_init': 2.3427516929601332e-05, 'mplc_max_iter': 2000}. Best is trial 20 with value: 0.989766.[0m
[32m[I 2022-10-20 13:09:07,426][0m sklearn.model_selection.train_test_split: running accelerated version on CPU[0m
[32m[I 2022-10-20 13:09:07,458][0m sklearn.model_selection.train_test_split: fallback to original Scikit-learn[0m
[32m[I 2022-10-20 13:09:19,425][0m Trial 22 finished with value: 0.9880444150085396 and parameters: {'mlpc_hidden_layer_count': 2, 'mlpc_learning_rate': 'constant', 'mlpc_learning_rate_init': 9.478579305943933e-05, 'mplc_max_iter': 2000}. Best is trial 20 with value: 0.989766.[0m
[32m[I 2022-10-20 13:09:19,688][0m sklearn.model_selection.train_test_split: running accelerated version on CPU[0m
[32m[I 2022-10-20 13:09:19,736][0m sklearn.model_selection.train_test_split: fallback to original Scikit-learn[0m
[32m[I 2022-10-20 13:10:18,865][0m Trial 25 finished with value: 0.9900934940509564 and parameters: {'mlpc_hidden_layer_count': 1, 'mlpc_learning_rate': 'constant', 'mlpc_learning_rate_init': 1.5536618068975186e-05, 'mplc_max_iter': 2000}. Best is trial 25 with value: 0.990093.[0m
[32m[I 2022-10-20 13:10:19,157][0m sklearn.model_selection.train_test_split: running accelerated version on CPU[0m
[32m[I 2022-10-20 13:10:19,189][0m sklearn.model_selection.train_test_split: fallback to original Scikit-learn[0m
[32m[I 2022-10-20 13:16:52,980][0m Trial 23 finished with value: 0.9880325546992096 and parameters: {'mlpc_hidden_layer_count': 2, 'mlpc_learning_rate': 'constant', 'mlpc_learning_rate_init': 0.00013198459522108529, 'mplc_max_iter': 2000}. Best is trial 25 with value: 0.990093.[0m
[32m[I 2022-10-20 13:16:53,298][0m sklearn.model_selection.train_test_split: running accelerated version on CPU[0m
[32m[I 2022-10-20 13:16:53,346][0m sklearn.model_selection.train_test_split: fallback to original Scikit-learn[0m
[32m[I 2022-10-20 13:22:59,325][0m Trial 13 finished with value: 0.9895295536178126 and parameters: {'mlpc_hidden_layer_count': 3, 'mlpc_learning_rate': 'invscaling', 'mlpc_learning_rate_init': 5.443986641195958e-05, 'mplc_max_iter': 2000}. Best is trial 25 with value: 0.990093.[0m
[32m[I 2022-10-20 13:22:59,587][0m sklearn.model_selection.train_test_split: running accelerated version on CPU[0m
[32m[I 2022-10-20 13:22:59,619][0m sklearn.model_selection.train_test_split: fallback to original Scikit-learn[0m
[32m[I 2022-10-20 13:23:14,833][0m Trial 31 finished with value: 0.990450701657498 and parameters: {'mlpc_hidden_layer_count': 1, 'mlpc_learning_rate': 'constant', 'mlpc_learning_rate_init': 7.03599984186839e-06, 'mplc_max_iter': 2000}. Best is trial 31 with value: 0.990451.[0m
[32m[I 2022-10-20 13:23:15,087][0m sklearn.model_selection.train_test_split: running accelerated version on CPU[0m
[32m[I 2022-10-20 13:23:15,135][0m sklearn.model_selection.train_test_split: fallback to original Scikit-learn[0m
[32m[I 2022-10-20 13:29:56,662][0m Trial 32 finished with value: 0.9904584198517071 and parameters: {'mlpc_hidden_layer_count': 1, 'mlpc_learning_rate': 'constant', 'mlpc_learning_rate_init': 7.090015217076284e-06, 'mplc_max_iter': 2000}. Best is trial 32 with value: 0.990458.[0m
[32m[I 2022-10-20 13:29:56,919][0m sklearn.model_selection.train_test_split: running accelerated version on CPU[0m
[32m[I 2022-10-20 13:29:56,951][0m sklearn.model_selection.train_test_split: fallback to original Scikit-learn[0m
[32m[I 2022-10-20 13:31:24,107][0m Trial 28 finished with value: 0.9854794887665702 and parameters: {'mlpc_hidden_layer_count': 3, 'mlpc_learning_rate': 'constant', 'mlpc_learning_rate_init': 1.2133685645731452e-05, 'mplc_max_iter': 2000}. Best is trial 32 with value: 0.990458.[0m
[32m[I 2022-10-20 13:31:24,406][0m sklearn.model_selection.train_test_split: running accelerated version on CPU[0m
[32m[I 2022-10-20 13:31:24,438][0m sklearn.model_selection.train_test_split: fallback to original Scikit-learn[0m
[32m[I 2022-10-20 13:31:39,244][0m Trial 33 finished with value: 0.9862284889505 and parameters: {'mlpc_hidden_layer_count': 1, 'mlpc_learning_rate': 'constant', 'mlpc_learning_rate_init': 5.83391601997688e-06, 'mplc_max_iter': 2000}. Best is trial 32 with value: 0.990458.[0m
[32m[I 2022-10-20 13:31:39,497][0m sklearn.model_selection.train_test_split: running accelerated version on CPU[0m
[32m[I 2022-10-20 13:31:39,544][0m sklearn.model_selection.train_test_split: fallback to original Scikit-learn[0m
[32m[I 2022-10-20 13:35:31,400][0m Trial 34 finished with value: 0.9897350298284939 and parameters: {'mlpc_hidden_layer_count': 1, 'mlpc_learning_rate': 'constant', 'mlpc_learning_rate_init': 5.648454101877105e-06, 'mplc_max_iter': 2000}. Best is trial 32 with value: 0.990458.[0m
[32m[I 2022-10-20 13:35:31,650][0m sklearn.model_selection.train_test_split: running accelerated version on CPU[0m
[32m[I 2022-10-20 13:35:31,698][0m sklearn.model_selection.train_test_split: fallback to original Scikit-learn[0m
[32m[I 2022-10-20 13:35:58,150][0m Trial 36 finished with value: 0.9849005995419151 and parameters: {'mlpc_hidden_layer_count': 1, 'mlpc_learning_rate': 'constant', 'mlpc_learning_rate_init': 3.28265334845208e-05, 'mplc_max_iter': 2000}. Best is trial 32 with value: 0.990458.[0m
[32m[I 2022-10-20 13:35:58,398][0m sklearn.model_selection.train_test_split: running accelerated version on CPU[0m
[32m[I 2022-10-20 13:35:58,449][0m sklearn.model_selection.train_test_split: fallback to original Scikit-learn[0m
[32m[I 2022-10-20 13:37:30,268][0m Trial 35 finished with value: 0.9903688339417704 and parameters: {'mlpc_hidden_layer_count': 1, 'mlpc_learning_rate': 'constant', 'mlpc_learning_rate_init': 2.982119034291899e-05, 'mplc_max_iter': 2000}. Best is trial 32 with value: 0.990458.[0m
[32m[I 2022-10-20 13:37:30,545][0m sklearn.model_selection.train_test_split: running accelerated version on CPU[0m
[32m[I 2022-10-20 13:37:30,598][0m sklearn.model_selection.train_test_split: fallback to original Scikit-learn[0m
[32m[I 2022-10-20 13:37:50,490][0m Trial 30 finished with value: 0.9880554013088076 and parameters: {'mlpc_hidden_layer_count': 3, 'mlpc_learning_rate': 'constant', 'mlpc_learning_rate_init': 8.707790063009322e-06, 'mplc_max_iter': 2000}. Best is trial 32 with value: 0.990458.[0m
[32m[I 2022-10-20 13:37:50,760][0m sklearn.model_selection.train_test_split: running accelerated version on CPU[0m
[32m[I 2022-10-20 13:37:50,808][0m sklearn.model_selection.train_test_split: fallback to original Scikit-learn[0m
[32m[I 2022-10-20 13:38:17,805][0m Trial 37 finished with value: 0.988304538938377 and parameters: {'mlpc_hidden_layer_count': 1, 'mlpc_learning_rate': 'constant', 'mlpc_learning_rate_init': 3.937716077865012e-05, 'mplc_max_iter': 2000}. Best is trial 32 with value: 0.990458.[0m
[32m[I 2022-10-20 13:38:18,059][0m sklearn.model_selection.train_test_split: running accelerated version on CPU[0m
[32m[I 2022-10-20 13:38:18,106][0m sklearn.model_selection.train_test_split: fallback to original Scikit-learn[0m
