[32m[I 2022-10-20 05:10:01,591][0m Trial 83 finished with value: 0.8773397842327134 and parameters: {'lsvc_dual': False, 'lsvc_C': 0.0007585102802317703, 'lsvc_max_iter': 2000}. Best is trial 43 with value: 0.92966.[0m
[32m[I 2022-10-20 05:10:17,623][0m Trial 84 finished with value: 0.8268700094874029 and parameters: {'lsvc_dual': False, 'lsvc_C': 0.00032117000757068834, 'lsvc_max_iter': 2000}. Best is trial 43 with value: 0.92966.[0m
[32m[I 2022-10-20 05:10:31,822][0m Trial 85 finished with value: 0.8788943243387458 and parameters: {'lsvc_dual': False, 'lsvc_C': 9.170278183031163e-06, 'lsvc_max_iter': 2000}. Best is trial 43 with value: 0.92966.[0m
[32m[I 2022-10-20 05:10:47,836][0m Trial 86 finished with value: 0.8279434472820545 and parameters: {'lsvc_dual': False, 'lsvc_C': 0.0019067419148134249, 'lsvc_max_iter': 2000}. Best is trial 43 with value: 0.92966.[0m
[32m[I 2022-10-20 05:11:02,185][0m Trial 87 finished with value: 0.8277300409333151 and parameters: {'lsvc_dual': False, 'lsvc_C': 5.258489445105743e-05, 'lsvc_max_iter': 2000}. Best is trial 43 with value: 0.92966.[0m
[32m[I 2022-10-20 05:11:19,896][0m Trial 88 finished with value: 0.8279502575535633 and parameters: {'lsvc_dual': False, 'lsvc_C': 42.37666886430591, 'lsvc_max_iter': 2000}. Best is trial 43 with value: 0.92966.[0m
[32m[I 2022-10-20 05:11:37,980][0m Trial 89 finished with value: 0.8281228480930922 and parameters: {'lsvc_dual': False, 'lsvc_C': 2.5769864112609655, 'lsvc_max_iter': 2000}. Best is trial 43 with value: 0.92966.[0m
[32m[I 2022-10-20 05:11:55,871][0m Trial 90 finished with value: 0.8283345222633886 and parameters: {'lsvc_dual': False, 'lsvc_C': 1.9352368752880933e-05, 'lsvc_max_iter': 2000}. Best is trial 43 with value: 0.92966.[0m
[32m[I 2022-10-20 05:12:14,481][0m Trial 91 finished with value: 0.8783114136843309 and parameters: {'lsvc_dual': False, 'lsvc_C': 0.00018977418722452682, 'lsvc_max_iter': 2000}. Best is trial 43 with value: 0.92966.[0m
[32m[I 2022-10-20 05:12:29,392][0m Trial 92 finished with value: 0.8250235675365646 and parameters: {'lsvc_dual': False, 'lsvc_C': 0.0007232560911655866, 'lsvc_max_iter': 2000}. Best is trial 43 with value: 0.92966.[0m
[32m[I 2022-10-20 05:12:46,293][0m Trial 93 finished with value: 0.8456836190668603 and parameters: {'lsvc_dual': False, 'lsvc_C': 0.00020531801142845775, 'lsvc_max_iter': 2000}. Best is trial 43 with value: 0.92966.[0m
[32m[I 2022-10-20 05:13:02,537][0m Trial 94 finished with value: 0.8274260836911859 and parameters: {'lsvc_dual': False, 'lsvc_C': 0.000270670963568643, 'lsvc_max_iter': 2000}. Best is trial 43 with value: 0.92966.[0m
[32m[I 2022-10-20 05:13:19,637][0m Trial 95 finished with value: 0.8346409029968334 and parameters: {'lsvc_dual': False, 'lsvc_C': 8.988019329721568e-05, 'lsvc_max_iter': 2000}. Best is trial 43 with value: 0.92966.[0m
[32m[I 2022-10-20 05:13:36,334][0m Trial 96 finished with value: 0.8276829588918015 and parameters: {'lsvc_dual': False, 'lsvc_C': 5.245083286904062, 'lsvc_max_iter': 2000}. Best is trial 43 with value: 0.92966.[0m
[32m[I 2022-10-20 05:13:50,274][0m Trial 97 finished with value: 0.8785174889098722 and parameters: {'lsvc_dual': False, 'lsvc_C': 3.841759718906608e-05, 'lsvc_max_iter': 2000}. Best is trial 43 with value: 0.92966.[0m
[32m[I 2022-10-20 05:14:04,634][0m Trial 98 finished with value: 0.8276960033283292 and parameters: {'lsvc_dual': False, 'lsvc_C': 0.00011821167899012008, 'lsvc_max_iter': 2000}. Best is trial 43 with value: 0.92966.[0m
[32m[I 2022-10-20 05:14:23,164][0m Trial 99 finished with value: 0.8287125430500698 and parameters: {'lsvc_dual': False, 'lsvc_C': 0.0037796715370439484, 'lsvc_max_iter': 2000}. Best is trial 43 with value: 0.92966.[0m
[32m[I 2022-10-20 05:14:23,226][0m Study finished.[0m
[32m[I 2022-10-20 05:14:23,289][0m --------------------------------------------------------------------------------[0m
[32m[I 2022-10-20 05:14:23,289][0m --------------------     LinearSVC_AdditiveChi2Sampler      --------------------[0m
[32m[I 2022-10-20 05:14:23,289][0m --------------------------------------------------------------------------------[0m
[32m[I 2022-10-20 05:14:23,320][0m A new study created in RDB with name: LinearSVC_AdditiveChi2Sampler_b4f53b70[0m
[32m[I 2022-10-20 05:14:23,335][0m Study started.[0m
[32m[I 2022-10-20 05:15:06,710][0m Trial 0 finished with value: 0.9898259483275941 and parameters: {'lsvc_ac2s_kernel_sample_steps': 3, 'lsvc_ac2s_dual': False, 'lsvc_ac2s_C': 1.0106573582927223, 'lsvc_ac2s_max_iter': 2000}. Best is trial 0 with value: 0.989826.[0m
[32m[I 2022-10-20 05:15:33,958][0m Trial 1 finished with value: 0.984196315675692 and parameters: {'lsvc_ac2s_kernel_sample_steps': 3, 'lsvc_ac2s_dual': False, 'lsvc_ac2s_C': 2.2107729050217935e-05, 'lsvc_ac2s_max_iter': 2000}. Best is trial 0 with value: 0.989826.[0m
[32m[I 2022-10-20 05:15:42,556][0m Trial 2 finished with value: 0.8666734344033404 and parameters: {'lsvc_ac2s_kernel_sample_steps': 1, 'lsvc_ac2s_dual': False, 'lsvc_ac2s_C': 0.01375797405939651, 'lsvc_ac2s_max_iter': 2000}. Best is trial 0 with value: 0.989826.[0m
[32m[I 2022-10-20 05:15:48,875][0m Trial 3 finished with value: 0.8439272370952259 and parameters: {'lsvc_ac2s_kernel_sample_steps': 1, 'lsvc_ac2s_dual': False, 'lsvc_ac2s_C': 7.645323844395278e-05, 'lsvc_ac2s_max_iter': 2000}. Best is trial 0 with value: 0.989826.[0m
[32m[I 2022-10-20 05:16:04,862][0m Trial 4 finished with value: 0.9521486748981897 and parameters: {'lsvc_ac2s_kernel_sample_steps': 2, 'lsvc_ac2s_dual': False, 'lsvc_ac2s_C': 1.7320353665317637e-05, 'lsvc_ac2s_max_iter': 2000}. Best is trial 0 with value: 0.989826.[0m
[32m[I 2022-10-20 05:16:44,221][0m Trial 5 finished with value: 0.9889152708645592 and parameters: {'lsvc_ac2s_kernel_sample_steps': 3, 'lsvc_ac2s_dual': False, 'lsvc_ac2s_C': 0.010273196401437612, 'lsvc_ac2s_max_iter': 2000}. Best is trial 0 with value: 0.989826.[0m
[32m[I 2022-10-20 05:17:02,946][0m Trial 6 finished with value: 0.9819893040191648 and parameters: {'lsvc_ac2s_kernel_sample_steps': 2, 'lsvc_ac2s_dual': False, 'lsvc_ac2s_C': 9.24433251461329e-05, 'lsvc_ac2s_max_iter': 2000}. Best is trial 0 with value: 0.989826.[0m
[32m[I 2022-10-20 05:17:23,675][0m Trial 7 finished with value: 0.9845087224458013 and parameters: {'lsvc_ac2s_kernel_sample_steps': 2, 'lsvc_ac2s_dual': False, 'lsvc_ac2s_C': 0.00012677154315580343, 'lsvc_ac2s_max_iter': 2000}. Best is trial 0 with value: 0.989826.[0m
[32m[I 2022-10-20 05:17:31,819][0m Trial 8 finished with value: 0.8592642920615688 and parameters: {'lsvc_ac2s_kernel_sample_steps': 1, 'lsvc_ac2s_dual': False, 'lsvc_ac2s_C': 0.0026158686421634968, 'lsvc_ac2s_max_iter': 2000}. Best is trial 0 with value: 0.989826.[0m
[32m[I 2022-10-20 05:18:09,421][0m Trial 9 finished with value: 0.9889993656468838 and parameters: {'lsvc_ac2s_kernel_sample_steps': 3, 'lsvc_ac2s_dual': False, 'lsvc_ac2s_C': 852.7084975861526, 'lsvc_ac2s_max_iter': 2000}. Best is trial 0 with value: 0.989826.[0m
[32m[I 2022-10-20 05:18:54,542][0m Trial 10 finished with value: 0.9892744613214923 and parameters: {'lsvc_ac2s_kernel_sample_steps': 3, 'lsvc_ac2s_dual': False, 'lsvc_ac2s_C': 6.82659459462825, 'lsvc_ac2s_max_iter': 2000}. Best is trial 0 with value: 0.989826.[0m
[32m[I 2022-10-20 05:19:37,447][0m Trial 11 finished with value: 0.9899475248950502 and parameters: {'lsvc_ac2s_kernel_sample_steps': 3, 'lsvc_ac2s_dual': False, 'lsvc_ac2s_C': 6.509483971643833, 'lsvc_ac2s_max_iter': 2000}. Best is trial 11 with value: 0.989947.[0m
[32m[I 2022-10-20 05:20:17,606][0m Trial 12 finished with value: 0.9890774685074935 and parameters: {'lsvc_ac2s_kernel_sample_steps': 3, 'lsvc_ac2s_dual': False, 'lsvc_ac2s_C': 2.059333811549428, 'lsvc_ac2s_max_iter': 2000}. Best is trial 11 with value: 0.989947.[0m
[32m[I 2022-10-20 05:21:06,722][0m Trial 13 finished with value: 0.9900707516577614 and parameters: {'lsvc_ac2s_kernel_sample_steps': 3, 'lsvc_ac2s_dual': False, 'lsvc_ac2s_C': 1.4987817994342147, 'lsvc_ac2s_max_iter': 2000}. Best is trial 13 with value: 0.990071.[0m
[32m[I 2022-10-20 05:21:54,731][0m Trial 14 finished with value: 0.9898394421413134 and parameters: {'lsvc_ac2s_kernel_sample_steps': 3, 'lsvc_ac2s_dual': False, 'lsvc_ac2s_C': 103.03824004326808, 'lsvc_ac2s_max_iter': 2000}. Best is trial 13 with value: 0.990071.[0m
[32m[I 2022-10-20 05:22:37,550][0m Trial 15 finished with value: 0.9894206000697822 and parameters: {'lsvc_ac2s_kernel_sample_steps': 3, 'lsvc_ac2s_dual': False, 'lsvc_ac2s_C': 0.2197885134923644, 'lsvc_ac2s_max_iter': 2000}. Best is trial 13 with value: 0.990071.[0m
[32m[I 2022-10-20 05:23:23,596][0m Trial 16 finished with value: 0.9892811889771355 and parameters: {'lsvc_ac2s_kernel_sample_steps': 3, 'lsvc_ac2s_dual': False, 'lsvc_ac2s_C': 47.32230130183937, 'lsvc_ac2s_max_iter': 2000}. Best is trial 13 with value: 0.990071.[0m
[32m[I 2022-10-20 05:24:05,058][0m Trial 17 finished with value: 0.9889523362504458 and parameters: {'lsvc_ac2s_kernel_sample_steps': 3, 'lsvc_ac2s_dual': False, 'lsvc_ac2s_C': 0.14782481226924996, 'lsvc_ac2s_max_iter': 2000}. Best is trial 13 with value: 0.990071.[0m
[32m[I 2022-10-20 05:24:13,912][0m Trial 18 finished with value: 0.8671988814802821 and parameters: {'lsvc_ac2s_kernel_sample_steps': 1, 'lsvc_ac2s_dual': False, 'lsvc_ac2s_C': 31.141957088107905, 'lsvc_ac2s_max_iter': 2000}. Best is trial 13 with value: 0.990071.[0m
[32m[I 2022-10-20 05:24:25,885][0m Trial 19 finished with value: 0.9200025916736881 and parameters: {'lsvc_ac2s_kernel_sample_steps': 2, 'lsvc_ac2s_dual': False, 'lsvc_ac2s_C': 1.6542616437584757e-06, 'lsvc_ac2s_max_iter': 2000}. Best is trial 13 with value: 0.990071.[0m
[32m[I 2022-10-20 05:25:14,188][0m Trial 20 finished with value: 0.9896176935313606 and parameters: {'lsvc_ac2s_kernel_sample_steps': 3, 'lsvc_ac2s_dual': False, 'lsvc_ac2s_C': 742.9674371415027, 'lsvc_ac2s_max_iter': 2000}. Best is trial 13 with value: 0.990071.[0m
[32m[I 2022-10-20 05:25:59,991][0m Trial 21 finished with value: 0.9901999957942869 and parameters: {'lsvc_ac2s_kernel_sample_steps': 3, 'lsvc_ac2s_dual': False, 'lsvc_ac2s_C': 36.699115420187766, 'lsvc_ac2s_max_iter': 2000}. Best is trial 21 with value: 0.9902.[0m
[32m[I 2022-10-20 05:26:51,458][0m Trial 22 finished with value: 0.9892747286307073 and parameters: {'lsvc_ac2s_kernel_sample_steps': 3, 'lsvc_ac2s_dual': False, 'lsvc_ac2s_C': 5.902382274538378, 'lsvc_ac2s_max_iter': 2000}. Best is trial 21 with value: 0.9902.[0m
[32m[I 2022-10-20 05:27:36,397][0m Trial 23 finished with value: 0.9898175141467427 and parameters: {'lsvc_ac2s_kernel_sample_steps': 3, 'lsvc_ac2s_dual': False, 'lsvc_ac2s_C': 0.26503261680357904, 'lsvc_ac2s_max_iter': 2000}. Best is trial 21 with value: 0.9902.[0m
[32m[I 2022-10-20 05:28:26,000][0m Trial 24 finished with value: 0.990008410264136 and parameters: {'lsvc_ac2s_kernel_sample_steps': 3, 'lsvc_ac2s_dual': False, 'lsvc_ac2s_C': 12.485292439351793, 'lsvc_ac2s_max_iter': 2000}. Best is trial 21 with value: 0.9902.[0m
[32m[I 2022-10-20 05:29:10,015][0m Trial 25 finished with value: 0.9891824548631644 and parameters: {'lsvc_ac2s_kernel_sample_steps': 3, 'lsvc_ac2s_dual': False, 'lsvc_ac2s_C': 197.34809882720648, 'lsvc_ac2s_max_iter': 2000}. Best is trial 21 with value: 0.9902.[0m
[32m[I 2022-10-20 05:29:52,356][0m Trial 26 finished with value: 0.9895952930326408 and parameters: {'lsvc_ac2s_kernel_sample_steps': 3, 'lsvc_ac2s_dual': False, 'lsvc_ac2s_C': 22.823182543925398, 'lsvc_ac2s_max_iter': 2000}. Best is trial 21 with value: 0.9902.[0m
[32m[I 2022-10-20 05:30:39,260][0m Trial 27 finished with value: 0.989505509423256 and parameters: {'lsvc_ac2s_kernel_sample_steps': 3, 'lsvc_ac2s_dual': False, 'lsvc_ac2s_C': 0.9610218893597621, 'lsvc_ac2s_max_iter': 2000}. Best is trial 21 with value: 0.9902.[0m
[32m[I 2022-10-20 05:31:02,592][0m Trial 28 finished with value: 0.989588399908633 and parameters: {'lsvc_ac2s_kernel_sample_steps': 2, 'lsvc_ac2s_dual': False, 'lsvc_ac2s_C': 0.09649741879899375, 'lsvc_ac2s_max_iter': 2000}. Best is trial 21 with value: 0.9902.[0m
[32m[I 2022-10-20 05:31:11,439][0m Trial 29 finished with value: 0.8674803900560243 and parameters: {'lsvc_ac2s_kernel_sample_steps': 1, 'lsvc_ac2s_dual': False, 'lsvc_ac2s_C': 1.2210368034194938, 'lsvc_ac2s_max_iter': 2000}. Best is trial 21 with value: 0.9902.[0m
[32m[I 2022-10-20 05:31:59,662][0m Trial 30 finished with value: 0.9900698498815294 and parameters: {'lsvc_ac2s_kernel_sample_steps': 3, 'lsvc_ac2s_dual': False, 'lsvc_ac2s_C': 248.44091937087373, 'lsvc_ac2s_max_iter': 2000}. Best is trial 21 with value: 0.9902.[0m
[32m[I 2022-10-20 05:32:47,565][0m Trial 31 finished with value: 0.9900397947636528 and parameters: {'lsvc_ac2s_kernel_sample_steps': 3, 'lsvc_ac2s_dual': False, 'lsvc_ac2s_C': 237.4935153834927, 'lsvc_ac2s_max_iter': 2000}. Best is trial 21 with value: 0.9902.[0m
[32m[I 2022-10-20 05:33:32,339][0m Trial 32 finished with value: 0.989871492403058 and parameters: {'lsvc_ac2s_kernel_sample_steps': 3, 'lsvc_ac2s_dual': False, 'lsvc_ac2s_C': 174.43341094154144, 'lsvc_ac2s_max_iter': 2000}. Best is trial 21 with value: 0.9902.[0m
[32m[I 2022-10-20 05:34:21,511][0m Trial 33 finished with value: 0.989266174886786 and parameters: {'lsvc_ac2s_kernel_sample_steps': 3, 'lsvc_ac2s_dual': False, 'lsvc_ac2s_C': 360.8409511560788, 'lsvc_ac2s_max_iter': 2000}. Best is trial 21 with value: 0.9902.[0m
[32m[I 2022-10-20 05:35:01,544][0m Trial 34 finished with value: 0.9892813002047495 and parameters: {'lsvc_ac2s_kernel_sample_steps': 3, 'lsvc_ac2s_dual': False, 'lsvc_ac2s_C': 53.19335009833426, 'lsvc_ac2s_max_iter': 2000}. Best is trial 21 with value: 0.9902.[0m
[32m[I 2022-10-20 05:35:41,706][0m Trial 35 finished with value: 0.9895955815231701 and parameters: {'lsvc_ac2s_kernel_sample_steps': 3, 'lsvc_ac2s_dual': False, 'lsvc_ac2s_C': 113.44466779277448, 'lsvc_ac2s_max_iter': 2000}. Best is trial 21 with value: 0.9902.[0m
[32m[I 2022-10-20 05:35:50,732][0m Trial 36 finished with value: 0.8672837566040612 and parameters: {'lsvc_ac2s_kernel_sample_steps': 1, 'lsvc_ac2s_dual': False, 'lsvc_ac2s_C': 2.9941984451689465, 'lsvc_ac2s_max_iter': 2000}. Best is trial 21 with value: 0.9902.[0m
[32m[I 2022-10-20 05:36:42,111][0m Trial 37 finished with value: 0.9900931228575292 and parameters: {'lsvc_ac2s_kernel_sample_steps': 3, 'lsvc_ac2s_dual': False, 'lsvc_ac2s_C': 375.4895608196962, 'lsvc_ac2s_max_iter': 2000}. Best is trial 21 with value: 0.9902.[0m
[32m[I 2022-10-20 05:37:12,796][0m Trial 38 finished with value: 0.9896109902268857 and parameters: {'lsvc_ac2s_kernel_sample_steps': 2, 'lsvc_ac2s_dual': False, 'lsvc_ac2s_C': 18.42015492081233, 'lsvc_ac2s_max_iter': 2000}. Best is trial 21 with value: 0.9902.[0m
[32m[I 2022-10-20 05:37:51,777][0m Trial 39 finished with value: 0.989580722279448 and parameters: {'lsvc_ac2s_kernel_sample_steps': 3, 'lsvc_ac2s_dual': False, 'lsvc_ac2s_C': 956.9288425272507, 'lsvc_ac2s_max_iter': 2000}. Best is trial 21 with value: 0.9902.[0m
[32m[I 2022-10-20 05:38:00,018][0m Trial 40 finished with value: 0.8599602489283125 and parameters: {'lsvc_ac2s_kernel_sample_steps': 1, 'lsvc_ac2s_dual': False, 'lsvc_ac2s_C': 0.0024984187061103326, 'lsvc_ac2s_max_iter': 2000}. Best is trial 21 with value: 0.9902.[0m
[32m[I 2022-10-20 05:38:46,937][0m Trial 41 finished with value: 0.989670192375963 and parameters: {'lsvc_ac2s_kernel_sample_steps': 3, 'lsvc_ac2s_dual': False, 'lsvc_ac2s_C': 374.6271500070571, 'lsvc_ac2s_max_iter': 2000}. Best is trial 21 with value: 0.9902.[0m
[32m[I 2022-10-20 05:39:33,689][0m Trial 42 finished with value: 0.9899840000570223 and parameters: {'lsvc_ac2s_kernel_sample_steps': 3, 'lsvc_ac2s_dual': False, 'lsvc_ac2s_C': 80.48173571505183, 'lsvc_ac2s_max_iter': 2000}. Best is trial 21 with value: 0.9902.[0m
[32m[I 2022-10-20 05:40:16,703][0m Trial 43 finished with value: 0.990054998081119 and parameters: {'lsvc_ac2s_kernel_sample_steps': 3, 'lsvc_ac2s_dual': False, 'lsvc_ac2s_C': 331.90803189861197, 'lsvc_ac2s_max_iter': 2000}. Best is trial 21 with value: 0.9902.[0m
[32m[I 2022-10-20 05:41:00,984][0m Trial 44 finished with value: 0.9897639777731592 and parameters: {'lsvc_ac2s_kernel_sample_steps': 3, 'lsvc_ac2s_dual': False, 'lsvc_ac2s_C': 0.5550324620015552, 'lsvc_ac2s_max_iter': 2000}. Best is trial 21 with value: 0.9902.[0m
[32m[I 2022-10-20 05:41:40,970][0m Trial 45 finished with value: 0.989053056601458 and parameters: {'lsvc_ac2s_kernel_sample_steps': 3, 'lsvc_ac2s_dual': False, 'lsvc_ac2s_C': 465.0630968936745, 'lsvc_ac2s_max_iter': 2000}. Best is trial 21 with value: 0.9902.[0m
[32m[I 2022-10-20 05:42:18,730][0m Trial 46 finished with value: 0.989320510404417 and parameters: {'lsvc_ac2s_kernel_sample_steps': 3, 'lsvc_ac2s_dual': False, 'lsvc_ac2s_C': 0.029771239380073606, 'lsvc_ac2s_max_iter': 2000}. Best is trial 21 with value: 0.9902.[0m
[32m[I 2022-10-20 05:42:42,913][0m Trial 47 finished with value: 0.9894876984347902 and parameters: {'lsvc_ac2s_kernel_sample_steps': 2, 'lsvc_ac2s_dual': False, 'lsvc_ac2s_C': 11.439635694467793, 'lsvc_ac2s_max_iter': 2000}. Best is trial 21 with value: 0.9902.[0m
[32m[I 2022-10-20 05:43:32,257][0m Trial 48 finished with value: 0.9899476680977497 and parameters: {'lsvc_ac2s_kernel_sample_steps': 3, 'lsvc_ac2s_dual': False, 'lsvc_ac2s_C': 55.993567900063184, 'lsvc_ac2s_max_iter': 2000}. Best is trial 21 with value: 0.9902.[0m
[32m[I 2022-10-20 05:44:25,774][0m Trial 49 finished with value: 0.989932889892763 and parameters: {'lsvc_ac2s_kernel_sample_steps': 3, 'lsvc_ac2s_dual': False, 'lsvc_ac2s_C': 3.3958073294502564, 'lsvc_ac2s_max_iter': 2000}. Best is trial 21 with value: 0.9902.[0m
[32m[I 2022-10-20 05:45:11,681][0m Trial 50 finished with value: 0.9889980642915093 and parameters: {'lsvc_ac2s_kernel_sample_steps': 3, 'lsvc_ac2s_dual': False, 'lsvc_ac2s_C': 32.93686522992144, 'lsvc_ac2s_max_iter': 2000}. Best is trial 21 with value: 0.9902.[0m
[32m[I 2022-10-20 05:45:53,317][0m Trial 51 finished with value: 0.9893196593683589 and parameters: {'lsvc_ac2s_kernel_sample_steps': 3, 'lsvc_ac2s_dual': False, 'lsvc_ac2s_C': 243.36867862000716, 'lsvc_ac2s_max_iter': 2000}. Best is trial 21 with value: 0.9902.[0m
[32m[I 2022-10-20 05:46:42,050][0m Trial 52 finished with value: 0.9891656016985502 and parameters: {'lsvc_ac2s_kernel_sample_steps': 3, 'lsvc_ac2s_dual': False, 'lsvc_ac2s_C': 127.71646272947535, 'lsvc_ac2s_max_iter': 2000}. Best is trial 21 with value: 0.9902.[0m
[32m[I 2022-10-20 05:47:30,542][0m Trial 53 finished with value: 0.9892363215040125 and parameters: {'lsvc_ac2s_kernel_sample_steps': 3, 'lsvc_ac2s_dual': False, 'lsvc_ac2s_C': 632.7162330006573, 'lsvc_ac2s_max_iter': 2000}. Best is trial 21 with value: 0.9902.[0m
[32m[I 2022-10-20 05:48:12,702][0m Trial 54 finished with value: 0.9891308316977449 and parameters: {'lsvc_ac2s_kernel_sample_steps': 3, 'lsvc_ac2s_dual': False, 'lsvc_ac2s_C': 229.9875342918295, 'lsvc_ac2s_max_iter': 2000}. Best is trial 21 with value: 0.9902.[0m
[32m[I 2022-10-20 05:49:03,267][0m Trial 55 finished with value: 0.9891359511239104 and parameters: {'lsvc_ac2s_kernel_sample_steps': 3, 'lsvc_ac2s_dual': False, 'lsvc_ac2s_C': 76.19218017027286, 'lsvc_ac2s_max_iter': 2000}. Best is trial 21 with value: 0.9902.[0m
[32m[I 2022-10-20 05:49:12,098][0m Trial 56 finished with value: 0.8621130290436163 and parameters: {'lsvc_ac2s_kernel_sample_steps': 1, 'lsvc_ac2s_dual': False, 'lsvc_ac2s_C': 0.0028857053225407234, 'lsvc_ac2s_max_iter': 2000}. Best is trial 21 with value: 0.9902.[0m
[32m[I 2022-10-20 05:50:00,372][0m Trial 57 finished with value: 0.9893582685040252 and parameters: {'lsvc_ac2s_kernel_sample_steps': 3, 'lsvc_ac2s_dual': False, 'lsvc_ac2s_C': 945.813508856273, 'lsvc_ac2s_max_iter': 2000}. Best is trial 21 with value: 0.9902.[0m
[32m[I 2022-10-20 05:50:23,753][0m Trial 58 finished with value: 0.9895487897703883 and parameters: {'lsvc_ac2s_kernel_sample_steps': 2, 'lsvc_ac2s_dual': False, 'lsvc_ac2s_C': 7.408542382128764, 'lsvc_ac2s_max_iter': 2000}. Best is trial 21 with value: 0.9902.[0m
[32m[I 2022-10-20 05:51:18,735][0m Trial 59 finished with value: 0.9900309979762436 and parameters: {'lsvc_ac2s_kernel_sample_steps': 3, 'lsvc_ac2s_dual': False, 'lsvc_ac2s_C': 31.339257572814663, 'lsvc_ac2s_max_iter': 2000}. Best is trial 21 with value: 0.9902.[0m
[32m[I 2022-10-20 05:52:04,870][0m Trial 60 finished with value: 0.989389236647224 and parameters: {'lsvc_ac2s_kernel_sample_steps': 3, 'lsvc_ac2s_dual': False, 'lsvc_ac2s_C': 306.94835414977774, 'lsvc_ac2s_max_iter': 2000}. Best is trial 21 with value: 0.9902.[0m
[32m[I 2022-10-20 05:52:53,155][0m Trial 61 finished with value: 0.9899001503432221 and parameters: {'lsvc_ac2s_kernel_sample_steps': 3, 'lsvc_ac2s_dual': False, 'lsvc_ac2s_C': 25.871100675704398, 'lsvc_ac2s_max_iter': 2000}. Best is trial 21 with value: 0.9902.[0m
[32m[I 2022-10-20 05:53:39,468][0m Trial 62 finished with value: 0.9893730518958151 and parameters: {'lsvc_ac2s_kernel_sample_steps': 3, 'lsvc_ac2s_dual': False, 'lsvc_ac2s_C': 55.28021665428262, 'lsvc_ac2s_max_iter': 2000}. Best is trial 21 with value: 0.9902.[0m
[32m[I 2022-10-20 05:54:16,871][0m Trial 63 finished with value: 0.9891439369355504 and parameters: {'lsvc_ac2s_kernel_sample_steps': 3, 'lsvc_ac2s_dual': False, 'lsvc_ac2s_C': 138.15111019492394, 'lsvc_ac2s_max_iter': 2000}. Best is trial 21 with value: 0.9902.[0m
[32m[I 2022-10-20 05:55:05,683][0m Trial 64 finished with value: 0.9899933826497593 and parameters: {'lsvc_ac2s_kernel_sample_steps': 3, 'lsvc_ac2s_dual': False, 'lsvc_ac2s_C': 9.62297840153008, 'lsvc_ac2s_max_iter': 2000}. Best is trial 21 with value: 0.9902.[0m
