[32m[I 2022-10-20 04:34:59,205][0m Trial 57 finished with value: 0.991572118017162 and parameters: {'hgbc_learning_rate': 0.21036552645429452, 'hgbc_max_iter': 2000, 'hgbc_min_samples_leaf': 22, 'hgbc_l2_regularization': 0.4, 'hgbc_max_bins': 255, 'hgbc_early_stopping': True, 'hgbc_validation_fraction': 0.25, 'hgbc_n_iter_no_change': 10}. Best is trial 37 with value: 0.991674.[0m
[32m[I 2022-10-20 04:35:01,174][0m Trial 55 finished with value: 0.9915798796387114 and parameters: {'hgbc_learning_rate': 0.1393823205856456, 'hgbc_max_iter': 2000, 'hgbc_min_samples_leaf': 36, 'hgbc_l2_regularization': 1.0, 'hgbc_max_bins': 255, 'hgbc_early_stopping': True, 'hgbc_validation_fraction': 0.25, 'hgbc_n_iter_no_change': 10}. Best is trial 37 with value: 0.991674.[0m
[32m[I 2022-10-20 04:35:01,890][0m Trial 52 finished with value: 0.9916117167512422 and parameters: {'hgbc_learning_rate': 0.13807915858508837, 'hgbc_max_iter': 2000, 'hgbc_min_samples_leaf': 37, 'hgbc_l2_regularization': 0.0, 'hgbc_max_bins': 127, 'hgbc_early_stopping': True, 'hgbc_validation_fraction': 0.25, 'hgbc_n_iter_no_change': 10}. Best is trial 37 with value: 0.991674.[0m
[32m[I 2022-10-20 04:35:22,536][0m Trial 59 finished with value: 0.991566866936862 and parameters: {'hgbc_learning_rate': 0.29813045210693406, 'hgbc_max_iter': 2000, 'hgbc_min_samples_leaf': 32, 'hgbc_l2_regularization': 0.0, 'hgbc_max_bins': 127, 'hgbc_early_stopping': True, 'hgbc_validation_fraction': 0.25, 'hgbc_n_iter_no_change': 10}. Best is trial 37 with value: 0.991674.[0m
[32m[I 2022-10-20 04:35:24,590][0m Trial 24 finished with value: 0.9916253732586265 and parameters: {'hgbc_learning_rate': 0.0039177983606643926, 'hgbc_max_iter': 2000, 'hgbc_min_samples_leaf': 45, 'hgbc_l2_regularization': 0.2, 'hgbc_max_bins': 63, 'hgbc_early_stopping': True, 'hgbc_validation_fraction': 0.25, 'hgbc_n_iter_no_change': 10}. Best is trial 37 with value: 0.991674.[0m
[32m[I 2022-10-20 04:35:28,506][0m Trial 60 finished with value: 0.9915648564337076 and parameters: {'hgbc_learning_rate': 0.2787054400691449, 'hgbc_max_iter': 2000, 'hgbc_min_samples_leaf': 23, 'hgbc_l2_regularization': 0.0, 'hgbc_max_bins': 127, 'hgbc_early_stopping': True, 'hgbc_validation_fraction': 0.25, 'hgbc_n_iter_no_change': 10}. Best is trial 37 with value: 0.991674.[0m
[32m[I 2022-10-20 04:35:30,261][0m Trial 63 finished with value: 0.9915206262290341 and parameters: {'hgbc_learning_rate': 0.31635344289793177, 'hgbc_max_iter': 2000, 'hgbc_min_samples_leaf': 31, 'hgbc_l2_regularization': 0.0, 'hgbc_max_bins': 127, 'hgbc_early_stopping': True, 'hgbc_validation_fraction': 0.25, 'hgbc_n_iter_no_change': 10}. Best is trial 37 with value: 0.991674.[0m
[32m[I 2022-10-20 04:35:30,979][0m Trial 61 finished with value: 0.9916958045267434 and parameters: {'hgbc_learning_rate': 0.29664014018788554, 'hgbc_max_iter': 2000, 'hgbc_min_samples_leaf': 1, 'hgbc_l2_regularization': 0.0, 'hgbc_max_bins': 127, 'hgbc_early_stopping': True, 'hgbc_validation_fraction': 0.25, 'hgbc_n_iter_no_change': 10}. Best is trial 61 with value: 0.991696.[0m
[32m[I 2022-10-20 04:35:32,122][0m Trial 62 finished with value: 0.9914975027934511 and parameters: {'hgbc_learning_rate': 0.30045450061428924, 'hgbc_max_iter': 2000, 'hgbc_min_samples_leaf': 31, 'hgbc_l2_regularization': 0.0, 'hgbc_max_bins': 127, 'hgbc_early_stopping': True, 'hgbc_validation_fraction': 0.25, 'hgbc_n_iter_no_change': 10}. Best is trial 61 with value: 0.991696.[0m
[32m[I 2022-10-20 04:35:38,512][0m Trial 64 finished with value: 0.9408770873943457 and parameters: {'hgbc_learning_rate': 0.5103969255090463, 'hgbc_max_iter': 2000, 'hgbc_min_samples_leaf': 31, 'hgbc_l2_regularization': 0.0, 'hgbc_max_bins': 127, 'hgbc_early_stopping': True, 'hgbc_validation_fraction': 0.25, 'hgbc_n_iter_no_change': 10}. Best is trial 61 with value: 0.991696.[0m
[32m[I 2022-10-20 04:35:43,212][0m Trial 67 finished with value: 0.9915803394610755 and parameters: {'hgbc_learning_rate': 0.5685786961830714, 'hgbc_max_iter': 2000, 'hgbc_min_samples_leaf': 40, 'hgbc_l2_regularization': 0.4, 'hgbc_max_bins': 127, 'hgbc_early_stopping': True, 'hgbc_validation_fraction': 0.25, 'hgbc_n_iter_no_change': 10}. Best is trial 61 with value: 0.991696.[0m
[32m[I 2022-10-20 04:35:44,870][0m Trial 66 finished with value: 0.9600529034900305 and parameters: {'hgbc_learning_rate': 0.5418098023264206, 'hgbc_max_iter': 2000, 'hgbc_min_samples_leaf': 31, 'hgbc_l2_regularization': 0.0, 'hgbc_max_bins': 127, 'hgbc_early_stopping': True, 'hgbc_validation_fraction': 0.25, 'hgbc_n_iter_no_change': 10}. Best is trial 61 with value: 0.991696.[0m
[32m[I 2022-10-20 04:35:49,618][0m Trial 68 finished with value: 0.8974001412602545 and parameters: {'hgbc_learning_rate': 0.520528829876702, 'hgbc_max_iter': 2000, 'hgbc_min_samples_leaf': 1, 'hgbc_l2_regularization': 0.0, 'hgbc_max_bins': 127, 'hgbc_early_stopping': True, 'hgbc_validation_fraction': 0.25, 'hgbc_n_iter_no_change': 10}. Best is trial 61 with value: 0.991696.[0m
[32m[I 2022-10-20 04:35:53,115][0m Trial 69 finished with value: 0.9915580137819279 and parameters: {'hgbc_learning_rate': 0.5708555935692003, 'hgbc_max_iter': 2000, 'hgbc_min_samples_leaf': 19, 'hgbc_l2_regularization': 0.0, 'hgbc_max_bins': 127, 'hgbc_early_stopping': True, 'hgbc_validation_fraction': 0.25, 'hgbc_n_iter_no_change': 10}. Best is trial 61 with value: 0.991696.[0m
[32m[I 2022-10-20 04:35:54,825][0m Trial 71 finished with value: 0.9067332263108222 and parameters: {'hgbc_learning_rate': 0.7125942074880545, 'hgbc_max_iter': 2000, 'hgbc_min_samples_leaf': 28, 'hgbc_l2_regularization': 0.2, 'hgbc_max_bins': 127, 'hgbc_early_stopping': True, 'hgbc_validation_fraction': 0.25, 'hgbc_n_iter_no_change': 10}. Best is trial 61 with value: 0.991696.[0m
[32m[I 2022-10-20 04:35:55,753][0m Trial 65 finished with value: 0.9915509763522832 and parameters: {'hgbc_learning_rate': 0.334625398128288, 'hgbc_max_iter': 2000, 'hgbc_min_samples_leaf': 24, 'hgbc_l2_regularization': 0.0, 'hgbc_max_bins': 127, 'hgbc_early_stopping': True, 'hgbc_validation_fraction': 0.25, 'hgbc_n_iter_no_change': 10}. Best is trial 61 with value: 0.991696.[0m
[32m[I 2022-10-20 04:35:55,879][0m Trial 29 finished with value: 0.9916492240178625 and parameters: {'hgbc_learning_rate': 0.00654867242446368, 'hgbc_max_iter': 2000, 'hgbc_min_samples_leaf': 29, 'hgbc_l2_regularization': 0.2, 'hgbc_max_bins': 63, 'hgbc_early_stopping': True, 'hgbc_validation_fraction': 0.25, 'hgbc_n_iter_no_change': 10}. Best is trial 61 with value: 0.991696.[0m
[32m[I 2022-10-20 04:35:56,663][0m Trial 72 finished with value: 0.9723971772327881 and parameters: {'hgbc_learning_rate': 0.8094587984841183, 'hgbc_max_iter': 2000, 'hgbc_min_samples_leaf': 8, 'hgbc_l2_regularization': 0.2, 'hgbc_max_bins': 127, 'hgbc_early_stopping': True, 'hgbc_validation_fraction': 0.25, 'hgbc_n_iter_no_change': 10}. Best is trial 61 with value: 0.991696.[0m
[32m[I 2022-10-20 04:36:05,543][0m Trial 73 finished with value: 0.880907247216829 and parameters: {'hgbc_learning_rate': 0.765734220300871, 'hgbc_max_iter': 2000, 'hgbc_min_samples_leaf': 18, 'hgbc_l2_regularization': 0.2, 'hgbc_max_bins': 127, 'hgbc_early_stopping': True, 'hgbc_validation_fraction': 0.25, 'hgbc_n_iter_no_change': 10}. Best is trial 61 with value: 0.991696.[0m
[32m[I 2022-10-20 04:36:06,355][0m Trial 77 finished with value: 0.9910643752679756 and parameters: {'hgbc_learning_rate': 0.803981356011634, 'hgbc_max_iter': 2000, 'hgbc_min_samples_leaf': 11, 'hgbc_l2_regularization': 0.2, 'hgbc_max_bins': 127, 'hgbc_early_stopping': True, 'hgbc_validation_fraction': 0.25, 'hgbc_n_iter_no_change': 10}. Best is trial 61 with value: 0.991696.[0m
[32m[I 2022-10-20 04:36:08,355][0m Trial 74 finished with value: 0.9241787543124582 and parameters: {'hgbc_learning_rate': 0.7275219979720137, 'hgbc_max_iter': 2000, 'hgbc_min_samples_leaf': 8, 'hgbc_l2_regularization': 0.2, 'hgbc_max_bins': 127, 'hgbc_early_stopping': True, 'hgbc_validation_fraction': 0.25, 'hgbc_n_iter_no_change': 10}. Best is trial 61 with value: 0.991696.[0m
[32m[I 2022-10-20 04:36:22,747][0m Trial 79 finished with value: 0.9915194812615663 and parameters: {'hgbc_learning_rate': 0.37477537352962614, 'hgbc_max_iter': 2000, 'hgbc_min_samples_leaf': 33, 'hgbc_l2_regularization': 0.2, 'hgbc_max_bins': 63, 'hgbc_early_stopping': True, 'hgbc_validation_fraction': 0.25, 'hgbc_n_iter_no_change': 10}. Best is trial 61 with value: 0.991696.[0m
[32m[I 2022-10-20 04:36:38,941][0m Trial 76 finished with value: 0.9916272685679427 and parameters: {'hgbc_learning_rate': 0.10434651350968373, 'hgbc_max_iter': 2000, 'hgbc_min_samples_leaf': 42, 'hgbc_l2_regularization': 0.2, 'hgbc_max_bins': 127, 'hgbc_early_stopping': True, 'hgbc_validation_fraction': 0.25, 'hgbc_n_iter_no_change': 10}. Best is trial 61 with value: 0.991696.[0m
[32m[I 2022-10-20 04:36:40,408][0m Trial 75 finished with value: 0.9916807024814132 and parameters: {'hgbc_learning_rate': 0.10502431444420224, 'hgbc_max_iter': 2000, 'hgbc_min_samples_leaf': 14, 'hgbc_l2_regularization': 0.2, 'hgbc_max_bins': 127, 'hgbc_early_stopping': True, 'hgbc_validation_fraction': 0.25, 'hgbc_n_iter_no_change': 10}. Best is trial 61 with value: 0.991696.[0m
[32m[I 2022-10-20 04:36:44,253][0m Trial 78 finished with value: 0.9915799948253001 and parameters: {'hgbc_learning_rate': 0.1123980172660241, 'hgbc_max_iter': 2000, 'hgbc_min_samples_leaf': 33, 'hgbc_l2_regularization': 0.2, 'hgbc_max_bins': 63, 'hgbc_early_stopping': True, 'hgbc_validation_fraction': 0.25, 'hgbc_n_iter_no_change': 10}. Best is trial 61 with value: 0.991696.[0m
[32m[I 2022-10-20 04:36:44,952][0m Trial 70 finished with value: 0.9916116790571491 and parameters: {'hgbc_learning_rate': 0.1119082493894125, 'hgbc_max_iter': 2000, 'hgbc_min_samples_leaf': 8, 'hgbc_l2_regularization': 0.0, 'hgbc_max_bins': 127, 'hgbc_early_stopping': True, 'hgbc_validation_fraction': 0.25, 'hgbc_n_iter_no_change': 10}. Best is trial 61 with value: 0.991696.[0m
[32m[I 2022-10-20 04:36:57,638][0m Trial 81 finished with value: 0.9915493333872474 and parameters: {'hgbc_learning_rate': 0.10825585316245771, 'hgbc_max_iter': 2000, 'hgbc_min_samples_leaf': 33, 'hgbc_l2_regularization': 0.4, 'hgbc_max_bins': 63, 'hgbc_early_stopping': True, 'hgbc_validation_fraction': 0.25, 'hgbc_n_iter_no_change': 10}. Best is trial 61 with value: 0.991696.[0m
[32m[I 2022-10-20 04:37:33,209][0m Trial 80 finished with value: 0.9916029708848009 and parameters: {'hgbc_learning_rate': 0.057680133494449136, 'hgbc_max_iter': 2000, 'hgbc_min_samples_leaf': 33, 'hgbc_l2_regularization': 0.4, 'hgbc_max_bins': 63, 'hgbc_early_stopping': True, 'hgbc_validation_fraction': 0.25, 'hgbc_n_iter_no_change': 10}. Best is trial 61 with value: 0.991696.[0m
[32m[I 2022-10-20 04:37:51,519][0m Trial 84 finished with value: 0.9915208155508578 and parameters: {'hgbc_learning_rate': 0.055019341431842235, 'hgbc_max_iter': 2000, 'hgbc_min_samples_leaf': 39, 'hgbc_l2_regularization': 0.4, 'hgbc_max_bins': 127, 'hgbc_early_stopping': True, 'hgbc_validation_fraction': 0.25, 'hgbc_n_iter_no_change': 10}. Best is trial 61 with value: 0.991696.[0m
[32m[I 2022-10-20 04:37:52,535][0m Trial 85 finished with value: 0.9915196731656833 and parameters: {'hgbc_learning_rate': 0.05825316423130878, 'hgbc_max_iter': 2000, 'hgbc_min_samples_leaf': 13, 'hgbc_l2_regularization': 0.4, 'hgbc_max_bins': 127, 'hgbc_early_stopping': True, 'hgbc_validation_fraction': 0.25, 'hgbc_n_iter_no_change': 10}. Best is trial 61 with value: 0.991696.[0m
[32m[I 2022-10-20 04:38:06,877][0m Trial 82 finished with value: 0.9915876408069968 and parameters: {'hgbc_learning_rate': 0.045619874178053396, 'hgbc_max_iter': 2000, 'hgbc_min_samples_leaf': 28, 'hgbc_l2_regularization': 0.4, 'hgbc_max_bins': 63, 'hgbc_early_stopping': True, 'hgbc_validation_fraction': 0.25, 'hgbc_n_iter_no_change': 10}. Best is trial 61 with value: 0.991696.[0m
[32m[I 2022-10-20 04:38:17,930][0m Trial 86 finished with value: 0.9915653540287936 and parameters: {'hgbc_learning_rate': 0.04105962511305692, 'hgbc_max_iter': 2000, 'hgbc_min_samples_leaf': 15, 'hgbc_l2_regularization': 0.4, 'hgbc_max_bins': 127, 'hgbc_early_stopping': True, 'hgbc_validation_fraction': 0.25, 'hgbc_n_iter_no_change': 10}. Best is trial 61 with value: 0.991696.[0m
[32m[I 2022-10-20 04:38:24,034][0m Trial 23 finished with value: 0.9914799683419769 and parameters: {'hgbc_learning_rate': 0.0012377066806794669, 'hgbc_max_iter': 2000, 'hgbc_min_samples_leaf': 49, 'hgbc_l2_regularization': 0.2, 'hgbc_max_bins': 63, 'hgbc_early_stopping': True, 'hgbc_validation_fraction': 0.25, 'hgbc_n_iter_no_change': 10}. Best is trial 61 with value: 0.991696.[0m
[32m[I 2022-10-20 04:38:24,789][0m Trial 83 finished with value: 0.9915947876236166 and parameters: {'hgbc_learning_rate': 0.045826303709189456, 'hgbc_max_iter': 2000, 'hgbc_min_samples_leaf': 38, 'hgbc_l2_regularization': 0.4, 'hgbc_max_bins': 63, 'hgbc_early_stopping': True, 'hgbc_validation_fraction': 0.25, 'hgbc_n_iter_no_change': 10}. Best is trial 61 with value: 0.991696.[0m
[32m[I 2022-10-20 04:38:38,374][0m Trial 91 finished with value: 0.9914808656223169 and parameters: {'hgbc_learning_rate': 0.2508354094952991, 'hgbc_max_iter': 2000, 'hgbc_min_samples_leaf': 28, 'hgbc_l2_regularization': 0.0, 'hgbc_max_bins': 127, 'hgbc_early_stopping': True, 'hgbc_validation_fraction': 0.25, 'hgbc_n_iter_no_change': 10}. Best is trial 61 with value: 0.991696.[0m
[32m[I 2022-10-20 04:38:48,010][0m Trial 92 finished with value: 0.9916347628380411 and parameters: {'hgbc_learning_rate': 0.25284246301344265, 'hgbc_max_iter': 2000, 'hgbc_min_samples_leaf': 27, 'hgbc_l2_regularization': 0.0, 'hgbc_max_bins': 63, 'hgbc_early_stopping': True, 'hgbc_validation_fraction': 0.25, 'hgbc_n_iter_no_change': 10}. Best is trial 61 with value: 0.991696.[0m
[32m[I 2022-10-20 04:39:01,248][0m Trial 93 finished with value: 0.9915269731592382 and parameters: {'hgbc_learning_rate': 0.18344451135342715, 'hgbc_max_iter': 2000, 'hgbc_min_samples_leaf': 1, 'hgbc_l2_regularization': 0.0, 'hgbc_max_bins': 127, 'hgbc_early_stopping': True, 'hgbc_validation_fraction': 0.25, 'hgbc_n_iter_no_change': 10}. Best is trial 61 with value: 0.991696.[0m
[32m[I 2022-10-20 04:39:03,010][0m Trial 94 finished with value: 0.9915894232839457 and parameters: {'hgbc_learning_rate': 0.17829937299766135, 'hgbc_max_iter': 2000, 'hgbc_min_samples_leaf': 21, 'hgbc_l2_regularization': 0.0, 'hgbc_max_bins': 127, 'hgbc_early_stopping': True, 'hgbc_validation_fraction': 0.25, 'hgbc_n_iter_no_change': 10}. Best is trial 61 with value: 0.991696.[0m
[32m[I 2022-10-20 04:39:10,697][0m Trial 96 finished with value: 0.991573493495371 and parameters: {'hgbc_learning_rate': 0.19635167143653484, 'hgbc_max_iter': 2000, 'hgbc_min_samples_leaf': 35, 'hgbc_l2_regularization': 0.6000000000000001, 'hgbc_max_bins': 255, 'hgbc_early_stopping': True, 'hgbc_validation_fraction': 0.25, 'hgbc_n_iter_no_change': 10}. Best is trial 61 with value: 0.991696.[0m
[32m[I 2022-10-20 04:39:15,080][0m Trial 95 finished with value: 0.9916552686745583 and parameters: {'hgbc_learning_rate': 0.1943500030589295, 'hgbc_max_iter': 2000, 'hgbc_min_samples_leaf': 25, 'hgbc_l2_regularization': 0.0, 'hgbc_max_bins': 255, 'hgbc_early_stopping': True, 'hgbc_validation_fraction': 0.25, 'hgbc_n_iter_no_change': 10}. Best is trial 61 with value: 0.991696.[0m
[32m[I 2022-10-20 04:39:21,248][0m Trial 87 finished with value: 0.9914737230669344 and parameters: {'hgbc_learning_rate': 0.0437000986140556, 'hgbc_max_iter': 2000, 'hgbc_min_samples_leaf': 15, 'hgbc_l2_regularization': 0.0, 'hgbc_max_bins': 127, 'hgbc_early_stopping': True, 'hgbc_validation_fraction': 0.25, 'hgbc_n_iter_no_change': 10}. Best is trial 61 with value: 0.991696.[0m
[32m[I 2022-10-20 04:39:25,654][0m Trial 99 finished with value: 0.991603542309451 and parameters: {'hgbc_learning_rate': 0.3744995884874482, 'hgbc_max_iter': 2000, 'hgbc_min_samples_leaf': 30, 'hgbc_l2_regularization': 0.2, 'hgbc_max_bins': 63, 'hgbc_early_stopping': True, 'hgbc_validation_fraction': 0.25, 'hgbc_n_iter_no_change': 10}. Best is trial 61 with value: 0.991696.[0m
[32m[I 2022-10-20 04:39:34,494][0m Trial 97 finished with value: 0.9916175732723626 and parameters: {'hgbc_learning_rate': 0.1879191969672118, 'hgbc_max_iter': 2000, 'hgbc_min_samples_leaf': 35, 'hgbc_l2_regularization': 0.0, 'hgbc_max_bins': 255, 'hgbc_early_stopping': True, 'hgbc_validation_fraction': 0.25, 'hgbc_n_iter_no_change': 10}. Best is trial 61 with value: 0.991696.[0m
[32m[I 2022-10-20 04:39:41,995][0m Trial 88 finished with value: 0.9915806065531539 and parameters: {'hgbc_learning_rate': 0.043227706444007606, 'hgbc_max_iter': 2000, 'hgbc_min_samples_leaf': 39, 'hgbc_l2_regularization': 0.0, 'hgbc_max_bins': 127, 'hgbc_early_stopping': True, 'hgbc_validation_fraction': 0.25, 'hgbc_n_iter_no_change': 10}. Best is trial 61 with value: 0.991696.[0m
[32m[I 2022-10-20 04:39:42,127][0m Trial 98 finished with value: 0.9915877557097352 and parameters: {'hgbc_learning_rate': 0.08427413390972661, 'hgbc_max_iter': 2000, 'hgbc_min_samples_leaf': 29, 'hgbc_l2_regularization': 0.2, 'hgbc_max_bins': 63, 'hgbc_early_stopping': True, 'hgbc_validation_fraction': 0.25, 'hgbc_n_iter_no_change': 10}. Best is trial 61 with value: 0.991696.[0m
[32m[I 2022-10-20 04:39:53,607][0m Trial 90 finished with value: 0.9916725351787663 and parameters: {'hgbc_learning_rate': 0.039583038752485214, 'hgbc_max_iter': 2000, 'hgbc_min_samples_leaf': 28, 'hgbc_l2_regularization': 0.0, 'hgbc_max_bins': 63, 'hgbc_early_stopping': True, 'hgbc_validation_fraction': 0.25, 'hgbc_n_iter_no_change': 10}. Best is trial 61 with value: 0.991696.[0m
[32m[I 2022-10-20 04:39:54,829][0m Trial 89 finished with value: 0.9916494127761759 and parameters: {'hgbc_learning_rate': 0.03898608486145221, 'hgbc_max_iter': 2000, 'hgbc_min_samples_leaf': 14, 'hgbc_l2_regularization': 0.0, 'hgbc_max_bins': 63, 'hgbc_early_stopping': True, 'hgbc_validation_fraction': 0.25, 'hgbc_n_iter_no_change': 10}. Best is trial 61 with value: 0.991696.[0m
[32m[I 2022-10-20 04:39:54,892][0m Study finished.[0m
[32m[I 2022-10-20 04:39:55,001][0m --------------------------------------------------------------------------------[0m
[32m[I 2022-10-20 04:39:55,001][0m --------------------             LGBMClassifier             --------------------[0m
[32m[I 2022-10-20 04:39:55,001][0m --------------------------------------------------------------------------------[0m
[32m[I 2022-10-20 04:39:55,032][0m A new study created in RDB with name: LGBMClassifier_b4f53b70[0m
[32m[I 2022-10-20 04:39:55,032][0m Study started.[0m
[32m[I 2022-10-20 04:40:03,710][0m Trial 3 finished with value: 0.6279113291613727 and parameters: {'lgbm_num_leaves': 15, 'lgbm_learning_rate': 0.004537611756836173, 'lgbm_n_estimators': 40, 'lgbm_reg_alpha': 0.65, 'lgbm_reg_lambda': 0.45}. Best is trial 3 with value: 0.627911.[0m
[32m[I 2022-10-20 04:40:09,187][0m Trial 4 finished with value: 0.2844441188051378 and parameters: {'lgbm_num_leaves': 31, 'lgbm_learning_rate': 3.550733666386101e-05, 'lgbm_n_estimators': 70, 'lgbm_reg_alpha': 0.15000000000000002, 'lgbm_reg_lambda': 0.55}. Best is trial 3 with value: 0.627911.[0m
[32m[I 2022-10-20 04:40:09,897][0m Trial 6 finished with value: 0.9914497818052381 and parameters: {'lgbm_num_leaves': 127, 'lgbm_learning_rate': 0.006063400873000646, 'lgbm_n_estimators': 70, 'lgbm_reg_alpha': 0.9, 'lgbm_reg_lambda': 0.65}. Best is trial 6 with value: 0.99145.[0m
[32m[I 2022-10-20 04:40:16,756][0m Trial 5 finished with value: 0.2844441188051378 and parameters: {'lgbm_num_leaves': 63, 'lgbm_learning_rate': 9.449909822590055e-06, 'lgbm_n_estimators': 110, 'lgbm_reg_alpha': 0.15000000000000002, 'lgbm_reg_lambda': 0.30000000000000004}. Best is trial 6 with value: 0.99145.[0m
[32m[I 2022-10-20 04:40:18,571][0m Trial 2 finished with value: 0.9082243754398449 and parameters: {'lgbm_num_leaves': 15, 'lgbm_learning_rate': 0.0014101481098608452, 'lgbm_n_estimators': 130, 'lgbm_reg_alpha': 0.8, 'lgbm_reg_lambda': 0.4}. Best is trial 6 with value: 0.99145.[0m
[32m[I 2022-10-20 04:40:19,181][0m Trial 7 finished with value: 0.2844441188051378 and parameters: {'lgbm_num_leaves': 15, 'lgbm_learning_rate': 0.0006090333173140323, 'lgbm_n_estimators': 130, 'lgbm_reg_alpha': 0.15000000000000002, 'lgbm_reg_lambda': 0.0}. Best is trial 6 with value: 0.99145.[0m
[32m[I 2022-10-20 04:40:19,779][0m Trial 1 finished with value: 0.2844441188051378 and parameters: {'lgbm_num_leaves': 63, 'lgbm_learning_rate': 1.817613245482431e-06, 'lgbm_n_estimators': 130, 'lgbm_reg_alpha': 0.45, 'lgbm_reg_lambda': 0.7000000000000001}. Best is trial 6 with value: 0.99145.[0m
[32m[I 2022-10-20 04:40:20,217][0m Trial 8 finished with value: 0.9914814141392254 and parameters: {'lgbm_num_leaves': 15, 'lgbm_learning_rate': 0.018911310487004625, 'lgbm_n_estimators': 90, 'lgbm_reg_alpha': 0.55, 'lgbm_reg_lambda': 0.45}. Best is trial 8 with value: 0.991481.[0m
[32m[I 2022-10-20 04:40:24,700][0m Trial 0 finished with value: 0.41091211852850706 and parameters: {'lgbm_num_leaves': 127, 'lgbm_learning_rate': 0.940726856003338, 'lgbm_n_estimators': 200, 'lgbm_reg_alpha': 0.9, 'lgbm_reg_lambda': 0.45}. Best is trial 8 with value: 0.991481.[0m
[32m[I 2022-10-20 04:40:26,051][0m Trial 9 finished with value: 0.2844441188051378 and parameters: {'lgbm_num_leaves': 63, 'lgbm_learning_rate': 1.7955509858808815e-05, 'lgbm_n_estimators': 90, 'lgbm_reg_alpha': 0.0, 'lgbm_reg_lambda': 0.45}. Best is trial 8 with value: 0.991481.[0m
[32m[I 2022-10-20 04:40:28,967][0m Trial 17 finished with value: 0.9867336956289473 and parameters: {'lgbm_num_leaves': 7, 'lgbm_learning_rate': 0.060847716659340294, 'lgbm_n_estimators': 10, 'lgbm_reg_alpha': 0.45, 'lgbm_reg_lambda': 1.0}. Best is trial 8 with value: 0.991481.[0m
