[32m[I 2022-10-20 14:46:13,735][0m Trial 58 finished with value: 0.38421133911073435 and parameters: {'mnb_alpha': 0.1, 'mnb_fit_prior': True}. Best is trial 6 with value: 0.384844.[0m
[32m[I 2022-10-20 14:46:13,864][0m Trial 62 finished with value: 0.38421133911073435 and parameters: {'mnb_alpha': 0.1, 'mnb_fit_prior': True}. Best is trial 6 with value: 0.384844.[0m
[32m[I 2022-10-20 14:46:13,864][0m Trial 59 finished with value: 0.38421133911073435 and parameters: {'mnb_alpha': 0.1, 'mnb_fit_prior': True}. Best is trial 6 with value: 0.384844.[0m
[32m[I 2022-10-20 14:46:13,864][0m Trial 60 finished with value: 0.38421133911073435 and parameters: {'mnb_alpha': 0.1, 'mnb_fit_prior': True}. Best is trial 6 with value: 0.384844.[0m
[32m[I 2022-10-20 14:46:14,005][0m Trial 63 finished with value: 0.38421133911073435 and parameters: {'mnb_alpha': 0.1, 'mnb_fit_prior': True}. Best is trial 6 with value: 0.384844.[0m
[32m[I 2022-10-20 14:46:14,130][0m Trial 61 finished with value: 0.38421133911073435 and parameters: {'mnb_alpha': 0.1, 'mnb_fit_prior': True}. Best is trial 6 with value: 0.384844.[0m
[32m[I 2022-10-20 14:46:14,255][0m Trial 64 finished with value: 0.38421133911073435 and parameters: {'mnb_alpha': 0.1, 'mnb_fit_prior': True}. Best is trial 6 with value: 0.384844.[0m
[32m[I 2022-10-20 14:46:15,958][0m Trial 65 finished with value: 0.38421133911073435 and parameters: {'mnb_alpha': 0.1, 'mnb_fit_prior': True}. Best is trial 6 with value: 0.384844.[0m
[32m[I 2022-10-20 14:46:16,585][0m Trial 66 finished with value: 0.3841998140289928 and parameters: {'mnb_alpha': 0.2, 'mnb_fit_prior': False}. Best is trial 6 with value: 0.384844.[0m
[32m[I 2022-10-20 14:46:16,773][0m Trial 67 finished with value: 0.3841998140289928 and parameters: {'mnb_alpha': 0.45, 'mnb_fit_prior': False}. Best is trial 6 with value: 0.384844.[0m
[32m[I 2022-10-20 14:46:16,867][0m Trial 69 finished with value: 0.3841998140289928 and parameters: {'mnb_alpha': 0.2, 'mnb_fit_prior': False}. Best is trial 6 with value: 0.384844.[0m
[32m[I 2022-10-20 14:46:16,945][0m Trial 68 finished with value: 0.3841998140289928 and parameters: {'mnb_alpha': 0.45, 'mnb_fit_prior': False}. Best is trial 6 with value: 0.384844.[0m
[32m[I 2022-10-20 14:46:17,043][0m Trial 70 finished with value: 0.3841998140289928 and parameters: {'mnb_alpha': 0.2, 'mnb_fit_prior': False}. Best is trial 6 with value: 0.384844.[0m
[32m[I 2022-10-20 14:46:17,121][0m Trial 71 finished with value: 0.3841998140289928 and parameters: {'mnb_alpha': 0.5, 'mnb_fit_prior': False}. Best is trial 6 with value: 0.384844.[0m
[32m[I 2022-10-20 14:46:17,231][0m Trial 72 finished with value: 0.3841998140289928 and parameters: {'mnb_alpha': 0.2, 'mnb_fit_prior': False}. Best is trial 6 with value: 0.384844.[0m
[32m[I 2022-10-20 14:46:17,798][0m Trial 73 finished with value: 0.3841998140289928 and parameters: {'mnb_alpha': 0.45, 'mnb_fit_prior': True}. Best is trial 6 with value: 0.384844.[0m
[32m[I 2022-10-20 14:46:19,486][0m Trial 74 finished with value: 0.3841881809986997 and parameters: {'mnb_alpha': 0.6000000000000001, 'mnb_fit_prior': True}. Best is trial 6 with value: 0.384844.[0m
[32m[I 2022-10-20 14:46:19,901][0m Trial 77 finished with value: 0.38423437530304067 and parameters: {'mnb_alpha': 0.05, 'mnb_fit_prior': True}. Best is trial 6 with value: 0.384844.[0m
[32m[I 2022-10-20 14:46:19,995][0m Trial 76 finished with value: 0.38423437530304067 and parameters: {'mnb_alpha': 0.05, 'mnb_fit_prior': True}. Best is trial 6 with value: 0.384844.[0m
[32m[I 2022-10-20 14:46:20,151][0m Trial 79 finished with value: 0.38423437530304067 and parameters: {'mnb_alpha': 0.05, 'mnb_fit_prior': True}. Best is trial 6 with value: 0.384844.[0m
[32m[I 2022-10-20 14:46:20,245][0m Trial 75 finished with value: 0.38423437530304067 and parameters: {'mnb_alpha': 0.05, 'mnb_fit_prior': True}. Best is trial 6 with value: 0.384844.[0m
[32m[I 2022-10-20 14:46:20,323][0m Trial 81 finished with value: 0.38423437530304067 and parameters: {'mnb_alpha': 0.05, 'mnb_fit_prior': True}. Best is trial 6 with value: 0.384844.[0m
[32m[I 2022-10-20 14:46:20,323][0m Trial 78 finished with value: 0.38423437530304067 and parameters: {'mnb_alpha': 0.05, 'mnb_fit_prior': True}. Best is trial 6 with value: 0.384844.[0m
[32m[I 2022-10-20 14:46:20,464][0m Trial 80 finished with value: 0.38423437530304067 and parameters: {'mnb_alpha': 0.05, 'mnb_fit_prior': True}. Best is trial 6 with value: 0.384844.[0m
[32m[I 2022-10-20 14:46:22,283][0m Trial 82 finished with value: 0.38423437530304067 and parameters: {'mnb_alpha': 0.05, 'mnb_fit_prior': True}. Best is trial 6 with value: 0.384844.[0m
[32m[I 2022-10-20 14:46:22,789][0m Trial 84 finished with value: 0.38484354706828566 and parameters: {'mnb_alpha': 0.0, 'mnb_fit_prior': False}. Best is trial 84 with value: 0.384844.[0m
[32m[I 2022-10-20 14:46:22,789][0m Trial 83 finished with value: 0.38484354706828566 and parameters: {'mnb_alpha': 0.0, 'mnb_fit_prior': False}. Best is trial 84 with value: 0.384844.[0m
[32m[I 2022-10-20 14:46:23,055][0m Trial 85 finished with value: 0.38484354706828566 and parameters: {'mnb_alpha': 0.0, 'mnb_fit_prior': False}. Best is trial 85 with value: 0.384844.[0m
[32m[I 2022-10-20 14:46:23,543][0m Trial 88 finished with value: 0.38484354706828566 and parameters: {'mnb_alpha': 0.0, 'mnb_fit_prior': False}. Best is trial 88 with value: 0.384844.[0m
[32m[I 2022-10-20 14:46:23,731][0m Trial 86 finished with value: 0.38484354706828566 and parameters: {'mnb_alpha': 0.0, 'mnb_fit_prior': False}. Best is trial 89 with value: 0.384844.[0m
[32m[I 2022-10-20 14:46:23,731][0m Trial 87 finished with value: 0.38484354706828566 and parameters: {'mnb_alpha': 0.0, 'mnb_fit_prior': False}. Best is trial 89 with value: 0.384844.[0m
[32m[I 2022-10-20 14:46:23,731][0m Trial 89 finished with value: 0.38484354706828566 and parameters: {'mnb_alpha': 0.0, 'mnb_fit_prior': False}. Best is trial 89 with value: 0.384844.[0m
[32m[I 2022-10-20 14:46:25,182][0m Trial 90 finished with value: 0.38484354706828566 and parameters: {'mnb_alpha': 0.0, 'mnb_fit_prior': False}. Best is trial 90 with value: 0.384844.[0m
[32m[I 2022-10-20 14:46:25,670][0m Trial 91 finished with value: 0.38484354706828566 and parameters: {'mnb_alpha': 0.0, 'mnb_fit_prior': True}. Best is trial 91 with value: 0.384844.[0m
[32m[I 2022-10-20 14:46:25,733][0m Trial 92 finished with value: 0.38484354706828566 and parameters: {'mnb_alpha': 0.0, 'mnb_fit_prior': True}. Best is trial 92 with value: 0.384844.[0m
[32m[I 2022-10-20 14:46:26,175][0m Trial 93 finished with value: 0.38484354706828566 and parameters: {'mnb_alpha': 0.0, 'mnb_fit_prior': False}. Best is trial 94 with value: 0.384844.[0m
[32m[I 2022-10-20 14:46:26,175][0m Trial 94 finished with value: 0.38484354706828566 and parameters: {'mnb_alpha': 0.0, 'mnb_fit_prior': False}. Best is trial 94 with value: 0.384844.[0m
[32m[I 2022-10-20 14:46:26,409][0m Trial 95 finished with value: 0.38484354706828566 and parameters: {'mnb_alpha': 0.0, 'mnb_fit_prior': False}. Best is trial 97 with value: 0.384844.[0m
[32m[I 2022-10-20 14:46:26,488][0m Trial 96 finished with value: 0.38484354706828566 and parameters: {'mnb_alpha': 0.0, 'mnb_fit_prior': False}. Best is trial 97 with value: 0.384844.[0m
[32m[I 2022-10-20 14:46:26,488][0m Trial 97 finished with value: 0.38484354706828566 and parameters: {'mnb_alpha': 0.0, 'mnb_fit_prior': False}. Best is trial 97 with value: 0.384844.[0m
[32m[I 2022-10-20 14:46:26,725][0m Trial 98 finished with value: 0.38484354706828566 and parameters: {'mnb_alpha': 0.0, 'mnb_fit_prior': False}. Best is trial 98 with value: 0.384844.[0m
[32m[I 2022-10-20 14:46:26,912][0m Trial 99 finished with value: 0.38484354706828566 and parameters: {'mnb_alpha': 0.0, 'mnb_fit_prior': True}. Best is trial 99 with value: 0.384844.[0m
[32m[I 2022-10-20 14:46:26,975][0m Study finished.[0m
[32m[I 2022-10-20 14:46:27,053][0m --------------------------------------------------------------------------------[0m
[32m[I 2022-10-20 14:46:27,053][0m --------------------      PassiveAggressiveClassifier       --------------------[0m
[32m[I 2022-10-20 14:46:27,053][0m --------------------------------------------------------------------------------[0m
[32m[I 2022-10-20 14:46:27,084][0m A new study created in RDB with name: PassiveAggressiveClassifier_b4f53b70[0m
[32m[I 2022-10-20 14:46:27,100][0m Study started.[0m
[32m[I 2022-10-20 14:46:46,128][0m Trial 4 finished with value: 0.4224288938309267 and parameters: {'pac_C': 182.88711743088882, 'pac_early_stopping': True, 'pac_validation_fraction': 0.25, 'pac_n_iter_no_change': 10}. Best is trial 1 with value: 0.422429.[0m
[32m[I 2022-10-20 14:46:46,128][0m Trial 1 finished with value: 0.4224288938309267 and parameters: {'pac_C': 0.016114111985495908, 'pac_early_stopping': True, 'pac_validation_fraction': 0.25, 'pac_n_iter_no_change': 10}. Best is trial 1 with value: 0.422429.[0m
[32m[I 2022-10-20 14:46:46,473][0m Trial 0 finished with value: 0.4224288938309267 and parameters: {'pac_C': 0.0023178814798242523, 'pac_early_stopping': True, 'pac_validation_fraction': 0.25, 'pac_n_iter_no_change': 10}. Best is trial 0 with value: 0.422429.[0m
[32m[I 2022-10-20 14:46:46,755][0m Trial 6 finished with value: 0.4224288938309267 and parameters: {'pac_C': 1.1637329474345698e-06, 'pac_early_stopping': True, 'pac_validation_fraction': 0.25, 'pac_n_iter_no_change': 10}. Best is trial 0 with value: 0.422429.[0m
[32m[I 2022-10-20 14:46:46,947][0m Trial 5 finished with value: 0.4224288938309267 and parameters: {'pac_C': 0.00012985117966684754, 'pac_early_stopping': True, 'pac_validation_fraction': 0.25, 'pac_n_iter_no_change': 10}. Best is trial 0 with value: 0.422429.[0m
[32m[I 2022-10-20 14:46:47,369][0m Trial 3 finished with value: 0.4224288938309267 and parameters: {'pac_C': 0.1310779082042459, 'pac_early_stopping': True, 'pac_validation_fraction': 0.25, 'pac_n_iter_no_change': 10}. Best is trial 0 with value: 0.422429.[0m
[32m[I 2022-10-20 14:46:47,511][0m Trial 7 finished with value: 0.4224288938309267 and parameters: {'pac_C': 2.6052461048507082e-06, 'pac_early_stopping': True, 'pac_validation_fraction': 0.25, 'pac_n_iter_no_change': 10}. Best is trial 0 with value: 0.422429.[0m
[32m[I 2022-10-20 14:46:47,795][0m Trial 2 finished with value: 0.4224288938309267 and parameters: {'pac_C': 0.00023881156248138836, 'pac_early_stopping': True, 'pac_validation_fraction': 0.25, 'pac_n_iter_no_change': 10}. Best is trial 0 with value: 0.422429.[0m
[32m[I 2022-10-20 14:47:04,568][0m Trial 8 finished with value: 0.4224288938309267 and parameters: {'pac_C': 0.0033185284750815104, 'pac_early_stopping': True, 'pac_validation_fraction': 0.25, 'pac_n_iter_no_change': 10}. Best is trial 0 with value: 0.422429.[0m
[32m[I 2022-10-20 14:47:04,777][0m Trial 9 finished with value: 0.4224288938309267 and parameters: {'pac_C': 0.1902945705469757, 'pac_early_stopping': True, 'pac_validation_fraction': 0.25, 'pac_n_iter_no_change': 10}. Best is trial 0 with value: 0.422429.[0m
[32m[I 2022-10-20 14:47:05,602][0m Trial 10 finished with value: 0.4224288938309267 and parameters: {'pac_C': 0.11466828016518102, 'pac_early_stopping': True, 'pac_validation_fraction': 0.25, 'pac_n_iter_no_change': 10}. Best is trial 0 with value: 0.422429.[0m
[32m[I 2022-10-20 14:47:05,859][0m Trial 11 finished with value: 0.4224288938309267 and parameters: {'pac_C': 359.83771170080706, 'pac_early_stopping': True, 'pac_validation_fraction': 0.25, 'pac_n_iter_no_change': 10}. Best is trial 0 with value: 0.422429.[0m
[32m[I 2022-10-20 14:47:06,538][0m Trial 12 finished with value: 0.4224288938309267 and parameters: {'pac_C': 1.1721419120831667e-06, 'pac_early_stopping': True, 'pac_validation_fraction': 0.25, 'pac_n_iter_no_change': 10}. Best is trial 0 with value: 0.422429.[0m
[32m[I 2022-10-20 14:47:06,772][0m Trial 13 finished with value: 0.4224288938309267 and parameters: {'pac_C': 0.000753977936887721, 'pac_early_stopping': True, 'pac_validation_fraction': 0.25, 'pac_n_iter_no_change': 10}. Best is trial 0 with value: 0.422429.[0m
[32m[I 2022-10-20 14:47:06,772][0m Trial 15 finished with value: 0.4224288938309267 and parameters: {'pac_C': 0.09127646126054714, 'pac_early_stopping': True, 'pac_validation_fraction': 0.25, 'pac_n_iter_no_change': 10}. Best is trial 0 with value: 0.422429.[0m
[32m[I 2022-10-20 14:47:06,772][0m Trial 14 finished with value: 0.4224288938309267 and parameters: {'pac_C': 0.0002874735766086571, 'pac_early_stopping': True, 'pac_validation_fraction': 0.25, 'pac_n_iter_no_change': 10}. Best is trial 0 with value: 0.422429.[0m
[32m[I 2022-10-20 14:47:23,365][0m Trial 16 finished with value: 0.4224288938309267 and parameters: {'pac_C': 4.104030925767203e-06, 'pac_early_stopping': True, 'pac_validation_fraction': 0.25, 'pac_n_iter_no_change': 10}. Best is trial 0 with value: 0.422429.[0m
[32m[I 2022-10-20 14:47:23,554][0m Trial 17 finished with value: 0.4224288938309267 and parameters: {'pac_C': 10.529623610550145, 'pac_early_stopping': True, 'pac_validation_fraction': 0.25, 'pac_n_iter_no_change': 10}. Best is trial 0 with value: 0.422429.[0m
[32m[I 2022-10-20 14:47:24,491][0m Trial 18 finished with value: 0.4224288938309267 and parameters: {'pac_C': 10.377481178606713, 'pac_early_stopping': True, 'pac_validation_fraction': 0.25, 'pac_n_iter_no_change': 10}. Best is trial 0 with value: 0.422429.[0m
[32m[I 2022-10-20 14:47:24,951][0m Trial 19 finished with value: 0.4224288938309267 and parameters: {'pac_C': 0.0030494119241043015, 'pac_early_stopping': True, 'pac_validation_fraction': 0.25, 'pac_n_iter_no_change': 10}. Best is trial 0 with value: 0.422429.[0m
[32m[I 2022-10-20 14:47:25,772][0m Trial 20 finished with value: 0.4224288938309267 and parameters: {'pac_C': 5.513159200838661, 'pac_early_stopping': True, 'pac_validation_fraction': 0.25, 'pac_n_iter_no_change': 10}. Best is trial 0 with value: 0.422429.[0m
[32m[I 2022-10-20 14:47:26,152][0m Trial 21 finished with value: 0.4224288938309267 and parameters: {'pac_C': 3.1318386042424393, 'pac_early_stopping': True, 'pac_validation_fraction': 0.25, 'pac_n_iter_no_change': 10}. Best is trial 0 with value: 0.422429.[0m
[32m[I 2022-10-20 14:47:26,248][0m Trial 22 finished with value: 0.4224288938309267 and parameters: {'pac_C': 7.214372821039965, 'pac_early_stopping': True, 'pac_validation_fraction': 0.25, 'pac_n_iter_no_change': 10}. Best is trial 0 with value: 0.422429.[0m
[32m[I 2022-10-20 14:47:26,778][0m Trial 23 finished with value: 0.4224288938309267 and parameters: {'pac_C': 2.114489743048092, 'pac_early_stopping': True, 'pac_validation_fraction': 0.25, 'pac_n_iter_no_change': 10}. Best is trial 0 with value: 0.422429.[0m
[32m[I 2022-10-20 14:47:42,367][0m Trial 24 finished with value: 0.4224288938309267 and parameters: {'pac_C': 2.9053688513247704, 'pac_early_stopping': True, 'pac_validation_fraction': 0.25, 'pac_n_iter_no_change': 10}. Best is trial 0 with value: 0.422429.[0m
[32m[I 2022-10-20 14:47:42,572][0m Trial 25 finished with value: 0.4224288938309267 and parameters: {'pac_C': 3.4371568981580434, 'pac_early_stopping': True, 'pac_validation_fraction': 0.25, 'pac_n_iter_no_change': 10}. Best is trial 0 with value: 0.422429.[0m
[32m[I 2022-10-20 14:47:43,364][0m Trial 26 finished with value: 0.4224288938309267 and parameters: {'pac_C': 1.934404527267926e-05, 'pac_early_stopping': True, 'pac_validation_fraction': 0.25, 'pac_n_iter_no_change': 10}. Best is trial 0 with value: 0.422429.[0m
[32m[I 2022-10-20 14:47:43,637][0m Trial 27 finished with value: 0.4224288938309267 and parameters: {'pac_C': 2.2105773066712597, 'pac_early_stopping': True, 'pac_validation_fraction': 0.25, 'pac_n_iter_no_change': 10}. Best is trial 0 with value: 0.422429.[0m
[32m[I 2022-10-20 14:47:44,621][0m Trial 28 finished with value: 0.4224288938309267 and parameters: {'pac_C': 3.5812918500027187, 'pac_early_stopping': True, 'pac_validation_fraction': 0.25, 'pac_n_iter_no_change': 10}. Best is trial 0 with value: 0.422429.[0m
[32m[I 2022-10-20 14:47:45,220][0m Trial 30 finished with value: 0.4224288938309267 and parameters: {'pac_C': 0.008736250078792716, 'pac_early_stopping': True, 'pac_validation_fraction': 0.25, 'pac_n_iter_no_change': 10}. Best is trial 0 with value: 0.422429.[0m
[32m[I 2022-10-20 14:47:45,395][0m Trial 29 finished with value: 0.4224288938309267 and parameters: {'pac_C': 0.005567197300004605, 'pac_early_stopping': True, 'pac_validation_fraction': 0.25, 'pac_n_iter_no_change': 10}. Best is trial 0 with value: 0.422429.[0m
[32m[I 2022-10-20 14:47:46,087][0m Trial 31 finished with value: 0.4224288938309267 and parameters: {'pac_C': 1.1735965329203701, 'pac_early_stopping': True, 'pac_validation_fraction': 0.25, 'pac_n_iter_no_change': 10}. Best is trial 0 with value: 0.422429.[0m
[32m[I 2022-10-20 14:48:01,488][0m Trial 32 finished with value: 0.4224288938309267 and parameters: {'pac_C': 57.319167211749054, 'pac_early_stopping': True, 'pac_validation_fraction': 0.25, 'pac_n_iter_no_change': 10}. Best is trial 0 with value: 0.422429.[0m
[32m[I 2022-10-20 14:48:01,928][0m Trial 33 finished with value: 0.4224288938309267 and parameters: {'pac_C': 50.83409004699441, 'pac_early_stopping': True, 'pac_validation_fraction': 0.25, 'pac_n_iter_no_change': 10}. Best is trial 0 with value: 0.422429.[0m
[32m[I 2022-10-20 14:48:02,614][0m Trial 35 finished with value: 0.4224288938309267 and parameters: {'pac_C': 35.07937823394921, 'pac_early_stopping': True, 'pac_validation_fraction': 0.25, 'pac_n_iter_no_change': 10}. Best is trial 0 with value: 0.422429.[0m
[32m[I 2022-10-20 14:48:02,726][0m Trial 34 finished with value: 0.4224288938309267 and parameters: {'pac_C': 0.7325921130886304, 'pac_early_stopping': True, 'pac_validation_fraction': 0.25, 'pac_n_iter_no_change': 10}. Best is trial 0 with value: 0.422429.[0m
[32m[I 2022-10-20 14:48:03,737][0m Trial 36 finished with value: 0.4224288938309267 and parameters: {'pac_C': 2.447737698187994e-05, 'pac_early_stopping': True, 'pac_validation_fraction': 0.25, 'pac_n_iter_no_change': 10}. Best is trial 0 with value: 0.422429.[0m
[32m[I 2022-10-20 14:48:04,415][0m Trial 38 finished with value: 0.4224288938309267 and parameters: {'pac_C': 1.890027476223571e-05, 'pac_early_stopping': True, 'pac_validation_fraction': 0.25, 'pac_n_iter_no_change': 10}. Best is trial 0 with value: 0.422429.[0m
[32m[I 2022-10-20 14:48:04,525][0m Trial 37 finished with value: 0.4224288938309267 and parameters: {'pac_C': 2.4916427073906594e-05, 'pac_early_stopping': True, 'pac_validation_fraction': 0.25, 'pac_n_iter_no_change': 10}. Best is trial 0 with value: 0.422429.[0m
[32m[I 2022-10-20 14:48:05,376][0m Trial 39 finished with value: 0.4224288938309267 and parameters: {'pac_C': 56.75553503708992, 'pac_early_stopping': True, 'pac_validation_fraction': 0.25, 'pac_n_iter_no_change': 10}. Best is trial 0 with value: 0.422429.[0m
[32m[I 2022-10-20 14:48:20,432][0m Trial 40 finished with value: 0.4224288938309267 and parameters: {'pac_C': 0.009684281409370247, 'pac_early_stopping': True, 'pac_validation_fraction': 0.25, 'pac_n_iter_no_change': 10}. Best is trial 0 with value: 0.422429.[0m
[32m[I 2022-10-20 14:48:20,937][0m Trial 41 finished with value: 0.4224288938309267 and parameters: {'pac_C': 0.008403437105016927, 'pac_early_stopping': True, 'pac_validation_fraction': 0.25, 'pac_n_iter_no_change': 10}. Best is trial 0 with value: 0.422429.[0m
[32m[I 2022-10-20 14:48:21,408][0m Trial 43 finished with value: 0.4224288938309267 and parameters: {'pac_C': 0.3002951561475827, 'pac_early_stopping': True, 'pac_validation_fraction': 0.25, 'pac_n_iter_no_change': 10}. Best is trial 0 with value: 0.422429.[0m
[32m[I 2022-10-20 14:48:22,071][0m Trial 42 finished with value: 0.4224288938309267 and parameters: {'pac_C': 0.028069334753718873, 'pac_early_stopping': True, 'pac_validation_fraction': 0.25, 'pac_n_iter_no_change': 10}. Best is trial 0 with value: 0.422429.[0m
[32m[I 2022-10-20 14:48:22,706][0m Trial 44 finished with value: 0.4224288938309267 and parameters: {'pac_C': 0.05490396679538059, 'pac_early_stopping': True, 'pac_validation_fraction': 0.25, 'pac_n_iter_no_change': 10}. Best is trial 0 with value: 0.422429.[0m
[32m[I 2022-10-20 14:48:23,475][0m Trial 46 finished with value: 0.4224288938309267 and parameters: {'pac_C': 0.025786322860159614, 'pac_early_stopping': True, 'pac_validation_fraction': 0.25, 'pac_n_iter_no_change': 10}. Best is trial 0 with value: 0.422429.[0m
[32m[I 2022-10-20 14:48:23,891][0m Trial 45 finished with value: 0.4224288938309267 and parameters: {'pac_C': 0.02969440583100676, 'pac_early_stopping': True, 'pac_validation_fraction': 0.25, 'pac_n_iter_no_change': 10}. Best is trial 0 with value: 0.422429.[0m
[32m[I 2022-10-20 14:48:24,417][0m Trial 47 finished with value: 0.4224288938309267 and parameters: {'pac_C': 0.01629537281112203, 'pac_early_stopping': True, 'pac_validation_fraction': 0.25, 'pac_n_iter_no_change': 10}. Best is trial 0 with value: 0.422429.[0m
[32m[I 2022-10-20 14:48:39,504][0m Trial 48 finished with value: 0.4224288938309267 and parameters: {'pac_C': 0.39196164176250475, 'pac_early_stopping': True, 'pac_validation_fraction': 0.25, 'pac_n_iter_no_change': 10}. Best is trial 0 with value: 0.422429.[0m
[32m[I 2022-10-20 14:48:39,987][0m Trial 49 finished with value: 0.4224288938309267 and parameters: {'pac_C': 0.5446206931096872, 'pac_early_stopping': True, 'pac_validation_fraction': 0.25, 'pac_n_iter_no_change': 10}. Best is trial 0 with value: 0.422429.[0m
