[32m[I 2022-10-20 04:40:36,006][0m Trial 10 finished with value: 0.2844441188051378 and parameters: {'lgbm_num_leaves': 31, 'lgbm_learning_rate': 1.8587578983108004e-06, 'lgbm_n_estimators': 150, 'lgbm_reg_alpha': 0.8500000000000001, 'lgbm_reg_lambda': 0.05}. Best is trial 8 with value: 0.991481.[0m
[32m[I 2022-10-20 04:40:36,461][0m Trial 16 finished with value: 0.2844441188051378 and parameters: {'lgbm_num_leaves': 63, 'lgbm_learning_rate': 0.0011897171000187234, 'lgbm_n_estimators': 60, 'lgbm_reg_alpha': 0.5, 'lgbm_reg_lambda': 0.7000000000000001}. Best is trial 8 with value: 0.991481.[0m
[32m[I 2022-10-20 04:40:37,432][0m Trial 14 finished with value: 0.9082243754398449 and parameters: {'lgbm_num_leaves': 15, 'lgbm_learning_rate': 0.001892412384152185, 'lgbm_n_estimators': 100, 'lgbm_reg_alpha': 0.25, 'lgbm_reg_lambda': 0.8500000000000001}. Best is trial 8 with value: 0.991481.[0m
[32m[I 2022-10-20 04:40:39,099][0m Trial 13 finished with value: 0.6278865794305353 and parameters: {'lgbm_num_leaves': 15, 'lgbm_learning_rate': 0.857978152556774, 'lgbm_n_estimators': 130, 'lgbm_reg_alpha': 0.4, 'lgbm_reg_lambda': 0.9500000000000001}. Best is trial 8 with value: 0.991481.[0m
[32m[I 2022-10-20 04:40:40,451][0m Trial 18 finished with value: 0.9915812139030649 and parameters: {'lgbm_num_leaves': 127, 'lgbm_learning_rate': 0.04574655875692401, 'lgbm_n_estimators': 60, 'lgbm_reg_alpha': 1.0, 'lgbm_reg_lambda': 0.75}. Best is trial 18 with value: 0.991581.[0m
[32m[I 2022-10-20 04:40:43,440][0m Trial 20 finished with value: 0.9914325479486575 and parameters: {'lgbm_num_leaves': 127, 'lgbm_learning_rate': 0.02601767864847251, 'lgbm_n_estimators': 30, 'lgbm_reg_alpha': 1.0, 'lgbm_reg_lambda': 0.8}. Best is trial 18 with value: 0.991581.[0m
[32m[I 2022-10-20 04:40:44,037][0m Trial 15 finished with value: 0.13404242223702498 and parameters: {'lgbm_num_leaves': 15, 'lgbm_learning_rate': 0.9415485271819223, 'lgbm_n_estimators': 170, 'lgbm_reg_alpha': 0.9, 'lgbm_reg_lambda': 0.25}. Best is trial 18 with value: 0.991581.[0m
[32m[I 2022-10-20 04:40:45,507][0m Trial 23 finished with value: 0.9914769381749308 and parameters: {'lgbm_num_leaves': 127, 'lgbm_learning_rate': 0.05559830385331686, 'lgbm_n_estimators': 20, 'lgbm_reg_alpha': 0.7000000000000001, 'lgbm_reg_lambda': 0.15000000000000002}. Best is trial 18 with value: 0.991581.[0m
[32m[I 2022-10-20 04:40:45,899][0m Trial 22 finished with value: 0.9914968112519253 and parameters: {'lgbm_num_leaves': 127, 'lgbm_learning_rate': 0.03045335251940219, 'lgbm_n_estimators': 30, 'lgbm_reg_alpha': 1.0, 'lgbm_reg_lambda': 0.2}. Best is trial 18 with value: 0.991581.[0m
[32m[I 2022-10-20 04:40:46,918][0m Trial 11 finished with value: 0.9917414094918827 and parameters: {'lgbm_num_leaves': 31, 'lgbm_learning_rate': 0.12300776579275016, 'lgbm_n_estimators': 190, 'lgbm_reg_alpha': 0.15000000000000002, 'lgbm_reg_lambda': 0.9}. Best is trial 11 with value: 0.991741.[0m
[32m[I 2022-10-20 04:40:47,982][0m Trial 19 finished with value: 0.9915850345200282 and parameters: {'lgbm_num_leaves': 127, 'lgbm_learning_rate': 0.02502428570619289, 'lgbm_n_estimators': 60, 'lgbm_reg_alpha': 0.65, 'lgbm_reg_lambda': 0.75}. Best is trial 11 with value: 0.991741.[0m
[32m[I 2022-10-20 04:40:49,547][0m Trial 21 finished with value: 0.9915567480978685 and parameters: {'lgbm_num_leaves': 127, 'lgbm_learning_rate': 0.03335838522213743, 'lgbm_n_estimators': 60, 'lgbm_reg_alpha': 0.7000000000000001, 'lgbm_reg_lambda': 0.65}. Best is trial 11 with value: 0.991741.[0m
[32m[I 2022-10-20 04:40:52,494][0m Trial 12 finished with value: 0.9913848076735291 and parameters: {'lgbm_num_leaves': 127, 'lgbm_learning_rate': 0.0048858751895056425, 'lgbm_n_estimators': 180, 'lgbm_reg_alpha': 0.1, 'lgbm_reg_lambda': 0.5}. Best is trial 11 with value: 0.991741.[0m
[32m[I 2022-10-20 04:40:52,776][0m Trial 25 finished with value: 0.9914514037999583 and parameters: {'lgbm_num_leaves': 7, 'lgbm_learning_rate': 0.08989886639168823, 'lgbm_n_estimators': 50, 'lgbm_reg_alpha': 0.7000000000000001, 'lgbm_reg_lambda': 0.2}. Best is trial 11 with value: 0.991741.[0m
[32m[I 2022-10-20 04:40:54,305][0m Trial 26 finished with value: 0.9915411126218081 and parameters: {'lgbm_num_leaves': 7, 'lgbm_learning_rate': 0.15990937863873325, 'lgbm_n_estimators': 50, 'lgbm_reg_alpha': 0.6000000000000001, 'lgbm_reg_lambda': 0.6000000000000001}. Best is trial 11 with value: 0.991741.[0m
[32m[I 2022-10-20 04:40:56,031][0m Trial 27 finished with value: 0.9917719490672932 and parameters: {'lgbm_num_leaves': 127, 'lgbm_learning_rate': 0.18076436568467374, 'lgbm_n_estimators': 50, 'lgbm_reg_alpha': 1.0, 'lgbm_reg_lambda': 0.6000000000000001}. Best is trial 27 with value: 0.991772.[0m
[32m[I 2022-10-20 04:40:56,626][0m Trial 28 finished with value: 0.9915567094521199 and parameters: {'lgbm_num_leaves': 31, 'lgbm_learning_rate': 0.1657287553855548, 'lgbm_n_estimators': 50, 'lgbm_reg_alpha': 1.0, 'lgbm_reg_lambda': 0.8500000000000001}. Best is trial 27 with value: 0.991772.[0m
[32m[I 2022-10-20 04:40:57,330][0m Trial 29 finished with value: 0.991557095137248 and parameters: {'lgbm_num_leaves': 31, 'lgbm_learning_rate': 0.1869840585749999, 'lgbm_n_estimators': 50, 'lgbm_reg_alpha': 0.30000000000000004, 'lgbm_reg_lambda': 0.8500000000000001}. Best is trial 27 with value: 0.991772.[0m
[32m[I 2022-10-20 04:41:02,431][0m Trial 31 finished with value: 0.9913273364356828 and parameters: {'lgbm_num_leaves': 31, 'lgbm_learning_rate': 0.1348261357189195, 'lgbm_n_estimators': 50, 'lgbm_reg_alpha': 0.30000000000000004, 'lgbm_reg_lambda': 0.8500000000000001}. Best is trial 27 with value: 0.991772.[0m
[32m[I 2022-10-20 04:41:06,559][0m Trial 32 finished with value: 0.991596238495472 and parameters: {'lgbm_num_leaves': 31, 'lgbm_learning_rate': 0.23943122085769758, 'lgbm_n_estimators': 80, 'lgbm_reg_alpha': 0.30000000000000004, 'lgbm_reg_lambda': 0.8500000000000001}. Best is trial 27 with value: 0.991772.[0m
[32m[I 2022-10-20 04:41:08,258][0m Trial 33 finished with value: 0.9917025891955761 and parameters: {'lgbm_num_leaves': 31, 'lgbm_learning_rate': 0.2862935498125422, 'lgbm_n_estimators': 80, 'lgbm_reg_alpha': 0.35000000000000003, 'lgbm_reg_lambda': 0.8500000000000001}. Best is trial 27 with value: 0.991772.[0m
[32m[I 2022-10-20 04:41:08,649][0m Trial 24 finished with value: 0.9915502924608088 and parameters: {'lgbm_num_leaves': 7, 'lgbm_learning_rate': 0.07834829649312877, 'lgbm_n_estimators': 170, 'lgbm_reg_alpha': 0.65, 'lgbm_reg_lambda': 0.2}. Best is trial 27 with value: 0.991772.[0m
[32m[I 2022-10-20 04:41:09,892][0m Trial 34 finished with value: 0.9917565867606695 and parameters: {'lgbm_num_leaves': 31, 'lgbm_learning_rate': 0.27633709734583467, 'lgbm_n_estimators': 80, 'lgbm_reg_alpha': 0.30000000000000004, 'lgbm_reg_lambda': 0.9}. Best is trial 27 with value: 0.991772.[0m
[32m[I 2022-10-20 04:41:10,440][0m Trial 35 finished with value: 0.9917260838439652 and parameters: {'lgbm_num_leaves': 31, 'lgbm_learning_rate': 0.2955756828509919, 'lgbm_n_estimators': 80, 'lgbm_reg_alpha': 0.30000000000000004, 'lgbm_reg_lambda': 0.9}. Best is trial 27 with value: 0.991772.[0m
[32m[I 2022-10-20 04:41:21,412][0m Trial 30 finished with value: 0.2844441188051378 and parameters: {'lgbm_num_leaves': 31, 'lgbm_learning_rate': 0.00019808422462587761, 'lgbm_n_estimators': 180, 'lgbm_reg_alpha': 0.30000000000000004, 'lgbm_reg_lambda': 0.8500000000000001}. Best is trial 27 with value: 0.991772.[0m
[32m[I 2022-10-20 04:41:22,883][0m Trial 36 finished with value: 0.9918706249280156 and parameters: {'lgbm_num_leaves': 31, 'lgbm_learning_rate': 0.3896100481630136, 'lgbm_n_estimators': 190, 'lgbm_reg_alpha': 0.35000000000000003, 'lgbm_reg_lambda': 0.9}. Best is trial 36 with value: 0.991871.[0m
[32m[I 2022-10-20 04:41:25,639][0m Trial 41 finished with value: 0.9918179594523888 and parameters: {'lgbm_num_leaves': 31, 'lgbm_learning_rate': 0.40007367429564167, 'lgbm_n_estimators': 110, 'lgbm_reg_alpha': 0.4, 'lgbm_reg_lambda': 1.0}. Best is trial 36 with value: 0.991871.[0m
[32m[I 2022-10-20 04:41:29,896][0m Trial 42 finished with value: 0.9918326971184258 and parameters: {'lgbm_num_leaves': 31, 'lgbm_learning_rate': 0.4706754034225265, 'lgbm_n_estimators': 120, 'lgbm_reg_alpha': 0.0, 'lgbm_reg_lambda': 0.9500000000000001}. Best is trial 36 with value: 0.991871.[0m
[32m[I 2022-10-20 04:41:36,118][0m Trial 39 finished with value: 0.9919167815400045 and parameters: {'lgbm_num_leaves': 31, 'lgbm_learning_rate': 0.3803654527041173, 'lgbm_n_estimators': 200, 'lgbm_reg_alpha': 0.25, 'lgbm_reg_lambda': 0.9500000000000001}. Best is trial 39 with value: 0.991917.[0m
[32m[I 2022-10-20 04:41:36,268][0m Trial 40 finished with value: 0.9918479488511646 and parameters: {'lgbm_num_leaves': 31, 'lgbm_learning_rate': 0.38165405489086085, 'lgbm_n_estimators': 200, 'lgbm_reg_alpha': 0.25, 'lgbm_reg_lambda': 0.9500000000000001}. Best is trial 39 with value: 0.991917.[0m
[32m[I 2022-10-20 04:41:37,557][0m Trial 38 finished with value: 0.9917643049594643 and parameters: {'lgbm_num_leaves': 31, 'lgbm_learning_rate': 0.42598842414324556, 'lgbm_n_estimators': 200, 'lgbm_reg_alpha': 0.0, 'lgbm_reg_lambda': 1.0}. Best is trial 39 with value: 0.991917.[0m
[32m[I 2022-10-20 04:41:37,777][0m Trial 43 finished with value: 0.9918329540788424 and parameters: {'lgbm_num_leaves': 31, 'lgbm_learning_rate': 0.46999160833988096, 'lgbm_n_estimators': 110, 'lgbm_reg_alpha': 0.2, 'lgbm_reg_lambda': 1.0}. Best is trial 39 with value: 0.991917.[0m
[32m[I 2022-10-20 04:41:38,331][0m Trial 37 finished with value: 0.9915499484303978 and parameters: {'lgbm_num_leaves': 127, 'lgbm_learning_rate': 0.011547763983851763, 'lgbm_n_estimators': 200, 'lgbm_reg_alpha': 0.8, 'lgbm_reg_lambda': 0.9500000000000001}. Best is trial 39 with value: 0.991917.[0m
[32m[I 2022-10-20 04:41:41,088][0m Trial 45 finished with value: 0.9918482784629589 and parameters: {'lgbm_num_leaves': 31, 'lgbm_learning_rate': 0.5088169328418232, 'lgbm_n_estimators': 110, 'lgbm_reg_alpha': 0.4, 'lgbm_reg_lambda': 1.0}. Best is trial 39 with value: 0.991917.[0m
[32m[I 2022-10-20 04:41:45,344][0m Trial 46 finished with value: 0.9918484974595722 and parameters: {'lgbm_num_leaves': 31, 'lgbm_learning_rate': 0.8662429976286649, 'lgbm_n_estimators': 110, 'lgbm_reg_alpha': 0.5, 'lgbm_reg_lambda': 1.0}. Best is trial 39 with value: 0.991917.[0m
[32m[I 2022-10-20 04:41:47,425][0m Trial 44 finished with value: 0.9918252366884832 and parameters: {'lgbm_num_leaves': 31, 'lgbm_learning_rate': 0.5950443493573527, 'lgbm_n_estimators': 190, 'lgbm_reg_alpha': 0.2, 'lgbm_reg_lambda': 1.0}. Best is trial 39 with value: 0.991917.[0m
[32m[I 2022-10-20 04:41:57,936][0m Trial 51 finished with value: 0.9918711369117456 and parameters: {'lgbm_num_leaves': 31, 'lgbm_learning_rate': 0.6205392639833417, 'lgbm_n_estimators': 150, 'lgbm_reg_alpha': 0.2, 'lgbm_reg_lambda': 0.9500000000000001}. Best is trial 39 with value: 0.991917.[0m
[32m[I 2022-10-20 04:42:03,050][0m Trial 49 finished with value: 0.9918249791977017 and parameters: {'lgbm_num_leaves': 31, 'lgbm_learning_rate': 0.5341369843765891, 'lgbm_n_estimators': 200, 'lgbm_reg_alpha': 0.2, 'lgbm_reg_lambda': 0.9500000000000001}. Best is trial 39 with value: 0.991917.[0m
[32m[I 2022-10-20 04:42:04,057][0m Trial 52 finished with value: 0.8151412062631715 and parameters: {'lgbm_num_leaves': 31, 'lgbm_learning_rate': 0.9792854291140771, 'lgbm_n_estimators': 160, 'lgbm_reg_alpha': 0.2, 'lgbm_reg_lambda': 0.9500000000000001}. Best is trial 39 with value: 0.991917.[0m
[32m[I 2022-10-20 04:42:04,436][0m Trial 53 finished with value: 0.9916723850593617 and parameters: {'lgbm_num_leaves': 31, 'lgbm_learning_rate': 0.9041727964704901, 'lgbm_n_estimators': 150, 'lgbm_reg_alpha': 0.5, 'lgbm_reg_lambda': 0.9500000000000001}. Best is trial 39 with value: 0.991917.[0m
[32m[I 2022-10-20 04:42:05,899][0m Trial 47 finished with value: 0.9918787078375044 and parameters: {'lgbm_num_leaves': 31, 'lgbm_learning_rate': 0.5128421132382677, 'lgbm_n_estimators': 200, 'lgbm_reg_alpha': 0.05, 'lgbm_reg_lambda': 1.0}. Best is trial 39 with value: 0.991917.[0m
[32m[I 2022-10-20 04:42:06,684][0m Trial 54 finished with value: 0.9918782693070645 and parameters: {'lgbm_num_leaves': 63, 'lgbm_learning_rate': 0.894943744957161, 'lgbm_n_estimators': 150, 'lgbm_reg_alpha': 0.5, 'lgbm_reg_lambda': 0.9500000000000001}. Best is trial 39 with value: 0.991917.[0m
[32m[I 2022-10-20 04:42:07,186][0m Trial 48 finished with value: 0.9918557029391231 and parameters: {'lgbm_num_leaves': 31, 'lgbm_learning_rate': 0.6348494309202035, 'lgbm_n_estimators': 200, 'lgbm_reg_alpha': 0.0, 'lgbm_reg_lambda': 1.0}. Best is trial 39 with value: 0.991917.[0m
[32m[I 2022-10-20 04:42:12,549][0m Trial 50 finished with value: 0.991303426283834 and parameters: {'lgbm_num_leaves': 31, 'lgbm_learning_rate': 0.010773900976504134, 'lgbm_n_estimators': 200, 'lgbm_reg_alpha': 0.2, 'lgbm_reg_lambda': 0.9500000000000001}. Best is trial 39 with value: 0.991917.[0m
[32m[I 2022-10-20 04:42:16,315][0m Trial 55 finished with value: 0.9917949914756831 and parameters: {'lgbm_num_leaves': 63, 'lgbm_learning_rate': 0.7566067016085256, 'lgbm_n_estimators': 150, 'lgbm_reg_alpha': 0.5, 'lgbm_reg_lambda': 0.9}. Best is trial 39 with value: 0.991917.[0m
[32m[I 2022-10-20 04:42:25,548][0m Trial 56 finished with value: 0.7156695229464033 and parameters: {'lgbm_num_leaves': 63, 'lgbm_learning_rate': 0.9299034876735468, 'lgbm_n_estimators': 150, 'lgbm_reg_alpha': 0.5, 'lgbm_reg_lambda': 0.75}. Best is trial 39 with value: 0.991917.[0m
[32m[I 2022-10-20 04:42:28,522][0m Trial 57 finished with value: 0.2844441188051378 and parameters: {'lgbm_num_leaves': 31, 'lgbm_learning_rate': 0.0002820017839068596, 'lgbm_n_estimators': 140, 'lgbm_reg_alpha': 0.5, 'lgbm_reg_lambda': 0.35000000000000003}. Best is trial 39 with value: 0.991917.[0m
[32m[I 2022-10-20 04:42:29,447][0m Trial 58 finished with value: 0.9916652650701723 and parameters: {'lgbm_num_leaves': 63, 'lgbm_learning_rate': 0.10325714667419808, 'lgbm_n_estimators': 140, 'lgbm_reg_alpha': 0.1, 'lgbm_reg_lambda': 0.9}. Best is trial 39 with value: 0.991917.[0m
[32m[I 2022-10-20 04:42:30,856][0m Trial 59 finished with value: 0.2844441188051378 and parameters: {'lgbm_num_leaves': 63, 'lgbm_learning_rate': 0.00010433082222705733, 'lgbm_n_estimators': 140, 'lgbm_reg_alpha': 0.1, 'lgbm_reg_lambda': 0.9}. Best is trial 39 with value: 0.991917.[0m
[32m[I 2022-10-20 04:42:32,310][0m Trial 60 finished with value: 0.2844441188051378 and parameters: {'lgbm_num_leaves': 63, 'lgbm_learning_rate': 0.00015112589689742436, 'lgbm_n_estimators': 140, 'lgbm_reg_alpha': 0.1, 'lgbm_reg_lambda': 0.8}. Best is trial 39 with value: 0.991917.[0m
[32m[I 2022-10-20 04:42:39,885][0m Trial 61 finished with value: 0.2844441188051378 and parameters: {'lgbm_num_leaves': 63, 'lgbm_learning_rate': 9.988540893484383e-05, 'lgbm_n_estimators': 180, 'lgbm_reg_alpha': 0.05, 'lgbm_reg_lambda': 0.35000000000000003}. Best is trial 39 with value: 0.991917.[0m
[32m[I 2022-10-20 04:42:46,055][0m Trial 62 finished with value: 0.2844441188051378 and parameters: {'lgbm_num_leaves': 63, 'lgbm_learning_rate': 0.00037327952070459637, 'lgbm_n_estimators': 180, 'lgbm_reg_alpha': 0.05, 'lgbm_reg_lambda': 0.8}. Best is trial 39 with value: 0.991917.[0m
[32m[I 2022-10-20 04:42:49,044][0m Trial 63 finished with value: 0.2844441188051378 and parameters: {'lgbm_num_leaves': 63, 'lgbm_learning_rate': 0.00036534658058585, 'lgbm_n_estimators': 180, 'lgbm_reg_alpha': 0.05, 'lgbm_reg_lambda': 0.9}. Best is trial 39 with value: 0.991917.[0m
[32m[I 2022-10-20 04:42:59,053][0m Trial 64 finished with value: 0.2844441188051378 and parameters: {'lgbm_num_leaves': 63, 'lgbm_learning_rate': 0.0005165868863153396, 'lgbm_n_estimators': 180, 'lgbm_reg_alpha': 0.05, 'lgbm_reg_lambda': 0.4}. Best is trial 39 with value: 0.991917.[0m
[32m[I 2022-10-20 04:42:59,147][0m Trial 68 finished with value: 0.9917945123603701 and parameters: {'lgbm_num_leaves': 15, 'lgbm_learning_rate': 0.25352832626405875, 'lgbm_n_estimators': 180, 'lgbm_reg_alpha': 0.05, 'lgbm_reg_lambda': 0.8}. Best is trial 39 with value: 0.991917.[0m
[32m[I 2022-10-20 04:43:00,574][0m Trial 65 finished with value: 0.9917339876948331 and parameters: {'lgbm_num_leaves': 63, 'lgbm_learning_rate': 0.10130299775104266, 'lgbm_n_estimators': 180, 'lgbm_reg_alpha': 0.05, 'lgbm_reg_lambda': 0.8}. Best is trial 39 with value: 0.991917.[0m
[32m[I 2022-10-20 04:43:02,560][0m Trial 67 finished with value: 0.2844441188051378 and parameters: {'lgbm_num_leaves': 15, 'lgbm_learning_rate': 3.5496488768502882e-06, 'lgbm_n_estimators': 180, 'lgbm_reg_alpha': 0.05, 'lgbm_reg_lambda': 0.8}. Best is trial 39 with value: 0.991917.[0m
[32m[I 2022-10-20 04:43:02,968][0m Trial 66 finished with value: 0.2844441188051378 and parameters: {'lgbm_num_leaves': 63, 'lgbm_learning_rate': 2.4344488319995935e-06, 'lgbm_n_estimators': 180, 'lgbm_reg_alpha': 0.05, 'lgbm_reg_lambda': 0.75}. Best is trial 39 with value: 0.991917.[0m
[32m[I 2022-10-20 04:43:10,991][0m Trial 70 finished with value: 0.9916878617668035 and parameters: {'lgbm_num_leaves': 15, 'lgbm_learning_rate': 0.2322392947125285, 'lgbm_n_estimators': 190, 'lgbm_reg_alpha': 0.45, 'lgbm_reg_lambda': 1.0}. Best is trial 39 with value: 0.991917.[0m
[32m[I 2022-10-20 04:43:12,462][0m Trial 69 finished with value: 0.2844441188051378 and parameters: {'lgbm_num_leaves': 15, 'lgbm_learning_rate': 4.141665892973056e-06, 'lgbm_n_estimators': 190, 'lgbm_reg_alpha': 0.45, 'lgbm_reg_lambda': 0.8}. Best is trial 39 with value: 0.991917.[0m
[32m[I 2022-10-20 04:43:14,169][0m Trial 71 finished with value: 0.9916804788765469 and parameters: {'lgbm_num_leaves': 15, 'lgbm_learning_rate': 0.22159322615836452, 'lgbm_n_estimators': 190, 'lgbm_reg_alpha': 0.45, 'lgbm_reg_lambda': 1.0}. Best is trial 39 with value: 0.991917.[0m
[32m[I 2022-10-20 04:43:27,153][0m Trial 78 finished with value: 0.9919930742661458 and parameters: {'lgbm_num_leaves': 31, 'lgbm_learning_rate': 0.5491723874698942, 'lgbm_n_estimators': 100, 'lgbm_reg_alpha': 0.4, 'lgbm_reg_lambda': 1.0}. Best is trial 78 with value: 0.991993.[0m
[32m[I 2022-10-20 04:43:32,337][0m Trial 74 finished with value: 0.9915035716546873 and parameters: {'lgbm_num_leaves': 31, 'lgbm_learning_rate': 0.054246293688851505, 'lgbm_n_estimators': 190, 'lgbm_reg_alpha': 0.55, 'lgbm_reg_lambda': 1.0}. Best is trial 78 with value: 0.991993.[0m
[32m[I 2022-10-20 04:43:34,041][0m Trial 73 finished with value: 0.2844441188051378 and parameters: {'lgbm_num_leaves': 31, 'lgbm_learning_rate': 1.5032102647904984e-06, 'lgbm_n_estimators': 190, 'lgbm_reg_alpha': 0.55, 'lgbm_reg_lambda': 1.0}. Best is trial 78 with value: 0.991993.[0m
[32m[I 2022-10-20 04:43:34,135][0m Trial 72 finished with value: 0.9914877871952282 and parameters: {'lgbm_num_leaves': 31, 'lgbm_learning_rate': 0.002803922192738233, 'lgbm_n_estimators': 190, 'lgbm_reg_alpha': 0.55, 'lgbm_reg_lambda': 1.0}. Best is trial 78 with value: 0.991993.[0m
[32m[I 2022-10-20 04:43:34,339][0m Trial 77 finished with value: 0.9919472480811924 and parameters: {'lgbm_num_leaves': 31, 'lgbm_learning_rate': 0.6587916503507657, 'lgbm_n_estimators': 160, 'lgbm_reg_alpha': 0.55, 'lgbm_reg_lambda': 1.0}. Best is trial 78 with value: 0.991993.[0m
[32m[I 2022-10-20 04:43:34,998][0m Trial 76 finished with value: 0.9915565546974572 and parameters: {'lgbm_num_leaves': 31, 'lgbm_learning_rate': 0.058641189524945264, 'lgbm_n_estimators': 190, 'lgbm_reg_alpha': 0.55, 'lgbm_reg_lambda': 1.0}. Best is trial 78 with value: 0.991993.[0m
[32m[I 2022-10-20 04:43:35,108][0m Trial 75 finished with value: 0.991617419363355 and parameters: {'lgbm_num_leaves': 31, 'lgbm_learning_rate': 0.050243229852092, 'lgbm_n_estimators': 190, 'lgbm_reg_alpha': 0.55, 'lgbm_reg_lambda': 1.0}. Best is trial 78 with value: 0.991993.[0m
[32m[I 2022-10-20 04:43:36,015][0m Trial 79 finished with value: 0.9138565034622637 and parameters: {'lgbm_num_leaves': 31, 'lgbm_learning_rate': 0.0021077906488053866, 'lgbm_n_estimators': 120, 'lgbm_reg_alpha': 0.4, 'lgbm_reg_lambda': 1.0}. Best is trial 78 with value: 0.991993.[0m
[32m[I 2022-10-20 04:43:41,068][0m Trial 80 finished with value: 0.9918785619245076 and parameters: {'lgbm_num_leaves': 31, 'lgbm_learning_rate': 0.6470294058837055, 'lgbm_n_estimators': 100, 'lgbm_reg_alpha': 0.55, 'lgbm_reg_lambda': 0.9500000000000001}. Best is trial 78 with value: 0.991993.[0m
[32m[I 2022-10-20 04:43:48,100][0m Trial 83 finished with value: 0.9918864971469579 and parameters: {'lgbm_num_leaves': 31, 'lgbm_learning_rate': 0.6379388609351894, 'lgbm_n_estimators': 100, 'lgbm_reg_alpha': 0.35000000000000003, 'lgbm_reg_lambda': 0.9500000000000001}. Best is trial 78 with value: 0.991993.[0m
[32m[I 2022-10-20 04:43:49,526][0m Trial 82 finished with value: 0.8255765056358213 and parameters: {'lgbm_num_leaves': 7, 'lgbm_learning_rate': 0.6725373601142203, 'lgbm_n_estimators': 100, 'lgbm_reg_alpha': 0.35000000000000003, 'lgbm_reg_lambda': 0.9500000000000001}. Best is trial 78 with value: 0.991993.[0m
[32m[I 2022-10-20 04:43:49,776][0m Trial 81 finished with value: 0.9087440987362598 and parameters: {'lgbm_num_leaves': 31, 'lgbm_learning_rate': 0.0021465542616582373, 'lgbm_n_estimators': 100, 'lgbm_reg_alpha': 0.35000000000000003, 'lgbm_reg_lambda': 0.9}. Best is trial 78 with value: 0.991993.[0m
[32m[I 2022-10-20 04:43:54,882][0m Trial 88 finished with value: 0.9916799923136218 and parameters: {'lgbm_num_leaves': 31, 'lgbm_learning_rate': 0.3590522854748301, 'lgbm_n_estimators': 90, 'lgbm_reg_alpha': 0.35000000000000003, 'lgbm_reg_lambda': 0.9500000000000001}. Best is trial 78 with value: 0.991993.[0m
