[32m[I 2022-10-20 06:33:37,829][0m Trial 35 finished with value: 0.3004982599365695 and parameters: {'lsvc_nystroem_kernel_gamma': 0.003228201544631362, 'lsvc_nystroem_kernel_n_components': 100, 'lsvc_nystroem_dual': False, 'lsvc_nystroem_C': 0.0035522729191366426, 'lsvc_nystroem_max_iter': 2000}. Best is trial 23 with value: 0.385599.[0m
[32m[I 2022-10-20 06:34:23,031][0m Trial 36 finished with value: 0.32420401054790304 and parameters: {'lsvc_nystroem_kernel_gamma': 0.00667628856172047, 'lsvc_nystroem_kernel_n_components': 150, 'lsvc_nystroem_dual': False, 'lsvc_nystroem_C': 9.831584414337808, 'lsvc_nystroem_max_iter': 2000}. Best is trial 23 with value: 0.385599.[0m
[32m[I 2022-10-20 06:36:51,232][0m Trial 37 finished with value: 0.38664255110837853 and parameters: {'lsvc_nystroem_kernel_gamma': 0.001055479700052347, 'lsvc_nystroem_kernel_n_components': 100, 'lsvc_nystroem_dual': False, 'lsvc_nystroem_C': 141.5595774779427, 'lsvc_nystroem_max_iter': 2000}. Best is trial 37 with value: 0.386643.[0m
[32m[I 2022-10-20 06:39:20,432][0m Trial 38 finished with value: 0.3714751425174362 and parameters: {'lsvc_nystroem_kernel_gamma': 0.0027483658607897073, 'lsvc_nystroem_kernel_n_components': 150, 'lsvc_nystroem_dual': False, 'lsvc_nystroem_C': 985.3897024409373, 'lsvc_nystroem_max_iter': 2000}. Best is trial 37 with value: 0.386643.[0m
[32m[I 2022-10-20 06:39:24,017][0m Trial 39 finished with value: 0.2844441188051378 and parameters: {'lsvc_nystroem_kernel_gamma': 47.04680731163341, 'lsvc_nystroem_kernel_n_components': 100, 'lsvc_nystroem_dual': False, 'lsvc_nystroem_C': 204.57664209455288, 'lsvc_nystroem_max_iter': 2000}. Best is trial 37 with value: 0.386643.[0m
[32m[I 2022-10-20 06:39:26,310][0m Trial 40 finished with value: 0.2844441188051378 and parameters: {'lsvc_nystroem_kernel_gamma': 0.9768664235301195, 'lsvc_nystroem_kernel_n_components': 50, 'lsvc_nystroem_dual': False, 'lsvc_nystroem_C': 249.01094090485128, 'lsvc_nystroem_max_iter': 2000}. Best is trial 37 with value: 0.386643.[0m
[32m[I 2022-10-20 06:42:50,843][0m Trial 41 finished with value: 0.36289147511313086 and parameters: {'lsvc_nystroem_kernel_gamma': 0.003113946780365428, 'lsvc_nystroem_kernel_n_components': 150, 'lsvc_nystroem_dual': False, 'lsvc_nystroem_C': 569.3558881317947, 'lsvc_nystroem_max_iter': 2000}. Best is trial 37 with value: 0.386643.[0m
[32m[I 2022-10-20 06:47:55,927][0m Trial 42 finished with value: 0.37945581687605073 and parameters: {'lsvc_nystroem_kernel_gamma': 0.0023583669379764285, 'lsvc_nystroem_kernel_n_components': 150, 'lsvc_nystroem_dual': False, 'lsvc_nystroem_C': 849.9892711588195, 'lsvc_nystroem_max_iter': 2000}. Best is trial 37 with value: 0.386643.[0m
[32m[I 2022-10-20 06:48:23,169][0m Trial 43 finished with value: 0.3079530252674552 and parameters: {'lsvc_nystroem_kernel_gamma': 0.010416343573377536, 'lsvc_nystroem_kernel_n_components': 100, 'lsvc_nystroem_dual': False, 'lsvc_nystroem_C': 79.6060470041017, 'lsvc_nystroem_max_iter': 2000}. Best is trial 37 with value: 0.386643.[0m
[32m[I 2022-10-20 06:51:21,047][0m Trial 44 finished with value: 0.39023219990325686 and parameters: {'lsvc_nystroem_kernel_gamma': 0.0010146775560791396, 'lsvc_nystroem_kernel_n_components': 100, 'lsvc_nystroem_dual': False, 'lsvc_nystroem_C': 187.80901867449813, 'lsvc_nystroem_max_iter': 2000}. Best is trial 44 with value: 0.390232.[0m
[32m[I 2022-10-20 06:53:10,318][0m Trial 45 finished with value: 0.338886648050781 and parameters: {'lsvc_nystroem_kernel_gamma': 0.0049720492204004185, 'lsvc_nystroem_kernel_n_components': 150, 'lsvc_nystroem_dual': False, 'lsvc_nystroem_C': 135.71924611153065, 'lsvc_nystroem_max_iter': 2000}. Best is trial 44 with value: 0.390232.[0m
[32m[I 2022-10-20 06:54:20,386][0m Trial 46 finished with value: 0.3531177296844718 and parameters: {'lsvc_nystroem_kernel_gamma': 0.0024422568478249655, 'lsvc_nystroem_kernel_n_components': 100, 'lsvc_nystroem_dual': False, 'lsvc_nystroem_C': 306.5090927705556, 'lsvc_nystroem_max_iter': 2000}. Best is trial 44 with value: 0.390232.[0m
[32m[I 2022-10-20 06:54:23,972][0m Trial 47 finished with value: 0.2844441188051378 and parameters: {'lsvc_nystroem_kernel_gamma': 3.533772425987376, 'lsvc_nystroem_kernel_n_components': 100, 'lsvc_nystroem_dual': False, 'lsvc_nystroem_C': 842.3703842850281, 'lsvc_nystroem_max_iter': 2000}. Best is trial 44 with value: 0.390232.[0m
[32m[I 2022-10-20 06:54:26,234][0m Trial 48 finished with value: 0.2844441188051378 and parameters: {'lsvc_nystroem_kernel_gamma': 0.020384907926941687, 'lsvc_nystroem_kernel_n_components': 50, 'lsvc_nystroem_dual': False, 'lsvc_nystroem_C': 0.00013347317650127017, 'lsvc_nystroem_max_iter': 2000}. Best is trial 44 with value: 0.390232.[0m
[32m[I 2022-10-20 06:55:13,226][0m Trial 49 finished with value: 0.3505570137383781 and parameters: {'lsvc_nystroem_kernel_gamma': 0.0017249031061953774, 'lsvc_nystroem_kernel_n_components': 100, 'lsvc_nystroem_dual': False, 'lsvc_nystroem_C': 3.7629158360257993, 'lsvc_nystroem_max_iter': 2000}. Best is trial 44 with value: 0.390232.[0m
[32m[I 2022-10-20 06:55:19,109][0m Trial 50 finished with value: 0.29382920973301496 and parameters: {'lsvc_nystroem_kernel_gamma': 0.05240528332617318, 'lsvc_nystroem_kernel_n_components': 150, 'lsvc_nystroem_dual': False, 'lsvc_nystroem_C': 20.998653838323957, 'lsvc_nystroem_max_iter': 2000}. Best is trial 44 with value: 0.390232.[0m
[32m[I 2022-10-20 06:57:32,098][0m Trial 51 finished with value: 0.38448142280165726 and parameters: {'lsvc_nystroem_kernel_gamma': 0.0010089428853869813, 'lsvc_nystroem_kernel_n_components': 100, 'lsvc_nystroem_dual': False, 'lsvc_nystroem_C': 49.175165473016946, 'lsvc_nystroem_max_iter': 2000}. Best is trial 44 with value: 0.390232.[0m
[32m[I 2022-10-20 06:58:42,830][0m Trial 52 finished with value: 0.3499325936794257 and parameters: {'lsvc_nystroem_kernel_gamma': 0.0022658786945483986, 'lsvc_nystroem_kernel_n_components': 100, 'lsvc_nystroem_dual': False, 'lsvc_nystroem_C': 76.98262722431586, 'lsvc_nystroem_max_iter': 2000}. Best is trial 44 with value: 0.390232.[0m
[32m[I 2022-10-20 07:02:09,375][0m Trial 53 finished with value: 0.3925064262270102 and parameters: {'lsvc_nystroem_kernel_gamma': 0.0010058391598409704, 'lsvc_nystroem_kernel_n_components': 100, 'lsvc_nystroem_dual': False, 'lsvc_nystroem_C': 303.1548738339265, 'lsvc_nystroem_max_iter': 2000}. Best is trial 53 with value: 0.392506.[0m
[32m[I 2022-10-20 07:02:45,125][0m Trial 54 finished with value: 0.36078211990840825 and parameters: {'lsvc_nystroem_kernel_gamma': 0.001079982397004547, 'lsvc_nystroem_kernel_n_components': 100, 'lsvc_nystroem_dual': False, 'lsvc_nystroem_C': 0.7798154393191961, 'lsvc_nystroem_max_iter': 2000}. Best is trial 53 with value: 0.392506.[0m
[32m[I 2022-10-20 07:03:29,573][0m Trial 55 finished with value: 0.3257691837306128 and parameters: {'lsvc_nystroem_kernel_gamma': 0.004987794179757772, 'lsvc_nystroem_kernel_n_components': 100, 'lsvc_nystroem_dual': False, 'lsvc_nystroem_C': 292.6358655982705, 'lsvc_nystroem_max_iter': 2000}. Best is trial 53 with value: 0.392506.[0m
[32m[I 2022-10-20 07:03:50,465][0m Trial 56 finished with value: 0.3050016608033104 and parameters: {'lsvc_nystroem_kernel_gamma': 0.01142345568990475, 'lsvc_nystroem_kernel_n_components': 100, 'lsvc_nystroem_dual': False, 'lsvc_nystroem_C': 18.93278617391966, 'lsvc_nystroem_max_iter': 2000}. Best is trial 53 with value: 0.392506.[0m
[32m[I 2022-10-20 07:05:27,928][0m Trial 57 finished with value: 0.3643248224266336 and parameters: {'lsvc_nystroem_kernel_gamma': 0.0017164014537005706, 'lsvc_nystroem_kernel_n_components': 100, 'lsvc_nystroem_dual': False, 'lsvc_nystroem_C': 118.23957776399307, 'lsvc_nystroem_max_iter': 2000}. Best is trial 53 with value: 0.392506.[0m
[32m[I 2022-10-20 07:05:37,550][0m Trial 58 finished with value: 0.2844441188051378 and parameters: {'lsvc_nystroem_kernel_gamma': 0.0010449619469950207, 'lsvc_nystroem_kernel_n_components': 100, 'lsvc_nystroem_dual': False, 'lsvc_nystroem_C': 2.3749208413762233e-06, 'lsvc_nystroem_max_iter': 2000}. Best is trial 53 with value: 0.392506.[0m
[32m[I 2022-10-20 07:05:51,684][0m Trial 59 finished with value: 0.3026681717103659 and parameters: {'lsvc_nystroem_kernel_gamma': 0.004222608237313671, 'lsvc_nystroem_kernel_n_components': 100, 'lsvc_nystroem_dual': False, 'lsvc_nystroem_C': 0.009480469367907127, 'lsvc_nystroem_max_iter': 2000}. Best is trial 53 with value: 0.392506.[0m
[32m[I 2022-10-20 07:06:47,189][0m Trial 60 finished with value: 0.3571439125501656 and parameters: {'lsvc_nystroem_kernel_gamma': 0.0015482703697842848, 'lsvc_nystroem_kernel_n_components': 100, 'lsvc_nystroem_dual': False, 'lsvc_nystroem_C': 6.5497241408782045, 'lsvc_nystroem_max_iter': 2000}. Best is trial 53 with value: 0.392506.[0m
[32m[I 2022-10-20 07:08:01,174][0m Trial 61 finished with value: 0.360443798612033 and parameters: {'lsvc_nystroem_kernel_gamma': 0.0017694150279273858, 'lsvc_nystroem_kernel_n_components': 100, 'lsvc_nystroem_dual': False, 'lsvc_nystroem_C': 55.64487769297243, 'lsvc_nystroem_max_iter': 2000}. Best is trial 53 with value: 0.392506.[0m
[32m[I 2022-10-20 07:09:22,094][0m Trial 62 finished with value: 0.3426071148767556 and parameters: {'lsvc_nystroem_kernel_gamma': 0.003095946376151393, 'lsvc_nystroem_kernel_n_components': 100, 'lsvc_nystroem_dual': False, 'lsvc_nystroem_C': 371.1602433981121, 'lsvc_nystroem_max_iter': 2000}. Best is trial 53 with value: 0.392506.[0m
[32m[I 2022-10-20 07:13:07,697][0m Trial 63 finished with value: 0.3902787723213998 and parameters: {'lsvc_nystroem_kernel_gamma': 0.001006943986258416, 'lsvc_nystroem_kernel_n_components': 100, 'lsvc_nystroem_dual': False, 'lsvc_nystroem_C': 177.00667666734594, 'lsvc_nystroem_max_iter': 2000}. Best is trial 53 with value: 0.392506.[0m
[32m[I 2022-10-20 07:16:39,781][0m Trial 64 finished with value: 0.38861060331935865 and parameters: {'lsvc_nystroem_kernel_gamma': 0.0010135373415975646, 'lsvc_nystroem_kernel_n_components': 100, 'lsvc_nystroem_dual': False, 'lsvc_nystroem_C': 171.92563014324443, 'lsvc_nystroem_max_iter': 2000}. Best is trial 53 with value: 0.392506.[0m
[32m[I 2022-10-20 07:17:32,901][0m Trial 65 finished with value: 0.3207268047983642 and parameters: {'lsvc_nystroem_kernel_gamma': 0.005978961582597036, 'lsvc_nystroem_kernel_n_components': 100, 'lsvc_nystroem_dual': False, 'lsvc_nystroem_C': 153.84060763555783, 'lsvc_nystroem_max_iter': 2000}. Best is trial 53 with value: 0.392506.[0m
[32m[I 2022-10-20 07:19:46,628][0m Trial 66 finished with value: 0.37143763552956416 and parameters: {'lsvc_nystroem_kernel_gamma': 0.0016134456213334476, 'lsvc_nystroem_kernel_n_components': 100, 'lsvc_nystroem_dual': False, 'lsvc_nystroem_C': 394.9057060520702, 'lsvc_nystroem_max_iter': 2000}. Best is trial 53 with value: 0.392506.[0m
[32m[I 2022-10-20 07:19:50,196][0m Trial 67 finished with value: 0.2844441188051378 and parameters: {'lsvc_nystroem_kernel_gamma': 33.949821137491476, 'lsvc_nystroem_kernel_n_components': 100, 'lsvc_nystroem_dual': False, 'lsvc_nystroem_C': 54.74190073594787, 'lsvc_nystroem_max_iter': 2000}. Best is trial 53 with value: 0.392506.[0m
[32m[I 2022-10-20 07:20:09,705][0m Trial 68 finished with value: 0.31240784133114385 and parameters: {'lsvc_nystroem_kernel_gamma': 0.003801739274947274, 'lsvc_nystroem_kernel_n_components': 100, 'lsvc_nystroem_dual': False, 'lsvc_nystroem_C': 0.07361426628546781, 'lsvc_nystroem_max_iter': 2000}. Best is trial 53 with value: 0.392506.[0m
[32m[I 2022-10-20 07:20:13,585][0m Trial 69 finished with value: 0.28556469994083516 and parameters: {'lsvc_nystroem_kernel_gamma': 0.42388553644302085, 'lsvc_nystroem_kernel_n_components': 100, 'lsvc_nystroem_dual': False, 'lsvc_nystroem_C': 14.464015755624912, 'lsvc_nystroem_max_iter': 2000}. Best is trial 53 with value: 0.392506.[0m
[32m[I 2022-10-20 07:22:43,525][0m Trial 70 finished with value: 0.37463658513652337 and parameters: {'lsvc_nystroem_kernel_gamma': 0.0013842706238009685, 'lsvc_nystroem_kernel_n_components': 100, 'lsvc_nystroem_dual': False, 'lsvc_nystroem_C': 172.02604047868098, 'lsvc_nystroem_max_iter': 2000}. Best is trial 53 with value: 0.392506.[0m
[32m[I 2022-10-20 07:24:21,876][0m Trial 71 finished with value: 0.38339486473833484 and parameters: {'lsvc_nystroem_kernel_gamma': 0.0010221862153547141, 'lsvc_nystroem_kernel_n_components': 100, 'lsvc_nystroem_dual': False, 'lsvc_nystroem_C': 43.27541832416658, 'lsvc_nystroem_max_iter': 2000}. Best is trial 53 with value: 0.392506.[0m
[32m[I 2022-10-20 07:25:18,487][0m Trial 72 finished with value: 0.35008084083517427 and parameters: {'lsvc_nystroem_kernel_gamma': 0.002163218495964451, 'lsvc_nystroem_kernel_n_components': 100, 'lsvc_nystroem_dual': False, 'lsvc_nystroem_C': 32.47123782402572, 'lsvc_nystroem_max_iter': 2000}. Best is trial 53 with value: 0.392506.[0m
[32m[I 2022-10-20 07:27:02,605][0m Trial 73 finished with value: 0.37209754937989137 and parameters: {'lsvc_nystroem_kernel_gamma': 0.0013599048411848153, 'lsvc_nystroem_kernel_n_components': 100, 'lsvc_nystroem_dual': False, 'lsvc_nystroem_C': 59.200532524630304, 'lsvc_nystroem_max_iter': 2000}. Best is trial 53 with value: 0.392506.[0m
[32m[I 2022-10-20 07:30:47,823][0m Trial 74 finished with value: 0.3914355444902468 and parameters: {'lsvc_nystroem_kernel_gamma': 0.001053179972213218, 'lsvc_nystroem_kernel_n_components': 100, 'lsvc_nystroem_dual': False, 'lsvc_nystroem_C': 455.8601414167511, 'lsvc_nystroem_max_iter': 2000}. Best is trial 53 with value: 0.392506.[0m
[32m[I 2022-10-20 07:31:55,912][0m Trial 75 finished with value: 0.33879807044822297 and parameters: {'lsvc_nystroem_kernel_gamma': 0.003331884908665676, 'lsvc_nystroem_kernel_n_components': 100, 'lsvc_nystroem_dual': False, 'lsvc_nystroem_C': 459.3989718431259, 'lsvc_nystroem_max_iter': 2000}. Best is trial 53 with value: 0.392506.[0m
[32m[I 2022-10-20 07:32:22,641][0m Trial 76 finished with value: 0.31347332450732607 and parameters: {'lsvc_nystroem_kernel_gamma': 0.008004347587828498, 'lsvc_nystroem_kernel_n_components': 100, 'lsvc_nystroem_dual': False, 'lsvc_nystroem_C': 114.87927491647278, 'lsvc_nystroem_max_iter': 2000}. Best is trial 53 with value: 0.392506.[0m
[32m[I 2022-10-20 07:34:01,071][0m Trial 77 finished with value: 0.35199400124849295 and parameters: {'lsvc_nystroem_kernel_gamma': 0.0023984498510692064, 'lsvc_nystroem_kernel_n_components': 100, 'lsvc_nystroem_dual': False, 'lsvc_nystroem_C': 222.1192265453613, 'lsvc_nystroem_max_iter': 2000}. Best is trial 53 with value: 0.392506.[0m
[32m[I 2022-10-20 07:36:10,467][0m Trial 78 finished with value: 0.3737583697521956 and parameters: {'lsvc_nystroem_kernel_gamma': 0.0015396869992294897, 'lsvc_nystroem_kernel_n_components': 100, 'lsvc_nystroem_dual': False, 'lsvc_nystroem_C': 429.00459543414, 'lsvc_nystroem_max_iter': 2000}. Best is trial 53 with value: 0.392506.[0m
[32m[I 2022-10-20 07:36:34,643][0m Trial 79 finished with value: 0.3160331113196116 and parameters: {'lsvc_nystroem_kernel_gamma': 0.005472541996183244, 'lsvc_nystroem_kernel_n_components': 100, 'lsvc_nystroem_dual': False, 'lsvc_nystroem_C': 6.337210954444159, 'lsvc_nystroem_max_iter': 2000}. Best is trial 53 with value: 0.392506.[0m
[32m[I 2022-10-20 07:37:29,726][0m Trial 80 finished with value: 0.33432802677844586 and parameters: {'lsvc_nystroem_kernel_gamma': 0.003487401269947305, 'lsvc_nystroem_kernel_n_components': 100, 'lsvc_nystroem_dual': False, 'lsvc_nystroem_C': 96.2912106309164, 'lsvc_nystroem_max_iter': 2000}. Best is trial 53 with value: 0.392506.[0m
[32m[I 2022-10-20 07:38:47,936][0m Trial 81 finished with value: 0.3807629152607337 and parameters: {'lsvc_nystroem_kernel_gamma': 0.001037097749814324, 'lsvc_nystroem_kernel_n_components': 100, 'lsvc_nystroem_dual': False, 'lsvc_nystroem_C': 30.36209371853033, 'lsvc_nystroem_max_iter': 2000}. Best is trial 53 with value: 0.392506.[0m
[32m[I 2022-10-20 07:42:07,741][0m Trial 82 finished with value: 0.39061012790734473 and parameters: {'lsvc_nystroem_kernel_gamma': 0.0010106085917435574, 'lsvc_nystroem_kernel_n_components': 100, 'lsvc_nystroem_dual': False, 'lsvc_nystroem_C': 195.38224806135838, 'lsvc_nystroem_max_iter': 2000}. Best is trial 53 with value: 0.392506.[0m
[32m[I 2022-10-20 07:44:00,928][0m Trial 83 finished with value: 0.35943517242536405 and parameters: {'lsvc_nystroem_kernel_gamma': 0.0020619464992077704, 'lsvc_nystroem_kernel_n_components': 100, 'lsvc_nystroem_dual': False, 'lsvc_nystroem_C': 560.4397541752744, 'lsvc_nystroem_max_iter': 2000}. Best is trial 53 with value: 0.392506.[0m
[32m[I 2022-10-20 07:45:47,147][0m Trial 84 finished with value: 0.3752847900196916 and parameters: {'lsvc_nystroem_kernel_gamma': 0.001396632089121465, 'lsvc_nystroem_kernel_n_components': 100, 'lsvc_nystroem_dual': False, 'lsvc_nystroem_C': 235.95228237007444, 'lsvc_nystroem_max_iter': 2000}. Best is trial 53 with value: 0.392506.[0m
[32m[I 2022-10-20 07:47:10,485][0m Trial 85 finished with value: 0.3572103338376346 and parameters: {'lsvc_nystroem_kernel_gamma': 0.0020754370494361868, 'lsvc_nystroem_kernel_n_components': 100, 'lsvc_nystroem_dual': False, 'lsvc_nystroem_C': 149.8819249903255, 'lsvc_nystroem_max_iter': 2000}. Best is trial 53 with value: 0.392506.[0m
[32m[I 2022-10-20 07:47:14,060][0m Trial 86 finished with value: 0.2844441188051378 and parameters: {'lsvc_nystroem_kernel_gamma': 535.9923625977649, 'lsvc_nystroem_kernel_n_components': 100, 'lsvc_nystroem_dual': False, 'lsvc_nystroem_C': 922.6793056776895, 'lsvc_nystroem_max_iter': 2000}. Best is trial 53 with value: 0.392506.[0m
[32m[I 2022-10-20 07:49:31,417][0m Trial 87 finished with value: 0.3738610498748305 and parameters: {'lsvc_nystroem_kernel_gamma': 0.0014713660186508985, 'lsvc_nystroem_kernel_n_components': 100, 'lsvc_nystroem_dual': False, 'lsvc_nystroem_C': 303.65747958872953, 'lsvc_nystroem_max_iter': 2000}. Best is trial 53 with value: 0.392506.[0m
[32m[I 2022-10-20 07:49:42,431][0m Trial 88 finished with value: 0.2844441188051378 and parameters: {'lsvc_nystroem_kernel_gamma': 0.0034310936223826915, 'lsvc_nystroem_kernel_n_components': 100, 'lsvc_nystroem_dual': False, 'lsvc_nystroem_C': 0.000391678619512782, 'lsvc_nystroem_max_iter': 2000}. Best is trial 53 with value: 0.392506.[0m
[32m[I 2022-10-20 07:50:04,854][0m Trial 89 finished with value: 0.3025429680565196 and parameters: {'lsvc_nystroem_kernel_gamma': 0.0132174213053383, 'lsvc_nystroem_kernel_n_components': 100, 'lsvc_nystroem_dual': False, 'lsvc_nystroem_C': 13.811483860450538, 'lsvc_nystroem_max_iter': 2000}. Best is trial 53 with value: 0.392506.[0m
[32m[I 2022-10-20 07:51:01,981][0m Trial 90 finished with value: 0.3484243315900453 and parameters: {'lsvc_nystroem_kernel_gamma': 0.002503567779110732, 'lsvc_nystroem_kernel_n_components': 100, 'lsvc_nystroem_dual': False, 'lsvc_nystroem_C': 101.79188169299363, 'lsvc_nystroem_max_iter': 2000}. Best is trial 53 with value: 0.392506.[0m
[32m[I 2022-10-20 07:52:51,904][0m Trial 91 finished with value: 0.38409649841789345 and parameters: {'lsvc_nystroem_kernel_gamma': 0.0010207233706563629, 'lsvc_nystroem_kernel_n_components': 100, 'lsvc_nystroem_dual': False, 'lsvc_nystroem_C': 50.74332615824063, 'lsvc_nystroem_max_iter': 2000}. Best is trial 53 with value: 0.392506.[0m
[32m[I 2022-10-20 07:53:37,402][0m Trial 92 finished with value: 0.36161973263992037 and parameters: {'lsvc_nystroem_kernel_gamma': 0.0012349351475038016, 'lsvc_nystroem_kernel_n_components': 100, 'lsvc_nystroem_dual': False, 'lsvc_nystroem_C': 2.348449263918099, 'lsvc_nystroem_max_iter': 2000}. Best is trial 53 with value: 0.392506.[0m
[32m[I 2022-10-20 07:55:44,242][0m Trial 93 finished with value: 0.3851448838152078 and parameters: {'lsvc_nystroem_kernel_gamma': 0.0010115977129815346, 'lsvc_nystroem_kernel_n_components': 100, 'lsvc_nystroem_dual': False, 'lsvc_nystroem_C': 59.91577502148563, 'lsvc_nystroem_max_iter': 2000}. Best is trial 53 with value: 0.392506.[0m
[32m[I 2022-10-20 07:56:57,426][0m Trial 94 finished with value: 0.3568093967158275 and parameters: {'lsvc_nystroem_kernel_gamma': 0.001987573453292317, 'lsvc_nystroem_kernel_n_components': 100, 'lsvc_nystroem_dual': False, 'lsvc_nystroem_C': 77.83816293490372, 'lsvc_nystroem_max_iter': 2000}. Best is trial 53 with value: 0.392506.[0m
[32m[I 2022-10-20 07:59:40,747][0m Trial 95 finished with value: 0.37629161494144 and parameters: {'lsvc_nystroem_kernel_gamma': 0.0014720574389133117, 'lsvc_nystroem_kernel_n_components': 100, 'lsvc_nystroem_dual': False, 'lsvc_nystroem_C': 661.3437082942677, 'lsvc_nystroem_max_iter': 2000}. Best is trial 53 with value: 0.392506.[0m
[32m[I 2022-10-20 08:00:14,824][0m Trial 96 finished with value: 0.314516120270944 and parameters: {'lsvc_nystroem_kernel_gamma': 0.008024697467831698, 'lsvc_nystroem_kernel_n_components': 100, 'lsvc_nystroem_dual': False, 'lsvc_nystroem_C': 171.03218563397013, 'lsvc_nystroem_max_iter': 2000}. Best is trial 53 with value: 0.392506.[0m
[32m[I 2022-10-20 08:01:33,288][0m Trial 97 finished with value: 0.34718841925681027 and parameters: {'lsvc_nystroem_kernel_gamma': 0.0026364133727327472, 'lsvc_nystroem_kernel_n_components': 100, 'lsvc_nystroem_dual': False, 'lsvc_nystroem_C': 269.01582703816774, 'lsvc_nystroem_max_iter': 2000}. Best is trial 53 with value: 0.392506.[0m
[32m[I 2022-10-20 08:02:19,304][0m Trial 98 finished with value: 0.326865345594091 and parameters: {'lsvc_nystroem_kernel_gamma': 0.004515393105375552, 'lsvc_nystroem_kernel_n_components': 100, 'lsvc_nystroem_dual': False, 'lsvc_nystroem_C': 66.40117765353716, 'lsvc_nystroem_max_iter': 2000}. Best is trial 53 with value: 0.392506.[0m
