[32m[I 2022-10-20 15:03:44,118][0m Trial 38 finished with value: 0.9918878660681472 and parameters: {'rfc_criterion': 'gini', 'rfc_n_estimators': 140, 'rfc_min_samples_split': 29, 'rfc_min_samples_leaf': 1, 'rfc_max_features': 45, 'rfc_bootstrap': False}. Best is trial 38 with value: 0.991888.[0m
[32m[I 2022-10-20 15:03:44,642][0m sklearn.ensemble.RandomForestClassifier.fit: fallback to original Scikit-learn[0m
[32m[I 2022-10-20 15:03:57,502][0m sklearn.ensemble.RandomForestClassifier.predict: running accelerated version on CPU[0m
[32m[I 2022-10-20 15:04:02,699][0m Trial 36 finished with value: 0.9918655466217273 and parameters: {'rfc_criterion': 'gini', 'rfc_n_estimators': 190, 'rfc_min_samples_split': 17, 'rfc_min_samples_leaf': 1, 'rfc_max_features': 45, 'rfc_bootstrap': False}. Best is trial 38 with value: 0.991888.[0m
[32m[I 2022-10-20 15:04:03,214][0m sklearn.ensemble.RandomForestClassifier.fit: fallback to original Scikit-learn[0m
[32m[I 2022-10-20 15:04:12,602][0m sklearn.ensemble.RandomForestClassifier.predict: running accelerated version on CPU[0m
[32m[I 2022-10-20 15:04:12,732][0m sklearn.ensemble.RandomForestClassifier.predict: running accelerated version on CPU[0m
[32m[I 2022-10-20 15:04:15,430][0m Trial 37 finished with value: 0.9918655466217273 and parameters: {'rfc_criterion': 'gini', 'rfc_n_estimators': 190, 'rfc_min_samples_split': 17, 'rfc_min_samples_leaf': 1, 'rfc_max_features': 45, 'rfc_bootstrap': False}. Best is trial 38 with value: 0.991888.[0m
[32m[I 2022-10-20 15:04:15,834][0m sklearn.ensemble.RandomForestClassifier.fit: fallback to original Scikit-learn[0m
[32m[I 2022-10-20 15:04:16,062][0m sklearn.ensemble.RandomForestClassifier.predict: running accelerated version on CPU[0m
[32m[I 2022-10-20 15:04:16,144][0m Trial 39 finished with value: 0.9919268529132897 and parameters: {'rfc_criterion': 'gini', 'rfc_n_estimators': 140, 'rfc_min_samples_split': 3, 'rfc_min_samples_leaf': 1, 'rfc_max_features': 45, 'rfc_bootstrap': False}. Best is trial 39 with value: 0.991927.[0m
[32m[I 2022-10-20 15:04:16,403][0m sklearn.ensemble.RandomForestClassifier.fit: fallback to original Scikit-learn[0m
[32m[I 2022-10-20 15:04:16,971][0m Trial 40 finished with value: 0.9917659964012442 and parameters: {'rfc_criterion': 'gini', 'rfc_n_estimators': 140, 'rfc_min_samples_split': 6, 'rfc_min_samples_leaf': 19, 'rfc_max_features': 46, 'rfc_bootstrap': False}. Best is trial 39 with value: 0.991927.[0m
[32m[I 2022-10-20 15:04:17,147][0m sklearn.ensemble.RandomForestClassifier.fit: fallback to original Scikit-learn[0m
[32m[I 2022-10-20 15:04:45,746][0m sklearn.ensemble.RandomForestClassifier.predict: fallback to original Scikit-learn[0m
[32m[I 2022-10-20 15:04:45,746][0m sklearn.ensemble.RandomForestClassifier.predict_proba: fallback to original Scikit-learn[0m
[32m[I 2022-10-20 15:04:48,339][0m Trial 17 finished with value: 0.9915502161297431 and parameters: {'rfc_criterion': 'entropy', 'rfc_n_estimators': 150, 'rfc_min_samples_split': 23, 'rfc_min_samples_leaf': 2, 'rfc_max_features': 48, 'rfc_bootstrap': False}. Best is trial 39 with value: 0.991927.[0m
[32m[I 2022-10-20 15:04:48,558][0m sklearn.ensemble.RandomForestClassifier.fit: fallback to original Scikit-learn[0m
[32m[I 2022-10-20 15:05:36,579][0m sklearn.ensemble.RandomForestClassifier.predict: fallback to original Scikit-learn[0m
[32m[I 2022-10-20 15:05:36,595][0m sklearn.ensemble.RandomForestClassifier.predict_proba: fallback to original Scikit-learn[0m
[32m[I 2022-10-20 15:05:38,724][0m Trial 47 finished with value: 0.9915044591773771 and parameters: {'rfc_criterion': 'entropy', 'rfc_n_estimators': 120, 'rfc_min_samples_split': 8, 'rfc_min_samples_leaf': 9, 'rfc_max_features': 34, 'rfc_bootstrap': True}. Best is trial 39 with value: 0.991927.[0m
[32m[I 2022-10-20 15:05:38,916][0m sklearn.ensemble.RandomForestClassifier.fit: fallback to original Scikit-learn[0m
[32m[I 2022-10-20 15:06:21,380][0m sklearn.ensemble.RandomForestClassifier.predict: fallback to original Scikit-learn[0m
[32m[I 2022-10-20 15:06:21,396][0m sklearn.ensemble.RandomForestClassifier.predict_proba: fallback to original Scikit-learn[0m
[32m[I 2022-10-20 15:06:21,869][0m sklearn.ensemble.RandomForestClassifier.predict: fallback to original Scikit-learn[0m
[32m[I 2022-10-20 15:06:21,869][0m sklearn.ensemble.RandomForestClassifier.predict_proba: fallback to original Scikit-learn[0m
[32m[I 2022-10-20 15:06:22,573][0m sklearn.ensemble.RandomForestClassifier.predict: fallback to original Scikit-learn[0m
[32m[I 2022-10-20 15:06:22,573][0m sklearn.ensemble.RandomForestClassifier.predict_proba: fallback to original Scikit-learn[0m
[32m[I 2022-10-20 15:06:23,817][0m Trial 41 finished with value: 0.9917037084408311 and parameters: {'rfc_criterion': 'entropy', 'rfc_n_estimators': 130, 'rfc_min_samples_split': 5, 'rfc_min_samples_leaf': 1, 'rfc_max_features': 45, 'rfc_bootstrap': False}. Best is trial 39 with value: 0.991927.[0m
[32m[I 2022-10-20 15:06:24,068][0m sklearn.ensemble.RandomForestClassifier.fit: running accelerated version on CPU[0m
[32m[I 2022-10-20 15:06:24,639][0m Trial 42 finished with value: 0.9917264177845267 and parameters: {'rfc_criterion': 'entropy', 'rfc_n_estimators': 130, 'rfc_min_samples_split': 6, 'rfc_min_samples_leaf': 1, 'rfc_max_features': 45, 'rfc_bootstrap': False}. Best is trial 39 with value: 0.991927.[0m
[32m[I 2022-10-20 15:06:25,306][0m sklearn.ensemble.RandomForestClassifier.fit: running accelerated version on CPU[0m
[32m[I 2022-10-20 15:06:25,848][0m Trial 46 finished with value: 0.9916569823519304 and parameters: {'rfc_criterion': 'entropy', 'rfc_n_estimators': 120, 'rfc_min_samples_split': 2, 'rfc_min_samples_leaf': 9, 'rfc_max_features': 45, 'rfc_bootstrap': False}. Best is trial 39 with value: 0.991927.[0m
[32m[I 2022-10-20 15:06:26,532][0m sklearn.ensemble.RandomForestClassifier.fit: running accelerated version on CPU[0m
[32m[I 2022-10-20 15:06:30,500][0m sklearn.ensemble.RandomForestClassifier.predict: fallback to original Scikit-learn[0m
[32m[I 2022-10-20 15:06:30,500][0m sklearn.ensemble.RandomForestClassifier.predict_proba: fallback to original Scikit-learn[0m
[32m[I 2022-10-20 15:06:33,658][0m sklearn.ensemble.RandomForestClassifier.predict: fallback to original Scikit-learn[0m
[32m[I 2022-10-20 15:06:33,664][0m sklearn.ensemble.RandomForestClassifier.predict_proba: fallback to original Scikit-learn[0m
[32m[I 2022-10-20 15:06:34,826][0m Trial 44 finished with value: 0.9916201853128311 and parameters: {'rfc_criterion': 'entropy', 'rfc_n_estimators': 130, 'rfc_min_samples_split': 3, 'rfc_min_samples_leaf': 1, 'rfc_max_features': 44, 'rfc_bootstrap': False}. Best is trial 39 with value: 0.991927.[0m
[32m[I 2022-10-20 15:06:35,482][0m sklearn.ensemble.RandomForestClassifier.fit: running accelerated version on CPU[0m
[32m[I 2022-10-20 15:06:37,998][0m Trial 45 finished with value: 0.9915428761166277 and parameters: {'rfc_criterion': 'entropy', 'rfc_n_estimators': 130, 'rfc_min_samples_split': 2, 'rfc_min_samples_leaf': 16, 'rfc_max_features': 44, 'rfc_bootstrap': False}. Best is trial 39 with value: 0.991927.[0m
[32m[I 2022-10-20 15:06:38,651][0m sklearn.ensemble.RandomForestClassifier.fit: running accelerated version on CPU[0m
[32m[I 2022-10-20 15:06:42,935][0m sklearn.ensemble.RandomForestClassifier.predict: fallback to original Scikit-learn[0m
[32m[I 2022-10-20 15:06:42,935][0m sklearn.ensemble.RandomForestClassifier.predict_proba: fallback to original Scikit-learn[0m
[32m[I 2022-10-20 15:06:47,273][0m Trial 43 finished with value: 0.991665040547875 and parameters: {'rfc_criterion': 'entropy', 'rfc_n_estimators': 140, 'rfc_min_samples_split': 7, 'rfc_min_samples_leaf': 8, 'rfc_max_features': 45, 'rfc_bootstrap': False}. Best is trial 39 with value: 0.991927.[0m
[32m[I 2022-10-20 15:06:47,986][0m sklearn.ensemble.RandomForestClassifier.fit: running accelerated version on CPU[0m
[32m[I 2022-10-20 15:07:08,714][0m sklearn.ensemble.RandomForestClassifier.predict: fallback to original Scikit-learn[0m
[32m[I 2022-10-20 15:07:08,730][0m sklearn.ensemble.RandomForestClassifier.predict_proba: fallback to original Scikit-learn[0m
[32m[I 2022-10-20 15:07:11,992][0m Trial 48 finished with value: 0.9916036182094388 and parameters: {'rfc_criterion': 'entropy', 'rfc_n_estimators': 110, 'rfc_min_samples_split': 7, 'rfc_min_samples_leaf': 9, 'rfc_max_features': 44, 'rfc_bootstrap': False}. Best is trial 39 with value: 0.991927.[0m
[32m[I 2022-10-20 15:07:12,653][0m sklearn.ensemble.RandomForestClassifier.fit: running accelerated version on CPU[0m
[32m[I 2022-10-20 15:07:36,236][0m sklearn.ensemble.RandomForestClassifier.predict: running accelerated version on CPU[0m
[32m[I 2022-10-20 15:07:41,589][0m Trial 50 finished with value: 0.9919113239763567 and parameters: {'rfc_criterion': 'gini', 'rfc_n_estimators': 200, 'rfc_min_samples_split': 2, 'rfc_min_samples_leaf': 5, 'rfc_max_features': 42, 'rfc_bootstrap': False}. Best is trial 39 with value: 0.991927.[0m
[32m[I 2022-10-20 15:07:42,288][0m sklearn.ensemble.RandomForestClassifier.fit: running accelerated version on CPU[0m
[32m[I 2022-10-20 15:07:54,179][0m sklearn.ensemble.RandomForestClassifier.predict: running accelerated version on CPU[0m
[32m[I 2022-10-20 15:07:58,747][0m sklearn.ensemble.RandomForestClassifier.predict: running accelerated version on CPU[0m
[32m[I 2022-10-20 15:07:59,608][0m Trial 51 finished with value: 0.9918955793981588 and parameters: {'rfc_criterion': 'gini', 'rfc_n_estimators': 200, 'rfc_min_samples_split': 29, 'rfc_min_samples_leaf': 5, 'rfc_max_features': 42, 'rfc_bootstrap': False}. Best is trial 39 with value: 0.991927.[0m
[32m[I 2022-10-20 15:08:00,256][0m sklearn.ensemble.RandomForestClassifier.fit: running accelerated version on CPU[0m
[32m[I 2022-10-20 15:08:04,133][0m Trial 52 finished with value: 0.9918724744490361 and parameters: {'rfc_criterion': 'gini', 'rfc_n_estimators': 200, 'rfc_min_samples_split': 30, 'rfc_min_samples_leaf': 5, 'rfc_max_features': 42, 'rfc_bootstrap': False}. Best is trial 39 with value: 0.991927.[0m
[32m[I 2022-10-20 15:08:04,828][0m sklearn.ensemble.RandomForestClassifier.fit: running accelerated version on CPU[0m
[32m[I 2022-10-20 15:08:30,905][0m sklearn.ensemble.RandomForestClassifier.predict: running accelerated version on CPU[0m
[32m[I 2022-10-20 15:08:32,727][0m sklearn.ensemble.RandomForestClassifier.predict: running accelerated version on CPU[0m
[32m[I 2022-10-20 15:08:34,395][0m Trial 54 finished with value: 0.9917266027193589 and parameters: {'rfc_criterion': 'gini', 'rfc_n_estimators': 200, 'rfc_min_samples_split': 29, 'rfc_min_samples_leaf': 5, 'rfc_max_features': 41, 'rfc_bootstrap': True}. Best is trial 39 with value: 0.991927.[0m
[32m[I 2022-10-20 15:08:35,026][0m sklearn.ensemble.RandomForestClassifier.fit: running accelerated version on CPU[0m
[32m[I 2022-10-20 15:08:36,029][0m Trial 55 finished with value: 0.9917266027193589 and parameters: {'rfc_criterion': 'gini', 'rfc_n_estimators': 200, 'rfc_min_samples_split': 29, 'rfc_min_samples_leaf': 5, 'rfc_max_features': 41, 'rfc_bootstrap': True}. Best is trial 39 with value: 0.991927.[0m
[32m[I 2022-10-20 15:08:36,685][0m sklearn.ensemble.RandomForestClassifier.fit: running accelerated version on CPU[0m
[32m[I 2022-10-20 15:08:58,313][0m sklearn.ensemble.RandomForestClassifier.predict: running accelerated version on CPU[0m
[32m[I 2022-10-20 15:09:02,219][0m Trial 53 finished with value: 0.9918955793981588 and parameters: {'rfc_criterion': 'gini', 'rfc_n_estimators': 200, 'rfc_min_samples_split': 29, 'rfc_min_samples_leaf': 5, 'rfc_max_features': 41, 'rfc_bootstrap': False}. Best is trial 39 with value: 0.991927.[0m
[32m[I 2022-10-20 15:09:02,835][0m sklearn.ensemble.RandomForestClassifier.fit: running accelerated version on CPU[0m
[32m[I 2022-10-20 15:09:03,177][0m sklearn.ensemble.RandomForestClassifier.predict: running accelerated version on CPU[0m
[32m[I 2022-10-20 15:09:06,382][0m Trial 56 finished with value: 0.9917266396559609 and parameters: {'rfc_criterion': 'gini', 'rfc_n_estimators': 200, 'rfc_min_samples_split': 28, 'rfc_min_samples_leaf': 5, 'rfc_max_features': 41, 'rfc_bootstrap': True}. Best is trial 39 with value: 0.991927.[0m
[32m[I 2022-10-20 15:09:07,057][0m sklearn.ensemble.RandomForestClassifier.fit: running accelerated version on CPU[0m
[32m[I 2022-10-20 15:09:16,427][0m sklearn.ensemble.RandomForestClassifier.predict: running accelerated version on CPU[0m
[32m[I 2022-10-20 15:09:18,914][0m Trial 61 finished with value: 0.9918853259300681 and parameters: {'rfc_criterion': 'gini', 'rfc_n_estimators': 70, 'rfc_min_samples_split': 33, 'rfc_min_samples_leaf': 12, 'rfc_max_features': 32, 'rfc_bootstrap': False}. Best is trial 39 with value: 0.991927.[0m
[32m[I 2022-10-20 15:09:19,636][0m sklearn.ensemble.RandomForestClassifier.fit: running accelerated version on CPU[0m
[32m[I 2022-10-20 15:09:34,047][0m sklearn.ensemble.RandomForestClassifier.predict: running accelerated version on CPU[0m
[32m[I 2022-10-20 15:09:36,763][0m Trial 60 finished with value: 0.9918495835129632 and parameters: {'rfc_criterion': 'gini', 'rfc_n_estimators': 80, 'rfc_min_samples_split': 32, 'rfc_min_samples_leaf': 4, 'rfc_max_features': 41, 'rfc_bootstrap': False}. Best is trial 39 with value: 0.991927.[0m
[32m[I 2022-10-20 15:09:37,466][0m sklearn.ensemble.RandomForestClassifier.fit: running accelerated version on CPU[0m
[32m[I 2022-10-20 15:09:39,246][0m sklearn.ensemble.RandomForestClassifier.predict: running accelerated version on CPU[0m
[32m[I 2022-10-20 15:09:43,481][0m sklearn.ensemble.RandomForestClassifier.predict: running accelerated version on CPU[0m
[32m[I 2022-10-20 15:09:44,545][0m Trial 57 finished with value: 0.9917266027193589 and parameters: {'rfc_criterion': 'gini', 'rfc_n_estimators': 200, 'rfc_min_samples_split': 29, 'rfc_min_samples_leaf': 5, 'rfc_max_features': 41, 'rfc_bootstrap': True}. Best is trial 39 with value: 0.991927.[0m
[32m[I 2022-10-20 15:09:45,208][0m sklearn.ensemble.RandomForestClassifier.fit: running accelerated version on CPU[0m
[32m[I 2022-10-20 15:09:47,753][0m Trial 58 finished with value: 0.9917266396559609 and parameters: {'rfc_criterion': 'gini', 'rfc_n_estimators': 200, 'rfc_min_samples_split': 28, 'rfc_min_samples_leaf': 5, 'rfc_max_features': 40, 'rfc_bootstrap': True}. Best is trial 39 with value: 0.991927.[0m
[32m[I 2022-10-20 15:09:48,400][0m sklearn.ensemble.RandomForestClassifier.fit: running accelerated version on CPU[0m
[32m[I 2022-10-20 15:09:48,551][0m sklearn.ensemble.RandomForestClassifier.predict: running accelerated version on CPU[0m
[32m[I 2022-10-20 15:09:51,382][0m Trial 62 finished with value: 0.9918775701095811 and parameters: {'rfc_criterion': 'gini', 'rfc_n_estimators': 80, 'rfc_min_samples_split': 33, 'rfc_min_samples_leaf': 12, 'rfc_max_features': 32, 'rfc_bootstrap': False}. Best is trial 39 with value: 0.991927.[0m
[32m[I 2022-10-20 15:09:52,059][0m sklearn.ensemble.RandomForestClassifier.fit: running accelerated version on CPU[0m
[32m[I 2022-10-20 15:10:00,647][0m sklearn.ensemble.RandomForestClassifier.predict: running accelerated version on CPU[0m
[32m[I 2022-10-20 15:10:04,276][0m sklearn.ensemble.RandomForestClassifier.predict: running accelerated version on CPU[0m
[32m[I 2022-10-20 15:10:05,437][0m Trial 59 finished with value: 0.9916579568329682 and parameters: {'rfc_criterion': 'gini', 'rfc_n_estimators': 200, 'rfc_min_samples_split': 30, 'rfc_min_samples_leaf': 4, 'rfc_max_features': 41, 'rfc_bootstrap': True}. Best is trial 39 with value: 0.991927.[0m
[32m[I 2022-10-20 15:10:06,138][0m sklearn.ensemble.RandomForestClassifier.fit: running accelerated version on CPU[0m
[32m[I 2022-10-20 15:10:06,413][0m Trial 64 finished with value: 0.991894068146858 and parameters: {'rfc_criterion': 'gini', 'rfc_n_estimators': 70, 'rfc_min_samples_split': 33, 'rfc_min_samples_leaf': 13, 'rfc_max_features': 34, 'rfc_bootstrap': False}. Best is trial 39 with value: 0.991927.[0m
[32m[I 2022-10-20 15:10:07,141][0m sklearn.ensemble.RandomForestClassifier.fit: running accelerated version on CPU[0m
[32m[I 2022-10-20 15:10:13,788][0m sklearn.ensemble.RandomForestClassifier.predict: running accelerated version on CPU[0m
[32m[I 2022-10-20 15:10:15,340][0m sklearn.ensemble.RandomForestClassifier.predict: running accelerated version on CPU[0m
[32m[I 2022-10-20 15:10:16,217][0m Trial 65 finished with value: 0.9919610420597647 and parameters: {'rfc_criterion': 'gini', 'rfc_n_estimators': 60, 'rfc_min_samples_split': 36, 'rfc_min_samples_leaf': 13, 'rfc_max_features': 31, 'rfc_bootstrap': False}. Best is trial 65 with value: 0.991961.[0m
[32m[I 2022-10-20 15:10:16,979][0m sklearn.ensemble.RandomForestClassifier.fit: running accelerated version on CPU[0m
[32m[I 2022-10-20 15:10:17,663][0m Trial 66 finished with value: 0.9919533965640531 and parameters: {'rfc_criterion': 'gini', 'rfc_n_estimators': 50, 'rfc_min_samples_split': 36, 'rfc_min_samples_leaf': 13, 'rfc_max_features': 31, 'rfc_bootstrap': False}. Best is trial 65 with value: 0.991961.[0m
[32m[I 2022-10-20 15:10:18,333][0m sklearn.ensemble.RandomForestClassifier.fit: running accelerated version on CPU[0m
[32m[I 2022-10-20 15:10:18,483][0m sklearn.ensemble.RandomForestClassifier.predict: running accelerated version on CPU[0m
[32m[I 2022-10-20 15:10:20,623][0m sklearn.ensemble.RandomForestClassifier.predict: running accelerated version on CPU[0m
[32m[I 2022-10-20 15:10:20,653][0m Trial 67 finished with value: 0.9918998770020698 and parameters: {'rfc_criterion': 'gini', 'rfc_n_estimators': 50, 'rfc_min_samples_split': 37, 'rfc_min_samples_leaf': 11, 'rfc_max_features': 27, 'rfc_bootstrap': False}. Best is trial 65 with value: 0.991961.[0m
[32m[I 2022-10-20 15:10:21,339][0m sklearn.ensemble.RandomForestClassifier.fit: running accelerated version on CPU[0m
[32m[I 2022-10-20 15:10:22,703][0m Trial 68 finished with value: 0.9919911465976606 and parameters: {'rfc_criterion': 'gini', 'rfc_n_estimators': 50, 'rfc_min_samples_split': 36, 'rfc_min_samples_leaf': 15, 'rfc_max_features': 27, 'rfc_bootstrap': False}. Best is trial 68 with value: 0.991991.[0m
[32m[I 2022-10-20 15:10:23,418][0m sklearn.ensemble.RandomForestClassifier.fit: running accelerated version on CPU[0m
[32m[I 2022-10-20 15:10:29,391][0m sklearn.ensemble.RandomForestClassifier.predict: running accelerated version on CPU[0m
[32m[I 2022-10-20 15:10:29,709][0m sklearn.ensemble.RandomForestClassifier.predict: running accelerated version on CPU[0m
[32m[I 2022-10-20 15:10:31,526][0m Trial 69 finished with value: 0.9919010560204831 and parameters: {'rfc_criterion': 'gini', 'rfc_n_estimators': 50, 'rfc_min_samples_split': 36, 'rfc_min_samples_leaf': 15, 'rfc_max_features': 29, 'rfc_bootstrap': False}. Best is trial 68 with value: 0.991991.[0m
[32m[I 2022-10-20 15:10:32,227][0m sklearn.ensemble.RandomForestClassifier.fit: running accelerated version on CPU[0m
[32m[I 2022-10-20 15:10:32,775][0m Trial 63 finished with value: 0.9919009095647187 and parameters: {'rfc_criterion': 'gini', 'rfc_n_estimators': 190, 'rfc_min_samples_split': 37, 'rfc_min_samples_leaf': 14, 'rfc_max_features': 33, 'rfc_bootstrap': False}. Best is trial 68 with value: 0.991991.[0m
[32m[I 2022-10-20 15:10:33,264][0m sklearn.ensemble.RandomForestClassifier.predict: running accelerated version on CPU[0m
[32m[I 2022-10-20 15:10:33,501][0m sklearn.ensemble.RandomForestClassifier.fit: running accelerated version on CPU[0m
[32m[I 2022-10-20 15:10:35,636][0m Trial 70 finished with value: 0.9919220713408271 and parameters: {'rfc_criterion': 'gini', 'rfc_n_estimators': 60, 'rfc_min_samples_split': 36, 'rfc_min_samples_leaf': 16, 'rfc_max_features': 26, 'rfc_bootstrap': False}. Best is trial 68 with value: 0.991991.[0m
[32m[I 2022-10-20 15:10:36,310][0m sklearn.ensemble.RandomForestClassifier.fit: running accelerated version on CPU[0m
[32m[I 2022-10-20 15:10:47,410][0m sklearn.ensemble.RandomForestClassifier.predict: running accelerated version on CPU[0m
[32m[I 2022-10-20 15:10:47,731][0m sklearn.ensemble.RandomForestClassifier.predict: running accelerated version on CPU[0m
[32m[I 2022-10-20 15:10:48,795][0m sklearn.ensemble.RandomForestClassifier.predict: running accelerated version on CPU[0m
[32m[I 2022-10-20 15:10:49,135][0m Trial 73 finished with value: 0.9919450850950551 and parameters: {'rfc_criterion': 'gini', 'rfc_n_estimators': 50, 'rfc_min_samples_split': 36, 'rfc_min_samples_leaf': 15, 'rfc_max_features': 25, 'rfc_bootstrap': False}. Best is trial 68 with value: 0.991991.[0m
[32m[I 2022-10-20 15:10:49,830][0m sklearn.ensemble.RandomForestClassifier.fit: running accelerated version on CPU[0m
[32m[I 2022-10-20 15:10:50,063][0m Trial 74 finished with value: 0.9919988659446739 and parameters: {'rfc_criterion': 'gini', 'rfc_n_estimators': 40, 'rfc_min_samples_split': 37, 'rfc_min_samples_leaf': 15, 'rfc_max_features': 28, 'rfc_bootstrap': False}. Best is trial 74 with value: 0.991999.[0m
[32m[I 2022-10-20 15:10:50,758][0m sklearn.ensemble.RandomForestClassifier.fit: running accelerated version on CPU[0m
[32m[I 2022-10-20 15:10:51,141][0m Trial 72 finished with value: 0.9919144797304381 and parameters: {'rfc_criterion': 'gini', 'rfc_n_estimators': 60, 'rfc_min_samples_split': 35, 'rfc_min_samples_leaf': 23, 'rfc_max_features': 28, 'rfc_bootstrap': False}. Best is trial 74 with value: 0.991999.[0m
[32m[I 2022-10-20 15:10:51,597][0m sklearn.ensemble.RandomForestClassifier.predict: running accelerated version on CPU[0m
[32m[I 2022-10-20 15:10:52,013][0m sklearn.ensemble.RandomForestClassifier.fit: running accelerated version on CPU[0m
