[32m[I 2022-10-20 02:09:38,027][0m Trial 12 finished with value: 0.8550328114005628 and parameters: {'cdc_loss': 'modified_huber', 'cdc_penalty': 'l1/l2', 'cdc_C': 0.2193259841164707, 'cdc_alpha': 0.007321856412372942, 'cdc_selection': 'uniform'}. Best is trial 9 with value: 0.952429.[0m
[32m[I 2022-10-20 02:12:02,229][0m Trial 14 finished with value: 0.8279717310993719 and parameters: {'cdc_loss': 'modified_huber', 'cdc_penalty': 'l2', 'cdc_C': 0.006746684639104485, 'cdc_alpha': 793.0705271978585, 'cdc_selection': 'cyclic'}. Best is trial 9 with value: 0.952429.[0m
[32m[I 2022-10-20 02:12:02,949][0m Trial 4 finished with value: 0.9460344564105136 and parameters: {'cdc_loss': 'log', 'cdc_penalty': 'l1/l2', 'cdc_C': 0.2091365547516031, 'cdc_alpha': 0.0015404090040049075, 'cdc_selection': 'cyclic'}. Best is trial 9 with value: 0.952429.[0m
[32m[I 2022-10-20 02:12:03,106][0m Trial 15 finished with value: 0.9042518792671724 and parameters: {'cdc_loss': 'squared', 'cdc_penalty': 'l1', 'cdc_C': 2.754239448189651, 'cdc_alpha': 456.9469456269977, 'cdc_selection': 'cyclic'}. Best is trial 9 with value: 0.952429.[0m
[32m[I 2022-10-20 02:12:03,294][0m Trial 6 finished with value: 0.9460344564105136 and parameters: {'cdc_loss': 'log', 'cdc_penalty': 'l1/l2', 'cdc_C': 910.1164299974882, 'cdc_alpha': 0.5054699095396614, 'cdc_selection': 'cyclic'}. Best is trial 9 with value: 0.952429.[0m
[32m[I 2022-10-20 02:14:42,917][0m Trial 17 finished with value: 0.7966097637100634 and parameters: {'cdc_loss': 'squared_hinge', 'cdc_penalty': 'l1', 'cdc_C': 0.003099616636562323, 'cdc_alpha': 557.1758703530171, 'cdc_selection': 'cyclic'}. Best is trial 9 with value: 0.952429.[0m
[32m[I 2022-10-20 02:15:18,515][0m Trial 16 finished with value: 0.5896396220588019 and parameters: {'cdc_loss': 'squared_hinge', 'cdc_penalty': 'l1', 'cdc_C': 0.001026867947869348, 'cdc_alpha': 891.7531886584605, 'cdc_selection': 'cyclic'}. Best is trial 9 with value: 0.952429.[0m
[32m[I 2022-10-20 02:15:18,688][0m Trial 18 finished with value: 0.8539980965433023 and parameters: {'cdc_loss': 'log', 'cdc_penalty': 'l2', 'cdc_C': 0.0035077355724429603, 'cdc_alpha': 179.99717668175373, 'cdc_selection': 'cyclic'}. Best is trial 9 with value: 0.952429.[0m
[32m[I 2022-10-20 02:21:47,625][0m Trial 13 finished with value: 0.631284164284614 and parameters: {'cdc_loss': 'log', 'cdc_penalty': 'l1/l2', 'cdc_C': 0.0031364713851081815, 'cdc_alpha': 538.2051841373848, 'cdc_selection': 'cyclic'}. Best is trial 9 with value: 0.952429.[0m
[32m[I 2022-10-20 02:22:08,071][0m Trial 19 finished with value: 0.9415769482133299 and parameters: {'cdc_loss': 'log', 'cdc_penalty': 'l2', 'cdc_C': 0.011987806919489573, 'cdc_alpha': 47.928834380500305, 'cdc_selection': 'cyclic'}. Best is trial 9 with value: 0.952429.[0m
[32m[I 2022-10-20 02:22:20,501][0m Trial 21 finished with value: 0.9512535779052733 and parameters: {'cdc_loss': 'squared_hinge', 'cdc_penalty': 'l2', 'cdc_C': 0.015435486191365894, 'cdc_alpha': 46.00157413108414, 'cdc_selection': 'cyclic'}. Best is trial 9 with value: 0.952429.[0m
[32m[I 2022-10-20 02:22:20,501][0m Trial 20 finished with value: 0.9512382902260432 and parameters: {'cdc_loss': 'squared_hinge', 'cdc_penalty': 'l2', 'cdc_C': 0.011364474847618235, 'cdc_alpha': 48.68336047302711, 'cdc_selection': 'cyclic'}. Best is trial 9 with value: 0.952429.[0m
[32m[I 2022-10-20 02:23:48,420][0m Trial 22 finished with value: 0.9513145745133276 and parameters: {'cdc_loss': 'squared_hinge', 'cdc_penalty': 'l2', 'cdc_C': 0.037451487748387996, 'cdc_alpha': 30.219389564271637, 'cdc_selection': 'cyclic'}. Best is trial 9 with value: 0.952429.[0m
[32m[I 2022-10-20 02:24:13,474][0m Trial 23 finished with value: 0.9498806114339828 and parameters: {'cdc_loss': 'log', 'cdc_penalty': 'l2', 'cdc_C': 0.03711950428460697, 'cdc_alpha': 62.646817434147174, 'cdc_selection': 'cyclic'}. Best is trial 9 with value: 0.952429.[0m
[32m[I 2022-10-20 02:24:13,727][0m Trial 24 finished with value: 0.9498802429440835 and parameters: {'cdc_loss': 'log', 'cdc_penalty': 'l2', 'cdc_C': 0.025950370245034635, 'cdc_alpha': 41.62096655753685, 'cdc_selection': 'cyclic'}. Best is trial 9 with value: 0.952429.[0m
[32m[I 2022-10-20 02:24:13,790][0m Trial 25 finished with value: 0.9498919036541201 and parameters: {'cdc_loss': 'log', 'cdc_penalty': 'l2', 'cdc_C': 0.036540786564840944, 'cdc_alpha': 36.66188314229055, 'cdc_selection': 'cyclic'}. Best is trial 9 with value: 0.952429.[0m
[32m[I 2022-10-20 02:24:14,072][0m Trial 26 finished with value: 0.9513220914970673 and parameters: {'cdc_loss': 'squared_hinge', 'cdc_penalty': 'l2', 'cdc_C': 0.04304531397087302, 'cdc_alpha': 32.6248857889194, 'cdc_selection': 'cyclic'}. Best is trial 9 with value: 0.952429.[0m
[32m[I 2022-10-20 02:27:34,080][0m Trial 27 finished with value: 0.9524819202587272 and parameters: {'cdc_loss': 'squared_hinge', 'cdc_penalty': 'l2', 'cdc_C': 42.736808370260356, 'cdc_alpha': 5.175116078943909, 'cdc_selection': 'cyclic'}. Best is trial 27 with value: 0.952482.[0m
[32m[I 2022-10-20 02:27:34,080][0m Trial 29 finished with value: 0.951911068742857 and parameters: {'cdc_loss': 'modified_huber', 'cdc_penalty': 'l2', 'cdc_C': 14.475598613546827, 'cdc_alpha': 6.566644456396966, 'cdc_selection': 'cyclic'}. Best is trial 27 with value: 0.952482.[0m
[32m[I 2022-10-20 02:27:34,080][0m Trial 28 finished with value: 0.9519275077561258 and parameters: {'cdc_loss': 'modified_huber', 'cdc_penalty': 'l2', 'cdc_C': 26.368583762153502, 'cdc_alpha': 8.367088423233216, 'cdc_selection': 'cyclic'}. Best is trial 27 with value: 0.952482.[0m
[32m[I 2022-10-20 02:29:45,230][0m Trial 32 finished with value: 0.9478481167751212 and parameters: {'cdc_loss': 'modified_huber', 'cdc_penalty': 'l1', 'cdc_C': 23.119598498064672, 'cdc_alpha': 8.79569634071435, 'cdc_selection': 'cyclic'}. Best is trial 27 with value: 0.952482.[0m
[32m[I 2022-10-20 02:29:45,230][0m Trial 31 finished with value: 0.9478706976607795 and parameters: {'cdc_loss': 'modified_huber', 'cdc_penalty': 'l1', 'cdc_C': 18.300910345609005, 'cdc_alpha': 6.22609592841616, 'cdc_selection': 'cyclic'}. Best is trial 27 with value: 0.952482.[0m
[32m[I 2022-10-20 02:29:45,230][0m Trial 33 finished with value: 0.949258107366418 and parameters: {'cdc_loss': 'modified_huber', 'cdc_penalty': 'l1', 'cdc_C': 31.214390640130407, 'cdc_alpha': 5.240420291862019, 'cdc_selection': 'cyclic'}. Best is trial 27 with value: 0.952482.[0m
[32m[I 2022-10-20 02:29:45,230][0m Trial 30 finished with value: 0.9493598405155012 and parameters: {'cdc_loss': 'modified_huber', 'cdc_penalty': 'l1', 'cdc_C': 21.465649122800432, 'cdc_alpha': 6.916560611933163, 'cdc_selection': 'cyclic'}. Best is trial 27 with value: 0.952482.[0m
[32m[I 2022-10-20 02:29:45,604][0m Trial 34 finished with value: 0.951083479864193 and parameters: {'cdc_loss': 'modified_huber', 'cdc_penalty': 'l1', 'cdc_C': 20.134299764975548, 'cdc_alpha': 4.319492079001723, 'cdc_selection': 'cyclic'}. Best is trial 27 with value: 0.952482.[0m
[32m[I 2022-10-20 02:31:45,152][0m Trial 35 finished with value: 0.9552166531717549 and parameters: {'cdc_loss': 'modified_huber', 'cdc_penalty': 'l1', 'cdc_C': 72.83110539297975, 'cdc_alpha': 3.675408128799507, 'cdc_selection': 'cyclic'}. Best is trial 35 with value: 0.955217.[0m
[32m[I 2022-10-20 02:31:45,168][0m Trial 37 finished with value: 0.9551021843371648 and parameters: {'cdc_loss': 'modified_huber', 'cdc_penalty': 'l1', 'cdc_C': 129.83370032083778, 'cdc_alpha': 3.159205799052483, 'cdc_selection': 'cyclic'}. Best is trial 35 with value: 0.955217.[0m
[32m[I 2022-10-20 02:31:45,231][0m Trial 36 finished with value: 0.9527205429446961 and parameters: {'cdc_loss': 'modified_huber', 'cdc_penalty': 'l1', 'cdc_C': 110.54670220629083, 'cdc_alpha': 4.7782880586296255, 'cdc_selection': 'cyclic'}. Best is trial 35 with value: 0.955217.[0m
[32m[I 2022-10-20 02:32:23,784][0m Trial 39 finished with value: 0.9047058204139466 and parameters: {'cdc_loss': 'squared', 'cdc_penalty': 'l2', 'cdc_C': 113.21777962839177, 'cdc_alpha': 0.1449992979096861, 'cdc_selection': 'cyclic'}. Best is trial 35 with value: 0.955217.[0m
[32m[I 2022-10-20 02:32:23,972][0m Trial 41 finished with value: 0.9047058204139466 and parameters: {'cdc_loss': 'squared', 'cdc_penalty': 'l2', 'cdc_C': 138.40672924378742, 'cdc_alpha': 1.9700257799608656, 'cdc_selection': 'cyclic'}. Best is trial 35 with value: 0.955217.[0m
[32m[I 2022-10-20 02:32:24,042][0m Trial 40 finished with value: 0.9047058204139466 and parameters: {'cdc_loss': 'squared', 'cdc_penalty': 'l2', 'cdc_C': 162.78020480517978, 'cdc_alpha': 0.20224520861214845, 'cdc_selection': 'cyclic'}. Best is trial 35 with value: 0.955217.[0m
[32m[I 2022-10-20 02:32:24,042][0m Trial 38 finished with value: 0.9047058204139466 and parameters: {'cdc_loss': 'squared', 'cdc_penalty': 'l2', 'cdc_C': 183.1461961716056, 'cdc_alpha': 0.13582796432713348, 'cdc_selection': 'cyclic'}. Best is trial 35 with value: 0.955217.[0m
[32m[I 2022-10-20 02:32:24,183][0m Trial 42 finished with value: 0.9047058204139466 and parameters: {'cdc_loss': 'squared', 'cdc_penalty': 'l2', 'cdc_C': 158.6410721435733, 'cdc_alpha': 0.12096641088334831, 'cdc_selection': 'cyclic'}. Best is trial 35 with value: 0.955217.[0m
[32m[I 2022-10-20 02:33:08,522][0m Trial 43 finished with value: 0.9047058204139466 and parameters: {'cdc_loss': 'squared', 'cdc_penalty': 'l1', 'cdc_C': 87.25835145911277, 'cdc_alpha': 1.9505950038754931, 'cdc_selection': 'uniform'}. Best is trial 35 with value: 0.955217.[0m
[32m[I 2022-10-20 02:33:08,600][0m Trial 45 finished with value: 0.9047058204139466 and parameters: {'cdc_loss': 'squared', 'cdc_penalty': 'l1', 'cdc_C': 118.2567631214711, 'cdc_alpha': 2.101772663307371, 'cdc_selection': 'uniform'}. Best is trial 35 with value: 0.955217.[0m
[32m[I 2022-10-20 02:33:08,662][0m Trial 44 finished with value: 0.9047058204139466 and parameters: {'cdc_loss': 'squared', 'cdc_penalty': 'l1', 'cdc_C': 147.0135258070731, 'cdc_alpha': 0.1166095103194553, 'cdc_selection': 'uniform'}. Best is trial 35 with value: 0.955217.[0m
[32m[I 2022-10-20 02:34:58,694][0m Trial 46 finished with value: 0.907281122056159 and parameters: {'cdc_loss': 'modified_huber', 'cdc_penalty': 'l1', 'cdc_C': 52.02585446711959, 'cdc_alpha': 1.7018904495799323, 'cdc_selection': 'uniform'}. Best is trial 35 with value: 0.955217.[0m
[32m[I 2022-10-20 02:34:58,788][0m Trial 47 finished with value: 0.904753158385941 and parameters: {'cdc_loss': 'squared_hinge', 'cdc_penalty': 'l1', 'cdc_C': 65.77885588342937, 'cdc_alpha': 2.2364263694894837, 'cdc_selection': 'uniform'}. Best is trial 35 with value: 0.955217.[0m
[32m[I 2022-10-20 02:34:58,882][0m Trial 48 finished with value: 0.904753158385941 and parameters: {'cdc_loss': 'squared_hinge', 'cdc_penalty': 'l1', 'cdc_C': 66.16991864843061, 'cdc_alpha': 1.487164471345872, 'cdc_selection': 'uniform'}. Best is trial 35 with value: 0.955217.[0m
[32m[I 2022-10-20 02:34:58,945][0m Trial 50 finished with value: 0.904753158385941 and parameters: {'cdc_loss': 'squared_hinge', 'cdc_penalty': 'l1', 'cdc_C': 356.17715280584844, 'cdc_alpha': 1.8733828596193616, 'cdc_selection': 'uniform'}. Best is trial 35 with value: 0.955217.[0m
[32m[I 2022-10-20 02:34:59,023][0m Trial 49 finished with value: 0.904753158385941 and parameters: {'cdc_loss': 'squared_hinge', 'cdc_penalty': 'l1', 'cdc_C': 51.123757792232716, 'cdc_alpha': 1.6570112576524616, 'cdc_selection': 'uniform'}. Best is trial 35 with value: 0.955217.[0m
[32m[I 2022-10-20 02:35:23,290][0m Trial 53 finished with value: 0.9524440892367784 and parameters: {'cdc_loss': 'squared_hinge', 'cdc_penalty': 'l1', 'cdc_C': 51.20985263773234, 'cdc_alpha': 0.8796798513373035, 'cdc_selection': 'cyclic'}. Best is trial 35 with value: 0.955217.[0m
[32m[I 2022-10-20 02:35:25,685][0m Trial 52 finished with value: 0.9524440892367784 and parameters: {'cdc_loss': 'squared_hinge', 'cdc_penalty': 'l1', 'cdc_C': 374.0990153319489, 'cdc_alpha': 0.9412855610612375, 'cdc_selection': 'cyclic'}. Best is trial 35 with value: 0.955217.[0m
[32m[I 2022-10-20 02:35:29,973][0m Trial 51 finished with value: 0.9516694529112085 and parameters: {'cdc_loss': 'squared_hinge', 'cdc_penalty': 'l1', 'cdc_C': 2.5114578369208145, 'cdc_alpha': 0.8531444760796606, 'cdc_selection': 'cyclic'}. Best is trial 35 with value: 0.955217.[0m
[32m[I 2022-10-20 02:41:54,713][0m Trial 59 finished with value: 0.9516259798708044 and parameters: {'cdc_loss': 'modified_huber', 'cdc_penalty': 'l1/l2', 'cdc_C': 352.70265678866645, 'cdc_alpha': 17.589589436892346, 'cdc_selection': 'cyclic'}. Best is trial 35 with value: 0.955217.[0m
[32m[I 2022-10-20 02:45:01,073][0m Trial 60 finished with value: 0.9525004401489245 and parameters: {'cdc_loss': 'modified_huber', 'cdc_penalty': 'l1/l2', 'cdc_C': 378.327973569685, 'cdc_alpha': 0.44115856976802365, 'cdc_selection': 'cyclic'}. Best is trial 35 with value: 0.955217.[0m
[32m[I 2022-10-20 02:45:59,374][0m Trial 54 finished with value: 0.9515540622378964 and parameters: {'cdc_loss': 'modified_huber', 'cdc_penalty': 'l1/l2', 'cdc_C': 8.552109243652477, 'cdc_alpha': 15.059444312131436, 'cdc_selection': 'cyclic'}. Best is trial 35 with value: 0.955217.[0m
[32m[I 2022-10-20 02:46:01,445][0m Trial 58 finished with value: 0.9519645767028959 and parameters: {'cdc_loss': 'modified_huber', 'cdc_penalty': 'l1/l2', 'cdc_C': 6.4856033570713, 'cdc_alpha': 13.974001833250908, 'cdc_selection': 'cyclic'}. Best is trial 35 with value: 0.955217.[0m
[32m[I 2022-10-20 02:46:04,622][0m Trial 61 finished with value: 0.9516031115248543 and parameters: {'cdc_loss': 'modified_huber', 'cdc_penalty': 'l1/l2', 'cdc_C': 8.98859743086599, 'cdc_alpha': 0.3283795536512875, 'cdc_selection': 'cyclic'}. Best is trial 35 with value: 0.955217.[0m
[32m[I 2022-10-20 02:46:06,001][0m Trial 57 finished with value: 0.952442917725578 and parameters: {'cdc_loss': 'modified_huber', 'cdc_penalty': 'l1/l2', 'cdc_C': 8.264354360647907, 'cdc_alpha': 0.5399417024939942, 'cdc_selection': 'cyclic'}. Best is trial 35 with value: 0.955217.[0m
[32m[I 2022-10-20 02:46:58,835][0m Trial 62 finished with value: 0.9522036942157118 and parameters: {'cdc_loss': 'modified_huber', 'cdc_penalty': 'l1/l2', 'cdc_C': 752.4195423857086, 'cdc_alpha': 0.44479864041484174, 'cdc_selection': 'cyclic'}. Best is trial 35 with value: 0.955217.[0m
[32m[I 2022-10-20 02:47:03,924][0m Trial 55 finished with value: 0.9526114991283112 and parameters: {'cdc_loss': 'modified_huber', 'cdc_penalty': 'l1/l2', 'cdc_C': 7.576390350215009, 'cdc_alpha': 16.728351114993725, 'cdc_selection': 'cyclic'}. Best is trial 35 with value: 0.955217.[0m
[32m[I 2022-10-20 02:47:42,677][0m Trial 56 finished with value: 0.9521100472206798 and parameters: {'cdc_loss': 'modified_huber', 'cdc_penalty': 'l1/l2', 'cdc_C': 11.538313914470322, 'cdc_alpha': 13.795172536885543, 'cdc_selection': 'cyclic'}. Best is trial 35 with value: 0.955217.[0m
[32m[I 2022-10-20 02:53:25,482][0m Trial 63 finished with value: 0.951552138502023 and parameters: {'cdc_loss': 'modified_huber', 'cdc_penalty': 'l1/l2', 'cdc_C': 8.630132793676959, 'cdc_alpha': 0.41670246543533984, 'cdc_selection': 'cyclic'}. Best is trial 35 with value: 0.955217.[0m
[32m[I 2022-10-20 02:54:25,720][0m Trial 68 finished with value: 0.9525646460065783 and parameters: {'cdc_loss': 'modified_huber', 'cdc_penalty': 'l1/l2', 'cdc_C': 266.4363592839452, 'cdc_alpha': 3.5331926323050125, 'cdc_selection': 'cyclic'}. Best is trial 35 with value: 0.955217.[0m
[32m[I 2022-10-20 02:58:33,806][0m Trial 64 finished with value: 0.9524726133907863 and parameters: {'cdc_loss': 'modified_huber', 'cdc_penalty': 'l1/l2', 'cdc_C': 919.639513103837, 'cdc_alpha': 3.2704756756041604, 'cdc_selection': 'cyclic'}. Best is trial 35 with value: 0.955217.[0m
[32m[I 2022-10-20 02:58:37,045][0m Trial 66 finished with value: 0.9521790922734225 and parameters: {'cdc_loss': 'modified_huber', 'cdc_penalty': 'l1/l2', 'cdc_C': 846.7976016683116, 'cdc_alpha': 3.5282358695936598, 'cdc_selection': 'cyclic'}. Best is trial 35 with value: 0.955217.[0m
[32m[I 2022-10-20 02:58:38,641][0m Trial 65 finished with value: 0.9521335201331687 and parameters: {'cdc_loss': 'modified_huber', 'cdc_penalty': 'l1/l2', 'cdc_C': 759.4093032138155, 'cdc_alpha': 0.0548486649714386, 'cdc_selection': 'cyclic'}. Best is trial 35 with value: 0.955217.[0m
[32m[I 2022-10-20 02:59:08,390][0m Trial 67 finished with value: 0.9525065803064584 and parameters: {'cdc_loss': 'modified_huber', 'cdc_penalty': 'l1/l2', 'cdc_C': 461.6780365356817, 'cdc_alpha': 0.05963064936881334, 'cdc_selection': 'cyclic'}. Best is trial 35 with value: 0.955217.[0m
[32m[I 2022-10-20 03:00:21,898][0m Trial 72 finished with value: 0.9519032301857983 and parameters: {'cdc_loss': 'modified_huber', 'cdc_penalty': 'l1/l2', 'cdc_C': 290.16008178975653, 'cdc_alpha': 3.542564950491881, 'cdc_selection': 'cyclic'}. Best is trial 35 with value: 0.955217.[0m
[32m[I 2022-10-20 03:02:07,819][0m Trial 71 finished with value: 0.9524308014077744 and parameters: {'cdc_loss': 'modified_huber', 'cdc_penalty': 'l1/l2', 'cdc_C': 545.8605607396801, 'cdc_alpha': 2.9040651492048783, 'cdc_selection': 'cyclic'}. Best is trial 35 with value: 0.955217.[0m
[32m[I 2022-10-20 03:02:15,750][0m Trial 69 finished with value: 0.9524769990149713 and parameters: {'cdc_loss': 'modified_huber', 'cdc_penalty': 'l1/l2', 'cdc_C': 260.9252581869099, 'cdc_alpha': 3.5250918002466407, 'cdc_selection': 'cyclic'}. Best is trial 35 with value: 0.955217.[0m
[32m[I 2022-10-20 03:03:19,474][0m Trial 70 finished with value: 0.9523456091697236 and parameters: {'cdc_loss': 'modified_huber', 'cdc_penalty': 'l1/l2', 'cdc_C': 370.1993154465416, 'cdc_alpha': 3.7493008593825845, 'cdc_selection': 'cyclic'}. Best is trial 35 with value: 0.955217.[0m
[32m[I 2022-10-20 03:06:47,742][0m Trial 77 finished with value: 0.952376378352993 and parameters: {'cdc_loss': 'modified_huber', 'cdc_penalty': 'l1/l2', 'cdc_C': 0.701960647983481, 'cdc_alpha': 0.0033034771362431426, 'cdc_selection': 'cyclic'}. Best is trial 35 with value: 0.955217.[0m
[32m[I 2022-10-20 03:09:59,747][0m Trial 74 finished with value: 0.9516774621387978 and parameters: {'cdc_loss': 'modified_huber', 'cdc_penalty': 'l1/l2', 'cdc_C': 304.39736373588534, 'cdc_alpha': 0.007299399504335278, 'cdc_selection': 'cyclic'}. Best is trial 35 with value: 0.955217.[0m
[32m[I 2022-10-20 03:10:06,235][0m Trial 73 finished with value: 0.9525308806656206 and parameters: {'cdc_loss': 'modified_huber', 'cdc_penalty': 'l1/l2', 'cdc_C': 259.6873869580461, 'cdc_alpha': 0.004442499315130836, 'cdc_selection': 'cyclic'}. Best is trial 35 with value: 0.955217.[0m
[32m[I 2022-10-20 03:10:12,729][0m Trial 75 finished with value: 0.9524689014258878 and parameters: {'cdc_loss': 'modified_huber', 'cdc_penalty': 'l1/l2', 'cdc_C': 512.0785450863931, 'cdc_alpha': 82.46099998017722, 'cdc_selection': 'cyclic'}. Best is trial 35 with value: 0.955217.[0m
[32m[I 2022-10-20 03:10:36,497][0m Trial 76 finished with value: 0.9525183091419748 and parameters: {'cdc_loss': 'modified_huber', 'cdc_penalty': 'l1/l2', 'cdc_C': 229.62687923278415, 'cdc_alpha': 0.003160651911874215, 'cdc_selection': 'cyclic'}. Best is trial 35 with value: 0.955217.[0m
[32m[I 2022-10-20 03:11:25,132][0m Trial 78 finished with value: 0.9515698029994027 and parameters: {'cdc_loss': 'modified_huber', 'cdc_penalty': 'l1/l2', 'cdc_C': 1.304281821553682, 'cdc_alpha': 0.0013106233750937257, 'cdc_selection': 'cyclic'}. Best is trial 35 with value: 0.955217.[0m
[32m[I 2022-10-20 03:12:42,918][0m Trial 81 finished with value: 0.951552138502023 and parameters: {'cdc_loss': 'modified_huber', 'cdc_penalty': 'l1/l2', 'cdc_C': 34.491849198881376, 'cdc_alpha': 0.050592983377703356, 'cdc_selection': 'cyclic'}. Best is trial 35 with value: 0.955217.[0m
[32m[I 2022-10-20 03:18:47,700][0m Trial 79 finished with value: 0.9524361249215644 and parameters: {'cdc_loss': 'modified_huber', 'cdc_penalty': 'l1/l2', 'cdc_C': 514.8960971542149, 'cdc_alpha': 0.00324815624927555, 'cdc_selection': 'cyclic'}. Best is trial 35 with value: 0.955217.[0m
[32m[I 2022-10-20 03:20:22,682][0m Trial 87 finished with value: 0.9518673339925006 and parameters: {'cdc_loss': 'modified_huber', 'cdc_penalty': 'l1/l2', 'cdc_C': 91.3213735612804, 'cdc_alpha': 0.002235468335052493, 'cdc_selection': 'cyclic'}. Best is trial 35 with value: 0.955217.[0m
[32m[I 2022-10-20 03:20:30,100][0m Trial 80 finished with value: 0.9525804383674541 and parameters: {'cdc_loss': 'modified_huber', 'cdc_penalty': 'l1/l2', 'cdc_C': 213.0325115244421, 'cdc_alpha': 0.0037971850930660573, 'cdc_selection': 'cyclic'}. Best is trial 35 with value: 0.955217.[0m
[32m[I 2022-10-20 03:22:31,129][0m Trial 82 finished with value: 0.9525040433483216 and parameters: {'cdc_loss': 'modified_huber', 'cdc_penalty': 'l1/l2', 'cdc_C': 221.23984635049007, 'cdc_alpha': 0.028316140728120328, 'cdc_selection': 'cyclic'}. Best is trial 35 with value: 0.955217.[0m
[32m[I 2022-10-20 03:22:31,818][0m Trial 86 finished with value: 0.9525327159010575 and parameters: {'cdc_loss': 'modified_huber', 'cdc_penalty': 'l1/l2', 'cdc_C': 198.3196424572863, 'cdc_alpha': 0.0025841154380144816, 'cdc_selection': 'cyclic'}. Best is trial 35 with value: 0.955217.[0m
[32m[I 2022-10-20 03:23:17,628][0m Trial 83 finished with value: 0.9526073758239157 and parameters: {'cdc_loss': 'modified_huber', 'cdc_penalty': 'l1/l2', 'cdc_C': 210.48575104969325, 'cdc_alpha': 0.0010264861253070036, 'cdc_selection': 'cyclic'}. Best is trial 35 with value: 0.955217.[0m
