[32m[I 2022-10-20 01:28:26,009][0m Trial 99 finished with value: 0.7112279308595345 and parameters: {'abc_n_estimators': 65, 'abc_learning_rate': 0.26272100773617113}. Best is trial 8 with value: 0.860355.[0m
[32m[I 2022-10-20 01:28:26,072][0m Study finished.[0m
[32m[I 2022-10-20 01:28:26,150][0m --------------------------------------------------------------------------------[0m
[32m[I 2022-10-20 01:28:26,150][0m --------------------           AdaGradClassifier            --------------------[0m
[32m[I 2022-10-20 01:28:26,150][0m --------------------------------------------------------------------------------[0m
[32m[I 2022-10-20 01:28:26,181][0m A new study created in RDB with name: AdaGradClassifier_b4f53b70[0m
[32m[I 2022-10-20 01:28:26,181][0m Study started.[0m
[32m[I 2022-10-20 01:29:58,087][0m Trial 5 finished with value: 0.6214131228135689 and parameters: {'agc_alpha': 0.2537574352959523, 'agc_l1_ratio': 0.8, 'agc_loss': 'hinge'}. Best is trial 5 with value: 0.903454.[0m
[32m[I 2022-10-20 01:29:58,087][0m Trial 1 finished with value: 0.903453845147846 and parameters: {'agc_alpha': 0.003582925772666172, 'agc_l1_ratio': 0.5, 'agc_loss': 'squared'}. Best is trial 1 with value: 0.903454.[0m
[32m[I 2022-10-20 01:29:58,244][0m Trial 3 finished with value: 0.44407276854079375 and parameters: {'agc_alpha': 38.94878637556596, 'agc_l1_ratio': 0.4, 'agc_loss': 'hinge'}. Best is trial 1 with value: 0.903454.[0m
[32m[I 2022-10-20 01:29:58,307][0m Trial 6 finished with value: 0.16667136246322053 and parameters: {'agc_alpha': 50.14985028775091, 'agc_l1_ratio': 0.8, 'agc_loss': 'log'}. Best is trial 1 with value: 0.903454.[0m
[32m[I 2022-10-20 01:29:58,385][0m Trial 0 finished with value: 0.7142269024903988 and parameters: {'agc_alpha': 0.1258810579679441, 'agc_l1_ratio': 1.0, 'agc_loss': 'hinge'}. Best is trial 1 with value: 0.903454.[0m
[32m[I 2022-10-20 01:29:58,464][0m Trial 7 finished with value: 0.27309501524680796 and parameters: {'agc_alpha': 110.80970579846785, 'agc_l1_ratio': 0.6000000000000001, 'agc_loss': 'log'}. Best is trial 1 with value: 0.903454.[0m
[32m[I 2022-10-20 01:29:58,557][0m Trial 4 finished with value: 0.9511367564986805 and parameters: {'agc_alpha': 0.0018898950882955208, 'agc_l1_ratio': 0.8, 'agc_loss': 'squared_hinge'}. Best is trial 4 with value: 0.951137.[0m
[32m[I 2022-10-20 01:29:58,667][0m Trial 2 finished with value: 0.9511130491735272 and parameters: {'agc_alpha': 0.010986740733843474, 'agc_l1_ratio': 1.0, 'agc_loss': 'squared_hinge'}. Best is trial 4 with value: 0.951137.[0m
[32m[I 2022-10-20 01:31:31,276][0m Trial 12 finished with value: 0.9131495463263851 and parameters: {'agc_alpha': 0.0451953030637773, 'agc_l1_ratio': 0.7000000000000001, 'agc_loss': 'squared_hinge'}. Best is trial 4 with value: 0.951137.[0m
[32m[I 2022-10-20 01:31:31,276][0m Trial 9 finished with value: 0.5482737033112407 and parameters: {'agc_alpha': 23.65418322177955, 'agc_l1_ratio': 0.0, 'agc_loss': 'squared'}. Best is trial 4 with value: 0.951137.[0m
[32m[I 2022-10-20 01:31:31,345][0m Trial 10 finished with value: 0.8651450760304703 and parameters: {'agc_alpha': 0.05419765818759117, 'agc_l1_ratio': 0.30000000000000004, 'agc_loss': 'perceptron'}. Best is trial 4 with value: 0.951137.[0m
[32m[I 2022-10-20 01:31:31,360][0m Trial 13 finished with value: 0.27950164784389614 and parameters: {'agc_alpha': 30.498653261566403, 'agc_l1_ratio': 0.6000000000000001, 'agc_loss': 'squared'}. Best is trial 4 with value: 0.951137.[0m
[32m[I 2022-10-20 01:31:31,485][0m Trial 15 finished with value: 0.8029180074832417 and parameters: {'agc_alpha': 0.007391195159155452, 'agc_l1_ratio': 0.30000000000000004, 'agc_loss': 'log'}. Best is trial 4 with value: 0.951137.[0m
[32m[I 2022-10-20 01:31:31,626][0m Trial 8 finished with value: 0.6172098099919789 and parameters: {'agc_alpha': 0.43278441379897103, 'agc_l1_ratio': 0.7000000000000001, 'agc_loss': 'modified_huber'}. Best is trial 4 with value: 0.951137.[0m
[32m[I 2022-10-20 01:31:31,689][0m Trial 11 finished with value: 0.275417402677795 and parameters: {'agc_alpha': 66.14566338971683, 'agc_l1_ratio': 0.2, 'agc_loss': 'log'}. Best is trial 4 with value: 0.951137.[0m
[32m[I 2022-10-20 01:31:31,783][0m Trial 14 finished with value: 0.8291751617124599 and parameters: {'agc_alpha': 0.004696955105651267, 'agc_l1_ratio': 0.9, 'agc_loss': 'hinge'}. Best is trial 4 with value: 0.951137.[0m
[32m[I 2022-10-20 01:32:55,151][0m Trial 18 finished with value: 0.9511367564986805 and parameters: {'agc_alpha': 0.001127141099288723, 'agc_l1_ratio': 1.0, 'agc_loss': 'squared_hinge'}. Best is trial 4 with value: 0.951137.[0m
[32m[I 2022-10-20 01:32:55,214][0m Trial 17 finished with value: 0.9511367564986805 and parameters: {'agc_alpha': 0.0010026169570227454, 'agc_l1_ratio': 1.0, 'agc_loss': 'squared_hinge'}. Best is trial 4 with value: 0.951137.[0m
[32m[I 2022-10-20 01:32:55,277][0m Trial 21 finished with value: 0.7429884818152731 and parameters: {'agc_alpha': 2.4175167738626264, 'agc_l1_ratio': 1.0, 'agc_loss': 'squared_hinge'}. Best is trial 4 with value: 0.951137.[0m
[32m[I 2022-10-20 01:32:55,355][0m Trial 20 finished with value: 0.9511367564986805 and parameters: {'agc_alpha': 0.0011071606602002253, 'agc_l1_ratio': 1.0, 'agc_loss': 'squared_hinge'}. Best is trial 23 with value: 0.951137.[0m
[32m[I 2022-10-20 01:32:55,418][0m Trial 23 finished with value: 0.9511367564986805 and parameters: {'agc_alpha': 0.0010908914297062956, 'agc_l1_ratio': 1.0, 'agc_loss': 'squared_hinge'}. Best is trial 23 with value: 0.951137.[0m
[32m[I 2022-10-20 01:32:55,498][0m Trial 16 finished with value: 0.9511367564986805 and parameters: {'agc_alpha': 0.0012357699326084406, 'agc_l1_ratio': 1.0, 'agc_loss': 'squared_hinge'}. Best is trial 23 with value: 0.951137.[0m
[32m[I 2022-10-20 01:32:55,580][0m Trial 22 finished with value: 0.5545897478581965 and parameters: {'agc_alpha': 4.022149408233901, 'agc_l1_ratio': 0.9, 'agc_loss': 'squared_hinge'}. Best is trial 23 with value: 0.951137.[0m
[32m[I 2022-10-20 01:32:55,658][0m Trial 19 finished with value: 0.5545893500175859 and parameters: {'agc_alpha': 3.6952538364730665, 'agc_l1_ratio': 1.0, 'agc_loss': 'squared_hinge'}. Best is trial 23 with value: 0.951137.[0m
[32m[I 2022-10-20 01:34:26,164][0m Trial 24 finished with value: 0.27950164784389614 and parameters: {'agc_alpha': 650.0687327580678, 'agc_l1_ratio': 0.8, 'agc_loss': 'smooth_hinge'}. Best is trial 4 with value: 0.951137.[0m
[32m[I 2022-10-20 01:34:26,242][0m Trial 26 finished with value: 0.7596281553930994 and parameters: {'agc_alpha': 0.02692866161018045, 'agc_l1_ratio': 0.8, 'agc_loss': 'smooth_hinge'}. Best is trial 4 with value: 0.951137.[0m
[32m[I 2022-10-20 01:34:26,305][0m Trial 27 finished with value: 0.2816398106664182 and parameters: {'agc_alpha': 570.606837613213, 'agc_l1_ratio': 0.8, 'agc_loss': 'smooth_hinge'}. Best is trial 4 with value: 0.951137.[0m
[32m[I 2022-10-20 01:34:53,117][0m Trial 31 finished with value: 0.28048012187812715 and parameters: {'agc_alpha': 685.9060174960481, 'agc_l1_ratio': 0.8, 'agc_loss': 'smooth_hinge'}. Best is trial 4 with value: 0.951137.[0m
[32m[I 2022-10-20 01:34:57,690][0m Trial 29 finished with value: 0.28040239943782147 and parameters: {'agc_alpha': 788.6979501648284, 'agc_l1_ratio': 0.8, 'agc_loss': 'smooth_hinge'}. Best is trial 4 with value: 0.951137.[0m
[32m[I 2022-10-20 01:34:57,705][0m Trial 28 finished with value: 0.8207613695984072 and parameters: {'agc_alpha': 0.018730668594662582, 'agc_l1_ratio': 0.8, 'agc_loss': 'smooth_hinge'}. Best is trial 4 with value: 0.951137.[0m
[32m[I 2022-10-20 01:34:57,705][0m Trial 25 finished with value: 0.2805849196520042 and parameters: {'agc_alpha': 689.2500015027034, 'agc_l1_ratio': 0.8, 'agc_loss': 'smooth_hinge'}. Best is trial 4 with value: 0.951137.[0m
[32m[I 2022-10-20 01:34:57,893][0m Trial 30 finished with value: 0.875856094016369 and parameters: {'agc_alpha': 0.015490408450481679, 'agc_l1_ratio': 0.8, 'agc_loss': 'smooth_hinge'}. Best is trial 4 with value: 0.951137.[0m
[32m[I 2022-10-20 01:35:48,057][0m Trial 34 finished with value: 0.8762535880409528 and parameters: {'agc_alpha': 0.016149975097787664, 'agc_l1_ratio': 0.9, 'agc_loss': 'modified_huber'}. Best is trial 4 with value: 0.951137.[0m
[32m[I 2022-10-20 01:35:48,135][0m Trial 32 finished with value: 0.880335023364519 and parameters: {'agc_alpha': 0.01282259905828848, 'agc_l1_ratio': 0.9, 'agc_loss': 'modified_huber'}. Best is trial 4 with value: 0.951137.[0m
[32m[I 2022-10-20 01:35:48,135][0m Trial 33 finished with value: 0.9329085328899352 and parameters: {'agc_alpha': 0.0029747085998705317, 'agc_l1_ratio': 0.9, 'agc_loss': 'modified_huber'}. Best is trial 4 with value: 0.951137.[0m
[32m[I 2022-10-20 01:36:18,261][0m Trial 38 finished with value: 0.9511367564986805 and parameters: {'agc_alpha': 0.002861565835400964, 'agc_l1_ratio': 0.9, 'agc_loss': 'squared_hinge'}. Best is trial 38 with value: 0.951137.[0m
[32m[I 2022-10-20 01:36:18,355][0m Trial 37 finished with value: 0.9511367564986805 and parameters: {'agc_alpha': 0.002513278739761675, 'agc_l1_ratio': 0.9, 'agc_loss': 'squared_hinge'}. Best is trial 39 with value: 0.951137.[0m
[32m[I 2022-10-20 01:36:18,355][0m Trial 39 finished with value: 0.9511367564986805 and parameters: {'agc_alpha': 0.0023800934291925676, 'agc_l1_ratio': 0.9, 'agc_loss': 'squared_hinge'}. Best is trial 39 with value: 0.951137.[0m
[32m[I 2022-10-20 01:36:18,355][0m Trial 35 finished with value: 0.9511367564986805 and parameters: {'agc_alpha': 0.0024364099702598703, 'agc_l1_ratio': 0.9, 'agc_loss': 'squared_hinge'}. Best is trial 39 with value: 0.951137.[0m
[32m[I 2022-10-20 01:36:18,355][0m Trial 36 finished with value: 0.9511367564986805 and parameters: {'agc_alpha': 0.0024968813196171937, 'agc_l1_ratio': 0.9, 'agc_loss': 'squared_hinge'}. Best is trial 39 with value: 0.951137.[0m
[32m[I 2022-10-20 01:37:10,293][0m Trial 42 finished with value: 0.9511367564986805 and parameters: {'agc_alpha': 0.0024088322329967196, 'agc_l1_ratio': 1.0, 'agc_loss': 'squared_hinge'}. Best is trial 42 with value: 0.951137.[0m
[32m[I 2022-10-20 01:37:10,293][0m Trial 40 finished with value: 0.9511367564986805 and parameters: {'agc_alpha': 0.002079325350675619, 'agc_l1_ratio': 1.0, 'agc_loss': 'squared_hinge'}. Best is trial 42 with value: 0.951137.[0m
[32m[I 2022-10-20 01:37:10,293][0m Trial 41 finished with value: 0.9511367564986805 and parameters: {'agc_alpha': 0.0027357102710221202, 'agc_l1_ratio': 1.0, 'agc_loss': 'squared_hinge'}. Best is trial 42 with value: 0.951137.[0m
[32m[I 2022-10-20 01:37:41,731][0m Trial 44 finished with value: 0.5547265401368044 and parameters: {'agc_alpha': 0.1270886019642003, 'agc_l1_ratio': 0.7000000000000001, 'agc_loss': 'perceptron'}. Best is trial 4 with value: 0.951137.[0m
[32m[I 2022-10-20 01:37:41,810][0m Trial 46 finished with value: 0.8463336539265075 and parameters: {'agc_alpha': 0.00617059120439658, 'agc_l1_ratio': 0.7000000000000001, 'agc_loss': 'perceptron'}. Best is trial 4 with value: 0.951137.[0m
[32m[I 2022-10-20 01:37:41,810][0m Trial 45 finished with value: 0.9509516848138647 and parameters: {'agc_alpha': 0.0061486510388259275, 'agc_l1_ratio': 0.7000000000000001, 'agc_loss': 'squared_hinge'}. Best is trial 4 with value: 0.951137.[0m
[32m[I 2022-10-20 01:37:41,873][0m Trial 47 finished with value: 0.8624546617540105 and parameters: {'agc_alpha': 0.005015427002326114, 'agc_l1_ratio': 0.7000000000000001, 'agc_loss': 'perceptron'}. Best is trial 4 with value: 0.951137.[0m
[32m[I 2022-10-20 01:37:41,935][0m Trial 43 finished with value: 0.8539713406510985 and parameters: {'agc_alpha': 0.005206011469843366, 'agc_l1_ratio': 0.7000000000000001, 'agc_loss': 'perceptron'}. Best is trial 4 with value: 0.951137.[0m
[32m[I 2022-10-20 01:38:36,014][0m Trial 50 finished with value: 0.8132059807787081 and parameters: {'agc_alpha': 0.006725389909593596, 'agc_l1_ratio': 0.6000000000000001, 'agc_loss': 'perceptron'}. Best is trial 4 with value: 0.951137.[0m
[32m[I 2022-10-20 01:38:36,014][0m Trial 49 finished with value: 0.8268375449887084 and parameters: {'agc_alpha': 0.005855318231440275, 'agc_l1_ratio': 0.7000000000000001, 'agc_loss': 'perceptron'}. Best is trial 4 with value: 0.951137.[0m
[32m[I 2022-10-20 01:38:36,139][0m Trial 48 finished with value: 0.8126904220176425 and parameters: {'agc_alpha': 0.006973938461059184, 'agc_l1_ratio': 0.7000000000000001, 'agc_loss': 'perceptron'}. Best is trial 4 with value: 0.951137.[0m
[32m[I 2022-10-20 01:39:09,667][0m Trial 54 finished with value: 0.9261983296534809 and parameters: {'agc_alpha': 0.0011092349657806152, 'agc_l1_ratio': 1.0, 'agc_loss': 'hinge'}. Best is trial 4 with value: 0.951137.[0m
[32m[I 2022-10-20 01:39:09,761][0m Trial 55 finished with value: 0.9509544701134772 and parameters: {'agc_alpha': 0.0010288004838470658, 'agc_l1_ratio': 1.0, 'agc_loss': 'hinge'}. Best is trial 4 with value: 0.951137.[0m
[32m[I 2022-10-20 01:39:09,777][0m Trial 53 finished with value: 0.9509547978528468 and parameters: {'agc_alpha': 0.0010980599734363005, 'agc_l1_ratio': 1.0, 'agc_loss': 'hinge'}. Best is trial 4 with value: 0.951137.[0m
[32m[I 2022-10-20 01:39:09,777][0m Trial 52 finished with value: 0.9035528865076398 and parameters: {'agc_alpha': 0.0011948221567265728, 'agc_l1_ratio': 1.0, 'agc_loss': 'squared'}. Best is trial 4 with value: 0.951137.[0m
[32m[I 2022-10-20 01:39:09,965][0m Trial 51 finished with value: 0.9510923407466488 and parameters: {'agc_alpha': 0.0010097321593115246, 'agc_l1_ratio': 1.0, 'agc_loss': 'hinge'}. Best is trial 4 with value: 0.951137.[0m
[32m[I 2022-10-20 01:40:00,695][0m Trial 56 finished with value: 0.8275407480706476 and parameters: {'agc_alpha': 0.0017219862311896655, 'agc_l1_ratio': 0.5, 'agc_loss': 'hinge'}. Best is trial 4 with value: 0.951137.[0m
[32m[I 2022-10-20 01:40:00,758][0m Trial 57 finished with value: 0.8278779642720681 and parameters: {'agc_alpha': 0.0015752720731728386, 'agc_l1_ratio': 0.5, 'agc_loss': 'hinge'}. Best is trial 4 with value: 0.951137.[0m
[32m[I 2022-10-20 01:40:00,773][0m Trial 58 finished with value: 0.9038256129015431 and parameters: {'agc_alpha': 0.0015836955154438052, 'agc_l1_ratio': 0.5, 'agc_loss': 'squared'}. Best is trial 4 with value: 0.951137.[0m
[32m[I 2022-10-20 01:40:31,656][0m Trial 59 finished with value: 0.9347417785926814 and parameters: {'agc_alpha': 0.039445581948545534, 'agc_l1_ratio': 0.0, 'agc_loss': 'squared_hinge'}. Best is trial 4 with value: 0.951137.[0m
[32m[I 2022-10-20 01:40:31,719][0m Trial 61 finished with value: 0.9115004925321857 and parameters: {'agc_alpha': 0.053017148863433824, 'agc_l1_ratio': 0.5, 'agc_loss': 'squared_hinge'}. Best is trial 4 with value: 0.951137.[0m
[32m[I 2022-10-20 01:40:31,797][0m Trial 60 finished with value: 0.8913844047860138 and parameters: {'agc_alpha': 0.059735237853288395, 'agc_l1_ratio': 0.5, 'agc_loss': 'squared_hinge'}. Best is trial 4 with value: 0.951137.[0m
[32m[I 2022-10-20 01:40:31,797][0m Trial 63 finished with value: 0.9376507169264342 and parameters: {'agc_alpha': 0.03691199885375487, 'agc_l1_ratio': 0.0, 'agc_loss': 'squared_hinge'}. Best is trial 4 with value: 0.951137.[0m
[32m[I 2022-10-20 01:40:31,923][0m Trial 62 finished with value: 0.9413047374990602 and parameters: {'agc_alpha': 0.03442660354077183, 'agc_l1_ratio': 0.1, 'agc_loss': 'squared_hinge'}. Best is trial 4 with value: 0.951137.[0m
[32m[I 2022-10-20 01:41:23,596][0m Trial 66 finished with value: 0.8589694213357291 and parameters: {'agc_alpha': 0.06741612327629204, 'agc_l1_ratio': 0.9, 'agc_loss': 'squared_hinge'}. Best is trial 4 with value: 0.951137.[0m
[32m[I 2022-10-20 01:41:23,596][0m Trial 64 finished with value: 0.9511289928417372 and parameters: {'agc_alpha': 0.00347498900193148, 'agc_l1_ratio': 0.9, 'agc_loss': 'squared_hinge'}. Best is trial 4 with value: 0.951137.[0m
[32m[I 2022-10-20 01:41:23,596][0m Trial 65 finished with value: 0.857735168475451 and parameters: {'agc_alpha': 0.07245423920326899, 'agc_l1_ratio': 0.9, 'agc_loss': 'squared_hinge'}. Best is trial 4 with value: 0.951137.[0m
[32m[I 2022-10-20 01:42:01,510][0m Trial 67 finished with value: 0.9511065647882512 and parameters: {'agc_alpha': 0.0039091812780327915, 'agc_l1_ratio': 0.9, 'agc_loss': 'squared_hinge'}. Best is trial 4 with value: 0.951137.[0m
[32m[I 2022-10-20 01:42:01,526][0m Trial 69 finished with value: 0.9511065647882512 and parameters: {'agc_alpha': 0.0038192903371581472, 'agc_l1_ratio': 0.9, 'agc_loss': 'squared_hinge'}. Best is trial 4 with value: 0.951137.[0m
[32m[I 2022-10-20 01:42:01,526][0m Trial 70 finished with value: 0.9509828354203607 and parameters: {'agc_alpha': 0.003958581868088588, 'agc_l1_ratio': 0.4, 'agc_loss': 'squared_hinge'}. Best is trial 4 with value: 0.951137.[0m
[32m[I 2022-10-20 01:42:01,526][0m Trial 68 finished with value: 0.5515014735037458 and parameters: {'agc_alpha': 11.903295761986708, 'agc_l1_ratio': 0.9, 'agc_loss': 'squared_hinge'}. Best is trial 4 with value: 0.951137.[0m
[32m[I 2022-10-20 01:42:01,526][0m Trial 71 finished with value: 0.9511140408625512 and parameters: {'agc_alpha': 0.003786265038744218, 'agc_l1_ratio': 0.9, 'agc_loss': 'squared_hinge'}. Best is trial 4 with value: 0.951137.[0m
[32m[I 2022-10-20 01:43:01,233][0m Trial 73 finished with value: 0.8687798143139313 and parameters: {'agc_alpha': 0.003430119412165687, 'agc_l1_ratio': 0.9, 'agc_loss': 'log'}. Best is trial 4 with value: 0.951137.[0m
[32m[I 2022-10-20 01:43:01,312][0m Trial 74 finished with value: 0.8485880250264786 and parameters: {'agc_alpha': 0.0033425603173781846, 'agc_l1_ratio': 0.9, 'agc_loss': 'log'}. Best is trial 4 with value: 0.951137.[0m
[32m[I 2022-10-20 01:43:01,312][0m Trial 72 finished with value: 0.8636600693568234 and parameters: {'agc_alpha': 0.01031029046586557, 'agc_l1_ratio': 0.9, 'agc_loss': 'log'}. Best is trial 4 with value: 0.951137.[0m
[32m[I 2022-10-20 01:43:32,474][0m Trial 75 finished with value: 0.9028272228784812 and parameters: {'agc_alpha': 0.0022113538670690733, 'agc_l1_ratio': 1.0, 'agc_loss': 'log'}. Best is trial 4 with value: 0.951137.[0m
[32m[I 2022-10-20 01:43:32,490][0m Trial 79 finished with value: 0.8965386422808459 and parameters: {'agc_alpha': 0.0020315021506528367, 'agc_l1_ratio': 1.0, 'agc_loss': 'log'}. Best is trial 4 with value: 0.951137.[0m
[32m[I 2022-10-20 01:43:32,553][0m Trial 77 finished with value: 0.9511110466323497 and parameters: {'agc_alpha': 0.009292554975847921, 'agc_l1_ratio': 1.0, 'agc_loss': 'squared_hinge'}. Best is trial 4 with value: 0.951137.[0m
[32m[I 2022-10-20 01:43:32,678][0m Trial 78 finished with value: 0.9501941319800448 and parameters: {'agc_alpha': 0.002365724995587001, 'agc_l1_ratio': 1.0, 'agc_loss': 'log'}. Best is trial 4 with value: 0.951137.[0m
[32m[I 2022-10-20 01:43:32,740][0m Trial 76 finished with value: 0.8911261259694926 and parameters: {'agc_alpha': 0.0022913024807163776, 'agc_l1_ratio': 1.0, 'agc_loss': 'log'}. Best is trial 4 with value: 0.951137.[0m
[32m[I 2022-10-20 01:43:33,075][0m Trial 81 finished with value: 0.6554700984237916 and parameters: {'agc_alpha': 0.6191088225405591, 'agc_l1_ratio': 1.0, 'agc_loss': 'squared_hinge'}. Best is trial 82 with value: 0.951137.[0m
[32m[I 2022-10-20 01:43:33,075][0m Trial 82 finished with value: 0.9511367564986805 and parameters: {'agc_alpha': 0.0019599368140916546, 'agc_l1_ratio': 1.0, 'agc_loss': 'squared_hinge'}. Best is trial 82 with value: 0.951137.[0m
[32m[I 2022-10-20 01:43:33,075][0m Trial 80 finished with value: 0.9511123810202164 and parameters: {'agc_alpha': 0.010272304709560635, 'agc_l1_ratio': 1.0, 'agc_loss': 'squared_hinge'}. Best is trial 82 with value: 0.951137.[0m
[32m[I 2022-10-20 01:44:54,491][0m Trial 87 finished with value: 0.5617850372904359 and parameters: {'agc_alpha': 0.6980773349302576, 'agc_l1_ratio': 1.0, 'agc_loss': 'squared_hinge'}. Best is trial 4 with value: 0.951137.[0m
[32m[I 2022-10-20 01:44:54,491][0m Trial 86 finished with value: 0.683684965244209 and parameters: {'agc_alpha': 0.4544762033091899, 'agc_l1_ratio': 1.0, 'agc_loss': 'squared_hinge'}. Best is trial 4 with value: 0.951137.[0m
[32m[I 2022-10-20 01:44:54,491][0m Trial 85 finished with value: 0.9511367564986805 and parameters: {'agc_alpha': 0.0015463907330102013, 'agc_l1_ratio': 1.0, 'agc_loss': 'squared_hinge'}. Best is trial 4 with value: 0.951137.[0m
[32m[I 2022-10-20 01:44:54,632][0m Trial 83 finished with value: 0.951106751110973 and parameters: {'agc_alpha': 0.020128811558452607, 'agc_l1_ratio': 1.0, 'agc_loss': 'squared_hinge'}. Best is trial 4 with value: 0.951137.[0m
[32m[I 2022-10-20 01:44:54,695][0m Trial 84 finished with value: 0.9511367564986805 and parameters: {'agc_alpha': 0.0016593093308202478, 'agc_l1_ratio': 1.0, 'agc_loss': 'squared_hinge'}. Best is trial 4 with value: 0.951137.[0m
[32m[I 2022-10-20 01:44:55,111][0m Trial 90 finished with value: 0.9511062760095157 and parameters: {'agc_alpha': 0.0027302628703664705, 'agc_l1_ratio': 0.8, 'agc_loss': 'squared_hinge'}. Best is trial 4 with value: 0.951137.[0m
[32m[I 2022-10-20 01:44:55,111][0m Trial 88 finished with value: 0.9511062760095157 and parameters: {'agc_alpha': 0.002643540477341342, 'agc_l1_ratio': 0.8, 'agc_loss': 'squared_hinge'}. Best is trial 4 with value: 0.951137.[0m
[32m[I 2022-10-20 01:44:55,111][0m Trial 89 finished with value: 0.9511062760095157 and parameters: {'agc_alpha': 0.0027808976852571827, 'agc_l1_ratio': 0.8, 'agc_loss': 'squared_hinge'}. Best is trial 4 with value: 0.951137.[0m
[32m[I 2022-10-20 01:46:22,820][0m Trial 92 finished with value: 0.2844441188051378 and parameters: {'agc_alpha': 182.79109113374207, 'agc_l1_ratio': 0.8, 'agc_loss': 'modified_huber'}. Best is trial 4 with value: 0.951137.[0m
