[32m[I 2022-10-20 03:23:31,923][0m Trial 84 finished with value: 0.9525900365271659 and parameters: {'cdc_loss': 'modified_huber', 'cdc_penalty': 'l1/l2', 'cdc_C': 214.56594232823994, 'cdc_alpha': 0.0029276301519980986, 'cdc_selection': 'cyclic'}. Best is trial 35 with value: 0.955217.[0m
[32m[I 2022-10-20 03:23:34,855][0m Trial 85 finished with value: 0.9525538348536643 and parameters: {'cdc_loss': 'modified_huber', 'cdc_penalty': 'l1/l2', 'cdc_C': 202.41485270909436, 'cdc_alpha': 0.003233371646213164, 'cdc_selection': 'cyclic'}. Best is trial 35 with value: 0.955217.[0m
[32m[I 2022-10-20 03:29:38,500][0m Trial 89 finished with value: 0.952575623752097 and parameters: {'cdc_loss': 'modified_huber', 'cdc_penalty': 'l1/l2', 'cdc_C': 215.45454307158116, 'cdc_alpha': 0.0164340006992736, 'cdc_selection': 'cyclic'}. Best is trial 35 with value: 0.955217.[0m
[32m[I 2022-10-20 03:30:12,478][0m Trial 93 finished with value: 0.9442222477389309 and parameters: {'cdc_loss': 'log', 'cdc_penalty': 'l1', 'cdc_C': 123.82101536122155, 'cdc_alpha': 0.0017813178123824468, 'cdc_selection': 'cyclic'}. Best is trial 35 with value: 0.955217.[0m
[32m[I 2022-10-20 03:30:14,359][0m Trial 94 finished with value: 0.944216560790349 and parameters: {'cdc_loss': 'log', 'cdc_penalty': 'l1', 'cdc_C': 89.7342961973183, 'cdc_alpha': 0.0010615235176128313, 'cdc_selection': 'cyclic'}. Best is trial 35 with value: 0.955217.[0m
[32m[I 2022-10-20 03:30:17,743][0m Trial 95 finished with value: 0.9442222477389309 and parameters: {'cdc_loss': 'log', 'cdc_penalty': 'l1', 'cdc_C': 82.86630682939658, 'cdc_alpha': 0.0011134127602833719, 'cdc_selection': 'cyclic'}. Best is trial 35 with value: 0.955217.[0m
[32m[I 2022-10-20 03:32:41,859][0m Trial 96 finished with value: 0.9442222477389309 and parameters: {'cdc_loss': 'log', 'cdc_penalty': 'l1', 'cdc_C': 83.3110514248098, 'cdc_alpha': 0.00923076092060053, 'cdc_selection': 'cyclic'}. Best is trial 35 with value: 0.955217.[0m
[32m[I 2022-10-20 03:34:18,457][0m Trial 88 finished with value: 0.9525822273884885 and parameters: {'cdc_loss': 'modified_huber', 'cdc_penalty': 'l1/l2', 'cdc_C': 214.59015591383454, 'cdc_alpha': 0.01701729974786916, 'cdc_selection': 'cyclic'}. Best is trial 35 with value: 0.955217.[0m
[32m[I 2022-10-20 03:35:18,538][0m Trial 90 finished with value: 0.9526261309445477 and parameters: {'cdc_loss': 'modified_huber', 'cdc_penalty': 'l1/l2', 'cdc_C': 218.16213745358093, 'cdc_alpha': 0.009978651359092977, 'cdc_selection': 'cyclic'}. Best is trial 35 with value: 0.955217.[0m
[32m[I 2022-10-20 03:35:41,577][0m Trial 92 finished with value: 0.9460344564105136 and parameters: {'cdc_loss': 'log', 'cdc_penalty': 'l1/l2', 'cdc_C': 207.63683494393985, 'cdc_alpha': 0.008101283125485357, 'cdc_selection': 'cyclic'}. Best is trial 35 with value: 0.955217.[0m
[32m[I 2022-10-20 03:36:21,277][0m Trial 91 finished with value: 0.9460344564105136 and parameters: {'cdc_loss': 'log', 'cdc_penalty': 'l1/l2', 'cdc_C': 233.67288930048306, 'cdc_alpha': 0.007054582134797634, 'cdc_selection': 'cyclic'}. Best is trial 35 with value: 0.955217.[0m
[32m[I 2022-10-20 03:37:55,811][0m Trial 99 finished with value: 0.9517989846761498 and parameters: {'cdc_loss': 'modified_huber', 'cdc_penalty': 'l1/l2', 'cdc_C': 173.63485958073517, 'cdc_alpha': 0.009376745271944448, 'cdc_selection': 'cyclic'}. Best is trial 35 with value: 0.955217.[0m
[32m[I 2022-10-20 03:37:55,936][0m Trial 97 finished with value: 0.9525166760524595 and parameters: {'cdc_loss': 'modified_huber', 'cdc_penalty': 'l1/l2', 'cdc_C': 195.15543153847779, 'cdc_alpha': 0.010170849465165737, 'cdc_selection': 'cyclic'}. Best is trial 35 with value: 0.955217.[0m
[32m[I 2022-10-20 03:37:55,936][0m Trial 98 finished with value: 0.9518108649762386 and parameters: {'cdc_loss': 'modified_huber', 'cdc_penalty': 'l1/l2', 'cdc_C': 176.42469243203635, 'cdc_alpha': 0.008387673579143573, 'cdc_selection': 'cyclic'}. Best is trial 35 with value: 0.955217.[0m
[32m[I 2022-10-20 03:37:56,062][0m Study finished.[0m
[32m[I 2022-10-20 03:37:56,155][0m --------------------------------------------------------------------------------[0m
[32m[I 2022-10-20 03:37:56,155][0m --------------------              ComplementNB              --------------------[0m
[32m[I 2022-10-20 03:37:56,155][0m --------------------------------------------------------------------------------[0m
[32m[I 2022-10-20 03:37:56,187][0m A new study created in RDB with name: ComplementNB_b4f53b70[0m
[32m[I 2022-10-20 03:37:56,187][0m Study started.[0m
[32m[I 2022-10-20 03:37:58,502][0m Trial 1 finished with value: 0.4181364617997549 and parameters: {'compnb_alpha': 1.0, 'compnb_fit_prior': True, 'compnb_norm': True}. Best is trial 1 with value: 0.418136.[0m
[32m[I 2022-10-20 03:37:58,517][0m Trial 5 finished with value: 0.4181364617997549 and parameters: {'compnb_alpha': 0.6000000000000001, 'compnb_fit_prior': True, 'compnb_norm': True}. Best is trial 1 with value: 0.418136.[0m
[32m[I 2022-10-20 03:37:58,768][0m Trial 4 finished with value: 0.4181364617997549 and parameters: {'compnb_alpha': 0.8500000000000001, 'compnb_fit_prior': False, 'compnb_norm': True}. Best is trial 1 with value: 0.41814.[0m
[32m[I 2022-10-20 03:37:58,862][0m Trial 0 finished with value: 0.418140026134891 and parameters: {'compnb_alpha': 0.5, 'compnb_fit_prior': False, 'compnb_norm': False}. Best is trial 0 with value: 0.41814.[0m
[32m[I 2022-10-20 03:37:58,940][0m Trial 6 finished with value: 0.4181364617997549 and parameters: {'compnb_alpha': 0.35000000000000003, 'compnb_fit_prior': True, 'compnb_norm': True}. Best is trial 0 with value: 0.41814.[0m
[32m[I 2022-10-20 03:37:58,940][0m Trial 2 finished with value: 0.4181364617997549 and parameters: {'compnb_alpha': 0.4, 'compnb_fit_prior': True, 'compnb_norm': True}. Best is trial 0 with value: 0.41814.[0m
[32m[I 2022-10-20 03:37:59,071][0m Trial 7 finished with value: 0.4180723565736698 and parameters: {'compnb_alpha': 0.15000000000000002, 'compnb_fit_prior': True, 'compnb_norm': True}. Best is trial 0 with value: 0.41814.[0m
[32m[I 2022-10-20 03:37:59,164][0m Trial 3 finished with value: 0.418140026134891 and parameters: {'compnb_alpha': 0.5, 'compnb_fit_prior': False, 'compnb_norm': False}. Best is trial 0 with value: 0.41814.[0m
[32m[I 2022-10-20 03:38:01,369][0m Trial 8 finished with value: 0.4181364617997549 and parameters: {'compnb_alpha': 0.9500000000000001, 'compnb_fit_prior': False, 'compnb_norm': True}. Best is trial 0 with value: 0.41814.[0m
[32m[I 2022-10-20 03:38:01,369][0m Trial 9 finished with value: 0.418140026134891 and parameters: {'compnb_alpha': 0.75, 'compnb_fit_prior': True, 'compnb_norm': False}. Best is trial 0 with value: 0.41814.[0m
[32m[I 2022-10-20 03:38:01,650][0m Trial 11 finished with value: 0.4181364617997549 and parameters: {'compnb_alpha': 0.9, 'compnb_fit_prior': False, 'compnb_norm': True}. Best is trial 0 with value: 0.41814.[0m
[32m[I 2022-10-20 03:38:01,650][0m Trial 10 finished with value: 0.418140026134891 and parameters: {'compnb_alpha': 0.6000000000000001, 'compnb_fit_prior': True, 'compnb_norm': False}. Best is trial 0 with value: 0.41814.[0m
[32m[I 2022-10-20 03:38:01,807][0m Trial 15 finished with value: 0.4181364617997549 and parameters: {'compnb_alpha': 0.9500000000000001, 'compnb_fit_prior': False, 'compnb_norm': True}. Best is trial 0 with value: 0.41814.[0m
[32m[I 2022-10-20 03:38:01,901][0m Trial 13 finished with value: 0.4181364617997549 and parameters: {'compnb_alpha': 0.45, 'compnb_fit_prior': False, 'compnb_norm': True}. Best is trial 0 with value: 0.41814.[0m
[32m[I 2022-10-20 03:38:01,979][0m Trial 12 finished with value: 0.4181364617997549 and parameters: {'compnb_alpha': 0.65, 'compnb_fit_prior': False, 'compnb_norm': True}. Best is trial 0 with value: 0.41814.[0m
[32m[I 2022-10-20 03:38:02,057][0m Trial 14 finished with value: 0.4180634609810014 and parameters: {'compnb_alpha': 0.1, 'compnb_fit_prior': False, 'compnb_norm': True}. Best is trial 0 with value: 0.41814.[0m
[32m[I 2022-10-20 03:38:04,224][0m Trial 17 finished with value: 0.418140026134891 and parameters: {'compnb_alpha': 0.05, 'compnb_fit_prior': False, 'compnb_norm': False}. Best is trial 0 with value: 0.41814.[0m
[32m[I 2022-10-20 03:38:04,224][0m Trial 16 finished with value: 0.418140026134891 and parameters: {'compnb_alpha': 0.1, 'compnb_fit_prior': False, 'compnb_norm': False}. Best is trial 0 with value: 0.41814.[0m
[32m[I 2022-10-20 03:38:05,006][0m Trial 19 finished with value: 0.418140026134891 and parameters: {'compnb_alpha': 0.25, 'compnb_fit_prior': False, 'compnb_norm': False}. Best is trial 0 with value: 0.41814.[0m
[32m[I 2022-10-20 03:38:05,109][0m Trial 21 finished with value: 0.418140026134891 and parameters: {'compnb_alpha': 0.25, 'compnb_fit_prior': False, 'compnb_norm': False}. Best is trial 0 with value: 0.41814.[0m
[32m[I 2022-10-20 03:38:05,109][0m Trial 20 finished with value: 0.418140026134891 and parameters: {'compnb_alpha': 0.2, 'compnb_fit_prior': False, 'compnb_norm': False}. Best is trial 0 with value: 0.41814.[0m
[32m[I 2022-10-20 03:38:05,251][0m Trial 23 finished with value: 0.418140026134891 and parameters: {'compnb_alpha': 0.25, 'compnb_fit_prior': False, 'compnb_norm': False}. Best is trial 0 with value: 0.41814.[0m
[32m[I 2022-10-20 03:38:05,251][0m Trial 18 finished with value: 0.418140026134891 and parameters: {'compnb_alpha': 0.30000000000000004, 'compnb_fit_prior': False, 'compnb_norm': False}. Best is trial 0 with value: 0.41814.[0m
[32m[I 2022-10-20 03:38:05,378][0m Trial 22 finished with value: 0.418140026134891 and parameters: {'compnb_alpha': 0.25, 'compnb_fit_prior': False, 'compnb_norm': False}. Best is trial 0 with value: 0.41814.[0m
[32m[I 2022-10-20 03:38:07,007][0m Trial 25 finished with value: 0.418140026134891 and parameters: {'compnb_alpha': 0.25, 'compnb_fit_prior': True, 'compnb_norm': False}. Best is trial 0 with value: 0.41814.[0m
[32m[I 2022-10-20 03:38:07,007][0m Trial 24 finished with value: 0.418140026134891 and parameters: {'compnb_alpha': 0.30000000000000004, 'compnb_fit_prior': True, 'compnb_norm': False}. Best is trial 0 with value: 0.41814.[0m
[32m[I 2022-10-20 03:38:07,835][0m Trial 26 finished with value: 0.418140026134891 and parameters: {'compnb_alpha': 0.0, 'compnb_fit_prior': False, 'compnb_norm': False}. Best is trial 0 with value: 0.41814.[0m
[32m[I 2022-10-20 03:38:08,054][0m Trial 28 finished with value: 0.418140026134891 and parameters: {'compnb_alpha': 0.0, 'compnb_fit_prior': False, 'compnb_norm': False}. Best is trial 0 with value: 0.41814.[0m
[32m[I 2022-10-20 03:38:08,116][0m Trial 27 finished with value: 0.418140026134891 and parameters: {'compnb_alpha': 0.0, 'compnb_fit_prior': False, 'compnb_norm': False}. Best is trial 0 with value: 0.41814.[0m
[32m[I 2022-10-20 03:38:08,210][0m Trial 29 finished with value: 0.418140026134891 and parameters: {'compnb_alpha': 0.0, 'compnb_fit_prior': False, 'compnb_norm': False}. Best is trial 0 with value: 0.41814.[0m
[32m[I 2022-10-20 03:38:08,210][0m Trial 31 finished with value: 0.418140026134891 and parameters: {'compnb_alpha': 0.5, 'compnb_fit_prior': False, 'compnb_norm': False}. Best is trial 0 with value: 0.41814.[0m
[32m[I 2022-10-20 03:38:08,210][0m Trial 30 finished with value: 0.418140026134891 and parameters: {'compnb_alpha': 0.0, 'compnb_fit_prior': False, 'compnb_norm': False}. Best is trial 0 with value: 0.41814.[0m
[32m[I 2022-10-20 03:38:09,860][0m Trial 33 finished with value: 0.418140026134891 and parameters: {'compnb_alpha': 0.0, 'compnb_fit_prior': False, 'compnb_norm': False}. Best is trial 0 with value: 0.41814.[0m
[32m[I 2022-10-20 03:38:09,860][0m Trial 32 finished with value: 0.418140026134891 and parameters: {'compnb_alpha': 0.5, 'compnb_fit_prior': False, 'compnb_norm': False}. Best is trial 0 with value: 0.41814.[0m
[32m[I 2022-10-20 03:38:10,680][0m Trial 34 finished with value: 0.418140026134891 and parameters: {'compnb_alpha': 0.5, 'compnb_fit_prior': True, 'compnb_norm': False}. Best is trial 0 with value: 0.41814.[0m
[32m[I 2022-10-20 03:38:11,180][0m Trial 36 finished with value: 0.418140026134891 and parameters: {'compnb_alpha': 0.1, 'compnb_fit_prior': False, 'compnb_norm': False}. Best is trial 0 with value: 0.41814.[0m
[32m[I 2022-10-20 03:38:11,243][0m Trial 39 finished with value: 0.418140026134891 and parameters: {'compnb_alpha': 0.1, 'compnb_fit_prior': False, 'compnb_norm': False}. Best is trial 0 with value: 0.41814.[0m
[32m[I 2022-10-20 03:38:11,258][0m Trial 37 finished with value: 0.418140026134891 and parameters: {'compnb_alpha': 0.1, 'compnb_fit_prior': False, 'compnb_norm': False}. Best is trial 0 with value: 0.41814.[0m
[32m[I 2022-10-20 03:38:11,258][0m Trial 35 finished with value: 0.418140026134891 and parameters: {'compnb_alpha': 0.1, 'compnb_fit_prior': False, 'compnb_norm': False}. Best is trial 0 with value: 0.41814.[0m
[32m[I 2022-10-20 03:38:11,462][0m Trial 38 finished with value: 0.418140026134891 and parameters: {'compnb_alpha': 0.1, 'compnb_fit_prior': False, 'compnb_norm': False}. Best is trial 0 with value: 0.41814.[0m
[32m[I 2022-10-20 03:38:12,719][0m Trial 40 finished with value: 0.418140026134891 and parameters: {'compnb_alpha': 0.45, 'compnb_fit_prior': False, 'compnb_norm': False}. Best is trial 0 with value: 0.41814.[0m
[32m[I 2022-10-20 03:38:12,719][0m Trial 41 finished with value: 0.418140026134891 and parameters: {'compnb_alpha': 0.45, 'compnb_fit_prior': False, 'compnb_norm': False}. Best is trial 0 with value: 0.41814.[0m
[32m[I 2022-10-20 03:38:13,487][0m Trial 42 finished with value: 0.418140026134891 and parameters: {'compnb_alpha': 0.4, 'compnb_fit_prior': False, 'compnb_norm': False}. Best is trial 0 with value: 0.41814.[0m
[32m[I 2022-10-20 03:38:14,087][0m Trial 47 finished with value: 0.418140026134891 and parameters: {'compnb_alpha': 0.4, 'compnb_fit_prior': True, 'compnb_norm': False}. Best is trial 0 with value: 0.41814.[0m
[32m[I 2022-10-20 03:38:14,166][0m Trial 45 finished with value: 0.418140026134891 and parameters: {'compnb_alpha': 0.4, 'compnb_fit_prior': True, 'compnb_norm': False}. Best is trial 0 with value: 0.41814.[0m
[32m[I 2022-10-20 03:38:14,166][0m Trial 43 finished with value: 0.418140026134891 and parameters: {'compnb_alpha': 0.4, 'compnb_fit_prior': True, 'compnb_norm': False}. Best is trial 0 with value: 0.41814.[0m
[32m[I 2022-10-20 03:38:14,166][0m Trial 46 finished with value: 0.418140026134891 and parameters: {'compnb_alpha': 0.4, 'compnb_fit_prior': True, 'compnb_norm': False}. Best is trial 0 with value: 0.41814.[0m
[32m[I 2022-10-20 03:38:14,385][0m Trial 44 finished with value: 0.418140026134891 and parameters: {'compnb_alpha': 0.4, 'compnb_fit_prior': True, 'compnb_norm': False}. Best is trial 0 with value: 0.41814.[0m
[32m[I 2022-10-20 03:38:14,572][0m Trial 48 finished with value: 0.418140026134891 and parameters: {'compnb_alpha': 0.35000000000000003, 'compnb_fit_prior': True, 'compnb_norm': False}. Best is trial 0 with value: 0.41814.[0m
[32m[I 2022-10-20 03:38:14,666][0m Trial 49 finished with value: 0.418140026134891 and parameters: {'compnb_alpha': 0.35000000000000003, 'compnb_fit_prior': True, 'compnb_norm': False}. Best is trial 0 with value: 0.41814.[0m
[32m[I 2022-10-20 03:38:16,318][0m Trial 50 finished with value: 0.418140026134891 and parameters: {'compnb_alpha': 0.35000000000000003, 'compnb_fit_prior': True, 'compnb_norm': False}. Best is trial 0 with value: 0.41814.[0m
[32m[I 2022-10-20 03:38:17,053][0m Trial 54 finished with value: 0.3649747495333992 and parameters: {'compnb_alpha': 0.0, 'compnb_fit_prior': False, 'compnb_norm': True}. Best is trial 0 with value: 0.41814.[0m
[32m[I 2022-10-20 03:38:17,115][0m Trial 53 finished with value: 0.3649747495333992 and parameters: {'compnb_alpha': 0.0, 'compnb_fit_prior': False, 'compnb_norm': True}. Best is trial 0 with value: 0.41814.[0m
[32m[I 2022-10-20 03:38:17,194][0m Trial 55 finished with value: 0.3649747495333992 and parameters: {'compnb_alpha': 0.0, 'compnb_fit_prior': False, 'compnb_norm': True}. Best is trial 0 with value: 0.41814.[0m
[32m[I 2022-10-20 03:38:17,288][0m Trial 51 finished with value: 0.3649747495333992 and parameters: {'compnb_alpha': 0.0, 'compnb_fit_prior': False, 'compnb_norm': True}. Best is trial 0 with value: 0.41814.[0m
[32m[I 2022-10-20 03:38:17,288][0m Trial 52 finished with value: 0.3649747495333992 and parameters: {'compnb_alpha': 0.0, 'compnb_fit_prior': False, 'compnb_norm': True}. Best is trial 0 with value: 0.41814.[0m
[32m[I 2022-10-20 03:38:17,428][0m Trial 56 finished with value: 0.3649747495333992 and parameters: {'compnb_alpha': 0.0, 'compnb_fit_prior': False, 'compnb_norm': True}. Best is trial 0 with value: 0.41814.[0m
[32m[I 2022-10-20 03:38:17,491][0m Trial 57 finished with value: 0.3649747495333992 and parameters: {'compnb_alpha': 0.0, 'compnb_fit_prior': False, 'compnb_norm': True}. Best is trial 0 with value: 0.41814.[0m
[32m[I 2022-10-20 03:38:17,929][0m Trial 58 finished with value: 0.4181364617997549 and parameters: {'compnb_alpha': 0.6000000000000001, 'compnb_fit_prior': False, 'compnb_norm': True}. Best is trial 0 with value: 0.41814.[0m
[32m[I 2022-10-20 03:38:19,971][0m Trial 61 finished with value: 0.418140026134891 and parameters: {'compnb_alpha': 0.6000000000000001, 'compnb_fit_prior': False, 'compnb_norm': False}. Best is trial 0 with value: 0.41814.[0m
[32m[I 2022-10-20 03:38:20,065][0m Trial 60 finished with value: 0.418140026134891 and parameters: {'compnb_alpha': 0.6000000000000001, 'compnb_fit_prior': False, 'compnb_norm': False}. Best is trial 0 with value: 0.41814.[0m
[32m[I 2022-10-20 03:38:20,143][0m Trial 66 finished with value: 0.418140026134891 and parameters: {'compnb_alpha': 0.55, 'compnb_fit_prior': False, 'compnb_norm': False}. Best is trial 0 with value: 0.41814.[0m
[32m[I 2022-10-20 03:38:20,143][0m Trial 63 finished with value: 0.418140026134891 and parameters: {'compnb_alpha': 0.6000000000000001, 'compnb_fit_prior': False, 'compnb_norm': False}. Best is trial 0 with value: 0.41814.[0m
[32m[I 2022-10-20 03:38:20,301][0m Trial 62 finished with value: 0.418140026134891 and parameters: {'compnb_alpha': 0.6000000000000001, 'compnb_fit_prior': False, 'compnb_norm': False}. Best is trial 0 with value: 0.41814.[0m
[32m[I 2022-10-20 03:38:20,379][0m Trial 65 finished with value: 0.418140026134891 and parameters: {'compnb_alpha': 0.6000000000000001, 'compnb_fit_prior': False, 'compnb_norm': False}. Best is trial 0 with value: 0.41814.[0m
[32m[I 2022-10-20 03:38:20,379][0m Trial 64 finished with value: 0.418140026134891 and parameters: {'compnb_alpha': 0.55, 'compnb_fit_prior': False, 'compnb_norm': False}. Best is trial 0 with value: 0.41814.[0m
[32m[I 2022-10-20 03:38:20,504][0m Trial 59 finished with value: 0.418140026134891 and parameters: {'compnb_alpha': 0.6000000000000001, 'compnb_fit_prior': False, 'compnb_norm': False}. Best is trial 0 with value: 0.41814.[0m
[32m[I 2022-10-20 03:38:22,730][0m Trial 67 finished with value: 0.418140026134891 and parameters: {'compnb_alpha': 0.7000000000000001, 'compnb_fit_prior': False, 'compnb_norm': False}. Best is trial 0 with value: 0.41814.[0m
[32m[I 2022-10-20 03:38:22,871][0m Trial 68 finished with value: 0.418140026134891 and parameters: {'compnb_alpha': 0.7000000000000001, 'compnb_fit_prior': False, 'compnb_norm': False}. Best is trial 0 with value: 0.41814.[0m
[32m[I 2022-10-20 03:38:23,043][0m Trial 71 finished with value: 0.418140026134891 and parameters: {'compnb_alpha': 0.7000000000000001, 'compnb_fit_prior': False, 'compnb_norm': False}. Best is trial 0 with value: 0.41814.[0m
[32m[I 2022-10-20 03:38:23,137][0m Trial 70 finished with value: 0.418140026134891 and parameters: {'compnb_alpha': 0.75, 'compnb_fit_prior': False, 'compnb_norm': False}. Best is trial 0 with value: 0.41814.[0m
[32m[I 2022-10-20 03:38:23,215][0m Trial 74 finished with value: 0.418140026134891 and parameters: {'compnb_alpha': 0.7000000000000001, 'compnb_fit_prior': False, 'compnb_norm': False}. Best is trial 0 with value: 0.41814.[0m
[32m[I 2022-10-20 03:38:23,231][0m Trial 73 finished with value: 0.418140026134891 and parameters: {'compnb_alpha': 0.7000000000000001, 'compnb_fit_prior': False, 'compnb_norm': False}. Best is trial 0 with value: 0.41814.[0m
[32m[I 2022-10-20 03:38:23,543][0m Trial 69 finished with value: 0.418140026134891 and parameters: {'compnb_alpha': 0.5, 'compnb_fit_prior': False, 'compnb_norm': False}. Best is trial 0 with value: 0.41814.[0m
[32m[I 2022-10-20 03:38:23,621][0m Trial 72 finished with value: 0.418140026134891 and parameters: {'compnb_alpha': 0.7000000000000001, 'compnb_fit_prior': False, 'compnb_norm': False}. Best is trial 0 with value: 0.41814.[0m
[32m[I 2022-10-20 03:38:25,553][0m Trial 75 finished with value: 0.418140026134891 and parameters: {'compnb_alpha': 0.8, 'compnb_fit_prior': False, 'compnb_norm': False}. Best is trial 0 with value: 0.41814.[0m
[32m[I 2022-10-20 03:38:25,965][0m Trial 76 finished with value: 0.418140026134891 and parameters: {'compnb_alpha': 0.15000000000000002, 'compnb_fit_prior': False, 'compnb_norm': False}. Best is trial 0 with value: 0.41814.[0m
[32m[I 2022-10-20 03:38:26,215][0m Trial 78 finished with value: 0.418140026134891 and parameters: {'compnb_alpha': 0.15000000000000002, 'compnb_fit_prior': False, 'compnb_norm': False}. Best is trial 0 with value: 0.41814.[0m
[32m[I 2022-10-20 03:38:26,309][0m Trial 81 finished with value: 0.418140026134891 and parameters: {'compnb_alpha': 0.15000000000000002, 'compnb_fit_prior': False, 'compnb_norm': False}. Best is trial 0 with value: 0.41814.[0m
