[32m[I 2022-10-20 01:18:30,294][0m Optimization for 30 classifiers started.[0m
[32m[I 2022-10-20 01:18:31,153][0m X_train shape: (524560, 50); y_train shape: (524560,); y_train unique values: {0, 1, 2, 3, 4}[0m
[32m[I 2022-10-20 01:18:31,153][0m X_test shape: (131140, 50); y_test shape: (131140,); y_test unique values: {0, 1, 2, 3, 4}[0m
[32m[I 2022-10-20 01:18:31,153][0m --------------------------------------------------------------------------------[0m
[32m[I 2022-10-20 01:18:31,153][0m --------------------           AdaBoostClassifier           --------------------[0m
[32m[I 2022-10-20 01:18:31,153][0m --------------------------------------------------------------------------------[0m
[32m[I 2022-10-20 01:18:31,231][0m A new study created in RDB with name: AdaBoostClassifier_b4f53b70[0m
[32m[I 2022-10-20 01:18:31,231][0m Study started.[0m
[32m[I 2022-10-20 01:19:13,565][0m Trial 5 finished with value: 0.5830927546766471 and parameters: {'abc_n_estimators': 50, 'abc_learning_rate': 0.004464308314740647}. Best is trial 5 with value: 0.583093.[0m
[32m[I 2022-10-20 01:19:25,936][0m Trial 4 finished with value: 0.5830927546766471 and parameters: {'abc_n_estimators': 65, 'abc_learning_rate': 1.5151707711472074e-06}. Best is trial 4 with value: 0.583093.[0m
[32m[I 2022-10-20 01:19:26,832][0m Trial 1 finished with value: 0.5830927546766471 and parameters: {'abc_n_estimators': 65, 'abc_learning_rate': 2.7525399814785376e-05}. Best is trial 1 with value: 0.583093.[0m
[32m[I 2022-10-20 01:19:30,872][0m Trial 2 finished with value: 0.5830927546766471 and parameters: {'abc_n_estimators': 70, 'abc_learning_rate': 2.2295227054742687e-06}. Best is trial 1 with value: 0.583093.[0m
[32m[I 2022-10-20 01:19:38,459][0m Trial 0 finished with value: 0.5830927546766471 and parameters: {'abc_n_estimators': 80, 'abc_learning_rate': 3.9298263118143574e-05}. Best is trial 0 with value: 0.583093.[0m
[32m[I 2022-10-20 01:19:43,021][0m Trial 7 finished with value: 0.5830927546766471 and parameters: {'abc_n_estimators': 85, 'abc_learning_rate': 2.1121755561041255e-06}. Best is trial 0 with value: 0.583093.[0m
[32m[I 2022-10-20 01:19:44,099][0m Trial 8 finished with value: 0.8603554461071355 and parameters: {'abc_n_estimators': 35, 'abc_learning_rate': 0.6125527827261561}. Best is trial 8 with value: 0.860355.[0m
[32m[I 2022-10-20 01:19:47,936][0m Trial 6 finished with value: 0.5830927546766471 and parameters: {'abc_n_estimators': 90, 'abc_learning_rate': 0.0012104513242856287}. Best is trial 8 with value: 0.860355.[0m
[32m[I 2022-10-20 01:19:51,884][0m Trial 3 finished with value: 0.5830927546766471 and parameters: {'abc_n_estimators': 95, 'abc_learning_rate': 5.3606639270932713e-05}. Best is trial 8 with value: 0.860355.[0m
[32m[I 2022-10-20 01:19:56,299][0m Trial 9 finished with value: 0.7626650464927084 and parameters: {'abc_n_estimators': 35, 'abc_learning_rate': 0.7297468530958772}. Best is trial 8 with value: 0.860355.[0m
[32m[I 2022-10-20 01:20:17,470][0m Trial 17 finished with value: 0.7626268845520136 and parameters: {'abc_n_estimators': 25, 'abc_learning_rate': 0.57448796055319}. Best is trial 8 with value: 0.860355.[0m
[32m[I 2022-10-20 01:20:26,102][0m Trial 16 finished with value: 0.5830927546766471 and parameters: {'abc_n_estimators': 40, 'abc_learning_rate': 5.070784267257494e-06}. Best is trial 8 with value: 0.860355.[0m
[32m[I 2022-10-20 01:20:26,500][0m Trial 15 finished with value: 0.8264654149181715 and parameters: {'abc_n_estimators': 45, 'abc_learning_rate': 0.728706889887304}. Best is trial 8 with value: 0.860355.[0m
[32m[I 2022-10-20 01:20:28,584][0m Trial 13 finished with value: 0.7581185821475852 and parameters: {'abc_n_estimators': 55, 'abc_learning_rate': 0.053104601161768204}. Best is trial 8 with value: 0.860355.[0m
[32m[I 2022-10-20 01:20:29,788][0m Trial 10 finished with value: 0.7112889710620933 and parameters: {'abc_n_estimators': 75, 'abc_learning_rate': 0.42138078140632074}. Best is trial 8 with value: 0.860355.[0m
[32m[I 2022-10-20 01:20:35,226][0m Trial 14 finished with value: 0.5830927546766471 and parameters: {'abc_n_estimators': 60, 'abc_learning_rate': 1.872309252934447e-05}. Best is trial 8 with value: 0.860355.[0m
[32m[I 2022-10-20 01:20:37,266][0m Trial 12 finished with value: 0.5830927546766471 and parameters: {'abc_n_estimators': 70, 'abc_learning_rate': 0.00023211259453939946}. Best is trial 8 with value: 0.860355.[0m
[32m[I 2022-10-20 01:20:47,419][0m Trial 18 finished with value: 0.7405052616395722 and parameters: {'abc_n_estimators': 35, 'abc_learning_rate': 0.762025947236886}. Best is trial 8 with value: 0.860355.[0m
[32m[I 2022-10-20 01:20:47,882][0m Trial 19 finished with value: 0.7257003168709458 and parameters: {'abc_n_estimators': 25, 'abc_learning_rate': 0.8989768875392173}. Best is trial 8 with value: 0.860355.[0m
[32m[I 2022-10-20 01:20:50,922][0m Trial 11 finished with value: 0.7112279308595345 and parameters: {'abc_n_estimators': 95, 'abc_learning_rate': 0.14320877833269394}. Best is trial 8 with value: 0.860355.[0m
[32m[I 2022-10-20 01:21:01,738][0m Trial 21 finished with value: 0.7581185821475852 and parameters: {'abc_n_estimators': 40, 'abc_learning_rate': 0.058921236426914075}. Best is trial 8 with value: 0.860355.[0m
[32m[I 2022-10-20 01:21:07,680][0m Trial 22 finished with value: 0.7578065575256585 and parameters: {'abc_n_estimators': 45, 'abc_learning_rate': 0.04643559085550124}. Best is trial 8 with value: 0.860355.[0m
[32m[I 2022-10-20 01:21:08,135][0m Trial 20 finished with value: 0.7581185821475852 and parameters: {'abc_n_estimators': 50, 'abc_learning_rate': 0.05110590904738413}. Best is trial 8 with value: 0.860355.[0m
[32m[I 2022-10-20 01:21:12,583][0m Trial 23 finished with value: 0.7266493841638412 and parameters: {'abc_n_estimators': 45, 'abc_learning_rate': 0.0325155978380745}. Best is trial 8 with value: 0.860355.[0m
[32m[I 2022-10-20 01:21:15,539][0m Trial 24 finished with value: 0.7266493841638412 and parameters: {'abc_n_estimators': 45, 'abc_learning_rate': 0.03184398422574025}. Best is trial 8 with value: 0.860355.[0m
[32m[I 2022-10-20 01:21:25,606][0m Trial 25 finished with value: 0.7581185821475852 and parameters: {'abc_n_estimators': 45, 'abc_learning_rate': 0.046981461153770374}. Best is trial 8 with value: 0.860355.[0m
[32m[I 2022-10-20 01:21:26,421][0m Trial 26 finished with value: 0.7266493841638412 and parameters: {'abc_n_estimators': 45, 'abc_learning_rate': 0.028192661203184245}. Best is trial 8 with value: 0.860355.[0m
[32m[I 2022-10-20 01:21:29,347][0m Trial 27 finished with value: 0.7237139089731098 and parameters: {'abc_n_estimators': 45, 'abc_learning_rate': 0.02022486974454377}. Best is trial 8 with value: 0.860355.[0m
[32m[I 2022-10-20 01:21:33,085][0m Trial 29 finished with value: 0.6202161914047097 and parameters: {'abc_n_estimators': 30, 'abc_learning_rate': 0.007744799803337785}. Best is trial 8 with value: 0.860355.[0m
[32m[I 2022-10-20 01:21:33,858][0m Trial 30 finished with value: 0.6202161914047097 and parameters: {'abc_n_estimators': 30, 'abc_learning_rate': 0.008878955204022817}. Best is trial 8 with value: 0.860355.[0m
[32m[I 2022-10-20 01:21:38,256][0m Trial 31 finished with value: 0.6202161914047097 and parameters: {'abc_n_estimators': 30, 'abc_learning_rate': 0.008409786443692766}. Best is trial 8 with value: 0.860355.[0m
[32m[I 2022-10-20 01:21:40,084][0m Trial 28 finished with value: 0.6186958931922693 and parameters: {'abc_n_estimators': 45, 'abc_learning_rate': 0.008134049394599292}. Best is trial 8 with value: 0.860355.[0m
[32m[I 2022-10-20 01:21:40,618][0m Trial 32 finished with value: 0.5830927546766471 and parameters: {'abc_n_estimators': 30, 'abc_learning_rate': 0.007563656910220843}. Best is trial 8 with value: 0.860355.[0m
[32m[I 2022-10-20 01:21:51,782][0m Trial 33 finished with value: 0.5830927546766471 and parameters: {'abc_n_estimators': 30, 'abc_learning_rate': 0.006186487520835164}. Best is trial 8 with value: 0.860355.[0m
[32m[I 2022-10-20 01:21:52,049][0m Trial 34 finished with value: 0.7109152880342821 and parameters: {'abc_n_estimators': 30, 'abc_learning_rate': 0.2088664024631212}. Best is trial 8 with value: 0.860355.[0m
[32m[I 2022-10-20 01:21:54,913][0m Trial 35 finished with value: 0.7112279308595345 and parameters: {'abc_n_estimators': 30, 'abc_learning_rate': 0.2509415739751763}. Best is trial 8 with value: 0.860355.[0m
[32m[I 2022-10-20 01:21:59,136][0m Trial 38 finished with value: 0.7109152880342821 and parameters: {'abc_n_estimators': 25, 'abc_learning_rate': 0.2715075368999951}. Best is trial 8 with value: 0.860355.[0m
[32m[I 2022-10-20 01:22:01,404][0m Trial 39 finished with value: 0.7083154749910884 and parameters: {'abc_n_estimators': 25, 'abc_learning_rate': 0.19955656245220588}. Best is trial 8 with value: 0.860355.[0m
[32m[I 2022-10-20 01:22:02,156][0m Trial 40 finished with value: 0.7083154749910884 and parameters: {'abc_n_estimators': 25, 'abc_learning_rate': 0.2057355027810387}. Best is trial 8 with value: 0.860355.[0m
[32m[I 2022-10-20 01:22:02,942][0m Trial 36 finished with value: 0.7112279308595345 and parameters: {'abc_n_estimators': 35, 'abc_learning_rate': 0.1663062028546987}. Best is trial 8 with value: 0.860355.[0m
[32m[I 2022-10-20 01:22:03,584][0m Trial 37 finished with value: 0.7083154749910884 and parameters: {'abc_n_estimators': 35, 'abc_learning_rate': 0.21508704040399187}. Best is trial 8 with value: 0.860355.[0m
[32m[I 2022-10-20 01:22:13,068][0m Trial 41 finished with value: 0.7083154749910884 and parameters: {'abc_n_estimators': 25, 'abc_learning_rate': 0.23392651554566912}. Best is trial 8 with value: 0.860355.[0m
[32m[I 2022-10-20 01:22:13,884][0m Trial 42 finished with value: 0.7080034503691619 and parameters: {'abc_n_estimators': 25, 'abc_learning_rate': 0.2378242826786182}. Best is trial 8 with value: 0.860355.[0m
[32m[I 2022-10-20 01:22:16,022][0m Trial 43 finished with value: 0.7083154749910884 and parameters: {'abc_n_estimators': 25, 'abc_learning_rate': 0.15432534417133503}. Best is trial 8 with value: 0.860355.[0m
[32m[I 2022-10-20 01:22:29,015][0m Trial 44 finished with value: 0.7083154749910884 and parameters: {'abc_n_estimators': 35, 'abc_learning_rate': 0.10625826502930641}. Best is trial 8 with value: 0.860355.[0m
[32m[I 2022-10-20 01:22:31,310][0m Trial 45 finished with value: 0.7181153178435477 and parameters: {'abc_n_estimators': 35, 'abc_learning_rate': 0.5072136534941267}. Best is trial 8 with value: 0.860355.[0m
[32m[I 2022-10-20 01:22:32,157][0m Trial 46 finished with value: 0.6973618635871874 and parameters: {'abc_n_estimators': 35, 'abc_learning_rate': 0.560202954397268}. Best is trial 8 with value: 0.860355.[0m
[32m[I 2022-10-20 01:22:33,044][0m Trial 47 finished with value: 0.6939461922796661 and parameters: {'abc_n_estimators': 35, 'abc_learning_rate': 0.9466890148255669}. Best is trial 8 with value: 0.860355.[0m
[32m[I 2022-10-20 01:22:47,727][0m Trial 50 finished with value: 0.8603554461071355 and parameters: {'abc_n_estimators': 40, 'abc_learning_rate': 0.6074817233390712}. Best is trial 50 with value: 0.860355.[0m
[32m[I 2022-10-20 01:22:49,064][0m Trial 48 finished with value: 0.7146444815896887 and parameters: {'abc_n_estimators': 55, 'abc_learning_rate': 0.5516986237976703}. Best is trial 50 with value: 0.860355.[0m
[32m[I 2022-10-20 01:22:49,379][0m Trial 51 finished with value: 0.7112889710620933 and parameters: {'abc_n_estimators': 40, 'abc_learning_rate': 0.5321080760110041}. Best is trial 8 with value: 0.860355.[0m
[32m[I 2022-10-20 01:22:59,288][0m Trial 49 finished with value: 0.8603554461071355 and parameters: {'abc_n_estimators': 55, 'abc_learning_rate': 0.6267046414884155}. Best is trial 8 with value: 0.860355.[0m
[32m[I 2022-10-20 01:23:05,447][0m Trial 54 finished with value: 0.5830927546766471 and parameters: {'abc_n_estimators': 40, 'abc_learning_rate': 0.0006186249528106751}. Best is trial 8 with value: 0.860355.[0m
[32m[I 2022-10-20 01:23:14,792][0m Trial 52 finished with value: 0.8603554461071355 and parameters: {'abc_n_estimators': 55, 'abc_learning_rate': 0.6047506061928302}. Best is trial 8 with value: 0.860355.[0m
[32m[I 2022-10-20 01:23:16,679][0m Trial 53 finished with value: 0.7178026721221197 and parameters: {'abc_n_estimators': 55, 'abc_learning_rate': 0.5207485137202237}. Best is trial 8 with value: 0.860355.[0m
[32m[I 2022-10-20 01:23:22,870][0m Trial 58 finished with value: 0.7080034503691619 and parameters: {'abc_n_estimators': 40, 'abc_learning_rate': 0.08945344543343084}. Best is trial 8 with value: 0.860355.[0m
[32m[I 2022-10-20 01:23:23,074][0m Trial 57 finished with value: 0.5830927546766471 and parameters: {'abc_n_estimators': 40, 'abc_learning_rate': 0.00027518957415720996}. Best is trial 8 with value: 0.860355.[0m
[32m[I 2022-10-20 01:23:23,471][0m Trial 55 finished with value: 0.5830927546766471 and parameters: {'abc_n_estimators': 60, 'abc_learning_rate': 0.002214151063092896}. Best is trial 8 with value: 0.860355.[0m
[32m[I 2022-10-20 01:23:33,547][0m Trial 56 finished with value: 0.5830927546766471 and parameters: {'abc_n_estimators': 55, 'abc_learning_rate': 0.0002974189947132936}. Best is trial 8 with value: 0.860355.[0m
[32m[I 2022-10-20 01:23:45,549][0m Trial 59 finished with value: 0.7083154749910884 and parameters: {'abc_n_estimators': 55, 'abc_learning_rate': 0.08699496699989163}. Best is trial 8 with value: 0.860355.[0m
[32m[I 2022-10-20 01:23:51,453][0m Trial 60 finished with value: 0.7080034503691619 and parameters: {'abc_n_estimators': 55, 'abc_learning_rate': 0.09535911661189254}. Best is trial 8 with value: 0.860355.[0m
[32m[I 2022-10-20 01:24:04,901][0m Trial 61 finished with value: 0.7112279308595345 and parameters: {'abc_n_estimators': 60, 'abc_learning_rate': 0.10837981753238307}. Best is trial 8 with value: 0.860355.[0m
[32m[I 2022-10-20 01:24:05,293][0m Trial 65 finished with value: 0.7112889710620933 and parameters: {'abc_n_estimators': 50, 'abc_learning_rate': 0.34313241344811884}. Best is trial 8 with value: 0.860355.[0m
[32m[I 2022-10-20 01:24:07,236][0m Trial 62 finished with value: 0.7080034503691619 and parameters: {'abc_n_estimators': 60, 'abc_learning_rate': 0.09081430534164937}. Best is trial 8 with value: 0.860355.[0m
[32m[I 2022-10-20 01:24:12,757][0m Trial 64 finished with value: 0.700845245084145 and parameters: {'abc_n_estimators': 60, 'abc_learning_rate': 0.9617580466078077}. Best is trial 8 with value: 0.860355.[0m
[32m[I 2022-10-20 01:24:13,417][0m Trial 63 finished with value: 0.7080034503691619 and parameters: {'abc_n_estimators': 60, 'abc_learning_rate': 0.09162654979906745}. Best is trial 8 with value: 0.860355.[0m
[32m[I 2022-10-20 01:24:15,605][0m Trial 66 finished with value: 0.6938971565245052 and parameters: {'abc_n_estimators': 50, 'abc_learning_rate': 0.9381386030407228}. Best is trial 8 with value: 0.860355.[0m
[32m[I 2022-10-20 01:24:27,096][0m Trial 67 finished with value: 0.7375268741667538 and parameters: {'abc_n_estimators': 50, 'abc_learning_rate': 0.9207114259010264}. Best is trial 8 with value: 0.860355.[0m
[32m[I 2022-10-20 01:24:33,140][0m Trial 68 finished with value: 0.6193849722764867 and parameters: {'abc_n_estimators': 50, 'abc_learning_rate': 0.9818979127365548}. Best is trial 8 with value: 0.860355.[0m
[32m[I 2022-10-20 01:24:46,277][0m Trial 69 finished with value: 0.6927055441205004 and parameters: {'abc_n_estimators': 50, 'abc_learning_rate': 0.9774606933999058}. Best is trial 8 with value: 0.860355.[0m
[32m[I 2022-10-20 01:24:48,793][0m Trial 71 finished with value: 0.6938971565245052 and parameters: {'abc_n_estimators': 50, 'abc_learning_rate': 0.940842259376349}. Best is trial 8 with value: 0.860355.[0m
[32m[I 2022-10-20 01:24:54,095][0m Trial 72 finished with value: 0.7112889710620933 and parameters: {'abc_n_estimators': 50, 'abc_learning_rate': 0.3449912327051103}. Best is trial 8 with value: 0.860355.[0m
[32m[I 2022-10-20 01:24:55,589][0m Trial 73 finished with value: 0.6779052923555353 and parameters: {'abc_n_estimators': 50, 'abc_learning_rate': 0.3653801041600341}. Best is trial 8 with value: 0.860355.[0m
[32m[I 2022-10-20 01:25:17,024][0m Trial 74 finished with value: 0.8293767568396516 and parameters: {'abc_n_estimators': 75, 'abc_learning_rate': 0.3755097930136157}. Best is trial 8 with value: 0.860355.[0m
[32m[I 2022-10-20 01:25:27,393][0m Trial 76 finished with value: 0.8293767568396516 and parameters: {'abc_n_estimators': 65, 'abc_learning_rate': 0.3833898211135492}. Best is trial 8 with value: 0.860355.[0m
[32m[I 2022-10-20 01:25:28,539][0m Trial 79 finished with value: 0.7112889710620933 and parameters: {'abc_n_estimators': 40, 'abc_learning_rate': 0.42800046107062806}. Best is trial 8 with value: 0.860355.[0m
[32m[I 2022-10-20 01:25:29,181][0m Trial 70 finished with value: 0.6936484522225402 and parameters: {'abc_n_estimators': 100, 'abc_learning_rate': 0.942389548450501}. Best is trial 8 with value: 0.860355.[0m
[32m[I 2022-10-20 01:25:45,765][0m Trial 77 finished with value: 0.7112889710620933 and parameters: {'abc_n_estimators': 70, 'abc_learning_rate': 0.3506476133497129}. Best is trial 8 with value: 0.860355.[0m
[32m[I 2022-10-20 01:25:49,265][0m Trial 78 finished with value: 0.7109763253406656 and parameters: {'abc_n_estimators': 70, 'abc_learning_rate': 0.3584665992860167}. Best is trial 8 with value: 0.860355.[0m
[32m[I 2022-10-20 01:25:51,029][0m Trial 75 finished with value: 0.8293767568396516 and parameters: {'abc_n_estimators': 100, 'abc_learning_rate': 0.38694926596173723}. Best is trial 8 with value: 0.860355.[0m
[32m[I 2022-10-20 01:25:56,656][0m Trial 80 finished with value: 0.5830927546766471 and parameters: {'abc_n_estimators': 70, 'abc_learning_rate': 5.750883867468052e-05}. Best is trial 8 with value: 0.860355.[0m
[32m[I 2022-10-20 01:26:21,309][0m Trial 81 finished with value: 0.7112889710620933 and parameters: {'abc_n_estimators': 75, 'abc_learning_rate': 0.4288917179566348}. Best is trial 8 with value: 0.860355.[0m
[32m[I 2022-10-20 01:26:28,229][0m Trial 82 finished with value: 0.7112889710620933 and parameters: {'abc_n_estimators': 70, 'abc_learning_rate': 0.41944713505615594}. Best is trial 8 with value: 0.860355.[0m
[32m[I 2022-10-20 01:26:34,081][0m Trial 83 finished with value: 0.7112889710620933 and parameters: {'abc_n_estimators': 75, 'abc_learning_rate': 0.3426695476377358}. Best is trial 8 with value: 0.860355.[0m
[32m[I 2022-10-20 01:26:36,057][0m Trial 84 finished with value: 0.5830927546766471 and parameters: {'abc_n_estimators': 75, 'abc_learning_rate': 7.2046145006524704e-06}. Best is trial 8 with value: 0.860355.[0m
[32m[I 2022-10-20 01:26:50,529][0m Trial 85 finished with value: 0.7147596505121057 and parameters: {'abc_n_estimators': 75, 'abc_learning_rate': 0.5605586984773141}. Best is trial 8 with value: 0.860355.[0m
[32m[I 2022-10-20 01:26:59,067][0m Trial 86 finished with value: 0.5830927546766471 and parameters: {'abc_n_estimators': 80, 'abc_learning_rate': 4.033037265280387e-05}. Best is trial 8 with value: 0.860355.[0m
[32m[I 2022-10-20 01:26:59,619][0m Trial 87 finished with value: 0.8603554461071355 and parameters: {'abc_n_estimators': 80, 'abc_learning_rate': 0.6239188306663636}. Best is trial 87 with value: 0.860355.[0m
[32m[I 2022-10-20 01:27:11,527][0m Trial 88 finished with value: 0.7112279308595345 and parameters: {'abc_n_estimators': 85, 'abc_learning_rate': 0.14137515325286573}. Best is trial 8 with value: 0.860355.[0m
[32m[I 2022-10-20 01:27:34,454][0m Trial 89 finished with value: 0.7395295217604434 and parameters: {'abc_n_estimators': 85, 'abc_learning_rate': 0.6553910113608925}. Best is trial 8 with value: 0.860355.[0m
[32m[I 2022-10-20 01:27:42,131][0m Trial 90 finished with value: 0.7112279308595345 and parameters: {'abc_n_estimators': 85, 'abc_learning_rate': 0.14758980520029383}. Best is trial 8 with value: 0.860355.[0m
[32m[I 2022-10-20 01:27:49,376][0m Trial 92 finished with value: 0.7485904993243858 and parameters: {'abc_n_estimators': 85, 'abc_learning_rate': 0.6516815256981968}. Best is trial 8 with value: 0.860355.[0m
[32m[I 2022-10-20 01:27:53,407][0m Trial 91 finished with value: 0.7112279308595345 and parameters: {'abc_n_estimators': 90, 'abc_learning_rate': 0.1480231106432794}. Best is trial 8 with value: 0.860355.[0m
[32m[I 2022-10-20 01:27:54,927][0m Trial 94 finished with value: 0.7112279308595345 and parameters: {'abc_n_estimators': 65, 'abc_learning_rate': 0.14428439527072853}. Best is trial 8 with value: 0.860355.[0m
[32m[I 2022-10-20 01:28:05,518][0m Trial 93 finished with value: 0.7109152880342821 and parameters: {'abc_n_estimators': 90, 'abc_learning_rate': 0.167450210726475}. Best is trial 8 with value: 0.860355.[0m
[32m[I 2022-10-20 01:28:12,016][0m Trial 95 finished with value: 0.7112279308595345 and parameters: {'abc_n_estimators': 90, 'abc_learning_rate': 0.14346093798641343}. Best is trial 8 with value: 0.860355.[0m
[32m[I 2022-10-20 01:28:19,229][0m Trial 96 finished with value: 0.7266493841638412 and parameters: {'abc_n_estimators': 90, 'abc_learning_rate': 0.016475087029346278}. Best is trial 8 with value: 0.860355.[0m
[32m[I 2022-10-20 01:28:20,135][0m Trial 97 finished with value: 0.7112279308595345 and parameters: {'abc_n_estimators': 65, 'abc_learning_rate': 0.14835448708470206}. Best is trial 8 with value: 0.860355.[0m
[32m[I 2022-10-20 01:28:23,362][0m Trial 98 finished with value: 0.7575278603673183 and parameters: {'abc_n_estimators': 65, 'abc_learning_rate': 0.6630219350859013}. Best is trial 8 with value: 0.860355.[0m
