[32m[I 2022-10-20 14:56:12,694][0m Trial 99 finished with value: 0.9074710020951025 and parameters: {'qda_reg_param': 0.05, 'qda_tol': 2.5823307249176415e-06}. Best is trial 0 with value: 0.907471.[0m
[32m[I 2022-10-20 14:56:12,772][0m Study finished.[0m
[32m[I 2022-10-20 14:56:12,854][0m --------------------------------------------------------------------------------[0m
[32m[I 2022-10-20 14:56:12,854][0m --------------------         RandomForestClassifier         --------------------[0m
[32m[I 2022-10-20 14:56:12,854][0m --------------------------------------------------------------------------------[0m
[32m[I 2022-10-20 14:56:12,886][0m A new study created in RDB with name: RandomForestClassifier_b4f53b70[0m
[32m[I 2022-10-20 14:56:12,886][0m Study started.[0m
[32m[I 2022-10-20 14:56:13,089][0m sklearn.ensemble.RandomForestClassifier.fit: fallback to original Scikit-learn[0m
[32m[I 2022-10-20 14:56:13,089][0m sklearn.ensemble.RandomForestClassifier.fit: running accelerated version on CPU[0m
[32m[I 2022-10-20 14:56:13,124][0m sklearn.ensemble.RandomForestClassifier.fit: fallback to original Scikit-learn[0m
[32m[I 2022-10-20 14:56:13,156][0m sklearn.ensemble.RandomForestClassifier.fit: fallback to original Scikit-learn[0m
[32m[I 2022-10-20 14:56:13,171][0m sklearn.ensemble.RandomForestClassifier.fit: fallback to original Scikit-learn[0m
[32m[I 2022-10-20 14:56:13,188][0m sklearn.ensemble.RandomForestClassifier.fit: running accelerated version on CPU[0m
[32m[I 2022-10-20 14:56:13,204][0m sklearn.ensemble.RandomForestClassifier.fit: fallback to original Scikit-learn[0m
[32m[I 2022-10-20 14:56:13,240][0m sklearn.ensemble.RandomForestClassifier.fit: running accelerated version on CPU[0m
[32m[I 2022-10-20 14:56:20,204][0m sklearn.ensemble.RandomForestClassifier.predict: running accelerated version on CPU[0m
[32m[I 2022-10-20 14:56:21,905][0m Trial 7 finished with value: 0.9916332457374047 and parameters: {'rfc_criterion': 'gini', 'rfc_n_estimators': 30, 'rfc_min_samples_split': 38, 'rfc_min_samples_leaf': 24, 'rfc_max_features': 36, 'rfc_bootstrap': True}. Best is trial 7 with value: 0.991633.[0m
[32m[I 2022-10-20 14:56:22,323][0m sklearn.ensemble.RandomForestClassifier.fit: fallback to original Scikit-learn[0m
[32m[I 2022-10-20 14:56:49,921][0m sklearn.ensemble.RandomForestClassifier.predict: running accelerated version on CPU[0m
[32m[I 2022-10-20 14:56:50,963][0m sklearn.ensemble.RandomForestClassifier.predict: running accelerated version on CPU[0m
[32m[I 2022-10-20 14:56:51,441][0m Trial 4 finished with value: 0.9917082720258918 and parameters: {'rfc_criterion': 'gini', 'rfc_n_estimators': 200, 'rfc_min_samples_split': 36, 'rfc_min_samples_leaf': 34, 'rfc_max_features': 11, 'rfc_bootstrap': False}. Best is trial 4 with value: 0.991708.[0m
[32m[I 2022-10-20 14:56:51,713][0m sklearn.ensemble.RandomForestClassifier.fit: running accelerated version on CPU[0m
[32m[I 2022-10-20 14:56:51,998][0m Trial 5 finished with value: 0.991496082195284 and parameters: {'rfc_criterion': 'gini', 'rfc_n_estimators': 130, 'rfc_min_samples_split': 29, 'rfc_min_samples_leaf': 49, 'rfc_max_features': 41, 'rfc_bootstrap': True}. Best is trial 4 with value: 0.991708.[0m
[32m[I 2022-10-20 14:56:52,561][0m sklearn.ensemble.RandomForestClassifier.fit: running accelerated version on CPU[0m
[32m[I 2022-10-20 14:57:28,037][0m sklearn.ensemble.RandomForestClassifier.predict: running accelerated version on CPU[0m
[32m[I 2022-10-20 14:57:30,868][0m Trial 9 finished with value: 0.9915346148937092 and parameters: {'rfc_criterion': 'gini', 'rfc_n_estimators': 190, 'rfc_min_samples_split': 50, 'rfc_min_samples_leaf': 32, 'rfc_max_features': 42, 'rfc_bootstrap': True}. Best is trial 4 with value: 0.991708.[0m
[32m[I 2022-10-20 14:57:31,437][0m sklearn.ensemble.RandomForestClassifier.fit: running accelerated version on CPU[0m
[32m[I 2022-10-20 14:57:38,766][0m sklearn.ensemble.RandomForestClassifier.predict: running accelerated version on CPU[0m
[32m[I 2022-10-20 14:57:39,203][0m sklearn.ensemble.RandomForestClassifier.predict: fallback to original Scikit-learn[0m
[32m[I 2022-10-20 14:57:39,203][0m sklearn.ensemble.RandomForestClassifier.predict_proba: fallback to original Scikit-learn[0m
[32m[I 2022-10-20 14:57:39,282][0m sklearn.ensemble.RandomForestClassifier.predict: running accelerated version on CPU[0m
[32m[I 2022-10-20 14:57:39,667][0m Trial 11 finished with value: 0.991773447606218 and parameters: {'rfc_criterion': 'gini', 'rfc_n_estimators': 20, 'rfc_min_samples_split': 12, 'rfc_min_samples_leaf': 5, 'rfc_max_features': 11, 'rfc_bootstrap': False}. Best is trial 11 with value: 0.991773.[0m
[32m[I 2022-10-20 14:57:39,863][0m sklearn.ensemble.RandomForestClassifier.fit: fallback to original Scikit-learn[0m
[32m[I 2022-10-20 14:57:40,287][0m Trial 10 finished with value: 0.9918574767876126 and parameters: {'rfc_criterion': 'gini', 'rfc_n_estimators': 180, 'rfc_min_samples_split': 26, 'rfc_min_samples_leaf': 8, 'rfc_max_features': 49, 'rfc_bootstrap': False}. Best is trial 10 with value: 0.991857.[0m
[32m[I 2022-10-20 14:57:40,522][0m sklearn.ensemble.RandomForestClassifier.fit: running accelerated version on CPU[0m
[32m[I 2022-10-20 14:57:41,638][0m Trial 1 finished with value: 0.9914888986396903 and parameters: {'rfc_criterion': 'entropy', 'rfc_n_estimators': 90, 'rfc_min_samples_split': 12, 'rfc_min_samples_leaf': 8, 'rfc_max_features': 13, 'rfc_bootstrap': True}. Best is trial 10 with value: 0.991857.[0m
[32m[I 2022-10-20 14:57:42,197][0m sklearn.ensemble.RandomForestClassifier.fit: running accelerated version on CPU[0m
[32m[I 2022-10-20 14:57:51,033][0m sklearn.ensemble.RandomForestClassifier.predict: fallback to original Scikit-learn[0m
[32m[I 2022-10-20 14:57:51,033][0m sklearn.ensemble.RandomForestClassifier.predict_proba: fallback to original Scikit-learn[0m
[32m[I 2022-10-20 14:57:53,323][0m Trial 3 finished with value: 0.9915817417451549 and parameters: {'rfc_criterion': 'entropy', 'rfc_n_estimators': 60, 'rfc_min_samples_split': 25, 'rfc_min_samples_leaf': 12, 'rfc_max_features': 32, 'rfc_bootstrap': True}. Best is trial 10 with value: 0.991857.[0m
[32m[I 2022-10-20 14:57:53,884][0m sklearn.ensemble.RandomForestClassifier.fit: running accelerated version on CPU[0m
[32m[I 2022-10-20 14:57:57,484][0m sklearn.ensemble.RandomForestClassifier.predict: fallback to original Scikit-learn[0m
[32m[I 2022-10-20 14:57:57,492][0m sklearn.ensemble.RandomForestClassifier.predict_proba: fallback to original Scikit-learn[0m
[32m[I 2022-10-20 14:57:58,208][0m sklearn.ensemble.RandomForestClassifier.predict: running accelerated version on CPU[0m
[32m[I 2022-10-20 14:57:59,561][0m Trial 14 finished with value: 0.99179841736556 and parameters: {'rfc_criterion': 'gini', 'rfc_n_estimators': 30, 'rfc_min_samples_split': 40, 'rfc_min_samples_leaf': 47, 'rfc_max_features': 28, 'rfc_bootstrap': False}. Best is trial 10 with value: 0.991857.[0m
[32m[I 2022-10-20 14:58:00,180][0m sklearn.ensemble.RandomForestClassifier.fit: running accelerated version on CPU[0m
[32m[I 2022-10-20 14:58:00,542][0m Trial 0 finished with value: 0.9914134096530454 and parameters: {'rfc_criterion': 'entropy', 'rfc_n_estimators': 80, 'rfc_min_samples_split': 6, 'rfc_min_samples_leaf': 17, 'rfc_max_features': 15, 'rfc_bootstrap': False}. Best is trial 10 with value: 0.991857.[0m
[32m[I 2022-10-20 14:58:01,007][0m sklearn.ensemble.RandomForestClassifier.fit: fallback to original Scikit-learn[0m
[32m[I 2022-10-20 14:58:02,551][0m sklearn.ensemble.RandomForestClassifier.predict: running accelerated version on CPU[0m
[32m[I 2022-10-20 14:58:06,913][0m Trial 13 finished with value: 0.9916098882140952 and parameters: {'rfc_criterion': 'gini', 'rfc_n_estimators': 150, 'rfc_min_samples_split': 19, 'rfc_min_samples_leaf': 7, 'rfc_max_features': 22, 'rfc_bootstrap': True}. Best is trial 10 with value: 0.991857.[0m
[32m[I 2022-10-20 14:58:07,468][0m sklearn.ensemble.RandomForestClassifier.fit: running accelerated version on CPU[0m
[32m[I 2022-10-20 14:58:19,072][0m sklearn.ensemble.RandomForestClassifier.predict: fallback to original Scikit-learn[0m
[32m[I 2022-10-20 14:58:19,072][0m sklearn.ensemble.RandomForestClassifier.predict_proba: fallback to original Scikit-learn[0m
[32m[I 2022-10-20 14:58:19,531][0m sklearn.ensemble.RandomForestClassifier.predict: running accelerated version on CPU[0m
[32m[I 2022-10-20 14:58:21,392][0m Trial 6 finished with value: 0.9917022881690922 and parameters: {'rfc_criterion': 'entropy', 'rfc_n_estimators': 60, 'rfc_min_samples_split': 30, 'rfc_min_samples_leaf': 28, 'rfc_max_features': 31, 'rfc_bootstrap': False}. Best is trial 10 with value: 0.991857.[0m
[32m[I 2022-10-20 14:58:21,989][0m sklearn.ensemble.RandomForestClassifier.fit: running accelerated version on CPU[0m
[32m[I 2022-10-20 14:58:22,667][0m Trial 16 finished with value: 0.9915355657764534 and parameters: {'rfc_criterion': 'gini', 'rfc_n_estimators': 100, 'rfc_min_samples_split': 14, 'rfc_min_samples_leaf': 12, 'rfc_max_features': 5, 'rfc_bootstrap': True}. Best is trial 10 with value: 0.991857.[0m
[32m[I 2022-10-20 14:58:23,330][0m sklearn.ensemble.RandomForestClassifier.fit: running accelerated version on CPU[0m
[32m[I 2022-10-20 14:58:41,670][0m sklearn.ensemble.RandomForestClassifier.predict: running accelerated version on CPU[0m
[32m[I 2022-10-20 14:58:46,841][0m Trial 15 finished with value: 0.9917535078797455 and parameters: {'rfc_criterion': 'gini', 'rfc_n_estimators': 200, 'rfc_min_samples_split': 34, 'rfc_min_samples_leaf': 28, 'rfc_max_features': 14, 'rfc_bootstrap': False}. Best is trial 10 with value: 0.991857.[0m
[32m[I 2022-10-20 14:58:47,519][0m sklearn.ensemble.RandomForestClassifier.fit: running accelerated version on CPU[0m
[32m[I 2022-10-20 14:58:51,493][0m sklearn.ensemble.RandomForestClassifier.predict: fallback to original Scikit-learn[0m
[32m[I 2022-10-20 14:58:51,494][0m sklearn.ensemble.RandomForestClassifier.predict_proba: fallback to original Scikit-learn[0m
[32m[I 2022-10-20 14:58:53,544][0m Trial 12 finished with value: 0.9913824795698173 and parameters: {'rfc_criterion': 'entropy', 'rfc_n_estimators': 50, 'rfc_min_samples_split': 46, 'rfc_min_samples_leaf': 12, 'rfc_max_features': 25, 'rfc_bootstrap': True}. Best is trial 10 with value: 0.991857.[0m
[32m[I 2022-10-20 14:58:54,177][0m sklearn.ensemble.RandomForestClassifier.fit: running accelerated version on CPU[0m
[32m[I 2022-10-20 14:58:58,099][0m sklearn.ensemble.RandomForestClassifier.predict: running accelerated version on CPU[0m
[32m[I 2022-10-20 14:59:02,412][0m Trial 18 finished with value: 0.9918332613122692 and parameters: {'rfc_criterion': 'gini', 'rfc_n_estimators': 150, 'rfc_min_samples_split': 48, 'rfc_min_samples_leaf': 49, 'rfc_max_features': 50, 'rfc_bootstrap': False}. Best is trial 10 with value: 0.991857.[0m
[32m[I 2022-10-20 14:59:03,063][0m sklearn.ensemble.RandomForestClassifier.fit: running accelerated version on CPU[0m
[32m[I 2022-10-20 14:59:17,096][0m sklearn.ensemble.RandomForestClassifier.predict: fallback to original Scikit-learn[0m
[32m[I 2022-10-20 14:59:17,096][0m sklearn.ensemble.RandomForestClassifier.predict_proba: fallback to original Scikit-learn[0m
[32m[I 2022-10-20 14:59:20,230][0m Trial 8 finished with value: 0.9914898199819906 and parameters: {'rfc_criterion': 'entropy', 'rfc_n_estimators': 100, 'rfc_min_samples_split': 50, 'rfc_min_samples_leaf': 21, 'rfc_max_features': 22, 'rfc_bootstrap': False}. Best is trial 10 with value: 0.991857.[0m
[32m[I 2022-10-20 14:59:20,930][0m sklearn.ensemble.RandomForestClassifier.fit: running accelerated version on CPU[0m
[32m[I 2022-10-20 14:59:27,522][0m sklearn.ensemble.RandomForestClassifier.predict: running accelerated version on CPU[0m
[32m[I 2022-10-20 14:59:31,908][0m Trial 19 finished with value: 0.9918331893452533 and parameters: {'rfc_criterion': 'gini', 'rfc_n_estimators': 150, 'rfc_min_samples_split': 47, 'rfc_min_samples_leaf': 50, 'rfc_max_features': 50, 'rfc_bootstrap': False}. Best is trial 10 with value: 0.991857.[0m
[32m[I 2022-10-20 14:59:32,555][0m sklearn.ensemble.RandomForestClassifier.fit: running accelerated version on CPU[0m
[32m[I 2022-10-20 14:59:41,776][0m sklearn.ensemble.RandomForestClassifier.predict: running accelerated version on CPU[0m
[32m[I 2022-10-20 14:59:44,599][0m Trial 20 finished with value: 0.9918331893452533 and parameters: {'rfc_criterion': 'gini', 'rfc_n_estimators': 160, 'rfc_min_samples_split': 48, 'rfc_min_samples_leaf': 50, 'rfc_max_features': 48, 'rfc_bootstrap': False}. Best is trial 10 with value: 0.991857.[0m
[32m[I 2022-10-20 14:59:45,303][0m sklearn.ensemble.RandomForestClassifier.fit: running accelerated version on CPU[0m
[32m[I 2022-10-20 15:00:08,020][0m sklearn.ensemble.RandomForestClassifier.predict: running accelerated version on CPU[0m
[32m[I 2022-10-20 15:00:09,940][0m sklearn.ensemble.RandomForestClassifier.predict: running accelerated version on CPU[0m
[32m[I 2022-10-20 15:00:10,594][0m Trial 21 finished with value: 0.9916810840595253 and parameters: {'rfc_criterion': 'gini', 'rfc_n_estimators': 130, 'rfc_min_samples_split': 44, 'rfc_min_samples_leaf': 43, 'rfc_max_features': 45, 'rfc_bootstrap': False}. Best is trial 10 with value: 0.991857.[0m
[32m[I 2022-10-20 15:00:11,249][0m sklearn.ensemble.RandomForestClassifier.fit: running accelerated version on CPU[0m
[32m[I 2022-10-20 15:00:13,424][0m Trial 22 finished with value: 0.9918332613122692 and parameters: {'rfc_criterion': 'gini', 'rfc_n_estimators': 160, 'rfc_min_samples_split': 42, 'rfc_min_samples_leaf': 49, 'rfc_max_features': 50, 'rfc_bootstrap': False}. Best is trial 10 with value: 0.991857.[0m
[32m[I 2022-10-20 15:00:14,108][0m sklearn.ensemble.RandomForestClassifier.fit: running accelerated version on CPU[0m
[32m[I 2022-10-20 15:00:16,157][0m sklearn.ensemble.RandomForestClassifier.predict: fallback to original Scikit-learn[0m
[32m[I 2022-10-20 15:00:16,157][0m sklearn.ensemble.RandomForestClassifier.predict_proba: fallback to original Scikit-learn[0m
[32m[I 2022-10-20 15:00:19,785][0m Trial 2 finished with value: 0.9915803776683996 and parameters: {'rfc_criterion': 'entropy', 'rfc_n_estimators': 120, 'rfc_min_samples_split': 34, 'rfc_min_samples_leaf': 3, 'rfc_max_features': 43, 'rfc_bootstrap': True}. Best is trial 10 with value: 0.991857.[0m
[32m[I 2022-10-20 15:00:20,518][0m sklearn.ensemble.RandomForestClassifier.fit: running accelerated version on CPU[0m
[32m[I 2022-10-20 15:00:35,528][0m sklearn.ensemble.RandomForestClassifier.predict: running accelerated version on CPU[0m
[32m[I 2022-10-20 15:00:35,697][0m sklearn.ensemble.RandomForestClassifier.predict: running accelerated version on CPU[0m
[32m[I 2022-10-20 15:00:38,002][0m Trial 23 finished with value: 0.9917955851350062 and parameters: {'rfc_criterion': 'gini', 'rfc_n_estimators': 160, 'rfc_min_samples_split': 23, 'rfc_min_samples_leaf': 42, 'rfc_max_features': 50, 'rfc_bootstrap': False}. Best is trial 10 with value: 0.991857.[0m
[32m[I 2022-10-20 15:00:38,655][0m sklearn.ensemble.RandomForestClassifier.fit: running accelerated version on CPU[0m
[32m[I 2022-10-20 15:00:39,351][0m Trial 24 finished with value: 0.9917885157003897 and parameters: {'rfc_criterion': 'gini', 'rfc_n_estimators': 160, 'rfc_min_samples_split': 22, 'rfc_min_samples_leaf': 40, 'rfc_max_features': 49, 'rfc_bootstrap': False}. Best is trial 10 with value: 0.991857.[0m
[32m[I 2022-10-20 15:00:40,052][0m sklearn.ensemble.RandomForestClassifier.fit: running accelerated version on CPU[0m
[32m[I 2022-10-20 15:00:56,022][0m sklearn.ensemble.RandomForestClassifier.predict: running accelerated version on CPU[0m
[32m[I 2022-10-20 15:01:00,864][0m Trial 25 finished with value: 0.9918185851236336 and parameters: {'rfc_criterion': 'gini', 'rfc_n_estimators': 170, 'rfc_min_samples_split': 23, 'rfc_min_samples_leaf': 41, 'rfc_max_features': 49, 'rfc_bootstrap': False}. Best is trial 10 with value: 0.991857.[0m
[32m[I 2022-10-20 15:01:01,613][0m sklearn.ensemble.RandomForestClassifier.fit: running accelerated version on CPU[0m
[32m[I 2022-10-20 15:01:40,765][0m sklearn.ensemble.RandomForestClassifier.predict: running accelerated version on CPU[0m
[32m[I 2022-10-20 15:01:44,350][0m sklearn.ensemble.RandomForestClassifier.predict: running accelerated version on CPU[0m
[32m[I 2022-10-20 15:01:45,209][0m Trial 26 finished with value: 0.9918805451223233 and parameters: {'rfc_criterion': 'gini', 'rfc_n_estimators': 170, 'rfc_min_samples_split': 22, 'rfc_min_samples_leaf': 2, 'rfc_max_features': 44, 'rfc_bootstrap': False}. Best is trial 26 with value: 0.991881.[0m
[32m[I 2022-10-20 15:01:45,775][0m sklearn.ensemble.RandomForestClassifier.predict: running accelerated version on CPU[0m
[32m[I 2022-10-20 15:01:46,078][0m sklearn.ensemble.RandomForestClassifier.fit: running accelerated version on CPU[0m
[32m[I 2022-10-20 15:01:49,063][0m Trial 28 finished with value: 0.99174914622064 and parameters: {'rfc_criterion': 'gini', 'rfc_n_estimators': 170, 'rfc_min_samples_split': 22, 'rfc_min_samples_leaf': 43, 'rfc_max_features': 39, 'rfc_bootstrap': False}. Best is trial 26 with value: 0.991881.[0m
[32m[I 2022-10-20 15:01:49,762][0m sklearn.ensemble.RandomForestClassifier.fit: running accelerated version on CPU[0m
[32m[I 2022-10-20 15:01:50,489][0m Trial 29 finished with value: 0.9918185851236336 and parameters: {'rfc_criterion': 'gini', 'rfc_n_estimators': 170, 'rfc_min_samples_split': 23, 'rfc_min_samples_leaf': 41, 'rfc_max_features': 50, 'rfc_bootstrap': False}. Best is trial 26 with value: 0.991881.[0m
[32m[I 2022-10-20 15:01:51,229][0m sklearn.ensemble.RandomForestClassifier.fit: running accelerated version on CPU[0m
[32m[I 2022-10-20 15:01:55,071][0m sklearn.ensemble.RandomForestClassifier.predict: running accelerated version on CPU[0m
[32m[I 2022-10-20 15:01:59,691][0m Trial 27 finished with value: 0.9917952250029607 and parameters: {'rfc_criterion': 'gini', 'rfc_n_estimators': 170, 'rfc_min_samples_split': 22, 'rfc_min_samples_leaf': 39, 'rfc_max_features': 38, 'rfc_bootstrap': False}. Best is trial 26 with value: 0.991881.[0m
[32m[I 2022-10-20 15:02:00,426][0m sklearn.ensemble.RandomForestClassifier.fit: running accelerated version on CPU[0m
[32m[I 2022-10-20 15:02:23,623][0m sklearn.ensemble.RandomForestClassifier.predict: running accelerated version on CPU[0m
[32m[I 2022-10-20 15:02:23,778][0m sklearn.ensemble.RandomForestClassifier.predict: running accelerated version on CPU[0m
[32m[I 2022-10-20 15:02:28,045][0m Trial 30 finished with value: 0.9918331173124008 and parameters: {'rfc_criterion': 'gini', 'rfc_n_estimators': 160, 'rfc_min_samples_split': 41, 'rfc_min_samples_leaf': 40, 'rfc_max_features': 38, 'rfc_bootstrap': False}. Best is trial 26 with value: 0.991881.[0m
[32m[I 2022-10-20 15:02:28,733][0m sklearn.ensemble.RandomForestClassifier.fit: running accelerated version on CPU[0m
[32m[I 2022-10-20 15:02:29,032][0m Trial 31 finished with value: 0.9917875817008651 and parameters: {'rfc_criterion': 'gini', 'rfc_n_estimators': 180, 'rfc_min_samples_split': 42, 'rfc_min_samples_leaf': 38, 'rfc_max_features': 38, 'rfc_bootstrap': False}. Best is trial 26 with value: 0.991881.[0m
[32m[I 2022-10-20 15:02:29,748][0m sklearn.ensemble.RandomForestClassifier.fit: running accelerated version on CPU[0m
[32m[I 2022-10-20 15:02:49,515][0m sklearn.ensemble.RandomForestClassifier.predict: running accelerated version on CPU[0m
[32m[I 2022-10-20 15:02:54,828][0m Trial 32 finished with value: 0.9916661624314411 and parameters: {'rfc_criterion': 'gini', 'rfc_n_estimators': 190, 'rfc_min_samples_split': 41, 'rfc_min_samples_leaf': 35, 'rfc_max_features': 39, 'rfc_bootstrap': False}. Best is trial 26 with value: 0.991881.[0m
[32m[I 2022-10-20 15:02:55,514][0m sklearn.ensemble.RandomForestClassifier.fit: running accelerated version on CPU[0m
[32m[I 2022-10-20 15:03:26,366][0m sklearn.ensemble.RandomForestClassifier.predict: running accelerated version on CPU[0m
[32m[I 2022-10-20 15:03:31,507][0m Trial 34 finished with value: 0.9917961588497965 and parameters: {'rfc_criterion': 'gini', 'rfc_n_estimators': 180, 'rfc_min_samples_split': 17, 'rfc_min_samples_leaf': 3, 'rfc_max_features': 37, 'rfc_bootstrap': False}. Best is trial 26 with value: 0.991881.[0m
[32m[I 2022-10-20 15:03:32,203][0m sklearn.ensemble.RandomForestClassifier.fit: running accelerated version on CPU[0m
[32m[I 2022-10-20 15:03:35,445][0m sklearn.ensemble.RandomForestClassifier.predict: running accelerated version on CPU[0m
[32m[I 2022-10-20 15:03:36,335][0m sklearn.ensemble.RandomForestClassifier.predict: running accelerated version on CPU[0m
[32m[I 2022-10-20 15:03:38,700][0m Trial 33 finished with value: 0.991843084580201 and parameters: {'rfc_criterion': 'gini', 'rfc_n_estimators': 180, 'rfc_min_samples_split': 16, 'rfc_min_samples_leaf': 1, 'rfc_max_features': 36, 'rfc_bootstrap': False}. Best is trial 26 with value: 0.991881.[0m
[32m[I 2022-10-20 15:03:39,246][0m sklearn.ensemble.RandomForestClassifier.fit: fallback to original Scikit-learn[0m
[32m[I 2022-10-20 15:03:40,136][0m Trial 35 finished with value: 0.991858224875145 and parameters: {'rfc_criterion': 'gini', 'rfc_n_estimators': 180, 'rfc_min_samples_split': 17, 'rfc_min_samples_leaf': 1, 'rfc_max_features': 37, 'rfc_bootstrap': False}. Best is trial 26 with value: 0.991881.[0m
[32m[I 2022-10-20 15:03:40,661][0m sklearn.ensemble.RandomForestClassifier.fit: fallback to original Scikit-learn[0m
[32m[I 2022-10-20 15:03:41,115][0m sklearn.ensemble.RandomForestClassifier.predict: running accelerated version on CPU[0m
