[32m[I 2022-10-20 04:46:20,082][0m Trial 87 finished with value: 0.9047439555188416 and parameters: {'lda_solver': 'svd', 'lda_n_components': 3}. Best is trial 87 with value: 0.904744.[0m
[32m[I 2022-10-20 04:46:20,207][0m Trial 85 finished with value: 0.9047439555188416 and parameters: {'lda_solver': 'svd', 'lda_n_components': 3}. Best is trial 87 with value: 0.904744.[0m
[32m[I 2022-10-20 04:46:23,860][0m Trial 88 finished with value: 0.9047439555188416 and parameters: {'lda_solver': 'svd', 'lda_n_components': 3}. Best is trial 88 with value: 0.904744.[0m
[32m[I 2022-10-20 04:46:23,922][0m Trial 86 finished with value: 0.9047439555188416 and parameters: {'lda_solver': 'svd', 'lda_n_components': 3}. Best is trial 89 with value: 0.904744.[0m
[32m[I 2022-10-20 04:46:24,000][0m Trial 89 finished with value: 0.9047439555188416 and parameters: {'lda_solver': 'svd', 'lda_n_components': 3}. Best is trial 89 with value: 0.904744.[0m
[32m[I 2022-10-20 04:46:24,393][0m Trial 91 finished with value: 0.9047439555188416 and parameters: {'lda_solver': 'svd', 'lda_n_components': 3}. Best is trial 92 with value: 0.904744.[0m
[32m[I 2022-10-20 04:46:24,409][0m Trial 92 finished with value: 0.9047439555188416 and parameters: {'lda_solver': 'svd', 'lda_n_components': 3}. Best is trial 92 with value: 0.904744.[0m
[32m[I 2022-10-20 04:46:24,409][0m Trial 90 finished with value: 0.9047439555188416 and parameters: {'lda_solver': 'svd', 'lda_n_components': 3}. Best is trial 92 with value: 0.904744.[0m
[32m[I 2022-10-20 04:46:27,563][0m Trial 93 finished with value: 0.9047439555188416 and parameters: {'lda_solver': 'svd', 'lda_n_components': 3}. Best is trial 93 with value: 0.904744.[0m
[32m[I 2022-10-20 04:46:29,382][0m Trial 94 finished with value: 0.9047439555188416 and parameters: {'lda_solver': 'svd', 'lda_n_components': 3}. Best is trial 94 with value: 0.904744.[0m
[32m[I 2022-10-20 04:46:35,146][0m Trial 95 finished with value: 0.9047439555188416 and parameters: {'lda_solver': 'svd', 'lda_n_components': 3}. Best is trial 97 with value: 0.904744.[0m
[32m[I 2022-10-20 04:46:35,208][0m Trial 99 finished with value: 0.9047439555188416 and parameters: {'lda_solver': 'svd', 'lda_n_components': 3}. Best is trial 99 with value: 0.904744.[0m
[32m[I 2022-10-20 04:46:35,208][0m Trial 97 finished with value: 0.9047439555188416 and parameters: {'lda_solver': 'svd', 'lda_n_components': 3}. Best is trial 99 with value: 0.904744.[0m
[32m[I 2022-10-20 04:46:35,349][0m Trial 96 finished with value: 0.9047439555188416 and parameters: {'lda_solver': 'svd', 'lda_n_components': 3}. Best is trial 99 with value: 0.904744.[0m
[32m[I 2022-10-20 04:46:35,412][0m Trial 98 finished with value: 0.9047439555188416 and parameters: {'lda_solver': 'svd', 'lda_n_components': 3}. Best is trial 99 with value: 0.904744.[0m
[32m[I 2022-10-20 04:46:35,474][0m Study finished.[0m
[32m[I 2022-10-20 04:46:35,568][0m --------------------------------------------------------------------------------[0m
[32m[I 2022-10-20 04:46:35,568][0m --------------------               LinearSVC                --------------------[0m
[32m[I 2022-10-20 04:46:35,568][0m --------------------------------------------------------------------------------[0m
[32m[I 2022-10-20 04:46:35,599][0m A new study created in RDB with name: LinearSVC_b4f53b70[0m
[32m[I 2022-10-20 04:46:35,599][0m Study started.[0m
[32m[I 2022-10-20 04:46:51,758][0m Trial 0 finished with value: 0.8279120300441366 and parameters: {'lsvc_dual': False, 'lsvc_C': 7.431946086982675, 'lsvc_max_iter': 2000}. Best is trial 0 with value: 0.827912.[0m
[32m[I 2022-10-20 04:47:07,997][0m Trial 1 finished with value: 0.8867677802807925 and parameters: {'lsvc_dual': False, 'lsvc_C': 1.1197240588611583, 'lsvc_max_iter': 2000}. Best is trial 1 with value: 0.886768.[0m
[32m[I 2022-10-20 04:47:27,585][0m Trial 2 finished with value: 0.8266395774144785 and parameters: {'lsvc_dual': False, 'lsvc_C': 25.17781646795131, 'lsvc_max_iter': 2000}. Best is trial 1 with value: 0.886768.[0m
[32m[I 2022-10-20 04:47:43,500][0m Trial 3 finished with value: 0.827825024016214 and parameters: {'lsvc_dual': False, 'lsvc_C': 6.177915905546505, 'lsvc_max_iter': 2000}. Best is trial 1 with value: 0.886768.[0m
[32m[I 2022-10-20 04:47:59,455][0m Trial 4 finished with value: 0.8775043480746892 and parameters: {'lsvc_dual': False, 'lsvc_C': 0.0001703285555854822, 'lsvc_max_iter': 2000}. Best is trial 1 with value: 0.886768.[0m
[32m[I 2022-10-20 04:48:15,778][0m Trial 5 finished with value: 0.8276489221371384 and parameters: {'lsvc_dual': False, 'lsvc_C': 0.0003147398335207216, 'lsvc_max_iter': 2000}. Best is trial 1 with value: 0.886768.[0m
[32m[I 2022-10-20 04:48:31,921][0m Trial 6 finished with value: 0.8780323329010553 and parameters: {'lsvc_dual': False, 'lsvc_C': 0.01329800743612261, 'lsvc_max_iter': 2000}. Best is trial 1 with value: 0.886768.[0m
[32m[I 2022-10-20 04:48:48,871][0m Trial 7 finished with value: 0.8276297844357339 and parameters: {'lsvc_dual': False, 'lsvc_C': 0.0004128468326458298, 'lsvc_max_iter': 2000}. Best is trial 1 with value: 0.886768.[0m
[32m[I 2022-10-20 04:49:06,172][0m Trial 8 finished with value: 0.8286893020625749 and parameters: {'lsvc_dual': False, 'lsvc_C': 0.009108599877275076, 'lsvc_max_iter': 2000}. Best is trial 1 with value: 0.886768.[0m
[32m[I 2022-10-20 04:49:26,256][0m Trial 9 finished with value: 0.8278847917611112 and parameters: {'lsvc_dual': False, 'lsvc_C': 0.001488583972545494, 'lsvc_max_iter': 2000}. Best is trial 1 with value: 0.886768.[0m
[32m[I 2022-10-20 04:49:41,067][0m Trial 10 finished with value: 0.878905599310365 and parameters: {'lsvc_dual': False, 'lsvc_C': 1.4012565645564933e-06, 'lsvc_max_iter': 2000}. Best is trial 1 with value: 0.886768.[0m
[32m[I 2022-10-20 04:49:54,523][0m Trial 11 finished with value: 0.8787133040732273 and parameters: {'lsvc_dual': False, 'lsvc_C': 1.2231004310900224e-06, 'lsvc_max_iter': 2000}. Best is trial 1 with value: 0.886768.[0m
[32m[I 2022-10-20 04:50:13,718][0m Trial 12 finished with value: 0.8288365869781479 and parameters: {'lsvc_dual': False, 'lsvc_C': 1.0859723256273932, 'lsvc_max_iter': 2000}. Best is trial 1 with value: 0.886768.[0m
[32m[I 2022-10-20 04:50:27,277][0m Trial 13 finished with value: 0.8786674524838676 and parameters: {'lsvc_dual': False, 'lsvc_C': 1.5545426528624564e-06, 'lsvc_max_iter': 2000}. Best is trial 1 with value: 0.886768.[0m
[32m[I 2022-10-20 04:50:45,695][0m Trial 14 finished with value: 0.8725174941568505 and parameters: {'lsvc_dual': False, 'lsvc_C': 0.258504385615717, 'lsvc_max_iter': 2000}. Best is trial 1 with value: 0.886768.[0m
[32m[I 2022-10-20 04:51:07,294][0m Trial 15 finished with value: 0.8785333279860851 and parameters: {'lsvc_dual': False, 'lsvc_C': 866.3649271813581, 'lsvc_max_iter': 2000}. Best is trial 1 with value: 0.886768.[0m
[32m[I 2022-10-20 04:51:25,491][0m Trial 16 finished with value: 0.8788049249222663 and parameters: {'lsvc_dual': False, 'lsvc_C': 2.3533171794148538e-05, 'lsvc_max_iter': 2000}. Best is trial 1 with value: 0.886768.[0m
[32m[I 2022-10-20 04:51:43,868][0m Trial 17 finished with value: 0.8279502575535633 and parameters: {'lsvc_dual': False, 'lsvc_C': 0.24522714044337315, 'lsvc_max_iter': 2000}. Best is trial 1 with value: 0.886768.[0m
[32m[I 2022-10-20 04:52:02,024][0m Trial 18 finished with value: 0.8478253235698423 and parameters: {'lsvc_dual': False, 'lsvc_C': 711.1908774814844, 'lsvc_max_iter': 2000}. Best is trial 1 with value: 0.886768.[0m
[32m[I 2022-10-20 04:52:19,751][0m Trial 19 finished with value: 0.8275354568534029 and parameters: {'lsvc_dual': False, 'lsvc_C': 1.3148132890623786e-05, 'lsvc_max_iter': 2000}. Best is trial 1 with value: 0.886768.[0m
[32m[I 2022-10-20 04:52:37,739][0m Trial 20 finished with value: 0.8278048574319974 and parameters: {'lsvc_dual': False, 'lsvc_C': 94.74638764830443, 'lsvc_max_iter': 2000}. Best is trial 1 with value: 0.886768.[0m
[32m[I 2022-10-20 04:52:53,305][0m Trial 21 finished with value: 0.8270594983693549 and parameters: {'lsvc_dual': False, 'lsvc_C': 1.4151964884451416e-05, 'lsvc_max_iter': 2000}. Best is trial 1 with value: 0.886768.[0m
[32m[I 2022-10-20 04:53:09,741][0m Trial 22 finished with value: 0.8271257678511084 and parameters: {'lsvc_dual': False, 'lsvc_C': 1.3206138195369196e-05, 'lsvc_max_iter': 2000}. Best is trial 1 with value: 0.886768.[0m
[32m[I 2022-10-20 04:53:27,198][0m Trial 23 finished with value: 0.8328931192425638 and parameters: {'lsvc_dual': False, 'lsvc_C': 5.026660222651904e-05, 'lsvc_max_iter': 2000}. Best is trial 1 with value: 0.886768.[0m
[32m[I 2022-10-20 04:53:44,971][0m Trial 24 finished with value: 0.9079977763209369 and parameters: {'lsvc_dual': False, 'lsvc_C': 0.08675095748671044, 'lsvc_max_iter': 2000}. Best is trial 24 with value: 0.907998.[0m
[32m[I 2022-10-20 04:54:02,273][0m Trial 25 finished with value: 0.8279120300441366 and parameters: {'lsvc_dual': False, 'lsvc_C': 0.09271715276164254, 'lsvc_max_iter': 2000}. Best is trial 24 with value: 0.907998.[0m
[32m[I 2022-10-20 04:54:16,979][0m Trial 26 finished with value: 0.8761457189367354 and parameters: {'lsvc_dual': False, 'lsvc_C': 0.0030794668706414004, 'lsvc_max_iter': 2000}. Best is trial 24 with value: 0.907998.[0m
[32m[I 2022-10-20 04:54:35,260][0m Trial 27 finished with value: 0.8279502575535633 and parameters: {'lsvc_dual': False, 'lsvc_C': 1.0511764778700357, 'lsvc_max_iter': 2000}. Best is trial 24 with value: 0.907998.[0m
[32m[I 2022-10-20 04:54:51,273][0m Trial 28 finished with value: 0.8271452766167416 and parameters: {'lsvc_dual': False, 'lsvc_C': 0.05404829916630618, 'lsvc_max_iter': 2000}. Best is trial 24 with value: 0.907998.[0m
[32m[I 2022-10-20 04:55:07,661][0m Trial 29 finished with value: 0.8284197269556579 and parameters: {'lsvc_dual': False, 'lsvc_C': 2.980434368931241, 'lsvc_max_iter': 2000}. Best is trial 24 with value: 0.907998.[0m
[32m[I 2022-10-20 04:55:27,459][0m Trial 30 finished with value: 0.8734625713162595 and parameters: {'lsvc_dual': False, 'lsvc_C': 103.66577065114262, 'lsvc_max_iter': 2000}. Best is trial 24 with value: 0.907998.[0m
[32m[I 2022-10-20 04:55:46,012][0m Trial 31 finished with value: 0.8276402248912715 and parameters: {'lsvc_dual': False, 'lsvc_C': 3.7042188527609336e-06, 'lsvc_max_iter': 2000}. Best is trial 24 with value: 0.907998.[0m
[32m[I 2022-10-20 04:56:03,201][0m Trial 32 finished with value: 0.8562554142292588 and parameters: {'lsvc_dual': False, 'lsvc_C': 0.3561662954786632, 'lsvc_max_iter': 2000}. Best is trial 24 with value: 0.907998.[0m
[32m[I 2022-10-20 04:56:20,854][0m Trial 33 finished with value: 0.8890992854260806 and parameters: {'lsvc_dual': False, 'lsvc_C': 6.234851356659625e-05, 'lsvc_max_iter': 2000}. Best is trial 24 with value: 0.907998.[0m
[32m[I 2022-10-20 04:56:38,738][0m Trial 34 finished with value: 0.8491960080689335 and parameters: {'lsvc_dual': False, 'lsvc_C': 10.344715334768255, 'lsvc_max_iter': 2000}. Best is trial 24 with value: 0.907998.[0m
[32m[I 2022-10-20 04:56:54,364][0m Trial 35 finished with value: 0.8271942338312436 and parameters: {'lsvc_dual': False, 'lsvc_C': 8.956869206744706e-05, 'lsvc_max_iter': 2000}. Best is trial 24 with value: 0.907998.[0m
[32m[I 2022-10-20 04:57:11,718][0m Trial 36 finished with value: 0.8276884739560114 and parameters: {'lsvc_dual': False, 'lsvc_C': 0.0021704538828543067, 'lsvc_max_iter': 2000}. Best is trial 24 with value: 0.907998.[0m
[32m[I 2022-10-20 04:57:29,905][0m Trial 37 finished with value: 0.8276903820839533 and parameters: {'lsvc_dual': False, 'lsvc_C': 0.0215988591879435, 'lsvc_max_iter': 2000}. Best is trial 24 with value: 0.907998.[0m
[32m[I 2022-10-20 04:57:45,258][0m Trial 38 finished with value: 0.8787270563890874 and parameters: {'lsvc_dual': False, 'lsvc_C': 0.00046872352319103985, 'lsvc_max_iter': 2000}. Best is trial 24 with value: 0.907998.[0m
[32m[I 2022-10-20 04:57:59,761][0m Trial 39 finished with value: 0.8276948986391538 and parameters: {'lsvc_dual': False, 'lsvc_C': 3.986661113117001e-06, 'lsvc_max_iter': 2000}. Best is trial 24 with value: 0.907998.[0m
[32m[I 2022-10-20 04:58:16,462][0m Trial 40 finished with value: 0.8278439358109788 and parameters: {'lsvc_dual': False, 'lsvc_C': 0.00562770954951096, 'lsvc_max_iter': 2000}. Best is trial 24 with value: 0.907998.[0m
[32m[I 2022-10-20 04:58:32,387][0m Trial 41 finished with value: 0.8276735059498372 and parameters: {'lsvc_dual': False, 'lsvc_C': 2.997659842442874e-05, 'lsvc_max_iter': 2000}. Best is trial 24 with value: 0.907998.[0m
[32m[I 2022-10-20 04:58:45,886][0m Trial 42 finished with value: 0.8787448009962107 and parameters: {'lsvc_dual': False, 'lsvc_C': 3.1574607772529263e-06, 'lsvc_max_iter': 2000}. Best is trial 24 with value: 0.907998.[0m
[32m[I 2022-10-20 04:59:05,521][0m Trial 43 finished with value: 0.929659978833396 and parameters: {'lsvc_dual': False, 'lsvc_C': 0.0002694463057021972, 'lsvc_max_iter': 2000}. Best is trial 43 with value: 0.92966.[0m
[32m[I 2022-10-20 04:59:21,089][0m Trial 44 finished with value: 0.8279681032019087 and parameters: {'lsvc_dual': False, 'lsvc_C': 0.0001789492431111645, 'lsvc_max_iter': 2000}. Best is trial 43 with value: 0.92966.[0m
[32m[I 2022-10-20 04:59:37,442][0m Trial 45 finished with value: 0.8267585155760395 and parameters: {'lsvc_dual': False, 'lsvc_C': 0.0004150517152387957, 'lsvc_max_iter': 2000}. Best is trial 43 with value: 0.92966.[0m
[32m[I 2022-10-20 04:59:52,624][0m Trial 46 finished with value: 0.8279502575535633 and parameters: {'lsvc_dual': False, 'lsvc_C': 0.0014072704448026341, 'lsvc_max_iter': 2000}. Best is trial 43 with value: 0.92966.[0m
[32m[I 2022-10-20 05:00:09,684][0m Trial 47 finished with value: 0.8557830419770498 and parameters: {'lsvc_dual': False, 'lsvc_C': 0.09915632835555167, 'lsvc_max_iter': 2000}. Best is trial 43 with value: 0.92966.[0m
[32m[I 2022-10-20 05:00:29,172][0m Trial 48 finished with value: 0.8261099244967974 and parameters: {'lsvc_dual': False, 'lsvc_C': 2.4553725987919983, 'lsvc_max_iter': 2000}. Best is trial 43 with value: 0.92966.[0m
[32m[I 2022-10-20 05:00:45,852][0m Trial 49 finished with value: 0.8279256494806927 and parameters: {'lsvc_dual': False, 'lsvc_C': 0.0098839751337421, 'lsvc_max_iter': 2000}. Best is trial 43 with value: 0.92966.[0m
[32m[I 2022-10-20 05:01:01,287][0m Trial 50 finished with value: 0.8279380994655269 and parameters: {'lsvc_dual': False, 'lsvc_C': 0.0010295710333123973, 'lsvc_max_iter': 2000}. Best is trial 43 with value: 0.92966.[0m
[32m[I 2022-10-20 05:01:15,404][0m Trial 51 finished with value: 0.8689198944448703 and parameters: {'lsvc_dual': False, 'lsvc_C': 1.0096832841565416e-06, 'lsvc_max_iter': 2000}. Best is trial 43 with value: 0.92966.[0m
[32m[I 2022-10-20 05:01:29,972][0m Trial 52 finished with value: 0.8277289763350542 and parameters: {'lsvc_dual': False, 'lsvc_C': 2.96713548081169e-05, 'lsvc_max_iter': 2000}. Best is trial 43 with value: 0.92966.[0m
[32m[I 2022-10-20 05:01:43,272][0m Trial 53 finished with value: 0.8517444106499938 and parameters: {'lsvc_dual': False, 'lsvc_C': 6.8499755883331554e-06, 'lsvc_max_iter': 2000}. Best is trial 43 with value: 0.92966.[0m
[32m[I 2022-10-20 05:01:58,887][0m Trial 54 finished with value: 0.8910084182843014 and parameters: {'lsvc_dual': False, 'lsvc_C': 5.966865371075866e-05, 'lsvc_max_iter': 2000}. Best is trial 43 with value: 0.92966.[0m
[32m[I 2022-10-20 05:02:14,907][0m Trial 55 finished with value: 0.8809333502697398 and parameters: {'lsvc_dual': False, 'lsvc_C': 0.00021932773796822685, 'lsvc_max_iter': 2000}. Best is trial 43 with value: 0.92966.[0m
[32m[I 2022-10-20 05:02:33,212][0m Trial 56 finished with value: 0.828069768594221 and parameters: {'lsvc_dual': False, 'lsvc_C': 9.215218689770502e-05, 'lsvc_max_iter': 2000}. Best is trial 43 with value: 0.92966.[0m
[32m[I 2022-10-20 05:02:48,643][0m Trial 57 finished with value: 0.8280124773947873 and parameters: {'lsvc_dual': False, 'lsvc_C': 7.372687119167255e-05, 'lsvc_max_iter': 2000}. Best is trial 43 with value: 0.92966.[0m
[32m[I 2022-10-20 05:03:03,867][0m Trial 58 finished with value: 0.90074840638658 and parameters: {'lsvc_dual': False, 'lsvc_C': 0.0002012540417898251, 'lsvc_max_iter': 2000}. Best is trial 43 with value: 0.92966.[0m
[32m[I 2022-10-20 05:03:20,639][0m Trial 59 finished with value: 0.8278904307647934 and parameters: {'lsvc_dual': False, 'lsvc_C': 0.9069122882855591, 'lsvc_max_iter': 2000}. Best is trial 43 with value: 0.92966.[0m
[32m[I 2022-10-20 05:03:37,741][0m Trial 60 finished with value: 0.8701330651860754 and parameters: {'lsvc_dual': False, 'lsvc_C': 0.019494207944058466, 'lsvc_max_iter': 2000}. Best is trial 43 with value: 0.92966.[0m
[32m[I 2022-10-20 05:03:55,778][0m Trial 61 finished with value: 0.8277579393099886 and parameters: {'lsvc_dual': False, 'lsvc_C': 0.00015856934771542498, 'lsvc_max_iter': 2000}. Best is trial 43 with value: 0.92966.[0m
[32m[I 2022-10-20 05:04:10,989][0m Trial 62 finished with value: 0.8279380994655269 and parameters: {'lsvc_dual': False, 'lsvc_C': 0.00015658598360564013, 'lsvc_max_iter': 2000}. Best is trial 43 with value: 0.92966.[0m
[32m[I 2022-10-20 05:04:26,620][0m Trial 63 finished with value: 0.8279244795908756 and parameters: {'lsvc_dual': False, 'lsvc_C': 0.0005399085273508648, 'lsvc_max_iter': 2000}. Best is trial 43 with value: 0.92966.[0m
[32m[I 2022-10-20 05:04:44,059][0m Trial 64 finished with value: 0.8278768115784373 and parameters: {'lsvc_dual': False, 'lsvc_C': 0.0008746411285442496, 'lsvc_max_iter': 2000}. Best is trial 43 with value: 0.92966.[0m
[32m[I 2022-10-20 05:05:00,514][0m Trial 65 finished with value: 0.8791779468794396 and parameters: {'lsvc_dual': False, 'lsvc_C': 0.00024438824397282236, 'lsvc_max_iter': 2000}. Best is trial 43 with value: 0.92966.[0m
[32m[I 2022-10-20 05:05:15,938][0m Trial 66 finished with value: 0.832171145591994 and parameters: {'lsvc_dual': False, 'lsvc_C': 0.0058157471349859465, 'lsvc_max_iter': 2000}. Best is trial 43 with value: 0.92966.[0m
[32m[I 2022-10-20 05:05:33,763][0m Trial 67 finished with value: 0.8277961306198247 and parameters: {'lsvc_dual': False, 'lsvc_C': 5.168231582054446e-05, 'lsvc_max_iter': 2000}. Best is trial 43 with value: 0.92966.[0m
[32m[I 2022-10-20 05:05:50,845][0m Trial 68 finished with value: 0.8787648448007815 and parameters: {'lsvc_dual': False, 'lsvc_C': 0.3788068838005718, 'lsvc_max_iter': 2000}. Best is trial 43 with value: 0.92966.[0m
[32m[I 2022-10-20 05:06:05,570][0m Trial 69 finished with value: 0.8304380859373628 and parameters: {'lsvc_dual': False, 'lsvc_C': 1.6395167453716934e-05, 'lsvc_max_iter': 2000}. Best is trial 43 with value: 0.92966.[0m
[32m[I 2022-10-20 05:06:19,441][0m Trial 70 finished with value: 0.8770327761565656 and parameters: {'lsvc_dual': False, 'lsvc_C': 0.03663268708809443, 'lsvc_max_iter': 2000}. Best is trial 43 with value: 0.92966.[0m
[32m[I 2022-10-20 05:06:38,236][0m Trial 71 finished with value: 0.827804597778906 and parameters: {'lsvc_dual': False, 'lsvc_C': 0.00018513185971010275, 'lsvc_max_iter': 2000}. Best is trial 43 with value: 0.92966.[0m
[32m[I 2022-10-20 05:06:55,237][0m Trial 72 finished with value: 0.8863214368786002 and parameters: {'lsvc_dual': False, 'lsvc_C': 0.002732739869796246, 'lsvc_max_iter': 2000}. Best is trial 43 with value: 0.92966.[0m
[32m[I 2022-10-20 05:07:09,451][0m Trial 73 finished with value: 0.8276761513774865 and parameters: {'lsvc_dual': False, 'lsvc_C': 0.11966577678454625, 'lsvc_max_iter': 2000}. Best is trial 43 with value: 0.92966.[0m
[32m[I 2022-10-20 05:07:24,349][0m Trial 74 finished with value: 0.8787663348468417 and parameters: {'lsvc_dual': False, 'lsvc_C': 0.0023968078579529165, 'lsvc_max_iter': 2000}. Best is trial 43 with value: 0.92966.[0m
[32m[I 2022-10-20 05:07:39,213][0m Trial 75 finished with value: 0.8741332608119063 and parameters: {'lsvc_dual': False, 'lsvc_C': 0.004335515844878868, 'lsvc_max_iter': 2000}. Best is trial 43 with value: 0.92966.[0m
[32m[I 2022-10-20 05:07:55,333][0m Trial 76 finished with value: 0.8276557291279428 and parameters: {'lsvc_dual': False, 'lsvc_C': 0.0003356252041140907, 'lsvc_max_iter': 2000}. Best is trial 43 with value: 0.92966.[0m
[32m[I 2022-10-20 05:08:15,379][0m Trial 77 finished with value: 0.8870144733234877 and parameters: {'lsvc_dual': False, 'lsvc_C': 0.0007833218326873288, 'lsvc_max_iter': 2000}. Best is trial 43 with value: 0.92966.[0m
[32m[I 2022-10-20 05:08:36,963][0m Trial 78 finished with value: 0.8279502575535633 and parameters: {'lsvc_dual': False, 'lsvc_C': 0.0005269620031576882, 'lsvc_max_iter': 2000}. Best is trial 43 with value: 0.92966.[0m
[32m[I 2022-10-20 05:08:53,946][0m Trial 79 finished with value: 0.8499947497620506 and parameters: {'lsvc_dual': False, 'lsvc_C': 4.6037705297884366e-05, 'lsvc_max_iter': 2000}. Best is trial 43 with value: 0.92966.[0m
[32m[I 2022-10-20 05:09:09,194][0m Trial 80 finished with value: 0.875609392731807 and parameters: {'lsvc_dual': False, 'lsvc_C': 0.0011681385867088447, 'lsvc_max_iter': 2000}. Best is trial 43 with value: 0.92966.[0m
[32m[I 2022-10-20 05:09:25,365][0m Trial 81 finished with value: 0.8698742583847843 and parameters: {'lsvc_dual': False, 'lsvc_C': 0.0001136618826478189, 'lsvc_max_iter': 2000}. Best is trial 43 with value: 0.92966.[0m
[32m[I 2022-10-20 05:09:43,145][0m Trial 82 finished with value: 0.8705564915006514 and parameters: {'lsvc_dual': False, 'lsvc_C': 14.182325972495669, 'lsvc_max_iter': 2000}. Best is trial 43 with value: 0.92966.[0m
