[32m[I 2022-10-20 05:55:49,071][0m Trial 65 finished with value: 0.9892989949350623 and parameters: {'lsvc_ac2s_kernel_sample_steps': 3, 'lsvc_ac2s_dual': False, 'lsvc_ac2s_C': 486.51932768888275, 'lsvc_ac2s_max_iter': 2000}. Best is trial 21 with value: 0.9902.[0m
[32m[I 2022-10-20 05:56:38,742][0m Trial 66 finished with value: 0.9898411243886054 and parameters: {'lsvc_ac2s_kernel_sample_steps': 3, 'lsvc_ac2s_dual': False, 'lsvc_ac2s_C': 18.55222729797347, 'lsvc_ac2s_max_iter': 2000}. Best is trial 21 with value: 0.9902.[0m
[32m[I 2022-10-20 05:57:27,024][0m Trial 67 finished with value: 0.9899622845348848 and parameters: {'lsvc_ac2s_kernel_sample_steps': 3, 'lsvc_ac2s_dual': False, 'lsvc_ac2s_C': 158.6205128963526, 'lsvc_ac2s_max_iter': 2000}. Best is trial 21 with value: 0.9902.[0m
[32m[I 2022-10-20 05:58:09,195][0m Trial 68 finished with value: 0.9889770796146126 and parameters: {'lsvc_ac2s_kernel_sample_steps': 3, 'lsvc_ac2s_dual': False, 'lsvc_ac2s_C': 1.7593442526209313, 'lsvc_ac2s_max_iter': 2000}. Best is trial 21 with value: 0.9902.[0m
[32m[I 2022-10-20 05:58:18,184][0m Trial 69 finished with value: 0.8682087838235538 and parameters: {'lsvc_ac2s_kernel_sample_steps': 1, 'lsvc_ac2s_dual': False, 'lsvc_ac2s_C': 36.36652279830029, 'lsvc_ac2s_max_iter': 2000}. Best is trial 21 with value: 0.9902.[0m
[32m[I 2022-10-20 05:58:39,593][0m Trial 70 finished with value: 0.989595366961975 and parameters: {'lsvc_ac2s_kernel_sample_steps': 2, 'lsvc_ac2s_dual': False, 'lsvc_ac2s_C': 5.139824131325777, 'lsvc_ac2s_max_iter': 2000}. Best is trial 21 with value: 0.9902.[0m
[32m[I 2022-10-20 05:59:21,787][0m Trial 71 finished with value: 0.9891974133153142 and parameters: {'lsvc_ac2s_kernel_sample_steps': 3, 'lsvc_ac2s_dual': False, 'lsvc_ac2s_C': 88.22718529872583, 'lsvc_ac2s_max_iter': 2000}. Best is trial 21 with value: 0.9902.[0m
[32m[I 2022-10-20 06:00:06,840][0m Trial 72 finished with value: 0.989158757403562 and parameters: {'lsvc_ac2s_kernel_sample_steps': 3, 'lsvc_ac2s_dual': False, 'lsvc_ac2s_C': 14.471358658521947, 'lsvc_ac2s_max_iter': 2000}. Best is trial 21 with value: 0.9902.[0m
[32m[I 2022-10-20 06:00:52,783][0m Trial 73 finished with value: 0.9890589503097186 and parameters: {'lsvc_ac2s_kernel_sample_steps': 3, 'lsvc_ac2s_dual': False, 'lsvc_ac2s_C': 297.7774251162302, 'lsvc_ac2s_max_iter': 2000}. Best is trial 21 with value: 0.9902.[0m
[32m[I 2022-10-20 06:01:32,859][0m Trial 74 finished with value: 0.9891836415284565 and parameters: {'lsvc_ac2s_kernel_sample_steps': 3, 'lsvc_ac2s_dual': False, 'lsvc_ac2s_C': 36.85478976479696, 'lsvc_ac2s_max_iter': 2000}. Best is trial 21 with value: 0.9902.[0m
[32m[I 2022-10-20 06:02:21,701][0m Trial 75 finished with value: 0.9899553107195187 and parameters: {'lsvc_ac2s_kernel_sample_steps': 3, 'lsvc_ac2s_dual': False, 'lsvc_ac2s_C': 0.45634415823467694, 'lsvc_ac2s_max_iter': 2000}. Best is trial 21 with value: 0.9902.[0m
[32m[I 2022-10-20 06:03:14,618][0m Trial 76 finished with value: 0.9900938679808331 and parameters: {'lsvc_ac2s_kernel_sample_steps': 3, 'lsvc_ac2s_dual': False, 'lsvc_ac2s_C': 525.9175186212193, 'lsvc_ac2s_max_iter': 2000}. Best is trial 21 with value: 0.9902.[0m
[32m[I 2022-10-20 06:03:56,244][0m Trial 77 finished with value: 0.988955674536569 and parameters: {'lsvc_ac2s_kernel_sample_steps': 3, 'lsvc_ac2s_dual': False, 'lsvc_ac2s_C': 531.3932228909787, 'lsvc_ac2s_max_iter': 2000}. Best is trial 21 with value: 0.9902.[0m
[32m[I 2022-10-20 06:04:39,105][0m Trial 78 finished with value: 0.9895662237555286 and parameters: {'lsvc_ac2s_kernel_sample_steps': 3, 'lsvc_ac2s_dual': False, 'lsvc_ac2s_C': 199.16529941599387, 'lsvc_ac2s_max_iter': 2000}. Best is trial 21 with value: 0.9902.[0m
[32m[I 2022-10-20 06:05:28,268][0m Trial 79 finished with value: 0.9899776721401141 and parameters: {'lsvc_ac2s_kernel_sample_steps': 3, 'lsvc_ac2s_dual': False, 'lsvc_ac2s_C': 85.12830514082579, 'lsvc_ac2s_max_iter': 2000}. Best is trial 21 with value: 0.9902.[0m
[32m[I 2022-10-20 06:05:49,782][0m Trial 80 finished with value: 0.9193514784164024 and parameters: {'lsvc_ac2s_kernel_sample_steps': 3, 'lsvc_ac2s_dual': False, 'lsvc_ac2s_C': 1.642924934687055e-06, 'lsvc_ac2s_max_iter': 2000}. Best is trial 21 with value: 0.9902.[0m
[32m[I 2022-10-20 06:06:35,813][0m Trial 81 finished with value: 0.9892126744578341 and parameters: {'lsvc_ac2s_kernel_sample_steps': 3, 'lsvc_ac2s_dual': False, 'lsvc_ac2s_C': 978.3987065296124, 'lsvc_ac2s_max_iter': 2000}. Best is trial 21 with value: 0.9902.[0m
[32m[I 2022-10-20 06:07:26,544][0m Trial 82 finished with value: 0.9899550492887633 and parameters: {'lsvc_ac2s_kernel_sample_steps': 3, 'lsvc_ac2s_dual': False, 'lsvc_ac2s_C': 397.3939055759884, 'lsvc_ac2s_max_iter': 2000}. Best is trial 21 with value: 0.9902.[0m
[32m[I 2022-10-20 06:08:19,544][0m Trial 83 finished with value: 0.9899176333719356 and parameters: {'lsvc_ac2s_kernel_sample_steps': 3, 'lsvc_ac2s_dual': False, 'lsvc_ac2s_C': 127.12442966632749, 'lsvc_ac2s_max_iter': 2000}. Best is trial 21 with value: 0.9902.[0m
[32m[I 2022-10-20 06:08:45,472][0m Trial 84 finished with value: 0.9833329726405221 and parameters: {'lsvc_ac2s_kernel_sample_steps': 3, 'lsvc_ac2s_dual': False, 'lsvc_ac2s_C': 1.7716001849044434e-05, 'lsvc_ac2s_max_iter': 2000}. Best is trial 21 with value: 0.9902.[0m
[32m[I 2022-10-20 06:08:54,867][0m Trial 85 finished with value: 0.8716803267329192 and parameters: {'lsvc_ac2s_kernel_sample_steps': 1, 'lsvc_ac2s_dual': False, 'lsvc_ac2s_C': 3.149215986413537, 'lsvc_ac2s_max_iter': 2000}. Best is trial 21 with value: 0.9902.[0m
[32m[I 2022-10-20 06:09:39,741][0m Trial 86 finished with value: 0.9890064943719107 and parameters: {'lsvc_ac2s_kernel_sample_steps': 3, 'lsvc_ac2s_dual': False, 'lsvc_ac2s_C': 51.887569497407746, 'lsvc_ac2s_max_iter': 2000}. Best is trial 21 with value: 0.9902.[0m
[32m[I 2022-10-20 06:10:17,083][0m Trial 87 finished with value: 0.989062269120894 and parameters: {'lsvc_ac2s_kernel_sample_steps': 3, 'lsvc_ac2s_dual': False, 'lsvc_ac2s_C': 20.81236714011793, 'lsvc_ac2s_max_iter': 2000}. Best is trial 21 with value: 0.9902.[0m
[32m[I 2022-10-20 06:10:39,833][0m Trial 88 finished with value: 0.9862042101919754 and parameters: {'lsvc_ac2s_kernel_sample_steps': 2, 'lsvc_ac2s_dual': False, 'lsvc_ac2s_C': 0.00016553916783523432, 'lsvc_ac2s_max_iter': 2000}. Best is trial 21 with value: 0.9902.[0m
[32m[I 2022-10-20 06:11:22,559][0m Trial 89 finished with value: 0.9890624799400577 and parameters: {'lsvc_ac2s_kernel_sample_steps': 3, 'lsvc_ac2s_dual': False, 'lsvc_ac2s_C': 0.0614581500235425, 'lsvc_ac2s_max_iter': 2000}. Best is trial 21 with value: 0.9902.[0m
[32m[I 2022-10-20 06:12:01,007][0m Trial 90 finished with value: 0.9892595769344964 and parameters: {'lsvc_ac2s_kernel_sample_steps': 3, 'lsvc_ac2s_dual': False, 'lsvc_ac2s_C': 562.4983322597834, 'lsvc_ac2s_max_iter': 2000}. Best is trial 21 with value: 0.9902.[0m
[32m[I 2022-10-20 06:12:50,856][0m Trial 91 finished with value: 0.9896332504953935 and parameters: {'lsvc_ac2s_kernel_sample_steps': 3, 'lsvc_ac2s_dual': False, 'lsvc_ac2s_C': 9.606724585200094, 'lsvc_ac2s_max_iter': 2000}. Best is trial 21 with value: 0.9902.[0m
[32m[I 2022-10-20 06:13:33,311][0m Trial 92 finished with value: 0.9899542256266931 and parameters: {'lsvc_ac2s_kernel_sample_steps': 3, 'lsvc_ac2s_dual': False, 'lsvc_ac2s_C': 5.005836686900672, 'lsvc_ac2s_max_iter': 2000}. Best is trial 21 with value: 0.9902.[0m
[32m[I 2022-10-20 06:14:20,218][0m Trial 93 finished with value: 0.9892431355726654 and parameters: {'lsvc_ac2s_kernel_sample_steps': 3, 'lsvc_ac2s_dual': False, 'lsvc_ac2s_C': 242.6377602045677, 'lsvc_ac2s_max_iter': 2000}. Best is trial 21 with value: 0.9902.[0m
[32m[I 2022-10-20 06:14:58,521][0m Trial 94 finished with value: 0.9892900225282619 and parameters: {'lsvc_ac2s_kernel_sample_steps': 3, 'lsvc_ac2s_dual': False, 'lsvc_ac2s_C': 24.624819750308653, 'lsvc_ac2s_max_iter': 2000}. Best is trial 21 with value: 0.9902.[0m
[32m[I 2022-10-20 06:15:48,497][0m Trial 95 finished with value: 0.9899855934136753 and parameters: {'lsvc_ac2s_kernel_sample_steps': 3, 'lsvc_ac2s_dual': False, 'lsvc_ac2s_C': 9.014050934606745, 'lsvc_ac2s_max_iter': 2000}. Best is trial 21 with value: 0.9902.[0m
[32m[I 2022-10-20 06:16:34,820][0m Trial 96 finished with value: 0.9890894544904085 and parameters: {'lsvc_ac2s_kernel_sample_steps': 3, 'lsvc_ac2s_dual': False, 'lsvc_ac2s_C': 82.37472815328117, 'lsvc_ac2s_max_iter': 2000}. Best is trial 21 with value: 0.9902.[0m
[32m[I 2022-10-20 06:17:15,289][0m Trial 97 finished with value: 0.9892198042506644 and parameters: {'lsvc_ac2s_kernel_sample_steps': 3, 'lsvc_ac2s_dual': False, 'lsvc_ac2s_C': 13.243287257172666, 'lsvc_ac2s_max_iter': 2000}. Best is trial 21 with value: 0.9902.[0m
[32m[I 2022-10-20 06:17:55,065][0m Trial 98 finished with value: 0.98901245075833 and parameters: {'lsvc_ac2s_kernel_sample_steps': 3, 'lsvc_ac2s_dual': False, 'lsvc_ac2s_C': 1.892148036105528, 'lsvc_ac2s_max_iter': 2000}. Best is trial 21 with value: 0.9902.[0m
[32m[I 2022-10-20 06:18:03,850][0m Trial 99 finished with value: 0.868140252187051 and parameters: {'lsvc_ac2s_kernel_sample_steps': 1, 'lsvc_ac2s_dual': False, 'lsvc_ac2s_C': 59.34127701165547, 'lsvc_ac2s_max_iter': 2000}. Best is trial 21 with value: 0.9902.[0m
[32m[I 2022-10-20 06:18:03,913][0m Study finished.[0m
[32m[I 2022-10-20 06:18:03,991][0m --------------------------------------------------------------------------------[0m
[32m[I 2022-10-20 06:18:03,991][0m --------------------           LinearSVC_Nystroem           --------------------[0m
[32m[I 2022-10-20 06:18:03,991][0m --------------------------------------------------------------------------------[0m
[32m[I 2022-10-20 06:18:04,022][0m A new study created in RDB with name: LinearSVC_Nystroem_b4f53b70[0m
[32m[I 2022-10-20 06:18:04,038][0m Study started.[0m
[32m[I 2022-10-20 06:18:06,171][0m Trial 0 finished with value: 0.2844441188051378 and parameters: {'lsvc_nystroem_kernel_gamma': 223.5460052492115, 'lsvc_nystroem_kernel_n_components': 50, 'lsvc_nystroem_dual': False, 'lsvc_nystroem_C': 40.885661472780804, 'lsvc_nystroem_max_iter': 2000}. Best is trial 0 with value: 0.284444.[0m
[32m[I 2022-10-20 06:18:15,403][0m Trial 1 finished with value: 0.2844441188051378 and parameters: {'lsvc_nystroem_kernel_gamma': 0.015451731052375873, 'lsvc_nystroem_kernel_n_components': 150, 'lsvc_nystroem_dual': False, 'lsvc_nystroem_C': 5.155525494230701e-06, 'lsvc_nystroem_max_iter': 2000}. Best is trial 0 with value: 0.284444.[0m
[32m[I 2022-10-20 06:18:19,021][0m Trial 2 finished with value: 0.2844441188051378 and parameters: {'lsvc_nystroem_kernel_gamma': 2.4333086152971912, 'lsvc_nystroem_kernel_n_components': 100, 'lsvc_nystroem_dual': False, 'lsvc_nystroem_C': 240.26806628990954, 'lsvc_nystroem_max_iter': 2000}. Best is trial 0 with value: 0.284444.[0m
[32m[I 2022-10-20 06:18:21,151][0m Trial 3 finished with value: 0.2844441188051378 and parameters: {'lsvc_nystroem_kernel_gamma': 2.3827505149612556, 'lsvc_nystroem_kernel_n_components': 50, 'lsvc_nystroem_dual': False, 'lsvc_nystroem_C': 0.0009960775381049557, 'lsvc_nystroem_max_iter': 2000}. Best is trial 0 with value: 0.284444.[0m
[32m[I 2022-10-20 06:18:34,645][0m Trial 4 finished with value: 0.2844441188051378 and parameters: {'lsvc_nystroem_kernel_gamma': 0.003857770109570754, 'lsvc_nystroem_kernel_n_components': 150, 'lsvc_nystroem_dual': False, 'lsvc_nystroem_C': 0.0001133896772660937, 'lsvc_nystroem_max_iter': 2000}. Best is trial 0 with value: 0.284444.[0m
[32m[I 2022-10-20 06:18:37,317][0m Trial 5 finished with value: 0.2867830258020076 and parameters: {'lsvc_nystroem_kernel_gamma': 0.07801822956812779, 'lsvc_nystroem_kernel_n_components': 50, 'lsvc_nystroem_dual': False, 'lsvc_nystroem_C': 777.3828393296634, 'lsvc_nystroem_max_iter': 2000}. Best is trial 5 with value: 0.286783.[0m
[32m[I 2022-10-20 06:18:39,815][0m Trial 6 finished with value: 0.2844441188051378 and parameters: {'lsvc_nystroem_kernel_gamma': 0.015132606277131465, 'lsvc_nystroem_kernel_n_components': 50, 'lsvc_nystroem_dual': False, 'lsvc_nystroem_C': 7.413280456301147e-06, 'lsvc_nystroem_max_iter': 2000}. Best is trial 5 with value: 0.286783.[0m
[32m[I 2022-10-20 06:18:44,565][0m Trial 7 finished with value: 0.2844441188051378 and parameters: {'lsvc_nystroem_kernel_gamma': 8.512846514526382, 'lsvc_nystroem_kernel_n_components': 150, 'lsvc_nystroem_dual': False, 'lsvc_nystroem_C': 0.034474699130510086, 'lsvc_nystroem_max_iter': 2000}. Best is trial 5 with value: 0.286783.[0m
[32m[I 2022-10-20 06:18:47,993][0m Trial 8 finished with value: 0.2844441188051378 and parameters: {'lsvc_nystroem_kernel_gamma': 182.05979714121625, 'lsvc_nystroem_kernel_n_components': 100, 'lsvc_nystroem_dual': False, 'lsvc_nystroem_C': 7.55844511871584e-05, 'lsvc_nystroem_max_iter': 2000}. Best is trial 5 with value: 0.286783.[0m
[32m[I 2022-10-20 06:18:51,587][0m Trial 9 finished with value: 0.2844441188051378 and parameters: {'lsvc_nystroem_kernel_gamma': 15.24664131767449, 'lsvc_nystroem_kernel_n_components': 100, 'lsvc_nystroem_dual': False, 'lsvc_nystroem_C': 26.504379578766983, 'lsvc_nystroem_max_iter': 2000}. Best is trial 5 with value: 0.286783.[0m
[32m[I 2022-10-20 06:18:53,905][0m Trial 10 finished with value: 0.2848958300363838 and parameters: {'lsvc_nystroem_kernel_gamma': 0.20585937085155795, 'lsvc_nystroem_kernel_n_components': 50, 'lsvc_nystroem_dual': False, 'lsvc_nystroem_C': 0.4421486819009431, 'lsvc_nystroem_max_iter': 2000}. Best is trial 5 with value: 0.286783.[0m
[32m[I 2022-10-20 06:18:56,449][0m Trial 11 finished with value: 0.28595042237648854 and parameters: {'lsvc_nystroem_kernel_gamma': 0.0760163992221361, 'lsvc_nystroem_kernel_n_components': 50, 'lsvc_nystroem_dual': False, 'lsvc_nystroem_C': 0.9476531677925668, 'lsvc_nystroem_max_iter': 2000}. Best is trial 5 with value: 0.286783.[0m
[32m[I 2022-10-20 06:18:58,944][0m Trial 12 finished with value: 0.28548058530770276 and parameters: {'lsvc_nystroem_kernel_gamma': 0.13224421906398492, 'lsvc_nystroem_kernel_n_components': 50, 'lsvc_nystroem_dual': False, 'lsvc_nystroem_C': 1.385065771901858, 'lsvc_nystroem_max_iter': 2000}. Best is trial 5 with value: 0.286783.[0m
[32m[I 2022-10-20 06:19:01,532][0m Trial 13 finished with value: 0.2857308758816064 and parameters: {'lsvc_nystroem_kernel_gamma': 0.14995895379409976, 'lsvc_nystroem_kernel_n_components': 50, 'lsvc_nystroem_dual': False, 'lsvc_nystroem_C': 495.6192133053344, 'lsvc_nystroem_max_iter': 2000}. Best is trial 5 with value: 0.286783.[0m
[32m[I 2022-10-20 06:19:46,404][0m Trial 14 finished with value: 0.35303331665359083 and parameters: {'lsvc_nystroem_kernel_gamma': 0.0016106267452340925, 'lsvc_nystroem_kernel_n_components': 100, 'lsvc_nystroem_dual': False, 'lsvc_nystroem_C': 3.450367194415161, 'lsvc_nystroem_max_iter': 2000}. Best is trial 14 with value: 0.353033.[0m
[32m[I 2022-10-20 06:20:42,269][0m Trial 15 finished with value: 0.35876495665019 and parameters: {'lsvc_nystroem_kernel_gamma': 0.001591311172282141, 'lsvc_nystroem_kernel_n_components': 100, 'lsvc_nystroem_dual': False, 'lsvc_nystroem_C': 10.757125417255981, 'lsvc_nystroem_max_iter': 2000}. Best is trial 15 with value: 0.358765.[0m
[32m[I 2022-10-20 06:21:09,167][0m Trial 16 finished with value: 0.3435198180783428 and parameters: {'lsvc_nystroem_kernel_gamma': 0.0010083680562800869, 'lsvc_nystroem_kernel_n_components': 100, 'lsvc_nystroem_dual': False, 'lsvc_nystroem_C': 0.040338741531172555, 'lsvc_nystroem_max_iter': 2000}. Best is trial 15 with value: 0.358765.[0m
[32m[I 2022-10-20 06:21:50,811][0m Trial 17 finished with value: 0.3513509517902124 and parameters: {'lsvc_nystroem_kernel_gamma': 0.0018330035802294592, 'lsvc_nystroem_kernel_n_components': 100, 'lsvc_nystroem_dual': False, 'lsvc_nystroem_C': 9.122487746606103, 'lsvc_nystroem_max_iter': 2000}. Best is trial 15 with value: 0.358765.[0m
[32m[I 2022-10-20 06:22:05,804][0m Trial 18 finished with value: 0.3025103501373401 and parameters: {'lsvc_nystroem_kernel_gamma': 0.00792779200845684, 'lsvc_nystroem_kernel_n_components': 100, 'lsvc_nystroem_dual': False, 'lsvc_nystroem_C': 0.1398422401671959, 'lsvc_nystroem_max_iter': 2000}. Best is trial 15 with value: 0.358765.[0m
[32m[I 2022-10-20 06:22:15,424][0m Trial 19 finished with value: 0.2844441188051378 and parameters: {'lsvc_nystroem_kernel_gamma': 0.029575924256110064, 'lsvc_nystroem_kernel_n_components': 150, 'lsvc_nystroem_dual': False, 'lsvc_nystroem_C': 0.0021263270700947953, 'lsvc_nystroem_max_iter': 2000}. Best is trial 15 with value: 0.358765.[0m
[32m[I 2022-10-20 06:22:50,341][0m Trial 20 finished with value: 0.32223637876321237 and parameters: {'lsvc_nystroem_kernel_gamma': 0.004121683912196996, 'lsvc_nystroem_kernel_n_components': 100, 'lsvc_nystroem_dual': False, 'lsvc_nystroem_C': 4.490197338281523, 'lsvc_nystroem_max_iter': 2000}. Best is trial 15 with value: 0.358765.[0m
[32m[I 2022-10-20 06:23:45,186][0m Trial 21 finished with value: 0.3690956523510288 and parameters: {'lsvc_nystroem_kernel_gamma': 0.001217263987742345, 'lsvc_nystroem_kernel_n_components': 100, 'lsvc_nystroem_dual': False, 'lsvc_nystroem_C': 10.027044062882979, 'lsvc_nystroem_max_iter': 2000}. Best is trial 21 with value: 0.369096.[0m
[32m[I 2022-10-20 06:25:04,324][0m Trial 22 finished with value: 0.37791677878543284 and parameters: {'lsvc_nystroem_kernel_gamma': 0.0011230450778001496, 'lsvc_nystroem_kernel_n_components': 100, 'lsvc_nystroem_dual': False, 'lsvc_nystroem_C': 37.814421841522396, 'lsvc_nystroem_max_iter': 2000}. Best is trial 22 with value: 0.377917.[0m
[32m[I 2022-10-20 06:27:37,278][0m Trial 23 finished with value: 0.3855989146463424 and parameters: {'lsvc_nystroem_kernel_gamma': 0.001000300948105242, 'lsvc_nystroem_kernel_n_components': 100, 'lsvc_nystroem_dual': False, 'lsvc_nystroem_C': 55.91527614895675, 'lsvc_nystroem_max_iter': 2000}. Best is trial 23 with value: 0.385599.[0m
[32m[I 2022-10-20 06:28:21,712][0m Trial 24 finished with value: 0.32611740948469375 and parameters: {'lsvc_nystroem_kernel_gamma': 0.0043126238794481495, 'lsvc_nystroem_kernel_n_components': 100, 'lsvc_nystroem_dual': False, 'lsvc_nystroem_C': 41.19488694826683, 'lsvc_nystroem_max_iter': 2000}. Best is trial 23 with value: 0.385599.[0m
[32m[I 2022-10-20 06:28:25,303][0m Trial 25 finished with value: 0.2844441188051378 and parameters: {'lsvc_nystroem_kernel_gamma': 869.0426710849572, 'lsvc_nystroem_kernel_n_components': 100, 'lsvc_nystroem_dual': False, 'lsvc_nystroem_C': 93.50327471905014, 'lsvc_nystroem_max_iter': 2000}. Best is trial 23 with value: 0.385599.[0m
[32m[I 2022-10-20 06:28:30,396][0m Trial 26 finished with value: 0.28539759330760345 and parameters: {'lsvc_nystroem_kernel_gamma': 0.5306048081301057, 'lsvc_nystroem_kernel_n_components': 150, 'lsvc_nystroem_dual': False, 'lsvc_nystroem_C': 213.27850216005993, 'lsvc_nystroem_max_iter': 2000}. Best is trial 23 with value: 0.385599.[0m
[32m[I 2022-10-20 06:28:34,569][0m Trial 27 finished with value: 0.2931058628927008 and parameters: {'lsvc_nystroem_kernel_gamma': 0.0240098716739837, 'lsvc_nystroem_kernel_n_components': 100, 'lsvc_nystroem_dual': False, 'lsvc_nystroem_C': 0.277646930110262, 'lsvc_nystroem_max_iter': 2000}. Best is trial 23 with value: 0.385599.[0m
[32m[I 2022-10-20 06:29:08,388][0m Trial 28 finished with value: 0.31847424229017607 and parameters: {'lsvc_nystroem_kernel_gamma': 0.00641266963341759, 'lsvc_nystroem_kernel_n_components': 100, 'lsvc_nystroem_dual': False, 'lsvc_nystroem_C': 115.04622747313692, 'lsvc_nystroem_max_iter': 2000}. Best is trial 23 with value: 0.385599.[0m
[32m[I 2022-10-20 06:30:33,859][0m Trial 29 finished with value: 0.38086575126780836 and parameters: {'lsvc_nystroem_kernel_gamma': 0.0010309762565811835, 'lsvc_nystroem_kernel_n_components': 100, 'lsvc_nystroem_dual': False, 'lsvc_nystroem_C': 28.38227651141551, 'lsvc_nystroem_max_iter': 2000}. Best is trial 23 with value: 0.385599.[0m
[32m[I 2022-10-20 06:30:49,709][0m Trial 30 finished with value: 0.2945549905410336 and parameters: {'lsvc_nystroem_kernel_gamma': 0.05048902968061827, 'lsvc_nystroem_kernel_n_components': 150, 'lsvc_nystroem_dual': False, 'lsvc_nystroem_C': 57.30071964919754, 'lsvc_nystroem_max_iter': 2000}. Best is trial 23 with value: 0.385599.[0m
[32m[I 2022-10-20 06:31:40,559][0m Trial 31 finished with value: 0.3424750155714359 and parameters: {'lsvc_nystroem_kernel_gamma': 0.002470504619946305, 'lsvc_nystroem_kernel_n_components': 100, 'lsvc_nystroem_dual': False, 'lsvc_nystroem_C': 17.12270814613985, 'lsvc_nystroem_max_iter': 2000}. Best is trial 23 with value: 0.385599.[0m
[32m[I 2022-10-20 06:32:30,490][0m Trial 32 finished with value: 0.36787851863413634 and parameters: {'lsvc_nystroem_kernel_gamma': 0.0010261841782246359, 'lsvc_nystroem_kernel_n_components': 100, 'lsvc_nystroem_dual': False, 'lsvc_nystroem_C': 2.0164335008321634, 'lsvc_nystroem_max_iter': 2000}. Best is trial 23 with value: 0.385599.[0m
[32m[I 2022-10-20 06:32:53,809][0m Trial 33 finished with value: 0.30240028410738773 and parameters: {'lsvc_nystroem_kernel_gamma': 0.01570956381726114, 'lsvc_nystroem_kernel_n_components': 100, 'lsvc_nystroem_dual': False, 'lsvc_nystroem_C': 607.1952906723438, 'lsvc_nystroem_max_iter': 2000}. Best is trial 23 with value: 0.385599.[0m
[32m[I 2022-10-20 06:33:23,440][0m Trial 34 finished with value: 0.30813313048802055 and parameters: {'lsvc_nystroem_kernel_gamma': 0.00986621551096882, 'lsvc_nystroem_kernel_n_components': 100, 'lsvc_nystroem_dual': False, 'lsvc_nystroem_C': 32.693781589282956, 'lsvc_nystroem_max_iter': 2000}. Best is trial 23 with value: 0.385599.[0m
