[32m[I 2022-10-20 03:38:48,174][0m Trial 59 finished with value: 0.9915367305870276 and parameters: {'dtc_criterion': 'entropy', 'dtc_splitter': 'best', 'dtc_min_samples_split': 26, 'dtc_min_samples_leaf': 47, 'dtc_max_features': 41}. Best is trial 19 with value: 0.991941.[0m
[32m[I 2022-10-20 03:38:48,174][0m Trial 60 finished with value: 0.991539463408599 and parameters: {'dtc_criterion': 'entropy', 'dtc_splitter': 'best', 'dtc_min_samples_split': 26, 'dtc_min_samples_leaf': 46, 'dtc_max_features': 41}. Best is trial 19 with value: 0.991941.[0m
[32m[I 2022-10-20 03:38:48,541][0m Trial 62 finished with value: 0.9915996854462653 and parameters: {'dtc_criterion': 'entropy', 'dtc_splitter': 'best', 'dtc_min_samples_split': 27, 'dtc_min_samples_leaf': 47, 'dtc_max_features': 40}. Best is trial 19 with value: 0.991941.[0m
[32m[I 2022-10-20 03:38:48,775][0m Trial 63 finished with value: 0.9916528281948948 and parameters: {'dtc_criterion': 'entropy', 'dtc_splitter': 'best', 'dtc_min_samples_split': 30, 'dtc_min_samples_leaf': 37, 'dtc_max_features': 40}. Best is trial 19 with value: 0.991941.[0m
[32m[I 2022-10-20 03:38:49,199][0m Trial 65 finished with value: 0.991709407276219 and parameters: {'dtc_criterion': 'entropy', 'dtc_splitter': 'best', 'dtc_min_samples_split': 28, 'dtc_min_samples_leaf': 27, 'dtc_max_features': 39}. Best is trial 19 with value: 0.991941.[0m
[32m[I 2022-10-20 03:38:49,199][0m Trial 64 finished with value: 0.9916528281948948 and parameters: {'dtc_criterion': 'entropy', 'dtc_splitter': 'best', 'dtc_min_samples_split': 26, 'dtc_min_samples_leaf': 37, 'dtc_max_features': 40}. Best is trial 19 with value: 0.991941.[0m
[32m[I 2022-10-20 03:38:49,199][0m Trial 66 finished with value: 0.991200912937322 and parameters: {'dtc_criterion': 'entropy', 'dtc_splitter': 'best', 'dtc_min_samples_split': 27, 'dtc_min_samples_leaf': 37, 'dtc_max_features': 12}. Best is trial 19 with value: 0.991941.[0m
[32m[I 2022-10-20 03:38:50,107][0m Trial 67 finished with value: 0.9914695250459984 and parameters: {'dtc_criterion': 'entropy', 'dtc_splitter': 'best', 'dtc_min_samples_split': 34, 'dtc_min_samples_leaf': 21, 'dtc_max_features': 44}. Best is trial 19 with value: 0.991941.[0m
[32m[I 2022-10-20 03:38:50,107][0m Trial 68 finished with value: 0.9917796874977607 and parameters: {'dtc_criterion': 'entropy', 'dtc_splitter': 'best', 'dtc_min_samples_split': 28, 'dtc_min_samples_leaf': 37, 'dtc_max_features': 43}. Best is trial 19 with value: 0.991941.[0m
[32m[I 2022-10-20 03:38:50,170][0m Trial 69 finished with value: 0.9918413993827667 and parameters: {'dtc_criterion': 'entropy', 'dtc_splitter': 'best', 'dtc_min_samples_split': 32, 'dtc_min_samples_leaf': 37, 'dtc_max_features': 44}. Best is trial 19 with value: 0.991941.[0m
[32m[I 2022-10-20 03:38:50,185][0m Trial 70 finished with value: 0.9918413993827667 and parameters: {'dtc_criterion': 'entropy', 'dtc_splitter': 'best', 'dtc_min_samples_split': 34, 'dtc_min_samples_leaf': 37, 'dtc_max_features': 44}. Best is trial 19 with value: 0.991941.[0m
[32m[I 2022-10-20 03:38:50,771][0m Trial 71 finished with value: 0.991807123088404 and parameters: {'dtc_criterion': 'entropy', 'dtc_splitter': 'best', 'dtc_min_samples_split': 32, 'dtc_min_samples_leaf': 27, 'dtc_max_features': 43}. Best is trial 19 with value: 0.991941.[0m
[32m[I 2022-10-20 03:38:51,178][0m Trial 73 finished with value: 0.9916928316801011 and parameters: {'dtc_criterion': 'entropy', 'dtc_splitter': 'best', 'dtc_min_samples_split': 32, 'dtc_min_samples_leaf': 30, 'dtc_max_features': 44}. Best is trial 19 with value: 0.991941.[0m
[32m[I 2022-10-20 03:38:51,178][0m Trial 74 finished with value: 0.9916928316801011 and parameters: {'dtc_criterion': 'entropy', 'dtc_splitter': 'best', 'dtc_min_samples_split': 33, 'dtc_min_samples_leaf': 30, 'dtc_max_features': 44}. Best is trial 19 with value: 0.991941.[0m
[32m[I 2022-10-20 03:38:51,178][0m Trial 72 finished with value: 0.9916124196611003 and parameters: {'dtc_criterion': 'entropy', 'dtc_splitter': 'best', 'dtc_min_samples_split': 33, 'dtc_min_samples_leaf': 40, 'dtc_max_features': 44}. Best is trial 19 with value: 0.991941.[0m
[32m[I 2022-10-20 03:38:52,024][0m Trial 76 finished with value: 0.9916004952731602 and parameters: {'dtc_criterion': 'entropy', 'dtc_splitter': 'best', 'dtc_min_samples_split': 32, 'dtc_min_samples_leaf': 39, 'dtc_max_features': 44}. Best is trial 19 with value: 0.991941.[0m
[32m[I 2022-10-20 03:38:52,337][0m Trial 78 finished with value: 0.9916423918112032 and parameters: {'dtc_criterion': 'entropy', 'dtc_splitter': 'best', 'dtc_min_samples_split': 37, 'dtc_min_samples_leaf': 40, 'dtc_max_features': 48}. Best is trial 19 with value: 0.991941.[0m
[32m[I 2022-10-20 03:38:52,682][0m Trial 77 finished with value: 0.991657938581949 and parameters: {'dtc_criterion': 'entropy', 'dtc_splitter': 'best', 'dtc_min_samples_split': 32, 'dtc_min_samples_leaf': 41, 'dtc_max_features': 48}. Best is trial 19 with value: 0.991941.[0m
[32m[I 2022-10-20 03:38:52,682][0m Trial 75 finished with value: 0.9916423918112032 and parameters: {'dtc_criterion': 'entropy', 'dtc_splitter': 'best', 'dtc_min_samples_split': 37, 'dtc_min_samples_leaf': 40, 'dtc_max_features': 48}. Best is trial 19 with value: 0.991941.[0m
[32m[I 2022-10-20 03:38:53,026][0m Trial 82 finished with value: 0.9917439897021496 and parameters: {'dtc_criterion': 'entropy', 'dtc_splitter': 'random', 'dtc_min_samples_split': 38, 'dtc_min_samples_leaf': 26, 'dtc_max_features': 49}. Best is trial 19 with value: 0.991941.[0m
[32m[I 2022-10-20 03:38:53,120][0m Trial 80 finished with value: 0.991529112214594 and parameters: {'dtc_criterion': 'entropy', 'dtc_splitter': 'random', 'dtc_min_samples_split': 37, 'dtc_min_samples_leaf': 26, 'dtc_max_features': 48}. Best is trial 19 with value: 0.991941.[0m
[32m[I 2022-10-20 03:38:53,183][0m Trial 81 finished with value: 0.9916042037590779 and parameters: {'dtc_criterion': 'entropy', 'dtc_splitter': 'random', 'dtc_min_samples_split': 38, 'dtc_min_samples_leaf': 12, 'dtc_max_features': 49}. Best is trial 19 with value: 0.991941.[0m
[32m[I 2022-10-20 03:38:53,246][0m Trial 79 finished with value: 0.9917044602908778 and parameters: {'dtc_criterion': 'entropy', 'dtc_splitter': 'best', 'dtc_min_samples_split': 37, 'dtc_min_samples_leaf': 31, 'dtc_max_features': 48}. Best is trial 19 with value: 0.991941.[0m
[32m[I 2022-10-20 03:38:53,746][0m Trial 83 finished with value: 0.9916982996985201 and parameters: {'dtc_criterion': 'entropy', 'dtc_splitter': 'random', 'dtc_min_samples_split': 38, 'dtc_min_samples_leaf': 19, 'dtc_max_features': 48}. Best is trial 19 with value: 0.991941.[0m
[32m[I 2022-10-20 03:38:53,981][0m Trial 84 finished with value: 0.991529112214594 and parameters: {'dtc_criterion': 'entropy', 'dtc_splitter': 'random', 'dtc_min_samples_split': 35, 'dtc_min_samples_leaf': 26, 'dtc_max_features': 48}. Best is trial 19 with value: 0.991941.[0m
[32m[I 2022-10-20 03:38:54,391][0m Trial 85 finished with value: 0.9917992261417459 and parameters: {'dtc_criterion': 'entropy', 'dtc_splitter': 'random', 'dtc_min_samples_split': 35, 'dtc_min_samples_leaf': 19, 'dtc_max_features': 50}. Best is trial 19 with value: 0.991941.[0m
[32m[I 2022-10-20 03:38:54,626][0m Trial 86 finished with value: 0.9915831945151167 and parameters: {'dtc_criterion': 'entropy', 'dtc_splitter': 'random', 'dtc_min_samples_split': 41, 'dtc_min_samples_leaf': 14, 'dtc_max_features': 49}. Best is trial 19 with value: 0.991941.[0m
[32m[I 2022-10-20 03:38:55,268][0m Trial 89 finished with value: 0.9916858178895376 and parameters: {'dtc_criterion': 'entropy', 'dtc_splitter': 'best', 'dtc_min_samples_split': 34, 'dtc_min_samples_leaf': 5, 'dtc_max_features': 42}. Best is trial 19 with value: 0.991941.[0m
[32m[I 2022-10-20 03:38:55,268][0m Trial 88 finished with value: 0.9917416266708367 and parameters: {'dtc_criterion': 'entropy', 'dtc_splitter': 'best', 'dtc_min_samples_split': 35, 'dtc_min_samples_leaf': 33, 'dtc_max_features': 42}. Best is trial 19 with value: 0.991941.[0m
[32m[I 2022-10-20 03:38:55,268][0m Trial 90 finished with value: 0.9917416266708367 and parameters: {'dtc_criterion': 'entropy', 'dtc_splitter': 'best', 'dtc_min_samples_split': 35, 'dtc_min_samples_leaf': 33, 'dtc_max_features': 42}. Best is trial 19 with value: 0.991941.[0m
[32m[I 2022-10-20 03:38:55,472][0m Trial 87 finished with value: 0.9916887242576914 and parameters: {'dtc_criterion': 'entropy', 'dtc_splitter': 'best', 'dtc_min_samples_split': 41, 'dtc_min_samples_leaf': 33, 'dtc_max_features': 43}. Best is trial 19 with value: 0.991941.[0m
[32m[I 2022-10-20 03:38:55,832][0m Trial 91 finished with value: 0.9917416266708367 and parameters: {'dtc_criterion': 'entropy', 'dtc_splitter': 'best', 'dtc_min_samples_split': 35, 'dtc_min_samples_leaf': 33, 'dtc_max_features': 42}. Best is trial 19 with value: 0.991941.[0m
[32m[I 2022-10-20 03:38:56,131][0m Trial 92 finished with value: 0.9917416266708367 and parameters: {'dtc_criterion': 'entropy', 'dtc_splitter': 'best', 'dtc_min_samples_split': 35, 'dtc_min_samples_leaf': 33, 'dtc_max_features': 42}. Best is trial 19 with value: 0.991941.[0m
[32m[I 2022-10-20 03:38:56,131][0m Trial 93 finished with value: 0.9917293917163534 and parameters: {'dtc_criterion': 'entropy', 'dtc_splitter': 'random', 'dtc_min_samples_split': 35, 'dtc_min_samples_leaf': 22, 'dtc_max_features': 42}. Best is trial 19 with value: 0.991941.[0m
[32m[I 2022-10-20 03:38:56,334][0m Trial 94 finished with value: 0.9916916907271441 and parameters: {'dtc_criterion': 'entropy', 'dtc_splitter': 'random', 'dtc_min_samples_split': 35, 'dtc_min_samples_leaf': 22, 'dtc_max_features': 38}. Best is trial 19 with value: 0.991941.[0m
[32m[I 2022-10-20 03:38:57,094][0m Trial 95 finished with value: 0.991550579018259 and parameters: {'dtc_criterion': 'entropy', 'dtc_splitter': 'best', 'dtc_min_samples_split': 29, 'dtc_min_samples_leaf': 22, 'dtc_max_features': 50}. Best is trial 19 with value: 0.991941.[0m
[32m[I 2022-10-20 03:38:57,094][0m Trial 96 finished with value: 0.9915102273503591 and parameters: {'dtc_criterion': 'entropy', 'dtc_splitter': 'best', 'dtc_min_samples_split': 29, 'dtc_min_samples_leaf': 22, 'dtc_max_features': 45}. Best is trial 19 with value: 0.991941.[0m
[32m[I 2022-10-20 03:38:57,329][0m Trial 98 finished with value: 0.9919405295424999 and parameters: {'dtc_criterion': 'entropy', 'dtc_splitter': 'best', 'dtc_min_samples_split': 29, 'dtc_min_samples_leaf': 38, 'dtc_max_features': 50}. Best is trial 19 with value: 0.991941.[0m
[32m[I 2022-10-20 03:38:57,344][0m Trial 97 finished with value: 0.9919405295424999 and parameters: {'dtc_criterion': 'entropy', 'dtc_splitter': 'best', 'dtc_min_samples_split': 29, 'dtc_min_samples_leaf': 38, 'dtc_max_features': 50}. Best is trial 19 with value: 0.991941.[0m
[32m[I 2022-10-20 03:38:57,532][0m Trial 99 finished with value: 0.9919405295424999 and parameters: {'dtc_criterion': 'entropy', 'dtc_splitter': 'best', 'dtc_min_samples_split': 29, 'dtc_min_samples_leaf': 38, 'dtc_max_features': 50}. Best is trial 19 with value: 0.991941.[0m
[32m[I 2022-10-20 03:38:57,594][0m Study finished.[0m
[32m[I 2022-10-20 03:38:57,673][0m --------------------------------------------------------------------------------[0m
[32m[I 2022-10-20 03:38:57,673][0m --------------------          ExtraTreeClassifier           --------------------[0m
[32m[I 2022-10-20 03:38:57,673][0m --------------------------------------------------------------------------------[0m
[32m[I 2022-10-20 03:38:57,704][0m A new study created in RDB with name: ExtraTreeClassifier_b4f53b70[0m
[32m[I 2022-10-20 03:38:57,719][0m Study started.[0m
[32m[I 2022-10-20 03:38:58,853][0m Trial 0 finished with value: 0.9653544905128155 and parameters: {'etc_criterion': 'gini', 'etc_min_samples_split': 13, 'etc_min_samples_leaf': 36, 'etc_max_features': 6}. Best is trial 0 with value: 0.965355.[0m
[32m[I 2022-10-20 03:38:59,089][0m Trial 6 finished with value: 0.9637138283181084 and parameters: {'etc_criterion': 'entropy', 'etc_min_samples_split': 40, 'etc_min_samples_leaf': 19, 'etc_max_features': 17}. Best is trial 0 with value: 0.965355.[0m
[32m[I 2022-10-20 03:38:59,294][0m Trial 7 finished with value: 0.9587261018567388 and parameters: {'etc_criterion': 'entropy', 'etc_min_samples_split': 23, 'etc_min_samples_leaf': 7, 'etc_max_features': 20}. Best is trial 0 with value: 0.965355.[0m
[32m[I 2022-10-20 03:38:59,591][0m Trial 3 finished with value: 0.9916388510061966 and parameters: {'etc_criterion': 'entropy', 'etc_min_samples_split': 28, 'etc_min_samples_leaf': 17, 'etc_max_features': 41}. Best is trial 3 with value: 0.991639.[0m
[32m[I 2022-10-20 03:38:59,591][0m Trial 4 finished with value: 0.9891725362533427 and parameters: {'etc_criterion': 'gini', 'etc_min_samples_split': 3, 'etc_min_samples_leaf': 33, 'etc_max_features': 31}. Best is trial 3 with value: 0.991639.[0m
[32m[I 2022-10-20 03:38:59,732][0m Trial 2 finished with value: 0.9915539676751839 and parameters: {'etc_criterion': 'entropy', 'etc_min_samples_split': 42, 'etc_min_samples_leaf': 24, 'etc_max_features': 42}. Best is trial 3 with value: 0.991639.[0m
[32m[I 2022-10-20 03:38:59,811][0m Trial 5 finished with value: 0.9914901248845343 and parameters: {'etc_criterion': 'gini', 'etc_min_samples_split': 3, 'etc_min_samples_leaf': 13, 'etc_max_features': 50}. Best is trial 3 with value: 0.991639.[0m
[32m[I 2022-10-20 03:38:59,811][0m Trial 1 finished with value: 0.9912562877532748 and parameters: {'etc_criterion': 'gini', 'etc_min_samples_split': 39, 'etc_min_samples_leaf': 50, 'etc_max_features': 42}. Best is trial 3 with value: 0.991639.[0m
[32m[I 2022-10-20 03:39:00,409][0m Trial 8 finished with value: 0.9915790642270819 and parameters: {'etc_criterion': 'entropy', 'etc_min_samples_split': 39, 'etc_min_samples_leaf': 44, 'etc_max_features': 27}. Best is trial 3 with value: 0.991639.[0m
[32m[I 2022-10-20 03:39:00,692][0m Trial 9 finished with value: 0.9673432170220742 and parameters: {'etc_criterion': 'gini', 'etc_min_samples_split': 18, 'etc_min_samples_leaf': 35, 'etc_max_features': 25}. Best is trial 3 with value: 0.991639.[0m
[32m[I 2022-10-20 03:39:01,084][0m Trial 14 finished with value: 0.6755150739149134 and parameters: {'etc_criterion': 'gini', 'etc_min_samples_split': 24, 'etc_min_samples_leaf': 40, 'etc_max_features': 7}. Best is trial 3 with value: 0.991639.[0m
[32m[I 2022-10-20 03:39:01,225][0m Trial 12 finished with value: 0.8614149682392633 and parameters: {'etc_criterion': 'entropy', 'etc_min_samples_split': 33, 'etc_min_samples_leaf': 22, 'etc_max_features': 8}. Best is trial 3 with value: 0.991639.[0m
[32m[I 2022-10-20 03:39:01,334][0m Trial 10 finished with value: 0.991449543667184 and parameters: {'etc_criterion': 'entropy', 'etc_min_samples_split': 30, 'etc_min_samples_leaf': 32, 'etc_max_features': 35}. Best is trial 3 with value: 0.991639.[0m
[32m[I 2022-10-20 03:39:01,538][0m Trial 11 finished with value: 0.9910485409603427 and parameters: {'etc_criterion': 'gini', 'etc_min_samples_split': 39, 'etc_min_samples_leaf': 9, 'etc_max_features': 14}. Best is trial 3 with value: 0.991639.[0m
[32m[I 2022-10-20 03:39:01,773][0m Trial 15 finished with value: 0.9901365471015421 and parameters: {'etc_criterion': 'gini', 'etc_min_samples_split': 48, 'etc_min_samples_leaf': 49, 'etc_max_features': 32}. Best is trial 3 with value: 0.991639.[0m
[32m[I 2022-10-20 03:39:01,851][0m Trial 13 finished with value: 0.9693813482989669 and parameters: {'etc_criterion': 'entropy', 'etc_min_samples_split': 17, 'etc_min_samples_leaf': 40, 'etc_max_features': 41}. Best is trial 3 with value: 0.991639.[0m
[32m[I 2022-10-20 03:39:02,070][0m Trial 16 finished with value: 0.94045206709978 and parameters: {'etc_criterion': 'entropy', 'etc_min_samples_split': 18, 'etc_min_samples_leaf': 50, 'etc_max_features': 10}. Best is trial 3 with value: 0.991639.[0m
[32m[I 2022-10-20 03:39:02,430][0m Trial 17 finished with value: 0.9915926593793267 and parameters: {'etc_criterion': 'entropy', 'etc_min_samples_split': 31, 'etc_min_samples_leaf': 4, 'etc_max_features': 37}. Best is trial 3 with value: 0.991639.[0m
[32m[I 2022-10-20 03:39:02,853][0m Trial 18 finished with value: 0.9914823454014957 and parameters: {'etc_criterion': 'entropy', 'etc_min_samples_split': 50, 'etc_min_samples_leaf': 4, 'etc_max_features': 35}. Best is trial 19 with value: 0.991719.[0m
[32m[I 2022-10-20 03:39:02,853][0m Trial 19 finished with value: 0.9917185882620446 and parameters: {'etc_criterion': 'entropy', 'etc_min_samples_split': 34, 'etc_min_samples_leaf': 1, 'etc_max_features': 36}. Best is trial 19 with value: 0.991719.[0m
[32m[I 2022-10-20 03:39:03,103][0m Trial 20 finished with value: 0.9918391204306405 and parameters: {'etc_criterion': 'entropy', 'etc_min_samples_split': 50, 'etc_min_samples_leaf': 2, 'etc_max_features': 35}. Best is trial 20 with value: 0.991839.[0m
[32m[I 2022-10-20 03:39:03,448][0m Trial 21 finished with value: 0.9917166334329002 and parameters: {'etc_criterion': 'entropy', 'etc_min_samples_split': 32, 'etc_min_samples_leaf': 16, 'etc_max_features': 50}. Best is trial 20 with value: 0.991839.[0m
[32m[I 2022-10-20 03:39:03,542][0m Trial 22 finished with value: 0.9916657494460824 and parameters: {'etc_criterion': 'entropy', 'etc_min_samples_split': 50, 'etc_min_samples_leaf': 1, 'etc_max_features': 24}. Best is trial 20 with value: 0.991839.[0m
[32m[I 2022-10-20 03:39:03,918][0m Trial 24 finished with value: 0.9917044461862072 and parameters: {'etc_criterion': 'entropy', 'etc_min_samples_split': 32, 'etc_min_samples_leaf': 3, 'etc_max_features': 50}. Best is trial 20 with value: 0.991839.[0m
[32m[I 2022-10-20 03:39:03,918][0m Trial 23 finished with value: 0.9917268240871849 and parameters: {'etc_criterion': 'entropy', 'etc_min_samples_split': 50, 'etc_min_samples_leaf': 16, 'etc_max_features': 50}. Best is trial 20 with value: 0.991839.[0m
[32m[I 2022-10-20 03:39:04,231][0m Trial 25 finished with value: 0.991515117117551 and parameters: {'etc_criterion': 'entropy', 'etc_min_samples_split': 31, 'etc_min_samples_leaf': 2, 'etc_max_features': 50}. Best is trial 20 with value: 0.991839.[0m
[32m[I 2022-10-20 03:39:04,716][0m Trial 27 finished with value: 0.991879829723298 and parameters: {'etc_criterion': 'entropy', 'etc_min_samples_split': 28, 'etc_min_samples_leaf': 16, 'etc_max_features': 46}. Best is trial 26 with value: 0.992029.[0m
[32m[I 2022-10-20 03:39:04,716][0m Trial 26 finished with value: 0.9920290088350593 and parameters: {'etc_criterion': 'entropy', 'etc_min_samples_split': 27, 'etc_min_samples_leaf': 15, 'etc_max_features': 50}. Best is trial 26 with value: 0.992029.[0m
[32m[I 2022-10-20 03:39:04,857][0m Trial 28 finished with value: 0.9916704857232956 and parameters: {'etc_criterion': 'entropy', 'etc_min_samples_split': 45, 'etc_min_samples_leaf': 15, 'etc_max_features': 49}. Best is trial 26 with value: 0.992029.[0m
[32m[I 2022-10-20 03:39:05,233][0m Trial 32 finished with value: 0.2844441188051378 and parameters: {'etc_criterion': 'entropy', 'etc_min_samples_split': 45, 'etc_min_samples_leaf': 12, 'etc_max_features': 1}. Best is trial 26 with value: 0.992029.[0m
[32m[I 2022-10-20 03:39:05,311][0m Trial 29 finished with value: 0.9916899605651253 and parameters: {'etc_criterion': 'entropy', 'etc_min_samples_split': 35, 'etc_min_samples_leaf': 12, 'etc_max_features': 49}. Best is trial 26 with value: 0.992029.[0m
[32m[I 2022-10-20 03:39:05,311][0m Trial 30 finished with value: 0.9916038455001644 and parameters: {'etc_criterion': 'entropy', 'etc_min_samples_split': 35, 'etc_min_samples_leaf': 13, 'etc_max_features': 49}. Best is trial 26 with value: 0.992029.[0m
[32m[I 2022-10-20 03:39:05,688][0m Trial 31 finished with value: 0.9916583656681077 and parameters: {'etc_criterion': 'entropy', 'etc_min_samples_split': 45, 'etc_min_samples_leaf': 11, 'etc_max_features': 46}. Best is trial 26 with value: 0.992029.[0m
[32m[I 2022-10-20 03:39:06,001][0m Trial 33 finished with value: 0.9914524745262662 and parameters: {'etc_criterion': 'entropy', 'etc_min_samples_split': 45, 'etc_min_samples_leaf': 10, 'etc_max_features': 45}. Best is trial 26 with value: 0.992029.[0m
[32m[I 2022-10-20 03:39:06,221][0m Trial 36 finished with value: 0.2844441188051378 and parameters: {'etc_criterion': 'entropy', 'etc_min_samples_split': 13, 'etc_min_samples_leaf': 10, 'etc_max_features': 1}. Best is trial 26 with value: 0.992029.[0m
[32m[I 2022-10-20 03:39:06,300][0m Trial 35 finished with value: 0.2844441188051378 and parameters: {'etc_criterion': 'entropy', 'etc_min_samples_split': 13, 'etc_min_samples_leaf': 11, 'etc_max_features': 1}. Best is trial 26 with value: 0.992029.[0m
[32m[I 2022-10-20 03:39:06,583][0m Trial 34 finished with value: 0.9916937702704957 and parameters: {'etc_criterion': 'entropy', 'etc_min_samples_split': 22, 'etc_min_samples_leaf': 10, 'etc_max_features': 45}. Best is trial 26 with value: 0.992029.[0m
[32m[I 2022-10-20 03:39:07,099][0m Trial 37 finished with value: 0.9913945106456004 and parameters: {'etc_criterion': 'entropy', 'etc_min_samples_split': 9, 'etc_min_samples_leaf': 28, 'etc_max_features': 45}. Best is trial 26 with value: 0.992029.[0m
[32m[I 2022-10-20 03:39:07,209][0m Trial 38 finished with value: 0.9916129636966662 and parameters: {'etc_criterion': 'entropy', 'etc_min_samples_split': 9, 'etc_min_samples_leaf': 20, 'etc_max_features': 45}. Best is trial 26 with value: 0.992029.[0m
[32m[I 2022-10-20 03:39:07,209][0m Trial 39 finished with value: 0.9914323177279784 and parameters: {'etc_criterion': 'entropy', 'etc_min_samples_split': 7, 'etc_min_samples_leaf': 29, 'etc_max_features': 45}. Best is trial 26 with value: 0.992029.[0m
