[32m[I 2022-10-26 21:42:05,146][0m Trial 48 finished with value: 0.7979305445405835 and parameters: {'pac_C': 9.791552619502855, 'pac_early_stopping': True, 'pac_validation_fraction': 0.25, 'pac_n_iter_no_change': 10}. Best is trial 0 with value: 0.797931.[0m
[32m[I 2022-10-26 21:42:06,616][0m Trial 49 finished with value: 0.7979305445405835 and parameters: {'pac_C': 4.147696995048312, 'pac_early_stopping': True, 'pac_validation_fraction': 0.25, 'pac_n_iter_no_change': 10}. Best is trial 0 with value: 0.797931.[0m
[32m[I 2022-10-26 21:42:08,398][0m Trial 50 finished with value: 0.7979305445405835 and parameters: {'pac_C': 5.4336129073595485, 'pac_early_stopping': True, 'pac_validation_fraction': 0.25, 'pac_n_iter_no_change': 10}. Best is trial 0 with value: 0.797931.[0m
[32m[I 2022-10-26 21:42:09,738][0m Trial 51 finished with value: 0.7979305445405835 and parameters: {'pac_C': 6.183246752235696, 'pac_early_stopping': True, 'pac_validation_fraction': 0.25, 'pac_n_iter_no_change': 10}. Best is trial 0 with value: 0.797931.[0m
[32m[I 2022-10-26 21:42:11,852][0m Trial 52 finished with value: 0.7979305445405835 and parameters: {'pac_C': 5.562428795460249, 'pac_early_stopping': True, 'pac_validation_fraction': 0.25, 'pac_n_iter_no_change': 10}. Best is trial 0 with value: 0.797931.[0m
[32m[I 2022-10-26 21:42:14,883][0m Trial 53 finished with value: 0.7979305445405835 and parameters: {'pac_C': 33.59873431598147, 'pac_early_stopping': True, 'pac_validation_fraction': 0.25, 'pac_n_iter_no_change': 10}. Best is trial 0 with value: 0.797931.[0m
[32m[I 2022-10-26 21:42:17,249][0m Trial 55 finished with value: 0.7979305445405835 and parameters: {'pac_C': 48.340300591946885, 'pac_early_stopping': True, 'pac_validation_fraction': 0.25, 'pac_n_iter_no_change': 10}. Best is trial 0 with value: 0.797931.[0m
[32m[I 2022-10-26 21:42:17,982][0m Trial 54 finished with value: 0.7979305445405835 and parameters: {'pac_C': 35.68648364732947, 'pac_early_stopping': True, 'pac_validation_fraction': 0.25, 'pac_n_iter_no_change': 10}. Best is trial 0 with value: 0.797931.[0m
[32m[I 2022-10-26 21:42:40,682][0m Trial 56 finished with value: 0.7979305445405835 and parameters: {'pac_C': 27.356828938642803, 'pac_early_stopping': True, 'pac_validation_fraction': 0.25, 'pac_n_iter_no_change': 10}. Best is trial 0 with value: 0.797931.[0m
[32m[I 2022-10-26 21:42:42,420][0m Trial 57 finished with value: 0.7979305445405835 and parameters: {'pac_C': 28.100854525429494, 'pac_early_stopping': True, 'pac_validation_fraction': 0.25, 'pac_n_iter_no_change': 10}. Best is trial 0 with value: 0.797931.[0m
[32m[I 2022-10-26 21:42:44,151][0m Trial 58 finished with value: 0.7979305445405835 and parameters: {'pac_C': 961.0946108458277, 'pac_early_stopping': True, 'pac_validation_fraction': 0.25, 'pac_n_iter_no_change': 10}. Best is trial 0 with value: 0.797931.[0m
[32m[I 2022-10-26 21:42:45,706][0m Trial 59 finished with value: 0.7979305445405835 and parameters: {'pac_C': 545.6018361315822, 'pac_early_stopping': True, 'pac_validation_fraction': 0.25, 'pac_n_iter_no_change': 10}. Best is trial 0 with value: 0.797931.[0m
[32m[I 2022-10-26 21:42:47,408][0m Trial 60 finished with value: 0.7979305445405835 and parameters: {'pac_C': 0.010035418862763764, 'pac_early_stopping': True, 'pac_validation_fraction': 0.25, 'pac_n_iter_no_change': 10}. Best is trial 0 with value: 0.797931.[0m
[32m[I 2022-10-26 21:42:50,503][0m Trial 61 finished with value: 0.7979305445405835 and parameters: {'pac_C': 0.009903494661498582, 'pac_early_stopping': True, 'pac_validation_fraction': 0.25, 'pac_n_iter_no_change': 10}. Best is trial 0 with value: 0.797931.[0m
[32m[I 2022-10-26 21:42:52,617][0m Trial 62 finished with value: 0.7979305445405835 and parameters: {'pac_C': 0.4240100743896572, 'pac_early_stopping': True, 'pac_validation_fraction': 0.25, 'pac_n_iter_no_change': 10}. Best is trial 0 with value: 0.797931.[0m
[32m[I 2022-10-26 21:42:54,033][0m Trial 63 finished with value: 0.7979305445405835 and parameters: {'pac_C': 0.3930173148100098, 'pac_early_stopping': True, 'pac_validation_fraction': 0.25, 'pac_n_iter_no_change': 10}. Best is trial 0 with value: 0.797931.[0m
[32m[I 2022-10-26 21:43:16,340][0m Trial 64 finished with value: 0.7979305445405835 and parameters: {'pac_C': 0.3712373004778899, 'pac_early_stopping': True, 'pac_validation_fraction': 0.25, 'pac_n_iter_no_change': 10}. Best is trial 0 with value: 0.797931.[0m
[32m[I 2022-10-26 21:43:18,085][0m Trial 65 finished with value: 0.7979305445405835 and parameters: {'pac_C': 0.012716538183551626, 'pac_early_stopping': True, 'pac_validation_fraction': 0.25, 'pac_n_iter_no_change': 10}. Best is trial 0 with value: 0.797931.[0m
[32m[I 2022-10-26 21:43:19,822][0m Trial 66 finished with value: 0.7979305445405835 and parameters: {'pac_C': 0.4698203542799775, 'pac_early_stopping': True, 'pac_validation_fraction': 0.25, 'pac_n_iter_no_change': 10}. Best is trial 0 with value: 0.797931.[0m
[32m[I 2022-10-26 21:43:21,563][0m Trial 67 finished with value: 0.7979305445405835 and parameters: {'pac_C': 0.316811606631286, 'pac_early_stopping': True, 'pac_validation_fraction': 0.25, 'pac_n_iter_no_change': 10}. Best is trial 0 with value: 0.797931.[0m
[32m[I 2022-10-26 21:43:23,124][0m Trial 68 finished with value: 0.7979305445405835 and parameters: {'pac_C': 0.21193902519016647, 'pac_early_stopping': True, 'pac_validation_fraction': 0.25, 'pac_n_iter_no_change': 10}. Best is trial 0 with value: 0.797931.[0m
[32m[I 2022-10-26 21:43:26,225][0m Trial 69 finished with value: 0.7979305445405835 and parameters: {'pac_C': 0.22100615648519772, 'pac_early_stopping': True, 'pac_validation_fraction': 0.25, 'pac_n_iter_no_change': 10}. Best is trial 0 with value: 0.797931.[0m
[32m[I 2022-10-26 21:43:29,202][0m Trial 70 finished with value: 0.7979305445405835 and parameters: {'pac_C': 0.29864406181216585, 'pac_early_stopping': True, 'pac_validation_fraction': 0.25, 'pac_n_iter_no_change': 10}. Best is trial 0 with value: 0.797931.[0m
[32m[I 2022-10-26 21:43:29,978][0m Trial 71 finished with value: 0.7979305445405835 and parameters: {'pac_C': 0.17298502888150263, 'pac_early_stopping': True, 'pac_validation_fraction': 0.25, 'pac_n_iter_no_change': 10}. Best is trial 0 with value: 0.797931.[0m
[32m[I 2022-10-26 21:43:51,901][0m Trial 72 finished with value: 0.7979305445405835 and parameters: {'pac_C': 0.023058676422298512, 'pac_early_stopping': True, 'pac_validation_fraction': 0.25, 'pac_n_iter_no_change': 10}. Best is trial 0 with value: 0.797931.[0m
[32m[I 2022-10-26 21:43:53,655][0m Trial 73 finished with value: 0.7979305445405835 and parameters: {'pac_C': 98.51506900147484, 'pac_early_stopping': True, 'pac_validation_fraction': 0.25, 'pac_n_iter_no_change': 10}. Best is trial 0 with value: 0.797931.[0m
[32m[I 2022-10-26 21:43:55,672][0m Trial 74 finished with value: 0.7979305445405835 and parameters: {'pac_C': 165.26117720013488, 'pac_early_stopping': True, 'pac_validation_fraction': 0.25, 'pac_n_iter_no_change': 10}. Best is trial 0 with value: 0.797931.[0m
[32m[I 2022-10-26 21:43:57,745][0m Trial 75 finished with value: 0.7979305445405835 and parameters: {'pac_C': 79.96226425310469, 'pac_early_stopping': True, 'pac_validation_fraction': 0.25, 'pac_n_iter_no_change': 10}. Best is trial 0 with value: 0.797931.[0m
[32m[I 2022-10-26 21:43:58,804][0m Trial 76 finished with value: 0.7979305445405835 and parameters: {'pac_C': 96.13428615629094, 'pac_early_stopping': True, 'pac_validation_fraction': 0.25, 'pac_n_iter_no_change': 10}. Best is trial 0 with value: 0.797931.[0m
[32m[I 2022-10-26 21:44:01,834][0m Trial 77 finished with value: 0.7979305445405835 and parameters: {'pac_C': 97.47377234679612, 'pac_early_stopping': True, 'pac_validation_fraction': 0.25, 'pac_n_iter_no_change': 10}. Best is trial 0 with value: 0.797931.[0m
[32m[I 2022-10-26 21:44:05,512][0m Trial 78 finished with value: 0.7979305445405835 and parameters: {'pac_C': 1.1176623407617303, 'pac_early_stopping': True, 'pac_validation_fraction': 0.25, 'pac_n_iter_no_change': 10}. Best is trial 0 with value: 0.797931.[0m
[32m[I 2022-10-26 21:44:06,273][0m Trial 79 finished with value: 0.7979305445405835 and parameters: {'pac_C': 6.377868367495305, 'pac_early_stopping': True, 'pac_validation_fraction': 0.25, 'pac_n_iter_no_change': 10}. Best is trial 0 with value: 0.797931.[0m
[32m[I 2022-10-26 21:44:28,297][0m Trial 80 finished with value: 0.7979305445405835 and parameters: {'pac_C': 6.59940641604178, 'pac_early_stopping': True, 'pac_validation_fraction': 0.25, 'pac_n_iter_no_change': 10}. Best is trial 0 with value: 0.797931.[0m
[32m[I 2022-10-26 21:44:30,832][0m Trial 81 finished with value: 0.7979305445405835 and parameters: {'pac_C': 7.390901382342523, 'pac_early_stopping': True, 'pac_validation_fraction': 0.25, 'pac_n_iter_no_change': 10}. Best is trial 0 with value: 0.797931.[0m
[32m[I 2022-10-26 21:44:33,013][0m Trial 82 finished with value: 0.7979305445405835 and parameters: {'pac_C': 7.167023166426496, 'pac_early_stopping': True, 'pac_validation_fraction': 0.25, 'pac_n_iter_no_change': 10}. Best is trial 0 with value: 0.797931.[0m
[32m[I 2022-10-26 21:44:35,126][0m Trial 83 finished with value: 0.7979305445405835 and parameters: {'pac_C': 1.2886844422675978, 'pac_early_stopping': True, 'pac_validation_fraction': 0.25, 'pac_n_iter_no_change': 10}. Best is trial 0 with value: 0.797931.[0m
[32m[I 2022-10-26 21:44:36,804][0m Trial 84 finished with value: 0.7979305445405835 and parameters: {'pac_C': 7.811690032277069, 'pac_early_stopping': True, 'pac_validation_fraction': 0.25, 'pac_n_iter_no_change': 10}. Best is trial 0 with value: 0.797931.[0m
[32m[I 2022-10-26 21:44:39,824][0m Trial 85 finished with value: 0.7979305445405835 and parameters: {'pac_C': 47.74965455466519, 'pac_early_stopping': True, 'pac_validation_fraction': 0.25, 'pac_n_iter_no_change': 10}. Best is trial 0 with value: 0.797931.[0m
[32m[I 2022-10-26 21:44:44,609][0m Trial 86 finished with value: 0.7979305445405835 and parameters: {'pac_C': 46.12761705046377, 'pac_early_stopping': True, 'pac_validation_fraction': 0.25, 'pac_n_iter_no_change': 10}. Best is trial 0 with value: 0.797931.[0m
[32m[I 2022-10-26 21:44:45,709][0m Trial 87 finished with value: 0.7979305445405835 and parameters: {'pac_C': 42.155656575771026, 'pac_early_stopping': True, 'pac_validation_fraction': 0.25, 'pac_n_iter_no_change': 10}. Best is trial 0 with value: 0.797931.[0m
[32m[I 2022-10-26 21:45:09,690][0m Trial 88 finished with value: 0.7979305445405835 and parameters: {'pac_C': 307.8634685261542, 'pac_early_stopping': True, 'pac_validation_fraction': 0.25, 'pac_n_iter_no_change': 10}. Best is trial 0 with value: 0.797931.[0m
[32m[I 2022-10-26 21:45:13,884][0m Trial 90 finished with value: 0.7979305445405835 and parameters: {'pac_C': 38.8141583779264, 'pac_early_stopping': True, 'pac_validation_fraction': 0.25, 'pac_n_iter_no_change': 10}. Best is trial 0 with value: 0.797931.[0m
[32m[I 2022-10-26 21:45:15,601][0m Trial 89 finished with value: 0.7979305445405835 and parameters: {'pac_C': 44.30091670381638, 'pac_early_stopping': True, 'pac_validation_fraction': 0.25, 'pac_n_iter_no_change': 10}. Best is trial 0 with value: 0.797931.[0m
[32m[I 2022-10-26 21:45:15,783][0m Trial 91 finished with value: 0.7979305445405835 and parameters: {'pac_C': 374.4280856796553, 'pac_early_stopping': True, 'pac_validation_fraction': 0.25, 'pac_n_iter_no_change': 10}. Best is trial 0 with value: 0.797931.[0m
[32m[I 2022-10-26 21:45:18,756][0m Trial 92 finished with value: 0.7979305445405835 and parameters: {'pac_C': 41.04366941852545, 'pac_early_stopping': True, 'pac_validation_fraction': 0.25, 'pac_n_iter_no_change': 10}. Best is trial 0 with value: 0.797931.[0m
[32m[I 2022-10-26 21:45:21,173][0m Trial 93 finished with value: 0.7979305445405835 and parameters: {'pac_C': 372.68427293629486, 'pac_early_stopping': True, 'pac_validation_fraction': 0.25, 'pac_n_iter_no_change': 10}. Best is trial 0 with value: 0.797931.[0m
[32m[I 2022-10-26 21:45:25,003][0m Trial 94 finished with value: 0.7979305445405835 and parameters: {'pac_C': 462.2170392850663, 'pac_early_stopping': True, 'pac_validation_fraction': 0.25, 'pac_n_iter_no_change': 10}. Best is trial 0 with value: 0.797931.[0m
[32m[I 2022-10-26 21:45:27,009][0m Trial 95 finished with value: 0.7979305445405835 and parameters: {'pac_C': 269.5932934805297, 'pac_early_stopping': True, 'pac_validation_fraction': 0.25, 'pac_n_iter_no_change': 10}. Best is trial 0 with value: 0.797931.[0m
[32m[I 2022-10-26 21:45:43,948][0m Trial 96 finished with value: 0.7979305445405835 and parameters: {'pac_C': 398.1327640027433, 'pac_early_stopping': True, 'pac_validation_fraction': 0.25, 'pac_n_iter_no_change': 10}. Best is trial 0 with value: 0.797931.[0m
[32m[I 2022-10-26 21:45:46,894][0m Trial 97 finished with value: 0.7979305445405835 and parameters: {'pac_C': 475.0215190056163, 'pac_early_stopping': True, 'pac_validation_fraction': 0.25, 'pac_n_iter_no_change': 10}. Best is trial 0 with value: 0.797931.[0m
[32m[I 2022-10-26 21:45:47,758][0m Trial 99 finished with value: 0.7979305445405835 and parameters: {'pac_C': 0.007172084153579251, 'pac_early_stopping': True, 'pac_validation_fraction': 0.25, 'pac_n_iter_no_change': 10}. Best is trial 0 with value: 0.797931.[0m
[32m[I 2022-10-26 21:45:48,087][0m Trial 98 finished with value: 0.7979305445405835 and parameters: {'pac_C': 0.007613531205137894, 'pac_early_stopping': True, 'pac_validation_fraction': 0.25, 'pac_n_iter_no_change': 10}. Best is trial 0 with value: 0.797931.[0m
[32m[I 2022-10-26 21:45:48,167][0m Study finished.[0m
[32m[I 2022-10-26 21:45:48,182][0m --------------------------------------------------------------------------------[0m
[32m[I 2022-10-26 21:45:48,183][0m --------------------               Perceptron               --------------------[0m
[32m[I 2022-10-26 21:45:48,183][0m --------------------------------------------------------------------------------[0m
[32m[I 2022-10-26 21:45:48,220][0m A new study created in RDB with name: Perceptron_c963b74b[0m
[32m[I 2022-10-26 21:45:48,227][0m Study started.[0m
[32m[I 2022-10-26 21:46:31,097][0m Trial 3 finished with value: 0.6950742018218817 and parameters: {'p_penalty': 'elasticnet', 'p_alpha': 0.39511339983830795, 'p_eta0': 2.0, 'p_early_stopping': True, 'p_validation_fraction': 0.25, 'p_n_iter_no_change': 10}. Best is trial 3 with value: 0.695074.[0m
[32m[I 2022-10-26 21:46:34,638][0m Trial 7 finished with value: 0.14712574922022667 and parameters: {'p_penalty': 'elasticnet', 'p_alpha': 4.51860365679217e-05, 'p_eta0': 1.5, 'p_early_stopping': True, 'p_validation_fraction': 0.25, 'p_n_iter_no_change': 10}. Best is trial 3 with value: 0.695074.[0m
[32m[I 2022-10-26 21:46:35,669][0m Trial 1 finished with value: 0.3949428603367736 and parameters: {'p_penalty': 'elasticnet', 'p_alpha': 8.739336410872637e-05, 'p_eta0': 1.5, 'p_early_stopping': True, 'p_validation_fraction': 0.25, 'p_n_iter_no_change': 10}. Best is trial 3 with value: 0.695074.[0m
[32m[I 2022-10-26 21:46:36,493][0m Trial 2 finished with value: 0.7477760659984629 and parameters: {'p_penalty': 'elasticnet', 'p_alpha': 3.094836059484848e-06, 'p_eta0': 2.0, 'p_early_stopping': True, 'p_validation_fraction': 0.25, 'p_n_iter_no_change': 10}. Best is trial 2 with value: 0.747776.[0m
[32m[I 2022-10-26 21:46:37,384][0m Trial 4 finished with value: 0.695084761408555 and parameters: {'p_penalty': 'elasticnet', 'p_alpha': 0.23255642923248634, 'p_eta0': 1.0, 'p_early_stopping': True, 'p_validation_fraction': 0.25, 'p_n_iter_no_change': 10}. Best is trial 2 with value: 0.747776.[0m
[32m[I 2022-10-26 21:46:38,529][0m Trial 6 finished with value: 0.7150246414665192 and parameters: {'p_penalty': 'elasticnet', 'p_alpha': 0.009831184178241808, 'p_eta0': 1.5, 'p_early_stopping': True, 'p_validation_fraction': 0.25, 'p_n_iter_no_change': 10}. Best is trial 2 with value: 0.747776.[0m
[32m[I 2022-10-26 21:46:40,325][0m Trial 5 finished with value: 0.4844250377515535 and parameters: {'p_penalty': 'elasticnet', 'p_alpha': 0.002090915130688883, 'p_eta0': 1.0, 'p_early_stopping': True, 'p_validation_fraction': 0.25, 'p_n_iter_no_change': 10}. Best is trial 2 with value: 0.747776.[0m
[32m[I 2022-10-26 21:46:43,543][0m Trial 0 finished with value: 0.7106486348385253 and parameters: {'p_penalty': 'elasticnet', 'p_alpha': 1.6439138389090411e-06, 'p_eta0': 1.0, 'p_early_stopping': True, 'p_validation_fraction': 0.25, 'p_n_iter_no_change': 10}. Best is trial 2 with value: 0.747776.[0m
[32m[I 2022-10-26 21:47:17,984][0m Trial 8 finished with value: 0.14539932520067836 and parameters: {'p_penalty': 'elasticnet', 'p_alpha': 9.206614525734024e-06, 'p_eta0': 0.5, 'p_early_stopping': True, 'p_validation_fraction': 0.25, 'p_n_iter_no_change': 10}. Best is trial 2 with value: 0.747776.[0m
[32m[I 2022-10-26 21:47:19,928][0m Trial 11 finished with value: 0.6950742018218817 and parameters: {'p_penalty': 'elasticnet', 'p_alpha': 0.5082346812607013, 'p_eta0': 1.5, 'p_early_stopping': True, 'p_validation_fraction': 0.25, 'p_n_iter_no_change': 10}. Best is trial 2 with value: 0.747776.[0m
[32m[I 2022-10-26 21:47:21,766][0m Trial 9 finished with value: 0.6425131442003414 and parameters: {'p_penalty': 'elasticnet', 'p_alpha': 2.623473103737498e-06, 'p_eta0': 0.5, 'p_early_stopping': True, 'p_validation_fraction': 0.25, 'p_n_iter_no_change': 10}. Best is trial 2 with value: 0.747776.[0m
[32m[I 2022-10-26 21:47:25,928][0m Trial 10 finished with value: 0.4085835896097203 and parameters: {'p_penalty': 'elasticnet', 'p_alpha': 2.1480168191523992e-05, 'p_eta0': 0.5, 'p_early_stopping': True, 'p_validation_fraction': 0.25, 'p_n_iter_no_change': 10}. Best is trial 2 with value: 0.747776.[0m
[32m[I 2022-10-26 21:47:27,410][0m Trial 13 finished with value: 0.7050801492908397 and parameters: {'p_penalty': 'elasticnet', 'p_alpha': 4.676980581288145e-05, 'p_eta0': 0.5, 'p_early_stopping': True, 'p_validation_fraction': 0.25, 'p_n_iter_no_change': 10}. Best is trial 2 with value: 0.747776.[0m
[32m[I 2022-10-26 21:47:30,268][0m Trial 12 finished with value: 0.7221657137657721 and parameters: {'p_penalty': 'elasticnet', 'p_alpha': 1.037077541116231e-06, 'p_eta0': 0.5, 'p_early_stopping': True, 'p_validation_fraction': 0.25, 'p_n_iter_no_change': 10}. Best is trial 2 with value: 0.747776.[0m
[32m[I 2022-10-26 21:47:32,367][0m Trial 14 finished with value: 0.14095123916073968 and parameters: {'p_penalty': 'elasticnet', 'p_alpha': 2.6033088713196338e-05, 'p_eta0': 2.0, 'p_early_stopping': True, 'p_validation_fraction': 0.25, 'p_n_iter_no_change': 10}. Best is trial 2 with value: 0.747776.[0m
[32m[I 2022-10-26 21:47:40,855][0m Trial 15 finished with value: 0.14513573731314075 and parameters: {'p_penalty': 'elasticnet', 'p_alpha': 7.233050827441203e-05, 'p_eta0': 1.5, 'p_early_stopping': True, 'p_validation_fraction': 0.25, 'p_n_iter_no_change': 10}. Best is trial 2 with value: 0.747776.[0m
[32m[I 2022-10-26 21:48:01,642][0m Trial 16 finished with value: 0.09562841070684094 and parameters: {'p_penalty': 'elasticnet', 'p_alpha': 0.01598114082973594, 'p_eta0': 1.0, 'p_early_stopping': True, 'p_validation_fraction': 0.25, 'p_n_iter_no_change': 10}. Best is trial 2 with value: 0.747776.[0m
[32m[I 2022-10-26 21:48:03,861][0m Trial 17 finished with value: 0.39296314366651136 and parameters: {'p_penalty': 'elasticnet', 'p_alpha': 0.0002997051243475679, 'p_eta0': 2.0, 'p_early_stopping': True, 'p_validation_fraction': 0.25, 'p_n_iter_no_change': 10}. Best is trial 2 with value: 0.747776.[0m
[32m[I 2022-10-26 21:48:04,809][0m Trial 18 finished with value: 0.35951227962384436 and parameters: {'p_penalty': 'elasticnet', 'p_alpha': 0.006007725615288913, 'p_eta0': 2.0, 'p_early_stopping': True, 'p_validation_fraction': 0.25, 'p_n_iter_no_change': 10}. Best is trial 2 with value: 0.747776.[0m
[32m[I 2022-10-26 21:48:13,366][0m Trial 19 finished with value: 0.6951424817790826 and parameters: {'p_penalty': 'elasticnet', 'p_alpha': 0.009730695750959138, 'p_eta0': 2.0, 'p_early_stopping': True, 'p_validation_fraction': 0.25, 'p_n_iter_no_change': 10}. Best is trial 2 with value: 0.747776.[0m
[32m[I 2022-10-26 21:48:16,701][0m Trial 20 finished with value: 0.3600480054369308 and parameters: {'p_penalty': 'elasticnet', 'p_alpha': 0.009938597326406283, 'p_eta0': 2.0, 'p_early_stopping': True, 'p_validation_fraction': 0.25, 'p_n_iter_no_change': 10}. Best is trial 2 with value: 0.747776.[0m
[32m[I 2022-10-26 21:48:18,701][0m Trial 21 finished with value: 0.1429489900828187 and parameters: {'p_penalty': 'elasticnet', 'p_alpha': 1.1642219815945661e-06, 'p_eta0': 2.0, 'p_early_stopping': True, 'p_validation_fraction': 0.25, 'p_n_iter_no_change': 10}. Best is trial 2 with value: 0.747776.[0m
[32m[I 2022-10-26 21:48:24,219][0m Trial 22 finished with value: 0.7409251684024502 and parameters: {'p_penalty': 'elasticnet', 'p_alpha': 1.094361353023038e-06, 'p_eta0': 2.0, 'p_early_stopping': True, 'p_validation_fraction': 0.25, 'p_n_iter_no_change': 10}. Best is trial 2 with value: 0.747776.[0m
[32m[I 2022-10-26 21:48:25,400][0m Trial 23 finished with value: 0.14338956760100707 and parameters: {'p_penalty': 'elasticnet', 'p_alpha': 1.0174695262906767e-06, 'p_eta0': 2.0, 'p_early_stopping': True, 'p_validation_fraction': 0.25, 'p_n_iter_no_change': 10}. Best is trial 2 with value: 0.747776.[0m
[32m[I 2022-10-26 21:48:46,294][0m Trial 24 finished with value: 0.7022141397442451 and parameters: {'p_penalty': 'elasticnet', 'p_alpha': 0.00031157907567229664, 'p_eta0': 2.0, 'p_early_stopping': True, 'p_validation_fraction': 0.25, 'p_n_iter_no_change': 10}. Best is trial 2 with value: 0.747776.[0m
