[32m[I 2022-10-27 00:45:37,790][0m Trial 47 finished with value: 0.08383563734770995 and parameters: {'vfdrc_ordered_rules': False, 'vfdrc_grace_period': 100, 'vfdrc_tie_threshold': 0.65, 'vfdrc_rule_prediction': 'weighted_max', 'vfdrc_max_rules': 30, 'vfdrc_expand_criterion': 'hellinger', 'vfdrc_remove_poor_atts': True}. Best is trial 20 with value: 0.69251.[0m
[32m[I 2022-10-27 00:46:55,728][0m Trial 45 finished with value: 0.08383563734770995 and parameters: {'vfdrc_ordered_rules': False, 'vfdrc_grace_period': 100, 'vfdrc_tie_threshold': 0.65, 'vfdrc_rule_prediction': 'weighted_max', 'vfdrc_max_rules': 30, 'vfdrc_expand_criterion': 'hellinger', 'vfdrc_remove_poor_atts': True}. Best is trial 20 with value: 0.69251.[0m
[32m[I 2022-10-27 00:48:17,963][0m Trial 44 finished with value: 0.08383563734770995 and parameters: {'vfdrc_ordered_rules': False, 'vfdrc_grace_period': 100, 'vfdrc_tie_threshold': 0.65, 'vfdrc_rule_prediction': 'weighted_max', 'vfdrc_max_rules': 30, 'vfdrc_expand_criterion': 'hellinger', 'vfdrc_remove_poor_atts': True}. Best is trial 20 with value: 0.69251.[0m
[32m[I 2022-10-27 00:48:57,696][0m Trial 46 finished with value: 0.08383563734770995 and parameters: {'vfdrc_ordered_rules': False, 'vfdrc_grace_period': 100, 'vfdrc_tie_threshold': 0.65, 'vfdrc_rule_prediction': 'weighted_max', 'vfdrc_max_rules': 30, 'vfdrc_expand_criterion': 'hellinger', 'vfdrc_remove_poor_atts': True}. Best is trial 20 with value: 0.69251.[0m
[32m[I 2022-10-27 00:53:19,657][0m Trial 48 finished with value: 0.42846110574368973 and parameters: {'vfdrc_ordered_rules': False, 'vfdrc_grace_period': 100, 'vfdrc_tie_threshold': 0.65, 'vfdrc_rule_prediction': 'weighted_max', 'vfdrc_max_rules': 30, 'vfdrc_expand_criterion': 'info_gain', 'vfdrc_remove_poor_atts': True}. Best is trial 20 with value: 0.69251.[0m
[32m[I 2022-10-27 00:53:32,273][0m Trial 50 finished with value: 0.7084859387426848 and parameters: {'vfdrc_ordered_rules': True, 'vfdrc_grace_period': 250, 'vfdrc_tie_threshold': 0.35000000000000003, 'vfdrc_rule_prediction': 'weighted_sum', 'vfdrc_max_rules': 35, 'vfdrc_expand_criterion': 'info_gain', 'vfdrc_remove_poor_atts': True}. Best is trial 50 with value: 0.708486.[0m
[32m[I 2022-10-27 00:53:37,574][0m Trial 49 finished with value: 0.7039995832728059 and parameters: {'vfdrc_ordered_rules': True, 'vfdrc_grace_period': 250, 'vfdrc_tie_threshold': 0.65, 'vfdrc_rule_prediction': 'weighted_max', 'vfdrc_max_rules': 35, 'vfdrc_expand_criterion': 'info_gain', 'vfdrc_remove_poor_atts': True}. Best is trial 50 with value: 0.708486.[0m
[32m[I 2022-10-27 00:53:43,878][0m Trial 51 finished with value: 0.7084859387426848 and parameters: {'vfdrc_ordered_rules': True, 'vfdrc_grace_period': 250, 'vfdrc_tie_threshold': 0.35000000000000003, 'vfdrc_rule_prediction': 'weighted_sum', 'vfdrc_max_rules': 35, 'vfdrc_expand_criterion': 'info_gain', 'vfdrc_remove_poor_atts': True}. Best is trial 50 with value: 0.708486.[0m
[32m[I 2022-10-27 00:58:28,927][0m Trial 52 finished with value: 0.43656343425298083 and parameters: {'vfdrc_ordered_rules': True, 'vfdrc_grace_period': 250, 'vfdrc_tie_threshold': 0.35000000000000003, 'vfdrc_rule_prediction': 'weighted_sum', 'vfdrc_max_rules': 20, 'vfdrc_expand_criterion': 'info_gain', 'vfdrc_remove_poor_atts': True}. Best is trial 50 with value: 0.708486.[0m
[32m[I 2022-10-27 00:58:41,708][0m Trial 53 finished with value: 0.7084859387426848 and parameters: {'vfdrc_ordered_rules': True, 'vfdrc_grace_period': 250, 'vfdrc_tie_threshold': 0.35000000000000003, 'vfdrc_rule_prediction': 'weighted_sum', 'vfdrc_max_rules': 35, 'vfdrc_expand_criterion': 'info_gain', 'vfdrc_remove_poor_atts': True}. Best is trial 50 with value: 0.708486.[0m
[32m[I 2022-10-27 00:59:23,635][0m Trial 55 finished with value: 0.7084859387426848 and parameters: {'vfdrc_ordered_rules': True, 'vfdrc_grace_period': 250, 'vfdrc_tie_threshold': 0.35000000000000003, 'vfdrc_rule_prediction': 'weighted_sum', 'vfdrc_max_rules': 35, 'vfdrc_expand_criterion': 'info_gain', 'vfdrc_remove_poor_atts': False}. Best is trial 50 with value: 0.708486.[0m
[32m[I 2022-10-27 00:59:30,399][0m Trial 54 finished with value: 0.6256609573513404 and parameters: {'vfdrc_ordered_rules': True, 'vfdrc_grace_period': 250, 'vfdrc_tie_threshold': 0.45, 'vfdrc_rule_prediction': 'weighted_sum', 'vfdrc_max_rules': 35, 'vfdrc_expand_criterion': 'info_gain', 'vfdrc_remove_poor_atts': False}. Best is trial 50 with value: 0.708486.[0m
[32m[I 2022-10-27 01:03:23,807][0m Trial 59 finished with value: 0.7816816308749098 and parameters: {'vfdrc_ordered_rules': True, 'vfdrc_grace_period': 250, 'vfdrc_tie_threshold': 0.30000000000000004, 'vfdrc_rule_prediction': 'weighted_sum', 'vfdrc_max_rules': 35, 'vfdrc_expand_criterion': 'info_gain', 'vfdrc_remove_poor_atts': False}. Best is trial 59 with value: 0.781682.[0m
[32m[I 2022-10-27 01:03:23,809][0m Trial 56 finished with value: 0.7084859387426848 and parameters: {'vfdrc_ordered_rules': True, 'vfdrc_grace_period': 250, 'vfdrc_tie_threshold': 0.35000000000000003, 'vfdrc_rule_prediction': 'weighted_sum', 'vfdrc_max_rules': 35, 'vfdrc_expand_criterion': 'info_gain', 'vfdrc_remove_poor_atts': False}. Best is trial 59 with value: 0.781682.[0m
[32m[I 2022-10-27 01:03:42,524][0m Trial 57 finished with value: 0.7084859387426848 and parameters: {'vfdrc_ordered_rules': True, 'vfdrc_grace_period': 250, 'vfdrc_tie_threshold': 0.35000000000000003, 'vfdrc_rule_prediction': 'weighted_sum', 'vfdrc_max_rules': 35, 'vfdrc_expand_criterion': 'info_gain', 'vfdrc_remove_poor_atts': False}. Best is trial 59 with value: 0.781682.[0m
[32m[I 2022-10-27 01:03:53,868][0m Trial 58 finished with value: 0.7039995832728059 and parameters: {'vfdrc_ordered_rules': True, 'vfdrc_grace_period': 250, 'vfdrc_tie_threshold': 0.8500000000000001, 'vfdrc_rule_prediction': 'weighted_sum', 'vfdrc_max_rules': 35, 'vfdrc_expand_criterion': 'info_gain', 'vfdrc_remove_poor_atts': False}. Best is trial 59 with value: 0.781682.[0m
[32m[I 2022-10-27 01:07:08,113][0m Trial 61 finished with value: 0.8437388156882051 and parameters: {'vfdrc_ordered_rules': True, 'vfdrc_grace_period': 400, 'vfdrc_tie_threshold': 0.2, 'vfdrc_rule_prediction': 'weighted_sum', 'vfdrc_max_rules': 35, 'vfdrc_expand_criterion': 'info_gain', 'vfdrc_remove_poor_atts': False}. Best is trial 61 with value: 0.843739.[0m
[32m[I 2022-10-27 01:08:25,339][0m Trial 60 finished with value: 0.8197545669003756 and parameters: {'vfdrc_ordered_rules': True, 'vfdrc_grace_period': 250, 'vfdrc_tie_threshold': 0.15000000000000002, 'vfdrc_rule_prediction': 'weighted_sum', 'vfdrc_max_rules': 35, 'vfdrc_expand_criterion': 'info_gain', 'vfdrc_remove_poor_atts': False}. Best is trial 61 with value: 0.843739.[0m
[32m[I 2022-10-27 01:09:01,801][0m Trial 63 finished with value: 0.8197545669003756 and parameters: {'vfdrc_ordered_rules': True, 'vfdrc_grace_period': 250, 'vfdrc_tie_threshold': 0.15000000000000002, 'vfdrc_rule_prediction': 'first_hit', 'vfdrc_max_rules': 35, 'vfdrc_expand_criterion': 'info_gain', 'vfdrc_remove_poor_atts': False}. Best is trial 61 with value: 0.843739.[0m
[32m[I 2022-10-27 01:10:50,667][0m Trial 62 finished with value: 0.7816816308749098 and parameters: {'vfdrc_ordered_rules': True, 'vfdrc_grace_period': 250, 'vfdrc_tie_threshold': 0.30000000000000004, 'vfdrc_rule_prediction': 'first_hit', 'vfdrc_max_rules': 35, 'vfdrc_expand_criterion': 'info_gain', 'vfdrc_remove_poor_atts': False}. Best is trial 61 with value: 0.843739.[0m
[32m[I 2022-10-27 01:14:04,027][0m Trial 64 finished with value: 0.7933337181985132 and parameters: {'vfdrc_ordered_rules': True, 'vfdrc_grace_period': 250, 'vfdrc_tie_threshold': 0.2, 'vfdrc_rule_prediction': 'weighted_sum', 'vfdrc_max_rules': 40, 'vfdrc_expand_criterion': 'info_gain', 'vfdrc_remove_poor_atts': False}. Best is trial 61 with value: 0.843739.[0m
[32m[I 2022-10-27 01:14:10,745][0m Trial 65 finished with value: 0.7933337181985132 and parameters: {'vfdrc_ordered_rules': True, 'vfdrc_grace_period': 250, 'vfdrc_tie_threshold': 0.2, 'vfdrc_rule_prediction': 'weighted_sum', 'vfdrc_max_rules': 40, 'vfdrc_expand_criterion': 'info_gain', 'vfdrc_remove_poor_atts': False}. Best is trial 61 with value: 0.843739.[0m
[32m[I 2022-10-27 01:14:25,172][0m Trial 66 finished with value: 0.7933337181985132 and parameters: {'vfdrc_ordered_rules': True, 'vfdrc_grace_period': 250, 'vfdrc_tie_threshold': 0.2, 'vfdrc_rule_prediction': 'weighted_sum', 'vfdrc_max_rules': 40, 'vfdrc_expand_criterion': 'info_gain', 'vfdrc_remove_poor_atts': False}. Best is trial 61 with value: 0.843739.[0m
[32m[I 2022-10-27 01:14:37,126][0m Trial 67 finished with value: 0.7933337181985132 and parameters: {'vfdrc_ordered_rules': True, 'vfdrc_grace_period': 250, 'vfdrc_tie_threshold': 0.2, 'vfdrc_rule_prediction': 'first_hit', 'vfdrc_max_rules': 40, 'vfdrc_expand_criterion': 'info_gain', 'vfdrc_remove_poor_atts': False}. Best is trial 61 with value: 0.843739.[0m
[32m[I 2022-10-27 01:19:11,025][0m Trial 68 finished with value: 0.781659008577558 and parameters: {'vfdrc_ordered_rules': True, 'vfdrc_grace_period': 400, 'vfdrc_tie_threshold': 0.15000000000000002, 'vfdrc_rule_prediction': 'weighted_sum', 'vfdrc_max_rules': 40, 'vfdrc_expand_criterion': 'info_gain', 'vfdrc_remove_poor_atts': False}. Best is trial 61 with value: 0.843739.[0m
[32m[I 2022-10-27 01:19:45,766][0m Trial 69 finished with value: 0.781659008577558 and parameters: {'vfdrc_ordered_rules': True, 'vfdrc_grace_period': 400, 'vfdrc_tie_threshold': 0.15000000000000002, 'vfdrc_rule_prediction': 'weighted_sum', 'vfdrc_max_rules': 40, 'vfdrc_expand_criterion': 'info_gain', 'vfdrc_remove_poor_atts': False}. Best is trial 61 with value: 0.843739.[0m
[32m[I 2022-10-27 01:20:07,521][0m Trial 70 finished with value: 0.781659008577558 and parameters: {'vfdrc_ordered_rules': True, 'vfdrc_grace_period': 400, 'vfdrc_tie_threshold': 0.15000000000000002, 'vfdrc_rule_prediction': 'first_hit', 'vfdrc_max_rules': 40, 'vfdrc_expand_criterion': 'info_gain', 'vfdrc_remove_poor_atts': False}. Best is trial 61 with value: 0.843739.[0m
[32m[I 2022-10-27 01:21:27,232][0m Trial 71 finished with value: 0.781659008577558 and parameters: {'vfdrc_ordered_rules': True, 'vfdrc_grace_period': 400, 'vfdrc_tie_threshold': 0.15000000000000002, 'vfdrc_rule_prediction': 'first_hit', 'vfdrc_max_rules': 40, 'vfdrc_expand_criterion': 'info_gain', 'vfdrc_remove_poor_atts': False}. Best is trial 61 with value: 0.843739.[0m
[32m[I 2022-10-27 01:24:14,599][0m Trial 72 finished with value: 0.781659008577558 and parameters: {'vfdrc_ordered_rules': True, 'vfdrc_grace_period': 400, 'vfdrc_tie_threshold': 0.15000000000000002, 'vfdrc_rule_prediction': 'first_hit', 'vfdrc_max_rules': 40, 'vfdrc_expand_criterion': 'info_gain', 'vfdrc_remove_poor_atts': False}. Best is trial 61 with value: 0.843739.[0m
[32m[I 2022-10-27 01:24:19,559][0m Trial 75 finished with value: 0.8356242085256126 and parameters: {'vfdrc_ordered_rules': True, 'vfdrc_grace_period': 300, 'vfdrc_tie_threshold': 0.1, 'vfdrc_rule_prediction': 'first_hit', 'vfdrc_max_rules': 40, 'vfdrc_expand_criterion': 'info_gain', 'vfdrc_remove_poor_atts': False}. Best is trial 61 with value: 0.843739.[0m
[32m[I 2022-10-27 01:24:24,452][0m Trial 73 finished with value: 0.781659008577558 and parameters: {'vfdrc_ordered_rules': True, 'vfdrc_grace_period': 400, 'vfdrc_tie_threshold': 0.15000000000000002, 'vfdrc_rule_prediction': 'first_hit', 'vfdrc_max_rules': 40, 'vfdrc_expand_criterion': 'info_gain', 'vfdrc_remove_poor_atts': False}. Best is trial 61 with value: 0.843739.[0m
[32m[I 2022-10-27 01:24:24,924][0m Trial 74 finished with value: 0.781659008577558 and parameters: {'vfdrc_ordered_rules': True, 'vfdrc_grace_period': 400, 'vfdrc_tie_threshold': 0.15000000000000002, 'vfdrc_rule_prediction': 'first_hit', 'vfdrc_max_rules': 40, 'vfdrc_expand_criterion': 'info_gain', 'vfdrc_remove_poor_atts': False}. Best is trial 61 with value: 0.843739.[0m
[32m[I 2022-10-27 01:27:34,489][0m Trial 76 finished with value: 0.9852760990727271 and parameters: {'vfdrc_ordered_rules': True, 'vfdrc_grace_period': 350, 'vfdrc_tie_threshold': 0.0, 'vfdrc_rule_prediction': 'first_hit', 'vfdrc_max_rules': 40, 'vfdrc_expand_criterion': 'info_gain', 'vfdrc_remove_poor_atts': False}. Best is trial 76 with value: 0.985276.[0m
[32m[I 2022-10-27 01:30:21,569][0m Trial 78 finished with value: 0.7222887720953894 and parameters: {'vfdrc_ordered_rules': True, 'vfdrc_grace_period': 350, 'vfdrc_tie_threshold': 0.05, 'vfdrc_rule_prediction': 'first_hit', 'vfdrc_max_rules': 40, 'vfdrc_expand_criterion': 'info_gain', 'vfdrc_remove_poor_atts': False}. Best is trial 76 with value: 0.985276.[0m
[32m[I 2022-10-27 01:30:25,998][0m Trial 77 finished with value: 0.7222887720953894 and parameters: {'vfdrc_ordered_rules': True, 'vfdrc_grace_period': 350, 'vfdrc_tie_threshold': 0.05, 'vfdrc_rule_prediction': 'first_hit', 'vfdrc_max_rules': 40, 'vfdrc_expand_criterion': 'info_gain', 'vfdrc_remove_poor_atts': False}. Best is trial 76 with value: 0.985276.[0m
[32m[I 2022-10-27 01:32:03,977][0m Trial 79 finished with value: 0.7222887720953894 and parameters: {'vfdrc_ordered_rules': True, 'vfdrc_grace_period': 350, 'vfdrc_tie_threshold': 0.05, 'vfdrc_rule_prediction': 'first_hit', 'vfdrc_max_rules': 40, 'vfdrc_expand_criterion': 'info_gain', 'vfdrc_remove_poor_atts': False}. Best is trial 76 with value: 0.985276.[0m
[32m[I 2022-10-27 01:33:06,016][0m Trial 80 finished with value: 0.8731973663361811 and parameters: {'vfdrc_ordered_rules': True, 'vfdrc_grace_period': 300, 'vfdrc_tie_threshold': 0.05, 'vfdrc_rule_prediction': 'first_hit', 'vfdrc_max_rules': 40, 'vfdrc_expand_criterion': 'info_gain', 'vfdrc_remove_poor_atts': False}. Best is trial 76 with value: 0.985276.[0m
[32m[I 2022-10-27 01:33:06,122][0m Trial 83 finished with value: 0.7222887720953894 and parameters: {'vfdrc_ordered_rules': True, 'vfdrc_grace_period': 350, 'vfdrc_tie_threshold': 0.05, 'vfdrc_rule_prediction': 'first_hit', 'vfdrc_max_rules': 40, 'vfdrc_expand_criterion': 'info_gain', 'vfdrc_remove_poor_atts': False}. Best is trial 76 with value: 0.985276.[0m
[32m[I 2022-10-27 01:33:33,615][0m Trial 81 finished with value: 0.7222887720953894 and parameters: {'vfdrc_ordered_rules': True, 'vfdrc_grace_period': 350, 'vfdrc_tie_threshold': 0.05, 'vfdrc_rule_prediction': 'first_hit', 'vfdrc_max_rules': 40, 'vfdrc_expand_criterion': 'info_gain', 'vfdrc_remove_poor_atts': False}. Best is trial 76 with value: 0.985276.[0m
[32m[I 2022-10-27 01:33:33,858][0m Trial 82 finished with value: 0.7222887720953894 and parameters: {'vfdrc_ordered_rules': True, 'vfdrc_grace_period': 350, 'vfdrc_tie_threshold': 0.05, 'vfdrc_rule_prediction': 'first_hit', 'vfdrc_max_rules': 40, 'vfdrc_expand_criterion': 'info_gain', 'vfdrc_remove_poor_atts': False}. Best is trial 76 with value: 0.985276.[0m
[32m[I 2022-10-27 01:33:34,214][0m Trial 84 finished with value: 0.9852760990727271 and parameters: {'vfdrc_ordered_rules': True, 'vfdrc_grace_period': 350, 'vfdrc_tie_threshold': 0.0, 'vfdrc_rule_prediction': 'first_hit', 'vfdrc_max_rules': 40, 'vfdrc_expand_criterion': 'info_gain', 'vfdrc_remove_poor_atts': False}. Best is trial 76 with value: 0.985276.[0m
[32m[I 2022-10-27 01:37:29,962][0m Trial 85 finished with value: 0.9852760990727271 and parameters: {'vfdrc_ordered_rules': True, 'vfdrc_grace_period': 350, 'vfdrc_tie_threshold': 0.0, 'vfdrc_rule_prediction': 'first_hit', 'vfdrc_max_rules': 40, 'vfdrc_expand_criterion': 'info_gain', 'vfdrc_remove_poor_atts': False}. Best is trial 76 with value: 0.985276.[0m
[32m[I 2022-10-27 01:37:46,942][0m Trial 86 finished with value: 0.9203773276356303 and parameters: {'vfdrc_ordered_rules': True, 'vfdrc_grace_period': 300, 'vfdrc_tie_threshold': 0.0, 'vfdrc_rule_prediction': 'first_hit', 'vfdrc_max_rules': 40, 'vfdrc_expand_criterion': 'info_gain', 'vfdrc_remove_poor_atts': False}. Best is trial 76 with value: 0.985276.[0m
[32m[I 2022-10-27 01:38:57,628][0m Trial 87 finished with value: 0.9203773276356303 and parameters: {'vfdrc_ordered_rules': True, 'vfdrc_grace_period': 300, 'vfdrc_tie_threshold': 0.0, 'vfdrc_rule_prediction': 'first_hit', 'vfdrc_max_rules': 40, 'vfdrc_expand_criterion': 'info_gain', 'vfdrc_remove_poor_atts': False}. Best is trial 76 with value: 0.985276.[0m
[32m[I 2022-10-27 01:40:18,728][0m Trial 88 finished with value: 0.9203773276356303 and parameters: {'vfdrc_ordered_rules': True, 'vfdrc_grace_period': 300, 'vfdrc_tie_threshold': 0.0, 'vfdrc_rule_prediction': 'first_hit', 'vfdrc_max_rules': 40, 'vfdrc_expand_criterion': 'info_gain', 'vfdrc_remove_poor_atts': False}. Best is trial 76 with value: 0.985276.[0m
[32m[I 2022-10-27 01:40:25,261][0m Trial 89 finished with value: 0.9203773276356303 and parameters: {'vfdrc_ordered_rules': True, 'vfdrc_grace_period': 300, 'vfdrc_tie_threshold': 0.0, 'vfdrc_rule_prediction': 'first_hit', 'vfdrc_max_rules': 40, 'vfdrc_expand_criterion': 'info_gain', 'vfdrc_remove_poor_atts': False}. Best is trial 76 with value: 0.985276.[0m
[32m[I 2022-10-27 01:40:34,601][0m Trial 91 finished with value: 0.9203773276356303 and parameters: {'vfdrc_ordered_rules': True, 'vfdrc_grace_period': 300, 'vfdrc_tie_threshold': 0.0, 'vfdrc_rule_prediction': 'first_hit', 'vfdrc_max_rules': 40, 'vfdrc_expand_criterion': 'info_gain', 'vfdrc_remove_poor_atts': False}. Best is trial 76 with value: 0.985276.[0m
[32m[I 2022-10-27 01:40:41,405][0m Trial 90 finished with value: 0.9203773276356303 and parameters: {'vfdrc_ordered_rules': True, 'vfdrc_grace_period': 300, 'vfdrc_tie_threshold': 0.0, 'vfdrc_rule_prediction': 'first_hit', 'vfdrc_max_rules': 40, 'vfdrc_expand_criterion': 'info_gain', 'vfdrc_remove_poor_atts': False}. Best is trial 76 with value: 0.985276.[0m
[32m[I 2022-10-27 01:40:49,688][0m Trial 92 finished with value: 0.9203773276356303 and parameters: {'vfdrc_ordered_rules': True, 'vfdrc_grace_period': 300, 'vfdrc_tie_threshold': 0.0, 'vfdrc_rule_prediction': 'first_hit', 'vfdrc_max_rules': 40, 'vfdrc_expand_criterion': 'info_gain', 'vfdrc_remove_poor_atts': False}. Best is trial 76 with value: 0.985276.[0m
[32m[I 2022-10-27 01:43:53,939][0m Trial 93 finished with value: 0.9203773276356303 and parameters: {'vfdrc_ordered_rules': True, 'vfdrc_grace_period': 300, 'vfdrc_tie_threshold': 0.0, 'vfdrc_rule_prediction': 'first_hit', 'vfdrc_max_rules': 40, 'vfdrc_expand_criterion': 'info_gain', 'vfdrc_remove_poor_atts': False}. Best is trial 76 with value: 0.985276.[0m
[32m[I 2022-10-27 01:43:54,627][0m Trial 94 finished with value: 0.9203773276356303 and parameters: {'vfdrc_ordered_rules': True, 'vfdrc_grace_period': 300, 'vfdrc_tie_threshold': 0.0, 'vfdrc_rule_prediction': 'first_hit', 'vfdrc_max_rules': 40, 'vfdrc_expand_criterion': 'info_gain', 'vfdrc_remove_poor_atts': False}. Best is trial 76 with value: 0.985276.[0m
[32m[I 2022-10-27 01:43:55,032][0m Trial 95 finished with value: 0.9203773276356303 and parameters: {'vfdrc_ordered_rules': True, 'vfdrc_grace_period': 300, 'vfdrc_tie_threshold': 0.0, 'vfdrc_rule_prediction': 'first_hit', 'vfdrc_max_rules': 40, 'vfdrc_expand_criterion': 'info_gain', 'vfdrc_remove_poor_atts': False}. Best is trial 76 with value: 0.985276.[0m
[32m[I 2022-10-27 01:44:00,335][0m Trial 98 finished with value: 0.9203773276356303 and parameters: {'vfdrc_ordered_rules': True, 'vfdrc_grace_period': 300, 'vfdrc_tie_threshold': 0.0, 'vfdrc_rule_prediction': 'first_hit', 'vfdrc_max_rules': 40, 'vfdrc_expand_criterion': 'info_gain', 'vfdrc_remove_poor_atts': False}. Best is trial 76 with value: 0.985276.[0m
[32m[I 2022-10-27 01:44:00,616][0m Trial 96 finished with value: 0.9203773276356303 and parameters: {'vfdrc_ordered_rules': True, 'vfdrc_grace_period': 300, 'vfdrc_tie_threshold': 0.0, 'vfdrc_rule_prediction': 'first_hit', 'vfdrc_max_rules': 40, 'vfdrc_expand_criterion': 'info_gain', 'vfdrc_remove_poor_atts': False}. Best is trial 76 with value: 0.985276.[0m
[32m[I 2022-10-27 01:44:00,810][0m Trial 97 finished with value: 0.9203773276356303 and parameters: {'vfdrc_ordered_rules': True, 'vfdrc_grace_period': 300, 'vfdrc_tie_threshold': 0.0, 'vfdrc_rule_prediction': 'first_hit', 'vfdrc_max_rules': 40, 'vfdrc_expand_criterion': 'info_gain', 'vfdrc_remove_poor_atts': False}. Best is trial 76 with value: 0.985276.[0m
[32m[I 2022-10-27 01:44:00,932][0m Trial 99 finished with value: 0.9203773276356303 and parameters: {'vfdrc_ordered_rules': True, 'vfdrc_grace_period': 300, 'vfdrc_tie_threshold': 0.0, 'vfdrc_rule_prediction': 'first_hit', 'vfdrc_max_rules': 40, 'vfdrc_expand_criterion': 'info_gain', 'vfdrc_remove_poor_atts': False}. Best is trial 76 with value: 0.985276.[0m
[32m[I 2022-10-27 01:44:01,009][0m Study finished.[0m
[32m[I 2022-10-27 01:44:01,029][0m --------------------------------------------------------------------------------[0m
[32m[I 2022-10-27 01:44:01,029][0m --------------------             XGBClassifier              --------------------[0m
[32m[I 2022-10-27 01:44:01,030][0m --------------------------------------------------------------------------------[0m
[32m[I 2022-10-27 01:44:01,058][0m A new study created in RDB with name: XGBClassifier_c963b74b[0m
[32m[I 2022-10-27 01:44:01,067][0m Study started.[0m
[32m[I 2022-10-27 01:50:47,522][0m Trial 3 finished with value: 0.9999155546456646 and parameters: {'xgbc_n_estimators': 30, 'xgbc_use_label_encoder': False, 'xgbc_learning_rate': 0.35867483605940437, 'xgbc_booster': 'dart', 'xgbc_gamma': 0.0006380421420274495}. Best is trial 3 with value: 0.999916.[0m
[32m[I 2022-10-27 01:51:57,279][0m Trial 4 finished with value: 0.6950742018218817 and parameters: {'xgbc_n_estimators': 40, 'xgbc_use_label_encoder': False, 'xgbc_learning_rate': 2.5663896344021505e-06, 'xgbc_booster': 'gblinear', 'xgbc_gamma': 9.182420113854234e-06}. Best is trial 3 with value: 0.999916.[0m
