[32m[I 2022-10-26 21:55:58,330][0m Trial 99 finished with value: 0.7039070102441788 and parameters: {'qda_reg_param': 0.5, 'qda_tol': 1.9064900698601545e-06}. Best is trial 34 with value: 0.708021.[0m
[32m[I 2022-10-26 21:55:58,330][0m Trial 98 finished with value: 0.6960743683825104 and parameters: {'qda_reg_param': 0.9500000000000001, 'qda_tol': 1.869547952719354e-06}. Best is trial 34 with value: 0.708021.[0m
[32m[I 2022-10-26 21:55:58,461][0m Study finished.[0m
[32m[I 2022-10-26 21:55:58,474][0m --------------------------------------------------------------------------------[0m
[32m[I 2022-10-26 21:55:58,474][0m --------------------         RandomForestClassifier         --------------------[0m
[32m[I 2022-10-26 21:55:58,475][0m --------------------------------------------------------------------------------[0m
[32m[I 2022-10-26 21:55:58,504][0m A new study created in RDB with name: RandomForestClassifier_c963b74b[0m
[32m[I 2022-10-26 21:55:58,510][0m Study started.[0m
[32m[I 2022-10-26 21:55:58,750][0m sklearn.ensemble.RandomForestClassifier.fit: running accelerated version on CPU[0m
[32m[I 2022-10-26 21:55:58,759][0m sklearn.ensemble.RandomForestClassifier.fit: running accelerated version on CPU[0m
[32m[I 2022-10-26 21:55:58,771][0m sklearn.ensemble.RandomForestClassifier.fit: running accelerated version on CPU[0m
[32m[I 2022-10-26 21:55:58,789][0m sklearn.ensemble.RandomForestClassifier.fit: fallback to original Scikit-learn[0m
[32m[I 2022-10-26 21:55:58,823][0m sklearn.ensemble.RandomForestClassifier.fit: running accelerated version on CPU[0m
[32m[I 2022-10-26 21:55:58,833][0m sklearn.ensemble.RandomForestClassifier.fit: fallback to original Scikit-learn[0m
[32m[I 2022-10-26 21:55:58,858][0m sklearn.ensemble.RandomForestClassifier.fit: running accelerated version on CPU[0m
[32m[I 2022-10-26 21:55:58,900][0m sklearn.ensemble.RandomForestClassifier.fit: running accelerated version on CPU[0m
[32m[I 2022-10-26 21:56:21,035][0m sklearn.ensemble.RandomForestClassifier.predict: running accelerated version on CPU[0m
[32m[I 2022-10-26 21:56:24,954][0m Trial 3 finished with value: 0.9975188220772165 and parameters: {'rfc_criterion': 'gini', 'rfc_n_estimators': 70, 'rfc_min_samples_split': 5, 'rfc_min_samples_leaf': 12, 'rfc_max_features': 1, 'rfc_bootstrap': True}. Best is trial 3 with value: 0.997519.[0m
[32m[I 2022-10-26 21:56:25,496][0m sklearn.ensemble.RandomForestClassifier.fit: running accelerated version on CPU[0m
[32m[I 2022-10-26 21:56:30,583][0m sklearn.ensemble.RandomForestClassifier.predict: running accelerated version on CPU[0m
[32m[I 2022-10-26 21:56:32,812][0m sklearn.ensemble.RandomForestClassifier.predict: running accelerated version on CPU[0m
[32m[I 2022-10-26 21:56:33,427][0m Trial 1 finished with value: 0.9954332037515569 and parameters: {'rfc_criterion': 'gini', 'rfc_n_estimators': 40, 'rfc_min_samples_split': 25, 'rfc_min_samples_leaf': 39, 'rfc_max_features': 1, 'rfc_bootstrap': False}. Best is trial 3 with value: 0.997519.[0m
[32m[I 2022-10-26 21:56:34,128][0m sklearn.ensemble.RandomForestClassifier.fit: running accelerated version on CPU[0m
[32m[I 2022-10-26 21:56:35,949][0m Trial 0 finished with value: 0.9963729221900137 and parameters: {'rfc_criterion': 'gini', 'rfc_n_estimators': 40, 'rfc_min_samples_split': 25, 'rfc_min_samples_leaf': 38, 'rfc_max_features': 5, 'rfc_bootstrap': False}. Best is trial 3 with value: 0.997519.[0m
[32m[I 2022-10-26 21:56:36,661][0m sklearn.ensemble.RandomForestClassifier.fit: running accelerated version on CPU[0m
[32m[I 2022-10-26 21:57:13,038][0m sklearn.ensemble.RandomForestClassifier.predict: running accelerated version on CPU[0m
[32m[I 2022-10-26 21:57:18,840][0m Trial 7 finished with value: 0.9973714262700885 and parameters: {'rfc_criterion': 'gini', 'rfc_n_estimators': 120, 'rfc_min_samples_split': 47, 'rfc_min_samples_leaf': 11, 'rfc_max_features': 1, 'rfc_bootstrap': False}. Best is trial 3 with value: 0.997519.[0m
[32m[I 2022-10-26 21:57:19,385][0m sklearn.ensemble.RandomForestClassifier.fit: running accelerated version on CPU[0m
[32m[I 2022-10-26 21:57:24,878][0m sklearn.ensemble.RandomForestClassifier.predict: running accelerated version on CPU[0m
[32m[I 2022-10-26 21:57:26,445][0m sklearn.ensemble.RandomForestClassifier.predict: running accelerated version on CPU[0m
[32m[I 2022-10-26 21:57:28,806][0m sklearn.ensemble.RandomForestClassifier.predict: fallback to original Scikit-learn[0m
[32m[I 2022-10-26 21:57:28,812][0m sklearn.ensemble.RandomForestClassifier.predict_proba: fallback to original Scikit-learn[0m
[32m[I 2022-10-26 21:57:29,706][0m Trial 8 finished with value: 0.9972344152590485 and parameters: {'rfc_criterion': 'gini', 'rfc_n_estimators': 160, 'rfc_min_samples_split': 25, 'rfc_min_samples_leaf': 30, 'rfc_max_features': 1, 'rfc_bootstrap': False}. Best is trial 3 with value: 0.997519.[0m
[32m[I 2022-10-26 21:57:30,263][0m sklearn.ensemble.RandomForestClassifier.fit: fallback to original Scikit-learn[0m
[32m[I 2022-10-26 21:57:30,817][0m Trial 5 finished with value: 0.997205603514754 and parameters: {'rfc_criterion': 'gini', 'rfc_n_estimators': 120, 'rfc_min_samples_split': 32, 'rfc_min_samples_leaf': 2, 'rfc_max_features': 3, 'rfc_bootstrap': False}. Best is trial 3 with value: 0.997519.[0m
[32m[I 2022-10-26 21:57:31,390][0m sklearn.ensemble.RandomForestClassifier.fit: running accelerated version on CPU[0m
[32m[I 2022-10-26 21:57:33,154][0m Trial 2 finished with value: 0.9996572553776708 and parameters: {'rfc_criterion': 'entropy', 'rfc_n_estimators': 20, 'rfc_min_samples_split': 3, 'rfc_min_samples_leaf': 36, 'rfc_max_features': 6, 'rfc_bootstrap': True}. Best is trial 2 with value: 0.999657.[0m
[32m[I 2022-10-26 21:57:33,595][0m sklearn.ensemble.RandomForestClassifier.fit: running accelerated version on CPU[0m
[32m[I 2022-10-26 21:57:40,058][0m sklearn.ensemble.RandomForestClassifier.predict: running accelerated version on CPU[0m
[32m[I 2022-10-26 21:57:42,153][0m sklearn.ensemble.RandomForestClassifier.predict: running accelerated version on CPU[0m
[32m[I 2022-10-26 21:57:44,659][0m Trial 10 finished with value: 0.9971622500198601 and parameters: {'rfc_criterion': 'gini', 'rfc_n_estimators': 120, 'rfc_min_samples_split': 11, 'rfc_min_samples_leaf': 32, 'rfc_max_features': 1, 'rfc_bootstrap': False}. Best is trial 2 with value: 0.999657.[0m
[32m[I 2022-10-26 21:57:45,203][0m sklearn.ensemble.RandomForestClassifier.fit: fallback to original Scikit-learn[0m
[32m[I 2022-10-26 21:57:46,670][0m Trial 4 finished with value: 0.9968443431366626 and parameters: {'rfc_criterion': 'gini', 'rfc_n_estimators': 120, 'rfc_min_samples_split': 43, 'rfc_min_samples_leaf': 2, 'rfc_max_features': 4, 'rfc_bootstrap': True}. Best is trial 2 with value: 0.999657.[0m
[32m[I 2022-10-26 21:57:47,155][0m sklearn.ensemble.RandomForestClassifier.fit: running accelerated version on CPU[0m
[32m[I 2022-10-26 21:58:18,252][0m sklearn.ensemble.RandomForestClassifier.predict: running accelerated version on CPU[0m
[32m[I 2022-10-26 21:58:21,441][0m Trial 13 finished with value: 0.9961968954182667 and parameters: {'rfc_criterion': 'gini', 'rfc_n_estimators': 60, 'rfc_min_samples_split': 11, 'rfc_min_samples_leaf': 22, 'rfc_max_features': 5, 'rfc_bootstrap': True}. Best is trial 2 with value: 0.999657.[0m
[32m[I 2022-10-26 21:58:21,845][0m sklearn.ensemble.RandomForestClassifier.fit: fallback to original Scikit-learn[0m
[32m[I 2022-10-26 21:58:24,351][0m sklearn.ensemble.RandomForestClassifier.predict: running accelerated version on CPU[0m
[32m[I 2022-10-26 21:58:24,415][0m sklearn.ensemble.RandomForestClassifier.predict: running accelerated version on CPU[0m
[32m[I 2022-10-26 21:58:28,007][0m Trial 11 finished with value: 0.9962140983748655 and parameters: {'rfc_criterion': 'gini', 'rfc_n_estimators': 70, 'rfc_min_samples_split': 33, 'rfc_min_samples_leaf': 5, 'rfc_max_features': 5, 'rfc_bootstrap': True}. Best is trial 2 with value: 0.999657.[0m
[32m[I 2022-10-26 21:58:28,533][0m sklearn.ensemble.RandomForestClassifier.fit: fallback to original Scikit-learn[0m
[32m[I 2022-10-26 21:58:29,775][0m Trial 9 finished with value: 0.9961186025036252 and parameters: {'rfc_criterion': 'gini', 'rfc_n_estimators': 110, 'rfc_min_samples_split': 48, 'rfc_min_samples_leaf': 33, 'rfc_max_features': 5, 'rfc_bootstrap': False}. Best is trial 2 with value: 0.999657.[0m
[32m[I 2022-10-26 21:58:30,270][0m sklearn.ensemble.RandomForestClassifier.fit: fallback to original Scikit-learn[0m
[32m[I 2022-10-26 21:58:41,393][0m sklearn.ensemble.RandomForestClassifier.predict: running accelerated version on CPU[0m
[32m[I 2022-10-26 21:58:41,596][0m sklearn.ensemble.RandomForestClassifier.predict: running accelerated version on CPU[0m
[32m[I 2022-10-26 21:58:43,191][0m Trial 16 finished with value: 0.9970398294100914 and parameters: {'rfc_criterion': 'gini', 'rfc_n_estimators': 90, 'rfc_min_samples_split': 49, 'rfc_min_samples_leaf': 32, 'rfc_max_features': 3, 'rfc_bootstrap': False}. Best is trial 2 with value: 0.999657.[0m
[32m[I 2022-10-26 21:58:43,365][0m sklearn.ensemble.RandomForestClassifier.fit: fallback to original Scikit-learn[0m
[32m[I 2022-10-26 21:58:43,490][0m Trial 14 finished with value: 0.9974538600584584 and parameters: {'rfc_criterion': 'gini', 'rfc_n_estimators': 150, 'rfc_min_samples_split': 35, 'rfc_min_samples_leaf': 11, 'rfc_max_features': 1, 'rfc_bootstrap': True}. Best is trial 2 with value: 0.999657.[0m
[32m[I 2022-10-26 21:58:43,691][0m sklearn.ensemble.RandomForestClassifier.fit: fallback to original Scikit-learn[0m
[32m[I 2022-10-26 21:58:53,650][0m sklearn.ensemble.RandomForestClassifier.predict: fallback to original Scikit-learn[0m
[32m[I 2022-10-26 21:58:53,653][0m sklearn.ensemble.RandomForestClassifier.predict_proba: fallback to original Scikit-learn[0m
[32m[I 2022-10-26 21:58:55,371][0m Trial 17 finished with value: 0.9994957812580889 and parameters: {'rfc_criterion': 'entropy', 'rfc_n_estimators': 10, 'rfc_min_samples_split': 3, 'rfc_min_samples_leaf': 49, 'rfc_max_features': 7, 'rfc_bootstrap': True}. Best is trial 2 with value: 0.999657.[0m
[32m[I 2022-10-26 21:58:55,590][0m sklearn.ensemble.RandomForestClassifier.fit: fallback to original Scikit-learn[0m
[32m[I 2022-10-26 21:58:56,665][0m sklearn.ensemble.RandomForestClassifier.predict: fallback to original Scikit-learn[0m
[32m[I 2022-10-26 21:58:56,669][0m sklearn.ensemble.RandomForestClassifier.predict_proba: fallback to original Scikit-learn[0m
[32m[I 2022-10-26 21:58:57,758][0m sklearn.ensemble.RandomForestClassifier.predict: fallback to original Scikit-learn[0m
[32m[I 2022-10-26 21:58:57,759][0m sklearn.ensemble.RandomForestClassifier.predict_proba: fallback to original Scikit-learn[0m
[32m[I 2022-10-26 21:58:58,308][0m Trial 18 finished with value: 0.9997344067275236 and parameters: {'rfc_criterion': 'entropy', 'rfc_n_estimators': 10, 'rfc_min_samples_split': 3, 'rfc_min_samples_leaf': 19, 'rfc_max_features': 7, 'rfc_bootstrap': True}. Best is trial 18 with value: 0.999734.[0m
[32m[I 2022-10-26 21:58:58,498][0m sklearn.ensemble.RandomForestClassifier.fit: fallback to original Scikit-learn[0m
[32m[I 2022-10-26 21:58:59,496][0m Trial 19 finished with value: 0.9994957812580889 and parameters: {'rfc_criterion': 'entropy', 'rfc_n_estimators': 10, 'rfc_min_samples_split': 3, 'rfc_min_samples_leaf': 49, 'rfc_max_features': 7, 'rfc_bootstrap': True}. Best is trial 18 with value: 0.999734.[0m
[32m[I 2022-10-26 21:58:59,678][0m sklearn.ensemble.RandomForestClassifier.fit: fallback to original Scikit-learn[0m
[32m[I 2022-10-26 21:59:04,953][0m sklearn.ensemble.RandomForestClassifier.predict: fallback to original Scikit-learn[0m
[32m[I 2022-10-26 21:59:04,955][0m sklearn.ensemble.RandomForestClassifier.predict_proba: fallback to original Scikit-learn[0m
[32m[I 2022-10-26 21:59:04,975][0m sklearn.ensemble.RandomForestClassifier.predict: fallback to original Scikit-learn[0m
[32m[I 2022-10-26 21:59:04,976][0m sklearn.ensemble.RandomForestClassifier.predict_proba: fallback to original Scikit-learn[0m
[32m[I 2022-10-26 21:59:06,512][0m Trial 21 finished with value: 0.9994957812580889 and parameters: {'rfc_criterion': 'entropy', 'rfc_n_estimators': 10, 'rfc_min_samples_split': 2, 'rfc_min_samples_leaf': 50, 'rfc_max_features': 7, 'rfc_bootstrap': True}. Best is trial 18 with value: 0.999734.[0m
[32m[I 2022-10-26 21:59:06,656][0m Trial 20 finished with value: 0.9994957812580889 and parameters: {'rfc_criterion': 'entropy', 'rfc_n_estimators': 10, 'rfc_min_samples_split': 2, 'rfc_min_samples_leaf': 50, 'rfc_max_features': 7, 'rfc_bootstrap': True}. Best is trial 18 with value: 0.999734.[0m
[32m[I 2022-10-26 21:59:06,812][0m sklearn.ensemble.RandomForestClassifier.fit: fallback to original Scikit-learn[0m
[32m[I 2022-10-26 21:59:06,873][0m sklearn.ensemble.RandomForestClassifier.fit: fallback to original Scikit-learn[0m
[32m[I 2022-10-26 21:59:15,526][0m sklearn.ensemble.RandomForestClassifier.predict: fallback to original Scikit-learn[0m
[32m[I 2022-10-26 21:59:15,527][0m sklearn.ensemble.RandomForestClassifier.predict_proba: fallback to original Scikit-learn[0m
[32m[I 2022-10-26 21:59:17,023][0m Trial 22 finished with value: 0.9995057545536731 and parameters: {'rfc_criterion': 'entropy', 'rfc_n_estimators': 10, 'rfc_min_samples_split': 2, 'rfc_min_samples_leaf': 48, 'rfc_max_features': 7, 'rfc_bootstrap': True}. Best is trial 18 with value: 0.999734.[0m
[32m[I 2022-10-26 21:59:17,227][0m sklearn.ensemble.RandomForestClassifier.fit: fallback to original Scikit-learn[0m
[32m[I 2022-10-26 21:59:51,846][0m sklearn.ensemble.RandomForestClassifier.predict: fallback to original Scikit-learn[0m
[32m[I 2022-10-26 21:59:51,847][0m sklearn.ensemble.RandomForestClassifier.predict_proba: fallback to original Scikit-learn[0m
[32m[I 2022-10-26 21:59:54,077][0m Trial 24 finished with value: 0.9997467764609569 and parameters: {'rfc_criterion': 'entropy', 'rfc_n_estimators': 30, 'rfc_min_samples_split': 16, 'rfc_min_samples_leaf': 21, 'rfc_max_features': 6, 'rfc_bootstrap': True}. Best is trial 24 with value: 0.999747.[0m
[32m[I 2022-10-26 21:59:54,319][0m sklearn.ensemble.RandomForestClassifier.fit: fallback to original Scikit-learn[0m
[32m[I 2022-10-26 22:00:15,688][0m sklearn.ensemble.RandomForestClassifier.predict: fallback to original Scikit-learn[0m
[32m[I 2022-10-26 22:00:15,689][0m sklearn.ensemble.RandomForestClassifier.predict_proba: fallback to original Scikit-learn[0m
[32m[I 2022-10-26 22:00:18,291][0m Trial 25 finished with value: 0.9997418077871647 and parameters: {'rfc_criterion': 'entropy', 'rfc_n_estimators': 40, 'rfc_min_samples_split': 16, 'rfc_min_samples_leaf': 21, 'rfc_max_features': 6, 'rfc_bootstrap': True}. Best is trial 24 with value: 0.999747.[0m
[32m[I 2022-10-26 22:00:18,514][0m sklearn.ensemble.RandomForestClassifier.fit: fallback to original Scikit-learn[0m
[32m[I 2022-10-26 22:00:31,636][0m sklearn.ensemble.RandomForestClassifier.predict: fallback to original Scikit-learn[0m
[32m[I 2022-10-26 22:00:31,638][0m sklearn.ensemble.RandomForestClassifier.predict_proba: fallback to original Scikit-learn[0m
[32m[I 2022-10-26 22:00:37,111][0m Trial 15 finished with value: 0.9992801187675306 and parameters: {'rfc_criterion': 'entropy', 'rfc_n_estimators': 120, 'rfc_min_samples_split': 23, 'rfc_min_samples_leaf': 36, 'rfc_max_features': 1, 'rfc_bootstrap': False}. Best is trial 24 with value: 0.999747.[0m
[32m[I 2022-10-26 22:00:37,303][0m sklearn.ensemble.RandomForestClassifier.fit: fallback to original Scikit-learn[0m
[32m[I 2022-10-26 22:01:03,932][0m sklearn.ensemble.RandomForestClassifier.predict: fallback to original Scikit-learn[0m
[32m[I 2022-10-26 22:01:03,935][0m sklearn.ensemble.RandomForestClassifier.predict_proba: fallback to original Scikit-learn[0m
[32m[I 2022-10-26 22:01:06,516][0m Trial 28 finished with value: 0.9997418077871647 and parameters: {'rfc_criterion': 'entropy', 'rfc_n_estimators': 40, 'rfc_min_samples_split': 15, 'rfc_min_samples_leaf': 21, 'rfc_max_features': 6, 'rfc_bootstrap': True}. Best is trial 24 with value: 0.999747.[0m
[32m[I 2022-10-26 22:01:06,726][0m sklearn.ensemble.RandomForestClassifier.fit: fallback to original Scikit-learn[0m
[32m[I 2022-10-26 22:01:28,788][0m sklearn.ensemble.RandomForestClassifier.predict: fallback to original Scikit-learn[0m
[32m[I 2022-10-26 22:01:28,789][0m sklearn.ensemble.RandomForestClassifier.predict_proba: fallback to original Scikit-learn[0m
[32m[I 2022-10-26 22:01:31,372][0m Trial 29 finished with value: 0.9997418077871647 and parameters: {'rfc_criterion': 'entropy', 'rfc_n_estimators': 40, 'rfc_min_samples_split': 17, 'rfc_min_samples_leaf': 21, 'rfc_max_features': 6, 'rfc_bootstrap': True}. Best is trial 24 with value: 0.999747.[0m
[32m[I 2022-10-26 22:01:31,578][0m sklearn.ensemble.RandomForestClassifier.fit: fallback to original Scikit-learn[0m
[32m[I 2022-10-26 22:01:48,316][0m sklearn.ensemble.RandomForestClassifier.predict: fallback to original Scikit-learn[0m
[32m[I 2022-10-26 22:01:48,317][0m sklearn.ensemble.RandomForestClassifier.predict_proba: fallback to original Scikit-learn[0m
[32m[I 2022-10-26 22:01:50,815][0m Trial 30 finished with value: 0.9997144432285066 and parameters: {'rfc_criterion': 'entropy', 'rfc_n_estimators': 40, 'rfc_min_samples_split': 16, 'rfc_min_samples_leaf': 22, 'rfc_max_features': 6, 'rfc_bootstrap': True}. Best is trial 24 with value: 0.999747.[0m
[32m[I 2022-10-26 22:01:51,010][0m sklearn.ensemble.RandomForestClassifier.fit: fallback to original Scikit-learn[0m
[32m[I 2022-10-26 22:03:03,663][0m sklearn.ensemble.RandomForestClassifier.predict: fallback to original Scikit-learn[0m
[32m[I 2022-10-26 22:03:03,665][0m sklearn.ensemble.RandomForestClassifier.predict_proba: fallback to original Scikit-learn[0m
[32m[I 2022-10-26 22:03:12,256][0m Trial 12 finished with value: 0.9997814302969963 and parameters: {'rfc_criterion': 'entropy', 'rfc_n_estimators': 200, 'rfc_min_samples_split': 37, 'rfc_min_samples_leaf': 20, 'rfc_max_features': 4, 'rfc_bootstrap': True}. Best is trial 12 with value: 0.999781.[0m
[32m[I 2022-10-26 22:03:12,425][0m sklearn.ensemble.RandomForestClassifier.fit: fallback to original Scikit-learn[0m
[32m[I 2022-10-26 22:04:30,774][0m sklearn.ensemble.RandomForestClassifier.predict: fallback to original Scikit-learn[0m
[32m[I 2022-10-26 22:04:30,776][0m sklearn.ensemble.RandomForestClassifier.predict_proba: fallback to original Scikit-learn[0m
[32m[I 2022-10-26 22:04:32,056][0m sklearn.ensemble.RandomForestClassifier.predict: fallback to original Scikit-learn[0m
[32m[I 2022-10-26 22:04:32,058][0m sklearn.ensemble.RandomForestClassifier.predict_proba: fallback to original Scikit-learn[0m
[32m[I 2022-10-26 22:04:35,735][0m Trial 33 finished with value: 0.9998336913786143 and parameters: {'rfc_criterion': 'entropy', 'rfc_n_estimators': 90, 'rfc_min_samples_split': 18, 'rfc_min_samples_leaf': 17, 'rfc_max_features': 6, 'rfc_bootstrap': True}. Best is trial 33 with value: 0.999834.[0m
[32m[I 2022-10-26 22:04:35,927][0m sklearn.ensemble.RandomForestClassifier.fit: fallback to original Scikit-learn[0m
[32m[I 2022-10-26 22:04:41,335][0m Trial 6 finished with value: 0.999843500182143 and parameters: {'rfc_criterion': 'entropy', 'rfc_n_estimators': 200, 'rfc_min_samples_split': 40, 'rfc_min_samples_leaf': 21, 'rfc_max_features': 5, 'rfc_bootstrap': False}. Best is trial 6 with value: 0.999843.[0m
[32m[I 2022-10-26 22:04:41,557][0m sklearn.ensemble.RandomForestClassifier.fit: fallback to original Scikit-learn[0m
[32m[I 2022-10-26 22:04:53,134][0m sklearn.ensemble.RandomForestClassifier.predict: fallback to original Scikit-learn[0m
[32m[I 2022-10-26 22:04:53,135][0m sklearn.ensemble.RandomForestClassifier.predict_proba: fallback to original Scikit-learn[0m
[32m[I 2022-10-26 22:05:00,151][0m sklearn.ensemble.RandomForestClassifier.predict: fallback to original Scikit-learn[0m
[32m[I 2022-10-26 22:05:00,152][0m sklearn.ensemble.RandomForestClassifier.predict_proba: fallback to original Scikit-learn[0m
[32m[I 2022-10-26 22:05:01,395][0m Trial 27 finished with value: 0.9997492683331515 and parameters: {'rfc_criterion': 'entropy', 'rfc_n_estimators': 190, 'rfc_min_samples_split': 16, 'rfc_min_samples_leaf': 21, 'rfc_max_features': 6, 'rfc_bootstrap': True}. Best is trial 6 with value: 0.999843.[0m
[32m[I 2022-10-26 22:05:01,624][0m sklearn.ensemble.RandomForestClassifier.fit: fallback to original Scikit-learn[0m
[32m[I 2022-10-26 22:05:09,056][0m Trial 26 finished with value: 0.9997318558590294 and parameters: {'rfc_criterion': 'entropy', 'rfc_n_estimators': 200, 'rfc_min_samples_split': 17, 'rfc_min_samples_leaf': 23, 'rfc_max_features': 6, 'rfc_bootstrap': True}. Best is trial 6 with value: 0.999843.[0m
[32m[I 2022-10-26 22:05:09,255][0m sklearn.ensemble.RandomForestClassifier.fit: fallback to original Scikit-learn[0m
[32m[I 2022-10-26 22:05:32,204][0m sklearn.ensemble.RandomForestClassifier.predict: fallback to original Scikit-learn[0m
[32m[I 2022-10-26 22:05:32,205][0m sklearn.ensemble.RandomForestClassifier.predict_proba: fallback to original Scikit-learn[0m
