[32m[I 2022-10-26 07:12:45,166][0m Trial 25 finished with value: 0.6950742018218817 and parameters: {'lgbm_num_leaves': 15, 'lgbm_learning_rate': 0.0014760399405346265, 'lgbm_n_estimators': 180, 'lgbm_reg_alpha': 0.7000000000000001, 'lgbm_reg_lambda': 0.5}. Best is trial 19 with value: 0.999893.[0m
[32m[I 2022-10-26 07:13:53,927][0m Trial 26 finished with value: 0.9699511552025529 and parameters: {'lgbm_num_leaves': 15, 'lgbm_learning_rate': 0.0023946766800845365, 'lgbm_n_estimators': 200, 'lgbm_reg_alpha': 0.65, 'lgbm_reg_lambda': 0.55}. Best is trial 19 with value: 0.999893.[0m
[32m[I 2022-10-26 07:14:35,887][0m Trial 28 finished with value: 0.6950742018218817 and parameters: {'lgbm_num_leaves': 15, 'lgbm_learning_rate': 0.0011305972000701372, 'lgbm_n_estimators': 200, 'lgbm_reg_alpha': 0.7000000000000001, 'lgbm_reg_lambda': 0.55}. Best is trial 19 with value: 0.999893.[0m
[32m[I 2022-10-26 07:14:37,376][0m Trial 33 finished with value: 0.9998931421721856 and parameters: {'lgbm_num_leaves': 127, 'lgbm_learning_rate': 0.2243776291791921, 'lgbm_n_estimators': 160, 'lgbm_reg_alpha': 0.8500000000000001, 'lgbm_reg_lambda': 0.65}. Best is trial 33 with value: 0.999893.[0m
[32m[I 2022-10-26 07:14:41,481][0m Trial 30 finished with value: 0.9998906553683087 and parameters: {'lgbm_num_leaves': 15, 'lgbm_learning_rate': 0.20960941789199988, 'lgbm_n_estimators': 170, 'lgbm_reg_alpha': 0.7000000000000001, 'lgbm_reg_lambda': 0.55}. Best is trial 33 with value: 0.999893.[0m
[32m[I 2022-10-26 07:14:45,981][0m Trial 27 finished with value: 0.6950742018218817 and parameters: {'lgbm_num_leaves': 127, 'lgbm_learning_rate': 0.0013974579847195294, 'lgbm_n_estimators': 200, 'lgbm_reg_alpha': 0.75, 'lgbm_reg_lambda': 0.55}. Best is trial 33 with value: 0.999893.[0m
[32m[I 2022-10-26 07:14:46,447][0m Trial 31 finished with value: 0.9999005897929585 and parameters: {'lgbm_num_leaves': 15, 'lgbm_learning_rate': 0.17345850504365573, 'lgbm_n_estimators': 170, 'lgbm_reg_alpha': 0.25, 'lgbm_reg_lambda': 0.45}. Best is trial 31 with value: 0.999901.[0m
[32m[I 2022-10-26 07:15:07,231][0m Trial 32 finished with value: 0.9995997263606942 and parameters: {'lgbm_num_leaves': 127, 'lgbm_learning_rate': 0.006487637858061192, 'lgbm_n_estimators': 180, 'lgbm_reg_alpha': 0.7000000000000001, 'lgbm_reg_lambda': 0.6000000000000001}. Best is trial 31 with value: 0.999901.[0m
[32m[I 2022-10-26 07:15:08,515][0m Trial 29 finished with value: 0.8669568558929825 and parameters: {'lgbm_num_leaves': 15, 'lgbm_learning_rate': 0.2243450121024654, 'lgbm_n_estimators': 170, 'lgbm_reg_alpha': 0.75, 'lgbm_reg_lambda': 0.55}. Best is trial 31 with value: 0.999901.[0m
[32m[I 2022-10-26 07:15:33,311][0m Trial 34 finished with value: 0.999888173950117 and parameters: {'lgbm_num_leaves': 127, 'lgbm_learning_rate': 0.2286654846198323, 'lgbm_n_estimators': 170, 'lgbm_reg_alpha': 0.8500000000000001, 'lgbm_reg_lambda': 0.65}. Best is trial 31 with value: 0.999901.[0m
[32m[I 2022-10-26 07:16:29,348][0m Trial 38 finished with value: 0.9998906614951322 and parameters: {'lgbm_num_leaves': 127, 'lgbm_learning_rate': 0.22612390341942248, 'lgbm_n_estimators': 160, 'lgbm_reg_alpha': 0.8500000000000001, 'lgbm_reg_lambda': 0.65}. Best is trial 31 with value: 0.999901.[0m
[32m[I 2022-10-26 07:16:39,047][0m Trial 36 finished with value: 0.9996022147121711 and parameters: {'lgbm_num_leaves': 127, 'lgbm_learning_rate': 0.007543055120830697, 'lgbm_n_estimators': 160, 'lgbm_reg_alpha': 0.8500000000000001, 'lgbm_reg_lambda': 0.65}. Best is trial 31 with value: 0.999901.[0m
[32m[I 2022-10-26 07:16:39,295][0m Trial 35 finished with value: 0.9997838302387047 and parameters: {'lgbm_num_leaves': 127, 'lgbm_learning_rate': 0.010136786124384702, 'lgbm_n_estimators': 160, 'lgbm_reg_alpha': 0.8500000000000001, 'lgbm_reg_lambda': 0.65}. Best is trial 31 with value: 0.999901.[0m
[32m[I 2022-10-26 07:16:44,951][0m Trial 39 finished with value: 0.9998533652802942 and parameters: {'lgbm_num_leaves': 15, 'lgbm_learning_rate': 0.25860434048729936, 'lgbm_n_estimators': 160, 'lgbm_reg_alpha': 0.2, 'lgbm_reg_lambda': 0.65}. Best is trial 31 with value: 0.999901.[0m
[32m[I 2022-10-26 07:16:54,029][0m Trial 41 finished with value: 0.9999005837268666 and parameters: {'lgbm_num_leaves': 15, 'lgbm_learning_rate': 0.2307262910992569, 'lgbm_n_estimators': 160, 'lgbm_reg_alpha': 0.25, 'lgbm_reg_lambda': 0.65}. Best is trial 31 with value: 0.999901.[0m
[32m[I 2022-10-26 07:16:56,734][0m Trial 37 finished with value: 0.7819440417405219 and parameters: {'lgbm_num_leaves': 15, 'lgbm_learning_rate': 0.3050069691152784, 'lgbm_n_estimators': 160, 'lgbm_reg_alpha': 0.8, 'lgbm_reg_lambda': 0.65}. Best is trial 31 with value: 0.999901.[0m
[32m[I 2022-10-26 07:17:20,368][0m Trial 40 finished with value: 0.7899193139910194 and parameters: {'lgbm_num_leaves': 15, 'lgbm_learning_rate': 0.2965993144822836, 'lgbm_n_estimators': 160, 'lgbm_reg_alpha': 0.25, 'lgbm_reg_lambda': 0.65}. Best is trial 31 with value: 0.999901.[0m
[32m[I 2022-10-26 07:17:36,893][0m Trial 42 finished with value: 0.7323011278040719 and parameters: {'lgbm_num_leaves': 15, 'lgbm_learning_rate': 0.39350572863723626, 'lgbm_n_estimators': 150, 'lgbm_reg_alpha': 0.25, 'lgbm_reg_lambda': 0.4}. Best is trial 31 with value: 0.999901.[0m
[32m[I 2022-10-26 07:18:24,020][0m Trial 45 finished with value: 0.6916461408644372 and parameters: {'lgbm_num_leaves': 31, 'lgbm_learning_rate': 0.42989388724074923, 'lgbm_n_estimators': 130, 'lgbm_reg_alpha': 0.2, 'lgbm_reg_lambda': 0.45}. Best is trial 31 with value: 0.999901.[0m
[32m[I 2022-10-26 07:18:29,379][0m Trial 43 finished with value: 0.7987763277811527 and parameters: {'lgbm_num_leaves': 31, 'lgbm_learning_rate': 0.4432123762846087, 'lgbm_n_estimators': 150, 'lgbm_reg_alpha': 0.5, 'lgbm_reg_lambda': 0.45}. Best is trial 31 with value: 0.999901.[0m
[32m[I 2022-10-26 07:18:36,310][0m Trial 46 finished with value: 0.7918393317183633 and parameters: {'lgbm_num_leaves': 31, 'lgbm_learning_rate': 0.35086373166493967, 'lgbm_n_estimators': 140, 'lgbm_reg_alpha': 0.5, 'lgbm_reg_lambda': 0.45}. Best is trial 31 with value: 0.999901.[0m
[32m[I 2022-10-26 07:18:39,093][0m Trial 44 finished with value: 0.6951080280647175 and parameters: {'lgbm_num_leaves': 31, 'lgbm_learning_rate': 0.44872017246383533, 'lgbm_n_estimators': 150, 'lgbm_reg_alpha': 0.25, 'lgbm_reg_lambda': 0.45}. Best is trial 31 with value: 0.999901.[0m
[32m[I 2022-10-26 07:18:46,623][0m Trial 47 finished with value: 0.8048168413852843 and parameters: {'lgbm_num_leaves': 31, 'lgbm_learning_rate': 0.3971554054727679, 'lgbm_n_estimators': 140, 'lgbm_reg_alpha': 0.2, 'lgbm_reg_lambda': 0.45}. Best is trial 31 with value: 0.999901.[0m
[32m[I 2022-10-26 07:18:48,758][0m Trial 48 finished with value: 0.7033531559135817 and parameters: {'lgbm_num_leaves': 31, 'lgbm_learning_rate': 0.4797920913266114, 'lgbm_n_estimators': 140, 'lgbm_reg_alpha': 0.25, 'lgbm_reg_lambda': 0.45}. Best is trial 31 with value: 0.999901.[0m
[32m[I 2022-10-26 07:18:49,056][0m Trial 49 finished with value: 0.9998831915783247 and parameters: {'lgbm_num_leaves': 31, 'lgbm_learning_rate': 0.06626882299240623, 'lgbm_n_estimators': 140, 'lgbm_reg_alpha': 0.5, 'lgbm_reg_lambda': 0.45}. Best is trial 31 with value: 0.999901.[0m
[32m[I 2022-10-26 07:19:03,953][0m Trial 50 finished with value: 0.9998931339615373 and parameters: {'lgbm_num_leaves': 31, 'lgbm_learning_rate': 0.12979831486941262, 'lgbm_n_estimators': 140, 'lgbm_reg_alpha': 0.5, 'lgbm_reg_lambda': 0.45}. Best is trial 31 with value: 0.999901.[0m
[32m[I 2022-10-26 07:20:17,475][0m Trial 52 finished with value: 0.9998881606808739 and parameters: {'lgbm_num_leaves': 127, 'lgbm_learning_rate': 0.07070744206104891, 'lgbm_n_estimators': 120, 'lgbm_reg_alpha': 0.9500000000000001, 'lgbm_reg_lambda': 0.75}. Best is trial 31 with value: 0.999901.[0m
[32m[I 2022-10-26 07:20:23,991][0m Trial 51 finished with value: 0.999890650519144 and parameters: {'lgbm_num_leaves': 31, 'lgbm_learning_rate': 0.08895598055400333, 'lgbm_n_estimators': 140, 'lgbm_reg_alpha': 0.5, 'lgbm_reg_lambda': 0.75}. Best is trial 31 with value: 0.999901.[0m
[32m[I 2022-10-26 07:20:30,108][0m Trial 55 finished with value: 0.6950742018218817 and parameters: {'lgbm_num_leaves': 127, 'lgbm_learning_rate': 0.0005058214682575073, 'lgbm_n_estimators': 120, 'lgbm_reg_alpha': 0.0, 'lgbm_reg_lambda': 0.75}. Best is trial 31 with value: 0.999901.[0m
[32m[I 2022-10-26 07:20:32,109][0m Trial 56 finished with value: 0.999873255092782 and parameters: {'lgbm_num_leaves': 127, 'lgbm_learning_rate': 0.021178296670416565, 'lgbm_n_estimators': 120, 'lgbm_reg_alpha': 0.0, 'lgbm_reg_lambda': 0.75}. Best is trial 31 with value: 0.999901.[0m
[32m[I 2022-10-26 07:20:33,598][0m Trial 57 finished with value: 0.9998459145269037 and parameters: {'lgbm_num_leaves': 127, 'lgbm_learning_rate': 0.02314424557575702, 'lgbm_n_estimators': 120, 'lgbm_reg_alpha': 0.9500000000000001, 'lgbm_reg_lambda': 0.75}. Best is trial 31 with value: 0.999901.[0m
[32m[I 2022-10-26 07:20:42,753][0m Trial 53 finished with value: 0.9998931200817172 and parameters: {'lgbm_num_leaves': 127, 'lgbm_learning_rate': 0.07655813790558486, 'lgbm_n_estimators': 130, 'lgbm_reg_alpha': 0.0, 'lgbm_reg_lambda': 0.75}. Best is trial 31 with value: 0.999901.[0m
[32m[I 2022-10-26 07:20:44,599][0m Trial 54 finished with value: 0.9998956064013903 and parameters: {'lgbm_num_leaves': 127, 'lgbm_learning_rate': 0.0736929983318241, 'lgbm_n_estimators': 130, 'lgbm_reg_alpha': 0.0, 'lgbm_reg_lambda': 0.75}. Best is trial 31 with value: 0.999901.[0m
[32m[I 2022-10-26 07:21:39,345][0m Trial 58 finished with value: 0.9998732430914532 and parameters: {'lgbm_num_leaves': 127, 'lgbm_learning_rate': 0.020049119765700518, 'lgbm_n_estimators': 180, 'lgbm_reg_alpha': 0.4, 'lgbm_reg_lambda': 0.75}. Best is trial 31 with value: 0.999901.[0m
[32m[I 2022-10-26 07:22:39,227][0m Trial 59 finished with value: 0.9998807065084019 and parameters: {'lgbm_num_leaves': 127, 'lgbm_learning_rate': 0.020793730864686298, 'lgbm_n_estimators': 180, 'lgbm_reg_alpha': 0.0, 'lgbm_reg_lambda': 0.8}. Best is trial 31 with value: 0.999901.[0m
[32m[I 2022-10-26 07:22:40,333][0m Trial 61 finished with value: 0.9998831756655304 and parameters: {'lgbm_num_leaves': 63, 'lgbm_learning_rate': 0.1366864096056819, 'lgbm_n_estimators': 180, 'lgbm_reg_alpha': 0.4, 'lgbm_reg_lambda': 0.8}. Best is trial 31 with value: 0.999901.[0m
[32m[I 2022-10-26 07:22:45,806][0m Trial 60 finished with value: 0.9998782138059849 and parameters: {'lgbm_num_leaves': 127, 'lgbm_learning_rate': 0.025126085646957314, 'lgbm_n_estimators': 180, 'lgbm_reg_alpha': 0.4, 'lgbm_reg_lambda': 0.8}. Best is trial 31 with value: 0.999901.[0m
[32m[I 2022-10-26 07:22:47,699][0m Trial 66 finished with value: 0.9998856688797814 and parameters: {'lgbm_num_leaves': 63, 'lgbm_learning_rate': 0.14801922418917213, 'lgbm_n_estimators': 80, 'lgbm_reg_alpha': 0.15000000000000002, 'lgbm_reg_lambda': 0.35000000000000003}. Best is trial 31 with value: 0.999901.[0m
[32m[I 2022-10-26 07:22:57,457][0m Trial 62 finished with value: 0.999890637645815 and parameters: {'lgbm_num_leaves': 63, 'lgbm_learning_rate': 0.1328919394608069, 'lgbm_n_estimators': 180, 'lgbm_reg_alpha': 0.1, 'lgbm_reg_lambda': 0.35000000000000003}. Best is trial 31 with value: 0.999901.[0m
[32m[I 2022-10-26 07:23:04,014][0m Trial 63 finished with value: 0.7352925462002092 and parameters: {'lgbm_num_leaves': 63, 'lgbm_learning_rate': 0.9478488003705299, 'lgbm_n_estimators': 180, 'lgbm_reg_alpha': 0.4, 'lgbm_reg_lambda': 0.35000000000000003}. Best is trial 31 with value: 0.999901.[0m
[32m[I 2022-10-26 07:23:18,569][0m Trial 64 finished with value: 0.9998906419741583 and parameters: {'lgbm_num_leaves': 63, 'lgbm_learning_rate': 0.1320863027093757, 'lgbm_n_estimators': 180, 'lgbm_reg_alpha': 0.1, 'lgbm_reg_lambda': 0.8500000000000001}. Best is trial 31 with value: 0.999901.[0m
[32m[I 2022-10-26 07:23:23,196][0m Trial 68 finished with value: 0.9975434875310749 and parameters: {'lgbm_num_leaves': 7, 'lgbm_learning_rate': 0.04332692390572042, 'lgbm_n_estimators': 80, 'lgbm_reg_alpha': 0.1, 'lgbm_reg_lambda': 0.9}. Best is trial 31 with value: 0.999901.[0m
[32m[I 2022-10-26 07:23:26,866][0m Trial 65 finished with value: 0.9998931264492168 and parameters: {'lgbm_num_leaves': 63, 'lgbm_learning_rate': 0.12207715554859552, 'lgbm_n_estimators': 190, 'lgbm_reg_alpha': 0.1, 'lgbm_reg_lambda': 0.8500000000000001}. Best is trial 31 with value: 0.999901.[0m
[32m[I 2022-10-26 07:24:49,623][0m Trial 72 finished with value: 0.9991270038369079 and parameters: {'lgbm_num_leaves': 7, 'lgbm_learning_rate': 0.050263150851433236, 'lgbm_n_estimators': 130, 'lgbm_reg_alpha': 0.1, 'lgbm_reg_lambda': 0.8500000000000001}. Best is trial 31 with value: 0.999901.[0m
[32m[I 2022-10-26 07:24:49,715][0m Trial 70 finished with value: 0.9987115545748383 and parameters: {'lgbm_num_leaves': 7, 'lgbm_learning_rate': 0.04189462699859127, 'lgbm_n_estimators': 130, 'lgbm_reg_alpha': 0.1, 'lgbm_reg_lambda': 0.9}. Best is trial 31 with value: 0.999901.[0m
[32m[I 2022-10-26 07:24:49,854][0m Trial 74 finished with value: 0.9997688870857341 and parameters: {'lgbm_num_leaves': 15, 'lgbm_learning_rate': 0.049203005284296185, 'lgbm_n_estimators': 130, 'lgbm_reg_alpha': 0.05, 'lgbm_reg_lambda': 0.7000000000000001}. Best is trial 31 with value: 0.999901.[0m
[32m[I 2022-10-26 07:24:49,855][0m Trial 69 finished with value: 0.6949308736544192 and parameters: {'lgbm_num_leaves': 7, 'lgbm_learning_rate': 0.9517239462517373, 'lgbm_n_estimators': 130, 'lgbm_reg_alpha': 0.1, 'lgbm_reg_lambda': 0.9}. Best is trial 31 with value: 0.999901.[0m
[32m[I 2022-10-26 07:24:49,958][0m Trial 73 finished with value: 0.9993982267339339 and parameters: {'lgbm_num_leaves': 7, 'lgbm_learning_rate': 0.051815199035933984, 'lgbm_n_estimators': 130, 'lgbm_reg_alpha': 0.30000000000000004, 'lgbm_reg_lambda': 0.6000000000000001}. Best is trial 31 with value: 0.999901.[0m
[32m[I 2022-10-26 07:24:50,149][0m Trial 71 finished with value: 0.9990522868427566 and parameters: {'lgbm_num_leaves': 7, 'lgbm_learning_rate': 0.049010460264587476, 'lgbm_n_estimators': 130, 'lgbm_reg_alpha': 0.05, 'lgbm_reg_lambda': 0.7000000000000001}. Best is trial 31 with value: 0.999901.[0m
[32m[I 2022-10-26 07:24:50,150][0m Trial 67 finished with value: 0.9998508653408038 and parameters: {'lgbm_num_leaves': 7, 'lgbm_learning_rate': 0.13047527738252987, 'lgbm_n_estimators': 190, 'lgbm_reg_alpha': 0.1, 'lgbm_reg_lambda': 0.8500000000000001}. Best is trial 31 with value: 0.999901.[0m
[32m[I 2022-10-26 07:25:22,765][0m Trial 75 finished with value: 0.6950742018218817 and parameters: {'lgbm_num_leaves': 15, 'lgbm_learning_rate': 4.899371069803976e-06, 'lgbm_n_estimators': 190, 'lgbm_reg_alpha': 0.30000000000000004, 'lgbm_reg_lambda': 0.9}. Best is trial 31 with value: 0.999901.[0m
[32m[I 2022-10-26 07:27:21,669][0m Trial 79 finished with value: 0.6950742018218817 and parameters: {'lgbm_num_leaves': 15, 'lgbm_learning_rate': 2.1584425248765125e-05, 'lgbm_n_estimators': 190, 'lgbm_reg_alpha': 0.15000000000000002, 'lgbm_reg_lambda': 0.6000000000000001}. Best is trial 31 with value: 0.999901.[0m
[32m[I 2022-10-26 07:27:22,277][0m Trial 80 finished with value: 0.6950742018218817 and parameters: {'lgbm_num_leaves': 15, 'lgbm_learning_rate': 7.87737645526679e-06, 'lgbm_n_estimators': 190, 'lgbm_reg_alpha': 0.15000000000000002, 'lgbm_reg_lambda': 0.6000000000000001}. Best is trial 31 with value: 0.999901.[0m
[32m[I 2022-10-26 07:27:22,990][0m Trial 82 finished with value: 0.6950742018218817 and parameters: {'lgbm_num_leaves': 15, 'lgbm_learning_rate': 8.15347832923736e-06, 'lgbm_n_estimators': 190, 'lgbm_reg_alpha': 0.15000000000000002, 'lgbm_reg_lambda': 0.6000000000000001}. Best is trial 31 with value: 0.999901.[0m
[32m[I 2022-10-26 07:27:37,334][0m Trial 76 finished with value: 0.9998906464714068 and parameters: {'lgbm_num_leaves': 15, 'lgbm_learning_rate': 0.09114324036747683, 'lgbm_n_estimators': 190, 'lgbm_reg_alpha': 0.15000000000000002, 'lgbm_reg_lambda': 0.6000000000000001}. Best is trial 31 with value: 0.999901.[0m
[32m[I 2022-10-26 07:27:38,840][0m Trial 77 finished with value: 0.9998881538650883 and parameters: {'lgbm_num_leaves': 15, 'lgbm_learning_rate': 0.09824106195685997, 'lgbm_n_estimators': 190, 'lgbm_reg_alpha': 0.15000000000000002, 'lgbm_reg_lambda': 0.6000000000000001}. Best is trial 31 with value: 0.999901.[0m
[32m[I 2022-10-26 07:27:39,979][0m Trial 81 finished with value: 0.9998806960787822 and parameters: {'lgbm_num_leaves': 15, 'lgbm_learning_rate': 0.08312325328224515, 'lgbm_n_estimators': 190, 'lgbm_reg_alpha': 0.15000000000000002, 'lgbm_reg_lambda': 0.6000000000000001}. Best is trial 31 with value: 0.999901.[0m
[32m[I 2022-10-26 07:27:42,286][0m Trial 78 finished with value: 0.9998906406435792 and parameters: {'lgbm_num_leaves': 15, 'lgbm_learning_rate': 0.09132811298886502, 'lgbm_n_estimators': 190, 'lgbm_reg_alpha': 0.15000000000000002, 'lgbm_reg_lambda': 0.6000000000000001}. Best is trial 31 with value: 0.999901.[0m
[32m[I 2022-10-26 07:28:12,039][0m Trial 83 finished with value: 0.9998931253424882 and parameters: {'lgbm_num_leaves': 127, 'lgbm_learning_rate': 0.08739909590826855, 'lgbm_n_estimators': 170, 'lgbm_reg_alpha': 0.05, 'lgbm_reg_lambda': 0.6000000000000001}. Best is trial 31 with value: 0.999901.[0m
[32m[I 2022-10-26 07:29:21,287][0m Trial 85 finished with value: 0.9998881606001325 and parameters: {'lgbm_num_leaves': 127, 'lgbm_learning_rate': 0.09321582437572871, 'lgbm_n_estimators': 170, 'lgbm_reg_alpha': 0.55, 'lgbm_reg_lambda': 0.5}. Best is trial 31 with value: 0.999901.[0m
[32m[I 2022-10-26 07:29:40,497][0m Trial 88 finished with value: 0.9998384656136781 and parameters: {'lgbm_num_leaves': 127, 'lgbm_learning_rate': 0.013105230036060383, 'lgbm_n_estimators': 170, 'lgbm_reg_alpha': 0.55, 'lgbm_reg_lambda': 0.5}. Best is trial 31 with value: 0.999901.[0m
[32m[I 2022-10-26 07:29:41,294][0m Trial 87 finished with value: 0.999850894053719 and parameters: {'lgbm_num_leaves': 127, 'lgbm_learning_rate': 0.0123263469456714, 'lgbm_n_estimators': 170, 'lgbm_reg_alpha': 0.05, 'lgbm_reg_lambda': 0.5}. Best is trial 31 with value: 0.999901.[0m
[32m[I 2022-10-26 07:29:43,968][0m Trial 84 finished with value: 0.7646820515882262 and parameters: {'lgbm_num_leaves': 127, 'lgbm_learning_rate': 0.6250569850924366, 'lgbm_n_estimators': 170, 'lgbm_reg_alpha': 0.55, 'lgbm_reg_lambda': 0.5}. Best is trial 31 with value: 0.999901.[0m
[32m[I 2022-10-26 07:29:45,605][0m Trial 86 finished with value: 0.9998956074645005 and parameters: {'lgbm_num_leaves': 127, 'lgbm_learning_rate': 0.08230896989958394, 'lgbm_n_estimators': 170, 'lgbm_reg_alpha': 0.05, 'lgbm_reg_lambda': 0.7000000000000001}. Best is trial 31 with value: 0.999901.[0m
[32m[I 2022-10-26 07:30:06,914][0m Trial 89 finished with value: 0.7676118684672054 and parameters: {'lgbm_num_leaves': 127, 'lgbm_learning_rate': 0.5732248149912506, 'lgbm_n_estimators': 170, 'lgbm_reg_alpha': 0.9, 'lgbm_reg_lambda': 0.5}. Best is trial 31 with value: 0.999901.[0m
[32m[I 2022-10-26 07:30:09,024][0m Trial 90 finished with value: 0.7786464207959418 and parameters: {'lgbm_num_leaves': 127, 'lgbm_learning_rate': 0.6349717273274129, 'lgbm_n_estimators': 170, 'lgbm_reg_alpha': 0.05, 'lgbm_reg_lambda': 0.5}. Best is trial 31 with value: 0.999901.[0m
[32m[I 2022-10-26 07:30:27,792][0m Trial 91 finished with value: 0.9998807051700694 and parameters: {'lgbm_num_leaves': 127, 'lgbm_learning_rate': 0.16849403492295423, 'lgbm_n_estimators': 170, 'lgbm_reg_alpha': 0.05, 'lgbm_reg_lambda': 0.5}. Best is trial 31 with value: 0.999901.[0m
[32m[I 2022-10-26 07:30:52,770][0m Trial 92 finished with value: 0.9998856699841593 and parameters: {'lgbm_num_leaves': 127, 'lgbm_learning_rate': 0.18895493740212047, 'lgbm_n_estimators': 110, 'lgbm_reg_alpha': 0.05, 'lgbm_reg_lambda': 0.5}. Best is trial 31 with value: 0.999901.[0m
[32m[I 2022-10-26 07:31:18,947][0m Trial 93 finished with value: 0.7902830176041937 and parameters: {'lgbm_num_leaves': 127, 'lgbm_learning_rate': 0.6766102271770108, 'lgbm_n_estimators': 110, 'lgbm_reg_alpha': 0.05, 'lgbm_reg_lambda': 0.7000000000000001}. Best is trial 31 with value: 0.999901.[0m
[32m[I 2022-10-26 07:31:22,245][0m Trial 95 finished with value: 0.7524388630709662 and parameters: {'lgbm_num_leaves': 127, 'lgbm_learning_rate': 0.6608126518660069, 'lgbm_n_estimators': 110, 'lgbm_reg_alpha': 0.0, 'lgbm_reg_lambda': 0.7000000000000001}. Best is trial 31 with value: 0.999901.[0m
[32m[I 2022-10-26 07:31:51,398][0m Trial 98 finished with value: 0.9998831806602557 and parameters: {'lgbm_num_leaves': 127, 'lgbm_learning_rate': 0.182079213415688, 'lgbm_n_estimators': 110, 'lgbm_reg_alpha': 0.0, 'lgbm_reg_lambda': 0.7000000000000001}. Best is trial 31 with value: 0.999901.[0m
[32m[I 2022-10-26 07:31:52,746][0m Trial 97 finished with value: 0.9998782077657752 and parameters: {'lgbm_num_leaves': 127, 'lgbm_learning_rate': 0.18951128604252218, 'lgbm_n_estimators': 160, 'lgbm_reg_alpha': 0.45, 'lgbm_reg_lambda': 0.7000000000000001}. Best is trial 31 with value: 0.999901.[0m
[32m[I 2022-10-26 07:31:57,244][0m Trial 96 finished with value: 0.9998632660727201 and parameters: {'lgbm_num_leaves': 127, 'lgbm_learning_rate': 0.16016257637906445, 'lgbm_n_estimators': 150, 'lgbm_reg_alpha': 0.05, 'lgbm_reg_lambda': 0.4}. Best is trial 31 with value: 0.999901.[0m
[32m[I 2022-10-26 07:32:08,519][0m Trial 94 finished with value: 0.9998658008860533 and parameters: {'lgbm_num_leaves': 127, 'lgbm_learning_rate': 0.1997246068685216, 'lgbm_n_estimators': 150, 'lgbm_reg_alpha': 0.0, 'lgbm_reg_lambda': 0.4}. Best is trial 31 with value: 0.999901.[0m
