[32m[I 2022-10-26 23:17:01,465][0m Trial 34 finished with value: 0.7218253808634624 and parameters: {'sgdc_loss': 'modified_huber', 'sgdc_penalty': 'elasticnet', 'sgdc_alpha': 0.0001297458496760555, 'sgdc_l1_ratio': 0.0, 'sgdc_learning_rate': 'adaptive', 'sgdc_eta0': 0.06688827864064716, 'sgdc_early_stopping': True, 'sgdc_validation_fraction': 0.25, 'sgdc_n_iter_no_change': 10}. Best is trial 39 with value: 0.780011.[0m
[32m[I 2022-10-26 23:17:12,919][0m Trial 41 finished with value: 0.14179401246469625 and parameters: {'sgdc_loss': 'modified_huber', 'sgdc_penalty': 'elasticnet', 'sgdc_alpha': 1.0053402743870245e-06, 'sgdc_l1_ratio': 0.4, 'sgdc_learning_rate': 'invscaling', 'sgdc_eta0': 0.0030471879377416767, 'sgdc_early_stopping': True, 'sgdc_validation_fraction': 0.25, 'sgdc_n_iter_no_change': 10}. Best is trial 39 with value: 0.780011.[0m
[32m[I 2022-10-26 23:17:22,079][0m Trial 42 finished with value: 0.1487956063038992 and parameters: {'sgdc_loss': 'hinge', 'sgdc_penalty': 'elasticnet', 'sgdc_alpha': 1.2978632870338064e-06, 'sgdc_l1_ratio': 0.4, 'sgdc_learning_rate': 'invscaling', 'sgdc_eta0': 0.07378359248519405, 'sgdc_early_stopping': True, 'sgdc_validation_fraction': 0.25, 'sgdc_n_iter_no_change': 10}. Best is trial 39 with value: 0.780011.[0m
[32m[I 2022-10-26 23:17:27,878][0m Trial 43 finished with value: 0.1481408545766343 and parameters: {'sgdc_loss': 'hinge', 'sgdc_penalty': 'elasticnet', 'sgdc_alpha': 1.7055583578898431e-06, 'sgdc_l1_ratio': 0.2, 'sgdc_learning_rate': 'invscaling', 'sgdc_eta0': 0.07207314790804896, 'sgdc_early_stopping': True, 'sgdc_validation_fraction': 0.25, 'sgdc_n_iter_no_change': 10}. Best is trial 39 with value: 0.780011.[0m
[32m[I 2022-10-26 23:17:29,021][0m Trial 36 finished with value: 0.7029954731336584 and parameters: {'sgdc_loss': 'modified_huber', 'sgdc_penalty': 'elasticnet', 'sgdc_alpha': 8.828903611810294e-05, 'sgdc_l1_ratio': 1.0, 'sgdc_learning_rate': 'adaptive', 'sgdc_eta0': 0.0071944190256477145, 'sgdc_early_stopping': True, 'sgdc_validation_fraction': 0.25, 'sgdc_n_iter_no_change': 10}. Best is trial 39 with value: 0.780011.[0m
[32m[I 2022-10-26 23:17:36,065][0m Trial 37 finished with value: 0.7159485959911789 and parameters: {'sgdc_loss': 'modified_huber', 'sgdc_penalty': 'elasticnet', 'sgdc_alpha': 9.88023282879683e-05, 'sgdc_l1_ratio': 1.0, 'sgdc_learning_rate': 'adaptive', 'sgdc_eta0': 0.0035422689486126007, 'sgdc_early_stopping': True, 'sgdc_validation_fraction': 0.25, 'sgdc_n_iter_no_change': 10}. Best is trial 39 with value: 0.780011.[0m
[32m[I 2022-10-26 23:17:38,111][0m Trial 38 finished with value: 0.6409717096563876 and parameters: {'sgdc_loss': 'modified_huber', 'sgdc_penalty': 'elasticnet', 'sgdc_alpha': 0.00010144499970405367, 'sgdc_l1_ratio': 0.2, 'sgdc_learning_rate': 'adaptive', 'sgdc_eta0': 0.005109153653968069, 'sgdc_early_stopping': True, 'sgdc_validation_fraction': 0.25, 'sgdc_n_iter_no_change': 10}. Best is trial 39 with value: 0.780011.[0m
[32m[I 2022-10-26 23:17:39,791][0m Trial 44 finished with value: 0.14905395700254365 and parameters: {'sgdc_loss': 'hinge', 'sgdc_penalty': 'elasticnet', 'sgdc_alpha': 2.587192993646784e-06, 'sgdc_l1_ratio': 0.2, 'sgdc_learning_rate': 'invscaling', 'sgdc_eta0': 0.05811435616014698, 'sgdc_early_stopping': True, 'sgdc_validation_fraction': 0.25, 'sgdc_n_iter_no_change': 10}. Best is trial 39 with value: 0.780011.[0m
[32m[I 2022-10-26 23:17:47,970][0m Trial 45 finished with value: 0.142900122173771 and parameters: {'sgdc_loss': 'hinge', 'sgdc_penalty': 'elasticnet', 'sgdc_alpha': 5.459567458980372e-05, 'sgdc_l1_ratio': 0.2, 'sgdc_learning_rate': 'invscaling', 'sgdc_eta0': 0.08741587683040387, 'sgdc_early_stopping': True, 'sgdc_validation_fraction': 0.25, 'sgdc_n_iter_no_change': 10}. Best is trial 39 with value: 0.780011.[0m
[32m[I 2022-10-26 23:18:08,104][0m Trial 46 finished with value: 0.7349652181321036 and parameters: {'sgdc_loss': 'hinge', 'sgdc_penalty': 'elasticnet', 'sgdc_alpha': 0.000349010903333334, 'sgdc_l1_ratio': 0.2, 'sgdc_learning_rate': 'invscaling', 'sgdc_eta0': 0.011093898567393626, 'sgdc_early_stopping': True, 'sgdc_validation_fraction': 0.25, 'sgdc_n_iter_no_change': 10}. Best is trial 39 with value: 0.780011.[0m
[32m[I 2022-10-26 23:18:15,260][0m Trial 47 finished with value: 0.1460048000635188 and parameters: {'sgdc_loss': 'hinge', 'sgdc_penalty': 'elasticnet', 'sgdc_alpha': 0.0003673586558627626, 'sgdc_l1_ratio': 0.2, 'sgdc_learning_rate': 'invscaling', 'sgdc_eta0': 0.010475081161792346, 'sgdc_early_stopping': True, 'sgdc_validation_fraction': 0.25, 'sgdc_n_iter_no_change': 10}. Best is trial 39 with value: 0.780011.[0m
[32m[I 2022-10-26 23:18:16,907][0m Trial 48 finished with value: 0.6951307894298789 and parameters: {'sgdc_loss': 'hinge', 'sgdc_penalty': 'elasticnet', 'sgdc_alpha': 4.07867692997387e-05, 'sgdc_l1_ratio': 0.2, 'sgdc_learning_rate': 'optimal', 'sgdc_eta0': 0.0021407173127673887, 'sgdc_early_stopping': True, 'sgdc_validation_fraction': 0.25, 'sgdc_n_iter_no_change': 10}. Best is trial 39 with value: 0.780011.[0m
[32m[I 2022-10-26 23:18:19,673][0m Trial 49 finished with value: 0.7189979272323848 and parameters: {'sgdc_loss': 'hinge', 'sgdc_penalty': 'elasticnet', 'sgdc_alpha': 0.0002434801861636947, 'sgdc_l1_ratio': 0.2, 'sgdc_learning_rate': 'optimal', 'sgdc_eta0': 0.0023762402539685727, 'sgdc_early_stopping': True, 'sgdc_validation_fraction': 0.25, 'sgdc_n_iter_no_change': 10}. Best is trial 39 with value: 0.780011.[0m
[32m[I 2022-10-26 23:18:20,601][0m Trial 52 finished with value: 0.7698108931634667 and parameters: {'sgdc_loss': 'hinge', 'sgdc_penalty': 'elasticnet', 'sgdc_alpha': 3.5050957646152866e-05, 'sgdc_l1_ratio': 0.6000000000000001, 'sgdc_learning_rate': 'optimal', 'sgdc_eta0': 0.011363418647409683, 'sgdc_early_stopping': True, 'sgdc_validation_fraction': 0.25, 'sgdc_n_iter_no_change': 10}. Best is trial 39 with value: 0.780011.[0m
[32m[I 2022-10-26 23:18:26,904][0m Trial 50 finished with value: 0.6951313414287491 and parameters: {'sgdc_loss': 'hinge', 'sgdc_penalty': 'elasticnet', 'sgdc_alpha': 2.0710503491678762e-05, 'sgdc_l1_ratio': 0.2, 'sgdc_learning_rate': 'optimal', 'sgdc_eta0': 0.010489498005596037, 'sgdc_early_stopping': True, 'sgdc_validation_fraction': 0.25, 'sgdc_n_iter_no_change': 10}. Best is trial 39 with value: 0.780011.[0m
[32m[I 2022-10-26 23:18:28,147][0m Trial 51 finished with value: 0.7184010541614062 and parameters: {'sgdc_loss': 'hinge', 'sgdc_penalty': 'elasticnet', 'sgdc_alpha': 0.00038294060487185027, 'sgdc_l1_ratio': 0.2, 'sgdc_learning_rate': 'optimal', 'sgdc_eta0': 0.012056448424201397, 'sgdc_early_stopping': True, 'sgdc_validation_fraction': 0.25, 'sgdc_n_iter_no_change': 10}. Best is trial 39 with value: 0.780011.[0m
[32m[I 2022-10-26 23:18:34,904][0m Trial 53 finished with value: 0.14889393438510118 and parameters: {'sgdc_loss': 'squared_hinge', 'sgdc_penalty': 'elasticnet', 'sgdc_alpha': 0.0002646837709629191, 'sgdc_l1_ratio': 0.6000000000000001, 'sgdc_learning_rate': 'optimal', 'sgdc_eta0': 0.011887004051433576, 'sgdc_early_stopping': True, 'sgdc_validation_fraction': 0.25, 'sgdc_n_iter_no_change': 10}. Best is trial 39 with value: 0.780011.[0m
[32m[I 2022-10-26 23:18:56,821][0m Trial 54 finished with value: 0.7320209913150733 and parameters: {'sgdc_loss': 'squared_hinge', 'sgdc_penalty': 'elasticnet', 'sgdc_alpha': 2.0867356913098196e-05, 'sgdc_l1_ratio': 0.4, 'sgdc_learning_rate': 'optimal', 'sgdc_eta0': 0.002548900397225016, 'sgdc_early_stopping': True, 'sgdc_validation_fraction': 0.25, 'sgdc_n_iter_no_change': 10}. Best is trial 39 with value: 0.780011.[0m
[32m[I 2022-10-26 23:18:57,145][0m Trial 55 finished with value: 0.7653717330125772 and parameters: {'sgdc_loss': 'squared_hinge', 'sgdc_penalty': 'elasticnet', 'sgdc_alpha': 2.224156400846435e-05, 'sgdc_l1_ratio': 0.6000000000000001, 'sgdc_learning_rate': 'optimal', 'sgdc_eta0': 0.0031393598909743576, 'sgdc_early_stopping': True, 'sgdc_validation_fraction': 0.25, 'sgdc_n_iter_no_change': 10}. Best is trial 39 with value: 0.780011.[0m
[32m[I 2022-10-26 23:19:01,297][0m Trial 56 finished with value: 0.146523882623152 and parameters: {'sgdc_loss': 'squared_hinge', 'sgdc_penalty': 'elasticnet', 'sgdc_alpha': 2.1900108233881795e-05, 'sgdc_l1_ratio': 0.6000000000000001, 'sgdc_learning_rate': 'optimal', 'sgdc_eta0': 0.6145325142207204, 'sgdc_early_stopping': True, 'sgdc_validation_fraction': 0.25, 'sgdc_n_iter_no_change': 10}. Best is trial 39 with value: 0.780011.[0m
[32m[I 2022-10-26 23:19:02,646][0m Trial 58 finished with value: 0.752778174780435 and parameters: {'sgdc_loss': 'squared_hinge', 'sgdc_penalty': 'elasticnet', 'sgdc_alpha': 2.0025344314582277e-05, 'sgdc_l1_ratio': 0.6000000000000001, 'sgdc_learning_rate': 'optimal', 'sgdc_eta0': 0.765157276927843, 'sgdc_early_stopping': True, 'sgdc_validation_fraction': 0.25, 'sgdc_n_iter_no_change': 10}. Best is trial 39 with value: 0.780011.[0m
[32m[I 2022-10-26 23:19:04,021][0m Trial 57 finished with value: 0.7769876278830534 and parameters: {'sgdc_loss': 'squared_hinge', 'sgdc_penalty': 'elasticnet', 'sgdc_alpha': 2.8145937019086287e-05, 'sgdc_l1_ratio': 0.6000000000000001, 'sgdc_learning_rate': 'optimal', 'sgdc_eta0': 1.1121679230087058, 'sgdc_early_stopping': True, 'sgdc_validation_fraction': 0.25, 'sgdc_n_iter_no_change': 10}. Best is trial 39 with value: 0.780011.[0m
[32m[I 2022-10-26 23:19:10,116][0m Trial 59 finished with value: 0.14857260863133953 and parameters: {'sgdc_loss': 'squared_hinge', 'sgdc_penalty': 'elasticnet', 'sgdc_alpha': 5.310914832942709e-06, 'sgdc_l1_ratio': 0.6000000000000001, 'sgdc_learning_rate': 'optimal', 'sgdc_eta0': 0.37316848331952623, 'sgdc_early_stopping': True, 'sgdc_validation_fraction': 0.25, 'sgdc_n_iter_no_change': 10}. Best is trial 39 with value: 0.780011.[0m
[32m[I 2022-10-26 23:19:11,826][0m Trial 60 finished with value: 0.1469108097296956 and parameters: {'sgdc_loss': 'squared_hinge', 'sgdc_penalty': 'elasticnet', 'sgdc_alpha': 5.059538732990033e-06, 'sgdc_l1_ratio': 0.6000000000000001, 'sgdc_learning_rate': 'optimal', 'sgdc_eta0': 6.951055247883465, 'sgdc_early_stopping': True, 'sgdc_validation_fraction': 0.25, 'sgdc_n_iter_no_change': 10}. Best is trial 39 with value: 0.780011.[0m
[32m[I 2022-10-26 23:19:20,219][0m Trial 61 finished with value: 0.1464393455570363 and parameters: {'sgdc_loss': 'squared_hinge', 'sgdc_penalty': 'elasticnet', 'sgdc_alpha': 6.099345471705934e-06, 'sgdc_l1_ratio': 0.6000000000000001, 'sgdc_learning_rate': 'optimal', 'sgdc_eta0': 0.4607954349006702, 'sgdc_early_stopping': True, 'sgdc_validation_fraction': 0.25, 'sgdc_n_iter_no_change': 10}. Best is trial 39 with value: 0.780011.[0m
[32m[I 2022-10-26 23:19:37,856][0m Trial 62 finished with value: 0.6788809488535639 and parameters: {'sgdc_loss': 'hinge', 'sgdc_penalty': 'elasticnet', 'sgdc_alpha': 160.3159440477932, 'sgdc_l1_ratio': 0.6000000000000001, 'sgdc_learning_rate': 'optimal', 'sgdc_eta0': 0.771915945545656, 'sgdc_early_stopping': True, 'sgdc_validation_fraction': 0.25, 'sgdc_n_iter_no_change': 10}. Best is trial 39 with value: 0.780011.[0m
[32m[I 2022-10-26 23:19:46,644][0m Trial 63 finished with value: 0.7644244841995532 and parameters: {'sgdc_loss': 'squared_hinge', 'sgdc_penalty': 'elasticnet', 'sgdc_alpha': 4.198090276651195e-06, 'sgdc_l1_ratio': 0.8, 'sgdc_learning_rate': 'optimal', 'sgdc_eta0': 0.3257518716156695, 'sgdc_early_stopping': True, 'sgdc_validation_fraction': 0.25, 'sgdc_n_iter_no_change': 10}. Best is trial 39 with value: 0.780011.[0m
[32m[I 2022-10-26 23:19:46,984][0m Trial 64 finished with value: 0.14035474472432716 and parameters: {'sgdc_loss': 'squared_hinge', 'sgdc_penalty': 'elasticnet', 'sgdc_alpha': 4.8080659284215495e-06, 'sgdc_l1_ratio': 0.6000000000000001, 'sgdc_learning_rate': 'optimal', 'sgdc_eta0': 828.8698348299292, 'sgdc_early_stopping': True, 'sgdc_validation_fraction': 0.25, 'sgdc_n_iter_no_change': 10}. Best is trial 39 with value: 0.780011.[0m
[32m[I 2022-10-26 23:19:50,302][0m Trial 67 finished with value: 0.7083837302722163 and parameters: {'sgdc_loss': 'squared_hinge', 'sgdc_penalty': 'elasticnet', 'sgdc_alpha': 0.0007976626033798251, 'sgdc_l1_ratio': 0.8, 'sgdc_learning_rate': 'optimal', 'sgdc_eta0': 5.144470233257231, 'sgdc_early_stopping': True, 'sgdc_validation_fraction': 0.25, 'sgdc_n_iter_no_change': 10}. Best is trial 39 with value: 0.780011.[0m
[32m[I 2022-10-26 23:19:51,015][0m Trial 65 finished with value: 0.7623638227751515 and parameters: {'sgdc_loss': 'squared_hinge', 'sgdc_penalty': 'elasticnet', 'sgdc_alpha': 4.8719161900972914e-06, 'sgdc_l1_ratio': 0.8, 'sgdc_learning_rate': 'optimal', 'sgdc_eta0': 4.855995412230683, 'sgdc_early_stopping': True, 'sgdc_validation_fraction': 0.25, 'sgdc_n_iter_no_change': 10}. Best is trial 39 with value: 0.780011.[0m
[32m[I 2022-10-26 23:19:52,956][0m Trial 66 finished with value: 0.7628986689660083 and parameters: {'sgdc_loss': 'squared_hinge', 'sgdc_penalty': 'elasticnet', 'sgdc_alpha': 4.023196273596541e-06, 'sgdc_l1_ratio': 0.8, 'sgdc_learning_rate': 'optimal', 'sgdc_eta0': 3.383028416192297, 'sgdc_early_stopping': True, 'sgdc_validation_fraction': 0.25, 'sgdc_n_iter_no_change': 10}. Best is trial 39 with value: 0.780011.[0m
[32m[I 2022-10-26 23:20:02,569][0m Trial 69 finished with value: 0.7136944213662466 and parameters: {'sgdc_loss': 'squared_hinge', 'sgdc_penalty': 'elasticnet', 'sgdc_alpha': 0.0008921974983333587, 'sgdc_l1_ratio': 0.8, 'sgdc_learning_rate': 'optimal', 'sgdc_eta0': 1.5211114274841002, 'sgdc_early_stopping': True, 'sgdc_validation_fraction': 0.25, 'sgdc_n_iter_no_change': 10}. Best is trial 39 with value: 0.780011.[0m
[32m[I 2022-10-26 23:20:04,118][0m Trial 68 finished with value: 0.8011636061613299 and parameters: {'sgdc_loss': 'squared_hinge', 'sgdc_penalty': 'elasticnet', 'sgdc_alpha': 3.1951416604576675e-05, 'sgdc_l1_ratio': 0.8, 'sgdc_learning_rate': 'optimal', 'sgdc_eta0': 1.745614917528762, 'sgdc_early_stopping': True, 'sgdc_validation_fraction': 0.25, 'sgdc_n_iter_no_change': 10}. Best is trial 68 with value: 0.801164.[0m
[32m[I 2022-10-26 23:20:45,578][0m Trial 71 finished with value: 0.25359778574481323 and parameters: {'sgdc_loss': 'squared_hinge', 'sgdc_penalty': 'elasticnet', 'sgdc_alpha': 3.6953454859582566e-05, 'sgdc_l1_ratio': 0.8, 'sgdc_learning_rate': 'optimal', 'sgdc_eta0': 1.5906524411899485, 'sgdc_early_stopping': True, 'sgdc_validation_fraction': 0.25, 'sgdc_n_iter_no_change': 10}. Best is trial 74 with value: 0.802711.[0m
[32m[I 2022-10-26 23:20:45,710][0m Trial 70 finished with value: 0.7131704443845059 and parameters: {'sgdc_loss': 'squared_hinge', 'sgdc_penalty': 'elasticnet', 'sgdc_alpha': 0.0009565853940456829, 'sgdc_l1_ratio': 0.8, 'sgdc_learning_rate': 'optimal', 'sgdc_eta0': 0.0010251535596482965, 'sgdc_early_stopping': True, 'sgdc_validation_fraction': 0.25, 'sgdc_n_iter_no_change': 10}. Best is trial 74 with value: 0.802711.[0m
[32m[I 2022-10-26 23:20:45,712][0m Trial 74 finished with value: 0.8027112289690306 and parameters: {'sgdc_loss': 'squared_hinge', 'sgdc_penalty': 'elasticnet', 'sgdc_alpha': 1.0152283509302542e-05, 'sgdc_l1_ratio': 0.8, 'sgdc_learning_rate': 'optimal', 'sgdc_eta0': 1.7263891681486117, 'sgdc_early_stopping': True, 'sgdc_validation_fraction': 0.25, 'sgdc_n_iter_no_change': 10}. Best is trial 74 with value: 0.802711.[0m
[32m[I 2022-10-26 23:20:45,902][0m Trial 72 finished with value: 0.2534530810480265 and parameters: {'sgdc_loss': 'squared_hinge', 'sgdc_penalty': 'elasticnet', 'sgdc_alpha': 3.7002136294911435e-05, 'sgdc_l1_ratio': 0.8, 'sgdc_learning_rate': 'optimal', 'sgdc_eta0': 2.1346903505733223, 'sgdc_early_stopping': True, 'sgdc_validation_fraction': 0.25, 'sgdc_n_iter_no_change': 10}. Best is trial 74 with value: 0.802711.[0m
[32m[I 2022-10-26 23:20:45,998][0m Trial 73 finished with value: 0.25436225577746485 and parameters: {'sgdc_loss': 'squared_hinge', 'sgdc_penalty': 'elasticnet', 'sgdc_alpha': 3.664895421736156e-05, 'sgdc_l1_ratio': 0.8, 'sgdc_learning_rate': 'optimal', 'sgdc_eta0': 1.9808154175207124, 'sgdc_early_stopping': True, 'sgdc_validation_fraction': 0.25, 'sgdc_n_iter_no_change': 10}. Best is trial 74 with value: 0.802711.[0m
[32m[I 2022-10-26 23:20:46,090][0m Trial 75 finished with value: 0.17057525684300992 and parameters: {'sgdc_loss': 'squared_hinge', 'sgdc_penalty': 'elasticnet', 'sgdc_alpha': 1.0569693577491902e-05, 'sgdc_l1_ratio': 0.8, 'sgdc_learning_rate': 'optimal', 'sgdc_eta0': 1.7241746290025066, 'sgdc_early_stopping': True, 'sgdc_validation_fraction': 0.25, 'sgdc_n_iter_no_change': 10}. Best is trial 74 with value: 0.802711.[0m
[32m[I 2022-10-26 23:21:09,079][0m Trial 77 finished with value: 0.17060061830881887 and parameters: {'sgdc_loss': 'squared_hinge', 'sgdc_penalty': 'elasticnet', 'sgdc_alpha': 1.0768917352526501e-05, 'sgdc_l1_ratio': 0.8, 'sgdc_learning_rate': 'optimal', 'sgdc_eta0': 2.7201175563797024, 'sgdc_early_stopping': True, 'sgdc_validation_fraction': 0.25, 'sgdc_n_iter_no_change': 10}. Best is trial 74 with value: 0.802711.[0m
[32m[I 2022-10-26 23:21:09,080][0m Trial 76 finished with value: 0.14128288448662873 and parameters: {'sgdc_loss': 'squared_hinge', 'sgdc_penalty': 'elasticnet', 'sgdc_alpha': 2.964047052060812e-06, 'sgdc_l1_ratio': 0.8, 'sgdc_learning_rate': 'optimal', 'sgdc_eta0': 3.8611373369583895, 'sgdc_early_stopping': True, 'sgdc_validation_fraction': 0.25, 'sgdc_n_iter_no_change': 10}. Best is trial 74 with value: 0.802711.[0m
[32m[I 2022-10-26 23:21:35,705][0m Trial 78 finished with value: 0.2534413453768308 and parameters: {'sgdc_loss': 'squared_hinge', 'sgdc_penalty': 'elasticnet', 'sgdc_alpha': 3.217358186816923e-06, 'sgdc_l1_ratio': 0.8, 'sgdc_learning_rate': 'optimal', 'sgdc_eta0': 11.77071103888412, 'sgdc_early_stopping': True, 'sgdc_validation_fraction': 0.25, 'sgdc_n_iter_no_change': 10}. Best is trial 74 with value: 0.802711.[0m
[32m[I 2022-10-26 23:21:35,799][0m Trial 83 finished with value: 0.17382545938103475 and parameters: {'sgdc_loss': 'squared_hinge', 'sgdc_penalty': 'elasticnet', 'sgdc_alpha': 2.337164957719947e-06, 'sgdc_l1_ratio': 0.8, 'sgdc_learning_rate': 'optimal', 'sgdc_eta0': 16.63886134839857, 'sgdc_early_stopping': True, 'sgdc_validation_fraction': 0.25, 'sgdc_n_iter_no_change': 10}. Best is trial 74 with value: 0.802711.[0m
[32m[I 2022-10-26 23:21:35,895][0m Trial 81 finished with value: 0.1740286106310788 and parameters: {'sgdc_loss': 'squared_hinge', 'sgdc_penalty': 'elasticnet', 'sgdc_alpha': 2.2517400430156494e-06, 'sgdc_l1_ratio': 0.8, 'sgdc_learning_rate': 'optimal', 'sgdc_eta0': 9.114810660937508, 'sgdc_early_stopping': True, 'sgdc_validation_fraction': 0.25, 'sgdc_n_iter_no_change': 10}. Best is trial 74 with value: 0.802711.[0m
[32m[I 2022-10-26 23:21:35,901][0m Trial 79 finished with value: 0.14727390136499924 and parameters: {'sgdc_loss': 'squared_hinge', 'sgdc_penalty': 'elasticnet', 'sgdc_alpha': 3.1355548967590978e-06, 'sgdc_l1_ratio': 0.8, 'sgdc_learning_rate': 'optimal', 'sgdc_eta0': 11.883716358452046, 'sgdc_early_stopping': True, 'sgdc_validation_fraction': 0.25, 'sgdc_n_iter_no_change': 10}. Best is trial 74 with value: 0.802711.[0m
[32m[I 2022-10-26 23:21:35,902][0m Trial 80 finished with value: 0.8013158457673195 and parameters: {'sgdc_loss': 'squared_hinge', 'sgdc_penalty': 'elasticnet', 'sgdc_alpha': 2.3488268809552435e-06, 'sgdc_l1_ratio': 0.8, 'sgdc_learning_rate': 'optimal', 'sgdc_eta0': 3.4697318139724556, 'sgdc_early_stopping': True, 'sgdc_validation_fraction': 0.25, 'sgdc_n_iter_no_change': 10}. Best is trial 74 with value: 0.802711.[0m
[32m[I 2022-10-26 23:21:35,992][0m Trial 82 finished with value: 0.7969324115937657 and parameters: {'sgdc_loss': 'squared_hinge', 'sgdc_penalty': 'elasticnet', 'sgdc_alpha': 2.4718013983110546e-06, 'sgdc_l1_ratio': 0.8, 'sgdc_learning_rate': 'optimal', 'sgdc_eta0': 15.974128331246392, 'sgdc_early_stopping': True, 'sgdc_validation_fraction': 0.25, 'sgdc_n_iter_no_change': 10}. Best is trial 74 with value: 0.802711.[0m
[32m[I 2022-10-26 23:22:50,639][0m Trial 84 finished with value: 0.7645619922821281 and parameters: {'sgdc_loss': 'log', 'sgdc_penalty': 'elasticnet', 'sgdc_alpha': 3.020357995593575e-06, 'sgdc_l1_ratio': 1.0, 'sgdc_learning_rate': 'optimal', 'sgdc_eta0': 11.725825537434606, 'sgdc_early_stopping': True, 'sgdc_validation_fraction': 0.25, 'sgdc_n_iter_no_change': 10}. Best is trial 74 with value: 0.802711.[0m
[32m[I 2022-10-26 23:22:50,646][0m Trial 85 finished with value: 0.13449126900071923 and parameters: {'sgdc_loss': 'log', 'sgdc_penalty': 'elasticnet', 'sgdc_alpha': 7.827389262864482e-06, 'sgdc_l1_ratio': 1.0, 'sgdc_learning_rate': 'optimal', 'sgdc_eta0': 15.933209431191889, 'sgdc_early_stopping': True, 'sgdc_validation_fraction': 0.25, 'sgdc_n_iter_no_change': 10}. Best is trial 74 with value: 0.802711.[0m
[32m[I 2022-10-26 23:22:50,647][0m Trial 88 finished with value: 0.6986155981903215 and parameters: {'sgdc_loss': 'log', 'sgdc_penalty': 'elasticnet', 'sgdc_alpha': 9.624852230850626e-06, 'sgdc_l1_ratio': 1.0, 'sgdc_learning_rate': 'constant', 'sgdc_eta0': 93.35129947020148, 'sgdc_early_stopping': True, 'sgdc_validation_fraction': 0.25, 'sgdc_n_iter_no_change': 10}. Best is trial 74 with value: 0.802711.[0m
[32m[I 2022-10-26 23:22:50,731][0m Trial 91 finished with value: 0.6986475172677716 and parameters: {'sgdc_loss': 'log', 'sgdc_penalty': 'elasticnet', 'sgdc_alpha': 7.930581888953973e-06, 'sgdc_l1_ratio': 1.0, 'sgdc_learning_rate': 'constant', 'sgdc_eta0': 1.1376615463272186, 'sgdc_early_stopping': True, 'sgdc_validation_fraction': 0.25, 'sgdc_n_iter_no_change': 10}. Best is trial 74 with value: 0.802711.[0m
