[32m[I 2022-10-26 22:59:28,123][0m Trial 78 finished with value: 0.6327730747535205 and parameters: {'rusbc_n_estimators': 50, 'rusbc_learning_rate': 0.3093577448831185, 'rusbc_sampling_strategy': 'all'}. Best is trial 35 with value: 0.810593.[0m
[32m[I 2022-10-26 22:59:30,829][0m Trial 79 finished with value: 0.7761696721360145 and parameters: {'rusbc_n_estimators': 50, 'rusbc_learning_rate': 0.32288328604252514, 'rusbc_sampling_strategy': 'all'}. Best is trial 35 with value: 0.810593.[0m
[32m[I 2022-10-26 22:59:49,482][0m Trial 80 finished with value: 0.728325546953771 and parameters: {'rusbc_n_estimators': 50, 'rusbc_learning_rate': 0.6367792593821165, 'rusbc_sampling_strategy': 'all'}. Best is trial 35 with value: 0.810593.[0m
[32m[I 2022-10-26 23:00:04,608][0m Trial 81 finished with value: 0.6565371084014769 and parameters: {'rusbc_n_estimators': 50, 'rusbc_learning_rate': 0.5833751783536678, 'rusbc_sampling_strategy': 'all'}. Best is trial 35 with value: 0.810593.[0m
[32m[I 2022-10-26 23:00:04,609][0m Trial 72 finished with value: 0.719895264651237 and parameters: {'rusbc_n_estimators': 100, 'rusbc_learning_rate': 0.1815362053306668, 'rusbc_sampling_strategy': 'not majority'}. Best is trial 35 with value: 0.810593.[0m
[32m[I 2022-10-26 23:00:09,959][0m Trial 82 finished with value: 0.5428331315795911 and parameters: {'rusbc_n_estimators': 50, 'rusbc_learning_rate': 0.6903172356742723, 'rusbc_sampling_strategy': 'all'}. Best is trial 35 with value: 0.810593.[0m
[32m[I 2022-10-26 23:00:12,374][0m Trial 83 finished with value: 0.23973436505526008 and parameters: {'rusbc_n_estimators': 50, 'rusbc_learning_rate': 0.6330378478395466, 'rusbc_sampling_strategy': 'all'}. Best is trial 35 with value: 0.810593.[0m
[32m[I 2022-10-26 23:00:15,367][0m Trial 84 finished with value: 0.2489821195023336 and parameters: {'rusbc_n_estimators': 50, 'rusbc_learning_rate': 0.6403315897836256, 'rusbc_sampling_strategy': 'all'}. Best is trial 35 with value: 0.810593.[0m
[32m[I 2022-10-26 23:01:13,760][0m Trial 85 finished with value: 0.24887965384060043 and parameters: {'rusbc_n_estimators': 50, 'rusbc_learning_rate': 0.6663306638267525, 'rusbc_sampling_strategy': 'all'}. Best is trial 35 with value: 0.810593.[0m
[32m[I 2022-10-26 23:01:16,435][0m Trial 86 finished with value: 0.7491142152663242 and parameters: {'rusbc_n_estimators': 50, 'rusbc_learning_rate': 0.6446979004811784, 'rusbc_sampling_strategy': 'all'}. Best is trial 35 with value: 0.810593.[0m
[32m[I 2022-10-26 23:01:34,513][0m Trial 87 finished with value: 0.16250578459331536 and parameters: {'rusbc_n_estimators': 50, 'rusbc_learning_rate': 0.6030912623137212, 'rusbc_sampling_strategy': 'all'}. Best is trial 35 with value: 0.810593.[0m
[32m[I 2022-10-26 23:01:50,288][0m Trial 88 finished with value: 0.47210082044637286 and parameters: {'rusbc_n_estimators': 50, 'rusbc_learning_rate': 0.3752485429241389, 'rusbc_sampling_strategy': 'all'}. Best is trial 35 with value: 0.810593.[0m
[32m[I 2022-10-26 23:01:51,090][0m Trial 89 finished with value: 0.456890857106337 and parameters: {'rusbc_n_estimators': 50, 'rusbc_learning_rate': 0.347448443609781, 'rusbc_sampling_strategy': 'all'}. Best is trial 35 with value: 0.810593.[0m
[32m[I 2022-10-26 23:01:57,201][0m Trial 90 finished with value: 0.6088246725391112 and parameters: {'rusbc_n_estimators': 50, 'rusbc_learning_rate': 0.32018861671145593, 'rusbc_sampling_strategy': 'all'}. Best is trial 35 with value: 0.810593.[0m
[32m[I 2022-10-26 23:02:00,139][0m Trial 91 finished with value: 0.6961555535690971 and parameters: {'rusbc_n_estimators': 50, 'rusbc_learning_rate': 0.41540354784254124, 'rusbc_sampling_strategy': 'all'}. Best is trial 35 with value: 0.810593.[0m
[32m[I 2022-10-26 23:02:03,350][0m Trial 92 finished with value: 0.45693271080773346 and parameters: {'rusbc_n_estimators': 50, 'rusbc_learning_rate': 0.364618413103292, 'rusbc_sampling_strategy': 'all'}. Best is trial 35 with value: 0.810593.[0m
[32m[I 2022-10-26 23:02:53,939][0m Trial 93 finished with value: 0.6527835526130034 and parameters: {'rusbc_n_estimators': 50, 'rusbc_learning_rate': 0.27539612649103373, 'rusbc_sampling_strategy': 'all'}. Best is trial 35 with value: 0.810593.[0m
[32m[I 2022-10-26 23:02:55,520][0m Trial 94 finished with value: 0.6088246725391112 and parameters: {'rusbc_n_estimators': 50, 'rusbc_learning_rate': 0.3191791766280922, 'rusbc_sampling_strategy': 'all'}. Best is trial 35 with value: 0.810593.[0m
[32m[I 2022-10-26 23:03:06,877][0m Trial 95 finished with value: 0.47193545208483495 and parameters: {'rusbc_n_estimators': 50, 'rusbc_learning_rate': 0.3839295450125086, 'rusbc_sampling_strategy': 'all'}. Best is trial 35 with value: 0.810593.[0m
[32m[I 2022-10-26 23:03:13,667][0m Trial 96 finished with value: 0.0034219756294838915 and parameters: {'rusbc_n_estimators': 50, 'rusbc_learning_rate': 0.00034088665131905093, 'rusbc_sampling_strategy': 'all'}. Best is trial 35 with value: 0.810593.[0m
[32m[I 2022-10-26 23:03:14,279][0m Trial 97 finished with value: 0.0034219756294838915 and parameters: {'rusbc_n_estimators': 50, 'rusbc_learning_rate': 0.0002844191864430329, 'rusbc_sampling_strategy': 'all'}. Best is trial 35 with value: 0.810593.[0m
[32m[I 2022-10-26 23:03:16,413][0m Trial 98 finished with value: 0.18259283931098158 and parameters: {'rusbc_n_estimators': 50, 'rusbc_learning_rate': 0.12914788424462587, 'rusbc_sampling_strategy': 'all'}. Best is trial 35 with value: 0.810593.[0m
[32m[I 2022-10-26 23:03:17,182][0m Trial 99 finished with value: 0.1699959526657326 and parameters: {'rusbc_n_estimators': 50, 'rusbc_learning_rate': 0.12232354418787968, 'rusbc_sampling_strategy': 'all'}. Best is trial 35 with value: 0.810593.[0m
[32m[I 2022-10-26 23:03:17,261][0m Study finished.[0m
[32m[I 2022-10-26 23:03:17,276][0m --------------------------------------------------------------------------------[0m
[32m[I 2022-10-26 23:03:17,277][0m --------------------             SGDClassifier              --------------------[0m
[32m[I 2022-10-26 23:03:17,277][0m --------------------------------------------------------------------------------[0m
[32m[I 2022-10-26 23:03:17,314][0m A new study created in RDB with name: SGDClassifier_c963b74b[0m
[32m[I 2022-10-26 23:03:17,321][0m Study started.[0m
[32m[I 2022-10-26 23:03:58,947][0m Trial 5 finished with value: 0.37489711355927424 and parameters: {'sgdc_loss': 'hinge', 'sgdc_penalty': 'elasticnet', 'sgdc_alpha': 0.07360455632834673, 'sgdc_l1_ratio': 0.4, 'sgdc_learning_rate': 'constant', 'sgdc_eta0': 0.6213424066020979, 'sgdc_early_stopping': True, 'sgdc_validation_fraction': 0.25, 'sgdc_n_iter_no_change': 10}. Best is trial 5 with value: 0.374897.[0m
[32m[I 2022-10-26 23:04:00,265][0m Trial 3 finished with value: 0.6950742018218817 and parameters: {'sgdc_loss': 'log', 'sgdc_penalty': 'elasticnet', 'sgdc_alpha': 359.99006418481014, 'sgdc_l1_ratio': 1.0, 'sgdc_learning_rate': 'optimal', 'sgdc_eta0': 2.157416682026042, 'sgdc_early_stopping': True, 'sgdc_validation_fraction': 0.25, 'sgdc_n_iter_no_change': 10}. Best is trial 3 with value: 0.695074.[0m
[32m[I 2022-10-26 23:04:00,817][0m Trial 6 finished with value: 0.6950742018218817 and parameters: {'sgdc_loss': 'squared_hinge', 'sgdc_penalty': 'elasticnet', 'sgdc_alpha': 16.434931307413343, 'sgdc_l1_ratio': 0.8, 'sgdc_learning_rate': 'constant', 'sgdc_eta0': 41.973892949007585, 'sgdc_early_stopping': True, 'sgdc_validation_fraction': 0.25, 'sgdc_n_iter_no_change': 10}. Best is trial 3 with value: 0.695074.[0m
[32m[I 2022-10-26 23:04:04,643][0m Trial 0 finished with value: 0.7218180332413638 and parameters: {'sgdc_loss': 'hinge', 'sgdc_penalty': 'elasticnet', 'sgdc_alpha': 40.461900896579955, 'sgdc_l1_ratio': 0.2, 'sgdc_learning_rate': 'optimal', 'sgdc_eta0': 0.006037298808164769, 'sgdc_early_stopping': True, 'sgdc_validation_fraction': 0.25, 'sgdc_n_iter_no_change': 10}. Best is trial 0 with value: 0.721818.[0m
[32m[I 2022-10-26 23:04:11,525][0m Trial 1 finished with value: 0.6635358670713516 and parameters: {'sgdc_loss': 'hinge', 'sgdc_penalty': 'elasticnet', 'sgdc_alpha': 0.4347727384129263, 'sgdc_l1_ratio': 0.2, 'sgdc_learning_rate': 'invscaling', 'sgdc_eta0': 0.2315241113552299, 'sgdc_early_stopping': True, 'sgdc_validation_fraction': 0.25, 'sgdc_n_iter_no_change': 10}. Best is trial 0 with value: 0.721818.[0m
[32m[I 2022-10-26 23:04:12,915][0m Trial 7 finished with value: 0.7284794379550598 and parameters: {'sgdc_loss': 'log', 'sgdc_penalty': 'elasticnet', 'sgdc_alpha': 7.6726390932511, 'sgdc_l1_ratio': 0.2, 'sgdc_learning_rate': 'constant', 'sgdc_eta0': 0.005155584204948137, 'sgdc_early_stopping': True, 'sgdc_validation_fraction': 0.25, 'sgdc_n_iter_no_change': 10}. Best is trial 7 with value: 0.728479.[0m
[32m[I 2022-10-26 23:04:15,270][0m Trial 2 finished with value: 0.3612826532251817 and parameters: {'sgdc_loss': 'log', 'sgdc_penalty': 'elasticnet', 'sgdc_alpha': 8.642735450844516, 'sgdc_l1_ratio': 0.8, 'sgdc_learning_rate': 'invscaling', 'sgdc_eta0': 1.0266905709214502, 'sgdc_early_stopping': True, 'sgdc_validation_fraction': 0.25, 'sgdc_n_iter_no_change': 10}. Best is trial 7 with value: 0.728479.[0m
[32m[I 2022-10-26 23:04:46,093][0m Trial 8 finished with value: 0.13988341731944554 and parameters: {'sgdc_loss': 'squared_hinge', 'sgdc_penalty': 'elasticnet', 'sgdc_alpha': 1.1429582438524335, 'sgdc_l1_ratio': 0.6000000000000001, 'sgdc_learning_rate': 'optimal', 'sgdc_eta0': 0.637062940804518, 'sgdc_early_stopping': True, 'sgdc_validation_fraction': 0.25, 'sgdc_n_iter_no_change': 10}. Best is trial 7 with value: 0.728479.[0m
[32m[I 2022-10-26 23:04:47,308][0m Trial 9 finished with value: 0.1757192762229191 and parameters: {'sgdc_loss': 'hinge', 'sgdc_penalty': 'elasticnet', 'sgdc_alpha': 1.0874708907773793e-05, 'sgdc_l1_ratio': 0.8, 'sgdc_learning_rate': 'optimal', 'sgdc_eta0': 2.0836535347648475, 'sgdc_early_stopping': True, 'sgdc_validation_fraction': 0.25, 'sgdc_n_iter_no_change': 10}. Best is trial 7 with value: 0.728479.[0m
[32m[I 2022-10-26 23:04:52,698][0m Trial 14 finished with value: 0.6950889082692254 and parameters: {'sgdc_loss': 'squared_hinge', 'sgdc_penalty': 'elasticnet', 'sgdc_alpha': 0.000389341518309384, 'sgdc_l1_ratio': 0.6000000000000001, 'sgdc_learning_rate': 'constant', 'sgdc_eta0': 311.35759021771275, 'sgdc_early_stopping': True, 'sgdc_validation_fraction': 0.25, 'sgdc_n_iter_no_change': 10}. Best is trial 7 with value: 0.728479.[0m
[32m[I 2022-10-26 23:04:54,959][0m Trial 12 finished with value: 0.35928254534847154 and parameters: {'sgdc_loss': 'modified_huber', 'sgdc_penalty': 'elasticnet', 'sgdc_alpha': 98.19641024417699, 'sgdc_l1_ratio': 0.6000000000000001, 'sgdc_learning_rate': 'invscaling', 'sgdc_eta0': 29.963507197318457, 'sgdc_early_stopping': True, 'sgdc_validation_fraction': 0.25, 'sgdc_n_iter_no_change': 10}. Best is trial 7 with value: 0.728479.[0m
[32m[I 2022-10-26 23:05:30,884][0m Trial 15 finished with value: 0.6961716250685213 and parameters: {'sgdc_loss': 'log', 'sgdc_penalty': 'elasticnet', 'sgdc_alpha': 0.09060286454691606, 'sgdc_l1_ratio': 0.4, 'sgdc_learning_rate': 'constant', 'sgdc_eta0': 0.2078439041152229, 'sgdc_early_stopping': True, 'sgdc_validation_fraction': 0.25, 'sgdc_n_iter_no_change': 10}. Best is trial 7 with value: 0.728479.[0m
[32m[I 2022-10-26 23:06:31,620][0m Trial 4 finished with value: 0.7370114000943598 and parameters: {'sgdc_loss': 'hinge', 'sgdc_penalty': 'elasticnet', 'sgdc_alpha': 51.63739621167057, 'sgdc_l1_ratio': 0.4, 'sgdc_learning_rate': 'adaptive', 'sgdc_eta0': 0.002023319014191085, 'sgdc_early_stopping': True, 'sgdc_validation_fraction': 0.25, 'sgdc_n_iter_no_change': 10}. Best is trial 4 with value: 0.737011.[0m
[32m[I 2022-10-26 23:07:44,773][0m Trial 10 finished with value: 0.6976837464941859 and parameters: {'sgdc_loss': 'squared_hinge', 'sgdc_penalty': 'elasticnet', 'sgdc_alpha': 9.923170496722097e-06, 'sgdc_l1_ratio': 0.2, 'sgdc_learning_rate': 'adaptive', 'sgdc_eta0': 0.0039237559951041286, 'sgdc_early_stopping': True, 'sgdc_validation_fraction': 0.25, 'sgdc_n_iter_no_change': 10}. Best is trial 4 with value: 0.737011.[0m
[32m[I 2022-10-26 23:08:04,524][0m Trial 17 finished with value: 0.604956493887686 and parameters: {'sgdc_loss': 'modified_huber', 'sgdc_penalty': 'elasticnet', 'sgdc_alpha': 0.0008475390420353598, 'sgdc_l1_ratio': 0.0, 'sgdc_learning_rate': 'adaptive', 'sgdc_eta0': 0.001173930168715569, 'sgdc_early_stopping': True, 'sgdc_validation_fraction': 0.25, 'sgdc_n_iter_no_change': 10}. Best is trial 4 with value: 0.737011.[0m
[32m[I 2022-10-26 23:08:39,533][0m Trial 19 finished with value: 0.7468956854315344 and parameters: {'sgdc_loss': 'modified_huber', 'sgdc_penalty': 'elasticnet', 'sgdc_alpha': 0.001965637796649377, 'sgdc_l1_ratio': 0.0, 'sgdc_learning_rate': 'adaptive', 'sgdc_eta0': 0.0012175788004837622, 'sgdc_early_stopping': True, 'sgdc_validation_fraction': 0.25, 'sgdc_n_iter_no_change': 10}. Best is trial 19 with value: 0.746896.[0m
[32m[I 2022-10-26 23:08:42,062][0m Trial 18 finished with value: 0.7076630928192227 and parameters: {'sgdc_loss': 'log', 'sgdc_penalty': 'elasticnet', 'sgdc_alpha': 0.006211544503132814, 'sgdc_l1_ratio': 0.0, 'sgdc_learning_rate': 'adaptive', 'sgdc_eta0': 0.0012812953491066923, 'sgdc_early_stopping': True, 'sgdc_validation_fraction': 0.25, 'sgdc_n_iter_no_change': 10}. Best is trial 19 with value: 0.746896.[0m
[32m[I 2022-10-26 23:09:21,141][0m Trial 16 finished with value: 0.636220467782388 and parameters: {'sgdc_loss': 'modified_huber', 'sgdc_penalty': 'elasticnet', 'sgdc_alpha': 1.2504572781506767e-05, 'sgdc_l1_ratio': 0.6000000000000001, 'sgdc_learning_rate': 'adaptive', 'sgdc_eta0': 0.15210385796150608, 'sgdc_early_stopping': True, 'sgdc_validation_fraction': 0.25, 'sgdc_n_iter_no_change': 10}. Best is trial 19 with value: 0.746896.[0m
[32m[I 2022-10-26 23:09:41,704][0m Trial 11 finished with value: 0.7000603240358915 and parameters: {'sgdc_loss': 'log', 'sgdc_penalty': 'elasticnet', 'sgdc_alpha': 0.2046890553531225, 'sgdc_l1_ratio': 0.8, 'sgdc_learning_rate': 'adaptive', 'sgdc_eta0': 0.1877274063895615, 'sgdc_early_stopping': True, 'sgdc_validation_fraction': 0.25, 'sgdc_n_iter_no_change': 10}. Best is trial 19 with value: 0.746896.[0m
[32m[I 2022-10-26 23:09:42,949][0m Trial 20 finished with value: 0.39663148548577243 and parameters: {'sgdc_loss': 'modified_huber', 'sgdc_penalty': 'elasticnet', 'sgdc_alpha': 0.0012569683137634074, 'sgdc_l1_ratio': 0.0, 'sgdc_learning_rate': 'adaptive', 'sgdc_eta0': 0.0013154236916878364, 'sgdc_early_stopping': True, 'sgdc_validation_fraction': 0.25, 'sgdc_n_iter_no_change': 10}. Best is trial 19 with value: 0.746896.[0m
[32m[I 2022-10-26 23:10:53,223][0m Trial 21 finished with value: 0.7051111860724005 and parameters: {'sgdc_loss': 'modified_huber', 'sgdc_penalty': 'elasticnet', 'sgdc_alpha': 0.0021998076465045606, 'sgdc_l1_ratio': 0.0, 'sgdc_learning_rate': 'adaptive', 'sgdc_eta0': 0.0016043927254795788, 'sgdc_early_stopping': True, 'sgdc_validation_fraction': 0.25, 'sgdc_n_iter_no_change': 10}. Best is trial 19 with value: 0.746896.[0m
[32m[I 2022-10-26 23:11:12,730][0m Trial 13 finished with value: 0.6966150540775934 and parameters: {'sgdc_loss': 'log', 'sgdc_penalty': 'elasticnet', 'sgdc_alpha': 1.0016737080904612, 'sgdc_l1_ratio': 0.2, 'sgdc_learning_rate': 'adaptive', 'sgdc_eta0': 24.212963270963886, 'sgdc_early_stopping': True, 'sgdc_validation_fraction': 0.25, 'sgdc_n_iter_no_change': 10}. Best is trial 19 with value: 0.746896.[0m
[32m[I 2022-10-26 23:11:31,631][0m Trial 28 finished with value: 0.14043963572235707 and parameters: {'sgdc_loss': 'hinge', 'sgdc_penalty': 'elasticnet', 'sgdc_alpha': 2.2897544349682657, 'sgdc_l1_ratio': 0.2, 'sgdc_learning_rate': 'constant', 'sgdc_eta0': 0.022421998873610814, 'sgdc_early_stopping': True, 'sgdc_validation_fraction': 0.25, 'sgdc_n_iter_no_change': 10}. Best is trial 19 with value: 0.746896.[0m
[32m[I 2022-10-26 23:11:50,834][0m Trial 29 finished with value: 0.6950742018218817 and parameters: {'sgdc_loss': 'hinge', 'sgdc_penalty': 'elasticnet', 'sgdc_alpha': 866.7293800868907, 'sgdc_l1_ratio': 0.4, 'sgdc_learning_rate': 'constant', 'sgdc_eta0': 0.0189236858648307, 'sgdc_early_stopping': True, 'sgdc_validation_fraction': 0.25, 'sgdc_n_iter_no_change': 10}. Best is trial 19 with value: 0.746896.[0m
[32m[I 2022-10-26 23:12:11,231][0m Trial 30 finished with value: 0.6950742018218817 and parameters: {'sgdc_loss': 'hinge', 'sgdc_penalty': 'elasticnet', 'sgdc_alpha': 788.2386169373302, 'sgdc_l1_ratio': 0.4, 'sgdc_learning_rate': 'constant', 'sgdc_eta0': 0.021024287020108837, 'sgdc_early_stopping': True, 'sgdc_validation_fraction': 0.25, 'sgdc_n_iter_no_change': 10}. Best is trial 19 with value: 0.746896.[0m
[32m[I 2022-10-26 23:12:49,204][0m Trial 22 finished with value: 0.7066873785755812 and parameters: {'sgdc_loss': 'log', 'sgdc_penalty': 'elasticnet', 'sgdc_alpha': 494.6538303263016, 'sgdc_l1_ratio': 0.0, 'sgdc_learning_rate': 'adaptive', 'sgdc_eta0': 0.024849621193697557, 'sgdc_early_stopping': True, 'sgdc_validation_fraction': 0.25, 'sgdc_n_iter_no_change': 10}. Best is trial 19 with value: 0.746896.[0m
[32m[I 2022-10-26 23:12:52,655][0m Trial 24 finished with value: 0.7509278708809672 and parameters: {'sgdc_loss': 'modified_huber', 'sgdc_penalty': 'elasticnet', 'sgdc_alpha': 0.00012328821136825318, 'sgdc_l1_ratio': 0.0, 'sgdc_learning_rate': 'adaptive', 'sgdc_eta0': 0.029790981205937296, 'sgdc_early_stopping': True, 'sgdc_validation_fraction': 0.25, 'sgdc_n_iter_no_change': 10}. Best is trial 24 with value: 0.750928.[0m
[32m[I 2022-10-26 23:12:55,774][0m Trial 23 finished with value: 0.7195651801805186 and parameters: {'sgdc_loss': 'modified_huber', 'sgdc_penalty': 'elasticnet', 'sgdc_alpha': 0.0032485042418690015, 'sgdc_l1_ratio': 0.0, 'sgdc_learning_rate': 'adaptive', 'sgdc_eta0': 0.03433949524242168, 'sgdc_early_stopping': True, 'sgdc_validation_fraction': 0.25, 'sgdc_n_iter_no_change': 10}. Best is trial 24 with value: 0.750928.[0m
[32m[I 2022-10-26 23:13:41,542][0m Trial 25 finished with value: 0.7205578534850936 and parameters: {'sgdc_loss': 'modified_huber', 'sgdc_penalty': 'elasticnet', 'sgdc_alpha': 0.003247795111350433, 'sgdc_l1_ratio': 0.0, 'sgdc_learning_rate': 'adaptive', 'sgdc_eta0': 0.031051392812811215, 'sgdc_early_stopping': True, 'sgdc_validation_fraction': 0.25, 'sgdc_n_iter_no_change': 10}. Best is trial 24 with value: 0.750928.[0m
[32m[I 2022-10-26 23:13:54,861][0m Trial 26 finished with value: 0.7053136876979976 and parameters: {'sgdc_loss': 'modified_huber', 'sgdc_penalty': 'elasticnet', 'sgdc_alpha': 0.006553412919425559, 'sgdc_l1_ratio': 0.0, 'sgdc_learning_rate': 'adaptive', 'sgdc_eta0': 0.03037663207702409, 'sgdc_early_stopping': True, 'sgdc_validation_fraction': 0.25, 'sgdc_n_iter_no_change': 10}. Best is trial 24 with value: 0.750928.[0m
[32m[I 2022-10-26 23:13:59,530][0m Trial 27 finished with value: 0.7045757527723189 and parameters: {'sgdc_loss': 'modified_huber', 'sgdc_penalty': 'elasticnet', 'sgdc_alpha': 970.8826343108568, 'sgdc_l1_ratio': 0.0, 'sgdc_learning_rate': 'adaptive', 'sgdc_eta0': 0.02982658794028158, 'sgdc_early_stopping': True, 'sgdc_validation_fraction': 0.25, 'sgdc_n_iter_no_change': 10}. Best is trial 24 with value: 0.750928.[0m
[32m[I 2022-10-26 23:15:57,777][0m Trial 32 finished with value: 0.725238003897479 and parameters: {'sgdc_loss': 'modified_huber', 'sgdc_penalty': 'elasticnet', 'sgdc_alpha': 0.022005398775514117, 'sgdc_l1_ratio': 0.2, 'sgdc_learning_rate': 'adaptive', 'sgdc_eta0': 0.006682129868784209, 'sgdc_early_stopping': True, 'sgdc_validation_fraction': 0.25, 'sgdc_n_iter_no_change': 10}. Best is trial 24 with value: 0.750928.[0m
[32m[I 2022-10-26 23:16:07,796][0m Trial 31 finished with value: 0.7459213098178404 and parameters: {'sgdc_loss': 'modified_huber', 'sgdc_penalty': 'elasticnet', 'sgdc_alpha': 9.468655011051227e-05, 'sgdc_l1_ratio': 0.4, 'sgdc_learning_rate': 'adaptive', 'sgdc_eta0': 0.021973398514130122, 'sgdc_early_stopping': True, 'sgdc_validation_fraction': 0.25, 'sgdc_n_iter_no_change': 10}. Best is trial 24 with value: 0.750928.[0m
[32m[I 2022-10-26 23:16:27,601][0m Trial 35 finished with value: 0.7029509248864083 and parameters: {'sgdc_loss': 'modified_huber', 'sgdc_penalty': 'elasticnet', 'sgdc_alpha': 0.00011410255728926623, 'sgdc_l1_ratio': 1.0, 'sgdc_learning_rate': 'adaptive', 'sgdc_eta0': 0.005860743739253154, 'sgdc_early_stopping': True, 'sgdc_validation_fraction': 0.25, 'sgdc_n_iter_no_change': 10}. Best is trial 24 with value: 0.750928.[0m
[32m[I 2022-10-26 23:16:35,533][0m Trial 33 finished with value: 0.7240271230564143 and parameters: {'sgdc_loss': 'modified_huber', 'sgdc_penalty': 'elasticnet', 'sgdc_alpha': 0.022526577305492443, 'sgdc_l1_ratio': 0.2, 'sgdc_learning_rate': 'adaptive', 'sgdc_eta0': 0.004652433824619011, 'sgdc_early_stopping': True, 'sgdc_validation_fraction': 0.25, 'sgdc_n_iter_no_change': 10}. Best is trial 24 with value: 0.750928.[0m
[32m[I 2022-10-26 23:16:42,172][0m Trial 39 finished with value: 0.7800107590584093 and parameters: {'sgdc_loss': 'hinge', 'sgdc_penalty': 'elasticnet', 'sgdc_alpha': 0.00011292923338905829, 'sgdc_l1_ratio': 0.2, 'sgdc_learning_rate': 'invscaling', 'sgdc_eta0': 0.004616863288282416, 'sgdc_early_stopping': True, 'sgdc_validation_fraction': 0.25, 'sgdc_n_iter_no_change': 10}. Best is trial 39 with value: 0.780011.[0m
[32m[I 2022-10-26 23:16:52,883][0m Trial 40 finished with value: 0.14863420626859766 and parameters: {'sgdc_loss': 'modified_huber', 'sgdc_penalty': 'elasticnet', 'sgdc_alpha': 7.977834871064911e-05, 'sgdc_l1_ratio': 0.4, 'sgdc_learning_rate': 'invscaling', 'sgdc_eta0': 0.007024550352460104, 'sgdc_early_stopping': True, 'sgdc_validation_fraction': 0.25, 'sgdc_n_iter_no_change': 10}. Best is trial 39 with value: 0.780011.[0m
