[32m[I 2022-10-26 12:40:28,490][0m Trial 26 finished with value: 0.433523227142029 and parameters: {'lsvc_pcs_kernel_gamma': 778.5130507963498, 'lsvc_pcs_kernel_n_components': 50, 'lsvc_pcs_degree': 2, 'lsvc_pcs_dual': False, 'lsvc_pcs_C': 1.7797358073007354, 'lsvc_pcs_max_iter': 2000}. Best is trial 24 with value: 0.716803.[0m
[32m[I 2022-10-26 12:41:02,727][0m Trial 27 finished with value: 0.6179782747498636 and parameters: {'lsvc_pcs_kernel_gamma': 0.1491642283177091, 'lsvc_pcs_kernel_n_components': 150, 'lsvc_pcs_degree': 2, 'lsvc_pcs_dual': False, 'lsvc_pcs_C': 0.3966259809116157, 'lsvc_pcs_max_iter': 2000}. Best is trial 24 with value: 0.716803.[0m
[32m[I 2022-10-26 12:41:17,269][0m Trial 28 finished with value: 0.409584200652463 and parameters: {'lsvc_pcs_kernel_gamma': 0.028409194716502502, 'lsvc_pcs_kernel_n_components': 100, 'lsvc_pcs_degree': 2, 'lsvc_pcs_dual': False, 'lsvc_pcs_C': 162.16092661459587, 'lsvc_pcs_max_iter': 2000}. Best is trial 24 with value: 0.716803.[0m
[32m[I 2022-10-26 12:41:45,975][0m Trial 29 finished with value: 0.6718820604686085 and parameters: {'lsvc_pcs_kernel_gamma': 3.757882246090541, 'lsvc_pcs_kernel_n_components': 150, 'lsvc_pcs_degree': 2, 'lsvc_pcs_dual': False, 'lsvc_pcs_C': 0.015137506231031593, 'lsvc_pcs_max_iter': 2000}. Best is trial 24 with value: 0.716803.[0m
[32m[I 2022-10-26 12:41:59,573][0m Trial 30 finished with value: 0.712837529509188 and parameters: {'lsvc_pcs_kernel_gamma': 3.8204117790213856, 'lsvc_pcs_kernel_n_components': 100, 'lsvc_pcs_degree': 2, 'lsvc_pcs_dual': False, 'lsvc_pcs_C': 0.0039951471375088915, 'lsvc_pcs_max_iter': 2000}. Best is trial 24 with value: 0.716803.[0m
[32m[I 2022-10-26 12:42:13,148][0m Trial 31 finished with value: 0.7162374110237714 and parameters: {'lsvc_pcs_kernel_gamma': 4.000287098667407, 'lsvc_pcs_kernel_n_components': 100, 'lsvc_pcs_degree': 2, 'lsvc_pcs_dual': False, 'lsvc_pcs_C': 0.004656026687485835, 'lsvc_pcs_max_iter': 2000}. Best is trial 24 with value: 0.716803.[0m
[32m[I 2022-10-26 12:42:26,737][0m Trial 32 finished with value: 0.7113237242980471 and parameters: {'lsvc_pcs_kernel_gamma': 3.455280967854891, 'lsvc_pcs_kernel_n_components': 100, 'lsvc_pcs_degree': 2, 'lsvc_pcs_dual': False, 'lsvc_pcs_C': 0.003910971566663283, 'lsvc_pcs_max_iter': 2000}. Best is trial 24 with value: 0.716803.[0m
[32m[I 2022-10-26 12:42:40,569][0m Trial 33 finished with value: 0.14486816562028476 and parameters: {'lsvc_pcs_kernel_gamma': 22.23583407461046, 'lsvc_pcs_kernel_n_components': 100, 'lsvc_pcs_degree': 2, 'lsvc_pcs_dual': False, 'lsvc_pcs_C': 0.04859531897274655, 'lsvc_pcs_max_iter': 2000}. Best is trial 24 with value: 0.716803.[0m
[32m[I 2022-10-26 12:42:54,145][0m Trial 34 finished with value: 0.7087208412208608 and parameters: {'lsvc_pcs_kernel_gamma': 202.51986854920372, 'lsvc_pcs_kernel_n_components': 100, 'lsvc_pcs_degree': 2, 'lsvc_pcs_dual': False, 'lsvc_pcs_C': 0.001573548379059337, 'lsvc_pcs_max_iter': 2000}. Best is trial 24 with value: 0.716803.[0m
[32m[I 2022-10-26 12:43:07,784][0m Trial 35 finished with value: 0.7150262183744922 and parameters: {'lsvc_pcs_kernel_gamma': 171.7720714205099, 'lsvc_pcs_kernel_n_components': 100, 'lsvc_pcs_degree': 2, 'lsvc_pcs_dual': False, 'lsvc_pcs_C': 0.008815328901928165, 'lsvc_pcs_max_iter': 2000}. Best is trial 24 with value: 0.716803.[0m
[32m[I 2022-10-26 12:43:21,484][0m Trial 36 finished with value: 0.7151465406794091 and parameters: {'lsvc_pcs_kernel_gamma': 179.01273548105218, 'lsvc_pcs_kernel_n_components': 100, 'lsvc_pcs_degree': 2, 'lsvc_pcs_dual': False, 'lsvc_pcs_C': 0.014107474006734719, 'lsvc_pcs_max_iter': 2000}. Best is trial 24 with value: 0.716803.[0m
[32m[I 2022-10-26 12:43:35,124][0m Trial 37 finished with value: 0.7100191766854355 and parameters: {'lsvc_pcs_kernel_gamma': 182.60268625655263, 'lsvc_pcs_kernel_n_components': 100, 'lsvc_pcs_degree': 2, 'lsvc_pcs_dual': False, 'lsvc_pcs_C': 0.012397533123447794, 'lsvc_pcs_max_iter': 2000}. Best is trial 24 with value: 0.716803.[0m
[32m[I 2022-10-26 12:43:48,774][0m Trial 38 finished with value: 0.7211854920251798 and parameters: {'lsvc_pcs_kernel_gamma': 120.90173962872765, 'lsvc_pcs_kernel_n_components': 100, 'lsvc_pcs_degree': 2, 'lsvc_pcs_dual': False, 'lsvc_pcs_C': 0.0011309305873425353, 'lsvc_pcs_max_iter': 2000}. Best is trial 38 with value: 0.721186.[0m
[32m[I 2022-10-26 12:44:02,636][0m Trial 39 finished with value: 0.40665387656716656 and parameters: {'lsvc_pcs_kernel_gamma': 27.055621113110636, 'lsvc_pcs_kernel_n_components': 100, 'lsvc_pcs_degree': 2, 'lsvc_pcs_dual': False, 'lsvc_pcs_C': 0.0013092140338965357, 'lsvc_pcs_max_iter': 2000}. Best is trial 38 with value: 0.721186.[0m
[32m[I 2022-10-26 12:44:14,432][0m Trial 40 finished with value: 0.17865127370467604 and parameters: {'lsvc_pcs_kernel_gamma': 470.5982517959405, 'lsvc_pcs_kernel_n_components': 50, 'lsvc_pcs_degree': 2, 'lsvc_pcs_dual': False, 'lsvc_pcs_C': 9.468907011919637e-06, 'lsvc_pcs_max_iter': 2000}. Best is trial 38 with value: 0.721186.[0m
[32m[I 2022-10-26 12:44:28,266][0m Trial 41 finished with value: 0.718431052076308 and parameters: {'lsvc_pcs_kernel_gamma': 137.15932445154075, 'lsvc_pcs_kernel_n_components': 100, 'lsvc_pcs_degree': 2, 'lsvc_pcs_dual': False, 'lsvc_pcs_C': 0.0007244684726919464, 'lsvc_pcs_max_iter': 2000}. Best is trial 38 with value: 0.721186.[0m
[32m[I 2022-10-26 12:44:45,010][0m Trial 42 finished with value: 0.4090919912940486 and parameters: {'lsvc_pcs_kernel_gamma': 108.40485185697476, 'lsvc_pcs_kernel_n_components': 100, 'lsvc_pcs_degree': 2, 'lsvc_pcs_dual': False, 'lsvc_pcs_C': 0.000555571920420562, 'lsvc_pcs_max_iter': 2000}. Best is trial 38 with value: 0.721186.[0m
[32m[I 2022-10-26 12:44:59,266][0m Trial 43 finished with value: 0.14507205376424132 and parameters: {'lsvc_pcs_kernel_gamma': 344.96287692224683, 'lsvc_pcs_kernel_n_components': 100, 'lsvc_pcs_degree': 2, 'lsvc_pcs_dual': False, 'lsvc_pcs_C': 0.001074301467044283, 'lsvc_pcs_max_iter': 2000}. Best is trial 38 with value: 0.721186.[0m
[32m[I 2022-10-26 12:45:16,120][0m Trial 44 finished with value: 0.7039138778368353 and parameters: {'lsvc_pcs_kernel_gamma': 46.51043727792762, 'lsvc_pcs_kernel_n_components': 100, 'lsvc_pcs_degree': 2, 'lsvc_pcs_dual': False, 'lsvc_pcs_C': 0.00015254285714916136, 'lsvc_pcs_max_iter': 2000}. Best is trial 38 with value: 0.721186.[0m
[32m[I 2022-10-26 12:45:33,417][0m Trial 45 finished with value: 0.7133891603477334 and parameters: {'lsvc_pcs_kernel_gamma': 949.1622176767848, 'lsvc_pcs_kernel_n_components': 100, 'lsvc_pcs_degree': 2, 'lsvc_pcs_dual': False, 'lsvc_pcs_C': 0.00013829404422054488, 'lsvc_pcs_max_iter': 2000}. Best is trial 38 with value: 0.721186.[0m
[32m[I 2022-10-26 12:45:51,325][0m Trial 46 finished with value: 0.1449146293965408 and parameters: {'lsvc_pcs_kernel_gamma': 314.0083915176748, 'lsvc_pcs_kernel_n_components': 100, 'lsvc_pcs_degree': 2, 'lsvc_pcs_dual': False, 'lsvc_pcs_C': 1.337070875218798e-06, 'lsvc_pcs_max_iter': 2000}. Best is trial 38 with value: 0.721186.[0m
[32m[I 2022-10-26 12:46:25,304][0m Trial 47 finished with value: 0.5563623617405438 and parameters: {'lsvc_pcs_kernel_gamma': 121.55369002606528, 'lsvc_pcs_kernel_n_components': 150, 'lsvc_pcs_degree': 2, 'lsvc_pcs_dual': False, 'lsvc_pcs_C': 0.003996759829770138, 'lsvc_pcs_max_iter': 2000}. Best is trial 38 with value: 0.721186.[0m
[32m[I 2022-10-26 12:46:40,069][0m Trial 48 finished with value: 0.14394896143086128 and parameters: {'lsvc_pcs_kernel_gamma': 17.022062056272492, 'lsvc_pcs_kernel_n_components': 100, 'lsvc_pcs_degree': 2, 'lsvc_pcs_dual': False, 'lsvc_pcs_C': 0.03183606558620245, 'lsvc_pcs_max_iter': 2000}. Best is trial 38 with value: 0.721186.[0m
[32m[I 2022-10-26 12:46:53,816][0m Trial 49 finished with value: 0.14297981614850067 and parameters: {'lsvc_pcs_kernel_gamma': 6.353859027075311, 'lsvc_pcs_kernel_n_components': 100, 'lsvc_pcs_degree': 2, 'lsvc_pcs_dual': False, 'lsvc_pcs_C': 0.23726945517445747, 'lsvc_pcs_max_iter': 2000}. Best is trial 38 with value: 0.721186.[0m
[32m[I 2022-10-26 12:47:05,677][0m Trial 50 finished with value: 0.42810502492731023 and parameters: {'lsvc_pcs_kernel_gamma': 1.6366279307391245, 'lsvc_pcs_kernel_n_components': 50, 'lsvc_pcs_degree': 2, 'lsvc_pcs_dual': False, 'lsvc_pcs_C': 1.5902559256539666e-05, 'lsvc_pcs_max_iter': 2000}. Best is trial 38 with value: 0.721186.[0m
[32m[I 2022-10-26 12:47:19,449][0m Trial 51 finished with value: 0.7102203969648421 and parameters: {'lsvc_pcs_kernel_gamma': 149.52251862342837, 'lsvc_pcs_kernel_n_components': 100, 'lsvc_pcs_degree': 2, 'lsvc_pcs_dual': False, 'lsvc_pcs_C': 0.00801615254685599, 'lsvc_pcs_max_iter': 2000}. Best is trial 38 with value: 0.721186.[0m
[32m[I 2022-10-26 12:47:33,244][0m Trial 52 finished with value: 0.7121168215493835 and parameters: {'lsvc_pcs_kernel_gamma': 38.73340815167984, 'lsvc_pcs_kernel_n_components': 100, 'lsvc_pcs_degree': 2, 'lsvc_pcs_dual': False, 'lsvc_pcs_C': 0.00033649722197467876, 'lsvc_pcs_max_iter': 2000}. Best is trial 38 with value: 0.721186.[0m
[32m[I 2022-10-26 12:47:46,959][0m Trial 53 finished with value: 0.7144147110086877 and parameters: {'lsvc_pcs_kernel_gamma': 508.78400202262986, 'lsvc_pcs_kernel_n_components': 100, 'lsvc_pcs_degree': 2, 'lsvc_pcs_dual': False, 'lsvc_pcs_C': 0.06648609089832493, 'lsvc_pcs_max_iter': 2000}. Best is trial 38 with value: 0.721186.[0m
[32m[I 2022-10-26 12:48:00,734][0m Trial 54 finished with value: 0.14416030483879533 and parameters: {'lsvc_pcs_kernel_gamma': 87.77727092853897, 'lsvc_pcs_kernel_n_components': 100, 'lsvc_pcs_degree': 2, 'lsvc_pcs_dual': False, 'lsvc_pcs_C': 0.0025460030449426653, 'lsvc_pcs_max_iter': 2000}. Best is trial 38 with value: 0.721186.[0m
[32m[I 2022-10-26 12:48:14,479][0m Trial 55 finished with value: 0.7052065103420292 and parameters: {'lsvc_pcs_kernel_gamma': 243.5690530566274, 'lsvc_pcs_kernel_n_components': 100, 'lsvc_pcs_degree': 2, 'lsvc_pcs_dual': False, 'lsvc_pcs_C': 0.021731105623866584, 'lsvc_pcs_max_iter': 2000}. Best is trial 38 with value: 0.721186.[0m
[32m[I 2022-10-26 12:48:28,166][0m Trial 56 finished with value: 0.1448722831224369 and parameters: {'lsvc_pcs_kernel_gamma': 75.35727994669253, 'lsvc_pcs_kernel_n_components': 100, 'lsvc_pcs_degree': 2, 'lsvc_pcs_dual': False, 'lsvc_pcs_C': 0.008572596255456777, 'lsvc_pcs_max_iter': 2000}. Best is trial 38 with value: 0.721186.[0m
[32m[I 2022-10-26 12:48:41,878][0m Trial 57 finished with value: 0.14451321704218323 and parameters: {'lsvc_pcs_kernel_gamma': 0.27573771543440145, 'lsvc_pcs_kernel_n_components': 100, 'lsvc_pcs_degree': 2, 'lsvc_pcs_dual': False, 'lsvc_pcs_C': 0.00036498429384694894, 'lsvc_pcs_max_iter': 2000}. Best is trial 38 with value: 0.721186.[0m
[32m[I 2022-10-26 12:48:55,606][0m Trial 58 finished with value: 0.7142900022495781 and parameters: {'lsvc_pcs_kernel_gamma': 535.7034555071541, 'lsvc_pcs_kernel_n_components': 100, 'lsvc_pcs_degree': 2, 'lsvc_pcs_dual': False, 'lsvc_pcs_C': 0.0007383999469348328, 'lsvc_pcs_max_iter': 2000}. Best is trial 38 with value: 0.721186.[0m
[32m[I 2022-10-26 12:49:09,253][0m Trial 59 finished with value: 0.14499396342508444 and parameters: {'lsvc_pcs_kernel_gamma': 291.90265453128006, 'lsvc_pcs_kernel_n_components': 100, 'lsvc_pcs_degree': 2, 'lsvc_pcs_dual': False, 'lsvc_pcs_C': 6.11979314549123e-05, 'lsvc_pcs_max_iter': 2000}. Best is trial 38 with value: 0.721186.[0m
[32m[I 2022-10-26 12:49:22,725][0m Trial 60 finished with value: 0.7103611535827238 and parameters: {'lsvc_pcs_kernel_gamma': 172.36413551550928, 'lsvc_pcs_kernel_n_components': 100, 'lsvc_pcs_degree': 2, 'lsvc_pcs_dual': False, 'lsvc_pcs_C': 0.002778019470351023, 'lsvc_pcs_max_iter': 2000}. Best is trial 38 with value: 0.721186.[0m
[32m[I 2022-10-26 12:49:36,277][0m Trial 61 finished with value: 0.7114207619079992 and parameters: {'lsvc_pcs_kernel_gamma': 621.3488852697075, 'lsvc_pcs_kernel_n_components': 100, 'lsvc_pcs_degree': 2, 'lsvc_pcs_dual': False, 'lsvc_pcs_C': 0.09655143533986017, 'lsvc_pcs_max_iter': 2000}. Best is trial 38 with value: 0.721186.[0m
[32m[I 2022-10-26 12:49:52,463][0m Trial 62 finished with value: 0.13754004898759034 and parameters: {'lsvc_pcs_kernel_gamma': 419.19653975824826, 'lsvc_pcs_kernel_n_components': 100, 'lsvc_pcs_degree': 2, 'lsvc_pcs_dual': False, 'lsvc_pcs_C': 0.05075214470596256, 'lsvc_pcs_max_iter': 2000}. Best is trial 38 with value: 0.721186.[0m
[32m[I 2022-10-26 12:50:06,555][0m Trial 63 finished with value: 0.7087395926699941 and parameters: {'lsvc_pcs_kernel_gamma': 776.9695355462724, 'lsvc_pcs_kernel_n_components': 100, 'lsvc_pcs_degree': 2, 'lsvc_pcs_dual': False, 'lsvc_pcs_C': 6.018182904626801, 'lsvc_pcs_max_iter': 2000}. Best is trial 38 with value: 0.721186.[0m
[32m[I 2022-10-26 12:50:25,030][0m Trial 64 finished with value: 0.14366596404658033 and parameters: {'lsvc_pcs_kernel_gamma': 68.06399406991196, 'lsvc_pcs_kernel_n_components': 100, 'lsvc_pcs_degree': 2, 'lsvc_pcs_dual': False, 'lsvc_pcs_C': 0.6202408675450404, 'lsvc_pcs_max_iter': 2000}. Best is trial 38 with value: 0.721186.[0m
[32m[I 2022-10-26 12:50:39,701][0m Trial 65 finished with value: 0.7148654660173627 and parameters: {'lsvc_pcs_kernel_gamma': 37.2623214172838, 'lsvc_pcs_kernel_n_components': 100, 'lsvc_pcs_degree': 2, 'lsvc_pcs_dual': False, 'lsvc_pcs_C': 0.0065616701176460625, 'lsvc_pcs_max_iter': 2000}. Best is trial 38 with value: 0.721186.[0m
[32m[I 2022-10-26 12:50:53,760][0m Trial 66 finished with value: 0.7101225805950869 and parameters: {'lsvc_pcs_kernel_gamma': 9.36893578628145, 'lsvc_pcs_kernel_n_components': 100, 'lsvc_pcs_degree': 2, 'lsvc_pcs_dual': False, 'lsvc_pcs_C': 0.006613752210481816, 'lsvc_pcs_max_iter': 2000}. Best is trial 38 with value: 0.721186.[0m
[32m[I 2022-10-26 12:51:07,448][0m Trial 67 finished with value: 0.7094549727586231 and parameters: {'lsvc_pcs_kernel_gamma': 32.17151425012675, 'lsvc_pcs_kernel_n_components': 100, 'lsvc_pcs_degree': 2, 'lsvc_pcs_dual': False, 'lsvc_pcs_C': 0.02054941698885078, 'lsvc_pcs_max_iter': 2000}. Best is trial 38 with value: 0.721186.[0m
[32m[I 2022-10-26 12:51:21,124][0m Trial 68 finished with value: 0.7128469776737076 and parameters: {'lsvc_pcs_kernel_gamma': 131.08400448821322, 'lsvc_pcs_kernel_n_components': 100, 'lsvc_pcs_degree': 2, 'lsvc_pcs_dual': False, 'lsvc_pcs_C': 0.005720818752799454, 'lsvc_pcs_max_iter': 2000}. Best is trial 38 with value: 0.721186.[0m
[32m[I 2022-10-26 12:52:01,690][0m Trial 69 finished with value: 0.3974013524144287 and parameters: {'lsvc_pcs_kernel_gamma': 0.0022610085980865452, 'lsvc_pcs_kernel_n_components': 150, 'lsvc_pcs_degree': 2, 'lsvc_pcs_dual': False, 'lsvc_pcs_C': 0.0017688024459700737, 'lsvc_pcs_max_iter': 2000}. Best is trial 38 with value: 0.721186.[0m
[32m[I 2022-10-26 12:52:16,483][0m Trial 70 finished with value: 0.14478534552932826 and parameters: {'lsvc_pcs_kernel_gamma': 18.71742551921479, 'lsvc_pcs_kernel_n_components': 100, 'lsvc_pcs_degree': 2, 'lsvc_pcs_dual': False, 'lsvc_pcs_C': 106.22322800570323, 'lsvc_pcs_max_iter': 2000}. Best is trial 38 with value: 0.721186.[0m
[32m[I 2022-10-26 12:52:30,857][0m Trial 71 finished with value: 0.709942843357284 and parameters: {'lsvc_pcs_kernel_gamma': 231.3403269886661, 'lsvc_pcs_kernel_n_components': 100, 'lsvc_pcs_degree': 2, 'lsvc_pcs_dual': False, 'lsvc_pcs_C': 0.0009357362711891776, 'lsvc_pcs_max_iter': 2000}. Best is trial 38 with value: 0.721186.[0m
[32m[I 2022-10-26 12:53:36,840][0m Trial 72 finished with value: 0.7126368579904027 and parameters: {'lsvc_pcs_kernel_gamma': 59.559017564188956, 'lsvc_pcs_kernel_n_components': 100, 'lsvc_pcs_degree': 2, 'lsvc_pcs_dual': False, 'lsvc_pcs_C': 0.07943105246894282, 'lsvc_pcs_max_iter': 2000}. Best is trial 38 with value: 0.721186.[0m
[32m[I 2022-10-26 12:54:43,520][0m Trial 73 finished with value: 0.14479666888823947 and parameters: {'lsvc_pcs_kernel_gamma': 375.8153205543411, 'lsvc_pcs_kernel_n_components': 100, 'lsvc_pcs_degree': 2, 'lsvc_pcs_dual': False, 'lsvc_pcs_C': 0.224570304188481, 'lsvc_pcs_max_iter': 2000}. Best is trial 38 with value: 0.721186.[0m
[32m[I 2022-10-26 12:55:00,886][0m Trial 74 finished with value: 0.7156183854872915 and parameters: {'lsvc_pcs_kernel_gamma': 656.8507271006113, 'lsvc_pcs_kernel_n_components': 100, 'lsvc_pcs_degree': 2, 'lsvc_pcs_dual': False, 'lsvc_pcs_C': 0.031732988017421034, 'lsvc_pcs_max_iter': 2000}. Best is trial 38 with value: 0.721186.[0m
[32m[I 2022-10-26 12:55:18,293][0m Trial 75 finished with value: 0.4063620070244671 and parameters: {'lsvc_pcs_kernel_gamma': 110.99495698324336, 'lsvc_pcs_kernel_n_components': 100, 'lsvc_pcs_degree': 2, 'lsvc_pcs_dual': False, 'lsvc_pcs_C': 0.027068852956418404, 'lsvc_pcs_max_iter': 2000}. Best is trial 38 with value: 0.721186.[0m
[32m[I 2022-10-26 12:55:35,253][0m Trial 76 finished with value: 0.717000048709276 and parameters: {'lsvc_pcs_kernel_gamma': 0.6671141993894761, 'lsvc_pcs_kernel_n_components': 100, 'lsvc_pcs_degree': 2, 'lsvc_pcs_dual': False, 'lsvc_pcs_C': 0.013333043483239226, 'lsvc_pcs_max_iter': 2000}. Best is trial 38 with value: 0.721186.[0m
[32m[I 2022-10-26 12:55:51,589][0m Trial 77 finished with value: 0.7130156142653183 and parameters: {'lsvc_pcs_kernel_gamma': 0.6827363395205207, 'lsvc_pcs_kernel_n_components': 100, 'lsvc_pcs_degree': 2, 'lsvc_pcs_dual': False, 'lsvc_pcs_C': 0.013371468992563326, 'lsvc_pcs_max_iter': 2000}. Best is trial 38 with value: 0.721186.[0m
[32m[I 2022-10-26 12:56:08,223][0m Trial 78 finished with value: 0.7111929691334383 and parameters: {'lsvc_pcs_kernel_gamma': 0.17757682962798146, 'lsvc_pcs_kernel_n_components': 100, 'lsvc_pcs_degree': 2, 'lsvc_pcs_dual': False, 'lsvc_pcs_C': 1.2081575504806235, 'lsvc_pcs_max_iter': 2000}. Best is trial 38 with value: 0.721186.[0m
[32m[I 2022-10-26 12:56:24,188][0m Trial 79 finished with value: 0.7117992285367631 and parameters: {'lsvc_pcs_kernel_gamma': 0.03864063001080401, 'lsvc_pcs_kernel_n_components': 100, 'lsvc_pcs_degree': 2, 'lsvc_pcs_dual': False, 'lsvc_pcs_C': 960.1971552765982, 'lsvc_pcs_max_iter': 2000}. Best is trial 38 with value: 0.721186.[0m
[32m[I 2022-10-26 12:56:39,169][0m Trial 80 finished with value: 0.14276008083595787 and parameters: {'lsvc_pcs_kernel_gamma': 1.0557164168344246, 'lsvc_pcs_kernel_n_components': 100, 'lsvc_pcs_degree': 2, 'lsvc_pcs_dual': False, 'lsvc_pcs_C': 0.034330891999518734, 'lsvc_pcs_max_iter': 2000}. Best is trial 38 with value: 0.721186.[0m
[32m[I 2022-10-26 12:56:56,122][0m Trial 81 finished with value: 0.40802331698512434 and parameters: {'lsvc_pcs_kernel_gamma': 1.6905585237719285, 'lsvc_pcs_kernel_n_components': 100, 'lsvc_pcs_degree': 2, 'lsvc_pcs_dual': False, 'lsvc_pcs_C': 0.0035103290425796243, 'lsvc_pcs_max_iter': 2000}. Best is trial 38 with value: 0.721186.[0m
[32m[I 2022-10-26 12:57:13,573][0m Trial 82 finished with value: 0.14481591888988127 and parameters: {'lsvc_pcs_kernel_gamma': 0.3927192897713009, 'lsvc_pcs_kernel_n_components': 100, 'lsvc_pcs_degree': 2, 'lsvc_pcs_dual': False, 'lsvc_pcs_C': 0.01142474772484366, 'lsvc_pcs_max_iter': 2000}. Best is trial 38 with value: 0.721186.[0m
[32m[I 2022-10-26 12:57:29,767][0m Trial 83 finished with value: 0.7101902948025061 and parameters: {'lsvc_pcs_kernel_gamma': 946.0450537626074, 'lsvc_pcs_kernel_n_components': 100, 'lsvc_pcs_degree': 2, 'lsvc_pcs_dual': False, 'lsvc_pcs_C': 0.00023292783881934288, 'lsvc_pcs_max_iter': 2000}. Best is trial 38 with value: 0.721186.[0m
[32m[I 2022-10-26 12:57:46,347][0m Trial 84 finished with value: 0.7162732857610782 and parameters: {'lsvc_pcs_kernel_gamma': 0.7242025285614392, 'lsvc_pcs_kernel_n_components': 100, 'lsvc_pcs_degree': 2, 'lsvc_pcs_dual': False, 'lsvc_pcs_C': 0.001404018017876929, 'lsvc_pcs_max_iter': 2000}. Best is trial 38 with value: 0.721186.[0m
[32m[I 2022-10-26 12:58:03,267][0m Trial 85 finished with value: 0.7108637903288874 and parameters: {'lsvc_pcs_kernel_gamma': 2.4435330931180643, 'lsvc_pcs_kernel_n_components': 100, 'lsvc_pcs_degree': 2, 'lsvc_pcs_dual': False, 'lsvc_pcs_C': 0.0015611994982122463, 'lsvc_pcs_max_iter': 2000}. Best is trial 38 with value: 0.721186.[0m
[32m[I 2022-10-26 12:58:18,667][0m Trial 86 finished with value: 0.7110551954884765 and parameters: {'lsvc_pcs_kernel_gamma': 0.6516389154748111, 'lsvc_pcs_kernel_n_components': 100, 'lsvc_pcs_degree': 2, 'lsvc_pcs_dual': False, 'lsvc_pcs_C': 8.049284708126669e-05, 'lsvc_pcs_max_iter': 2000}. Best is trial 38 with value: 0.721186.[0m
[32m[I 2022-10-26 12:58:33,107][0m Trial 87 finished with value: 0.7136209890308863 and parameters: {'lsvc_pcs_kernel_gamma': 0.06136739704257263, 'lsvc_pcs_kernel_n_components': 100, 'lsvc_pcs_degree': 2, 'lsvc_pcs_dual': False, 'lsvc_pcs_C': 0.0022707298464357674, 'lsvc_pcs_max_iter': 2000}. Best is trial 38 with value: 0.721186.[0m
[32m[I 2022-10-26 12:58:46,791][0m Trial 88 finished with value: 0.71579655748152 and parameters: {'lsvc_pcs_kernel_gamma': 0.008928741585695444, 'lsvc_pcs_kernel_n_components': 100, 'lsvc_pcs_degree': 2, 'lsvc_pcs_dual': False, 'lsvc_pcs_C': 0.0007034815605234821, 'lsvc_pcs_max_iter': 2000}. Best is trial 38 with value: 0.721186.[0m
[32m[I 2022-10-26 12:59:03,777][0m Trial 89 finished with value: 0.14423458828212812 and parameters: {'lsvc_pcs_kernel_gamma': 0.0013696308794710268, 'lsvc_pcs_kernel_n_components': 100, 'lsvc_pcs_degree': 2, 'lsvc_pcs_dual': False, 'lsvc_pcs_C': 0.0006065658872072678, 'lsvc_pcs_max_iter': 2000}. Best is trial 38 with value: 0.721186.[0m
[32m[I 2022-10-26 12:59:20,783][0m Trial 90 finished with value: 0.7070874287690937 and parameters: {'lsvc_pcs_kernel_gamma': 0.010187009460282755, 'lsvc_pcs_kernel_n_components': 100, 'lsvc_pcs_degree': 2, 'lsvc_pcs_dual': False, 'lsvc_pcs_C': 2.750218107864821e-05, 'lsvc_pcs_max_iter': 2000}. Best is trial 38 with value: 0.721186.[0m
