[32m[I 2022-10-26 02:47:14,244][0m Trial 93 finished with value: 0.985045024691202 and parameters: {'etsc_n_estimators': 120, 'etsc_criterion': 'gini', 'etsc_min_samples_split': 7, 'etsc_min_samples_leaf': 2, 'etsc_max_features': 3, 'etsc_bootstrap': False}. Best is trial 25 with value: 0.999983.[0m
[32m[I 2022-10-26 02:47:28,295][0m Trial 87 finished with value: 0.999843312925408 and parameters: {'etsc_n_estimators': 70, 'etsc_criterion': 'gini', 'etsc_min_samples_split': 7, 'etsc_min_samples_leaf': 2, 'etsc_max_features': 7, 'etsc_bootstrap': False}. Best is trial 25 with value: 0.999983.[0m
[32m[I 2022-10-26 02:47:32,988][0m Trial 89 finished with value: 0.999843312925408 and parameters: {'etsc_n_estimators': 70, 'etsc_criterion': 'gini', 'etsc_min_samples_split': 7, 'etsc_min_samples_leaf': 2, 'etsc_max_features': 7, 'etsc_bootstrap': False}. Best is trial 25 with value: 0.999983.[0m
[32m[I 2022-10-26 02:47:37,075][0m Trial 88 finished with value: 0.9998482822864377 and parameters: {'etsc_n_estimators': 70, 'etsc_criterion': 'gini', 'etsc_min_samples_split': 6, 'etsc_min_samples_leaf': 2, 'etsc_max_features': 7, 'etsc_bootstrap': False}. Best is trial 25 with value: 0.999983.[0m
[32m[I 2022-10-26 02:48:03,328][0m Trial 95 finished with value: 0.6950742018218817 and parameters: {'etsc_n_estimators': 130, 'etsc_criterion': 'entropy', 'etsc_min_samples_split': 20, 'etsc_min_samples_leaf': 7, 'etsc_max_features': 3, 'etsc_bootstrap': False}. Best is trial 25 with value: 0.999983.[0m
[32m[I 2022-10-26 02:48:13,413][0m Trial 96 finished with value: 0.6950742018218817 and parameters: {'etsc_n_estimators': 140, 'etsc_criterion': 'entropy', 'etsc_min_samples_split': 4, 'etsc_min_samples_leaf': 5, 'etsc_max_features': 3, 'etsc_bootstrap': False}. Best is trial 25 with value: 0.999983.[0m
[32m[I 2022-10-26 02:48:16,227][0m Trial 97 finished with value: 0.6950742018218817 and parameters: {'etsc_n_estimators': 130, 'etsc_criterion': 'entropy', 'etsc_min_samples_split': 4, 'etsc_min_samples_leaf': 7, 'etsc_max_features': 3, 'etsc_bootstrap': False}. Best is trial 25 with value: 0.999983.[0m
[32m[I 2022-10-26 02:48:19,918][0m Trial 94 finished with value: 0.9839341332737899 and parameters: {'etsc_n_estimators': 180, 'etsc_criterion': 'entropy', 'etsc_min_samples_split': 7, 'etsc_min_samples_leaf': 2, 'etsc_max_features': 3, 'etsc_bootstrap': False}. Best is trial 25 with value: 0.999983.[0m
[32m[I 2022-10-26 02:49:49,423][0m Trial 91 finished with value: 0.9998458218613538 and parameters: {'etsc_n_estimators': 180, 'etsc_criterion': 'gini', 'etsc_min_samples_split': 7, 'etsc_min_samples_leaf': 2, 'etsc_max_features': 7, 'etsc_bootstrap': True}. Best is trial 25 with value: 0.999983.[0m
[32m[I 2022-10-26 02:49:51,011][0m Trial 92 finished with value: 0.9998458218613538 and parameters: {'etsc_n_estimators': 180, 'etsc_criterion': 'gini', 'etsc_min_samples_split': 7, 'etsc_min_samples_leaf': 2, 'etsc_max_features': 7, 'etsc_bootstrap': True}. Best is trial 25 with value: 0.999983.[0m
[32m[I 2022-10-26 02:49:56,860][0m Trial 99 finished with value: 0.9930164407865004 and parameters: {'etsc_n_estimators': 140, 'etsc_criterion': 'entropy', 'etsc_min_samples_split': 4, 'etsc_min_samples_leaf': 7, 'etsc_max_features': 7, 'etsc_bootstrap': True}. Best is trial 25 with value: 0.999983.[0m
[32m[I 2022-10-26 02:50:33,713][0m Trial 98 finished with value: 0.999972655355715 and parameters: {'etsc_n_estimators': 130, 'etsc_criterion': 'gini', 'etsc_min_samples_split': 4, 'etsc_min_samples_leaf': 1, 'etsc_max_features': 7, 'etsc_bootstrap': False}. Best is trial 25 with value: 0.999983.[0m
[32m[I 2022-10-26 02:50:33,779][0m Study finished.[0m
[32m[I 2022-10-26 02:50:33,795][0m --------------------------------------------------------------------------------[0m
[32m[I 2022-10-26 02:50:33,796][0m --------------------               GaussianNB               --------------------[0m
[32m[I 2022-10-26 02:50:33,796][0m --------------------------------------------------------------------------------[0m
[32m[I 2022-10-26 02:50:33,823][0m A new study created in RDB with name: GaussianNB_c963b74b[0m
[32m[I 2022-10-26 02:50:33,830][0m Study started.[0m
[32m[I 2022-10-26 02:50:36,391][0m Trial 2 finished with value: 0.6950742018218817 and parameters: {'gnb_var_smoothing': 2.300973652012041}. Best is trial 2 with value: 0.695074.[0m
[32m[I 2022-10-26 02:50:36,485][0m Trial 1 finished with value: 0.05163488645862473 and parameters: {'gnb_var_smoothing': 1.942595057801946e-08}. Best is trial 0 with value: 0.695074.[0m
[32m[I 2022-10-26 02:50:36,488][0m Trial 3 finished with value: 0.05163488645862473 and parameters: {'gnb_var_smoothing': 1.5314092642468233e-06}. Best is trial 0 with value: 0.695074.[0m
[32m[I 2022-10-26 02:50:36,553][0m Trial 0 finished with value: 0.6950742018218817 and parameters: {'gnb_var_smoothing': 0.8566573762748355}. Best is trial 0 with value: 0.695074.[0m
[32m[I 2022-10-26 02:50:36,713][0m Trial 6 finished with value: 0.05163488645862473 and parameters: {'gnb_var_smoothing': 4.5907413573499776e-11}. Best is trial 0 with value: 0.695074.[0m
[32m[I 2022-10-26 02:50:36,832][0m Trial 4 finished with value: 0.05163488645862473 and parameters: {'gnb_var_smoothing': 8.859082856313659e-06}. Best is trial 0 with value: 0.695074.[0m
[32m[I 2022-10-26 02:50:36,916][0m Trial 7 finished with value: 0.05163488645862473 and parameters: {'gnb_var_smoothing': 5.644042518489968e-10}. Best is trial 0 with value: 0.695074.[0m
[32m[I 2022-10-26 02:50:36,981][0m Trial 5 finished with value: 0.05163488645862473 and parameters: {'gnb_var_smoothing': 0.00015742694362420452}. Best is trial 0 with value: 0.695074.[0m
[32m[I 2022-10-26 02:50:39,535][0m Trial 9 finished with value: 0.6950742018218817 and parameters: {'gnb_var_smoothing': 12.694817808434086}. Best is trial 0 with value: 0.695074.[0m
[32m[I 2022-10-26 02:50:39,536][0m Trial 13 finished with value: 0.05163488645862473 and parameters: {'gnb_var_smoothing': 1.1418964498676804e-06}. Best is trial 0 with value: 0.695074.[0m
[32m[I 2022-10-26 02:50:39,726][0m Trial 11 finished with value: 0.05163488645862473 and parameters: {'gnb_var_smoothing': 4.449545670503517e-06}. Best is trial 0 with value: 0.695074.[0m
[32m[I 2022-10-26 02:50:39,843][0m Trial 12 finished with value: 0.05163488645862473 and parameters: {'gnb_var_smoothing': 1.4847395484654687e-08}. Best is trial 0 with value: 0.695074.[0m
[32m[I 2022-10-26 02:50:39,916][0m Trial 10 finished with value: 0.05163488645862473 and parameters: {'gnb_var_smoothing': 2.821886602300611e-10}. Best is trial 0 with value: 0.695074.[0m
[32m[I 2022-10-26 02:50:40,001][0m Trial 14 finished with value: 0.6950742018218817 and parameters: {'gnb_var_smoothing': 9.446550072584422}. Best is trial 0 with value: 0.695074.[0m
[32m[I 2022-10-26 02:50:40,001][0m Trial 8 finished with value: 0.05163488645862473 and parameters: {'gnb_var_smoothing': 2.512532642609959e-08}. Best is trial 0 with value: 0.695074.[0m
[32m[I 2022-10-26 02:50:40,005][0m Trial 15 finished with value: 0.05163488645862473 and parameters: {'gnb_var_smoothing': 6.898805245418801e-09}. Best is trial 0 with value: 0.695074.[0m
[32m[I 2022-10-26 02:50:42,471][0m Trial 16 finished with value: 0.6950742018218817 and parameters: {'gnb_var_smoothing': 0.03192631763847083}. Best is trial 0 with value: 0.695074.[0m
[32m[I 2022-10-26 02:50:42,857][0m Trial 23 finished with value: 0.6950742018218817 and parameters: {'gnb_var_smoothing': 0.04823309033266633}. Best is trial 0 with value: 0.695074.[0m
[32m[I 2022-10-26 02:50:42,858][0m Trial 17 finished with value: 0.6950742018218817 and parameters: {'gnb_var_smoothing': 0.08096645815316277}. Best is trial 0 with value: 0.695074.[0m
[32m[I 2022-10-26 02:50:42,860][0m Trial 20 finished with value: 0.6950742018218817 and parameters: {'gnb_var_smoothing': 0.06595072601004659}. Best is trial 0 with value: 0.695074.[0m
[32m[I 2022-10-26 02:50:42,941][0m Trial 19 finished with value: 0.6950742018218817 and parameters: {'gnb_var_smoothing': 0.04622264426030165}. Best is trial 0 with value: 0.695074.[0m
[32m[I 2022-10-26 02:50:43,015][0m Trial 21 finished with value: 0.6950742018218817 and parameters: {'gnb_var_smoothing': 0.028166033956720102}. Best is trial 0 with value: 0.695074.[0m
[32m[I 2022-10-26 02:50:43,085][0m Trial 22 finished with value: 0.6950742018218817 and parameters: {'gnb_var_smoothing': 0.042570373597775095}. Best is trial 0 with value: 0.695074.[0m
[32m[I 2022-10-26 02:50:43,214][0m Trial 18 finished with value: 0.6950742018218817 and parameters: {'gnb_var_smoothing': 0.0697533365545602}. Best is trial 0 with value: 0.695074.[0m
[32m[I 2022-10-26 02:50:45,518][0m Trial 24 finished with value: 0.6950742018218817 and parameters: {'gnb_var_smoothing': 461.09958221529996}. Best is trial 0 with value: 0.695074.[0m
[32m[I 2022-10-26 02:50:46,109][0m Trial 28 finished with value: 0.6950742018218817 and parameters: {'gnb_var_smoothing': 218.84797454787656}. Best is trial 0 with value: 0.695074.[0m
[32m[I 2022-10-26 02:50:46,111][0m Trial 27 finished with value: 0.6950742018218817 and parameters: {'gnb_var_smoothing': 415.592150382542}. Best is trial 0 with value: 0.695074.[0m
[32m[I 2022-10-26 02:50:46,112][0m Trial 26 finished with value: 0.6950742018218817 and parameters: {'gnb_var_smoothing': 541.2418745356949}. Best is trial 0 with value: 0.695074.[0m
[32m[I 2022-10-26 02:50:46,113][0m Trial 25 finished with value: 0.6950742018218817 and parameters: {'gnb_var_smoothing': 516.2753907568033}. Best is trial 0 with value: 0.695074.[0m
[32m[I 2022-10-26 02:50:46,113][0m Trial 29 finished with value: 0.05163488645862473 and parameters: {'gnb_var_smoothing': 0.0002890258772131871}. Best is trial 0 with value: 0.695074.[0m
[32m[I 2022-10-26 02:50:46,314][0m Trial 30 finished with value: 0.6950742018218817 and parameters: {'gnb_var_smoothing': 192.16603352480462}. Best is trial 0 with value: 0.695074.[0m
[32m[I 2022-10-26 02:50:46,439][0m Trial 31 finished with value: 0.6950742018218817 and parameters: {'gnb_var_smoothing': 618.5856864826327}. Best is trial 0 with value: 0.695074.[0m
[32m[I 2022-10-26 02:50:48,208][0m Trial 32 finished with value: 0.05163488645862473 and parameters: {'gnb_var_smoothing': 0.0008762768646770732}. Best is trial 0 with value: 0.695074.[0m
[32m[I 2022-10-26 02:50:49,293][0m Trial 33 finished with value: 0.6950742018218817 and parameters: {'gnb_var_smoothing': 18.457748476953203}. Best is trial 0 with value: 0.695074.[0m
[32m[I 2022-10-26 02:50:49,372][0m Trial 37 finished with value: 0.6950742018218817 and parameters: {'gnb_var_smoothing': 39.95206867720323}. Best is trial 0 with value: 0.695074.[0m
[32m[I 2022-10-26 02:50:49,372][0m Trial 35 finished with value: 0.6950742018218817 and parameters: {'gnb_var_smoothing': 1.7104645083757228}. Best is trial 0 with value: 0.695074.[0m
[32m[I 2022-10-26 02:50:49,441][0m Trial 39 finished with value: 0.6950742018218817 and parameters: {'gnb_var_smoothing': 36.33539929828072}. Best is trial 0 with value: 0.695074.[0m
[32m[I 2022-10-26 02:50:49,442][0m Trial 34 finished with value: 0.6950742018218817 and parameters: {'gnb_var_smoothing': 33.51409564617643}. Best is trial 0 with value: 0.695074.[0m
[32m[I 2022-10-26 02:50:49,444][0m Trial 36 finished with value: 0.6950742018218817 and parameters: {'gnb_var_smoothing': 45.53941918959862}. Best is trial 0 with value: 0.695074.[0m
[32m[I 2022-10-26 02:50:49,568][0m Trial 38 finished with value: 0.6950742018218817 and parameters: {'gnb_var_smoothing': 44.46400062090711}. Best is trial 0 with value: 0.695074.[0m
[32m[I 2022-10-26 02:50:51,134][0m Trial 40 finished with value: 0.6950742018218817 and parameters: {'gnb_var_smoothing': 25.569446987848305}. Best is trial 0 with value: 0.695074.[0m
[32m[I 2022-10-26 02:50:52,403][0m Trial 41 finished with value: 0.05163488645862473 and parameters: {'gnb_var_smoothing': 0.003701219957333752}. Best is trial 0 with value: 0.695074.[0m
[32m[I 2022-10-26 02:50:52,490][0m Trial 43 finished with value: 0.05163488645862473 and parameters: {'gnb_var_smoothing': 0.006340983014728423}. Best is trial 0 with value: 0.695074.[0m
[32m[I 2022-10-26 02:50:52,565][0m Trial 44 finished with value: 0.6950742018218817 and parameters: {'gnb_var_smoothing': 0.588556773776626}. Best is trial 0 with value: 0.695074.[0m
[32m[I 2022-10-26 02:50:52,572][0m Trial 42 finished with value: 0.05163488645862473 and parameters: {'gnb_var_smoothing': 0.003867031230239017}. Best is trial 0 with value: 0.695074.[0m
[32m[I 2022-10-26 02:50:52,572][0m Trial 45 finished with value: 0.6950742018218817 and parameters: {'gnb_var_smoothing': 0.47871673723870467}. Best is trial 0 with value: 0.695074.[0m
[32m[I 2022-10-26 02:50:52,635][0m Trial 47 finished with value: 0.05163488645862473 and parameters: {'gnb_var_smoothing': 0.002931227814015257}. Best is trial 0 with value: 0.695074.[0m
[32m[I 2022-10-26 02:50:52,638][0m Trial 46 finished with value: 0.05163488645862473 and parameters: {'gnb_var_smoothing': 0.0019614680154956443}. Best is trial 0 with value: 0.695074.[0m
[32m[I 2022-10-26 02:50:53,994][0m Trial 48 finished with value: 0.05163488645862473 and parameters: {'gnb_var_smoothing': 0.0029923792148471287}. Best is trial 0 with value: 0.695074.[0m
[32m[I 2022-10-26 02:50:55,316][0m Trial 49 finished with value: 0.6950742018218817 and parameters: {'gnb_var_smoothing': 495.7749698493275}. Best is trial 0 with value: 0.695074.[0m
[32m[I 2022-10-26 02:50:55,632][0m Trial 53 finished with value: 0.6950742018218817 and parameters: {'gnb_var_smoothing': 3.6281444438570247}. Best is trial 0 with value: 0.695074.[0m
[32m[I 2022-10-26 02:50:55,779][0m Trial 54 finished with value: 0.6950742018218817 and parameters: {'gnb_var_smoothing': 901.3224977249798}. Best is trial 0 with value: 0.695074.[0m
[32m[I 2022-10-26 02:50:55,784][0m Trial 50 finished with value: 0.6950742018218817 and parameters: {'gnb_var_smoothing': 720.0264434520061}. Best is trial 0 with value: 0.695074.[0m
[32m[I 2022-10-26 02:50:55,785][0m Trial 51 finished with value: 0.6950742018218817 and parameters: {'gnb_var_smoothing': 569.1240880466078}. Best is trial 0 with value: 0.695074.[0m
[32m[I 2022-10-26 02:50:55,857][0m Trial 52 finished with value: 0.6950742018218817 and parameters: {'gnb_var_smoothing': 902.2017148920661}. Best is trial 0 with value: 0.695074.[0m
[32m[I 2022-10-26 02:50:55,857][0m Trial 55 finished with value: 0.6950742018218817 and parameters: {'gnb_var_smoothing': 942.6287731064568}. Best is trial 0 with value: 0.695074.[0m
[32m[I 2022-10-26 02:50:56,766][0m Trial 56 finished with value: 0.6950742018218817 and parameters: {'gnb_var_smoothing': 2.033775513767718}. Best is trial 0 with value: 0.695074.[0m
[32m[I 2022-10-26 02:50:58,136][0m Trial 57 finished with value: 0.6950742018218817 and parameters: {'gnb_var_smoothing': 2.2072443876665173}. Best is trial 0 with value: 0.695074.[0m
[32m[I 2022-10-26 02:50:58,842][0m Trial 58 finished with value: 0.6950742018218817 and parameters: {'gnb_var_smoothing': 5.800418520635846}. Best is trial 0 with value: 0.695074.[0m
[32m[I 2022-10-26 02:50:58,943][0m Trial 60 finished with value: 0.6950742018218817 and parameters: {'gnb_var_smoothing': 105.00752487871749}. Best is trial 0 with value: 0.695074.[0m
[32m[I 2022-10-26 02:50:59,028][0m Trial 59 finished with value: 0.6950742018218817 and parameters: {'gnb_var_smoothing': 108.09758841604227}. Best is trial 0 with value: 0.695074.[0m
[32m[I 2022-10-26 02:50:59,029][0m Trial 63 finished with value: 0.6950742018218817 and parameters: {'gnb_var_smoothing': 121.10312761255209}. Best is trial 0 with value: 0.695074.[0m
[32m[I 2022-10-26 02:50:59,031][0m Trial 61 finished with value: 0.6950742018218817 and parameters: {'gnb_var_smoothing': 172.93981948690586}. Best is trial 0 with value: 0.695074.[0m
[32m[I 2022-10-26 02:50:59,031][0m Trial 62 finished with value: 0.6950742018218817 and parameters: {'gnb_var_smoothing': 127.78756880930405}. Best is trial 0 with value: 0.695074.[0m
[32m[I 2022-10-26 02:50:59,610][0m Trial 64 finished with value: 0.6950742018218817 and parameters: {'gnb_var_smoothing': 185.25904616725376}. Best is trial 0 with value: 0.695074.[0m
[32m[I 2022-10-26 02:51:00,973][0m Trial 65 finished with value: 0.6950742018218817 and parameters: {'gnb_var_smoothing': 142.58023261234015}. Best is trial 0 with value: 0.695074.[0m
[32m[I 2022-10-26 02:51:01,764][0m Trial 66 finished with value: 0.6950742018218817 and parameters: {'gnb_var_smoothing': 0.6629792130931368}. Best is trial 0 with value: 0.695074.[0m
[32m[I 2022-10-26 02:51:02,074][0m Trial 69 finished with value: 0.05163488645862473 and parameters: {'gnb_var_smoothing': 4.054154054854722e-12}. Best is trial 0 with value: 0.695074.[0m
[32m[I 2022-10-26 02:51:02,082][0m Trial 70 finished with value: 0.6950742018218817 and parameters: {'gnb_var_smoothing': 0.3961381993126164}. Best is trial 0 with value: 0.695074.[0m
[32m[I 2022-10-26 02:51:02,083][0m Trial 67 finished with value: 0.6950742018218817 and parameters: {'gnb_var_smoothing': 0.6301917462759601}. Best is trial 0 with value: 0.695074.[0m
[32m[I 2022-10-26 02:51:02,293][0m Trial 71 finished with value: 0.6950742018218817 and parameters: {'gnb_var_smoothing': 0.5222578572400741}. Best is trial 0 with value: 0.695074.[0m
[32m[I 2022-10-26 02:51:02,294][0m Trial 68 finished with value: 0.05163488645862473 and parameters: {'gnb_var_smoothing': 1.0364701385687161e-12}. Best is trial 0 with value: 0.695074.[0m
[32m[I 2022-10-26 02:51:02,595][0m Trial 72 finished with value: 0.6950742018218817 and parameters: {'gnb_var_smoothing': 0.5835618173587521}. Best is trial 0 with value: 0.695074.[0m
[32m[I 2022-10-26 02:51:03,943][0m Trial 73 finished with value: 0.6950742018218817 and parameters: {'gnb_var_smoothing': 14.097582496604097}. Best is trial 0 with value: 0.695074.[0m
[32m[I 2022-10-26 02:51:04,794][0m Trial 74 finished with value: 0.6950742018218817 and parameters: {'gnb_var_smoothing': 32.80061723634315}. Best is trial 0 with value: 0.695074.[0m
[32m[I 2022-10-26 02:51:05,258][0m Trial 78 finished with value: 0.6950742018218817 and parameters: {'gnb_var_smoothing': 25.04000653137599}. Best is trial 0 with value: 0.695074.[0m
[32m[I 2022-10-26 02:51:05,376][0m Trial 77 finished with value: 0.6950742018218817 and parameters: {'gnb_var_smoothing': 29.837258381687203}. Best is trial 0 with value: 0.695074.[0m
[32m[I 2022-10-26 02:51:05,467][0m Trial 80 finished with value: 0.6950742018218817 and parameters: {'gnb_var_smoothing': 0.16135307840865887}. Best is trial 0 with value: 0.695074.[0m
[32m[I 2022-10-26 02:51:05,468][0m Trial 76 finished with value: 0.6950742018218817 and parameters: {'gnb_var_smoothing': 27.464839815614862}. Best is trial 0 with value: 0.695074.[0m
[32m[I 2022-10-26 02:51:05,469][0m Trial 75 finished with value: 0.6950742018218817 and parameters: {'gnb_var_smoothing': 30.842191324703034}. Best is trial 0 with value: 0.695074.[0m
[32m[I 2022-10-26 02:51:05,540][0m Trial 79 finished with value: 0.6950742018218817 and parameters: {'gnb_var_smoothing': 27.360565608366432}. Best is trial 0 with value: 0.695074.[0m
[32m[I 2022-10-26 02:51:06,827][0m Trial 81 finished with value: 0.6950742018218817 and parameters: {'gnb_var_smoothing': 0.22009287204037356}. Best is trial 0 with value: 0.695074.[0m
[32m[I 2022-10-26 02:51:07,605][0m Trial 82 finished with value: 0.6950742018218817 and parameters: {'gnb_var_smoothing': 10.030883244586546}. Best is trial 0 with value: 0.695074.[0m
[32m[I 2022-10-26 02:51:08,344][0m Trial 83 finished with value: 0.6950742018218817 and parameters: {'gnb_var_smoothing': 3.7117477252689857}. Best is trial 0 with value: 0.695074.[0m
[32m[I 2022-10-26 02:51:08,544][0m Trial 85 finished with value: 0.6950742018218817 and parameters: {'gnb_var_smoothing': 3.3859234038801875}. Best is trial 0 with value: 0.695074.[0m
[32m[I 2022-10-26 02:51:08,630][0m Trial 88 finished with value: 0.6950742018218817 and parameters: {'gnb_var_smoothing': 2.2600869795966974}. Best is trial 0 with value: 0.695074.[0m
[32m[I 2022-10-26 02:51:08,631][0m Trial 86 finished with value: 0.6950742018218817 and parameters: {'gnb_var_smoothing': 3.8213194882963863}. Best is trial 0 with value: 0.695074.[0m
[32m[I 2022-10-26 02:51:08,631][0m Trial 87 finished with value: 0.6950742018218817 and parameters: {'gnb_var_smoothing': 3.6439980115031387}. Best is trial 0 with value: 0.695074.[0m
[32m[I 2022-10-26 02:51:08,639][0m Trial 84 finished with value: 0.6950742018218817 and parameters: {'gnb_var_smoothing': 3.0044848081337743}. Best is trial 0 with value: 0.695074.[0m
[32m[I 2022-10-26 02:51:09,735][0m Trial 89 finished with value: 0.6950742018218817 and parameters: {'gnb_var_smoothing': 3.9592079974334617}. Best is trial 0 with value: 0.695074.[0m
[32m[I 2022-10-26 02:51:10,531][0m Trial 90 finished with value: 0.6950742018218817 and parameters: {'gnb_var_smoothing': 1.5911137962479625}. Best is trial 0 with value: 0.695074.[0m
[32m[I 2022-10-26 02:51:11,353][0m Trial 91 finished with value: 0.6950742018218817 and parameters: {'gnb_var_smoothing': 2.8481137690240157}. Best is trial 0 with value: 0.695074.[0m
[32m[I 2022-10-26 02:51:11,760][0m Trial 93 finished with value: 0.6950742018218817 and parameters: {'gnb_var_smoothing': 96.11108532368651}. Best is trial 0 with value: 0.695074.[0m
[32m[I 2022-10-26 02:51:11,873][0m Trial 96 finished with value: 0.6950742018218817 and parameters: {'gnb_var_smoothing': 186.47943131952533}. Best is trial 0 with value: 0.695074.[0m
