[32m[I 2022-10-26 21:37:40,286][0m Trial 56 finished with value: 0.09615246535891787 and parameters: {'mnb_alpha': 0.15000000000000002, 'mnb_fit_prior': False}. Best is trial 41 with value: 0.0961588.[0m
[32m[I 2022-10-26 21:37:40,286][0m Trial 59 finished with value: 0.09615246535891787 and parameters: {'mnb_alpha': 0.15000000000000002, 'mnb_fit_prior': False}. Best is trial 41 with value: 0.0961588.[0m
[32m[I 2022-10-26 21:37:40,362][0m Trial 61 finished with value: 0.09615246535891787 and parameters: {'mnb_alpha': 0.15000000000000002, 'mnb_fit_prior': False}. Best is trial 41 with value: 0.0961588.[0m
[32m[I 2022-10-26 21:37:40,432][0m Trial 57 finished with value: 0.09615246535891787 and parameters: {'mnb_alpha': 0.15000000000000002, 'mnb_fit_prior': False}. Best is trial 41 with value: 0.0961588.[0m
[32m[I 2022-10-26 21:37:40,506][0m Trial 60 finished with value: 0.09615246535891787 and parameters: {'mnb_alpha': 0.15000000000000002, 'mnb_fit_prior': False}. Best is trial 41 with value: 0.0961588.[0m
[32m[I 2022-10-26 21:37:40,644][0m Trial 63 finished with value: 0.09615246535891787 and parameters: {'mnb_alpha': 0.15000000000000002, 'mnb_fit_prior': False}. Best is trial 41 with value: 0.0961588.[0m
[32m[I 2022-10-26 21:37:40,709][0m Trial 62 finished with value: 0.09615246535891787 and parameters: {'mnb_alpha': 0.15000000000000002, 'mnb_fit_prior': False}. Best is trial 41 with value: 0.0961588.[0m
[32m[I 2022-10-26 21:37:40,710][0m Trial 58 finished with value: 0.09615246535891787 and parameters: {'mnb_alpha': 0.15000000000000002, 'mnb_fit_prior': False}. Best is trial 41 with value: 0.0961588.[0m
[32m[I 2022-10-26 21:37:43,039][0m Trial 67 finished with value: 0.09615262642719138 and parameters: {'mnb_alpha': 0.4, 'mnb_fit_prior': False}. Best is trial 41 with value: 0.0961588.[0m
[32m[I 2022-10-26 21:37:43,041][0m Trial 69 finished with value: 0.09615262642719138 and parameters: {'mnb_alpha': 0.4, 'mnb_fit_prior': False}. Best is trial 41 with value: 0.0961588.[0m
[32m[I 2022-10-26 21:37:43,179][0m Trial 68 finished with value: 0.09615262642719138 and parameters: {'mnb_alpha': 0.4, 'mnb_fit_prior': False}. Best is trial 41 with value: 0.0961588.[0m
[32m[I 2022-10-26 21:37:43,254][0m Trial 64 finished with value: 0.09615363715240817 and parameters: {'mnb_alpha': 0.8500000000000001, 'mnb_fit_prior': False}. Best is trial 41 with value: 0.0961588.[0m
[32m[I 2022-10-26 21:37:43,255][0m Trial 65 finished with value: 0.09615256504156225 and parameters: {'mnb_alpha': 0.35000000000000003, 'mnb_fit_prior': False}. Best is trial 41 with value: 0.0961588.[0m
[32m[I 2022-10-26 21:37:43,263][0m Trial 66 finished with value: 0.09615262642719138 and parameters: {'mnb_alpha': 0.45, 'mnb_fit_prior': False}. Best is trial 41 with value: 0.0961588.[0m
[32m[I 2022-10-26 21:37:43,263][0m Trial 71 finished with value: 0.09615262642719138 and parameters: {'mnb_alpha': 0.45, 'mnb_fit_prior': False}. Best is trial 41 with value: 0.0961588.[0m
[32m[I 2022-10-26 21:37:43,545][0m Trial 70 finished with value: 0.09615262642719138 and parameters: {'mnb_alpha': 0.4, 'mnb_fit_prior': False}. Best is trial 41 with value: 0.0961588.[0m
[32m[I 2022-10-26 21:37:45,817][0m Trial 74 finished with value: 0.09615363715240817 and parameters: {'mnb_alpha': 1.0, 'mnb_fit_prior': False}. Best is trial 41 with value: 0.0961588.[0m
[32m[I 2022-10-26 21:37:45,826][0m Trial 77 finished with value: 0.09615363715240817 and parameters: {'mnb_alpha': 1.0, 'mnb_fit_prior': False}. Best is trial 41 with value: 0.0961588.[0m
[32m[I 2022-10-26 21:37:45,827][0m Trial 76 finished with value: 0.09615363715240817 and parameters: {'mnb_alpha': 1.0, 'mnb_fit_prior': False}. Best is trial 41 with value: 0.0961588.[0m
[32m[I 2022-10-26 21:37:45,827][0m Trial 73 finished with value: 0.09615363715240817 and parameters: {'mnb_alpha': 1.0, 'mnb_fit_prior': False}. Best is trial 41 with value: 0.0961588.[0m
[32m[I 2022-10-26 21:37:46,046][0m Trial 78 finished with value: 0.09615363715240817 and parameters: {'mnb_alpha': 1.0, 'mnb_fit_prior': False}. Best is trial 41 with value: 0.0961588.[0m
[32m[I 2022-10-26 21:37:46,109][0m Trial 79 finished with value: 0.09615363715240817 and parameters: {'mnb_alpha': 1.0, 'mnb_fit_prior': False}. Best is trial 41 with value: 0.0961588.[0m
[32m[I 2022-10-26 21:37:46,114][0m Trial 72 finished with value: 0.09615363715240817 and parameters: {'mnb_alpha': 1.0, 'mnb_fit_prior': False}. Best is trial 41 with value: 0.0961588.[0m
[32m[I 2022-10-26 21:37:46,176][0m Trial 75 finished with value: 0.09615363715240817 and parameters: {'mnb_alpha': 1.0, 'mnb_fit_prior': False}. Best is trial 41 with value: 0.0961588.[0m
[32m[I 2022-10-26 21:37:48,576][0m Trial 81 finished with value: 0.09615363715240817 and parameters: {'mnb_alpha': 0.8500000000000001, 'mnb_fit_prior': False}. Best is trial 41 with value: 0.0961588.[0m
[32m[I 2022-10-26 21:37:48,586][0m Trial 80 finished with value: 0.09615363715240817 and parameters: {'mnb_alpha': 0.9, 'mnb_fit_prior': False}. Best is trial 41 with value: 0.0961588.[0m
[32m[I 2022-10-26 21:37:48,654][0m Trial 83 finished with value: 0.09615363715240817 and parameters: {'mnb_alpha': 0.9, 'mnb_fit_prior': False}. Best is trial 41 with value: 0.0961588.[0m
[32m[I 2022-10-26 21:37:48,655][0m Trial 82 finished with value: 0.09615363715240817 and parameters: {'mnb_alpha': 0.9, 'mnb_fit_prior': False}. Best is trial 41 with value: 0.0961588.[0m
[32m[I 2022-10-26 21:37:48,655][0m Trial 86 finished with value: 0.09615363715240817 and parameters: {'mnb_alpha': 0.9, 'mnb_fit_prior': False}. Best is trial 41 with value: 0.0961588.[0m
[32m[I 2022-10-26 21:37:48,656][0m Trial 84 finished with value: 0.09615363715240817 and parameters: {'mnb_alpha': 0.9, 'mnb_fit_prior': False}. Best is trial 41 with value: 0.0961588.[0m
[32m[I 2022-10-26 21:37:48,720][0m Trial 85 finished with value: 0.09615363715240817 and parameters: {'mnb_alpha': 0.9, 'mnb_fit_prior': False}. Best is trial 41 with value: 0.0961588.[0m
[32m[I 2022-10-26 21:37:48,789][0m Trial 87 finished with value: 0.09615363715240817 and parameters: {'mnb_alpha': 0.9, 'mnb_fit_prior': False}. Best is trial 41 with value: 0.0961588.[0m
[32m[I 2022-10-26 21:37:51,295][0m Trial 88 finished with value: 0.09615295755240336 and parameters: {'mnb_alpha': 0.05, 'mnb_fit_prior': False}. Best is trial 41 with value: 0.0961588.[0m
[32m[I 2022-10-26 21:37:51,391][0m Trial 95 finished with value: 0.09615295755240336 and parameters: {'mnb_alpha': 0.05, 'mnb_fit_prior': False}. Best is trial 41 with value: 0.0961588.[0m
[32m[I 2022-10-26 21:37:51,392][0m Trial 93 finished with value: 0.09615295755240336 and parameters: {'mnb_alpha': 0.05, 'mnb_fit_prior': False}. Best is trial 41 with value: 0.0961588.[0m
[32m[I 2022-10-26 21:37:51,531][0m Trial 89 finished with value: 0.09615295755240336 and parameters: {'mnb_alpha': 0.05, 'mnb_fit_prior': False}. Best is trial 41 with value: 0.0961588.[0m
[32m[I 2022-10-26 21:37:51,535][0m Trial 94 finished with value: 0.09615295755240336 and parameters: {'mnb_alpha': 0.05, 'mnb_fit_prior': False}. Best is trial 41 with value: 0.0961588.[0m
[32m[I 2022-10-26 21:37:51,601][0m Trial 90 finished with value: 0.09615295755240336 and parameters: {'mnb_alpha': 0.05, 'mnb_fit_prior': False}. Best is trial 41 with value: 0.0961588.[0m
[32m[I 2022-10-26 21:37:51,737][0m Trial 91 finished with value: 0.09615295755240336 and parameters: {'mnb_alpha': 0.05, 'mnb_fit_prior': False}. Best is trial 41 with value: 0.0961588.[0m
[32m[I 2022-10-26 21:37:51,805][0m Trial 92 finished with value: 0.09615295755240336 and parameters: {'mnb_alpha': 0.05, 'mnb_fit_prior': False}. Best is trial 41 with value: 0.0961588.[0m
[32m[I 2022-10-26 21:37:53,377][0m Trial 96 finished with value: 0.09615363715240817 and parameters: {'mnb_alpha': 0.9500000000000001, 'mnb_fit_prior': False}. Best is trial 41 with value: 0.0961588.[0m
[32m[I 2022-10-26 21:37:53,378][0m Trial 97 finished with value: 0.09615363715240817 and parameters: {'mnb_alpha': 0.9500000000000001, 'mnb_fit_prior': False}. Best is trial 41 with value: 0.0961588.[0m
[32m[I 2022-10-26 21:37:53,501][0m Trial 99 finished with value: 0.09615363715240817 and parameters: {'mnb_alpha': 0.9500000000000001, 'mnb_fit_prior': False}. Best is trial 41 with value: 0.0961588.[0m
[32m[I 2022-10-26 21:37:53,564][0m Trial 98 finished with value: 0.09615363715240817 and parameters: {'mnb_alpha': 0.9500000000000001, 'mnb_fit_prior': False}. Best is trial 41 with value: 0.0961588.[0m
[32m[I 2022-10-26 21:37:53,622][0m Study finished.[0m
[32m[I 2022-10-26 21:37:53,636][0m --------------------------------------------------------------------------------[0m
[32m[I 2022-10-26 21:37:53,637][0m --------------------      PassiveAggressiveClassifier       --------------------[0m
[32m[I 2022-10-26 21:37:53,637][0m --------------------------------------------------------------------------------[0m
[32m[I 2022-10-26 21:37:53,667][0m A new study created in RDB with name: PassiveAggressiveClassifier_c963b74b[0m
[32m[I 2022-10-26 21:37:53,673][0m Study started.[0m
[32m[I 2022-10-26 21:38:29,580][0m Trial 7 finished with value: 0.777186946682078 and parameters: {'pac_C': 0.00012417417649692347, 'pac_early_stopping': True, 'pac_validation_fraction': 0.25, 'pac_n_iter_no_change': 10}. Best is trial 7 with value: 0.777187.[0m
[32m[I 2022-10-26 21:38:30,806][0m Trial 1 finished with value: 0.7979305445405835 and parameters: {'pac_C': 0.006064804389677349, 'pac_early_stopping': True, 'pac_validation_fraction': 0.25, 'pac_n_iter_no_change': 10}. Best is trial 1 with value: 0.797931.[0m
[32m[I 2022-10-26 21:38:31,503][0m Trial 5 finished with value: 0.7979305445405835 and parameters: {'pac_C': 1.227257699489122, 'pac_early_stopping': True, 'pac_validation_fraction': 0.25, 'pac_n_iter_no_change': 10}. Best is trial 1 with value: 0.797931.[0m
[32m[I 2022-10-26 21:38:31,681][0m Trial 2 finished with value: 0.7979305445405835 and parameters: {'pac_C': 198.8344137951145, 'pac_early_stopping': True, 'pac_validation_fraction': 0.25, 'pac_n_iter_no_change': 10}. Best is trial 1 with value: 0.797931.[0m
[32m[I 2022-10-26 21:38:31,683][0m Trial 6 finished with value: 0.7979305445405835 and parameters: {'pac_C': 0.569475432710474, 'pac_early_stopping': True, 'pac_validation_fraction': 0.25, 'pac_n_iter_no_change': 10}. Best is trial 1 with value: 0.797931.[0m
[32m[I 2022-10-26 21:38:33,547][0m Trial 4 finished with value: 0.7979305445405835 and parameters: {'pac_C': 0.0069742218260815305, 'pac_early_stopping': True, 'pac_validation_fraction': 0.25, 'pac_n_iter_no_change': 10}. Best is trial 1 with value: 0.797931.[0m
[32m[I 2022-10-26 21:38:35,040][0m Trial 0 finished with value: 0.7979305445405835 and parameters: {'pac_C': 67.98759395981504, 'pac_early_stopping': True, 'pac_validation_fraction': 0.25, 'pac_n_iter_no_change': 10}. Best is trial 0 with value: 0.797931.[0m
[32m[I 2022-10-26 21:38:38,106][0m Trial 3 finished with value: 0.7642665903023229 and parameters: {'pac_C': 1.6251848916145299e-06, 'pac_early_stopping': True, 'pac_validation_fraction': 0.25, 'pac_n_iter_no_change': 10}. Best is trial 0 with value: 0.797931.[0m
[32m[I 2022-10-26 21:39:06,327][0m Trial 8 finished with value: 0.7979305445405835 and parameters: {'pac_C': 0.010346457010281735, 'pac_early_stopping': True, 'pac_validation_fraction': 0.25, 'pac_n_iter_no_change': 10}. Best is trial 0 with value: 0.797931.[0m
[32m[I 2022-10-26 21:39:06,477][0m Trial 9 finished with value: 0.7979305445405835 and parameters: {'pac_C': 0.9415942590128579, 'pac_early_stopping': True, 'pac_validation_fraction': 0.25, 'pac_n_iter_no_change': 10}. Best is trial 0 with value: 0.797931.[0m
[32m[I 2022-10-26 21:39:08,744][0m Trial 11 finished with value: 0.7979305445405835 and parameters: {'pac_C': 12.409614019220443, 'pac_early_stopping': True, 'pac_validation_fraction': 0.25, 'pac_n_iter_no_change': 10}. Best is trial 0 with value: 0.797931.[0m
[32m[I 2022-10-26 21:39:09,525][0m Trial 13 finished with value: 0.7979305445405835 and parameters: {'pac_C': 317.8330816802871, 'pac_early_stopping': True, 'pac_validation_fraction': 0.25, 'pac_n_iter_no_change': 10}. Best is trial 0 with value: 0.797931.[0m
[32m[I 2022-10-26 21:39:10,726][0m Trial 14 finished with value: 0.7979305445405835 and parameters: {'pac_C': 16.263345981363454, 'pac_early_stopping': True, 'pac_validation_fraction': 0.25, 'pac_n_iter_no_change': 10}. Best is trial 0 with value: 0.797931.[0m
[32m[I 2022-10-26 21:39:12,006][0m Trial 10 finished with value: 0.7250928408963156 and parameters: {'pac_C': 2.491921452483718e-05, 'pac_early_stopping': True, 'pac_validation_fraction': 0.25, 'pac_n_iter_no_change': 10}. Best is trial 0 with value: 0.797931.[0m
[32m[I 2022-10-26 21:39:12,400][0m Trial 12 finished with value: 0.7250615124103551 and parameters: {'pac_C': 2.3419724910590618e-05, 'pac_early_stopping': True, 'pac_validation_fraction': 0.25, 'pac_n_iter_no_change': 10}. Best is trial 0 with value: 0.797931.[0m
[32m[I 2022-10-26 21:39:17,852][0m Trial 15 finished with value: 0.7471675343275898 and parameters: {'pac_C': 1.0281253156148961e-05, 'pac_early_stopping': True, 'pac_validation_fraction': 0.25, 'pac_n_iter_no_change': 10}. Best is trial 0 with value: 0.797931.[0m
[32m[I 2022-10-26 21:39:41,880][0m Trial 16 finished with value: 0.7979305445405835 and parameters: {'pac_C': 291.6464343405309, 'pac_early_stopping': True, 'pac_validation_fraction': 0.25, 'pac_n_iter_no_change': 10}. Best is trial 0 with value: 0.797931.[0m
[32m[I 2022-10-26 21:39:42,617][0m Trial 17 finished with value: 0.7979305445405835 and parameters: {'pac_C': 519.5175870826795, 'pac_early_stopping': True, 'pac_validation_fraction': 0.25, 'pac_n_iter_no_change': 10}. Best is trial 0 with value: 0.797931.[0m
[32m[I 2022-10-26 21:39:44,149][0m Trial 18 finished with value: 0.7979305445405835 and parameters: {'pac_C': 770.013091690093, 'pac_early_stopping': True, 'pac_validation_fraction': 0.25, 'pac_n_iter_no_change': 10}. Best is trial 0 with value: 0.797931.[0m
[32m[I 2022-10-26 21:39:46,892][0m Trial 19 finished with value: 0.7976360011684666 and parameters: {'pac_C': 0.0005021247968661481, 'pac_early_stopping': True, 'pac_validation_fraction': 0.25, 'pac_n_iter_no_change': 10}. Best is trial 0 with value: 0.797931.[0m
[32m[I 2022-10-26 21:39:47,629][0m Trial 21 finished with value: 0.7979305445405835 and parameters: {'pac_C': 0.001286268624436565, 'pac_early_stopping': True, 'pac_validation_fraction': 0.25, 'pac_n_iter_no_change': 10}. Best is trial 0 with value: 0.797931.[0m
[32m[I 2022-10-26 21:39:48,376][0m Trial 20 finished with value: 0.7976365411764862 and parameters: {'pac_C': 0.0005149748709160258, 'pac_early_stopping': True, 'pac_validation_fraction': 0.25, 'pac_n_iter_no_change': 10}. Best is trial 0 with value: 0.797931.[0m
[32m[I 2022-10-26 21:39:49,634][0m Trial 22 finished with value: 0.7976348280814057 and parameters: {'pac_C': 0.0005796427288295689, 'pac_early_stopping': True, 'pac_validation_fraction': 0.25, 'pac_n_iter_no_change': 10}. Best is trial 0 with value: 0.797931.[0m
[32m[I 2022-10-26 21:39:53,642][0m Trial 23 finished with value: 0.7979305445405835 and parameters: {'pac_C': 0.0012325756586156749, 'pac_early_stopping': True, 'pac_validation_fraction': 0.25, 'pac_n_iter_no_change': 10}. Best is trial 0 with value: 0.797931.[0m
[32m[I 2022-10-26 21:40:17,432][0m Trial 24 finished with value: 0.7979305445405835 and parameters: {'pac_C': 8.366838175026837, 'pac_early_stopping': True, 'pac_validation_fraction': 0.25, 'pac_n_iter_no_change': 10}. Best is trial 0 with value: 0.797931.[0m
[32m[I 2022-10-26 21:40:18,190][0m Trial 25 finished with value: 0.7979305445405835 and parameters: {'pac_C': 16.897217135594463, 'pac_early_stopping': True, 'pac_validation_fraction': 0.25, 'pac_n_iter_no_change': 10}. Best is trial 0 with value: 0.797931.[0m
[32m[I 2022-10-26 21:40:19,730][0m Trial 26 finished with value: 0.7979305445405835 and parameters: {'pac_C': 27.829304360391436, 'pac_early_stopping': True, 'pac_validation_fraction': 0.25, 'pac_n_iter_no_change': 10}. Best is trial 0 with value: 0.797931.[0m
[32m[I 2022-10-26 21:40:21,893][0m Trial 27 finished with value: 0.7979305445405835 and parameters: {'pac_C': 24.200462600041547, 'pac_early_stopping': True, 'pac_validation_fraction': 0.25, 'pac_n_iter_no_change': 10}. Best is trial 0 with value: 0.797931.[0m
[32m[I 2022-10-26 21:40:23,675][0m Trial 29 finished with value: 0.7979305445405835 and parameters: {'pac_C': 26.063361650728083, 'pac_early_stopping': True, 'pac_validation_fraction': 0.25, 'pac_n_iter_no_change': 10}. Best is trial 0 with value: 0.797931.[0m
[32m[I 2022-10-26 21:40:26,046][0m Trial 28 finished with value: 0.7979305445405835 and parameters: {'pac_C': 944.114848072267, 'pac_early_stopping': True, 'pac_validation_fraction': 0.25, 'pac_n_iter_no_change': 10}. Best is trial 0 with value: 0.797931.[0m
[32m[I 2022-10-26 21:40:27,171][0m Trial 30 finished with value: 0.7979305445405835 and parameters: {'pac_C': 901.71695857618, 'pac_early_stopping': True, 'pac_validation_fraction': 0.25, 'pac_n_iter_no_change': 10}. Best is trial 0 with value: 0.797931.[0m
[32m[I 2022-10-26 21:40:29,236][0m Trial 31 finished with value: 0.7979305445405835 and parameters: {'pac_C': 0.10617197957874931, 'pac_early_stopping': True, 'pac_validation_fraction': 0.25, 'pac_n_iter_no_change': 10}. Best is trial 0 with value: 0.797931.[0m
[32m[I 2022-10-26 21:40:53,006][0m Trial 32 finished with value: 0.7979305445405835 and parameters: {'pac_C': 0.08335095803789663, 'pac_early_stopping': True, 'pac_validation_fraction': 0.25, 'pac_n_iter_no_change': 10}. Best is trial 0 with value: 0.797931.[0m
[32m[I 2022-10-26 21:40:54,039][0m Trial 33 finished with value: 0.7979305445405835 and parameters: {'pac_C': 0.07677361192146741, 'pac_early_stopping': True, 'pac_validation_fraction': 0.25, 'pac_n_iter_no_change': 10}. Best is trial 0 with value: 0.797931.[0m
[32m[I 2022-10-26 21:40:55,481][0m Trial 34 finished with value: 0.7979305445405835 and parameters: {'pac_C': 0.15826424025524805, 'pac_early_stopping': True, 'pac_validation_fraction': 0.25, 'pac_n_iter_no_change': 10}. Best is trial 0 with value: 0.797931.[0m
[32m[I 2022-10-26 21:40:57,581][0m Trial 35 finished with value: 0.7979305445405835 and parameters: {'pac_C': 0.07527856011340617, 'pac_early_stopping': True, 'pac_validation_fraction': 0.25, 'pac_n_iter_no_change': 10}. Best is trial 0 with value: 0.797931.[0m
[32m[I 2022-10-26 21:40:59,441][0m Trial 36 finished with value: 0.7979305445405835 and parameters: {'pac_C': 0.1558771597533936, 'pac_early_stopping': True, 'pac_validation_fraction': 0.25, 'pac_n_iter_no_change': 10}. Best is trial 0 with value: 0.797931.[0m
[32m[I 2022-10-26 21:41:03,180][0m Trial 37 finished with value: 0.7979305445405835 and parameters: {'pac_C': 0.06572272950384572, 'pac_early_stopping': True, 'pac_validation_fraction': 0.25, 'pac_n_iter_no_change': 10}. Best is trial 0 with value: 0.797931.[0m
[32m[I 2022-10-26 21:41:05,392][0m Trial 38 finished with value: 0.7979305445405835 and parameters: {'pac_C': 89.6906599211624, 'pac_early_stopping': True, 'pac_validation_fraction': 0.25, 'pac_n_iter_no_change': 10}. Best is trial 0 with value: 0.797931.[0m
[32m[I 2022-10-26 21:41:05,392][0m Trial 39 finished with value: 0.7979305445405835 and parameters: {'pac_C': 114.3612457871789, 'pac_early_stopping': True, 'pac_validation_fraction': 0.25, 'pac_n_iter_no_change': 10}. Best is trial 0 with value: 0.797931.[0m
[32m[I 2022-10-26 21:41:29,347][0m Trial 40 finished with value: 0.7979305445405835 and parameters: {'pac_C': 83.84228448590899, 'pac_early_stopping': True, 'pac_validation_fraction': 0.25, 'pac_n_iter_no_change': 10}. Best is trial 0 with value: 0.797931.[0m
[32m[I 2022-10-26 21:41:30,561][0m Trial 41 finished with value: 0.7979305445405835 and parameters: {'pac_C': 86.23315102667787, 'pac_early_stopping': True, 'pac_validation_fraction': 0.25, 'pac_n_iter_no_change': 10}. Best is trial 0 with value: 0.797931.[0m
[32m[I 2022-10-26 21:41:32,276][0m Trial 42 finished with value: 0.7979305445405835 and parameters: {'pac_C': 2.5868761321754676, 'pac_early_stopping': True, 'pac_validation_fraction': 0.25, 'pac_n_iter_no_change': 10}. Best is trial 0 with value: 0.797931.[0m
[32m[I 2022-10-26 21:41:33,795][0m Trial 43 finished with value: 0.7979305445405835 and parameters: {'pac_C': 0.05985727939202997, 'pac_early_stopping': True, 'pac_validation_fraction': 0.25, 'pac_n_iter_no_change': 10}. Best is trial 0 with value: 0.797931.[0m
[32m[I 2022-10-26 21:41:35,837][0m Trial 44 finished with value: 0.7979305445405835 and parameters: {'pac_C': 3.0518164262203102, 'pac_early_stopping': True, 'pac_validation_fraction': 0.25, 'pac_n_iter_no_change': 10}. Best is trial 0 with value: 0.797931.[0m
[32m[I 2022-10-26 21:41:38,862][0m Trial 45 finished with value: 0.7979305445405835 and parameters: {'pac_C': 0.0021182455769417846, 'pac_early_stopping': True, 'pac_validation_fraction': 0.25, 'pac_n_iter_no_change': 10}. Best is trial 0 with value: 0.797931.[0m
[32m[I 2022-10-26 21:41:41,274][0m Trial 46 finished with value: 0.7979305445405835 and parameters: {'pac_C': 3.495922735150788, 'pac_early_stopping': True, 'pac_validation_fraction': 0.25, 'pac_n_iter_no_change': 10}. Best is trial 0 with value: 0.797931.[0m
[32m[I 2022-10-26 21:41:41,274][0m Trial 47 finished with value: 0.7979305445405835 and parameters: {'pac_C': 4.440693375197729, 'pac_early_stopping': True, 'pac_validation_fraction': 0.25, 'pac_n_iter_no_change': 10}. Best is trial 0 with value: 0.797931.[0m
