[32m[I 2022-10-27 01:53:41,363][0m Trial 0 finished with value: 0.9966939191634422 and parameters: {'xgbc_n_estimators': 110, 'xgbc_use_label_encoder': False, 'xgbc_learning_rate': 0.00309746679471927, 'xgbc_booster': 'gbtree', 'xgbc_gamma': 0.001465559741932279}. Best is trial 3 with value: 0.999916.[0m
[32m[I 2022-10-27 01:54:24,949][0m Trial 2 finished with value: 0.9999825981388429 and parameters: {'xgbc_n_estimators': 150, 'xgbc_use_label_encoder': False, 'xgbc_learning_rate': 0.4448593599168706, 'xgbc_booster': 'gbtree', 'xgbc_gamma': 1.9738301382211982e-05}. Best is trial 2 with value: 0.999983.[0m
[32m[I 2022-10-27 02:05:23,982][0m Trial 6 finished with value: 0.9958366239995311 and parameters: {'xgbc_n_estimators': 130, 'xgbc_use_label_encoder': False, 'xgbc_learning_rate': 6.260765834238792e-05, 'xgbc_booster': 'gbtree', 'xgbc_gamma': 1.5065380727770534e-05}. Best is trial 2 with value: 0.999983.[0m
[32m[I 2022-10-27 02:06:54,926][0m Trial 5 finished with value: 0.9965485211325545 and parameters: {'xgbc_n_estimators': 170, 'xgbc_use_label_encoder': False, 'xgbc_learning_rate': 0.0003125263229467132, 'xgbc_booster': 'gbtree', 'xgbc_gamma': 0.04780127265039895}. Best is trial 2 with value: 0.999983.[0m
[32m[I 2022-10-27 02:10:00,880][0m Trial 7 finished with value: 0.996723974968167 and parameters: {'xgbc_n_estimators': 50, 'xgbc_use_label_encoder': False, 'xgbc_learning_rate': 0.023353555475881988, 'xgbc_booster': 'dart', 'xgbc_gamma': 3.4282321124678774e-06}. Best is trial 2 with value: 0.999983.[0m
[32m[I 2022-10-27 02:11:26,142][0m Trial 9 finished with value: 0.6950742018218817 and parameters: {'xgbc_n_estimators': 140, 'xgbc_use_label_encoder': False, 'xgbc_learning_rate': 1.724568919804351e-05, 'xgbc_booster': 'gblinear', 'xgbc_gamma': 0.013199110869440665}. Best is trial 2 with value: 0.999983.[0m
[32m[I 2022-10-27 02:13:40,663][0m Trial 10 finished with value: 0.6950742018218817 and parameters: {'xgbc_n_estimators': 110, 'xgbc_use_label_encoder': False, 'xgbc_learning_rate': 0.0004130780370234415, 'xgbc_booster': 'gblinear', 'xgbc_gamma': 2.535776259966147e-05}. Best is trial 2 with value: 0.999983.[0m
[32m[I 2022-10-27 02:21:21,176][0m Trial 12 finished with value: 0.728017063624208 and parameters: {'xgbc_n_estimators': 190, 'xgbc_use_label_encoder': False, 'xgbc_learning_rate': 0.9898003999185443, 'xgbc_booster': 'gbtree', 'xgbc_gamma': 2.9072484506044086e-05}. Best is trial 2 with value: 0.999983.[0m
[32m[I 2022-10-27 02:23:22,183][0m Trial 11 finished with value: 0.9999825985410074 and parameters: {'xgbc_n_estimators': 180, 'xgbc_use_label_encoder': False, 'xgbc_learning_rate': 0.4965391521333946, 'xgbc_booster': 'gbtree', 'xgbc_gamma': 9.893431546919315e-05}. Best is trial 2 with value: 0.999983.[0m
[32m[I 2022-10-27 02:27:13,341][0m Trial 1 finished with value: 0.99994534979111 and parameters: {'xgbc_n_estimators': 90, 'xgbc_use_label_encoder': False, 'xgbc_learning_rate': 0.1731162413082823, 'xgbc_booster': 'dart', 'xgbc_gamma': 0.024246530607266323}. Best is trial 2 with value: 0.999983.[0m
[32m[I 2022-10-27 02:27:23,977][0m Trial 13 finished with value: 0.9988312895862792 and parameters: {'xgbc_n_estimators': 70, 'xgbc_use_label_encoder': False, 'xgbc_learning_rate': 0.043441448736735486, 'xgbc_booster': 'gbtree', 'xgbc_gamma': 0.6181299314619103}. Best is trial 2 with value: 0.999983.[0m
[32m[I 2022-10-27 02:40:34,269][0m Trial 14 finished with value: 0.999900663527029 and parameters: {'xgbc_n_estimators': 200, 'xgbc_use_label_encoder': False, 'xgbc_learning_rate': 0.059284827335713414, 'xgbc_booster': 'gbtree', 'xgbc_gamma': 0.0004236412561234339}. Best is trial 2 with value: 0.999983.[0m
[32m[I 2022-10-27 02:45:09,633][0m Trial 16 finished with value: 0.9975323502154638 and parameters: {'xgbc_n_estimators': 200, 'xgbc_use_label_encoder': False, 'xgbc_learning_rate': 0.006717206765580157, 'xgbc_booster': 'gbtree', 'xgbc_gamma': 0.00013197919297598226}. Best is trial 2 with value: 0.999983.[0m
[32m[I 2022-10-27 02:45:10,420][0m Trial 15 finished with value: 0.9991844084149862 and parameters: {'xgbc_n_estimators': 200, 'xgbc_use_label_encoder': False, 'xgbc_learning_rate': 0.022835319652388584, 'xgbc_booster': 'gbtree', 'xgbc_gamma': 0.0002447858848268247}. Best is trial 2 with value: 0.999983.[0m
[32m[I 2022-10-27 02:54:36,315][0m Trial 17 finished with value: 0.9975323502154638 and parameters: {'xgbc_n_estimators': 160, 'xgbc_use_label_encoder': False, 'xgbc_learning_rate': 0.008122034153718476, 'xgbc_booster': 'gbtree', 'xgbc_gamma': 0.00011965182867294393}. Best is trial 2 with value: 0.999983.[0m
[32m[I 2022-10-27 02:55:13,650][0m Trial 18 finished with value: 0.999987569320571 and parameters: {'xgbc_n_estimators': 160, 'xgbc_use_label_encoder': False, 'xgbc_learning_rate': 0.6043091754398037, 'xgbc_booster': 'gbtree', 'xgbc_gamma': 0.0001071272418786722}. Best is trial 18 with value: 0.999988.[0m
[32m[I 2022-10-27 02:56:41,151][0m Trial 19 finished with value: 0.9999801119168742 and parameters: {'xgbc_n_estimators': 160, 'xgbc_use_label_encoder': False, 'xgbc_learning_rate': 0.35494994191220175, 'xgbc_booster': 'gbtree', 'xgbc_gamma': 1.6032780046711226e-06}. Best is trial 18 with value: 0.999988.[0m
[32m[I 2022-10-27 03:02:36,536][0m Trial 22 finished with value: 0.6950742018218817 and parameters: {'xgbc_n_estimators': 180, 'xgbc_use_label_encoder': False, 'xgbc_learning_rate': 0.001305515317038303, 'xgbc_booster': 'gblinear', 'xgbc_gamma': 0.0056475308626582335}. Best is trial 18 with value: 0.999988.[0m
[32m[I 2022-10-27 03:03:16,135][0m Trial 21 finished with value: 0.04927109885642248 and parameters: {'xgbc_n_estimators': 170, 'xgbc_use_label_encoder': False, 'xgbc_learning_rate': 0.1440802447139213, 'xgbc_booster': 'gblinear', 'xgbc_gamma': 1.5801627350629508e-06}. Best is trial 18 with value: 0.999988.[0m
[32m[I 2022-10-27 03:04:05,804][0m Trial 23 finished with value: 0.9967988190981049 and parameters: {'xgbc_n_estimators': 10, 'xgbc_use_label_encoder': False, 'xgbc_learning_rate': 0.09698976564000462, 'xgbc_booster': 'dart', 'xgbc_gamma': 0.0019261846141341175}. Best is trial 18 with value: 0.999988.[0m
[32m[I 2022-10-27 03:05:58,528][0m Trial 20 finished with value: 0.9999825984163768 and parameters: {'xgbc_n_estimators': 160, 'xgbc_use_label_encoder': False, 'xgbc_learning_rate': 0.6020867423130418, 'xgbc_booster': 'gbtree', 'xgbc_gamma': 1.3995132401961678e-06}. Best is trial 18 with value: 0.999988.[0m
[32m[I 2022-10-27 03:11:26,544][0m Trial 24 finished with value: 0.9999825981388429 and parameters: {'xgbc_n_estimators': 140, 'xgbc_use_label_encoder': False, 'xgbc_learning_rate': 0.8223506884339793, 'xgbc_booster': 'gbtree', 'xgbc_gamma': 5.981846229422435e-05}. Best is trial 18 with value: 0.999988.[0m
[32m[I 2022-10-27 03:12:28,052][0m Trial 25 finished with value: 0.999980114762584 and parameters: {'xgbc_n_estimators': 140, 'xgbc_use_label_encoder': False, 'xgbc_learning_rate': 0.8102273285565167, 'xgbc_booster': 'gbtree', 'xgbc_gamma': 6.032230848019481e-05}. Best is trial 18 with value: 0.999988.[0m
[32m[I 2022-10-27 03:13:47,002][0m Trial 26 finished with value: 0.99997514146695 and parameters: {'xgbc_n_estimators': 130, 'xgbc_use_label_encoder': False, 'xgbc_learning_rate': 0.8513173838969248, 'xgbc_booster': 'gbtree', 'xgbc_gamma': 5.482361661049352e-05}. Best is trial 18 with value: 0.999988.[0m
[32m[I 2022-10-27 03:22:21,072][0m Trial 27 finished with value: 0.9999676911836458 and parameters: {'xgbc_n_estimators': 130, 'xgbc_use_label_encoder': False, 'xgbc_learning_rate': 0.18523804375664468, 'xgbc_booster': 'gbtree', 'xgbc_gamma': 5.574382761593513e-06}. Best is trial 18 with value: 0.999988.[0m
[32m[I 2022-10-27 03:22:57,712][0m Trial 28 finished with value: 0.9999378903277459 and parameters: {'xgbc_n_estimators': 120, 'xgbc_use_label_encoder': False, 'xgbc_learning_rate': 0.1372643085956002, 'xgbc_booster': 'gbtree', 'xgbc_gamma': 3.970796507611786e-06}. Best is trial 18 with value: 0.999988.[0m
[32m[I 2022-10-27 03:28:29,187][0m Trial 29 finished with value: 0.9999751419972758 and parameters: {'xgbc_n_estimators': 180, 'xgbc_use_label_encoder': False, 'xgbc_learning_rate': 0.16057147956348228, 'xgbc_booster': 'gbtree', 'xgbc_gamma': 3.845581079312764e-06}. Best is trial 18 with value: 0.999988.[0m
[32m[I 2022-10-27 03:38:20,458][0m Trial 30 finished with value: 0.9988362655389543 and parameters: {'xgbc_n_estimators': 180, 'xgbc_use_label_encoder': False, 'xgbc_learning_rate': 0.018566374480594908, 'xgbc_booster': 'gbtree', 'xgbc_gamma': 1.1129599301519229e-06}. Best is trial 18 with value: 0.999988.[0m
[32m[I 2022-10-27 03:38:57,580][0m Trial 31 finished with value: 0.9988263212987762 and parameters: {'xgbc_n_estimators': 180, 'xgbc_use_label_encoder': False, 'xgbc_learning_rate': 0.016186838049803268, 'xgbc_booster': 'gbtree', 'xgbc_gamma': 0.3009659533750356}. Best is trial 18 with value: 0.999988.[0m
[32m[I 2022-10-27 03:50:44,554][0m Trial 34 finished with value: 0.9999801119168742 and parameters: {'xgbc_n_estimators': 150, 'xgbc_use_label_encoder': False, 'xgbc_learning_rate': 0.27004980655883504, 'xgbc_booster': 'gbtree', 'xgbc_gamma': 0.002127525714691686}. Best is trial 18 with value: 0.999988.[0m
[32m[I 2022-10-27 04:21:47,766][0m Trial 32 finished with value: 0.9967887735451932 and parameters: {'xgbc_n_estimators': 100, 'xgbc_use_label_encoder': False, 'xgbc_learning_rate': 0.008858333408974036, 'xgbc_booster': 'dart', 'xgbc_gamma': 0.0016322296829108197}. Best is trial 18 with value: 0.999988.[0m
[32m[I 2022-10-27 04:22:57,752][0m Trial 33 finished with value: 0.996706637620131 and parameters: {'xgbc_n_estimators': 90, 'xgbc_use_label_encoder': False, 'xgbc_learning_rate': 0.0041314004054544395, 'xgbc_booster': 'dart', 'xgbc_gamma': 0.0013170805797195983}. Best is trial 18 with value: 0.999988.[0m
[32m[I 2022-10-27 04:24:38,148][0m Trial 8 finished with value: 0.9999304409451869 and parameters: {'xgbc_n_estimators': 170, 'xgbc_use_label_encoder': False, 'xgbc_learning_rate': 0.0796564492025438, 'xgbc_booster': 'dart', 'xgbc_gamma': 2.8642357530571614e-05}. Best is trial 18 with value: 0.999988.[0m
[32m[I 2022-10-27 04:32:32,287][0m Trial 36 finished with value: 0.9999776250451295 and parameters: {'xgbc_n_estimators': 160, 'xgbc_use_label_encoder': False, 'xgbc_learning_rate': 0.41043007396866293, 'xgbc_booster': 'gbtree', 'xgbc_gamma': 1.3199898168681758e-05}. Best is trial 18 with value: 0.999988.[0m
[32m[I 2022-10-27 04:33:51,588][0m Trial 37 finished with value: 0.9999825985410074 and parameters: {'xgbc_n_estimators': 160, 'xgbc_use_label_encoder': False, 'xgbc_learning_rate': 0.4576094017234848, 'xgbc_booster': 'gbtree', 'xgbc_gamma': 1.5892651865874186e-05}. Best is trial 18 with value: 0.999988.[0m
[32m[I 2022-10-27 04:36:10,198][0m Trial 38 finished with value: 0.999980114762584 and parameters: {'xgbc_n_estimators': 160, 'xgbc_use_label_encoder': False, 'xgbc_learning_rate': 0.3706859376102232, 'xgbc_booster': 'gbtree', 'xgbc_gamma': 1.4268816918022941e-05}. Best is trial 18 with value: 0.999988.[0m
[32m[I 2022-10-27 04:42:57,647][0m Trial 39 finished with value: 0.9999825985410074 and parameters: {'xgbc_n_estimators': 150, 'xgbc_use_label_encoder': False, 'xgbc_learning_rate': 0.4019847028657991, 'xgbc_booster': 'gbtree', 'xgbc_gamma': 0.0002462315575121829}. Best is trial 18 with value: 0.999988.[0m
[32m[I 2022-10-27 04:47:01,746][0m Trial 40 finished with value: 0.9998410298103458 and parameters: {'xgbc_n_estimators': 150, 'xgbc_use_label_encoder': False, 'xgbc_learning_rate': 0.044685943627711985, 'xgbc_booster': 'gbtree', 'xgbc_gamma': 0.00018670260245502666}. Best is trial 18 with value: 0.999988.[0m
[32m[I 2022-10-27 04:49:39,573][0m Trial 41 finished with value: 0.9956413108536409 and parameters: {'xgbc_n_estimators': 150, 'xgbc_use_label_encoder': False, 'xgbc_learning_rate': 1.6016195872698482e-06, 'xgbc_booster': 'gbtree', 'xgbc_gamma': 0.00016857225073004463}. Best is trial 18 with value: 0.999988.[0m
[32m[I 2022-10-27 04:50:35,141][0m Trial 43 finished with value: 0.6950742018218817 and parameters: {'xgbc_n_estimators': 120, 'xgbc_use_label_encoder': False, 'xgbc_learning_rate': 1.1327369078874255e-06, 'xgbc_booster': 'gblinear', 'xgbc_gamma': 0.0003416793393785915}. Best is trial 18 with value: 0.999988.[0m
[32m[I 2022-10-27 04:56:15,792][0m Trial 42 finished with value: 0.995633645978882 and parameters: {'xgbc_n_estimators': 150, 'xgbc_use_label_encoder': False, 'xgbc_learning_rate': 1.5232037660394226e-06, 'xgbc_booster': 'gbtree', 'xgbc_gamma': 0.00039460504003523914}. Best is trial 18 with value: 0.999988.[0m
[32m[I 2022-10-27 05:01:40,067][0m Trial 44 finished with value: 0.9999776215753453 and parameters: {'xgbc_n_estimators': 190, 'xgbc_use_label_encoder': False, 'xgbc_learning_rate': 0.5496818027750352, 'xgbc_booster': 'gbtree', 'xgbc_gamma': 0.0005717973580906736}. Best is trial 18 with value: 0.999988.[0m
[32m[I 2022-10-27 05:02:48,310][0m Trial 45 finished with value: 0.999985082821062 and parameters: {'xgbc_n_estimators': 190, 'xgbc_use_label_encoder': False, 'xgbc_learning_rate': 0.4727017909085391, 'xgbc_booster': 'gbtree', 'xgbc_gamma': 8.084063244071141e-06}. Best is trial 18 with value: 0.999988.[0m
[32m[I 2022-10-27 05:07:27,675][0m Trial 46 finished with value: 0.999987569320571 and parameters: {'xgbc_n_estimators': 170, 'xgbc_use_label_encoder': False, 'xgbc_learning_rate': 0.5250072198199575, 'xgbc_booster': 'gbtree', 'xgbc_gamma': 0.0008164931061328858}. Best is trial 46 with value: 0.999988.[0m
[32m[I 2022-10-27 05:14:23,904][0m Trial 47 finished with value: 0.9999776254048643 and parameters: {'xgbc_n_estimators': 170, 'xgbc_use_label_encoder': False, 'xgbc_learning_rate': 0.2590240713206243, 'xgbc_booster': 'gbtree', 'xgbc_gamma': 8.654695877534282e-06}. Best is trial 18 with value: 0.999988.[0m
[32m[I 2022-10-27 05:16:56,292][0m Trial 48 finished with value: 0.9999776286513333 and parameters: {'xgbc_n_estimators': 190, 'xgbc_use_label_encoder': False, 'xgbc_learning_rate': 0.23826458931530517, 'xgbc_booster': 'gbtree', 'xgbc_gamma': 7.328760869066707e-06}. Best is trial 18 with value: 0.999988.[0m
[32m[I 2022-10-27 05:22:00,069][0m Trial 49 finished with value: 0.999972655355715 and parameters: {'xgbc_n_estimators': 190, 'xgbc_use_label_encoder': False, 'xgbc_learning_rate': 0.21742601368846365, 'xgbc_booster': 'gbtree', 'xgbc_gamma': 9.230249864120457e-06}. Best is trial 18 with value: 0.999988.[0m
[32m[I 2022-10-27 05:52:15,314][0m Trial 35 finished with value: 0.9999825959482587 and parameters: {'xgbc_n_estimators': 160, 'xgbc_use_label_encoder': False, 'xgbc_learning_rate': 0.44303910482947534, 'xgbc_booster': 'dart', 'xgbc_gamma': 1.4243613774861375e-05}. Best is trial 18 with value: 0.999988.[0m
[32m[I 2022-10-27 07:40:53,123][0m Trial 52 finished with value: 0.9958366239995311 and parameters: {'xgbc_n_estimators': 170, 'xgbc_use_label_encoder': False, 'xgbc_learning_rate': 6.783200598614529e-05, 'xgbc_booster': 'dart', 'xgbc_gamma': 3.200792873375937e-05}. Best is trial 18 with value: 0.999988.[0m
[32m[I 2022-10-27 08:02:20,691][0m Trial 50 finished with value: 0.9999453322694264 and parameters: {'xgbc_n_estimators': 190, 'xgbc_use_label_encoder': False, 'xgbc_learning_rate': 0.09695595266219618, 'xgbc_booster': 'dart', 'xgbc_gamma': 0.0033536819693163653}. Best is trial 18 with value: 0.999988.[0m
[32m[I 2022-10-27 08:05:48,201][0m Trial 51 finished with value: 0.9958366239995311 and parameters: {'xgbc_n_estimators': 190, 'xgbc_use_label_encoder': False, 'xgbc_learning_rate': 3.690258288924813e-05, 'xgbc_booster': 'dart', 'xgbc_gamma': 3.0046084224914627e-05}. Best is trial 18 with value: 0.999988.[0m
[32m[I 2022-10-27 08:05:48,275][0m Study finished.[0m
[32m[I 2022-10-27 08:05:49,303][0m Optimization finished.[0m
