[32m[I 2022-10-26 17:50:59,835][0m Trial 22 finished with value: 0.8473540518986168 and parameters: {'mlpc_hidden_layer_count': 1, 'mlpc_learning_rate': 'adaptive', 'mlpc_learning_rate_init': 0.000132293006264372, 'mplc_max_iter': 2000}. Best is trial 15 with value: 0.927558.[0m
[32m[I 2022-10-26 17:51:00,180][0m sklearn.model_selection.train_test_split: running accelerated version on CPU[0m
[32m[I 2022-10-26 17:51:00,217][0m sklearn.model_selection.train_test_split: fallback to original Scikit-learn[0m
[32m[I 2022-10-26 17:52:28,191][0m Trial 23 finished with value: 0.8633388896461248 and parameters: {'mlpc_hidden_layer_count': 1, 'mlpc_learning_rate': 'adaptive', 'mlpc_learning_rate_init': 0.00011987116290349014, 'mplc_max_iter': 2000}. Best is trial 15 with value: 0.927558.[0m
[32m[I 2022-10-26 17:52:28,511][0m sklearn.model_selection.train_test_split: running accelerated version on CPU[0m
[32m[I 2022-10-26 17:52:28,538][0m sklearn.model_selection.train_test_split: fallback to original Scikit-learn[0m
[32m[I 2022-10-26 17:52:56,410][0m Trial 19 finished with value: 0.90303631041188 and parameters: {'mlpc_hidden_layer_count': 2, 'mlpc_learning_rate': 'adaptive', 'mlpc_learning_rate_init': 0.00010593092822052676, 'mplc_max_iter': 2000}. Best is trial 15 with value: 0.927558.[0m
[32m[I 2022-10-26 17:52:56,730][0m sklearn.model_selection.train_test_split: running accelerated version on CPU[0m
[32m[I 2022-10-26 17:52:56,755][0m sklearn.model_selection.train_test_split: fallback to original Scikit-learn[0m
[32m[I 2022-10-26 17:59:36,460][0m Trial 24 finished with value: 0.8726033990524248 and parameters: {'mlpc_hidden_layer_count': 1, 'mlpc_learning_rate': 'adaptive', 'mlpc_learning_rate_init': 0.00010202056922685256, 'mplc_max_iter': 2000}. Best is trial 15 with value: 0.927558.[0m
[32m[I 2022-10-26 17:59:36,794][0m sklearn.model_selection.train_test_split: running accelerated version on CPU[0m
[32m[I 2022-10-26 17:59:36,821][0m sklearn.model_selection.train_test_split: fallback to original Scikit-learn[0m
[32m[I 2022-10-26 17:59:37,462][0m Trial 27 finished with value: 0.9049828721469012 and parameters: {'mlpc_hidden_layer_count': 1, 'mlpc_learning_rate': 'adaptive', 'mlpc_learning_rate_init': 0.0005339935953775741, 'mplc_max_iter': 2000}. Best is trial 15 with value: 0.927558.[0m
[32m[I 2022-10-26 17:59:37,788][0m sklearn.model_selection.train_test_split: running accelerated version on CPU[0m
[32m[I 2022-10-26 17:59:37,816][0m sklearn.model_selection.train_test_split: fallback to original Scikit-learn[0m
[32m[I 2022-10-26 17:59:41,470][0m Trial 25 finished with value: 0.4294617375253055 and parameters: {'mlpc_hidden_layer_count': 1, 'mlpc_learning_rate': 'adaptive', 'mlpc_learning_rate_init': 1.3016450075320697e-06, 'mplc_max_iter': 2000}. Best is trial 15 with value: 0.927558.[0m
[32m[I 2022-10-26 17:59:41,794][0m sklearn.model_selection.train_test_split: running accelerated version on CPU[0m
[32m[I 2022-10-26 17:59:41,820][0m sklearn.model_selection.train_test_split: fallback to original Scikit-learn[0m
[32m[I 2022-10-26 18:01:08,772][0m Trial 26 finished with value: 0.42917164154218324 and parameters: {'mlpc_hidden_layer_count': 1, 'mlpc_learning_rate': 'adaptive', 'mlpc_learning_rate_init': 1.2286969039673013e-06, 'mplc_max_iter': 2000}. Best is trial 15 with value: 0.927558.[0m
[32m[I 2022-10-26 18:01:09,100][0m sklearn.model_selection.train_test_split: running accelerated version on CPU[0m
[32m[I 2022-10-26 18:01:09,127][0m sklearn.model_selection.train_test_split: fallback to original Scikit-learn[0m
[32m[I 2022-10-26 18:02:06,776][0m Trial 20 finished with value: 0.8925876952155067 and parameters: {'mlpc_hidden_layer_count': 1, 'mlpc_learning_rate': 'adaptive', 'mlpc_learning_rate_init': 8.624842918291304e-05, 'mplc_max_iter': 2000}. Best is trial 15 with value: 0.927558.[0m
[32m[I 2022-10-26 18:02:07,115][0m sklearn.model_selection.train_test_split: running accelerated version on CPU[0m
[32m[I 2022-10-26 18:02:07,145][0m sklearn.model_selection.train_test_split: fallback to original Scikit-learn[0m
[32m[I 2022-10-26 18:07:15,078][0m Trial 32 finished with value: 0.8851617028876647 and parameters: {'mlpc_hidden_layer_count': 1, 'mlpc_learning_rate': 'adaptive', 'mlpc_learning_rate_init': 0.0005997577050528682, 'mplc_max_iter': 2000}. Best is trial 15 with value: 0.927558.[0m
[32m[I 2022-10-26 18:07:15,492][0m sklearn.model_selection.train_test_split: running accelerated version on CPU[0m
[32m[I 2022-10-26 18:07:15,526][0m sklearn.model_selection.train_test_split: fallback to original Scikit-learn[0m
[32m[I 2022-10-26 18:07:47,988][0m Trial 31 finished with value: 0.8855434117577181 and parameters: {'mlpc_hidden_layer_count': 1, 'mlpc_learning_rate': 'adaptive', 'mlpc_learning_rate_init': 0.0006333766921899071, 'mplc_max_iter': 2000}. Best is trial 15 with value: 0.927558.[0m
[32m[I 2022-10-26 18:07:48,370][0m sklearn.model_selection.train_test_split: running accelerated version on CPU[0m
[32m[I 2022-10-26 18:07:48,403][0m sklearn.model_selection.train_test_split: fallback to original Scikit-learn[0m
[32m[I 2022-10-26 18:14:37,480][0m Trial 36 finished with value: 0.695087046409682 and parameters: {'mlpc_hidden_layer_count': 2, 'mlpc_learning_rate': 'invscaling', 'mlpc_learning_rate_init': 0.004126459271114116, 'mplc_max_iter': 2000}. Best is trial 15 with value: 0.927558.[0m
[32m[I 2022-10-26 18:14:37,902][0m sklearn.model_selection.train_test_split: running accelerated version on CPU[0m
[32m[I 2022-10-26 18:14:37,937][0m sklearn.model_selection.train_test_split: fallback to original Scikit-learn[0m
[32m[I 2022-10-26 18:15:00,123][0m Trial 28 finished with value: 0.785814184970888 and parameters: {'mlpc_hidden_layer_count': 2, 'mlpc_learning_rate': 'adaptive', 'mlpc_learning_rate_init': 1.3061998525484553e-06, 'mplc_max_iter': 2000}. Best is trial 15 with value: 0.927558.[0m
[32m[I 2022-10-26 18:15:00,538][0m sklearn.model_selection.train_test_split: running accelerated version on CPU[0m
[32m[I 2022-10-26 18:15:00,572][0m sklearn.model_selection.train_test_split: fallback to original Scikit-learn[0m
[32m[I 2022-10-26 18:15:31,690][0m Trial 33 finished with value: 0.920304492484642 and parameters: {'mlpc_hidden_layer_count': 1, 'mlpc_learning_rate': 'invscaling', 'mlpc_learning_rate_init': 0.0007944399353891626, 'mplc_max_iter': 2000}. Best is trial 15 with value: 0.927558.[0m
[32m[I 2022-10-26 18:15:32,075][0m sklearn.model_selection.train_test_split: running accelerated version on CPU[0m
[32m[I 2022-10-26 18:15:32,107][0m sklearn.model_selection.train_test_split: fallback to original Scikit-learn[0m
[32m[I 2022-10-26 18:17:24,910][0m Trial 34 finished with value: 0.9370618742280372 and parameters: {'mlpc_hidden_layer_count': 1, 'mlpc_learning_rate': 'invscaling', 'mlpc_learning_rate_init': 0.0005742729436193544, 'mplc_max_iter': 2000}. Best is trial 34 with value: 0.937062.[0m
[32m[I 2022-10-26 18:17:25,316][0m sklearn.model_selection.train_test_split: running accelerated version on CPU[0m
[32m[I 2022-10-26 18:17:25,349][0m sklearn.model_selection.train_test_split: fallback to original Scikit-learn[0m
[32m[I 2022-10-26 18:18:53,366][0m Trial 35 finished with value: 0.8695929370062522 and parameters: {'mlpc_hidden_layer_count': 2, 'mlpc_learning_rate': 'invscaling', 'mlpc_learning_rate_init': 0.0006487841915794656, 'mplc_max_iter': 2000}. Best is trial 34 with value: 0.937062.[0m
[32m[I 2022-10-26 18:18:53,789][0m sklearn.model_selection.train_test_split: running accelerated version on CPU[0m
[32m[I 2022-10-26 18:18:53,822][0m sklearn.model_selection.train_test_split: fallback to original Scikit-learn[0m
[32m[I 2022-10-26 18:19:55,461][0m Trial 39 finished with value: 0.8069301534313532 and parameters: {'mlpc_hidden_layer_count': 1, 'mlpc_learning_rate': 'invscaling', 'mlpc_learning_rate_init': 0.009671277073501109, 'mplc_max_iter': 2000}. Best is trial 34 with value: 0.937062.[0m
[32m[I 2022-10-26 18:19:55,842][0m sklearn.model_selection.train_test_split: running accelerated version on CPU[0m
[32m[I 2022-10-26 18:19:55,874][0m sklearn.model_selection.train_test_split: fallback to original Scikit-learn[0m
[32m[I 2022-10-26 18:20:51,993][0m Trial 37 finished with value: 0.6950742018218817 and parameters: {'mlpc_hidden_layer_count': 2, 'mlpc_learning_rate': 'invscaling', 'mlpc_learning_rate_init': 0.0162798317340011, 'mplc_max_iter': 2000}. Best is trial 34 with value: 0.937062.[0m
[32m[I 2022-10-26 18:20:52,384][0m sklearn.model_selection.train_test_split: running accelerated version on CPU[0m
[32m[I 2022-10-26 18:20:52,416][0m sklearn.model_selection.train_test_split: fallback to original Scikit-learn[0m
[32m[I 2022-10-26 18:22:25,938][0m Trial 7 finished with value: 0.9528964055253869 and parameters: {'mlpc_hidden_layer_count': 3, 'mlpc_learning_rate': 'adaptive', 'mlpc_learning_rate_init': 1.1943348793383394e-05, 'mplc_max_iter': 2000}. Best is trial 7 with value: 0.952896.[0m
[32m[I 2022-10-26 18:22:26,399][0m sklearn.model_selection.train_test_split: running accelerated version on CPU[0m
[32m[I 2022-10-26 18:22:26,435][0m sklearn.model_selection.train_test_split: fallback to original Scikit-learn[0m
[32m[I 2022-10-26 18:22:30,900][0m Trial 40 finished with value: 0.7378368509113042 and parameters: {'mlpc_hidden_layer_count': 1, 'mlpc_learning_rate': 'invscaling', 'mlpc_learning_rate_init': 0.009586667887327805, 'mplc_max_iter': 2000}. Best is trial 7 with value: 0.952896.[0m
[32m[I 2022-10-26 18:22:31,309][0m sklearn.model_selection.train_test_split: running accelerated version on CPU[0m
[32m[I 2022-10-26 18:22:31,343][0m sklearn.model_selection.train_test_split: fallback to original Scikit-learn[0m
[32m[I 2022-10-26 18:23:13,338][0m Trial 41 finished with value: 0.7306005659651297 and parameters: {'mlpc_hidden_layer_count': 1, 'mlpc_learning_rate': 'invscaling', 'mlpc_learning_rate_init': 0.01153804859641952, 'mplc_max_iter': 2000}. Best is trial 7 with value: 0.952896.[0m
[32m[I 2022-10-26 18:23:13,751][0m sklearn.model_selection.train_test_split: running accelerated version on CPU[0m
[32m[I 2022-10-26 18:23:13,786][0m sklearn.model_selection.train_test_split: fallback to original Scikit-learn[0m
[32m[I 2022-10-26 18:25:10,118][0m Trial 30 finished with value: 0.7859809484990341 and parameters: {'mlpc_hidden_layer_count': 2, 'mlpc_learning_rate': 'adaptive', 'mlpc_learning_rate_init': 1.1112816575864525e-06, 'mplc_max_iter': 2000}. Best is trial 7 with value: 0.952896.[0m
[32m[I 2022-10-26 18:25:10,504][0m sklearn.model_selection.train_test_split: running accelerated version on CPU[0m
[32m[I 2022-10-26 18:25:10,537][0m sklearn.model_selection.train_test_split: fallback to original Scikit-learn[0m
[32m[I 2022-10-26 18:25:45,966][0m Trial 42 finished with value: 0.7725897824073142 and parameters: {'mlpc_hidden_layer_count': 1, 'mlpc_learning_rate': 'invscaling', 'mlpc_learning_rate_init': 0.004370780360366892, 'mplc_max_iter': 2000}. Best is trial 7 with value: 0.952896.[0m
[32m[I 2022-10-26 18:25:46,391][0m sklearn.model_selection.train_test_split: running accelerated version on CPU[0m
[32m[I 2022-10-26 18:25:46,424][0m sklearn.model_selection.train_test_split: fallback to original Scikit-learn[0m
[32m[I 2022-10-26 18:27:19,193][0m Trial 43 finished with value: 0.8266686009768683 and parameters: {'mlpc_hidden_layer_count': 1, 'mlpc_learning_rate': 'invscaling', 'mlpc_learning_rate_init': 0.002154476973082335, 'mplc_max_iter': 2000}. Best is trial 7 with value: 0.952896.[0m
[32m[I 2022-10-26 18:27:19,660][0m sklearn.model_selection.train_test_split: running accelerated version on CPU[0m
[32m[I 2022-10-26 18:27:19,686][0m sklearn.model_selection.train_test_split: fallback to original Scikit-learn[0m
[32m[I 2022-10-26 18:32:21,483][0m Trial 38 finished with value: 0.921223558318863 and parameters: {'mlpc_hidden_layer_count': 2, 'mlpc_learning_rate': 'adaptive', 'mlpc_learning_rate_init': 0.00041398349252773554, 'mplc_max_iter': 2000}. Best is trial 7 with value: 0.952896.[0m
[32m[I 2022-10-26 18:32:21,833][0m sklearn.model_selection.train_test_split: running accelerated version on CPU[0m
[32m[I 2022-10-26 18:32:21,861][0m sklearn.model_selection.train_test_split: fallback to original Scikit-learn[0m
[32m[I 2022-10-26 18:33:14,606][0m Trial 45 finished with value: 0.6950742018218817 and parameters: {'mlpc_hidden_layer_count': 3, 'mlpc_learning_rate': 'invscaling', 'mlpc_learning_rate_init': 0.0025371676727597952, 'mplc_max_iter': 2000}. Best is trial 7 with value: 0.952896.[0m
[32m[I 2022-10-26 18:33:14,976][0m sklearn.model_selection.train_test_split: running accelerated version on CPU[0m
[32m[I 2022-10-26 18:33:15,004][0m sklearn.model_selection.train_test_split: fallback to original Scikit-learn[0m
[32m[I 2022-10-26 18:37:15,560][0m Trial 49 finished with value: 0.8164988829999902 and parameters: {'mlpc_hidden_layer_count': 3, 'mlpc_learning_rate': 'invscaling', 'mlpc_learning_rate_init': 0.00033826549301860384, 'mplc_max_iter': 2000}. Best is trial 7 with value: 0.952896.[0m
[32m[I 2022-10-26 18:37:15,915][0m sklearn.model_selection.train_test_split: running accelerated version on CPU[0m
[32m[I 2022-10-26 18:37:15,944][0m sklearn.model_selection.train_test_split: fallback to original Scikit-learn[0m
[32m[I 2022-10-26 18:37:39,886][0m Trial 47 finished with value: 0.8799302072985877 and parameters: {'mlpc_hidden_layer_count': 3, 'mlpc_learning_rate': 'invscaling', 'mlpc_learning_rate_init': 3.50452625520722e-05, 'mplc_max_iter': 2000}. Best is trial 7 with value: 0.952896.[0m
[32m[I 2022-10-26 18:37:40,235][0m sklearn.model_selection.train_test_split: running accelerated version on CPU[0m
[32m[I 2022-10-26 18:37:40,263][0m sklearn.model_selection.train_test_split: fallback to original Scikit-learn[0m
[32m[I 2022-10-26 18:42:28,644][0m Trial 29 finished with value: 0.9494563501894924 and parameters: {'mlpc_hidden_layer_count': 2, 'mlpc_learning_rate': 'adaptive', 'mlpc_learning_rate_init': 3.697270283909407e-05, 'mplc_max_iter': 2000}. Best is trial 7 with value: 0.952896.[0m
[32m[I 2022-10-26 18:42:29,024][0m sklearn.model_selection.train_test_split: running accelerated version on CPU[0m
[32m[I 2022-10-26 18:42:29,050][0m sklearn.model_selection.train_test_split: fallback to original Scikit-learn[0m
[32m[I 2022-10-26 18:44:16,246][0m Trial 50 finished with value: 0.9018451546594578 and parameters: {'mlpc_hidden_layer_count': 3, 'mlpc_learning_rate': 'invscaling', 'mlpc_learning_rate_init': 4.036778544353831e-05, 'mplc_max_iter': 2000}. Best is trial 7 with value: 0.952896.[0m
[32m[I 2022-10-26 18:44:16,609][0m sklearn.model_selection.train_test_split: running accelerated version on CPU[0m
[32m[I 2022-10-26 18:44:16,638][0m sklearn.model_selection.train_test_split: fallback to original Scikit-learn[0m
[32m[I 2022-10-26 18:46:56,595][0m Trial 52 finished with value: 0.8204020937209505 and parameters: {'mlpc_hidden_layer_count': 3, 'mlpc_learning_rate': 'constant', 'mlpc_learning_rate_init': 0.0012469160040324467, 'mplc_max_iter': 2000}. Best is trial 7 with value: 0.952896.[0m
[32m[I 2022-10-26 18:46:56,950][0m sklearn.model_selection.train_test_split: running accelerated version on CPU[0m
[32m[I 2022-10-26 18:46:56,981][0m sklearn.model_selection.train_test_split: fallback to original Scikit-learn[0m
[32m[I 2022-10-26 18:52:12,016][0m Trial 53 finished with value: 0.8532039317589176 and parameters: {'mlpc_hidden_layer_count': 3, 'mlpc_learning_rate': 'constant', 'mlpc_learning_rate_init': 0.0011880710850369215, 'mplc_max_iter': 2000}. Best is trial 7 with value: 0.952896.[0m
[32m[I 2022-10-26 18:52:12,363][0m sklearn.model_selection.train_test_split: running accelerated version on CPU[0m
[32m[I 2022-10-26 18:52:12,392][0m sklearn.model_selection.train_test_split: fallback to original Scikit-learn[0m
[32m[I 2022-10-26 18:57:11,756][0m Trial 48 finished with value: 0.8768380119569995 and parameters: {'mlpc_hidden_layer_count': 3, 'mlpc_learning_rate': 'invscaling', 'mlpc_learning_rate_init': 0.00033389440379292694, 'mplc_max_iter': 2000}. Best is trial 7 with value: 0.952896.[0m
[32m[I 2022-10-26 18:57:12,113][0m sklearn.model_selection.train_test_split: running accelerated version on CPU[0m
[32m[I 2022-10-26 18:57:12,144][0m sklearn.model_selection.train_test_split: fallback to original Scikit-learn[0m
[32m[I 2022-10-26 19:05:13,908][0m Trial 56 finished with value: 0.7962980802643672 and parameters: {'mlpc_hidden_layer_count': 2, 'mlpc_learning_rate': 'constant', 'mlpc_learning_rate_init': 2.8443605242559096e-06, 'mplc_max_iter': 2000}. Best is trial 7 with value: 0.952896.[0m
[32m[I 2022-10-26 19:05:14,355][0m sklearn.model_selection.train_test_split: running accelerated version on CPU[0m
[32m[I 2022-10-26 19:05:14,393][0m sklearn.model_selection.train_test_split: fallback to original Scikit-learn[0m
[32m[I 2022-10-26 19:09:57,261][0m Trial 57 finished with value: 0.8646038041907269 and parameters: {'mlpc_hidden_layer_count': 2, 'mlpc_learning_rate': 'constant', 'mlpc_learning_rate_init': 1.1519358153185182e-05, 'mplc_max_iter': 2000}. Best is trial 7 with value: 0.952896.[0m
[32m[I 2022-10-26 19:09:57,712][0m sklearn.model_selection.train_test_split: running accelerated version on CPU[0m
[32m[I 2022-10-26 19:09:57,748][0m sklearn.model_selection.train_test_split: fallback to original Scikit-learn[0m
[32m[I 2022-10-26 19:11:21,907][0m Trial 51 finished with value: 0.9289793790595204 and parameters: {'mlpc_hidden_layer_count': 3, 'mlpc_learning_rate': 'constant', 'mlpc_learning_rate_init': 2.6911068478077514e-05, 'mplc_max_iter': 2000}. Best is trial 7 with value: 0.952896.[0m
[32m[I 2022-10-26 19:11:22,271][0m sklearn.model_selection.train_test_split: running accelerated version on CPU[0m
[32m[I 2022-10-26 19:11:22,303][0m sklearn.model_selection.train_test_split: fallback to original Scikit-learn[0m
[32m[I 2022-10-26 19:13:52,361][0m Trial 58 finished with value: 0.8629364959963013 and parameters: {'mlpc_hidden_layer_count': 2, 'mlpc_learning_rate': 'invscaling', 'mlpc_learning_rate_init': 1.403198627230865e-05, 'mplc_max_iter': 2000}. Best is trial 7 with value: 0.952896.[0m
[32m[I 2022-10-26 19:13:52,720][0m sklearn.model_selection.train_test_split: running accelerated version on CPU[0m
[32m[I 2022-10-26 19:13:52,748][0m sklearn.model_selection.train_test_split: fallback to original Scikit-learn[0m
[32m[I 2022-10-26 19:22:54,274][0m Trial 59 finished with value: 0.8607432749098953 and parameters: {'mlpc_hidden_layer_count': 2, 'mlpc_learning_rate': 'invscaling', 'mlpc_learning_rate_init': 1.2110453522449698e-05, 'mplc_max_iter': 2000}. Best is trial 7 with value: 0.952896.[0m
[32m[I 2022-10-26 19:22:54,613][0m sklearn.model_selection.train_test_split: running accelerated version on CPU[0m
[32m[I 2022-10-26 19:22:54,639][0m sklearn.model_selection.train_test_split: fallback to original Scikit-learn[0m
[32m[I 2022-10-26 19:23:52,418][0m Trial 55 finished with value: 0.9392127632072557 and parameters: {'mlpc_hidden_layer_count': 3, 'mlpc_learning_rate': 'constant', 'mlpc_learning_rate_init': 2.230752301811334e-05, 'mplc_max_iter': 2000}. Best is trial 7 with value: 0.952896.[0m
[32m[I 2022-10-26 19:23:52,753][0m sklearn.model_selection.train_test_split: running accelerated version on CPU[0m
[32m[I 2022-10-26 19:23:52,782][0m sklearn.model_selection.train_test_split: fallback to original Scikit-learn[0m
[32m[I 2022-10-26 19:29:40,809][0m Trial 60 finished with value: 0.9120808445593662 and parameters: {'mlpc_hidden_layer_count': 2, 'mlpc_learning_rate': 'invscaling', 'mlpc_learning_rate_init': 2.2564110382599e-05, 'mplc_max_iter': 2000}. Best is trial 7 with value: 0.952896.[0m
[32m[I 2022-10-26 19:29:41,144][0m sklearn.model_selection.train_test_split: running accelerated version on CPU[0m
[32m[I 2022-10-26 19:29:41,173][0m sklearn.model_selection.train_test_split: fallback to original Scikit-learn[0m
[32m[I 2022-10-26 19:35:46,590][0m Trial 54 finished with value: 0.9298676942713944 and parameters: {'mlpc_hidden_layer_count': 3, 'mlpc_learning_rate': 'constant', 'mlpc_learning_rate_init': 1.8699553642674673e-05, 'mplc_max_iter': 2000}. Best is trial 7 with value: 0.952896.[0m
[32m[I 2022-10-26 19:35:46,927][0m sklearn.model_selection.train_test_split: running accelerated version on CPU[0m
[32m[I 2022-10-26 19:35:46,953][0m sklearn.model_selection.train_test_split: fallback to original Scikit-learn[0m
[32m[I 2022-10-26 19:36:08,087][0m Trial 44 finished with value: 0.9478825830493738 and parameters: {'mlpc_hidden_layer_count': 3, 'mlpc_learning_rate': 'invscaling', 'mlpc_learning_rate_init': 2.9758545646823137e-05, 'mplc_max_iter': 2000}. Best is trial 7 with value: 0.952896.[0m
[32m[I 2022-10-26 19:36:08,420][0m sklearn.model_selection.train_test_split: running accelerated version on CPU[0m
[32m[I 2022-10-26 19:36:08,447][0m sklearn.model_selection.train_test_split: fallback to original Scikit-learn[0m
[32m[I 2022-10-26 19:45:00,597][0m Trial 62 finished with value: 0.9141717467495798 and parameters: {'mlpc_hidden_layer_count': 3, 'mlpc_learning_rate': 'constant', 'mlpc_learning_rate_init': 2.9167213800557608e-05, 'mplc_max_iter': 2000}. Best is trial 7 with value: 0.952896.[0m
[32m[I 2022-10-26 19:45:00,939][0m sklearn.model_selection.train_test_split: running accelerated version on CPU[0m
[32m[I 2022-10-26 19:45:00,966][0m sklearn.model_selection.train_test_split: fallback to original Scikit-learn[0m
