[32m[I 2022-10-26 00:24:38,634][0m Trial 26 finished with value: 0.9919852835814067 and parameters: {'brf_n_estimators': 110, 'brf_criterion': 'gini', 'brf_min_samples_split': 19, 'brf_min_samples_leaf': 2, 'brf_max_features': 2, 'brf_bootstrap': True}. Best is trial 19 with value: 0.996312.[0m
[32m[I 2022-10-26 00:24:45,485][0m sklearn.ensemble.RandomForestClassifier.predict: fallback to original Scikit-learn[0m
[32m[I 2022-10-26 00:24:45,486][0m sklearn.ensemble.RandomForestClassifier.predict_proba: fallback to original Scikit-learn[0m
[32m[I 2022-10-26 00:24:55,283][0m Trial 27 finished with value: 0.9284839251996551 and parameters: {'brf_n_estimators': 110, 'brf_criterion': 'gini', 'brf_min_samples_split': 19, 'brf_min_samples_leaf': 21, 'brf_max_features': 2, 'brf_bootstrap': True}. Best is trial 19 with value: 0.996312.[0m
[32m[I 2022-10-26 00:25:05,171][0m Trial 28 finished with value: 0.9928625157332112 and parameters: {'brf_n_estimators': 110, 'brf_criterion': 'gini', 'brf_min_samples_split': 19, 'brf_min_samples_leaf': 1, 'brf_max_features': 2, 'brf_bootstrap': True}. Best is trial 19 with value: 0.996312.[0m
[32m[I 2022-10-26 00:25:08,882][0m sklearn.ensemble.RandomForestClassifier.predict: fallback to original Scikit-learn[0m
[32m[I 2022-10-26 00:25:08,884][0m sklearn.ensemble.RandomForestClassifier.predict_proba: fallback to original Scikit-learn[0m
[32m[I 2022-10-26 00:25:27,512][0m Trial 29 finished with value: 0.9691316217180742 and parameters: {'brf_n_estimators': 110, 'brf_criterion': 'gini', 'brf_min_samples_split': 18, 'brf_min_samples_leaf': 7, 'brf_max_features': 2, 'brf_bootstrap': True}. Best is trial 19 with value: 0.996312.[0m
[32m[I 2022-10-26 00:25:35,826][0m sklearn.ensemble.RandomForestClassifier.predict: fallback to original Scikit-learn[0m
[32m[I 2022-10-26 00:25:35,826][0m sklearn.ensemble.RandomForestClassifier.predict_proba: fallback to original Scikit-learn[0m
[32m[I 2022-10-26 00:25:49,943][0m Trial 33 finished with value: 0.9879814481186303 and parameters: {'brf_n_estimators': 70, 'brf_criterion': 'gini', 'brf_min_samples_split': 7, 'brf_min_samples_leaf': 8, 'brf_max_features': 4, 'brf_bootstrap': True}. Best is trial 19 with value: 0.996312.[0m
[32m[I 2022-10-26 00:25:53,718][0m sklearn.ensemble.RandomForestClassifier.predict: fallback to original Scikit-learn[0m
[32m[I 2022-10-26 00:25:53,720][0m sklearn.ensemble.RandomForestClassifier.predict_proba: fallback to original Scikit-learn[0m
[32m[I 2022-10-26 00:26:06,683][0m sklearn.ensemble.RandomForestClassifier.predict: fallback to original Scikit-learn[0m
[32m[I 2022-10-26 00:26:06,684][0m sklearn.ensemble.RandomForestClassifier.predict_proba: fallback to original Scikit-learn[0m
[32m[I 2022-10-26 00:26:13,616][0m Trial 30 finished with value: 0.9694721620479075 and parameters: {'brf_n_estimators': 120, 'brf_criterion': 'gini', 'brf_min_samples_split': 8, 'brf_min_samples_leaf': 8, 'brf_max_features': 2, 'brf_bootstrap': True}. Best is trial 19 with value: 0.996312.[0m
[32m[I 2022-10-26 00:26:19,168][0m sklearn.ensemble.RandomForestClassifier.predict: fallback to original Scikit-learn[0m
[32m[I 2022-10-26 00:26:19,175][0m sklearn.ensemble.RandomForestClassifier.predict_proba: fallback to original Scikit-learn[0m
[32m[I 2022-10-26 00:26:27,214][0m Trial 31 finished with value: 0.9693541052299861 and parameters: {'brf_n_estimators': 130, 'brf_criterion': 'gini', 'brf_min_samples_split': 8, 'brf_min_samples_leaf': 8, 'brf_max_features': 2, 'brf_bootstrap': True}. Best is trial 19 with value: 0.996312.[0m
[32m[I 2022-10-26 00:26:40,291][0m Trial 32 finished with value: 0.9876156763797607 and parameters: {'brf_n_estimators': 130, 'brf_criterion': 'gini', 'brf_min_samples_split': 8, 'brf_min_samples_leaf': 8, 'brf_max_features': 4, 'brf_bootstrap': True}. Best is trial 19 with value: 0.996312.[0m
[32m[I 2022-10-26 00:27:12,559][0m sklearn.ensemble.RandomForestClassifier.predict: fallback to original Scikit-learn[0m
[32m[I 2022-10-26 00:27:12,560][0m sklearn.ensemble.RandomForestClassifier.predict_proba: fallback to original Scikit-learn[0m
[32m[I 2022-10-26 00:27:19,279][0m sklearn.ensemble.RandomForestClassifier.predict: fallback to original Scikit-learn[0m
[32m[I 2022-10-26 00:27:19,282][0m sklearn.ensemble.RandomForestClassifier.predict_proba: fallback to original Scikit-learn[0m
[32m[I 2022-10-26 00:27:27,389][0m sklearn.ensemble.RandomForestClassifier.predict: fallback to original Scikit-learn[0m
[32m[I 2022-10-26 00:27:27,391][0m sklearn.ensemble.RandomForestClassifier.predict_proba: fallback to original Scikit-learn[0m
[32m[I 2022-10-26 00:27:34,527][0m Trial 34 finished with value: 0.987614530589319 and parameters: {'brf_n_estimators': 140, 'brf_criterion': 'gini', 'brf_min_samples_split': 7, 'brf_min_samples_leaf': 8, 'brf_max_features': 4, 'brf_bootstrap': True}. Best is trial 19 with value: 0.996312.[0m
[32m[I 2022-10-26 00:27:39,531][0m Trial 35 finished with value: 0.9882586166909706 and parameters: {'brf_n_estimators': 130, 'brf_criterion': 'gini', 'brf_min_samples_split': 8, 'brf_min_samples_leaf': 7, 'brf_max_features': 4, 'brf_bootstrap': True}. Best is trial 19 with value: 0.996312.[0m
[32m[I 2022-10-26 00:27:47,161][0m Trial 36 finished with value: 0.883935893381917 and parameters: {'brf_n_estimators': 130, 'brf_criterion': 'gini', 'brf_min_samples_split': 7, 'brf_min_samples_leaf': 50, 'brf_max_features': 4, 'brf_bootstrap': True}. Best is trial 19 with value: 0.996312.[0m
[32m[I 2022-10-26 00:27:48,158][0m sklearn.ensemble.RandomForestClassifier.predict: fallback to original Scikit-learn[0m
[32m[I 2022-10-26 00:27:48,163][0m sklearn.ensemble.RandomForestClassifier.predict_proba: fallback to original Scikit-learn[0m
[32m[I 2022-10-26 00:28:05,998][0m sklearn.ensemble.RandomForestClassifier.predict: fallback to original Scikit-learn[0m
[32m[I 2022-10-26 00:28:05,999][0m sklearn.ensemble.RandomForestClassifier.predict_proba: fallback to original Scikit-learn[0m
[32m[I 2022-10-26 00:28:09,993][0m sklearn.ensemble.RandomForestClassifier.predict: fallback to original Scikit-learn[0m
[32m[I 2022-10-26 00:28:09,994][0m sklearn.ensemble.RandomForestClassifier.predict_proba: fallback to original Scikit-learn[0m
[32m[I 2022-10-26 00:28:10,108][0m Trial 37 finished with value: 0.8859564522969712 and parameters: {'brf_n_estimators': 130, 'brf_criterion': 'gini', 'brf_min_samples_split': 8, 'brf_min_samples_leaf': 49, 'brf_max_features': 4, 'brf_bootstrap': True}. Best is trial 19 with value: 0.996312.[0m
[32m[I 2022-10-26 00:28:16,947][0m sklearn.ensemble.RandomForestClassifier.predict: fallback to original Scikit-learn[0m
[32m[I 2022-10-26 00:28:16,947][0m sklearn.ensemble.RandomForestClassifier.predict_proba: fallback to original Scikit-learn[0m
[32m[I 2022-10-26 00:28:20,684][0m Trial 40 finished with value: 0.9634931955703204 and parameters: {'brf_n_estimators': 90, 'brf_criterion': 'gini', 'brf_min_samples_split': 14, 'brf_min_samples_leaf': 18, 'brf_max_features': 4, 'brf_bootstrap': True}. Best is trial 19 with value: 0.996312.[0m
[32m[I 2022-10-26 00:28:30,575][0m Trial 38 finished with value: 0.9619023108640895 and parameters: {'brf_n_estimators': 130, 'brf_criterion': 'gini', 'brf_min_samples_split': 7, 'brf_min_samples_leaf': 19, 'brf_max_features': 3, 'brf_bootstrap': True}. Best is trial 19 with value: 0.996312.[0m
[32m[I 2022-10-26 00:28:30,713][0m sklearn.ensemble.RandomForestClassifier.predict: fallback to original Scikit-learn[0m
[32m[I 2022-10-26 00:28:30,719][0m sklearn.ensemble.RandomForestClassifier.predict_proba: fallback to original Scikit-learn[0m
[32m[I 2022-10-26 00:28:32,613][0m Trial 41 finished with value: 0.987647691500564 and parameters: {'brf_n_estimators': 90, 'brf_criterion': 'entropy', 'brf_min_samples_split': 25, 'brf_min_samples_leaf': 5, 'brf_max_features': 3, 'brf_bootstrap': True}. Best is trial 19 with value: 0.996312.[0m
[32m[I 2022-10-26 00:28:52,602][0m Trial 39 finished with value: 0.9633101299384065 and parameters: {'brf_n_estimators': 130, 'brf_criterion': 'gini', 'brf_min_samples_split': 25, 'brf_min_samples_leaf': 18, 'brf_max_features': 4, 'brf_bootstrap': True}. Best is trial 19 with value: 0.996312.[0m
[32m[I 2022-10-26 00:28:59,508][0m sklearn.ensemble.RandomForestClassifier.predict: fallback to original Scikit-learn[0m
[32m[I 2022-10-26 00:28:59,508][0m sklearn.ensemble.RandomForestClassifier.predict_proba: fallback to original Scikit-learn[0m
[32m[I 2022-10-26 00:29:03,928][0m sklearn.ensemble.RandomForestClassifier.predict: fallback to original Scikit-learn[0m
[32m[I 2022-10-26 00:29:03,931][0m sklearn.ensemble.RandomForestClassifier.predict_proba: fallback to original Scikit-learn[0m
[32m[I 2022-10-26 00:29:10,009][0m sklearn.ensemble.RandomForestClassifier.predict: fallback to original Scikit-learn[0m
[32m[I 2022-10-26 00:29:10,082][0m sklearn.ensemble.RandomForestClassifier.predict_proba: fallback to original Scikit-learn[0m
[32m[I 2022-10-26 00:29:14,466][0m Trial 42 finished with value: 0.96704874288595 and parameters: {'brf_n_estimators': 80, 'brf_criterion': 'entropy', 'brf_min_samples_split': 24, 'brf_min_samples_leaf': 19, 'brf_max_features': 3, 'brf_bootstrap': True}. Best is trial 19 with value: 0.996312.[0m
[32m[I 2022-10-26 00:29:18,528][0m Trial 43 finished with value: 0.9727491288387738 and parameters: {'brf_n_estimators': 80, 'brf_criterion': 'entropy', 'brf_min_samples_split': 26, 'brf_min_samples_leaf': 18, 'brf_max_features': 3, 'brf_bootstrap': True}. Best is trial 19 with value: 0.996312.[0m
[32m[I 2022-10-26 00:29:26,075][0m Trial 44 finished with value: 0.9685340007505153 and parameters: {'brf_n_estimators': 80, 'brf_criterion': 'entropy', 'brf_min_samples_split': 14, 'brf_min_samples_leaf': 12, 'brf_max_features': 3, 'brf_bootstrap': True}. Best is trial 19 with value: 0.996312.[0m
[32m[I 2022-10-26 00:29:33,161][0m sklearn.ensemble.RandomForestClassifier.predict: fallback to original Scikit-learn[0m
[32m[I 2022-10-26 00:29:33,161][0m sklearn.ensemble.RandomForestClassifier.predict_proba: fallback to original Scikit-learn[0m
[32m[I 2022-10-26 00:29:44,278][0m sklearn.ensemble.RandomForestClassifier.predict: fallback to original Scikit-learn[0m
[32m[I 2022-10-26 00:29:44,282][0m sklearn.ensemble.RandomForestClassifier.predict_proba: fallback to original Scikit-learn[0m
[32m[I 2022-10-26 00:29:49,315][0m Trial 45 finished with value: 0.9727491288387738 and parameters: {'brf_n_estimators': 80, 'brf_criterion': 'entropy', 'brf_min_samples_split': 23, 'brf_min_samples_leaf': 18, 'brf_max_features': 3, 'brf_bootstrap': True}. Best is trial 19 with value: 0.996312.[0m
[32m[I 2022-10-26 00:29:58,092][0m sklearn.ensemble.RandomForestClassifier.predict: fallback to original Scikit-learn[0m
[32m[I 2022-10-26 00:29:58,093][0m sklearn.ensemble.RandomForestClassifier.predict_proba: fallback to original Scikit-learn[0m
[32m[I 2022-10-26 00:29:59,174][0m Trial 46 finished with value: 0.97324658513917 and parameters: {'brf_n_estimators': 80, 'brf_criterion': 'entropy', 'brf_min_samples_split': 26, 'brf_min_samples_leaf': 17, 'brf_max_features': 3, 'brf_bootstrap': True}. Best is trial 19 with value: 0.996312.[0m
[32m[I 2022-10-26 00:30:14,364][0m Trial 47 finished with value: 0.968325416379364 and parameters: {'brf_n_estimators': 80, 'brf_criterion': 'entropy', 'brf_min_samples_split': 25, 'brf_min_samples_leaf': 12, 'brf_max_features': 3, 'brf_bootstrap': True}. Best is trial 19 with value: 0.996312.[0m
[32m[I 2022-10-26 00:30:16,930][0m sklearn.ensemble.RandomForestClassifier.predict: fallback to original Scikit-learn[0m
[32m[I 2022-10-26 00:30:16,933][0m sklearn.ensemble.RandomForestClassifier.predict_proba: fallback to original Scikit-learn[0m
[32m[I 2022-10-26 00:30:20,289][0m sklearn.ensemble.RandomForestClassifier.predict: fallback to original Scikit-learn[0m
[32m[I 2022-10-26 00:30:20,291][0m sklearn.ensemble.RandomForestClassifier.predict_proba: fallback to original Scikit-learn[0m
[32m[I 2022-10-26 00:30:31,530][0m Trial 49 finished with value: 0.9646149141631231 and parameters: {'brf_n_estimators': 80, 'brf_criterion': 'entropy', 'brf_min_samples_split': 23, 'brf_min_samples_leaf': 11, 'brf_max_features': 1, 'brf_bootstrap': True}. Best is trial 19 with value: 0.996312.[0m
[32m[I 2022-10-26 00:30:38,020][0m Trial 48 finished with value: 0.9886626508575848 and parameters: {'brf_n_estimators': 100, 'brf_criterion': 'entropy', 'brf_min_samples_split': 23, 'brf_min_samples_leaf': 5, 'brf_max_features': 3, 'brf_bootstrap': True}. Best is trial 19 with value: 0.996312.[0m
[32m[I 2022-10-26 00:31:04,399][0m sklearn.ensemble.RandomForestClassifier.predict: fallback to original Scikit-learn[0m
[32m[I 2022-10-26 00:31:04,400][0m sklearn.ensemble.RandomForestClassifier.predict_proba: fallback to original Scikit-learn[0m
[32m[I 2022-10-26 00:31:07,685][0m sklearn.ensemble.RandomForestClassifier.predict: fallback to original Scikit-learn[0m
[32m[I 2022-10-26 00:31:07,688][0m sklearn.ensemble.RandomForestClassifier.predict_proba: fallback to original Scikit-learn[0m
[32m[I 2022-10-26 00:31:13,754][0m sklearn.ensemble.RandomForestClassifier.predict: fallback to original Scikit-learn[0m
[32m[I 2022-10-26 00:31:13,757][0m sklearn.ensemble.RandomForestClassifier.predict_proba: fallback to original Scikit-learn[0m
[32m[I 2022-10-26 00:31:20,482][0m Trial 50 finished with value: 0.9638101368538949 and parameters: {'brf_n_estimators': 100, 'brf_criterion': 'entropy', 'brf_min_samples_split': 14, 'brf_min_samples_leaf': 11, 'brf_max_features': 1, 'brf_bootstrap': True}. Best is trial 19 with value: 0.996312.[0m
[32m[I 2022-10-26 00:31:24,082][0m Trial 51 finished with value: 0.9869915255213682 and parameters: {'brf_n_estimators': 100, 'brf_criterion': 'gini', 'brf_min_samples_split': 15, 'brf_min_samples_leaf': 5, 'brf_max_features': 1, 'brf_bootstrap': True}. Best is trial 19 with value: 0.996312.[0m
[32m[I 2022-10-26 00:31:30,740][0m Trial 52 finished with value: 0.9645890841829522 and parameters: {'brf_n_estimators': 100, 'brf_criterion': 'gini', 'brf_min_samples_split': 15, 'brf_min_samples_leaf': 11, 'brf_max_features': 1, 'brf_bootstrap': True}. Best is trial 19 with value: 0.996312.[0m
[32m[I 2022-10-26 00:31:36,460][0m sklearn.ensemble.RandomForestClassifier.predict: fallback to original Scikit-learn[0m
[32m[I 2022-10-26 00:31:36,461][0m sklearn.ensemble.RandomForestClassifier.predict_proba: fallback to original Scikit-learn[0m
[32m[I 2022-10-26 00:31:46,323][0m sklearn.ensemble.RandomForestClassifier.predict: fallback to original Scikit-learn[0m
[32m[I 2022-10-26 00:31:46,324][0m sklearn.ensemble.RandomForestClassifier.predict_proba: fallback to original Scikit-learn[0m
[32m[I 2022-10-26 00:31:53,724][0m Trial 53 finished with value: 0.9796100350038784 and parameters: {'brf_n_estimators': 100, 'brf_criterion': 'gini', 'brf_min_samples_split': 34, 'brf_min_samples_leaf': 5, 'brf_max_features': 1, 'brf_bootstrap': True}. Best is trial 19 with value: 0.996312.[0m
[32m[I 2022-10-26 00:32:01,289][0m sklearn.ensemble.RandomForestClassifier.predict: fallback to original Scikit-learn[0m
[32m[I 2022-10-26 00:32:01,292][0m sklearn.ensemble.RandomForestClassifier.predict_proba: fallback to original Scikit-learn[0m
[32m[I 2022-10-26 00:32:03,587][0m Trial 54 finished with value: 0.9642110490181429 and parameters: {'brf_n_estimators': 100, 'brf_criterion': 'gini', 'brf_min_samples_split': 34, 'brf_min_samples_leaf': 11, 'brf_max_features': 1, 'brf_bootstrap': True}. Best is trial 19 with value: 0.996312.[0m
[32m[I 2022-10-26 00:32:18,601][0m Trial 55 finished with value: 0.9797247928472769 and parameters: {'brf_n_estimators': 100, 'brf_criterion': 'gini', 'brf_min_samples_split': 35, 'brf_min_samples_leaf': 5, 'brf_max_features': 1, 'brf_bootstrap': True}. Best is trial 19 with value: 0.996312.[0m
[32m[I 2022-10-26 00:32:19,623][0m sklearn.ensemble.RandomForestClassifier.predict: fallback to original Scikit-learn[0m
[32m[I 2022-10-26 00:32:19,626][0m sklearn.ensemble.RandomForestClassifier.predict_proba: fallback to original Scikit-learn[0m
[32m[I 2022-10-26 00:32:25,101][0m sklearn.ensemble.RandomForestClassifier.predict: fallback to original Scikit-learn[0m
[32m[I 2022-10-26 00:32:25,102][0m sklearn.ensemble.RandomForestClassifier.predict_proba: fallback to original Scikit-learn[0m
[32m[I 2022-10-26 00:32:38,600][0m Trial 56 finished with value: 0.9881966290091961 and parameters: {'brf_n_estimators': 100, 'brf_criterion': 'gini', 'brf_min_samples_split': 4, 'brf_min_samples_leaf': 5, 'brf_max_features': 1, 'brf_bootstrap': True}. Best is trial 19 with value: 0.996312.[0m
[32m[I 2022-10-26 00:32:44,021][0m Trial 57 finished with value: 0.9871262754327078 and parameters: {'brf_n_estimators': 100, 'brf_criterion': 'gini', 'brf_min_samples_split': 34, 'brf_min_samples_leaf': 1, 'brf_max_features': 1, 'brf_bootstrap': True}. Best is trial 19 with value: 0.996312.[0m
[32m[I 2022-10-26 00:33:38,890][0m sklearn.ensemble.RandomForestClassifier.predict: fallback to original Scikit-learn[0m
[32m[I 2022-10-26 00:33:38,892][0m sklearn.ensemble.RandomForestClassifier.predict_proba: fallback to original Scikit-learn[0m
[32m[I 2022-10-26 00:34:01,123][0m Trial 59 finished with value: 0.9934366949753684 and parameters: {'brf_n_estimators': 120, 'brf_criterion': 'gini', 'brf_min_samples_split': 11, 'brf_min_samples_leaf': 1, 'brf_max_features': 2, 'brf_bootstrap': True}. Best is trial 19 with value: 0.996312.[0m
[32m[I 2022-10-26 00:34:16,055][0m sklearn.ensemble.RandomForestClassifier.predict: fallback to original Scikit-learn[0m
[32m[I 2022-10-26 00:34:16,057][0m sklearn.ensemble.RandomForestClassifier.predict_proba: fallback to original Scikit-learn[0m
[32m[I 2022-10-26 00:34:34,826][0m sklearn.ensemble.RandomForestClassifier.predict: fallback to original Scikit-learn[0m
[32m[I 2022-10-26 00:34:34,827][0m sklearn.ensemble.RandomForestClassifier.predict_proba: fallback to original Scikit-learn[0m
[32m[I 2022-10-26 00:34:37,031][0m Trial 62 finished with value: 0.9968078306006753 and parameters: {'brf_n_estimators': 120, 'brf_criterion': 'gini', 'brf_min_samples_split': 4, 'brf_min_samples_leaf': 1, 'brf_max_features': 2, 'brf_bootstrap': False}. Best is trial 62 with value: 0.996808.[0m
[32m[I 2022-10-26 00:34:55,976][0m sklearn.ensemble.RandomForestClassifier.predict: fallback to original Scikit-learn[0m
[32m[I 2022-10-26 00:34:55,977][0m sklearn.ensemble.RandomForestClassifier.predict_proba: fallback to original Scikit-learn[0m
[32m[I 2022-10-26 00:34:58,460][0m Trial 63 finished with value: 0.9968078306006753 and parameters: {'brf_n_estimators': 120, 'brf_criterion': 'gini', 'brf_min_samples_split': 4, 'brf_min_samples_leaf': 1, 'brf_max_features': 2, 'brf_bootstrap': False}. Best is trial 63 with value: 0.996808.[0m
[32m[I 2022-10-26 00:35:01,302][0m sklearn.ensemble.RandomForestClassifier.predict: fallback to original Scikit-learn[0m
[32m[I 2022-10-26 00:35:01,307][0m sklearn.ensemble.RandomForestClassifier.predict_proba: fallback to original Scikit-learn[0m
[32m[I 2022-10-26 00:35:11,364][0m sklearn.ensemble.RandomForestClassifier.predict: fallback to original Scikit-learn[0m
[32m[I 2022-10-26 00:35:11,439][0m sklearn.ensemble.RandomForestClassifier.predict_proba: fallback to original Scikit-learn[0m
[32m[I 2022-10-26 00:35:17,792][0m Trial 64 finished with value: 0.9968078306006753 and parameters: {'brf_n_estimators': 120, 'brf_criterion': 'gini', 'brf_min_samples_split': 4, 'brf_min_samples_leaf': 1, 'brf_max_features': 2, 'brf_bootstrap': False}. Best is trial 64 with value: 0.996808.[0m
[32m[I 2022-10-26 00:35:20,772][0m sklearn.ensemble.RandomForestClassifier.predict: fallback to original Scikit-learn[0m
[32m[I 2022-10-26 00:35:20,774][0m sklearn.ensemble.RandomForestClassifier.predict_proba: fallback to original Scikit-learn[0m
[32m[I 2022-10-26 00:35:32,529][0m Trial 58 finished with value: 0.9957005342905596 and parameters: {'brf_n_estimators': 200, 'brf_criterion': 'gini', 'brf_min_samples_split': 4, 'brf_min_samples_leaf': 1, 'brf_max_features': 2, 'brf_bootstrap': True}. Best is trial 64 with value: 0.996808.[0m
[32m[I 2022-10-26 00:35:43,179][0m Trial 60 finished with value: 0.9957005342905596 and parameters: {'brf_n_estimators': 200, 'brf_criterion': 'gini', 'brf_min_samples_split': 4, 'brf_min_samples_leaf': 1, 'brf_max_features': 2, 'brf_bootstrap': True}. Best is trial 64 with value: 0.996808.[0m
[32m[I 2022-10-26 00:35:50,943][0m Trial 61 finished with value: 0.9968302636796722 and parameters: {'brf_n_estimators': 190, 'brf_criterion': 'gini', 'brf_min_samples_split': 4, 'brf_min_samples_leaf': 1, 'brf_max_features': 2, 'brf_bootstrap': False}. Best is trial 61 with value: 0.99683.[0m
[32m[I 2022-10-26 00:36:05,731][0m sklearn.ensemble.RandomForestClassifier.predict: fallback to original Scikit-learn[0m
[32m[I 2022-10-26 00:36:05,732][0m sklearn.ensemble.RandomForestClassifier.predict_proba: fallback to original Scikit-learn[0m
[32m[I 2022-10-26 00:36:09,098][0m sklearn.ensemble.RandomForestClassifier.predict: fallback to original Scikit-learn[0m
[32m[I 2022-10-26 00:36:09,100][0m sklearn.ensemble.RandomForestClassifier.predict_proba: fallback to original Scikit-learn[0m
[32m[I 2022-10-26 00:36:26,824][0m Trial 66 finished with value: 0.9281959146420007 and parameters: {'brf_n_estimators': 120, 'brf_criterion': 'gini', 'brf_min_samples_split': 11, 'brf_min_samples_leaf': 30, 'brf_max_features': 2, 'brf_bootstrap': False}. Best is trial 61 with value: 0.99683.[0m
