[32m[I 2022-10-25 22:58:18,303][0m Optimization for 30 classifiers started.[0m
[32m[I 2022-10-25 22:58:18,945][0m X_train shape: (1608679, 7); y_train shape: (1608679,); y_train unique values: {0, 1, 2, 3, 4, 5, 6, 7, 8}[0m
[32m[I 2022-10-25 22:58:18,961][0m X_test shape: (402170, 7); y_test shape: (402170,); y_test unique values: {0, 1, 2, 3, 4, 5, 6, 7, 8}[0m
[32m[I 2022-10-25 22:58:18,962][0m --------------------------------------------------------------------------------[0m
[32m[I 2022-10-25 22:58:18,963][0m --------------------           AdaBoostClassifier           --------------------[0m
[32m[I 2022-10-25 22:58:18,963][0m --------------------------------------------------------------------------------[0m
[32m[I 2022-10-25 22:58:19,031][0m A new study created in RDB with name: AdaBoostClassifier_c963b74b[0m
[32m[I 2022-10-25 22:58:19,039][0m Study started.[0m
[32m[I 2022-10-25 22:59:03,532][0m Trial 6 finished with value: 0.6950742018218817 and parameters: {'abc_n_estimators': 25, 'abc_learning_rate': 1.2357021233492727e-05}. Best is trial 6 with value: 0.695074.[0m
[32m[I 2022-10-25 22:59:12,808][0m Trial 5 finished with value: 0.6950742018218817 and parameters: {'abc_n_estimators': 30, 'abc_learning_rate': 0.00011902782284180439}. Best is trial 5 with value: 0.695074.[0m
[32m[I 2022-10-25 22:59:30,566][0m Trial 3 finished with value: 0.6950742018218817 and parameters: {'abc_n_estimators': 40, 'abc_learning_rate': 6.330209458176475e-05}. Best is trial 3 with value: 0.695074.[0m
[32m[I 2022-10-25 22:59:48,272][0m Trial 2 finished with value: 0.6950742018218817 and parameters: {'abc_n_estimators': 50, 'abc_learning_rate': 3.5714401410398923e-06}. Best is trial 2 with value: 0.695074.[0m
[32m[I 2022-10-25 22:59:49,361][0m Trial 1 finished with value: 0.6950742018218817 and parameters: {'abc_n_estimators': 50, 'abc_learning_rate': 1.50188095371824e-05}. Best is trial 1 with value: 0.695074.[0m
[32m[I 2022-10-25 23:00:14,188][0m Trial 4 finished with value: 0.7559731367235444 and parameters: {'abc_n_estimators': 65, 'abc_learning_rate': 0.000976799708963997}. Best is trial 4 with value: 0.755973.[0m
[32m[I 2022-10-25 23:00:25,286][0m Trial 10 finished with value: 0.6950742018218817 and parameters: {'abc_n_estimators': 30, 'abc_learning_rate': 7.060023805116092e-05}. Best is trial 4 with value: 0.755973.[0m
[32m[I 2022-10-25 23:00:38,917][0m Trial 0 finished with value: 0.7445616116929415 and parameters: {'abc_n_estimators': 80, 'abc_learning_rate': 0.022739353387471534}. Best is trial 4 with value: 0.755973.[0m
[32m[I 2022-10-25 23:01:00,066][0m Trial 8 finished with value: 0.7559731367235444 and parameters: {'abc_n_estimators': 65, 'abc_learning_rate': 0.001776552054234424}. Best is trial 4 with value: 0.755973.[0m
[32m[I 2022-10-25 23:01:01,600][0m Trial 12 finished with value: 0.6950742018218817 and parameters: {'abc_n_estimators': 40, 'abc_learning_rate': 6.253816231965811e-06}. Best is trial 4 with value: 0.755973.[0m
[32m[I 2022-10-25 23:01:15,241][0m Trial 7 finished with value: 0.15852870122259716 and parameters: {'abc_n_estimators': 100, 'abc_learning_rate': 0.22519693721483522}. Best is trial 4 with value: 0.755973.[0m
[32m[I 2022-10-25 23:01:27,540][0m Trial 9 finished with value: 0.6950742018218817 and parameters: {'abc_n_estimators': 75, 'abc_learning_rate': 8.592457879232297e-05}. Best is trial 4 with value: 0.755973.[0m
[32m[I 2022-10-25 23:01:50,883][0m Trial 15 finished with value: 0.7445616116929415 and parameters: {'abc_n_estimators': 40, 'abc_learning_rate': 0.04837112200672526}. Best is trial 4 with value: 0.755973.[0m
[32m[I 2022-10-25 23:02:13,919][0m Trial 14 finished with value: 0.7445616116929415 and parameters: {'abc_n_estimators': 60, 'abc_learning_rate': 0.012942516371294331}. Best is trial 4 with value: 0.755973.[0m
[32m[I 2022-10-25 23:02:35,984][0m Trial 11 finished with value: 0.16513790611545118 and parameters: {'abc_n_estimators': 95, 'abc_learning_rate': 0.8961860422514475}. Best is trial 4 with value: 0.755973.[0m
[32m[I 2022-10-25 23:02:59,648][0m Trial 16 finished with value: 0.7559731367235444 and parameters: {'abc_n_estimators': 65, 'abc_learning_rate': 0.0003303272661626805}. Best is trial 16 with value: 0.755973.[0m
[32m[I 2022-10-25 23:03:04,754][0m Trial 13 finished with value: 0.6950742018218817 and parameters: {'abc_n_estimators': 95, 'abc_learning_rate': 5.6596691153675475e-05}. Best is trial 16 with value: 0.755973.[0m
[32m[I 2022-10-25 23:03:20,710][0m Trial 18 finished with value: 0.7559731367235444 and parameters: {'abc_n_estimators': 70, 'abc_learning_rate': 0.001934018832276526}. Best is trial 18 with value: 0.755973.[0m
[32m[I 2022-10-25 23:03:32,900][0m Trial 19 finished with value: 0.7559731367235444 and parameters: {'abc_n_estimators': 70, 'abc_learning_rate': 0.0028929748416478334}. Best is trial 19 with value: 0.755973.[0m
[32m[I 2022-10-25 23:03:55,857][0m Trial 20 finished with value: 0.7559731367235444 and parameters: {'abc_n_estimators': 70, 'abc_learning_rate': 0.0023706935383031205}. Best is trial 20 with value: 0.755973.[0m
[32m[I 2022-10-25 23:03:57,556][0m Trial 17 finished with value: 0.6657421754540273 and parameters: {'abc_n_estimators': 100, 'abc_learning_rate': 0.638338849459463}. Best is trial 20 with value: 0.755973.[0m
[32m[I 2022-10-25 23:04:29,522][0m Trial 21 finished with value: 0.7559731367235444 and parameters: {'abc_n_estimators': 75, 'abc_learning_rate': 0.0015571817812938798}. Best is trial 21 with value: 0.755973.[0m
[32m[I 2022-10-25 23:04:40,410][0m Trial 22 finished with value: 0.7559731367235444 and parameters: {'abc_n_estimators': 70, 'abc_learning_rate': 0.0008630583236610273}. Best is trial 22 with value: 0.755973.[0m
[32m[I 2022-10-25 23:05:24,263][0m Trial 24 finished with value: 0.7559731367235444 and parameters: {'abc_n_estimators': 80, 'abc_learning_rate': 0.002135597073322193}. Best is trial 24 with value: 0.755973.[0m
[32m[I 2022-10-25 23:05:31,569][0m Trial 23 finished with value: 0.7559731367235444 and parameters: {'abc_n_estimators': 85, 'abc_learning_rate': 0.002200721980602331}. Best is trial 24 with value: 0.755973.[0m
[32m[I 2022-10-25 23:05:49,787][0m Trial 25 finished with value: 0.7559731367235444 and parameters: {'abc_n_estimators': 85, 'abc_learning_rate': 0.0011150891459594681}. Best is trial 25 with value: 0.755973.[0m
[32m[I 2022-10-25 23:06:02,147][0m Trial 26 finished with value: 0.7559731367235444 and parameters: {'abc_n_estimators': 85, 'abc_learning_rate': 0.0004898115866307192}. Best is trial 26 with value: 0.755973.[0m
[32m[I 2022-10-25 23:06:21,999][0m Trial 27 finished with value: 0.7445616116929415 and parameters: {'abc_n_estimators': 85, 'abc_learning_rate': 0.010254223282440843}. Best is trial 4 with value: 0.755973.[0m
[32m[I 2022-10-25 23:06:25,646][0m Trial 28 finished with value: 0.7559731367235444 and parameters: {'abc_n_estimators': 85, 'abc_learning_rate': 0.0004701558576269033}. Best is trial 28 with value: 0.755973.[0m
[32m[I 2022-10-25 23:07:01,201][0m Trial 29 finished with value: 0.7318229322263453 and parameters: {'abc_n_estimators': 85, 'abc_learning_rate': 0.003692669081657428}. Best is trial 4 with value: 0.755973.[0m
[32m[I 2022-10-25 23:07:08,405][0m Trial 30 finished with value: 0.7445616116929415 and parameters: {'abc_n_estimators': 85, 'abc_learning_rate': 0.005393914576405215}. Best is trial 4 with value: 0.755973.[0m
[32m[I 2022-10-25 23:07:53,517][0m Trial 31 finished with value: 0.7445616116929415 and parameters: {'abc_n_estimators': 85, 'abc_learning_rate': 0.007080843767935699}. Best is trial 4 with value: 0.755973.[0m
[32m[I 2022-10-25 23:08:06,078][0m Trial 32 finished with value: 0.7559731367235444 and parameters: {'abc_n_estimators': 85, 'abc_learning_rate': 0.0004620586365858216}. Best is trial 32 with value: 0.755973.[0m
[32m[I 2022-10-25 23:08:22,682][0m Trial 33 finished with value: 0.7559731367235444 and parameters: {'abc_n_estimators': 85, 'abc_learning_rate': 0.00033221892808087003}. Best is trial 33 with value: 0.755973.[0m
[32m[I 2022-10-25 23:08:34,632][0m Trial 34 finished with value: 0.7445616116929415 and parameters: {'abc_n_estimators': 85, 'abc_learning_rate': 0.0073498710130446695}. Best is trial 4 with value: 0.755973.[0m
[32m[I 2022-10-25 23:08:43,431][0m Trial 37 finished with value: 0.6950742018218817 and parameters: {'abc_n_estimators': 55, 'abc_learning_rate': 1.1451400123728958e-06}. Best is trial 4 with value: 0.755973.[0m
[32m[I 2022-10-25 23:09:01,105][0m Trial 35 finished with value: 0.7445616116929415 and parameters: {'abc_n_estimators': 90, 'abc_learning_rate': 0.009100521496763148}. Best is trial 4 with value: 0.755973.[0m
[32m[I 2022-10-25 23:09:08,521][0m Trial 36 finished with value: 0.7559731367235444 and parameters: {'abc_n_estimators': 90, 'abc_learning_rate': 0.0002501311748868745}. Best is trial 4 with value: 0.755973.[0m
[32m[I 2022-10-25 23:09:49,486][0m Trial 40 finished with value: 0.7559731367235444 and parameters: {'abc_n_estimators': 55, 'abc_learning_rate': 0.0003150304485716647}. Best is trial 40 with value: 0.755973.[0m
[32m[I 2022-10-25 23:09:51,528][0m Trial 38 finished with value: 0.7559731367235444 and parameters: {'abc_n_estimators': 90, 'abc_learning_rate': 0.0004124810596036459}. Best is trial 40 with value: 0.755973.[0m
[32m[I 2022-10-25 23:10:04,622][0m Trial 41 finished with value: 0.6950742018218817 and parameters: {'abc_n_estimators': 55, 'abc_learning_rate': 1.1119250548649972e-06}. Best is trial 4 with value: 0.755973.[0m
[32m[I 2022-10-25 23:10:06,521][0m Trial 42 finished with value: 0.7445616116929415 and parameters: {'abc_n_estimators': 50, 'abc_learning_rate': 0.02252799646423344}. Best is trial 4 with value: 0.755973.[0m
[32m[I 2022-10-25 23:10:37,746][0m Trial 39 finished with value: 0.7559731367235444 and parameters: {'abc_n_estimators': 90, 'abc_learning_rate': 0.0004849262654023947}. Best is trial 4 with value: 0.755973.[0m
[32m[I 2022-10-25 23:11:00,138][0m Trial 43 finished with value: 0.7445616116929415 and parameters: {'abc_n_estimators': 75, 'abc_learning_rate': 0.027494677122091093}. Best is trial 4 with value: 0.755973.[0m
[32m[I 2022-10-25 23:11:15,329][0m Trial 44 finished with value: 0.7445616116929415 and parameters: {'abc_n_estimators': 75, 'abc_learning_rate': 0.03895605079816859}. Best is trial 4 with value: 0.755973.[0m
[32m[I 2022-10-25 23:11:25,356][0m Trial 45 finished with value: 0.7559731367235444 and parameters: {'abc_n_estimators': 75, 'abc_learning_rate': 0.0001812893106717089}. Best is trial 45 with value: 0.755973.[0m
[32m[I 2022-10-25 23:12:08,025][0m Trial 47 finished with value: 0.7559731367235444 and parameters: {'abc_n_estimators': 75, 'abc_learning_rate': 0.00016476052569785083}. Best is trial 47 with value: 0.755973.[0m
[32m[I 2022-10-25 23:12:09,967][0m Trial 48 finished with value: 0.7445616116929415 and parameters: {'abc_n_estimators': 70, 'abc_learning_rate': 0.04643617631190923}. Best is trial 4 with value: 0.755973.[0m
[32m[I 2022-10-25 23:12:23,219][0m Trial 49 finished with value: 0.7559731367235444 and parameters: {'abc_n_estimators': 75, 'abc_learning_rate': 0.00279001000892284}. Best is trial 49 with value: 0.755973.[0m
[32m[I 2022-10-25 23:12:44,337][0m Trial 46 finished with value: 0.6950742018218817 and parameters: {'abc_n_estimators': 95, 'abc_learning_rate': 3.243192477596036e-05}. Best is trial 49 with value: 0.755973.[0m
[32m[I 2022-10-25 23:12:54,531][0m Trial 50 finished with value: 0.7559731367235444 and parameters: {'abc_n_estimators': 75, 'abc_learning_rate': 0.0024369985120278803}. Best is trial 50 with value: 0.755973.[0m
[32m[I 2022-10-25 23:13:19,594][0m Trial 51 finished with value: 0.7559731367235444 and parameters: {'abc_n_estimators': 75, 'abc_learning_rate': 0.002505181166274355}. Best is trial 51 with value: 0.755973.[0m
[32m[I 2022-10-25 23:13:32,569][0m Trial 52 finished with value: 0.7559731367235444 and parameters: {'abc_n_estimators': 75, 'abc_learning_rate': 0.0008644887143875667}. Best is trial 52 with value: 0.755973.[0m
[32m[I 2022-10-25 23:14:15,743][0m Trial 54 finished with value: 0.7559731367235444 and parameters: {'abc_n_estimators': 70, 'abc_learning_rate': 0.0015462338759120022}. Best is trial 54 with value: 0.755973.[0m
[32m[I 2022-10-25 23:14:16,504][0m Trial 53 finished with value: 0.7559731367235444 and parameters: {'abc_n_estimators': 95, 'abc_learning_rate': 0.0001820267919194538}. Best is trial 54 with value: 0.755973.[0m
[32m[I 2022-10-25 23:14:35,249][0m Trial 55 finished with value: 0.7559731367235444 and parameters: {'abc_n_estimators': 80, 'abc_learning_rate': 0.001116440054093485}. Best is trial 55 with value: 0.755973.[0m
[32m[I 2022-10-25 23:14:49,263][0m Trial 56 finished with value: 0.7559731367235444 and parameters: {'abc_n_estimators': 80, 'abc_learning_rate': 0.001041273585452678}. Best is trial 56 with value: 0.755973.[0m
[32m[I 2022-10-25 23:15:12,597][0m Trial 57 finished with value: 0.7559731367235444 and parameters: {'abc_n_estimators': 80, 'abc_learning_rate': 0.001035353296314807}. Best is trial 57 with value: 0.755973.[0m
[32m[I 2022-10-25 23:15:19,695][0m Trial 58 finished with value: 0.7559731367235444 and parameters: {'abc_n_estimators': 80, 'abc_learning_rate': 0.0006911803612406868}. Best is trial 58 with value: 0.755973.[0m
[32m[I 2022-10-25 23:15:48,305][0m Trial 59 finished with value: 0.7559731367235444 and parameters: {'abc_n_estimators': 80, 'abc_learning_rate': 0.001178116967890382}. Best is trial 59 with value: 0.755973.[0m
[32m[I 2022-10-25 23:15:57,944][0m Trial 60 finished with value: 0.7559731367235444 and parameters: {'abc_n_estimators': 80, 'abc_learning_rate': 0.0010720397624232076}. Best is trial 60 with value: 0.755973.[0m
[32m[I 2022-10-25 23:16:40,834][0m Trial 61 finished with value: 0.7559731367235444 and parameters: {'abc_n_estimators': 80, 'abc_learning_rate': 0.0011056712235132874}. Best is trial 61 with value: 0.755973.[0m
[32m[I 2022-10-25 23:16:41,766][0m Trial 62 finished with value: 0.7559731367235444 and parameters: {'abc_n_estimators': 80, 'abc_learning_rate': 0.0010224233220214082}. Best is trial 62 with value: 0.755973.[0m
[32m[I 2022-10-25 23:17:00,523][0m Trial 63 finished with value: 0.7559731367235444 and parameters: {'abc_n_estimators': 80, 'abc_learning_rate': 0.0011109577124239108}. Best is trial 63 with value: 0.755973.[0m
[32m[I 2022-10-25 23:17:14,603][0m Trial 64 finished with value: 0.7559731367235444 and parameters: {'abc_n_estimators': 80, 'abc_learning_rate': 0.0006340264781207781}. Best is trial 64 with value: 0.755973.[0m
[32m[I 2022-10-25 23:17:16,430][0m Trial 66 finished with value: 0.7361937393913572 and parameters: {'abc_n_estimators': 65, 'abc_learning_rate': 0.09807116580710612}. Best is trial 4 with value: 0.755973.[0m
[32m[I 2022-10-25 23:17:39,539][0m Trial 65 finished with value: 0.7559731367235444 and parameters: {'abc_n_estimators': 80, 'abc_learning_rate': 0.0006056491604942593}. Best is trial 4 with value: 0.755973.[0m
[32m[I 2022-10-25 23:17:47,117][0m Trial 67 finished with value: 0.7318229322263453 and parameters: {'abc_n_estimators': 65, 'abc_learning_rate': 0.00481250238209064}. Best is trial 4 with value: 0.755973.[0m
[32m[I 2022-10-25 23:18:36,413][0m Trial 69 finished with value: 0.7073621070475593 and parameters: {'abc_n_estimators': 65, 'abc_learning_rate': 0.003943981773695993}. Best is trial 4 with value: 0.755973.[0m
[32m[I 2022-10-25 23:18:37,247][0m Trial 70 finished with value: 0.7073621070475593 and parameters: {'abc_n_estimators': 65, 'abc_learning_rate': 0.0037422416975664945}. Best is trial 4 with value: 0.755973.[0m
[32m[I 2022-10-25 23:18:38,548][0m Trial 68 finished with value: 0.6950742018218817 and parameters: {'abc_n_estimators': 90, 'abc_learning_rate': 4.740567862278225e-05}. Best is trial 4 with value: 0.755973.[0m
[32m[I 2022-10-25 23:18:55,580][0m Trial 71 finished with value: 0.7073621070475593 and parameters: {'abc_n_estimators': 65, 'abc_learning_rate': 0.003956691573277379}. Best is trial 4 with value: 0.755973.[0m
[32m[I 2022-10-25 23:19:52,367][0m Trial 72 finished with value: 0.7559731367235444 and parameters: {'abc_n_estimators': 90, 'abc_learning_rate': 0.0002800383264579754}. Best is trial 72 with value: 0.755973.[0m
[32m[I 2022-10-25 23:19:53,034][0m Trial 73 finished with value: 0.7445616116929415 and parameters: {'abc_n_estimators': 90, 'abc_learning_rate': 0.004445185314379721}. Best is trial 4 with value: 0.755973.[0m
[32m[I 2022-10-25 23:20:18,857][0m Trial 74 finished with value: 0.7318229322263453 and parameters: {'abc_n_estimators': 90, 'abc_learning_rate': 0.00381914053493357}. Best is trial 4 with value: 0.755973.[0m
[32m[I 2022-10-25 23:20:25,444][0m Trial 75 finished with value: 0.7445616116929415 and parameters: {'abc_n_estimators': 90, 'abc_learning_rate': 0.0043033725322641665}. Best is trial 4 with value: 0.755973.[0m
[32m[I 2022-10-25 23:20:39,531][0m Trial 77 finished with value: 0.7445616116929415 and parameters: {'abc_n_estimators': 70, 'abc_learning_rate': 0.01708184166146311}. Best is trial 4 with value: 0.755973.[0m
[32m[I 2022-10-25 23:20:40,277][0m Trial 76 finished with value: 0.7559731367235444 and parameters: {'abc_n_estimators': 70, 'abc_learning_rate': 0.0019864790984809046}. Best is trial 4 with value: 0.755973.[0m
[32m[I 2022-10-25 23:20:42,066][0m Trial 78 finished with value: 0.7559731367235444 and parameters: {'abc_n_estimators': 70, 'abc_learning_rate': 0.0023013663261774496}. Best is trial 78 with value: 0.755973.[0m
[32m[I 2022-10-25 23:20:59,518][0m Trial 79 finished with value: 0.7559731367235444 and parameters: {'abc_n_estimators': 70, 'abc_learning_rate': 0.001809989921889876}. Best is trial 79 with value: 0.755973.[0m
[32m[I 2022-10-25 23:22:21,133][0m Trial 81 finished with value: 0.7559731367235444 and parameters: {'abc_n_estimators': 85, 'abc_learning_rate': 0.00013104077450569763}. Best is trial 81 with value: 0.755973.[0m
[32m[I 2022-10-25 23:22:47,229][0m Trial 80 finished with value: 0.7559731367235444 and parameters: {'abc_n_estimators': 100, 'abc_learning_rate': 0.00010681430804977111}. Best is trial 81 with value: 0.755973.[0m
[32m[I 2022-10-25 23:22:48,509][0m Trial 82 finished with value: 0.7559731367235444 and parameters: {'abc_n_estimators': 85, 'abc_learning_rate': 0.00010127016961117647}. Best is trial 82 with value: 0.755973.[0m
[32m[I 2022-10-25 23:23:13,293][0m Trial 83 finished with value: 0.7559731367235444 and parameters: {'abc_n_estimators': 95, 'abc_learning_rate': 0.00011309467185946522}. Best is trial 83 with value: 0.755973.[0m
[32m[I 2022-10-25 23:23:25,402][0m Trial 85 finished with value: 0.7559731367235444 and parameters: {'abc_n_estimators': 95, 'abc_learning_rate': 0.00010216211037417356}. Best is trial 85 with value: 0.755973.[0m
[32m[I 2022-10-25 23:23:34,458][0m Trial 84 finished with value: 0.7559731367235444 and parameters: {'abc_n_estimators': 100, 'abc_learning_rate': 8.474410221629572e-05}. Best is trial 85 with value: 0.755973.[0m
[32m[I 2022-10-25 23:23:38,131][0m Trial 86 finished with value: 0.7559731367235444 and parameters: {'abc_n_estimators': 100, 'abc_learning_rate': 0.00011427586680380194}. Best is trial 86 with value: 0.755973.[0m
[32m[I 2022-10-25 23:23:55,872][0m Trial 87 finished with value: 0.7559731367235444 and parameters: {'abc_n_estimators': 100, 'abc_learning_rate': 0.00012241431007651134}. Best is trial 87 with value: 0.755973.[0m
[32m[I 2022-10-25 23:25:22,399][0m Trial 88 finished with value: 0.7559731367235444 and parameters: {'abc_n_estimators': 100, 'abc_learning_rate': 0.00020224888637684617}. Best is trial 88 with value: 0.755973.[0m
[32m[I 2022-10-25 23:25:24,218][0m Trial 90 finished with value: 0.7559731367235444 and parameters: {'abc_n_estimators': 85, 'abc_learning_rate': 0.0004089386375188411}. Best is trial 90 with value: 0.755973.[0m
[32m[I 2022-10-25 23:25:49,954][0m Trial 89 finished with value: 0.7559731367235444 and parameters: {'abc_n_estimators': 100, 'abc_learning_rate': 0.0001939374832160799}. Best is trial 90 with value: 0.755973.[0m
[32m[I 2022-10-25 23:25:50,483][0m Trial 92 finished with value: 0.7559731367235444 and parameters: {'abc_n_estimators': 80, 'abc_learning_rate': 0.00039785717902863436}. Best is trial 92 with value: 0.755973.[0m
[32m[I 2022-10-25 23:25:59,799][0m Trial 93 finished with value: 0.7559731367235444 and parameters: {'abc_n_estimators': 80, 'abc_learning_rate': 0.0003849321281533539}. Best is trial 93 with value: 0.755973.[0m
[32m[I 2022-10-25 23:26:03,296][0m Trial 94 finished with value: 0.7559731367235444 and parameters: {'abc_n_estimators': 80, 'abc_learning_rate': 0.00040895428481490674}. Best is trial 94 with value: 0.755973.[0m
[32m[I 2022-10-25 23:26:08,364][0m Trial 91 finished with value: 0.7559731367235444 and parameters: {'abc_n_estimators': 95, 'abc_learning_rate': 0.00045624858536521775}. Best is trial 94 with value: 0.755973.[0m
[32m[I 2022-10-25 23:26:16,898][0m Trial 95 finished with value: 0.7559731367235444 and parameters: {'abc_n_estimators': 80, 'abc_learning_rate': 0.00041667073219324566}. Best is trial 95 with value: 0.755973.[0m
[32m[I 2022-10-25 23:26:21,134][0m Trial 96 finished with value: 0.7559731367235444 and parameters: {'abc_n_estimators': 35, 'abc_learning_rate': 0.00026299227962248633}. Best is trial 96 with value: 0.755973.[0m
[32m[I 2022-10-25 23:27:09,175][0m Trial 97 finished with value: 0.7559731367235444 and parameters: {'abc_n_estimators': 85, 'abc_learning_rate': 0.000639284826505047}. Best is trial 97 with value: 0.755973.[0m
