[32m[I 2022-10-26 07:56:16,105][0m Trial 76 finished with value: 0.6950742018218817 and parameters: {'lsvc_ac2s_kernel_sample_steps': 1, 'lsvc_ac2s_dual': False, 'lsvc_ac2s_C': 0.05761288529297152, 'lsvc_ac2s_max_iter': 2000}. Best is trial 0 with value: 0.695074.[0m
[32m[I 2022-10-26 07:56:25,359][0m Trial 77 finished with value: 0.6950742018218817 and parameters: {'lsvc_ac2s_kernel_sample_steps': 1, 'lsvc_ac2s_dual': False, 'lsvc_ac2s_C': 0.08581237255889493, 'lsvc_ac2s_max_iter': 2000}. Best is trial 0 with value: 0.695074.[0m
[32m[I 2022-10-26 07:56:34,949][0m Trial 78 finished with value: 0.6950742018218817 and parameters: {'lsvc_ac2s_kernel_sample_steps': 1, 'lsvc_ac2s_dual': False, 'lsvc_ac2s_C': 0.4990693202391346, 'lsvc_ac2s_max_iter': 2000}. Best is trial 0 with value: 0.695074.[0m
[32m[I 2022-10-26 07:56:44,245][0m Trial 79 finished with value: 0.6950742018218817 and parameters: {'lsvc_ac2s_kernel_sample_steps': 1, 'lsvc_ac2s_dual': False, 'lsvc_ac2s_C': 8.854327222312182e-06, 'lsvc_ac2s_max_iter': 2000}. Best is trial 0 with value: 0.695074.[0m
[32m[I 2022-10-26 07:56:53,443][0m Trial 80 finished with value: 0.6950742018218817 and parameters: {'lsvc_ac2s_kernel_sample_steps': 1, 'lsvc_ac2s_dual': False, 'lsvc_ac2s_C': 2.0591014734574878e-05, 'lsvc_ac2s_max_iter': 2000}. Best is trial 0 with value: 0.695074.[0m
[32m[I 2022-10-26 07:57:02,937][0m Trial 81 finished with value: 0.6950742018218817 and parameters: {'lsvc_ac2s_kernel_sample_steps': 1, 'lsvc_ac2s_dual': False, 'lsvc_ac2s_C': 0.0085607049832479, 'lsvc_ac2s_max_iter': 2000}. Best is trial 0 with value: 0.695074.[0m
[32m[I 2022-10-26 07:57:19,105][0m Trial 82 finished with value: 0.6950742018218817 and parameters: {'lsvc_ac2s_kernel_sample_steps': 2, 'lsvc_ac2s_dual': False, 'lsvc_ac2s_C': 0.0013334640687330636, 'lsvc_ac2s_max_iter': 2000}. Best is trial 0 with value: 0.695074.[0m
[32m[I 2022-10-26 07:57:35,249][0m Trial 83 finished with value: 0.6950742018218817 and parameters: {'lsvc_ac2s_kernel_sample_steps': 2, 'lsvc_ac2s_dual': False, 'lsvc_ac2s_C': 0.0009239408251738523, 'lsvc_ac2s_max_iter': 2000}. Best is trial 0 with value: 0.695074.[0m
[32m[I 2022-10-26 07:57:59,811][0m Trial 84 finished with value: 0.6950742018218817 and parameters: {'lsvc_ac2s_kernel_sample_steps': 3, 'lsvc_ac2s_dual': False, 'lsvc_ac2s_C': 0.004850986840892999, 'lsvc_ac2s_max_iter': 2000}. Best is trial 0 with value: 0.695074.[0m
[32m[I 2022-10-26 07:58:24,450][0m Trial 85 finished with value: 0.6950742018218817 and parameters: {'lsvc_ac2s_kernel_sample_steps': 3, 'lsvc_ac2s_dual': False, 'lsvc_ac2s_C': 0.01517976445891487, 'lsvc_ac2s_max_iter': 2000}. Best is trial 0 with value: 0.695074.[0m
[32m[I 2022-10-26 07:58:49,016][0m Trial 86 finished with value: 0.6950742018218817 and parameters: {'lsvc_ac2s_kernel_sample_steps': 3, 'lsvc_ac2s_dual': False, 'lsvc_ac2s_C': 0.03641883163116711, 'lsvc_ac2s_max_iter': 2000}. Best is trial 0 with value: 0.695074.[0m
[32m[I 2022-10-26 07:59:13,573][0m Trial 87 finished with value: 0.6950742018218817 and parameters: {'lsvc_ac2s_kernel_sample_steps': 3, 'lsvc_ac2s_dual': False, 'lsvc_ac2s_C': 0.009760383272696547, 'lsvc_ac2s_max_iter': 2000}. Best is trial 0 with value: 0.695074.[0m
[32m[I 2022-10-26 07:59:29,759][0m Trial 88 finished with value: 0.6950742018218817 and parameters: {'lsvc_ac2s_kernel_sample_steps': 2, 'lsvc_ac2s_dual': False, 'lsvc_ac2s_C': 0.000525556031823545, 'lsvc_ac2s_max_iter': 2000}. Best is trial 0 with value: 0.695074.[0m
[32m[I 2022-10-26 07:59:46,003][0m Trial 89 finished with value: 0.6950742018218817 and parameters: {'lsvc_ac2s_kernel_sample_steps': 2, 'lsvc_ac2s_dual': False, 'lsvc_ac2s_C': 0.0027029837233656082, 'lsvc_ac2s_max_iter': 2000}. Best is trial 0 with value: 0.695074.[0m
[32m[I 2022-10-26 08:00:02,220][0m Trial 90 finished with value: 0.6950742018218817 and parameters: {'lsvc_ac2s_kernel_sample_steps': 2, 'lsvc_ac2s_dual': False, 'lsvc_ac2s_C': 0.003977617164634953, 'lsvc_ac2s_max_iter': 2000}. Best is trial 0 with value: 0.695074.[0m
[32m[I 2022-10-26 08:00:18,416][0m Trial 91 finished with value: 0.6950742018218817 and parameters: {'lsvc_ac2s_kernel_sample_steps': 2, 'lsvc_ac2s_dual': False, 'lsvc_ac2s_C': 7.098109783586585e-05, 'lsvc_ac2s_max_iter': 2000}. Best is trial 0 with value: 0.695074.[0m
[32m[I 2022-10-26 08:00:34,634][0m Trial 92 finished with value: 0.6950742018218817 and parameters: {'lsvc_ac2s_kernel_sample_steps': 2, 'lsvc_ac2s_dual': False, 'lsvc_ac2s_C': 0.030837867153815625, 'lsvc_ac2s_max_iter': 2000}. Best is trial 0 with value: 0.695074.[0m
[32m[I 2022-10-26 08:00:50,878][0m Trial 93 finished with value: 0.6950742018218817 and parameters: {'lsvc_ac2s_kernel_sample_steps': 2, 'lsvc_ac2s_dual': False, 'lsvc_ac2s_C': 0.0014072766518564656, 'lsvc_ac2s_max_iter': 2000}. Best is trial 0 with value: 0.695074.[0m
[32m[I 2022-10-26 08:01:08,134][0m Trial 94 finished with value: 0.6950742018218817 and parameters: {'lsvc_ac2s_kernel_sample_steps': 2, 'lsvc_ac2s_dual': False, 'lsvc_ac2s_C': 0.0004439278354216045, 'lsvc_ac2s_max_iter': 2000}. Best is trial 0 with value: 0.695074.[0m
[32m[I 2022-10-26 08:01:36,676][0m Trial 95 finished with value: 0.6950742018218817 and parameters: {'lsvc_ac2s_kernel_sample_steps': 3, 'lsvc_ac2s_dual': False, 'lsvc_ac2s_C': 0.0002554922365694942, 'lsvc_ac2s_max_iter': 2000}. Best is trial 0 with value: 0.695074.[0m
[32m[I 2022-10-26 08:01:56,460][0m Trial 96 finished with value: 0.6950742018218817 and parameters: {'lsvc_ac2s_kernel_sample_steps': 2, 'lsvc_ac2s_dual': False, 'lsvc_ac2s_C': 0.00026561183099700907, 'lsvc_ac2s_max_iter': 2000}. Best is trial 0 with value: 0.695074.[0m
[32m[I 2022-10-26 08:02:22,137][0m Trial 97 finished with value: 0.6950742018218817 and parameters: {'lsvc_ac2s_kernel_sample_steps': 3, 'lsvc_ac2s_dual': False, 'lsvc_ac2s_C': 0.00263817349210282, 'lsvc_ac2s_max_iter': 2000}. Best is trial 0 with value: 0.695074.[0m
[32m[I 2022-10-26 08:02:38,569][0m Trial 98 finished with value: 0.6950742018218817 and parameters: {'lsvc_ac2s_kernel_sample_steps': 2, 'lsvc_ac2s_dual': False, 'lsvc_ac2s_C': 4.17115937216569e-05, 'lsvc_ac2s_max_iter': 2000}. Best is trial 0 with value: 0.695074.[0m
[32m[I 2022-10-26 08:02:54,704][0m Trial 99 finished with value: 0.6950742018218817 and parameters: {'lsvc_ac2s_kernel_sample_steps': 2, 'lsvc_ac2s_dual': False, 'lsvc_ac2s_C': 679.4840577208687, 'lsvc_ac2s_max_iter': 2000}. Best is trial 0 with value: 0.695074.[0m
[32m[I 2022-10-26 08:02:54,775][0m Study finished.[0m
[32m[I 2022-10-26 08:02:54,789][0m --------------------------------------------------------------------------------[0m
[32m[I 2022-10-26 08:02:54,790][0m --------------------           LinearSVC_Nystroem           --------------------[0m
[32m[I 2022-10-26 08:02:54,790][0m --------------------------------------------------------------------------------[0m
[32m[I 2022-10-26 08:02:54,820][0m A new study created in RDB with name: LinearSVC_Nystroem_c963b74b[0m
[32m[I 2022-10-26 08:02:54,827][0m Study started.[0m
[32m[I 2022-10-26 08:03:48,866][0m Trial 0 finished with value: 0.6950742018218817 and parameters: {'lsvc_nystroem_kernel_gamma': 0.09834478045710404, 'lsvc_nystroem_kernel_n_components': 100, 'lsvc_nystroem_dual': False, 'lsvc_nystroem_C': 2.0935867689749976e-06, 'lsvc_nystroem_max_iter': 2000}. Best is trial 0 with value: 0.695074.[0m
[32m[I 2022-10-26 08:07:18,748][0m Trial 1 finished with value: 0.8240009054888168 and parameters: {'lsvc_nystroem_kernel_gamma': 0.044742652662512546, 'lsvc_nystroem_kernel_n_components': 150, 'lsvc_nystroem_dual': False, 'lsvc_nystroem_C': 6.697945929908476e-05, 'lsvc_nystroem_max_iter': 2000}. Best is trial 1 with value: 0.824001.[0m
[32m[I 2022-10-26 08:40:01,968][0m Trial 2 finished with value: 0.7910030034520573 and parameters: {'lsvc_nystroem_kernel_gamma': 0.009850059038750098, 'lsvc_nystroem_kernel_n_components': 100, 'lsvc_nystroem_dual': False, 'lsvc_nystroem_C': 717.5957063438638, 'lsvc_nystroem_max_iter': 2000}. Best is trial 1 with value: 0.824001.[0m
[32m[I 2022-10-26 08:42:18,570][0m Trial 3 finished with value: 0.8096612203650337 and parameters: {'lsvc_nystroem_kernel_gamma': 67.61308528268171, 'lsvc_nystroem_kernel_n_components': 150, 'lsvc_nystroem_dual': False, 'lsvc_nystroem_C': 2.7407829177046703e-05, 'lsvc_nystroem_max_iter': 2000}. Best is trial 1 with value: 0.824001.[0m
[32m[I 2022-10-26 08:42:54,884][0m Trial 4 finished with value: 0.7659952267665012 and parameters: {'lsvc_nystroem_kernel_gamma': 0.294906800139372, 'lsvc_nystroem_kernel_n_components': 50, 'lsvc_nystroem_dual': False, 'lsvc_nystroem_C': 161.59821876192143, 'lsvc_nystroem_max_iter': 2000}. Best is trial 1 with value: 0.824001.[0m
[32m[I 2022-10-26 08:43:45,552][0m Trial 5 finished with value: 0.7658722580266725 and parameters: {'lsvc_nystroem_kernel_gamma': 3.8855960247445127, 'lsvc_nystroem_kernel_n_components': 50, 'lsvc_nystroem_dual': False, 'lsvc_nystroem_C': 0.9450200035370957, 'lsvc_nystroem_max_iter': 2000}. Best is trial 1 with value: 0.824001.[0m
[32m[I 2022-10-26 08:48:02,512][0m Trial 6 finished with value: 0.8767679043247483 and parameters: {'lsvc_nystroem_kernel_gamma': 102.57502835169691, 'lsvc_nystroem_kernel_n_components': 150, 'lsvc_nystroem_dual': False, 'lsvc_nystroem_C': 2.170397331120561, 'lsvc_nystroem_max_iter': 2000}. Best is trial 6 with value: 0.876768.[0m
[32m[I 2022-10-26 08:49:59,019][0m Trial 7 finished with value: 0.7659732756365629 and parameters: {'lsvc_nystroem_kernel_gamma': 0.08552045093663979, 'lsvc_nystroem_kernel_n_components': 50, 'lsvc_nystroem_dual': False, 'lsvc_nystroem_C': 0.4752926454971112, 'lsvc_nystroem_max_iter': 2000}. Best is trial 6 with value: 0.876768.[0m
[32m[I 2022-10-26 08:51:57,847][0m Trial 8 finished with value: 0.8767674458162784 and parameters: {'lsvc_nystroem_kernel_gamma': 0.23416790044999655, 'lsvc_nystroem_kernel_n_components': 150, 'lsvc_nystroem_dual': False, 'lsvc_nystroem_C': 96.66647126809687, 'lsvc_nystroem_max_iter': 2000}. Best is trial 6 with value: 0.876768.[0m
[32m[I 2022-10-26 08:53:19,965][0m Trial 9 finished with value: 0.8767679043247483 and parameters: {'lsvc_nystroem_kernel_gamma': 887.0954720615291, 'lsvc_nystroem_kernel_n_components': 150, 'lsvc_nystroem_dual': False, 'lsvc_nystroem_C': 163.9007790562942, 'lsvc_nystroem_max_iter': 2000}. Best is trial 6 with value: 0.876768.[0m
[32m[I 2022-10-26 09:19:02,033][0m Trial 10 finished with value: 0.7879647706589985 and parameters: {'lsvc_nystroem_kernel_gamma': 8.254772304720753, 'lsvc_nystroem_kernel_n_components': 100, 'lsvc_nystroem_dual': False, 'lsvc_nystroem_C': 0.005678645778579488, 'lsvc_nystroem_max_iter': 2000}. Best is trial 6 with value: 0.876768.[0m
[32m[I 2022-10-26 09:21:26,376][0m Trial 11 finished with value: 0.8767679043247483 and parameters: {'lsvc_nystroem_kernel_gamma': 738.4836682024144, 'lsvc_nystroem_kernel_n_components': 150, 'lsvc_nystroem_dual': False, 'lsvc_nystroem_C': 3.9083087118646715, 'lsvc_nystroem_max_iter': 2000}. Best is trial 6 with value: 0.876768.[0m
[32m[I 2022-10-26 11:20:37,794][0m Trial 12 finished with value: 0.8767679043247483 and parameters: {'lsvc_nystroem_kernel_gamma': 711.4827317412999, 'lsvc_nystroem_kernel_n_components': 150, 'lsvc_nystroem_dual': False, 'lsvc_nystroem_C': 0.023469073342714197, 'lsvc_nystroem_max_iter': 2000}. Best is trial 6 with value: 0.876768.[0m
[32m[I 2022-10-26 11:22:25,022][0m Trial 13 finished with value: 0.8767679043247483 and parameters: {'lsvc_nystroem_kernel_gamma': 60.956539516327105, 'lsvc_nystroem_kernel_n_components': 150, 'lsvc_nystroem_dual': False, 'lsvc_nystroem_C': 8.928019460519346, 'lsvc_nystroem_max_iter': 2000}. Best is trial 6 with value: 0.876768.[0m
[32m[I 2022-10-26 11:23:32,998][0m Trial 14 finished with value: 0.7879691110325241 and parameters: {'lsvc_nystroem_kernel_gamma': 96.58542935741656, 'lsvc_nystroem_kernel_n_components': 100, 'lsvc_nystroem_dual': False, 'lsvc_nystroem_C': 23.247768670005506, 'lsvc_nystroem_max_iter': 2000}. Best is trial 6 with value: 0.876768.[0m
[32m[I 2022-10-26 12:33:11,169][0m Trial 15 finished with value: 0.8767679043247483 and parameters: {'lsvc_nystroem_kernel_gamma': 10.785718576570877, 'lsvc_nystroem_kernel_n_components': 150, 'lsvc_nystroem_dual': False, 'lsvc_nystroem_C': 0.11500338514084343, 'lsvc_nystroem_max_iter': 2000}. Best is trial 6 with value: 0.876768.[0m
[32m[I 2022-10-26 12:33:11,234][0m Study finished.[0m
[32m[I 2022-10-26 12:33:11,239][0m --------------------------------------------------------------------------------[0m
[32m[I 2022-10-26 12:33:11,239][0m --------------------    LinearSVC_PolynomialCountSketch     --------------------[0m
[32m[I 2022-10-26 12:33:11,240][0m --------------------------------------------------------------------------------[0m
[32m[I 2022-10-26 12:33:11,268][0m A new study created in RDB with name: LinearSVC_PolynomialCountSketch_c963b74b[0m
[32m[I 2022-10-26 12:33:11,273][0m Study started.[0m
[32m[I 2022-10-26 12:33:39,386][0m Trial 0 finished with value: 0.7013262533471539 and parameters: {'lsvc_pcs_kernel_gamma': 2.6211050576597543, 'lsvc_pcs_kernel_n_components': 150, 'lsvc_pcs_degree': 2, 'lsvc_pcs_dual': False, 'lsvc_pcs_C': 0.006876269511894459, 'lsvc_pcs_max_iter': 2000}. Best is trial 0 with value: 0.701326.[0m
[32m[I 2022-10-26 12:33:53,259][0m Trial 1 finished with value: 0.14478766285452763 and parameters: {'lsvc_pcs_kernel_gamma': 0.08840734009874288, 'lsvc_pcs_kernel_n_components': 100, 'lsvc_pcs_degree': 2, 'lsvc_pcs_dual': False, 'lsvc_pcs_C': 0.0025357120427566622, 'lsvc_pcs_max_iter': 2000}. Best is trial 0 with value: 0.701326.[0m
[32m[I 2022-10-26 12:34:20,744][0m Trial 2 finished with value: 0.4470365661386334 and parameters: {'lsvc_pcs_kernel_gamma': 202.58807575169592, 'lsvc_pcs_kernel_n_components': 150, 'lsvc_pcs_degree': 2, 'lsvc_pcs_dual': False, 'lsvc_pcs_C': 6.921082497323326e-06, 'lsvc_pcs_max_iter': 2000}. Best is trial 0 with value: 0.701326.[0m
[32m[I 2022-10-26 12:34:34,147][0m Trial 3 finished with value: 0.13755187751825632 and parameters: {'lsvc_pcs_kernel_gamma': 416.90874143977675, 'lsvc_pcs_kernel_n_components': 100, 'lsvc_pcs_degree': 2, 'lsvc_pcs_dual': False, 'lsvc_pcs_C': 0.0018975509961639083, 'lsvc_pcs_max_iter': 2000}. Best is trial 0 with value: 0.701326.[0m
[32m[I 2022-10-26 12:34:47,670][0m Trial 4 finished with value: 0.4059909296449809 and parameters: {'lsvc_pcs_kernel_gamma': 29.984060688286874, 'lsvc_pcs_kernel_n_components': 100, 'lsvc_pcs_degree': 2, 'lsvc_pcs_dual': False, 'lsvc_pcs_C': 2.6975648116181906e-06, 'lsvc_pcs_max_iter': 2000}. Best is trial 0 with value: 0.701326.[0m
[32m[I 2022-10-26 12:35:01,103][0m Trial 5 finished with value: 0.7134192399078086 and parameters: {'lsvc_pcs_kernel_gamma': 613.2099589465397, 'lsvc_pcs_kernel_n_components': 100, 'lsvc_pcs_degree': 2, 'lsvc_pcs_dual': False, 'lsvc_pcs_C': 1.6099475536124777, 'lsvc_pcs_max_iter': 2000}. Best is trial 5 with value: 0.713419.[0m
[32m[I 2022-10-26 12:35:12,721][0m Trial 6 finished with value: 0.4306066086089303 and parameters: {'lsvc_pcs_kernel_gamma': 0.0010662403766987427, 'lsvc_pcs_kernel_n_components': 50, 'lsvc_pcs_degree': 2, 'lsvc_pcs_dual': False, 'lsvc_pcs_C': 405.888337129124, 'lsvc_pcs_max_iter': 2000}. Best is trial 5 with value: 0.713419.[0m
[32m[I 2022-10-26 12:35:26,082][0m Trial 7 finished with value: 0.7123947367847479 and parameters: {'lsvc_pcs_kernel_gamma': 0.5939224633316441, 'lsvc_pcs_kernel_n_components': 100, 'lsvc_pcs_degree': 2, 'lsvc_pcs_dual': False, 'lsvc_pcs_C': 0.0004765128902592423, 'lsvc_pcs_max_iter': 2000}. Best is trial 5 with value: 0.713419.[0m
[32m[I 2022-10-26 12:35:37,687][0m Trial 8 finished with value: 0.39745316217973514 and parameters: {'lsvc_pcs_kernel_gamma': 9.708697565111716, 'lsvc_pcs_kernel_n_components': 50, 'lsvc_pcs_degree': 2, 'lsvc_pcs_dual': False, 'lsvc_pcs_C': 0.8854273325403512, 'lsvc_pcs_max_iter': 2000}. Best is trial 5 with value: 0.713419.[0m
[32m[I 2022-10-26 12:36:05,669][0m Trial 9 finished with value: 0.5956403223932989 and parameters: {'lsvc_pcs_kernel_gamma': 2.2701657221058165, 'lsvc_pcs_kernel_n_components': 150, 'lsvc_pcs_degree': 2, 'lsvc_pcs_dual': False, 'lsvc_pcs_C': 636.5586886064535, 'lsvc_pcs_max_iter': 2000}. Best is trial 5 with value: 0.713419.[0m
[32m[I 2022-10-26 12:36:17,313][0m Trial 10 finished with value: 0.24066769847423827 and parameters: {'lsvc_pcs_kernel_gamma': 0.02411903647204552, 'lsvc_pcs_kernel_n_components': 50, 'lsvc_pcs_degree': 2, 'lsvc_pcs_dual': False, 'lsvc_pcs_C': 0.4949205018012651, 'lsvc_pcs_max_iter': 2000}. Best is trial 5 with value: 0.713419.[0m
[32m[I 2022-10-26 12:36:31,354][0m Trial 11 finished with value: 0.15599539056525366 and parameters: {'lsvc_pcs_kernel_gamma': 0.10430776908576428, 'lsvc_pcs_kernel_n_components': 100, 'lsvc_pcs_degree': 2, 'lsvc_pcs_dual': False, 'lsvc_pcs_C': 3.4918904375790656, 'lsvc_pcs_max_iter': 2000}. Best is trial 5 with value: 0.713419.[0m
[32m[I 2022-10-26 12:36:44,822][0m Trial 12 finished with value: 0.40513348217329326 and parameters: {'lsvc_pcs_kernel_gamma': 0.4655877947495532, 'lsvc_pcs_kernel_n_components': 100, 'lsvc_pcs_degree': 2, 'lsvc_pcs_dual': False, 'lsvc_pcs_C': 0.000165165816971634, 'lsvc_pcs_max_iter': 2000}. Best is trial 5 with value: 0.713419.[0m
[32m[I 2022-10-26 12:36:58,156][0m Trial 13 finished with value: 0.7088458956694547 and parameters: {'lsvc_pcs_kernel_gamma': 54.177828321482814, 'lsvc_pcs_kernel_n_components': 100, 'lsvc_pcs_degree': 2, 'lsvc_pcs_dual': False, 'lsvc_pcs_C': 22.581624476229372, 'lsvc_pcs_max_iter': 2000}. Best is trial 5 with value: 0.713419.[0m
[32m[I 2022-10-26 12:37:09,728][0m Trial 14 finished with value: 0.3219688162484085 and parameters: {'lsvc_pcs_kernel_gamma': 0.00569708312764078, 'lsvc_pcs_kernel_n_components': 50, 'lsvc_pcs_degree': 2, 'lsvc_pcs_dual': False, 'lsvc_pcs_C': 0.16507030899040737, 'lsvc_pcs_max_iter': 2000}. Best is trial 5 with value: 0.713419.[0m
[32m[I 2022-10-26 12:37:43,074][0m Trial 15 finished with value: 0.5847730436873854 and parameters: {'lsvc_pcs_kernel_gamma': 934.6825585266077, 'lsvc_pcs_kernel_n_components': 150, 'lsvc_pcs_degree': 2, 'lsvc_pcs_dual': False, 'lsvc_pcs_C': 3.524296122177018e-05, 'lsvc_pcs_max_iter': 2000}. Best is trial 5 with value: 0.713419.[0m
[32m[I 2022-10-26 12:37:56,499][0m Trial 16 finished with value: 0.1591097431561356 and parameters: {'lsvc_pcs_kernel_gamma': 0.4157154390321227, 'lsvc_pcs_kernel_n_components': 100, 'lsvc_pcs_degree': 2, 'lsvc_pcs_dual': False, 'lsvc_pcs_C': 0.05324739392744794, 'lsvc_pcs_max_iter': 2000}. Best is trial 5 with value: 0.713419.[0m
[32m[I 2022-10-26 12:38:08,066][0m Trial 17 finished with value: 0.2995546783934471 and parameters: {'lsvc_pcs_kernel_gamma': 9.726386758765646, 'lsvc_pcs_kernel_n_components': 50, 'lsvc_pcs_degree': 2, 'lsvc_pcs_dual': False, 'lsvc_pcs_C': 0.0004983354761220941, 'lsvc_pcs_max_iter': 2000}. Best is trial 5 with value: 0.713419.[0m
[32m[I 2022-10-26 12:38:21,407][0m Trial 18 finished with value: 0.143227151023316 and parameters: {'lsvc_pcs_kernel_gamma': 95.53461450391048, 'lsvc_pcs_kernel_n_components': 100, 'lsvc_pcs_degree': 2, 'lsvc_pcs_dual': False, 'lsvc_pcs_C': 0.016417394809044514, 'lsvc_pcs_max_iter': 2000}. Best is trial 5 with value: 0.713419.[0m
[32m[I 2022-10-26 12:38:54,259][0m Trial 19 finished with value: 0.6522426839051172 and parameters: {'lsvc_pcs_kernel_gamma': 13.554310349965814, 'lsvc_pcs_kernel_n_components': 150, 'lsvc_pcs_degree': 2, 'lsvc_pcs_dual': False, 'lsvc_pcs_C': 31.008212000916572, 'lsvc_pcs_max_iter': 2000}. Best is trial 5 with value: 0.713419.[0m
[32m[I 2022-10-26 12:39:08,244][0m Trial 20 finished with value: 0.14497406739766727 and parameters: {'lsvc_pcs_kernel_gamma': 1.2062624133049886, 'lsvc_pcs_kernel_n_components': 100, 'lsvc_pcs_degree': 2, 'lsvc_pcs_dual': False, 'lsvc_pcs_C': 5.668900930923379e-05, 'lsvc_pcs_max_iter': 2000}. Best is trial 5 with value: 0.713419.[0m
[32m[I 2022-10-26 12:39:21,859][0m Trial 21 finished with value: 0.1449356352912179 and parameters: {'lsvc_pcs_kernel_gamma': 70.92963676274691, 'lsvc_pcs_kernel_n_components': 100, 'lsvc_pcs_degree': 2, 'lsvc_pcs_dual': False, 'lsvc_pcs_C': 18.5695532182113, 'lsvc_pcs_max_iter': 2000}. Best is trial 5 with value: 0.713419.[0m
[32m[I 2022-10-26 12:39:35,605][0m Trial 22 finished with value: 0.4104384652933837 and parameters: {'lsvc_pcs_kernel_gamma': 434.0767284649977, 'lsvc_pcs_kernel_n_components': 100, 'lsvc_pcs_degree': 2, 'lsvc_pcs_dual': False, 'lsvc_pcs_C': 31.613151655449457, 'lsvc_pcs_max_iter': 2000}. Best is trial 5 with value: 0.713419.[0m
[32m[I 2022-10-26 12:39:49,259][0m Trial 23 finished with value: 0.7109074465063108 and parameters: {'lsvc_pcs_kernel_gamma': 50.94072749823313, 'lsvc_pcs_kernel_n_components': 100, 'lsvc_pcs_degree': 2, 'lsvc_pcs_dual': False, 'lsvc_pcs_C': 3.851315918033672, 'lsvc_pcs_max_iter': 2000}. Best is trial 5 with value: 0.713419.[0m
[32m[I 2022-10-26 12:40:02,950][0m Trial 24 finished with value: 0.7168032076278603 and parameters: {'lsvc_pcs_kernel_gamma': 807.064504021698, 'lsvc_pcs_kernel_n_components': 100, 'lsvc_pcs_degree': 2, 'lsvc_pcs_dual': False, 'lsvc_pcs_C': 2.488027156247267, 'lsvc_pcs_max_iter': 2000}. Best is trial 24 with value: 0.716803.[0m
[32m[I 2022-10-26 12:40:16,662][0m Trial 25 finished with value: 0.701130838569483 and parameters: {'lsvc_pcs_kernel_gamma': 224.81523673623695, 'lsvc_pcs_kernel_n_components': 100, 'lsvc_pcs_degree': 2, 'lsvc_pcs_dual': False, 'lsvc_pcs_C': 0.1114628812859168, 'lsvc_pcs_max_iter': 2000}. Best is trial 24 with value: 0.716803.[0m
