[32m[I 2022-10-26 23:22:50,733][0m Trial 87 finished with value: 0.6984452162041704 and parameters: {'sgdc_loss': 'log', 'sgdc_penalty': 'elasticnet', 'sgdc_alpha': 7.75548075263724e-06, 'sgdc_l1_ratio': 1.0, 'sgdc_learning_rate': 'constant', 'sgdc_eta0': 50.963641461122144, 'sgdc_early_stopping': True, 'sgdc_validation_fraction': 0.25, 'sgdc_n_iter_no_change': 10}. Best is trial 74 with value: 0.802711.[0m
[32m[I 2022-10-26 23:22:50,914][0m Trial 86 finished with value: 0.7200642319652016 and parameters: {'sgdc_loss': 'squared_hinge', 'sgdc_penalty': 'elasticnet', 'sgdc_alpha': 8.899871792284573e-06, 'sgdc_l1_ratio': 1.0, 'sgdc_learning_rate': 'constant', 'sgdc_eta0': 94.2544383344378, 'sgdc_early_stopping': True, 'sgdc_validation_fraction': 0.25, 'sgdc_n_iter_no_change': 10}. Best is trial 74 with value: 0.802711.[0m
[32m[I 2022-10-26 23:23:27,578][0m Trial 90 finished with value: 0.6977879552251672 and parameters: {'sgdc_loss': 'squared_hinge', 'sgdc_penalty': 'elasticnet', 'sgdc_alpha': 7.947705068897901e-06, 'sgdc_l1_ratio': 1.0, 'sgdc_learning_rate': 'constant', 'sgdc_eta0': 90.65637850761257, 'sgdc_early_stopping': True, 'sgdc_validation_fraction': 0.25, 'sgdc_n_iter_no_change': 10}. Best is trial 74 with value: 0.802711.[0m
[32m[I 2022-10-26 23:23:31,666][0m Trial 89 finished with value: 0.6986259604140002 and parameters: {'sgdc_loss': 'log', 'sgdc_penalty': 'elasticnet', 'sgdc_alpha': 9.002062118135618e-06, 'sgdc_l1_ratio': 1.0, 'sgdc_learning_rate': 'constant', 'sgdc_eta0': 79.52780053452491, 'sgdc_early_stopping': True, 'sgdc_validation_fraction': 0.25, 'sgdc_n_iter_no_change': 10}. Best is trial 74 with value: 0.802711.[0m
[32m[I 2022-10-26 23:23:41,358][0m Trial 93 finished with value: 0.21698681333657613 and parameters: {'sgdc_loss': 'log', 'sgdc_penalty': 'elasticnet', 'sgdc_alpha': 0.00017446759654633128, 'sgdc_l1_ratio': 0.6000000000000001, 'sgdc_learning_rate': 'invscaling', 'sgdc_eta0': 42.50490890417462, 'sgdc_early_stopping': True, 'sgdc_validation_fraction': 0.25, 'sgdc_n_iter_no_change': 10}. Best is trial 74 with value: 0.802711.[0m
[32m[I 2022-10-26 23:23:43,623][0m Trial 97 finished with value: 0.13898821204274642 and parameters: {'sgdc_loss': 'log', 'sgdc_penalty': 'elasticnet', 'sgdc_alpha': 1.414503733518297e-06, 'sgdc_l1_ratio': 0.6000000000000001, 'sgdc_learning_rate': 'invscaling', 'sgdc_eta0': 34.2227500567536, 'sgdc_early_stopping': True, 'sgdc_validation_fraction': 0.25, 'sgdc_n_iter_no_change': 10}. Best is trial 74 with value: 0.802711.[0m
[32m[I 2022-10-26 23:23:43,761][0m Trial 92 finished with value: 0.14791537565312987 and parameters: {'sgdc_loss': 'log', 'sgdc_penalty': 'elasticnet', 'sgdc_alpha': 1.4938281841360557e-06, 'sgdc_l1_ratio': 1.0, 'sgdc_learning_rate': 'invscaling', 'sgdc_eta0': 1.0002723169668881, 'sgdc_early_stopping': True, 'sgdc_validation_fraction': 0.25, 'sgdc_n_iter_no_change': 10}. Best is trial 74 with value: 0.802711.[0m
[32m[I 2022-10-26 23:23:44,342][0m Trial 94 finished with value: 0.7173903019245133 and parameters: {'sgdc_loss': 'log', 'sgdc_penalty': 'elasticnet', 'sgdc_alpha': 1.5580008267161847e-05, 'sgdc_l1_ratio': 0.6000000000000001, 'sgdc_learning_rate': 'invscaling', 'sgdc_eta0': 42.06695579440583, 'sgdc_early_stopping': True, 'sgdc_validation_fraction': 0.25, 'sgdc_n_iter_no_change': 10}. Best is trial 74 with value: 0.802711.[0m
[32m[I 2022-10-26 23:23:49,183][0m Trial 95 finished with value: 0.7631541622067537 and parameters: {'sgdc_loss': 'log', 'sgdc_penalty': 'elasticnet', 'sgdc_alpha': 1.6077850976765876e-05, 'sgdc_l1_ratio': 0.6000000000000001, 'sgdc_learning_rate': 'invscaling', 'sgdc_eta0': 27.35444692085477, 'sgdc_early_stopping': True, 'sgdc_validation_fraction': 0.25, 'sgdc_n_iter_no_change': 10}. Best is trial 74 with value: 0.802711.[0m
[32m[I 2022-10-26 23:23:49,320][0m Trial 96 finished with value: 0.5098426529389067 and parameters: {'sgdc_loss': 'log', 'sgdc_penalty': 'elasticnet', 'sgdc_alpha': 1.5698217182370057e-05, 'sgdc_l1_ratio': 0.6000000000000001, 'sgdc_learning_rate': 'invscaling', 'sgdc_eta0': 7.395395022052606, 'sgdc_early_stopping': True, 'sgdc_validation_fraction': 0.25, 'sgdc_n_iter_no_change': 10}. Best is trial 74 with value: 0.802711.[0m
[32m[I 2022-10-26 23:24:05,572][0m Trial 98 finished with value: 0.7813036585598023 and parameters: {'sgdc_loss': 'log', 'sgdc_penalty': 'elasticnet', 'sgdc_alpha': 1.5802955120886722e-06, 'sgdc_l1_ratio': 0.6000000000000001, 'sgdc_learning_rate': 'optimal', 'sgdc_eta0': 1.1290507223259052, 'sgdc_early_stopping': True, 'sgdc_validation_fraction': 0.25, 'sgdc_n_iter_no_change': 10}. Best is trial 74 with value: 0.802711.[0m
[32m[I 2022-10-26 23:24:09,462][0m Trial 99 finished with value: 0.7261815921390163 and parameters: {'sgdc_loss': 'squared_hinge', 'sgdc_penalty': 'elasticnet', 'sgdc_alpha': 1.2696359737361051e-06, 'sgdc_l1_ratio': 0.6000000000000001, 'sgdc_learning_rate': 'optimal', 'sgdc_eta0': 1.211825620106537, 'sgdc_early_stopping': True, 'sgdc_validation_fraction': 0.25, 'sgdc_n_iter_no_change': 10}. Best is trial 74 with value: 0.802711.[0m
[32m[I 2022-10-26 23:24:09,564][0m Study finished.[0m
[32m[I 2022-10-26 23:24:09,584][0m --------------------------------------------------------------------------------[0m
[32m[I 2022-10-26 23:24:09,584][0m --------------------    VeryFastDecisionRulesClassifier     --------------------[0m
[32m[I 2022-10-26 23:24:09,585][0m --------------------------------------------------------------------------------[0m
[32m[I 2022-10-26 23:24:09,678][0m A new study created in RDB with name: VeryFastDecisionRulesClassifier_c963b74b[0m
[32m[I 2022-10-26 23:24:09,692][0m Study started.[0m
[32m[I 2022-10-26 23:38:54,363][0m Trial 1 finished with value: 0.6484309052275083 and parameters: {'vfdrc_ordered_rules': True, 'vfdrc_grace_period': 250, 'vfdrc_tie_threshold': 0.55, 'vfdrc_rule_prediction': 'weighted_sum', 'vfdrc_max_rules': 30, 'vfdrc_expand_criterion': 'foil_gain', 'vfdrc_remove_poor_atts': True}. Best is trial 1 with value: 0.648431.[0m
[32m[I 2022-10-26 23:40:44,438][0m Trial 0 finished with value: 0.15103846126307766 and parameters: {'vfdrc_ordered_rules': False, 'vfdrc_grace_period': 400, 'vfdrc_tie_threshold': 0.75, 'vfdrc_rule_prediction': 'weighted_max', 'vfdrc_max_rules': 10, 'vfdrc_expand_criterion': 'foil_gain', 'vfdrc_remove_poor_atts': True}. Best is trial 1 with value: 0.648431.[0m
[32m[I 2022-10-26 23:40:56,910][0m Trial 6 finished with value: 0.1520365471689274 and parameters: {'vfdrc_ordered_rules': False, 'vfdrc_grace_period': 350, 'vfdrc_tie_threshold': 0.4, 'vfdrc_rule_prediction': 'weighted_sum', 'vfdrc_max_rules': 40, 'vfdrc_expand_criterion': 'hellinger', 'vfdrc_remove_poor_atts': False}. Best is trial 1 with value: 0.648431.[0m
[32m[I 2022-10-26 23:41:04,564][0m Trial 7 finished with value: 0.24758861877212687 and parameters: {'vfdrc_ordered_rules': True, 'vfdrc_grace_period': 250, 'vfdrc_tie_threshold': 0.30000000000000004, 'vfdrc_rule_prediction': 'weighted_sum', 'vfdrc_max_rules': 30, 'vfdrc_expand_criterion': 'foil_gain', 'vfdrc_remove_poor_atts': True}. Best is trial 1 with value: 0.648431.[0m
[32m[I 2022-10-26 23:41:15,291][0m Trial 2 finished with value: 0.09674784483940815 and parameters: {'vfdrc_ordered_rules': False, 'vfdrc_grace_period': 350, 'vfdrc_tie_threshold': 0.8500000000000001, 'vfdrc_rule_prediction': 'weighted_max', 'vfdrc_max_rules': 10, 'vfdrc_expand_criterion': 'foil_gain', 'vfdrc_remove_poor_atts': False}. Best is trial 1 with value: 0.648431.[0m
[32m[I 2022-10-26 23:44:15,468][0m Trial 3 finished with value: 0.22032700343375586 and parameters: {'vfdrc_ordered_rules': False, 'vfdrc_grace_period': 350, 'vfdrc_tie_threshold': 0.9, 'vfdrc_rule_prediction': 'first_hit', 'vfdrc_max_rules': 40, 'vfdrc_expand_criterion': 'foil_gain', 'vfdrc_remove_poor_atts': False}. Best is trial 1 with value: 0.648431.[0m
[32m[I 2022-10-26 23:45:43,656][0m Trial 4 finished with value: 0.42648070140668914 and parameters: {'vfdrc_ordered_rules': False, 'vfdrc_grace_period': 300, 'vfdrc_tie_threshold': 0.0, 'vfdrc_rule_prediction': 'weighted_max', 'vfdrc_max_rules': 30, 'vfdrc_expand_criterion': 'hellinger', 'vfdrc_remove_poor_atts': True}. Best is trial 1 with value: 0.648431.[0m
[32m[I 2022-10-26 23:47:54,562][0m Trial 5 finished with value: 0.08394332376333051 and parameters: {'vfdrc_ordered_rules': False, 'vfdrc_grace_period': 250, 'vfdrc_tie_threshold': 0.9500000000000001, 'vfdrc_rule_prediction': 'weighted_sum', 'vfdrc_max_rules': 40, 'vfdrc_expand_criterion': 'hellinger', 'vfdrc_remove_poor_atts': False}. Best is trial 1 with value: 0.648431.[0m
[32m[I 2022-10-26 23:52:26,077][0m Trial 8 finished with value: 0.4511556537544617 and parameters: {'vfdrc_ordered_rules': True, 'vfdrc_grace_period': 400, 'vfdrc_tie_threshold': 0.4, 'vfdrc_rule_prediction': 'first_hit', 'vfdrc_max_rules': 30, 'vfdrc_expand_criterion': 'hellinger', 'vfdrc_remove_poor_atts': False}. Best is trial 1 with value: 0.648431.[0m
[32m[I 2022-10-26 23:53:11,749][0m Trial 9 finished with value: 0.15986178836092182 and parameters: {'vfdrc_ordered_rules': True, 'vfdrc_grace_period': 100, 'vfdrc_tie_threshold': 0.2, 'vfdrc_rule_prediction': 'weighted_max', 'vfdrc_max_rules': 10, 'vfdrc_expand_criterion': 'foil_gain', 'vfdrc_remove_poor_atts': True}. Best is trial 1 with value: 0.648431.[0m
[32m[I 2022-10-26 23:54:08,694][0m Trial 10 finished with value: 0.1519817815307236 and parameters: {'vfdrc_ordered_rules': False, 'vfdrc_grace_period': 350, 'vfdrc_tie_threshold': 0.15000000000000002, 'vfdrc_rule_prediction': 'first_hit', 'vfdrc_max_rules': 35, 'vfdrc_expand_criterion': 'foil_gain', 'vfdrc_remove_poor_atts': True}. Best is trial 1 with value: 0.648431.[0m
[32m[I 2022-10-26 23:55:07,366][0m Trial 11 finished with value: 0.1660813784998172 and parameters: {'vfdrc_ordered_rules': False, 'vfdrc_grace_period': 250, 'vfdrc_tie_threshold': 0.9, 'vfdrc_rule_prediction': 'first_hit', 'vfdrc_max_rules': 35, 'vfdrc_expand_criterion': 'foil_gain', 'vfdrc_remove_poor_atts': False}. Best is trial 1 with value: 0.648431.[0m
[32m[I 2022-10-26 23:57:10,455][0m Trial 12 finished with value: 0.2847983172574975 and parameters: {'vfdrc_ordered_rules': True, 'vfdrc_grace_period': 300, 'vfdrc_tie_threshold': 0.75, 'vfdrc_rule_prediction': 'weighted_sum', 'vfdrc_max_rules': 30, 'vfdrc_expand_criterion': 'hellinger', 'vfdrc_remove_poor_atts': True}. Best is trial 1 with value: 0.648431.[0m
[32m[I 2022-10-26 23:57:13,402][0m Trial 13 finished with value: 0.5116370759500464 and parameters: {'vfdrc_ordered_rules': True, 'vfdrc_grace_period': 100, 'vfdrc_tie_threshold': 0.25, 'vfdrc_rule_prediction': 'first_hit', 'vfdrc_max_rules': 10, 'vfdrc_expand_criterion': 'info_gain', 'vfdrc_remove_poor_atts': False}. Best is trial 1 with value: 0.648431.[0m
[32m[I 2022-10-26 23:58:27,973][0m Trial 14 finished with value: 0.35108574399437303 and parameters: {'vfdrc_ordered_rules': True, 'vfdrc_grace_period': 200, 'vfdrc_tie_threshold': 0.6000000000000001, 'vfdrc_rule_prediction': 'weighted_sum', 'vfdrc_max_rules': 15, 'vfdrc_expand_criterion': 'info_gain', 'vfdrc_remove_poor_atts': False}. Best is trial 1 with value: 0.648431.[0m
[32m[I 2022-10-27 00:01:06,804][0m Trial 15 finished with value: 0.20029475349205395 and parameters: {'vfdrc_ordered_rules': False, 'vfdrc_grace_period': 250, 'vfdrc_tie_threshold': 0.6000000000000001, 'vfdrc_rule_prediction': 'first_hit', 'vfdrc_max_rules': 40, 'vfdrc_expand_criterion': 'info_gain', 'vfdrc_remove_poor_atts': True}. Best is trial 1 with value: 0.648431.[0m
[32m[I 2022-10-27 00:02:42,166][0m Trial 21 finished with value: 0.6925102891728763 and parameters: {'vfdrc_ordered_rules': True, 'vfdrc_grace_period': 100, 'vfdrc_tie_threshold': 0.6000000000000001, 'vfdrc_rule_prediction': 'weighted_sum', 'vfdrc_max_rules': 20, 'vfdrc_expand_criterion': 'info_gain', 'vfdrc_remove_poor_atts': True}. Best is trial 21 with value: 0.69251.[0m
[32m[I 2022-10-27 00:02:42,474][0m Trial 17 finished with value: 0.3045383121144054 and parameters: {'vfdrc_ordered_rules': True, 'vfdrc_grace_period': 150, 'vfdrc_tie_threshold': 0.65, 'vfdrc_rule_prediction': 'weighted_sum', 'vfdrc_max_rules': 20, 'vfdrc_expand_criterion': 'info_gain', 'vfdrc_remove_poor_atts': True}. Best is trial 20 with value: 0.69251.[0m
[32m[I 2022-10-27 00:02:42,481][0m Trial 20 finished with value: 0.6925102891728763 and parameters: {'vfdrc_ordered_rules': True, 'vfdrc_grace_period': 100, 'vfdrc_tie_threshold': 0.6000000000000001, 'vfdrc_rule_prediction': 'weighted_sum', 'vfdrc_max_rules': 20, 'vfdrc_expand_criterion': 'info_gain', 'vfdrc_remove_poor_atts': True}. Best is trial 20 with value: 0.69251.[0m
[32m[I 2022-10-27 00:02:42,562][0m Trial 23 finished with value: 0.555602242576222 and parameters: {'vfdrc_ordered_rules': True, 'vfdrc_grace_period': 100, 'vfdrc_tie_threshold': 0.5, 'vfdrc_rule_prediction': 'weighted_sum', 'vfdrc_max_rules': 20, 'vfdrc_expand_criterion': 'info_gain', 'vfdrc_remove_poor_atts': False}. Best is trial 20 with value: 0.69251.[0m
[32m[I 2022-10-27 00:02:42,729][0m Trial 19 finished with value: 0.5405110743956053 and parameters: {'vfdrc_ordered_rules': True, 'vfdrc_grace_period': 150, 'vfdrc_tie_threshold': 0.6000000000000001, 'vfdrc_rule_prediction': 'weighted_sum', 'vfdrc_max_rules': 20, 'vfdrc_expand_criterion': 'info_gain', 'vfdrc_remove_poor_atts': True}. Best is trial 20 with value: 0.69251.[0m
[32m[I 2022-10-27 00:02:42,818][0m Trial 16 finished with value: 0.3189288060928392 and parameters: {'vfdrc_ordered_rules': True, 'vfdrc_grace_period': 150, 'vfdrc_tie_threshold': 0.05, 'vfdrc_rule_prediction': 'weighted_max', 'vfdrc_max_rules': 10, 'vfdrc_expand_criterion': 'info_gain', 'vfdrc_remove_poor_atts': True}. Best is trial 20 with value: 0.69251.[0m
[32m[I 2022-10-27 00:02:42,908][0m Trial 18 finished with value: 0.5405110743956053 and parameters: {'vfdrc_ordered_rules': True, 'vfdrc_grace_period': 150, 'vfdrc_tie_threshold': 0.6000000000000001, 'vfdrc_rule_prediction': 'first_hit', 'vfdrc_max_rules': 20, 'vfdrc_expand_criterion': 'info_gain', 'vfdrc_remove_poor_atts': False}. Best is trial 20 with value: 0.69251.[0m
[32m[I 2022-10-27 00:02:42,996][0m Trial 22 finished with value: 0.5531454106299959 and parameters: {'vfdrc_ordered_rules': True, 'vfdrc_grace_period': 100, 'vfdrc_tie_threshold': 0.55, 'vfdrc_rule_prediction': 'first_hit', 'vfdrc_max_rules': 20, 'vfdrc_expand_criterion': 'info_gain', 'vfdrc_remove_poor_atts': True}. Best is trial 20 with value: 0.69251.[0m
[32m[I 2022-10-27 00:13:38,379][0m Trial 26 finished with value: 0.5785792184795574 and parameters: {'vfdrc_ordered_rules': True, 'vfdrc_grace_period': 200, 'vfdrc_tie_threshold': 0.4, 'vfdrc_rule_prediction': 'weighted_sum', 'vfdrc_max_rules': 25, 'vfdrc_expand_criterion': 'info_gain', 'vfdrc_remove_poor_atts': True}. Best is trial 20 with value: 0.69251.[0m
[32m[I 2022-10-27 00:13:38,634][0m Trial 28 finished with value: 0.5785792184795574 and parameters: {'vfdrc_ordered_rules': True, 'vfdrc_grace_period': 200, 'vfdrc_tie_threshold': 0.4, 'vfdrc_rule_prediction': 'weighted_sum', 'vfdrc_max_rules': 25, 'vfdrc_expand_criterion': 'info_gain', 'vfdrc_remove_poor_atts': True}. Best is trial 20 with value: 0.69251.[0m
[32m[I 2022-10-27 00:13:45,517][0m Trial 30 finished with value: 0.5785792184795574 and parameters: {'vfdrc_ordered_rules': True, 'vfdrc_grace_period': 200, 'vfdrc_tie_threshold': 0.4, 'vfdrc_rule_prediction': 'weighted_sum', 'vfdrc_max_rules': 25, 'vfdrc_expand_criterion': 'info_gain', 'vfdrc_remove_poor_atts': True}. Best is trial 20 with value: 0.69251.[0m
[32m[I 2022-10-27 00:13:47,685][0m Trial 29 finished with value: 0.5785792184795574 and parameters: {'vfdrc_ordered_rules': True, 'vfdrc_grace_period': 200, 'vfdrc_tie_threshold': 0.4, 'vfdrc_rule_prediction': 'weighted_sum', 'vfdrc_max_rules': 25, 'vfdrc_expand_criterion': 'info_gain', 'vfdrc_remove_poor_atts': True}. Best is trial 20 with value: 0.69251.[0m
[32m[I 2022-10-27 00:14:03,925][0m Trial 24 finished with value: 0.5785792184795574 and parameters: {'vfdrc_ordered_rules': True, 'vfdrc_grace_period': 200, 'vfdrc_tie_threshold': 0.4, 'vfdrc_rule_prediction': 'weighted_sum', 'vfdrc_max_rules': 25, 'vfdrc_expand_criterion': 'info_gain', 'vfdrc_remove_poor_atts': True}. Best is trial 20 with value: 0.69251.[0m
[32m[I 2022-10-27 00:14:06,181][0m Trial 31 finished with value: 0.4393660905114275 and parameters: {'vfdrc_ordered_rules': True, 'vfdrc_grace_period': 200, 'vfdrc_tie_threshold': 0.75, 'vfdrc_rule_prediction': 'weighted_sum', 'vfdrc_max_rules': 25, 'vfdrc_expand_criterion': 'info_gain', 'vfdrc_remove_poor_atts': True}. Best is trial 20 with value: 0.69251.[0m
[32m[I 2022-10-27 00:14:07,325][0m Trial 25 finished with value: 0.5785792184795574 and parameters: {'vfdrc_ordered_rules': True, 'vfdrc_grace_period': 200, 'vfdrc_tie_threshold': 0.4, 'vfdrc_rule_prediction': 'weighted_sum', 'vfdrc_max_rules': 25, 'vfdrc_expand_criterion': 'info_gain', 'vfdrc_remove_poor_atts': True}. Best is trial 20 with value: 0.69251.[0m
[32m[I 2022-10-27 00:14:08,472][0m Trial 27 finished with value: 0.4393660905114275 and parameters: {'vfdrc_ordered_rules': True, 'vfdrc_grace_period': 200, 'vfdrc_tie_threshold': 0.75, 'vfdrc_rule_prediction': 'weighted_sum', 'vfdrc_max_rules': 25, 'vfdrc_expand_criterion': 'info_gain', 'vfdrc_remove_poor_atts': True}. Best is trial 20 with value: 0.69251.[0m
[32m[I 2022-10-27 00:25:19,903][0m Trial 34 finished with value: 0.3717391175807861 and parameters: {'vfdrc_ordered_rules': True, 'vfdrc_grace_period': 150, 'vfdrc_tie_threshold': 0.75, 'vfdrc_rule_prediction': 'weighted_sum', 'vfdrc_max_rules': 15, 'vfdrc_expand_criterion': 'foil_gain', 'vfdrc_remove_poor_atts': True}. Best is trial 20 with value: 0.69251.[0m
[32m[I 2022-10-27 00:25:27,838][0m Trial 39 finished with value: 0.14879408527304533 and parameters: {'vfdrc_ordered_rules': True, 'vfdrc_grace_period': 300, 'vfdrc_tie_threshold': 0.5, 'vfdrc_rule_prediction': 'weighted_sum', 'vfdrc_max_rules': 15, 'vfdrc_expand_criterion': 'foil_gain', 'vfdrc_remove_poor_atts': True}. Best is trial 20 with value: 0.69251.[0m
[32m[I 2022-10-27 00:25:28,227][0m Trial 35 finished with value: 0.0947124420771591 and parameters: {'vfdrc_ordered_rules': True, 'vfdrc_grace_period': 150, 'vfdrc_tie_threshold': 0.5, 'vfdrc_rule_prediction': 'weighted_sum', 'vfdrc_max_rules': 15, 'vfdrc_expand_criterion': 'foil_gain', 'vfdrc_remove_poor_atts': True}. Best is trial 20 with value: 0.69251.[0m
[32m[I 2022-10-27 00:25:28,525][0m Trial 36 finished with value: 0.14879408527304533 and parameters: {'vfdrc_ordered_rules': True, 'vfdrc_grace_period': 300, 'vfdrc_tie_threshold': 0.5, 'vfdrc_rule_prediction': 'weighted_sum', 'vfdrc_max_rules': 15, 'vfdrc_expand_criterion': 'foil_gain', 'vfdrc_remove_poor_atts': True}. Best is trial 20 with value: 0.69251.[0m
[32m[I 2022-10-27 00:25:28,556][0m Trial 33 finished with value: 0.4619902004428384 and parameters: {'vfdrc_ordered_rules': True, 'vfdrc_grace_period': 200, 'vfdrc_tie_threshold': 0.75, 'vfdrc_rule_prediction': 'weighted_sum', 'vfdrc_max_rules': 25, 'vfdrc_expand_criterion': 'foil_gain', 'vfdrc_remove_poor_atts': True}. Best is trial 20 with value: 0.69251.[0m
[32m[I 2022-10-27 00:25:34,837][0m Trial 32 finished with value: 0.4619902004428384 and parameters: {'vfdrc_ordered_rules': True, 'vfdrc_grace_period': 200, 'vfdrc_tie_threshold': 0.75, 'vfdrc_rule_prediction': 'weighted_sum', 'vfdrc_max_rules': 25, 'vfdrc_expand_criterion': 'foil_gain', 'vfdrc_remove_poor_atts': True}. Best is trial 20 with value: 0.69251.[0m
[32m[I 2022-10-27 00:25:41,757][0m Trial 37 finished with value: 0.14879408527304533 and parameters: {'vfdrc_ordered_rules': True, 'vfdrc_grace_period': 300, 'vfdrc_tie_threshold': 0.5, 'vfdrc_rule_prediction': 'weighted_sum', 'vfdrc_max_rules': 15, 'vfdrc_expand_criterion': 'foil_gain', 'vfdrc_remove_poor_atts': True}. Best is trial 20 with value: 0.69251.[0m
[32m[I 2022-10-27 00:25:43,000][0m Trial 38 finished with value: 0.14879408527304533 and parameters: {'vfdrc_ordered_rules': True, 'vfdrc_grace_period': 300, 'vfdrc_tie_threshold': 0.5, 'vfdrc_rule_prediction': 'weighted_sum', 'vfdrc_max_rules': 15, 'vfdrc_expand_criterion': 'foil_gain', 'vfdrc_remove_poor_atts': True}. Best is trial 20 with value: 0.69251.[0m
[32m[I 2022-10-27 00:41:53,227][0m Trial 40 finished with value: 0.14879408527304533 and parameters: {'vfdrc_ordered_rules': True, 'vfdrc_grace_period': 300, 'vfdrc_tie_threshold': 0.5, 'vfdrc_rule_prediction': 'weighted_sum', 'vfdrc_max_rules': 15, 'vfdrc_expand_criterion': 'foil_gain', 'vfdrc_remove_poor_atts': True}. Best is trial 20 with value: 0.69251.[0m
[32m[I 2022-10-27 00:43:10,876][0m Trial 43 finished with value: 0.08391289463151232 and parameters: {'vfdrc_ordered_rules': False, 'vfdrc_grace_period': 100, 'vfdrc_tie_threshold': 0.30000000000000004, 'vfdrc_rule_prediction': 'weighted_max', 'vfdrc_max_rules': 30, 'vfdrc_expand_criterion': 'hellinger', 'vfdrc_remove_poor_atts': True}. Best is trial 20 with value: 0.69251.[0m
[32m[I 2022-10-27 00:43:20,321][0m Trial 42 finished with value: 0.08383563734770995 and parameters: {'vfdrc_ordered_rules': False, 'vfdrc_grace_period': 100, 'vfdrc_tie_threshold': 0.65, 'vfdrc_rule_prediction': 'weighted_max', 'vfdrc_max_rules': 30, 'vfdrc_expand_criterion': 'hellinger', 'vfdrc_remove_poor_atts': True}. Best is trial 20 with value: 0.69251.[0m
[32m[I 2022-10-27 00:44:03,919][0m Trial 41 finished with value: 0.08383563734770995 and parameters: {'vfdrc_ordered_rules': False, 'vfdrc_grace_period': 100, 'vfdrc_tie_threshold': 0.65, 'vfdrc_rule_prediction': 'weighted_max', 'vfdrc_max_rules': 30, 'vfdrc_expand_criterion': 'hellinger', 'vfdrc_remove_poor_atts': True}. Best is trial 20 with value: 0.69251.[0m
