[32m[I 2022-10-26 02:51:11,873][0m Trial 94 finished with value: 0.6950742018218817 and parameters: {'gnb_var_smoothing': 102.77939994968138}. Best is trial 0 with value: 0.695074.[0m
[32m[I 2022-10-26 02:51:11,874][0m Trial 95 finished with value: 0.6950742018218817 and parameters: {'gnb_var_smoothing': 127.56163377655287}. Best is trial 0 with value: 0.695074.[0m
[32m[I 2022-10-26 02:51:11,942][0m Trial 92 finished with value: 0.6950742018218817 and parameters: {'gnb_var_smoothing': 113.24254281342493}. Best is trial 0 with value: 0.695074.[0m
[32m[I 2022-10-26 02:51:12,359][0m Trial 97 finished with value: 0.6950742018218817 and parameters: {'gnb_var_smoothing': 81.9536712320654}. Best is trial 0 with value: 0.695074.[0m
[32m[I 2022-10-26 02:51:12,758][0m Trial 98 finished with value: 0.6950742018218817 and parameters: {'gnb_var_smoothing': 146.41567244807175}. Best is trial 0 with value: 0.695074.[0m
[32m[I 2022-10-26 02:51:13,118][0m Trial 99 finished with value: 0.6950742018218817 and parameters: {'gnb_var_smoothing': 144.71772131682872}. Best is trial 0 with value: 0.695074.[0m
[32m[I 2022-10-26 02:51:13,182][0m Study finished.[0m
[32m[I 2022-10-26 02:51:13,194][0m --------------------------------------------------------------------------------[0m
[32m[I 2022-10-26 02:51:13,195][0m --------------------     HistGradientBoostingClassifier     --------------------[0m
[32m[I 2022-10-26 02:51:13,195][0m --------------------------------------------------------------------------------[0m
[32m[I 2022-10-26 02:51:13,220][0m A new study created in RDB with name: HistGradientBoostingClassifier_c963b74b[0m
[32m[I 2022-10-26 02:51:13,226][0m Study started.[0m
[32m[I 2022-10-26 02:51:31,922][0m Trial 4 finished with value: 0.8051394638195595 and parameters: {'hgbc_learning_rate': 0.7930026903384554, 'hgbc_max_iter': 2000, 'hgbc_min_samples_leaf': 10, 'hgbc_l2_regularization': 0.4, 'hgbc_max_bins': 255, 'hgbc_early_stopping': True, 'hgbc_validation_fraction': 0.25, 'hgbc_n_iter_no_change': 10}. Best is trial 4 with value: 0.805139.[0m
[32m[I 2022-10-26 02:51:36,823][0m Trial 5 finished with value: 0.9806112949402275 and parameters: {'hgbc_learning_rate': 0.05921568482176395, 'hgbc_max_iter': 2000, 'hgbc_min_samples_leaf': 35, 'hgbc_l2_regularization': 0.0, 'hgbc_max_bins': 63, 'hgbc_early_stopping': True, 'hgbc_validation_fraction': 0.25, 'hgbc_n_iter_no_change': 10}. Best is trial 5 with value: 0.980611.[0m
[32m[I 2022-10-26 02:51:55,004][0m Trial 9 finished with value: 0.9597039803925188 and parameters: {'hgbc_learning_rate': 0.4634458919649448, 'hgbc_max_iter': 2000, 'hgbc_min_samples_leaf': 26, 'hgbc_l2_regularization': 0.6000000000000001, 'hgbc_max_bins': 127, 'hgbc_early_stopping': True, 'hgbc_validation_fraction': 0.25, 'hgbc_n_iter_no_change': 10}. Best is trial 5 with value: 0.980611.[0m
[32m[I 2022-10-26 02:52:12,871][0m Trial 10 finished with value: 0.9717749700365327 and parameters: {'hgbc_learning_rate': 0.16002154093394982, 'hgbc_max_iter': 2000, 'hgbc_min_samples_leaf': 45, 'hgbc_l2_regularization': 0.6000000000000001, 'hgbc_max_bins': 63, 'hgbc_early_stopping': True, 'hgbc_validation_fraction': 0.25, 'hgbc_n_iter_no_change': 10}. Best is trial 5 with value: 0.980611.[0m
[32m[I 2022-10-26 03:03:38,875][0m Trial 0 finished with value: 0.995429526074902 and parameters: {'hgbc_learning_rate': 0.026708434351031353, 'hgbc_max_iter': 2000, 'hgbc_min_samples_leaf': 14, 'hgbc_l2_regularization': 0.6000000000000001, 'hgbc_max_bins': 127, 'hgbc_early_stopping': True, 'hgbc_validation_fraction': 0.25, 'hgbc_n_iter_no_change': 10}. Best is trial 0 with value: 0.99543.[0m
[32m[I 2022-10-26 03:04:21,205][0m Trial 12 finished with value: 0.9642675578709675 and parameters: {'hgbc_learning_rate': 0.017322429066902314, 'hgbc_max_iter': 2000, 'hgbc_min_samples_leaf': 5, 'hgbc_l2_regularization': 0.0, 'hgbc_max_bins': 63, 'hgbc_early_stopping': True, 'hgbc_validation_fraction': 0.25, 'hgbc_n_iter_no_change': 10}. Best is trial 0 with value: 0.99543.[0m
[32m[I 2022-10-26 03:04:38,704][0m Trial 13 finished with value: 0.9927467774129217 and parameters: {'hgbc_learning_rate': 0.25713033926466394, 'hgbc_max_iter': 2000, 'hgbc_min_samples_leaf': 44, 'hgbc_l2_regularization': 0.8, 'hgbc_max_bins': 127, 'hgbc_early_stopping': True, 'hgbc_validation_fraction': 0.25, 'hgbc_n_iter_no_change': 10}. Best is trial 0 with value: 0.99543.[0m
[32m[I 2022-10-26 03:05:11,666][0m Trial 14 finished with value: 0.9936427866876171 and parameters: {'hgbc_learning_rate': 0.1601637653781117, 'hgbc_max_iter': 2000, 'hgbc_min_samples_leaf': 4, 'hgbc_l2_regularization': 1.0, 'hgbc_max_bins': 127, 'hgbc_early_stopping': True, 'hgbc_validation_fraction': 0.25, 'hgbc_n_iter_no_change': 10}. Best is trial 0 with value: 0.99543.[0m
[32m[I 2022-10-26 03:05:32,745][0m Trial 15 finished with value: 0.9934796763841531 and parameters: {'hgbc_learning_rate': 0.06464988474534876, 'hgbc_max_iter': 2000, 'hgbc_min_samples_leaf': 39, 'hgbc_l2_regularization': 0.0, 'hgbc_max_bins': 255, 'hgbc_early_stopping': True, 'hgbc_validation_fraction': 0.25, 'hgbc_n_iter_no_change': 10}. Best is trial 0 with value: 0.99543.[0m
[32m[I 2022-10-26 03:33:27,969][0m Trial 8 finished with value: 0.9963002922761309 and parameters: {'hgbc_learning_rate': 0.0020268283380334836, 'hgbc_max_iter': 2000, 'hgbc_min_samples_leaf': 47, 'hgbc_l2_regularization': 1.0, 'hgbc_max_bins': 255, 'hgbc_early_stopping': True, 'hgbc_validation_fraction': 0.25, 'hgbc_n_iter_no_change': 10}. Best is trial 8 with value: 0.9963.[0m
[32m[I 2022-10-26 03:34:57,725][0m Trial 1 finished with value: 0.9962774675788478 and parameters: {'hgbc_learning_rate': 0.001629825536068277, 'hgbc_max_iter': 2000, 'hgbc_min_samples_leaf': 20, 'hgbc_l2_regularization': 0.6000000000000001, 'hgbc_max_bins': 255, 'hgbc_early_stopping': True, 'hgbc_validation_fraction': 0.25, 'hgbc_n_iter_no_change': 10}. Best is trial 8 with value: 0.9963.[0m
[32m[I 2022-10-26 03:36:12,158][0m Trial 11 finished with value: 0.9963695828311645 and parameters: {'hgbc_learning_rate': 0.0032500417278317753, 'hgbc_max_iter': 2000, 'hgbc_min_samples_leaf': 34, 'hgbc_l2_regularization': 0.8, 'hgbc_max_bins': 255, 'hgbc_early_stopping': True, 'hgbc_validation_fraction': 0.25, 'hgbc_n_iter_no_change': 10}. Best is trial 11 with value: 0.99637.[0m
[32m[I 2022-10-26 03:37:03,448][0m Trial 7 finished with value: 0.9832364372797783 and parameters: {'hgbc_learning_rate': 0.0014887200178829339, 'hgbc_max_iter': 2000, 'hgbc_min_samples_leaf': 34, 'hgbc_l2_regularization': 1.0, 'hgbc_max_bins': 63, 'hgbc_early_stopping': True, 'hgbc_validation_fraction': 0.25, 'hgbc_n_iter_no_change': 10}. Best is trial 11 with value: 0.99637.[0m
[32m[I 2022-10-26 03:38:33,707][0m Trial 3 finished with value: 0.9835031940847111 and parameters: {'hgbc_learning_rate': 0.003723747514020587, 'hgbc_max_iter': 2000, 'hgbc_min_samples_leaf': 28, 'hgbc_l2_regularization': 0.8, 'hgbc_max_bins': 63, 'hgbc_early_stopping': True, 'hgbc_validation_fraction': 0.25, 'hgbc_n_iter_no_change': 10}. Best is trial 11 with value: 0.99637.[0m
[32m[I 2022-10-26 03:39:12,836][0m Trial 2 finished with value: 0.9954270957503605 and parameters: {'hgbc_learning_rate': 0.004364394258575051, 'hgbc_max_iter': 2000, 'hgbc_min_samples_leaf': 23, 'hgbc_l2_regularization': 0.2, 'hgbc_max_bins': 127, 'hgbc_early_stopping': True, 'hgbc_validation_fraction': 0.25, 'hgbc_n_iter_no_change': 10}. Best is trial 11 with value: 0.99637.[0m
[32m[I 2022-10-26 03:48:46,570][0m Trial 6 finished with value: 0.9835150627680752 and parameters: {'hgbc_learning_rate': 0.0038110748749020894, 'hgbc_max_iter': 2000, 'hgbc_min_samples_leaf': 49, 'hgbc_l2_regularization': 0.0, 'hgbc_max_bins': 63, 'hgbc_early_stopping': True, 'hgbc_validation_fraction': 0.25, 'hgbc_n_iter_no_change': 10}. Best is trial 11 with value: 0.99637.[0m
[32m[I 2022-10-26 03:53:22,899][0m Trial 16 finished with value: 0.9953820559229631 and parameters: {'hgbc_learning_rate': 0.00300825880206125, 'hgbc_max_iter': 2000, 'hgbc_min_samples_leaf': 44, 'hgbc_l2_regularization': 0.8, 'hgbc_max_bins': 127, 'hgbc_early_stopping': True, 'hgbc_validation_fraction': 0.25, 'hgbc_n_iter_no_change': 10}. Best is trial 11 with value: 0.99637.[0m
[32m[I 2022-10-26 04:15:04,324][0m Trial 22 finished with value: 0.9963896853981289 and parameters: {'hgbc_learning_rate': 0.009149356133724713, 'hgbc_max_iter': 2000, 'hgbc_min_samples_leaf': 48, 'hgbc_l2_regularization': 0.8, 'hgbc_max_bins': 255, 'hgbc_early_stopping': True, 'hgbc_validation_fraction': 0.25, 'hgbc_n_iter_no_change': 10}. Best is trial 22 with value: 0.99639.[0m
[32m[I 2022-10-26 04:18:54,399][0m Trial 21 finished with value: 0.9963897090185347 and parameters: {'hgbc_learning_rate': 0.010160109044591517, 'hgbc_max_iter': 2000, 'hgbc_min_samples_leaf': 50, 'hgbc_l2_regularization': 1.0, 'hgbc_max_bins': 255, 'hgbc_early_stopping': True, 'hgbc_validation_fraction': 0.25, 'hgbc_n_iter_no_change': 10}. Best is trial 21 with value: 0.99639.[0m
[32m[I 2022-10-26 04:20:36,371][0m Trial 19 finished with value: 0.9960946837496135 and parameters: {'hgbc_learning_rate': 0.0013917214014993583, 'hgbc_max_iter': 2000, 'hgbc_min_samples_leaf': 50, 'hgbc_l2_regularization': 1.0, 'hgbc_max_bins': 255, 'hgbc_early_stopping': True, 'hgbc_validation_fraction': 0.25, 'hgbc_n_iter_no_change': 10}. Best is trial 21 with value: 0.99639.[0m
[32m[I 2022-10-26 04:20:56,434][0m Trial 23 finished with value: 0.9963797020220914 and parameters: {'hgbc_learning_rate': 0.009738437903956057, 'hgbc_max_iter': 2000, 'hgbc_min_samples_leaf': 50, 'hgbc_l2_regularization': 0.8, 'hgbc_max_bins': 255, 'hgbc_early_stopping': True, 'hgbc_validation_fraction': 0.25, 'hgbc_n_iter_no_change': 10}. Best is trial 21 with value: 0.99639.[0m
[32m[I 2022-10-26 04:21:33,995][0m Trial 17 finished with value: 0.9961197299939618 and parameters: {'hgbc_learning_rate': 0.0012156596492051911, 'hgbc_max_iter': 2000, 'hgbc_min_samples_leaf': 26, 'hgbc_l2_regularization': 1.0, 'hgbc_max_bins': 255, 'hgbc_early_stopping': True, 'hgbc_validation_fraction': 0.25, 'hgbc_n_iter_no_change': 10}. Best is trial 21 with value: 0.99639.[0m
[32m[I 2022-10-26 04:22:32,956][0m Trial 18 finished with value: 0.996127392956836 and parameters: {'hgbc_learning_rate': 0.0011414612781192029, 'hgbc_max_iter': 2000, 'hgbc_min_samples_leaf': 22, 'hgbc_l2_regularization': 1.0, 'hgbc_max_bins': 255, 'hgbc_early_stopping': True, 'hgbc_validation_fraction': 0.25, 'hgbc_n_iter_no_change': 10}. Best is trial 21 with value: 0.99639.[0m
[32m[I 2022-10-26 04:27:03,490][0m Trial 20 finished with value: 0.9963821418205111 and parameters: {'hgbc_learning_rate': 0.005757018107116302, 'hgbc_max_iter': 2000, 'hgbc_min_samples_leaf': 50, 'hgbc_l2_regularization': 1.0, 'hgbc_max_bins': 255, 'hgbc_early_stopping': True, 'hgbc_validation_fraction': 0.25, 'hgbc_n_iter_no_change': 10}. Best is trial 21 with value: 0.99639.[0m
[32m[I 2022-10-26 04:29:14,577][0m Trial 24 finished with value: 0.9963897259060202 and parameters: {'hgbc_learning_rate': 0.010266052019254719, 'hgbc_max_iter': 2000, 'hgbc_min_samples_leaf': 50, 'hgbc_l2_regularization': 1.0, 'hgbc_max_bins': 255, 'hgbc_early_stopping': True, 'hgbc_validation_fraction': 0.25, 'hgbc_n_iter_no_change': 10}. Best is trial 24 with value: 0.99639.[0m
[32m[I 2022-10-26 04:45:20,180][0m Trial 25 finished with value: 0.9963822227033207 and parameters: {'hgbc_learning_rate': 0.0091070086938965, 'hgbc_max_iter': 2000, 'hgbc_min_samples_leaf': 38, 'hgbc_l2_regularization': 0.4, 'hgbc_max_bins': 255, 'hgbc_early_stopping': True, 'hgbc_validation_fraction': 0.25, 'hgbc_n_iter_no_change': 10}. Best is trial 24 with value: 0.99639.[0m
[32m[I 2022-10-26 04:50:46,260][0m Trial 27 finished with value: 0.9963847309461374 and parameters: {'hgbc_learning_rate': 0.009420608220104898, 'hgbc_max_iter': 2000, 'hgbc_min_samples_leaf': 40, 'hgbc_l2_regularization': 0.4, 'hgbc_max_bins': 255, 'hgbc_early_stopping': True, 'hgbc_validation_fraction': 0.25, 'hgbc_n_iter_no_change': 10}. Best is trial 24 with value: 0.99639.[0m
[32m[I 2022-10-26 04:51:32,702][0m Trial 28 finished with value: 0.9963896999962655 and parameters: {'hgbc_learning_rate': 0.010566294885042798, 'hgbc_max_iter': 2000, 'hgbc_min_samples_leaf': 40, 'hgbc_l2_regularization': 0.8, 'hgbc_max_bins': 255, 'hgbc_early_stopping': True, 'hgbc_validation_fraction': 0.25, 'hgbc_n_iter_no_change': 10}. Best is trial 24 with value: 0.99639.[0m
[32m[I 2022-10-26 04:53:19,444][0m Trial 29 finished with value: 0.9963872190495151 and parameters: {'hgbc_learning_rate': 0.009965920266526726, 'hgbc_max_iter': 2000, 'hgbc_min_samples_leaf': 40, 'hgbc_l2_regularization': 0.8, 'hgbc_max_bins': 255, 'hgbc_early_stopping': True, 'hgbc_validation_fraction': 0.25, 'hgbc_n_iter_no_change': 10}. Best is trial 24 with value: 0.99639.[0m
[32m[I 2022-10-26 04:53:36,006][0m Trial 26 finished with value: 0.9963846876158121 and parameters: {'hgbc_learning_rate': 0.010194536952708414, 'hgbc_max_iter': 2000, 'hgbc_min_samples_leaf': 39, 'hgbc_l2_regularization': 1.0, 'hgbc_max_bins': 255, 'hgbc_early_stopping': True, 'hgbc_validation_fraction': 0.25, 'hgbc_n_iter_no_change': 10}. Best is trial 24 with value: 0.99639.[0m
[32m[I 2022-10-26 04:54:18,332][0m Trial 32 finished with value: 0.9963847122032209 and parameters: {'hgbc_learning_rate': 0.012770711019934393, 'hgbc_max_iter': 2000, 'hgbc_min_samples_leaf': 38, 'hgbc_l2_regularization': 0.8, 'hgbc_max_bins': 255, 'hgbc_early_stopping': True, 'hgbc_validation_fraction': 0.25, 'hgbc_n_iter_no_change': 10}. Best is trial 24 with value: 0.99639.[0m
[32m[I 2022-10-26 04:55:42,063][0m Trial 30 finished with value: 0.9963871931491074 and parameters: {'hgbc_learning_rate': 0.00963998098298865, 'hgbc_max_iter': 2000, 'hgbc_min_samples_leaf': 39, 'hgbc_l2_regularization': 0.8, 'hgbc_max_bins': 255, 'hgbc_early_stopping': True, 'hgbc_validation_fraction': 0.25, 'hgbc_n_iter_no_change': 10}. Best is trial 24 with value: 0.99639.[0m
[32m[I 2022-10-26 05:02:02,135][0m Trial 31 finished with value: 0.9963871931491074 and parameters: {'hgbc_learning_rate': 0.008339990503664687, 'hgbc_max_iter': 2000, 'hgbc_min_samples_leaf': 39, 'hgbc_l2_regularization': 0.8, 'hgbc_max_bins': 255, 'hgbc_early_stopping': True, 'hgbc_validation_fraction': 0.25, 'hgbc_n_iter_no_change': 10}. Best is trial 24 with value: 0.99639.[0m
[32m[I 2022-10-26 05:04:43,995][0m Trial 37 finished with value: 0.9963821829668862 and parameters: {'hgbc_learning_rate': 0.025146376117499983, 'hgbc_max_iter': 2000, 'hgbc_min_samples_leaf': 31, 'hgbc_l2_regularization': 0.6000000000000001, 'hgbc_max_bins': 255, 'hgbc_early_stopping': True, 'hgbc_validation_fraction': 0.25, 'hgbc_n_iter_no_change': 10}. Best is trial 24 with value: 0.99639.[0m
[32m[I 2022-10-26 05:06:43,201][0m Trial 35 finished with value: 0.9963847122032209 and parameters: {'hgbc_learning_rate': 0.020656959915041212, 'hgbc_max_iter': 2000, 'hgbc_min_samples_leaf': 42, 'hgbc_l2_regularization': 0.8, 'hgbc_max_bins': 255, 'hgbc_early_stopping': True, 'hgbc_validation_fraction': 0.25, 'hgbc_n_iter_no_change': 10}. Best is trial 24 with value: 0.99639.[0m
[32m[I 2022-10-26 05:07:35,164][0m Trial 38 finished with value: 0.9963897259060202 and parameters: {'hgbc_learning_rate': 0.030775923154025178, 'hgbc_max_iter': 2000, 'hgbc_min_samples_leaf': 45, 'hgbc_l2_regularization': 0.6000000000000001, 'hgbc_max_bins': 255, 'hgbc_early_stopping': True, 'hgbc_validation_fraction': 0.25, 'hgbc_n_iter_no_change': 10}. Best is trial 24 with value: 0.99639.[0m
[32m[I 2022-10-26 05:08:52,115][0m Trial 33 finished with value: 0.9963872190495151 and parameters: {'hgbc_learning_rate': 0.015289036421179632, 'hgbc_max_iter': 2000, 'hgbc_min_samples_leaf': 42, 'hgbc_l2_regularization': 0.8, 'hgbc_max_bins': 255, 'hgbc_early_stopping': True, 'hgbc_validation_fraction': 0.25, 'hgbc_n_iter_no_change': 10}. Best is trial 24 with value: 0.99639.[0m
[32m[I 2022-10-26 05:09:42,844][0m Trial 39 finished with value: 0.9963897013828877 and parameters: {'hgbc_learning_rate': 0.027752699433633225, 'hgbc_max_iter': 2000, 'hgbc_min_samples_leaf': 45, 'hgbc_l2_regularization': 0.6000000000000001, 'hgbc_max_bins': 255, 'hgbc_early_stopping': True, 'hgbc_validation_fraction': 0.25, 'hgbc_n_iter_no_change': 10}. Best is trial 24 with value: 0.99639.[0m
[32m[I 2022-10-26 05:09:53,216][0m Trial 34 finished with value: 0.9963847122032209 and parameters: {'hgbc_learning_rate': 0.018178202378904832, 'hgbc_max_iter': 2000, 'hgbc_min_samples_leaf': 42, 'hgbc_l2_regularization': 0.8, 'hgbc_max_bins': 255, 'hgbc_early_stopping': True, 'hgbc_validation_fraction': 0.25, 'hgbc_n_iter_no_change': 10}. Best is trial 24 with value: 0.99639.[0m
[32m[I 2022-10-26 05:10:35,883][0m Trial 36 finished with value: 0.9963897090185347 and parameters: {'hgbc_learning_rate': 0.023606217962870622, 'hgbc_max_iter': 2000, 'hgbc_min_samples_leaf': 31, 'hgbc_l2_regularization': 0.6000000000000001, 'hgbc_max_bins': 255, 'hgbc_early_stopping': True, 'hgbc_validation_fraction': 0.25, 'hgbc_n_iter_no_change': 10}. Best is trial 24 with value: 0.99639.[0m
[32m[I 2022-10-26 05:14:07,564][0m Trial 40 finished with value: 0.9963846952520955 and parameters: {'hgbc_learning_rate': 0.025579581565273492, 'hgbc_max_iter': 2000, 'hgbc_min_samples_leaf': 46, 'hgbc_l2_regularization': 0.6000000000000001, 'hgbc_max_bins': 255, 'hgbc_early_stopping': True, 'hgbc_validation_fraction': 0.25, 'hgbc_n_iter_no_change': 10}. Best is trial 24 with value: 0.99639.[0m
[32m[I 2022-10-26 05:14:52,359][0m Trial 41 finished with value: 0.9963872118630226 and parameters: {'hgbc_learning_rate': 0.039100655302135086, 'hgbc_max_iter': 2000, 'hgbc_min_samples_leaf': 46, 'hgbc_l2_regularization': 0.6000000000000001, 'hgbc_max_bins': 255, 'hgbc_early_stopping': True, 'hgbc_validation_fraction': 0.25, 'hgbc_n_iter_no_change': 10}. Best is trial 24 with value: 0.99639.[0m
[32m[I 2022-10-26 05:15:29,118][0m Trial 49 finished with value: 0.983096581416516 and parameters: {'hgbc_learning_rate': 0.0648269715681411, 'hgbc_max_iter': 2000, 'hgbc_min_samples_leaf': 16, 'hgbc_l2_regularization': 0.2, 'hgbc_max_bins': 63, 'hgbc_early_stopping': True, 'hgbc_validation_fraction': 0.25, 'hgbc_n_iter_no_change': 10}. Best is trial 24 with value: 0.99639.[0m
[32m[I 2022-10-26 05:15:49,379][0m Trial 46 finished with value: 0.9954295576585046 and parameters: {'hgbc_learning_rate': 0.04918313381981109, 'hgbc_max_iter': 2000, 'hgbc_min_samples_leaf': 46, 'hgbc_l2_regularization': 0.2, 'hgbc_max_bins': 127, 'hgbc_early_stopping': True, 'hgbc_validation_fraction': 0.25, 'hgbc_n_iter_no_change': 10}. Best is trial 24 with value: 0.99639.[0m
[32m[I 2022-10-26 05:16:29,813][0m Trial 47 finished with value: 0.995427368783841 and parameters: {'hgbc_learning_rate': 0.04513773000084352, 'hgbc_max_iter': 2000, 'hgbc_min_samples_leaf': 19, 'hgbc_l2_regularization': 0.2, 'hgbc_max_bins': 127, 'hgbc_early_stopping': True, 'hgbc_validation_fraction': 0.25, 'hgbc_n_iter_no_change': 10}. Best is trial 24 with value: 0.99639.[0m
[32m[I 2022-10-26 05:16:39,865][0m Trial 45 finished with value: 0.9963847072882928 and parameters: {'hgbc_learning_rate': 0.046361266907940596, 'hgbc_max_iter': 2000, 'hgbc_min_samples_leaf': 47, 'hgbc_l2_regularization': 0.2, 'hgbc_max_bins': 255, 'hgbc_early_stopping': True, 'hgbc_validation_fraction': 0.25, 'hgbc_n_iter_no_change': 10}. Best is trial 24 with value: 0.99639.[0m
[32m[I 2022-10-26 05:17:16,841][0m Trial 44 finished with value: 0.9963822446261772 and parameters: {'hgbc_learning_rate': 0.04096031097237757, 'hgbc_max_iter': 2000, 'hgbc_min_samples_leaf': 46, 'hgbc_l2_regularization': 0.6000000000000001, 'hgbc_max_bins': 255, 'hgbc_early_stopping': True, 'hgbc_validation_fraction': 0.25, 'hgbc_n_iter_no_change': 10}. Best is trial 24 with value: 0.99639.[0m
[32m[I 2022-10-26 05:17:44,194][0m Trial 42 finished with value: 0.9963847214351376 and parameters: {'hgbc_learning_rate': 0.034514496530009424, 'hgbc_max_iter': 2000, 'hgbc_min_samples_leaf': 46, 'hgbc_l2_regularization': 0.6000000000000001, 'hgbc_max_bins': 255, 'hgbc_early_stopping': True, 'hgbc_validation_fraction': 0.25, 'hgbc_n_iter_no_change': 10}. Best is trial 24 with value: 0.99639.[0m
[32m[I 2022-10-26 05:18:16,054][0m Trial 43 finished with value: 0.9963971946577517 and parameters: {'hgbc_learning_rate': 0.04213238319827253, 'hgbc_max_iter': 2000, 'hgbc_min_samples_leaf': 17, 'hgbc_l2_regularization': 0.6000000000000001, 'hgbc_max_bins': 255, 'hgbc_early_stopping': True, 'hgbc_validation_fraction': 0.25, 'hgbc_n_iter_no_change': 10}. Best is trial 43 with value: 0.996397.[0m
[32m[I 2022-10-26 05:19:09,585][0m Trial 56 finished with value: 0.9832075460223875 and parameters: {'hgbc_learning_rate': 0.09292560997748914, 'hgbc_max_iter': 2000, 'hgbc_min_samples_leaf': 13, 'hgbc_l2_regularization': 0.4, 'hgbc_max_bins': 63, 'hgbc_early_stopping': True, 'hgbc_validation_fraction': 0.25, 'hgbc_n_iter_no_change': 10}. Best is trial 43 with value: 0.996397.[0m
[32m[I 2022-10-26 05:21:23,530][0m Trial 50 finished with value: 0.9963947698398272 and parameters: {'hgbc_learning_rate': 0.052028172468296725, 'hgbc_max_iter': 2000, 'hgbc_min_samples_leaf': 29, 'hgbc_l2_regularization': 0.4, 'hgbc_max_bins': 255, 'hgbc_early_stopping': True, 'hgbc_validation_fraction': 0.25, 'hgbc_n_iter_no_change': 10}. Best is trial 43 with value: 0.996397.[0m
[32m[I 2022-10-26 05:21:26,116][0m Trial 48 finished with value: 0.9963847309461374 and parameters: {'hgbc_learning_rate': 0.04582722989562762, 'hgbc_max_iter': 2000, 'hgbc_min_samples_leaf': 20, 'hgbc_l2_regularization': 0.4, 'hgbc_max_bins': 255, 'hgbc_early_stopping': True, 'hgbc_validation_fraction': 0.25, 'hgbc_n_iter_no_change': 10}. Best is trial 43 with value: 0.996397.[0m
