[32m[I 2022-10-26 21:54:48,094][0m Trial 97 finished with value: 0.7132425463628324 and parameters: {'p_penalty': 'elasticnet', 'p_alpha': 1.5204747665270214e-06, 'p_eta0': 1.5, 'p_early_stopping': True, 'p_validation_fraction': 0.25, 'p_n_iter_no_change': 10}. Best is trial 32 with value: 0.76808.[0m
[32m[I 2022-10-26 21:54:48,486][0m Trial 98 finished with value: 0.13020475309857063 and parameters: {'p_penalty': 'elasticnet', 'p_alpha': 2.6754281266856914e-06, 'p_eta0': 1.5, 'p_early_stopping': True, 'p_validation_fraction': 0.25, 'p_n_iter_no_change': 10}. Best is trial 32 with value: 0.76808.[0m
[32m[I 2022-10-26 21:54:54,222][0m Trial 99 finished with value: 0.42712941639272933 and parameters: {'p_penalty': 'elasticnet', 'p_alpha': 3.0977466298244507e-06, 'p_eta0': 1.5, 'p_early_stopping': True, 'p_validation_fraction': 0.25, 'p_n_iter_no_change': 10}. Best is trial 32 with value: 0.76808.[0m
[32m[I 2022-10-26 21:54:54,292][0m Study finished.[0m
[32m[I 2022-10-26 21:54:54,308][0m --------------------------------------------------------------------------------[0m
[32m[I 2022-10-26 21:54:54,309][0m --------------------     QuadraticDiscriminantAnalysis      --------------------[0m
[32m[I 2022-10-26 21:54:54,309][0m --------------------------------------------------------------------------------[0m
[32m[I 2022-10-26 21:54:54,361][0m A new study created in RDB with name: QuadraticDiscriminantAnalysis_c963b74b[0m
[32m[I 2022-10-26 21:54:54,371][0m Study started.[0m
[32m[I 2022-10-26 21:54:58,979][0m Trial 2 finished with value: 0.6953961406851846 and parameters: {'qda_reg_param': 0.15000000000000002, 'qda_tol': 1.079191828552502e-06}. Best is trial 5 with value: 0.706458.[0m
[32m[I 2022-10-26 21:54:58,986][0m Trial 7 finished with value: 0.6999850143797616 and parameters: {'qda_reg_param': 0.55, 'qda_tol': 1.3708847181033636e-05}. Best is trial 5 with value: 0.706458.[0m
[32m[I 2022-10-26 21:54:58,989][0m Trial 6 finished with value: 0.6969634103200527 and parameters: {'qda_reg_param': 0.8, 'qda_tol': 0.0007635802358976699}. Best is trial 5 with value: 0.706458.[0m
[32m[I 2022-10-26 21:54:58,989][0m Trial 3 finished with value: 0.690404344900762 and parameters: {'qda_reg_param': 0.30000000000000004, 'qda_tol': 6.661423474177608e-06}. Best is trial 5 with value: 0.706458.[0m
[32m[I 2022-10-26 21:54:59,060][0m Trial 5 finished with value: 0.7064578820031926 and parameters: {'qda_reg_param': 0.35000000000000003, 'qda_tol': 2.5086828052981703e-05}. Best is trial 5 with value: 0.706458.[0m
[32m[I 2022-10-26 21:54:59,062][0m Trial 4 finished with value: 0.6930092936118972 and parameters: {'qda_reg_param': 0.2, 'qda_tol': 0.0007477169700732628}. Best is trial 5 with value: 0.706458.[0m
[32m[I 2022-10-26 21:54:59,063][0m Trial 0 finished with value: 0.6930092936118972 and parameters: {'qda_reg_param': 0.2, 'qda_tol': 1.1004908725181353e-05}. Best is trial 5 with value: 0.706458.[0m
[32m[I 2022-10-26 21:54:59,064][0m Trial 1 finished with value: 0.7039070102441788 and parameters: {'qda_reg_param': 0.5, 'qda_tol': 0.00023096052697258015}. Best is trial 5 with value: 0.706458.[0m
[32m[I 2022-10-26 21:55:03,967][0m Trial 15 finished with value: 0.044843378911844006 and parameters: {'qda_reg_param': 0.1, 'qda_tol': 4.6053160027867395e-06}. Best is trial 5 with value: 0.706458.[0m
[32m[I 2022-10-26 21:55:03,969][0m Trial 9 finished with value: 0.6999850143797616 and parameters: {'qda_reg_param': 0.55, 'qda_tol': 1.0885783745144234e-06}. Best is trial 5 with value: 0.706458.[0m
[32m[I 2022-10-26 21:55:03,975][0m Trial 12 finished with value: 0.6966971921848978 and parameters: {'qda_reg_param': 0.8500000000000001, 'qda_tol': 0.00015564948555066472}. Best is trial 5 with value: 0.706458.[0m
[32m[I 2022-10-26 21:55:04,217][0m Trial 8 finished with value: 0.7047050208726613 and parameters: {'qda_reg_param': 0.45, 'qda_tol': 0.00018556127404461973}. Best is trial 5 with value: 0.706458.[0m
[32m[I 2022-10-26 21:55:04,218][0m Trial 13 finished with value: 0.7047050208726613 and parameters: {'qda_reg_param': 0.45, 'qda_tol': 7.414716892180301e-05}. Best is trial 5 with value: 0.706458.[0m
[32m[I 2022-10-26 21:55:04,220][0m Trial 11 finished with value: 0.6915449757313482 and parameters: {'qda_reg_param': 0.25, 'qda_tol': 0.0004608655883102245}. Best is trial 5 with value: 0.706458.[0m
[32m[I 2022-10-26 21:55:04,221][0m Trial 10 finished with value: 0.6991119378167865 and parameters: {'qda_reg_param': 0.6000000000000001, 'qda_tol': 4.501372248318282e-06}. Best is trial 5 with value: 0.706458.[0m
[32m[I 2022-10-26 21:55:04,221][0m Trial 14 finished with value: 0.6966971921848978 and parameters: {'qda_reg_param': 0.8500000000000001, 'qda_tol': 0.0007280713195398075}. Best is trial 5 with value: 0.706458.[0m
[32m[I 2022-10-26 21:55:08,878][0m Trial 17 finished with value: 0.7064578820031926 and parameters: {'qda_reg_param': 0.35000000000000003, 'qda_tol': 3.5395925594969006e-05}. Best is trial 5 with value: 0.706458.[0m
[32m[I 2022-10-26 21:55:09,161][0m Trial 21 finished with value: 0.11573887834229303 and parameters: {'qda_reg_param': 0.0, 'qda_tol': 4.391020274258177e-05}. Best is trial 5 with value: 0.706458.[0m
[32m[I 2022-10-26 21:55:09,268][0m Trial 18 finished with value: 0.11573887834229303 and parameters: {'qda_reg_param': 0.0, 'qda_tol': 3.593178064353748e-05}. Best is trial 5 with value: 0.706458.[0m
[32m[I 2022-10-26 21:55:09,271][0m Trial 16 finished with value: 0.11573887834229303 and parameters: {'qda_reg_param': 0.0, 'qda_tol': 4.548978267722027e-05}. Best is trial 5 with value: 0.706458.[0m
[32m[I 2022-10-26 21:55:09,369][0m Trial 23 finished with value: 0.7064578820031926 and parameters: {'qda_reg_param': 0.35000000000000003, 'qda_tol': 4.06925126743088e-05}. Best is trial 5 with value: 0.706458.[0m
[32m[I 2022-10-26 21:55:09,370][0m Trial 22 finished with value: 0.11573887834229303 and parameters: {'qda_reg_param': 0.0, 'qda_tol': 4.1220380799571965e-05}. Best is trial 5 with value: 0.706458.[0m
[32m[I 2022-10-26 21:55:09,616][0m Trial 19 finished with value: 0.7055881487675915 and parameters: {'qda_reg_param': 0.4, 'qda_tol': 4.623193844561783e-05}. Best is trial 5 with value: 0.706458.[0m
[32m[I 2022-10-26 21:55:09,718][0m Trial 20 finished with value: 0.11573887834229303 and parameters: {'qda_reg_param': 0.0, 'qda_tol': 4.765600913527829e-05}. Best is trial 5 with value: 0.706458.[0m
[32m[I 2022-10-26 21:55:14,227][0m Trial 27 finished with value: 0.7064578820031926 and parameters: {'qda_reg_param': 0.35000000000000003, 'qda_tol': 1.7151948550555907e-05}. Best is trial 5 with value: 0.706458.[0m
[32m[I 2022-10-26 21:55:14,329][0m Trial 24 finished with value: 0.6974882073157657 and parameters: {'qda_reg_param': 0.7000000000000001, 'qda_tol': 1.9157649198173534e-05}. Best is trial 5 with value: 0.706458.[0m
[32m[I 2022-10-26 21:55:14,330][0m Trial 29 finished with value: 0.7064578820031926 and parameters: {'qda_reg_param': 0.35000000000000003, 'qda_tol': 1.8025795252531705e-05}. Best is trial 5 with value: 0.706458.[0m
[32m[I 2022-10-26 21:55:14,333][0m Trial 31 finished with value: 0.7064578820031926 and parameters: {'qda_reg_param': 0.35000000000000003, 'qda_tol': 1.8238550216712267e-05}. Best is trial 5 with value: 0.706458.[0m
[32m[I 2022-10-26 21:55:14,406][0m Trial 25 finished with value: 0.7064578820031926 and parameters: {'qda_reg_param': 0.35000000000000003, 'qda_tol': 1.4228392543024654e-05}. Best is trial 5 with value: 0.706458.[0m
[32m[I 2022-10-26 21:55:14,409][0m Trial 30 finished with value: 0.698244139233112 and parameters: {'qda_reg_param': 0.65, 'qda_tol': 1.6844019744858905e-05}. Best is trial 5 with value: 0.706458.[0m
[32m[I 2022-10-26 21:55:14,410][0m Trial 28 finished with value: 0.7064578820031926 and parameters: {'qda_reg_param': 0.35000000000000003, 'qda_tol': 2.0491270573933455e-05}. Best is trial 5 with value: 0.706458.[0m
[32m[I 2022-10-26 21:55:14,776][0m Trial 26 finished with value: 0.7064578820031926 and parameters: {'qda_reg_param': 0.35000000000000003, 'qda_tol': 1.8124584704664953e-05}. Best is trial 5 with value: 0.706458.[0m
[32m[I 2022-10-26 21:55:19,336][0m Trial 32 finished with value: 0.6915449757313482 and parameters: {'qda_reg_param': 0.25, 'qda_tol': 6.645748783309677e-06}. Best is trial 5 with value: 0.708021.[0m
[32m[I 2022-10-26 21:55:19,337][0m Trial 38 finished with value: 0.6915449757313482 and parameters: {'qda_reg_param': 0.25, 'qda_tol': 8.061500837836416e-06}. Best is trial 5 with value: 0.708021.[0m
[32m[I 2022-10-26 21:55:19,509][0m Trial 35 finished with value: 0.6915449757313482 and parameters: {'qda_reg_param': 0.25, 'qda_tol': 8.588805380799715e-05}. Best is trial 34 with value: 0.708021.[0m
[32m[I 2022-10-26 21:55:19,596][0m Trial 33 finished with value: 0.6915449757313482 and parameters: {'qda_reg_param': 0.25, 'qda_tol': 9.252965022323526e-06}. Best is trial 34 with value: 0.708021.[0m
[32m[I 2022-10-26 21:55:19,600][0m Trial 39 finished with value: 0.6915449757313482 and parameters: {'qda_reg_param': 0.25, 'qda_tol': 8.859629260013734e-06}. Best is trial 34 with value: 0.708021.[0m
[32m[I 2022-10-26 21:55:19,677][0m Trial 36 finished with value: 0.6915449757313482 and parameters: {'qda_reg_param': 0.25, 'qda_tol': 8.390765352872224e-06}. Best is trial 34 with value: 0.708021.[0m
[32m[I 2022-10-26 21:55:19,681][0m Trial 37 finished with value: 0.6915449757313482 and parameters: {'qda_reg_param': 0.25, 'qda_tol': 9.898836945447602e-06}. Best is trial 34 with value: 0.708021.[0m
[32m[I 2022-10-26 21:55:19,754][0m Trial 34 finished with value: 0.7080206915862601 and parameters: {'qda_reg_param': 1.0, 'qda_tol': 8.665008425614e-06}. Best is trial 34 with value: 0.708021.[0m
[32m[I 2022-10-26 21:55:24,528][0m Trial 43 finished with value: 0.6953961406851846 and parameters: {'qda_reg_param': 0.15000000000000002, 'qda_tol': 1.9156396906105995e-06}. Best is trial 46 with value: 0.708021.[0m
[32m[I 2022-10-26 21:55:24,531][0m Trial 44 finished with value: 0.7080206915862601 and parameters: {'qda_reg_param': 1.0, 'qda_tol': 8.185835815703544e-05}. Best is trial 46 with value: 0.708021.[0m
[32m[I 2022-10-26 21:55:24,691][0m Trial 46 finished with value: 0.7080206915862601 and parameters: {'qda_reg_param': 1.0, 'qda_tol': 3.2776748064027365e-06}. Best is trial 46 with value: 0.708021.[0m
[32m[I 2022-10-26 21:55:24,694][0m Trial 40 finished with value: 0.6960743683825104 and parameters: {'qda_reg_param': 0.9500000000000001, 'qda_tol': 1.8585918923343911e-06}. Best is trial 46 with value: 0.708021.[0m
[32m[I 2022-10-26 21:55:24,779][0m Trial 41 finished with value: 0.7080206915862601 and parameters: {'qda_reg_param': 1.0, 'qda_tol': 1.56758709462083e-06}. Best is trial 46 with value: 0.708021.[0m
[32m[I 2022-10-26 21:55:24,944][0m Trial 42 finished with value: 0.7080206915862601 and parameters: {'qda_reg_param': 1.0, 'qda_tol': 2.637740688423172e-06}. Best is trial 47 with value: 0.708021.[0m
[32m[I 2022-10-26 21:55:24,944][0m Trial 47 finished with value: 0.7080206915862601 and parameters: {'qda_reg_param': 1.0, 'qda_tol': 3.3204986558342763e-06}. Best is trial 47 with value: 0.708021.[0m
[32m[I 2022-10-26 21:55:24,946][0m Trial 45 finished with value: 0.7080206915862601 and parameters: {'qda_reg_param': 1.0, 'qda_tol': 2.4023642685666367e-06}. Best is trial 46 with value: 0.708021.[0m
[32m[I 2022-10-26 21:55:29,691][0m Trial 51 finished with value: 0.6964237090495516 and parameters: {'qda_reg_param': 0.9, 'qda_tol': 1.5239325981202666e-06}. Best is trial 34 with value: 0.708021.[0m
[32m[I 2022-10-26 21:55:29,693][0m Trial 48 finished with value: 0.6964237090495516 and parameters: {'qda_reg_param': 0.9, 'qda_tol': 1.8644259820241317e-06}. Best is trial 34 with value: 0.708021.[0m
[32m[I 2022-10-26 21:55:29,698][0m Trial 55 finished with value: 0.6964237090495516 and parameters: {'qda_reg_param': 0.9, 'qda_tol': 1.5526569031802205e-06}. Best is trial 34 with value: 0.708021.[0m
[32m[I 2022-10-26 21:55:29,699][0m Trial 54 finished with value: 0.6964237090495516 and parameters: {'qda_reg_param': 0.9, 'qda_tol': 1.3804849956235643e-06}. Best is trial 34 with value: 0.708021.[0m
[32m[I 2022-10-26 21:55:29,699][0m Trial 49 finished with value: 0.6964237090495516 and parameters: {'qda_reg_param': 0.9, 'qda_tol': 1.5080595314586163e-06}. Best is trial 34 with value: 0.708021.[0m
[32m[I 2022-10-26 21:55:29,846][0m Trial 52 finished with value: 0.6964237090495516 and parameters: {'qda_reg_param': 0.9, 'qda_tol': 1.4683399746312068e-06}. Best is trial 34 with value: 0.708021.[0m
[32m[I 2022-10-26 21:55:30,126][0m Trial 50 finished with value: 0.6964237090495516 and parameters: {'qda_reg_param': 0.9, 'qda_tol': 1.5756878343113375e-06}. Best is trial 34 with value: 0.708021.[0m
[32m[I 2022-10-26 21:55:30,127][0m Trial 53 finished with value: 0.6964237090495516 and parameters: {'qda_reg_param': 0.9, 'qda_tol': 1.6224541749904326e-06}. Best is trial 34 with value: 0.708021.[0m
[32m[I 2022-10-26 21:55:34,788][0m Trial 56 finished with value: 0.7080206915862601 and parameters: {'qda_reg_param': 1.0, 'qda_tol': 2.961174165013673e-06}. Best is trial 60 with value: 0.708021.[0m
[32m[I 2022-10-26 21:55:34,884][0m Trial 60 finished with value: 0.7080206915862601 and parameters: {'qda_reg_param': 1.0, 'qda_tol': 2.6284265586963133e-06}. Best is trial 63 with value: 0.708021.[0m
[32m[I 2022-10-26 21:55:34,891][0m Trial 63 finished with value: 0.7080206915862601 and parameters: {'qda_reg_param': 1.0, 'qda_tol': 2.8571020781569813e-06}. Best is trial 63 with value: 0.708021.[0m
[32m[I 2022-10-26 21:55:35,053][0m Trial 59 finished with value: 0.7080206915862601 and parameters: {'qda_reg_param': 1.0, 'qda_tol': 2.7471674700067683e-06}. Best is trial 63 with value: 0.708021.[0m
[32m[I 2022-10-26 21:55:35,054][0m Trial 58 finished with value: 0.7080206915862601 and parameters: {'qda_reg_param': 1.0, 'qda_tol': 3.868504338554805e-06}. Best is trial 63 with value: 0.708021.[0m
[32m[I 2022-10-26 21:55:35,197][0m Trial 62 finished with value: 0.7080206915862601 and parameters: {'qda_reg_param': 1.0, 'qda_tol': 2.9006884154561917e-06}. Best is trial 63 with value: 0.708021.[0m
[32m[I 2022-10-26 21:55:35,279][0m Trial 57 finished with value: 0.7080206915862601 and parameters: {'qda_reg_param': 1.0, 'qda_tol': 2.9431142209503347e-06}. Best is trial 63 with value: 0.708021.[0m
[32m[I 2022-10-26 21:55:35,280][0m Trial 61 finished with value: 0.7080206915862601 and parameters: {'qda_reg_param': 1.0, 'qda_tol': 2.801897748815202e-06}. Best is trial 63 with value: 0.708021.[0m
[32m[I 2022-10-26 21:55:39,647][0m Trial 64 finished with value: 0.6972222782532743 and parameters: {'qda_reg_param': 0.75, 'qda_tol': 4.481345550602748e-06}. Best is trial 34 with value: 0.708021.[0m
[32m[I 2022-10-26 21:55:39,936][0m Trial 69 finished with value: 0.6969634103200527 and parameters: {'qda_reg_param': 0.8, 'qda_tol': 5.717389684976929e-06}. Best is trial 34 with value: 0.708021.[0m
[32m[I 2022-10-26 21:55:40,023][0m Trial 67 finished with value: 0.6969634103200527 and parameters: {'qda_reg_param': 0.8, 'qda_tol': 1.0699109832399946e-06}. Best is trial 34 with value: 0.708021.[0m
[32m[I 2022-10-26 21:55:40,106][0m Trial 65 finished with value: 0.6969634103200527 and parameters: {'qda_reg_param': 0.8, 'qda_tol': 5.217369211276234e-06}. Best is trial 34 with value: 0.708021.[0m
[32m[I 2022-10-26 21:55:40,107][0m Trial 68 finished with value: 0.6972222782532743 and parameters: {'qda_reg_param': 0.75, 'qda_tol': 5.7657739756806884e-06}. Best is trial 34 with value: 0.708021.[0m
[32m[I 2022-10-26 21:55:40,262][0m Trial 66 finished with value: 0.6969634103200527 and parameters: {'qda_reg_param': 0.8, 'qda_tol': 5.277007339779336e-06}. Best is trial 34 with value: 0.708021.[0m
[32m[I 2022-10-26 21:55:40,265][0m Trial 70 finished with value: 0.6969634103200527 and parameters: {'qda_reg_param': 0.8, 'qda_tol': 5.4817019562487425e-06}. Best is trial 34 with value: 0.708021.[0m
[32m[I 2022-10-26 21:55:40,432][0m Trial 71 finished with value: 0.6969634103200527 and parameters: {'qda_reg_param': 0.8, 'qda_tol': 5.3148947953219695e-06}. Best is trial 34 with value: 0.708021.[0m
[32m[I 2022-10-26 21:55:44,571][0m Trial 72 finished with value: 0.6960743683825104 and parameters: {'qda_reg_param': 0.9500000000000001, 'qda_tol': 0.0002700592900641053}. Best is trial 34 with value: 0.708021.[0m
[32m[I 2022-10-26 21:55:45,000][0m Trial 74 finished with value: 0.6960743683825104 and parameters: {'qda_reg_param': 0.9500000000000001, 'qda_tol': 2.3412114992667777e-06}. Best is trial 34 with value: 0.708021.[0m
[32m[I 2022-10-26 21:55:45,106][0m Trial 78 finished with value: 0.6960743683825104 and parameters: {'qda_reg_param': 0.9500000000000001, 'qda_tol': 7.047618241060196e-05}. Best is trial 34 with value: 0.708021.[0m
[32m[I 2022-10-26 21:55:45,107][0m Trial 76 finished with value: 0.6960743683825104 and parameters: {'qda_reg_param': 0.9500000000000001, 'qda_tol': 9.864278051572334e-05}. Best is trial 34 with value: 0.708021.[0m
[32m[I 2022-10-26 21:55:45,336][0m Trial 75 finished with value: 0.6960743683825104 and parameters: {'qda_reg_param': 0.9500000000000001, 'qda_tol': 2.301932978527467e-06}. Best is trial 34 with value: 0.708021.[0m
[32m[I 2022-10-26 21:55:45,338][0m Trial 77 finished with value: 0.6960743683825104 and parameters: {'qda_reg_param': 0.9500000000000001, 'qda_tol': 0.00014041170784565913}. Best is trial 34 with value: 0.708021.[0m
[32m[I 2022-10-26 21:55:45,339][0m Trial 73 finished with value: 0.6960743683825104 and parameters: {'qda_reg_param': 0.9500000000000001, 'qda_tol': 2.242876218461308e-06}. Best is trial 34 with value: 0.708021.[0m
[32m[I 2022-10-26 21:55:45,419][0m Trial 79 finished with value: 0.6960743683825104 and parameters: {'qda_reg_param': 0.9500000000000001, 'qda_tol': 2.2441598879290964e-06}. Best is trial 34 with value: 0.708021.[0m
[32m[I 2022-10-26 21:55:49,066][0m Trial 80 finished with value: 0.6960743683825104 and parameters: {'qda_reg_param': 0.9500000000000001, 'qda_tol': 3.608633462600527e-06}. Best is trial 34 with value: 0.708021.[0m
[32m[I 2022-10-26 21:55:50,294][0m Trial 81 finished with value: 0.6966971921848978 and parameters: {'qda_reg_param': 0.8500000000000001, 'qda_tol': 3.840361851814308e-06}. Best is trial 34 with value: 0.708021.[0m
[32m[I 2022-10-26 21:55:50,421][0m Trial 87 finished with value: 0.6966971921848978 and parameters: {'qda_reg_param': 0.8500000000000001, 'qda_tol': 4.067350313719675e-06}. Best is trial 34 with value: 0.708021.[0m
[32m[I 2022-10-26 21:55:50,425][0m Trial 83 finished with value: 0.6966971921848978 and parameters: {'qda_reg_param': 0.8500000000000001, 'qda_tol': 1.1950653560250083e-06}. Best is trial 34 with value: 0.708021.[0m
[32m[I 2022-10-26 21:55:50,573][0m Trial 84 finished with value: 0.6966971921848978 and parameters: {'qda_reg_param': 0.8500000000000001, 'qda_tol': 3.80307411291142e-06}. Best is trial 34 with value: 0.708021.[0m
[32m[I 2022-10-26 21:55:50,652][0m Trial 86 finished with value: 0.6966971921848978 and parameters: {'qda_reg_param': 0.8500000000000001, 'qda_tol': 3.5727061003919202e-06}. Best is trial 34 with value: 0.708021.[0m
[32m[I 2022-10-26 21:55:50,733][0m Trial 82 finished with value: 0.6966971921848978 and parameters: {'qda_reg_param': 0.8500000000000001, 'qda_tol': 2.656520181326739e-05}. Best is trial 34 with value: 0.708021.[0m
[32m[I 2022-10-26 21:55:50,808][0m Trial 85 finished with value: 0.6966971921848978 and parameters: {'qda_reg_param': 0.8500000000000001, 'qda_tol': 3.7148067359508224e-06}. Best is trial 34 with value: 0.708021.[0m
[32m[I 2022-10-26 21:55:53,905][0m Trial 88 finished with value: 0.6966971921848978 and parameters: {'qda_reg_param': 0.8500000000000001, 'qda_tol': 4.163486016785752e-06}. Best is trial 34 with value: 0.708021.[0m
[32m[I 2022-10-26 21:55:55,480][0m Trial 92 finished with value: 0.7080206915862601 and parameters: {'qda_reg_param': 1.0, 'qda_tol': 1.2244854387354712e-05}. Best is trial 95 with value: 0.708021.[0m
[32m[I 2022-10-26 21:55:55,565][0m Trial 89 finished with value: 0.7080206915862601 and parameters: {'qda_reg_param': 1.0, 'qda_tol': 7.1787883754910306e-06}. Best is trial 95 with value: 0.708021.[0m
[32m[I 2022-10-26 21:55:55,570][0m Trial 95 finished with value: 0.7080206915862601 and parameters: {'qda_reg_param': 1.0, 'qda_tol': 3.2506746451494406e-06}. Best is trial 95 with value: 0.708021.[0m
[32m[I 2022-10-26 21:55:55,643][0m Trial 93 finished with value: 0.7080206915862601 and parameters: {'qda_reg_param': 1.0, 'qda_tol': 1.1944296802832587e-05}. Best is trial 95 with value: 0.708021.[0m
[32m[I 2022-10-26 21:55:55,714][0m Trial 94 finished with value: 0.7080206915862601 and parameters: {'qda_reg_param': 1.0, 'qda_tol': 7.412233052596181e-06}. Best is trial 95 with value: 0.708021.[0m
[32m[I 2022-10-26 21:55:55,862][0m Trial 90 finished with value: 0.7080206915862601 and parameters: {'qda_reg_param': 1.0, 'qda_tol': 7.327471569472512e-06}. Best is trial 95 with value: 0.708021.[0m
[32m[I 2022-10-26 21:55:55,864][0m Trial 91 finished with value: 0.7080206915862601 and parameters: {'qda_reg_param': 1.0, 'qda_tol': 3.2059976919716155e-06}. Best is trial 95 with value: 0.708021.[0m
[32m[I 2022-10-26 21:55:56,982][0m Trial 96 finished with value: 0.7080206915862601 and parameters: {'qda_reg_param': 1.0, 'qda_tol': 2.579321287561744e-06}. Best is trial 96 with value: 0.708021.[0m
[32m[I 2022-10-26 21:55:58,172][0m Trial 97 finished with value: 0.6960743683825104 and parameters: {'qda_reg_param': 0.9500000000000001, 'qda_tol': 1.9162316389982086e-06}. Best is trial 34 with value: 0.708021.[0m
