[32m[I 2022-10-26 21:48:47,506][0m Trial 25 finished with value: 0.12470515852624407 and parameters: {'p_penalty': 'elasticnet', 'p_alpha': 1.1105234951952864e-06, 'p_eta0': 2.0, 'p_early_stopping': True, 'p_validation_fraction': 0.25, 'p_n_iter_no_change': 10}. Best is trial 2 with value: 0.747776.[0m
[32m[I 2022-10-26 21:48:49,610][0m Trial 26 finished with value: 0.7004580453541513 and parameters: {'p_penalty': 'elasticnet', 'p_alpha': 1.006735097613533e-06, 'p_eta0': 1.0, 'p_early_stopping': True, 'p_validation_fraction': 0.25, 'p_n_iter_no_change': 10}. Best is trial 2 with value: 0.747776.[0m
[32m[I 2022-10-26 21:48:57,129][0m Trial 28 finished with value: 0.09796142730771047 and parameters: {'p_penalty': 'elasticnet', 'p_alpha': 0.08062752859560779, 'p_eta0': 1.5, 'p_early_stopping': True, 'p_validation_fraction': 0.25, 'p_n_iter_no_change': 10}. Best is trial 2 with value: 0.747776.[0m
[32m[I 2022-10-26 21:48:58,526][0m Trial 27 finished with value: 0.18193234532192706 and parameters: {'p_penalty': 'elasticnet', 'p_alpha': 1.0263296374330425e-06, 'p_eta0': 1.0, 'p_early_stopping': True, 'p_validation_fraction': 0.25, 'p_n_iter_no_change': 10}. Best is trial 2 with value: 0.747776.[0m
[32m[I 2022-10-26 21:49:00,152][0m Trial 29 finished with value: 0.37681878365415183 and parameters: {'p_penalty': 'elasticnet', 'p_alpha': 0.06573069792354695, 'p_eta0': 1.5, 'p_early_stopping': True, 'p_validation_fraction': 0.25, 'p_n_iter_no_change': 10}. Best is trial 2 with value: 0.747776.[0m
[32m[I 2022-10-26 21:49:08,040][0m Trial 31 finished with value: 0.4365288412572478 and parameters: {'p_penalty': 'elasticnet', 'p_alpha': 7.631731496453222e-06, 'p_eta0': 1.5, 'p_early_stopping': True, 'p_validation_fraction': 0.25, 'p_n_iter_no_change': 10}. Best is trial 2 with value: 0.747776.[0m
[32m[I 2022-10-26 21:49:09,559][0m Trial 30 finished with value: 0.738424801184967 and parameters: {'p_penalty': 'elasticnet', 'p_alpha': 8.622643300648023e-06, 'p_eta0': 1.5, 'p_early_stopping': True, 'p_validation_fraction': 0.25, 'p_n_iter_no_change': 10}. Best is trial 2 with value: 0.747776.[0m
[32m[I 2022-10-26 21:49:31,893][0m Trial 33 finished with value: 0.739180453647465 and parameters: {'p_penalty': 'elasticnet', 'p_alpha': 6.2689485090312e-06, 'p_eta0': 1.5, 'p_early_stopping': True, 'p_validation_fraction': 0.25, 'p_n_iter_no_change': 10}. Best is trial 2 with value: 0.747776.[0m
[32m[I 2022-10-26 21:49:33,286][0m Trial 32 finished with value: 0.7680803657868062 and parameters: {'p_penalty': 'elasticnet', 'p_alpha': 5.230387931085776e-06, 'p_eta0': 1.5, 'p_early_stopping': True, 'p_validation_fraction': 0.25, 'p_n_iter_no_change': 10}. Best is trial 32 with value: 0.76808.[0m
[32m[I 2022-10-26 21:49:38,760][0m Trial 34 finished with value: 0.7642019553828204 and parameters: {'p_penalty': 'elasticnet', 'p_alpha': 4.541745019082459e-06, 'p_eta0': 1.5, 'p_early_stopping': True, 'p_validation_fraction': 0.25, 'p_n_iter_no_change': 10}. Best is trial 32 with value: 0.76808.[0m
[32m[I 2022-10-26 21:49:43,038][0m Trial 36 finished with value: 0.739057157608511 and parameters: {'p_penalty': 'elasticnet', 'p_alpha': 6.3350885679832505e-06, 'p_eta0': 1.5, 'p_early_stopping': True, 'p_validation_fraction': 0.25, 'p_n_iter_no_change': 10}. Best is trial 32 with value: 0.76808.[0m
[32m[I 2022-10-26 21:49:46,289][0m Trial 37 finished with value: 0.1849279167427542 and parameters: {'p_penalty': 'elasticnet', 'p_alpha': 4.037460180439094e-06, 'p_eta0': 0.5, 'p_early_stopping': True, 'p_validation_fraction': 0.25, 'p_n_iter_no_change': 10}. Best is trial 32 with value: 0.76808.[0m
[32m[I 2022-10-26 21:49:47,608][0m Trial 35 finished with value: 0.7190652966550689 and parameters: {'p_penalty': 'elasticnet', 'p_alpha': 5.003178392614407e-06, 'p_eta0': 1.5, 'p_early_stopping': True, 'p_validation_fraction': 0.25, 'p_n_iter_no_change': 10}. Best is trial 32 with value: 0.76808.[0m
[32m[I 2022-10-26 21:49:58,344][0m Trial 38 finished with value: 0.701033767482707 and parameters: {'p_penalty': 'elasticnet', 'p_alpha': 5.578551998239955e-06, 'p_eta0': 1.5, 'p_early_stopping': True, 'p_validation_fraction': 0.25, 'p_n_iter_no_change': 10}. Best is trial 32 with value: 0.76808.[0m
[32m[I 2022-10-26 21:50:00,095][0m Trial 39 finished with value: 0.7022304233551071 and parameters: {'p_penalty': 'elasticnet', 'p_alpha': 4.008125254357502e-06, 'p_eta0': 1.5, 'p_early_stopping': True, 'p_validation_fraction': 0.25, 'p_n_iter_no_change': 10}. Best is trial 32 with value: 0.76808.[0m
[32m[I 2022-10-26 21:50:18,366][0m Trial 41 finished with value: 0.7301929956373046 and parameters: {'p_penalty': 'elasticnet', 'p_alpha': 3.513332161969372e-06, 'p_eta0': 1.5, 'p_early_stopping': True, 'p_validation_fraction': 0.25, 'p_n_iter_no_change': 10}. Best is trial 32 with value: 0.76808.[0m
[32m[I 2022-10-26 21:50:19,929][0m Trial 40 finished with value: 0.6967870256407513 and parameters: {'p_penalty': 'elasticnet', 'p_alpha': 4.391826705970179e-06, 'p_eta0': 1.5, 'p_early_stopping': True, 'p_validation_fraction': 0.25, 'p_n_iter_no_change': 10}. Best is trial 32 with value: 0.76808.[0m
[32m[I 2022-10-26 21:50:23,204][0m Trial 42 finished with value: 0.7175627946279913 and parameters: {'p_penalty': 'elasticnet', 'p_alpha': 3.6888286020544815e-06, 'p_eta0': 2.0, 'p_early_stopping': True, 'p_validation_fraction': 0.25, 'p_n_iter_no_change': 10}. Best is trial 32 with value: 0.76808.[0m
[32m[I 2022-10-26 21:50:28,953][0m Trial 45 finished with value: 0.14202008192905852 and parameters: {'p_penalty': 'elasticnet', 'p_alpha': 1.9851913799052086e-05, 'p_eta0': 2.0, 'p_early_stopping': True, 'p_validation_fraction': 0.25, 'p_n_iter_no_change': 10}. Best is trial 32 with value: 0.76808.[0m
[32m[I 2022-10-26 21:50:30,464][0m Trial 43 finished with value: 0.7174749243476681 and parameters: {'p_penalty': 'elasticnet', 'p_alpha': 2.494842621292344e-06, 'p_eta0': 2.0, 'p_early_stopping': True, 'p_validation_fraction': 0.25, 'p_n_iter_no_change': 10}. Best is trial 32 with value: 0.76808.[0m
[32m[I 2022-10-26 21:50:30,674][0m Trial 44 finished with value: 0.7156022672461388 and parameters: {'p_penalty': 'elasticnet', 'p_alpha': 3.14760094240586e-06, 'p_eta0': 2.0, 'p_early_stopping': True, 'p_validation_fraction': 0.25, 'p_n_iter_no_change': 10}. Best is trial 32 with value: 0.76808.[0m
[32m[I 2022-10-26 21:50:38,762][0m Trial 46 finished with value: 0.14506944382248704 and parameters: {'p_penalty': 'elasticnet', 'p_alpha': 1.775704968019248e-05, 'p_eta0': 2.0, 'p_early_stopping': True, 'p_validation_fraction': 0.25, 'p_n_iter_no_change': 10}. Best is trial 32 with value: 0.76808.[0m
[32m[I 2022-10-26 21:50:41,883][0m Trial 47 finished with value: 0.7101615008396255 and parameters: {'p_penalty': 'elasticnet', 'p_alpha': 1.6566243104916986e-05, 'p_eta0': 2.0, 'p_early_stopping': True, 'p_validation_fraction': 0.25, 'p_n_iter_no_change': 10}. Best is trial 32 with value: 0.76808.[0m
[32m[I 2022-10-26 21:50:58,918][0m Trial 49 finished with value: 0.7131225888026105 and parameters: {'p_penalty': 'elasticnet', 'p_alpha': 1.651050583269818e-05, 'p_eta0': 2.0, 'p_early_stopping': True, 'p_validation_fraction': 0.25, 'p_n_iter_no_change': 10}. Best is trial 32 with value: 0.76808.[0m
[32m[I 2022-10-26 21:50:59,733][0m Trial 48 finished with value: 0.7098113295065536 and parameters: {'p_penalty': 'elasticnet', 'p_alpha': 1.613610975577861e-05, 'p_eta0': 2.0, 'p_early_stopping': True, 'p_validation_fraction': 0.25, 'p_n_iter_no_change': 10}. Best is trial 32 with value: 0.76808.[0m
[32m[I 2022-10-26 21:51:04,182][0m Trial 50 finished with value: 0.40902985746800496 and parameters: {'p_penalty': 'elasticnet', 'p_alpha': 1.6903771178898437e-05, 'p_eta0': 1.0, 'p_early_stopping': True, 'p_validation_fraction': 0.25, 'p_n_iter_no_change': 10}. Best is trial 32 with value: 0.76808.[0m
[32m[I 2022-10-26 21:51:08,927][0m Trial 51 finished with value: 0.39469500941177155 and parameters: {'p_penalty': 'elasticnet', 'p_alpha': 1.366638425612028e-05, 'p_eta0': 1.0, 'p_early_stopping': True, 'p_validation_fraction': 0.25, 'p_n_iter_no_change': 10}. Best is trial 32 with value: 0.76808.[0m
[32m[I 2022-10-26 21:51:10,320][0m Trial 52 finished with value: 0.7086839244115329 and parameters: {'p_penalty': 'elasticnet', 'p_alpha': 2.2898059126565616e-05, 'p_eta0': 1.0, 'p_early_stopping': True, 'p_validation_fraction': 0.25, 'p_n_iter_no_change': 10}. Best is trial 32 with value: 0.76808.[0m
[32m[I 2022-10-26 21:51:12,860][0m Trial 53 finished with value: 0.4057888637787138 and parameters: {'p_penalty': 'elasticnet', 'p_alpha': 1.682391570186854e-05, 'p_eta0': 1.0, 'p_early_stopping': True, 'p_validation_fraction': 0.25, 'p_n_iter_no_change': 10}. Best is trial 32 with value: 0.76808.[0m
[32m[I 2022-10-26 21:51:14,858][0m Trial 54 finished with value: 0.3951496783692218 and parameters: {'p_penalty': 'elasticnet', 'p_alpha': 0.00019113252406984495, 'p_eta0': 1.0, 'p_early_stopping': True, 'p_validation_fraction': 0.25, 'p_n_iter_no_change': 10}. Best is trial 32 with value: 0.76808.[0m
[32m[I 2022-10-26 21:51:22,841][0m Trial 55 finished with value: 0.397026046790577 and parameters: {'p_penalty': 'elasticnet', 'p_alpha': 0.00014466078499363825, 'p_eta0': 1.0, 'p_early_stopping': True, 'p_validation_fraction': 0.25, 'p_n_iter_no_change': 10}. Best is trial 32 with value: 0.76808.[0m
[32m[I 2022-10-26 21:51:37,398][0m Trial 56 finished with value: 0.4076936238465905 and parameters: {'p_penalty': 'elasticnet', 'p_alpha': 2.1366797958624823e-06, 'p_eta0': 1.0, 'p_early_stopping': True, 'p_validation_fraction': 0.25, 'p_n_iter_no_change': 10}. Best is trial 32 with value: 0.76808.[0m
[32m[I 2022-10-26 21:51:38,556][0m Trial 57 finished with value: 0.40915643745996616 and parameters: {'p_penalty': 'elasticnet', 'p_alpha': 0.00012617779900657048, 'p_eta0': 1.0, 'p_early_stopping': True, 'p_validation_fraction': 0.25, 'p_n_iter_no_change': 10}. Best is trial 32 with value: 0.76808.[0m
[32m[I 2022-10-26 21:51:42,282][0m Trial 58 finished with value: 0.14297903748242546 and parameters: {'p_penalty': 'elasticnet', 'p_alpha': 1.950151652156198e-06, 'p_eta0': 1.5, 'p_early_stopping': True, 'p_validation_fraction': 0.25, 'p_n_iter_no_change': 10}. Best is trial 32 with value: 0.76808.[0m
[32m[I 2022-10-26 21:51:47,904][0m Trial 60 finished with value: 0.39622976059204046 and parameters: {'p_penalty': 'elasticnet', 'p_alpha': 0.00015543380696278413, 'p_eta0': 1.5, 'p_early_stopping': True, 'p_validation_fraction': 0.25, 'p_n_iter_no_change': 10}. Best is trial 32 with value: 0.76808.[0m
[32m[I 2022-10-26 21:51:49,924][0m Trial 59 finished with value: 0.7358214316859422 and parameters: {'p_penalty': 'elasticnet', 'p_alpha': 0.00014484514433353284, 'p_eta0': 1.5, 'p_early_stopping': True, 'p_validation_fraction': 0.25, 'p_n_iter_no_change': 10}. Best is trial 32 with value: 0.76808.[0m
[32m[I 2022-10-26 21:51:56,373][0m Trial 61 finished with value: 0.18272591851630174 and parameters: {'p_penalty': 'elasticnet', 'p_alpha': 1.8286331461043023e-06, 'p_eta0': 1.5, 'p_early_stopping': True, 'p_validation_fraction': 0.25, 'p_n_iter_no_change': 10}. Best is trial 32 with value: 0.76808.[0m
[32m[I 2022-10-26 21:51:59,640][0m Trial 63 finished with value: 0.1913537024381116 and parameters: {'p_penalty': 'elasticnet', 'p_alpha': 2.091869126440742e-06, 'p_eta0': 1.5, 'p_early_stopping': True, 'p_validation_fraction': 0.25, 'p_n_iter_no_change': 10}. Best is trial 32 with value: 0.76808.[0m
[32m[I 2022-10-26 21:52:00,970][0m Trial 62 finished with value: 0.13736985392137552 and parameters: {'p_penalty': 'elasticnet', 'p_alpha': 1.7664821418811195e-06, 'p_eta0': 1.5, 'p_early_stopping': True, 'p_validation_fraction': 0.25, 'p_n_iter_no_change': 10}. Best is trial 32 with value: 0.76808.[0m
[32m[I 2022-10-26 21:52:12,744][0m Trial 64 finished with value: 0.145134321918137 and parameters: {'p_penalty': 'elasticnet', 'p_alpha': 4.1664911571577153e-05, 'p_eta0': 1.5, 'p_early_stopping': True, 'p_validation_fraction': 0.25, 'p_n_iter_no_change': 10}. Best is trial 32 with value: 0.76808.[0m
[32m[I 2022-10-26 21:52:16,792][0m Trial 65 finished with value: 0.1457002031666427 and parameters: {'p_penalty': 'elasticnet', 'p_alpha': 4.431108542404973e-05, 'p_eta0': 1.5, 'p_early_stopping': True, 'p_validation_fraction': 0.25, 'p_n_iter_no_change': 10}. Best is trial 32 with value: 0.76808.[0m
[32m[I 2022-10-26 21:52:18,794][0m Trial 66 finished with value: 0.413965389959204 and parameters: {'p_penalty': 'elasticnet', 'p_alpha': 8.154421566080015e-06, 'p_eta0': 1.5, 'p_early_stopping': True, 'p_validation_fraction': 0.25, 'p_n_iter_no_change': 10}. Best is trial 32 with value: 0.76808.[0m
[32m[I 2022-10-26 21:52:26,104][0m Trial 67 finished with value: 0.1450643959536588 and parameters: {'p_penalty': 'elasticnet', 'p_alpha': 5.464000070830293e-05, 'p_eta0': 1.5, 'p_early_stopping': True, 'p_validation_fraction': 0.25, 'p_n_iter_no_change': 10}. Best is trial 32 with value: 0.76808.[0m
[32m[I 2022-10-26 21:52:28,928][0m Trial 68 finished with value: 0.17397804560150598 and parameters: {'p_penalty': 'elasticnet', 'p_alpha': 4.4127620455082616e-05, 'p_eta0': 1.5, 'p_early_stopping': True, 'p_validation_fraction': 0.25, 'p_n_iter_no_change': 10}. Best is trial 32 with value: 0.76808.[0m
[32m[I 2022-10-26 21:52:35,143][0m Trial 69 finished with value: 0.7007384400443649 and parameters: {'p_penalty': 'elasticnet', 'p_alpha': 1.0043198424126471e-05, 'p_eta0': 1.5, 'p_early_stopping': True, 'p_validation_fraction': 0.25, 'p_n_iter_no_change': 10}. Best is trial 32 with value: 0.76808.[0m
[32m[I 2022-10-26 21:52:36,545][0m Trial 70 finished with value: 0.145068642328751 and parameters: {'p_penalty': 'elasticnet', 'p_alpha': 4.8031656571211755e-05, 'p_eta0': 1.5, 'p_early_stopping': True, 'p_validation_fraction': 0.25, 'p_n_iter_no_change': 10}. Best is trial 32 with value: 0.76808.[0m
[32m[I 2022-10-26 21:52:44,470][0m Trial 71 finished with value: 0.38067089476964583 and parameters: {'p_penalty': 'elasticnet', 'p_alpha': 9.193811906442702e-06, 'p_eta0': 1.5, 'p_early_stopping': True, 'p_validation_fraction': 0.25, 'p_n_iter_no_change': 10}. Best is trial 32 with value: 0.76808.[0m
[32m[I 2022-10-26 21:52:51,144][0m Trial 73 finished with value: 0.3951274995915109 and parameters: {'p_penalty': 'elasticnet', 'p_alpha': 8.495351782333428e-06, 'p_eta0': 1.5, 'p_early_stopping': True, 'p_validation_fraction': 0.25, 'p_n_iter_no_change': 10}. Best is trial 32 with value: 0.76808.[0m
[32m[I 2022-10-26 21:52:51,873][0m Trial 72 finished with value: 0.3947327564417851 and parameters: {'p_penalty': 'elasticnet', 'p_alpha': 9.264944831780588e-06, 'p_eta0': 1.5, 'p_early_stopping': True, 'p_validation_fraction': 0.25, 'p_n_iter_no_change': 10}. Best is trial 32 with value: 0.76808.[0m
[32m[I 2022-10-26 21:52:58,226][0m Trial 74 finished with value: 0.12945697389341826 and parameters: {'p_penalty': 'elasticnet', 'p_alpha': 9.631068220923966e-06, 'p_eta0': 1.5, 'p_early_stopping': True, 'p_validation_fraction': 0.25, 'p_n_iter_no_change': 10}. Best is trial 32 with value: 0.76808.[0m
[32m[I 2022-10-26 21:53:04,838][0m Trial 75 finished with value: 0.411093232365163 and parameters: {'p_penalty': 'elasticnet', 'p_alpha': 1.0317005016331407e-05, 'p_eta0': 1.5, 'p_early_stopping': True, 'p_validation_fraction': 0.25, 'p_n_iter_no_change': 10}. Best is trial 32 with value: 0.76808.[0m
[32m[I 2022-10-26 21:53:08,710][0m Trial 76 finished with value: 0.7308802813611659 and parameters: {'p_penalty': 'elasticnet', 'p_alpha': 1.0127047842632033e-05, 'p_eta0': 1.5, 'p_early_stopping': True, 'p_validation_fraction': 0.25, 'p_n_iter_no_change': 10}. Best is trial 32 with value: 0.76808.[0m
[32m[I 2022-10-26 21:53:10,759][0m Trial 78 finished with value: 0.4843330549290835 and parameters: {'p_penalty': 'elasticnet', 'p_alpha': 0.0023698489670650543, 'p_eta0': 1.5, 'p_early_stopping': True, 'p_validation_fraction': 0.25, 'p_n_iter_no_change': 10}. Best is trial 32 with value: 0.76808.[0m
[32m[I 2022-10-26 21:53:14,125][0m Trial 77 finished with value: 0.4095199546220182 and parameters: {'p_penalty': 'elasticnet', 'p_alpha': 7.122339595037466e-06, 'p_eta0': 1.5, 'p_early_stopping': True, 'p_validation_fraction': 0.25, 'p_n_iter_no_change': 10}. Best is trial 32 with value: 0.76808.[0m
[32m[I 2022-10-26 21:53:21,738][0m Trial 79 finished with value: 0.6326055862156693 and parameters: {'p_penalty': 'elasticnet', 'p_alpha': 0.0017284954562695326, 'p_eta0': 1.5, 'p_early_stopping': True, 'p_validation_fraction': 0.25, 'p_n_iter_no_change': 10}. Best is trial 32 with value: 0.76808.[0m
[32m[I 2022-10-26 21:53:27,529][0m Trial 81 finished with value: 0.6951525154160132 and parameters: {'p_penalty': 'elasticnet', 'p_alpha': 0.0006490221915345747, 'p_eta0': 1.5, 'p_early_stopping': True, 'p_validation_fraction': 0.25, 'p_n_iter_no_change': 10}. Best is trial 32 with value: 0.76808.[0m
[32m[I 2022-10-26 21:53:28,446][0m Trial 80 finished with value: 0.6986541384770109 and parameters: {'p_penalty': 'elasticnet', 'p_alpha': 0.0006201158034991541, 'p_eta0': 1.5, 'p_early_stopping': True, 'p_validation_fraction': 0.25, 'p_n_iter_no_change': 10}. Best is trial 32 with value: 0.76808.[0m
[32m[I 2022-10-26 21:53:34,808][0m Trial 82 finished with value: 0.3833884850358457 and parameters: {'p_penalty': 'elasticnet', 'p_alpha': 0.00037042248289063815, 'p_eta0': 1.5, 'p_early_stopping': True, 'p_validation_fraction': 0.25, 'p_n_iter_no_change': 10}. Best is trial 32 with value: 0.76808.[0m
[32m[I 2022-10-26 21:53:41,528][0m Trial 83 finished with value: 0.6319733037652912 and parameters: {'p_penalty': 'elasticnet', 'p_alpha': 0.0012732464392812327, 'p_eta0': 2.0, 'p_early_stopping': True, 'p_validation_fraction': 0.25, 'p_n_iter_no_change': 10}. Best is trial 32 with value: 0.76808.[0m
[32m[I 2022-10-26 21:53:44,185][0m Trial 84 finished with value: 0.3594606358545885 and parameters: {'p_penalty': 'elasticnet', 'p_alpha': 0.0005807778315225857, 'p_eta0': 2.0, 'p_early_stopping': True, 'p_validation_fraction': 0.25, 'p_n_iter_no_change': 10}. Best is trial 32 with value: 0.76808.[0m
[32m[I 2022-10-26 21:53:50,366][0m Trial 85 finished with value: 0.36073835666369797 and parameters: {'p_penalty': 'elasticnet', 'p_alpha': 0.0010176953423347574, 'p_eta0': 2.0, 'p_early_stopping': True, 'p_validation_fraction': 0.25, 'p_n_iter_no_change': 10}. Best is trial 32 with value: 0.76808.[0m
[32m[I 2022-10-26 21:53:53,453][0m Trial 86 finished with value: 0.701583797318367 and parameters: {'p_penalty': 'elasticnet', 'p_alpha': 5.124640392012445e-06, 'p_eta0': 2.0, 'p_early_stopping': True, 'p_validation_fraction': 0.25, 'p_n_iter_no_change': 10}. Best is trial 32 with value: 0.76808.[0m
[32m[I 2022-10-26 21:54:03,065][0m Trial 87 finished with value: 0.4065101203798418 and parameters: {'p_penalty': 'elasticnet', 'p_alpha': 5.413742490141186e-06, 'p_eta0': 2.0, 'p_early_stopping': True, 'p_validation_fraction': 0.25, 'p_n_iter_no_change': 10}. Best is trial 32 with value: 0.76808.[0m
[32m[I 2022-10-26 21:54:07,207][0m Trial 88 finished with value: 0.17336973518809815 and parameters: {'p_penalty': 'elasticnet', 'p_alpha': 3.068794691460221e-05, 'p_eta0': 2.0, 'p_early_stopping': True, 'p_validation_fraction': 0.25, 'p_n_iter_no_change': 10}. Best is trial 32 with value: 0.76808.[0m
[32m[I 2022-10-26 21:54:09,284][0m Trial 89 finished with value: 0.39515070494159626 and parameters: {'p_penalty': 'elasticnet', 'p_alpha': 5.686900597915525e-06, 'p_eta0': 2.0, 'p_early_stopping': True, 'p_validation_fraction': 0.25, 'p_n_iter_no_change': 10}. Best is trial 32 with value: 0.76808.[0m
[32m[I 2022-10-26 21:54:11,747][0m Trial 90 finished with value: 0.6950742018218817 and parameters: {'p_penalty': 'elasticnet', 'p_alpha': 0.9905400970933412, 'p_eta0': 2.0, 'p_early_stopping': True, 'p_validation_fraction': 0.25, 'p_n_iter_no_change': 10}. Best is trial 32 with value: 0.76808.[0m
[32m[I 2022-10-26 21:54:19,223][0m Trial 91 finished with value: 0.14210027682323967 and parameters: {'p_penalty': 'elasticnet', 'p_alpha': 2.8972550425980348e-05, 'p_eta0': 2.0, 'p_early_stopping': True, 'p_validation_fraction': 0.25, 'p_n_iter_no_change': 10}. Best is trial 32 with value: 0.76808.[0m
[32m[I 2022-10-26 21:54:21,935][0m Trial 92 finished with value: 0.4133822630052412 and parameters: {'p_penalty': 'elasticnet', 'p_alpha': 5.253166066980217e-06, 'p_eta0': 2.0, 'p_early_stopping': True, 'p_validation_fraction': 0.25, 'p_n_iter_no_change': 10}. Best is trial 32 with value: 0.76808.[0m
[32m[I 2022-10-26 21:54:28,049][0m Trial 93 finished with value: 0.42262578562244973 and parameters: {'p_penalty': 'elasticnet', 'p_alpha': 4.8383865774358705e-06, 'p_eta0': 1.5, 'p_early_stopping': True, 'p_validation_fraction': 0.25, 'p_n_iter_no_change': 10}. Best is trial 32 with value: 0.76808.[0m
[32m[I 2022-10-26 21:54:33,294][0m Trial 94 finished with value: 0.7454122521169896 and parameters: {'p_penalty': 'elasticnet', 'p_alpha': 3.106932292671057e-05, 'p_eta0': 1.5, 'p_early_stopping': True, 'p_validation_fraction': 0.25, 'p_n_iter_no_change': 10}. Best is trial 32 with value: 0.76808.[0m
[32m[I 2022-10-26 21:54:39,899][0m Trial 95 finished with value: 0.13885263587548757 and parameters: {'p_penalty': 'elasticnet', 'p_alpha': 2.925949210747648e-06, 'p_eta0': 1.5, 'p_early_stopping': True, 'p_validation_fraction': 0.25, 'p_n_iter_no_change': 10}. Best is trial 32 with value: 0.76808.[0m
[32m[I 2022-10-26 21:54:42,766][0m Trial 96 finished with value: 0.40910361904236425 and parameters: {'p_penalty': 'elasticnet', 'p_alpha': 8.411224135060825e-05, 'p_eta0': 1.5, 'p_early_stopping': True, 'p_validation_fraction': 0.25, 'p_n_iter_no_change': 10}. Best is trial 32 with value: 0.76808.[0m
