[32m[I 2022-10-26 00:13:57,841][0m Trial 76 finished with value: 0.9988204214540845 and parameters: {'bbc_n_estimators': 9, 'bbc_max_features': 7, 'bbc_bootstrap': True, 'bbc_sampling_strategy': 'majority'}. Best is trial 19 with value: 0.99927.[0m
[32m[I 2022-10-26 00:14:00,077][0m Trial 77 finished with value: 0.9988204214540845 and parameters: {'bbc_n_estimators': 9, 'bbc_max_features': 7, 'bbc_bootstrap': True, 'bbc_sampling_strategy': 'majority'}. Best is trial 19 with value: 0.99927.[0m
[32m[I 2022-10-26 00:14:02,923][0m Trial 78 finished with value: 0.9988204214540845 and parameters: {'bbc_n_estimators': 9, 'bbc_max_features': 7, 'bbc_bootstrap': True, 'bbc_sampling_strategy': 'majority'}. Best is trial 19 with value: 0.99927.[0m
[32m[I 2022-10-26 00:14:09,148][0m Trial 79 finished with value: 0.9988204214540845 and parameters: {'bbc_n_estimators': 9, 'bbc_max_features': 7, 'bbc_bootstrap': True, 'bbc_sampling_strategy': 'majority'}. Best is trial 19 with value: 0.99927.[0m
[32m[I 2022-10-26 00:14:09,982][0m Trial 81 finished with value: 0.9988204214540845 and parameters: {'bbc_n_estimators': 9, 'bbc_max_features': 7, 'bbc_bootstrap': True, 'bbc_sampling_strategy': 'majority'}. Best is trial 19 with value: 0.99927.[0m
[32m[I 2022-10-26 00:14:11,346][0m Trial 80 finished with value: 0.9988204214540845 and parameters: {'bbc_n_estimators': 9, 'bbc_max_features': 7, 'bbc_bootstrap': True, 'bbc_sampling_strategy': 'majority'}. Best is trial 19 with value: 0.99927.[0m
[32m[I 2022-10-26 00:14:16,460][0m Trial 84 finished with value: 0.9988204209733362 and parameters: {'bbc_n_estimators': 7, 'bbc_max_features': 7, 'bbc_bootstrap': True, 'bbc_sampling_strategy': 'majority'}. Best is trial 19 with value: 0.99927.[0m
[32m[I 2022-10-26 00:14:17,030][0m Trial 83 finished with value: 0.9988204214540845 and parameters: {'bbc_n_estimators': 9, 'bbc_max_features': 7, 'bbc_bootstrap': True, 'bbc_sampling_strategy': 'majority'}. Best is trial 19 with value: 0.99927.[0m
[32m[I 2022-10-26 00:14:17,282][0m Trial 82 finished with value: 0.9985453319085613 and parameters: {'bbc_n_estimators': 10, 'bbc_max_features': 7, 'bbc_bootstrap': True, 'bbc_sampling_strategy': 'majority'}. Best is trial 19 with value: 0.99927.[0m
[32m[I 2022-10-26 00:14:19,968][0m Trial 85 finished with value: 0.9988204209733362 and parameters: {'bbc_n_estimators': 7, 'bbc_max_features': 7, 'bbc_bootstrap': True, 'bbc_sampling_strategy': 'majority'}. Best is trial 19 with value: 0.99927.[0m
[32m[I 2022-10-26 00:14:21,200][0m Trial 86 finished with value: 0.9846285965823098 and parameters: {'bbc_n_estimators': 7, 'bbc_max_features': 5, 'bbc_bootstrap': True, 'bbc_sampling_strategy': 'majority'}. Best is trial 19 with value: 0.99927.[0m
[32m[I 2022-10-26 00:14:24,397][0m Trial 87 finished with value: 0.6999171940201631 and parameters: {'bbc_n_estimators': 7, 'bbc_max_features': 2, 'bbc_bootstrap': True, 'bbc_sampling_strategy': 'majority'}. Best is trial 19 with value: 0.99927.[0m
[32m[I 2022-10-26 00:14:30,482][0m Trial 88 finished with value: 0.9988204209733362 and parameters: {'bbc_n_estimators': 7, 'bbc_max_features': 7, 'bbc_bootstrap': True, 'bbc_sampling_strategy': 'majority'}. Best is trial 19 with value: 0.99927.[0m
[32m[I 2022-10-26 00:14:31,383][0m Trial 89 finished with value: 0.42415999970515 and parameters: {'bbc_n_estimators': 10, 'bbc_max_features': 2, 'bbc_bootstrap': True, 'bbc_sampling_strategy': 'majority'}. Best is trial 19 with value: 0.99927.[0m
[32m[I 2022-10-26 00:14:33,400][0m Trial 93 finished with value: 0.6999171940201631 and parameters: {'bbc_n_estimators': 7, 'bbc_max_features': 2, 'bbc_bootstrap': True, 'bbc_sampling_strategy': 'majority'}. Best is trial 19 with value: 0.99927.[0m
[32m[I 2022-10-26 00:14:35,152][0m Trial 92 finished with value: 0.9856030083344539 and parameters: {'bbc_n_estimators': 7, 'bbc_max_features': 6, 'bbc_bootstrap': True, 'bbc_sampling_strategy': 'majority'}. Best is trial 19 with value: 0.99927.[0m
[32m[I 2022-10-26 00:14:35,381][0m Trial 90 finished with value: 0.42415999970515 and parameters: {'bbc_n_estimators': 10, 'bbc_max_features': 2, 'bbc_bootstrap': True, 'bbc_sampling_strategy': 'majority'}. Best is trial 19 with value: 0.99927.[0m
[32m[I 2022-10-26 00:14:40,053][0m Trial 94 finished with value: 0.9855946149193701 and parameters: {'bbc_n_estimators': 8, 'bbc_max_features': 6, 'bbc_bootstrap': True, 'bbc_sampling_strategy': 'majority'}. Best is trial 19 with value: 0.99927.[0m
[32m[I 2022-10-26 00:14:41,024][0m Trial 91 finished with value: 0.9856125698843242 and parameters: {'bbc_n_estimators': 10, 'bbc_max_features': 6, 'bbc_bootstrap': True, 'bbc_sampling_strategy': 'majority'}. Best is trial 19 with value: 0.99927.[0m
[32m[I 2022-10-26 00:14:42,959][0m Trial 95 finished with value: 0.9855946149193701 and parameters: {'bbc_n_estimators': 8, 'bbc_max_features': 6, 'bbc_bootstrap': True, 'bbc_sampling_strategy': 'majority'}. Best is trial 19 with value: 0.99927.[0m
[32m[I 2022-10-26 00:14:46,316][0m Trial 96 finished with value: 0.9855946149193701 and parameters: {'bbc_n_estimators': 8, 'bbc_max_features': 6, 'bbc_bootstrap': True, 'bbc_sampling_strategy': 'majority'}. Best is trial 19 with value: 0.99927.[0m
[32m[I 2022-10-26 00:14:48,352][0m Trial 98 finished with value: 0.9855946149193701 and parameters: {'bbc_n_estimators': 8, 'bbc_max_features': 6, 'bbc_bootstrap': True, 'bbc_sampling_strategy': 'majority'}. Best is trial 19 with value: 0.99927.[0m
[32m[I 2022-10-26 00:14:49,259][0m Trial 99 finished with value: 0.9855946149193701 and parameters: {'bbc_n_estimators': 8, 'bbc_max_features': 6, 'bbc_bootstrap': True, 'bbc_sampling_strategy': 'majority'}. Best is trial 19 with value: 0.99927.[0m
[32m[I 2022-10-26 00:14:56,489][0m Trial 97 finished with value: 0.9988526747059199 and parameters: {'bbc_n_estimators': 20, 'bbc_max_features': 6, 'bbc_bootstrap': True, 'bbc_sampling_strategy': 'majority'}. Best is trial 19 with value: 0.99927.[0m
[32m[I 2022-10-26 00:14:56,576][0m Study finished.[0m
[32m[I 2022-10-26 00:14:56,592][0m --------------------------------------------------------------------------------[0m
[32m[I 2022-10-26 00:14:56,593][0m --------------------     BalancedRandomForestClassifier     --------------------[0m
[32m[I 2022-10-26 00:14:56,594][0m --------------------------------------------------------------------------------[0m
[32m[I 2022-10-26 00:14:56,624][0m A new study created in RDB with name: BalancedRandomForestClassifier_c963b74b[0m
[32m[I 2022-10-26 00:14:56,633][0m Study started.[0m
[32m[I 2022-10-26 00:16:06,483][0m sklearn.ensemble.RandomForestClassifier.predict: fallback to original Scikit-learn[0m
[32m[I 2022-10-26 00:16:06,484][0m sklearn.ensemble.RandomForestClassifier.predict_proba: fallback to original Scikit-learn[0m
[32m[I 2022-10-26 00:16:19,558][0m Trial 7 finished with value: 0.992448943090826 and parameters: {'brf_n_estimators': 50, 'brf_criterion': 'gini', 'brf_min_samples_split': 13, 'brf_min_samples_leaf': 2, 'brf_max_features': 3, 'brf_bootstrap': True}. Best is trial 7 with value: 0.992449.[0m
[32m[I 2022-10-26 00:16:32,273][0m sklearn.ensemble.RandomForestClassifier.predict: fallback to original Scikit-learn[0m
[32m[I 2022-10-26 00:16:32,278][0m sklearn.ensemble.RandomForestClassifier.predict_proba: fallback to original Scikit-learn[0m
[32m[I 2022-10-26 00:16:44,660][0m sklearn.ensemble.RandomForestClassifier.predict: fallback to original Scikit-learn[0m
[32m[I 2022-10-26 00:16:44,667][0m sklearn.ensemble.RandomForestClassifier.predict_proba: fallback to original Scikit-learn[0m
[32m[I 2022-10-26 00:16:48,549][0m Trial 1 finished with value: 0.9885945673413536 and parameters: {'brf_n_estimators': 70, 'brf_criterion': 'entropy', 'brf_min_samples_split': 2, 'brf_min_samples_leaf': 13, 'brf_max_features': 5, 'brf_bootstrap': False}. Best is trial 7 with value: 0.992449.[0m
[32m[I 2022-10-26 00:16:58,861][0m sklearn.ensemble.RandomForestClassifier.predict: fallback to original Scikit-learn[0m
[32m[I 2022-10-26 00:16:58,862][0m sklearn.ensemble.RandomForestClassifier.predict_proba: fallback to original Scikit-learn[0m
[32m[I 2022-10-26 00:17:01,734][0m Trial 2 finished with value: 0.9147949783184433 and parameters: {'brf_n_estimators': 80, 'brf_criterion': 'gini', 'brf_min_samples_split': 26, 'brf_min_samples_leaf': 37, 'brf_max_features': 4, 'brf_bootstrap': False}. Best is trial 7 with value: 0.992449.[0m
[32m[I 2022-10-26 00:17:18,820][0m Trial 0 finished with value: 0.9727341634230462 and parameters: {'brf_n_estimators': 90, 'brf_criterion': 'entropy', 'brf_min_samples_split': 29, 'brf_min_samples_leaf': 29, 'brf_max_features': 3, 'brf_bootstrap': False}. Best is trial 7 with value: 0.992449.[0m
[32m[I 2022-10-26 00:17:42,163][0m sklearn.ensemble.RandomForestClassifier.predict: fallback to original Scikit-learn[0m
[32m[I 2022-10-26 00:17:42,166][0m sklearn.ensemble.RandomForestClassifier.predict_proba: fallback to original Scikit-learn[0m
[32m[I 2022-10-26 00:18:04,883][0m sklearn.ensemble.RandomForestClassifier.predict: fallback to original Scikit-learn[0m
[32m[I 2022-10-26 00:18:04,883][0m sklearn.ensemble.RandomForestClassifier.predict_proba: fallback to original Scikit-learn[0m
[32m[I 2022-10-26 00:18:07,425][0m Trial 6 finished with value: 0.9618613254191271 and parameters: {'brf_n_estimators': 120, 'brf_criterion': 'entropy', 'brf_min_samples_split': 32, 'brf_min_samples_leaf': 14, 'brf_max_features': 1, 'brf_bootstrap': True}. Best is trial 7 with value: 0.992449.[0m
[32m[I 2022-10-26 00:18:19,107][0m sklearn.ensemble.RandomForestClassifier.predict: fallback to original Scikit-learn[0m
[32m[I 2022-10-26 00:18:19,109][0m sklearn.ensemble.RandomForestClassifier.predict_proba: fallback to original Scikit-learn[0m
[32m[I 2022-10-26 00:18:21,496][0m sklearn.ensemble.RandomForestClassifier.predict: fallback to original Scikit-learn[0m
[32m[I 2022-10-26 00:18:21,498][0m sklearn.ensemble.RandomForestClassifier.predict_proba: fallback to original Scikit-learn[0m
[32m[I 2022-10-26 00:18:29,681][0m Trial 4 finished with value: 0.9468616474524245 and parameters: {'brf_n_estimators': 140, 'brf_criterion': 'entropy', 'brf_min_samples_split': 39, 'brf_min_samples_leaf': 42, 'brf_max_features': 6, 'brf_bootstrap': False}. Best is trial 7 with value: 0.992449.[0m
[32m[I 2022-10-26 00:18:32,037][0m Trial 10 finished with value: 0.9233982361393774 and parameters: {'brf_n_estimators': 60, 'brf_criterion': 'gini', 'brf_min_samples_split': 39, 'brf_min_samples_leaf': 34, 'brf_max_features': 1, 'brf_bootstrap': False}. Best is trial 7 with value: 0.992449.[0m
[32m[I 2022-10-26 00:18:38,964][0m sklearn.ensemble.RandomForestClassifier.predict: fallback to original Scikit-learn[0m
[32m[I 2022-10-26 00:18:38,972][0m sklearn.ensemble.RandomForestClassifier.predict_proba: fallback to original Scikit-learn[0m
[32m[I 2022-10-26 00:18:40,371][0m Trial 8 finished with value: 0.8918578513993634 and parameters: {'brf_n_estimators': 90, 'brf_criterion': 'entropy', 'brf_min_samples_split': 10, 'brf_min_samples_leaf': 36, 'brf_max_features': 5, 'brf_bootstrap': True}. Best is trial 7 with value: 0.992449.[0m
[32m[I 2022-10-26 00:19:13,341][0m Trial 3 finished with value: 0.973228370446317 and parameters: {'brf_n_estimators': 170, 'brf_criterion': 'entropy', 'brf_min_samples_split': 4, 'brf_min_samples_leaf': 13, 'brf_max_features': 1, 'brf_bootstrap': False}. Best is trial 7 with value: 0.992449.[0m
[32m[I 2022-10-26 00:19:26,513][0m sklearn.ensemble.RandomForestClassifier.predict: fallback to original Scikit-learn[0m
[32m[I 2022-10-26 00:19:26,513][0m sklearn.ensemble.RandomForestClassifier.predict_proba: fallback to original Scikit-learn[0m
[32m[I 2022-10-26 00:19:48,440][0m sklearn.ensemble.RandomForestClassifier.predict: fallback to original Scikit-learn[0m
[32m[I 2022-10-26 00:19:48,445][0m sklearn.ensemble.RandomForestClassifier.predict_proba: fallback to original Scikit-learn[0m
[32m[I 2022-10-26 00:19:50,822][0m sklearn.ensemble.RandomForestClassifier.predict: fallback to original Scikit-learn[0m
[32m[I 2022-10-26 00:19:50,825][0m sklearn.ensemble.RandomForestClassifier.predict_proba: fallback to original Scikit-learn[0m
[32m[I 2022-10-26 00:19:59,362][0m Trial 5 finished with value: 0.9847484899453591 and parameters: {'brf_n_estimators': 200, 'brf_criterion': 'gini', 'brf_min_samples_split': 12, 'brf_min_samples_leaf': 10, 'brf_max_features': 7, 'brf_bootstrap': True}. Best is trial 7 with value: 0.992449.[0m
[32m[I 2022-10-26 00:20:00,372][0m Trial 15 finished with value: 0.9387883623493041 and parameters: {'brf_n_estimators': 50, 'brf_criterion': 'gini', 'brf_min_samples_split': 17, 'brf_min_samples_leaf': 38, 'brf_max_features': 5, 'brf_bootstrap': False}. Best is trial 7 with value: 0.992449.[0m
[32m[I 2022-10-26 00:20:01,529][0m sklearn.ensemble.RandomForestClassifier.predict: fallback to original Scikit-learn[0m
[32m[I 2022-10-26 00:20:01,530][0m sklearn.ensemble.RandomForestClassifier.predict_proba: fallback to original Scikit-learn[0m
[32m[I 2022-10-26 00:20:05,053][0m Trial 14 finished with value: 0.9201300056323113 and parameters: {'brf_n_estimators': 60, 'brf_criterion': 'gini', 'brf_min_samples_split': 21, 'brf_min_samples_leaf': 43, 'brf_max_features': 3, 'brf_bootstrap': False}. Best is trial 7 with value: 0.992449.[0m
[32m[I 2022-10-26 00:20:23,683][0m sklearn.ensemble.RandomForestClassifier.predict: fallback to original Scikit-learn[0m
[32m[I 2022-10-26 00:20:23,684][0m sklearn.ensemble.RandomForestClassifier.predict_proba: fallback to original Scikit-learn[0m
[32m[I 2022-10-26 00:20:28,583][0m Trial 9 finished with value: 0.946873296531972 and parameters: {'brf_n_estimators': 150, 'brf_criterion': 'entropy', 'brf_min_samples_split': 30, 'brf_min_samples_leaf': 42, 'brf_max_features': 6, 'brf_bootstrap': False}. Best is trial 7 with value: 0.992449.[0m
[32m[I 2022-10-26 00:20:44,359][0m Trial 13 finished with value: 0.9834720459180548 and parameters: {'brf_n_estimators': 90, 'brf_criterion': 'gini', 'brf_min_samples_split': 7, 'brf_min_samples_leaf': 25, 'brf_max_features': 7, 'brf_bootstrap': False}. Best is trial 7 with value: 0.992449.[0m
[32m[I 2022-10-26 00:21:03,428][0m sklearn.ensemble.RandomForestClassifier.predict: fallback to original Scikit-learn[0m
[32m[I 2022-10-26 00:21:03,432][0m sklearn.ensemble.RandomForestClassifier.predict_proba: fallback to original Scikit-learn[0m
[32m[I 2022-10-26 00:21:06,116][0m sklearn.ensemble.RandomForestClassifier.predict: fallback to original Scikit-learn[0m
[32m[I 2022-10-26 00:21:06,117][0m sklearn.ensemble.RandomForestClassifier.predict_proba: fallback to original Scikit-learn[0m
[32m[I 2022-10-26 00:21:07,325][0m sklearn.ensemble.RandomForestClassifier.predict: fallback to original Scikit-learn[0m
[32m[I 2022-10-26 00:21:07,328][0m sklearn.ensemble.RandomForestClassifier.predict_proba: fallback to original Scikit-learn[0m
[32m[I 2022-10-26 00:21:18,170][0m Trial 17 finished with value: 0.9932859422965273 and parameters: {'brf_n_estimators': 50, 'brf_criterion': 'gini', 'brf_min_samples_split': 17, 'brf_min_samples_leaf': 1, 'brf_max_features': 3, 'brf_bootstrap': True}. Best is trial 17 with value: 0.993286.[0m
[32m[I 2022-10-26 00:21:19,522][0m Trial 18 finished with value: 0.9917828903914865 and parameters: {'brf_n_estimators': 50, 'brf_criterion': 'gini', 'brf_min_samples_split': 2, 'brf_min_samples_leaf': 3, 'brf_max_features': 3, 'brf_bootstrap': True}. Best is trial 17 with value: 0.993286.[0m
[32m[I 2022-10-26 00:21:29,070][0m sklearn.ensemble.RandomForestClassifier.predict: fallback to original Scikit-learn[0m
[32m[I 2022-10-26 00:21:29,075][0m sklearn.ensemble.RandomForestClassifier.predict_proba: fallback to original Scikit-learn[0m
[32m[I 2022-10-26 00:21:34,441][0m Trial 11 finished with value: 0.9126210295076814 and parameters: {'brf_n_estimators': 180, 'brf_criterion': 'gini', 'brf_min_samples_split': 31, 'brf_min_samples_leaf': 42, 'brf_max_features': 1, 'brf_bootstrap': False}. Best is trial 17 with value: 0.993286.[0m
[32m[I 2022-10-26 00:21:56,118][0m sklearn.ensemble.RandomForestClassifier.predict: fallback to original Scikit-learn[0m
[32m[I 2022-10-26 00:21:56,120][0m sklearn.ensemble.RandomForestClassifier.predict_proba: fallback to original Scikit-learn[0m
[32m[I 2022-10-26 00:21:58,400][0m Trial 12 finished with value: 0.923458523292003 and parameters: {'brf_n_estimators': 160, 'brf_criterion': 'gini', 'brf_min_samples_split': 12, 'brf_min_samples_leaf': 37, 'brf_max_features': 2, 'brf_bootstrap': False}. Best is trial 17 with value: 0.993286.[0m
[32m[I 2022-10-26 00:22:19,394][0m sklearn.ensemble.RandomForestClassifier.predict: fallback to original Scikit-learn[0m
[32m[I 2022-10-26 00:22:19,396][0m sklearn.ensemble.RandomForestClassifier.predict_proba: fallback to original Scikit-learn[0m
[32m[I 2022-10-26 00:22:19,397][0m Trial 16 finished with value: 0.9672932781718704 and parameters: {'brf_n_estimators': 130, 'brf_criterion': 'gini', 'brf_min_samples_split': 47, 'brf_min_samples_leaf': 14, 'brf_max_features': 4, 'brf_bootstrap': False}. Best is trial 17 with value: 0.993286.[0m
[32m[I 2022-10-26 00:22:30,944][0m sklearn.ensemble.RandomForestClassifier.predict: fallback to original Scikit-learn[0m
[32m[I 2022-10-26 00:22:30,945][0m sklearn.ensemble.RandomForestClassifier.predict_proba: fallback to original Scikit-learn[0m
[32m[I 2022-10-26 00:22:38,362][0m Trial 19 finished with value: 0.9963117306143366 and parameters: {'brf_n_estimators': 110, 'brf_criterion': 'gini', 'brf_min_samples_split': 2, 'brf_min_samples_leaf': 1, 'brf_max_features': 3, 'brf_bootstrap': True}. Best is trial 19 with value: 0.996312.[0m
[32m[I 2022-10-26 00:22:49,178][0m Trial 20 finished with value: 0.9891773861544013 and parameters: {'brf_n_estimators': 100, 'brf_criterion': 'gini', 'brf_min_samples_split': 2, 'brf_min_samples_leaf': 4, 'brf_max_features': 3, 'brf_bootstrap': True}. Best is trial 19 with value: 0.996312.[0m
[32m[I 2022-10-26 00:22:54,385][0m sklearn.ensemble.RandomForestClassifier.predict: fallback to original Scikit-learn[0m
[32m[I 2022-10-26 00:22:54,386][0m sklearn.ensemble.RandomForestClassifier.predict_proba: fallback to original Scikit-learn[0m
[32m[I 2022-10-26 00:23:13,216][0m Trial 21 finished with value: 0.9932075919272915 and parameters: {'brf_n_estimators': 110, 'brf_criterion': 'gini', 'brf_min_samples_split': 4, 'brf_min_samples_leaf': 2, 'brf_max_features': 3, 'brf_bootstrap': True}. Best is trial 19 with value: 0.996312.[0m
[32m[I 2022-10-26 00:23:23,601][0m sklearn.ensemble.RandomForestClassifier.predict: fallback to original Scikit-learn[0m
[32m[I 2022-10-26 00:23:23,602][0m sklearn.ensemble.RandomForestClassifier.predict_proba: fallback to original Scikit-learn[0m
[32m[I 2022-10-26 00:23:24,724][0m sklearn.ensemble.RandomForestClassifier.predict: fallback to original Scikit-learn[0m
[32m[I 2022-10-26 00:23:24,725][0m sklearn.ensemble.RandomForestClassifier.predict_proba: fallback to original Scikit-learn[0m
[32m[I 2022-10-26 00:23:38,269][0m sklearn.ensemble.RandomForestClassifier.predict: fallback to original Scikit-learn[0m
[32m[I 2022-10-26 00:23:38,273][0m sklearn.ensemble.RandomForestClassifier.predict_proba: fallback to original Scikit-learn[0m
[32m[I 2022-10-26 00:23:42,892][0m Trial 22 finished with value: 0.9927010728945104 and parameters: {'brf_n_estimators': 110, 'brf_criterion': 'gini', 'brf_min_samples_split': 17, 'brf_min_samples_leaf': 2, 'brf_max_features': 3, 'brf_bootstrap': True}. Best is trial 19 with value: 0.996312.[0m
[32m[I 2022-10-26 00:23:44,190][0m Trial 23 finished with value: 0.992962196641816 and parameters: {'brf_n_estimators': 110, 'brf_criterion': 'gini', 'brf_min_samples_split': 17, 'brf_min_samples_leaf': 1, 'brf_max_features': 2, 'brf_bootstrap': True}. Best is trial 19 with value: 0.996312.[0m
[32m[I 2022-10-26 00:23:57,432][0m Trial 24 finished with value: 0.992962196641816 and parameters: {'brf_n_estimators': 110, 'brf_criterion': 'gini', 'brf_min_samples_split': 17, 'brf_min_samples_leaf': 1, 'brf_max_features': 2, 'brf_bootstrap': True}. Best is trial 19 with value: 0.996312.[0m
[32m[I 2022-10-26 00:24:00,474][0m sklearn.ensemble.RandomForestClassifier.predict: fallback to original Scikit-learn[0m
[32m[I 2022-10-26 00:24:00,475][0m sklearn.ensemble.RandomForestClassifier.predict_proba: fallback to original Scikit-learn[0m
[32m[I 2022-10-26 00:24:18,098][0m sklearn.ensemble.RandomForestClassifier.predict: fallback to original Scikit-learn[0m
[32m[I 2022-10-26 00:24:18,100][0m sklearn.ensemble.RandomForestClassifier.predict_proba: fallback to original Scikit-learn[0m
[32m[I 2022-10-26 00:24:19,331][0m Trial 25 finished with value: 0.9905623190382797 and parameters: {'brf_n_estimators': 110, 'brf_criterion': 'gini', 'brf_min_samples_split': 20, 'brf_min_samples_leaf': 3, 'brf_max_features': 2, 'brf_bootstrap': True}. Best is trial 19 with value: 0.996312.[0m
[32m[I 2022-10-26 00:24:36,735][0m sklearn.ensemble.RandomForestClassifier.predict: fallback to original Scikit-learn[0m
[32m[I 2022-10-26 00:24:36,746][0m sklearn.ensemble.RandomForestClassifier.predict_proba: fallback to original Scikit-learn[0m
