[32m[I 2022-10-26 12:59:35,776][0m Trial 91 finished with value: 0.7115248450776943 and parameters: {'lsvc_pcs_kernel_gamma': 0.013733675119008207, 'lsvc_pcs_kernel_n_components': 100, 'lsvc_pcs_degree': 2, 'lsvc_pcs_dual': False, 'lsvc_pcs_C': 0.00030244604246770275, 'lsvc_pcs_max_iter': 2000}. Best is trial 38 with value: 0.721186.[0m
[32m[I 2022-10-26 12:59:55,679][0m Trial 92 finished with value: 0.1445961581883726 and parameters: {'lsvc_pcs_kernel_gamma': 6.426329083822797, 'lsvc_pcs_kernel_n_components': 100, 'lsvc_pcs_degree': 2, 'lsvc_pcs_dual': False, 'lsvc_pcs_C': 0.0011447392014884102, 'lsvc_pcs_max_iter': 2000}. Best is trial 38 with value: 0.721186.[0m
[32m[I 2022-10-26 13:00:15,114][0m Trial 93 finished with value: 0.33983879988150645 and parameters: {'lsvc_pcs_kernel_gamma': 0.003984043597338707, 'lsvc_pcs_kernel_n_components': 100, 'lsvc_pcs_degree': 2, 'lsvc_pcs_dual': False, 'lsvc_pcs_C': 0.005149922994503413, 'lsvc_pcs_max_iter': 2000}. Best is trial 38 with value: 0.721186.[0m
[32m[I 2022-10-26 13:00:34,454][0m Trial 94 finished with value: 0.14444671555177827 and parameters: {'lsvc_pcs_kernel_gamma': 0.278378675718424, 'lsvc_pcs_kernel_n_components': 100, 'lsvc_pcs_degree': 2, 'lsvc_pcs_dual': False, 'lsvc_pcs_C': 0.00011193658171939167, 'lsvc_pcs_max_iter': 2000}. Best is trial 38 with value: 0.721186.[0m
[32m[I 2022-10-26 13:00:55,683][0m Trial 95 finished with value: 0.3429027198458468 and parameters: {'lsvc_pcs_kernel_gamma': 271.61070114103575, 'lsvc_pcs_kernel_n_components': 100, 'lsvc_pcs_degree': 2, 'lsvc_pcs_dual': False, 'lsvc_pcs_C': 0.0007657760735504394, 'lsvc_pcs_max_iter': 2000}. Best is trial 38 with value: 0.721186.[0m
[32m[I 2022-10-26 13:01:12,843][0m Trial 96 finished with value: 0.7101683737546898 and parameters: {'lsvc_pcs_kernel_gamma': 744.3117935245523, 'lsvc_pcs_kernel_n_components': 100, 'lsvc_pcs_degree': 2, 'lsvc_pcs_dual': False, 'lsvc_pcs_C': 0.01047127760289376, 'lsvc_pcs_max_iter': 2000}. Best is trial 38 with value: 0.721186.[0m
[32m[I 2022-10-26 13:01:26,722][0m Trial 97 finished with value: 0.14497409852547152 and parameters: {'lsvc_pcs_kernel_gamma': 0.08444304206817538, 'lsvc_pcs_kernel_n_components': 100, 'lsvc_pcs_degree': 2, 'lsvc_pcs_dual': False, 'lsvc_pcs_C': 0.0002083068901890948, 'lsvc_pcs_max_iter': 2000}. Best is trial 38 with value: 0.721186.[0m
[32m[I 2022-10-26 13:01:40,738][0m Trial 98 finished with value: 0.7092490062021881 and parameters: {'lsvc_pcs_kernel_gamma': 149.57702081515555, 'lsvc_pcs_kernel_n_components': 100, 'lsvc_pcs_degree': 2, 'lsvc_pcs_dual': False, 'lsvc_pcs_C': 0.0031422802490507578, 'lsvc_pcs_max_iter': 2000}. Best is trial 38 with value: 0.721186.[0m
[32m[I 2022-10-26 13:01:54,530][0m Trial 99 finished with value: 0.7146294626350176 and parameters: {'lsvc_pcs_kernel_gamma': 592.5730165746407, 'lsvc_pcs_kernel_n_components': 100, 'lsvc_pcs_degree': 2, 'lsvc_pcs_dual': False, 'lsvc_pcs_C': 0.15538807738224947, 'lsvc_pcs_max_iter': 2000}. Best is trial 38 with value: 0.721186.[0m
[32m[I 2022-10-26 13:01:54,602][0m Study finished.[0m
[32m[I 2022-10-26 13:01:54,666][0m --------------------------------------------------------------------------------[0m
[32m[I 2022-10-26 13:01:54,667][0m --------------------          LinearSVC_RBFSampler          --------------------[0m
[32m[I 2022-10-26 13:01:54,668][0m --------------------------------------------------------------------------------[0m
[32m[I 2022-10-26 13:01:55,005][0m A new study created in RDB with name: LinearSVC_RBFSampler_c963b74b[0m
[32m[I 2022-10-26 13:01:55,014][0m Study started.[0m
[32m[I 2022-10-26 13:05:17,361][0m Trial 0 finished with value: 0.8843748569145197 and parameters: {'lsvc_rbfs_kernel_gamma': 3.2791117636310303, 'lsvc_rbfs_kernel_n_components': 50, 'lsvc_rbfs_dual': False, 'lsvc_rbfs_C': 0.15013671872905857, 'lsvc_rbfs_max_iter': 2000}. Best is trial 0 with value: 0.884375.[0m
[32m[I 2022-10-26 13:09:26,068][0m Trial 1 finished with value: 0.8949449639689682 and parameters: {'lsvc_rbfs_kernel_gamma': 0.0964428493479855, 'lsvc_rbfs_kernel_n_components': 50, 'lsvc_rbfs_dual': False, 'lsvc_rbfs_C': 1.8400784788450968, 'lsvc_rbfs_max_iter': 2000}. Best is trial 1 with value: 0.894945.[0m
[32m[I 2022-10-26 13:17:51,881][0m Trial 2 finished with value: 0.9279319264722189 and parameters: {'lsvc_rbfs_kernel_gamma': 0.09348729220280555, 'lsvc_rbfs_kernel_n_components': 150, 'lsvc_rbfs_dual': False, 'lsvc_rbfs_C': 0.04111551666116596, 'lsvc_rbfs_max_iter': 2000}. Best is trial 2 with value: 0.927932.[0m
[32m[I 2022-10-26 13:28:56,021][0m Trial 3 finished with value: 0.9266943230265653 and parameters: {'lsvc_rbfs_kernel_gamma': 0.5435826015984068, 'lsvc_rbfs_kernel_n_components': 150, 'lsvc_rbfs_dual': False, 'lsvc_rbfs_C': 0.0016442786785665483, 'lsvc_rbfs_max_iter': 2000}. Best is trial 2 with value: 0.927932.[0m
[32m[I 2022-10-26 13:42:27,993][0m Trial 4 finished with value: 0.9121060421880137 and parameters: {'lsvc_rbfs_kernel_gamma': 6.060446551878411, 'lsvc_rbfs_kernel_n_components': 100, 'lsvc_rbfs_dual': False, 'lsvc_rbfs_C': 0.7871318515873511, 'lsvc_rbfs_max_iter': 2000}. Best is trial 2 with value: 0.927932.[0m
[32m[I 2022-10-26 13:44:08,707][0m Trial 5 finished with value: 0.8356029831426109 and parameters: {'lsvc_rbfs_kernel_gamma': 0.010082586229042617, 'lsvc_rbfs_kernel_n_components': 50, 'lsvc_rbfs_dual': False, 'lsvc_rbfs_C': 3.124585826579456e-05, 'lsvc_rbfs_max_iter': 2000}. Best is trial 2 with value: 0.927932.[0m
[32m[I 2022-10-26 13:48:36,807][0m Trial 6 finished with value: 0.8765274997613307 and parameters: {'lsvc_rbfs_kernel_gamma': 0.03077298850631265, 'lsvc_rbfs_kernel_n_components': 100, 'lsvc_rbfs_dual': False, 'lsvc_rbfs_C': 0.00015950283390043864, 'lsvc_rbfs_max_iter': 2000}. Best is trial 2 with value: 0.927932.[0m
[32m[I 2022-10-26 13:56:27,179][0m Trial 7 finished with value: 0.907539950320257 and parameters: {'lsvc_rbfs_kernel_gamma': 289.0610109662202, 'lsvc_rbfs_kernel_n_components': 100, 'lsvc_rbfs_dual': False, 'lsvc_rbfs_C': 152.1123842855606, 'lsvc_rbfs_max_iter': 2000}. Best is trial 2 with value: 0.927932.[0m
[32m[I 2022-10-26 14:03:46,351][0m Trial 8 finished with value: 0.9157720388620915 and parameters: {'lsvc_rbfs_kernel_gamma': 0.29326323690973066, 'lsvc_rbfs_kernel_n_components': 100, 'lsvc_rbfs_dual': False, 'lsvc_rbfs_C': 0.18155407183667602, 'lsvc_rbfs_max_iter': 2000}. Best is trial 2 with value: 0.927932.[0m
[32m[I 2022-10-26 14:09:27,246][0m Trial 9 finished with value: 0.9192559130707769 and parameters: {'lsvc_rbfs_kernel_gamma': 0.21765423542871082, 'lsvc_rbfs_kernel_n_components': 100, 'lsvc_rbfs_dual': False, 'lsvc_rbfs_C': 1.3726431572522027, 'lsvc_rbfs_max_iter': 2000}. Best is trial 2 with value: 0.927932.[0m
[32m[I 2022-10-26 14:41:11,304][0m Trial 10 finished with value: 0.932798524398479 and parameters: {'lsvc_rbfs_kernel_gamma': 0.0031140172275608948, 'lsvc_rbfs_kernel_n_components': 150, 'lsvc_rbfs_dual': False, 'lsvc_rbfs_C': 865.328016994693, 'lsvc_rbfs_max_iter': 2000}. Best is trial 10 with value: 0.932799.[0m
[32m[I 2022-10-26 15:29:19,516][0m Trial 11 finished with value: 0.9353831342085989 and parameters: {'lsvc_rbfs_kernel_gamma': 0.0011249032685404581, 'lsvc_rbfs_kernel_n_components': 150, 'lsvc_rbfs_dual': False, 'lsvc_rbfs_C': 605.4710670899938, 'lsvc_rbfs_max_iter': 2000}. Best is trial 11 with value: 0.935383.[0m
[32m[I 2022-10-26 16:12:10,852][0m Trial 12 finished with value: 0.9363167398165897 and parameters: {'lsvc_rbfs_kernel_gamma': 0.0010191334876370258, 'lsvc_rbfs_kernel_n_components': 150, 'lsvc_rbfs_dual': False, 'lsvc_rbfs_C': 301.0107529446629, 'lsvc_rbfs_max_iter': 2000}. Best is trial 12 with value: 0.936317.[0m
[32m[I 2022-10-26 16:24:22,993][0m Trial 13 finished with value: 0.9340019304989688 and parameters: {'lsvc_rbfs_kernel_gamma': 0.0011387137221207724, 'lsvc_rbfs_kernel_n_components': 150, 'lsvc_rbfs_dual': False, 'lsvc_rbfs_C': 37.6213521171189, 'lsvc_rbfs_max_iter': 2000}. Best is trial 12 with value: 0.936317.[0m
[32m[I 2022-10-26 16:25:50,224][0m Trial 14 finished with value: 0.6950742018218817 and parameters: {'lsvc_rbfs_kernel_gamma': 0.0081235630806684, 'lsvc_rbfs_kernel_n_components': 150, 'lsvc_rbfs_dual': False, 'lsvc_rbfs_C': 1.3874455460138019e-06, 'lsvc_rbfs_max_iter': 2000}. Best is trial 12 with value: 0.936317.[0m
[32m[I 2022-10-26 16:43:09,808][0m Trial 15 finished with value: 0.9347303097079122 and parameters: {'lsvc_rbfs_kernel_gamma': 0.0015153546295748731, 'lsvc_rbfs_kernel_n_components': 150, 'lsvc_rbfs_dual': False, 'lsvc_rbfs_C': 24.060944743985484, 'lsvc_rbfs_max_iter': 2000}. Best is trial 12 with value: 0.936317.[0m
[32m[I 2022-10-26 16:52:52,010][0m Trial 16 finished with value: 0.92257992184704 and parameters: {'lsvc_rbfs_kernel_gamma': 54.53524990530638, 'lsvc_rbfs_kernel_n_components': 150, 'lsvc_rbfs_dual': False, 'lsvc_rbfs_C': 848.3001855344185, 'lsvc_rbfs_max_iter': 2000}. Best is trial 12 with value: 0.936317.[0m
[32m[I 2022-10-26 17:12:08,114][0m Trial 17 finished with value: 0.9224257742837677 and parameters: {'lsvc_rbfs_kernel_gamma': 0.015263188575311714, 'lsvc_rbfs_kernel_n_components': 150, 'lsvc_rbfs_dual': False, 'lsvc_rbfs_C': 20.37002253477886, 'lsvc_rbfs_max_iter': 2000}. Best is trial 12 with value: 0.936317.[0m
[32m[I 2022-10-26 17:12:08,218][0m Study finished.[0m
[32m[I 2022-10-26 17:12:08,231][0m --------------------------------------------------------------------------------[0m
[32m[I 2022-10-26 17:12:08,231][0m --------------------             MLPClassifier              --------------------[0m
[32m[I 2022-10-26 17:12:08,232][0m --------------------------------------------------------------------------------[0m
[32m[I 2022-10-26 17:12:08,320][0m A new study created in RDB with name: MLPClassifier_c963b74b[0m
[32m[I 2022-10-26 17:12:08,328][0m Study started.[0m
[32m[I 2022-10-26 17:12:08,887][0m sklearn.model_selection.train_test_split: running accelerated version on CPU[0m
[32m[I 2022-10-26 17:12:08,939][0m sklearn.model_selection.train_test_split: fallback to original Scikit-learn[0m
[32m[I 2022-10-26 17:12:08,988][0m sklearn.model_selection.train_test_split: running accelerated version on CPU[0m
[32m[I 2022-10-26 17:12:09,015][0m sklearn.model_selection.train_test_split: running accelerated version on CPU[0m
[32m[I 2022-10-26 17:12:09,051][0m sklearn.model_selection.train_test_split: running accelerated version on CPU[0m
[32m[I 2022-10-26 17:12:09,102][0m sklearn.model_selection.train_test_split: fallback to original Scikit-learn[0m
[32m[I 2022-10-26 17:12:09,102][0m sklearn.model_selection.train_test_split: running accelerated version on CPU[0m
[32m[I 2022-10-26 17:12:09,211][0m sklearn.model_selection.train_test_split: running accelerated version on CPU[0m
[32m[I 2022-10-26 17:12:09,211][0m sklearn.model_selection.train_test_split: fallback to original Scikit-learn[0m
[32m[I 2022-10-26 17:12:09,269][0m sklearn.model_selection.train_test_split: fallback to original Scikit-learn[0m
[32m[I 2022-10-26 17:12:09,305][0m sklearn.model_selection.train_test_split: fallback to original Scikit-learn[0m
[32m[I 2022-10-26 17:12:09,345][0m sklearn.model_selection.train_test_split: fallback to original Scikit-learn[0m
[32m[I 2022-10-26 17:12:09,372][0m sklearn.model_selection.train_test_split: running accelerated version on CPU[0m
[32m[I 2022-10-26 17:12:09,413][0m sklearn.model_selection.train_test_split: fallback to original Scikit-learn[0m
[32m[I 2022-10-26 17:12:09,451][0m sklearn.model_selection.train_test_split: running accelerated version on CPU[0m
[32m[I 2022-10-26 17:12:09,482][0m sklearn.model_selection.train_test_split: fallback to original Scikit-learn[0m
[32m[I 2022-10-26 17:17:44,203][0m Trial 3 finished with value: 0.8091784969903607 and parameters: {'mlpc_hidden_layer_count': 2, 'mlpc_learning_rate': 'invscaling', 'mlpc_learning_rate_init': 0.0022360099989336994, 'mplc_max_iter': 2000}. Best is trial 3 with value: 0.809178.[0m
[32m[I 2022-10-26 17:17:44,534][0m sklearn.model_selection.train_test_split: running accelerated version on CPU[0m
[32m[I 2022-10-26 17:17:44,564][0m sklearn.model_selection.train_test_split: fallback to original Scikit-learn[0m
[32m[I 2022-10-26 17:19:04,975][0m Trial 2 finished with value: 0.7810651909165821 and parameters: {'mlpc_hidden_layer_count': 1, 'mlpc_learning_rate': 'invscaling', 'mlpc_learning_rate_init': 7.108318996909243e-06, 'mplc_max_iter': 2000}. Best is trial 3 with value: 0.809178.[0m
[32m[I 2022-10-26 17:19:05,301][0m sklearn.model_selection.train_test_split: running accelerated version on CPU[0m
[32m[I 2022-10-26 17:19:05,329][0m sklearn.model_selection.train_test_split: fallback to original Scikit-learn[0m
[32m[I 2022-10-26 17:20:25,880][0m Trial 6 finished with value: 0.7525009762444298 and parameters: {'mlpc_hidden_layer_count': 1, 'mlpc_learning_rate': 'constant', 'mlpc_learning_rate_init': 9.314974564586228e-06, 'mplc_max_iter': 2000}. Best is trial 3 with value: 0.809178.[0m
[32m[I 2022-10-26 17:20:26,227][0m sklearn.model_selection.train_test_split: running accelerated version on CPU[0m
[32m[I 2022-10-26 17:20:26,254][0m sklearn.model_selection.train_test_split: fallback to original Scikit-learn[0m
[32m[I 2022-10-26 17:21:59,945][0m Trial 1 finished with value: 0.6950742018218817 and parameters: {'mlpc_hidden_layer_count': 3, 'mlpc_learning_rate': 'invscaling', 'mlpc_learning_rate_init': 0.01501871166627803, 'mplc_max_iter': 2000}. Best is trial 3 with value: 0.809178.[0m
[32m[I 2022-10-26 17:22:00,282][0m sklearn.model_selection.train_test_split: running accelerated version on CPU[0m
[32m[I 2022-10-26 17:22:00,311][0m sklearn.model_selection.train_test_split: fallback to original Scikit-learn[0m
[32m[I 2022-10-26 17:22:07,324][0m Trial 0 finished with value: 0.6950742018218817 and parameters: {'mlpc_hidden_layer_count': 3, 'mlpc_learning_rate': 'constant', 'mlpc_learning_rate_init': 0.006651754767395973, 'mplc_max_iter': 2000}. Best is trial 3 with value: 0.809178.[0m
[32m[I 2022-10-26 17:22:07,637][0m sklearn.model_selection.train_test_split: running accelerated version on CPU[0m
[32m[I 2022-10-26 17:22:07,664][0m sklearn.model_selection.train_test_split: fallback to original Scikit-learn[0m
[32m[I 2022-10-26 17:23:43,608][0m Trial 5 finished with value: 0.7990788943174234 and parameters: {'mlpc_hidden_layer_count': 2, 'mlpc_learning_rate': 'invscaling', 'mlpc_learning_rate_init': 5.6025288581058524e-06, 'mplc_max_iter': 2000}. Best is trial 3 with value: 0.809178.[0m
[32m[I 2022-10-26 17:23:43,933][0m sklearn.model_selection.train_test_split: running accelerated version on CPU[0m
[32m[I 2022-10-26 17:23:43,962][0m sklearn.model_selection.train_test_split: fallback to original Scikit-learn[0m
[32m[I 2022-10-26 17:28:51,543][0m Trial 9 finished with value: 0.6950742018218817 and parameters: {'mlpc_hidden_layer_count': 3, 'mlpc_learning_rate': 'constant', 'mlpc_learning_rate_init': 0.10135482832308397, 'mplc_max_iter': 2000}. Best is trial 3 with value: 0.809178.[0m
[32m[I 2022-10-26 17:28:51,870][0m sklearn.model_selection.train_test_split: running accelerated version on CPU[0m
[32m[I 2022-10-26 17:28:51,897][0m sklearn.model_selection.train_test_split: fallback to original Scikit-learn[0m
[32m[I 2022-10-26 17:30:17,244][0m Trial 10 finished with value: 0.6950742018218817 and parameters: {'mlpc_hidden_layer_count': 3, 'mlpc_learning_rate': 'constant', 'mlpc_learning_rate_init': 0.06731692883411243, 'mplc_max_iter': 2000}. Best is trial 3 with value: 0.809178.[0m
[32m[I 2022-10-26 17:30:17,573][0m sklearn.model_selection.train_test_split: running accelerated version on CPU[0m
[32m[I 2022-10-26 17:30:17,599][0m sklearn.model_selection.train_test_split: fallback to original Scikit-learn[0m
[32m[I 2022-10-26 17:33:08,893][0m Trial 12 finished with value: 0.8366794102522422 and parameters: {'mlpc_hidden_layer_count': 3, 'mlpc_learning_rate': 'adaptive', 'mlpc_learning_rate_init': 0.0014694339510360433, 'mplc_max_iter': 2000}. Best is trial 12 with value: 0.836679.[0m
[32m[I 2022-10-26 17:33:09,220][0m sklearn.model_selection.train_test_split: running accelerated version on CPU[0m
[32m[I 2022-10-26 17:33:09,246][0m sklearn.model_selection.train_test_split: fallback to original Scikit-learn[0m
[32m[I 2022-10-26 17:33:28,369][0m Trial 11 finished with value: 0.8720613417684909 and parameters: {'mlpc_hidden_layer_count': 2, 'mlpc_learning_rate': 'adaptive', 'mlpc_learning_rate_init': 1.7052995231402578e-05, 'mplc_max_iter': 2000}. Best is trial 11 with value: 0.872061.[0m
[32m[I 2022-10-26 17:33:28,686][0m sklearn.model_selection.train_test_split: running accelerated version on CPU[0m
[32m[I 2022-10-26 17:33:28,714][0m sklearn.model_selection.train_test_split: fallback to original Scikit-learn[0m
[32m[I 2022-10-26 17:38:36,802][0m Trial 16 finished with value: 0.6950742018218817 and parameters: {'mlpc_hidden_layer_count': 2, 'mlpc_learning_rate': 'constant', 'mlpc_learning_rate_init': 0.23729006715102502, 'mplc_max_iter': 2000}. Best is trial 11 with value: 0.872061.[0m
[32m[I 2022-10-26 17:38:37,126][0m sklearn.model_selection.train_test_split: running accelerated version on CPU[0m
[32m[I 2022-10-26 17:38:37,154][0m sklearn.model_selection.train_test_split: fallback to original Scikit-learn[0m
[32m[I 2022-10-26 17:39:35,207][0m Trial 13 finished with value: 0.8997152673455365 and parameters: {'mlpc_hidden_layer_count': 2, 'mlpc_learning_rate': 'adaptive', 'mlpc_learning_rate_init': 5.005711347202355e-05, 'mplc_max_iter': 2000}. Best is trial 13 with value: 0.899715.[0m
[32m[I 2022-10-26 17:39:35,531][0m sklearn.model_selection.train_test_split: running accelerated version on CPU[0m
[32m[I 2022-10-26 17:39:35,559][0m sklearn.model_selection.train_test_split: fallback to original Scikit-learn[0m
[32m[I 2022-10-26 17:39:50,303][0m Trial 14 finished with value: 0.7946722394489352 and parameters: {'mlpc_hidden_layer_count': 2, 'mlpc_learning_rate': 'invscaling', 'mlpc_learning_rate_init': 5.829330123926961e-06, 'mplc_max_iter': 2000}. Best is trial 13 with value: 0.899715.[0m
[32m[I 2022-10-26 17:39:50,625][0m sklearn.model_selection.train_test_split: running accelerated version on CPU[0m
[32m[I 2022-10-26 17:39:50,653][0m sklearn.model_selection.train_test_split: fallback to original Scikit-learn[0m
[32m[I 2022-10-26 17:41:16,694][0m Trial 4 finished with value: 0.8014504878533298 and parameters: {'mlpc_hidden_layer_count': 3, 'mlpc_learning_rate': 'invscaling', 'mlpc_learning_rate_init': 0.0002590226641579139, 'mplc_max_iter': 2000}. Best is trial 13 with value: 0.899715.[0m
[32m[I 2022-10-26 17:41:17,023][0m sklearn.model_selection.train_test_split: running accelerated version on CPU[0m
[32m[I 2022-10-26 17:41:17,052][0m sklearn.model_selection.train_test_split: fallback to original Scikit-learn[0m
[32m[I 2022-10-26 17:43:43,550][0m Trial 15 finished with value: 0.9275583446991964 and parameters: {'mlpc_hidden_layer_count': 1, 'mlpc_learning_rate': 'invscaling', 'mlpc_learning_rate_init': 0.0005409264178923834, 'mplc_max_iter': 2000}. Best is trial 15 with value: 0.927558.[0m
[32m[I 2022-10-26 17:43:43,886][0m sklearn.model_selection.train_test_split: running accelerated version on CPU[0m
[32m[I 2022-10-26 17:43:43,916][0m sklearn.model_selection.train_test_split: fallback to original Scikit-learn[0m
[32m[I 2022-10-26 17:44:43,415][0m Trial 8 finished with value: 0.8811038859352651 and parameters: {'mlpc_hidden_layer_count': 1, 'mlpc_learning_rate': 'invscaling', 'mlpc_learning_rate_init': 1.0981969007092933e-05, 'mplc_max_iter': 2000}. Best is trial 15 with value: 0.927558.[0m
[32m[I 2022-10-26 17:44:43,745][0m sklearn.model_selection.train_test_split: running accelerated version on CPU[0m
[32m[I 2022-10-26 17:44:43,773][0m sklearn.model_selection.train_test_split: fallback to original Scikit-learn[0m
[32m[I 2022-10-26 17:49:08,577][0m Trial 21 finished with value: 0.8511120314948105 and parameters: {'mlpc_hidden_layer_count': 1, 'mlpc_learning_rate': 'adaptive', 'mlpc_learning_rate_init': 0.00018244069629084957, 'mplc_max_iter': 2000}. Best is trial 15 with value: 0.927558.[0m
[32m[I 2022-10-26 17:49:08,924][0m sklearn.model_selection.train_test_split: running accelerated version on CPU[0m
[32m[I 2022-10-26 17:49:08,954][0m sklearn.model_selection.train_test_split: fallback to original Scikit-learn[0m
[32m[I 2022-10-26 17:49:16,801][0m Trial 17 finished with value: 0.8918776131778154 and parameters: {'mlpc_hidden_layer_count': 2, 'mlpc_learning_rate': 'adaptive', 'mlpc_learning_rate_init': 8.282387678586408e-05, 'mplc_max_iter': 2000}. Best is trial 15 with value: 0.927558.[0m
[32m[I 2022-10-26 17:49:17,133][0m sklearn.model_selection.train_test_split: running accelerated version on CPU[0m
[32m[I 2022-10-26 17:49:17,164][0m sklearn.model_selection.train_test_split: fallback to original Scikit-learn[0m
[32m[I 2022-10-26 17:50:36,852][0m Trial 18 finished with value: 0.8811835136112433 and parameters: {'mlpc_hidden_layer_count': 2, 'mlpc_learning_rate': 'adaptive', 'mlpc_learning_rate_init': 0.00015105819384836054, 'mplc_max_iter': 2000}. Best is trial 15 with value: 0.927558.[0m
[32m[I 2022-10-26 17:50:37,171][0m sklearn.model_selection.train_test_split: running accelerated version on CPU[0m
[32m[I 2022-10-26 17:50:37,211][0m sklearn.model_selection.train_test_split: fallback to original Scikit-learn[0m
