[32m[I 2022-10-26 22:34:34,176][0m Trial 96 finished with value: 0.9998733110695578 and parameters: {'rfc_criterion': 'entropy', 'rfc_n_estimators': 80, 'rfc_min_samples_split': 24, 'rfc_min_samples_leaf': 13, 'rfc_max_features': 4, 'rfc_bootstrap': False}. Best is trial 95 with value: 0.999955.[0m
[32m[I 2022-10-26 22:34:39,266][0m sklearn.ensemble.RandomForestClassifier.predict: fallback to original Scikit-learn[0m
[32m[I 2022-10-26 22:34:39,267][0m sklearn.ensemble.RandomForestClassifier.predict_proba: fallback to original Scikit-learn[0m
[32m[I 2022-10-26 22:34:42,997][0m Trial 94 finished with value: 0.9997167607089104 and parameters: {'rfc_criterion': 'entropy', 'rfc_n_estimators': 100, 'rfc_min_samples_split': 32, 'rfc_min_samples_leaf': 41, 'rfc_max_features': 4, 'rfc_bootstrap': False}. Best is trial 95 with value: 0.999955.[0m
[32m[I 2022-10-26 22:34:50,728][0m sklearn.ensemble.RandomForestClassifier.predict: fallback to original Scikit-learn[0m
[32m[I 2022-10-26 22:34:50,729][0m sklearn.ensemble.RandomForestClassifier.predict_proba: fallback to original Scikit-learn[0m
[32m[I 2022-10-26 22:34:52,528][0m sklearn.ensemble.RandomForestClassifier.predict: fallback to original Scikit-learn[0m
[32m[I 2022-10-26 22:34:52,531][0m sklearn.ensemble.RandomForestClassifier.predict_proba: fallback to original Scikit-learn[0m
[32m[I 2022-10-26 22:34:53,853][0m Trial 98 finished with value: 0.9999527625488813 and parameters: {'rfc_criterion': 'entropy', 'rfc_n_estimators': 80, 'rfc_min_samples_split': 25, 'rfc_min_samples_leaf': 2, 'rfc_max_features': 4, 'rfc_bootstrap': False}. Best is trial 95 with value: 0.999955.[0m
[32m[I 2022-10-26 22:34:55,556][0m Trial 99 finished with value: 0.9999552542404249 and parameters: {'rfc_criterion': 'entropy', 'rfc_n_estimators': 80, 'rfc_min_samples_split': 26, 'rfc_min_samples_leaf': 2, 'rfc_max_features': 4, 'rfc_bootstrap': False}. Best is trial 99 with value: 0.999955.[0m
[32m[I 2022-10-26 22:34:55,625][0m Study finished.[0m
[32m[I 2022-10-26 22:34:55,642][0m --------------------------------------------------------------------------------[0m
[32m[I 2022-10-26 22:34:55,643][0m --------------------            RidgeClassifier             --------------------[0m
[32m[I 2022-10-26 22:34:55,643][0m --------------------------------------------------------------------------------[0m
[32m[I 2022-10-26 22:34:55,673][0m A new study created in RDB with name: RidgeClassifier_c963b74b[0m
[32m[I 2022-10-26 22:34:55,679][0m Study started.[0m
[32m[I 2022-10-26 22:34:59,225][0m Trial 2 finished with value: 0.6848996760022037 and parameters: {'rc_C': 1.479760326433235, 'rc_tol': 0.0032156262350200963}. Best is trial 1 with value: 0.6849.[0m
[32m[I 2022-10-26 22:34:59,225][0m Trial 3 finished with value: 0.6848996760022037 and parameters: {'rc_C': 129877.13080831908, 'rc_tol': 0.0009266898175865344}. Best is trial 1 with value: 0.6849.[0m
[32m[I 2022-10-26 22:34:59,308][0m Trial 6 finished with value: 0.6848996760022037 and parameters: {'rc_C': 1037.9191102555965, 'rc_tol': 0.003379400645974363}. Best is trial 1 with value: 0.6849.[0m
[32m[I 2022-10-26 22:34:59,311][0m Trial 4 finished with value: 0.6848996760022037 and parameters: {'rc_C': 0.2589379028193112, 'rc_tol': 0.0024541031273084208}. Best is trial 0 with value: 0.6849.[0m
[32m[I 2022-10-26 22:34:59,395][0m Trial 5 finished with value: 0.6848996760022037 and parameters: {'rc_C': 39.109545775047565, 'rc_tol': 0.0027701398090270966}. Best is trial 1 with value: 0.6849.[0m
[32m[I 2022-10-26 22:34:59,472][0m Trial 1 finished with value: 0.6848996760022037 and parameters: {'rc_C': 3.393252087758006e-06, 'rc_tol': 0.0002559031386160057}. Best is trial 0 with value: 0.6849.[0m
[32m[I 2022-10-26 22:34:59,554][0m Trial 0 finished with value: 0.6848996760022037 and parameters: {'rc_C': 6.978828850967807e-05, 'rc_tol': 0.0015264468061449497}. Best is trial 0 with value: 0.6849.[0m
[32m[I 2022-10-26 22:34:59,626][0m Trial 7 finished with value: 0.6848996760022037 and parameters: {'rc_C': 16494.227755888747, 'rc_tol': 0.0017623462041485597}. Best is trial 0 with value: 0.6849.[0m
[32m[I 2022-10-26 22:35:03,257][0m Trial 10 finished with value: 0.6848996760022037 and parameters: {'rc_C': 0.00053942537709414, 'rc_tol': 0.0013980389113366662}. Best is trial 0 with value: 0.6849.[0m
[32m[I 2022-10-26 22:35:03,342][0m Trial 13 finished with value: 0.6848996760022037 and parameters: {'rc_C': 0.017405352789001648, 'rc_tol': 0.0005624488752146966}. Best is trial 0 with value: 0.6849.[0m
[32m[I 2022-10-26 22:35:03,422][0m Trial 14 finished with value: 0.6848996760022037 and parameters: {'rc_C': 7.756679490094262, 'rc_tol': 0.009261927646544816}. Best is trial 0 with value: 0.6849.[0m
[32m[I 2022-10-26 22:35:03,509][0m Trial 11 finished with value: 0.6848996760022037 and parameters: {'rc_C': 1.1015073008898546, 'rc_tol': 0.0029265356203128532}. Best is trial 0 with value: 0.6849.[0m
[32m[I 2022-10-26 22:35:03,514][0m Trial 9 finished with value: 0.6848996760022037 and parameters: {'rc_C': 55.69880824543993, 'rc_tol': 0.0015604294968619018}. Best is trial 0 with value: 0.6849.[0m
[32m[I 2022-10-26 22:35:03,583][0m Trial 15 finished with value: 0.6848996760022037 and parameters: {'rc_C': 1.2721543877018821e-05, 'rc_tol': 0.0011027492819905744}. Best is trial 0 with value: 0.6849.[0m
[32m[I 2022-10-26 22:35:03,734][0m Trial 12 finished with value: 0.6848996760022037 and parameters: {'rc_C': 0.3943865594894463, 'rc_tol': 0.001648356918660111}. Best is trial 0 with value: 0.6849.[0m
[32m[I 2022-10-26 22:35:03,839][0m Trial 8 finished with value: 0.6848996760022037 and parameters: {'rc_C': 0.006817120429267722, 'rc_tol': 0.00012240404851530538}. Best is trial 0 with value: 0.6849.[0m
[32m[I 2022-10-26 22:35:07,244][0m Trial 23 finished with value: 0.6848996760022037 and parameters: {'rc_C': 2.8385740299775806e-06, 'rc_tol': 0.0002984624713924251}. Best is trial 0 with value: 0.6849.[0m
[32m[I 2022-10-26 22:35:07,323][0m Trial 16 finished with value: 0.6848996760022037 and parameters: {'rc_C': 3.906721824909893e-06, 'rc_tol': 0.0002642875606314}. Best is trial 0 with value: 0.6849.[0m
[32m[I 2022-10-26 22:35:07,409][0m Trial 22 finished with value: 0.6848996760022037 and parameters: {'rc_C': 4.4278891619572205e-06, 'rc_tol': 0.00027652452840304137}. Best is trial 0 with value: 0.6849.[0m
[32m[I 2022-10-26 22:35:07,494][0m Trial 17 finished with value: 0.6848996760022037 and parameters: {'rc_C': 1.1222831518197568e-06, 'rc_tol': 0.0002041331466229403}. Best is trial 0 with value: 0.6849.[0m
[32m[I 2022-10-26 22:35:07,494][0m Trial 20 finished with value: 0.6848996760022037 and parameters: {'rc_C': 1.3155799930204553e-06, 'rc_tol': 0.0002761765463543873}. Best is trial 0 with value: 0.6849.[0m
[32m[I 2022-10-26 22:35:07,651][0m Trial 21 finished with value: 0.6848996760022037 and parameters: {'rc_C': 1.3286617651526199e-06, 'rc_tol': 0.00026946099903439635}. Best is trial 0 with value: 0.6849.[0m
[32m[I 2022-10-26 22:35:07,652][0m Trial 18 finished with value: 0.6848996760022037 and parameters: {'rc_C': 1.1613312312114805e-06, 'rc_tol': 0.00027574801255948766}. Best is trial 0 with value: 0.6849.[0m
[32m[I 2022-10-26 22:35:07,653][0m Trial 19 finished with value: 0.6848996760022037 and parameters: {'rc_C': 1.2708473466919037e-06, 'rc_tol': 0.0002762629989979954}. Best is trial 0 with value: 0.6849.[0m
[32m[I 2022-10-26 22:35:10,967][0m Trial 24 finished with value: 0.6848996760022037 and parameters: {'rc_C': 0.00011854485247948165, 'rc_tol': 0.0005046294926426561}. Best is trial 0 with value: 0.6849.[0m
[32m[I 2022-10-26 22:35:11,227][0m Trial 29 finished with value: 0.6848996760022037 and parameters: {'rc_C': 0.00011269740631551157, 'rc_tol': 0.0005093277960284552}. Best is trial 0 with value: 0.6849.[0m
[32m[I 2022-10-26 22:35:11,228][0m Trial 28 finished with value: 0.6848996760022037 and parameters: {'rc_C': 8.312722258214943e-05, 'rc_tol': 0.0005817332054382063}. Best is trial 0 with value: 0.6849.[0m
[32m[I 2022-10-26 22:35:11,397][0m Trial 25 finished with value: 0.6848996760022037 and parameters: {'rc_C': 0.00010117967797729616, 'rc_tol': 0.0005278110558636757}. Best is trial 0 with value: 0.6849.[0m
[32m[I 2022-10-26 22:35:11,398][0m Trial 27 finished with value: 0.6848996760022037 and parameters: {'rc_C': 0.00010060714749557723, 'rc_tol': 0.0005848939512446437}. Best is trial 0 with value: 0.6849.[0m
[32m[I 2022-10-26 22:35:11,557][0m Trial 31 finished with value: 0.6848996760022037 and parameters: {'rc_C': 0.00011221323457352539, 'rc_tol': 0.0005983470059445407}. Best is trial 0 with value: 0.6849.[0m
[32m[I 2022-10-26 22:35:11,557][0m Trial 26 finished with value: 0.6848996760022037 and parameters: {'rc_C': 7.835039748031854e-05, 'rc_tol': 0.0006546106562539014}. Best is trial 0 with value: 0.6849.[0m
[32m[I 2022-10-26 22:35:11,558][0m Trial 30 finished with value: 0.6848996760022037 and parameters: {'rc_C': 0.00011871163950797228, 'rc_tol': 0.0005089347820635151}. Best is trial 0 with value: 0.6849.[0m
[32m[I 2022-10-26 22:35:15,121][0m Trial 33 finished with value: 0.6848996760022037 and parameters: {'rc_C': 0.00371390205286201, 'rc_tol': 0.0009330417588590738}. Best is trial 0 with value: 0.6849.[0m
[32m[I 2022-10-26 22:35:15,122][0m Trial 35 finished with value: 0.6848996760022037 and parameters: {'rc_C': 0.0016636820756750572, 'rc_tol': 0.0008755889157890806}. Best is trial 0 with value: 0.6849.[0m
[32m[I 2022-10-26 22:35:15,123][0m Trial 32 finished with value: 0.6848996760022037 and parameters: {'rc_C': 0.0011465253665062822, 'rc_tol': 0.0003970730024506597}. Best is trial 0 with value: 0.6849.[0m
[32m[I 2022-10-26 22:35:15,202][0m Trial 34 finished with value: 0.6848996760022037 and parameters: {'rc_C': 0.0031752134871293487, 'rc_tol': 0.0007790203450111758}. Best is trial 0 with value: 0.6849.[0m
[32m[I 2022-10-26 22:35:15,274][0m Trial 37 finished with value: 0.6848996760022037 and parameters: {'rc_C': 0.002172411223758015, 'rc_tol': 0.0009123035318027376}. Best is trial 0 with value: 0.6849.[0m
[32m[I 2022-10-26 22:35:15,341][0m Trial 38 finished with value: 0.6848996760022037 and parameters: {'rc_C': 0.0015200341253458131, 'rc_tol': 0.0008644016577938994}. Best is trial 0 with value: 0.6849.[0m
[32m[I 2022-10-26 22:35:15,342][0m Trial 36 finished with value: 0.6848996760022037 and parameters: {'rc_C': 0.003864854650184267, 'rc_tol': 0.0009222846374986444}. Best is trial 0 with value: 0.6849.[0m
[32m[I 2022-10-26 22:35:15,344][0m Trial 39 finished with value: 0.6848996760022037 and parameters: {'rc_C': 0.0021055840071338094, 'rc_tol': 0.0008553923970630872}. Best is trial 0 with value: 0.6849.[0m
[32m[I 2022-10-26 22:35:19,056][0m Trial 40 finished with value: 0.6848996760022037 and parameters: {'rc_C': 1.1702619665736159e-05, 'rc_tol': 0.0001725197634921824}. Best is trial 0 with value: 0.6849.[0m
[32m[I 2022-10-26 22:35:19,056][0m Trial 46 finished with value: 0.6848996760022037 and parameters: {'rc_C': 1.5189455953481829e-05, 'rc_tol': 0.00015548328805789374}. Best is trial 0 with value: 0.6849.[0m
[32m[I 2022-10-26 22:35:19,060][0m Trial 44 finished with value: 0.6848996760022037 and parameters: {'rc_C': 1.1779637508792574e-05, 'rc_tol': 0.00016740763101155286}. Best is trial 0 with value: 0.6849.[0m
[32m[I 2022-10-26 22:35:19,060][0m Trial 43 finished with value: 0.6848996760022037 and parameters: {'rc_C': 0.04353624588245146, 'rc_tol': 0.00013065873629913662}. Best is trial 0 with value: 0.6849.[0m
[32m[I 2022-10-26 22:35:19,289][0m Trial 47 finished with value: 0.6848996760022037 and parameters: {'rc_C': 9.656736729543777e-06, 'rc_tol': 0.00016778461541963082}. Best is trial 0 with value: 0.6849.[0m
[32m[I 2022-10-26 22:35:19,441][0m Trial 45 finished with value: 0.6848996760022037 and parameters: {'rc_C': 1.1603489104862943e-05, 'rc_tol': 0.0001265861268384034}. Best is trial 0 with value: 0.6849.[0m
[32m[I 2022-10-26 22:35:19,442][0m Trial 42 finished with value: 0.6848996760022037 and parameters: {'rc_C': 1.3476233115861815e-05, 'rc_tol': 0.00016945773577542106}. Best is trial 0 with value: 0.6849.[0m
[32m[I 2022-10-26 22:35:19,588][0m Trial 41 finished with value: 0.6848996760022037 and parameters: {'rc_C': 1.36426228375062e-05, 'rc_tol': 0.00013571087610287873}. Best is trial 0 with value: 0.6849.[0m
[32m[I 2022-10-26 22:35:22,994][0m Trial 49 finished with value: 0.6848996760022037 and parameters: {'rc_C': 0.0003559303032537912, 'rc_tol': 0.00037967583746486314}. Best is trial 0 with value: 0.6849.[0m
[32m[I 2022-10-26 22:35:22,996][0m Trial 54 finished with value: 0.6848996760022037 and parameters: {'rc_C': 0.0004145674492412682, 'rc_tol': 0.0013074046876011673}. Best is trial 0 with value: 0.6849.[0m
[32m[I 2022-10-26 22:35:23,151][0m Trial 52 finished with value: 0.6848996760022037 and parameters: {'rc_C': 0.00038870018294624487, 'rc_tol': 0.00039424539083036725}. Best is trial 0 with value: 0.6849.[0m
[32m[I 2022-10-26 22:35:23,151][0m Trial 48 finished with value: 0.6848996760022037 and parameters: {'rc_C': 0.0003298893466878395, 'rc_tol': 0.0023447686530261996}. Best is trial 0 with value: 0.6849.[0m
[32m[I 2022-10-26 22:35:23,309][0m Trial 53 finished with value: 0.6848996760022037 and parameters: {'rc_C': 0.00037637842173890527, 'rc_tol': 0.0012346891803711156}. Best is trial 0 with value: 0.6849.[0m
[32m[I 2022-10-26 22:35:23,384][0m Trial 50 finished with value: 0.6848996760022037 and parameters: {'rc_C': 0.0002404747364554766, 'rc_tol': 0.00040139076189895517}. Best is trial 0 with value: 0.6849.[0m
[32m[I 2022-10-26 22:35:23,459][0m Trial 55 finished with value: 0.6848996760022037 and parameters: {'rc_C': 0.00037367907896883405, 'rc_tol': 0.0021431313305251202}. Best is trial 0 with value: 0.6849.[0m
[32m[I 2022-10-26 22:35:23,538][0m Trial 51 finished with value: 0.6848996760022037 and parameters: {'rc_C': 0.0003484603460268242, 'rc_tol': 0.0011925581164129195}. Best is trial 0 with value: 0.6849.[0m
[32m[I 2022-10-26 22:35:26,864][0m Trial 60 finished with value: 0.6848996760022037 and parameters: {'rc_C': 0.05538334623896952, 'rc_tol': 0.004166884765896768}. Best is trial 0 with value: 0.6849.[0m
[32m[I 2022-10-26 22:35:26,866][0m Trial 56 finished with value: 0.6848996760022037 and parameters: {'rc_C': 0.01606144303821499, 'rc_tol': 0.000712513115341492}. Best is trial 0 with value: 0.6849.[0m
[32m[I 2022-10-26 22:35:27,030][0m Trial 58 finished with value: 0.6848996760022037 and parameters: {'rc_C': 0.04412776071884564, 'rc_tol': 0.003926878134796604}. Best is trial 0 with value: 0.6849.[0m
[32m[I 2022-10-26 22:35:27,116][0m Trial 59 finished with value: 0.6848996760022037 and parameters: {'rc_C': 0.05960154464749878, 'rc_tol': 0.0007241554712677105}. Best is trial 0 with value: 0.6849.[0m
[32m[I 2022-10-26 22:35:27,122][0m Trial 57 finished with value: 0.6848996760022037 and parameters: {'rc_C': 0.06415542672253022, 'rc_tol': 0.0038916951340353277}. Best is trial 0 with value: 0.6849.[0m
[32m[I 2022-10-26 22:35:27,192][0m Trial 62 finished with value: 0.6848996760022037 and parameters: {'rc_C': 0.05121793269903745, 'rc_tol': 0.0007461524196319996}. Best is trial 0 with value: 0.6849.[0m
[32m[I 2022-10-26 22:35:27,260][0m Trial 61 finished with value: 0.6848996760022037 and parameters: {'rc_C': 0.025384199339501784, 'rc_tol': 0.0006981162725806677}. Best is trial 0 with value: 0.6849.[0m
[32m[I 2022-10-26 22:35:27,262][0m Trial 63 finished with value: 0.6848996760022037 and parameters: {'rc_C': 0.05151578521700875, 'rc_tol': 0.0006788472350972521}. Best is trial 0 with value: 0.6849.[0m
[32m[I 2022-10-26 22:35:30,821][0m Trial 64 finished with value: 0.6848996760022037 and parameters: {'rc_C': 0.0023906371063941202, 'rc_tol': 0.0008502172687769978}. Best is trial 0 with value: 0.6849.[0m
[32m[I 2022-10-26 22:35:30,912][0m Trial 66 finished with value: 0.6848996760022037 and parameters: {'rc_C': 0.0027049460107608047, 'rc_tol': 0.0008604466805587925}. Best is trial 0 with value: 0.6849.[0m
[32m[I 2022-10-26 22:35:31,003][0m Trial 67 finished with value: 0.6848996760022037 and parameters: {'rc_C': 0.0024060648305031626, 'rc_tol': 0.0008659856134673374}. Best is trial 0 with value: 0.6849.[0m
[32m[I 2022-10-26 22:35:31,010][0m Trial 71 finished with value: 0.6848996760022037 and parameters: {'rc_C': 0.0017572482545187649, 'rc_tol': 0.000860174026327172}. Best is trial 0 with value: 0.6849.[0m
[32m[I 2022-10-26 22:35:31,011][0m Trial 70 finished with value: 0.6848996760022037 and parameters: {'rc_C': 0.0017203168685240421, 'rc_tol': 0.0008414531999494195}. Best is trial 0 with value: 0.6849.[0m
[32m[I 2022-10-26 22:35:31,085][0m Trial 69 finished with value: 0.6848996760022037 and parameters: {'rc_C': 0.003007724469134354, 'rc_tol': 0.0009410725651455286}. Best is trial 0 with value: 0.6849.[0m
[32m[I 2022-10-26 22:35:31,089][0m Trial 68 finished with value: 0.6848996760022037 and parameters: {'rc_C': 0.0017587605390545966, 'rc_tol': 0.0008752844238404878}. Best is trial 0 with value: 0.6849.[0m
[32m[I 2022-10-26 22:35:31,157][0m Trial 65 finished with value: 0.6848996760022037 and parameters: {'rc_C': 0.0023690989704347864, 'rc_tol': 0.0008583137612170092}. Best is trial 0 with value: 0.6849.[0m
[32m[I 2022-10-26 22:35:34,737][0m Trial 75 finished with value: 0.6848996760022037 and parameters: {'rc_C': 4.342270167961199e-05, 'rc_tol': 0.000356928964358551}. Best is trial 0 with value: 0.6849.[0m
[32m[I 2022-10-26 22:35:34,847][0m Trial 73 finished with value: 0.6848996760022037 and parameters: {'rc_C': 622501.0918414047, 'rc_tol': 0.00034056700799819055}. Best is trial 0 with value: 0.6849.[0m
[32m[I 2022-10-26 22:35:34,850][0m Trial 74 finished with value: 0.6848996760022037 and parameters: {'rc_C': 5.091291161188519e-05, 'rc_tol': 0.0003689867313105931}. Best is trial 0 with value: 0.6849.[0m
[32m[I 2022-10-26 22:35:34,851][0m Trial 78 finished with value: 0.6848996760022037 and parameters: {'rc_C': 2.7648072156891912e-05, 'rc_tol': 0.0003531653063157161}. Best is trial 0 with value: 0.6849.[0m
[32m[I 2022-10-26 22:35:34,927][0m Trial 79 finished with value: 0.6848996760022037 and parameters: {'rc_C': 3.5811365435568924e-05, 'rc_tol': 0.0003706855878929956}. Best is trial 0 with value: 0.6849.[0m
[32m[I 2022-10-26 22:35:34,931][0m Trial 76 finished with value: 0.6848996760022037 and parameters: {'rc_C': 3.012776781831551e-05, 'rc_tol': 0.0003545383353607904}. Best is trial 0 with value: 0.6849.[0m
[32m[I 2022-10-26 22:35:35,005][0m Trial 72 finished with value: 0.6848996760022037 and parameters: {'rc_C': 2.8950309327872225e-05, 'rc_tol': 0.00010335001112269785}. Best is trial 0 with value: 0.6849.[0m
[32m[I 2022-10-26 22:35:35,304][0m Trial 77 finished with value: 0.6848996760022037 and parameters: {'rc_C': 3.484937640355111e-05, 'rc_tol': 0.00010386116526149579}. Best is trial 0 with value: 0.6849.[0m
[32m[I 2022-10-26 22:35:38,474][0m Trial 80 finished with value: 0.6848996760022037 and parameters: {'rc_C': 0.012991425363663482, 'rc_tol': 0.0012065164486176317}. Best is trial 0 with value: 0.6849.[0m
[32m[I 2022-10-26 22:35:38,739][0m Trial 84 finished with value: 0.6848996760022037 and parameters: {'rc_C': 0.009433828644466014, 'rc_tol': 0.0011972464591675717}. Best is trial 0 with value: 0.6849.[0m
[32m[I 2022-10-26 22:35:38,835][0m Trial 83 finished with value: 0.6848996760022037 and parameters: {'rc_C': 0.009718731908716267, 'rc_tol': 0.0012295878020125825}. Best is trial 0 with value: 0.6849.[0m
[32m[I 2022-10-26 22:35:38,920][0m Trial 87 finished with value: 0.6848996760022037 and parameters: {'rc_C': 3.6133462162694188, 'rc_tol': 0.001327507344624969}. Best is trial 0 with value: 0.6849.[0m
[32m[I 2022-10-26 22:35:39,005][0m Trial 85 finished with value: 0.6848996760022037 and parameters: {'rc_C': 0.010097642162510561, 'rc_tol': 0.0011940356168652303}. Best is trial 0 with value: 0.6849.[0m
[32m[I 2022-10-26 22:35:39,100][0m Trial 82 finished with value: 0.6848996760022037 and parameters: {'rc_C': 0.009318516528355313, 'rc_tol': 0.0011920853151517854}. Best is trial 0 with value: 0.6849.[0m
[32m[I 2022-10-26 22:35:39,101][0m Trial 86 finished with value: 0.6848996760022037 and parameters: {'rc_C': 0.00897648197282327, 'rc_tol': 0.0013828591951357333}. Best is trial 0 with value: 0.6849.[0m
[32m[I 2022-10-26 22:35:39,106][0m Trial 81 finished with value: 0.6848996760022037 and parameters: {'rc_C': 0.008515236088658692, 'rc_tol': 0.0011891315405918076}. Best is trial 0 with value: 0.6849.[0m
[32m[I 2022-10-26 22:35:42,321][0m Trial 88 finished with value: 0.6848996760022037 and parameters: {'rc_C': 0.21313616661085513, 'rc_tol': 0.004145847502961991}. Best is trial 0 with value: 0.6849.[0m
[32m[I 2022-10-26 22:35:42,654][0m Trial 92 finished with value: 0.6848996760022037 and parameters: {'rc_C': 0.0788018537434322, 'rc_tol': 0.003911959893008057}. Best is trial 0 with value: 0.6849.[0m
[32m[I 2022-10-26 22:35:42,655][0m Trial 95 finished with value: 0.6848996760022037 and parameters: {'rc_C': 0.06507767365733065, 'rc_tol': 0.004156394910050882}. Best is trial 0 with value: 0.6849.[0m
[32m[I 2022-10-26 22:35:42,819][0m Trial 89 finished with value: 0.6848996760022037 and parameters: {'rc_C': 0.08904731423787565, 'rc_tol': 0.004322637146879327}. Best is trial 0 with value: 0.6849.[0m
[32m[I 2022-10-26 22:35:42,821][0m Trial 90 finished with value: 0.6848996760022037 and parameters: {'rc_C': 0.08438795149070044, 'rc_tol': 0.004285750452434651}. Best is trial 0 with value: 0.6849.[0m
