[32m[I 2022-10-26 02:26:03,060][0m Trial 12 finished with value: 0.9997787209549761 and parameters: {'etsc_n_estimators': 90, 'etsc_criterion': 'gini', 'etsc_min_samples_split': 40, 'etsc_min_samples_leaf': 4, 'etsc_max_features': 7, 'etsc_bootstrap': False}. Best is trial 18 with value: 0.999968.[0m
[32m[I 2022-10-26 02:27:07,151][0m Trial 16 finished with value: 0.9928096268757103 and parameters: {'etsc_n_estimators': 140, 'etsc_criterion': 'entropy', 'etsc_min_samples_split': 7, 'etsc_min_samples_leaf': 20, 'etsc_max_features': 7, 'etsc_bootstrap': False}. Best is trial 18 with value: 0.999968.[0m
[32m[I 2022-10-26 02:27:18,804][0m Trial 20 finished with value: 0.9998557453223978 and parameters: {'etsc_n_estimators': 80, 'etsc_criterion': 'entropy', 'etsc_min_samples_split': 11, 'etsc_min_samples_leaf': 2, 'etsc_max_features': 7, 'etsc_bootstrap': False}. Best is trial 18 with value: 0.999968.[0m
[32m[I 2022-10-26 02:27:21,391][0m Trial 19 finished with value: 0.9999701655452788 and parameters: {'etsc_n_estimators': 80, 'etsc_criterion': 'entropy', 'etsc_min_samples_split': 12, 'etsc_min_samples_leaf': 1, 'etsc_max_features': 7, 'etsc_bootstrap': False}. Best is trial 19 with value: 0.99997.[0m
[32m[I 2022-10-26 02:27:38,326][0m Trial 21 finished with value: 0.9999701655452788 and parameters: {'etsc_n_estimators': 80, 'etsc_criterion': 'entropy', 'etsc_min_samples_split': 12, 'etsc_min_samples_leaf': 1, 'etsc_max_features': 7, 'etsc_bootstrap': False}. Best is trial 21 with value: 0.99997.[0m
[32m[I 2022-10-26 02:28:19,624][0m Trial 22 finished with value: 0.9998035624476304 and parameters: {'etsc_n_estimators': 90, 'etsc_criterion': 'entropy', 'etsc_min_samples_split': 11, 'etsc_min_samples_leaf': 4, 'etsc_max_features': 7, 'etsc_bootstrap': False}. Best is trial 19 with value: 0.99997.[0m
[32m[I 2022-10-26 02:28:48,566][0m Trial 27 finished with value: 0.9917821271413916 and parameters: {'etsc_n_estimators': 80, 'etsc_criterion': 'entropy', 'etsc_min_samples_split': 12, 'etsc_min_samples_leaf': 32, 'etsc_max_features': 6, 'etsc_bootstrap': False}. Best is trial 19 with value: 0.99997.[0m
[32m[I 2022-10-26 02:29:02,990][0m Trial 25 finished with value: 0.9999825961446517 and parameters: {'etsc_n_estimators': 70, 'etsc_criterion': 'gini', 'etsc_min_samples_split': 2, 'etsc_min_samples_leaf': 1, 'etsc_max_features': 7, 'etsc_bootstrap': False}. Best is trial 25 with value: 0.999983.[0m
[32m[I 2022-10-26 02:29:04,971][0m Trial 29 finished with value: 0.9924915840701235 and parameters: {'etsc_n_estimators': 70, 'etsc_criterion': 'entropy', 'etsc_min_samples_split': 11, 'etsc_min_samples_leaf': 14, 'etsc_max_features': 6, 'etsc_bootstrap': False}. Best is trial 25 with value: 0.999983.[0m
[32m[I 2022-10-26 02:29:09,737][0m Trial 24 finished with value: 0.9998482822864377 and parameters: {'etsc_n_estimators': 80, 'etsc_criterion': 'gini', 'etsc_min_samples_split': 3, 'etsc_min_samples_leaf': 2, 'etsc_max_features': 7, 'etsc_bootstrap': False}. Best is trial 25 with value: 0.999983.[0m
[32m[I 2022-10-26 02:29:47,066][0m Trial 30 finished with value: 0.9924915840701235 and parameters: {'etsc_n_estimators': 70, 'etsc_criterion': 'entropy', 'etsc_min_samples_split': 3, 'etsc_min_samples_leaf': 14, 'etsc_max_features': 6, 'etsc_bootstrap': False}. Best is trial 25 with value: 0.999983.[0m
[32m[I 2022-10-26 02:29:49,760][0m Trial 28 finished with value: 0.9998010704037624 and parameters: {'etsc_n_estimators': 80, 'etsc_criterion': 'entropy', 'etsc_min_samples_split': 11, 'etsc_min_samples_leaf': 3, 'etsc_max_features': 6, 'etsc_bootstrap': False}. Best is trial 25 with value: 0.999983.[0m
[32m[I 2022-10-26 02:30:14,598][0m Trial 26 finished with value: 0.9999701622943471 and parameters: {'etsc_n_estimators': 70, 'etsc_criterion': 'gini', 'etsc_min_samples_split': 11, 'etsc_min_samples_leaf': 1, 'etsc_max_features': 7, 'etsc_bootstrap': False}. Best is trial 25 with value: 0.999983.[0m
[32m[I 2022-10-26 02:30:32,893][0m Trial 32 finished with value: 0.990301737205501 and parameters: {'etsc_n_estimators': 70, 'etsc_criterion': 'entropy', 'etsc_min_samples_split': 2, 'etsc_min_samples_leaf': 15, 'etsc_max_features': 6, 'etsc_bootstrap': False}. Best is trial 25 with value: 0.999983.[0m
[32m[I 2022-10-26 02:31:13,181][0m Trial 36 finished with value: 0.9127948526560569 and parameters: {'etsc_n_estimators': 100, 'etsc_criterion': 'entropy', 'etsc_min_samples_split': 19, 'etsc_min_samples_leaf': 31, 'etsc_max_features': 5, 'etsc_bootstrap': False}. Best is trial 25 with value: 0.999983.[0m
[32m[I 2022-10-26 02:31:15,873][0m Trial 35 finished with value: 0.9320147822603952 and parameters: {'etsc_n_estimators': 100, 'etsc_criterion': 'entropy', 'etsc_min_samples_split': 30, 'etsc_min_samples_leaf': 17, 'etsc_max_features': 5, 'etsc_bootstrap': False}. Best is trial 25 with value: 0.999983.[0m
[32m[I 2022-10-26 02:31:18,406][0m Trial 33 finished with value: 0.9903594328427328 and parameters: {'etsc_n_estimators': 100, 'etsc_criterion': 'entropy', 'etsc_min_samples_split': 2, 'etsc_min_samples_leaf': 15, 'etsc_max_features': 6, 'etsc_bootstrap': False}. Best is trial 25 with value: 0.999983.[0m
[32m[I 2022-10-26 02:31:39,225][0m Trial 37 finished with value: 0.9232743670255044 and parameters: {'etsc_n_estimators': 100, 'etsc_criterion': 'entropy', 'etsc_min_samples_split': 18, 'etsc_min_samples_leaf': 29, 'etsc_max_features': 5, 'etsc_bootstrap': False}. Best is trial 25 with value: 0.999983.[0m
[32m[I 2022-10-26 02:31:53,988][0m Trial 31 finished with value: 0.9999751384334966 and parameters: {'etsc_n_estimators': 70, 'etsc_criterion': 'entropy', 'etsc_min_samples_split': 4, 'etsc_min_samples_leaf': 1, 'etsc_max_features': 6, 'etsc_bootstrap': False}. Best is trial 25 with value: 0.999983.[0m
[32m[I 2022-10-26 02:32:04,613][0m Trial 23 finished with value: 0.9999701635220528 and parameters: {'etsc_n_estimators': 150, 'etsc_criterion': 'gini', 'etsc_min_samples_split': 6, 'etsc_min_samples_leaf': 1, 'etsc_max_features': 7, 'etsc_bootstrap': False}. Best is trial 25 with value: 0.999983.[0m
[32m[I 2022-10-26 02:33:26,847][0m Trial 34 finished with value: 0.9925675116542513 and parameters: {'etsc_n_estimators': 200, 'etsc_criterion': 'entropy', 'etsc_min_samples_split': 30, 'etsc_min_samples_leaf': 14, 'etsc_max_features': 6, 'etsc_bootstrap': False}. Best is trial 25 with value: 0.999983.[0m
[32m[I 2022-10-26 02:33:48,417][0m Trial 45 finished with value: 0.6950742018218817 and parameters: {'etsc_n_estimators': 60, 'etsc_criterion': 'entropy', 'etsc_min_samples_split': 8, 'etsc_min_samples_leaf': 6, 'etsc_max_features': 3, 'etsc_bootstrap': False}. Best is trial 25 with value: 0.999983.[0m
[32m[I 2022-10-26 02:33:55,437][0m Trial 43 finished with value: 0.9989290331854966 and parameters: {'etsc_n_estimators': 60, 'etsc_criterion': 'entropy', 'etsc_min_samples_split': 7, 'etsc_min_samples_leaf': 5, 'etsc_max_features': 7, 'etsc_bootstrap': False}. Best is trial 25 with value: 0.999983.[0m
[32m[I 2022-10-26 02:33:56,790][0m Trial 38 finished with value: 0.9984668491895773 and parameters: {'etsc_n_estimators': 100, 'etsc_criterion': 'entropy', 'etsc_min_samples_split': 18, 'etsc_min_samples_leaf': 6, 'etsc_max_features': 7, 'etsc_bootstrap': False}. Best is trial 25 with value: 0.999983.[0m
[32m[I 2022-10-26 02:34:02,671][0m Trial 44 finished with value: 0.995010612116796 and parameters: {'etsc_n_estimators': 60, 'etsc_criterion': 'entropy', 'etsc_min_samples_split': 15, 'etsc_min_samples_leaf': 6, 'etsc_max_features': 7, 'etsc_bootstrap': False}. Best is trial 25 with value: 0.999983.[0m
[32m[I 2022-10-26 02:34:29,322][0m Trial 39 finished with value: 0.9959031060506298 and parameters: {'etsc_n_estimators': 100, 'etsc_criterion': 'entropy', 'etsc_min_samples_split': 29, 'etsc_min_samples_leaf': 6, 'etsc_max_features': 7, 'etsc_bootstrap': False}. Best is trial 25 with value: 0.999983.[0m
[32m[I 2022-10-26 02:34:48,577][0m Trial 40 finished with value: 0.9950280918909714 and parameters: {'etsc_n_estimators': 110, 'etsc_criterion': 'gini', 'etsc_min_samples_split': 16, 'etsc_min_samples_leaf': 6, 'etsc_max_features': 7, 'etsc_bootstrap': False}. Best is trial 25 with value: 0.999983.[0m
[32m[I 2022-10-26 02:35:14,405][0m Trial 42 finished with value: 0.9984869312588968 and parameters: {'etsc_n_estimators': 110, 'etsc_criterion': 'gini', 'etsc_min_samples_split': 22, 'etsc_min_samples_leaf': 6, 'etsc_max_features': 7, 'etsc_bootstrap': False}. Best is trial 25 with value: 0.999983.[0m
[32m[I 2022-10-26 02:37:00,404][0m Trial 47 finished with value: 0.9929835721457759 and parameters: {'etsc_n_estimators': 110, 'etsc_criterion': 'entropy', 'etsc_min_samples_split': 15, 'etsc_min_samples_leaf': 11, 'etsc_max_features': 7, 'etsc_bootstrap': False}. Best is trial 25 with value: 0.999983.[0m
[32m[I 2022-10-26 02:37:15,393][0m Trial 46 finished with value: 0.9950181595782014 and parameters: {'etsc_n_estimators': 110, 'etsc_criterion': 'entropy', 'etsc_min_samples_split': 16, 'etsc_min_samples_leaf': 6, 'etsc_max_features': 7, 'etsc_bootstrap': False}. Best is trial 25 with value: 0.999983.[0m
[32m[I 2022-10-26 02:37:49,313][0m Trial 50 finished with value: 0.990629321304767 and parameters: {'etsc_n_estimators': 160, 'etsc_criterion': 'gini', 'etsc_min_samples_split': 23, 'etsc_min_samples_leaf': 11, 'etsc_max_features': 6, 'etsc_bootstrap': False}. Best is trial 25 with value: 0.999983.[0m
[32m[I 2022-10-26 02:37:50,141][0m Trial 41 finished with value: 0.9984818510088609 and parameters: {'etsc_n_estimators': 200, 'etsc_criterion': 'gini', 'etsc_min_samples_split': 15, 'etsc_min_samples_leaf': 6, 'etsc_max_features': 7, 'etsc_bootstrap': False}. Best is trial 25 with value: 0.999983.[0m
[32m[I 2022-10-26 02:38:06,488][0m Trial 52 finished with value: 0.9927435506760013 and parameters: {'etsc_n_estimators': 150, 'etsc_criterion': 'gini', 'etsc_min_samples_split': 9, 'etsc_min_samples_leaf': 9, 'etsc_max_features': 6, 'etsc_bootstrap': True}. Best is trial 25 with value: 0.999983.[0m
[32m[I 2022-10-26 02:38:15,646][0m Trial 51 finished with value: 0.9917809646195628 and parameters: {'etsc_n_estimators': 160, 'etsc_criterion': 'gini', 'etsc_min_samples_split': 24, 'etsc_min_samples_leaf': 11, 'etsc_max_features': 6, 'etsc_bootstrap': False}. Best is trial 25 with value: 0.999983.[0m
[32m[I 2022-10-26 02:38:45,064][0m Trial 49 finished with value: 0.992976034089434 and parameters: {'etsc_n_estimators': 160, 'etsc_criterion': 'gini', 'etsc_min_samples_split': 15, 'etsc_min_samples_leaf': 11, 'etsc_max_features': 7, 'etsc_bootstrap': False}. Best is trial 25 with value: 0.999983.[0m
[32m[I 2022-10-26 02:38:53,479][0m Trial 48 finished with value: 0.9930744640606524 and parameters: {'etsc_n_estimators': 160, 'etsc_criterion': 'gini', 'etsc_min_samples_split': 15, 'etsc_min_samples_leaf': 8, 'etsc_max_features': 7, 'etsc_bootstrap': False}. Best is trial 25 with value: 0.999983.[0m
[32m[I 2022-10-26 02:40:01,408][0m Trial 58 finished with value: 0.9999229129195265 and parameters: {'etsc_n_estimators': 70, 'etsc_criterion': 'gini', 'etsc_min_samples_split': 9, 'etsc_min_samples_leaf': 1, 'etsc_max_features': 1, 'etsc_bootstrap': True}. Best is trial 25 with value: 0.999983.[0m
[32m[I 2022-10-26 02:40:13,124][0m Trial 53 finished with value: 0.9926431928633193 and parameters: {'etsc_n_estimators': 160, 'etsc_criterion': 'gini', 'etsc_min_samples_split': 8, 'etsc_min_samples_leaf': 11, 'etsc_max_features': 6, 'etsc_bootstrap': True}. Best is trial 25 with value: 0.999983.[0m
[32m[I 2022-10-26 02:40:25,447][0m Trial 54 finished with value: 0.9928578925907183 and parameters: {'etsc_n_estimators': 150, 'etsc_criterion': 'gini', 'etsc_min_samples_split': 8, 'etsc_min_samples_leaf': 8, 'etsc_max_features': 6, 'etsc_bootstrap': True}. Best is trial 25 with value: 0.999983.[0m
[32m[I 2022-10-26 02:40:46,079][0m Trial 55 finished with value: 0.9927285181705976 and parameters: {'etsc_n_estimators': 140, 'etsc_criterion': 'gini', 'etsc_min_samples_split': 8, 'etsc_min_samples_leaf': 9, 'etsc_max_features': 6, 'etsc_bootstrap': True}. Best is trial 25 with value: 0.999983.[0m
[32m[I 2022-10-26 02:41:02,424][0m Trial 56 finished with value: 0.9928578925907183 and parameters: {'etsc_n_estimators': 150, 'etsc_criterion': 'gini', 'etsc_min_samples_split': 9, 'etsc_min_samples_leaf': 8, 'etsc_max_features': 6, 'etsc_bootstrap': True}. Best is trial 25 with value: 0.999983.[0m
[32m[I 2022-10-26 02:41:05,360][0m Trial 60 finished with value: 0.9999676767272199 and parameters: {'etsc_n_estimators': 70, 'etsc_criterion': 'gini', 'etsc_min_samples_split': 5, 'etsc_min_samples_leaf': 1, 'etsc_max_features': 3, 'etsc_bootstrap': True}. Best is trial 25 with value: 0.999983.[0m
[32m[I 2022-10-26 02:41:26,791][0m Trial 59 finished with value: 0.999967679133476 and parameters: {'etsc_n_estimators': 70, 'etsc_criterion': 'gini', 'etsc_min_samples_split': 5, 'etsc_min_samples_leaf': 1, 'etsc_max_features': 7, 'etsc_bootstrap': True}. Best is trial 25 with value: 0.999983.[0m
[32m[I 2022-10-26 02:41:43,183][0m Trial 57 finished with value: 0.999965189094186 and parameters: {'etsc_n_estimators': 130, 'etsc_criterion': 'gini', 'etsc_min_samples_split': 4, 'etsc_min_samples_leaf': 1, 'etsc_max_features': 2, 'etsc_bootstrap': True}. Best is trial 25 with value: 0.999983.[0m
[32m[I 2022-10-26 02:41:52,187][0m Trial 61 finished with value: 0.9999751385494288 and parameters: {'etsc_n_estimators': 50, 'etsc_criterion': 'gini', 'etsc_min_samples_split': 4, 'etsc_min_samples_leaf': 1, 'etsc_max_features': 3, 'etsc_bootstrap': False}. Best is trial 25 with value: 0.999983.[0m
[32m[I 2022-10-26 02:42:19,665][0m Trial 69 finished with value: 0.7310199001741156 and parameters: {'etsc_n_estimators': 50, 'etsc_criterion': 'gini', 'etsc_min_samples_split': 6, 'etsc_min_samples_leaf': 3, 'etsc_max_features': 3, 'etsc_bootstrap': False}. Best is trial 25 with value: 0.999983.[0m
[32m[I 2022-10-26 02:42:25,213][0m Trial 62 finished with value: 0.9999676789497212 and parameters: {'etsc_n_estimators': 50, 'etsc_criterion': 'gini', 'etsc_min_samples_split': 5, 'etsc_min_samples_leaf': 1, 'etsc_max_features': 7, 'etsc_bootstrap': False}. Best is trial 25 with value: 0.999983.[0m
[32m[I 2022-10-26 02:42:37,928][0m Trial 64 finished with value: 0.9999701631038723 and parameters: {'etsc_n_estimators': 50, 'etsc_criterion': 'gini', 'etsc_min_samples_split': 5, 'etsc_min_samples_leaf': 1, 'etsc_max_features': 3, 'etsc_bootstrap': False}. Best is trial 25 with value: 0.999983.[0m
[32m[I 2022-10-26 02:43:10,469][0m Trial 71 finished with value: 0.6950742018218817 and parameters: {'etsc_n_estimators': 90, 'etsc_criterion': 'entropy', 'etsc_min_samples_split': 13, 'etsc_min_samples_leaf': 3, 'etsc_max_features': 2, 'etsc_bootstrap': False}. Best is trial 25 with value: 0.999983.[0m
[32m[I 2022-10-26 02:43:10,470][0m Trial 66 finished with value: 0.999820950250178 and parameters: {'etsc_n_estimators': 50, 'etsc_criterion': 'entropy', 'etsc_min_samples_split': 13, 'etsc_min_samples_leaf': 3, 'etsc_max_features': 7, 'etsc_bootstrap': False}. Best is trial 25 with value: 0.999983.[0m
[32m[I 2022-10-26 02:43:17,383][0m Trial 70 finished with value: 0.7871488955076361 and parameters: {'etsc_n_estimators': 90, 'etsc_criterion': 'gini', 'etsc_min_samples_split': 2, 'etsc_min_samples_leaf': 3, 'etsc_max_features': 3, 'etsc_bootstrap': False}. Best is trial 25 with value: 0.999983.[0m
[32m[I 2022-10-26 02:43:17,492][0m Trial 65 finished with value: 0.9999676789497212 and parameters: {'etsc_n_estimators': 50, 'etsc_criterion': 'gini', 'etsc_min_samples_split': 5, 'etsc_min_samples_leaf': 1, 'etsc_max_features': 7, 'etsc_bootstrap': False}. Best is trial 25 with value: 0.999983.[0m
[32m[I 2022-10-26 02:43:23,697][0m Trial 67 finished with value: 0.999820950250178 and parameters: {'etsc_n_estimators': 50, 'etsc_criterion': 'entropy', 'etsc_min_samples_split': 13, 'etsc_min_samples_leaf': 3, 'etsc_max_features': 7, 'etsc_bootstrap': False}. Best is trial 25 with value: 0.999983.[0m
[32m[I 2022-10-26 02:43:29,957][0m Trial 72 finished with value: 0.7735901151656097 and parameters: {'etsc_n_estimators': 90, 'etsc_criterion': 'entropy', 'etsc_min_samples_split': 13, 'etsc_min_samples_leaf': 3, 'etsc_max_features': 3, 'etsc_bootstrap': False}. Best is trial 25 with value: 0.999983.[0m
[32m[I 2022-10-26 02:43:40,921][0m Trial 73 finished with value: 0.6950742018218817 and parameters: {'etsc_n_estimators': 60, 'etsc_criterion': 'gini', 'etsc_min_samples_split': 2, 'etsc_min_samples_leaf': 4, 'etsc_max_features': 3, 'etsc_bootstrap': False}. Best is trial 25 with value: 0.999983.[0m
[32m[I 2022-10-26 02:43:41,187][0m Trial 74 finished with value: 0.6950742018218817 and parameters: {'etsc_n_estimators': 60, 'etsc_criterion': 'gini', 'etsc_min_samples_split': 2, 'etsc_min_samples_leaf': 4, 'etsc_max_features': 3, 'etsc_bootstrap': False}. Best is trial 25 with value: 0.999983.[0m
[32m[I 2022-10-26 02:43:42,050][0m Trial 68 finished with value: 0.9998433178544374 and parameters: {'etsc_n_estimators': 50, 'etsc_criterion': 'gini', 'etsc_min_samples_split': 6, 'etsc_min_samples_leaf': 3, 'etsc_max_features': 7, 'etsc_bootstrap': False}. Best is trial 25 with value: 0.999983.[0m
[32m[I 2022-10-26 02:44:09,343][0m Trial 77 finished with value: 0.718233089516913 and parameters: {'etsc_n_estimators': 80, 'etsc_criterion': 'entropy', 'etsc_min_samples_split': 3, 'etsc_min_samples_leaf': 36, 'etsc_max_features': 4, 'etsc_bootstrap': False}. Best is trial 25 with value: 0.999983.[0m
[32m[I 2022-10-26 02:44:12,015][0m Trial 75 finished with value: 0.8738091142098977 and parameters: {'etsc_n_estimators': 60, 'etsc_criterion': 'entropy', 'etsc_min_samples_split': 3, 'etsc_min_samples_leaf': 4, 'etsc_max_features': 4, 'etsc_bootstrap': False}. Best is trial 25 with value: 0.999983.[0m
[32m[I 2022-10-26 02:44:13,566][0m Trial 76 finished with value: 0.8738091142098977 and parameters: {'etsc_n_estimators': 60, 'etsc_criterion': 'entropy', 'etsc_min_samples_split': 3, 'etsc_min_samples_leaf': 4, 'etsc_max_features': 4, 'etsc_bootstrap': False}. Best is trial 25 with value: 0.999983.[0m
[32m[I 2022-10-26 02:44:28,270][0m Trial 80 finished with value: 0.718394978126482 and parameters: {'etsc_n_estimators': 80, 'etsc_criterion': 'gini', 'etsc_min_samples_split': 10, 'etsc_min_samples_leaf': 42, 'etsc_max_features': 4, 'etsc_bootstrap': False}. Best is trial 25 with value: 0.999983.[0m
[32m[I 2022-10-26 02:44:29,043][0m Trial 81 finished with value: 0.7175406878908211 and parameters: {'etsc_n_estimators': 80, 'etsc_criterion': 'gini', 'etsc_min_samples_split': 4, 'etsc_min_samples_leaf': 40, 'etsc_max_features': 4, 'etsc_bootstrap': False}. Best is trial 25 with value: 0.999983.[0m
[32m[I 2022-10-26 02:44:34,986][0m Trial 83 finished with value: 0.6950742018218817 and parameters: {'etsc_n_estimators': 70, 'etsc_criterion': 'gini', 'etsc_min_samples_split': 10, 'etsc_min_samples_leaf': 26, 'etsc_max_features': 2, 'etsc_bootstrap': False}. Best is trial 25 with value: 0.999983.[0m
[32m[I 2022-10-26 02:44:39,944][0m Trial 84 finished with value: 0.6950742018218817 and parameters: {'etsc_n_estimators': 80, 'etsc_criterion': 'gini', 'etsc_min_samples_split': 10, 'etsc_min_samples_leaf': 25, 'etsc_max_features': 2, 'etsc_bootstrap': False}. Best is trial 25 with value: 0.999983.[0m
[32m[I 2022-10-26 02:44:39,944][0m Trial 78 finished with value: 0.8317248365940139 and parameters: {'etsc_n_estimators': 80, 'etsc_criterion': 'gini', 'etsc_min_samples_split': 3, 'etsc_min_samples_leaf': 4, 'etsc_max_features': 4, 'etsc_bootstrap': False}. Best is trial 25 with value: 0.999983.[0m
[32m[I 2022-10-26 02:44:50,363][0m Trial 79 finished with value: 0.8285802288957558 and parameters: {'etsc_n_estimators': 80, 'etsc_criterion': 'gini', 'etsc_min_samples_split': 10, 'etsc_min_samples_leaf': 4, 'etsc_max_features': 4, 'etsc_bootstrap': False}. Best is trial 25 with value: 0.999983.[0m
[32m[I 2022-10-26 02:45:06,105][0m Trial 85 finished with value: 0.6950742018218817 and parameters: {'etsc_n_estimators': 70, 'etsc_criterion': 'gini', 'etsc_min_samples_split': 10, 'etsc_min_samples_leaf': 2, 'etsc_max_features': 2, 'etsc_bootstrap': False}. Best is trial 25 with value: 0.999983.[0m
[32m[I 2022-10-26 02:45:07,173][0m Trial 82 finished with value: 0.7798347992192807 and parameters: {'etsc_n_estimators': 80, 'etsc_criterion': 'gini', 'etsc_min_samples_split': 10, 'etsc_min_samples_leaf': 5, 'etsc_max_features': 4, 'etsc_bootstrap': False}. Best is trial 25 with value: 0.999983.[0m
[32m[I 2022-10-26 02:45:20,122][0m Trial 63 finished with value: 0.999975136536856 and parameters: {'etsc_n_estimators': 130, 'etsc_criterion': 'gini', 'etsc_min_samples_split': 5, 'etsc_min_samples_leaf': 1, 'etsc_max_features': 3, 'etsc_bootstrap': False}. Best is trial 25 with value: 0.999983.[0m
[32m[I 2022-10-26 02:45:26,422][0m Trial 86 finished with value: 0.869934328449618 and parameters: {'etsc_n_estimators': 70, 'etsc_criterion': 'gini', 'etsc_min_samples_split': 7, 'etsc_min_samples_leaf': 50, 'etsc_max_features': 5, 'etsc_bootstrap': False}. Best is trial 25 with value: 0.999983.[0m
[32m[I 2022-10-26 02:47:14,065][0m Trial 90 finished with value: 0.9998433351932919 and parameters: {'etsc_n_estimators': 70, 'etsc_criterion': 'gini', 'etsc_min_samples_split': 7, 'etsc_min_samples_leaf': 2, 'etsc_max_features': 7, 'etsc_bootstrap': True}. Best is trial 25 with value: 0.999983.[0m
