[32m[I 2022-10-25 23:27:12,612][0m Trial 99 finished with value: 0.7559731367235444 and parameters: {'abc_n_estimators': 75, 'abc_learning_rate': 0.0007427720312634653}. Best is trial 99 with value: 0.755973.[0m
[32m[I 2022-10-25 23:27:16,054][0m Trial 98 finished with value: 0.7559731367235444 and parameters: {'abc_n_estimators': 80, 'abc_learning_rate': 0.0014670245931108301}. Best is trial 99 with value: 0.755973.[0m
[32m[I 2022-10-25 23:27:16,121][0m Study finished.[0m
[32m[I 2022-10-25 23:27:16,133][0m --------------------------------------------------------------------------------[0m
[32m[I 2022-10-25 23:27:16,134][0m --------------------           AdaGradClassifier            --------------------[0m
[32m[I 2022-10-25 23:27:16,135][0m --------------------------------------------------------------------------------[0m
[32m[I 2022-10-25 23:27:16,163][0m A new study created in RDB with name: AdaGradClassifier_c963b74b[0m
[32m[I 2022-10-25 23:27:16,170][0m Study started.[0m
[32m[I 2022-10-25 23:30:26,898][0m Trial 2 finished with value: 0.7548179063435468 and parameters: {'agc_alpha': 214.54337798539652, 'agc_l1_ratio': 0.4, 'agc_loss': 'modified_huber'}. Best is trial 2 with value: 0.769993.[0m
[32m[I 2022-10-25 23:30:26,900][0m Trial 1 finished with value: 1.5322517778019187e-05 and parameters: {'agc_alpha': 0.002934365073709792, 'agc_l1_ratio': 0.4, 'agc_loss': 'squared'}. Best is trial 2 with value: 0.769993.[0m
[32m[I 2022-10-25 23:30:26,984][0m Trial 0 finished with value: 0.14609613061680257 and parameters: {'agc_alpha': 101.28707098585409, 'agc_l1_ratio': 0.8, 'agc_loss': 'log'}. Best is trial 2 with value: 0.769993.[0m
[32m[I 2022-10-25 23:30:27,060][0m Trial 4 finished with value: 1.5322520003945214e-05 and parameters: {'agc_alpha': 0.31894332689233873, 'agc_l1_ratio': 0.0, 'agc_loss': 'squared'}. Best is trial 5 with value: 0.769993.[0m
[32m[I 2022-10-25 23:30:27,138][0m Trial 7 finished with value: 0.7362671390843327 and parameters: {'agc_alpha': 0.0022070608614239507, 'agc_l1_ratio': 0.0, 'agc_loss': 'perceptron'}. Best is trial 5 with value: 0.769993.[0m
[32m[I 2022-10-25 23:30:27,207][0m Trial 6 finished with value: 0.6986024501803075 and parameters: {'agc_alpha': 0.01650324063507923, 'agc_l1_ratio': 0.1, 'agc_loss': 'squared_hinge'}. Best is trial 5 with value: 0.769993.[0m
[32m[I 2022-10-25 23:30:27,354][0m Trial 3 finished with value: 0.7671444938263039 and parameters: {'agc_alpha': 1.5555576061644625, 'agc_l1_ratio': 0.9, 'agc_loss': 'hinge'}. Best is trial 5 with value: 0.769993.[0m
[32m[I 2022-10-25 23:30:27,357][0m Trial 5 finished with value: 0.7699926090577461 and parameters: {'agc_alpha': 26.270927682702816, 'agc_l1_ratio': 0.4, 'agc_loss': 'smooth_hinge'}. Best is trial 5 with value: 0.769993.[0m
[32m[I 2022-10-25 23:33:32,717][0m Trial 11 finished with value: 0.7165344542948663 and parameters: {'agc_alpha': 0.010321250706035609, 'agc_l1_ratio': 0.5, 'agc_loss': 'hinge'}. Best is trial 5 with value: 0.769993.[0m
[32m[I 2022-10-25 23:33:32,717][0m Trial 13 finished with value: 1.5322517778019187e-05 and parameters: {'agc_alpha': 0.16841217955735305, 'agc_l1_ratio': 0.1, 'agc_loss': 'squared'}. Best is trial 5 with value: 0.769993.[0m
[32m[I 2022-10-25 23:33:32,867][0m Trial 12 finished with value: 0.7102213956959543 and parameters: {'agc_alpha': 215.45501703255434, 'agc_l1_ratio': 0.0, 'agc_loss': 'log'}. Best is trial 14 with value: 0.776225.[0m
[32m[I 2022-10-25 23:33:32,938][0m Trial 15 finished with value: 0.7508999518042181 and parameters: {'agc_alpha': 0.0018797623949266269, 'agc_l1_ratio': 0.5, 'agc_loss': 'smooth_hinge'}. Best is trial 14 with value: 0.776225.[0m
[32m[I 2022-10-25 23:33:33,001][0m Trial 8 finished with value: 0.7408407984613737 and parameters: {'agc_alpha': 0.010230188910278045, 'agc_l1_ratio': 1.0, 'agc_loss': 'modified_huber'}. Best is trial 14 with value: 0.776225.[0m
[32m[I 2022-10-25 23:33:33,002][0m Trial 10 finished with value: 0.7259009463639345 and parameters: {'agc_alpha': 0.04106092058635676, 'agc_l1_ratio': 1.0, 'agc_loss': 'smooth_hinge'}. Best is trial 14 with value: 0.776225.[0m
[32m[I 2022-10-25 23:33:33,002][0m Trial 9 finished with value: 0.7327832101497784 and parameters: {'agc_alpha': 14.871186786506472, 'agc_l1_ratio': 0.6000000000000001, 'agc_loss': 'perceptron'}. Best is trial 14 with value: 0.776225.[0m
[32m[I 2022-10-25 23:33:33,215][0m Trial 14 finished with value: 0.7762245462610979 and parameters: {'agc_alpha': 4.615257743121082, 'agc_l1_ratio': 0.9, 'agc_loss': 'hinge'}. Best is trial 14 with value: 0.776225.[0m
[32m[I 2022-10-25 23:36:31,534][0m Trial 19 finished with value: 0.7620369981604073 and parameters: {'agc_alpha': 8.906434536367588, 'agc_l1_ratio': 0.7000000000000001, 'agc_loss': 'smooth_hinge'}. Best is trial 14 with value: 0.776225.[0m
[32m[I 2022-10-25 23:36:31,610][0m Trial 20 finished with value: 0.7682531037269638 and parameters: {'agc_alpha': 10.877410065996939, 'agc_l1_ratio': 0.7000000000000001, 'agc_loss': 'smooth_hinge'}. Best is trial 14 with value: 0.776225.[0m
[32m[I 2022-10-25 23:36:31,619][0m Trial 17 finished with value: 0.7727695069859725 and parameters: {'agc_alpha': 7.477581339112061, 'agc_l1_ratio': 0.7000000000000001, 'agc_loss': 'smooth_hinge'}. Best is trial 14 with value: 0.776225.[0m
[32m[I 2022-10-25 23:36:31,619][0m Trial 22 finished with value: 0.7762226714958427 and parameters: {'agc_alpha': 6.457759547892375, 'agc_l1_ratio': 0.7000000000000001, 'agc_loss': 'hinge'}. Best is trial 14 with value: 0.776225.[0m
[32m[I 2022-10-25 23:36:31,861][0m Trial 21 finished with value: 0.7644046898988627 and parameters: {'agc_alpha': 7.9710837342777845, 'agc_l1_ratio': 0.7000000000000001, 'agc_loss': 'hinge'}. Best is trial 14 with value: 0.776225.[0m
[32m[I 2022-10-25 23:36:31,863][0m Trial 18 finished with value: 0.7660892627231264 and parameters: {'agc_alpha': 6.080508390141192, 'agc_l1_ratio': 0.7000000000000001, 'agc_loss': 'hinge'}. Best is trial 14 with value: 0.776225.[0m
[32m[I 2022-10-25 23:36:31,864][0m Trial 16 finished with value: 0.7601888746092764 and parameters: {'agc_alpha': 8.745325502766294, 'agc_l1_ratio': 0.7000000000000001, 'agc_loss': 'hinge'}. Best is trial 14 with value: 0.776225.[0m
[32m[I 2022-10-25 23:36:31,989][0m Trial 23 finished with value: 0.7750265732363322 and parameters: {'agc_alpha': 7.1668314728051845, 'agc_l1_ratio': 0.7000000000000001, 'agc_loss': 'smooth_hinge'}. Best is trial 14 with value: 0.776225.[0m
[32m[I 2022-10-25 23:39:29,537][0m Trial 25 finished with value: 0.699871381233784 and parameters: {'agc_alpha': 1.3507922613894283, 'agc_l1_ratio': 0.9, 'agc_loss': 'squared_hinge'}. Best is trial 14 with value: 0.776909.[0m
[32m[I 2022-10-25 23:39:29,539][0m Trial 29 finished with value: 0.7112163922443778 and parameters: {'agc_alpha': 1.058589479977194, 'agc_l1_ratio': 0.9, 'agc_loss': 'squared_hinge'}. Best is trial 14 with value: 0.776909.[0m
[32m[I 2022-10-25 23:39:29,741][0m Trial 26 finished with value: 0.7634715617887569 and parameters: {'agc_alpha': 971.931480431351, 'agc_l1_ratio': 0.9, 'agc_loss': 'squared_hinge'}. Best is trial 30 with value: 0.776909.[0m
[32m[I 2022-10-25 23:39:29,742][0m Trial 31 finished with value: 0.6998733771685425 and parameters: {'agc_alpha': 1.402609786746642, 'agc_l1_ratio': 0.9, 'agc_loss': 'squared_hinge'}. Best is trial 30 with value: 0.776909.[0m
[32m[I 2022-10-25 23:39:29,812][0m Trial 30 finished with value: 0.7769091682878234 and parameters: {'agc_alpha': 1.312991899077757, 'agc_l1_ratio': 0.9, 'agc_loss': 'hinge'}. Best is trial 30 with value: 0.776909.[0m
[32m[I 2022-10-25 23:39:29,940][0m Trial 27 finished with value: 0.699871381233784 and parameters: {'agc_alpha': 1.367325993685597, 'agc_l1_ratio': 0.9, 'agc_loss': 'squared_hinge'}. Best is trial 30 with value: 0.776909.[0m
[32m[I 2022-10-25 23:39:29,943][0m Trial 28 finished with value: 0.7113423530028025 and parameters: {'agc_alpha': 1.834360653809976, 'agc_l1_ratio': 0.9, 'agc_loss': 'squared_hinge'}. Best is trial 30 with value: 0.776909.[0m
[32m[I 2022-10-25 23:39:30,072][0m Trial 24 finished with value: 0.7121721008624253 and parameters: {'agc_alpha': 0.9080303459166194, 'agc_l1_ratio': 0.9, 'agc_loss': 'squared_hinge'}. Best is trial 30 with value: 0.776909.[0m
[32m[I 2022-10-25 23:42:35,186][0m Trial 32 finished with value: 0.7244754762110556 and parameters: {'agc_alpha': 36.70443639356305, 'agc_l1_ratio': 0.8, 'agc_loss': 'hinge'}. Best is trial 30 with value: 0.776909.[0m
[32m[I 2022-10-25 23:42:35,258][0m Trial 34 finished with value: 0.7751303025952676 and parameters: {'agc_alpha': 28.793874097122746, 'agc_l1_ratio': 0.8, 'agc_loss': 'hinge'}. Best is trial 30 with value: 0.776909.[0m
[32m[I 2022-10-25 23:42:35,259][0m Trial 39 finished with value: 0.7236006186436972 and parameters: {'agc_alpha': 34.876552972789405, 'agc_l1_ratio': 0.8, 'agc_loss': 'hinge'}. Best is trial 30 with value: 0.776909.[0m
[32m[I 2022-10-25 23:42:35,411][0m Trial 33 finished with value: 0.7594283207768404 and parameters: {'agc_alpha': 46.160239346228785, 'agc_l1_ratio': 0.8, 'agc_loss': 'hinge'}. Best is trial 30 with value: 0.776909.[0m
[32m[I 2022-10-25 23:42:35,412][0m Trial 36 finished with value: 0.701204322362412 and parameters: {'agc_alpha': 61.579175802832886, 'agc_l1_ratio': 0.8, 'agc_loss': 'hinge'}. Best is trial 30 with value: 0.776909.[0m
[32m[I 2022-10-25 23:42:35,483][0m Trial 35 finished with value: 0.7553440670246336 and parameters: {'agc_alpha': 50.618907079339465, 'agc_l1_ratio': 0.8, 'agc_loss': 'hinge'}. Best is trial 30 with value: 0.776909.[0m
[32m[I 2022-10-25 23:42:35,623][0m Trial 38 finished with value: 0.7237503980937597 and parameters: {'agc_alpha': 38.42919467045847, 'agc_l1_ratio': 0.8, 'agc_loss': 'hinge'}. Best is trial 30 with value: 0.776909.[0m
[32m[I 2022-10-25 23:42:35,626][0m Trial 37 finished with value: 0.7245165144576267 and parameters: {'agc_alpha': 35.054193876154926, 'agc_l1_ratio': 0.8, 'agc_loss': 'hinge'}. Best is trial 30 with value: 0.776909.[0m
[32m[I 2022-10-25 23:45:46,839][0m Trial 46 finished with value: 0.7389006742624836 and parameters: {'agc_alpha': 2.912854619066904, 'agc_l1_ratio': 0.6000000000000001, 'agc_loss': 'modified_huber'}. Best is trial 30 with value: 0.776909.[0m
[32m[I 2022-10-25 23:45:46,841][0m Trial 40 finished with value: 0.7396888348226881 and parameters: {'agc_alpha': 3.1722684765611704, 'agc_l1_ratio': 0.6000000000000001, 'agc_loss': 'modified_huber'}. Best is trial 30 with value: 0.776909.[0m
[32m[I 2022-10-25 23:45:46,843][0m Trial 45 finished with value: 0.7393287187142521 and parameters: {'agc_alpha': 3.427294515061265, 'agc_l1_ratio': 0.6000000000000001, 'agc_loss': 'modified_huber'}. Best is trial 30 with value: 0.776909.[0m
[32m[I 2022-10-25 23:45:46,844][0m Trial 47 finished with value: 0.7389647975380631 and parameters: {'agc_alpha': 3.1864255162922435, 'agc_l1_ratio': 0.6000000000000001, 'agc_loss': 'modified_huber'}. Best is trial 30 with value: 0.776909.[0m
[32m[I 2022-10-25 23:45:47,015][0m Trial 43 finished with value: 0.7264572304341144 and parameters: {'agc_alpha': 3.228304834368886, 'agc_l1_ratio': 0.6000000000000001, 'agc_loss': 'modified_huber'}. Best is trial 30 with value: 0.776909.[0m
[32m[I 2022-10-25 23:45:47,018][0m Trial 42 finished with value: 0.7403174498768083 and parameters: {'agc_alpha': 3.053772004086117, 'agc_l1_ratio': 0.6000000000000001, 'agc_loss': 'modified_huber'}. Best is trial 30 with value: 0.776909.[0m
[32m[I 2022-10-25 23:45:47,103][0m Trial 41 finished with value: 0.745847647455658 and parameters: {'agc_alpha': 0.37289122456288204, 'agc_l1_ratio': 0.6000000000000001, 'agc_loss': 'modified_huber'}. Best is trial 30 with value: 0.776909.[0m
[32m[I 2022-10-25 23:45:47,105][0m Trial 44 finished with value: 0.7196930349548882 and parameters: {'agc_alpha': 3.4416100943033534, 'agc_l1_ratio': 0.6000000000000001, 'agc_loss': 'modified_huber'}. Best is trial 30 with value: 0.776909.[0m
[32m[I 2022-10-25 23:49:47,097][0m Trial 48 finished with value: 0.14510470151102717 and parameters: {'agc_alpha': 121.55094407639193, 'agc_l1_ratio': 1.0, 'agc_loss': 'log'}. Best is trial 30 with value: 0.776909.[0m
[32m[I 2022-10-25 23:49:47,208][0m Trial 52 finished with value: 0.14525887688717642 and parameters: {'agc_alpha': 135.9223595991958, 'agc_l1_ratio': 1.0, 'agc_loss': 'log'}. Best is trial 30 with value: 0.776909.[0m
[32m[I 2022-10-25 23:49:47,208][0m Trial 50 finished with value: 0.14533170245098706 and parameters: {'agc_alpha': 198.4796159041844, 'agc_l1_ratio': 1.0, 'agc_loss': 'log'}. Best is trial 30 with value: 0.776909.[0m
[32m[I 2022-10-25 23:49:47,302][0m Trial 55 finished with value: 0.14508355012216492 and parameters: {'agc_alpha': 113.09088249244357, 'agc_l1_ratio': 1.0, 'agc_loss': 'log'}. Best is trial 30 with value: 0.776909.[0m
[32m[I 2022-10-25 23:49:47,304][0m Trial 49 finished with value: 0.14521980607715726 and parameters: {'agc_alpha': 137.68354262167273, 'agc_l1_ratio': 1.0, 'agc_loss': 'log'}. Best is trial 30 with value: 0.776909.[0m
[32m[I 2022-10-25 23:49:47,307][0m Trial 53 finished with value: 0.7759034664823379 and parameters: {'agc_alpha': 18.21712464459926, 'agc_l1_ratio': 1.0, 'agc_loss': 'log'}. Best is trial 30 with value: 0.776909.[0m
[32m[I 2022-10-25 23:49:47,581][0m Trial 54 finished with value: 0.1453363373838257 and parameters: {'agc_alpha': 167.7742631062154, 'agc_l1_ratio': 1.0, 'agc_loss': 'log'}. Best is trial 30 with value: 0.776909.[0m
[32m[I 2022-10-25 23:49:47,774][0m Trial 51 finished with value: 0.775961736717687 and parameters: {'agc_alpha': 17.5154409920571, 'agc_l1_ratio': 1.0, 'agc_loss': 'log'}. Best is trial 30 with value: 0.776909.[0m
[32m[I 2022-10-25 23:53:17,024][0m Trial 59 finished with value: 2.2825475202498058e-05 and parameters: {'agc_alpha': 16.541321042731497, 'agc_l1_ratio': 0.9, 'agc_loss': 'squared'}. Best is trial 56 with value: 0.777301.[0m
[32m[I 2022-10-25 23:53:17,126][0m Trial 60 finished with value: 0.7679655031969571 and parameters: {'agc_alpha': 20.4726531518661, 'agc_l1_ratio': 0.30000000000000004, 'agc_loss': 'perceptron'}. Best is trial 56 with value: 0.777301.[0m
[32m[I 2022-10-25 23:53:17,231][0m Trial 63 finished with value: 0.7084604761409182 and parameters: {'agc_alpha': 0.5794167682517913, 'agc_l1_ratio': 0.30000000000000004, 'agc_loss': 'perceptron'}. Best is trial 56 with value: 0.777301.[0m
[32m[I 2022-10-25 23:53:17,234][0m Trial 56 finished with value: 0.7773008196659459 and parameters: {'agc_alpha': 17.842723395098247, 'agc_l1_ratio': 0.30000000000000004, 'agc_loss': 'perceptron'}. Best is trial 56 with value: 0.777301.[0m
[32m[I 2022-10-25 23:53:17,336][0m Trial 58 finished with value: 0.6954410660367396 and parameters: {'agc_alpha': 14.270315628346156, 'agc_l1_ratio': 0.2, 'agc_loss': 'perceptron'}. Best is trial 56 with value: 0.777301.[0m
[32m[I 2022-10-25 23:53:17,532][0m Trial 61 finished with value: 0.6983347910479089 and parameters: {'agc_alpha': 17.749877720503083, 'agc_l1_ratio': 0.2, 'agc_loss': 'perceptron'}. Best is trial 56 with value: 0.777301.[0m
[32m[I 2022-10-25 23:53:17,635][0m Trial 57 finished with value: 0.7163863257316265 and parameters: {'agc_alpha': 0.5463217866603715, 'agc_l1_ratio': 0.30000000000000004, 'agc_loss': 'perceptron'}. Best is trial 56 with value: 0.777301.[0m
[32m[I 2022-10-25 23:53:17,735][0m Trial 62 finished with value: 0.7138954194012803 and parameters: {'agc_alpha': 0.3160781734114988, 'agc_l1_ratio': 0.4, 'agc_loss': 'perceptron'}. Best is trial 56 with value: 0.777301.[0m
[32m[I 2022-10-25 23:56:54,097][0m Trial 67 finished with value: 0.6955697316950604 and parameters: {'agc_alpha': 335.9137110969035, 'agc_l1_ratio': 0.5, 'agc_loss': 'hinge'}. Best is trial 56 with value: 0.777301.[0m
[32m[I 2022-10-25 23:56:54,409][0m Trial 69 finished with value: 0.7779284168269525 and parameters: {'agc_alpha': 5.618971848693605, 'agc_l1_ratio': 0.5, 'agc_loss': 'hinge'}. Best is trial 66 with value: 0.780046.[0m
[32m[I 2022-10-25 23:56:54,509][0m Trial 71 finished with value: 0.6961620766703533 and parameters: {'agc_alpha': 374.7717363212116, 'agc_l1_ratio': 0.5, 'agc_loss': 'hinge'}. Best is trial 66 with value: 0.780046.[0m
[32m[I 2022-10-25 23:56:54,626][0m Trial 70 finished with value: 0.7721567429138084 and parameters: {'agc_alpha': 5.684014347713511, 'agc_l1_ratio': 0.5, 'agc_loss': 'hinge'}. Best is trial 66 with value: 0.780046.[0m
[32m[I 2022-10-25 23:56:54,757][0m Trial 65 finished with value: 0.769617893025961 and parameters: {'agc_alpha': 5.57887232556078, 'agc_l1_ratio': 0.5, 'agc_loss': 'hinge'}. Best is trial 66 with value: 0.780046.[0m
[32m[I 2022-10-25 23:56:54,758][0m Trial 64 finished with value: 0.7718543667311945 and parameters: {'agc_alpha': 5.509388993083518, 'agc_l1_ratio': 0.5, 'agc_loss': 'hinge'}. Best is trial 66 with value: 0.780046.[0m
[32m[I 2022-10-25 23:56:54,760][0m Trial 68 finished with value: 0.7762271092863703 and parameters: {'agc_alpha': 5.0871121827928345, 'agc_l1_ratio': 0.5, 'agc_loss': 'hinge'}. Best is trial 66 with value: 0.780046.[0m
[32m[I 2022-10-25 23:56:54,944][0m Trial 66 finished with value: 0.7800462710184242 and parameters: {'agc_alpha': 5.794414407042778, 'agc_l1_ratio': 0.5, 'agc_loss': 'hinge'}. Best is trial 66 with value: 0.780046.[0m
[32m[I 2022-10-26 00:00:30,498][0m Trial 78 finished with value: 0.7707566445246061 and parameters: {'agc_alpha': 12.264732340836915, 'agc_l1_ratio': 0.4, 'agc_loss': 'hinge'}. Best is trial 66 with value: 0.780046.[0m
[32m[I 2022-10-26 00:00:30,503][0m Trial 79 finished with value: 0.765860499291553 and parameters: {'agc_alpha': 10.900005062768557, 'agc_l1_ratio': 0.4, 'agc_loss': 'hinge'}. Best is trial 66 with value: 0.780046.[0m
[32m[I 2022-10-26 00:00:30,507][0m Trial 77 finished with value: 0.6985244971771688 and parameters: {'agc_alpha': 10.228301865621976, 'agc_l1_ratio': 0.1, 'agc_loss': 'hinge'}. Best is trial 66 with value: 0.780046.[0m
[32m[I 2022-10-26 00:00:30,508][0m Trial 76 finished with value: 0.7699181304041453 and parameters: {'agc_alpha': 11.344361518327723, 'agc_l1_ratio': 0.4, 'agc_loss': 'hinge'}. Best is trial 66 with value: 0.780046.[0m
[32m[I 2022-10-26 00:00:30,609][0m Trial 75 finished with value: 0.7740970182100383 and parameters: {'agc_alpha': 11.102765696809708, 'agc_l1_ratio': 0.4, 'agc_loss': 'hinge'}. Best is trial 66 with value: 0.780046.[0m
[32m[I 2022-10-26 00:00:30,941][0m Trial 73 finished with value: 0.7667207215409435 and parameters: {'agc_alpha': 10.30103642216497, 'agc_l1_ratio': 0.4, 'agc_loss': 'hinge'}. Best is trial 66 with value: 0.780046.[0m
[32m[I 2022-10-26 00:00:30,941][0m Trial 74 finished with value: 0.7739073758526999 and parameters: {'agc_alpha': 11.360955560569895, 'agc_l1_ratio': 0.4, 'agc_loss': 'hinge'}. Best is trial 66 with value: 0.780046.[0m
[32m[I 2022-10-26 00:00:31,031][0m Trial 72 finished with value: 0.7701685133483058 and parameters: {'agc_alpha': 5.214108623778251, 'agc_l1_ratio': 0.4, 'agc_loss': 'hinge'}. Best is trial 66 with value: 0.780046.[0m
[32m[I 2022-10-26 00:04:15,799][0m Trial 83 finished with value: 1.532608410649405e-05 and parameters: {'agc_alpha': 2.0463363016612073, 'agc_l1_ratio': 0.9, 'agc_loss': 'squared'}. Best is trial 66 with value: 0.780046.[0m
[32m[I 2022-10-26 00:04:15,809][0m Trial 86 finished with value: 1.5326082993475765e-05 and parameters: {'agc_alpha': 1.8952943332449486, 'agc_l1_ratio': 0.9, 'agc_loss': 'squared'}. Best is trial 66 with value: 0.780046.[0m
[32m[I 2022-10-26 00:04:15,908][0m Trial 82 finished with value: 1.5322517778019187e-05 and parameters: {'agc_alpha': 0.09663310302884633, 'agc_l1_ratio': 0.9, 'agc_loss': 'squared'}. Best is trial 66 with value: 0.780046.[0m
[32m[I 2022-10-26 00:04:16,005][0m Trial 85 finished with value: 1.532608410649405e-05 and parameters: {'agc_alpha': 2.079422817071386, 'agc_l1_ratio': 0.9, 'agc_loss': 'squared'}. Best is trial 66 with value: 0.780046.[0m
[32m[I 2022-10-26 00:04:16,107][0m Trial 87 finished with value: 1.5326086332548077e-05 and parameters: {'agc_alpha': 2.185850964273959, 'agc_l1_ratio': 0.9, 'agc_loss': 'squared'}. Best is trial 66 with value: 0.780046.[0m
[32m[I 2022-10-26 00:04:16,201][0m Trial 81 finished with value: 2.0317295253498498e-05 and parameters: {'agc_alpha': 74.21080706611718, 'agc_l1_ratio': 0.9, 'agc_loss': 'squared'}. Best is trial 66 with value: 0.780046.[0m
[32m[I 2022-10-26 00:04:16,203][0m Trial 80 finished with value: 1.53225255688621e-05 and parameters: {'agc_alpha': 0.7023586321726047, 'agc_l1_ratio': 0.9, 'agc_loss': 'squared'}. Best is trial 66 with value: 0.780046.[0m
[32m[I 2022-10-26 00:04:16,297][0m Trial 84 finished with value: 1.5326086332548077e-05 and parameters: {'agc_alpha': 2.228696825666319, 'agc_l1_ratio': 0.9, 'agc_loss': 'squared'}. Best is trial 66 with value: 0.780046.[0m
[32m[I 2022-10-26 00:08:24,731][0m Trial 94 finished with value: 0.7752717717320075 and parameters: {'agc_alpha': 22.495008824623092, 'agc_l1_ratio': 1.0, 'agc_loss': 'log'}. Best is trial 66 with value: 0.780046.[0m
[32m[I 2022-10-26 00:08:24,841][0m Trial 92 finished with value: 0.7752770817757846 and parameters: {'agc_alpha': 22.860664567013657, 'agc_l1_ratio': 1.0, 'agc_loss': 'log'}. Best is trial 66 with value: 0.780046.[0m
[32m[I 2022-10-26 00:08:24,934][0m Trial 93 finished with value: 0.7717846424956001 and parameters: {'agc_alpha': 25.191586688578546, 'agc_l1_ratio': 1.0, 'agc_loss': 'log'}. Best is trial 66 with value: 0.780046.[0m
