[32m[I 2022-10-26 02:20:55,403][0m Trial 36 finished with value: 0.9579723486901057 and parameters: {'etc_criterion': 'gini', 'etc_min_samples_split': 43, 'etc_min_samples_leaf': 2, 'etc_max_features': 5}. Best is trial 32 with value: 0.999824.[0m
[32m[I 2022-10-26 02:20:56,150][0m Trial 37 finished with value: 0.9997641131635698 and parameters: {'etc_criterion': 'gini', 'etc_min_samples_split': 44, 'etc_min_samples_leaf': 1, 'etc_max_features': 5}. Best is trial 32 with value: 0.999824.[0m
[32m[I 2022-10-26 02:20:56,818][0m Trial 41 finished with value: 0.752787221144879 and parameters: {'etc_criterion': 'gini', 'etc_min_samples_split': 43, 'etc_min_samples_leaf': 11, 'etc_max_features': 5}. Best is trial 32 with value: 0.999824.[0m
[32m[I 2022-10-26 02:20:56,887][0m Trial 42 finished with value: 0.752787221144879 and parameters: {'etc_criterion': 'gini', 'etc_min_samples_split': 43, 'etc_min_samples_leaf': 11, 'etc_max_features': 5}. Best is trial 32 with value: 0.999824.[0m
[32m[I 2022-10-26 02:20:57,210][0m Trial 38 finished with value: 0.999801259027109 and parameters: {'etc_criterion': 'gini', 'etc_min_samples_split': 43, 'etc_min_samples_leaf': 1, 'etc_max_features': 5}. Best is trial 32 with value: 0.999824.[0m
[32m[I 2022-10-26 02:20:57,365][0m Trial 39 finished with value: 0.9997962481113513 and parameters: {'etc_criterion': 'gini', 'etc_min_samples_split': 42, 'etc_min_samples_leaf': 1, 'etc_max_features': 5}. Best is trial 32 with value: 0.999824.[0m
[32m[I 2022-10-26 02:20:57,840][0m Trial 43 finished with value: 0.752787221144879 and parameters: {'etc_criterion': 'gini', 'etc_min_samples_split': 43, 'etc_min_samples_leaf': 10, 'etc_max_features': 5}. Best is trial 32 with value: 0.999824.[0m
[32m[I 2022-10-26 02:20:57,913][0m Trial 44 finished with value: 0.752787221144879 and parameters: {'etc_criterion': 'gini', 'etc_min_samples_split': 42, 'etc_min_samples_leaf': 11, 'etc_max_features': 5}. Best is trial 32 with value: 0.999824.[0m
[32m[I 2022-10-26 02:20:58,244][0m Trial 40 finished with value: 0.999801259027109 and parameters: {'etc_criterion': 'gini', 'etc_min_samples_split': 43, 'etc_min_samples_leaf': 1, 'etc_max_features': 5}. Best is trial 32 with value: 0.999824.[0m
[32m[I 2022-10-26 02:20:58,561][0m Trial 45 finished with value: 0.804409550459672 and parameters: {'etc_criterion': 'gini', 'etc_min_samples_split': 34, 'etc_min_samples_leaf': 12, 'etc_max_features': 5}. Best is trial 32 with value: 0.999824.[0m
[32m[I 2022-10-26 02:20:58,985][0m Trial 47 finished with value: 0.6950742018218817 and parameters: {'etc_criterion': 'gini', 'etc_min_samples_split': 33, 'etc_min_samples_leaf': 7, 'etc_max_features': 4}. Best is trial 32 with value: 0.999824.[0m
[32m[I 2022-10-26 02:20:58,988][0m Trial 46 finished with value: 0.6950742018218817 and parameters: {'etc_criterion': 'gini', 'etc_min_samples_split': 34, 'etc_min_samples_leaf': 7, 'etc_max_features': 3}. Best is trial 32 with value: 0.999824.[0m
[32m[I 2022-10-26 02:20:59,453][0m Trial 48 finished with value: 0.6950742018218817 and parameters: {'etc_criterion': 'gini', 'etc_min_samples_split': 34, 'etc_min_samples_leaf': 6, 'etc_max_features': 4}. Best is trial 32 with value: 0.999824.[0m
[32m[I 2022-10-26 02:20:59,521][0m Trial 49 finished with value: 0.6950742018218817 and parameters: {'etc_criterion': 'gini', 'etc_min_samples_split': 34, 'etc_min_samples_leaf': 6, 'etc_max_features': 4}. Best is trial 32 with value: 0.999824.[0m
[32m[I 2022-10-26 02:21:00,009][0m Trial 51 finished with value: 0.6950742018218817 and parameters: {'etc_criterion': 'gini', 'etc_min_samples_split': 36, 'etc_min_samples_leaf': 5, 'etc_max_features': 4}. Best is trial 32 with value: 0.999824.[0m
[32m[I 2022-10-26 02:21:00,010][0m Trial 50 finished with value: 0.6950742018218817 and parameters: {'etc_criterion': 'gini', 'etc_min_samples_split': 33, 'etc_min_samples_leaf': 5, 'etc_max_features': 4}. Best is trial 32 with value: 0.999824.[0m
[32m[I 2022-10-26 02:21:00,359][0m Trial 52 finished with value: 0.6950742018218817 and parameters: {'etc_criterion': 'gini', 'etc_min_samples_split': 33, 'etc_min_samples_leaf': 6, 'etc_max_features': 4}. Best is trial 32 with value: 0.999824.[0m
[32m[I 2022-10-26 02:21:00,709][0m Trial 53 finished with value: 0.6950742018218817 and parameters: {'etc_criterion': 'gini', 'etc_min_samples_split': 47, 'etc_min_samples_leaf': 5, 'etc_max_features': 4}. Best is trial 32 with value: 0.999824.[0m
[32m[I 2022-10-26 02:21:01,172][0m Trial 54 finished with value: 0.6950742018218817 and parameters: {'etc_criterion': 'gini', 'etc_min_samples_split': 47, 'etc_min_samples_leaf': 15, 'etc_max_features': 4}. Best is trial 32 with value: 0.999824.[0m
[32m[I 2022-10-26 02:21:01,172][0m Trial 55 finished with value: 0.6950742018218817 and parameters: {'etc_criterion': 'gini', 'etc_min_samples_split': 47, 'etc_min_samples_leaf': 5, 'etc_max_features': 4}. Best is trial 32 with value: 0.999824.[0m
[32m[I 2022-10-26 02:21:01,671][0m Trial 56 finished with value: 0.6950742018218817 and parameters: {'etc_criterion': 'gini', 'etc_min_samples_split': 47, 'etc_min_samples_leaf': 17, 'etc_max_features': 2}. Best is trial 32 with value: 0.999824.[0m
[32m[I 2022-10-26 02:21:02,096][0m Trial 59 finished with value: 0.6950742018218817 and parameters: {'etc_criterion': 'gini', 'etc_min_samples_split': 47, 'etc_min_samples_leaf': 16, 'etc_max_features': 2}. Best is trial 32 with value: 0.999824.[0m
[32m[I 2022-10-26 02:21:02,832][0m Trial 57 finished with value: 0.9919342752934386 and parameters: {'etc_criterion': 'gini', 'etc_min_samples_split': 47, 'etc_min_samples_leaf': 5, 'etc_max_features': 6}. Best is trial 32 with value: 0.999824.[0m
[32m[I 2022-10-26 02:21:03,170][0m Trial 58 finished with value: 0.9633809567918058 and parameters: {'etc_criterion': 'gini', 'etc_min_samples_split': 47, 'etc_min_samples_leaf': 15, 'etc_max_features': 6}. Best is trial 32 with value: 0.999824.[0m
[32m[I 2022-10-26 02:21:03,358][0m Trial 60 finished with value: 0.9633809567918058 and parameters: {'etc_criterion': 'gini', 'etc_min_samples_split': 47, 'etc_min_samples_leaf': 15, 'etc_max_features': 6}. Best is trial 32 with value: 0.999824.[0m
[32m[I 2022-10-26 02:21:03,890][0m Trial 61 finished with value: 0.9767701947474963 and parameters: {'etc_criterion': 'gini', 'etc_min_samples_split': 40, 'etc_min_samples_leaf': 15, 'etc_max_features': 6}. Best is trial 32 with value: 0.999824.[0m
[32m[I 2022-10-26 02:21:04,462][0m Trial 63 finished with value: 0.9401836420913233 and parameters: {'etc_criterion': 'gini', 'etc_min_samples_split': 40, 'etc_min_samples_leaf': 9, 'etc_max_features': 6}. Best is trial 32 with value: 0.999824.[0m
[32m[I 2022-10-26 02:21:04,900][0m Trial 62 finished with value: 0.9832896426911736 and parameters: {'etc_criterion': 'gini', 'etc_min_samples_split': 40, 'etc_min_samples_leaf': 3, 'etc_max_features': 6}. Best is trial 32 with value: 0.999824.[0m
[32m[I 2022-10-26 02:21:05,002][0m Trial 65 finished with value: 0.9381565128667091 and parameters: {'etc_criterion': 'gini', 'etc_min_samples_split': 39, 'etc_min_samples_leaf': 9, 'etc_max_features': 6}. Best is trial 32 with value: 0.999824.[0m
[32m[I 2022-10-26 02:21:05,081][0m Trial 64 finished with value: 0.9832896426911736 and parameters: {'etc_criterion': 'gini', 'etc_min_samples_split': 40, 'etc_min_samples_leaf': 3, 'etc_max_features': 6}. Best is trial 32 with value: 0.999824.[0m
[32m[I 2022-10-26 02:21:06,201][0m Trial 68 finished with value: 0.9147219549409147 and parameters: {'etc_criterion': 'gini', 'etc_min_samples_split': 41, 'etc_min_samples_leaf': 3, 'etc_max_features': 5}. Best is trial 32 with value: 0.999824.[0m
[32m[I 2022-10-26 02:21:06,484][0m Trial 70 finished with value: 0.752657823037206 and parameters: {'etc_criterion': 'entropy', 'etc_min_samples_split': 41, 'etc_min_samples_leaf': 4, 'etc_max_features': 5}. Best is trial 32 with value: 0.999824.[0m
[32m[I 2022-10-26 02:21:06,484][0m Trial 66 finished with value: 0.9910118389519075 and parameters: {'etc_criterion': 'entropy', 'etc_min_samples_split': 40, 'etc_min_samples_leaf': 4, 'etc_max_features': 6}. Best is trial 32 with value: 0.999824.[0m
[32m[I 2022-10-26 02:21:06,485][0m Trial 67 finished with value: 0.9116339531093091 and parameters: {'etc_criterion': 'entropy', 'etc_min_samples_split': 41, 'etc_min_samples_leaf': 3, 'etc_max_features': 5}. Best is trial 32 with value: 0.999824.[0m
[32m[I 2022-10-26 02:21:06,485][0m Trial 69 finished with value: 0.851057178543322 and parameters: {'etc_criterion': 'gini', 'etc_min_samples_split': 40, 'etc_min_samples_leaf': 3, 'etc_max_features': 5}. Best is trial 32 with value: 0.999824.[0m
[32m[I 2022-10-26 02:21:08,175][0m Trial 72 finished with value: 0.9997690329820655 and parameters: {'etc_criterion': 'entropy', 'etc_min_samples_split': 45, 'etc_min_samples_leaf': 1, 'etc_max_features': 5}. Best is trial 32 with value: 0.999824.[0m
[32m[I 2022-10-26 02:21:08,176][0m Trial 71 finished with value: 0.9997690329820655 and parameters: {'etc_criterion': 'entropy', 'etc_min_samples_split': 45, 'etc_min_samples_leaf': 1, 'etc_max_features': 5}. Best is trial 32 with value: 0.999824.[0m
[32m[I 2022-10-26 02:21:08,176][0m Trial 73 finished with value: 0.9997986870942764 and parameters: {'etc_criterion': 'entropy', 'etc_min_samples_split': 30, 'etc_min_samples_leaf': 1, 'etc_max_features': 5}. Best is trial 32 with value: 0.999824.[0m
[32m[I 2022-10-26 02:21:09,836][0m Trial 74 finished with value: 0.9997690329820655 and parameters: {'etc_criterion': 'entropy', 'etc_min_samples_split': 45, 'etc_min_samples_leaf': 1, 'etc_max_features': 5}. Best is trial 32 with value: 0.999824.[0m
[32m[I 2022-10-26 02:21:10,446][0m Trial 77 finished with value: 0.9997591306059216 and parameters: {'etc_criterion': 'gini', 'etc_min_samples_split': 45, 'etc_min_samples_leaf': 1, 'etc_max_features': 5}. Best is trial 32 with value: 0.999824.[0m
[32m[I 2022-10-26 02:21:10,547][0m Trial 78 finished with value: 0.9997591306059216 and parameters: {'etc_criterion': 'gini', 'etc_min_samples_split': 45, 'etc_min_samples_leaf': 1, 'etc_max_features': 5}. Best is trial 32 with value: 0.999824.[0m
[32m[I 2022-10-26 02:21:10,547][0m Trial 75 finished with value: 0.9997591306059216 and parameters: {'etc_criterion': 'gini', 'etc_min_samples_split': 45, 'etc_min_samples_leaf': 1, 'etc_max_features': 5}. Best is trial 32 with value: 0.999824.[0m
[32m[I 2022-10-26 02:21:10,548][0m Trial 76 finished with value: 0.9997591306059216 and parameters: {'etc_criterion': 'gini', 'etc_min_samples_split': 45, 'etc_min_samples_leaf': 1, 'etc_max_features': 5}. Best is trial 32 with value: 0.999824.[0m
[32m[I 2022-10-26 02:21:11,496][0m Trial 80 finished with value: 0.9756697296634823 and parameters: {'etc_criterion': 'entropy', 'etc_min_samples_split': 29, 'etc_min_samples_leaf': 26, 'etc_max_features': 7}. Best is trial 32 with value: 0.999824.[0m
[32m[I 2022-10-26 02:21:11,918][0m Trial 81 finished with value: 0.9765693194070398 and parameters: {'etc_criterion': 'entropy', 'etc_min_samples_split': 28, 'etc_min_samples_leaf': 24, 'etc_max_features': 7}. Best is trial 32 with value: 0.999824.[0m
[32m[I 2022-10-26 02:21:12,274][0m Trial 79 finished with value: 0.9998311154765126 and parameters: {'etc_criterion': 'entropy', 'etc_min_samples_split': 36, 'etc_min_samples_leaf': 1, 'etc_max_features': 7}. Best is trial 79 with value: 0.999831.[0m
[32m[I 2022-10-26 02:21:13,330][0m Trial 82 finished with value: 0.9998483716699059 and parameters: {'etc_criterion': 'entropy', 'etc_min_samples_split': 28, 'etc_min_samples_leaf': 1, 'etc_max_features': 7}. Best is trial 82 with value: 0.999848.[0m
[32m[I 2022-10-26 02:21:13,921][0m Trial 85 finished with value: 0.9756697296634823 and parameters: {'etc_criterion': 'entropy', 'etc_min_samples_split': 49, 'etc_min_samples_leaf': 26, 'etc_max_features': 7}. Best is trial 82 with value: 0.999848.[0m
[32m[I 2022-10-26 02:21:13,923][0m Trial 83 finished with value: 0.9871564286883434 and parameters: {'etc_criterion': 'entropy', 'etc_min_samples_split': 19, 'etc_min_samples_leaf': 8, 'etc_max_features': 7}. Best is trial 82 with value: 0.999848.[0m
[32m[I 2022-10-26 02:21:14,080][0m Trial 86 finished with value: 0.9765693194070398 and parameters: {'etc_criterion': 'entropy', 'etc_min_samples_split': 49, 'etc_min_samples_leaf': 22, 'etc_max_features': 7}. Best is trial 82 with value: 0.999848.[0m
[32m[I 2022-10-26 02:21:14,299][0m Trial 84 finished with value: 0.953210977107487 and parameters: {'etc_criterion': 'entropy', 'etc_min_samples_split': 37, 'etc_min_samples_leaf': 8, 'etc_max_features': 7}. Best is trial 82 with value: 0.999848.[0m
[32m[I 2022-10-26 02:21:14,886][0m Trial 87 finished with value: 0.9895101488228458 and parameters: {'etc_criterion': 'entropy', 'etc_min_samples_split': 36, 'etc_min_samples_leaf': 8, 'etc_max_features': 7}. Best is trial 82 with value: 0.999848.[0m
[32m[I 2022-10-26 02:21:15,522][0m Trial 89 finished with value: 0.9895101488228458 and parameters: {'etc_criterion': 'entropy', 'etc_min_samples_split': 36, 'etc_min_samples_leaf': 8, 'etc_max_features': 7}. Best is trial 82 with value: 0.999848.[0m
[32m[I 2022-10-26 02:21:15,522][0m Trial 88 finished with value: 0.9995675156419527 and parameters: {'etc_criterion': 'gini', 'etc_min_samples_split': 49, 'etc_min_samples_leaf': 4, 'etc_max_features': 7}. Best is trial 82 with value: 0.999848.[0m
[32m[I 2022-10-26 02:21:16,351][0m Trial 90 finished with value: 0.9746330066035442 and parameters: {'etc_criterion': 'entropy', 'etc_min_samples_split': 37, 'etc_min_samples_leaf': 29, 'etc_max_features': 7}. Best is trial 82 with value: 0.999848.[0m
[32m[I 2022-10-26 02:21:17,037][0m Trial 93 finished with value: 0.9735987973853312 and parameters: {'etc_criterion': 'entropy', 'etc_min_samples_split': 31, 'etc_min_samples_leaf': 50, 'etc_max_features': 7}. Best is trial 82 with value: 0.999848.[0m
[32m[I 2022-10-26 02:21:17,287][0m Trial 96 finished with value: 0.6950742018218817 and parameters: {'etc_criterion': 'entropy', 'etc_min_samples_split': 27, 'etc_min_samples_leaf': 2, 'etc_max_features': 1}. Best is trial 82 with value: 0.999848.[0m
[32m[I 2022-10-26 02:21:17,372][0m Trial 92 finished with value: 0.9535652672114263 and parameters: {'etc_criterion': 'entropy', 'etc_min_samples_split': 37, 'etc_min_samples_leaf': 4, 'etc_max_features': 7}. Best is trial 82 with value: 0.999848.[0m
[32m[I 2022-10-26 02:21:17,849][0m Trial 94 finished with value: 0.9962155858214948 and parameters: {'etc_criterion': 'entropy', 'etc_min_samples_split': 31, 'etc_min_samples_leaf': 4, 'etc_max_features': 7}. Best is trial 82 with value: 0.999848.[0m
[32m[I 2022-10-26 02:21:17,849][0m Trial 91 finished with value: 0.9962155858214948 and parameters: {'etc_criterion': 'entropy', 'etc_min_samples_split': 31, 'etc_min_samples_leaf': 4, 'etc_max_features': 7}. Best is trial 82 with value: 0.999848.[0m
[32m[I 2022-10-26 02:21:18,068][0m Trial 98 finished with value: 0.6950742018218817 and parameters: {'etc_criterion': 'entropy', 'etc_min_samples_split': 30, 'etc_min_samples_leaf': 2, 'etc_max_features': 3}. Best is trial 82 with value: 0.999848.[0m
[32m[I 2022-10-26 02:21:18,464][0m Trial 95 finished with value: 0.9980849265527122 and parameters: {'etc_criterion': 'entropy', 'etc_min_samples_split': 29, 'etc_min_samples_leaf': 4, 'etc_max_features': 7}. Best is trial 82 with value: 0.999848.[0m
[32m[I 2022-10-26 02:21:18,464][0m Trial 97 finished with value: 0.9735987973853312 and parameters: {'etc_criterion': 'entropy', 'etc_min_samples_split': 26, 'etc_min_samples_leaf': 49, 'etc_max_features': 7}. Best is trial 82 with value: 0.999848.[0m
[32m[I 2022-10-26 02:21:18,663][0m Trial 99 finished with value: 0.6950742018218817 and parameters: {'etc_criterion': 'gini', 'etc_min_samples_split': 27, 'etc_min_samples_leaf': 2, 'etc_max_features': 3}. Best is trial 82 with value: 0.999848.[0m
[32m[I 2022-10-26 02:21:18,742][0m Study finished.[0m
[32m[I 2022-10-26 02:21:18,757][0m --------------------------------------------------------------------------------[0m
[32m[I 2022-10-26 02:21:18,758][0m --------------------          ExtraTreesClassifier          --------------------[0m
[32m[I 2022-10-26 02:21:18,758][0m --------------------------------------------------------------------------------[0m
[32m[I 2022-10-26 02:21:18,785][0m A new study created in RDB with name: ExtraTreesClassifier_c963b74b[0m
[32m[I 2022-10-26 02:21:18,791][0m Study started.[0m
[32m[I 2022-10-26 02:21:38,048][0m Trial 3 finished with value: 0.6950742018218817 and parameters: {'etsc_n_estimators': 50, 'etsc_criterion': 'entropy', 'etsc_min_samples_split': 23, 'etsc_min_samples_leaf': 41, 'etsc_max_features': 1, 'etsc_bootstrap': True}. Best is trial 3 with value: 0.695074.[0m
[32m[I 2022-10-26 02:21:50,035][0m Trial 6 finished with value: 0.6950742018218817 and parameters: {'etsc_n_estimators': 80, 'etsc_criterion': 'entropy', 'etsc_min_samples_split': 36, 'etsc_min_samples_leaf': 23, 'etsc_max_features': 2, 'etsc_bootstrap': True}. Best is trial 3 with value: 0.695074.[0m
[32m[I 2022-10-26 02:21:58,198][0m Trial 0 finished with value: 0.6950742018218817 and parameters: {'etsc_n_estimators': 110, 'etsc_criterion': 'entropy', 'etsc_min_samples_split': 22, 'etsc_min_samples_leaf': 29, 'etsc_max_features': 1, 'etsc_bootstrap': True}. Best is trial 0 with value: 0.695074.[0m
[32m[I 2022-10-26 02:22:19,419][0m Trial 2 finished with value: 0.6950742018218817 and parameters: {'etsc_n_estimators': 180, 'etsc_criterion': 'gini', 'etsc_min_samples_split': 34, 'etsc_min_samples_leaf': 48, 'etsc_max_features': 1, 'etsc_bootstrap': True}. Best is trial 0 with value: 0.695074.[0m
[32m[I 2022-10-26 02:22:36,866][0m Trial 4 finished with value: 0.9886872305751027 and parameters: {'etsc_n_estimators': 60, 'etsc_criterion': 'gini', 'etsc_min_samples_split': 18, 'etsc_min_samples_leaf': 7, 'etsc_max_features': 5, 'etsc_bootstrap': False}. Best is trial 4 with value: 0.988687.[0m
[32m[I 2022-10-26 02:22:40,925][0m Trial 5 finished with value: 0.722962034722486 and parameters: {'etsc_n_estimators': 130, 'etsc_criterion': 'gini', 'etsc_min_samples_split': 36, 'etsc_min_samples_leaf': 9, 'etsc_max_features': 4, 'etsc_bootstrap': False}. Best is trial 4 with value: 0.988687.[0m
[32m[I 2022-10-26 02:22:50,537][0m Trial 8 finished with value: 0.739703699207963 and parameters: {'etsc_n_estimators': 120, 'etsc_criterion': 'entropy', 'etsc_min_samples_split': 39, 'etsc_min_samples_leaf': 14, 'etsc_max_features': 4, 'etsc_bootstrap': False}. Best is trial 4 with value: 0.988687.[0m
[32m[I 2022-10-26 02:23:05,272][0m Trial 1 finished with value: 0.9136037460674682 and parameters: {'etsc_n_estimators': 110, 'etsc_criterion': 'gini', 'etsc_min_samples_split': 50, 'etsc_min_samples_leaf': 25, 'etsc_max_features': 5, 'etsc_bootstrap': True}. Best is trial 4 with value: 0.988687.[0m
[32m[I 2022-10-26 02:23:12,301][0m Trial 11 finished with value: 0.6950742018218817 and parameters: {'etsc_n_estimators': 150, 'etsc_criterion': 'gini', 'etsc_min_samples_split': 47, 'etsc_min_samples_leaf': 41, 'etsc_max_features': 2, 'etsc_bootstrap': True}. Best is trial 4 with value: 0.988687.[0m
[32m[I 2022-10-26 02:23:32,481][0m Trial 10 finished with value: 0.6979622694246342 and parameters: {'etsc_n_estimators': 170, 'etsc_criterion': 'gini', 'etsc_min_samples_split': 27, 'etsc_min_samples_leaf': 48, 'etsc_max_features': 4, 'etsc_bootstrap': True}. Best is trial 4 with value: 0.988687.[0m
[32m[I 2022-10-26 02:23:45,623][0m Trial 14 finished with value: 0.914919422215201 and parameters: {'etsc_n_estimators': 60, 'etsc_criterion': 'gini', 'etsc_min_samples_split': 5, 'etsc_min_samples_leaf': 20, 'etsc_max_features': 5, 'etsc_bootstrap': True}. Best is trial 4 with value: 0.988687.[0m
[32m[I 2022-10-26 02:23:58,553][0m Trial 9 finished with value: 0.9905617518261602 and parameters: {'etsc_n_estimators': 90, 'etsc_criterion': 'entropy', 'etsc_min_samples_split': 45, 'etsc_min_samples_leaf': 9, 'etsc_max_features': 6, 'etsc_bootstrap': True}. Best is trial 9 with value: 0.990562.[0m
[32m[I 2022-10-26 02:24:13,002][0m Trial 13 finished with value: 0.7112784521173605 and parameters: {'etsc_n_estimators': 180, 'etsc_criterion': 'gini', 'etsc_min_samples_split': 37, 'etsc_min_samples_leaf': 45, 'etsc_max_features': 4, 'etsc_bootstrap': False}. Best is trial 9 with value: 0.990562.[0m
[32m[I 2022-10-26 02:24:16,732][0m Trial 15 finished with value: 0.7272234027915601 and parameters: {'etsc_n_estimators': 120, 'etsc_criterion': 'gini', 'etsc_min_samples_split': 43, 'etsc_min_samples_leaf': 10, 'etsc_max_features': 4, 'etsc_bootstrap': True}. Best is trial 9 with value: 0.990562.[0m
[32m[I 2022-10-26 02:25:09,082][0m Trial 7 finished with value: 0.9929030530118476 and parameters: {'etsc_n_estimators': 150, 'etsc_criterion': 'gini', 'etsc_min_samples_split': 15, 'etsc_min_samples_leaf': 9, 'etsc_max_features': 6, 'etsc_bootstrap': False}. Best is trial 7 with value: 0.992903.[0m
[32m[I 2022-10-26 02:25:27,917][0m Trial 17 finished with value: 0.9998134921759899 and parameters: {'etsc_n_estimators': 50, 'etsc_criterion': 'gini', 'etsc_min_samples_split': 6, 'etsc_min_samples_leaf': 4, 'etsc_max_features': 7, 'etsc_bootstrap': False}. Best is trial 17 with value: 0.999813.[0m
[32m[I 2022-10-26 02:25:57,422][0m Trial 18 finished with value: 0.9999676789497212 and parameters: {'etsc_n_estimators': 50, 'etsc_criterion': 'gini', 'etsc_min_samples_split': 5, 'etsc_min_samples_leaf': 1, 'etsc_max_features': 7, 'etsc_bootstrap': False}. Best is trial 18 with value: 0.999968.[0m
