[32m[I 2022-10-26 02:19:47,839][0m Trial 73 finished with value: 0.08553430843786972 and parameters: {'compnb_alpha': 0.1, 'compnb_fit_prior': False, 'compnb_norm': True}. Best is trial 75 with value: 0.0855343.[0m
[32m[I 2022-10-26 02:19:47,949][0m Trial 74 finished with value: 0.08553430843786972 and parameters: {'compnb_alpha': 0.1, 'compnb_fit_prior': False, 'compnb_norm': True}. Best is trial 79 with value: 0.0855343.[0m
[32m[I 2022-10-26 02:19:47,949][0m Trial 79 finished with value: 0.08553430843786972 and parameters: {'compnb_alpha': 0.1, 'compnb_fit_prior': False, 'compnb_norm': True}. Best is trial 79 with value: 0.0855343.[0m
[32m[I 2022-10-26 02:19:47,951][0m Trial 76 finished with value: 0.08553430843786972 and parameters: {'compnb_alpha': 0.1, 'compnb_fit_prior': False, 'compnb_norm': True}. Best is trial 79 with value: 0.0855343.[0m
[32m[I 2022-10-26 02:19:48,017][0m Trial 78 finished with value: 0.08553430843786972 and parameters: {'compnb_alpha': 0.1, 'compnb_fit_prior': False, 'compnb_norm': True}. Best is trial 79 with value: 0.0855343.[0m
[32m[I 2022-10-26 02:19:48,019][0m Trial 77 finished with value: 0.08553430843786972 and parameters: {'compnb_alpha': 0.1, 'compnb_fit_prior': False, 'compnb_norm': True}. Best is trial 79 with value: 0.0855343.[0m
[32m[I 2022-10-26 02:19:49,496][0m Trial 80 finished with value: 0.08553430843786972 and parameters: {'compnb_alpha': 0.15000000000000002, 'compnb_fit_prior': False, 'compnb_norm': True}. Best is trial 80 with value: 0.0855343.[0m
[32m[I 2022-10-26 02:19:50,324][0m Trial 81 finished with value: 0.08553430843786972 and parameters: {'compnb_alpha': 0.25, 'compnb_fit_prior': True, 'compnb_norm': True}. Best is trial 82 with value: 0.0855343.[0m
[32m[I 2022-10-26 02:19:50,464][0m Trial 82 finished with value: 0.08553430843786972 and parameters: {'compnb_alpha': 0.25, 'compnb_fit_prior': True, 'compnb_norm': True}. Best is trial 82 with value: 0.0855343.[0m
[32m[I 2022-10-26 02:19:50,576][0m Trial 86 finished with value: 0.08553430843786972 and parameters: {'compnb_alpha': 0.25, 'compnb_fit_prior': True, 'compnb_norm': True}. Best is trial 86 with value: 0.0855343.[0m
[32m[I 2022-10-26 02:19:50,577][0m Trial 84 finished with value: 0.08553430843786972 and parameters: {'compnb_alpha': 0.25, 'compnb_fit_prior': True, 'compnb_norm': True}. Best is trial 86 with value: 0.0855343.[0m
[32m[I 2022-10-26 02:19:50,577][0m Trial 85 finished with value: 0.08553430843786972 and parameters: {'compnb_alpha': 0.25, 'compnb_fit_prior': True, 'compnb_norm': True}. Best is trial 86 with value: 0.0855343.[0m
[32m[I 2022-10-26 02:19:50,579][0m Trial 83 finished with value: 0.08553430843786972 and parameters: {'compnb_alpha': 0.25, 'compnb_fit_prior': True, 'compnb_norm': True}. Best is trial 86 with value: 0.0855343.[0m
[32m[I 2022-10-26 02:19:50,906][0m Trial 87 finished with value: 0.08553430843786972 and parameters: {'compnb_alpha': 0.25, 'compnb_fit_prior': True, 'compnb_norm': True}. Best is trial 87 with value: 0.0855343.[0m
[32m[I 2022-10-26 02:19:52,015][0m Trial 88 finished with value: 0.08553430843786972 and parameters: {'compnb_alpha': 0.15000000000000002, 'compnb_fit_prior': False, 'compnb_norm': True}. Best is trial 88 with value: 0.0855343.[0m
[32m[I 2022-10-26 02:19:53,145][0m Trial 92 finished with value: 0.08553430843786972 and parameters: {'compnb_alpha': 0.0, 'compnb_fit_prior': False, 'compnb_norm': True}. Best is trial 93 with value: 0.0855343.[0m
[32m[I 2022-10-26 02:19:53,222][0m Trial 91 finished with value: 0.08553430843786972 and parameters: {'compnb_alpha': 0.0, 'compnb_fit_prior': False, 'compnb_norm': True}. Best is trial 92 with value: 0.0855343.[0m
[32m[I 2022-10-26 02:19:53,225][0m Trial 89 finished with value: 0.08553430843786972 and parameters: {'compnb_alpha': 0.0, 'compnb_fit_prior': False, 'compnb_norm': True}. Best is trial 92 with value: 0.0855343.[0m
[32m[I 2022-10-26 02:19:53,294][0m Trial 90 finished with value: 0.08553430843786972 and parameters: {'compnb_alpha': 0.0, 'compnb_fit_prior': False, 'compnb_norm': True}. Best is trial 93 with value: 0.0855343.[0m
[32m[I 2022-10-26 02:19:53,423][0m Trial 95 finished with value: 0.08553430843786972 and parameters: {'compnb_alpha': 0.0, 'compnb_fit_prior': False, 'compnb_norm': True}. Best is trial 95 with value: 0.0855343.[0m
[32m[I 2022-10-26 02:19:53,489][0m Trial 93 finished with value: 0.08553430843786972 and parameters: {'compnb_alpha': 0.0, 'compnb_fit_prior': False, 'compnb_norm': True}. Best is trial 95 with value: 0.0855343.[0m
[32m[I 2022-10-26 02:19:53,560][0m Trial 94 finished with value: 0.08553430843786972 and parameters: {'compnb_alpha': 0.0, 'compnb_fit_prior': False, 'compnb_norm': True}. Best is trial 95 with value: 0.0855343.[0m
[32m[I 2022-10-26 02:19:54,049][0m Trial 96 finished with value: 0.08553430843786972 and parameters: {'compnb_alpha': 0.05, 'compnb_fit_prior': False, 'compnb_norm': True}. Best is trial 96 with value: 0.0855343.[0m
[32m[I 2022-10-26 02:19:54,946][0m Trial 97 finished with value: 0.08553430843786972 and parameters: {'compnb_alpha': 0.4, 'compnb_fit_prior': False, 'compnb_norm': True}. Best is trial 98 with value: 0.0855343.[0m
[32m[I 2022-10-26 02:19:55,016][0m Trial 98 finished with value: 0.08553430843786972 and parameters: {'compnb_alpha': 0.4, 'compnb_fit_prior': False, 'compnb_norm': True}. Best is trial 99 with value: 0.0855343.[0m
[32m[I 2022-10-26 02:19:55,016][0m Trial 99 finished with value: 0.08553430843786972 and parameters: {'compnb_alpha': 0.4, 'compnb_fit_prior': False, 'compnb_norm': True}. Best is trial 99 with value: 0.0855343.[0m
[32m[I 2022-10-26 02:19:55,138][0m Study finished.[0m
[32m[I 2022-10-26 02:19:55,152][0m --------------------------------------------------------------------------------[0m
[32m[I 2022-10-26 02:19:55,153][0m --------------------         DecisionTreeClassifier         --------------------[0m
[32m[I 2022-10-26 02:19:55,153][0m --------------------------------------------------------------------------------[0m
[32m[I 2022-10-26 02:19:55,181][0m A new study created in RDB with name: DecisionTreeClassifier_c963b74b[0m
[32m[I 2022-10-26 02:19:55,187][0m Study started.[0m
[32m[I 2022-10-26 02:19:56,589][0m Trial 0 finished with value: 0.6950742018218817 and parameters: {'dtc_criterion': 'gini', 'dtc_splitter': 'random', 'dtc_min_samples_split': 23, 'dtc_min_samples_leaf': 16, 'dtc_max_features': 2}. Best is trial 0 with value: 0.695074.[0m
[32m[I 2022-10-26 02:19:57,113][0m Trial 1 finished with value: 0.8751354292502617 and parameters: {'dtc_criterion': 'entropy', 'dtc_splitter': 'random', 'dtc_min_samples_split': 35, 'dtc_min_samples_leaf': 48, 'dtc_max_features': 5}. Best is trial 1 with value: 0.875135.[0m
[32m[I 2022-10-26 02:19:58,031][0m Trial 3 finished with value: 0.9733157425689813 and parameters: {'dtc_criterion': 'entropy', 'dtc_splitter': 'random', 'dtc_min_samples_split': 31, 'dtc_min_samples_leaf': 30, 'dtc_max_features': 7}. Best is trial 4 with value: 0.981437.[0m
[32m[I 2022-10-26 02:19:58,120][0m Trial 4 finished with value: 0.9814369977069248 and parameters: {'dtc_criterion': 'gini', 'dtc_splitter': 'best', 'dtc_min_samples_split': 4, 'dtc_min_samples_leaf': 15, 'dtc_max_features': 1}. Best is trial 4 with value: 0.981437.[0m
[32m[I 2022-10-26 02:19:58,122][0m Trial 6 finished with value: 0.9352100215679202 and parameters: {'dtc_criterion': 'entropy', 'dtc_splitter': 'random', 'dtc_min_samples_split': 47, 'dtc_min_samples_leaf': 29, 'dtc_max_features': 6}. Best is trial 4 with value: 0.981437.[0m
[32m[I 2022-10-26 02:19:58,534][0m Trial 2 finished with value: 0.9774936932854308 and parameters: {'dtc_criterion': 'entropy', 'dtc_splitter': 'best', 'dtc_min_samples_split': 37, 'dtc_min_samples_leaf': 9, 'dtc_max_features': 1}. Best is trial 4 with value: 0.981437.[0m
[32m[I 2022-10-26 02:19:58,848][0m Trial 5 finished with value: 0.999516284686564 and parameters: {'dtc_criterion': 'gini', 'dtc_splitter': 'best', 'dtc_min_samples_split': 29, 'dtc_min_samples_leaf': 27, 'dtc_max_features': 4}. Best is trial 5 with value: 0.999516.[0m
[32m[I 2022-10-26 02:19:58,849][0m Trial 7 finished with value: 0.9983552809190565 and parameters: {'dtc_criterion': 'gini', 'dtc_splitter': 'best', 'dtc_min_samples_split': 24, 'dtc_min_samples_leaf': 37, 'dtc_max_features': 4}. Best is trial 5 with value: 0.999516.[0m
[32m[I 2022-10-26 02:19:59,867][0m Trial 8 finished with value: 0.999491481462713 and parameters: {'dtc_criterion': 'entropy', 'dtc_splitter': 'best', 'dtc_min_samples_split': 8, 'dtc_min_samples_leaf': 46, 'dtc_max_features': 5}. Best is trial 5 with value: 0.999516.[0m
[32m[I 2022-10-26 02:20:00,399][0m Trial 12 finished with value: 0.8729181633759879 and parameters: {'dtc_criterion': 'entropy', 'dtc_splitter': 'random', 'dtc_min_samples_split': 48, 'dtc_min_samples_leaf': 35, 'dtc_max_features': 5}. Best is trial 5 with value: 0.999516.[0m
[32m[I 2022-10-26 02:20:00,483][0m Trial 14 finished with value: 0.6950742018218817 and parameters: {'dtc_criterion': 'gini', 'dtc_splitter': 'random', 'dtc_min_samples_split': 29, 'dtc_min_samples_leaf': 14, 'dtc_max_features': 1}. Best is trial 5 with value: 0.999516.[0m
[32m[I 2022-10-26 02:20:00,484][0m Trial 15 finished with value: 0.6950742018218817 and parameters: {'dtc_criterion': 'entropy', 'dtc_splitter': 'random', 'dtc_min_samples_split': 47, 'dtc_min_samples_leaf': 9, 'dtc_max_features': 2}. Best is trial 5 with value: 0.999516.[0m
[32m[I 2022-10-26 02:20:01,055][0m Trial 11 finished with value: 0.9734455029230435 and parameters: {'dtc_criterion': 'gini', 'dtc_splitter': 'random', 'dtc_min_samples_split': 48, 'dtc_min_samples_leaf': 27, 'dtc_max_features': 7}. Best is trial 5 with value: 0.999516.[0m
[32m[I 2022-10-26 02:20:01,194][0m Trial 10 finished with value: 0.9534236095775365 and parameters: {'dtc_criterion': 'gini', 'dtc_splitter': 'best', 'dtc_min_samples_split': 22, 'dtc_min_samples_leaf': 49, 'dtc_max_features': 2}. Best is trial 5 with value: 0.999516.[0m
[32m[I 2022-10-26 02:20:01,556][0m Trial 9 finished with value: 0.9999129902526767 and parameters: {'dtc_criterion': 'entropy', 'dtc_splitter': 'best', 'dtc_min_samples_split': 2, 'dtc_min_samples_leaf': 5, 'dtc_max_features': 7}. Best is trial 9 with value: 0.999913.[0m
[32m[I 2022-10-26 02:20:01,841][0m Trial 16 finished with value: 0.6950742018218817 and parameters: {'dtc_criterion': 'entropy', 'dtc_splitter': 'random', 'dtc_min_samples_split': 28, 'dtc_min_samples_leaf': 20, 'dtc_max_features': 2}. Best is trial 9 with value: 0.999913.[0m
[32m[I 2022-10-26 02:20:02,249][0m Trial 13 finished with value: 0.9993118457306651 and parameters: {'dtc_criterion': 'gini', 'dtc_splitter': 'best', 'dtc_min_samples_split': 43, 'dtc_min_samples_leaf': 26, 'dtc_max_features': 3}. Best is trial 9 with value: 0.999913.[0m
[32m[I 2022-10-26 02:20:03,519][0m Trial 18 finished with value: 0.9961504801663362 and parameters: {'dtc_criterion': 'gini', 'dtc_splitter': 'best', 'dtc_min_samples_split': 12, 'dtc_min_samples_leaf': 49, 'dtc_max_features': 4}. Best is trial 9 with value: 0.999913.[0m
[32m[I 2022-10-26 02:20:03,519][0m Trial 19 finished with value: 0.9961504801663362 and parameters: {'dtc_criterion': 'gini', 'dtc_splitter': 'best', 'dtc_min_samples_split': 11, 'dtc_min_samples_leaf': 49, 'dtc_max_features': 4}. Best is trial 9 with value: 0.999913.[0m
[32m[I 2022-10-26 02:20:03,918][0m Trial 17 finished with value: 0.9964106503456797 and parameters: {'dtc_criterion': 'gini', 'dtc_splitter': 'best', 'dtc_min_samples_split': 12, 'dtc_min_samples_leaf': 50, 'dtc_max_features': 4}. Best is trial 9 with value: 0.999913.[0m
[32m[I 2022-10-26 02:20:04,651][0m Trial 20 finished with value: 0.9988450371754829 and parameters: {'dtc_criterion': 'gini', 'dtc_splitter': 'best', 'dtc_min_samples_split': 12, 'dtc_min_samples_leaf': 41, 'dtc_max_features': 4}. Best is trial 9 with value: 0.999913.[0m
[32m[I 2022-10-26 02:20:04,941][0m Trial 21 finished with value: 0.99988312265554 and parameters: {'dtc_criterion': 'gini', 'dtc_splitter': 'best', 'dtc_min_samples_split': 12, 'dtc_min_samples_leaf': 1, 'dtc_max_features': 4}. Best is trial 9 with value: 0.999913.[0m
[32m[I 2022-10-26 02:20:05,283][0m Trial 23 finished with value: 0.999893069108867 and parameters: {'dtc_criterion': 'gini', 'dtc_splitter': 'best', 'dtc_min_samples_split': 14, 'dtc_min_samples_leaf': 1, 'dtc_max_features': 4}. Best is trial 9 with value: 0.999913.[0m
[32m[I 2022-10-26 02:20:05,284][0m Trial 22 finished with value: 0.999893069108867 and parameters: {'dtc_criterion': 'gini', 'dtc_splitter': 'best', 'dtc_min_samples_split': 14, 'dtc_min_samples_leaf': 1, 'dtc_max_features': 4}. Best is trial 9 with value: 0.999913.[0m
[32m[I 2022-10-26 02:20:05,591][0m Trial 24 finished with value: 0.9998905821364105 and parameters: {'dtc_criterion': 'gini', 'dtc_splitter': 'best', 'dtc_min_samples_split': 16, 'dtc_min_samples_leaf': 1, 'dtc_max_features': 4}. Best is trial 9 with value: 0.999913.[0m
[32m[I 2022-10-26 02:20:07,234][0m Trial 26 finished with value: 0.9998831507719076 and parameters: {'dtc_criterion': 'entropy', 'dtc_splitter': 'best', 'dtc_min_samples_split': 17, 'dtc_min_samples_leaf': 5, 'dtc_max_features': 6}. Best is trial 9 with value: 0.999913.[0m
[32m[I 2022-10-26 02:20:07,235][0m Trial 25 finished with value: 0.999912984887791 and parameters: {'dtc_criterion': 'entropy', 'dtc_splitter': 'best', 'dtc_min_samples_split': 18, 'dtc_min_samples_leaf': 1, 'dtc_max_features': 6}. Best is trial 9 with value: 0.999913.[0m
[32m[I 2022-10-26 02:20:07,235][0m Trial 27 finished with value: 0.9998955474885283 and parameters: {'dtc_criterion': 'entropy', 'dtc_splitter': 'best', 'dtc_min_samples_split': 19, 'dtc_min_samples_leaf': 4, 'dtc_max_features': 6}. Best is trial 9 with value: 0.999913.[0m
[32m[I 2022-10-26 02:20:08,619][0m Trial 28 finished with value: 0.9999254191240954 and parameters: {'dtc_criterion': 'entropy', 'dtc_splitter': 'best', 'dtc_min_samples_split': 3, 'dtc_min_samples_leaf': 2, 'dtc_max_features': 6}. Best is trial 29 with value: 0.999955.[0m
[32m[I 2022-10-26 02:20:08,619][0m Trial 29 finished with value: 0.999955245633549 and parameters: {'dtc_criterion': 'gini', 'dtc_splitter': 'best', 'dtc_min_samples_split': 2, 'dtc_min_samples_leaf': 1, 'dtc_max_features': 6}. Best is trial 29 with value: 0.999955.[0m
[32m[I 2022-10-26 02:20:08,968][0m Trial 31 finished with value: 0.9998831507719076 and parameters: {'dtc_criterion': 'entropy', 'dtc_splitter': 'best', 'dtc_min_samples_split': 18, 'dtc_min_samples_leaf': 5, 'dtc_max_features': 6}. Best is trial 29 with value: 0.999955.[0m
[32m[I 2022-10-26 02:20:09,273][0m Trial 32 finished with value: 0.9999129620534002 and parameters: {'dtc_criterion': 'entropy', 'dtc_splitter': 'best', 'dtc_min_samples_split': 3, 'dtc_min_samples_leaf': 5, 'dtc_max_features': 6}. Best is trial 29 with value: 0.999955.[0m
[32m[I 2022-10-26 02:20:09,655][0m Trial 30 finished with value: 0.9998756721468779 and parameters: {'dtc_criterion': 'entropy', 'dtc_splitter': 'best', 'dtc_min_samples_split': 18, 'dtc_min_samples_leaf': 6, 'dtc_max_features': 6}. Best is trial 29 with value: 0.999955.[0m
[32m[I 2022-10-26 02:20:10,751][0m Trial 33 finished with value: 0.9998832038382172 and parameters: {'dtc_criterion': 'entropy', 'dtc_splitter': 'best', 'dtc_min_samples_split': 2, 'dtc_min_samples_leaf': 7, 'dtc_max_features': 6}. Best is trial 29 with value: 0.999955.[0m
[32m[I 2022-10-26 02:20:10,972][0m Trial 34 finished with value: 0.9998832038382172 and parameters: {'dtc_criterion': 'entropy', 'dtc_splitter': 'best', 'dtc_min_samples_split': 2, 'dtc_min_samples_leaf': 7, 'dtc_max_features': 6}. Best is trial 29 with value: 0.999955.[0m
[32m[I 2022-10-26 02:20:11,078][0m Trial 35 finished with value: 0.9998584009370652 and parameters: {'dtc_criterion': 'entropy', 'dtc_splitter': 'best', 'dtc_min_samples_split': 3, 'dtc_min_samples_leaf': 8, 'dtc_max_features': 6}. Best is trial 29 with value: 0.999955.[0m
[32m[I 2022-10-26 02:20:12,792][0m Trial 36 finished with value: 0.9998633301167089 and parameters: {'dtc_criterion': 'entropy', 'dtc_splitter': 'best', 'dtc_min_samples_split': 2, 'dtc_min_samples_leaf': 9, 'dtc_max_features': 7}. Best is trial 29 with value: 0.999955.[0m
[32m[I 2022-10-26 02:20:12,898][0m Trial 37 finished with value: 0.9998633301167089 and parameters: {'dtc_criterion': 'entropy', 'dtc_splitter': 'best', 'dtc_min_samples_split': 2, 'dtc_min_samples_leaf': 9, 'dtc_max_features': 7}. Best is trial 29 with value: 0.999955.[0m
[32m[I 2022-10-26 02:20:12,993][0m Trial 38 finished with value: 0.9998608791922546 and parameters: {'dtc_criterion': 'entropy', 'dtc_splitter': 'best', 'dtc_min_samples_split': 2, 'dtc_min_samples_leaf': 10, 'dtc_max_features': 7}. Best is trial 29 with value: 0.999955.[0m
[32m[I 2022-10-26 02:20:13,219][0m Trial 39 finished with value: 0.9998633301167089 and parameters: {'dtc_criterion': 'entropy', 'dtc_splitter': 'best', 'dtc_min_samples_split': 7, 'dtc_min_samples_leaf': 9, 'dtc_max_features': 7}. Best is trial 29 with value: 0.999955.[0m
[32m[I 2022-10-26 02:20:13,809][0m Trial 40 finished with value: 0.999853434046317 and parameters: {'dtc_criterion': 'entropy', 'dtc_splitter': 'best', 'dtc_min_samples_split': 6, 'dtc_min_samples_leaf': 11, 'dtc_max_features': 7}. Best is trial 29 with value: 0.999955.[0m
[32m[I 2022-10-26 02:20:14,746][0m Trial 43 finished with value: 0.999853434046317 and parameters: {'dtc_criterion': 'entropy', 'dtc_splitter': 'best', 'dtc_min_samples_split': 7, 'dtc_min_samples_leaf': 11, 'dtc_max_features': 7}. Best is trial 29 with value: 0.999955.[0m
[32m[I 2022-10-26 02:20:14,746][0m Trial 42 finished with value: 0.999853434046317 and parameters: {'dtc_criterion': 'entropy', 'dtc_splitter': 'best', 'dtc_min_samples_split': 7, 'dtc_min_samples_leaf': 12, 'dtc_max_features': 7}. Best is trial 29 with value: 0.999955.[0m
[32m[I 2022-10-26 02:20:14,855][0m Trial 41 finished with value: 0.999853434046317 and parameters: {'dtc_criterion': 'entropy', 'dtc_splitter': 'best', 'dtc_min_samples_split': 6, 'dtc_min_samples_leaf': 11, 'dtc_max_features': 7}. Best is trial 29 with value: 0.999955.[0m
[32m[I 2022-10-26 02:20:16,331][0m Trial 44 finished with value: 0.9998086599877332 and parameters: {'dtc_criterion': 'entropy', 'dtc_splitter': 'best', 'dtc_min_samples_split': 7, 'dtc_min_samples_leaf': 13, 'dtc_max_features': 5}. Best is trial 29 with value: 0.999955.[0m
[32m[I 2022-10-26 02:20:16,428][0m Trial 45 finished with value: 0.9998086599877332 and parameters: {'dtc_criterion': 'entropy', 'dtc_splitter': 'best', 'dtc_min_samples_split': 7, 'dtc_min_samples_leaf': 13, 'dtc_max_features': 5}. Best is trial 29 with value: 0.999955.[0m
[32m[I 2022-10-26 02:20:16,429][0m Trial 47 finished with value: 0.9997340235018629 and parameters: {'dtc_criterion': 'entropy', 'dtc_splitter': 'best', 'dtc_min_samples_split': 7, 'dtc_min_samples_leaf': 21, 'dtc_max_features': 5}. Best is trial 29 with value: 0.999955.[0m
[32m[I 2022-10-26 02:20:16,813][0m Trial 46 finished with value: 0.9997912860113646 and parameters: {'dtc_criterion': 'entropy', 'dtc_splitter': 'best', 'dtc_min_samples_split': 7, 'dtc_min_samples_leaf': 12, 'dtc_max_features': 5}. Best is trial 29 with value: 0.999955.[0m
[32m[I 2022-10-26 02:20:17,142][0m Trial 48 finished with value: 0.9999154596272425 and parameters: {'dtc_criterion': 'entropy', 'dtc_splitter': 'best', 'dtc_min_samples_split': 6, 'dtc_min_samples_leaf': 3, 'dtc_max_features': 5}. Best is trial 29 with value: 0.999955.[0m
[32m[I 2022-10-26 02:20:18,314][0m Trial 49 finished with value: 0.9997317242734146 and parameters: {'dtc_criterion': 'entropy', 'dtc_splitter': 'best', 'dtc_min_samples_split': 5, 'dtc_min_samples_leaf': 17, 'dtc_max_features': 5}. Best is trial 29 with value: 0.999955.[0m
[32m[I 2022-10-26 02:20:18,314][0m Trial 50 finished with value: 0.9999353625222511 and parameters: {'dtc_criterion': 'entropy', 'dtc_splitter': 'best', 'dtc_min_samples_split': 9, 'dtc_min_samples_leaf': 3, 'dtc_max_features': 5}. Best is trial 29 with value: 0.999955.[0m
[32m[I 2022-10-26 02:20:18,315][0m Trial 51 finished with value: 0.9907971498753886 and parameters: {'dtc_criterion': 'entropy', 'dtc_splitter': 'best', 'dtc_min_samples_split': 36, 'dtc_min_samples_leaf': 19, 'dtc_max_features': 5}. Best is trial 29 with value: 0.999955.[0m
[32m[I 2022-10-26 02:20:19,596][0m Trial 53 finished with value: 0.8962086776658746 and parameters: {'dtc_criterion': 'entropy', 'dtc_splitter': 'random', 'dtc_min_samples_split': 34, 'dtc_min_samples_leaf': 17, 'dtc_max_features': 6}. Best is trial 29 with value: 0.999955.[0m
[32m[I 2022-10-26 02:20:19,972][0m Trial 52 finished with value: 0.923254991612785 and parameters: {'dtc_criterion': 'entropy', 'dtc_splitter': 'random', 'dtc_min_samples_split': 37, 'dtc_min_samples_leaf': 17, 'dtc_max_features': 6}. Best is trial 29 with value: 0.999955.[0m
[32m[I 2022-10-26 02:20:20,078][0m Trial 55 finished with value: 0.9781540393680106 and parameters: {'dtc_criterion': 'entropy', 'dtc_splitter': 'random', 'dtc_min_samples_split': 38, 'dtc_min_samples_leaf': 3, 'dtc_max_features': 6}. Best is trial 29 with value: 0.999955.[0m
[32m[I 2022-10-26 02:20:20,167][0m Trial 56 finished with value: 0.9243564978708719 and parameters: {'dtc_criterion': 'entropy', 'dtc_splitter': 'random', 'dtc_min_samples_split': 34, 'dtc_min_samples_leaf': 3, 'dtc_max_features': 5}. Best is trial 29 with value: 0.999955.[0m
