[32m[I 2022-10-26 00:08:24,938][0m Trial 90 finished with value: 0.7758509777524272 and parameters: {'agc_alpha': 19.726719498892802, 'agc_l1_ratio': 1.0, 'agc_loss': 'log'}. Best is trial 66 with value: 0.780046.[0m
[32m[I 2022-10-26 00:08:24,940][0m Trial 91 finished with value: 0.6980677218651827 and parameters: {'agc_alpha': 1.0235230643708588, 'agc_l1_ratio': 1.0, 'agc_loss': 'log'}. Best is trial 66 with value: 0.780046.[0m
[32m[I 2022-10-26 00:08:25,030][0m Trial 89 finished with value: 0.7761171444285183 and parameters: {'agc_alpha': 23.87065720629022, 'agc_l1_ratio': 1.0, 'agc_loss': 'log'}. Best is trial 66 with value: 0.780046.[0m
[32m[I 2022-10-26 00:08:25,031][0m Trial 88 finished with value: 0.7195636376082555 and parameters: {'agc_alpha': 0.003837275283932397, 'agc_l1_ratio': 1.0, 'agc_loss': 'log'}. Best is trial 66 with value: 0.780046.[0m
[32m[I 2022-10-26 00:08:25,217][0m Trial 95 finished with value: 0.7715846255124071 and parameters: {'agc_alpha': 25.925716291222805, 'agc_l1_ratio': 1.0, 'agc_loss': 'log'}. Best is trial 66 with value: 0.780046.[0m
[32m[I 2022-10-26 00:10:13,323][0m Trial 99 finished with value: 0.7436774946860609 and parameters: {'agc_alpha': 4.24648180757064, 'agc_l1_ratio': 0.5, 'agc_loss': 'smooth_hinge'}. Best is trial 66 with value: 0.780046.[0m
[32m[I 2022-10-26 00:10:13,327][0m Trial 96 finished with value: 0.7729349137037035 and parameters: {'agc_alpha': 7.520342358544207, 'agc_l1_ratio': 0.7000000000000001, 'agc_loss': 'hinge'}. Best is trial 66 with value: 0.780046.[0m
[32m[I 2022-10-26 00:10:13,328][0m Trial 98 finished with value: 0.770946633920731 and parameters: {'agc_alpha': 4.4474521137095895, 'agc_l1_ratio': 0.7000000000000001, 'agc_loss': 'smooth_hinge'}. Best is trial 66 with value: 0.780046.[0m
[32m[I 2022-10-26 00:10:13,415][0m Trial 97 finished with value: 0.7699965224659736 and parameters: {'agc_alpha': 4.030486853337515, 'agc_l1_ratio': 0.7000000000000001, 'agc_loss': 'smooth_hinge'}. Best is trial 66 with value: 0.780046.[0m
[32m[I 2022-10-26 00:10:13,691][0m Study finished.[0m
[32m[I 2022-10-26 00:10:13,713][0m --------------------------------------------------------------------------------[0m
[32m[I 2022-10-26 00:10:13,714][0m --------------------       BalancedBaggingClassifier        --------------------[0m
[32m[I 2022-10-26 00:10:13,714][0m --------------------------------------------------------------------------------[0m
[32m[I 2022-10-26 00:10:13,745][0m A new study created in RDB with name: BalancedBaggingClassifier_c963b74b[0m
[32m[I 2022-10-26 00:10:13,754][0m Study started.[0m
[32m[I 2022-10-26 00:10:32,767][0m Trial 5 finished with value: 0.9632564487145254 and parameters: {'bbc_n_estimators': 9, 'bbc_max_features': 3, 'bbc_bootstrap': False, 'bbc_sampling_strategy': 'all'}. Best is trial 5 with value: 0.963256.[0m
[32m[I 2022-10-26 00:10:34,974][0m Trial 4 finished with value: 0.9968178109240378 and parameters: {'bbc_n_estimators': 11, 'bbc_max_features': 7, 'bbc_bootstrap': False, 'bbc_sampling_strategy': 'not minority'}. Best is trial 4 with value: 0.996818.[0m
[32m[I 2022-10-26 00:10:36,573][0m Trial 2 finished with value: 0.9771480377673846 and parameters: {'bbc_n_estimators': 14, 'bbc_max_features': 2, 'bbc_bootstrap': False, 'bbc_sampling_strategy': 'not minority'}. Best is trial 4 with value: 0.996818.[0m
[32m[I 2022-10-26 00:10:40,393][0m Trial 7 finished with value: 0.9977639655292192 and parameters: {'bbc_n_estimators': 17, 'bbc_max_features': 6, 'bbc_bootstrap': False, 'bbc_sampling_strategy': 'not minority'}. Best is trial 7 with value: 0.997764.[0m
[32m[I 2022-10-26 00:10:44,948][0m Trial 0 finished with value: 0.9974548355978963 and parameters: {'bbc_n_estimators': 20, 'bbc_max_features': 7, 'bbc_bootstrap': False, 'bbc_sampling_strategy': 'not minority'}. Best is trial 7 with value: 0.997764.[0m
[32m[I 2022-10-26 00:10:50,616][0m Trial 10 finished with value: 0.9766044387712131 and parameters: {'bbc_n_estimators': 9, 'bbc_max_features': 4, 'bbc_bootstrap': False, 'bbc_sampling_strategy': 'not minority'}. Best is trial 7 with value: 0.997764.[0m
[32m[I 2022-10-26 00:10:51,263][0m Trial 3 finished with value: 0.9846795695553392 and parameters: {'bbc_n_estimators': 17, 'bbc_max_features': 5, 'bbc_bootstrap': False, 'bbc_sampling_strategy': 'majority'}. Best is trial 7 with value: 0.997764.[0m
[32m[I 2022-10-26 00:10:52,432][0m Trial 6 finished with value: 0.9870248528913131 and parameters: {'bbc_n_estimators': 10, 'bbc_max_features': 5, 'bbc_bootstrap': True, 'bbc_sampling_strategy': 'not majority'}. Best is trial 7 with value: 0.997764.[0m
[32m[I 2022-10-26 00:10:53,350][0m Trial 8 finished with value: 0.9633011960823644 and parameters: {'bbc_n_estimators': 12, 'bbc_max_features': 1, 'bbc_bootstrap': True, 'bbc_sampling_strategy': 'not minority'}. Best is trial 7 with value: 0.997764.[0m
[32m[I 2022-10-26 00:10:56,295][0m Trial 9 finished with value: 0.9239626253872668 and parameters: {'bbc_n_estimators': 19, 'bbc_max_features': 1, 'bbc_bootstrap': False, 'bbc_sampling_strategy': 'not minority'}. Best is trial 7 with value: 0.997764.[0m
[32m[I 2022-10-26 00:10:57,943][0m Trial 1 finished with value: 0.9987782953246581 and parameters: {'bbc_n_estimators': 16, 'bbc_max_features': 6, 'bbc_bootstrap': True, 'bbc_sampling_strategy': 'majority'}. Best is trial 1 with value: 0.998778.[0m
[32m[I 2022-10-26 00:11:09,799][0m Trial 17 finished with value: 0.9979104735044942 and parameters: {'bbc_n_estimators': 6, 'bbc_max_features': 6, 'bbc_bootstrap': True, 'bbc_sampling_strategy': 'all'}. Best is trial 1 with value: 0.998778.[0m
[32m[I 2022-10-26 00:11:12,824][0m Trial 12 finished with value: 0.9914264892824446 and parameters: {'bbc_n_estimators': 19, 'bbc_max_features': 3, 'bbc_bootstrap': True, 'bbc_sampling_strategy': 'all'}. Best is trial 1 with value: 0.998778.[0m
[32m[I 2022-10-26 00:11:13,419][0m Trial 14 finished with value: 0.28488616805579425 and parameters: {'bbc_n_estimators': 18, 'bbc_max_features': 1, 'bbc_bootstrap': False, 'bbc_sampling_strategy': 'majority'}. Best is trial 1 with value: 0.998778.[0m
[32m[I 2022-10-26 00:11:16,151][0m Trial 15 finished with value: 0.9856125698843242 and parameters: {'bbc_n_estimators': 10, 'bbc_max_features': 6, 'bbc_bootstrap': True, 'bbc_sampling_strategy': 'majority'}. Best is trial 1 with value: 0.998778.[0m
[32m[I 2022-10-26 00:11:22,770][0m Trial 21 finished with value: 0.9977159736761152 and parameters: {'bbc_n_estimators': 5, 'bbc_max_features': 6, 'bbc_bootstrap': True, 'bbc_sampling_strategy': 'all'}. Best is trial 1 with value: 0.998778.[0m
[32m[I 2022-10-26 00:11:23,481][0m Trial 19 finished with value: 0.9992697399606445 and parameters: {'bbc_n_estimators': 5, 'bbc_max_features': 6, 'bbc_bootstrap': True, 'bbc_sampling_strategy': 'majority'}. Best is trial 19 with value: 0.99927.[0m
[32m[I 2022-10-26 00:11:25,244][0m Trial 22 finished with value: 0.9977159736761152 and parameters: {'bbc_n_estimators': 5, 'bbc_max_features': 6, 'bbc_bootstrap': True, 'bbc_sampling_strategy': 'all'}. Best is trial 19 with value: 0.99927.[0m
[32m[I 2022-10-26 00:11:25,544][0m Trial 20 finished with value: 0.9992697399606445 and parameters: {'bbc_n_estimators': 5, 'bbc_max_features': 6, 'bbc_bootstrap': True, 'bbc_sampling_strategy': 'majority'}. Best is trial 19 with value: 0.99927.[0m
[32m[I 2022-10-26 00:11:26,327][0m Trial 13 finished with value: 0.9045101238481802 and parameters: {'bbc_n_estimators': 18, 'bbc_max_features': 2, 'bbc_bootstrap': False, 'bbc_sampling_strategy': 'not majority'}. Best is trial 19 with value: 0.99927.[0m
[32m[I 2022-10-26 00:11:31,051][0m Trial 16 finished with value: 0.9857341585773326 and parameters: {'bbc_n_estimators': 18, 'bbc_max_features': 5, 'bbc_bootstrap': True, 'bbc_sampling_strategy': 'majority'}. Best is trial 19 with value: 0.99927.[0m
[32m[I 2022-10-26 00:11:33,551][0m Trial 18 finished with value: 0.9987807748861679 and parameters: {'bbc_n_estimators': 15, 'bbc_max_features': 6, 'bbc_bootstrap': True, 'bbc_sampling_strategy': 'majority'}. Best is trial 19 with value: 0.99927.[0m
[32m[I 2022-10-26 00:11:36,958][0m Trial 11 finished with value: 0.9976939673364988 and parameters: {'bbc_n_estimators': 16, 'bbc_max_features': 6, 'bbc_bootstrap': True, 'bbc_sampling_strategy': 'not majority'}. Best is trial 19 with value: 0.99927.[0m
[32m[I 2022-10-26 00:11:40,450][0m Trial 23 finished with value: 0.9968495280182673 and parameters: {'bbc_n_estimators': 5, 'bbc_max_features': 5, 'bbc_bootstrap': True, 'bbc_sampling_strategy': 'not majority'}. Best is trial 19 with value: 0.99927.[0m
[32m[I 2022-10-26 00:11:41,976][0m Trial 26 finished with value: 0.9846285965823098 and parameters: {'bbc_n_estimators': 7, 'bbc_max_features': 5, 'bbc_bootstrap': True, 'bbc_sampling_strategy': 'majority'}. Best is trial 19 with value: 0.99927.[0m
[32m[I 2022-10-26 00:11:43,159][0m Trial 27 finished with value: 0.9846285965823098 and parameters: {'bbc_n_estimators': 7, 'bbc_max_features': 5, 'bbc_bootstrap': True, 'bbc_sampling_strategy': 'majority'}. Best is trial 19 with value: 0.99927.[0m
[32m[I 2022-10-26 00:11:49,156][0m Trial 28 finished with value: 0.9988204209733362 and parameters: {'bbc_n_estimators': 7, 'bbc_max_features': 7, 'bbc_bootstrap': True, 'bbc_sampling_strategy': 'majority'}. Best is trial 19 with value: 0.99927.[0m
[32m[I 2022-10-26 00:11:53,945][0m Trial 24 finished with value: 0.9846820844044273 and parameters: {'bbc_n_estimators': 14, 'bbc_max_features': 5, 'bbc_bootstrap': True, 'bbc_sampling_strategy': 'majority'}. Best is trial 19 with value: 0.99927.[0m
[32m[I 2022-10-26 00:11:55,749][0m Trial 30 finished with value: 0.9988204209733362 and parameters: {'bbc_n_estimators': 7, 'bbc_max_features': 7, 'bbc_bootstrap': True, 'bbc_sampling_strategy': 'majority'}. Best is trial 19 with value: 0.99927.[0m
[32m[I 2022-10-26 00:11:56,722][0m Trial 25 finished with value: 0.9846281276804356 and parameters: {'bbc_n_estimators': 15, 'bbc_max_features': 5, 'bbc_bootstrap': True, 'bbc_sampling_strategy': 'majority'}. Best is trial 19 with value: 0.99927.[0m
[32m[I 2022-10-26 00:11:58,699][0m Trial 31 finished with value: 0.9988204209733362 and parameters: {'bbc_n_estimators': 7, 'bbc_max_features': 7, 'bbc_bootstrap': True, 'bbc_sampling_strategy': 'majority'}. Best is trial 19 with value: 0.99927.[0m
[32m[I 2022-10-26 00:12:02,745][0m Trial 32 finished with value: 0.9988303664751103 and parameters: {'bbc_n_estimators': 8, 'bbc_max_features': 7, 'bbc_bootstrap': True, 'bbc_sampling_strategy': 'majority'}. Best is trial 19 with value: 0.99927.[0m
[32m[I 2022-10-26 00:12:07,944][0m Trial 34 finished with value: 0.9988204209733362 and parameters: {'bbc_n_estimators': 7, 'bbc_max_features': 7, 'bbc_bootstrap': True, 'bbc_sampling_strategy': 'majority'}. Best is trial 19 with value: 0.99927.[0m
[32m[I 2022-10-26 00:12:08,220][0m Trial 29 finished with value: 0.9986964735389077 and parameters: {'bbc_n_estimators': 14, 'bbc_max_features': 7, 'bbc_bootstrap': True, 'bbc_sampling_strategy': 'majority'}. Best is trial 19 with value: 0.99927.[0m
[32m[I 2022-10-26 00:12:13,780][0m Trial 35 finished with value: 0.9988204209733362 and parameters: {'bbc_n_estimators': 7, 'bbc_max_features': 7, 'bbc_bootstrap': True, 'bbc_sampling_strategy': 'majority'}. Best is trial 19 with value: 0.99927.[0m
[32m[I 2022-10-26 00:12:16,872][0m Trial 33 finished with value: 0.9986964735389077 and parameters: {'bbc_n_estimators': 14, 'bbc_max_features': 7, 'bbc_bootstrap': True, 'bbc_sampling_strategy': 'majority'}. Best is trial 19 with value: 0.99927.[0m
[32m[I 2022-10-26 00:12:17,467][0m Trial 36 finished with value: 0.9988303664751103 and parameters: {'bbc_n_estimators': 8, 'bbc_max_features': 7, 'bbc_bootstrap': True, 'bbc_sampling_strategy': 'majority'}. Best is trial 19 with value: 0.99927.[0m
[32m[I 2022-10-26 00:12:18,463][0m Trial 37 finished with value: 0.9988303664751103 and parameters: {'bbc_n_estimators': 8, 'bbc_max_features': 7, 'bbc_bootstrap': True, 'bbc_sampling_strategy': 'majority'}. Best is trial 19 with value: 0.99927.[0m
[32m[I 2022-10-26 00:12:20,013][0m Trial 38 finished with value: 0.9988303664751103 and parameters: {'bbc_n_estimators': 8, 'bbc_max_features': 7, 'bbc_bootstrap': True, 'bbc_sampling_strategy': 'majority'}. Best is trial 19 with value: 0.99927.[0m
[32m[I 2022-10-26 00:12:24,399][0m Trial 39 finished with value: 0.9988303664751103 and parameters: {'bbc_n_estimators': 8, 'bbc_max_features': 7, 'bbc_bootstrap': True, 'bbc_sampling_strategy': 'majority'}. Best is trial 19 with value: 0.99927.[0m
[32m[I 2022-10-26 00:12:26,172][0m Trial 41 finished with value: 0.9988154689097268 and parameters: {'bbc_n_estimators': 6, 'bbc_max_features': 7, 'bbc_bootstrap': True, 'bbc_sampling_strategy': 'majority'}. Best is trial 19 with value: 0.99927.[0m
[32m[I 2022-10-26 00:12:30,522][0m Trial 40 finished with value: 0.9988303664751103 and parameters: {'bbc_n_estimators': 8, 'bbc_max_features': 7, 'bbc_bootstrap': True, 'bbc_sampling_strategy': 'majority'}. Best is trial 19 with value: 0.99927.[0m
[32m[I 2022-10-26 00:12:33,735][0m Trial 43 finished with value: 0.967153256114614 and parameters: {'bbc_n_estimators': 8, 'bbc_max_features': 4, 'bbc_bootstrap': True, 'bbc_sampling_strategy': 'majority'}. Best is trial 19 with value: 0.99927.[0m
[32m[I 2022-10-26 00:12:33,924][0m Trial 46 finished with value: 0.9673692790934866 and parameters: {'bbc_n_estimators': 6, 'bbc_max_features': 4, 'bbc_bootstrap': True, 'bbc_sampling_strategy': 'majority'}. Best is trial 19 with value: 0.99927.[0m
[32m[I 2022-10-26 00:12:35,798][0m Trial 42 finished with value: 0.9988303664751103 and parameters: {'bbc_n_estimators': 8, 'bbc_max_features': 7, 'bbc_bootstrap': True, 'bbc_sampling_strategy': 'majority'}. Best is trial 19 with value: 0.99927.[0m
[32m[I 2022-10-26 00:12:36,520][0m Trial 44 finished with value: 0.9558297650644431 and parameters: {'bbc_n_estimators': 9, 'bbc_max_features': 4, 'bbc_bootstrap': True, 'bbc_sampling_strategy': 'majority'}. Best is trial 19 with value: 0.99927.[0m
[32m[I 2022-10-26 00:12:41,227][0m Trial 47 finished with value: 0.9673692790934866 and parameters: {'bbc_n_estimators': 6, 'bbc_max_features': 4, 'bbc_bootstrap': True, 'bbc_sampling_strategy': 'majority'}. Best is trial 19 with value: 0.99927.[0m
[32m[I 2022-10-26 00:12:41,564][0m Trial 45 finished with value: 0.9558297650644431 and parameters: {'bbc_n_estimators': 9, 'bbc_max_features': 4, 'bbc_bootstrap': True, 'bbc_sampling_strategy': 'majority'}. Best is trial 19 with value: 0.99927.[0m
[32m[I 2022-10-26 00:12:54,014][0m Trial 48 finished with value: 0.9558187119893566 and parameters: {'bbc_n_estimators': 11, 'bbc_max_features': 4, 'bbc_bootstrap': True, 'bbc_sampling_strategy': 'majority'}. Best is trial 19 with value: 0.99927.[0m
[32m[I 2022-10-26 00:12:55,568][0m Trial 52 finished with value: 0.9971684127168321 and parameters: {'bbc_n_estimators': 11, 'bbc_max_features': 6, 'bbc_bootstrap': False, 'bbc_sampling_strategy': 'not minority'}. Best is trial 19 with value: 0.99927.[0m
[32m[I 2022-10-26 00:12:55,574][0m Trial 49 finished with value: 0.9538424898522148 and parameters: {'bbc_n_estimators': 10, 'bbc_max_features': 4, 'bbc_bootstrap': True, 'bbc_sampling_strategy': 'majority'}. Best is trial 19 with value: 0.99927.[0m
[32m[I 2022-10-26 00:12:55,687][0m Trial 50 finished with value: 0.9975253227486186 and parameters: {'bbc_n_estimators': 11, 'bbc_max_features': 6, 'bbc_bootstrap': True, 'bbc_sampling_strategy': 'not minority'}. Best is trial 19 with value: 0.99927.[0m
[32m[I 2022-10-26 00:12:56,243][0m Trial 51 finished with value: 0.9975253227486186 and parameters: {'bbc_n_estimators': 11, 'bbc_max_features': 6, 'bbc_bootstrap': True, 'bbc_sampling_strategy': 'not minority'}. Best is trial 19 with value: 0.99927.[0m
[32m[I 2022-10-26 00:12:56,414][0m Trial 53 finished with value: 0.9976538388941629 and parameters: {'bbc_n_estimators': 12, 'bbc_max_features': 6, 'bbc_bootstrap': False, 'bbc_sampling_strategy': 'not minority'}. Best is trial 19 with value: 0.99927.[0m
[32m[I 2022-10-26 00:12:58,812][0m Trial 55 finished with value: 0.9971684127168321 and parameters: {'bbc_n_estimators': 11, 'bbc_max_features': 6, 'bbc_bootstrap': False, 'bbc_sampling_strategy': 'not minority'}. Best is trial 19 with value: 0.99927.[0m
[32m[I 2022-10-26 00:12:59,178][0m Trial 54 finished with value: 0.9976538388941629 and parameters: {'bbc_n_estimators': 12, 'bbc_max_features': 6, 'bbc_bootstrap': False, 'bbc_sampling_strategy': 'not minority'}. Best is trial 19 with value: 0.99927.[0m
[32m[I 2022-10-26 00:13:03,713][0m Trial 56 finished with value: 0.9972640070721189 and parameters: {'bbc_n_estimators': 10, 'bbc_max_features': 6, 'bbc_bootstrap': False, 'bbc_sampling_strategy': 'not minority'}. Best is trial 19 with value: 0.99927.[0m
[32m[I 2022-10-26 00:13:12,828][0m Trial 57 finished with value: 0.9966241886969389 and parameters: {'bbc_n_estimators': 5, 'bbc_max_features': 6, 'bbc_bootstrap': False, 'bbc_sampling_strategy': 'not majority'}. Best is trial 19 with value: 0.99927.[0m
[32m[I 2022-10-26 00:13:13,360][0m Trial 59 finished with value: 0.9966241886969389 and parameters: {'bbc_n_estimators': 5, 'bbc_max_features': 6, 'bbc_bootstrap': False, 'bbc_sampling_strategy': 'not majority'}. Best is trial 19 with value: 0.99927.[0m
[32m[I 2022-10-26 00:13:13,360][0m Trial 58 finished with value: 0.9966241886969389 and parameters: {'bbc_n_estimators': 5, 'bbc_max_features': 6, 'bbc_bootstrap': False, 'bbc_sampling_strategy': 'not majority'}. Best is trial 19 with value: 0.99927.[0m
[32m[I 2022-10-26 00:13:17,370][0m Trial 60 finished with value: 0.9962282886551248 and parameters: {'bbc_n_estimators': 5, 'bbc_max_features': 7, 'bbc_bootstrap': False, 'bbc_sampling_strategy': 'not majority'}. Best is trial 19 with value: 0.99927.[0m
[32m[I 2022-10-26 00:13:17,371][0m Trial 61 finished with value: 0.9962282886551248 and parameters: {'bbc_n_estimators': 5, 'bbc_max_features': 7, 'bbc_bootstrap': False, 'bbc_sampling_strategy': 'not majority'}. Best is trial 19 with value: 0.99927.[0m
[32m[I 2022-10-26 00:13:22,268][0m Trial 63 finished with value: 0.996641911232823 and parameters: {'bbc_n_estimators': 5, 'bbc_max_features': 7, 'bbc_bootstrap': True, 'bbc_sampling_strategy': 'not majority'}. Best is trial 19 with value: 0.99927.[0m
[32m[I 2022-10-26 00:13:23,007][0m Trial 65 finished with value: 0.9556750013663953 and parameters: {'bbc_n_estimators': 6, 'bbc_max_features': 3, 'bbc_bootstrap': True, 'bbc_sampling_strategy': 'all'}. Best is trial 19 with value: 0.99927.[0m
[32m[I 2022-10-26 00:13:23,007][0m Trial 66 finished with value: 0.9556750013663953 and parameters: {'bbc_n_estimators': 6, 'bbc_max_features': 3, 'bbc_bootstrap': True, 'bbc_sampling_strategy': 'all'}. Best is trial 19 with value: 0.99927.[0m
[32m[I 2022-10-26 00:13:24,129][0m Trial 67 finished with value: 0.9975565667727553 and parameters: {'bbc_n_estimators': 6, 'bbc_max_features': 7, 'bbc_bootstrap': True, 'bbc_sampling_strategy': 'all'}. Best is trial 19 with value: 0.99927.[0m
[32m[I 2022-10-26 00:13:26,635][0m Trial 62 finished with value: 0.9972194514493479 and parameters: {'bbc_n_estimators': 6, 'bbc_max_features': 7, 'bbc_bootstrap': True, 'bbc_sampling_strategy': 'not majority'}. Best is trial 19 with value: 0.99927.[0m
[32m[I 2022-10-26 00:13:27,545][0m Trial 64 finished with value: 0.996641911232823 and parameters: {'bbc_n_estimators': 5, 'bbc_max_features': 7, 'bbc_bootstrap': True, 'bbc_sampling_strategy': 'not majority'}. Best is trial 19 with value: 0.99927.[0m
[32m[I 2022-10-26 00:13:34,940][0m Trial 69 finished with value: 0.7174946418498755 and parameters: {'bbc_n_estimators': 8, 'bbc_max_features': 3, 'bbc_bootstrap': True, 'bbc_sampling_strategy': 'majority'}. Best is trial 19 with value: 0.99927.[0m
[32m[I 2022-10-26 00:13:36,160][0m Trial 70 finished with value: 0.9977659078510596 and parameters: {'bbc_n_estimators': 8, 'bbc_max_features': 7, 'bbc_bootstrap': True, 'bbc_sampling_strategy': 'all'}. Best is trial 19 with value: 0.99927.[0m
[32m[I 2022-10-26 00:13:39,210][0m Trial 68 finished with value: 0.9988303664751103 and parameters: {'bbc_n_estimators': 8, 'bbc_max_features': 7, 'bbc_bootstrap': True, 'bbc_sampling_strategy': 'majority'}. Best is trial 19 with value: 0.99927.[0m
[32m[I 2022-10-26 00:13:43,691][0m Trial 72 finished with value: 0.9988303664751103 and parameters: {'bbc_n_estimators': 8, 'bbc_max_features': 7, 'bbc_bootstrap': True, 'bbc_sampling_strategy': 'majority'}. Best is trial 19 with value: 0.99927.[0m
[32m[I 2022-10-26 00:13:45,348][0m Trial 71 finished with value: 0.9988303664751103 and parameters: {'bbc_n_estimators': 8, 'bbc_max_features': 7, 'bbc_bootstrap': True, 'bbc_sampling_strategy': 'majority'}. Best is trial 19 with value: 0.99927.[0m
[32m[I 2022-10-26 00:13:45,642][0m Trial 73 finished with value: 0.9988303664751103 and parameters: {'bbc_n_estimators': 8, 'bbc_max_features': 7, 'bbc_bootstrap': True, 'bbc_sampling_strategy': 'majority'}. Best is trial 19 with value: 0.99927.[0m
[32m[I 2022-10-26 00:13:48,773][0m Trial 75 finished with value: 0.9988303664751103 and parameters: {'bbc_n_estimators': 8, 'bbc_max_features': 7, 'bbc_bootstrap': True, 'bbc_sampling_strategy': 'majority'}. Best is trial 19 with value: 0.99927.[0m
[32m[I 2022-10-26 00:13:50,782][0m Trial 74 finished with value: 0.9988204214540845 and parameters: {'bbc_n_estimators': 9, 'bbc_max_features': 7, 'bbc_bootstrap': True, 'bbc_sampling_strategy': 'majority'}. Best is trial 19 with value: 0.99927.[0m
