[32m[I 2022-10-26 02:11:13,861][0m Trial 83 finished with value: 0.14506927147139223 and parameters: {'cdc_loss': 'modified_huber', 'cdc_penalty': 'l1/l2', 'cdc_C': 0.001358583899188421, 'cdc_alpha': 0.005995292783741408, 'cdc_selection': 'cyclic'}. Best is trial 84 with value: 0.796675.[0m
[32m[I 2022-10-26 02:11:29,360][0m Trial 86 finished with value: 0.7795978101051858 and parameters: {'cdc_loss': 'modified_huber', 'cdc_penalty': 'l1/l2', 'cdc_C': 0.0010868786728639296, 'cdc_alpha': 0.004839782173908367, 'cdc_selection': 'cyclic'}. Best is trial 84 with value: 0.796675.[0m
[32m[I 2022-10-26 02:11:29,360][0m Trial 85 finished with value: 0.7782192114676124 and parameters: {'cdc_loss': 'modified_huber', 'cdc_penalty': 'l1/l2', 'cdc_C': 0.001005655518811047, 'cdc_alpha': 0.006512363613904057, 'cdc_selection': 'cyclic'}. Best is trial 84 with value: 0.796675.[0m
[32m[I 2022-10-26 02:11:29,758][0m Trial 87 finished with value: 0.7780322122341266 and parameters: {'cdc_loss': 'modified_huber', 'cdc_penalty': 'l1/l2', 'cdc_C': 0.0010702284951358831, 'cdc_alpha': 0.007649364046677464, 'cdc_selection': 'cyclic'}. Best is trial 84 with value: 0.796675.[0m
[32m[I 2022-10-26 02:11:29,848][0m Trial 88 finished with value: 0.7817674601335094 and parameters: {'cdc_loss': 'modified_huber', 'cdc_penalty': 'l1/l2', 'cdc_C': 0.0010300033023343997, 'cdc_alpha': 0.010125703723399448, 'cdc_selection': 'cyclic'}. Best is trial 84 with value: 0.796675.[0m
[32m[I 2022-10-26 02:16:05,510][0m Trial 89 finished with value: 0.7409784896773368 and parameters: {'cdc_loss': 'modified_huber', 'cdc_penalty': 'l1/l2', 'cdc_C': 0.0024379607760935565, 'cdc_alpha': 0.001492562370308832, 'cdc_selection': 'cyclic'}. Best is trial 84 with value: 0.796675.[0m
[32m[I 2022-10-26 02:16:06,041][0m Trial 90 finished with value: 0.7453597991166653 and parameters: {'cdc_loss': 'modified_huber', 'cdc_penalty': 'l1/l2', 'cdc_C': 0.0019993038385396054, 'cdc_alpha': 0.10514126336145978, 'cdc_selection': 'cyclic'}. Best is trial 84 with value: 0.796675.[0m
[32m[I 2022-10-26 02:16:21,563][0m Trial 91 finished with value: 0.7409777053937231 and parameters: {'cdc_loss': 'modified_huber', 'cdc_penalty': 'l1/l2', 'cdc_C': 0.002372698576178355, 'cdc_alpha': 0.08855618492874805, 'cdc_selection': 'cyclic'}. Best is trial 84 with value: 0.796675.[0m
[32m[I 2022-10-26 02:16:36,780][0m Trial 94 finished with value: 0.7454129117433878 and parameters: {'cdc_loss': 'modified_huber', 'cdc_penalty': 'l1/l2', 'cdc_C': 0.0020418130485063443, 'cdc_alpha': 0.0734263360258833, 'cdc_selection': 'cyclic'}. Best is trial 84 with value: 0.796675.[0m
[32m[I 2022-10-26 02:16:36,864][0m Trial 93 finished with value: 0.7945798369610385 and parameters: {'cdc_loss': 'modified_huber', 'cdc_penalty': 'l1/l2', 'cdc_C': 0.0019154942414142324, 'cdc_alpha': 0.012817475433173749, 'cdc_selection': 'cyclic'}. Best is trial 84 with value: 0.796675.[0m
[32m[I 2022-10-26 02:16:37,122][0m Trial 96 finished with value: 0.7453863402733103 and parameters: {'cdc_loss': 'modified_huber', 'cdc_penalty': 'l1/l2', 'cdc_C': 0.0021370632963703113, 'cdc_alpha': 0.10807883088745951, 'cdc_selection': 'cyclic'}. Best is trial 84 with value: 0.796675.[0m
[32m[I 2022-10-26 02:16:37,198][0m Trial 95 finished with value: 0.7946453761388466 and parameters: {'cdc_loss': 'modified_huber', 'cdc_penalty': 'l1/l2', 'cdc_C': 0.0018345139147695935, 'cdc_alpha': 0.06501954616778793, 'cdc_selection': 'cyclic'}. Best is trial 84 with value: 0.796675.[0m
[32m[I 2022-10-26 02:16:37,199][0m Trial 92 finished with value: 0.7743291883994402 and parameters: {'cdc_loss': 'modified_huber', 'cdc_penalty': 'l1/l2', 'cdc_C': 0.0032031427217793615, 'cdc_alpha': 0.012497328046407744, 'cdc_selection': 'cyclic'}. Best is trial 84 with value: 0.796675.[0m
[32m[I 2022-10-26 02:19:20,153][0m Trial 97 finished with value: 0.7453971251226347 and parameters: {'cdc_loss': 'modified_huber', 'cdc_penalty': 'l1/l2', 'cdc_C': 0.001941668787432181, 'cdc_alpha': 0.07577552238954181, 'cdc_selection': 'cyclic'}. Best is trial 84 with value: 0.796675.[0m
[32m[I 2022-10-26 02:19:20,482][0m Trial 98 finished with value: 0.794640395248555 and parameters: {'cdc_loss': 'modified_huber', 'cdc_penalty': 'l1/l2', 'cdc_C': 0.0018432078791115777, 'cdc_alpha': 0.03496003470361507, 'cdc_selection': 'cyclic'}. Best is trial 84 with value: 0.796675.[0m
[32m[I 2022-10-26 02:19:21,058][0m Trial 99 finished with value: 0.7644874937607764 and parameters: {'cdc_loss': 'modified_huber', 'cdc_penalty': 'l1/l2', 'cdc_C': 0.014299665379955287, 'cdc_alpha': 0.013346621646756473, 'cdc_selection': 'cyclic'}. Best is trial 84 with value: 0.796675.[0m
[32m[I 2022-10-26 02:19:21,119][0m Study finished.[0m
[32m[I 2022-10-26 02:19:21,135][0m --------------------------------------------------------------------------------[0m
[32m[I 2022-10-26 02:19:21,135][0m --------------------              ComplementNB              --------------------[0m
[32m[I 2022-10-26 02:19:21,136][0m --------------------------------------------------------------------------------[0m
[32m[I 2022-10-26 02:19:21,163][0m A new study created in RDB with name: ComplementNB_c963b74b[0m
[32m[I 2022-10-26 02:19:21,170][0m Study started.[0m
[32m[I 2022-10-26 02:19:23,329][0m Trial 4 finished with value: 0.08231845847806078 and parameters: {'compnb_alpha': 0.8500000000000001, 'compnb_fit_prior': False, 'compnb_norm': False}. Best is trial 3 with value: 0.0855343.[0m
[32m[I 2022-10-26 02:19:23,333][0m Trial 6 finished with value: 0.08553430843786972 and parameters: {'compnb_alpha': 0.5, 'compnb_fit_prior': True, 'compnb_norm': True}. Best is trial 3 with value: 0.0855343.[0m
[32m[I 2022-10-26 02:19:23,335][0m Trial 5 finished with value: 0.08553430843786972 and parameters: {'compnb_alpha': 0.65, 'compnb_fit_prior': True, 'compnb_norm': True}. Best is trial 3 with value: 0.0855343.[0m
[32m[I 2022-10-26 02:19:23,468][0m Trial 2 finished with value: 0.08231845847806078 and parameters: {'compnb_alpha': 0.0, 'compnb_fit_prior': True, 'compnb_norm': False}. Best is trial 3 with value: 0.0855343.[0m
[32m[I 2022-10-26 02:19:23,473][0m Trial 3 finished with value: 0.08553430843786972 and parameters: {'compnb_alpha': 0.75, 'compnb_fit_prior': False, 'compnb_norm': True}. Best is trial 3 with value: 0.0855343.[0m
[32m[I 2022-10-26 02:19:23,540][0m Trial 1 finished with value: 0.08231845847806078 and parameters: {'compnb_alpha': 0.9, 'compnb_fit_prior': True, 'compnb_norm': False}. Best is trial 3 with value: 0.0855343.[0m
[32m[I 2022-10-26 02:19:23,542][0m Trial 0 finished with value: 0.08231845847806078 and parameters: {'compnb_alpha': 0.15000000000000002, 'compnb_fit_prior': False, 'compnb_norm': False}. Best is trial 3 with value: 0.0855343.[0m
[32m[I 2022-10-26 02:19:23,703][0m Trial 7 finished with value: 0.08553430843786972 and parameters: {'compnb_alpha': 0.65, 'compnb_fit_prior': False, 'compnb_norm': True}. Best is trial 3 with value: 0.0855343.[0m
[32m[I 2022-10-26 02:19:26,038][0m Trial 13 finished with value: 0.08231845847806078 and parameters: {'compnb_alpha': 1.0, 'compnb_fit_prior': False, 'compnb_norm': False}. Best is trial 3 with value: 0.0855343.[0m
[32m[I 2022-10-26 02:19:26,041][0m Trial 14 finished with value: 0.08553430843786972 and parameters: {'compnb_alpha': 0.65, 'compnb_fit_prior': True, 'compnb_norm': True}. Best is trial 3 with value: 0.0855343.[0m
[32m[I 2022-10-26 02:19:26,043][0m Trial 12 finished with value: 0.08553430843786972 and parameters: {'compnb_alpha': 0.25, 'compnb_fit_prior': False, 'compnb_norm': True}. Best is trial 3 with value: 0.0855343.[0m
[32m[I 2022-10-26 02:19:26,237][0m Trial 9 finished with value: 0.08553430843786972 and parameters: {'compnb_alpha': 0.25, 'compnb_fit_prior': True, 'compnb_norm': True}. Best is trial 3 with value: 0.0855343.[0m
[32m[I 2022-10-26 02:19:26,245][0m Trial 10 finished with value: 0.08231845847806078 and parameters: {'compnb_alpha': 1.0, 'compnb_fit_prior': True, 'compnb_norm': False}. Best is trial 3 with value: 0.0855343.[0m
[32m[I 2022-10-26 02:19:26,306][0m Trial 11 finished with value: 0.08553430843786972 and parameters: {'compnb_alpha': 0.7000000000000001, 'compnb_fit_prior': True, 'compnb_norm': True}. Best is trial 3 with value: 0.0855343.[0m
[32m[I 2022-10-26 02:19:26,430][0m Trial 15 finished with value: 0.08231845847806078 and parameters: {'compnb_alpha': 0.7000000000000001, 'compnb_fit_prior': True, 'compnb_norm': False}. Best is trial 3 with value: 0.0855343.[0m
[32m[I 2022-10-26 02:19:26,517][0m Trial 8 finished with value: 0.08553430843786972 and parameters: {'compnb_alpha': 0.05, 'compnb_fit_prior': False, 'compnb_norm': True}. Best is trial 3 with value: 0.0855343.[0m
[32m[I 2022-10-26 02:19:28,756][0m Trial 21 finished with value: 0.08553430843786972 and parameters: {'compnb_alpha': 0.45, 'compnb_fit_prior': False, 'compnb_norm': True}. Best is trial 21 with value: 0.0855343.[0m
[32m[I 2022-10-26 02:19:28,758][0m Trial 19 finished with value: 0.08553430843786972 and parameters: {'compnb_alpha': 0.5, 'compnb_fit_prior': False, 'compnb_norm': True}. Best is trial 21 with value: 0.0855343.[0m
[32m[I 2022-10-26 02:19:28,840][0m Trial 20 finished with value: 0.08553430843786972 and parameters: {'compnb_alpha': 0.45, 'compnb_fit_prior': False, 'compnb_norm': True}. Best is trial 23 with value: 0.0855343.[0m
[32m[I 2022-10-26 02:19:28,898][0m Trial 18 finished with value: 0.08553430843786972 and parameters: {'compnb_alpha': 0.5, 'compnb_fit_prior': False, 'compnb_norm': True}. Best is trial 23 with value: 0.0855343.[0m
[32m[I 2022-10-26 02:19:29,035][0m Trial 22 finished with value: 0.08553430843786972 and parameters: {'compnb_alpha': 0.45, 'compnb_fit_prior': False, 'compnb_norm': True}. Best is trial 23 with value: 0.0855343.[0m
[32m[I 2022-10-26 02:19:29,039][0m Trial 16 finished with value: 0.08553430843786972 and parameters: {'compnb_alpha': 0.45, 'compnb_fit_prior': False, 'compnb_norm': True}. Best is trial 23 with value: 0.0855343.[0m
[32m[I 2022-10-26 02:19:29,101][0m Trial 23 finished with value: 0.08553430843786972 and parameters: {'compnb_alpha': 0.45, 'compnb_fit_prior': False, 'compnb_norm': True}. Best is trial 23 with value: 0.0855343.[0m
[32m[I 2022-10-26 02:19:29,102][0m Trial 17 finished with value: 0.08553430843786972 and parameters: {'compnb_alpha': 0.5, 'compnb_fit_prior': False, 'compnb_norm': True}. Best is trial 23 with value: 0.0855343.[0m
[32m[I 2022-10-26 02:19:31,410][0m Trial 31 finished with value: 0.08553430843786972 and parameters: {'compnb_alpha': 0.35000000000000003, 'compnb_fit_prior': True, 'compnb_norm': True}. Best is trial 31 with value: 0.0855343.[0m
[32m[I 2022-10-26 02:19:31,482][0m Trial 29 finished with value: 0.08553430843786972 and parameters: {'compnb_alpha': 0.35000000000000003, 'compnb_fit_prior': True, 'compnb_norm': True}. Best is trial 31 with value: 0.0855343.[0m
[32m[I 2022-10-26 02:19:31,577][0m Trial 30 finished with value: 0.08553430843786972 and parameters: {'compnb_alpha': 0.35000000000000003, 'compnb_fit_prior': True, 'compnb_norm': True}. Best is trial 31 with value: 0.0855343.[0m
[32m[I 2022-10-26 02:19:31,582][0m Trial 25 finished with value: 0.08553430843786972 and parameters: {'compnb_alpha': 0.30000000000000004, 'compnb_fit_prior': True, 'compnb_norm': True}. Best is trial 31 with value: 0.0855343.[0m
[32m[I 2022-10-26 02:19:31,584][0m Trial 27 finished with value: 0.08553430843786972 and parameters: {'compnb_alpha': 0.30000000000000004, 'compnb_fit_prior': True, 'compnb_norm': True}. Best is trial 31 with value: 0.0855343.[0m
[32m[I 2022-10-26 02:19:31,770][0m Trial 26 finished with value: 0.08553430843786972 and parameters: {'compnb_alpha': 0.35000000000000003, 'compnb_fit_prior': True, 'compnb_norm': True}. Best is trial 31 with value: 0.0855343.[0m
[32m[I 2022-10-26 02:19:31,829][0m Trial 24 finished with value: 0.08553430843786972 and parameters: {'compnb_alpha': 0.35000000000000003, 'compnb_fit_prior': True, 'compnb_norm': True}. Best is trial 31 with value: 0.0855343.[0m
[32m[I 2022-10-26 02:19:31,953][0m Trial 28 finished with value: 0.08553430843786972 and parameters: {'compnb_alpha': 0.35000000000000003, 'compnb_fit_prior': True, 'compnb_norm': True}. Best is trial 31 with value: 0.0855343.[0m
[32m[I 2022-10-26 02:19:34,152][0m Trial 35 finished with value: 0.08553430843786972 and parameters: {'compnb_alpha': 0.15000000000000002, 'compnb_fit_prior': False, 'compnb_norm': True}. Best is trial 39 with value: 0.0855343.[0m
[32m[I 2022-10-26 02:19:34,157][0m Trial 32 finished with value: 0.08553430843786972 and parameters: {'compnb_alpha': 0.55, 'compnb_fit_prior': False, 'compnb_norm': True}. Best is trial 39 with value: 0.0855343.[0m
[32m[I 2022-10-26 02:19:34,295][0m Trial 39 finished with value: 0.08553430843786972 and parameters: {'compnb_alpha': 0.2, 'compnb_fit_prior': False, 'compnb_norm': True}. Best is trial 39 with value: 0.0855343.[0m
[32m[I 2022-10-26 02:19:34,296][0m Trial 36 finished with value: 0.08553430843786972 and parameters: {'compnb_alpha': 0.15000000000000002, 'compnb_fit_prior': False, 'compnb_norm': True}. Best is trial 39 with value: 0.0855343.[0m
[32m[I 2022-10-26 02:19:34,297][0m Trial 34 finished with value: 0.08553430843786972 and parameters: {'compnb_alpha': 0.15000000000000002, 'compnb_fit_prior': False, 'compnb_norm': True}. Best is trial 39 with value: 0.0855343.[0m
[32m[I 2022-10-26 02:19:34,359][0m Trial 38 finished with value: 0.08553430843786972 and parameters: {'compnb_alpha': 0.15000000000000002, 'compnb_fit_prior': False, 'compnb_norm': True}. Best is trial 39 with value: 0.0855343.[0m
[32m[I 2022-10-26 02:19:34,543][0m Trial 33 finished with value: 0.08553430843786972 and parameters: {'compnb_alpha': 0.15000000000000002, 'compnb_fit_prior': False, 'compnb_norm': True}. Best is trial 39 with value: 0.0855343.[0m
[32m[I 2022-10-26 02:19:34,544][0m Trial 37 finished with value: 0.08553430843786972 and parameters: {'compnb_alpha': 0.15000000000000002, 'compnb_fit_prior': False, 'compnb_norm': True}. Best is trial 39 with value: 0.0855343.[0m
[32m[I 2022-10-26 02:19:36,842][0m Trial 44 finished with value: 0.08231845847806078 and parameters: {'compnb_alpha': 0.6000000000000001, 'compnb_fit_prior': False, 'compnb_norm': False}. Best is trial 3 with value: 0.0855343.[0m
[32m[I 2022-10-26 02:19:36,920][0m Trial 41 finished with value: 0.08231845847806078 and parameters: {'compnb_alpha': 0.55, 'compnb_fit_prior': False, 'compnb_norm': False}. Best is trial 3 with value: 0.0855343.[0m
[32m[I 2022-10-26 02:19:36,997][0m Trial 40 finished with value: 0.08231845847806078 and parameters: {'compnb_alpha': 0.6000000000000001, 'compnb_fit_prior': False, 'compnb_norm': False}. Best is trial 3 with value: 0.0855343.[0m
[32m[I 2022-10-26 02:19:36,998][0m Trial 42 finished with value: 0.08231845847806078 and parameters: {'compnb_alpha': 0.6000000000000001, 'compnb_fit_prior': False, 'compnb_norm': False}. Best is trial 3 with value: 0.0855343.[0m
[32m[I 2022-10-26 02:19:37,064][0m Trial 47 finished with value: 0.08231845847806078 and parameters: {'compnb_alpha': 0.6000000000000001, 'compnb_fit_prior': False, 'compnb_norm': False}. Best is trial 3 with value: 0.0855343.[0m
[32m[I 2022-10-26 02:19:37,194][0m Trial 43 finished with value: 0.08231845847806078 and parameters: {'compnb_alpha': 0.6000000000000001, 'compnb_fit_prior': False, 'compnb_norm': False}. Best is trial 3 with value: 0.0855343.[0m
[32m[I 2022-10-26 02:19:37,278][0m Trial 45 finished with value: 0.08231845847806078 and parameters: {'compnb_alpha': 0.55, 'compnb_fit_prior': False, 'compnb_norm': False}. Best is trial 3 with value: 0.0855343.[0m
[32m[I 2022-10-26 02:19:37,280][0m Trial 46 finished with value: 0.08231845847806078 and parameters: {'compnb_alpha': 0.6000000000000001, 'compnb_fit_prior': False, 'compnb_norm': False}. Best is trial 3 with value: 0.0855343.[0m
[32m[I 2022-10-26 02:19:39,489][0m Trial 50 finished with value: 0.08553430843786972 and parameters: {'compnb_alpha': 0.05, 'compnb_fit_prior': False, 'compnb_norm': True}. Best is trial 55 with value: 0.0855343.[0m
[32m[I 2022-10-26 02:19:39,499][0m Trial 52 finished with value: 0.08553430843786972 and parameters: {'compnb_alpha': 0.4, 'compnb_fit_prior': False, 'compnb_norm': True}. Best is trial 55 with value: 0.0855343.[0m
[32m[I 2022-10-26 02:19:39,565][0m Trial 55 finished with value: 0.08553430843786972 and parameters: {'compnb_alpha': 0.05, 'compnb_fit_prior': False, 'compnb_norm': True}. Best is trial 55 with value: 0.0855343.[0m
[32m[I 2022-10-26 02:19:39,566][0m Trial 49 finished with value: 0.08553430843786972 and parameters: {'compnb_alpha': 0.05, 'compnb_fit_prior': False, 'compnb_norm': True}. Best is trial 55 with value: 0.0855343.[0m
[32m[I 2022-10-26 02:19:39,626][0m Trial 53 finished with value: 0.08553430843786972 and parameters: {'compnb_alpha': 0.4, 'compnb_fit_prior': False, 'compnb_norm': True}. Best is trial 55 with value: 0.0855343.[0m
[32m[I 2022-10-26 02:19:39,630][0m Trial 51 finished with value: 0.08553430843786972 and parameters: {'compnb_alpha': 0.05, 'compnb_fit_prior': False, 'compnb_norm': True}. Best is trial 55 with value: 0.0855343.[0m
[32m[I 2022-10-26 02:19:39,630][0m Trial 48 finished with value: 0.08553430843786972 and parameters: {'compnb_alpha': 0.4, 'compnb_fit_prior': False, 'compnb_norm': True}. Best is trial 55 with value: 0.0855343.[0m
[32m[I 2022-10-26 02:19:39,817][0m Trial 54 finished with value: 0.08553430843786972 and parameters: {'compnb_alpha': 0.4, 'compnb_fit_prior': False, 'compnb_norm': True}. Best is trial 55 with value: 0.0855343.[0m
[32m[I 2022-10-26 02:19:42,187][0m Trial 56 finished with value: 0.08553430843786972 and parameters: {'compnb_alpha': 0.30000000000000004, 'compnb_fit_prior': True, 'compnb_norm': True}. Best is trial 63 with value: 0.0855343.[0m
[32m[I 2022-10-26 02:19:42,272][0m Trial 59 finished with value: 0.08553430843786972 and parameters: {'compnb_alpha': 0.30000000000000004, 'compnb_fit_prior': True, 'compnb_norm': True}. Best is trial 63 with value: 0.0855343.[0m
[32m[I 2022-10-26 02:19:42,273][0m Trial 58 finished with value: 0.08553430843786972 and parameters: {'compnb_alpha': 0.30000000000000004, 'compnb_fit_prior': True, 'compnb_norm': True}. Best is trial 63 with value: 0.0855343.[0m
[32m[I 2022-10-26 02:19:42,274][0m Trial 60 finished with value: 0.08553430843786972 and parameters: {'compnb_alpha': 0.30000000000000004, 'compnb_fit_prior': True, 'compnb_norm': True}. Best is trial 63 with value: 0.0855343.[0m
[32m[I 2022-10-26 02:19:42,481][0m Trial 63 finished with value: 0.08553430843786972 and parameters: {'compnb_alpha': 0.30000000000000004, 'compnb_fit_prior': True, 'compnb_norm': True}. Best is trial 63 with value: 0.0855343.[0m
[32m[I 2022-10-26 02:19:42,482][0m Trial 62 finished with value: 0.08553430843786972 and parameters: {'compnb_alpha': 0.30000000000000004, 'compnb_fit_prior': True, 'compnb_norm': True}. Best is trial 63 with value: 0.0855343.[0m
[32m[I 2022-10-26 02:19:42,485][0m Trial 57 finished with value: 0.08553430843786972 and parameters: {'compnb_alpha': 0.30000000000000004, 'compnb_fit_prior': True, 'compnb_norm': True}. Best is trial 63 with value: 0.0855343.[0m
[32m[I 2022-10-26 02:19:42,546][0m Trial 61 finished with value: 0.08553430843786972 and parameters: {'compnb_alpha': 0.30000000000000004, 'compnb_fit_prior': True, 'compnb_norm': True}. Best is trial 63 with value: 0.0855343.[0m
[32m[I 2022-10-26 02:19:44,641][0m Trial 64 finished with value: 0.08553430843786972 and parameters: {'compnb_alpha': 0.2, 'compnb_fit_prior': True, 'compnb_norm': True}. Best is trial 64 with value: 0.0855343.[0m
[32m[I 2022-10-26 02:19:45,027][0m Trial 66 finished with value: 0.08553430843786972 and parameters: {'compnb_alpha': 0.2, 'compnb_fit_prior': True, 'compnb_norm': True}. Best is trial 71 with value: 0.0855343.[0m
[32m[I 2022-10-26 02:19:45,028][0m Trial 68 finished with value: 0.08553430843786972 and parameters: {'compnb_alpha': 0.1, 'compnb_fit_prior': True, 'compnb_norm': True}. Best is trial 71 with value: 0.0855343.[0m
[32m[I 2022-10-26 02:19:45,029][0m Trial 65 finished with value: 0.08553430843786972 and parameters: {'compnb_alpha': 0.2, 'compnb_fit_prior': True, 'compnb_norm': True}. Best is trial 71 with value: 0.0855343.[0m
[32m[I 2022-10-26 02:19:45,030][0m Trial 71 finished with value: 0.08553430843786972 and parameters: {'compnb_alpha': 0.2, 'compnb_fit_prior': True, 'compnb_norm': True}. Best is trial 71 with value: 0.0855343.[0m
[32m[I 2022-10-26 02:19:45,294][0m Trial 67 finished with value: 0.08553430843786972 and parameters: {'compnb_alpha': 0.2, 'compnb_fit_prior': True, 'compnb_norm': True}. Best is trial 71 with value: 0.0855343.[0m
[32m[I 2022-10-26 02:19:45,368][0m Trial 70 finished with value: 0.08553430843786972 and parameters: {'compnb_alpha': 0.2, 'compnb_fit_prior': True, 'compnb_norm': True}. Best is trial 71 with value: 0.0855343.[0m
[32m[I 2022-10-26 02:19:45,445][0m Trial 69 finished with value: 0.08553430843786972 and parameters: {'compnb_alpha': 0.2, 'compnb_fit_prior': True, 'compnb_norm': True}. Best is trial 71 with value: 0.0855343.[0m
[32m[I 2022-10-26 02:19:47,191][0m Trial 72 finished with value: 0.08553430843786972 and parameters: {'compnb_alpha': 0.1, 'compnb_fit_prior': True, 'compnb_norm': True}. Best is trial 72 with value: 0.0855343.[0m
[32m[I 2022-10-26 02:19:47,749][0m Trial 75 finished with value: 0.08553430843786972 and parameters: {'compnb_alpha': 0.1, 'compnb_fit_prior': False, 'compnb_norm': True}. Best is trial 75 with value: 0.0855343.[0m
