[32m[I 2022-10-26 22:23:28,269][0m Trial 61 finished with value: 0.9999055299495849 and parameters: {'rfc_criterion': 'entropy', 'rfc_n_estimators': 140, 'rfc_min_samples_split': 47, 'rfc_min_samples_leaf': 1, 'rfc_max_features': 2, 'rfc_bootstrap': False}. Best is trial 60 with value: 0.999913.[0m
[32m[I 2022-10-26 22:23:28,431][0m sklearn.ensemble.RandomForestClassifier.predict: fallback to original Scikit-learn[0m
[32m[I 2022-10-26 22:23:28,441][0m sklearn.ensemble.RandomForestClassifier.predict_proba: fallback to original Scikit-learn[0m
[32m[I 2022-10-26 22:23:28,707][0m sklearn.ensemble.RandomForestClassifier.fit: fallback to original Scikit-learn[0m
[32m[I 2022-10-26 22:23:31,475][0m sklearn.ensemble.RandomForestClassifier.predict: fallback to original Scikit-learn[0m
[32m[I 2022-10-26 22:23:31,477][0m sklearn.ensemble.RandomForestClassifier.predict_proba: fallback to original Scikit-learn[0m
[32m[I 2022-10-26 22:23:35,405][0m Trial 62 finished with value: 0.9998955986617057 and parameters: {'rfc_criterion': 'entropy', 'rfc_n_estimators': 140, 'rfc_min_samples_split': 50, 'rfc_min_samples_leaf': 2, 'rfc_max_features': 2, 'rfc_bootstrap': False}. Best is trial 60 with value: 0.999913.[0m
[32m[I 2022-10-26 22:23:35,638][0m sklearn.ensemble.RandomForestClassifier.fit: fallback to original Scikit-learn[0m
[32m[I 2022-10-26 22:23:38,716][0m Trial 65 finished with value: 0.999878214065405 and parameters: {'rfc_criterion': 'entropy', 'rfc_n_estimators': 130, 'rfc_min_samples_split': 49, 'rfc_min_samples_leaf': 5, 'rfc_max_features': 2, 'rfc_bootstrap': False}. Best is trial 60 with value: 0.999913.[0m
[32m[I 2022-10-26 22:23:40,113][0m sklearn.ensemble.RandomForestClassifier.fit: fallback to original Scikit-learn[0m
[32m[I 2022-10-26 22:24:00,329][0m sklearn.ensemble.RandomForestClassifier.predict: fallback to original Scikit-learn[0m
[32m[I 2022-10-26 22:24:00,330][0m sklearn.ensemble.RandomForestClassifier.predict_proba: fallback to original Scikit-learn[0m
[32m[I 2022-10-26 22:24:06,346][0m Trial 66 finished with value: 0.999917973843909 and parameters: {'rfc_criterion': 'entropy', 'rfc_n_estimators': 130, 'rfc_min_samples_split': 33, 'rfc_min_samples_leaf': 4, 'rfc_max_features': 3, 'rfc_bootstrap': False}. Best is trial 66 with value: 0.999918.[0m
[32m[I 2022-10-26 22:24:07,273][0m sklearn.ensemble.RandomForestClassifier.fit: fallback to original Scikit-learn[0m
[32m[I 2022-10-26 22:25:44,594][0m sklearn.ensemble.RandomForestClassifier.predict: fallback to original Scikit-learn[0m
[32m[I 2022-10-26 22:25:44,600][0m sklearn.ensemble.RandomForestClassifier.predict_proba: fallback to original Scikit-learn[0m
[32m[I 2022-10-26 22:25:51,616][0m Trial 67 finished with value: 0.9999229408847674 and parameters: {'rfc_criterion': 'entropy', 'rfc_n_estimators': 160, 'rfc_min_samples_split': 50, 'rfc_min_samples_leaf': 3, 'rfc_max_features': 3, 'rfc_bootstrap': False}. Best is trial 67 with value: 0.999923.[0m
[32m[I 2022-10-26 22:25:51,793][0m sklearn.ensemble.RandomForestClassifier.fit: fallback to original Scikit-learn[0m
[32m[I 2022-10-26 22:26:05,868][0m sklearn.ensemble.RandomForestClassifier.predict: fallback to original Scikit-learn[0m
[32m[I 2022-10-26 22:26:05,870][0m sklearn.ensemble.RandomForestClassifier.predict_proba: fallback to original Scikit-learn[0m
[32m[I 2022-10-26 22:26:06,259][0m sklearn.ensemble.RandomForestClassifier.predict: fallback to original Scikit-learn[0m
[32m[I 2022-10-26 22:26:06,263][0m sklearn.ensemble.RandomForestClassifier.predict_proba: fallback to original Scikit-learn[0m
[32m[I 2022-10-26 22:26:12,072][0m Trial 71 finished with value: 0.9998582799174554 and parameters: {'rfc_criterion': 'entropy', 'rfc_n_estimators': 130, 'rfc_min_samples_split': 50, 'rfc_min_samples_leaf': 4, 'rfc_max_features': 1, 'rfc_bootstrap': False}. Best is trial 67 with value: 0.999923.[0m
[32m[I 2022-10-26 22:26:12,265][0m sklearn.ensemble.RandomForestClassifier.fit: fallback to original Scikit-learn[0m
[32m[I 2022-10-26 22:26:12,615][0m Trial 73 finished with value: 0.9997837602399053 and parameters: {'rfc_criterion': 'entropy', 'rfc_n_estimators': 130, 'rfc_min_samples_split': 50, 'rfc_min_samples_leaf': 11, 'rfc_max_features': 1, 'rfc_bootstrap': False}. Best is trial 67 with value: 0.999923.[0m
[32m[I 2022-10-26 22:26:12,722][0m sklearn.ensemble.RandomForestClassifier.predict: fallback to original Scikit-learn[0m
[32m[I 2022-10-26 22:26:12,726][0m sklearn.ensemble.RandomForestClassifier.predict_proba: fallback to original Scikit-learn[0m
[32m[I 2022-10-26 22:26:12,815][0m sklearn.ensemble.RandomForestClassifier.fit: fallback to original Scikit-learn[0m
[32m[I 2022-10-26 22:26:15,986][0m sklearn.ensemble.RandomForestClassifier.predict: fallback to original Scikit-learn[0m
[32m[I 2022-10-26 22:26:15,988][0m sklearn.ensemble.RandomForestClassifier.predict_proba: fallback to original Scikit-learn[0m
[32m[I 2022-10-26 22:26:17,951][0m sklearn.ensemble.RandomForestClassifier.predict: fallback to original Scikit-learn[0m
[32m[I 2022-10-26 22:26:17,952][0m sklearn.ensemble.RandomForestClassifier.predict_proba: fallback to original Scikit-learn[0m
[32m[I 2022-10-26 22:26:18,986][0m Trial 72 finished with value: 0.9998582799174554 and parameters: {'rfc_criterion': 'entropy', 'rfc_n_estimators': 130, 'rfc_min_samples_split': 50, 'rfc_min_samples_leaf': 4, 'rfc_max_features': 1, 'rfc_bootstrap': False}. Best is trial 67 with value: 0.999923.[0m
[32m[I 2022-10-26 22:26:19,188][0m sklearn.ensemble.RandomForestClassifier.fit: fallback to original Scikit-learn[0m
[32m[I 2022-10-26 22:26:23,598][0m Trial 68 finished with value: 0.9999130188938752 and parameters: {'rfc_criterion': 'entropy', 'rfc_n_estimators': 160, 'rfc_min_samples_split': 50, 'rfc_min_samples_leaf': 4, 'rfc_max_features': 3, 'rfc_bootstrap': False}. Best is trial 67 with value: 0.999923.[0m
[32m[I 2022-10-26 22:26:23,767][0m sklearn.ensemble.RandomForestClassifier.fit: fallback to original Scikit-learn[0m
[32m[I 2022-10-26 22:26:24,445][0m Trial 70 finished with value: 0.9999155052397202 and parameters: {'rfc_criterion': 'entropy', 'rfc_n_estimators': 130, 'rfc_min_samples_split': 50, 'rfc_min_samples_leaf': 4, 'rfc_max_features': 3, 'rfc_bootstrap': False}. Best is trial 67 with value: 0.999923.[0m
[32m[I 2022-10-26 22:26:24,627][0m sklearn.ensemble.RandomForestClassifier.fit: fallback to original Scikit-learn[0m
[32m[I 2022-10-26 22:26:37,927][0m sklearn.ensemble.RandomForestClassifier.predict: fallback to original Scikit-learn[0m
[32m[I 2022-10-26 22:26:37,928][0m sklearn.ensemble.RandomForestClassifier.predict_proba: fallback to original Scikit-learn[0m
[32m[I 2022-10-26 22:26:45,254][0m Trial 69 finished with value: 0.9998757513347933 and parameters: {'rfc_criterion': 'entropy', 'rfc_n_estimators': 170, 'rfc_min_samples_split': 36, 'rfc_min_samples_leaf': 10, 'rfc_max_features': 3, 'rfc_bootstrap': False}. Best is trial 67 with value: 0.999923.[0m
[32m[I 2022-10-26 22:26:45,437][0m sklearn.ensemble.RandomForestClassifier.fit: fallback to original Scikit-learn[0m
[32m[I 2022-10-26 22:27:04,361][0m sklearn.ensemble.RandomForestClassifier.predict: fallback to original Scikit-learn[0m
[32m[I 2022-10-26 22:27:04,361][0m sklearn.ensemble.RandomForestClassifier.predict_proba: fallback to original Scikit-learn[0m
[32m[I 2022-10-26 22:27:09,430][0m Trial 74 finished with value: 0.9999353563370877 and parameters: {'rfc_criterion': 'entropy', 'rfc_n_estimators': 110, 'rfc_min_samples_split': 34, 'rfc_min_samples_leaf': 3, 'rfc_max_features': 3, 'rfc_bootstrap': False}. Best is trial 74 with value: 0.999935.[0m
[32m[I 2022-10-26 22:27:09,593][0m sklearn.ensemble.RandomForestClassifier.fit: fallback to original Scikit-learn[0m
[32m[I 2022-10-26 22:28:08,362][0m sklearn.ensemble.RandomForestClassifier.predict: fallback to original Scikit-learn[0m
[32m[I 2022-10-26 22:28:08,363][0m sklearn.ensemble.RandomForestClassifier.predict_proba: fallback to original Scikit-learn[0m
[32m[I 2022-10-26 22:28:13,542][0m Trial 75 finished with value: 0.9998906096405937 and parameters: {'rfc_criterion': 'entropy', 'rfc_n_estimators': 110, 'rfc_min_samples_split': 35, 'rfc_min_samples_leaf': 3, 'rfc_max_features': 1, 'rfc_bootstrap': False}. Best is trial 74 with value: 0.999935.[0m
[32m[I 2022-10-26 22:28:13,755][0m sklearn.ensemble.RandomForestClassifier.fit: fallback to original Scikit-learn[0m
[32m[I 2022-10-26 22:28:56,931][0m sklearn.ensemble.RandomForestClassifier.predict: fallback to original Scikit-learn[0m
[32m[I 2022-10-26 22:28:56,932][0m sklearn.ensemble.RandomForestClassifier.predict_proba: fallback to original Scikit-learn[0m
[32m[I 2022-10-26 22:29:02,027][0m Trial 76 finished with value: 0.9998559033491555 and parameters: {'rfc_criterion': 'entropy', 'rfc_n_estimators': 110, 'rfc_min_samples_split': 35, 'rfc_min_samples_leaf': 11, 'rfc_max_features': 3, 'rfc_bootstrap': False}. Best is trial 74 with value: 0.999935.[0m
[32m[I 2022-10-26 22:29:02,273][0m sklearn.ensemble.RandomForestClassifier.fit: running accelerated version on CPU[0m
[32m[I 2022-10-26 22:29:06,838][0m sklearn.ensemble.RandomForestClassifier.predict: fallback to original Scikit-learn[0m
[32m[I 2022-10-26 22:29:06,845][0m sklearn.ensemble.RandomForestClassifier.predict_proba: fallback to original Scikit-learn[0m
[32m[I 2022-10-26 22:29:16,412][0m Trial 77 finished with value: 0.9999254260058233 and parameters: {'rfc_criterion': 'entropy', 'rfc_n_estimators': 110, 'rfc_min_samples_split': 31, 'rfc_min_samples_leaf': 4, 'rfc_max_features': 3, 'rfc_bootstrap': False}. Best is trial 74 with value: 0.999935.[0m
[32m[I 2022-10-26 22:29:17,292][0m sklearn.ensemble.RandomForestClassifier.fit: running accelerated version on CPU[0m
[32m[I 2022-10-26 22:29:23,964][0m sklearn.ensemble.RandomForestClassifier.predict: fallback to original Scikit-learn[0m
[32m[I 2022-10-26 22:29:23,978][0m sklearn.ensemble.RandomForestClassifier.predict_proba: fallback to original Scikit-learn[0m
[32m[I 2022-10-26 22:29:25,445][0m sklearn.ensemble.RandomForestClassifier.predict: running accelerated version on CPU[0m
[32m[I 2022-10-26 22:29:29,540][0m Trial 84 finished with value: 0.9972776223697596 and parameters: {'rfc_criterion': 'gini', 'rfc_n_estimators': 100, 'rfc_min_samples_split': 31, 'rfc_min_samples_leaf': 3, 'rfc_max_features': 3, 'rfc_bootstrap': False}. Best is trial 74 with value: 0.999935.[0m
[32m[I 2022-10-26 22:29:31,183][0m sklearn.ensemble.RandomForestClassifier.fit: fallback to original Scikit-learn[0m
[32m[I 2022-10-26 22:29:32,692][0m sklearn.ensemble.RandomForestClassifier.predict: fallback to original Scikit-learn[0m
[32m[I 2022-10-26 22:29:32,696][0m sklearn.ensemble.RandomForestClassifier.predict_proba: fallback to original Scikit-learn[0m
[32m[I 2022-10-26 22:29:33,595][0m Trial 78 finished with value: 0.9999353563370877 and parameters: {'rfc_criterion': 'entropy', 'rfc_n_estimators': 110, 'rfc_min_samples_split': 30, 'rfc_min_samples_leaf': 3, 'rfc_max_features': 3, 'rfc_bootstrap': False}. Best is trial 74 with value: 0.999935.[0m
[32m[I 2022-10-26 22:29:35,048][0m sklearn.ensemble.RandomForestClassifier.fit: fallback to original Scikit-learn[0m
[32m[I 2022-10-26 22:29:40,723][0m sklearn.ensemble.RandomForestClassifier.predict: running accelerated version on CPU[0m
[32m[I 2022-10-26 22:29:44,064][0m Trial 85 finished with value: 0.9969794092483201 and parameters: {'rfc_criterion': 'gini', 'rfc_n_estimators': 90, 'rfc_min_samples_split': 28, 'rfc_min_samples_leaf': 3, 'rfc_max_features': 3, 'rfc_bootstrap': False}. Best is trial 74 with value: 0.999935.[0m
[32m[I 2022-10-26 22:29:44,064][0m Trial 80 finished with value: 0.9999303880932738 and parameters: {'rfc_criterion': 'entropy', 'rfc_n_estimators': 110, 'rfc_min_samples_split': 29, 'rfc_min_samples_leaf': 3, 'rfc_max_features': 3, 'rfc_bootstrap': False}. Best is trial 74 with value: 0.999935.[0m
[32m[I 2022-10-26 22:29:45,359][0m sklearn.ensemble.RandomForestClassifier.fit: fallback to original Scikit-learn[0m
[32m[I 2022-10-26 22:29:45,537][0m sklearn.ensemble.RandomForestClassifier.fit: fallback to original Scikit-learn[0m
[32m[I 2022-10-26 22:29:58,372][0m sklearn.ensemble.RandomForestClassifier.predict: fallback to original Scikit-learn[0m
[32m[I 2022-10-26 22:29:58,373][0m sklearn.ensemble.RandomForestClassifier.predict_proba: fallback to original Scikit-learn[0m
[32m[I 2022-10-26 22:30:03,487][0m Trial 81 finished with value: 0.9999378473759247 and parameters: {'rfc_criterion': 'entropy', 'rfc_n_estimators': 110, 'rfc_min_samples_split': 32, 'rfc_min_samples_leaf': 3, 'rfc_max_features': 3, 'rfc_bootstrap': False}. Best is trial 81 with value: 0.999938.[0m
[32m[I 2022-10-26 22:30:03,666][0m sklearn.ensemble.RandomForestClassifier.fit: fallback to original Scikit-learn[0m
[32m[I 2022-10-26 22:30:22,996][0m sklearn.ensemble.RandomForestClassifier.predict: fallback to original Scikit-learn[0m
[32m[I 2022-10-26 22:30:22,997][0m sklearn.ensemble.RandomForestClassifier.predict_proba: fallback to original Scikit-learn[0m
[32m[I 2022-10-26 22:30:24,209][0m sklearn.ensemble.RandomForestClassifier.predict: fallback to original Scikit-learn[0m
[32m[I 2022-10-26 22:30:24,211][0m sklearn.ensemble.RandomForestClassifier.predict_proba: fallback to original Scikit-learn[0m
[32m[I 2022-10-26 22:30:28,335][0m Trial 82 finished with value: 0.9999328699612452 and parameters: {'rfc_criterion': 'entropy', 'rfc_n_estimators': 110, 'rfc_min_samples_split': 33, 'rfc_min_samples_leaf': 3, 'rfc_max_features': 3, 'rfc_bootstrap': False}. Best is trial 81 with value: 0.999938.[0m
[32m[I 2022-10-26 22:30:28,539][0m sklearn.ensemble.RandomForestClassifier.fit: fallback to original Scikit-learn[0m
[32m[I 2022-10-26 22:30:30,676][0m Trial 79 finished with value: 0.9999353563370877 and parameters: {'rfc_criterion': 'entropy', 'rfc_n_estimators': 140, 'rfc_min_samples_split': 33, 'rfc_min_samples_leaf': 3, 'rfc_max_features': 3, 'rfc_bootstrap': False}. Best is trial 81 with value: 0.999938.[0m
[32m[I 2022-10-26 22:30:30,850][0m sklearn.ensemble.RandomForestClassifier.fit: fallback to original Scikit-learn[0m
[32m[I 2022-10-26 22:31:29,885][0m sklearn.ensemble.RandomForestClassifier.predict: fallback to original Scikit-learn[0m
[32m[I 2022-10-26 22:31:29,886][0m sklearn.ensemble.RandomForestClassifier.predict_proba: fallback to original Scikit-learn[0m
[32m[I 2022-10-26 22:31:34,857][0m Trial 83 finished with value: 0.9999378473759247 and parameters: {'rfc_criterion': 'entropy', 'rfc_n_estimators': 110, 'rfc_min_samples_split': 32, 'rfc_min_samples_leaf': 3, 'rfc_max_features': 3, 'rfc_bootstrap': False}. Best is trial 81 with value: 0.999938.[0m
[32m[I 2022-10-26 22:31:35,032][0m sklearn.ensemble.RandomForestClassifier.fit: fallback to original Scikit-learn[0m
[32m[I 2022-10-26 22:32:00,667][0m sklearn.ensemble.RandomForestClassifier.predict: fallback to original Scikit-learn[0m
[32m[I 2022-10-26 22:32:00,668][0m sklearn.ensemble.RandomForestClassifier.predict_proba: fallback to original Scikit-learn[0m
[32m[I 2022-10-26 22:32:05,062][0m Trial 87 finished with value: 0.9999328699612452 and parameters: {'rfc_criterion': 'entropy', 'rfc_n_estimators': 90, 'rfc_min_samples_split': 33, 'rfc_min_samples_leaf': 3, 'rfc_max_features': 3, 'rfc_bootstrap': False}. Best is trial 81 with value: 0.999938.[0m
[32m[I 2022-10-26 22:32:05,344][0m sklearn.ensemble.RandomForestClassifier.fit: fallback to original Scikit-learn[0m
[32m[I 2022-10-26 22:32:07,909][0m sklearn.ensemble.RandomForestClassifier.predict: fallback to original Scikit-learn[0m
[32m[I 2022-10-26 22:32:07,913][0m sklearn.ensemble.RandomForestClassifier.predict_proba: fallback to original Scikit-learn[0m
[32m[I 2022-10-26 22:32:12,523][0m Trial 86 finished with value: 0.9996421519294216 and parameters: {'rfc_criterion': 'entropy', 'rfc_n_estimators': 100, 'rfc_min_samples_split': 33, 'rfc_min_samples_leaf': 43, 'rfc_max_features': 3, 'rfc_bootstrap': False}. Best is trial 81 with value: 0.999938.[0m
[32m[I 2022-10-26 22:32:12,699][0m sklearn.ensemble.RandomForestClassifier.fit: fallback to original Scikit-learn[0m
[32m[I 2022-10-26 22:32:22,377][0m sklearn.ensemble.RandomForestClassifier.predict: fallback to original Scikit-learn[0m
[32m[I 2022-10-26 22:32:22,378][0m sklearn.ensemble.RandomForestClassifier.predict_proba: fallback to original Scikit-learn[0m
[32m[I 2022-10-26 22:32:27,050][0m Trial 88 finished with value: 0.9999353569299495 and parameters: {'rfc_criterion': 'entropy', 'rfc_n_estimators': 100, 'rfc_min_samples_split': 33, 'rfc_min_samples_leaf': 2, 'rfc_max_features': 3, 'rfc_bootstrap': False}. Best is trial 81 with value: 0.999938.[0m
[32m[I 2022-10-26 22:32:27,236][0m sklearn.ensemble.RandomForestClassifier.fit: fallback to original Scikit-learn[0m
[32m[I 2022-10-26 22:32:35,257][0m sklearn.ensemble.RandomForestClassifier.predict: fallback to original Scikit-learn[0m
[32m[I 2022-10-26 22:32:35,259][0m sklearn.ensemble.RandomForestClassifier.predict_proba: fallback to original Scikit-learn[0m
[32m[I 2022-10-26 22:32:39,826][0m Trial 90 finished with value: 0.9996421519294216 and parameters: {'rfc_criterion': 'entropy', 'rfc_n_estimators': 100, 'rfc_min_samples_split': 32, 'rfc_min_samples_leaf': 43, 'rfc_max_features': 3, 'rfc_bootstrap': False}. Best is trial 81 with value: 0.999938.[0m
[32m[I 2022-10-26 22:32:40,009][0m sklearn.ensemble.RandomForestClassifier.fit: fallback to original Scikit-learn[0m
[32m[I 2022-10-26 22:32:55,234][0m sklearn.ensemble.RandomForestClassifier.predict: fallback to original Scikit-learn[0m
[32m[I 2022-10-26 22:32:55,235][0m sklearn.ensemble.RandomForestClassifier.predict_proba: fallback to original Scikit-learn[0m
[32m[I 2022-10-26 22:33:00,492][0m sklearn.ensemble.RandomForestClassifier.predict: fallback to original Scikit-learn[0m
[32m[I 2022-10-26 22:33:00,496][0m sklearn.ensemble.RandomForestClassifier.predict_proba: fallback to original Scikit-learn[0m
[32m[I 2022-10-26 22:33:00,643][0m Trial 89 finished with value: 0.9999204603160243 and parameters: {'rfc_criterion': 'entropy', 'rfc_n_estimators': 120, 'rfc_min_samples_split': 33, 'rfc_min_samples_leaf': 4, 'rfc_max_features': 3, 'rfc_bootstrap': False}. Best is trial 81 with value: 0.999938.[0m
[32m[I 2022-10-26 22:33:00,817][0m sklearn.ensemble.RandomForestClassifier.fit: fallback to original Scikit-learn[0m
[32m[I 2022-10-26 22:33:03,354][0m sklearn.ensemble.RandomForestClassifier.predict: fallback to original Scikit-learn[0m
[32m[I 2022-10-26 22:33:03,356][0m sklearn.ensemble.RandomForestClassifier.predict_proba: fallback to original Scikit-learn[0m
[32m[I 2022-10-26 22:33:05,377][0m Trial 91 finished with value: 0.9996670376451064 and parameters: {'rfc_criterion': 'entropy', 'rfc_n_estimators': 100, 'rfc_min_samples_split': 33, 'rfc_min_samples_leaf': 40, 'rfc_max_features': 3, 'rfc_bootstrap': False}. Best is trial 81 with value: 0.999938.[0m
[32m[I 2022-10-26 22:33:05,578][0m sklearn.ensemble.RandomForestClassifier.fit: fallback to original Scikit-learn[0m
[32m[I 2022-10-26 22:33:08,257][0m Trial 92 finished with value: 0.9996670327520533 and parameters: {'rfc_criterion': 'entropy', 'rfc_n_estimators': 100, 'rfc_min_samples_split': 32, 'rfc_min_samples_leaf': 46, 'rfc_max_features': 3, 'rfc_bootstrap': False}. Best is trial 81 with value: 0.999938.[0m
[32m[I 2022-10-26 22:34:04,690][0m sklearn.ensemble.RandomForestClassifier.predict: fallback to original Scikit-learn[0m
[32m[I 2022-10-26 22:34:04,692][0m sklearn.ensemble.RandomForestClassifier.predict_proba: fallback to original Scikit-learn[0m
[32m[I 2022-10-26 22:34:09,135][0m Trial 93 finished with value: 0.999947785791306 and parameters: {'rfc_criterion': 'entropy', 'rfc_n_estimators': 100, 'rfc_min_samples_split': 23, 'rfc_min_samples_leaf': 2, 'rfc_max_features': 3, 'rfc_bootstrap': False}. Best is trial 93 with value: 0.999948.[0m
[32m[I 2022-10-26 22:34:19,954][0m sklearn.ensemble.RandomForestClassifier.predict: fallback to original Scikit-learn[0m
[32m[I 2022-10-26 22:34:19,956][0m sklearn.ensemble.RandomForestClassifier.predict_proba: fallback to original Scikit-learn[0m
[32m[I 2022-10-26 22:34:23,523][0m Trial 95 finished with value: 0.9999552542404249 and parameters: {'rfc_criterion': 'entropy', 'rfc_n_estimators': 80, 'rfc_min_samples_split': 26, 'rfc_min_samples_leaf': 2, 'rfc_max_features': 4, 'rfc_bootstrap': False}. Best is trial 95 with value: 0.999955.[0m
[32m[I 2022-10-26 22:34:27,727][0m sklearn.ensemble.RandomForestClassifier.predict: fallback to original Scikit-learn[0m
[32m[I 2022-10-26 22:34:27,728][0m sklearn.ensemble.RandomForestClassifier.predict_proba: fallback to original Scikit-learn[0m
[32m[I 2022-10-26 22:34:30,802][0m sklearn.ensemble.RandomForestClassifier.predict: fallback to original Scikit-learn[0m
[32m[I 2022-10-26 22:34:30,804][0m sklearn.ensemble.RandomForestClassifier.predict_proba: fallback to original Scikit-learn[0m
[32m[I 2022-10-26 22:34:30,806][0m Trial 97 finished with value: 0.9998782850791039 and parameters: {'rfc_criterion': 'entropy', 'rfc_n_estimators': 70, 'rfc_min_samples_split': 25, 'rfc_min_samples_leaf': 13, 'rfc_max_features': 4, 'rfc_bootstrap': False}. Best is trial 95 with value: 0.999955.[0m
