[32m[I 2022-10-26 22:35:42,823][0m Trial 91 finished with value: 0.6848996760022037 and parameters: {'rc_C': 0.14153489525200041, 'rc_tol': 0.004220927909453706}. Best is trial 0 with value: 0.6849.[0m
[32m[I 2022-10-26 22:35:42,977][0m Trial 93 finished with value: 0.6848996760022037 and parameters: {'rc_C': 0.05267157347357661, 'rc_tol': 0.005351870425785706}. Best is trial 0 with value: 0.6849.[0m
[32m[I 2022-10-26 22:35:43,129][0m Trial 94 finished with value: 0.6848996760022037 and parameters: {'rc_C': 0.08915292273318143, 'rc_tol': 0.004248072597851851}. Best is trial 0 with value: 0.6849.[0m
[32m[I 2022-10-26 22:35:44,938][0m Trial 96 finished with value: 0.6848996760022037 and parameters: {'rc_C': 0.058152314796122664, 'rc_tol': 0.004269190825091683}. Best is trial 0 with value: 0.6849.[0m
[32m[I 2022-10-26 22:35:45,189][0m Trial 97 finished with value: 0.6848996760022037 and parameters: {'rc_C': 0.5170950216627203, 'rc_tol': 0.001043069322644767}. Best is trial 0 with value: 0.6849.[0m
[32m[I 2022-10-26 22:35:45,190][0m Trial 99 finished with value: 0.6848996760022037 and parameters: {'rc_C': 0.0007592027395659885, 'rc_tol': 0.0010573318858943935}. Best is trial 0 with value: 0.6849.[0m
[32m[I 2022-10-26 22:35:45,190][0m Trial 98 finished with value: 0.6848996760022037 and parameters: {'rc_C': 0.0009452532563423237, 'rc_tol': 0.0010263378045276194}. Best is trial 0 with value: 0.6849.[0m
[32m[I 2022-10-26 22:35:45,385][0m Study finished.[0m
[32m[I 2022-10-26 22:35:45,398][0m --------------------------------------------------------------------------------[0m
[32m[I 2022-10-26 22:35:45,398][0m --------------------           RUSBoostClassifier           --------------------[0m
[32m[I 2022-10-26 22:35:45,399][0m --------------------------------------------------------------------------------[0m
[32m[I 2022-10-26 22:35:45,431][0m A new study created in RDB with name: RUSBoostClassifier_c963b74b[0m
[32m[I 2022-10-26 22:35:45,437][0m Study started.[0m
[32m[I 2022-10-26 22:36:39,745][0m Trial 6 finished with value: 0.0006044929990853171 and parameters: {'rusbc_n_estimators': 25, 'rusbc_learning_rate': 0.008255046481582689, 'rusbc_sampling_strategy': 'not minority'}. Best is trial 6 with value: 0.000604493.[0m
[32m[I 2022-10-26 22:37:39,936][0m Trial 5 finished with value: 0.0032142660720063812 and parameters: {'rusbc_n_estimators': 50, 'rusbc_learning_rate': 1.9304240252947897e-05, 'rusbc_sampling_strategy': 'not minority'}. Best is trial 5 with value: 0.00342198.[0m
[32m[I 2022-10-26 22:37:40,043][0m Trial 4 finished with value: 0.0006044929990853171 and parameters: {'rusbc_n_estimators': 50, 'rusbc_learning_rate': 0.0012720800032042156, 'rusbc_sampling_strategy': 'not minority'}. Best is trial 0 with value: 0.00342198.[0m
[32m[I 2022-10-26 22:37:40,043][0m Trial 0 finished with value: 0.0034219756294838915 and parameters: {'rusbc_n_estimators': 50, 'rusbc_learning_rate': 0.00020519679742322418, 'rusbc_sampling_strategy': 'all'}. Best is trial 0 with value: 0.00342198.[0m
[32m[I 2022-10-26 22:37:59,096][0m Trial 7 finished with value: 0.7126730374606763 and parameters: {'rusbc_n_estimators': 50, 'rusbc_learning_rate': 1.4182493449260965e-05, 'rusbc_sampling_strategy': 'not majority'}. Best is trial 7 with value: 0.712673.[0m
[32m[I 2022-10-26 22:38:06,515][0m Trial 8 finished with value: 0.0034366581894720474 and parameters: {'rusbc_n_estimators': 50, 'rusbc_learning_rate': 1.6835853019024367e-06, 'rusbc_sampling_strategy': 'all'}. Best is trial 7 with value: 0.712673.[0m
[32m[I 2022-10-26 22:38:36,188][0m Trial 3 finished with value: 0.04740951657551045 and parameters: {'rusbc_n_estimators': 75, 'rusbc_learning_rate': 0.0009819772043111715, 'rusbc_sampling_strategy': 'majority'}. Best is trial 7 with value: 0.712673.[0m
[32m[I 2022-10-26 22:38:36,189][0m Trial 2 finished with value: 0.05457420409487437 and parameters: {'rusbc_n_estimators': 75, 'rusbc_learning_rate': 7.388439972696856e-06, 'rusbc_sampling_strategy': 'majority'}. Best is trial 7 with value: 0.712673.[0m
[32m[I 2022-10-26 22:38:50,614][0m Trial 13 finished with value: 0.13724121319916138 and parameters: {'rusbc_n_estimators': 25, 'rusbc_learning_rate': 0.259691393137296, 'rusbc_sampling_strategy': 'not minority'}. Best is trial 7 with value: 0.712673.[0m
[32m[I 2022-10-26 22:39:02,907][0m Trial 10 finished with value: 0.0032006866408331915 and parameters: {'rusbc_n_estimators': 50, 'rusbc_learning_rate': 0.0017941710427540958, 'rusbc_sampling_strategy': 'all'}. Best is trial 7 with value: 0.712673.[0m
[32m[I 2022-10-26 22:39:36,957][0m Trial 11 finished with value: 0.7126730374606763 and parameters: {'rusbc_n_estimators': 50, 'rusbc_learning_rate': 0.017145120101784223, 'rusbc_sampling_strategy': 'not majority'}. Best is trial 7 with value: 0.712673.[0m
[32m[I 2022-10-26 22:39:41,444][0m Trial 1 finished with value: 0.7126730374606763 and parameters: {'rusbc_n_estimators': 100, 'rusbc_learning_rate': 0.0004416020910745981, 'rusbc_sampling_strategy': 'not majority'}. Best is trial 1 with value: 0.712673.[0m
[32m[I 2022-10-26 22:40:05,871][0m Trial 14 finished with value: 0.003761621328382142 and parameters: {'rusbc_n_estimators': 50, 'rusbc_learning_rate': 0.005013785490494829, 'rusbc_sampling_strategy': 'all'}. Best is trial 1 with value: 0.712673.[0m
[32m[I 2022-10-26 22:40:32,888][0m Trial 9 finished with value: 0.031010166408776768 and parameters: {'rusbc_n_estimators': 100, 'rusbc_learning_rate': 0.01323340268110217, 'rusbc_sampling_strategy': 'not minority'}. Best is trial 1 with value: 0.712673.[0m
[32m[I 2022-10-26 22:40:55,422][0m Trial 16 finished with value: 0.003937748219093993 and parameters: {'rusbc_n_estimators': 75, 'rusbc_learning_rate': 0.0006670065908113675, 'rusbc_sampling_strategy': 'all'}. Best is trial 1 with value: 0.712673.[0m
[32m[I 2022-10-26 22:41:42,437][0m Trial 15 finished with value: 0.02462264231878719 and parameters: {'rusbc_n_estimators': 100, 'rusbc_learning_rate': 0.03948674413722446, 'rusbc_sampling_strategy': 'majority'}. Best is trial 1 with value: 0.712673.[0m
[32m[I 2022-10-26 22:41:46,054][0m Trial 12 finished with value: 0.7126730374606763 and parameters: {'rusbc_n_estimators': 100, 'rusbc_learning_rate': 2.2187234992224527e-06, 'rusbc_sampling_strategy': 'not majority'}. Best is trial 1 with value: 0.712673.[0m
[32m[I 2022-10-26 22:42:49,877][0m Trial 17 finished with value: 0.7126730374606763 and parameters: {'rusbc_n_estimators': 100, 'rusbc_learning_rate': 5.1742871246241724e-05, 'rusbc_sampling_strategy': 'not majority'}. Best is trial 17 with value: 0.712673.[0m
[32m[I 2022-10-26 22:43:23,149][0m Trial 19 finished with value: 0.7126730374606763 and parameters: {'rusbc_n_estimators': 100, 'rusbc_learning_rate': 6.663400857189788e-05, 'rusbc_sampling_strategy': 'not majority'}. Best is trial 19 with value: 0.712673.[0m
[32m[I 2022-10-26 22:43:23,531][0m Trial 18 finished with value: 0.7499843839824113 and parameters: {'rusbc_n_estimators': 100, 'rusbc_learning_rate': 0.07545792630818451, 'rusbc_sampling_strategy': 'not majority'}. Best is trial 18 with value: 0.749984.[0m
[32m[I 2022-10-26 22:43:46,556][0m Trial 20 finished with value: 0.7126730374606763 and parameters: {'rusbc_n_estimators': 100, 'rusbc_learning_rate': 6.468855063503722e-05, 'rusbc_sampling_strategy': 'not majority'}. Best is trial 18 with value: 0.749984.[0m
[32m[I 2022-10-26 22:44:14,260][0m Trial 21 finished with value: 0.7126730374606763 and parameters: {'rusbc_n_estimators': 100, 'rusbc_learning_rate': 5.209751729086716e-05, 'rusbc_sampling_strategy': 'not majority'}. Best is trial 18 with value: 0.749984.[0m
[32m[I 2022-10-26 22:44:37,256][0m Trial 22 finished with value: 0.7126730374606763 and parameters: {'rusbc_n_estimators': 100, 'rusbc_learning_rate': 7.55439085956419e-05, 'rusbc_sampling_strategy': 'not majority'}. Best is trial 18 with value: 0.749984.[0m
[32m[I 2022-10-26 22:45:22,864][0m Trial 23 finished with value: 0.7126730374606763 and parameters: {'rusbc_n_estimators': 100, 'rusbc_learning_rate': 6.21507448423348e-05, 'rusbc_sampling_strategy': 'not majority'}. Best is trial 18 with value: 0.749984.[0m
[32m[I 2022-10-26 22:45:25,506][0m Trial 24 finished with value: 0.7126730374606763 and parameters: {'rusbc_n_estimators': 100, 'rusbc_learning_rate': 0.00010462671400754993, 'rusbc_sampling_strategy': 'not majority'}. Best is trial 18 with value: 0.749984.[0m
[32m[I 2022-10-26 22:46:17,929][0m Trial 26 finished with value: 0.7276805534031655 and parameters: {'rusbc_n_estimators': 75, 'rusbc_learning_rate': 0.20113202184863654, 'rusbc_sampling_strategy': 'not majority'}. Best is trial 18 with value: 0.749984.[0m
[32m[I 2022-10-26 22:46:18,068][0m Trial 27 finished with value: 0.728224089984504 and parameters: {'rusbc_n_estimators': 75, 'rusbc_learning_rate': 0.15428339592094, 'rusbc_sampling_strategy': 'not majority'}. Best is trial 18 with value: 0.749984.[0m
[32m[I 2022-10-26 22:46:29,162][0m Trial 25 finished with value: 0.7126730374606763 and parameters: {'rusbc_n_estimators': 100, 'rusbc_learning_rate': 5.938070632098287e-05, 'rusbc_sampling_strategy': 'not majority'}. Best is trial 18 with value: 0.749984.[0m
[32m[I 2022-10-26 22:46:31,927][0m Trial 28 finished with value: 0.7482676731364574 and parameters: {'rusbc_n_estimators': 75, 'rusbc_learning_rate': 0.19149546395017294, 'rusbc_sampling_strategy': 'not majority'}. Best is trial 18 with value: 0.749984.[0m
[32m[I 2022-10-26 22:46:53,237][0m Trial 29 finished with value: 0.12472312017185463 and parameters: {'rusbc_n_estimators': 75, 'rusbc_learning_rate': 0.9993966351919024, 'rusbc_sampling_strategy': 'not majority'}. Best is trial 18 with value: 0.749984.[0m
[32m[I 2022-10-26 22:47:23,557][0m Trial 30 finished with value: 0.34733789635066015 and parameters: {'rusbc_n_estimators': 75, 'rusbc_learning_rate': 0.4297734474378015, 'rusbc_sampling_strategy': 'not majority'}. Best is trial 18 with value: 0.749984.[0m
[32m[I 2022-10-26 22:48:07,856][0m Trial 31 finished with value: 0.5154729678115384 and parameters: {'rusbc_n_estimators': 75, 'rusbc_learning_rate': 0.46696789076530015, 'rusbc_sampling_strategy': 'not majority'}. Best is trial 18 with value: 0.749984.[0m
[32m[I 2022-10-26 22:48:11,070][0m Trial 32 finished with value: 0.1471170804894495 and parameters: {'rusbc_n_estimators': 75, 'rusbc_learning_rate': 0.898008438399367, 'rusbc_sampling_strategy': 'not majority'}. Best is trial 18 with value: 0.749984.[0m
[32m[I 2022-10-26 22:49:06,743][0m Trial 37 finished with value: 0.027999073206142415 and parameters: {'rusbc_n_estimators': 75, 'rusbc_learning_rate': 0.08345023355900885, 'rusbc_sampling_strategy': 'majority'}. Best is trial 18 with value: 0.749984.[0m
[32m[I 2022-10-26 22:49:09,397][0m Trial 33 finished with value: 0.4810549632309895 and parameters: {'rusbc_n_estimators': 75, 'rusbc_learning_rate': 0.9152790504213115, 'rusbc_sampling_strategy': 'not majority'}. Best is trial 18 with value: 0.749984.[0m
[32m[I 2022-10-26 22:49:44,698][0m Trial 34 finished with value: 0.1976317897157297 and parameters: {'rusbc_n_estimators': 75, 'rusbc_learning_rate': 0.5125902174972677, 'rusbc_sampling_strategy': 'not majority'}. Best is trial 18 with value: 0.810593.[0m
[32m[I 2022-10-26 22:49:44,815][0m Trial 36 finished with value: 0.737654046445299 and parameters: {'rusbc_n_estimators': 75, 'rusbc_learning_rate': 0.08835075841039201, 'rusbc_sampling_strategy': 'not majority'}. Best is trial 35 with value: 0.810593.[0m
[32m[I 2022-10-26 22:49:44,821][0m Trial 35 finished with value: 0.8105931094121007 and parameters: {'rusbc_n_estimators': 75, 'rusbc_learning_rate': 0.6219726265319384, 'rusbc_sampling_strategy': 'not majority'}. Best is trial 35 with value: 0.810593.[0m
[32m[I 2022-10-26 22:50:08,013][0m Trial 38 finished with value: 0.7416830515899765 and parameters: {'rusbc_n_estimators': 75, 'rusbc_learning_rate': 0.08959839482864328, 'rusbc_sampling_strategy': 'not majority'}. Best is trial 35 with value: 0.810593.[0m
[32m[I 2022-10-26 22:50:13,773][0m Trial 40 finished with value: 0.08680042383370337 and parameters: {'rusbc_n_estimators': 75, 'rusbc_learning_rate': 0.08252522412961588, 'rusbc_sampling_strategy': 'majority'}. Best is trial 35 with value: 0.810593.[0m
[32m[I 2022-10-26 22:51:19,158][0m Trial 39 finished with value: 0.7334508224148979 and parameters: {'rusbc_n_estimators': 75, 'rusbc_learning_rate': 0.08143389736194258, 'rusbc_sampling_strategy': 'not majority'}. Best is trial 35 with value: 0.810593.[0m
[32m[I 2022-10-26 22:51:42,598][0m Trial 47 finished with value: 0.7492703008101322 and parameters: {'rusbc_n_estimators': 50, 'rusbc_learning_rate': 0.03329989165202289, 'rusbc_sampling_strategy': 'not minority'}. Best is trial 35 with value: 0.810593.[0m
[32m[I 2022-10-26 22:51:53,908][0m Trial 41 finished with value: 0.7475794314186445 and parameters: {'rusbc_n_estimators': 75, 'rusbc_learning_rate': 0.1206746620757661, 'rusbc_sampling_strategy': 'not majority'}. Best is trial 35 with value: 0.810593.[0m
[32m[I 2022-10-26 22:51:55,106][0m Trial 42 finished with value: 0.7491751109607364 and parameters: {'rusbc_n_estimators': 75, 'rusbc_learning_rate': 0.10953595794466846, 'rusbc_sampling_strategy': 'not majority'}. Best is trial 35 with value: 0.810593.[0m
[32m[I 2022-10-26 22:52:12,863][0m Trial 45 finished with value: 0.02458901913746301 and parameters: {'rusbc_n_estimators': 75, 'rusbc_learning_rate': 0.05323755086984284, 'rusbc_sampling_strategy': 'majority'}. Best is trial 35 with value: 0.810593.[0m
[32m[I 2022-10-26 22:52:12,863][0m Trial 43 finished with value: 0.02458784745644454 and parameters: {'rusbc_n_estimators': 75, 'rusbc_learning_rate': 0.057020509960766866, 'rusbc_sampling_strategy': 'majority'}. Best is trial 35 with value: 0.810593.[0m
[32m[I 2022-10-26 22:52:14,492][0m Trial 44 finished with value: 0.027993146443118903 and parameters: {'rusbc_n_estimators': 75, 'rusbc_learning_rate': 0.06020532160902537, 'rusbc_sampling_strategy': 'majority'}. Best is trial 35 with value: 0.810593.[0m
[32m[I 2022-10-26 22:52:33,524][0m Trial 49 finished with value: 0.0065454006419009 and parameters: {'rusbc_n_estimators': 25, 'rusbc_learning_rate': 0.040576550491429844, 'rusbc_sampling_strategy': 'not minority'}. Best is trial 35 with value: 0.810593.[0m
[32m[I 2022-10-26 22:52:43,008][0m Trial 46 finished with value: 0.024791454783222575 and parameters: {'rusbc_n_estimators': 75, 'rusbc_learning_rate': 0.049864434640323106, 'rusbc_sampling_strategy': 'majority'}. Best is trial 35 with value: 0.810593.[0m
[32m[I 2022-10-26 22:53:33,724][0m Trial 51 finished with value: 0.7492703008101322 and parameters: {'rusbc_n_estimators': 50, 'rusbc_learning_rate': 0.0329017008575374, 'rusbc_sampling_strategy': 'not minority'}. Best is trial 35 with value: 0.810593.[0m
[32m[I 2022-10-26 22:53:33,728][0m Trial 50 finished with value: 0.7402500360645109 and parameters: {'rusbc_n_estimators': 50, 'rusbc_learning_rate': 0.047151084668231, 'rusbc_sampling_strategy': 'not minority'}. Best is trial 35 with value: 0.810593.[0m
[32m[I 2022-10-26 22:53:53,028][0m Trial 53 finished with value: 0.030878724359210897 and parameters: {'rusbc_n_estimators': 50, 'rusbc_learning_rate': 0.029580736162173615, 'rusbc_sampling_strategy': 'not minority'}. Best is trial 35 with value: 0.810593.[0m
[32m[I 2022-10-26 22:53:54,093][0m Trial 54 finished with value: 0.006335028849647652 and parameters: {'rusbc_n_estimators': 50, 'rusbc_learning_rate': 0.021833952995858233, 'rusbc_sampling_strategy': 'not minority'}. Best is trial 35 with value: 0.810593.[0m
[32m[I 2022-10-26 22:53:54,744][0m Trial 52 finished with value: 0.030881066445130896 and parameters: {'rusbc_n_estimators': 50, 'rusbc_learning_rate': 0.029107347952581703, 'rusbc_sampling_strategy': 'not minority'}. Best is trial 35 with value: 0.810593.[0m
[32m[I 2022-10-26 22:54:14,243][0m Trial 55 finished with value: 0.006205580474771737 and parameters: {'rusbc_n_estimators': 50, 'rusbc_learning_rate': 0.01971111416498996, 'rusbc_sampling_strategy': 'not minority'}. Best is trial 35 with value: 0.810593.[0m
[32m[I 2022-10-26 22:54:22,898][0m Trial 56 finished with value: 0.0006044929990853171 and parameters: {'rusbc_n_estimators': 50, 'rusbc_learning_rate': 0.003569692483828444, 'rusbc_sampling_strategy': 'not minority'}. Best is trial 35 with value: 0.810593.[0m
[32m[I 2022-10-26 22:54:37,059][0m Trial 48 finished with value: 0.7007912438477164 and parameters: {'rusbc_n_estimators': 75, 'rusbc_learning_rate': 0.03165414881189514, 'rusbc_sampling_strategy': 'not majority'}. Best is trial 35 with value: 0.810593.[0m
[32m[I 2022-10-26 22:54:49,660][0m Trial 61 finished with value: 0.0006044929990853171 and parameters: {'rusbc_n_estimators': 25, 'rusbc_learning_rate': 0.006908618619310433, 'rusbc_sampling_strategy': 'not minority'}. Best is trial 35 with value: 0.810593.[0m
[32m[I 2022-10-26 22:55:07,705][0m Trial 62 finished with value: 0.0006044929990853171 and parameters: {'rusbc_n_estimators': 25, 'rusbc_learning_rate': 0.004871594793839902, 'rusbc_sampling_strategy': 'not minority'}. Best is trial 35 with value: 0.810593.[0m
[32m[I 2022-10-26 22:55:14,537][0m Trial 58 finished with value: 0.006205580474771737 and parameters: {'rusbc_n_estimators': 50, 'rusbc_learning_rate': 0.020645752184326183, 'rusbc_sampling_strategy': 'not minority'}. Best is trial 35 with value: 0.810593.[0m
[32m[I 2022-10-26 22:55:16,116][0m Trial 57 finished with value: 0.0006044929990853171 and parameters: {'rusbc_n_estimators': 50, 'rusbc_learning_rate': 0.0032012382696947265, 'rusbc_sampling_strategy': 'not minority'}. Best is trial 35 with value: 0.810593.[0m
[32m[I 2022-10-26 22:55:17,138][0m Trial 63 finished with value: 0.14036061489081733 and parameters: {'rusbc_n_estimators': 25, 'rusbc_learning_rate': 0.3284911061803498, 'rusbc_sampling_strategy': 'all'}. Best is trial 35 with value: 0.810593.[0m
[32m[I 2022-10-26 22:55:30,795][0m Trial 64 finished with value: 0.003726507473463766 and parameters: {'rusbc_n_estimators': 25, 'rusbc_learning_rate': 0.006862400028504574, 'rusbc_sampling_strategy': 'all'}. Best is trial 35 with value: 0.810593.[0m
[32m[I 2022-10-26 22:55:33,539][0m Trial 60 finished with value: 0.0006044929990853171 and parameters: {'rusbc_n_estimators': 50, 'rusbc_learning_rate': 0.005484295366290972, 'rusbc_sampling_strategy': 'not minority'}. Best is trial 35 with value: 0.810593.[0m
[32m[I 2022-10-26 22:55:34,549][0m Trial 59 finished with value: 0.0062850337639245935 and parameters: {'rusbc_n_estimators': 50, 'rusbc_learning_rate': 0.016798311381465612, 'rusbc_sampling_strategy': 'not minority'}. Best is trial 35 with value: 0.810593.[0m
[32m[I 2022-10-26 22:56:28,216][0m Trial 65 finished with value: 0.7742476343329399 and parameters: {'rusbc_n_estimators': 50, 'rusbc_learning_rate': 0.2531497159507675, 'rusbc_sampling_strategy': 'all'}. Best is trial 35 with value: 0.810593.[0m
[32m[I 2022-10-26 22:56:42,427][0m Trial 66 finished with value: 0.7963978538352251 and parameters: {'rusbc_n_estimators': 50, 'rusbc_learning_rate': 0.33180862757477037, 'rusbc_sampling_strategy': 'all'}. Best is trial 35 with value: 0.810593.[0m
[32m[I 2022-10-26 22:56:48,561][0m Trial 67 finished with value: 0.7742476343329399 and parameters: {'rusbc_n_estimators': 50, 'rusbc_learning_rate': 0.25702862479229166, 'rusbc_sampling_strategy': 'all'}. Best is trial 35 with value: 0.810593.[0m
[32m[I 2022-10-26 22:56:50,558][0m Trial 68 finished with value: 0.23857615000022003 and parameters: {'rusbc_n_estimators': 50, 'rusbc_learning_rate': 0.17790606405054277, 'rusbc_sampling_strategy': 'all'}. Best is trial 35 with value: 0.810593.[0m
[32m[I 2022-10-26 22:56:51,953][0m Trial 69 finished with value: 0.7800717487052422 and parameters: {'rusbc_n_estimators': 50, 'rusbc_learning_rate': 0.22309730338651834, 'rusbc_sampling_strategy': 'all'}. Best is trial 35 with value: 0.810593.[0m
[32m[I 2022-10-26 22:57:45,611][0m Trial 70 finished with value: 0.7442362604916195 and parameters: {'rusbc_n_estimators': 50, 'rusbc_learning_rate': 0.1780692304813019, 'rusbc_sampling_strategy': 'not majority'}. Best is trial 35 with value: 0.810593.[0m
[32m[I 2022-10-26 22:57:47,332][0m Trial 71 finished with value: 0.7442332477715975 and parameters: {'rusbc_n_estimators': 50, 'rusbc_learning_rate': 0.1773166999218122, 'rusbc_sampling_strategy': 'not majority'}. Best is trial 35 with value: 0.810593.[0m
[32m[I 2022-10-26 22:58:05,788][0m Trial 73 finished with value: 0.23929159648128104 and parameters: {'rusbc_n_estimators': 50, 'rusbc_learning_rate': 0.22849245753888633, 'rusbc_sampling_strategy': 'all'}. Best is trial 35 with value: 0.810593.[0m
[32m[I 2022-10-26 22:58:21,237][0m Trial 74 finished with value: 0.7745943975327041 and parameters: {'rusbc_n_estimators': 50, 'rusbc_learning_rate': 0.2870432617041897, 'rusbc_sampling_strategy': 'all'}. Best is trial 35 with value: 0.810593.[0m
[32m[I 2022-10-26 22:58:26,185][0m Trial 75 finished with value: 0.7725408036399354 and parameters: {'rusbc_n_estimators': 50, 'rusbc_learning_rate': 0.2799817226253209, 'rusbc_sampling_strategy': 'all'}. Best is trial 35 with value: 0.810593.[0m
[32m[I 2022-10-26 22:58:29,463][0m Trial 76 finished with value: 0.6005622840402819 and parameters: {'rusbc_n_estimators': 50, 'rusbc_learning_rate': 0.26097238761246766, 'rusbc_sampling_strategy': 'all'}. Best is trial 35 with value: 0.810593.[0m
[32m[I 2022-10-26 22:58:32,622][0m Trial 77 finished with value: 0.7814909568425816 and parameters: {'rusbc_n_estimators': 50, 'rusbc_learning_rate': 0.3097846208797199, 'rusbc_sampling_strategy': 'all'}. Best is trial 35 with value: 0.810593.[0m
