[32m[I 2022-10-26 00:50:18,304][0m Trial 12 finished with value: 0.7323259635510226 and parameters: {'bnb_alpha': 0.15000000000000002, 'bnb_binarize': 0.9, 'bnb_fit_prior': True}. Best is trial 0 with value: 0.818939.[0m
[32m[I 2022-10-26 00:50:18,425][0m Trial 10 finished with value: 0.07429784596598596 and parameters: {'bnb_alpha': 0.75, 'bnb_binarize': 0.9500000000000001, 'bnb_fit_prior': False}. Best is trial 0 with value: 0.818939.[0m
[32m[I 2022-10-26 00:50:18,427][0m Trial 11 finished with value: 0.7323259635510226 and parameters: {'bnb_alpha': 0.45, 'bnb_binarize': 0.1, 'bnb_fit_prior': True}. Best is trial 0 with value: 0.818939.[0m
[32m[I 2022-10-26 00:50:21,116][0m Trial 19 finished with value: 0.7323259635510226 and parameters: {'bnb_alpha': 1.0, 'bnb_binarize': 0.6000000000000001, 'bnb_fit_prior': True}. Best is trial 0 with value: 0.818939.[0m
[32m[I 2022-10-26 00:50:21,116][0m Trial 16 finished with value: 0.7323259635510226 and parameters: {'bnb_alpha': 1.0, 'bnb_binarize': 0.65, 'bnb_fit_prior': True}. Best is trial 0 with value: 0.818939.[0m
[32m[I 2022-10-26 00:50:21,265][0m Trial 17 finished with value: 0.7323259635510226 and parameters: {'bnb_alpha': 0.9500000000000001, 'bnb_binarize': 0.65, 'bnb_fit_prior': True}. Best is trial 0 with value: 0.818939.[0m
[32m[I 2022-10-26 00:50:21,340][0m Trial 21 finished with value: 0.7323259635510226 and parameters: {'bnb_alpha': 0.65, 'bnb_binarize': 0.65, 'bnb_fit_prior': True}. Best is trial 0 with value: 0.818939.[0m
[32m[I 2022-10-26 00:50:21,407][0m Trial 20 finished with value: 0.7323259635510226 and parameters: {'bnb_alpha': 1.0, 'bnb_binarize': 0.65, 'bnb_fit_prior': True}. Best is trial 0 with value: 0.818939.[0m
[32m[I 2022-10-26 00:50:21,471][0m Trial 18 finished with value: 0.7323259635510226 and parameters: {'bnb_alpha': 0.65, 'bnb_binarize': 0.65, 'bnb_fit_prior': True}. Best is trial 0 with value: 0.818939.[0m
[32m[I 2022-10-26 00:50:21,537][0m Trial 22 finished with value: 0.7323259635510226 and parameters: {'bnb_alpha': 0.9500000000000001, 'bnb_binarize': 0.65, 'bnb_fit_prior': True}. Best is trial 0 with value: 0.818939.[0m
[32m[I 2022-10-26 00:50:21,607][0m Trial 23 finished with value: 0.7323259635510226 and parameters: {'bnb_alpha': 1.0, 'bnb_binarize': 0.65, 'bnb_fit_prior': True}. Best is trial 0 with value: 0.818939.[0m
[32m[I 2022-10-26 00:50:23,981][0m Trial 26 finished with value: 0.7323259635510226 and parameters: {'bnb_alpha': 0.65, 'bnb_binarize': 0.5, 'bnb_fit_prior': True}. Best is trial 0 with value: 0.818939.[0m
[32m[I 2022-10-26 00:50:24,120][0m Trial 27 finished with value: 0.8189394612083668 and parameters: {'bnb_alpha': 0.6000000000000001, 'bnb_binarize': 1.0, 'bnb_fit_prior': True}. Best is trial 0 with value: 0.818939.[0m
[32m[I 2022-10-26 00:50:24,211][0m Trial 24 finished with value: 0.8189394612083668 and parameters: {'bnb_alpha': 0.6000000000000001, 'bnb_binarize': 1.0, 'bnb_fit_prior': True}. Best is trial 0 with value: 0.818939.[0m
[32m[I 2022-10-26 00:50:24,295][0m Trial 29 finished with value: 0.8189394612083668 and parameters: {'bnb_alpha': 0.6000000000000001, 'bnb_binarize': 1.0, 'bnb_fit_prior': True}. Best is trial 0 with value: 0.818939.[0m
[32m[I 2022-10-26 00:50:24,371][0m Trial 30 finished with value: 0.8189394612083668 and parameters: {'bnb_alpha': 0.55, 'bnb_binarize': 1.0, 'bnb_fit_prior': True}. Best is trial 0 with value: 0.818939.[0m
[32m[I 2022-10-26 00:50:24,371][0m Trial 25 finished with value: 0.8189394612083668 and parameters: {'bnb_alpha': 0.6000000000000001, 'bnb_binarize': 1.0, 'bnb_fit_prior': True}. Best is trial 0 with value: 0.818939.[0m
[32m[I 2022-10-26 00:50:24,547][0m Trial 31 finished with value: 0.8189394612083668 and parameters: {'bnb_alpha': 0.6000000000000001, 'bnb_binarize': 1.0, 'bnb_fit_prior': True}. Best is trial 0 with value: 0.818939.[0m
[32m[I 2022-10-26 00:50:24,615][0m Trial 28 finished with value: 0.8189394612083668 and parameters: {'bnb_alpha': 0.6000000000000001, 'bnb_binarize': 1.0, 'bnb_fit_prior': True}. Best is trial 0 with value: 0.818939.[0m
[32m[I 2022-10-26 00:50:27,039][0m Trial 34 finished with value: 0.7323259635510226 and parameters: {'bnb_alpha': 0.35000000000000003, 'bnb_binarize': 0.8500000000000001, 'bnb_fit_prior': True}. Best is trial 0 with value: 0.818939.[0m
[32m[I 2022-10-26 00:50:27,039][0m Trial 33 finished with value: 0.7323259635510226 and parameters: {'bnb_alpha': 0.4, 'bnb_binarize': 0.8500000000000001, 'bnb_fit_prior': True}. Best is trial 0 with value: 0.818939.[0m
[32m[I 2022-10-26 00:50:27,176][0m Trial 32 finished with value: 0.7323259635510226 and parameters: {'bnb_alpha': 0.4, 'bnb_binarize': 0.8500000000000001, 'bnb_fit_prior': True}. Best is trial 0 with value: 0.818939.[0m
[32m[I 2022-10-26 00:50:27,251][0m Trial 37 finished with value: 0.7323259635510226 and parameters: {'bnb_alpha': 0.4, 'bnb_binarize': 0.8500000000000001, 'bnb_fit_prior': True}. Best is trial 0 with value: 0.818939.[0m
[32m[I 2022-10-26 00:50:27,252][0m Trial 36 finished with value: 0.7323259635510226 and parameters: {'bnb_alpha': 0.4, 'bnb_binarize': 0.8500000000000001, 'bnb_fit_prior': True}. Best is trial 0 with value: 0.818939.[0m
[32m[I 2022-10-26 00:50:27,387][0m Trial 38 finished with value: 0.7323259635510226 and parameters: {'bnb_alpha': 0.4, 'bnb_binarize': 0.8500000000000001, 'bnb_fit_prior': True}. Best is trial 0 with value: 0.818939.[0m
[32m[I 2022-10-26 00:50:27,466][0m Trial 35 finished with value: 0.7323259635510226 and parameters: {'bnb_alpha': 0.4, 'bnb_binarize': 0.8500000000000001, 'bnb_fit_prior': True}. Best is trial 0 with value: 0.818939.[0m
[32m[I 2022-10-26 00:50:27,533][0m Trial 39 finished with value: 0.7323259635510226 and parameters: {'bnb_alpha': 0.45, 'bnb_binarize': 0.8500000000000001, 'bnb_fit_prior': True}. Best is trial 0 with value: 0.818939.[0m
[32m[I 2022-10-26 00:50:29,992][0m Trial 43 finished with value: 0.07429784596598596 and parameters: {'bnb_alpha': 0.75, 'bnb_binarize': 0.9500000000000001, 'bnb_fit_prior': False}. Best is trial 0 with value: 0.818939.[0m
[32m[I 2022-10-26 00:50:29,993][0m Trial 40 finished with value: 0.07429784596598596 and parameters: {'bnb_alpha': 0.75, 'bnb_binarize': 0.9500000000000001, 'bnb_fit_prior': False}. Best is trial 0 with value: 0.818939.[0m
[32m[I 2022-10-26 00:50:30,142][0m Trial 45 finished with value: 0.07429784596598596 and parameters: {'bnb_alpha': 0.75, 'bnb_binarize': 0.9500000000000001, 'bnb_fit_prior': False}. Best is trial 0 with value: 0.818939.[0m
[32m[I 2022-10-26 00:50:30,145][0m Trial 47 finished with value: 0.07429784596598596 and parameters: {'bnb_alpha': 0.75, 'bnb_binarize': 0.9500000000000001, 'bnb_fit_prior': False}. Best is trial 0 with value: 0.818939.[0m
[32m[I 2022-10-26 00:50:30,208][0m Trial 41 finished with value: 0.07429784596598596 and parameters: {'bnb_alpha': 0.75, 'bnb_binarize': 0.9500000000000001, 'bnb_fit_prior': False}. Best is trial 0 with value: 0.818939.[0m
[32m[I 2022-10-26 00:50:30,342][0m Trial 46 finished with value: 0.07429784596598596 and parameters: {'bnb_alpha': 0.75, 'bnb_binarize': 0.9500000000000001, 'bnb_fit_prior': False}. Best is trial 0 with value: 0.818939.[0m
[32m[I 2022-10-26 00:50:30,343][0m Trial 42 finished with value: 0.07429784596598596 and parameters: {'bnb_alpha': 0.75, 'bnb_binarize': 0.9500000000000001, 'bnb_fit_prior': False}. Best is trial 0 with value: 0.818939.[0m
[32m[I 2022-10-26 00:50:30,345][0m Trial 44 finished with value: 0.07429784596598596 and parameters: {'bnb_alpha': 0.75, 'bnb_binarize': 0.9500000000000001, 'bnb_fit_prior': False}. Best is trial 0 with value: 0.818939.[0m
[32m[I 2022-10-26 00:50:32,943][0m Trial 51 finished with value: 0.7323259635510226 and parameters: {'bnb_alpha': 0.5, 'bnb_binarize': 0.8, 'bnb_fit_prior': True}. Best is trial 0 with value: 0.818939.[0m
[32m[I 2022-10-26 00:50:33,043][0m Trial 53 finished with value: 0.7323259635510226 and parameters: {'bnb_alpha': 0.5, 'bnb_binarize': 0.75, 'bnb_fit_prior': True}. Best is trial 0 with value: 0.818939.[0m
[32m[I 2022-10-26 00:50:33,044][0m Trial 50 finished with value: 0.7323259635510226 and parameters: {'bnb_alpha': 0.5, 'bnb_binarize': 0.8, 'bnb_fit_prior': True}. Best is trial 0 with value: 0.818939.[0m
[32m[I 2022-10-26 00:50:33,044][0m Trial 48 finished with value: 0.7323259635510226 and parameters: {'bnb_alpha': 0.5, 'bnb_binarize': 0.75, 'bnb_fit_prior': True}. Best is trial 0 with value: 0.818939.[0m
[32m[I 2022-10-26 00:50:33,115][0m Trial 52 finished with value: 0.7323259635510226 and parameters: {'bnb_alpha': 0.5, 'bnb_binarize': 0.75, 'bnb_fit_prior': True}. Best is trial 0 with value: 0.818939.[0m
[32m[I 2022-10-26 00:50:33,248][0m Trial 49 finished with value: 0.7323259635510226 and parameters: {'bnb_alpha': 0.5, 'bnb_binarize': 0.75, 'bnb_fit_prior': True}. Best is trial 0 with value: 0.818939.[0m
[32m[I 2022-10-26 00:50:33,311][0m Trial 54 finished with value: 0.7323259635510226 and parameters: {'bnb_alpha': 0.5, 'bnb_binarize': 0.8, 'bnb_fit_prior': True}. Best is trial 0 with value: 0.818939.[0m
[32m[I 2022-10-26 00:50:33,375][0m Trial 55 finished with value: 0.7323259635510226 and parameters: {'bnb_alpha': 0.5, 'bnb_binarize': 0.75, 'bnb_fit_prior': True}. Best is trial 0 with value: 0.818939.[0m
[32m[I 2022-10-26 00:50:35,920][0m Trial 59 finished with value: 0.8189394612083668 and parameters: {'bnb_alpha': 0.6000000000000001, 'bnb_binarize': 1.0, 'bnb_fit_prior': True}. Best is trial 0 with value: 0.818939.[0m
[32m[I 2022-10-26 00:50:35,996][0m Trial 62 finished with value: 0.8189394612083668 and parameters: {'bnb_alpha': 0.6000000000000001, 'bnb_binarize': 1.0, 'bnb_fit_prior': True}. Best is trial 0 with value: 0.818939.[0m
[32m[I 2022-10-26 00:50:36,078][0m Trial 61 finished with value: 0.8189394612083668 and parameters: {'bnb_alpha': 0.6000000000000001, 'bnb_binarize': 1.0, 'bnb_fit_prior': True}. Best is trial 0 with value: 0.818939.[0m
[32m[I 2022-10-26 00:50:36,079][0m Trial 58 finished with value: 0.8189394612083668 and parameters: {'bnb_alpha': 0.6000000000000001, 'bnb_binarize': 1.0, 'bnb_fit_prior': True}. Best is trial 0 with value: 0.818939.[0m
[32m[I 2022-10-26 00:50:36,148][0m Trial 60 finished with value: 0.8189394612083668 and parameters: {'bnb_alpha': 0.6000000000000001, 'bnb_binarize': 1.0, 'bnb_fit_prior': True}. Best is trial 0 with value: 0.818939.[0m
[32m[I 2022-10-26 00:50:36,277][0m Trial 56 finished with value: 0.8189394612083668 and parameters: {'bnb_alpha': 0.6000000000000001, 'bnb_binarize': 1.0, 'bnb_fit_prior': True}. Best is trial 0 with value: 0.818939.[0m
[32m[I 2022-10-26 00:50:36,346][0m Trial 57 finished with value: 0.8189394612083668 and parameters: {'bnb_alpha': 0.6000000000000001, 'bnb_binarize': 1.0, 'bnb_fit_prior': True}. Best is trial 0 with value: 0.818939.[0m
[32m[I 2022-10-26 00:50:36,417][0m Trial 63 finished with value: 0.8189394612083668 and parameters: {'bnb_alpha': 0.6000000000000001, 'bnb_binarize': 1.0, 'bnb_fit_prior': True}. Best is trial 0 with value: 0.818939.[0m
[32m[I 2022-10-26 00:50:38,894][0m Trial 67 finished with value: 0.7323259635510226 and parameters: {'bnb_alpha': 0.7000000000000001, 'bnb_binarize': 0.9, 'bnb_fit_prior': True}. Best is trial 0 with value: 0.818939.[0m
[32m[I 2022-10-26 00:50:38,896][0m Trial 65 finished with value: 0.7323259635510226 and parameters: {'bnb_alpha': 0.7000000000000001, 'bnb_binarize': 0.9, 'bnb_fit_prior': True}. Best is trial 0 with value: 0.818939.[0m
[32m[I 2022-10-26 00:50:38,897][0m Trial 71 finished with value: 0.7323259635510226 and parameters: {'bnb_alpha': 0.7000000000000001, 'bnb_binarize': 0.9, 'bnb_fit_prior': True}. Best is trial 0 with value: 0.818939.[0m
[32m[I 2022-10-26 00:50:39,100][0m Trial 68 finished with value: 0.7323259635510226 and parameters: {'bnb_alpha': 0.7000000000000001, 'bnb_binarize': 0.9, 'bnb_fit_prior': True}. Best is trial 0 with value: 0.818939.[0m
[32m[I 2022-10-26 00:50:39,102][0m Trial 69 finished with value: 0.7323259635510226 and parameters: {'bnb_alpha': 0.7000000000000001, 'bnb_binarize': 0.9, 'bnb_fit_prior': True}. Best is trial 0 with value: 0.818939.[0m
[32m[I 2022-10-26 00:50:39,102][0m Trial 64 finished with value: 0.7323259635510226 and parameters: {'bnb_alpha': 0.7000000000000001, 'bnb_binarize': 0.9, 'bnb_fit_prior': True}. Best is trial 0 with value: 0.818939.[0m
[32m[I 2022-10-26 00:50:39,234][0m Trial 66 finished with value: 0.7323259635510226 and parameters: {'bnb_alpha': 0.7000000000000001, 'bnb_binarize': 0.9, 'bnb_fit_prior': True}. Best is trial 0 with value: 0.818939.[0m
[32m[I 2022-10-26 00:50:39,234][0m Trial 70 finished with value: 0.7323259635510226 and parameters: {'bnb_alpha': 0.7000000000000001, 'bnb_binarize': 0.9, 'bnb_fit_prior': True}. Best is trial 0 with value: 0.818939.[0m
[32m[I 2022-10-26 00:50:41,838][0m Trial 74 finished with value: 0.7323259635510226 and parameters: {'bnb_alpha': 0.55, 'bnb_binarize': 0.4, 'bnb_fit_prior': True}. Best is trial 0 with value: 0.818939.[0m
[32m[I 2022-10-26 00:50:41,928][0m Trial 72 finished with value: 0.8189394612083668 and parameters: {'bnb_alpha': 0.55, 'bnb_binarize': 1.0, 'bnb_fit_prior': True}. Best is trial 0 with value: 0.818939.[0m
[32m[I 2022-10-26 00:50:41,932][0m Trial 79 finished with value: 0.7323259635510226 and parameters: {'bnb_alpha': 0.55, 'bnb_binarize': 0.2, 'bnb_fit_prior': True}. Best is trial 0 with value: 0.818939.[0m
[32m[I 2022-10-26 00:50:41,935][0m Trial 78 finished with value: 0.7323259635510226 and parameters: {'bnb_alpha': 0.55, 'bnb_binarize': 0.4, 'bnb_fit_prior': True}. Best is trial 0 with value: 0.818939.[0m
[32m[I 2022-10-26 00:50:42,000][0m Trial 76 finished with value: 0.7323259635510226 and parameters: {'bnb_alpha': 0.55, 'bnb_binarize': 0.25, 'bnb_fit_prior': True}. Best is trial 0 with value: 0.818939.[0m
[32m[I 2022-10-26 00:50:42,121][0m Trial 77 finished with value: 0.7323259635510226 and parameters: {'bnb_alpha': 0.55, 'bnb_binarize': 0.25, 'bnb_fit_prior': True}. Best is trial 0 with value: 0.818939.[0m
[32m[I 2022-10-26 00:50:42,252][0m Trial 75 finished with value: 0.7323259635510226 and parameters: {'bnb_alpha': 0.55, 'bnb_binarize': 0.35000000000000003, 'bnb_fit_prior': True}. Best is trial 0 with value: 0.818939.[0m
[32m[I 2022-10-26 00:50:42,342][0m Trial 73 finished with value: 0.7323259635510226 and parameters: {'bnb_alpha': 0.55, 'bnb_binarize': 0.30000000000000004, 'bnb_fit_prior': True}. Best is trial 0 with value: 0.818939.[0m
[32m[I 2022-10-26 00:50:44,721][0m Trial 84 finished with value: 0.7323259635510226 and parameters: {'bnb_alpha': 0.05, 'bnb_binarize': 0.9500000000000001, 'bnb_fit_prior': True}. Best is trial 0 with value: 0.818939.[0m
[32m[I 2022-10-26 00:50:44,723][0m Trial 86 finished with value: 0.7323259635510226 and parameters: {'bnb_alpha': 0.65, 'bnb_binarize': 0.9500000000000001, 'bnb_fit_prior': True}. Best is trial 0 with value: 0.818939.[0m
[32m[I 2022-10-26 00:50:44,723][0m Trial 81 finished with value: 0.7323259635510226 and parameters: {'bnb_alpha': 0.05, 'bnb_binarize': 0.9500000000000001, 'bnb_fit_prior': True}. Best is trial 0 with value: 0.818939.[0m
[32m[I 2022-10-26 00:50:45,001][0m Trial 85 finished with value: 0.7323259635510226 and parameters: {'bnb_alpha': 0.15000000000000002, 'bnb_binarize': 0.9500000000000001, 'bnb_fit_prior': True}. Best is trial 0 with value: 0.818939.[0m
[32m[I 2022-10-26 00:50:45,001][0m Trial 80 finished with value: 0.7323259635510226 and parameters: {'bnb_alpha': 0.2, 'bnb_binarize': 0.9500000000000001, 'bnb_fit_prior': True}. Best is trial 0 with value: 0.818939.[0m
[32m[I 2022-10-26 00:50:45,002][0m Trial 83 finished with value: 0.7323259635510226 and parameters: {'bnb_alpha': 0.15000000000000002, 'bnb_binarize': 0.9500000000000001, 'bnb_fit_prior': True}. Best is trial 0 with value: 0.818939.[0m
[32m[I 2022-10-26 00:50:45,002][0m Trial 82 finished with value: 0.7323259635510226 and parameters: {'bnb_alpha': 0.1, 'bnb_binarize': 0.9500000000000001, 'bnb_fit_prior': True}. Best is trial 0 with value: 0.818939.[0m
[32m[I 2022-10-26 00:50:45,276][0m Trial 87 finished with value: 0.7323259635510226 and parameters: {'bnb_alpha': 0.1, 'bnb_binarize': 0.9500000000000001, 'bnb_fit_prior': True}. Best is trial 0 with value: 0.818939.[0m
[32m[I 2022-10-26 00:50:47,681][0m Trial 93 finished with value: 0.8189394612083668 and parameters: {'bnb_alpha': 0.65, 'bnb_binarize': 1.0, 'bnb_fit_prior': True}. Best is trial 0 with value: 0.818939.[0m
[32m[I 2022-10-26 00:50:47,685][0m Trial 88 finished with value: 0.7323259635510226 and parameters: {'bnb_alpha': 0.65, 'bnb_binarize': 0.0, 'bnb_fit_prior': True}. Best is trial 0 with value: 0.818939.[0m
[32m[I 2022-10-26 00:50:47,899][0m Trial 91 finished with value: 0.8189394612083668 and parameters: {'bnb_alpha': 0.65, 'bnb_binarize': 1.0, 'bnb_fit_prior': True}. Best is trial 0 with value: 0.818939.[0m
[32m[I 2022-10-26 00:50:47,966][0m Trial 95 finished with value: 0.8189394612083668 and parameters: {'bnb_alpha': 0.65, 'bnb_binarize': 1.0, 'bnb_fit_prior': True}. Best is trial 0 with value: 0.818939.[0m
[32m[I 2022-10-26 00:50:48,032][0m Trial 89 finished with value: 0.8189394612083668 and parameters: {'bnb_alpha': 0.65, 'bnb_binarize': 1.0, 'bnb_fit_prior': True}. Best is trial 0 with value: 0.818939.[0m
[32m[I 2022-10-26 00:50:48,036][0m Trial 90 finished with value: 0.8189394612083668 and parameters: {'bnb_alpha': 0.65, 'bnb_binarize': 1.0, 'bnb_fit_prior': True}. Best is trial 0 with value: 0.818939.[0m
[32m[I 2022-10-26 00:50:48,037][0m Trial 94 finished with value: 0.8189394612083668 and parameters: {'bnb_alpha': 0.65, 'bnb_binarize': 1.0, 'bnb_fit_prior': True}. Best is trial 0 with value: 0.818939.[0m
[32m[I 2022-10-26 00:50:48,097][0m Trial 92 finished with value: 0.7323259635510226 and parameters: {'bnb_alpha': 0.65, 'bnb_binarize': 0.0, 'bnb_fit_prior': True}. Best is trial 0 with value: 0.818939.[0m
[32m[I 2022-10-26 00:50:49,856][0m Trial 97 finished with value: 0.8189394612083668 and parameters: {'bnb_alpha': 0.45, 'bnb_binarize': 1.0, 'bnb_fit_prior': True}. Best is trial 0 with value: 0.818939.[0m
[32m[I 2022-10-26 00:50:49,860][0m Trial 98 finished with value: 0.8189394612083668 and parameters: {'bnb_alpha': 0.45, 'bnb_binarize': 1.0, 'bnb_fit_prior': True}. Best is trial 0 with value: 0.818939.[0m
[32m[I 2022-10-26 00:50:49,860][0m Trial 96 finished with value: 0.8189394612083668 and parameters: {'bnb_alpha': 0.45, 'bnb_binarize': 1.0, 'bnb_fit_prior': True}. Best is trial 0 with value: 0.818939.[0m
[32m[I 2022-10-26 00:50:50,045][0m Trial 99 finished with value: 0.8189394612083668 and parameters: {'bnb_alpha': 0.45, 'bnb_binarize': 1.0, 'bnb_fit_prior': True}. Best is trial 0 with value: 0.818939.[0m
[32m[I 2022-10-26 00:50:50,102][0m Study finished.[0m
[32m[I 2022-10-26 00:50:50,116][0m --------------------------------------------------------------------------------[0m
[32m[I 2022-10-26 00:50:50,116][0m --------------------              CDClassifier              --------------------[0m
[32m[I 2022-10-26 00:50:50,117][0m --------------------------------------------------------------------------------[0m
[32m[I 2022-10-26 00:50:50,143][0m A new study created in RDB with name: CDClassifier_c963b74b[0m
[32m[I 2022-10-26 00:50:50,150][0m Study started.[0m
[32m[I 2022-10-26 00:54:39,228][0m Trial 0 finished with value: 0.7372210875100446 and parameters: {'cdc_loss': 'modified_huber', 'cdc_penalty': 'l1', 'cdc_C': 0.3731375611064074, 'cdc_alpha': 12.07055762441201, 'cdc_selection': 'cyclic'}. Best is trial 0 with value: 0.737221.[0m
[32m[I 2022-10-26 00:54:39,323][0m Trial 6 finished with value: 2.1768465890535954e-05 and parameters: {'cdc_loss': 'log', 'cdc_penalty': 'l2', 'cdc_C': 0.0013255213283718838, 'cdc_alpha': 0.06411458673991446, 'cdc_selection': 'cyclic'}. Best is trial 0 with value: 0.737221.[0m
[32m[I 2022-10-26 00:54:39,324][0m Trial 7 finished with value: 0.707427318386891 and parameters: {'cdc_loss': 'squared_hinge', 'cdc_penalty': 'l2', 'cdc_C': 0.12562596322933842, 'cdc_alpha': 1.1682794359961528, 'cdc_selection': 'cyclic'}. Best is trial 0 with value: 0.737221.[0m
[32m[I 2022-10-26 00:54:39,325][0m Trial 3 finished with value: 0.7302818358017263 and parameters: {'cdc_loss': 'modified_huber', 'cdc_penalty': 'l2', 'cdc_C': 0.0014669732084376635, 'cdc_alpha': 0.24347767185794159, 'cdc_selection': 'cyclic'}. Best is trial 0 with value: 0.737221.[0m
[32m[I 2022-10-26 00:54:39,327][0m Trial 4 finished with value: 0.695145458044165 and parameters: {'cdc_loss': 'squared', 'cdc_penalty': 'l1', 'cdc_C': 0.09466896593771504, 'cdc_alpha': 0.42234083429473407, 'cdc_selection': 'cyclic'}. Best is trial 0 with value: 0.737221.[0m
[32m[I 2022-10-26 00:54:39,631][0m Trial 2 finished with value: 0.6967667531869958 and parameters: {'cdc_loss': 'squared_hinge', 'cdc_penalty': 'l1', 'cdc_C': 1.6630568477687522, 'cdc_alpha': 0.27867244991906, 'cdc_selection': 'uniform'}. Best is trial 0 with value: 0.737221.[0m
[32m[I 2022-10-26 00:54:39,633][0m Trial 1 finished with value: 0.7224263523011131 and parameters: {'cdc_loss': 'squared_hinge', 'cdc_penalty': 'l1', 'cdc_C': 17.54868209326983, 'cdc_alpha': 304.22478841937595, 'cdc_selection': 'cyclic'}. Best is trial 0 with value: 0.737221.[0m
[32m[I 2022-10-26 00:54:39,826][0m Trial 5 finished with value: 0.7224263523011131 and parameters: {'cdc_loss': 'squared_hinge', 'cdc_penalty': 'l1', 'cdc_C': 19.398235495892493, 'cdc_alpha': 0.7883745129555542, 'cdc_selection': 'cyclic'}. Best is trial 0 with value: 0.737221.[0m
