[32m[I 2022-10-26 22:05:40,676][0m Trial 23 finished with value: 0.9996871512873331 and parameters: {'rfc_criterion': 'entropy', 'rfc_n_estimators': 200, 'rfc_min_samples_split': 15, 'rfc_min_samples_leaf': 21, 'rfc_max_features': 7, 'rfc_bootstrap': True}. Best is trial 6 with value: 0.999843.[0m
[32m[I 2022-10-26 22:05:40,903][0m sklearn.ensemble.RandomForestClassifier.fit: fallback to original Scikit-learn[0m
[32m[I 2022-10-26 22:07:02,366][0m sklearn.ensemble.RandomForestClassifier.predict: fallback to original Scikit-learn[0m
[32m[I 2022-10-26 22:07:02,368][0m sklearn.ensemble.RandomForestClassifier.predict_proba: fallback to original Scikit-learn[0m
[32m[I 2022-10-26 22:07:10,865][0m Trial 31 finished with value: 0.9998013913758329 and parameters: {'rfc_criterion': 'entropy', 'rfc_n_estimators': 200, 'rfc_min_samples_split': 18, 'rfc_min_samples_leaf': 19, 'rfc_max_features': 6, 'rfc_bootstrap': True}. Best is trial 6 with value: 0.999843.[0m
[32m[I 2022-10-26 22:07:11,057][0m sklearn.ensemble.RandomForestClassifier.fit: fallback to original Scikit-learn[0m
[32m[I 2022-10-26 22:07:25,767][0m sklearn.ensemble.RandomForestClassifier.predict: fallback to original Scikit-learn[0m
[32m[I 2022-10-26 22:07:25,768][0m sklearn.ensemble.RandomForestClassifier.predict_proba: fallback to original Scikit-learn[0m
[32m[I 2022-10-26 22:07:34,402][0m Trial 32 finished with value: 0.9996945510335176 and parameters: {'rfc_criterion': 'entropy', 'rfc_n_estimators': 200, 'rfc_min_samples_split': 19, 'rfc_min_samples_leaf': 26, 'rfc_max_features': 6, 'rfc_bootstrap': True}. Best is trial 6 with value: 0.999843.[0m
[32m[I 2022-10-26 22:07:34,623][0m sklearn.ensemble.RandomForestClassifier.fit: fallback to original Scikit-learn[0m
[32m[I 2022-10-26 22:07:52,885][0m sklearn.ensemble.RandomForestClassifier.predict: fallback to original Scikit-learn[0m
[32m[I 2022-10-26 22:07:52,886][0m sklearn.ensemble.RandomForestClassifier.predict_proba: fallback to original Scikit-learn[0m
[32m[I 2022-10-26 22:08:01,194][0m Trial 34 finished with value: 0.9998063007074404 and parameters: {'rfc_criterion': 'entropy', 'rfc_n_estimators': 190, 'rfc_min_samples_split': 38, 'rfc_min_samples_leaf': 16, 'rfc_max_features': 4, 'rfc_bootstrap': True}. Best is trial 6 with value: 0.999843.[0m
[32m[I 2022-10-26 22:08:01,403][0m sklearn.ensemble.RandomForestClassifier.fit: fallback to original Scikit-learn[0m
[32m[I 2022-10-26 22:09:24,041][0m sklearn.ensemble.RandomForestClassifier.predict: fallback to original Scikit-learn[0m
[32m[I 2022-10-26 22:09:24,043][0m sklearn.ensemble.RandomForestClassifier.predict_proba: fallback to original Scikit-learn[0m
[32m[I 2022-10-26 22:09:32,370][0m Trial 35 finished with value: 0.9998063007074404 and parameters: {'rfc_criterion': 'entropy', 'rfc_n_estimators': 200, 'rfc_min_samples_split': 39, 'rfc_min_samples_leaf': 16, 'rfc_max_features': 4, 'rfc_bootstrap': True}. Best is trial 6 with value: 0.999843.[0m
[32m[I 2022-10-26 22:09:32,583][0m sklearn.ensemble.RandomForestClassifier.fit: fallback to original Scikit-learn[0m
[32m[I 2022-10-26 22:10:39,791][0m sklearn.ensemble.RandomForestClassifier.predict: fallback to original Scikit-learn[0m
[32m[I 2022-10-26 22:10:39,792][0m sklearn.ensemble.RandomForestClassifier.predict_proba: fallback to original Scikit-learn[0m
[32m[I 2022-10-26 22:10:47,941][0m Trial 36 finished with value: 0.9998559343314913 and parameters: {'rfc_criterion': 'entropy', 'rfc_n_estimators': 200, 'rfc_min_samples_split': 40, 'rfc_min_samples_leaf': 15, 'rfc_max_features': 4, 'rfc_bootstrap': False}. Best is trial 36 with value: 0.999856.[0m
[32m[I 2022-10-26 22:10:48,122][0m sklearn.ensemble.RandomForestClassifier.fit: fallback to original Scikit-learn[0m
[32m[I 2022-10-26 22:10:57,823][0m sklearn.ensemble.RandomForestClassifier.predict: fallback to original Scikit-learn[0m
[32m[I 2022-10-26 22:10:57,825][0m sklearn.ensemble.RandomForestClassifier.predict_proba: fallback to original Scikit-learn[0m
[32m[I 2022-10-26 22:10:59,298][0m sklearn.ensemble.RandomForestClassifier.predict: fallback to original Scikit-learn[0m
[32m[I 2022-10-26 22:10:59,300][0m sklearn.ensemble.RandomForestClassifier.predict_proba: fallback to original Scikit-learn[0m
[32m[I 2022-10-26 22:11:06,736][0m Trial 37 finished with value: 0.9998559343314913 and parameters: {'rfc_criterion': 'entropy', 'rfc_n_estimators': 200, 'rfc_min_samples_split': 40, 'rfc_min_samples_leaf': 16, 'rfc_max_features': 4, 'rfc_bootstrap': False}. Best is trial 37 with value: 0.999856.[0m
[32m[I 2022-10-26 22:11:06,931][0m sklearn.ensemble.RandomForestClassifier.fit: fallback to original Scikit-learn[0m
[32m[I 2022-10-26 22:11:07,213][0m sklearn.ensemble.RandomForestClassifier.predict: fallback to original Scikit-learn[0m
[32m[I 2022-10-26 22:11:07,214][0m sklearn.ensemble.RandomForestClassifier.predict_proba: fallback to original Scikit-learn[0m
[32m[I 2022-10-26 22:11:07,704][0m Trial 39 finished with value: 0.9998484705027321 and parameters: {'rfc_criterion': 'entropy', 'rfc_n_estimators': 180, 'rfc_min_samples_split': 39, 'rfc_min_samples_leaf': 16, 'rfc_max_features': 4, 'rfc_bootstrap': False}. Best is trial 36 with value: 0.999856.[0m
[32m[I 2022-10-26 22:11:07,898][0m sklearn.ensemble.RandomForestClassifier.fit: fallback to original Scikit-learn[0m
[32m[I 2022-10-26 22:11:15,977][0m Trial 38 finished with value: 0.9998559328103941 and parameters: {'rfc_criterion': 'entropy', 'rfc_n_estimators': 200, 'rfc_min_samples_split': 39, 'rfc_min_samples_leaf': 16, 'rfc_max_features': 4, 'rfc_bootstrap': False}. Best is trial 36 with value: 0.999856.[0m
[32m[I 2022-10-26 22:11:16,180][0m sklearn.ensemble.RandomForestClassifier.fit: fallback to original Scikit-learn[0m
[32m[I 2022-10-26 22:12:28,089][0m sklearn.ensemble.RandomForestClassifier.predict: fallback to original Scikit-learn[0m
[32m[I 2022-10-26 22:12:28,091][0m sklearn.ensemble.RandomForestClassifier.predict_proba: fallback to original Scikit-learn[0m
[32m[I 2022-10-26 22:12:35,678][0m Trial 40 finished with value: 0.9998559353606735 and parameters: {'rfc_criterion': 'entropy', 'rfc_n_estimators': 180, 'rfc_min_samples_split': 41, 'rfc_min_samples_leaf': 17, 'rfc_max_features': 4, 'rfc_bootstrap': False}. Best is trial 40 with value: 0.999856.[0m
[32m[I 2022-10-26 22:12:35,878][0m sklearn.ensemble.RandomForestClassifier.fit: fallback to original Scikit-learn[0m
[32m[I 2022-10-26 22:12:51,321][0m sklearn.ensemble.RandomForestClassifier.predict: fallback to original Scikit-learn[0m
[32m[I 2022-10-26 22:12:51,323][0m sklearn.ensemble.RandomForestClassifier.predict_proba: fallback to original Scikit-learn[0m
[32m[I 2022-10-26 22:12:59,213][0m Trial 41 finished with value: 0.9998584178835885 and parameters: {'rfc_criterion': 'entropy', 'rfc_n_estimators': 180, 'rfc_min_samples_split': 39, 'rfc_min_samples_leaf': 15, 'rfc_max_features': 4, 'rfc_bootstrap': False}. Best is trial 41 with value: 0.999858.[0m
[32m[I 2022-10-26 22:12:59,398][0m sklearn.ensemble.RandomForestClassifier.fit: fallback to original Scikit-learn[0m
[32m[I 2022-10-26 22:13:17,168][0m sklearn.ensemble.RandomForestClassifier.predict: fallback to original Scikit-learn[0m
[32m[I 2022-10-26 22:13:17,169][0m sklearn.ensemble.RandomForestClassifier.predict_proba: fallback to original Scikit-learn[0m
[32m[I 2022-10-26 22:13:24,648][0m Trial 42 finished with value: 0.9998484705027321 and parameters: {'rfc_criterion': 'entropy', 'rfc_n_estimators': 180, 'rfc_min_samples_split': 40, 'rfc_min_samples_leaf': 16, 'rfc_max_features': 4, 'rfc_bootstrap': False}. Best is trial 41 with value: 0.999858.[0m
[32m[I 2022-10-26 22:13:24,839][0m sklearn.ensemble.RandomForestClassifier.fit: fallback to original Scikit-learn[0m
[32m[I 2022-10-26 22:14:09,478][0m sklearn.ensemble.RandomForestClassifier.predict: fallback to original Scikit-learn[0m
[32m[I 2022-10-26 22:14:09,481][0m sklearn.ensemble.RandomForestClassifier.predict_proba: fallback to original Scikit-learn[0m
[32m[I 2022-10-26 22:14:17,079][0m Trial 43 finished with value: 0.9998559777090372 and parameters: {'rfc_criterion': 'entropy', 'rfc_n_estimators': 180, 'rfc_min_samples_split': 40, 'rfc_min_samples_leaf': 15, 'rfc_max_features': 3, 'rfc_bootstrap': False}. Best is trial 41 with value: 0.999858.[0m
[32m[I 2022-10-26 22:14:17,260][0m sklearn.ensemble.RandomForestClassifier.fit: fallback to original Scikit-learn[0m
[32m[I 2022-10-26 22:15:27,539][0m sklearn.ensemble.RandomForestClassifier.predict: fallback to original Scikit-learn[0m
[32m[I 2022-10-26 22:15:27,540][0m sklearn.ensemble.RandomForestClassifier.predict_proba: fallback to original Scikit-learn[0m
[32m[I 2022-10-26 22:15:32,533][0m sklearn.ensemble.RandomForestClassifier.predict: fallback to original Scikit-learn[0m
[32m[I 2022-10-26 22:15:32,536][0m sklearn.ensemble.RandomForestClassifier.predict_proba: fallback to original Scikit-learn[0m
[32m[I 2022-10-26 22:15:34,622][0m sklearn.ensemble.RandomForestClassifier.predict: fallback to original Scikit-learn[0m
[32m[I 2022-10-26 22:15:34,623][0m sklearn.ensemble.RandomForestClassifier.predict_proba: fallback to original Scikit-learn[0m
[32m[I 2022-10-26 22:15:35,237][0m Trial 44 finished with value: 0.999850961698126 and parameters: {'rfc_criterion': 'entropy', 'rfc_n_estimators': 180, 'rfc_min_samples_split': 29, 'rfc_min_samples_leaf': 15, 'rfc_max_features': 3, 'rfc_bootstrap': False}. Best is trial 41 with value: 0.999858.[0m
[32m[I 2022-10-26 22:15:35,408][0m sklearn.ensemble.RandomForestClassifier.fit: fallback to original Scikit-learn[0m
[32m[I 2022-10-26 22:15:40,293][0m Trial 46 finished with value: 0.9998857299000344 and parameters: {'rfc_criterion': 'entropy', 'rfc_n_estimators': 170, 'rfc_min_samples_split': 43, 'rfc_min_samples_leaf': 8, 'rfc_max_features': 3, 'rfc_bootstrap': False}. Best is trial 46 with value: 0.999886.[0m
[32m[I 2022-10-26 22:15:40,469][0m sklearn.ensemble.RandomForestClassifier.fit: fallback to original Scikit-learn[0m
[32m[I 2022-10-26 22:15:42,517][0m Trial 45 finished with value: 0.9999055441669887 and parameters: {'rfc_criterion': 'entropy', 'rfc_n_estimators': 170, 'rfc_min_samples_split': 29, 'rfc_min_samples_leaf': 7, 'rfc_max_features': 3, 'rfc_bootstrap': False}. Best is trial 45 with value: 0.999906.[0m
[32m[I 2022-10-26 22:15:42,679][0m sklearn.ensemble.RandomForestClassifier.fit: fallback to original Scikit-learn[0m
[32m[I 2022-10-26 22:15:43,810][0m sklearn.ensemble.RandomForestClassifier.predict: fallback to original Scikit-learn[0m
[32m[I 2022-10-26 22:15:43,812][0m sklearn.ensemble.RandomForestClassifier.predict_proba: fallback to original Scikit-learn[0m
[32m[I 2022-10-26 22:15:51,288][0m Trial 47 finished with value: 0.9998981269371701 and parameters: {'rfc_criterion': 'entropy', 'rfc_n_estimators': 170, 'rfc_min_samples_split': 43, 'rfc_min_samples_leaf': 7, 'rfc_max_features': 3, 'rfc_bootstrap': False}. Best is trial 45 with value: 0.999906.[0m
[32m[I 2022-10-26 22:15:51,491][0m sklearn.ensemble.RandomForestClassifier.fit: fallback to original Scikit-learn[0m
[32m[I 2022-10-26 22:17:01,105][0m sklearn.ensemble.RandomForestClassifier.predict: fallback to original Scikit-learn[0m
[32m[I 2022-10-26 22:17:01,106][0m sklearn.ensemble.RandomForestClassifier.predict_proba: fallback to original Scikit-learn[0m
[32m[I 2022-10-26 22:17:08,382][0m Trial 48 finished with value: 0.9998882318214342 and parameters: {'rfc_criterion': 'entropy', 'rfc_n_estimators': 170, 'rfc_min_samples_split': 44, 'rfc_min_samples_leaf': 8, 'rfc_max_features': 3, 'rfc_bootstrap': False}. Best is trial 45 with value: 0.999906.[0m
[32m[I 2022-10-26 22:17:08,593][0m sklearn.ensemble.RandomForestClassifier.fit: fallback to original Scikit-learn[0m
[32m[I 2022-10-26 22:17:24,889][0m sklearn.ensemble.RandomForestClassifier.predict: fallback to original Scikit-learn[0m
[32m[I 2022-10-26 22:17:24,892][0m sklearn.ensemble.RandomForestClassifier.predict_proba: fallback to original Scikit-learn[0m
[32m[I 2022-10-26 22:17:32,366][0m Trial 49 finished with value: 0.9998882318214342 and parameters: {'rfc_criterion': 'entropy', 'rfc_n_estimators': 170, 'rfc_min_samples_split': 44, 'rfc_min_samples_leaf': 8, 'rfc_max_features': 3, 'rfc_bootstrap': False}. Best is trial 45 with value: 0.999906.[0m
[32m[I 2022-10-26 22:17:32,568][0m sklearn.ensemble.RandomForestClassifier.fit: running accelerated version on CPU[0m
[32m[I 2022-10-26 22:17:40,786][0m sklearn.ensemble.RandomForestClassifier.predict: fallback to original Scikit-learn[0m
[32m[I 2022-10-26 22:17:40,808][0m sklearn.ensemble.RandomForestClassifier.predict_proba: fallback to original Scikit-learn[0m
[32m[I 2022-10-26 22:17:52,795][0m Trial 50 finished with value: 0.9999080580276899 and parameters: {'rfc_criterion': 'entropy', 'rfc_n_estimators': 160, 'rfc_min_samples_split': 44, 'rfc_min_samples_leaf': 6, 'rfc_max_features': 3, 'rfc_bootstrap': False}. Best is trial 50 with value: 0.999908.[0m
[32m[I 2022-10-26 22:17:53,415][0m sklearn.ensemble.RandomForestClassifier.fit: fallback to original Scikit-learn[0m
[32m[I 2022-10-26 22:17:57,301][0m sklearn.ensemble.RandomForestClassifier.predict: running accelerated version on CPU[0m
[32m[I 2022-10-26 22:17:59,043][0m Trial 57 finished with value: 0.9973418584597554 and parameters: {'rfc_criterion': 'gini', 'rfc_n_estimators': 150, 'rfc_min_samples_split': 45, 'rfc_min_samples_leaf': 7, 'rfc_max_features': 2, 'rfc_bootstrap': False}. Best is trial 50 with value: 0.999908.[0m
[32m[I 2022-10-26 22:17:59,231][0m sklearn.ensemble.RandomForestClassifier.fit: fallback to original Scikit-learn[0m
[32m[I 2022-10-26 22:18:43,014][0m sklearn.ensemble.RandomForestClassifier.predict: fallback to original Scikit-learn[0m
[32m[I 2022-10-26 22:18:43,016][0m sklearn.ensemble.RandomForestClassifier.predict_proba: fallback to original Scikit-learn[0m
[32m[I 2022-10-26 22:18:50,042][0m Trial 51 finished with value: 0.9998981272919291 and parameters: {'rfc_criterion': 'entropy', 'rfc_n_estimators': 160, 'rfc_min_samples_split': 44, 'rfc_min_samples_leaf': 7, 'rfc_max_features': 3, 'rfc_bootstrap': False}. Best is trial 50 with value: 0.999908.[0m
[32m[I 2022-10-26 22:18:50,202][0m sklearn.ensemble.RandomForestClassifier.fit: fallback to original Scikit-learn[0m
[32m[I 2022-10-26 22:19:21,605][0m sklearn.ensemble.RandomForestClassifier.predict: fallback to original Scikit-learn[0m
[32m[I 2022-10-26 22:19:21,607][0m sklearn.ensemble.RandomForestClassifier.predict_proba: fallback to original Scikit-learn[0m
[32m[I 2022-10-26 22:19:28,217][0m Trial 54 finished with value: 0.9998559065652891 and parameters: {'rfc_criterion': 'entropy', 'rfc_n_estimators': 150, 'rfc_min_samples_split': 45, 'rfc_min_samples_leaf': 7, 'rfc_max_features': 2, 'rfc_bootstrap': False}. Best is trial 50 with value: 0.999908.[0m
[32m[I 2022-10-26 22:19:28,398][0m sklearn.ensemble.RandomForestClassifier.fit: fallback to original Scikit-learn[0m
[32m[I 2022-10-26 22:19:31,053][0m sklearn.ensemble.RandomForestClassifier.predict: fallback to original Scikit-learn[0m
[32m[I 2022-10-26 22:19:31,054][0m sklearn.ensemble.RandomForestClassifier.predict_proba: fallback to original Scikit-learn[0m
[32m[I 2022-10-26 22:19:31,606][0m sklearn.ensemble.RandomForestClassifier.predict: fallback to original Scikit-learn[0m
[32m[I 2022-10-26 22:19:31,606][0m sklearn.ensemble.RandomForestClassifier.predict_proba: fallback to original Scikit-learn[0m
[32m[I 2022-10-26 22:19:38,644][0m Trial 55 finished with value: 0.9998633262410515 and parameters: {'rfc_criterion': 'entropy', 'rfc_n_estimators': 150, 'rfc_min_samples_split': 43, 'rfc_min_samples_leaf': 7, 'rfc_max_features': 2, 'rfc_bootstrap': False}. Best is trial 50 with value: 0.999908.[0m
[32m[I 2022-10-26 22:19:38,835][0m sklearn.ensemble.RandomForestClassifier.fit: fallback to original Scikit-learn[0m
[32m[I 2022-10-26 22:19:39,792][0m Trial 53 finished with value: 0.9998533843437739 and parameters: {'rfc_criterion': 'entropy', 'rfc_n_estimators': 160, 'rfc_min_samples_split': 45, 'rfc_min_samples_leaf': 8, 'rfc_max_features': 2, 'rfc_bootstrap': False}. Best is trial 50 with value: 0.999908.[0m
[32m[I 2022-10-26 22:19:40,007][0m sklearn.ensemble.RandomForestClassifier.fit: running accelerated version on CPU[0m
[32m[I 2022-10-26 22:19:40,644][0m sklearn.ensemble.RandomForestClassifier.predict: fallback to original Scikit-learn[0m
[32m[I 2022-10-26 22:19:40,771][0m sklearn.ensemble.RandomForestClassifier.predict_proba: fallback to original Scikit-learn[0m
[32m[I 2022-10-26 22:19:54,764][0m Trial 52 finished with value: 0.9998906349918186 and parameters: {'rfc_criterion': 'entropy', 'rfc_n_estimators': 160, 'rfc_min_samples_split': 44, 'rfc_min_samples_leaf': 5, 'rfc_max_features': 2, 'rfc_bootstrap': False}. Best is trial 50 with value: 0.999908.[0m
[32m[I 2022-10-26 22:19:55,325][0m sklearn.ensemble.RandomForestClassifier.fit: running accelerated version on CPU[0m
[32m[I 2022-10-26 22:20:19,004][0m sklearn.ensemble.RandomForestClassifier.predict: running accelerated version on CPU[0m
[32m[I 2022-10-26 22:20:22,776][0m Trial 63 finished with value: 0.9969629844674013 and parameters: {'rfc_criterion': 'gini', 'rfc_n_estimators': 140, 'rfc_min_samples_split': 47, 'rfc_min_samples_leaf': 1, 'rfc_max_features': 3, 'rfc_bootstrap': False}. Best is trial 50 with value: 0.999908.[0m
[32m[I 2022-10-26 22:20:23,262][0m sklearn.ensemble.RandomForestClassifier.fit: fallback to original Scikit-learn[0m
[32m[I 2022-10-26 22:20:30,489][0m sklearn.ensemble.RandomForestClassifier.predict: running accelerated version on CPU[0m
[32m[I 2022-10-26 22:20:32,180][0m Trial 64 finished with value: 0.9957536467309397 and parameters: {'rfc_criterion': 'gini', 'rfc_n_estimators': 140, 'rfc_min_samples_split': 48, 'rfc_min_samples_leaf': 1, 'rfc_max_features': 2, 'rfc_bootstrap': False}. Best is trial 50 with value: 0.999908.[0m
[32m[I 2022-10-26 22:20:32,392][0m sklearn.ensemble.RandomForestClassifier.fit: fallback to original Scikit-learn[0m
[32m[I 2022-10-26 22:21:23,012][0m sklearn.ensemble.RandomForestClassifier.predict: fallback to original Scikit-learn[0m
[32m[I 2022-10-26 22:21:23,013][0m sklearn.ensemble.RandomForestClassifier.predict_proba: fallback to original Scikit-learn[0m
[32m[I 2022-10-26 22:21:29,790][0m Trial 56 finished with value: 0.9998683031988745 and parameters: {'rfc_criterion': 'entropy', 'rfc_n_estimators': 150, 'rfc_min_samples_split': 45, 'rfc_min_samples_leaf': 6, 'rfc_max_features': 2, 'rfc_bootstrap': False}. Best is trial 50 with value: 0.999908.[0m
[32m[I 2022-10-26 22:21:29,998][0m sklearn.ensemble.RandomForestClassifier.fit: fallback to original Scikit-learn[0m
[32m[I 2022-10-26 22:21:52,887][0m sklearn.ensemble.RandomForestClassifier.predict: fallback to original Scikit-learn[0m
[32m[I 2022-10-26 22:21:52,888][0m sklearn.ensemble.RandomForestClassifier.predict_proba: fallback to original Scikit-learn[0m
[32m[I 2022-10-26 22:21:59,755][0m Trial 58 finished with value: 0.9998559065652891 and parameters: {'rfc_criterion': 'entropy', 'rfc_n_estimators': 150, 'rfc_min_samples_split': 45, 'rfc_min_samples_leaf': 7, 'rfc_max_features': 2, 'rfc_bootstrap': False}. Best is trial 50 with value: 0.999908.[0m
[32m[I 2022-10-26 22:21:59,947][0m sklearn.ensemble.RandomForestClassifier.fit: fallback to original Scikit-learn[0m
[32m[I 2022-10-26 22:22:06,130][0m sklearn.ensemble.RandomForestClassifier.predict: fallback to original Scikit-learn[0m
[32m[I 2022-10-26 22:22:06,131][0m sklearn.ensemble.RandomForestClassifier.predict_proba: fallback to original Scikit-learn[0m
[32m[I 2022-10-26 22:22:13,199][0m Trial 59 finished with value: 0.9998533748843865 and parameters: {'rfc_criterion': 'entropy', 'rfc_n_estimators': 160, 'rfc_min_samples_split': 44, 'rfc_min_samples_leaf': 8, 'rfc_max_features': 2, 'rfc_bootstrap': False}. Best is trial 50 with value: 0.999908.[0m
[32m[I 2022-10-26 22:22:13,398][0m sklearn.ensemble.RandomForestClassifier.fit: fallback to original Scikit-learn[0m
[32m[I 2022-10-26 22:22:44,494][0m sklearn.ensemble.RandomForestClassifier.predict: fallback to original Scikit-learn[0m
[32m[I 2022-10-26 22:22:44,495][0m sklearn.ensemble.RandomForestClassifier.predict_proba: fallback to original Scikit-learn[0m
[32m[I 2022-10-26 22:22:50,748][0m Trial 60 finished with value: 0.9999129794615389 and parameters: {'rfc_criterion': 'entropy', 'rfc_n_estimators': 140, 'rfc_min_samples_split': 45, 'rfc_min_samples_leaf': 1, 'rfc_max_features': 2, 'rfc_bootstrap': False}. Best is trial 60 with value: 0.999913.[0m
[32m[I 2022-10-26 22:22:50,914][0m sklearn.ensemble.RandomForestClassifier.fit: fallback to original Scikit-learn[0m
[32m[I 2022-10-26 22:23:21,828][0m sklearn.ensemble.RandomForestClassifier.predict: fallback to original Scikit-learn[0m
[32m[I 2022-10-26 22:23:21,829][0m sklearn.ensemble.RandomForestClassifier.predict_proba: fallback to original Scikit-learn[0m
