[32m[I 2022-10-26 07:36:55,728][0m Trial 97 finished with value: 0.6951098341920565 and parameters: {'lsvc_dual': False, 'lsvc_C': 5.418639206056757e-05, 'lsvc_max_iter': 2000}. Best is trial 0 with value: 0.69511.[0m
[32m[I 2022-10-26 07:36:57,794][0m Trial 98 finished with value: 0.6951098341920565 and parameters: {'lsvc_dual': False, 'lsvc_C': 0.0003885290294474225, 'lsvc_max_iter': 2000}. Best is trial 0 with value: 0.69511.[0m
[32m[I 2022-10-26 07:36:59,906][0m Trial 99 finished with value: 0.6951098341920565 and parameters: {'lsvc_dual': False, 'lsvc_C': 0.021055496643738084, 'lsvc_max_iter': 2000}. Best is trial 0 with value: 0.69511.[0m
[32m[I 2022-10-26 07:36:59,972][0m Study finished.[0m
[32m[I 2022-10-26 07:36:59,985][0m --------------------------------------------------------------------------------[0m
[32m[I 2022-10-26 07:36:59,985][0m --------------------     LinearSVC_AdditiveChi2Sampler      --------------------[0m
[32m[I 2022-10-26 07:36:59,986][0m --------------------------------------------------------------------------------[0m
[32m[I 2022-10-26 07:37:00,013][0m A new study created in RDB with name: LinearSVC_AdditiveChi2Sampler_c963b74b[0m
[32m[I 2022-10-26 07:37:00,020][0m Study started.[0m
[32m[I 2022-10-26 07:37:23,616][0m Trial 0 finished with value: 0.6950742018218817 and parameters: {'lsvc_ac2s_kernel_sample_steps': 3, 'lsvc_ac2s_dual': False, 'lsvc_ac2s_C': 0.0006145225544732065, 'lsvc_ac2s_max_iter': 2000}. Best is trial 0 with value: 0.695074.[0m
[32m[I 2022-10-26 07:37:47,333][0m Trial 1 finished with value: 0.6950742018218817 and parameters: {'lsvc_ac2s_kernel_sample_steps': 3, 'lsvc_ac2s_dual': False, 'lsvc_ac2s_C': 0.05888878204449197, 'lsvc_ac2s_max_iter': 2000}. Best is trial 0 with value: 0.695074.[0m
[32m[I 2022-10-26 07:38:03,168][0m Trial 2 finished with value: 0.6950742018218817 and parameters: {'lsvc_ac2s_kernel_sample_steps': 2, 'lsvc_ac2s_dual': False, 'lsvc_ac2s_C': 0.16737334025034467, 'lsvc_ac2s_max_iter': 2000}. Best is trial 0 with value: 0.695074.[0m
[32m[I 2022-10-26 07:38:19,253][0m Trial 3 finished with value: 0.6950742018218817 and parameters: {'lsvc_ac2s_kernel_sample_steps': 2, 'lsvc_ac2s_dual': False, 'lsvc_ac2s_C': 20.39540211412536, 'lsvc_ac2s_max_iter': 2000}. Best is trial 0 with value: 0.695074.[0m
[32m[I 2022-10-26 07:38:28,579][0m Trial 4 finished with value: 0.6950742018218817 and parameters: {'lsvc_ac2s_kernel_sample_steps': 1, 'lsvc_ac2s_dual': False, 'lsvc_ac2s_C': 429.5544116209509, 'lsvc_ac2s_max_iter': 2000}. Best is trial 0 with value: 0.695074.[0m
[32m[I 2022-10-26 07:38:44,686][0m Trial 5 finished with value: 0.6950742018218817 and parameters: {'lsvc_ac2s_kernel_sample_steps': 2, 'lsvc_ac2s_dual': False, 'lsvc_ac2s_C': 1.340487946420574e-06, 'lsvc_ac2s_max_iter': 2000}. Best is trial 0 with value: 0.695074.[0m
[32m[I 2022-10-26 07:39:09,243][0m Trial 6 finished with value: 0.6950742018218817 and parameters: {'lsvc_ac2s_kernel_sample_steps': 3, 'lsvc_ac2s_dual': False, 'lsvc_ac2s_C': 313.54300775426304, 'lsvc_ac2s_max_iter': 2000}. Best is trial 0 with value: 0.695074.[0m
[32m[I 2022-10-26 07:39:33,747][0m Trial 7 finished with value: 0.6950742018218817 and parameters: {'lsvc_ac2s_kernel_sample_steps': 3, 'lsvc_ac2s_dual': False, 'lsvc_ac2s_C': 1.4880557773789502e-05, 'lsvc_ac2s_max_iter': 2000}. Best is trial 0 with value: 0.695074.[0m
[32m[I 2022-10-26 07:39:49,937][0m Trial 8 finished with value: 0.6950742018218817 and parameters: {'lsvc_ac2s_kernel_sample_steps': 2, 'lsvc_ac2s_dual': False, 'lsvc_ac2s_C': 11.404159762838548, 'lsvc_ac2s_max_iter': 2000}. Best is trial 0 with value: 0.695074.[0m
[32m[I 2022-10-26 07:39:59,135][0m Trial 9 finished with value: 0.6950742018218817 and parameters: {'lsvc_ac2s_kernel_sample_steps': 1, 'lsvc_ac2s_dual': False, 'lsvc_ac2s_C': 347.98723486946534, 'lsvc_ac2s_max_iter': 2000}. Best is trial 0 with value: 0.695074.[0m
[32m[I 2022-10-26 07:40:23,669][0m Trial 10 finished with value: 0.6950742018218817 and parameters: {'lsvc_ac2s_kernel_sample_steps': 3, 'lsvc_ac2s_dual': False, 'lsvc_ac2s_C': 0.00041806300586045756, 'lsvc_ac2s_max_iter': 2000}. Best is trial 0 with value: 0.695074.[0m
[32m[I 2022-10-26 07:40:48,257][0m Trial 11 finished with value: 0.6950742018218817 and parameters: {'lsvc_ac2s_kernel_sample_steps': 3, 'lsvc_ac2s_dual': False, 'lsvc_ac2s_C': 0.007186238887380902, 'lsvc_ac2s_max_iter': 2000}. Best is trial 0 with value: 0.695074.[0m
[32m[I 2022-10-26 07:41:12,803][0m Trial 12 finished with value: 0.6950742018218817 and parameters: {'lsvc_ac2s_kernel_sample_steps': 3, 'lsvc_ac2s_dual': False, 'lsvc_ac2s_C': 0.02146433104589027, 'lsvc_ac2s_max_iter': 2000}. Best is trial 0 with value: 0.695074.[0m
[32m[I 2022-10-26 07:41:37,449][0m Trial 13 finished with value: 0.6950742018218817 and parameters: {'lsvc_ac2s_kernel_sample_steps': 3, 'lsvc_ac2s_dual': False, 'lsvc_ac2s_C': 0.0005772444232996833, 'lsvc_ac2s_max_iter': 2000}. Best is trial 0 with value: 0.695074.[0m
[32m[I 2022-10-26 07:42:02,062][0m Trial 14 finished with value: 0.6950742018218817 and parameters: {'lsvc_ac2s_kernel_sample_steps': 3, 'lsvc_ac2s_dual': False, 'lsvc_ac2s_C': 0.41478214878613234, 'lsvc_ac2s_max_iter': 2000}. Best is trial 0 with value: 0.695074.[0m
[32m[I 2022-10-26 07:42:26,654][0m Trial 15 finished with value: 0.6950742018218817 and parameters: {'lsvc_ac2s_kernel_sample_steps': 3, 'lsvc_ac2s_dual': False, 'lsvc_ac2s_C': 0.0006751669496990141, 'lsvc_ac2s_max_iter': 2000}. Best is trial 0 with value: 0.695074.[0m
[32m[I 2022-10-26 07:42:36,110][0m Trial 16 finished with value: 0.6950742018218817 and parameters: {'lsvc_ac2s_kernel_sample_steps': 1, 'lsvc_ac2s_dual': False, 'lsvc_ac2s_C': 3.9516194259254217e-05, 'lsvc_ac2s_max_iter': 2000}. Best is trial 0 with value: 0.695074.[0m
[32m[I 2022-10-26 07:43:00,912][0m Trial 17 finished with value: 0.6950742018218817 and parameters: {'lsvc_ac2s_kernel_sample_steps': 3, 'lsvc_ac2s_dual': False, 'lsvc_ac2s_C': 1.2745643740596475, 'lsvc_ac2s_max_iter': 2000}. Best is trial 0 with value: 0.695074.[0m
[32m[I 2022-10-26 07:43:25,496][0m Trial 18 finished with value: 0.6950742018218817 and parameters: {'lsvc_ac2s_kernel_sample_steps': 3, 'lsvc_ac2s_dual': False, 'lsvc_ac2s_C': 0.0019453479294686948, 'lsvc_ac2s_max_iter': 2000}. Best is trial 0 with value: 0.695074.[0m
[32m[I 2022-10-26 07:43:34,702][0m Trial 19 finished with value: 0.6950742018218817 and parameters: {'lsvc_ac2s_kernel_sample_steps': 1, 'lsvc_ac2s_dual': False, 'lsvc_ac2s_C': 3.796698106997292e-05, 'lsvc_ac2s_max_iter': 2000}. Best is trial 0 with value: 0.695074.[0m
[32m[I 2022-10-26 07:43:59,297][0m Trial 20 finished with value: 0.6950742018218817 and parameters: {'lsvc_ac2s_kernel_sample_steps': 3, 'lsvc_ac2s_dual': False, 'lsvc_ac2s_C': 3.094630789957093, 'lsvc_ac2s_max_iter': 2000}. Best is trial 0 with value: 0.695074.[0m
[32m[I 2022-10-26 07:44:23,882][0m Trial 21 finished with value: 0.6950742018218817 and parameters: {'lsvc_ac2s_kernel_sample_steps': 3, 'lsvc_ac2s_dual': False, 'lsvc_ac2s_C': 0.003785833794330259, 'lsvc_ac2s_max_iter': 2000}. Best is trial 0 with value: 0.695074.[0m
[32m[I 2022-10-26 07:44:33,179][0m Trial 22 finished with value: 0.6950742018218817 and parameters: {'lsvc_ac2s_kernel_sample_steps': 1, 'lsvc_ac2s_dual': False, 'lsvc_ac2s_C': 3.9570383011996016e-05, 'lsvc_ac2s_max_iter': 2000}. Best is trial 0 with value: 0.695074.[0m
[32m[I 2022-10-26 07:44:42,750][0m Trial 23 finished with value: 0.6950742018218817 and parameters: {'lsvc_ac2s_kernel_sample_steps': 1, 'lsvc_ac2s_dual': False, 'lsvc_ac2s_C': 4.982582543963276e-06, 'lsvc_ac2s_max_iter': 2000}. Best is trial 0 with value: 0.695074.[0m
[32m[I 2022-10-26 07:45:07,345][0m Trial 24 finished with value: 0.6950742018218817 and parameters: {'lsvc_ac2s_kernel_sample_steps': 3, 'lsvc_ac2s_dual': False, 'lsvc_ac2s_C': 6.5770814373940505, 'lsvc_ac2s_max_iter': 2000}. Best is trial 0 with value: 0.695074.[0m
[32m[I 2022-10-26 07:45:16,612][0m Trial 25 finished with value: 0.6950742018218817 and parameters: {'lsvc_ac2s_kernel_sample_steps': 1, 'lsvc_ac2s_dual': False, 'lsvc_ac2s_C': 0.00011387817512551095, 'lsvc_ac2s_max_iter': 2000}. Best is trial 0 with value: 0.695074.[0m
[32m[I 2022-10-26 07:45:26,140][0m Trial 26 finished with value: 0.6950742018218817 and parameters: {'lsvc_ac2s_kernel_sample_steps': 1, 'lsvc_ac2s_dual': False, 'lsvc_ac2s_C': 5.345429020229781e-06, 'lsvc_ac2s_max_iter': 2000}. Best is trial 0 with value: 0.695074.[0m
[32m[I 2022-10-26 07:45:35,459][0m Trial 27 finished with value: 0.6950742018218817 and parameters: {'lsvc_ac2s_kernel_sample_steps': 1, 'lsvc_ac2s_dual': False, 'lsvc_ac2s_C': 1.5809900957122388e-06, 'lsvc_ac2s_max_iter': 2000}. Best is trial 0 with value: 0.695074.[0m
[32m[I 2022-10-26 07:45:44,731][0m Trial 28 finished with value: 0.6950742018218817 and parameters: {'lsvc_ac2s_kernel_sample_steps': 1, 'lsvc_ac2s_dual': False, 'lsvc_ac2s_C': 57.56264143509485, 'lsvc_ac2s_max_iter': 2000}. Best is trial 0 with value: 0.695074.[0m
[32m[I 2022-10-26 07:45:54,016][0m Trial 29 finished with value: 0.6950742018218817 and parameters: {'lsvc_ac2s_kernel_sample_steps': 1, 'lsvc_ac2s_dual': False, 'lsvc_ac2s_C': 0.00014852089996995093, 'lsvc_ac2s_max_iter': 2000}. Best is trial 0 with value: 0.695074.[0m
[32m[I 2022-10-26 07:46:03,605][0m Trial 30 finished with value: 0.6950742018218817 and parameters: {'lsvc_ac2s_kernel_sample_steps': 1, 'lsvc_ac2s_dual': False, 'lsvc_ac2s_C': 1.6066042698317634e-06, 'lsvc_ac2s_max_iter': 2000}. Best is trial 0 with value: 0.695074.[0m
[32m[I 2022-10-26 07:46:12,941][0m Trial 31 finished with value: 0.6950742018218817 and parameters: {'lsvc_ac2s_kernel_sample_steps': 1, 'lsvc_ac2s_dual': False, 'lsvc_ac2s_C': 1.3281655902176333e-05, 'lsvc_ac2s_max_iter': 2000}. Best is trial 0 with value: 0.695074.[0m
[32m[I 2022-10-26 07:46:22,304][0m Trial 32 finished with value: 0.6950742018218817 and parameters: {'lsvc_ac2s_kernel_sample_steps': 1, 'lsvc_ac2s_dual': False, 'lsvc_ac2s_C': 0.07468160084286105, 'lsvc_ac2s_max_iter': 2000}. Best is trial 0 with value: 0.695074.[0m
[32m[I 2022-10-26 07:46:31,524][0m Trial 33 finished with value: 0.6950742018218817 and parameters: {'lsvc_ac2s_kernel_sample_steps': 1, 'lsvc_ac2s_dual': False, 'lsvc_ac2s_C': 0.0001397281488662612, 'lsvc_ac2s_max_iter': 2000}. Best is trial 0 with value: 0.695074.[0m
[32m[I 2022-10-26 07:46:40,758][0m Trial 34 finished with value: 0.6950742018218817 and parameters: {'lsvc_ac2s_kernel_sample_steps': 1, 'lsvc_ac2s_dual': False, 'lsvc_ac2s_C': 5.988668226499935e-06, 'lsvc_ac2s_max_iter': 2000}. Best is trial 0 with value: 0.695074.[0m
[32m[I 2022-10-26 07:46:56,978][0m Trial 35 finished with value: 0.6950742018218817 and parameters: {'lsvc_ac2s_kernel_sample_steps': 2, 'lsvc_ac2s_dual': False, 'lsvc_ac2s_C': 0.005487209929293685, 'lsvc_ac2s_max_iter': 2000}. Best is trial 0 with value: 0.695074.[0m
[32m[I 2022-10-26 07:47:21,566][0m Trial 36 finished with value: 0.6950742018218817 and parameters: {'lsvc_ac2s_kernel_sample_steps': 3, 'lsvc_ac2s_dual': False, 'lsvc_ac2s_C': 0.02044193281133347, 'lsvc_ac2s_max_iter': 2000}. Best is trial 0 with value: 0.695074.[0m
[32m[I 2022-10-26 07:47:46,185][0m Trial 37 finished with value: 0.6950742018218817 and parameters: {'lsvc_ac2s_kernel_sample_steps': 3, 'lsvc_ac2s_dual': False, 'lsvc_ac2s_C': 0.0021788583675450925, 'lsvc_ac2s_max_iter': 2000}. Best is trial 0 with value: 0.695074.[0m
[32m[I 2022-10-26 07:48:02,149][0m Trial 38 finished with value: 0.6950742018218817 and parameters: {'lsvc_ac2s_kernel_sample_steps': 2, 'lsvc_ac2s_dual': False, 'lsvc_ac2s_C': 6.856743566455171e-05, 'lsvc_ac2s_max_iter': 2000}. Best is trial 0 with value: 0.695074.[0m
[32m[I 2022-10-26 07:48:17,933][0m Trial 39 finished with value: 0.6950742018218817 and parameters: {'lsvc_ac2s_kernel_sample_steps': 2, 'lsvc_ac2s_dual': False, 'lsvc_ac2s_C': 1.227142237758597e-05, 'lsvc_ac2s_max_iter': 2000}. Best is trial 0 with value: 0.695074.[0m
[32m[I 2022-10-26 07:48:33,664][0m Trial 40 finished with value: 0.6950742018218817 and parameters: {'lsvc_ac2s_kernel_sample_steps': 2, 'lsvc_ac2s_dual': False, 'lsvc_ac2s_C': 119.74433407400214, 'lsvc_ac2s_max_iter': 2000}. Best is trial 0 with value: 0.695074.[0m
[32m[I 2022-10-26 07:48:42,607][0m Trial 41 finished with value: 0.6950742018218817 and parameters: {'lsvc_ac2s_kernel_sample_steps': 1, 'lsvc_ac2s_dual': False, 'lsvc_ac2s_C': 0.00016668596959798924, 'lsvc_ac2s_max_iter': 2000}. Best is trial 0 with value: 0.695074.[0m
[32m[I 2022-10-26 07:48:51,920][0m Trial 42 finished with value: 0.6950742018218817 and parameters: {'lsvc_ac2s_kernel_sample_steps': 1, 'lsvc_ac2s_dual': False, 'lsvc_ac2s_C': 3.812241092170078e-06, 'lsvc_ac2s_max_iter': 2000}. Best is trial 0 with value: 0.695074.[0m
[32m[I 2022-10-26 07:49:00,802][0m Trial 43 finished with value: 0.6950742018218817 and parameters: {'lsvc_ac2s_kernel_sample_steps': 1, 'lsvc_ac2s_dual': False, 'lsvc_ac2s_C': 4.615335600701621e-06, 'lsvc_ac2s_max_iter': 2000}. Best is trial 0 with value: 0.695074.[0m
[32m[I 2022-10-26 07:49:09,995][0m Trial 44 finished with value: 0.6950742018218817 and parameters: {'lsvc_ac2s_kernel_sample_steps': 1, 'lsvc_ac2s_dual': False, 'lsvc_ac2s_C': 1.4742641225487648e-06, 'lsvc_ac2s_max_iter': 2000}. Best is trial 0 with value: 0.695074.[0m
[32m[I 2022-10-26 07:49:33,673][0m Trial 45 finished with value: 0.6950742018218817 and parameters: {'lsvc_ac2s_kernel_sample_steps': 3, 'lsvc_ac2s_dual': False, 'lsvc_ac2s_C': 1.54501692607711e-05, 'lsvc_ac2s_max_iter': 2000}. Best is trial 0 with value: 0.695074.[0m
[32m[I 2022-10-26 07:49:42,730][0m Trial 46 finished with value: 0.6950742018218817 and parameters: {'lsvc_ac2s_kernel_sample_steps': 1, 'lsvc_ac2s_dual': False, 'lsvc_ac2s_C': 1.173274186673616e-06, 'lsvc_ac2s_max_iter': 2000}. Best is trial 0 with value: 0.695074.[0m
[32m[I 2022-10-26 07:49:51,663][0m Trial 47 finished with value: 0.6950742018218817 and parameters: {'lsvc_ac2s_kernel_sample_steps': 1, 'lsvc_ac2s_dual': False, 'lsvc_ac2s_C': 46.21504489348888, 'lsvc_ac2s_max_iter': 2000}. Best is trial 0 with value: 0.695074.[0m
[32m[I 2022-10-26 07:50:00,581][0m Trial 48 finished with value: 0.6950742018218817 and parameters: {'lsvc_ac2s_kernel_sample_steps': 1, 'lsvc_ac2s_dual': False, 'lsvc_ac2s_C': 0.00084710511886467, 'lsvc_ac2s_max_iter': 2000}. Best is trial 0 with value: 0.695074.[0m
[32m[I 2022-10-26 07:50:09,584][0m Trial 49 finished with value: 0.6950742018218817 and parameters: {'lsvc_ac2s_kernel_sample_steps': 1, 'lsvc_ac2s_dual': False, 'lsvc_ac2s_C': 0.07565608361640913, 'lsvc_ac2s_max_iter': 2000}. Best is trial 0 with value: 0.695074.[0m
[32m[I 2022-10-26 07:50:18,544][0m Trial 50 finished with value: 0.6950742018218817 and parameters: {'lsvc_ac2s_kernel_sample_steps': 1, 'lsvc_ac2s_dual': False, 'lsvc_ac2s_C': 0.0002769087027900147, 'lsvc_ac2s_max_iter': 2000}. Best is trial 0 with value: 0.695074.[0m
[32m[I 2022-10-26 07:50:27,571][0m Trial 51 finished with value: 0.6950742018218817 and parameters: {'lsvc_ac2s_kernel_sample_steps': 1, 'lsvc_ac2s_dual': False, 'lsvc_ac2s_C': 2.0643048630154675e-06, 'lsvc_ac2s_max_iter': 2000}. Best is trial 0 with value: 0.695074.[0m
[32m[I 2022-10-26 07:50:36,451][0m Trial 52 finished with value: 0.6950742018218817 and parameters: {'lsvc_ac2s_kernel_sample_steps': 1, 'lsvc_ac2s_dual': False, 'lsvc_ac2s_C': 0.31942155473138845, 'lsvc_ac2s_max_iter': 2000}. Best is trial 0 with value: 0.695074.[0m
[32m[I 2022-10-26 07:50:45,498][0m Trial 53 finished with value: 0.6950742018218817 and parameters: {'lsvc_ac2s_kernel_sample_steps': 1, 'lsvc_ac2s_dual': False, 'lsvc_ac2s_C': 1.1902208193890552e-05, 'lsvc_ac2s_max_iter': 2000}. Best is trial 0 with value: 0.695074.[0m
[32m[I 2022-10-26 07:50:54,555][0m Trial 54 finished with value: 0.6950742018218817 and parameters: {'lsvc_ac2s_kernel_sample_steps': 1, 'lsvc_ac2s_dual': False, 'lsvc_ac2s_C': 0.06137141979541723, 'lsvc_ac2s_max_iter': 2000}. Best is trial 0 with value: 0.695074.[0m
[32m[I 2022-10-26 07:51:03,580][0m Trial 55 finished with value: 0.6950742018218817 and parameters: {'lsvc_ac2s_kernel_sample_steps': 1, 'lsvc_ac2s_dual': False, 'lsvc_ac2s_C': 0.012778135174369782, 'lsvc_ac2s_max_iter': 2000}. Best is trial 0 with value: 0.695074.[0m
[32m[I 2022-10-26 07:51:12,482][0m Trial 56 finished with value: 0.6950742018218817 and parameters: {'lsvc_ac2s_kernel_sample_steps': 1, 'lsvc_ac2s_dual': False, 'lsvc_ac2s_C': 2.598930068694395e-05, 'lsvc_ac2s_max_iter': 2000}. Best is trial 0 with value: 0.695074.[0m
[32m[I 2022-10-26 07:51:21,386][0m Trial 57 finished with value: 0.6950742018218817 and parameters: {'lsvc_ac2s_kernel_sample_steps': 1, 'lsvc_ac2s_dual': False, 'lsvc_ac2s_C': 7.52496203124196e-05, 'lsvc_ac2s_max_iter': 2000}. Best is trial 0 with value: 0.695074.[0m
[32m[I 2022-10-26 07:51:37,110][0m Trial 58 finished with value: 0.6950742018218817 and parameters: {'lsvc_ac2s_kernel_sample_steps': 2, 'lsvc_ac2s_dual': False, 'lsvc_ac2s_C': 0.00504741795482753, 'lsvc_ac2s_max_iter': 2000}. Best is trial 0 with value: 0.695074.[0m
[32m[I 2022-10-26 07:51:53,003][0m Trial 59 finished with value: 0.6950742018218817 and parameters: {'lsvc_ac2s_kernel_sample_steps': 2, 'lsvc_ac2s_dual': False, 'lsvc_ac2s_C': 0.0009532533235589546, 'lsvc_ac2s_max_iter': 2000}. Best is trial 0 with value: 0.695074.[0m
[32m[I 2022-10-26 07:52:16,703][0m Trial 60 finished with value: 0.6950742018218817 and parameters: {'lsvc_ac2s_kernel_sample_steps': 3, 'lsvc_ac2s_dual': False, 'lsvc_ac2s_C': 0.02800815783681947, 'lsvc_ac2s_max_iter': 2000}. Best is trial 0 with value: 0.695074.[0m
[32m[I 2022-10-26 07:52:40,510][0m Trial 61 finished with value: 0.6950742018218817 and parameters: {'lsvc_ac2s_kernel_sample_steps': 3, 'lsvc_ac2s_dual': False, 'lsvc_ac2s_C': 0.0021332778143812728, 'lsvc_ac2s_max_iter': 2000}. Best is trial 0 with value: 0.695074.[0m
[32m[I 2022-10-26 07:52:56,245][0m Trial 62 finished with value: 0.6950742018218817 and parameters: {'lsvc_ac2s_kernel_sample_steps': 2, 'lsvc_ac2s_dual': False, 'lsvc_ac2s_C': 0.009809085413227408, 'lsvc_ac2s_max_iter': 2000}. Best is trial 0 with value: 0.695074.[0m
[32m[I 2022-10-26 07:53:11,973][0m Trial 63 finished with value: 0.6950742018218817 and parameters: {'lsvc_ac2s_kernel_sample_steps': 2, 'lsvc_ac2s_dual': False, 'lsvc_ac2s_C': 0.0017746862273375459, 'lsvc_ac2s_max_iter': 2000}. Best is trial 0 with value: 0.695074.[0m
[32m[I 2022-10-26 07:53:27,718][0m Trial 64 finished with value: 0.6950742018218817 and parameters: {'lsvc_ac2s_kernel_sample_steps': 2, 'lsvc_ac2s_dual': False, 'lsvc_ac2s_C': 0.017427324148704862, 'lsvc_ac2s_max_iter': 2000}. Best is trial 0 with value: 0.695074.[0m
[32m[I 2022-10-26 07:53:43,516][0m Trial 65 finished with value: 0.6950742018218817 and parameters: {'lsvc_ac2s_kernel_sample_steps': 2, 'lsvc_ac2s_dual': False, 'lsvc_ac2s_C': 6.258220205942347e-05, 'lsvc_ac2s_max_iter': 2000}. Best is trial 0 with value: 0.695074.[0m
[32m[I 2022-10-26 07:53:59,317][0m Trial 66 finished with value: 0.6950742018218817 and parameters: {'lsvc_ac2s_kernel_sample_steps': 2, 'lsvc_ac2s_dual': False, 'lsvc_ac2s_C': 0.00029517463428245657, 'lsvc_ac2s_max_iter': 2000}. Best is trial 0 with value: 0.695074.[0m
[32m[I 2022-10-26 07:54:15,214][0m Trial 67 finished with value: 0.6950742018218817 and parameters: {'lsvc_ac2s_kernel_sample_steps': 2, 'lsvc_ac2s_dual': False, 'lsvc_ac2s_C': 776.4186448596514, 'lsvc_ac2s_max_iter': 2000}. Best is trial 0 with value: 0.695074.[0m
[32m[I 2022-10-26 07:54:39,780][0m Trial 68 finished with value: 0.6950742018218817 and parameters: {'lsvc_ac2s_kernel_sample_steps': 3, 'lsvc_ac2s_dual': False, 'lsvc_ac2s_C': 0.0003021296317262722, 'lsvc_ac2s_max_iter': 2000}. Best is trial 0 with value: 0.695074.[0m
[32m[I 2022-10-26 07:55:04,307][0m Trial 69 finished with value: 0.6950742018218817 and parameters: {'lsvc_ac2s_kernel_sample_steps': 3, 'lsvc_ac2s_dual': False, 'lsvc_ac2s_C': 0.0025223504362645944, 'lsvc_ac2s_max_iter': 2000}. Best is trial 0 with value: 0.695074.[0m
[32m[I 2022-10-26 07:55:20,518][0m Trial 70 finished with value: 0.6950742018218817 and parameters: {'lsvc_ac2s_kernel_sample_steps': 2, 'lsvc_ac2s_dual': False, 'lsvc_ac2s_C': 2.194432282625514e-05, 'lsvc_ac2s_max_iter': 2000}. Best is trial 0 with value: 0.695074.[0m
[32m[I 2022-10-26 07:55:29,688][0m Trial 71 finished with value: 0.6950742018218817 and parameters: {'lsvc_ac2s_kernel_sample_steps': 1, 'lsvc_ac2s_dual': False, 'lsvc_ac2s_C': 2.716123669363689e-06, 'lsvc_ac2s_max_iter': 2000}. Best is trial 0 with value: 0.695074.[0m
[32m[I 2022-10-26 07:55:38,981][0m Trial 72 finished with value: 0.6950742018218817 and parameters: {'lsvc_ac2s_kernel_sample_steps': 1, 'lsvc_ac2s_dual': False, 'lsvc_ac2s_C': 0.35180854114048504, 'lsvc_ac2s_max_iter': 2000}. Best is trial 0 with value: 0.695074.[0m
[32m[I 2022-10-26 07:55:48,221][0m Trial 73 finished with value: 0.6950742018218817 and parameters: {'lsvc_ac2s_kernel_sample_steps': 1, 'lsvc_ac2s_dual': False, 'lsvc_ac2s_C': 0.16621759835445363, 'lsvc_ac2s_max_iter': 2000}. Best is trial 0 with value: 0.695074.[0m
[32m[I 2022-10-26 07:55:57,440][0m Trial 74 finished with value: 0.6950742018218817 and parameters: {'lsvc_ac2s_kernel_sample_steps': 1, 'lsvc_ac2s_dual': False, 'lsvc_ac2s_C': 1.4506815876334767, 'lsvc_ac2s_max_iter': 2000}. Best is trial 0 with value: 0.695074.[0m
[32m[I 2022-10-26 07:56:06,687][0m Trial 75 finished with value: 0.6950742018218817 and parameters: {'lsvc_ac2s_kernel_sample_steps': 1, 'lsvc_ac2s_dual': False, 'lsvc_ac2s_C': 27.95545710488203, 'lsvc_ac2s_max_iter': 2000}. Best is trial 0 with value: 0.695074.[0m
