[32m[I 2022-10-26 19:49:36,231][0m Trial 63 finished with value: 0.9257094302530434 and parameters: {'mlpc_hidden_layer_count': 3, 'mlpc_learning_rate': 'constant', 'mlpc_learning_rate_init': 2.9015219486417488e-05, 'mplc_max_iter': 2000}. Best is trial 7 with value: 0.952896.[0m
[32m[I 2022-10-26 19:49:36,563][0m sklearn.model_selection.train_test_split: running accelerated version on CPU[0m
[32m[I 2022-10-26 19:49:36,589][0m sklearn.model_selection.train_test_split: fallback to original Scikit-learn[0m
[32m[I 2022-10-26 19:55:05,807][0m Trial 65 finished with value: 0.866882803590525 and parameters: {'mlpc_hidden_layer_count': 3, 'mlpc_learning_rate': 'constant', 'mlpc_learning_rate_init': 3.4563502629958302e-06, 'mplc_max_iter': 2000}. Best is trial 7 with value: 0.952896.[0m
[32m[I 2022-10-26 19:55:06,148][0m sklearn.model_selection.train_test_split: running accelerated version on CPU[0m
[32m[I 2022-10-26 19:55:06,176][0m sklearn.model_selection.train_test_split: fallback to original Scikit-learn[0m
[32m[I 2022-10-26 19:55:28,586][0m Trial 61 finished with value: 0.945992715331934 and parameters: {'mlpc_hidden_layer_count': 3, 'mlpc_learning_rate': 'constant', 'mlpc_learning_rate_init': 2.0182297066068807e-05, 'mplc_max_iter': 2000}. Best is trial 7 with value: 0.952896.[0m
[32m[I 2022-10-26 19:55:28,928][0m sklearn.model_selection.train_test_split: running accelerated version on CPU[0m
[32m[I 2022-10-26 19:55:28,955][0m sklearn.model_selection.train_test_split: fallback to original Scikit-learn[0m
[32m[I 2022-10-26 19:58:43,762][0m Trial 46 finished with value: 0.9401586461837339 and parameters: {'mlpc_hidden_layer_count': 3, 'mlpc_learning_rate': 'invscaling', 'mlpc_learning_rate_init': 2.7314916548986846e-05, 'mplc_max_iter': 2000}. Best is trial 7 with value: 0.952896.[0m
[32m[I 2022-10-26 19:58:44,107][0m sklearn.model_selection.train_test_split: running accelerated version on CPU[0m
[32m[I 2022-10-26 19:58:44,134][0m sklearn.model_selection.train_test_split: fallback to original Scikit-learn[0m
[32m[I 2022-10-26 19:59:25,303][0m Trial 64 finished with value: 0.9278534137527269 and parameters: {'mlpc_hidden_layer_count': 3, 'mlpc_learning_rate': 'constant', 'mlpc_learning_rate_init': 2.3709227632271224e-05, 'mplc_max_iter': 2000}. Best is trial 7 with value: 0.952896.[0m
[32m[I 2022-10-26 19:59:25,645][0m sklearn.model_selection.train_test_split: running accelerated version on CPU[0m
[32m[I 2022-10-26 19:59:25,673][0m sklearn.model_selection.train_test_split: fallback to original Scikit-learn[0m
[32m[I 2022-10-26 20:01:55,035][0m Trial 69 finished with value: 0.886384702144297 and parameters: {'mlpc_hidden_layer_count': 3, 'mlpc_learning_rate': 'constant', 'mlpc_learning_rate_init': 5.7982177587148e-05, 'mplc_max_iter': 2000}. Best is trial 7 with value: 0.952896.[0m
[32m[I 2022-10-26 20:01:55,381][0m sklearn.model_selection.train_test_split: running accelerated version on CPU[0m
[32m[I 2022-10-26 20:01:55,409][0m sklearn.model_selection.train_test_split: fallback to original Scikit-learn[0m
[32m[I 2022-10-26 20:33:38,589][0m Trial 72 finished with value: 0.9190825303233231 and parameters: {'mlpc_hidden_layer_count': 3, 'mlpc_learning_rate': 'constant', 'mlpc_learning_rate_init': 6.383139574686312e-05, 'mplc_max_iter': 2000}. Best is trial 7 with value: 0.952896.[0m
[32m[I 2022-10-26 20:33:38,919][0m sklearn.model_selection.train_test_split: running accelerated version on CPU[0m
[32m[I 2022-10-26 20:33:38,946][0m sklearn.model_selection.train_test_split: fallback to original Scikit-learn[0m
[32m[I 2022-10-26 20:39:59,869][0m Trial 70 finished with value: 0.9296844310821147 and parameters: {'mlpc_hidden_layer_count': 3, 'mlpc_learning_rate': 'constant', 'mlpc_learning_rate_init': 6.281848205368941e-05, 'mplc_max_iter': 2000}. Best is trial 7 with value: 0.952896.[0m
[32m[I 2022-10-26 20:40:00,211][0m sklearn.model_selection.train_test_split: running accelerated version on CPU[0m
[32m[I 2022-10-26 20:40:00,238][0m sklearn.model_selection.train_test_split: fallback to original Scikit-learn[0m
[32m[I 2022-10-26 20:40:44,850][0m Trial 73 finished with value: 0.9346054275130126 and parameters: {'mlpc_hidden_layer_count': 3, 'mlpc_learning_rate': 'constant', 'mlpc_learning_rate_init': 6.473942909705622e-06, 'mplc_max_iter': 2000}. Best is trial 7 with value: 0.952896.[0m
[32m[I 2022-10-26 20:40:45,190][0m sklearn.model_selection.train_test_split: running accelerated version on CPU[0m
[32m[I 2022-10-26 20:40:45,217][0m sklearn.model_selection.train_test_split: fallback to original Scikit-learn[0m
[32m[I 2022-10-26 20:42:45,982][0m Trial 67 finished with value: 0.9379104725194346 and parameters: {'mlpc_hidden_layer_count': 3, 'mlpc_learning_rate': 'constant', 'mlpc_learning_rate_init': 3.701582080854322e-06, 'mplc_max_iter': 2000}. Best is trial 7 with value: 0.952896.[0m
[32m[I 2022-10-26 20:42:46,323][0m sklearn.model_selection.train_test_split: running accelerated version on CPU[0m
[32m[I 2022-10-26 20:42:46,351][0m sklearn.model_selection.train_test_split: fallback to original Scikit-learn[0m
[32m[I 2022-10-26 20:43:23,102][0m Trial 71 finished with value: 0.931079608744349 and parameters: {'mlpc_hidden_layer_count': 3, 'mlpc_learning_rate': 'constant', 'mlpc_learning_rate_init': 5.482607264981188e-05, 'mplc_max_iter': 2000}. Best is trial 7 with value: 0.952896.[0m
[32m[I 2022-10-26 20:43:23,448][0m sklearn.model_selection.train_test_split: running accelerated version on CPU[0m
[32m[I 2022-10-26 20:43:23,477][0m sklearn.model_selection.train_test_split: fallback to original Scikit-learn[0m
[32m[I 2022-10-26 20:44:51,113][0m Trial 68 finished with value: 0.9327008042182253 and parameters: {'mlpc_hidden_layer_count': 3, 'mlpc_learning_rate': 'constant', 'mlpc_learning_rate_init': 3.7609524970625475e-06, 'mplc_max_iter': 2000}. Best is trial 7 with value: 0.952896.[0m
[32m[I 2022-10-26 20:44:51,321][0m Trial 74 finished with value: 0.9317068289812548 and parameters: {'mlpc_hidden_layer_count': 3, 'mlpc_learning_rate': 'constant', 'mlpc_learning_rate_init': 4.71944397515318e-06, 'mplc_max_iter': 2000}. Best is trial 7 with value: 0.952896.[0m
[32m[I 2022-10-26 20:44:51,537][0m sklearn.model_selection.train_test_split: running accelerated version on CPU[0m
[32m[I 2022-10-26 20:44:51,565][0m sklearn.model_selection.train_test_split: fallback to original Scikit-learn[0m
[32m[I 2022-10-26 20:44:51,832][0m sklearn.model_selection.train_test_split: running accelerated version on CPU[0m
[32m[I 2022-10-26 20:44:51,860][0m sklearn.model_selection.train_test_split: fallback to original Scikit-learn[0m
[32m[I 2022-10-26 20:50:58,570][0m Trial 66 finished with value: 0.9393591745495313 and parameters: {'mlpc_hidden_layer_count': 3, 'mlpc_learning_rate': 'constant', 'mlpc_learning_rate_init': 3.7595053411326864e-06, 'mplc_max_iter': 2000}. Best is trial 7 with value: 0.952896.[0m
[32m[I 2022-10-26 20:50:58,899][0m sklearn.model_selection.train_test_split: running accelerated version on CPU[0m
[32m[I 2022-10-26 20:50:58,924][0m sklearn.model_selection.train_test_split: fallback to original Scikit-learn[0m
[32m[I 2022-10-26 21:03:34,068][0m Trial 78 finished with value: 0.8648458109875437 and parameters: {'mlpc_hidden_layer_count': 3, 'mlpc_learning_rate': 'adaptive', 'mlpc_learning_rate_init': 4.4557632813112785e-06, 'mplc_max_iter': 2000}. Best is trial 7 with value: 0.952896.[0m
[32m[I 2022-10-26 21:03:34,404][0m sklearn.model_selection.train_test_split: running accelerated version on CPU[0m
[32m[I 2022-10-26 21:03:34,432][0m sklearn.model_selection.train_test_split: fallback to original Scikit-learn[0m
[32m[I 2022-10-26 21:06:17,716][0m Trial 77 finished with value: 0.8659391443221617 and parameters: {'mlpc_hidden_layer_count': 3, 'mlpc_learning_rate': 'adaptive', 'mlpc_learning_rate_init': 3.1650328670358592e-06, 'mplc_max_iter': 2000}. Best is trial 7 with value: 0.952896.[0m
[32m[I 2022-10-26 21:06:18,044][0m sklearn.model_selection.train_test_split: running accelerated version on CPU[0m
[32m[I 2022-10-26 21:06:18,071][0m sklearn.model_selection.train_test_split: fallback to original Scikit-learn[0m
[32m[I 2022-10-26 21:20:17,262][0m Trial 75 finished with value: 0.9337206926628336 and parameters: {'mlpc_hidden_layer_count': 3, 'mlpc_learning_rate': 'adaptive', 'mlpc_learning_rate_init': 4.932270755036925e-06, 'mplc_max_iter': 2000}. Best is trial 7 with value: 0.952896.[0m
[32m[I 2022-10-26 21:24:07,491][0m Trial 81 finished with value: 0.8719033984982959 and parameters: {'mlpc_hidden_layer_count': 3, 'mlpc_learning_rate': 'adaptive', 'mlpc_learning_rate_init': 2.1579972694137147e-06, 'mplc_max_iter': 2000}. Best is trial 7 with value: 0.952896.[0m
[32m[I 2022-10-26 21:25:41,057][0m Trial 79 finished with value: 0.9318545427382944 and parameters: {'mlpc_hidden_layer_count': 3, 'mlpc_learning_rate': 'adaptive', 'mlpc_learning_rate_init': 4.006137364799663e-06, 'mplc_max_iter': 2000}. Best is trial 7 with value: 0.952896.[0m
[32m[I 2022-10-26 21:25:54,114][0m Trial 76 finished with value: 0.9376916542287815 and parameters: {'mlpc_hidden_layer_count': 3, 'mlpc_learning_rate': 'adaptive', 'mlpc_learning_rate_init': 6.616886755575532e-06, 'mplc_max_iter': 2000}. Best is trial 7 with value: 0.952896.[0m
[32m[I 2022-10-26 21:27:17,177][0m Trial 82 finished with value: 0.8701953073958661 and parameters: {'mlpc_hidden_layer_count': 3, 'mlpc_learning_rate': 'adaptive', 'mlpc_learning_rate_init': 2.2600798928180645e-06, 'mplc_max_iter': 2000}. Best is trial 7 with value: 0.952896.[0m
[32m[I 2022-10-26 21:32:54,173][0m Trial 80 finished with value: 0.9376480049308205 and parameters: {'mlpc_hidden_layer_count': 3, 'mlpc_learning_rate': 'adaptive', 'mlpc_learning_rate_init': 5.111650675640157e-06, 'mplc_max_iter': 2000}. Best is trial 7 with value: 0.952896.[0m
[32m[I 2022-10-26 21:33:10,209][0m Trial 83 finished with value: 0.9252589836104608 and parameters: {'mlpc_hidden_layer_count': 3, 'mlpc_learning_rate': 'constant', 'mlpc_learning_rate_init': 9.26491628511967e-06, 'mplc_max_iter': 2000}. Best is trial 7 with value: 0.952896.[0m
[32m[I 2022-10-26 21:37:18,576][0m Trial 84 finished with value: 0.9550065773268767 and parameters: {'mlpc_hidden_layer_count': 3, 'mlpc_learning_rate': 'constant', 'mlpc_learning_rate_init': 7.624519768292621e-06, 'mplc_max_iter': 2000}. Best is trial 84 with value: 0.955007.[0m
[32m[I 2022-10-26 21:37:18,645][0m Study finished.[0m
[32m[I 2022-10-26 21:37:18,658][0m --------------------------------------------------------------------------------[0m
[32m[I 2022-10-26 21:37:18,659][0m --------------------             MultinomialNB              --------------------[0m
[32m[I 2022-10-26 21:37:18,660][0m --------------------------------------------------------------------------------[0m
[32m[I 2022-10-26 21:37:18,718][0m A new study created in RDB with name: MultinomialNB_c963b74b[0m
[32m[I 2022-10-26 21:37:18,725][0m Study started.[0m
[32m[I 2022-10-26 21:37:20,970][0m Trial 4 finished with value: 0.09610301233200992 and parameters: {'mnb_alpha': 0.25, 'mnb_fit_prior': True}. Best is trial 5 with value: 0.0961536.[0m
[32m[I 2022-10-26 21:37:21,055][0m Trial 3 finished with value: 0.09610301233200992 and parameters: {'mnb_alpha': 0.2, 'mnb_fit_prior': True}. Best is trial 5 with value: 0.0961536.[0m
[32m[I 2022-10-26 21:37:21,056][0m Trial 7 finished with value: 0.0961521095913611 and parameters: {'mnb_alpha': 0.55, 'mnb_fit_prior': False}. Best is trial 0 with value: 0.0961536.[0m
[32m[I 2022-10-26 21:37:21,132][0m Trial 2 finished with value: 0.09610928671081832 and parameters: {'mnb_alpha': 0.0, 'mnb_fit_prior': True}. Best is trial 0 with value: 0.0961536.[0m
[32m[I 2022-10-26 21:37:21,260][0m Trial 0 finished with value: 0.09615363715240817 and parameters: {'mnb_alpha': 0.9, 'mnb_fit_prior': False}. Best is trial 0 with value: 0.0961536.[0m
[32m[I 2022-10-26 21:37:21,266][0m Trial 5 finished with value: 0.096152490212032 and parameters: {'mnb_alpha': 0.25, 'mnb_fit_prior': False}. Best is trial 0 with value: 0.0961536.[0m
[32m[I 2022-10-26 21:37:21,400][0m Trial 6 finished with value: 0.0961521095913611 and parameters: {'mnb_alpha': 0.6000000000000001, 'mnb_fit_prior': False}. Best is trial 0 with value: 0.0961536.[0m
[32m[I 2022-10-26 21:37:21,403][0m Trial 1 finished with value: 0.0961521095913611 and parameters: {'mnb_alpha': 0.6000000000000001, 'mnb_fit_prior': False}. Best is trial 0 with value: 0.0961536.[0m
[32m[I 2022-10-26 21:37:23,710][0m Trial 14 finished with value: 0.0961031485471693 and parameters: {'mnb_alpha': 0.5, 'mnb_fit_prior': True}. Best is trial 0 with value: 0.0961536.[0m
[32m[I 2022-10-26 21:37:23,791][0m Trial 8 finished with value: 0.09615265147081081 and parameters: {'mnb_alpha': 0.5, 'mnb_fit_prior': False}. Best is trial 0 with value: 0.0961536.[0m
[32m[I 2022-10-26 21:37:23,866][0m Trial 12 finished with value: 0.09610306217337834 and parameters: {'mnb_alpha': 0.30000000000000004, 'mnb_fit_prior': True}. Best is trial 0 with value: 0.0961536.[0m
[32m[I 2022-10-26 21:37:23,937][0m Trial 13 finished with value: 0.09610306217337834 and parameters: {'mnb_alpha': 0.35000000000000003, 'mnb_fit_prior': True}. Best is trial 0 with value: 0.0961536.[0m
[32m[I 2022-10-26 21:37:24,007][0m Trial 9 finished with value: 0.09610415927238608 and parameters: {'mnb_alpha': 1.0, 'mnb_fit_prior': True}. Best is trial 0 with value: 0.0961536.[0m
[32m[I 2022-10-26 21:37:24,008][0m Trial 15 finished with value: 0.0961521095913611 and parameters: {'mnb_alpha': 0.75, 'mnb_fit_prior': False}. Best is trial 0 with value: 0.0961536.[0m
[32m[I 2022-10-26 21:37:24,143][0m Trial 11 finished with value: 0.0961031485471693 and parameters: {'mnb_alpha': 0.45, 'mnb_fit_prior': True}. Best is trial 0 with value: 0.0961536.[0m
[32m[I 2022-10-26 21:37:24,227][0m Trial 10 finished with value: 0.09610301233200992 and parameters: {'mnb_alpha': 0.25, 'mnb_fit_prior': True}. Best is trial 0 with value: 0.0961536.[0m
[32m[I 2022-10-26 21:37:26,463][0m Trial 16 finished with value: 0.09615363715240817 and parameters: {'mnb_alpha': 1.0, 'mnb_fit_prior': False}. Best is trial 0 with value: 0.0961536.[0m
[32m[I 2022-10-26 21:37:26,467][0m Trial 17 finished with value: 0.09615363715240817 and parameters: {'mnb_alpha': 0.9500000000000001, 'mnb_fit_prior': False}. Best is trial 0 with value: 0.0961536.[0m
[32m[I 2022-10-26 21:37:26,538][0m Trial 23 finished with value: 0.09615363715240817 and parameters: {'mnb_alpha': 1.0, 'mnb_fit_prior': False}. Best is trial 0 with value: 0.0961536.[0m
[32m[I 2022-10-26 21:37:26,609][0m Trial 20 finished with value: 0.09615363715240817 and parameters: {'mnb_alpha': 0.9500000000000001, 'mnb_fit_prior': False}. Best is trial 0 with value: 0.0961536.[0m
[32m[I 2022-10-26 21:37:26,611][0m Trial 22 finished with value: 0.09615363715240817 and parameters: {'mnb_alpha': 0.9500000000000001, 'mnb_fit_prior': False}. Best is trial 0 with value: 0.0961536.[0m
[32m[I 2022-10-26 21:37:26,613][0m Trial 18 finished with value: 0.09615363715240817 and parameters: {'mnb_alpha': 1.0, 'mnb_fit_prior': False}. Best is trial 0 with value: 0.0961536.[0m
[32m[I 2022-10-26 21:37:26,741][0m Trial 21 finished with value: 0.09615363715240817 and parameters: {'mnb_alpha': 1.0, 'mnb_fit_prior': False}. Best is trial 0 with value: 0.0961536.[0m
[32m[I 2022-10-26 21:37:26,877][0m Trial 19 finished with value: 0.09615363715240817 and parameters: {'mnb_alpha': 0.9500000000000001, 'mnb_fit_prior': False}. Best is trial 0 with value: 0.0961536.[0m
[32m[I 2022-10-26 21:37:29,213][0m Trial 31 finished with value: 0.0961521095913611 and parameters: {'mnb_alpha': 0.8, 'mnb_fit_prior': False}. Best is trial 0 with value: 0.0961536.[0m
[32m[I 2022-10-26 21:37:29,298][0m Trial 30 finished with value: 0.0961521095913611 and parameters: {'mnb_alpha': 0.8, 'mnb_fit_prior': False}. Best is trial 0 with value: 0.0961536.[0m
[32m[I 2022-10-26 21:37:29,370][0m Trial 26 finished with value: 0.0961521095913611 and parameters: {'mnb_alpha': 0.8, 'mnb_fit_prior': False}. Best is trial 0 with value: 0.0961536.[0m
[32m[I 2022-10-26 21:37:29,371][0m Trial 24 finished with value: 0.0961521095913611 and parameters: {'mnb_alpha': 0.8, 'mnb_fit_prior': False}. Best is trial 0 with value: 0.0961536.[0m
[32m[I 2022-10-26 21:37:29,372][0m Trial 29 finished with value: 0.0961521095913611 and parameters: {'mnb_alpha': 0.8, 'mnb_fit_prior': False}. Best is trial 0 with value: 0.0961536.[0m
[32m[I 2022-10-26 21:37:29,373][0m Trial 25 finished with value: 0.0961521095913611 and parameters: {'mnb_alpha': 0.75, 'mnb_fit_prior': False}. Best is trial 0 with value: 0.0961536.[0m
[32m[I 2022-10-26 21:37:29,444][0m Trial 27 finished with value: 0.0961521095913611 and parameters: {'mnb_alpha': 0.8, 'mnb_fit_prior': False}. Best is trial 0 with value: 0.0961536.[0m
[32m[I 2022-10-26 21:37:29,445][0m Trial 28 finished with value: 0.0961521095913611 and parameters: {'mnb_alpha': 0.8, 'mnb_fit_prior': False}. Best is trial 0 with value: 0.0961536.[0m
[32m[I 2022-10-26 21:37:32,012][0m Trial 38 finished with value: 0.09615363715240817 and parameters: {'mnb_alpha': 0.9, 'mnb_fit_prior': False}. Best is trial 0 with value: 0.0961536.[0m
[32m[I 2022-10-26 21:37:32,015][0m Trial 35 finished with value: 0.09615363715240817 and parameters: {'mnb_alpha': 0.9, 'mnb_fit_prior': False}. Best is trial 0 with value: 0.0961536.[0m
[32m[I 2022-10-26 21:37:32,016][0m Trial 33 finished with value: 0.09615363715240817 and parameters: {'mnb_alpha': 0.9, 'mnb_fit_prior': False}. Best is trial 0 with value: 0.0961536.[0m
[32m[I 2022-10-26 21:37:32,091][0m Trial 36 finished with value: 0.09615363715240817 and parameters: {'mnb_alpha': 0.9, 'mnb_fit_prior': False}. Best is trial 0 with value: 0.0961536.[0m
[32m[I 2022-10-26 21:37:32,091][0m Trial 32 finished with value: 0.09615363715240817 and parameters: {'mnb_alpha': 0.9, 'mnb_fit_prior': False}. Best is trial 0 with value: 0.0961536.[0m
[32m[I 2022-10-26 21:37:32,150][0m Trial 39 finished with value: 0.09615363715240817 and parameters: {'mnb_alpha': 0.9, 'mnb_fit_prior': False}. Best is trial 0 with value: 0.0961536.[0m
[32m[I 2022-10-26 21:37:32,219][0m Trial 37 finished with value: 0.09615363715240817 and parameters: {'mnb_alpha': 0.9500000000000001, 'mnb_fit_prior': False}. Best is trial 0 with value: 0.0961536.[0m
[32m[I 2022-10-26 21:37:32,419][0m Trial 34 finished with value: 0.09615363715240817 and parameters: {'mnb_alpha': 0.9, 'mnb_fit_prior': False}. Best is trial 0 with value: 0.0961536.[0m
[32m[I 2022-10-26 21:37:34,755][0m Trial 41 finished with value: 0.09615876459084041 and parameters: {'mnb_alpha': 0.0, 'mnb_fit_prior': False}. Best is trial 41 with value: 0.0961588.[0m
[32m[I 2022-10-26 21:37:34,844][0m Trial 44 finished with value: 0.0961521095913611 and parameters: {'mnb_alpha': 0.7000000000000001, 'mnb_fit_prior': False}. Best is trial 41 with value: 0.0961588.[0m
[32m[I 2022-10-26 21:37:34,853][0m Trial 42 finished with value: 0.09615876459084041 and parameters: {'mnb_alpha': 0.0, 'mnb_fit_prior': False}. Best is trial 41 with value: 0.0961588.[0m
[32m[I 2022-10-26 21:37:34,927][0m Trial 43 finished with value: 0.09615241578806163 and parameters: {'mnb_alpha': 0.1, 'mnb_fit_prior': False}. Best is trial 41 with value: 0.0961588.[0m
[32m[I 2022-10-26 21:37:34,993][0m Trial 45 finished with value: 0.09615295755240336 and parameters: {'mnb_alpha': 0.05, 'mnb_fit_prior': False}. Best is trial 41 with value: 0.0961588.[0m
[32m[I 2022-10-26 21:37:35,054][0m Trial 47 finished with value: 0.0961521095913611 and parameters: {'mnb_alpha': 0.65, 'mnb_fit_prior': False}. Best is trial 41 with value: 0.0961588.[0m
[32m[I 2022-10-26 21:37:35,058][0m Trial 46 finished with value: 0.09615876459084041 and parameters: {'mnb_alpha': 0.0, 'mnb_fit_prior': False}. Best is trial 41 with value: 0.0961588.[0m
[32m[I 2022-10-26 21:37:35,118][0m Trial 40 finished with value: 0.0961521095913611 and parameters: {'mnb_alpha': 0.65, 'mnb_fit_prior': False}. Best is trial 41 with value: 0.0961588.[0m
[32m[I 2022-10-26 21:37:37,539][0m Trial 53 finished with value: 0.09610928671081832 and parameters: {'mnb_alpha': 0.0, 'mnb_fit_prior': True}. Best is trial 41 with value: 0.0961588.[0m
[32m[I 2022-10-26 21:37:37,543][0m Trial 51 finished with value: 0.09610928671081832 and parameters: {'mnb_alpha': 0.0, 'mnb_fit_prior': True}. Best is trial 41 with value: 0.0961588.[0m
[32m[I 2022-10-26 21:37:37,543][0m Trial 48 finished with value: 0.09610928671081832 and parameters: {'mnb_alpha': 0.0, 'mnb_fit_prior': True}. Best is trial 41 with value: 0.0961588.[0m
[32m[I 2022-10-26 21:37:37,544][0m Trial 55 finished with value: 0.09610928671081832 and parameters: {'mnb_alpha': 0.0, 'mnb_fit_prior': True}. Best is trial 41 with value: 0.0961588.[0m
[32m[I 2022-10-26 21:37:37,545][0m Trial 50 finished with value: 0.09610928671081832 and parameters: {'mnb_alpha': 0.0, 'mnb_fit_prior': True}. Best is trial 41 with value: 0.0961588.[0m
[32m[I 2022-10-26 21:37:37,614][0m Trial 52 finished with value: 0.09610928671081832 and parameters: {'mnb_alpha': 0.0, 'mnb_fit_prior': True}. Best is trial 41 with value: 0.0961588.[0m
[32m[I 2022-10-26 21:37:37,676][0m Trial 49 finished with value: 0.09610928671081832 and parameters: {'mnb_alpha': 0.0, 'mnb_fit_prior': True}. Best is trial 41 with value: 0.0961588.[0m
[32m[I 2022-10-26 21:37:37,743][0m Trial 54 finished with value: 0.09610928671081832 and parameters: {'mnb_alpha': 0.0, 'mnb_fit_prior': True}. Best is trial 41 with value: 0.0961588.[0m
