[32m[I 2022-10-26 05:22:02,999][0m Trial 59 finished with value: 0.9930008979064058 and parameters: {'hgbc_learning_rate': 0.10495895289305111, 'hgbc_max_iter': 2000, 'hgbc_min_samples_leaf': 31, 'hgbc_l2_regularization': 0.4, 'hgbc_max_bins': 255, 'hgbc_early_stopping': True, 'hgbc_validation_fraction': 0.25, 'hgbc_n_iter_no_change': 10}. Best is trial 43 with value: 0.996397.[0m
[32m[I 2022-10-26 05:24:44,514][0m Trial 51 finished with value: 0.9963872364050291 and parameters: {'hgbc_learning_rate': 0.037837782992497564, 'hgbc_max_iter': 2000, 'hgbc_min_samples_leaf': 30, 'hgbc_l2_regularization': 0.4, 'hgbc_max_bins': 255, 'hgbc_early_stopping': True, 'hgbc_validation_fraction': 0.25, 'hgbc_n_iter_no_change': 10}. Best is trial 43 with value: 0.996397.[0m
[32m[I 2022-10-26 05:28:23,998][0m Trial 53 finished with value: 0.9835250826230066 and parameters: {'hgbc_learning_rate': 0.0317836482964669, 'hgbc_max_iter': 2000, 'hgbc_min_samples_leaf': 31, 'hgbc_l2_regularization': 0.6000000000000001, 'hgbc_max_bins': 63, 'hgbc_early_stopping': True, 'hgbc_validation_fraction': 0.25, 'hgbc_n_iter_no_change': 10}. Best is trial 43 with value: 0.996397.[0m
[32m[I 2022-10-26 05:31:50,423][0m Trial 62 finished with value: 0.9963722541146228 and parameters: {'hgbc_learning_rate': 0.08933862430242374, 'hgbc_max_iter': 2000, 'hgbc_min_samples_leaf': 7, 'hgbc_l2_regularization': 0.4, 'hgbc_max_bins': 255, 'hgbc_early_stopping': True, 'hgbc_validation_fraction': 0.25, 'hgbc_n_iter_no_change': 10}. Best is trial 43 with value: 0.996397.[0m
[32m[I 2022-10-26 05:33:14,423][0m Trial 58 finished with value: 0.9963774351567821 and parameters: {'hgbc_learning_rate': 0.08019066238263321, 'hgbc_max_iter': 2000, 'hgbc_min_samples_leaf': 28, 'hgbc_l2_regularization': 0.4, 'hgbc_max_bins': 255, 'hgbc_early_stopping': True, 'hgbc_validation_fraction': 0.25, 'hgbc_n_iter_no_change': 10}. Best is trial 43 with value: 0.996397.[0m
[32m[I 2022-10-26 05:34:29,239][0m Trial 52 finished with value: 0.9963675919063818 and parameters: {'hgbc_learning_rate': 0.08745623433562431, 'hgbc_max_iter': 2000, 'hgbc_min_samples_leaf': 30, 'hgbc_l2_regularization': 0.4, 'hgbc_max_bins': 255, 'hgbc_early_stopping': True, 'hgbc_validation_fraction': 0.25, 'hgbc_n_iter_no_change': 10}. Best is trial 43 with value: 0.996397.[0m
[32m[I 2022-10-26 06:03:58,571][0m Trial 60 finished with value: 0.9963872028593442 and parameters: {'hgbc_learning_rate': 0.006099554555238162, 'hgbc_max_iter': 2000, 'hgbc_min_samples_leaf': 7, 'hgbc_l2_regularization': 0.4, 'hgbc_max_bins': 255, 'hgbc_early_stopping': True, 'hgbc_validation_fraction': 0.25, 'hgbc_n_iter_no_change': 10}. Best is trial 43 with value: 0.996397.[0m
[32m[I 2022-10-26 06:05:05,721][0m Trial 54 finished with value: 0.9835222223500532 and parameters: {'hgbc_learning_rate': 0.005040663731189871, 'hgbc_max_iter': 2000, 'hgbc_min_samples_leaf': 31, 'hgbc_l2_regularization': 0.4, 'hgbc_max_bins': 63, 'hgbc_early_stopping': True, 'hgbc_validation_fraction': 0.25, 'hgbc_n_iter_no_change': 10}. Best is trial 43 with value: 0.996397.[0m
[32m[I 2022-10-26 06:05:17,233][0m Trial 55 finished with value: 0.98352489058154 and parameters: {'hgbc_learning_rate': 0.0054167468486893975, 'hgbc_max_iter': 2000, 'hgbc_min_samples_leaf': 35, 'hgbc_l2_regularization': 0.4, 'hgbc_max_bins': 63, 'hgbc_early_stopping': True, 'hgbc_validation_fraction': 0.25, 'hgbc_n_iter_no_change': 10}. Best is trial 43 with value: 0.996397.[0m
[32m[I 2022-10-26 06:05:28,037][0m Trial 66 finished with value: 0.9687893414089153 and parameters: {'hgbc_learning_rate': 0.12719889606969903, 'hgbc_max_iter': 2000, 'hgbc_min_samples_leaf': 24, 'hgbc_l2_regularization': 1.0, 'hgbc_max_bins': 127, 'hgbc_early_stopping': True, 'hgbc_validation_fraction': 0.25, 'hgbc_n_iter_no_change': 10}. Best is trial 43 with value: 0.996397.[0m
[32m[I 2022-10-26 06:07:01,669][0m Trial 57 finished with value: 0.9835177829446748 and parameters: {'hgbc_learning_rate': 0.004957462559541087, 'hgbc_max_iter': 2000, 'hgbc_min_samples_leaf': 31, 'hgbc_l2_regularization': 0.4, 'hgbc_max_bins': 63, 'hgbc_early_stopping': True, 'hgbc_validation_fraction': 0.25, 'hgbc_n_iter_no_change': 10}. Best is trial 43 with value: 0.996397.[0m
[32m[I 2022-10-26 06:13:45,509][0m Trial 61 finished with value: 0.9835199046645201 and parameters: {'hgbc_learning_rate': 0.006369290058751436, 'hgbc_max_iter': 2000, 'hgbc_min_samples_leaf': 9, 'hgbc_l2_regularization': 0.6000000000000001, 'hgbc_max_bins': 63, 'hgbc_early_stopping': True, 'hgbc_validation_fraction': 0.25, 'hgbc_n_iter_no_change': 10}. Best is trial 43 with value: 0.996397.[0m
[32m[I 2022-10-26 06:16:45,796][0m Trial 65 finished with value: 0.9954295530271041 and parameters: {'hgbc_learning_rate': 0.007178806456069961, 'hgbc_max_iter': 2000, 'hgbc_min_samples_leaf': 34, 'hgbc_l2_regularization': 1.0, 'hgbc_max_bins': 127, 'hgbc_early_stopping': True, 'hgbc_validation_fraction': 0.25, 'hgbc_n_iter_no_change': 10}. Best is trial 43 with value: 0.996397.[0m
[32m[I 2022-10-26 06:20:17,400][0m Trial 69 finished with value: 0.9963897013828877 and parameters: {'hgbc_learning_rate': 0.023194340839181357, 'hgbc_max_iter': 2000, 'hgbc_min_samples_leaf': 48, 'hgbc_l2_regularization': 0.6000000000000001, 'hgbc_max_bins': 255, 'hgbc_early_stopping': True, 'hgbc_validation_fraction': 0.25, 'hgbc_n_iter_no_change': 10}. Best is trial 43 with value: 0.996397.[0m
[32m[I 2022-10-26 06:20:21,097][0m Trial 63 finished with value: 0.9963772008031088 and parameters: {'hgbc_learning_rate': 0.006426573909826557, 'hgbc_max_iter': 2000, 'hgbc_min_samples_leaf': 23, 'hgbc_l2_regularization': 1.0, 'hgbc_max_bins': 255, 'hgbc_early_stopping': True, 'hgbc_validation_fraction': 0.25, 'hgbc_n_iter_no_change': 10}. Best is trial 43 with value: 0.996397.[0m
[32m[I 2022-10-26 06:21:28,938][0m Trial 68 finished with value: 0.9963847036190234 and parameters: {'hgbc_learning_rate': 0.020454805482780187, 'hgbc_max_iter': 2000, 'hgbc_min_samples_leaf': 25, 'hgbc_l2_regularization': 0.6000000000000001, 'hgbc_max_bins': 255, 'hgbc_early_stopping': True, 'hgbc_validation_fraction': 0.25, 'hgbc_n_iter_no_change': 10}. Best is trial 43 with value: 0.996397.[0m
[32m[I 2022-10-26 06:22:18,618][0m Trial 64 finished with value: 0.9954270715587402 and parameters: {'hgbc_learning_rate': 0.005633314942394212, 'hgbc_max_iter': 2000, 'hgbc_min_samples_leaf': 35, 'hgbc_l2_regularization': 1.0, 'hgbc_max_bins': 127, 'hgbc_early_stopping': True, 'hgbc_validation_fraction': 0.25, 'hgbc_n_iter_no_change': 10}. Best is trial 43 with value: 0.996397.[0m
[32m[I 2022-10-26 06:25:49,548][0m Trial 70 finished with value: 0.9963996641911096 and parameters: {'hgbc_learning_rate': 0.020488103666572086, 'hgbc_max_iter': 2000, 'hgbc_min_samples_leaf': 1, 'hgbc_l2_regularization': 0.6000000000000001, 'hgbc_max_bins': 255, 'hgbc_early_stopping': True, 'hgbc_validation_fraction': 0.25, 'hgbc_n_iter_no_change': 10}. Best is trial 70 with value: 0.9964.[0m
[32m[I 2022-10-26 06:35:39,357][0m Trial 72 finished with value: 0.9963921899957875 and parameters: {'hgbc_learning_rate': 0.023732843811172407, 'hgbc_max_iter': 2000, 'hgbc_min_samples_leaf': 50, 'hgbc_l2_regularization': 0.6000000000000001, 'hgbc_max_bins': 255, 'hgbc_early_stopping': True, 'hgbc_validation_fraction': 0.25, 'hgbc_n_iter_no_change': 10}. Best is trial 70 with value: 0.9964.[0m
[32m[I 2022-10-26 06:38:13,614][0m Trial 71 finished with value: 0.9963922144996854 and parameters: {'hgbc_learning_rate': 0.01372644054420982, 'hgbc_max_iter': 2000, 'hgbc_min_samples_leaf': 49, 'hgbc_l2_regularization': 0.6000000000000001, 'hgbc_max_bins': 255, 'hgbc_early_stopping': True, 'hgbc_validation_fraction': 0.25, 'hgbc_n_iter_no_change': 10}. Best is trial 70 with value: 0.9964.[0m
[32m[I 2022-10-26 06:40:11,062][0m Trial 74 finished with value: 0.9963897076426355 and parameters: {'hgbc_learning_rate': 0.01575863800657664, 'hgbc_max_iter': 2000, 'hgbc_min_samples_leaf': 49, 'hgbc_l2_regularization': 0.6000000000000001, 'hgbc_max_bins': 255, 'hgbc_early_stopping': True, 'hgbc_validation_fraction': 0.25, 'hgbc_n_iter_no_change': 10}. Best is trial 70 with value: 0.9964.[0m
[32m[I 2022-10-26 06:41:21,418][0m Trial 67 finished with value: 0.9954270724236739 and parameters: {'hgbc_learning_rate': 0.1453270308110853, 'hgbc_max_iter': 2000, 'hgbc_min_samples_leaf': 24, 'hgbc_l2_regularization': 1.0, 'hgbc_max_bins': 127, 'hgbc_early_stopping': True, 'hgbc_validation_fraction': 0.25, 'hgbc_n_iter_no_change': 10}. Best is trial 70 with value: 0.9964.[0m
[32m[I 2022-10-26 06:42:17,438][0m Trial 73 finished with value: 0.9963921809310808 and parameters: {'hgbc_learning_rate': 0.014018347925888618, 'hgbc_max_iter': 2000, 'hgbc_min_samples_leaf': 43, 'hgbc_l2_regularization': 0.6000000000000001, 'hgbc_max_bins': 255, 'hgbc_early_stopping': True, 'hgbc_validation_fraction': 0.25, 'hgbc_n_iter_no_change': 10}. Best is trial 70 with value: 0.9964.[0m
[32m[I 2022-10-26 06:43:55,956][0m Trial 76 finished with value: 0.9963822131805604 and parameters: {'hgbc_learning_rate': 0.013629562547068493, 'hgbc_max_iter': 2000, 'hgbc_min_samples_leaf': 18, 'hgbc_l2_regularization': 0.6000000000000001, 'hgbc_max_bins': 255, 'hgbc_early_stopping': True, 'hgbc_validation_fraction': 0.25, 'hgbc_n_iter_no_change': 10}. Best is trial 70 with value: 0.9964.[0m
[32m[I 2022-10-26 06:44:04,617][0m Trial 75 finished with value: 0.9963922068536335 and parameters: {'hgbc_learning_rate': 0.014051394561602966, 'hgbc_max_iter': 2000, 'hgbc_min_samples_leaf': 49, 'hgbc_l2_regularization': 0.6000000000000001, 'hgbc_max_bins': 255, 'hgbc_early_stopping': True, 'hgbc_validation_fraction': 0.25, 'hgbc_n_iter_no_change': 10}. Best is trial 70 with value: 0.9964.[0m
[32m[I 2022-10-26 06:46:26,203][0m Trial 80 finished with value: 0.9963871993348317 and parameters: {'hgbc_learning_rate': 0.05848922525679478, 'hgbc_max_iter': 2000, 'hgbc_min_samples_leaf': 2, 'hgbc_l2_regularization': 0.6000000000000001, 'hgbc_max_bins': 255, 'hgbc_early_stopping': True, 'hgbc_validation_fraction': 0.25, 'hgbc_n_iter_no_change': 10}. Best is trial 70 with value: 0.9964.[0m
[32m[I 2022-10-26 06:48:58,464][0m Trial 77 finished with value: 0.9963946877893103 and parameters: {'hgbc_learning_rate': 0.013252852309822025, 'hgbc_max_iter': 2000, 'hgbc_min_samples_leaf': 1, 'hgbc_l2_regularization': 0.6000000000000001, 'hgbc_max_bins': 255, 'hgbc_early_stopping': True, 'hgbc_validation_fraction': 0.25, 'hgbc_n_iter_no_change': 10}. Best is trial 70 with value: 0.9964.[0m
[32m[I 2022-10-26 06:59:49,349][0m Trial 79 finished with value: 0.9963946877893103 and parameters: {'hgbc_learning_rate': 0.014329853394463344, 'hgbc_max_iter': 2000, 'hgbc_min_samples_leaf': 2, 'hgbc_l2_regularization': 0.6000000000000001, 'hgbc_max_bins': 255, 'hgbc_early_stopping': True, 'hgbc_validation_fraction': 0.25, 'hgbc_n_iter_no_change': 10}. Best is trial 70 with value: 0.9964.[0m
[32m[I 2022-10-26 07:02:08,204][0m Trial 78 finished with value: 0.9963946877893103 and parameters: {'hgbc_learning_rate': 0.012610164630478198, 'hgbc_max_iter': 2000, 'hgbc_min_samples_leaf': 1, 'hgbc_l2_regularization': 0.6000000000000001, 'hgbc_max_bins': 255, 'hgbc_early_stopping': True, 'hgbc_validation_fraction': 0.25, 'hgbc_n_iter_no_change': 10}. Best is trial 70 with value: 0.9964.[0m
[32m[I 2022-10-26 07:04:03,560][0m Trial 81 finished with value: 0.9963921982279521 and parameters: {'hgbc_learning_rate': 0.014105992940359831, 'hgbc_max_iter': 2000, 'hgbc_min_samples_leaf': 3, 'hgbc_l2_regularization': 0.6000000000000001, 'hgbc_max_bins': 255, 'hgbc_early_stopping': True, 'hgbc_validation_fraction': 0.25, 'hgbc_n_iter_no_change': 10}. Best is trial 70 with value: 0.9964.[0m
[32m[I 2022-10-26 07:04:08,456][0m Trial 82 finished with value: 0.9963871931491074 and parameters: {'hgbc_learning_rate': 0.013017019876067161, 'hgbc_max_iter': 2000, 'hgbc_min_samples_leaf': 43, 'hgbc_l2_regularization': 0.6000000000000001, 'hgbc_max_bins': 255, 'hgbc_early_stopping': True, 'hgbc_validation_fraction': 0.25, 'hgbc_n_iter_no_change': 10}. Best is trial 70 with value: 0.9964.[0m
[32m[I 2022-10-26 07:05:22,747][0m Trial 83 finished with value: 0.9963946877893103 and parameters: {'hgbc_learning_rate': 0.013221416979254805, 'hgbc_max_iter': 2000, 'hgbc_min_samples_leaf': 1, 'hgbc_l2_regularization': 0.6000000000000001, 'hgbc_max_bins': 255, 'hgbc_early_stopping': True, 'hgbc_validation_fraction': 0.25, 'hgbc_n_iter_no_change': 10}. Best is trial 70 with value: 0.9964.[0m
[32m[I 2022-10-26 07:06:33,998][0m Trial 84 finished with value: 0.9963921982279521 and parameters: {'hgbc_learning_rate': 0.012256369676939015, 'hgbc_max_iter': 2000, 'hgbc_min_samples_leaf': 3, 'hgbc_l2_regularization': 0.6000000000000001, 'hgbc_max_bins': 255, 'hgbc_early_stopping': True, 'hgbc_validation_fraction': 0.25, 'hgbc_n_iter_no_change': 10}. Best is trial 70 with value: 0.9964.[0m
[32m[I 2022-10-26 07:07:13,448][0m Trial 86 finished with value: 0.9963946504826824 and parameters: {'hgbc_learning_rate': 0.012822628415282375, 'hgbc_max_iter': 2000, 'hgbc_min_samples_leaf': 4, 'hgbc_l2_regularization': 0.6000000000000001, 'hgbc_max_bins': 255, 'hgbc_early_stopping': True, 'hgbc_validation_fraction': 0.25, 'hgbc_n_iter_no_change': 10}. Best is trial 70 with value: 0.9964.[0m
[32m[I 2022-10-26 07:07:25,797][0m Trial 85 finished with value: 0.9963922068536335 and parameters: {'hgbc_learning_rate': 0.011965693156285496, 'hgbc_max_iter': 2000, 'hgbc_min_samples_leaf': 43, 'hgbc_l2_regularization': 0.6000000000000001, 'hgbc_max_bins': 255, 'hgbc_early_stopping': True, 'hgbc_validation_fraction': 0.25, 'hgbc_n_iter_no_change': 10}. Best is trial 70 with value: 0.9964.[0m
[32m[I 2022-10-26 07:07:25,869][0m Study finished.[0m
[32m[I 2022-10-26 07:07:25,886][0m --------------------------------------------------------------------------------[0m
[32m[I 2022-10-26 07:07:25,887][0m --------------------             LGBMClassifier             --------------------[0m
[32m[I 2022-10-26 07:07:25,887][0m --------------------------------------------------------------------------------[0m
[32m[I 2022-10-26 07:07:25,916][0m A new study created in RDB with name: LGBMClassifier_c963b74b[0m
[32m[I 2022-10-26 07:07:25,924][0m Study started.[0m
[32m[I 2022-10-26 07:07:46,165][0m Trial 5 finished with value: 0.9997167652571322 and parameters: {'lgbm_num_leaves': 63, 'lgbm_learning_rate': 0.07708264808679453, 'lgbm_n_estimators': 20, 'lgbm_reg_alpha': 0.35000000000000003, 'lgbm_reg_lambda': 0.35000000000000003}. Best is trial 5 with value: 0.999717.[0m
[32m[I 2022-10-26 07:08:02,307][0m Trial 0 finished with value: 0.6950742018218817 and parameters: {'lgbm_num_leaves': 31, 'lgbm_learning_rate': 4.5722477111954274e-06, 'lgbm_n_estimators': 40, 'lgbm_reg_alpha': 0.35000000000000003, 'lgbm_reg_lambda': 0.8500000000000001}. Best is trial 5 with value: 0.999717.[0m
[32m[I 2022-10-26 07:08:14,508][0m Trial 4 finished with value: 0.9997938435260767 and parameters: {'lgbm_num_leaves': 127, 'lgbm_learning_rate': 0.036532275776038764, 'lgbm_n_estimators': 50, 'lgbm_reg_alpha': 0.55, 'lgbm_reg_lambda': 0.8500000000000001}. Best is trial 4 with value: 0.999794.[0m
[32m[I 2022-10-26 07:08:27,195][0m Trial 9 finished with value: 0.7931663874199881 and parameters: {'lgbm_num_leaves': 63, 'lgbm_learning_rate': 0.8820244145475787, 'lgbm_n_estimators': 20, 'lgbm_reg_alpha': 0.6000000000000001, 'lgbm_reg_lambda': 0.75}. Best is trial 4 with value: 0.999794.[0m
[32m[I 2022-10-26 07:08:31,536][0m Trial 10 finished with value: 0.6950742018218817 and parameters: {'lgbm_num_leaves': 15, 'lgbm_learning_rate': 0.003889416977419631, 'lgbm_n_estimators': 20, 'lgbm_reg_alpha': 0.05, 'lgbm_reg_lambda': 0.30000000000000004}. Best is trial 4 with value: 0.999794.[0m
[32m[I 2022-10-26 07:08:38,155][0m Trial 11 finished with value: 0.6950742018218817 and parameters: {'lgbm_num_leaves': 31, 'lgbm_learning_rate': 0.0001716290923351754, 'lgbm_n_estimators': 10, 'lgbm_reg_alpha': 0.75, 'lgbm_reg_lambda': 0.25}. Best is trial 4 with value: 0.999794.[0m
[32m[I 2022-10-26 07:08:56,382][0m Trial 7 finished with value: 0.9997192401553796 and parameters: {'lgbm_num_leaves': 63, 'lgbm_learning_rate': 0.021621941457841357, 'lgbm_n_estimators': 100, 'lgbm_reg_alpha': 0.9500000000000001, 'lgbm_reg_lambda': 0.30000000000000004}. Best is trial 4 with value: 0.999794.[0m
[32m[I 2022-10-26 07:09:04,793][0m Trial 8 finished with value: 0.9995947378168258 and parameters: {'lgbm_num_leaves': 63, 'lgbm_learning_rate': 0.014166097196598493, 'lgbm_n_estimators': 90, 'lgbm_reg_alpha': 0.2, 'lgbm_reg_lambda': 0.75}. Best is trial 4 with value: 0.999794.[0m
[32m[I 2022-10-26 07:09:06,337][0m Trial 2 finished with value: 0.6950742018218817 and parameters: {'lgbm_num_leaves': 63, 'lgbm_learning_rate': 8.095729481656856e-06, 'lgbm_n_estimators': 110, 'lgbm_reg_alpha': 0.35000000000000003, 'lgbm_reg_lambda': 0.35000000000000003}. Best is trial 4 with value: 0.999794.[0m
[32m[I 2022-10-26 07:09:08,325][0m Trial 6 finished with value: 0.6950742018218817 and parameters: {'lgbm_num_leaves': 7, 'lgbm_learning_rate': 5.6331982414224766e-05, 'lgbm_n_estimators': 150, 'lgbm_reg_alpha': 0.9, 'lgbm_reg_lambda': 0.7000000000000001}. Best is trial 4 with value: 0.999794.[0m
[32m[I 2022-10-26 07:09:11,238][0m Trial 12 finished with value: 0.6950742018218817 and parameters: {'lgbm_num_leaves': 63, 'lgbm_learning_rate': 9.033358193194246e-05, 'lgbm_n_estimators': 50, 'lgbm_reg_alpha': 0.1, 'lgbm_reg_lambda': 0.9}. Best is trial 4 with value: 0.999794.[0m
[32m[I 2022-10-26 07:09:14,998][0m Trial 1 finished with value: 0.6950742018218817 and parameters: {'lgbm_num_leaves': 31, 'lgbm_learning_rate': 4.108903626166509e-05, 'lgbm_n_estimators': 130, 'lgbm_reg_alpha': 0.1, 'lgbm_reg_lambda': 0.1}. Best is trial 4 with value: 0.999794.[0m
[32m[I 2022-10-26 07:09:26,844][0m Trial 13 finished with value: 0.7987480103979427 and parameters: {'lgbm_num_leaves': 127, 'lgbm_learning_rate': 0.550562690400756, 'lgbm_n_estimators': 50, 'lgbm_reg_alpha': 0.4, 'lgbm_reg_lambda': 0.25}. Best is trial 4 with value: 0.999794.[0m
[32m[I 2022-10-26 07:09:53,495][0m Trial 3 finished with value: 0.9998807020221441 and parameters: {'lgbm_num_leaves': 31, 'lgbm_learning_rate': 0.04692294633297889, 'lgbm_n_estimators': 170, 'lgbm_reg_alpha': 0.8500000000000001, 'lgbm_reg_lambda': 0.8}. Best is trial 3 with value: 0.999881.[0m
[32m[I 2022-10-26 07:10:18,009][0m Trial 14 finished with value: 0.6950742018218817 and parameters: {'lgbm_num_leaves': 127, 'lgbm_learning_rate': 1.171387966967971e-06, 'lgbm_n_estimators': 100, 'lgbm_reg_alpha': 1.0, 'lgbm_reg_lambda': 0.05}. Best is trial 3 with value: 0.999881.[0m
[32m[I 2022-10-26 07:10:33,039][0m Trial 18 finished with value: 0.9998211039921562 and parameters: {'lgbm_num_leaves': 127, 'lgbm_learning_rate': 0.07796340526913938, 'lgbm_n_estimators': 90, 'lgbm_reg_alpha': 1.0, 'lgbm_reg_lambda': 0.05}. Best is trial 3 with value: 0.999881.[0m
[32m[I 2022-10-26 07:10:40,759][0m Trial 15 finished with value: 0.9998856589641186 and parameters: {'lgbm_num_leaves': 63, 'lgbm_learning_rate': 0.17022956188990535, 'lgbm_n_estimators': 120, 'lgbm_reg_alpha': 0.4, 'lgbm_reg_lambda': 0.4}. Best is trial 15 with value: 0.999886.[0m
[32m[I 2022-10-26 07:10:41,149][0m Trial 16 finished with value: 0.9985524047277308 and parameters: {'lgbm_num_leaves': 7, 'lgbm_learning_rate': 0.03279425376696497, 'lgbm_n_estimators': 140, 'lgbm_reg_alpha': 0.9, 'lgbm_reg_lambda': 1.0}. Best is trial 15 with value: 0.999886.[0m
[32m[I 2022-10-26 07:11:33,272][0m Trial 19 finished with value: 0.9998931358343359 and parameters: {'lgbm_num_leaves': 127, 'lgbm_learning_rate': 0.08563337906297885, 'lgbm_n_estimators': 190, 'lgbm_reg_alpha': 1.0, 'lgbm_reg_lambda': 0.55}. Best is trial 19 with value: 0.999893.[0m
[32m[I 2022-10-26 07:11:59,573][0m Trial 20 finished with value: 0.9998906483916871 and parameters: {'lgbm_num_leaves': 127, 'lgbm_learning_rate': 0.03792981970656693, 'lgbm_n_estimators': 180, 'lgbm_reg_alpha': 1.0, 'lgbm_reg_lambda': 0.55}. Best is trial 19 with value: 0.999893.[0m
[32m[I 2022-10-26 07:12:15,126][0m Trial 17 finished with value: 0.8161013286794344 and parameters: {'lgbm_num_leaves': 127, 'lgbm_learning_rate': 0.8227122282578152, 'lgbm_n_estimators': 200, 'lgbm_reg_alpha': 0.6000000000000001, 'lgbm_reg_lambda': 1.0}. Best is trial 19 with value: 0.999893.[0m
[32m[I 2022-10-26 07:12:35,147][0m Trial 21 finished with value: 0.6958443348733063 and parameters: {'lgbm_num_leaves': 127, 'lgbm_learning_rate': 0.0015745225385443277, 'lgbm_n_estimators': 200, 'lgbm_reg_alpha': 0.75, 'lgbm_reg_lambda': 1.0}. Best is trial 19 with value: 0.999893.[0m
[32m[I 2022-10-26 07:12:36,233][0m Trial 23 finished with value: 0.6950742018218817 and parameters: {'lgbm_num_leaves': 7, 'lgbm_learning_rate': 0.0010939269518146844, 'lgbm_n_estimators': 200, 'lgbm_reg_alpha': 0.8, 'lgbm_reg_lambda': 0.55}. Best is trial 19 with value: 0.999893.[0m
[32m[I 2022-10-26 07:12:36,486][0m Trial 24 finished with value: 0.6950742018218817 and parameters: {'lgbm_num_leaves': 7, 'lgbm_learning_rate': 0.001739328299113802, 'lgbm_n_estimators': 190, 'lgbm_reg_alpha': 0.7000000000000001, 'lgbm_reg_lambda': 0.55}. Best is trial 19 with value: 0.999893.[0m
[32m[I 2022-10-26 07:12:40,753][0m Trial 22 finished with value: 0.9998881567188116 and parameters: {'lgbm_num_leaves': 127, 'lgbm_learning_rate': 0.11355299471296694, 'lgbm_n_estimators': 200, 'lgbm_reg_alpha': 0.65, 'lgbm_reg_lambda': 1.0}. Best is trial 19 with value: 0.999893.[0m
