[32m[I 2022-10-26 00:36:42,410][0m Trial 65 finished with value: 0.9946707997262204 and parameters: {'brf_n_estimators': 190, 'brf_criterion': 'gini', 'brf_min_samples_split': 10, 'brf_min_samples_leaf': 1, 'brf_max_features': 2, 'brf_bootstrap': False}. Best is trial 61 with value: 0.99683.[0m
[32m[I 2022-10-26 00:37:03,402][0m sklearn.ensemble.RandomForestClassifier.predict: fallback to original Scikit-learn[0m
[32m[I 2022-10-26 00:37:03,403][0m sklearn.ensemble.RandomForestClassifier.predict_proba: fallback to original Scikit-learn[0m
[32m[I 2022-10-26 00:37:25,831][0m Trial 68 finished with value: 0.9934134901412814 and parameters: {'brf_n_estimators': 120, 'brf_criterion': 'gini', 'brf_min_samples_split': 5, 'brf_min_samples_leaf': 3, 'brf_max_features': 2, 'brf_bootstrap': False}. Best is trial 61 with value: 0.99683.[0m
[32m[I 2022-10-26 00:37:26,002][0m sklearn.ensemble.RandomForestClassifier.predict: fallback to original Scikit-learn[0m
[32m[I 2022-10-26 00:37:26,100][0m sklearn.ensemble.RandomForestClassifier.predict_proba: fallback to original Scikit-learn[0m
[32m[I 2022-10-26 00:37:51,503][0m Trial 69 finished with value: 0.9934134901412814 and parameters: {'brf_n_estimators': 120, 'brf_criterion': 'gini', 'brf_min_samples_split': 4, 'brf_min_samples_leaf': 3, 'brf_max_features': 2, 'brf_bootstrap': False}. Best is trial 61 with value: 0.99683.[0m
[32m[I 2022-10-26 00:38:00,343][0m sklearn.ensemble.RandomForestClassifier.predict: fallback to original Scikit-learn[0m
[32m[I 2022-10-26 00:38:05,282][0m sklearn.ensemble.RandomForestClassifier.predict_proba: fallback to original Scikit-learn[0m
[32m[I 2022-10-26 00:38:39,518][0m Trial 67 finished with value: 0.9279028983084644 and parameters: {'brf_n_estimators': 190, 'brf_criterion': 'gini', 'brf_min_samples_split': 4, 'brf_min_samples_leaf': 30, 'brf_max_features': 2, 'brf_bootstrap': False}. Best is trial 61 with value: 0.99683.[0m
[32m[I 2022-10-26 00:39:16,526][0m sklearn.ensemble.RandomForestClassifier.predict: fallback to original Scikit-learn[0m
[32m[I 2022-10-26 00:39:16,527][0m sklearn.ensemble.RandomForestClassifier.predict_proba: fallback to original Scikit-learn[0m
[32m[I 2022-10-26 00:39:27,301][0m sklearn.ensemble.RandomForestClassifier.predict: fallback to original Scikit-learn[0m
[32m[I 2022-10-26 00:39:27,403][0m sklearn.ensemble.RandomForestClassifier.predict_proba: fallback to original Scikit-learn[0m
[32m[I 2022-10-26 00:39:37,874][0m sklearn.ensemble.RandomForestClassifier.predict: fallback to original Scikit-learn[0m
[32m[I 2022-10-26 00:39:37,876][0m sklearn.ensemble.RandomForestClassifier.predict_proba: fallback to original Scikit-learn[0m
[32m[I 2022-10-26 00:39:46,018][0m Trial 70 finished with value: 0.9592571329498054 and parameters: {'brf_n_estimators': 200, 'brf_criterion': 'gini', 'brf_min_samples_split': 4, 'brf_min_samples_leaf': 28, 'brf_max_features': 2, 'brf_bootstrap': False}. Best is trial 61 with value: 0.99683.[0m
[32m[I 2022-10-26 00:39:57,293][0m Trial 71 finished with value: 0.9930314386172474 and parameters: {'brf_n_estimators': 200, 'brf_criterion': 'gini', 'brf_min_samples_split': 4, 'brf_min_samples_leaf': 3, 'brf_max_features': 2, 'brf_bootstrap': False}. Best is trial 61 with value: 0.99683.[0m
[32m[I 2022-10-26 00:40:08,531][0m Trial 72 finished with value: 0.9930314386172474 and parameters: {'brf_n_estimators': 200, 'brf_criterion': 'gini', 'brf_min_samples_split': 4, 'brf_min_samples_leaf': 3, 'brf_max_features': 2, 'brf_bootstrap': False}. Best is trial 61 with value: 0.99683.[0m
[32m[I 2022-10-26 00:40:10,924][0m sklearn.ensemble.RandomForestClassifier.predict: fallback to original Scikit-learn[0m
[32m[I 2022-10-26 00:40:10,926][0m sklearn.ensemble.RandomForestClassifier.predict_proba: fallback to original Scikit-learn[0m
[32m[I 2022-10-26 00:40:25,363][0m sklearn.ensemble.RandomForestClassifier.predict: fallback to original Scikit-learn[0m
[32m[I 2022-10-26 00:40:25,364][0m sklearn.ensemble.RandomForestClassifier.predict_proba: fallback to original Scikit-learn[0m
[32m[I 2022-10-26 00:40:41,891][0m Trial 73 finished with value: 0.9930314386172474 and parameters: {'brf_n_estimators': 200, 'brf_criterion': 'gini', 'brf_min_samples_split': 3, 'brf_min_samples_leaf': 3, 'brf_max_features': 2, 'brf_bootstrap': False}. Best is trial 61 with value: 0.99683.[0m
[32m[I 2022-10-26 00:40:56,565][0m Trial 74 finished with value: 0.9930314386172474 and parameters: {'brf_n_estimators': 200, 'brf_criterion': 'gini', 'brf_min_samples_split': 5, 'brf_min_samples_leaf': 3, 'brf_max_features': 2, 'brf_bootstrap': False}. Best is trial 61 with value: 0.99683.[0m
[32m[I 2022-10-26 00:41:09,936][0m sklearn.ensemble.RandomForestClassifier.predict: fallback to original Scikit-learn[0m
[32m[I 2022-10-26 00:41:09,937][0m sklearn.ensemble.RandomForestClassifier.predict_proba: fallback to original Scikit-learn[0m
[32m[I 2022-10-26 00:41:33,634][0m sklearn.ensemble.RandomForestClassifier.predict: fallback to original Scikit-learn[0m
[32m[I 2022-10-26 00:41:33,636][0m sklearn.ensemble.RandomForestClassifier.predict_proba: fallback to original Scikit-learn[0m
[32m[I 2022-10-26 00:41:41,442][0m Trial 75 finished with value: 0.9930314386172474 and parameters: {'brf_n_estimators': 200, 'brf_criterion': 'gini', 'brf_min_samples_split': 2, 'brf_min_samples_leaf': 3, 'brf_max_features': 2, 'brf_bootstrap': False}. Best is trial 61 with value: 0.99683.[0m
[32m[I 2022-10-26 00:42:04,346][0m Trial 76 finished with value: 0.9930314386172474 and parameters: {'brf_n_estimators': 200, 'brf_criterion': 'gini', 'brf_min_samples_split': 3, 'brf_min_samples_leaf': 3, 'brf_max_features': 2, 'brf_bootstrap': False}. Best is trial 61 with value: 0.99683.[0m
[32m[I 2022-10-26 00:42:22,340][0m sklearn.ensemble.RandomForestClassifier.predict: fallback to original Scikit-learn[0m
[32m[I 2022-10-26 00:42:22,341][0m sklearn.ensemble.RandomForestClassifier.predict_proba: fallback to original Scikit-learn[0m
[32m[I 2022-10-26 00:42:53,710][0m Trial 77 finished with value: 0.9930314386172474 and parameters: {'brf_n_estimators': 200, 'brf_criterion': 'gini', 'brf_min_samples_split': 2, 'brf_min_samples_leaf': 3, 'brf_max_features': 2, 'brf_bootstrap': False}. Best is trial 61 with value: 0.99683.[0m
[32m[I 2022-10-26 00:43:02,198][0m sklearn.ensemble.RandomForestClassifier.predict: fallback to original Scikit-learn[0m
[32m[I 2022-10-26 00:43:02,200][0m sklearn.ensemble.RandomForestClassifier.predict_proba: fallback to original Scikit-learn[0m
[32m[I 2022-10-26 00:43:15,629][0m sklearn.ensemble.RandomForestClassifier.predict: fallback to original Scikit-learn[0m
[32m[I 2022-10-26 00:43:15,632][0m sklearn.ensemble.RandomForestClassifier.predict_proba: fallback to original Scikit-learn[0m
[32m[I 2022-10-26 00:43:17,694][0m sklearn.ensemble.RandomForestClassifier.predict: fallback to original Scikit-learn[0m
[32m[I 2022-10-26 00:43:17,699][0m sklearn.ensemble.RandomForestClassifier.predict_proba: fallback to original Scikit-learn[0m
[32m[I 2022-10-26 00:43:29,225][0m Trial 78 finished with value: 0.9930729247096299 and parameters: {'brf_n_estimators': 180, 'brf_criterion': 'gini', 'brf_min_samples_split': 2, 'brf_min_samples_leaf': 3, 'brf_max_features': 2, 'brf_bootstrap': False}. Best is trial 61 with value: 0.99683.[0m
[32m[I 2022-10-26 00:43:42,252][0m Trial 79 finished with value: 0.9897409411500854 and parameters: {'brf_n_estimators': 180, 'brf_criterion': 'gini', 'brf_min_samples_split': 2, 'brf_min_samples_leaf': 6, 'brf_max_features': 2, 'brf_bootstrap': False}. Best is trial 61 with value: 0.99683.[0m
[32m[I 2022-10-26 00:43:43,638][0m Trial 80 finished with value: 0.989714676066062 and parameters: {'brf_n_estimators': 170, 'brf_criterion': 'gini', 'brf_min_samples_split': 2, 'brf_min_samples_leaf': 6, 'brf_max_features': 2, 'brf_bootstrap': False}. Best is trial 61 with value: 0.99683.[0m
[32m[I 2022-10-26 00:44:12,285][0m sklearn.ensemble.RandomForestClassifier.predict: fallback to original Scikit-learn[0m
[32m[I 2022-10-26 00:44:12,360][0m sklearn.ensemble.RandomForestClassifier.predict_proba: fallback to original Scikit-learn[0m
[32m[I 2022-10-26 00:44:27,605][0m sklearn.ensemble.RandomForestClassifier.predict: fallback to original Scikit-learn[0m
[32m[I 2022-10-26 00:44:27,607][0m sklearn.ensemble.RandomForestClassifier.predict_proba: fallback to original Scikit-learn[0m
[32m[I 2022-10-26 00:44:42,786][0m Trial 81 finished with value: 0.9896328033520891 and parameters: {'brf_n_estimators': 190, 'brf_criterion': 'gini', 'brf_min_samples_split': 2, 'brf_min_samples_leaf': 6, 'brf_max_features': 2, 'brf_bootstrap': False}. Best is trial 61 with value: 0.99683.[0m
[32m[I 2022-10-26 00:44:54,749][0m sklearn.ensemble.RandomForestClassifier.predict: fallback to original Scikit-learn[0m
[32m[I 2022-10-26 00:44:54,755][0m sklearn.ensemble.RandomForestClassifier.predict_proba: fallback to original Scikit-learn[0m
[32m[I 2022-10-26 00:44:58,537][0m Trial 82 finished with value: 0.9896328033520891 and parameters: {'brf_n_estimators': 190, 'brf_criterion': 'gini', 'brf_min_samples_split': 2, 'brf_min_samples_leaf': 6, 'brf_max_features': 2, 'brf_bootstrap': False}. Best is trial 61 with value: 0.99683.[0m
[32m[I 2022-10-26 00:45:18,086][0m sklearn.ensemble.RandomForestClassifier.predict: fallback to original Scikit-learn[0m
[32m[I 2022-10-26 00:45:18,087][0m sklearn.ensemble.RandomForestClassifier.predict_proba: fallback to original Scikit-learn[0m
[32m[I 2022-10-26 00:45:23,902][0m Trial 83 finished with value: 0.9897409411500854 and parameters: {'brf_n_estimators': 180, 'brf_criterion': 'gini', 'brf_min_samples_split': 10, 'brf_min_samples_leaf': 6, 'brf_max_features': 2, 'brf_bootstrap': False}. Best is trial 61 with value: 0.99683.[0m
[32m[I 2022-10-26 00:45:47,062][0m Trial 84 finished with value: 0.9890387821100267 and parameters: {'brf_n_estimators': 180, 'brf_criterion': 'gini', 'brf_min_samples_split': 10, 'brf_min_samples_leaf': 7, 'brf_max_features': 2, 'brf_bootstrap': False}. Best is trial 61 with value: 0.99683.[0m
[32m[I 2022-10-26 00:46:01,714][0m sklearn.ensemble.RandomForestClassifier.predict: fallback to original Scikit-learn[0m
[32m[I 2022-10-26 00:46:01,716][0m sklearn.ensemble.RandomForestClassifier.predict_proba: fallback to original Scikit-learn[0m
[32m[I 2022-10-26 00:46:30,101][0m Trial 85 finished with value: 0.9897409411500854 and parameters: {'brf_n_estimators': 180, 'brf_criterion': 'gini', 'brf_min_samples_split': 10, 'brf_min_samples_leaf': 6, 'brf_max_features': 2, 'brf_bootstrap': False}. Best is trial 61 with value: 0.99683.[0m
[32m[I 2022-10-26 00:46:52,642][0m sklearn.ensemble.RandomForestClassifier.predict: fallback to original Scikit-learn[0m
[32m[I 2022-10-26 00:46:52,643][0m sklearn.ensemble.RandomForestClassifier.predict_proba: fallback to original Scikit-learn[0m
[32m[I 2022-10-26 00:47:10,469][0m sklearn.ensemble.RandomForestClassifier.predict: fallback to original Scikit-learn[0m
[32m[I 2022-10-26 00:47:10,470][0m sklearn.ensemble.RandomForestClassifier.predict_proba: fallback to original Scikit-learn[0m
[32m[I 2022-10-26 00:47:12,431][0m sklearn.ensemble.RandomForestClassifier.predict: fallback to original Scikit-learn[0m
[32m[I 2022-10-26 00:47:12,434][0m sklearn.ensemble.RandomForestClassifier.predict_proba: fallback to original Scikit-learn[0m
[32m[I 2022-10-26 00:47:14,188][0m sklearn.ensemble.RandomForestClassifier.predict: fallback to original Scikit-learn[0m
[32m[I 2022-10-26 00:47:14,194][0m sklearn.ensemble.RandomForestClassifier.predict_proba: fallback to original Scikit-learn[0m
[32m[I 2022-10-26 00:47:21,490][0m Trial 86 finished with value: 0.9890412783539009 and parameters: {'brf_n_estimators': 190, 'brf_criterion': 'gini', 'brf_min_samples_split': 6, 'brf_min_samples_leaf': 7, 'brf_max_features': 2, 'brf_bootstrap': False}. Best is trial 61 with value: 0.99683.[0m
[32m[I 2022-10-26 00:47:28,352][0m sklearn.ensemble.RandomForestClassifier.predict: fallback to original Scikit-learn[0m
[32m[I 2022-10-26 00:47:28,354][0m sklearn.ensemble.RandomForestClassifier.predict_proba: fallback to original Scikit-learn[0m
[32m[I 2022-10-26 00:47:34,606][0m Trial 89 finished with value: 0.9977272169578493 and parameters: {'brf_n_estimators': 140, 'brf_criterion': 'gini', 'brf_min_samples_split': 10, 'brf_min_samples_leaf': 1, 'brf_max_features': 6, 'brf_bootstrap': False}. Best is trial 89 with value: 0.997727.[0m
[32m[I 2022-10-26 00:47:37,293][0m Trial 87 finished with value: 0.9926199129269712 and parameters: {'brf_n_estimators': 190, 'brf_criterion': 'gini', 'brf_min_samples_split': 10, 'brf_min_samples_leaf': 7, 'brf_max_features': 6, 'brf_bootstrap': False}. Best is trial 89 with value: 0.997727.[0m
[32m[I 2022-10-26 00:47:40,347][0m Trial 88 finished with value: 0.9946707997262204 and parameters: {'brf_n_estimators': 190, 'brf_criterion': 'gini', 'brf_min_samples_split': 10, 'brf_min_samples_leaf': 1, 'brf_max_features': 2, 'brf_bootstrap': False}. Best is trial 89 with value: 0.997727.[0m
[32m[I 2022-10-26 00:47:48,991][0m sklearn.ensemble.RandomForestClassifier.predict: fallback to original Scikit-learn[0m
[32m[I 2022-10-26 00:47:48,992][0m sklearn.ensemble.RandomForestClassifier.predict_proba: fallback to original Scikit-learn[0m
[32m[I 2022-10-26 00:47:49,238][0m Trial 90 finished with value: 0.9956181989304385 and parameters: {'brf_n_estimators': 140, 'brf_criterion': 'gini', 'brf_min_samples_split': 10, 'brf_min_samples_leaf': 1, 'brf_max_features': 5, 'brf_bootstrap': False}. Best is trial 89 with value: 0.997727.[0m
[32m[I 2022-10-26 00:48:10,018][0m sklearn.ensemble.RandomForestClassifier.predict: fallback to original Scikit-learn[0m
[32m[I 2022-10-26 00:48:10,020][0m sklearn.ensemble.RandomForestClassifier.predict_proba: fallback to original Scikit-learn[0m
[32m[I 2022-10-26 00:48:12,029][0m Trial 91 finished with value: 0.9976462228552209 and parameters: {'brf_n_estimators': 140, 'brf_criterion': 'gini', 'brf_min_samples_split': 6, 'brf_min_samples_leaf': 1, 'brf_max_features': 5, 'brf_bootstrap': False}. Best is trial 89 with value: 0.997727.[0m
[32m[I 2022-10-26 00:48:35,897][0m Trial 92 finished with value: 0.9968355829436829 and parameters: {'brf_n_estimators': 140, 'brf_criterion': 'gini', 'brf_min_samples_split': 6, 'brf_min_samples_leaf': 1, 'brf_max_features': 2, 'brf_bootstrap': False}. Best is trial 89 with value: 0.997727.[0m
[32m[I 2022-10-26 00:48:52,262][0m sklearn.ensemble.RandomForestClassifier.predict: fallback to original Scikit-learn[0m
[32m[I 2022-10-26 00:48:52,263][0m sklearn.ensemble.RandomForestClassifier.predict_proba: fallback to original Scikit-learn[0m
[32m[I 2022-10-26 00:49:13,206][0m Trial 93 finished with value: 0.9971036799031364 and parameters: {'brf_n_estimators': 140, 'brf_criterion': 'gini', 'brf_min_samples_split': 6, 'brf_min_samples_leaf': 1, 'brf_max_features': 3, 'brf_bootstrap': False}. Best is trial 89 with value: 0.997727.[0m
[32m[I 2022-10-26 00:49:47,830][0m sklearn.ensemble.RandomForestClassifier.predict: fallback to original Scikit-learn[0m
[32m[I 2022-10-26 00:49:47,830][0m sklearn.ensemble.RandomForestClassifier.predict_proba: fallback to original Scikit-learn[0m
[32m[I 2022-10-26 00:49:53,548][0m sklearn.ensemble.RandomForestClassifier.predict: fallback to original Scikit-learn[0m
[32m[I 2022-10-26 00:49:53,549][0m sklearn.ensemble.RandomForestClassifier.predict_proba: fallback to original Scikit-learn[0m
[32m[I 2022-10-26 00:49:53,555][0m sklearn.ensemble.RandomForestClassifier.predict: fallback to original Scikit-learn[0m
[32m[I 2022-10-26 00:49:53,558][0m sklearn.ensemble.RandomForestClassifier.predict_proba: fallback to original Scikit-learn[0m
[32m[I 2022-10-26 00:49:56,781][0m sklearn.ensemble.RandomForestClassifier.predict: fallback to original Scikit-learn[0m
[32m[I 2022-10-26 00:49:56,782][0m sklearn.ensemble.RandomForestClassifier.predict_proba: fallback to original Scikit-learn[0m
[32m[I 2022-10-26 00:49:59,544][0m sklearn.ensemble.RandomForestClassifier.predict: fallback to original Scikit-learn[0m
[32m[I 2022-10-26 00:49:59,545][0m sklearn.ensemble.RandomForestClassifier.predict_proba: fallback to original Scikit-learn[0m
[32m[I 2022-10-26 00:50:02,589][0m Trial 94 finished with value: 0.9976547391105676 and parameters: {'brf_n_estimators': 150, 'brf_criterion': 'gini', 'brf_min_samples_split': 6, 'brf_min_samples_leaf': 1, 'brf_max_features': 6, 'brf_bootstrap': False}. Best is trial 89 with value: 0.997727.[0m
[32m[I 2022-10-26 00:50:05,311][0m Trial 96 finished with value: 0.9976138847649425 and parameters: {'brf_n_estimators': 140, 'brf_criterion': 'gini', 'brf_min_samples_split': 5, 'brf_min_samples_leaf': 1, 'brf_max_features': 5, 'brf_bootstrap': False}. Best is trial 89 with value: 0.997727.[0m
[32m[I 2022-10-26 00:50:05,312][0m Trial 95 finished with value: 0.9977169309101719 and parameters: {'brf_n_estimators': 140, 'brf_criterion': 'gini', 'brf_min_samples_split': 6, 'brf_min_samples_leaf': 1, 'brf_max_features': 6, 'brf_bootstrap': False}. Best is trial 89 with value: 0.997727.[0m
[32m[I 2022-10-26 00:50:06,925][0m Trial 97 finished with value: 0.9972521626088137 and parameters: {'brf_n_estimators': 140, 'brf_criterion': 'gini', 'brf_min_samples_split': 6, 'brf_min_samples_leaf': 1, 'brf_max_features': 7, 'brf_bootstrap': False}. Best is trial 89 with value: 0.997727.[0m
[32m[I 2022-10-26 00:50:07,994][0m sklearn.ensemble.RandomForestClassifier.predict: fallback to original Scikit-learn[0m
[32m[I 2022-10-26 00:50:07,994][0m sklearn.ensemble.RandomForestClassifier.predict_proba: fallback to original Scikit-learn[0m
[32m[I 2022-10-26 00:50:08,493][0m Trial 98 finished with value: 0.9976462228552209 and parameters: {'brf_n_estimators': 140, 'brf_criterion': 'gini', 'brf_min_samples_split': 6, 'brf_min_samples_leaf': 1, 'brf_max_features': 5, 'brf_bootstrap': False}. Best is trial 89 with value: 0.997727.[0m
[32m[I 2022-10-26 00:50:12,573][0m Trial 99 finished with value: 0.99698626504778 and parameters: {'brf_n_estimators': 140, 'brf_criterion': 'gini', 'brf_min_samples_split': 6, 'brf_min_samples_leaf': 2, 'brf_max_features': 5, 'brf_bootstrap': False}. Best is trial 89 with value: 0.997727.[0m
[32m[I 2022-10-26 00:50:12,637][0m Study finished.[0m
[32m[I 2022-10-26 00:50:12,658][0m --------------------------------------------------------------------------------[0m
[32m[I 2022-10-26 00:50:12,659][0m --------------------              BernoulliNB               --------------------[0m
[32m[I 2022-10-26 00:50:12,660][0m --------------------------------------------------------------------------------[0m
[32m[I 2022-10-26 00:50:12,700][0m A new study created in RDB with name: BernoulliNB_c963b74b[0m
[32m[I 2022-10-26 00:50:12,707][0m Study started.[0m
[32m[I 2022-10-26 00:50:15,169][0m Trial 5 finished with value: 0.6950742018218817 and parameters: {'bnb_alpha': 0.0, 'bnb_binarize': 0.15000000000000002, 'bnb_fit_prior': False}. Best is trial 2 with value: 0.818939.[0m
[32m[I 2022-10-26 00:50:15,170][0m Trial 1 finished with value: 0.07429784596598596 and parameters: {'bnb_alpha': 0.8500000000000001, 'bnb_binarize': 0.9, 'bnb_fit_prior': False}. Best is trial 0 with value: 0.818939.[0m
[32m[I 2022-10-26 00:50:15,170][0m Trial 3 finished with value: 0.7323259635510226 and parameters: {'bnb_alpha': 0.45, 'bnb_binarize': 0.05, 'bnb_fit_prior': True}. Best is trial 0 with value: 0.818939.[0m
[32m[I 2022-10-26 00:50:15,173][0m Trial 2 finished with value: 0.7323259635510226 and parameters: {'bnb_alpha': 1.0, 'bnb_binarize': 0.75, 'bnb_fit_prior': True}. Best is trial 0 with value: 0.818939.[0m
[32m[I 2022-10-26 00:50:15,310][0m Trial 0 finished with value: 0.8189394612083668 and parameters: {'bnb_alpha': 0.05, 'bnb_binarize': 1.0, 'bnb_fit_prior': True}. Best is trial 0 with value: 0.818939.[0m
[32m[I 2022-10-26 00:50:15,368][0m Trial 7 finished with value: 0.07430793772171441 and parameters: {'bnb_alpha': 0.30000000000000004, 'bnb_binarize': 0.4, 'bnb_fit_prior': False}. Best is trial 0 with value: 0.818939.[0m
[32m[I 2022-10-26 00:50:15,371][0m Trial 6 finished with value: 0.07431092717465383 and parameters: {'bnb_alpha': 0.55, 'bnb_binarize': 0.8, 'bnb_fit_prior': False}. Best is trial 0 with value: 0.818939.[0m
[32m[I 2022-10-26 00:50:15,495][0m Trial 4 finished with value: 0.7323259635510226 and parameters: {'bnb_alpha': 0.8, 'bnb_binarize': 0.4, 'bnb_fit_prior': True}. Best is trial 0 with value: 0.818939.[0m
[32m[I 2022-10-26 00:50:18,147][0m Trial 8 finished with value: 0.6950742018218817 and parameters: {'bnb_alpha': 0.0, 'bnb_binarize': 0.35000000000000003, 'bnb_fit_prior': True}. Best is trial 0 with value: 0.818939.[0m
[32m[I 2022-10-26 00:50:18,230][0m Trial 9 finished with value: 0.7323259635510226 and parameters: {'bnb_alpha': 0.2, 'bnb_binarize': 0.05, 'bnb_fit_prior': True}. Best is trial 0 with value: 0.818939.[0m
[32m[I 2022-10-26 00:50:18,233][0m Trial 14 finished with value: 0.074334981788516 and parameters: {'bnb_alpha': 0.05, 'bnb_binarize': 0.55, 'bnb_fit_prior': False}. Best is trial 0 with value: 0.818939.[0m
[32m[I 2022-10-26 00:50:18,298][0m Trial 13 finished with value: 0.07430793772171441 and parameters: {'bnb_alpha': 0.30000000000000004, 'bnb_binarize': 0.75, 'bnb_fit_prior': False}. Best is trial 0 with value: 0.818939.[0m
[32m[I 2022-10-26 00:50:18,301][0m Trial 15 finished with value: 0.07429784596598596 and parameters: {'bnb_alpha': 0.8, 'bnb_binarize': 0.25, 'bnb_fit_prior': False}. Best is trial 0 with value: 0.818939.[0m
