[32m[I 2022-10-26 07:33:33,250][0m Trial 99 finished with value: 0.7077867894758822 and parameters: {'lda_solver': 'eigen', 'lda_n_components': 4, 'lda_tol': 0.001}. Best is trial 0 with value: 0.707787.[0m
[32m[I 2022-10-26 07:33:33,314][0m Study finished.[0m
[32m[I 2022-10-26 07:33:33,327][0m --------------------------------------------------------------------------------[0m
[32m[I 2022-10-26 07:33:33,328][0m --------------------               LinearSVC                --------------------[0m
[32m[I 2022-10-26 07:33:33,329][0m --------------------------------------------------------------------------------[0m
[32m[I 2022-10-26 07:33:33,354][0m A new study created in RDB with name: LinearSVC_c963b74b[0m
[32m[I 2022-10-26 07:33:33,361][0m Study started.[0m
[32m[I 2022-10-26 07:33:35,356][0m Trial 0 finished with value: 0.6951098341920565 and parameters: {'lsvc_dual': False, 'lsvc_C': 208.0961967348006, 'lsvc_max_iter': 2000}. Best is trial 0 with value: 0.69511.[0m
[32m[I 2022-10-26 07:33:37,414][0m Trial 1 finished with value: 0.6951098341920565 and parameters: {'lsvc_dual': False, 'lsvc_C': 0.09636730379197346, 'lsvc_max_iter': 2000}. Best is trial 0 with value: 0.69511.[0m
[32m[I 2022-10-26 07:33:39,476][0m Trial 2 finished with value: 0.6951098341920565 and parameters: {'lsvc_dual': False, 'lsvc_C': 0.016760644610098477, 'lsvc_max_iter': 2000}. Best is trial 0 with value: 0.69511.[0m
[32m[I 2022-10-26 07:33:41,548][0m Trial 3 finished with value: 0.6951098341920565 and parameters: {'lsvc_dual': False, 'lsvc_C': 62.29681162163499, 'lsvc_max_iter': 2000}. Best is trial 0 with value: 0.69511.[0m
[32m[I 2022-10-26 07:33:43,611][0m Trial 4 finished with value: 0.6951098341920565 and parameters: {'lsvc_dual': False, 'lsvc_C': 0.010741860970938412, 'lsvc_max_iter': 2000}. Best is trial 0 with value: 0.69511.[0m
[32m[I 2022-10-26 07:33:45,713][0m Trial 5 finished with value: 0.6951098341920565 and parameters: {'lsvc_dual': False, 'lsvc_C': 1.8262176671391193e-05, 'lsvc_max_iter': 2000}. Best is trial 0 with value: 0.69511.[0m
[32m[I 2022-10-26 07:33:47,778][0m Trial 6 finished with value: 0.6951098341920565 and parameters: {'lsvc_dual': False, 'lsvc_C': 0.0072169580053589215, 'lsvc_max_iter': 2000}. Best is trial 0 with value: 0.69511.[0m
[32m[I 2022-10-26 07:33:49,830][0m Trial 7 finished with value: 0.6951098341920565 and parameters: {'lsvc_dual': False, 'lsvc_C': 2.8469952411082144e-06, 'lsvc_max_iter': 2000}. Best is trial 0 with value: 0.69511.[0m
[32m[I 2022-10-26 07:33:51,877][0m Trial 8 finished with value: 0.6951098341920565 and parameters: {'lsvc_dual': False, 'lsvc_C': 3.6794447395527086e-05, 'lsvc_max_iter': 2000}. Best is trial 0 with value: 0.69511.[0m
[32m[I 2022-10-26 07:33:53,946][0m Trial 9 finished with value: 0.6951098341920565 and parameters: {'lsvc_dual': False, 'lsvc_C': 2.855176722071589e-06, 'lsvc_max_iter': 2000}. Best is trial 0 with value: 0.69511.[0m
[32m[I 2022-10-26 07:33:56,002][0m Trial 10 finished with value: 0.6951098341920565 and parameters: {'lsvc_dual': False, 'lsvc_C': 140.21742883184592, 'lsvc_max_iter': 2000}. Best is trial 0 with value: 0.69511.[0m
[32m[I 2022-10-26 07:33:58,064][0m Trial 11 finished with value: 0.6951098341920565 and parameters: {'lsvc_dual': False, 'lsvc_C': 1.8817335182240031, 'lsvc_max_iter': 2000}. Best is trial 0 with value: 0.69511.[0m
[32m[I 2022-10-26 07:34:00,132][0m Trial 12 finished with value: 0.6951098341920565 and parameters: {'lsvc_dual': False, 'lsvc_C': 3.205416633397708, 'lsvc_max_iter': 2000}. Best is trial 0 with value: 0.69511.[0m
[32m[I 2022-10-26 07:34:02,187][0m Trial 13 finished with value: 0.6951098341920565 and parameters: {'lsvc_dual': False, 'lsvc_C': 0.6507802551367634, 'lsvc_max_iter': 2000}. Best is trial 0 with value: 0.69511.[0m
[32m[I 2022-10-26 07:34:04,238][0m Trial 14 finished with value: 0.6951098341920565 and parameters: {'lsvc_dual': False, 'lsvc_C': 663.4768766149556, 'lsvc_max_iter': 2000}. Best is trial 0 with value: 0.69511.[0m
[32m[I 2022-10-26 07:34:06,305][0m Trial 15 finished with value: 0.6951098341920565 and parameters: {'lsvc_dual': False, 'lsvc_C': 0.0005702060737934793, 'lsvc_max_iter': 2000}. Best is trial 0 with value: 0.69511.[0m
[32m[I 2022-10-26 07:34:08,363][0m Trial 16 finished with value: 0.6951098341920565 and parameters: {'lsvc_dual': False, 'lsvc_C': 0.23001609283501528, 'lsvc_max_iter': 2000}. Best is trial 0 with value: 0.69511.[0m
[32m[I 2022-10-26 07:34:10,421][0m Trial 17 finished with value: 0.6951098341920565 and parameters: {'lsvc_dual': False, 'lsvc_C': 648.2425542481393, 'lsvc_max_iter': 2000}. Best is trial 0 with value: 0.69511.[0m
[32m[I 2022-10-26 07:34:12,495][0m Trial 18 finished with value: 0.6951098341920565 and parameters: {'lsvc_dual': False, 'lsvc_C': 6.201227754991026e-05, 'lsvc_max_iter': 2000}. Best is trial 0 with value: 0.69511.[0m
[32m[I 2022-10-26 07:34:14,536][0m Trial 19 finished with value: 0.6951098341920565 and parameters: {'lsvc_dual': False, 'lsvc_C': 12.35189147103352, 'lsvc_max_iter': 2000}. Best is trial 0 with value: 0.69511.[0m
[32m[I 2022-10-26 07:34:16,603][0m Trial 20 finished with value: 0.6951098341920565 and parameters: {'lsvc_dual': False, 'lsvc_C': 540.1578295338825, 'lsvc_max_iter': 2000}. Best is trial 0 with value: 0.69511.[0m
[32m[I 2022-10-26 07:34:18,675][0m Trial 21 finished with value: 0.6951098341920565 and parameters: {'lsvc_dual': False, 'lsvc_C': 0.000758211234686707, 'lsvc_max_iter': 2000}. Best is trial 0 with value: 0.69511.[0m
[32m[I 2022-10-26 07:34:20,769][0m Trial 22 finished with value: 0.6951098341920565 and parameters: {'lsvc_dual': False, 'lsvc_C': 12.998474817804766, 'lsvc_max_iter': 2000}. Best is trial 0 with value: 0.69511.[0m
[32m[I 2022-10-26 07:34:22,825][0m Trial 23 finished with value: 0.6951098341920565 and parameters: {'lsvc_dual': False, 'lsvc_C': 27.715858113119353, 'lsvc_max_iter': 2000}. Best is trial 0 with value: 0.69511.[0m
[32m[I 2022-10-26 07:34:24,876][0m Trial 24 finished with value: 0.6951098341920565 and parameters: {'lsvc_dual': False, 'lsvc_C': 0.0010720887282597454, 'lsvc_max_iter': 2000}. Best is trial 0 with value: 0.69511.[0m
[32m[I 2022-10-26 07:34:26,939][0m Trial 25 finished with value: 0.6951098341920565 and parameters: {'lsvc_dual': False, 'lsvc_C': 0.001117874395156805, 'lsvc_max_iter': 2000}. Best is trial 0 with value: 0.69511.[0m
[32m[I 2022-10-26 07:34:29,000][0m Trial 26 finished with value: 0.6951098341920565 and parameters: {'lsvc_dual': False, 'lsvc_C': 37.90113936998011, 'lsvc_max_iter': 2000}. Best is trial 0 with value: 0.69511.[0m
[32m[I 2022-10-26 07:34:31,068][0m Trial 27 finished with value: 0.6951098341920565 and parameters: {'lsvc_dual': False, 'lsvc_C': 6.572896249748327, 'lsvc_max_iter': 2000}. Best is trial 0 with value: 0.69511.[0m
[32m[I 2022-10-26 07:34:33,144][0m Trial 28 finished with value: 0.6951098341920565 and parameters: {'lsvc_dual': False, 'lsvc_C': 0.0016375518310120338, 'lsvc_max_iter': 2000}. Best is trial 0 with value: 0.69511.[0m
[32m[I 2022-10-26 07:34:35,202][0m Trial 29 finished with value: 0.6951098341920565 and parameters: {'lsvc_dual': False, 'lsvc_C': 0.06713191765428858, 'lsvc_max_iter': 2000}. Best is trial 0 with value: 0.69511.[0m
[32m[I 2022-10-26 07:34:37,259][0m Trial 30 finished with value: 0.6951098341920565 and parameters: {'lsvc_dual': False, 'lsvc_C': 144.07840661910387, 'lsvc_max_iter': 2000}. Best is trial 0 with value: 0.69511.[0m
[32m[I 2022-10-26 07:34:39,313][0m Trial 31 finished with value: 0.6951098341920565 and parameters: {'lsvc_dual': False, 'lsvc_C': 3.7027011399646543, 'lsvc_max_iter': 2000}. Best is trial 0 with value: 0.69511.[0m
[32m[I 2022-10-26 07:34:41,384][0m Trial 32 finished with value: 0.6951098341920565 and parameters: {'lsvc_dual': False, 'lsvc_C': 0.09694293242521838, 'lsvc_max_iter': 2000}. Best is trial 0 with value: 0.69511.[0m
[32m[I 2022-10-26 07:34:43,450][0m Trial 33 finished with value: 0.6951098341920565 and parameters: {'lsvc_dual': False, 'lsvc_C': 134.98275982392786, 'lsvc_max_iter': 2000}. Best is trial 0 with value: 0.69511.[0m
[32m[I 2022-10-26 07:34:45,513][0m Trial 34 finished with value: 0.6951098341920565 and parameters: {'lsvc_dual': False, 'lsvc_C': 0.89306921052691, 'lsvc_max_iter': 2000}. Best is trial 0 with value: 0.69511.[0m
[32m[I 2022-10-26 07:34:47,565][0m Trial 35 finished with value: 0.6951098341920565 and parameters: {'lsvc_dual': False, 'lsvc_C': 953.0207755894241, 'lsvc_max_iter': 2000}. Best is trial 0 with value: 0.69511.[0m
[32m[I 2022-10-26 07:34:49,621][0m Trial 36 finished with value: 0.6951098341920565 and parameters: {'lsvc_dual': False, 'lsvc_C': 0.000179632904394351, 'lsvc_max_iter': 2000}. Best is trial 0 with value: 0.69511.[0m
[32m[I 2022-10-26 07:34:51,716][0m Trial 37 finished with value: 0.6951098341920565 and parameters: {'lsvc_dual': False, 'lsvc_C': 269.50967578498495, 'lsvc_max_iter': 2000}. Best is trial 0 with value: 0.69511.[0m
[32m[I 2022-10-26 07:34:53,801][0m Trial 38 finished with value: 0.6951098341920565 and parameters: {'lsvc_dual': False, 'lsvc_C': 25.9056131042392, 'lsvc_max_iter': 2000}. Best is trial 0 with value: 0.69511.[0m
[32m[I 2022-10-26 07:34:55,844][0m Trial 39 finished with value: 0.6951098341920565 and parameters: {'lsvc_dual': False, 'lsvc_C': 0.009614657030444763, 'lsvc_max_iter': 2000}. Best is trial 0 with value: 0.69511.[0m
[32m[I 2022-10-26 07:34:57,895][0m Trial 40 finished with value: 0.6951098341920565 and parameters: {'lsvc_dual': False, 'lsvc_C': 54.220995215763885, 'lsvc_max_iter': 2000}. Best is trial 0 with value: 0.69511.[0m
[32m[I 2022-10-26 07:34:59,939][0m Trial 41 finished with value: 0.6951098341920565 and parameters: {'lsvc_dual': False, 'lsvc_C': 0.005888341398135168, 'lsvc_max_iter': 2000}. Best is trial 0 with value: 0.69511.[0m
[32m[I 2022-10-26 07:35:02,001][0m Trial 42 finished with value: 0.6951098341920565 and parameters: {'lsvc_dual': False, 'lsvc_C': 41.67486969525821, 'lsvc_max_iter': 2000}. Best is trial 0 with value: 0.69511.[0m
[32m[I 2022-10-26 07:35:04,044][0m Trial 43 finished with value: 0.6951098341920565 and parameters: {'lsvc_dual': False, 'lsvc_C': 9.5741591505911e-06, 'lsvc_max_iter': 2000}. Best is trial 0 with value: 0.69511.[0m
[32m[I 2022-10-26 07:35:06,113][0m Trial 44 finished with value: 0.6951098341920565 and parameters: {'lsvc_dual': False, 'lsvc_C': 0.0019622777102205817, 'lsvc_max_iter': 2000}. Best is trial 0 with value: 0.69511.[0m
[32m[I 2022-10-26 07:35:08,186][0m Trial 45 finished with value: 0.6951098341920565 and parameters: {'lsvc_dual': False, 'lsvc_C': 0.0332525447108333, 'lsvc_max_iter': 2000}. Best is trial 0 with value: 0.69511.[0m
[32m[I 2022-10-26 07:35:10,249][0m Trial 46 finished with value: 0.6951098341920565 and parameters: {'lsvc_dual': False, 'lsvc_C': 0.0029093939060116075, 'lsvc_max_iter': 2000}. Best is trial 0 with value: 0.69511.[0m
[32m[I 2022-10-26 07:35:12,307][0m Trial 47 finished with value: 0.6951098341920565 and parameters: {'lsvc_dual': False, 'lsvc_C': 0.0002164502098646602, 'lsvc_max_iter': 2000}. Best is trial 0 with value: 0.69511.[0m
[32m[I 2022-10-26 07:35:14,377][0m Trial 48 finished with value: 0.6951098341920565 and parameters: {'lsvc_dual': False, 'lsvc_C': 0.025495343340913468, 'lsvc_max_iter': 2000}. Best is trial 0 with value: 0.69511.[0m
[32m[I 2022-10-26 07:35:16,448][0m Trial 49 finished with value: 0.6951098341920565 and parameters: {'lsvc_dual': False, 'lsvc_C': 9.73593205594959, 'lsvc_max_iter': 2000}. Best is trial 0 with value: 0.69511.[0m
[32m[I 2022-10-26 07:35:18,529][0m Trial 50 finished with value: 0.6951098341920565 and parameters: {'lsvc_dual': False, 'lsvc_C': 0.24781893555911605, 'lsvc_max_iter': 2000}. Best is trial 0 with value: 0.69511.[0m
[32m[I 2022-10-26 07:35:20,577][0m Trial 51 finished with value: 0.6951098341920565 and parameters: {'lsvc_dual': False, 'lsvc_C': 5.223874557805146, 'lsvc_max_iter': 2000}. Best is trial 0 with value: 0.69511.[0m
[32m[I 2022-10-26 07:35:22,657][0m Trial 52 finished with value: 0.6951098341920565 and parameters: {'lsvc_dual': False, 'lsvc_C': 0.044314747495074414, 'lsvc_max_iter': 2000}. Best is trial 0 with value: 0.69511.[0m
[32m[I 2022-10-26 07:35:24,728][0m Trial 53 finished with value: 0.6951098341920565 and parameters: {'lsvc_dual': False, 'lsvc_C': 0.08035677137490542, 'lsvc_max_iter': 2000}. Best is trial 0 with value: 0.69511.[0m
[32m[I 2022-10-26 07:35:26,824][0m Trial 54 finished with value: 0.6951098341920565 and parameters: {'lsvc_dual': False, 'lsvc_C': 130.03067968024212, 'lsvc_max_iter': 2000}. Best is trial 0 with value: 0.69511.[0m
[32m[I 2022-10-26 07:35:28,872][0m Trial 55 finished with value: 0.6951098341920565 and parameters: {'lsvc_dual': False, 'lsvc_C': 120.4405566822122, 'lsvc_max_iter': 2000}. Best is trial 0 with value: 0.69511.[0m
[32m[I 2022-10-26 07:35:30,959][0m Trial 56 finished with value: 0.6951098341920565 and parameters: {'lsvc_dual': False, 'lsvc_C': 0.4973975097089489, 'lsvc_max_iter': 2000}. Best is trial 0 with value: 0.69511.[0m
[32m[I 2022-10-26 07:35:33,006][0m Trial 57 finished with value: 0.6951098341920565 and parameters: {'lsvc_dual': False, 'lsvc_C': 1.9189093021172932, 'lsvc_max_iter': 2000}. Best is trial 0 with value: 0.69511.[0m
[32m[I 2022-10-26 07:35:35,091][0m Trial 58 finished with value: 0.6951098341920565 and parameters: {'lsvc_dual': False, 'lsvc_C': 284.4762129954892, 'lsvc_max_iter': 2000}. Best is trial 0 with value: 0.69511.[0m
[32m[I 2022-10-26 07:35:37,307][0m Trial 59 finished with value: 0.6951098341920565 and parameters: {'lsvc_dual': False, 'lsvc_C': 1.2952807049372046, 'lsvc_max_iter': 2000}. Best is trial 0 with value: 0.69511.[0m
[32m[I 2022-10-26 07:35:39,364][0m Trial 60 finished with value: 0.6951098341920565 and parameters: {'lsvc_dual': False, 'lsvc_C': 972.2517954928859, 'lsvc_max_iter': 2000}. Best is trial 0 with value: 0.69511.[0m
[32m[I 2022-10-26 07:35:41,453][0m Trial 61 finished with value: 0.6951098341920565 and parameters: {'lsvc_dual': False, 'lsvc_C': 260.94027063296846, 'lsvc_max_iter': 2000}. Best is trial 0 with value: 0.69511.[0m
[32m[I 2022-10-26 07:35:43,518][0m Trial 62 finished with value: 0.6951098341920565 and parameters: {'lsvc_dual': False, 'lsvc_C': 367.9256966952846, 'lsvc_max_iter': 2000}. Best is trial 0 with value: 0.69511.[0m
[32m[I 2022-10-26 07:35:45,589][0m Trial 63 finished with value: 0.6951098341920565 and parameters: {'lsvc_dual': False, 'lsvc_C': 21.206869435319458, 'lsvc_max_iter': 2000}. Best is trial 0 with value: 0.69511.[0m
[32m[I 2022-10-26 07:35:47,649][0m Trial 64 finished with value: 0.6951098341920565 and parameters: {'lsvc_dual': False, 'lsvc_C': 0.00015253532050007104, 'lsvc_max_iter': 2000}. Best is trial 0 with value: 0.69511.[0m
[32m[I 2022-10-26 07:35:49,724][0m Trial 65 finished with value: 0.6951098341920565 and parameters: {'lsvc_dual': False, 'lsvc_C': 0.012322107761125392, 'lsvc_max_iter': 2000}. Best is trial 0 with value: 0.69511.[0m
[32m[I 2022-10-26 07:35:51,787][0m Trial 66 finished with value: 0.6951098341920565 and parameters: {'lsvc_dual': False, 'lsvc_C': 67.25809362690102, 'lsvc_max_iter': 2000}. Best is trial 0 with value: 0.69511.[0m
[32m[I 2022-10-26 07:35:53,878][0m Trial 67 finished with value: 0.6951098341920565 and parameters: {'lsvc_dual': False, 'lsvc_C': 73.54644566532644, 'lsvc_max_iter': 2000}. Best is trial 0 with value: 0.69511.[0m
[32m[I 2022-10-26 07:35:55,945][0m Trial 68 finished with value: 0.6951098341920565 and parameters: {'lsvc_dual': False, 'lsvc_C': 0.005439530580788177, 'lsvc_max_iter': 2000}. Best is trial 0 with value: 0.69511.[0m
[32m[I 2022-10-26 07:35:58,002][0m Trial 69 finished with value: 0.6951098341920565 and parameters: {'lsvc_dual': False, 'lsvc_C': 0.0004657854807675267, 'lsvc_max_iter': 2000}. Best is trial 0 with value: 0.69511.[0m
[32m[I 2022-10-26 07:36:00,081][0m Trial 70 finished with value: 0.6951098341920565 and parameters: {'lsvc_dual': False, 'lsvc_C': 36.976129697378795, 'lsvc_max_iter': 2000}. Best is trial 0 with value: 0.69511.[0m
[32m[I 2022-10-26 07:36:02,136][0m Trial 71 finished with value: 0.6951098341920565 and parameters: {'lsvc_dual': False, 'lsvc_C': 0.023750439230395413, 'lsvc_max_iter': 2000}. Best is trial 0 with value: 0.69511.[0m
[32m[I 2022-10-26 07:36:04,178][0m Trial 72 finished with value: 0.6951098341920565 and parameters: {'lsvc_dual': False, 'lsvc_C': 0.23980114755760523, 'lsvc_max_iter': 2000}. Best is trial 0 with value: 0.69511.[0m
[32m[I 2022-10-26 07:36:06,246][0m Trial 73 finished with value: 0.6951098341920565 and parameters: {'lsvc_dual': False, 'lsvc_C': 0.2355043057999348, 'lsvc_max_iter': 2000}. Best is trial 0 with value: 0.69511.[0m
[32m[I 2022-10-26 07:36:08,319][0m Trial 74 finished with value: 0.6951098341920565 and parameters: {'lsvc_dual': False, 'lsvc_C': 0.06280601073711639, 'lsvc_max_iter': 2000}. Best is trial 0 with value: 0.69511.[0m
[32m[I 2022-10-26 07:36:10,373][0m Trial 75 finished with value: 0.6951098341920565 and parameters: {'lsvc_dual': False, 'lsvc_C': 0.5058700788927682, 'lsvc_max_iter': 2000}. Best is trial 0 with value: 0.69511.[0m
[32m[I 2022-10-26 07:36:12,418][0m Trial 76 finished with value: 0.6951098341920565 and parameters: {'lsvc_dual': False, 'lsvc_C': 7.260600495619045, 'lsvc_max_iter': 2000}. Best is trial 0 with value: 0.69511.[0m
[32m[I 2022-10-26 07:36:14,469][0m Trial 77 finished with value: 0.6951098341920565 and parameters: {'lsvc_dual': False, 'lsvc_C': 0.08912999384356249, 'lsvc_max_iter': 2000}. Best is trial 0 with value: 0.69511.[0m
[32m[I 2022-10-26 07:36:16,526][0m Trial 78 finished with value: 0.6951098341920565 and parameters: {'lsvc_dual': False, 'lsvc_C': 112.96095261558305, 'lsvc_max_iter': 2000}. Best is trial 0 with value: 0.69511.[0m
[32m[I 2022-10-26 07:36:18,589][0m Trial 79 finished with value: 0.6951098341920565 and parameters: {'lsvc_dual': False, 'lsvc_C': 0.5081281155051959, 'lsvc_max_iter': 2000}. Best is trial 0 with value: 0.69511.[0m
[32m[I 2022-10-26 07:36:20,645][0m Trial 80 finished with value: 0.6951098341920565 and parameters: {'lsvc_dual': False, 'lsvc_C': 3.346419358223141, 'lsvc_max_iter': 2000}. Best is trial 0 with value: 0.69511.[0m
[32m[I 2022-10-26 07:36:22,683][0m Trial 81 finished with value: 0.6951098341920565 and parameters: {'lsvc_dual': False, 'lsvc_C': 2.406433931889354, 'lsvc_max_iter': 2000}. Best is trial 0 with value: 0.69511.[0m
[32m[I 2022-10-26 07:36:24,750][0m Trial 82 finished with value: 0.6951098341920565 and parameters: {'lsvc_dual': False, 'lsvc_C': 1.2329337120250945, 'lsvc_max_iter': 2000}. Best is trial 0 with value: 0.69511.[0m
[32m[I 2022-10-26 07:36:26,812][0m Trial 83 finished with value: 0.6951098341920565 and parameters: {'lsvc_dual': False, 'lsvc_C': 0.1428794935432751, 'lsvc_max_iter': 2000}. Best is trial 0 with value: 0.69511.[0m
[32m[I 2022-10-26 07:36:28,907][0m Trial 84 finished with value: 0.6951098341920565 and parameters: {'lsvc_dual': False, 'lsvc_C': 786.1589459669101, 'lsvc_max_iter': 2000}. Best is trial 0 with value: 0.69511.[0m
[32m[I 2022-10-26 07:36:30,955][0m Trial 85 finished with value: 0.6951098341920565 and parameters: {'lsvc_dual': False, 'lsvc_C': 224.1558151162716, 'lsvc_max_iter': 2000}. Best is trial 0 with value: 0.69511.[0m
[32m[I 2022-10-26 07:36:33,005][0m Trial 86 finished with value: 0.6951098341920565 and parameters: {'lsvc_dual': False, 'lsvc_C': 491.41078139690757, 'lsvc_max_iter': 2000}. Best is trial 0 with value: 0.69511.[0m
[32m[I 2022-10-26 07:36:35,068][0m Trial 87 finished with value: 0.6951098341920565 and parameters: {'lsvc_dual': False, 'lsvc_C': 331.50220896861634, 'lsvc_max_iter': 2000}. Best is trial 0 with value: 0.69511.[0m
[32m[I 2022-10-26 07:36:37,131][0m Trial 88 finished with value: 0.6951098341920565 and parameters: {'lsvc_dual': False, 'lsvc_C': 14.17680073771407, 'lsvc_max_iter': 2000}. Best is trial 0 with value: 0.69511.[0m
[32m[I 2022-10-26 07:36:39,185][0m Trial 89 finished with value: 0.6951098341920565 and parameters: {'lsvc_dual': False, 'lsvc_C': 19.540960109058705, 'lsvc_max_iter': 2000}. Best is trial 0 with value: 0.69511.[0m
[32m[I 2022-10-26 07:36:41,239][0m Trial 90 finished with value: 0.6951098341920565 and parameters: {'lsvc_dual': False, 'lsvc_C': 374.33548418223387, 'lsvc_max_iter': 2000}. Best is trial 0 with value: 0.69511.[0m
[32m[I 2022-10-26 07:36:43,315][0m Trial 91 finished with value: 0.6951098341920565 and parameters: {'lsvc_dual': False, 'lsvc_C': 251.112741101864, 'lsvc_max_iter': 2000}. Best is trial 0 with value: 0.69511.[0m
[32m[I 2022-10-26 07:36:45,375][0m Trial 92 finished with value: 0.6951098341920565 and parameters: {'lsvc_dual': False, 'lsvc_C': 546.5279276928637, 'lsvc_max_iter': 2000}. Best is trial 0 with value: 0.69511.[0m
[32m[I 2022-10-26 07:36:47,439][0m Trial 93 finished with value: 0.6951098341920565 and parameters: {'lsvc_dual': False, 'lsvc_C': 212.335158260027, 'lsvc_max_iter': 2000}. Best is trial 0 with value: 0.69511.[0m
[32m[I 2022-10-26 07:36:49,501][0m Trial 94 finished with value: 0.6951098341920565 and parameters: {'lsvc_dual': False, 'lsvc_C': 81.13214689049059, 'lsvc_max_iter': 2000}. Best is trial 0 with value: 0.69511.[0m
[32m[I 2022-10-26 07:36:51,570][0m Trial 95 finished with value: 0.6951098341920565 and parameters: {'lsvc_dual': False, 'lsvc_C': 0.005607418179997249, 'lsvc_max_iter': 2000}. Best is trial 0 with value: 0.69511.[0m
[32m[I 2022-10-26 07:36:53,645][0m Trial 96 finished with value: 0.6951098341920565 and parameters: {'lsvc_dual': False, 'lsvc_C': 0.00019143607080664163, 'lsvc_max_iter': 2000}. Best is trial 0 with value: 0.69511.[0m
