[32m[I 2022-10-26 01:04:52,943][0m Trial 12 finished with value: 0.7275370458687368 and parameters: {'cdc_loss': 'modified_huber', 'cdc_penalty': 'l1/l2', 'cdc_C': 0.02446634145229547, 'cdc_alpha': 1.15416711278542, 'cdc_selection': 'uniform'}. Best is trial 8 with value: 0.775237.[0m
[32m[I 2022-10-26 01:04:52,944][0m Trial 11 finished with value: 2.1768465890535954e-05 and parameters: {'cdc_loss': 'log', 'cdc_penalty': 'l2', 'cdc_C': 789.3856379077599, 'cdc_alpha': 0.005884390785783285, 'cdc_selection': 'cyclic'}. Best is trial 8 with value: 0.775237.[0m
[32m[I 2022-10-26 01:04:53,081][0m Trial 8 finished with value: 0.7752372678352495 and parameters: {'cdc_loss': 'modified_huber', 'cdc_penalty': 'l2', 'cdc_C': 48.348925017430574, 'cdc_alpha': 0.9863584800144225, 'cdc_selection': 'uniform'}. Best is trial 8 with value: 0.775237.[0m
[32m[I 2022-10-26 01:04:53,148][0m Trial 13 finished with value: 2.1768465890535954e-05 and parameters: {'cdc_loss': 'log', 'cdc_penalty': 'l2', 'cdc_C': 49.17833783051121, 'cdc_alpha': 27.628123333830203, 'cdc_selection': 'uniform'}. Best is trial 8 with value: 0.775237.[0m
[32m[I 2022-10-26 01:04:53,224][0m Trial 10 finished with value: 0.695145458044165 and parameters: {'cdc_loss': 'squared', 'cdc_penalty': 'l1', 'cdc_C': 569.8673849061548, 'cdc_alpha': 0.07959989330106662, 'cdc_selection': 'uniform'}. Best is trial 8 with value: 0.775237.[0m
[32m[I 2022-10-26 01:04:53,382][0m Trial 14 finished with value: 0.6951650568989206 and parameters: {'cdc_loss': 'squared', 'cdc_penalty': 'l1/l2', 'cdc_C': 43.09286266483878, 'cdc_alpha': 53.74645328242124, 'cdc_selection': 'uniform'}. Best is trial 8 with value: 0.775237.[0m
[32m[I 2022-10-26 01:04:53,590][0m Trial 9 finished with value: 0.5847153532305833 and parameters: {'cdc_loss': 'modified_huber', 'cdc_penalty': 'l1/l2', 'cdc_C': 441.39618031098195, 'cdc_alpha': 0.008369952920631682, 'cdc_selection': 'cyclic'}. Best is trial 8 with value: 0.775237.[0m
[32m[I 2022-10-26 01:04:53,661][0m Trial 15 finished with value: 0.019344332152171136 and parameters: {'cdc_loss': 'squared_hinge', 'cdc_penalty': 'l1/l2', 'cdc_C': 336.24880341541837, 'cdc_alpha': 653.7065936202439, 'cdc_selection': 'uniform'}. Best is trial 8 with value: 0.775237.[0m
[32m[I 2022-10-26 01:06:16,707][0m Trial 23 finished with value: 0.7281385132908006 and parameters: {'cdc_loss': 'modified_huber', 'cdc_penalty': 'l1', 'cdc_C': 1.579699265596233, 'cdc_alpha': 13.717523511968354, 'cdc_selection': 'uniform'}. Best is trial 8 with value: 0.775237.[0m
[32m[I 2022-10-26 01:06:16,714][0m Trial 18 finished with value: 0.7286409734985605 and parameters: {'cdc_loss': 'modified_huber', 'cdc_penalty': 'l1/l2', 'cdc_C': 1.6333435921959576, 'cdc_alpha': 6.2476875061257156, 'cdc_selection': 'uniform'}. Best is trial 8 with value: 0.775237.[0m
[32m[I 2022-10-26 01:06:16,779][0m Trial 22 finished with value: 0.7291472478323844 and parameters: {'cdc_loss': 'modified_huber', 'cdc_penalty': 'l1', 'cdc_C': 1.6139388937168877, 'cdc_alpha': 12.958407592698338, 'cdc_selection': 'uniform'}. Best is trial 8 with value: 0.775237.[0m
[32m[I 2022-10-26 01:06:16,781][0m Trial 16 finished with value: 0.7338407495039819 and parameters: {'cdc_loss': 'modified_huber', 'cdc_penalty': 'l1/l2', 'cdc_C': 1.852104543764958, 'cdc_alpha': 9.932469807305488, 'cdc_selection': 'uniform'}. Best is trial 8 with value: 0.775237.[0m
[32m[I 2022-10-26 01:06:16,908][0m Trial 17 finished with value: 0.7316288880645762 and parameters: {'cdc_loss': 'modified_huber', 'cdc_penalty': 'l1/l2', 'cdc_C': 1.713693681414097, 'cdc_alpha': 8.705253380091687, 'cdc_selection': 'uniform'}. Best is trial 8 with value: 0.775237.[0m
[32m[I 2022-10-26 01:06:17,038][0m Trial 21 finished with value: 0.7306245652628383 and parameters: {'cdc_loss': 'modified_huber', 'cdc_penalty': 'l1', 'cdc_C': 1.2642339888360619, 'cdc_alpha': 4.878335311415649, 'cdc_selection': 'uniform'}. Best is trial 8 with value: 0.775237.[0m
[32m[I 2022-10-26 01:06:17,038][0m Trial 20 finished with value: 0.7145491072519761 and parameters: {'cdc_loss': 'modified_huber', 'cdc_penalty': 'l1/l2', 'cdc_C': 1.272554129036997, 'cdc_alpha': 7.438981525446785, 'cdc_selection': 'uniform'}. Best is trial 8 with value: 0.775237.[0m
[32m[I 2022-10-26 01:06:17,161][0m Trial 19 finished with value: 0.7343665368357727 and parameters: {'cdc_loss': 'modified_huber', 'cdc_penalty': 'l1/l2', 'cdc_C': 1.618071631261895, 'cdc_alpha': 8.71887797382525, 'cdc_selection': 'uniform'}. Best is trial 8 with value: 0.775237.[0m
[32m[I 2022-10-26 01:13:37,940][0m Trial 24 finished with value: 0.73100656739858 and parameters: {'cdc_loss': 'modified_huber', 'cdc_penalty': 'l2', 'cdc_C': 0.23968059124030408, 'cdc_alpha': 87.18073239747271, 'cdc_selection': 'cyclic'}. Best is trial 8 with value: 0.775237.[0m
[32m[I 2022-10-26 01:13:38,016][0m Trial 28 finished with value: 0.7306076581138604 and parameters: {'cdc_loss': 'modified_huber', 'cdc_penalty': 'l2', 'cdc_C': 0.18898885558406198, 'cdc_alpha': 141.50572197581832, 'cdc_selection': 'cyclic'}. Best is trial 8 with value: 0.775237.[0m
[32m[I 2022-10-26 01:13:38,101][0m Trial 29 finished with value: 0.7301097885466413 and parameters: {'cdc_loss': 'modified_huber', 'cdc_penalty': 'l2', 'cdc_C': 0.23637997920891582, 'cdc_alpha': 80.77925155946687, 'cdc_selection': 'cyclic'}. Best is trial 8 with value: 0.775237.[0m
[32m[I 2022-10-26 01:13:38,193][0m Trial 31 finished with value: 0.7299199801349945 and parameters: {'cdc_loss': 'modified_huber', 'cdc_penalty': 'l2', 'cdc_C': 0.203030974435233, 'cdc_alpha': 89.82625003757161, 'cdc_selection': 'cyclic'}. Best is trial 8 with value: 0.775237.[0m
[32m[I 2022-10-26 01:13:38,193][0m Trial 30 finished with value: 0.7306343381695287 and parameters: {'cdc_loss': 'modified_huber', 'cdc_penalty': 'l2', 'cdc_C': 0.18937146711301267, 'cdc_alpha': 118.26916622015872, 'cdc_selection': 'cyclic'}. Best is trial 8 with value: 0.775237.[0m
[32m[I 2022-10-26 01:13:38,195][0m Trial 26 finished with value: 0.7145536977859923 and parameters: {'cdc_loss': 'modified_huber', 'cdc_penalty': 'l2', 'cdc_C': 0.1482600382245314, 'cdc_alpha': 74.23017390028257, 'cdc_selection': 'cyclic'}. Best is trial 8 with value: 0.775237.[0m
[32m[I 2022-10-26 01:13:38,419][0m Trial 25 finished with value: 0.7123235308594172 and parameters: {'cdc_loss': 'modified_huber', 'cdc_penalty': 'l2', 'cdc_C': 0.11811978528058356, 'cdc_alpha': 2.484018659742383, 'cdc_selection': 'cyclic'}. Best is trial 8 with value: 0.775237.[0m
[32m[I 2022-10-26 01:13:38,506][0m Trial 27 finished with value: 0.730136176677129 and parameters: {'cdc_loss': 'modified_huber', 'cdc_penalty': 'l2', 'cdc_C': 0.23096630700373957, 'cdc_alpha': 146.25343003800702, 'cdc_selection': 'cyclic'}. Best is trial 8 with value: 0.775237.[0m
[32m[I 2022-10-26 01:15:12,212][0m Trial 39 finished with value: 0.6951513945249667 and parameters: {'cdc_loss': 'log', 'cdc_penalty': 'l1/l2', 'cdc_C': 6.02757261788594, 'cdc_alpha': 3.0345876251047423, 'cdc_selection': 'uniform'}. Best is trial 8 with value: 0.775237.[0m
[32m[I 2022-10-26 01:15:12,409][0m Trial 35 finished with value: 0.6951513945249667 and parameters: {'cdc_loss': 'log', 'cdc_penalty': 'l1/l2', 'cdc_C': 8.061952176928996, 'cdc_alpha': 2.594950575047665, 'cdc_selection': 'uniform'}. Best is trial 8 with value: 0.775237.[0m
[32m[I 2022-10-26 01:15:14,347][0m Trial 37 finished with value: 3.649110965113589e-05 and parameters: {'cdc_loss': 'squared', 'cdc_penalty': 'l1/l2', 'cdc_C': 4.977156164285715, 'cdc_alpha': 2.611388054530837, 'cdc_selection': 'uniform'}. Best is trial 8 with value: 0.775237.[0m
[32m[I 2022-10-26 01:15:15,034][0m Trial 38 finished with value: 0.0006078015657829853 and parameters: {'cdc_loss': 'squared', 'cdc_penalty': 'l1/l2', 'cdc_C': 7.815829084737836, 'cdc_alpha': 24.975170739522625, 'cdc_selection': 'uniform'}. Best is trial 8 with value: 0.775237.[0m
[32m[I 2022-10-26 01:15:15,335][0m Trial 33 finished with value: 2.1768465890535954e-05 and parameters: {'cdc_loss': 'squared', 'cdc_penalty': 'l1/l2', 'cdc_C': 8.638065039672668, 'cdc_alpha': 2.604213417758503, 'cdc_selection': 'uniform'}. Best is trial 8 with value: 0.775237.[0m
[32m[I 2022-10-26 01:15:15,413][0m Trial 36 finished with value: 2.1768465890535954e-05 and parameters: {'cdc_loss': 'squared', 'cdc_penalty': 'l1/l2', 'cdc_C': 8.993534947281999, 'cdc_alpha': 3.231836399333233, 'cdc_selection': 'uniform'}. Best is trial 8 with value: 0.775237.[0m
[32m[I 2022-10-26 01:15:15,788][0m Trial 34 finished with value: 0.0006078015657829853 and parameters: {'cdc_loss': 'squared', 'cdc_penalty': 'l1/l2', 'cdc_C': 6.8780575930496175, 'cdc_alpha': 2.626775882176555, 'cdc_selection': 'uniform'}. Best is trial 8 with value: 0.775237.[0m
[32m[I 2022-10-26 01:15:16,812][0m Trial 32 finished with value: 2.1768465890535954e-05 and parameters: {'cdc_loss': 'squared', 'cdc_penalty': 'l1/l2', 'cdc_C': 3.584702567295638, 'cdc_alpha': 2.6426912524522743, 'cdc_selection': 'uniform'}. Best is trial 8 with value: 0.775237.[0m
[32m[I 2022-10-26 01:16:25,294][0m Trial 40 finished with value: 0.12818437970031965 and parameters: {'cdc_loss': 'squared', 'cdc_penalty': 'l1/l2', 'cdc_C': 0.01892860022051819, 'cdc_alpha': 26.806830157225534, 'cdc_selection': 'uniform'}. Best is trial 8 with value: 0.775237.[0m
[32m[I 2022-10-26 01:16:25,483][0m Trial 41 finished with value: 0.12818437970031965 and parameters: {'cdc_loss': 'squared', 'cdc_penalty': 'l1/l2', 'cdc_C': 0.03050601035793142, 'cdc_alpha': 27.727046839413827, 'cdc_selection': 'uniform'}. Best is trial 8 with value: 0.775237.[0m
[32m[I 2022-10-26 01:16:35,496][0m Trial 43 finished with value: 0.6967580200143225 and parameters: {'cdc_loss': 'squared_hinge', 'cdc_penalty': 'l1', 'cdc_C': 0.03787183614518469, 'cdc_alpha': 0.3410895147271767, 'cdc_selection': 'uniform'}. Best is trial 8 with value: 0.775237.[0m
[32m[I 2022-10-26 01:16:35,572][0m Trial 42 finished with value: 0.6967580200143225 and parameters: {'cdc_loss': 'squared_hinge', 'cdc_penalty': 'l1', 'cdc_C': 0.02919358165123059, 'cdc_alpha': 0.21312337277442228, 'cdc_selection': 'uniform'}. Best is trial 8 with value: 0.775237.[0m
[32m[I 2022-10-26 01:16:35,694][0m Trial 46 finished with value: 0.7306064846393729 and parameters: {'cdc_loss': 'squared_hinge', 'cdc_penalty': 'l1', 'cdc_C': 167.11502796665619, 'cdc_alpha': 0.16936282580365217, 'cdc_selection': 'uniform'}. Best is trial 8 with value: 0.775237.[0m
[32m[I 2022-10-26 01:16:35,699][0m Trial 47 finished with value: 0.6967580200143225 and parameters: {'cdc_loss': 'squared_hinge', 'cdc_penalty': 'l1', 'cdc_C': 0.029959649213657964, 'cdc_alpha': 0.21362486585946147, 'cdc_selection': 'uniform'}. Best is trial 8 with value: 0.775237.[0m
[32m[I 2022-10-26 01:16:35,841][0m Trial 45 finished with value: 0.7248648300398778 and parameters: {'cdc_loss': 'modified_huber', 'cdc_penalty': 'l1', 'cdc_C': 0.02070090649036995, 'cdc_alpha': 0.4418027191145765, 'cdc_selection': 'uniform'}. Best is trial 8 with value: 0.775237.[0m
[32m[I 2022-10-26 01:16:35,914][0m Trial 44 finished with value: 0.6967580200143225 and parameters: {'cdc_loss': 'squared_hinge', 'cdc_penalty': 'l1', 'cdc_C': 0.025508908072061416, 'cdc_alpha': 0.285176993202657, 'cdc_selection': 'uniform'}. Best is trial 8 with value: 0.775237.[0m
[32m[I 2022-10-26 01:17:23,762][0m Trial 49 finished with value: 0.6952408995481784 and parameters: {'cdc_loss': 'modified_huber', 'cdc_penalty': 'l1', 'cdc_C': 149.06449191063066, 'cdc_alpha': 0.3713192835745285, 'cdc_selection': 'uniform'}. Best is trial 8 with value: 0.775237.[0m
[32m[I 2022-10-26 01:17:23,764][0m Trial 48 finished with value: 0.7195311683992067 and parameters: {'cdc_loss': 'modified_huber', 'cdc_penalty': 'l1', 'cdc_C': 0.5562347574414932, 'cdc_alpha': 0.4137915189009424, 'cdc_selection': 'uniform'}. Best is trial 8 with value: 0.775237.[0m
[32m[I 2022-10-26 01:22:44,836][0m Trial 50 finished with value: 0.7265892491961207 and parameters: {'cdc_loss': 'modified_huber', 'cdc_penalty': 'l1/l2', 'cdc_C': 0.3862882859797463, 'cdc_alpha': 1.0191116657494361, 'cdc_selection': 'uniform'}. Best is trial 8 with value: 0.775237.[0m
[32m[I 2022-10-26 01:22:44,838][0m Trial 53 finished with value: 0.7265168430095575 and parameters: {'cdc_loss': 'modified_huber', 'cdc_penalty': 'l1/l2', 'cdc_C': 24.56674217397991, 'cdc_alpha': 0.8797010294456931, 'cdc_selection': 'uniform'}. Best is trial 8 with value: 0.775237.[0m
[32m[I 2022-10-26 01:22:44,983][0m Trial 54 finished with value: 0.7177049619687277 and parameters: {'cdc_loss': 'modified_huber', 'cdc_penalty': 'l1/l2', 'cdc_C': 0.645140458471353, 'cdc_alpha': 0.9322333930331843, 'cdc_selection': 'uniform'}. Best is trial 8 with value: 0.775237.[0m
[32m[I 2022-10-26 01:22:45,061][0m Trial 51 finished with value: 0.7345546679495046 and parameters: {'cdc_loss': 'modified_huber', 'cdc_penalty': 'l1/l2', 'cdc_C': 0.8142095151518063, 'cdc_alpha': 0.843370498058881, 'cdc_selection': 'uniform'}. Best is trial 8 with value: 0.775237.[0m
[32m[I 2022-10-26 01:22:45,061][0m Trial 52 finished with value: 0.678917177207097 and parameters: {'cdc_loss': 'modified_huber', 'cdc_penalty': 'l1/l2', 'cdc_C': 0.49981916230505546, 'cdc_alpha': 9.960474485540391, 'cdc_selection': 'uniform'}. Best is trial 8 with value: 0.775237.[0m
[32m[I 2022-10-26 01:22:45,206][0m Trial 55 finished with value: 0.7253752699800841 and parameters: {'cdc_loss': 'modified_huber', 'cdc_penalty': 'l1/l2', 'cdc_C': 0.7349967373273029, 'cdc_alpha': 0.7890741254566072, 'cdc_selection': 'uniform'}. Best is trial 8 with value: 0.775237.[0m
[32m[I 2022-10-26 01:40:47,993][0m Trial 57 finished with value: 0.7704698400163665 and parameters: {'cdc_loss': 'modified_huber', 'cdc_penalty': 'l1/l2', 'cdc_C': 0.6391005837527829, 'cdc_alpha': 0.019182860166430667, 'cdc_selection': 'cyclic'}. Best is trial 8 with value: 0.775237.[0m
[32m[I 2022-10-26 01:42:47,346][0m Trial 56 finished with value: 0.7872186712214622 and parameters: {'cdc_loss': 'modified_huber', 'cdc_penalty': 'l1/l2', 'cdc_C': 0.6339337334269451, 'cdc_alpha': 0.0019313205756453925, 'cdc_selection': 'cyclic'}. Best is trial 56 with value: 0.787219.[0m
[32m[I 2022-10-26 01:43:22,939][0m Trial 62 finished with value: 0.7660096036924583 and parameters: {'cdc_loss': 'modified_huber', 'cdc_penalty': 'l1/l2', 'cdc_C': 0.06797740125952388, 'cdc_alpha': 5.767444489019377, 'cdc_selection': 'cyclic'}. Best is trial 56 with value: 0.787219.[0m
[32m[I 2022-10-26 01:43:23,093][0m Trial 59 finished with value: 0.7621814008785294 and parameters: {'cdc_loss': 'modified_huber', 'cdc_penalty': 'l1/l2', 'cdc_C': 2.1195511332495665, 'cdc_alpha': 0.04451469894077887, 'cdc_selection': 'cyclic'}. Best is trial 56 with value: 0.787219.[0m
[32m[I 2022-10-26 01:43:23,337][0m Trial 58 finished with value: 0.7863963986845163 and parameters: {'cdc_loss': 'modified_huber', 'cdc_penalty': 'l1/l2', 'cdc_C': 3.2377475726921485, 'cdc_alpha': 0.10386395684803938, 'cdc_selection': 'cyclic'}. Best is trial 60 with value: 0.790409.[0m
[32m[I 2022-10-26 01:43:23,338][0m Trial 60 finished with value: 0.7904089530587014 and parameters: {'cdc_loss': 'modified_huber', 'cdc_penalty': 'l1/l2', 'cdc_C': 3.143092422177619, 'cdc_alpha': 0.025150508706895502, 'cdc_selection': 'cyclic'}. Best is trial 60 with value: 0.790409.[0m
[32m[I 2022-10-26 01:43:23,508][0m Trial 63 finished with value: 0.7799997727466325 and parameters: {'cdc_loss': 'modified_huber', 'cdc_penalty': 'l1/l2', 'cdc_C': 2.9452870545455654, 'cdc_alpha': 17.63079114837966, 'cdc_selection': 'cyclic'}. Best is trial 60 with value: 0.790409.[0m
[32m[I 2022-10-26 01:43:23,590][0m Trial 61 finished with value: 0.764830828030975 and parameters: {'cdc_loss': 'modified_huber', 'cdc_penalty': 'l1/l2', 'cdc_C': 2.7494771373909606, 'cdc_alpha': 0.0010913062064994376, 'cdc_selection': 'cyclic'}. Best is trial 60 with value: 0.790409.[0m
[32m[I 2022-10-26 01:46:26,129][0m Trial 64 finished with value: 0.7799388121147224 and parameters: {'cdc_loss': 'modified_huber', 'cdc_penalty': 'l1/l2', 'cdc_C': 0.08104227414005394, 'cdc_alpha': 0.021350159928855826, 'cdc_selection': 'cyclic'}. Best is trial 60 with value: 0.790409.[0m
[32m[I 2022-10-26 01:46:45,469][0m Trial 65 finished with value: 0.789526356573908 and parameters: {'cdc_loss': 'modified_huber', 'cdc_penalty': 'l1/l2', 'cdc_C': 0.06689927147311771, 'cdc_alpha': 0.0021320078768927915, 'cdc_selection': 'cyclic'}. Best is trial 60 with value: 0.790409.[0m
[32m[I 2022-10-26 01:54:12,634][0m Trial 69 finished with value: 0.7829609685816835 and parameters: {'cdc_loss': 'modified_huber', 'cdc_penalty': 'l1/l2', 'cdc_C': 0.06382131105441972, 'cdc_alpha': 0.019124563886128456, 'cdc_selection': 'cyclic'}. Best is trial 60 with value: 0.790409.[0m
[32m[I 2022-10-26 01:54:12,775][0m Trial 68 finished with value: 0.7893824387867074 and parameters: {'cdc_loss': 'modified_huber', 'cdc_penalty': 'l1/l2', 'cdc_C': 0.06654393816088443, 'cdc_alpha': 0.022730994088130122, 'cdc_selection': 'cyclic'}. Best is trial 60 with value: 0.790409.[0m
[32m[I 2022-10-26 01:54:13,061][0m Trial 66 finished with value: 0.7895921978286692 and parameters: {'cdc_loss': 'modified_huber', 'cdc_penalty': 'l1/l2', 'cdc_C': 0.0670329011007554, 'cdc_alpha': 0.016377590594318987, 'cdc_selection': 'cyclic'}. Best is trial 60 with value: 0.790409.[0m
[32m[I 2022-10-26 01:54:13,061][0m Trial 67 finished with value: 0.6950930523544878 and parameters: {'cdc_loss': 'log', 'cdc_penalty': 'l1/l2', 'cdc_C': 0.011268654642181323, 'cdc_alpha': 0.008487483573639314, 'cdc_selection': 'cyclic'}. Best is trial 60 with value: 0.790409.[0m
[32m[I 2022-10-26 01:54:13,335][0m Trial 70 finished with value: 0.7761665798785968 and parameters: {'cdc_loss': 'modified_huber', 'cdc_penalty': 'l1/l2', 'cdc_C': 0.006601826191753127, 'cdc_alpha': 0.024646898539309244, 'cdc_selection': 'cyclic'}. Best is trial 60 with value: 0.790409.[0m
[32m[I 2022-10-26 01:54:15,092][0m Trial 71 finished with value: 0.7872186712214622 and parameters: {'cdc_loss': 'modified_huber', 'cdc_penalty': 'l1/l2', 'cdc_C': 0.004304545092226465, 'cdc_alpha': 0.017479102364928372, 'cdc_selection': 'cyclic'}. Best is trial 60 with value: 0.790409.[0m
[32m[I 2022-10-26 02:05:36,814][0m Trial 72 finished with value: 0.6950930523544878 and parameters: {'cdc_loss': 'log', 'cdc_penalty': 'l1/l2', 'cdc_C': 0.0029374181474572715, 'cdc_alpha': 0.0022974238546050346, 'cdc_selection': 'cyclic'}. Best is trial 60 with value: 0.790409.[0m
[32m[I 2022-10-26 02:08:46,285][0m Trial 73 finished with value: 0.6950930523544878 and parameters: {'cdc_loss': 'log', 'cdc_penalty': 'l1/l2', 'cdc_C': 0.06495393733073465, 'cdc_alpha': 0.0025440693048899873, 'cdc_selection': 'cyclic'}. Best is trial 60 with value: 0.790409.[0m
[32m[I 2022-10-26 02:09:17,124][0m Trial 74 finished with value: 0.6950930523544878 and parameters: {'cdc_loss': 'log', 'cdc_penalty': 'l1/l2', 'cdc_C': 0.004516270434420615, 'cdc_alpha': 0.003049340563018336, 'cdc_selection': 'cyclic'}. Best is trial 60 with value: 0.790409.[0m
[32m[I 2022-10-26 02:09:17,408][0m Trial 75 finished with value: 0.6950930523544878 and parameters: {'cdc_loss': 'log', 'cdc_penalty': 'l1/l2', 'cdc_C': 0.009947725510839738, 'cdc_alpha': 0.002878429276887774, 'cdc_selection': 'cyclic'}. Best is trial 78 with value: 0.794638.[0m
[32m[I 2022-10-26 02:09:17,408][0m Trial 78 finished with value: 0.7946379047768795 and parameters: {'cdc_loss': 'modified_huber', 'cdc_penalty': 'l1/l2', 'cdc_C': 0.0018577012616979216, 'cdc_alpha': 0.002122664391823403, 'cdc_selection': 'cyclic'}. Best is trial 78 with value: 0.794638.[0m
[32m[I 2022-10-26 02:09:17,704][0m Trial 77 finished with value: 0.7836234559835792 and parameters: {'cdc_loss': 'modified_huber', 'cdc_penalty': 'l1/l2', 'cdc_C': 0.0026694100214188408, 'cdc_alpha': 0.001608661953780061, 'cdc_selection': 'cyclic'}. Best is trial 78 with value: 0.794638.[0m
[32m[I 2022-10-26 02:09:34,379][0m Trial 76 finished with value: 0.7225296580397175 and parameters: {'cdc_loss': 'modified_huber', 'cdc_penalty': 'l1/l2', 'cdc_C': 0.005862728035546863, 'cdc_alpha': 0.002216714753636422, 'cdc_selection': 'cyclic'}. Best is trial 78 with value: 0.794638.[0m
[32m[I 2022-10-26 02:09:34,500][0m Trial 79 finished with value: 0.7225296580397175 and parameters: {'cdc_loss': 'modified_huber', 'cdc_penalty': 'l1/l2', 'cdc_C': 0.004534862429036012, 'cdc_alpha': 0.0026451204700434394, 'cdc_selection': 'cyclic'}. Best is trial 78 with value: 0.794638.[0m
[32m[I 2022-10-26 02:10:04,009][0m Trial 80 finished with value: 0.7472851509401396 and parameters: {'cdc_loss': 'modified_huber', 'cdc_penalty': 'l1/l2', 'cdc_C': 0.05857820742522544, 'cdc_alpha': 0.003494862838463104, 'cdc_selection': 'cyclic'}. Best is trial 78 with value: 0.794638.[0m
[32m[I 2022-10-26 02:10:59,983][0m Trial 81 finished with value: 0.778952961790348 and parameters: {'cdc_loss': 'modified_huber', 'cdc_penalty': 'l1/l2', 'cdc_C': 0.0011294910204955053, 'cdc_alpha': 0.0070457573080768355, 'cdc_selection': 'cyclic'}. Best is trial 78 with value: 0.794638.[0m
[32m[I 2022-10-26 02:11:00,595][0m Trial 82 finished with value: 0.7627682042667102 and parameters: {'cdc_loss': 'modified_huber', 'cdc_penalty': 'l1/l2', 'cdc_C': 0.04825314204480284, 'cdc_alpha': 0.010011768472968769, 'cdc_selection': 'cyclic'}. Best is trial 78 with value: 0.794638.[0m
[32m[I 2022-10-26 02:11:13,860][0m Trial 84 finished with value: 0.7966751344687236 and parameters: {'cdc_loss': 'modified_huber', 'cdc_penalty': 'l1/l2', 'cdc_C': 0.0011532011559942663, 'cdc_alpha': 0.006477359406216802, 'cdc_selection': 'cyclic'}. Best is trial 84 with value: 0.796675.[0m
