[32m[I 2022-10-26 02:20:20,257][0m Trial 54 finished with value: 0.9982345294787428 and parameters: {'dtc_criterion': 'entropy', 'dtc_splitter': 'random', 'dtc_min_samples_split': 36, 'dtc_min_samples_leaf': 3, 'dtc_max_features': 6}. Best is trial 29 with value: 0.999955.[0m
[32m[I 2022-10-26 02:20:21,543][0m Trial 57 finished with value: 0.9995823684934693 and parameters: {'dtc_criterion': 'entropy', 'dtc_splitter': 'random', 'dtc_min_samples_split': 10, 'dtc_min_samples_leaf': 3, 'dtc_max_features': 6}. Best is trial 29 with value: 0.999955.[0m
[32m[I 2022-10-26 02:20:21,544][0m Trial 60 finished with value: 0.6950742018218817 and parameters: {'dtc_criterion': 'entropy', 'dtc_splitter': 'random', 'dtc_min_samples_split': 10, 'dtc_min_samples_leaf': 3, 'dtc_max_features': 3}. Best is trial 29 with value: 0.999955.[0m
[32m[I 2022-10-26 02:20:21,545][0m Trial 58 finished with value: 0.9995823684934693 and parameters: {'dtc_criterion': 'entropy', 'dtc_splitter': 'random', 'dtc_min_samples_split': 10, 'dtc_min_samples_leaf': 3, 'dtc_max_features': 6}. Best is trial 29 with value: 0.999955.[0m
[32m[I 2022-10-26 02:20:21,661][0m Trial 59 finished with value: 0.9995823684934693 and parameters: {'dtc_criterion': 'entropy', 'dtc_splitter': 'random', 'dtc_min_samples_split': 10, 'dtc_min_samples_leaf': 3, 'dtc_max_features': 6}. Best is trial 29 with value: 0.999955.[0m
[32m[I 2022-10-26 02:20:23,177][0m Trial 63 finished with value: 0.9972757426538413 and parameters: {'dtc_criterion': 'gini', 'dtc_splitter': 'best', 'dtc_min_samples_split': 21, 'dtc_min_samples_leaf': 3, 'dtc_max_features': 3}. Best is trial 29 with value: 0.999955.[0m
[32m[I 2022-10-26 02:20:23,417][0m Trial 62 finished with value: 0.999043358431355 and parameters: {'dtc_criterion': 'gini', 'dtc_splitter': 'best', 'dtc_min_samples_split': 10, 'dtc_min_samples_leaf': 3, 'dtc_max_features': 3}. Best is trial 29 with value: 0.999955.[0m
[32m[I 2022-10-26 02:20:23,419][0m Trial 64 finished with value: 0.999043358431355 and parameters: {'dtc_criterion': 'gini', 'dtc_splitter': 'best', 'dtc_min_samples_split': 10, 'dtc_min_samples_leaf': 3, 'dtc_max_features': 3}. Best is trial 29 with value: 0.999955.[0m
[32m[I 2022-10-26 02:20:23,420][0m Trial 61 finished with value: 0.999043358431355 and parameters: {'dtc_criterion': 'gini', 'dtc_splitter': 'best', 'dtc_min_samples_split': 10, 'dtc_min_samples_leaf': 3, 'dtc_max_features': 3}. Best is trial 29 with value: 0.999955.[0m
[32m[I 2022-10-26 02:20:24,945][0m Trial 67 finished with value: 0.9998160550350847 and parameters: {'dtc_criterion': 'gini', 'dtc_splitter': 'best', 'dtc_min_samples_split': 4, 'dtc_min_samples_leaf': 5, 'dtc_max_features': 5}. Best is trial 29 with value: 0.999955.[0m
[32m[I 2022-10-26 02:20:25,171][0m Trial 68 finished with value: 0.999811150889874 and parameters: {'dtc_criterion': 'gini', 'dtc_splitter': 'best', 'dtc_min_samples_split': 4, 'dtc_min_samples_leaf': 6, 'dtc_max_features': 5}. Best is trial 29 with value: 0.999955.[0m
[32m[I 2022-10-26 02:20:25,262][0m Trial 65 finished with value: 0.999811150889874 and parameters: {'dtc_criterion': 'gini', 'dtc_splitter': 'best', 'dtc_min_samples_split': 4, 'dtc_min_samples_leaf': 6, 'dtc_max_features': 5}. Best is trial 29 with value: 0.999955.[0m
[32m[I 2022-10-26 02:20:25,386][0m Trial 66 finished with value: 0.9998160550350847 and parameters: {'dtc_criterion': 'gini', 'dtc_splitter': 'best', 'dtc_min_samples_split': 4, 'dtc_min_samples_leaf': 5, 'dtc_max_features': 5}. Best is trial 29 with value: 0.999955.[0m
[32m[I 2022-10-26 02:20:26,881][0m Trial 71 finished with value: 0.9998408866705517 and parameters: {'dtc_criterion': 'entropy', 'dtc_splitter': 'best', 'dtc_min_samples_split': 4, 'dtc_min_samples_leaf': 5, 'dtc_max_features': 5}. Best is trial 29 with value: 0.999955.[0m
[32m[I 2022-10-26 02:20:26,881][0m Trial 70 finished with value: 0.999873176234658 and parameters: {'dtc_criterion': 'entropy', 'dtc_splitter': 'best', 'dtc_min_samples_split': 4, 'dtc_min_samples_leaf': 6, 'dtc_max_features': 5}. Best is trial 29 with value: 0.999955.[0m
[32m[I 2022-10-26 02:20:26,883][0m Trial 69 finished with value: 0.999811150889874 and parameters: {'dtc_criterion': 'gini', 'dtc_splitter': 'best', 'dtc_min_samples_split': 4, 'dtc_min_samples_leaf': 6, 'dtc_max_features': 5}. Best is trial 29 with value: 0.999955.[0m
[32m[I 2022-10-26 02:20:26,980][0m Trial 72 finished with value: 0.999873176234658 and parameters: {'dtc_criterion': 'entropy', 'dtc_splitter': 'best', 'dtc_min_samples_split': 4, 'dtc_min_samples_leaf': 6, 'dtc_max_features': 5}. Best is trial 29 with value: 0.999955.[0m
[32m[I 2022-10-26 02:20:28,811][0m Trial 75 finished with value: 0.9995600854365939 and parameters: {'dtc_criterion': 'entropy', 'dtc_splitter': 'best', 'dtc_min_samples_split': 14, 'dtc_min_samples_leaf': 33, 'dtc_max_features': 6}. Best is trial 29 with value: 0.999955.[0m
[32m[I 2022-10-26 02:20:29,059][0m Trial 76 finished with value: 0.9999030406644951 and parameters: {'dtc_criterion': 'entropy', 'dtc_splitter': 'best', 'dtc_min_samples_split': 24, 'dtc_min_samples_leaf': 1, 'dtc_max_features': 6}. Best is trial 29 with value: 0.999955.[0m
[32m[I 2022-10-26 02:20:29,060][0m Trial 73 finished with value: 0.9993743443145071 and parameters: {'dtc_criterion': 'entropy', 'dtc_splitter': 'best', 'dtc_min_samples_split': 27, 'dtc_min_samples_leaf': 32, 'dtc_max_features': 6}. Best is trial 29 with value: 0.999955.[0m
[32m[I 2022-10-26 02:20:29,259][0m Trial 74 finished with value: 0.9999204314686159 and parameters: {'dtc_criterion': 'entropy', 'dtc_splitter': 'best', 'dtc_min_samples_split': 15, 'dtc_min_samples_leaf': 1, 'dtc_max_features': 6}. Best is trial 29 with value: 0.999955.[0m
[32m[I 2022-10-26 02:20:30,630][0m Trial 78 finished with value: 0.9999030528083331 and parameters: {'dtc_criterion': 'entropy', 'dtc_splitter': 'best', 'dtc_min_samples_split': 25, 'dtc_min_samples_leaf': 1, 'dtc_max_features': 6}. Best is trial 29 with value: 0.999955.[0m
[32m[I 2022-10-26 02:20:30,832][0m Trial 79 finished with value: 0.999850925430956 and parameters: {'dtc_criterion': 'entropy', 'dtc_splitter': 'best', 'dtc_min_samples_split': 20, 'dtc_min_samples_leaf': 8, 'dtc_max_features': 6}. Best is trial 29 with value: 0.999955.[0m
[32m[I 2022-10-26 02:20:30,833][0m Trial 80 finished with value: 0.9999030528083331 and parameters: {'dtc_criterion': 'entropy', 'dtc_splitter': 'best', 'dtc_min_samples_split': 25, 'dtc_min_samples_leaf': 1, 'dtc_max_features': 6}. Best is trial 29 with value: 0.999955.[0m
[32m[I 2022-10-26 02:20:31,308][0m Trial 77 finished with value: 0.9998955816239892 and parameters: {'dtc_criterion': 'entropy', 'dtc_splitter': 'best', 'dtc_min_samples_split': 20, 'dtc_min_samples_leaf': 1, 'dtc_max_features': 6}. Best is trial 29 with value: 0.999955.[0m
[32m[I 2022-10-26 02:20:32,968][0m Trial 83 finished with value: 0.9999229381271478 and parameters: {'dtc_criterion': 'entropy', 'dtc_splitter': 'best', 'dtc_min_samples_split': 15, 'dtc_min_samples_leaf': 1, 'dtc_max_features': 7}. Best is trial 29 with value: 0.999955.[0m
[32m[I 2022-10-26 02:20:32,969][0m Trial 84 finished with value: 0.9999229381271478 and parameters: {'dtc_criterion': 'entropy', 'dtc_splitter': 'best', 'dtc_min_samples_split': 15, 'dtc_min_samples_leaf': 1, 'dtc_max_features': 7}. Best is trial 29 with value: 0.999955.[0m
[32m[I 2022-10-26 02:20:32,969][0m Trial 81 finished with value: 0.9999229381271478 and parameters: {'dtc_criterion': 'entropy', 'dtc_splitter': 'best', 'dtc_min_samples_split': 15, 'dtc_min_samples_leaf': 1, 'dtc_max_features': 7}. Best is trial 29 with value: 0.999955.[0m
[32m[I 2022-10-26 02:20:33,158][0m Trial 82 finished with value: 0.9999229381271478 and parameters: {'dtc_criterion': 'entropy', 'dtc_splitter': 'best', 'dtc_min_samples_split': 15, 'dtc_min_samples_leaf': 1, 'dtc_max_features': 7}. Best is trial 29 with value: 0.999955.[0m
[32m[I 2022-10-26 02:20:34,452][0m Trial 85 finished with value: 0.9997887943630509 and parameters: {'dtc_criterion': 'entropy', 'dtc_splitter': 'best', 'dtc_min_samples_split': 16, 'dtc_min_samples_leaf': 23, 'dtc_max_features': 7}. Best is trial 29 with value: 0.999955.[0m
[32m[I 2022-10-26 02:20:34,782][0m Trial 87 finished with value: 0.9995803150990007 and parameters: {'dtc_criterion': 'entropy', 'dtc_splitter': 'best', 'dtc_min_samples_split': 16, 'dtc_min_samples_leaf': 42, 'dtc_max_features': 7}. Best is trial 29 with value: 0.999955.[0m
[32m[I 2022-10-26 02:20:34,782][0m Trial 86 finished with value: 0.9995803150990007 and parameters: {'dtc_criterion': 'entropy', 'dtc_splitter': 'best', 'dtc_min_samples_split': 15, 'dtc_min_samples_leaf': 42, 'dtc_max_features': 7}. Best is trial 29 with value: 0.999955.[0m
[32m[I 2022-10-26 02:20:35,255][0m Trial 88 finished with value: 0.9999378367670528 and parameters: {'dtc_criterion': 'entropy', 'dtc_splitter': 'best', 'dtc_min_samples_split': 14, 'dtc_min_samples_leaf': 1, 'dtc_max_features': 7}. Best is trial 29 with value: 0.999955.[0m
[32m[I 2022-10-26 02:20:36,981][0m Trial 90 finished with value: 0.9999179646960222 and parameters: {'dtc_criterion': 'entropy', 'dtc_splitter': 'best', 'dtc_min_samples_split': 15, 'dtc_min_samples_leaf': 2, 'dtc_max_features': 7}. Best is trial 29 with value: 0.999955.[0m
[32m[I 2022-10-26 02:20:36,985][0m Trial 91 finished with value: 0.9995504855664495 and parameters: {'dtc_criterion': 'entropy', 'dtc_splitter': 'best', 'dtc_min_samples_split': 15, 'dtc_min_samples_leaf': 43, 'dtc_max_features': 7}. Best is trial 29 with value: 0.999955.[0m
[32m[I 2022-10-26 02:20:36,986][0m Trial 89 finished with value: 0.9995504855664495 and parameters: {'dtc_criterion': 'entropy', 'dtc_splitter': 'best', 'dtc_min_samples_split': 15, 'dtc_min_samples_leaf': 43, 'dtc_max_features': 7}. Best is trial 29 with value: 0.999955.[0m
[32m[I 2022-10-26 02:20:36,986][0m Trial 92 finished with value: 0.9999179646960222 and parameters: {'dtc_criterion': 'entropy', 'dtc_splitter': 'best', 'dtc_min_samples_split': 15, 'dtc_min_samples_leaf': 2, 'dtc_max_features': 7}. Best is trial 29 with value: 0.999955.[0m
[32m[I 2022-10-26 02:20:38,441][0m Trial 95 finished with value: 0.9999378364878079 and parameters: {'dtc_criterion': 'entropy', 'dtc_splitter': 'best', 'dtc_min_samples_split': 12, 'dtc_min_samples_leaf': 2, 'dtc_max_features': 7}. Best is trial 29 with value: 0.999955.[0m
[32m[I 2022-10-26 02:20:38,444][0m Trial 93 finished with value: 0.9995828022149351 and parameters: {'dtc_criterion': 'entropy', 'dtc_splitter': 'best', 'dtc_min_samples_split': 15, 'dtc_min_samples_leaf': 39, 'dtc_max_features': 7}. Best is trial 29 with value: 0.999955.[0m
[32m[I 2022-10-26 02:20:38,540][0m Trial 94 finished with value: 0.9999328633957756 and parameters: {'dtc_criterion': 'entropy', 'dtc_splitter': 'best', 'dtc_min_samples_split': 13, 'dtc_min_samples_leaf': 2, 'dtc_max_features': 7}. Best is trial 29 with value: 0.999955.[0m
[32m[I 2022-10-26 02:20:38,937][0m Trial 96 finished with value: 0.9999328633957756 and parameters: {'dtc_criterion': 'entropy', 'dtc_splitter': 'best', 'dtc_min_samples_split': 13, 'dtc_min_samples_leaf': 2, 'dtc_max_features': 7}. Best is trial 29 with value: 0.999955.[0m
[32m[I 2022-10-26 02:20:40,246][0m Trial 98 finished with value: 0.9999378364878079 and parameters: {'dtc_criterion': 'entropy', 'dtc_splitter': 'best', 'dtc_min_samples_split': 12, 'dtc_min_samples_leaf': 2, 'dtc_max_features': 7}. Best is trial 29 with value: 0.999955.[0m
[32m[I 2022-10-26 02:20:40,248][0m Trial 99 finished with value: 0.9999328633957756 and parameters: {'dtc_criterion': 'entropy', 'dtc_splitter': 'best', 'dtc_min_samples_split': 13, 'dtc_min_samples_leaf': 2, 'dtc_max_features': 7}. Best is trial 29 with value: 0.999955.[0m
[32m[I 2022-10-26 02:20:40,371][0m Trial 97 finished with value: 0.9999030562262597 and parameters: {'dtc_criterion': 'entropy', 'dtc_splitter': 'best', 'dtc_min_samples_split': 17, 'dtc_min_samples_leaf': 4, 'dtc_max_features': 7}. Best is trial 29 with value: 0.999955.[0m
[32m[I 2022-10-26 02:20:40,426][0m Study finished.[0m
[32m[I 2022-10-26 02:20:40,441][0m --------------------------------------------------------------------------------[0m
[32m[I 2022-10-26 02:20:40,442][0m --------------------          ExtraTreeClassifier           --------------------[0m
[32m[I 2022-10-26 02:20:40,442][0m --------------------------------------------------------------------------------[0m
[32m[I 2022-10-26 02:20:40,469][0m A new study created in RDB with name: ExtraTreeClassifier_c963b74b[0m
[32m[I 2022-10-26 02:20:40,476][0m Study started.[0m
[32m[I 2022-10-26 02:20:42,187][0m Trial 2 finished with value: 0.6950742018218817 and parameters: {'etc_criterion': 'entropy', 'etc_min_samples_split': 32, 'etc_min_samples_leaf': 21, 'etc_max_features': 4}. Best is trial 0 with value: 0.695074.[0m
[32m[I 2022-10-26 02:20:42,189][0m Trial 3 finished with value: 0.6950742018218817 and parameters: {'etc_criterion': 'entropy', 'etc_min_samples_split': 17, 'etc_min_samples_leaf': 27, 'etc_max_features': 3}. Best is trial 0 with value: 0.695074.[0m
[32m[I 2022-10-26 02:20:42,190][0m Trial 0 finished with value: 0.6950742018218817 and parameters: {'etc_criterion': 'gini', 'etc_min_samples_split': 20, 'etc_min_samples_leaf': 13, 'etc_max_features': 2}. Best is trial 0 with value: 0.695074.[0m
[32m[I 2022-10-26 02:20:42,324][0m Trial 5 finished with value: 0.6950742018218817 and parameters: {'etc_criterion': 'entropy', 'etc_min_samples_split': 15, 'etc_min_samples_leaf': 19, 'etc_max_features': 4}. Best is trial 0 with value: 0.695074.[0m
[32m[I 2022-10-26 02:20:42,779][0m Trial 1 finished with value: 0.8040976878709973 and parameters: {'etc_criterion': 'gini', 'etc_min_samples_split': 44, 'etc_min_samples_leaf': 26, 'etc_max_features': 5}. Best is trial 1 with value: 0.804098.[0m
[32m[I 2022-10-26 02:20:43,100][0m Trial 7 finished with value: 0.9019123326522348 and parameters: {'etc_criterion': 'entropy', 'etc_min_samples_split': 16, 'etc_min_samples_leaf': 21, 'etc_max_features': 5}. Best is trial 7 with value: 0.901912.[0m
[32m[I 2022-10-26 02:20:43,479][0m Trial 4 finished with value: 0.8543706158044921 and parameters: {'etc_criterion': 'gini', 'etc_min_samples_split': 37, 'etc_min_samples_leaf': 46, 'etc_max_features': 6}. Best is trial 7 with value: 0.901912.[0m
[32m[I 2022-10-26 02:20:43,923][0m Trial 6 finished with value: 0.9766866191020648 and parameters: {'etc_criterion': 'gini', 'etc_min_samples_split': 5, 'etc_min_samples_leaf': 46, 'etc_max_features': 7}. Best is trial 6 with value: 0.976687.[0m
[32m[I 2022-10-26 02:20:44,343][0m Trial 10 finished with value: 0.6950742018218817 and parameters: {'etc_criterion': 'entropy', 'etc_min_samples_split': 29, 'etc_min_samples_leaf': 5, 'etc_max_features': 1}. Best is trial 6 with value: 0.976687.[0m
[32m[I 2022-10-26 02:20:44,494][0m Trial 9 finished with value: 0.6950742018218817 and parameters: {'etc_criterion': 'entropy', 'etc_min_samples_split': 38, 'etc_min_samples_leaf': 47, 'etc_max_features': 3}. Best is trial 6 with value: 0.976687.[0m
[32m[I 2022-10-26 02:20:44,753][0m Trial 12 finished with value: 0.6950742018218817 and parameters: {'etc_criterion': 'entropy', 'etc_min_samples_split': 5, 'etc_min_samples_leaf': 38, 'etc_max_features': 4}. Best is trial 6 with value: 0.976687.[0m
[32m[I 2022-10-26 02:20:45,536][0m Trial 8 finished with value: 0.9796918291861343 and parameters: {'etc_criterion': 'entropy', 'etc_min_samples_split': 20, 'etc_min_samples_leaf': 38, 'etc_max_features': 7}. Best is trial 8 with value: 0.979692.[0m
[32m[I 2022-10-26 02:20:45,537][0m Trial 11 finished with value: 0.9771006397598332 and parameters: {'etc_criterion': 'gini', 'etc_min_samples_split': 47, 'etc_min_samples_leaf': 16, 'etc_max_features': 7}. Best is trial 8 with value: 0.979692.[0m
[32m[I 2022-10-26 02:20:45,922][0m Trial 15 finished with value: 0.6950742018218817 and parameters: {'etc_criterion': 'gini', 'etc_min_samples_split': 38, 'etc_min_samples_leaf': 33, 'etc_max_features': 4}. Best is trial 8 with value: 0.979692.[0m
[32m[I 2022-10-26 02:20:46,413][0m Trial 14 finished with value: 0.897991454743766 and parameters: {'etc_criterion': 'gini', 'etc_min_samples_split': 12, 'etc_min_samples_leaf': 37, 'etc_max_features': 6}. Best is trial 8 with value: 0.979692.[0m
[32m[I 2022-10-26 02:20:46,414][0m Trial 13 finished with value: 0.9771638349443217 and parameters: {'etc_criterion': 'gini', 'etc_min_samples_split': 21, 'etc_min_samples_leaf': 23, 'etc_max_features': 7}. Best is trial 8 with value: 0.979692.[0m
[32m[I 2022-10-26 02:20:47,247][0m Trial 16 finished with value: 0.9805183121254019 and parameters: {'etc_criterion': 'gini', 'etc_min_samples_split': 7, 'etc_min_samples_leaf': 36, 'etc_max_features': 7}. Best is trial 16 with value: 0.980518.[0m
[32m[I 2022-10-26 02:20:47,486][0m Trial 17 finished with value: 0.9298011438032786 and parameters: {'etc_criterion': 'gini', 'etc_min_samples_split': 3, 'etc_min_samples_leaf': 33, 'etc_max_features': 7}. Best is trial 16 with value: 0.980518.[0m
[32m[I 2022-10-26 02:20:47,793][0m Trial 18 finished with value: 0.9805183121254019 and parameters: {'etc_criterion': 'gini', 'etc_min_samples_split': 3, 'etc_min_samples_leaf': 36, 'etc_max_features': 7}. Best is trial 18 with value: 0.980518.[0m
[32m[I 2022-10-26 02:20:48,799][0m Trial 19 finished with value: 0.9805183121254019 and parameters: {'etc_criterion': 'gini', 'etc_min_samples_split': 49, 'etc_min_samples_leaf': 35, 'etc_max_features': 7}. Best is trial 19 with value: 0.980518.[0m
[32m[I 2022-10-26 02:20:49,010][0m Trial 20 finished with value: 0.9873210733787434 and parameters: {'etc_criterion': 'gini', 'etc_min_samples_split': 50, 'etc_min_samples_leaf': 8, 'etc_max_features': 7}. Best is trial 20 with value: 0.987321.[0m
[32m[I 2022-10-26 02:20:49,449][0m Trial 23 finished with value: 0.9740662571160343 and parameters: {'etc_criterion': 'entropy', 'etc_min_samples_split': 24, 'etc_min_samples_leaf': 33, 'etc_max_features': 7}. Best is trial 20 with value: 0.987321.[0m
[32m[I 2022-10-26 02:20:49,449][0m Trial 22 finished with value: 0.9740662571160343 and parameters: {'etc_criterion': 'entropy', 'etc_min_samples_split': 24, 'etc_min_samples_leaf': 32, 'etc_max_features': 7}. Best is trial 20 with value: 0.987321.[0m
[32m[I 2022-10-26 02:20:49,789][0m Trial 21 finished with value: 0.9998186764134299 and parameters: {'etc_criterion': 'gini', 'etc_min_samples_split': 50, 'etc_min_samples_leaf': 1, 'etc_max_features': 7}. Best is trial 21 with value: 0.999819.[0m
[32m[I 2022-10-26 02:20:50,436][0m Trial 24 finished with value: 0.9290665246276727 and parameters: {'etc_criterion': 'entropy', 'etc_min_samples_split': 10, 'etc_min_samples_leaf': 33, 'etc_max_features': 6}. Best is trial 21 with value: 0.999819.[0m
[32m[I 2022-10-26 02:20:50,636][0m Trial 25 finished with value: 0.9310517665113944 and parameters: {'etc_criterion': 'entropy', 'etc_min_samples_split': 10, 'etc_min_samples_leaf': 41, 'etc_max_features': 6}. Best is trial 21 with value: 0.999819.[0m
[32m[I 2022-10-26 02:20:50,864][0m Trial 26 finished with value: 0.9242174338492397 and parameters: {'etc_criterion': 'gini', 'etc_min_samples_split': 9, 'etc_min_samples_leaf': 31, 'etc_max_features': 6}. Best is trial 21 with value: 0.999819.[0m
[32m[I 2022-10-26 02:20:51,421][0m Trial 27 finished with value: 0.8852445750856389 and parameters: {'etc_criterion': 'gini', 'etc_min_samples_split': 26, 'etc_min_samples_leaf': 42, 'etc_max_features': 6}. Best is trial 21 with value: 0.999819.[0m
[32m[I 2022-10-26 02:20:52,186][0m Trial 28 finished with value: 0.9932229119907976 and parameters: {'etc_criterion': 'gini', 'etc_min_samples_split': 9, 'etc_min_samples_leaf': 2, 'etc_max_features': 6}. Best is trial 21 with value: 0.999819.[0m
[32m[I 2022-10-26 02:20:52,573][0m Trial 29 finished with value: 0.9358530670670011 and parameters: {'etc_criterion': 'gini', 'etc_min_samples_split': 50, 'etc_min_samples_leaf': 7, 'etc_max_features': 6}. Best is trial 21 with value: 0.999819.[0m
[32m[I 2022-10-26 02:20:53,453][0m Trial 31 finished with value: 0.9930091772597132 and parameters: {'etc_criterion': 'gini', 'etc_min_samples_split': 50, 'etc_min_samples_leaf': 2, 'etc_max_features': 6}. Best is trial 21 with value: 0.999819.[0m
[32m[I 2022-10-26 02:20:53,627][0m Trial 30 finished with value: 0.9998087069777022 and parameters: {'etc_criterion': 'gini', 'etc_min_samples_split': 48, 'etc_min_samples_leaf': 1, 'etc_max_features': 6}. Best is trial 21 with value: 0.999819.[0m
[32m[I 2022-10-26 02:20:54,065][0m Trial 35 finished with value: 0.9166858131587272 and parameters: {'etc_criterion': 'gini', 'etc_min_samples_split': 44, 'etc_min_samples_leaf': 3, 'etc_max_features': 5}. Best is trial 21 with value: 0.999819.[0m
[32m[I 2022-10-26 02:20:54,483][0m Trial 33 finished with value: 0.999801259027109 and parameters: {'etc_criterion': 'gini', 'etc_min_samples_split': 43, 'etc_min_samples_leaf': 1, 'etc_max_features': 5}. Best is trial 21 with value: 0.999819.[0m
[32m[I 2022-10-26 02:20:54,676][0m Trial 34 finished with value: 0.9997739323284037 and parameters: {'etc_criterion': 'gini', 'etc_min_samples_split': 50, 'etc_min_samples_leaf': 1, 'etc_max_features': 5}. Best is trial 21 with value: 0.999819.[0m
[32m[I 2022-10-26 02:20:55,403][0m Trial 32 finished with value: 0.9998238681341979 and parameters: {'etc_criterion': 'gini', 'etc_min_samples_split': 44, 'etc_min_samples_leaf': 1, 'etc_max_features': 6}. Best is trial 32 with value: 0.999824.[0m
