[32m[I 2022-10-26 07:32:33,132][0m Trial 99 finished with value: 0.9998558300181378 and parameters: {'lgbm_num_leaves': 127, 'lgbm_learning_rate': 0.20445459101114408, 'lgbm_n_estimators': 150, 'lgbm_reg_alpha': 0.0, 'lgbm_reg_lambda': 0.7000000000000001}. Best is trial 31 with value: 0.999901.[0m
[32m[I 2022-10-26 07:32:33,202][0m Study finished.[0m
[32m[I 2022-10-26 07:32:33,218][0m --------------------------------------------------------------------------------[0m
[32m[I 2022-10-26 07:32:33,220][0m --------------------       LinearDiscriminantAnalysis       --------------------[0m
[32m[I 2022-10-26 07:32:33,221][0m --------------------------------------------------------------------------------[0m
[32m[I 2022-10-26 07:32:33,249][0m A new study created in RDB with name: LinearDiscriminantAnalysis_c963b74b[0m
[32m[I 2022-10-26 07:32:33,256][0m Study started.[0m
[32m[I 2022-10-26 07:32:37,596][0m Trial 1 finished with value: 0.707365175921671 and parameters: {'lda_solver': 'svd', 'lda_n_components': 3}. Best is trial 1 with value: 0.707365.[0m
[32m[I 2022-10-26 07:32:37,676][0m Trial 3 finished with value: 0.707365175921671 and parameters: {'lda_solver': 'svd', 'lda_n_components': 4}. Best is trial 1 with value: 0.707365.[0m
[32m[I 2022-10-26 07:32:38,084][0m Trial 2 finished with value: 0.6950742018218817 and parameters: {'lda_solver': 'lsqr', 'lda_n_components': 1, 'lda_tol': 1e-05}. Best is trial 1 with value: 0.707365.[0m
[32m[I 2022-10-26 07:32:38,473][0m Trial 6 finished with value: 0.7077867894758822 and parameters: {'lda_solver': 'eigen', 'lda_n_components': 5, 'lda_tol': 0.0001}. Best is trial 6 with value: 0.707787.[0m
[32m[I 2022-10-26 07:32:38,777][0m Trial 0 finished with value: 0.7077867894758822 and parameters: {'lda_solver': 'eigen', 'lda_n_components': 7, 'lda_tol': 0.001}. Best is trial 0 with value: 0.707787.[0m
[32m[I 2022-10-26 07:32:39,016][0m Trial 5 finished with value: 0.7077867894758822 and parameters: {'lda_solver': 'eigen', 'lda_n_components': 3, 'lda_tol': 0.001}. Best is trial 0 with value: 0.707787.[0m
[32m[I 2022-10-26 07:32:39,109][0m Trial 4 finished with value: 0.7077867894758822 and parameters: {'lda_solver': 'eigen', 'lda_n_components': 1, 'lda_tol': 0.0001}. Best is trial 0 with value: 0.707787.[0m
[32m[I 2022-10-26 07:32:39,193][0m Trial 7 finished with value: 0.7077867894758822 and parameters: {'lda_solver': 'eigen', 'lda_n_components': 5, 'lda_tol': 0.001}. Best is trial 0 with value: 0.707787.[0m
[32m[I 2022-10-26 07:32:42,160][0m Trial 9 finished with value: 0.707365175921671 and parameters: {'lda_solver': 'svd', 'lda_n_components': 4}. Best is trial 0 with value: 0.707787.[0m
[32m[I 2022-10-26 07:32:42,161][0m Trial 10 finished with value: 0.707365175921671 and parameters: {'lda_solver': 'svd', 'lda_n_components': 7}. Best is trial 0 with value: 0.707787.[0m
[32m[I 2022-10-26 07:32:42,562][0m Trial 11 finished with value: 0.707365175921671 and parameters: {'lda_solver': 'svd', 'lda_n_components': 3}. Best is trial 0 with value: 0.707787.[0m
[32m[I 2022-10-26 07:32:42,858][0m Trial 8 finished with value: 0.6950742018218817 and parameters: {'lda_solver': 'lsqr', 'lda_n_components': 2, 'lda_tol': 0.0001}. Best is trial 0 with value: 0.707787.[0m
[32m[I 2022-10-26 07:32:43,255][0m Trial 12 finished with value: 0.707365175921671 and parameters: {'lda_solver': 'svd', 'lda_n_components': 6}. Best is trial 0 with value: 0.707787.[0m
[32m[I 2022-10-26 07:32:43,810][0m Trial 14 finished with value: 0.707365175921671 and parameters: {'lda_solver': 'svd', 'lda_n_components': 2}. Best is trial 0 with value: 0.707787.[0m
[32m[I 2022-10-26 07:32:43,811][0m Trial 15 finished with value: 0.707365175921671 and parameters: {'lda_solver': 'svd', 'lda_n_components': 1}. Best is trial 0 with value: 0.707787.[0m
[32m[I 2022-10-26 07:32:44,698][0m Trial 13 finished with value: 0.7077867894758822 and parameters: {'lda_solver': 'eigen', 'lda_n_components': 4, 'lda_tol': 0.0001}. Best is trial 0 with value: 0.707787.[0m
[32m[I 2022-10-26 07:32:47,404][0m Trial 17 finished with value: 0.7077867894758822 and parameters: {'lda_solver': 'eigen', 'lda_n_components': 7, 'lda_tol': 0.0001}. Best is trial 0 with value: 0.707787.[0m
[32m[I 2022-10-26 07:32:47,513][0m Trial 18 finished with value: 0.7077867894758822 and parameters: {'lda_solver': 'eigen', 'lda_n_components': 7, 'lda_tol': 0.0001}. Best is trial 0 with value: 0.707787.[0m
[32m[I 2022-10-26 07:32:47,671][0m Trial 16 finished with value: 0.7077867894758822 and parameters: {'lda_solver': 'eigen', 'lda_n_components': 7, 'lda_tol': 0.0001}. Best is trial 0 with value: 0.707787.[0m
[32m[I 2022-10-26 07:32:47,757][0m Trial 19 finished with value: 0.7077867894758822 and parameters: {'lda_solver': 'eigen', 'lda_n_components': 7, 'lda_tol': 0.001}. Best is trial 0 with value: 0.707787.[0m
[32m[I 2022-10-26 07:32:47,760][0m Trial 20 finished with value: 0.7077867894758822 and parameters: {'lda_solver': 'eigen', 'lda_n_components': 7, 'lda_tol': 0.0001}. Best is trial 0 with value: 0.707787.[0m
[32m[I 2022-10-26 07:32:48,781][0m Trial 21 finished with value: 0.7077867894758822 and parameters: {'lda_solver': 'eigen', 'lda_n_components': 7, 'lda_tol': 0.001}. Best is trial 0 with value: 0.707787.[0m
[32m[I 2022-10-26 07:32:49,037][0m Trial 22 finished with value: 0.7077867894758822 and parameters: {'lda_solver': 'eigen', 'lda_n_components': 7, 'lda_tol': 0.0001}. Best is trial 0 with value: 0.707787.[0m
[32m[I 2022-10-26 07:32:49,631][0m Trial 23 finished with value: 0.7077867894758822 and parameters: {'lda_solver': 'eigen', 'lda_n_components': 7, 'lda_tol': 0.001}. Best is trial 0 with value: 0.707787.[0m
[32m[I 2022-10-26 07:32:52,321][0m Trial 28 finished with value: 0.7077867894758822 and parameters: {'lda_solver': 'eigen', 'lda_n_components': 6, 'lda_tol': 1e-05}. Best is trial 0 with value: 0.707787.[0m
[32m[I 2022-10-26 07:32:52,587][0m Trial 26 finished with value: 0.7077867894758822 and parameters: {'lda_solver': 'eigen', 'lda_n_components': 6, 'lda_tol': 1e-05}. Best is trial 0 with value: 0.707787.[0m
[32m[I 2022-10-26 07:32:52,589][0m Trial 25 finished with value: 0.7077867894758822 and parameters: {'lda_solver': 'eigen', 'lda_n_components': 6, 'lda_tol': 1e-05}. Best is trial 0 with value: 0.707787.[0m
[32m[I 2022-10-26 07:32:52,806][0m Trial 24 finished with value: 0.7077867894758822 and parameters: {'lda_solver': 'eigen', 'lda_n_components': 6, 'lda_tol': 1e-05}. Best is trial 0 with value: 0.707787.[0m
[32m[I 2022-10-26 07:32:53,303][0m Trial 30 finished with value: 0.6950742018218817 and parameters: {'lda_solver': 'lsqr', 'lda_n_components': 6, 'lda_tol': 0.001}. Best is trial 0 with value: 0.707787.[0m
[32m[I 2022-10-26 07:32:53,388][0m Trial 27 finished with value: 0.7077867894758822 and parameters: {'lda_solver': 'eigen', 'lda_n_components': 6, 'lda_tol': 1e-05}. Best is trial 0 with value: 0.707787.[0m
[32m[I 2022-10-26 07:32:53,808][0m Trial 29 finished with value: 0.7077867894758822 and parameters: {'lda_solver': 'eigen', 'lda_n_components': 6, 'lda_tol': 0.001}. Best is trial 0 with value: 0.707787.[0m
[32m[I 2022-10-26 07:32:54,045][0m Trial 31 finished with value: 0.6950742018218817 and parameters: {'lda_solver': 'lsqr', 'lda_n_components': 6, 'lda_tol': 0.001}. Best is trial 0 with value: 0.707787.[0m
[32m[I 2022-10-26 07:32:56,129][0m Trial 32 finished with value: 0.6950742018218817 and parameters: {'lda_solver': 'lsqr', 'lda_n_components': 5, 'lda_tol': 1e-05}. Best is trial 0 with value: 0.707787.[0m
[32m[I 2022-10-26 07:32:56,754][0m Trial 34 finished with value: 0.6950742018218817 and parameters: {'lda_solver': 'lsqr', 'lda_n_components': 5, 'lda_tol': 1e-05}. Best is trial 0 with value: 0.707787.[0m
[32m[I 2022-10-26 07:32:57,121][0m Trial 33 finished with value: 0.6950742018218817 and parameters: {'lda_solver': 'lsqr', 'lda_n_components': 5, 'lda_tol': 1e-05}. Best is trial 0 with value: 0.707787.[0m
[32m[I 2022-10-26 07:32:57,360][0m Trial 35 finished with value: 0.6950742018218817 and parameters: {'lda_solver': 'lsqr', 'lda_n_components': 5, 'lda_tol': 0.001}. Best is trial 0 with value: 0.707787.[0m
[32m[I 2022-10-26 07:32:57,632][0m Trial 36 finished with value: 0.6950742018218817 and parameters: {'lda_solver': 'lsqr', 'lda_n_components': 5, 'lda_tol': 0.001}. Best is trial 0 with value: 0.707787.[0m
[32m[I 2022-10-26 07:32:58,019][0m Trial 37 finished with value: 0.6950742018218817 and parameters: {'lda_solver': 'lsqr', 'lda_n_components': 5, 'lda_tol': 0.001}. Best is trial 0 with value: 0.707787.[0m
[32m[I 2022-10-26 07:32:58,330][0m Trial 38 finished with value: 0.6950742018218817 and parameters: {'lda_solver': 'lsqr', 'lda_n_components': 5, 'lda_tol': 0.0001}. Best is trial 0 with value: 0.707787.[0m
[32m[I 2022-10-26 07:32:59,040][0m Trial 39 finished with value: 0.7077867894758822 and parameters: {'lda_solver': 'eigen', 'lda_n_components': 7, 'lda_tol': 0.0001}. Best is trial 0 with value: 0.707787.[0m
[32m[I 2022-10-26 07:33:00,852][0m Trial 40 finished with value: 0.7077867894758822 and parameters: {'lda_solver': 'eigen', 'lda_n_components': 5, 'lda_tol': 1e-05}. Best is trial 0 with value: 0.707787.[0m
[32m[I 2022-10-26 07:33:01,254][0m Trial 41 finished with value: 0.7077867894758822 and parameters: {'lda_solver': 'eigen', 'lda_n_components': 5, 'lda_tol': 1e-05}. Best is trial 0 with value: 0.707787.[0m
[32m[I 2022-10-26 07:33:01,784][0m Trial 42 finished with value: 0.7077867894758822 and parameters: {'lda_solver': 'eigen', 'lda_n_components': 6, 'lda_tol': 1e-05}. Best is trial 0 with value: 0.707787.[0m
[32m[I 2022-10-26 07:33:02,032][0m Trial 43 finished with value: 0.7077867894758822 and parameters: {'lda_solver': 'eigen', 'lda_n_components': 6, 'lda_tol': 1e-05}. Best is trial 0 with value: 0.707787.[0m
[32m[I 2022-10-26 07:33:02,354][0m Trial 44 finished with value: 0.7077867894758822 and parameters: {'lda_solver': 'eigen', 'lda_n_components': 6, 'lda_tol': 1e-05}. Best is trial 0 with value: 0.707787.[0m
[32m[I 2022-10-26 07:33:02,883][0m Trial 45 finished with value: 0.7077867894758822 and parameters: {'lda_solver': 'eigen', 'lda_n_components': 6, 'lda_tol': 1e-05}. Best is trial 0 with value: 0.707787.[0m
[32m[I 2022-10-26 07:33:02,954][0m Trial 46 finished with value: 0.7077867894758822 and parameters: {'lda_solver': 'eigen', 'lda_n_components': 6, 'lda_tol': 1e-05}. Best is trial 0 with value: 0.707787.[0m
[32m[I 2022-10-26 07:33:03,847][0m Trial 47 finished with value: 0.7077867894758822 and parameters: {'lda_solver': 'eigen', 'lda_n_components': 6, 'lda_tol': 1e-05}. Best is trial 0 with value: 0.707787.[0m
[32m[I 2022-10-26 07:33:05,387][0m Trial 48 finished with value: 0.7077867894758822 and parameters: {'lda_solver': 'eigen', 'lda_n_components': 6, 'lda_tol': 1e-05}. Best is trial 0 with value: 0.707787.[0m
[32m[I 2022-10-26 07:33:05,862][0m Trial 49 finished with value: 0.7077867894758822 and parameters: {'lda_solver': 'eigen', 'lda_n_components': 6, 'lda_tol': 1e-05}. Best is trial 0 with value: 0.707787.[0m
[32m[I 2022-10-26 07:33:06,396][0m Trial 50 finished with value: 0.7077867894758822 and parameters: {'lda_solver': 'eigen', 'lda_n_components': 6, 'lda_tol': 1e-05}. Best is trial 0 with value: 0.707787.[0m
[32m[I 2022-10-26 07:33:06,653][0m Trial 51 finished with value: 0.7077867894758822 and parameters: {'lda_solver': 'eigen', 'lda_n_components': 7, 'lda_tol': 0.0001}. Best is trial 0 with value: 0.707787.[0m
[32m[I 2022-10-26 07:33:07,016][0m Trial 52 finished with value: 0.7077867894758822 and parameters: {'lda_solver': 'eigen', 'lda_n_components': 7, 'lda_tol': 0.001}. Best is trial 0 with value: 0.707787.[0m
[32m[I 2022-10-26 07:33:07,766][0m Trial 53 finished with value: 0.7077867894758822 and parameters: {'lda_solver': 'eigen', 'lda_n_components': 7, 'lda_tol': 0.001}. Best is trial 0 with value: 0.707787.[0m
[32m[I 2022-10-26 07:33:07,998][0m Trial 54 finished with value: 0.7077867894758822 and parameters: {'lda_solver': 'eigen', 'lda_n_components': 7, 'lda_tol': 0.001}. Best is trial 0 with value: 0.707787.[0m
[32m[I 2022-10-26 07:33:08,843][0m Trial 55 finished with value: 0.7077867894758822 and parameters: {'lda_solver': 'eigen', 'lda_n_components': 7, 'lda_tol': 0.001}. Best is trial 0 with value: 0.707787.[0m
[32m[I 2022-10-26 07:33:09,929][0m Trial 57 finished with value: 0.707365175921671 and parameters: {'lda_solver': 'svd', 'lda_n_components': 7}. Best is trial 0 with value: 0.707787.[0m
[32m[I 2022-10-26 07:33:10,648][0m Trial 56 finished with value: 0.7077867894758822 and parameters: {'lda_solver': 'eigen', 'lda_n_components': 7, 'lda_tol': 0.001}. Best is trial 0 with value: 0.707787.[0m
[32m[I 2022-10-26 07:33:11,033][0m Trial 60 finished with value: 0.707365175921671 and parameters: {'lda_solver': 'svd', 'lda_n_components': 4}. Best is trial 0 with value: 0.707787.[0m
[32m[I 2022-10-26 07:33:11,493][0m Trial 58 finished with value: 0.7077867894758822 and parameters: {'lda_solver': 'eigen', 'lda_n_components': 4, 'lda_tol': 0.001}. Best is trial 0 with value: 0.707787.[0m
[32m[I 2022-10-26 07:33:11,956][0m Trial 61 finished with value: 0.707365175921671 and parameters: {'lda_solver': 'svd', 'lda_n_components': 4}. Best is trial 0 with value: 0.707787.[0m
[32m[I 2022-10-26 07:33:11,956][0m Trial 62 finished with value: 0.707365175921671 and parameters: {'lda_solver': 'svd', 'lda_n_components': 4}. Best is trial 0 with value: 0.707787.[0m
[32m[I 2022-10-26 07:33:12,126][0m Trial 59 finished with value: 0.7077867894758822 and parameters: {'lda_solver': 'eigen', 'lda_n_components': 4, 'lda_tol': 0.001}. Best is trial 0 with value: 0.707787.[0m
[32m[I 2022-10-26 07:33:13,007][0m Trial 63 finished with value: 0.707365175921671 and parameters: {'lda_solver': 'svd', 'lda_n_components': 4}. Best is trial 0 with value: 0.707787.[0m
[32m[I 2022-10-26 07:33:14,163][0m Trial 65 finished with value: 0.707365175921671 and parameters: {'lda_solver': 'svd', 'lda_n_components': 4}. Best is trial 0 with value: 0.707787.[0m
[32m[I 2022-10-26 07:33:14,508][0m Trial 64 finished with value: 0.7077867894758822 and parameters: {'lda_solver': 'eigen', 'lda_n_components': 4, 'lda_tol': 0.001}. Best is trial 0 with value: 0.707787.[0m
[32m[I 2022-10-26 07:33:15,706][0m Trial 67 finished with value: 0.7077867894758822 and parameters: {'lda_solver': 'eigen', 'lda_n_components': 4, 'lda_tol': 0.0001}. Best is trial 0 with value: 0.707787.[0m
[32m[I 2022-10-26 07:33:15,707][0m Trial 66 finished with value: 0.7077867894758822 and parameters: {'lda_solver': 'eigen', 'lda_n_components': 4, 'lda_tol': 0.0001}. Best is trial 0 with value: 0.707787.[0m
[32m[I 2022-10-26 07:33:16,802][0m Trial 68 finished with value: 0.7077867894758822 and parameters: {'lda_solver': 'eigen', 'lda_n_components': 6, 'lda_tol': 1e-05}. Best is trial 0 with value: 0.707787.[0m
[32m[I 2022-10-26 07:33:17,050][0m Trial 69 finished with value: 0.7077867894758822 and parameters: {'lda_solver': 'eigen', 'lda_n_components': 6, 'lda_tol': 1e-05}. Best is trial 0 with value: 0.707787.[0m
[32m[I 2022-10-26 07:33:17,120][0m Trial 70 finished with value: 0.7077867894758822 and parameters: {'lda_solver': 'eigen', 'lda_n_components': 6, 'lda_tol': 1e-05}. Best is trial 0 with value: 0.707787.[0m
[32m[I 2022-10-26 07:33:17,522][0m Trial 71 finished with value: 0.7077867894758822 and parameters: {'lda_solver': 'eigen', 'lda_n_components': 6, 'lda_tol': 1e-05}. Best is trial 0 with value: 0.707787.[0m
[32m[I 2022-10-26 07:33:18,742][0m Trial 72 finished with value: 0.7077867894758822 and parameters: {'lda_solver': 'eigen', 'lda_n_components': 6, 'lda_tol': 1e-05}. Best is trial 0 with value: 0.707787.[0m
[32m[I 2022-10-26 07:33:19,192][0m Trial 73 finished with value: 0.7077867894758822 and parameters: {'lda_solver': 'eigen', 'lda_n_components': 6, 'lda_tol': 1e-05}. Best is trial 0 with value: 0.707787.[0m
[32m[I 2022-10-26 07:33:20,472][0m Trial 74 finished with value: 0.7077867894758822 and parameters: {'lda_solver': 'eigen', 'lda_n_components': 3, 'lda_tol': 0.0001}. Best is trial 0 with value: 0.707787.[0m
[32m[I 2022-10-26 07:33:20,567][0m Trial 75 finished with value: 0.7077867894758822 and parameters: {'lda_solver': 'eigen', 'lda_n_components': 3, 'lda_tol': 0.0001}. Best is trial 0 with value: 0.707787.[0m
[32m[I 2022-10-26 07:33:21,185][0m Trial 76 finished with value: 0.7077867894758822 and parameters: {'lda_solver': 'eigen', 'lda_n_components': 3, 'lda_tol': 1e-05}. Best is trial 0 with value: 0.707787.[0m
[32m[I 2022-10-26 07:33:21,836][0m Trial 77 finished with value: 0.7077867894758822 and parameters: {'lda_solver': 'eigen', 'lda_n_components': 5, 'lda_tol': 1e-05}. Best is trial 0 with value: 0.707787.[0m
[32m[I 2022-10-26 07:33:22,131][0m Trial 78 finished with value: 0.7077867894758822 and parameters: {'lda_solver': 'eigen', 'lda_n_components': 3, 'lda_tol': 1e-05}. Best is trial 0 with value: 0.707787.[0m
[32m[I 2022-10-26 07:33:22,208][0m Trial 79 finished with value: 0.7077867894758822 and parameters: {'lda_solver': 'eigen', 'lda_n_components': 5, 'lda_tol': 1e-05}. Best is trial 0 with value: 0.707787.[0m
[32m[I 2022-10-26 07:33:23,314][0m Trial 80 finished with value: 0.7077867894758822 and parameters: {'lda_solver': 'eigen', 'lda_n_components': 5, 'lda_tol': 1e-05}. Best is trial 0 with value: 0.707787.[0m
[32m[I 2022-10-26 07:33:24,051][0m Trial 81 finished with value: 0.7077867894758822 and parameters: {'lda_solver': 'eigen', 'lda_n_components': 5, 'lda_tol': 1e-05}. Best is trial 0 with value: 0.707787.[0m
[32m[I 2022-10-26 07:33:25,003][0m Trial 82 finished with value: 0.7077867894758822 and parameters: {'lda_solver': 'eigen', 'lda_n_components': 5, 'lda_tol': 1e-05}. Best is trial 0 with value: 0.707787.[0m
[32m[I 2022-10-26 07:33:25,273][0m Trial 83 finished with value: 0.7077867894758822 and parameters: {'lda_solver': 'eigen', 'lda_n_components': 5, 'lda_tol': 1e-05}. Best is trial 0 with value: 0.707787.[0m
[32m[I 2022-10-26 07:33:25,792][0m Trial 84 finished with value: 0.7077867894758822 and parameters: {'lda_solver': 'eigen', 'lda_n_components': 5, 'lda_tol': 1e-05}. Best is trial 0 with value: 0.707787.[0m
[32m[I 2022-10-26 07:33:26,748][0m Trial 85 finished with value: 0.7077867894758822 and parameters: {'lda_solver': 'eigen', 'lda_n_components': 6, 'lda_tol': 1e-05}. Best is trial 0 with value: 0.707787.[0m
[32m[I 2022-10-26 07:33:27,085][0m Trial 86 finished with value: 0.7077867894758822 and parameters: {'lda_solver': 'eigen', 'lda_n_components': 6, 'lda_tol': 1e-05}. Best is trial 0 with value: 0.707787.[0m
[32m[I 2022-10-26 07:33:27,168][0m Trial 87 finished with value: 0.7077867894758822 and parameters: {'lda_solver': 'eigen', 'lda_n_components': 6, 'lda_tol': 1e-05}. Best is trial 0 with value: 0.707787.[0m
[32m[I 2022-10-26 07:33:27,962][0m Trial 88 finished with value: 0.7077867894758822 and parameters: {'lda_solver': 'eigen', 'lda_n_components': 7, 'lda_tol': 0.001}. Best is trial 0 with value: 0.707787.[0m
[32m[I 2022-10-26 07:33:28,735][0m Trial 89 finished with value: 0.7077867894758822 and parameters: {'lda_solver': 'eigen', 'lda_n_components': 7, 'lda_tol': 0.001}. Best is trial 0 with value: 0.707787.[0m
[32m[I 2022-10-26 07:33:29,658][0m Trial 90 finished with value: 0.7077867894758822 and parameters: {'lda_solver': 'eigen', 'lda_n_components': 7, 'lda_tol': 0.001}. Best is trial 0 with value: 0.707787.[0m
[32m[I 2022-10-26 07:33:30,093][0m Trial 91 finished with value: 0.7077867894758822 and parameters: {'lda_solver': 'eigen', 'lda_n_components': 7, 'lda_tol': 0.001}. Best is trial 0 with value: 0.707787.[0m
[32m[I 2022-10-26 07:33:30,520][0m Trial 92 finished with value: 0.7077867894758822 and parameters: {'lda_solver': 'eigen', 'lda_n_components': 7, 'lda_tol': 0.001}. Best is trial 0 with value: 0.707787.[0m
[32m[I 2022-10-26 07:33:31,297][0m Trial 93 finished with value: 0.7077867894758822 and parameters: {'lda_solver': 'eigen', 'lda_n_components': 7, 'lda_tol': 0.001}. Best is trial 0 with value: 0.707787.[0m
[32m[I 2022-10-26 07:33:31,650][0m Trial 95 finished with value: 0.7077867894758822 and parameters: {'lda_solver': 'eigen', 'lda_n_components': 7, 'lda_tol': 0.001}. Best is trial 0 with value: 0.707787.[0m
[32m[I 2022-10-26 07:33:31,651][0m Trial 94 finished with value: 0.7077867894758822 and parameters: {'lda_solver': 'eigen', 'lda_n_components': 7, 'lda_tol': 0.001}. Best is trial 0 with value: 0.707787.[0m
[32m[I 2022-10-26 07:33:31,992][0m Trial 96 finished with value: 0.7077867894758822 and parameters: {'lda_solver': 'eigen', 'lda_n_components': 7, 'lda_tol': 0.001}. Best is trial 0 with value: 0.707787.[0m
[32m[I 2022-10-26 07:33:32,476][0m Trial 97 finished with value: 0.7077867894758822 and parameters: {'lda_solver': 'eigen', 'lda_n_components': 4, 'lda_tol': 0.001}. Best is trial 0 with value: 0.707787.[0m
[32m[I 2022-10-26 07:33:32,902][0m Trial 98 finished with value: 0.7077867894758822 and parameters: {'lda_solver': 'eigen', 'lda_n_components': 7, 'lda_tol': 0.001}. Best is trial 0 with value: 0.707787.[0m
