[32m[I 2022-10-19 20:01:23,917][0m Trial 20 finished with value: 0.6950742018218817 and parameters: {'lsvc_ac2s_kernel_sample_steps': 2, 'lsvc_ac2s_dual': False, 'lsvc_ac2s_C': 3.803727990405049e-05, 'lsvc_ac2s_max_iter': 2000}. Best is trial 0 with value: 0.695074.[0m
[32m[I 2022-10-19 20:01:40,177][0m Trial 21 finished with value: 0.6950742018218817 and parameters: {'lsvc_ac2s_kernel_sample_steps': 2, 'lsvc_ac2s_dual': False, 'lsvc_ac2s_C': 0.009102468032317927, 'lsvc_ac2s_max_iter': 2000}. Best is trial 0 with value: 0.695074.[0m
[32m[I 2022-10-19 20:01:40,253][0m EarlyStopping exceeded for LinearSVC_AdditiveChi2Sampler; no new best scores on iters 20.[0m
[32m[I 2022-10-19 20:01:40,254][0m Study finished.[0m
[32m[I 2022-10-19 20:01:40,259][0m --------------------------------------------------------------------------------[0m
[32m[I 2022-10-19 20:01:40,259][0m --------------------           LinearSVC_Nystroem           --------------------[0m
[32m[I 2022-10-19 20:01:40,260][0m --------------------------------------------------------------------------------[0m
[32m[I 2022-10-19 20:01:40,286][0m A new study created in RDB with name: LinearSVC_Nystroem_e448dfef[0m
[32m[I 2022-10-19 20:01:40,292][0m Study started.[0m
[32m[I 2022-10-19 20:04:54,886][0m Trial 0 finished with value: 0.8229122926846603 and parameters: {'lsvc_nystroem_kernel_gamma': 13.207227107103751, 'lsvc_nystroem_kernel_n_components': 150, 'lsvc_nystroem_dual': False, 'lsvc_nystroem_C': 8.543009709143798e-05, 'lsvc_nystroem_max_iter': 2000}. Best is trial 0 with value: 0.822912.[0m
[32m[I 2022-10-19 23:03:51,964][0m Trial 1 finished with value: 0.8767606499654848 and parameters: {'lsvc_nystroem_kernel_gamma': 0.03996915244185587, 'lsvc_nystroem_kernel_n_components': 150, 'lsvc_nystroem_dual': False, 'lsvc_nystroem_C': 0.03706721753310935, 'lsvc_nystroem_max_iter': 2000}. Best is trial 1 with value: 0.876761.[0m
[32m[I 2022-10-19 23:05:50,706][0m Trial 2 finished with value: 0.7658681259337831 and parameters: {'lsvc_nystroem_kernel_gamma': 0.4092951619914069, 'lsvc_nystroem_kernel_n_components': 50, 'lsvc_nystroem_dual': False, 'lsvc_nystroem_C': 0.00033601694020032234, 'lsvc_nystroem_max_iter': 2000}. Best is trial 1 with value: 0.876761.[0m
[32m[I 2022-10-19 23:06:58,308][0m Trial 3 finished with value: 0.7890502141569177 and parameters: {'lsvc_nystroem_kernel_gamma': 1.961900429758939, 'lsvc_nystroem_kernel_n_components': 100, 'lsvc_nystroem_dual': False, 'lsvc_nystroem_C': 204.8657396227166, 'lsvc_nystroem_max_iter': 2000}. Best is trial 1 with value: 0.876761.[0m
[32m[I 2022-10-19 23:41:20,010][0m Trial 4 finished with value: 0.7890459054988699 and parameters: {'lsvc_nystroem_kernel_gamma': 0.6012993185044466, 'lsvc_nystroem_kernel_n_components': 100, 'lsvc_nystroem_dual': False, 'lsvc_nystroem_C': 0.007488848481784105, 'lsvc_nystroem_max_iter': 2000}. Best is trial 1 with value: 0.876761.[0m
[32m[I 2022-10-20 00:11:47,520][0m Trial 5 finished with value: 0.7658722580266725 and parameters: {'lsvc_nystroem_kernel_gamma': 83.27814583878715, 'lsvc_nystroem_kernel_n_components': 50, 'lsvc_nystroem_dual': False, 'lsvc_nystroem_C': 0.031452961921946694, 'lsvc_nystroem_max_iter': 2000}. Best is trial 1 with value: 0.876761.[0m
[32m[I 2022-10-20 00:11:47,598][0m Study finished.[0m
[32m[I 2022-10-20 00:11:47,602][0m --------------------------------------------------------------------------------[0m
[32m[I 2022-10-20 00:11:47,603][0m --------------------    LinearSVC_PolynomialCountSketch     --------------------[0m
[32m[I 2022-10-20 00:11:47,603][0m --------------------------------------------------------------------------------[0m
[32m[I 2022-10-20 00:11:47,630][0m A new study created in RDB with name: LinearSVC_PolynomialCountSketch_e448dfef[0m
[32m[I 2022-10-20 00:11:47,636][0m Study started.[0m
[32m[I 2022-10-20 00:11:59,557][0m Trial 0 finished with value: 0.4914377721466728 and parameters: {'lsvc_pcs_kernel_gamma': 0.020361321042833704, 'lsvc_pcs_kernel_n_components': 50, 'lsvc_pcs_degree': 2, 'lsvc_pcs_dual': False, 'lsvc_pcs_C': 650.4403094243144, 'lsvc_pcs_max_iter': 2000}. Best is trial 0 with value: 0.491438.[0m
[32m[I 2022-10-20 00:12:13,561][0m Trial 1 finished with value: 0.40559735438594013 and parameters: {'lsvc_pcs_kernel_gamma': 0.10845920601929049, 'lsvc_pcs_kernel_n_components': 100, 'lsvc_pcs_degree': 2, 'lsvc_pcs_dual': False, 'lsvc_pcs_C': 307.5012539900847, 'lsvc_pcs_max_iter': 2000}. Best is trial 0 with value: 0.491438.[0m
[32m[I 2022-10-20 00:12:42,201][0m Trial 2 finished with value: 0.6698312806391837 and parameters: {'lsvc_pcs_kernel_gamma': 33.02894866872318, 'lsvc_pcs_kernel_n_components': 150, 'lsvc_pcs_degree': 2, 'lsvc_pcs_dual': False, 'lsvc_pcs_C': 0.0005321687057644336, 'lsvc_pcs_max_iter': 2000}. Best is trial 2 with value: 0.669831.[0m
[32m[I 2022-10-20 00:12:54,107][0m Trial 3 finished with value: 0.18413114091368127 and parameters: {'lsvc_pcs_kernel_gamma': 319.0251505620509, 'lsvc_pcs_kernel_n_components': 50, 'lsvc_pcs_degree': 2, 'lsvc_pcs_dual': False, 'lsvc_pcs_C': 368.39781337997084, 'lsvc_pcs_max_iter': 2000}. Best is trial 2 with value: 0.669831.[0m
[32m[I 2022-10-20 00:13:22,711][0m Trial 4 finished with value: 0.5626486034504191 and parameters: {'lsvc_pcs_kernel_gamma': 0.0028561813249007484, 'lsvc_pcs_kernel_n_components': 150, 'lsvc_pcs_degree': 2, 'lsvc_pcs_dual': False, 'lsvc_pcs_C': 2.9445232303948735e-05, 'lsvc_pcs_max_iter': 2000}. Best is trial 2 with value: 0.669831.[0m
[32m[I 2022-10-20 00:13:51,124][0m Trial 5 finished with value: 0.3565865064813961 and parameters: {'lsvc_pcs_kernel_gamma': 0.4150595087157006, 'lsvc_pcs_kernel_n_components': 150, 'lsvc_pcs_degree': 2, 'lsvc_pcs_dual': False, 'lsvc_pcs_C': 0.003431314698874413, 'lsvc_pcs_max_iter': 2000}. Best is trial 2 with value: 0.669831.[0m
[32m[I 2022-10-20 00:14:02,997][0m Trial 6 finished with value: 0.5197666519491263 and parameters: {'lsvc_pcs_kernel_gamma': 0.019907062299492243, 'lsvc_pcs_kernel_n_components': 50, 'lsvc_pcs_degree': 2, 'lsvc_pcs_dual': False, 'lsvc_pcs_C': 0.0016083325272637798, 'lsvc_pcs_max_iter': 2000}. Best is trial 2 with value: 0.669831.[0m
[32m[I 2022-10-20 00:14:14,826][0m Trial 7 finished with value: 0.14767797951751194 and parameters: {'lsvc_pcs_kernel_gamma': 104.72337346379742, 'lsvc_pcs_kernel_n_components': 50, 'lsvc_pcs_degree': 2, 'lsvc_pcs_dual': False, 'lsvc_pcs_C': 1.1091686030828104e-05, 'lsvc_pcs_max_iter': 2000}. Best is trial 2 with value: 0.669831.[0m
[32m[I 2022-10-20 00:14:43,181][0m Trial 8 finished with value: 0.5569721905237601 and parameters: {'lsvc_pcs_kernel_gamma': 991.0711505808082, 'lsvc_pcs_kernel_n_components': 150, 'lsvc_pcs_degree': 2, 'lsvc_pcs_dual': False, 'lsvc_pcs_C': 4.836379684486713e-06, 'lsvc_pcs_max_iter': 2000}. Best is trial 2 with value: 0.669831.[0m
[32m[I 2022-10-20 00:14:56,866][0m Trial 9 finished with value: 0.1448440100314603 and parameters: {'lsvc_pcs_kernel_gamma': 1.1189594333689297, 'lsvc_pcs_kernel_n_components': 100, 'lsvc_pcs_degree': 2, 'lsvc_pcs_dual': False, 'lsvc_pcs_C': 2.041126886613245e-05, 'lsvc_pcs_max_iter': 2000}. Best is trial 2 with value: 0.669831.[0m
[32m[I 2022-10-20 00:15:25,451][0m Trial 10 finished with value: 0.5876910899467964 and parameters: {'lsvc_pcs_kernel_gamma': 27.79756834777356, 'lsvc_pcs_kernel_n_components': 150, 'lsvc_pcs_degree': 2, 'lsvc_pcs_dual': False, 'lsvc_pcs_C': 2.603990434893699, 'lsvc_pcs_max_iter': 2000}. Best is trial 2 with value: 0.669831.[0m
[32m[I 2022-10-20 00:15:53,942][0m Trial 11 finished with value: 0.5169670793465307 and parameters: {'lsvc_pcs_kernel_gamma': 15.67472740708316, 'lsvc_pcs_kernel_n_components': 150, 'lsvc_pcs_degree': 2, 'lsvc_pcs_dual': False, 'lsvc_pcs_C': 1.5437329862894447, 'lsvc_pcs_max_iter': 2000}. Best is trial 2 with value: 0.669831.[0m
[32m[I 2022-10-20 00:16:07,629][0m Trial 12 finished with value: 0.7080403257707859 and parameters: {'lsvc_pcs_kernel_gamma': 11.635268801835693, 'lsvc_pcs_kernel_n_components': 100, 'lsvc_pcs_degree': 2, 'lsvc_pcs_dual': False, 'lsvc_pcs_C': 2.8352758689385285, 'lsvc_pcs_max_iter': 2000}. Best is trial 12 with value: 0.70804.[0m
[32m[I 2022-10-20 00:16:21,327][0m Trial 13 finished with value: 0.14432591349402132 and parameters: {'lsvc_pcs_kernel_gamma': 4.4065125901306885, 'lsvc_pcs_kernel_n_components': 100, 'lsvc_pcs_degree': 2, 'lsvc_pcs_dual': False, 'lsvc_pcs_C': 0.6181151315092748, 'lsvc_pcs_max_iter': 2000}. Best is trial 12 with value: 0.70804.[0m
[32m[I 2022-10-20 00:16:35,025][0m Trial 14 finished with value: 0.14483183168772604 and parameters: {'lsvc_pcs_kernel_gamma': 5.0845374764354165, 'lsvc_pcs_kernel_n_components': 100, 'lsvc_pcs_degree': 2, 'lsvc_pcs_dual': False, 'lsvc_pcs_C': 0.05831869865937257, 'lsvc_pcs_max_iter': 2000}. Best is trial 12 with value: 0.70804.[0m
[32m[I 2022-10-20 00:16:48,709][0m Trial 15 finished with value: 0.7080176044829145 and parameters: {'lsvc_pcs_kernel_gamma': 51.54712069084996, 'lsvc_pcs_kernel_n_components': 100, 'lsvc_pcs_degree': 2, 'lsvc_pcs_dual': False, 'lsvc_pcs_C': 0.0003402881007275871, 'lsvc_pcs_max_iter': 2000}. Best is trial 12 with value: 0.70804.[0m
[32m[I 2022-10-20 00:17:02,368][0m Trial 16 finished with value: 0.7094861655598441 and parameters: {'lsvc_pcs_kernel_gamma': 159.3482572087891, 'lsvc_pcs_kernel_n_components': 100, 'lsvc_pcs_degree': 2, 'lsvc_pcs_dual': False, 'lsvc_pcs_C': 16.7441684635448, 'lsvc_pcs_max_iter': 2000}. Best is trial 16 with value: 0.709486.[0m
[32m[I 2022-10-20 00:17:16,348][0m Trial 17 finished with value: 0.7087735455428305 and parameters: {'lsvc_pcs_kernel_gamma': 237.783585702552, 'lsvc_pcs_kernel_n_components': 100, 'lsvc_pcs_degree': 2, 'lsvc_pcs_dual': False, 'lsvc_pcs_C': 21.12422056974265, 'lsvc_pcs_max_iter': 2000}. Best is trial 16 with value: 0.709486.[0m
[32m[I 2022-10-20 00:17:30,240][0m Trial 18 finished with value: 0.4099772289781089 and parameters: {'lsvc_pcs_kernel_gamma': 107.97581320067704, 'lsvc_pcs_kernel_n_components': 100, 'lsvc_pcs_degree': 2, 'lsvc_pcs_dual': False, 'lsvc_pcs_C': 39.23065366332819, 'lsvc_pcs_max_iter': 2000}. Best is trial 16 with value: 0.709486.[0m
[32m[I 2022-10-20 00:17:43,943][0m Trial 19 finished with value: 0.7034128684822833 and parameters: {'lsvc_pcs_kernel_gamma': 804.5902450123791, 'lsvc_pcs_kernel_n_components': 100, 'lsvc_pcs_degree': 2, 'lsvc_pcs_dual': False, 'lsvc_pcs_C': 27.91122906477519, 'lsvc_pcs_max_iter': 2000}. Best is trial 16 with value: 0.709486.[0m
[32m[I 2022-10-20 00:17:55,834][0m Trial 20 finished with value: 0.30970354475099887 and parameters: {'lsvc_pcs_kernel_gamma': 186.0304523092194, 'lsvc_pcs_kernel_n_components': 50, 'lsvc_pcs_degree': 2, 'lsvc_pcs_dual': False, 'lsvc_pcs_C': 0.13570217903850834, 'lsvc_pcs_max_iter': 2000}. Best is trial 16 with value: 0.709486.[0m
[32m[I 2022-10-20 00:18:10,050][0m Trial 21 finished with value: 0.40693427089918577 and parameters: {'lsvc_pcs_kernel_gamma': 6.8734172356976675, 'lsvc_pcs_kernel_n_components': 100, 'lsvc_pcs_degree': 2, 'lsvc_pcs_dual': False, 'lsvc_pcs_C': 33.38943587588215, 'lsvc_pcs_max_iter': 2000}. Best is trial 16 with value: 0.709486.[0m
[32m[I 2022-10-20 00:18:23,950][0m Trial 22 finished with value: 0.14428984338426465 and parameters: {'lsvc_pcs_kernel_gamma': 323.91867395662536, 'lsvc_pcs_kernel_n_components': 100, 'lsvc_pcs_degree': 2, 'lsvc_pcs_dual': False, 'lsvc_pcs_C': 5.884291406494386, 'lsvc_pcs_max_iter': 2000}. Best is trial 16 with value: 0.709486.[0m
[32m[I 2022-10-20 00:18:24,031][0m EarlyStopping exceeded for LinearSVC_PolynomialCountSketch; no new best scores on iters 20.[0m
[32m[I 2022-10-20 00:18:24,032][0m Study finished.[0m
[32m[I 2022-10-20 00:18:24,038][0m --------------------------------------------------------------------------------[0m
[32m[I 2022-10-20 00:18:24,038][0m --------------------          LinearSVC_RBFSampler          --------------------[0m
[32m[I 2022-10-20 00:18:24,039][0m --------------------------------------------------------------------------------[0m
[32m[I 2022-10-20 00:18:24,075][0m A new study created in RDB with name: LinearSVC_RBFSampler_e448dfef[0m
[32m[I 2022-10-20 00:18:24,082][0m Study started.[0m
[32m[I 2022-10-20 00:31:13,974][0m Trial 0 finished with value: 0.9195888686179043 and parameters: {'lsvc_rbfs_kernel_gamma': 15.709413470282259, 'lsvc_rbfs_kernel_n_components': 150, 'lsvc_rbfs_dual': False, 'lsvc_rbfs_C': 41.593317555947266, 'lsvc_rbfs_max_iter': 2000}. Best is trial 0 with value: 0.919589.[0m
[32m[I 2022-10-20 00:34:48,747][0m Trial 1 finished with value: 0.8837571095999686 and parameters: {'lsvc_rbfs_kernel_gamma': 0.001625704282100147, 'lsvc_rbfs_kernel_n_components': 100, 'lsvc_rbfs_dual': False, 'lsvc_rbfs_C': 7.01079470571401e-05, 'lsvc_rbfs_max_iter': 2000}. Best is trial 0 with value: 0.919589.[0m
[32m[I 2022-10-20 00:41:19,780][0m Trial 2 finished with value: 0.9122009337393634 and parameters: {'lsvc_rbfs_kernel_gamma': 0.28540725698905545, 'lsvc_rbfs_kernel_n_components': 100, 'lsvc_rbfs_dual': False, 'lsvc_rbfs_C': 16.67194380246213, 'lsvc_rbfs_max_iter': 2000}. Best is trial 0 with value: 0.919589.[0m
[32m[I 2022-10-20 00:47:47,415][0m Trial 3 finished with value: 0.9112890442859182 and parameters: {'lsvc_rbfs_kernel_gamma': 3.4257034293226236, 'lsvc_rbfs_kernel_n_components': 100, 'lsvc_rbfs_dual': False, 'lsvc_rbfs_C': 0.6568631148278964, 'lsvc_rbfs_max_iter': 2000}. Best is trial 0 with value: 0.919589.[0m
[32m[I 2022-10-20 00:54:03,350][0m Trial 4 finished with value: 0.914652488206502 and parameters: {'lsvc_rbfs_kernel_gamma': 7.374068448396177, 'lsvc_rbfs_kernel_n_components': 100, 'lsvc_rbfs_dual': False, 'lsvc_rbfs_C': 656.3373677666139, 'lsvc_rbfs_max_iter': 2000}. Best is trial 0 with value: 0.919589.[0m
[32m[I 2022-10-20 01:01:26,657][0m Trial 5 finished with value: 0.9167196989221034 and parameters: {'lsvc_rbfs_kernel_gamma': 0.16540471772134452, 'lsvc_rbfs_kernel_n_components': 100, 'lsvc_rbfs_dual': False, 'lsvc_rbfs_C': 7.665363914001169, 'lsvc_rbfs_max_iter': 2000}. Best is trial 0 with value: 0.919589.[0m
[32m[I 2022-10-20 01:08:54,100][0m Trial 6 finished with value: 0.9148022037681264 and parameters: {'lsvc_rbfs_kernel_gamma': 940.8460329987766, 'lsvc_rbfs_kernel_n_components': 100, 'lsvc_rbfs_dual': False, 'lsvc_rbfs_C': 0.07387899332836186, 'lsvc_rbfs_max_iter': 2000}. Best is trial 0 with value: 0.919589.[0m
[32m[I 2022-10-20 01:12:29,874][0m Trial 7 finished with value: 0.8849812047133258 and parameters: {'lsvc_rbfs_kernel_gamma': 33.02722526691286, 'lsvc_rbfs_kernel_n_components': 50, 'lsvc_rbfs_dual': False, 'lsvc_rbfs_C': 141.712267751254, 'lsvc_rbfs_max_iter': 2000}. Best is trial 0 with value: 0.919589.[0m
[32m[I 2022-10-20 01:14:04,545][0m Trial 8 finished with value: 0.8082582226380535 and parameters: {'lsvc_rbfs_kernel_gamma': 29.478186985249575, 'lsvc_rbfs_kernel_n_components': 50, 'lsvc_rbfs_dual': False, 'lsvc_rbfs_C': 3.1322999458966194e-05, 'lsvc_rbfs_max_iter': 2000}. Best is trial 0 with value: 0.919589.[0m
[32m[I 2022-10-20 01:25:02,382][0m Trial 9 finished with value: 0.9258655755935468 and parameters: {'lsvc_rbfs_kernel_gamma': 0.13549074317714463, 'lsvc_rbfs_kernel_n_components': 150, 'lsvc_rbfs_dual': False, 'lsvc_rbfs_C': 4.796113508005818, 'lsvc_rbfs_max_iter': 2000}. Best is trial 9 with value: 0.925866.[0m
[32m[I 2022-10-20 01:35:38,180][0m Trial 10 finished with value: 0.9189391443059632 and parameters: {'lsvc_rbfs_kernel_gamma': 0.009609454315704206, 'lsvc_rbfs_kernel_n_components': 150, 'lsvc_rbfs_dual': False, 'lsvc_rbfs_C': 0.0027825408115473528, 'lsvc_rbfs_max_iter': 2000}. Best is trial 9 with value: 0.925866.[0m
[32m[I 2022-10-20 01:50:34,466][0m Trial 11 finished with value: 0.9202930048557556 and parameters: {'lsvc_rbfs_kernel_gamma': 0.09777374916738782, 'lsvc_rbfs_kernel_n_components': 150, 'lsvc_rbfs_dual': False, 'lsvc_rbfs_C': 1.8089328290004827, 'lsvc_rbfs_max_iter': 2000}. Best is trial 9 with value: 0.925866.[0m
[32m[I 2022-10-20 02:00:51,995][0m Trial 12 finished with value: 0.9229528350254529 and parameters: {'lsvc_rbfs_kernel_gamma': 0.03794275352726504, 'lsvc_rbfs_kernel_n_components': 150, 'lsvc_rbfs_dual': False, 'lsvc_rbfs_C': 0.38330482425229295, 'lsvc_rbfs_max_iter': 2000}. Best is trial 9 with value: 0.925866.[0m
[32m[I 2022-10-20 02:13:22,824][0m Trial 13 finished with value: 0.9205489269674647 and parameters: {'lsvc_rbfs_kernel_gamma': 0.009495779485121553, 'lsvc_rbfs_kernel_n_components': 150, 'lsvc_rbfs_dual': False, 'lsvc_rbfs_C': 0.018816665066643524, 'lsvc_rbfs_max_iter': 2000}. Best is trial 9 with value: 0.925866.[0m
[32m[I 2022-10-20 02:24:05,468][0m Trial 14 finished with value: 0.9269737553438464 and parameters: {'lsvc_rbfs_kernel_gamma': 0.022274093626926332, 'lsvc_rbfs_kernel_n_components': 150, 'lsvc_rbfs_dual': False, 'lsvc_rbfs_C': 0.11623716894435461, 'lsvc_rbfs_max_iter': 2000}. Best is trial 14 with value: 0.926974.[0m
[32m[I 2022-10-20 02:30:32,420][0m Trial 15 finished with value: 0.9296269641131181 and parameters: {'lsvc_rbfs_kernel_gamma': 0.8361764714503086, 'lsvc_rbfs_kernel_n_components': 150, 'lsvc_rbfs_dual': False, 'lsvc_rbfs_C': 0.0018634722810028598, 'lsvc_rbfs_max_iter': 2000}. Best is trial 15 with value: 0.929627.[0m
[32m[I 2022-10-20 02:38:49,971][0m Trial 16 finished with value: 0.9157243460814832 and parameters: {'lsvc_rbfs_kernel_gamma': 1.1165657227770094, 'lsvc_rbfs_kernel_n_components': 150, 'lsvc_rbfs_dual': False, 'lsvc_rbfs_C': 0.0008520684139930554, 'lsvc_rbfs_max_iter': 2000}. Best is trial 15 with value: 0.929627.[0m
[32m[I 2022-10-20 02:41:08,111][0m Trial 17 finished with value: 0.6950742018218817 and parameters: {'lsvc_rbfs_kernel_gamma': 0.0012925596239519274, 'lsvc_rbfs_kernel_n_components': 150, 'lsvc_rbfs_dual': False, 'lsvc_rbfs_C': 6.26415125661556e-06, 'lsvc_rbfs_max_iter': 2000}. Best is trial 15 with value: 0.929627.[0m
[32m[I 2022-10-20 02:52:30,278][0m Trial 18 finished with value: 0.910938610806896 and parameters: {'lsvc_rbfs_kernel_gamma': 226.19180406069748, 'lsvc_rbfs_kernel_n_components': 150, 'lsvc_rbfs_dual': False, 'lsvc_rbfs_C': 0.0008364195596330215, 'lsvc_rbfs_max_iter': 2000}. Best is trial 15 with value: 0.929627.[0m
[32m[I 2022-10-20 02:54:43,181][0m Trial 19 finished with value: 0.8674351940070297 and parameters: {'lsvc_rbfs_kernel_gamma': 1.3474553480203246, 'lsvc_rbfs_kernel_n_components': 50, 'lsvc_rbfs_dual': False, 'lsvc_rbfs_C': 0.013126647011179928, 'lsvc_rbfs_max_iter': 2000}. Best is trial 15 with value: 0.929627.[0m
[32m[I 2022-10-20 03:08:30,034][0m Trial 20 finished with value: 0.9308274021539176 and parameters: {'lsvc_rbfs_kernel_gamma': 0.020921708948883035, 'lsvc_rbfs_kernel_n_components': 150, 'lsvc_rbfs_dual': False, 'lsvc_rbfs_C': 0.07659118103155191, 'lsvc_rbfs_max_iter': 2000}. Best is trial 20 with value: 0.930827.[0m
[32m[I 2022-10-20 03:29:34,713][0m Trial 21 finished with value: 0.9237148640567988 and parameters: {'lsvc_rbfs_kernel_gamma': 0.01651140513053891, 'lsvc_rbfs_kernel_n_components': 150, 'lsvc_rbfs_dual': False, 'lsvc_rbfs_C': 0.07625210727188042, 'lsvc_rbfs_max_iter': 2000}. Best is trial 20 with value: 0.930827.[0m
[32m[I 2022-10-20 03:29:34,807][0m EarlyStopping exceeded for LinearSVC_RBFSampler; no new best scores on iters 20.[0m
[32m[I 2022-10-20 03:29:34,807][0m Study finished.[0m
[32m[I 2022-10-20 03:29:34,814][0m --------------------------------------------------------------------------------[0m
[32m[I 2022-10-20 03:29:34,814][0m --------------------             MLPClassifier              --------------------[0m
[32m[I 2022-10-20 03:29:34,815][0m --------------------------------------------------------------------------------[0m
[32m[I 2022-10-20 03:29:34,848][0m A new study created in RDB with name: MLPClassifier_e448dfef[0m
[32m[I 2022-10-20 03:29:34,854][0m Study started.[0m
[32m[I 2022-10-20 03:29:35,390][0m sklearn.model_selection.train_test_split: running accelerated version on CPU[0m
[32m[I 2022-10-20 03:29:35,420][0m sklearn.model_selection.train_test_split: running accelerated version on CPU[0m
[32m[I 2022-10-20 03:29:35,450][0m sklearn.model_selection.train_test_split: running accelerated version on CPU[0m
[32m[I 2022-10-20 03:29:35,481][0m sklearn.model_selection.train_test_split: running accelerated version on CPU[0m
[32m[I 2022-10-20 03:29:35,506][0m sklearn.model_selection.train_test_split: running accelerated version on CPU[0m
[32m[I 2022-10-20 03:29:35,545][0m sklearn.model_selection.train_test_split: fallback to original Scikit-learn[0m
[32m[I 2022-10-20 03:29:35,598][0m sklearn.model_selection.train_test_split: fallback to original Scikit-learn[0m
[32m[I 2022-10-20 03:29:35,599][0m sklearn.model_selection.train_test_split: running accelerated version on CPU[0m
[32m[I 2022-10-20 03:29:35,631][0m sklearn.model_selection.train_test_split: fallback to original Scikit-learn[0m
[32m[I 2022-10-20 03:29:35,658][0m sklearn.model_selection.train_test_split: fallback to original Scikit-learn[0m
[32m[I 2022-10-20 03:29:35,697][0m sklearn.model_selection.train_test_split: fallback to original Scikit-learn[0m
[32m[I 2022-10-20 03:29:35,743][0m sklearn.model_selection.train_test_split: fallback to original Scikit-learn[0m
[32m[I 2022-10-20 03:29:35,821][0m sklearn.model_selection.train_test_split: running accelerated version on CPU[0m
[32m[I 2022-10-20 03:29:35,859][0m sklearn.model_selection.train_test_split: fallback to original Scikit-learn[0m
[32m[I 2022-10-20 03:29:35,913][0m sklearn.model_selection.train_test_split: running accelerated version on CPU[0m
[32m[I 2022-10-20 03:29:35,941][0m sklearn.model_selection.train_test_split: fallback to original Scikit-learn[0m
