[32m[I 2022-10-20 12:59:04,276][0m Trial 22 finished with value: 0.9966000544984178 and parameters: {'xgbc_n_estimators': 200, 'xgbc_use_label_encoder': False, 'xgbc_learning_rate': 0.0005868863102638058, 'xgbc_booster': 'dart', 'xgbc_gamma': 1.1055162653426252e-05}. Best is trial 14 with value: 0.999988.[0m
[32m[I 2022-10-20 12:59:04,365][0m Study finished.[0m
[32m[I 2022-10-20 12:59:05,220][0m Optimization finished.[0m
