[32m[I 2022-10-20 05:28:44,576][0m Trial 20 finished with value: 0.7151459168063034 and parameters: {'sgdc_loss': 'modified_huber', 'sgdc_penalty': 'elasticnet', 'sgdc_alpha': 1.412389912001829e-06, 'sgdc_l1_ratio': 0.2, 'sgdc_learning_rate': 'adaptive', 'sgdc_eta0': 124.523528949167, 'sgdc_early_stopping': True, 'sgdc_validation_fraction': 0.25, 'sgdc_n_iter_no_change': 10}. Best is trial 24 with value: 0.744177.[0m
[32m[I 2022-10-20 05:29:03,720][0m Trial 27 finished with value: 0.1468578070101746 and parameters: {'sgdc_loss': 'squared_hinge', 'sgdc_penalty': 'elasticnet', 'sgdc_alpha': 2.0727028173174094e-05, 'sgdc_l1_ratio': 0.6000000000000001, 'sgdc_learning_rate': 'optimal', 'sgdc_eta0': 0.06598942577886188, 'sgdc_early_stopping': True, 'sgdc_validation_fraction': 0.25, 'sgdc_n_iter_no_change': 10}. Best is trial 24 with value: 0.744177.[0m
[32m[I 2022-10-20 05:29:07,981][0m Trial 29 finished with value: 0.14513124498233415 and parameters: {'sgdc_loss': 'modified_huber', 'sgdc_penalty': 'elasticnet', 'sgdc_alpha': 1.8470967732694226e-05, 'sgdc_l1_ratio': 0.6000000000000001, 'sgdc_learning_rate': 'optimal', 'sgdc_eta0': 709.6954705016944, 'sgdc_early_stopping': True, 'sgdc_validation_fraction': 0.25, 'sgdc_n_iter_no_change': 10}. Best is trial 24 with value: 0.744177.[0m
[32m[I 2022-10-20 05:30:50,001][0m Trial 23 finished with value: 0.6966799442244574 and parameters: {'sgdc_loss': 'modified_huber', 'sgdc_penalty': 'elasticnet', 'sgdc_alpha': 0.8858968244752586, 'sgdc_l1_ratio': 0.6000000000000001, 'sgdc_learning_rate': 'adaptive', 'sgdc_eta0': 0.35165999966762684, 'sgdc_early_stopping': True, 'sgdc_validation_fraction': 0.25, 'sgdc_n_iter_no_change': 10}. Best is trial 24 with value: 0.744177.[0m
[32m[I 2022-10-20 05:31:25,770][0m Trial 26 finished with value: 0.7021292889867147 and parameters: {'sgdc_loss': 'squared_hinge', 'sgdc_penalty': 'elasticnet', 'sgdc_alpha': 0.2584463936819438, 'sgdc_l1_ratio': 0.6000000000000001, 'sgdc_learning_rate': 'adaptive', 'sgdc_eta0': 0.06907906785160663, 'sgdc_early_stopping': True, 'sgdc_validation_fraction': 0.25, 'sgdc_n_iter_no_change': 10}. Best is trial 24 with value: 0.744177.[0m
[32m[I 2022-10-20 05:33:46,002][0m Trial 28 finished with value: 0.6938694982011979 and parameters: {'sgdc_loss': 'modified_huber', 'sgdc_penalty': 'elasticnet', 'sgdc_alpha': 1.8659303070642874e-05, 'sgdc_l1_ratio': 0.6000000000000001, 'sgdc_learning_rate': 'adaptive', 'sgdc_eta0': 548.767494722451, 'sgdc_early_stopping': True, 'sgdc_validation_fraction': 0.25, 'sgdc_n_iter_no_change': 10}. Best is trial 24 with value: 0.744177.[0m
[32m[I 2022-10-20 05:33:46,085][0m EarlyStopping exceeded for SGDClassifier; no new best scores on iters 20.[0m
[32m[I 2022-10-20 05:33:46,086][0m Study finished.[0m
[32m[I 2022-10-20 05:33:46,094][0m --------------------------------------------------------------------------------[0m
[32m[I 2022-10-20 05:33:46,094][0m --------------------    VeryFastDecisionRulesClassifier     --------------------[0m
[32m[I 2022-10-20 05:33:46,095][0m --------------------------------------------------------------------------------[0m
[32m[I 2022-10-20 05:33:46,119][0m A new study created in RDB with name: VeryFastDecisionRulesClassifier_e448dfef[0m
[32m[I 2022-10-20 05:33:46,126][0m Study started.[0m
[32m[I 2022-10-20 05:46:57,949][0m Trial 6 finished with value: 0.07516908231374075 and parameters: {'vfdrc_ordered_rules': False, 'vfdrc_grace_period': 250, 'vfdrc_tie_threshold': 0.0, 'vfdrc_rule_prediction': 'weighted_sum', 'vfdrc_max_rules': 20, 'vfdrc_expand_criterion': 'info_gain', 'vfdrc_remove_poor_atts': True}. Best is trial 6 with value: 0.0751691.[0m
[32m[I 2022-10-20 05:47:21,630][0m Trial 0 finished with value: 0.6486537428018704 and parameters: {'vfdrc_ordered_rules': True, 'vfdrc_grace_period': 250, 'vfdrc_tie_threshold': 0.4, 'vfdrc_rule_prediction': 'first_hit', 'vfdrc_max_rules': 40, 'vfdrc_expand_criterion': 'info_gain', 'vfdrc_remove_poor_atts': False}. Best is trial 0 with value: 0.648654.[0m
[32m[I 2022-10-20 05:47:22,342][0m Trial 1 finished with value: 0.08440942596015012 and parameters: {'vfdrc_ordered_rules': False, 'vfdrc_grace_period': 100, 'vfdrc_tie_threshold': 0.0, 'vfdrc_rule_prediction': 'first_hit', 'vfdrc_max_rules': 30, 'vfdrc_expand_criterion': 'info_gain', 'vfdrc_remove_poor_atts': True}. Best is trial 0 with value: 0.648654.[0m
[32m[I 2022-10-20 05:48:45,697][0m Trial 3 finished with value: 0.2179471349881182 and parameters: {'vfdrc_ordered_rules': False, 'vfdrc_grace_period': 150, 'vfdrc_tie_threshold': 0.9500000000000001, 'vfdrc_rule_prediction': 'weighted_max', 'vfdrc_max_rules': 35, 'vfdrc_expand_criterion': 'foil_gain', 'vfdrc_remove_poor_atts': True}. Best is trial 0 with value: 0.648654.[0m
[32m[I 2022-10-20 05:49:13,677][0m Trial 5 finished with value: 0.5284629695669574 and parameters: {'vfdrc_ordered_rules': True, 'vfdrc_grace_period': 400, 'vfdrc_tie_threshold': 0.15000000000000002, 'vfdrc_rule_prediction': 'weighted_max', 'vfdrc_max_rules': 40, 'vfdrc_expand_criterion': 'foil_gain', 'vfdrc_remove_poor_atts': False}. Best is trial 0 with value: 0.648654.[0m
[32m[I 2022-10-20 05:49:31,990][0m Trial 2 finished with value: 0.09345687129838284 and parameters: {'vfdrc_ordered_rules': False, 'vfdrc_grace_period': 350, 'vfdrc_tie_threshold': 1.0, 'vfdrc_rule_prediction': 'weighted_sum', 'vfdrc_max_rules': 20, 'vfdrc_expand_criterion': 'foil_gain', 'vfdrc_remove_poor_atts': True}. Best is trial 0 with value: 0.648654.[0m
[32m[I 2022-10-20 05:52:22,258][0m Trial 4 finished with value: 0.21576572086298187 and parameters: {'vfdrc_ordered_rules': False, 'vfdrc_grace_period': 150, 'vfdrc_tie_threshold': 0.65, 'vfdrc_rule_prediction': 'first_hit', 'vfdrc_max_rules': 30, 'vfdrc_expand_criterion': 'foil_gain', 'vfdrc_remove_poor_atts': True}. Best is trial 0 with value: 0.648654.[0m
[32m[I 2022-10-20 05:56:04,532][0m Trial 7 finished with value: 0.2128861681612872 and parameters: {'vfdrc_ordered_rules': False, 'vfdrc_grace_period': 400, 'vfdrc_tie_threshold': 0.8500000000000001, 'vfdrc_rule_prediction': 'weighted_max', 'vfdrc_max_rules': 40, 'vfdrc_expand_criterion': 'foil_gain', 'vfdrc_remove_poor_atts': False}. Best is trial 0 with value: 0.648654.[0m
[32m[I 2022-10-20 05:59:34,534][0m Trial 8 finished with value: 0.8993822420218973 and parameters: {'vfdrc_ordered_rules': True, 'vfdrc_grace_period': 200, 'vfdrc_tie_threshold': 0.0, 'vfdrc_rule_prediction': 'weighted_sum', 'vfdrc_max_rules': 30, 'vfdrc_expand_criterion': 'info_gain', 'vfdrc_remove_poor_atts': False}. Best is trial 8 with value: 0.899382.[0m
[32m[I 2022-10-20 06:00:48,782][0m Trial 9 finished with value: 0.42307498620620754 and parameters: {'vfdrc_ordered_rules': False, 'vfdrc_grace_period': 150, 'vfdrc_tie_threshold': 0.05, 'vfdrc_rule_prediction': 'weighted_max', 'vfdrc_max_rules': 30, 'vfdrc_expand_criterion': 'foil_gain', 'vfdrc_remove_poor_atts': True}. Best is trial 8 with value: 0.899382.[0m
[32m[I 2022-10-20 06:01:11,985][0m Trial 10 finished with value: 0.5151550718465102 and parameters: {'vfdrc_ordered_rules': False, 'vfdrc_grace_period': 150, 'vfdrc_tie_threshold': 0.25, 'vfdrc_rule_prediction': 'weighted_max', 'vfdrc_max_rules': 20, 'vfdrc_expand_criterion': 'info_gain', 'vfdrc_remove_poor_atts': True}. Best is trial 8 with value: 0.899382.[0m
[32m[I 2022-10-20 06:02:18,172][0m Trial 11 finished with value: 0.26521291444370754 and parameters: {'vfdrc_ordered_rules': True, 'vfdrc_grace_period': 100, 'vfdrc_tie_threshold': 0.9, 'vfdrc_rule_prediction': 'first_hit', 'vfdrc_max_rules': 30, 'vfdrc_expand_criterion': 'hellinger', 'vfdrc_remove_poor_atts': False}. Best is trial 8 with value: 0.899382.[0m
[32m[I 2022-10-20 06:02:27,427][0m Trial 12 finished with value: 0.31806282780145534 and parameters: {'vfdrc_ordered_rules': True, 'vfdrc_grace_period': 200, 'vfdrc_tie_threshold': 0.6000000000000001, 'vfdrc_rule_prediction': 'weighted_sum', 'vfdrc_max_rules': 10, 'vfdrc_expand_criterion': 'info_gain', 'vfdrc_remove_poor_atts': False}. Best is trial 8 with value: 0.899382.[0m
[32m[I 2022-10-20 06:03:10,624][0m Trial 14 finished with value: 0.2231276110599808 and parameters: {'vfdrc_ordered_rules': False, 'vfdrc_grace_period': 250, 'vfdrc_tie_threshold': 0.05, 'vfdrc_rule_prediction': 'weighted_max', 'vfdrc_max_rules': 10, 'vfdrc_expand_criterion': 'foil_gain', 'vfdrc_remove_poor_atts': False}. Best is trial 8 with value: 0.899382.[0m
[32m[I 2022-10-20 06:04:26,023][0m Trial 13 finished with value: 0.1564163615984132 and parameters: {'vfdrc_ordered_rules': False, 'vfdrc_grace_period': 200, 'vfdrc_tie_threshold': 0.35000000000000003, 'vfdrc_rule_prediction': 'weighted_max', 'vfdrc_max_rules': 25, 'vfdrc_expand_criterion': 'foil_gain', 'vfdrc_remove_poor_atts': True}. Best is trial 8 with value: 0.899382.[0m
[32m[I 2022-10-20 06:09:36,497][0m Trial 15 finished with value: 0.0835482056411327 and parameters: {'vfdrc_ordered_rules': False, 'vfdrc_grace_period': 200, 'vfdrc_tie_threshold': 0.4, 'vfdrc_rule_prediction': 'weighted_sum', 'vfdrc_max_rules': 35, 'vfdrc_expand_criterion': 'hellinger', 'vfdrc_remove_poor_atts': True}. Best is trial 8 with value: 0.899382.[0m
[32m[I 2022-10-20 06:11:05,435][0m Trial 16 finished with value: 0.296070218432906 and parameters: {'vfdrc_ordered_rules': True, 'vfdrc_grace_period': 200, 'vfdrc_tie_threshold': 0.15000000000000002, 'vfdrc_rule_prediction': 'weighted_sum', 'vfdrc_max_rules': 15, 'vfdrc_expand_criterion': 'hellinger', 'vfdrc_remove_poor_atts': False}. Best is trial 8 with value: 0.899382.[0m
[32m[I 2022-10-20 06:11:16,043][0m Trial 17 finished with value: 0.1437037760778762 and parameters: {'vfdrc_ordered_rules': True, 'vfdrc_grace_period': 300, 'vfdrc_tie_threshold': 0.30000000000000004, 'vfdrc_rule_prediction': 'weighted_sum', 'vfdrc_max_rules': 10, 'vfdrc_expand_criterion': 'hellinger', 'vfdrc_remove_poor_atts': False}. Best is trial 8 with value: 0.899382.[0m
[32m[I 2022-10-20 06:13:03,030][0m Trial 21 finished with value: 0.7673190218053597 and parameters: {'vfdrc_ordered_rules': True, 'vfdrc_grace_period': 300, 'vfdrc_tie_threshold': 0.35000000000000003, 'vfdrc_rule_prediction': 'first_hit', 'vfdrc_max_rules': 35, 'vfdrc_expand_criterion': 'info_gain', 'vfdrc_remove_poor_atts': False}. Best is trial 8 with value: 0.899382.[0m
[32m[I 2022-10-20 06:13:45,324][0m Trial 20 finished with value: 0.7775800342288711 and parameters: {'vfdrc_ordered_rules': True, 'vfdrc_grace_period': 300, 'vfdrc_tie_threshold': 0.4, 'vfdrc_rule_prediction': 'first_hit', 'vfdrc_max_rules': 40, 'vfdrc_expand_criterion': 'info_gain', 'vfdrc_remove_poor_atts': False}. Best is trial 8 with value: 0.899382.[0m
[32m[I 2022-10-20 06:14:48,975][0m Trial 18 finished with value: 0.29586348771038584 and parameters: {'vfdrc_ordered_rules': True, 'vfdrc_grace_period': 250, 'vfdrc_tie_threshold': 0.4, 'vfdrc_rule_prediction': 'first_hit', 'vfdrc_max_rules': 35, 'vfdrc_expand_criterion': 'hellinger', 'vfdrc_remove_poor_atts': False}. Best is trial 8 with value: 0.899382.[0m
[32m[I 2022-10-20 06:15:59,488][0m Trial 22 finished with value: 0.7765528756706428 and parameters: {'vfdrc_ordered_rules': True, 'vfdrc_grace_period': 300, 'vfdrc_tie_threshold': 0.4, 'vfdrc_rule_prediction': 'weighted_sum', 'vfdrc_max_rules': 35, 'vfdrc_expand_criterion': 'info_gain', 'vfdrc_remove_poor_atts': False}. Best is trial 8 with value: 0.899382.[0m
[32m[I 2022-10-20 06:16:15,112][0m Trial 19 finished with value: 0.6486537428018704 and parameters: {'vfdrc_ordered_rules': True, 'vfdrc_grace_period': 250, 'vfdrc_tie_threshold': 0.4, 'vfdrc_rule_prediction': 'first_hit', 'vfdrc_max_rules': 40, 'vfdrc_expand_criterion': 'info_gain', 'vfdrc_remove_poor_atts': False}. Best is trial 8 with value: 0.899382.[0m
[32m[I 2022-10-20 06:18:56,914][0m Trial 23 finished with value: 0.7648492547162384 and parameters: {'vfdrc_ordered_rules': True, 'vfdrc_grace_period': 300, 'vfdrc_tie_threshold': 0.5, 'vfdrc_rule_prediction': 'first_hit', 'vfdrc_max_rules': 40, 'vfdrc_expand_criterion': 'info_gain', 'vfdrc_remove_poor_atts': False}. Best is trial 8 with value: 0.899382.[0m
[32m[I 2022-10-20 06:19:03,750][0m Trial 25 finished with value: 0.7588256925934491 and parameters: {'vfdrc_ordered_rules': True, 'vfdrc_grace_period': 300, 'vfdrc_tie_threshold': 0.5, 'vfdrc_rule_prediction': 'first_hit', 'vfdrc_max_rules': 35, 'vfdrc_expand_criterion': 'info_gain', 'vfdrc_remove_poor_atts': False}. Best is trial 8 with value: 0.899382.[0m
[32m[I 2022-10-20 06:19:04,789][0m Trial 24 finished with value: 0.7588256925934491 and parameters: {'vfdrc_ordered_rules': True, 'vfdrc_grace_period': 300, 'vfdrc_tie_threshold': 0.5, 'vfdrc_rule_prediction': 'first_hit', 'vfdrc_max_rules': 35, 'vfdrc_expand_criterion': 'info_gain', 'vfdrc_remove_poor_atts': False}. Best is trial 8 with value: 0.899382.[0m
[32m[I 2022-10-20 06:19:04,985][0m Trial 26 finished with value: 0.7588256925934491 and parameters: {'vfdrc_ordered_rules': True, 'vfdrc_grace_period': 300, 'vfdrc_tie_threshold': 0.6000000000000001, 'vfdrc_rule_prediction': 'first_hit', 'vfdrc_max_rules': 35, 'vfdrc_expand_criterion': 'info_gain', 'vfdrc_remove_poor_atts': False}. Best is trial 8 with value: 0.899382.[0m
[32m[I 2022-10-20 06:19:05,600][0m Trial 27 finished with value: 0.5906873660663384 and parameters: {'vfdrc_ordered_rules': True, 'vfdrc_grace_period': 300, 'vfdrc_tie_threshold': 0.55, 'vfdrc_rule_prediction': 'first_hit', 'vfdrc_max_rules': 25, 'vfdrc_expand_criterion': 'info_gain', 'vfdrc_remove_poor_atts': False}. Best is trial 8 with value: 0.899382.[0m
[32m[I 2022-10-20 06:19:05,765][0m Trial 28 finished with value: 0.7588256925934491 and parameters: {'vfdrc_ordered_rules': True, 'vfdrc_grace_period': 300, 'vfdrc_tie_threshold': 0.65, 'vfdrc_rule_prediction': 'first_hit', 'vfdrc_max_rules': 35, 'vfdrc_expand_criterion': 'info_gain', 'vfdrc_remove_poor_atts': False}. Best is trial 8 with value: 0.899382.[0m
[32m[I 2022-10-20 06:19:05,889][0m Trial 29 finished with value: 0.5906873660663384 and parameters: {'vfdrc_ordered_rules': True, 'vfdrc_grace_period': 300, 'vfdrc_tie_threshold': 0.55, 'vfdrc_rule_prediction': 'weighted_sum', 'vfdrc_max_rules': 25, 'vfdrc_expand_criterion': 'info_gain', 'vfdrc_remove_poor_atts': False}. Best is trial 8 with value: 0.899382.[0m
[32m[I 2022-10-20 06:19:05,969][0m EarlyStopping exceeded for VeryFastDecisionRulesClassifier; no new best scores on iters 20.[0m
[32m[I 2022-10-20 06:19:05,970][0m Study finished.[0m
[32m[I 2022-10-20 06:19:05,978][0m --------------------------------------------------------------------------------[0m
[32m[I 2022-10-20 06:19:05,978][0m --------------------             XGBClassifier              --------------------[0m
[32m[I 2022-10-20 06:19:05,979][0m --------------------------------------------------------------------------------[0m
[32m[I 2022-10-20 06:19:06,005][0m A new study created in RDB with name: XGBClassifier_e448dfef[0m
[32m[I 2022-10-20 06:19:06,011][0m Study started.[0m
[32m[I 2022-10-20 06:20:26,647][0m Trial 0 finished with value: 0.6950742018218817 and parameters: {'xgbc_n_estimators': 40, 'xgbc_use_label_encoder': False, 'xgbc_learning_rate': 0.004667743176898157, 'xgbc_booster': 'gblinear', 'xgbc_gamma': 0.00013936294689784147}. Best is trial 0 with value: 0.695074.[0m
[32m[I 2022-10-20 06:24:47,903][0m Trial 4 finished with value: 0.9966025771567648 and parameters: {'xgbc_n_estimators': 50, 'xgbc_use_label_encoder': False, 'xgbc_learning_rate': 0.002323554269494753, 'xgbc_booster': 'gbtree', 'xgbc_gamma': 0.0006948071072907678}. Best is trial 4 with value: 0.996603.[0m
[32m[I 2022-10-20 06:26:28,660][0m Trial 1 finished with value: 0.06831450563863598 and parameters: {'xgbc_n_estimators': 180, 'xgbc_use_label_encoder': False, 'xgbc_learning_rate': 0.08473643720383944, 'xgbc_booster': 'gblinear', 'xgbc_gamma': 0.16044699354639444}. Best is trial 4 with value: 0.996603.[0m
[32m[I 2022-10-20 06:33:53,092][0m Trial 3 finished with value: 0.9990974496366657 and parameters: {'xgbc_n_estimators': 160, 'xgbc_use_label_encoder': False, 'xgbc_learning_rate': 0.023158196076617912, 'xgbc_booster': 'gbtree', 'xgbc_gamma': 0.5460095525163915}. Best is trial 3 with value: 0.999097.[0m
[32m[I 2022-10-20 06:34:48,705][0m Trial 5 finished with value: 0.9960182052933122 and parameters: {'xgbc_n_estimators': 110, 'xgbc_use_label_encoder': False, 'xgbc_learning_rate': 4.2330035753745045e-06, 'xgbc_booster': 'gbtree', 'xgbc_gamma': 0.1085313215168258}. Best is trial 3 with value: 0.999097.[0m
[32m[I 2022-10-20 06:37:49,787][0m Trial 7 finished with value: 0.6950742018218817 and parameters: {'xgbc_n_estimators': 130, 'xgbc_use_label_encoder': False, 'xgbc_learning_rate': 0.00011753741625150327, 'xgbc_booster': 'gblinear', 'xgbc_gamma': 0.0379145724016115}. Best is trial 3 with value: 0.999097.[0m
[32m[I 2022-10-20 06:39:59,423][0m Trial 9 finished with value: 0.6951662205600707 and parameters: {'xgbc_n_estimators': 70, 'xgbc_use_label_encoder': False, 'xgbc_learning_rate': 0.03009367492844504, 'xgbc_booster': 'gblinear', 'xgbc_gamma': 0.00016345793545926836}. Best is trial 3 with value: 0.999097.[0m
[32m[I 2022-10-20 06:43:29,052][0m Trial 6 finished with value: 0.9967165620443373 and parameters: {'xgbc_n_estimators': 180, 'xgbc_use_label_encoder': False, 'xgbc_learning_rate': 0.0035687530959370114, 'xgbc_booster': 'gbtree', 'xgbc_gamma': 9.744245112217355e-05}. Best is trial 3 with value: 0.999097.[0m
[32m[I 2022-10-20 06:46:02,836][0m Trial 8 finished with value: 0.996706637620131 and parameters: {'xgbc_n_estimators': 40, 'xgbc_use_label_encoder': False, 'xgbc_learning_rate': 0.009346483545522725, 'xgbc_booster': 'dart', 'xgbc_gamma': 0.0009569658381014332}. Best is trial 3 with value: 0.999097.[0m
[32m[I 2022-10-20 06:46:24,998][0m Trial 12 finished with value: 0.6950742018218817 and parameters: {'xgbc_n_estimators': 10, 'xgbc_use_label_encoder': False, 'xgbc_learning_rate': 3.25428794606436e-06, 'xgbc_booster': 'gblinear', 'xgbc_gamma': 0.0008409617177568799}. Best is trial 3 with value: 0.999097.[0m
[32m[I 2022-10-20 06:59:36,708][0m Trial 11 finished with value: 0.9988586484188101 and parameters: {'xgbc_n_estimators': 50, 'xgbc_use_label_encoder': False, 'xgbc_learning_rate': 0.06649913385053453, 'xgbc_booster': 'dart', 'xgbc_gamma': 1.131694021347489e-06}. Best is trial 3 with value: 0.999097.[0m
[32m[I 2022-10-20 07:59:51,797][0m Trial 2 finished with value: 0.9975323502154638 and parameters: {'xgbc_n_estimators': 140, 'xgbc_use_label_encoder': False, 'xgbc_learning_rate': 0.009742776675051542, 'xgbc_booster': 'dart', 'xgbc_gamma': 1.0724017521951616e-06}. Best is trial 3 with value: 0.999097.[0m
[32m[I 2022-10-20 08:35:41,053][0m Trial 15 finished with value: 0.9999776282930039 and parameters: {'xgbc_n_estimators': 80, 'xgbc_use_label_encoder': False, 'xgbc_learning_rate': 0.7994053857382373, 'xgbc_booster': 'dart', 'xgbc_gamma': 1.1293345595772094e-06}. Best is trial 15 with value: 0.999978.[0m
[32m[I 2022-10-20 08:38:57,498][0m Trial 14 finished with value: 0.999987569320571 and parameters: {'xgbc_n_estimators': 140, 'xgbc_use_label_encoder': False, 'xgbc_learning_rate': 0.517552279027007, 'xgbc_booster': 'dart', 'xgbc_gamma': 1.2881967387737329e-06}. Best is trial 14 with value: 0.999988.[0m
[32m[I 2022-10-20 08:53:40,255][0m Trial 10 finished with value: 0.9956388207772612 and parameters: {'xgbc_n_estimators': 160, 'xgbc_use_label_encoder': False, 'xgbc_learning_rate': 1.236340736491393e-06, 'xgbc_booster': 'dart', 'xgbc_gamma': 0.003014310336698066}. Best is trial 14 with value: 0.999988.[0m
[32m[I 2022-10-20 09:16:38,078][0m Trial 16 finished with value: 0.9999403580687382 and parameters: {'xgbc_n_estimators': 90, 'xgbc_use_label_encoder': False, 'xgbc_learning_rate': 0.7369941876067975, 'xgbc_booster': 'dart', 'xgbc_gamma': 0.7230762047666868}. Best is trial 14 with value: 0.999988.[0m
[32m[I 2022-10-20 09:24:34,959][0m Trial 17 finished with value: 0.999975146175016 and parameters: {'xgbc_n_estimators': 90, 'xgbc_use_label_encoder': False, 'xgbc_learning_rate': 0.33140490793880956, 'xgbc_booster': 'dart', 'xgbc_gamma': 1.1789611395013027e-05}. Best is trial 14 with value: 0.999988.[0m
[32m[I 2022-10-20 09:38:57,048][0m Trial 18 finished with value: 0.7142963987348706 and parameters: {'xgbc_n_estimators': 100, 'xgbc_use_label_encoder': False, 'xgbc_learning_rate': 0.9776457587886854, 'xgbc_booster': 'dart', 'xgbc_gamma': 7.947654351795385e-06}. Best is trial 14 with value: 0.999988.[0m
[32m[I 2022-10-20 09:54:33,477][0m Trial 13 finished with value: 0.9999801116692598 and parameters: {'xgbc_n_estimators': 200, 'xgbc_use_label_encoder': False, 'xgbc_learning_rate': 0.7380160441569843, 'xgbc_booster': 'dart', 'xgbc_gamma': 6.848719442007774e-06}. Best is trial 14 with value: 0.999988.[0m
[32m[I 2022-10-20 10:19:34,007][0m Trial 19 finished with value: 0.9999801116692598 and parameters: {'xgbc_n_estimators': 110, 'xgbc_use_label_encoder': False, 'xgbc_learning_rate': 0.662376909853383, 'xgbc_booster': 'dart', 'xgbc_gamma': 8.612683426422303e-06}. Best is trial 14 with value: 0.999988.[0m
[32m[I 2022-10-20 10:53:56,747][0m Trial 21 finished with value: 0.9965387125866305 and parameters: {'xgbc_n_estimators': 120, 'xgbc_use_label_encoder': False, 'xgbc_learning_rate': 0.0002859686201014469, 'xgbc_booster': 'dart', 'xgbc_gamma': 7.804852511586103e-06}. Best is trial 14 with value: 0.999988.[0m
[32m[I 2022-10-20 12:33:55,310][0m Trial 20 finished with value: 0.9965505719336601 and parameters: {'xgbc_n_estimators': 200, 'xgbc_use_label_encoder': False, 'xgbc_learning_rate': 0.0004640554148269325, 'xgbc_booster': 'dart', 'xgbc_gamma': 7.3176180254056454e-06}. Best is trial 14 with value: 0.999988.[0m
