[32m[I 2022-10-19 18:23:35,415][0m Trial 1 finished with value: 0.05163488645862473 and parameters: {'gnb_var_smoothing': 2.397101568239508e-12}. Best is trial 3 with value: 0.695074.[0m
[32m[I 2022-10-19 18:23:35,501][0m Trial 3 finished with value: 0.6950742018218817 and parameters: {'gnb_var_smoothing': 16.59992025037638}. Best is trial 3 with value: 0.695074.[0m
[32m[I 2022-10-19 18:23:35,594][0m Trial 2 finished with value: 0.05163488645862473 and parameters: {'gnb_var_smoothing': 0.018704352730154337}. Best is trial 3 with value: 0.695074.[0m
[32m[I 2022-10-19 18:23:35,595][0m Trial 0 finished with value: 0.05163488645862473 and parameters: {'gnb_var_smoothing': 1.8116249610017002e-09}. Best is trial 3 with value: 0.695074.[0m
[32m[I 2022-10-19 18:23:35,596][0m Trial 4 finished with value: 0.05163488645862473 and parameters: {'gnb_var_smoothing': 1.484386167325028e-07}. Best is trial 3 with value: 0.695074.[0m
[32m[I 2022-10-19 18:23:35,667][0m Trial 5 finished with value: 0.05163488645862473 and parameters: {'gnb_var_smoothing': 7.238672344706069e-12}. Best is trial 3 with value: 0.695074.[0m
[32m[I 2022-10-19 18:23:35,746][0m Trial 6 finished with value: 0.6950742018218817 and parameters: {'gnb_var_smoothing': 0.03611059359897841}. Best is trial 3 with value: 0.695074.[0m
[32m[I 2022-10-19 18:23:35,899][0m Trial 7 finished with value: 0.6950742018218817 and parameters: {'gnb_var_smoothing': 0.7945204756074743}. Best is trial 3 with value: 0.695074.[0m
[32m[I 2022-10-19 18:23:38,680][0m Trial 8 finished with value: 0.05163488645862473 and parameters: {'gnb_var_smoothing': 0.002498708957671958}. Best is trial 3 with value: 0.695074.[0m
[32m[I 2022-10-19 18:23:38,764][0m Trial 9 finished with value: 0.05163488645862473 and parameters: {'gnb_var_smoothing': 6.30142033543362e-05}. Best is trial 3 with value: 0.695074.[0m
[32m[I 2022-10-19 18:23:38,765][0m Trial 12 finished with value: 0.6950742018218817 and parameters: {'gnb_var_smoothing': 0.8265607250097745}. Best is trial 3 with value: 0.695074.[0m
[32m[I 2022-10-19 18:23:38,766][0m Trial 13 finished with value: 0.05163488645862473 and parameters: {'gnb_var_smoothing': 5.525092495025988e-09}. Best is trial 3 with value: 0.695074.[0m
[32m[I 2022-10-19 18:23:38,838][0m Trial 11 finished with value: 0.05163488645862473 and parameters: {'gnb_var_smoothing': 1.0644843917645278e-08}. Best is trial 3 with value: 0.695074.[0m
[32m[I 2022-10-19 18:23:38,841][0m Trial 10 finished with value: 0.05163488645862473 and parameters: {'gnb_var_smoothing': 5.297328430988135e-07}. Best is trial 3 with value: 0.695074.[0m
[32m[I 2022-10-19 18:23:38,841][0m Trial 15 finished with value: 0.05163488645862473 and parameters: {'gnb_var_smoothing': 0.00015479508687653748}. Best is trial 3 with value: 0.695074.[0m
[32m[I 2022-10-19 18:23:38,912][0m Trial 14 finished with value: 0.05163488645862473 and parameters: {'gnb_var_smoothing': 7.955509668856315e-07}. Best is trial 3 with value: 0.695074.[0m
[32m[I 2022-10-19 18:23:41,955][0m Trial 17 finished with value: 0.6950742018218817 and parameters: {'gnb_var_smoothing': 488.6629283164815}. Best is trial 17 with value: 0.695074.[0m
[32m[I 2022-10-19 18:23:42,141][0m Trial 20 finished with value: 0.6950742018218817 and parameters: {'gnb_var_smoothing': 811.1311572138728}. Best is trial 21 with value: 0.695074.[0m
[32m[I 2022-10-19 18:23:42,237][0m Trial 21 finished with value: 0.6950742018218817 and parameters: {'gnb_var_smoothing': 548.5303590173258}. Best is trial 21 with value: 0.695074.[0m
[32m[I 2022-10-19 18:23:42,333][0m Trial 22 finished with value: 0.6950742018218817 and parameters: {'gnb_var_smoothing': 557.6247709152086}. Best is trial 23 with value: 0.695074.[0m
[32m[I 2022-10-19 18:23:42,412][0m Trial 16 finished with value: 0.6950742018218817 and parameters: {'gnb_var_smoothing': 96.00594298363141}. Best is trial 23 with value: 0.695074.[0m
[32m[I 2022-10-19 18:23:42,487][0m Trial 19 finished with value: 0.6950742018218817 and parameters: {'gnb_var_smoothing': 886.9547317267098}. Best is trial 23 with value: 0.695074.[0m
[32m[I 2022-10-19 18:23:42,490][0m Trial 18 finished with value: 0.6950742018218817 and parameters: {'gnb_var_smoothing': 367.82426833552137}. Best is trial 23 with value: 0.695074.[0m
[32m[I 2022-10-19 18:23:42,560][0m Trial 23 finished with value: 0.6950742018218817 and parameters: {'gnb_var_smoothing': 198.0265535711853}. Best is trial 23 with value: 0.695074.[0m
[32m[I 2022-10-19 18:23:45,327][0m Trial 24 finished with value: 0.6950742018218817 and parameters: {'gnb_var_smoothing': 6.856725477338492}. Best is trial 28 with value: 0.695074.[0m
[32m[I 2022-10-19 18:23:45,413][0m Trial 28 finished with value: 0.6950742018218817 and parameters: {'gnb_var_smoothing': 4.644402257621801}. Best is trial 29 with value: 0.695074.[0m
[32m[I 2022-10-19 18:23:45,417][0m Trial 26 finished with value: 0.6950742018218817 and parameters: {'gnb_var_smoothing': 5.752723263722461}. Best is trial 31 with value: 0.695074.[0m
[32m[I 2022-10-19 18:23:45,420][0m Trial 31 finished with value: 0.6950742018218817 and parameters: {'gnb_var_smoothing': 4.744104898674671}. Best is trial 31 with value: 0.695074.[0m
[32m[I 2022-10-19 18:23:45,491][0m Trial 27 finished with value: 0.6950742018218817 and parameters: {'gnb_var_smoothing': 5.942913491044225}. Best is trial 31 with value: 0.695074.[0m
[32m[I 2022-10-19 18:23:45,562][0m Trial 29 finished with value: 0.6950742018218817 and parameters: {'gnb_var_smoothing': 7.788279907686981}. Best is trial 31 with value: 0.695074.[0m
[32m[I 2022-10-19 18:23:45,640][0m Trial 25 finished with value: 0.6950742018218817 and parameters: {'gnb_var_smoothing': 5.815003112261505}. Best is trial 31 with value: 0.695074.[0m
[32m[I 2022-10-19 18:23:45,641][0m Trial 30 finished with value: 0.6950742018218817 and parameters: {'gnb_var_smoothing': 5.478455343863108}. Best is trial 31 with value: 0.695074.[0m
[32m[I 2022-10-19 18:23:45,937][0m EarlyStopping exceeded for GaussianNB; no new best scores on iters 20.[0m
[32m[I 2022-10-19 18:23:45,938][0m Study finished.[0m
[32m[I 2022-10-19 18:23:45,944][0m --------------------------------------------------------------------------------[0m
[32m[I 2022-10-19 18:23:45,944][0m --------------------     HistGradientBoostingClassifier     --------------------[0m
[32m[I 2022-10-19 18:23:45,944][0m --------------------------------------------------------------------------------[0m
[32m[I 2022-10-19 18:23:45,977][0m A new study created in RDB with name: HistGradientBoostingClassifier_e448dfef[0m
[32m[I 2022-10-19 18:23:45,983][0m Study started.[0m
[32m[I 2022-10-19 18:24:04,530][0m Trial 2 finished with value: 0.9645763194123922 and parameters: {'hgbc_learning_rate': 0.41196368177484344, 'hgbc_max_iter': 2000, 'hgbc_min_samples_leaf': 22, 'hgbc_l2_regularization': 0.2, 'hgbc_max_bins': 127, 'hgbc_early_stopping': True, 'hgbc_validation_fraction': 0.25, 'hgbc_n_iter_no_change': 10}. Best is trial 2 with value: 0.964576.[0m
[32m[I 2022-10-19 18:24:05,927][0m Trial 7 finished with value: 0.9738433048162217 and parameters: {'hgbc_learning_rate': 0.2871372937317369, 'hgbc_max_iter': 2000, 'hgbc_min_samples_leaf': 12, 'hgbc_l2_regularization': 1.0, 'hgbc_max_bins': 127, 'hgbc_early_stopping': True, 'hgbc_validation_fraction': 0.25, 'hgbc_n_iter_no_change': 10}. Best is trial 7 with value: 0.973843.[0m
[32m[I 2022-10-19 18:24:09,344][0m Trial 6 finished with value: 0.9951503353592246 and parameters: {'hgbc_learning_rate': 0.0932848720338055, 'hgbc_max_iter': 2000, 'hgbc_min_samples_leaf': 7, 'hgbc_l2_regularization': 0.0, 'hgbc_max_bins': 255, 'hgbc_early_stopping': True, 'hgbc_validation_fraction': 0.25, 'hgbc_n_iter_no_change': 10}. Best is trial 6 with value: 0.99515.[0m
[32m[I 2022-10-19 18:24:22,697][0m Trial 8 finished with value: 0.7643169564778876 and parameters: {'hgbc_learning_rate': 0.5613614935952835, 'hgbc_max_iter': 2000, 'hgbc_min_samples_leaf': 44, 'hgbc_l2_regularization': 0.8, 'hgbc_max_bins': 255, 'hgbc_early_stopping': True, 'hgbc_validation_fraction': 0.25, 'hgbc_n_iter_no_change': 10}. Best is trial 6 with value: 0.99515.[0m
[32m[I 2022-10-19 18:27:54,273][0m Trial 9 finished with value: 0.9963872118630226 and parameters: {'hgbc_learning_rate': 0.09607843253394047, 'hgbc_max_iter': 2000, 'hgbc_min_samples_leaf': 47, 'hgbc_l2_regularization': 0.6000000000000001, 'hgbc_max_bins': 255, 'hgbc_early_stopping': True, 'hgbc_validation_fraction': 0.25, 'hgbc_n_iter_no_change': 10}. Best is trial 9 with value: 0.996387.[0m
[32m[I 2022-10-19 18:30:33,741][0m Trial 11 finished with value: 0.9954295767664985 and parameters: {'hgbc_learning_rate': 0.09366358454853757, 'hgbc_max_iter': 2000, 'hgbc_min_samples_leaf': 7, 'hgbc_l2_regularization': 0.6000000000000001, 'hgbc_max_bins': 127, 'hgbc_early_stopping': True, 'hgbc_validation_fraction': 0.25, 'hgbc_n_iter_no_change': 10}. Best is trial 9 with value: 0.996387.[0m
[32m[I 2022-10-19 18:37:02,536][0m Trial 13 finished with value: 0.9835221970125578 and parameters: {'hgbc_learning_rate': 0.06863322323013694, 'hgbc_max_iter': 2000, 'hgbc_min_samples_leaf': 45, 'hgbc_l2_regularization': 0.6000000000000001, 'hgbc_max_bins': 63, 'hgbc_early_stopping': True, 'hgbc_validation_fraction': 0.25, 'hgbc_n_iter_no_change': 10}. Best is trial 9 with value: 0.996387.[0m
[32m[I 2022-10-19 18:37:55,467][0m Trial 14 finished with value: 0.9881018266571984 and parameters: {'hgbc_learning_rate': 0.01992582771039593, 'hgbc_max_iter': 2000, 'hgbc_min_samples_leaf': 32, 'hgbc_l2_regularization': 0.0, 'hgbc_max_bins': 255, 'hgbc_early_stopping': True, 'hgbc_validation_fraction': 0.25, 'hgbc_n_iter_no_change': 10}. Best is trial 9 with value: 0.996387.[0m
[32m[I 2022-10-19 18:38:40,770][0m Trial 15 finished with value: 0.9817172029252108 and parameters: {'hgbc_learning_rate': 0.13748209157550642, 'hgbc_max_iter': 2000, 'hgbc_min_samples_leaf': 3, 'hgbc_l2_regularization': 1.0, 'hgbc_max_bins': 63, 'hgbc_early_stopping': True, 'hgbc_validation_fraction': 0.25, 'hgbc_n_iter_no_change': 10}. Best is trial 9 with value: 0.996387.[0m
[32m[I 2022-10-19 18:39:57,321][0m Trial 1 finished with value: 0.9960790212575732 and parameters: {'hgbc_learning_rate': 0.006123250329365776, 'hgbc_max_iter': 2000, 'hgbc_min_samples_leaf': 33, 'hgbc_l2_regularization': 0.0, 'hgbc_max_bins': 255, 'hgbc_early_stopping': True, 'hgbc_validation_fraction': 0.25, 'hgbc_n_iter_no_change': 10}. Best is trial 9 with value: 0.996387.[0m
[32m[I 2022-10-19 18:46:42,303][0m Trial 4 finished with value: 0.9954270945017989 and parameters: {'hgbc_learning_rate': 0.013071602371341456, 'hgbc_max_iter': 2000, 'hgbc_min_samples_leaf': 1, 'hgbc_l2_regularization': 0.2, 'hgbc_max_bins': 127, 'hgbc_early_stopping': True, 'hgbc_validation_fraction': 0.25, 'hgbc_n_iter_no_change': 10}. Best is trial 9 with value: 0.996387.[0m
[32m[I 2022-10-19 18:46:56,581][0m Trial 3 finished with value: 0.9835248851671269 and parameters: {'hgbc_learning_rate': 0.02510340248863607, 'hgbc_max_iter': 2000, 'hgbc_min_samples_leaf': 47, 'hgbc_l2_regularization': 1.0, 'hgbc_max_bins': 63, 'hgbc_early_stopping': True, 'hgbc_validation_fraction': 0.25, 'hgbc_n_iter_no_change': 10}. Best is trial 9 with value: 0.996387.[0m
[32m[I 2022-10-19 19:17:28,686][0m Trial 0 finished with value: 0.9963273219833305 and parameters: {'hgbc_learning_rate': 0.002661080491245369, 'hgbc_max_iter': 2000, 'hgbc_min_samples_leaf': 44, 'hgbc_l2_regularization': 1.0, 'hgbc_max_bins': 255, 'hgbc_early_stopping': True, 'hgbc_validation_fraction': 0.25, 'hgbc_n_iter_no_change': 10}. Best is trial 9 with value: 0.996387.[0m
[32m[I 2022-10-19 19:19:58,207][0m Trial 5 finished with value: 0.9833056626276442 and parameters: {'hgbc_learning_rate': 0.00167925341892564, 'hgbc_max_iter': 2000, 'hgbc_min_samples_leaf': 45, 'hgbc_l2_regularization': 1.0, 'hgbc_max_bins': 63, 'hgbc_early_stopping': True, 'hgbc_validation_fraction': 0.25, 'hgbc_n_iter_no_change': 10}. Best is trial 9 with value: 0.996387.[0m
[32m[I 2022-10-19 19:21:06,853][0m Trial 10 finished with value: 0.9834782681734462 and parameters: {'hgbc_learning_rate': 0.0032470907685044773, 'hgbc_max_iter': 2000, 'hgbc_min_samples_leaf': 46, 'hgbc_l2_regularization': 0.8, 'hgbc_max_bins': 63, 'hgbc_early_stopping': True, 'hgbc_validation_fraction': 0.25, 'hgbc_n_iter_no_change': 10}. Best is trial 9 with value: 0.996387.[0m
[32m[I 2022-10-19 19:24:33,153][0m Trial 12 finished with value: 0.9963746653499309 and parameters: {'hgbc_learning_rate': 0.004567346875440949, 'hgbc_max_iter': 2000, 'hgbc_min_samples_leaf': 46, 'hgbc_l2_regularization': 0.4, 'hgbc_max_bins': 255, 'hgbc_early_stopping': True, 'hgbc_validation_fraction': 0.25, 'hgbc_n_iter_no_change': 10}. Best is trial 9 with value: 0.996387.[0m
[32m[I 2022-10-19 19:30:56,079][0m Trial 17 finished with value: 0.9961176196625317 and parameters: {'hgbc_learning_rate': 0.0012941560553697538, 'hgbc_max_iter': 2000, 'hgbc_min_samples_leaf': 49, 'hgbc_l2_regularization': 0.4, 'hgbc_max_bins': 255, 'hgbc_early_stopping': True, 'hgbc_validation_fraction': 0.25, 'hgbc_n_iter_no_change': 10}. Best is trial 9 with value: 0.996387.[0m
[32m[I 2022-10-19 19:35:48,829][0m Trial 16 finished with value: 0.9834642293716238 and parameters: {'hgbc_learning_rate': 0.002149705285436202, 'hgbc_max_iter': 2000, 'hgbc_min_samples_leaf': 9, 'hgbc_l2_regularization': 0.2, 'hgbc_max_bins': 63, 'hgbc_early_stopping': True, 'hgbc_validation_fraction': 0.25, 'hgbc_n_iter_no_change': 10}. Best is trial 9 with value: 0.996387.[0m
[32m[I 2022-10-19 19:36:14,989][0m Trial 19 finished with value: 0.9963052142401777 and parameters: {'hgbc_learning_rate': 0.001890030084755809, 'hgbc_max_iter': 2000, 'hgbc_min_samples_leaf': 34, 'hgbc_l2_regularization': 0.4, 'hgbc_max_bins': 255, 'hgbc_early_stopping': True, 'hgbc_validation_fraction': 0.25, 'hgbc_n_iter_no_change': 10}. Best is trial 9 with value: 0.996387.[0m
[32m[I 2022-10-19 19:36:18,054][0m Trial 18 finished with value: 0.9963052142401777 and parameters: {'hgbc_learning_rate': 0.0018963530373696817, 'hgbc_max_iter': 2000, 'hgbc_min_samples_leaf': 34, 'hgbc_l2_regularization': 0.4, 'hgbc_max_bins': 255, 'hgbc_early_stopping': True, 'hgbc_validation_fraction': 0.25, 'hgbc_n_iter_no_change': 10}. Best is trial 9 with value: 0.996387.[0m
[32m[I 2022-10-19 19:44:12,333][0m Trial 22 finished with value: 0.9963847295490692 and parameters: {'hgbc_learning_rate': 0.007880363907069065, 'hgbc_max_iter': 2000, 'hgbc_min_samples_leaf': 36, 'hgbc_l2_regularization': 0.4, 'hgbc_max_bins': 255, 'hgbc_early_stopping': True, 'hgbc_validation_fraction': 0.25, 'hgbc_n_iter_no_change': 10}. Best is trial 9 with value: 0.996387.[0m
[32m[I 2022-10-19 19:45:20,225][0m Trial 20 finished with value: 0.9961196749891279 and parameters: {'hgbc_learning_rate': 0.0010131882307503237, 'hgbc_max_iter': 2000, 'hgbc_min_samples_leaf': 38, 'hgbc_l2_regularization': 0.4, 'hgbc_max_bins': 255, 'hgbc_early_stopping': True, 'hgbc_validation_fraction': 0.25, 'hgbc_n_iter_no_change': 10}. Best is trial 9 with value: 0.996387.[0m
[32m[I 2022-10-19 19:46:05,504][0m Trial 21 finished with value: 0.9962475603575904 and parameters: {'hgbc_learning_rate': 0.0017135824942694647, 'hgbc_max_iter': 2000, 'hgbc_min_samples_leaf': 36, 'hgbc_l2_regularization': 0.4, 'hgbc_max_bins': 255, 'hgbc_early_stopping': True, 'hgbc_validation_fraction': 0.25, 'hgbc_n_iter_no_change': 10}. Best is trial 9 with value: 0.996387.[0m
[32m[I 2022-10-19 19:46:05,584][0m EarlyStopping exceeded for HistGradientBoostingClassifier; no new best scores on iters 20.[0m
[32m[I 2022-10-19 19:46:05,584][0m Study finished.[0m
[32m[I 2022-10-19 19:46:05,591][0m --------------------------------------------------------------------------------[0m
[32m[I 2022-10-19 19:46:05,591][0m --------------------             LGBMClassifier             --------------------[0m
[32m[I 2022-10-19 19:46:05,592][0m --------------------------------------------------------------------------------[0m
[32m[I 2022-10-19 19:46:05,618][0m A new study created in RDB with name: LGBMClassifier_e448dfef[0m
[32m[I 2022-10-19 19:46:05,624][0m Study started.[0m
[32m[I 2022-10-19 19:46:53,366][0m Trial 6 finished with value: 0.6950742018218817 and parameters: {'lgbm_num_leaves': 63, 'lgbm_learning_rate': 0.0015607243171537435, 'lgbm_n_estimators': 50, 'lgbm_reg_alpha': 0.05, 'lgbm_reg_lambda': 0.35000000000000003}. Best is trial 6 with value: 0.695074.[0m
[32m[I 2022-10-19 19:47:08,658][0m Trial 4 finished with value: 0.9945613558667614 and parameters: {'lgbm_num_leaves': 31, 'lgbm_learning_rate': 0.007725743678028187, 'lgbm_n_estimators': 70, 'lgbm_reg_alpha': 0.9, 'lgbm_reg_lambda': 0.9500000000000001}. Best is trial 4 with value: 0.994561.[0m
[32m[I 2022-10-19 19:47:12,514][0m Trial 0 finished with value: 0.9970356002518092 and parameters: {'lgbm_num_leaves': 15, 'lgbm_learning_rate': 0.01738553586103781, 'lgbm_n_estimators': 80, 'lgbm_reg_alpha': 0.7000000000000001, 'lgbm_reg_lambda': 0.2}. Best is trial 0 with value: 0.997036.[0m
[32m[I 2022-10-19 19:47:59,596][0m Trial 2 finished with value: 0.6950742018218817 and parameters: {'lgbm_num_leaves': 7, 'lgbm_learning_rate': 3.972905239253673e-06, 'lgbm_n_estimators': 160, 'lgbm_reg_alpha': 0.1, 'lgbm_reg_lambda': 0.7000000000000001}. Best is trial 0 with value: 0.997036.[0m
[32m[I 2022-10-19 19:48:01,437][0m Trial 5 finished with value: 0.6950742018218817 and parameters: {'lgbm_num_leaves': 127, 'lgbm_learning_rate': 8.870316024490343e-05, 'lgbm_n_estimators': 120, 'lgbm_reg_alpha': 0.9, 'lgbm_reg_lambda': 0.6000000000000001}. Best is trial 0 with value: 0.997036.[0m
[32m[I 2022-10-19 19:48:17,733][0m Trial 3 finished with value: 0.6950742018218817 and parameters: {'lgbm_num_leaves': 63, 'lgbm_learning_rate': 0.0019710540888337696, 'lgbm_n_estimators': 140, 'lgbm_reg_alpha': 0.0, 'lgbm_reg_lambda': 0.05}. Best is trial 0 with value: 0.997036.[0m
[32m[I 2022-10-19 19:48:18,833][0m Trial 7 finished with value: 0.6950742018218817 and parameters: {'lgbm_num_leaves': 7, 'lgbm_learning_rate': 0.0001607823901432057, 'lgbm_n_estimators': 190, 'lgbm_reg_alpha': 0.75, 'lgbm_reg_lambda': 0.4}. Best is trial 0 with value: 0.997036.[0m
[32m[I 2022-10-19 19:48:23,354][0m Trial 9 finished with value: 0.6950742018218817 and parameters: {'lgbm_num_leaves': 7, 'lgbm_learning_rate': 3.682945849588467e-06, 'lgbm_n_estimators': 110, 'lgbm_reg_alpha': 0.4, 'lgbm_reg_lambda': 0.9500000000000001}. Best is trial 0 with value: 0.997036.[0m
[32m[I 2022-10-19 19:48:29,326][0m Trial 14 finished with value: 0.6950742018218817 and parameters: {'lgbm_num_leaves': 31, 'lgbm_learning_rate': 4.729209688154923e-06, 'lgbm_n_estimators': 10, 'lgbm_reg_alpha': 0.8500000000000001, 'lgbm_reg_lambda': 0.05}. Best is trial 0 with value: 0.997036.[0m
[32m[I 2022-10-19 19:48:45,956][0m Trial 1 finished with value: 0.9387222075368322 and parameters: {'lgbm_num_leaves': 31, 'lgbm_learning_rate': 0.002066247641943096, 'lgbm_n_estimators': 190, 'lgbm_reg_alpha': 0.05, 'lgbm_reg_lambda': 0.55}. Best is trial 0 with value: 0.997036.[0m
[32m[I 2022-10-19 19:49:01,813][0m Trial 8 finished with value: 0.9806158846281435 and parameters: {'lgbm_num_leaves': 15, 'lgbm_learning_rate': 0.0029999945508155284, 'lgbm_n_estimators': 170, 'lgbm_reg_alpha': 1.0, 'lgbm_reg_lambda': 0.4}. Best is trial 0 with value: 0.997036.[0m
[32m[I 2022-10-19 19:49:04,544][0m Trial 10 finished with value: 0.9970247447418789 and parameters: {'lgbm_num_leaves': 7, 'lgbm_learning_rate': 0.020921916506515013, 'lgbm_n_estimators': 160, 'lgbm_reg_alpha': 0.8, 'lgbm_reg_lambda': 0.35000000000000003}. Best is trial 0 with value: 0.997036.[0m
[32m[I 2022-10-19 19:49:28,229][0m Trial 15 finished with value: 0.7903782055943139 and parameters: {'lgbm_num_leaves': 7, 'lgbm_learning_rate': 0.43527614893683364, 'lgbm_n_estimators': 70, 'lgbm_reg_alpha': 0.4, 'lgbm_reg_lambda': 0.05}. Best is trial 0 with value: 0.997036.[0m
[32m[I 2022-10-19 19:49:40,694][0m Trial 13 finished with value: 0.9996345498607256 and parameters: {'lgbm_num_leaves': 15, 'lgbm_learning_rate': 0.039240897300187504, 'lgbm_n_estimators': 110, 'lgbm_reg_alpha': 0.6000000000000001, 'lgbm_reg_lambda': 0.15000000000000002}. Best is trial 13 with value: 0.999635.[0m
[32m[I 2022-10-19 19:49:44,292][0m Trial 17 finished with value: 0.7140112478511467 and parameters: {'lgbm_num_leaves': 15, 'lgbm_learning_rate': 0.908510237362601, 'lgbm_n_estimators': 60, 'lgbm_reg_alpha': 0.55, 'lgbm_reg_lambda': 0.2}. Best is trial 13 with value: 0.999635.[0m
[32m[I 2022-10-19 19:49:53,804][0m Trial 11 finished with value: 0.6950742018218817 and parameters: {'lgbm_num_leaves': 15, 'lgbm_learning_rate': 2.5412177804231272e-05, 'lgbm_n_estimators': 160, 'lgbm_reg_alpha': 0.9, 'lgbm_reg_lambda': 0.25}. Best is trial 13 with value: 0.999635.[0m
[32m[I 2022-10-19 19:49:58,322][0m Trial 18 finished with value: 0.999860812025889 and parameters: {'lgbm_num_leaves': 15, 'lgbm_learning_rate': 0.1712304553926941, 'lgbm_n_estimators': 70, 'lgbm_reg_alpha': 0.6000000000000001, 'lgbm_reg_lambda': 0.9500000000000001}. Best is trial 18 with value: 0.999861.[0m
[32m[I 2022-10-19 19:49:59,828][0m Trial 16 finished with value: 0.9997415389093312 and parameters: {'lgbm_num_leaves': 7, 'lgbm_learning_rate': 0.11591030278002237, 'lgbm_n_estimators': 130, 'lgbm_reg_alpha': 0.75, 'lgbm_reg_lambda': 0.8}. Best is trial 18 with value: 0.999861.[0m
[32m[I 2022-10-19 19:50:23,799][0m Trial 19 finished with value: 0.7758058071196218 and parameters: {'lgbm_num_leaves': 15, 'lgbm_learning_rate': 0.41281517377258264, 'lgbm_n_estimators': 80, 'lgbm_reg_alpha': 0.6000000000000001, 'lgbm_reg_lambda': 0.2}. Best is trial 18 with value: 0.999861.[0m
