[32m[I 2022-10-20 04:59:35,886][0m Trial 7 finished with value: 0.7979305445405835 and parameters: {'pac_C': 1.2917100476537982, 'pac_early_stopping': True, 'pac_validation_fraction': 0.25, 'pac_n_iter_no_change': 10}. Best is trial 0 with value: 0.797931.[0m
[32m[I 2022-10-20 04:59:37,890][0m Trial 1 finished with value: 0.7849324362388667 and parameters: {'pac_C': 2.190612831870927e-06, 'pac_early_stopping': True, 'pac_validation_fraction': 0.25, 'pac_n_iter_no_change': 10}. Best is trial 0 with value: 0.797931.[0m
[32m[I 2022-10-20 04:59:37,998][0m Trial 2 finished with value: 0.7740697652347194 and parameters: {'pac_C': 2.7998497351137e-06, 'pac_early_stopping': True, 'pac_validation_fraction': 0.25, 'pac_n_iter_no_change': 10}. Best is trial 0 with value: 0.797931.[0m
[32m[I 2022-10-20 04:59:37,999][0m Trial 4 finished with value: 0.7541470263250386 and parameters: {'pac_C': 1.8270041950362935e-05, 'pac_early_stopping': True, 'pac_validation_fraction': 0.25, 'pac_n_iter_no_change': 10}. Best is trial 0 with value: 0.797931.[0m
[32m[I 2022-10-20 05:00:10,776][0m Trial 8 finished with value: 0.7992462209057175 and parameters: {'pac_C': 0.0002501633425577968, 'pac_early_stopping': True, 'pac_validation_fraction': 0.25, 'pac_n_iter_no_change': 10}. Best is trial 8 with value: 0.799246.[0m
[32m[I 2022-10-20 05:00:12,551][0m Trial 9 finished with value: 0.7979305445405835 and parameters: {'pac_C': 0.018003925934391866, 'pac_early_stopping': True, 'pac_validation_fraction': 0.25, 'pac_n_iter_no_change': 10}. Best is trial 8 with value: 0.799246.[0m
[32m[I 2022-10-20 05:00:13,881][0m Trial 10 finished with value: 0.7979305445405835 and parameters: {'pac_C': 5.602964149880399, 'pac_early_stopping': True, 'pac_validation_fraction': 0.25, 'pac_n_iter_no_change': 10}. Best is trial 8 with value: 0.799246.[0m
[32m[I 2022-10-20 05:00:13,881][0m Trial 11 finished with value: 0.7979305445405835 and parameters: {'pac_C': 2.14239184595629, 'pac_early_stopping': True, 'pac_validation_fraction': 0.25, 'pac_n_iter_no_change': 10}. Best is trial 8 with value: 0.799246.[0m
[32m[I 2022-10-20 05:00:15,276][0m Trial 12 finished with value: 0.7979305445405835 and parameters: {'pac_C': 0.06655353366335742, 'pac_early_stopping': True, 'pac_validation_fraction': 0.25, 'pac_n_iter_no_change': 10}. Best is trial 8 with value: 0.799246.[0m
[32m[I 2022-10-20 05:00:16,951][0m Trial 14 finished with value: 0.7979305445405835 and parameters: {'pac_C': 0.04646695386937122, 'pac_early_stopping': True, 'pac_validation_fraction': 0.25, 'pac_n_iter_no_change': 10}. Best is trial 8 with value: 0.799246.[0m
[32m[I 2022-10-20 05:00:16,951][0m Trial 15 finished with value: 0.7976348280814057 and parameters: {'pac_C': 0.0008065362764321384, 'pac_early_stopping': True, 'pac_validation_fraction': 0.25, 'pac_n_iter_no_change': 10}. Best is trial 8 with value: 0.799246.[0m
[32m[I 2022-10-20 05:00:17,548][0m Trial 13 finished with value: 0.7979305445405835 and parameters: {'pac_C': 44.031819570128725, 'pac_early_stopping': True, 'pac_validation_fraction': 0.25, 'pac_n_iter_no_change': 10}. Best is trial 8 with value: 0.799246.[0m
[32m[I 2022-10-20 05:00:48,360][0m Trial 17 finished with value: 0.7979305445405835 and parameters: {'pac_C': 0.0013884058212699038, 'pac_early_stopping': True, 'pac_validation_fraction': 0.25, 'pac_n_iter_no_change': 10}. Best is trial 8 with value: 0.799246.[0m
[32m[I 2022-10-20 05:00:49,535][0m Trial 16 finished with value: 0.8071613125696224 and parameters: {'pac_C': 0.00020899214532117157, 'pac_early_stopping': True, 'pac_validation_fraction': 0.25, 'pac_n_iter_no_change': 10}. Best is trial 16 with value: 0.807161.[0m
[32m[I 2022-10-20 05:00:49,752][0m Trial 18 finished with value: 0.7979305445405835 and parameters: {'pac_C': 668.8500265654071, 'pac_early_stopping': True, 'pac_validation_fraction': 0.25, 'pac_n_iter_no_change': 10}. Best is trial 16 with value: 0.807161.[0m
[32m[I 2022-10-20 05:00:50,254][0m Trial 19 finished with value: 0.7979305445405835 and parameters: {'pac_C': 852.0426005935363, 'pac_early_stopping': True, 'pac_validation_fraction': 0.25, 'pac_n_iter_no_change': 10}. Best is trial 16 with value: 0.807161.[0m
[32m[I 2022-10-20 05:00:50,918][0m Trial 20 finished with value: 0.7979305445405835 and parameters: {'pac_C': 994.1792554620528, 'pac_early_stopping': True, 'pac_validation_fraction': 0.25, 'pac_n_iter_no_change': 10}. Best is trial 16 with value: 0.807161.[0m
[32m[I 2022-10-20 05:00:51,904][0m Trial 22 finished with value: 0.7979305445405835 and parameters: {'pac_C': 890.7020008578038, 'pac_early_stopping': True, 'pac_validation_fraction': 0.25, 'pac_n_iter_no_change': 10}. Best is trial 16 with value: 0.807161.[0m
[32m[I 2022-10-20 05:00:51,904][0m Trial 21 finished with value: 0.7979305445405835 and parameters: {'pac_C': 820.4363914492918, 'pac_early_stopping': True, 'pac_validation_fraction': 0.25, 'pac_n_iter_no_change': 10}. Best is trial 16 with value: 0.807161.[0m
[32m[I 2022-10-20 05:00:52,054][0m EarlyStopping exceeded for PassiveAggressiveClassifier; no new best scores on iters 20.[0m
[32m[I 2022-10-20 05:00:52,055][0m Study finished.[0m
[32m[I 2022-10-20 05:00:52,062][0m --------------------------------------------------------------------------------[0m
[32m[I 2022-10-20 05:00:52,062][0m --------------------               Perceptron               --------------------[0m
[32m[I 2022-10-20 05:00:52,063][0m --------------------------------------------------------------------------------[0m
[32m[I 2022-10-20 05:00:52,089][0m A new study created in RDB with name: Perceptron_e448dfef[0m
[32m[I 2022-10-20 05:00:52,095][0m Study started.[0m
[32m[I 2022-10-20 05:01:27,448][0m Trial 4 finished with value: 0.7119527884468769 and parameters: {'p_penalty': 'elasticnet', 'p_alpha': 0.20582791915892495, 'p_eta0': 0.5, 'p_early_stopping': True, 'p_validation_fraction': 0.25, 'p_n_iter_no_change': 10}. Best is trial 4 with value: 0.711953.[0m
[32m[I 2022-10-20 05:01:28,602][0m Trial 1 finished with value: 0.37664303617842276 and parameters: {'p_penalty': 'elasticnet', 'p_alpha': 0.004850683914736693, 'p_eta0': 2.0, 'p_early_stopping': True, 'p_validation_fraction': 0.25, 'p_n_iter_no_change': 10}. Best is trial 4 with value: 0.711953.[0m
[32m[I 2022-10-20 05:01:30,013][0m Trial 2 finished with value: 0.3600675698447287 and parameters: {'p_penalty': 'elasticnet', 'p_alpha': 0.006989799781980968, 'p_eta0': 2.0, 'p_early_stopping': True, 'p_validation_fraction': 0.25, 'p_n_iter_no_change': 10}. Best is trial 4 with value: 0.711953.[0m
[32m[I 2022-10-20 05:01:31,870][0m Trial 7 finished with value: 0.14762367697324874 and parameters: {'p_penalty': 'elasticnet', 'p_alpha': 4.338174555763049e-05, 'p_eta0': 1.5, 'p_early_stopping': True, 'p_validation_fraction': 0.25, 'p_n_iter_no_change': 10}. Best is trial 4 with value: 0.711953.[0m
[32m[I 2022-10-20 05:01:32,054][0m Trial 5 finished with value: 0.15851040378431527 and parameters: {'p_penalty': 'elasticnet', 'p_alpha': 1.8754960765241838e-06, 'p_eta0': 1.5, 'p_early_stopping': True, 'p_validation_fraction': 0.25, 'p_n_iter_no_change': 10}. Best is trial 4 with value: 0.711953.[0m
[32m[I 2022-10-20 05:01:33,116][0m Trial 3 finished with value: 0.7435961873016059 and parameters: {'p_penalty': 'elasticnet', 'p_alpha': 0.0007271954374247152, 'p_eta0': 2.0, 'p_early_stopping': True, 'p_validation_fraction': 0.25, 'p_n_iter_no_change': 10}. Best is trial 3 with value: 0.743596.[0m
[32m[I 2022-10-20 05:01:33,881][0m Trial 6 finished with value: 0.13992958379732198 and parameters: {'p_penalty': 'elasticnet', 'p_alpha': 1.7541056741596004e-05, 'p_eta0': 1.0, 'p_early_stopping': True, 'p_validation_fraction': 0.25, 'p_n_iter_no_change': 10}. Best is trial 3 with value: 0.743596.[0m
[32m[I 2022-10-20 05:01:35,951][0m Trial 0 finished with value: 0.7233484563283551 and parameters: {'p_penalty': 'elasticnet', 'p_alpha': 6.2135853437058105e-06, 'p_eta0': 1.5, 'p_early_stopping': True, 'p_validation_fraction': 0.25, 'p_n_iter_no_change': 10}. Best is trial 3 with value: 0.743596.[0m
[32m[I 2022-10-20 05:02:03,771][0m Trial 9 finished with value: 0.4320393425716276 and parameters: {'p_penalty': 'elasticnet', 'p_alpha': 0.007498293863663112, 'p_eta0': 1.5, 'p_early_stopping': True, 'p_validation_fraction': 0.25, 'p_n_iter_no_change': 10}. Best is trial 3 with value: 0.743596.[0m
[32m[I 2022-10-20 05:02:06,547][0m Trial 11 finished with value: 0.7117393456299845 and parameters: {'p_penalty': 'elasticnet', 'p_alpha': 0.16091646931399953, 'p_eta0': 2.0, 'p_early_stopping': True, 'p_validation_fraction': 0.25, 'p_n_iter_no_change': 10}. Best is trial 3 with value: 0.743596.[0m
[32m[I 2022-10-20 05:02:07,720][0m Trial 13 finished with value: 0.7287721619043523 and parameters: {'p_penalty': 'elasticnet', 'p_alpha': 0.010231598424864742, 'p_eta0': 1.5, 'p_early_stopping': True, 'p_validation_fraction': 0.25, 'p_n_iter_no_change': 10}. Best is trial 3 with value: 0.743596.[0m
[32m[I 2022-10-20 05:02:09,238][0m Trial 10 finished with value: 0.395018821012595 and parameters: {'p_penalty': 'elasticnet', 'p_alpha': 0.0003984353433075023, 'p_eta0': 0.5, 'p_early_stopping': True, 'p_validation_fraction': 0.25, 'p_n_iter_no_change': 10}. Best is trial 3 with value: 0.743596.[0m
[32m[I 2022-10-20 05:02:10,212][0m Trial 8 finished with value: 0.7037907564340649 and parameters: {'p_penalty': 'elasticnet', 'p_alpha': 4.7510905566019475e-06, 'p_eta0': 1.5, 'p_early_stopping': True, 'p_validation_fraction': 0.25, 'p_n_iter_no_change': 10}. Best is trial 3 with value: 0.743596.[0m
[32m[I 2022-10-20 05:02:11,217][0m Trial 12 finished with value: 0.7225311638582476 and parameters: {'p_penalty': 'elasticnet', 'p_alpha': 3.2694702296576293e-06, 'p_eta0': 2.0, 'p_early_stopping': True, 'p_validation_fraction': 0.25, 'p_n_iter_no_change': 10}. Best is trial 3 with value: 0.743596.[0m
[32m[I 2022-10-20 05:02:13,480][0m Trial 14 finished with value: 0.19829567373708634 and parameters: {'p_penalty': 'elasticnet', 'p_alpha': 1.827942710880781e-06, 'p_eta0': 2.0, 'p_early_stopping': True, 'p_validation_fraction': 0.25, 'p_n_iter_no_change': 10}. Best is trial 3 with value: 0.743596.[0m
[32m[I 2022-10-20 05:02:13,587][0m Trial 15 finished with value: 0.3951887966120191 and parameters: {'p_penalty': 'elasticnet', 'p_alpha': 0.00011318783838401141, 'p_eta0': 2.0, 'p_early_stopping': True, 'p_validation_fraction': 0.25, 'p_n_iter_no_change': 10}. Best is trial 3 with value: 0.743596.[0m
[32m[I 2022-10-20 05:02:42,852][0m Trial 16 finished with value: 0.14513290650201366 and parameters: {'p_penalty': 'elasticnet', 'p_alpha': 0.0001330967897307166, 'p_eta0': 0.5, 'p_early_stopping': True, 'p_validation_fraction': 0.25, 'p_n_iter_no_change': 10}. Best is trial 3 with value: 0.743596.[0m
[32m[I 2022-10-20 05:02:44,146][0m Trial 17 finished with value: 0.3976935378490001 and parameters: {'p_penalty': 'elasticnet', 'p_alpha': 0.0003837599139063835, 'p_eta0': 0.5, 'p_early_stopping': True, 'p_validation_fraction': 0.25, 'p_n_iter_no_change': 10}. Best is trial 3 with value: 0.743596.[0m
[32m[I 2022-10-20 05:02:45,605][0m Trial 18 finished with value: 0.7393264563817835 and parameters: {'p_penalty': 'elasticnet', 'p_alpha': 0.000533115251881556, 'p_eta0': 1.0, 'p_early_stopping': True, 'p_validation_fraction': 0.25, 'p_n_iter_no_change': 10}. Best is trial 3 with value: 0.743596.[0m
[32m[I 2022-10-20 05:02:47,145][0m Trial 19 finished with value: 0.400802446189608 and parameters: {'p_penalty': 'elasticnet', 'p_alpha': 0.0005015735815312154, 'p_eta0': 1.0, 'p_early_stopping': True, 'p_validation_fraction': 0.25, 'p_n_iter_no_change': 10}. Best is trial 3 with value: 0.743596.[0m
[32m[I 2022-10-20 05:02:47,285][0m Trial 21 finished with value: 0.41183867871600754 and parameters: {'p_penalty': 'elasticnet', 'p_alpha': 0.00034340005131736756, 'p_eta0': 1.0, 'p_early_stopping': True, 'p_validation_fraction': 0.25, 'p_n_iter_no_change': 10}. Best is trial 3 with value: 0.743596.[0m
[32m[I 2022-10-20 05:02:49,352][0m Trial 23 finished with value: 0.3606958066754467 and parameters: {'p_penalty': 'elasticnet', 'p_alpha': 0.042992251488801994, 'p_eta0': 1.0, 'p_early_stopping': True, 'p_validation_fraction': 0.25, 'p_n_iter_no_change': 10}. Best is trial 3 with value: 0.743596.[0m
[32m[I 2022-10-20 05:02:50,824][0m Trial 20 finished with value: 0.3929748625949994 and parameters: {'p_penalty': 'elasticnet', 'p_alpha': 0.0006218539602597137, 'p_eta0': 1.0, 'p_early_stopping': True, 'p_validation_fraction': 0.25, 'p_n_iter_no_change': 10}. Best is trial 3 with value: 0.743596.[0m
[32m[I 2022-10-20 05:02:54,815][0m Trial 22 finished with value: 0.5738249270045304 and parameters: {'p_penalty': 'elasticnet', 'p_alpha': 0.04126386296711527, 'p_eta0': 1.0, 'p_early_stopping': True, 'p_validation_fraction': 0.25, 'p_n_iter_no_change': 10}. Best is trial 3 with value: 0.743596.[0m
[32m[I 2022-10-20 05:03:15,145][0m Trial 24 finished with value: 0.05966831131425303 and parameters: {'p_penalty': 'elasticnet', 'p_alpha': 0.03359177435458649, 'p_eta0': 1.0, 'p_early_stopping': True, 'p_validation_fraction': 0.25, 'p_n_iter_no_change': 10}. Best is trial 3 with value: 0.743596.[0m
[32m[I 2022-10-20 05:03:18,803][0m Trial 25 finished with value: 0.7235231360728682 and parameters: {'p_penalty': 'elasticnet', 'p_alpha': 0.03698059574697591, 'p_eta0': 1.0, 'p_early_stopping': True, 'p_validation_fraction': 0.25, 'p_n_iter_no_change': 10}. Best is trial 3 with value: 0.743596.[0m
[32m[I 2022-10-20 05:03:21,656][0m Trial 28 finished with value: 0.725678141127633 and parameters: {'p_penalty': 'elasticnet', 'p_alpha': 0.02689770841507113, 'p_eta0': 1.0, 'p_early_stopping': True, 'p_validation_fraction': 0.25, 'p_n_iter_no_change': 10}. Best is trial 3 with value: 0.743596.[0m
[32m[I 2022-10-20 05:03:22,154][0m Trial 27 finished with value: 0.7143220349015176 and parameters: {'p_penalty': 'elasticnet', 'p_alpha': 0.03749444933121652, 'p_eta0': 1.0, 'p_early_stopping': True, 'p_validation_fraction': 0.25, 'p_n_iter_no_change': 10}. Best is trial 3 with value: 0.743596.[0m
[32m[I 2022-10-20 05:03:22,239][0m Trial 26 finished with value: 0.7015423988592385 and parameters: {'p_penalty': 'elasticnet', 'p_alpha': 0.0015849436783897566, 'p_eta0': 1.0, 'p_early_stopping': True, 'p_validation_fraction': 0.25, 'p_n_iter_no_change': 10}. Best is trial 3 with value: 0.743596.[0m
[32m[I 2022-10-20 05:03:23,427][0m Trial 29 finished with value: 0.6994516340824916 and parameters: {'p_penalty': 'elasticnet', 'p_alpha': 0.0017007194746818577, 'p_eta0': 1.0, 'p_early_stopping': True, 'p_validation_fraction': 0.25, 'p_n_iter_no_change': 10}. Best is trial 3 with value: 0.743596.[0m
[32m[I 2022-10-20 05:03:23,507][0m EarlyStopping exceeded for Perceptron; no new best scores on iters 20.[0m
[32m[I 2022-10-20 05:03:23,508][0m Study finished.[0m
[32m[I 2022-10-20 05:03:23,514][0m --------------------------------------------------------------------------------[0m
[32m[I 2022-10-20 05:03:23,515][0m --------------------     QuadraticDiscriminantAnalysis      --------------------[0m
[32m[I 2022-10-20 05:03:23,515][0m --------------------------------------------------------------------------------[0m
[32m[I 2022-10-20 05:03:23,541][0m A new study created in RDB with name: QuadraticDiscriminantAnalysis_e448dfef[0m
[32m[I 2022-10-20 05:03:23,548][0m Study started.[0m
[32m[I 2022-10-20 05:03:28,107][0m Trial 0 finished with value: 0.6999850143797616 and parameters: {'qda_reg_param': 0.55, 'qda_tol': 2.1986001846398037e-05}. Best is trial 0 with value: 0.703907.[0m
[32m[I 2022-10-20 05:03:28,194][0m Trial 4 finished with value: 0.690404344900762 and parameters: {'qda_reg_param': 0.30000000000000004, 'qda_tol': 0.0004088681419370302}. Best is trial 1 with value: 0.703907.[0m
[32m[I 2022-10-20 05:03:28,198][0m Trial 5 finished with value: 0.6960743683825104 and parameters: {'qda_reg_param': 0.9500000000000001, 'qda_tol': 6.424696732557375e-05}. Best is trial 1 with value: 0.703907.[0m
[32m[I 2022-10-20 05:03:28,273][0m Trial 3 finished with value: 0.6999850143797616 and parameters: {'qda_reg_param': 0.55, 'qda_tol': 0.0008888904754251098}. Best is trial 0 with value: 0.703907.[0m
[32m[I 2022-10-20 05:03:28,436][0m Trial 1 finished with value: 0.7039070102441788 and parameters: {'qda_reg_param': 0.5, 'qda_tol': 4.2072378903151435e-05}. Best is trial 1 with value: 0.703907.[0m
[32m[I 2022-10-20 05:03:28,529][0m Trial 7 finished with value: 0.6969634103200527 and parameters: {'qda_reg_param': 0.8, 'qda_tol': 0.00027483453143396097}. Best is trial 1 with value: 0.703907.[0m
[32m[I 2022-10-20 05:03:28,531][0m Trial 2 finished with value: 0.6991119378167865 and parameters: {'qda_reg_param': 0.6000000000000001, 'qda_tol': 7.6131360335329385e-06}. Best is trial 1 with value: 0.703907.[0m
[32m[I 2022-10-20 05:03:28,534][0m Trial 6 finished with value: 0.6991119378167865 and parameters: {'qda_reg_param': 0.6000000000000001, 'qda_tol': 6.466688742481176e-06}. Best is trial 1 with value: 0.703907.[0m
[32m[I 2022-10-20 05:03:33,270][0m Trial 9 finished with value: 0.6964237090495516 and parameters: {'qda_reg_param': 0.9, 'qda_tol': 3.038310935265114e-06}. Best is trial 1 with value: 0.703907.[0m
[32m[I 2022-10-20 05:03:33,360][0m Trial 8 finished with value: 0.044843378911844006 and parameters: {'qda_reg_param': 0.1, 'qda_tol': 5.441646415531942e-05}. Best is trial 1 with value: 0.703907.[0m
[32m[I 2022-10-20 05:03:33,451][0m Trial 11 finished with value: 0.6915449757313482 and parameters: {'qda_reg_param': 0.25, 'qda_tol': 0.0004221872968025782}. Best is trial 1 with value: 0.705588.[0m
[32m[I 2022-10-20 05:03:33,453][0m Trial 10 finished with value: 0.6969634103200527 and parameters: {'qda_reg_param': 0.8, 'qda_tol': 1.9210101058332513e-06}. Best is trial 1 with value: 0.705588.[0m
[32m[I 2022-10-20 05:03:33,617][0m Trial 14 finished with value: 0.6960743683825104 and parameters: {'qda_reg_param': 0.9500000000000001, 'qda_tol': 9.859073155397662e-05}. Best is trial 15 with value: 0.705588.[0m
[32m[I 2022-10-20 05:03:33,623][0m Trial 13 finished with value: 0.6991119378167865 and parameters: {'qda_reg_param': 0.6000000000000001, 'qda_tol': 1.1899586998704251e-05}. Best is trial 15 with value: 0.705588.[0m
[32m[I 2022-10-20 05:03:33,714][0m Trial 12 finished with value: 0.6930092936118972 and parameters: {'qda_reg_param': 0.2, 'qda_tol': 0.0005432926939722307}. Best is trial 15 with value: 0.705588.[0m
[32m[I 2022-10-20 05:03:33,723][0m Trial 15 finished with value: 0.7055881487675915 and parameters: {'qda_reg_param': 0.4, 'qda_tol': 1.3355455716382133e-06}. Best is trial 15 with value: 0.705588.[0m
[32m[I 2022-10-20 05:03:38,466][0m Trial 20 finished with value: 0.7064578820031926 and parameters: {'qda_reg_param': 0.35000000000000003, 'qda_tol': 0.00013710464827757345}. Best is trial 20 with value: 0.706458.[0m
[32m[I 2022-10-20 05:03:38,468][0m Trial 21 finished with value: 0.7055881487675915 and parameters: {'qda_reg_param': 0.4, 'qda_tol': 1.2454078394609677e-06}. Best is trial 20 with value: 0.706458.[0m
[32m[I 2022-10-20 05:03:38,471][0m Trial 22 finished with value: 0.7055881487675915 and parameters: {'qda_reg_param': 0.4, 'qda_tol': 1.0311952715689864e-06}. Best is trial 20 with value: 0.706458.[0m
[32m[I 2022-10-20 05:03:38,550][0m Trial 18 finished with value: 0.7055881487675915 and parameters: {'qda_reg_param': 0.4, 'qda_tol': 1.4596548417648004e-06}. Best is trial 20 with value: 0.706458.[0m
[32m[I 2022-10-20 05:03:38,551][0m Trial 17 finished with value: 0.7055881487675915 and parameters: {'qda_reg_param': 0.4, 'qda_tol': 0.00015118481735015678}. Best is trial 20 with value: 0.706458.[0m
[32m[I 2022-10-20 05:03:38,731][0m Trial 23 finished with value: 0.7055881487675915 and parameters: {'qda_reg_param': 0.4, 'qda_tol': 0.00016267617576630445}. Best is trial 20 with value: 0.706458.[0m
[32m[I 2022-10-20 05:03:38,847][0m Trial 19 finished with value: 0.7055881487675915 and parameters: {'qda_reg_param': 0.4, 'qda_tol': 0.0001230488277878854}. Best is trial 20 with value: 0.706458.[0m
[32m[I 2022-10-20 05:03:38,848][0m Trial 16 finished with value: 0.7055881487675915 and parameters: {'qda_reg_param': 0.4, 'qda_tol': 0.0001382298919807391}. Best is trial 20 with value: 0.706458.[0m
[32m[I 2022-10-20 05:03:43,620][0m Trial 25 finished with value: 0.044843378911844006 and parameters: {'qda_reg_param': 0.1, 'qda_tol': 2.0975853020972744e-05}. Best is trial 20 with value: 0.706458.[0m
[32m[I 2022-10-20 05:03:43,784][0m Trial 29 finished with value: 0.05103159168250427 and parameters: {'qda_reg_param': 0.05, 'qda_tol': 2.6628432724934417e-05}. Best is trial 20 with value: 0.706458.[0m
[32m[I 2022-10-20 05:03:43,787][0m Trial 26 finished with value: 0.05103159168250427 and parameters: {'qda_reg_param': 0.05, 'qda_tol': 2.4198365722245315e-05}. Best is trial 20 with value: 0.706458.[0m
[32m[I 2022-10-20 05:03:43,793][0m Trial 24 finished with value: 0.11573887834229303 and parameters: {'qda_reg_param': 0.0, 'qda_tol': 1.8004216827238685e-05}. Best is trial 20 with value: 0.706458.[0m
[32m[I 2022-10-20 05:03:43,883][0m Trial 31 finished with value: 0.044843378911844006 and parameters: {'qda_reg_param': 0.1, 'qda_tol': 2.496462051591914e-05}. Best is trial 20 with value: 0.706458.[0m
[32m[I 2022-10-20 05:03:43,962][0m Trial 30 finished with value: 0.044843378911844006 and parameters: {'qda_reg_param': 0.1, 'qda_tol': 2.0978402704649132e-05}. Best is trial 20 with value: 0.706458.[0m
