[32m[I 2022-10-20 03:35:06,622][0m Trial 1 finished with value: 0.6950742018218817 and parameters: {'mlpc_hidden_layer_count': 2, 'mlpc_learning_rate': 'adaptive', 'mlpc_learning_rate_init': 0.16142865947973825, 'mplc_max_iter': 2000}. Best is trial 1 with value: 0.695074.[0m
[32m[I 2022-10-20 03:35:06,975][0m sklearn.model_selection.train_test_split: running accelerated version on CPU[0m
[32m[I 2022-10-20 03:35:07,002][0m sklearn.model_selection.train_test_split: fallback to original Scikit-learn[0m
[32m[I 2022-10-20 03:35:09,274][0m Trial 5 finished with value: 0.6950742018218817 and parameters: {'mlpc_hidden_layer_count': 2, 'mlpc_learning_rate': 'adaptive', 'mlpc_learning_rate_init': 0.11595824790074151, 'mplc_max_iter': 2000}. Best is trial 1 with value: 0.695074.[0m
[32m[I 2022-10-20 03:35:09,608][0m sklearn.model_selection.train_test_split: running accelerated version on CPU[0m
[32m[I 2022-10-20 03:35:09,636][0m sklearn.model_selection.train_test_split: fallback to original Scikit-learn[0m
[32m[I 2022-10-20 03:36:20,412][0m Trial 2 finished with value: 0.7607232992006341 and parameters: {'mlpc_hidden_layer_count': 1, 'mlpc_learning_rate': 'constant', 'mlpc_learning_rate_init': 6.731472178451776e-06, 'mplc_max_iter': 2000}. Best is trial 2 with value: 0.760723.[0m
[32m[I 2022-10-20 03:36:20,744][0m sklearn.model_selection.train_test_split: running accelerated version on CPU[0m
[32m[I 2022-10-20 03:36:20,771][0m sklearn.model_selection.train_test_split: fallback to original Scikit-learn[0m
[32m[I 2022-10-20 03:38:03,141][0m Trial 6 finished with value: 0.836319607994449 and parameters: {'mlpc_hidden_layer_count': 1, 'mlpc_learning_rate': 'invscaling', 'mlpc_learning_rate_init': 0.00010544709342596726, 'mplc_max_iter': 2000}. Best is trial 6 with value: 0.83632.[0m
[32m[I 2022-10-20 03:38:03,453][0m sklearn.model_selection.train_test_split: running accelerated version on CPU[0m
[32m[I 2022-10-20 03:38:03,482][0m sklearn.model_selection.train_test_split: fallback to original Scikit-learn[0m
[32m[I 2022-10-20 03:39:21,942][0m Trial 4 finished with value: 0.6950742018218817 and parameters: {'mlpc_hidden_layer_count': 3, 'mlpc_learning_rate': 'constant', 'mlpc_learning_rate_init': 0.3048579458153885, 'mplc_max_iter': 2000}. Best is trial 6 with value: 0.83632.[0m
[32m[I 2022-10-20 03:39:22,253][0m sklearn.model_selection.train_test_split: running accelerated version on CPU[0m
[32m[I 2022-10-20 03:39:22,278][0m sklearn.model_selection.train_test_split: fallback to original Scikit-learn[0m
[32m[I 2022-10-20 03:41:43,937][0m Trial 11 finished with value: 0.7746838643279249 and parameters: {'mlpc_hidden_layer_count': 1, 'mlpc_learning_rate': 'adaptive', 'mlpc_learning_rate_init': 0.006528168397368248, 'mplc_max_iter': 2000}. Best is trial 6 with value: 0.83632.[0m
[32m[I 2022-10-20 03:41:44,260][0m sklearn.model_selection.train_test_split: running accelerated version on CPU[0m
[32m[I 2022-10-20 03:41:44,287][0m sklearn.model_selection.train_test_split: fallback to original Scikit-learn[0m
[32m[I 2022-10-20 03:43:30,279][0m Trial 9 finished with value: 0.8601849090815585 and parameters: {'mlpc_hidden_layer_count': 2, 'mlpc_learning_rate': 'invscaling', 'mlpc_learning_rate_init': 2.905167347740449e-05, 'mplc_max_iter': 2000}. Best is trial 9 with value: 0.860185.[0m
[32m[I 2022-10-20 03:43:30,608][0m sklearn.model_selection.train_test_split: running accelerated version on CPU[0m
[32m[I 2022-10-20 03:43:30,636][0m sklearn.model_selection.train_test_split: fallback to original Scikit-learn[0m
[32m[I 2022-10-20 03:44:55,194][0m Trial 12 finished with value: 0.6950742018218817 and parameters: {'mlpc_hidden_layer_count': 2, 'mlpc_learning_rate': 'invscaling', 'mlpc_learning_rate_init': 0.025669852556213544, 'mplc_max_iter': 2000}. Best is trial 9 with value: 0.860185.[0m
[32m[I 2022-10-20 03:44:55,560][0m sklearn.model_selection.train_test_split: running accelerated version on CPU[0m
[32m[I 2022-10-20 03:44:55,588][0m sklearn.model_selection.train_test_split: fallback to original Scikit-learn[0m
[32m[I 2022-10-20 03:47:23,239][0m Trial 10 finished with value: 0.8879599437771517 and parameters: {'mlpc_hidden_layer_count': 1, 'mlpc_learning_rate': 'invscaling', 'mlpc_learning_rate_init': 0.00046559807882748996, 'mplc_max_iter': 2000}. Best is trial 10 with value: 0.88796.[0m
[32m[I 2022-10-20 03:47:23,569][0m sklearn.model_selection.train_test_split: running accelerated version on CPU[0m
[32m[I 2022-10-20 03:47:23,596][0m sklearn.model_selection.train_test_split: fallback to original Scikit-learn[0m
[32m[I 2022-10-20 03:47:47,474][0m Trial 3 finished with value: 0.8610730664349177 and parameters: {'mlpc_hidden_layer_count': 1, 'mlpc_learning_rate': 'invscaling', 'mlpc_learning_rate_init': 2.428755899792198e-05, 'mplc_max_iter': 2000}. Best is trial 10 with value: 0.88796.[0m
[32m[I 2022-10-20 03:47:47,818][0m sklearn.model_selection.train_test_split: running accelerated version on CPU[0m
[32m[I 2022-10-20 03:47:47,845][0m sklearn.model_selection.train_test_split: fallback to original Scikit-learn[0m
[32m[I 2022-10-20 03:48:41,299][0m Trial 7 finished with value: 0.8774876368977126 and parameters: {'mlpc_hidden_layer_count': 1, 'mlpc_learning_rate': 'adaptive', 'mlpc_learning_rate_init': 1.7421549548501386e-05, 'mplc_max_iter': 2000}. Best is trial 10 with value: 0.88796.[0m
[32m[I 2022-10-20 03:48:41,635][0m sklearn.model_selection.train_test_split: running accelerated version on CPU[0m
[32m[I 2022-10-20 03:48:41,661][0m sklearn.model_selection.train_test_split: fallback to original Scikit-learn[0m
[32m[I 2022-10-20 03:48:49,287][0m Trial 14 finished with value: 0.7795876179217192 and parameters: {'mlpc_hidden_layer_count': 2, 'mlpc_learning_rate': 'invscaling', 'mlpc_learning_rate_init': 0.0028406277729458515, 'mplc_max_iter': 2000}. Best is trial 10 with value: 0.88796.[0m
[32m[I 2022-10-20 03:48:49,613][0m sklearn.model_selection.train_test_split: running accelerated version on CPU[0m
[32m[I 2022-10-20 03:48:49,641][0m sklearn.model_selection.train_test_split: fallback to original Scikit-learn[0m
[32m[I 2022-10-20 03:52:59,023][0m Trial 16 finished with value: 0.7063851750297672 and parameters: {'mlpc_hidden_layer_count': 2, 'mlpc_learning_rate': 'constant', 'mlpc_learning_rate_init': 0.003209422209835527, 'mplc_max_iter': 2000}. Best is trial 10 with value: 0.88796.[0m
[32m[I 2022-10-20 03:52:59,349][0m sklearn.model_selection.train_test_split: running accelerated version on CPU[0m
[32m[I 2022-10-20 03:52:59,375][0m sklearn.model_selection.train_test_split: fallback to original Scikit-learn[0m
[32m[I 2022-10-20 03:54:23,178][0m Trial 15 finished with value: 0.6950742018218817 and parameters: {'mlpc_hidden_layer_count': 3, 'mlpc_learning_rate': 'adaptive', 'mlpc_learning_rate_init': 0.9857181060338713, 'mplc_max_iter': 2000}. Best is trial 10 with value: 0.88796.[0m
[32m[I 2022-10-20 03:54:23,500][0m sklearn.model_selection.train_test_split: running accelerated version on CPU[0m
[32m[I 2022-10-20 03:54:23,528][0m sklearn.model_selection.train_test_split: fallback to original Scikit-learn[0m
[32m[I 2022-10-20 03:54:30,836][0m Trial 13 finished with value: 0.9117257484056412 and parameters: {'mlpc_hidden_layer_count': 2, 'mlpc_learning_rate': 'adaptive', 'mlpc_learning_rate_init': 0.00010400498773159376, 'mplc_max_iter': 2000}. Best is trial 13 with value: 0.911726.[0m
[32m[I 2022-10-20 03:54:31,153][0m sklearn.model_selection.train_test_split: running accelerated version on CPU[0m
[32m[I 2022-10-20 03:54:31,179][0m sklearn.model_selection.train_test_split: fallback to original Scikit-learn[0m
[32m[I 2022-10-20 04:00:59,381][0m Trial 0 finished with value: 0.9211903873791436 and parameters: {'mlpc_hidden_layer_count': 3, 'mlpc_learning_rate': 'invscaling', 'mlpc_learning_rate_init': 3.707076844514952e-05, 'mplc_max_iter': 2000}. Best is trial 0 with value: 0.92119.[0m
[32m[I 2022-10-20 04:00:59,740][0m sklearn.model_selection.train_test_split: running accelerated version on CPU[0m
[32m[I 2022-10-20 04:00:59,768][0m sklearn.model_selection.train_test_split: fallback to original Scikit-learn[0m
[32m[I 2022-10-20 04:02:45,576][0m Trial 20 finished with value: 0.8858156874003821 and parameters: {'mlpc_hidden_layer_count': 1, 'mlpc_learning_rate': 'adaptive', 'mlpc_learning_rate_init': 0.00033396917923408107, 'mplc_max_iter': 2000}. Best is trial 0 with value: 0.92119.[0m
[32m[I 2022-10-20 04:02:45,924][0m sklearn.model_selection.train_test_split: running accelerated version on CPU[0m
[32m[I 2022-10-20 04:02:45,950][0m sklearn.model_selection.train_test_split: fallback to original Scikit-learn[0m
[32m[I 2022-10-20 04:04:28,135][0m Trial 21 finished with value: 0.4291560652114132 and parameters: {'mlpc_hidden_layer_count': 1, 'mlpc_learning_rate': 'adaptive', 'mlpc_learning_rate_init': 1.2326953044170663e-06, 'mplc_max_iter': 2000}. Best is trial 0 with value: 0.92119.[0m
[32m[I 2022-10-20 04:04:28,471][0m sklearn.model_selection.train_test_split: running accelerated version on CPU[0m
[32m[I 2022-10-20 04:04:28,496][0m sklearn.model_selection.train_test_split: fallback to original Scikit-learn[0m
[32m[I 2022-10-20 04:05:33,036][0m Trial 8 finished with value: 0.9235561267847391 and parameters: {'mlpc_hidden_layer_count': 3, 'mlpc_learning_rate': 'invscaling', 'mlpc_learning_rate_init': 4.685641309124142e-05, 'mplc_max_iter': 2000}. Best is trial 8 with value: 0.923556.[0m
[32m[I 2022-10-20 04:05:33,365][0m sklearn.model_selection.train_test_split: running accelerated version on CPU[0m
[32m[I 2022-10-20 04:05:33,391][0m sklearn.model_selection.train_test_split: fallback to original Scikit-learn[0m
[32m[I 2022-10-20 04:06:36,608][0m Trial 18 finished with value: 0.937761746938457 and parameters: {'mlpc_hidden_layer_count': 1, 'mlpc_learning_rate': 'adaptive', 'mlpc_learning_rate_init': 0.0006541922528342011, 'mplc_max_iter': 2000}. Best is trial 18 with value: 0.937762.[0m
[32m[I 2022-10-20 04:06:36,944][0m sklearn.model_selection.train_test_split: running accelerated version on CPU[0m
[32m[I 2022-10-20 04:06:36,970][0m sklearn.model_selection.train_test_split: fallback to original Scikit-learn[0m
[32m[I 2022-10-20 04:08:54,964][0m Trial 19 finished with value: 0.9123409869165789 and parameters: {'mlpc_hidden_layer_count': 1, 'mlpc_learning_rate': 'adaptive', 'mlpc_learning_rate_init': 0.00042146532125738397, 'mplc_max_iter': 2000}. Best is trial 18 with value: 0.937762.[0m
[32m[I 2022-10-20 04:08:55,303][0m sklearn.model_selection.train_test_split: running accelerated version on CPU[0m
[32m[I 2022-10-20 04:08:55,329][0m sklearn.model_selection.train_test_split: fallback to original Scikit-learn[0m
[32m[I 2022-10-20 04:09:42,396][0m Trial 17 finished with value: 0.7967791818435299 and parameters: {'mlpc_hidden_layer_count': 3, 'mlpc_learning_rate': 'invscaling', 'mlpc_learning_rate_init': 0.0006283853178504702, 'mplc_max_iter': 2000}. Best is trial 18 with value: 0.937762.[0m
[32m[I 2022-10-20 04:46:14,984][0m Trial 24 finished with value: 0.8724742177102803 and parameters: {'mlpc_hidden_layer_count': 3, 'mlpc_learning_rate': 'adaptive', 'mlpc_learning_rate_init': 1.6418737579308893e-06, 'mplc_max_iter': 2000}. Best is trial 18 with value: 0.937762.[0m
[32m[I 2022-10-20 04:48:28,723][0m Trial 28 finished with value: 0.9356891727433834 and parameters: {'mlpc_hidden_layer_count': 3, 'mlpc_learning_rate': 'invscaling', 'mlpc_learning_rate_init': 4.770233867024423e-06, 'mplc_max_iter': 2000}. Best is trial 18 with value: 0.937762.[0m
[32m[I 2022-10-20 04:51:19,887][0m Trial 22 finished with value: 0.8672164022720683 and parameters: {'mlpc_hidden_layer_count': 3, 'mlpc_learning_rate': 'invscaling', 'mlpc_learning_rate_init': 1.1700908078069205e-06, 'mplc_max_iter': 2000}. Best is trial 18 with value: 0.937762.[0m
[32m[I 2022-10-20 04:54:14,202][0m Trial 25 finished with value: 0.8678811704352201 and parameters: {'mlpc_hidden_layer_count': 3, 'mlpc_learning_rate': 'invscaling', 'mlpc_learning_rate_init': 1.2049593453784252e-06, 'mplc_max_iter': 2000}. Best is trial 18 with value: 0.937762.[0m
[32m[I 2022-10-20 04:56:57,479][0m Trial 23 finished with value: 0.9405649059169727 and parameters: {'mlpc_hidden_layer_count': 3, 'mlpc_learning_rate': 'adaptive', 'mlpc_learning_rate_init': 2.6867343968290965e-06, 'mplc_max_iter': 2000}. Best is trial 23 with value: 0.940565.[0m
[32m[I 2022-10-20 04:58:10,877][0m Trial 26 finished with value: 0.8624659502913491 and parameters: {'mlpc_hidden_layer_count': 3, 'mlpc_learning_rate': 'invscaling', 'mlpc_learning_rate_init': 1.2360614835806125e-06, 'mplc_max_iter': 2000}. Best is trial 23 with value: 0.940565.[0m
[32m[I 2022-10-20 04:58:42,385][0m Trial 27 finished with value: 0.9400558064640713 and parameters: {'mlpc_hidden_layer_count': 3, 'mlpc_learning_rate': 'constant', 'mlpc_learning_rate_init': 2.5506266247709565e-06, 'mplc_max_iter': 2000}. Best is trial 23 with value: 0.940565.[0m
[32m[I 2022-10-20 04:58:42,463][0m EarlyStopping exceeded for MLPClassifier; no new best scores on iters 20.[0m
[32m[I 2022-10-20 04:58:42,463][0m Study finished.[0m
[32m[I 2022-10-20 04:58:42,470][0m --------------------------------------------------------------------------------[0m
[32m[I 2022-10-20 04:58:42,471][0m --------------------             MultinomialNB              --------------------[0m
[32m[I 2022-10-20 04:58:42,471][0m --------------------------------------------------------------------------------[0m
[32m[I 2022-10-20 04:58:42,501][0m A new study created in RDB with name: MultinomialNB_e448dfef[0m
[32m[I 2022-10-20 04:58:42,507][0m Study started.[0m
[32m[I 2022-10-20 04:58:44,903][0m Trial 4 finished with value: 0.0961521095913611 and parameters: {'mnb_alpha': 0.7000000000000001, 'mnb_fit_prior': False}. Best is trial 4 with value: 0.0961521.[0m
[32m[I 2022-10-20 04:58:44,907][0m Trial 7 finished with value: 0.09610301233200992 and parameters: {'mnb_alpha': 0.25, 'mnb_fit_prior': True}. Best is trial 4 with value: 0.0961521.[0m
[32m[I 2022-10-20 04:58:45,076][0m Trial 1 finished with value: 0.09610415927238608 and parameters: {'mnb_alpha': 0.9, 'mnb_fit_prior': True}. Best is trial 3 with value: 0.0961521.[0m
[32m[I 2022-10-20 04:58:45,161][0m Trial 5 finished with value: 0.09610415927238608 and parameters: {'mnb_alpha': 0.9, 'mnb_fit_prior': True}. Best is trial 3 with value: 0.0961521.[0m
[32m[I 2022-10-20 04:58:45,162][0m Trial 3 finished with value: 0.0961521095913611 and parameters: {'mnb_alpha': 0.65, 'mnb_fit_prior': False}. Best is trial 3 with value: 0.0961521.[0m
[32m[I 2022-10-20 04:58:45,165][0m Trial 6 finished with value: 0.09610415927238608 and parameters: {'mnb_alpha': 1.0, 'mnb_fit_prior': True}. Best is trial 3 with value: 0.0961521.[0m
[32m[I 2022-10-20 04:58:45,242][0m Trial 2 finished with value: 0.0961031485471693 and parameters: {'mnb_alpha': 0.5, 'mnb_fit_prior': True}. Best is trial 3 with value: 0.0961521.[0m
[32m[I 2022-10-20 04:58:45,245][0m Trial 0 finished with value: 0.09610301233200992 and parameters: {'mnb_alpha': 0.25, 'mnb_fit_prior': True}. Best is trial 3 with value: 0.0961521.[0m
[32m[I 2022-10-20 04:58:47,926][0m Trial 12 finished with value: 0.09615262642719138 and parameters: {'mnb_alpha': 0.45, 'mnb_fit_prior': False}. Best is trial 12 with value: 0.0961526.[0m
[32m[I 2022-10-20 04:58:47,932][0m Trial 14 finished with value: 0.09615246535891787 and parameters: {'mnb_alpha': 0.15000000000000002, 'mnb_fit_prior': False}. Best is trial 12 with value: 0.0961526.[0m
[32m[I 2022-10-20 04:58:48,009][0m Trial 15 finished with value: 0.0961521095913611 and parameters: {'mnb_alpha': 0.8, 'mnb_fit_prior': False}. Best is trial 12 with value: 0.0961526.[0m
[32m[I 2022-10-20 04:58:48,011][0m Trial 9 finished with value: 0.09615241578806163 and parameters: {'mnb_alpha': 0.1, 'mnb_fit_prior': False}. Best is trial 12 with value: 0.0961526.[0m
[32m[I 2022-10-20 04:58:48,012][0m Trial 11 finished with value: 0.09615256504156225 and parameters: {'mnb_alpha': 0.35000000000000003, 'mnb_fit_prior': False}. Best is trial 12 with value: 0.0961526.[0m
[32m[I 2022-10-20 04:58:48,087][0m Trial 13 finished with value: 0.09615246535891787 and parameters: {'mnb_alpha': 0.15000000000000002, 'mnb_fit_prior': False}. Best is trial 12 with value: 0.0961526.[0m
[32m[I 2022-10-20 04:58:48,161][0m Trial 8 finished with value: 0.09610306217337834 and parameters: {'mnb_alpha': 0.30000000000000004, 'mnb_fit_prior': True}. Best is trial 12 with value: 0.0961526.[0m
[32m[I 2022-10-20 04:58:48,322][0m Trial 10 finished with value: 0.0961521095913611 and parameters: {'mnb_alpha': 0.75, 'mnb_fit_prior': False}. Best is trial 12 with value: 0.0961526.[0m
[32m[I 2022-10-20 04:58:50,917][0m Trial 18 finished with value: 0.09615262642719138 and parameters: {'mnb_alpha': 0.45, 'mnb_fit_prior': False}. Best is trial 22 with value: 0.0961526.[0m
[32m[I 2022-10-20 04:58:51,007][0m Trial 22 finished with value: 0.09615262642719138 and parameters: {'mnb_alpha': 0.45, 'mnb_fit_prior': False}. Best is trial 23 with value: 0.0961526.[0m
[32m[I 2022-10-20 04:58:51,102][0m Trial 21 finished with value: 0.09615262642719138 and parameters: {'mnb_alpha': 0.45, 'mnb_fit_prior': False}. Best is trial 23 with value: 0.0961526.[0m
[32m[I 2022-10-20 04:58:51,104][0m Trial 23 finished with value: 0.09615265147081081 and parameters: {'mnb_alpha': 0.5, 'mnb_fit_prior': False}. Best is trial 19 with value: 0.0961526.[0m
[32m[I 2022-10-20 04:58:51,106][0m Trial 17 finished with value: 0.09615262642719138 and parameters: {'mnb_alpha': 0.4, 'mnb_fit_prior': False}. Best is trial 19 with value: 0.0961526.[0m
[32m[I 2022-10-20 04:58:51,348][0m Trial 19 finished with value: 0.09615265147081081 and parameters: {'mnb_alpha': 0.5, 'mnb_fit_prior': False}. Best is trial 19 with value: 0.0961526.[0m
[32m[I 2022-10-20 04:58:51,354][0m Trial 20 finished with value: 0.09615262642719138 and parameters: {'mnb_alpha': 0.45, 'mnb_fit_prior': False}. Best is trial 19 with value: 0.0961526.[0m
[32m[I 2022-10-20 04:58:51,431][0m Trial 16 finished with value: 0.09615262642719138 and parameters: {'mnb_alpha': 0.45, 'mnb_fit_prior': False}. Best is trial 19 with value: 0.0961526.[0m
[32m[I 2022-10-20 04:58:53,910][0m Trial 26 finished with value: 0.0961521095913611 and parameters: {'mnb_alpha': 0.6000000000000001, 'mnb_fit_prior': False}. Best is trial 19 with value: 0.0961526.[0m
[32m[I 2022-10-20 04:58:54,015][0m Trial 25 finished with value: 0.0961521095913611 and parameters: {'mnb_alpha': 0.6000000000000001, 'mnb_fit_prior': False}. Best is trial 19 with value: 0.0961526.[0m
[32m[I 2022-10-20 04:58:54,020][0m Trial 28 finished with value: 0.0961521095913611 and parameters: {'mnb_alpha': 0.6000000000000001, 'mnb_fit_prior': False}. Best is trial 19 with value: 0.0961526.[0m
[32m[I 2022-10-20 04:58:54,091][0m Trial 24 finished with value: 0.0961521095913611 and parameters: {'mnb_alpha': 0.6000000000000001, 'mnb_fit_prior': False}. Best is trial 19 with value: 0.0961526.[0m
[32m[I 2022-10-20 04:58:54,096][0m Trial 30 finished with value: 0.0961521095913611 and parameters: {'mnb_alpha': 0.6000000000000001, 'mnb_fit_prior': False}. Best is trial 19 with value: 0.0961526.[0m
[32m[I 2022-10-20 04:58:54,096][0m Trial 29 finished with value: 0.0961521095913611 and parameters: {'mnb_alpha': 0.6000000000000001, 'mnb_fit_prior': False}. Best is trial 19 with value: 0.0961526.[0m
[32m[I 2022-10-20 04:58:54,324][0m Trial 31 finished with value: 0.0961521095913611 and parameters: {'mnb_alpha': 0.6000000000000001, 'mnb_fit_prior': False}. Best is trial 19 with value: 0.0961526.[0m
[32m[I 2022-10-20 04:58:54,477][0m Trial 27 finished with value: 0.0961521095913611 and parameters: {'mnb_alpha': 0.6000000000000001, 'mnb_fit_prior': False}. Best is trial 19 with value: 0.0961526.[0m
[32m[I 2022-10-20 04:58:54,569][0m EarlyStopping exceeded for MultinomialNB; no new best scores on iters 20.[0m
[32m[I 2022-10-20 04:58:54,570][0m Study finished.[0m
[32m[I 2022-10-20 04:58:54,576][0m --------------------------------------------------------------------------------[0m
[32m[I 2022-10-20 04:58:54,576][0m --------------------      PassiveAggressiveClassifier       --------------------[0m
[32m[I 2022-10-20 04:58:54,577][0m --------------------------------------------------------------------------------[0m
[32m[I 2022-10-20 04:58:54,604][0m A new study created in RDB with name: PassiveAggressiveClassifier_e448dfef[0m
[32m[I 2022-10-20 04:58:54,610][0m Study started.[0m
[32m[I 2022-10-20 04:59:33,295][0m Trial 3 finished with value: 0.7979305445405835 and parameters: {'pac_C': 0.4346839853263316, 'pac_early_stopping': True, 'pac_validation_fraction': 0.25, 'pac_n_iter_no_change': 10}. Best is trial 3 with value: 0.797931.[0m
[32m[I 2022-10-20 04:59:33,496][0m Trial 6 finished with value: 0.7979305445405835 and parameters: {'pac_C': 0.4801432369250106, 'pac_early_stopping': True, 'pac_validation_fraction': 0.25, 'pac_n_iter_no_change': 10}. Best is trial 3 with value: 0.797931.[0m
[32m[I 2022-10-20 04:59:34,723][0m Trial 5 finished with value: 0.7979305445405835 and parameters: {'pac_C': 0.051374395721674265, 'pac_early_stopping': True, 'pac_validation_fraction': 0.25, 'pac_n_iter_no_change': 10}. Best is trial 3 with value: 0.797931.[0m
[32m[I 2022-10-20 04:59:34,861][0m Trial 0 finished with value: 0.7979305445405835 and parameters: {'pac_C': 28.50643181266922, 'pac_early_stopping': True, 'pac_validation_fraction': 0.25, 'pac_n_iter_no_change': 10}. Best is trial 0 with value: 0.797931.[0m
