[32m[I 2022-10-19 17:47:51,312][0m Trial 7 finished with value: 0.8838168778224919 and parameters: {'brf_n_estimators': 100, 'brf_criterion': 'gini', 'brf_min_samples_split': 6, 'brf_min_samples_leaf': 49, 'brf_max_features': 4, 'brf_bootstrap': True}. Best is trial 3 with value: 0.98667.[0m
[32m[I 2022-10-19 17:48:11,322][0m Trial 1 finished with value: 0.9134649811056422 and parameters: {'brf_n_estimators': 120, 'brf_criterion': 'gini', 'brf_min_samples_split': 12, 'brf_min_samples_leaf': 47, 'brf_max_features': 4, 'brf_bootstrap': False}. Best is trial 3 with value: 0.98667.[0m
[32m[I 2022-10-19 17:48:23,357][0m sklearn.ensemble.RandomForestClassifier.predict: fallback to original Scikit-learn[0m
[32m[I 2022-10-19 17:48:23,357][0m sklearn.ensemble.RandomForestClassifier.predict_proba: fallback to original Scikit-learn[0m
[32m[I 2022-10-19 17:48:39,572][0m Trial 8 finished with value: 0.9181199071057343 and parameters: {'brf_n_estimators': 90, 'brf_criterion': 'entropy', 'brf_min_samples_split': 22, 'brf_min_samples_leaf': 32, 'brf_max_features': 1, 'brf_bootstrap': True}. Best is trial 3 with value: 0.98667.[0m
[32m[I 2022-10-19 17:48:43,362][0m sklearn.ensemble.RandomForestClassifier.predict: fallback to original Scikit-learn[0m
[32m[I 2022-10-19 17:48:43,363][0m sklearn.ensemble.RandomForestClassifier.predict_proba: fallback to original Scikit-learn[0m
[32m[I 2022-10-19 17:48:46,784][0m sklearn.ensemble.RandomForestClassifier.predict: fallback to original Scikit-learn[0m
[32m[I 2022-10-19 17:48:46,786][0m sklearn.ensemble.RandomForestClassifier.predict_proba: fallback to original Scikit-learn[0m
[32m[I 2022-10-19 17:48:49,688][0m sklearn.ensemble.RandomForestClassifier.predict: fallback to original Scikit-learn[0m
[32m[I 2022-10-19 17:48:49,689][0m sklearn.ensemble.RandomForestClassifier.predict_proba: fallback to original Scikit-learn[0m
[32m[I 2022-10-19 17:49:06,740][0m Trial 9 finished with value: 0.9920349297443435 and parameters: {'brf_n_estimators': 100, 'brf_criterion': 'gini', 'brf_min_samples_split': 15, 'brf_min_samples_leaf': 9, 'brf_max_features': 6, 'brf_bootstrap': False}. Best is trial 9 with value: 0.992035.[0m
[32m[I 2022-10-19 17:49:09,484][0m Trial 2 finished with value: 0.964559097255321 and parameters: {'brf_n_estimators': 170, 'brf_criterion': 'gini', 'brf_min_samples_split': 24, 'brf_min_samples_leaf': 31, 'brf_max_features': 4, 'brf_bootstrap': False}. Best is trial 9 with value: 0.992035.[0m
[32m[I 2022-10-19 17:49:12,903][0m Trial 0 finished with value: 0.896007422147624 and parameters: {'brf_n_estimators': 170, 'brf_criterion': 'gini', 'brf_min_samples_split': 42, 'brf_min_samples_leaf': 39, 'brf_max_features': 3, 'brf_bootstrap': True}. Best is trial 9 with value: 0.992035.[0m
[32m[I 2022-10-19 17:49:13,103][0m sklearn.ensemble.RandomForestClassifier.predict: fallback to original Scikit-learn[0m
[32m[I 2022-10-19 17:49:13,104][0m sklearn.ensemble.RandomForestClassifier.predict_proba: fallback to original Scikit-learn[0m
[32m[I 2022-10-19 17:49:46,309][0m Trial 6 finished with value: 0.9653266928516884 and parameters: {'brf_n_estimators': 200, 'brf_criterion': 'gini', 'brf_min_samples_split': 5, 'brf_min_samples_leaf': 25, 'brf_max_features': 3, 'brf_bootstrap': False}. Best is trial 9 with value: 0.992035.[0m
[32m[I 2022-10-19 17:50:26,112][0m sklearn.ensemble.RandomForestClassifier.predict: fallback to original Scikit-learn[0m
[32m[I 2022-10-19 17:50:26,113][0m sklearn.ensemble.RandomForestClassifier.predict_proba: fallback to original Scikit-learn[0m
[32m[I 2022-10-19 17:50:40,332][0m Trial 14 finished with value: 0.9896918111079946 and parameters: {'brf_n_estimators': 70, 'brf_criterion': 'gini', 'brf_min_samples_split': 41, 'brf_min_samples_leaf': 7, 'brf_max_features': 6, 'brf_bootstrap': False}. Best is trial 9 with value: 0.992035.[0m
[32m[I 2022-10-19 17:50:46,453][0m sklearn.ensemble.RandomForestClassifier.predict: fallback to original Scikit-learn[0m
[32m[I 2022-10-19 17:50:46,454][0m sklearn.ensemble.RandomForestClassifier.predict_proba: fallback to original Scikit-learn[0m
[32m[I 2022-10-19 17:50:48,633][0m sklearn.ensemble.RandomForestClassifier.predict: fallback to original Scikit-learn[0m
[32m[I 2022-10-19 17:50:48,635][0m sklearn.ensemble.RandomForestClassifier.predict_proba: fallback to original Scikit-learn[0m
[32m[I 2022-10-19 17:51:10,847][0m Trial 10 finished with value: 0.9261233432483587 and parameters: {'brf_n_estimators': 160, 'brf_criterion': 'gini', 'brf_min_samples_split': 23, 'brf_min_samples_leaf': 25, 'brf_max_features': 3, 'brf_bootstrap': True}. Best is trial 9 with value: 0.992035.[0m
[32m[I 2022-10-19 17:51:13,017][0m Trial 11 finished with value: 0.9798254549666289 and parameters: {'brf_n_estimators': 160, 'brf_criterion': 'entropy', 'brf_min_samples_split': 16, 'brf_min_samples_leaf': 38, 'brf_max_features': 6, 'brf_bootstrap': False}. Best is trial 9 with value: 0.992035.[0m
[32m[I 2022-10-19 17:51:16,499][0m sklearn.ensemble.RandomForestClassifier.predict: fallback to original Scikit-learn[0m
[32m[I 2022-10-19 17:51:16,500][0m sklearn.ensemble.RandomForestClassifier.predict_proba: fallback to original Scikit-learn[0m
[32m[I 2022-10-19 17:51:36,249][0m sklearn.ensemble.RandomForestClassifier.predict: fallback to original Scikit-learn[0m
[32m[I 2022-10-19 17:51:36,250][0m sklearn.ensemble.RandomForestClassifier.predict_proba: fallback to original Scikit-learn[0m
[32m[I 2022-10-19 17:51:39,316][0m Trial 13 finished with value: 0.9153758261901886 and parameters: {'brf_n_estimators': 150, 'brf_criterion': 'gini', 'brf_min_samples_split': 14, 'brf_min_samples_leaf': 26, 'brf_max_features': 1, 'brf_bootstrap': True}. Best is trial 9 with value: 0.992035.[0m
[32m[I 2022-10-19 17:51:55,883][0m sklearn.ensemble.RandomForestClassifier.predict: fallback to original Scikit-learn[0m
[32m[I 2022-10-19 17:51:55,886][0m sklearn.ensemble.RandomForestClassifier.predict_proba: fallback to original Scikit-learn[0m
[32m[I 2022-10-19 17:52:04,871][0m sklearn.ensemble.RandomForestClassifier.predict: fallback to original Scikit-learn[0m
[32m[I 2022-10-19 17:52:04,872][0m sklearn.ensemble.RandomForestClassifier.predict_proba: fallback to original Scikit-learn[0m
[32m[I 2022-10-19 17:52:05,445][0m Trial 12 finished with value: 0.98358988151618 and parameters: {'brf_n_estimators': 190, 'brf_criterion': 'gini', 'brf_min_samples_split': 27, 'brf_min_samples_leaf': 24, 'brf_max_features': 7, 'brf_bootstrap': False}. Best is trial 9 with value: 0.992035.[0m
[32m[I 2022-10-19 17:52:08,929][0m Trial 18 finished with value: 0.9936235523350372 and parameters: {'brf_n_estimators': 70, 'brf_criterion': 'entropy', 'brf_min_samples_split': 49, 'brf_min_samples_leaf': 1, 'brf_max_features': 7, 'brf_bootstrap': False}. Best is trial 18 with value: 0.993624.[0m
[32m[I 2022-10-19 17:52:19,884][0m sklearn.ensemble.RandomForestClassifier.predict: fallback to original Scikit-learn[0m
[32m[I 2022-10-19 17:52:19,887][0m sklearn.ensemble.RandomForestClassifier.predict_proba: fallback to original Scikit-learn[0m
[32m[I 2022-10-19 17:52:24,131][0m sklearn.ensemble.RandomForestClassifier.predict: fallback to original Scikit-learn[0m
[32m[I 2022-10-19 17:52:24,133][0m sklearn.ensemble.RandomForestClassifier.predict_proba: fallback to original Scikit-learn[0m
[32m[I 2022-10-19 17:52:26,634][0m sklearn.ensemble.RandomForestClassifier.predict: fallback to original Scikit-learn[0m
[32m[I 2022-10-19 17:52:26,636][0m sklearn.ensemble.RandomForestClassifier.predict_proba: fallback to original Scikit-learn[0m
[32m[I 2022-10-19 17:52:27,439][0m sklearn.ensemble.RandomForestClassifier.predict: fallback to original Scikit-learn[0m
[32m[I 2022-10-19 17:52:27,441][0m sklearn.ensemble.RandomForestClassifier.predict_proba: fallback to original Scikit-learn[0m
[32m[I 2022-10-19 17:52:28,844][0m Trial 16 finished with value: 0.9923622744365349 and parameters: {'brf_n_estimators': 160, 'brf_criterion': 'entropy', 'brf_min_samples_split': 42, 'brf_min_samples_leaf': 3, 'brf_max_features': 2, 'brf_bootstrap': False}. Best is trial 18 with value: 0.993624.[0m
[32m[I 2022-10-19 17:52:38,643][0m Trial 19 finished with value: 0.9933981906798643 and parameters: {'brf_n_estimators': 70, 'brf_criterion': 'entropy', 'brf_min_samples_split': 49, 'brf_min_samples_leaf': 2, 'brf_max_features': 7, 'brf_bootstrap': False}. Best is trial 18 with value: 0.993624.[0m
[32m[I 2022-10-19 17:52:39,543][0m Trial 20 finished with value: 0.9934459745141866 and parameters: {'brf_n_estimators': 70, 'brf_criterion': 'gini', 'brf_min_samples_split': 50, 'brf_min_samples_leaf': 3, 'brf_max_features': 7, 'brf_bootstrap': False}. Best is trial 18 with value: 0.993624.[0m
[32m[I 2022-10-19 17:52:40,545][0m Trial 17 finished with value: 0.9934233743409736 and parameters: {'brf_n_estimators': 140, 'brf_criterion': 'entropy', 'brf_min_samples_split': 49, 'brf_min_samples_leaf': 2, 'brf_max_features': 7, 'brf_bootstrap': False}. Best is trial 18 with value: 0.993624.[0m
[32m[I 2022-10-19 17:52:48,396][0m sklearn.ensemble.RandomForestClassifier.predict: fallback to original Scikit-learn[0m
[32m[I 2022-10-19 17:52:48,419][0m sklearn.ensemble.RandomForestClassifier.predict_proba: fallback to original Scikit-learn[0m
[32m[I 2022-10-19 17:52:51,279][0m Trial 15 finished with value: 0.9350517304507971 and parameters: {'brf_n_estimators': 180, 'brf_criterion': 'entropy', 'brf_min_samples_split': 39, 'brf_min_samples_leaf': 44, 'brf_max_features': 3, 'brf_bootstrap': False}. Best is trial 18 with value: 0.993624.[0m
[32m[I 2022-10-19 17:53:03,361][0m Trial 21 finished with value: 0.9940543533362409 and parameters: {'brf_n_estimators': 70, 'brf_criterion': 'gini', 'brf_min_samples_split': 50, 'brf_min_samples_leaf': 1, 'brf_max_features': 7, 'brf_bootstrap': False}. Best is trial 21 with value: 0.994054.[0m
[32m[I 2022-10-19 17:53:14,709][0m sklearn.ensemble.RandomForestClassifier.predict: fallback to original Scikit-learn[0m
[32m[I 2022-10-19 17:53:14,716][0m sklearn.ensemble.RandomForestClassifier.predict_proba: fallback to original Scikit-learn[0m
[32m[I 2022-10-19 17:53:28,188][0m Trial 22 finished with value: 0.9936340487342782 and parameters: {'brf_n_estimators': 70, 'brf_criterion': 'entropy', 'brf_min_samples_split': 43, 'brf_min_samples_leaf': 1, 'brf_max_features': 6, 'brf_bootstrap': False}. Best is trial 21 with value: 0.994054.[0m
[32m[I 2022-10-19 17:53:30,235][0m sklearn.ensemble.RandomForestClassifier.predict: fallback to original Scikit-learn[0m
[32m[I 2022-10-19 17:53:30,236][0m sklearn.ensemble.RandomForestClassifier.predict_proba: fallback to original Scikit-learn[0m
[32m[I 2022-10-19 17:53:44,109][0m Trial 23 finished with value: 0.9934209323183986 and parameters: {'brf_n_estimators': 80, 'brf_criterion': 'entropy', 'brf_min_samples_split': 50, 'brf_min_samples_leaf': 2, 'brf_max_features': 7, 'brf_bootstrap': False}. Best is trial 21 with value: 0.994054.[0m
[32m[I 2022-10-19 17:54:01,562][0m sklearn.ensemble.RandomForestClassifier.predict: fallback to original Scikit-learn[0m
[32m[I 2022-10-19 17:54:01,563][0m sklearn.ensemble.RandomForestClassifier.predict_proba: fallback to original Scikit-learn[0m
[32m[I 2022-10-19 17:54:12,655][0m Trial 25 finished with value: 0.9868953156829179 and parameters: {'brf_n_estimators': 80, 'brf_criterion': 'entropy', 'brf_min_samples_split': 49, 'brf_min_samples_leaf': 16, 'brf_max_features': 7, 'brf_bootstrap': False}. Best is trial 21 with value: 0.994054.[0m
[32m[I 2022-10-19 17:54:21,090][0m sklearn.ensemble.RandomForestClassifier.predict: fallback to original Scikit-learn[0m
[32m[I 2022-10-19 17:54:21,090][0m sklearn.ensemble.RandomForestClassifier.predict_proba: fallback to original Scikit-learn[0m
[32m[I 2022-10-19 17:54:28,652][0m sklearn.ensemble.RandomForestClassifier.predict: fallback to original Scikit-learn[0m
[32m[I 2022-10-19 17:54:28,652][0m sklearn.ensemble.RandomForestClassifier.predict_proba: fallback to original Scikit-learn[0m
[32m[I 2022-10-19 17:54:30,383][0m Trial 29 finished with value: 0.9876729887544371 and parameters: {'brf_n_estimators': 80, 'brf_criterion': 'entropy', 'brf_min_samples_split': 50, 'brf_min_samples_leaf': 16, 'brf_max_features': 5, 'brf_bootstrap': False}. Best is trial 21 with value: 0.994054.[0m
[32m[I 2022-10-19 17:54:33,194][0m sklearn.ensemble.RandomForestClassifier.predict: fallback to original Scikit-learn[0m
[32m[I 2022-10-19 17:54:33,195][0m sklearn.ensemble.RandomForestClassifier.predict_proba: fallback to original Scikit-learn[0m
[32m[I 2022-10-19 17:54:36,251][0m sklearn.ensemble.RandomForestClassifier.predict: fallback to original Scikit-learn[0m
[32m[I 2022-10-19 17:54:36,252][0m sklearn.ensemble.RandomForestClassifier.predict_proba: fallback to original Scikit-learn[0m
[32m[I 2022-10-19 17:54:39,229][0m Trial 24 finished with value: 0.9934280014068805 and parameters: {'brf_n_estimators': 130, 'brf_criterion': 'entropy', 'brf_min_samples_split': 49, 'brf_min_samples_leaf': 1, 'brf_max_features': 2, 'brf_bootstrap': False}. Best is trial 21 with value: 0.994054.[0m
[32m[I 2022-10-19 17:54:40,229][0m sklearn.ensemble.RandomForestClassifier.predict: fallback to original Scikit-learn[0m
[32m[I 2022-10-19 17:54:40,230][0m sklearn.ensemble.RandomForestClassifier.predict_proba: fallback to original Scikit-learn[0m
[32m[I 2022-10-19 17:54:40,778][0m Trial 27 finished with value: 0.9920392137227759 and parameters: {'brf_n_estimators': 120, 'brf_criterion': 'entropy', 'brf_min_samples_split': 34, 'brf_min_samples_leaf': 13, 'brf_max_features': 5, 'brf_bootstrap': False}. Best is trial 21 with value: 0.994054.[0m
[32m[I 2022-10-19 17:54:42,553][0m Trial 26 finished with value: 0.987628087069931 and parameters: {'brf_n_estimators': 130, 'brf_criterion': 'entropy', 'brf_min_samples_split': 50, 'brf_min_samples_leaf': 17, 'brf_max_features': 5, 'brf_bootstrap': False}. Best is trial 21 with value: 0.994054.[0m
[32m[I 2022-10-19 17:54:44,646][0m Trial 28 finished with value: 0.9870757743918996 and parameters: {'brf_n_estimators': 130, 'brf_criterion': 'entropy', 'brf_min_samples_split': 50, 'brf_min_samples_leaf': 15, 'brf_max_features': 7, 'brf_bootstrap': False}. Best is trial 21 with value: 0.994054.[0m
[32m[I 2022-10-19 17:54:44,721][0m EarlyStopping exceeded for BalancedRandomForestClassifier; no new best scores on iters 20.[0m
[32m[I 2022-10-19 17:54:44,722][0m Study finished.[0m
[32m[I 2022-10-19 17:54:44,728][0m --------------------------------------------------------------------------------[0m
[32m[I 2022-10-19 17:54:44,729][0m --------------------              BernoulliNB               --------------------[0m
[32m[I 2022-10-19 17:54:44,730][0m --------------------------------------------------------------------------------[0m
[32m[I 2022-10-19 17:54:44,756][0m A new study created in RDB with name: BernoulliNB_e448dfef[0m
[32m[I 2022-10-19 17:54:44,762][0m Study started.[0m
[32m[I 2022-10-19 17:54:47,284][0m Trial 3 finished with value: 0.7323259635510226 and parameters: {'bnb_alpha': 0.45, 'bnb_binarize': 0.65, 'bnb_fit_prior': True}. Best is trial 3 with value: 0.732326.[0m
[32m[I 2022-10-19 17:54:47,378][0m Trial 1 finished with value: 0.7323259635510226 and parameters: {'bnb_alpha': 0.65, 'bnb_binarize': 0.0, 'bnb_fit_prior': True}. Best is trial 1 with value: 0.732326.[0m
[32m[I 2022-10-19 17:54:47,378][0m Trial 5 finished with value: 0.07429784596598596 and parameters: {'bnb_alpha': 0.9500000000000001, 'bnb_binarize': 0.5, 'bnb_fit_prior': False}. Best is trial 1 with value: 0.732326.[0m
[32m[I 2022-10-19 17:54:47,378][0m Trial 2 finished with value: 0.07430793772171441 and parameters: {'bnb_alpha': 0.2, 'bnb_binarize': 0.4, 'bnb_fit_prior': False}. Best is trial 1 with value: 0.732326.[0m
[32m[I 2022-10-19 17:54:47,608][0m Trial 6 finished with value: 0.10647384869588476 and parameters: {'bnb_alpha': 1.0, 'bnb_binarize': 1.0, 'bnb_fit_prior': False}. Best is trial 0 with value: 0.732326.[0m
[32m[I 2022-10-19 17:54:47,609][0m Trial 4 finished with value: 0.7323259635510226 and parameters: {'bnb_alpha': 0.25, 'bnb_binarize': 0.05, 'bnb_fit_prior': True}. Best is trial 0 with value: 0.732326.[0m
[32m[I 2022-10-19 17:54:47,754][0m Trial 0 finished with value: 0.7323259635510226 and parameters: {'bnb_alpha': 0.8500000000000001, 'bnb_binarize': 0.05, 'bnb_fit_prior': True}. Best is trial 0 with value: 0.732326.[0m
[32m[I 2022-10-19 17:54:47,828][0m Trial 7 finished with value: 0.7323259635510226 and parameters: {'bnb_alpha': 0.55, 'bnb_binarize': 0.9500000000000001, 'bnb_fit_prior': True}. Best is trial 0 with value: 0.732326.[0m
[32m[I 2022-10-19 17:54:50,339][0m Trial 8 finished with value: 0.7323259635510226 and parameters: {'bnb_alpha': 0.9, 'bnb_binarize': 0.8500000000000001, 'bnb_fit_prior': True}. Best is trial 0 with value: 0.732326.[0m
[32m[I 2022-10-19 17:54:50,436][0m Trial 12 finished with value: 0.7323259635510226 and parameters: {'bnb_alpha': 0.1, 'bnb_binarize': 0.65, 'bnb_fit_prior': True}. Best is trial 0 with value: 0.732326.[0m
[32m[I 2022-10-19 17:54:50,524][0m Trial 10 finished with value: 0.07429784596598596 and parameters: {'bnb_alpha': 0.8, 'bnb_binarize': 0.6000000000000001, 'bnb_fit_prior': False}. Best is trial 0 with value: 0.732326.[0m
[32m[I 2022-10-19 17:54:50,611][0m Trial 9 finished with value: 0.07429784596598596 and parameters: {'bnb_alpha': 1.0, 'bnb_binarize': 0.45, 'bnb_fit_prior': False}. Best is trial 0 with value: 0.732326.[0m
[32m[I 2022-10-19 17:54:50,616][0m Trial 11 finished with value: 0.7323259635510226 and parameters: {'bnb_alpha': 0.6000000000000001, 'bnb_binarize': 0.7000000000000001, 'bnb_fit_prior': True}. Best is trial 0 with value: 0.732326.[0m
[32m[I 2022-10-19 17:54:50,765][0m Trial 15 finished with value: 0.7323259635510226 and parameters: {'bnb_alpha': 0.75, 'bnb_binarize': 0.4, 'bnb_fit_prior': True}. Best is trial 0 with value: 0.732326.[0m
[32m[I 2022-10-19 17:54:50,765][0m Trial 14 finished with value: 0.074334981788516 and parameters: {'bnb_alpha': 0.05, 'bnb_binarize': 0.4, 'bnb_fit_prior': False}. Best is trial 0 with value: 0.732326.[0m
[32m[I 2022-10-19 17:54:50,910][0m Trial 13 finished with value: 0.7323259635510226 and parameters: {'bnb_alpha': 0.9, 'bnb_binarize': 0.9500000000000001, 'bnb_fit_prior': True}. Best is trial 0 with value: 0.732326.[0m
[32m[I 2022-10-19 17:54:53,287][0m Trial 16 finished with value: 0.7323259635510226 and parameters: {'bnb_alpha': 0.7000000000000001, 'bnb_binarize': 0.0, 'bnb_fit_prior': True}. Best is trial 0 with value: 0.732326.[0m
[32m[I 2022-10-19 17:54:53,457][0m Trial 17 finished with value: 0.7323259635510226 and parameters: {'bnb_alpha': 0.65, 'bnb_binarize': 0.0, 'bnb_fit_prior': True}. Best is trial 0 with value: 0.732326.[0m
[32m[I 2022-10-19 17:54:53,586][0m Trial 21 finished with value: 0.7323259635510226 and parameters: {'bnb_alpha': 0.7000000000000001, 'bnb_binarize': 0.0, 'bnb_fit_prior': True}. Best is trial 0 with value: 0.732326.[0m
[32m[I 2022-10-19 17:54:53,685][0m Trial 22 finished with value: 0.7323259635510226 and parameters: {'bnb_alpha': 0.7000000000000001, 'bnb_binarize': 0.0, 'bnb_fit_prior': True}. Best is trial 0 with value: 0.732326.[0m
[32m[I 2022-10-19 17:54:53,759][0m Trial 19 finished with value: 0.7323259635510226 and parameters: {'bnb_alpha': 0.7000000000000001, 'bnb_binarize': 0.0, 'bnb_fit_prior': True}. Best is trial 0 with value: 0.732326.[0m
[32m[I 2022-10-19 17:54:53,833][0m Trial 20 finished with value: 0.7323259635510226 and parameters: {'bnb_alpha': 0.7000000000000001, 'bnb_binarize': 0.0, 'bnb_fit_prior': True}. Best is trial 0 with value: 0.732326.[0m
[32m[I 2022-10-19 17:54:53,836][0m Trial 18 finished with value: 0.7323259635510226 and parameters: {'bnb_alpha': 0.7000000000000001, 'bnb_binarize': 0.0, 'bnb_fit_prior': True}. Best is trial 0 with value: 0.732326.[0m
[32m[I 2022-10-19 17:54:53,990][0m Trial 23 finished with value: 0.7323259635510226 and parameters: {'bnb_alpha': 0.7000000000000001, 'bnb_binarize': 0.0, 'bnb_fit_prior': True}. Best is trial 0 with value: 0.732326.[0m
[32m[I 2022-10-19 17:54:55,856][0m Trial 25 finished with value: 0.7323259635510226 and parameters: {'bnb_alpha': 0.5, 'bnb_binarize': 0.2, 'bnb_fit_prior': True}. Best is trial 0 with value: 0.732326.[0m
[32m[I 2022-10-19 17:54:55,857][0m Trial 24 finished with value: 0.7323259635510226 and parameters: {'bnb_alpha': 0.45, 'bnb_binarize': 0.2, 'bnb_fit_prior': True}. Best is trial 0 with value: 0.732326.[0m
[32m[I 2022-10-19 17:54:56,057][0m Trial 27 finished with value: 0.7323259635510226 and parameters: {'bnb_alpha': 0.5, 'bnb_binarize': 0.2, 'bnb_fit_prior': True}. Best is trial 0 with value: 0.732326.[0m
[32m[I 2022-10-19 17:54:56,247][0m Trial 26 finished with value: 0.7323259635510226 and parameters: {'bnb_alpha': 0.45, 'bnb_binarize': 0.15000000000000002, 'bnb_fit_prior': True}. Best is trial 0 with value: 0.732326.[0m
[32m[I 2022-10-19 17:54:56,250][0m Trial 29 finished with value: 0.7323259635510226 and parameters: {'bnb_alpha': 0.45, 'bnb_binarize': 0.2, 'bnb_fit_prior': True}. Best is trial 0 with value: 0.732326.[0m
