[32m[I 2022-10-20 05:12:27,668][0m Trial 17 finished with value: 0.6848996760022037 and parameters: {'rc_C': 175.91015627730496, 'rc_tol': 0.00338090363833864}. Best is trial 0 with value: 0.6849.[0m
[32m[I 2022-10-20 05:12:27,792][0m Trial 16 finished with value: 0.6848996760022037 and parameters: {'rc_C': 169.34590919634135, 'rc_tol': 0.003049120356269326}. Best is trial 0 with value: 0.6849.[0m
[32m[I 2022-10-20 05:12:27,794][0m Trial 21 finished with value: 0.6848996760022037 and parameters: {'rc_C': 1.3797907264372271e-06, 'rc_tol': 0.002767186566873258}. Best is trial 0 with value: 0.6849.[0m
[32m[I 2022-10-20 05:12:31,503][0m Trial 24 finished with value: 0.6848996760022037 and parameters: {'rc_C': 1.8733818471963798e-06, 'rc_tol': 0.008092579040883712}. Best is trial 0 with value: 0.6849.[0m
[32m[I 2022-10-20 05:12:31,504][0m Trial 28 finished with value: 0.6848996760022037 and parameters: {'rc_C': 1.0819820793781334e-06, 'rc_tol': 0.008919158186281478}. Best is trial 0 with value: 0.6849.[0m
[32m[I 2022-10-20 05:12:31,677][0m Trial 25 finished with value: 0.6848996760022037 and parameters: {'rc_C': 0.012311943787447018, 'rc_tol': 0.009235855120322208}. Best is trial 0 with value: 0.6849.[0m
[32m[I 2022-10-20 05:12:31,682][0m Trial 30 finished with value: 0.6848996760022037 and parameters: {'rc_C': 4.494497459247274e-06, 'rc_tol': 0.007523944724748525}. Best is trial 0 with value: 0.6849.[0m
[32m[I 2022-10-20 05:12:31,829][0m Trial 27 finished with value: 0.6848996760022037 and parameters: {'rc_C': 1.2913173171153823e-06, 'rc_tol': 0.009556532196265122}. Best is trial 0 with value: 0.6849.[0m
[32m[I 2022-10-20 05:12:31,918][0m Trial 29 finished with value: 0.6848996760022037 and parameters: {'rc_C': 0.0028841319660358666, 'rc_tol': 0.00808766635336123}. Best is trial 0 with value: 0.6849.[0m
[32m[I 2022-10-20 05:12:32,074][0m Trial 26 finished with value: 0.6848996760022037 and parameters: {'rc_C': 3.155636914505342e-06, 'rc_tol': 0.009778659748687748}. Best is trial 0 with value: 0.6849.[0m
[32m[I 2022-10-20 05:12:32,079][0m Trial 31 finished with value: 0.6848996760022037 and parameters: {'rc_C': 1.818043019869077e-06, 'rc_tol': 0.007874448138607737}. Best is trial 0 with value: 0.6849.[0m
[32m[I 2022-10-20 05:12:33,483][0m Trial 32 finished with value: 0.6848996760022037 and parameters: {'rc_C': 0.0017218333418005693, 'rc_tol': 0.004584767719412651}. Best is trial 0 with value: 0.6849.[0m
[32m[I 2022-10-20 05:12:33,564][0m EarlyStopping exceeded for RidgeClassifier; no new best scores on iters 20.[0m
[32m[I 2022-10-20 05:12:33,564][0m Study finished.[0m
[32m[I 2022-10-20 05:12:33,570][0m --------------------------------------------------------------------------------[0m
[32m[I 2022-10-20 05:12:33,570][0m --------------------           RUSBoostClassifier           --------------------[0m
[32m[I 2022-10-20 05:12:33,571][0m --------------------------------------------------------------------------------[0m
[32m[I 2022-10-20 05:12:33,599][0m A new study created in RDB with name: RUSBoostClassifier_e448dfef[0m
[32m[I 2022-10-20 05:12:33,605][0m Study started.[0m
[32m[I 2022-10-20 05:13:21,679][0m Trial 3 finished with value: 0.003441725750839265 and parameters: {'rusbc_n_estimators': 25, 'rusbc_learning_rate': 2.700996152985066e-05, 'rusbc_sampling_strategy': 'all'}. Best is trial 3 with value: 0.00344173.[0m
[32m[I 2022-10-20 05:13:40,678][0m Trial 6 finished with value: 0.7475168981004684 and parameters: {'rusbc_n_estimators': 25, 'rusbc_learning_rate': 0.2509924556392628, 'rusbc_sampling_strategy': 'not majority'}. Best is trial 6 with value: 0.747517.[0m
[32m[I 2022-10-20 05:14:22,499][0m Trial 4 finished with value: 0.05457420409487437 and parameters: {'rusbc_n_estimators': 50, 'rusbc_learning_rate': 1.0553072295713815e-06, 'rusbc_sampling_strategy': 'majority'}. Best is trial 6 with value: 0.747517.[0m
[32m[I 2022-10-20 05:15:35,519][0m Trial 0 finished with value: 0.7581942603031502 and parameters: {'rusbc_n_estimators': 100, 'rusbc_learning_rate': 0.04147241998613164, 'rusbc_sampling_strategy': 'all'}. Best is trial 0 with value: 0.758194.[0m
[32m[I 2022-10-20 05:15:35,672][0m Trial 5 finished with value: 0.16651185918258432 and parameters: {'rusbc_n_estimators': 100, 'rusbc_learning_rate': 0.08744840526003196, 'rusbc_sampling_strategy': 'all'}. Best is trial 0 with value: 0.758194.[0m
[32m[I 2022-10-20 05:16:03,183][0m Trial 1 finished with value: 0.14539869272648842 and parameters: {'rusbc_n_estimators': 100, 'rusbc_learning_rate': 0.2718038678877466, 'rusbc_sampling_strategy': 'majority'}. Best is trial 0 with value: 0.758194.[0m
[32m[I 2022-10-20 05:16:30,133][0m Trial 8 finished with value: 0.7126730374606763 and parameters: {'rusbc_n_estimators': 75, 'rusbc_learning_rate': 1.2411726719317893e-05, 'rusbc_sampling_strategy': 'not majority'}. Best is trial 0 with value: 0.758194.[0m
[32m[I 2022-10-20 05:16:39,388][0m Trial 9 finished with value: 0.0033394944404160974 and parameters: {'rusbc_n_estimators': 100, 'rusbc_learning_rate': 9.280262908588006e-06, 'rusbc_sampling_strategy': 'not minority'}. Best is trial 0 with value: 0.758194.[0m
[32m[I 2022-10-20 05:16:44,228][0m Trial 2 finished with value: 0.7126730374606763 and parameters: {'rusbc_n_estimators': 100, 'rusbc_learning_rate': 0.00028936228268385157, 'rusbc_sampling_strategy': 'not majority'}. Best is trial 0 with value: 0.758194.[0m
[32m[I 2022-10-20 05:16:45,339][0m Trial 7 finished with value: 0.7126730374606763 and parameters: {'rusbc_n_estimators': 100, 'rusbc_learning_rate': 0.0041993610103105185, 'rusbc_sampling_strategy': 'not majority'}. Best is trial 0 with value: 0.758194.[0m
[32m[I 2022-10-20 05:16:51,083][0m Trial 13 finished with value: 0.14036061489081733 and parameters: {'rusbc_n_estimators': 25, 'rusbc_learning_rate': 0.32726538842443037, 'rusbc_sampling_strategy': 'all'}. Best is trial 0 with value: 0.758194.[0m
[32m[I 2022-10-20 05:17:00,704][0m Trial 10 finished with value: 0.04740951657551045 and parameters: {'rusbc_n_estimators': 75, 'rusbc_learning_rate': 0.0014521080276513403, 'rusbc_sampling_strategy': 'majority'}. Best is trial 0 with value: 0.758194.[0m
[32m[I 2022-10-20 05:17:56,554][0m Trial 11 finished with value: 0.0036611413391874643 and parameters: {'rusbc_n_estimators': 75, 'rusbc_learning_rate': 0.0002212602941404106, 'rusbc_sampling_strategy': 'not minority'}. Best is trial 0 with value: 0.758194.[0m
[32m[I 2022-10-20 05:18:30,070][0m Trial 18 finished with value: 0.006541679007870504 and parameters: {'rusbc_n_estimators': 50, 'rusbc_learning_rate': 0.018636526163039676, 'rusbc_sampling_strategy': 'not minority'}. Best is trial 0 with value: 0.758194.[0m
[32m[I 2022-10-20 05:18:39,407][0m Trial 19 finished with value: 0.006358748066056927 and parameters: {'rusbc_n_estimators': 50, 'rusbc_learning_rate': 0.01607120590268732, 'rusbc_sampling_strategy': 'not minority'}. Best is trial 0 with value: 0.758194.[0m
[32m[I 2022-10-20 05:18:50,143][0m Trial 12 finished with value: 0.7126730374606763 and parameters: {'rusbc_n_estimators': 75, 'rusbc_learning_rate': 0.0040452137940191184, 'rusbc_sampling_strategy': 'not majority'}. Best is trial 0 with value: 0.758194.[0m
[32m[I 2022-10-20 05:18:51,931][0m Trial 15 finished with value: 0.7126730374606763 and parameters: {'rusbc_n_estimators': 50, 'rusbc_learning_rate': 0.00039123145611933796, 'rusbc_sampling_strategy': 'not majority'}. Best is trial 0 with value: 0.758194.[0m
[32m[I 2022-10-20 05:18:53,799][0m Trial 14 finished with value: 0.0032142661931255888 and parameters: {'rusbc_n_estimators': 75, 'rusbc_learning_rate': 7.428612887393614e-05, 'rusbc_sampling_strategy': 'not minority'}. Best is trial 0 with value: 0.758194.[0m
[32m[I 2022-10-20 05:19:11,199][0m Trial 17 finished with value: 0.004990057481329609 and parameters: {'rusbc_n_estimators': 75, 'rusbc_learning_rate': 0.007753262015330142, 'rusbc_sampling_strategy': 'all'}. Best is trial 0 with value: 0.758194.[0m
[32m[I 2022-10-20 05:19:31,596][0m Trial 22 finished with value: 0.23187576456384446 and parameters: {'rusbc_n_estimators': 25, 'rusbc_learning_rate': 0.7905047756892676, 'rusbc_sampling_strategy': 'all'}. Best is trial 0 with value: 0.758194.[0m
[32m[I 2022-10-20 05:19:36,146][0m Trial 20 finished with value: 0.006460718794358963 and parameters: {'rusbc_n_estimators': 50, 'rusbc_learning_rate': 0.018525001450342287, 'rusbc_sampling_strategy': 'all'}. Best is trial 0 with value: 0.758194.[0m
[32m[I 2022-10-20 05:19:40,651][0m Trial 23 finished with value: 0.7405449002388155 and parameters: {'rusbc_n_estimators': 25, 'rusbc_learning_rate': 0.7401659457791754, 'rusbc_sampling_strategy': 'all'}. Best is trial 0 with value: 0.758194.[0m
[32m[I 2022-10-20 05:19:42,882][0m Trial 24 finished with value: 0.7248687074171445 and parameters: {'rusbc_n_estimators': 25, 'rusbc_learning_rate': 0.059378412394421404, 'rusbc_sampling_strategy': 'all'}. Best is trial 0 with value: 0.758194.[0m
[32m[I 2022-10-20 05:19:45,708][0m Trial 25 finished with value: 0.7252941242118134 and parameters: {'rusbc_n_estimators': 25, 'rusbc_learning_rate': 0.054310882293064446, 'rusbc_sampling_strategy': 'all'}. Best is trial 0 with value: 0.758194.[0m
[32m[I 2022-10-20 05:19:55,549][0m Trial 26 finished with value: 0.7456259241489335 and parameters: {'rusbc_n_estimators': 25, 'rusbc_learning_rate': 0.07686644833867945, 'rusbc_sampling_strategy': 'all'}. Best is trial 0 with value: 0.758194.[0m
[32m[I 2022-10-20 05:20:06,991][0m Trial 27 finished with value: 0.7252941242118134 and parameters: {'rusbc_n_estimators': 25, 'rusbc_learning_rate': 0.053932001209809906, 'rusbc_sampling_strategy': 'all'}. Best is trial 0 with value: 0.758194.[0m
[32m[I 2022-10-20 05:20:07,454][0m Trial 16 finished with value: 0.04740951657551045 and parameters: {'rusbc_n_estimators': 100, 'rusbc_learning_rate': 0.00014307676856209538, 'rusbc_sampling_strategy': 'majority'}. Best is trial 0 with value: 0.758194.[0m
[32m[I 2022-10-20 05:20:10,902][0m Trial 29 finished with value: 0.7425375751585414 and parameters: {'rusbc_n_estimators': 25, 'rusbc_learning_rate': 0.06310712842324849, 'rusbc_sampling_strategy': 'all'}. Best is trial 0 with value: 0.758194.[0m
[32m[I 2022-10-20 05:20:15,795][0m Trial 21 finished with value: 0.5619397564741684 and parameters: {'rusbc_n_estimators': 50, 'rusbc_learning_rate': 0.8905292082427467, 'rusbc_sampling_strategy': 'not majority'}. Best is trial 0 with value: 0.758194.[0m
[32m[I 2022-10-20 05:20:16,149][0m Trial 28 finished with value: 0.7035476058687679 and parameters: {'rusbc_n_estimators': 25, 'rusbc_learning_rate': 0.14054861947088426, 'rusbc_sampling_strategy': 'not majority'}. Best is trial 0 with value: 0.758194.[0m
[32m[I 2022-10-20 05:20:16,220][0m EarlyStopping exceeded for RUSBoostClassifier; no new best scores on iters 20.[0m
[32m[I 2022-10-20 05:20:16,221][0m Study finished.[0m
[32m[I 2022-10-20 05:20:16,227][0m --------------------------------------------------------------------------------[0m
[32m[I 2022-10-20 05:20:16,227][0m --------------------             SGDClassifier              --------------------[0m
[32m[I 2022-10-20 05:20:16,228][0m --------------------------------------------------------------------------------[0m
[32m[I 2022-10-20 05:20:16,255][0m A new study created in RDB with name: SGDClassifier_e448dfef[0m
[32m[I 2022-10-20 05:20:16,262][0m Study started.[0m
[32m[I 2022-10-20 05:20:52,358][0m Trial 0 finished with value: 0.6956360571892365 and parameters: {'sgdc_loss': 'squared_hinge', 'sgdc_penalty': 'elasticnet', 'sgdc_alpha': 58.438289824737545, 'sgdc_l1_ratio': 0.0, 'sgdc_learning_rate': 'optimal', 'sgdc_eta0': 0.009227791633587175, 'sgdc_early_stopping': True, 'sgdc_validation_fraction': 0.25, 'sgdc_n_iter_no_change': 10}. Best is trial 0 with value: 0.695636.[0m
[32m[I 2022-10-20 05:20:58,287][0m Trial 5 finished with value: 0.7225296580397175 and parameters: {'sgdc_loss': 'log', 'sgdc_penalty': 'elasticnet', 'sgdc_alpha': 19.33707093484828, 'sgdc_l1_ratio': 0.8, 'sgdc_learning_rate': 'optimal', 'sgdc_eta0': 3.8651682555815996, 'sgdc_early_stopping': True, 'sgdc_validation_fraction': 0.25, 'sgdc_n_iter_no_change': 10}. Best is trial 5 with value: 0.72253.[0m
[32m[I 2022-10-20 05:21:01,605][0m Trial 7 finished with value: 0.430658739861893 and parameters: {'sgdc_loss': 'log', 'sgdc_penalty': 'elasticnet', 'sgdc_alpha': 195.35389350432487, 'sgdc_l1_ratio': 0.4, 'sgdc_learning_rate': 'invscaling', 'sgdc_eta0': 0.0014644455729150782, 'sgdc_early_stopping': True, 'sgdc_validation_fraction': 0.25, 'sgdc_n_iter_no_change': 10}. Best is trial 5 with value: 0.72253.[0m
[32m[I 2022-10-20 05:21:02,422][0m Trial 6 finished with value: 0.1306947163590422 and parameters: {'sgdc_loss': 'log', 'sgdc_penalty': 'elasticnet', 'sgdc_alpha': 0.00019878625521422693, 'sgdc_l1_ratio': 0.0, 'sgdc_learning_rate': 'constant', 'sgdc_eta0': 0.008549490771529698, 'sgdc_early_stopping': True, 'sgdc_validation_fraction': 0.25, 'sgdc_n_iter_no_change': 10}. Best is trial 5 with value: 0.72253.[0m
[32m[I 2022-10-20 05:21:02,935][0m Trial 3 finished with value: 0.14388607625333955 and parameters: {'sgdc_loss': 'modified_huber', 'sgdc_penalty': 'elasticnet', 'sgdc_alpha': 5.499905138916018e-06, 'sgdc_l1_ratio': 0.8, 'sgdc_learning_rate': 'invscaling', 'sgdc_eta0': 9.141307374738721, 'sgdc_early_stopping': True, 'sgdc_validation_fraction': 0.25, 'sgdc_n_iter_no_change': 10}. Best is trial 5 with value: 0.72253.[0m
[32m[I 2022-10-20 05:21:04,456][0m Trial 1 finished with value: 0.7247394128571742 and parameters: {'sgdc_loss': 'modified_huber', 'sgdc_penalty': 'elasticnet', 'sgdc_alpha': 0.0017800135314008623, 'sgdc_l1_ratio': 0.2, 'sgdc_learning_rate': 'optimal', 'sgdc_eta0': 26.20139762726309, 'sgdc_early_stopping': True, 'sgdc_validation_fraction': 0.25, 'sgdc_n_iter_no_change': 10}. Best is trial 1 with value: 0.724739.[0m
[32m[I 2022-10-20 05:21:06,100][0m Trial 4 finished with value: 0.7023859133804693 and parameters: {'sgdc_loss': 'log', 'sgdc_penalty': 'elasticnet', 'sgdc_alpha': 0.00851624928699583, 'sgdc_l1_ratio': 0.2, 'sgdc_learning_rate': 'optimal', 'sgdc_eta0': 4.50474891276898, 'sgdc_early_stopping': True, 'sgdc_validation_fraction': 0.25, 'sgdc_n_iter_no_change': 10}. Best is trial 1 with value: 0.724739.[0m
[32m[I 2022-10-20 05:21:09,786][0m Trial 2 finished with value: 0.7173317569662647 and parameters: {'sgdc_loss': 'log', 'sgdc_penalty': 'elasticnet', 'sgdc_alpha': 0.006291580465309686, 'sgdc_l1_ratio': 0.4, 'sgdc_learning_rate': 'invscaling', 'sgdc_eta0': 0.0011558275241995823, 'sgdc_early_stopping': True, 'sgdc_validation_fraction': 0.25, 'sgdc_n_iter_no_change': 10}. Best is trial 1 with value: 0.724739.[0m
[32m[I 2022-10-20 05:21:28,596][0m Trial 8 finished with value: 0.6986276232110232 and parameters: {'sgdc_loss': 'modified_huber', 'sgdc_penalty': 'elasticnet', 'sgdc_alpha': 0.0001534228879014748, 'sgdc_l1_ratio': 0.0, 'sgdc_learning_rate': 'optimal', 'sgdc_eta0': 719.7792804679949, 'sgdc_early_stopping': True, 'sgdc_validation_fraction': 0.25, 'sgdc_n_iter_no_change': 10}. Best is trial 1 with value: 0.724739.[0m
[32m[I 2022-10-20 05:21:44,840][0m Trial 14 finished with value: 0.3861221953522124 and parameters: {'sgdc_loss': 'squared_hinge', 'sgdc_penalty': 'elasticnet', 'sgdc_alpha': 0.017674775787286854, 'sgdc_l1_ratio': 0.4, 'sgdc_learning_rate': 'constant', 'sgdc_eta0': 0.4335440047901637, 'sgdc_early_stopping': True, 'sgdc_validation_fraction': 0.25, 'sgdc_n_iter_no_change': 10}. Best is trial 1 with value: 0.724739.[0m
[32m[I 2022-10-20 05:21:47,690][0m Trial 10 finished with value: 0.6990201245074674 and parameters: {'sgdc_loss': 'log', 'sgdc_penalty': 'elasticnet', 'sgdc_alpha': 317.5756457672599, 'sgdc_l1_ratio': 0.0, 'sgdc_learning_rate': 'invscaling', 'sgdc_eta0': 0.0012016396168766088, 'sgdc_early_stopping': True, 'sgdc_validation_fraction': 0.25, 'sgdc_n_iter_no_change': 10}. Best is trial 1 with value: 0.724739.[0m
[32m[I 2022-10-20 05:21:48,489][0m Trial 11 finished with value: 0.13901951728399406 and parameters: {'sgdc_loss': 'hinge', 'sgdc_penalty': 'elasticnet', 'sgdc_alpha': 0.00010643415042864174, 'sgdc_l1_ratio': 0.8, 'sgdc_learning_rate': 'invscaling', 'sgdc_eta0': 0.08436097855295677, 'sgdc_early_stopping': True, 'sgdc_validation_fraction': 0.25, 'sgdc_n_iter_no_change': 10}. Best is trial 1 with value: 0.724739.[0m
[32m[I 2022-10-20 05:21:56,208][0m Trial 15 finished with value: 0.7269875560745049 and parameters: {'sgdc_loss': 'modified_huber', 'sgdc_penalty': 'elasticnet', 'sgdc_alpha': 1.5700812117989182e-06, 'sgdc_l1_ratio': 0.2, 'sgdc_learning_rate': 'optimal', 'sgdc_eta0': 109.5171229698286, 'sgdc_early_stopping': True, 'sgdc_validation_fraction': 0.25, 'sgdc_n_iter_no_change': 10}. Best is trial 15 with value: 0.726988.[0m
[32m[I 2022-10-20 05:22:12,575][0m Trial 16 finished with value: 0.7366138940550673 and parameters: {'sgdc_loss': 'log', 'sgdc_penalty': 'elasticnet', 'sgdc_alpha': 0.00026096830611850835, 'sgdc_l1_ratio': 1.0, 'sgdc_learning_rate': 'optimal', 'sgdc_eta0': 0.19518963150537788, 'sgdc_early_stopping': True, 'sgdc_validation_fraction': 0.25, 'sgdc_n_iter_no_change': 10}. Best is trial 16 with value: 0.736614.[0m
[32m[I 2022-10-20 05:22:57,933][0m Trial 21 finished with value: 0.13875020945977892 and parameters: {'sgdc_loss': 'modified_huber', 'sgdc_penalty': 'elasticnet', 'sgdc_alpha': 1.6981453097725784e-06, 'sgdc_l1_ratio': 1.0, 'sgdc_learning_rate': 'optimal', 'sgdc_eta0': 117.68000761040926, 'sgdc_early_stopping': True, 'sgdc_validation_fraction': 0.25, 'sgdc_n_iter_no_change': 10}. Best is trial 16 with value: 0.736614.[0m
[32m[I 2022-10-20 05:26:41,568][0m Trial 12 finished with value: 0.7175635196204256 and parameters: {'sgdc_loss': 'hinge', 'sgdc_penalty': 'elasticnet', 'sgdc_alpha': 0.0016333075950116132, 'sgdc_l1_ratio': 1.0, 'sgdc_learning_rate': 'adaptive', 'sgdc_eta0': 6.486728090054599, 'sgdc_early_stopping': True, 'sgdc_validation_fraction': 0.25, 'sgdc_n_iter_no_change': 10}. Best is trial 16 with value: 0.736614.[0m
[32m[I 2022-10-20 05:27:43,376][0m Trial 22 finished with value: 0.7232777627288058 and parameters: {'sgdc_loss': 'hinge', 'sgdc_penalty': 'elasticnet', 'sgdc_alpha': 1.2908490945794302, 'sgdc_l1_ratio': 1.0, 'sgdc_learning_rate': 'adaptive', 'sgdc_eta0': 0.2988600149887495, 'sgdc_early_stopping': True, 'sgdc_validation_fraction': 0.25, 'sgdc_n_iter_no_change': 10}. Best is trial 16 with value: 0.736614.[0m
[32m[I 2022-10-20 05:27:50,375][0m Trial 13 finished with value: 0.6943229773619517 and parameters: {'sgdc_loss': 'modified_huber', 'sgdc_penalty': 'elasticnet', 'sgdc_alpha': 0.08356370024115142, 'sgdc_l1_ratio': 0.8, 'sgdc_learning_rate': 'adaptive', 'sgdc_eta0': 74.72874153671457, 'sgdc_early_stopping': True, 'sgdc_validation_fraction': 0.25, 'sgdc_n_iter_no_change': 10}. Best is trial 16 with value: 0.736614.[0m
[32m[I 2022-10-20 05:28:00,001][0m Trial 9 finished with value: 0.7318918887523659 and parameters: {'sgdc_loss': 'modified_huber', 'sgdc_penalty': 'elasticnet', 'sgdc_alpha': 429.59071247314205, 'sgdc_l1_ratio': 0.4, 'sgdc_learning_rate': 'adaptive', 'sgdc_eta0': 48.97306236886745, 'sgdc_early_stopping': True, 'sgdc_validation_fraction': 0.25, 'sgdc_n_iter_no_change': 10}. Best is trial 16 with value: 0.736614.[0m
[32m[I 2022-10-20 05:28:24,323][0m Trial 24 finished with value: 0.7441771968679445 and parameters: {'sgdc_loss': 'modified_huber', 'sgdc_penalty': 'elasticnet', 'sgdc_alpha': 1.3984490295539056e-05, 'sgdc_l1_ratio': 0.6000000000000001, 'sgdc_learning_rate': 'optimal', 'sgdc_eta0': 700.6139947861759, 'sgdc_early_stopping': True, 'sgdc_validation_fraction': 0.25, 'sgdc_n_iter_no_change': 10}. Best is trial 24 with value: 0.744177.[0m
[32m[I 2022-10-20 05:28:30,449][0m Trial 17 finished with value: 0.5369833159329899 and parameters: {'sgdc_loss': 'hinge', 'sgdc_penalty': 'elasticnet', 'sgdc_alpha': 1.093580005659673, 'sgdc_l1_ratio': 1.0, 'sgdc_learning_rate': 'adaptive', 'sgdc_eta0': 243.6472328575905, 'sgdc_early_stopping': True, 'sgdc_validation_fraction': 0.25, 'sgdc_n_iter_no_change': 10}. Best is trial 24 with value: 0.744177.[0m
[32m[I 2022-10-20 05:28:34,061][0m Trial 18 finished with value: 0.5509327772943722 and parameters: {'sgdc_loss': 'hinge', 'sgdc_penalty': 'elasticnet', 'sgdc_alpha': 0.7786800186632015, 'sgdc_l1_ratio': 1.0, 'sgdc_learning_rate': 'adaptive', 'sgdc_eta0': 104.41177241328647, 'sgdc_early_stopping': True, 'sgdc_validation_fraction': 0.25, 'sgdc_n_iter_no_change': 10}. Best is trial 24 with value: 0.744177.[0m
[32m[I 2022-10-20 05:28:35,034][0m Trial 25 finished with value: 0.146732180194273 and parameters: {'sgdc_loss': 'squared_hinge', 'sgdc_penalty': 'elasticnet', 'sgdc_alpha': 1.1968032089763573e-05, 'sgdc_l1_ratio': 0.6000000000000001, 'sgdc_learning_rate': 'optimal', 'sgdc_eta0': 972.6429281286862, 'sgdc_early_stopping': True, 'sgdc_validation_fraction': 0.25, 'sgdc_n_iter_no_change': 10}. Best is trial 24 with value: 0.744177.[0m
[32m[I 2022-10-20 05:28:39,300][0m Trial 19 finished with value: 0.5730475034076835 and parameters: {'sgdc_loss': 'modified_huber', 'sgdc_penalty': 'elasticnet', 'sgdc_alpha': 1.7915818722425676, 'sgdc_l1_ratio': 1.0, 'sgdc_learning_rate': 'adaptive', 'sgdc_eta0': 88.96229779243149, 'sgdc_early_stopping': True, 'sgdc_validation_fraction': 0.25, 'sgdc_n_iter_no_change': 10}. Best is trial 24 with value: 0.744177.[0m
