[32m[I 2022-10-19 19:50:24,211][0m Trial 24 finished with value: 0.9986066686945436 and parameters: {'lgbm_num_leaves': 15, 'lgbm_learning_rate': 0.06929691382359122, 'lgbm_n_estimators': 30, 'lgbm_reg_alpha': 0.55, 'lgbm_reg_lambda': 0.8}. Best is trial 18 with value: 0.999861.[0m
[32m[I 2022-10-19 19:50:36,588][0m Trial 20 finished with value: 0.9996519669013585 and parameters: {'lgbm_num_leaves': 15, 'lgbm_learning_rate': 0.049077853144718964, 'lgbm_n_estimators': 90, 'lgbm_reg_alpha': 0.65, 'lgbm_reg_lambda': 0.25}. Best is trial 18 with value: 0.999861.[0m
[32m[I 2022-10-19 19:50:46,253][0m Trial 21 finished with value: 0.9998682789646098 and parameters: {'lgbm_num_leaves': 15, 'lgbm_learning_rate': 0.16192658785145156, 'lgbm_n_estimators': 80, 'lgbm_reg_alpha': 0.55, 'lgbm_reg_lambda': 0.2}. Best is trial 21 with value: 0.999868.[0m
[32m[I 2022-10-19 19:50:50,376][0m Trial 26 finished with value: 0.9998558571912215 and parameters: {'lgbm_num_leaves': 127, 'lgbm_learning_rate': 0.102382100285419, 'lgbm_n_estimators': 30, 'lgbm_reg_alpha': 0.4, 'lgbm_reg_lambda': 0.75}. Best is trial 21 with value: 0.999868.[0m
[32m[I 2022-10-19 19:50:55,970][0m Trial 22 finished with value: 0.9997763266999901 and parameters: {'lgbm_num_leaves': 15, 'lgbm_learning_rate': 0.07071515849398415, 'lgbm_n_estimators': 90, 'lgbm_reg_alpha': 0.55, 'lgbm_reg_lambda': 0.2}. Best is trial 21 with value: 0.999868.[0m
[32m[I 2022-10-19 19:50:58,451][0m Trial 12 finished with value: 0.9459066312468657 and parameters: {'lgbm_num_leaves': 127, 'lgbm_learning_rate': 0.0018515905575573759, 'lgbm_n_estimators': 200, 'lgbm_reg_alpha': 0.7000000000000001, 'lgbm_reg_lambda': 0.25}. Best is trial 21 with value: 0.999868.[0m
[32m[I 2022-10-19 19:51:03,504][0m Trial 23 finished with value: 0.9997465308958339 and parameters: {'lgbm_num_leaves': 15, 'lgbm_learning_rate': 0.06266445084388308, 'lgbm_n_estimators': 90, 'lgbm_reg_alpha': 0.6000000000000001, 'lgbm_reg_lambda': 0.2}. Best is trial 21 with value: 0.999868.[0m
[32m[I 2022-10-19 19:51:14,365][0m Trial 25 finished with value: 0.99989065403977 and parameters: {'lgbm_num_leaves': 127, 'lgbm_learning_rate': 0.20938352536007585, 'lgbm_n_estimators': 90, 'lgbm_reg_alpha': 0.4, 'lgbm_reg_lambda': 0.8}. Best is trial 25 with value: 0.999891.[0m
[32m[I 2022-10-19 19:51:14,476][0m Trial 29 finished with value: 0.9998856860912612 and parameters: {'lgbm_num_leaves': 127, 'lgbm_learning_rate': 0.14537962606426894, 'lgbm_n_estimators': 40, 'lgbm_reg_alpha': 0.4, 'lgbm_reg_lambda': 0.8}. Best is trial 25 with value: 0.999891.[0m
[32m[I 2022-10-19 19:51:30,188][0m Trial 27 finished with value: 0.999893129430462 and parameters: {'lgbm_num_leaves': 127, 'lgbm_learning_rate': 0.1894465059907536, 'lgbm_n_estimators': 90, 'lgbm_reg_alpha': 0.25, 'lgbm_reg_lambda': 0.8}. Best is trial 27 with value: 0.999893.[0m
[32m[I 2022-10-19 19:51:36,224][0m Trial 28 finished with value: 0.9998931276457574 and parameters: {'lgbm_num_leaves': 127, 'lgbm_learning_rate': 0.10145467677507192, 'lgbm_n_estimators': 90, 'lgbm_reg_alpha': 0.4, 'lgbm_reg_lambda': 0.8500000000000001}. Best is trial 27 with value: 0.999893.[0m
[32m[I 2022-10-19 19:51:36,300][0m EarlyStopping exceeded for LGBMClassifier; no new best scores on iters 20.[0m
[32m[I 2022-10-19 19:51:36,301][0m Study finished.[0m
[32m[I 2022-10-19 19:51:36,308][0m --------------------------------------------------------------------------------[0m
[32m[I 2022-10-19 19:51:36,308][0m --------------------       LinearDiscriminantAnalysis       --------------------[0m
[32m[I 2022-10-19 19:51:36,309][0m --------------------------------------------------------------------------------[0m
[32m[I 2022-10-19 19:51:36,356][0m A new study created in RDB with name: LinearDiscriminantAnalysis_e448dfef[0m
[32m[I 2022-10-19 19:51:36,374][0m Study started.[0m
[32m[I 2022-10-19 19:51:40,961][0m Trial 0 finished with value: 0.707365175921671 and parameters: {'lda_solver': 'svd', 'lda_n_components': 3}. Best is trial 0 with value: 0.707365.[0m
[32m[I 2022-10-19 19:51:41,863][0m Trial 5 finished with value: 0.707365175921671 and parameters: {'lda_solver': 'svd', 'lda_n_components': 2}. Best is trial 0 with value: 0.707365.[0m
[32m[I 2022-10-19 19:51:42,454][0m Trial 3 finished with value: 0.707365175921671 and parameters: {'lda_solver': 'svd', 'lda_n_components': 6}. Best is trial 0 with value: 0.707365.[0m
[32m[I 2022-10-19 19:51:43,719][0m Trial 2 finished with value: 0.707365175921671 and parameters: {'lda_solver': 'svd', 'lda_n_components': 7}. Best is trial 4 with value: 0.707787.[0m
[32m[I 2022-10-19 19:51:43,719][0m Trial 6 finished with value: 0.6950742018218817 and parameters: {'lda_solver': 'lsqr', 'lda_n_components': 6, 'lda_tol': 0.001}. Best is trial 4 with value: 0.707787.[0m
[32m[I 2022-10-19 19:51:43,887][0m Trial 4 finished with value: 0.7077867894758822 and parameters: {'lda_solver': 'eigen', 'lda_n_components': 4, 'lda_tol': 0.001}. Best is trial 1 with value: 0.707787.[0m
[32m[I 2022-10-19 19:51:44,457][0m Trial 7 finished with value: 0.7077867894758822 and parameters: {'lda_solver': 'eigen', 'lda_n_components': 5, 'lda_tol': 1e-05}. Best is trial 1 with value: 0.707787.[0m
[32m[I 2022-10-19 19:51:44,458][0m Trial 1 finished with value: 0.7077867894758822 and parameters: {'lda_solver': 'eigen', 'lda_n_components': 3, 'lda_tol': 1e-05}. Best is trial 1 with value: 0.707787.[0m
[32m[I 2022-10-19 19:52:12,413][0m Trial 8 finished with value: 0.7077867894758822 and parameters: {'lda_solver': 'eigen', 'lda_n_components': 1, 'lda_tol': 0.0001}. Best is trial 1 with value: 0.707787.[0m
[32m[I 2022-10-19 19:52:30,691][0m Trial 9 finished with value: 0.6950742018218817 and parameters: {'lda_solver': 'lsqr', 'lda_n_components': 1, 'lda_tol': 0.001}. Best is trial 1 with value: 0.707787.[0m
[32m[I 2022-10-19 19:52:30,691][0m Trial 10 finished with value: 0.707365175921671 and parameters: {'lda_solver': 'svd', 'lda_n_components': 3}. Best is trial 1 with value: 0.707787.[0m
[32m[I 2022-10-19 19:52:34,350][0m Trial 11 finished with value: 0.6950742018218817 and parameters: {'lda_solver': 'lsqr', 'lda_n_components': 4, 'lda_tol': 0.001}. Best is trial 1 with value: 0.707787.[0m
[32m[I 2022-10-19 19:52:36,673][0m Trial 16 finished with value: 0.707365175921671 and parameters: {'lda_solver': 'svd', 'lda_n_components': 4}. Best is trial 1 with value: 0.707787.[0m
[32m[I 2022-10-19 19:52:36,674][0m Trial 15 finished with value: 0.6950742018218817 and parameters: {'lda_solver': 'lsqr', 'lda_n_components': 3, 'lda_tol': 1e-05}. Best is trial 1 with value: 0.707787.[0m
[32m[I 2022-10-19 19:52:36,926][0m Trial 14 finished with value: 0.7077867894758822 and parameters: {'lda_solver': 'eigen', 'lda_n_components': 1, 'lda_tol': 1e-05}. Best is trial 17 with value: 0.707787.[0m
[32m[I 2022-10-19 19:52:37,012][0m Trial 12 finished with value: 0.6950742018218817 and parameters: {'lda_solver': 'lsqr', 'lda_n_components': 1, 'lda_tol': 1e-05}. Best is trial 18 with value: 0.707787.[0m
[32m[I 2022-10-19 19:52:37,012][0m Trial 13 finished with value: 0.6950742018218817 and parameters: {'lda_solver': 'lsqr', 'lda_n_components': 6, 'lda_tol': 0.001}. Best is trial 18 with value: 0.707787.[0m
[32m[I 2022-10-19 19:52:37,014][0m Trial 17 finished with value: 0.7077867894758822 and parameters: {'lda_solver': 'eigen', 'lda_n_components': 4, 'lda_tol': 1e-05}. Best is trial 18 with value: 0.707787.[0m
[32m[I 2022-10-19 19:52:37,238][0m Trial 18 finished with value: 0.7077867894758822 and parameters: {'lda_solver': 'eigen', 'lda_n_components': 4, 'lda_tol': 1e-05}. Best is trial 18 with value: 0.707787.[0m
[32m[I 2022-10-19 19:53:00,003][0m Trial 26 finished with value: 0.7077867894758822 and parameters: {'lda_solver': 'eigen', 'lda_n_components': 2, 'lda_tol': 0.0001}. Best is trial 26 with value: 0.707787.[0m
[32m[I 2022-10-19 19:53:00,106][0m Trial 19 finished with value: 0.7077867894758822 and parameters: {'lda_solver': 'eigen', 'lda_n_components': 2, 'lda_tol': 0.0001}. Best is trial 26 with value: 0.707787.[0m
[32m[I 2022-10-19 19:53:00,215][0m Trial 23 finished with value: 0.7077867894758822 and parameters: {'lda_solver': 'eigen', 'lda_n_components': 2, 'lda_tol': 0.0001}. Best is trial 26 with value: 0.707787.[0m
[32m[I 2022-10-19 19:53:00,217][0m Trial 24 finished with value: 0.7077867894758822 and parameters: {'lda_solver': 'eigen', 'lda_n_components': 2, 'lda_tol': 0.0001}. Best is trial 26 with value: 0.707787.[0m
[32m[I 2022-10-19 19:53:00,308][0m Trial 20 finished with value: 0.7077867894758822 and parameters: {'lda_solver': 'eigen', 'lda_n_components': 2, 'lda_tol': 0.0001}. Best is trial 26 with value: 0.707787.[0m
[32m[I 2022-10-19 19:53:00,568][0m Trial 21 finished with value: 0.7077867894758822 and parameters: {'lda_solver': 'eigen', 'lda_n_components': 2, 'lda_tol': 0.0001}. Best is trial 26 with value: 0.707787.[0m
[32m[I 2022-10-19 19:53:00,571][0m Trial 25 finished with value: 0.7077867894758822 and parameters: {'lda_solver': 'eigen', 'lda_n_components': 2, 'lda_tol': 0.0001}. Best is trial 26 with value: 0.707787.[0m
[32m[I 2022-10-19 19:53:00,572][0m Trial 22 finished with value: 0.7077867894758822 and parameters: {'lda_solver': 'eigen', 'lda_n_components': 2, 'lda_tol': 0.0001}. Best is trial 26 with value: 0.707787.[0m
[32m[I 2022-10-19 19:53:04,585][0m Trial 29 finished with value: 0.7077867894758822 and parameters: {'lda_solver': 'eigen', 'lda_n_components': 3, 'lda_tol': 0.0001}. Best is trial 29 with value: 0.707787.[0m
[32m[I 2022-10-19 19:53:04,671][0m Trial 27 finished with value: 0.7077867894758822 and parameters: {'lda_solver': 'eigen', 'lda_n_components': 3, 'lda_tol': 0.0001}. Best is trial 29 with value: 0.707787.[0m
[32m[I 2022-10-19 19:53:04,672][0m Trial 28 finished with value: 0.7077867894758822 and parameters: {'lda_solver': 'eigen', 'lda_n_components': 3, 'lda_tol': 0.0001}. Best is trial 29 with value: 0.707787.[0m
[32m[I 2022-10-19 19:53:04,856][0m EarlyStopping exceeded for LinearDiscriminantAnalysis; no new best scores on iters 20.[0m
[32m[I 2022-10-19 19:53:04,857][0m Study finished.[0m
[32m[I 2022-10-19 19:53:04,863][0m --------------------------------------------------------------------------------[0m
[32m[I 2022-10-19 19:53:04,864][0m --------------------               LinearSVC                --------------------[0m
[32m[I 2022-10-19 19:53:04,864][0m --------------------------------------------------------------------------------[0m
[32m[I 2022-10-19 19:53:04,891][0m A new study created in RDB with name: LinearSVC_e448dfef[0m
[32m[I 2022-10-19 19:53:04,898][0m Study started.[0m
[32m[I 2022-10-19 19:53:36,514][0m Trial 0 finished with value: 0.6951098341920565 and parameters: {'lsvc_dual': False, 'lsvc_C': 7.464387052696539e-06, 'lsvc_max_iter': 2000}. Best is trial 0 with value: 0.69511.[0m
[32m[I 2022-10-19 19:53:59,935][0m Trial 1 finished with value: 0.6951098341920565 and parameters: {'lsvc_dual': False, 'lsvc_C': 20.689927789194172, 'lsvc_max_iter': 2000}. Best is trial 0 with value: 0.69511.[0m
[32m[I 2022-10-19 19:54:03,091][0m Trial 2 finished with value: 0.6951098341920565 and parameters: {'lsvc_dual': False, 'lsvc_C': 0.0007002511132892991, 'lsvc_max_iter': 2000}. Best is trial 0 with value: 0.69511.[0m
[32m[I 2022-10-19 19:54:05,687][0m Trial 3 finished with value: 0.6951098341920565 and parameters: {'lsvc_dual': False, 'lsvc_C': 0.020303026257954382, 'lsvc_max_iter': 2000}. Best is trial 0 with value: 0.69511.[0m
[32m[I 2022-10-19 19:54:07,804][0m Trial 4 finished with value: 0.6951098341920565 and parameters: {'lsvc_dual': False, 'lsvc_C': 0.7307425426961208, 'lsvc_max_iter': 2000}. Best is trial 0 with value: 0.69511.[0m
[32m[I 2022-10-19 19:54:09,937][0m Trial 5 finished with value: 0.6951098341920565 and parameters: {'lsvc_dual': False, 'lsvc_C': 2.8008373561983766e-05, 'lsvc_max_iter': 2000}. Best is trial 0 with value: 0.69511.[0m
[32m[I 2022-10-19 19:54:12,664][0m Trial 6 finished with value: 0.6951098341920565 and parameters: {'lsvc_dual': False, 'lsvc_C': 45.70124315255725, 'lsvc_max_iter': 2000}. Best is trial 0 with value: 0.69511.[0m
[32m[I 2022-10-19 19:54:14,766][0m Trial 7 finished with value: 0.6951098341920565 and parameters: {'lsvc_dual': False, 'lsvc_C': 8.44773051717695e-05, 'lsvc_max_iter': 2000}. Best is trial 0 with value: 0.69511.[0m
[32m[I 2022-10-19 19:54:17,230][0m Trial 8 finished with value: 0.6951098341920565 and parameters: {'lsvc_dual': False, 'lsvc_C': 0.026425136841955275, 'lsvc_max_iter': 2000}. Best is trial 0 with value: 0.69511.[0m
[32m[I 2022-10-19 19:54:19,371][0m Trial 9 finished with value: 0.6951098341920565 and parameters: {'lsvc_dual': False, 'lsvc_C': 1.9246835465818966e-06, 'lsvc_max_iter': 2000}. Best is trial 0 with value: 0.69511.[0m
[32m[I 2022-10-19 19:54:21,496][0m Trial 10 finished with value: 0.6951098341920565 and parameters: {'lsvc_dual': False, 'lsvc_C': 1.5201954826070253e-06, 'lsvc_max_iter': 2000}. Best is trial 0 with value: 0.69511.[0m
[32m[I 2022-10-19 19:54:23,621][0m Trial 11 finished with value: 0.6951098341920565 and parameters: {'lsvc_dual': False, 'lsvc_C': 397.63547426999725, 'lsvc_max_iter': 2000}. Best is trial 0 with value: 0.69511.[0m
[32m[I 2022-10-19 19:54:25,736][0m Trial 12 finished with value: 0.6951098341920565 and parameters: {'lsvc_dual': False, 'lsvc_C': 1.847981989701138, 'lsvc_max_iter': 2000}. Best is trial 0 with value: 0.69511.[0m
[32m[I 2022-10-19 19:54:27,854][0m Trial 13 finished with value: 0.6951098341920565 and parameters: {'lsvc_dual': False, 'lsvc_C': 2.4880380830722504, 'lsvc_max_iter': 2000}. Best is trial 0 with value: 0.69511.[0m
[32m[I 2022-10-19 19:54:30,020][0m Trial 14 finished with value: 0.6951098341920565 and parameters: {'lsvc_dual': False, 'lsvc_C': 0.0017419250137244986, 'lsvc_max_iter': 2000}. Best is trial 0 with value: 0.69511.[0m
[32m[I 2022-10-19 19:54:32,134][0m Trial 15 finished with value: 0.6951098341920565 and parameters: {'lsvc_dual': False, 'lsvc_C': 115.20069525980487, 'lsvc_max_iter': 2000}. Best is trial 0 with value: 0.69511.[0m
[32m[I 2022-10-19 19:54:34,260][0m Trial 16 finished with value: 0.6951098341920565 and parameters: {'lsvc_dual': False, 'lsvc_C': 0.23237988663925202, 'lsvc_max_iter': 2000}. Best is trial 0 with value: 0.69511.[0m
[32m[I 2022-10-19 19:54:36,423][0m Trial 17 finished with value: 0.6951098341920565 and parameters: {'lsvc_dual': False, 'lsvc_C': 0.00124519782147318, 'lsvc_max_iter': 2000}. Best is trial 0 with value: 0.69511.[0m
[32m[I 2022-10-19 19:54:38,552][0m Trial 18 finished with value: 0.6951098341920565 and parameters: {'lsvc_dual': False, 'lsvc_C': 588.0063289536888, 'lsvc_max_iter': 2000}. Best is trial 0 with value: 0.69511.[0m
[32m[I 2022-10-19 19:54:40,681][0m Trial 19 finished with value: 0.6951098341920565 and parameters: {'lsvc_dual': False, 'lsvc_C': 0.2096369661664705, 'lsvc_max_iter': 2000}. Best is trial 0 with value: 0.69511.[0m
[32m[I 2022-10-19 19:54:42,811][0m Trial 20 finished with value: 0.6951098341920565 and parameters: {'lsvc_dual': False, 'lsvc_C': 2.3073429827551695e-05, 'lsvc_max_iter': 2000}. Best is trial 0 with value: 0.69511.[0m
[32m[I 2022-10-19 19:54:44,943][0m Trial 21 finished with value: 0.6951098341920565 and parameters: {'lsvc_dual': False, 'lsvc_C': 0.001993682339981624, 'lsvc_max_iter': 2000}. Best is trial 0 with value: 0.69511.[0m
[32m[I 2022-10-19 19:54:47,101][0m Trial 22 finished with value: 0.6951098341920565 and parameters: {'lsvc_dual': False, 'lsvc_C': 8.45961605425898, 'lsvc_max_iter': 2000}. Best is trial 0 with value: 0.69511.[0m
[32m[I 2022-10-19 19:54:47,177][0m EarlyStopping exceeded for LinearSVC; no new best scores on iters 20.[0m
[32m[I 2022-10-19 19:54:47,178][0m Study finished.[0m
[32m[I 2022-10-19 19:54:47,183][0m --------------------------------------------------------------------------------[0m
[32m[I 2022-10-19 19:54:47,183][0m --------------------     LinearSVC_AdditiveChi2Sampler      --------------------[0m
[32m[I 2022-10-19 19:54:47,184][0m --------------------------------------------------------------------------------[0m
[32m[I 2022-10-19 19:54:47,210][0m A new study created in RDB with name: LinearSVC_AdditiveChi2Sampler_e448dfef[0m
[32m[I 2022-10-19 19:54:47,216][0m Study started.[0m
[32m[I 2022-10-19 19:55:03,314][0m Trial 0 finished with value: 0.6950742018218817 and parameters: {'lsvc_ac2s_kernel_sample_steps': 2, 'lsvc_ac2s_dual': False, 'lsvc_ac2s_C': 0.0028951961937490897, 'lsvc_ac2s_max_iter': 2000}. Best is trial 0 with value: 0.695074.[0m
[32m[I 2022-10-19 19:55:27,862][0m Trial 1 finished with value: 0.6950742018218817 and parameters: {'lsvc_ac2s_kernel_sample_steps': 3, 'lsvc_ac2s_dual': False, 'lsvc_ac2s_C': 9.78264775256906, 'lsvc_ac2s_max_iter': 2000}. Best is trial 0 with value: 0.695074.[0m
[32m[I 2022-10-19 19:55:37,850][0m Trial 2 finished with value: 0.6950742018218817 and parameters: {'lsvc_ac2s_kernel_sample_steps': 1, 'lsvc_ac2s_dual': False, 'lsvc_ac2s_C': 164.7262585397282, 'lsvc_ac2s_max_iter': 2000}. Best is trial 0 with value: 0.695074.[0m
[32m[I 2022-10-19 19:55:54,113][0m Trial 3 finished with value: 0.6950742018218817 and parameters: {'lsvc_ac2s_kernel_sample_steps': 2, 'lsvc_ac2s_dual': False, 'lsvc_ac2s_C': 0.02535351412652274, 'lsvc_ac2s_max_iter': 2000}. Best is trial 0 with value: 0.695074.[0m
[32m[I 2022-10-19 19:56:03,402][0m Trial 4 finished with value: 0.6950742018218817 and parameters: {'lsvc_ac2s_kernel_sample_steps': 1, 'lsvc_ac2s_dual': False, 'lsvc_ac2s_C': 0.00042366803713936497, 'lsvc_ac2s_max_iter': 2000}. Best is trial 0 with value: 0.695074.[0m
[32m[I 2022-10-19 19:56:19,596][0m Trial 5 finished with value: 0.6950742018218817 and parameters: {'lsvc_ac2s_kernel_sample_steps': 2, 'lsvc_ac2s_dual': False, 'lsvc_ac2s_C': 0.0028245648791217883, 'lsvc_ac2s_max_iter': 2000}. Best is trial 0 with value: 0.695074.[0m
[32m[I 2022-10-19 19:56:44,177][0m Trial 6 finished with value: 0.6950742018218817 and parameters: {'lsvc_ac2s_kernel_sample_steps': 3, 'lsvc_ac2s_dual': False, 'lsvc_ac2s_C': 10.880106052057178, 'lsvc_ac2s_max_iter': 2000}. Best is trial 0 with value: 0.695074.[0m
[32m[I 2022-10-19 19:57:09,229][0m Trial 7 finished with value: 0.6950742018218817 and parameters: {'lsvc_ac2s_kernel_sample_steps': 3, 'lsvc_ac2s_dual': False, 'lsvc_ac2s_C': 6.673914051772217, 'lsvc_ac2s_max_iter': 2000}. Best is trial 0 with value: 0.695074.[0m
[32m[I 2022-10-19 19:57:34,162][0m Trial 8 finished with value: 0.6950742018218817 and parameters: {'lsvc_ac2s_kernel_sample_steps': 3, 'lsvc_ac2s_dual': False, 'lsvc_ac2s_C': 0.0025424094704791633, 'lsvc_ac2s_max_iter': 2000}. Best is trial 0 with value: 0.695074.[0m
[32m[I 2022-10-19 19:57:43,442][0m Trial 9 finished with value: 0.6950742018218817 and parameters: {'lsvc_ac2s_kernel_sample_steps': 1, 'lsvc_ac2s_dual': False, 'lsvc_ac2s_C': 3.5343234111287364e-06, 'lsvc_ac2s_max_iter': 2000}. Best is trial 0 with value: 0.695074.[0m
[32m[I 2022-10-19 19:57:59,669][0m Trial 10 finished with value: 0.6950742018218817 and parameters: {'lsvc_ac2s_kernel_sample_steps': 2, 'lsvc_ac2s_dual': False, 'lsvc_ac2s_C': 9.549405926756807e-06, 'lsvc_ac2s_max_iter': 2000}. Best is trial 0 with value: 0.695074.[0m
[32m[I 2022-10-19 19:58:24,543][0m Trial 11 finished with value: 0.6950742018218817 and parameters: {'lsvc_ac2s_kernel_sample_steps': 3, 'lsvc_ac2s_dual': False, 'lsvc_ac2s_C': 0.3571781757728492, 'lsvc_ac2s_max_iter': 2000}. Best is trial 0 with value: 0.695074.[0m
[32m[I 2022-10-19 19:58:41,492][0m Trial 12 finished with value: 0.6950742018218817 and parameters: {'lsvc_ac2s_kernel_sample_steps': 2, 'lsvc_ac2s_dual': False, 'lsvc_ac2s_C': 0.3830424892585256, 'lsvc_ac2s_max_iter': 2000}. Best is trial 0 with value: 0.695074.[0m
[32m[I 2022-10-19 19:59:06,588][0m Trial 13 finished with value: 0.6950742018218817 and parameters: {'lsvc_ac2s_kernel_sample_steps': 3, 'lsvc_ac2s_dual': False, 'lsvc_ac2s_C': 945.6120095244976, 'lsvc_ac2s_max_iter': 2000}. Best is trial 0 with value: 0.695074.[0m
[32m[I 2022-10-19 19:59:23,238][0m Trial 14 finished with value: 0.6950742018218817 and parameters: {'lsvc_ac2s_kernel_sample_steps': 2, 'lsvc_ac2s_dual': False, 'lsvc_ac2s_C': 0.0001710123964617886, 'lsvc_ac2s_max_iter': 2000}. Best is trial 0 with value: 0.695074.[0m
[32m[I 2022-10-19 19:59:48,145][0m Trial 15 finished with value: 0.6950742018218817 and parameters: {'lsvc_ac2s_kernel_sample_steps': 3, 'lsvc_ac2s_dual': False, 'lsvc_ac2s_C': 0.11780764719114555, 'lsvc_ac2s_max_iter': 2000}. Best is trial 0 with value: 0.695074.[0m
[32m[I 2022-10-19 20:00:04,575][0m Trial 16 finished with value: 0.6950742018218817 and parameters: {'lsvc_ac2s_kernel_sample_steps': 2, 'lsvc_ac2s_dual': False, 'lsvc_ac2s_C': 5.4567598151027585, 'lsvc_ac2s_max_iter': 2000}. Best is trial 0 with value: 0.695074.[0m
[32m[I 2022-10-19 20:00:27,388][0m Trial 17 finished with value: 0.6950742018218817 and parameters: {'lsvc_ac2s_kernel_sample_steps': 2, 'lsvc_ac2s_dual': False, 'lsvc_ac2s_C': 9.230115157812644e-05, 'lsvc_ac2s_max_iter': 2000}. Best is trial 0 with value: 0.695074.[0m
[32m[I 2022-10-19 20:00:51,942][0m Trial 18 finished with value: 0.6950742018218817 and parameters: {'lsvc_ac2s_kernel_sample_steps': 3, 'lsvc_ac2s_dual': False, 'lsvc_ac2s_C': 0.07772259649146004, 'lsvc_ac2s_max_iter': 2000}. Best is trial 0 with value: 0.695074.[0m
[32m[I 2022-10-19 20:01:07,756][0m Trial 19 finished with value: 0.6950742018218817 and parameters: {'lsvc_ac2s_kernel_sample_steps': 2, 'lsvc_ac2s_dual': False, 'lsvc_ac2s_C': 1.3542887328539912, 'lsvc_ac2s_max_iter': 2000}. Best is trial 0 with value: 0.695074.[0m
