[32m[I 2022-10-19 18:13:22,277][0m Trial 10 finished with value: 0.9997962403088564 and parameters: {'dtc_criterion': 'entropy', 'dtc_splitter': 'best', 'dtc_min_samples_split': 48, 'dtc_min_samples_leaf': 9, 'dtc_max_features': 5}. Best is trial 2 with value: 0.999896.[0m
[32m[I 2022-10-19 18:13:22,728][0m Trial 14 finished with value: 0.912522232382409 and parameters: {'dtc_criterion': 'gini', 'dtc_splitter': 'best', 'dtc_min_samples_split': 29, 'dtc_min_samples_leaf': 37, 'dtc_max_features': 1}. Best is trial 2 with value: 0.999896.[0m
[32m[I 2022-10-19 18:13:23,093][0m Trial 13 finished with value: 0.9981241906895989 and parameters: {'dtc_criterion': 'entropy', 'dtc_splitter': 'best', 'dtc_min_samples_split': 38, 'dtc_min_samples_leaf': 16, 'dtc_max_features': 4}. Best is trial 2 with value: 0.999896.[0m
[32m[I 2022-10-19 18:13:23,717][0m Trial 15 finished with value: 0.9957754359446364 and parameters: {'dtc_criterion': 'gini', 'dtc_splitter': 'best', 'dtc_min_samples_split': 24, 'dtc_min_samples_leaf': 27, 'dtc_max_features': 3}. Best is trial 2 with value: 0.999896.[0m
[32m[I 2022-10-19 18:13:24,100][0m Trial 16 finished with value: 0.998167868189731 and parameters: {'dtc_criterion': 'entropy', 'dtc_splitter': 'best', 'dtc_min_samples_split': 23, 'dtc_min_samples_leaf': 35, 'dtc_max_features': 3}. Best is trial 2 with value: 0.999896.[0m
[32m[I 2022-10-19 18:13:25,151][0m Trial 17 finished with value: 0.9997987571608519 and parameters: {'dtc_criterion': 'gini', 'dtc_splitter': 'best', 'dtc_min_samples_split': 2, 'dtc_min_samples_leaf': 12, 'dtc_max_features': 7}. Best is trial 2 with value: 0.999896.[0m
[32m[I 2022-10-19 18:13:25,562][0m Trial 18 finished with value: 0.9999577321963047 and parameters: {'dtc_criterion': 'entropy', 'dtc_splitter': 'best', 'dtc_min_samples_split': 3, 'dtc_min_samples_leaf': 1, 'dtc_max_features': 7}. Best is trial 18 with value: 0.999958.[0m
[32m[I 2022-10-19 18:13:26,071][0m Trial 19 finished with value: 0.999927888106758 and parameters: {'dtc_criterion': 'gini', 'dtc_splitter': 'best', 'dtc_min_samples_split': 4, 'dtc_min_samples_leaf': 1, 'dtc_max_features': 7}. Best is trial 18 with value: 0.999958.[0m
[32m[I 2022-10-19 18:13:26,198][0m Trial 20 finished with value: 0.999937837165836 and parameters: {'dtc_criterion': 'gini', 'dtc_splitter': 'best', 'dtc_min_samples_split': 3, 'dtc_min_samples_leaf': 1, 'dtc_max_features': 7}. Best is trial 18 with value: 0.999958.[0m
[32m[I 2022-10-19 18:13:26,330][0m Trial 21 finished with value: 0.9997319475978557 and parameters: {'dtc_criterion': 'gini', 'dtc_splitter': 'best', 'dtc_min_samples_split': 3, 'dtc_min_samples_leaf': 17, 'dtc_max_features': 6}. Best is trial 18 with value: 0.999958.[0m
[32m[I 2022-10-19 18:13:26,686][0m Trial 22 finished with value: 0.9999030674775166 and parameters: {'dtc_criterion': 'gini', 'dtc_splitter': 'best', 'dtc_min_samples_split': 5, 'dtc_min_samples_leaf': 2, 'dtc_max_features': 7}. Best is trial 18 with value: 0.999958.[0m
[32m[I 2022-10-19 18:13:26,762][0m EarlyStopping exceeded for DecisionTreeClassifier; no new best scores on iters 20.[0m
[32m[I 2022-10-19 18:13:26,762][0m Study finished.[0m
[32m[I 2022-10-19 18:13:26,768][0m --------------------------------------------------------------------------------[0m
[32m[I 2022-10-19 18:13:26,769][0m --------------------          ExtraTreeClassifier           --------------------[0m
[32m[I 2022-10-19 18:13:26,769][0m --------------------------------------------------------------------------------[0m
[32m[I 2022-10-19 18:13:26,795][0m A new study created in RDB with name: ExtraTreeClassifier_e448dfef[0m
[32m[I 2022-10-19 18:13:26,801][0m Study started.[0m
[32m[I 2022-10-19 18:13:28,447][0m Trial 7 finished with value: 0.6950742018218817 and parameters: {'etc_criterion': 'entropy', 'etc_min_samples_split': 6, 'etc_min_samples_leaf': 36, 'etc_max_features': 1}. Best is trial 7 with value: 0.695074.[0m
[32m[I 2022-10-19 18:13:29,147][0m Trial 1 finished with value: 0.8729181633759879 and parameters: {'etc_criterion': 'entropy', 'etc_min_samples_split': 27, 'etc_min_samples_leaf': 26, 'etc_max_features': 5}. Best is trial 1 with value: 0.872918.[0m
[32m[I 2022-10-19 18:13:29,267][0m Trial 6 finished with value: 0.9019123326522348 and parameters: {'etc_criterion': 'entropy', 'etc_min_samples_split': 35, 'etc_min_samples_leaf': 21, 'etc_max_features': 5}. Best is trial 6 with value: 0.901912.[0m
[32m[I 2022-10-19 18:13:29,730][0m Trial 4 finished with value: 0.8524589488399141 and parameters: {'etc_criterion': 'entropy', 'etc_min_samples_split': 26, 'etc_min_samples_leaf': 13, 'etc_max_features': 6}. Best is trial 6 with value: 0.901912.[0m
[32m[I 2022-10-19 18:13:30,226][0m Trial 0 finished with value: 0.976924497321388 and parameters: {'etc_criterion': 'gini', 'etc_min_samples_split': 45, 'etc_min_samples_leaf': 18, 'etc_max_features': 7}. Best is trial 0 with value: 0.976924.[0m
[32m[I 2022-10-19 18:13:30,227][0m Trial 2 finished with value: 0.9246021928016215 and parameters: {'etc_criterion': 'gini', 'etc_min_samples_split': 45, 'etc_min_samples_leaf': 7, 'etc_max_features': 6}. Best is trial 0 with value: 0.976924.[0m
[32m[I 2022-10-19 18:13:30,570][0m Trial 5 finished with value: 0.9862522607027177 and parameters: {'etc_criterion': 'gini', 'etc_min_samples_split': 42, 'etc_min_samples_leaf': 9, 'etc_max_features': 7}. Best is trial 5 with value: 0.986252.[0m
[32m[I 2022-10-19 18:13:30,657][0m Trial 3 finished with value: 0.9771638349443217 and parameters: {'etc_criterion': 'gini', 'etc_min_samples_split': 6, 'etc_min_samples_leaf': 23, 'etc_max_features': 7}. Best is trial 5 with value: 0.986252.[0m
[32m[I 2022-10-19 18:13:31,230][0m Trial 9 finished with value: 0.6950742018218817 and parameters: {'etc_criterion': 'gini', 'etc_min_samples_split': 28, 'etc_min_samples_leaf': 32, 'etc_max_features': 1}. Best is trial 5 with value: 0.986252.[0m
[32m[I 2022-10-19 18:13:31,549][0m Trial 8 finished with value: 0.9101060331668641 and parameters: {'etc_criterion': 'gini', 'etc_min_samples_split': 2, 'etc_min_samples_leaf': 23, 'etc_max_features': 6}. Best is trial 5 with value: 0.986252.[0m
[32m[I 2022-10-19 18:13:31,825][0m Trial 11 finished with value: 0.6950742018218817 and parameters: {'etc_criterion': 'gini', 'etc_min_samples_split': 30, 'etc_min_samples_leaf': 10, 'etc_max_features': 1}. Best is trial 5 with value: 0.986252.[0m
[32m[I 2022-10-19 18:13:32,051][0m Trial 10 finished with value: 0.8751354292502617 and parameters: {'etc_criterion': 'entropy', 'etc_min_samples_split': 7, 'etc_min_samples_leaf': 46, 'etc_max_features': 5}. Best is trial 5 with value: 0.986252.[0m
[32m[I 2022-10-19 18:13:33,188][0m Trial 15 finished with value: 0.8040976878709973 and parameters: {'etc_criterion': 'gini', 'etc_min_samples_split': 16, 'etc_min_samples_leaf': 31, 'etc_max_features': 5}. Best is trial 5 with value: 0.986252.[0m
[32m[I 2022-10-19 18:13:33,270][0m Trial 16 finished with value: 0.6950742018218817 and parameters: {'etc_criterion': 'entropy', 'etc_min_samples_split': 42, 'etc_min_samples_leaf': 4, 'etc_max_features': 2}. Best is trial 5 with value: 0.986252.[0m
[32m[I 2022-10-19 18:13:33,351][0m Trial 14 finished with value: 0.8822608712749165 and parameters: {'etc_criterion': 'gini', 'etc_min_samples_split': 10, 'etc_min_samples_leaf': 22, 'etc_max_features': 5}. Best is trial 5 with value: 0.986252.[0m
[32m[I 2022-10-19 18:13:33,549][0m Trial 17 finished with value: 0.6950742018218817 and parameters: {'etc_criterion': 'gini', 'etc_min_samples_split': 50, 'etc_min_samples_leaf': 49, 'etc_max_features': 3}. Best is trial 5 with value: 0.986252.[0m
[32m[I 2022-10-19 18:13:33,753][0m Trial 13 finished with value: 0.9451345395190276 and parameters: {'etc_criterion': 'gini', 'etc_min_samples_split': 45, 'etc_min_samples_leaf': 11, 'etc_max_features': 7}. Best is trial 5 with value: 0.986252.[0m
[32m[I 2022-10-19 18:13:34,058][0m Trial 18 finished with value: 0.6950742018218817 and parameters: {'etc_criterion': 'gini', 'etc_min_samples_split': 19, 'etc_min_samples_leaf': 3, 'etc_max_features': 3}. Best is trial 5 with value: 0.986252.[0m
[32m[I 2022-10-19 18:13:34,159][0m Trial 19 finished with value: 0.6950742018218817 and parameters: {'etc_criterion': 'gini', 'etc_min_samples_split': 15, 'etc_min_samples_leaf': 14, 'etc_max_features': 3}. Best is trial 5 with value: 0.986252.[0m
[32m[I 2022-10-19 18:13:35,010][0m Trial 12 finished with value: 0.9998483716699059 and parameters: {'etc_criterion': 'entropy', 'etc_min_samples_split': 29, 'etc_min_samples_leaf': 1, 'etc_max_features': 7}. Best is trial 12 with value: 0.999848.[0m
[32m[I 2022-10-19 18:13:36,732][0m Trial 22 finished with value: 0.9770186525475757 and parameters: {'etc_criterion': 'gini', 'etc_min_samples_split': 18, 'etc_min_samples_leaf': 15, 'etc_max_features': 7}. Best is trial 12 with value: 0.999848.[0m
[32m[I 2022-10-19 18:13:36,955][0m Trial 24 finished with value: 0.9802602469891523 and parameters: {'etc_criterion': 'gini', 'etc_min_samples_split': 37, 'etc_min_samples_leaf': 43, 'etc_max_features': 7}. Best is trial 12 with value: 0.999848.[0m
[32m[I 2022-10-19 18:13:37,370][0m Trial 26 finished with value: 0.9802602469891523 and parameters: {'etc_criterion': 'gini', 'etc_min_samples_split': 38, 'etc_min_samples_leaf': 42, 'etc_max_features': 7}. Best is trial 12 with value: 0.999848.[0m
[32m[I 2022-10-19 18:13:37,907][0m Trial 23 finished with value: 0.9994754878886172 and parameters: {'etc_criterion': 'gini', 'etc_min_samples_split': 19, 'etc_min_samples_leaf': 2, 'etc_max_features': 7}. Best is trial 20 with value: 0.999893.[0m
[32m[I 2022-10-19 18:13:37,908][0m Trial 20 finished with value: 0.9998756830214525 and parameters: {'etc_criterion': 'gini', 'etc_min_samples_split': 18, 'etc_min_samples_leaf': 1, 'etc_max_features': 7}. Best is trial 20 with value: 0.999893.[0m
[32m[I 2022-10-19 18:13:38,139][0m Trial 21 finished with value: 0.999893103667389 and parameters: {'etc_criterion': 'gini', 'etc_min_samples_split': 16, 'etc_min_samples_leaf': 1, 'etc_max_features': 7}. Best is trial 21 with value: 0.999893.[0m
[32m[I 2022-10-19 18:13:38,331][0m Trial 25 finished with value: 0.999840971158349 and parameters: {'etc_criterion': 'gini', 'etc_min_samples_split': 34, 'etc_min_samples_leaf': 1, 'etc_max_features': 7}. Best is trial 21 with value: 0.999893.[0m
[32m[I 2022-10-19 18:13:38,640][0m Trial 27 finished with value: 0.9998012654004954 and parameters: {'etc_criterion': 'entropy', 'etc_min_samples_split': 36, 'etc_min_samples_leaf': 1, 'etc_max_features': 4}. Best is trial 21 with value: 0.999893.[0m
[32m[I 2022-10-19 18:13:39,572][0m Trial 29 finished with value: 0.9984297420465768 and parameters: {'etc_criterion': 'entropy', 'etc_min_samples_split': 36, 'etc_min_samples_leaf': 2, 'etc_max_features': 6}. Best is trial 21 with value: 0.999893.[0m
[32m[I 2022-10-19 18:13:39,655][0m Trial 28 finished with value: 0.9998211649377585 and parameters: {'etc_criterion': 'entropy', 'etc_min_samples_split': 35, 'etc_min_samples_leaf': 2, 'etc_max_features': 7}. Best is trial 21 with value: 0.999893.[0m
[32m[I 2022-10-19 18:13:39,730][0m EarlyStopping exceeded for ExtraTreeClassifier; no new best scores on iters 20.[0m
[32m[I 2022-10-19 18:13:39,731][0m Study finished.[0m
[32m[I 2022-10-19 18:13:39,737][0m --------------------------------------------------------------------------------[0m
[32m[I 2022-10-19 18:13:39,738][0m --------------------          ExtraTreesClassifier          --------------------[0m
[32m[I 2022-10-19 18:13:39,739][0m --------------------------------------------------------------------------------[0m
[32m[I 2022-10-19 18:13:39,766][0m A new study created in RDB with name: ExtraTreesClassifier_e448dfef[0m
[32m[I 2022-10-19 18:13:39,772][0m Study started.[0m
[32m[I 2022-10-19 18:14:01,382][0m Trial 0 finished with value: 0.6950742018218817 and parameters: {'etsc_n_estimators': 60, 'etsc_criterion': 'entropy', 'etsc_min_samples_split': 50, 'etsc_min_samples_leaf': 28, 'etsc_max_features': 2, 'etsc_bootstrap': True}. Best is trial 0 with value: 0.695074.[0m
[32m[I 2022-10-19 18:14:45,683][0m Trial 6 finished with value: 0.7174029242389841 and parameters: {'etsc_n_estimators': 120, 'etsc_criterion': 'gini', 'etsc_min_samples_split': 27, 'etsc_min_samples_leaf': 43, 'etsc_max_features': 4, 'etsc_bootstrap': False}. Best is trial 6 with value: 0.717403.[0m
[32m[I 2022-10-19 18:14:49,914][0m Trial 2 finished with value: 0.7049595287807678 and parameters: {'etsc_n_estimators': 130, 'etsc_criterion': 'entropy', 'etsc_min_samples_split': 40, 'etsc_min_samples_leaf': 41, 'etsc_max_features': 4, 'etsc_bootstrap': False}. Best is trial 6 with value: 0.717403.[0m
[32m[I 2022-10-19 18:14:53,155][0m Trial 4 finished with value: 0.7134814179806004 and parameters: {'etsc_n_estimators': 130, 'etsc_criterion': 'gini', 'etsc_min_samples_split': 48, 'etsc_min_samples_leaf': 22, 'etsc_max_features': 4, 'etsc_bootstrap': False}. Best is trial 6 with value: 0.717403.[0m
[32m[I 2022-10-19 18:15:34,137][0m Trial 8 finished with value: 0.708207271218417 and parameters: {'etsc_n_estimators': 180, 'etsc_criterion': 'gini', 'etsc_min_samples_split': 50, 'etsc_min_samples_leaf': 37, 'etsc_max_features': 4, 'etsc_bootstrap': False}. Best is trial 6 with value: 0.717403.[0m
[32m[I 2022-10-19 18:15:36,084][0m Trial 3 finished with value: 0.9920292564850651 and parameters: {'etsc_n_estimators': 70, 'etsc_criterion': 'gini', 'etsc_min_samples_split': 23, 'etsc_min_samples_leaf': 42, 'etsc_max_features': 7, 'etsc_bootstrap': True}. Best is trial 3 with value: 0.992029.[0m
[32m[I 2022-10-19 18:16:02,644][0m Trial 13 finished with value: 0.6950742018218817 and parameters: {'etsc_n_estimators': 50, 'etsc_criterion': 'gini', 'etsc_min_samples_split': 21, 'etsc_min_samples_leaf': 4, 'etsc_max_features': 3, 'etsc_bootstrap': True}. Best is trial 3 with value: 0.992029.[0m
[32m[I 2022-10-19 18:16:08,586][0m Trial 5 finished with value: 0.9929410490851412 and parameters: {'etsc_n_estimators': 80, 'etsc_criterion': 'gini', 'etsc_min_samples_split': 47, 'etsc_min_samples_leaf': 8, 'etsc_max_features': 7, 'etsc_bootstrap': True}. Best is trial 5 with value: 0.992941.[0m
[32m[I 2022-10-19 18:16:15,586][0m Trial 9 finished with value: 0.883891447301541 and parameters: {'etsc_n_estimators': 100, 'etsc_criterion': 'entropy', 'etsc_min_samples_split': 50, 'etsc_min_samples_leaf': 41, 'etsc_max_features': 5, 'etsc_bootstrap': False}. Best is trial 5 with value: 0.992941.[0m
[32m[I 2022-10-19 18:16:21,583][0m Trial 11 finished with value: 0.7336689981400022 and parameters: {'etsc_n_estimators': 150, 'etsc_criterion': 'gini', 'etsc_min_samples_split': 25, 'etsc_min_samples_leaf': 12, 'etsc_max_features': 4, 'etsc_bootstrap': True}. Best is trial 5 with value: 0.992941.[0m
[32m[I 2022-10-19 18:16:54,797][0m Trial 15 finished with value: 0.7069244296371959 and parameters: {'etsc_n_estimators': 80, 'etsc_criterion': 'gini', 'etsc_min_samples_split': 42, 'etsc_min_samples_leaf': 43, 'etsc_max_features': 4, 'etsc_bootstrap': True}. Best is trial 5 with value: 0.992941.[0m
[32m[I 2022-10-19 18:16:56,212][0m Trial 14 finished with value: 0.6950742018218817 and parameters: {'etsc_n_estimators': 200, 'etsc_criterion': 'gini', 'etsc_min_samples_split': 21, 'etsc_min_samples_leaf': 29, 'etsc_max_features': 1, 'etsc_bootstrap': False}. Best is trial 5 with value: 0.992941.[0m
[32m[I 2022-10-19 18:17:23,240][0m Trial 16 finished with value: 0.6950742018218817 and parameters: {'etsc_n_estimators': 190, 'etsc_criterion': 'gini', 'etsc_min_samples_split': 37, 'etsc_min_samples_leaf': 12, 'etsc_max_features': 3, 'etsc_bootstrap': False}. Best is trial 5 with value: 0.992941.[0m
[32m[I 2022-10-19 18:17:37,829][0m Trial 7 finished with value: 0.9960025478533321 and parameters: {'etsc_n_estimators': 170, 'etsc_criterion': 'entropy', 'etsc_min_samples_split': 23, 'etsc_min_samples_leaf': 2, 'etsc_max_features': 4, 'etsc_bootstrap': True}. Best is trial 7 with value: 0.996003.[0m
[32m[I 2022-10-19 18:17:47,091][0m Trial 10 finished with value: 0.9997861885142715 and parameters: {'etsc_n_estimators': 80, 'etsc_criterion': 'gini', 'etsc_min_samples_split': 27, 'etsc_min_samples_leaf': 3, 'etsc_max_features': 7, 'etsc_bootstrap': True}. Best is trial 10 with value: 0.999786.[0m
[32m[I 2022-10-19 18:18:19,748][0m Trial 12 finished with value: 0.9184036135681095 and parameters: {'etsc_n_estimators': 190, 'etsc_criterion': 'gini', 'etsc_min_samples_split': 6, 'etsc_min_samples_leaf': 29, 'etsc_max_features': 5, 'etsc_bootstrap': False}. Best is trial 10 with value: 0.999786.[0m
[32m[I 2022-10-19 18:18:49,473][0m Trial 1 finished with value: 0.9904282557279669 and parameters: {'etsc_n_estimators': 170, 'etsc_criterion': 'gini', 'etsc_min_samples_split': 24, 'etsc_min_samples_leaf': 35, 'etsc_max_features': 7, 'etsc_bootstrap': False}. Best is trial 10 with value: 0.999786.[0m
[32m[I 2022-10-19 18:18:56,923][0m Trial 19 finished with value: 0.9927188325247346 and parameters: {'etsc_n_estimators': 80, 'etsc_criterion': 'gini', 'etsc_min_samples_split': 6, 'etsc_min_samples_leaf': 17, 'etsc_max_features': 7, 'etsc_bootstrap': True}. Best is trial 10 with value: 0.999786.[0m
[32m[I 2022-10-19 18:19:07,723][0m Trial 20 finished with value: 0.9918107599031382 and parameters: {'etsc_n_estimators': 80, 'etsc_criterion': 'gini', 'etsc_min_samples_split': 5, 'etsc_min_samples_leaf': 50, 'etsc_max_features': 7, 'etsc_bootstrap': True}. Best is trial 10 with value: 0.999786.[0m
[32m[I 2022-10-19 18:19:39,120][0m Trial 17 finished with value: 0.9999577360379659 and parameters: {'etsc_n_estimators': 90, 'etsc_criterion': 'entropy', 'etsc_min_samples_split': 5, 'etsc_min_samples_leaf': 1, 'etsc_max_features': 7, 'etsc_bootstrap': True}. Best is trial 17 with value: 0.999958.[0m
[32m[I 2022-10-19 18:20:06,941][0m Trial 18 finished with value: 0.9999478027521416 and parameters: {'etsc_n_estimators': 90, 'etsc_criterion': 'gini', 'etsc_min_samples_split': 11, 'etsc_min_samples_leaf': 1, 'etsc_max_features': 7, 'etsc_bootstrap': True}. Best is trial 17 with value: 0.999958.[0m
[32m[I 2022-10-19 18:22:12,661][0m Trial 23 finished with value: 0.9997787090690903 and parameters: {'etsc_n_estimators': 160, 'etsc_criterion': 'entropy', 'etsc_min_samples_split': 12, 'etsc_min_samples_leaf': 3, 'etsc_max_features': 6, 'etsc_bootstrap': True}. Best is trial 17 with value: 0.999958.[0m
[32m[I 2022-10-19 18:22:51,249][0m Trial 27 finished with value: 0.9999428294267828 and parameters: {'etsc_n_estimators': 100, 'etsc_criterion': 'entropy', 'etsc_min_samples_split': 13, 'etsc_min_samples_leaf': 1, 'etsc_max_features': 6, 'etsc_bootstrap': True}. Best is trial 17 with value: 0.999958.[0m
[32m[I 2022-10-19 18:22:55,455][0m Trial 22 finished with value: 0.999952765354328 and parameters: {'etsc_n_estimators': 160, 'etsc_criterion': 'entropy', 'etsc_min_samples_split': 10, 'etsc_min_samples_leaf': 1, 'etsc_max_features': 6, 'etsc_bootstrap': True}. Best is trial 17 with value: 0.999958.[0m
[32m[I 2022-10-19 18:22:57,873][0m Trial 26 finished with value: 0.9997662695256081 and parameters: {'etsc_n_estimators': 160, 'etsc_criterion': 'entropy', 'etsc_min_samples_split': 15, 'etsc_min_samples_leaf': 3, 'etsc_max_features': 6, 'etsc_bootstrap': True}. Best is trial 17 with value: 0.999958.[0m
[32m[I 2022-10-19 18:23:10,936][0m Trial 24 finished with value: 0.9998259497299071 and parameters: {'etsc_n_estimators': 160, 'etsc_criterion': 'entropy', 'etsc_min_samples_split': 12, 'etsc_min_samples_leaf': 2, 'etsc_max_features': 6, 'etsc_bootstrap': True}. Best is trial 17 with value: 0.999958.[0m
[32m[I 2022-10-19 18:23:12,350][0m Trial 21 finished with value: 0.9999602225325096 and parameters: {'etsc_n_estimators': 170, 'etsc_criterion': 'entropy', 'etsc_min_samples_split': 7, 'etsc_min_samples_leaf': 1, 'etsc_max_features': 7, 'etsc_bootstrap': True}. Best is trial 21 with value: 0.99996.[0m
[32m[I 2022-10-19 18:23:13,498][0m Trial 28 finished with value: 0.9999453163174644 and parameters: {'etsc_n_estimators': 100, 'etsc_criterion': 'entropy', 'etsc_min_samples_split': 11, 'etsc_min_samples_leaf': 1, 'etsc_max_features': 6, 'etsc_bootstrap': True}. Best is trial 21 with value: 0.99996.[0m
[32m[I 2022-10-19 18:23:14,796][0m Trial 25 finished with value: 0.9998234629246578 and parameters: {'etsc_n_estimators': 160, 'etsc_criterion': 'entropy', 'etsc_min_samples_split': 14, 'etsc_min_samples_leaf': 2, 'etsc_max_features': 6, 'etsc_bootstrap': True}. Best is trial 21 with value: 0.99996.[0m
[32m[I 2022-10-19 18:23:32,657][0m Trial 29 finished with value: 0.9906921854420051 and parameters: {'etsc_n_estimators': 100, 'etsc_criterion': 'entropy', 'etsc_min_samples_split': 14, 'etsc_min_samples_leaf': 9, 'etsc_max_features': 6, 'etsc_bootstrap': True}. Best is trial 21 with value: 0.99996.[0m
[32m[I 2022-10-19 18:23:32,730][0m EarlyStopping exceeded for ExtraTreesClassifier; no new best scores on iters 20.[0m
[32m[I 2022-10-19 18:23:32,731][0m Study finished.[0m
[32m[I 2022-10-19 18:23:32,738][0m --------------------------------------------------------------------------------[0m
[32m[I 2022-10-19 18:23:32,738][0m --------------------               GaussianNB               --------------------[0m
[32m[I 2022-10-19 18:23:32,739][0m --------------------------------------------------------------------------------[0m
[32m[I 2022-10-19 18:23:32,764][0m A new study created in RDB with name: GaussianNB_e448dfef[0m
[32m[I 2022-10-19 18:23:32,771][0m Study started.[0m
