[32m[I 2022-10-19 17:28:58,901][0m Optimization for 30 classifiers started.[0m
[32m[I 2022-10-19 17:28:59,546][0m X_train shape: (1608679, 7); y_train shape: (1608679,); y_train unique values: {0, 1, 2, 3, 4, 5, 6, 7, 8}[0m
[32m[I 2022-10-19 17:28:59,562][0m X_test shape: (402170, 7); y_test shape: (402170,); y_test unique values: {0, 1, 2, 3, 4, 5, 6, 7, 8}[0m
[32m[I 2022-10-19 17:28:59,563][0m --------------------------------------------------------------------------------[0m
[32m[I 2022-10-19 17:28:59,563][0m --------------------           AdaBoostClassifier           --------------------[0m
[32m[I 2022-10-19 17:28:59,564][0m --------------------------------------------------------------------------------[0m
[32m[I 2022-10-19 17:28:59,629][0m A new study created in RDB with name: AdaBoostClassifier_e448dfef[0m
[32m[I 2022-10-19 17:28:59,637][0m Study started.[0m
[32m[I 2022-10-19 17:30:01,049][0m Trial 4 finished with value: 0.7445616116929415 and parameters: {'abc_n_estimators': 35, 'abc_learning_rate': 0.019803009890990535}. Best is trial 4 with value: 0.744562.[0m
[32m[I 2022-10-19 17:30:10,538][0m Trial 7 finished with value: 0.7559731367235444 and parameters: {'abc_n_estimators': 40, 'abc_learning_rate': 0.00045816070357117066}. Best is trial 7 with value: 0.755973.[0m
[32m[I 2022-10-19 17:30:36,506][0m Trial 2 finished with value: 0.7559731367235444 and parameters: {'abc_n_estimators': 55, 'abc_learning_rate': 0.00023373966381075317}. Best is trial 2 with value: 0.755973.[0m
[32m[I 2022-10-19 17:30:36,672][0m Trial 6 finished with value: 0.7559731367235444 and parameters: {'abc_n_estimators': 55, 'abc_learning_rate': 0.0005737923459481395}. Best is trial 2 with value: 0.755973.[0m
[32m[I 2022-10-19 17:30:47,159][0m Trial 5 finished with value: 0.6950742018218817 and parameters: {'abc_n_estimators': 60, 'abc_learning_rate': 1.2328640489235e-05}. Best is trial 2 with value: 0.755973.[0m
[32m[I 2022-10-19 17:31:03,817][0m Trial 0 finished with value: 0.7318229322263453 and parameters: {'abc_n_estimators': 70, 'abc_learning_rate': 0.004828802462238445}. Best is trial 2 with value: 0.755973.[0m
[32m[I 2022-10-19 17:31:05,745][0m Trial 8 finished with value: 0.7559731367235444 and parameters: {'abc_n_estimators': 35, 'abc_learning_rate': 0.0008244799398745354}. Best is trial 2 with value: 0.755973.[0m
[32m[I 2022-10-19 17:31:06,286][0m Trial 3 finished with value: 0.7559731367235444 and parameters: {'abc_n_estimators': 70, 'abc_learning_rate': 0.00024978726556591557}. Best is trial 2 with value: 0.755973.[0m
[32m[I 2022-10-19 17:31:21,291][0m Trial 1 finished with value: 0.6976573798174587 and parameters: {'abc_n_estimators': 80, 'abc_learning_rate': 0.5759447005020747}. Best is trial 2 with value: 0.755973.[0m
[32m[I 2022-10-19 17:31:52,075][0m Trial 15 finished with value: 0.7559731367235444 and parameters: {'abc_n_estimators': 25, 'abc_learning_rate': 0.0005759820727218087}. Best is trial 2 with value: 0.755973.[0m
[32m[I 2022-10-19 17:31:59,801][0m Trial 9 finished with value: 0.7559731367235444 and parameters: {'abc_n_estimators': 60, 'abc_learning_rate': 0.0001491823672719629}. Best is trial 15 with value: 0.755973.[0m
[32m[I 2022-10-19 17:32:15,461][0m Trial 16 finished with value: 0.7559731367235444 and parameters: {'abc_n_estimators': 30, 'abc_learning_rate': 0.00048019666747791453}. Best is trial 16 with value: 0.755973.[0m
[32m[I 2022-10-19 17:32:41,337][0m Trial 14 finished with value: 0.7445616116929415 and parameters: {'abc_n_estimators': 55, 'abc_learning_rate': 0.03635469212900895}. Best is trial 16 with value: 0.755973.[0m
[32m[I 2022-10-19 17:32:57,836][0m Trial 10 finished with value: 0.7559731367235444 and parameters: {'abc_n_estimators': 80, 'abc_learning_rate': 0.0002224646947690854}. Best is trial 16 with value: 0.755973.[0m
[32m[I 2022-10-19 17:33:07,634][0m Trial 13 finished with value: 0.6950742018218817 and parameters: {'abc_n_estimators': 70, 'abc_learning_rate': 4.065756743083712e-06}. Best is trial 16 with value: 0.755973.[0m
[32m[I 2022-10-19 17:33:20,028][0m Trial 12 finished with value: 0.6950742018218817 and parameters: {'abc_n_estimators': 85, 'abc_learning_rate': 1.6876700010626485e-06}. Best is trial 16 with value: 0.755973.[0m
[32m[I 2022-10-19 17:33:33,152][0m Trial 11 finished with value: 0.7445616116929415 and parameters: {'abc_n_estimators': 100, 'abc_learning_rate': 0.004466204636002333}. Best is trial 16 with value: 0.755973.[0m
[32m[I 2022-10-19 17:34:29,795][0m Trial 17 finished with value: 0.6950742018218817 and parameters: {'abc_n_estimators': 90, 'abc_learning_rate': 1.0969728595069363e-06}. Best is trial 2 with value: 0.755973.[0m
[32m[I 2022-10-19 17:34:49,691][0m Trial 24 finished with value: 0.6950742018218817 and parameters: {'abc_n_estimators': 45, 'abc_learning_rate': 2.418579979600383e-05}. Best is trial 2 with value: 0.755973.[0m
[32m[I 2022-10-19 17:34:53,656][0m Trial 18 finished with value: 0.6950742018218817 and parameters: {'abc_n_estimators': 100, 'abc_learning_rate': 6.977542674359399e-06}. Best is trial 2 with value: 0.755973.[0m
[32m[I 2022-10-19 17:35:08,499][0m Trial 19 finished with value: 0.6950742018218817 and parameters: {'abc_n_estimators': 100, 'abc_learning_rate': 1.5862608866681137e-06}. Best is trial 2 with value: 0.755973.[0m
[32m[I 2022-10-19 17:35:15,672][0m Trial 25 finished with value: 0.6950742018218817 and parameters: {'abc_n_estimators': 25, 'abc_learning_rate': 3.897655493746643e-05}. Best is trial 2 with value: 0.755973.[0m
[32m[I 2022-10-19 17:35:24,950][0m Trial 20 finished with value: 0.6950742018218817 and parameters: {'abc_n_estimators': 95, 'abc_learning_rate': 1.5451462506231415e-05}. Best is trial 2 with value: 0.755973.[0m
[32m[I 2022-10-19 17:35:31,796][0m Trial 26 finished with value: 0.6950742018218817 and parameters: {'abc_n_estimators': 25, 'abc_learning_rate': 3.9499725005032655e-05}. Best is trial 2 with value: 0.755973.[0m
[32m[I 2022-10-19 17:35:43,836][0m Trial 21 finished with value: 0.6950742018218817 and parameters: {'abc_n_estimators': 100, 'abc_learning_rate': 1.1950431688989142e-05}. Best is trial 2 with value: 0.755973.[0m
[32m[I 2022-10-19 17:35:45,182][0m Trial 28 finished with value: 0.6950742018218817 and parameters: {'abc_n_estimators': 25, 'abc_learning_rate': 5.224675202932916e-05}. Best is trial 2 with value: 0.755973.[0m
[32m[I 2022-10-19 17:35:48,463][0m Trial 22 finished with value: 0.6950742018218817 and parameters: {'abc_n_estimators': 100, 'abc_learning_rate': 3.298439812306003e-05}. Best is trial 2 with value: 0.755973.[0m
[32m[I 2022-10-19 17:35:55,275][0m Trial 27 finished with value: 0.6950742018218817 and parameters: {'abc_n_estimators': 45, 'abc_learning_rate': 4.860804626011562e-05}. Best is trial 2 with value: 0.755973.[0m
[32m[I 2022-10-19 17:35:56,183][0m Trial 23 finished with value: 0.6950742018218817 and parameters: {'abc_n_estimators': 100, 'abc_learning_rate': 4.309945015426103e-05}. Best is trial 2 with value: 0.755973.[0m
[32m[I 2022-10-19 17:35:56,250][0m EarlyStopping exceeded for AdaBoostClassifier; no new best scores on iters 20.[0m
[32m[I 2022-10-19 17:35:56,251][0m Study finished.[0m
[32m[I 2022-10-19 17:35:56,257][0m --------------------------------------------------------------------------------[0m
[32m[I 2022-10-19 17:35:56,257][0m --------------------           AdaGradClassifier            --------------------[0m
[32m[I 2022-10-19 17:35:56,258][0m --------------------------------------------------------------------------------[0m
[32m[I 2022-10-19 17:35:56,284][0m A new study created in RDB with name: AdaGradClassifier_e448dfef[0m
[32m[I 2022-10-19 17:35:56,290][0m Study started.[0m
[32m[I 2022-10-19 17:39:00,010][0m Trial 3 finished with value: 0.7146715286948985 and parameters: {'agc_alpha': 0.0012632703980683952, 'agc_l1_ratio': 0.4, 'agc_loss': 'squared_hinge'}. Best is trial 3 with value: 0.770097.[0m
[32m[I 2022-10-19 17:39:00,171][0m Trial 5 finished with value: 0.7441607105478097 and parameters: {'agc_alpha': 8.79860886909863, 'agc_l1_ratio': 0.2, 'agc_loss': 'modified_huber'}. Best is trial 7 with value: 0.775643.[0m
[32m[I 2022-10-19 17:39:00,172][0m Trial 7 finished with value: 0.7700973788874113 and parameters: {'agc_alpha': 3.8242225844097733, 'agc_l1_ratio': 1.0, 'agc_loss': 'smooth_hinge'}. Best is trial 7 with value: 0.775643.[0m
[32m[I 2022-10-19 17:39:00,329][0m Trial 2 finished with value: 0.7399458450266829 and parameters: {'agc_alpha': 0.21582417060350764, 'agc_l1_ratio': 0.5, 'agc_loss': 'log'}. Best is trial 1 with value: 0.775643.[0m
[32m[I 2022-10-19 17:39:00,420][0m Trial 1 finished with value: 0.7756432231588581 and parameters: {'agc_alpha': 15.405253452103427, 'agc_l1_ratio': 0.9, 'agc_loss': 'hinge'}. Best is trial 1 with value: 0.775643.[0m
[32m[I 2022-10-19 17:39:00,422][0m Trial 4 finished with value: 0.7199438346086804 and parameters: {'agc_alpha': 0.7456282757252156, 'agc_l1_ratio': 0.1, 'agc_loss': 'smooth_hinge'}. Best is trial 1 with value: 0.775643.[0m
[32m[I 2022-10-19 17:39:00,423][0m Trial 6 finished with value: 0.7661237849222121 and parameters: {'agc_alpha': 2.3420481129786395, 'agc_l1_ratio': 0.7000000000000001, 'agc_loss': 'smooth_hinge'}. Best is trial 1 with value: 0.775643.[0m
[32m[I 2022-10-19 17:39:00,424][0m Trial 0 finished with value: 0.7696749350885782 and parameters: {'agc_alpha': 27.17767576121955, 'agc_l1_ratio': 0.2, 'agc_loss': 'smooth_hinge'}. Best is trial 1 with value: 0.775643.[0m
[32m[I 2022-10-19 17:42:13,945][0m Trial 8 finished with value: 0.7034963254672407 and parameters: {'agc_alpha': 2.55526880754521, 'agc_l1_ratio': 0.5, 'agc_loss': 'squared_hinge'}. Best is trial 1 with value: 0.775643.[0m
[32m[I 2022-10-19 17:42:14,111][0m Trial 15 finished with value: 0.01042742051959043 and parameters: {'agc_alpha': 925.1756528638394, 'agc_l1_ratio': 0.7000000000000001, 'agc_loss': 'squared'}. Best is trial 1 with value: 0.776122.[0m
[32m[I 2022-10-19 17:42:14,201][0m Trial 12 finished with value: 0.7427875002917321 and parameters: {'agc_alpha': 0.0010676801223947405, 'agc_l1_ratio': 0.0, 'agc_loss': 'smooth_hinge'}. Best is trial 1 with value: 0.776122.[0m
[32m[I 2022-10-19 17:42:14,206][0m Trial 13 finished with value: 0.6866328839962436 and parameters: {'agc_alpha': 99.69843531873387, 'agc_l1_ratio': 0.1, 'agc_loss': 'hinge'}. Best is trial 9 with value: 0.776122.[0m
[32m[I 2022-10-19 17:42:14,279][0m Trial 10 finished with value: 1.5322517778019187e-05 and parameters: {'agc_alpha': 0.3577039388597856, 'agc_l1_ratio': 0.7000000000000001, 'agc_loss': 'squared'}. Best is trial 9 with value: 0.776122.[0m
[32m[I 2022-10-19 17:42:14,349][0m Trial 14 finished with value: 0.7374266513853656 and parameters: {'agc_alpha': 0.0011561972468081944, 'agc_l1_ratio': 0.9, 'agc_loss': 'log'}. Best is trial 9 with value: 0.776122.[0m
[32m[I 2022-10-19 17:42:14,425][0m Trial 11 finished with value: 0.7323430460521491 and parameters: {'agc_alpha': 0.045420670265664875, 'agc_l1_ratio': 0.9, 'agc_loss': 'log'}. Best is trial 9 with value: 0.776122.[0m
[32m[I 2022-10-19 17:42:14,571][0m Trial 9 finished with value: 0.7761216619221472 and parameters: {'agc_alpha': 11.447707894169916, 'agc_l1_ratio': 0.9, 'agc_loss': 'hinge'}. Best is trial 9 with value: 0.776122.[0m
[32m[I 2022-10-19 17:44:35,376][0m Trial 16 finished with value: 0.6967130129164244 and parameters: {'agc_alpha': 87.41644604750141, 'agc_l1_ratio': 1.0, 'agc_loss': 'hinge'}. Best is trial 9 with value: 0.776122.[0m
[32m[I 2022-10-19 17:44:35,445][0m Trial 18 finished with value: 0.6969193548004718 and parameters: {'agc_alpha': 84.47644958256237, 'agc_l1_ratio': 1.0, 'agc_loss': 'hinge'}. Best is trial 9 with value: 0.776122.[0m
[32m[I 2022-10-19 17:44:35,525][0m Trial 21 finished with value: 0.6951681791244972 and parameters: {'agc_alpha': 113.7007874987841, 'agc_l1_ratio': 1.0, 'agc_loss': 'hinge'}. Best is trial 9 with value: 0.776122.[0m
[32m[I 2022-10-19 17:44:35,526][0m Trial 17 finished with value: 0.684858674764115 and parameters: {'agc_alpha': 146.4892011480586, 'agc_l1_ratio': 1.0, 'agc_loss': 'hinge'}. Best is trial 9 with value: 0.776122.[0m
[32m[I 2022-10-19 17:44:35,527][0m Trial 20 finished with value: 0.6848605877390614 and parameters: {'agc_alpha': 149.22781765319223, 'agc_l1_ratio': 1.0, 'agc_loss': 'hinge'}. Best is trial 9 with value: 0.776122.[0m
[32m[I 2022-10-19 17:44:35,748][0m Trial 19 finished with value: 0.683642738100577 and parameters: {'agc_alpha': 151.55344712920459, 'agc_l1_ratio': 1.0, 'agc_loss': 'hinge'}. Best is trial 9 with value: 0.776122.[0m
[32m[I 2022-10-19 17:44:35,821][0m EarlyStopping exceeded for AdaGradClassifier; no new best scores on iters 20.[0m
[32m[I 2022-10-19 17:44:35,822][0m Study finished.[0m
[32m[I 2022-10-19 17:44:35,827][0m --------------------------------------------------------------------------------[0m
[32m[I 2022-10-19 17:44:35,828][0m --------------------       BalancedBaggingClassifier        --------------------[0m
[32m[I 2022-10-19 17:44:35,828][0m --------------------------------------------------------------------------------[0m
[32m[I 2022-10-19 17:44:35,854][0m A new study created in RDB with name: BalancedBaggingClassifier_e448dfef[0m
[32m[I 2022-10-19 17:44:35,860][0m Study started.[0m
[32m[I 2022-10-19 17:44:52,256][0m Trial 2 finished with value: 0.9734944957211502 and parameters: {'bbc_n_estimators': 12, 'bbc_max_features': 3, 'bbc_bootstrap': False, 'bbc_sampling_strategy': 'not minority'}. Best is trial 2 with value: 0.973494.[0m
[32m[I 2022-10-19 17:44:52,717][0m Trial 4 finished with value: 0.9602165168687661 and parameters: {'bbc_n_estimators': 10, 'bbc_max_features': 1, 'bbc_bootstrap': True, 'bbc_sampling_strategy': 'all'}. Best is trial 2 with value: 0.973494.[0m
[32m[I 2022-10-19 17:44:53,445][0m Trial 6 finished with value: 0.9613794219108854 and parameters: {'bbc_n_estimators': 14, 'bbc_max_features': 1, 'bbc_bootstrap': False, 'bbc_sampling_strategy': 'all'}. Best is trial 2 with value: 0.973494.[0m
[32m[I 2022-10-19 17:44:55,154][0m Trial 3 finished with value: 0.9988204209733362 and parameters: {'bbc_n_estimators': 7, 'bbc_max_features': 7, 'bbc_bootstrap': True, 'bbc_sampling_strategy': 'majority'}. Best is trial 3 with value: 0.99882.[0m
[32m[I 2022-10-19 17:44:59,291][0m Trial 5 finished with value: 0.9975515173010541 and parameters: {'bbc_n_estimators': 13, 'bbc_max_features': 7, 'bbc_bootstrap': True, 'bbc_sampling_strategy': 'all'}. Best is trial 3 with value: 0.99882.[0m
[32m[I 2022-10-19 17:45:03,099][0m Trial 9 finished with value: 0.9623155272901444 and parameters: {'bbc_n_estimators': 6, 'bbc_max_features': 2, 'bbc_bootstrap': False, 'bbc_sampling_strategy': 'not minority'}. Best is trial 3 with value: 0.99882.[0m
[32m[I 2022-10-19 17:45:03,104][0m Trial 1 finished with value: 0.9977280565215365 and parameters: {'bbc_n_estimators': 17, 'bbc_max_features': 6, 'bbc_bootstrap': True, 'bbc_sampling_strategy': 'all'}. Best is trial 3 with value: 0.99882.[0m
[32m[I 2022-10-19 17:45:04,915][0m Trial 7 finished with value: 0.9974420404354702 and parameters: {'bbc_n_estimators': 18, 'bbc_max_features': 7, 'bbc_bootstrap': True, 'bbc_sampling_strategy': 'not minority'}. Best is trial 3 with value: 0.99882.[0m
[32m[I 2022-10-19 17:45:09,921][0m Trial 10 finished with value: 0.9663754954700935 and parameters: {'bbc_n_estimators': 13, 'bbc_max_features': 1, 'bbc_bootstrap': False, 'bbc_sampling_strategy': 'all'}. Best is trial 3 with value: 0.99882.[0m
[32m[I 2022-10-19 17:45:11,480][0m Trial 0 finished with value: 0.996715291905273 and parameters: {'bbc_n_estimators': 11, 'bbc_max_features': 7, 'bbc_bootstrap': False, 'bbc_sampling_strategy': 'not majority'}. Best is trial 3 with value: 0.99882.[0m
[32m[I 2022-10-19 17:45:13,409][0m Trial 8 finished with value: 0.9977940402453471 and parameters: {'bbc_n_estimators': 18, 'bbc_max_features': 5, 'bbc_bootstrap': False, 'bbc_sampling_strategy': 'all'}. Best is trial 3 with value: 0.99882.[0m
[32m[I 2022-10-19 17:45:16,900][0m Trial 11 finished with value: 0.9784343915109784 and parameters: {'bbc_n_estimators': 20, 'bbc_max_features': 2, 'bbc_bootstrap': False, 'bbc_sampling_strategy': 'all'}. Best is trial 3 with value: 0.99882.[0m
[32m[I 2022-10-19 17:45:20,122][0m Trial 15 finished with value: 0.9958285710340116 and parameters: {'bbc_n_estimators': 13, 'bbc_max_features': 4, 'bbc_bootstrap': False, 'bbc_sampling_strategy': 'not minority'}. Best is trial 3 with value: 0.99882.[0m
[32m[I 2022-10-19 17:45:22,861][0m Trial 17 finished with value: 0.9857636988828085 and parameters: {'bbc_n_estimators': 5, 'bbc_max_features': 5, 'bbc_bootstrap': True, 'bbc_sampling_strategy': 'majority'}. Best is trial 3 with value: 0.99882.[0m
[32m[I 2022-10-19 17:45:24,685][0m Trial 18 finished with value: 0.9857636988828085 and parameters: {'bbc_n_estimators': 5, 'bbc_max_features': 5, 'bbc_bootstrap': True, 'bbc_sampling_strategy': 'majority'}. Best is trial 3 with value: 0.99882.[0m
[32m[I 2022-10-19 17:45:27,158][0m Trial 14 finished with value: 0.8802412713652937 and parameters: {'bbc_n_estimators': 10, 'bbc_max_features': 3, 'bbc_bootstrap': True, 'bbc_sampling_strategy': 'not majority'}. Best is trial 3 with value: 0.99882.[0m
[32m[I 2022-10-19 17:45:27,266][0m Trial 16 finished with value: 0.9783760827446559 and parameters: {'bbc_n_estimators': 20, 'bbc_max_features': 2, 'bbc_bootstrap': False, 'bbc_sampling_strategy': 'not minority'}. Best is trial 3 with value: 0.99882.[0m
[32m[I 2022-10-19 17:45:28,805][0m Trial 19 finished with value: 0.9853657641393171 and parameters: {'bbc_n_estimators': 6, 'bbc_max_features': 5, 'bbc_bootstrap': True, 'bbc_sampling_strategy': 'majority'}. Best is trial 3 with value: 0.99882.[0m
[32m[I 2022-10-19 17:45:29,700][0m Trial 20 finished with value: 0.9857636988828085 and parameters: {'bbc_n_estimators': 5, 'bbc_max_features': 5, 'bbc_bootstrap': True, 'bbc_sampling_strategy': 'majority'}. Best is trial 3 with value: 0.99882.[0m
[32m[I 2022-10-19 17:45:31,368][0m Trial 12 finished with value: 0.9987758026096308 and parameters: {'bbc_n_estimators': 18, 'bbc_max_features': 6, 'bbc_bootstrap': True, 'bbc_sampling_strategy': 'majority'}. Best is trial 3 with value: 0.99882.[0m
[32m[I 2022-10-19 17:45:32,323][0m Trial 13 finished with value: 0.9990315080798413 and parameters: {'bbc_n_estimators': 20, 'bbc_max_features': 7, 'bbc_bootstrap': False, 'bbc_sampling_strategy': 'majority'}. Best is trial 13 with value: 0.999031.[0m
[32m[I 2022-10-19 17:45:32,516][0m Trial 21 finished with value: 0.9832656016544378 and parameters: {'bbc_n_estimators': 8, 'bbc_max_features': 5, 'bbc_bootstrap': True, 'bbc_sampling_strategy': 'majority'}. Best is trial 13 with value: 0.999031.[0m
[32m[I 2022-10-19 17:45:32,589][0m EarlyStopping exceeded for BalancedBaggingClassifier; no new best scores on iters 20.[0m
[32m[I 2022-10-19 17:45:32,589][0m Study finished.[0m
[32m[I 2022-10-19 17:45:32,595][0m --------------------------------------------------------------------------------[0m
[32m[I 2022-10-19 17:45:32,595][0m --------------------     BalancedRandomForestClassifier     --------------------[0m
[32m[I 2022-10-19 17:45:32,596][0m --------------------------------------------------------------------------------[0m
[32m[I 2022-10-19 17:45:32,623][0m A new study created in RDB with name: BalancedRandomForestClassifier_e448dfef[0m
[32m[I 2022-10-19 17:45:32,628][0m Study started.[0m
[32m[I 2022-10-19 17:46:31,401][0m sklearn.ensemble.RandomForestClassifier.predict: fallback to original Scikit-learn[0m
[32m[I 2022-10-19 17:46:31,402][0m sklearn.ensemble.RandomForestClassifier.predict_proba: fallback to original Scikit-learn[0m
[32m[I 2022-10-19 17:46:42,703][0m Trial 5 finished with value: 0.969049899693401 and parameters: {'brf_n_estimators': 50, 'brf_criterion': 'entropy', 'brf_min_samples_split': 35, 'brf_min_samples_leaf': 23, 'brf_max_features': 1, 'brf_bootstrap': False}. Best is trial 5 with value: 0.96905.[0m
[32m[I 2022-10-19 17:46:44,786][0m sklearn.ensemble.RandomForestClassifier.predict: fallback to original Scikit-learn[0m
[32m[I 2022-10-19 17:46:44,788][0m sklearn.ensemble.RandomForestClassifier.predict_proba: fallback to original Scikit-learn[0m
[32m[I 2022-10-19 17:46:57,205][0m Trial 4 finished with value: 0.9678723023000085 and parameters: {'brf_n_estimators': 60, 'brf_criterion': 'gini', 'brf_min_samples_split': 2, 'brf_min_samples_leaf': 15, 'brf_max_features': 4, 'brf_bootstrap': True}. Best is trial 5 with value: 0.96905.[0m
[32m[I 2022-10-19 17:47:31,313][0m sklearn.ensemble.RandomForestClassifier.predict: fallback to original Scikit-learn[0m
[32m[I 2022-10-19 17:47:31,393][0m sklearn.ensemble.RandomForestClassifier.predict_proba: fallback to original Scikit-learn[0m
[32m[I 2022-10-19 17:47:32,544][0m sklearn.ensemble.RandomForestClassifier.predict: fallback to original Scikit-learn[0m
[32m[I 2022-10-19 17:47:32,549][0m sklearn.ensemble.RandomForestClassifier.predict_proba: fallback to original Scikit-learn[0m
[32m[I 2022-10-19 17:47:49,031][0m Trial 3 finished with value: 0.986669740651423 and parameters: {'brf_n_estimators': 100, 'brf_criterion': 'gini', 'brf_min_samples_split': 11, 'brf_min_samples_leaf': 9, 'brf_max_features': 1, 'brf_bootstrap': False}. Best is trial 3 with value: 0.98667.[0m
[32m[I 2022-10-19 17:47:49,818][0m sklearn.ensemble.RandomForestClassifier.predict: fallback to original Scikit-learn[0m
[32m[I 2022-10-19 17:47:49,819][0m sklearn.ensemble.RandomForestClassifier.predict_proba: fallback to original Scikit-learn[0m
