[32m[I 2022-10-19 17:54:56,250][0m Trial 28 finished with value: 0.7323259635510226 and parameters: {'bnb_alpha': 0.45, 'bnb_binarize': 0.15000000000000002, 'bnb_fit_prior': True}. Best is trial 0 with value: 0.732326.[0m
[32m[I 2022-10-19 17:54:56,466][0m EarlyStopping exceeded for BernoulliNB; no new best scores on iters 20.[0m
[32m[I 2022-10-19 17:54:56,466][0m Study finished.[0m
[32m[I 2022-10-19 17:54:56,473][0m --------------------------------------------------------------------------------[0m
[32m[I 2022-10-19 17:54:56,473][0m --------------------              CDClassifier              --------------------[0m
[32m[I 2022-10-19 17:54:56,474][0m --------------------------------------------------------------------------------[0m
[32m[I 2022-10-19 17:54:56,499][0m A new study created in RDB with name: CDClassifier_e448dfef[0m
[32m[I 2022-10-19 17:54:56,506][0m Study started.[0m
[32m[I 2022-10-19 17:57:38,352][0m Trial 2 finished with value: 2.1768465890535954e-05 and parameters: {'cdc_loss': 'log', 'cdc_penalty': 'l2', 'cdc_C': 0.030115696846787488, 'cdc_alpha': 36.83685492354747, 'cdc_selection': 'cyclic'}. Best is trial 2 with value: 2.17685e-05.[0m
[32m[I 2022-10-19 17:57:38,499][0m Trial 7 finished with value: 0.695145458044165 and parameters: {'cdc_loss': 'squared', 'cdc_penalty': 'l1', 'cdc_C': 0.5350991352566845, 'cdc_alpha': 475.93860985586025, 'cdc_selection': 'cyclic'}. Best is trial 0 with value: 0.695151.[0m
[32m[I 2022-10-19 17:57:38,584][0m Trial 6 finished with value: 0.695145458044165 and parameters: {'cdc_loss': 'squared', 'cdc_penalty': 'l2', 'cdc_C': 5.311840832702151, 'cdc_alpha': 0.12745174695629455, 'cdc_selection': 'uniform'}. Best is trial 0 with value: 0.707749.[0m
[32m[I 2022-10-19 17:57:38,591][0m Trial 4 finished with value: 0.14441280411132196 and parameters: {'cdc_loss': 'squared_hinge', 'cdc_penalty': 'l1/l2', 'cdc_C': 0.051143423732439394, 'cdc_alpha': 0.16592047428228737, 'cdc_selection': 'cyclic'}. Best is trial 0 with value: 0.707749.[0m
[32m[I 2022-10-19 17:57:38,592][0m Trial 0 finished with value: 0.6951513945249667 and parameters: {'cdc_loss': 'log', 'cdc_penalty': 'l1/l2', 'cdc_C': 400.3850352073205, 'cdc_alpha': 0.026690248884105656, 'cdc_selection': 'uniform'}. Best is trial 0 with value: 0.707749.[0m
[32m[I 2022-10-19 17:57:38,733][0m Trial 1 finished with value: 0.6019733223464185 and parameters: {'cdc_loss': 'squared_hinge', 'cdc_penalty': 'l1/l2', 'cdc_C': 1.2729213540845183, 'cdc_alpha': 0.06873591579585508, 'cdc_selection': 'cyclic'}. Best is trial 3 with value: 0.707749.[0m
[32m[I 2022-10-19 17:57:38,801][0m Trial 5 finished with value: 0.695145458044165 and parameters: {'cdc_loss': 'squared', 'cdc_penalty': 'l1', 'cdc_C': 19.16143505681336, 'cdc_alpha': 0.0023391343274343497, 'cdc_selection': 'uniform'}. Best is trial 3 with value: 0.707749.[0m
[32m[I 2022-10-19 17:57:38,809][0m Trial 3 finished with value: 0.707749389503084 and parameters: {'cdc_loss': 'squared_hinge', 'cdc_penalty': 'l2', 'cdc_C': 0.01590958950731753, 'cdc_alpha': 0.0012698161619281497, 'cdc_selection': 'cyclic'}. Best is trial 3 with value: 0.707749.[0m
[32m[I 2022-10-19 18:03:39,745][0m Trial 9 finished with value: 0.695145458044165 and parameters: {'cdc_loss': 'squared', 'cdc_penalty': 'l1', 'cdc_C': 7.109364529923076, 'cdc_alpha': 9.431771228985399, 'cdc_selection': 'uniform'}. Best is trial 3 with value: 0.722426.[0m
[32m[I 2022-10-19 18:03:39,748][0m Trial 12 finished with value: 0.01731581013733852 and parameters: {'cdc_loss': 'log', 'cdc_penalty': 'l1', 'cdc_C': 0.0016395166788177424, 'cdc_alpha': 0.01007683501953788, 'cdc_selection': 'cyclic'}. Best is trial 3 with value: 0.722426.[0m
[32m[I 2022-10-19 18:03:39,816][0m Trial 8 finished with value: 2.1768465890535954e-05 and parameters: {'cdc_loss': 'log', 'cdc_penalty': 'l2', 'cdc_C': 0.004111331255469427, 'cdc_alpha': 605.2789328809072, 'cdc_selection': 'cyclic'}. Best is trial 3 with value: 0.722426.[0m
[32m[I 2022-10-19 18:03:39,973][0m Trial 10 finished with value: 0.7224263523011131 and parameters: {'cdc_loss': 'squared_hinge', 'cdc_penalty': 'l1', 'cdc_C': 1.2201311220603215, 'cdc_alpha': 0.0015457408551412786, 'cdc_selection': 'cyclic'}. Best is trial 10 with value: 0.722426.[0m
[32m[I 2022-10-19 18:03:39,982][0m Trial 14 finished with value: 0.14441031401709017 and parameters: {'cdc_loss': 'squared_hinge', 'cdc_penalty': 'l1/l2', 'cdc_C': 0.051064322130579515, 'cdc_alpha': 38.619933844242304, 'cdc_selection': 'cyclic'}. Best is trial 10 with value: 0.722426.[0m
[32m[I 2022-10-19 18:03:40,137][0m Trial 15 finished with value: 0.7077387454942204 and parameters: {'cdc_loss': 'squared_hinge', 'cdc_penalty': 'l2', 'cdc_C': 1.3592027929211214, 'cdc_alpha': 150.8621342762246, 'cdc_selection': 'cyclic'}. Best is trial 10 with value: 0.722426.[0m
[32m[I 2022-10-19 18:03:40,440][0m Trial 13 finished with value: 2.1768465890535954e-05 and parameters: {'cdc_loss': 'squared', 'cdc_penalty': 'l1/l2', 'cdc_C': 33.42343866372985, 'cdc_alpha': 13.213081401313863, 'cdc_selection': 'cyclic'}. Best is trial 10 with value: 0.722426.[0m
[32m[I 2022-10-19 18:03:40,516][0m Trial 11 finished with value: 0.019344332152171136 and parameters: {'cdc_loss': 'squared_hinge', 'cdc_penalty': 'l1/l2', 'cdc_C': 93.67093140924716, 'cdc_alpha': 510.67402841363804, 'cdc_selection': 'cyclic'}. Best is trial 10 with value: 0.722426.[0m
[32m[I 2022-10-19 18:12:13,731][0m Trial 18 finished with value: 0.1846089832439953 and parameters: {'cdc_loss': 'modified_huber', 'cdc_penalty': 'l2', 'cdc_C': 0.292287964892224, 'cdc_alpha': 0.0010533918605624027, 'cdc_selection': 'cyclic'}. Best is trial 10 with value: 0.722426.[0m
[32m[I 2022-10-19 18:12:13,735][0m Trial 20 finished with value: 0.7031169416105775 and parameters: {'cdc_loss': 'modified_huber', 'cdc_penalty': 'l2', 'cdc_C': 0.15755136382171644, 'cdc_alpha': 0.001503573332122299, 'cdc_selection': 'cyclic'}. Best is trial 10 with value: 0.722426.[0m
[32m[I 2022-10-19 18:12:13,899][0m Trial 19 finished with value: 0.1454231279111573 and parameters: {'cdc_loss': 'modified_huber', 'cdc_penalty': 'l2', 'cdc_C': 0.23393223118050085, 'cdc_alpha': 0.0012915482825084678, 'cdc_selection': 'cyclic'}. Best is trial 10 with value: 0.722426.[0m
[32m[I 2022-10-19 18:12:13,904][0m Trial 17 finished with value: 0.13240657690969013 and parameters: {'cdc_loss': 'modified_huber', 'cdc_penalty': 'l2', 'cdc_C': 0.3097032463414699, 'cdc_alpha': 0.0010699258152397813, 'cdc_selection': 'cyclic'}. Best is trial 10 with value: 0.722426.[0m
[32m[I 2022-10-19 18:12:14,020][0m Trial 22 finished with value: 0.17939373382515753 and parameters: {'cdc_loss': 'modified_huber', 'cdc_penalty': 'l2', 'cdc_C': 0.15465989427976787, 'cdc_alpha': 0.0010718152976598324, 'cdc_selection': 'cyclic'}. Best is trial 10 with value: 0.722426.[0m
[32m[I 2022-10-19 18:12:14,022][0m Trial 23 finished with value: 0.18178849337517158 and parameters: {'cdc_loss': 'modified_huber', 'cdc_penalty': 'l2', 'cdc_C': 0.2579098234336458, 'cdc_alpha': 0.0010746974131489312, 'cdc_selection': 'cyclic'}. Best is trial 10 with value: 0.722426.[0m
[32m[I 2022-10-19 18:12:14,023][0m Trial 16 finished with value: 0.7138886060450943 and parameters: {'cdc_loss': 'modified_huber', 'cdc_penalty': 'l2', 'cdc_C': 68.65163979702166, 'cdc_alpha': 0.0010814768499460413, 'cdc_selection': 'cyclic'}. Best is trial 10 with value: 0.722426.[0m
[32m[I 2022-10-19 18:12:14,187][0m Trial 21 finished with value: 0.7107363720186135 and parameters: {'cdc_loss': 'modified_huber', 'cdc_penalty': 'l2', 'cdc_C': 0.22211051726045847, 'cdc_alpha': 0.003693261342875482, 'cdc_selection': 'cyclic'}. Best is trial 10 with value: 0.722426.[0m
[32m[I 2022-10-19 18:13:02,840][0m Trial 25 finished with value: 0.714384091933326 and parameters: {'cdc_loss': 'modified_huber', 'cdc_penalty': 'l1', 'cdc_C': 309.1673694928172, 'cdc_alpha': 0.01082963100328225, 'cdc_selection': 'uniform'}. Best is trial 10 with value: 0.729148.[0m
[32m[I 2022-10-19 18:13:02,844][0m Trial 29 finished with value: 0.695318963742575 and parameters: {'cdc_loss': 'modified_huber', 'cdc_penalty': 'l1', 'cdc_C': 375.31797125459576, 'cdc_alpha': 0.007906161311381507, 'cdc_selection': 'uniform'}. Best is trial 24 with value: 0.729148.[0m
[32m[I 2022-10-19 18:13:02,844][0m Trial 27 finished with value: 0.695318963742575 and parameters: {'cdc_loss': 'modified_huber', 'cdc_penalty': 'l1', 'cdc_C': 722.284668143956, 'cdc_alpha': 0.007772108879177359, 'cdc_selection': 'uniform'}. Best is trial 24 with value: 0.729148.[0m
[32m[I 2022-10-19 18:13:02,845][0m Trial 24 finished with value: 0.7291476828772434 and parameters: {'cdc_loss': 'modified_huber', 'cdc_penalty': 'l1', 'cdc_C': 479.8414448829268, 'cdc_alpha': 0.007579048533501721, 'cdc_selection': 'uniform'}. Best is trial 24 with value: 0.729148.[0m
[32m[I 2022-10-19 18:13:03,148][0m Trial 28 finished with value: 0.714384091933326 and parameters: {'cdc_loss': 'modified_huber', 'cdc_penalty': 'l1', 'cdc_C': 972.9625643010977, 'cdc_alpha': 0.006879525591444585, 'cdc_selection': 'uniform'}. Best is trial 24 with value: 0.729148.[0m
[32m[I 2022-10-19 18:13:03,223][0m Trial 26 finished with value: 0.714384091933326 and parameters: {'cdc_loss': 'modified_huber', 'cdc_penalty': 'l1', 'cdc_C': 277.8362469338227, 'cdc_alpha': 0.00911635254525042, 'cdc_selection': 'uniform'}. Best is trial 24 with value: 0.729148.[0m
[32m[I 2022-10-19 18:13:03,388][0m EarlyStopping exceeded for CDClassifier; no new best scores on iters 20.[0m
[32m[I 2022-10-19 18:13:03,389][0m Study finished.[0m
[32m[I 2022-10-19 18:13:03,395][0m --------------------------------------------------------------------------------[0m
[32m[I 2022-10-19 18:13:03,396][0m --------------------              ComplementNB              --------------------[0m
[32m[I 2022-10-19 18:13:03,396][0m --------------------------------------------------------------------------------[0m
[32m[I 2022-10-19 18:13:03,422][0m A new study created in RDB with name: ComplementNB_e448dfef[0m
[32m[I 2022-10-19 18:13:03,428][0m Study started.[0m
[32m[I 2022-10-19 18:13:05,668][0m Trial 4 finished with value: 0.08553430843786972 and parameters: {'compnb_alpha': 0.7000000000000001, 'compnb_fit_prior': True, 'compnb_norm': True}. Best is trial 4 with value: 0.0855343.[0m
[32m[I 2022-10-19 18:13:05,748][0m Trial 6 finished with value: 0.08553430843786972 and parameters: {'compnb_alpha': 0.7000000000000001, 'compnb_fit_prior': False, 'compnb_norm': True}. Best is trial 1 with value: 0.0855343.[0m
[32m[I 2022-10-19 18:13:05,749][0m Trial 2 finished with value: 0.08231845847806078 and parameters: {'compnb_alpha': 1.0, 'compnb_fit_prior': False, 'compnb_norm': False}. Best is trial 1 with value: 0.0855343.[0m
[32m[I 2022-10-19 18:13:05,905][0m Trial 1 finished with value: 0.08553430843786972 and parameters: {'compnb_alpha': 0.6000000000000001, 'compnb_fit_prior': False, 'compnb_norm': True}. Best is trial 1 with value: 0.0855343.[0m
[32m[I 2022-10-19 18:13:05,906][0m Trial 3 finished with value: 0.08231845847806078 and parameters: {'compnb_alpha': 0.0, 'compnb_fit_prior': False, 'compnb_norm': False}. Best is trial 1 with value: 0.0855343.[0m
[32m[I 2022-10-19 18:13:06,093][0m Trial 5 finished with value: 0.08553430843786972 and parameters: {'compnb_alpha': 0.1, 'compnb_fit_prior': False, 'compnb_norm': True}. Best is trial 1 with value: 0.0855343.[0m
[32m[I 2022-10-19 18:13:06,094][0m Trial 0 finished with value: 0.08231845847806078 and parameters: {'compnb_alpha': 0.8, 'compnb_fit_prior': False, 'compnb_norm': False}. Best is trial 1 with value: 0.0855343.[0m
[32m[I 2022-10-19 18:13:06,173][0m Trial 7 finished with value: 0.08231845847806078 and parameters: {'compnb_alpha': 0.0, 'compnb_fit_prior': True, 'compnb_norm': False}. Best is trial 1 with value: 0.0855343.[0m
[32m[I 2022-10-19 18:13:08,556][0m Trial 9 finished with value: 0.08231845847806078 and parameters: {'compnb_alpha': 0.45, 'compnb_fit_prior': False, 'compnb_norm': False}. Best is trial 1 with value: 0.0855343.[0m
[32m[I 2022-10-19 18:13:08,557][0m Trial 8 finished with value: 0.08231845847806078 and parameters: {'compnb_alpha': 0.75, 'compnb_fit_prior': False, 'compnb_norm': False}. Best is trial 1 with value: 0.0855343.[0m
[32m[I 2022-10-19 18:13:08,721][0m Trial 13 finished with value: 0.08553430843786972 and parameters: {'compnb_alpha': 0.0, 'compnb_fit_prior': False, 'compnb_norm': True}. Best is trial 1 with value: 0.0855343.[0m
[32m[I 2022-10-19 18:13:08,724][0m Trial 12 finished with value: 0.08231845847806078 and parameters: {'compnb_alpha': 0.25, 'compnb_fit_prior': False, 'compnb_norm': False}. Best is trial 1 with value: 0.0855343.[0m
[32m[I 2022-10-19 18:13:08,881][0m Trial 15 finished with value: 0.08553430843786972 and parameters: {'compnb_alpha': 0.9, 'compnb_fit_prior': True, 'compnb_norm': True}. Best is trial 1 with value: 0.0855343.[0m
[32m[I 2022-10-19 18:13:08,883][0m Trial 11 finished with value: 0.08553430843786972 and parameters: {'compnb_alpha': 0.9500000000000001, 'compnb_fit_prior': False, 'compnb_norm': True}. Best is trial 1 with value: 0.0855343.[0m
[32m[I 2022-10-19 18:13:08,883][0m Trial 14 finished with value: 0.08231845847806078 and parameters: {'compnb_alpha': 0.35000000000000003, 'compnb_fit_prior': False, 'compnb_norm': False}. Best is trial 1 with value: 0.0855343.[0m
[32m[I 2022-10-19 18:13:09,052][0m Trial 10 finished with value: 0.08553430843786972 and parameters: {'compnb_alpha': 0.5, 'compnb_fit_prior': True, 'compnb_norm': True}. Best is trial 1 with value: 0.0855343.[0m
[32m[I 2022-10-19 18:13:11,466][0m Trial 21 finished with value: 0.08553430843786972 and parameters: {'compnb_alpha': 0.6000000000000001, 'compnb_fit_prior': True, 'compnb_norm': True}. Best is trial 23 with value: 0.0855343.[0m
[32m[I 2022-10-19 18:13:11,471][0m Trial 19 finished with value: 0.08553430843786972 and parameters: {'compnb_alpha': 0.6000000000000001, 'compnb_fit_prior': True, 'compnb_norm': True}. Best is trial 23 with value: 0.0855343.[0m
[32m[I 2022-10-19 18:13:11,622][0m Trial 22 finished with value: 0.08553430843786972 and parameters: {'compnb_alpha': 0.6000000000000001, 'compnb_fit_prior': True, 'compnb_norm': True}. Best is trial 23 with value: 0.0855343.[0m
[32m[I 2022-10-19 18:13:11,623][0m Trial 16 finished with value: 0.08553430843786972 and parameters: {'compnb_alpha': 0.55, 'compnb_fit_prior': True, 'compnb_norm': True}. Best is trial 23 with value: 0.0855343.[0m
[32m[I 2022-10-19 18:13:11,702][0m Trial 23 finished with value: 0.08553430843786972 and parameters: {'compnb_alpha': 0.6000000000000001, 'compnb_fit_prior': True, 'compnb_norm': True}. Best is trial 23 with value: 0.0855343.[0m
[32m[I 2022-10-19 18:13:11,778][0m Trial 20 finished with value: 0.08553430843786972 and parameters: {'compnb_alpha': 0.6000000000000001, 'compnb_fit_prior': True, 'compnb_norm': True}. Best is trial 23 with value: 0.0855343.[0m
[32m[I 2022-10-19 18:13:11,778][0m Trial 18 finished with value: 0.08553430843786972 and parameters: {'compnb_alpha': 0.6000000000000001, 'compnb_fit_prior': True, 'compnb_norm': True}. Best is trial 23 with value: 0.0855343.[0m
[32m[I 2022-10-19 18:13:11,916][0m Trial 17 finished with value: 0.08553430843786972 and parameters: {'compnb_alpha': 0.6000000000000001, 'compnb_fit_prior': True, 'compnb_norm': True}. Best is trial 23 with value: 0.0855343.[0m
[32m[I 2022-10-19 18:13:14,336][0m Trial 25 finished with value: 0.08553430843786972 and parameters: {'compnb_alpha': 0.8500000000000001, 'compnb_fit_prior': True, 'compnb_norm': True}. Best is trial 30 with value: 0.0855343.[0m
[32m[I 2022-10-19 18:13:14,426][0m Trial 30 finished with value: 0.08553430843786972 and parameters: {'compnb_alpha': 0.8500000000000001, 'compnb_fit_prior': True, 'compnb_norm': True}. Best is trial 31 with value: 0.0855343.[0m
[32m[I 2022-10-19 18:13:14,430][0m Trial 27 finished with value: 0.08553430843786972 and parameters: {'compnb_alpha': 1.0, 'compnb_fit_prior': True, 'compnb_norm': True}. Best is trial 31 with value: 0.0855343.[0m
[32m[I 2022-10-19 18:13:14,583][0m Trial 26 finished with value: 0.08553430843786972 and parameters: {'compnb_alpha': 0.8500000000000001, 'compnb_fit_prior': True, 'compnb_norm': True}. Best is trial 31 with value: 0.0855343.[0m
[32m[I 2022-10-19 18:13:14,583][0m Trial 24 finished with value: 0.08553430843786972 and parameters: {'compnb_alpha': 0.9, 'compnb_fit_prior': True, 'compnb_norm': True}. Best is trial 31 with value: 0.0855343.[0m
[32m[I 2022-10-19 18:13:14,583][0m Trial 28 finished with value: 0.08553430843786972 and parameters: {'compnb_alpha': 0.8500000000000001, 'compnb_fit_prior': True, 'compnb_norm': True}. Best is trial 31 with value: 0.0855343.[0m
[32m[I 2022-10-19 18:13:14,592][0m Trial 29 finished with value: 0.08553430843786972 and parameters: {'compnb_alpha': 0.8500000000000001, 'compnb_fit_prior': True, 'compnb_norm': True}. Best is trial 31 with value: 0.0855343.[0m
[32m[I 2022-10-19 18:13:14,664][0m Trial 31 finished with value: 0.08553430843786972 and parameters: {'compnb_alpha': 0.8500000000000001, 'compnb_fit_prior': True, 'compnb_norm': True}. Best is trial 31 with value: 0.0855343.[0m
[32m[I 2022-10-19 18:13:16,073][0m Trial 33 finished with value: 0.08553430843786972 and parameters: {'compnb_alpha': 1.0, 'compnb_fit_prior': True, 'compnb_norm': True}. Best is trial 33 with value: 0.0855343.[0m
[32m[I 2022-10-19 18:13:16,073][0m Trial 32 finished with value: 0.08553430843786972 and parameters: {'compnb_alpha': 1.0, 'compnb_fit_prior': True, 'compnb_norm': True}. Best is trial 33 with value: 0.0855343.[0m
[32m[I 2022-10-19 18:13:16,217][0m EarlyStopping exceeded for ComplementNB; no new best scores on iters 20.[0m
[32m[I 2022-10-19 18:13:16,217][0m Study finished.[0m
[32m[I 2022-10-19 18:13:16,223][0m --------------------------------------------------------------------------------[0m
[32m[I 2022-10-19 18:13:16,224][0m --------------------         DecisionTreeClassifier         --------------------[0m
[32m[I 2022-10-19 18:13:16,224][0m --------------------------------------------------------------------------------[0m
[32m[I 2022-10-19 18:13:16,250][0m A new study created in RDB with name: DecisionTreeClassifier_e448dfef[0m
[32m[I 2022-10-19 18:13:16,257][0m Study started.[0m
[32m[I 2022-10-19 18:13:17,900][0m Trial 1 finished with value: 0.6950742018218817 and parameters: {'dtc_criterion': 'entropy', 'dtc_splitter': 'random', 'dtc_min_samples_split': 14, 'dtc_min_samples_leaf': 7, 'dtc_max_features': 2}. Best is trial 1 with value: 0.695074.[0m
[32m[I 2022-10-19 18:13:18,057][0m Trial 0 finished with value: 0.6950742018218817 and parameters: {'dtc_criterion': 'gini', 'dtc_splitter': 'random', 'dtc_min_samples_split': 20, 'dtc_min_samples_leaf': 23, 'dtc_max_features': 2}. Best is trial 0 with value: 0.695074.[0m
[32m[I 2022-10-19 18:13:18,063][0m Trial 7 finished with value: 0.6950742018218817 and parameters: {'dtc_criterion': 'gini', 'dtc_splitter': 'random', 'dtc_min_samples_split': 29, 'dtc_min_samples_leaf': 43, 'dtc_max_features': 2}. Best is trial 0 with value: 0.695074.[0m
[32m[I 2022-10-19 18:13:18,247][0m Trial 5 finished with value: 0.6950742018218817 and parameters: {'dtc_criterion': 'gini', 'dtc_splitter': 'random', 'dtc_min_samples_split': 13, 'dtc_min_samples_leaf': 37, 'dtc_max_features': 2}. Best is trial 0 with value: 0.695074.[0m
[32m[I 2022-10-19 18:13:18,332][0m Trial 6 finished with value: 0.6950742018218817 and parameters: {'dtc_criterion': 'gini', 'dtc_splitter': 'random', 'dtc_min_samples_split': 20, 'dtc_min_samples_leaf': 44, 'dtc_max_features': 4}. Best is trial 0 with value: 0.695074.[0m
[32m[I 2022-10-19 18:13:19,467][0m Trial 4 finished with value: 0.9645884495186425 and parameters: {'dtc_criterion': 'gini', 'dtc_splitter': 'best', 'dtc_min_samples_split': 49, 'dtc_min_samples_leaf': 26, 'dtc_max_features': 1}. Best is trial 4 with value: 0.964588.[0m
[32m[I 2022-10-19 18:13:19,712][0m Trial 3 finished with value: 0.9998435010870693 and parameters: {'dtc_criterion': 'entropy', 'dtc_splitter': 'best', 'dtc_min_samples_split': 39, 'dtc_min_samples_leaf': 4, 'dtc_max_features': 4}. Best is trial 3 with value: 0.999843.[0m
[32m[I 2022-10-19 18:13:20,128][0m Trial 12 finished with value: 0.6950742018218817 and parameters: {'dtc_criterion': 'entropy', 'dtc_splitter': 'random', 'dtc_min_samples_split': 43, 'dtc_min_samples_leaf': 31, 'dtc_max_features': 3}. Best is trial 3 with value: 0.999843.[0m
[32m[I 2022-10-19 18:13:20,780][0m Trial 2 finished with value: 0.9998955730561615 and parameters: {'dtc_criterion': 'gini', 'dtc_splitter': 'best', 'dtc_min_samples_split': 17, 'dtc_min_samples_leaf': 1, 'dtc_max_features': 7}. Best is trial 2 with value: 0.999896.[0m
[32m[I 2022-10-19 18:13:21,176][0m Trial 11 finished with value: 0.9290665246276727 and parameters: {'dtc_criterion': 'entropy', 'dtc_splitter': 'random', 'dtc_min_samples_split': 31, 'dtc_min_samples_leaf': 35, 'dtc_max_features': 6}. Best is trial 2 with value: 0.999896.[0m
[32m[I 2022-10-19 18:13:21,814][0m Trial 9 finished with value: 0.9983828436931076 and parameters: {'dtc_criterion': 'entropy', 'dtc_splitter': 'best', 'dtc_min_samples_split': 32, 'dtc_min_samples_leaf': 10, 'dtc_max_features': 4}. Best is trial 2 with value: 0.999896.[0m
[32m[I 2022-10-19 18:13:22,109][0m Trial 8 finished with value: 0.9992572404150015 and parameters: {'dtc_criterion': 'entropy', 'dtc_splitter': 'best', 'dtc_min_samples_split': 14, 'dtc_min_samples_leaf': 48, 'dtc_max_features': 5}. Best is trial 2 with value: 0.999896.[0m
