[32m[I 2022-10-20 05:03:44,035][0m Trial 27 finished with value: 0.6953961406851846 and parameters: {'qda_reg_param': 0.15000000000000002, 'qda_tol': 2.3874026319998456e-05}. Best is trial 20 with value: 0.706458.[0m
[32m[I 2022-10-20 05:03:44,185][0m Trial 28 finished with value: 0.11573887834229303 and parameters: {'qda_reg_param': 0.0, 'qda_tol': 2.5627032155539313e-05}. Best is trial 20 with value: 0.706458.[0m
[32m[I 2022-10-20 05:03:45,991][0m Trial 32 finished with value: 0.690404344900762 and parameters: {'qda_reg_param': 0.30000000000000004, 'qda_tol': 2.978135089673248e-06}. Best is trial 20 with value: 0.706458.[0m
[32m[I 2022-10-20 05:03:46,099][0m Trial 33 finished with value: 0.690404344900762 and parameters: {'qda_reg_param': 0.30000000000000004, 'qda_tol': 3.0726327908688573e-06}. Best is trial 20 with value: 0.706458.[0m
[32m[I 2022-10-20 05:03:46,179][0m EarlyStopping exceeded for QuadraticDiscriminantAnalysis; no new best scores on iters 20.[0m
[32m[I 2022-10-20 05:03:46,180][0m Study finished.[0m
[32m[I 2022-10-20 05:03:46,185][0m --------------------------------------------------------------------------------[0m
[32m[I 2022-10-20 05:03:46,186][0m --------------------         RandomForestClassifier         --------------------[0m
[32m[I 2022-10-20 05:03:46,187][0m --------------------------------------------------------------------------------[0m
[32m[I 2022-10-20 05:03:46,213][0m A new study created in RDB with name: RandomForestClassifier_e448dfef[0m
[32m[I 2022-10-20 05:03:46,219][0m Study started.[0m
[32m[I 2022-10-20 05:03:46,434][0m sklearn.ensemble.RandomForestClassifier.fit: running accelerated version on CPU[0m
[32m[I 2022-10-20 05:03:46,448][0m sklearn.ensemble.RandomForestClassifier.fit: fallback to original Scikit-learn[0m
[32m[I 2022-10-20 05:03:46,473][0m sklearn.ensemble.RandomForestClassifier.fit: fallback to original Scikit-learn[0m
[32m[I 2022-10-20 05:03:46,510][0m sklearn.ensemble.RandomForestClassifier.fit: running accelerated version on CPU[0m
[32m[I 2022-10-20 05:03:46,522][0m sklearn.ensemble.RandomForestClassifier.fit: running accelerated version on CPU[0m
[32m[I 2022-10-20 05:03:46,534][0m sklearn.ensemble.RandomForestClassifier.fit: fallback to original Scikit-learn[0m
[32m[I 2022-10-20 05:03:46,573][0m sklearn.ensemble.RandomForestClassifier.fit: running accelerated version on CPU[0m
[32m[I 2022-10-20 05:03:46,683][0m sklearn.ensemble.RandomForestClassifier.fit: running accelerated version on CPU[0m
[32m[I 2022-10-20 05:04:03,633][0m sklearn.ensemble.RandomForestClassifier.predict: running accelerated version on CPU[0m
[32m[I 2022-10-20 05:04:03,939][0m sklearn.ensemble.RandomForestClassifier.predict: running accelerated version on CPU[0m
[32m[I 2022-10-20 05:04:05,648][0m Trial 5 finished with value: 0.9939818755455918 and parameters: {'rfc_criterion': 'gini', 'rfc_n_estimators': 10, 'rfc_min_samples_split': 22, 'rfc_min_samples_leaf': 14, 'rfc_max_features': 6, 'rfc_bootstrap': False}. Best is trial 5 with value: 0.993982.[0m
[32m[I 2022-10-20 05:04:06,288][0m sklearn.ensemble.RandomForestClassifier.fit: fallback to original Scikit-learn[0m
[32m[I 2022-10-20 05:04:07,532][0m Trial 0 finished with value: 0.9968125230169586 and parameters: {'rfc_criterion': 'gini', 'rfc_n_estimators': 50, 'rfc_min_samples_split': 25, 'rfc_min_samples_leaf': 7, 'rfc_max_features': 4, 'rfc_bootstrap': False}. Best is trial 0 with value: 0.996813.[0m
[32m[I 2022-10-20 05:04:08,040][0m sklearn.ensemble.RandomForestClassifier.fit: running accelerated version on CPU[0m
[32m[I 2022-10-20 05:04:27,123][0m sklearn.ensemble.RandomForestClassifier.predict: running accelerated version on CPU[0m
[32m[I 2022-10-20 05:04:29,891][0m Trial 6 finished with value: 0.9939298022241838 and parameters: {'rfc_criterion': 'gini', 'rfc_n_estimators': 40, 'rfc_min_samples_split': 45, 'rfc_min_samples_leaf': 2, 'rfc_max_features': 7, 'rfc_bootstrap': True}. Best is trial 0 with value: 0.996813.[0m
[32m[I 2022-10-20 05:04:30,467][0m sklearn.ensemble.RandomForestClassifier.fit: fallback to original Scikit-learn[0m
[32m[I 2022-10-20 05:04:35,792][0m sklearn.ensemble.RandomForestClassifier.predict: running accelerated version on CPU[0m
[32m[I 2022-10-20 05:04:36,068][0m sklearn.ensemble.RandomForestClassifier.predict: running accelerated version on CPU[0m
[32m[I 2022-10-20 05:04:37,874][0m Trial 9 finished with value: 0.9937015047844923 and parameters: {'rfc_criterion': 'gini', 'rfc_n_estimators': 20, 'rfc_min_samples_split': 32, 'rfc_min_samples_leaf': 8, 'rfc_max_features': 7, 'rfc_bootstrap': False}. Best is trial 0 with value: 0.996813.[0m
[32m[I 2022-10-20 05:04:38,309][0m sklearn.ensemble.RandomForestClassifier.fit: fallback to original Scikit-learn[0m
[32m[I 2022-10-20 05:04:40,075][0m Trial 4 finished with value: 0.9970676503812966 and parameters: {'rfc_criterion': 'gini', 'rfc_n_estimators': 160, 'rfc_min_samples_split': 26, 'rfc_min_samples_leaf': 35, 'rfc_max_features': 1, 'rfc_bootstrap': False}. Best is trial 4 with value: 0.997068.[0m
[32m[I 2022-10-20 05:04:40,490][0m sklearn.ensemble.RandomForestClassifier.fit: fallback to original Scikit-learn[0m
[32m[I 2022-10-20 05:04:54,472][0m sklearn.ensemble.RandomForestClassifier.predict: running accelerated version on CPU[0m
[32m[I 2022-10-20 05:04:56,311][0m Trial 7 finished with value: 0.9974070057011416 and parameters: {'rfc_criterion': 'gini', 'rfc_n_estimators': 200, 'rfc_min_samples_split': 15, 'rfc_min_samples_leaf': 14, 'rfc_max_features': 2, 'rfc_bootstrap': True}. Best is trial 7 with value: 0.997407.[0m
[32m[I 2022-10-20 05:04:56,512][0m sklearn.ensemble.RandomForestClassifier.fit: fallback to original Scikit-learn[0m
[32m[I 2022-10-20 05:05:02,202][0m sklearn.ensemble.RandomForestClassifier.predict: fallback to original Scikit-learn[0m
[32m[I 2022-10-20 05:05:02,203][0m sklearn.ensemble.RandomForestClassifier.predict_proba: fallback to original Scikit-learn[0m
[32m[I 2022-10-20 05:05:04,118][0m Trial 2 finished with value: 0.9996272168614109 and parameters: {'rfc_criterion': 'entropy', 'rfc_n_estimators': 20, 'rfc_min_samples_split': 17, 'rfc_min_samples_leaf': 48, 'rfc_max_features': 4, 'rfc_bootstrap': False}. Best is trial 2 with value: 0.999627.[0m
[32m[I 2022-10-20 05:05:04,304][0m sklearn.ensemble.RandomForestClassifier.fit: fallback to original Scikit-learn[0m
[32m[I 2022-10-20 05:06:38,962][0m sklearn.ensemble.RandomForestClassifier.predict: fallback to original Scikit-learn[0m
[32m[I 2022-10-20 05:06:38,963][0m sklearn.ensemble.RandomForestClassifier.predict_proba: fallback to original Scikit-learn[0m
[32m[I 2022-10-20 05:06:42,307][0m Trial 11 finished with value: 0.999955249536547 and parameters: {'rfc_criterion': 'entropy', 'rfc_n_estimators': 60, 'rfc_min_samples_split': 39, 'rfc_min_samples_leaf': 1, 'rfc_max_features': 4, 'rfc_bootstrap': False}. Best is trial 11 with value: 0.999955.[0m
[32m[I 2022-10-20 05:06:42,491][0m sklearn.ensemble.RandomForestClassifier.fit: running accelerated version on CPU[0m
[32m[I 2022-10-20 05:06:46,133][0m sklearn.ensemble.RandomForestClassifier.predict: fallback to original Scikit-learn[0m
[32m[I 2022-10-20 05:06:46,157][0m sklearn.ensemble.RandomForestClassifier.predict_proba: fallback to original Scikit-learn[0m
[32m[I 2022-10-20 05:06:48,291][0m sklearn.ensemble.RandomForestClassifier.predict: running accelerated version on CPU[0m
[32m[I 2022-10-20 05:06:49,575][0m Trial 15 finished with value: 0.9938474010775361 and parameters: {'rfc_criterion': 'gini', 'rfc_n_estimators': 20, 'rfc_min_samples_split': 10, 'rfc_min_samples_leaf': 20, 'rfc_max_features': 7, 'rfc_bootstrap': True}. Best is trial 11 with value: 0.999955.[0m
[32m[I 2022-10-20 05:06:49,786][0m sklearn.ensemble.RandomForestClassifier.fit: fallback to original Scikit-learn[0m
[32m[I 2022-10-20 05:06:50,939][0m Trial 1 finished with value: 0.9996100258342946 and parameters: {'rfc_criterion': 'entropy', 'rfc_n_estimators': 80, 'rfc_min_samples_split': 43, 'rfc_min_samples_leaf': 41, 'rfc_max_features': 6, 'rfc_bootstrap': True}. Best is trial 11 with value: 0.999955.[0m
[32m[I 2022-10-20 05:06:51,135][0m sklearn.ensemble.RandomForestClassifier.fit: fallback to original Scikit-learn[0m
[32m[I 2022-10-20 05:07:46,569][0m sklearn.ensemble.RandomForestClassifier.predict: fallback to original Scikit-learn[0m
[32m[I 2022-10-20 05:07:46,570][0m sklearn.ensemble.RandomForestClassifier.predict_proba: fallback to original Scikit-learn[0m
[32m[I 2022-10-20 05:07:50,435][0m Trial 16 finished with value: 0.9972605442476462 and parameters: {'rfc_criterion': 'entropy', 'rfc_n_estimators': 80, 'rfc_min_samples_split': 24, 'rfc_min_samples_leaf': 47, 'rfc_max_features': 1, 'rfc_bootstrap': True}. Best is trial 11 with value: 0.999955.[0m
[32m[I 2022-10-20 05:07:50,637][0m sklearn.ensemble.RandomForestClassifier.fit: fallback to original Scikit-learn[0m
[32m[I 2022-10-20 05:08:03,070][0m sklearn.ensemble.RandomForestClassifier.predict: fallback to original Scikit-learn[0m
[32m[I 2022-10-20 05:08:03,070][0m sklearn.ensemble.RandomForestClassifier.predict_proba: fallback to original Scikit-learn[0m
[32m[I 2022-10-20 05:08:03,972][0m sklearn.ensemble.RandomForestClassifier.predict: fallback to original Scikit-learn[0m
[32m[I 2022-10-20 05:08:03,973][0m sklearn.ensemble.RandomForestClassifier.predict_proba: fallback to original Scikit-learn[0m
[32m[I 2022-10-20 05:08:07,709][0m Trial 13 finished with value: 0.9997739566290628 and parameters: {'rfc_criterion': 'entropy', 'rfc_n_estimators': 90, 'rfc_min_samples_split': 10, 'rfc_min_samples_leaf': 33, 'rfc_max_features': 5, 'rfc_bootstrap': False}. Best is trial 11 with value: 0.999955.[0m
[32m[I 2022-10-20 05:08:07,937][0m sklearn.ensemble.RandomForestClassifier.fit: fallback to original Scikit-learn[0m
[32m[I 2022-10-20 05:08:11,015][0m Trial 3 finished with value: 0.999659558426023 and parameters: {'rfc_criterion': 'entropy', 'rfc_n_estimators': 150, 'rfc_min_samples_split': 46, 'rfc_min_samples_leaf': 41, 'rfc_max_features': 4, 'rfc_bootstrap': True}. Best is trial 11 with value: 0.999955.[0m
[32m[I 2022-10-20 05:08:11,185][0m sklearn.ensemble.RandomForestClassifier.fit: fallback to original Scikit-learn[0m
[32m[I 2022-10-20 05:09:06,520][0m sklearn.ensemble.RandomForestClassifier.predict: fallback to original Scikit-learn[0m
[32m[I 2022-10-20 05:09:06,521][0m sklearn.ensemble.RandomForestClassifier.predict_proba: fallback to original Scikit-learn[0m
[32m[I 2022-10-20 05:09:12,797][0m Trial 10 finished with value: 0.9995578734410422 and parameters: {'rfc_criterion': 'entropy', 'rfc_n_estimators': 150, 'rfc_min_samples_split': 43, 'rfc_min_samples_leaf': 45, 'rfc_max_features': 6, 'rfc_bootstrap': True}. Best is trial 11 with value: 0.999955.[0m
[32m[I 2022-10-20 05:09:12,964][0m sklearn.ensemble.RandomForestClassifier.fit: fallback to original Scikit-learn[0m
[32m[I 2022-10-20 05:09:27,156][0m sklearn.ensemble.RandomForestClassifier.predict: fallback to original Scikit-learn[0m
[32m[I 2022-10-20 05:09:27,157][0m sklearn.ensemble.RandomForestClassifier.predict_proba: fallback to original Scikit-learn[0m
[32m[I 2022-10-20 05:09:33,811][0m Trial 8 finished with value: 0.9998832571369705 and parameters: {'rfc_criterion': 'entropy', 'rfc_n_estimators': 160, 'rfc_min_samples_split': 47, 'rfc_min_samples_leaf': 10, 'rfc_max_features': 4, 'rfc_bootstrap': False}. Best is trial 11 with value: 0.999955.[0m
[32m[I 2022-10-20 05:09:33,982][0m sklearn.ensemble.RandomForestClassifier.fit: fallback to original Scikit-learn[0m
[32m[I 2022-10-20 05:09:37,044][0m sklearn.ensemble.RandomForestClassifier.predict: fallback to original Scikit-learn[0m
[32m[I 2022-10-20 05:09:37,045][0m sklearn.ensemble.RandomForestClassifier.predict_proba: fallback to original Scikit-learn[0m
[32m[I 2022-10-20 05:09:43,389][0m Trial 12 finished with value: 0.9998758283647742 and parameters: {'rfc_criterion': 'entropy', 'rfc_n_estimators': 150, 'rfc_min_samples_split': 20, 'rfc_min_samples_leaf': 8, 'rfc_max_features': 7, 'rfc_bootstrap': True}. Best is trial 11 with value: 0.999955.[0m
[32m[I 2022-10-20 05:09:43,590][0m sklearn.ensemble.RandomForestClassifier.fit: fallback to original Scikit-learn[0m
[32m[I 2022-10-20 05:10:00,609][0m sklearn.ensemble.RandomForestClassifier.predict: fallback to original Scikit-learn[0m
[32m[I 2022-10-20 05:10:00,610][0m sklearn.ensemble.RandomForestClassifier.predict_proba: fallback to original Scikit-learn[0m
[32m[I 2022-10-20 05:10:06,235][0m Trial 17 finished with value: 0.9997341724757605 and parameters: {'rfc_criterion': 'entropy', 'rfc_n_estimators': 120, 'rfc_min_samples_split': 37, 'rfc_min_samples_leaf': 29, 'rfc_max_features': 3, 'rfc_bootstrap': False}. Best is trial 11 with value: 0.999955.[0m
[32m[I 2022-10-20 05:10:12,071][0m sklearn.ensemble.RandomForestClassifier.predict: fallback to original Scikit-learn[0m
[32m[I 2022-10-20 05:10:12,072][0m sklearn.ensemble.RandomForestClassifier.predict_proba: fallback to original Scikit-learn[0m
[32m[I 2022-10-20 05:10:18,259][0m Trial 14 finished with value: 0.999937877351133 and parameters: {'rfc_criterion': 'entropy', 'rfc_n_estimators': 150, 'rfc_min_samples_split': 47, 'rfc_min_samples_leaf': 1, 'rfc_max_features': 5, 'rfc_bootstrap': False}. Best is trial 11 with value: 0.999955.[0m
[32m[I 2022-10-20 05:11:10,363][0m sklearn.ensemble.RandomForestClassifier.predict: fallback to original Scikit-learn[0m
[32m[I 2022-10-20 05:11:10,364][0m sklearn.ensemble.RandomForestClassifier.predict_proba: fallback to original Scikit-learn[0m
[32m[I 2022-10-20 05:11:15,358][0m Trial 18 finished with value: 0.9997764593448778 and parameters: {'rfc_criterion': 'entropy', 'rfc_n_estimators': 120, 'rfc_min_samples_split': 36, 'rfc_min_samples_leaf': 31, 'rfc_max_features': 4, 'rfc_bootstrap': False}. Best is trial 11 with value: 0.999955.[0m
[32m[I 2022-10-20 05:11:16,012][0m sklearn.ensemble.RandomForestClassifier.predict: fallback to original Scikit-learn[0m
[32m[I 2022-10-20 05:11:16,012][0m sklearn.ensemble.RandomForestClassifier.predict_proba: fallback to original Scikit-learn[0m
[32m[I 2022-10-20 05:11:21,181][0m Trial 19 finished with value: 0.9997341724757605 and parameters: {'rfc_criterion': 'entropy', 'rfc_n_estimators': 130, 'rfc_min_samples_split': 2, 'rfc_min_samples_leaf': 29, 'rfc_max_features': 3, 'rfc_bootstrap': False}. Best is trial 11 with value: 0.999955.[0m
[32m[I 2022-10-20 05:11:41,268][0m sklearn.ensemble.RandomForestClassifier.predict: fallback to original Scikit-learn[0m
[32m[I 2022-10-20 05:11:41,268][0m sklearn.ensemble.RandomForestClassifier.predict_proba: fallback to original Scikit-learn[0m
[32m[I 2022-10-20 05:11:43,099][0m sklearn.ensemble.RandomForestClassifier.predict: fallback to original Scikit-learn[0m
[32m[I 2022-10-20 05:11:43,100][0m sklearn.ensemble.RandomForestClassifier.predict_proba: fallback to original Scikit-learn[0m
[32m[I 2022-10-20 05:11:45,643][0m Trial 21 finished with value: 0.9997565370437316 and parameters: {'rfc_criterion': 'entropy', 'rfc_n_estimators': 110, 'rfc_min_samples_split': 3, 'rfc_min_samples_leaf': 31, 'rfc_max_features': 3, 'rfc_bootstrap': False}. Best is trial 11 with value: 0.999955.[0m
[32m[I 2022-10-20 05:11:47,738][0m Trial 20 finished with value: 0.9998187125487028 and parameters: {'rfc_criterion': 'entropy', 'rfc_n_estimators': 120, 'rfc_min_samples_split': 2, 'rfc_min_samples_leaf': 28, 'rfc_max_features': 5, 'rfc_bootstrap': False}. Best is trial 11 with value: 0.999955.[0m
[32m[I 2022-10-20 05:12:06,065][0m sklearn.ensemble.RandomForestClassifier.predict: fallback to original Scikit-learn[0m
[32m[I 2022-10-20 05:12:06,066][0m sklearn.ensemble.RandomForestClassifier.predict_proba: fallback to original Scikit-learn[0m
[32m[I 2022-10-20 05:12:10,312][0m Trial 22 finished with value: 0.9999477890655383 and parameters: {'rfc_criterion': 'entropy', 'rfc_n_estimators': 120, 'rfc_min_samples_split': 34, 'rfc_min_samples_leaf': 1, 'rfc_max_features': 3, 'rfc_bootstrap': False}. Best is trial 11 with value: 0.999955.[0m
[32m[I 2022-10-20 05:12:11,641][0m sklearn.ensemble.RandomForestClassifier.predict: fallback to original Scikit-learn[0m
[32m[I 2022-10-20 05:12:11,641][0m sklearn.ensemble.RandomForestClassifier.predict_proba: fallback to original Scikit-learn[0m
[32m[I 2022-10-20 05:12:15,647][0m Trial 23 finished with value: 0.9999453028979421 and parameters: {'rfc_criterion': 'entropy', 'rfc_n_estimators': 120, 'rfc_min_samples_split': 35, 'rfc_min_samples_leaf': 1, 'rfc_max_features': 3, 'rfc_bootstrap': False}. Best is trial 11 with value: 0.999955.[0m
[32m[I 2022-10-20 05:12:15,747][0m EarlyStopping exceeded for RandomForestClassifier; no new best scores on iters 20.[0m
[32m[I 2022-10-20 05:12:15,747][0m Study finished.[0m
[32m[I 2022-10-20 05:12:15,753][0m --------------------------------------------------------------------------------[0m
[32m[I 2022-10-20 05:12:15,754][0m --------------------            RidgeClassifier             --------------------[0m
[32m[I 2022-10-20 05:12:15,754][0m --------------------------------------------------------------------------------[0m
[32m[I 2022-10-20 05:12:15,782][0m A new study created in RDB with name: RidgeClassifier_e448dfef[0m
[32m[I 2022-10-20 05:12:15,788][0m Study started.[0m
[32m[I 2022-10-20 05:12:19,218][0m Trial 1 finished with value: 0.6848996760022037 and parameters: {'rc_C': 206849.78837490638, 'rc_tol': 0.0010654519263673375}. Best is trial 1 with value: 0.6849.[0m
[32m[I 2022-10-20 05:12:19,296][0m Trial 3 finished with value: 0.6848996760022037 and parameters: {'rc_C': 9.258061326015364, 'rc_tol': 0.00022621690214892694}. Best is trial 1 with value: 0.6849.[0m
[32m[I 2022-10-20 05:12:19,398][0m Trial 0 finished with value: 0.6848996760022037 and parameters: {'rc_C': 0.5591585229623137, 'rc_tol': 0.007640072847789171}. Best is trial 0 with value: 0.6849.[0m
[32m[I 2022-10-20 05:12:19,402][0m Trial 2 finished with value: 0.6848996760022037 and parameters: {'rc_C': 0.00036343729967714484, 'rc_tol': 0.00030482294489206363}. Best is trial 0 with value: 0.6849.[0m
[32m[I 2022-10-20 05:12:19,489][0m Trial 6 finished with value: 0.6848996760022037 and parameters: {'rc_C': 0.014687900827877303, 'rc_tol': 0.006098314511449332}. Best is trial 0 with value: 0.6849.[0m
[32m[I 2022-10-20 05:12:19,568][0m Trial 4 finished with value: 0.6848996760022037 and parameters: {'rc_C': 1.1449574815150896, 'rc_tol': 0.0013814844081094294}. Best is trial 0 with value: 0.6849.[0m
[32m[I 2022-10-20 05:12:19,645][0m Trial 5 finished with value: 0.6848996760022037 and parameters: {'rc_C': 1032.5869809848173, 'rc_tol': 0.0007181602989820358}. Best is trial 0 with value: 0.6849.[0m
[32m[I 2022-10-20 05:12:19,761][0m Trial 7 finished with value: 0.6848996760022037 and parameters: {'rc_C': 5.256991936564444, 'rc_tol': 0.005199725372788469}. Best is trial 0 with value: 0.6849.[0m
[32m[I 2022-10-20 05:12:23,323][0m Trial 12 finished with value: 0.6848996760022037 and parameters: {'rc_C': 2.9217473298480715e-05, 'rc_tol': 0.0016661000222808046}. Best is trial 0 with value: 0.6849.[0m
[32m[I 2022-10-20 05:12:23,326][0m Trial 10 finished with value: 0.6848996760022037 and parameters: {'rc_C': 0.00019892369009383873, 'rc_tol': 0.001684030949856694}. Best is trial 0 with value: 0.6849.[0m
[32m[I 2022-10-20 05:12:23,327][0m Trial 15 finished with value: 0.6848996760022037 and parameters: {'rc_C': 0.02354604064737929, 'rc_tol': 0.008152975525967972}. Best is trial 0 with value: 0.6849.[0m
[32m[I 2022-10-20 05:12:23,477][0m Trial 11 finished with value: 0.6848996760022037 and parameters: {'rc_C': 1167.2050784672294, 'rc_tol': 0.0001931132693441307}. Best is trial 0 with value: 0.6849.[0m
[32m[I 2022-10-20 05:12:23,652][0m Trial 8 finished with value: 0.6848996760022037 and parameters: {'rc_C': 557117.497925203, 'rc_tol': 0.0008962037606643277}. Best is trial 0 with value: 0.6849.[0m
[32m[I 2022-10-20 05:12:23,653][0m Trial 14 finished with value: 0.6848996760022037 and parameters: {'rc_C': 0.362815088840604, 'rc_tol': 0.00012701662219927908}. Best is trial 0 with value: 0.6849.[0m
[32m[I 2022-10-20 05:12:23,769][0m Trial 13 finished with value: 0.6848996760022037 and parameters: {'rc_C': 46525.19486830763, 'rc_tol': 0.0009248042441018012}. Best is trial 0 with value: 0.6849.[0m
[32m[I 2022-10-20 05:12:23,928][0m Trial 9 finished with value: 0.6848996760022037 and parameters: {'rc_C': 34245.271787092635, 'rc_tol': 0.006125431435265365}. Best is trial 0 with value: 0.6849.[0m
[32m[I 2022-10-20 05:12:27,388][0m Trial 20 finished with value: 0.6848996760022037 and parameters: {'rc_C': 123.42214057520549, 'rc_tol': 0.0030597303069077684}. Best is trial 0 with value: 0.6849.[0m
[32m[I 2022-10-20 05:12:27,490][0m Trial 23 finished with value: 0.6848996760022037 and parameters: {'rc_C': 157.68500609142308, 'rc_tol': 0.003095980937351836}. Best is trial 0 with value: 0.6849.[0m
[32m[I 2022-10-20 05:12:27,582][0m Trial 18 finished with value: 0.6848996760022037 and parameters: {'rc_C': 203.42815649902258, 'rc_tol': 0.0031049675463602254}. Best is trial 0 with value: 0.6849.[0m
[32m[I 2022-10-20 05:12:27,584][0m Trial 19 finished with value: 0.6848996760022037 and parameters: {'rc_C': 145.56229235511748, 'rc_tol': 0.003169789053771328}. Best is trial 0 with value: 0.6849.[0m
[32m[I 2022-10-20 05:12:27,588][0m Trial 22 finished with value: 0.6848996760022037 and parameters: {'rc_C': 158.8019169344604, 'rc_tol': 0.002836651658646965}. Best is trial 0 with value: 0.6849.[0m
