[32m[I 2023-02-27 19:48:54,164][0m Trial 9 finished with value: 0.3782834802287911 and parameters: {'mlpc_hidden_layer_count': 1, 'mlpc_learning_rate': 'constant', 'mlpc_learning_rate_init': 0.07793493979457589, 'mplc_max_iter': 2000}. Best is trial 2 with value: 0.911963.[0m
[32m[I 2023-02-27 19:48:54,648][0m sklearn.model_selection.train_test_split: running accelerated version on CPU[0m
[32m[I 2023-02-27 19:48:54,820][0m sklearn.model_selection.train_test_split: fallback to original Scikit-learn[0m
[32m[I 2023-02-27 20:03:57,547][0m Trial 10 finished with value: 0.8543517827985283 and parameters: {'mlpc_hidden_layer_count': 3, 'mlpc_learning_rate': 'invscaling', 'mlpc_learning_rate_init': 1.6346311480015453e-06, 'mplc_max_iter': 2000}. Best is trial 2 with value: 0.911963.[0m
[32m[I 2023-02-27 20:03:57,609][0m Study finished.[0m
[32m[I 2023-02-27 20:03:57,625][0m --------------------------------------------------------------------------------[0m
[32m[I 2023-02-27 20:03:57,625][0m --------------------             MultinomialNB              --------------------[0m
[32m[I 2023-02-27 20:03:57,625][0m --------------------------------------------------------------------------------[0m
[32m[I 2023-02-27 20:03:57,656][0m A new study created in RDB with name: MultinomialNB_0a1486bb[0m
[32m[I 2023-02-27 20:03:57,672][0m Study started.[0m
[32m[I 2023-02-27 20:04:00,504][0m Trial 0 finished with value: 0.4371372856847349 and parameters: {'mnb_alpha': 0.15000000000000002, 'mnb_fit_prior': True}. Best is trial 0 with value: 0.437137.[0m
[32m[I 2023-02-27 20:04:03,364][0m Trial 1 finished with value: 0.432405628893918 and parameters: {'mnb_alpha': 0.9500000000000001, 'mnb_fit_prior': False}. Best is trial 0 with value: 0.437137.[0m
[32m[I 2023-02-27 20:04:06,194][0m Trial 2 finished with value: 0.4338825494221405 and parameters: {'mnb_alpha': 0.5, 'mnb_fit_prior': False}. Best is trial 0 with value: 0.437137.[0m
[32m[I 2023-02-27 20:04:09,023][0m Trial 3 finished with value: 0.43813793223283776 and parameters: {'mnb_alpha': 0.1, 'mnb_fit_prior': True}. Best is trial 3 with value: 0.438138.[0m
[32m[I 2023-02-27 20:04:11,855][0m Trial 4 finished with value: 0.4338825494221405 and parameters: {'mnb_alpha': 0.5, 'mnb_fit_prior': False}. Best is trial 3 with value: 0.438138.[0m
[32m[I 2023-02-27 20:04:14,690][0m Trial 5 finished with value: 0.4330562550748492 and parameters: {'mnb_alpha': 0.8, 'mnb_fit_prior': True}. Best is trial 3 with value: 0.438138.[0m
[32m[I 2023-02-27 20:04:17,538][0m Trial 6 finished with value: 0.43228081599376744 and parameters: {'mnb_alpha': 1.0, 'mnb_fit_prior': False}. Best is trial 3 with value: 0.438138.[0m
[32m[I 2023-02-27 20:04:20,382][0m Trial 7 finished with value: 0.4336048864377802 and parameters: {'mnb_alpha': 0.55, 'mnb_fit_prior': False}. Best is trial 3 with value: 0.438138.[0m
[32m[I 2023-02-27 20:04:23,211][0m Trial 8 finished with value: 0.43252476197451334 and parameters: {'mnb_alpha': 0.9, 'mnb_fit_prior': False}. Best is trial 3 with value: 0.438138.[0m
[32m[I 2023-02-27 20:04:26,046][0m Trial 9 finished with value: 0.436475712444929 and parameters: {'mnb_alpha': 0.2, 'mnb_fit_prior': True}. Best is trial 3 with value: 0.438138.[0m
[32m[I 2023-02-27 20:04:28,874][0m Trial 10 finished with value: 0.4592855963872168 and parameters: {'mnb_alpha': 0.0, 'mnb_fit_prior': True}. Best is trial 10 with value: 0.459286.[0m
[32m[I 2023-02-27 20:04:31,695][0m Trial 11 finished with value: 0.4592855963872168 and parameters: {'mnb_alpha': 0.0, 'mnb_fit_prior': True}. Best is trial 10 with value: 0.459286.[0m
[32m[I 2023-02-27 20:04:34,509][0m Trial 12 finished with value: 0.4592855963872168 and parameters: {'mnb_alpha': 0.0, 'mnb_fit_prior': True}. Best is trial 10 with value: 0.459286.[0m
[32m[I 2023-02-27 20:04:37,367][0m Trial 13 finished with value: 0.4354063555333748 and parameters: {'mnb_alpha': 0.30000000000000004, 'mnb_fit_prior': True}. Best is trial 10 with value: 0.459286.[0m
[32m[I 2023-02-27 20:04:40,211][0m Trial 14 finished with value: 0.4354063555333748 and parameters: {'mnb_alpha': 0.30000000000000004, 'mnb_fit_prior': True}. Best is trial 10 with value: 0.459286.[0m
[32m[I 2023-02-27 20:04:43,028][0m Trial 15 finished with value: 0.4592855963872168 and parameters: {'mnb_alpha': 0.0, 'mnb_fit_prior': True}. Best is trial 10 with value: 0.459286.[0m
[32m[I 2023-02-27 20:04:45,872][0m Trial 16 finished with value: 0.4351048280197406 and parameters: {'mnb_alpha': 0.35000000000000003, 'mnb_fit_prior': True}. Best is trial 10 with value: 0.459286.[0m
[32m[I 2023-02-27 20:04:48,700][0m Trial 17 finished with value: 0.4335189973504239 and parameters: {'mnb_alpha': 0.65, 'mnb_fit_prior': True}. Best is trial 10 with value: 0.459286.[0m
[32m[I 2023-02-27 20:04:51,560][0m Trial 18 finished with value: 0.4592855963872168 and parameters: {'mnb_alpha': 0.0, 'mnb_fit_prior': True}. Best is trial 10 with value: 0.459286.[0m
[32m[I 2023-02-27 20:04:54,406][0m Trial 19 finished with value: 0.436475712444929 and parameters: {'mnb_alpha': 0.2, 'mnb_fit_prior': True}. Best is trial 10 with value: 0.459286.[0m
[32m[I 2023-02-27 20:04:54,453][0m Study finished.[0m
[32m[I 2023-02-27 20:04:54,484][0m --------------------------------------------------------------------------------[0m
[32m[I 2023-02-27 20:04:54,484][0m --------------------      PassiveAggressiveClassifier       --------------------[0m
[32m[I 2023-02-27 20:04:54,500][0m --------------------------------------------------------------------------------[0m
[32m[I 2023-02-27 20:04:54,531][0m A new study created in RDB with name: PassiveAggressiveClassifier_0a1486bb[0m
[32m[I 2023-02-27 20:04:54,531][0m Study started.[0m
[32m[I 2023-02-27 20:05:52,474][0m Trial 0 finished with value: 0.764129512658306 and parameters: {'pac_C': 656.4936337953574, 'pac_early_stopping': True, 'pac_validation_fraction': 0.25, 'pac_n_iter_no_change': 10}. Best is trial 0 with value: 0.76413.[0m
[32m[I 2023-02-27 20:06:50,433][0m Trial 1 finished with value: 0.7641258171665267 and parameters: {'pac_C': 1.376166083062744e-05, 'pac_early_stopping': True, 'pac_validation_fraction': 0.25, 'pac_n_iter_no_change': 10}. Best is trial 0 with value: 0.76413.[0m
[32m[I 2023-02-27 20:07:48,274][0m Trial 2 finished with value: 0.764129512658306 and parameters: {'pac_C': 0.0007211028106335, 'pac_early_stopping': True, 'pac_validation_fraction': 0.25, 'pac_n_iter_no_change': 10}. Best is trial 0 with value: 0.76413.[0m
[32m[I 2023-02-27 20:08:45,488][0m Trial 3 finished with value: 0.764129512658306 and parameters: {'pac_C': 0.006047187835921674, 'pac_early_stopping': True, 'pac_validation_fraction': 0.25, 'pac_n_iter_no_change': 10}. Best is trial 0 with value: 0.76413.[0m
[32m[I 2023-02-27 20:09:43,567][0m Trial 4 finished with value: 0.7641026606837705 and parameters: {'pac_C': 1.1835049079528013e-05, 'pac_early_stopping': True, 'pac_validation_fraction': 0.25, 'pac_n_iter_no_change': 10}. Best is trial 0 with value: 0.76413.[0m
[32m[I 2023-02-27 20:10:41,565][0m Trial 5 finished with value: 0.764129512658306 and parameters: {'pac_C': 16.12192660063543, 'pac_early_stopping': True, 'pac_validation_fraction': 0.25, 'pac_n_iter_no_change': 10}. Best is trial 0 with value: 0.76413.[0m
[32m[I 2023-02-27 20:11:39,921][0m Trial 6 finished with value: 0.6239336202213716 and parameters: {'pac_C': 4.764401020922851e-06, 'pac_early_stopping': True, 'pac_validation_fraction': 0.25, 'pac_n_iter_no_change': 10}. Best is trial 0 with value: 0.76413.[0m
[32m[I 2023-02-27 20:12:36,274][0m Trial 7 finished with value: 0.764129512658306 and parameters: {'pac_C': 0.0013162351067164224, 'pac_early_stopping': True, 'pac_validation_fraction': 0.25, 'pac_n_iter_no_change': 10}. Best is trial 0 with value: 0.76413.[0m
[32m[I 2023-02-27 20:13:32,800][0m Trial 8 finished with value: 0.6370436623265926 and parameters: {'pac_C': 6.4368802441027485e-06, 'pac_early_stopping': True, 'pac_validation_fraction': 0.25, 'pac_n_iter_no_change': 10}. Best is trial 0 with value: 0.76413.[0m
[32m[I 2023-02-27 20:14:29,151][0m Trial 9 finished with value: 0.764129512658306 and parameters: {'pac_C': 6.914965900964709e-05, 'pac_early_stopping': True, 'pac_validation_fraction': 0.25, 'pac_n_iter_no_change': 10}. Best is trial 0 with value: 0.76413.[0m
[32m[I 2023-02-27 20:15:27,339][0m Trial 10 finished with value: 0.764129512658306 and parameters: {'pac_C': 808.3986142000946, 'pac_early_stopping': True, 'pac_validation_fraction': 0.25, 'pac_n_iter_no_change': 10}. Best is trial 0 with value: 0.76413.[0m
[32m[I 2023-02-27 20:16:25,395][0m Trial 11 finished with value: 0.764129512658306 and parameters: {'pac_C': 0.5499258093895469, 'pac_early_stopping': True, 'pac_validation_fraction': 0.25, 'pac_n_iter_no_change': 10}. Best is trial 0 with value: 0.76413.[0m
[32m[I 2023-02-27 20:17:23,388][0m Trial 12 finished with value: 0.764129512658306 and parameters: {'pac_C': 0.3208335011840196, 'pac_early_stopping': True, 'pac_validation_fraction': 0.25, 'pac_n_iter_no_change': 10}. Best is trial 0 with value: 0.76413.[0m
[32m[I 2023-02-27 20:18:21,328][0m Trial 13 finished with value: 0.764129512658306 and parameters: {'pac_C': 344.12086254860145, 'pac_early_stopping': True, 'pac_validation_fraction': 0.25, 'pac_n_iter_no_change': 10}. Best is trial 0 with value: 0.76413.[0m
[32m[I 2023-02-27 20:19:19,168][0m Trial 14 finished with value: 0.764129512658306 and parameters: {'pac_C': 0.00041327246921474156, 'pac_early_stopping': True, 'pac_validation_fraction': 0.25, 'pac_n_iter_no_change': 10}. Best is trial 0 with value: 0.76413.[0m
[32m[I 2023-02-27 20:20:17,064][0m Trial 15 finished with value: 0.764129512658306 and parameters: {'pac_C': 0.0707626466599921, 'pac_early_stopping': True, 'pac_validation_fraction': 0.25, 'pac_n_iter_no_change': 10}. Best is trial 0 with value: 0.76413.[0m
[32m[I 2023-02-27 20:21:15,013][0m Trial 16 finished with value: 0.764129512658306 and parameters: {'pac_C': 14.548937418246998, 'pac_early_stopping': True, 'pac_validation_fraction': 0.25, 'pac_n_iter_no_change': 10}. Best is trial 0 with value: 0.76413.[0m
[32m[I 2023-02-27 20:22:13,031][0m Trial 17 finished with value: 0.764129512658306 and parameters: {'pac_C': 0.00026776678431877313, 'pac_early_stopping': True, 'pac_validation_fraction': 0.25, 'pac_n_iter_no_change': 10}. Best is trial 0 with value: 0.76413.[0m
[32m[I 2023-02-27 20:23:10,790][0m Trial 18 finished with value: 0.764129512658306 and parameters: {'pac_C': 0.10431850520789558, 'pac_early_stopping': True, 'pac_validation_fraction': 0.25, 'pac_n_iter_no_change': 10}. Best is trial 0 with value: 0.76413.[0m
[32m[I 2023-02-27 20:24:08,759][0m Trial 19 finished with value: 0.764129512658306 and parameters: {'pac_C': 18.549223507073286, 'pac_early_stopping': True, 'pac_validation_fraction': 0.25, 'pac_n_iter_no_change': 10}. Best is trial 0 with value: 0.76413.[0m
[32m[I 2023-02-27 20:24:08,822][0m Study finished.[0m
[32m[I 2023-02-27 20:24:08,853][0m --------------------------------------------------------------------------------[0m
[32m[I 2023-02-27 20:24:08,853][0m --------------------               Perceptron               --------------------[0m
[32m[I 2023-02-27 20:24:08,853][0m --------------------------------------------------------------------------------[0m
[32m[I 2023-02-27 20:24:08,884][0m A new study created in RDB with name: Perceptron_0a1486bb[0m
[32m[I 2023-02-27 20:24:08,884][0m Study started.[0m
[32m[I 2023-02-27 20:25:11,265][0m Trial 0 finished with value: 0.23501345968426327 and parameters: {'p_penalty': 'elasticnet', 'p_alpha': 0.0016833829420937652, 'p_eta0': 0.5, 'p_early_stopping': True, 'p_validation_fraction': 0.25, 'p_n_iter_no_change': 10}. Best is trial 0 with value: 0.235013.[0m
[32m[I 2023-02-27 20:26:07,141][0m Trial 1 finished with value: 0.5505724521428791 and parameters: {'p_penalty': 'elasticnet', 'p_alpha': 0.018420400807337936, 'p_eta0': 0.5, 'p_early_stopping': True, 'p_validation_fraction': 0.25, 'p_n_iter_no_change': 10}. Best is trial 1 with value: 0.550572.[0m
[32m[I 2023-02-27 20:27:09,436][0m Trial 2 finished with value: 0.2305125348166823 and parameters: {'p_penalty': 'elasticnet', 'p_alpha': 0.0025690230521332705, 'p_eta0': 1.0, 'p_early_stopping': True, 'p_validation_fraction': 0.25, 'p_n_iter_no_change': 10}. Best is trial 1 with value: 0.550572.[0m
[32m[I 2023-02-27 20:28:09,918][0m Trial 3 finished with value: 0.192797279362015 and parameters: {'p_penalty': 'elasticnet', 'p_alpha': 7.160988127233408e-05, 'p_eta0': 0.5, 'p_early_stopping': True, 'p_validation_fraction': 0.25, 'p_n_iter_no_change': 10}. Best is trial 1 with value: 0.550572.[0m
[32m[I 2023-02-27 20:29:04,288][0m Trial 4 finished with value: 0.5849883541721306 and parameters: {'p_penalty': 'elasticnet', 'p_alpha': 4.0522177764463105e-05, 'p_eta0': 1.0, 'p_early_stopping': True, 'p_validation_fraction': 0.25, 'p_n_iter_no_change': 10}. Best is trial 4 with value: 0.584988.[0m
[32m[I 2023-02-27 20:30:02,531][0m Trial 5 finished with value: 0.36690995311046115 and parameters: {'p_penalty': 'elasticnet', 'p_alpha': 4.742135664449609e-06, 'p_eta0': 1.5, 'p_early_stopping': True, 'p_validation_fraction': 0.25, 'p_n_iter_no_change': 10}. Best is trial 4 with value: 0.584988.[0m
[32m[I 2023-02-27 20:31:01,862][0m Trial 6 finished with value: 0.1927744985413555 and parameters: {'p_penalty': 'elasticnet', 'p_alpha': 0.09932098912618638, 'p_eta0': 1.5, 'p_early_stopping': True, 'p_validation_fraction': 0.25, 'p_n_iter_no_change': 10}. Best is trial 4 with value: 0.584988.[0m
[32m[I 2023-02-27 20:32:00,097][0m Trial 7 finished with value: 0.6287137813349899 and parameters: {'p_penalty': 'elasticnet', 'p_alpha': 0.00016390563088721017, 'p_eta0': 1.5, 'p_early_stopping': True, 'p_validation_fraction': 0.25, 'p_n_iter_no_change': 10}. Best is trial 7 with value: 0.628714.[0m
[32m[I 2023-02-27 20:33:03,461][0m Trial 8 finished with value: 0.6234442730459334 and parameters: {'p_penalty': 'elasticnet', 'p_alpha': 0.0008231860633861466, 'p_eta0': 1.5, 'p_early_stopping': True, 'p_validation_fraction': 0.25, 'p_n_iter_no_change': 10}. Best is trial 7 with value: 0.628714.[0m
[32m[I 2023-02-27 20:33:57,874][0m Trial 9 finished with value: 0.5852401765938352 and parameters: {'p_penalty': 'elasticnet', 'p_alpha': 2.9672066390137647e-05, 'p_eta0': 2.0, 'p_early_stopping': True, 'p_validation_fraction': 0.25, 'p_n_iter_no_change': 10}. Best is trial 7 with value: 0.628714.[0m
[32m[I 2023-02-27 20:34:50,745][0m Trial 10 finished with value: 0.3782834802287911 and parameters: {'p_penalty': 'elasticnet', 'p_alpha': 0.8870719109236583, 'p_eta0': 2.0, 'p_early_stopping': True, 'p_validation_fraction': 0.25, 'p_n_iter_no_change': 10}. Best is trial 7 with value: 0.628714.[0m
[32m[I 2023-02-27 20:35:42,989][0m Trial 11 finished with value: 0.5637338509927743 and parameters: {'p_penalty': 'elasticnet', 'p_alpha': 0.0002577699946045973, 'p_eta0': 1.5, 'p_early_stopping': True, 'p_validation_fraction': 0.25, 'p_n_iter_no_change': 10}. Best is trial 7 with value: 0.628714.[0m
[32m[I 2023-02-27 20:36:38,333][0m Trial 12 finished with value: 0.6628391186718907 and parameters: {'p_penalty': 'elasticnet', 'p_alpha': 1.330088365073253e-06, 'p_eta0': 1.5, 'p_early_stopping': True, 'p_validation_fraction': 0.25, 'p_n_iter_no_change': 10}. Best is trial 12 with value: 0.662839.[0m
[32m[I 2023-02-27 20:37:40,360][0m Trial 13 finished with value: 0.6235108862797621 and parameters: {'p_penalty': 'elasticnet', 'p_alpha': 3.387402623067482e-06, 'p_eta0': 2.0, 'p_early_stopping': True, 'p_validation_fraction': 0.25, 'p_n_iter_no_change': 10}. Best is trial 12 with value: 0.662839.[0m
[32m[I 2023-02-27 20:38:39,397][0m Trial 14 finished with value: 0.6820486909570068 and parameters: {'p_penalty': 'elasticnet', 'p_alpha': 1.504403933347593e-06, 'p_eta0': 1.0, 'p_early_stopping': True, 'p_validation_fraction': 0.25, 'p_n_iter_no_change': 10}. Best is trial 14 with value: 0.682049.[0m
[32m[I 2023-02-27 20:39:49,207][0m Trial 15 finished with value: 0.6837901458512332 and parameters: {'p_penalty': 'elasticnet', 'p_alpha': 1.373291332512174e-06, 'p_eta0': 1.0, 'p_early_stopping': True, 'p_validation_fraction': 0.25, 'p_n_iter_no_change': 10}. Best is trial 15 with value: 0.68379.[0m
[32m[I 2023-02-27 20:40:45,148][0m Trial 16 finished with value: 0.6364101942804619 and parameters: {'p_penalty': 'elasticnet', 'p_alpha': 1.0382010554033843e-05, 'p_eta0': 1.0, 'p_early_stopping': True, 'p_validation_fraction': 0.25, 'p_n_iter_no_change': 10}. Best is trial 15 with value: 0.68379.[0m
[32m[I 2023-02-27 20:41:40,885][0m Trial 17 finished with value: 0.664307991875184 and parameters: {'p_penalty': 'elasticnet', 'p_alpha': 1.7557197347717745e-06, 'p_eta0': 1.0, 'p_early_stopping': True, 'p_validation_fraction': 0.25, 'p_n_iter_no_change': 10}. Best is trial 15 with value: 0.68379.[0m
[32m[I 2023-02-27 20:42:39,161][0m Trial 18 finished with value: 0.566362666814522 and parameters: {'p_penalty': 'elasticnet', 'p_alpha': 1.1435592379497055e-05, 'p_eta0': 1.0, 'p_early_stopping': True, 'p_validation_fraction': 0.25, 'p_n_iter_no_change': 10}. Best is trial 15 with value: 0.68379.[0m
[32m[I 2023-02-27 20:43:38,656][0m Trial 19 finished with value: 0.2048037390378927 and parameters: {'p_penalty': 'elasticnet', 'p_alpha': 1.3983239662340353e-05, 'p_eta0': 0.5, 'p_early_stopping': True, 'p_validation_fraction': 0.25, 'p_n_iter_no_change': 10}. Best is trial 15 with value: 0.68379.[0m
[32m[I 2023-02-27 20:43:38,718][0m Study finished.[0m
[32m[I 2023-02-27 20:43:38,749][0m --------------------------------------------------------------------------------[0m
[32m[I 2023-02-27 20:43:38,749][0m --------------------     QuadraticDiscriminantAnalysis      --------------------[0m
[32m[I 2023-02-27 20:43:38,749][0m --------------------------------------------------------------------------------[0m
[32m[I 2023-02-27 20:43:38,781][0m A new study created in RDB with name: QuadraticDiscriminantAnalysis_0a1486bb[0m
[32m[I 2023-02-27 20:43:38,781][0m Study started.[0m
[32m[I 2023-02-27 20:43:44,573][0m Trial 0 finished with value: 0.5145559488441521 and parameters: {'qda_reg_param': 0.4, 'qda_tol': 8.372505643834241e-06}. Best is trial 0 with value: 0.514556.[0m
[32m[I 2023-02-27 20:43:50,412][0m Trial 1 finished with value: 0.5154206899523287 and parameters: {'qda_reg_param': 0.35000000000000003, 'qda_tol': 2.248506964733703e-05}. Best is trial 1 with value: 0.515421.[0m
[32m[I 2023-02-27 20:43:56,258][0m Trial 2 finished with value: 0.5065985108261676 and parameters: {'qda_reg_param': 0.55, 'qda_tol': 0.00014892534103932222}. Best is trial 1 with value: 0.515421.[0m
[32m[I 2023-02-27 20:44:02,133][0m Trial 3 finished with value: 0.5196649784407499 and parameters: {'qda_reg_param': 0.25, 'qda_tol': 1.728816236211854e-06}. Best is trial 3 with value: 0.519665.[0m
[32m[I 2023-02-27 20:44:07,997][0m Trial 4 finished with value: 0.5247765518090837 and parameters: {'qda_reg_param': 0.2, 'qda_tol': 1.2274125294235517e-05}. Best is trial 4 with value: 0.524777.[0m
[32m[I 2023-02-27 20:44:13,843][0m Trial 5 finished with value: 0.5154206899523287 and parameters: {'qda_reg_param': 0.35000000000000003, 'qda_tol': 1.7778533880831065e-06}. Best is trial 4 with value: 0.524777.[0m
[32m[I 2023-02-27 20:44:19,701][0m Trial 6 finished with value: 0.5145559488441521 and parameters: {'qda_reg_param': 0.4, 'qda_tol': 0.0001413249076448807}. Best is trial 4 with value: 0.524777.[0m
[32m[I 2023-02-27 20:44:25,542][0m Trial 7 finished with value: 0.8074011437179476 and parameters: {'qda_reg_param': 0.65, 'qda_tol': 2.021377360027384e-05}. Best is trial 7 with value: 0.807401.[0m
[32m[I 2023-02-27 20:44:31,338][0m Trial 8 finished with value: 0.8613398135448959 and parameters: {'qda_reg_param': 0.8500000000000001, 'qda_tol': 6.014228780351684e-05}. Best is trial 8 with value: 0.86134.[0m
[32m[I 2023-02-27 20:44:37,140][0m Trial 9 finished with value: 0.5196649784407499 and parameters: {'qda_reg_param': 0.25, 'qda_tol': 6.010495504363706e-05}. Best is trial 8 with value: 0.86134.[0m
[32m[I 2023-02-27 20:44:42,893][0m Trial 10 finished with value: 0.8906948762085103 and parameters: {'qda_reg_param': 1.0, 'qda_tol': 0.0008029159771242532}. Best is trial 10 with value: 0.890695.[0m
[32m[I 2023-02-27 20:44:48,635][0m Trial 11 finished with value: 0.8906948762085103 and parameters: {'qda_reg_param': 1.0, 'qda_tol': 0.000712842371242388}. Best is trial 10 with value: 0.890695.[0m
[32m[I 2023-02-27 20:44:54,351][0m Trial 12 finished with value: 0.8906948762085103 and parameters: {'qda_reg_param': 1.0, 'qda_tol': 0.000931647841163154}. Best is trial 10 with value: 0.890695.[0m
[32m[I 2023-02-27 20:44:59,945][0m Trial 13 finished with value: 0.3705864186155029 and parameters: {'qda_reg_param': 0.0, 'qda_tol': 0.0008213881219412244}. Best is trial 10 with value: 0.890695.[0m
[32m[I 2023-02-27 20:45:05,696][0m Trial 14 finished with value: 0.8906948762085103 and parameters: {'qda_reg_param': 1.0, 'qda_tol': 0.0003180872832152966}. Best is trial 10 with value: 0.890695.[0m
[32m[I 2023-02-27 20:45:11,464][0m Trial 15 finished with value: 0.8576637654486604 and parameters: {'qda_reg_param': 0.8, 'qda_tol': 0.0003364662049833507}. Best is trial 10 with value: 0.890695.[0m
[32m[I 2023-02-27 20:45:17,317][0m Trial 16 finished with value: 0.8576637654486604 and parameters: {'qda_reg_param': 0.8, 'qda_tol': 0.0003604615231890113}. Best is trial 10 with value: 0.890695.[0m
