[32m[I 2023-02-27 20:45:23,194][0m Trial 17 finished with value: 0.8856959649244142 and parameters: {'qda_reg_param': 0.9, 'qda_tol': 0.0002810406793841768}. Best is trial 10 with value: 0.890695.[0m
[32m[I 2023-02-27 20:45:29,064][0m Trial 18 finished with value: 0.8074011437179476 and parameters: {'qda_reg_param': 0.65, 'qda_tol': 0.00010322614698659116}. Best is trial 10 with value: 0.890695.[0m
[32m[I 2023-02-27 20:45:34,940][0m Trial 19 finished with value: 0.8537505012792463 and parameters: {'qda_reg_param': 0.7000000000000001, 'qda_tol': 0.0003895231459574476}. Best is trial 10 with value: 0.890695.[0m
[32m[I 2023-02-27 20:45:35,003][0m Study finished.[0m
[32m[I 2023-02-27 20:45:35,034][0m --------------------------------------------------------------------------------[0m
[32m[I 2023-02-27 20:45:35,034][0m --------------------         RandomForestClassifier         --------------------[0m
[32m[I 2023-02-27 20:45:35,034][0m --------------------------------------------------------------------------------[0m
[32m[I 2023-02-27 20:45:35,065][0m A new study created in RDB with name: RandomForestClassifier_0a1486bb[0m
[32m[I 2023-02-27 20:45:35,065][0m Study started.[0m
[32m[I 2023-02-27 20:45:35,097][0m sklearn.ensemble.RandomForestClassifier.fit: fallback to original Scikit-learn[0m
[32m[I 2023-02-27 20:47:03,913][0m sklearn.ensemble.RandomForestClassifier.predict: fallback to original Scikit-learn[0m
[32m[I 2023-02-27 20:47:03,913][0m sklearn.ensemble.RandomForestClassifier.predict_proba: fallback to original Scikit-learn[0m
[32m[I 2023-02-27 20:47:07,289][0m Trial 0 finished with value: 0.987971308745292 and parameters: {'rfc_criterion': 'entropy', 'rfc_n_estimators': 40, 'rfc_min_samples_split': 10, 'rfc_min_samples_leaf': 32, 'rfc_max_features': 7, 'rfc_bootstrap': True}. Best is trial 0 with value: 0.987971.[0m
[32m[I 2023-02-27 20:47:07,377][0m sklearn.ensemble.RandomForestClassifier.fit: fallback to original Scikit-learn[0m
[32m[I 2023-02-27 20:51:26,470][0m sklearn.ensemble.RandomForestClassifier.predict: fallback to original Scikit-learn[0m
[32m[I 2023-02-27 20:51:26,470][0m sklearn.ensemble.RandomForestClassifier.predict_proba: fallback to original Scikit-learn[0m
[32m[I 2023-02-27 20:51:30,580][0m Trial 1 finished with value: 0.9925654026381586 and parameters: {'rfc_criterion': 'entropy', 'rfc_n_estimators': 50, 'rfc_min_samples_split': 2, 'rfc_min_samples_leaf': 12, 'rfc_max_features': 14, 'rfc_bootstrap': False}. Best is trial 1 with value: 0.992565.[0m
[32m[I 2023-02-27 20:51:30,736][0m sklearn.ensemble.RandomForestClassifier.fit: running accelerated version on CPU[0m
[32m[I 2023-02-27 20:55:18,367][0m sklearn.ensemble.RandomForestClassifier.predict: running accelerated version on CPU[0m
[32m[I 2023-02-27 20:55:20,716][0m Trial 2 finished with value: 0.9912284646515478 and parameters: {'rfc_criterion': 'gini', 'rfc_n_estimators': 180, 'rfc_min_samples_split': 10, 'rfc_min_samples_leaf': 8, 'rfc_max_features': 20, 'rfc_bootstrap': False}. Best is trial 1 with value: 0.992565.[0m
[32m[I 2023-02-27 20:55:20,904][0m sklearn.ensemble.RandomForestClassifier.fit: running accelerated version on CPU[0m
[32m[I 2023-02-27 20:58:03,880][0m sklearn.ensemble.RandomForestClassifier.predict: running accelerated version on CPU[0m
[32m[I 2023-02-27 20:58:05,973][0m Trial 3 finished with value: 0.9904727309131511 and parameters: {'rfc_criterion': 'gini', 'rfc_n_estimators': 130, 'rfc_min_samples_split': 43, 'rfc_min_samples_leaf': 34, 'rfc_max_features': 16, 'rfc_bootstrap': False}. Best is trial 1 with value: 0.992565.[0m
[32m[I 2023-02-27 20:58:06,113][0m sklearn.ensemble.RandomForestClassifier.fit: running accelerated version on CPU[0m
[32m[I 2023-02-27 21:00:39,868][0m sklearn.ensemble.RandomForestClassifier.predict: running accelerated version on CPU[0m
[32m[I 2023-02-27 21:00:42,197][0m Trial 4 finished with value: 0.9908063220815037 and parameters: {'rfc_criterion': 'gini', 'rfc_n_estimators': 180, 'rfc_min_samples_split': 40, 'rfc_min_samples_leaf': 36, 'rfc_max_features': 8, 'rfc_bootstrap': False}. Best is trial 1 with value: 0.992565.[0m
[32m[I 2023-02-27 21:00:42,290][0m sklearn.ensemble.RandomForestClassifier.fit: fallback to original Scikit-learn[0m
[32m[I 2023-02-27 21:02:52,285][0m sklearn.ensemble.RandomForestClassifier.predict: fallback to original Scikit-learn[0m
[32m[I 2023-02-27 21:02:52,285][0m sklearn.ensemble.RandomForestClassifier.predict_proba: fallback to original Scikit-learn[0m
[32m[I 2023-02-27 21:02:58,833][0m Trial 5 finished with value: 0.9512259884834385 and parameters: {'rfc_criterion': 'entropy', 'rfc_n_estimators': 100, 'rfc_min_samples_split': 25, 'rfc_min_samples_leaf': 7, 'rfc_max_features': 1, 'rfc_bootstrap': False}. Best is trial 1 with value: 0.992565.[0m
[32m[I 2023-02-27 21:02:58,927][0m sklearn.ensemble.RandomForestClassifier.fit: fallback to original Scikit-learn[0m
[32m[I 2023-02-27 21:04:36,892][0m sklearn.ensemble.RandomForestClassifier.predict: fallback to original Scikit-learn[0m
[32m[I 2023-02-27 21:04:36,892][0m sklearn.ensemble.RandomForestClassifier.predict_proba: fallback to original Scikit-learn[0m
[32m[I 2023-02-27 21:04:41,134][0m Trial 6 finished with value: 0.9803856480181257 and parameters: {'rfc_criterion': 'entropy', 'rfc_n_estimators': 60, 'rfc_min_samples_split': 5, 'rfc_min_samples_leaf': 28, 'rfc_max_features': 5, 'rfc_bootstrap': True}. Best is trial 1 with value: 0.992565.[0m
[32m[I 2023-02-27 21:04:41,228][0m sklearn.ensemble.RandomForestClassifier.fit: fallback to original Scikit-learn[0m
[32m[I 2023-02-27 21:07:08,983][0m sklearn.ensemble.RandomForestClassifier.predict: fallback to original Scikit-learn[0m
[32m[I 2023-02-27 21:07:08,999][0m sklearn.ensemble.RandomForestClassifier.predict_proba: fallback to original Scikit-learn[0m
[32m[I 2023-02-27 21:07:15,467][0m Trial 7 finished with value: 0.9643180664531373 and parameters: {'rfc_criterion': 'entropy', 'rfc_n_estimators': 110, 'rfc_min_samples_split': 41, 'rfc_min_samples_leaf': 48, 'rfc_max_features': 4, 'rfc_bootstrap': True}. Best is trial 1 with value: 0.992565.[0m
[32m[I 2023-02-27 21:07:15,608][0m sklearn.ensemble.RandomForestClassifier.fit: running accelerated version on CPU[0m
[32m[I 2023-02-27 21:09:52,422][0m sklearn.ensemble.RandomForestClassifier.predict: running accelerated version on CPU[0m
[32m[I 2023-02-27 21:09:54,455][0m Trial 8 finished with value: 0.9907575242080406 and parameters: {'rfc_criterion': 'gini', 'rfc_n_estimators': 120, 'rfc_min_samples_split': 50, 'rfc_min_samples_leaf': 6, 'rfc_max_features': 23, 'rfc_bootstrap': False}. Best is trial 1 with value: 0.992565.[0m
[32m[I 2023-02-27 21:09:54,548][0m sklearn.ensemble.RandomForestClassifier.fit: fallback to original Scikit-learn[0m
[32m[I 2023-02-27 21:13:06,886][0m sklearn.ensemble.RandomForestClassifier.predict: fallback to original Scikit-learn[0m
[32m[I 2023-02-27 21:13:06,886][0m sklearn.ensemble.RandomForestClassifier.predict_proba: fallback to original Scikit-learn[0m
[32m[I 2023-02-27 21:13:13,949][0m Trial 9 finished with value: 0.981857455531019 and parameters: {'rfc_criterion': 'entropy', 'rfc_n_estimators': 120, 'rfc_min_samples_split': 3, 'rfc_min_samples_leaf': 43, 'rfc_max_features': 5, 'rfc_bootstrap': True}. Best is trial 1 with value: 0.992565.[0m
[32m[I 2023-02-27 21:13:14,058][0m sklearn.ensemble.RandomForestClassifier.fit: fallback to original Scikit-learn[0m
[32m[I 2023-02-27 21:13:59,896][0m sklearn.ensemble.RandomForestClassifier.predict: fallback to original Scikit-learn[0m
[32m[I 2023-02-27 21:13:59,896][0m sklearn.ensemble.RandomForestClassifier.predict_proba: fallback to original Scikit-learn[0m
[32m[I 2023-02-27 21:14:01,789][0m Trial 10 finished with value: 0.9911911480452597 and parameters: {'rfc_criterion': 'entropy', 'rfc_n_estimators': 10, 'rfc_min_samples_split': 21, 'rfc_min_samples_leaf': 18, 'rfc_max_features': 12, 'rfc_bootstrap': False}. Best is trial 1 with value: 0.992565.[0m
[32m[I 2023-02-27 21:14:01,946][0m sklearn.ensemble.RandomForestClassifier.fit: running accelerated version on CPU[0m
[32m[I 2023-02-27 21:18:00,543][0m sklearn.ensemble.RandomForestClassifier.predict: running accelerated version on CPU[0m
[32m[I 2023-02-27 21:18:02,889][0m Trial 11 finished with value: 0.9908016697449403 and parameters: {'rfc_criterion': 'gini', 'rfc_n_estimators': 190, 'rfc_min_samples_split': 15, 'rfc_min_samples_leaf': 16, 'rfc_max_features': 20, 'rfc_bootstrap': False}. Best is trial 1 with value: 0.992565.[0m
[32m[I 2023-02-27 21:18:03,062][0m sklearn.ensemble.RandomForestClassifier.fit: running accelerated version on CPU[0m
[32m[I 2023-02-27 21:21:08,271][0m sklearn.ensemble.RandomForestClassifier.predict: running accelerated version on CPU[0m
[32m[I 2023-02-27 21:21:10,501][0m Trial 12 finished with value: 0.9923984690491107 and parameters: {'rfc_criterion': 'gini', 'rfc_n_estimators': 160, 'rfc_min_samples_split': 14, 'rfc_min_samples_leaf': 1, 'rfc_max_features': 16, 'rfc_bootstrap': False}. Best is trial 1 with value: 0.992565.[0m
[32m[I 2023-02-27 21:21:10,642][0m sklearn.ensemble.RandomForestClassifier.fit: running accelerated version on CPU[0m
[32m[I 2023-02-27 21:22:23,597][0m sklearn.ensemble.RandomForestClassifier.predict: running accelerated version on CPU[0m
[32m[I 2023-02-27 21:22:25,426][0m Trial 13 finished with value: 0.9913767401041246 and parameters: {'rfc_criterion': 'gini', 'rfc_n_estimators': 70, 'rfc_min_samples_split': 16, 'rfc_min_samples_leaf': 17, 'rfc_max_features': 13, 'rfc_bootstrap': False}. Best is trial 1 with value: 0.992565.[0m
[32m[I 2023-02-27 21:22:25,582][0m sklearn.ensemble.RandomForestClassifier.fit: running accelerated version on CPU[0m
[32m[I 2023-02-27 21:25:27,162][0m sklearn.ensemble.RandomForestClassifier.predict: running accelerated version on CPU[0m
[32m[I 2023-02-27 21:25:29,443][0m Trial 14 finished with value: 0.9919365142041878 and parameters: {'rfc_criterion': 'gini', 'rfc_n_estimators': 150, 'rfc_min_samples_split': 31, 'rfc_min_samples_leaf': 2, 'rfc_max_features': 16, 'rfc_bootstrap': False}. Best is trial 1 with value: 0.992565.[0m
[32m[I 2023-02-27 21:25:29,537][0m sklearn.ensemble.RandomForestClassifier.fit: fallback to original Scikit-learn[0m
[32m[I 2023-02-27 21:31:03,745][0m sklearn.ensemble.RandomForestClassifier.predict: fallback to original Scikit-learn[0m
[32m[I 2023-02-27 21:31:03,745][0m sklearn.ensemble.RandomForestClassifier.predict_proba: fallback to original Scikit-learn[0m
[32m[I 2023-02-27 21:31:09,949][0m Trial 15 finished with value: 0.996084634280105 and parameters: {'rfc_criterion': 'entropy', 'rfc_n_estimators': 80, 'rfc_min_samples_split': 2, 'rfc_min_samples_leaf': 1, 'rfc_max_features': 10, 'rfc_bootstrap': False}. Best is trial 15 with value: 0.996085.[0m
[32m[I 2023-02-27 21:31:10,043][0m sklearn.ensemble.RandomForestClassifier.fit: fallback to original Scikit-learn[0m
[32m[I 2023-02-27 21:35:38,981][0m sklearn.ensemble.RandomForestClassifier.predict: fallback to original Scikit-learn[0m
[32m[I 2023-02-27 21:35:38,981][0m sklearn.ensemble.RandomForestClassifier.predict_proba: fallback to original Scikit-learn[0m
[32m[I 2023-02-27 21:35:44,107][0m Trial 16 finished with value: 0.9914275381707626 and parameters: {'rfc_criterion': 'entropy', 'rfc_n_estimators': 70, 'rfc_min_samples_split': 2, 'rfc_min_samples_leaf': 11, 'rfc_max_features': 10, 'rfc_bootstrap': False}. Best is trial 15 with value: 0.996085.[0m
[32m[I 2023-02-27 21:35:44,200][0m sklearn.ensemble.RandomForestClassifier.fit: fallback to original Scikit-learn[0m
[32m[I 2023-02-27 21:37:02,368][0m sklearn.ensemble.RandomForestClassifier.predict: fallback to original Scikit-learn[0m
[32m[I 2023-02-27 21:37:02,368][0m sklearn.ensemble.RandomForestClassifier.predict_proba: fallback to original Scikit-learn[0m
[32m[I 2023-02-27 21:37:04,775][0m Trial 17 finished with value: 0.9905224353342362 and parameters: {'rfc_criterion': 'entropy', 'rfc_n_estimators': 20, 'rfc_min_samples_split': 9, 'rfc_min_samples_leaf': 23, 'rfc_max_features': 10, 'rfc_bootstrap': False}. Best is trial 15 with value: 0.996085.[0m
[32m[I 2023-02-27 21:37:04,869][0m sklearn.ensemble.RandomForestClassifier.fit: fallback to original Scikit-learn[0m
[32m[I 2023-02-27 21:40:16,870][0m sklearn.ensemble.RandomForestClassifier.predict: fallback to original Scikit-learn[0m
[32m[I 2023-02-27 21:40:16,886][0m sklearn.ensemble.RandomForestClassifier.predict_proba: fallback to original Scikit-learn[0m
[32m[I 2023-02-27 21:40:20,418][0m Trial 18 finished with value: 0.992500432220511 and parameters: {'rfc_criterion': 'entropy', 'rfc_n_estimators': 40, 'rfc_min_samples_split': 31, 'rfc_min_samples_leaf': 13, 'rfc_max_features': 19, 'rfc_bootstrap': True}. Best is trial 15 with value: 0.996085.[0m
[32m[I 2023-02-27 21:40:20,527][0m sklearn.ensemble.RandomForestClassifier.fit: fallback to original Scikit-learn[0m
[32m[I 2023-02-27 21:52:41,361][0m sklearn.ensemble.RandomForestClassifier.predict: fallback to original Scikit-learn[0m
[32m[I 2023-02-27 21:52:41,361][0m sklearn.ensemble.RandomForestClassifier.predict_proba: fallback to original Scikit-learn[0m
[32m[I 2023-02-27 21:52:47,629][0m Trial 19 finished with value: 0.991610760628331 and parameters: {'rfc_criterion': 'entropy', 'rfc_n_estimators': 90, 'rfc_min_samples_split': 20, 'rfc_min_samples_leaf': 23, 'rfc_max_features': 25, 'rfc_bootstrap': False}. Best is trial 15 with value: 0.996085.[0m
[32m[I 2023-02-27 21:52:47,692][0m Study finished.[0m
[32m[I 2023-02-27 21:52:47,723][0m --------------------------------------------------------------------------------[0m
[32m[I 2023-02-27 21:52:47,723][0m --------------------            RidgeClassifier             --------------------[0m
[32m[I 2023-02-27 21:52:47,723][0m --------------------------------------------------------------------------------[0m
[32m[I 2023-02-27 21:52:47,755][0m A new study created in RDB with name: RidgeClassifier_0a1486bb[0m
[32m[I 2023-02-27 21:52:47,770][0m Study started.[0m
[32m[I 2023-02-27 21:52:50,405][0m Trial 0 finished with value: 0.8798019061596224 and parameters: {'rc_C': 65576.75880849542, 'rc_tol': 0.0005476895115890765}. Best is trial 0 with value: 0.879802.[0m
[32m[I 2023-02-27 21:52:53,125][0m Trial 1 finished with value: 0.9121866546562144 and parameters: {'rc_C': 0.012856875048451531, 'rc_tol': 0.00021577636916359787}. Best is trial 1 with value: 0.912187.[0m
[32m[I 2023-02-27 21:52:55,846][0m Trial 2 finished with value: 0.9121884983032598 and parameters: {'rc_C': 0.00045770570302072875, 'rc_tol': 0.00015849354270454895}. Best is trial 2 with value: 0.912188.[0m
[32m[I 2023-02-27 21:52:58,553][0m Trial 3 finished with value: 0.9121124856741708 and parameters: {'rc_C': 2.995062909039044, 'rc_tol': 0.005638937476304168}. Best is trial 2 with value: 0.912188.[0m
[32m[I 2023-02-27 21:53:01,285][0m Trial 4 finished with value: 0.9121884983032598 and parameters: {'rc_C': 0.000250789137293143, 'rc_tol': 0.005908070101515873}. Best is trial 2 with value: 0.912188.[0m
[32m[I 2023-02-27 21:53:04,017][0m Trial 5 finished with value: 0.9105501449878158 and parameters: {'rc_C': 77.3504262428477, 'rc_tol': 0.0004533735914708281}. Best is trial 2 with value: 0.912188.[0m
[32m[I 2023-02-27 21:53:06,753][0m Trial 6 finished with value: 0.9119932811245748 and parameters: {'rc_C': 15.880438099770233, 'rc_tol': 0.00013772027800865757}. Best is trial 2 with value: 0.912188.[0m
[32m[I 2023-02-27 21:53:09,438][0m Trial 7 finished with value: 0.8150294299168873 and parameters: {'rc_C': 745782.1512333518, 'rc_tol': 0.00029375884010318594}. Best is trial 2 with value: 0.912188.[0m
[32m[I 2023-02-27 21:53:12,128][0m Trial 8 finished with value: 0.9121604613923981 and parameters: {'rc_C': 1.1710585193448708, 'rc_tol': 0.0020633054390847786}. Best is trial 2 with value: 0.912188.[0m
[32m[I 2023-02-27 21:53:14,818][0m Trial 9 finished with value: 0.880952454373267 and parameters: {'rc_C': 33744.00106254142, 'rc_tol': 0.0001669041958024279}. Best is trial 2 with value: 0.912188.[0m
[32m[I 2023-02-27 21:53:17,519][0m Trial 10 finished with value: 0.9121884983032598 and parameters: {'rc_C': 1.3744978226015165e-06, 'rc_tol': 0.0014144271523339935}. Best is trial 2 with value: 0.912188.[0m
[32m[I 2023-02-27 21:53:20,258][0m Trial 11 finished with value: 0.9121884983032598 and parameters: {'rc_C': 0.00011857505746367741, 'rc_tol': 0.009298378905795407}. Best is trial 2 with value: 0.912188.[0m
[32m[I 2023-02-27 21:53:22,985][0m Trial 12 finished with value: 0.9121884983032598 and parameters: {'rc_C': 0.0029467227466608765, 'rc_tol': 0.0027996878657254145}. Best is trial 2 with value: 0.912188.[0m
[32m[I 2023-02-27 21:53:25,693][0m Trial 13 finished with value: 0.9121884983032598 and parameters: {'rc_C': 2.5643495292323705e-06, 'rc_tol': 0.000787476285383981}. Best is trial 2 with value: 0.912188.[0m
[32m[I 2023-02-27 21:53:28,411][0m Trial 14 finished with value: 0.9121884983032598 and parameters: {'rc_C': 0.007561900973758642, 'rc_tol': 0.0040543044147288805}. Best is trial 2 with value: 0.912188.[0m
[32m[I 2023-02-27 21:53:31,139][0m Trial 15 finished with value: 0.9121884983032598 and parameters: {'rc_C': 4.420116809674561e-05, 'rc_tol': 0.0008607937285050502}. Best is trial 2 with value: 0.912188.[0m
[32m[I 2023-02-27 21:53:33,859][0m Trial 16 finished with value: 0.9121866546562144 and parameters: {'rc_C': 0.0607023385763156, 'rc_tol': 0.00010060709584949922}. Best is trial 2 with value: 0.912188.[0m
[32m[I 2023-02-27 21:53:36,593][0m Trial 17 finished with value: 0.912184810952689 and parameters: {'rc_C': 0.14177255117729118, 'rc_tol': 0.0029662390423446064}. Best is trial 2 with value: 0.912188.[0m
[32m[I 2023-02-27 21:53:39,315][0m Trial 18 finished with value: 0.9121884983032598 and parameters: {'rc_C': 0.00010649312270431936, 'rc_tol': 0.0010217015536735444}. Best is trial 2 with value: 0.912188.[0m
[32m[I 2023-02-27 21:53:42,038][0m Trial 19 finished with value: 0.9121884983032598 and parameters: {'rc_C': 0.0007361519923329995, 'rc_tol': 0.0003424758764734102}. Best is trial 2 with value: 0.912188.[0m
[32m[I 2023-02-27 21:53:42,101][0m Study finished.[0m
[32m[I 2023-02-27 21:53:42,132][0m --------------------------------------------------------------------------------[0m
[32m[I 2023-02-27 21:53:42,132][0m --------------------           RUSBoostClassifier           --------------------[0m
[32m[I 2023-02-27 21:53:42,132][0m --------------------------------------------------------------------------------[0m
[32m[I 2023-02-27 21:53:42,163][0m A new study created in RDB with name: RUSBoostClassifier_0a1486bb[0m
[32m[I 2023-02-27 21:53:42,163][0m Study started.[0m
[32m[I 2023-02-27 21:55:01,981][0m Trial 0 finished with value: 0.5698815132968043 and parameters: {'rusbc_n_estimators': 75, 'rusbc_learning_rate': 0.00015252281372310486, 'rusbc_sampling_strategy': 'not minority'}. Best is trial 0 with value: 0.569881.[0m
[32m[I 2023-02-27 21:55:55,396][0m Trial 1 finished with value: 0.9353605659807469 and parameters: {'rusbc_n_estimators': 50, 'rusbc_learning_rate': 0.058331045369731195, 'rusbc_sampling_strategy': 'not minority'}. Best is trial 1 with value: 0.935361.[0m
[32m[I 2023-02-27 21:56:23,198][0m Trial 2 finished with value: 0.6492310469881507 and parameters: {'rusbc_n_estimators': 25, 'rusbc_learning_rate': 0.010140486056207983, 'rusbc_sampling_strategy': 'not minority'}. Best is trial 1 with value: 0.935361.[0m
[32m[I 2023-02-27 21:56:51,023][0m Trial 3 finished with value: 0.6656777930787171 and parameters: {'rusbc_n_estimators': 25, 'rusbc_learning_rate': 0.020942163397317998, 'rusbc_sampling_strategy': 'all'}. Best is trial 1 with value: 0.935361.[0m
[32m[I 2023-02-27 21:58:37,687][0m Trial 4 finished with value: 0.5112976242054578 and parameters: {'rusbc_n_estimators': 100, 'rusbc_learning_rate': 0.7177559134820606, 'rusbc_sampling_strategy': 'all'}. Best is trial 1 with value: 0.935361.[0m
[32m[I 2023-02-27 22:00:00,926][0m Trial 5 finished with value: 0.32486884058563387 and parameters: {'rusbc_n_estimators': 50, 'rusbc_learning_rate': 0.0007030193694737599, 'rusbc_sampling_strategy': 'majority'}. Best is trial 1 with value: 0.935361.[0m
[32m[I 2023-02-27 22:01:27,253][0m Trial 6 finished with value: 0.3782834802287911 and parameters: {'rusbc_n_estimators': 50, 'rusbc_learning_rate': 4.188324812605302e-05, 'rusbc_sampling_strategy': 'not majority'}. Best is trial 1 with value: 0.935361.[0m
[32m[I 2023-02-27 22:02:45,975][0m Trial 7 finished with value: 0.0027353477737435783 and parameters: {'rusbc_n_estimators': 75, 'rusbc_learning_rate': 6.569080761426557e-06, 'rusbc_sampling_strategy': 'not minority'}. Best is trial 1 with value: 0.935361.[0m
[32m[I 2023-02-27 22:03:39,401][0m Trial 8 finished with value: 0.7716455902008085 and parameters: {'rusbc_n_estimators': 50, 'rusbc_learning_rate': 0.7251237733375353, 'rusbc_sampling_strategy': 'not minority'}. Best is trial 1 with value: 0.935361.[0m
[32m[I 2023-02-27 22:05:47,736][0m Trial 9 finished with value: 0.3782834802287911 and parameters: {'rusbc_n_estimators': 75, 'rusbc_learning_rate': 2.8168436591855813e-05, 'rusbc_sampling_strategy': 'not majority'}. Best is trial 1 with value: 0.935361.[0m
[32m[I 2023-02-27 22:08:29,527][0m Trial 10 finished with value: 0.6659244534195745 and parameters: {'rusbc_n_estimators': 100, 'rusbc_learning_rate': 0.02025777292728786, 'rusbc_sampling_strategy': 'majority'}. Best is trial 1 with value: 0.935361.[0m
