[32m[I 2023-02-27 12:54:18,207][0m Trial 0 finished with value: 0.9891799243715509 and parameters: {'dtc_criterion': 'gini', 'dtc_splitter': 'best', 'dtc_min_samples_split': 33, 'dtc_min_samples_leaf': 32, 'dtc_max_features': 12}. Best is trial 0 with value: 0.98918.[0m
[32m[I 2023-02-27 12:54:22,412][0m Trial 1 finished with value: 0.9913287075793366 and parameters: {'dtc_criterion': 'entropy', 'dtc_splitter': 'random', 'dtc_min_samples_split': 20, 'dtc_min_samples_leaf': 1, 'dtc_max_features': 24}. Best is trial 1 with value: 0.991329.[0m
[32m[I 2023-02-27 12:54:29,357][0m Trial 2 finished with value: 0.9905687067301938 and parameters: {'dtc_criterion': 'gini', 'dtc_splitter': 'best', 'dtc_min_samples_split': 39, 'dtc_min_samples_leaf': 41, 'dtc_max_features': 18}. Best is trial 1 with value: 0.991329.[0m
[32m[I 2023-02-27 12:54:36,430][0m Trial 3 finished with value: 0.9920771536619172 and parameters: {'dtc_criterion': 'gini', 'dtc_splitter': 'best', 'dtc_min_samples_split': 33, 'dtc_min_samples_leaf': 1, 'dtc_max_features': 15}. Best is trial 3 with value: 0.992077.[0m
[32m[I 2023-02-27 12:54:44,199][0m Trial 4 finished with value: 0.9915438004428347 and parameters: {'dtc_criterion': 'entropy', 'dtc_splitter': 'best', 'dtc_min_samples_split': 28, 'dtc_min_samples_leaf': 14, 'dtc_max_features': 19}. Best is trial 3 with value: 0.992077.[0m
[32m[I 2023-02-27 12:54:52,505][0m Trial 5 finished with value: 0.9908738973802996 and parameters: {'dtc_criterion': 'gini', 'dtc_splitter': 'best', 'dtc_min_samples_split': 19, 'dtc_min_samples_leaf': 38, 'dtc_max_features': 22}. Best is trial 3 with value: 0.992077.[0m
[32m[I 2023-02-27 12:54:54,623][0m Trial 6 finished with value: 0.9360077643902275 and parameters: {'dtc_criterion': 'gini', 'dtc_splitter': 'random', 'dtc_min_samples_split': 24, 'dtc_min_samples_leaf': 4, 'dtc_max_features': 3}. Best is trial 3 with value: 0.992077.[0m
[32m[I 2023-02-27 12:54:57,510][0m Trial 7 finished with value: 0.9644842400822569 and parameters: {'dtc_criterion': 'entropy', 'dtc_splitter': 'random', 'dtc_min_samples_split': 15, 'dtc_min_samples_leaf': 19, 'dtc_max_features': 12}. Best is trial 3 with value: 0.992077.[0m
[32m[I 2023-02-27 12:55:05,837][0m Trial 8 finished with value: 0.9907231268000504 and parameters: {'dtc_criterion': 'entropy', 'dtc_splitter': 'best', 'dtc_min_samples_split': 21, 'dtc_min_samples_leaf': 16, 'dtc_max_features': 17}. Best is trial 3 with value: 0.992077.[0m
[32m[I 2023-02-27 12:55:09,484][0m Trial 9 finished with value: 0.9529991160468154 and parameters: {'dtc_criterion': 'entropy', 'dtc_splitter': 'best', 'dtc_min_samples_split': 2, 'dtc_min_samples_leaf': 22, 'dtc_max_features': 3}. Best is trial 3 with value: 0.992077.[0m
[32m[I 2023-02-27 12:55:11,969][0m Trial 10 finished with value: 0.9432322895095616 and parameters: {'dtc_criterion': 'gini', 'dtc_splitter': 'random', 'dtc_min_samples_split': 48, 'dtc_min_samples_leaf': 50, 'dtc_max_features': 8}. Best is trial 3 with value: 0.992077.[0m
[32m[I 2023-02-27 12:55:19,650][0m Trial 11 finished with value: 0.9913169914655068 and parameters: {'dtc_criterion': 'entropy', 'dtc_splitter': 'best', 'dtc_min_samples_split': 36, 'dtc_min_samples_leaf': 9, 'dtc_max_features': 18}. Best is trial 3 with value: 0.992077.[0m
[32m[I 2023-02-27 12:55:27,697][0m Trial 12 finished with value: 0.9911068397437602 and parameters: {'dtc_criterion': 'entropy', 'dtc_splitter': 'best', 'dtc_min_samples_split': 30, 'dtc_min_samples_leaf': 12, 'dtc_max_features': 16}. Best is trial 3 with value: 0.992077.[0m
[32m[I 2023-02-27 12:55:36,236][0m Trial 13 finished with value: 0.9917918167643324 and parameters: {'dtc_criterion': 'gini', 'dtc_splitter': 'best', 'dtc_min_samples_split': 46, 'dtc_min_samples_leaf': 8, 'dtc_max_features': 21}. Best is trial 3 with value: 0.992077.[0m
[32m[I 2023-02-27 12:55:45,526][0m Trial 14 finished with value: 0.9918284682040844 and parameters: {'dtc_criterion': 'gini', 'dtc_splitter': 'best', 'dtc_min_samples_split': 48, 'dtc_min_samples_leaf': 6, 'dtc_max_features': 25}. Best is trial 3 with value: 0.992077.[0m
[32m[I 2023-02-27 12:55:54,999][0m Trial 15 finished with value: 0.9912483884460083 and parameters: {'dtc_criterion': 'gini', 'dtc_splitter': 'best', 'dtc_min_samples_split': 40, 'dtc_min_samples_leaf': 27, 'dtc_max_features': 25}. Best is trial 3 with value: 0.992077.[0m
[32m[I 2023-02-27 12:56:00,384][0m Trial 16 finished with value: 0.99108577135717 and parameters: {'dtc_criterion': 'gini', 'dtc_splitter': 'best', 'dtc_min_samples_split': 50, 'dtc_min_samples_leaf': 1, 'dtc_max_features': 8}. Best is trial 3 with value: 0.992077.[0m
[32m[I 2023-02-27 12:56:06,152][0m Trial 17 finished with value: 0.9905050345837267 and parameters: {'dtc_criterion': 'gini', 'dtc_splitter': 'best', 'dtc_min_samples_split': 44, 'dtc_min_samples_leaf': 7, 'dtc_max_features': 14}. Best is trial 3 with value: 0.992077.[0m
[32m[I 2023-02-27 12:56:08,778][0m Trial 18 finished with value: 0.9596211909554805 and parameters: {'dtc_criterion': 'gini', 'dtc_splitter': 'random', 'dtc_min_samples_split': 12, 'dtc_min_samples_leaf': 28, 'dtc_max_features': 9}. Best is trial 3 with value: 0.992077.[0m
[32m[I 2023-02-27 12:56:17,922][0m Trial 19 finished with value: 0.9916080916505794 and parameters: {'dtc_criterion': 'gini', 'dtc_splitter': 'best', 'dtc_min_samples_split': 41, 'dtc_min_samples_leaf': 20, 'dtc_max_features': 22}. Best is trial 3 with value: 0.992077.[0m
[32m[I 2023-02-27 12:56:17,985][0m Study finished.[0m
[32m[I 2023-02-27 12:56:18,016][0m --------------------------------------------------------------------------------[0m
[32m[I 2023-02-27 12:56:18,016][0m --------------------          ExtraTreeClassifier           --------------------[0m
[32m[I 2023-02-27 12:56:18,016][0m --------------------------------------------------------------------------------[0m
[32m[I 2023-02-27 12:56:18,047][0m A new study created in RDB with name: ExtraTreeClassifier_0a1486bb[0m
[32m[I 2023-02-27 12:56:18,047][0m Study started.[0m
[32m[I 2023-02-27 12:56:19,782][0m Trial 0 finished with value: 0.8185172458166712 and parameters: {'etc_criterion': 'gini', 'etc_min_samples_split': 3, 'etc_min_samples_leaf': 24, 'etc_max_features': 2}. Best is trial 0 with value: 0.818517.[0m
[32m[I 2023-02-27 12:56:22,204][0m Trial 1 finished with value: 0.9264459923240961 and parameters: {'etc_criterion': 'gini', 'etc_min_samples_split': 50, 'etc_min_samples_leaf': 7, 'etc_max_features': 5}. Best is trial 1 with value: 0.926446.[0m
[32m[I 2023-02-27 12:56:24,444][0m Trial 2 finished with value: 0.935807945981077 and parameters: {'etc_criterion': 'entropy', 'etc_min_samples_split': 47, 'etc_min_samples_leaf': 24, 'etc_max_features': 7}. Best is trial 2 with value: 0.935808.[0m
[32m[I 2023-02-27 12:56:26,101][0m Trial 3 finished with value: 0.6640841551634432 and parameters: {'etc_criterion': 'entropy', 'etc_min_samples_split': 38, 'etc_min_samples_leaf': 20, 'etc_max_features': 1}. Best is trial 2 with value: 0.935808.[0m
[32m[I 2023-02-27 12:56:29,911][0m Trial 4 finished with value: 0.9814928648366652 and parameters: {'etc_criterion': 'gini', 'etc_min_samples_split': 2, 'etc_min_samples_leaf': 45, 'etc_max_features': 24}. Best is trial 4 with value: 0.981493.[0m
[32m[I 2023-02-27 12:56:32,287][0m Trial 5 finished with value: 0.9499409818951295 and parameters: {'etc_criterion': 'gini', 'etc_min_samples_split': 7, 'etc_min_samples_leaf': 23, 'etc_max_features': 7}. Best is trial 4 with value: 0.981493.[0m
[32m[I 2023-02-27 12:56:34,865][0m Trial 6 finished with value: 0.9502414326289966 and parameters: {'etc_criterion': 'entropy', 'etc_min_samples_split': 19, 'etc_min_samples_leaf': 42, 'etc_max_features': 9}. Best is trial 4 with value: 0.981493.[0m
[32m[I 2023-02-27 12:56:38,960][0m Trial 7 finished with value: 0.9840466580237046 and parameters: {'etc_criterion': 'entropy', 'etc_min_samples_split': 2, 'etc_min_samples_leaf': 23, 'etc_max_features': 24}. Best is trial 7 with value: 0.984047.[0m
[32m[I 2023-02-27 12:56:41,945][0m Trial 8 finished with value: 0.9710917290558708 and parameters: {'etc_criterion': 'gini', 'etc_min_samples_split': 34, 'etc_min_samples_leaf': 32, 'etc_max_features': 13}. Best is trial 7 with value: 0.984047.[0m
[32m[I 2023-02-27 12:56:44,603][0m Trial 9 finished with value: 0.9604545615588057 and parameters: {'etc_criterion': 'gini', 'etc_min_samples_split': 25, 'etc_min_samples_leaf': 19, 'etc_max_features': 9}. Best is trial 7 with value: 0.984047.[0m
[32m[I 2023-02-27 12:56:48,687][0m Trial 10 finished with value: 0.9915263113770737 and parameters: {'etc_criterion': 'entropy', 'etc_min_samples_split': 14, 'etc_min_samples_leaf': 4, 'etc_max_features': 24}. Best is trial 10 with value: 0.991526.[0m
[32m[I 2023-02-27 12:56:52,850][0m Trial 11 finished with value: 0.9911016770224614 and parameters: {'etc_criterion': 'entropy', 'etc_min_samples_split': 16, 'etc_min_samples_leaf': 3, 'etc_max_features': 25}. Best is trial 10 with value: 0.991526.[0m
[32m[I 2023-02-27 12:56:56,743][0m Trial 12 finished with value: 0.9908672237203373 and parameters: {'etc_criterion': 'entropy', 'etc_min_samples_split': 18, 'etc_min_samples_leaf': 3, 'etc_max_features': 19}. Best is trial 10 with value: 0.991526.[0m
[32m[I 2023-02-27 12:57:00,574][0m Trial 13 finished with value: 0.98387354798601 and parameters: {'etc_criterion': 'entropy', 'etc_min_samples_split': 15, 'etc_min_samples_leaf': 11, 'etc_max_features': 19}. Best is trial 10 with value: 0.991526.[0m
[32m[I 2023-02-27 12:57:04,403][0m Trial 14 finished with value: 0.992095833174794 and parameters: {'etc_criterion': 'entropy', 'etc_min_samples_split': 12, 'etc_min_samples_leaf': 1, 'etc_max_features': 20}. Best is trial 14 with value: 0.992096.[0m
[32m[I 2023-02-27 12:57:08,124][0m Trial 15 finished with value: 0.9872807256333214 and parameters: {'etc_criterion': 'entropy', 'etc_min_samples_split': 10, 'etc_min_samples_leaf': 12, 'etc_max_features': 19}. Best is trial 14 with value: 0.992096.[0m
[32m[I 2023-02-27 12:57:11,516][0m Trial 16 finished with value: 0.9907896246896892 and parameters: {'etc_criterion': 'entropy', 'etc_min_samples_split': 25, 'etc_min_samples_leaf': 1, 'etc_max_features': 16}. Best is trial 14 with value: 0.992096.[0m
[32m[I 2023-02-27 12:57:15,408][0m Trial 17 finished with value: 0.9876776008974772 and parameters: {'etc_criterion': 'entropy', 'etc_min_samples_split': 12, 'etc_min_samples_leaf': 14, 'etc_max_features': 21}. Best is trial 14 with value: 0.992096.[0m
[32m[I 2023-02-27 12:57:18,645][0m Trial 18 finished with value: 0.9708510363219729 and parameters: {'etc_criterion': 'entropy', 'etc_min_samples_split': 22, 'etc_min_samples_leaf': 32, 'etc_max_features': 14}. Best is trial 14 with value: 0.992096.[0m
[32m[I 2023-02-27 12:57:22,696][0m Trial 19 finished with value: 0.9884681946656013 and parameters: {'etc_criterion': 'entropy', 'etc_min_samples_split': 32, 'etc_min_samples_leaf': 8, 'etc_max_features': 22}. Best is trial 14 with value: 0.992096.[0m
[32m[I 2023-02-27 12:57:22,759][0m Study finished.[0m
[32m[I 2023-02-27 12:57:22,803][0m --------------------------------------------------------------------------------[0m
[32m[I 2023-02-27 12:57:22,803][0m --------------------          ExtraTreesClassifier          --------------------[0m
[32m[I 2023-02-27 12:57:22,803][0m --------------------------------------------------------------------------------[0m
[32m[I 2023-02-27 12:57:22,819][0m A new study created in RDB with name: ExtraTreesClassifier_0a1486bb[0m
[32m[I 2023-02-27 12:57:22,835][0m Study started.[0m
[32m[I 2023-02-27 13:06:44,420][0m Trial 0 finished with value: 0.991298887160788 and parameters: {'etsc_n_estimators': 200, 'etsc_criterion': 'gini', 'etsc_min_samples_split': 48, 'etsc_min_samples_leaf': 15, 'etsc_max_features': 24, 'etsc_bootstrap': False}. Best is trial 0 with value: 0.991299.[0m
[32m[I 2023-02-27 13:07:18,805][0m Trial 1 finished with value: 0.8392838657799401 and parameters: {'etsc_n_estimators': 120, 'etsc_criterion': 'entropy', 'etsc_min_samples_split': 27, 'etsc_min_samples_leaf': 26, 'etsc_max_features': 1, 'etsc_bootstrap': False}. Best is trial 0 with value: 0.991299.[0m
[32m[I 2023-02-27 13:15:42,942][0m Trial 2 finished with value: 0.989622088018125 and parameters: {'etsc_n_estimators': 200, 'etsc_criterion': 'entropy', 'etsc_min_samples_split': 30, 'etsc_min_samples_leaf': 36, 'etsc_max_features': 23, 'etsc_bootstrap': False}. Best is trial 0 with value: 0.991299.[0m
[32m[I 2023-02-27 13:19:57,690][0m Trial 3 finished with value: 0.99091938156122 and parameters: {'etsc_n_estimators': 100, 'etsc_criterion': 'entropy', 'etsc_min_samples_split': 45, 'etsc_min_samples_leaf': 19, 'etsc_max_features': 23, 'etsc_bootstrap': False}. Best is trial 0 with value: 0.991299.[0m
[32m[I 2023-02-27 13:23:15,759][0m Trial 4 finished with value: 0.9876991259353937 and parameters: {'etsc_n_estimators': 100, 'etsc_criterion': 'entropy', 'etsc_min_samples_split': 13, 'etsc_min_samples_leaf': 34, 'etsc_max_features': 17, 'etsc_bootstrap': False}. Best is trial 0 with value: 0.991299.[0m
[32m[I 2023-02-27 13:24:59,740][0m Trial 5 finished with value: 0.9882447660301076 and parameters: {'etsc_n_estimators': 70, 'etsc_criterion': 'entropy', 'etsc_min_samples_split': 12, 'etsc_min_samples_leaf': 19, 'etsc_max_features': 16, 'etsc_bootstrap': True}. Best is trial 0 with value: 0.991299.[0m
[32m[I 2023-02-27 13:26:46,689][0m Trial 6 finished with value: 0.9813103664901237 and parameters: {'etsc_n_estimators': 80, 'etsc_criterion': 'gini', 'etsc_min_samples_split': 8, 'etsc_min_samples_leaf': 30, 'etsc_max_features': 14, 'etsc_bootstrap': True}. Best is trial 0 with value: 0.991299.[0m
[32m[I 2023-02-27 13:29:13,461][0m Trial 7 finished with value: 0.9930207696976703 and parameters: {'etsc_n_estimators': 60, 'etsc_criterion': 'entropy', 'etsc_min_samples_split': 26, 'etsc_min_samples_leaf': 3, 'etsc_max_features': 22, 'etsc_bootstrap': False}. Best is trial 7 with value: 0.993021.[0m
[32m[I 2023-02-27 13:33:59,182][0m Trial 8 finished with value: 0.9861429255311235 and parameters: {'etsc_n_estimators': 180, 'etsc_criterion': 'gini', 'etsc_min_samples_split': 17, 'etsc_min_samples_leaf': 45, 'etsc_max_features': 18, 'etsc_bootstrap': True}. Best is trial 7 with value: 0.993021.[0m
[32m[I 2023-02-27 13:38:33,509][0m Trial 9 finished with value: 0.9901709048376863 and parameters: {'etsc_n_estimators': 140, 'etsc_criterion': 'entropy', 'etsc_min_samples_split': 41, 'etsc_min_samples_leaf': 10, 'etsc_max_features': 16, 'etsc_bootstrap': False}. Best is trial 7 with value: 0.993021.[0m
[32m[I 2023-02-27 13:39:39,530][0m Trial 10 finished with value: 0.9870316092230904 and parameters: {'etsc_n_estimators': 50, 'etsc_criterion': 'entropy', 'etsc_min_samples_split': 35, 'etsc_min_samples_leaf': 3, 'etsc_max_features': 8, 'etsc_bootstrap': False}. Best is trial 7 with value: 0.993021.[0m
[32m[I 2023-02-27 13:47:09,291][0m Trial 11 finished with value: 0.9939078973651811 and parameters: {'etsc_n_estimators': 160, 'etsc_criterion': 'gini', 'etsc_min_samples_split': 20, 'etsc_min_samples_leaf': 1, 'etsc_max_features': 25, 'etsc_bootstrap': False}. Best is trial 11 with value: 0.993908.[0m
[32m[I 2023-02-27 13:54:10,685][0m Trial 12 finished with value: 0.9936694299655745 and parameters: {'etsc_n_estimators': 150, 'etsc_criterion': 'gini', 'etsc_min_samples_split': 22, 'etsc_min_samples_leaf': 1, 'etsc_max_features': 25, 'etsc_bootstrap': False}. Best is trial 11 with value: 0.993908.[0m
[32m[I 2023-02-27 13:58:14,568][0m Trial 13 finished with value: 0.9930669965031462 and parameters: {'etsc_n_estimators': 160, 'etsc_criterion': 'gini', 'etsc_min_samples_split': 21, 'etsc_min_samples_leaf': 1, 'etsc_max_features': 9, 'etsc_bootstrap': False}. Best is trial 11 with value: 0.993908.[0m
[32m[I 2023-02-27 13:58:14,631][0m Study finished.[0m
[32m[I 2023-02-27 13:58:14,662][0m --------------------------------------------------------------------------------[0m
[32m[I 2023-02-27 13:58:14,662][0m --------------------               GaussianNB               --------------------[0m
[32m[I 2023-02-27 13:58:14,662][0m --------------------------------------------------------------------------------[0m
[32m[I 2023-02-27 13:58:14,693][0m A new study created in RDB with name: GaussianNB_0a1486bb[0m
[32m[I 2023-02-27 13:58:14,693][0m Study started.[0m
[32m[I 2023-02-27 13:58:17,821][0m Trial 0 finished with value: 0.6652632768656654 and parameters: {'gnb_var_smoothing': 2.1681681871031736e-11}. Best is trial 0 with value: 0.665263.[0m
[32m[I 2023-02-27 13:58:20,899][0m Trial 1 finished with value: 0.7299129479609536 and parameters: {'gnb_var_smoothing': 8.5144280757744e-07}. Best is trial 1 with value: 0.729913.[0m
[32m[I 2023-02-27 13:58:24,058][0m Trial 2 finished with value: 0.7142133689751899 and parameters: {'gnb_var_smoothing': 1.4295736545167754e-07}. Best is trial 1 with value: 0.729913.[0m
[32m[I 2023-02-27 13:58:27,043][0m Trial 3 finished with value: 0.5806402046701071 and parameters: {'gnb_var_smoothing': 0.41063736577029303}. Best is trial 1 with value: 0.729913.[0m
[32m[I 2023-02-27 13:58:30,046][0m Trial 4 finished with value: 0.6948545970838309 and parameters: {'gnb_var_smoothing': 0.0015596293563144281}. Best is trial 1 with value: 0.729913.[0m
[32m[I 2023-02-27 13:58:33,187][0m Trial 5 finished with value: 0.6509288503846717 and parameters: {'gnb_var_smoothing': 7.989131315234302e-12}. Best is trial 1 with value: 0.729913.[0m
[32m[I 2023-02-27 13:58:36,095][0m Trial 6 finished with value: 0.3782834802287911 and parameters: {'gnb_var_smoothing': 615.7123944254367}. Best is trial 1 with value: 0.729913.[0m
[32m[I 2023-02-27 13:58:38,986][0m Trial 7 finished with value: 0.3782834802287911 and parameters: {'gnb_var_smoothing': 52.016035710208975}. Best is trial 1 with value: 0.729913.[0m
[32m[I 2023-02-27 13:58:41,909][0m Trial 8 finished with value: 0.3782834802287911 and parameters: {'gnb_var_smoothing': 35.31442825276321}. Best is trial 1 with value: 0.729913.[0m
[32m[I 2023-02-27 13:58:44,802][0m Trial 9 finished with value: 0.3782834802287911 and parameters: {'gnb_var_smoothing': 108.60523835401264}. Best is trial 1 with value: 0.729913.[0m
[32m[I 2023-02-27 13:58:47,850][0m Trial 10 finished with value: 0.7304411690346619 and parameters: {'gnb_var_smoothing': 1.6947648718129469e-06}. Best is trial 10 with value: 0.730441.[0m
[32m[I 2023-02-27 13:58:50,976][0m Trial 11 finished with value: 0.7303798076280322 and parameters: {'gnb_var_smoothing': 2.734413398748624e-07}. Best is trial 10 with value: 0.730441.[0m
[32m[I 2023-02-27 13:58:54,118][0m Trial 12 finished with value: 0.723849869296919 and parameters: {'gnb_var_smoothing': 1.4784303234521006e-08}. Best is trial 10 with value: 0.730441.[0m
[32m[I 2023-02-27 13:58:57,123][0m Trial 13 finished with value: 0.6958395949950547 and parameters: {'gnb_var_smoothing': 0.0003636286603757634}. Best is trial 10 with value: 0.730441.[0m
[32m[I 2023-02-27 13:59:00,314][0m Trial 14 finished with value: 0.6766157373904056 and parameters: {'gnb_var_smoothing': 4.031787386827737e-10}. Best is trial 10 with value: 0.730441.[0m
[32m[I 2023-02-27 13:59:03,342][0m Trial 15 finished with value: 0.7103889083295533 and parameters: {'gnb_var_smoothing': 8.800085286678416e-06}. Best is trial 10 with value: 0.730441.[0m
[32m[I 2023-02-27 13:59:06,514][0m Trial 16 finished with value: 0.7053189512936093 and parameters: {'gnb_var_smoothing': 1.1246888268360612e-08}. Best is trial 10 with value: 0.730441.[0m
[32m[I 2023-02-27 13:59:09,532][0m Trial 17 finished with value: 0.6858032248471475 and parameters: {'gnb_var_smoothing': 0.014742148455895965}. Best is trial 10 with value: 0.730441.[0m
[32m[I 2023-02-27 13:59:12,564][0m Trial 18 finished with value: 0.711796090774344 and parameters: {'gnb_var_smoothing': 7.925826545592521e-06}. Best is trial 10 with value: 0.730441.[0m
[32m[I 2023-02-27 13:59:15,752][0m Trial 19 finished with value: 0.6914480308346275 and parameters: {'gnb_var_smoothing': 1.3607102954303245e-09}. Best is trial 10 with value: 0.730441.[0m
[32m[I 2023-02-27 13:59:15,815][0m Study finished.[0m
[32m[I 2023-02-27 13:59:15,846][0m --------------------------------------------------------------------------------[0m
[32m[I 2023-02-27 13:59:15,846][0m --------------------     HistGradientBoostingClassifier     --------------------[0m
[32m[I 2023-02-27 13:59:15,846][0m --------------------------------------------------------------------------------[0m
[32m[I 2023-02-27 13:59:15,877][0m A new study created in RDB with name: HistGradientBoostingClassifier_0a1486bb[0m
[32m[I 2023-02-27 13:59:15,877][0m Study started.[0m
[32m[I 2023-02-27 14:16:07,963][0m Trial 0 finished with value: 0.9890311222408598 and parameters: {'hgbc_learning_rate': 0.002205517133076708, 'hgbc_max_iter': 2000, 'hgbc_min_samples_leaf': 31, 'hgbc_l2_regularization': 0.6000000000000001, 'hgbc_max_bins': 127, 'hgbc_early_stopping': True, 'hgbc_validation_fraction': 0.25, 'hgbc_n_iter_no_change': 10}. Best is trial 0 with value: 0.989031.[0m
[32m[I 2023-02-27 14:36:14,588][0m Trial 1 finished with value: 0.9914943329314405 and parameters: {'hgbc_learning_rate': 0.011204797207274362, 'hgbc_max_iter': 2000, 'hgbc_min_samples_leaf': 39, 'hgbc_l2_regularization': 1.0, 'hgbc_max_bins': 255, 'hgbc_early_stopping': True, 'hgbc_validation_fraction': 0.25, 'hgbc_n_iter_no_change': 10}. Best is trial 1 with value: 0.991494.[0m
