[32m[I 2023-02-27 11:41:11,856][0m Trial 9 finished with value: 0.917267375852721 and parameters: {'brf_n_estimators': 200, 'brf_criterion': 'gini', 'brf_min_samples_split': 34, 'brf_min_samples_leaf': 10, 'brf_max_features': 7, 'brf_bootstrap': False}. Best is trial 5 with value: 0.935156.[0m
[32m[I 2023-02-27 11:42:06,265][0m sklearn.ensemble.RandomForestClassifier.predict: fallback to original Scikit-learn[0m
[32m[I 2023-02-27 11:42:06,265][0m sklearn.ensemble.RandomForestClassifier.predict_proba: fallback to original Scikit-learn[0m
[32m[I 2023-02-27 11:42:14,498][0m Trial 10 finished with value: 0.9298599178605945 and parameters: {'brf_n_estimators': 140, 'brf_criterion': 'entropy', 'brf_min_samples_split': 50, 'brf_min_samples_leaf': 1, 'brf_max_features': 2, 'brf_bootstrap': False}. Best is trial 5 with value: 0.935156.[0m
[32m[I 2023-02-27 11:43:08,888][0m sklearn.ensemble.RandomForestClassifier.predict: fallback to original Scikit-learn[0m
[32m[I 2023-02-27 11:43:08,888][0m sklearn.ensemble.RandomForestClassifier.predict_proba: fallback to original Scikit-learn[0m
[32m[I 2023-02-27 11:43:17,213][0m Trial 11 finished with value: 0.9283087267320046 and parameters: {'brf_n_estimators': 140, 'brf_criterion': 'entropy', 'brf_min_samples_split': 50, 'brf_min_samples_leaf': 1, 'brf_max_features': 1, 'brf_bootstrap': False}. Best is trial 5 with value: 0.935156.[0m
[32m[I 2023-02-27 11:44:22,821][0m sklearn.ensemble.RandomForestClassifier.predict: fallback to original Scikit-learn[0m
[32m[I 2023-02-27 11:44:22,821][0m sklearn.ensemble.RandomForestClassifier.predict_proba: fallback to original Scikit-learn[0m
[32m[I 2023-02-27 11:44:30,354][0m Trial 12 finished with value: 0.8211253984405582 and parameters: {'brf_n_estimators': 170, 'brf_criterion': 'entropy', 'brf_min_samples_split': 43, 'brf_min_samples_leaf': 30, 'brf_max_features': 1, 'brf_bootstrap': False}. Best is trial 5 with value: 0.935156.[0m
[32m[I 2023-02-27 11:45:48,364][0m sklearn.ensemble.RandomForestClassifier.predict: fallback to original Scikit-learn[0m
[32m[I 2023-02-27 11:45:48,364][0m sklearn.ensemble.RandomForestClassifier.predict_proba: fallback to original Scikit-learn[0m
[32m[I 2023-02-27 11:45:58,844][0m Trial 13 finished with value: 0.9293775261728089 and parameters: {'brf_n_estimators': 200, 'brf_criterion': 'entropy', 'brf_min_samples_split': 31, 'brf_min_samples_leaf': 4, 'brf_max_features': 7, 'brf_bootstrap': False}. Best is trial 5 with value: 0.935156.[0m
[32m[I 2023-02-27 11:46:42,004][0m sklearn.ensemble.RandomForestClassifier.predict: fallback to original Scikit-learn[0m
[32m[I 2023-02-27 11:46:42,004][0m sklearn.ensemble.RandomForestClassifier.predict_proba: fallback to original Scikit-learn[0m
[32m[I 2023-02-27 11:46:48,376][0m Trial 14 finished with value: 0.9368230403299036 and parameters: {'brf_n_estimators': 110, 'brf_criterion': 'entropy', 'brf_min_samples_split': 44, 'brf_min_samples_leaf': 1, 'brf_max_features': 10, 'brf_bootstrap': False}. Best is trial 14 with value: 0.936823.[0m
[32m[I 2023-02-27 11:47:31,533][0m sklearn.ensemble.RandomForestClassifier.predict: fallback to original Scikit-learn[0m
[32m[I 2023-02-27 11:47:31,533][0m sklearn.ensemble.RandomForestClassifier.predict_proba: fallback to original Scikit-learn[0m
[32m[I 2023-02-27 11:47:37,790][0m Trial 15 finished with value: 0.9285488376381448 and parameters: {'brf_n_estimators': 110, 'brf_criterion': 'entropy', 'brf_min_samples_split': 42, 'brf_min_samples_leaf': 7, 'brf_max_features': 10, 'brf_bootstrap': False}. Best is trial 14 with value: 0.936823.[0m
[32m[I 2023-02-27 11:48:21,712][0m sklearn.ensemble.RandomForestClassifier.predict: fallback to original Scikit-learn[0m
[32m[I 2023-02-27 11:48:21,728][0m sklearn.ensemble.RandomForestClassifier.predict_proba: fallback to original Scikit-learn[0m
[32m[I 2023-02-27 11:48:27,950][0m Trial 16 finished with value: 0.9164999352127045 and parameters: {'brf_n_estimators': 110, 'brf_criterion': 'entropy', 'brf_min_samples_split': 32, 'brf_min_samples_leaf': 21, 'brf_max_features': 21, 'brf_bootstrap': False}. Best is trial 14 with value: 0.936823.[0m
[32m[I 2023-02-27 11:48:47,804][0m sklearn.ensemble.RandomForestClassifier.predict: fallback to original Scikit-learn[0m
[32m[I 2023-02-27 11:48:47,820][0m sklearn.ensemble.RandomForestClassifier.predict_proba: fallback to original Scikit-learn[0m
[32m[I 2023-02-27 11:48:51,402][0m Trial 17 finished with value: 0.9006442878975175 and parameters: {'brf_n_estimators': 50, 'brf_criterion': 'entropy', 'brf_min_samples_split': 45, 'brf_min_samples_leaf': 38, 'brf_max_features': 12, 'brf_bootstrap': False}. Best is trial 14 with value: 0.936823.[0m
[32m[I 2023-02-27 11:49:34,281][0m sklearn.ensemble.RandomForestClassifier.predict: fallback to original Scikit-learn[0m
[32m[I 2023-02-27 11:49:34,281][0m sklearn.ensemble.RandomForestClassifier.predict_proba: fallback to original Scikit-learn[0m
[32m[I 2023-02-27 11:49:40,611][0m Trial 18 finished with value: 0.9094518146005195 and parameters: {'brf_n_estimators': 110, 'brf_criterion': 'entropy', 'brf_min_samples_split': 25, 'brf_min_samples_leaf': 6, 'brf_max_features': 7, 'brf_bootstrap': True}. Best is trial 14 with value: 0.936823.[0m
[32m[I 2023-02-27 11:50:39,047][0m sklearn.ensemble.RandomForestClassifier.predict: fallback to original Scikit-learn[0m
[32m[I 2023-02-27 11:50:39,047][0m sklearn.ensemble.RandomForestClassifier.predict_proba: fallback to original Scikit-learn[0m
[32m[I 2023-02-27 11:50:46,996][0m Trial 19 finished with value: 0.908999709418564 and parameters: {'brf_n_estimators': 150, 'brf_criterion': 'entropy', 'brf_min_samples_split': 36, 'brf_min_samples_leaf': 15, 'brf_max_features': 5, 'brf_bootstrap': False}. Best is trial 14 with value: 0.936823.[0m
[32m[I 2023-02-27 11:50:47,059][0m Study finished.[0m
[32m[I 2023-02-27 11:50:47,090][0m --------------------------------------------------------------------------------[0m
[32m[I 2023-02-27 11:50:47,090][0m --------------------              BernoulliNB               --------------------[0m
[32m[I 2023-02-27 11:50:47,090][0m --------------------------------------------------------------------------------[0m
[32m[I 2023-02-27 11:50:47,106][0m A new study created in RDB with name: BernoulliNB_0a1486bb[0m
[32m[I 2023-02-27 11:50:47,121][0m Study started.[0m
[32m[I 2023-02-27 11:50:50,101][0m Trial 0 finished with value: 0.5357813804376615 and parameters: {'bnb_alpha': 0.9, 'bnb_binarize': 0.15000000000000002, 'bnb_fit_prior': False}. Best is trial 0 with value: 0.535781.[0m
[32m[I 2023-02-27 11:50:53,165][0m Trial 1 finished with value: 0.5370240154591481 and parameters: {'bnb_alpha': 0.6000000000000001, 'bnb_binarize': 0.2, 'bnb_fit_prior': False}. Best is trial 1 with value: 0.537024.[0m
[32m[I 2023-02-27 11:50:56,119][0m Trial 2 finished with value: 0.9138573667164109 and parameters: {'bnb_alpha': 0.8, 'bnb_binarize': 0.2, 'bnb_fit_prior': True}. Best is trial 2 with value: 0.913857.[0m
[32m[I 2023-02-27 11:50:59,086][0m Trial 3 finished with value: 0.9137997904136999 and parameters: {'bnb_alpha': 1.0, 'bnb_binarize': 0.25, 'bnb_fit_prior': True}. Best is trial 2 with value: 0.913857.[0m
[32m[I 2023-02-27 11:51:02,108][0m Trial 4 finished with value: 0.5357813804376615 and parameters: {'bnb_alpha': 0.8, 'bnb_binarize': 0.05, 'bnb_fit_prior': False}. Best is trial 2 with value: 0.913857.[0m
[32m[I 2023-02-27 11:51:05,131][0m Trial 5 finished with value: 0.5370328946279649 and parameters: {'bnb_alpha': 0.25, 'bnb_binarize': 0.9500000000000001, 'bnb_fit_prior': False}. Best is trial 2 with value: 0.913857.[0m
[32m[I 2023-02-27 11:51:08,083][0m Trial 6 finished with value: 0.9138573667164109 and parameters: {'bnb_alpha': 0.7000000000000001, 'bnb_binarize': 0.05, 'bnb_fit_prior': True}. Best is trial 2 with value: 0.913857.[0m
[32m[I 2023-02-27 11:51:11,054][0m Trial 7 finished with value: 0.9137997904136999 and parameters: {'bnb_alpha': 1.0, 'bnb_binarize': 0.55, 'bnb_fit_prior': True}. Best is trial 2 with value: 0.913857.[0m
[32m[I 2023-02-27 11:51:14,071][0m Trial 8 finished with value: 0.5357813804376615 and parameters: {'bnb_alpha': 0.9500000000000001, 'bnb_binarize': 0.6000000000000001, 'bnb_fit_prior': False}. Best is trial 2 with value: 0.913857.[0m
[32m[I 2023-02-27 11:51:17,116][0m Trial 9 finished with value: 0.5370240154591481 and parameters: {'bnb_alpha': 0.6000000000000001, 'bnb_binarize': 0.4, 'bnb_fit_prior': False}. Best is trial 2 with value: 0.913857.[0m
[32m[I 2023-02-27 11:51:20,096][0m Trial 10 finished with value: 0.9138639484812452 and parameters: {'bnb_alpha': 0.35000000000000003, 'bnb_binarize': 0.8, 'bnb_fit_prior': True}. Best is trial 10 with value: 0.913864.[0m
[32m[I 2023-02-27 11:51:23,070][0m Trial 11 finished with value: 0.913865047750881 and parameters: {'bnb_alpha': 0.30000000000000004, 'bnb_binarize': 0.8500000000000001, 'bnb_fit_prior': True}. Best is trial 11 with value: 0.913865.[0m
[32m[I 2023-02-27 11:51:26,061][0m Trial 12 finished with value: 0.913865047750881 and parameters: {'bnb_alpha': 0.30000000000000004, 'bnb_binarize': 0.8500000000000001, 'bnb_fit_prior': True}. Best is trial 11 with value: 0.913865.[0m
[32m[I 2023-02-27 11:51:28,997][0m Trial 13 finished with value: 0.7679292497544551 and parameters: {'bnb_alpha': 0.05, 'bnb_binarize': 1.0, 'bnb_fit_prior': True}. Best is trial 11 with value: 0.913865.[0m
[32m[I 2023-02-27 11:51:31,971][0m Trial 14 finished with value: 0.9138639484812452 and parameters: {'bnb_alpha': 0.35000000000000003, 'bnb_binarize': 0.75, 'bnb_fit_prior': True}. Best is trial 11 with value: 0.913865.[0m
[32m[I 2023-02-27 11:51:34,950][0m Trial 15 finished with value: 0.9138767903578751 and parameters: {'bnb_alpha': 0.15000000000000002, 'bnb_binarize': 0.8, 'bnb_fit_prior': True}. Best is trial 15 with value: 0.913877.[0m
[32m[I 2023-02-27 11:51:37,740][0m Trial 16 finished with value: 0.1923821603729616 and parameters: {'bnb_alpha': 0.0, 'bnb_binarize': 0.7000000000000001, 'bnb_fit_prior': True}. Best is trial 15 with value: 0.913877.[0m
[32m[I 2023-02-27 11:51:40,701][0m Trial 17 finished with value: 0.9138767903578751 and parameters: {'bnb_alpha': 0.15000000000000002, 'bnb_binarize': 0.45, 'bnb_fit_prior': True}. Best is trial 17 with value: 0.913877.[0m
[32m[I 2023-02-27 11:51:43,663][0m Trial 18 finished with value: 0.9138767903578751 and parameters: {'bnb_alpha': 0.15000000000000002, 'bnb_binarize': 0.45, 'bnb_fit_prior': True}. Best is trial 18 with value: 0.913877.[0m
[32m[I 2023-02-27 11:51:46,634][0m Trial 19 finished with value: 0.9138628498816691 and parameters: {'bnb_alpha': 0.45, 'bnb_binarize': 0.65, 'bnb_fit_prior': True}. Best is trial 15 with value: 0.913877.[0m
[32m[I 2023-02-27 11:51:46,696][0m Study finished.[0m
[32m[I 2023-02-27 11:51:46,727][0m --------------------------------------------------------------------------------[0m
[32m[I 2023-02-27 11:51:46,727][0m --------------------              CDClassifier              --------------------[0m
[32m[I 2023-02-27 11:51:46,727][0m --------------------------------------------------------------------------------[0m
[32m[I 2023-02-27 11:51:46,743][0m A new study created in RDB with name: CDClassifier_0a1486bb[0m
[32m[I 2023-02-27 11:51:46,758][0m Study started.[0m
[32m[I 2023-02-27 11:53:11,931][0m Trial 0 finished with value: 0.8767414665604076 and parameters: {'cdc_loss': 'squared', 'cdc_penalty': 'l2', 'cdc_C': 0.5233838088761806, 'cdc_alpha': 0.9497026777112052, 'cdc_selection': 'uniform'}. Best is trial 0 with value: 0.876741.[0m
[32m[I 2023-02-27 11:53:22,532][0m Trial 1 finished with value: 0.8346559002270241 and parameters: {'cdc_loss': 'log', 'cdc_penalty': 'l1/l2', 'cdc_C': 0.02172882762080951, 'cdc_alpha': 0.11342703467619458, 'cdc_selection': 'uniform'}. Best is trial 0 with value: 0.876741.[0m
[32m[I 2023-02-27 11:53:33,922][0m Trial 2 finished with value: 0.7484817914123473 and parameters: {'cdc_loss': 'modified_huber', 'cdc_penalty': 'l1/l2', 'cdc_C': 78.92419223283105, 'cdc_alpha': 0.05979422826637841, 'cdc_selection': 'uniform'}. Best is trial 0 with value: 0.876741.[0m
[32m[I 2023-02-27 11:54:59,061][0m Trial 3 finished with value: 0.8767224827999393 and parameters: {'cdc_loss': 'squared', 'cdc_penalty': 'l2', 'cdc_C': 0.041414787979453964, 'cdc_alpha': 2.524154214096295, 'cdc_selection': 'uniform'}. Best is trial 0 with value: 0.876741.[0m
[32m[I 2023-02-27 12:00:44,754][0m Trial 4 finished with value: 0.9307144677576265 and parameters: {'cdc_loss': 'log', 'cdc_penalty': 'l1', 'cdc_C': 6.027311093682369, 'cdc_alpha': 44.422503204648955, 'cdc_selection': 'cyclic'}. Best is trial 4 with value: 0.930714.[0m
[32m[I 2023-02-27 12:02:23,911][0m Trial 5 finished with value: 0.9281813882596263 and parameters: {'cdc_loss': 'modified_huber', 'cdc_penalty': 'l1', 'cdc_C': 0.1273405557447785, 'cdc_alpha': 10.783235962271684, 'cdc_selection': 'cyclic'}. Best is trial 4 with value: 0.930714.[0m
[32m[I 2023-02-27 12:07:00,402][0m Trial 6 finished with value: 0.9140943218841712 and parameters: {'cdc_loss': 'squared_hinge', 'cdc_penalty': 'l1/l2', 'cdc_C': 5.7968817607785645, 'cdc_alpha': 43.01001068765405, 'cdc_selection': 'cyclic'}. Best is trial 4 with value: 0.930714.[0m
[32m[I 2023-02-27 12:10:08,282][0m Trial 7 finished with value: 0.9207848103067401 and parameters: {'cdc_loss': 'log', 'cdc_penalty': 'l1', 'cdc_C': 0.38416085710128295, 'cdc_alpha': 259.32241177481825, 'cdc_selection': 'uniform'}. Best is trial 4 with value: 0.930714.[0m
[32m[I 2023-02-27 12:14:41,505][0m Trial 8 finished with value: 0.9219962042449372 and parameters: {'cdc_loss': 'squared_hinge', 'cdc_penalty': 'l1/l2', 'cdc_C': 0.6054553104153347, 'cdc_alpha': 0.035646079978538164, 'cdc_selection': 'cyclic'}. Best is trial 4 with value: 0.930714.[0m
[32m[I 2023-02-27 12:19:55,553][0m Trial 9 finished with value: 0.9305076408577355 and parameters: {'cdc_loss': 'log', 'cdc_penalty': 'l1', 'cdc_C': 0.021844973039522545, 'cdc_alpha': 0.4422359066263867, 'cdc_selection': 'cyclic'}. Best is trial 4 with value: 0.930714.[0m
[32m[I 2023-02-27 12:24:50,892][0m Trial 10 finished with value: 0.41846681909711536 and parameters: {'cdc_loss': 'log', 'cdc_penalty': 'l1', 'cdc_C': 0.0017982293587879383, 'cdc_alpha': 0.0017827229015277243, 'cdc_selection': 'cyclic'}. Best is trial 4 with value: 0.930714.[0m
[32m[I 2023-02-27 12:29:38,069][0m Trial 11 finished with value: 0.9303855652009959 and parameters: {'cdc_loss': 'log', 'cdc_penalty': 'l1', 'cdc_C': 21.312475794900568, 'cdc_alpha': 965.5234795572792, 'cdc_selection': 'cyclic'}. Best is trial 4 with value: 0.930714.[0m
[32m[I 2023-02-27 12:34:54,233][0m Trial 12 finished with value: 0.9320829831945606 and parameters: {'cdc_loss': 'log', 'cdc_penalty': 'l1', 'cdc_C': 0.0018642427711093204, 'cdc_alpha': 0.4494012163709551, 'cdc_selection': 'cyclic'}. Best is trial 12 with value: 0.932083.[0m
[32m[I 2023-02-27 12:40:15,914][0m Trial 13 finished with value: 0.9307410708357838 and parameters: {'cdc_loss': 'log', 'cdc_penalty': 'l1', 'cdc_C': 500.6050597772124, 'cdc_alpha': 27.053657601783303, 'cdc_selection': 'cyclic'}. Best is trial 12 with value: 0.932083.[0m
[32m[I 2023-02-27 12:45:39,838][0m Trial 14 finished with value: 0.9307474895519288 and parameters: {'cdc_loss': 'log', 'cdc_penalty': 'l1', 'cdc_C': 929.5274470231174, 'cdc_alpha': 6.299027085610436, 'cdc_selection': 'cyclic'}. Best is trial 12 with value: 0.932083.[0m
[32m[I 2023-02-27 12:51:16,140][0m Trial 15 finished with value: 0.9304362829622211 and parameters: {'cdc_loss': 'log', 'cdc_penalty': 'l1', 'cdc_C': 0.0013657631529012638, 'cdc_alpha': 0.005810347839778056, 'cdc_selection': 'cyclic'}. Best is trial 12 with value: 0.932083.[0m
[32m[I 2023-02-27 12:53:20,117][0m Trial 16 finished with value: 0.9260754918452708 and parameters: {'cdc_loss': 'modified_huber', 'cdc_penalty': 'l2', 'cdc_C': 918.3151489406331, 'cdc_alpha': 4.356415228726938, 'cdc_selection': 'cyclic'}. Best is trial 12 with value: 0.932083.[0m
[32m[I 2023-02-27 12:53:20,164][0m Study finished.[0m
[32m[I 2023-02-27 12:53:20,195][0m --------------------------------------------------------------------------------[0m
[32m[I 2023-02-27 12:53:20,195][0m --------------------              ComplementNB              --------------------[0m
[32m[I 2023-02-27 12:53:20,195][0m --------------------------------------------------------------------------------[0m
[32m[I 2023-02-27 12:53:20,227][0m A new study created in RDB with name: ComplementNB_0a1486bb[0m
[32m[I 2023-02-27 12:53:20,227][0m Study started.[0m
[32m[I 2023-02-27 12:53:22,763][0m Trial 0 finished with value: 0.6275937817993288 and parameters: {'compnb_alpha': 0.75, 'compnb_fit_prior': False, 'compnb_norm': False}. Best is trial 0 with value: 0.627594.[0m
[32m[I 2023-02-27 12:53:25,394][0m Trial 1 finished with value: 0.5928663457925565 and parameters: {'compnb_alpha': 0.5, 'compnb_fit_prior': False, 'compnb_norm': True}. Best is trial 0 with value: 0.627594.[0m
[32m[I 2023-02-27 12:53:27,995][0m Trial 2 finished with value: 0.6275937817993288 and parameters: {'compnb_alpha': 1.0, 'compnb_fit_prior': False, 'compnb_norm': False}. Best is trial 0 with value: 0.627594.[0m
[32m[I 2023-02-27 12:53:30,628][0m Trial 3 finished with value: 0.589182709021444 and parameters: {'compnb_alpha': 0.30000000000000004, 'compnb_fit_prior': True, 'compnb_norm': True}. Best is trial 0 with value: 0.627594.[0m
[32m[I 2023-02-27 12:53:33,216][0m Trial 4 finished with value: 0.6275937817993288 and parameters: {'compnb_alpha': 0.9500000000000001, 'compnb_fit_prior': True, 'compnb_norm': False}. Best is trial 0 with value: 0.627594.[0m
[32m[I 2023-02-27 12:53:35,848][0m Trial 5 finished with value: 0.5753555746748803 and parameters: {'compnb_alpha': 0.05, 'compnb_fit_prior': False, 'compnb_norm': True}. Best is trial 0 with value: 0.627594.[0m
[32m[I 2023-02-27 12:53:38,437][0m Trial 6 finished with value: 0.5970824756388747 and parameters: {'compnb_alpha': 0.9, 'compnb_fit_prior': True, 'compnb_norm': True}. Best is trial 0 with value: 0.627594.[0m
[32m[I 2023-02-27 12:53:41,068][0m Trial 7 finished with value: 0.5921038979498272 and parameters: {'compnb_alpha': 0.45, 'compnb_fit_prior': False, 'compnb_norm': True}. Best is trial 0 with value: 0.627594.[0m
[32m[I 2023-02-27 12:53:43,651][0m Trial 8 finished with value: 0.6275937817993288 and parameters: {'compnb_alpha': 0.30000000000000004, 'compnb_fit_prior': False, 'compnb_norm': False}. Best is trial 0 with value: 0.627594.[0m
[32m[I 2023-02-27 12:53:46,251][0m Trial 9 finished with value: 0.6275937817993288 and parameters: {'compnb_alpha': 0.55, 'compnb_fit_prior': True, 'compnb_norm': False}. Best is trial 0 with value: 0.627594.[0m
[32m[I 2023-02-27 12:53:48,835][0m Trial 10 finished with value: 0.6275937817993288 and parameters: {'compnb_alpha': 0.75, 'compnb_fit_prior': False, 'compnb_norm': False}. Best is trial 0 with value: 0.627594.[0m
[32m[I 2023-02-27 12:53:51,430][0m Trial 11 finished with value: 0.6275937817993288 and parameters: {'compnb_alpha': 0.75, 'compnb_fit_prior': False, 'compnb_norm': False}. Best is trial 0 with value: 0.627594.[0m
[32m[I 2023-02-27 12:53:54,018][0m Trial 12 finished with value: 0.6275937817993288 and parameters: {'compnb_alpha': 1.0, 'compnb_fit_prior': False, 'compnb_norm': False}. Best is trial 0 with value: 0.627594.[0m
[32m[I 2023-02-27 12:53:56,603][0m Trial 13 finished with value: 0.6275937817993288 and parameters: {'compnb_alpha': 0.75, 'compnb_fit_prior': False, 'compnb_norm': False}. Best is trial 0 with value: 0.627594.[0m
[32m[I 2023-02-27 12:53:59,202][0m Trial 14 finished with value: 0.6275937817993288 and parameters: {'compnb_alpha': 0.8, 'compnb_fit_prior': False, 'compnb_norm': False}. Best is trial 0 with value: 0.627594.[0m
[32m[I 2023-02-27 12:54:01,798][0m Trial 15 finished with value: 0.6275937817993288 and parameters: {'compnb_alpha': 0.6000000000000001, 'compnb_fit_prior': False, 'compnb_norm': False}. Best is trial 0 with value: 0.627594.[0m
[32m[I 2023-02-27 12:54:04,398][0m Trial 16 finished with value: 0.6275937817993288 and parameters: {'compnb_alpha': 0.8500000000000001, 'compnb_fit_prior': False, 'compnb_norm': False}. Best is trial 0 with value: 0.627594.[0m
[32m[I 2023-02-27 12:54:06,993][0m Trial 17 finished with value: 0.6275937817993288 and parameters: {'compnb_alpha': 0.65, 'compnb_fit_prior': False, 'compnb_norm': False}. Best is trial 0 with value: 0.627594.[0m
[32m[I 2023-02-27 12:54:09,587][0m Trial 18 finished with value: 0.6275937817993288 and parameters: {'compnb_alpha': 0.6000000000000001, 'compnb_fit_prior': True, 'compnb_norm': False}. Best is trial 0 with value: 0.627594.[0m
[32m[I 2023-02-27 12:54:12,166][0m Trial 19 finished with value: 0.6275937817993288 and parameters: {'compnb_alpha': 0.8500000000000001, 'compnb_fit_prior': False, 'compnb_norm': False}. Best is trial 0 with value: 0.627594.[0m
[32m[I 2023-02-27 12:54:12,213][0m Study finished.[0m
[32m[I 2023-02-27 12:54:12,244][0m --------------------------------------------------------------------------------[0m
[32m[I 2023-02-27 12:54:12,244][0m --------------------         DecisionTreeClassifier         --------------------[0m
[32m[I 2023-02-27 12:54:12,244][0m --------------------------------------------------------------------------------[0m
[32m[I 2023-02-27 12:54:12,276][0m A new study created in RDB with name: DecisionTreeClassifier_0a1486bb[0m
[32m[I 2023-02-27 12:54:12,291][0m Study started.[0m
