[32m[I 2023-02-27 10:25:20,170][0m Optimization for 30 classifiers started.[0m
[32m[I 2023-02-27 10:25:22,140][0m X_train shape: (2096537, 25); y_train shape: (2096537,); y_train unique values: {0, 1, 2, 3, 4, 5, 6, 7, 8, 9, 10}[0m
[32m[I 2023-02-27 10:25:22,171][0m X_test shape: (524134, 25); y_test shape: (524134,); y_test unique values: {0, 1, 2, 3, 4, 5, 6, 7, 8, 9, 10}[0m
[32m[I 2023-02-27 10:25:22,171][0m --------------------------------------------------------------------------------[0m
[32m[I 2023-02-27 10:25:22,171][0m --------------------           AdaBoostClassifier           --------------------[0m
[32m[I 2023-02-27 10:25:22,171][0m --------------------------------------------------------------------------------[0m
[32m[I 2023-02-27 10:25:22,234][0m A new study created in RDB with name: AdaBoostClassifier_0a1486bb[0m
[32m[I 2023-02-27 10:25:22,249][0m Study started.[0m
[32m[I 2023-02-27 10:27:31,430][0m Trial 0 finished with value: 0.9255256848677087 and parameters: {'abc_n_estimators': 70, 'abc_learning_rate': 0.018683665798922625}. Best is trial 0 with value: 0.925526.[0m
[32m[I 2023-02-27 10:29:59,387][0m Trial 1 finished with value: 0.8339473320112101 and parameters: {'abc_n_estimators': 80, 'abc_learning_rate': 6.4982245907931205e-06}. Best is trial 0 with value: 0.925526.[0m
[32m[I 2023-02-27 10:31:04,887][0m Trial 2 finished with value: 0.8424559088988979 and parameters: {'abc_n_estimators': 35, 'abc_learning_rate': 0.013787897845768173}. Best is trial 0 with value: 0.925526.[0m
[32m[I 2023-02-27 10:34:08,746][0m Trial 3 finished with value: 0.40934626448708655 and parameters: {'abc_n_estimators': 100, 'abc_learning_rate': 0.3239652961898604}. Best is trial 0 with value: 0.925526.[0m
[32m[I 2023-02-27 10:36:08,633][0m Trial 4 finished with value: 0.8833913485086623 and parameters: {'abc_n_estimators': 65, 'abc_learning_rate': 0.009319668721382223}. Best is trial 0 with value: 0.925526.[0m
[32m[I 2023-02-27 10:37:50,894][0m Trial 5 finished with value: 0.8339473320112101 and parameters: {'abc_n_estimators': 55, 'abc_learning_rate': 0.0004618821726260958}. Best is trial 0 with value: 0.925526.[0m
[32m[I 2023-02-27 10:40:26,721][0m Trial 6 finished with value: 0.4427957880426066 and parameters: {'abc_n_estimators': 85, 'abc_learning_rate': 0.08163709572786197}. Best is trial 0 with value: 0.925526.[0m
[32m[I 2023-02-27 10:43:13,332][0m Trial 7 finished with value: 0.8339473320112101 and parameters: {'abc_n_estimators': 90, 'abc_learning_rate': 2.5354740609260883e-06}. Best is trial 0 with value: 0.925526.[0m
[32m[I 2023-02-27 10:44:00,289][0m Trial 8 finished with value: 0.8339473320112101 and parameters: {'abc_n_estimators': 25, 'abc_learning_rate': 3.585304339919544e-05}. Best is trial 0 with value: 0.925526.[0m
[32m[I 2023-02-27 10:46:26,754][0m Trial 9 finished with value: 0.8339473320112101 and parameters: {'abc_n_estimators': 80, 'abc_learning_rate': 4.746977814715944e-05}. Best is trial 0 with value: 0.925526.[0m
[32m[I 2023-02-27 10:48:08,751][0m Trial 10 finished with value: 0.8339473320112101 and parameters: {'abc_n_estimators': 55, 'abc_learning_rate': 0.0013929956701643712}. Best is trial 0 with value: 0.925526.[0m
[32m[I 2023-02-27 10:50:08,856][0m Trial 11 finished with value: 0.92449584313345 and parameters: {'abc_n_estimators': 65, 'abc_learning_rate': 0.013378047007631361}. Best is trial 0 with value: 0.925526.[0m
[32m[I 2023-02-27 10:52:08,481][0m Trial 12 finished with value: 0.9255256848677087 and parameters: {'abc_n_estimators': 65, 'abc_learning_rate': 0.01984723255654258}. Best is trial 0 with value: 0.925526.[0m
[32m[I 2023-02-27 10:53:31,775][0m Trial 13 finished with value: 0.40934626448708655 and parameters: {'abc_n_estimators': 45, 'abc_learning_rate': 0.3352710796356253}. Best is trial 0 with value: 0.925526.[0m
[32m[I 2023-02-27 10:55:41,227][0m Trial 14 finished with value: 0.8424105923030978 and parameters: {'abc_n_estimators': 70, 'abc_learning_rate': 0.0017858724187483506}. Best is trial 0 with value: 0.925526.[0m
[32m[I 2023-02-27 10:57:13,330][0m Trial 15 finished with value: 0.9265860394112988 and parameters: {'abc_n_estimators': 50, 'abc_learning_rate': 0.06244580248411956}. Best is trial 15 with value: 0.926586.[0m
[32m[I 2023-02-27 10:58:36,121][0m Trial 16 finished with value: 0.8776094705272978 and parameters: {'abc_n_estimators': 45, 'abc_learning_rate': 0.8714620087621756}. Best is trial 15 with value: 0.926586.[0m
[32m[I 2023-02-27 11:00:08,277][0m Trial 17 finished with value: 0.9265917411048408 and parameters: {'abc_n_estimators': 50, 'abc_learning_rate': 0.05026234183366735}. Best is trial 17 with value: 0.926592.[0m
[32m[I 2023-02-27 11:01:31,709][0m Trial 18 finished with value: 0.8846172595093726 and parameters: {'abc_n_estimators': 45, 'abc_learning_rate': 0.0888323384922501}. Best is trial 17 with value: 0.926592.[0m
[32m[I 2023-02-27 11:02:37,252][0m Trial 19 finished with value: 0.8339473320112101 and parameters: {'abc_n_estimators': 35, 'abc_learning_rate': 0.0003108310026923598}. Best is trial 17 with value: 0.926592.[0m
[32m[I 2023-02-27 11:02:37,314][0m Study finished.[0m
[32m[I 2023-02-27 11:02:37,345][0m --------------------------------------------------------------------------------[0m
[32m[I 2023-02-27 11:02:37,345][0m --------------------           AdaGradClassifier            --------------------[0m
[32m[I 2023-02-27 11:02:37,345][0m --------------------------------------------------------------------------------[0m
[32m[I 2023-02-27 11:02:37,377][0m A new study created in RDB with name: AdaGradClassifier_0a1486bb[0m
[32m[I 2023-02-27 11:02:37,377][0m Study started.[0m
[32m[I 2023-02-27 11:03:40,610][0m Trial 0 finished with value: 0.68517527328568 and parameters: {'agc_alpha': 178.2798936629956, 'agc_l1_ratio': 0.5, 'agc_loss': 'squared_hinge'}. Best is trial 0 with value: 0.685175.[0m
[32m[I 2023-02-27 11:04:42,549][0m Trial 1 finished with value: 0.7791736843126927 and parameters: {'agc_alpha': 4.275683988709216, 'agc_l1_ratio': 0.5, 'agc_loss': 'modified_huber'}. Best is trial 1 with value: 0.779174.[0m
[32m[I 2023-02-27 11:05:58,702][0m Trial 2 finished with value: 0.7676613922113117 and parameters: {'agc_alpha': 3.371649466322001, 'agc_l1_ratio': 0.4, 'agc_loss': 'log'}. Best is trial 1 with value: 0.779174.[0m
[32m[I 2023-02-27 11:07:02,576][0m Trial 3 finished with value: 0.15445336745664517 and parameters: {'agc_alpha': 781.5198116100438, 'agc_l1_ratio': 0.7000000000000001, 'agc_loss': 'perceptron'}. Best is trial 1 with value: 0.779174.[0m
[32m[I 2023-02-27 11:08:06,662][0m Trial 4 finished with value: 0.717025766529563 and parameters: {'agc_alpha': 84.98758105546725, 'agc_l1_ratio': 0.6000000000000001, 'agc_loss': 'modified_huber'}. Best is trial 1 with value: 0.779174.[0m
[32m[I 2023-02-27 11:09:08,328][0m Trial 5 finished with value: 0.8142599604953753 and parameters: {'agc_alpha': 0.013487623541245202, 'agc_l1_ratio': 0.30000000000000004, 'agc_loss': 'smooth_hinge'}. Best is trial 5 with value: 0.81426.[0m
[32m[I 2023-02-27 11:10:11,443][0m Trial 6 finished with value: 0.7321310156881717 and parameters: {'agc_alpha': 8.804196684980239, 'agc_l1_ratio': 0.1, 'agc_loss': 'hinge'}. Best is trial 5 with value: 0.81426.[0m
[32m[I 2023-02-27 11:11:15,213][0m Trial 7 finished with value: 0.6392804016717664 and parameters: {'agc_alpha': 17.143149257547375, 'agc_l1_ratio': 0.8, 'agc_loss': 'hinge'}. Best is trial 5 with value: 0.81426.[0m
[32m[I 2023-02-27 11:12:16,245][0m Trial 8 finished with value: 0.763025821718812 and parameters: {'agc_alpha': 0.3281399132024241, 'agc_l1_ratio': 0.7000000000000001, 'agc_loss': 'perceptron'}. Best is trial 5 with value: 0.81426.[0m
[32m[I 2023-02-27 11:13:17,971][0m Trial 9 finished with value: 0.7824424554302638 and parameters: {'agc_alpha': 7.099570512615054, 'agc_l1_ratio': 0.2, 'agc_loss': 'hinge'}. Best is trial 5 with value: 0.81426.[0m
[32m[I 2023-02-27 11:14:17,550][0m Trial 10 finished with value: 0.904134507660795 and parameters: {'agc_alpha': 0.0034231802856469415, 'agc_l1_ratio': 1.0, 'agc_loss': 'smooth_hinge'}. Best is trial 10 with value: 0.904135.[0m
[32m[I 2023-02-27 11:15:16,957][0m Trial 11 finished with value: 0.9088575321235218 and parameters: {'agc_alpha': 0.0037709289034779394, 'agc_l1_ratio': 1.0, 'agc_loss': 'smooth_hinge'}. Best is trial 11 with value: 0.908858.[0m
[32m[I 2023-02-27 11:16:15,988][0m Trial 12 finished with value: 0.8687974570838716 and parameters: {'agc_alpha': 0.0015786158229139677, 'agc_l1_ratio': 1.0, 'agc_loss': 'smooth_hinge'}. Best is trial 11 with value: 0.908858.[0m
[32m[I 2023-02-27 11:17:26,652][0m Trial 13 finished with value: 0.8226261625811859 and parameters: {'agc_alpha': 0.09901324104718996, 'agc_l1_ratio': 1.0, 'agc_loss': 'squared'}. Best is trial 11 with value: 0.908858.[0m
[32m[I 2023-02-27 11:18:27,682][0m Trial 14 finished with value: 0.9008810278544837 and parameters: {'agc_alpha': 0.0012561490909525123, 'agc_l1_ratio': 0.9, 'agc_loss': 'smooth_hinge'}. Best is trial 11 with value: 0.908858.[0m
[32m[I 2023-02-27 11:19:29,474][0m Trial 15 finished with value: 0.8485791740068066 and parameters: {'agc_alpha': 0.01564132195089, 'agc_l1_ratio': 0.9, 'agc_loss': 'smooth_hinge'}. Best is trial 11 with value: 0.908858.[0m
[32m[I 2023-02-27 11:20:31,128][0m Trial 16 finished with value: 0.8324476322218516 and parameters: {'agc_alpha': 0.013982593505304322, 'agc_l1_ratio': 0.8, 'agc_loss': 'smooth_hinge'}. Best is trial 11 with value: 0.908858.[0m
[32m[I 2023-02-27 11:21:43,523][0m Trial 17 finished with value: 0.835824245378219 and parameters: {'agc_alpha': 0.005144935981614354, 'agc_l1_ratio': 1.0, 'agc_loss': 'squared'}. Best is trial 11 with value: 0.908858.[0m
[32m[I 2023-02-27 11:22:54,747][0m Trial 18 finished with value: 0.7995932802691146 and parameters: {'agc_alpha': 0.07685251703450013, 'agc_l1_ratio': 0.0, 'agc_loss': 'log'}. Best is trial 11 with value: 0.908858.[0m
[32m[I 2023-02-27 11:23:56,085][0m Trial 19 finished with value: 0.8941722836863778 and parameters: {'agc_alpha': 0.09493178625711152, 'agc_l1_ratio': 0.8, 'agc_loss': 'squared_hinge'}. Best is trial 11 with value: 0.908858.[0m
[32m[I 2023-02-27 11:23:56,147][0m Study finished.[0m
[32m[I 2023-02-27 11:23:56,163][0m --------------------------------------------------------------------------------[0m
[32m[I 2023-02-27 11:23:56,163][0m --------------------       BalancedBaggingClassifier        --------------------[0m
[32m[I 2023-02-27 11:23:56,163][0m --------------------------------------------------------------------------------[0m
[32m[I 2023-02-27 11:23:56,195][0m A new study created in RDB with name: BalancedBaggingClassifier_0a1486bb[0m
[32m[I 2023-02-27 11:23:56,210][0m Study started.[0m
[32m[I 2023-02-27 11:24:20,924][0m Trial 0 finished with value: 0.8904498221696943 and parameters: {'bbc_n_estimators': 10, 'bbc_max_features': 22, 'bbc_bootstrap': False, 'bbc_sampling_strategy': 'majority'}. Best is trial 0 with value: 0.89045.[0m
[32m[I 2023-02-27 11:24:26,677][0m Trial 1 finished with value: 0.9415987262808125 and parameters: {'bbc_n_estimators': 5, 'bbc_max_features': 24, 'bbc_bootstrap': False, 'bbc_sampling_strategy': 'all'}. Best is trial 1 with value: 0.941599.[0m
[32m[I 2023-02-27 11:25:01,872][0m Trial 2 finished with value: 0.7772495227682069 and parameters: {'bbc_n_estimators': 16, 'bbc_max_features': 9, 'bbc_bootstrap': True, 'bbc_sampling_strategy': 'majority'}. Best is trial 1 with value: 0.941599.[0m
[32m[I 2023-02-27 11:25:14,030][0m Trial 3 finished with value: 0.9384432815290488 and parameters: {'bbc_n_estimators': 13, 'bbc_max_features': 23, 'bbc_bootstrap': False, 'bbc_sampling_strategy': 'not minority'}. Best is trial 1 with value: 0.941599.[0m
[32m[I 2023-02-27 11:25:50,983][0m Trial 4 finished with value: 0.8893999816357387 and parameters: {'bbc_n_estimators': 13, 'bbc_max_features': 24, 'bbc_bootstrap': False, 'bbc_sampling_strategy': 'majority'}. Best is trial 1 with value: 0.941599.[0m
[32m[I 2023-02-27 11:25:57,836][0m Trial 5 finished with value: 0.8281671459105941 and parameters: {'bbc_n_estimators': 9, 'bbc_max_features': 6, 'bbc_bootstrap': False, 'bbc_sampling_strategy': 'not minority'}. Best is trial 1 with value: 0.941599.[0m
[32m[I 2023-02-27 11:26:10,208][0m Trial 6 finished with value: 0.7780385432737225 and parameters: {'bbc_n_estimators': 10, 'bbc_max_features': 3, 'bbc_bootstrap': True, 'bbc_sampling_strategy': 'all'}. Best is trial 1 with value: 0.941599.[0m
[32m[I 2023-02-27 11:26:31,140][0m Trial 7 finished with value: 0.3785147908348532 and parameters: {'bbc_n_estimators': 10, 'bbc_max_features': 3, 'bbc_bootstrap': False, 'bbc_sampling_strategy': 'not majority'}. Best is trial 1 with value: 0.941599.[0m
[32m[I 2023-02-27 11:26:54,774][0m Trial 8 finished with value: 0.9397733647273687 and parameters: {'bbc_n_estimators': 16, 'bbc_max_features': 24, 'bbc_bootstrap': True, 'bbc_sampling_strategy': 'all'}. Best is trial 1 with value: 0.941599.[0m
[32m[I 2023-02-27 11:27:17,075][0m Trial 9 finished with value: 0.4261811905102902 and parameters: {'bbc_n_estimators': 7, 'bbc_max_features': 4, 'bbc_bootstrap': True, 'bbc_sampling_strategy': 'not majority'}. Best is trial 1 with value: 0.941599.[0m
[32m[I 2023-02-27 11:27:22,396][0m Trial 10 finished with value: 0.910479477882546 and parameters: {'bbc_n_estimators': 5, 'bbc_max_features': 17, 'bbc_bootstrap': False, 'bbc_sampling_strategy': 'all'}. Best is trial 1 with value: 0.941599.[0m
[32m[I 2023-02-27 11:27:49,655][0m Trial 11 finished with value: 0.9390619690677174 and parameters: {'bbc_n_estimators': 20, 'bbc_max_features': 17, 'bbc_bootstrap': True, 'bbc_sampling_strategy': 'all'}. Best is trial 1 with value: 0.941599.[0m
[32m[I 2023-02-27 11:28:14,481][0m Trial 12 finished with value: 0.9349249633325194 and parameters: {'bbc_n_estimators': 18, 'bbc_max_features': 18, 'bbc_bootstrap': True, 'bbc_sampling_strategy': 'all'}. Best is trial 1 with value: 0.941599.[0m
[32m[I 2023-02-27 11:28:35,604][0m Trial 13 finished with value: 0.9255063971791467 and parameters: {'bbc_n_estimators': 16, 'bbc_max_features': 13, 'bbc_bootstrap': True, 'bbc_sampling_strategy': 'all'}. Best is trial 1 with value: 0.941599.[0m
[32m[I 2023-02-27 11:28:58,014][0m Trial 14 finished with value: 0.9410255397530443 and parameters: {'bbc_n_estimators': 15, 'bbc_max_features': 25, 'bbc_bootstrap': True, 'bbc_sampling_strategy': 'all'}. Best is trial 1 with value: 0.941599.[0m
[32m[I 2023-02-27 11:29:03,512][0m Trial 15 finished with value: 0.9290355978339895 and parameters: {'bbc_n_estimators': 5, 'bbc_max_features': 20, 'bbc_bootstrap': False, 'bbc_sampling_strategy': 'all'}. Best is trial 1 with value: 0.941599.[0m
[32m[I 2023-02-27 11:29:14,592][0m Trial 16 finished with value: 0.9239291914802081 and parameters: {'bbc_n_estimators': 14, 'bbc_max_features': 13, 'bbc_bootstrap': False, 'bbc_sampling_strategy': 'all'}. Best is trial 1 with value: 0.941599.[0m
[32m[I 2023-02-27 11:30:12,061][0m Trial 17 finished with value: 0.987409566000785 and parameters: {'bbc_n_estimators': 8, 'bbc_max_features': 25, 'bbc_bootstrap': True, 'bbc_sampling_strategy': 'not majority'}. Best is trial 17 with value: 0.98741.[0m
[32m[I 2023-02-27 11:30:58,380][0m Trial 18 finished with value: 0.9741312376586005 and parameters: {'bbc_n_estimators': 7, 'bbc_max_features': 20, 'bbc_bootstrap': True, 'bbc_sampling_strategy': 'not majority'}. Best is trial 17 with value: 0.98741.[0m
[32m[I 2023-02-27 11:31:52,026][0m Trial 19 finished with value: 0.9798171430127526 and parameters: {'bbc_n_estimators': 8, 'bbc_max_features': 20, 'bbc_bootstrap': True, 'bbc_sampling_strategy': 'not majority'}. Best is trial 17 with value: 0.98741.[0m
[32m[I 2023-02-27 11:31:52,073][0m Study finished.[0m
[32m[I 2023-02-27 11:31:52,104][0m --------------------------------------------------------------------------------[0m
[32m[I 2023-02-27 11:31:52,104][0m --------------------     BalancedRandomForestClassifier     --------------------[0m
[32m[I 2023-02-27 11:31:52,104][0m --------------------------------------------------------------------------------[0m
[32m[I 2023-02-27 11:31:52,136][0m A new study created in RDB with name: BalancedRandomForestClassifier_0a1486bb[0m
[32m[I 2023-02-27 11:31:52,151][0m Study started.[0m
[32m[I 2023-02-27 11:32:23,440][0m sklearn.ensemble.RandomForestClassifier.predict: fallback to original Scikit-learn[0m
[32m[I 2023-02-27 11:32:23,440][0m sklearn.ensemble.RandomForestClassifier.predict_proba: fallback to original Scikit-learn[0m
[32m[I 2023-02-27 11:32:28,525][0m Trial 0 finished with value: 0.9199455924266626 and parameters: {'brf_n_estimators': 80, 'brf_criterion': 'gini', 'brf_min_samples_split': 38, 'brf_min_samples_leaf': 16, 'brf_max_features': 13, 'brf_bootstrap': False}. Best is trial 0 with value: 0.919946.[0m
[32m[I 2023-02-27 11:33:39,695][0m sklearn.ensemble.RandomForestClassifier.predict: fallback to original Scikit-learn[0m
[32m[I 2023-02-27 11:33:39,695][0m sklearn.ensemble.RandomForestClassifier.predict_proba: fallback to original Scikit-learn[0m
[32m[I 2023-02-27 11:33:49,011][0m Trial 1 finished with value: 0.9091509883789554 and parameters: {'brf_n_estimators': 180, 'brf_criterion': 'entropy', 'brf_min_samples_split': 49, 'brf_min_samples_leaf': 28, 'brf_max_features': 16, 'brf_bootstrap': False}. Best is trial 0 with value: 0.919946.[0m
[32m[I 2023-02-27 11:34:20,682][0m sklearn.ensemble.RandomForestClassifier.predict: fallback to original Scikit-learn[0m
[32m[I 2023-02-27 11:34:20,682][0m sklearn.ensemble.RandomForestClassifier.predict_proba: fallback to original Scikit-learn[0m
[32m[I 2023-02-27 11:34:25,623][0m Trial 2 finished with value: 0.9181422121313103 and parameters: {'brf_n_estimators': 80, 'brf_criterion': 'entropy', 'brf_min_samples_split': 27, 'brf_min_samples_leaf': 18, 'brf_max_features': 17, 'brf_bootstrap': False}. Best is trial 0 with value: 0.919946.[0m
[32m[I 2023-02-27 11:35:28,293][0m sklearn.ensemble.RandomForestClassifier.predict: fallback to original Scikit-learn[0m
[32m[I 2023-02-27 11:35:28,293][0m sklearn.ensemble.RandomForestClassifier.predict_proba: fallback to original Scikit-learn[0m
[32m[I 2023-02-27 11:35:36,952][0m Trial 3 finished with value: 0.8968225317995047 and parameters: {'brf_n_estimators': 160, 'brf_criterion': 'gini', 'brf_min_samples_split': 20, 'brf_min_samples_leaf': 39, 'brf_max_features': 18, 'brf_bootstrap': False}. Best is trial 0 with value: 0.919946.[0m
[32m[I 2023-02-27 11:36:12,177][0m sklearn.ensemble.RandomForestClassifier.predict: fallback to original Scikit-learn[0m
[32m[I 2023-02-27 11:36:12,177][0m sklearn.ensemble.RandomForestClassifier.predict_proba: fallback to original Scikit-learn[0m
[32m[I 2023-02-27 11:36:17,619][0m Trial 4 finished with value: 0.9081175121881533 and parameters: {'brf_n_estimators': 90, 'brf_criterion': 'gini', 'brf_min_samples_split': 39, 'brf_min_samples_leaf': 12, 'brf_max_features': 19, 'brf_bootstrap': True}. Best is trial 0 with value: 0.919946.[0m
[32m[I 2023-02-27 11:37:32,217][0m sklearn.ensemble.RandomForestClassifier.predict: fallback to original Scikit-learn[0m
[32m[I 2023-02-27 11:37:32,217][0m sklearn.ensemble.RandomForestClassifier.predict_proba: fallback to original Scikit-learn[0m
[32m[I 2023-02-27 11:37:42,020][0m Trial 5 finished with value: 0.9351559877884997 and parameters: {'brf_n_estimators': 190, 'brf_criterion': 'entropy', 'brf_min_samples_split': 38, 'brf_min_samples_leaf': 4, 'brf_max_features': 14, 'brf_bootstrap': False}. Best is trial 5 with value: 0.935156.[0m
[32m[I 2023-02-27 11:38:05,579][0m sklearn.ensemble.RandomForestClassifier.predict: fallback to original Scikit-learn[0m
[32m[I 2023-02-27 11:38:05,579][0m sklearn.ensemble.RandomForestClassifier.predict_proba: fallback to original Scikit-learn[0m
[32m[I 2023-02-27 11:38:09,486][0m Trial 6 finished with value: 0.8927050788460966 and parameters: {'brf_n_estimators': 60, 'brf_criterion': 'entropy', 'brf_min_samples_split': 18, 'brf_min_samples_leaf': 46, 'brf_max_features': 14, 'brf_bootstrap': True}. Best is trial 5 with value: 0.935156.[0m
[32m[I 2023-02-27 11:39:00,232][0m sklearn.ensemble.RandomForestClassifier.predict: fallback to original Scikit-learn[0m
[32m[I 2023-02-27 11:39:00,232][0m sklearn.ensemble.RandomForestClassifier.predict_proba: fallback to original Scikit-learn[0m
[32m[I 2023-02-27 11:39:07,498][0m Trial 7 finished with value: 0.9195757236590782 and parameters: {'brf_n_estimators': 130, 'brf_criterion': 'gini', 'brf_min_samples_split': 12, 'brf_min_samples_leaf': 11, 'brf_max_features': 24, 'brf_bootstrap': True}. Best is trial 5 with value: 0.935156.[0m
[32m[I 2023-02-27 11:39:38,823][0m sklearn.ensemble.RandomForestClassifier.predict: fallback to original Scikit-learn[0m
[32m[I 2023-02-27 11:39:38,823][0m sklearn.ensemble.RandomForestClassifier.predict_proba: fallback to original Scikit-learn[0m
[32m[I 2023-02-27 11:39:43,718][0m Trial 8 finished with value: 0.8967712433583672 and parameters: {'brf_n_estimators': 80, 'brf_criterion': 'entropy', 'brf_min_samples_split': 6, 'brf_min_samples_leaf': 23, 'brf_max_features': 9, 'brf_bootstrap': True}. Best is trial 5 with value: 0.935156.[0m
[32m[I 2023-02-27 11:41:01,365][0m sklearn.ensemble.RandomForestClassifier.predict: fallback to original Scikit-learn[0m
[32m[I 2023-02-27 11:41:01,365][0m sklearn.ensemble.RandomForestClassifier.predict_proba: fallback to original Scikit-learn[0m
