[32m[I 2023-02-27 22:09:22,954][0m Trial 11 finished with value: 0.8461816244999883 and parameters: {'rusbc_n_estimators': 50, 'rusbc_learning_rate': 0.9719657126384211, 'rusbc_sampling_strategy': 'not minority'}. Best is trial 1 with value: 0.935361.[0m
[32m[I 2023-02-27 22:10:16,155][0m Trial 12 finished with value: 0.9364482202176134 and parameters: {'rusbc_n_estimators': 50, 'rusbc_learning_rate': 0.09922902776713624, 'rusbc_sampling_strategy': 'not minority'}. Best is trial 12 with value: 0.936448.[0m
[32m[I 2023-02-27 22:11:09,362][0m Trial 13 finished with value: 0.9367006076904238 and parameters: {'rusbc_n_estimators': 50, 'rusbc_learning_rate': 0.060540935472843525, 'rusbc_sampling_strategy': 'not minority'}. Best is trial 13 with value: 0.936701.[0m
[32m[I 2023-02-27 22:11:36,889][0m Trial 14 finished with value: 0.5530684270855681 and parameters: {'rusbc_n_estimators': 25, 'rusbc_learning_rate': 0.0016552722631231046, 'rusbc_sampling_strategy': 'not minority'}. Best is trial 13 with value: 0.936701.[0m
[32m[I 2023-02-27 22:12:56,172][0m Trial 15 finished with value: 0.45934974392724753 and parameters: {'rusbc_n_estimators': 75, 'rusbc_learning_rate': 0.07617406923802486, 'rusbc_sampling_strategy': 'not minority'}. Best is trial 13 with value: 0.936701.[0m
[32m[I 2023-02-27 22:13:23,745][0m Trial 16 finished with value: 0.58679547062744 and parameters: {'rusbc_n_estimators': 25, 'rusbc_learning_rate': 0.0034337801925810986, 'rusbc_sampling_strategy': 'all'}. Best is trial 13 with value: 0.936701.[0m
[32m[I 2023-02-27 22:14:49,614][0m Trial 17 finished with value: 0.40902003897192846 and parameters: {'rusbc_n_estimators': 50, 'rusbc_learning_rate': 0.13248473503494487, 'rusbc_sampling_strategy': 'not majority'}. Best is trial 13 with value: 0.936701.[0m
[32m[I 2023-02-27 22:16:50,052][0m Trial 18 finished with value: 0.9277754662523298 and parameters: {'rusbc_n_estimators': 75, 'rusbc_learning_rate': 0.15150718212894385, 'rusbc_sampling_strategy': 'majority'}. Best is trial 13 with value: 0.936701.[0m
[32m[I 2023-02-27 22:17:17,411][0m Trial 19 finished with value: 0.5766673586353265 and parameters: {'rusbc_n_estimators': 25, 'rusbc_learning_rate': 0.0005321216447455741, 'rusbc_sampling_strategy': 'not minority'}. Best is trial 13 with value: 0.936701.[0m
[32m[I 2023-02-27 22:17:17,473][0m Study finished.[0m
[32m[I 2023-02-27 22:17:17,505][0m --------------------------------------------------------------------------------[0m
[32m[I 2023-02-27 22:17:17,520][0m --------------------             SGDClassifier              --------------------[0m
[32m[I 2023-02-27 22:17:17,520][0m --------------------------------------------------------------------------------[0m
[32m[I 2023-02-27 22:17:17,536][0m A new study created in RDB with name: SGDClassifier_0a1486bb[0m
[32m[I 2023-02-27 22:17:17,551][0m Study started.[0m
[32m[I 2023-02-27 22:27:51,108][0m Trial 0 finished with value: 0.7026264054935366 and parameters: {'sgdc_loss': 'hinge', 'sgdc_penalty': 'elasticnet', 'sgdc_alpha': 0.2248715916484329, 'sgdc_l1_ratio': 0.6000000000000001, 'sgdc_learning_rate': 'adaptive', 'sgdc_eta0': 581.4007315344417, 'sgdc_early_stopping': True, 'sgdc_validation_fraction': 0.25, 'sgdc_n_iter_no_change': 10}. Best is trial 0 with value: 0.702626.[0m
[32m[I 2023-02-27 22:37:37,843][0m Trial 1 finished with value: 0.6992787928339309 and parameters: {'sgdc_loss': 'hinge', 'sgdc_penalty': 'elasticnet', 'sgdc_alpha': 11.41429081661886, 'sgdc_l1_ratio': 0.6000000000000001, 'sgdc_learning_rate': 'adaptive', 'sgdc_eta0': 57.724300096778904, 'sgdc_early_stopping': True, 'sgdc_validation_fraction': 0.25, 'sgdc_n_iter_no_change': 10}. Best is trial 0 with value: 0.702626.[0m
[32m[I 2023-02-27 22:38:29,452][0m Trial 2 finished with value: 0.3782834802287911 and parameters: {'sgdc_loss': 'hinge', 'sgdc_penalty': 'elasticnet', 'sgdc_alpha': 0.002158415319722904, 'sgdc_l1_ratio': 0.0, 'sgdc_learning_rate': 'constant', 'sgdc_eta0': 622.9022936997699, 'sgdc_early_stopping': True, 'sgdc_validation_fraction': 0.25, 'sgdc_n_iter_no_change': 10}. Best is trial 0 with value: 0.702626.[0m
[32m[I 2023-02-27 22:39:32,181][0m Trial 3 finished with value: 0.7248567954480601 and parameters: {'sgdc_loss': 'squared_hinge', 'sgdc_penalty': 'elasticnet', 'sgdc_alpha': 170.24357698749805, 'sgdc_l1_ratio': 1.0, 'sgdc_learning_rate': 'optimal', 'sgdc_eta0': 0.024529677048916242, 'sgdc_early_stopping': True, 'sgdc_validation_fraction': 0.25, 'sgdc_n_iter_no_change': 10}. Best is trial 3 with value: 0.724857.[0m
[32m[I 2023-02-27 22:40:41,397][0m Trial 4 finished with value: 0.7331342915115641 and parameters: {'sgdc_loss': 'log', 'sgdc_penalty': 'elasticnet', 'sgdc_alpha': 0.09938832460030148, 'sgdc_l1_ratio': 0.0, 'sgdc_learning_rate': 'optimal', 'sgdc_eta0': 0.23132378166017156, 'sgdc_early_stopping': True, 'sgdc_validation_fraction': 0.25, 'sgdc_n_iter_no_change': 10}. Best is trial 4 with value: 0.733134.[0m
[32m[I 2023-02-27 22:41:37,204][0m Trial 5 finished with value: 0.7240195247650029 and parameters: {'sgdc_loss': 'squared_hinge', 'sgdc_penalty': 'elasticnet', 'sgdc_alpha': 0.8244215402768871, 'sgdc_l1_ratio': 0.0, 'sgdc_learning_rate': 'optimal', 'sgdc_eta0': 8.307057386162963, 'sgdc_early_stopping': True, 'sgdc_validation_fraction': 0.25, 'sgdc_n_iter_no_change': 10}. Best is trial 4 with value: 0.733134.[0m
[32m[I 2023-02-27 22:42:32,080][0m Trial 6 finished with value: 0.7046370897235624 and parameters: {'sgdc_loss': 'modified_huber', 'sgdc_penalty': 'elasticnet', 'sgdc_alpha': 47.6702986994984, 'sgdc_l1_ratio': 1.0, 'sgdc_learning_rate': 'constant', 'sgdc_eta0': 248.74779932538414, 'sgdc_early_stopping': True, 'sgdc_validation_fraction': 0.25, 'sgdc_n_iter_no_change': 10}. Best is trial 4 with value: 0.733134.[0m
[32m[I 2023-02-27 22:43:28,210][0m Trial 7 finished with value: 0.7083405163827836 and parameters: {'sgdc_loss': 'hinge', 'sgdc_penalty': 'elasticnet', 'sgdc_alpha': 3.317519942019244, 'sgdc_l1_ratio': 0.8, 'sgdc_learning_rate': 'optimal', 'sgdc_eta0': 0.09127615669037346, 'sgdc_early_stopping': True, 'sgdc_validation_fraction': 0.25, 'sgdc_n_iter_no_change': 10}. Best is trial 4 with value: 0.733134.[0m
[32m[I 2023-02-27 22:44:22,747][0m Trial 8 finished with value: 0.24733750872015894 and parameters: {'sgdc_loss': 'hinge', 'sgdc_penalty': 'elasticnet', 'sgdc_alpha': 9.052439155733845e-06, 'sgdc_l1_ratio': 0.2, 'sgdc_learning_rate': 'constant', 'sgdc_eta0': 2.4008985338955733, 'sgdc_early_stopping': True, 'sgdc_validation_fraction': 0.25, 'sgdc_n_iter_no_change': 10}. Best is trial 4 with value: 0.733134.[0m
[32m[I 2023-02-27 22:45:32,418][0m Trial 9 finished with value: 0.6410240189025862 and parameters: {'sgdc_loss': 'hinge', 'sgdc_penalty': 'elasticnet', 'sgdc_alpha': 2.144510559540719e-06, 'sgdc_l1_ratio': 0.4, 'sgdc_learning_rate': 'optimal', 'sgdc_eta0': 0.0593183838991912, 'sgdc_early_stopping': True, 'sgdc_validation_fraction': 0.25, 'sgdc_n_iter_no_change': 10}. Best is trial 4 with value: 0.733134.[0m
[32m[I 2023-02-27 22:46:44,141][0m Trial 10 finished with value: 0.6992246569639506 and parameters: {'sgdc_loss': 'log', 'sgdc_penalty': 'elasticnet', 'sgdc_alpha': 0.003326541233394041, 'sgdc_l1_ratio': 0.2, 'sgdc_learning_rate': 'invscaling', 'sgdc_eta0': 0.001252654885205657, 'sgdc_early_stopping': True, 'sgdc_validation_fraction': 0.25, 'sgdc_n_iter_no_change': 10}. Best is trial 4 with value: 0.733134.[0m
[32m[I 2023-02-27 22:47:51,081][0m Trial 11 finished with value: 0.7354296744992229 and parameters: {'sgdc_loss': 'squared_hinge', 'sgdc_penalty': 'elasticnet', 'sgdc_alpha': 206.75849922974456, 'sgdc_l1_ratio': 1.0, 'sgdc_learning_rate': 'optimal', 'sgdc_eta0': 0.06332822502630318, 'sgdc_early_stopping': True, 'sgdc_validation_fraction': 0.25, 'sgdc_n_iter_no_change': 10}. Best is trial 11 with value: 0.73543.[0m
[32m[I 2023-02-27 22:48:52,773][0m Trial 12 finished with value: 0.5783451192851368 and parameters: {'sgdc_loss': 'log', 'sgdc_penalty': 'elasticnet', 'sgdc_alpha': 411.3408816613699, 'sgdc_l1_ratio': 0.8, 'sgdc_learning_rate': 'optimal', 'sgdc_eta0': 0.35748471078360183, 'sgdc_early_stopping': True, 'sgdc_validation_fraction': 0.25, 'sgdc_n_iter_no_change': 10}. Best is trial 11 with value: 0.73543.[0m
[32m[I 2023-02-27 22:50:13,569][0m Trial 13 finished with value: 0.7622160713091731 and parameters: {'sgdc_loss': 'squared_hinge', 'sgdc_penalty': 'elasticnet', 'sgdc_alpha': 0.014641403880112204, 'sgdc_l1_ratio': 0.4, 'sgdc_learning_rate': 'invscaling', 'sgdc_eta0': 0.002107021661765336, 'sgdc_early_stopping': True, 'sgdc_validation_fraction': 0.25, 'sgdc_n_iter_no_change': 10}. Best is trial 13 with value: 0.762216.[0m
[32m[I 2023-02-27 22:51:27,095][0m Trial 14 finished with value: 0.6871869946173124 and parameters: {'sgdc_loss': 'squared_hinge', 'sgdc_penalty': 'elasticnet', 'sgdc_alpha': 0.0003886444376084889, 'sgdc_l1_ratio': 0.4, 'sgdc_learning_rate': 'invscaling', 'sgdc_eta0': 0.0027578116982383124, 'sgdc_early_stopping': True, 'sgdc_validation_fraction': 0.25, 'sgdc_n_iter_no_change': 10}. Best is trial 13 with value: 0.762216.[0m
[32m[I 2023-02-27 22:52:38,148][0m Trial 15 finished with value: 0.6703389226229429 and parameters: {'sgdc_loss': 'squared_hinge', 'sgdc_penalty': 'elasticnet', 'sgdc_alpha': 7.862842474498073e-05, 'sgdc_l1_ratio': 0.8, 'sgdc_learning_rate': 'invscaling', 'sgdc_eta0': 0.008568194469357507, 'sgdc_early_stopping': True, 'sgdc_validation_fraction': 0.25, 'sgdc_n_iter_no_change': 10}. Best is trial 13 with value: 0.762216.[0m
[32m[I 2023-02-27 22:53:47,867][0m Trial 16 finished with value: 0.6622694803032473 and parameters: {'sgdc_loss': 'squared_hinge', 'sgdc_penalty': 'elasticnet', 'sgdc_alpha': 0.016391140111460437, 'sgdc_l1_ratio': 0.4, 'sgdc_learning_rate': 'invscaling', 'sgdc_eta0': 0.009339672965619368, 'sgdc_early_stopping': True, 'sgdc_validation_fraction': 0.25, 'sgdc_n_iter_no_change': 10}. Best is trial 13 with value: 0.762216.[0m
[32m[I 2023-02-27 22:54:46,105][0m Trial 17 finished with value: 0.25050435175821695 and parameters: {'sgdc_loss': 'modified_huber', 'sgdc_penalty': 'elasticnet', 'sgdc_alpha': 960.1179127813649, 'sgdc_l1_ratio': 0.6000000000000001, 'sgdc_learning_rate': 'invscaling', 'sgdc_eta0': 0.001024213643891194, 'sgdc_early_stopping': True, 'sgdc_validation_fraction': 0.25, 'sgdc_n_iter_no_change': 10}. Best is trial 13 with value: 0.762216.[0m
[32m[I 2023-02-27 23:02:58,004][0m Trial 18 finished with value: 0.695008630008585 and parameters: {'sgdc_loss': 'squared_hinge', 'sgdc_penalty': 'elasticnet', 'sgdc_alpha': 0.016018008033618632, 'sgdc_l1_ratio': 0.2, 'sgdc_learning_rate': 'adaptive', 'sgdc_eta0': 1.6196878341146472, 'sgdc_early_stopping': True, 'sgdc_validation_fraction': 0.25, 'sgdc_n_iter_no_change': 10}. Best is trial 13 with value: 0.762216.[0m
[32m[I 2023-02-27 23:04:02,824][0m Trial 19 finished with value: 0.6635838206111585 and parameters: {'sgdc_loss': 'squared_hinge', 'sgdc_penalty': 'elasticnet', 'sgdc_alpha': 0.9010091735123844, 'sgdc_l1_ratio': 1.0, 'sgdc_learning_rate': 'invscaling', 'sgdc_eta0': 0.00575878612494933, 'sgdc_early_stopping': True, 'sgdc_validation_fraction': 0.25, 'sgdc_n_iter_no_change': 10}. Best is trial 13 with value: 0.762216.[0m
[32m[I 2023-02-27 23:04:02,886][0m Study finished.[0m
[32m[I 2023-02-27 23:04:02,918][0m --------------------------------------------------------------------------------[0m
[32m[I 2023-02-27 23:04:02,918][0m --------------------    VeryFastDecisionRulesClassifier     --------------------[0m
[32m[I 2023-02-27 23:04:02,918][0m --------------------------------------------------------------------------------[0m
[32m[I 2023-02-27 23:04:02,949][0m A new study created in RDB with name: VeryFastDecisionRulesClassifier_0a1486bb[0m
[32m[I 2023-02-27 23:04:02,965][0m Study started.[0m
[32m[I 2023-02-27 23:09:08,817][0m Trial 0 finished with value: 0.8502780585430724 and parameters: {'vfdrc_ordered_rules': False, 'vfdrc_grace_period': 300, 'vfdrc_tie_threshold': 0.4, 'vfdrc_rule_prediction': 'first_hit', 'vfdrc_max_rules': 10, 'vfdrc_expand_criterion': 'foil_gain', 'vfdrc_remove_poor_atts': False}. Best is trial 0 with value: 0.850278.[0m
[32m[I 2023-02-27 23:13:13,021][0m Trial 1 finished with value: 0.1588182230763001 and parameters: {'vfdrc_ordered_rules': True, 'vfdrc_grace_period': 400, 'vfdrc_tie_threshold': 0.0, 'vfdrc_rule_prediction': 'first_hit', 'vfdrc_max_rules': 40, 'vfdrc_expand_criterion': 'hellinger', 'vfdrc_remove_poor_atts': True}. Best is trial 0 with value: 0.850278.[0m
[32m[I 2023-02-27 23:18:01,704][0m Trial 2 finished with value: 0.9398391220624859 and parameters: {'vfdrc_ordered_rules': True, 'vfdrc_grace_period': 300, 'vfdrc_tie_threshold': 0.75, 'vfdrc_rule_prediction': 'weighted_sum', 'vfdrc_max_rules': 20, 'vfdrc_expand_criterion': 'info_gain', 'vfdrc_remove_poor_atts': True}. Best is trial 2 with value: 0.939839.[0m
[32m[I 2023-02-27 23:22:59,113][0m Trial 3 finished with value: 0.7938708857617339 and parameters: {'vfdrc_ordered_rules': True, 'vfdrc_grace_period': 200, 'vfdrc_tie_threshold': 0.9500000000000001, 'vfdrc_rule_prediction': 'weighted_sum', 'vfdrc_max_rules': 40, 'vfdrc_expand_criterion': 'foil_gain', 'vfdrc_remove_poor_atts': True}. Best is trial 2 with value: 0.939839.[0m
[32m[I 2023-02-27 23:28:25,364][0m Trial 4 finished with value: 0.9393573438102002 and parameters: {'vfdrc_ordered_rules': True, 'vfdrc_grace_period': 100, 'vfdrc_tie_threshold': 0.75, 'vfdrc_rule_prediction': 'weighted_sum', 'vfdrc_max_rules': 35, 'vfdrc_expand_criterion': 'foil_gain', 'vfdrc_remove_poor_atts': False}. Best is trial 2 with value: 0.939839.[0m
[32m[I 2023-02-27 23:33:26,132][0m Trial 5 finished with value: 0.925218113596153 and parameters: {'vfdrc_ordered_rules': True, 'vfdrc_grace_period': 200, 'vfdrc_tie_threshold': 0.55, 'vfdrc_rule_prediction': 'weighted_sum', 'vfdrc_max_rules': 10, 'vfdrc_expand_criterion': 'info_gain', 'vfdrc_remove_poor_atts': False}. Best is trial 2 with value: 0.939839.[0m
[32m[I 2023-02-27 23:38:35,322][0m Trial 6 finished with value: 0.9484488878490583 and parameters: {'vfdrc_ordered_rules': False, 'vfdrc_grace_period': 200, 'vfdrc_tie_threshold': 0.9500000000000001, 'vfdrc_rule_prediction': 'first_hit', 'vfdrc_max_rules': 15, 'vfdrc_expand_criterion': 'foil_gain', 'vfdrc_remove_poor_atts': True}. Best is trial 6 with value: 0.948449.[0m
[32m[I 2023-02-27 23:43:36,160][0m Trial 7 finished with value: 0.9389180500421862 and parameters: {'vfdrc_ordered_rules': True, 'vfdrc_grace_period': 300, 'vfdrc_tie_threshold': 0.15000000000000002, 'vfdrc_rule_prediction': 'first_hit', 'vfdrc_max_rules': 30, 'vfdrc_expand_criterion': 'foil_gain', 'vfdrc_remove_poor_atts': True}. Best is trial 6 with value: 0.948449.[0m
[32m[I 2023-02-27 23:48:30,373][0m Trial 8 finished with value: 0.936887494986775 and parameters: {'vfdrc_ordered_rules': True, 'vfdrc_grace_period': 250, 'vfdrc_tie_threshold': 0.5, 'vfdrc_rule_prediction': 'first_hit', 'vfdrc_max_rules': 15, 'vfdrc_expand_criterion': 'info_gain', 'vfdrc_remove_poor_atts': False}. Best is trial 6 with value: 0.948449.[0m
[32m[I 2023-02-27 23:53:38,198][0m Trial 9 finished with value: 0.9387910037215287 and parameters: {'vfdrc_ordered_rules': True, 'vfdrc_grace_period': 150, 'vfdrc_tie_threshold': 0.75, 'vfdrc_rule_prediction': 'weighted_sum', 'vfdrc_max_rules': 40, 'vfdrc_expand_criterion': 'foil_gain', 'vfdrc_remove_poor_atts': True}. Best is trial 6 with value: 0.948449.[0m
[32m[I 2023-02-27 23:59:00,777][0m Trial 10 finished with value: 0.8221646484042986 and parameters: {'vfdrc_ordered_rules': False, 'vfdrc_grace_period': 400, 'vfdrc_tie_threshold': 1.0, 'vfdrc_rule_prediction': 'weighted_max', 'vfdrc_max_rules': 25, 'vfdrc_expand_criterion': 'hellinger', 'vfdrc_remove_poor_atts': True}. Best is trial 6 with value: 0.948449.[0m
[32m[I 2023-02-28 00:04:44,768][0m Trial 11 finished with value: 0.9435799161681149 and parameters: {'vfdrc_ordered_rules': False, 'vfdrc_grace_period': 300, 'vfdrc_tie_threshold': 0.8, 'vfdrc_rule_prediction': 'weighted_max', 'vfdrc_max_rules': 20, 'vfdrc_expand_criterion': 'info_gain', 'vfdrc_remove_poor_atts': True}. Best is trial 6 with value: 0.948449.[0m
[32m[I 2023-02-28 00:04:44,831][0m Study finished.[0m
[32m[I 2023-02-28 00:04:44,846][0m --------------------------------------------------------------------------------[0m
[32m[I 2023-02-28 00:04:44,846][0m --------------------             XGBClassifier              --------------------[0m
[32m[I 2023-02-28 00:04:44,846][0m --------------------------------------------------------------------------------[0m
[32m[I 2023-02-28 00:04:44,877][0m A new study created in RDB with name: XGBClassifier_0a1486bb[0m
[32m[I 2023-02-28 00:04:44,877][0m Study started.[0m
[32m[I 2023-02-28 00:25:19,964][0m Trial 0 finished with value: 0.9346267617872769 and parameters: {'xgbc_n_estimators': 190, 'xgbc_use_label_encoder': False, 'xgbc_learning_rate': 0.21373065841858388, 'xgbc_booster': 'gblinear', 'xgbc_gamma': 0.05840666511095724}. Best is trial 0 with value: 0.934627.[0m
[32m[I 2023-02-28 00:38:11,843][0m Trial 1 finished with value: 0.8347519989106859 and parameters: {'xgbc_n_estimators': 110, 'xgbc_use_label_encoder': False, 'xgbc_learning_rate': 0.002527355038083805, 'xgbc_booster': 'gblinear', 'xgbc_gamma': 0.048100202615870585}. Best is trial 0 with value: 0.934627.[0m
[32m[I 2023-02-28 00:42:57,695][0m Trial 2 finished with value: 0.8341621233048455 and parameters: {'xgbc_n_estimators': 40, 'xgbc_use_label_encoder': False, 'xgbc_learning_rate': 0.0023934873433288234, 'xgbc_booster': 'gblinear', 'xgbc_gamma': 0.17951394728428346}. Best is trial 0 with value: 0.934627.[0m
[32m[I 2023-02-28 00:58:16,045][0m Trial 3 finished with value: 0.8328586542148857 and parameters: {'xgbc_n_estimators': 130, 'xgbc_use_label_encoder': False, 'xgbc_learning_rate': 0.005983761196862846, 'xgbc_booster': 'gblinear', 'xgbc_gamma': 0.44142054923057816}. Best is trial 0 with value: 0.934627.[0m
[32m[I 2023-02-28 09:45:34,720][0m Trial 4 finished with value: 0.9838035529977158 and parameters: {'xgbc_n_estimators': 190, 'xgbc_use_label_encoder': False, 'xgbc_learning_rate': 2.5101330602470354e-06, 'xgbc_booster': 'dart', 'xgbc_gamma': 0.00015960820231449902}. Best is trial 4 with value: 0.983804.[0m
[32m[I 2023-02-28 09:45:34,783][0m Study finished.[0m
[32m[I 2023-02-28 09:45:35,485][0m Optimization finished.[0m
