[32m[I 2023-02-27 17:23:43,357][0m Trial 3 finished with value: 0.3782834802287911 and parameters: {'lsvc_nystroem_kernel_gamma': 16.384483667778554, 'lsvc_nystroem_kernel_n_components': 50, 'lsvc_nystroem_dual': False, 'lsvc_nystroem_C': 8.438112976248203e-05, 'lsvc_nystroem_max_iter': 2000}. Best is trial 2 with value: 0.379046.[0m
[32m[I 2023-02-27 17:23:51,664][0m Trial 4 finished with value: 0.3782834802287911 and parameters: {'lsvc_nystroem_kernel_gamma': 0.11788727747813298, 'lsvc_nystroem_kernel_n_components': 50, 'lsvc_nystroem_dual': False, 'lsvc_nystroem_C': 0.0021589039305362216, 'lsvc_nystroem_max_iter': 2000}. Best is trial 2 with value: 0.379046.[0m
[32m[I 2023-02-27 17:23:59,828][0m Trial 5 finished with value: 0.3782834802287911 and parameters: {'lsvc_nystroem_kernel_gamma': 460.45275125454685, 'lsvc_nystroem_kernel_n_components': 50, 'lsvc_nystroem_dual': False, 'lsvc_nystroem_C': 17.513037852067022, 'lsvc_nystroem_max_iter': 2000}. Best is trial 2 with value: 0.379046.[0m
[32m[I 2023-02-27 17:24:14,503][0m Trial 6 finished with value: 0.3788786603230018 and parameters: {'lsvc_nystroem_kernel_gamma': 0.0028804871070132352, 'lsvc_nystroem_kernel_n_components': 100, 'lsvc_nystroem_dual': False, 'lsvc_nystroem_C': 487.14191108966463, 'lsvc_nystroem_max_iter': 2000}. Best is trial 2 with value: 0.379046.[0m
[32m[I 2023-02-27 17:24:27,909][0m Trial 7 finished with value: 0.3782834802287911 and parameters: {'lsvc_nystroem_kernel_gamma': 206.8422857768536, 'lsvc_nystroem_kernel_n_components': 100, 'lsvc_nystroem_dual': False, 'lsvc_nystroem_C': 0.022493960804723243, 'lsvc_nystroem_max_iter': 2000}. Best is trial 2 with value: 0.379046.[0m
[32m[I 2023-02-27 17:24:36,126][0m Trial 8 finished with value: 0.3782834802287911 and parameters: {'lsvc_nystroem_kernel_gamma': 9.591588469627123, 'lsvc_nystroem_kernel_n_components': 50, 'lsvc_nystroem_dual': False, 'lsvc_nystroem_C': 40.32251775552059, 'lsvc_nystroem_max_iter': 2000}. Best is trial 2 with value: 0.379046.[0m
[32m[I 2023-02-27 17:24:49,699][0m Trial 9 finished with value: 0.3782834802287911 and parameters: {'lsvc_nystroem_kernel_gamma': 0.10198025880699932, 'lsvc_nystroem_kernel_n_components': 100, 'lsvc_nystroem_dual': False, 'lsvc_nystroem_C': 0.0798612814126342, 'lsvc_nystroem_max_iter': 2000}. Best is trial 2 with value: 0.379046.[0m
[32m[I 2023-02-27 17:25:10,946][0m Trial 10 finished with value: 0.3793149320173757 and parameters: {'lsvc_nystroem_kernel_gamma': 0.0011252865474702845, 'lsvc_nystroem_kernel_n_components': 150, 'lsvc_nystroem_dual': False, 'lsvc_nystroem_C': 0.8244855276478898, 'lsvc_nystroem_max_iter': 2000}. Best is trial 10 with value: 0.379315.[0m
[32m[I 2023-02-27 17:25:32,136][0m Trial 11 finished with value: 0.3792935555917175 and parameters: {'lsvc_nystroem_kernel_gamma': 0.0013366951130481964, 'lsvc_nystroem_kernel_n_components': 150, 'lsvc_nystroem_dual': False, 'lsvc_nystroem_C': 1.3111616218395743, 'lsvc_nystroem_max_iter': 2000}. Best is trial 10 with value: 0.379315.[0m
[32m[I 2023-02-27 17:25:51,726][0m Trial 12 finished with value: 0.3787245852933713 and parameters: {'lsvc_nystroem_kernel_gamma': 0.011350452892565496, 'lsvc_nystroem_kernel_n_components': 150, 'lsvc_nystroem_dual': False, 'lsvc_nystroem_C': 0.5544907374943886, 'lsvc_nystroem_max_iter': 2000}. Best is trial 10 with value: 0.379315.[0m
[32m[I 2023-02-27 17:26:10,551][0m Trial 13 finished with value: 0.37828776479347415 and parameters: {'lsvc_nystroem_kernel_gamma': 0.667136396920028, 'lsvc_nystroem_kernel_n_components': 150, 'lsvc_nystroem_dual': False, 'lsvc_nystroem_C': 0.9733193308192951, 'lsvc_nystroem_max_iter': 2000}. Best is trial 10 with value: 0.379315.[0m
[32m[I 2023-02-27 17:26:30,029][0m Trial 14 finished with value: 0.37832632411775213 and parameters: {'lsvc_nystroem_kernel_gamma': 0.0011990332826490805, 'lsvc_nystroem_kernel_n_components': 150, 'lsvc_nystroem_dual': False, 'lsvc_nystroem_C': 0.0035978957933499745, 'lsvc_nystroem_max_iter': 2000}. Best is trial 10 with value: 0.379315.[0m
[32m[I 2023-02-27 17:26:49,612][0m Trial 15 finished with value: 0.37872030471007084 and parameters: {'lsvc_nystroem_kernel_gamma': 0.013145417803660502, 'lsvc_nystroem_kernel_n_components': 150, 'lsvc_nystroem_dual': False, 'lsvc_nystroem_C': 0.8015279085114865, 'lsvc_nystroem_max_iter': 2000}. Best is trial 10 with value: 0.379315.[0m
[32m[I 2023-02-27 17:27:08,553][0m Trial 16 finished with value: 0.3782920493190917 and parameters: {'lsvc_nystroem_kernel_gamma': 0.10870128902185272, 'lsvc_nystroem_kernel_n_components': 150, 'lsvc_nystroem_dual': False, 'lsvc_nystroem_C': 0.08826597634934849, 'lsvc_nystroem_max_iter': 2000}. Best is trial 10 with value: 0.379315.[0m
[32m[I 2023-02-27 17:27:27,317][0m Trial 17 finished with value: 0.3782834802287911 and parameters: {'lsvc_nystroem_kernel_gamma': 1.1949804769182444, 'lsvc_nystroem_kernel_n_components': 150, 'lsvc_nystroem_dual': False, 'lsvc_nystroem_C': 0.0005984346937254556, 'lsvc_nystroem_max_iter': 2000}. Best is trial 10 with value: 0.379315.[0m
[32m[I 2023-02-27 17:27:46,976][0m Trial 18 finished with value: 0.3788401463024915 and parameters: {'lsvc_nystroem_kernel_gamma': 0.008499648105559853, 'lsvc_nystroem_kernel_n_components': 150, 'lsvc_nystroem_dual': False, 'lsvc_nystroem_C': 3.850013469215714, 'lsvc_nystroem_max_iter': 2000}. Best is trial 10 with value: 0.379315.[0m
[32m[I 2023-02-27 17:28:01,158][0m Trial 19 finished with value: 0.3784334167529279 and parameters: {'lsvc_nystroem_kernel_gamma': 0.04549130014738704, 'lsvc_nystroem_kernel_n_components': 100, 'lsvc_nystroem_dual': False, 'lsvc_nystroem_C': 53.65245042541619, 'lsvc_nystroem_max_iter': 2000}. Best is trial 10 with value: 0.379315.[0m
[32m[I 2023-02-27 17:28:01,205][0m Study finished.[0m
[32m[I 2023-02-27 17:28:01,236][0m --------------------------------------------------------------------------------[0m
[32m[I 2023-02-27 17:28:01,236][0m --------------------    LinearSVC_PolynomialCountSketch     --------------------[0m
[32m[I 2023-02-27 17:28:01,236][0m --------------------------------------------------------------------------------[0m
[32m[I 2023-02-27 17:28:01,268][0m A new study created in RDB with name: LinearSVC_PolynomialCountSketch_0a1486bb[0m
[32m[I 2023-02-27 17:28:01,283][0m Study started.[0m
[32m[I 2023-02-27 17:35:39,653][0m Trial 0 finished with value: 0.8121862063978591 and parameters: {'lsvc_pcs_kernel_gamma': 0.22646713803790405, 'lsvc_pcs_kernel_n_components': 100, 'lsvc_pcs_degree': 2, 'lsvc_pcs_dual': False, 'lsvc_pcs_C': 97.66129149903695, 'lsvc_pcs_max_iter': 2000}. Best is trial 0 with value: 0.812186.[0m
[32m[I 2023-02-27 17:43:17,186][0m Trial 1 finished with value: 0.8121846579244434 and parameters: {'lsvc_pcs_kernel_gamma': 0.007754034738003854, 'lsvc_pcs_kernel_n_components': 100, 'lsvc_pcs_degree': 2, 'lsvc_pcs_dual': False, 'lsvc_pcs_C': 1.8960833416639742, 'lsvc_pcs_max_iter': 2000}. Best is trial 0 with value: 0.812186.[0m
[32m[I 2023-02-27 17:55:19,368][0m Trial 2 finished with value: 0.800632073305721 and parameters: {'lsvc_pcs_kernel_gamma': 0.021241716017134697, 'lsvc_pcs_kernel_n_components': 150, 'lsvc_pcs_degree': 2, 'lsvc_pcs_dual': False, 'lsvc_pcs_C': 0.03686270967374858, 'lsvc_pcs_max_iter': 2000}. Best is trial 0 with value: 0.812186.[0m
[32m[I 2023-02-27 18:03:07,892][0m Trial 3 finished with value: 0.8120663770136032 and parameters: {'lsvc_pcs_kernel_gamma': 1.8532530072112117, 'lsvc_pcs_kernel_n_components': 100, 'lsvc_pcs_degree': 2, 'lsvc_pcs_dual': False, 'lsvc_pcs_C': 0.19250504158078166, 'lsvc_pcs_max_iter': 2000}. Best is trial 0 with value: 0.812186.[0m
[32m[I 2023-02-27 18:09:01,813][0m Trial 4 finished with value: 0.8022615199800506 and parameters: {'lsvc_pcs_kernel_gamma': 33.229952253763614, 'lsvc_pcs_kernel_n_components': 50, 'lsvc_pcs_degree': 2, 'lsvc_pcs_dual': False, 'lsvc_pcs_C': 183.6405200491623, 'lsvc_pcs_max_iter': 2000}. Best is trial 0 with value: 0.812186.[0m
[32m[I 2023-02-27 18:14:49,345][0m Trial 5 finished with value: 0.8096076817038841 and parameters: {'lsvc_pcs_kernel_gamma': 63.58979326906998, 'lsvc_pcs_kernel_n_components': 50, 'lsvc_pcs_degree': 2, 'lsvc_pcs_dual': False, 'lsvc_pcs_C': 2.4323039273985916e-06, 'lsvc_pcs_max_iter': 2000}. Best is trial 0 with value: 0.812186.[0m
[32m[I 2023-02-27 18:20:36,771][0m Trial 6 finished with value: 0.8106648995272152 and parameters: {'lsvc_pcs_kernel_gamma': 0.0033707101594154473, 'lsvc_pcs_kernel_n_components': 50, 'lsvc_pcs_degree': 2, 'lsvc_pcs_dual': False, 'lsvc_pcs_C': 2.2727591704250487e-06, 'lsvc_pcs_max_iter': 2000}. Best is trial 0 with value: 0.812186.[0m
[32m[I 2023-02-27 18:33:11,296][0m Trial 7 finished with value: 0.7998528870027695 and parameters: {'lsvc_pcs_kernel_gamma': 0.0012057571469959924, 'lsvc_pcs_kernel_n_components': 150, 'lsvc_pcs_degree': 2, 'lsvc_pcs_dual': False, 'lsvc_pcs_C': 918.3950077975853, 'lsvc_pcs_max_iter': 2000}. Best is trial 0 with value: 0.812186.[0m
[32m[I 2023-02-27 18:33:11,625][0m Study finished.[0m
[32m[I 2023-02-27 18:33:11,656][0m --------------------------------------------------------------------------------[0m
[32m[I 2023-02-27 18:33:11,656][0m --------------------          LinearSVC_RBFSampler          --------------------[0m
[32m[I 2023-02-27 18:33:11,671][0m --------------------------------------------------------------------------------[0m
[32m[I 2023-02-27 18:33:11,765][0m A new study created in RDB with name: LinearSVC_RBFSampler_0a1486bb[0m
[32m[I 2023-02-27 18:33:11,765][0m Study started.[0m
[32m[I 2023-02-27 18:33:46,685][0m Trial 0 finished with value: 0.3782834802287911 and parameters: {'lsvc_rbfs_kernel_gamma': 0.0032414826302995907, 'lsvc_rbfs_kernel_n_components': 50, 'lsvc_rbfs_dual': False, 'lsvc_rbfs_C': 2.854438777932828e-06, 'lsvc_rbfs_max_iter': 2000}. Best is trial 0 with value: 0.378283.[0m
[32m[I 2023-02-27 18:34:57,129][0m Trial 1 finished with value: 0.3782834802287911 and parameters: {'lsvc_rbfs_kernel_gamma': 0.23776843295370936, 'lsvc_rbfs_kernel_n_components': 100, 'lsvc_rbfs_dual': False, 'lsvc_rbfs_C': 0.648166466801964, 'lsvc_rbfs_max_iter': 2000}. Best is trial 0 with value: 0.378283.[0m
[32m[I 2023-02-27 18:35:29,973][0m Trial 2 finished with value: 0.3782834802287911 and parameters: {'lsvc_rbfs_kernel_gamma': 65.79743295953428, 'lsvc_rbfs_kernel_n_components': 50, 'lsvc_rbfs_dual': False, 'lsvc_rbfs_C': 4.96460396931455e-06, 'lsvc_rbfs_max_iter': 2000}. Best is trial 0 with value: 0.378283.[0m
[32m[I 2023-02-27 18:37:03,545][0m Trial 3 finished with value: 0.3782834802287911 and parameters: {'lsvc_rbfs_kernel_gamma': 9.224245326041611, 'lsvc_rbfs_kernel_n_components': 150, 'lsvc_rbfs_dual': False, 'lsvc_rbfs_C': 1.1072224850208106, 'lsvc_rbfs_max_iter': 2000}. Best is trial 0 with value: 0.378283.[0m
[32m[I 2023-02-27 18:38:35,129][0m Trial 4 finished with value: 0.3782834802287911 and parameters: {'lsvc_rbfs_kernel_gamma': 24.9067016203708, 'lsvc_rbfs_kernel_n_components': 150, 'lsvc_rbfs_dual': False, 'lsvc_rbfs_C': 0.0005770684400602979, 'lsvc_rbfs_max_iter': 2000}. Best is trial 0 with value: 0.378283.[0m
[32m[I 2023-02-27 18:39:43,614][0m Trial 5 finished with value: 0.3782834802287911 and parameters: {'lsvc_rbfs_kernel_gamma': 52.566713131947914, 'lsvc_rbfs_kernel_n_components': 100, 'lsvc_rbfs_dual': False, 'lsvc_rbfs_C': 0.25326624529021274, 'lsvc_rbfs_max_iter': 2000}. Best is trial 0 with value: 0.378283.[0m
[32m[I 2023-02-27 18:40:50,933][0m Trial 6 finished with value: 0.3782834802287911 and parameters: {'lsvc_rbfs_kernel_gamma': 0.008790602692429627, 'lsvc_rbfs_kernel_n_components': 150, 'lsvc_rbfs_dual': False, 'lsvc_rbfs_C': 3.499384067657962e-06, 'lsvc_rbfs_max_iter': 2000}. Best is trial 0 with value: 0.378283.[0m
[32m[I 2023-02-27 18:42:27,003][0m Trial 7 finished with value: 0.3782834802287911 and parameters: {'lsvc_rbfs_kernel_gamma': 715.8970312523869, 'lsvc_rbfs_kernel_n_components': 150, 'lsvc_rbfs_dual': False, 'lsvc_rbfs_C': 346.9955130813564, 'lsvc_rbfs_max_iter': 2000}. Best is trial 0 with value: 0.378283.[0m
[32m[I 2023-02-27 18:43:35,462][0m Trial 8 finished with value: 0.3782834802287911 and parameters: {'lsvc_rbfs_kernel_gamma': 41.35977844846639, 'lsvc_rbfs_kernel_n_components': 100, 'lsvc_rbfs_dual': False, 'lsvc_rbfs_C': 0.0008550731033282685, 'lsvc_rbfs_max_iter': 2000}. Best is trial 0 with value: 0.378283.[0m
[32m[I 2023-02-27 18:44:09,732][0m Trial 9 finished with value: 0.3782834802287911 and parameters: {'lsvc_rbfs_kernel_gamma': 0.038569813702684225, 'lsvc_rbfs_kernel_n_components': 50, 'lsvc_rbfs_dual': False, 'lsvc_rbfs_C': 5.645760809013377e-06, 'lsvc_rbfs_max_iter': 2000}. Best is trial 0 with value: 0.378283.[0m
[32m[I 2023-02-27 18:44:53,778][0m Trial 10 finished with value: 0.3782834802287911 and parameters: {'lsvc_rbfs_kernel_gamma': 0.0018042716810213184, 'lsvc_rbfs_kernel_n_components': 50, 'lsvc_rbfs_dual': False, 'lsvc_rbfs_C': 0.0015056753051832525, 'lsvc_rbfs_max_iter': 2000}. Best is trial 0 with value: 0.378283.[0m
[32m[I 2023-02-27 18:46:02,244][0m Trial 11 finished with value: 0.3782834802287911 and parameters: {'lsvc_rbfs_kernel_gamma': 0.19035686255416878, 'lsvc_rbfs_kernel_n_components': 100, 'lsvc_rbfs_dual': False, 'lsvc_rbfs_C': 12.17237292504411, 'lsvc_rbfs_max_iter': 2000}. Best is trial 0 with value: 0.378283.[0m
[32m[I 2023-02-27 18:46:43,578][0m Trial 12 finished with value: 0.3782834802287911 and parameters: {'lsvc_rbfs_kernel_gamma': 0.30693232545357757, 'lsvc_rbfs_kernel_n_components': 50, 'lsvc_rbfs_dual': False, 'lsvc_rbfs_C': 0.02137534009577489, 'lsvc_rbfs_max_iter': 2000}. Best is trial 0 with value: 0.378283.[0m
[32m[I 2023-02-27 18:47:51,797][0m Trial 13 finished with value: 0.3782834802287911 and parameters: {'lsvc_rbfs_kernel_gamma': 1.696727482978196, 'lsvc_rbfs_kernel_n_components': 100, 'lsvc_rbfs_dual': False, 'lsvc_rbfs_C': 31.252627543085865, 'lsvc_rbfs_max_iter': 2000}. Best is trial 0 with value: 0.378283.[0m
[32m[I 2023-02-27 18:48:36,820][0m Trial 14 finished with value: 0.3782834802287911 and parameters: {'lsvc_rbfs_kernel_gamma': 0.0019309589911359502, 'lsvc_rbfs_kernel_n_components': 50, 'lsvc_rbfs_dual': False, 'lsvc_rbfs_C': 0.0402141678893547, 'lsvc_rbfs_max_iter': 2000}. Best is trial 0 with value: 0.378283.[0m
[32m[I 2023-02-27 18:49:45,442][0m Trial 15 finished with value: 0.3782834802287911 and parameters: {'lsvc_rbfs_kernel_gamma': 0.03525405743880809, 'lsvc_rbfs_kernel_n_components': 100, 'lsvc_rbfs_dual': False, 'lsvc_rbfs_C': 4.4072148191220804e-05, 'lsvc_rbfs_max_iter': 2000}. Best is trial 0 with value: 0.378283.[0m
[32m[I 2023-02-27 18:50:28,120][0m Trial 16 finished with value: 0.3782834802287911 and parameters: {'lsvc_rbfs_kernel_gamma': 0.014339733497960604, 'lsvc_rbfs_kernel_n_components': 50, 'lsvc_rbfs_dual': False, 'lsvc_rbfs_C': 3.1221598230735355, 'lsvc_rbfs_max_iter': 2000}. Best is trial 0 with value: 0.378283.[0m
[32m[I 2023-02-27 18:51:12,654][0m Trial 17 finished with value: 0.3782834802287911 and parameters: {'lsvc_rbfs_kernel_gamma': 0.002047168450042453, 'lsvc_rbfs_kernel_n_components': 50, 'lsvc_rbfs_dual': False, 'lsvc_rbfs_C': 0.027235307695704973, 'lsvc_rbfs_max_iter': 2000}. Best is trial 0 with value: 0.378283.[0m
[32m[I 2023-02-27 18:52:21,196][0m Trial 18 finished with value: 0.3782834802287911 and parameters: {'lsvc_rbfs_kernel_gamma': 0.05015834752973554, 'lsvc_rbfs_kernel_n_components': 100, 'lsvc_rbfs_dual': False, 'lsvc_rbfs_C': 5.688807435044845e-05, 'lsvc_rbfs_max_iter': 2000}. Best is trial 0 with value: 0.378283.[0m
[32m[I 2023-02-27 18:53:04,417][0m Trial 19 finished with value: 0.3782834802287911 and parameters: {'lsvc_rbfs_kernel_gamma': 0.010090243110318586, 'lsvc_rbfs_kernel_n_components': 50, 'lsvc_rbfs_dual': False, 'lsvc_rbfs_C': 518.9672087870333, 'lsvc_rbfs_max_iter': 2000}. Best is trial 0 with value: 0.378283.[0m
[32m[I 2023-02-27 18:53:04,480][0m Study finished.[0m
[32m[I 2023-02-27 18:53:04,511][0m --------------------------------------------------------------------------------[0m
[32m[I 2023-02-27 18:53:04,511][0m --------------------             MLPClassifier              --------------------[0m
[32m[I 2023-02-27 18:53:04,527][0m --------------------------------------------------------------------------------[0m
[32m[I 2023-02-27 18:53:04,558][0m A new study created in RDB with name: MLPClassifier_0a1486bb[0m
[32m[I 2023-02-27 18:53:04,558][0m Study started.[0m
[32m[I 2023-02-27 18:53:05,011][0m sklearn.model_selection.train_test_split: running accelerated version on CPU[0m
[32m[I 2023-02-27 18:53:05,199][0m sklearn.model_selection.train_test_split: fallback to original Scikit-learn[0m
[32m[I 2023-02-27 18:57:42,781][0m Trial 0 finished with value: 0.891039131682679 and parameters: {'mlpc_hidden_layer_count': 1, 'mlpc_learning_rate': 'adaptive', 'mlpc_learning_rate_init': 0.00012818654521258574, 'mplc_max_iter': 2000}. Best is trial 0 with value: 0.891039.[0m
[32m[I 2023-02-27 18:57:43,266][0m sklearn.model_selection.train_test_split: running accelerated version on CPU[0m
[32m[I 2023-02-27 18:57:43,407][0m sklearn.model_selection.train_test_split: fallback to original Scikit-learn[0m
[32m[I 2023-02-27 18:59:48,705][0m Trial 1 finished with value: 0.8315200195106943 and parameters: {'mlpc_hidden_layer_count': 1, 'mlpc_learning_rate': 'adaptive', 'mlpc_learning_rate_init': 0.0028151212748111143, 'mplc_max_iter': 2000}. Best is trial 0 with value: 0.891039.[0m
[32m[I 2023-02-27 18:59:49,190][0m sklearn.model_selection.train_test_split: running accelerated version on CPU[0m
[32m[I 2023-02-27 18:59:49,366][0m sklearn.model_selection.train_test_split: fallback to original Scikit-learn[0m
[32m[I 2023-02-27 19:16:40,870][0m Trial 2 finished with value: 0.9119630392773295 and parameters: {'mlpc_hidden_layer_count': 2, 'mlpc_learning_rate': 'constant', 'mlpc_learning_rate_init': 2.631603284824284e-06, 'mplc_max_iter': 2000}. Best is trial 2 with value: 0.911963.[0m
[32m[I 2023-02-27 19:16:41,370][0m sklearn.model_selection.train_test_split: running accelerated version on CPU[0m
[32m[I 2023-02-27 19:16:41,527][0m sklearn.model_selection.train_test_split: fallback to original Scikit-learn[0m
[32m[I 2023-02-27 19:18:19,601][0m Trial 3 finished with value: 0.752073029572469 and parameters: {'mlpc_hidden_layer_count': 1, 'mlpc_learning_rate': 'adaptive', 'mlpc_learning_rate_init': 0.004089352430941874, 'mplc_max_iter': 2000}. Best is trial 2 with value: 0.911963.[0m
[32m[I 2023-02-27 19:18:20,085][0m sklearn.model_selection.train_test_split: running accelerated version on CPU[0m
[32m[I 2023-02-27 19:18:20,257][0m sklearn.model_selection.train_test_split: fallback to original Scikit-learn[0m
[32m[I 2023-02-27 19:23:13,433][0m Trial 4 finished with value: 0.3782834802287911 and parameters: {'mlpc_hidden_layer_count': 2, 'mlpc_learning_rate': 'adaptive', 'mlpc_learning_rate_init': 0.3675288160132809, 'mplc_max_iter': 2000}. Best is trial 2 with value: 0.911963.[0m
[32m[I 2023-02-27 19:23:13,949][0m sklearn.model_selection.train_test_split: running accelerated version on CPU[0m
[32m[I 2023-02-27 19:23:14,105][0m sklearn.model_selection.train_test_split: fallback to original Scikit-learn[0m
[32m[I 2023-02-27 19:29:38,144][0m Trial 5 finished with value: 0.8393629147037066 and parameters: {'mlpc_hidden_layer_count': 2, 'mlpc_learning_rate': 'constant', 'mlpc_learning_rate_init': 3.730022896679134e-05, 'mplc_max_iter': 2000}. Best is trial 2 with value: 0.911963.[0m
[32m[I 2023-02-27 19:29:38,613][0m sklearn.model_selection.train_test_split: running accelerated version on CPU[0m
[32m[I 2023-02-27 19:29:38,769][0m sklearn.model_selection.train_test_split: fallback to original Scikit-learn[0m
[32m[I 2023-02-27 19:32:12,441][0m Trial 6 finished with value: 0.9034469579265303 and parameters: {'mlpc_hidden_layer_count': 1, 'mlpc_learning_rate': 'adaptive', 'mlpc_learning_rate_init': 5.723881133936493e-06, 'mplc_max_iter': 2000}. Best is trial 2 with value: 0.911963.[0m
[32m[I 2023-02-27 19:32:12,925][0m sklearn.model_selection.train_test_split: running accelerated version on CPU[0m
[32m[I 2023-02-27 19:32:13,082][0m sklearn.model_selection.train_test_split: fallback to original Scikit-learn[0m
[32m[I 2023-02-27 19:44:12,520][0m Trial 7 finished with value: 0.8723686813805124 and parameters: {'mlpc_hidden_layer_count': 2, 'mlpc_learning_rate': 'adaptive', 'mlpc_learning_rate_init': 4.2397927320616977e-05, 'mplc_max_iter': 2000}. Best is trial 2 with value: 0.911963.[0m
[32m[I 2023-02-27 19:44:13,036][0m sklearn.model_selection.train_test_split: running accelerated version on CPU[0m
[32m[I 2023-02-27 19:44:13,208][0m sklearn.model_selection.train_test_split: fallback to original Scikit-learn[0m
[32m[I 2023-02-27 19:47:02,874][0m Trial 8 finished with value: 0.9064265918961162 and parameters: {'mlpc_hidden_layer_count': 1, 'mlpc_learning_rate': 'adaptive', 'mlpc_learning_rate_init': 0.00040495469255019776, 'mplc_max_iter': 2000}. Best is trial 2 with value: 0.911963.[0m
[32m[I 2023-02-27 19:47:03,343][0m sklearn.model_selection.train_test_split: running accelerated version on CPU[0m
[32m[I 2023-02-27 19:47:03,501][0m sklearn.model_selection.train_test_split: fallback to original Scikit-learn[0m
