[32m[I 2023-02-27 14:36:23,434][0m Trial 2 finished with value: 0.9770652203427613 and parameters: {'hgbc_learning_rate': 0.29141650447721723, 'hgbc_max_iter': 2000, 'hgbc_min_samples_leaf': 29, 'hgbc_l2_regularization': 0.6000000000000001, 'hgbc_max_bins': 63, 'hgbc_early_stopping': True, 'hgbc_validation_fraction': 0.25, 'hgbc_n_iter_no_change': 10}. Best is trial 1 with value: 0.991494.[0m
[32m[I 2023-02-27 14:46:30,213][0m Trial 3 finished with value: 0.989398027709853 and parameters: {'hgbc_learning_rate': 0.058248344764983015, 'hgbc_max_iter': 2000, 'hgbc_min_samples_leaf': 46, 'hgbc_l2_regularization': 0.8, 'hgbc_max_bins': 63, 'hgbc_early_stopping': True, 'hgbc_validation_fraction': 0.25, 'hgbc_n_iter_no_change': 10}. Best is trial 1 with value: 0.991494.[0m
[32m[I 2023-02-27 15:05:59,075][0m Trial 4 finished with value: 0.9925002947199626 and parameters: {'hgbc_learning_rate': 0.0326126116366847, 'hgbc_max_iter': 2000, 'hgbc_min_samples_leaf': 24, 'hgbc_l2_regularization': 0.4, 'hgbc_max_bins': 255, 'hgbc_early_stopping': True, 'hgbc_validation_fraction': 0.25, 'hgbc_n_iter_no_change': 10}. Best is trial 4 with value: 0.9925.[0m
[32m[I 2023-02-27 15:05:59,138][0m Study finished.[0m
[32m[I 2023-02-27 15:05:59,154][0m --------------------------------------------------------------------------------[0m
[32m[I 2023-02-27 15:05:59,169][0m --------------------             LGBMClassifier             --------------------[0m
[32m[I 2023-02-27 15:05:59,169][0m --------------------------------------------------------------------------------[0m
[32m[I 2023-02-27 15:05:59,185][0m A new study created in RDB with name: LGBMClassifier_0a1486bb[0m
[32m[I 2023-02-27 15:05:59,200][0m Study started.[0m
[32m[I 2023-02-27 15:07:26,470][0m Trial 0 finished with value: 0.3782834802287911 and parameters: {'lgbm_num_leaves': 7, 'lgbm_learning_rate': 1.0030742617306228e-06, 'lgbm_n_estimators': 130, 'lgbm_reg_alpha': 0.7000000000000001, 'lgbm_reg_lambda': 0.0}. Best is trial 0 with value: 0.378283.[0m
[32m[I 2023-02-27 15:09:47,940][0m Trial 1 finished with value: 0.3782834802287911 and parameters: {'lgbm_num_leaves': 31, 'lgbm_learning_rate': 8.73947879333387e-05, 'lgbm_n_estimators': 170, 'lgbm_reg_alpha': 0.9500000000000001, 'lgbm_reg_lambda': 0.0}. Best is trial 0 with value: 0.378283.[0m
[32m[I 2023-02-27 15:10:41,588][0m Trial 2 finished with value: 0.3782834802287911 and parameters: {'lgbm_num_leaves': 127, 'lgbm_learning_rate': 0.00010450846782346411, 'lgbm_n_estimators': 60, 'lgbm_reg_alpha': 0.55, 'lgbm_reg_lambda': 0.2}. Best is trial 0 with value: 0.378283.[0m
[32m[I 2023-02-27 15:12:39,343][0m Trial 3 finished with value: 0.8564864305666556 and parameters: {'lgbm_num_leaves': 7, 'lgbm_learning_rate': 0.001303105111598569, 'lgbm_n_estimators': 160, 'lgbm_reg_alpha': 0.9, 'lgbm_reg_lambda': 0.8}. Best is trial 3 with value: 0.856486.[0m
[32m[I 2023-02-27 15:16:26,883][0m Trial 4 finished with value: 0.9933345189521827 and parameters: {'lgbm_num_leaves': 127, 'lgbm_learning_rate': 0.3108725930014327, 'lgbm_n_estimators': 160, 'lgbm_reg_alpha': 0.0, 'lgbm_reg_lambda': 0.9}. Best is trial 4 with value: 0.993335.[0m
[32m[I 2023-02-27 15:17:27,121][0m Trial 5 finished with value: 0.3782834802287911 and parameters: {'lgbm_num_leaves': 15, 'lgbm_learning_rate': 1.2118091470511841e-06, 'lgbm_n_estimators': 80, 'lgbm_reg_alpha': 0.5, 'lgbm_reg_lambda': 0.35000000000000003}. Best is trial 4 with value: 0.993335.[0m
[32m[I 2023-02-27 15:18:00,587][0m Trial 6 finished with value: 0.9830471863446303 and parameters: {'lgbm_num_leaves': 7, 'lgbm_learning_rate': 0.05556066833922913, 'lgbm_n_estimators': 40, 'lgbm_reg_alpha': 0.75, 'lgbm_reg_lambda': 0.30000000000000004}. Best is trial 4 with value: 0.993335.[0m
[32m[I 2023-02-27 15:18:35,184][0m Trial 7 finished with value: 0.3782834802287911 and parameters: {'lgbm_num_leaves': 7, 'lgbm_learning_rate': 3.0006603314539247e-05, 'lgbm_n_estimators': 50, 'lgbm_reg_alpha': 0.65, 'lgbm_reg_lambda': 0.2}. Best is trial 4 with value: 0.993335.[0m
[32m[I 2023-02-27 15:20:31,238][0m Trial 8 finished with value: 0.3782834802287911 and parameters: {'lgbm_num_leaves': 7, 'lgbm_learning_rate': 0.00024842348443994606, 'lgbm_n_estimators': 160, 'lgbm_reg_alpha': 0.8500000000000001, 'lgbm_reg_lambda': 0.0}. Best is trial 4 with value: 0.993335.[0m
[32m[I 2023-02-27 15:21:45,987][0m Trial 9 finished with value: 0.9861782169308848 and parameters: {'lgbm_num_leaves': 15, 'lgbm_learning_rate': 0.01813178072399932, 'lgbm_n_estimators': 90, 'lgbm_reg_alpha': 0.45, 'lgbm_reg_lambda': 0.2}. Best is trial 4 with value: 0.993335.[0m
[32m[I 2023-02-27 15:26:30,783][0m Trial 10 finished with value: 0.9934626285149689 and parameters: {'lgbm_num_leaves': 127, 'lgbm_learning_rate': 0.20733975770328622, 'lgbm_n_estimators': 200, 'lgbm_reg_alpha': 0.0, 'lgbm_reg_lambda': 0.9500000000000001}. Best is trial 10 with value: 0.993463.[0m
[32m[I 2023-02-27 15:32:29,773][0m Trial 11 finished with value: 0.9904920516665012 and parameters: {'lgbm_num_leaves': 127, 'lgbm_learning_rate': 0.5880821025147894, 'lgbm_n_estimators': 200, 'lgbm_reg_alpha': 0.05, 'lgbm_reg_lambda': 1.0}. Best is trial 10 with value: 0.993463.[0m
[32m[I 2023-02-27 15:36:56,991][0m Trial 12 finished with value: 0.9744814191613933 and parameters: {'lgbm_num_leaves': 127, 'lgbm_learning_rate': 0.8272302288462207, 'lgbm_n_estimators': 200, 'lgbm_reg_alpha': 0.0, 'lgbm_reg_lambda': 0.7000000000000001}. Best is trial 10 with value: 0.993463.[0m
[32m[I 2023-02-27 15:39:19,294][0m Trial 13 finished with value: 0.991607755015998 and parameters: {'lgbm_num_leaves': 63, 'lgbm_learning_rate': 0.06838706343933112, 'lgbm_n_estimators': 130, 'lgbm_reg_alpha': 0.2, 'lgbm_reg_lambda': 1.0}. Best is trial 10 with value: 0.993463.[0m
[32m[I 2023-02-27 15:41:23,751][0m Trial 14 finished with value: 0.987678886289293 and parameters: {'lgbm_num_leaves': 127, 'lgbm_learning_rate': 0.004985697837082821, 'lgbm_n_estimators': 130, 'lgbm_reg_alpha': 0.25, 'lgbm_reg_lambda': 0.8}. Best is trial 10 with value: 0.993463.[0m
[32m[I 2023-02-27 15:41:36,760][0m Trial 15 finished with value: 0.9897413542200261 and parameters: {'lgbm_num_leaves': 127, 'lgbm_learning_rate': 0.15857104355448629, 'lgbm_n_estimators': 10, 'lgbm_reg_alpha': 0.15000000000000002, 'lgbm_reg_lambda': 0.6000000000000001}. Best is trial 10 with value: 0.993463.[0m
[32m[I 2023-02-27 15:44:12,419][0m Trial 16 finished with value: 0.9871951722662162 and parameters: {'lgbm_num_leaves': 31, 'lgbm_learning_rate': 0.007935081951281816, 'lgbm_n_estimators': 180, 'lgbm_reg_alpha': 0.35000000000000003, 'lgbm_reg_lambda': 0.8500000000000001}. Best is trial 10 with value: 0.993463.[0m
[32m[I 2023-02-27 15:47:07,685][0m Trial 17 finished with value: 0.9923780791927599 and parameters: {'lgbm_num_leaves': 63, 'lgbm_learning_rate': 0.2117531791383016, 'lgbm_n_estimators': 140, 'lgbm_reg_alpha': 0.1, 'lgbm_reg_lambda': 0.9}. Best is trial 10 with value: 0.993463.[0m
[32m[I 2023-02-27 15:50:22,196][0m Trial 18 finished with value: 0.991864121340946 and parameters: {'lgbm_num_leaves': 127, 'lgbm_learning_rate': 0.027954528888400887, 'lgbm_n_estimators': 190, 'lgbm_reg_alpha': 0.30000000000000004, 'lgbm_reg_lambda': 0.55}. Best is trial 10 with value: 0.993463.[0m
[32m[I 2023-02-27 15:52:05,174][0m Trial 19 finished with value: 0.8564883318075132 and parameters: {'lgbm_num_leaves': 127, 'lgbm_learning_rate': 0.0017002923846547793, 'lgbm_n_estimators': 110, 'lgbm_reg_alpha': 0.0, 'lgbm_reg_lambda': 0.7000000000000001}. Best is trial 10 with value: 0.993463.[0m
[32m[I 2023-02-27 15:52:05,237][0m Study finished.[0m
[32m[I 2023-02-27 15:52:05,268][0m --------------------------------------------------------------------------------[0m
[32m[I 2023-02-27 15:52:05,268][0m --------------------       LinearDiscriminantAnalysis       --------------------[0m
[32m[I 2023-02-27 15:52:05,268][0m --------------------------------------------------------------------------------[0m
[32m[I 2023-02-27 15:52:05,299][0m A new study created in RDB with name: LinearDiscriminantAnalysis_0a1486bb[0m
[32m[I 2023-02-27 15:52:05,299][0m Study started.[0m
[32m[I 2023-02-27 15:52:12,133][0m Trial 0 finished with value: 0.8967017349098918 and parameters: {'lda_solver': 'eigen', 'lda_n_components': 3, 'lda_tol': 1e-05}. Best is trial 0 with value: 0.896702.[0m
[32m[I 2023-02-27 15:52:17,841][0m Trial 1 finished with value: 0.8967017349098918 and parameters: {'lda_solver': 'lsqr', 'lda_n_components': 2, 'lda_tol': 0.0001}. Best is trial 0 with value: 0.896702.[0m
[32m[I 2023-02-27 15:52:24,753][0m Trial 2 finished with value: 0.8967017349098918 and parameters: {'lda_solver': 'eigen', 'lda_n_components': 7, 'lda_tol': 0.0001}. Best is trial 0 with value: 0.896702.[0m
[32m[I 2023-02-27 15:52:31,397][0m Trial 3 finished with value: 0.896271727873345 and parameters: {'lda_solver': 'svd', 'lda_n_components': 10}. Best is trial 0 with value: 0.896702.[0m
[32m[I 2023-02-27 15:52:38,266][0m Trial 4 finished with value: 0.8967017349098918 and parameters: {'lda_solver': 'eigen', 'lda_n_components': 3, 'lda_tol': 0.0001}. Best is trial 0 with value: 0.896702.[0m
[32m[I 2023-02-27 15:52:45,148][0m Trial 5 finished with value: 0.8967017349098918 and parameters: {'lda_solver': 'eigen', 'lda_n_components': 3, 'lda_tol': 0.001}. Best is trial 0 with value: 0.896702.[0m
[32m[I 2023-02-27 15:52:50,827][0m Trial 6 finished with value: 0.8967017349098918 and parameters: {'lda_solver': 'lsqr', 'lda_n_components': 2, 'lda_tol': 0.0001}. Best is trial 0 with value: 0.896702.[0m
[32m[I 2023-02-27 15:52:56,518][0m Trial 7 finished with value: 0.8967017349098918 and parameters: {'lda_solver': 'lsqr', 'lda_n_components': 8, 'lda_tol': 0.001}. Best is trial 0 with value: 0.896702.[0m
[32m[I 2023-02-27 15:53:03,394][0m Trial 8 finished with value: 0.8967017349098918 and parameters: {'lda_solver': 'eigen', 'lda_n_components': 4, 'lda_tol': 0.001}. Best is trial 0 with value: 0.896702.[0m
[32m[I 2023-02-27 15:53:10,227][0m Trial 9 finished with value: 0.8967017349098918 and parameters: {'lda_solver': 'eigen', 'lda_n_components': 5, 'lda_tol': 1e-05}. Best is trial 0 with value: 0.896702.[0m
[32m[I 2023-02-27 15:53:16,788][0m Trial 10 finished with value: 0.896271727873345 and parameters: {'lda_solver': 'svd', 'lda_n_components': 1}. Best is trial 0 with value: 0.896702.[0m
[32m[I 2023-02-27 15:53:22,476][0m Trial 11 finished with value: 0.8967017349098918 and parameters: {'lda_solver': 'lsqr', 'lda_n_components': 1, 'lda_tol': 1e-05}. Best is trial 0 with value: 0.896702.[0m
[32m[I 2023-02-27 15:53:28,175][0m Trial 12 finished with value: 0.8967017349098918 and parameters: {'lda_solver': 'lsqr', 'lda_n_components': 5, 'lda_tol': 1e-05}. Best is trial 0 with value: 0.896702.[0m
[32m[I 2023-02-27 15:53:33,864][0m Trial 13 finished with value: 0.8967017349098918 and parameters: {'lda_solver': 'lsqr', 'lda_n_components': 3, 'lda_tol': 0.0001}. Best is trial 0 with value: 0.896702.[0m
[32m[I 2023-02-27 15:53:40,452][0m Trial 14 finished with value: 0.896271727873345 and parameters: {'lda_solver': 'svd', 'lda_n_components': 2}. Best is trial 0 with value: 0.896702.[0m
[32m[I 2023-02-27 15:53:46,105][0m Trial 15 finished with value: 0.8967017349098918 and parameters: {'lda_solver': 'lsqr', 'lda_n_components': 6, 'lda_tol': 1e-05}. Best is trial 0 with value: 0.896702.[0m
[32m[I 2023-02-27 15:53:52,954][0m Trial 16 finished with value: 0.8967017349098918 and parameters: {'lda_solver': 'eigen', 'lda_n_components': 4, 'lda_tol': 0.0001}. Best is trial 0 with value: 0.896702.[0m
[32m[I 2023-02-27 15:53:58,637][0m Trial 17 finished with value: 0.8967017349098918 and parameters: {'lda_solver': 'lsqr', 'lda_n_components': 4, 'lda_tol': 1e-05}. Best is trial 0 with value: 0.896702.[0m
[32m[I 2023-02-27 15:54:05,461][0m Trial 18 finished with value: 0.8967017349098918 and parameters: {'lda_solver': 'eigen', 'lda_n_components': 7, 'lda_tol': 1e-05}. Best is trial 0 with value: 0.896702.[0m
[32m[I 2023-02-27 15:54:12,420][0m Trial 19 finished with value: 0.8967017349098918 and parameters: {'lda_solver': 'eigen', 'lda_n_components': 4, 'lda_tol': 0.0001}. Best is trial 0 with value: 0.896702.[0m
[32m[I 2023-02-27 15:54:12,483][0m Study finished.[0m
[32m[I 2023-02-27 15:54:12,514][0m --------------------------------------------------------------------------------[0m
[32m[I 2023-02-27 15:54:12,514][0m --------------------               LinearSVC                --------------------[0m
[32m[I 2023-02-27 15:54:12,514][0m --------------------------------------------------------------------------------[0m
[32m[I 2023-02-27 15:54:12,545][0m A new study created in RDB with name: LinearSVC_0a1486bb[0m
[32m[I 2023-02-27 15:54:12,561][0m Study started.[0m
[32m[I 2023-02-27 15:55:22,921][0m Trial 0 finished with value: 0.8100288608990536 and parameters: {'lsvc_dual': False, 'lsvc_C': 0.0012087131818242943, 'lsvc_max_iter': 2000}. Best is trial 0 with value: 0.810029.[0m
[32m[I 2023-02-27 15:56:33,023][0m Trial 1 finished with value: 0.7998865385059438 and parameters: {'lsvc_dual': False, 'lsvc_C': 4.643037685405436e-05, 'lsvc_max_iter': 2000}. Best is trial 0 with value: 0.810029.[0m
[32m[I 2023-02-27 15:57:43,485][0m Trial 2 finished with value: 0.8077902970849872 and parameters: {'lsvc_dual': False, 'lsvc_C': 66.60474149572767, 'lsvc_max_iter': 2000}. Best is trial 0 with value: 0.810029.[0m
[32m[I 2023-02-27 15:58:55,687][0m Trial 3 finished with value: 0.8092723364544375 and parameters: {'lsvc_dual': False, 'lsvc_C': 2.9699079187544277, 'lsvc_max_iter': 2000}. Best is trial 0 with value: 0.810029.[0m
[32m[I 2023-02-27 16:00:08,383][0m Trial 4 finished with value: 0.8112030316399605 and parameters: {'lsvc_dual': False, 'lsvc_C': 0.000634318911267337, 'lsvc_max_iter': 2000}. Best is trial 4 with value: 0.811203.[0m
[32m[I 2023-02-27 16:01:19,049][0m Trial 5 finished with value: 0.7999662072493954 and parameters: {'lsvc_dual': False, 'lsvc_C': 0.00038634800667899086, 'lsvc_max_iter': 2000}. Best is trial 4 with value: 0.811203.[0m
[32m[I 2023-02-27 16:02:33,279][0m Trial 6 finished with value: 0.8156983618941682 and parameters: {'lsvc_dual': False, 'lsvc_C': 0.00017329005134212927, 'lsvc_max_iter': 2000}. Best is trial 6 with value: 0.815698.[0m
[32m[I 2023-02-27 16:03:43,990][0m Trial 7 finished with value: 0.8111593075432723 and parameters: {'lsvc_dual': False, 'lsvc_C': 1.1411205168275472e-05, 'lsvc_max_iter': 2000}. Best is trial 6 with value: 0.815698.[0m
[32m[I 2023-02-27 16:04:54,386][0m Trial 8 finished with value: 0.7999995453647831 and parameters: {'lsvc_dual': False, 'lsvc_C': 0.29776876330026686, 'lsvc_max_iter': 2000}. Best is trial 6 with value: 0.815698.[0m
[32m[I 2023-02-27 16:06:06,195][0m Trial 9 finished with value: 0.8091708127099737 and parameters: {'lsvc_dual': False, 'lsvc_C': 6.063951674836928e-06, 'lsvc_max_iter': 2000}. Best is trial 6 with value: 0.815698.[0m
[32m[I 2023-02-27 16:07:15,334][0m Trial 10 finished with value: 0.7974486924311853 and parameters: {'lsvc_dual': False, 'lsvc_C': 0.025142431547870034, 'lsvc_max_iter': 2000}. Best is trial 6 with value: 0.815698.[0m
[32m[I 2023-02-27 16:08:27,282][0m Trial 11 finished with value: 0.8092670399451002 and parameters: {'lsvc_dual': False, 'lsvc_C': 0.0035148209425514346, 'lsvc_max_iter': 2000}. Best is trial 6 with value: 0.815698.[0m
[32m[I 2023-02-27 16:09:35,895][0m Trial 12 finished with value: 0.7974206662996965 and parameters: {'lsvc_dual': False, 'lsvc_C': 1.0350639351732244e-06, 'lsvc_max_iter': 2000}. Best is trial 6 with value: 0.815698.[0m
[32m[I 2023-02-27 16:10:48,758][0m Trial 13 finished with value: 0.812266739361801 and parameters: {'lsvc_dual': False, 'lsvc_C': 0.00021493446144794833, 'lsvc_max_iter': 2000}. Best is trial 6 with value: 0.815698.[0m
[32m[I 2023-02-27 16:11:59,331][0m Trial 14 finished with value: 0.8100235973245514 and parameters: {'lsvc_dual': False, 'lsvc_C': 0.040268279619998994, 'lsvc_max_iter': 2000}. Best is trial 6 with value: 0.815698.[0m
[32m[I 2023-02-27 16:13:11,970][0m Trial 15 finished with value: 0.8103939175500506 and parameters: {'lsvc_dual': False, 'lsvc_C': 4.328452931005675e-05, 'lsvc_max_iter': 2000}. Best is trial 6 with value: 0.815698.[0m
[32m[I 2023-02-27 16:14:22,934][0m Trial 16 finished with value: 0.8077720805161762 and parameters: {'lsvc_dual': False, 'lsvc_C': 0.013008437325085578, 'lsvc_max_iter': 2000}. Best is trial 6 with value: 0.815698.[0m
[32m[I 2023-02-27 16:15:33,019][0m Trial 17 finished with value: 0.7974327371465106 and parameters: {'lsvc_dual': False, 'lsvc_C': 8.065033828952033e-05, 'lsvc_max_iter': 2000}. Best is trial 6 with value: 0.815698.[0m
[32m[I 2023-02-27 16:16:43,738][0m Trial 18 finished with value: 0.807788436715581 and parameters: {'lsvc_dual': False, 'lsvc_C': 752.9024067028446, 'lsvc_max_iter': 2000}. Best is trial 6 with value: 0.815698.[0m
[32m[I 2023-02-27 16:17:55,201][0m Trial 19 finished with value: 0.8090384422082535 and parameters: {'lsvc_dual': False, 'lsvc_C': 1.33497563442653e-06, 'lsvc_max_iter': 2000}. Best is trial 6 with value: 0.815698.[0m
[32m[I 2023-02-27 16:17:55,248][0m Study finished.[0m
[32m[I 2023-02-27 16:17:55,279][0m --------------------------------------------------------------------------------[0m
[32m[I 2023-02-27 16:17:55,279][0m --------------------     LinearSVC_AdditiveChi2Sampler      --------------------[0m
[32m[I 2023-02-27 16:17:55,279][0m --------------------------------------------------------------------------------[0m
[32m[I 2023-02-27 16:17:55,311][0m A new study created in RDB with name: LinearSVC_AdditiveChi2Sampler_0a1486bb[0m
[32m[I 2023-02-27 16:17:55,326][0m Study started.[0m
[32m[I 2023-02-27 16:28:59,037][0m Trial 0 finished with value: 0.9051768550989926 and parameters: {'lsvc_ac2s_kernel_sample_steps': 3, 'lsvc_ac2s_dual': False, 'lsvc_ac2s_C': 25.88898624222677, 'lsvc_ac2s_max_iter': 2000}. Best is trial 0 with value: 0.905177.[0m
[32m[I 2023-02-27 16:44:58,477][0m Trial 1 finished with value: 0.9050922134491479 and parameters: {'lsvc_ac2s_kernel_sample_steps': 3, 'lsvc_ac2s_dual': False, 'lsvc_ac2s_C': 38.86417133646712, 'lsvc_ac2s_max_iter': 2000}. Best is trial 0 with value: 0.905177.[0m
[32m[I 2023-02-27 16:46:40,526][0m Trial 2 finished with value: 0.8653167291839091 and parameters: {'lsvc_ac2s_kernel_sample_steps': 1, 'lsvc_ac2s_dual': False, 'lsvc_ac2s_C': 0.001648925968566936, 'lsvc_ac2s_max_iter': 2000}. Best is trial 0 with value: 0.905177.[0m
[32m[I 2023-02-27 16:56:17,439][0m Trial 3 finished with value: 0.902174004423493 and parameters: {'lsvc_ac2s_kernel_sample_steps': 3, 'lsvc_ac2s_dual': False, 'lsvc_ac2s_C': 0.0005458131149353154, 'lsvc_ac2s_max_iter': 2000}. Best is trial 0 with value: 0.905177.[0m
[32m[I 2023-02-27 17:03:09,333][0m Trial 4 finished with value: 0.8989030530384015 and parameters: {'lsvc_ac2s_kernel_sample_steps': 2, 'lsvc_ac2s_dual': False, 'lsvc_ac2s_C': 67.098855680613, 'lsvc_ac2s_max_iter': 2000}. Best is trial 0 with value: 0.905177.[0m
[32m[I 2023-02-27 17:07:44,232][0m Trial 5 finished with value: 0.8932907673795452 and parameters: {'lsvc_ac2s_kernel_sample_steps': 2, 'lsvc_ac2s_dual': False, 'lsvc_ac2s_C': 0.0004594686689918364, 'lsvc_ac2s_max_iter': 2000}. Best is trial 0 with value: 0.905177.[0m
[32m[I 2023-02-27 17:15:25,237][0m Trial 6 finished with value: 0.896224265501057 and parameters: {'lsvc_ac2s_kernel_sample_steps': 2, 'lsvc_ac2s_dual': False, 'lsvc_ac2s_C': 0.9908131930806118, 'lsvc_ac2s_max_iter': 2000}. Best is trial 0 with value: 0.905177.[0m
[32m[I 2023-02-27 17:22:46,982][0m Trial 7 finished with value: 0.8984314541045068 and parameters: {'lsvc_ac2s_kernel_sample_steps': 2, 'lsvc_ac2s_dual': False, 'lsvc_ac2s_C': 1.1769161424051302, 'lsvc_ac2s_max_iter': 2000}. Best is trial 0 with value: 0.905177.[0m
[32m[I 2023-02-27 17:22:47,044][0m Study finished.[0m
[32m[I 2023-02-27 17:22:47,060][0m --------------------------------------------------------------------------------[0m
[32m[I 2023-02-27 17:22:47,076][0m --------------------           LinearSVC_Nystroem           --------------------[0m
[32m[I 2023-02-27 17:22:47,076][0m --------------------------------------------------------------------------------[0m
[32m[I 2023-02-27 17:22:47,091][0m A new study created in RDB with name: LinearSVC_Nystroem_0a1486bb[0m
[32m[I 2023-02-27 17:22:47,107][0m Study started.[0m
[32m[I 2023-02-27 17:23:06,792][0m Trial 0 finished with value: 0.3787074627261618 and parameters: {'lsvc_nystroem_kernel_gamma': 0.018300182964887012, 'lsvc_nystroem_kernel_n_components': 150, 'lsvc_nystroem_dual': False, 'lsvc_nystroem_C': 812.7361259976998, 'lsvc_nystroem_max_iter': 2000}. Best is trial 0 with value: 0.378707.[0m
[32m[I 2023-02-27 17:23:20,311][0m Trial 1 finished with value: 0.3782834802287911 and parameters: {'lsvc_nystroem_kernel_gamma': 58.89913668127913, 'lsvc_nystroem_kernel_n_components': 100, 'lsvc_nystroem_dual': False, 'lsvc_nystroem_C': 1.8668209952468136e-06, 'lsvc_nystroem_max_iter': 2000}. Best is trial 0 with value: 0.378707.[0m
[32m[I 2023-02-27 17:23:35,168][0m Trial 2 finished with value: 0.37904551793517083 and parameters: {'lsvc_nystroem_kernel_gamma': 0.0012645121766324124, 'lsvc_nystroem_kernel_n_components': 100, 'lsvc_nystroem_dual': False, 'lsvc_nystroem_C': 7.527160877562136, 'lsvc_nystroem_max_iter': 2000}. Best is trial 2 with value: 0.379046.[0m
