[32m[I 2022-10-19 19:13:27,236][0m Trial 21 finished with value: 0.38484354706828566 and parameters: {'mnb_alpha': 0.0, 'mnb_fit_prior': True}. Best is trial 23 with value: 0.384844.[0m
[32m[I 2022-10-19 19:13:27,330][0m Trial 22 finished with value: 0.38484354706828566 and parameters: {'mnb_alpha': 0.0, 'mnb_fit_prior': True}. Best is trial 23 with value: 0.384844.[0m
[32m[I 2022-10-19 19:13:29,200][0m Trial 24 finished with value: 0.38484354706828566 and parameters: {'mnb_alpha': 0.0, 'mnb_fit_prior': True}. Best is trial 24 with value: 0.384844.[0m
[32m[I 2022-10-19 19:13:29,642][0m Trial 25 finished with value: 0.38421133911073435 and parameters: {'mnb_alpha': 0.15000000000000002, 'mnb_fit_prior': True}. Best is trial 17 with value: 0.384844.[0m
[32m[I 2022-10-19 19:13:29,736][0m Trial 26 finished with value: 0.38421133911073435 and parameters: {'mnb_alpha': 0.15000000000000002, 'mnb_fit_prior': True}. Best is trial 17 with value: 0.384844.[0m
[32m[I 2022-10-19 19:13:29,862][0m Trial 28 finished with value: 0.38421133911073435 and parameters: {'mnb_alpha': 0.15000000000000002, 'mnb_fit_prior': True}. Best is trial 17 with value: 0.384844.[0m
[32m[I 2022-10-19 19:13:30,034][0m Trial 29 finished with value: 0.38421133911073435 and parameters: {'mnb_alpha': 0.15000000000000002, 'mnb_fit_prior': True}. Best is trial 17 with value: 0.384844.[0m
[32m[I 2022-10-19 19:13:30,050][0m Trial 27 finished with value: 0.38421133911073435 and parameters: {'mnb_alpha': 0.15000000000000002, 'mnb_fit_prior': True}. Best is trial 17 with value: 0.384844.[0m
[32m[I 2022-10-19 19:13:30,113][0m Trial 31 finished with value: 0.38421133911073435 and parameters: {'mnb_alpha': 0.15000000000000002, 'mnb_fit_prior': True}. Best is trial 17 with value: 0.384844.[0m
[32m[I 2022-10-19 19:13:30,113][0m Trial 30 finished with value: 0.38421133911073435 and parameters: {'mnb_alpha': 0.15000000000000002, 'mnb_fit_prior': True}. Best is trial 17 with value: 0.384844.[0m
[32m[I 2022-10-19 19:13:30,488][0m Trial 32 finished with value: 0.38421133911073435 and parameters: {'mnb_alpha': 0.15000000000000002, 'mnb_fit_prior': True}. Best is trial 17 with value: 0.384844.[0m
[32m[I 2022-10-19 19:13:30,566][0m EarlyStopping exceeded for MultinomialNB; no new best scores on iters 20.[0m
[32m[I 2022-10-19 19:13:30,566][0m Study finished.[0m
[32m[I 2022-10-19 19:13:30,597][0m --------------------------------------------------------------------------------[0m
[32m[I 2022-10-19 19:13:30,597][0m --------------------      PassiveAggressiveClassifier       --------------------[0m
[32m[I 2022-10-19 19:13:30,597][0m --------------------------------------------------------------------------------[0m
[32m[I 2022-10-19 19:13:30,629][0m A new study created in RDB with name: PassiveAggressiveClassifier_b9881135[0m
[32m[I 2022-10-19 19:13:30,629][0m Study started.[0m
[32m[I 2022-10-19 19:13:49,298][0m Trial 1 finished with value: 0.4224288938309267 and parameters: {'pac_C': 0.0012635447013226715, 'pac_early_stopping': True, 'pac_validation_fraction': 0.25, 'pac_n_iter_no_change': 10}. Best is trial 1 with value: 0.422429.[0m
[32m[I 2022-10-19 19:13:49,298][0m Trial 4 finished with value: 0.4224288938309267 and parameters: {'pac_C': 6.2840963444778195, 'pac_early_stopping': True, 'pac_validation_fraction': 0.25, 'pac_n_iter_no_change': 10}. Best is trial 1 with value: 0.422429.[0m
[32m[I 2022-10-19 19:13:49,575][0m Trial 3 finished with value: 0.4224288938309267 and parameters: {'pac_C': 1.2973068193321944e-06, 'pac_early_stopping': True, 'pac_validation_fraction': 0.25, 'pac_n_iter_no_change': 10}. Best is trial 1 with value: 0.422429.[0m
[32m[I 2022-10-19 19:13:50,000][0m Trial 5 finished with value: 0.4224288938309267 and parameters: {'pac_C': 381.5477950709292, 'pac_early_stopping': True, 'pac_validation_fraction': 0.25, 'pac_n_iter_no_change': 10}. Best is trial 1 with value: 0.422429.[0m
[32m[I 2022-10-19 19:13:50,203][0m Trial 7 finished with value: 0.4224288938309267 and parameters: {'pac_C': 0.0022497668465045625, 'pac_early_stopping': True, 'pac_validation_fraction': 0.25, 'pac_n_iter_no_change': 10}. Best is trial 1 with value: 0.422429.[0m
[32m[I 2022-10-19 19:13:50,675][0m Trial 2 finished with value: 0.4224288938309267 and parameters: {'pac_C': 5.071472077722556, 'pac_early_stopping': True, 'pac_validation_fraction': 0.25, 'pac_n_iter_no_change': 10}. Best is trial 1 with value: 0.422429.[0m
[32m[I 2022-10-19 19:13:50,942][0m Trial 0 finished with value: 0.4224288938309267 and parameters: {'pac_C': 0.784922966594427, 'pac_early_stopping': True, 'pac_validation_fraction': 0.25, 'pac_n_iter_no_change': 10}. Best is trial 0 with value: 0.422429.[0m
[32m[I 2022-10-19 19:13:50,942][0m Trial 6 finished with value: 0.4224288938309267 and parameters: {'pac_C': 5.458581114901941, 'pac_early_stopping': True, 'pac_validation_fraction': 0.25, 'pac_n_iter_no_change': 10}. Best is trial 0 with value: 0.422429.[0m
[32m[I 2022-10-19 19:14:07,983][0m Trial 8 finished with value: 0.4224288938309267 and parameters: {'pac_C': 158.7814124359563, 'pac_early_stopping': True, 'pac_validation_fraction': 0.25, 'pac_n_iter_no_change': 10}. Best is trial 0 with value: 0.422429.[0m
[32m[I 2022-10-19 19:14:08,463][0m Trial 10 finished with value: 0.4224288938309267 and parameters: {'pac_C': 0.02813749851969191, 'pac_early_stopping': True, 'pac_validation_fraction': 0.25, 'pac_n_iter_no_change': 10}. Best is trial 0 with value: 0.422429.[0m
[32m[I 2022-10-19 19:14:08,714][0m Trial 9 finished with value: 0.4224288938309267 and parameters: {'pac_C': 213.9129930451667, 'pac_early_stopping': True, 'pac_validation_fraction': 0.25, 'pac_n_iter_no_change': 10}. Best is trial 0 with value: 0.422429.[0m
[32m[I 2022-10-19 19:14:09,155][0m Trial 12 finished with value: 0.4224288938309267 and parameters: {'pac_C': 0.0005777809191503822, 'pac_early_stopping': True, 'pac_validation_fraction': 0.25, 'pac_n_iter_no_change': 10}. Best is trial 0 with value: 0.422429.[0m
[32m[I 2022-10-19 19:14:09,343][0m Trial 11 finished with value: 0.4224288938309267 and parameters: {'pac_C': 42.26957662092255, 'pac_early_stopping': True, 'pac_validation_fraction': 0.25, 'pac_n_iter_no_change': 10}. Best is trial 0 with value: 0.422429.[0m
[32m[I 2022-10-19 19:14:09,985][0m Trial 13 finished with value: 0.4224288938309267 and parameters: {'pac_C': 13.068163744034605, 'pac_early_stopping': True, 'pac_validation_fraction': 0.25, 'pac_n_iter_no_change': 10}. Best is trial 0 with value: 0.422429.[0m
[32m[I 2022-10-19 19:14:10,378][0m Trial 14 finished with value: 0.4224288938309267 and parameters: {'pac_C': 7.796894233992478e-05, 'pac_early_stopping': True, 'pac_validation_fraction': 0.25, 'pac_n_iter_no_change': 10}. Best is trial 0 with value: 0.422429.[0m
[32m[I 2022-10-19 19:14:10,515][0m Trial 15 finished with value: 0.4224288938309267 and parameters: {'pac_C': 0.04373176456039386, 'pac_early_stopping': True, 'pac_validation_fraction': 0.25, 'pac_n_iter_no_change': 10}. Best is trial 0 with value: 0.422429.[0m
[32m[I 2022-10-19 19:14:24,366][0m Trial 16 finished with value: 0.4224288938309267 and parameters: {'pac_C': 6.454171608947829e-06, 'pac_early_stopping': True, 'pac_validation_fraction': 0.25, 'pac_n_iter_no_change': 10}. Best is trial 0 with value: 0.422429.[0m
[32m[I 2022-10-19 19:14:24,915][0m Trial 17 finished with value: 0.4224288938309267 and parameters: {'pac_C': 1.652552508251589e-05, 'pac_early_stopping': True, 'pac_validation_fraction': 0.25, 'pac_n_iter_no_change': 10}. Best is trial 0 with value: 0.422429.[0m
[32m[I 2022-10-19 19:14:25,354][0m Trial 18 finished with value: 0.4224288938309267 and parameters: {'pac_C': 0.00019270487883581025, 'pac_early_stopping': True, 'pac_validation_fraction': 0.25, 'pac_n_iter_no_change': 10}. Best is trial 0 with value: 0.422429.[0m
[32m[I 2022-10-19 19:14:25,527][0m Trial 20 finished with value: 0.4224288938309267 and parameters: {'pac_C': 7.941837879481308e-05, 'pac_early_stopping': True, 'pac_validation_fraction': 0.25, 'pac_n_iter_no_change': 10}. Best is trial 0 with value: 0.422429.[0m
[32m[I 2022-10-19 19:14:25,527][0m Trial 19 finished with value: 0.4224288938309267 and parameters: {'pac_C': 3.503268570948775e-05, 'pac_early_stopping': True, 'pac_validation_fraction': 0.25, 'pac_n_iter_no_change': 10}. Best is trial 0 with value: 0.422429.[0m
[32m[I 2022-10-19 19:14:25,918][0m Trial 21 finished with value: 0.4224288938309267 and parameters: {'pac_C': 0.13188436462873662, 'pac_early_stopping': True, 'pac_validation_fraction': 0.25, 'pac_n_iter_no_change': 10}. Best is trial 0 with value: 0.422429.[0m
[32m[I 2022-10-19 19:14:26,002][0m EarlyStopping exceeded for PassiveAggressiveClassifier; no new best scores on iters 20.[0m
[32m[I 2022-10-19 19:14:26,002][0m Study finished.[0m
[32m[I 2022-10-19 19:14:26,018][0m --------------------------------------------------------------------------------[0m
[32m[I 2022-10-19 19:14:26,018][0m --------------------               Perceptron               --------------------[0m
[32m[I 2022-10-19 19:14:26,018][0m --------------------------------------------------------------------------------[0m
[32m[I 2022-10-19 19:14:26,049][0m A new study created in RDB with name: Perceptron_b9881135[0m
[32m[I 2022-10-19 19:14:26,049][0m Study started.[0m
[32m[I 2022-10-19 19:14:40,084][0m Trial 3 finished with value: 0.2844441188051378 and parameters: {'p_penalty': 'elasticnet', 'p_alpha': 0.13351185188323939, 'p_eta0': 2.0, 'p_early_stopping': True, 'p_validation_fraction': 0.25, 'p_n_iter_no_change': 10}. Best is trial 3 with value: 0.284444.[0m
[32m[I 2022-10-19 19:14:41,354][0m Trial 6 finished with value: 0.12388641062088446 and parameters: {'p_penalty': 'elasticnet', 'p_alpha': 0.5752755224881139, 'p_eta0': 2.0, 'p_early_stopping': True, 'p_validation_fraction': 0.25, 'p_n_iter_no_change': 10}. Best is trial 3 with value: 0.284444.[0m
[32m[I 2022-10-19 19:14:41,604][0m Trial 2 finished with value: 0.2844441188051378 and parameters: {'p_penalty': 'elasticnet', 'p_alpha': 0.6088859803754306, 'p_eta0': 1.5, 'p_early_stopping': True, 'p_validation_fraction': 0.25, 'p_n_iter_no_change': 10}. Best is trial 1 with value: 0.284444.[0m
[32m[I 2022-10-19 19:14:41,604][0m Trial 1 finished with value: 0.2844441188051378 and parameters: {'p_penalty': 'elasticnet', 'p_alpha': 0.4680813322608084, 'p_eta0': 2.0, 'p_early_stopping': True, 'p_validation_fraction': 0.25, 'p_n_iter_no_change': 10}. Best is trial 1 with value: 0.284444.[0m
[32m[I 2022-10-19 19:14:41,997][0m Trial 7 finished with value: 0.42401165905920235 and parameters: {'p_penalty': 'elasticnet', 'p_alpha': 0.0014379522007798762, 'p_eta0': 2.0, 'p_early_stopping': True, 'p_validation_fraction': 0.25, 'p_n_iter_no_change': 10}. Best is trial 7 with value: 0.424012.[0m
[32m[I 2022-10-19 19:14:42,709][0m Trial 4 finished with value: 0.2503616112203047 and parameters: {'p_penalty': 'elasticnet', 'p_alpha': 8.306485045000451e-06, 'p_eta0': 2.0, 'p_early_stopping': True, 'p_validation_fraction': 0.25, 'p_n_iter_no_change': 10}. Best is trial 7 with value: 0.424012.[0m
[32m[I 2022-10-19 19:14:43,389][0m Trial 5 finished with value: 0.16970668206380304 and parameters: {'p_penalty': 'elasticnet', 'p_alpha': 0.05516012695681018, 'p_eta0': 0.5, 'p_early_stopping': True, 'p_validation_fraction': 0.25, 'p_n_iter_no_change': 10}. Best is trial 7 with value: 0.424012.[0m
[32m[I 2022-10-19 19:14:43,984][0m Trial 0 finished with value: 0.2844441188051378 and parameters: {'p_penalty': 'elasticnet', 'p_alpha': 0.062245816088821196, 'p_eta0': 2.0, 'p_early_stopping': True, 'p_validation_fraction': 0.25, 'p_n_iter_no_change': 10}. Best is trial 7 with value: 0.424012.[0m
[32m[I 2022-10-19 19:14:54,412][0m Trial 8 finished with value: 0.2844441188051378 and parameters: {'p_penalty': 'elasticnet', 'p_alpha': 0.0002451920026593432, 'p_eta0': 1.0, 'p_early_stopping': True, 'p_validation_fraction': 0.25, 'p_n_iter_no_change': 10}. Best is trial 7 with value: 0.424012.[0m
[32m[I 2022-10-19 19:14:55,245][0m Trial 12 finished with value: 0.07399138544370873 and parameters: {'p_penalty': 'elasticnet', 'p_alpha': 0.8854949622547463, 'p_eta0': 1.5, 'p_early_stopping': True, 'p_validation_fraction': 0.25, 'p_n_iter_no_change': 10}. Best is trial 7 with value: 0.424012.[0m
[32m[I 2022-10-19 19:14:55,683][0m Trial 13 finished with value: 0.3997325367665019 and parameters: {'p_penalty': 'elasticnet', 'p_alpha': 0.006697300146731036, 'p_eta0': 0.5, 'p_early_stopping': True, 'p_validation_fraction': 0.25, 'p_n_iter_no_change': 10}. Best is trial 7 with value: 0.424012.[0m
[32m[I 2022-10-19 19:14:56,523][0m Trial 9 finished with value: 0.2844441188051378 and parameters: {'p_penalty': 'elasticnet', 'p_alpha': 0.07345011778942534, 'p_eta0': 1.0, 'p_early_stopping': True, 'p_validation_fraction': 0.25, 'p_n_iter_no_change': 10}. Best is trial 7 with value: 0.424012.[0m
[32m[I 2022-10-19 19:14:57,356][0m Trial 14 finished with value: 0.5616204725686426 and parameters: {'p_penalty': 'elasticnet', 'p_alpha': 0.3790629658420383, 'p_eta0': 1.0, 'p_early_stopping': True, 'p_validation_fraction': 0.25, 'p_n_iter_no_change': 10}. Best is trial 14 with value: 0.56162.[0m
[32m[I 2022-10-19 19:14:57,356][0m Trial 11 finished with value: 0.4236599892248675 and parameters: {'p_penalty': 'elasticnet', 'p_alpha': 0.003319910509058651, 'p_eta0': 1.0, 'p_early_stopping': True, 'p_validation_fraction': 0.25, 'p_n_iter_no_change': 10}. Best is trial 14 with value: 0.56162.[0m
[32m[I 2022-10-19 19:14:59,039][0m Trial 10 finished with value: 0.25492065630400607 and parameters: {'p_penalty': 'elasticnet', 'p_alpha': 1.7541645395521919e-06, 'p_eta0': 1.0, 'p_early_stopping': True, 'p_validation_fraction': 0.25, 'p_n_iter_no_change': 10}. Best is trial 14 with value: 0.56162.[0m
[32m[I 2022-10-19 19:15:01,734][0m Trial 15 finished with value: 0.23615283589735966 and parameters: {'p_penalty': 'elasticnet', 'p_alpha': 1.3211614980041168e-06, 'p_eta0': 0.5, 'p_early_stopping': True, 'p_validation_fraction': 0.25, 'p_n_iter_no_change': 10}. Best is trial 14 with value: 0.56162.[0m
[32m[I 2022-10-19 19:15:08,789][0m Trial 18 finished with value: 0.42340888864669596 and parameters: {'p_penalty': 'elasticnet', 'p_alpha': 0.0027568342476811994, 'p_eta0': 0.5, 'p_early_stopping': True, 'p_validation_fraction': 0.25, 'p_n_iter_no_change': 10}. Best is trial 14 with value: 0.56162.[0m
[32m[I 2022-10-19 19:15:09,366][0m Trial 16 finished with value: 0.2069170009544136 and parameters: {'p_penalty': 'elasticnet', 'p_alpha': 7.950487093392058e-06, 'p_eta0': 0.5, 'p_early_stopping': True, 'p_validation_fraction': 0.25, 'p_n_iter_no_change': 10}. Best is trial 14 with value: 0.56162.[0m
[32m[I 2022-10-19 19:15:10,640][0m Trial 17 finished with value: 0.423603631259025 and parameters: {'p_penalty': 'elasticnet', 'p_alpha': 0.0015622804815341223, 'p_eta0': 1.0, 'p_early_stopping': True, 'p_validation_fraction': 0.25, 'p_n_iter_no_change': 10}. Best is trial 14 with value: 0.56162.[0m
[32m[I 2022-10-19 19:15:12,186][0m Trial 20 finished with value: 0.2844441188051378 and parameters: {'p_penalty': 'elasticnet', 'p_alpha': 0.00014022516058183703, 'p_eta0': 1.5, 'p_early_stopping': True, 'p_validation_fraction': 0.25, 'p_n_iter_no_change': 10}. Best is trial 14 with value: 0.56162.[0m
[32m[I 2022-10-19 19:15:12,186][0m Trial 22 finished with value: 0.17097347996250128 and parameters: {'p_penalty': 'elasticnet', 'p_alpha': 4.051077900568898e-05, 'p_eta0': 1.5, 'p_early_stopping': True, 'p_validation_fraction': 0.25, 'p_n_iter_no_change': 10}. Best is trial 14 with value: 0.56162.[0m
[32m[I 2022-10-19 19:15:12,800][0m Trial 21 finished with value: 0.20621109599609896 and parameters: {'p_penalty': 'elasticnet', 'p_alpha': 0.00014165671629485152, 'p_eta0': 1.5, 'p_early_stopping': True, 'p_validation_fraction': 0.25, 'p_n_iter_no_change': 10}. Best is trial 14 with value: 0.56162.[0m
[32m[I 2022-10-19 19:15:13,418][0m Trial 19 finished with value: 0.3645269768073133 and parameters: {'p_penalty': 'elasticnet', 'p_alpha': 0.0025387313189160305, 'p_eta0': 0.5, 'p_early_stopping': True, 'p_validation_fraction': 0.25, 'p_n_iter_no_change': 10}. Best is trial 14 with value: 0.56162.[0m
[32m[I 2022-10-19 19:15:14,873][0m Trial 23 finished with value: 0.2990056990148396 and parameters: {'p_penalty': 'elasticnet', 'p_alpha': 0.00021304767885179518, 'p_eta0': 1.5, 'p_early_stopping': True, 'p_validation_fraction': 0.25, 'p_n_iter_no_change': 10}. Best is trial 14 with value: 0.56162.[0m
[32m[I 2022-10-19 19:15:22,421][0m Trial 24 finished with value: 0.2844441188051378 and parameters: {'p_penalty': 'elasticnet', 'p_alpha': 0.00016679262625546545, 'p_eta0': 1.5, 'p_early_stopping': True, 'p_validation_fraction': 0.25, 'p_n_iter_no_change': 10}. Best is trial 14 with value: 0.56162.[0m
[32m[I 2022-10-19 19:15:22,687][0m Trial 26 finished with value: 0.028422589202317806 and parameters: {'p_penalty': 'elasticnet', 'p_alpha': 0.00025743957149824834, 'p_eta0': 1.5, 'p_early_stopping': True, 'p_validation_fraction': 0.25, 'p_n_iter_no_change': 10}. Best is trial 14 with value: 0.56162.[0m
[32m[I 2022-10-19 19:15:22,828][0m Trial 25 finished with value: 0.2844441188051378 and parameters: {'p_penalty': 'elasticnet', 'p_alpha': 0.00018691533113967483, 'p_eta0': 1.5, 'p_early_stopping': True, 'p_validation_fraction': 0.25, 'p_n_iter_no_change': 10}. Best is trial 14 with value: 0.56162.[0m
[32m[I 2022-10-19 19:15:24,250][0m Trial 29 finished with value: 0.4688162601866879 and parameters: {'p_penalty': 'elasticnet', 'p_alpha': 0.005409257131737371, 'p_eta0': 1.0, 'p_early_stopping': True, 'p_validation_fraction': 0.25, 'p_n_iter_no_change': 10}. Best is trial 14 with value: 0.56162.[0m
[32m[I 2022-10-19 19:15:25,116][0m Trial 28 finished with value: 0.2844441188051378 and parameters: {'p_penalty': 'elasticnet', 'p_alpha': 0.008336867857339485, 'p_eta0': 1.0, 'p_early_stopping': True, 'p_validation_fraction': 0.25, 'p_n_iter_no_change': 10}. Best is trial 14 with value: 0.56162.[0m
[32m[I 2022-10-19 19:15:25,460][0m Trial 27 finished with value: 0.14976288677323563 and parameters: {'p_penalty': 'elasticnet', 'p_alpha': 0.012109232869527777, 'p_eta0': 1.0, 'p_early_stopping': True, 'p_validation_fraction': 0.25, 'p_n_iter_no_change': 10}. Best is trial 14 with value: 0.56162.[0m
[32m[I 2022-10-19 19:15:25,538][0m EarlyStopping exceeded for Perceptron; no new best scores on iters 20.[0m
[32m[I 2022-10-19 19:15:25,538][0m Study finished.[0m
[32m[I 2022-10-19 19:15:25,554][0m --------------------------------------------------------------------------------[0m
[32m[I 2022-10-19 19:15:25,554][0m --------------------     QuadraticDiscriminantAnalysis      --------------------[0m
[32m[I 2022-10-19 19:15:25,569][0m --------------------------------------------------------------------------------[0m
[32m[I 2022-10-19 19:15:25,585][0m A new study created in RDB with name: QuadraticDiscriminantAnalysis_b9881135[0m
[32m[I 2022-10-19 19:15:25,601][0m Study started.[0m
[32m[I 2022-10-19 19:15:37,829][0m Trial 4 finished with value: 0.8902004936721672 and parameters: {'qda_reg_param': 0.6000000000000001, 'qda_tol': 0.0003263574897793685}. Best is trial 4 with value: 0.8902.[0m
[32m[I 2022-10-19 19:15:37,971][0m Trial 3 finished with value: 0.8880056295866787 and parameters: {'qda_reg_param': 0.7000000000000001, 'qda_tol': 3.080240344722147e-05}. Best is trial 4 with value: 0.8902.[0m
[32m[I 2022-10-19 19:15:38,097][0m Trial 0 finished with value: 0.8880056295866787 and parameters: {'qda_reg_param': 0.75, 'qda_tol': 0.0005627452719795113}. Best is trial 4 with value: 0.8902.[0m
[32m[I 2022-10-19 19:15:38,300][0m Trial 6 finished with value: 0.8880056295866787 and parameters: {'qda_reg_param': 0.8, 'qda_tol': 1.6833213022324518e-05}. Best is trial 2 with value: 0.905848.[0m
[32m[I 2022-10-19 19:15:38,395][0m Trial 2 finished with value: 0.905848436475046 and parameters: {'qda_reg_param': 0.2, 'qda_tol': 0.00010561743162775741}. Best is trial 2 with value: 0.905848.[0m
[32m[I 2022-10-19 19:15:38,488][0m Trial 1 finished with value: 0.8915367692986965 and parameters: {'qda_reg_param': 0.5, 'qda_tol': 0.0002587869674252834}. Best is trial 2 with value: 0.905848.[0m
[32m[I 2022-10-19 19:15:38,665][0m Trial 7 finished with value: 0.87267830627431 and parameters: {'qda_reg_param': 1.0, 'qda_tol': 2.2006270828573122e-05}. Best is trial 2 with value: 0.905848.[0m
[32m[I 2022-10-19 19:15:38,886][0m Trial 5 finished with value: 0.8879634640551044 and parameters: {'qda_reg_param': 0.8500000000000001, 'qda_tol': 3.855100360628566e-06}. Best is trial 2 with value: 0.905848.[0m
[32m[I 2022-10-19 19:15:47,638][0m Trial 8 finished with value: 0.8902004936721672 and parameters: {'qda_reg_param': 0.6000000000000001, 'qda_tol': 0.00013202013276090793}. Best is trial 2 with value: 0.905848.[0m
[32m[I 2022-10-19 19:15:49,997][0m Trial 9 finished with value: 0.8880056295866787 and parameters: {'qda_reg_param': 0.7000000000000001, 'qda_tol': 4.477807883712211e-06}. Best is trial 2 with value: 0.905848.[0m
[32m[I 2022-10-19 19:15:50,298][0m Trial 10 finished with value: 0.8829622959250618 and parameters: {'qda_reg_param': 0.9, 'qda_tol': 3.275714316789135e-05}. Best is trial 2 with value: 0.905848.[0m
[32m[I 2022-10-19 19:15:50,731][0m Trial 11 finished with value: 0.8959405588555578 and parameters: {'qda_reg_param': 0.45, 'qda_tol': 2.6688121074140093e-05}. Best is trial 2 with value: 0.907471.[0m
[32m[I 2022-10-19 19:15:50,944][0m Trial 13 finished with value: 0.9074710020951025 and parameters: {'qda_reg_param': 0.05, 'qda_tol': 1.2301223473953051e-06}. Best is trial 13 with value: 0.907471.[0m
