[32m[I 2022-10-19 18:25:32,213][0m Trial 18 finished with value: 0.2844441188051378 and parameters: {'lsvc_rbfs_kernel_gamma': 45.44996341156773, 'lsvc_rbfs_kernel_n_components': 100, 'lsvc_rbfs_dual': False, 'lsvc_rbfs_C': 0.018181521140764708, 'lsvc_rbfs_max_iter': 2000}. Best is trial 0 with value: 0.284444.[0m
[32m[I 2022-10-19 18:25:38,297][0m Trial 19 finished with value: 0.2844441188051378 and parameters: {'lsvc_rbfs_kernel_gamma': 0.06394138013621103, 'lsvc_rbfs_kernel_n_components': 50, 'lsvc_rbfs_dual': False, 'lsvc_rbfs_C': 0.747832577512637, 'lsvc_rbfs_max_iter': 2000}. Best is trial 0 with value: 0.284444.[0m
[32m[I 2022-10-19 18:25:47,422][0m Trial 20 finished with value: 0.2844441188051378 and parameters: {'lsvc_rbfs_kernel_gamma': 176.93264317884135, 'lsvc_rbfs_kernel_n_components': 150, 'lsvc_rbfs_dual': False, 'lsvc_rbfs_C': 1.301865040310559e-06, 'lsvc_rbfs_max_iter': 2000}. Best is trial 0 with value: 0.284444.[0m
[32m[I 2022-10-19 18:25:59,008][0m Trial 21 finished with value: 0.2844441188051378 and parameters: {'lsvc_rbfs_kernel_gamma': 7.771149861472571, 'lsvc_rbfs_kernel_n_components': 150, 'lsvc_rbfs_dual': False, 'lsvc_rbfs_C': 0.0035968954954521165, 'lsvc_rbfs_max_iter': 2000}. Best is trial 0 with value: 0.284444.[0m
[32m[I 2022-10-19 18:25:59,071][0m EarlyStopping exceeded for LinearSVC_RBFSampler; no new best scores on iters 20.[0m
[32m[I 2022-10-19 18:25:59,086][0m Study finished.[0m
[32m[I 2022-10-19 18:25:59,102][0m --------------------------------------------------------------------------------[0m
[32m[I 2022-10-19 18:25:59,102][0m --------------------             MLPClassifier              --------------------[0m
[32m[I 2022-10-19 18:25:59,102][0m --------------------------------------------------------------------------------[0m
[32m[I 2022-10-19 18:25:59,133][0m A new study created in RDB with name: MLPClassifier_b9881135[0m
[32m[I 2022-10-19 18:25:59,133][0m Study started.[0m
[32m[I 2022-10-19 18:25:59,497][0m sklearn.model_selection.train_test_split: running accelerated version on CPU[0m
[32m[I 2022-10-19 18:25:59,546][0m sklearn.model_selection.train_test_split: fallback to original Scikit-learn[0m
[32m[I 2022-10-19 18:25:59,562][0m sklearn.model_selection.train_test_split: running accelerated version on CPU[0m
[32m[I 2022-10-19 18:25:59,614][0m sklearn.model_selection.train_test_split: fallback to original Scikit-learn[0m
[32m[I 2022-10-19 18:25:59,657][0m sklearn.model_selection.train_test_split: running accelerated version on CPU[0m
[32m[I 2022-10-19 18:25:59,673][0m sklearn.model_selection.train_test_split: running accelerated version on CPU[0m
[32m[I 2022-10-19 18:25:59,735][0m sklearn.model_selection.train_test_split: fallback to original Scikit-learn[0m
[32m[I 2022-10-19 18:25:59,803][0m sklearn.model_selection.train_test_split: fallback to original Scikit-learn[0m
[32m[I 2022-10-19 18:25:59,803][0m sklearn.model_selection.train_test_split: running accelerated version on CPU[0m
[32m[I 2022-10-19 18:25:59,808][0m sklearn.model_selection.train_test_split: running accelerated version on CPU[0m
[32m[I 2022-10-19 18:25:59,874][0m sklearn.model_selection.train_test_split: fallback to original Scikit-learn[0m
[32m[I 2022-10-19 18:25:59,922][0m sklearn.model_selection.train_test_split: fallback to original Scikit-learn[0m
[32m[I 2022-10-19 18:25:59,938][0m sklearn.model_selection.train_test_split: running accelerated version on CPU[0m
[32m[I 2022-10-19 18:25:59,954][0m sklearn.model_selection.train_test_split: running accelerated version on CPU[0m
[32m[I 2022-10-19 18:26:00,002][0m sklearn.model_selection.train_test_split: fallback to original Scikit-learn[0m
[32m[I 2022-10-19 18:26:00,050][0m sklearn.model_selection.train_test_split: fallback to original Scikit-learn[0m
[32m[I 2022-10-19 18:28:00,027][0m Trial 2 finished with value: 0.2844441188051378 and parameters: {'mlpc_hidden_layer_count': 1, 'mlpc_learning_rate': 'adaptive', 'mlpc_learning_rate_init': 0.2554387727189453, 'mplc_max_iter': 2000}. Best is trial 2 with value: 0.284444.[0m
[32m[I 2022-10-19 18:28:00,295][0m sklearn.model_selection.train_test_split: running accelerated version on CPU[0m
[32m[I 2022-10-19 18:28:00,342][0m sklearn.model_selection.train_test_split: fallback to original Scikit-learn[0m
[32m[I 2022-10-19 18:30:43,854][0m Trial 0 finished with value: 0.2844441188051378 and parameters: {'mlpc_hidden_layer_count': 2, 'mlpc_learning_rate': 'adaptive', 'mlpc_learning_rate_init': 0.0135891505665287, 'mplc_max_iter': 2000}. Best is trial 0 with value: 0.284444.[0m
[32m[I 2022-10-19 18:30:44,108][0m sklearn.model_selection.train_test_split: running accelerated version on CPU[0m
[32m[I 2022-10-19 18:30:44,155][0m sklearn.model_selection.train_test_split: fallback to original Scikit-learn[0m
[32m[I 2022-10-19 18:31:08,260][0m Trial 6 finished with value: 0.6088571938822024 and parameters: {'mlpc_hidden_layer_count': 2, 'mlpc_learning_rate': 'constant', 'mlpc_learning_rate_init': 0.013344100981979475, 'mplc_max_iter': 2000}. Best is trial 6 with value: 0.608857.[0m
[32m[I 2022-10-19 18:31:08,508][0m sklearn.model_selection.train_test_split: running accelerated version on CPU[0m
[32m[I 2022-10-19 18:31:08,557][0m sklearn.model_selection.train_test_split: fallback to original Scikit-learn[0m
[32m[I 2022-10-19 18:34:21,053][0m Trial 5 finished with value: 0.2844441188051378 and parameters: {'mlpc_hidden_layer_count': 3, 'mlpc_learning_rate': 'constant', 'mlpc_learning_rate_init': 0.19399212856128373, 'mplc_max_iter': 2000}. Best is trial 6 with value: 0.608857.[0m
[32m[I 2022-10-19 18:34:21,343][0m sklearn.model_selection.train_test_split: running accelerated version on CPU[0m
[32m[I 2022-10-19 18:34:21,392][0m sklearn.model_selection.train_test_split: fallback to original Scikit-learn[0m
[32m[I 2022-10-19 18:35:16,540][0m Trial 4 finished with value: 0.990105833227001 and parameters: {'mlpc_hidden_layer_count': 1, 'mlpc_learning_rate': 'constant', 'mlpc_learning_rate_init': 0.0009605231620438353, 'mplc_max_iter': 2000}. Best is trial 4 with value: 0.990106.[0m
[32m[I 2022-10-19 18:35:16,806][0m sklearn.model_selection.train_test_split: running accelerated version on CPU[0m
[32m[I 2022-10-19 18:35:16,854][0m sklearn.model_selection.train_test_split: fallback to original Scikit-learn[0m
[32m[I 2022-10-19 18:35:31,870][0m Trial 9 finished with value: 0.6030029054749461 and parameters: {'mlpc_hidden_layer_count': 2, 'mlpc_learning_rate': 'invscaling', 'mlpc_learning_rate_init': 0.007235818029998553, 'mplc_max_iter': 2000}. Best is trial 4 with value: 0.990106.[0m
[32m[I 2022-10-19 18:35:32,123][0m sklearn.model_selection.train_test_split: running accelerated version on CPU[0m
[32m[I 2022-10-19 18:35:32,171][0m sklearn.model_selection.train_test_split: fallback to original Scikit-learn[0m
[32m[I 2022-10-19 18:37:34,751][0m Trial 1 finished with value: 0.8325112875846824 and parameters: {'mlpc_hidden_layer_count': 3, 'mlpc_learning_rate': 'invscaling', 'mlpc_learning_rate_init': 0.00236063244010664, 'mplc_max_iter': 2000}. Best is trial 4 with value: 0.990106.[0m
[32m[I 2022-10-19 18:37:35,017][0m sklearn.model_selection.train_test_split: running accelerated version on CPU[0m
[32m[I 2022-10-19 18:37:35,049][0m sklearn.model_selection.train_test_split: fallback to original Scikit-learn[0m
[32m[I 2022-10-19 18:39:33,068][0m Trial 13 finished with value: 0.9884612849350234 and parameters: {'mlpc_hidden_layer_count': 1, 'mlpc_learning_rate': 'invscaling', 'mlpc_learning_rate_init': 5.308063948353035e-05, 'mplc_max_iter': 2000}. Best is trial 4 with value: 0.990106.[0m
[32m[I 2022-10-19 18:39:33,323][0m sklearn.model_selection.train_test_split: running accelerated version on CPU[0m
[32m[I 2022-10-19 18:39:33,370][0m sklearn.model_selection.train_test_split: fallback to original Scikit-learn[0m
[32m[I 2022-10-19 18:41:01,992][0m Trial 11 finished with value: 0.9873846042273883 and parameters: {'mlpc_hidden_layer_count': 1, 'mlpc_learning_rate': 'constant', 'mlpc_learning_rate_init': 9.125512336180979e-05, 'mplc_max_iter': 2000}. Best is trial 4 with value: 0.990106.[0m
[32m[I 2022-10-19 18:41:02,250][0m sklearn.model_selection.train_test_split: running accelerated version on CPU[0m
[32m[I 2022-10-19 18:41:02,297][0m sklearn.model_selection.train_test_split: fallback to original Scikit-learn[0m
[32m[I 2022-10-19 18:43:17,609][0m Trial 10 finished with value: 0.9887494200151898 and parameters: {'mlpc_hidden_layer_count': 1, 'mlpc_learning_rate': 'adaptive', 'mlpc_learning_rate_init': 2.9468037150747366e-06, 'mplc_max_iter': 2000}. Best is trial 4 with value: 0.990106.[0m
[32m[I 2022-10-19 18:43:18,244][0m sklearn.model_selection.train_test_split: running accelerated version on CPU[0m
[32m[I 2022-10-19 18:43:18,301][0m sklearn.model_selection.train_test_split: fallback to original Scikit-learn[0m
[32m[I 2022-10-19 18:43:19,004][0m Trial 7 finished with value: 0.9861775638849083 and parameters: {'mlpc_hidden_layer_count': 3, 'mlpc_learning_rate': 'adaptive', 'mlpc_learning_rate_init': 0.0002049577285400286, 'mplc_max_iter': 2000}. Best is trial 4 with value: 0.990106.[0m
[32m[I 2022-10-19 18:43:19,270][0m sklearn.model_selection.train_test_split: running accelerated version on CPU[0m
[32m[I 2022-10-19 18:43:19,317][0m sklearn.model_selection.train_test_split: fallback to original Scikit-learn[0m
[32m[I 2022-10-19 18:43:27,285][0m Trial 15 finished with value: 0.9886190934948679 and parameters: {'mlpc_hidden_layer_count': 1, 'mlpc_learning_rate': 'invscaling', 'mlpc_learning_rate_init': 0.0017310844461545676, 'mplc_max_iter': 2000}. Best is trial 4 with value: 0.990106.[0m
[32m[I 2022-10-19 18:43:27,555][0m sklearn.model_selection.train_test_split: running accelerated version on CPU[0m
[32m[I 2022-10-19 18:43:27,602][0m sklearn.model_selection.train_test_split: fallback to original Scikit-learn[0m
[32m[I 2022-10-19 18:47:38,155][0m Trial 12 finished with value: 0.8827349137112177 and parameters: {'mlpc_hidden_layer_count': 3, 'mlpc_learning_rate': 'constant', 'mlpc_learning_rate_init': 0.0006840751617584356, 'mplc_max_iter': 2000}. Best is trial 4 with value: 0.990106.[0m
[32m[I 2022-10-19 18:47:38,409][0m sklearn.model_selection.train_test_split: running accelerated version on CPU[0m
[32m[I 2022-10-19 18:47:38,441][0m sklearn.model_selection.train_test_split: fallback to original Scikit-learn[0m
[32m[I 2022-10-19 18:49:17,507][0m Trial 17 finished with value: 0.9888807766668012 and parameters: {'mlpc_hidden_layer_count': 1, 'mlpc_learning_rate': 'constant', 'mlpc_learning_rate_init': 8.61061662032105e-05, 'mplc_max_iter': 2000}. Best is trial 4 with value: 0.990106.[0m
[32m[I 2022-10-19 18:49:17,792][0m sklearn.model_selection.train_test_split: running accelerated version on CPU[0m
[32m[I 2022-10-19 18:49:17,840][0m sklearn.model_selection.train_test_split: fallback to original Scikit-learn[0m
[32m[I 2022-10-19 18:51:19,613][0m Trial 14 finished with value: 0.9884112451369662 and parameters: {'mlpc_hidden_layer_count': 2, 'mlpc_learning_rate': 'invscaling', 'mlpc_learning_rate_init': 0.00044583984371453385, 'mplc_max_iter': 2000}. Best is trial 4 with value: 0.990106.[0m
[32m[I 2022-10-19 18:51:19,884][0m sklearn.model_selection.train_test_split: running accelerated version on CPU[0m
[32m[I 2022-10-19 18:51:19,917][0m sklearn.model_selection.train_test_split: fallback to original Scikit-learn[0m
[32m[I 2022-10-19 18:54:55,625][0m Trial 3 finished with value: 0.9857251005918373 and parameters: {'mlpc_hidden_layer_count': 3, 'mlpc_learning_rate': 'invscaling', 'mlpc_learning_rate_init': 5.937888769276688e-05, 'mplc_max_iter': 2000}. Best is trial 4 with value: 0.990106.[0m
[32m[I 2022-10-19 18:54:55,876][0m sklearn.model_selection.train_test_split: running accelerated version on CPU[0m
[32m[I 2022-10-19 18:54:55,908][0m sklearn.model_selection.train_test_split: fallback to original Scikit-learn[0m
[32m[I 2022-10-19 18:58:28,820][0m Trial 20 finished with value: 0.9895876051585913 and parameters: {'mlpc_hidden_layer_count': 1, 'mlpc_learning_rate': 'adaptive', 'mlpc_learning_rate_init': 5.211808057948749e-06, 'mplc_max_iter': 2000}. Best is trial 4 with value: 0.990106.[0m
[32m[I 2022-10-19 18:58:29,072][0m sklearn.model_selection.train_test_split: running accelerated version on CPU[0m
[32m[I 2022-10-19 18:58:29,107][0m sklearn.model_selection.train_test_split: fallback to original Scikit-learn[0m
[32m[I 2022-10-19 18:59:29,057][0m Trial 21 finished with value: 0.9897030034232747 and parameters: {'mlpc_hidden_layer_count': 1, 'mlpc_learning_rate': 'constant', 'mlpc_learning_rate_init': 8.241876385895511e-06, 'mplc_max_iter': 2000}. Best is trial 4 with value: 0.990106.[0m
[32m[I 2022-10-19 18:59:29,301][0m sklearn.model_selection.train_test_split: running accelerated version on CPU[0m
[32m[I 2022-10-19 18:59:29,349][0m sklearn.model_selection.train_test_split: fallback to original Scikit-learn[0m
[32m[I 2022-10-19 19:00:05,354][0m Trial 8 finished with value: 0.9870660374767906 and parameters: {'mlpc_hidden_layer_count': 3, 'mlpc_learning_rate': 'constant', 'mlpc_learning_rate_init': 2.6197039583695446e-05, 'mplc_max_iter': 2000}. Best is trial 4 with value: 0.990106.[0m
[32m[I 2022-10-19 19:00:05,599][0m sklearn.model_selection.train_test_split: running accelerated version on CPU[0m
[32m[I 2022-10-19 19:00:05,647][0m sklearn.model_selection.train_test_split: fallback to original Scikit-learn[0m
[32m[I 2022-10-19 19:01:10,540][0m Trial 18 finished with value: 0.9841490351672485 and parameters: {'mlpc_hidden_layer_count': 1, 'mlpc_learning_rate': 'constant', 'mlpc_learning_rate_init': 1.0405189536343824e-06, 'mplc_max_iter': 2000}. Best is trial 4 with value: 0.990106.[0m
[32m[I 2022-10-19 19:01:10,787][0m sklearn.model_selection.train_test_split: running accelerated version on CPU[0m
[32m[I 2022-10-19 19:01:10,836][0m sklearn.model_selection.train_test_split: fallback to original Scikit-learn[0m
[32m[I 2022-10-19 19:01:28,772][0m Trial 19 finished with value: 0.9873433733400188 and parameters: {'mlpc_hidden_layer_count': 1, 'mlpc_learning_rate': 'constant', 'mlpc_learning_rate_init': 1.5318858544427325e-06, 'mplc_max_iter': 2000}. Best is trial 4 with value: 0.990106.[0m
[32m[I 2022-10-19 19:01:29,024][0m sklearn.model_selection.train_test_split: running accelerated version on CPU[0m
[32m[I 2022-10-19 19:01:29,072][0m sklearn.model_selection.train_test_split: fallback to original Scikit-learn[0m
[32m[I 2022-10-19 19:02:16,789][0m Trial 16 finished with value: 0.9754351563489513 and parameters: {'mlpc_hidden_layer_count': 3, 'mlpc_learning_rate': 'adaptive', 'mlpc_learning_rate_init': 4.898790927451172e-05, 'mplc_max_iter': 2000}. Best is trial 4 with value: 0.990106.[0m
[32m[I 2022-10-19 19:02:26,643][0m Trial 22 finished with value: 0.9877640558745682 and parameters: {'mlpc_hidden_layer_count': 1, 'mlpc_learning_rate': 'constant', 'mlpc_learning_rate_init': 3.0232307359570264e-06, 'mplc_max_iter': 2000}. Best is trial 4 with value: 0.990106.[0m
[32m[I 2022-10-19 19:04:30,261][0m Trial 23 finished with value: 0.9888431320347548 and parameters: {'mlpc_hidden_layer_count': 1, 'mlpc_learning_rate': 'constant', 'mlpc_learning_rate_init': 4.594562513769082e-06, 'mplc_max_iter': 2000}. Best is trial 4 with value: 0.990106.[0m
[32m[I 2022-10-19 19:07:10,459][0m Trial 28 finished with value: 0.9908081428326198 and parameters: {'mlpc_hidden_layer_count': 1, 'mlpc_learning_rate': 'adaptive', 'mlpc_learning_rate_init': 1.5685093452983778e-05, 'mplc_max_iter': 2000}. Best is trial 28 with value: 0.990808.[0m
[32m[I 2022-10-19 19:07:15,283][0m Trial 26 finished with value: 0.9723453419894429 and parameters: {'mlpc_hidden_layer_count': 2, 'mlpc_learning_rate': 'constant', 'mlpc_learning_rate_init': 9.90038934770696e-06, 'mplc_max_iter': 2000}. Best is trial 28 with value: 0.990808.[0m
[32m[I 2022-10-19 19:10:07,010][0m Trial 24 finished with value: 0.9869213624511524 and parameters: {'mlpc_hidden_layer_count': 1, 'mlpc_learning_rate': 'adaptive', 'mlpc_learning_rate_init': 1.2441930251978926e-06, 'mplc_max_iter': 2000}. Best is trial 28 with value: 0.990808.[0m
[32m[I 2022-10-19 19:10:32,611][0m Trial 27 finished with value: 0.987835031017287 and parameters: {'mlpc_hidden_layer_count': 2, 'mlpc_learning_rate': 'constant', 'mlpc_learning_rate_init': 1.5784707473471598e-05, 'mplc_max_iter': 2000}. Best is trial 28 with value: 0.990808.[0m
[32m[I 2022-10-19 19:13:17,999][0m Trial 25 finished with value: 0.9850473038569999 and parameters: {'mlpc_hidden_layer_count': 2, 'mlpc_learning_rate': 'constant', 'mlpc_learning_rate_init': 1.094675742931255e-06, 'mplc_max_iter': 2000}. Best is trial 28 with value: 0.990808.[0m
[32m[I 2022-10-19 19:13:18,077][0m EarlyStopping exceeded for MLPClassifier; no new best scores on iters 20.[0m
[32m[I 2022-10-19 19:13:18,077][0m Study finished.[0m
[32m[I 2022-10-19 19:13:18,124][0m --------------------------------------------------------------------------------[0m
[32m[I 2022-10-19 19:13:18,124][0m --------------------             MultinomialNB              --------------------[0m
[32m[I 2022-10-19 19:13:18,124][0m --------------------------------------------------------------------------------[0m
[32m[I 2022-10-19 19:13:18,140][0m A new study created in RDB with name: MultinomialNB_b9881135[0m
[32m[I 2022-10-19 19:13:18,155][0m Study started.[0m
[32m[I 2022-10-19 19:13:20,590][0m Trial 4 finished with value: 0.3841998140289928 and parameters: {'mnb_alpha': 0.2, 'mnb_fit_prior': True}. Best is trial 3 with value: 0.384211.[0m
[32m[I 2022-10-19 19:13:20,652][0m Trial 7 finished with value: 0.3841766551360142 and parameters: {'mnb_alpha': 0.8500000000000001, 'mnb_fit_prior': False}. Best is trial 3 with value: 0.384211.[0m
[32m[I 2022-10-19 19:13:20,746][0m Trial 3 finished with value: 0.38421133911073435 and parameters: {'mnb_alpha': 0.1, 'mnb_fit_prior': True}. Best is trial 3 with value: 0.384211.[0m
[32m[I 2022-10-19 19:13:20,746][0m Trial 0 finished with value: 0.3841766551360142 and parameters: {'mnb_alpha': 0.7000000000000001, 'mnb_fit_prior': False}. Best is trial 3 with value: 0.384211.[0m
[32m[I 2022-10-19 19:13:20,903][0m Trial 2 finished with value: 0.3841998140289928 and parameters: {'mnb_alpha': 0.30000000000000004, 'mnb_fit_prior': False}. Best is trial 3 with value: 0.384211.[0m
[32m[I 2022-10-19 19:13:20,903][0m Trial 1 finished with value: 0.3841881809986997 and parameters: {'mnb_alpha': 0.55, 'mnb_fit_prior': True}. Best is trial 3 with value: 0.384211.[0m
[32m[I 2022-10-19 19:13:20,903][0m Trial 6 finished with value: 0.3841998140289928 and parameters: {'mnb_alpha': 0.45, 'mnb_fit_prior': False}. Best is trial 3 with value: 0.384211.[0m
[32m[I 2022-10-19 19:13:21,122][0m Trial 5 finished with value: 0.3841998140289928 and parameters: {'mnb_alpha': 0.35000000000000003, 'mnb_fit_prior': True}. Best is trial 3 with value: 0.384211.[0m
[32m[I 2022-10-19 19:13:23,495][0m Trial 12 finished with value: 0.3841881809986997 and parameters: {'mnb_alpha': 0.6000000000000001, 'mnb_fit_prior': True}. Best is trial 3 with value: 0.384211.[0m
[32m[I 2022-10-19 19:13:23,604][0m Trial 8 finished with value: 0.3841881809986997 and parameters: {'mnb_alpha': 0.6000000000000001, 'mnb_fit_prior': False}. Best is trial 3 with value: 0.384211.[0m
[32m[I 2022-10-19 19:13:23,714][0m Trial 9 finished with value: 0.3841766551360142 and parameters: {'mnb_alpha': 0.9500000000000001, 'mnb_fit_prior': True}. Best is trial 3 with value: 0.384211.[0m
[32m[I 2022-10-19 19:13:23,714][0m Trial 13 finished with value: 0.3841766551360142 and parameters: {'mnb_alpha': 0.9, 'mnb_fit_prior': False}. Best is trial 3 with value: 0.384211.[0m
[32m[I 2022-10-19 19:13:23,776][0m Trial 14 finished with value: 0.3841766551360142 and parameters: {'mnb_alpha': 0.9, 'mnb_fit_prior': False}. Best is trial 3 with value: 0.384211.[0m
[32m[I 2022-10-19 19:13:23,917][0m Trial 15 finished with value: 0.3841766551360142 and parameters: {'mnb_alpha': 0.9500000000000001, 'mnb_fit_prior': False}. Best is trial 3 with value: 0.384211.[0m
[32m[I 2022-10-19 19:13:23,933][0m Trial 10 finished with value: 0.3841998140289928 and parameters: {'mnb_alpha': 0.2, 'mnb_fit_prior': False}. Best is trial 3 with value: 0.384211.[0m
[32m[I 2022-10-19 19:13:24,089][0m Trial 11 finished with value: 0.3841881809986997 and parameters: {'mnb_alpha': 0.6000000000000001, 'mnb_fit_prior': False}. Best is trial 3 with value: 0.384211.[0m
[32m[I 2022-10-19 19:13:26,330][0m Trial 16 finished with value: 0.38423437530304067 and parameters: {'mnb_alpha': 0.05, 'mnb_fit_prior': True}. Best is trial 16 with value: 0.384234.[0m
[32m[I 2022-10-19 19:13:26,502][0m Trial 17 finished with value: 0.38484354706828566 and parameters: {'mnb_alpha': 0.0, 'mnb_fit_prior': True}. Best is trial 17 with value: 0.384844.[0m
[32m[I 2022-10-19 19:13:26,565][0m Trial 18 finished with value: 0.38484354706828566 and parameters: {'mnb_alpha': 0.0, 'mnb_fit_prior': True}. Best is trial 18 with value: 0.384844.[0m
[32m[I 2022-10-19 19:13:26,938][0m Trial 19 finished with value: 0.38484354706828566 and parameters: {'mnb_alpha': 0.0, 'mnb_fit_prior': True}. Best is trial 19 with value: 0.384844.[0m
[32m[I 2022-10-19 19:13:27,032][0m Trial 23 finished with value: 0.38484354706828566 and parameters: {'mnb_alpha': 0.0, 'mnb_fit_prior': True}. Best is trial 23 with value: 0.384844.[0m
[32m[I 2022-10-19 19:13:27,157][0m Trial 20 finished with value: 0.38484354706828566 and parameters: {'mnb_alpha': 0.0, 'mnb_fit_prior': True}. Best is trial 23 with value: 0.384844.[0m
