[32m[I 2022-10-19 17:01:41,126][0m Trial 27 finished with value: 0.6279113291613727 and parameters: {'lgbm_num_leaves': 63, 'lgbm_learning_rate': 0.0021276396496455034, 'lgbm_n_estimators': 70, 'lgbm_reg_alpha': 0.75, 'lgbm_reg_lambda': 0.15000000000000002}. Best is trial 4 with value: 0.991757.[0m
[32m[I 2022-10-19 17:01:47,748][0m Trial 24 finished with value: 0.9914916713851855 and parameters: {'lgbm_num_leaves': 63, 'lgbm_learning_rate': 0.008658353339523013, 'lgbm_n_estimators': 140, 'lgbm_reg_alpha': 0.6000000000000001, 'lgbm_reg_lambda': 0.2}. Best is trial 4 with value: 0.991757.[0m
[32m[I 2022-10-19 17:01:48,374][0m Trial 28 finished with value: 0.9915580898898111 and parameters: {'lgbm_num_leaves': 63, 'lgbm_learning_rate': 0.05529389787967612, 'lgbm_n_estimators': 80, 'lgbm_reg_alpha': 0.30000000000000004, 'lgbm_reg_lambda': 0.7000000000000001}. Best is trial 4 with value: 0.991757.[0m
[32m[I 2022-10-19 17:01:48,608][0m Trial 29 finished with value: 0.991497350168156 and parameters: {'lgbm_num_leaves': 63, 'lgbm_learning_rate': 0.08104250431960017, 'lgbm_n_estimators': 80, 'lgbm_reg_alpha': 0.30000000000000004, 'lgbm_reg_lambda': 0.65}. Best is trial 4 with value: 0.991757.[0m
[32m[I 2022-10-19 17:01:49,750][0m Trial 25 finished with value: 0.9913252097458336 and parameters: {'lgbm_num_leaves': 63, 'lgbm_learning_rate': 0.00397656545788337, 'lgbm_n_estimators': 140, 'lgbm_reg_alpha': 0.6000000000000001, 'lgbm_reg_lambda': 0.2}. Best is trial 4 with value: 0.991757.[0m
[32m[I 2022-10-19 17:01:50,363][0m Trial 26 finished with value: 0.6279221692661894 and parameters: {'lgbm_num_leaves': 63, 'lgbm_learning_rate': 0.0012897491099230166, 'lgbm_n_estimators': 140, 'lgbm_reg_alpha': 0.7000000000000001, 'lgbm_reg_lambda': 0.2}. Best is trial 4 with value: 0.991757.[0m
[32m[I 2022-10-19 17:01:50,441][0m EarlyStopping exceeded for LGBMClassifier; no new best scores on iters 20.[0m
[32m[I 2022-10-19 17:01:50,441][0m Study finished.[0m
[32m[I 2022-10-19 17:01:50,472][0m --------------------------------------------------------------------------------[0m
[32m[I 2022-10-19 17:01:50,488][0m --------------------       LinearDiscriminantAnalysis       --------------------[0m
[32m[I 2022-10-19 17:01:50,488][0m --------------------------------------------------------------------------------[0m
[32m[I 2022-10-19 17:01:50,503][0m A new study created in RDB with name: LinearDiscriminantAnalysis_b9881135[0m
[32m[I 2022-10-19 17:01:50,519][0m Study started.[0m
[32m[I 2022-10-19 17:01:55,286][0m Trial 4 finished with value: 0.9045171792659163 and parameters: {'lda_solver': 'lsqr', 'lda_n_components': 1, 'lda_tol': 0.0001}. Best is trial 4 with value: 0.904517.[0m
[32m[I 2022-10-19 17:01:55,897][0m Trial 2 finished with value: 0.9045171792659163 and parameters: {'lda_solver': 'lsqr', 'lda_n_components': 2, 'lda_tol': 1e-05}. Best is trial 2 with value: 0.904517.[0m
[32m[I 2022-10-19 17:01:55,991][0m Trial 1 finished with value: 0.9045171792659163 and parameters: {'lda_solver': 'lsqr', 'lda_n_components': 3, 'lda_tol': 0.0001}. Best is trial 1 with value: 0.904517.[0m
[32m[I 2022-10-19 17:01:56,227][0m Trial 6 finished with value: 0.9045171792659163 and parameters: {'lda_solver': 'lsqr', 'lda_n_components': 2, 'lda_tol': 0.001}. Best is trial 1 with value: 0.904517.[0m
[32m[I 2022-10-19 17:01:56,897][0m Trial 3 finished with value: 0.9045171792659163 and parameters: {'lda_solver': 'eigen', 'lda_n_components': 4, 'lda_tol': 1e-05}. Best is trial 1 with value: 0.904517.[0m
[32m[I 2022-10-19 17:01:57,153][0m Trial 0 finished with value: 0.9045171792659163 and parameters: {'lda_solver': 'eigen', 'lda_n_components': 2, 'lda_tol': 0.0001}. Best is trial 0 with value: 0.904517.[0m
[32m[I 2022-10-19 17:01:57,733][0m Trial 7 finished with value: 0.9045171792659163 and parameters: {'lda_solver': 'eigen', 'lda_n_components': 4, 'lda_tol': 1e-05}. Best is trial 0 with value: 0.904517.[0m
[32m[I 2022-10-19 17:01:58,173][0m Trial 5 finished with value: 0.9045171792659163 and parameters: {'lda_solver': 'eigen', 'lda_n_components': 2, 'lda_tol': 0.0001}. Best is trial 0 with value: 0.904517.[0m
[32m[I 2022-10-19 17:01:59,023][0m Trial 8 finished with value: 0.9045171792659163 and parameters: {'lda_solver': 'lsqr', 'lda_n_components': 4, 'lda_tol': 1e-05}. Best is trial 0 with value: 0.904517.[0m
[32m[I 2022-10-19 17:02:02,669][0m Trial 10 finished with value: 0.9047439555188416 and parameters: {'lda_solver': 'svd', 'lda_n_components': 4}. Best is trial 10 with value: 0.904744.[0m
[32m[I 2022-10-19 17:02:02,669][0m Trial 11 finished with value: 0.9047439555188416 and parameters: {'lda_solver': 'svd', 'lda_n_components': 1}. Best is trial 10 with value: 0.904744.[0m
[32m[I 2022-10-19 17:02:05,142][0m Trial 13 finished with value: 0.9045171792659163 and parameters: {'lda_solver': 'lsqr', 'lda_n_components': 1, 'lda_tol': 0.0001}. Best is trial 10 with value: 0.904744.[0m
[32m[I 2022-10-19 17:02:05,379][0m Trial 9 finished with value: 0.9045171792659163 and parameters: {'lda_solver': 'eigen', 'lda_n_components': 2, 'lda_tol': 0.0001}. Best is trial 16 with value: 0.904744.[0m
[32m[I 2022-10-19 17:02:05,457][0m Trial 16 finished with value: 0.9047439555188416 and parameters: {'lda_solver': 'svd', 'lda_n_components': 4}. Best is trial 16 with value: 0.904744.[0m
[32m[I 2022-10-19 17:02:08,158][0m Trial 14 finished with value: 0.9045171792659163 and parameters: {'lda_solver': 'lsqr', 'lda_n_components': 1, 'lda_tol': 0.001}. Best is trial 16 with value: 0.904744.[0m
[32m[I 2022-10-19 17:02:08,158][0m Trial 15 finished with value: 0.9045171792659163 and parameters: {'lda_solver': 'lsqr', 'lda_n_components': 2, 'lda_tol': 0.0001}. Best is trial 16 with value: 0.904744.[0m
[32m[I 2022-10-19 17:02:08,627][0m Trial 12 finished with value: 0.9045171792659163 and parameters: {'lda_solver': 'eigen', 'lda_n_components': 3, 'lda_tol': 0.001}. Best is trial 16 with value: 0.904744.[0m
[32m[I 2022-10-19 17:02:09,191][0m Trial 17 finished with value: 0.9047439555188416 and parameters: {'lda_solver': 'svd', 'lda_n_components': 1}. Best is trial 18 with value: 0.904744.[0m
[32m[I 2022-10-19 17:02:09,191][0m Trial 18 finished with value: 0.9047439555188416 and parameters: {'lda_solver': 'svd', 'lda_n_components': 1}. Best is trial 18 with value: 0.904744.[0m
[32m[I 2022-10-19 17:02:13,439][0m Trial 20 finished with value: 0.9047439555188416 and parameters: {'lda_solver': 'svd', 'lda_n_components': 3}. Best is trial 20 with value: 0.904744.[0m
[32m[I 2022-10-19 17:02:13,439][0m Trial 19 finished with value: 0.9047439555188416 and parameters: {'lda_solver': 'svd', 'lda_n_components': 3}. Best is trial 21 with value: 0.904744.[0m
[32m[I 2022-10-19 17:02:13,721][0m Trial 21 finished with value: 0.9047439555188416 and parameters: {'lda_solver': 'svd', 'lda_n_components': 3}. Best is trial 21 with value: 0.904744.[0m
[32m[I 2022-10-19 17:02:17,690][0m Trial 22 finished with value: 0.9047439555188416 and parameters: {'lda_solver': 'svd', 'lda_n_components': 3}. Best is trial 24 with value: 0.904744.[0m
[32m[I 2022-10-19 17:02:17,690][0m Trial 24 finished with value: 0.9047439555188416 and parameters: {'lda_solver': 'svd', 'lda_n_components': 3}. Best is trial 24 with value: 0.904744.[0m
[32m[I 2022-10-19 17:02:17,910][0m Trial 23 finished with value: 0.9047439555188416 and parameters: {'lda_solver': 'svd', 'lda_n_components': 3}. Best is trial 24 with value: 0.904744.[0m
[32m[I 2022-10-19 17:02:20,664][0m Trial 25 finished with value: 0.9047439555188416 and parameters: {'lda_solver': 'svd', 'lda_n_components': 3}. Best is trial 26 with value: 0.904744.[0m
[32m[I 2022-10-19 17:02:20,664][0m Trial 26 finished with value: 0.9047439555188416 and parameters: {'lda_solver': 'svd', 'lda_n_components': 3}. Best is trial 26 with value: 0.904744.[0m
[32m[I 2022-10-19 17:02:24,656][0m Trial 27 finished with value: 0.9047439555188416 and parameters: {'lda_solver': 'svd', 'lda_n_components': 3}. Best is trial 27 with value: 0.904744.[0m
[32m[I 2022-10-19 17:02:24,656][0m Trial 28 finished with value: 0.9047439555188416 and parameters: {'lda_solver': 'svd', 'lda_n_components': 3}. Best is trial 28 with value: 0.904744.[0m
[32m[I 2022-10-19 17:02:24,797][0m Trial 29 finished with value: 0.9047439555188416 and parameters: {'lda_solver': 'svd', 'lda_n_components': 3}. Best is trial 29 with value: 0.904744.[0m
[32m[I 2022-10-19 17:02:24,860][0m EarlyStopping exceeded for LinearDiscriminantAnalysis; no new best scores on iters 20.[0m
[32m[I 2022-10-19 17:02:24,860][0m Study finished.[0m
[32m[I 2022-10-19 17:02:24,906][0m --------------------------------------------------------------------------------[0m
[32m[I 2022-10-19 17:02:24,906][0m --------------------               LinearSVC                --------------------[0m
[32m[I 2022-10-19 17:02:24,906][0m --------------------------------------------------------------------------------[0m
[32m[I 2022-10-19 17:02:24,938][0m A new study created in RDB with name: LinearSVC_b9881135[0m
[32m[I 2022-10-19 17:02:24,938][0m Study started.[0m
[32m[I 2022-10-19 17:02:40,965][0m Trial 0 finished with value: 0.8850228200101932 and parameters: {'lsvc_dual': False, 'lsvc_C': 9.387808777065533e-05, 'lsvc_max_iter': 2000}. Best is trial 0 with value: 0.885023.[0m
[32m[I 2022-10-19 17:03:02,146][0m Trial 1 finished with value: 0.8786683238474633 and parameters: {'lsvc_dual': False, 'lsvc_C': 0.08288855679761051, 'lsvc_max_iter': 2000}. Best is trial 0 with value: 0.885023.[0m
[32m[I 2022-10-19 17:03:19,649][0m Trial 2 finished with value: 0.8994796520800797 and parameters: {'lsvc_dual': False, 'lsvc_C': 0.602249050089042, 'lsvc_max_iter': 2000}. Best is trial 2 with value: 0.89948.[0m
[32m[I 2022-10-19 17:03:34,592][0m Trial 3 finished with value: 0.8276742654432975 and parameters: {'lsvc_dual': False, 'lsvc_C': 6.738081344100041e-05, 'lsvc_max_iter': 2000}. Best is trial 2 with value: 0.89948.[0m
[32m[I 2022-10-19 17:03:52,102][0m Trial 4 finished with value: 0.827767120325333 and parameters: {'lsvc_dual': False, 'lsvc_C': 6.340893939418766e-06, 'lsvc_max_iter': 2000}. Best is trial 2 with value: 0.89948.[0m
[32m[I 2022-10-19 17:04:09,781][0m Trial 5 finished with value: 0.8463649243314062 and parameters: {'lsvc_dual': False, 'lsvc_C': 0.05463584259459826, 'lsvc_max_iter': 2000}. Best is trial 2 with value: 0.89948.[0m
[32m[I 2022-10-19 17:04:24,847][0m Trial 6 finished with value: 0.8787194052709645 and parameters: {'lsvc_dual': False, 'lsvc_C': 1.8448688509065292e-05, 'lsvc_max_iter': 2000}. Best is trial 2 with value: 0.89948.[0m
[32m[I 2022-10-19 17:04:42,594][0m Trial 7 finished with value: 0.8382865254472581 and parameters: {'lsvc_dual': False, 'lsvc_C': 1.4682362342716906, 'lsvc_max_iter': 2000}. Best is trial 2 with value: 0.89948.[0m
[32m[I 2022-10-19 17:04:59,088][0m Trial 8 finished with value: 0.9064668744330557 and parameters: {'lsvc_dual': False, 'lsvc_C': 0.45577453049091077, 'lsvc_max_iter': 2000}. Best is trial 8 with value: 0.906467.[0m
[32m[I 2022-10-19 17:05:15,339][0m Trial 9 finished with value: 0.8786598771365581 and parameters: {'lsvc_dual': False, 'lsvc_C': 0.5300679880060579, 'lsvc_max_iter': 2000}. Best is trial 8 with value: 0.906467.[0m
[32m[I 2022-10-19 17:05:30,934][0m Trial 10 finished with value: 0.874105851144889 and parameters: {'lsvc_dual': False, 'lsvc_C': 920.4128687659393, 'lsvc_max_iter': 2000}. Best is trial 8 with value: 0.906467.[0m
[32m[I 2022-10-19 17:05:45,060][0m Trial 11 finished with value: 0.8279502575535633 and parameters: {'lsvc_dual': False, 'lsvc_C': 29.000683852301538, 'lsvc_max_iter': 2000}. Best is trial 8 with value: 0.906467.[0m
[32m[I 2022-10-19 17:06:03,114][0m Trial 12 finished with value: 0.8276297844357339 and parameters: {'lsvc_dual': False, 'lsvc_C': 0.0011429406313058926, 'lsvc_max_iter': 2000}. Best is trial 8 with value: 0.906467.[0m
[32m[I 2022-10-19 17:06:22,797][0m Trial 13 finished with value: 0.8276544360819652 and parameters: {'lsvc_dual': False, 'lsvc_C': 0.003343564564980047, 'lsvc_max_iter': 2000}. Best is trial 8 with value: 0.906467.[0m
[32m[I 2022-10-19 17:06:45,244][0m Trial 14 finished with value: 0.8793278549259594 and parameters: {'lsvc_dual': False, 'lsvc_C': 11.44008297509228, 'lsvc_max_iter': 2000}. Best is trial 8 with value: 0.906467.[0m
[32m[I 2022-10-19 17:07:00,527][0m Trial 15 finished with value: 0.8244907345012051 and parameters: {'lsvc_dual': False, 'lsvc_C': 110.16619284908334, 'lsvc_max_iter': 2000}. Best is trial 8 with value: 0.906467.[0m
[32m[I 2022-10-19 17:07:16,636][0m Trial 16 finished with value: 0.8276911462521475 and parameters: {'lsvc_dual': False, 'lsvc_C': 1.2983942524123813, 'lsvc_max_iter': 2000}. Best is trial 8 with value: 0.906467.[0m
[32m[I 2022-10-19 17:07:31,685][0m Trial 17 finished with value: 0.8757158966976453 and parameters: {'lsvc_dual': False, 'lsvc_C': 0.005290190512132658, 'lsvc_max_iter': 2000}. Best is trial 8 with value: 0.906467.[0m
[32m[I 2022-10-19 17:07:47,395][0m Trial 18 finished with value: 0.887210742509439 and parameters: {'lsvc_dual': False, 'lsvc_C': 0.28952326194928074, 'lsvc_max_iter': 2000}. Best is trial 8 with value: 0.906467.[0m
[32m[I 2022-10-19 17:08:05,954][0m Trial 19 finished with value: 0.8276680510848795 and parameters: {'lsvc_dual': False, 'lsvc_C': 6.120831821644097, 'lsvc_max_iter': 2000}. Best is trial 8 with value: 0.906467.[0m
[32m[I 2022-10-19 17:08:22,492][0m Trial 20 finished with value: 0.8278587769116801 and parameters: {'lsvc_dual': False, 'lsvc_C': 0.011279973381171865, 'lsvc_max_iter': 2000}. Best is trial 8 with value: 0.906467.[0m
[32m[I 2022-10-19 17:08:38,503][0m Trial 21 finished with value: 0.8279502575535633 and parameters: {'lsvc_dual': False, 'lsvc_C': 0.17579455212676912, 'lsvc_max_iter': 2000}. Best is trial 8 with value: 0.906467.[0m
[32m[I 2022-10-19 17:08:52,626][0m Trial 22 finished with value: 0.8775142718311477 and parameters: {'lsvc_dual': False, 'lsvc_C': 0.28987852685238485, 'lsvc_max_iter': 2000}. Best is trial 8 with value: 0.906467.[0m
[32m[I 2022-10-19 17:08:52,688][0m EarlyStopping exceeded for LinearSVC; no new best scores on iters 20.[0m
[32m[I 2022-10-19 17:08:52,688][0m Study finished.[0m
[32m[I 2022-10-19 17:08:52,721][0m --------------------------------------------------------------------------------[0m
[32m[I 2022-10-19 17:08:52,721][0m --------------------     LinearSVC_AdditiveChi2Sampler      --------------------[0m
[32m[I 2022-10-19 17:08:52,721][0m --------------------------------------------------------------------------------[0m
[32m[I 2022-10-19 17:08:52,753][0m A new study created in RDB with name: LinearSVC_AdditiveChi2Sampler_b9881135[0m
[32m[I 2022-10-19 17:08:52,753][0m Study started.[0m
[32m[I 2022-10-19 17:09:39,489][0m Trial 0 finished with value: 0.9897868772523388 and parameters: {'lsvc_ac2s_kernel_sample_steps': 3, 'lsvc_ac2s_dual': False, 'lsvc_ac2s_C': 0.04640662206481424, 'lsvc_ac2s_max_iter': 2000}. Best is trial 0 with value: 0.989787.[0m
[32m[I 2022-10-19 17:10:05,573][0m Trial 1 finished with value: 0.9895487897703883 and parameters: {'lsvc_ac2s_kernel_sample_steps': 2, 'lsvc_ac2s_dual': False, 'lsvc_ac2s_C': 0.06578244729080508, 'lsvc_ac2s_max_iter': 2000}. Best is trial 0 with value: 0.989787.[0m
[32m[I 2022-10-19 17:10:21,819][0m Trial 2 finished with value: 0.9700347666647957 and parameters: {'lsvc_ac2s_kernel_sample_steps': 2, 'lsvc_ac2s_dual': False, 'lsvc_ac2s_C': 3.5394324995066e-05, 'lsvc_ac2s_max_iter': 2000}. Best is trial 0 with value: 0.989787.[0m
[32m[I 2022-10-19 17:10:30,748][0m Trial 3 finished with value: 0.8704947570912491 and parameters: {'lsvc_ac2s_kernel_sample_steps': 1, 'lsvc_ac2s_dual': False, 'lsvc_ac2s_C': 0.39296091603688466, 'lsvc_ac2s_max_iter': 2000}. Best is trial 0 with value: 0.989787.[0m
[32m[I 2022-10-19 17:11:19,263][0m Trial 4 finished with value: 0.9899920610579452 and parameters: {'lsvc_ac2s_kernel_sample_steps': 3, 'lsvc_ac2s_dual': False, 'lsvc_ac2s_C': 61.135952493059584, 'lsvc_ac2s_max_iter': 2000}. Best is trial 4 with value: 0.989992.[0m
[32m[I 2022-10-19 17:11:26,158][0m Trial 5 finished with value: 0.8471865800805046 and parameters: {'lsvc_ac2s_kernel_sample_steps': 1, 'lsvc_ac2s_dual': False, 'lsvc_ac2s_C': 0.0001686640984241787, 'lsvc_ac2s_max_iter': 2000}. Best is trial 4 with value: 0.989992.[0m
[32m[I 2022-10-19 17:11:34,797][0m Trial 6 finished with value: 0.86790446574453 and parameters: {'lsvc_ac2s_kernel_sample_steps': 1, 'lsvc_ac2s_dual': False, 'lsvc_ac2s_C': 0.30520799830136464, 'lsvc_ac2s_max_iter': 2000}. Best is trial 4 with value: 0.989992.[0m
[32m[I 2022-10-19 17:12:14,227][0m Trial 7 finished with value: 0.9900549699234104 and parameters: {'lsvc_ac2s_kernel_sample_steps': 3, 'lsvc_ac2s_dual': False, 'lsvc_ac2s_C': 8.162161624701291, 'lsvc_ac2s_max_iter': 2000}. Best is trial 7 with value: 0.990055.[0m
[32m[I 2022-10-19 17:12:42,092][0m Trial 8 finished with value: 0.989519490669857 and parameters: {'lsvc_ac2s_kernel_sample_steps': 2, 'lsvc_ac2s_dual': False, 'lsvc_ac2s_C': 10.427311711367123, 'lsvc_ac2s_max_iter': 2000}. Best is trial 7 with value: 0.990055.[0m
[32m[I 2022-10-19 17:13:04,837][0m Trial 9 finished with value: 0.9888693067014439 and parameters: {'lsvc_ac2s_kernel_sample_steps': 2, 'lsvc_ac2s_dual': False, 'lsvc_ac2s_C': 0.00394941353412571, 'lsvc_ac2s_max_iter': 2000}. Best is trial 7 with value: 0.990055.[0m
[32m[I 2022-10-19 17:13:52,880][0m Trial 10 finished with value: 0.9899779369949311 and parameters: {'lsvc_ac2s_kernel_sample_steps': 3, 'lsvc_ac2s_dual': False, 'lsvc_ac2s_C': 800.8037661290971, 'lsvc_ac2s_max_iter': 2000}. Best is trial 7 with value: 0.990055.[0m
[32m[I 2022-10-19 17:14:37,377][0m Trial 11 finished with value: 0.989100808760333 and parameters: {'lsvc_ac2s_kernel_sample_steps': 3, 'lsvc_ac2s_dual': False, 'lsvc_ac2s_C': 73.57825675562093, 'lsvc_ac2s_max_iter': 2000}. Best is trial 7 with value: 0.990055.[0m
[32m[I 2022-10-19 17:15:28,587][0m Trial 12 finished with value: 0.9899309520588789 and parameters: {'lsvc_ac2s_kernel_sample_steps': 3, 'lsvc_ac2s_dual': False, 'lsvc_ac2s_C': 7.660534673430044, 'lsvc_ac2s_max_iter': 2000}. Best is trial 7 with value: 0.990055.[0m
[32m[I 2022-10-19 17:16:13,582][0m Trial 13 finished with value: 0.9892287353862453 and parameters: {'lsvc_ac2s_kernel_sample_steps': 3, 'lsvc_ac2s_dual': False, 'lsvc_ac2s_C': 612.4749104084327, 'lsvc_ac2s_max_iter': 2000}. Best is trial 7 with value: 0.990055.[0m
[32m[I 2022-10-19 17:16:57,704][0m Trial 14 finished with value: 0.9890471707781197 and parameters: {'lsvc_ac2s_kernel_sample_steps': 3, 'lsvc_ac2s_dual': False, 'lsvc_ac2s_C': 5.448410512902655, 'lsvc_ac2s_max_iter': 2000}. Best is trial 7 with value: 0.990055.[0m
[32m[I 2022-10-19 17:17:19,047][0m Trial 15 finished with value: 0.9221478919276969 and parameters: {'lsvc_ac2s_kernel_sample_steps': 3, 'lsvc_ac2s_dual': False, 'lsvc_ac2s_C': 2.5043804844045404e-06, 'lsvc_ac2s_max_iter': 2000}. Best is trial 7 with value: 0.990055.[0m
[32m[I 2022-10-19 17:18:15,003][0m Trial 16 finished with value: 0.9901764427230636 and parameters: {'lsvc_ac2s_kernel_sample_steps': 3, 'lsvc_ac2s_dual': False, 'lsvc_ac2s_C': 44.36807519531738, 'lsvc_ac2s_max_iter': 2000}. Best is trial 16 with value: 0.990176.[0m
[32m[I 2022-10-19 17:19:05,160][0m Trial 17 finished with value: 0.9895659094147706 and parameters: {'lsvc_ac2s_kernel_sample_steps': 3, 'lsvc_ac2s_dual': False, 'lsvc_ac2s_C': 0.6968453823029858, 'lsvc_ac2s_max_iter': 2000}. Best is trial 16 with value: 0.990176.[0m
[32m[I 2022-10-19 17:19:42,902][0m Trial 18 finished with value: 0.9883616260680058 and parameters: {'lsvc_ac2s_kernel_sample_steps': 3, 'lsvc_ac2s_dual': False, 'lsvc_ac2s_C': 0.002226989301992701, 'lsvc_ac2s_max_iter': 2000}. Best is trial 16 with value: 0.990176.[0m
[32m[I 2022-10-19 17:19:51,693][0m Trial 19 finished with value: 0.868140252187051 and parameters: {'lsvc_ac2s_kernel_sample_steps': 1, 'lsvc_ac2s_dual': False, 'lsvc_ac2s_C': 82.75369844923007, 'lsvc_ac2s_max_iter': 2000}. Best is trial 16 with value: 0.990176.[0m
[32m[I 2022-10-19 17:20:33,279][0m Trial 20 finished with value: 0.9890134453314509 and parameters: {'lsvc_ac2s_kernel_sample_steps': 3, 'lsvc_ac2s_dual': False, 'lsvc_ac2s_C': 1.7509908664255218, 'lsvc_ac2s_max_iter': 2000}. Best is trial 16 with value: 0.990176.[0m
[32m[I 2022-10-19 17:21:14,968][0m Trial 21 finished with value: 0.9890622402172708 and parameters: {'lsvc_ac2s_kernel_sample_steps': 3, 'lsvc_ac2s_dual': False, 'lsvc_ac2s_C': 57.87196548700044, 'lsvc_ac2s_max_iter': 2000}. Best is trial 16 with value: 0.990176.[0m
[32m[I 2022-10-19 17:21:15,031][0m EarlyStopping exceeded for LinearSVC_AdditiveChi2Sampler; no new best scores on iters 20.[0m
[32m[I 2022-10-19 17:21:15,031][0m Study finished.[0m
[32m[I 2022-10-19 17:21:15,062][0m --------------------------------------------------------------------------------[0m
[32m[I 2022-10-19 17:21:15,062][0m --------------------           LinearSVC_Nystroem           --------------------[0m
[32m[I 2022-10-19 17:21:15,062][0m --------------------------------------------------------------------------------[0m
[32m[I 2022-10-19 17:21:15,093][0m A new study created in RDB with name: LinearSVC_Nystroem_b9881135[0m
[32m[I 2022-10-19 17:21:15,093][0m Study started.[0m
[32m[I 2022-10-19 17:21:20,603][0m Trial 0 finished with value: 0.30045050571441273 and parameters: {'lsvc_nystroem_kernel_gamma': 0.005348883261533948, 'lsvc_nystroem_kernel_n_components': 50, 'lsvc_nystroem_dual': False, 'lsvc_nystroem_C': 15.289292211888974, 'lsvc_nystroem_max_iter': 2000}. Best is trial 0 with value: 0.300451.[0m
