[32m[I 2022-10-19 19:15:51,232][0m Trial 14 finished with value: 0.8902004936721672 and parameters: {'qda_reg_param': 0.55, 'qda_tol': 0.0006575717561907528}. Best is trial 13 with value: 0.907471.[0m
[32m[I 2022-10-19 19:15:51,469][0m Trial 12 finished with value: 0.9062922688902247 and parameters: {'qda_reg_param': 0.15000000000000002, 'qda_tol': 7.945481930610901e-06}. Best is trial 13 with value: 0.907471.[0m
[32m[I 2022-10-19 19:15:51,721][0m Trial 15 finished with value: 0.8902004936721672 and parameters: {'qda_reg_param': 0.55, 'qda_tol': 2.189710590069018e-05}. Best is trial 13 with value: 0.907471.[0m
[32m[I 2022-10-19 19:15:53,542][0m Trial 16 finished with value: 0.8902004936721672 and parameters: {'qda_reg_param': 0.55, 'qda_tol': 2.7531259041296895e-06}. Best is trial 13 with value: 0.907471.[0m
[32m[I 2022-10-19 19:15:57,044][0m Trial 17 finished with value: 0.9062922688902247 and parameters: {'qda_reg_param': 0.15000000000000002, 'qda_tol': 8.442991658863713e-05}. Best is trial 13 with value: 0.907471.[0m
[32m[I 2022-10-19 19:15:58,469][0m Trial 18 finished with value: 0.905848436475046 and parameters: {'qda_reg_param': 0.2, 'qda_tol': 0.00016102634172886608}. Best is trial 13 with value: 0.907471.[0m
[32m[I 2022-10-19 19:15:58,735][0m Trial 21 finished with value: 0.8712101843086053 and parameters: {'qda_reg_param': 0.0, 'qda_tol': 1.0598369672374286e-06}. Best is trial 13 with value: 0.907471.[0m
[32m[I 2022-10-19 19:15:58,845][0m Trial 20 finished with value: 0.8712101843086053 and parameters: {'qda_reg_param': 0.0, 'qda_tol': 1.2249800076320426e-06}. Best is trial 13 with value: 0.907471.[0m
[32m[I 2022-10-19 19:15:58,954][0m Trial 19 finished with value: 0.8712101843086053 and parameters: {'qda_reg_param': 0.0, 'qda_tol': 1.3629179501176158e-06}. Best is trial 13 with value: 0.907471.[0m
[32m[I 2022-10-19 19:15:59,017][0m EarlyStopping exceeded for QuadraticDiscriminantAnalysis; no new best scores on iters 20.[0m
[32m[I 2022-10-19 19:15:59,017][0m Study finished.[0m
[32m[I 2022-10-19 19:15:59,053][0m --------------------------------------------------------------------------------[0m
[32m[I 2022-10-19 19:15:59,053][0m --------------------         RandomForestClassifier         --------------------[0m
[32m[I 2022-10-19 19:15:59,053][0m --------------------------------------------------------------------------------[0m
[32m[I 2022-10-19 19:15:59,085][0m A new study created in RDB with name: RandomForestClassifier_b9881135[0m
[32m[I 2022-10-19 19:15:59,100][0m Study started.[0m
[32m[I 2022-10-19 19:15:59,288][0m sklearn.ensemble.RandomForestClassifier.fit: running accelerated version on CPU[0m
[32m[I 2022-10-19 19:15:59,303][0m sklearn.ensemble.RandomForestClassifier.fit: running accelerated version on CPU[0m
[32m[I 2022-10-19 19:15:59,350][0m sklearn.ensemble.RandomForestClassifier.fit: fallback to original Scikit-learn[0m
[32m[I 2022-10-19 19:15:59,366][0m sklearn.ensemble.RandomForestClassifier.fit: running accelerated version on CPU[0m
[32m[I 2022-10-19 19:15:59,383][0m sklearn.ensemble.RandomForestClassifier.fit: fallback to original Scikit-learn[0m
[32m[I 2022-10-19 19:15:59,484][0m sklearn.ensemble.RandomForestClassifier.fit: fallback to original Scikit-learn[0m
[32m[I 2022-10-19 19:15:59,500][0m sklearn.ensemble.RandomForestClassifier.fit: running accelerated version on CPU[0m
[32m[I 2022-10-19 19:15:59,574][0m sklearn.ensemble.RandomForestClassifier.fit: running accelerated version on CPU[0m
[32m[I 2022-10-19 19:16:04,996][0m sklearn.ensemble.RandomForestClassifier.predict: running accelerated version on CPU[0m
[32m[I 2022-10-19 19:16:06,126][0m Trial 6 finished with value: 0.9916845989369517 and parameters: {'rfc_criterion': 'gini', 'rfc_n_estimators': 10, 'rfc_min_samples_split': 22, 'rfc_min_samples_leaf': 34, 'rfc_max_features': 23, 'rfc_bootstrap': False}. Best is trial 6 with value: 0.991685.[0m
[32m[I 2022-10-19 19:16:06,564][0m sklearn.ensemble.RandomForestClassifier.fit: fallback to original Scikit-learn[0m
[32m[I 2022-10-19 19:16:21,439][0m sklearn.ensemble.RandomForestClassifier.predict: running accelerated version on CPU[0m
[32m[I 2022-10-19 19:16:23,823][0m Trial 4 finished with value: 0.991335385660587 and parameters: {'rfc_criterion': 'gini', 'rfc_n_estimators': 120, 'rfc_min_samples_split': 46, 'rfc_min_samples_leaf': 43, 'rfc_max_features': 4, 'rfc_bootstrap': True}. Best is trial 6 with value: 0.991685.[0m
[32m[I 2022-10-19 19:16:24,218][0m sklearn.ensemble.RandomForestClassifier.fit: fallback to original Scikit-learn[0m
[32m[I 2022-10-19 19:16:25,164][0m sklearn.ensemble.RandomForestClassifier.predict: fallback to original Scikit-learn[0m
[32m[I 2022-10-19 19:16:25,164][0m sklearn.ensemble.RandomForestClassifier.predict_proba: fallback to original Scikit-learn[0m
[32m[I 2022-10-19 19:16:26,206][0m Trial 0 finished with value: 0.9913980808008755 and parameters: {'rfc_criterion': 'entropy', 'rfc_n_estimators': 10, 'rfc_min_samples_split': 11, 'rfc_min_samples_leaf': 19, 'rfc_max_features': 40, 'rfc_bootstrap': False}. Best is trial 6 with value: 0.991685.[0m
[32m[I 2022-10-19 19:16:26,849][0m sklearn.ensemble.RandomForestClassifier.fit: running accelerated version on CPU[0m
[32m[I 2022-10-19 19:16:39,376][0m sklearn.ensemble.RandomForestClassifier.predict: running accelerated version on CPU[0m
[32m[I 2022-10-19 19:16:41,679][0m sklearn.ensemble.RandomForestClassifier.predict: running accelerated version on CPU[0m
[32m[I 2022-10-19 19:16:41,963][0m Trial 3 finished with value: 0.9917402891326571 and parameters: {'rfc_criterion': 'gini', 'rfc_n_estimators': 170, 'rfc_min_samples_split': 49, 'rfc_min_samples_leaf': 32, 'rfc_max_features': 34, 'rfc_bootstrap': False}. Best is trial 3 with value: 0.99174.[0m
[32m[I 2022-10-19 19:16:42,412][0m sklearn.ensemble.RandomForestClassifier.fit: fallback to original Scikit-learn[0m
[32m[I 2022-10-19 19:16:43,246][0m Trial 10 finished with value: 0.9917681681172228 and parameters: {'rfc_criterion': 'gini', 'rfc_n_estimators': 30, 'rfc_min_samples_split': 35, 'rfc_min_samples_leaf': 45, 'rfc_max_features': 21, 'rfc_bootstrap': False}. Best is trial 10 with value: 0.991768.[0m
[32m[I 2022-10-19 19:16:43,864][0m sklearn.ensemble.RandomForestClassifier.fit: running accelerated version on CPU[0m
[32m[I 2022-10-19 19:16:52,738][0m sklearn.ensemble.RandomForestClassifier.predict: running accelerated version on CPU[0m
[32m[I 2022-10-19 19:16:54,107][0m Trial 12 finished with value: 0.9916023732718193 and parameters: {'rfc_criterion': 'gini', 'rfc_n_estimators': 20, 'rfc_min_samples_split': 18, 'rfc_min_samples_leaf': 47, 'rfc_max_features': 30, 'rfc_bootstrap': True}. Best is trial 10 with value: 0.991768.[0m
[32m[I 2022-10-19 19:16:54,750][0m sklearn.ensemble.RandomForestClassifier.fit: running accelerated version on CPU[0m
[32m[I 2022-10-19 19:17:06,533][0m sklearn.ensemble.RandomForestClassifier.predict: running accelerated version on CPU[0m
[32m[I 2022-10-19 19:17:07,136][0m sklearn.ensemble.RandomForestClassifier.predict: running accelerated version on CPU[0m
[32m[I 2022-10-19 19:17:09,284][0m Trial 1 finished with value: 0.99146568986196 and parameters: {'rfc_criterion': 'gini', 'rfc_n_estimators': 180, 'rfc_min_samples_split': 18, 'rfc_min_samples_leaf': 45, 'rfc_max_features': 50, 'rfc_bootstrap': True}. Best is trial 10 with value: 0.991768.[0m
[32m[I 2022-10-19 19:17:09,747][0m sklearn.ensemble.RandomForestClassifier.fit: fallback to original Scikit-learn[0m
[32m[I 2022-10-19 19:17:10,595][0m Trial 2 finished with value: 0.9914883596746034 and parameters: {'rfc_criterion': 'gini', 'rfc_n_estimators': 200, 'rfc_min_samples_split': 39, 'rfc_min_samples_leaf': 41, 'rfc_max_features': 40, 'rfc_bootstrap': True}. Best is trial 10 with value: 0.991768.[0m
[32m[I 2022-10-19 19:17:11,049][0m sklearn.ensemble.RandomForestClassifier.fit: fallback to original Scikit-learn[0m
[32m[I 2022-10-19 19:17:16,916][0m sklearn.ensemble.RandomForestClassifier.predict: fallback to original Scikit-learn[0m
[32m[I 2022-10-19 19:17:16,916][0m sklearn.ensemble.RandomForestClassifier.predict_proba: fallback to original Scikit-learn[0m
[32m[I 2022-10-19 19:17:19,717][0m Trial 8 finished with value: 0.9912213161509426 and parameters: {'rfc_criterion': 'entropy', 'rfc_n_estimators': 90, 'rfc_min_samples_split': 18, 'rfc_min_samples_leaf': 32, 'rfc_max_features': 10, 'rfc_bootstrap': True}. Best is trial 10 with value: 0.991768.[0m
[32m[I 2022-10-19 19:17:20,259][0m sklearn.ensemble.RandomForestClassifier.fit: fallback to original Scikit-learn[0m
[32m[I 2022-10-19 19:17:24,756][0m sklearn.ensemble.RandomForestClassifier.predict: running accelerated version on CPU[0m
[32m[I 2022-10-19 19:17:25,578][0m Trial 13 finished with value: 0.9916578605723954 and parameters: {'rfc_criterion': 'gini', 'rfc_n_estimators': 170, 'rfc_min_samples_split': 37, 'rfc_min_samples_leaf': 20, 'rfc_max_features': 49, 'rfc_bootstrap': True}. Best is trial 10 with value: 0.991768.[0m
[32m[I 2022-10-19 19:17:25,766][0m sklearn.ensemble.RandomForestClassifier.fit: fallback to original Scikit-learn[0m
[32m[I 2022-10-19 19:17:32,875][0m sklearn.ensemble.RandomForestClassifier.predict: fallback to original Scikit-learn[0m
[32m[I 2022-10-19 19:17:32,875][0m sklearn.ensemble.RandomForestClassifier.predict_proba: fallback to original Scikit-learn[0m
[32m[I 2022-10-19 19:17:34,141][0m Trial 5 finished with value: 0.9915344228764252 and parameters: {'rfc_criterion': 'entropy', 'rfc_n_estimators': 60, 'rfc_min_samples_split': 34, 'rfc_min_samples_leaf': 30, 'rfc_max_features': 39, 'rfc_bootstrap': True}. Best is trial 10 with value: 0.991768.[0m
[32m[I 2022-10-19 19:17:34,394][0m sklearn.ensemble.RandomForestClassifier.fit: running accelerated version on CPU[0m
[32m[I 2022-10-19 19:17:50,229][0m sklearn.ensemble.RandomForestClassifier.predict: running accelerated version on CPU[0m
[32m[I 2022-10-19 19:17:50,952][0m Trial 18 finished with value: 0.9917696826317232 and parameters: {'rfc_criterion': 'gini', 'rfc_n_estimators': 140, 'rfc_min_samples_split': 49, 'rfc_min_samples_leaf': 9, 'rfc_max_features': 20, 'rfc_bootstrap': False}. Best is trial 18 with value: 0.99177.[0m
[32m[I 2022-10-19 19:17:51,251][0m sklearn.ensemble.RandomForestClassifier.fit: running accelerated version on CPU[0m
[32m[I 2022-10-19 19:18:06,117][0m sklearn.ensemble.RandomForestClassifier.predict: running accelerated version on CPU[0m
[32m[I 2022-10-19 19:18:06,889][0m Trial 19 finished with value: 0.9917774046176044 and parameters: {'rfc_criterion': 'gini', 'rfc_n_estimators': 130, 'rfc_min_samples_split': 30, 'rfc_min_samples_leaf': 5, 'rfc_max_features': 20, 'rfc_bootstrap': False}. Best is trial 19 with value: 0.991777.[0m
[32m[I 2022-10-19 19:18:07,154][0m sklearn.ensemble.RandomForestClassifier.fit: running accelerated version on CPU[0m
[32m[I 2022-10-19 19:18:16,267][0m sklearn.ensemble.RandomForestClassifier.predict: fallback to original Scikit-learn[0m
[32m[I 2022-10-19 19:18:16,267][0m sklearn.ensemble.RandomForestClassifier.predict_proba: fallback to original Scikit-learn[0m
[32m[I 2022-10-19 19:18:18,851][0m Trial 11 finished with value: 0.9914736797295078 and parameters: {'rfc_criterion': 'entropy', 'rfc_n_estimators': 70, 'rfc_min_samples_split': 8, 'rfc_min_samples_leaf': 41, 'rfc_max_features': 32, 'rfc_bootstrap': True}. Best is trial 19 with value: 0.991777.[0m
[32m[I 2022-10-19 19:18:19,468][0m sklearn.ensemble.RandomForestClassifier.fit: running accelerated version on CPU[0m
[32m[I 2022-10-19 19:18:22,802][0m sklearn.ensemble.RandomForestClassifier.predict: running accelerated version on CPU[0m
[32m[I 2022-10-19 19:18:25,436][0m Trial 20 finished with value: 0.991873188049099 and parameters: {'rfc_criterion': 'gini', 'rfc_n_estimators': 130, 'rfc_min_samples_split': 3, 'rfc_min_samples_leaf': 2, 'rfc_max_features': 14, 'rfc_bootstrap': False}. Best is trial 20 with value: 0.991873.[0m
[32m[I 2022-10-19 19:18:34,378][0m sklearn.ensemble.RandomForestClassifier.predict: running accelerated version on CPU[0m
[32m[I 2022-10-19 19:18:35,086][0m Trial 21 finished with value: 0.9918657242002191 and parameters: {'rfc_criterion': 'gini', 'rfc_n_estimators': 130, 'rfc_min_samples_split': 28, 'rfc_min_samples_leaf': 1, 'rfc_max_features': 14, 'rfc_bootstrap': False}. Best is trial 20 with value: 0.991873.[0m
[32m[I 2022-10-19 19:18:36,747][0m sklearn.ensemble.RandomForestClassifier.predict: fallback to original Scikit-learn[0m
[32m[I 2022-10-19 19:18:36,763][0m sklearn.ensemble.RandomForestClassifier.predict_proba: fallback to original Scikit-learn[0m
[32m[I 2022-10-19 19:18:38,300][0m sklearn.ensemble.RandomForestClassifier.predict: fallback to original Scikit-learn[0m
[32m[I 2022-10-19 19:18:38,300][0m sklearn.ensemble.RandomForestClassifier.predict_proba: fallback to original Scikit-learn[0m
[32m[I 2022-10-19 19:18:38,503][0m Trial 14 finished with value: 0.9914161372452562 and parameters: {'rfc_criterion': 'entropy', 'rfc_n_estimators': 120, 'rfc_min_samples_split': 40, 'rfc_min_samples_leaf': 35, 'rfc_max_features': 9, 'rfc_bootstrap': False}. Best is trial 20 with value: 0.991873.[0m
[32m[I 2022-10-19 19:18:39,507][0m Trial 17 finished with value: 0.9917172775183658 and parameters: {'rfc_criterion': 'entropy', 'rfc_n_estimators': 60, 'rfc_min_samples_split': 2, 'rfc_min_samples_leaf': 2, 'rfc_max_features': 20, 'rfc_bootstrap': False}. Best is trial 20 with value: 0.991873.[0m
[32m[I 2022-10-19 19:18:51,868][0m sklearn.ensemble.RandomForestClassifier.predict: fallback to original Scikit-learn[0m
[32m[I 2022-10-19 19:18:51,868][0m sklearn.ensemble.RandomForestClassifier.predict_proba: fallback to original Scikit-learn[0m
[32m[I 2022-10-19 19:18:52,930][0m Trial 16 finished with value: 0.9915879045993892 and parameters: {'rfc_criterion': 'entropy', 'rfc_n_estimators': 70, 'rfc_min_samples_split': 16, 'rfc_min_samples_leaf': 44, 'rfc_max_features': 50, 'rfc_bootstrap': True}. Best is trial 20 with value: 0.991873.[0m
[32m[I 2022-10-19 19:18:57,928][0m sklearn.ensemble.RandomForestClassifier.predict: fallback to original Scikit-learn[0m
[32m[I 2022-10-19 19:18:57,928][0m sklearn.ensemble.RandomForestClassifier.predict_proba: fallback to original Scikit-learn[0m
[32m[I 2022-10-19 19:18:59,038][0m Trial 9 finished with value: 0.9918876287768105 and parameters: {'rfc_criterion': 'entropy', 'rfc_n_estimators': 80, 'rfc_min_samples_split': 35, 'rfc_min_samples_leaf': 37, 'rfc_max_features': 50, 'rfc_bootstrap': False}. Best is trial 9 with value: 0.991888.[0m
[32m[I 2022-10-19 19:19:02,351][0m sklearn.ensemble.RandomForestClassifier.predict: fallback to original Scikit-learn[0m
[32m[I 2022-10-19 19:19:02,351][0m sklearn.ensemble.RandomForestClassifier.predict_proba: fallback to original Scikit-learn[0m
[32m[I 2022-10-19 19:19:03,790][0m Trial 15 finished with value: 0.9915196731656833 and parameters: {'rfc_criterion': 'entropy', 'rfc_n_estimators': 130, 'rfc_min_samples_split': 27, 'rfc_min_samples_leaf': 4, 'rfc_max_features': 31, 'rfc_bootstrap': True}. Best is trial 9 with value: 0.991888.[0m
[32m[I 2022-10-19 19:19:10,307][0m sklearn.ensemble.RandomForestClassifier.predict: fallback to original Scikit-learn[0m
[32m[I 2022-10-19 19:19:10,307][0m sklearn.ensemble.RandomForestClassifier.predict_proba: fallback to original Scikit-learn[0m
[32m[I 2022-10-19 19:19:11,698][0m Trial 7 finished with value: 0.9918025618606513 and parameters: {'rfc_criterion': 'entropy', 'rfc_n_estimators': 130, 'rfc_min_samples_split': 9, 'rfc_min_samples_leaf': 4, 'rfc_max_features': 39, 'rfc_bootstrap': False}. Best is trial 9 with value: 0.991888.[0m
[32m[I 2022-10-19 19:19:11,776][0m EarlyStopping exceeded for RandomForestClassifier; no new best scores on iters 20.[0m
[32m[I 2022-10-19 19:19:11,776][0m Study finished.[0m
[32m[I 2022-10-19 19:19:11,792][0m --------------------------------------------------------------------------------[0m
[32m[I 2022-10-19 19:19:11,792][0m --------------------            RidgeClassifier             --------------------[0m
[32m[I 2022-10-19 19:19:11,792][0m --------------------------------------------------------------------------------[0m
[32m[I 2022-10-19 19:19:11,823][0m A new study created in RDB with name: RidgeClassifier_b9881135[0m
[32m[I 2022-10-19 19:19:11,823][0m Study started.[0m
[32m[I 2022-10-19 19:19:14,455][0m Trial 2 finished with value: 0.9041440623928134 and parameters: {'rc_C': 4985.098858917191, 'rc_tol': 0.0001279175313366312}. Best is trial 7 with value: 0.904744.[0m
[32m[I 2022-10-19 19:19:14,534][0m Trial 7 finished with value: 0.9047439555188416 and parameters: {'rc_C': 9.448949295064575e-05, 'rc_tol': 0.0012751865111724355}. Best is trial 7 with value: 0.904744.[0m
[32m[I 2022-10-19 19:19:14,612][0m Trial 0 finished with value: 0.9047439555188416 and parameters: {'rc_C': 1.1963398233814982e-06, 'rc_tol': 0.0009378692297654043}. Best is trial 0 with value: 0.904744.[0m
[32m[I 2022-10-19 19:19:14,612][0m Trial 1 finished with value: 0.9047439555188416 and parameters: {'rc_C': 0.7136308925681647, 'rc_tol': 0.000339372654473572}. Best is trial 0 with value: 0.904744.[0m
[32m[I 2022-10-19 19:19:14,769][0m Trial 5 finished with value: 0.9047439555188416 and parameters: {'rc_C': 7.405278522980445e-05, 'rc_tol': 0.00010108608379282194}. Best is trial 0 with value: 0.904744.[0m
[32m[I 2022-10-19 19:19:14,847][0m Trial 3 finished with value: 0.9047439555188416 and parameters: {'rc_C': 8.50604027491544e-05, 'rc_tol': 0.00013098394088902708}. Best is trial 0 with value: 0.904744.[0m
[32m[I 2022-10-19 19:19:14,847][0m Trial 4 finished with value: 0.9047439555188416 and parameters: {'rc_C': 4.309800968304361e-06, 'rc_tol': 0.0007594244695570281}. Best is trial 0 with value: 0.904744.[0m
[32m[I 2022-10-19 19:19:15,004][0m Trial 6 finished with value: 0.9047439555188416 and parameters: {'rc_C': 0.00402918446824219, 'rc_tol': 0.00021621629451141054}. Best is trial 0 with value: 0.904744.[0m
[32m[I 2022-10-19 19:19:17,995][0m Trial 10 finished with value: 0.9047439555188416 and parameters: {'rc_C': 5.0850802623683305e-05, 'rc_tol': 0.008684286645283668}. Best is trial 0 with value: 0.904744.[0m
[32m[I 2022-10-19 19:19:17,995][0m Trial 11 finished with value: 0.9047439555188416 and parameters: {'rc_C': 0.12158016486633576, 'rc_tol': 0.002623348292216637}. Best is trial 0 with value: 0.904744.[0m
[32m[I 2022-10-19 19:19:18,098][0m Trial 12 finished with value: 0.9041285944594778 and parameters: {'rc_C': 2309.2970949626433, 'rc_tol': 0.0018339510802213154}. Best is trial 0 with value: 0.904744.[0m
[32m[I 2022-10-19 19:19:18,281][0m Trial 13 finished with value: 0.9047439555188416 and parameters: {'rc_C': 0.001027375046269712, 'rc_tol': 0.0005512119725545712}. Best is trial 0 with value: 0.904744.[0m
[32m[I 2022-10-19 19:19:18,285][0m Trial 9 finished with value: 0.9047439555188416 and parameters: {'rc_C': 0.16889906559587997, 'rc_tol': 0.0009736981404840732}. Best is trial 0 with value: 0.904744.[0m
[32m[I 2022-10-19 19:19:18,287][0m Trial 14 finished with value: 0.9047439555188416 and parameters: {'rc_C': 0.45303579606499694, 'rc_tol': 0.0013265500282718735}. Best is trial 0 with value: 0.904744.[0m
[32m[I 2022-10-19 19:19:18,366][0m Trial 8 finished with value: 0.9047439555188416 and parameters: {'rc_C': 0.00021973660878902968, 'rc_tol': 0.0001258465036504899}. Best is trial 0 with value: 0.904744.[0m
[32m[I 2022-10-19 19:19:18,441][0m Trial 15 finished with value: 0.9047439555188416 and parameters: {'rc_C': 0.002339689879797678, 'rc_tol': 0.00037131900228163945}. Best is trial 0 with value: 0.904744.[0m
[32m[I 2022-10-19 19:19:21,507][0m Trial 20 finished with value: 0.8516184501931903 and parameters: {'rc_C': 374485.51245192764, 'rc_tol': 0.00031493219519137286}. Best is trial 0 with value: 0.904744.[0m
[32m[I 2022-10-19 19:19:21,612][0m Trial 19 finished with value: 0.8516324755104056 and parameters: {'rc_C': 363258.9513436941, 'rc_tol': 0.00029789455729203104}. Best is trial 0 with value: 0.904744.[0m
[32m[I 2022-10-19 19:19:21,612][0m Trial 17 finished with value: 0.9043254518430234 and parameters: {'rc_C': 39.062166997720766, 'rc_tol': 0.00032906059972714517}. Best is trial 0 with value: 0.904744.[0m
[32m[I 2022-10-19 19:19:21,614][0m Trial 22 finished with value: 0.9043254518430234 and parameters: {'rc_C': 41.08308593256981, 'rc_tol': 0.0003332899961183962}. Best is trial 0 with value: 0.904744.[0m
[32m[I 2022-10-19 19:19:21,615][0m Trial 21 finished with value: 0.9043863195767216 and parameters: {'rc_C': 21.2409317637764, 'rc_tol': 0.0003414690728006788}. Best is trial 0 with value: 0.904744.[0m
[32m[I 2022-10-19 19:19:21,687][0m Trial 18 finished with value: 0.8937655039504292 and parameters: {'rc_C': 928333.9042742961, 'rc_tol': 0.0003942700051884462}. Best is trial 0 with value: 0.904744.[0m
[32m[I 2022-10-19 19:19:21,764][0m Trial 16 finished with value: 0.9043254518430234 and parameters: {'rc_C': 45.924831988372794, 'rc_tol': 0.00032274928498929377}. Best is trial 0 with value: 0.904744.[0m
[32m[I 2022-10-19 19:19:21,848][0m Trial 23 finished with value: 0.9043254518430234 and parameters: {'rc_C': 30.52301303132423, 'rc_tol': 0.0003425028645643129}. Best is trial 0 with value: 0.904744.[0m
[32m[I 2022-10-19 19:19:24,433][0m Trial 24 finished with value: 0.9047439555188416 and parameters: {'rc_C': 1.8405870278041371e-06, 'rc_tol': 0.0028345082659726076}. Best is trial 0 with value: 0.904744.[0m
