[32m[I 2022-10-19 16:30:45,727][0m Trial 15 finished with value: 0.3883138326575102 and parameters: {'gnb_var_smoothing': 0.022614659245760695}. Best is trial 13 with value: 0.853789.[0m
[32m[I 2022-10-19 16:30:45,884][0m Trial 9 finished with value: 0.44864867331278313 and parameters: {'gnb_var_smoothing': 9.820896767885943e-06}. Best is trial 13 with value: 0.853789.[0m
[32m[I 2022-10-19 16:30:48,094][0m Trial 16 finished with value: 0.8466648170068484 and parameters: {'gnb_var_smoothing': 1.1743406712431826e-12}. Best is trial 13 with value: 0.853789.[0m
[32m[I 2022-10-19 16:30:48,360][0m Trial 17 finished with value: 0.8466648170068484 and parameters: {'gnb_var_smoothing': 2.2336882275097836e-12}. Best is trial 13 with value: 0.853789.[0m
[32m[I 2022-10-19 16:30:48,641][0m Trial 19 finished with value: 0.8466648170068484 and parameters: {'gnb_var_smoothing': 1.1714623937827852e-12}. Best is trial 13 with value: 0.853789.[0m
[32m[I 2022-10-19 16:30:48,705][0m Trial 21 finished with value: 0.8466190100106348 and parameters: {'gnb_var_smoothing': 6.646066257964091e-12}. Best is trial 13 with value: 0.853789.[0m
[32m[I 2022-10-19 16:30:48,799][0m Trial 20 finished with value: 0.8466190100106348 and parameters: {'gnb_var_smoothing': 5.805427974068676e-12}. Best is trial 13 with value: 0.853789.[0m
[32m[I 2022-10-19 16:30:48,815][0m Trial 18 finished with value: 0.8466648170068484 and parameters: {'gnb_var_smoothing': 1.0515138087681407e-12}. Best is trial 13 with value: 0.853789.[0m
[32m[I 2022-10-19 16:30:48,815][0m Trial 23 finished with value: 0.8466648170068484 and parameters: {'gnb_var_smoothing': 1.1981462308070732e-12}. Best is trial 13 with value: 0.853789.[0m
[32m[I 2022-10-19 16:30:48,893][0m Trial 22 finished with value: 0.8466648170068484 and parameters: {'gnb_var_smoothing': 2.631161131611498e-12}. Best is trial 13 with value: 0.853789.[0m
[32m[I 2022-10-19 16:30:50,381][0m Trial 24 finished with value: 0.8466648170068484 and parameters: {'gnb_var_smoothing': 2.0856749952618012e-12}. Best is trial 13 with value: 0.853789.[0m
[32m[I 2022-10-19 16:30:51,023][0m Trial 25 finished with value: 0.8549300342970795 and parameters: {'gnb_var_smoothing': 6.171649138056125e-10}. Best is trial 25 with value: 0.85493.[0m
[32m[I 2022-10-19 16:30:51,539][0m Trial 26 finished with value: 0.8548523889040832 and parameters: {'gnb_var_smoothing': 6.133098846622065e-10}. Best is trial 25 with value: 0.85493.[0m
[32m[I 2022-10-19 16:30:51,868][0m Trial 30 finished with value: 0.8542960676562957 and parameters: {'gnb_var_smoothing': 5.87007680784587e-10}. Best is trial 25 with value: 0.85493.[0m
[32m[I 2022-10-19 16:30:51,868][0m Trial 28 finished with value: 0.850425541450666 and parameters: {'gnb_var_smoothing': 3.6662803568504e-10}. Best is trial 25 with value: 0.85493.[0m
[32m[I 2022-10-19 16:30:51,868][0m Trial 31 finished with value: 0.8494135239974998 and parameters: {'gnb_var_smoothing': 3.191531055655832e-10}. Best is trial 25 with value: 0.85493.[0m
[32m[I 2022-10-19 16:30:51,868][0m Trial 27 finished with value: 0.8486098810868831 and parameters: {'gnb_var_smoothing': 2.871348243763459e-10}. Best is trial 25 with value: 0.85493.[0m
[32m[I 2022-10-19 16:30:51,946][0m Trial 29 finished with value: 0.8518661873147676 and parameters: {'gnb_var_smoothing': 4.3721385343505585e-10}. Best is trial 25 with value: 0.85493.[0m
[32m[I 2022-10-19 16:30:52,558][0m Trial 32 finished with value: 0.8521300795250724 and parameters: {'gnb_var_smoothing': 4.52649039250716e-10}. Best is trial 25 with value: 0.85493.[0m
[32m[I 2022-10-19 16:30:52,761][0m Trial 33 finished with value: 0.8499360410919496 and parameters: {'gnb_var_smoothing': 3.406541331329857e-10}. Best is trial 25 with value: 0.85493.[0m
[32m[I 2022-10-19 16:30:53,089][0m Trial 34 finished with value: 0.7408370845699203 and parameters: {'gnb_var_smoothing': 5.2737918606947804e-08}. Best is trial 25 with value: 0.85493.[0m
[32m[I 2022-10-19 16:30:53,151][0m EarlyStopping exceeded for GaussianNB; no new best scores on iters 20.[0m
[32m[I 2022-10-19 16:30:53,151][0m Study finished.[0m
[32m[I 2022-10-19 16:30:53,183][0m --------------------------------------------------------------------------------[0m
[32m[I 2022-10-19 16:30:53,183][0m --------------------     HistGradientBoostingClassifier     --------------------[0m
[32m[I 2022-10-19 16:30:53,183][0m --------------------------------------------------------------------------------[0m
[32m[I 2022-10-19 16:30:53,214][0m A new study created in RDB with name: HistGradientBoostingClassifier_b9881135[0m
[32m[I 2022-10-19 16:30:53,214][0m Study started.[0m
[32m[I 2022-10-19 16:31:07,616][0m Trial 0 finished with value: 0.9055399100795377 and parameters: {'hgbc_learning_rate': 0.654314501362333, 'hgbc_max_iter': 2000, 'hgbc_min_samples_leaf': 31, 'hgbc_l2_regularization': 0.0, 'hgbc_max_bins': 255, 'hgbc_early_stopping': True, 'hgbc_validation_fraction': 0.25, 'hgbc_n_iter_no_change': 10}. Best is trial 0 with value: 0.90554.[0m
[32m[I 2022-10-19 16:31:52,777][0m Trial 7 finished with value: 0.9915340021475394 and parameters: {'hgbc_learning_rate': 0.07071941379515004, 'hgbc_max_iter': 2000, 'hgbc_min_samples_leaf': 25, 'hgbc_l2_regularization': 1.0, 'hgbc_max_bins': 255, 'hgbc_early_stopping': True, 'hgbc_validation_fraction': 0.25, 'hgbc_n_iter_no_change': 10}. Best is trial 7 with value: 0.991534.[0m
[32m[I 2022-10-19 16:31:57,089][0m Trial 4 finished with value: 0.9915343110499857 and parameters: {'hgbc_learning_rate': 0.09990290796387684, 'hgbc_max_iter': 2000, 'hgbc_min_samples_leaf': 7, 'hgbc_l2_regularization': 0.0, 'hgbc_max_bins': 255, 'hgbc_early_stopping': True, 'hgbc_validation_fraction': 0.25, 'hgbc_n_iter_no_change': 10}. Best is trial 4 with value: 0.991534.[0m
[32m[I 2022-10-19 16:32:46,483][0m Trial 10 finished with value: 0.991503649193124 and parameters: {'hgbc_learning_rate': 0.08111190475498206, 'hgbc_max_iter': 2000, 'hgbc_min_samples_leaf': 49, 'hgbc_l2_regularization': 0.2, 'hgbc_max_bins': 255, 'hgbc_early_stopping': True, 'hgbc_validation_fraction': 0.25, 'hgbc_n_iter_no_change': 10}. Best is trial 4 with value: 0.991534.[0m
[32m[I 2022-10-19 16:33:21,168][0m Trial 3 finished with value: 0.9916114525349552 and parameters: {'hgbc_learning_rate': 0.04363745597565857, 'hgbc_max_iter': 2000, 'hgbc_min_samples_leaf': 36, 'hgbc_l2_regularization': 0.0, 'hgbc_max_bins': 63, 'hgbc_early_stopping': True, 'hgbc_validation_fraction': 0.25, 'hgbc_n_iter_no_change': 10}. Best is trial 3 with value: 0.991611.[0m
[32m[I 2022-10-19 16:33:44,152][0m Trial 12 finished with value: 0.9915110628735772 and parameters: {'hgbc_learning_rate': 0.2094430972119551, 'hgbc_max_iter': 2000, 'hgbc_min_samples_leaf': 27, 'hgbc_l2_regularization': 0.6000000000000001, 'hgbc_max_bins': 255, 'hgbc_early_stopping': True, 'hgbc_validation_fraction': 0.25, 'hgbc_n_iter_no_change': 10}. Best is trial 3 with value: 0.991611.[0m
[32m[I 2022-10-19 16:33:47,664][0m Trial 1 finished with value: 0.9915341567364162 and parameters: {'hgbc_learning_rate': 0.023274591366928905, 'hgbc_max_iter': 2000, 'hgbc_min_samples_leaf': 20, 'hgbc_l2_regularization': 1.0, 'hgbc_max_bins': 255, 'hgbc_early_stopping': True, 'hgbc_validation_fraction': 0.25, 'hgbc_n_iter_no_change': 10}. Best is trial 3 with value: 0.991611.[0m
[32m[I 2022-10-19 16:34:24,609][0m Trial 11 finished with value: 0.9916866185849273 and parameters: {'hgbc_learning_rate': 0.042781226879364746, 'hgbc_max_iter': 2000, 'hgbc_min_samples_leaf': 25, 'hgbc_l2_regularization': 0.2, 'hgbc_max_bins': 63, 'hgbc_early_stopping': True, 'hgbc_validation_fraction': 0.25, 'hgbc_n_iter_no_change': 10}. Best is trial 11 with value: 0.991687.[0m
[32m[I 2022-10-19 16:38:18,095][0m Trial 15 finished with value: 0.9915417257358722 and parameters: {'hgbc_learning_rate': 0.015541266383195793, 'hgbc_max_iter': 2000, 'hgbc_min_samples_leaf': 34, 'hgbc_l2_regularization': 1.0, 'hgbc_max_bins': 255, 'hgbc_early_stopping': True, 'hgbc_validation_fraction': 0.25, 'hgbc_n_iter_no_change': 10}. Best is trial 11 with value: 0.991687.[0m
[32m[I 2022-10-19 16:39:32,920][0m Trial 16 finished with value: 0.9915648564337076 and parameters: {'hgbc_learning_rate': 0.0849471468710622, 'hgbc_max_iter': 2000, 'hgbc_min_samples_leaf': 48, 'hgbc_l2_regularization': 0.0, 'hgbc_max_bins': 127, 'hgbc_early_stopping': True, 'hgbc_validation_fraction': 0.25, 'hgbc_n_iter_no_change': 10}. Best is trial 11 with value: 0.991687.[0m
[32m[I 2022-10-19 16:40:00,325][0m Trial 5 finished with value: 0.9916561107632208 and parameters: {'hgbc_learning_rate': 0.011355929237455747, 'hgbc_max_iter': 2000, 'hgbc_min_samples_leaf': 41, 'hgbc_l2_regularization': 0.0, 'hgbc_max_bins': 63, 'hgbc_early_stopping': True, 'hgbc_validation_fraction': 0.25, 'hgbc_n_iter_no_change': 10}. Best is trial 11 with value: 0.991687.[0m
[32m[I 2022-10-19 16:40:37,870][0m Trial 13 finished with value: 0.9916021644395394 and parameters: {'hgbc_learning_rate': 0.010078523914974703, 'hgbc_max_iter': 2000, 'hgbc_min_samples_leaf': 41, 'hgbc_l2_regularization': 0.6000000000000001, 'hgbc_max_bins': 63, 'hgbc_early_stopping': True, 'hgbc_validation_fraction': 0.25, 'hgbc_n_iter_no_change': 10}. Best is trial 11 with value: 0.991687.[0m
[32m[I 2022-10-19 16:43:44,299][0m Trial 2 finished with value: 0.9914799683419769 and parameters: {'hgbc_learning_rate': 0.0044338352259317305, 'hgbc_max_iter': 2000, 'hgbc_min_samples_leaf': 2, 'hgbc_l2_regularization': 0.2, 'hgbc_max_bins': 255, 'hgbc_early_stopping': True, 'hgbc_validation_fraction': 0.25, 'hgbc_n_iter_no_change': 10}. Best is trial 11 with value: 0.991687.[0m
[32m[I 2022-10-19 16:45:51,362][0m Trial 9 finished with value: 0.9915346956297306 and parameters: {'hgbc_learning_rate': 0.004192947074754669, 'hgbc_max_iter': 2000, 'hgbc_min_samples_leaf': 37, 'hgbc_l2_regularization': 0.2, 'hgbc_max_bins': 127, 'hgbc_early_stopping': True, 'hgbc_validation_fraction': 0.25, 'hgbc_n_iter_no_change': 10}. Best is trial 11 with value: 0.991687.[0m
[32m[I 2022-10-19 16:49:55,748][0m Trial 6 finished with value: 0.9914580435819675 and parameters: {'hgbc_learning_rate': 0.0027157726793501273, 'hgbc_max_iter': 2000, 'hgbc_min_samples_leaf': 39, 'hgbc_l2_regularization': 0.6000000000000001, 'hgbc_max_bins': 255, 'hgbc_early_stopping': True, 'hgbc_validation_fraction': 0.25, 'hgbc_n_iter_no_change': 10}. Best is trial 11 with value: 0.991687.[0m
[32m[I 2022-10-19 16:51:17,150][0m Trial 8 finished with value: 0.9915489854932344 and parameters: {'hgbc_learning_rate': 0.0011377550921342445, 'hgbc_max_iter': 2000, 'hgbc_min_samples_leaf': 20, 'hgbc_l2_regularization': 0.6000000000000001, 'hgbc_max_bins': 63, 'hgbc_early_stopping': True, 'hgbc_validation_fraction': 0.25, 'hgbc_n_iter_no_change': 10}. Best is trial 11 with value: 0.991687.[0m
[32m[I 2022-10-19 16:53:35,589][0m Trial 14 finished with value: 0.9915497567016122 and parameters: {'hgbc_learning_rate': 0.0022328501914795702, 'hgbc_max_iter': 2000, 'hgbc_min_samples_leaf': 24, 'hgbc_l2_regularization': 0.6000000000000001, 'hgbc_max_bins': 255, 'hgbc_early_stopping': True, 'hgbc_validation_fraction': 0.25, 'hgbc_n_iter_no_change': 10}. Best is trial 11 with value: 0.991687.[0m
[32m[I 2022-10-19 16:57:08,646][0m Trial 23 finished with value: 0.9916260224353521 and parameters: {'hgbc_learning_rate': 0.011717491919084803, 'hgbc_max_iter': 2000, 'hgbc_min_samples_leaf': 13, 'hgbc_l2_regularization': 0.4, 'hgbc_max_bins': 63, 'hgbc_early_stopping': True, 'hgbc_validation_fraction': 0.25, 'hgbc_n_iter_no_change': 10}. Best is trial 11 with value: 0.991687.[0m
[32m[I 2022-10-19 16:57:53,690][0m Trial 22 finished with value: 0.9915800331866041 and parameters: {'hgbc_learning_rate': 0.008360446492644365, 'hgbc_max_iter': 2000, 'hgbc_min_samples_leaf': 15, 'hgbc_l2_regularization': 0.4, 'hgbc_max_bins': 63, 'hgbc_early_stopping': True, 'hgbc_validation_fraction': 0.25, 'hgbc_n_iter_no_change': 10}. Best is trial 11 with value: 0.991687.[0m
[32m[I 2022-10-19 16:57:59,227][0m Trial 17 finished with value: 0.9915641626731654 and parameters: {'hgbc_learning_rate': 0.002565913065109499, 'hgbc_max_iter': 2000, 'hgbc_min_samples_leaf': 12, 'hgbc_l2_regularization': 0.4, 'hgbc_max_bins': 63, 'hgbc_early_stopping': True, 'hgbc_validation_fraction': 0.25, 'hgbc_n_iter_no_change': 10}. Best is trial 11 with value: 0.991687.[0m
[32m[I 2022-10-19 16:58:43,625][0m Trial 18 finished with value: 0.9915871796571754 and parameters: {'hgbc_learning_rate': 0.002265801341338306, 'hgbc_max_iter': 2000, 'hgbc_min_samples_leaf': 14, 'hgbc_l2_regularization': 0.4, 'hgbc_max_bins': 63, 'hgbc_early_stopping': True, 'hgbc_validation_fraction': 0.25, 'hgbc_n_iter_no_change': 10}. Best is trial 11 with value: 0.991687.[0m
[32m[I 2022-10-19 16:58:59,583][0m Trial 19 finished with value: 0.9915877174259178 and parameters: {'hgbc_learning_rate': 0.0018898836338722854, 'hgbc_max_iter': 2000, 'hgbc_min_samples_leaf': 12, 'hgbc_l2_regularization': 0.4, 'hgbc_max_bins': 63, 'hgbc_early_stopping': True, 'hgbc_validation_fraction': 0.25, 'hgbc_n_iter_no_change': 10}. Best is trial 11 with value: 0.991687.[0m
[32m[I 2022-10-19 17:00:06,617][0m Trial 20 finished with value: 0.9916189461864642 and parameters: {'hgbc_learning_rate': 0.0013622464214756043, 'hgbc_max_iter': 2000, 'hgbc_min_samples_leaf': 15, 'hgbc_l2_regularization': 0.4, 'hgbc_max_bins': 63, 'hgbc_early_stopping': True, 'hgbc_validation_fraction': 0.25, 'hgbc_n_iter_no_change': 10}. Best is trial 11 with value: 0.991687.[0m
[32m[I 2022-10-19 17:00:24,755][0m Trial 21 finished with value: 0.9915724255966734 and parameters: {'hgbc_learning_rate': 0.0010705784962777448, 'hgbc_max_iter': 2000, 'hgbc_min_samples_leaf': 15, 'hgbc_l2_regularization': 0.4, 'hgbc_max_bins': 63, 'hgbc_early_stopping': True, 'hgbc_validation_fraction': 0.25, 'hgbc_n_iter_no_change': 10}. Best is trial 11 with value: 0.991687.[0m
[32m[I 2022-10-19 17:00:24,818][0m EarlyStopping exceeded for HistGradientBoostingClassifier; no new best scores on iters 20.[0m
[32m[I 2022-10-19 17:00:24,818][0m Study finished.[0m
[32m[I 2022-10-19 17:00:24,849][0m --------------------------------------------------------------------------------[0m
[32m[I 2022-10-19 17:00:24,865][0m --------------------             LGBMClassifier             --------------------[0m
[32m[I 2022-10-19 17:00:24,865][0m --------------------------------------------------------------------------------[0m
[32m[I 2022-10-19 17:00:24,881][0m A new study created in RDB with name: LGBMClassifier_b9881135[0m
[32m[I 2022-10-19 17:00:24,896][0m Study started.[0m
[32m[I 2022-10-19 17:00:30,082][0m Trial 6 finished with value: 0.2844441188051378 and parameters: {'lgbm_num_leaves': 127, 'lgbm_learning_rate': 0.0014467391574585528, 'lgbm_n_estimators': 20, 'lgbm_reg_alpha': 0.9500000000000001, 'lgbm_reg_lambda': 0.55}. Best is trial 6 with value: 0.284444.[0m
[32m[I 2022-10-19 17:00:43,057][0m Trial 2 finished with value: 0.9915888585071536 and parameters: {'lgbm_num_leaves': 127, 'lgbm_learning_rate': 0.04518856637904433, 'lgbm_n_estimators': 100, 'lgbm_reg_alpha': 0.4, 'lgbm_reg_lambda': 0.7000000000000001}. Best is trial 2 with value: 0.991589.[0m
[32m[I 2022-10-19 17:00:46,432][0m Trial 1 finished with value: 0.9913740904376369 and parameters: {'lgbm_num_leaves': 7, 'lgbm_learning_rate': 0.18628509507981073, 'lgbm_n_estimators': 160, 'lgbm_reg_alpha': 0.4, 'lgbm_reg_lambda': 0.4}. Best is trial 2 with value: 0.991589.[0m
[32m[I 2022-10-19 17:00:49,886][0m Trial 0 finished with value: 0.2844441188051378 and parameters: {'lgbm_num_leaves': 7, 'lgbm_learning_rate': 8.590843502838702e-05, 'lgbm_n_estimators': 170, 'lgbm_reg_alpha': 0.0, 'lgbm_reg_lambda': 0.55}. Best is trial 2 with value: 0.991589.[0m
[32m[I 2022-10-19 17:00:52,242][0m Trial 4 finished with value: 0.9917566237953155 and parameters: {'lgbm_num_leaves': 127, 'lgbm_learning_rate': 0.05955101349896128, 'lgbm_n_estimators': 150, 'lgbm_reg_alpha': 0.65, 'lgbm_reg_lambda': 0.0}. Best is trial 4 with value: 0.991757.[0m
[32m[I 2022-10-19 17:00:53,308][0m Trial 5 finished with value: 0.5757784047521336 and parameters: {'lgbm_num_leaves': 63, 'lgbm_learning_rate': 0.6812408271716659, 'lgbm_n_estimators': 190, 'lgbm_reg_alpha': 0.65, 'lgbm_reg_lambda': 1.0}. Best is trial 4 with value: 0.991757.[0m
[32m[I 2022-10-19 17:00:54,059][0m Trial 7 finished with value: 0.2844441188051378 and parameters: {'lgbm_num_leaves': 127, 'lgbm_learning_rate': 0.00011431875645624371, 'lgbm_n_estimators': 160, 'lgbm_reg_alpha': 0.05, 'lgbm_reg_lambda': 0.9}. Best is trial 4 with value: 0.991757.[0m
[32m[I 2022-10-19 17:00:54,575][0m Trial 3 finished with value: 0.9874694735777781 and parameters: {'lgbm_num_leaves': 7, 'lgbm_learning_rate': 0.007027265595637102, 'lgbm_n_estimators': 200, 'lgbm_reg_alpha': 0.15000000000000002, 'lgbm_reg_lambda': 0.0}. Best is trial 4 with value: 0.991757.[0m
[32m[I 2022-10-19 17:00:55,577][0m Trial 8 finished with value: 0.2844441188051378 and parameters: {'lgbm_num_leaves': 7, 'lgbm_learning_rate': 3.3955460101509846e-06, 'lgbm_n_estimators': 180, 'lgbm_reg_alpha': 0.0, 'lgbm_reg_lambda': 0.7000000000000001}. Best is trial 4 with value: 0.991757.[0m
[32m[I 2022-10-19 17:01:03,195][0m Trial 14 finished with value: 0.4945405743159749 and parameters: {'lgbm_num_leaves': 7, 'lgbm_learning_rate': 0.5709891139121878, 'lgbm_n_estimators': 50, 'lgbm_reg_alpha': 0.35000000000000003, 'lgbm_reg_lambda': 0.4}. Best is trial 4 with value: 0.991757.[0m
[32m[I 2022-10-19 17:01:03,901][0m Trial 12 finished with value: 0.9914515191712423 and parameters: {'lgbm_num_leaves': 7, 'lgbm_learning_rate': 0.08873576874064136, 'lgbm_n_estimators': 70, 'lgbm_reg_alpha': 0.8500000000000001, 'lgbm_reg_lambda': 0.0}. Best is trial 4 with value: 0.991757.[0m
[32m[I 2022-10-19 17:01:04,575][0m Trial 11 finished with value: 0.9915332250719924 and parameters: {'lgbm_num_leaves': 15, 'lgbm_learning_rate': 0.21345868747181468, 'lgbm_n_estimators': 100, 'lgbm_reg_alpha': 0.9, 'lgbm_reg_lambda': 0.5}. Best is trial 4 with value: 0.991757.[0m
[32m[I 2022-10-19 17:01:09,250][0m Trial 16 finished with value: 0.9915963141742793 and parameters: {'lgbm_num_leaves': 63, 'lgbm_learning_rate': 0.15882288671278647, 'lgbm_n_estimators': 70, 'lgbm_reg_alpha': 0.9, 'lgbm_reg_lambda': 0.05}. Best is trial 4 with value: 0.991757.[0m
[32m[I 2022-10-19 17:01:11,851][0m Trial 13 finished with value: 0.2844441188051378 and parameters: {'lgbm_num_leaves': 7, 'lgbm_learning_rate': 3.871362126412465e-06, 'lgbm_n_estimators': 120, 'lgbm_reg_alpha': 0.75, 'lgbm_reg_lambda': 0.55}. Best is trial 4 with value: 0.991757.[0m
[32m[I 2022-10-19 17:01:15,558][0m Trial 10 finished with value: 0.2844441188051378 and parameters: {'lgbm_num_leaves': 15, 'lgbm_learning_rate': 1.1863368940719438e-06, 'lgbm_n_estimators': 170, 'lgbm_reg_alpha': 0.45, 'lgbm_reg_lambda': 0.8}. Best is trial 4 with value: 0.991757.[0m
[32m[I 2022-10-19 17:01:17,605][0m Trial 9 finished with value: 0.2844441188051378 and parameters: {'lgbm_num_leaves': 31, 'lgbm_learning_rate': 4.196618686061918e-06, 'lgbm_n_estimators': 200, 'lgbm_reg_alpha': 0.8500000000000001, 'lgbm_reg_lambda': 0.8500000000000001}. Best is trial 4 with value: 0.991757.[0m
[32m[I 2022-10-19 17:01:23,490][0m Trial 17 finished with value: 0.9914967753633406 and parameters: {'lgbm_num_leaves': 15, 'lgbm_learning_rate': 0.018806946469479006, 'lgbm_n_estimators': 110, 'lgbm_reg_alpha': 0.75, 'lgbm_reg_lambda': 0.0}. Best is trial 4 with value: 0.991757.[0m
[32m[I 2022-10-19 17:01:25,168][0m Trial 15 finished with value: 0.2844441188051378 and parameters: {'lgbm_num_leaves': 127, 'lgbm_learning_rate': 4.473238314047942e-06, 'lgbm_n_estimators': 170, 'lgbm_reg_alpha': 1.0, 'lgbm_reg_lambda': 0.9500000000000001}. Best is trial 4 with value: 0.991757.[0m
[32m[I 2022-10-19 17:01:27,006][0m Trial 18 finished with value: 0.9915246746488281 and parameters: {'lgbm_num_leaves': 127, 'lgbm_learning_rate': 0.012633587831957067, 'lgbm_n_estimators': 120, 'lgbm_reg_alpha': 0.6000000000000001, 'lgbm_reg_lambda': 0.15000000000000002}. Best is trial 4 with value: 0.991757.[0m
[32m[I 2022-10-19 17:01:27,413][0m Trial 19 finished with value: 0.9914578099221272 and parameters: {'lgbm_num_leaves': 127, 'lgbm_learning_rate': 0.01732091198472979, 'lgbm_n_estimators': 120, 'lgbm_reg_alpha': 0.6000000000000001, 'lgbm_reg_lambda': 0.25}. Best is trial 4 with value: 0.991757.[0m
[32m[I 2022-10-19 17:01:35,367][0m Trial 20 finished with value: 0.9915312123332796 and parameters: {'lgbm_num_leaves': 63, 'lgbm_learning_rate': 0.01198377580696345, 'lgbm_n_estimators': 140, 'lgbm_reg_alpha': 0.7000000000000001, 'lgbm_reg_lambda': 0.2}. Best is trial 4 with value: 0.991757.[0m
[32m[I 2022-10-19 17:01:35,821][0m Trial 21 finished with value: 0.9912315092968779 and parameters: {'lgbm_num_leaves': 31, 'lgbm_learning_rate': 0.013309064254091316, 'lgbm_n_estimators': 130, 'lgbm_reg_alpha': 0.7000000000000001, 'lgbm_reg_lambda': 0.2}. Best is trial 4 with value: 0.991757.[0m
[32m[I 2022-10-19 17:01:39,749][0m Trial 22 finished with value: 0.991239203974773 and parameters: {'lgbm_num_leaves': 31, 'lgbm_learning_rate': 0.0132709167891958, 'lgbm_n_estimators': 130, 'lgbm_reg_alpha': 0.65, 'lgbm_reg_lambda': 0.15000000000000002}. Best is trial 4 with value: 0.991757.[0m
[32m[I 2022-10-19 17:01:40,187][0m Trial 23 finished with value: 0.9915473435763057 and parameters: {'lgbm_num_leaves': 63, 'lgbm_learning_rate': 0.01574246239742218, 'lgbm_n_estimators': 120, 'lgbm_reg_alpha': 0.65, 'lgbm_reg_lambda': 0.15000000000000002}. Best is trial 4 with value: 0.991757.[0m
