[32m[I 2022-10-19 16:00:16,121][0m Optimization for 30 classifiers started.[0m
[32m[I 2022-10-19 16:00:16,981][0m X_train shape: (524560, 50); y_train shape: (524560,); y_train unique values: {0, 1, 2, 3, 4}[0m
[32m[I 2022-10-19 16:00:16,981][0m X_test shape: (131140, 50); y_test shape: (131140,); y_test unique values: {0, 1, 2, 3, 4}[0m
[32m[I 2022-10-19 16:00:16,997][0m --------------------------------------------------------------------------------[0m
[32m[I 2022-10-19 16:00:16,997][0m --------------------           AdaBoostClassifier           --------------------[0m
[32m[I 2022-10-19 16:00:16,997][0m --------------------------------------------------------------------------------[0m
[32m[I 2022-10-19 16:00:17,061][0m A new study created in RDB with name: AdaBoostClassifier_b9881135[0m
[32m[I 2022-10-19 16:00:17,061][0m Study started.[0m
[32m[I 2022-10-19 16:00:43,791][0m Trial 3 finished with value: 0.7246034468560911 and parameters: {'abc_n_estimators': 30, 'abc_learning_rate': 0.9341231103882346}. Best is trial 3 with value: 0.724603.[0m
[32m[I 2022-10-19 16:00:47,659][0m Trial 7 finished with value: 0.8603554461071355 and parameters: {'abc_n_estimators': 35, 'abc_learning_rate': 0.6361106449811881}. Best is trial 7 with value: 0.860355.[0m
[32m[I 2022-10-19 16:01:00,280][0m Trial 1 finished with value: 0.5830927546766471 and parameters: {'abc_n_estimators': 50, 'abc_learning_rate': 2.2100038391228393e-05}. Best is trial 7 with value: 0.860355.[0m
[32m[I 2022-10-19 16:01:00,721][0m Trial 2 finished with value: 0.5830927546766471 and parameters: {'abc_n_estimators': 50, 'abc_learning_rate': 2.4576702785333448e-05}. Best is trial 7 with value: 0.860355.[0m
[32m[I 2022-10-19 16:01:11,814][0m Trial 0 finished with value: 0.7112279308595345 and parameters: {'abc_n_estimators': 65, 'abc_learning_rate': 0.19215324644795226}. Best is trial 7 with value: 0.860355.[0m
[32m[I 2022-10-19 16:01:12,460][0m Trial 5 finished with value: 0.5830927546766471 and parameters: {'abc_n_estimators': 65, 'abc_learning_rate': 0.001145316453725157}. Best is trial 7 with value: 0.860355.[0m
[32m[I 2022-10-19 16:01:13,091][0m Trial 8 finished with value: 0.7581185821475852 and parameters: {'abc_n_estimators': 35, 'abc_learning_rate': 0.06532659778172184}. Best is trial 7 with value: 0.860355.[0m
[32m[I 2022-10-19 16:01:20,655][0m Trial 6 finished with value: 0.6743506838844658 and parameters: {'abc_n_estimators': 75, 'abc_learning_rate': 0.006137459912315333}. Best is trial 7 with value: 0.860355.[0m
[32m[I 2022-10-19 16:01:25,758][0m Trial 9 finished with value: 0.6755988827884419 and parameters: {'abc_n_estimators': 45, 'abc_learning_rate': 0.011120986436202285}. Best is trial 7 with value: 0.860355.[0m
[32m[I 2022-10-19 16:01:29,335][0m Trial 4 finished with value: 0.5830927546766471 and parameters: {'abc_n_estimators': 85, 'abc_learning_rate': 0.0004900477756282619}. Best is trial 7 with value: 0.860355.[0m
[32m[I 2022-10-19 16:02:03,248][0m Trial 16 finished with value: 0.6190148492952547 and parameters: {'abc_n_estimators': 45, 'abc_learning_rate': 0.008946742616288373}. Best is trial 7 with value: 0.860355.[0m
[32m[I 2022-10-19 16:02:10,787][0m Trial 12 finished with value: 0.7578065575256585 and parameters: {'abc_n_estimators': 70, 'abc_learning_rate': 0.02845203407031178}. Best is trial 7 with value: 0.860355.[0m
[32m[I 2022-10-19 16:02:11,641][0m Trial 11 finished with value: 0.5830927546766471 and parameters: {'abc_n_estimators': 85, 'abc_learning_rate': 9.192818420191378e-06}. Best is trial 7 with value: 0.860355.[0m
[32m[I 2022-10-19 16:02:15,945][0m Trial 10 finished with value: 0.5830927546766471 and parameters: {'abc_n_estimators': 90, 'abc_learning_rate': 0.0014474058800771365}. Best is trial 7 with value: 0.860355.[0m
[32m[I 2022-10-19 16:02:19,386][0m Trial 13 finished with value: 0.7581185821475852 and parameters: {'abc_n_estimators': 80, 'abc_learning_rate': 0.027849760064456025}. Best is trial 7 with value: 0.860355.[0m
[32m[I 2022-10-19 16:02:25,199][0m Trial 18 finished with value: 0.7128750257008201 and parameters: {'abc_n_estimators': 25, 'abc_learning_rate': 0.14016644687800353}. Best is trial 7 with value: 0.860355.[0m
[32m[I 2022-10-19 16:02:31,706][0m Trial 15 finished with value: 0.5830927546766471 and parameters: {'abc_n_estimators': 85, 'abc_learning_rate': 0.0023840818125132677}. Best is trial 7 with value: 0.860355.[0m
[32m[I 2022-10-19 16:02:32,445][0m Trial 14 finished with value: 0.5830927546766471 and parameters: {'abc_n_estimators': 95, 'abc_learning_rate': 0.001230628156769972}. Best is trial 7 with value: 0.860355.[0m
[32m[I 2022-10-19 16:02:33,010][0m Trial 19 finished with value: 0.7112508091213986 and parameters: {'abc_n_estimators': 25, 'abc_learning_rate': 0.17713022555149868}. Best is trial 7 with value: 0.860355.[0m
[32m[I 2022-10-19 16:02:33,874][0m Trial 20 finished with value: 0.7442866731014973 and parameters: {'abc_n_estimators': 25, 'abc_learning_rate': 0.7907108219950136}. Best is trial 7 with value: 0.860355.[0m
[32m[I 2022-10-19 16:02:36,990][0m Trial 21 finished with value: 0.7089808217007433 and parameters: {'abc_n_estimators': 25, 'abc_learning_rate': 0.19036559845920803}. Best is trial 7 with value: 0.860355.[0m
[32m[I 2022-10-19 16:02:40,949][0m Trial 22 finished with value: 0.7575808653204157 and parameters: {'abc_n_estimators': 25, 'abc_learning_rate': 0.7642552678216245}. Best is trial 7 with value: 0.860355.[0m
[32m[I 2022-10-19 16:02:48,511][0m Trial 17 finished with value: 0.5830927546766471 and parameters: {'abc_n_estimators': 95, 'abc_learning_rate': 1.3022552777305497e-06}. Best is trial 7 with value: 0.860355.[0m
[32m[I 2022-10-19 16:02:53,083][0m Trial 23 finished with value: 0.7252704317187496 and parameters: {'abc_n_estimators': 35, 'abc_learning_rate': 0.9113019019634687}. Best is trial 7 with value: 0.860355.[0m
[32m[I 2022-10-19 16:02:57,524][0m Trial 24 finished with value: 0.7252704317187496 and parameters: {'abc_n_estimators': 35, 'abc_learning_rate': 0.9077568631624514}. Best is trial 7 with value: 0.860355.[0m
[32m[I 2022-10-19 16:02:57,774][0m Trial 25 finished with value: 0.7579686001063767 and parameters: {'abc_n_estimators': 35, 'abc_learning_rate': 0.8162319694828253}. Best is trial 7 with value: 0.860355.[0m
[32m[I 2022-10-19 16:03:00,184][0m Trial 28 finished with value: 0.7266493841638412 and parameters: {'abc_n_estimators': 35, 'abc_learning_rate': 0.03787506206045156}. Best is trial 7 with value: 0.860355.[0m
[32m[I 2022-10-19 16:03:22,397][0m Trial 26 finished with value: 0.6924464027420278 and parameters: {'abc_n_estimators': 100, 'abc_learning_rate': 0.8329551882181294}. Best is trial 7 with value: 0.860355.[0m
[32m[I 2022-10-19 16:03:23,287][0m Trial 27 finished with value: 0.5830927546766471 and parameters: {'abc_n_estimators': 100, 'abc_learning_rate': 1.0469202795564448e-06}. Best is trial 7 with value: 0.860355.[0m
[32m[I 2022-10-19 16:03:23,366][0m EarlyStopping exceeded for AdaBoostClassifier; no new best scores on iters 20.[0m
[32m[I 2022-10-19 16:03:23,366][0m Study finished.[0m
[32m[I 2022-10-19 16:03:23,381][0m --------------------------------------------------------------------------------[0m
[32m[I 2022-10-19 16:03:23,381][0m --------------------           AdaGradClassifier            --------------------[0m
[32m[I 2022-10-19 16:03:23,397][0m --------------------------------------------------------------------------------[0m
[32m[I 2022-10-19 16:03:23,428][0m A new study created in RDB with name: AdaGradClassifier_b9881135[0m
[32m[I 2022-10-19 16:03:23,428][0m Study started.[0m
[32m[I 2022-10-19 16:04:59,823][0m Trial 5 finished with value: 0.2835156863258348 and parameters: {'agc_alpha': 636.7390158271743, 'agc_l1_ratio': 0.9, 'agc_loss': 'modified_huber'}. Best is trial 5 with value: 0.554608.[0m
[32m[I 2022-10-19 16:04:59,916][0m Trial 0 finished with value: 0.5546077863894672 and parameters: {'agc_alpha': 6.6880916328810684, 'agc_l1_ratio': 0.4, 'agc_loss': 'squared_hinge'}. Best is trial 0 with value: 0.951137.[0m
[32m[I 2022-10-19 16:04:59,995][0m Trial 3 finished with value: 0.9016629121294706 and parameters: {'agc_alpha': 0.014498567506949923, 'agc_l1_ratio': 0.0, 'agc_loss': 'squared'}. Best is trial 3 with value: 0.951137.[0m
[32m[I 2022-10-19 16:05:00,089][0m Trial 1 finished with value: 0.8034854307032205 and parameters: {'agc_alpha': 0.11090007039700078, 'agc_l1_ratio': 0.5, 'agc_loss': 'log'}. Best is trial 6 with value: 0.951137.[0m
[32m[I 2022-10-19 16:05:00,089][0m Trial 7 finished with value: 0.3754584207916021 and parameters: {'agc_alpha': 55.61411105616509, 'agc_l1_ratio': 0.6000000000000001, 'agc_loss': 'squared_hinge'}. Best is trial 6 with value: 0.951137.[0m
[32m[I 2022-10-19 16:05:00,231][0m Trial 6 finished with value: 0.9511367564986805 and parameters: {'agc_alpha': 0.0013997498805891904, 'agc_l1_ratio': 0.6000000000000001, 'agc_loss': 'squared_hinge'}. Best is trial 6 with value: 0.951137.[0m
[32m[I 2022-10-19 16:05:00,231][0m Trial 2 finished with value: 0.5346514090670763 and parameters: {'agc_alpha': 220.41876193151396, 'agc_l1_ratio': 0.0, 'agc_loss': 'modified_huber'}. Best is trial 6 with value: 0.951137.[0m
[32m[I 2022-10-19 16:05:00,293][0m Trial 4 finished with value: 0.5945802638149031 and parameters: {'agc_alpha': 0.304753596899137, 'agc_l1_ratio': 0.30000000000000004, 'agc_loss': 'log'}. Best is trial 6 with value: 0.951137.[0m
[32m[I 2022-10-19 16:06:29,771][0m Trial 8 finished with value: 0.5868032238191262 and parameters: {'agc_alpha': 0.14861080490292441, 'agc_l1_ratio': 0.0, 'agc_loss': 'perceptron'}. Best is trial 6 with value: 0.951137.[0m
[32m[I 2022-10-19 16:06:29,849][0m Trial 13 finished with value: 0.2701244525469239 and parameters: {'agc_alpha': 179.7896888064483, 'agc_l1_ratio': 1.0, 'agc_loss': 'smooth_hinge'}. Best is trial 6 with value: 0.951137.[0m
[32m[I 2022-10-19 16:06:29,849][0m Trial 11 finished with value: 0.8791269331949427 and parameters: {'agc_alpha': 0.3985629114671849, 'agc_l1_ratio': 0.6000000000000001, 'agc_loss': 'squared_hinge'}. Best is trial 6 with value: 0.951137.[0m
[32m[I 2022-10-19 16:06:29,912][0m Trial 10 finished with value: 0.5200298147194614 and parameters: {'agc_alpha': 49.87108311900294, 'agc_l1_ratio': 0.0, 'agc_loss': 'hinge'}. Best is trial 6 with value: 0.951137.[0m
[32m[I 2022-10-19 16:06:29,975][0m Trial 9 finished with value: 0.48828575369610866 and parameters: {'agc_alpha': 3.11808746102415, 'agc_l1_ratio': 1.0, 'agc_loss': 'smooth_hinge'}. Best is trial 6 with value: 0.951137.[0m
[32m[I 2022-10-19 16:06:30,178][0m Trial 12 finished with value: 0.2652733149602904 and parameters: {'agc_alpha': 279.95700207641045, 'agc_l1_ratio': 1.0, 'agc_loss': 'smooth_hinge'}. Best is trial 6 with value: 0.951137.[0m
[32m[I 2022-10-19 16:06:30,288][0m Trial 14 finished with value: 0.8171079639636595 and parameters: {'agc_alpha': 0.03446155605920006, 'agc_l1_ratio': 1.0, 'agc_loss': 'hinge'}. Best is trial 6 with value: 0.951137.[0m
[32m[I 2022-10-19 16:06:30,397][0m Trial 15 finished with value: 0.805067766406663 and parameters: {'agc_alpha': 0.00585469012570261, 'agc_l1_ratio': 0.1, 'agc_loss': 'perceptron'}. Best is trial 6 with value: 0.951137.[0m
[32m[I 2022-10-19 16:07:35,963][0m Trial 18 finished with value: 0.9035269557717045 and parameters: {'agc_alpha': 0.0016794881718147773, 'agc_l1_ratio': 0.8, 'agc_loss': 'squared'}. Best is trial 6 with value: 0.951137.[0m
[32m[I 2022-10-19 16:07:36,057][0m Trial 20 finished with value: 0.9035196738358637 and parameters: {'agc_alpha': 0.0015969339786833497, 'agc_l1_ratio': 0.8, 'agc_loss': 'squared'}. Best is trial 6 with value: 0.951137.[0m
[32m[I 2022-10-19 16:07:36,072][0m Trial 16 finished with value: 0.9038200893797782 and parameters: {'agc_alpha': 0.0010969963084920672, 'agc_l1_ratio': 0.8, 'agc_loss': 'squared'}. Best is trial 6 with value: 0.951137.[0m
[32m[I 2022-10-19 16:07:36,198][0m Trial 17 finished with value: 0.9038200893797782 and parameters: {'agc_alpha': 0.0011429519893425683, 'agc_l1_ratio': 0.8, 'agc_loss': 'squared'}. Best is trial 6 with value: 0.951137.[0m
[32m[I 2022-10-19 16:07:36,198][0m Trial 19 finished with value: 0.902155220573159 and parameters: {'agc_alpha': 0.004520233725404268, 'agc_l1_ratio': 0.8, 'agc_loss': 'squared'}. Best is trial 6 with value: 0.951137.[0m
[32m[I 2022-10-19 16:07:36,323][0m EarlyStopping exceeded for AdaGradClassifier; no new best scores on iters 20.[0m
[32m[I 2022-10-19 16:07:36,323][0m Study finished.[0m
[32m[I 2022-10-19 16:07:36,354][0m --------------------------------------------------------------------------------[0m
[32m[I 2022-10-19 16:07:36,354][0m --------------------       BalancedBaggingClassifier        --------------------[0m
[32m[I 2022-10-19 16:07:36,354][0m --------------------------------------------------------------------------------[0m
[32m[I 2022-10-19 16:07:36,385][0m A new study created in RDB with name: BalancedBaggingClassifier_b9881135[0m
[32m[I 2022-10-19 16:07:36,401][0m Study started.[0m
[32m[I 2022-10-19 16:07:40,964][0m Trial 7 finished with value: 0.9894384381267398 and parameters: {'bbc_n_estimators': 6, 'bbc_max_features': 15, 'bbc_bootstrap': False, 'bbc_sampling_strategy': 'all'}. Best is trial 7 with value: 0.989438.[0m
[32m[I 2022-10-19 16:07:47,520][0m Trial 6 finished with value: 0.8333634993625513 and parameters: {'bbc_n_estimators': 15, 'bbc_max_features': 7, 'bbc_bootstrap': False, 'bbc_sampling_strategy': 'majority'}. Best is trial 7 with value: 0.989438.[0m
[32m[I 2022-10-19 16:07:48,271][0m Trial 8 finished with value: 0.9242251177655928 and parameters: {'bbc_n_estimators': 15, 'bbc_max_features': 3, 'bbc_bootstrap': False, 'bbc_sampling_strategy': 'all'}. Best is trial 7 with value: 0.989438.[0m
[32m[I 2022-10-19 16:07:48,554][0m Trial 4 finished with value: 0.9915451119124477 and parameters: {'bbc_n_estimators': 6, 'bbc_max_features': 24, 'bbc_bootstrap': True, 'bbc_sampling_strategy': 'not majority'}. Best is trial 4 with value: 0.991545.[0m
[32m[I 2022-10-19 16:07:51,058][0m Trial 5 finished with value: 0.9915672674982827 and parameters: {'bbc_n_estimators': 18, 'bbc_max_features': 27, 'bbc_bootstrap': False, 'bbc_sampling_strategy': 'not minority'}. Best is trial 5 with value: 0.991567.[0m
[32m[I 2022-10-19 16:07:55,568][0m Trial 1 finished with value: 0.9750290321647854 and parameters: {'bbc_n_estimators': 19, 'bbc_max_features': 5, 'bbc_bootstrap': True, 'bbc_sampling_strategy': 'not minority'}. Best is trial 5 with value: 0.991567.[0m
[32m[I 2022-10-19 16:07:55,631][0m Trial 2 finished with value: 0.9915648948130809 and parameters: {'bbc_n_estimators': 10, 'bbc_max_features': 23, 'bbc_bootstrap': True, 'bbc_sampling_strategy': 'majority'}. Best is trial 5 with value: 0.991567.[0m
[32m[I 2022-10-19 16:08:01,697][0m Trial 9 finished with value: 0.9916336716405518 and parameters: {'bbc_n_estimators': 11, 'bbc_max_features': 20, 'bbc_bootstrap': True, 'bbc_sampling_strategy': 'all'}. Best is trial 9 with value: 0.991634.[0m
[32m[I 2022-10-19 16:08:02,702][0m Trial 13 finished with value: 0.9916024210942388 and parameters: {'bbc_n_estimators': 7, 'bbc_max_features': 35, 'bbc_bootstrap': False, 'bbc_sampling_strategy': 'not minority'}. Best is trial 9 with value: 0.991634.[0m
[32m[I 2022-10-19 16:08:03,584][0m Trial 12 finished with value: 0.9917430150798189 and parameters: {'bbc_n_estimators': 15, 'bbc_max_features': 29, 'bbc_bootstrap': False, 'bbc_sampling_strategy': 'not minority'}. Best is trial 12 with value: 0.991743.[0m
[32m[I 2022-10-19 16:08:09,485][0m Trial 15 finished with value: 0.2844441188051378 and parameters: {'bbc_n_estimators': 15, 'bbc_max_features': 3, 'bbc_bootstrap': False, 'bbc_sampling_strategy': 'not majority'}. Best is trial 12 with value: 0.991743.[0m
[32m[I 2022-10-19 16:08:10,886][0m Trial 11 finished with value: 0.9917432761219641 and parameters: {'bbc_n_estimators': 15, 'bbc_max_features': 28, 'bbc_bootstrap': False, 'bbc_sampling_strategy': 'not majority'}. Best is trial 11 with value: 0.991743.[0m
[32m[I 2022-10-19 16:08:11,838][0m Trial 16 finished with value: 0.9916569701813943 and parameters: {'bbc_n_estimators': 7, 'bbc_max_features': 19, 'bbc_bootstrap': False, 'bbc_sampling_strategy': 'not majority'}. Best is trial 11 with value: 0.991743.[0m
[32m[I 2022-10-19 16:08:17,829][0m Trial 10 finished with value: 0.992101447520568 and parameters: {'bbc_n_estimators': 15, 'bbc_max_features': 28, 'bbc_bootstrap': False, 'bbc_sampling_strategy': 'majority'}. Best is trial 10 with value: 0.992101.[0m
[32m[I 2022-10-19 16:08:18,158][0m Trial 0 finished with value: 0.9917946969686297 and parameters: {'bbc_n_estimators': 20, 'bbc_max_features': 40, 'bbc_bootstrap': False, 'bbc_sampling_strategy': 'majority'}. Best is trial 10 with value: 0.992101.[0m
[32m[I 2022-10-19 16:08:19,482][0m Trial 3 finished with value: 0.9917330195031814 and parameters: {'bbc_n_estimators': 16, 'bbc_max_features': 44, 'bbc_bootstrap': True, 'bbc_sampling_strategy': 'majority'}. Best is trial 10 with value: 0.992101.[0m
[32m[I 2022-10-19 16:08:24,931][0m Trial 20 finished with value: 0.9914959602761558 and parameters: {'bbc_n_estimators': 13, 'bbc_max_features': 44, 'bbc_bootstrap': False, 'bbc_sampling_strategy': 'not minority'}. Best is trial 10 with value: 0.992101.[0m
[32m[I 2022-10-19 16:08:26,167][0m Trial 18 finished with value: 0.9917992922423968 and parameters: {'bbc_n_estimators': 11, 'bbc_max_features': 42, 'bbc_bootstrap': True, 'bbc_sampling_strategy': 'all'}. Best is trial 10 with value: 0.992101.[0m
[32m[I 2022-10-19 16:08:31,674][0m Trial 17 finished with value: 0.9915442962945554 and parameters: {'bbc_n_estimators': 14, 'bbc_max_features': 48, 'bbc_bootstrap': False, 'bbc_sampling_strategy': 'not majority'}. Best is trial 10 with value: 0.992101.[0m
[32m[I 2022-10-19 16:08:31,971][0m Trial 14 finished with value: 0.9915283083557532 and parameters: {'bbc_n_estimators': 16, 'bbc_max_features': 24, 'bbc_bootstrap': True, 'bbc_sampling_strategy': 'majority'}. Best is trial 10 with value: 0.992101.[0m
[32m[I 2022-10-19 16:08:33,102][0m Trial 19 finished with value: 0.9915040157163025 and parameters: {'bbc_n_estimators': 13, 'bbc_max_features': 44, 'bbc_bootstrap': False, 'bbc_sampling_strategy': 'not majority'}. Best is trial 10 with value: 0.992101.[0m
[32m[I 2022-10-19 16:08:37,494][0m Trial 21 finished with value: 0.9917946969686297 and parameters: {'bbc_n_estimators': 13, 'bbc_max_features': 48, 'bbc_bootstrap': False, 'bbc_sampling_strategy': 'majority'}. Best is trial 10 with value: 0.992101.[0m
[32m[I 2022-10-19 16:08:41,719][0m Trial 22 finished with value: 0.9918099116414846 and parameters: {'bbc_n_estimators': 18, 'bbc_max_features': 48, 'bbc_bootstrap': False, 'bbc_sampling_strategy': 'majority'}. Best is trial 10 with value: 0.992101.[0m
[32m[I 2022-10-19 16:08:41,782][0m EarlyStopping exceeded for BalancedBaggingClassifier; no new best scores on iters 20.[0m
[32m[I 2022-10-19 16:08:41,782][0m Study finished.[0m
[32m[I 2022-10-19 16:08:41,813][0m --------------------------------------------------------------------------------[0m
[32m[I 2022-10-19 16:08:41,813][0m --------------------     BalancedRandomForestClassifier     --------------------[0m
[32m[I 2022-10-19 16:08:41,813][0m --------------------------------------------------------------------------------[0m
[32m[I 2022-10-19 16:08:41,844][0m A new study created in RDB with name: BalancedRandomForestClassifier_b9881135[0m
[32m[I 2022-10-19 16:08:41,844][0m Study started.[0m
[32m[I 2022-10-19 16:09:15,069][0m sklearn.ensemble.RandomForestClassifier.predict: fallback to original Scikit-learn[0m
[32m[I 2022-10-19 16:09:15,084][0m sklearn.ensemble.RandomForestClassifier.predict_proba: fallback to original Scikit-learn[0m
[32m[I 2022-10-19 16:09:19,621][0m Trial 4 finished with value: 0.9914448229787679 and parameters: {'brf_n_estimators': 80, 'brf_criterion': 'gini', 'brf_min_samples_split': 9, 'brf_min_samples_leaf': 47, 'brf_max_features': 25, 'brf_bootstrap': True}. Best is trial 4 with value: 0.991445.[0m
[32m[I 2022-10-19 16:09:23,207][0m sklearn.ensemble.RandomForestClassifier.predict: fallback to original Scikit-learn[0m
[32m[I 2022-10-19 16:09:23,207][0m sklearn.ensemble.RandomForestClassifier.predict_proba: fallback to original Scikit-learn[0m
[32m[I 2022-10-19 16:09:24,287][0m sklearn.ensemble.RandomForestClassifier.predict: fallback to original Scikit-learn[0m
[32m[I 2022-10-19 16:09:24,287][0m sklearn.ensemble.RandomForestClassifier.predict_proba: fallback to original Scikit-learn[0m
[32m[I 2022-10-19 16:09:28,262][0m Trial 5 finished with value: 0.9913492637777999 and parameters: {'brf_n_estimators': 110, 'brf_criterion': 'entropy', 'brf_min_samples_split': 15, 'brf_min_samples_leaf': 36, 'brf_max_features': 8, 'brf_bootstrap': True}. Best is trial 4 with value: 0.991445.[0m
[32m[I 2022-10-19 16:09:29,344][0m Trial 7 finished with value: 0.9910724466246316 and parameters: {'brf_n_estimators': 100, 'brf_criterion': 'gini', 'brf_min_samples_split': 24, 'brf_min_samples_leaf': 21, 'brf_max_features': 41, 'brf_bootstrap': True}. Best is trial 4 with value: 0.991445.[0m
[32m[I 2022-10-19 16:09:32,776][0m sklearn.ensemble.RandomForestClassifier.predict: fallback to original Scikit-learn[0m
[32m[I 2022-10-19 16:09:32,791][0m sklearn.ensemble.RandomForestClassifier.predict_proba: fallback to original Scikit-learn[0m
