[32m[I 2022-10-19 16:09:38,641][0m Trial 1 finished with value: 0.9911178509672314 and parameters: {'brf_n_estimators': 130, 'brf_criterion': 'entropy', 'brf_min_samples_split': 11, 'brf_min_samples_leaf': 38, 'brf_max_features': 27, 'brf_bootstrap': True}. Best is trial 4 with value: 0.991445.[0m
[32m[I 2022-10-19 16:09:39,033][0m sklearn.ensemble.RandomForestClassifier.predict: fallback to original Scikit-learn[0m
[32m[I 2022-10-19 16:09:39,033][0m sklearn.ensemble.RandomForestClassifier.predict_proba: fallback to original Scikit-learn[0m
[32m[I 2022-10-19 16:09:40,504][0m sklearn.ensemble.RandomForestClassifier.predict: fallback to original Scikit-learn[0m
[32m[I 2022-10-19 16:09:40,520][0m sklearn.ensemble.RandomForestClassifier.predict_proba: fallback to original Scikit-learn[0m
[32m[I 2022-10-19 16:09:42,729][0m sklearn.ensemble.RandomForestClassifier.predict: fallback to original Scikit-learn[0m
[32m[I 2022-10-19 16:09:42,729][0m sklearn.ensemble.RandomForestClassifier.predict_proba: fallback to original Scikit-learn[0m
[32m[I 2022-10-19 16:09:43,229][0m sklearn.ensemble.RandomForestClassifier.predict: fallback to original Scikit-learn[0m
[32m[I 2022-10-19 16:09:43,245][0m sklearn.ensemble.RandomForestClassifier.predict_proba: fallback to original Scikit-learn[0m
[32m[I 2022-10-19 16:09:44,295][0m Trial 0 finished with value: 0.9911730085650617 and parameters: {'brf_n_estimators': 140, 'brf_criterion': 'gini', 'brf_min_samples_split': 45, 'brf_min_samples_leaf': 28, 'brf_max_features': 35, 'brf_bootstrap': True}. Best is trial 4 with value: 0.991445.[0m
[32m[I 2022-10-19 16:09:45,788][0m Trial 3 finished with value: 0.9910811313579103 and parameters: {'brf_n_estimators': 140, 'brf_criterion': 'entropy', 'brf_min_samples_split': 47, 'brf_min_samples_leaf': 29, 'brf_max_features': 49, 'brf_bootstrap': True}. Best is trial 4 with value: 0.991445.[0m
[32m[I 2022-10-19 16:09:46,462][0m Trial 8 finished with value: 0.9915413611572704 and parameters: {'brf_n_estimators': 60, 'brf_criterion': 'entropy', 'brf_min_samples_split': 30, 'brf_min_samples_leaf': 3, 'brf_max_features': 21, 'brf_bootstrap': False}. Best is trial 8 with value: 0.991541.[0m
[32m[I 2022-10-19 16:09:49,191][0m Trial 6 finished with value: 0.991520486441835 and parameters: {'brf_n_estimators': 160, 'brf_criterion': 'entropy', 'brf_min_samples_split': 48, 'brf_min_samples_leaf': 10, 'brf_max_features': 14, 'brf_bootstrap': True}. Best is trial 8 with value: 0.991541.[0m
[32m[I 2022-10-19 16:09:50,507][0m sklearn.ensemble.RandomForestClassifier.predict: fallback to original Scikit-learn[0m
[32m[I 2022-10-19 16:09:50,507][0m sklearn.ensemble.RandomForestClassifier.predict_proba: fallback to original Scikit-learn[0m
[32m[I 2022-10-19 16:09:57,776][0m Trial 2 finished with value: 0.991536313911827 and parameters: {'brf_n_estimators': 180, 'brf_criterion': 'entropy', 'brf_min_samples_split': 46, 'brf_min_samples_leaf': 4, 'brf_max_features': 20, 'brf_bootstrap': True}. Best is trial 8 with value: 0.991541.[0m
[32m[I 2022-10-19 16:10:09,365][0m sklearn.ensemble.RandomForestClassifier.predict: fallback to original Scikit-learn[0m
[32m[I 2022-10-19 16:10:09,380][0m sklearn.ensemble.RandomForestClassifier.predict_proba: fallback to original Scikit-learn[0m
[32m[I 2022-10-19 16:10:14,475][0m Trial 9 finished with value: 0.991157817555184 and parameters: {'brf_n_estimators': 100, 'brf_criterion': 'entropy', 'brf_min_samples_split': 48, 'brf_min_samples_leaf': 48, 'brf_max_features': 39, 'brf_bootstrap': False}. Best is trial 8 with value: 0.991541.[0m
[32m[I 2022-10-19 16:10:15,070][0m sklearn.ensemble.RandomForestClassifier.predict: fallback to original Scikit-learn[0m
[32m[I 2022-10-19 16:10:15,070][0m sklearn.ensemble.RandomForestClassifier.predict_proba: fallback to original Scikit-learn[0m
[32m[I 2022-10-19 16:10:19,218][0m Trial 13 finished with value: 0.9910875219429294 and parameters: {'brf_n_estimators': 70, 'brf_criterion': 'gini', 'brf_min_samples_split': 37, 'brf_min_samples_leaf': 20, 'brf_max_features': 44, 'brf_bootstrap': True}. Best is trial 8 with value: 0.991541.[0m
[32m[I 2022-10-19 16:10:23,361][0m sklearn.ensemble.RandomForestClassifier.predict: fallback to original Scikit-learn[0m
[32m[I 2022-10-19 16:10:23,376][0m sklearn.ensemble.RandomForestClassifier.predict_proba: fallback to original Scikit-learn[0m
[32m[I 2022-10-19 16:10:29,057][0m Trial 11 finished with value: 0.9913644282067343 and parameters: {'brf_n_estimators': 130, 'brf_criterion': 'gini', 'brf_min_samples_split': 37, 'brf_min_samples_leaf': 47, 'brf_max_features': 5, 'brf_bootstrap': False}. Best is trial 8 with value: 0.991541.[0m
[32m[I 2022-10-19 16:10:31,731][0m sklearn.ensemble.RandomForestClassifier.predict: fallback to original Scikit-learn[0m
[32m[I 2022-10-19 16:10:31,731][0m sklearn.ensemble.RandomForestClassifier.predict_proba: fallback to original Scikit-learn[0m
[32m[I 2022-10-19 16:10:33,121][0m sklearn.ensemble.RandomForestClassifier.predict: fallback to original Scikit-learn[0m
[32m[I 2022-10-19 16:10:33,121][0m sklearn.ensemble.RandomForestClassifier.predict_proba: fallback to original Scikit-learn[0m
[32m[I 2022-10-19 16:10:35,557][0m sklearn.ensemble.RandomForestClassifier.predict: fallback to original Scikit-learn[0m
[32m[I 2022-10-19 16:10:35,573][0m sklearn.ensemble.RandomForestClassifier.predict_proba: fallback to original Scikit-learn[0m
[32m[I 2022-10-19 16:10:37,064][0m Trial 10 finished with value: 0.9911028623300181 and parameters: {'brf_n_estimators': 140, 'brf_criterion': 'gini', 'brf_min_samples_split': 39, 'brf_min_samples_leaf': 33, 'brf_max_features': 45, 'brf_bootstrap': False}. Best is trial 8 with value: 0.991541.[0m
[32m[I 2022-10-19 16:10:38,271][0m Trial 12 finished with value: 0.991326523006325 and parameters: {'brf_n_estimators': 130, 'brf_criterion': 'gini', 'brf_min_samples_split': 44, 'brf_min_samples_leaf': 48, 'brf_max_features': 10, 'brf_bootstrap': False}. Best is trial 8 with value: 0.991541.[0m
[32m[I 2022-10-19 16:10:39,023][0m Trial 17 finished with value: 0.9913864434928352 and parameters: {'brf_n_estimators': 60, 'brf_criterion': 'gini', 'brf_min_samples_split': 30, 'brf_min_samples_leaf': 15, 'brf_max_features': 3, 'brf_bootstrap': False}. Best is trial 8 with value: 0.991541.[0m
[32m[I 2022-10-19 16:10:39,400][0m sklearn.ensemble.RandomForestClassifier.predict: fallback to original Scikit-learn[0m
[32m[I 2022-10-19 16:10:39,415][0m sklearn.ensemble.RandomForestClassifier.predict_proba: fallback to original Scikit-learn[0m
[32m[I 2022-10-19 16:10:42,921][0m Trial 18 finished with value: 0.9915567760659011 and parameters: {'brf_n_estimators': 50, 'brf_criterion': 'entropy', 'brf_min_samples_split': 32, 'brf_min_samples_leaf': 3, 'brf_max_features': 18, 'brf_bootstrap': False}. Best is trial 18 with value: 0.991557.[0m
[32m[I 2022-10-19 16:10:50,320][0m sklearn.ensemble.RandomForestClassifier.predict: fallback to original Scikit-learn[0m
[32m[I 2022-10-19 16:10:50,320][0m sklearn.ensemble.RandomForestClassifier.predict_proba: fallback to original Scikit-learn[0m
[32m[I 2022-10-19 16:10:52,066][0m sklearn.ensemble.RandomForestClassifier.predict: fallback to original Scikit-learn[0m
[32m[I 2022-10-19 16:10:52,082][0m sklearn.ensemble.RandomForestClassifier.predict_proba: fallback to original Scikit-learn[0m
[32m[I 2022-10-19 16:10:56,846][0m Trial 14 finished with value: 0.9914898543265719 and parameters: {'brf_n_estimators': 160, 'brf_criterion': 'gini', 'brf_min_samples_split': 13, 'brf_min_samples_leaf': 24, 'brf_max_features': 28, 'brf_bootstrap': True}. Best is trial 18 with value: 0.991557.[0m
[32m[I 2022-10-19 16:10:57,740][0m sklearn.ensemble.RandomForestClassifier.predict: fallback to original Scikit-learn[0m
[32m[I 2022-10-19 16:10:57,740][0m sklearn.ensemble.RandomForestClassifier.predict_proba: fallback to original Scikit-learn[0m
[32m[I 2022-10-19 16:10:58,148][0m Trial 15 finished with value: 0.9910877387525467 and parameters: {'brf_n_estimators': 140, 'brf_criterion': 'gini', 'brf_min_samples_split': 2, 'brf_min_samples_leaf': 19, 'brf_max_features': 42, 'brf_bootstrap': False}. Best is trial 18 with value: 0.991557.[0m
[32m[I 2022-10-19 16:11:03,469][0m sklearn.ensemble.RandomForestClassifier.predict: fallback to original Scikit-learn[0m
[32m[I 2022-10-19 16:11:03,469][0m sklearn.ensemble.RandomForestClassifier.predict_proba: fallback to original Scikit-learn[0m
[32m[I 2022-10-19 16:11:04,346][0m Trial 16 finished with value: 0.9910814144309568 and parameters: {'brf_n_estimators': 150, 'brf_criterion': 'entropy', 'brf_min_samples_split': 18, 'brf_min_samples_leaf': 40, 'brf_max_features': 46, 'brf_bootstrap': True}. Best is trial 18 with value: 0.991557.[0m
[32m[I 2022-10-19 16:11:07,009][0m Trial 23 finished with value: 0.9917146444373802 and parameters: {'brf_n_estimators': 50, 'brf_criterion': 'entropy', 'brf_min_samples_split': 24, 'brf_min_samples_leaf': 1, 'brf_max_features': 31, 'brf_bootstrap': False}. Best is trial 23 with value: 0.991715.[0m
[32m[I 2022-10-19 16:11:18,235][0m sklearn.ensemble.RandomForestClassifier.predict: fallback to original Scikit-learn[0m
[32m[I 2022-10-19 16:11:18,235][0m sklearn.ensemble.RandomForestClassifier.predict_proba: fallback to original Scikit-learn[0m
[32m[I 2022-10-19 16:11:20,247][0m sklearn.ensemble.RandomForestClassifier.predict: fallback to original Scikit-learn[0m
[32m[I 2022-10-19 16:11:20,247][0m sklearn.ensemble.RandomForestClassifier.predict_proba: fallback to original Scikit-learn[0m
[32m[I 2022-10-19 16:11:21,420][0m Trial 25 finished with value: 0.9916459633303275 and parameters: {'brf_n_estimators': 50, 'brf_criterion': 'entropy', 'brf_min_samples_split': 26, 'brf_min_samples_leaf': 1, 'brf_max_features': 17, 'brf_bootstrap': False}. Best is trial 23 with value: 0.991715.[0m
[32m[I 2022-10-19 16:11:24,114][0m Trial 24 finished with value: 0.9915547410623049 and parameters: {'brf_n_estimators': 60, 'brf_criterion': 'entropy', 'brf_min_samples_split': 24, 'brf_min_samples_leaf': 1, 'brf_max_features': 16, 'brf_bootstrap': False}. Best is trial 23 with value: 0.991715.[0m
[32m[I 2022-10-19 16:11:24,396][0m sklearn.ensemble.RandomForestClassifier.predict: fallback to original Scikit-learn[0m
[32m[I 2022-10-19 16:11:24,412][0m sklearn.ensemble.RandomForestClassifier.predict_proba: fallback to original Scikit-learn[0m
[32m[I 2022-10-19 16:11:27,526][0m Trial 26 finished with value: 0.9916238048545792 and parameters: {'brf_n_estimators': 50, 'brf_criterion': 'entropy', 'brf_min_samples_split': 29, 'brf_min_samples_leaf': 1, 'brf_max_features': 17, 'brf_bootstrap': False}. Best is trial 23 with value: 0.991715.[0m
[32m[I 2022-10-19 16:11:28,026][0m sklearn.ensemble.RandomForestClassifier.predict: fallback to original Scikit-learn[0m
[32m[I 2022-10-19 16:11:28,026][0m sklearn.ensemble.RandomForestClassifier.predict_proba: fallback to original Scikit-learn[0m
[32m[I 2022-10-19 16:11:31,077][0m Trial 27 finished with value: 0.9915801899386777 and parameters: {'brf_n_estimators': 50, 'brf_criterion': 'entropy', 'brf_min_samples_split': 23, 'brf_min_samples_leaf': 9, 'brf_max_features': 32, 'brf_bootstrap': False}. Best is trial 23 with value: 0.991715.[0m
[32m[I 2022-10-19 16:11:39,178][0m sklearn.ensemble.RandomForestClassifier.predict: fallback to original Scikit-learn[0m
[32m[I 2022-10-19 16:11:39,178][0m sklearn.ensemble.RandomForestClassifier.predict_proba: fallback to original Scikit-learn[0m
[32m[I 2022-10-19 16:11:41,445][0m sklearn.ensemble.RandomForestClassifier.predict: fallback to original Scikit-learn[0m
[32m[I 2022-10-19 16:11:41,445][0m sklearn.ensemble.RandomForestClassifier.predict_proba: fallback to original Scikit-learn[0m
[32m[I 2022-10-19 16:11:41,555][0m Trial 28 finished with value: 0.9916073201752493 and parameters: {'brf_n_estimators': 50, 'brf_criterion': 'entropy', 'brf_min_samples_split': 22, 'brf_min_samples_leaf': 1, 'brf_max_features': 16, 'brf_bootstrap': False}. Best is trial 23 with value: 0.991715.[0m
[32m[I 2022-10-19 16:11:42,758][0m sklearn.ensemble.RandomForestClassifier.predict: fallback to original Scikit-learn[0m
[32m[I 2022-10-19 16:11:42,758][0m sklearn.ensemble.RandomForestClassifier.predict_proba: fallback to original Scikit-learn[0m
[32m[I 2022-10-19 16:11:43,369][0m Trial 29 finished with value: 0.9915126152534368 and parameters: {'brf_n_estimators': 50, 'brf_criterion': 'entropy', 'brf_min_samples_split': 30, 'brf_min_samples_leaf': 9, 'brf_max_features': 34, 'brf_bootstrap': False}. Best is trial 23 with value: 0.991715.[0m
[32m[I 2022-10-19 16:11:46,653][0m Trial 19 finished with value: 0.9916870130252143 and parameters: {'brf_n_estimators': 200, 'brf_criterion': 'entropy', 'brf_min_samples_split': 29, 'brf_min_samples_leaf': 2, 'brf_max_features': 20, 'brf_bootstrap': False}. Best is trial 23 with value: 0.991715.[0m
[32m[I 2022-10-19 16:11:47,529][0m sklearn.ensemble.RandomForestClassifier.predict: fallback to original Scikit-learn[0m
[32m[I 2022-10-19 16:11:47,529][0m sklearn.ensemble.RandomForestClassifier.predict_proba: fallback to original Scikit-learn[0m
[32m[I 2022-10-19 16:11:47,998][0m sklearn.ensemble.RandomForestClassifier.predict: fallback to original Scikit-learn[0m
[32m[I 2022-10-19 16:11:47,998][0m sklearn.ensemble.RandomForestClassifier.predict_proba: fallback to original Scikit-learn[0m
[32m[I 2022-10-19 16:11:48,264][0m sklearn.ensemble.RandomForestClassifier.predict: fallback to original Scikit-learn[0m
[32m[I 2022-10-19 16:11:48,264][0m sklearn.ensemble.RandomForestClassifier.predict_proba: fallback to original Scikit-learn[0m
[32m[I 2022-10-19 16:11:49,800][0m Trial 20 finished with value: 0.9917452947149163 and parameters: {'brf_n_estimators': 200, 'brf_criterion': 'entropy', 'brf_min_samples_split': 23, 'brf_min_samples_leaf': 1, 'brf_max_features': 18, 'brf_bootstrap': False}. Best is trial 20 with value: 0.991745.[0m
[32m[I 2022-10-19 16:11:50,223][0m Trial 22 finished with value: 0.9917460775109227 and parameters: {'brf_n_estimators': 200, 'brf_criterion': 'entropy', 'brf_min_samples_split': 25, 'brf_min_samples_leaf': 1, 'brf_max_features': 19, 'brf_bootstrap': False}. Best is trial 22 with value: 0.991746.[0m
[32m[I 2022-10-19 16:11:50,520][0m Trial 21 finished with value: 0.9917997627637979 and parameters: {'brf_n_estimators': 200, 'brf_criterion': 'entropy', 'brf_min_samples_split': 27, 'brf_min_samples_leaf': 1, 'brf_max_features': 19, 'brf_bootstrap': False}. Best is trial 21 with value: 0.9918.[0m
[32m[I 2022-10-19 16:11:50,583][0m EarlyStopping exceeded for BalancedRandomForestClassifier; no new best scores on iters 20.[0m
[32m[I 2022-10-19 16:11:50,598][0m Study finished.[0m
[32m[I 2022-10-19 16:11:50,629][0m --------------------------------------------------------------------------------[0m
[32m[I 2022-10-19 16:11:50,629][0m --------------------              BernoulliNB               --------------------[0m
[32m[I 2022-10-19 16:11:50,629][0m --------------------------------------------------------------------------------[0m
[32m[I 2022-10-19 16:11:50,661][0m A new study created in RDB with name: BernoulliNB_b9881135[0m
[32m[I 2022-10-19 16:11:50,661][0m Study started.[0m
[32m[I 2022-10-19 16:11:53,596][0m Trial 6 finished with value: 0.8468527798566332 and parameters: {'bnb_alpha': 0.9500000000000001, 'bnb_binarize': 0.05, 'bnb_fit_prior': True}. Best is trial 6 with value: 0.846853.[0m
[32m[I 2022-10-19 16:11:53,675][0m Trial 0 finished with value: 0.820286900220342 and parameters: {'bnb_alpha': 0.75, 'bnb_binarize': 0.7000000000000001, 'bnb_fit_prior': False}. Best is trial 6 with value: 0.846853.[0m
[32m[I 2022-10-19 16:11:53,769][0m Trial 7 finished with value: 0.7941632140503269 and parameters: {'bnb_alpha': 0.9, 'bnb_binarize': 1.0, 'bnb_fit_prior': False}. Best is trial 5 with value: 0.846853.[0m
[32m[I 2022-10-19 16:11:53,769][0m Trial 5 finished with value: 0.8468527798566332 and parameters: {'bnb_alpha': 0.8, 'bnb_binarize': 0.65, 'bnb_fit_prior': True}. Best is trial 5 with value: 0.846853.[0m
[32m[I 2022-10-19 16:11:53,847][0m Trial 4 finished with value: 0.07399138544370873 and parameters: {'bnb_alpha': 0.0, 'bnb_binarize': 0.9500000000000001, 'bnb_fit_prior': False}. Best is trial 1 with value: 0.846853.[0m
[32m[I 2022-10-19 16:11:53,910][0m Trial 3 finished with value: 0.820286900220342 and parameters: {'bnb_alpha': 0.45, 'bnb_binarize': 0.5, 'bnb_fit_prior': False}. Best is trial 2 with value: 0.846853.[0m
[32m[I 2022-10-19 16:11:53,910][0m Trial 1 finished with value: 0.8468527798566332 and parameters: {'bnb_alpha': 0.15000000000000002, 'bnb_binarize': 0.75, 'bnb_fit_prior': True}. Best is trial 1 with value: 0.846853.[0m
[32m[I 2022-10-19 16:11:54,035][0m Trial 2 finished with value: 0.8468527798566332 and parameters: {'bnb_alpha': 0.25, 'bnb_binarize': 0.45, 'bnb_fit_prior': True}. Best is trial 1 with value: 0.846853.[0m
[32m[I 2022-10-19 16:11:57,032][0m Trial 13 finished with value: 0.8468527798566332 and parameters: {'bnb_alpha': 0.75, 'bnb_binarize': 0.4, 'bnb_fit_prior': True}. Best is trial 1 with value: 0.846853.[0m
[32m[I 2022-10-19 16:11:57,032][0m Trial 8 finished with value: 0.820286900220342 and parameters: {'bnb_alpha': 0.7000000000000001, 'bnb_binarize': 0.4, 'bnb_fit_prior': False}. Best is trial 1 with value: 0.846853.[0m
[32m[I 2022-10-19 16:11:57,032][0m Trial 14 finished with value: 0.07399138544370873 and parameters: {'bnb_alpha': 0.0, 'bnb_binarize': 0.7000000000000001, 'bnb_fit_prior': False}. Best is trial 1 with value: 0.846853.[0m
[32m[I 2022-10-19 16:11:57,282][0m Trial 11 finished with value: 0.8468527798566332 and parameters: {'bnb_alpha': 0.45, 'bnb_binarize': 0.4, 'bnb_fit_prior': True}. Best is trial 1 with value: 0.846853.[0m
[32m[I 2022-10-19 16:11:57,282][0m Trial 15 finished with value: 0.07399138544370873 and parameters: {'bnb_alpha': 0.0, 'bnb_binarize': 0.55, 'bnb_fit_prior': False}. Best is trial 1 with value: 0.846853.[0m
[32m[I 2022-10-19 16:11:57,282][0m Trial 12 finished with value: 0.8468527798566332 and parameters: {'bnb_alpha': 0.2, 'bnb_binarize': 0.55, 'bnb_fit_prior': True}. Best is trial 1 with value: 0.846853.[0m
[32m[I 2022-10-19 16:11:57,346][0m Trial 10 finished with value: 0.820286900220342 and parameters: {'bnb_alpha': 0.9500000000000001, 'bnb_binarize': 0.8500000000000001, 'bnb_fit_prior': False}. Best is trial 1 with value: 0.846853.[0m
[32m[I 2022-10-19 16:11:57,549][0m Trial 9 finished with value: 0.7941632140503269 and parameters: {'bnb_alpha': 0.8, 'bnb_binarize': 1.0, 'bnb_fit_prior': True}. Best is trial 1 with value: 0.846853.[0m
[32m[I 2022-10-19 16:12:00,480][0m Trial 17 finished with value: 0.8468527798566332 and parameters: {'bnb_alpha': 0.25, 'bnb_binarize': 0.2, 'bnb_fit_prior': True}. Best is trial 17 with value: 0.846853.[0m
[32m[I 2022-10-19 16:12:00,558][0m Trial 22 finished with value: 0.8468527798566332 and parameters: {'bnb_alpha': 0.2, 'bnb_binarize': 0.2, 'bnb_fit_prior': True}. Best is trial 22 with value: 0.846853.[0m
[32m[I 2022-10-19 16:12:00,636][0m Trial 20 finished with value: 0.8468527798566332 and parameters: {'bnb_alpha': 0.25, 'bnb_binarize': 0.2, 'bnb_fit_prior': True}. Best is trial 22 with value: 0.846853.[0m
[32m[I 2022-10-19 16:12:00,730][0m Trial 18 finished with value: 0.8468527798566332 and parameters: {'bnb_alpha': 0.25, 'bnb_binarize': 0.2, 'bnb_fit_prior': True}. Best is trial 22 with value: 0.846853.[0m
[32m[I 2022-10-19 16:12:00,808][0m Trial 21 finished with value: 0.8468527798566332 and parameters: {'bnb_alpha': 0.2, 'bnb_binarize': 0.2, 'bnb_fit_prior': True}. Best is trial 22 with value: 0.846853.[0m
[32m[I 2022-10-19 16:12:00,886][0m Trial 16 finished with value: 0.8468527798566332 and parameters: {'bnb_alpha': 0.25, 'bnb_binarize': 0.2, 'bnb_fit_prior': True}. Best is trial 23 with value: 0.846853.[0m
[32m[I 2022-10-19 16:12:00,886][0m Trial 19 finished with value: 0.8468527798566332 and parameters: {'bnb_alpha': 0.25, 'bnb_binarize': 0.1, 'bnb_fit_prior': True}. Best is trial 22 with value: 0.846853.[0m
[32m[I 2022-10-19 16:12:01,011][0m Trial 23 finished with value: 0.8468527798566332 and parameters: {'bnb_alpha': 0.25, 'bnb_binarize': 0.2, 'bnb_fit_prior': True}. Best is trial 23 with value: 0.846853.[0m
[32m[I 2022-10-19 16:12:03,802][0m Trial 24 finished with value: 0.8468527798566332 and parameters: {'bnb_alpha': 0.45, 'bnb_binarize': 0.30000000000000004, 'bnb_fit_prior': True}. Best is trial 24 with value: 0.846853.[0m
[32m[I 2022-10-19 16:12:04,037][0m Trial 28 finished with value: 0.8468527798566332 and parameters: {'bnb_alpha': 0.45, 'bnb_binarize': 0.35000000000000003, 'bnb_fit_prior': True}. Best is trial 28 with value: 0.846853.[0m
[32m[I 2022-10-19 16:12:04,131][0m Trial 30 finished with value: 0.8468527798566332 and parameters: {'bnb_alpha': 0.45, 'bnb_binarize': 0.35000000000000003, 'bnb_fit_prior': True}. Best is trial 30 with value: 0.846853.[0m
[32m[I 2022-10-19 16:12:04,209][0m Trial 27 finished with value: 0.8468527798566332 and parameters: {'bnb_alpha': 0.4, 'bnb_binarize': 0.30000000000000004, 'bnb_fit_prior': True}. Best is trial 30 with value: 0.846853.[0m
[32m[I 2022-10-19 16:12:04,287][0m Trial 25 finished with value: 0.8468527798566332 and parameters: {'bnb_alpha': 0.45, 'bnb_binarize': 0.30000000000000004, 'bnb_fit_prior': True}. Best is trial 30 with value: 0.846853.[0m
[32m[I 2022-10-19 16:12:04,365][0m Trial 31 finished with value: 0.8468527798566332 and parameters: {'bnb_alpha': 0.45, 'bnb_binarize': 0.35000000000000003, 'bnb_fit_prior': True}. Best is trial 31 with value: 0.846853.[0m
