[32m[I 2022-10-19 16:24:45,706][0m Trial 21 finished with value: 0.9914688631985918 and parameters: {'dtc_criterion': 'entropy', 'dtc_splitter': 'random', 'dtc_min_samples_split': 36, 'dtc_min_samples_leaf': 22, 'dtc_max_features': 48}. Best is trial 10 with value: 0.991759.[0m
[32m[I 2022-10-19 16:24:45,784][0m EarlyStopping exceeded for DecisionTreeClassifier; no new best scores on iters 20.[0m
[32m[I 2022-10-19 16:24:45,784][0m Study finished.[0m
[32m[I 2022-10-19 16:24:45,799][0m --------------------------------------------------------------------------------[0m
[32m[I 2022-10-19 16:24:45,799][0m --------------------          ExtraTreeClassifier           --------------------[0m
[32m[I 2022-10-19 16:24:45,799][0m --------------------------------------------------------------------------------[0m
[32m[I 2022-10-19 16:24:45,831][0m A new study created in RDB with name: ExtraTreeClassifier_b9881135[0m
[32m[I 2022-10-19 16:24:45,846][0m Study started.[0m
[32m[I 2022-10-19 16:24:47,088][0m Trial 5 finished with value: 0.9679792088000063 and parameters: {'etc_criterion': 'gini', 'etc_min_samples_split': 23, 'etc_min_samples_leaf': 14, 'etc_max_features': 11}. Best is trial 5 with value: 0.967979.[0m
[32m[I 2022-10-19 16:24:47,356][0m Trial 4 finished with value: 0.981580891562659 and parameters: {'etc_criterion': 'entropy', 'etc_min_samples_split': 24, 'etc_min_samples_leaf': 22, 'etc_max_features': 12}. Best is trial 3 with value: 0.991608.[0m
[32m[I 2022-10-19 16:24:47,466][0m Trial 3 finished with value: 0.9916083352666177 and parameters: {'etc_criterion': 'gini', 'etc_min_samples_split': 45, 'etc_min_samples_leaf': 25, 'etc_max_features': 23}. Best is trial 3 with value: 0.991608.[0m
[32m[I 2022-10-19 16:24:47,607][0m Trial 6 finished with value: 0.9805759502501615 and parameters: {'etc_criterion': 'gini', 'etc_min_samples_split': 4, 'etc_min_samples_leaf': 26, 'etc_max_features': 22}. Best is trial 0 with value: 0.991814.[0m
[32m[I 2022-10-19 16:24:47,607][0m Trial 0 finished with value: 0.9918138272696309 and parameters: {'etc_criterion': 'entropy', 'etc_min_samples_split': 24, 'etc_min_samples_leaf': 4, 'etc_max_features': 20}. Best is trial 0 with value: 0.991814.[0m
[32m[I 2022-10-19 16:24:47,763][0m Trial 2 finished with value: 0.9917183697134814 and parameters: {'etc_criterion': 'entropy', 'etc_min_samples_split': 36, 'etc_min_samples_leaf': 48, 'etc_max_features': 44}. Best is trial 0 with value: 0.991814.[0m
[32m[I 2022-10-19 16:24:47,842][0m Trial 1 finished with value: 0.9915354200779946 and parameters: {'etc_criterion': 'gini', 'etc_min_samples_split': 29, 'etc_min_samples_leaf': 18, 'etc_max_features': 30}. Best is trial 0 with value: 0.991814.[0m
[32m[I 2022-10-19 16:24:47,842][0m Trial 7 finished with value: 0.9915440238996894 and parameters: {'etc_criterion': 'entropy', 'etc_min_samples_split': 34, 'etc_min_samples_leaf': 48, 'etc_max_features': 35}. Best is trial 0 with value: 0.991814.[0m
[32m[I 2022-10-19 16:24:48,531][0m Trial 8 finished with value: 0.9912373310072182 and parameters: {'etc_criterion': 'entropy', 'etc_min_samples_split': 21, 'etc_min_samples_leaf': 33, 'etc_max_features': 12}. Best is trial 0 with value: 0.991814.[0m
[32m[I 2022-10-19 16:24:49,283][0m Trial 14 finished with value: 0.9898247586871483 and parameters: {'etc_criterion': 'gini', 'etc_min_samples_split': 46, 'etc_min_samples_leaf': 42, 'etc_max_features': 21}. Best is trial 0 with value: 0.991814.[0m
[32m[I 2022-10-19 16:24:49,376][0m Trial 13 finished with value: 0.9874092078850629 and parameters: {'etc_criterion': 'entropy', 'etc_min_samples_split': 21, 'etc_min_samples_leaf': 24, 'etc_max_features': 14}. Best is trial 0 with value: 0.991814.[0m
[32m[I 2022-10-19 16:24:49,455][0m Trial 9 finished with value: 0.9625097496855615 and parameters: {'etc_criterion': 'entropy', 'etc_min_samples_split': 34, 'etc_min_samples_leaf': 26, 'etc_max_features': 20}. Best is trial 0 with value: 0.991911.[0m
[32m[I 2022-10-19 16:24:49,455][0m Trial 12 finished with value: 0.9884752304966488 and parameters: {'etc_criterion': 'gini', 'etc_min_samples_split': 17, 'etc_min_samples_leaf': 50, 'etc_max_features': 8}. Best is trial 0 with value: 0.991911.[0m
[32m[I 2022-10-19 16:24:49,596][0m Trial 11 finished with value: 0.9914162122865652 and parameters: {'etc_criterion': 'gini', 'etc_min_samples_split': 48, 'etc_min_samples_leaf': 31, 'etc_max_features': 14}. Best is trial 15 with value: 0.991911.[0m
[32m[I 2022-10-19 16:24:49,596][0m Trial 15 finished with value: 0.991911378933877 and parameters: {'etc_criterion': 'gini', 'etc_min_samples_split': 20, 'etc_min_samples_leaf': 7, 'etc_max_features': 32}. Best is trial 15 with value: 0.991911.[0m
[32m[I 2022-10-19 16:24:49,612][0m Trial 10 finished with value: 0.9915620980385899 and parameters: {'etc_criterion': 'entropy', 'etc_min_samples_split': 7, 'etc_min_samples_leaf': 1, 'etc_max_features': 36}. Best is trial 0 with value: 0.991911.[0m
[32m[I 2022-10-19 16:24:50,081][0m Trial 16 finished with value: 0.9914831727931287 and parameters: {'etc_criterion': 'entropy', 'etc_min_samples_split': 16, 'etc_min_samples_leaf': 13, 'etc_max_features': 13}. Best is trial 15 with value: 0.991911.[0m
[32m[I 2022-10-19 16:24:50,833][0m Trial 23 finished with value: 0.2844441188051378 and parameters: {'etc_criterion': 'gini', 'etc_min_samples_split': 13, 'etc_min_samples_leaf': 3, 'etc_max_features': 1}. Best is trial 15 with value: 0.991911.[0m
[32m[I 2022-10-19 16:24:51,005][0m Trial 17 finished with value: 0.9916373103970451 and parameters: {'etc_criterion': 'gini', 'etc_min_samples_split': 14, 'etc_min_samples_leaf': 1, 'etc_max_features': 3}. Best is trial 15 with value: 0.991911.[0m
[32m[I 2022-10-19 16:24:51,364][0m Trial 19 finished with value: 0.9916599805449838 and parameters: {'etc_criterion': 'gini', 'etc_min_samples_split': 14, 'etc_min_samples_leaf': 2, 'etc_max_features': 47}. Best is trial 15 with value: 0.991911.[0m
[32m[I 2022-10-19 16:24:51,460][0m Trial 24 finished with value: 0.9915378437247702 and parameters: {'etc_criterion': 'gini', 'etc_min_samples_split': 11, 'etc_min_samples_leaf': 1, 'etc_max_features': 2}. Best is trial 15 with value: 0.991911.[0m
[32m[I 2022-10-19 16:24:51,695][0m Trial 21 finished with value: 0.9917522124407475 and parameters: {'etc_criterion': 'gini', 'etc_min_samples_split': 11, 'etc_min_samples_leaf': 1, 'etc_max_features': 50}. Best is trial 15 with value: 0.991911.[0m
[32m[I 2022-10-19 16:24:51,898][0m Trial 18 finished with value: 0.99154355892577 and parameters: {'etc_criterion': 'gini', 'etc_min_samples_split': 8, 'etc_min_samples_leaf': 3, 'etc_max_features': 43}. Best is trial 15 with value: 0.991911.[0m
[32m[I 2022-10-19 16:24:51,993][0m Trial 22 finished with value: 0.9917816323737062 and parameters: {'etc_criterion': 'gini', 'etc_min_samples_split': 12, 'etc_min_samples_leaf': 3, 'etc_max_features': 48}. Best is trial 15 with value: 0.991911.[0m
[32m[I 2022-10-19 16:24:52,071][0m Trial 20 finished with value: 0.9915762879012043 and parameters: {'etc_criterion': 'gini', 'etc_min_samples_split': 15, 'etc_min_samples_leaf': 1, 'etc_max_features': 49}. Best is trial 15 with value: 0.991911.[0m
[32m[I 2022-10-19 16:24:52,431][0m Trial 25 finished with value: 0.9916826512778693 and parameters: {'etc_criterion': 'entropy', 'etc_min_samples_split': 11, 'etc_min_samples_leaf': 7, 'etc_max_features': 49}. Best is trial 15 with value: 0.991911.[0m
[32m[I 2022-10-19 16:24:52,541][0m Trial 26 finished with value: 0.9915976275104889 and parameters: {'etc_criterion': 'entropy', 'etc_min_samples_split': 29, 'etc_min_samples_leaf': 8, 'etc_max_features': 50}. Best is trial 15 with value: 0.991911.[0m
[32m[I 2022-10-19 16:24:52,760][0m Trial 28 finished with value: 0.9915375710984675 and parameters: {'etc_criterion': 'entropy', 'etc_min_samples_split': 39, 'etc_min_samples_leaf': 9, 'etc_max_features': 48}. Best is trial 15 with value: 0.991911.[0m
[32m[I 2022-10-19 16:24:52,760][0m Trial 27 finished with value: 0.9915520402151495 and parameters: {'etc_criterion': 'entropy', 'etc_min_samples_split': 30, 'etc_min_samples_leaf': 9, 'etc_max_features': 49}. Best is trial 15 with value: 0.991911.[0m
[32m[I 2022-10-19 16:24:53,088][0m Trial 29 finished with value: 0.9914455125063965 and parameters: {'etc_criterion': 'entropy', 'etc_min_samples_split': 28, 'etc_min_samples_leaf': 8, 'etc_max_features': 29}. Best is trial 15 with value: 0.991911.[0m
[32m[I 2022-10-19 16:24:53,151][0m EarlyStopping exceeded for ExtraTreeClassifier; no new best scores on iters 20.[0m
[32m[I 2022-10-19 16:24:53,151][0m Study finished.[0m
[32m[I 2022-10-19 16:24:53,198][0m --------------------------------------------------------------------------------[0m
[32m[I 2022-10-19 16:24:53,198][0m --------------------          ExtraTreesClassifier          --------------------[0m
[32m[I 2022-10-19 16:24:53,198][0m --------------------------------------------------------------------------------[0m
[32m[I 2022-10-19 16:24:53,213][0m A new study created in RDB with name: ExtraTreesClassifier_b9881135[0m
[32m[I 2022-10-19 16:24:53,229][0m Study started.[0m
[32m[I 2022-10-19 16:25:37,085][0m Trial 3 finished with value: 0.9915254557539865 and parameters: {'etsc_n_estimators': 60, 'etsc_criterion': 'gini', 'etsc_min_samples_split': 17, 'etsc_min_samples_leaf': 26, 'etsc_max_features': 48, 'etsc_bootstrap': True}. Best is trial 3 with value: 0.991525.[0m
[32m[I 2022-10-19 16:25:41,145][0m Trial 2 finished with value: 0.9914418837063672 and parameters: {'etsc_n_estimators': 80, 'etsc_criterion': 'entropy', 'etsc_min_samples_split': 14, 'etsc_min_samples_leaf': 45, 'etsc_max_features': 36, 'etsc_bootstrap': True}. Best is trial 3 with value: 0.991525.[0m
[32m[I 2022-10-19 16:26:03,804][0m Trial 4 finished with value: 0.9914280187396782 and parameters: {'etsc_n_estimators': 130, 'etsc_criterion': 'entropy', 'etsc_min_samples_split': 17, 'etsc_min_samples_leaf': 47, 'etsc_max_features': 29, 'etsc_bootstrap': True}. Best is trial 3 with value: 0.991525.[0m
[32m[I 2022-10-19 16:26:19,688][0m Trial 0 finished with value: 0.9915192889267659 and parameters: {'etsc_n_estimators': 180, 'etsc_criterion': 'gini', 'etsc_min_samples_split': 40, 'etsc_min_samples_leaf': 6, 'etsc_max_features': 22, 'etsc_bootstrap': True}. Best is trial 3 with value: 0.991525.[0m
[32m[I 2022-10-19 16:26:32,216][0m Trial 1 finished with value: 0.9913352121026783 and parameters: {'etsc_n_estimators': 180, 'etsc_criterion': 'entropy', 'etsc_min_samples_split': 34, 'etsc_min_samples_leaf': 30, 'etsc_max_features': 22, 'etsc_bootstrap': False}. Best is trial 3 with value: 0.991525.[0m
[32m[I 2022-10-19 16:26:35,439][0m Trial 7 finished with value: 0.9914931468396198 and parameters: {'etsc_n_estimators': 160, 'etsc_criterion': 'gini', 'etsc_min_samples_split': 34, 'etsc_min_samples_leaf': 45, 'etsc_max_features': 40, 'etsc_bootstrap': True}. Best is trial 3 with value: 0.991525.[0m
[32m[I 2022-10-19 16:26:48,304][0m Trial 5 finished with value: 0.991508208187774 and parameters: {'etsc_n_estimators': 180, 'etsc_criterion': 'gini', 'etsc_min_samples_split': 27, 'etsc_min_samples_leaf': 42, 'etsc_max_features': 41, 'etsc_bootstrap': True}. Best is trial 3 with value: 0.991525.[0m
[32m[I 2022-10-19 16:26:53,618][0m Trial 8 finished with value: 0.9915876791250051 and parameters: {'etsc_n_estimators': 120, 'etsc_criterion': 'gini', 'etsc_min_samples_split': 10, 'etsc_min_samples_leaf': 6, 'etsc_max_features': 40, 'etsc_bootstrap': True}. Best is trial 8 with value: 0.991588.[0m
[32m[I 2022-10-19 16:27:17,960][0m Trial 10 finished with value: 0.9914882399969857 and parameters: {'etsc_n_estimators': 80, 'etsc_criterion': 'gini', 'etsc_min_samples_split': 43, 'etsc_min_samples_leaf': 4, 'etsc_max_features': 50, 'etsc_bootstrap': False}. Best is trial 8 with value: 0.991588.[0m
[32m[I 2022-10-19 16:27:18,338][0m Trial 6 finished with value: 0.9915872951754982 and parameters: {'etsc_n_estimators': 160, 'etsc_criterion': 'gini', 'etsc_min_samples_split': 31, 'etsc_min_samples_leaf': 10, 'etsc_max_features': 49, 'etsc_bootstrap': False}. Best is trial 8 with value: 0.991588.[0m
[32m[I 2022-10-19 16:27:19,014][0m Trial 9 finished with value: 0.9915038311463548 and parameters: {'etsc_n_estimators': 170, 'etsc_criterion': 'entropy', 'etsc_min_samples_split': 9, 'etsc_min_samples_leaf': 20, 'etsc_max_features': 34, 'etsc_bootstrap': True}. Best is trial 8 with value: 0.991588.[0m
[32m[I 2022-10-19 16:27:32,256][0m Trial 14 finished with value: 0.9831351834249425 and parameters: {'etsc_n_estimators': 160, 'etsc_criterion': 'entropy', 'etsc_min_samples_split': 36, 'etsc_min_samples_leaf': 30, 'etsc_max_features': 8, 'etsc_bootstrap': True}. Best is trial 8 with value: 0.991588.[0m
[32m[I 2022-10-19 16:27:35,676][0m Trial 15 finished with value: 0.984414753132674 and parameters: {'etsc_n_estimators': 160, 'etsc_criterion': 'entropy', 'etsc_min_samples_split': 2, 'etsc_min_samples_leaf': 13, 'etsc_max_features': 7, 'etsc_bootstrap': True}. Best is trial 8 with value: 0.991588.[0m
[32m[I 2022-10-19 16:27:42,204][0m Trial 13 finished with value: 0.9914961579550142 and parameters: {'etsc_n_estimators': 170, 'etsc_criterion': 'entropy', 'etsc_min_samples_split': 10, 'etsc_min_samples_leaf': 6, 'etsc_max_features': 15, 'etsc_bootstrap': True}. Best is trial 8 with value: 0.991588.[0m
[32m[I 2022-10-19 16:27:47,190][0m Trial 16 finished with value: 0.9915125459389096 and parameters: {'etsc_n_estimators': 50, 'etsc_criterion': 'gini', 'etsc_min_samples_split': 10, 'etsc_min_samples_leaf': 16, 'etsc_max_features': 32, 'etsc_bootstrap': True}. Best is trial 8 with value: 0.991588.[0m
[32m[I 2022-10-19 16:27:48,179][0m Trial 17 finished with value: 0.9844938172550683 and parameters: {'etsc_n_estimators': 110, 'etsc_criterion': 'entropy', 'etsc_min_samples_split': 2, 'etsc_min_samples_leaf': 15, 'etsc_max_features': 7, 'etsc_bootstrap': True}. Best is trial 8 with value: 0.991588.[0m
[32m[I 2022-10-19 16:27:49,502][0m Trial 18 finished with value: 0.9840240181705776 and parameters: {'etsc_n_estimators': 130, 'etsc_criterion': 'gini', 'etsc_min_samples_split': 50, 'etsc_min_samples_leaf': 15, 'etsc_max_features': 5, 'etsc_bootstrap': False}. Best is trial 8 with value: 0.991588.[0m
[32m[I 2022-10-19 16:27:51,223][0m Trial 11 finished with value: 0.9914622313604214 and parameters: {'etsc_n_estimators': 130, 'etsc_criterion': 'gini', 'etsc_min_samples_split': 47, 'etsc_min_samples_leaf': 38, 'etsc_max_features': 48, 'etsc_bootstrap': True}. Best is trial 8 with value: 0.991588.[0m
[32m[I 2022-10-19 16:28:36,346][0m Trial 12 finished with value: 0.991508366261203 and parameters: {'etsc_n_estimators': 170, 'etsc_criterion': 'gini', 'etsc_min_samples_split': 36, 'etsc_min_samples_leaf': 46, 'etsc_max_features': 38, 'etsc_bootstrap': False}. Best is trial 8 with value: 0.991588.[0m
[32m[I 2022-10-19 16:28:57,038][0m Trial 19 finished with value: 0.9915414163552199 and parameters: {'etsc_n_estimators': 110, 'etsc_criterion': 'gini', 'etsc_min_samples_split': 49, 'etsc_min_samples_leaf': 12, 'etsc_max_features': 44, 'etsc_bootstrap': False}. Best is trial 8 with value: 0.991588.[0m
[32m[I 2022-10-19 16:29:09,201][0m Trial 20 finished with value: 0.991510556858245 and parameters: {'etsc_n_estimators': 120, 'etsc_criterion': 'gini', 'etsc_min_samples_split': 50, 'etsc_min_samples_leaf': 12, 'etsc_max_features': 45, 'etsc_bootstrap': False}. Best is trial 8 with value: 0.991588.[0m
[32m[I 2022-10-19 16:29:12,801][0m Trial 21 finished with value: 0.9916328662807825 and parameters: {'etsc_n_estimators': 120, 'etsc_criterion': 'gini', 'etsc_min_samples_split': 25, 'etsc_min_samples_leaf': 14, 'etsc_max_features': 43, 'etsc_bootstrap': False}. Best is trial 21 with value: 0.991633.[0m
[32m[I 2022-10-19 16:29:28,563][0m Trial 22 finished with value: 0.9915495260604686 and parameters: {'etsc_n_estimators': 130, 'etsc_criterion': 'gini', 'etsc_min_samples_split': 25, 'etsc_min_samples_leaf': 1, 'etsc_max_features': 44, 'etsc_bootstrap': False}. Best is trial 21 with value: 0.991633.[0m
[32m[I 2022-10-19 16:29:30,456][0m Trial 23 finished with value: 0.9915652012310651 and parameters: {'etsc_n_estimators': 130, 'etsc_criterion': 'gini', 'etsc_min_samples_split': 26, 'etsc_min_samples_leaf': 1, 'etsc_max_features': 45, 'etsc_bootstrap': False}. Best is trial 21 with value: 0.991633.[0m
[32m[I 2022-10-19 16:29:53,434][0m Trial 26 finished with value: 0.9915953250244002 and parameters: {'etsc_n_estimators': 110, 'etsc_criterion': 'gini', 'etsc_min_samples_split': 25, 'etsc_min_samples_leaf': 1, 'etsc_max_features': 44, 'etsc_bootstrap': False}. Best is trial 21 with value: 0.991633.[0m
[32m[I 2022-10-19 16:30:07,118][0m Trial 25 finished with value: 0.991488628039239 and parameters: {'etsc_n_estimators': 200, 'etsc_criterion': 'gini', 'etsc_min_samples_split': 25, 'etsc_min_samples_leaf': 1, 'etsc_max_features': 43, 'etsc_bootstrap': False}. Best is trial 21 with value: 0.991633.[0m
[32m[I 2022-10-19 16:30:08,306][0m Trial 24 finished with value: 0.9914810594710243 and parameters: {'etsc_n_estimators': 200, 'etsc_criterion': 'gini', 'etsc_min_samples_split': 26, 'etsc_min_samples_leaf': 3, 'etsc_max_features': 45, 'etsc_bootstrap': False}. Best is trial 21 with value: 0.991633.[0m
[32m[I 2022-10-19 16:30:23,590][0m Trial 29 finished with value: 0.991580492187742 and parameters: {'etsc_n_estimators': 140, 'etsc_criterion': 'gini', 'etsc_min_samples_split': 28, 'etsc_min_samples_leaf': 1, 'etsc_max_features': 43, 'etsc_bootstrap': False}. Best is trial 21 with value: 0.991633.[0m
[32m[I 2022-10-19 16:30:35,867][0m Trial 27 finished with value: 0.9915952101489728 and parameters: {'etsc_n_estimators': 200, 'etsc_criterion': 'gini', 'etsc_min_samples_split': 27, 'etsc_min_samples_leaf': 9, 'etsc_max_features': 44, 'etsc_bootstrap': False}. Best is trial 21 with value: 0.991633.[0m
[32m[I 2022-10-19 16:30:39,574][0m Trial 28 finished with value: 0.9915423028592123 and parameters: {'etsc_n_estimators': 200, 'etsc_criterion': 'gini', 'etsc_min_samples_split': 27, 'etsc_min_samples_leaf': 1, 'etsc_max_features': 42, 'etsc_bootstrap': False}. Best is trial 21 with value: 0.991633.[0m
[32m[I 2022-10-19 16:30:39,652][0m EarlyStopping exceeded for ExtraTreesClassifier; no new best scores on iters 20.[0m
[32m[I 2022-10-19 16:30:39,652][0m Study finished.[0m
[32m[I 2022-10-19 16:30:39,668][0m --------------------------------------------------------------------------------[0m
[32m[I 2022-10-19 16:30:39,668][0m --------------------               GaussianNB               --------------------[0m
[32m[I 2022-10-19 16:30:39,668][0m --------------------------------------------------------------------------------[0m
[32m[I 2022-10-19 16:30:39,699][0m A new study created in RDB with name: GaussianNB_b9881135[0m
[32m[I 2022-10-19 16:30:39,715][0m Study started.[0m
[32m[I 2022-10-19 16:30:42,219][0m Trial 3 finished with value: 0.3921981125458082 and parameters: {'gnb_var_smoothing': 0.01338019696761557}. Best is trial 5 with value: 0.796703.[0m
[32m[I 2022-10-19 16:30:42,313][0m Trial 2 finished with value: 0.3912790364761604 and parameters: {'gnb_var_smoothing': 0.016160297897181337}. Best is trial 5 with value: 0.796703.[0m
[32m[I 2022-10-19 16:30:42,313][0m Trial 6 finished with value: 0.2844441188051378 and parameters: {'gnb_var_smoothing': 883.5266635758319}. Best is trial 3 with value: 0.796703.[0m
[32m[I 2022-10-19 16:30:42,376][0m Trial 1 finished with value: 0.4931342087782375 and parameters: {'gnb_var_smoothing': 4.812034228458574e-06}. Best is trial 5 with value: 0.796703.[0m
[32m[I 2022-10-19 16:30:42,517][0m Trial 5 finished with value: 0.7967029359947584 and parameters: {'gnb_var_smoothing': 1.758826199819255e-08}. Best is trial 5 with value: 0.796703.[0m
[32m[I 2022-10-19 16:30:42,517][0m Trial 0 finished with value: 0.2844441188051378 and parameters: {'gnb_var_smoothing': 38.429476200043815}. Best is trial 5 with value: 0.796703.[0m
[32m[I 2022-10-19 16:30:42,579][0m Trial 4 finished with value: 0.2844441188051378 and parameters: {'gnb_var_smoothing': 10.148392493949705}. Best is trial 5 with value: 0.796703.[0m
[32m[I 2022-10-19 16:30:42,752][0m Trial 7 finished with value: 0.3952306515096553 and parameters: {'gnb_var_smoothing': 0.0017398998598968675}. Best is trial 5 with value: 0.796703.[0m
[32m[I 2022-10-19 16:30:45,211][0m Trial 11 finished with value: 0.3951054478947944 and parameters: {'gnb_var_smoothing': 0.001951601675366242}. Best is trial 5 with value: 0.796703.[0m
[32m[I 2022-10-19 16:30:45,414][0m Trial 10 finished with value: 0.42077026075806007 and parameters: {'gnb_var_smoothing': 0.6872481031662029}. Best is trial 5 with value: 0.853789.[0m
[32m[I 2022-10-19 16:30:45,508][0m Trial 13 finished with value: 0.8537892714506093 and parameters: {'gnb_var_smoothing': 5.608228978189975e-10}. Best is trial 13 with value: 0.853789.[0m
[32m[I 2022-10-19 16:30:45,508][0m Trial 14 finished with value: 0.481262564548514 and parameters: {'gnb_var_smoothing': 6.022393066917505e-06}. Best is trial 13 with value: 0.853789.[0m
[32m[I 2022-10-19 16:30:45,633][0m Trial 12 finished with value: 0.8466710087561489 and parameters: {'gnb_var_smoothing': 1.1651027845208487e-10}. Best is trial 13 with value: 0.853789.[0m
[32m[I 2022-10-19 16:30:45,727][0m Trial 8 finished with value: 0.7775265642182151 and parameters: {'gnb_var_smoothing': 5.87421264443684e-09}. Best is trial 13 with value: 0.853789.[0m
