[32m[I 2022-10-19 19:27:40,338][0m Trial 23 finished with value: 0.2886428568013715 and parameters: {'sgdc_loss': 'modified_huber', 'sgdc_penalty': 'elasticnet', 'sgdc_alpha': 847.6273934512932, 'sgdc_l1_ratio': 0.8, 'sgdc_learning_rate': 'adaptive', 'sgdc_eta0': 837.1802037750947, 'sgdc_early_stopping': True, 'sgdc_validation_fraction': 0.25, 'sgdc_n_iter_no_change': 10}. Best is trial 2 with value: 0.650125.[0m
[32m[I 2022-10-19 19:27:46,399][0m Trial 24 finished with value: 0.5660782272272461 and parameters: {'sgdc_loss': 'squared_hinge', 'sgdc_penalty': 'elasticnet', 'sgdc_alpha': 0.00020019598204008715, 'sgdc_l1_ratio': 0.2, 'sgdc_learning_rate': 'adaptive', 'sgdc_eta0': 52.493859283835434, 'sgdc_early_stopping': True, 'sgdc_validation_fraction': 0.25, 'sgdc_n_iter_no_change': 10}. Best is trial 2 with value: 0.650125.[0m
[32m[I 2022-10-19 19:27:47,697][0m Trial 25 finished with value: 0.629639201528882 and parameters: {'sgdc_loss': 'squared_hinge', 'sgdc_penalty': 'elasticnet', 'sgdc_alpha': 0.00015796123323411193, 'sgdc_l1_ratio': 0.2, 'sgdc_learning_rate': 'adaptive', 'sgdc_eta0': 31.296293501654986, 'sgdc_early_stopping': True, 'sgdc_validation_fraction': 0.25, 'sgdc_n_iter_no_change': 10}. Best is trial 2 with value: 0.650125.[0m
[32m[I 2022-10-19 19:27:56,755][0m Trial 26 finished with value: 0.6272114374685911 and parameters: {'sgdc_loss': 'squared_hinge', 'sgdc_penalty': 'elasticnet', 'sgdc_alpha': 0.00017739813708611896, 'sgdc_l1_ratio': 0.6000000000000001, 'sgdc_learning_rate': 'adaptive', 'sgdc_eta0': 46.9396762997268, 'sgdc_early_stopping': True, 'sgdc_validation_fraction': 0.25, 'sgdc_n_iter_no_change': 10}. Best is trial 2 with value: 0.650125.[0m
[32m[I 2022-10-19 19:27:56,833][0m EarlyStopping exceeded for SGDClassifier; no new best scores on iters 20.[0m
[32m[I 2022-10-19 19:27:56,833][0m Study finished.[0m
[32m[I 2022-10-19 19:27:56,864][0m --------------------------------------------------------------------------------[0m
[32m[I 2022-10-19 19:27:56,864][0m --------------------    VeryFastDecisionRulesClassifier     --------------------[0m
[32m[I 2022-10-19 19:27:56,864][0m --------------------------------------------------------------------------------[0m
[32m[I 2022-10-19 19:27:56,895][0m A new study created in RDB with name: VeryFastDecisionRulesClassifier_b9881135[0m
[32m[I 2022-10-19 19:27:56,895][0m Study started.[0m
[32m[I 2022-10-19 19:40:24,710][0m Trial 5 finished with value: 0.6147046648608087 and parameters: {'vfdrc_ordered_rules': False, 'vfdrc_grace_period': 300, 'vfdrc_tie_threshold': 0.1, 'vfdrc_rule_prediction': 'weighted_max', 'vfdrc_max_rules': 10, 'vfdrc_expand_criterion': 'hellinger', 'vfdrc_remove_poor_atts': True}. Best is trial 5 with value: 0.614705.[0m
[32m[I 2022-10-19 19:41:31,742][0m Trial 2 finished with value: 0.6060447101216413 and parameters: {'vfdrc_ordered_rules': True, 'vfdrc_grace_period': 100, 'vfdrc_tie_threshold': 0.7000000000000001, 'vfdrc_rule_prediction': 'weighted_max', 'vfdrc_max_rules': 25, 'vfdrc_expand_criterion': 'hellinger', 'vfdrc_remove_poor_atts': True}. Best is trial 5 with value: 0.614705.[0m
[32m[I 2022-10-19 19:42:03,407][0m Trial 3 finished with value: 0.6315874334244862 and parameters: {'vfdrc_ordered_rules': False, 'vfdrc_grace_period': 350, 'vfdrc_tie_threshold': 0.15000000000000002, 'vfdrc_rule_prediction': 'first_hit', 'vfdrc_max_rules': 25, 'vfdrc_expand_criterion': 'hellinger', 'vfdrc_remove_poor_atts': True}. Best is trial 7 with value: 0.954219.[0m
[32m[I 2022-10-19 19:42:03,502][0m Trial 7 finished with value: 0.9542194001910662 and parameters: {'vfdrc_ordered_rules': True, 'vfdrc_grace_period': 200, 'vfdrc_tie_threshold': 0.9500000000000001, 'vfdrc_rule_prediction': 'weighted_max', 'vfdrc_max_rules': 15, 'vfdrc_expand_criterion': 'info_gain', 'vfdrc_remove_poor_atts': False}. Best is trial 7 with value: 0.954219.[0m
[32m[I 2022-10-19 19:42:14,033][0m Trial 0 finished with value: 0.99148656066856 and parameters: {'vfdrc_ordered_rules': True, 'vfdrc_grace_period': 300, 'vfdrc_tie_threshold': 0.8500000000000001, 'vfdrc_rule_prediction': 'weighted_max', 'vfdrc_max_rules': 35, 'vfdrc_expand_criterion': 'info_gain', 'vfdrc_remove_poor_atts': True}. Best is trial 0 with value: 0.991487.[0m
[32m[I 2022-10-19 19:42:22,466][0m Trial 1 finished with value: 0.6493075359243197 and parameters: {'vfdrc_ordered_rules': True, 'vfdrc_grace_period': 350, 'vfdrc_tie_threshold': 0.8500000000000001, 'vfdrc_rule_prediction': 'weighted_sum', 'vfdrc_max_rules': 30, 'vfdrc_expand_criterion': 'hellinger', 'vfdrc_remove_poor_atts': False}. Best is trial 0 with value: 0.991487.[0m
[32m[I 2022-10-19 19:43:04,282][0m Trial 6 finished with value: 0.6229282703292676 and parameters: {'vfdrc_ordered_rules': False, 'vfdrc_grace_period': 350, 'vfdrc_tie_threshold': 0.25, 'vfdrc_rule_prediction': 'first_hit', 'vfdrc_max_rules': 15, 'vfdrc_expand_criterion': 'hellinger', 'vfdrc_remove_poor_atts': True}. Best is trial 0 with value: 0.991487.[0m
[32m[I 2022-10-19 19:44:40,020][0m Trial 8 finished with value: 0.9479619021654178 and parameters: {'vfdrc_ordered_rules': True, 'vfdrc_grace_period': 300, 'vfdrc_tie_threshold': 0.65, 'vfdrc_rule_prediction': 'weighted_max', 'vfdrc_max_rules': 40, 'vfdrc_expand_criterion': 'foil_gain', 'vfdrc_remove_poor_atts': False}. Best is trial 0 with value: 0.991487.[0m
[32m[I 2022-10-19 19:45:07,611][0m Trial 4 finished with value: 0.9530278683745074 and parameters: {'vfdrc_ordered_rules': False, 'vfdrc_grace_period': 100, 'vfdrc_tie_threshold': 0.75, 'vfdrc_rule_prediction': 'weighted_max', 'vfdrc_max_rules': 40, 'vfdrc_expand_criterion': 'foil_gain', 'vfdrc_remove_poor_atts': True}. Best is trial 0 with value: 0.991487.[0m
[32m[I 2022-10-19 19:55:49,622][0m Trial 9 finished with value: 0.9634340733680405 and parameters: {'vfdrc_ordered_rules': False, 'vfdrc_grace_period': 150, 'vfdrc_tie_threshold': 0.5, 'vfdrc_rule_prediction': 'first_hit', 'vfdrc_max_rules': 35, 'vfdrc_expand_criterion': 'info_gain', 'vfdrc_remove_poor_atts': False}. Best is trial 0 with value: 0.991487.[0m
[32m[I 2022-10-19 19:56:22,810][0m Trial 15 finished with value: 0.9151155960225966 and parameters: {'vfdrc_ordered_rules': False, 'vfdrc_grace_period': 150, 'vfdrc_tie_threshold': 0.55, 'vfdrc_rule_prediction': 'first_hit', 'vfdrc_max_rules': 40, 'vfdrc_expand_criterion': 'foil_gain', 'vfdrc_remove_poor_atts': True}. Best is trial 0 with value: 0.991487.[0m
[32m[I 2022-10-19 19:57:01,003][0m Trial 16 finished with value: 0.9570635980589981 and parameters: {'vfdrc_ordered_rules': True, 'vfdrc_grace_period': 350, 'vfdrc_tie_threshold': 0.9500000000000001, 'vfdrc_rule_prediction': 'first_hit', 'vfdrc_max_rules': 30, 'vfdrc_expand_criterion': 'foil_gain', 'vfdrc_remove_poor_atts': True}. Best is trial 0 with value: 0.991487.[0m
[32m[I 2022-10-19 19:57:37,773][0m Trial 10 finished with value: 0.624624907429125 and parameters: {'vfdrc_ordered_rules': False, 'vfdrc_grace_period': 350, 'vfdrc_tie_threshold': 0.75, 'vfdrc_rule_prediction': 'weighted_max', 'vfdrc_max_rules': 40, 'vfdrc_expand_criterion': 'hellinger', 'vfdrc_remove_poor_atts': True}. Best is trial 0 with value: 0.991487.[0m
[32m[I 2022-10-19 19:58:49,900][0m Trial 11 finished with value: 0.6125216138901328 and parameters: {'vfdrc_ordered_rules': False, 'vfdrc_grace_period': 400, 'vfdrc_tie_threshold': 0.30000000000000004, 'vfdrc_rule_prediction': 'first_hit', 'vfdrc_max_rules': 30, 'vfdrc_expand_criterion': 'hellinger', 'vfdrc_remove_poor_atts': True}. Best is trial 0 with value: 0.991487.[0m
[32m[I 2022-10-19 19:59:30,626][0m Trial 12 finished with value: 0.9381146378877694 and parameters: {'vfdrc_ordered_rules': False, 'vfdrc_grace_period': 150, 'vfdrc_tie_threshold': 1.0, 'vfdrc_rule_prediction': 'first_hit', 'vfdrc_max_rules': 30, 'vfdrc_expand_criterion': 'info_gain', 'vfdrc_remove_poor_atts': False}. Best is trial 0 with value: 0.991487.[0m
[32m[I 2022-10-19 19:59:53,364][0m Trial 13 finished with value: 0.8683268529580775 and parameters: {'vfdrc_ordered_rules': False, 'vfdrc_grace_period': 200, 'vfdrc_tie_threshold': 0.45, 'vfdrc_rule_prediction': 'weighted_sum', 'vfdrc_max_rules': 35, 'vfdrc_expand_criterion': 'foil_gain', 'vfdrc_remove_poor_atts': True}. Best is trial 0 with value: 0.991487.[0m
[32m[I 2022-10-19 20:01:29,464][0m Trial 14 finished with value: 0.9173171362181959 and parameters: {'vfdrc_ordered_rules': False, 'vfdrc_grace_period': 350, 'vfdrc_tie_threshold': 0.05, 'vfdrc_rule_prediction': 'weighted_sum', 'vfdrc_max_rules': 25, 'vfdrc_expand_criterion': 'foil_gain', 'vfdrc_remove_poor_atts': True}. Best is trial 0 with value: 0.991487.[0m
[32m[I 2022-10-19 20:03:19,893][0m Trial 18 finished with value: 0.9912528060078104 and parameters: {'vfdrc_ordered_rules': True, 'vfdrc_grace_period': 250, 'vfdrc_tie_threshold': 0.35000000000000003, 'vfdrc_rule_prediction': 'weighted_sum', 'vfdrc_max_rules': 30, 'vfdrc_expand_criterion': 'info_gain', 'vfdrc_remove_poor_atts': False}. Best is trial 0 with value: 0.991487.[0m
[32m[I 2022-10-19 20:04:10,136][0m Trial 17 finished with value: 0.989264395523213 and parameters: {'vfdrc_ordered_rules': True, 'vfdrc_grace_period': 250, 'vfdrc_tie_threshold': 1.0, 'vfdrc_rule_prediction': 'weighted_sum', 'vfdrc_max_rules': 30, 'vfdrc_expand_criterion': 'info_gain', 'vfdrc_remove_poor_atts': True}. Best is trial 0 with value: 0.991487.[0m
[32m[I 2022-10-19 20:06:01,621][0m Trial 19 finished with value: 0.9861224306398914 and parameters: {'vfdrc_ordered_rules': True, 'vfdrc_grace_period': 250, 'vfdrc_tie_threshold': 0.4, 'vfdrc_rule_prediction': 'weighted_sum', 'vfdrc_max_rules': 35, 'vfdrc_expand_criterion': 'info_gain', 'vfdrc_remove_poor_atts': False}. Best is trial 0 with value: 0.991487.[0m
[32m[I 2022-10-19 20:06:15,255][0m Trial 20 finished with value: 0.989264395523213 and parameters: {'vfdrc_ordered_rules': True, 'vfdrc_grace_period': 250, 'vfdrc_tie_threshold': 0.45, 'vfdrc_rule_prediction': 'weighted_sum', 'vfdrc_max_rules': 30, 'vfdrc_expand_criterion': 'info_gain', 'vfdrc_remove_poor_atts': False}. Best is trial 0 with value: 0.991487.[0m
[32m[I 2022-10-19 20:07:49,834][0m Trial 21 finished with value: 0.9905320860756549 and parameters: {'vfdrc_ordered_rules': True, 'vfdrc_grace_period': 200, 'vfdrc_tie_threshold': 0.45, 'vfdrc_rule_prediction': 'weighted_sum', 'vfdrc_max_rules': 35, 'vfdrc_expand_criterion': 'info_gain', 'vfdrc_remove_poor_atts': False}. Best is trial 0 with value: 0.991487.[0m
[32m[I 2022-10-19 20:08:09,576][0m Trial 25 finished with value: 0.9686356370107059 and parameters: {'vfdrc_ordered_rules': True, 'vfdrc_grace_period': 250, 'vfdrc_tie_threshold': 0.4, 'vfdrc_rule_prediction': 'weighted_sum', 'vfdrc_max_rules': 20, 'vfdrc_expand_criterion': 'info_gain', 'vfdrc_remove_poor_atts': False}. Best is trial 0 with value: 0.991487.[0m
[32m[I 2022-10-19 20:08:18,204][0m Trial 23 finished with value: 0.9814917667364738 and parameters: {'vfdrc_ordered_rules': True, 'vfdrc_grace_period': 250, 'vfdrc_tie_threshold': 0.45, 'vfdrc_rule_prediction': 'weighted_sum', 'vfdrc_max_rules': 35, 'vfdrc_expand_criterion': 'info_gain', 'vfdrc_remove_poor_atts': False}. Best is trial 0 with value: 0.991487.[0m
[32m[I 2022-10-19 20:08:26,259][0m Trial 22 finished with value: 0.9814917667364738 and parameters: {'vfdrc_ordered_rules': True, 'vfdrc_grace_period': 250, 'vfdrc_tie_threshold': 0.45, 'vfdrc_rule_prediction': 'weighted_sum', 'vfdrc_max_rules': 35, 'vfdrc_expand_criterion': 'info_gain', 'vfdrc_remove_poor_atts': False}. Best is trial 0 with value: 0.991487.[0m
[32m[I 2022-10-19 20:08:51,707][0m Trial 24 finished with value: 0.9814917667364738 and parameters: {'vfdrc_ordered_rules': True, 'vfdrc_grace_period': 250, 'vfdrc_tie_threshold': 0.45, 'vfdrc_rule_prediction': 'first_hit', 'vfdrc_max_rules': 35, 'vfdrc_expand_criterion': 'info_gain', 'vfdrc_remove_poor_atts': False}. Best is trial 0 with value: 0.991487.[0m
[32m[I 2022-10-19 20:08:55,369][0m Trial 26 finished with value: 0.968814870738318 and parameters: {'vfdrc_ordered_rules': True, 'vfdrc_grace_period': 250, 'vfdrc_tie_threshold': 0.35000000000000003, 'vfdrc_rule_prediction': 'weighted_sum', 'vfdrc_max_rules': 20, 'vfdrc_expand_criterion': 'info_gain', 'vfdrc_remove_poor_atts': False}. Best is trial 0 with value: 0.991487.[0m
[32m[I 2022-10-19 20:09:08,198][0m Trial 28 finished with value: 0.9913793437598339 and parameters: {'vfdrc_ordered_rules': True, 'vfdrc_grace_period': 300, 'vfdrc_tie_threshold': 0.8500000000000001, 'vfdrc_rule_prediction': 'weighted_sum', 'vfdrc_max_rules': 20, 'vfdrc_expand_criterion': 'info_gain', 'vfdrc_remove_poor_atts': False}. Best is trial 0 with value: 0.991487.[0m
[32m[I 2022-10-19 20:09:08,370][0m Trial 27 finished with value: 0.9768688094204355 and parameters: {'vfdrc_ordered_rules': True, 'vfdrc_grace_period': 300, 'vfdrc_tie_threshold': 0.35000000000000003, 'vfdrc_rule_prediction': 'weighted_sum', 'vfdrc_max_rules': 20, 'vfdrc_expand_criterion': 'info_gain', 'vfdrc_remove_poor_atts': False}. Best is trial 0 with value: 0.991487.[0m
[32m[I 2022-10-19 20:09:08,558][0m Trial 29 finished with value: 0.9576615063776266 and parameters: {'vfdrc_ordered_rules': True, 'vfdrc_grace_period': 200, 'vfdrc_tie_threshold': 0.25, 'vfdrc_rule_prediction': 'weighted_sum', 'vfdrc_max_rules': 35, 'vfdrc_expand_criterion': 'info_gain', 'vfdrc_remove_poor_atts': False}. Best is trial 0 with value: 0.991487.[0m
[32m[I 2022-10-19 20:09:08,636][0m EarlyStopping exceeded for VeryFastDecisionRulesClassifier; no new best scores on iters 20.[0m
[32m[I 2022-10-19 20:09:08,636][0m Study finished.[0m
[32m[I 2022-10-19 20:09:08,668][0m --------------------------------------------------------------------------------[0m
[32m[I 2022-10-19 20:09:08,668][0m --------------------             XGBClassifier              --------------------[0m
[32m[I 2022-10-19 20:09:08,668][0m --------------------------------------------------------------------------------[0m
[32m[I 2022-10-19 20:09:08,699][0m A new study created in RDB with name: XGBClassifier_b9881135[0m
[32m[I 2022-10-19 20:09:08,699][0m Study started.[0m
[32m[I 2022-10-19 20:09:21,657][0m Trial 2 finished with value: 0.7422307857144322 and parameters: {'xgbc_n_estimators': 10, 'xgbc_use_label_encoder': False, 'xgbc_learning_rate': 0.002714524737212399, 'xgbc_booster': 'gblinear', 'xgbc_gamma': 4.862195521699302e-06}. Best is trial 2 with value: 0.742231.[0m
[32m[I 2022-10-19 20:10:06,901][0m Trial 0 finished with value: 0.9915263944785363 and parameters: {'xgbc_n_estimators': 10, 'xgbc_use_label_encoder': False, 'xgbc_learning_rate': 0.847058580802671, 'xgbc_booster': 'dart', 'xgbc_gamma': 1.0761684809934253e-05}. Best is trial 0 with value: 0.991526.[0m
[32m[I 2022-10-19 20:12:54,141][0m Trial 1 finished with value: 0.987391581259032 and parameters: {'xgbc_n_estimators': 70, 'xgbc_use_label_encoder': False, 'xgbc_learning_rate': 0.006507028974730899, 'xgbc_booster': 'gbtree', 'xgbc_gamma': 0.036514399869143434}. Best is trial 0 with value: 0.991526.[0m
[32m[I 2022-10-19 20:13:14,623][0m Trial 6 finished with value: 0.819096449448676 and parameters: {'xgbc_n_estimators': 20, 'xgbc_use_label_encoder': False, 'xgbc_learning_rate': 0.014049219281833074, 'xgbc_booster': 'gblinear', 'xgbc_gamma': 0.004360898388930608}. Best is trial 0 with value: 0.991526.[0m
[32m[I 2022-10-19 20:16:03,218][0m Trial 7 finished with value: 0.6952353249762836 and parameters: {'xgbc_n_estimators': 180, 'xgbc_use_label_encoder': False, 'xgbc_learning_rate': 1.3232442315808117e-05, 'xgbc_booster': 'gblinear', 'xgbc_gamma': 1.1458796622067724e-06}. Best is trial 0 with value: 0.991526.[0m
[32m[I 2022-10-19 20:17:19,381][0m Trial 8 finished with value: 0.8878366721774834 and parameters: {'xgbc_n_estimators': 80, 'xgbc_use_label_encoder': False, 'xgbc_learning_rate': 0.03001350929672906, 'xgbc_booster': 'gblinear', 'xgbc_gamma': 0.03087503618482271}. Best is trial 0 with value: 0.991526.[0m
[32m[I 2022-10-19 20:30:55,350][0m Trial 9 finished with value: 0.987430427654197 and parameters: {'xgbc_n_estimators': 60, 'xgbc_use_label_encoder': False, 'xgbc_learning_rate': 0.000785393699540031, 'xgbc_booster': 'dart', 'xgbc_gamma': 0.5641133405418146}. Best is trial 0 with value: 0.991526.[0m
[32m[I 2022-10-19 20:39:54,351][0m Trial 3 finished with value: 0.9915125634270353 and parameters: {'xgbc_n_estimators': 100, 'xgbc_use_label_encoder': False, 'xgbc_learning_rate': 0.44030935897393403, 'xgbc_booster': 'dart', 'xgbc_gamma': 0.007831992645441514}. Best is trial 0 with value: 0.991526.[0m
[32m[I 2022-10-19 20:43:07,680][0m Trial 11 finished with value: 0.987391581259032 and parameters: {'xgbc_n_estimators': 60, 'xgbc_use_label_encoder': False, 'xgbc_learning_rate': 0.0077212195452489325, 'xgbc_booster': 'gbtree', 'xgbc_gamma': 1.7982654048472484e-06}. Best is trial 0 with value: 0.991526.[0m
[32m[I 2022-10-19 20:44:29,609][0m Trial 12 finished with value: 0.7544607968460966 and parameters: {'xgbc_n_estimators': 90, 'xgbc_use_label_encoder': False, 'xgbc_learning_rate': 0.0011687385741205078, 'xgbc_booster': 'gblinear', 'xgbc_gamma': 6.614832650580128e-06}. Best is trial 0 with value: 0.991526.[0m
[32m[I 2022-10-19 20:44:36,681][0m Trial 10 finished with value: 0.9874373527966328 and parameters: {'xgbc_n_estimators': 60, 'xgbc_use_label_encoder': False, 'xgbc_learning_rate': 0.014247925132836937, 'xgbc_booster': 'dart', 'xgbc_gamma': 6.110559292898577e-06}. Best is trial 0 with value: 0.991526.[0m
[32m[I 2022-10-19 21:42:03,278][0m Trial 14 finished with value: 0.9912295202719535 and parameters: {'xgbc_n_estimators': 140, 'xgbc_use_label_encoder': False, 'xgbc_learning_rate': 0.29768737631649345, 'xgbc_booster': 'dart', 'xgbc_gamma': 0.0002218255581105697}. Best is trial 0 with value: 0.991526.[0m
[32m[I 2022-10-19 21:56:03,831][0m Trial 13 finished with value: 0.9918404147638626 and parameters: {'xgbc_n_estimators': 160, 'xgbc_use_label_encoder': False, 'xgbc_learning_rate': 0.8762442243244565, 'xgbc_booster': 'dart', 'xgbc_gamma': 0.00013457670645208034}. Best is trial 13 with value: 0.99184.[0m
[32m[I 2022-10-19 21:57:37,600][0m Trial 5 finished with value: 0.9872397701116491 and parameters: {'xgbc_n_estimators': 190, 'xgbc_use_label_encoder': False, 'xgbc_learning_rate': 6.2431593353663724e-06, 'xgbc_booster': 'dart', 'xgbc_gamma': 0.0001251123879415141}. Best is trial 13 with value: 0.99184.[0m
[32m[I 2022-10-19 22:07:37,996][0m Trial 4 finished with value: 0.9872397701116491 and parameters: {'xgbc_n_estimators': 200, 'xgbc_use_label_encoder': False, 'xgbc_learning_rate': 2.084731047693803e-06, 'xgbc_booster': 'dart', 'xgbc_gamma': 0.04233800490072196}. Best is trial 13 with value: 0.99184.[0m
[32m[I 2022-10-19 22:30:34,178][0m Trial 15 finished with value: 0.9915955924692982 and parameters: {'xgbc_n_estimators': 130, 'xgbc_use_label_encoder': False, 'xgbc_learning_rate': 0.9368773431188823, 'xgbc_booster': 'dart', 'xgbc_gamma': 0.0001614835668746278}. Best is trial 13 with value: 0.99184.[0m
[32m[I 2022-10-19 22:37:06,286][0m Trial 19 finished with value: 0.9916103107230885 and parameters: {'xgbc_n_estimators': 140, 'xgbc_use_label_encoder': False, 'xgbc_learning_rate': 0.09642368340127119, 'xgbc_booster': 'gbtree', 'xgbc_gamma': 0.00019402030709812318}. Best is trial 13 with value: 0.99184.[0m
[32m[I 2022-10-19 22:44:38,023][0m Trial 20 finished with value: 0.9915106738899494 and parameters: {'xgbc_n_estimators': 160, 'xgbc_use_label_encoder': False, 'xgbc_learning_rate': 0.08010728490020455, 'xgbc_booster': 'gbtree', 'xgbc_gamma': 4.5042936961506835e-05}. Best is trial 13 with value: 0.99184.[0m
[32m[I 2022-10-19 22:50:43,860][0m Trial 21 finished with value: 0.991616567987035 and parameters: {'xgbc_n_estimators': 130, 'xgbc_use_label_encoder': False, 'xgbc_learning_rate': 0.10396359552784452, 'xgbc_booster': 'gbtree', 'xgbc_gamma': 0.0013980967583239994}. Best is trial 13 with value: 0.99184.[0m
[32m[I 2022-10-19 22:53:52,673][0m Trial 17 finished with value: 0.9917640457811975 and parameters: {'xgbc_n_estimators': 140, 'xgbc_use_label_encoder': False, 'xgbc_learning_rate': 0.7671188858758643, 'xgbc_booster': 'dart', 'xgbc_gamma': 4.585185063806214e-05}. Best is trial 13 with value: 0.99184.[0m
[32m[I 2022-10-19 22:57:04,435][0m Trial 22 finished with value: 0.9872397701116491 and parameters: {'xgbc_n_estimators': 120, 'xgbc_use_label_encoder': False, 'xgbc_learning_rate': 9.401800196284489e-05, 'xgbc_booster': 'gbtree', 'xgbc_gamma': 0.0020464948177753633}. Best is trial 13 with value: 0.99184.[0m
[32m[I 2022-10-19 22:59:33,664][0m Trial 16 finished with value: 0.9917409260608206 and parameters: {'xgbc_n_estimators': 150, 'xgbc_use_label_encoder': False, 'xgbc_learning_rate': 0.8181437938551365, 'xgbc_booster': 'dart', 'xgbc_gamma': 0.00010245302017518965}. Best is trial 13 with value: 0.99184.[0m
[32m[I 2022-10-19 23:03:36,973][0m Trial 24 finished with value: 0.9916183387275341 and parameters: {'xgbc_n_estimators': 160, 'xgbc_use_label_encoder': False, 'xgbc_learning_rate': 0.1797994312466393, 'xgbc_booster': 'gbtree', 'xgbc_gamma': 0.0007622996680766716}. Best is trial 13 with value: 0.99184.[0m
[32m[I 2022-10-19 23:14:37,071][0m Trial 18 finished with value: 0.9914349486035929 and parameters: {'xgbc_n_estimators': 150, 'xgbc_use_label_encoder': False, 'xgbc_learning_rate': 0.11390723149579712, 'xgbc_booster': 'dart', 'xgbc_gamma': 3.869268740487971e-05}. Best is trial 13 with value: 0.99184.[0m
[32m[I 2022-10-20 00:08:42,958][0m Trial 25 finished with value: 0.9915109074872495 and parameters: {'xgbc_n_estimators': 160, 'xgbc_use_label_encoder': False, 'xgbc_learning_rate': 0.2019195912034214, 'xgbc_booster': 'dart', 'xgbc_gamma': 3.087356043848491e-05}. Best is trial 13 with value: 0.99184.[0m
