[32m[I 2022-10-19 19:19:24,573][0m Trial 26 finished with value: 0.9047439555188416 and parameters: {'rc_C': 1.2253725388288904e-06, 'rc_tol': 0.0033002148574405137}. Best is trial 0 with value: 0.904744.[0m
[32m[I 2022-10-19 19:19:24,824][0m Trial 31 finished with value: 0.9047439555188416 and parameters: {'rc_C': 1.7900790056944698e-06, 'rc_tol': 0.004385157983810961}. Best is trial 0 with value: 0.904744.[0m
[32m[I 2022-10-19 19:19:24,902][0m Trial 28 finished with value: 0.9047439555188416 and parameters: {'rc_C': 1.4794993921070223e-06, 'rc_tol': 0.0034454862593350354}. Best is trial 0 with value: 0.904744.[0m
[32m[I 2022-10-19 19:19:24,996][0m Trial 27 finished with value: 0.9047439555188416 and parameters: {'rc_C': 1.889379127994995e-06, 'rc_tol': 0.0034213404860630107}. Best is trial 0 with value: 0.904744.[0m
[32m[I 2022-10-19 19:19:24,996][0m Trial 30 finished with value: 0.9047439555188416 and parameters: {'rc_C': 1.6601858424956145e-06, 'rc_tol': 0.004582050457174523}. Best is trial 0 with value: 0.904744.[0m
[32m[I 2022-10-19 19:19:25,152][0m Trial 29 finished with value: 0.9047439555188416 and parameters: {'rc_C': 1.3537841189318631e-06, 'rc_tol': 0.003297905042982778}. Best is trial 0 with value: 0.904744.[0m
[32m[I 2022-10-19 19:19:25,152][0m Trial 25 finished with value: 0.9047439555188416 and parameters: {'rc_C': 1.3276030282478511e-06, 'rc_tol': 0.003972287583569881}. Best is trial 0 with value: 0.904744.[0m
[32m[I 2022-10-19 19:19:25,890][0m Trial 32 finished with value: 0.9047439555188416 and parameters: {'rc_C': 0.01131711660888961, 'rc_tol': 0.0007022474928641805}. Best is trial 0 with value: 0.904744.[0m
[32m[I 2022-10-19 19:19:26,218][0m Trial 33 finished with value: 0.9047439555188416 and parameters: {'rc_C': 9.479561928483698e-06, 'rc_tol': 0.007136580015647852}. Best is trial 0 with value: 0.904744.[0m
[32m[I 2022-10-19 19:19:26,297][0m EarlyStopping exceeded for RidgeClassifier; no new best scores on iters 20.[0m
[32m[I 2022-10-19 19:19:26,297][0m Study finished.[0m
[32m[I 2022-10-19 19:19:26,312][0m --------------------------------------------------------------------------------[0m
[32m[I 2022-10-19 19:19:26,328][0m --------------------           RUSBoostClassifier           --------------------[0m
[32m[I 2022-10-19 19:19:26,328][0m --------------------------------------------------------------------------------[0m
[32m[I 2022-10-19 19:19:26,343][0m A new study created in RDB with name: RUSBoostClassifier_b9881135[0m
[32m[I 2022-10-19 19:19:26,359][0m Study started.[0m
[32m[I 2022-10-19 19:19:45,433][0m Trial 7 finished with value: 0.10117121198760491 and parameters: {'rusbc_n_estimators': 25, 'rusbc_learning_rate': 2.1524628306106866e-05, 'rusbc_sampling_strategy': 'not minority'}. Best is trial 7 with value: 0.101171.[0m
[32m[I 2022-10-19 19:19:57,088][0m Trial 4 finished with value: 0.3013147453657114 and parameters: {'rusbc_n_estimators': 25, 'rusbc_learning_rate': 0.000578258298124626, 'rusbc_sampling_strategy': 'majority'}. Best is trial 4 with value: 0.301315.[0m
[32m[I 2022-10-19 19:20:15,999][0m Trial 8 finished with value: 0.7581185821475852 and parameters: {'rusbc_n_estimators': 25, 'rusbc_learning_rate': 0.25880977713320213, 'rusbc_sampling_strategy': 'not majority'}. Best is trial 8 with value: 0.758119.[0m
[32m[I 2022-10-19 19:20:21,520][0m Trial 2 finished with value: 0.10117121198760491 and parameters: {'rusbc_n_estimators': 75, 'rusbc_learning_rate': 7.90653742211766e-06, 'rusbc_sampling_strategy': 'not minority'}. Best is trial 8 with value: 0.758119.[0m
[32m[I 2022-10-19 19:20:24,540][0m Trial 0 finished with value: 0.31229924485982147 and parameters: {'rusbc_n_estimators': 50, 'rusbc_learning_rate': 3.371247280723394e-06, 'rusbc_sampling_strategy': 'not majority'}. Best is trial 8 with value: 0.758119.[0m
[32m[I 2022-10-19 19:20:26,538][0m Trial 1 finished with value: 0.3083464227585943 and parameters: {'rusbc_n_estimators': 50, 'rusbc_learning_rate': 1.2084339665114744e-06, 'rusbc_sampling_strategy': 'majority'}. Best is trial 8 with value: 0.758119.[0m
[32m[I 2022-10-19 19:20:27,013][0m Trial 5 finished with value: 0.3083464227585943 and parameters: {'rusbc_n_estimators': 50, 'rusbc_learning_rate': 9.628551942173904e-06, 'rusbc_sampling_strategy': 'majority'}. Best is trial 8 with value: 0.758119.[0m
[32m[I 2022-10-19 19:20:40,594][0m Trial 3 finished with value: 0.712623877502489 and parameters: {'rusbc_n_estimators': 100, 'rusbc_learning_rate': 0.06761003973839284, 'rusbc_sampling_strategy': 'not minority'}. Best is trial 8 with value: 0.759593.[0m
[32m[I 2022-10-19 19:20:40,688][0m Trial 11 finished with value: 0.7595926056385959 and parameters: {'rusbc_n_estimators': 25, 'rusbc_learning_rate': 0.15571920333473516, 'rusbc_sampling_strategy': 'not minority'}. Best is trial 11 with value: 0.759593.[0m
[32m[I 2022-10-19 19:21:00,700][0m Trial 15 finished with value: 0.7176424976167689 and parameters: {'rusbc_n_estimators': 25, 'rusbc_learning_rate': 0.2853727069874727, 'rusbc_sampling_strategy': 'all'}. Best is trial 11 with value: 0.759593.[0m
[32m[I 2022-10-19 19:21:10,680][0m Trial 9 finished with value: 0.8905507179547066 and parameters: {'rusbc_n_estimators': 100, 'rusbc_learning_rate': 0.5733918343446335, 'rusbc_sampling_strategy': 'not minority'}. Best is trial 9 with value: 0.890551.[0m
[32m[I 2022-10-19 19:21:20,507][0m Trial 6 finished with value: 0.31229924485982147 and parameters: {'rusbc_n_estimators': 100, 'rusbc_learning_rate': 1.3835032815451586e-05, 'rusbc_sampling_strategy': 'not majority'}. Best is trial 9 with value: 0.890551.[0m
[32m[I 2022-10-19 19:21:30,173][0m Trial 10 finished with value: 0.10117121198760491 and parameters: {'rusbc_n_estimators': 100, 'rusbc_learning_rate': 1.280065437413204e-06, 'rusbc_sampling_strategy': 'all'}. Best is trial 9 with value: 0.890551.[0m
[32m[I 2022-10-19 19:21:39,097][0m Trial 12 finished with value: 0.7127989133290933 and parameters: {'rusbc_n_estimators': 100, 'rusbc_learning_rate': 0.02017331474885631, 'rusbc_sampling_strategy': 'all'}. Best is trial 9 with value: 0.890551.[0m
[32m[I 2022-10-19 19:21:40,948][0m Trial 14 finished with value: 0.8833812237157426 and parameters: {'rusbc_n_estimators': 100, 'rusbc_learning_rate': 0.8740168002029275, 'rusbc_sampling_strategy': 'not minority'}. Best is trial 9 with value: 0.890551.[0m
[32m[I 2022-10-19 19:21:54,672][0m Trial 16 finished with value: 0.9237863482389447 and parameters: {'rusbc_n_estimators': 100, 'rusbc_learning_rate': 0.006618739519211619, 'rusbc_sampling_strategy': 'not minority'}. Best is trial 16 with value: 0.923786.[0m
[32m[I 2022-10-19 19:21:56,770][0m Trial 17 finished with value: 0.9240990235115991 and parameters: {'rusbc_n_estimators': 75, 'rusbc_learning_rate': 0.005743407045247005, 'rusbc_sampling_strategy': 'all'}. Best is trial 17 with value: 0.924099.[0m
[32m[I 2022-10-19 19:22:16,016][0m Trial 19 finished with value: 0.8656645351002399 and parameters: {'rusbc_n_estimators': 75, 'rusbc_learning_rate': 0.0051927191819438724, 'rusbc_sampling_strategy': 'not minority'}. Best is trial 17 with value: 0.924099.[0m
[32m[I 2022-10-19 19:22:18,338][0m Trial 13 finished with value: 0.3013147453657114 and parameters: {'rusbc_n_estimators': 100, 'rusbc_learning_rate': 0.0008108391556833613, 'rusbc_sampling_strategy': 'majority'}. Best is trial 17 with value: 0.924099.[0m
[32m[I 2022-10-19 19:22:24,390][0m Trial 18 finished with value: 0.712623877502489 and parameters: {'rusbc_n_estimators': 100, 'rusbc_learning_rate': 0.012027213688104912, 'rusbc_sampling_strategy': 'not minority'}. Best is trial 17 with value: 0.924099.[0m
[32m[I 2022-10-19 19:22:26,055][0m Trial 20 finished with value: 0.9211436583435888 and parameters: {'rusbc_n_estimators': 75, 'rusbc_learning_rate': 0.016906066397434947, 'rusbc_sampling_strategy': 'not minority'}. Best is trial 17 with value: 0.924099.[0m
[32m[I 2022-10-19 19:22:35,083][0m Trial 21 finished with value: 0.8652576797334038 and parameters: {'rusbc_n_estimators': 75, 'rusbc_learning_rate': 0.004949834621382516, 'rusbc_sampling_strategy': 'not minority'}. Best is trial 17 with value: 0.924099.[0m
[32m[I 2022-10-19 19:22:36,604][0m Trial 22 finished with value: 0.912099217495041 and parameters: {'rusbc_n_estimators': 75, 'rusbc_learning_rate': 0.9045165269352402, 'rusbc_sampling_strategy': 'not minority'}. Best is trial 17 with value: 0.924099.[0m
[32m[I 2022-10-19 19:22:48,937][0m Trial 23 finished with value: 0.8473039533570059 and parameters: {'rusbc_n_estimators': 75, 'rusbc_learning_rate': 0.004156709794700299, 'rusbc_sampling_strategy': 'not minority'}. Best is trial 17 with value: 0.924099.[0m
[32m[I 2022-10-19 19:22:50,173][0m Trial 24 finished with value: 0.6366845557095607 and parameters: {'rusbc_n_estimators': 75, 'rusbc_learning_rate': 0.0022830220746682013, 'rusbc_sampling_strategy': 'all'}. Best is trial 17 with value: 0.924099.[0m
[32m[I 2022-10-19 19:23:02,563][0m Trial 25 finished with value: 0.12231775321658918 and parameters: {'rusbc_n_estimators': 75, 'rusbc_learning_rate': 0.00013750017595321652, 'rusbc_sampling_strategy': 'all'}. Best is trial 17 with value: 0.924099.[0m
[32m[I 2022-10-19 19:23:03,907][0m Trial 26 finished with value: 0.12231775321658918 and parameters: {'rusbc_n_estimators': 75, 'rusbc_learning_rate': 7.581371834028595e-05, 'rusbc_sampling_strategy': 'all'}. Best is trial 17 with value: 0.924099.[0m
[32m[I 2022-10-19 19:23:06,815][0m Trial 27 finished with value: 0.12231775321658918 and parameters: {'rusbc_n_estimators': 75, 'rusbc_learning_rate': 8.104141601857598e-05, 'rusbc_sampling_strategy': 'all'}. Best is trial 17 with value: 0.924099.[0m
[32m[I 2022-10-19 19:23:07,502][0m Trial 28 finished with value: 0.12231775321658918 and parameters: {'rusbc_n_estimators': 75, 'rusbc_learning_rate': 0.00014544817000148612, 'rusbc_sampling_strategy': 'all'}. Best is trial 17 with value: 0.924099.[0m
[32m[I 2022-10-19 19:23:10,893][0m Trial 29 finished with value: 0.12231775321658918 and parameters: {'rusbc_n_estimators': 75, 'rusbc_learning_rate': 0.0002748287376111735, 'rusbc_sampling_strategy': 'all'}. Best is trial 17 with value: 0.924099.[0m
[32m[I 2022-10-19 19:23:10,971][0m EarlyStopping exceeded for RUSBoostClassifier; no new best scores on iters 20.[0m
[32m[I 2022-10-19 19:23:10,971][0m Study finished.[0m
[32m[I 2022-10-19 19:23:11,002][0m --------------------------------------------------------------------------------[0m
[32m[I 2022-10-19 19:23:11,002][0m --------------------             SGDClassifier              --------------------[0m
[32m[I 2022-10-19 19:23:11,002][0m --------------------------------------------------------------------------------[0m
[32m[I 2022-10-19 19:23:11,034][0m A new study created in RDB with name: SGDClassifier_b9881135[0m
[32m[I 2022-10-19 19:23:11,034][0m Study started.[0m
[32m[I 2022-10-19 19:23:28,125][0m Trial 1 finished with value: 0.45199870216630017 and parameters: {'sgdc_loss': 'squared_hinge', 'sgdc_penalty': 'elasticnet', 'sgdc_alpha': 0.0010603214542533083, 'sgdc_l1_ratio': 0.0, 'sgdc_learning_rate': 'optimal', 'sgdc_eta0': 0.005696111975036848, 'sgdc_early_stopping': True, 'sgdc_validation_fraction': 0.25, 'sgdc_n_iter_no_change': 10}. Best is trial 1 with value: 0.451999.[0m
[32m[I 2022-10-19 19:23:28,630][0m Trial 6 finished with value: 0.44614868393971485 and parameters: {'sgdc_loss': 'hinge', 'sgdc_penalty': 'elasticnet', 'sgdc_alpha': 4.374463412489453e-06, 'sgdc_l1_ratio': 0.4, 'sgdc_learning_rate': 'constant', 'sgdc_eta0': 0.01669817117479706, 'sgdc_early_stopping': True, 'sgdc_validation_fraction': 0.25, 'sgdc_n_iter_no_change': 10}. Best is trial 1 with value: 0.451999.[0m
[32m[I 2022-10-19 19:23:29,137][0m Trial 3 finished with value: 0.3265271025008819 and parameters: {'sgdc_loss': 'hinge', 'sgdc_penalty': 'elasticnet', 'sgdc_alpha': 1.9674661071381343e-06, 'sgdc_l1_ratio': 0.4, 'sgdc_learning_rate': 'constant', 'sgdc_eta0': 0.43329177643018413, 'sgdc_early_stopping': True, 'sgdc_validation_fraction': 0.25, 'sgdc_n_iter_no_change': 10}. Best is trial 1 with value: 0.451999.[0m
[32m[I 2022-10-19 19:23:29,563][0m Trial 5 finished with value: 0.5043740180653727 and parameters: {'sgdc_loss': 'log', 'sgdc_penalty': 'elasticnet', 'sgdc_alpha': 4.4656339178939784e-05, 'sgdc_l1_ratio': 0.8, 'sgdc_learning_rate': 'invscaling', 'sgdc_eta0': 0.7151654364325367, 'sgdc_early_stopping': True, 'sgdc_validation_fraction': 0.25, 'sgdc_n_iter_no_change': 10}. Best is trial 5 with value: 0.504374.[0m
[32m[I 2022-10-19 19:23:30,609][0m Trial 4 finished with value: 0.39433273454570855 and parameters: {'sgdc_loss': 'log', 'sgdc_penalty': 'elasticnet', 'sgdc_alpha': 0.008687060703893393, 'sgdc_l1_ratio': 1.0, 'sgdc_learning_rate': 'constant', 'sgdc_eta0': 0.8009481458005698, 'sgdc_early_stopping': True, 'sgdc_validation_fraction': 0.25, 'sgdc_n_iter_no_change': 10}. Best is trial 5 with value: 0.504374.[0m
[32m[I 2022-10-19 19:23:33,597][0m Trial 0 finished with value: 0.4561101921318651 and parameters: {'sgdc_loss': 'log', 'sgdc_penalty': 'elasticnet', 'sgdc_alpha': 0.1816162006331122, 'sgdc_l1_ratio': 0.2, 'sgdc_learning_rate': 'invscaling', 'sgdc_eta0': 0.030359123902976185, 'sgdc_early_stopping': True, 'sgdc_validation_fraction': 0.25, 'sgdc_n_iter_no_change': 10}. Best is trial 5 with value: 0.504374.[0m
[32m[I 2022-10-19 19:23:43,146][0m Trial 9 finished with value: 0.4248878871186623 and parameters: {'sgdc_loss': 'log', 'sgdc_penalty': 'elasticnet', 'sgdc_alpha': 4.863262911214957e-06, 'sgdc_l1_ratio': 0.6000000000000001, 'sgdc_learning_rate': 'constant', 'sgdc_eta0': 16.22428448643658, 'sgdc_early_stopping': True, 'sgdc_validation_fraction': 0.25, 'sgdc_n_iter_no_change': 10}. Best is trial 5 with value: 0.504374.[0m
[32m[I 2022-10-19 19:23:44,504][0m Trial 11 finished with value: 0.17806547804975126 and parameters: {'sgdc_loss': 'log', 'sgdc_penalty': 'elasticnet', 'sgdc_alpha': 4.326498990599314, 'sgdc_l1_ratio': 1.0, 'sgdc_learning_rate': 'constant', 'sgdc_eta0': 139.86178718599464, 'sgdc_early_stopping': True, 'sgdc_validation_fraction': 0.25, 'sgdc_n_iter_no_change': 10}. Best is trial 5 with value: 0.504374.[0m
[32m[I 2022-10-19 19:23:47,501][0m Trial 10 finished with value: 0.6325993487325634 and parameters: {'sgdc_loss': 'squared_hinge', 'sgdc_penalty': 'elasticnet', 'sgdc_alpha': 3.321144118404792e-05, 'sgdc_l1_ratio': 0.8, 'sgdc_learning_rate': 'invscaling', 'sgdc_eta0': 50.442568011103496, 'sgdc_early_stopping': True, 'sgdc_validation_fraction': 0.25, 'sgdc_n_iter_no_change': 10}. Best is trial 10 with value: 0.632599.[0m
[32m[I 2022-10-19 19:23:49,094][0m Trial 12 finished with value: 0.4751237449475098 and parameters: {'sgdc_loss': 'log', 'sgdc_penalty': 'elasticnet', 'sgdc_alpha': 1.0647231103404254e-05, 'sgdc_l1_ratio': 0.6000000000000001, 'sgdc_learning_rate': 'optimal', 'sgdc_eta0': 0.0027075030492347595, 'sgdc_early_stopping': True, 'sgdc_validation_fraction': 0.25, 'sgdc_n_iter_no_change': 10}. Best is trial 10 with value: 0.632599.[0m
[32m[I 2022-10-19 19:23:51,605][0m Trial 13 finished with value: 0.5893252881667271 and parameters: {'sgdc_loss': 'log', 'sgdc_penalty': 'elasticnet', 'sgdc_alpha': 0.010151451019546528, 'sgdc_l1_ratio': 1.0, 'sgdc_learning_rate': 'optimal', 'sgdc_eta0': 0.1741126092904061, 'sgdc_early_stopping': True, 'sgdc_validation_fraction': 0.25, 'sgdc_n_iter_no_change': 10}. Best is trial 10 with value: 0.632599.[0m
[32m[I 2022-10-19 19:23:59,526][0m Trial 14 finished with value: 0.54036698156976 and parameters: {'sgdc_loss': 'modified_huber', 'sgdc_penalty': 'elasticnet', 'sgdc_alpha': 0.0013357017722427605, 'sgdc_l1_ratio': 0.8, 'sgdc_learning_rate': 'optimal', 'sgdc_eta0': 0.03245505478577051, 'sgdc_early_stopping': True, 'sgdc_validation_fraction': 0.25, 'sgdc_n_iter_no_change': 10}. Best is trial 10 with value: 0.632599.[0m
[32m[I 2022-10-19 19:24:00,944][0m Trial 15 finished with value: 0.4624656684118497 and parameters: {'sgdc_loss': 'hinge', 'sgdc_penalty': 'elasticnet', 'sgdc_alpha': 0.00019837195524344912, 'sgdc_l1_ratio': 1.0, 'sgdc_learning_rate': 'constant', 'sgdc_eta0': 159.6663425553356, 'sgdc_early_stopping': True, 'sgdc_validation_fraction': 0.25, 'sgdc_n_iter_no_change': 10}. Best is trial 10 with value: 0.632599.[0m
[32m[I 2022-10-19 19:24:08,009][0m Trial 16 finished with value: 0.4679544061162307 and parameters: {'sgdc_loss': 'squared_hinge', 'sgdc_penalty': 'elasticnet', 'sgdc_alpha': 1.6452028226600045e-06, 'sgdc_l1_ratio': 0.4, 'sgdc_learning_rate': 'optimal', 'sgdc_eta0': 5.71195728247434, 'sgdc_early_stopping': True, 'sgdc_validation_fraction': 0.25, 'sgdc_n_iter_no_change': 10}. Best is trial 10 with value: 0.632599.[0m
[32m[I 2022-10-19 19:25:27,986][0m Trial 8 finished with value: 0.41088954498799446 and parameters: {'sgdc_loss': 'squared_hinge', 'sgdc_penalty': 'elasticnet', 'sgdc_alpha': 18.945918276309815, 'sgdc_l1_ratio': 0.4, 'sgdc_learning_rate': 'adaptive', 'sgdc_eta0': 3.461173659658727, 'sgdc_early_stopping': True, 'sgdc_validation_fraction': 0.25, 'sgdc_n_iter_no_change': 10}. Best is trial 10 with value: 0.632599.[0m
[32m[I 2022-10-19 19:25:29,145][0m Trial 2 finished with value: 0.6501251047364761 and parameters: {'sgdc_loss': 'log', 'sgdc_penalty': 'elasticnet', 'sgdc_alpha': 0.00035698219765178355, 'sgdc_l1_ratio': 0.4, 'sgdc_learning_rate': 'adaptive', 'sgdc_eta0': 2.1325084092998483, 'sgdc_early_stopping': True, 'sgdc_validation_fraction': 0.25, 'sgdc_n_iter_no_change': 10}. Best is trial 2 with value: 0.650125.[0m
[32m[I 2022-10-19 19:25:44,048][0m Trial 22 finished with value: 0.17778866624163073 and parameters: {'sgdc_loss': 'modified_huber', 'sgdc_penalty': 'elasticnet', 'sgdc_alpha': 0.13502125202563028, 'sgdc_l1_ratio': 0.8, 'sgdc_learning_rate': 'invscaling', 'sgdc_eta0': 0.16300380197215536, 'sgdc_early_stopping': True, 'sgdc_validation_fraction': 0.25, 'sgdc_n_iter_no_change': 10}. Best is trial 2 with value: 0.650125.[0m
[32m[I 2022-10-19 19:25:56,930][0m Trial 7 finished with value: 0.4698204058526615 and parameters: {'sgdc_loss': 'log', 'sgdc_penalty': 'elasticnet', 'sgdc_alpha': 1.2237370834553223, 'sgdc_l1_ratio': 0.2, 'sgdc_learning_rate': 'adaptive', 'sgdc_eta0': 950.661813292145, 'sgdc_early_stopping': True, 'sgdc_validation_fraction': 0.25, 'sgdc_n_iter_no_change': 10}. Best is trial 2 with value: 0.650125.[0m
[32m[I 2022-10-19 19:26:09,591][0m Trial 20 finished with value: 0.4065836912844848 and parameters: {'sgdc_loss': 'squared_hinge', 'sgdc_penalty': 'elasticnet', 'sgdc_alpha': 982.2524017690254, 'sgdc_l1_ratio': 0.8, 'sgdc_learning_rate': 'adaptive', 'sgdc_eta0': 10.548643413987445, 'sgdc_early_stopping': True, 'sgdc_validation_fraction': 0.25, 'sgdc_n_iter_no_change': 10}. Best is trial 2 with value: 0.650125.[0m
[32m[I 2022-10-19 19:26:18,760][0m Trial 17 finished with value: 0.2844441188051378 and parameters: {'sgdc_loss': 'modified_huber', 'sgdc_penalty': 'elasticnet', 'sgdc_alpha': 742.5526321404453, 'sgdc_l1_ratio': 0.8, 'sgdc_learning_rate': 'adaptive', 'sgdc_eta0': 570.5383856543089, 'sgdc_early_stopping': True, 'sgdc_validation_fraction': 0.25, 'sgdc_n_iter_no_change': 10}. Best is trial 2 with value: 0.650125.[0m
[32m[I 2022-10-19 19:26:23,071][0m Trial 18 finished with value: 0.28356821445577857 and parameters: {'sgdc_loss': 'modified_huber', 'sgdc_penalty': 'elasticnet', 'sgdc_alpha': 591.8655906938233, 'sgdc_l1_ratio': 0.8, 'sgdc_learning_rate': 'adaptive', 'sgdc_eta0': 461.288828610434, 'sgdc_early_stopping': True, 'sgdc_validation_fraction': 0.25, 'sgdc_n_iter_no_change': 10}. Best is trial 2 with value: 0.650125.[0m
[32m[I 2022-10-19 19:26:31,710][0m Trial 19 finished with value: 0.3820662759856108 and parameters: {'sgdc_loss': 'squared_hinge', 'sgdc_penalty': 'elasticnet', 'sgdc_alpha': 0.5342097774350396, 'sgdc_l1_ratio': 0.8, 'sgdc_learning_rate': 'adaptive', 'sgdc_eta0': 558.3828859110964, 'sgdc_early_stopping': True, 'sgdc_validation_fraction': 0.25, 'sgdc_n_iter_no_change': 10}. Best is trial 2 with value: 0.650125.[0m
[32m[I 2022-10-19 19:26:37,330][0m Trial 27 finished with value: 0.3094166588603411 and parameters: {'sgdc_loss': 'squared_hinge', 'sgdc_penalty': 'elasticnet', 'sgdc_alpha': 0.00010664181669731253, 'sgdc_l1_ratio': 0.6000000000000001, 'sgdc_learning_rate': 'invscaling', 'sgdc_eta0': 37.312142144775216, 'sgdc_early_stopping': True, 'sgdc_validation_fraction': 0.25, 'sgdc_n_iter_no_change': 10}. Best is trial 2 with value: 0.650125.[0m
[32m[I 2022-10-19 19:26:38,760][0m Trial 21 finished with value: 0.2844441188051378 and parameters: {'sgdc_loss': 'squared_hinge', 'sgdc_penalty': 'elasticnet', 'sgdc_alpha': 694.8408720305077, 'sgdc_l1_ratio': 0.8, 'sgdc_learning_rate': 'adaptive', 'sgdc_eta0': 555.7181752548418, 'sgdc_early_stopping': True, 'sgdc_validation_fraction': 0.25, 'sgdc_n_iter_no_change': 10}. Best is trial 2 with value: 0.650125.[0m
[32m[I 2022-10-19 19:26:39,327][0m Trial 28 finished with value: 0.14238322312874818 and parameters: {'sgdc_loss': 'squared_hinge', 'sgdc_penalty': 'elasticnet', 'sgdc_alpha': 0.0038545705641819597, 'sgdc_l1_ratio': 0.6000000000000001, 'sgdc_learning_rate': 'invscaling', 'sgdc_eta0': 44.16058433959662, 'sgdc_early_stopping': True, 'sgdc_validation_fraction': 0.25, 'sgdc_n_iter_no_change': 10}. Best is trial 2 with value: 0.650125.[0m
[32m[I 2022-10-19 19:26:46,767][0m Trial 29 finished with value: 0.43698324050677595 and parameters: {'sgdc_loss': 'log', 'sgdc_penalty': 'elasticnet', 'sgdc_alpha': 0.0028064646584409682, 'sgdc_l1_ratio': 0.6000000000000001, 'sgdc_learning_rate': 'invscaling', 'sgdc_eta0': 41.99333671114938, 'sgdc_early_stopping': True, 'sgdc_validation_fraction': 0.25, 'sgdc_n_iter_no_change': 10}. Best is trial 2 with value: 0.650125.[0m
