[32m[I 2022-10-19 17:21:22,786][0m Trial 1 finished with value: 0.2844441188051378 and parameters: {'lsvc_nystroem_kernel_gamma': 201.08951808245885, 'lsvc_nystroem_kernel_n_components': 50, 'lsvc_nystroem_dual': False, 'lsvc_nystroem_C': 408.6451593029061, 'lsvc_nystroem_max_iter': 2000}. Best is trial 0 with value: 0.300451.[0m
[32m[I 2022-10-19 17:21:31,373][0m Trial 2 finished with value: 0.2844441188051378 and parameters: {'lsvc_nystroem_kernel_gamma': 0.02056781753650374, 'lsvc_nystroem_kernel_n_components': 150, 'lsvc_nystroem_dual': False, 'lsvc_nystroem_C': 2.14285190234171e-05, 'lsvc_nystroem_max_iter': 2000}. Best is trial 0 with value: 0.300451.[0m
[32m[I 2022-10-19 17:21:43,190][0m Trial 3 finished with value: 0.2844441188051378 and parameters: {'lsvc_nystroem_kernel_gamma': 0.0013947261984337779, 'lsvc_nystroem_kernel_n_components': 100, 'lsvc_nystroem_dual': False, 'lsvc_nystroem_C': 0.00016367923293601164, 'lsvc_nystroem_max_iter': 2000}. Best is trial 0 with value: 0.300451.[0m
[32m[I 2022-10-19 17:22:01,652][0m Trial 4 finished with value: 0.29625660245621643 and parameters: {'lsvc_nystroem_kernel_gamma': 0.036135645473618076, 'lsvc_nystroem_kernel_n_components': 150, 'lsvc_nystroem_dual': False, 'lsvc_nystroem_C': 11.286153359121226, 'lsvc_nystroem_max_iter': 2000}. Best is trial 0 with value: 0.300451.[0m
[32m[I 2022-10-19 17:22:05,076][0m Trial 5 finished with value: 0.2844441188051378 and parameters: {'lsvc_nystroem_kernel_gamma': 31.276093320249117, 'lsvc_nystroem_kernel_n_components': 100, 'lsvc_nystroem_dual': False, 'lsvc_nystroem_C': 0.0019555940670293722, 'lsvc_nystroem_max_iter': 2000}. Best is trial 0 with value: 0.300451.[0m
[32m[I 2022-10-19 17:22:09,919][0m Trial 6 finished with value: 0.2844441188051378 and parameters: {'lsvc_nystroem_kernel_gamma': 136.0821465570224, 'lsvc_nystroem_kernel_n_components': 150, 'lsvc_nystroem_dual': False, 'lsvc_nystroem_C': 1.4176698812512165, 'lsvc_nystroem_max_iter': 2000}. Best is trial 0 with value: 0.300451.[0m
[32m[I 2022-10-19 17:22:13,407][0m Trial 7 finished with value: 0.2844441188051378 and parameters: {'lsvc_nystroem_kernel_gamma': 0.05219140007362863, 'lsvc_nystroem_kernel_n_components': 100, 'lsvc_nystroem_dual': False, 'lsvc_nystroem_C': 1.2588910460706498e-06, 'lsvc_nystroem_max_iter': 2000}. Best is trial 0 with value: 0.300451.[0m
[32m[I 2022-10-19 17:22:18,115][0m Trial 8 finished with value: 0.2844441188051378 and parameters: {'lsvc_nystroem_kernel_gamma': 959.1133415607106, 'lsvc_nystroem_kernel_n_components': 150, 'lsvc_nystroem_dual': False, 'lsvc_nystroem_C': 2.022278484150099e-06, 'lsvc_nystroem_max_iter': 2000}. Best is trial 0 with value: 0.300451.[0m
[32m[I 2022-10-19 17:22:21,650][0m Trial 9 finished with value: 0.2844441188051378 and parameters: {'lsvc_nystroem_kernel_gamma': 0.3494050026653827, 'lsvc_nystroem_kernel_n_components': 100, 'lsvc_nystroem_dual': False, 'lsvc_nystroem_C': 0.06435301559340327, 'lsvc_nystroem_max_iter': 2000}. Best is trial 0 with value: 0.300451.[0m
[32m[I 2022-10-19 17:22:23,825][0m Trial 10 finished with value: 0.2844441188051378 and parameters: {'lsvc_nystroem_kernel_gamma': 3.4361161174138135, 'lsvc_nystroem_kernel_n_components': 50, 'lsvc_nystroem_dual': False, 'lsvc_nystroem_C': 969.7497588692764, 'lsvc_nystroem_max_iter': 2000}. Best is trial 0 with value: 0.300451.[0m
[32m[I 2022-10-19 17:22:48,037][0m Trial 11 finished with value: 0.32968222852445866 and parameters: {'lsvc_nystroem_kernel_gamma': 0.0010253394298309205, 'lsvc_nystroem_kernel_n_components': 50, 'lsvc_nystroem_dual': False, 'lsvc_nystroem_C': 4.210427828788247, 'lsvc_nystroem_max_iter': 2000}. Best is trial 11 with value: 0.329682.[0m
[32m[I 2022-10-19 17:23:07,143][0m Trial 12 finished with value: 0.328315403940767 and parameters: {'lsvc_nystroem_kernel_gamma': 0.0011086030361388299, 'lsvc_nystroem_kernel_n_components': 50, 'lsvc_nystroem_dual': False, 'lsvc_nystroem_C': 5.180317441385216, 'lsvc_nystroem_max_iter': 2000}. Best is trial 11 with value: 0.329682.[0m
[32m[I 2022-10-19 17:23:19,430][0m Trial 13 finished with value: 0.3196851343303417 and parameters: {'lsvc_nystroem_kernel_gamma': 0.0010301570293639037, 'lsvc_nystroem_kernel_n_components': 50, 'lsvc_nystroem_dual': False, 'lsvc_nystroem_C': 0.16381123369193298, 'lsvc_nystroem_max_iter': 2000}. Best is trial 11 with value: 0.329682.[0m
[32m[I 2022-10-19 17:23:21,800][0m Trial 14 finished with value: 0.2848288967191686 and parameters: {'lsvc_nystroem_kernel_gamma': 0.414166246457091, 'lsvc_nystroem_kernel_n_components': 50, 'lsvc_nystroem_dual': False, 'lsvc_nystroem_C': 31.72838980629177, 'lsvc_nystroem_max_iter': 2000}. Best is trial 11 with value: 0.329682.[0m
[32m[I 2022-10-19 17:23:25,099][0m Trial 15 finished with value: 0.29471900181068444 and parameters: {'lsvc_nystroem_kernel_gamma': 0.007750256051136038, 'lsvc_nystroem_kernel_n_components': 50, 'lsvc_nystroem_dual': False, 'lsvc_nystroem_C': 0.7943443840699844, 'lsvc_nystroem_max_iter': 2000}. Best is trial 11 with value: 0.329682.[0m
[32m[I 2022-10-19 17:23:27,226][0m Trial 16 finished with value: 0.2844441188051378 and parameters: {'lsvc_nystroem_kernel_gamma': 2.6097603249950043, 'lsvc_nystroem_kernel_n_components': 50, 'lsvc_nystroem_dual': False, 'lsvc_nystroem_C': 0.006448277630402855, 'lsvc_nystroem_max_iter': 2000}. Best is trial 11 with value: 0.329682.[0m
[32m[I 2022-10-19 17:24:13,946][0m Trial 17 finished with value: 0.3288457810999153 and parameters: {'lsvc_nystroem_kernel_gamma': 0.00422493478368613, 'lsvc_nystroem_kernel_n_components': 100, 'lsvc_nystroem_dual': False, 'lsvc_nystroem_C': 74.27139408266402, 'lsvc_nystroem_max_iter': 2000}. Best is trial 11 with value: 0.329682.[0m
[32m[I 2022-10-19 17:24:17,921][0m Trial 18 finished with value: 0.2887212613316432 and parameters: {'lsvc_nystroem_kernel_gamma': 0.09738814397318248, 'lsvc_nystroem_kernel_n_components': 100, 'lsvc_nystroem_dual': False, 'lsvc_nystroem_C': 127.2828354411098, 'lsvc_nystroem_max_iter': 2000}. Best is trial 11 with value: 0.329682.[0m
[32m[I 2022-10-19 17:24:37,619][0m Trial 19 finished with value: 0.30846178093546245 and parameters: {'lsvc_nystroem_kernel_gamma': 0.0061676251441213446, 'lsvc_nystroem_kernel_n_components': 100, 'lsvc_nystroem_dual': False, 'lsvc_nystroem_C': 0.41475962579039616, 'lsvc_nystroem_max_iter': 2000}. Best is trial 11 with value: 0.329682.[0m
[32m[I 2022-10-19 17:25:42,026][0m Trial 20 finished with value: 0.3284455645312016 and parameters: {'lsvc_nystroem_kernel_gamma': 0.004386908561997374, 'lsvc_nystroem_kernel_n_components': 100, 'lsvc_nystroem_dual': False, 'lsvc_nystroem_C': 127.97042927753846, 'lsvc_nystroem_max_iter': 2000}. Best is trial 11 with value: 0.329682.[0m
[32m[I 2022-10-19 17:26:42,761][0m Trial 21 finished with value: 0.3320060204213549 and parameters: {'lsvc_nystroem_kernel_gamma': 0.0037385839075588004, 'lsvc_nystroem_kernel_n_components': 100, 'lsvc_nystroem_dual': False, 'lsvc_nystroem_C': 82.49063670753785, 'lsvc_nystroem_max_iter': 2000}. Best is trial 21 with value: 0.332006.[0m
[32m[I 2022-10-19 17:26:42,839][0m EarlyStopping exceeded for LinearSVC_Nystroem; no new best scores on iters 20.[0m
[32m[I 2022-10-19 17:26:42,839][0m Study finished.[0m
[32m[I 2022-10-19 17:26:42,855][0m --------------------------------------------------------------------------------[0m
[32m[I 2022-10-19 17:26:42,855][0m --------------------    LinearSVC_PolynomialCountSketch     --------------------[0m
[32m[I 2022-10-19 17:26:42,855][0m --------------------------------------------------------------------------------[0m
[32m[I 2022-10-19 17:26:42,886][0m A new study created in RDB with name: LinearSVC_PolynomialCountSketch_b9881135[0m
[32m[I 2022-10-19 17:26:42,886][0m Study started.[0m
[32m[I 2022-10-19 17:29:13,290][0m Trial 0 finished with value: 0.9277444219631235 and parameters: {'lsvc_pcs_kernel_gamma': 0.03644493008364751, 'lsvc_pcs_kernel_n_components': 100, 'lsvc_pcs_degree': 2, 'lsvc_pcs_dual': False, 'lsvc_pcs_C': 4.122669578244798, 'lsvc_pcs_max_iter': 2000}. Best is trial 0 with value: 0.927744.[0m
[32m[I 2022-10-19 17:32:06,162][0m Trial 1 finished with value: 0.9175217645014585 and parameters: {'lsvc_pcs_kernel_gamma': 16.292347248833643, 'lsvc_pcs_kernel_n_components': 150, 'lsvc_pcs_degree': 2, 'lsvc_pcs_dual': False, 'lsvc_pcs_C': 2.3519988728769854, 'lsvc_pcs_max_iter': 2000}. Best is trial 0 with value: 0.927744.[0m
[32m[I 2022-10-19 17:35:45,743][0m Trial 2 finished with value: 0.9878081224004549 and parameters: {'lsvc_pcs_kernel_gamma': 0.004375370233865515, 'lsvc_pcs_kernel_n_components': 150, 'lsvc_pcs_degree': 2, 'lsvc_pcs_dual': False, 'lsvc_pcs_C': 0.3109319033954937, 'lsvc_pcs_max_iter': 2000}. Best is trial 2 with value: 0.987808.[0m
[32m[I 2022-10-19 17:37:20,511][0m Trial 3 finished with value: 0.9624041402697134 and parameters: {'lsvc_pcs_kernel_gamma': 32.2214880768181, 'lsvc_pcs_kernel_n_components': 50, 'lsvc_pcs_degree': 2, 'lsvc_pcs_dual': False, 'lsvc_pcs_C': 0.12223669804115438, 'lsvc_pcs_max_iter': 2000}. Best is trial 2 with value: 0.987808.[0m
[32m[I 2022-10-19 17:39:56,828][0m Trial 4 finished with value: 0.928787639736439 and parameters: {'lsvc_pcs_kernel_gamma': 0.015209997418462113, 'lsvc_pcs_kernel_n_components': 100, 'lsvc_pcs_degree': 2, 'lsvc_pcs_dual': False, 'lsvc_pcs_C': 0.0014243997553344588, 'lsvc_pcs_max_iter': 2000}. Best is trial 2 with value: 0.987808.[0m
[32m[I 2022-10-19 17:41:24,204][0m Trial 5 finished with value: 0.9248881587625613 and parameters: {'lsvc_pcs_kernel_gamma': 0.018718112077211777, 'lsvc_pcs_kernel_n_components': 50, 'lsvc_pcs_degree': 2, 'lsvc_pcs_dual': False, 'lsvc_pcs_C': 25.36397280636639, 'lsvc_pcs_max_iter': 2000}. Best is trial 2 with value: 0.987808.[0m
[32m[I 2022-10-19 17:43:48,074][0m Trial 6 finished with value: 0.9727649431621217 and parameters: {'lsvc_pcs_kernel_gamma': 0.05750803470775655, 'lsvc_pcs_kernel_n_components': 100, 'lsvc_pcs_degree': 2, 'lsvc_pcs_dual': False, 'lsvc_pcs_C': 0.10332218927636544, 'lsvc_pcs_max_iter': 2000}. Best is trial 2 with value: 0.987808.[0m
[32m[I 2022-10-19 17:45:56,064][0m Trial 7 finished with value: 0.9281100536325136 and parameters: {'lsvc_pcs_kernel_gamma': 0.011659281758640888, 'lsvc_pcs_kernel_n_components': 100, 'lsvc_pcs_degree': 2, 'lsvc_pcs_dual': False, 'lsvc_pcs_C': 353.0001941473003, 'lsvc_pcs_max_iter': 2000}. Best is trial 2 with value: 0.987808.[0m
[32m[I 2022-10-19 17:48:54,292][0m Trial 8 finished with value: 0.930772029109957 and parameters: {'lsvc_pcs_kernel_gamma': 0.10486852425033798, 'lsvc_pcs_kernel_n_components': 150, 'lsvc_pcs_degree': 2, 'lsvc_pcs_dual': False, 'lsvc_pcs_C': 55.03081787485623, 'lsvc_pcs_max_iter': 2000}. Best is trial 2 with value: 0.987808.[0m
[32m[I 2022-10-19 17:51:35,316][0m Trial 9 finished with value: 0.9661476044063925 and parameters: {'lsvc_pcs_kernel_gamma': 0.007201103740658138, 'lsvc_pcs_kernel_n_components': 100, 'lsvc_pcs_degree': 2, 'lsvc_pcs_dual': False, 'lsvc_pcs_C': 0.002327437927768777, 'lsvc_pcs_max_iter': 2000}. Best is trial 2 with value: 0.987808.[0m
[32m[I 2022-10-19 17:54:38,524][0m Trial 10 finished with value: 0.9296121156609225 and parameters: {'lsvc_pcs_kernel_gamma': 937.5958511810885, 'lsvc_pcs_kernel_n_components': 150, 'lsvc_pcs_degree': 2, 'lsvc_pcs_dual': False, 'lsvc_pcs_C': 1.5421031527589363e-06, 'lsvc_pcs_max_iter': 2000}. Best is trial 2 with value: 0.987808.[0m
[32m[I 2022-10-19 17:57:59,530][0m Trial 11 finished with value: 0.9254029974955871 and parameters: {'lsvc_pcs_kernel_gamma': 0.6217042396926131, 'lsvc_pcs_kernel_n_components': 150, 'lsvc_pcs_degree': 2, 'lsvc_pcs_dual': False, 'lsvc_pcs_C': 0.06782388421846977, 'lsvc_pcs_max_iter': 2000}. Best is trial 2 with value: 0.987808.[0m
[32m[I 2022-10-19 17:59:29,009][0m Trial 12 finished with value: 0.9331674817313939 and parameters: {'lsvc_pcs_kernel_gamma': 0.001369117576930455, 'lsvc_pcs_kernel_n_components': 50, 'lsvc_pcs_degree': 2, 'lsvc_pcs_dual': False, 'lsvc_pcs_C': 0.0019087204308046997, 'lsvc_pcs_max_iter': 2000}. Best is trial 2 with value: 0.987808.[0m
[32m[I 2022-10-19 18:01:43,187][0m Trial 13 finished with value: 0.9373393607963532 and parameters: {'lsvc_pcs_kernel_gamma': 0.0011882336769981046, 'lsvc_pcs_kernel_n_components': 100, 'lsvc_pcs_degree': 2, 'lsvc_pcs_dual': False, 'lsvc_pcs_C': 3.60097846844699e-05, 'lsvc_pcs_max_iter': 2000}. Best is trial 2 with value: 0.987808.[0m
[32m[I 2022-10-19 18:05:02,843][0m Trial 14 finished with value: 0.9480880902910447 and parameters: {'lsvc_pcs_kernel_gamma': 0.26526551123919456, 'lsvc_pcs_kernel_n_components': 150, 'lsvc_pcs_degree': 2, 'lsvc_pcs_dual': False, 'lsvc_pcs_C': 0.3661196594784029, 'lsvc_pcs_max_iter': 2000}. Best is trial 2 with value: 0.987808.[0m
[32m[I 2022-10-19 18:07:24,249][0m Trial 15 finished with value: 0.9303352155764094 and parameters: {'lsvc_pcs_kernel_gamma': 5.510755931996539, 'lsvc_pcs_kernel_n_components': 100, 'lsvc_pcs_degree': 2, 'lsvc_pcs_dual': False, 'lsvc_pcs_C': 0.00940311272524825, 'lsvc_pcs_max_iter': 2000}. Best is trial 2 with value: 0.987808.[0m
[32m[I 2022-10-19 18:10:26,549][0m Trial 16 finished with value: 0.9576470708467161 and parameters: {'lsvc_pcs_kernel_gamma': 1.6850077662244152, 'lsvc_pcs_kernel_n_components': 150, 'lsvc_pcs_degree': 2, 'lsvc_pcs_dual': False, 'lsvc_pcs_C': 0.00016365508280315842, 'lsvc_pcs_max_iter': 2000}. Best is trial 2 with value: 0.987808.[0m
[32m[I 2022-10-19 18:12:00,035][0m Trial 17 finished with value: 0.9195691582427181 and parameters: {'lsvc_pcs_kernel_gamma': 0.08660777553904181, 'lsvc_pcs_kernel_n_components': 50, 'lsvc_pcs_degree': 2, 'lsvc_pcs_dual': False, 'lsvc_pcs_C': 0.96234208449628, 'lsvc_pcs_max_iter': 2000}. Best is trial 2 with value: 0.987808.[0m
[32m[I 2022-10-19 18:15:06,389][0m Trial 18 finished with value: 0.9370586834461525 and parameters: {'lsvc_pcs_kernel_gamma': 0.0030518402845814393, 'lsvc_pcs_kernel_n_components': 100, 'lsvc_pcs_degree': 2, 'lsvc_pcs_dual': False, 'lsvc_pcs_C': 0.011854920076305174, 'lsvc_pcs_max_iter': 2000}. Best is trial 2 with value: 0.987808.[0m
[32m[I 2022-10-19 18:17:03,430][0m Trial 19 finished with value: 0.9571740383373999 and parameters: {'lsvc_pcs_kernel_gamma': 0.19556919496157862, 'lsvc_pcs_kernel_n_components': 100, 'lsvc_pcs_degree': 2, 'lsvc_pcs_dual': False, 'lsvc_pcs_C': 20.357490598499407, 'lsvc_pcs_max_iter': 2000}. Best is trial 2 with value: 0.987808.[0m
[32m[I 2022-10-19 18:20:09,466][0m Trial 20 finished with value: 0.9331488571927516 and parameters: {'lsvc_pcs_kernel_gamma': 0.0045780917783062765, 'lsvc_pcs_kernel_n_components': 150, 'lsvc_pcs_degree': 2, 'lsvc_pcs_dual': False, 'lsvc_pcs_C': 351.6831732844386, 'lsvc_pcs_max_iter': 2000}. Best is trial 2 with value: 0.987808.[0m
[32m[I 2022-10-19 18:22:54,052][0m Trial 21 finished with value: 0.9661383994311677 and parameters: {'lsvc_pcs_kernel_gamma': 0.008461826926478854, 'lsvc_pcs_kernel_n_components': 100, 'lsvc_pcs_degree': 2, 'lsvc_pcs_dual': False, 'lsvc_pcs_C': 0.001088736976221484, 'lsvc_pcs_max_iter': 2000}. Best is trial 2 with value: 0.987808.[0m
[32m[I 2022-10-19 18:22:54,114][0m EarlyStopping exceeded for LinearSVC_PolynomialCountSketch; no new best scores on iters 20.[0m
[32m[I 2022-10-19 18:22:54,114][0m Study finished.[0m
[32m[I 2022-10-19 18:22:54,146][0m --------------------------------------------------------------------------------[0m
[32m[I 2022-10-19 18:22:54,146][0m --------------------          LinearSVC_RBFSampler          --------------------[0m
[32m[I 2022-10-19 18:22:54,146][0m --------------------------------------------------------------------------------[0m
[32m[I 2022-10-19 18:22:54,177][0m A new study created in RDB with name: LinearSVC_RBFSampler_b9881135[0m
[32m[I 2022-10-19 18:22:54,193][0m Study started.[0m
[32m[I 2022-10-19 18:22:59,677][0m Trial 0 finished with value: 0.2844441188051378 and parameters: {'lsvc_rbfs_kernel_gamma': 1.0110706463960286, 'lsvc_rbfs_kernel_n_components': 50, 'lsvc_rbfs_dual': False, 'lsvc_rbfs_C': 9.66077525884946e-06, 'lsvc_rbfs_max_iter': 2000}. Best is trial 0 with value: 0.284444.[0m
[32m[I 2022-10-19 18:23:05,344][0m Trial 1 finished with value: 0.2844441188051378 and parameters: {'lsvc_rbfs_kernel_gamma': 0.8051455383552221, 'lsvc_rbfs_kernel_n_components': 50, 'lsvc_rbfs_dual': False, 'lsvc_rbfs_C': 104.18082836996503, 'lsvc_rbfs_max_iter': 2000}. Best is trial 0 with value: 0.284444.[0m
[32m[I 2022-10-19 18:23:11,418][0m Trial 2 finished with value: 0.2844441188051378 and parameters: {'lsvc_rbfs_kernel_gamma': 1.8485336205221303, 'lsvc_rbfs_kernel_n_components': 50, 'lsvc_rbfs_dual': False, 'lsvc_rbfs_C': 0.001134167492754789, 'lsvc_rbfs_max_iter': 2000}. Best is trial 0 with value: 0.284444.[0m
[32m[I 2022-10-19 18:23:18,393][0m Trial 3 finished with value: 0.2844441188051378 and parameters: {'lsvc_rbfs_kernel_gamma': 0.019033163411440537, 'lsvc_rbfs_kernel_n_components': 50, 'lsvc_rbfs_dual': False, 'lsvc_rbfs_C': 22.968219157831783, 'lsvc_rbfs_max_iter': 2000}. Best is trial 0 with value: 0.284444.[0m
[32m[I 2022-10-19 18:23:26,047][0m Trial 4 finished with value: 0.2844441188051378 and parameters: {'lsvc_rbfs_kernel_gamma': 5.860470105291893, 'lsvc_rbfs_kernel_n_components': 100, 'lsvc_rbfs_dual': False, 'lsvc_rbfs_C': 1.7494324444760458e-05, 'lsvc_rbfs_max_iter': 2000}. Best is trial 0 with value: 0.284444.[0m
[32m[I 2022-10-19 18:23:38,948][0m Trial 5 finished with value: 0.2844441188051378 and parameters: {'lsvc_rbfs_kernel_gamma': 0.008630536700412257, 'lsvc_rbfs_kernel_n_components': 100, 'lsvc_rbfs_dual': False, 'lsvc_rbfs_C': 0.02681694470583164, 'lsvc_rbfs_max_iter': 2000}. Best is trial 0 with value: 0.284444.[0m
[32m[I 2022-10-19 18:23:53,562][0m Trial 6 finished with value: 0.2844441188051378 and parameters: {'lsvc_rbfs_kernel_gamma': 81.51675117662195, 'lsvc_rbfs_kernel_n_components': 150, 'lsvc_rbfs_dual': False, 'lsvc_rbfs_C': 126.17584968133572, 'lsvc_rbfs_max_iter': 2000}. Best is trial 0 with value: 0.284444.[0m
[32m[I 2022-10-19 18:24:03,182][0m Trial 7 finished with value: 0.2844441188051378 and parameters: {'lsvc_rbfs_kernel_gamma': 0.001013193188954743, 'lsvc_rbfs_kernel_n_components': 100, 'lsvc_rbfs_dual': False, 'lsvc_rbfs_C': 1.707837416863111e-06, 'lsvc_rbfs_max_iter': 2000}. Best is trial 0 with value: 0.284444.[0m
[32m[I 2022-10-19 18:24:09,021][0m Trial 8 finished with value: 0.2844441188051378 and parameters: {'lsvc_rbfs_kernel_gamma': 484.31462122784, 'lsvc_rbfs_kernel_n_components': 50, 'lsvc_rbfs_dual': False, 'lsvc_rbfs_C': 3.354868822034552, 'lsvc_rbfs_max_iter': 2000}. Best is trial 0 with value: 0.284444.[0m
[32m[I 2022-10-19 18:24:18,376][0m Trial 9 finished with value: 0.2844441188051378 and parameters: {'lsvc_rbfs_kernel_gamma': 0.025134643468076846, 'lsvc_rbfs_kernel_n_components': 100, 'lsvc_rbfs_dual': False, 'lsvc_rbfs_C': 3.082563974594351e-05, 'lsvc_rbfs_max_iter': 2000}. Best is trial 0 with value: 0.284444.[0m
[32m[I 2022-10-19 18:24:31,544][0m Trial 10 finished with value: 0.2844441188051378 and parameters: {'lsvc_rbfs_kernel_gamma': 0.35603601544735314, 'lsvc_rbfs_kernel_n_components': 150, 'lsvc_rbfs_dual': False, 'lsvc_rbfs_C': 0.0023889963421509933, 'lsvc_rbfs_max_iter': 2000}. Best is trial 0 with value: 0.284444.[0m
[32m[I 2022-10-19 18:24:38,260][0m Trial 11 finished with value: 0.2844441188051378 and parameters: {'lsvc_rbfs_kernel_gamma': 0.21709291718312826, 'lsvc_rbfs_kernel_n_components': 50, 'lsvc_rbfs_dual': False, 'lsvc_rbfs_C': 1.803344196521839, 'lsvc_rbfs_max_iter': 2000}. Best is trial 0 with value: 0.284444.[0m
[32m[I 2022-10-19 18:24:44,223][0m Trial 12 finished with value: 0.2844441188051378 and parameters: {'lsvc_rbfs_kernel_gamma': 13.595658534007201, 'lsvc_rbfs_kernel_n_components': 50, 'lsvc_rbfs_dual': False, 'lsvc_rbfs_C': 463.38596183805055, 'lsvc_rbfs_max_iter': 2000}. Best is trial 0 with value: 0.284444.[0m
[32m[I 2022-10-19 18:24:50,357][0m Trial 13 finished with value: 0.2844441188051378 and parameters: {'lsvc_rbfs_kernel_gamma': 0.12258567035944733, 'lsvc_rbfs_kernel_n_components': 50, 'lsvc_rbfs_dual': False, 'lsvc_rbfs_C': 0.16008081293041304, 'lsvc_rbfs_max_iter': 2000}. Best is trial 0 with value: 0.284444.[0m
[32m[I 2022-10-19 18:24:56,643][0m Trial 14 finished with value: 0.2844441188051378 and parameters: {'lsvc_rbfs_kernel_gamma': 2.015983941841636, 'lsvc_rbfs_kernel_n_components': 50, 'lsvc_rbfs_dual': False, 'lsvc_rbfs_C': 0.00025136891351953196, 'lsvc_rbfs_max_iter': 2000}. Best is trial 0 with value: 0.284444.[0m
[32m[I 2022-10-19 18:25:05,497][0m Trial 15 finished with value: 0.2844441188051378 and parameters: {'lsvc_rbfs_kernel_gamma': 28.13737519344854, 'lsvc_rbfs_kernel_n_components': 100, 'lsvc_rbfs_dual': False, 'lsvc_rbfs_C': 0.05944151600824357, 'lsvc_rbfs_max_iter': 2000}. Best is trial 0 with value: 0.284444.[0m
[32m[I 2022-10-19 18:25:11,230][0m Trial 16 finished with value: 0.2844441188051378 and parameters: {'lsvc_rbfs_kernel_gamma': 0.9013113851564445, 'lsvc_rbfs_kernel_n_components': 50, 'lsvc_rbfs_dual': False, 'lsvc_rbfs_C': 1.0287885261971588, 'lsvc_rbfs_max_iter': 2000}. Best is trial 0 with value: 0.284444.[0m
[32m[I 2022-10-19 18:25:22,969][0m Trial 17 finished with value: 0.2844441188051378 and parameters: {'lsvc_rbfs_kernel_gamma': 4.2552617116637395, 'lsvc_rbfs_kernel_n_components': 150, 'lsvc_rbfs_dual': False, 'lsvc_rbfs_C': 0.0003438697552105531, 'lsvc_rbfs_max_iter': 2000}. Best is trial 0 with value: 0.284444.[0m
