[32m[I 2022-10-19 16:12:04,444][0m Trial 29 finished with value: 0.8468527798566332 and parameters: {'bnb_alpha': 0.45, 'bnb_binarize': 0.30000000000000004, 'bnb_fit_prior': True}. Best is trial 31 with value: 0.846853.[0m
[32m[I 2022-10-19 16:12:04,459][0m Trial 26 finished with value: 0.8468527798566332 and parameters: {'bnb_alpha': 0.45, 'bnb_binarize': 0.30000000000000004, 'bnb_fit_prior': True}. Best is trial 31 with value: 0.846853.[0m
[32m[I 2022-10-19 16:12:05,225][0m Trial 32 finished with value: 0.846879304059287 and parameters: {'bnb_alpha': 0.1, 'bnb_binarize': 0.30000000000000004, 'bnb_fit_prior': True}. Best is trial 32 with value: 0.846879.[0m
[32m[I 2022-10-19 16:12:05,288][0m EarlyStopping exceeded for BernoulliNB; no new best scores on iters 20.[0m
[32m[I 2022-10-19 16:12:05,288][0m Study finished.[0m
[32m[I 2022-10-19 16:12:05,320][0m --------------------------------------------------------------------------------[0m
[32m[I 2022-10-19 16:12:05,335][0m --------------------              CDClassifier              --------------------[0m
[32m[I 2022-10-19 16:12:05,335][0m --------------------------------------------------------------------------------[0m
[32m[I 2022-10-19 16:12:05,351][0m A new study created in RDB with name: CDClassifier_b9881135[0m
[32m[I 2022-10-19 16:12:05,367][0m Study started.[0m
[32m[I 2022-10-19 16:14:20,392][0m Trial 2 finished with value: 0.9033961251607454 and parameters: {'cdc_loss': 'log', 'cdc_penalty': 'l1', 'cdc_C': 20.201429680099174, 'cdc_alpha': 55.21014412893084, 'cdc_selection': 'uniform'}. Best is trial 2 with value: 0.903396.[0m
[32m[I 2022-10-19 16:14:42,289][0m Trial 3 finished with value: 0.832523051356641 and parameters: {'cdc_loss': 'log', 'cdc_penalty': 'l1/l2', 'cdc_C': 22.763757843250847, 'cdc_alpha': 0.04370159526021039, 'cdc_selection': 'uniform'}. Best is trial 2 with value: 0.951261.[0m
[32m[I 2022-10-19 16:14:42,931][0m Trial 7 finished with value: 0.904753158385941 and parameters: {'cdc_loss': 'squared_hinge', 'cdc_penalty': 'l2', 'cdc_C': 0.011779572730042251, 'cdc_alpha': 0.1889468035698238, 'cdc_selection': 'uniform'}. Best is trial 7 with value: 0.951261.[0m
[32m[I 2022-10-19 16:14:43,181][0m Trial 5 finished with value: 0.00128765656199791 and parameters: {'cdc_loss': 'log', 'cdc_penalty': 'l2', 'cdc_C': 223.7193695670506, 'cdc_alpha': 7.200154914700379, 'cdc_selection': 'uniform'}. Best is trial 6 with value: 0.951261.[0m
[32m[I 2022-10-19 16:14:43,291][0m Trial 6 finished with value: 0.9512612201868526 and parameters: {'cdc_loss': 'squared_hinge', 'cdc_penalty': 'l2', 'cdc_C': 0.11698798383040436, 'cdc_alpha': 184.91458378741982, 'cdc_selection': 'cyclic'}. Best is trial 6 with value: 0.951261.[0m
[32m[I 2022-10-19 16:14:44,119][0m Trial 4 finished with value: 0.898287323433568 and parameters: {'cdc_loss': 'modified_huber', 'cdc_penalty': 'l1', 'cdc_C': 5.107230463754866, 'cdc_alpha': 1.0281719853315119, 'cdc_selection': 'uniform'}. Best is trial 6 with value: 0.951261.[0m
[32m[I 2022-10-19 16:17:07,806][0m Trial 8 finished with value: 0.8888483636799324 and parameters: {'cdc_loss': 'log', 'cdc_penalty': 'l1', 'cdc_C': 287.3543057828517, 'cdc_alpha': 0.004664918663694162, 'cdc_selection': 'uniform'}. Best is trial 6 with value: 0.951261.[0m
[32m[I 2022-10-19 16:18:04,287][0m Trial 9 finished with value: 0.9524526198367209 and parameters: {'cdc_loss': 'squared_hinge', 'cdc_penalty': 'l2', 'cdc_C': 49.04672224798345, 'cdc_alpha': 0.1153904055339085, 'cdc_selection': 'cyclic'}. Best is trial 9 with value: 0.952453.[0m
[32m[I 2022-10-19 16:18:27,541][0m Trial 0 finished with value: 0.2844441188051378 and parameters: {'cdc_loss': 'squared', 'cdc_penalty': 'l1/l2', 'cdc_C': 0.019113972819725152, 'cdc_alpha': 0.0011810914963381505, 'cdc_selection': 'uniform'}. Best is trial 9 with value: 0.952453.[0m
[32m[I 2022-10-19 16:19:08,996][0m Trial 13 finished with value: 0.9524526198367209 and parameters: {'cdc_loss': 'squared_hinge', 'cdc_penalty': 'l1', 'cdc_C': 208.2701764533484, 'cdc_alpha': 0.00789567678923958, 'cdc_selection': 'cyclic'}. Best is trial 9 with value: 0.952453.[0m
[32m[I 2022-10-19 16:19:10,295][0m Trial 14 finished with value: 0.8888483636799324 and parameters: {'cdc_loss': 'log', 'cdc_penalty': 'l1', 'cdc_C': 4.283318574653123, 'cdc_alpha': 0.020316990240227966, 'cdc_selection': 'uniform'}. Best is trial 9 with value: 0.952453.[0m
[32m[I 2022-10-19 16:19:12,625][0m Trial 1 finished with value: 0.9520697698329859 and parameters: {'cdc_loss': 'squared_hinge', 'cdc_penalty': 'l1/l2', 'cdc_C': 0.6293588962364242, 'cdc_alpha': 0.00238586393375838, 'cdc_selection': 'cyclic'}. Best is trial 9 with value: 0.952453.[0m
[32m[I 2022-10-19 16:19:15,801][0m Trial 10 finished with value: 0.832523051356641 and parameters: {'cdc_loss': 'log', 'cdc_penalty': 'l1/l2', 'cdc_C': 322.3064888266225, 'cdc_alpha': 0.05735807575652885, 'cdc_selection': 'uniform'}. Best is trial 9 with value: 0.952453.[0m
[32m[I 2022-10-19 16:23:41,087][0m Trial 17 finished with value: 0.9524362858161857 and parameters: {'cdc_loss': 'squared_hinge', 'cdc_penalty': 'l2', 'cdc_C': 45.40228168396732, 'cdc_alpha': 0.7715935229876573, 'cdc_selection': 'cyclic'}. Best is trial 9 with value: 0.952453.[0m
[32m[I 2022-10-19 16:23:41,279][0m Trial 19 finished with value: 0.9524526198367209 and parameters: {'cdc_loss': 'squared_hinge', 'cdc_penalty': 'l2', 'cdc_C': 922.1683275451344, 'cdc_alpha': 0.506314141663422, 'cdc_selection': 'cyclic'}. Best is trial 9 with value: 0.952453.[0m
[32m[I 2022-10-19 16:24:27,547][0m Trial 20 finished with value: 0.9524526198367209 and parameters: {'cdc_loss': 'squared_hinge', 'cdc_penalty': 'l2', 'cdc_C': 799.535917983697, 'cdc_alpha': 0.5326246625881101, 'cdc_selection': 'cyclic'}. Best is trial 9 with value: 0.952453.[0m
[32m[I 2022-10-19 16:24:27,704][0m Trial 16 finished with value: 0.7192410297044017 and parameters: {'cdc_loss': 'squared_hinge', 'cdc_penalty': 'l1/l2', 'cdc_C': 0.00332718648317684, 'cdc_alpha': 991.0809613079524, 'cdc_selection': 'cyclic'}. Best is trial 9 with value: 0.952453.[0m
[32m[I 2022-10-19 16:24:27,704][0m Trial 18 finished with value: 0.9524526198367209 and parameters: {'cdc_loss': 'squared_hinge', 'cdc_penalty': 'l2', 'cdc_C': 913.1105199817343, 'cdc_alpha': 0.7362514474594256, 'cdc_selection': 'cyclic'}. Best is trial 9 with value: 0.952453.[0m
[32m[I 2022-10-19 16:24:27,892][0m Trial 11 finished with value: 0.9524017993003032 and parameters: {'cdc_loss': 'squared_hinge', 'cdc_penalty': 'l1/l2', 'cdc_C': 405.71835893657953, 'cdc_alpha': 56.03226787397726, 'cdc_selection': 'cyclic'}. Best is trial 9 with value: 0.952453.[0m
[32m[I 2022-10-19 16:24:28,126][0m Trial 12 finished with value: 0.9521581265285602 and parameters: {'cdc_loss': 'modified_huber', 'cdc_penalty': 'l1/l2', 'cdc_C': 27.229861072476172, 'cdc_alpha': 0.20221795852599656, 'cdc_selection': 'cyclic'}. Best is trial 9 with value: 0.952453.[0m
[32m[I 2022-10-19 16:24:28,204][0m Trial 15 finished with value: 0.9515050442471091 and parameters: {'cdc_loss': 'modified_huber', 'cdc_penalty': 'l1/l2', 'cdc_C': 0.01836825949233444, 'cdc_alpha': 0.013331820617061202, 'cdc_selection': 'cyclic'}. Best is trial 9 with value: 0.952453.[0m
[32m[I 2022-10-19 16:24:28,376][0m Trial 21 finished with value: 0.9524602041168543 and parameters: {'cdc_loss': 'squared_hinge', 'cdc_penalty': 'l2', 'cdc_C': 711.4971179005644, 'cdc_alpha': 0.013662238060390916, 'cdc_selection': 'cyclic'}. Best is trial 21 with value: 0.95246.[0m
[32m[I 2022-10-19 16:24:28,454][0m EarlyStopping exceeded for CDClassifier; no new best scores on iters 20.[0m
[32m[I 2022-10-19 16:24:28,454][0m Study finished.[0m
[32m[I 2022-10-19 16:24:28,486][0m --------------------------------------------------------------------------------[0m
[32m[I 2022-10-19 16:24:28,486][0m --------------------              ComplementNB              --------------------[0m
[32m[I 2022-10-19 16:24:28,486][0m --------------------------------------------------------------------------------[0m
[32m[I 2022-10-19 16:24:28,517][0m A new study created in RDB with name: ComplementNB_b9881135[0m
[32m[I 2022-10-19 16:24:28,517][0m Study started.[0m
[32m[I 2022-10-19 16:24:30,861][0m Trial 3 finished with value: 0.4180972744965742 and parameters: {'compnb_alpha': 0.25, 'compnb_fit_prior': True, 'compnb_norm': True}. Best is trial 3 with value: 0.418097.[0m
[32m[I 2022-10-19 16:24:30,924][0m Trial 2 finished with value: 0.4180634609810014 and parameters: {'compnb_alpha': 0.1, 'compnb_fit_prior': True, 'compnb_norm': True}. Best is trial 3 with value: 0.418097.[0m
[32m[I 2022-10-19 16:24:31,112][0m Trial 1 finished with value: 0.4181364617997549 and parameters: {'compnb_alpha': 0.9500000000000001, 'compnb_fit_prior': True, 'compnb_norm': True}. Best is trial 1 with value: 0.418136.[0m
[32m[I 2022-10-19 16:24:31,112][0m Trial 6 finished with value: 0.4181364617997549 and parameters: {'compnb_alpha': 0.75, 'compnb_fit_prior': False, 'compnb_norm': True}. Best is trial 1 with value: 0.418136.[0m
[32m[I 2022-10-19 16:24:31,112][0m Trial 5 finished with value: 0.4181364617997549 and parameters: {'compnb_alpha': 0.8, 'compnb_fit_prior': True, 'compnb_norm': True}. Best is trial 1 with value: 0.41814.[0m
[32m[I 2022-10-19 16:24:31,331][0m Trial 4 finished with value: 0.4180972744965742 and parameters: {'compnb_alpha': 0.25, 'compnb_fit_prior': False, 'compnb_norm': True}. Best is trial 7 with value: 0.41814.[0m
[32m[I 2022-10-19 16:24:31,394][0m Trial 0 finished with value: 0.4181364617997549 and parameters: {'compnb_alpha': 0.4, 'compnb_fit_prior': True, 'compnb_norm': True}. Best is trial 0 with value: 0.41814.[0m
[32m[I 2022-10-19 16:24:31,472][0m Trial 7 finished with value: 0.418140026134891 and parameters: {'compnb_alpha': 0.4, 'compnb_fit_prior': False, 'compnb_norm': False}. Best is trial 7 with value: 0.41814.[0m
[32m[I 2022-10-19 16:24:33,717][0m Trial 8 finished with value: 0.418140026134891 and parameters: {'compnb_alpha': 0.30000000000000004, 'compnb_fit_prior': False, 'compnb_norm': False}. Best is trial 7 with value: 0.41814.[0m
[32m[I 2022-10-19 16:24:33,717][0m Trial 9 finished with value: 0.4181364617997549 and parameters: {'compnb_alpha': 1.0, 'compnb_fit_prior': True, 'compnb_norm': True}. Best is trial 7 with value: 0.41814.[0m
[32m[I 2022-10-19 16:24:34,562][0m Trial 10 finished with value: 0.4181364617997549 and parameters: {'compnb_alpha': 0.35000000000000003, 'compnb_fit_prior': True, 'compnb_norm': True}. Best is trial 7 with value: 0.41814.[0m
[32m[I 2022-10-19 16:24:34,562][0m Trial 14 finished with value: 0.418140026134891 and parameters: {'compnb_alpha': 0.8, 'compnb_fit_prior': False, 'compnb_norm': False}. Best is trial 7 with value: 0.41814.[0m
[32m[I 2022-10-19 16:24:34,562][0m Trial 12 finished with value: 0.4181364617997549 and parameters: {'compnb_alpha': 0.8, 'compnb_fit_prior': True, 'compnb_norm': True}. Best is trial 7 with value: 0.41814.[0m
[32m[I 2022-10-19 16:24:34,562][0m Trial 15 finished with value: 0.4181364617997549 and parameters: {'compnb_alpha': 0.55, 'compnb_fit_prior': False, 'compnb_norm': True}. Best is trial 7 with value: 0.41814.[0m
[32m[I 2022-10-19 16:24:34,625][0m Trial 13 finished with value: 0.418140026134891 and parameters: {'compnb_alpha': 0.1, 'compnb_fit_prior': True, 'compnb_norm': False}. Best is trial 7 with value: 0.41814.[0m
[32m[I 2022-10-19 16:24:34,687][0m Trial 11 finished with value: 0.4181364617997549 and parameters: {'compnb_alpha': 0.9500000000000001, 'compnb_fit_prior': True, 'compnb_norm': True}. Best is trial 7 with value: 0.41814.[0m
[32m[I 2022-10-19 16:24:36,515][0m Trial 17 finished with value: 0.418140026134891 and parameters: {'compnb_alpha': 0.6000000000000001, 'compnb_fit_prior': False, 'compnb_norm': False}. Best is trial 17 with value: 0.41814.[0m
[32m[I 2022-10-19 16:24:36,515][0m Trial 16 finished with value: 0.418140026134891 and parameters: {'compnb_alpha': 0.6000000000000001, 'compnb_fit_prior': False, 'compnb_norm': False}. Best is trial 17 with value: 0.41814.[0m
[32m[I 2022-10-19 16:24:37,519][0m Trial 21 finished with value: 0.418140026134891 and parameters: {'compnb_alpha': 0.45, 'compnb_fit_prior': False, 'compnb_norm': False}. Best is trial 23 with value: 0.41814.[0m
[32m[I 2022-10-19 16:24:37,519][0m Trial 23 finished with value: 0.418140026134891 and parameters: {'compnb_alpha': 0.55, 'compnb_fit_prior': False, 'compnb_norm': False}. Best is trial 23 with value: 0.41814.[0m
[32m[I 2022-10-19 16:24:37,660][0m Trial 19 finished with value: 0.418140026134891 and parameters: {'compnb_alpha': 0.55, 'compnb_fit_prior': False, 'compnb_norm': False}. Best is trial 23 with value: 0.41814.[0m
[32m[I 2022-10-19 16:24:37,660][0m Trial 22 finished with value: 0.418140026134891 and parameters: {'compnb_alpha': 0.55, 'compnb_fit_prior': False, 'compnb_norm': False}. Best is trial 23 with value: 0.41814.[0m
[32m[I 2022-10-19 16:24:37,816][0m Trial 20 finished with value: 0.418140026134891 and parameters: {'compnb_alpha': 0.55, 'compnb_fit_prior': False, 'compnb_norm': False}. Best is trial 23 with value: 0.41814.[0m
[32m[I 2022-10-19 16:24:37,879][0m Trial 18 finished with value: 0.418140026134891 and parameters: {'compnb_alpha': 0.55, 'compnb_fit_prior': False, 'compnb_norm': False}. Best is trial 23 with value: 0.41814.[0m
[32m[I 2022-10-19 16:24:39,187][0m Trial 24 finished with value: 0.418140026134891 and parameters: {'compnb_alpha': 0.7000000000000001, 'compnb_fit_prior': False, 'compnb_norm': False}. Best is trial 25 with value: 0.41814.[0m
[32m[I 2022-10-19 16:24:39,187][0m Trial 25 finished with value: 0.418140026134891 and parameters: {'compnb_alpha': 0.65, 'compnb_fit_prior': False, 'compnb_norm': False}. Best is trial 25 with value: 0.41814.[0m
[32m[I 2022-10-19 16:24:39,735][0m Trial 30 finished with value: 0.418140026134891 and parameters: {'compnb_alpha': 0.7000000000000001, 'compnb_fit_prior': False, 'compnb_norm': False}. Best is trial 30 with value: 0.41814.[0m
[32m[I 2022-10-19 16:24:39,750][0m Trial 29 finished with value: 0.418140026134891 and parameters: {'compnb_alpha': 0.7000000000000001, 'compnb_fit_prior': False, 'compnb_norm': False}. Best is trial 30 with value: 0.41814.[0m
[32m[I 2022-10-19 16:24:39,891][0m Trial 27 finished with value: 0.418140026134891 and parameters: {'compnb_alpha': 0.45, 'compnb_fit_prior': False, 'compnb_norm': False}. Best is trial 30 with value: 0.41814.[0m
[32m[I 2022-10-19 16:24:39,954][0m Trial 26 finished with value: 0.418140026134891 and parameters: {'compnb_alpha': 0.7000000000000001, 'compnb_fit_prior': False, 'compnb_norm': False}. Best is trial 30 with value: 0.41814.[0m
[32m[I 2022-10-19 16:24:40,016][0m Trial 28 finished with value: 0.418140026134891 and parameters: {'compnb_alpha': 0.7000000000000001, 'compnb_fit_prior': False, 'compnb_norm': False}. Best is trial 30 with value: 0.41814.[0m
[32m[I 2022-10-19 16:24:40,094][0m EarlyStopping exceeded for ComplementNB; no new best scores on iters 20.[0m
[32m[I 2022-10-19 16:24:40,094][0m Study finished.[0m
[32m[I 2022-10-19 16:24:40,126][0m --------------------------------------------------------------------------------[0m
[32m[I 2022-10-19 16:24:40,126][0m --------------------         DecisionTreeClassifier         --------------------[0m
[32m[I 2022-10-19 16:24:40,126][0m --------------------------------------------------------------------------------[0m
[32m[I 2022-10-19 16:24:40,157][0m A new study created in RDB with name: DecisionTreeClassifier_b9881135[0m
[32m[I 2022-10-19 16:24:40,157][0m Study started.[0m
[32m[I 2022-10-19 16:24:41,634][0m Trial 5 finished with value: 0.9694721590207485 and parameters: {'dtc_criterion': 'gini', 'dtc_splitter': 'random', 'dtc_min_samples_split': 41, 'dtc_min_samples_leaf': 30, 'dtc_max_features': 36}. Best is trial 6 with value: 0.991469.[0m
[32m[I 2022-10-19 16:24:41,634][0m Trial 2 finished with value: 0.9900810720799352 and parameters: {'dtc_criterion': 'gini', 'dtc_splitter': 'random', 'dtc_min_samples_split': 6, 'dtc_min_samples_leaf': 36, 'dtc_max_features': 38}. Best is trial 3 with value: 0.991469.[0m
[32m[I 2022-10-19 16:24:41,776][0m Trial 3 finished with value: 0.9914694210338036 and parameters: {'dtc_criterion': 'entropy', 'dtc_splitter': 'random', 'dtc_min_samples_split': 37, 'dtc_min_samples_leaf': 40, 'dtc_max_features': 31}. Best is trial 3 with value: 0.991469.[0m
[32m[I 2022-10-19 16:24:41,776][0m Trial 6 finished with value: 0.9913860238485248 and parameters: {'dtc_criterion': 'entropy', 'dtc_splitter': 'best', 'dtc_min_samples_split': 42, 'dtc_min_samples_leaf': 10, 'dtc_max_features': 13}. Best is trial 3 with value: 0.991469.[0m
[32m[I 2022-10-19 16:24:42,151][0m Trial 1 finished with value: 0.9915185607798337 and parameters: {'dtc_criterion': 'gini', 'dtc_splitter': 'best', 'dtc_min_samples_split': 21, 'dtc_min_samples_leaf': 37, 'dtc_max_features': 31}. Best is trial 1 with value: 0.991587.[0m
[32m[I 2022-10-19 16:24:42,277][0m Trial 4 finished with value: 0.9915867229530546 and parameters: {'dtc_criterion': 'gini', 'dtc_splitter': 'best', 'dtc_min_samples_split': 12, 'dtc_min_samples_leaf': 40, 'dtc_max_features': 27}. Best is trial 0 with value: 0.991654.[0m
[32m[I 2022-10-19 16:24:42,277][0m Trial 7 finished with value: 0.9916539760566847 and parameters: {'dtc_criterion': 'entropy', 'dtc_splitter': 'best', 'dtc_min_samples_split': 26, 'dtc_min_samples_leaf': 40, 'dtc_max_features': 24}. Best is trial 7 with value: 0.991654.[0m
[32m[I 2022-10-19 16:24:42,356][0m Trial 0 finished with value: 0.9916346502424702 and parameters: {'dtc_criterion': 'gini', 'dtc_splitter': 'best', 'dtc_min_samples_split': 24, 'dtc_min_samples_leaf': 3, 'dtc_max_features': 24}. Best is trial 7 with value: 0.991654.[0m
[32m[I 2022-10-19 16:24:43,185][0m Trial 8 finished with value: 0.9623049103363097 and parameters: {'dtc_criterion': 'gini', 'dtc_splitter': 'random', 'dtc_min_samples_split': 20, 'dtc_min_samples_leaf': 48, 'dtc_max_features': 23}. Best is trial 7 with value: 0.991654.[0m
[32m[I 2022-10-19 16:24:43,248][0m Trial 11 finished with value: 0.545650096941471 and parameters: {'dtc_criterion': 'entropy', 'dtc_splitter': 'best', 'dtc_min_samples_split': 45, 'dtc_min_samples_leaf': 14, 'dtc_max_features': 3}. Best is trial 7 with value: 0.991654.[0m
[32m[I 2022-10-19 16:24:43,498][0m Trial 10 finished with value: 0.9917591723777527 and parameters: {'dtc_criterion': 'entropy', 'dtc_splitter': 'random', 'dtc_min_samples_split': 44, 'dtc_min_samples_leaf': 19, 'dtc_max_features': 45}. Best is trial 10 with value: 0.991759.[0m
[32m[I 2022-10-19 16:24:43,827][0m Trial 12 finished with value: 0.9901526831712562 and parameters: {'dtc_criterion': 'entropy', 'dtc_splitter': 'random', 'dtc_min_samples_split': 30, 'dtc_min_samples_leaf': 45, 'dtc_max_features': 16}. Best is trial 10 with value: 0.991759.[0m
[32m[I 2022-10-19 16:24:44,078][0m Trial 9 finished with value: 0.9915126015579889 and parameters: {'dtc_criterion': 'gini', 'dtc_splitter': 'best', 'dtc_min_samples_split': 28, 'dtc_min_samples_leaf': 2, 'dtc_max_features': 35}. Best is trial 10 with value: 0.991759.[0m
[32m[I 2022-10-19 16:24:44,234][0m Trial 13 finished with value: 0.9915553836846135 and parameters: {'dtc_criterion': 'entropy', 'dtc_splitter': 'random', 'dtc_min_samples_split': 48, 'dtc_min_samples_leaf': 25, 'dtc_max_features': 48}. Best is trial 10 with value: 0.991759.[0m
[32m[I 2022-10-19 16:24:44,406][0m Trial 14 finished with value: 0.9916682074606006 and parameters: {'dtc_criterion': 'gini', 'dtc_splitter': 'best', 'dtc_min_samples_split': 42, 'dtc_min_samples_leaf': 42, 'dtc_max_features': 25}. Best is trial 10 with value: 0.991759.[0m
[32m[I 2022-10-19 16:24:44,594][0m Trial 15 finished with value: 0.9915279670319372 and parameters: {'dtc_criterion': 'entropy', 'dtc_splitter': 'best', 'dtc_min_samples_split': 9, 'dtc_min_samples_leaf': 11, 'dtc_max_features': 34}. Best is trial 10 with value: 0.991759.[0m
[32m[I 2022-10-19 16:24:45,001][0m Trial 18 finished with value: 0.9916099954017983 and parameters: {'dtc_criterion': 'entropy', 'dtc_splitter': 'random', 'dtc_min_samples_split': 32, 'dtc_min_samples_leaf': 22, 'dtc_max_features': 45}. Best is trial 10 with value: 0.991759.[0m
[32m[I 2022-10-19 16:24:45,220][0m Trial 17 finished with value: 0.991512468934342 and parameters: {'dtc_criterion': 'entropy', 'dtc_splitter': 'best', 'dtc_min_samples_split': 32, 'dtc_min_samples_leaf': 22, 'dtc_max_features': 47}. Best is trial 10 with value: 0.991759.[0m
[32m[I 2022-10-19 16:24:45,220][0m Trial 16 finished with value: 0.9917184422554488 and parameters: {'dtc_criterion': 'entropy', 'dtc_splitter': 'best', 'dtc_min_samples_split': 32, 'dtc_min_samples_leaf': 25, 'dtc_max_features': 50}. Best is trial 10 with value: 0.991759.[0m
[32m[I 2022-10-19 16:24:45,580][0m Trial 20 finished with value: 0.9915715318894206 and parameters: {'dtc_criterion': 'entropy', 'dtc_splitter': 'random', 'dtc_min_samples_split': 35, 'dtc_min_samples_leaf': 20, 'dtc_max_features': 48}. Best is trial 10 with value: 0.991759.[0m
[32m[I 2022-10-19 16:24:45,580][0m Trial 19 finished with value: 0.9915228308002035 and parameters: {'dtc_criterion': 'entropy', 'dtc_splitter': 'best', 'dtc_min_samples_split': 33, 'dtc_min_samples_leaf': 23, 'dtc_max_features': 49}. Best is trial 10 with value: 0.991759.[0m
