[32m[I 2022-10-20 00:15:32,332][0m Trial 23 finished with value: 0.9872397701116491 and parameters: {'xgbc_n_estimators': 170, 'xgbc_use_label_encoder': False, 'xgbc_learning_rate': 9.074147452299494e-05, 'xgbc_booster': 'dart', 'xgbc_gamma': 3.662810221897841e-05}. Best is trial 13 with value: 0.99184.[0m
[32m[I 2022-10-20 00:15:32,410][0m EarlyStopping exceeded for XGBClassifier; no new best scores on iters 20.[0m
[32m[I 2022-10-20 00:15:32,410][0m Study finished.[0m
[32m[I 2022-10-20 00:15:33,136][0m Optimization finished.[0m
