[32m[I 2023-02-26 23:14:55,812][0m Trial 15 finished with value: 0.3781255596969302 and parameters: {'rusbc_n_estimators': 75, 'rusbc_learning_rate': 0.0032606693893377932, 'rusbc_sampling_strategy': 'not majority'}. Best is trial 10 with value: 0.894449.[0m
[32m[I 2023-02-26 23:16:20,844][0m Trial 16 finished with value: 0.41595712552491176 and parameters: {'rusbc_n_estimators': 100, 'rusbc_learning_rate': 0.11307220631380097, 'rusbc_sampling_strategy': 'all'}. Best is trial 10 with value: 0.894449.[0m
[32m[I 2023-02-26 23:17:03,514][0m Trial 17 finished with value: 0.39555768501699523 and parameters: {'rusbc_n_estimators': 50, 'rusbc_learning_rate': 0.006048132857636197, 'rusbc_sampling_strategy': 'not minority'}. Best is trial 10 with value: 0.894449.[0m
[32m[I 2023-02-26 23:18:07,035][0m Trial 18 finished with value: 0.4036516267204078 and parameters: {'rusbc_n_estimators': 75, 'rusbc_learning_rate': 0.008607307511030097, 'rusbc_sampling_strategy': 'not minority'}. Best is trial 10 with value: 0.894449.[0m
[32m[I 2023-02-26 23:18:49,637][0m Trial 19 finished with value: 0.24757593593632823 and parameters: {'rusbc_n_estimators': 50, 'rusbc_learning_rate': 0.00048460985783523004, 'rusbc_sampling_strategy': 'not minority'}. Best is trial 10 with value: 0.894449.[0m
[32m[I 2023-02-26 23:18:49,700][0m Study finished.[0m
[32m[I 2023-02-26 23:18:49,731][0m --------------------------------------------------------------------------------[0m
[32m[I 2023-02-26 23:18:49,731][0m --------------------             SGDClassifier              --------------------[0m
[32m[I 2023-02-26 23:18:49,731][0m --------------------------------------------------------------------------------[0m
[32m[I 2023-02-26 23:18:49,763][0m A new study created in RDB with name: SGDClassifier_03691551[0m
[32m[I 2023-02-26 23:18:49,763][0m Study started.[0m
[32m[I 2023-02-26 23:19:31,700][0m Trial 0 finished with value: 0.2694675841193563 and parameters: {'sgdc_loss': 'modified_huber', 'sgdc_penalty': 'elasticnet', 'sgdc_alpha': 123.20447161062779, 'sgdc_l1_ratio': 0.0, 'sgdc_learning_rate': 'invscaling', 'sgdc_eta0': 0.022677576070306845, 'sgdc_early_stopping': True, 'sgdc_validation_fraction': 0.25, 'sgdc_n_iter_no_change': 10}. Best is trial 0 with value: 0.269468.[0m
[32m[I 2023-02-26 23:22:54,933][0m Trial 1 finished with value: 0.7967944487299323 and parameters: {'sgdc_loss': 'log', 'sgdc_penalty': 'elasticnet', 'sgdc_alpha': 7.311828198908316e-06, 'sgdc_l1_ratio': 0.4, 'sgdc_learning_rate': 'adaptive', 'sgdc_eta0': 0.03283049691363495, 'sgdc_early_stopping': True, 'sgdc_validation_fraction': 0.25, 'sgdc_n_iter_no_change': 10}. Best is trial 1 with value: 0.796794.[0m
[32m[I 2023-02-26 23:23:28,825][0m Trial 2 finished with value: 0.7004592492898953 and parameters: {'sgdc_loss': 'hinge', 'sgdc_penalty': 'elasticnet', 'sgdc_alpha': 1.1622394102580644e-06, 'sgdc_l1_ratio': 0.2, 'sgdc_learning_rate': 'invscaling', 'sgdc_eta0': 538.986925062138, 'sgdc_early_stopping': True, 'sgdc_validation_fraction': 0.25, 'sgdc_n_iter_no_change': 10}. Best is trial 1 with value: 0.796794.[0m
[32m[I 2023-02-26 23:26:02,963][0m Trial 3 finished with value: 0.7259385110185713 and parameters: {'sgdc_loss': 'modified_huber', 'sgdc_penalty': 'elasticnet', 'sgdc_alpha': 0.07704060571741263, 'sgdc_l1_ratio': 0.6000000000000001, 'sgdc_learning_rate': 'adaptive', 'sgdc_eta0': 0.0011240755836997803, 'sgdc_early_stopping': True, 'sgdc_validation_fraction': 0.25, 'sgdc_n_iter_no_change': 10}. Best is trial 1 with value: 0.796794.[0m
[32m[I 2023-02-26 23:30:15,634][0m Trial 4 finished with value: 0.6990311709111714 and parameters: {'sgdc_loss': 'hinge', 'sgdc_penalty': 'elasticnet', 'sgdc_alpha': 56.48826148658724, 'sgdc_l1_ratio': 0.4, 'sgdc_learning_rate': 'adaptive', 'sgdc_eta0': 5.029518460306476, 'sgdc_early_stopping': True, 'sgdc_validation_fraction': 0.25, 'sgdc_n_iter_no_change': 10}. Best is trial 1 with value: 0.796794.[0m
[32m[I 2023-02-26 23:30:42,769][0m Trial 5 finished with value: 0.3781255596969302 and parameters: {'sgdc_loss': 'log', 'sgdc_penalty': 'elasticnet', 'sgdc_alpha': 0.010604540213869796, 'sgdc_l1_ratio': 0.6000000000000001, 'sgdc_learning_rate': 'constant', 'sgdc_eta0': 577.6943758586677, 'sgdc_early_stopping': True, 'sgdc_validation_fraction': 0.25, 'sgdc_n_iter_no_change': 10}. Best is trial 1 with value: 0.796794.[0m
[32m[I 2023-02-26 23:31:29,822][0m Trial 6 finished with value: 0.7134147884906265 and parameters: {'sgdc_loss': 'modified_huber', 'sgdc_penalty': 'elasticnet', 'sgdc_alpha': 3.4630262417851037, 'sgdc_l1_ratio': 0.2, 'sgdc_learning_rate': 'optimal', 'sgdc_eta0': 0.006922014607581423, 'sgdc_early_stopping': True, 'sgdc_validation_fraction': 0.25, 'sgdc_n_iter_no_change': 10}. Best is trial 1 with value: 0.796794.[0m
[32m[I 2023-02-26 23:32:01,620][0m Trial 7 finished with value: 0.6106484668458513 and parameters: {'sgdc_loss': 'squared_hinge', 'sgdc_penalty': 'elasticnet', 'sgdc_alpha': 2.3817410461997666e-05, 'sgdc_l1_ratio': 0.2, 'sgdc_learning_rate': 'constant', 'sgdc_eta0': 13.74212246382274, 'sgdc_early_stopping': True, 'sgdc_validation_fraction': 0.25, 'sgdc_n_iter_no_change': 10}. Best is trial 1 with value: 0.796794.[0m
[32m[I 2023-02-26 23:32:35,230][0m Trial 8 finished with value: 0.750655340542364 and parameters: {'sgdc_loss': 'hinge', 'sgdc_penalty': 'elasticnet', 'sgdc_alpha': 0.0005978732690253822, 'sgdc_l1_ratio': 0.4, 'sgdc_learning_rate': 'invscaling', 'sgdc_eta0': 0.24586358704601458, 'sgdc_early_stopping': True, 'sgdc_validation_fraction': 0.25, 'sgdc_n_iter_no_change': 10}. Best is trial 1 with value: 0.796794.[0m
[32m[I 2023-02-26 23:33:12,193][0m Trial 9 finished with value: 0.720919783429348 and parameters: {'sgdc_loss': 'squared_hinge', 'sgdc_penalty': 'elasticnet', 'sgdc_alpha': 1.4351580972827779e-05, 'sgdc_l1_ratio': 0.6000000000000001, 'sgdc_learning_rate': 'invscaling', 'sgdc_eta0': 0.24727094959206933, 'sgdc_early_stopping': True, 'sgdc_validation_fraction': 0.25, 'sgdc_n_iter_no_change': 10}. Best is trial 1 with value: 0.796794.[0m
[32m[I 2023-02-26 23:36:21,288][0m Trial 10 finished with value: 0.7949339001371144 and parameters: {'sgdc_loss': 'log', 'sgdc_penalty': 'elasticnet', 'sgdc_alpha': 0.0008279375353429877, 'sgdc_l1_ratio': 1.0, 'sgdc_learning_rate': 'adaptive', 'sgdc_eta0': 0.04061596199241787, 'sgdc_early_stopping': True, 'sgdc_validation_fraction': 0.25, 'sgdc_n_iter_no_change': 10}. Best is trial 1 with value: 0.796794.[0m
[32m[I 2023-02-26 23:39:30,432][0m Trial 11 finished with value: 0.7953666928587697 and parameters: {'sgdc_loss': 'log', 'sgdc_penalty': 'elasticnet', 'sgdc_alpha': 0.0008274739369874459, 'sgdc_l1_ratio': 1.0, 'sgdc_learning_rate': 'adaptive', 'sgdc_eta0': 0.039848895571378225, 'sgdc_early_stopping': True, 'sgdc_validation_fraction': 0.25, 'sgdc_n_iter_no_change': 10}. Best is trial 1 with value: 0.796794.[0m
[32m[I 2023-02-26 23:41:58,251][0m Trial 12 finished with value: 0.7945743254157207 and parameters: {'sgdc_loss': 'log', 'sgdc_penalty': 'elasticnet', 'sgdc_alpha': 0.00010734352936918715, 'sgdc_l1_ratio': 1.0, 'sgdc_learning_rate': 'adaptive', 'sgdc_eta0': 0.0011834724786580213, 'sgdc_early_stopping': True, 'sgdc_validation_fraction': 0.25, 'sgdc_n_iter_no_change': 10}. Best is trial 1 with value: 0.796794.[0m
[32m[I 2023-02-26 23:46:21,346][0m Trial 13 finished with value: 0.8003509322475414 and parameters: {'sgdc_loss': 'log', 'sgdc_penalty': 'elasticnet', 'sgdc_alpha': 1.125403336745401e-06, 'sgdc_l1_ratio': 0.8, 'sgdc_learning_rate': 'adaptive', 'sgdc_eta0': 0.4377699570148469, 'sgdc_early_stopping': True, 'sgdc_validation_fraction': 0.25, 'sgdc_n_iter_no_change': 10}. Best is trial 13 with value: 0.800351.[0m
[32m[I 2023-02-26 23:47:04,976][0m Trial 14 finished with value: 0.7900560131442548 and parameters: {'sgdc_loss': 'log', 'sgdc_penalty': 'elasticnet', 'sgdc_alpha': 1.4732934188202582e-06, 'sgdc_l1_ratio': 0.8, 'sgdc_learning_rate': 'optimal', 'sgdc_eta0': 1.5944785295977433, 'sgdc_early_stopping': True, 'sgdc_validation_fraction': 0.25, 'sgdc_n_iter_no_change': 10}. Best is trial 13 with value: 0.800351.[0m
[32m[I 2023-02-26 23:51:36,932][0m Trial 15 finished with value: 0.7113077780991138 and parameters: {'sgdc_loss': 'log', 'sgdc_penalty': 'elasticnet', 'sgdc_alpha': 0.40263200302030905, 'sgdc_l1_ratio': 0.8, 'sgdc_learning_rate': 'adaptive', 'sgdc_eta0': 39.10430765077507, 'sgdc_early_stopping': True, 'sgdc_validation_fraction': 0.25, 'sgdc_n_iter_no_change': 10}. Best is trial 13 with value: 0.800351.[0m
[32m[I 2023-02-26 23:55:24,009][0m Trial 16 finished with value: 0.7990955374423404 and parameters: {'sgdc_loss': 'log', 'sgdc_penalty': 'elasticnet', 'sgdc_alpha': 7.485607290457701e-06, 'sgdc_l1_ratio': 0.8, 'sgdc_learning_rate': 'adaptive', 'sgdc_eta0': 0.2472662353102217, 'sgdc_early_stopping': True, 'sgdc_validation_fraction': 0.25, 'sgdc_n_iter_no_change': 10}. Best is trial 13 with value: 0.800351.[0m
[32m[I 2023-02-26 23:59:43,126][0m Trial 17 finished with value: 0.7695472724273145 and parameters: {'sgdc_loss': 'log', 'sgdc_penalty': 'elasticnet', 'sgdc_alpha': 0.007510375245912675, 'sgdc_l1_ratio': 0.8, 'sgdc_learning_rate': 'adaptive', 'sgdc_eta0': 0.7005155315083063, 'sgdc_early_stopping': True, 'sgdc_validation_fraction': 0.25, 'sgdc_n_iter_no_change': 10}. Best is trial 13 with value: 0.800351.[0m
[32m[I 2023-02-27 00:00:17,537][0m Trial 18 finished with value: 0.7358985141298903 and parameters: {'sgdc_loss': 'squared_hinge', 'sgdc_penalty': 'elasticnet', 'sgdc_alpha': 2.218178633640224e-05, 'sgdc_l1_ratio': 0.8, 'sgdc_learning_rate': 'optimal', 'sgdc_eta0': 0.20626980040637255, 'sgdc_early_stopping': True, 'sgdc_validation_fraction': 0.25, 'sgdc_n_iter_no_change': 10}. Best is trial 13 with value: 0.800351.[0m
[32m[I 2023-02-27 00:00:49,820][0m Trial 19 finished with value: 0.6274088003295873 and parameters: {'sgdc_loss': 'log', 'sgdc_penalty': 'elasticnet', 'sgdc_alpha': 0.00014737029989125345, 'sgdc_l1_ratio': 0.8, 'sgdc_learning_rate': 'constant', 'sgdc_eta0': 114.47579318018225, 'sgdc_early_stopping': True, 'sgdc_validation_fraction': 0.25, 'sgdc_n_iter_no_change': 10}. Best is trial 13 with value: 0.800351.[0m
[32m[I 2023-02-27 00:00:49,882][0m Study finished.[0m
[32m[I 2023-02-27 00:00:49,914][0m --------------------------------------------------------------------------------[0m
[32m[I 2023-02-27 00:00:49,914][0m --------------------    VeryFastDecisionRulesClassifier     --------------------[0m
[32m[I 2023-02-27 00:00:49,914][0m --------------------------------------------------------------------------------[0m
[32m[I 2023-02-27 00:00:49,929][0m A new study created in RDB with name: VeryFastDecisionRulesClassifier_03691551[0m
[32m[I 2023-02-27 00:00:49,945][0m Study started.[0m
[32m[I 2023-02-27 00:04:47,671][0m Trial 0 finished with value: 0.6576137426217968 and parameters: {'vfdrc_ordered_rules': False, 'vfdrc_grace_period': 350, 'vfdrc_tie_threshold': 0.5, 'vfdrc_rule_prediction': 'first_hit', 'vfdrc_max_rules': 20, 'vfdrc_expand_criterion': 'foil_gain', 'vfdrc_remove_poor_atts': False}. Best is trial 0 with value: 0.657614.[0m
[32m[I 2023-02-27 00:08:11,997][0m Trial 1 finished with value: 0.6867679661731924 and parameters: {'vfdrc_ordered_rules': False, 'vfdrc_grace_period': 400, 'vfdrc_tie_threshold': 0.15000000000000002, 'vfdrc_rule_prediction': 'first_hit', 'vfdrc_max_rules': 15, 'vfdrc_expand_criterion': 'info_gain', 'vfdrc_remove_poor_atts': True}. Best is trial 1 with value: 0.686768.[0m
[32m[I 2023-02-27 00:11:43,335][0m Trial 2 finished with value: 0.6151739921596824 and parameters: {'vfdrc_ordered_rules': True, 'vfdrc_grace_period': 250, 'vfdrc_tie_threshold': 0.9500000000000001, 'vfdrc_rule_prediction': 'first_hit', 'vfdrc_max_rules': 10, 'vfdrc_expand_criterion': 'hellinger', 'vfdrc_remove_poor_atts': True}. Best is trial 1 with value: 0.686768.[0m
[32m[I 2023-02-27 00:15:30,434][0m Trial 3 finished with value: 0.7026667181750866 and parameters: {'vfdrc_ordered_rules': True, 'vfdrc_grace_period': 200, 'vfdrc_tie_threshold': 0.30000000000000004, 'vfdrc_rule_prediction': 'first_hit', 'vfdrc_max_rules': 30, 'vfdrc_expand_criterion': 'info_gain', 'vfdrc_remove_poor_atts': False}. Best is trial 3 with value: 0.702667.[0m
[32m[I 2023-02-27 00:18:58,954][0m Trial 4 finished with value: 0.8646115013788693 and parameters: {'vfdrc_ordered_rules': True, 'vfdrc_grace_period': 100, 'vfdrc_tie_threshold': 0.25, 'vfdrc_rule_prediction': 'first_hit', 'vfdrc_max_rules': 30, 'vfdrc_expand_criterion': 'foil_gain', 'vfdrc_remove_poor_atts': True}. Best is trial 4 with value: 0.864612.[0m
[32m[I 2023-02-27 00:23:39,494][0m Trial 5 finished with value: 0.6186714021801719 and parameters: {'vfdrc_ordered_rules': False, 'vfdrc_grace_period': 250, 'vfdrc_tie_threshold': 0.9, 'vfdrc_rule_prediction': 'weighted_max', 'vfdrc_max_rules': 35, 'vfdrc_expand_criterion': 'hellinger', 'vfdrc_remove_poor_atts': True}. Best is trial 4 with value: 0.864612.[0m
[32m[I 2023-02-27 00:31:58,013][0m Trial 6 finished with value: 0.9283250592447995 and parameters: {'vfdrc_ordered_rules': False, 'vfdrc_grace_period': 400, 'vfdrc_tie_threshold': 0.0, 'vfdrc_rule_prediction': 'weighted_max', 'vfdrc_max_rules': 20, 'vfdrc_expand_criterion': 'foil_gain', 'vfdrc_remove_poor_atts': False}. Best is trial 6 with value: 0.928325.[0m
[32m[I 2023-02-27 00:35:34,953][0m Trial 7 finished with value: 0.6150630016477571 and parameters: {'vfdrc_ordered_rules': True, 'vfdrc_grace_period': 200, 'vfdrc_tie_threshold': 0.7000000000000001, 'vfdrc_rule_prediction': 'weighted_sum', 'vfdrc_max_rules': 10, 'vfdrc_expand_criterion': 'hellinger', 'vfdrc_remove_poor_atts': False}. Best is trial 6 with value: 0.928325.[0m
[32m[I 2023-02-27 00:39:33,981][0m Trial 8 finished with value: 0.6902625488135355 and parameters: {'vfdrc_ordered_rules': False, 'vfdrc_grace_period': 400, 'vfdrc_tie_threshold': 0.65, 'vfdrc_rule_prediction': 'weighted_sum', 'vfdrc_max_rules': 25, 'vfdrc_expand_criterion': 'info_gain', 'vfdrc_remove_poor_atts': True}. Best is trial 6 with value: 0.928325.[0m
[32m[I 2023-02-27 00:43:49,775][0m Trial 9 finished with value: 0.6840403091579284 and parameters: {'vfdrc_ordered_rules': False, 'vfdrc_grace_period': 150, 'vfdrc_tie_threshold': 0.1, 'vfdrc_rule_prediction': 'weighted_sum', 'vfdrc_max_rules': 35, 'vfdrc_expand_criterion': 'info_gain', 'vfdrc_remove_poor_atts': False}. Best is trial 6 with value: 0.928325.[0m
[32m[I 2023-02-27 00:54:42,402][0m Trial 10 finished with value: 0.7848561703332377 and parameters: {'vfdrc_ordered_rules': False, 'vfdrc_grace_period': 350, 'vfdrc_tie_threshold': 0.0, 'vfdrc_rule_prediction': 'weighted_max', 'vfdrc_max_rules': 20, 'vfdrc_expand_criterion': 'foil_gain', 'vfdrc_remove_poor_atts': False}. Best is trial 6 with value: 0.928325.[0m
[32m[I 2023-02-27 00:58:28,506][0m Trial 11 finished with value: 0.9083335893196325 and parameters: {'vfdrc_ordered_rules': True, 'vfdrc_grace_period': 100, 'vfdrc_tie_threshold': 0.30000000000000004, 'vfdrc_rule_prediction': 'weighted_max', 'vfdrc_max_rules': 40, 'vfdrc_expand_criterion': 'foil_gain', 'vfdrc_remove_poor_atts': True}. Best is trial 6 with value: 0.928325.[0m
[32m[I 2023-02-27 01:02:16,910][0m Trial 12 finished with value: 0.6525555087053669 and parameters: {'vfdrc_ordered_rules': True, 'vfdrc_grace_period': 100, 'vfdrc_tie_threshold': 0.4, 'vfdrc_rule_prediction': 'weighted_max', 'vfdrc_max_rules': 40, 'vfdrc_expand_criterion': 'foil_gain', 'vfdrc_remove_poor_atts': True}. Best is trial 6 with value: 0.928325.[0m
[32m[I 2023-02-27 01:02:16,972][0m Study finished.[0m
[32m[I 2023-02-27 01:02:17,003][0m --------------------------------------------------------------------------------[0m
[32m[I 2023-02-27 01:02:17,003][0m --------------------             XGBClassifier              --------------------[0m
[32m[I 2023-02-27 01:02:17,003][0m --------------------------------------------------------------------------------[0m
[32m[I 2023-02-27 01:02:17,034][0m A new study created in RDB with name: XGBClassifier_03691551[0m
[32m[I 2023-02-27 01:02:17,034][0m Study started.[0m
[32m[I 2023-02-27 01:05:56,917][0m Trial 0 finished with value: 0.8308427712915046 and parameters: {'xgbc_n_estimators': 110, 'xgbc_use_label_encoder': False, 'xgbc_learning_rate': 0.007969629286147839, 'xgbc_booster': 'gblinear', 'xgbc_gamma': 0.000853165016581557}. Best is trial 0 with value: 0.830843.[0m
[32m[I 2023-02-27 05:17:36,533][0m Trial 1 finished with value: 0.9879019312726345 and parameters: {'xgbc_n_estimators': 190, 'xgbc_use_label_encoder': False, 'xgbc_learning_rate': 0.1817993322612747, 'xgbc_booster': 'dart', 'xgbc_gamma': 0.04584799497845985}. Best is trial 1 with value: 0.987902.[0m
[32m[I 2023-02-27 05:17:36,611][0m Study finished.[0m
[32m[I 2023-02-27 05:17:37,296][0m Optimization finished.[0m
