[32m[I 2023-02-26 21:51:59,595][0m Trial 11 finished with value: 0.6744141146448385 and parameters: {'p_penalty': 'elasticnet', 'p_alpha': 1.4431513690790624e-06, 'p_eta0': 0.5, 'p_early_stopping': True, 'p_validation_fraction': 0.25, 'p_n_iter_no_change': 10}. Best is trial 5 with value: 0.710426.[0m
[32m[I 2023-02-26 21:52:33,058][0m Trial 12 finished with value: 0.7015269839106294 and parameters: {'p_penalty': 'elasticnet', 'p_alpha': 1.9021496570692335e-06, 'p_eta0': 0.5, 'p_early_stopping': True, 'p_validation_fraction': 0.25, 'p_n_iter_no_change': 10}. Best is trial 5 with value: 0.710426.[0m
[32m[I 2023-02-26 21:53:05,458][0m Trial 13 finished with value: 0.5753900696154072 and parameters: {'p_penalty': 'elasticnet', 'p_alpha': 9.076596947720769e-05, 'p_eta0': 1.0, 'p_early_stopping': True, 'p_validation_fraction': 0.25, 'p_n_iter_no_change': 10}. Best is trial 5 with value: 0.710426.[0m
[32m[I 2023-02-26 21:53:39,835][0m Trial 14 finished with value: 0.6666365928229909 and parameters: {'p_penalty': 'elasticnet', 'p_alpha': 1.006692315277579e-06, 'p_eta0': 1.5, 'p_early_stopping': True, 'p_validation_fraction': 0.25, 'p_n_iter_no_change': 10}. Best is trial 5 with value: 0.710426.[0m
[32m[I 2023-02-26 21:54:06,575][0m Trial 15 finished with value: 0.6126885597353016 and parameters: {'p_penalty': 'elasticnet', 'p_alpha': 9.152692126057115e-06, 'p_eta0': 0.5, 'p_early_stopping': True, 'p_validation_fraction': 0.25, 'p_n_iter_no_change': 10}. Best is trial 5 with value: 0.710426.[0m
[32m[I 2023-02-26 21:54:38,894][0m Trial 16 finished with value: 0.6466823649199477 and parameters: {'p_penalty': 'elasticnet', 'p_alpha': 0.00010200990004604283, 'p_eta0': 1.0, 'p_early_stopping': True, 'p_validation_fraction': 0.25, 'p_n_iter_no_change': 10}. Best is trial 5 with value: 0.710426.[0m
[32m[I 2023-02-26 21:55:11,962][0m Trial 17 finished with value: 0.4457643135376501 and parameters: {'p_penalty': 'elasticnet', 'p_alpha': 5.521323408375382e-06, 'p_eta0': 0.5, 'p_early_stopping': True, 'p_validation_fraction': 0.25, 'p_n_iter_no_change': 10}. Best is trial 5 with value: 0.710426.[0m
[32m[I 2023-02-26 21:55:44,084][0m Trial 18 finished with value: 0.5535883775061562 and parameters: {'p_penalty': 'elasticnet', 'p_alpha': 4.5723663008760736e-05, 'p_eta0': 1.0, 'p_early_stopping': True, 'p_validation_fraction': 0.25, 'p_n_iter_no_change': 10}. Best is trial 5 with value: 0.710426.[0m
[32m[I 2023-02-26 21:56:15,531][0m Trial 19 finished with value: 0.19191854689979754 and parameters: {'p_penalty': 'elasticnet', 'p_alpha': 0.006018667597919778, 'p_eta0': 1.5, 'p_early_stopping': True, 'p_validation_fraction': 0.25, 'p_n_iter_no_change': 10}. Best is trial 5 with value: 0.710426.[0m
[32m[I 2023-02-26 21:56:15,593][0m Study finished.[0m
[32m[I 2023-02-26 21:56:15,625][0m --------------------------------------------------------------------------------[0m
[32m[I 2023-02-26 21:56:15,625][0m --------------------     QuadraticDiscriminantAnalysis      --------------------[0m
[32m[I 2023-02-26 21:56:15,625][0m --------------------------------------------------------------------------------[0m
[32m[I 2023-02-26 21:56:15,656][0m A new study created in RDB with name: QuadraticDiscriminantAnalysis_03691551[0m
[32m[I 2023-02-26 21:56:15,656][0m Study started.[0m
[32m[I 2023-02-26 21:56:20,730][0m Trial 0 finished with value: 0.46982713119403724 and parameters: {'qda_reg_param': 0.35000000000000003, 'qda_tol': 1.3516311176322125e-05}. Best is trial 0 with value: 0.469827.[0m
[32m[I 2023-02-26 21:56:25,865][0m Trial 1 finished with value: 0.517309332304541 and parameters: {'qda_reg_param': 0.05, 'qda_tol': 5.809038085499093e-06}. Best is trial 1 with value: 0.517309.[0m
[32m[I 2023-02-26 21:56:31,012][0m Trial 2 finished with value: 0.46982713119403724 and parameters: {'qda_reg_param': 0.35000000000000003, 'qda_tol': 1.9886171310598953e-06}. Best is trial 1 with value: 0.517309.[0m
[32m[I 2023-02-26 21:56:36,110][0m Trial 3 finished with value: 0.8126016124168968 and parameters: {'qda_reg_param': 0.8, 'qda_tol': 6.48642263440949e-06}. Best is trial 3 with value: 0.812602.[0m
[32m[I 2023-02-26 21:56:41,231][0m Trial 4 finished with value: 0.47147785372914214 and parameters: {'qda_reg_param': 0.2, 'qda_tol': 0.0006821112381850559}. Best is trial 3 with value: 0.812602.[0m
[32m[I 2023-02-26 21:56:46,294][0m Trial 5 finished with value: 0.8436903945510715 and parameters: {'qda_reg_param': 0.9500000000000001, 'qda_tol': 1.1024612585222726e-06}. Best is trial 5 with value: 0.84369.[0m
[32m[I 2023-02-26 21:56:51,416][0m Trial 6 finished with value: 0.7431238163593181 and parameters: {'qda_reg_param': 0.65, 'qda_tol': 0.00013440871574969522}. Best is trial 5 with value: 0.84369.[0m
[32m[I 2023-02-26 21:56:56,519][0m Trial 7 finished with value: 0.8088220434199221 and parameters: {'qda_reg_param': 0.75, 'qda_tol': 1.7908773489746925e-05}. Best is trial 5 with value: 0.84369.[0m
[32m[I 2023-02-26 21:57:01,653][0m Trial 8 finished with value: 0.815698799668355 and parameters: {'qda_reg_param': 0.8500000000000001, 'qda_tol': 4.242733793130674e-06}. Best is trial 5 with value: 0.84369.[0m
[32m[I 2023-02-26 21:57:06,741][0m Trial 9 finished with value: 0.8436903945510715 and parameters: {'qda_reg_param': 0.9500000000000001, 'qda_tol': 2.254054975481302e-05}. Best is trial 5 with value: 0.84369.[0m
[32m[I 2023-02-26 21:57:11,901][0m Trial 10 finished with value: 0.4845784246112148 and parameters: {'qda_reg_param': 0.55, 'qda_tol': 1.3286014861086366e-06}. Best is trial 5 with value: 0.84369.[0m
[32m[I 2023-02-26 21:57:16,992][0m Trial 11 finished with value: 0.8400315131972449 and parameters: {'qda_reg_param': 0.9, 'qda_tol': 7.699820847482033e-05}. Best is trial 5 with value: 0.84369.[0m
[32m[I 2023-02-26 21:57:22,024][0m Trial 12 finished with value: 0.837955083383341 and parameters: {'qda_reg_param': 1.0, 'qda_tol': 6.177157682992794e-05}. Best is trial 5 with value: 0.84369.[0m
[32m[I 2023-02-26 21:57:27,083][0m Trial 13 finished with value: 0.837955083383341 and parameters: {'qda_reg_param': 1.0, 'qda_tol': 0.0005396028823455205}. Best is trial 5 with value: 0.84369.[0m
[32m[I 2023-02-26 21:57:32,188][0m Trial 14 finished with value: 0.806903678226692 and parameters: {'qda_reg_param': 0.7000000000000001, 'qda_tol': 0.00020117431076801544}. Best is trial 5 with value: 0.84369.[0m
[32m[I 2023-02-26 21:57:37,282][0m Trial 15 finished with value: 0.4845784246112148 and parameters: {'qda_reg_param': 0.55, 'qda_tol': 3.057816073271235e-05}. Best is trial 5 with value: 0.84369.[0m
[32m[I 2023-02-26 21:57:42,333][0m Trial 16 finished with value: 0.8400315131972449 and parameters: {'qda_reg_param': 0.9, 'qda_tol': 1.1291533870181836e-06}. Best is trial 5 with value: 0.84369.[0m
[32m[I 2023-02-26 21:57:47,371][0m Trial 17 finished with value: 0.837955083383341 and parameters: {'qda_reg_param': 1.0, 'qda_tol': 2.3254284535465713e-06}. Best is trial 5 with value: 0.84369.[0m
[32m[I 2023-02-26 21:57:52,500][0m Trial 18 finished with value: 0.5109817950214515 and parameters: {'qda_reg_param': 0.6000000000000001, 'qda_tol': 1.3640114235886021e-05}. Best is trial 5 with value: 0.84369.[0m
[32m[I 2023-02-26 21:57:57,646][0m Trial 19 finished with value: 0.46982713119403724 and parameters: {'qda_reg_param': 0.35000000000000003, 'qda_tol': 0.00027544142681383554}. Best is trial 5 with value: 0.84369.[0m
[32m[I 2023-02-26 21:57:57,709][0m Study finished.[0m
[32m[I 2023-02-26 21:57:57,725][0m --------------------------------------------------------------------------------[0m
[32m[I 2023-02-26 21:57:57,725][0m --------------------         RandomForestClassifier         --------------------[0m
[32m[I 2023-02-26 21:57:57,725][0m --------------------------------------------------------------------------------[0m
[32m[I 2023-02-26 21:57:57,756][0m A new study created in RDB with name: RandomForestClassifier_03691551[0m
[32m[I 2023-02-26 21:57:57,772][0m Study started.[0m
[32m[I 2023-02-26 21:57:57,803][0m sklearn.ensemble.RandomForestClassifier.fit: fallback to original Scikit-learn[0m
[32m[I 2023-02-26 21:58:23,122][0m sklearn.ensemble.RandomForestClassifier.predict: fallback to original Scikit-learn[0m
[32m[I 2023-02-26 21:58:23,138][0m sklearn.ensemble.RandomForestClassifier.predict_proba: fallback to original Scikit-learn[0m
[32m[I 2023-02-26 21:58:24,858][0m Trial 0 finished with value: 0.9878376346099232 and parameters: {'rfc_criterion': 'entropy', 'rfc_n_estimators': 10, 'rfc_min_samples_split': 39, 'rfc_min_samples_leaf': 8, 'rfc_max_features': 9, 'rfc_bootstrap': True}. Best is trial 0 with value: 0.987838.[0m
[32m[I 2023-02-26 21:58:24,936][0m sklearn.ensemble.RandomForestClassifier.fit: fallback to original Scikit-learn[0m
[32m[I 2023-02-26 22:08:16,310][0m sklearn.ensemble.RandomForestClassifier.predict: fallback to original Scikit-learn[0m
[32m[I 2023-02-26 22:08:16,326][0m sklearn.ensemble.RandomForestClassifier.predict_proba: fallback to original Scikit-learn[0m
[32m[I 2023-02-26 22:08:23,201][0m Trial 1 finished with value: 0.9875667472722699 and parameters: {'rfc_criterion': 'entropy', 'rfc_n_estimators': 130, 'rfc_min_samples_split': 9, 'rfc_min_samples_leaf': 46, 'rfc_max_features': 20, 'rfc_bootstrap': True}. Best is trial 0 with value: 0.987838.[0m
[32m[I 2023-02-26 22:08:23,284][0m sklearn.ensemble.RandomForestClassifier.fit: fallback to original Scikit-learn[0m
[32m[I 2023-02-26 22:17:24,896][0m sklearn.ensemble.RandomForestClassifier.predict: fallback to original Scikit-learn[0m
[32m[I 2023-02-26 22:17:24,896][0m sklearn.ensemble.RandomForestClassifier.predict_proba: fallback to original Scikit-learn[0m
[32m[I 2023-02-26 22:17:29,411][0m Trial 2 finished with value: 0.9920156513713932 and parameters: {'rfc_criterion': 'entropy', 'rfc_n_estimators': 70, 'rfc_min_samples_split': 7, 'rfc_min_samples_leaf': 9, 'rfc_max_features': 25, 'rfc_bootstrap': False}. Best is trial 2 with value: 0.992016.[0m
[32m[I 2023-02-26 22:17:29,489][0m sklearn.ensemble.RandomForestClassifier.fit: fallback to original Scikit-learn[0m
[32m[I 2023-02-26 22:25:58,028][0m sklearn.ensemble.RandomForestClassifier.predict: fallback to original Scikit-learn[0m
[32m[I 2023-02-26 22:25:58,028][0m sklearn.ensemble.RandomForestClassifier.predict_proba: fallback to original Scikit-learn[0m
[32m[I 2023-02-26 22:26:03,218][0m Trial 3 finished with value: 0.9881459742266959 and parameters: {'rfc_criterion': 'entropy', 'rfc_n_estimators': 90, 'rfc_min_samples_split': 33, 'rfc_min_samples_leaf': 46, 'rfc_max_features': 18, 'rfc_bootstrap': False}. Best is trial 2 with value: 0.992016.[0m
[32m[I 2023-02-26 22:26:03,312][0m sklearn.ensemble.RandomForestClassifier.fit: fallback to original Scikit-learn[0m
[32m[I 2023-02-26 22:48:08,106][0m sklearn.ensemble.RandomForestClassifier.predict: fallback to original Scikit-learn[0m
[32m[I 2023-02-26 22:48:08,106][0m sklearn.ensemble.RandomForestClassifier.predict_proba: fallback to original Scikit-learn[0m
[32m[I 2023-02-26 22:48:17,587][0m Trial 4 finished with value: 0.9922107830021158 and parameters: {'rfc_criterion': 'entropy', 'rfc_n_estimators': 180, 'rfc_min_samples_split': 44, 'rfc_min_samples_leaf': 2, 'rfc_max_features': 24, 'rfc_bootstrap': False}. Best is trial 4 with value: 0.992211.[0m
[32m[I 2023-02-26 22:48:17,759][0m sklearn.ensemble.RandomForestClassifier.fit: running accelerated version on CPU[0m
[32m[I 2023-02-26 22:49:07,869][0m sklearn.ensemble.RandomForestClassifier.predict: running accelerated version on CPU[0m
[32m[I 2023-02-26 22:49:09,463][0m Trial 5 finished with value: 0.9864819561877467 and parameters: {'rfc_criterion': 'gini', 'rfc_n_estimators': 60, 'rfc_min_samples_split': 33, 'rfc_min_samples_leaf': 25, 'rfc_max_features': 23, 'rfc_bootstrap': False}. Best is trial 4 with value: 0.992211.[0m
[32m[I 2023-02-26 22:49:09,573][0m sklearn.ensemble.RandomForestClassifier.fit: fallback to original Scikit-learn[0m
[32m[I 2023-02-26 22:58:28,819][0m sklearn.ensemble.RandomForestClassifier.predict: fallback to original Scikit-learn[0m
[32m[I 2023-02-26 22:58:28,819][0m sklearn.ensemble.RandomForestClassifier.predict_proba: fallback to original Scikit-learn[0m
[32m[I 2023-02-26 22:58:33,294][0m Trial 6 finished with value: 0.9901626126076097 and parameters: {'rfc_criterion': 'entropy', 'rfc_n_estimators': 70, 'rfc_min_samples_split': 16, 'rfc_min_samples_leaf': 13, 'rfc_max_features': 26, 'rfc_bootstrap': False}. Best is trial 4 with value: 0.992211.[0m
[32m[I 2023-02-26 22:58:33,357][0m Study finished.[0m
[32m[I 2023-02-26 22:58:33,373][0m --------------------------------------------------------------------------------[0m
[32m[I 2023-02-26 22:58:33,373][0m --------------------            RidgeClassifier             --------------------[0m
[32m[I 2023-02-26 22:58:33,373][0m --------------------------------------------------------------------------------[0m
[32m[I 2023-02-26 22:58:33,404][0m A new study created in RDB with name: RidgeClassifier_03691551[0m
[32m[I 2023-02-26 22:58:33,419][0m Study started.[0m
[32m[I 2023-02-26 22:58:35,819][0m Trial 0 finished with value: 0.8668449550880869 and parameters: {'rc_C': 3340.865459998009, 'rc_tol': 0.00466831408886688}. Best is trial 0 with value: 0.866845.[0m
[32m[I 2023-02-26 22:58:38,290][0m Trial 1 finished with value: 0.8676547723552451 and parameters: {'rc_C': 0.0016804067702593556, 'rc_tol': 0.0031271748923012046}. Best is trial 1 with value: 0.867655.[0m
[32m[I 2023-02-26 22:58:40,731][0m Trial 2 finished with value: 0.8668187716680871 and parameters: {'rc_C': 3523.2029413339797, 'rc_tol': 0.0004581930460467528}. Best is trial 1 with value: 0.867655.[0m
[32m[I 2023-02-26 22:58:43,186][0m Trial 3 finished with value: 0.8676547723552451 and parameters: {'rc_C': 0.0007349839192936485, 'rc_tol': 0.002398909288769652}. Best is trial 1 with value: 0.867655.[0m
[32m[I 2023-02-26 22:58:45,659][0m Trial 4 finished with value: 0.8676547723552451 and parameters: {'rc_C': 0.06341618976348817, 'rc_tol': 0.0006742905424874714}. Best is trial 1 with value: 0.867655.[0m
[32m[I 2023-02-26 22:58:48,131][0m Trial 5 finished with value: 0.8676547723552451 and parameters: {'rc_C': 0.010062641271093178, 'rc_tol': 0.0056185233519362105}. Best is trial 1 with value: 0.867655.[0m
[32m[I 2023-02-26 22:58:50,555][0m Trial 6 finished with value: 0.8662250688772369 and parameters: {'rc_C': 5755.757533909116, 'rc_tol': 0.001210651288492575}. Best is trial 1 with value: 0.867655.[0m
[32m[I 2023-02-26 22:58:53,011][0m Trial 7 finished with value: 0.8676547723552451 and parameters: {'rc_C': 0.000105887508703434, 'rc_tol': 0.00037496362158017353}. Best is trial 1 with value: 0.867655.[0m
[32m[I 2023-02-26 22:58:55,441][0m Trial 8 finished with value: 0.8673716916809245 and parameters: {'rc_C': 26.391712604008564, 'rc_tol': 0.00010985594100740887}. Best is trial 1 with value: 0.867655.[0m
[32m[I 2023-02-26 22:58:57,901][0m Trial 9 finished with value: 0.8676511960782405 and parameters: {'rc_C': 1.5823881144319407, 'rc_tol': 0.0008780896147500333}. Best is trial 1 with value: 0.867655.[0m
[32m[I 2023-02-26 22:59:00,364][0m Trial 10 finished with value: 0.8676547723552451 and parameters: {'rc_C': 1.6926622087283126e-06, 'rc_tol': 0.009558580952478215}. Best is trial 1 with value: 0.867655.[0m
[32m[I 2023-02-26 22:59:02,810][0m Trial 11 finished with value: 0.8676547723552451 and parameters: {'rc_C': 0.0004342917064432544, 'rc_tol': 0.002743073180962406}. Best is trial 1 with value: 0.867655.[0m
[32m[I 2023-02-26 22:59:05,282][0m Trial 12 finished with value: 0.8676547723552451 and parameters: {'rc_C': 1.5307254677487095e-05, 'rc_tol': 0.0024994862264619334}. Best is trial 1 with value: 0.867655.[0m
[32m[I 2023-02-26 22:59:07,723][0m Trial 13 finished with value: 0.8676547723552451 and parameters: {'rc_C': 0.0032869064749901735, 'rc_tol': 0.0019264568732224668}. Best is trial 1 with value: 0.867655.[0m
[32m[I 2023-02-26 22:59:10,196][0m Trial 14 finished with value: 0.8676528851127555 and parameters: {'rc_C': 0.3479676183967829, 'rc_tol': 0.004357050305011126}. Best is trial 1 with value: 0.867655.[0m
[32m[I 2023-02-26 22:59:12,651][0m Trial 15 finished with value: 0.8673773531824756 and parameters: {'rc_C': 17.90047056455126, 'rc_tol': 0.0015400451441215856}. Best is trial 1 with value: 0.867655.[0m
[32m[I 2023-02-26 22:59:15,084][0m Trial 16 finished with value: 0.8253862393851503 and parameters: {'rc_C': 733359.3225609971, 'rc_tol': 0.009413617698513099}. Best is trial 1 with value: 0.867655.[0m
[32m[I 2023-02-26 22:59:17,540][0m Trial 17 finished with value: 0.8676547723552451 and parameters: {'rc_C': 0.0013031107445681778, 'rc_tol': 0.0029268469022444435}. Best is trial 17 with value: 0.867655.[0m
[32m[I 2023-02-26 22:59:20,011][0m Trial 18 finished with value: 0.8676547723552451 and parameters: {'rc_C': 3.93424038569231e-05, 'rc_tol': 0.00018223976181167288}. Best is trial 18 with value: 0.867655.[0m
[32m[I 2023-02-26 22:59:22,461][0m Trial 19 finished with value: 0.8676547723552451 and parameters: {'rc_C': 2.4233707272576333e-06, 'rc_tol': 0.0001725492207531377}. Best is trial 19 with value: 0.867655.[0m
[32m[I 2023-02-26 22:59:22,523][0m Study finished.[0m
[32m[I 2023-02-26 22:59:22,539][0m --------------------------------------------------------------------------------[0m
[32m[I 2023-02-26 22:59:22,539][0m --------------------           RUSBoostClassifier           --------------------[0m
[32m[I 2023-02-26 22:59:22,539][0m --------------------------------------------------------------------------------[0m
[32m[I 2023-02-26 22:59:22,570][0m A new study created in RDB with name: RUSBoostClassifier_03691551[0m
[32m[I 2023-02-26 22:59:22,570][0m Study started.[0m
[32m[I 2023-02-26 23:00:47,136][0m Trial 0 finished with value: 0.24757593593632823 and parameters: {'rusbc_n_estimators': 100, 'rusbc_learning_rate': 3.87598705255524e-06, 'rusbc_sampling_strategy': 'all'}. Best is trial 0 with value: 0.247576.[0m
[32m[I 2023-02-26 23:01:23,182][0m Trial 1 finished with value: 0.35178689869332874 and parameters: {'rusbc_n_estimators': 25, 'rusbc_learning_rate': 0.002509390851657238, 'rusbc_sampling_strategy': 'majority'}. Best is trial 1 with value: 0.351787.[0m
[32m[I 2023-02-26 23:01:58,575][0m Trial 2 finished with value: 0.32940263098104067 and parameters: {'rusbc_n_estimators': 25, 'rusbc_learning_rate': 0.6665001627359403, 'rusbc_sampling_strategy': 'majority'}. Best is trial 1 with value: 0.351787.[0m
[32m[I 2023-02-26 23:02:33,938][0m Trial 3 finished with value: 0.3346181507288841 and parameters: {'rusbc_n_estimators': 25, 'rusbc_learning_rate': 0.2713844009300084, 'rusbc_sampling_strategy': 'majority'}. Best is trial 1 with value: 0.351787.[0m
[32m[I 2023-02-26 23:03:17,046][0m Trial 4 finished with value: 0.4434972300591517 and parameters: {'rusbc_n_estimators': 50, 'rusbc_learning_rate': 0.9402673347648188, 'rusbc_sampling_strategy': 'not minority'}. Best is trial 4 with value: 0.443497.[0m
[32m[I 2023-02-26 23:03:56,330][0m Trial 5 finished with value: 0.3781255596969302 and parameters: {'rusbc_n_estimators': 25, 'rusbc_learning_rate': 0.000655764390818166, 'rusbc_sampling_strategy': 'not majority'}. Best is trial 4 with value: 0.443497.[0m
[32m[I 2023-02-26 23:05:07,154][0m Trial 6 finished with value: 0.35178689869332874 and parameters: {'rusbc_n_estimators': 50, 'rusbc_learning_rate': 2.0755531753131904e-05, 'rusbc_sampling_strategy': 'majority'}. Best is trial 4 with value: 0.443497.[0m
[32m[I 2023-02-26 23:06:30,963][0m Trial 7 finished with value: 0.2573993083133119 and parameters: {'rusbc_n_estimators': 100, 'rusbc_learning_rate': 0.0012544321945250146, 'rusbc_sampling_strategy': 'not minority'}. Best is trial 4 with value: 0.443497.[0m
[32m[I 2023-02-26 23:07:06,935][0m Trial 8 finished with value: 0.35178689869332874 and parameters: {'rusbc_n_estimators': 25, 'rusbc_learning_rate': 1.786676773831956e-05, 'rusbc_sampling_strategy': 'majority'}. Best is trial 4 with value: 0.443497.[0m
[32m[I 2023-02-26 23:07:42,934][0m Trial 9 finished with value: 0.35178689869332874 and parameters: {'rusbc_n_estimators': 25, 'rusbc_learning_rate': 2.29742493549734e-05, 'rusbc_sampling_strategy': 'majority'}. Best is trial 4 with value: 0.443497.[0m
[32m[I 2023-02-26 23:08:46,444][0m Trial 10 finished with value: 0.8944487460826572 and parameters: {'rusbc_n_estimators': 75, 'rusbc_learning_rate': 0.042418871594193865, 'rusbc_sampling_strategy': 'not minority'}. Best is trial 10 with value: 0.894449.[0m
[32m[I 2023-02-26 23:09:50,164][0m Trial 11 finished with value: 0.8752560108653764 and parameters: {'rusbc_n_estimators': 75, 'rusbc_learning_rate': 0.043917131597771934, 'rusbc_sampling_strategy': 'not minority'}. Best is trial 10 with value: 0.894449.[0m
[32m[I 2023-02-26 23:10:53,795][0m Trial 12 finished with value: 0.8774617338317099 and parameters: {'rusbc_n_estimators': 75, 'rusbc_learning_rate': 0.033346811789590224, 'rusbc_sampling_strategy': 'not minority'}. Best is trial 10 with value: 0.894449.[0m
[32m[I 2023-02-26 23:11:57,055][0m Trial 13 finished with value: 0.3993745940528148 and parameters: {'rusbc_n_estimators': 75, 'rusbc_learning_rate': 0.021214099181582534, 'rusbc_sampling_strategy': 'not minority'}. Best is trial 10 with value: 0.894449.[0m
[32m[I 2023-02-26 23:13:00,385][0m Trial 14 finished with value: 0.40103843876716355 and parameters: {'rusbc_n_estimators': 75, 'rusbc_learning_rate': 0.031050789554896343, 'rusbc_sampling_strategy': 'not minority'}. Best is trial 10 with value: 0.894449.[0m
