[32m[I 2023-02-26 16:31:24,821][0m Trial 19 finished with value: 0.704839719365404 and parameters: {'gnb_var_smoothing': 0.002610737850207704}. Best is trial 11 with value: 0.77208.[0m
[32m[I 2023-02-26 16:31:24,868][0m Study finished.[0m
[32m[I 2023-02-26 16:31:24,899][0m --------------------------------------------------------------------------------[0m
[32m[I 2023-02-26 16:31:24,899][0m --------------------     HistGradientBoostingClassifier     --------------------[0m
[32m[I 2023-02-26 16:31:24,899][0m --------------------------------------------------------------------------------[0m
[32m[I 2023-02-26 16:31:24,931][0m A new study created in RDB with name: HistGradientBoostingClassifier_03691551[0m
[32m[I 2023-02-26 16:31:24,931][0m Study started.[0m
[32m[I 2023-02-26 16:40:18,910][0m Trial 0 finished with value: 0.9856387797044129 and parameters: {'hgbc_learning_rate': 0.0034136078388581456, 'hgbc_max_iter': 2000, 'hgbc_min_samples_leaf': 48, 'hgbc_l2_regularization': 0.2, 'hgbc_max_bins': 127, 'hgbc_early_stopping': True, 'hgbc_validation_fraction': 0.25, 'hgbc_n_iter_no_change': 10}. Best is trial 0 with value: 0.985639.[0m
[32m[I 2023-02-26 16:48:43,834][0m Trial 1 finished with value: 0.9710048798620498 and parameters: {'hgbc_learning_rate': 0.010337517838931947, 'hgbc_max_iter': 2000, 'hgbc_min_samples_leaf': 13, 'hgbc_l2_regularization': 0.6000000000000001, 'hgbc_max_bins': 63, 'hgbc_early_stopping': True, 'hgbc_validation_fraction': 0.25, 'hgbc_n_iter_no_change': 10}. Best is trial 0 with value: 0.985639.[0m
[32m[I 2023-02-26 16:56:10,698][0m Trial 2 finished with value: 0.9889665235093223 and parameters: {'hgbc_learning_rate': 0.060470296500375414, 'hgbc_max_iter': 2000, 'hgbc_min_samples_leaf': 38, 'hgbc_l2_regularization': 0.2, 'hgbc_max_bins': 127, 'hgbc_early_stopping': True, 'hgbc_validation_fraction': 0.25, 'hgbc_n_iter_no_change': 10}. Best is trial 2 with value: 0.988967.[0m
[32m[I 2023-02-26 16:56:16,884][0m Trial 3 finished with value: 0.9780797715151562 and parameters: {'hgbc_learning_rate': 0.6234168881578223, 'hgbc_max_iter': 2000, 'hgbc_min_samples_leaf': 13, 'hgbc_l2_regularization': 0.4, 'hgbc_max_bins': 127, 'hgbc_early_stopping': True, 'hgbc_validation_fraction': 0.25, 'hgbc_n_iter_no_change': 10}. Best is trial 2 with value: 0.988967.[0m
[32m[I 2023-02-26 17:05:26,010][0m Trial 4 finished with value: 0.9867952307295172 and parameters: {'hgbc_learning_rate': 0.006571758281554556, 'hgbc_max_iter': 2000, 'hgbc_min_samples_leaf': 21, 'hgbc_l2_regularization': 1.0, 'hgbc_max_bins': 127, 'hgbc_early_stopping': True, 'hgbc_validation_fraction': 0.25, 'hgbc_n_iter_no_change': 10}. Best is trial 2 with value: 0.988967.[0m
[32m[I 2023-02-26 17:05:32,055][0m Trial 5 finished with value: 0.9600653827433132 and parameters: {'hgbc_learning_rate': 0.5410213935723868, 'hgbc_max_iter': 2000, 'hgbc_min_samples_leaf': 27, 'hgbc_l2_regularization': 0.2, 'hgbc_max_bins': 63, 'hgbc_early_stopping': True, 'hgbc_validation_fraction': 0.25, 'hgbc_n_iter_no_change': 10}. Best is trial 2 with value: 0.988967.[0m
[32m[I 2023-02-26 17:05:38,204][0m Trial 6 finished with value: 0.942108824515701 and parameters: {'hgbc_learning_rate': 0.7584267549298171, 'hgbc_max_iter': 2000, 'hgbc_min_samples_leaf': 13, 'hgbc_l2_regularization': 0.2, 'hgbc_max_bins': 63, 'hgbc_early_stopping': True, 'hgbc_validation_fraction': 0.25, 'hgbc_n_iter_no_change': 10}. Best is trial 2 with value: 0.988967.[0m
[32m[I 2023-02-26 17:15:05,564][0m Trial 7 finished with value: 0.9862027206645204 and parameters: {'hgbc_learning_rate': 0.004579888548447259, 'hgbc_max_iter': 2000, 'hgbc_min_samples_leaf': 34, 'hgbc_l2_regularization': 0.8, 'hgbc_max_bins': 127, 'hgbc_early_stopping': True, 'hgbc_validation_fraction': 0.25, 'hgbc_n_iter_no_change': 10}. Best is trial 2 with value: 0.988967.[0m
[32m[I 2023-02-26 17:24:52,154][0m Trial 8 finished with value: 0.9842918787187757 and parameters: {'hgbc_learning_rate': 0.0012430744186560899, 'hgbc_max_iter': 2000, 'hgbc_min_samples_leaf': 3, 'hgbc_l2_regularization': 0.2, 'hgbc_max_bins': 127, 'hgbc_early_stopping': True, 'hgbc_validation_fraction': 0.25, 'hgbc_n_iter_no_change': 10}. Best is trial 2 with value: 0.988967.[0m
[32m[I 2023-02-26 17:24:58,257][0m Trial 9 finished with value: 0.9811904847776309 and parameters: {'hgbc_learning_rate': 0.5764404844664268, 'hgbc_max_iter': 2000, 'hgbc_min_samples_leaf': 37, 'hgbc_l2_regularization': 0.8, 'hgbc_max_bins': 127, 'hgbc_early_stopping': True, 'hgbc_validation_fraction': 0.25, 'hgbc_n_iter_no_change': 10}. Best is trial 2 with value: 0.988967.[0m
[32m[I 2023-02-26 17:25:18,655][0m Trial 10 finished with value: 0.985474433795904 and parameters: {'hgbc_learning_rate': 0.07889074495709802, 'hgbc_max_iter': 2000, 'hgbc_min_samples_leaf': 50, 'hgbc_l2_regularization': 0.0, 'hgbc_max_bins': 255, 'hgbc_early_stopping': True, 'hgbc_validation_fraction': 0.25, 'hgbc_n_iter_no_change': 10}. Best is trial 2 with value: 0.988967.[0m
[32m[I 2023-02-26 17:33:51,880][0m Trial 11 finished with value: 0.9897744016920131 and parameters: {'hgbc_learning_rate': 0.046102680463823535, 'hgbc_max_iter': 2000, 'hgbc_min_samples_leaf': 25, 'hgbc_l2_regularization': 1.0, 'hgbc_max_bins': 255, 'hgbc_early_stopping': True, 'hgbc_validation_fraction': 0.25, 'hgbc_n_iter_no_change': 10}. Best is trial 11 with value: 0.989774.[0m
[32m[I 2023-02-26 17:33:51,943][0m Study finished.[0m
[32m[I 2023-02-26 17:33:51,958][0m --------------------------------------------------------------------------------[0m
[32m[I 2023-02-26 17:33:51,958][0m --------------------             LGBMClassifier             --------------------[0m
[32m[I 2023-02-26 17:33:51,958][0m --------------------------------------------------------------------------------[0m
[32m[I 2023-02-26 17:33:51,990][0m A new study created in RDB with name: LGBMClassifier_03691551[0m
[32m[I 2023-02-26 17:33:51,990][0m Study started.[0m
[32m[I 2023-02-26 17:35:15,503][0m Trial 0 finished with value: 0.9868119523031749 and parameters: {'lgbm_num_leaves': 63, 'lgbm_learning_rate': 0.02612676798746025, 'lgbm_n_estimators': 160, 'lgbm_reg_alpha': 1.0, 'lgbm_reg_lambda': 0.45}. Best is trial 0 with value: 0.986812.[0m
[32m[I 2023-02-26 17:35:50,977][0m Trial 1 finished with value: 0.8871307738251409 and parameters: {'lgbm_num_leaves': 7, 'lgbm_learning_rate': 0.003696431648699041, 'lgbm_n_estimators': 100, 'lgbm_reg_alpha': 0.75, 'lgbm_reg_lambda': 0.0}. Best is trial 0 with value: 0.986812.[0m
[32m[I 2023-02-26 17:36:23,751][0m Trial 2 finished with value: 0.3781255596969302 and parameters: {'lgbm_num_leaves': 127, 'lgbm_learning_rate': 2.541256496984147e-05, 'lgbm_n_estimators': 60, 'lgbm_reg_alpha': 0.65, 'lgbm_reg_lambda': 0.25}. Best is trial 0 with value: 0.986812.[0m
[32m[I 2023-02-26 17:37:36,690][0m Trial 3 finished with value: 0.9393239211095152 and parameters: {'lgbm_num_leaves': 31, 'lgbm_learning_rate': 0.9133340885209804, 'lgbm_n_estimators': 160, 'lgbm_reg_alpha': 0.55, 'lgbm_reg_lambda': 0.2}. Best is trial 0 with value: 0.986812.[0m
[32m[I 2023-02-26 17:39:11,978][0m Trial 4 finished with value: 0.8973927993953874 and parameters: {'lgbm_num_leaves': 127, 'lgbm_learning_rate': 0.0009405424574317633, 'lgbm_n_estimators': 170, 'lgbm_reg_alpha': 0.7000000000000001, 'lgbm_reg_lambda': 0.4}. Best is trial 0 with value: 0.986812.[0m
[32m[I 2023-02-26 17:39:48,975][0m Trial 5 finished with value: 0.9847025342537733 and parameters: {'lgbm_num_leaves': 7, 'lgbm_learning_rate': 0.2234393216954409, 'lgbm_n_estimators': 90, 'lgbm_reg_alpha': 0.30000000000000004, 'lgbm_reg_lambda': 0.30000000000000004}. Best is trial 0 with value: 0.986812.[0m
[32m[I 2023-02-26 17:41:06,811][0m Trial 6 finished with value: 0.3781255596969302 and parameters: {'lgbm_num_leaves': 63, 'lgbm_learning_rate': 3.9091750145549236e-05, 'lgbm_n_estimators': 160, 'lgbm_reg_alpha': 0.55, 'lgbm_reg_lambda': 1.0}. Best is trial 0 with value: 0.986812.[0m
[32m[I 2023-02-26 17:41:55,913][0m Trial 7 finished with value: 0.9743833618748737 and parameters: {'lgbm_num_leaves': 15, 'lgbm_learning_rate': 0.006057978410249288, 'lgbm_n_estimators': 120, 'lgbm_reg_alpha': 0.15000000000000002, 'lgbm_reg_lambda': 0.2}. Best is trial 0 with value: 0.986812.[0m
[32m[I 2023-02-26 17:43:16,478][0m Trial 8 finished with value: 0.8977865316999524 and parameters: {'lgbm_num_leaves': 31, 'lgbm_learning_rate': 0.0013632980698578487, 'lgbm_n_estimators': 190, 'lgbm_reg_alpha': 0.9500000000000001, 'lgbm_reg_lambda': 0.8500000000000001}. Best is trial 0 with value: 0.986812.[0m
[32m[I 2023-02-26 17:44:05,305][0m Trial 9 finished with value: 0.981787155710156 and parameters: {'lgbm_num_leaves': 7, 'lgbm_learning_rate': 0.07327284463518692, 'lgbm_n_estimators': 120, 'lgbm_reg_alpha': 1.0, 'lgbm_reg_lambda': 0.6000000000000001}. Best is trial 0 with value: 0.986812.[0m
[32m[I 2023-02-26 17:44:13,178][0m Trial 10 finished with value: 0.3781255596969302 and parameters: {'lgbm_num_leaves': 63, 'lgbm_learning_rate': 1.0323706839346269e-06, 'lgbm_n_estimators': 10, 'lgbm_reg_alpha': 0.35000000000000003, 'lgbm_reg_lambda': 0.6000000000000001}. Best is trial 0 with value: 0.986812.[0m
[32m[I 2023-02-26 17:44:46,446][0m Trial 11 finished with value: 0.9834984175779297 and parameters: {'lgbm_num_leaves': 7, 'lgbm_learning_rate': 0.1497019847714843, 'lgbm_n_estimators': 80, 'lgbm_reg_alpha': 0.25, 'lgbm_reg_lambda': 0.45}. Best is trial 0 with value: 0.986812.[0m
[32m[I 2023-02-26 17:45:04,676][0m Trial 12 finished with value: 0.9865784140340159 and parameters: {'lgbm_num_leaves': 63, 'lgbm_learning_rate': 0.10918713799043125, 'lgbm_n_estimators': 30, 'lgbm_reg_alpha': 0.0, 'lgbm_reg_lambda': 0.7000000000000001}. Best is trial 0 with value: 0.986812.[0m
[32m[I 2023-02-26 17:45:22,491][0m Trial 13 finished with value: 0.9838800697996699 and parameters: {'lgbm_num_leaves': 63, 'lgbm_learning_rate': 0.026009607408484244, 'lgbm_n_estimators': 30, 'lgbm_reg_alpha': 0.05, 'lgbm_reg_lambda': 0.75}. Best is trial 0 with value: 0.986812.[0m
[32m[I 2023-02-26 17:45:49,967][0m Trial 14 finished with value: 0.984656832866819 and parameters: {'lgbm_num_leaves': 63, 'lgbm_learning_rate': 0.02726836400285531, 'lgbm_n_estimators': 50, 'lgbm_reg_alpha': 0.8500000000000001, 'lgbm_reg_lambda': 0.7000000000000001}. Best is trial 0 with value: 0.986812.[0m
[32m[I 2023-02-26 17:46:56,788][0m Trial 15 finished with value: 0.38128506928487604 and parameters: {'lgbm_num_leaves': 63, 'lgbm_learning_rate': 0.8873243170461979, 'lgbm_n_estimators': 140, 'lgbm_reg_alpha': 0.4, 'lgbm_reg_lambda': 0.55}. Best is trial 0 with value: 0.986812.[0m
[32m[I 2023-02-26 17:47:03,761][0m Trial 16 finished with value: 0.893019405872107 and parameters: {'lgbm_num_leaves': 15, 'lgbm_learning_rate': 0.013802409578943398, 'lgbm_n_estimators': 10, 'lgbm_reg_alpha': 0.05, 'lgbm_reg_lambda': 0.8}. Best is trial 0 with value: 0.986812.[0m
[32m[I 2023-02-26 17:48:42,656][0m Trial 17 finished with value: 0.3781255596969302 and parameters: {'lgbm_num_leaves': 63, 'lgbm_learning_rate': 0.00018145693040509344, 'lgbm_n_estimators': 200, 'lgbm_reg_alpha': 0.0, 'lgbm_reg_lambda': 1.0}. Best is trial 0 with value: 0.986812.[0m
[32m[I 2023-02-26 17:49:15,347][0m Trial 18 finished with value: 0.9880608305810955 and parameters: {'lgbm_num_leaves': 63, 'lgbm_learning_rate': 0.15331274928304464, 'lgbm_n_estimators': 60, 'lgbm_reg_alpha': 0.8500000000000001, 'lgbm_reg_lambda': 0.4}. Best is trial 18 with value: 0.988061.[0m
[32m[I 2023-02-26 17:49:48,346][0m Trial 19 finished with value: 0.9891907727045012 and parameters: {'lgbm_num_leaves': 63, 'lgbm_learning_rate': 0.2865735972734516, 'lgbm_n_estimators': 60, 'lgbm_reg_alpha': 0.8500000000000001, 'lgbm_reg_lambda': 0.35000000000000003}. Best is trial 19 with value: 0.989191.[0m
[32m[I 2023-02-26 17:49:48,393][0m Study finished.[0m
[32m[I 2023-02-26 17:49:48,424][0m --------------------------------------------------------------------------------[0m
[32m[I 2023-02-26 17:49:48,424][0m --------------------       LinearDiscriminantAnalysis       --------------------[0m
[32m[I 2023-02-26 17:49:48,424][0m --------------------------------------------------------------------------------[0m
[32m[I 2023-02-26 17:49:48,455][0m A new study created in RDB with name: LinearDiscriminantAnalysis_03691551[0m
[32m[I 2023-02-26 17:49:48,455][0m Study started.[0m
[32m[I 2023-02-26 17:49:55,272][0m Trial 0 finished with value: 0.8524550429116526 and parameters: {'lda_solver': 'eigen', 'lda_n_components': 3, 'lda_tol': 0.0001}. Best is trial 0 with value: 0.852455.[0m
[32m[I 2023-02-26 17:50:02,228][0m Trial 1 finished with value: 0.8524550429116526 and parameters: {'lda_solver': 'eigen', 'lda_n_components': 2, 'lda_tol': 0.0001}. Best is trial 0 with value: 0.852455.[0m
[32m[I 2023-02-26 17:50:09,153][0m Trial 2 finished with value: 0.8524550429116526 and parameters: {'lda_solver': 'eigen', 'lda_n_components': 2, 'lda_tol': 0.001}. Best is trial 0 with value: 0.852455.[0m
[32m[I 2023-02-26 17:50:16,047][0m Trial 3 finished with value: 0.8524550429116526 and parameters: {'lda_solver': 'eigen', 'lda_n_components': 3, 'lda_tol': 1e-05}. Best is trial 0 with value: 0.852455.[0m
[32m[I 2023-02-26 17:50:22,923][0m Trial 4 finished with value: 0.8524550429116526 and parameters: {'lda_solver': 'eigen', 'lda_n_components': 3, 'lda_tol': 0.0001}. Best is trial 0 with value: 0.852455.[0m
[32m[I 2023-02-26 17:50:28,569][0m Trial 5 finished with value: 0.8524413970410073 and parameters: {'lda_solver': 'lsqr', 'lda_n_components': 3, 'lda_tol': 0.001}. Best is trial 0 with value: 0.852455.[0m
[32m[I 2023-02-26 17:50:35,236][0m Trial 6 finished with value: 0.8698521292148584 and parameters: {'lda_solver': 'svd', 'lda_n_components': 4}. Best is trial 6 with value: 0.869852.[0m
[32m[I 2023-02-26 17:50:41,939][0m Trial 7 finished with value: 0.8698521292148584 and parameters: {'lda_solver': 'svd', 'lda_n_components': 3}. Best is trial 6 with value: 0.869852.[0m
[32m[I 2023-02-26 17:50:48,632][0m Trial 8 finished with value: 0.8698521292148584 and parameters: {'lda_solver': 'svd', 'lda_n_components': 1}. Best is trial 6 with value: 0.869852.[0m
[32m[I 2023-02-26 17:50:55,540][0m Trial 9 finished with value: 0.8524550429116526 and parameters: {'lda_solver': 'eigen', 'lda_n_components': 4, 'lda_tol': 1e-05}. Best is trial 6 with value: 0.869852.[0m
[32m[I 2023-02-26 17:51:02,303][0m Trial 10 finished with value: 0.8698521292148584 and parameters: {'lda_solver': 'svd', 'lda_n_components': 4}. Best is trial 6 with value: 0.869852.[0m
[32m[I 2023-02-26 17:51:08,963][0m Trial 11 finished with value: 0.8698521292148584 and parameters: {'lda_solver': 'svd', 'lda_n_components': 4}. Best is trial 6 with value: 0.869852.[0m
[32m[I 2023-02-26 17:51:15,746][0m Trial 12 finished with value: 0.8698521292148584 and parameters: {'lda_solver': 'svd', 'lda_n_components': 4}. Best is trial 6 with value: 0.869852.[0m
[32m[I 2023-02-26 17:51:22,439][0m Trial 13 finished with value: 0.8698521292148584 and parameters: {'lda_solver': 'svd', 'lda_n_components': 2}. Best is trial 6 with value: 0.869852.[0m
[32m[I 2023-02-26 17:51:28,146][0m Trial 14 finished with value: 0.8524413970410073 and parameters: {'lda_solver': 'lsqr', 'lda_n_components': 4, 'lda_tol': 0.001}. Best is trial 6 with value: 0.869852.[0m
[32m[I 2023-02-26 17:51:34,818][0m Trial 15 finished with value: 0.8698521292148584 and parameters: {'lda_solver': 'svd', 'lda_n_components': 3}. Best is trial 6 with value: 0.869852.[0m
[32m[I 2023-02-26 17:51:41,536][0m Trial 16 finished with value: 0.8698521292148584 and parameters: {'lda_solver': 'svd', 'lda_n_components': 1}. Best is trial 6 with value: 0.869852.[0m
[32m[I 2023-02-26 17:51:47,178][0m Trial 17 finished with value: 0.8524413970410073 and parameters: {'lda_solver': 'lsqr', 'lda_n_components': 1, 'lda_tol': 1e-05}. Best is trial 6 with value: 0.869852.[0m
[32m[I 2023-02-26 17:51:53,929][0m Trial 18 finished with value: 0.8698521292148584 and parameters: {'lda_solver': 'svd', 'lda_n_components': 1}. Best is trial 18 with value: 0.869852.[0m
[32m[I 2023-02-26 17:52:00,619][0m Trial 19 finished with value: 0.8698521292148584 and parameters: {'lda_solver': 'svd', 'lda_n_components': 1}. Best is trial 19 with value: 0.869852.[0m
[32m[I 2023-02-26 17:52:00,682][0m Study finished.[0m
[32m[I 2023-02-26 17:52:00,697][0m --------------------------------------------------------------------------------[0m
[32m[I 2023-02-26 17:52:00,713][0m --------------------               LinearSVC                --------------------[0m
[32m[I 2023-02-26 17:52:00,713][0m --------------------------------------------------------------------------------[0m
[32m[I 2023-02-26 17:52:00,729][0m A new study created in RDB with name: LinearSVC_03691551[0m
[32m[I 2023-02-26 17:52:00,744][0m Study started.[0m
[32m[I 2023-02-26 17:52:40,046][0m Trial 0 finished with value: 0.8257874183974058 and parameters: {'lsvc_dual': False, 'lsvc_C': 0.7523852267060082, 'lsvc_max_iter': 2000}. Best is trial 0 with value: 0.825787.[0m
[32m[I 2023-02-26 17:53:19,665][0m Trial 1 finished with value: 0.8257984503501749 and parameters: {'lsvc_dual': False, 'lsvc_C': 1.5957611459475256e-06, 'lsvc_max_iter': 2000}. Best is trial 1 with value: 0.825798.[0m
[32m[I 2023-02-26 17:53:57,440][0m Trial 2 finished with value: 0.8285794430235768 and parameters: {'lsvc_dual': False, 'lsvc_C': 0.025997361413061228, 'lsvc_max_iter': 2000}. Best is trial 2 with value: 0.828579.[0m
[32m[I 2023-02-26 17:54:34,826][0m Trial 3 finished with value: 0.8254777048319392 and parameters: {'lsvc_dual': False, 'lsvc_C': 34.60956378971852, 'lsvc_max_iter': 2000}. Best is trial 2 with value: 0.828579.[0m
[32m[I 2023-02-26 17:55:11,310][0m Trial 4 finished with value: 0.8291278562877659 and parameters: {'lsvc_dual': False, 'lsvc_C': 0.048806834372150824, 'lsvc_max_iter': 2000}. Best is trial 4 with value: 0.829128.[0m
[32m[I 2023-02-26 17:55:48,834][0m Trial 5 finished with value: 0.8269854737307019 and parameters: {'lsvc_dual': False, 'lsvc_C': 0.00498982145796624, 'lsvc_max_iter': 2000}. Best is trial 4 with value: 0.829128.[0m
[32m[I 2023-02-26 17:56:25,465][0m Trial 6 finished with value: 0.8255082889876505 and parameters: {'lsvc_dual': False, 'lsvc_C': 0.057662418380045356, 'lsvc_max_iter': 2000}. Best is trial 4 with value: 0.829128.[0m
[32m[I 2023-02-26 17:57:01,895][0m Trial 7 finished with value: 0.8255045400732427 and parameters: {'lsvc_dual': False, 'lsvc_C': 0.17455527949056227, 'lsvc_max_iter': 2000}. Best is trial 4 with value: 0.829128.[0m
[32m[I 2023-02-26 17:57:41,237][0m Trial 8 finished with value: 0.825753730491364 and parameters: {'lsvc_dual': False, 'lsvc_C': 7.368505571117037e-05, 'lsvc_max_iter': 2000}. Best is trial 4 with value: 0.829128.[0m
[32m[I 2023-02-26 17:58:21,018][0m Trial 9 finished with value: 0.8257873645696928 and parameters: {'lsvc_dual': False, 'lsvc_C': 18.207447607186264, 'lsvc_max_iter': 2000}. Best is trial 4 with value: 0.829128.[0m
[32m[I 2023-02-26 17:58:58,654][0m Trial 10 finished with value: 0.8286249694343483 and parameters: {'lsvc_dual': False, 'lsvc_C': 488.46839552584623, 'lsvc_max_iter': 2000}. Best is trial 4 with value: 0.829128.[0m
[32m[I 2023-02-26 17:59:33,338][0m Trial 11 finished with value: 0.8255156790739031 and parameters: {'lsvc_dual': False, 'lsvc_C': 749.7130460951246, 'lsvc_max_iter': 2000}. Best is trial 4 with value: 0.829128.[0m
[32m[I 2023-02-26 18:00:13,372][0m Trial 12 finished with value: 0.8257911136599588 and parameters: {'lsvc_dual': False, 'lsvc_C': 0.0005925585225706159, 'lsvc_max_iter': 2000}. Best is trial 4 with value: 0.829128.[0m
[32m[I 2023-02-26 18:00:50,086][0m Trial 13 finished with value: 0.8255082889876505 and parameters: {'lsvc_dual': False, 'lsvc_C': 464.9692415231514, 'lsvc_max_iter': 2000}. Best is trial 4 with value: 0.829128.[0m
[32m[I 2023-02-26 18:01:26,419][0m Trial 14 finished with value: 0.8286250214181227 and parameters: {'lsvc_dual': False, 'lsvc_C': 4.63352619618575, 'lsvc_max_iter': 2000}. Best is trial 4 with value: 0.829128.[0m
[32m[I 2023-02-26 18:02:06,402][0m Trial 15 finished with value: 0.8257892391146455 and parameters: {'lsvc_dual': False, 'lsvc_C': 1.416529913894507, 'lsvc_max_iter': 2000}. Best is trial 4 with value: 0.829128.[0m
[32m[I 2023-02-26 18:02:45,439][0m Trial 16 finished with value: 0.8257399668358888 and parameters: {'lsvc_dual': False, 'lsvc_C': 5.176311256911705, 'lsvc_max_iter': 2000}. Best is trial 4 with value: 0.829128.[0m
[32m[I 2023-02-26 18:03:21,510][0m Trial 17 finished with value: 0.8255175535340191 and parameters: {'lsvc_dual': False, 'lsvc_C': 0.0035038421259016733, 'lsvc_max_iter': 2000}. Best is trial 4 with value: 0.829128.[0m
[32m[I 2023-02-26 18:03:57,568][0m Trial 18 finished with value: 0.8254609489332416 and parameters: {'lsvc_dual': False, 'lsvc_C': 0.27034814459938816, 'lsvc_max_iter': 2000}. Best is trial 4 with value: 0.829128.[0m
