[32m[I 2023-02-26 20:25:13,961][0m Trial 16 finished with value: 0.3781255596969302 and parameters: {'lsvc_rbfs_kernel_gamma': 0.0017115045760957666, 'lsvc_rbfs_kernel_n_components': 150, 'lsvc_rbfs_dual': False, 'lsvc_rbfs_C': 909.2840259510963, 'lsvc_rbfs_max_iter': 2000}. Best is trial 0 with value: 0.378126.[0m
[32m[I 2023-02-26 20:25:46,300][0m Trial 17 finished with value: 0.3781255596969302 and parameters: {'lsvc_rbfs_kernel_gamma': 0.7090660094011796, 'lsvc_rbfs_kernel_n_components': 100, 'lsvc_rbfs_dual': False, 'lsvc_rbfs_C': 0.00017056776800452317, 'lsvc_rbfs_max_iter': 2000}. Best is trial 0 with value: 0.378126.[0m
[32m[I 2023-02-26 20:26:21,322][0m Trial 18 finished with value: 0.3781255596969302 and parameters: {'lsvc_rbfs_kernel_gamma': 90.00049201550901, 'lsvc_rbfs_kernel_n_components': 100, 'lsvc_rbfs_dual': False, 'lsvc_rbfs_C': 0.847758761449289, 'lsvc_rbfs_max_iter': 2000}. Best is trial 0 with value: 0.378126.[0m
[32m[I 2023-02-26 20:27:11,832][0m Trial 19 finished with value: 0.3781255596969302 and parameters: {'lsvc_rbfs_kernel_gamma': 0.001545587627762497, 'lsvc_rbfs_kernel_n_components': 150, 'lsvc_rbfs_dual': False, 'lsvc_rbfs_C': 857.0497486015917, 'lsvc_rbfs_max_iter': 2000}. Best is trial 0 with value: 0.378126.[0m
[32m[I 2023-02-26 20:27:11,910][0m Study finished.[0m
[32m[I 2023-02-26 20:27:11,941][0m --------------------------------------------------------------------------------[0m
[32m[I 2023-02-26 20:27:11,941][0m --------------------             MLPClassifier              --------------------[0m
[32m[I 2023-02-26 20:27:11,941][0m --------------------------------------------------------------------------------[0m
[32m[I 2023-02-26 20:27:11,972][0m A new study created in RDB with name: MLPClassifier_03691551[0m
[32m[I 2023-02-26 20:27:11,988][0m Study started.[0m
[32m[I 2023-02-26 20:27:12,379][0m sklearn.model_selection.train_test_split: running accelerated version on CPU[0m
[32m[I 2023-02-26 20:27:12,535][0m sklearn.model_selection.train_test_split: fallback to original Scikit-learn[0m
[32m[I 2023-02-26 20:31:18,812][0m Trial 0 finished with value: 0.3781255596969302 and parameters: {'mlpc_hidden_layer_count': 2, 'mlpc_learning_rate': 'constant', 'mlpc_learning_rate_init': 0.031440302601538885, 'mplc_max_iter': 2000}. Best is trial 0 with value: 0.378126.[0m
[32m[I 2023-02-26 20:31:19,265][0m sklearn.model_selection.train_test_split: running accelerated version on CPU[0m
[32m[I 2023-02-26 20:31:19,454][0m sklearn.model_selection.train_test_split: fallback to original Scikit-learn[0m
[32m[I 2023-02-26 20:32:09,659][0m Trial 1 finished with value: 0.3781255596969302 and parameters: {'mlpc_hidden_layer_count': 1, 'mlpc_learning_rate': 'constant', 'mlpc_learning_rate_init': 0.9198408983728238, 'mplc_max_iter': 2000}. Best is trial 0 with value: 0.378126.[0m
[32m[I 2023-02-26 20:32:10,081][0m sklearn.model_selection.train_test_split: running accelerated version on CPU[0m
[32m[I 2023-02-26 20:32:10,254][0m sklearn.model_selection.train_test_split: fallback to original Scikit-learn[0m
[32m[I 2023-02-26 20:35:02,583][0m Trial 2 finished with value: 0.8703958210706738 and parameters: {'mlpc_hidden_layer_count': 1, 'mlpc_learning_rate': 'constant', 'mlpc_learning_rate_init': 8.755765681410345e-06, 'mplc_max_iter': 2000}. Best is trial 2 with value: 0.870396.[0m
[32m[I 2023-02-26 20:35:03,005][0m sklearn.model_selection.train_test_split: running accelerated version on CPU[0m
[32m[I 2023-02-26 20:35:03,161][0m sklearn.model_selection.train_test_split: fallback to original Scikit-learn[0m
[32m[I 2023-02-26 20:59:50,087][0m Trial 3 finished with value: 0.9048320643358111 and parameters: {'mlpc_hidden_layer_count': 3, 'mlpc_learning_rate': 'invscaling', 'mlpc_learning_rate_init': 6.189070693723017e-05, 'mplc_max_iter': 2000}. Best is trial 3 with value: 0.904832.[0m
[32m[I 2023-02-26 20:59:50,540][0m sklearn.model_selection.train_test_split: running accelerated version on CPU[0m
[32m[I 2023-02-26 20:59:50,716][0m sklearn.model_selection.train_test_split: fallback to original Scikit-learn[0m
[32m[I 2023-02-26 21:03:48,655][0m Trial 4 finished with value: 0.3781246893331529 and parameters: {'mlpc_hidden_layer_count': 2, 'mlpc_learning_rate': 'adaptive', 'mlpc_learning_rate_init': 0.002763852090341241, 'mplc_max_iter': 2000}. Best is trial 3 with value: 0.904832.[0m
[32m[I 2023-02-26 21:03:49,125][0m sklearn.model_selection.train_test_split: running accelerated version on CPU[0m
[32m[I 2023-02-26 21:03:49,297][0m sklearn.model_selection.train_test_split: fallback to original Scikit-learn[0m
[32m[I 2023-02-26 21:05:03,237][0m Trial 5 finished with value: 0.8633296656731564 and parameters: {'mlpc_hidden_layer_count': 1, 'mlpc_learning_rate': 'adaptive', 'mlpc_learning_rate_init': 7.577659573239193e-05, 'mplc_max_iter': 2000}. Best is trial 3 with value: 0.904832.[0m
[32m[I 2023-02-26 21:05:03,659][0m sklearn.model_selection.train_test_split: running accelerated version on CPU[0m
[32m[I 2023-02-26 21:05:03,832][0m sklearn.model_selection.train_test_split: fallback to original Scikit-learn[0m
[32m[I 2023-02-26 21:11:34,954][0m Trial 6 finished with value: 0.3781255596969302 and parameters: {'mlpc_hidden_layer_count': 3, 'mlpc_learning_rate': 'invscaling', 'mlpc_learning_rate_init': 0.41405481691919876, 'mplc_max_iter': 2000}. Best is trial 3 with value: 0.904832.[0m
[32m[I 2023-02-26 21:11:35,392][0m sklearn.model_selection.train_test_split: running accelerated version on CPU[0m
[32m[I 2023-02-26 21:11:35,566][0m sklearn.model_selection.train_test_split: fallback to original Scikit-learn[0m
[32m[I 2023-02-26 21:15:30,886][0m Trial 7 finished with value: 0.3781255596969302 and parameters: {'mlpc_hidden_layer_count': 2, 'mlpc_learning_rate': 'constant', 'mlpc_learning_rate_init': 0.0058685494034106875, 'mplc_max_iter': 2000}. Best is trial 3 with value: 0.904832.[0m
[32m[I 2023-02-26 21:15:31,355][0m sklearn.model_selection.train_test_split: running accelerated version on CPU[0m
[32m[I 2023-02-26 21:15:31,513][0m sklearn.model_selection.train_test_split: fallback to original Scikit-learn[0m
[32m[I 2023-02-26 21:17:02,705][0m Trial 8 finished with value: 0.3781255596969302 and parameters: {'mlpc_hidden_layer_count': 1, 'mlpc_learning_rate': 'adaptive', 'mlpc_learning_rate_init': 0.09520285721837936, 'mplc_max_iter': 2000}. Best is trial 3 with value: 0.904832.[0m
[32m[I 2023-02-26 21:17:03,142][0m sklearn.model_selection.train_test_split: running accelerated version on CPU[0m
[32m[I 2023-02-26 21:17:03,299][0m sklearn.model_selection.train_test_split: fallback to original Scikit-learn[0m
[32m[I 2023-02-26 21:22:53,457][0m Trial 9 finished with value: 0.3781255596969302 and parameters: {'mlpc_hidden_layer_count': 3, 'mlpc_learning_rate': 'invscaling', 'mlpc_learning_rate_init': 0.031542879542992765, 'mplc_max_iter': 2000}. Best is trial 3 with value: 0.904832.[0m
[32m[I 2023-02-26 21:22:53,910][0m sklearn.model_selection.train_test_split: running accelerated version on CPU[0m
[32m[I 2023-02-26 21:22:54,067][0m sklearn.model_selection.train_test_split: fallback to original Scikit-learn[0m
[32m[I 2023-02-26 21:36:02,514][0m Trial 10 finished with value: 0.8659756789248929 and parameters: {'mlpc_hidden_layer_count': 3, 'mlpc_learning_rate': 'invscaling', 'mlpc_learning_rate_init': 1.7492612621392721e-06, 'mplc_max_iter': 2000}. Best is trial 3 with value: 0.904832.[0m
[32m[I 2023-02-26 21:36:02,576][0m Study finished.[0m
[32m[I 2023-02-26 21:36:02,592][0m --------------------------------------------------------------------------------[0m
[32m[I 2023-02-26 21:36:02,592][0m --------------------             MultinomialNB              --------------------[0m
[32m[I 2023-02-26 21:36:02,592][0m --------------------------------------------------------------------------------[0m
[32m[I 2023-02-26 21:36:02,639][0m A new study created in RDB with name: MultinomialNB_03691551[0m
[32m[I 2023-02-26 21:36:02,639][0m Study started.[0m
[32m[I 2023-02-26 21:36:04,782][0m Trial 0 finished with value: 0.5335515326566682 and parameters: {'mnb_alpha': 1.0, 'mnb_fit_prior': True}. Best is trial 0 with value: 0.533552.[0m
[32m[I 2023-02-26 21:36:06,954][0m Trial 1 finished with value: 0.5337623070083589 and parameters: {'mnb_alpha': 0.1, 'mnb_fit_prior': False}. Best is trial 1 with value: 0.533762.[0m
[32m[I 2023-02-26 21:36:09,111][0m Trial 2 finished with value: 0.5335836748605411 and parameters: {'mnb_alpha': 0.55, 'mnb_fit_prior': False}. Best is trial 1 with value: 0.533762.[0m
[32m[I 2023-02-26 21:36:11,254][0m Trial 3 finished with value: 0.533658139966192 and parameters: {'mnb_alpha': 0.25, 'mnb_fit_prior': False}. Best is trial 1 with value: 0.533762.[0m
[32m[I 2023-02-26 21:36:13,411][0m Trial 4 finished with value: 0.5337786867318915 and parameters: {'mnb_alpha': 0.1, 'mnb_fit_prior': True}. Best is trial 4 with value: 0.533779.[0m
[32m[I 2023-02-26 21:36:15,568][0m Trial 5 finished with value: 0.5338231716741023 and parameters: {'mnb_alpha': 0.05, 'mnb_fit_prior': False}. Best is trial 5 with value: 0.533823.[0m
[32m[I 2023-02-26 21:36:17,711][0m Trial 6 finished with value: 0.533658139966192 and parameters: {'mnb_alpha': 0.25, 'mnb_fit_prior': False}. Best is trial 5 with value: 0.533823.[0m
[32m[I 2023-02-26 21:36:19,837][0m Trial 7 finished with value: 0.533606572722816 and parameters: {'mnb_alpha': 0.5, 'mnb_fit_prior': True}. Best is trial 5 with value: 0.533823.[0m
[32m[I 2023-02-26 21:36:21,994][0m Trial 8 finished with value: 0.5337623070083589 and parameters: {'mnb_alpha': 0.1, 'mnb_fit_prior': False}. Best is trial 5 with value: 0.533823.[0m
[32m[I 2023-02-26 21:36:24,151][0m Trial 9 finished with value: 0.533563697458066 and parameters: {'mnb_alpha': 0.75, 'mnb_fit_prior': True}. Best is trial 5 with value: 0.533823.[0m
[32m[I 2023-02-26 21:36:26,294][0m Trial 10 finished with value: 0.5336434434659328 and parameters: {'mnb_alpha': 0.30000000000000004, 'mnb_fit_prior': False}. Best is trial 5 with value: 0.533823.[0m
[32m[I 2023-02-26 21:36:28,451][0m Trial 11 finished with value: 0.5357221148041305 and parameters: {'mnb_alpha': 0.0, 'mnb_fit_prior': True}. Best is trial 11 with value: 0.535722.[0m
[32m[I 2023-02-26 21:36:30,625][0m Trial 12 finished with value: 0.5357221148041305 and parameters: {'mnb_alpha': 0.0, 'mnb_fit_prior': True}. Best is trial 11 with value: 0.535722.[0m
[32m[I 2023-02-26 21:36:32,747][0m Trial 13 finished with value: 0.5336421911536825 and parameters: {'mnb_alpha': 0.35000000000000003, 'mnb_fit_prior': True}. Best is trial 11 with value: 0.535722.[0m
[32m[I 2023-02-26 21:36:34,922][0m Trial 14 finished with value: 0.5357221148041305 and parameters: {'mnb_alpha': 0.0, 'mnb_fit_prior': True}. Best is trial 11 with value: 0.535722.[0m
[32m[I 2023-02-26 21:36:37,064][0m Trial 15 finished with value: 0.5335666529533578 and parameters: {'mnb_alpha': 0.7000000000000001, 'mnb_fit_prior': True}. Best is trial 11 with value: 0.535722.[0m
[32m[I 2023-02-26 21:36:39,190][0m Trial 16 finished with value: 0.5336258309370043 and parameters: {'mnb_alpha': 0.4, 'mnb_fit_prior': True}. Best is trial 11 with value: 0.535722.[0m
[32m[I 2023-02-26 21:36:41,337][0m Trial 17 finished with value: 0.5336916317424043 and parameters: {'mnb_alpha': 0.2, 'mnb_fit_prior': True}. Best is trial 11 with value: 0.535722.[0m
[32m[I 2023-02-26 21:36:43,494][0m Trial 18 finished with value: 0.5357221148041305 and parameters: {'mnb_alpha': 0.0, 'mnb_fit_prior': True}. Best is trial 11 with value: 0.535722.[0m
[32m[I 2023-02-26 21:36:45,650][0m Trial 19 finished with value: 0.5337327346981315 and parameters: {'mnb_alpha': 0.15000000000000002, 'mnb_fit_prior': True}. Best is trial 11 with value: 0.535722.[0m
[32m[I 2023-02-26 21:36:45,713][0m Study finished.[0m
[32m[I 2023-02-26 21:36:45,728][0m --------------------------------------------------------------------------------[0m
[32m[I 2023-02-26 21:36:45,728][0m --------------------      PassiveAggressiveClassifier       --------------------[0m
[32m[I 2023-02-26 21:36:45,728][0m --------------------------------------------------------------------------------[0m
[32m[I 2023-02-26 21:36:45,760][0m A new study created in RDB with name: PassiveAggressiveClassifier_03691551[0m
[32m[I 2023-02-26 21:36:45,775][0m Study started.[0m
[32m[I 2023-02-26 21:37:13,530][0m Trial 0 finished with value: 0.7883499323605928 and parameters: {'pac_C': 500.78071292342474, 'pac_early_stopping': True, 'pac_validation_fraction': 0.25, 'pac_n_iter_no_change': 10}. Best is trial 0 with value: 0.78835.[0m
[32m[I 2023-02-26 21:37:41,346][0m Trial 1 finished with value: 0.7609914726154008 and parameters: {'pac_C': 1.2650571028028528e-06, 'pac_early_stopping': True, 'pac_validation_fraction': 0.25, 'pac_n_iter_no_change': 10}. Best is trial 0 with value: 0.78835.[0m
[32m[I 2023-02-26 21:38:09,132][0m Trial 2 finished with value: 0.7620781224788498 and parameters: {'pac_C': 1.3873803422288758e-06, 'pac_early_stopping': True, 'pac_validation_fraction': 0.25, 'pac_n_iter_no_change': 10}. Best is trial 0 with value: 0.78835.[0m
[32m[I 2023-02-26 21:38:36,881][0m Trial 3 finished with value: 0.7883499323605928 and parameters: {'pac_C': 0.00017607707257630137, 'pac_early_stopping': True, 'pac_validation_fraction': 0.25, 'pac_n_iter_no_change': 10}. Best is trial 0 with value: 0.78835.[0m
[32m[I 2023-02-26 21:39:04,591][0m Trial 4 finished with value: 0.7883499323605928 and parameters: {'pac_C': 0.0018093236879755392, 'pac_early_stopping': True, 'pac_validation_fraction': 0.25, 'pac_n_iter_no_change': 10}. Best is trial 0 with value: 0.78835.[0m
[32m[I 2023-02-26 21:39:32,412][0m Trial 5 finished with value: 0.7883499323605928 and parameters: {'pac_C': 7.219969141318764e-05, 'pac_early_stopping': True, 'pac_validation_fraction': 0.25, 'pac_n_iter_no_change': 10}. Best is trial 0 with value: 0.78835.[0m
[32m[I 2023-02-26 21:40:00,155][0m Trial 6 finished with value: 0.7883499323605928 and parameters: {'pac_C': 0.24631684940694912, 'pac_early_stopping': True, 'pac_validation_fraction': 0.25, 'pac_n_iter_no_change': 10}. Best is trial 0 with value: 0.78835.[0m
[32m[I 2023-02-26 21:40:27,963][0m Trial 7 finished with value: 0.7883499323605928 and parameters: {'pac_C': 8.74826599603717, 'pac_early_stopping': True, 'pac_validation_fraction': 0.25, 'pac_n_iter_no_change': 10}. Best is trial 0 with value: 0.78835.[0m
[32m[I 2023-02-26 21:40:55,724][0m Trial 8 finished with value: 0.7883499323605928 and parameters: {'pac_C': 0.01273390484179495, 'pac_early_stopping': True, 'pac_validation_fraction': 0.25, 'pac_n_iter_no_change': 10}. Best is trial 0 with value: 0.78835.[0m
[32m[I 2023-02-26 21:41:23,540][0m Trial 9 finished with value: 0.7883499323605928 and parameters: {'pac_C': 2.876089791492765, 'pac_early_stopping': True, 'pac_validation_fraction': 0.25, 'pac_n_iter_no_change': 10}. Best is trial 0 with value: 0.78835.[0m
[32m[I 2023-02-26 21:41:51,305][0m Trial 10 finished with value: 0.7883499323605928 and parameters: {'pac_C': 601.9885384343963, 'pac_early_stopping': True, 'pac_validation_fraction': 0.25, 'pac_n_iter_no_change': 10}. Best is trial 0 with value: 0.78835.[0m
[32m[I 2023-02-26 21:42:19,100][0m Trial 11 finished with value: 0.7883499323605928 and parameters: {'pac_C': 761.2989712670867, 'pac_early_stopping': True, 'pac_validation_fraction': 0.25, 'pac_n_iter_no_change': 10}. Best is trial 0 with value: 0.78835.[0m
[32m[I 2023-02-26 21:42:46,849][0m Trial 12 finished with value: 0.7883499323605928 and parameters: {'pac_C': 0.00014476463283831463, 'pac_early_stopping': True, 'pac_validation_fraction': 0.25, 'pac_n_iter_no_change': 10}. Best is trial 0 with value: 0.78835.[0m
[32m[I 2023-02-26 21:43:14,609][0m Trial 13 finished with value: 0.7883499323605928 and parameters: {'pac_C': 9.654791148344208e-05, 'pac_early_stopping': True, 'pac_validation_fraction': 0.25, 'pac_n_iter_no_change': 10}. Best is trial 0 with value: 0.78835.[0m
[32m[I 2023-02-26 21:43:41,597][0m Trial 14 finished with value: 0.7883499323605928 and parameters: {'pac_C': 20.48628038254652, 'pac_early_stopping': True, 'pac_validation_fraction': 0.25, 'pac_n_iter_no_change': 10}. Best is trial 0 with value: 0.78835.[0m
[32m[I 2023-02-26 21:44:08,614][0m Trial 15 finished with value: 0.7883499323605928 and parameters: {'pac_C': 0.17830968016408583, 'pac_early_stopping': True, 'pac_validation_fraction': 0.25, 'pac_n_iter_no_change': 10}. Best is trial 0 with value: 0.78835.[0m
[32m[I 2023-02-26 21:44:36,393][0m Trial 16 finished with value: 0.7883499323605928 and parameters: {'pac_C': 0.0025498814442799357, 'pac_early_stopping': True, 'pac_validation_fraction': 0.25, 'pac_n_iter_no_change': 10}. Best is trial 0 with value: 0.78835.[0m
[32m[I 2023-02-26 21:45:04,326][0m Trial 17 finished with value: 0.7883499323605928 and parameters: {'pac_C': 48.2485323999096, 'pac_early_stopping': True, 'pac_validation_fraction': 0.25, 'pac_n_iter_no_change': 10}. Best is trial 0 with value: 0.78835.[0m
[32m[I 2023-02-26 21:45:32,151][0m Trial 18 finished with value: 0.7883499323605928 and parameters: {'pac_C': 0.3734537139474898, 'pac_early_stopping': True, 'pac_validation_fraction': 0.25, 'pac_n_iter_no_change': 10}. Best is trial 0 with value: 0.78835.[0m
[32m[I 2023-02-26 21:45:59,713][0m Trial 19 finished with value: 0.7883499323605928 and parameters: {'pac_C': 0.0035103141876891425, 'pac_early_stopping': True, 'pac_validation_fraction': 0.25, 'pac_n_iter_no_change': 10}. Best is trial 0 with value: 0.78835.[0m
[32m[I 2023-02-26 21:45:59,775][0m Study finished.[0m
[32m[I 2023-02-26 21:45:59,791][0m --------------------------------------------------------------------------------[0m
[32m[I 2023-02-26 21:45:59,807][0m --------------------               Perceptron               --------------------[0m
[32m[I 2023-02-26 21:45:59,807][0m --------------------------------------------------------------------------------[0m
[32m[I 2023-02-26 21:45:59,822][0m A new study created in RDB with name: Perceptron_03691551[0m
[32m[I 2023-02-26 21:45:59,838][0m Study started.[0m
[32m[I 2023-02-26 21:46:32,415][0m Trial 0 finished with value: 0.5258321978414258 and parameters: {'p_penalty': 'elasticnet', 'p_alpha': 1.388954656999624e-05, 'p_eta0': 1.5, 'p_early_stopping': True, 'p_validation_fraction': 0.25, 'p_n_iter_no_change': 10}. Best is trial 0 with value: 0.525832.[0m
[32m[I 2023-02-26 21:47:07,428][0m Trial 1 finished with value: 0.4986646548782201 and parameters: {'p_penalty': 'elasticnet', 'p_alpha': 0.0795324931490203, 'p_eta0': 1.0, 'p_early_stopping': True, 'p_validation_fraction': 0.25, 'p_n_iter_no_change': 10}. Best is trial 0 with value: 0.525832.[0m
[32m[I 2023-02-26 21:47:40,211][0m Trial 2 finished with value: 0.3781255596969302 and parameters: {'p_penalty': 'elasticnet', 'p_alpha': 0.47530813405191985, 'p_eta0': 2.0, 'p_early_stopping': True, 'p_validation_fraction': 0.25, 'p_n_iter_no_change': 10}. Best is trial 0 with value: 0.525832.[0m
[32m[I 2023-02-26 21:48:06,044][0m Trial 3 finished with value: 0.6594161637958129 and parameters: {'p_penalty': 'elasticnet', 'p_alpha': 8.364067445719487e-06, 'p_eta0': 1.0, 'p_early_stopping': True, 'p_validation_fraction': 0.25, 'p_n_iter_no_change': 10}. Best is trial 3 with value: 0.659416.[0m
[32m[I 2023-02-26 21:48:31,884][0m Trial 4 finished with value: 0.7049531799678097 and parameters: {'p_penalty': 'elasticnet', 'p_alpha': 2.7348172531296484e-06, 'p_eta0': 0.5, 'p_early_stopping': True, 'p_validation_fraction': 0.25, 'p_n_iter_no_change': 10}. Best is trial 4 with value: 0.704953.[0m
[32m[I 2023-02-26 21:49:08,666][0m Trial 5 finished with value: 0.7104256101179052 and parameters: {'p_penalty': 'elasticnet', 'p_alpha': 1.3152388563783796e-06, 'p_eta0': 1.0, 'p_early_stopping': True, 'p_validation_fraction': 0.25, 'p_n_iter_no_change': 10}. Best is trial 5 with value: 0.710426.[0m
[32m[I 2023-02-26 21:49:36,176][0m Trial 6 finished with value: 0.6411893730851902 and parameters: {'p_penalty': 'elasticnet', 'p_alpha': 4.6471398511639964e-05, 'p_eta0': 0.5, 'p_early_stopping': True, 'p_validation_fraction': 0.25, 'p_n_iter_no_change': 10}. Best is trial 5 with value: 0.710426.[0m
[32m[I 2023-02-26 21:50:05,264][0m Trial 7 finished with value: 0.643322669367591 and parameters: {'p_penalty': 'elasticnet', 'p_alpha': 0.0005487365222808548, 'p_eta0': 0.5, 'p_early_stopping': True, 'p_validation_fraction': 0.25, 'p_n_iter_no_change': 10}. Best is trial 5 with value: 0.710426.[0m
[32m[I 2023-02-26 21:50:30,369][0m Trial 8 finished with value: 0.6429068988376239 and parameters: {'p_penalty': 'elasticnet', 'p_alpha': 0.001245585025478385, 'p_eta0': 1.0, 'p_early_stopping': True, 'p_validation_fraction': 0.25, 'p_n_iter_no_change': 10}. Best is trial 5 with value: 0.710426.[0m
[32m[I 2023-02-26 21:50:59,005][0m Trial 9 finished with value: 0.6451083848451445 and parameters: {'p_penalty': 'elasticnet', 'p_alpha': 0.0012357569233222817, 'p_eta0': 2.0, 'p_early_stopping': True, 'p_validation_fraction': 0.25, 'p_n_iter_no_change': 10}. Best is trial 5 with value: 0.710426.[0m
[32m[I 2023-02-26 21:51:32,873][0m Trial 10 finished with value: 0.00018895391781870453 and parameters: {'p_penalty': 'elasticnet', 'p_alpha': 0.017274044687984394, 'p_eta0': 1.5, 'p_early_stopping': True, 'p_validation_fraction': 0.25, 'p_n_iter_no_change': 10}. Best is trial 5 with value: 0.710426.[0m
