[32m[I 2023-02-26 18:04:34,650][0m Trial 19 finished with value: 0.8255157329489802 and parameters: {'lsvc_dual': False, 'lsvc_C': 5.307206956456252e-05, 'lsvc_max_iter': 2000}. Best is trial 4 with value: 0.829128.[0m
[32m[I 2023-02-26 18:04:34,712][0m Study finished.[0m
[32m[I 2023-02-26 18:04:34,728][0m --------------------------------------------------------------------------------[0m
[32m[I 2023-02-26 18:04:34,728][0m --------------------     LinearSVC_AdditiveChi2Sampler      --------------------[0m
[32m[I 2023-02-26 18:04:34,728][0m --------------------------------------------------------------------------------[0m
[32m[I 2023-02-26 18:04:34,759][0m A new study created in RDB with name: LinearSVC_AdditiveChi2Sampler_03691551[0m
[32m[I 2023-02-26 18:04:34,775][0m Study started.[0m
[32m[I 2023-02-26 18:14:54,688][0m Trial 0 finished with value: 0.9033586427811153 and parameters: {'lsvc_ac2s_kernel_sample_steps': 3, 'lsvc_ac2s_dual': False, 'lsvc_ac2s_C': 0.018266634801465544, 'lsvc_ac2s_max_iter': 2000}. Best is trial 0 with value: 0.903359.[0m
[32m[I 2023-02-26 18:21:39,136][0m Trial 1 finished with value: 0.897829087384045 and parameters: {'lsvc_ac2s_kernel_sample_steps': 3, 'lsvc_ac2s_dual': False, 'lsvc_ac2s_C': 0.00036210866458389067, 'lsvc_ac2s_max_iter': 2000}. Best is trial 0 with value: 0.903359.[0m
[32m[I 2023-02-26 18:25:36,617][0m Trial 2 finished with value: 0.873425412465652 and parameters: {'lsvc_ac2s_kernel_sample_steps': 3, 'lsvc_ac2s_dual': False, 'lsvc_ac2s_C': 1.2824360614665798e-05, 'lsvc_ac2s_max_iter': 2000}. Best is trial 0 with value: 0.903359.[0m
[32m[I 2023-02-26 18:26:34,019][0m Trial 3 finished with value: 0.8380538894201367 and parameters: {'lsvc_ac2s_kernel_sample_steps': 1, 'lsvc_ac2s_dual': False, 'lsvc_ac2s_C': 0.0003413471470296942, 'lsvc_ac2s_max_iter': 2000}. Best is trial 0 with value: 0.903359.[0m
[32m[I 2023-02-26 18:27:35,140][0m Trial 4 finished with value: 0.8456381575260228 and parameters: {'lsvc_ac2s_kernel_sample_steps': 1, 'lsvc_ac2s_dual': False, 'lsvc_ac2s_C': 6.714543944260033, 'lsvc_ac2s_max_iter': 2000}. Best is trial 0 with value: 0.903359.[0m
[32m[I 2023-02-26 18:36:33,123][0m Trial 5 finished with value: 0.9040387884738443 and parameters: {'lsvc_ac2s_kernel_sample_steps': 3, 'lsvc_ac2s_dual': False, 'lsvc_ac2s_C': 21.792787419179813, 'lsvc_ac2s_max_iter': 2000}. Best is trial 5 with value: 0.904039.[0m
[32m[I 2023-02-26 18:40:13,104][0m Trial 6 finished with value: 0.8940921469236268 and parameters: {'lsvc_ac2s_kernel_sample_steps': 2, 'lsvc_ac2s_dual': False, 'lsvc_ac2s_C': 119.80045432296886, 'lsvc_ac2s_max_iter': 2000}. Best is trial 5 with value: 0.904039.[0m
[32m[I 2023-02-26 18:41:12,745][0m Trial 7 finished with value: 0.8475448073427758 and parameters: {'lsvc_ac2s_kernel_sample_steps': 1, 'lsvc_ac2s_dual': False, 'lsvc_ac2s_C': 0.2550633944540817, 'lsvc_ac2s_max_iter': 2000}. Best is trial 5 with value: 0.904039.[0m
[32m[I 2023-02-26 18:45:19,058][0m Trial 8 finished with value: 0.8939061579210028 and parameters: {'lsvc_ac2s_kernel_sample_steps': 2, 'lsvc_ac2s_dual': False, 'lsvc_ac2s_C': 0.014899464644532491, 'lsvc_ac2s_max_iter': 2000}. Best is trial 5 with value: 0.904039.[0m
[32m[I 2023-02-26 18:48:19,203][0m Trial 9 finished with value: 0.8430775935963727 and parameters: {'lsvc_ac2s_kernel_sample_steps': 3, 'lsvc_ac2s_dual': False, 'lsvc_ac2s_C': 2.1522060755310977e-06, 'lsvc_ac2s_max_iter': 2000}. Best is trial 5 with value: 0.904039.[0m
[32m[I 2023-02-26 18:57:15,721][0m Trial 10 finished with value: 0.9032160559696663 and parameters: {'lsvc_ac2s_kernel_sample_steps': 3, 'lsvc_ac2s_dual': False, 'lsvc_ac2s_C': 587.7447935480794, 'lsvc_ac2s_max_iter': 2000}. Best is trial 5 with value: 0.904039.[0m
[32m[I 2023-02-26 19:07:44,887][0m Trial 11 finished with value: 0.9038803140570079 and parameters: {'lsvc_ac2s_kernel_sample_steps': 3, 'lsvc_ac2s_dual': False, 'lsvc_ac2s_C': 0.08567831462032797, 'lsvc_ac2s_max_iter': 2000}. Best is trial 5 with value: 0.904039.[0m
[32m[I 2023-02-26 19:07:44,965][0m Study finished.[0m
[32m[I 2023-02-26 19:07:44,981][0m --------------------------------------------------------------------------------[0m
[32m[I 2023-02-26 19:07:44,981][0m --------------------           LinearSVC_Nystroem           --------------------[0m
[32m[I 2023-02-26 19:07:44,981][0m --------------------------------------------------------------------------------[0m
[32m[I 2023-02-26 19:07:45,012][0m A new study created in RDB with name: LinearSVC_Nystroem_03691551[0m
[32m[I 2023-02-26 19:07:45,028][0m Study started.[0m
[32m[I 2023-02-26 19:07:57,888][0m Trial 0 finished with value: 0.3781641963302589 and parameters: {'lsvc_nystroem_kernel_gamma': 0.23098329956811386, 'lsvc_nystroem_kernel_n_components': 100, 'lsvc_nystroem_dual': False, 'lsvc_nystroem_C': 63.30119560128125, 'lsvc_nystroem_max_iter': 2000}. Best is trial 0 with value: 0.378164.[0m
[32m[I 2023-02-26 19:08:10,829][0m Trial 1 finished with value: 0.3781255596969302 and parameters: {'lsvc_nystroem_kernel_gamma': 2.9739570328597003, 'lsvc_nystroem_kernel_n_components': 100, 'lsvc_nystroem_dual': False, 'lsvc_nystroem_C': 0.004902172353419451, 'lsvc_nystroem_max_iter': 2000}. Best is trial 0 with value: 0.378164.[0m
[32m[I 2023-02-26 19:08:18,508][0m Trial 2 finished with value: 0.3781255596969302 and parameters: {'lsvc_nystroem_kernel_gamma': 417.7578740449229, 'lsvc_nystroem_kernel_n_components': 50, 'lsvc_nystroem_dual': False, 'lsvc_nystroem_C': 0.0040365119374329034, 'lsvc_nystroem_max_iter': 2000}. Best is trial 0 with value: 0.378164.[0m
[32m[I 2023-02-26 19:08:26,640][0m Trial 3 finished with value: 0.378395955154665 and parameters: {'lsvc_nystroem_kernel_gamma': 0.004068738941542747, 'lsvc_nystroem_kernel_n_components': 50, 'lsvc_nystroem_dual': False, 'lsvc_nystroem_C': 1.2103831792068342, 'lsvc_nystroem_max_iter': 2000}. Best is trial 3 with value: 0.378396.[0m
[32m[I 2023-02-26 19:08:40,420][0m Trial 4 finished with value: 0.37886773340634006 and parameters: {'lsvc_nystroem_kernel_gamma': 0.0028151243945686954, 'lsvc_nystroem_kernel_n_components': 100, 'lsvc_nystroem_dual': False, 'lsvc_nystroem_C': 15.121845708201173, 'lsvc_nystroem_max_iter': 2000}. Best is trial 4 with value: 0.378868.[0m
[32m[I 2023-02-26 19:08:54,405][0m Trial 5 finished with value: 0.37882057506777583 and parameters: {'lsvc_nystroem_kernel_gamma': 0.0047515524669224565, 'lsvc_nystroem_kernel_n_components': 100, 'lsvc_nystroem_dual': False, 'lsvc_nystroem_C': 558.892677353842, 'lsvc_nystroem_max_iter': 2000}. Best is trial 4 with value: 0.378868.[0m
[32m[I 2023-02-26 19:09:02,151][0m Trial 6 finished with value: 0.3781255596969302 and parameters: {'lsvc_nystroem_kernel_gamma': 0.0894781413473665, 'lsvc_nystroem_kernel_n_components': 50, 'lsvc_nystroem_dual': False, 'lsvc_nystroem_C': 9.764824036895615e-05, 'lsvc_nystroem_max_iter': 2000}. Best is trial 4 with value: 0.378868.[0m
[32m[I 2023-02-26 19:09:16,175][0m Trial 7 finished with value: 0.37897060930599696 and parameters: {'lsvc_nystroem_kernel_gamma': 0.0011447105344305098, 'lsvc_nystroem_kernel_n_components': 100, 'lsvc_nystroem_dual': False, 'lsvc_nystroem_C': 1.0352324354754654, 'lsvc_nystroem_max_iter': 2000}. Best is trial 7 with value: 0.378971.[0m
[32m[I 2023-02-26 19:09:34,099][0m Trial 8 finished with value: 0.3781255596969302 and parameters: {'lsvc_nystroem_kernel_gamma': 151.65354416235107, 'lsvc_nystroem_kernel_n_components': 150, 'lsvc_nystroem_dual': False, 'lsvc_nystroem_C': 1.1913779506629515e-05, 'lsvc_nystroem_max_iter': 2000}. Best is trial 7 with value: 0.378971.[0m
[32m[I 2023-02-26 19:09:52,401][0m Trial 9 finished with value: 0.3781513177751973 and parameters: {'lsvc_nystroem_kernel_gamma': 0.011437211370353691, 'lsvc_nystroem_kernel_n_components': 150, 'lsvc_nystroem_dual': False, 'lsvc_nystroem_C': 0.007788384833727022, 'lsvc_nystroem_max_iter': 2000}. Best is trial 7 with value: 0.378971.[0m
[32m[I 2023-02-26 19:10:10,474][0m Trial 10 finished with value: 0.3781255596969302 and parameters: {'lsvc_nystroem_kernel_gamma': 10.79051308267601, 'lsvc_nystroem_kernel_n_components': 150, 'lsvc_nystroem_dual': False, 'lsvc_nystroem_C': 0.41332788327453174, 'lsvc_nystroem_max_iter': 2000}. Best is trial 7 with value: 0.378971.[0m
[32m[I 2023-02-26 19:10:24,227][0m Trial 11 finished with value: 0.37890631428253296 and parameters: {'lsvc_nystroem_kernel_gamma': 0.0019888736458243813, 'lsvc_nystroem_kernel_n_components': 100, 'lsvc_nystroem_dual': False, 'lsvc_nystroem_C': 6.6340230895560985, 'lsvc_nystroem_max_iter': 2000}. Best is trial 7 with value: 0.378971.[0m
[32m[I 2023-02-26 19:10:38,074][0m Trial 12 finished with value: 0.3789748953548482 and parameters: {'lsvc_nystroem_kernel_gamma': 0.0010214227577140518, 'lsvc_nystroem_kernel_n_components': 100, 'lsvc_nystroem_dual': False, 'lsvc_nystroem_C': 0.6842450919363919, 'lsvc_nystroem_max_iter': 2000}. Best is trial 12 with value: 0.378975.[0m
[32m[I 2023-02-26 19:10:51,198][0m Trial 13 finished with value: 0.37829296413505237 and parameters: {'lsvc_nystroem_kernel_gamma': 0.049420162121449444, 'lsvc_nystroem_kernel_n_components': 100, 'lsvc_nystroem_dual': False, 'lsvc_nystroem_C': 0.4021777575056882, 'lsvc_nystroem_max_iter': 2000}. Best is trial 12 with value: 0.378975.[0m
[32m[I 2023-02-26 19:10:59,277][0m Trial 14 finished with value: 0.3784860553688957 and parameters: {'lsvc_nystroem_kernel_gamma': 0.0010883705853194094, 'lsvc_nystroem_kernel_n_components': 50, 'lsvc_nystroem_dual': False, 'lsvc_nystroem_C': 0.09855940344061935, 'lsvc_nystroem_max_iter': 2000}. Best is trial 12 with value: 0.378975.[0m
[32m[I 2023-02-26 19:11:17,993][0m Trial 15 finished with value: 0.37859329693583094 and parameters: {'lsvc_nystroem_kernel_gamma': 0.02752629245089731, 'lsvc_nystroem_kernel_n_components': 150, 'lsvc_nystroem_dual': False, 'lsvc_nystroem_C': 194.12521088125413, 'lsvc_nystroem_max_iter': 2000}. Best is trial 12 with value: 0.378975.[0m
[32m[I 2023-02-26 19:11:30,827][0m Trial 16 finished with value: 0.3781255596969302 and parameters: {'lsvc_nystroem_kernel_gamma': 0.6932909591332007, 'lsvc_nystroem_kernel_n_components': 100, 'lsvc_nystroem_dual': False, 'lsvc_nystroem_C': 0.0008432999525838359, 'lsvc_nystroem_max_iter': 2000}. Best is trial 12 with value: 0.378975.[0m
[32m[I 2023-02-26 19:11:38,370][0m Trial 17 finished with value: 0.3781255596969302 and parameters: {'lsvc_nystroem_kernel_gamma': 23.856625612163505, 'lsvc_nystroem_kernel_n_components': 50, 'lsvc_nystroem_dual': False, 'lsvc_nystroem_C': 5.089712811755456, 'lsvc_nystroem_max_iter': 2000}. Best is trial 12 with value: 0.378975.[0m
[32m[I 2023-02-26 19:11:51,444][0m Trial 18 finished with value: 0.37834875349933655 and parameters: {'lsvc_nystroem_kernel_gamma': 0.017000028409094765, 'lsvc_nystroem_kernel_n_components': 100, 'lsvc_nystroem_dual': False, 'lsvc_nystroem_C': 0.04888307682287569, 'lsvc_nystroem_max_iter': 2000}. Best is trial 12 with value: 0.378975.[0m
[32m[I 2023-02-26 19:12:09,415][0m Trial 19 finished with value: 0.3781255596969302 and parameters: {'lsvc_nystroem_kernel_gamma': 0.0010545402281754114, 'lsvc_nystroem_kernel_n_components': 150, 'lsvc_nystroem_dual': False, 'lsvc_nystroem_C': 1.8184724598182533e-06, 'lsvc_nystroem_max_iter': 2000}. Best is trial 12 with value: 0.378975.[0m
[32m[I 2023-02-26 19:12:09,477][0m Study finished.[0m
[32m[I 2023-02-26 19:12:09,493][0m --------------------------------------------------------------------------------[0m
[32m[I 2023-02-26 19:12:09,493][0m --------------------    LinearSVC_PolynomialCountSketch     --------------------[0m
[32m[I 2023-02-26 19:12:09,493][0m --------------------------------------------------------------------------------[0m
[32m[I 2023-02-26 19:12:09,524][0m A new study created in RDB with name: LinearSVC_PolynomialCountSketch_03691551[0m
[32m[I 2023-02-26 19:12:09,540][0m Study started.[0m
[32m[I 2023-02-26 19:19:41,217][0m Trial 0 finished with value: 0.8332850915151006 and parameters: {'lsvc_pcs_kernel_gamma': 0.0015726330978368763, 'lsvc_pcs_kernel_n_components': 150, 'lsvc_pcs_degree': 2, 'lsvc_pcs_dual': False, 'lsvc_pcs_C': 5.539765670358884e-05, 'lsvc_pcs_max_iter': 2000}. Best is trial 0 with value: 0.833285.[0m
[32m[I 2023-02-26 19:24:36,839][0m Trial 1 finished with value: 0.8319504298576839 and parameters: {'lsvc_pcs_kernel_gamma': 0.009686446924758386, 'lsvc_pcs_kernel_n_components': 100, 'lsvc_pcs_degree': 2, 'lsvc_pcs_dual': False, 'lsvc_pcs_C': 346.11855708581305, 'lsvc_pcs_max_iter': 2000}. Best is trial 0 with value: 0.833285.[0m
[32m[I 2023-02-26 19:29:16,956][0m Trial 2 finished with value: 0.8282209177508949 and parameters: {'lsvc_pcs_kernel_gamma': 9.06584973892775, 'lsvc_pcs_kernel_n_components': 100, 'lsvc_pcs_degree': 2, 'lsvc_pcs_dual': False, 'lsvc_pcs_C': 0.16874637839477669, 'lsvc_pcs_max_iter': 2000}. Best is trial 0 with value: 0.833285.[0m
[32m[I 2023-02-26 19:36:44,169][0m Trial 3 finished with value: 0.8305333672538483 and parameters: {'lsvc_pcs_kernel_gamma': 5.479562850948184, 'lsvc_pcs_kernel_n_components': 150, 'lsvc_pcs_degree': 2, 'lsvc_pcs_dual': False, 'lsvc_pcs_C': 2.5316239734008676e-05, 'lsvc_pcs_max_iter': 2000}. Best is trial 0 with value: 0.833285.[0m
[32m[I 2023-02-26 19:39:38,971][0m Trial 4 finished with value: 0.8246595651788113 and parameters: {'lsvc_pcs_kernel_gamma': 1.4055168864917642, 'lsvc_pcs_kernel_n_components': 50, 'lsvc_pcs_degree': 2, 'lsvc_pcs_dual': False, 'lsvc_pcs_C': 0.00026980320925912234, 'lsvc_pcs_max_iter': 2000}. Best is trial 0 with value: 0.833285.[0m
[32m[I 2023-02-26 19:44:56,389][0m Trial 5 finished with value: 0.8322507240319578 and parameters: {'lsvc_pcs_kernel_gamma': 467.6297067023584, 'lsvc_pcs_kernel_n_components': 100, 'lsvc_pcs_degree': 2, 'lsvc_pcs_dual': False, 'lsvc_pcs_C': 78.69248692862465, 'lsvc_pcs_max_iter': 2000}. Best is trial 0 with value: 0.833285.[0m
[32m[I 2023-02-26 19:51:57,574][0m Trial 6 finished with value: 0.8292771701113016 and parameters: {'lsvc_pcs_kernel_gamma': 0.18153119041768218, 'lsvc_pcs_kernel_n_components': 150, 'lsvc_pcs_degree': 2, 'lsvc_pcs_dual': False, 'lsvc_pcs_C': 4.215734537192717e-06, 'lsvc_pcs_max_iter': 2000}. Best is trial 0 with value: 0.833285.[0m
[32m[I 2023-02-26 19:57:03,536][0m Trial 7 finished with value: 0.83130321586284 and parameters: {'lsvc_pcs_kernel_gamma': 1.0355714047922044, 'lsvc_pcs_kernel_n_components': 100, 'lsvc_pcs_degree': 2, 'lsvc_pcs_dual': False, 'lsvc_pcs_C': 0.004570081418190185, 'lsvc_pcs_max_iter': 2000}. Best is trial 0 with value: 0.833285.[0m
[32m[I 2023-02-26 20:00:06,731][0m Trial 8 finished with value: 0.8257836472336278 and parameters: {'lsvc_pcs_kernel_gamma': 0.04595324249827113, 'lsvc_pcs_kernel_n_components': 50, 'lsvc_pcs_degree': 2, 'lsvc_pcs_dual': False, 'lsvc_pcs_C': 0.0002135491341021371, 'lsvc_pcs_max_iter': 2000}. Best is trial 0 with value: 0.833285.[0m
[32m[I 2023-02-26 20:02:54,278][0m Trial 9 finished with value: 0.8249453276146945 and parameters: {'lsvc_pcs_kernel_gamma': 32.72468919891776, 'lsvc_pcs_kernel_n_components': 50, 'lsvc_pcs_degree': 2, 'lsvc_pcs_dual': False, 'lsvc_pcs_C': 0.0035117396040317728, 'lsvc_pcs_max_iter': 2000}. Best is trial 0 with value: 0.833285.[0m
[32m[I 2023-02-26 20:10:04,835][0m Trial 10 finished with value: 0.8316901952553152 and parameters: {'lsvc_pcs_kernel_gamma': 0.001433278227620815, 'lsvc_pcs_kernel_n_components': 150, 'lsvc_pcs_degree': 2, 'lsvc_pcs_dual': False, 'lsvc_pcs_C': 0.947196563087217, 'lsvc_pcs_max_iter': 2000}. Best is trial 0 with value: 0.833285.[0m
[32m[I 2023-02-26 20:15:30,777][0m Trial 11 finished with value: 0.8328298182138711 and parameters: {'lsvc_pcs_kernel_gamma': 248.88059154789568, 'lsvc_pcs_kernel_n_components': 100, 'lsvc_pcs_degree': 2, 'lsvc_pcs_dual': False, 'lsvc_pcs_C': 72.9314270729889, 'lsvc_pcs_max_iter': 2000}. Best is trial 0 with value: 0.833285.[0m
[32m[I 2023-02-26 20:15:31,012][0m Study finished.[0m
[32m[I 2023-02-26 20:15:31,043][0m --------------------------------------------------------------------------------[0m
[32m[I 2023-02-26 20:15:31,043][0m --------------------          LinearSVC_RBFSampler          --------------------[0m
[32m[I 2023-02-26 20:15:31,043][0m --------------------------------------------------------------------------------[0m
[32m[I 2023-02-26 20:15:31,137][0m A new study created in RDB with name: LinearSVC_RBFSampler_03691551[0m
[32m[I 2023-02-26 20:15:31,137][0m Study started.[0m
[32m[I 2023-02-26 20:16:18,173][0m Trial 0 finished with value: 0.3781255596969302 and parameters: {'lsvc_rbfs_kernel_gamma': 1.9436819165559076, 'lsvc_rbfs_kernel_n_components': 150, 'lsvc_rbfs_dual': False, 'lsvc_rbfs_C': 2.377245816811117, 'lsvc_rbfs_max_iter': 2000}. Best is trial 0 with value: 0.378126.[0m
[32m[I 2023-02-26 20:16:55,055][0m Trial 1 finished with value: 0.3781255596969302 and parameters: {'lsvc_rbfs_kernel_gamma': 4.1816896537014445, 'lsvc_rbfs_kernel_n_components': 150, 'lsvc_rbfs_dual': False, 'lsvc_rbfs_C': 7.11887727978185e-06, 'lsvc_rbfs_max_iter': 2000}. Best is trial 0 with value: 0.378126.[0m
[32m[I 2023-02-26 20:17:15,045][0m Trial 2 finished with value: 0.3781255596969302 and parameters: {'lsvc_rbfs_kernel_gamma': 5.626196615027695, 'lsvc_rbfs_kernel_n_components': 50, 'lsvc_rbfs_dual': False, 'lsvc_rbfs_C': 0.019756717332226826, 'lsvc_rbfs_max_iter': 2000}. Best is trial 0 with value: 0.378126.[0m
[32m[I 2023-02-26 20:17:35,152][0m Trial 3 finished with value: 0.3781255596969302 and parameters: {'lsvc_rbfs_kernel_gamma': 0.36380456299148184, 'lsvc_rbfs_kernel_n_components': 50, 'lsvc_rbfs_dual': False, 'lsvc_rbfs_C': 27.03509366274752, 'lsvc_rbfs_max_iter': 2000}. Best is trial 0 with value: 0.378126.[0m
[32m[I 2023-02-26 20:17:56,539][0m Trial 4 finished with value: 0.3781255596969302 and parameters: {'lsvc_rbfs_kernel_gamma': 1.9972438725100778, 'lsvc_rbfs_kernel_n_components': 50, 'lsvc_rbfs_dual': False, 'lsvc_rbfs_C': 0.005523488709804416, 'lsvc_rbfs_max_iter': 2000}. Best is trial 0 with value: 0.378126.[0m
[32m[I 2023-02-26 20:18:44,470][0m Trial 5 finished with value: 0.3781255596969302 and parameters: {'lsvc_rbfs_kernel_gamma': 565.4230421062159, 'lsvc_rbfs_kernel_n_components': 150, 'lsvc_rbfs_dual': False, 'lsvc_rbfs_C': 0.042684886147788634, 'lsvc_rbfs_max_iter': 2000}. Best is trial 0 with value: 0.378126.[0m
[32m[I 2023-02-26 20:19:04,365][0m Trial 6 finished with value: 0.3781255596969302 and parameters: {'lsvc_rbfs_kernel_gamma': 0.1541104493857091, 'lsvc_rbfs_kernel_n_components': 50, 'lsvc_rbfs_dual': False, 'lsvc_rbfs_C': 1.3204572498465488, 'lsvc_rbfs_max_iter': 2000}. Best is trial 0 with value: 0.378126.[0m
[32m[I 2023-02-26 20:19:42,186][0m Trial 7 finished with value: 0.3781255596969302 and parameters: {'lsvc_rbfs_kernel_gamma': 0.005790339366357978, 'lsvc_rbfs_kernel_n_components': 100, 'lsvc_rbfs_dual': False, 'lsvc_rbfs_C': 49.71168345386452, 'lsvc_rbfs_max_iter': 2000}. Best is trial 0 with value: 0.378126.[0m
[32m[I 2023-02-26 20:20:00,921][0m Trial 8 finished with value: 0.3781255596969302 and parameters: {'lsvc_rbfs_kernel_gamma': 0.0972927673774374, 'lsvc_rbfs_kernel_n_components': 50, 'lsvc_rbfs_dual': False, 'lsvc_rbfs_C': 114.9945890325697, 'lsvc_rbfs_max_iter': 2000}. Best is trial 0 with value: 0.378126.[0m
[32m[I 2023-02-26 20:20:19,522][0m Trial 9 finished with value: 0.3781255596969302 and parameters: {'lsvc_rbfs_kernel_gamma': 0.19155698209282362, 'lsvc_rbfs_kernel_n_components': 50, 'lsvc_rbfs_dual': False, 'lsvc_rbfs_C': 0.019875362436254318, 'lsvc_rbfs_max_iter': 2000}. Best is trial 0 with value: 0.378126.[0m
[32m[I 2023-02-26 20:20:46,118][0m Trial 10 finished with value: 0.3781255596969302 and parameters: {'lsvc_rbfs_kernel_gamma': 114.47207943267229, 'lsvc_rbfs_kernel_n_components': 100, 'lsvc_rbfs_dual': False, 'lsvc_rbfs_C': 1.5102338965282736e-05, 'lsvc_rbfs_max_iter': 2000}. Best is trial 0 with value: 0.378126.[0m
[32m[I 2023-02-26 20:21:23,530][0m Trial 11 finished with value: 0.3781255596969302 and parameters: {'lsvc_rbfs_kernel_gamma': 16.006161954994965, 'lsvc_rbfs_kernel_n_components': 150, 'lsvc_rbfs_dual': False, 'lsvc_rbfs_C': 3.857682219148027e-06, 'lsvc_rbfs_max_iter': 2000}. Best is trial 0 with value: 0.378126.[0m
[32m[I 2023-02-26 20:22:12,251][0m Trial 12 finished with value: 0.3781255596969302 and parameters: {'lsvc_rbfs_kernel_gamma': 22.2595400102719, 'lsvc_rbfs_kernel_n_components': 150, 'lsvc_rbfs_dual': False, 'lsvc_rbfs_C': 0.00040976812293449854, 'lsvc_rbfs_max_iter': 2000}. Best is trial 0 with value: 0.378126.[0m
[32m[I 2023-02-26 20:23:03,764][0m Trial 13 finished with value: 0.3781255596969302 and parameters: {'lsvc_rbfs_kernel_gamma': 0.023803152419046576, 'lsvc_rbfs_kernel_n_components': 150, 'lsvc_rbfs_dual': False, 'lsvc_rbfs_C': 1.546451678266719, 'lsvc_rbfs_max_iter': 2000}. Best is trial 0 with value: 0.378126.[0m
[32m[I 2023-02-26 20:23:36,341][0m Trial 14 finished with value: 0.3781255596969302 and parameters: {'lsvc_rbfs_kernel_gamma': 1.526787522565651, 'lsvc_rbfs_kernel_n_components': 100, 'lsvc_rbfs_dual': False, 'lsvc_rbfs_C': 0.00011421958066250306, 'lsvc_rbfs_max_iter': 2000}. Best is trial 0 with value: 0.378126.[0m
[32m[I 2023-02-26 20:24:23,371][0m Trial 15 finished with value: 0.3781255596969302 and parameters: {'lsvc_rbfs_kernel_gamma': 68.10861127924488, 'lsvc_rbfs_kernel_n_components': 150, 'lsvc_rbfs_dual': False, 'lsvc_rbfs_C': 0.5845666902175697, 'lsvc_rbfs_max_iter': 2000}. Best is trial 0 with value: 0.378126.[0m
