[32m[I 2023-02-26 13:16:58,746][0m Optimization for 30 classifiers started.[0m
[32m[I 2023-02-26 13:17:00,766][0m X_train shape: (2092293, 26); y_train shape: (2092293,); y_train unique values: {0, 1, 2, 3, 4}[0m
[32m[I 2023-02-26 13:17:00,798][0m X_test shape: (523073, 26); y_test shape: (523073,); y_test unique values: {0, 1, 2, 3, 4}[0m
[32m[I 2023-02-26 13:17:00,798][0m --------------------------------------------------------------------------------[0m
[32m[I 2023-02-26 13:17:00,798][0m --------------------           AdaBoostClassifier           --------------------[0m
[32m[I 2023-02-26 13:17:00,798][0m --------------------------------------------------------------------------------[0m
[32m[I 2023-02-26 13:17:00,862][0m A new study created in RDB with name: AdaBoostClassifier_03691551[0m
[32m[I 2023-02-26 13:17:00,877][0m Study started.[0m
[32m[I 2023-02-26 13:19:37,608][0m Trial 0 finished with value: 0.8364493769932703 and parameters: {'abc_n_estimators': 100, 'abc_learning_rate': 0.002015985625376628}. Best is trial 0 with value: 0.836449.[0m
[32m[I 2023-02-26 13:22:06,766][0m Trial 1 finished with value: 0.4327437111677405 and parameters: {'abc_n_estimators': 95, 'abc_learning_rate': 0.9970647359389152}. Best is trial 0 with value: 0.836449.[0m
[32m[I 2023-02-26 13:23:02,648][0m Trial 2 finished with value: 0.8364493769932703 and parameters: {'abc_n_estimators': 35, 'abc_learning_rate': 7.027140655578754e-05}. Best is trial 0 with value: 0.836449.[0m
[32m[I 2023-02-26 13:24:28,855][0m Trial 3 finished with value: 0.4089181238931836 and parameters: {'abc_n_estimators': 55, 'abc_learning_rate': 0.012189792610633644}. Best is trial 0 with value: 0.836449.[0m
[32m[I 2023-02-26 13:26:43,239][0m Trial 4 finished with value: 0.8364493769932703 and parameters: {'abc_n_estimators': 85, 'abc_learning_rate': 3.295119976831076e-06}. Best is trial 0 with value: 0.836449.[0m
[32m[I 2023-02-26 13:28:25,173][0m Trial 5 finished with value: 0.40900055197761886 and parameters: {'abc_n_estimators': 65, 'abc_learning_rate': 0.07815751941432016}. Best is trial 0 with value: 0.836449.[0m
[32m[I 2023-02-26 13:30:39,669][0m Trial 6 finished with value: 0.8364493769932703 and parameters: {'abc_n_estimators': 85, 'abc_learning_rate': 5.691877165932754e-06}. Best is trial 0 with value: 0.836449.[0m
[32m[I 2023-02-26 13:32:30,603][0m Trial 7 finished with value: 0.8364493769932703 and parameters: {'abc_n_estimators': 70, 'abc_learning_rate': 8.419711033245095e-05}. Best is trial 0 with value: 0.836449.[0m
[32m[I 2023-02-26 13:34:50,464][0m Trial 8 finished with value: 0.40900055197761886 and parameters: {'abc_n_estimators': 90, 'abc_learning_rate': 0.1327873243230898}. Best is trial 0 with value: 0.836449.[0m
[32m[I 2023-02-26 13:36:09,356][0m Trial 9 finished with value: 0.8364493769932703 and parameters: {'abc_n_estimators': 50, 'abc_learning_rate': 0.0001755253564967556}. Best is trial 0 with value: 0.836449.[0m
[32m[I 2023-02-26 13:38:45,875][0m Trial 10 finished with value: 0.84926329538673 and parameters: {'abc_n_estimators': 100, 'abc_learning_rate': 0.002686476133459446}. Best is trial 10 with value: 0.849263.[0m
[32m[I 2023-02-26 13:41:22,720][0m Trial 11 finished with value: 0.8498646538539902 and parameters: {'abc_n_estimators': 100, 'abc_learning_rate': 0.0027939127151863316}. Best is trial 11 with value: 0.849865.[0m
[32m[I 2023-02-26 13:43:19,832][0m Trial 12 finished with value: 0.8364493769932703 and parameters: {'abc_n_estimators': 75, 'abc_learning_rate': 0.0027093267023528774}. Best is trial 11 with value: 0.849865.[0m
[32m[I 2023-02-26 13:45:55,321][0m Trial 13 finished with value: 0.4089181238931836 and parameters: {'abc_n_estimators': 100, 'abc_learning_rate': 0.012987378196346107}. Best is trial 11 with value: 0.849865.[0m
[32m[I 2023-02-26 13:48:01,796][0m Trial 14 finished with value: 0.8364493769932703 and parameters: {'abc_n_estimators': 80, 'abc_learning_rate': 0.0006503997791194799}. Best is trial 11 with value: 0.849865.[0m
[32m[I 2023-02-26 13:48:49,435][0m Trial 15 finished with value: 0.38026777325770467 and parameters: {'abc_n_estimators': 30, 'abc_learning_rate': 0.01430056259894725}. Best is trial 11 with value: 0.849865.[0m
[32m[I 2023-02-26 13:50:01,221][0m Trial 16 finished with value: 0.8364493769932703 and parameters: {'abc_n_estimators': 45, 'abc_learning_rate': 0.0003155104287219311}. Best is trial 11 with value: 0.849865.[0m
[32m[I 2023-02-26 13:52:23,370][0m Trial 17 finished with value: 0.8364493769932703 and parameters: {'abc_n_estimators': 90, 'abc_learning_rate': 2.1714766507061737e-05}. Best is trial 11 with value: 0.849865.[0m
[32m[I 2023-02-26 13:54:59,735][0m Trial 18 finished with value: 0.8498646538539902 and parameters: {'abc_n_estimators': 100, 'abc_learning_rate': 0.003491501369800036}. Best is trial 11 with value: 0.849865.[0m
[32m[I 2023-02-26 13:56:57,152][0m Trial 19 finished with value: 0.40900055197761886 and parameters: {'abc_n_estimators': 75, 'abc_learning_rate': 0.05547630090477954}. Best is trial 11 with value: 0.849865.[0m
[32m[I 2023-02-26 13:56:57,214][0m Study finished.[0m
[32m[I 2023-02-26 13:56:57,246][0m --------------------------------------------------------------------------------[0m
[32m[I 2023-02-26 13:56:57,246][0m --------------------           AdaGradClassifier            --------------------[0m
[32m[I 2023-02-26 13:56:57,246][0m --------------------------------------------------------------------------------[0m
[32m[I 2023-02-26 13:56:57,277][0m A new study created in RDB with name: AdaGradClassifier_03691551[0m
[32m[I 2023-02-26 13:56:57,277][0m Study started.[0m
[32m[I 2023-02-26 13:57:33,227][0m Trial 0 finished with value: 0.760824593557675 and parameters: {'agc_alpha': 0.3187154953048522, 'agc_l1_ratio': 0.6000000000000001, 'agc_loss': 'log'}. Best is trial 0 with value: 0.760825.[0m
[32m[I 2023-02-26 13:58:05,030][0m Trial 1 finished with value: 0.6285838227646617 and parameters: {'agc_alpha': 309.52852965690204, 'agc_l1_ratio': 0.9, 'agc_loss': 'smooth_hinge'}. Best is trial 0 with value: 0.760825.[0m
[32m[I 2023-02-26 13:58:36,379][0m Trial 2 finished with value: 0.698534411828195 and parameters: {'agc_alpha': 35.64332075733814, 'agc_l1_ratio': 0.8, 'agc_loss': 'smooth_hinge'}. Best is trial 0 with value: 0.760825.[0m
[32m[I 2023-02-26 13:59:06,193][0m Trial 3 finished with value: 0.7738793658332358 and parameters: {'agc_alpha': 33.92489744754875, 'agc_l1_ratio': 0.0, 'agc_loss': 'perceptron'}. Best is trial 3 with value: 0.773879.[0m
[32m[I 2023-02-26 13:59:40,813][0m Trial 4 finished with value: 0.8258805613619163 and parameters: {'agc_alpha': 0.041246901277671534, 'agc_l1_ratio': 0.4, 'agc_loss': 'squared'}. Best is trial 4 with value: 0.825881.[0m
[32m[I 2023-02-26 14:00:12,382][0m Trial 5 finished with value: 0.6617718104342016 and parameters: {'agc_alpha': 261.0292780899489, 'agc_l1_ratio': 0.5, 'agc_loss': 'hinge'}. Best is trial 4 with value: 0.825881.[0m
[32m[I 2023-02-26 14:00:42,471][0m Trial 6 finished with value: 0.879228589231533 and parameters: {'agc_alpha': 0.0029448291458576015, 'agc_l1_ratio': 1.0, 'agc_loss': 'perceptron'}. Best is trial 6 with value: 0.879229.[0m
[32m[I 2023-02-26 14:01:12,733][0m Trial 7 finished with value: 0.8434569988786648 and parameters: {'agc_alpha': 0.012579156091328796, 'agc_l1_ratio': 0.9, 'agc_loss': 'smooth_hinge'}. Best is trial 6 with value: 0.879229.[0m
[32m[I 2023-02-26 14:01:42,304][0m Trial 8 finished with value: 0.8311782387544193 and parameters: {'agc_alpha': 0.14341164708415413, 'agc_l1_ratio': 0.0, 'agc_loss': 'squared_hinge'}. Best is trial 6 with value: 0.879229.[0m
[32m[I 2023-02-26 14:02:16,588][0m Trial 9 finished with value: 0.7977321774020448 and parameters: {'agc_alpha': 2.6686686583353194, 'agc_l1_ratio': 0.30000000000000004, 'agc_loss': 'squared'}. Best is trial 6 with value: 0.879229.[0m
[32m[I 2023-02-26 14:02:46,513][0m Trial 10 finished with value: 0.8734326433004463 and parameters: {'agc_alpha': 0.0011039354624494413, 'agc_l1_ratio': 1.0, 'agc_loss': 'perceptron'}. Best is trial 6 with value: 0.879229.[0m
[32m[I 2023-02-26 14:03:16,536][0m Trial 11 finished with value: 0.8765660210281107 and parameters: {'agc_alpha': 0.0013283726166918152, 'agc_l1_ratio': 1.0, 'agc_loss': 'perceptron'}. Best is trial 6 with value: 0.879229.[0m
[32m[I 2023-02-26 14:03:46,508][0m Trial 12 finished with value: 0.8415427791597405 and parameters: {'agc_alpha': 0.0011878967604160974, 'agc_l1_ratio': 0.7000000000000001, 'agc_loss': 'perceptron'}. Best is trial 6 with value: 0.879229.[0m
[32m[I 2023-02-26 14:04:16,593][0m Trial 13 finished with value: 0.8670735777825447 and parameters: {'agc_alpha': 0.008108735314737464, 'agc_l1_ratio': 1.0, 'agc_loss': 'modified_huber'}. Best is trial 6 with value: 0.879229.[0m
[32m[I 2023-02-26 14:04:46,656][0m Trial 14 finished with value: 0.8185728160813227 and parameters: {'agc_alpha': 0.008174776209648028, 'agc_l1_ratio': 0.7000000000000001, 'agc_loss': 'perceptron'}. Best is trial 6 with value: 0.879229.[0m
[32m[I 2023-02-26 14:05:17,452][0m Trial 15 finished with value: 0.7592940410790816 and parameters: {'agc_alpha': 2.194307798779065, 'agc_l1_ratio': 0.2, 'agc_loss': 'perceptron'}. Best is trial 6 with value: 0.879229.[0m
[32m[I 2023-02-26 14:05:47,428][0m Trial 16 finished with value: 0.8390358697879847 and parameters: {'agc_alpha': 0.0039056585053681555, 'agc_l1_ratio': 0.8, 'agc_loss': 'hinge'}. Best is trial 6 with value: 0.879229.[0m
[32m[I 2023-02-26 14:06:23,488][0m Trial 17 finished with value: 0.8408214415012777 and parameters: {'agc_alpha': 0.05988237496557195, 'agc_l1_ratio': 1.0, 'agc_loss': 'log'}. Best is trial 6 with value: 0.879229.[0m
[32m[I 2023-02-26 14:06:53,735][0m Trial 18 finished with value: 0.8301664234814112 and parameters: {'agc_alpha': 0.0332603965736343, 'agc_l1_ratio': 0.8, 'agc_loss': 'modified_huber'}. Best is trial 6 with value: 0.879229.[0m
[32m[I 2023-02-26 14:07:24,211][0m Trial 19 finished with value: 0.8239520466060849 and parameters: {'agc_alpha': 0.4200153392372066, 'agc_l1_ratio': 0.6000000000000001, 'agc_loss': 'squared_hinge'}. Best is trial 6 with value: 0.879229.[0m
[32m[I 2023-02-26 14:07:24,274][0m Study finished.[0m
[32m[I 2023-02-26 14:07:24,305][0m --------------------------------------------------------------------------------[0m
[32m[I 2023-02-26 14:07:24,305][0m --------------------       BalancedBaggingClassifier        --------------------[0m
[32m[I 2023-02-26 14:07:24,305][0m --------------------------------------------------------------------------------[0m
[32m[I 2023-02-26 14:07:24,321][0m A new study created in RDB with name: BalancedBaggingClassifier_03691551[0m
[32m[I 2023-02-26 14:07:24,336][0m Study started.[0m
[32m[I 2023-02-26 14:08:26,284][0m Trial 0 finished with value: 0.9507715793413527 and parameters: {'bbc_n_estimators': 17, 'bbc_max_features': 23, 'bbc_bootstrap': False, 'bbc_sampling_strategy': 'majority'}. Best is trial 0 with value: 0.950772.[0m
[32m[I 2023-02-26 14:08:37,160][0m Trial 1 finished with value: 0.9462081432366148 and parameters: {'bbc_n_estimators': 7, 'bbc_max_features': 10, 'bbc_bootstrap': True, 'bbc_sampling_strategy': 'not minority'}. Best is trial 0 with value: 0.950772.[0m
[32m[I 2023-02-26 14:09:04,527][0m Trial 2 finished with value: 0.9684237498912506 and parameters: {'bbc_n_estimators': 16, 'bbc_max_features': 26, 'bbc_bootstrap': True, 'bbc_sampling_strategy': 'all'}. Best is trial 2 with value: 0.968424.[0m
[32m[I 2023-02-26 14:09:17,216][0m Trial 3 finished with value: 0.8699271516173375 and parameters: {'bbc_n_estimators': 18, 'bbc_max_features': 5, 'bbc_bootstrap': False, 'bbc_sampling_strategy': 'all'}. Best is trial 2 with value: 0.968424.[0m
[32m[I 2023-02-26 14:09:49,577][0m Trial 4 finished with value: 0.9705427965636944 and parameters: {'bbc_n_estimators': 20, 'bbc_max_features': 23, 'bbc_bootstrap': True, 'bbc_sampling_strategy': 'all'}. Best is trial 4 with value: 0.970543.[0m
[32m[I 2023-02-26 14:10:28,027][0m Trial 5 finished with value: 0.867019016265498 and parameters: {'bbc_n_estimators': 18, 'bbc_max_features': 5, 'bbc_bootstrap': False, 'bbc_sampling_strategy': 'not majority'}. Best is trial 4 with value: 0.970543.[0m
[32m[I 2023-02-26 14:11:23,747][0m Trial 6 finished with value: 0.9741597452427103 and parameters: {'bbc_n_estimators': 10, 'bbc_max_features': 17, 'bbc_bootstrap': True, 'bbc_sampling_strategy': 'not majority'}. Best is trial 6 with value: 0.97416.[0m
[32m[I 2023-02-26 14:11:48,619][0m Trial 7 finished with value: 0.3781255596969302 and parameters: {'bbc_n_estimators': 17, 'bbc_max_features': 1, 'bbc_bootstrap': True, 'bbc_sampling_strategy': 'not majority'}. Best is trial 6 with value: 0.97416.[0m
[32m[I 2023-02-26 14:12:47,724][0m Trial 8 finished with value: 0.9510882401631601 and parameters: {'bbc_n_estimators': 14, 'bbc_max_features': 26, 'bbc_bootstrap': False, 'bbc_sampling_strategy': 'majority'}. Best is trial 6 with value: 0.97416.[0m
[32m[I 2023-02-26 14:12:56,137][0m Trial 9 finished with value: 0.9202506299404989 and parameters: {'bbc_n_estimators': 10, 'bbc_max_features': 8, 'bbc_bootstrap': False, 'bbc_sampling_strategy': 'all'}. Best is trial 6 with value: 0.97416.[0m
[32m[I 2023-02-26 14:13:26,970][0m Trial 10 finished with value: 0.976859025984797 and parameters: {'bbc_n_estimators': 5, 'bbc_max_features': 17, 'bbc_bootstrap': True, 'bbc_sampling_strategy': 'not majority'}. Best is trial 10 with value: 0.976859.[0m
[32m[I 2023-02-26 14:13:56,915][0m Trial 11 finished with value: 0.9765459498711911 and parameters: {'bbc_n_estimators': 5, 'bbc_max_features': 16, 'bbc_bootstrap': True, 'bbc_sampling_strategy': 'not majority'}. Best is trial 10 with value: 0.976859.[0m
[32m[I 2023-02-26 14:14:26,913][0m Trial 12 finished with value: 0.9765459498711911 and parameters: {'bbc_n_estimators': 5, 'bbc_max_features': 16, 'bbc_bootstrap': True, 'bbc_sampling_strategy': 'not majority'}. Best is trial 10 with value: 0.976859.[0m
[32m[I 2023-02-26 14:14:58,593][0m Trial 13 finished with value: 0.9770066252110747 and parameters: {'bbc_n_estimators': 5, 'bbc_max_features': 18, 'bbc_bootstrap': True, 'bbc_sampling_strategy': 'not majority'}. Best is trial 13 with value: 0.977007.[0m
[32m[I 2023-02-26 14:15:12,107][0m Trial 14 finished with value: 0.9617938110276142 and parameters: {'bbc_n_estimators': 8, 'bbc_max_features': 19, 'bbc_bootstrap': True, 'bbc_sampling_strategy': 'not minority'}. Best is trial 13 with value: 0.977007.[0m
[32m[I 2023-02-26 14:15:46,980][0m Trial 15 finished with value: 0.9454593723174911 and parameters: {'bbc_n_estimators': 8, 'bbc_max_features': 12, 'bbc_bootstrap': True, 'bbc_sampling_strategy': 'not majority'}. Best is trial 13 with value: 0.977007.[0m
[32m[I 2023-02-26 14:16:58,588][0m Trial 16 finished with value: 0.976998549172563 and parameters: {'bbc_n_estimators': 11, 'bbc_max_features': 21, 'bbc_bootstrap': True, 'bbc_sampling_strategy': 'not majority'}. Best is trial 13 with value: 0.977007.[0m
[32m[I 2023-02-26 14:18:17,689][0m Trial 17 finished with value: 0.9787690000710539 and parameters: {'bbc_n_estimators': 12, 'bbc_max_features': 21, 'bbc_bootstrap': True, 'bbc_sampling_strategy': 'not majority'}. Best is trial 17 with value: 0.978769.[0m
[32m[I 2023-02-26 14:18:37,268][0m Trial 18 finished with value: 0.9639315068373123 and parameters: {'bbc_n_estimators': 13, 'bbc_max_features': 14, 'bbc_bootstrap': True, 'bbc_sampling_strategy': 'not minority'}. Best is trial 17 with value: 0.978769.[0m
[32m[I 2023-02-26 14:19:30,659][0m Trial 19 finished with value: 0.9547669808678286 and parameters: {'bbc_n_estimators': 14, 'bbc_max_features': 20, 'bbc_bootstrap': True, 'bbc_sampling_strategy': 'majority'}. Best is trial 17 with value: 0.978769.[0m
[32m[I 2023-02-26 14:19:30,706][0m Study finished.[0m
[32m[I 2023-02-26 14:19:30,737][0m --------------------------------------------------------------------------------[0m
[32m[I 2023-02-26 14:19:30,737][0m --------------------     BalancedRandomForestClassifier     --------------------[0m
[32m[I 2023-02-26 14:19:30,737][0m --------------------------------------------------------------------------------[0m
[32m[I 2023-02-26 14:19:30,769][0m A new study created in RDB with name: BalancedRandomForestClassifier_03691551[0m
[32m[I 2023-02-26 14:19:30,769][0m Study started.[0m
[32m[I 2023-02-26 14:20:06,389][0m sklearn.ensemble.RandomForestClassifier.predict: fallback to original Scikit-learn[0m
[32m[I 2023-02-26 14:20:06,389][0m sklearn.ensemble.RandomForestClassifier.predict_proba: fallback to original Scikit-learn[0m
[32m[I 2023-02-26 14:20:10,705][0m Trial 0 finished with value: 0.9490953737568337 and parameters: {'brf_n_estimators': 80, 'brf_criterion': 'gini', 'brf_min_samples_split': 47, 'brf_min_samples_leaf': 45, 'brf_max_features': 11, 'brf_bootstrap': True}. Best is trial 0 with value: 0.949095.[0m
[32m[I 2023-02-26 14:21:04,774][0m sklearn.ensemble.RandomForestClassifier.predict: fallback to original Scikit-learn[0m
[32m[I 2023-02-26 14:21:04,774][0m sklearn.ensemble.RandomForestClassifier.predict_proba: fallback to original Scikit-learn[0m
[32m[I 2023-02-26 14:21:10,073][0m Trial 1 finished with value: 0.8866045437874287 and parameters: {'brf_n_estimators': 130, 'brf_criterion': 'gini', 'brf_min_samples_split': 22, 'brf_min_samples_leaf': 36, 'brf_max_features': 3, 'brf_bootstrap': False}. Best is trial 0 with value: 0.949095.[0m
[32m[I 2023-02-26 14:21:38,299][0m sklearn.ensemble.RandomForestClassifier.predict: fallback to original Scikit-learn[0m
[32m[I 2023-02-26 14:21:38,299][0m sklearn.ensemble.RandomForestClassifier.predict_proba: fallback to original Scikit-learn[0m
[32m[I 2023-02-26 14:21:41,878][0m Trial 2 finished with value: 0.9498041895746279 and parameters: {'brf_n_estimators': 60, 'brf_criterion': 'gini', 'brf_min_samples_split': 50, 'brf_min_samples_leaf': 44, 'brf_max_features': 17, 'brf_bootstrap': True}. Best is trial 2 with value: 0.949804.[0m
[32m[I 2023-02-26 14:22:26,083][0m sklearn.ensemble.RandomForestClassifier.predict: fallback to original Scikit-learn[0m
[32m[I 2023-02-26 14:22:26,083][0m sklearn.ensemble.RandomForestClassifier.predict_proba: fallback to original Scikit-learn[0m
[32m[I 2023-02-26 14:22:30,230][0m Trial 3 finished with value: 0.8199250462979151 and parameters: {'brf_n_estimators': 110, 'brf_criterion': 'entropy', 'brf_min_samples_split': 50, 'brf_min_samples_leaf': 12, 'brf_max_features': 1, 'brf_bootstrap': True}. Best is trial 2 with value: 0.949804.[0m
[32m[I 2023-02-26 14:23:39,566][0m sklearn.ensemble.RandomForestClassifier.predict: fallback to original Scikit-learn[0m
[32m[I 2023-02-26 14:23:39,566][0m sklearn.ensemble.RandomForestClassifier.predict_proba: fallback to original Scikit-learn[0m
[32m[I 2023-02-26 14:23:45,600][0m Trial 4 finished with value: 0.8572979696764914 and parameters: {'brf_n_estimators': 170, 'brf_criterion': 'entropy', 'brf_min_samples_split': 17, 'brf_min_samples_leaf': 8, 'brf_max_features': 1, 'brf_bootstrap': False}. Best is trial 2 with value: 0.949804.[0m
[32m[I 2023-02-26 14:24:26,631][0m sklearn.ensemble.RandomForestClassifier.predict: fallback to original Scikit-learn[0m
[32m[I 2023-02-26 14:24:26,631][0m sklearn.ensemble.RandomForestClassifier.predict_proba: fallback to original Scikit-learn[0m
[32m[I 2023-02-26 14:24:31,167][0m Trial 5 finished with value: 0.9612967486295578 and parameters: {'brf_n_estimators': 80, 'brf_criterion': 'gini', 'brf_min_samples_split': 37, 'brf_min_samples_leaf': 4, 'brf_max_features': 16, 'brf_bootstrap': False}. Best is trial 5 with value: 0.961297.[0m
[32m[I 2023-02-26 14:25:08,815][0m sklearn.ensemble.RandomForestClassifier.predict: fallback to original Scikit-learn[0m
[32m[I 2023-02-26 14:25:08,831][0m sklearn.ensemble.RandomForestClassifier.predict_proba: fallback to original Scikit-learn[0m
[32m[I 2023-02-26 14:25:13,177][0m Trial 6 finished with value: 0.9500558387397436 and parameters: {'brf_n_estimators': 80, 'brf_criterion': 'gini', 'brf_min_samples_split': 42, 'brf_min_samples_leaf': 40, 'brf_max_features': 18, 'brf_bootstrap': True}. Best is trial 5 with value: 0.961297.[0m
[32m[I 2023-02-26 14:26:06,384][0m sklearn.ensemble.RandomForestClassifier.predict: fallback to original Scikit-learn[0m
[32m[I 2023-02-26 14:26:06,399][0m sklearn.ensemble.RandomForestClassifier.predict_proba: fallback to original Scikit-learn[0m
[32m[I 2023-02-26 14:26:11,525][0m Trial 7 finished with value: 0.9525689239510431 and parameters: {'brf_n_estimators': 100, 'brf_criterion': 'entropy', 'brf_min_samples_split': 6, 'brf_min_samples_leaf': 27, 'brf_max_features': 24, 'brf_bootstrap': True}. Best is trial 5 with value: 0.961297.[0m
[32m[I 2023-02-26 14:26:48,873][0m sklearn.ensemble.RandomForestClassifier.predict: fallback to original Scikit-learn[0m
[32m[I 2023-02-26 14:26:48,873][0m sklearn.ensemble.RandomForestClassifier.predict_proba: fallback to original Scikit-learn[0m
[32m[I 2023-02-26 14:26:53,046][0m Trial 8 finished with value: 0.9627099350861542 and parameters: {'brf_n_estimators': 70, 'brf_criterion': 'gini', 'brf_min_samples_split': 42, 'brf_min_samples_leaf': 1, 'brf_max_features': 19, 'brf_bootstrap': False}. Best is trial 8 with value: 0.96271.[0m
[32m[I 2023-02-26 14:27:41,612][0m sklearn.ensemble.RandomForestClassifier.predict: fallback to original Scikit-learn[0m
[32m[I 2023-02-26 14:27:41,612][0m sklearn.ensemble.RandomForestClassifier.predict_proba: fallback to original Scikit-learn[0m
