[32m[I 2023-02-26 15:23:25,013][0m Trial 19 finished with value: 0.6463212475715816 and parameters: {'compnb_alpha': 0.1, 'compnb_fit_prior': True, 'compnb_norm': False}. Best is trial 0 with value: 0.646321.[0m
[32m[I 2023-02-26 15:23:25,076][0m Study finished.[0m
[32m[I 2023-02-26 15:23:25,091][0m --------------------------------------------------------------------------------[0m
[32m[I 2023-02-26 15:23:25,091][0m --------------------         DecisionTreeClassifier         --------------------[0m
[32m[I 2023-02-26 15:23:25,091][0m --------------------------------------------------------------------------------[0m
[32m[I 2023-02-26 15:23:25,123][0m A new study created in RDB with name: DecisionTreeClassifier_03691551[0m
[32m[I 2023-02-26 15:23:25,123][0m Study started.[0m
[32m[I 2023-02-26 15:23:29,109][0m Trial 0 finished with value: 0.9799783020252785 and parameters: {'dtc_criterion': 'gini', 'dtc_splitter': 'best', 'dtc_min_samples_split': 15, 'dtc_min_samples_leaf': 36, 'dtc_max_features': 8}. Best is trial 0 with value: 0.979978.[0m
[32m[I 2023-02-26 15:23:32,517][0m Trial 1 finished with value: 0.9693816274315133 and parameters: {'dtc_criterion': 'entropy', 'dtc_splitter': 'random', 'dtc_min_samples_split': 35, 'dtc_min_samples_leaf': 23, 'dtc_max_features': 15}. Best is trial 0 with value: 0.979978.[0m
[32m[I 2023-02-26 15:23:38,533][0m Trial 2 finished with value: 0.9839709572617319 and parameters: {'dtc_criterion': 'gini', 'dtc_splitter': 'best', 'dtc_min_samples_split': 19, 'dtc_min_samples_leaf': 36, 'dtc_max_features': 13}. Best is trial 2 with value: 0.983971.[0m
[32m[I 2023-02-26 15:23:41,019][0m Trial 3 finished with value: 0.9284570399290764 and parameters: {'dtc_criterion': 'gini', 'dtc_splitter': 'random', 'dtc_min_samples_split': 32, 'dtc_min_samples_leaf': 43, 'dtc_max_features': 10}. Best is trial 2 with value: 0.983971.[0m
[32m[I 2023-02-26 15:23:49,292][0m Trial 4 finished with value: 0.9886314483944424 and parameters: {'dtc_criterion': 'entropy', 'dtc_splitter': 'best', 'dtc_min_samples_split': 18, 'dtc_min_samples_leaf': 26, 'dtc_max_features': 24}. Best is trial 4 with value: 0.988631.[0m
[32m[I 2023-02-26 15:23:57,457][0m Trial 5 finished with value: 0.9879604973838755 and parameters: {'dtc_criterion': 'gini', 'dtc_splitter': 'best', 'dtc_min_samples_split': 47, 'dtc_min_samples_leaf': 29, 'dtc_max_features': 21}. Best is trial 4 with value: 0.988631.[0m
[32m[I 2023-02-26 15:24:04,129][0m Trial 6 finished with value: 0.9865636913667671 and parameters: {'dtc_criterion': 'entropy', 'dtc_splitter': 'best', 'dtc_min_samples_split': 21, 'dtc_min_samples_leaf': 39, 'dtc_max_features': 16}. Best is trial 4 with value: 0.988631.[0m
[32m[I 2023-02-26 15:24:06,211][0m Trial 7 finished with value: 0.8433930088524522 and parameters: {'dtc_criterion': 'gini', 'dtc_splitter': 'random', 'dtc_min_samples_split': 27, 'dtc_min_samples_leaf': 18, 'dtc_max_features': 5}. Best is trial 4 with value: 0.988631.[0m
[32m[I 2023-02-26 15:24:08,822][0m Trial 8 finished with value: 0.9363816398290216 and parameters: {'dtc_criterion': 'gini', 'dtc_splitter': 'best', 'dtc_min_samples_split': 21, 'dtc_min_samples_leaf': 25, 'dtc_max_features': 3}. Best is trial 4 with value: 0.988631.[0m
[32m[I 2023-02-26 15:24:16,438][0m Trial 9 finished with value: 0.9899963468126318 and parameters: {'dtc_criterion': 'entropy', 'dtc_splitter': 'best', 'dtc_min_samples_split': 41, 'dtc_min_samples_leaf': 8, 'dtc_max_features': 22}. Best is trial 9 with value: 0.989996.[0m
[32m[I 2023-02-26 15:24:20,456][0m Trial 10 finished with value: 0.9872694854159483 and parameters: {'dtc_criterion': 'entropy', 'dtc_splitter': 'random', 'dtc_min_samples_split': 47, 'dtc_min_samples_leaf': 2, 'dtc_max_features': 26}. Best is trial 9 with value: 0.989996.[0m
[32m[I 2023-02-26 15:24:29,725][0m Trial 11 finished with value: 0.9905122455135177 and parameters: {'dtc_criterion': 'entropy', 'dtc_splitter': 'best', 'dtc_min_samples_split': 6, 'dtc_min_samples_leaf': 11, 'dtc_max_features': 25}. Best is trial 11 with value: 0.990512.[0m
[32m[I 2023-02-26 15:24:37,163][0m Trial 12 finished with value: 0.9901117595226585 and parameters: {'dtc_criterion': 'entropy', 'dtc_splitter': 'best', 'dtc_min_samples_split': 5, 'dtc_min_samples_leaf': 8, 'dtc_max_features': 20}. Best is trial 11 with value: 0.990512.[0m
[32m[I 2023-02-26 15:24:44,291][0m Trial 13 finished with value: 0.9896966698822248 and parameters: {'dtc_criterion': 'entropy', 'dtc_splitter': 'best', 'dtc_min_samples_split': 2, 'dtc_min_samples_leaf': 11, 'dtc_max_features': 19}. Best is trial 11 with value: 0.990512.[0m
[32m[I 2023-02-26 15:24:50,880][0m Trial 14 finished with value: 0.9886098112759149 and parameters: {'dtc_criterion': 'entropy', 'dtc_splitter': 'best', 'dtc_min_samples_split': 3, 'dtc_min_samples_leaf': 14, 'dtc_max_features': 18}. Best is trial 11 with value: 0.990512.[0m
[32m[I 2023-02-26 15:25:00,022][0m Trial 15 finished with value: 0.9927213019445332 and parameters: {'dtc_criterion': 'entropy', 'dtc_splitter': 'best', 'dtc_min_samples_split': 10, 'dtc_min_samples_leaf': 1, 'dtc_max_features': 25}. Best is trial 15 with value: 0.992721.[0m
[32m[I 2023-02-26 15:25:09,404][0m Trial 16 finished with value: 0.9922827940928912 and parameters: {'dtc_criterion': 'entropy', 'dtc_splitter': 'best', 'dtc_min_samples_split': 11, 'dtc_min_samples_leaf': 3, 'dtc_max_features': 26}. Best is trial 15 with value: 0.992721.[0m
[32m[I 2023-02-26 15:25:17,767][0m Trial 17 finished with value: 0.9921779006865499 and parameters: {'dtc_criterion': 'entropy', 'dtc_splitter': 'best', 'dtc_min_samples_split': 10, 'dtc_min_samples_leaf': 2, 'dtc_max_features': 23}. Best is trial 15 with value: 0.992721.[0m
[32m[I 2023-02-26 15:25:21,972][0m Trial 18 finished with value: 0.9910776229084901 and parameters: {'dtc_criterion': 'entropy', 'dtc_splitter': 'random', 'dtc_min_samples_split': 11, 'dtc_min_samples_leaf': 1, 'dtc_max_features': 26}. Best is trial 15 with value: 0.992721.[0m
[32m[I 2023-02-26 15:25:27,041][0m Trial 19 finished with value: 0.9859425445890261 and parameters: {'dtc_criterion': 'entropy', 'dtc_splitter': 'best', 'dtc_min_samples_split': 11, 'dtc_min_samples_leaf': 18, 'dtc_max_features': 11}. Best is trial 15 with value: 0.992721.[0m
[32m[I 2023-02-26 15:25:27,103][0m Study finished.[0m
[32m[I 2023-02-26 15:25:27,134][0m --------------------------------------------------------------------------------[0m
[32m[I 2023-02-26 15:25:27,134][0m --------------------          ExtraTreeClassifier           --------------------[0m
[32m[I 2023-02-26 15:25:27,134][0m --------------------------------------------------------------------------------[0m
[32m[I 2023-02-26 15:25:27,166][0m A new study created in RDB with name: ExtraTreeClassifier_03691551[0m
[32m[I 2023-02-26 15:25:27,181][0m Study started.[0m
[32m[I 2023-02-26 15:25:29,246][0m Trial 0 finished with value: 0.9103605775808601 and parameters: {'etc_criterion': 'entropy', 'etc_min_samples_split': 39, 'etc_min_samples_leaf': 9, 'etc_max_features': 4}. Best is trial 0 with value: 0.910361.[0m
[32m[I 2023-02-26 15:25:32,044][0m Trial 1 finished with value: 0.9525298927264998 and parameters: {'etc_criterion': 'entropy', 'etc_min_samples_split': 35, 'etc_min_samples_leaf': 25, 'etc_max_features': 10}. Best is trial 1 with value: 0.95253.[0m
[32m[I 2023-02-26 15:25:34,061][0m Trial 2 finished with value: 0.8958296526599852 and parameters: {'etc_criterion': 'entropy', 'etc_min_samples_split': 44, 'etc_min_samples_leaf': 34, 'etc_max_features': 5}. Best is trial 1 with value: 0.95253.[0m
[32m[I 2023-02-26 15:25:37,390][0m Trial 3 finished with value: 0.9742735321097771 and parameters: {'etc_criterion': 'gini', 'etc_min_samples_split': 17, 'etc_min_samples_leaf': 46, 'etc_max_features': 18}. Best is trial 3 with value: 0.974274.[0m
[32m[I 2023-02-26 15:25:39,922][0m Trial 4 finished with value: 0.9854181330108538 and parameters: {'etc_criterion': 'gini', 'etc_min_samples_split': 19, 'etc_min_samples_leaf': 1, 'etc_max_features': 4}. Best is trial 4 with value: 0.985418.[0m
[32m[I 2023-02-26 15:25:43,596][0m Trial 5 finished with value: 0.9768534277793772 and parameters: {'etc_criterion': 'gini', 'etc_min_samples_split': 14, 'etc_min_samples_leaf': 25, 'etc_max_features': 17}. Best is trial 4 with value: 0.985418.[0m
[32m[I 2023-02-26 15:25:47,255][0m Trial 6 finished with value: 0.9665631049619663 and parameters: {'etc_criterion': 'gini', 'etc_min_samples_split': 11, 'etc_min_samples_leaf': 38, 'etc_max_features': 18}. Best is trial 4 with value: 0.985418.[0m
[32m[I 2023-02-26 15:25:49,615][0m Trial 7 finished with value: 0.9091568004025506 and parameters: {'etc_criterion': 'entropy', 'etc_min_samples_split': 18, 'etc_min_samples_leaf': 25, 'etc_max_features': 8}. Best is trial 4 with value: 0.985418.[0m
[32m[I 2023-02-26 15:25:53,257][0m Trial 8 finished with value: 0.9762785368084494 and parameters: {'etc_criterion': 'entropy', 'etc_min_samples_split': 4, 'etc_min_samples_leaf': 32, 'etc_max_features': 19}. Best is trial 4 with value: 0.985418.[0m
[32m[I 2023-02-26 15:25:57,026][0m Trial 9 finished with value: 0.9823399365366312 and parameters: {'etc_criterion': 'entropy', 'etc_min_samples_split': 37, 'etc_min_samples_leaf': 2, 'etc_max_features': 16}. Best is trial 4 with value: 0.985418.[0m
[32m[I 2023-02-26 15:26:00,969][0m Trial 10 finished with value: 0.9833082020958077 and parameters: {'etc_criterion': 'gini', 'etc_min_samples_split': 27, 'etc_min_samples_leaf': 13, 'etc_max_features': 24}. Best is trial 4 with value: 0.985418.[0m
[32m[I 2023-02-26 15:26:05,221][0m Trial 11 finished with value: 0.9838841973830271 and parameters: {'etc_criterion': 'gini', 'etc_min_samples_split': 25, 'etc_min_samples_leaf': 13, 'etc_max_features': 25}. Best is trial 4 with value: 0.985418.[0m
[32m[I 2023-02-26 15:26:09,349][0m Trial 12 finished with value: 0.9837680779023131 and parameters: {'etc_criterion': 'gini', 'etc_min_samples_split': 28, 'etc_min_samples_leaf': 14, 'etc_max_features': 26}. Best is trial 4 with value: 0.985418.[0m
[32m[I 2023-02-26 15:26:11,633][0m Trial 13 finished with value: 0.9837440468706371 and parameters: {'etc_criterion': 'gini', 'etc_min_samples_split': 23, 'etc_min_samples_leaf': 1, 'etc_max_features': 2}. Best is trial 4 with value: 0.985418.[0m
[32m[I 2023-02-26 15:26:14,696][0m Trial 14 finished with value: 0.974275913307354 and parameters: {'etc_criterion': 'gini', 'etc_min_samples_split': 5, 'etc_min_samples_leaf': 10, 'etc_max_features': 12}. Best is trial 4 with value: 0.985418.[0m
[32m[I 2023-02-26 15:26:18,541][0m Trial 15 finished with value: 0.9792475001289851 and parameters: {'etc_criterion': 'gini', 'etc_min_samples_split': 23, 'etc_min_samples_leaf': 18, 'etc_max_features': 22}. Best is trial 4 with value: 0.985418.[0m
[32m[I 2023-02-26 15:26:21,057][0m Trial 16 finished with value: 0.9559167723109951 and parameters: {'etc_criterion': 'gini', 'etc_min_samples_split': 32, 'etc_min_samples_leaf': 6, 'etc_max_features': 7}. Best is trial 4 with value: 0.985418.[0m
[32m[I 2023-02-26 15:26:24,340][0m Trial 17 finished with value: 0.9525076483173553 and parameters: {'etc_criterion': 'gini', 'etc_min_samples_split': 50, 'etc_min_samples_leaf': 19, 'etc_max_features': 13}. Best is trial 4 with value: 0.985418.[0m
[32m[I 2023-02-26 15:26:26,075][0m Trial 18 finished with value: 0.7171431067191513 and parameters: {'etc_criterion': 'gini', 'etc_min_samples_split': 10, 'etc_min_samples_leaf': 5, 'etc_max_features': 1}. Best is trial 4 with value: 0.985418.[0m
[32m[I 2023-02-26 15:26:29,905][0m Trial 19 finished with value: 0.9778488209848943 and parameters: {'etc_criterion': 'gini', 'etc_min_samples_split': 19, 'etc_min_samples_leaf': 17, 'etc_max_features': 21}. Best is trial 4 with value: 0.985418.[0m
[32m[I 2023-02-26 15:26:29,967][0m Study finished.[0m
[32m[I 2023-02-26 15:26:29,998][0m --------------------------------------------------------------------------------[0m
[32m[I 2023-02-26 15:26:29,998][0m --------------------          ExtraTreesClassifier          --------------------[0m
[32m[I 2023-02-26 15:26:29,998][0m --------------------------------------------------------------------------------[0m
[32m[I 2023-02-26 15:26:30,030][0m A new study created in RDB with name: ExtraTreesClassifier_03691551[0m
[32m[I 2023-02-26 15:26:30,030][0m Study started.[0m
[32m[I 2023-02-26 15:35:26,339][0m Trial 0 finished with value: 0.9895704438857811 and parameters: {'etsc_n_estimators': 200, 'etsc_criterion': 'gini', 'etsc_min_samples_split': 48, 'etsc_min_samples_leaf': 7, 'etsc_max_features': 25, 'etsc_bootstrap': False}. Best is trial 0 with value: 0.98957.[0m
[32m[I 2023-02-26 15:39:58,765][0m Trial 1 finished with value: 0.988498364727728 and parameters: {'etsc_n_estimators': 200, 'etsc_criterion': 'entropy', 'etsc_min_samples_split': 6, 'etsc_min_samples_leaf': 2, 'etsc_max_features': 8, 'etsc_bootstrap': False}. Best is trial 0 with value: 0.98957.[0m
[32m[I 2023-02-26 15:41:41,132][0m Trial 2 finished with value: 0.9797167444606671 and parameters: {'etsc_n_estimators': 50, 'etsc_criterion': 'gini', 'etsc_min_samples_split': 11, 'etsc_min_samples_leaf': 48, 'etsc_max_features': 17, 'etsc_bootstrap': False}. Best is trial 0 with value: 0.98957.[0m
[32m[I 2023-02-26 15:44:29,349][0m Trial 3 finished with value: 0.9810946975830054 and parameters: {'etsc_n_estimators': 80, 'etsc_criterion': 'gini', 'etsc_min_samples_split': 46, 'etsc_min_samples_leaf': 50, 'etsc_max_features': 18, 'etsc_bootstrap': False}. Best is trial 0 with value: 0.98957.[0m
[32m[I 2023-02-26 15:45:27,845][0m Trial 4 finished with value: 0.8861401417206688 and parameters: {'etsc_n_estimators': 170, 'etsc_criterion': 'gini', 'etsc_min_samples_split': 19, 'etsc_min_samples_leaf': 38, 'etsc_max_features': 2, 'etsc_bootstrap': False}. Best is trial 0 with value: 0.98957.[0m
[32m[I 2023-02-26 15:47:59,733][0m Trial 5 finished with value: 0.9813322601505305 and parameters: {'etsc_n_estimators': 80, 'etsc_criterion': 'entropy', 'etsc_min_samples_split': 22, 'etsc_min_samples_leaf': 30, 'etsc_max_features': 16, 'etsc_bootstrap': False}. Best is trial 0 with value: 0.98957.[0m
[32m[I 2023-02-26 15:48:42,079][0m Trial 6 finished with value: 0.8939721282099191 and parameters: {'etsc_n_estimators': 90, 'etsc_criterion': 'entropy', 'etsc_min_samples_split': 16, 'etsc_min_samples_leaf': 22, 'etsc_max_features': 3, 'etsc_bootstrap': True}. Best is trial 0 with value: 0.98957.[0m
[32m[I 2023-02-26 15:50:46,153][0m Trial 7 finished with value: 0.9748856647344188 and parameters: {'etsc_n_estimators': 90, 'etsc_criterion': 'gini', 'etsc_min_samples_split': 17, 'etsc_min_samples_leaf': 38, 'etsc_max_features': 15, 'etsc_bootstrap': True}. Best is trial 0 with value: 0.98957.[0m
[32m[I 2023-02-26 15:52:04,171][0m Trial 8 finished with value: 0.9509760253974455 and parameters: {'etsc_n_estimators': 70, 'etsc_criterion': 'gini', 'etsc_min_samples_split': 29, 'etsc_min_samples_leaf': 35, 'etsc_max_features': 11, 'etsc_bootstrap': True}. Best is trial 0 with value: 0.98957.[0m
[32m[I 2023-02-26 15:52:50,252][0m Trial 9 finished with value: 0.8940298152652715 and parameters: {'etsc_n_estimators': 90, 'etsc_criterion': 'gini', 'etsc_min_samples_split': 48, 'etsc_min_samples_leaf': 40, 'etsc_max_features': 4, 'etsc_bootstrap': True}. Best is trial 0 with value: 0.98957.[0m
[32m[I 2023-02-26 15:59:03,474][0m Trial 10 finished with value: 0.9908192846169737 and parameters: {'etsc_n_estimators': 140, 'etsc_criterion': 'gini', 'etsc_min_samples_split': 37, 'etsc_min_samples_leaf': 3, 'etsc_max_features': 25, 'etsc_bootstrap': False}. Best is trial 10 with value: 0.990819.[0m
[32m[I 2023-02-26 16:05:53,187][0m Trial 11 finished with value: 0.9913224600730663 and parameters: {'etsc_n_estimators': 150, 'etsc_criterion': 'gini', 'etsc_min_samples_split': 37, 'etsc_min_samples_leaf': 1, 'etsc_max_features': 26, 'etsc_bootstrap': False}. Best is trial 11 with value: 0.991322.[0m
[32m[I 2023-02-26 16:12:22,965][0m Trial 12 finished with value: 0.9889131884774631 and parameters: {'etsc_n_estimators': 140, 'etsc_criterion': 'gini', 'etsc_min_samples_split': 35, 'etsc_min_samples_leaf': 14, 'etsc_max_features': 26, 'etsc_bootstrap': False}. Best is trial 11 with value: 0.991322.[0m
[32m[I 2023-02-26 16:17:41,220][0m Trial 13 finished with value: 0.9884017693955703 and parameters: {'etsc_n_estimators': 130, 'etsc_criterion': 'gini', 'etsc_min_samples_split': 37, 'etsc_min_samples_leaf': 13, 'etsc_max_features': 22, 'etsc_bootstrap': False}. Best is trial 11 with value: 0.991322.[0m
[32m[I 2023-02-26 16:24:01,380][0m Trial 14 finished with value: 0.9908879328372675 and parameters: {'etsc_n_estimators': 160, 'etsc_criterion': 'gini', 'etsc_min_samples_split': 38, 'etsc_min_samples_leaf': 1, 'etsc_max_features': 21, 'etsc_bootstrap': False}. Best is trial 11 with value: 0.991322.[0m
[32m[I 2023-02-26 16:30:33,772][0m Trial 15 finished with value: 0.9887687520499805 and parameters: {'etsc_n_estimators': 170, 'etsc_criterion': 'entropy', 'etsc_min_samples_split': 29, 'etsc_min_samples_leaf': 11, 'etsc_max_features': 21, 'etsc_bootstrap': False}. Best is trial 11 with value: 0.991322.[0m
[32m[I 2023-02-26 16:30:33,835][0m Study finished.[0m
[32m[I 2023-02-26 16:30:33,850][0m --------------------------------------------------------------------------------[0m
[32m[I 2023-02-26 16:30:33,850][0m --------------------               GaussianNB               --------------------[0m
[32m[I 2023-02-26 16:30:33,850][0m --------------------------------------------------------------------------------[0m
[32m[I 2023-02-26 16:30:33,882][0m A new study created in RDB with name: GaussianNB_03691551[0m
[32m[I 2023-02-26 16:30:33,882][0m Study started.[0m
[32m[I 2023-02-26 16:30:36,492][0m Trial 0 finished with value: 0.710493909224098 and parameters: {'gnb_var_smoothing': 8.569289844608334e-08}. Best is trial 0 with value: 0.710494.[0m
[32m[I 2023-02-26 16:30:39,151][0m Trial 1 finished with value: 0.6183181535752397 and parameters: {'gnb_var_smoothing': 9.033353616214555e-12}. Best is trial 0 with value: 0.710494.[0m
[32m[I 2023-02-26 16:30:41,642][0m Trial 2 finished with value: 0.7281172339903896 and parameters: {'gnb_var_smoothing': 6.652370512038782e-06}. Best is trial 2 with value: 0.728117.[0m
[32m[I 2023-02-26 16:30:44,050][0m Trial 3 finished with value: 0.39353397916183885 and parameters: {'gnb_var_smoothing': 1.2429162438013537}. Best is trial 2 with value: 0.728117.[0m
[32m[I 2023-02-26 16:30:46,736][0m Trial 4 finished with value: 0.6531299551351526 and parameters: {'gnb_var_smoothing': 1.0678575530029904e-10}. Best is trial 2 with value: 0.728117.[0m
[32m[I 2023-02-26 16:30:49,378][0m Trial 5 finished with value: 0.6673777807510957 and parameters: {'gnb_var_smoothing': 2.3116867277396831e-10}. Best is trial 2 with value: 0.728117.[0m
[32m[I 2023-02-26 16:30:51,801][0m Trial 6 finished with value: 0.3781255596969302 and parameters: {'gnb_var_smoothing': 37.8668796167977}. Best is trial 2 with value: 0.728117.[0m
[32m[I 2023-02-26 16:30:54,224][0m Trial 7 finished with value: 0.3781255596969302 and parameters: {'gnb_var_smoothing': 12.885043913142997}. Best is trial 2 with value: 0.728117.[0m
[32m[I 2023-02-26 16:30:56,913][0m Trial 8 finished with value: 0.6876898638184202 and parameters: {'gnb_var_smoothing': 6.983219411380274e-10}. Best is trial 2 with value: 0.728117.[0m
[32m[I 2023-02-26 16:30:59,321][0m Trial 9 finished with value: 0.3781255596969302 and parameters: {'gnb_var_smoothing': 4.621335846219803}. Best is trial 2 with value: 0.728117.[0m
[32m[I 2023-02-26 16:31:01,841][0m Trial 10 finished with value: 0.706101618132966 and parameters: {'gnb_var_smoothing': 0.0003283517288550624}. Best is trial 2 with value: 0.728117.[0m
[32m[I 2023-02-26 16:31:04,435][0m Trial 11 finished with value: 0.77208029059935 and parameters: {'gnb_var_smoothing': 6.079175890426581e-07}. Best is trial 11 with value: 0.77208.[0m
[32m[I 2023-02-26 16:31:06,983][0m Trial 12 finished with value: 0.7082683954530983 and parameters: {'gnb_var_smoothing': 7.626357930443951e-05}. Best is trial 11 with value: 0.77208.[0m
[32m[I 2023-02-26 16:31:09,515][0m Trial 13 finished with value: 0.7489155691672459 and parameters: {'gnb_var_smoothing': 1.3042361086357485e-06}. Best is trial 11 with value: 0.77208.[0m
[32m[I 2023-02-26 16:31:12,126][0m Trial 14 finished with value: 0.7276703478811527 and parameters: {'gnb_var_smoothing': 2.0385797093099545e-07}. Best is trial 11 with value: 0.77208.[0m
[32m[I 2023-02-26 16:31:14,738][0m Trial 15 finished with value: 0.7106546779946147 and parameters: {'gnb_var_smoothing': 8.081669543083557e-08}. Best is trial 11 with value: 0.77208.[0m
[32m[I 2023-02-26 16:31:17,223][0m Trial 16 finished with value: 0.6871851271317927 and parameters: {'gnb_var_smoothing': 0.03301303058140064}. Best is trial 11 with value: 0.77208.[0m
[32m[I 2023-02-26 16:31:19,756][0m Trial 17 finished with value: 0.6991391686397251 and parameters: {'gnb_var_smoothing': 0.012813785211801031}. Best is trial 11 with value: 0.77208.[0m
[32m[I 2023-02-26 16:31:22,288][0m Trial 18 finished with value: 0.7381888152523637 and parameters: {'gnb_var_smoothing': 3.1453573233111536e-06}. Best is trial 11 with value: 0.77208.[0m
