[32m[I 2023-02-26 14:27:46,778][0m Trial 9 finished with value: 0.9543546898461005 and parameters: {'brf_n_estimators': 100, 'brf_criterion': 'gini', 'brf_min_samples_split': 40, 'brf_min_samples_leaf': 23, 'brf_max_features': 22, 'brf_bootstrap': True}. Best is trial 8 with value: 0.96271.[0m
[32m[I 2023-02-26 14:28:59,835][0m sklearn.ensemble.RandomForestClassifier.predict: fallback to original Scikit-learn[0m
[32m[I 2023-02-26 14:28:59,850][0m sklearn.ensemble.RandomForestClassifier.predict_proba: fallback to original Scikit-learn[0m
[32m[I 2023-02-26 14:29:06,794][0m Trial 10 finished with value: 0.9524133940635396 and parameters: {'brf_n_estimators': 150, 'brf_criterion': 'entropy', 'brf_min_samples_split': 31, 'brf_min_samples_leaf': 19, 'brf_max_features': 9, 'brf_bootstrap': False}. Best is trial 8 with value: 0.96271.[0m
[32m[I 2023-02-26 14:29:32,688][0m sklearn.ensemble.RandomForestClassifier.predict: fallback to original Scikit-learn[0m
[32m[I 2023-02-26 14:29:32,688][0m sklearn.ensemble.RandomForestClassifier.predict_proba: fallback to original Scikit-learn[0m
[32m[I 2023-02-26 14:29:36,080][0m Trial 11 finished with value: 0.962487855118111 and parameters: {'brf_n_estimators': 50, 'brf_criterion': 'gini', 'brf_min_samples_split': 32, 'brf_min_samples_leaf': 2, 'brf_max_features': 16, 'brf_bootstrap': False}. Best is trial 8 with value: 0.96271.[0m
[32m[I 2023-02-26 14:30:03,064][0m sklearn.ensemble.RandomForestClassifier.predict: fallback to original Scikit-learn[0m
[32m[I 2023-02-26 14:30:03,080][0m sklearn.ensemble.RandomForestClassifier.predict_proba: fallback to original Scikit-learn[0m
[32m[I 2023-02-26 14:30:06,456][0m Trial 12 finished with value: 0.9642114422509722 and parameters: {'brf_n_estimators': 50, 'brf_criterion': 'gini', 'brf_min_samples_split': 31, 'brf_min_samples_leaf': 1, 'brf_max_features': 20, 'brf_bootstrap': False}. Best is trial 12 with value: 0.964211.[0m
[32m[I 2023-02-26 14:30:33,448][0m sklearn.ensemble.RandomForestClassifier.predict: fallback to original Scikit-learn[0m
[32m[I 2023-02-26 14:30:33,464][0m sklearn.ensemble.RandomForestClassifier.predict_proba: fallback to original Scikit-learn[0m
[32m[I 2023-02-26 14:30:36,748][0m Trial 13 finished with value: 0.9596218823419977 and parameters: {'brf_n_estimators': 50, 'brf_criterion': 'gini', 'brf_min_samples_split': 26, 'brf_min_samples_leaf': 14, 'brf_max_features': 21, 'brf_bootstrap': False}. Best is trial 12 with value: 0.964211.[0m
[32m[I 2023-02-26 14:32:24,338][0m sklearn.ensemble.RandomForestClassifier.predict: fallback to original Scikit-learn[0m
[32m[I 2023-02-26 14:32:24,338][0m sklearn.ensemble.RandomForestClassifier.predict_proba: fallback to original Scikit-learn[0m
[32m[I 2023-02-26 14:32:33,264][0m Trial 14 finished with value: 0.9635567187484334 and parameters: {'brf_n_estimators': 190, 'brf_criterion': 'gini', 'brf_min_samples_split': 33, 'brf_min_samples_leaf': 2, 'brf_max_features': 25, 'brf_bootstrap': False}. Best is trial 12 with value: 0.964211.[0m
[32m[I 2023-02-26 14:34:15,862][0m sklearn.ensemble.RandomForestClassifier.predict: fallback to original Scikit-learn[0m
[32m[I 2023-02-26 14:34:15,862][0m sklearn.ensemble.RandomForestClassifier.predict_proba: fallback to original Scikit-learn[0m
[32m[I 2023-02-26 14:34:24,411][0m Trial 15 finished with value: 0.9615062144474256 and parameters: {'brf_n_estimators': 180, 'brf_criterion': 'gini', 'brf_min_samples_split': 14, 'brf_min_samples_leaf': 10, 'brf_max_features': 26, 'brf_bootstrap': False}. Best is trial 12 with value: 0.964211.[0m
[32m[I 2023-02-26 14:36:11,546][0m sklearn.ensemble.RandomForestClassifier.predict: fallback to original Scikit-learn[0m
[32m[I 2023-02-26 14:36:11,546][0m sklearn.ensemble.RandomForestClassifier.predict_proba: fallback to original Scikit-learn[0m
[32m[I 2023-02-26 14:36:20,241][0m Trial 16 finished with value: 0.9533396708450413 and parameters: {'brf_n_estimators': 190, 'brf_criterion': 'gini', 'brf_min_samples_split': 28, 'brf_min_samples_leaf': 31, 'brf_max_features': 26, 'brf_bootstrap': False}. Best is trial 12 with value: 0.964211.[0m
[32m[I 2023-02-26 14:38:08,685][0m sklearn.ensemble.RandomForestClassifier.predict: fallback to original Scikit-learn[0m
[32m[I 2023-02-26 14:38:08,685][0m sklearn.ensemble.RandomForestClassifier.predict_proba: fallback to original Scikit-learn[0m
[32m[I 2023-02-26 14:38:17,913][0m Trial 17 finished with value: 0.958155864480639 and parameters: {'brf_n_estimators': 200, 'brf_criterion': 'gini', 'brf_min_samples_split': 35, 'brf_min_samples_leaf': 18, 'brf_max_features': 22, 'brf_bootstrap': False}. Best is trial 12 with value: 0.964211.[0m
[32m[I 2023-02-26 14:39:39,088][0m sklearn.ensemble.RandomForestClassifier.predict: fallback to original Scikit-learn[0m
[32m[I 2023-02-26 14:39:39,088][0m sklearn.ensemble.RandomForestClassifier.predict_proba: fallback to original Scikit-learn[0m
[32m[I 2023-02-26 14:39:46,378][0m Trial 18 finished with value: 0.961373366607269 and parameters: {'brf_n_estimators': 150, 'brf_criterion': 'entropy', 'brf_min_samples_split': 21, 'brf_min_samples_leaf': 6, 'brf_max_features': 14, 'brf_bootstrap': False}. Best is trial 12 with value: 0.964211.[0m
[32m[I 2023-02-26 14:41:01,070][0m sklearn.ensemble.RandomForestClassifier.predict: fallback to original Scikit-learn[0m
[32m[I 2023-02-26 14:41:01,070][0m sklearn.ensemble.RandomForestClassifier.predict_proba: fallback to original Scikit-learn[0m
[32m[I 2023-02-26 14:41:07,743][0m Trial 19 finished with value: 0.9530938091011538 and parameters: {'brf_n_estimators': 140, 'brf_criterion': 'gini', 'brf_min_samples_split': 9, 'brf_min_samples_leaf': 50, 'brf_max_features': 21, 'brf_bootstrap': False}. Best is trial 12 with value: 0.964211.[0m
[32m[I 2023-02-26 14:41:07,790][0m Study finished.[0m
[32m[I 2023-02-26 14:41:07,821][0m --------------------------------------------------------------------------------[0m
[32m[I 2023-02-26 14:41:07,821][0m --------------------              BernoulliNB               --------------------[0m
[32m[I 2023-02-26 14:41:07,821][0m --------------------------------------------------------------------------------[0m
[32m[I 2023-02-26 14:41:07,853][0m A new study created in RDB with name: BernoulliNB_03691551[0m
[32m[I 2023-02-26 14:41:07,853][0m Study started.[0m
[32m[I 2023-02-26 14:41:10,182][0m Trial 0 finished with value: 0.8150466003953311 and parameters: {'bnb_alpha': 0.9, 'bnb_binarize': 0.25, 'bnb_fit_prior': True}. Best is trial 0 with value: 0.815047.[0m
[32m[I 2023-02-26 14:41:12,541][0m Trial 1 finished with value: 0.38933149613359774 and parameters: {'bnb_alpha': 0.25, 'bnb_binarize': 0.15000000000000002, 'bnb_fit_prior': False}. Best is trial 0 with value: 0.815047.[0m
[32m[I 2023-02-26 14:41:14,903][0m Trial 2 finished with value: 0.38933149613359774 and parameters: {'bnb_alpha': 0.25, 'bnb_binarize': 0.2, 'bnb_fit_prior': False}. Best is trial 0 with value: 0.815047.[0m
[32m[I 2023-02-26 14:41:17,278][0m Trial 3 finished with value: 0.38933149613359774 and parameters: {'bnb_alpha': 0.2, 'bnb_binarize': 0.30000000000000004, 'bnb_fit_prior': False}. Best is trial 0 with value: 0.815047.[0m
[32m[I 2023-02-26 14:41:19,598][0m Trial 4 finished with value: 0.3419059959784064 and parameters: {'bnb_alpha': 0.2, 'bnb_binarize': 1.0, 'bnb_fit_prior': False}. Best is trial 0 with value: 0.815047.[0m
[32m[I 2023-02-26 14:41:21,958][0m Trial 5 finished with value: 0.8150466003953311 and parameters: {'bnb_alpha': 0.8500000000000001, 'bnb_binarize': 0.75, 'bnb_fit_prior': True}. Best is trial 0 with value: 0.815047.[0m
[32m[I 2023-02-26 14:41:24,318][0m Trial 6 finished with value: 0.8150466003953311 and parameters: {'bnb_alpha': 0.9, 'bnb_binarize': 0.9, 'bnb_fit_prior': True}. Best is trial 0 with value: 0.815047.[0m
[32m[I 2023-02-26 14:41:26,663][0m Trial 7 finished with value: 0.8150479725566577 and parameters: {'bnb_alpha': 0.4, 'bnb_binarize': 0.45, 'bnb_fit_prior': True}. Best is trial 7 with value: 0.815048.[0m
[32m[I 2023-02-26 14:41:29,039][0m Trial 8 finished with value: 0.3893242118180741 and parameters: {'bnb_alpha': 0.65, 'bnb_binarize': 0.75, 'bnb_fit_prior': False}. Best is trial 7 with value: 0.815048.[0m
[32m[I 2023-02-26 14:41:31,404][0m Trial 9 finished with value: 0.8150479725566577 and parameters: {'bnb_alpha': 0.1, 'bnb_binarize': 0.9500000000000001, 'bnb_fit_prior': True}. Best is trial 7 with value: 0.815048.[0m
[32m[I 2023-02-26 14:41:33,748][0m Trial 10 finished with value: 0.8150479725566577 and parameters: {'bnb_alpha': 0.45, 'bnb_binarize': 0.45, 'bnb_fit_prior': True}. Best is trial 7 with value: 0.815048.[0m
[32m[I 2023-02-26 14:41:35,944][0m Trial 11 finished with value: 0.22354152149826756 and parameters: {'bnb_alpha': 0.0, 'bnb_binarize': 0.55, 'bnb_fit_prior': True}. Best is trial 7 with value: 0.815048.[0m
[32m[I 2023-02-26 14:41:38,319][0m Trial 12 finished with value: 0.8150479725566577 and parameters: {'bnb_alpha': 0.55, 'bnb_binarize': 0.55, 'bnb_fit_prior': True}. Best is trial 7 with value: 0.815048.[0m
[32m[I 2023-02-26 14:41:40,508][0m Trial 13 finished with value: 0.22354152149826756 and parameters: {'bnb_alpha': 0.0, 'bnb_binarize': 0.4, 'bnb_fit_prior': True}. Best is trial 7 with value: 0.815048.[0m
[32m[I 2023-02-26 14:41:42,852][0m Trial 14 finished with value: 0.8150479725566577 and parameters: {'bnb_alpha': 0.45, 'bnb_binarize': 0.0, 'bnb_fit_prior': True}. Best is trial 7 with value: 0.815048.[0m
[32m[I 2023-02-26 14:41:45,230][0m Trial 15 finished with value: 0.8150479725566577 and parameters: {'bnb_alpha': 0.35000000000000003, 'bnb_binarize': 0.7000000000000001, 'bnb_fit_prior': True}. Best is trial 7 with value: 0.815048.[0m
[32m[I 2023-02-26 14:41:47,579][0m Trial 16 finished with value: 0.8150466003953311 and parameters: {'bnb_alpha': 0.7000000000000001, 'bnb_binarize': 0.65, 'bnb_fit_prior': True}. Best is trial 7 with value: 0.815048.[0m
[32m[I 2023-02-26 14:41:49,954][0m Trial 17 finished with value: 0.8150479725566577 and parameters: {'bnb_alpha': 0.6000000000000001, 'bnb_binarize': 0.0, 'bnb_fit_prior': True}. Best is trial 17 with value: 0.815048.[0m
[32m[I 2023-02-26 14:41:52,313][0m Trial 18 finished with value: 0.8150466003953311 and parameters: {'bnb_alpha': 0.75, 'bnb_binarize': 0.0, 'bnb_fit_prior': True}. Best is trial 7 with value: 0.815048.[0m
[32m[I 2023-02-26 14:41:54,675][0m Trial 19 finished with value: 0.8150479725566577 and parameters: {'bnb_alpha': 0.1, 'bnb_binarize': 0.8500000000000001, 'bnb_fit_prior': True}. Best is trial 19 with value: 0.815048.[0m
[32m[I 2023-02-26 14:41:54,722][0m Study finished.[0m
[32m[I 2023-02-26 14:41:54,753][0m --------------------------------------------------------------------------------[0m
[32m[I 2023-02-26 14:41:54,769][0m --------------------              CDClassifier              --------------------[0m
[32m[I 2023-02-26 14:41:54,769][0m --------------------------------------------------------------------------------[0m
[32m[I 2023-02-26 14:41:54,784][0m A new study created in RDB with name: CDClassifier_03691551[0m
[32m[I 2023-02-26 14:41:54,800][0m Study started.[0m
[32m[I 2023-02-26 14:43:43,205][0m Trial 0 finished with value: 0.8687280637962438 and parameters: {'cdc_loss': 'log', 'cdc_penalty': 'l1', 'cdc_C': 0.006445576099860397, 'cdc_alpha': 49.866671437325984, 'cdc_selection': 'uniform'}. Best is trial 0 with value: 0.868728.[0m
[32m[I 2023-02-26 14:44:09,948][0m Trial 1 finished with value: 0.8637634365101939 and parameters: {'cdc_loss': 'squared_hinge', 'cdc_penalty': 'l2', 'cdc_C': 0.5172207803194583, 'cdc_alpha': 0.13052751850838487, 'cdc_selection': 'uniform'}. Best is trial 0 with value: 0.868728.[0m
[32m[I 2023-02-26 14:46:40,935][0m Trial 2 finished with value: 0.8664177202516389 and parameters: {'cdc_loss': 'log', 'cdc_penalty': 'l1/l2', 'cdc_C': 202.34965794146308, 'cdc_alpha': 0.018430999607198205, 'cdc_selection': 'cyclic'}. Best is trial 0 with value: 0.868728.[0m
[32m[I 2023-02-26 14:50:30,169][0m Trial 3 finished with value: 0.46947058358974364 and parameters: {'cdc_loss': 'squared_hinge', 'cdc_penalty': 'l1/l2', 'cdc_C': 53.79079483922226, 'cdc_alpha': 2.603949695079589, 'cdc_selection': 'cyclic'}. Best is trial 0 with value: 0.868728.[0m
[32m[I 2023-02-26 14:51:21,823][0m Trial 4 finished with value: 0.8496429552968107 and parameters: {'cdc_loss': 'modified_huber', 'cdc_penalty': 'l1', 'cdc_C': 0.07425417393946207, 'cdc_alpha': 0.03524004215652015, 'cdc_selection': 'uniform'}. Best is trial 0 with value: 0.868728.[0m
[32m[I 2023-02-26 14:51:54,700][0m Trial 5 finished with value: 0.8659822471835988 and parameters: {'cdc_loss': 'squared', 'cdc_penalty': 'l2', 'cdc_C': 16.64027910760019, 'cdc_alpha': 0.005949375242698302, 'cdc_selection': 'uniform'}. Best is trial 0 with value: 0.868728.[0m
[32m[I 2023-02-26 14:52:01,399][0m Trial 6 finished with value: 0.7917977126353167 and parameters: {'cdc_loss': 'log', 'cdc_penalty': 'l1/l2', 'cdc_C': 209.07702405051788, 'cdc_alpha': 1.8368289437702994, 'cdc_selection': 'uniform'}. Best is trial 0 with value: 0.868728.[0m
[32m[I 2023-02-26 14:54:33,183][0m Trial 7 finished with value: 0.00018895391781870453 and parameters: {'cdc_loss': 'log', 'cdc_penalty': 'l2', 'cdc_C': 0.032232518811749725, 'cdc_alpha': 0.01582784900102749, 'cdc_selection': 'uniform'}. Best is trial 0 with value: 0.868728.[0m
[32m[I 2023-02-26 14:56:18,451][0m Trial 8 finished with value: 0.8307998741730919 and parameters: {'cdc_loss': 'log', 'cdc_penalty': 'l1', 'cdc_C': 0.0017446871425501145, 'cdc_alpha': 366.28826138508083, 'cdc_selection': 'cyclic'}. Best is trial 0 with value: 0.868728.[0m
[32m[I 2023-02-26 14:58:50,330][0m Trial 9 finished with value: 0.8664177202516389 and parameters: {'cdc_loss': 'log', 'cdc_penalty': 'l1/l2', 'cdc_C': 0.35151101036696003, 'cdc_alpha': 0.0061986167167364875, 'cdc_selection': 'cyclic'}. Best is trial 0 with value: 0.868728.[0m
[32m[I 2023-02-26 14:59:14,708][0m Trial 10 finished with value: 0.8310072566203544 and parameters: {'cdc_loss': 'squared', 'cdc_penalty': 'l1', 'cdc_C': 0.0010779867334246977, 'cdc_alpha': 137.7862022312705, 'cdc_selection': 'uniform'}. Best is trial 0 with value: 0.868728.[0m
[32m[I 2023-02-26 15:02:26,208][0m Trial 11 finished with value: 0.8703625181821218 and parameters: {'cdc_loss': 'log', 'cdc_penalty': 'l1', 'cdc_C': 804.8299678781054, 'cdc_alpha': 8.124254891321822, 'cdc_selection': 'cyclic'}. Best is trial 11 with value: 0.870363.[0m
[32m[I 2023-02-26 15:04:08,151][0m Trial 12 finished with value: 0.8765709241481789 and parameters: {'cdc_loss': 'modified_huber', 'cdc_penalty': 'l1', 'cdc_C': 3.39222047404507, 'cdc_alpha': 24.463287160462563, 'cdc_selection': 'cyclic'}. Best is trial 12 with value: 0.876571.[0m
[32m[I 2023-02-26 15:06:22,758][0m Trial 13 finished with value: 0.8720727202314752 and parameters: {'cdc_loss': 'modified_huber', 'cdc_penalty': 'l1', 'cdc_C': 4.6755314517111595, 'cdc_alpha': 17.120755398345462, 'cdc_selection': 'cyclic'}. Best is trial 12 with value: 0.876571.[0m
[32m[I 2023-02-26 15:08:45,047][0m Trial 14 finished with value: 0.8693106827015402 and parameters: {'cdc_loss': 'modified_huber', 'cdc_penalty': 'l1', 'cdc_C': 5.982424331030527, 'cdc_alpha': 22.959509173633922, 'cdc_selection': 'cyclic'}. Best is trial 12 with value: 0.876571.[0m
[32m[I 2023-02-26 15:10:02,475][0m Trial 15 finished with value: 0.8711103037009087 and parameters: {'cdc_loss': 'modified_huber', 'cdc_penalty': 'l1', 'cdc_C': 2.314104760508739, 'cdc_alpha': 882.188416822785, 'cdc_selection': 'cyclic'}. Best is trial 12 with value: 0.876571.[0m
[32m[I 2023-02-26 15:13:16,288][0m Trial 16 finished with value: 0.8760250811719079 and parameters: {'cdc_loss': 'modified_huber', 'cdc_penalty': 'l1', 'cdc_C': 10.228832524279019, 'cdc_alpha': 0.5090980408191739, 'cdc_selection': 'cyclic'}. Best is trial 12 with value: 0.876571.[0m
[32m[I 2023-02-26 15:17:23,009][0m Trial 17 finished with value: 0.8710198514163174 and parameters: {'cdc_loss': 'modified_huber', 'cdc_penalty': 'l1', 'cdc_C': 31.550624468929996, 'cdc_alpha': 0.5204641534249831, 'cdc_selection': 'cyclic'}. Best is trial 12 with value: 0.876571.[0m
[32m[I 2023-02-26 15:21:15,989][0m Trial 18 finished with value: 0.877587261001965 and parameters: {'cdc_loss': 'modified_huber', 'cdc_penalty': 'l1', 'cdc_C': 0.14145419711364585, 'cdc_alpha': 0.29984447292469263, 'cdc_selection': 'cyclic'}. Best is trial 18 with value: 0.877587.[0m
[32m[I 2023-02-26 15:22:44,597][0m Trial 19 finished with value: 0.8775193277270287 and parameters: {'cdc_loss': 'modified_huber', 'cdc_penalty': 'l2', 'cdc_C': 0.11359415859268349, 'cdc_alpha': 0.13697615646683753, 'cdc_selection': 'cyclic'}. Best is trial 18 with value: 0.877587.[0m
[32m[I 2023-02-26 15:22:44,659][0m Study finished.[0m
[32m[I 2023-02-26 15:22:44,690][0m --------------------------------------------------------------------------------[0m
[32m[I 2023-02-26 15:22:44,690][0m --------------------              ComplementNB              --------------------[0m
[32m[I 2023-02-26 15:22:44,690][0m --------------------------------------------------------------------------------[0m
[32m[I 2023-02-26 15:22:44,721][0m A new study created in RDB with name: ComplementNB_03691551[0m
[32m[I 2023-02-26 15:22:44,721][0m Study started.[0m
[32m[I 2023-02-26 15:22:46,660][0m Trial 0 finished with value: 0.6463212475715816 and parameters: {'compnb_alpha': 0.0, 'compnb_fit_prior': True, 'compnb_norm': False}. Best is trial 0 with value: 0.646321.[0m
[32m[I 2023-02-26 15:22:48,677][0m Trial 1 finished with value: 0.6463212475715816 and parameters: {'compnb_alpha': 1.0, 'compnb_fit_prior': True, 'compnb_norm': False}. Best is trial 0 with value: 0.646321.[0m
[32m[I 2023-02-26 15:22:50,758][0m Trial 2 finished with value: 0.49679945658291924 and parameters: {'compnb_alpha': 0.0, 'compnb_fit_prior': False, 'compnb_norm': True}. Best is trial 0 with value: 0.646321.[0m
[32m[I 2023-02-26 15:22:52,759][0m Trial 3 finished with value: 0.6463212475715816 and parameters: {'compnb_alpha': 0.6000000000000001, 'compnb_fit_prior': True, 'compnb_norm': False}. Best is trial 0 with value: 0.646321.[0m
[32m[I 2023-02-26 15:22:54,793][0m Trial 4 finished with value: 0.6164924073203388 and parameters: {'compnb_alpha': 0.35000000000000003, 'compnb_fit_prior': True, 'compnb_norm': True}. Best is trial 0 with value: 0.646321.[0m
[32m[I 2023-02-26 15:22:56,813][0m Trial 5 finished with value: 0.6463212475715816 and parameters: {'compnb_alpha': 0.4, 'compnb_fit_prior': True, 'compnb_norm': False}. Best is trial 0 with value: 0.646321.[0m
[32m[I 2023-02-26 15:22:58,807][0m Trial 6 finished with value: 0.6207558530620126 and parameters: {'compnb_alpha': 0.8, 'compnb_fit_prior': False, 'compnb_norm': True}. Best is trial 0 with value: 0.646321.[0m
[32m[I 2023-02-26 15:23:00,843][0m Trial 7 finished with value: 0.6199942399075864 and parameters: {'compnb_alpha': 0.7000000000000001, 'compnb_fit_prior': False, 'compnb_norm': True}. Best is trial 0 with value: 0.646321.[0m
[32m[I 2023-02-26 15:23:02,850][0m Trial 8 finished with value: 0.6463212475715816 and parameters: {'compnb_alpha': 0.35000000000000003, 'compnb_fit_prior': True, 'compnb_norm': False}. Best is trial 0 with value: 0.646321.[0m
[32m[I 2023-02-26 15:23:04,881][0m Trial 9 finished with value: 0.6211660649492512 and parameters: {'compnb_alpha': 0.8500000000000001, 'compnb_fit_prior': True, 'compnb_norm': True}. Best is trial 0 with value: 0.646321.[0m
[32m[I 2023-02-26 15:23:06,883][0m Trial 10 finished with value: 0.6463212475715816 and parameters: {'compnb_alpha': 0.0, 'compnb_fit_prior': False, 'compnb_norm': False}. Best is trial 0 with value: 0.646321.[0m
[32m[I 2023-02-26 15:23:08,907][0m Trial 11 finished with value: 0.6463212475715816 and parameters: {'compnb_alpha': 1.0, 'compnb_fit_prior': True, 'compnb_norm': False}. Best is trial 0 with value: 0.646321.[0m
[32m[I 2023-02-26 15:23:10,914][0m Trial 12 finished with value: 0.6463212475715816 and parameters: {'compnb_alpha': 0.2, 'compnb_fit_prior': True, 'compnb_norm': False}. Best is trial 0 with value: 0.646321.[0m
[32m[I 2023-02-26 15:23:12,928][0m Trial 13 finished with value: 0.6463212475715816 and parameters: {'compnb_alpha': 0.5, 'compnb_fit_prior': True, 'compnb_norm': False}. Best is trial 0 with value: 0.646321.[0m
[32m[I 2023-02-26 15:23:14,938][0m Trial 14 finished with value: 0.6463212475715816 and parameters: {'compnb_alpha': 0.2, 'compnb_fit_prior': True, 'compnb_norm': False}. Best is trial 0 with value: 0.646321.[0m
[32m[I 2023-02-26 15:23:16,954][0m Trial 15 finished with value: 0.6463212475715816 and parameters: {'compnb_alpha': 1.0, 'compnb_fit_prior': True, 'compnb_norm': False}. Best is trial 0 with value: 0.646321.[0m
[32m[I 2023-02-26 15:23:18,973][0m Trial 16 finished with value: 0.6463212475715816 and parameters: {'compnb_alpha': 0.15000000000000002, 'compnb_fit_prior': True, 'compnb_norm': False}. Best is trial 0 with value: 0.646321.[0m
[32m[I 2023-02-26 15:23:20,990][0m Trial 17 finished with value: 0.6463212475715816 and parameters: {'compnb_alpha': 0.15000000000000002, 'compnb_fit_prior': True, 'compnb_norm': False}. Best is trial 0 with value: 0.646321.[0m
[32m[I 2023-02-26 15:23:22,996][0m Trial 18 finished with value: 0.6463212475715816 and parameters: {'compnb_alpha': 0.8500000000000001, 'compnb_fit_prior': False, 'compnb_norm': False}. Best is trial 0 with value: 0.646321.[0m
