Trial 27 finished with value: 0.8391392215791358 and parameters: {'mlpc_hidden_layer_count': 3, 'mlpc_learning_rate': 'adaptive', 'mlpc_learning_rate_init': 0.00031782012291874573, 'mplc_max_iter': 2000}. Best is trial 8 with value: 0.923361.
Trial 26 finished with value: 0.9341137306118392 and parameters: {'mlpc_hidden_layer_count': 3, 'mlpc_learning_rate': 'adaptive', 'mlpc_learning_rate_init': 1.4703438474474961e-05, 'mplc_max_iter': 2000}. Best is trial 26 with value: 0.934114.
Trial 20 finished with value: 0.947043995683616 and parameters: {'mlpc_hidden_layer_count': 3, 'mlpc_learning_rate': 'constant', 'mlpc_learning_rate_init': 6.304215388045516e-05, 'mplc_max_iter': 2000}. Best is trial 20 with value: 0.947044.
Trial 28 finished with value: 0.9429050948647835 and parameters: {'mlpc_hidden_layer_count': 3, 'mlpc_learning_rate': 'constant', 'mlpc_learning_rate_init': 0.000308312024730865, 'mplc_max_iter': 2000}. Best is trial 20 with value: 0.947044.
Trial 25 finished with value: 0.9519208669417147 and parameters: {'mlpc_hidden_layer_count': 3, 'mlpc_learning_rate': 'adaptive', 'mlpc_learning_rate_init': 1.859801322029442e-05, 'mplc_max_iter': 2000}. Best is trial 25 with value: 0.951921.
Trial 17 finished with value: 0.940309017618378 and parameters: {'mlpc_hidden_layer_count': 3, 'mlpc_learning_rate': 'adaptive', 'mlpc_learning_rate_init': 2.4498640798555616e-06, 'mplc_max_iter': 2000}. Best is trial 25 with value: 0.951921.
A new study created in RDB with name: MultinomialNB_f33849d8
Trial 1 finished with value: 0.09610301233200992 and parameters: {'mnb_alpha': 0.25, 'mnb_fit_prior': True}. Best is trial 5 with value: 0.0961525.
Trial 6 finished with value: 0.0961521095913611 and parameters: {'mnb_alpha': 0.75, 'mnb_fit_prior': False}. Best is trial 5 with value: 0.0961525.
Trial 3 finished with value: 0.09610296267089016 and parameters: {'mnb_alpha': 0.15000000000000002, 'mnb_fit_prior': True}. Best is trial 5 with value: 0.0961525.
Trial 2 finished with value: 0.0961031485471693 and parameters: {'mnb_alpha': 0.45, 'mnb_fit_prior': True}. Best is trial 5 with value: 0.0961525.
Trial 0 finished with value: 0.0961521095913611 and parameters: {'mnb_alpha': 0.7000000000000001, 'mnb_fit_prior': False}. Best is trial 5 with value: 0.0961525.
Trial 7 finished with value: 0.0961521095913611 and parameters: {'mnb_alpha': 0.75, 'mnb_fit_prior': False}. Best is trial 5 with value: 0.0961525.
Trial 4 finished with value: 0.09610301233200992 and parameters: {'mnb_alpha': 0.25, 'mnb_fit_prior': True}. Best is trial 5 with value: 0.0961525.
Trial 5 finished with value: 0.096152490212032 and parameters: {'mnb_alpha': 0.2, 'mnb_fit_prior': False}. Best is trial 5 with value: 0.0961525.
Trial 11 finished with value: 0.0961521095913611 and parameters: {'mnb_alpha': 0.8, 'mnb_fit_prior': False}. Best is trial 12 with value: 0.0961526.
Trial 12 finished with value: 0.09615262642719138 and parameters: {'mnb_alpha': 0.4, 'mnb_fit_prior': False}. Best is trial 12 with value: 0.0961526.
Trial 8 finished with value: 0.09610306217337834 and parameters: {'mnb_alpha': 0.35000000000000003, 'mnb_fit_prior': True}. Best is trial 12 with value: 0.0961526.
Trial 15 finished with value: 0.09610296267089016 and parameters: {'mnb_alpha': 0.15000000000000002, 'mnb_fit_prior': True}. Best is trial 12 with value: 0.0961526.
Trial 13 finished with value: 0.0961031485471693 and parameters: {'mnb_alpha': 0.4, 'mnb_fit_prior': True}. Best is trial 12 with value: 0.0961526.
Trial 14 finished with value: 0.09610293790803956 and parameters: {'mnb_alpha': 0.1, 'mnb_fit_prior': True}. Best is trial 12 with value: 0.0961526.
Trial 9 finished with value: 0.09610263171133902 and parameters: {'mnb_alpha': 0.75, 'mnb_fit_prior': True}. Best is trial 12 with value: 0.0961526.
Trial 10 finished with value: 0.09610415927238608 and parameters: {'mnb_alpha': 1.0, 'mnb_fit_prior': True}. Best is trial 12 with value: 0.0961526.
Trial 16 finished with value: 0.0961521095913611 and parameters: {'mnb_alpha': 0.55, 'mnb_fit_prior': False}. Best is trial 21 with value: 0.0961588.
Trial 21 finished with value: 0.09615876459084041 and parameters: {'mnb_alpha': 0.0, 'mnb_fit_prior': False}. Best is trial 21 with value: 0.0961588.
Trial 22 finished with value: 0.09615876459084041 and parameters: {'mnb_alpha': 0.0, 'mnb_fit_prior': False}. Best is trial 22 with value: 0.0961588.
Trial 17 finished with value: 0.09615876459084041 and parameters: {'mnb_alpha': 0.0, 'mnb_fit_prior': False}. Best is trial 22 with value: 0.0961588.
Trial 19 finished with value: 0.0961521095913611 and parameters: {'mnb_alpha': 0.55, 'mnb_fit_prior': False}. Best is trial 17 with value: 0.0961588.
Trial 18 finished with value: 0.09615876459084041 and parameters: {'mnb_alpha': 0.0, 'mnb_fit_prior': False}. Best is trial 17 with value: 0.0961588.
Trial 23 finished with value: 0.0961521095913611 and parameters: {'mnb_alpha': 0.55, 'mnb_fit_prior': False}. Best is trial 17 with value: 0.0961588.
Trial 20 finished with value: 0.09615876459084041 and parameters: {'mnb_alpha': 0.0, 'mnb_fit_prior': False}. Best is trial 17 with value: 0.0961588.
Trial 30 finished with value: 0.09615295755240336 and parameters: {'mnb_alpha': 0.05, 'mnb_fit_prior': False}. Best is trial 17 with value: 0.0961588.
Trial 25 finished with value: 0.09615295755240336 and parameters: {'mnb_alpha': 0.05, 'mnb_fit_prior': False}. Best is trial 17 with value: 0.0961588.
Trial 26 finished with value: 0.09615295755240336 and parameters: {'mnb_alpha': 0.05, 'mnb_fit_prior': False}. Best is trial 17 with value: 0.0961588.
Trial 31 finished with value: 0.09615295755240336 and parameters: {'mnb_alpha': 0.05, 'mnb_fit_prior': False}. Best is trial 17 with value: 0.0961588.
Trial 29 finished with value: 0.09615295755240336 and parameters: {'mnb_alpha': 0.05, 'mnb_fit_prior': False}. Best is trial 17 with value: 0.0961588.
Trial 24 finished with value: 0.09615295755240336 and parameters: {'mnb_alpha': 0.05, 'mnb_fit_prior': False}. Best is trial 17 with value: 0.0961588.
Trial 28 finished with value: 0.09615295755240336 and parameters: {'mnb_alpha': 0.05, 'mnb_fit_prior': False}. Best is trial 17 with value: 0.0961588.
Trial 27 finished with value: 0.09615295755240336 and parameters: {'mnb_alpha': 0.05, 'mnb_fit_prior': False}. Best is trial 17 with value: 0.0961588.
Trial 32 finished with value: 0.09615254005340045 and parameters: {'mnb_alpha': 0.30000000000000004, 'mnb_fit_prior': False}. Best is trial 17 with value: 0.0961588.
A new study created in RDB with name: PassiveAggressiveClassifier_f33849d8
Trial 5 finished with value: 0.8035480563676576 and parameters: {'pac_C': 0.0001378895754303939, 'pac_early_stopping': True, 'pac_validation_fraction': 0.25, 'pac_n_iter_no_change': 10}. Best is trial 5 with value: 0.803548.
Trial 2 finished with value: 0.7979305445405835 and parameters: {'pac_C': 0.04714813399243871, 'pac_early_stopping': True, 'pac_validation_fraction': 0.25, 'pac_n_iter_no_change': 10}. Best is trial 5 with value: 0.803548.
Trial 1 finished with value: 0.7979305445405835 and parameters: {'pac_C': 0.08633032331130891, 'pac_early_stopping': True, 'pac_validation_fraction': 0.25, 'pac_n_iter_no_change': 10}. Best is trial 5 with value: 0.803548.
Trial 0 finished with value: 0.7979305445405835 and parameters: {'pac_C': 0.014817899844100212, 'pac_early_stopping': True, 'pac_validation_fraction': 0.25, 'pac_n_iter_no_change': 10}. Best is trial 5 with value: 0.803548.
Trial 6 finished with value: 0.7979305445405835 and parameters: {'pac_C': 853.7464290632358, 'pac_early_stopping': True, 'pac_validation_fraction': 0.25, 'pac_n_iter_no_change': 10}. Best is trial 5 with value: 0.803548.
Trial 7 finished with value: 0.7979305445405835 and parameters: {'pac_C': 1.381631278673139, 'pac_early_stopping': True, 'pac_validation_fraction': 0.25, 'pac_n_iter_no_change': 10}. Best is trial 5 with value: 0.803548.
Trial 3 finished with value: 0.7979305445405835 and parameters: {'pac_C': 4.059017864365259, 'pac_early_stopping': True, 'pac_validation_fraction': 0.25, 'pac_n_iter_no_change': 10}. Best is trial 5 with value: 0.803548.
Trial 4 finished with value: 0.7985840157966124 and parameters: {'pac_C': 1.1664406595248345e-06, 'pac_early_stopping': True, 'pac_validation_fraction': 0.25, 'pac_n_iter_no_change': 10}. Best is trial 5 with value: 0.803548.
Trial 12 finished with value: 0.7979305445405835 and parameters: {'pac_C': 0.049182070392947266, 'pac_early_stopping': True, 'pac_validation_fraction': 0.25, 'pac_n_iter_no_change': 10}. Best is trial 5 with value: 0.803548.
Trial 9 finished with value: 0.7979305445405835 and parameters: {'pac_C': 0.0058248834369511605, 'pac_early_stopping': True, 'pac_validation_fraction': 0.25, 'pac_n_iter_no_change': 10}. Best is trial 5 with value: 0.803548.
Trial 10 finished with value: 0.7979305445405835 and parameters: {'pac_C': 988.9642621775613, 'pac_early_stopping': True, 'pac_validation_fraction': 0.25, 'pac_n_iter_no_change': 10}. Best is trial 5 with value: 0.803548.
Trial 15 finished with value: 0.7979305445405835 and parameters: {'pac_C': 0.00956656118339566, 'pac_early_stopping': True, 'pac_validation_fraction': 0.25, 'pac_n_iter_no_change': 10}. Best is trial 5 with value: 0.803548.
Trial 14 finished with value: 0.7479575359729063 and parameters: {'pac_C': 9.633267823585574e-06, 'pac_early_stopping': True, 'pac_validation_fraction': 0.25, 'pac_n_iter_no_change': 10}. Best is trial 5 with value: 0.803548.
Trial 8 finished with value: 0.7772179530558425 and parameters: {'pac_C': 4.016057914627589e-06, 'pac_early_stopping': True, 'pac_validation_fraction': 0.25, 'pac_n_iter_no_change': 10}. Best is trial 5 with value: 0.803548.
Trial 13 finished with value: 0.7746203237302327 and parameters: {'pac_C': 2.9459502861252636e-06, 'pac_early_stopping': True, 'pac_validation_fraction': 0.25, 'pac_n_iter_no_change': 10}. Best is trial 5 with value: 0.803548.
Trial 11 finished with value: 0.7693231595585504 and parameters: {'pac_C': 5.523004059479455e-06, 'pac_early_stopping': True, 'pac_validation_fraction': 0.25, 'pac_n_iter_no_change': 10}. Best is trial 5 with value: 0.803548.
Trial 16 finished with value: 0.7979305445405835 and parameters: {'pac_C': 606.2833347974484, 'pac_early_stopping': True, 'pac_validation_fraction': 0.25, 'pac_n_iter_no_change': 10}. Best is trial 5 with value: 0.803548.
Trial 17 finished with value: 0.7702428814143892 and parameters: {'pac_C': 3.1765694917694025e-05, 'pac_early_stopping': True, 'pac_validation_fraction': 0.25, 'pac_n_iter_no_change': 10}. Best is trial 5 with value: 0.803548.
Trial 21 finished with value: 0.7855322276701271 and parameters: {'pac_C': 0.00011874495390892879, 'pac_early_stopping': True, 'pac_validation_fraction': 0.25, 'pac_n_iter_no_change': 10}. Best is trial 5 with value: 0.803548.
Trial 22 finished with value: 0.78578959935078 and parameters: {'pac_C': 0.00010921131742048972, 'pac_early_stopping': True, 'pac_validation_fraction': 0.25, 'pac_n_iter_no_change': 10}. Best is trial 5 with value: 0.803548.
Trial 18 finished with value: 0.8008573864406766 and parameters: {'pac_C': 1.0028575699577955e-06, 'pac_early_stopping': True, 'pac_validation_fraction': 0.25, 'pac_n_iter_no_change': 10}. Best is trial 5 with value: 0.803548.
Trial 23 finished with value: 0.8034530044094556 and parameters: {'pac_C': 0.00018494331621070066, 'pac_early_stopping': True, 'pac_validation_fraction': 0.25, 'pac_n_iter_no_change': 10}. Best is trial 5 with value: 0.803548.
Trial 19 finished with value: 0.7968423735489156 and parameters: {'pac_C': 1.2622188867185153e-06, 'pac_early_stopping': True, 'pac_validation_fraction': 0.25, 'pac_n_iter_no_change': 10}. Best is trial 5 with value: 0.803548.
Trial 20 finished with value: 0.79849668386213 and parameters: {'pac_C': 1.1750865113358554e-06, 'pac_early_stopping': True, 'pac_validation_fraction': 0.25, 'pac_n_iter_no_change': 10}. Best is trial 5 with value: 0.803548.
A new study created in RDB with name: Perceptron_f33849d8
Trial 6 finished with value: 0.6950742018218817 and parameters: {'p_penalty': 'elasticnet', 'p_alpha': 0.29486416705800905, 'p_eta0': 2.0, 'p_early_stopping': True, 'p_validation_fraction': 0.25, 'p_n_iter_no_change': 10}. Best is trial 6 with value: 0.695074.
Trial 1 finished with value: 0.6950742018218817 and parameters: {'p_penalty': 'elasticnet', 'p_alpha': 0.29114523366655864, 'p_eta0': 2.0, 'p_early_stopping': True, 'p_validation_fraction': 0.25, 'p_n_iter_no_change': 10}. Best is trial 1 with value: 0.695074.
Trial 4 finished with value: 0.14661797106633015 and parameters: {'p_penalty': 'elasticnet', 'p_alpha': 3.384512354452558e-05, 'p_eta0': 2.0, 'p_early_stopping': True, 'p_validation_fraction': 0.25, 'p_n_iter_no_change': 10}. Best is trial 1 with value: 0.695074.
Trial 7 finished with value: 0.7240092313690887 and parameters: {'p_penalty': 'elasticnet', 'p_alpha': 0.016368274725132942, 'p_eta0': 0.5, 'p_early_stopping': True, 'p_validation_fraction': 0.25, 'p_n_iter_no_change': 10}. Best is trial 7 with value: 0.724009.
Trial 3 finished with value: 0.39406210987374696 and parameters: {'p_penalty': 'elasticnet', 'p_alpha': 0.0004614569698994545, 'p_eta0': 1.5, 'p_early_stopping': True, 'p_validation_fraction': 0.25, 'p_n_iter_no_change': 10}. Best is trial 7 with value: 0.724009.
Trial 5 finished with value: 0.36006269140811165 and parameters: {'p_penalty': 'elasticnet', 'p_alpha': 0.0016026069520366272, 'p_eta0': 2.0, 'p_early_stopping': True, 'p_validation_fraction': 0.25, 'p_n_iter_no_change': 10}. Best is trial 7 with value: 0.724009.
Trial 2 finished with value: 0.14451631144022073 and parameters: {'p_penalty': 'elasticnet', 'p_alpha': 6.0075136299715157e-05, 'p_eta0': 2.0, 'p_early_stopping': True, 'p_validation_fraction': 0.25, 'p_n_iter_no_change': 10}. Best is trial 7 with value: 0.724009.
Trial 0 finished with value: 0.6326222412693562 and parameters: {'p_penalty': 'elasticnet', 'p_alpha': 0.0013547676947402662, 'p_eta0': 1.5, 'p_early_stopping': True, 'p_validation_fraction': 0.25, 'p_n_iter_no_change': 10}. Best is trial 7 with value: 0.724009.
Trial 9 finished with value: 0.7031651994779327 and parameters: {'p_penalty': 'elasticnet', 'p_alpha': 0.8413677662567404, 'p_eta0': 0.5, 'p_early_stopping': True, 'p_validation_fraction': 0.25, 'p_n_iter_no_change': 10}. Best is trial 7 with value: 0.724009.
Trial 13 finished with value: 0.39296314366651136 and parameters: {'p_penalty': 'elasticnet', 'p_alpha': 0.0005896452850141034, 'p_eta0': 1.0, 'p_early_stopping': True, 'p_validation_fraction': 0.25, 'p_n_iter_no_change': 10}. Best is trial 7 with value: 0.724009.
Trial 10 finished with value: 0.6951709263159864 and parameters: {'p_penalty': 'elasticnet', 'p_alpha': 0.0011806484295426205, 'p_eta0': 1.5, 'p_early_stopping': True, 'p_validation_fraction': 0.25, 'p_n_iter_no_change': 10}. Best is trial 7 with value: 0.724009.
Trial 14 finished with value: 0.00014726595814079828 and parameters: {'p_penalty': 'elasticnet', 'p_alpha': 0.3592371579949781, 'p_eta0': 1.5, 'p_early_stopping': True, 'p_validation_fraction': 0.25, 'p_n_iter_no_change': 10}. Best is trial 7 with value: 0.724009.
Trial 11 finished with value: 0.7049774381020005 and parameters: {'p_penalty': 'elasticnet', 'p_alpha': 4.505889163989204e-05, 'p_eta0': 0.5, 'p_early_stopping': True, 'p_validation_fraction': 0.25, 'p_n_iter_no_change': 10}. Best is trial 7 with value: 0.724009.
Trial 8 finished with value: 0.22721671200427615 and parameters: {'p_penalty': 'elasticnet', 'p_alpha': 2.160733825833016e-05, 'p_eta0': 2.0, 'p_early_stopping': True, 'p_validation_fraction': 0.25, 'p_n_iter_no_change': 10}. Best is trial 7 with value: 0.724009.
Trial 15 finished with value: 0.14513385011510918 and parameters: {'p_penalty': 'elasticnet', 'p_alpha': 4.4474647360411196e-05, 'p_eta0': 2.0, 'p_early_stopping': True, 'p_validation_fraction': 0.25, 'p_n_iter_no_change': 10}. Best is trial 7 with value: 0.724009.
Trial 12 finished with value: 0.4056225223662546 and parameters: {'p_penalty': 'elasticnet', 'p_alpha': 2.7197502127772654e-06, 'p_eta0': 1.5, 'p_early_stopping': True, 'p_validation_fraction': 0.25, 'p_n_iter_no_change': 10}. Best is trial 7 with value: 0.724009.
Trial 16 finished with value: 0.22756246967892693 and parameters: {'p_penalty': 'elasticnet', 'p_alpha': 3.855244974329383e-05, 'p_eta0': 1.5, 'p_early_stopping': True, 'p_validation_fraction': 0.25, 'p_n_iter_no_change': 10}. Best is trial 7 with value: 0.724009.
Trial 18 finished with value: 0.3748690768023874 and parameters: {'p_penalty': 'elasticnet', 'p_alpha': 0.026639851104669255, 'p_eta0': 0.5, 'p_early_stopping': True, 'p_validation_fraction': 0.25, 'p_n_iter_no_change': 10}. Best is trial 7 with value: 0.724009.
Trial 19 finished with value: 0.7404103279708872 and parameters: {'p_penalty': 'elasticnet', 'p_alpha': 0.017554719199776452, 'p_eta0': 0.5, 'p_early_stopping': True, 'p_validation_fraction': 0.25, 'p_n_iter_no_change': 10}. Best is trial 19 with value: 0.74041.
Trial 17 finished with value: 0.7232929271808701 and parameters: {'p_penalty': 'elasticnet', 'p_alpha': 1.0312345345416116e-06, 'p_eta0': 0.5, 'p_early_stopping': True, 'p_validation_fraction': 0.25, 'p_n_iter_no_change': 10}. Best is trial 19 with value: 0.74041.
Trial 20 finished with value: 0.7060787302879176 and parameters: {'p_penalty': 'elasticnet', 'p_alpha': 1.4483593256715545e-06, 'p_eta0': 0.5, 'p_early_stopping': True, 'p_validation_fraction': 0.25, 'p_n_iter_no_change': 10}. Best is trial 19 with value: 0.74041.
Trial 21 finished with value: 0.7008000450337947 and parameters: {'p_penalty': 'elasticnet', 'p_alpha': 2.2877037716663963e-06, 'p_eta0': 0.5, 'p_early_stopping': True, 'p_validation_fraction': 0.25, 'p_n_iter_no_change': 10}. Best is trial 19 with value: 0.74041.
Trial 23 finished with value: 0.7395340587679071 and parameters: {'p_penalty': 'elasticnet', 'p_alpha': 0.019467624828237804, 'p_eta0': 0.5, 'p_early_stopping': True, 'p_validation_fraction': 0.25, 'p_n_iter_no_change': 10}. Best is trial 19 with value: 0.74041.
Trial 22 finished with value: 0.7046213569207429 and parameters: {'p_penalty': 'elasticnet', 'p_alpha': 1.5536818673758658e-06, 'p_eta0': 0.5, 'p_early_stopping': True, 'p_validation_fraction': 0.25, 'p_n_iter_no_change': 10}. Best is trial 19 with value: 0.74041.
Trial 24 finished with value: 0.7403645615337476 and parameters: {'p_penalty': 'elasticnet', 'p_alpha': 0.017615201829508344, 'p_eta0': 0.5, 'p_early_stopping': True, 'p_validation_fraction': 0.25, 'p_n_iter_no_change': 10}. Best is trial 19 with value: 0.74041.
Trial 26 finished with value: 0.7271574839828135 and parameters: {'p_penalty': 'elasticnet', 'p_alpha': 0.01879536368941674, 'p_eta0': 1.0, 'p_early_stopping': True, 'p_validation_fraction': 0.25, 'p_n_iter_no_change': 10}. Best is trial 19 with value: 0.74041.
Trial 27 finished with value: 0.6951424817790826 and parameters: {'p_penalty': 'elasticnet', 'p_alpha': 0.01705570991842924, 'p_eta0': 1.0, 'p_early_stopping': True, 'p_validation_fraction': 0.25, 'p_n_iter_no_change': 10}. Best is trial 19 with value: 0.74041.
Trial 25 finished with value: 0.7272708253541119 and parameters: {'p_penalty': 'elasticnet', 'p_alpha': 0.01877234138391497, 'p_eta0': 1.0, 'p_early_stopping': True, 'p_validation_fraction': 0.25, 'p_n_iter_no_change': 10}. Best is trial 19 with value: 0.74041.
Trial 28 finished with value: 0.3614433672168055 and parameters: {'p_penalty': 'elasticnet', 'p_alpha': 0.026003373695169064, 'p_eta0': 1.0, 'p_early_stopping': True, 'p_validation_fraction': 0.25, 'p_n_iter_no_change': 10}. Best is trial 19 with value: 0.74041.
Trial 29 finished with value: 0.061344494808701536 and parameters: {'p_penalty': 'elasticnet', 'p_alpha': 0.020581597863711817, 'p_eta0': 1.0, 'p_early_stopping': True, 'p_validation_fraction': 0.25, 'p_n_iter_no_change': 10}. Best is trial 19 with value: 0.74041.
A new study created in RDB with name: QuadraticDiscriminantAnalysis_f33849d8
Trial 2 finished with value: 0.7064578820031926 and parameters: {'qda_reg_param': 0.35000000000000003, 'qda_tol': 0.0004059532881351694}. Best is trial 2 with value: 0.706458.
Trial 0 finished with value: 0.6953961406851846 and parameters: {'qda_reg_param': 0.15000000000000002, 'qda_tol': 2.5724951418141068e-05}. Best is trial 2 with value: 0.706458.
Trial 4 finished with value: 0.7064578820031926 and parameters: {'qda_reg_param': 0.35000000000000003, 'qda_tol': 1.5002789078422311e-05}. Best is trial 2 with value: 0.706458.
Trial 3 finished with value: 0.6966971921848978 and parameters: {'qda_reg_param': 0.8500000000000001, 'qda_tol': 9.408482376033757e-05}. Best is trial 2 with value: 0.706458.
Trial 7 finished with value: 0.7047050208726613 and parameters: {'qda_reg_param': 0.45, 'qda_tol': 0.00023180619504859144}. Best is trial 2 with value: 0.706458.
Trial 6 finished with value: 0.7039070102441788 and parameters: {'qda_reg_param': 0.5, 'qda_tol': 1.328125424444472e-05}. Best is trial 2 with value: 0.706458.
Trial 1 finished with value: 0.690404344900762 and parameters: {'qda_reg_param': 0.30000000000000004, 'qda_tol': 5.3114467001724075e-05}. Best is trial 2 with value: 0.706458.
Trial 5 finished with value: 0.6969634103200527 and parameters: {'qda_reg_param': 0.8, 'qda_tol': 0.00013587013145292676}. Best is trial 2 with value: 0.706458.
Trial 13 finished with value: 0.6972222782532743 and parameters: {'qda_reg_param': 0.75, 'qda_tol': 2.6781182820077244e-06}. Best is trial 15 with value: 0.708021.
Trial 15 finished with value: 0.7080206915862601 and parameters: {'qda_reg_param': 1.0, 'qda_tol': 3.714633598028319e-06}. Best is trial 15 with value: 0.708021.
Trial 8 finished with value: 0.6969634103200527 and parameters: {'qda_reg_param': 0.8, 'qda_tol': 9.437615817597341e-05}. Best is trial 15 with value: 0.708021.
