Trial 23 finished with value: 0.99048372306065 and parameters: {'etsc_n_estimators': 70, 'etsc_criterion': 'gini', 'etsc_min_samples_split': 48, 'etsc_min_samples_leaf': 31, 'etsc_max_features': 7, 'etsc_bootstrap': False}. Best is trial 3 with value: 0.995146.
Trial 27 finished with value: 0.9954522209938372 and parameters: {'etsc_n_estimators': 70, 'etsc_criterion': 'entropy', 'etsc_min_samples_split': 19, 'etsc_min_samples_leaf': 6, 'etsc_max_features': 6, 'etsc_bootstrap': False}. Best is trial 27 with value: 0.995452.
Trial 28 finished with value: 0.9954522209938372 and parameters: {'etsc_n_estimators': 70, 'etsc_criterion': 'entropy', 'etsc_min_samples_split': 19, 'etsc_min_samples_leaf': 6, 'etsc_max_features': 6, 'etsc_bootstrap': False}. Best is trial 28 with value: 0.995452.
Trial 29 finished with value: 0.9949682564173628 and parameters: {'etsc_n_estimators': 70, 'etsc_criterion': 'entropy', 'etsc_min_samples_split': 21, 'etsc_min_samples_leaf': 6, 'etsc_max_features': 6, 'etsc_bootstrap': False}. Best is trial 27 with value: 0.995452.
Trial 25 finished with value: 0.9998134891193065 and parameters: {'etsc_n_estimators': 70, 'etsc_criterion': 'entropy', 'etsc_min_samples_split': 20, 'etsc_min_samples_leaf': 2, 'etsc_max_features': 6, 'etsc_bootstrap': False}. Best is trial 25 with value: 0.999813.
Trial 26 finished with value: 0.9998134891193065 and parameters: {'etsc_n_estimators': 70, 'etsc_criterion': 'entropy', 'etsc_min_samples_split': 20, 'etsc_min_samples_leaf': 2, 'etsc_max_features': 6, 'etsc_bootstrap': False}. Best is trial 25 with value: 0.999813.
Trial 24 finished with value: 0.9999527694645945 and parameters: {'etsc_n_estimators': 70, 'etsc_criterion': 'entropy', 'etsc_min_samples_split': 23, 'etsc_min_samples_leaf': 1, 'etsc_max_features': 6, 'etsc_bootstrap': False}. Best is trial 24 with value: 0.999953.
A new study created in RDB with name: GaussianNB_f33849d8
Trial 2 finished with value: 0.05163488645862473 and parameters: {'gnb_var_smoothing': 2.8591733627631975e-09}. Best is trial 1 with value: 0.695074.
Trial 0 finished with value: 0.05163488645862473 and parameters: {'gnb_var_smoothing': 4.599754290794263e-07}. Best is trial 1 with value: 0.695074.
Trial 1 finished with value: 0.6950742018218817 and parameters: {'gnb_var_smoothing': 0.30956099382914365}. Best is trial 1 with value: 0.695074.
Trial 6 finished with value: 0.05163488645862473 and parameters: {'gnb_var_smoothing': 2.2291300288288603e-06}. Best is trial 1 with value: 0.695074.
Trial 7 finished with value: 0.05163488645862473 and parameters: {'gnb_var_smoothing': 1.5210146240865658e-11}. Best is trial 1 with value: 0.695074.
Trial 4 finished with value: 0.05163488645862473 and parameters: {'gnb_var_smoothing': 0.0007758005922243773}. Best is trial 1 with value: 0.695074.
Trial 5 finished with value: 0.05163488645862473 and parameters: {'gnb_var_smoothing': 1.7969549144790532e-10}. Best is trial 1 with value: 0.695074.
Trial 3 finished with value: 0.05163488645862473 and parameters: {'gnb_var_smoothing': 3.620293143600355e-11}. Best is trial 1 with value: 0.695074.
Trial 10 finished with value: 0.05163488645862473 and parameters: {'gnb_var_smoothing': 4.1371882616598553e-07}. Best is trial 1 with value: 0.695074.
Trial 11 finished with value: 0.6950742018218817 and parameters: {'gnb_var_smoothing': 0.6209970735628524}. Best is trial 1 with value: 0.695074.
Trial 9 finished with value: 0.05163488645862473 and parameters: {'gnb_var_smoothing': 1.510345217148445e-11}. Best is trial 1 with value: 0.695074.
Trial 15 finished with value: 0.05163488645862473 and parameters: {'gnb_var_smoothing': 4.302475968333182e-08}. Best is trial 1 with value: 0.695074.
Trial 8 finished with value: 0.05163488645862473 and parameters: {'gnb_var_smoothing': 1.6405026046398029e-12}. Best is trial 1 with value: 0.695074.
Trial 14 finished with value: 0.05163488645862473 and parameters: {'gnb_var_smoothing': 3.661083986879575e-12}. Best is trial 1 with value: 0.695074.
Trial 13 finished with value: 0.05163488645862473 and parameters: {'gnb_var_smoothing': 1.3072427889874765e-06}. Best is trial 1 with value: 0.695074.
Trial 12 finished with value: 0.05163488645862473 and parameters: {'gnb_var_smoothing': 2.892914925468383e-05}. Best is trial 1 with value: 0.695074.
Trial 17 finished with value: 0.6950742018218817 and parameters: {'gnb_var_smoothing': 13.168381431678561}. Best is trial 23 with value: 0.695074.
Trial 22 finished with value: 0.6950742018218817 and parameters: {'gnb_var_smoothing': 30.5789734422574}. Best is trial 23 with value: 0.695074.
Trial 18 finished with value: 0.6950742018218817 and parameters: {'gnb_var_smoothing': 20.235113586107566}. Best is trial 23 with value: 0.695074.
Trial 16 finished with value: 0.6950742018218817 and parameters: {'gnb_var_smoothing': 17.533318773627165}. Best is trial 23 with value: 0.695074.
Trial 23 finished with value: 0.6950742018218817 and parameters: {'gnb_var_smoothing': 18.68391060889534}. Best is trial 23 with value: 0.695074.
Trial 20 finished with value: 0.6950742018218817 and parameters: {'gnb_var_smoothing': 2.388244600010662}. Best is trial 23 with value: 0.695074.
Trial 19 finished with value: 0.6950742018218817 and parameters: {'gnb_var_smoothing': 17.14357551990753}. Best is trial 23 with value: 0.695074.
Trial 21 finished with value: 0.6950742018218817 and parameters: {'gnb_var_smoothing': 18.12004525639185}. Best is trial 23 with value: 0.695074.
Trial 24 finished with value: 0.6950742018218817 and parameters: {'gnb_var_smoothing': 0.06005531847399431}. Best is trial 24 with value: 0.695074.
Trial 30 finished with value: 0.6950742018218817 and parameters: {'gnb_var_smoothing': 0.048221179623376}. Best is trial 31 with value: 0.695074.
Trial 25 finished with value: 0.6950742018218817 and parameters: {'gnb_var_smoothing': 0.05842798640808586}. Best is trial 31 with value: 0.695074.
Trial 26 finished with value: 0.6950742018218817 and parameters: {'gnb_var_smoothing': 0.05767712378091159}. Best is trial 31 with value: 0.695074.
Trial 31 finished with value: 0.6950742018218817 and parameters: {'gnb_var_smoothing': 967.2975007945306}. Best is trial 31 with value: 0.695074.
Trial 28 finished with value: 0.6950742018218817 and parameters: {'gnb_var_smoothing': 0.058340390138532254}. Best is trial 31 with value: 0.695074.
Trial 29 finished with value: 0.6950742018218817 and parameters: {'gnb_var_smoothing': 0.02509012067716676}. Best is trial 31 with value: 0.695074.
Trial 27 finished with value: 0.6950742018218817 and parameters: {'gnb_var_smoothing': 0.04509098127432752}. Best is trial 31 with value: 0.695074.
Trial 32 finished with value: 0.6950742018218817 and parameters: {'gnb_var_smoothing': 565.8304721214556}. Best is trial 32 with value: 0.695074.
A new study created in RDB with name: HistGradientBoostingClassifier_f33849d8
Trial 4 finished with value: 0.8622168061533511 and parameters: {'hgbc_learning_rate': 0.8995368415354827, 'hgbc_max_iter': 2000, 'hgbc_min_samples_leaf': 25, 'hgbc_l2_regularization': 0.6000000000000001, 'hgbc_max_bins': 255, 'hgbc_early_stopping': True, 'hgbc_validation_fraction': 0.25, 'hgbc_n_iter_no_change': 10}. Best is trial 4 with value: 0.862217.
Trial 0 finished with value: 0.7639922069010621 and parameters: {'hgbc_learning_rate': 0.8028425361748269, 'hgbc_max_iter': 2000, 'hgbc_min_samples_leaf': 48, 'hgbc_l2_regularization': 1.0, 'hgbc_max_bins': 255, 'hgbc_early_stopping': True, 'hgbc_validation_fraction': 0.25, 'hgbc_n_iter_no_change': 10}. Best is trial 4 with value: 0.862217.
Trial 7 finished with value: 0.8252195466394784 and parameters: {'hgbc_learning_rate': 0.7637947256692795, 'hgbc_max_iter': 2000, 'hgbc_min_samples_leaf': 40, 'hgbc_l2_regularization': 0.2, 'hgbc_max_bins': 127, 'hgbc_early_stopping': True, 'hgbc_validation_fraction': 0.25, 'hgbc_n_iter_no_change': 10}. Best is trial 4 with value: 0.862217.
Trial 2 finished with value: 0.9950870006987779 and parameters: {'hgbc_learning_rate': 0.12510761621603664, 'hgbc_max_iter': 2000, 'hgbc_min_samples_leaf': 24, 'hgbc_l2_regularization': 0.8, 'hgbc_max_bins': 255, 'hgbc_early_stopping': True, 'hgbc_validation_fraction': 0.25, 'hgbc_n_iter_no_change': 10}. Best is trial 2 with value: 0.995087.
Trial 5 finished with value: 0.9949599148336752 and parameters: {'hgbc_learning_rate': 0.08832149495434838, 'hgbc_max_iter': 2000, 'hgbc_min_samples_leaf': 18, 'hgbc_l2_regularization': 0.2, 'hgbc_max_bins': 127, 'hgbc_early_stopping': True, 'hgbc_validation_fraction': 0.25, 'hgbc_n_iter_no_change': 10}. Best is trial 2 with value: 0.995087.
Trial 3 finished with value: 0.996389748003282 and parameters: {'hgbc_learning_rate': 0.0625895597542008, 'hgbc_max_iter': 2000, 'hgbc_min_samples_leaf': 11, 'hgbc_l2_regularization': 0.8, 'hgbc_max_bins': 255, 'hgbc_early_stopping': True, 'hgbc_validation_fraction': 0.25, 'hgbc_n_iter_no_change': 10}. Best is trial 3 with value: 0.99639.
Trial 10 finished with value: 0.9963922470542553 and parameters: {'hgbc_learning_rate': 0.05858330529405961, 'hgbc_max_iter': 2000, 'hgbc_min_samples_leaf': 19, 'hgbc_l2_regularization': 1.0, 'hgbc_max_bins': 255, 'hgbc_early_stopping': True, 'hgbc_validation_fraction': 0.25, 'hgbc_n_iter_no_change': 10}. Best is trial 10 with value: 0.996392.
Trial 14 finished with value: 0.9792467134377648 and parameters: {'hgbc_learning_rate': 0.1347261513539677, 'hgbc_max_iter': 2000, 'hgbc_min_samples_leaf': 46, 'hgbc_l2_regularization': 0.6000000000000001, 'hgbc_max_bins': 127, 'hgbc_early_stopping': True, 'hgbc_validation_fraction': 0.25, 'hgbc_n_iter_no_change': 10}. Best is trial 10 with value: 0.996392.
Trial 13 finished with value: 0.9963921982279521 and parameters: {'hgbc_learning_rate': 0.033476623352918296, 'hgbc_max_iter': 2000, 'hgbc_min_samples_leaf': 16, 'hgbc_l2_regularization': 0.8, 'hgbc_max_bins': 255, 'hgbc_early_stopping': True, 'hgbc_validation_fraction': 0.25, 'hgbc_n_iter_no_change': 10}. Best is trial 10 with value: 0.996392.
Trial 12 finished with value: 0.9963847123906974 and parameters: {'hgbc_learning_rate': 0.009774263635426623, 'hgbc_max_iter': 2000, 'hgbc_min_samples_leaf': 11, 'hgbc_l2_regularization': 0.6000000000000001, 'hgbc_max_bins': 255, 'hgbc_early_stopping': True, 'hgbc_validation_fraction': 0.25, 'hgbc_n_iter_no_change': 10}. Best is trial 10 with value: 0.996392.
Trial 8 finished with value: 0.9953095992144377 and parameters: {'hgbc_learning_rate': 0.001731580315334102, 'hgbc_max_iter': 2000, 'hgbc_min_samples_leaf': 21, 'hgbc_l2_regularization': 1.0, 'hgbc_max_bins': 127, 'hgbc_early_stopping': True, 'hgbc_validation_fraction': 0.25, 'hgbc_n_iter_no_change': 10}. Best is trial 10 with value: 0.996392.
Trial 1 finished with value: 0.9954345583181141 and parameters: {'hgbc_learning_rate': 0.005185033254134184, 'hgbc_max_iter': 2000, 'hgbc_min_samples_leaf': 37, 'hgbc_l2_regularization': 0.4, 'hgbc_max_bins': 127, 'hgbc_early_stopping': True, 'hgbc_validation_fraction': 0.25, 'hgbc_n_iter_no_change': 10}. Best is trial 10 with value: 0.996392.
Trial 11 finished with value: 0.9832104642546 and parameters: {'hgbc_learning_rate': 0.001296166088378061, 'hgbc_max_iter': 2000, 'hgbc_min_samples_leaf': 30, 'hgbc_l2_regularization': 0.4, 'hgbc_max_bins': 63, 'hgbc_early_stopping': True, 'hgbc_validation_fraction': 0.25, 'hgbc_n_iter_no_change': 10}. Best is trial 10 with value: 0.996392.
Trial 9 finished with value: 0.9953473863762444 and parameters: {'hgbc_learning_rate': 0.002119042642075278, 'hgbc_max_iter': 2000, 'hgbc_min_samples_leaf': 20, 'hgbc_l2_regularization': 1.0, 'hgbc_max_bins': 127, 'hgbc_early_stopping': True, 'hgbc_validation_fraction': 0.25, 'hgbc_n_iter_no_change': 10}. Best is trial 10 with value: 0.996392.
Trial 6 finished with value: 0.9954171976031881 and parameters: {'hgbc_learning_rate': 0.0037618381576741437, 'hgbc_max_iter': 2000, 'hgbc_min_samples_leaf': 6, 'hgbc_l2_regularization': 0.6000000000000001, 'hgbc_max_bins': 127, 'hgbc_early_stopping': True, 'hgbc_validation_fraction': 0.25, 'hgbc_n_iter_no_change': 10}. Best is trial 10 with value: 0.996392.
Trial 15 finished with value: 0.9961590564749649 and parameters: {'hgbc_learning_rate': 0.0010832225584833655, 'hgbc_max_iter': 2000, 'hgbc_min_samples_leaf': 12, 'hgbc_l2_regularization': 0.6000000000000001, 'hgbc_max_bins': 255, 'hgbc_early_stopping': True, 'hgbc_validation_fraction': 0.25, 'hgbc_n_iter_no_change': 10}. Best is trial 10 with value: 0.996392.
Trial 16 finished with value: 0.996279517767621 and parameters: {'hgbc_learning_rate': 0.0015005032717276502, 'hgbc_max_iter': 2000, 'hgbc_min_samples_leaf': 9, 'hgbc_l2_regularization': 0.2, 'hgbc_max_bins': 255, 'hgbc_early_stopping': True, 'hgbc_validation_fraction': 0.25, 'hgbc_n_iter_no_change': 10}. Best is trial 10 with value: 0.996392.
Trial 19 finished with value: 0.9835176838258024 and parameters: {'hgbc_learning_rate': 0.02137908676643429, 'hgbc_max_iter': 2000, 'hgbc_min_samples_leaf': 1, 'hgbc_l2_regularization': 1.0, 'hgbc_max_bins': 63, 'hgbc_early_stopping': True, 'hgbc_validation_fraction': 0.25, 'hgbc_n_iter_no_change': 10}. Best is trial 10 with value: 0.996392.
Trial 20 finished with value: 0.983520023952117 and parameters: {'hgbc_learning_rate': 0.02048827166208538, 'hgbc_max_iter': 2000, 'hgbc_min_samples_leaf': 1, 'hgbc_l2_regularization': 0.8, 'hgbc_max_bins': 63, 'hgbc_early_stopping': True, 'hgbc_validation_fraction': 0.25, 'hgbc_n_iter_no_change': 10}. Best is trial 10 with value: 0.996392.
Trial 22 finished with value: 0.9835176838258024 and parameters: {'hgbc_learning_rate': 0.02033097375710261, 'hgbc_max_iter': 2000, 'hgbc_min_samples_leaf': 2, 'hgbc_l2_regularization': 0.8, 'hgbc_max_bins': 63, 'hgbc_early_stopping': True, 'hgbc_validation_fraction': 0.25, 'hgbc_n_iter_no_change': 10}. Best is trial 10 with value: 0.996392.
Trial 21 finished with value: 0.9835151559755414 and parameters: {'hgbc_learning_rate': 0.017272534493971557, 'hgbc_max_iter': 2000, 'hgbc_min_samples_leaf': 1, 'hgbc_l2_regularization': 0.8, 'hgbc_max_bins': 63, 'hgbc_early_stopping': True, 'hgbc_validation_fraction': 0.25, 'hgbc_n_iter_no_change': 10}. Best is trial 10 with value: 0.996392.
Trial 23 finished with value: 0.9835201663480572 and parameters: {'hgbc_learning_rate': 0.021946235394277456, 'hgbc_max_iter': 2000, 'hgbc_min_samples_leaf': 3, 'hgbc_l2_regularization': 0.8, 'hgbc_max_bins': 63, 'hgbc_early_stopping': True, 'hgbc_validation_fraction': 0.25, 'hgbc_n_iter_no_change': 10}. Best is trial 10 with value: 0.996392.
Trial 18 finished with value: 0.9835199786563502 and parameters: {'hgbc_learning_rate': 0.012799024959774042, 'hgbc_max_iter': 2000, 'hgbc_min_samples_leaf': 4, 'hgbc_l2_regularization': 1.0, 'hgbc_max_bins': 63, 'hgbc_early_stopping': True, 'hgbc_validation_fraction': 0.25, 'hgbc_n_iter_no_change': 10}. Best is trial 10 with value: 0.996392.
Trial 24 finished with value: 0.9835273490417962 and parameters: {'hgbc_learning_rate': 0.02156935252218045, 'hgbc_max_iter': 2000, 'hgbc_min_samples_leaf': 31, 'hgbc_l2_regularization': 0.8, 'hgbc_max_bins': 63, 'hgbc_early_stopping': True, 'hgbc_validation_fraction': 0.25, 'hgbc_n_iter_no_change': 10}. Best is trial 10 with value: 0.996392.
Trial 17 finished with value: 0.9833032240409845 and parameters: {'hgbc_learning_rate': 0.0012547333433375475, 'hgbc_max_iter': 2000, 'hgbc_min_samples_leaf': 1, 'hgbc_l2_regularization': 0.0, 'hgbc_max_bins': 63, 'hgbc_early_stopping': True, 'hgbc_validation_fraction': 0.25, 'hgbc_n_iter_no_change': 10}. Best is trial 10 with value: 0.996392.
A new study created in RDB with name: LGBMClassifier_f33849d8
Trial 2 finished with value: 0.6950742018218817 and parameters: {'lgbm_num_leaves': 7, 'lgbm_learning_rate': 5.2190371471737905e-05, 'lgbm_n_estimators': 50, 'lgbm_reg_alpha': 0.8500000000000001, 'lgbm_reg_lambda': 0.1}. Best is trial 2 with value: 0.695074.
Trial 4 finished with value: 0.7046032976505441 and parameters: {'lgbm_num_leaves': 7, 'lgbm_learning_rate': 0.21719384145592413, 'lgbm_n_estimators': 60, 'lgbm_reg_alpha': 0.75, 'lgbm_reg_lambda': 0.1}. Best is trial 4 with value: 0.704603.
Trial 9 finished with value: 0.6950742018218817 and parameters: {'lgbm_num_leaves': 63, 'lgbm_learning_rate': 4.567277223371052e-06, 'lgbm_n_estimators': 20, 'lgbm_reg_alpha': 0.75, 'lgbm_reg_lambda': 0.30000000000000004}. Best is trial 4 with value: 0.704603.
Trial 3 finished with value: 0.6950742018218817 and parameters: {'lgbm_num_leaves': 31, 'lgbm_learning_rate': 0.002082573406388105, 'lgbm_n_estimators': 130, 'lgbm_reg_alpha': 0.9500000000000001, 'lgbm_reg_lambda': 0.7000000000000001}. Best is trial 4 with value: 0.704603.
Trial 7 finished with value: 0.896212588784694 and parameters: {'lgbm_num_leaves': 7, 'lgbm_learning_rate': 0.002653097461982434, 'lgbm_n_estimators': 160, 'lgbm_reg_alpha': 0.35000000000000003, 'lgbm_reg_lambda': 1.0}. Best is trial 7 with value: 0.896213.
Trial 5 finished with value: 0.6950742018218817 and parameters: {'lgbm_num_leaves': 127, 'lgbm_learning_rate': 2.0962862018329485e-06, 'lgbm_n_estimators': 120, 'lgbm_reg_alpha': 0.75, 'lgbm_reg_lambda': 0.35000000000000003}. Best is trial 7 with value: 0.896213.
Trial 0 finished with value: 0.6950742018218817 and parameters: {'lgbm_num_leaves': 15, 'lgbm_learning_rate': 2.7266497771583456e-05, 'lgbm_n_estimators': 150, 'lgbm_reg_alpha': 0.15000000000000002, 'lgbm_reg_lambda': 0.45}. Best is trial 7 with value: 0.896213.
Trial 1 finished with value: 0.7450653530880729 and parameters: {'lgbm_num_leaves': 15, 'lgbm_learning_rate': 0.4317870595006214, 'lgbm_n_estimators': 170, 'lgbm_reg_alpha': 0.5, 'lgbm_reg_lambda': 0.8500000000000001}. Best is trial 7 with value: 0.896213.
Trial 6 finished with value: 0.8008579099832996 and parameters: {'lgbm_num_leaves': 7, 'lgbm_learning_rate': 0.6585029553273943, 'lgbm_n_estimators': 180, 'lgbm_reg_alpha': 0.65, 'lgbm_reg_lambda': 1.0}. Best is trial 7 with value: 0.896213.
Trial 16 finished with value: 0.6950742018218817 and parameters: {'lgbm_num_leaves': 31, 'lgbm_learning_rate': 0.0001872292809722242, 'lgbm_n_estimators': 20, 'lgbm_reg_alpha': 0.25, 'lgbm_reg_lambda': 0.15000000000000002}. Best is trial 7 with value: 0.896213.
Trial 8 finished with value: 0.9976080672808695 and parameters: {'lgbm_num_leaves': 127, 'lgbm_learning_rate': 0.0024288704872747185, 'lgbm_n_estimators': 180, 'lgbm_reg_alpha': 0.65, 'lgbm_reg_lambda': 0.9500000000000001}. Best is trial 8 with value: 0.997608.
Trial 12 finished with value: 0.6950742018218817 and parameters: {'lgbm_num_leaves': 7, 'lgbm_learning_rate': 1.6007061969092727e-05, 'lgbm_n_estimators': 140, 'lgbm_reg_alpha': 0.6000000000000001, 'lgbm_reg_lambda': 0.8500000000000001}. Best is trial 8 with value: 0.997608.
Trial 13 finished with value: 0.6950742018218817 and parameters: {'lgbm_num_leaves': 15, 'lgbm_learning_rate': 0.001964937253614376, 'lgbm_n_estimators': 140, 'lgbm_reg_alpha': 0.45, 'lgbm_reg_lambda': 0.6000000000000001}. Best is trial 8 with value: 0.997608.
Trial 10 finished with value: 0.9720676324327967 and parameters: {'lgbm_num_leaves': 15, 'lgbm_learning_rate': 0.0023915656523418503, 'lgbm_n_estimators': 200, 'lgbm_reg_alpha': 0.8, 'lgbm_reg_lambda': 0.15000000000000002}. Best is trial 8 with value: 0.997608.
Trial 15 finished with value: 0.6950742018218817 and parameters: {'lgbm_num_leaves': 7, 'lgbm_learning_rate': 7.448762268129914e-05, 'lgbm_n_estimators': 90, 'lgbm_reg_alpha': 1.0, 'lgbm_reg_lambda': 0.7000000000000001}. Best is trial 8 with value: 0.997608.
Trial 11 finished with value: 0.9998161449916471 and parameters: {'lgbm_num_leaves': 63, 'lgbm_learning_rate': 0.019804193942761218, 'lgbm_n_estimators': 140, 'lgbm_reg_alpha': 0.15000000000000002, 'lgbm_reg_lambda': 0.4}. Best is trial 11 with value: 0.999816.
Trial 14 finished with value: 0.6950742018218817 and parameters: {'lgbm_num_leaves': 15, 'lgbm_learning_rate': 0.0012099535542199015, 'lgbm_n_estimators': 200, 'lgbm_reg_alpha': 0.1, 'lgbm_reg_lambda': 0.2}. Best is trial 11 with value: 0.999816.
Trial 24 finished with value: 0.9998657855782046 and parameters: {'lgbm_num_leaves': 63, 'lgbm_learning_rate': 0.0330469428072417, 'lgbm_n_estimators': 110, 'lgbm_reg_alpha': 0.0, 'lgbm_reg_lambda': 0.5}. Best is trial 24 with value: 0.999866.
Trial 18 finished with value: 0.9996047013991135 and parameters: {'lgbm_num_leaves': 127, 'lgbm_learning_rate': 0.005335474905671182, 'lgbm_n_estimators': 200, 'lgbm_reg_alpha': 0.35000000000000003, 'lgbm_reg_lambda': 1.0}. Best is trial 24 with value: 0.999866.
Trial 17 finished with value: 0.9998682685489967 and parameters: {'lgbm_num_leaves': 127, 'lgbm_learning_rate': 0.01453261903965362, 'lgbm_n_estimators': 200, 'lgbm_reg_alpha': 0.0, 'lgbm_reg_lambda': 0.65}. Best is trial 17 with value: 0.999868.
Trial 19 finished with value: 0.9998384553194322 and parameters: {'lgbm_num_leaves': 127, 'lgbm_learning_rate': 0.014576709149742335, 'lgbm_n_estimators': 200, 'lgbm_reg_alpha': 0.35000000000000003, 'lgbm_reg_lambda': 1.0}. Best is trial 17 with value: 0.999868.
Trial 20 finished with value: 0.9998012360343086 and parameters: {'lgbm_num_leaves': 127, 'lgbm_learning_rate': 0.009255282805003808, 'lgbm_n_estimators': 200, 'lgbm_reg_alpha': 0.35000000000000003, 'lgbm_reg_lambda': 1.0}. Best is trial 17 with value: 0.999868.
Trial 21 finished with value: 0.9998807065084019 and parameters: {'lgbm_num_leaves': 127, 'lgbm_learning_rate': 0.022487267422033712, 'lgbm_n_estimators': 200, 'lgbm_reg_alpha': 0.9500000000000001, 'lgbm_reg_lambda': 0.25}. Best is trial 21 with value: 0.999881.
Trial 23 finished with value: 0.9998956150150532 and parameters: {'lgbm_num_leaves': 127, 'lgbm_learning_rate': 0.031588185081683505, 'lgbm_n_estimators': 200, 'lgbm_reg_alpha': 0.05, 'lgbm_reg_lambda': 0.5}. Best is trial 23 with value: 0.999896.
