Trial 16 finished with value: 0.08553430843786972 and parameters: {'compnb_alpha': 0.1, 'compnb_fit_prior': True, 'compnb_norm': True}. Best is trial 0 with value: 0.0855343.
Trial 19 finished with value: 0.08553430843786972 and parameters: {'compnb_alpha': 0.15000000000000002, 'compnb_fit_prior': True, 'compnb_norm': True}. Best is trial 0 with value: 0.0855343.
Trial 23 finished with value: 0.08553430843786972 and parameters: {'compnb_alpha': 0.1, 'compnb_fit_prior': True, 'compnb_norm': True}. Best is trial 0 with value: 0.0855343.
Trial 20 finished with value: 0.08553430843786972 and parameters: {'compnb_alpha': 0.05, 'compnb_fit_prior': True, 'compnb_norm': True}. Best is trial 0 with value: 0.0855343.
Trial 28 finished with value: 0.08553430843786972 and parameters: {'compnb_alpha': 0.0, 'compnb_fit_prior': True, 'compnb_norm': True}. Best is trial 0 with value: 0.0855343.
Trial 26 finished with value: 0.08553430843786972 and parameters: {'compnb_alpha': 0.0, 'compnb_fit_prior': True, 'compnb_norm': True}. Best is trial 0 with value: 0.0855343.
Trial 24 finished with value: 0.08553430843786972 and parameters: {'compnb_alpha': 0.0, 'compnb_fit_prior': True, 'compnb_norm': True}. Best is trial 0 with value: 0.0855343.
Trial 30 finished with value: 0.08553430843786972 and parameters: {'compnb_alpha': 0.25, 'compnb_fit_prior': True, 'compnb_norm': True}. Best is trial 0 with value: 0.0855343.
Trial 29 finished with value: 0.08553430843786972 and parameters: {'compnb_alpha': 0.0, 'compnb_fit_prior': True, 'compnb_norm': True}. Best is trial 0 with value: 0.0855343.
Trial 27 finished with value: 0.08553430843786972 and parameters: {'compnb_alpha': 0.0, 'compnb_fit_prior': True, 'compnb_norm': True}. Best is trial 0 with value: 0.0855343.
Trial 25 finished with value: 0.08553430843786972 and parameters: {'compnb_alpha': 0.0, 'compnb_fit_prior': True, 'compnb_norm': True}. Best is trial 0 with value: 0.0855343.
Trial 31 finished with value: 0.08553430843786972 and parameters: {'compnb_alpha': 0.25, 'compnb_fit_prior': True, 'compnb_norm': True}. Best is trial 0 with value: 0.0855343.
Trial 34 finished with value: 0.08231845847806078 and parameters: {'compnb_alpha': 0.2, 'compnb_fit_prior': True, 'compnb_norm': False}. Best is trial 0 with value: 0.0855343.
Trial 32 finished with value: 0.08231845847806078 and parameters: {'compnb_alpha': 0.2, 'compnb_fit_prior': True, 'compnb_norm': False}. Best is trial 0 with value: 0.0855343.
Trial 33 finished with value: 0.08231845847806078 and parameters: {'compnb_alpha': 0.2, 'compnb_fit_prior': True, 'compnb_norm': False}. Best is trial 0 with value: 0.0855343.
A new study created in RDB with name: DecisionTreeClassifier_f33849d8
Trial 1 finished with value: 0.6950742018218817 and parameters: {'dtc_criterion': 'entropy', 'dtc_splitter': 'random', 'dtc_min_samples_split': 44, 'dtc_min_samples_leaf': 37, 'dtc_max_features': 1}. Best is trial 1 with value: 0.695074.
Trial 2 finished with value: 0.6950742018218817 and parameters: {'dtc_criterion': 'gini', 'dtc_splitter': 'random', 'dtc_min_samples_split': 32, 'dtc_min_samples_leaf': 25, 'dtc_max_features': 3}. Best is trial 1 with value: 0.695074.
Trial 5 finished with value: 0.6950742018218817 and parameters: {'dtc_criterion': 'entropy', 'dtc_splitter': 'random', 'dtc_min_samples_split': 6, 'dtc_min_samples_leaf': 43, 'dtc_max_features': 2}. Best is trial 1 with value: 0.695074.
Trial 0 finished with value: 0.752787221144879 and parameters: {'dtc_criterion': 'gini', 'dtc_splitter': 'random', 'dtc_min_samples_split': 49, 'dtc_min_samples_leaf': 7, 'dtc_max_features': 5}. Best is trial 0 with value: 0.752787.
Trial 3 finished with value: 0.8752193459748737 and parameters: {'dtc_criterion': 'gini', 'dtc_splitter': 'random', 'dtc_min_samples_split': 32, 'dtc_min_samples_leaf': 49, 'dtc_max_features': 5}. Best is trial 3 with value: 0.875219.
Trial 6 finished with value: 0.9997067851532363 and parameters: {'dtc_criterion': 'entropy', 'dtc_splitter': 'best', 'dtc_min_samples_split': 43, 'dtc_min_samples_leaf': 1, 'dtc_max_features': 1}. Best is trial 6 with value: 0.999707.
Trial 11 finished with value: 0.6950742018218817 and parameters: {'dtc_criterion': 'gini', 'dtc_splitter': 'random', 'dtc_min_samples_split': 44, 'dtc_min_samples_leaf': 30, 'dtc_max_features': 2}. Best is trial 6 with value: 0.999707.
Trial 12 finished with value: 0.6950742018218817 and parameters: {'dtc_criterion': 'gini', 'dtc_splitter': 'random', 'dtc_min_samples_split': 48, 'dtc_min_samples_leaf': 10, 'dtc_max_features': 4}. Best is trial 6 with value: 0.999707.
Trial 9 finished with value: 0.8730078785716602 and parameters: {'dtc_criterion': 'gini', 'dtc_splitter': 'random', 'dtc_min_samples_split': 45, 'dtc_min_samples_leaf': 38, 'dtc_max_features': 5}. Best is trial 6 with value: 0.999707.
Trial 7 finished with value: 0.9996819153781272 and parameters: {'dtc_criterion': 'gini', 'dtc_splitter': 'best', 'dtc_min_samples_split': 49, 'dtc_min_samples_leaf': 21, 'dtc_max_features': 7}. Best is trial 6 with value: 0.999707.
Trial 4 finished with value: 0.9994359921540928 and parameters: {'dtc_criterion': 'gini', 'dtc_splitter': 'best', 'dtc_min_samples_split': 13, 'dtc_min_samples_leaf': 45, 'dtc_max_features': 7}. Best is trial 6 with value: 0.999707.
Trial 8 finished with value: 0.9935260935970539 and parameters: {'dtc_criterion': 'entropy', 'dtc_splitter': 'best', 'dtc_min_samples_split': 14, 'dtc_min_samples_leaf': 43, 'dtc_max_features': 2}. Best is trial 6 with value: 0.999707.
Trial 10 finished with value: 0.9378325244670056 and parameters: {'dtc_criterion': 'entropy', 'dtc_splitter': 'random', 'dtc_min_samples_split': 42, 'dtc_min_samples_leaf': 39, 'dtc_max_features': 6}. Best is trial 6 with value: 0.999707.
Trial 14 finished with value: 0.6950742018218817 and parameters: {'dtc_criterion': 'entropy', 'dtc_splitter': 'random', 'dtc_min_samples_split': 37, 'dtc_min_samples_leaf': 15, 'dtc_max_features': 2}. Best is trial 6 with value: 0.999707.
Trial 15 finished with value: 0.6950742018218817 and parameters: {'dtc_criterion': 'gini', 'dtc_splitter': 'random', 'dtc_min_samples_split': 34, 'dtc_min_samples_leaf': 45, 'dtc_max_features': 2}. Best is trial 6 with value: 0.999707.
Trial 13 finished with value: 0.9863438056269576 and parameters: {'dtc_criterion': 'entropy', 'dtc_splitter': 'best', 'dtc_min_samples_split': 7, 'dtc_min_samples_leaf': 25, 'dtc_max_features': 2}. Best is trial 6 with value: 0.999707.
Trial 16 finished with value: 0.9995132298212063 and parameters: {'dtc_criterion': 'entropy', 'dtc_splitter': 'best', 'dtc_min_samples_split': 30, 'dtc_min_samples_leaf': 43, 'dtc_max_features': 5}. Best is trial 6 with value: 0.999707.
Trial 17 finished with value: 0.9999130508697186 and parameters: {'dtc_criterion': 'entropy', 'dtc_splitter': 'best', 'dtc_min_samples_split': 35, 'dtc_min_samples_leaf': 1, 'dtc_max_features': 7}. Best is trial 17 with value: 0.999913.
Trial 18 finished with value: 0.9999130508697186 and parameters: {'dtc_criterion': 'entropy', 'dtc_splitter': 'best', 'dtc_min_samples_split': 35, 'dtc_min_samples_leaf': 1, 'dtc_max_features': 7}. Best is trial 17 with value: 0.999913.
Trial 19 finished with value: 0.9998037611609233 and parameters: {'dtc_criterion': 'entropy', 'dtc_splitter': 'best', 'dtc_min_samples_split': 37, 'dtc_min_samples_leaf': 19, 'dtc_max_features': 7}. Best is trial 17 with value: 0.999913.
Trial 20 finished with value: 0.9998310810358568 and parameters: {'dtc_criterion': 'entropy', 'dtc_splitter': 'best', 'dtc_min_samples_split': 34, 'dtc_min_samples_leaf': 15, 'dtc_max_features': 7}. Best is trial 17 with value: 0.999913.
Trial 21 finished with value: 0.9999130092427563 and parameters: {'dtc_criterion': 'entropy', 'dtc_splitter': 'best', 'dtc_min_samples_split': 27, 'dtc_min_samples_leaf': 3, 'dtc_max_features': 7}. Best is trial 17 with value: 0.999913.
Trial 22 finished with value: 0.999920456133539 and parameters: {'dtc_criterion': 'entropy', 'dtc_splitter': 'best', 'dtc_min_samples_split': 23, 'dtc_min_samples_leaf': 1, 'dtc_max_features': 7}. Best is trial 22 with value: 0.99992.
Trial 23 finished with value: 0.9999204734516932 and parameters: {'dtc_criterion': 'entropy', 'dtc_splitter': 'best', 'dtc_min_samples_split': 24, 'dtc_min_samples_leaf': 1, 'dtc_max_features': 7}. Best is trial 23 with value: 0.99992.
Trial 24 finished with value: 0.999920456133539 and parameters: {'dtc_criterion': 'entropy', 'dtc_splitter': 'best', 'dtc_min_samples_split': 23, 'dtc_min_samples_leaf': 1, 'dtc_max_features': 7}. Best is trial 23 with value: 0.99992.
A new study created in RDB with name: ExtraTreeClassifier_f33849d8
Trial 7 finished with value: 0.6950742018218817 and parameters: {'etc_criterion': 'entropy', 'etc_min_samples_split': 10, 'etc_min_samples_leaf': 41, 'etc_max_features': 2}. Best is trial 0 with value: 0.695074.
Trial 2 finished with value: 0.6950742018218817 and parameters: {'etc_criterion': 'gini', 'etc_min_samples_split': 33, 'etc_min_samples_leaf': 42, 'etc_max_features': 2}. Best is trial 0 with value: 0.695074.
Trial 1 finished with value: 0.6950742018218817 and parameters: {'etc_criterion': 'gini', 'etc_min_samples_split': 9, 'etc_min_samples_leaf': 4, 'etc_max_features': 3}. Best is trial 0 with value: 0.695074.
Trial 0 finished with value: 0.6950742018218817 and parameters: {'etc_criterion': 'entropy', 'etc_min_samples_split': 22, 'etc_min_samples_leaf': 28, 'etc_max_features': 3}. Best is trial 0 with value: 0.695074.
Trial 5 finished with value: 0.804409550459672 and parameters: {'etc_criterion': 'gini', 'etc_min_samples_split': 50, 'etc_min_samples_leaf': 18, 'etc_max_features': 5}. Best is trial 5 with value: 0.80441.
Trial 6 finished with value: 0.8568847207388457 and parameters: {'etc_criterion': 'gini', 'etc_min_samples_split': 43, 'etc_min_samples_leaf': 25, 'etc_max_features': 6}. Best is trial 6 with value: 0.856885.
Trial 3 finished with value: 0.9766866191020648 and parameters: {'etc_criterion': 'entropy', 'etc_min_samples_split': 24, 'etc_min_samples_leaf': 47, 'etc_max_features': 7}. Best is trial 3 with value: 0.976687.
Trial 4 finished with value: 0.9874050523684631 and parameters: {'etc_criterion': 'gini', 'etc_min_samples_split': 35, 'etc_min_samples_leaf': 9, 'etc_max_features': 6}. Best is trial 4 with value: 0.987405.
Trial 11 finished with value: 0.6950742018218817 and parameters: {'etc_criterion': 'entropy', 'etc_min_samples_split': 35, 'etc_min_samples_leaf': 41, 'etc_max_features': 2}. Best is trial 4 with value: 0.987405.
Trial 10 finished with value: 0.6950742018218817 and parameters: {'etc_criterion': 'gini', 'etc_min_samples_split': 13, 'etc_min_samples_leaf': 35, 'etc_max_features': 1}. Best is trial 4 with value: 0.987405.
Trial 8 finished with value: 0.6950742018218817 and parameters: {'etc_criterion': 'gini', 'etc_min_samples_split': 47, 'etc_min_samples_leaf': 14, 'etc_max_features': 1}. Best is trial 4 with value: 0.987405.
Trial 9 finished with value: 0.6950742018218817 and parameters: {'etc_criterion': 'gini', 'etc_min_samples_split': 30, 'etc_min_samples_leaf': 23, 'etc_max_features': 3}. Best is trial 4 with value: 0.987405.
Trial 12 finished with value: 0.6950742018218817 and parameters: {'etc_criterion': 'entropy', 'etc_min_samples_split': 48, 'etc_min_samples_leaf': 37, 'etc_max_features': 1}. Best is trial 4 with value: 0.987405.
Trial 13 finished with value: 0.6950742018218817 and parameters: {'etc_criterion': 'entropy', 'etc_min_samples_split': 47, 'etc_min_samples_leaf': 50, 'etc_max_features': 3}. Best is trial 4 with value: 0.987405.
Trial 14 finished with value: 0.6950742018218817 and parameters: {'etc_criterion': 'entropy', 'etc_min_samples_split': 15, 'etc_min_samples_leaf': 46, 'etc_max_features': 4}. Best is trial 4 with value: 0.987405.
Trial 15 finished with value: 0.6950742018218817 and parameters: {'etc_criterion': 'gini', 'etc_min_samples_split': 45, 'etc_min_samples_leaf': 6, 'etc_max_features': 2}. Best is trial 4 with value: 0.987405.
Trial 18 finished with value: 0.9736131673089681 and parameters: {'etc_criterion': 'entropy', 'etc_min_samples_split': 23, 'etc_min_samples_leaf': 48, 'etc_max_features': 7}. Best is trial 4 with value: 0.987405.
Trial 17 finished with value: 0.9735987973853312 and parameters: {'etc_criterion': 'entropy', 'etc_min_samples_split': 23, 'etc_min_samples_leaf': 50, 'etc_max_features': 7}. Best is trial 4 with value: 0.987405.
Trial 19 finished with value: 0.9736131673089681 and parameters: {'etc_criterion': 'entropy', 'etc_min_samples_split': 21, 'etc_min_samples_leaf': 48, 'etc_max_features': 7}. Best is trial 4 with value: 0.987405.
Trial 16 finished with value: 0.9735987973853312 and parameters: {'etc_criterion': 'entropy', 'etc_min_samples_split': 20, 'etc_min_samples_leaf': 50, 'etc_max_features': 7}. Best is trial 4 with value: 0.987405.
Trial 20 finished with value: 0.9998632872339245 and parameters: {'etc_criterion': 'entropy', 'etc_min_samples_split': 21, 'etc_min_samples_leaf': 1, 'etc_max_features': 7}. Best is trial 20 with value: 0.999863.
Trial 21 finished with value: 0.9996667898297272 and parameters: {'etc_criterion': 'entropy', 'etc_min_samples_split': 21, 'etc_min_samples_leaf': 2, 'etc_max_features': 7}. Best is trial 20 with value: 0.999863.
Trial 23 finished with value: 0.9889649126728255 and parameters: {'etc_criterion': 'entropy', 'etc_min_samples_split': 22, 'etc_min_samples_leaf': 11, 'etc_max_features': 7}. Best is trial 20 with value: 0.999863.
Trial 22 finished with value: 0.9889649126728255 and parameters: {'etc_criterion': 'entropy', 'etc_min_samples_split': 2, 'etc_min_samples_leaf': 11, 'etc_max_features': 7}. Best is trial 20 with value: 0.999863.
Trial 25 finished with value: 0.9884066339187716 and parameters: {'etc_criterion': 'gini', 'etc_min_samples_split': 2, 'etc_min_samples_leaf': 11, 'etc_max_features': 6}. Best is trial 20 with value: 0.999863.
Trial 26 finished with value: 0.98309237674314 and parameters: {'etc_criterion': 'gini', 'etc_min_samples_split': 39, 'etc_min_samples_leaf': 12, 'etc_max_features': 6}. Best is trial 20 with value: 0.999863.
Trial 24 finished with value: 0.951914956988778 and parameters: {'etc_criterion': 'gini', 'etc_min_samples_split': 2, 'etc_min_samples_leaf': 10, 'etc_max_features': 6}. Best is trial 20 with value: 0.999863.
Trial 27 finished with value: 0.9486112210358085 and parameters: {'etc_criterion': 'gini', 'etc_min_samples_split': 40, 'etc_min_samples_leaf': 11, 'etc_max_features': 6}. Best is trial 20 with value: 0.999863.
Trial 28 finished with value: 0.999940326686925 and parameters: {'etc_criterion': 'entropy', 'etc_min_samples_split': 4, 'etc_min_samples_leaf': 1, 'etc_max_features': 6}. Best is trial 28 with value: 0.99994.
Trial 31 finished with value: 0.9996395702662472 and parameters: {'etc_criterion': 'entropy', 'etc_min_samples_split': 31, 'etc_min_samples_leaf': 2, 'etc_max_features': 6}. Best is trial 28 with value: 0.99994.
Trial 30 finished with value: 0.9998185213207328 and parameters: {'etc_criterion': 'entropy', 'etc_min_samples_split': 29, 'etc_min_samples_leaf': 1, 'etc_max_features': 6}. Best is trial 28 with value: 0.99994.
Trial 29 finished with value: 0.9998781855675903 and parameters: {'etc_criterion': 'entropy', 'etc_min_samples_split': 18, 'etc_min_samples_leaf': 1, 'etc_max_features': 6}. Best is trial 28 with value: 0.99994.
Trial 32 finished with value: 0.9998086762245092 and parameters: {'etc_criterion': 'entropy', 'etc_min_samples_split': 28, 'etc_min_samples_leaf': 1, 'etc_max_features': 5}. Best is trial 28 with value: 0.99994.
A new study created in RDB with name: ExtraTreesClassifier_f33849d8
Trial 0 finished with value: 0.6950742018218817 and parameters: {'etsc_n_estimators': 120, 'etsc_criterion': 'entropy', 'etsc_min_samples_split': 11, 'etsc_min_samples_leaf': 11, 'etsc_max_features': 2, 'etsc_bootstrap': True}. Best is trial 0 with value: 0.695074.
Trial 5 finished with value: 0.6950742018218817 and parameters: {'etsc_n_estimators': 110, 'etsc_criterion': 'entropy', 'etsc_min_samples_split': 42, 'etsc_min_samples_leaf': 10, 'etsc_max_features': 3, 'etsc_bootstrap': False}. Best is trial 0 with value: 0.695074.
Trial 1 finished with value: 0.9531507457122734 and parameters: {'etsc_n_estimators': 50, 'etsc_criterion': 'gini', 'etsc_min_samples_split': 12, 'etsc_min_samples_leaf': 3, 'etsc_max_features': 4, 'etsc_bootstrap': False}. Best is trial 1 with value: 0.953151.
Trial 9 finished with value: 0.6950742018218817 and parameters: {'etsc_n_estimators': 50, 'etsc_criterion': 'gini', 'etsc_min_samples_split': 39, 'etsc_min_samples_leaf': 21, 'etsc_max_features': 1, 'etsc_bootstrap': True}. Best is trial 1 with value: 0.953151.
Trial 4 finished with value: 0.8022503707448061 and parameters: {'etsc_n_estimators': 120, 'etsc_criterion': 'gini', 'etsc_min_samples_split': 2, 'etsc_min_samples_leaf': 5, 'etsc_max_features': 4, 'etsc_bootstrap': False}. Best is trial 1 with value: 0.953151.
Trial 8 finished with value: 0.6950742018218817 and parameters: {'etsc_n_estimators': 200, 'etsc_criterion': 'entropy', 'etsc_min_samples_split': 48, 'etsc_min_samples_leaf': 23, 'etsc_max_features': 2, 'etsc_bootstrap': False}. Best is trial 1 with value: 0.953151.
Trial 10 finished with value: 0.6950742018218817 and parameters: {'etsc_n_estimators': 150, 'etsc_criterion': 'gini', 'etsc_min_samples_split': 40, 'etsc_min_samples_leaf': 38, 'etsc_max_features': 1, 'etsc_bootstrap': True}. Best is trial 1 with value: 0.953151.
Trial 12 finished with value: 0.6950742018218817 and parameters: {'etsc_n_estimators': 90, 'etsc_criterion': 'gini', 'etsc_min_samples_split': 9, 'etsc_min_samples_leaf': 48, 'etsc_max_features': 2, 'etsc_bootstrap': False}. Best is trial 1 with value: 0.953151.
Trial 2 finished with value: 0.9005654048951395 and parameters: {'etsc_n_estimators': 150, 'etsc_criterion': 'gini', 'etsc_min_samples_split': 39, 'etsc_min_samples_leaf': 40, 'etsc_max_features': 5, 'etsc_bootstrap': True}. Best is trial 1 with value: 0.953151.
Trial 7 finished with value: 0.9923551561191803 and parameters: {'etsc_n_estimators': 100, 'etsc_criterion': 'entropy', 'etsc_min_samples_split': 24, 'etsc_min_samples_leaf': 17, 'etsc_max_features': 6, 'etsc_bootstrap': False}. Best is trial 7 with value: 0.992355.
Trial 3 finished with value: 0.9951455891639165 and parameters: {'etsc_n_estimators': 90, 'etsc_criterion': 'gini', 'etsc_min_samples_split': 36, 'etsc_min_samples_leaf': 4, 'etsc_max_features': 6, 'etsc_bootstrap': False}. Best is trial 3 with value: 0.995146.
Trial 6 finished with value: 0.9211728123628553 and parameters: {'etsc_n_estimators': 200, 'etsc_criterion': 'entropy', 'etsc_min_samples_split': 34, 'etsc_min_samples_leaf': 30, 'etsc_max_features': 5, 'etsc_bootstrap': True}. Best is trial 3 with value: 0.995146.
Trial 13 finished with value: 0.9927339265279059 and parameters: {'etsc_n_estimators': 50, 'etsc_criterion': 'gini', 'etsc_min_samples_split': 40, 'etsc_min_samples_leaf': 26, 'etsc_max_features': 7, 'etsc_bootstrap': False}. Best is trial 3 with value: 0.995146.
Trial 11 finished with value: 0.992405867914597 and parameters: {'etsc_n_estimators': 90, 'etsc_criterion': 'entropy', 'etsc_min_samples_split': 34, 'etsc_min_samples_leaf': 31, 'etsc_max_features': 7, 'etsc_bootstrap': True}. Best is trial 3 with value: 0.995146.
Trial 14 finished with value: 0.7266112644184033 and parameters: {'etsc_n_estimators': 190, 'etsc_criterion': 'entropy', 'etsc_min_samples_split': 26, 'etsc_min_samples_leaf': 12, 'etsc_max_features': 4, 'etsc_bootstrap': True}. Best is trial 3 with value: 0.995146.
Trial 15 finished with value: 0.9539296351451853 and parameters: {'etsc_n_estimators': 150, 'etsc_criterion': 'gini', 'etsc_min_samples_split': 32, 'etsc_min_samples_leaf': 11, 'etsc_max_features': 5, 'etsc_bootstrap': False}. Best is trial 3 with value: 0.995146.
Trial 17 finished with value: 0.9929130486687432 and parameters: {'etsc_n_estimators': 80, 'etsc_criterion': 'entropy', 'etsc_min_samples_split': 26, 'etsc_min_samples_leaf': 16, 'etsc_max_features': 7, 'etsc_bootstrap': False}. Best is trial 3 with value: 0.995146.
Trial 16 finished with value: 0.9908318773725759 and parameters: {'etsc_n_estimators': 150, 'etsc_criterion': 'gini', 'etsc_min_samples_split': 42, 'etsc_min_samples_leaf': 34, 'etsc_max_features': 6, 'etsc_bootstrap': True}. Best is trial 3 with value: 0.995146.
Trial 20 finished with value: 0.9905264330907554 and parameters: {'etsc_n_estimators': 70, 'etsc_criterion': 'gini', 'etsc_min_samples_split': 28, 'etsc_min_samples_leaf': 30, 'etsc_max_features': 7, 'etsc_bootstrap': False}. Best is trial 3 with value: 0.995146.
Trial 18 finished with value: 0.9929130486687432 and parameters: {'etsc_n_estimators': 80, 'etsc_criterion': 'entropy', 'etsc_min_samples_split': 25, 'etsc_min_samples_leaf': 16, 'etsc_max_features': 7, 'etsc_bootstrap': False}. Best is trial 3 with value: 0.995146.
Trial 19 finished with value: 0.9928926666324375 and parameters: {'etsc_n_estimators': 80, 'etsc_criterion': 'entropy', 'etsc_min_samples_split': 25, 'etsc_min_samples_leaf': 15, 'etsc_max_features': 7, 'etsc_bootstrap': False}. Best is trial 3 with value: 0.995146.
Trial 22 finished with value: 0.9916700171836984 and parameters: {'etsc_n_estimators': 70, 'etsc_criterion': 'gini', 'etsc_min_samples_split': 48, 'etsc_min_samples_leaf': 29, 'etsc_max_features': 7, 'etsc_bootstrap': False}. Best is trial 3 with value: 0.995146.
Trial 21 finished with value: 0.9929178844179107 and parameters: {'etsc_n_estimators': 70, 'etsc_criterion': 'gini', 'etsc_min_samples_split': 50, 'etsc_min_samples_leaf': 14, 'etsc_max_features': 7, 'etsc_bootstrap': False}. Best is trial 3 with value: 0.995146.
