A new study created in RDB with name: AdaBoostClassifier_f33849d8
Trial 5 finished with value: 0.6950742018218817 and parameters: {'abc_n_estimators': 30, 'abc_learning_rate': 4.26935432401561e-06}. Best is trial 5 with value: 0.695074.
Trial 7 finished with value: 0.7445616116929415 and parameters: {'abc_n_estimators': 35, 'abc_learning_rate': 0.021588082085701305}. Best is trial 7 with value: 0.744562.
Trial 9 finished with value: 0.7456741477332239 and parameters: {'abc_n_estimators': 25, 'abc_learning_rate': 0.14294815417762316}. Best is trial 9 with value: 0.745674.
Trial 3 finished with value: 0.6950742018218817 and parameters: {'abc_n_estimators': 75, 'abc_learning_rate': 1.378375630464509e-05}. Best is trial 9 with value: 0.745674.
Trial 1 finished with value: 0.7445616116929415 and parameters: {'abc_n_estimators': 80, 'abc_learning_rate': 0.008741619461691769}. Best is trial 9 with value: 0.745674.
Trial 4 finished with value: 0.4246237896428745 and parameters: {'abc_n_estimators': 85, 'abc_learning_rate': 0.7157926706937583}. Best is trial 9 with value: 0.745674.
Trial 2 finished with value: 0.7456741477332239 and parameters: {'abc_n_estimators': 85, 'abc_learning_rate': 0.0399575188531168}. Best is trial 2 with value: 0.745674.
Trial 0 finished with value: 0.762887922059495 and parameters: {'abc_n_estimators': 95, 'abc_learning_rate': 0.11183143903402867}. Best is trial 0 with value: 0.762888.
Trial 6 finished with value: 0.6950742018218817 and parameters: {'abc_n_estimators': 100, 'abc_learning_rate': 1.083882999017095e-06}. Best is trial 0 with value: 0.762888.
Trial 11 finished with value: 0.6950742018218817 and parameters: {'abc_n_estimators': 25, 'abc_learning_rate': 7.65104926601631e-06}. Best is trial 0 with value: 0.762888.
Trial 8 finished with value: 0.7559731367235444 and parameters: {'abc_n_estimators': 75, 'abc_learning_rate': 0.0020154780522310934}. Best is trial 0 with value: 0.762888.
Trial 13 finished with value: 0.6950742018218817 and parameters: {'abc_n_estimators': 55, 'abc_learning_rate': 3.299883292235428e-05}. Best is trial 0 with value: 0.762888.
Trial 14 finished with value: 0.6950742018218817 and parameters: {'abc_n_estimators': 55, 'abc_learning_rate': 8.585746291122026e-05}. Best is trial 0 with value: 0.762888.
Trial 10 finished with value: 0.7446304202782416 and parameters: {'abc_n_estimators': 85, 'abc_learning_rate': 0.6387299377030381}. Best is trial 0 with value: 0.762888.
Trial 16 finished with value: 0.7559731367235444 and parameters: {'abc_n_estimators': 50, 'abc_learning_rate': 0.004080602672482494}. Best is trial 0 with value: 0.762888.
Trial 15 finished with value: 0.7559731367235444 and parameters: {'abc_n_estimators': 65, 'abc_learning_rate': 0.0012631288171408785}. Best is trial 0 with value: 0.762888.
Trial 17 finished with value: 0.7559731367235444 and parameters: {'abc_n_estimators': 60, 'abc_learning_rate': 0.00041190512709230896}. Best is trial 0 with value: 0.762888.
Trial 18 finished with value: 0.7559731367235444 and parameters: {'abc_n_estimators': 60, 'abc_learning_rate': 0.00032021339811016876}. Best is trial 0 with value: 0.762888.
Trial 12 finished with value: 0.7559731367235444 and parameters: {'abc_n_estimators': 100, 'abc_learning_rate': 0.00013063817611143794}. Best is trial 0 with value: 0.762888.
Trial 25 finished with value: 0.7073621070475593 and parameters: {'abc_n_estimators': 45, 'abc_learning_rate': 0.005506486512430971}. Best is trial 0 with value: 0.762888.
Trial 26 finished with value: 0.7559731367235444 and parameters: {'abc_n_estimators': 45, 'abc_learning_rate': 0.0037099982664797106}. Best is trial 0 with value: 0.762888.
Trial 19 finished with value: 0.7559731367235444 and parameters: {'abc_n_estimators': 100, 'abc_learning_rate': 0.0006587561676339618}. Best is trial 0 with value: 0.762888.
Trial 20 finished with value: 0.7559731367235444 and parameters: {'abc_n_estimators': 100, 'abc_learning_rate': 0.0014984456120743512}. Best is trial 0 with value: 0.762888.
Trial 21 finished with value: 0.7559731367235444 and parameters: {'abc_n_estimators': 100, 'abc_learning_rate': 0.0011600634708854368}. Best is trial 0 with value: 0.762888.
Trial 22 finished with value: 0.7559731367235444 and parameters: {'abc_n_estimators': 100, 'abc_learning_rate': 0.00035077684183452203}. Best is trial 0 with value: 0.762888.
Trial 27 finished with value: 0.7559731367235444 and parameters: {'abc_n_estimators': 40, 'abc_learning_rate': 0.0003727187736049212}. Best is trial 0 with value: 0.762888.
Trial 23 finished with value: 0.7559731367235444 and parameters: {'abc_n_estimators': 100, 'abc_learning_rate': 0.0005534342682864632}. Best is trial 0 with value: 0.762888.
Trial 24 finished with value: 0.7559731367235444 and parameters: {'abc_n_estimators': 100, 'abc_learning_rate': 0.00039629306844684924}. Best is trial 0 with value: 0.762888.
Trial 28 finished with value: 0.7559731367235444 and parameters: {'abc_n_estimators': 65, 'abc_learning_rate': 0.00040798369135146555}. Best is trial 0 with value: 0.762888.
A new study created in RDB with name: AdaGradClassifier_f33849d8
Trial 3 finished with value: 0.6893948007052385 and parameters: {'agc_alpha': 4.661112309642362, 'agc_l1_ratio': 1.0, 'agc_loss': 'modified_huber'}. Best is trial 2 with value: 0.773124.
Trial 7 finished with value: 1.5316032040840837e-05 and parameters: {'agc_alpha': 6.207131887082975, 'agc_l1_ratio': 0.2, 'agc_loss': 'squared'}. Best is trial 2 with value: 0.773124.
Trial 6 finished with value: 0.7034549318228858 and parameters: {'agc_alpha': 0.6507227837621763, 'agc_l1_ratio': 0.0, 'agc_loss': 'squared_hinge'}. Best is trial 2 with value: 0.773124.
Trial 2 finished with value: 0.7731243422009014 and parameters: {'agc_alpha': 102.645545798166, 'agc_l1_ratio': 0.6000000000000001, 'agc_loss': 'modified_huber'}. Best is trial 2 with value: 0.773124.
Trial 5 finished with value: 0.7468494615289386 and parameters: {'agc_alpha': 0.003305584808348211, 'agc_l1_ratio': 0.5, 'agc_loss': 'hinge'}. Best is trial 2 with value: 0.773124.
Trial 1 finished with value: 0.7300115148948286 and parameters: {'agc_alpha': 0.06554495071346289, 'agc_l1_ratio': 0.6000000000000001, 'agc_loss': 'perceptron'}. Best is trial 2 with value: 0.773124.
Trial 4 finished with value: 0.7329949717830232 and parameters: {'agc_alpha': 0.7119799300978508, 'agc_l1_ratio': 0.4, 'agc_loss': 'hinge'}. Best is trial 2 with value: 0.773124.
Trial 0 finished with value: 0.7434082920983269 and parameters: {'agc_alpha': 0.0010633773753862077, 'agc_l1_ratio': 0.7000000000000001, 'agc_loss': 'log'}. Best is trial 2 with value: 0.773124.
Trial 8 finished with value: 0.77594933415311 and parameters: {'agc_alpha': 57.796216069912965, 'agc_l1_ratio': 0.8, 'agc_loss': 'modified_huber'}. Best is trial 8 with value: 0.775949.
Trial 9 finished with value: 0.7308048985284261 and parameters: {'agc_alpha': 0.01973648991296371, 'agc_l1_ratio': 1.0, 'agc_loss': 'log'}. Best is trial 8 with value: 0.775949.
Trial 10 finished with value: 0.7034963254672407 and parameters: {'agc_alpha': 2.5589054256444683, 'agc_l1_ratio': 0.6000000000000001, 'agc_loss': 'squared_hinge'}. Best is trial 8 with value: 0.775949.
Trial 14 finished with value: 0.774686059859717 and parameters: {'agc_alpha': 18.593803006631642, 'agc_l1_ratio': 0.9, 'agc_loss': 'hinge'}. Best is trial 8 with value: 0.775949.
Trial 13 finished with value: 0.6896194587625482 and parameters: {'agc_alpha': 4.387002169955357, 'agc_l1_ratio': 0.30000000000000004, 'agc_loss': 'perceptron'}. Best is trial 8 with value: 0.775949.
Trial 12 finished with value: 1.5326097463167323e-05 and parameters: {'agc_alpha': 3.1958257041469653, 'agc_l1_ratio': 0.8, 'agc_loss': 'squared'}. Best is trial 8 with value: 0.775949.
Trial 15 finished with value: 1.5322517778019187e-05 and parameters: {'agc_alpha': 0.003969433316330774, 'agc_l1_ratio': 0.5, 'agc_loss': 'squared'}. Best is trial 8 with value: 0.775949.
Trial 11 finished with value: 0.725610680130522 and parameters: {'agc_alpha': 3.7006381815713687, 'agc_l1_ratio': 0.6000000000000001, 'agc_loss': 'modified_huber'}. Best is trial 8 with value: 0.775949.
Trial 17 finished with value: 0.69576049759975 and parameters: {'agc_alpha': 746.8690718055556, 'agc_l1_ratio': 0.9, 'agc_loss': 'smooth_hinge'}. Best is trial 8 with value: 0.775949.
Trial 16 finished with value: 0.6952322491670602 and parameters: {'agc_alpha': 820.1046933830143, 'agc_l1_ratio': 0.9, 'agc_loss': 'smooth_hinge'}. Best is trial 8 with value: 0.775949.
Trial 19 finished with value: 0.6959233936367704 and parameters: {'agc_alpha': 854.9983609054492, 'agc_l1_ratio': 0.9, 'agc_loss': 'smooth_hinge'}. Best is trial 8 with value: 0.775949.
Trial 20 finished with value: 0.6953149021298908 and parameters: {'agc_alpha': 889.0514138738888, 'agc_l1_ratio': 0.9, 'agc_loss': 'smooth_hinge'}. Best is trial 8 with value: 0.775949.
Trial 21 finished with value: 0.6953723083727219 and parameters: {'agc_alpha': 758.074381030446, 'agc_l1_ratio': 0.9, 'agc_loss': 'smooth_hinge'}. Best is trial 8 with value: 0.775949.
Trial 18 finished with value: 0.695252641709269 and parameters: {'agc_alpha': 881.8399921875006, 'agc_l1_ratio': 0.9, 'agc_loss': 'smooth_hinge'}. Best is trial 8 with value: 0.775949.
A new study created in RDB with name: BalancedBaggingClassifier_f33849d8
Trial 0 finished with value: 0.9972947235746229 and parameters: {'bbc_n_estimators': 6, 'bbc_max_features': 6, 'bbc_bootstrap': False, 'bbc_sampling_strategy': 'all'}. Best is trial 0 with value: 0.997295.
Trial 4 finished with value: 0.955418385014924 and parameters: {'bbc_n_estimators': 6, 'bbc_max_features': 3, 'bbc_bootstrap': True, 'bbc_sampling_strategy': 'not minority'}. Best is trial 0 with value: 0.997295.
Trial 3 finished with value: 0.9940209959458045 and parameters: {'bbc_n_estimators': 7, 'bbc_max_features': 4, 'bbc_bootstrap': True, 'bbc_sampling_strategy': 'all'}. Best is trial 0 with value: 0.997295.
Trial 2 finished with value: 0.4280119081049267 and parameters: {'bbc_n_estimators': 8, 'bbc_max_features': 2, 'bbc_bootstrap': False, 'bbc_sampling_strategy': 'majority'}. Best is trial 0 with value: 0.997295.
Trial 5 finished with value: 0.7174946418498755 and parameters: {'bbc_n_estimators': 8, 'bbc_max_features': 3, 'bbc_bootstrap': True, 'bbc_sampling_strategy': 'majority'}. Best is trial 0 with value: 0.997295.
Trial 10 finished with value: 0.9971340116083334 and parameters: {'bbc_n_estimators': 5, 'bbc_max_features': 6, 'bbc_bootstrap': False, 'bbc_sampling_strategy': 'not minority'}. Best is trial 0 with value: 0.997295.
Trial 6 finished with value: 0.9717927992898244 and parameters: {'bbc_n_estimators': 14, 'bbc_max_features': 4, 'bbc_bootstrap': False, 'bbc_sampling_strategy': 'majority'}. Best is trial 0 with value: 0.997295.
Trial 8 finished with value: 0.9856030083344539 and parameters: {'bbc_n_estimators': 7, 'bbc_max_features': 6, 'bbc_bootstrap': True, 'bbc_sampling_strategy': 'majority'}. Best is trial 0 with value: 0.997295.
Trial 7 finished with value: 0.9846820735294814 and parameters: {'bbc_n_estimators': 16, 'bbc_max_features': 5, 'bbc_bootstrap': False, 'bbc_sampling_strategy': 'majority'}. Best is trial 0 with value: 0.997295.
Trial 1 finished with value: 0.9972557951717346 and parameters: {'bbc_n_estimators': 9, 'bbc_max_features': 6, 'bbc_bootstrap': False, 'bbc_sampling_strategy': 'not majority'}. Best is trial 0 with value: 0.997295.
Trial 11 finished with value: 0.99782972160134 and parameters: {'bbc_n_estimators': 14, 'bbc_max_features': 6, 'bbc_bootstrap': True, 'bbc_sampling_strategy': 'all'}. Best is trial 11 with value: 0.99783.
Trial 16 finished with value: 0.6916762917639688 and parameters: {'bbc_n_estimators': 9, 'bbc_max_features': 3, 'bbc_bootstrap': False, 'bbc_sampling_strategy': 'majority'}. Best is trial 11 with value: 0.99783.
Trial 12 finished with value: 0.9526914154651586 and parameters: {'bbc_n_estimators': 14, 'bbc_max_features': 3, 'bbc_bootstrap': True, 'bbc_sampling_strategy': 'majority'}. Best is trial 11 with value: 0.99783.
Trial 14 finished with value: 0.9525107703530572 and parameters: {'bbc_n_estimators': 15, 'bbc_max_features': 3, 'bbc_bootstrap': False, 'bbc_sampling_strategy': 'majority'}. Best is trial 11 with value: 0.99783.
Trial 13 finished with value: 0.9846795695553392 and parameters: {'bbc_n_estimators': 17, 'bbc_max_features': 5, 'bbc_bootstrap': False, 'bbc_sampling_strategy': 'majority'}. Best is trial 11 with value: 0.99783.
Trial 17 finished with value: 0.9975648769997719 and parameters: {'bbc_n_estimators': 20, 'bbc_max_features': 7, 'bbc_bootstrap': False, 'bbc_sampling_strategy': 'all'}. Best is trial 11 with value: 0.99783.
Trial 15 finished with value: 0.9986964735389077 and parameters: {'bbc_n_estimators': 14, 'bbc_max_features': 7, 'bbc_bootstrap': True, 'bbc_sampling_strategy': 'majority'}. Best is trial 15 with value: 0.998696.
Trial 18 finished with value: 0.9971810049722346 and parameters: {'bbc_n_estimators': 20, 'bbc_max_features': 7, 'bbc_bootstrap': True, 'bbc_sampling_strategy': 'all'}. Best is trial 15 with value: 0.998696.
Trial 9 finished with value: 0.9972408095528316 and parameters: {'bbc_n_estimators': 16, 'bbc_max_features': 7, 'bbc_bootstrap': True, 'bbc_sampling_strategy': 'not majority'}. Best is trial 15 with value: 0.998696.
Trial 19 finished with value: 0.9971810049722346 and parameters: {'bbc_n_estimators': 20, 'bbc_max_features': 7, 'bbc_bootstrap': True, 'bbc_sampling_strategy': 'all'}. Best is trial 15 with value: 0.998696.
Trial 20 finished with value: 0.9971810049722346 and parameters: {'bbc_n_estimators': 20, 'bbc_max_features': 7, 'bbc_bootstrap': True, 'bbc_sampling_strategy': 'all'}. Best is trial 15 with value: 0.998696.
Trial 21 finished with value: 0.9971810049722346 and parameters: {'bbc_n_estimators': 20, 'bbc_max_features': 7, 'bbc_bootstrap': True, 'bbc_sampling_strategy': 'all'}. Best is trial 15 with value: 0.998696.
Trial 22 finished with value: 0.9971810049722346 and parameters: {'bbc_n_estimators': 20, 'bbc_max_features': 7, 'bbc_bootstrap': True, 'bbc_sampling_strategy': 'all'}. Best is trial 15 with value: 0.998696.
A new study created in RDB with name: BalancedRandomForestClassifier_f33849d8
sklearn.ensemble.RandomForestClassifier.predict: fallback to original Scikit-learn
sklearn.ensemble.RandomForestClassifier.predict_proba: fallback to original Scikit-learn
sklearn.ensemble.RandomForestClassifier.predict: fallback to original Scikit-learn
sklearn.ensemble.RandomForestClassifier.predict_proba: fallback to original Scikit-learn
sklearn.ensemble.RandomForestClassifier.predict: fallback to original Scikit-learn
sklearn.ensemble.RandomForestClassifier.predict_proba: fallback to original Scikit-learn
Trial 4 finished with value: 0.9899357012113474 and parameters: {'brf_n_estimators': 70, 'brf_criterion': 'gini', 'brf_min_samples_split': 5, 'brf_min_samples_leaf': 5, 'brf_max_features': 2, 'brf_bootstrap': False}. Best is trial 4 with value: 0.989936.
Trial 1 finished with value: 0.9863764370734985 and parameters: {'brf_n_estimators': 80, 'brf_criterion': 'gini', 'brf_min_samples_split': 18, 'brf_min_samples_leaf': 8, 'brf_max_features': 3, 'brf_bootstrap': True}. Best is trial 4 with value: 0.989936.
Trial 5 finished with value: 0.9882977104642753 and parameters: {'brf_n_estimators': 80, 'brf_criterion': 'entropy', 'brf_min_samples_split': 49, 'brf_min_samples_leaf': 7, 'brf_max_features': 2, 'brf_bootstrap': False}. Best is trial 4 with value: 0.989936.
sklearn.ensemble.RandomForestClassifier.predict: fallback to original Scikit-learn
sklearn.ensemble.RandomForestClassifier.predict_proba: fallback to original Scikit-learn
sklearn.ensemble.RandomForestClassifier.predict: fallback to original Scikit-learn
sklearn.ensemble.RandomForestClassifier.predict_proba: fallback to original Scikit-learn
sklearn.ensemble.RandomForestClassifier.predict: fallback to original Scikit-learn
sklearn.ensemble.RandomForestClassifier.predict_proba: fallback to original Scikit-learn
Trial 7 finished with value: 0.9164726998245091 and parameters: {'brf_n_estimators': 100, 'brf_criterion': 'entropy', 'brf_min_samples_split': 11, 'brf_min_samples_leaf': 49, 'brf_max_features': 1, 'brf_bootstrap': False}. Best is trial 4 with value: 0.989936.
Trial 2 finished with value: 0.9846843737005243 and parameters: {'brf_n_estimators': 100, 'brf_criterion': 'entropy', 'brf_min_samples_split': 25, 'brf_min_samples_leaf': 12, 'brf_max_features': 5, 'brf_bootstrap': True}. Best is trial 4 with value: 0.989936.
Trial 0 finished with value: 0.9110742086544938 and parameters: {'brf_n_estimators': 110, 'brf_criterion': 'gini', 'brf_min_samples_split': 17, 'brf_min_samples_leaf': 41, 'brf_max_features': 4, 'brf_bootstrap': True}. Best is trial 4 with value: 0.989936.
sklearn.ensemble.RandomForestClassifier.predict: fallback to original Scikit-learn
sklearn.ensemble.RandomForestClassifier.predict_proba: fallback to original Scikit-learn
sklearn.ensemble.RandomForestClassifier.predict: fallback to original Scikit-learn
sklearn.ensemble.RandomForestClassifier.predict_proba: fallback to original Scikit-learn
Trial 3 finished with value: 0.9202612950423383 and parameters: {'brf_n_estimators': 140, 'brf_criterion': 'entropy', 'brf_min_samples_split': 4, 'brf_min_samples_leaf': 48, 'brf_max_features': 4, 'brf_bootstrap': False}. Best is trial 4 with value: 0.989936.
Trial 6 finished with value: 0.9870882496745101 and parameters: {'brf_n_estimators': 140, 'brf_criterion': 'gini', 'brf_min_samples_split': 2, 'brf_min_samples_leaf': 15, 'brf_max_features': 5, 'brf_bootstrap': False}. Best is trial 4 with value: 0.989936.
sklearn.ensemble.RandomForestClassifier.predict: fallback to original Scikit-learn
sklearn.ensemble.RandomForestClassifier.predict_proba: fallback to original Scikit-learn
Trial 12 finished with value: 0.9904043121200059 and parameters: {'brf_n_estimators': 60, 'brf_criterion': 'entropy', 'brf_min_samples_split': 37, 'brf_min_samples_leaf': 10, 'brf_max_features': 5, 'brf_bootstrap': False}. Best is trial 12 with value: 0.990404.
sklearn.ensemble.RandomForestClassifier.predict: fallback to original Scikit-learn
sklearn.ensemble.RandomForestClassifier.predict_proba: fallback to original Scikit-learn
Trial 9 finished with value: 0.9514510004224226 and parameters: {'brf_n_estimators': 120, 'brf_criterion': 'entropy', 'brf_min_samples_split': 45, 'brf_min_samples_leaf': 37, 'brf_max_features': 5, 'brf_bootstrap': False}. Best is trial 12 with value: 0.990404.
sklearn.ensemble.RandomForestClassifier.predict: fallback to original Scikit-learn
sklearn.ensemble.RandomForestClassifier.predict_proba: fallback to original Scikit-learn
sklearn.ensemble.RandomForestClassifier.predict: fallback to original Scikit-learn
sklearn.ensemble.RandomForestClassifier.predict_proba: fallback to original Scikit-learn
sklearn.ensemble.RandomForestClassifier.predict: fallback to original Scikit-learn
sklearn.ensemble.RandomForestClassifier.predict_proba: fallback to original Scikit-learn
Trial 15 finished with value: 0.9412659942244028 and parameters: {'brf_n_estimators': 90, 'brf_criterion': 'entropy', 'brf_min_samples_split': 12, 'brf_min_samples_leaf': 34, 'brf_max_features': 4, 'brf_bootstrap': False}. Best is trial 12 with value: 0.990404.
Trial 10 finished with value: 0.9447491502858864 and parameters: {'brf_n_estimators': 150, 'brf_criterion': 'gini', 'brf_min_samples_split': 13, 'brf_min_samples_leaf': 27, 'brf_max_features': 6, 'brf_bootstrap': True}. Best is trial 12 with value: 0.990404.
sklearn.ensemble.RandomForestClassifier.predict: fallback to original Scikit-learn
sklearn.ensemble.RandomForestClassifier.predict_proba: fallback to original Scikit-learn
sklearn.ensemble.RandomForestClassifier.predict: fallback to original Scikit-learn
sklearn.ensemble.RandomForestClassifier.predict_proba: fallback to original Scikit-learn
sklearn.ensemble.RandomForestClassifier.predict: fallback to original Scikit-learn
sklearn.ensemble.RandomForestClassifier.predict_proba: fallback to original Scikit-learn
Trial 8 finished with value: 0.9755726286926133 and parameters: {'brf_n_estimators': 180, 'brf_criterion': 'entropy', 'brf_min_samples_split': 26, 'brf_min_samples_leaf': 13, 'brf_max_features': 2, 'brf_bootstrap': False}. Best is trial 12 with value: 0.990404.
Trial 14 finished with value: 0.9632012706655441 and parameters: {'brf_n_estimators': 120, 'brf_criterion': 'gini', 'brf_min_samples_split': 50, 'brf_min_samples_leaf': 24, 'brf_max_features': 1, 'brf_bootstrap': False}. Best is trial 12 with value: 0.990404.
Trial 11 finished with value: 0.9715548111727211 and parameters: {'brf_n_estimators': 160, 'brf_criterion': 'entropy', 'brf_min_samples_split': 25, 'brf_min_samples_leaf': 26, 'brf_max_features': 4, 'brf_bootstrap': False}. Best is trial 12 with value: 0.990404.
Trial 16 finished with value: 0.9681879439897151 and parameters: {'brf_n_estimators': 90, 'brf_criterion': 'gini', 'brf_min_samples_split': 3, 'brf_min_samples_leaf': 24, 'brf_max_features': 3, 'brf_bootstrap': False}. Best is trial 12 with value: 0.990404.
sklearn.ensemble.RandomForestClassifier.predict: fallback to original Scikit-learn
sklearn.ensemble.RandomForestClassifier.predict_proba: fallback to original Scikit-learn
sklearn.ensemble.RandomForestClassifier.predict: fallback to original Scikit-learn
sklearn.ensemble.RandomForestClassifier.predict_proba: fallback to original Scikit-learn
sklearn.ensemble.RandomForestClassifier.predict: fallback to original Scikit-learn
sklearn.ensemble.RandomForestClassifier.predict_proba: fallback to original Scikit-learn
Trial 19 finished with value: 0.9941613201933839 and parameters: {'brf_n_estimators': 50, 'brf_criterion': 'gini', 'brf_min_samples_split': 38, 'brf_min_samples_leaf': 1, 'brf_max_features': 7, 'brf_bootstrap': False}. Best is trial 19 with value: 0.994161.
