Trial 13 finished with value: 0.45089711887274375 and parameters: {'vfdrc_ordered_rules': False, 'vfdrc_grace_period': 250, 'vfdrc_tie_threshold': 0.5, 'vfdrc_rule_prediction': 'weighted_sum', 'vfdrc_max_rules': 30, 'vfdrc_expand_criterion': 'info_gain', 'vfdrc_remove_poor_atts': False}. Best is trial 6 with value: 0.749427.
Trial 15 finished with value: 0.6583739452396495 and parameters: {'vfdrc_ordered_rules': True, 'vfdrc_grace_period': 150, 'vfdrc_tie_threshold': 0.1, 'vfdrc_rule_prediction': 'weighted_max', 'vfdrc_max_rules': 30, 'vfdrc_expand_criterion': 'info_gain', 'vfdrc_remove_poor_atts': False}. Best is trial 6 with value: 0.749427.
Trial 14 finished with value: 0.1899619014197583 and parameters: {'vfdrc_ordered_rules': False, 'vfdrc_grace_period': 200, 'vfdrc_tie_threshold': 0.2, 'vfdrc_rule_prediction': 'weighted_sum', 'vfdrc_max_rules': 35, 'vfdrc_expand_criterion': 'info_gain', 'vfdrc_remove_poor_atts': True}. Best is trial 6 with value: 0.749427.
Trial 19 finished with value: 0.7511439441022666 and parameters: {'vfdrc_ordered_rules': True, 'vfdrc_grace_period': 100, 'vfdrc_tie_threshold': 1.0, 'vfdrc_rule_prediction': 'weighted_sum', 'vfdrc_max_rules': 30, 'vfdrc_expand_criterion': 'info_gain', 'vfdrc_remove_poor_atts': True}. Best is trial 19 with value: 0.751144.
Trial 16 finished with value: 0.15556482959633403 and parameters: {'vfdrc_ordered_rules': True, 'vfdrc_grace_period': 150, 'vfdrc_tie_threshold': 0.2, 'vfdrc_rule_prediction': 'weighted_max', 'vfdrc_max_rules': 20, 'vfdrc_expand_criterion': 'hellinger', 'vfdrc_remove_poor_atts': False}. Best is trial 18 with value: 0.751144.
Trial 18 finished with value: 0.7511439441022666 and parameters: {'vfdrc_ordered_rules': True, 'vfdrc_grace_period': 100, 'vfdrc_tie_threshold': 0.9500000000000001, 'vfdrc_rule_prediction': 'weighted_sum', 'vfdrc_max_rules': 30, 'vfdrc_expand_criterion': 'info_gain', 'vfdrc_remove_poor_atts': True}. Best is trial 18 with value: 0.751144.
Trial 21 finished with value: 0.7663455972452762 and parameters: {'vfdrc_ordered_rules': True, 'vfdrc_grace_period': 100, 'vfdrc_tie_threshold': 1.0, 'vfdrc_rule_prediction': 'weighted_sum', 'vfdrc_max_rules': 40, 'vfdrc_expand_criterion': 'info_gain', 'vfdrc_remove_poor_atts': True}. Best is trial 21 with value: 0.766346.
Trial 17 finished with value: 0.7511439441022666 and parameters: {'vfdrc_ordered_rules': True, 'vfdrc_grace_period': 100, 'vfdrc_tie_threshold': 1.0, 'vfdrc_rule_prediction': 'weighted_sum', 'vfdrc_max_rules': 30, 'vfdrc_expand_criterion': 'info_gain', 'vfdrc_remove_poor_atts': True}. Best is trial 21 with value: 0.766346.
Trial 20 finished with value: 0.7663455972452762 and parameters: {'vfdrc_ordered_rules': True, 'vfdrc_grace_period': 100, 'vfdrc_tie_threshold': 1.0, 'vfdrc_rule_prediction': 'weighted_sum', 'vfdrc_max_rules': 40, 'vfdrc_expand_criterion': 'info_gain', 'vfdrc_remove_poor_atts': True}. Best is trial 21 with value: 0.766346.
Trial 23 finished with value: 0.749426850629697 and parameters: {'vfdrc_ordered_rules': True, 'vfdrc_grace_period': 100, 'vfdrc_tie_threshold': 1.0, 'vfdrc_rule_prediction': 'weighted_sum', 'vfdrc_max_rules': 25, 'vfdrc_expand_criterion': 'info_gain', 'vfdrc_remove_poor_atts': True}. Best is trial 20 with value: 0.766346.
Trial 22 finished with value: 0.7663455972452762 and parameters: {'vfdrc_ordered_rules': True, 'vfdrc_grace_period': 100, 'vfdrc_tie_threshold': 1.0, 'vfdrc_rule_prediction': 'weighted_sum', 'vfdrc_max_rules': 40, 'vfdrc_expand_criterion': 'info_gain', 'vfdrc_remove_poor_atts': True}. Best is trial 20 with value: 0.766346.
Trial 25 finished with value: 0.7663455972452762 and parameters: {'vfdrc_ordered_rules': True, 'vfdrc_grace_period': 100, 'vfdrc_tie_threshold': 0.9500000000000001, 'vfdrc_rule_prediction': 'weighted_sum', 'vfdrc_max_rules': 40, 'vfdrc_expand_criterion': 'info_gain', 'vfdrc_remove_poor_atts': True}. Best is trial 25 with value: 0.766346.
Trial 24 finished with value: 0.749426850629697 and parameters: {'vfdrc_ordered_rules': True, 'vfdrc_grace_period': 100, 'vfdrc_tie_threshold': 1.0, 'vfdrc_rule_prediction': 'first_hit', 'vfdrc_max_rules': 25, 'vfdrc_expand_criterion': 'info_gain', 'vfdrc_remove_poor_atts': True}. Best is trial 25 with value: 0.766346.
Trial 26 finished with value: 0.7663455972452762 and parameters: {'vfdrc_ordered_rules': True, 'vfdrc_grace_period': 100, 'vfdrc_tie_threshold': 0.9500000000000001, 'vfdrc_rule_prediction': 'weighted_sum', 'vfdrc_max_rules': 40, 'vfdrc_expand_criterion': 'info_gain', 'vfdrc_remove_poor_atts': True}. Best is trial 26 with value: 0.766346.
Trial 27 finished with value: 0.6180619057464393 and parameters: {'vfdrc_ordered_rules': True, 'vfdrc_grace_period': 150, 'vfdrc_tie_threshold': 0.8500000000000001, 'vfdrc_rule_prediction': 'weighted_sum', 'vfdrc_max_rules': 40, 'vfdrc_expand_criterion': 'info_gain', 'vfdrc_remove_poor_atts': True}. Best is trial 20 with value: 0.766346.
Trial 29 finished with value: 0.6180619057464393 and parameters: {'vfdrc_ordered_rules': True, 'vfdrc_grace_period': 150, 'vfdrc_tie_threshold': 0.8500000000000001, 'vfdrc_rule_prediction': 'weighted_sum', 'vfdrc_max_rules': 40, 'vfdrc_expand_criterion': 'info_gain', 'vfdrc_remove_poor_atts': True}. Best is trial 20 with value: 0.766346.
Trial 28 finished with value: 0.6180619057464393 and parameters: {'vfdrc_ordered_rules': True, 'vfdrc_grace_period': 150, 'vfdrc_tie_threshold': 0.8500000000000001, 'vfdrc_rule_prediction': 'weighted_sum', 'vfdrc_max_rules': 40, 'vfdrc_expand_criterion': 'info_gain', 'vfdrc_remove_poor_atts': True}. Best is trial 20 with value: 0.766346.
A new study created in RDB with name: XGBClassifier_f33849d8
Trial 2 finished with value: 0.6950742018218817 and parameters: {'xgbc_n_estimators': 200, 'xgbc_use_label_encoder': False, 'xgbc_learning_rate': 2.9861646296802545e-06, 'xgbc_booster': 'gblinear', 'xgbc_gamma': 0.8609366044719465}. Best is trial 2 with value: 0.695074.
Trial 4 finished with value: 0.6950742018218817 and parameters: {'xgbc_n_estimators': 200, 'xgbc_use_label_encoder': False, 'xgbc_learning_rate': 0.0011590536643634626, 'xgbc_booster': 'gblinear', 'xgbc_gamma': 0.011072487561092772}. Best is trial 2 with value: 0.695074.
Trial 5 finished with value: 0.6950742018218817 and parameters: {'xgbc_n_estimators': 100, 'xgbc_use_label_encoder': False, 'xgbc_learning_rate': 0.00019968880877217039, 'xgbc_booster': 'gblinear', 'xgbc_gamma': 3.548201028807958e-05}. Best is trial 2 with value: 0.695074.
Trial 1 finished with value: 0.9999776285092824 and parameters: {'xgbc_n_estimators': 80, 'xgbc_use_label_encoder': False, 'xgbc_learning_rate': 0.47177738887378745, 'xgbc_booster': 'dart', 'xgbc_gamma': 1.2375345304534901e-06}. Best is trial 1 with value: 0.999978.
Trial 7 finished with value: 0.9967066112984104 and parameters: {'xgbc_n_estimators': 170, 'xgbc_use_label_encoder': False, 'xgbc_learning_rate': 0.002634007715858326, 'xgbc_booster': 'gbtree', 'xgbc_gamma': 0.014286525229270744}. Best is trial 1 with value: 0.999978.
Trial 3 finished with value: 0.9966025773350382 and parameters: {'xgbc_n_estimators': 100, 'xgbc_use_label_encoder': False, 'xgbc_learning_rate': 0.0012670262592056828, 'xgbc_booster': 'dart', 'xgbc_gamma': 0.9126057294364953}. Best is trial 1 with value: 0.999978.
Trial 8 finished with value: 0.9968318595228598 and parameters: {'xgbc_n_estimators': 40, 'xgbc_use_label_encoder': False, 'xgbc_learning_rate': 0.00541027716444171, 'xgbc_booster': 'gbtree', 'xgbc_gamma': 0.14275241912014364}. Best is trial 1 with value: 0.999978.
Trial 10 finished with value: 0.9958466801872934 and parameters: {'xgbc_n_estimators': 100, 'xgbc_use_label_encoder': False, 'xgbc_learning_rate': 4.534773422398831e-06, 'xgbc_booster': 'gbtree', 'xgbc_gamma': 0.0006020949811856189}. Best is trial 1 with value: 0.999978.
Trial 11 finished with value: 0.6950742018218817 and parameters: {'xgbc_n_estimators': 130, 'xgbc_use_label_encoder': False, 'xgbc_learning_rate': 0.0028703846107400997, 'xgbc_booster': 'gblinear', 'xgbc_gamma': 6.319894686082949e-06}. Best is trial 1 with value: 0.999978.
Trial 12 finished with value: 0.6950742018218817 and parameters: {'xgbc_n_estimators': 20, 'xgbc_use_label_encoder': False, 'xgbc_learning_rate': 9.228797718998359e-05, 'xgbc_booster': 'gblinear', 'xgbc_gamma': 4.836965384374821e-05}. Best is trial 1 with value: 0.999978.
Trial 9 finished with value: 0.9999652044947124 and parameters: {'xgbc_n_estimators': 190, 'xgbc_use_label_encoder': False, 'xgbc_learning_rate': 0.1219514932721372, 'xgbc_booster': 'gbtree', 'xgbc_gamma': 0.008186313683519823}. Best is trial 1 with value: 0.999978.
Trial 13 finished with value: 0.9999776250451295 and parameters: {'xgbc_n_estimators': 60, 'xgbc_use_label_encoder': False, 'xgbc_learning_rate': 0.8680512058499177, 'xgbc_booster': 'dart', 'xgbc_gamma': 1.2962846294201868e-06}. Best is trial 1 with value: 0.999978.
Trial 14 finished with value: 0.9999751418109148 and parameters: {'xgbc_n_estimators': 60, 'xgbc_use_label_encoder': False, 'xgbc_learning_rate': 0.6158834108618275, 'xgbc_booster': 'dart', 'xgbc_gamma': 1.2723809735323765e-06}. Best is trial 1 with value: 0.999978.
Trial 15 finished with value: 0.9999801115147081 and parameters: {'xgbc_n_estimators': 70, 'xgbc_use_label_encoder': False, 'xgbc_learning_rate': 0.805280330741271, 'xgbc_booster': 'dart', 'xgbc_gamma': 1.015985511587436e-06}. Best is trial 15 with value: 0.99998.
Trial 16 finished with value: 0.9988312895862792 and parameters: {'xgbc_n_estimators': 70, 'xgbc_use_label_encoder': False, 'xgbc_learning_rate': 0.04426722523711072, 'xgbc_booster': 'dart', 'xgbc_gamma': 1.2011006253422937e-06}. Best is trial 15 with value: 0.99998.
Trial 0 finished with value: 0.9966000544984178 and parameters: {'xgbc_n_estimators': 180, 'xgbc_use_label_encoder': False, 'xgbc_learning_rate': 0.0006470494883729612, 'xgbc_booster': 'dart', 'xgbc_gamma': 7.345062490838566e-06}. Best is trial 15 with value: 0.99998.
Trial 6 finished with value: 0.9992142482865376 and parameters: {'xgbc_n_estimators': 190, 'xgbc_use_label_encoder': False, 'xgbc_learning_rate': 0.02597009320301071, 'xgbc_booster': 'dart', 'xgbc_gamma': 0.00037247310543715034}. Best is trial 15 with value: 0.99998.
Trial 17 finished with value: 0.9992366196248703 and parameters: {'xgbc_n_estimators': 140, 'xgbc_use_label_encoder': False, 'xgbc_learning_rate': 0.0393492421098279, 'xgbc_booster': 'dart', 'xgbc_gamma': 2.0823336281332357e-05}. Best is trial 15 with value: 0.99998.
Trial 18 finished with value: 0.9998311176125484 and parameters: {'xgbc_n_estimators': 140, 'xgbc_use_label_encoder': False, 'xgbc_learning_rate': 0.048170959987332534, 'xgbc_booster': 'dart', 'xgbc_gamma': 2.5248032623388802e-05}. Best is trial 15 with value: 0.99998.
Trial 19 finished with value: 0.999850943254636 and parameters: {'xgbc_n_estimators': 130, 'xgbc_use_label_encoder': False, 'xgbc_learning_rate': 0.05605231041019325, 'xgbc_booster': 'dart', 'xgbc_gamma': 0.0002064508414955761}. Best is trial 15 with value: 0.99998.
Trial 21 finished with value: 0.9999527771418392 and parameters: {'xgbc_n_estimators': 80, 'xgbc_use_label_encoder': False, 'xgbc_learning_rate': 0.2540674019574353, 'xgbc_booster': 'dart', 'xgbc_gamma': 0.00014588177683748946}. Best is trial 15 with value: 0.99998.
Trial 22 finished with value: 0.999947811285182 and parameters: {'xgbc_n_estimators': 80, 'xgbc_use_label_encoder': False, 'xgbc_learning_rate': 0.21115385201696563, 'xgbc_booster': 'dart', 'xgbc_gamma': 0.000161220453091769}. Best is trial 15 with value: 0.99998.
Trial 20 finished with value: 0.9999701729665151 and parameters: {'xgbc_n_estimators': 150, 'xgbc_use_label_encoder': False, 'xgbc_learning_rate': 0.22222207752590015, 'xgbc_booster': 'dart', 'xgbc_gamma': 1.8622575551732463e-05}. Best is trial 15 with value: 0.99998.
