Trial 2 finished with value: 0.04740951657551045 and parameters: {'rusbc_n_estimators': 75, 'rusbc_learning_rate': 0.004350177282803778, 'rusbc_sampling_strategy': 'majority'}. Best is trial 4 with value: 0.753338.
Trial 8 finished with value: 0.7126730374606763 and parameters: {'rusbc_n_estimators': 50, 'rusbc_learning_rate': 8.306200582802633e-05, 'rusbc_sampling_strategy': 'not majority'}. Best is trial 4 with value: 0.753338.
Trial 6 finished with value: 0.7126730374606763 and parameters: {'rusbc_n_estimators': 75, 'rusbc_learning_rate': 9.03965554815167e-05, 'rusbc_sampling_strategy': 'not majority'}. Best is trial 4 with value: 0.753338.
Trial 9 finished with value: 0.019344332152171136 and parameters: {'rusbc_n_estimators': 75, 'rusbc_learning_rate': 0.013510982288195045, 'rusbc_sampling_strategy': 'majority'}. Best is trial 4 with value: 0.753338.
Trial 7 finished with value: 0.7895630239019198 and parameters: {'rusbc_n_estimators': 100, 'rusbc_learning_rate': 0.47478960905709244, 'rusbc_sampling_strategy': 'majority'}. Best is trial 7 with value: 0.789563.
Trial 12 finished with value: 0.019344332152171136 and parameters: {'rusbc_n_estimators': 25, 'rusbc_learning_rate': 0.042234886111471324, 'rusbc_sampling_strategy': 'majority'}. Best is trial 7 with value: 0.789563.
Trial 5 finished with value: 0.7126730374606763 and parameters: {'rusbc_n_estimators': 100, 'rusbc_learning_rate': 0.0016697724809417063, 'rusbc_sampling_strategy': 'not majority'}. Best is trial 7 with value: 0.789563.
Trial 0 finished with value: 0.7419963633157554 and parameters: {'rusbc_n_estimators': 100, 'rusbc_learning_rate': 0.2618693507104728, 'rusbc_sampling_strategy': 'not majority'}. Best is trial 7 with value: 0.789563.
Trial 10 finished with value: 0.003937748219093993 and parameters: {'rusbc_n_estimators': 75, 'rusbc_learning_rate': 0.0003783600652309043, 'rusbc_sampling_strategy': 'all'}. Best is trial 7 with value: 0.789563.
Trial 11 finished with value: 0.7126730374606763 and parameters: {'rusbc_n_estimators': 50, 'rusbc_learning_rate': 0.0007389481055239476, 'rusbc_sampling_strategy': 'not majority'}. Best is trial 7 with value: 0.789563.
Trial 13 finished with value: 0.04740951657551045 and parameters: {'rusbc_n_estimators': 50, 'rusbc_learning_rate': 0.0009103506203755484, 'rusbc_sampling_strategy': 'majority'}. Best is trial 7 with value: 0.789563.
Trial 14 finished with value: 0.0006045392121425023 and parameters: {'rusbc_n_estimators': 75, 'rusbc_learning_rate': 0.002954552236573245, 'rusbc_sampling_strategy': 'not minority'}. Best is trial 7 with value: 0.789563.
Trial 15 finished with value: 0.6251646163655844 and parameters: {'rusbc_n_estimators': 75, 'rusbc_learning_rate': 0.2508009473161528, 'rusbc_sampling_strategy': 'not minority'}. Best is trial 7 with value: 0.789563.
Trial 17 finished with value: 0.8007054107771715 and parameters: {'rusbc_n_estimators': 100, 'rusbc_learning_rate': 0.6004667932686747, 'rusbc_sampling_strategy': 'all'}. Best is trial 17 with value: 0.800705.
Trial 18 finished with value: 0.6236773015232654 and parameters: {'rusbc_n_estimators': 100, 'rusbc_learning_rate': 0.9077818826353292, 'rusbc_sampling_strategy': 'all'}. Best is trial 17 with value: 0.800705.
Trial 16 finished with value: 0.04740951657551045 and parameters: {'rusbc_n_estimators': 100, 'rusbc_learning_rate': 0.0005037212456147331, 'rusbc_sampling_strategy': 'majority'}. Best is trial 17 with value: 0.800705.
Trial 19 finished with value: 0.51758605088483 and parameters: {'rusbc_n_estimators': 100, 'rusbc_learning_rate': 0.9577149925820201, 'rusbc_sampling_strategy': 'all'}. Best is trial 17 with value: 0.800705.
Trial 20 finished with value: 0.0034366581894720474 and parameters: {'rusbc_n_estimators': 100, 'rusbc_learning_rate': 1.493610305719148e-06, 'rusbc_sampling_strategy': 'all'}. Best is trial 17 with value: 0.800705.
Trial 21 finished with value: 0.6942800732079697 and parameters: {'rusbc_n_estimators': 100, 'rusbc_learning_rate': 0.8318710593945733, 'rusbc_sampling_strategy': 'all'}. Best is trial 17 with value: 0.800705.
Trial 22 finished with value: 0.0034366581894720474 and parameters: {'rusbc_n_estimators': 100, 'rusbc_learning_rate': 2.1968472815451358e-06, 'rusbc_sampling_strategy': 'all'}. Best is trial 17 with value: 0.800705.
Trial 23 finished with value: 0.0034366581894720474 and parameters: {'rusbc_n_estimators': 100, 'rusbc_learning_rate': 1.988932232242771e-06, 'rusbc_sampling_strategy': 'all'}. Best is trial 17 with value: 0.800705.
Trial 25 finished with value: 0.0034366581894720474 and parameters: {'rusbc_n_estimators': 100, 'rusbc_learning_rate': 1.4488488775015337e-06, 'rusbc_sampling_strategy': 'all'}. Best is trial 17 with value: 0.800705.
Trial 24 finished with value: 0.0034366581894720474 and parameters: {'rusbc_n_estimators': 100, 'rusbc_learning_rate': 1.702452185688185e-06, 'rusbc_sampling_strategy': 'all'}. Best is trial 17 with value: 0.800705.
Trial 26 finished with value: 0.6908082929001668 and parameters: {'rusbc_n_estimators': 100, 'rusbc_learning_rate': 0.7807742254526794, 'rusbc_sampling_strategy': 'all'}. Best is trial 17 with value: 0.800705.
Trial 27 finished with value: 0.0034366581894720474 and parameters: {'rusbc_n_estimators': 100, 'rusbc_learning_rate': 3.1150374944656637e-06, 'rusbc_sampling_strategy': 'all'}. Best is trial 17 with value: 0.800705.
Trial 28 finished with value: 0.193022146748611 and parameters: {'rusbc_n_estimators': 100, 'rusbc_learning_rate': 0.15506814718466724, 'rusbc_sampling_strategy': 'all'}. Best is trial 17 with value: 0.800705.
Trial 29 finished with value: 0.22292316026605463 and parameters: {'rusbc_n_estimators': 100, 'rusbc_learning_rate': 0.10418785384635193, 'rusbc_sampling_strategy': 'all'}. Best is trial 17 with value: 0.800705.
A new study created in RDB with name: SGDClassifier_f33849d8
Trial 2 finished with value: 0.6950742018218817 and parameters: {'sgdc_loss': 'modified_huber', 'sgdc_penalty': 'elasticnet', 'sgdc_alpha': 10.87524573134633, 'sgdc_l1_ratio': 0.4, 'sgdc_learning_rate': 'constant', 'sgdc_eta0': 1.0350722875363534, 'sgdc_early_stopping': True, 'sgdc_validation_fraction': 0.25, 'sgdc_n_iter_no_change': 10}. Best is trial 2 with value: 0.695074.
Trial 7 finished with value: 0.6950721976737666 and parameters: {'sgdc_loss': 'hinge', 'sgdc_penalty': 'elasticnet', 'sgdc_alpha': 0.11912233644791416, 'sgdc_l1_ratio': 0.6000000000000001, 'sgdc_learning_rate': 'constant', 'sgdc_eta0': 0.8396453047819311, 'sgdc_early_stopping': True, 'sgdc_validation_fraction': 0.25, 'sgdc_n_iter_no_change': 10}. Best is trial 2 with value: 0.695074.
Trial 3 finished with value: 0.7881493404613873 and parameters: {'sgdc_loss': 'hinge', 'sgdc_penalty': 'elasticnet', 'sgdc_alpha': 0.2608674718474794, 'sgdc_l1_ratio': 0.6000000000000001, 'sgdc_learning_rate': 'optimal', 'sgdc_eta0': 51.924453475961585, 'sgdc_early_stopping': True, 'sgdc_validation_fraction': 0.25, 'sgdc_n_iter_no_change': 10}. Best is trial 3 with value: 0.788149.
Trial 4 finished with value: 0.3781138193923855 and parameters: {'sgdc_loss': 'hinge', 'sgdc_penalty': 'elasticnet', 'sgdc_alpha': 0.7626229437888201, 'sgdc_l1_ratio': 0.2, 'sgdc_learning_rate': 'invscaling', 'sgdc_eta0': 3.0593133867146376, 'sgdc_early_stopping': True, 'sgdc_validation_fraction': 0.25, 'sgdc_n_iter_no_change': 10}. Best is trial 3 with value: 0.788149.
Trial 5 finished with value: 0.7334502440010411 and parameters: {'sgdc_loss': 'squared_hinge', 'sgdc_penalty': 'elasticnet', 'sgdc_alpha': 0.046017419877237495, 'sgdc_l1_ratio': 0.8, 'sgdc_learning_rate': 'invscaling', 'sgdc_eta0': 405.0692094559897, 'sgdc_early_stopping': True, 'sgdc_validation_fraction': 0.25, 'sgdc_n_iter_no_change': 10}. Best is trial 3 with value: 0.788149.
Trial 0 finished with value: 0.35961154822649805 and parameters: {'sgdc_loss': 'squared_hinge', 'sgdc_penalty': 'elasticnet', 'sgdc_alpha': 0.024444957030305258, 'sgdc_l1_ratio': 0.0, 'sgdc_learning_rate': 'invscaling', 'sgdc_eta0': 272.8315290162065, 'sgdc_early_stopping': True, 'sgdc_validation_fraction': 0.25, 'sgdc_n_iter_no_change': 10}. Best is trial 3 with value: 0.788149.
Trial 11 finished with value: 0.6950742018218817 and parameters: {'sgdc_loss': 'hinge', 'sgdc_penalty': 'elasticnet', 'sgdc_alpha': 581.6515266918349, 'sgdc_l1_ratio': 0.4, 'sgdc_learning_rate': 'optimal', 'sgdc_eta0': 0.027898548551949922, 'sgdc_early_stopping': True, 'sgdc_validation_fraction': 0.25, 'sgdc_n_iter_no_change': 10}. Best is trial 3 with value: 0.788149.
Trial 10 finished with value: 0.7464017194066375 and parameters: {'sgdc_loss': 'modified_huber', 'sgdc_penalty': 'elasticnet', 'sgdc_alpha': 0.0003071639817162391, 'sgdc_l1_ratio': 0.6000000000000001, 'sgdc_learning_rate': 'invscaling', 'sgdc_eta0': 0.11754729305479847, 'sgdc_early_stopping': True, 'sgdc_validation_fraction': 0.25, 'sgdc_n_iter_no_change': 10}. Best is trial 3 with value: 0.788149.
Trial 9 finished with value: 0.7586653722240058 and parameters: {'sgdc_loss': 'log', 'sgdc_penalty': 'elasticnet', 'sgdc_alpha': 0.08908259537780364, 'sgdc_l1_ratio': 1.0, 'sgdc_learning_rate': 'invscaling', 'sgdc_eta0': 0.007705854430149939, 'sgdc_early_stopping': True, 'sgdc_validation_fraction': 0.25, 'sgdc_n_iter_no_change': 10}. Best is trial 3 with value: 0.788149.
Trial 12 finished with value: 0.794313596612662 and parameters: {'sgdc_loss': 'squared_hinge', 'sgdc_penalty': 'elasticnet', 'sgdc_alpha': 0.05324139294676432, 'sgdc_l1_ratio': 1.0, 'sgdc_learning_rate': 'invscaling', 'sgdc_eta0': 1.0935622338515798, 'sgdc_early_stopping': True, 'sgdc_validation_fraction': 0.25, 'sgdc_n_iter_no_change': 10}. Best is trial 12 with value: 0.794314.
Trial 13 finished with value: 0.8642449592292896 and parameters: {'sgdc_loss': 'modified_huber', 'sgdc_penalty': 'elasticnet', 'sgdc_alpha': 0.04601822306934954, 'sgdc_l1_ratio': 0.8, 'sgdc_learning_rate': 'optimal', 'sgdc_eta0': 40.36395472708371, 'sgdc_early_stopping': True, 'sgdc_validation_fraction': 0.25, 'sgdc_n_iter_no_change': 10}. Best is trial 13 with value: 0.864245.
Trial 14 finished with value: 0.794277072207342 and parameters: {'sgdc_loss': 'hinge', 'sgdc_penalty': 'elasticnet', 'sgdc_alpha': 12.726407974850929, 'sgdc_l1_ratio': 0.6000000000000001, 'sgdc_learning_rate': 'invscaling', 'sgdc_eta0': 0.014706229866968944, 'sgdc_early_stopping': True, 'sgdc_validation_fraction': 0.25, 'sgdc_n_iter_no_change': 10}. Best is trial 13 with value: 0.864245.
Trial 16 finished with value: 0.7233213807878047 and parameters: {'sgdc_loss': 'log', 'sgdc_penalty': 'elasticnet', 'sgdc_alpha': 3.9252858113351907, 'sgdc_l1_ratio': 0.8, 'sgdc_learning_rate': 'optimal', 'sgdc_eta0': 7.496589566342641, 'sgdc_early_stopping': True, 'sgdc_validation_fraction': 0.25, 'sgdc_n_iter_no_change': 10}. Best is trial 13 with value: 0.864245.
Trial 15 finished with value: 0.7492816802879259 and parameters: {'sgdc_loss': 'squared_hinge', 'sgdc_penalty': 'elasticnet', 'sgdc_alpha': 0.0007486762075411257, 'sgdc_l1_ratio': 0.0, 'sgdc_learning_rate': 'adaptive', 'sgdc_eta0': 0.004247999354589795, 'sgdc_early_stopping': True, 'sgdc_validation_fraction': 0.25, 'sgdc_n_iter_no_change': 10}. Best is trial 13 with value: 0.864245.
Trial 1 finished with value: 0.6918808793241961 and parameters: {'sgdc_loss': 'modified_huber', 'sgdc_penalty': 'elasticnet', 'sgdc_alpha': 0.0005772009922092041, 'sgdc_l1_ratio': 0.6000000000000001, 'sgdc_learning_rate': 'adaptive', 'sgdc_eta0': 3.166172456363868, 'sgdc_early_stopping': True, 'sgdc_validation_fraction': 0.25, 'sgdc_n_iter_no_change': 10}. Best is trial 13 with value: 0.864245.
Trial 6 finished with value: 0.7276713833551056 and parameters: {'sgdc_loss': 'squared_hinge', 'sgdc_penalty': 'elasticnet', 'sgdc_alpha': 780.0876149427074, 'sgdc_l1_ratio': 0.6000000000000001, 'sgdc_learning_rate': 'adaptive', 'sgdc_eta0': 13.003711568025363, 'sgdc_early_stopping': True, 'sgdc_validation_fraction': 0.25, 'sgdc_n_iter_no_change': 10}. Best is trial 13 with value: 0.864245.
Trial 22 finished with value: 0.7459271802214439 and parameters: {'sgdc_loss': 'squared_hinge', 'sgdc_penalty': 'elasticnet', 'sgdc_alpha': 2.9507294910760715e-06, 'sgdc_l1_ratio': 1.0, 'sgdc_learning_rate': 'optimal', 'sgdc_eta0': 42.28778484556665, 'sgdc_early_stopping': True, 'sgdc_validation_fraction': 0.25, 'sgdc_n_iter_no_change': 10}. Best is trial 13 with value: 0.864245.
Trial 23 finished with value: 0.13632974329415398 and parameters: {'sgdc_loss': 'modified_huber', 'sgdc_penalty': 'elasticnet', 'sgdc_alpha': 3.336854717213384e-06, 'sgdc_l1_ratio': 1.0, 'sgdc_learning_rate': 'optimal', 'sgdc_eta0': 48.261248133817006, 'sgdc_early_stopping': True, 'sgdc_validation_fraction': 0.25, 'sgdc_n_iter_no_change': 10}. Best is trial 13 with value: 0.864245.
Trial 24 finished with value: 0.7256442230659967 and parameters: {'sgdc_loss': 'modified_huber', 'sgdc_penalty': 'elasticnet', 'sgdc_alpha': 0.006900898267778287, 'sgdc_l1_ratio': 1.0, 'sgdc_learning_rate': 'optimal', 'sgdc_eta0': 0.18823424570929229, 'sgdc_early_stopping': True, 'sgdc_validation_fraction': 0.25, 'sgdc_n_iter_no_change': 10}. Best is trial 13 with value: 0.864245.
Trial 18 finished with value: 0.6989131411933092 and parameters: {'sgdc_loss': 'squared_hinge', 'sgdc_penalty': 'elasticnet', 'sgdc_alpha': 0.0003376247952183326, 'sgdc_l1_ratio': 1.0, 'sgdc_learning_rate': 'adaptive', 'sgdc_eta0': 13.167785285290163, 'sgdc_early_stopping': True, 'sgdc_validation_fraction': 0.25, 'sgdc_n_iter_no_change': 10}. Best is trial 13 with value: 0.864245.
Trial 25 finished with value: 0.7341815449503153 and parameters: {'sgdc_loss': 'modified_huber', 'sgdc_penalty': 'elasticnet', 'sgdc_alpha': 0.0035721295830439827, 'sgdc_l1_ratio': 0.8, 'sgdc_learning_rate': 'constant', 'sgdc_eta0': 0.46772843892906585, 'sgdc_early_stopping': True, 'sgdc_validation_fraction': 0.25, 'sgdc_n_iter_no_change': 10}. Best is trial 13 with value: 0.864245.
Trial 17 finished with value: 0.7175594429232024 and parameters: {'sgdc_loss': 'squared_hinge', 'sgdc_penalty': 'elasticnet', 'sgdc_alpha': 2.769446775510533e-06, 'sgdc_l1_ratio': 1.0, 'sgdc_learning_rate': 'adaptive', 'sgdc_eta0': 9.82148536718226, 'sgdc_early_stopping': True, 'sgdc_validation_fraction': 0.25, 'sgdc_n_iter_no_change': 10}. Best is trial 13 with value: 0.864245.
Trial 26 finished with value: 0.15497002861975345 and parameters: {'sgdc_loss': 'log', 'sgdc_penalty': 'elasticnet', 'sgdc_alpha': 3.9825913174606325e-05, 'sgdc_l1_ratio': 0.8, 'sgdc_learning_rate': 'constant', 'sgdc_eta0': 0.2304614346571919, 'sgdc_early_stopping': True, 'sgdc_validation_fraction': 0.25, 'sgdc_n_iter_no_change': 10}. Best is trial 13 with value: 0.864245.
Trial 20 finished with value: 0.7209181357080798 and parameters: {'sgdc_loss': 'squared_hinge', 'sgdc_penalty': 'elasticnet', 'sgdc_alpha': 0.0005670669702041355, 'sgdc_l1_ratio': 1.0, 'sgdc_learning_rate': 'adaptive', 'sgdc_eta0': 30.990784059607126, 'sgdc_early_stopping': True, 'sgdc_validation_fraction': 0.25, 'sgdc_n_iter_no_change': 10}. Best is trial 13 with value: 0.864245.
Trial 27 finished with value: 0.7334130402555766 and parameters: {'sgdc_loss': 'log', 'sgdc_penalty': 'elasticnet', 'sgdc_alpha': 0.0040324457968985445, 'sgdc_l1_ratio': 0.8, 'sgdc_learning_rate': 'constant', 'sgdc_eta0': 0.31390312570644113, 'sgdc_early_stopping': True, 'sgdc_validation_fraction': 0.25, 'sgdc_n_iter_no_change': 10}. Best is trial 13 with value: 0.864245.
Trial 8 finished with value: 0.6945961792068678 and parameters: {'sgdc_loss': 'log', 'sgdc_penalty': 'elasticnet', 'sgdc_alpha': 1.392843905808617, 'sgdc_l1_ratio': 0.0, 'sgdc_learning_rate': 'adaptive', 'sgdc_eta0': 203.58068716725325, 'sgdc_early_stopping': True, 'sgdc_validation_fraction': 0.25, 'sgdc_n_iter_no_change': 10}. Best is trial 13 with value: 0.864245.
Trial 19 finished with value: 0.6989141600190808 and parameters: {'sgdc_loss': 'squared_hinge', 'sgdc_penalty': 'elasticnet', 'sgdc_alpha': 0.00026217373584988513, 'sgdc_l1_ratio': 1.0, 'sgdc_learning_rate': 'adaptive', 'sgdc_eta0': 12.8759946281707, 'sgdc_early_stopping': True, 'sgdc_validation_fraction': 0.25, 'sgdc_n_iter_no_change': 10}. Best is trial 13 with value: 0.864245.
Trial 28 finished with value: 0.4076001262159745 and parameters: {'sgdc_loss': 'hinge', 'sgdc_penalty': 'elasticnet', 'sgdc_alpha': 50.077400252244736, 'sgdc_l1_ratio': 0.8, 'sgdc_learning_rate': 'invscaling', 'sgdc_eta0': 0.0015778726984187108, 'sgdc_early_stopping': True, 'sgdc_validation_fraction': 0.25, 'sgdc_n_iter_no_change': 10}. Best is trial 13 with value: 0.864245.
Trial 29 finished with value: 0.3858664885442267 and parameters: {'sgdc_loss': 'hinge', 'sgdc_penalty': 'elasticnet', 'sgdc_alpha': 33.62099795707134, 'sgdc_l1_ratio': 0.8, 'sgdc_learning_rate': 'invscaling', 'sgdc_eta0': 0.0013864205066250758, 'sgdc_early_stopping': True, 'sgdc_validation_fraction': 0.25, 'sgdc_n_iter_no_change': 10}. Best is trial 13 with value: 0.864245.
Trial 21 finished with value: 0.699183017264368 and parameters: {'sgdc_loss': 'modified_huber', 'sgdc_penalty': 'elasticnet', 'sgdc_alpha': 1.0656188609952561e-06, 'sgdc_l1_ratio': 1.0, 'sgdc_learning_rate': 'adaptive', 'sgdc_eta0': 31.346389722935488, 'sgdc_early_stopping': True, 'sgdc_validation_fraction': 0.25, 'sgdc_n_iter_no_change': 10}. Best is trial 13 with value: 0.864245.
A new study created in RDB with name: VeryFastDecisionRulesClassifier_f33849d8
Trial 5 finished with value: 0.5001432395949063 and parameters: {'vfdrc_ordered_rules': False, 'vfdrc_grace_period': 300, 'vfdrc_tie_threshold': 0.1, 'vfdrc_rule_prediction': 'first_hit', 'vfdrc_max_rules': 15, 'vfdrc_expand_criterion': 'info_gain', 'vfdrc_remove_poor_atts': True}. Best is trial 5 with value: 0.500143.
Trial 2 finished with value: 0.1790512807386793 and parameters: {'vfdrc_ordered_rules': False, 'vfdrc_grace_period': 250, 'vfdrc_tie_threshold': 0.05, 'vfdrc_rule_prediction': 'first_hit', 'vfdrc_max_rules': 20, 'vfdrc_expand_criterion': 'hellinger', 'vfdrc_remove_poor_atts': False}. Best is trial 5 with value: 0.500143.
Trial 0 finished with value: 0.5730449964320393 and parameters: {'vfdrc_ordered_rules': True, 'vfdrc_grace_period': 400, 'vfdrc_tie_threshold': 0.7000000000000001, 'vfdrc_rule_prediction': 'weighted_sum', 'vfdrc_max_rules': 20, 'vfdrc_expand_criterion': 'info_gain', 'vfdrc_remove_poor_atts': True}. Best is trial 0 with value: 0.573045.
Trial 4 finished with value: 0.4763976369377389 and parameters: {'vfdrc_ordered_rules': True, 'vfdrc_grace_period': 250, 'vfdrc_tie_threshold': 0.35000000000000003, 'vfdrc_rule_prediction': 'weighted_max', 'vfdrc_max_rules': 30, 'vfdrc_expand_criterion': 'foil_gain', 'vfdrc_remove_poor_atts': False}. Best is trial 0 with value: 0.573045.
Trial 6 finished with value: 0.749426850629697 and parameters: {'vfdrc_ordered_rules': True, 'vfdrc_grace_period': 100, 'vfdrc_tie_threshold': 1.0, 'vfdrc_rule_prediction': 'first_hit', 'vfdrc_max_rules': 25, 'vfdrc_expand_criterion': 'info_gain', 'vfdrc_remove_poor_atts': False}. Best is trial 6 with value: 0.749427.
Trial 3 finished with value: 0.08390090326518712 and parameters: {'vfdrc_ordered_rules': False, 'vfdrc_grace_period': 300, 'vfdrc_tie_threshold': 0.7000000000000001, 'vfdrc_rule_prediction': 'first_hit', 'vfdrc_max_rules': 40, 'vfdrc_expand_criterion': 'hellinger', 'vfdrc_remove_poor_atts': False}. Best is trial 6 with value: 0.749427.
Trial 7 finished with value: 0.15069497100133744 and parameters: {'vfdrc_ordered_rules': True, 'vfdrc_grace_period': 150, 'vfdrc_tie_threshold': 0.8, 'vfdrc_rule_prediction': 'weighted_sum', 'vfdrc_max_rules': 15, 'vfdrc_expand_criterion': 'hellinger', 'vfdrc_remove_poor_atts': True}. Best is trial 6 with value: 0.749427.
Trial 1 finished with value: 0.1834807586204652 and parameters: {'vfdrc_ordered_rules': True, 'vfdrc_grace_period': 200, 'vfdrc_tie_threshold': 0.1, 'vfdrc_rule_prediction': 'weighted_sum', 'vfdrc_max_rules': 10, 'vfdrc_expand_criterion': 'foil_gain', 'vfdrc_remove_poor_atts': False}. Best is trial 6 with value: 0.749427.
Trial 9 finished with value: 0.09345687129838284 and parameters: {'vfdrc_ordered_rules': False, 'vfdrc_grace_period': 350, 'vfdrc_tie_threshold': 0.6000000000000001, 'vfdrc_rule_prediction': 'weighted_max', 'vfdrc_max_rules': 20, 'vfdrc_expand_criterion': 'foil_gain', 'vfdrc_remove_poor_atts': True}. Best is trial 6 with value: 0.749427.
Trial 10 finished with value: 0.157970707754502 and parameters: {'vfdrc_ordered_rules': False, 'vfdrc_grace_period': 200, 'vfdrc_tie_threshold': 0.25, 'vfdrc_rule_prediction': 'first_hit', 'vfdrc_max_rules': 10, 'vfdrc_expand_criterion': 'foil_gain', 'vfdrc_remove_poor_atts': False}. Best is trial 6 with value: 0.749427.
Trial 8 finished with value: 0.6681226866202102 and parameters: {'vfdrc_ordered_rules': True, 'vfdrc_grace_period': 400, 'vfdrc_tie_threshold': 0.15000000000000002, 'vfdrc_rule_prediction': 'weighted_sum', 'vfdrc_max_rules': 30, 'vfdrc_expand_criterion': 'info_gain', 'vfdrc_remove_poor_atts': True}. Best is trial 6 with value: 0.749427.
Trial 11 finished with value: 0.08394332376333051 and parameters: {'vfdrc_ordered_rules': False, 'vfdrc_grace_period': 250, 'vfdrc_tie_threshold': 0.65, 'vfdrc_rule_prediction': 'first_hit', 'vfdrc_max_rules': 30, 'vfdrc_expand_criterion': 'hellinger', 'vfdrc_remove_poor_atts': False}. Best is trial 6 with value: 0.749427.
Trial 12 finished with value: 0.1470823618812094 and parameters: {'vfdrc_ordered_rules': False, 'vfdrc_grace_period': 300, 'vfdrc_tie_threshold': 0.5, 'vfdrc_rule_prediction': 'weighted_max', 'vfdrc_max_rules': 20, 'vfdrc_expand_criterion': 'foil_gain', 'vfdrc_remove_poor_atts': False}. Best is trial 6 with value: 0.749427.
