Trial 25 finished with value: 0.999878210760157 and parameters: {'lgbm_num_leaves': 63, 'lgbm_learning_rate': 0.04004467633667224, 'lgbm_n_estimators': 100, 'lgbm_reg_alpha': 0.0, 'lgbm_reg_lambda': 0.5}. Best is trial 23 with value: 0.999896.
Trial 22 finished with value: 0.6778297967131817 and parameters: {'lgbm_num_leaves': 127, 'lgbm_learning_rate': 0.04474114346965361, 'lgbm_n_estimators': 200, 'lgbm_reg_alpha': 0.5, 'lgbm_reg_lambda': 0.0}. Best is trial 23 with value: 0.999896.
Trial 27 finished with value: 0.9998757290975566 and parameters: {'lgbm_num_leaves': 63, 'lgbm_learning_rate': 0.04817888597361413, 'lgbm_n_estimators': 80, 'lgbm_reg_alpha': 0.0, 'lgbm_reg_lambda': 0.55}. Best is trial 23 with value: 0.999896.
Trial 26 finished with value: 0.9998657855782046 and parameters: {'lgbm_num_leaves': 63, 'lgbm_learning_rate': 0.03331761310059271, 'lgbm_n_estimators': 100, 'lgbm_reg_alpha': 0.0, 'lgbm_reg_lambda': 0.5}. Best is trial 23 with value: 0.999896.
Trial 28 finished with value: 0.9998881624166216 and parameters: {'lgbm_num_leaves': 127, 'lgbm_learning_rate': 0.04682189982380544, 'lgbm_n_estimators': 100, 'lgbm_reg_alpha': 0.0, 'lgbm_reg_lambda': 0.55}. Best is trial 23 with value: 0.999896.
Trial 29 finished with value: 0.9998881594974568 and parameters: {'lgbm_num_leaves': 63, 'lgbm_learning_rate': 0.06044578674007649, 'lgbm_n_estimators': 100, 'lgbm_reg_alpha': 0.0, 'lgbm_reg_lambda': 0.55}. Best is trial 23 with value: 0.999896.
A new study created in RDB with name: LinearDiscriminantAnalysis_f33849d8
Trial 1 finished with value: 0.707365175921671 and parameters: {'lda_solver': 'svd', 'lda_n_components': 5}. Best is trial 1 with value: 0.707365.
Trial 0 finished with value: 0.707365175921671 and parameters: {'lda_solver': 'svd', 'lda_n_components': 3}. Best is trial 0 with value: 0.707365.
Trial 6 finished with value: 0.6950742018218817 and parameters: {'lda_solver': 'lsqr', 'lda_n_components': 3, 'lda_tol': 0.001}. Best is trial 0 with value: 0.707365.
Trial 5 finished with value: 0.6950742018218817 and parameters: {'lda_solver': 'lsqr', 'lda_n_components': 2, 'lda_tol': 0.0001}. Best is trial 0 with value: 0.707365.
Trial 2 finished with value: 0.6950742018218817 and parameters: {'lda_solver': 'lsqr', 'lda_n_components': 3, 'lda_tol': 0.001}. Best is trial 0 with value: 0.707365.
Trial 4 finished with value: 0.7077867894758822 and parameters: {'lda_solver': 'eigen', 'lda_n_components': 6, 'lda_tol': 1e-05}. Best is trial 3 with value: 0.707787.
Trial 3 finished with value: 0.7077867894758822 and parameters: {'lda_solver': 'eigen', 'lda_n_components': 4, 'lda_tol': 0.0001}. Best is trial 3 with value: 0.707787.
Trial 7 finished with value: 0.7077867894758822 and parameters: {'lda_solver': 'eigen', 'lda_n_components': 4, 'lda_tol': 1e-05}. Best is trial 3 with value: 0.707787.
Trial 9 finished with value: 0.707365175921671 and parameters: {'lda_solver': 'svd', 'lda_n_components': 7}. Best is trial 3 with value: 0.707787.
Trial 12 finished with value: 0.707365175921671 and parameters: {'lda_solver': 'svd', 'lda_n_components': 7}. Best is trial 3 with value: 0.707787.
Trial 10 finished with value: 0.6950742018218817 and parameters: {'lda_solver': 'lsqr', 'lda_n_components': 6, 'lda_tol': 1e-05}. Best is trial 3 with value: 0.707787.
Trial 14 finished with value: 0.707365175921671 and parameters: {'lda_solver': 'svd', 'lda_n_components': 6}. Best is trial 3 with value: 0.707787.
Trial 8 finished with value: 0.7077867894758822 and parameters: {'lda_solver': 'eigen', 'lda_n_components': 1, 'lda_tol': 0.001}. Best is trial 3 with value: 0.707787.
Trial 13 finished with value: 0.6950742018218817 and parameters: {'lda_solver': 'lsqr', 'lda_n_components': 1, 'lda_tol': 0.001}. Best is trial 3 with value: 0.707787.
Trial 11 finished with value: 0.7077867894758822 and parameters: {'lda_solver': 'eigen', 'lda_n_components': 7, 'lda_tol': 1e-05}. Best is trial 3 with value: 0.707787.
Trial 15 finished with value: 0.7077867894758822 and parameters: {'lda_solver': 'eigen', 'lda_n_components': 6, 'lda_tol': 0.0001}. Best is trial 15 with value: 0.707787.
Trial 16 finished with value: 0.707365175921671 and parameters: {'lda_solver': 'svd', 'lda_n_components': 5}. Best is trial 3 with value: 0.707787.
Trial 17 finished with value: 0.7077867894758822 and parameters: {'lda_solver': 'eigen', 'lda_n_components': 1, 'lda_tol': 0.0001}. Best is trial 17 with value: 0.707787.
Trial 18 finished with value: 0.7077867894758822 and parameters: {'lda_solver': 'eigen', 'lda_n_components': 5, 'lda_tol': 0.0001}. Best is trial 18 with value: 0.707787.
Trial 19 finished with value: 0.7077867894758822 and parameters: {'lda_solver': 'eigen', 'lda_n_components': 1, 'lda_tol': 0.0001}. Best is trial 19 with value: 0.707787.
Trial 20 finished with value: 0.7077867894758822 and parameters: {'lda_solver': 'eigen', 'lda_n_components': 5, 'lda_tol': 0.0001}. Best is trial 20 with value: 0.707787.
Trial 21 finished with value: 0.7077867894758822 and parameters: {'lda_solver': 'eigen', 'lda_n_components': 5, 'lda_tol': 0.0001}. Best is trial 21 with value: 0.707787.
Trial 22 finished with value: 0.7077867894758822 and parameters: {'lda_solver': 'eigen', 'lda_n_components': 5, 'lda_tol': 0.0001}. Best is trial 22 with value: 0.707787.
Trial 23 finished with value: 0.7077867894758822 and parameters: {'lda_solver': 'eigen', 'lda_n_components': 5, 'lda_tol': 0.0001}. Best is trial 23 with value: 0.707787.
Trial 24 finished with value: 0.7077867894758822 and parameters: {'lda_solver': 'eigen', 'lda_n_components': 1, 'lda_tol': 0.0001}. Best is trial 24 with value: 0.707787.
Trial 25 finished with value: 0.7077867894758822 and parameters: {'lda_solver': 'eigen', 'lda_n_components': 5, 'lda_tol': 0.0001}. Best is trial 25 with value: 0.707787.
Trial 27 finished with value: 0.7077867894758822 and parameters: {'lda_solver': 'eigen', 'lda_n_components': 2, 'lda_tol': 0.0001}. Best is trial 27 with value: 0.707787.
Trial 26 finished with value: 0.7077867894758822 and parameters: {'lda_solver': 'eigen', 'lda_n_components': 2, 'lda_tol': 0.0001}. Best is trial 27 with value: 0.707787.
Trial 29 finished with value: 0.7077867894758822 and parameters: {'lda_solver': 'eigen', 'lda_n_components': 2, 'lda_tol': 1e-05}. Best is trial 29 with value: 0.707787.
Trial 28 finished with value: 0.7077867894758822 and parameters: {'lda_solver': 'eigen', 'lda_n_components': 5, 'lda_tol': 1e-05}. Best is trial 29 with value: 0.707787.
Trial 30 finished with value: 0.7077867894758822 and parameters: {'lda_solver': 'eigen', 'lda_n_components': 2, 'lda_tol': 1e-05}. Best is trial 30 with value: 0.707787.
A new study created in RDB with name: LinearSVC_f33849d8
Trial 0 finished with value: 0.6951098341920565 and parameters: {'lsvc_dual': False, 'lsvc_C': 23.386906560080376, 'lsvc_max_iter': 2000}. Best is trial 0 with value: 0.69511.
Trial 1 finished with value: 0.6951098341920565 and parameters: {'lsvc_dual': False, 'lsvc_C': 16.554193067706628, 'lsvc_max_iter': 2000}. Best is trial 0 with value: 0.69511.
Trial 2 finished with value: 0.6951098341920565 and parameters: {'lsvc_dual': False, 'lsvc_C': 115.01242357812322, 'lsvc_max_iter': 2000}. Best is trial 0 with value: 0.69511.
Trial 3 finished with value: 0.6951098341920565 and parameters: {'lsvc_dual': False, 'lsvc_C': 0.29409849624632034, 'lsvc_max_iter': 2000}. Best is trial 0 with value: 0.69511.
Trial 4 finished with value: 0.6951098341920565 and parameters: {'lsvc_dual': False, 'lsvc_C': 10.039439856214482, 'lsvc_max_iter': 2000}. Best is trial 0 with value: 0.69511.
Trial 5 finished with value: 0.6951098341920565 and parameters: {'lsvc_dual': False, 'lsvc_C': 4.083667661360021, 'lsvc_max_iter': 2000}. Best is trial 0 with value: 0.69511.
Trial 6 finished with value: 0.6951098341920565 and parameters: {'lsvc_dual': False, 'lsvc_C': 3.042509505285739e-06, 'lsvc_max_iter': 2000}. Best is trial 0 with value: 0.69511.
Trial 7 finished with value: 0.6951098341920565 and parameters: {'lsvc_dual': False, 'lsvc_C': 2.4342393926979895e-06, 'lsvc_max_iter': 2000}. Best is trial 0 with value: 0.69511.
Trial 8 finished with value: 0.6951098341920565 and parameters: {'lsvc_dual': False, 'lsvc_C': 25.424589697719078, 'lsvc_max_iter': 2000}. Best is trial 0 with value: 0.69511.
Trial 9 finished with value: 0.6951098341920565 and parameters: {'lsvc_dual': False, 'lsvc_C': 47.07718132350264, 'lsvc_max_iter': 2000}. Best is trial 0 with value: 0.69511.
Trial 10 finished with value: 0.6951098341920565 and parameters: {'lsvc_dual': False, 'lsvc_C': 0.004610638116406268, 'lsvc_max_iter': 2000}. Best is trial 0 with value: 0.69511.
Trial 11 finished with value: 0.6951098341920565 and parameters: {'lsvc_dual': False, 'lsvc_C': 0.013222436736329479, 'lsvc_max_iter': 2000}. Best is trial 0 with value: 0.69511.
Trial 12 finished with value: 0.6951098341920565 and parameters: {'lsvc_dual': False, 'lsvc_C': 831.8988491640506, 'lsvc_max_iter': 2000}. Best is trial 0 with value: 0.69511.
Trial 13 finished with value: 0.6951098341920565 and parameters: {'lsvc_dual': False, 'lsvc_C': 0.3706584296393785, 'lsvc_max_iter': 2000}. Best is trial 0 with value: 0.69511.
Trial 14 finished with value: 0.6951098341920565 and parameters: {'lsvc_dual': False, 'lsvc_C': 0.0007884172922057244, 'lsvc_max_iter': 2000}. Best is trial 0 with value: 0.69511.
Trial 15 finished with value: 0.6951098341920565 and parameters: {'lsvc_dual': False, 'lsvc_C': 0.6740018049060419, 'lsvc_max_iter': 2000}. Best is trial 0 with value: 0.69511.
Trial 16 finished with value: 0.6951098341920565 and parameters: {'lsvc_dual': False, 'lsvc_C': 707.8738000584342, 'lsvc_max_iter': 2000}. Best is trial 0 with value: 0.69511.
Trial 17 finished with value: 0.6951098341920565 and parameters: {'lsvc_dual': False, 'lsvc_C': 0.0002993016329485476, 'lsvc_max_iter': 2000}. Best is trial 0 with value: 0.69511.
Trial 18 finished with value: 0.6951098341920565 and parameters: {'lsvc_dual': False, 'lsvc_C': 0.4106916957716587, 'lsvc_max_iter': 2000}. Best is trial 0 with value: 0.69511.
Trial 19 finished with value: 0.6951098341920565 and parameters: {'lsvc_dual': False, 'lsvc_C': 865.3169474610133, 'lsvc_max_iter': 2000}. Best is trial 0 with value: 0.69511.
Trial 20 finished with value: 0.6951098341920565 and parameters: {'lsvc_dual': False, 'lsvc_C': 6.0363362452568025e-05, 'lsvc_max_iter': 2000}. Best is trial 0 with value: 0.69511.
Trial 21 finished with value: 0.6951098341920565 and parameters: {'lsvc_dual': False, 'lsvc_C': 0.0013770104333695207, 'lsvc_max_iter': 2000}. Best is trial 0 with value: 0.69511.
Trial 22 finished with value: 0.6951098341920565 and parameters: {'lsvc_dual': False, 'lsvc_C': 0.0907673019097304, 'lsvc_max_iter': 2000}. Best is trial 0 with value: 0.69511.
A new study created in RDB with name: LinearSVC_AdditiveChi2Sampler_f33849d8
Trial 0 finished with value: 0.6950742018218817 and parameters: {'lsvc_ac2s_kernel_sample_steps': 2, 'lsvc_ac2s_dual': False, 'lsvc_ac2s_C': 0.0007754459521183028, 'lsvc_ac2s_max_iter': 2000}. Best is trial 0 with value: 0.695074.
Trial 1 finished with value: 0.6950742018218817 and parameters: {'lsvc_ac2s_kernel_sample_steps': 2, 'lsvc_ac2s_dual': False, 'lsvc_ac2s_C': 0.07382441215839843, 'lsvc_ac2s_max_iter': 2000}. Best is trial 0 with value: 0.695074.
Trial 2 finished with value: 0.6950742018218817 and parameters: {'lsvc_ac2s_kernel_sample_steps': 3, 'lsvc_ac2s_dual': False, 'lsvc_ac2s_C': 7.497356851431705e-06, 'lsvc_ac2s_max_iter': 2000}. Best is trial 0 with value: 0.695074.
Trial 3 finished with value: 0.6950742018218817 and parameters: {'lsvc_ac2s_kernel_sample_steps': 3, 'lsvc_ac2s_dual': False, 'lsvc_ac2s_C': 2.5558417112095754e-06, 'lsvc_ac2s_max_iter': 2000}. Best is trial 0 with value: 0.695074.
Trial 4 finished with value: 0.6950742018218817 and parameters: {'lsvc_ac2s_kernel_sample_steps': 3, 'lsvc_ac2s_dual': False, 'lsvc_ac2s_C': 0.4326467401006698, 'lsvc_ac2s_max_iter': 2000}. Best is trial 0 with value: 0.695074.
Trial 5 finished with value: 0.6950742018218817 and parameters: {'lsvc_ac2s_kernel_sample_steps': 1, 'lsvc_ac2s_dual': False, 'lsvc_ac2s_C': 0.0004498973100162112, 'lsvc_ac2s_max_iter': 2000}. Best is trial 0 with value: 0.695074.
Trial 6 finished with value: 0.6950742018218817 and parameters: {'lsvc_ac2s_kernel_sample_steps': 1, 'lsvc_ac2s_dual': False, 'lsvc_ac2s_C': 0.0026467364258402257, 'lsvc_ac2s_max_iter': 2000}. Best is trial 0 with value: 0.695074.
Trial 7 finished with value: 0.6950742018218817 and parameters: {'lsvc_ac2s_kernel_sample_steps': 2, 'lsvc_ac2s_dual': False, 'lsvc_ac2s_C': 3.9623855566474085e-06, 'lsvc_ac2s_max_iter': 2000}. Best is trial 0 with value: 0.695074.
Trial 8 finished with value: 0.6950742018218817 and parameters: {'lsvc_ac2s_kernel_sample_steps': 1, 'lsvc_ac2s_dual': False, 'lsvc_ac2s_C': 1.1871706066634435, 'lsvc_ac2s_max_iter': 2000}. Best is trial 0 with value: 0.695074.
Trial 9 finished with value: 0.6950742018218817 and parameters: {'lsvc_ac2s_kernel_sample_steps': 3, 'lsvc_ac2s_dual': False, 'lsvc_ac2s_C': 0.0010219974214250725, 'lsvc_ac2s_max_iter': 2000}. Best is trial 0 with value: 0.695074.
Trial 10 finished with value: 0.6950742018218817 and parameters: {'lsvc_ac2s_kernel_sample_steps': 2, 'lsvc_ac2s_dual': False, 'lsvc_ac2s_C': 383.4587014450604, 'lsvc_ac2s_max_iter': 2000}. Best is trial 0 with value: 0.695074.
Trial 11 finished with value: 0.6950742018218817 and parameters: {'lsvc_ac2s_kernel_sample_steps': 2, 'lsvc_ac2s_dual': False, 'lsvc_ac2s_C': 0.11817469664661683, 'lsvc_ac2s_max_iter': 2000}. Best is trial 0 with value: 0.695074.
Trial 12 finished with value: 0.6950742018218817 and parameters: {'lsvc_ac2s_kernel_sample_steps': 2, 'lsvc_ac2s_dual': False, 'lsvc_ac2s_C': 17.10514053670184, 'lsvc_ac2s_max_iter': 2000}. Best is trial 0 with value: 0.695074.
Trial 13 finished with value: 0.6950742018218817 and parameters: {'lsvc_ac2s_kernel_sample_steps': 2, 'lsvc_ac2s_dual': False, 'lsvc_ac2s_C': 0.019065559597846865, 'lsvc_ac2s_max_iter': 2000}. Best is trial 0 with value: 0.695074.
Trial 14 finished with value: 0.6950742018218817 and parameters: {'lsvc_ac2s_kernel_sample_steps': 2, 'lsvc_ac2s_dual': False, 'lsvc_ac2s_C': 7.612644067758093e-05, 'lsvc_ac2s_max_iter': 2000}. Best is trial 0 with value: 0.695074.
Trial 15 finished with value: 0.6950742018218817 and parameters: {'lsvc_ac2s_kernel_sample_steps': 2, 'lsvc_ac2s_dual': False, 'lsvc_ac2s_C': 0.024907467190817902, 'lsvc_ac2s_max_iter': 2000}. Best is trial 0 with value: 0.695074.
Trial 16 finished with value: 0.6950742018218817 and parameters: {'lsvc_ac2s_kernel_sample_steps': 2, 'lsvc_ac2s_dual': False, 'lsvc_ac2s_C': 2.9645210488736393, 'lsvc_ac2s_max_iter': 2000}. Best is trial 0 with value: 0.695074.
Trial 17 finished with value: 0.6950742018218817 and parameters: {'lsvc_ac2s_kernel_sample_steps': 2, 'lsvc_ac2s_dual': False, 'lsvc_ac2s_C': 7.572860655623286e-05, 'lsvc_ac2s_max_iter': 2000}. Best is trial 0 with value: 0.695074.
Trial 18 finished with value: 0.6950742018218817 and parameters: {'lsvc_ac2s_kernel_sample_steps': 2, 'lsvc_ac2s_dual': False, 'lsvc_ac2s_C': 0.011119533404444309, 'lsvc_ac2s_max_iter': 2000}. Best is trial 0 with value: 0.695074.
Trial 19 finished with value: 0.6950742018218817 and parameters: {'lsvc_ac2s_kernel_sample_steps': 1, 'lsvc_ac2s_dual': False, 'lsvc_ac2s_C': 4.353186665651192, 'lsvc_ac2s_max_iter': 2000}. Best is trial 0 with value: 0.695074.
Trial 20 finished with value: 0.6950742018218817 and parameters: {'lsvc_ac2s_kernel_sample_steps': 2, 'lsvc_ac2s_dual': False, 'lsvc_ac2s_C': 8.823996294471745e-05, 'lsvc_ac2s_max_iter': 2000}. Best is trial 0 with value: 0.695074.
Trial 21 finished with value: 0.6950742018218817 and parameters: {'lsvc_ac2s_kernel_sample_steps': 2, 'lsvc_ac2s_dual': False, 'lsvc_ac2s_C': 0.003812811276886816, 'lsvc_ac2s_max_iter': 2000}. Best is trial 0 with value: 0.695074.
A new study created in RDB with name: LinearSVC_Nystroem_f33849d8
Trial 0 finished with value: 0.7681635495680512 and parameters: {'lsvc_nystroem_kernel_gamma': 0.0034589610047063265, 'lsvc_nystroem_kernel_n_components': 50, 'lsvc_nystroem_dual': False, 'lsvc_nystroem_C': 0.020217124719039272, 'lsvc_nystroem_max_iter': 2000}. Best is trial 0 with value: 0.768164.
Trial 1 finished with value: 0.7879691110325241 and parameters: {'lsvc_nystroem_kernel_gamma': 47.46009022562661, 'lsvc_nystroem_kernel_n_components': 100, 'lsvc_nystroem_dual': False, 'lsvc_nystroem_C': 13.662208120931004, 'lsvc_nystroem_max_iter': 2000}. Best is trial 1 with value: 0.787969.
Trial 2 finished with value: 0.8767697367456867 and parameters: {'lsvc_nystroem_kernel_gamma': 0.7136052932674142, 'lsvc_nystroem_kernel_n_components': 150, 'lsvc_nystroem_dual': False, 'lsvc_nystroem_C': 2.62897527093982, 'lsvc_nystroem_max_iter': 2000}. Best is trial 2 with value: 0.87677.
Trial 3 finished with value: 0.7658722580266725 and parameters: {'lsvc_nystroem_kernel_gamma': 621.548331483685, 'lsvc_nystroem_kernel_n_components': 50, 'lsvc_nystroem_dual': False, 'lsvc_nystroem_C': 0.0027358835224640136, 'lsvc_nystroem_max_iter': 2000}. Best is trial 2 with value: 0.87677.
Trial 4 finished with value: 0.7890760634614722 and parameters: {'lsvc_nystroem_kernel_gamma': 0.7606321567054776, 'lsvc_nystroem_kernel_n_components': 100, 'lsvc_nystroem_dual': False, 'lsvc_nystroem_C': 45.95878964165681, 'lsvc_nystroem_max_iter': 2000}. Best is trial 2 with value: 0.87677.
Trial 5 finished with value: 0.7879647706589985 and parameters: {'lsvc_nystroem_kernel_gamma': 63.662443417362944, 'lsvc_nystroem_kernel_n_components': 100, 'lsvc_nystroem_dual': False, 'lsvc_nystroem_C': 0.006019241463705876, 'lsvc_nystroem_max_iter': 2000}. Best is trial 2 with value: 0.87677.
Trial 6 finished with value: 0.7377874503126177 and parameters: {'lsvc_nystroem_kernel_gamma': 0.14417400128986127, 'lsvc_nystroem_kernel_n_components': 100, 'lsvc_nystroem_dual': False, 'lsvc_nystroem_C': 7.066254355915878e-06, 'lsvc_nystroem_max_iter': 2000}. Best is trial 2 with value: 0.87677.
Trial 7 finished with value: 0.8767674458162784 and parameters: {'lsvc_nystroem_kernel_gamma': 0.3677000389001726, 'lsvc_nystroem_kernel_n_components': 150, 'lsvc_nystroem_dual': False, 'lsvc_nystroem_C': 3.7362325327582777, 'lsvc_nystroem_max_iter': 2000}. Best is trial 2 with value: 0.87677.
Trial 8 finished with value: 0.7877028704601139 and parameters: {'lsvc_nystroem_kernel_gamma': 140.44072558861316, 'lsvc_nystroem_kernel_n_components': 100, 'lsvc_nystroem_dual': False, 'lsvc_nystroem_C': 0.00045778362119814427, 'lsvc_nystroem_max_iter': 2000}. Best is trial 2 with value: 0.87677.
Trial 9 finished with value: 0.7680464184802321 and parameters: {'lsvc_nystroem_kernel_gamma': 0.0026110104433227812, 'lsvc_nystroem_kernel_n_components': 50, 'lsvc_nystroem_dual': False, 'lsvc_nystroem_C': 0.0012181541100230885, 'lsvc_nystroem_max_iter': 2000}. Best is trial 2 with value: 0.87677.
Trial 10 finished with value: 0.8767679043247483 and parameters: {'lsvc_nystroem_kernel_gamma': 5.014974361099407, 'lsvc_nystroem_kernel_n_components': 150, 'lsvc_nystroem_dual': False, 'lsvc_nystroem_C': 315.05663085335544, 'lsvc_nystroem_max_iter': 2000}. Best is trial 2 with value: 0.87677.
Trial 11 finished with value: 0.8767679043247483 and parameters: {'lsvc_nystroem_kernel_gamma': 5.800594438612665, 'lsvc_nystroem_kernel_n_components': 150, 'lsvc_nystroem_dual': False, 'lsvc_nystroem_C': 515.1354377495479, 'lsvc_nystroem_max_iter': 2000}. Best is trial 2 with value: 0.87677.
Trial 12 finished with value: 0.8768137198495453 and parameters: {'lsvc_nystroem_kernel_gamma': 0.031531147702291006, 'lsvc_nystroem_kernel_n_components': 150, 'lsvc_nystroem_dual': False, 'lsvc_nystroem_C': 0.6631714554884394, 'lsvc_nystroem_max_iter': 2000}. Best is trial 12 with value: 0.876814.
Trial 13 finished with value: 0.8767651548756337 and parameters: {'lsvc_nystroem_kernel_gamma': 0.06766516856451288, 'lsvc_nystroem_kernel_n_components': 150, 'lsvc_nystroem_dual': False, 'lsvc_nystroem_C': 0.5943099575377793, 'lsvc_nystroem_max_iter': 2000}. Best is trial 12 with value: 0.876814.
Trial 14 finished with value: 0.8767873857635201 and parameters: {'lsvc_nystroem_kernel_gamma': 0.013894293377268314, 'lsvc_nystroem_kernel_n_components': 150, 'lsvc_nystroem_dual': False, 'lsvc_nystroem_C': 0.20543936330317206, 'lsvc_nystroem_max_iter': 2000}. Best is trial 12 with value: 0.876814.
A new study created in RDB with name: LinearSVC_PolynomialCountSketch_f33849d8
Trial 0 finished with value: 0.1448666631153516 and parameters: {'lsvc_pcs_kernel_gamma': 99.82296497762611, 'lsvc_pcs_kernel_n_components': 100, 'lsvc_pcs_degree': 2, 'lsvc_pcs_dual': False, 'lsvc_pcs_C': 0.00025461489441451485, 'lsvc_pcs_max_iter': 2000}. Best is trial 0 with value: 0.144867.
Trial 1 finished with value: 0.4735266193412447 and parameters: {'lsvc_pcs_kernel_gamma': 0.7877909707247702, 'lsvc_pcs_kernel_n_components': 150, 'lsvc_pcs_degree': 2, 'lsvc_pcs_dual': False, 'lsvc_pcs_C': 0.00919893510326958, 'lsvc_pcs_max_iter': 2000}. Best is trial 1 with value: 0.473527.
Trial 2 finished with value: 0.2482430900003802 and parameters: {'lsvc_pcs_kernel_gamma': 0.002855501651938834, 'lsvc_pcs_kernel_n_components': 50, 'lsvc_pcs_degree': 2, 'lsvc_pcs_dual': False, 'lsvc_pcs_C': 0.18435252556420664, 'lsvc_pcs_max_iter': 2000}. Best is trial 1 with value: 0.473527.
Trial 3 finished with value: 0.4079979664009995 and parameters: {'lsvc_pcs_kernel_gamma': 0.10607676282654666, 'lsvc_pcs_kernel_n_components': 100, 'lsvc_pcs_degree': 2, 'lsvc_pcs_dual': False, 'lsvc_pcs_C': 1.4713142603912436e-05, 'lsvc_pcs_max_iter': 2000}. Best is trial 1 with value: 0.473527.
