Trial 18 finished with value: 0.9842115565071008 and parameters: {'brf_n_estimators': 50, 'brf_criterion': 'gini', 'brf_min_samples_split': 38, 'brf_min_samples_leaf': 20, 'brf_max_features': 7, 'brf_bootstrap': False}. Best is trial 19 with value: 0.994161.
Trial 13 finished with value: 0.9871939566098189 and parameters: {'brf_n_estimators': 180, 'brf_criterion': 'entropy', 'brf_min_samples_split': 5, 'brf_min_samples_leaf': 19, 'brf_max_features': 5, 'brf_bootstrap': False}. Best is trial 19 with value: 0.994161.
sklearn.ensemble.RandomForestClassifier.predict: fallback to original Scikit-learn
sklearn.ensemble.RandomForestClassifier.predict_proba: fallback to original Scikit-learn
sklearn.ensemble.RandomForestClassifier.predict: fallback to original Scikit-learn
sklearn.ensemble.RandomForestClassifier.predict_proba: fallback to original Scikit-learn
sklearn.ensemble.RandomForestClassifier.predict: fallback to original Scikit-learn
sklearn.ensemble.RandomForestClassifier.predict_proba: fallback to original Scikit-learn
sklearn.ensemble.RandomForestClassifier.predict: fallback to original Scikit-learn
sklearn.ensemble.RandomForestClassifier.predict_proba: fallback to original Scikit-learn
Trial 20 finished with value: 0.9938886019762312 and parameters: {'brf_n_estimators': 50, 'brf_criterion': 'gini', 'brf_min_samples_split': 38, 'brf_min_samples_leaf': 2, 'brf_max_features': 7, 'brf_bootstrap': False}. Best is trial 19 with value: 0.994161.
Trial 21 finished with value: 0.9941613201933839 and parameters: {'brf_n_estimators': 50, 'brf_criterion': 'gini', 'brf_min_samples_split': 38, 'brf_min_samples_leaf': 1, 'brf_max_features': 7, 'brf_bootstrap': False}. Best is trial 19 with value: 0.994161.
Trial 22 finished with value: 0.993195613710801 and parameters: {'brf_n_estimators': 50, 'brf_criterion': 'gini', 'brf_min_samples_split': 38, 'brf_min_samples_leaf': 3, 'brf_max_features': 7, 'brf_bootstrap': False}. Best is trial 19 with value: 0.994161.
Trial 23 finished with value: 0.9938886019762312 and parameters: {'brf_n_estimators': 50, 'brf_criterion': 'gini', 'brf_min_samples_split': 38, 'brf_min_samples_leaf': 2, 'brf_max_features': 7, 'brf_bootstrap': False}. Best is trial 19 with value: 0.994161.
sklearn.ensemble.RandomForestClassifier.predict: fallback to original Scikit-learn
sklearn.ensemble.RandomForestClassifier.predict_proba: fallback to original Scikit-learn
sklearn.ensemble.RandomForestClassifier.predict: fallback to original Scikit-learn
sklearn.ensemble.RandomForestClassifier.predict_proba: fallback to original Scikit-learn
sklearn.ensemble.RandomForestClassifier.predict: fallback to original Scikit-learn
sklearn.ensemble.RandomForestClassifier.predict_proba: fallback to original Scikit-learn
Trial 25 finished with value: 0.993062624204414 and parameters: {'brf_n_estimators': 50, 'brf_criterion': 'entropy', 'brf_min_samples_split': 35, 'brf_min_samples_leaf': 1, 'brf_max_features': 7, 'brf_bootstrap': True}. Best is trial 19 with value: 0.994161.
Trial 24 finished with value: 0.9929450704407625 and parameters: {'brf_n_estimators': 50, 'brf_criterion': 'entropy', 'brf_min_samples_split': 37, 'brf_min_samples_leaf': 1, 'brf_max_features': 7, 'brf_bootstrap': True}. Best is trial 19 with value: 0.994161.
Trial 26 finished with value: 0.9935636469336806 and parameters: {'brf_n_estimators': 50, 'brf_criterion': 'gini', 'brf_min_samples_split': 35, 'brf_min_samples_leaf': 1, 'brf_max_features': 7, 'brf_bootstrap': True}. Best is trial 19 with value: 0.994161.
sklearn.ensemble.RandomForestClassifier.predict: fallback to original Scikit-learn
sklearn.ensemble.RandomForestClassifier.predict_proba: fallback to original Scikit-learn
Trial 27 finished with value: 0.9935636469336806 and parameters: {'brf_n_estimators': 50, 'brf_criterion': 'gini', 'brf_min_samples_split': 35, 'brf_min_samples_leaf': 1, 'brf_max_features': 7, 'brf_bootstrap': True}. Best is trial 19 with value: 0.994161.
sklearn.ensemble.RandomForestClassifier.predict: fallback to original Scikit-learn
sklearn.ensemble.RandomForestClassifier.predict_proba: fallback to original Scikit-learn
sklearn.ensemble.RandomForestClassifier.predict: fallback to original Scikit-learn
sklearn.ensemble.RandomForestClassifier.predict_proba: fallback to original Scikit-learn
sklearn.ensemble.RandomForestClassifier.predict: fallback to original Scikit-learn
sklearn.ensemble.RandomForestClassifier.predict_proba: fallback to original Scikit-learn
Trial 29 finished with value: 0.9935059796375519 and parameters: {'brf_n_estimators': 60, 'brf_criterion': 'gini', 'brf_min_samples_split': 32, 'brf_min_samples_leaf': 1, 'brf_max_features': 7, 'brf_bootstrap': True}. Best is trial 19 with value: 0.994161.
Trial 28 finished with value: 0.995411838275808 and parameters: {'brf_n_estimators': 60, 'brf_criterion': 'gini', 'brf_min_samples_split': 32, 'brf_min_samples_leaf': 2, 'brf_max_features': 7, 'brf_bootstrap': False}. Best is trial 28 with value: 0.995412.
Trial 17 finished with value: 0.9430150437774385 and parameters: {'brf_n_estimators': 190, 'brf_criterion': 'entropy', 'brf_min_samples_split': 38, 'brf_min_samples_leaf': 24, 'brf_max_features': 7, 'brf_bootstrap': True}. Best is trial 28 with value: 0.995412.
A new study created in RDB with name: BernoulliNB_f33849d8
Trial 0 finished with value: 0.7323259635510226 and parameters: {'bnb_alpha': 0.35000000000000003, 'bnb_binarize': 0.4, 'bnb_fit_prior': True}. Best is trial 0 with value: 0.732326.
Trial 5 finished with value: 0.07429784596598596 and parameters: {'bnb_alpha': 1.0, 'bnb_binarize': 0.15000000000000002, 'bnb_fit_prior': False}. Best is trial 0 with value: 0.732326.
Trial 7 finished with value: 0.7323259635510226 and parameters: {'bnb_alpha': 0.5, 'bnb_binarize': 0.6000000000000001, 'bnb_fit_prior': True}. Best is trial 0 with value: 0.732326.
Trial 2 finished with value: 0.07430793772171441 and parameters: {'bnb_alpha': 0.30000000000000004, 'bnb_binarize': 0.9, 'bnb_fit_prior': False}. Best is trial 0 with value: 0.732326.
Trial 6 finished with value: 0.07430793772171441 and parameters: {'bnb_alpha': 0.15000000000000002, 'bnb_binarize': 0.4, 'bnb_fit_prior': False}. Best is trial 0 with value: 0.732326.
Trial 3 finished with value: 0.07429784596598596 and parameters: {'bnb_alpha': 0.9500000000000001, 'bnb_binarize': 0.4, 'bnb_fit_prior': False}. Best is trial 0 with value: 0.732326.
Trial 1 finished with value: 0.7323259635510226 and parameters: {'bnb_alpha': 0.7000000000000001, 'bnb_binarize': 0.05, 'bnb_fit_prior': True}. Best is trial 0 with value: 0.732326.
Trial 4 finished with value: 0.07429784596598596 and parameters: {'bnb_alpha': 0.8500000000000001, 'bnb_binarize': 0.9, 'bnb_fit_prior': False}. Best is trial 0 with value: 0.732326.
Trial 8 finished with value: 0.8189394612083668 and parameters: {'bnb_alpha': 0.8, 'bnb_binarize': 1.0, 'bnb_fit_prior': True}. Best is trial 8 with value: 0.818939.
Trial 11 finished with value: 0.7323259635510226 and parameters: {'bnb_alpha': 0.55, 'bnb_binarize': 0.7000000000000001, 'bnb_fit_prior': True}. Best is trial 8 with value: 0.818939.
Trial 14 finished with value: 0.7323259635510226 and parameters: {'bnb_alpha': 0.6000000000000001, 'bnb_binarize': 0.15000000000000002, 'bnb_fit_prior': True}. Best is trial 8 with value: 0.818939.
Trial 12 finished with value: 0.074334981788516 and parameters: {'bnb_alpha': 0.05, 'bnb_binarize': 0.9, 'bnb_fit_prior': False}. Best is trial 8 with value: 0.818939.
Trial 9 finished with value: 0.7323259635510226 and parameters: {'bnb_alpha': 0.45, 'bnb_binarize': 0.75, 'bnb_fit_prior': True}. Best is trial 8 with value: 0.818939.
Trial 13 finished with value: 0.07429784596598596 and parameters: {'bnb_alpha': 0.65, 'bnb_binarize': 0.7000000000000001, 'bnb_fit_prior': False}. Best is trial 8 with value: 0.818939.
Trial 15 finished with value: 0.07429784596598596 and parameters: {'bnb_alpha': 0.9500000000000001, 'bnb_binarize': 0.25, 'bnb_fit_prior': False}. Best is trial 8 with value: 0.818939.
Trial 10 finished with value: 0.07430793772171441 and parameters: {'bnb_alpha': 0.2, 'bnb_binarize': 0.05, 'bnb_fit_prior': False}. Best is trial 8 with value: 0.818939.
Trial 18 finished with value: 0.7323259635510226 and parameters: {'bnb_alpha': 0.35000000000000003, 'bnb_binarize': 0.5, 'bnb_fit_prior': True}. Best is trial 8 with value: 0.818939.
Trial 21 finished with value: 0.7323259635510226 and parameters: {'bnb_alpha': 0.35000000000000003, 'bnb_binarize': 0.5, 'bnb_fit_prior': True}. Best is trial 8 with value: 0.818939.
Trial 20 finished with value: 0.7323259635510226 and parameters: {'bnb_alpha': 0.35000000000000003, 'bnb_binarize': 0.45, 'bnb_fit_prior': True}. Best is trial 8 with value: 0.818939.
Trial 16 finished with value: 0.7323259635510226 and parameters: {'bnb_alpha': 0.35000000000000003, 'bnb_binarize': 0.5, 'bnb_fit_prior': True}. Best is trial 8 with value: 0.818939.
Trial 19 finished with value: 0.7323259635510226 and parameters: {'bnb_alpha': 0.35000000000000003, 'bnb_binarize': 0.45, 'bnb_fit_prior': True}. Best is trial 8 with value: 0.818939.
Trial 17 finished with value: 0.7323259635510226 and parameters: {'bnb_alpha': 0.4, 'bnb_binarize': 0.5, 'bnb_fit_prior': True}. Best is trial 8 with value: 0.818939.
Trial 23 finished with value: 0.7323259635510226 and parameters: {'bnb_alpha': 0.35000000000000003, 'bnb_binarize': 0.5, 'bnb_fit_prior': True}. Best is trial 8 with value: 0.818939.
Trial 22 finished with value: 0.7323259635510226 and parameters: {'bnb_alpha': 0.4, 'bnb_binarize': 0.5, 'bnb_fit_prior': True}. Best is trial 8 with value: 0.818939.
Trial 24 finished with value: 0.7323259635510226 and parameters: {'bnb_alpha': 0.75, 'bnb_binarize': 0.30000000000000004, 'bnb_fit_prior': True}. Best is trial 8 with value: 0.818939.
Trial 31 finished with value: 0.8189394612083668 and parameters: {'bnb_alpha': 0.75, 'bnb_binarize': 1.0, 'bnb_fit_prior': True}. Best is trial 31 with value: 0.818939.
Trial 25 finished with value: 0.7323259635510226 and parameters: {'bnb_alpha': 0.75, 'bnb_binarize': 0.30000000000000004, 'bnb_fit_prior': True}. Best is trial 31 with value: 0.818939.
Trial 26 finished with value: 0.8189394612083668 and parameters: {'bnb_alpha': 0.7000000000000001, 'bnb_binarize': 1.0, 'bnb_fit_prior': True}. Best is trial 31 with value: 0.818939.
Trial 27 finished with value: 0.7323259635510226 and parameters: {'bnb_alpha': 0.75, 'bnb_binarize': 0.30000000000000004, 'bnb_fit_prior': True}. Best is trial 31 with value: 0.818939.
Trial 28 finished with value: 0.8189394612083668 and parameters: {'bnb_alpha': 0.75, 'bnb_binarize': 1.0, 'bnb_fit_prior': True}. Best is trial 31 with value: 0.818939.
Trial 29 finished with value: 0.8189394612083668 and parameters: {'bnb_alpha': 0.75, 'bnb_binarize': 1.0, 'bnb_fit_prior': True}. Best is trial 31 with value: 0.818939.
Trial 30 finished with value: 0.8189394612083668 and parameters: {'bnb_alpha': 0.75, 'bnb_binarize': 1.0, 'bnb_fit_prior': True}. Best is trial 31 with value: 0.818939.
A new study created in RDB with name: CDClassifier_f33849d8
Trial 4 finished with value: 2.1768465890535954e-05 and parameters: {'cdc_loss': 'log', 'cdc_penalty': 'l2', 'cdc_C': 1.3524913867513753, 'cdc_alpha': 2.6388735256371376, 'cdc_selection': 'uniform'}. Best is trial 4 with value: 2.17685e-05.
Trial 3 finished with value: 0.01731581013733852 and parameters: {'cdc_loss': 'log', 'cdc_penalty': 'l1', 'cdc_C': 658.1676686495102, 'cdc_alpha': 0.0970691084030239, 'cdc_selection': 'cyclic'}. Best is trial 0 with value: 0.737221.
Trial 1 finished with value: 0.01731581013733852 and parameters: {'cdc_loss': 'log', 'cdc_penalty': 'l1', 'cdc_C': 30.118861617139963, 'cdc_alpha': 0.003418044076642421, 'cdc_selection': 'cyclic'}. Best is trial 0 with value: 0.737221.
Trial 0 finished with value: 0.7372210875100446 and parameters: {'cdc_loss': 'modified_huber', 'cdc_penalty': 'l1', 'cdc_C': 101.45626397903473, 'cdc_alpha': 2.9791471050973177, 'cdc_selection': 'cyclic'}. Best is trial 0 with value: 0.737221.
Trial 5 finished with value: 0.7074308662500778 and parameters: {'cdc_loss': 'squared_hinge', 'cdc_penalty': 'l2', 'cdc_C': 17.570446169993698, 'cdc_alpha': 6.350445993823597, 'cdc_selection': 'cyclic'}. Best is trial 0 with value: 0.737221.
Trial 7 finished with value: 0.6945385088836564 and parameters: {'cdc_loss': 'modified_huber', 'cdc_penalty': 'l1/l2', 'cdc_C': 11.360536821027328, 'cdc_alpha': 0.001796302527090924, 'cdc_selection': 'uniform'}. Best is trial 0 with value: 0.737221.
Trial 6 finished with value: 0.15014485745131462 and parameters: {'cdc_loss': 'squared_hinge', 'cdc_penalty': 'l1/l2', 'cdc_C': 0.0035228568288929794, 'cdc_alpha': 44.64825691308648, 'cdc_selection': 'uniform'}. Best is trial 0 with value: 0.737221.
Trial 2 finished with value: 0.705247988531644 and parameters: {'cdc_loss': 'squared_hinge', 'cdc_penalty': 'l2', 'cdc_C': 0.3211900521051892, 'cdc_alpha': 170.08023391178966, 'cdc_selection': 'uniform'}. Best is trial 0 with value: 0.737221.
Trial 11 finished with value: 0.01731581013733852 and parameters: {'cdc_loss': 'log', 'cdc_penalty': 'l1', 'cdc_C': 0.006628190561463343, 'cdc_alpha': 0.11322322582176816, 'cdc_selection': 'cyclic'}. Best is trial 0 with value: 0.737221.
Trial 9 finished with value: 0.01731581013733852 and parameters: {'cdc_loss': 'log', 'cdc_penalty': 'l1', 'cdc_C': 0.008427942753783337, 'cdc_alpha': 36.77853091450052, 'cdc_selection': 'cyclic'}. Best is trial 0 with value: 0.737221.
Trial 12 finished with value: 0.7306019453886586 and parameters: {'cdc_loss': 'squared_hinge', 'cdc_penalty': 'l1', 'cdc_C': 0.004621157178118981, 'cdc_alpha': 1.6729341476832826, 'cdc_selection': 'uniform'}. Best is trial 0 with value: 0.737221.
Trial 15 finished with value: 0.6951513945249667 and parameters: {'cdc_loss': 'log', 'cdc_penalty': 'l1/l2', 'cdc_C': 240.25045618038004, 'cdc_alpha': 0.272542873578248, 'cdc_selection': 'uniform'}. Best is trial 0 with value: 0.737221.
Trial 14 finished with value: 2.1768465890535954e-05 and parameters: {'cdc_loss': 'log', 'cdc_penalty': 'l2', 'cdc_C': 0.07623521701828487, 'cdc_alpha': 8.378228875374617, 'cdc_selection': 'cyclic'}. Best is trial 0 with value: 0.737221.
Trial 13 finished with value: 0.695145458044165 and parameters: {'cdc_loss': 'squared', 'cdc_penalty': 'l1', 'cdc_C': 26.271408915826605, 'cdc_alpha': 217.10505642186604, 'cdc_selection': 'uniform'}. Best is trial 0 with value: 0.737221.
Trial 8 finished with value: 0.6951513945249667 and parameters: {'cdc_loss': 'log', 'cdc_penalty': 'l1/l2', 'cdc_C': 0.6770951612615294, 'cdc_alpha': 0.0038307632212070297, 'cdc_selection': 'uniform'}. Best is trial 0 with value: 0.737221.
Trial 10 finished with value: 0.019221462647889348 and parameters: {'cdc_loss': 'squared', 'cdc_penalty': 'l1/l2', 'cdc_C': 0.008784478116912145, 'cdc_alpha': 0.11696818003198235, 'cdc_selection': 'cyclic'}. Best is trial 0 with value: 0.737221.
Trial 18 finished with value: 0.695318963742575 and parameters: {'cdc_loss': 'modified_huber', 'cdc_penalty': 'l1', 'cdc_C': 0.04538157902591827, 'cdc_alpha': 0.8779718887814284, 'cdc_selection': 'uniform'}. Best is trial 0 with value: 0.737221.
Trial 20 finished with value: 0.6952408995481784 and parameters: {'cdc_loss': 'modified_huber', 'cdc_penalty': 'l1', 'cdc_C': 0.0714620491871244, 'cdc_alpha': 1.0186051555578977, 'cdc_selection': 'uniform'}. Best is trial 0 with value: 0.737221.
Trial 16 finished with value: 0.6952408995481784 and parameters: {'cdc_loss': 'modified_huber', 'cdc_penalty': 'l1', 'cdc_C': 0.0011251067649228836, 'cdc_alpha': 0.9133571222494657, 'cdc_selection': 'uniform'}. Best is trial 0 with value: 0.737221.
Trial 22 finished with value: 0.728169035136086 and parameters: {'cdc_loss': 'modified_huber', 'cdc_penalty': 'l1', 'cdc_C': 0.061025038266002724, 'cdc_alpha': 0.8524314845399633, 'cdc_selection': 'uniform'}. Best is trial 0 with value: 0.737221.
Trial 17 finished with value: 0.7372210875100446 and parameters: {'cdc_loss': 'modified_huber', 'cdc_penalty': 'l1', 'cdc_C': 0.0010970860070002803, 'cdc_alpha': 0.5183883626484521, 'cdc_selection': 'cyclic'}. Best is trial 0 with value: 0.737221.
Trial 21 finished with value: 0.714384091933326 and parameters: {'cdc_loss': 'modified_huber', 'cdc_penalty': 'l1', 'cdc_C': 0.061076583193023753, 'cdc_alpha': 1.3782211109128026, 'cdc_selection': 'uniform'}. Best is trial 0 with value: 0.737221.
Trial 19 finished with value: 0.7372210875100446 and parameters: {'cdc_loss': 'modified_huber', 'cdc_penalty': 'l1', 'cdc_C': 0.05205958643125281, 'cdc_alpha': 0.7227093463813645, 'cdc_selection': 'cyclic'}. Best is trial 0 with value: 0.737221.
Trial 23 finished with value: 0.7281385132908006 and parameters: {'cdc_loss': 'modified_huber', 'cdc_penalty': 'l1', 'cdc_C': 0.08539561532925005, 'cdc_alpha': 0.7922098464640599, 'cdc_selection': 'uniform'}. Best is trial 0 with value: 0.737221.
Trial 28 finished with value: 0.7372210875100446 and parameters: {'cdc_loss': 'modified_huber', 'cdc_penalty': 'l1', 'cdc_C': 3.7327462427187275, 'cdc_alpha': 0.01660477019333446, 'cdc_selection': 'cyclic'}. Best is trial 26 with value: 0.737231.
Trial 27 finished with value: 0.7372210875100446 and parameters: {'cdc_loss': 'modified_huber', 'cdc_penalty': 'l1', 'cdc_C': 0.0010919819102720146, 'cdc_alpha': 0.025587723864861897, 'cdc_selection': 'cyclic'}. Best is trial 26 with value: 0.737231.
Trial 24 finished with value: 0.7372210875100446 and parameters: {'cdc_loss': 'modified_huber', 'cdc_penalty': 'l1', 'cdc_C': 3.0085898416750143, 'cdc_alpha': 0.026731431702182732, 'cdc_selection': 'cyclic'}. Best is trial 26 with value: 0.737231.
Trial 25 finished with value: 0.7372210875100446 and parameters: {'cdc_loss': 'modified_huber', 'cdc_penalty': 'l1', 'cdc_C': 2.7869770670213816, 'cdc_alpha': 0.018094203056743575, 'cdc_selection': 'cyclic'}. Best is trial 26 with value: 0.737231.
Trial 26 finished with value: 0.7372312170536749 and parameters: {'cdc_loss': 'modified_huber', 'cdc_penalty': 'l1', 'cdc_C': 0.0011348024878737762, 'cdc_alpha': 5.888274426784093, 'cdc_selection': 'cyclic'}. Best is trial 26 with value: 0.737231.
A new study created in RDB with name: ComplementNB_f33849d8
Trial 2 finished with value: 0.08231845847806078 and parameters: {'compnb_alpha': 0.35000000000000003, 'compnb_fit_prior': True, 'compnb_norm': False}. Best is trial 1 with value: 0.0855343.
Trial 4 finished with value: 0.08553430843786972 and parameters: {'compnb_alpha': 0.6000000000000001, 'compnb_fit_prior': False, 'compnb_norm': True}. Best is trial 1 with value: 0.0855343.
Trial 1 finished with value: 0.08553430843786972 and parameters: {'compnb_alpha': 0.9, 'compnb_fit_prior': False, 'compnb_norm': True}. Best is trial 1 with value: 0.0855343.
Trial 3 finished with value: 0.08553430843786972 and parameters: {'compnb_alpha': 0.9500000000000001, 'compnb_fit_prior': True, 'compnb_norm': True}. Best is trial 0 with value: 0.0855343.
Trial 7 finished with value: 0.08553430843786972 and parameters: {'compnb_alpha': 1.0, 'compnb_fit_prior': True, 'compnb_norm': True}. Best is trial 1 with value: 0.0855343.
Trial 6 finished with value: 0.08553430843786972 and parameters: {'compnb_alpha': 1.0, 'compnb_fit_prior': False, 'compnb_norm': True}. Best is trial 0 with value: 0.0855343.
Trial 5 finished with value: 0.08553430843786972 and parameters: {'compnb_alpha': 0.75, 'compnb_fit_prior': False, 'compnb_norm': True}. Best is trial 0 with value: 0.0855343.
Trial 0 finished with value: 0.08553430843786972 and parameters: {'compnb_alpha': 0.4, 'compnb_fit_prior': True, 'compnb_norm': True}. Best is trial 0 with value: 0.0855343.
Trial 14 finished with value: 0.08231845847806078 and parameters: {'compnb_alpha': 0.25, 'compnb_fit_prior': False, 'compnb_norm': False}. Best is trial 0 with value: 0.0855343.
Trial 13 finished with value: 0.08553430843786972 and parameters: {'compnb_alpha': 0.55, 'compnb_fit_prior': True, 'compnb_norm': True}. Best is trial 0 with value: 0.0855343.
Trial 8 finished with value: 0.08553430843786972 and parameters: {'compnb_alpha': 0.8, 'compnb_fit_prior': True, 'compnb_norm': True}. Best is trial 0 with value: 0.0855343.
Trial 12 finished with value: 0.08231845847806078 and parameters: {'compnb_alpha': 0.5, 'compnb_fit_prior': False, 'compnb_norm': False}. Best is trial 0 with value: 0.0855343.
Trial 15 finished with value: 0.08231845847806078 and parameters: {'compnb_alpha': 0.65, 'compnb_fit_prior': False, 'compnb_norm': False}. Best is trial 0 with value: 0.0855343.
Trial 9 finished with value: 0.08553430843786972 and parameters: {'compnb_alpha': 0.35000000000000003, 'compnb_fit_prior': True, 'compnb_norm': True}. Best is trial 0 with value: 0.0855343.
Trial 10 finished with value: 0.08231845847806078 and parameters: {'compnb_alpha': 0.35000000000000003, 'compnb_fit_prior': True, 'compnb_norm': False}. Best is trial 0 with value: 0.0855343.
Trial 11 finished with value: 0.08553430843786972 and parameters: {'compnb_alpha': 0.05, 'compnb_fit_prior': False, 'compnb_norm': True}. Best is trial 0 with value: 0.0855343.
Trial 21 finished with value: 0.08553430843786972 and parameters: {'compnb_alpha': 0.1, 'compnb_fit_prior': True, 'compnb_norm': True}. Best is trial 0 with value: 0.0855343.
Trial 18 finished with value: 0.08553430843786972 and parameters: {'compnb_alpha': 0.1, 'compnb_fit_prior': True, 'compnb_norm': True}. Best is trial 0 with value: 0.0855343.
Trial 22 finished with value: 0.08553430843786972 and parameters: {'compnb_alpha': 0.1, 'compnb_fit_prior': True, 'compnb_norm': True}. Best is trial 0 with value: 0.0855343.
Trial 17 finished with value: 0.08553430843786972 and parameters: {'compnb_alpha': 0.1, 'compnb_fit_prior': True, 'compnb_norm': True}. Best is trial 0 with value: 0.0855343.
