Trial 4 finished with value: 0.7086976900423219 and parameters: {'lsvc_pcs_kernel_gamma': 36.236708362411, 'lsvc_pcs_kernel_n_components': 100, 'lsvc_pcs_degree': 2, 'lsvc_pcs_dual': False, 'lsvc_pcs_C': 0.0055672876703412475, 'lsvc_pcs_max_iter': 2000}. Best is trial 4 with value: 0.708698.
Trial 5 finished with value: 0.4075226841593701 and parameters: {'lsvc_pcs_kernel_gamma': 108.66537969350438, 'lsvc_pcs_kernel_n_components': 100, 'lsvc_pcs_degree': 2, 'lsvc_pcs_dual': False, 'lsvc_pcs_C': 0.5256019309042236, 'lsvc_pcs_max_iter': 2000}. Best is trial 4 with value: 0.708698.
Trial 6 finished with value: 0.43552086046583494 and parameters: {'lsvc_pcs_kernel_gamma': 0.03756530741628396, 'lsvc_pcs_kernel_n_components': 50, 'lsvc_pcs_degree': 2, 'lsvc_pcs_dual': False, 'lsvc_pcs_C': 2.5333581529303837, 'lsvc_pcs_max_iter': 2000}. Best is trial 4 with value: 0.708698.
Trial 7 finished with value: 0.14460842619318162 and parameters: {'lsvc_pcs_kernel_gamma': 19.62602604081289, 'lsvc_pcs_kernel_n_components': 100, 'lsvc_pcs_degree': 2, 'lsvc_pcs_dual': False, 'lsvc_pcs_C': 0.6187593340503584, 'lsvc_pcs_max_iter': 2000}. Best is trial 4 with value: 0.708698.
Trial 8 finished with value: 0.5911063090102397 and parameters: {'lsvc_pcs_kernel_gamma': 150.11967833304914, 'lsvc_pcs_kernel_n_components': 150, 'lsvc_pcs_degree': 2, 'lsvc_pcs_dual': False, 'lsvc_pcs_C': 79.64092034663555, 'lsvc_pcs_max_iter': 2000}. Best is trial 4 with value: 0.708698.
Trial 9 finished with value: 0.7404415482027349 and parameters: {'lsvc_pcs_kernel_gamma': 57.103288276678484, 'lsvc_pcs_kernel_n_components': 150, 'lsvc_pcs_degree': 2, 'lsvc_pcs_dual': False, 'lsvc_pcs_C': 0.006040747350330894, 'lsvc_pcs_max_iter': 2000}. Best is trial 9 with value: 0.740442.
Trial 10 finished with value: 0.49943740323964825 and parameters: {'lsvc_pcs_kernel_gamma': 1.9623341585771086, 'lsvc_pcs_kernel_n_components': 150, 'lsvc_pcs_degree': 2, 'lsvc_pcs_dual': False, 'lsvc_pcs_C': 2.8145975887866177e-06, 'lsvc_pcs_max_iter': 2000}. Best is trial 9 with value: 0.740442.
Trial 11 finished with value: 0.6376709303711698 and parameters: {'lsvc_pcs_kernel_gamma': 10.046627153688242, 'lsvc_pcs_kernel_n_components': 150, 'lsvc_pcs_degree': 2, 'lsvc_pcs_dual': False, 'lsvc_pcs_C': 0.0027347176821733653, 'lsvc_pcs_max_iter': 2000}. Best is trial 9 with value: 0.740442.
Trial 12 finished with value: 0.4598103651374003 and parameters: {'lsvc_pcs_kernel_gamma': 990.5010332160712, 'lsvc_pcs_kernel_n_components': 50, 'lsvc_pcs_degree': 2, 'lsvc_pcs_dual': False, 'lsvc_pcs_C': 0.0002818416769731342, 'lsvc_pcs_max_iter': 2000}. Best is trial 9 with value: 0.740442.
Trial 13 finished with value: 0.7172261812172831 and parameters: {'lsvc_pcs_kernel_gamma': 8.823237979586132, 'lsvc_pcs_kernel_n_components': 100, 'lsvc_pcs_degree': 2, 'lsvc_pcs_dual': False, 'lsvc_pcs_C': 0.0017510030475636406, 'lsvc_pcs_max_iter': 2000}. Best is trial 9 with value: 0.740442.
Trial 14 finished with value: 0.4382950533011767 and parameters: {'lsvc_pcs_kernel_gamma': 1.942818088055506, 'lsvc_pcs_kernel_n_components': 150, 'lsvc_pcs_degree': 2, 'lsvc_pcs_dual': False, 'lsvc_pcs_C': 0.00016277002169845539, 'lsvc_pcs_max_iter': 2000}. Best is trial 9 with value: 0.740442.
Trial 15 finished with value: 0.14392930711765498 and parameters: {'lsvc_pcs_kernel_gamma': 5.811006680959133, 'lsvc_pcs_kernel_n_components': 100, 'lsvc_pcs_degree': 2, 'lsvc_pcs_dual': False, 'lsvc_pcs_C': 38.82533130602523, 'lsvc_pcs_max_iter': 2000}. Best is trial 9 with value: 0.740442.
Trial 16 finished with value: 0.4962190552316782 and parameters: {'lsvc_pcs_kernel_gamma': 799.7377417714908, 'lsvc_pcs_kernel_n_components': 150, 'lsvc_pcs_degree': 2, 'lsvc_pcs_dual': False, 'lsvc_pcs_C': 0.0013033313071316734, 'lsvc_pcs_max_iter': 2000}. Best is trial 9 with value: 0.740442.
Trial 17 finished with value: 0.3211951065483614 and parameters: {'lsvc_pcs_kernel_gamma': 0.29162096004032595, 'lsvc_pcs_kernel_n_components': 50, 'lsvc_pcs_degree': 2, 'lsvc_pcs_dual': False, 'lsvc_pcs_C': 0.04851905575472189, 'lsvc_pcs_max_iter': 2000}. Best is trial 9 with value: 0.740442.
Trial 18 finished with value: 0.14358958322859927 and parameters: {'lsvc_pcs_kernel_gamma': 0.0011087874854083088, 'lsvc_pcs_kernel_n_components': 100, 'lsvc_pcs_degree': 2, 'lsvc_pcs_dual': False, 'lsvc_pcs_C': 742.3464529591835, 'lsvc_pcs_max_iter': 2000}. Best is trial 9 with value: 0.740442.
Trial 19 finished with value: 0.7199184354604073 and parameters: {'lsvc_pcs_kernel_gamma': 3.9086982785736324, 'lsvc_pcs_kernel_n_components': 100, 'lsvc_pcs_degree': 2, 'lsvc_pcs_dual': False, 'lsvc_pcs_C': 1.5727275651450013e-05, 'lsvc_pcs_max_iter': 2000}. Best is trial 9 with value: 0.740442.
Trial 20 finished with value: 0.37733088778893487 and parameters: {'lsvc_pcs_kernel_gamma': 0.01999046352122963, 'lsvc_pcs_kernel_n_components': 150, 'lsvc_pcs_degree': 2, 'lsvc_pcs_dual': False, 'lsvc_pcs_C': 2.3288127157381787e-05, 'lsvc_pcs_max_iter': 2000}. Best is trial 9 with value: 0.740442.
Trial 21 finished with value: 0.1443861270367319 and parameters: {'lsvc_pcs_kernel_gamma': 5.527473912007763, 'lsvc_pcs_kernel_n_components': 100, 'lsvc_pcs_degree': 2, 'lsvc_pcs_dual': False, 'lsvc_pcs_C': 5.2880776238426295e-05, 'lsvc_pcs_max_iter': 2000}. Best is trial 9 with value: 0.740442.
Trial 22 finished with value: 0.7101002730029714 and parameters: {'lsvc_pcs_kernel_gamma': 55.00224040490736, 'lsvc_pcs_kernel_n_components': 100, 'lsvc_pcs_degree': 2, 'lsvc_pcs_dual': False, 'lsvc_pcs_C': 1.8096134210999165e-06, 'lsvc_pcs_max_iter': 2000}. Best is trial 9 with value: 0.740442.
A new study created in RDB with name: LinearSVC_RBFSampler_f33849d8
Trial 0 finished with value: 0.8673853848944781 and parameters: {'lsvc_rbfs_kernel_gamma': 0.0029585786806060658, 'lsvc_rbfs_kernel_n_components': 150, 'lsvc_rbfs_dual': False, 'lsvc_rbfs_C': 4.905721208203495e-05, 'lsvc_rbfs_max_iter': 2000}. Best is trial 0 with value: 0.867385.
Trial 1 finished with value: 0.6950742018218817 and parameters: {'lsvc_rbfs_kernel_gamma': 568.6354195841396, 'lsvc_rbfs_kernel_n_components': 150, 'lsvc_rbfs_dual': False, 'lsvc_rbfs_C': 3.506288607250636e-06, 'lsvc_rbfs_max_iter': 2000}. Best is trial 0 with value: 0.867385.
Trial 2 finished with value: 0.7835806504711306 and parameters: {'lsvc_rbfs_kernel_gamma': 30.10085708339472, 'lsvc_rbfs_kernel_n_components': 100, 'lsvc_rbfs_dual': False, 'lsvc_rbfs_C': 1.5629965501052466e-05, 'lsvc_rbfs_max_iter': 2000}. Best is trial 0 with value: 0.867385.
Trial 3 finished with value: 0.8974021645597927 and parameters: {'lsvc_rbfs_kernel_gamma': 0.05762704645750079, 'lsvc_rbfs_kernel_n_components': 50, 'lsvc_rbfs_dual': False, 'lsvc_rbfs_C': 19.318398686796463, 'lsvc_rbfs_max_iter': 2000}. Best is trial 3 with value: 0.897402.
Trial 4 finished with value: 0.913497363792078 and parameters: {'lsvc_rbfs_kernel_gamma': 2.2991292905030396, 'lsvc_rbfs_kernel_n_components': 100, 'lsvc_rbfs_dual': False, 'lsvc_rbfs_C': 448.8569690880271, 'lsvc_rbfs_max_iter': 2000}. Best is trial 4 with value: 0.913497.
Trial 5 finished with value: 0.9256514282564008 and parameters: {'lsvc_rbfs_kernel_gamma': 3.134076844203342, 'lsvc_rbfs_kernel_n_components': 150, 'lsvc_rbfs_dual': False, 'lsvc_rbfs_C': 0.20586564148213102, 'lsvc_rbfs_max_iter': 2000}. Best is trial 5 with value: 0.925651.
Trial 6 finished with value: 0.9163544516361742 and parameters: {'lsvc_rbfs_kernel_gamma': 2.263739202273967, 'lsvc_rbfs_kernel_n_components': 100, 'lsvc_rbfs_dual': False, 'lsvc_rbfs_C': 0.06413540595892926, 'lsvc_rbfs_max_iter': 2000}. Best is trial 5 with value: 0.925651.
Trial 7 finished with value: 0.8949124940487501 and parameters: {'lsvc_rbfs_kernel_gamma': 0.11161630026248202, 'lsvc_rbfs_kernel_n_components': 50, 'lsvc_rbfs_dual': False, 'lsvc_rbfs_C': 0.18426002871523275, 'lsvc_rbfs_max_iter': 2000}. Best is trial 5 with value: 0.925651.
Trial 8 finished with value: 0.9167589243960104 and parameters: {'lsvc_rbfs_kernel_gamma': 166.65000470046968, 'lsvc_rbfs_kernel_n_components': 100, 'lsvc_rbfs_dual': False, 'lsvc_rbfs_C': 7.030456041147858, 'lsvc_rbfs_max_iter': 2000}. Best is trial 5 with value: 0.925651.
Trial 9 finished with value: 0.8959981399503867 and parameters: {'lsvc_rbfs_kernel_gamma': 982.6022558992133, 'lsvc_rbfs_kernel_n_components': 50, 'lsvc_rbfs_dual': False, 'lsvc_rbfs_C': 2.6989931376454677, 'lsvc_rbfs_max_iter': 2000}. Best is trial 5 with value: 0.925651.
Trial 10 finished with value: 0.9164808195114776 and parameters: {'lsvc_rbfs_kernel_gamma': 32.02656601264367, 'lsvc_rbfs_kernel_n_components': 150, 'lsvc_rbfs_dual': False, 'lsvc_rbfs_C': 0.0012565945224540095, 'lsvc_rbfs_max_iter': 2000}. Best is trial 5 with value: 0.925651.
Trial 11 finished with value: 0.914282707847661 and parameters: {'lsvc_rbfs_kernel_gamma': 23.47464795093323, 'lsvc_rbfs_kernel_n_components': 100, 'lsvc_rbfs_dual': False, 'lsvc_rbfs_C': 3.132929210194816, 'lsvc_rbfs_max_iter': 2000}. Best is trial 5 with value: 0.925651.
Trial 12 finished with value: 0.9191809346190738 and parameters: {'lsvc_rbfs_kernel_gamma': 125.99833782928111, 'lsvc_rbfs_kernel_n_components': 150, 'lsvc_rbfs_dual': False, 'lsvc_rbfs_C': 0.0029640468837388856, 'lsvc_rbfs_max_iter': 2000}. Best is trial 5 with value: 0.925651.
Trial 13 finished with value: 0.9218703089315389 and parameters: {'lsvc_rbfs_kernel_gamma': 0.5200138241145946, 'lsvc_rbfs_kernel_n_components': 150, 'lsvc_rbfs_dual': False, 'lsvc_rbfs_C': 0.002013505191388643, 'lsvc_rbfs_max_iter': 2000}. Best is trial 5 with value: 0.925651.
Trial 14 finished with value: 0.9197090871795385 and parameters: {'lsvc_rbfs_kernel_gamma': 0.2901705787830834, 'lsvc_rbfs_kernel_n_components': 150, 'lsvc_rbfs_dual': False, 'lsvc_rbfs_C': 0.001990688367252708, 'lsvc_rbfs_max_iter': 2000}. Best is trial 5 with value: 0.925651.
Trial 15 finished with value: 0.9087668278594548 and parameters: {'lsvc_rbfs_kernel_gamma': 0.008902560671353648, 'lsvc_rbfs_kernel_n_components': 150, 'lsvc_rbfs_dual': False, 'lsvc_rbfs_C': 0.00017700007905208068, 'lsvc_rbfs_max_iter': 2000}. Best is trial 5 with value: 0.925651.
Trial 16 finished with value: 0.9314395514448635 and parameters: {'lsvc_rbfs_kernel_gamma': 1.3711251637493642, 'lsvc_rbfs_kernel_n_components': 150, 'lsvc_rbfs_dual': False, 'lsvc_rbfs_C': 0.019186071813276237, 'lsvc_rbfs_max_iter': 2000}. Best is trial 16 with value: 0.93144.
Trial 17 finished with value: 0.9304131672560909 and parameters: {'lsvc_rbfs_kernel_gamma': 5.435599653772576, 'lsvc_rbfs_kernel_n_components': 150, 'lsvc_rbfs_dual': False, 'lsvc_rbfs_C': 0.28281693227383864, 'lsvc_rbfs_max_iter': 2000}. Best is trial 16 with value: 0.93144.
Trial 18 finished with value: 0.9147762031596745 and parameters: {'lsvc_rbfs_kernel_gamma': 11.064680436052875, 'lsvc_rbfs_kernel_n_components': 100, 'lsvc_rbfs_dual': False, 'lsvc_rbfs_C': 0.017459506465381615, 'lsvc_rbfs_max_iter': 2000}. Best is trial 16 with value: 0.93144.
Trial 19 finished with value: 0.9310648583783533 and parameters: {'lsvc_rbfs_kernel_gamma': 0.038016097419305526, 'lsvc_rbfs_kernel_n_components': 150, 'lsvc_rbfs_dual': False, 'lsvc_rbfs_C': 105.74882122794347, 'lsvc_rbfs_max_iter': 2000}. Best is trial 16 with value: 0.93144.
Trial 20 finished with value: 0.9174431776124132 and parameters: {'lsvc_rbfs_kernel_gamma': 0.01866766666184087, 'lsvc_rbfs_kernel_n_components': 100, 'lsvc_rbfs_dual': False, 'lsvc_rbfs_C': 838.7648660686181, 'lsvc_rbfs_max_iter': 2000}. Best is trial 16 with value: 0.93144.
Trial 21 finished with value: 0.9247059944428495 and parameters: {'lsvc_rbfs_kernel_gamma': 0.209461555916344, 'lsvc_rbfs_kernel_n_components': 150, 'lsvc_rbfs_dual': False, 'lsvc_rbfs_C': 59.83072954423979, 'lsvc_rbfs_max_iter': 2000}. Best is trial 16 with value: 0.93144.
A new study created in RDB with name: MLPClassifier_f33849d8
sklearn.model_selection.train_test_split: running accelerated version on CPU
sklearn.model_selection.train_test_split: running accelerated version on CPU
sklearn.model_selection.train_test_split: running accelerated version on CPU
sklearn.model_selection.train_test_split: running accelerated version on CPU
sklearn.model_selection.train_test_split: fallback to original Scikit-learn
sklearn.model_selection.train_test_split: fallback to original Scikit-learn
sklearn.model_selection.train_test_split: fallback to original Scikit-learn
sklearn.model_selection.train_test_split: running accelerated version on CPU
sklearn.model_selection.train_test_split: fallback to original Scikit-learn
sklearn.model_selection.train_test_split: running accelerated version on CPU
sklearn.model_selection.train_test_split: fallback to original Scikit-learn
sklearn.model_selection.train_test_split: fallback to original Scikit-learn
sklearn.model_selection.train_test_split: running accelerated version on CPU
sklearn.model_selection.train_test_split: running accelerated version on CPU
sklearn.model_selection.train_test_split: fallback to original Scikit-learn
sklearn.model_selection.train_test_split: fallback to original Scikit-learn
Trial 3 finished with value: 0.6950742018218817 and parameters: {'mlpc_hidden_layer_count': 1, 'mlpc_learning_rate': 'invscaling', 'mlpc_learning_rate_init': 0.04892193624606722, 'mplc_max_iter': 2000}. Best is trial 3 with value: 0.695074.
sklearn.model_selection.train_test_split: running accelerated version on CPU
sklearn.model_selection.train_test_split: fallback to original Scikit-learn
Trial 5 finished with value: 0.6950742018218817 and parameters: {'mlpc_hidden_layer_count': 1, 'mlpc_learning_rate': 'adaptive', 'mlpc_learning_rate_init': 0.11207954511298687, 'mplc_max_iter': 2000}. Best is trial 3 with value: 0.695074.
sklearn.model_selection.train_test_split: running accelerated version on CPU
sklearn.model_selection.train_test_split: fallback to original Scikit-learn
Trial 4 finished with value: 0.695087046409682 and parameters: {'mlpc_hidden_layer_count': 2, 'mlpc_learning_rate': 'invscaling', 'mlpc_learning_rate_init': 0.005059007639209299, 'mplc_max_iter': 2000}. Best is trial 4 with value: 0.695087.
sklearn.model_selection.train_test_split: running accelerated version on CPU
sklearn.model_selection.train_test_split: fallback to original Scikit-learn
Trial 9 finished with value: 0.8093042345456077 and parameters: {'mlpc_hidden_layer_count': 2, 'mlpc_learning_rate': 'invscaling', 'mlpc_learning_rate_init': 0.00118310863900743, 'mplc_max_iter': 2000}. Best is trial 9 with value: 0.809304.
sklearn.model_selection.train_test_split: running accelerated version on CPU
sklearn.model_selection.train_test_split: fallback to original Scikit-learn
Trial 7 finished with value: 0.8741551843202056 and parameters: {'mlpc_hidden_layer_count': 1, 'mlpc_learning_rate': 'constant', 'mlpc_learning_rate_init': 0.00010922573378961343, 'mplc_max_iter': 2000}. Best is trial 7 with value: 0.874155.
sklearn.model_selection.train_test_split: running accelerated version on CPU
sklearn.model_selection.train_test_split: fallback to original Scikit-learn
Trial 10 finished with value: 0.6950742018218817 and parameters: {'mlpc_hidden_layer_count': 2, 'mlpc_learning_rate': 'constant', 'mlpc_learning_rate_init': 0.004513693793011211, 'mplc_max_iter': 2000}. Best is trial 7 with value: 0.874155.
sklearn.model_selection.train_test_split: running accelerated version on CPU
sklearn.model_selection.train_test_split: fallback to original Scikit-learn
Trial 2 finished with value: 0.8476855994239042 and parameters: {'mlpc_hidden_layer_count': 1, 'mlpc_learning_rate': 'invscaling', 'mlpc_learning_rate_init': 3.163789165671028e-05, 'mplc_max_iter': 2000}. Best is trial 7 with value: 0.874155.
sklearn.model_selection.train_test_split: running accelerated version on CPU
sklearn.model_selection.train_test_split: fallback to original Scikit-learn
Trial 14 finished with value: 0.6950742018218817 and parameters: {'mlpc_hidden_layer_count': 1, 'mlpc_learning_rate': 'adaptive', 'mlpc_learning_rate_init': 0.2560094704632862, 'mplc_max_iter': 2000}. Best is trial 7 with value: 0.874155.
sklearn.model_selection.train_test_split: running accelerated version on CPU
sklearn.model_selection.train_test_split: fallback to original Scikit-learn
Trial 11 finished with value: 0.6950742018218817 and parameters: {'mlpc_hidden_layer_count': 3, 'mlpc_learning_rate': 'invscaling', 'mlpc_learning_rate_init': 0.3131357788676395, 'mplc_max_iter': 2000}. Best is trial 7 with value: 0.874155.
sklearn.model_selection.train_test_split: running accelerated version on CPU
sklearn.model_selection.train_test_split: fallback to original Scikit-learn
Trial 1 finished with value: 0.9109182526191792 and parameters: {'mlpc_hidden_layer_count': 2, 'mlpc_learning_rate': 'adaptive', 'mlpc_learning_rate_init': 3.9465306999576655e-05, 'mplc_max_iter': 2000}. Best is trial 1 with value: 0.910918.
sklearn.model_selection.train_test_split: running accelerated version on CPU
sklearn.model_selection.train_test_split: fallback to original Scikit-learn
Trial 12 finished with value: 0.6950742018218817 and parameters: {'mlpc_hidden_layer_count': 3, 'mlpc_learning_rate': 'constant', 'mlpc_learning_rate_init': 0.09202003318963929, 'mplc_max_iter': 2000}. Best is trial 1 with value: 0.910918.
sklearn.model_selection.train_test_split: running accelerated version on CPU
sklearn.model_selection.train_test_split: fallback to original Scikit-learn
Trial 13 finished with value: 0.7618084396966189 and parameters: {'mlpc_hidden_layer_count': 1, 'mlpc_learning_rate': 'adaptive', 'mlpc_learning_rate_init': 5.137178259366263e-06, 'mplc_max_iter': 2000}. Best is trial 1 with value: 0.910918.
sklearn.model_selection.train_test_split: running accelerated version on CPU
sklearn.model_selection.train_test_split: fallback to original Scikit-learn
Trial 15 finished with value: 0.6950742018218817 and parameters: {'mlpc_hidden_layer_count': 2, 'mlpc_learning_rate': 'invscaling', 'mlpc_learning_rate_init': 0.004247625584872518, 'mplc_max_iter': 2000}. Best is trial 1 with value: 0.910918.
sklearn.model_selection.train_test_split: running accelerated version on CPU
sklearn.model_selection.train_test_split: fallback to original Scikit-learn
Trial 6 finished with value: 0.8685982928585864 and parameters: {'mlpc_hidden_layer_count': 3, 'mlpc_learning_rate': 'constant', 'mlpc_learning_rate_init': 2.88031537843556e-06, 'mplc_max_iter': 2000}. Best is trial 1 with value: 0.910918.
sklearn.model_selection.train_test_split: running accelerated version on CPU
sklearn.model_selection.train_test_split: fallback to original Scikit-learn
Trial 19 finished with value: 0.8589786487290068 and parameters: {'mlpc_hidden_layer_count': 2, 'mlpc_learning_rate': 'constant', 'mlpc_learning_rate_init': 6.676950171495251e-05, 'mplc_max_iter': 2000}. Best is trial 1 with value: 0.910918.
sklearn.model_selection.train_test_split: running accelerated version on CPU
sklearn.model_selection.train_test_split: fallback to original Scikit-learn
Trial 0 finished with value: 0.800207565942279 and parameters: {'mlpc_hidden_layer_count': 3, 'mlpc_learning_rate': 'invscaling', 'mlpc_learning_rate_init': 0.0006151360808328853, 'mplc_max_iter': 2000}. Best is trial 1 with value: 0.910918.
sklearn.model_selection.train_test_split: running accelerated version on CPU
sklearn.model_selection.train_test_split: fallback to original Scikit-learn
Trial 16 finished with value: 0.78550095184489 and parameters: {'mlpc_hidden_layer_count': 2, 'mlpc_learning_rate': 'constant', 'mlpc_learning_rate_init': 1.1692687143057084e-06, 'mplc_max_iter': 2000}. Best is trial 1 with value: 0.910918.
sklearn.model_selection.train_test_split: running accelerated version on CPU
sklearn.model_selection.train_test_split: fallback to original Scikit-learn
Trial 8 finished with value: 0.9233605627218752 and parameters: {'mlpc_hidden_layer_count': 3, 'mlpc_learning_rate': 'constant', 'mlpc_learning_rate_init': 0.00010690119407561617, 'mplc_max_iter': 2000}. Best is trial 8 with value: 0.923361.
sklearn.model_selection.train_test_split: running accelerated version on CPU
sklearn.model_selection.train_test_split: fallback to original Scikit-learn
Trial 21 finished with value: 0.8737323373462723 and parameters: {'mlpc_hidden_layer_count': 2, 'mlpc_learning_rate': 'adaptive', 'mlpc_learning_rate_init': 7.085313690956986e-05, 'mplc_max_iter': 2000}. Best is trial 8 with value: 0.923361.
sklearn.model_selection.train_test_split: running accelerated version on CPU
sklearn.model_selection.train_test_split: fallback to original Scikit-learn
Trial 18 finished with value: 0.8693309421761314 and parameters: {'mlpc_hidden_layer_count': 2, 'mlpc_learning_rate': 'constant', 'mlpc_learning_rate_init': 1.0456793380549417e-05, 'mplc_max_iter': 2000}. Best is trial 8 with value: 0.923361.
sklearn.model_selection.train_test_split: running accelerated version on CPU
sklearn.model_selection.train_test_split: fallback to original Scikit-learn
Trial 23 finished with value: 0.8560842713818465 and parameters: {'mlpc_hidden_layer_count': 1, 'mlpc_learning_rate': 'adaptive', 'mlpc_learning_rate_init': 7.081265953666694e-05, 'mplc_max_iter': 2000}. Best is trial 8 with value: 0.923361.
sklearn.model_selection.train_test_split: running accelerated version on CPU
sklearn.model_selection.train_test_split: fallback to original Scikit-learn
Trial 24 finished with value: 0.8567228228509628 and parameters: {'mlpc_hidden_layer_count': 1, 'mlpc_learning_rate': 'adaptive', 'mlpc_learning_rate_init': 7.206495973063022e-05, 'mplc_max_iter': 2000}. Best is trial 8 with value: 0.923361.
Trial 22 finished with value: 0.87807356289379 and parameters: {'mlpc_hidden_layer_count': 1, 'mlpc_learning_rate': 'adaptive', 'mlpc_learning_rate_init': 8.900016625036819e-05, 'mplc_max_iter': 2000}. Best is trial 8 with value: 0.923361.
