Trial 11 finished with value: 0.7047050208726613 and parameters: {'qda_reg_param': 0.45, 'qda_tol': 1.141546175351482e-06}. Best is trial 15 with value: 0.708021.
Trial 9 finished with value: 0.6964237090495516 and parameters: {'qda_reg_param': 0.9, 'qda_tol': 0.000707506441547116}. Best is trial 15 with value: 0.708021.
Trial 10 finished with value: 0.7047050208726613 and parameters: {'qda_reg_param': 0.45, 'qda_tol': 1.3854334053368272e-05}. Best is trial 15 with value: 0.708021.
Trial 12 finished with value: 0.690404344900762 and parameters: {'qda_reg_param': 0.30000000000000004, 'qda_tol': 0.0005173120996279045}. Best is trial 15 with value: 0.708021.
Trial 14 finished with value: 0.044843378911844006 and parameters: {'qda_reg_param': 0.1, 'qda_tol': 5.4933749599923776e-05}. Best is trial 15 with value: 0.708021.
Trial 16 finished with value: 0.7080206915862601 and parameters: {'qda_reg_param': 1.0, 'qda_tol': 5.16385357402337e-06}. Best is trial 15 with value: 0.708021.
Trial 20 finished with value: 0.7080206915862601 and parameters: {'qda_reg_param': 1.0, 'qda_tol': 2.971689457224682e-06}. Best is trial 15 with value: 0.708021.
Trial 17 finished with value: 0.698244139233112 and parameters: {'qda_reg_param': 0.65, 'qda_tol': 4.9937397826083075e-06}. Best is trial 15 with value: 0.708021.
Trial 18 finished with value: 0.698244139233112 and parameters: {'qda_reg_param': 0.65, 'qda_tol': 4.476517242207411e-06}. Best is trial 15 with value: 0.708021.
Trial 23 finished with value: 0.6991119378167865 and parameters: {'qda_reg_param': 0.6000000000000001, 'qda_tol': 3.697821566108523e-06}. Best is trial 15 with value: 0.708021.
Trial 22 finished with value: 0.698244139233112 and parameters: {'qda_reg_param': 0.65, 'qda_tol': 5.337110855529663e-06}. Best is trial 15 with value: 0.708021.
Trial 19 finished with value: 0.698244139233112 and parameters: {'qda_reg_param': 0.65, 'qda_tol': 4.038890057067475e-06}. Best is trial 15 with value: 0.708021.
Trial 21 finished with value: 0.7080206915862601 and parameters: {'qda_reg_param': 1.0, 'qda_tol': 4.831921588560338e-06}. Best is trial 15 with value: 0.708021.
Trial 25 finished with value: 0.7080206915862601 and parameters: {'qda_reg_param': 1.0, 'qda_tol': 1.3345790600908555e-06}. Best is trial 15 with value: 0.708021.
Trial 31 finished with value: 0.7080206915862601 and parameters: {'qda_reg_param': 1.0, 'qda_tol': 1.5117473600271245e-06}. Best is trial 15 with value: 0.708021.
Trial 24 finished with value: 0.7080206915862601 and parameters: {'qda_reg_param': 1.0, 'qda_tol': 1.1772458514220417e-06}. Best is trial 15 with value: 0.708021.
Trial 26 finished with value: 0.7080206915862601 and parameters: {'qda_reg_param': 1.0, 'qda_tol': 1.304960741607805e-06}. Best is trial 15 with value: 0.708021.
Trial 28 finished with value: 0.7080206915862601 and parameters: {'qda_reg_param': 1.0, 'qda_tol': 1.2592276854266864e-06}. Best is trial 15 with value: 0.708021.
Trial 30 finished with value: 0.7080206915862601 and parameters: {'qda_reg_param': 1.0, 'qda_tol': 1.1020409653869342e-06}. Best is trial 15 with value: 0.708021.
Trial 27 finished with value: 0.7080206915862601 and parameters: {'qda_reg_param': 1.0, 'qda_tol': 1.2756998231901979e-06}. Best is trial 15 with value: 0.708021.
Trial 29 finished with value: 0.7080206915862601 and parameters: {'qda_reg_param': 1.0, 'qda_tol': 1.3213362874257187e-06}. Best is trial 15 with value: 0.708021.
Trial 32 finished with value: 0.6964237090495516 and parameters: {'qda_reg_param': 0.9, 'qda_tol': 2.1378206539670155e-06}. Best is trial 15 with value: 0.708021.
A new study created in RDB with name: RandomForestClassifier_f33849d8
sklearn.ensemble.RandomForestClassifier.fit: running accelerated version on CPU
sklearn.ensemble.RandomForestClassifier.fit: fallback to original Scikit-learn
sklearn.ensemble.RandomForestClassifier.fit: fallback to original Scikit-learn
sklearn.ensemble.RandomForestClassifier.fit: fallback to original Scikit-learn
sklearn.ensemble.RandomForestClassifier.fit: running accelerated version on CPU
sklearn.ensemble.RandomForestClassifier.fit: fallback to original Scikit-learn
sklearn.ensemble.RandomForestClassifier.fit: fallback to original Scikit-learn
sklearn.ensemble.RandomForestClassifier.fit: running accelerated version on CPU
sklearn.ensemble.RandomForestClassifier.predict: running accelerated version on CPU
sklearn.ensemble.RandomForestClassifier.predict: running accelerated version on CPU
Trial 5 finished with value: 0.9970192606256569 and parameters: {'rfc_criterion': 'gini', 'rfc_n_estimators': 10, 'rfc_min_samples_split': 8, 'rfc_min_samples_leaf': 43, 'rfc_max_features': 3, 'rfc_bootstrap': False}. Best is trial 5 with value: 0.997019.
sklearn.ensemble.RandomForestClassifier.fit: fallback to original Scikit-learn
Trial 7 finished with value: 0.9969436831127901 and parameters: {'rfc_criterion': 'gini', 'rfc_n_estimators': 10, 'rfc_min_samples_split': 32, 'rfc_min_samples_leaf': 23, 'rfc_max_features': 2, 'rfc_bootstrap': True}. Best is trial 5 with value: 0.997019.
sklearn.ensemble.RandomForestClassifier.fit: fallback to original Scikit-learn
sklearn.ensemble.RandomForestClassifier.predict: running accelerated version on CPU
Trial 4 finished with value: 0.9939249967578527 and parameters: {'rfc_criterion': 'gini', 'rfc_n_estimators': 100, 'rfc_min_samples_split': 47, 'rfc_min_samples_leaf': 18, 'rfc_max_features': 7, 'rfc_bootstrap': True}. Best is trial 5 with value: 0.997019.
sklearn.ensemble.RandomForestClassifier.fit: running accelerated version on CPU
sklearn.ensemble.RandomForestClassifier.predict: running accelerated version on CPU
Trial 10 finished with value: 0.9967559787751235 and parameters: {'rfc_criterion': 'gini', 'rfc_n_estimators': 160, 'rfc_min_samples_split': 11, 'rfc_min_samples_leaf': 23, 'rfc_max_features': 4, 'rfc_bootstrap': False}. Best is trial 5 with value: 0.997019.
sklearn.ensemble.RandomForestClassifier.fit: running accelerated version on CPU
sklearn.ensemble.RandomForestClassifier.predict: running accelerated version on CPU
Trial 11 finished with value: 0.9967000137059155 and parameters: {'rfc_criterion': 'gini', 'rfc_n_estimators': 100, 'rfc_min_samples_split': 50, 'rfc_min_samples_leaf': 12, 'rfc_max_features': 4, 'rfc_bootstrap': True}. Best is trial 5 with value: 0.997019.
sklearn.ensemble.RandomForestClassifier.fit: running accelerated version on CPU
sklearn.ensemble.RandomForestClassifier.predict: running accelerated version on CPU
Trial 12 finished with value: 0.9937252438621631 and parameters: {'rfc_criterion': 'gini', 'rfc_n_estimators': 200, 'rfc_min_samples_split': 30, 'rfc_min_samples_leaf': 24, 'rfc_max_features': 7, 'rfc_bootstrap': False}. Best is trial 5 with value: 0.997019.
sklearn.ensemble.RandomForestClassifier.fit: fallback to original Scikit-learn
sklearn.ensemble.RandomForestClassifier.predict: fallback to original Scikit-learn
sklearn.ensemble.RandomForestClassifier.predict_proba: fallback to original Scikit-learn
Trial 13 finished with value: 0.9999353434515038 and parameters: {'rfc_criterion': 'entropy', 'rfc_n_estimators': 10, 'rfc_min_samples_split': 16, 'rfc_min_samples_leaf': 4, 'rfc_max_features': 3, 'rfc_bootstrap': False}. Best is trial 13 with value: 0.999935.
sklearn.ensemble.RandomForestClassifier.fit: running accelerated version on CPU
sklearn.ensemble.RandomForestClassifier.predict: running accelerated version on CPU
Trial 14 finished with value: 0.993719231440626 and parameters: {'rfc_criterion': 'gini', 'rfc_n_estimators': 120, 'rfc_min_samples_split': 6, 'rfc_min_samples_leaf': 36, 'rfc_max_features': 6, 'rfc_bootstrap': True}. Best is trial 13 with value: 0.999935.
sklearn.ensemble.RandomForestClassifier.fit: fallback to original Scikit-learn
sklearn.ensemble.RandomForestClassifier.predict: fallback to original Scikit-learn
sklearn.ensemble.RandomForestClassifier.predict_proba: fallback to original Scikit-learn
Trial 0 finished with value: 0.9998135808379323 and parameters: {'rfc_criterion': 'entropy', 'rfc_n_estimators': 110, 'rfc_min_samples_split': 8, 'rfc_min_samples_leaf': 8, 'rfc_max_features': 1, 'rfc_bootstrap': True}. Best is trial 13 with value: 0.999935.
sklearn.ensemble.RandomForestClassifier.fit: running accelerated version on CPU
sklearn.ensemble.RandomForestClassifier.predict: running accelerated version on CPU
Trial 16 finished with value: 0.9972351106942495 and parameters: {'rfc_criterion': 'gini', 'rfc_n_estimators': 100, 'rfc_min_samples_split': 7, 'rfc_min_samples_leaf': 6, 'rfc_max_features': 2, 'rfc_bootstrap': False}. Best is trial 13 with value: 0.999935.
sklearn.ensemble.RandomForestClassifier.fit: fallback to original Scikit-learn
sklearn.ensemble.RandomForestClassifier.predict: fallback to original Scikit-learn
sklearn.ensemble.RandomForestClassifier.predict_proba: fallback to original Scikit-learn
Trial 15 finished with value: 0.9995971950194087 and parameters: {'rfc_criterion': 'entropy', 'rfc_n_estimators': 10, 'rfc_min_samples_split': 32, 'rfc_min_samples_leaf': 32, 'rfc_max_features': 7, 'rfc_bootstrap': False}. Best is trial 13 with value: 0.999935.
sklearn.ensemble.RandomForestClassifier.fit: fallback to original Scikit-learn
sklearn.ensemble.RandomForestClassifier.predict: fallback to original Scikit-learn
sklearn.ensemble.RandomForestClassifier.predict_proba: fallback to original Scikit-learn
Trial 18 finished with value: 0.9998881151330836 and parameters: {'rfc_criterion': 'entropy', 'rfc_n_estimators': 60, 'rfc_min_samples_split': 20, 'rfc_min_samples_leaf': 2, 'rfc_max_features': 1, 'rfc_bootstrap': True}. Best is trial 13 with value: 0.999935.
sklearn.ensemble.RandomForestClassifier.fit: fallback to original Scikit-learn
sklearn.ensemble.RandomForestClassifier.predict: fallback to original Scikit-learn
sklearn.ensemble.RandomForestClassifier.predict_proba: fallback to original Scikit-learn
sklearn.ensemble.RandomForestClassifier.predict: fallback to original Scikit-learn
sklearn.ensemble.RandomForestClassifier.predict_proba: fallback to original Scikit-learn
Trial 3 finished with value: 0.999863389882088 and parameters: {'rfc_criterion': 'entropy', 'rfc_n_estimators': 190, 'rfc_min_samples_split': 3, 'rfc_min_samples_leaf': 8, 'rfc_max_features': 3, 'rfc_bootstrap': True}. Best is trial 13 with value: 0.999935.
sklearn.ensemble.RandomForestClassifier.fit: fallback to original Scikit-learn
sklearn.ensemble.RandomForestClassifier.predict: fallback to original Scikit-learn
sklearn.ensemble.RandomForestClassifier.predict_proba: fallback to original Scikit-learn
Trial 17 finished with value: 0.9999627089646833 and parameters: {'rfc_criterion': 'entropy', 'rfc_n_estimators': 60, 'rfc_min_samples_split': 19, 'rfc_min_samples_leaf': 3, 'rfc_max_features': 5, 'rfc_bootstrap': False}. Best is trial 17 with value: 0.999963.
sklearn.ensemble.RandomForestClassifier.fit: fallback to original Scikit-learn
Trial 19 finished with value: 0.9999179585835046 and parameters: {'rfc_criterion': 'entropy', 'rfc_n_estimators': 50, 'rfc_min_samples_split': 19, 'rfc_min_samples_leaf': 1, 'rfc_max_features': 1, 'rfc_bootstrap': True}. Best is trial 17 with value: 0.999963.
sklearn.ensemble.RandomForestClassifier.fit: fallback to original Scikit-learn
sklearn.ensemble.RandomForestClassifier.predict: fallback to original Scikit-learn
sklearn.ensemble.RandomForestClassifier.predict_proba: fallback to original Scikit-learn
Trial 9 finished with value: 0.9998658936870071 and parameters: {'rfc_criterion': 'entropy', 'rfc_n_estimators': 170, 'rfc_min_samples_split': 31, 'rfc_min_samples_leaf': 9, 'rfc_max_features': 5, 'rfc_bootstrap': True}. Best is trial 17 with value: 0.999963.
sklearn.ensemble.RandomForestClassifier.fit: fallback to original Scikit-learn
sklearn.ensemble.RandomForestClassifier.predict: fallback to original Scikit-learn
sklearn.ensemble.RandomForestClassifier.predict_proba: fallback to original Scikit-learn
Trial 2 finished with value: 0.999930379479418 and parameters: {'rfc_criterion': 'entropy', 'rfc_n_estimators': 180, 'rfc_min_samples_split': 5, 'rfc_min_samples_leaf': 5, 'rfc_max_features': 3, 'rfc_bootstrap': False}. Best is trial 17 with value: 0.999963.
sklearn.ensemble.RandomForestClassifier.predict: fallback to original Scikit-learn
sklearn.ensemble.RandomForestClassifier.predict_proba: fallback to original Scikit-learn
sklearn.ensemble.RandomForestClassifier.predict: fallback to original Scikit-learn
sklearn.ensemble.RandomForestClassifier.predict_proba: fallback to original Scikit-learn
Trial 8 finished with value: 0.9996521344359371 and parameters: {'rfc_criterion': 'entropy', 'rfc_n_estimators': 190, 'rfc_min_samples_split': 23, 'rfc_min_samples_leaf': 40, 'rfc_max_features': 5, 'rfc_bootstrap': True}. Best is trial 17 with value: 0.999963.
Trial 20 finished with value: 0.9999030384210759 and parameters: {'rfc_criterion': 'entropy', 'rfc_n_estimators': 50, 'rfc_min_samples_split': 18, 'rfc_min_samples_leaf': 3, 'rfc_max_features': 1, 'rfc_bootstrap': False}. Best is trial 17 with value: 0.999963.
sklearn.ensemble.RandomForestClassifier.predict: fallback to original Scikit-learn
sklearn.ensemble.RandomForestClassifier.predict_proba: fallback to original Scikit-learn
sklearn.ensemble.RandomForestClassifier.predict: fallback to original Scikit-learn
sklearn.ensemble.RandomForestClassifier.predict_proba: fallback to original Scikit-learn
Trial 21 finished with value: 0.9998658687294523 and parameters: {'rfc_criterion': 'entropy', 'rfc_n_estimators': 50, 'rfc_min_samples_split': 19, 'rfc_min_samples_leaf': 14, 'rfc_max_features': 5, 'rfc_bootstrap': False}. Best is trial 17 with value: 0.999963.
Trial 22 finished with value: 0.9998658687294523 and parameters: {'rfc_criterion': 'entropy', 'rfc_n_estimators': 50, 'rfc_min_samples_split': 17, 'rfc_min_samples_leaf': 14, 'rfc_max_features': 5, 'rfc_bootstrap': False}. Best is trial 17 with value: 0.999963.
sklearn.ensemble.RandomForestClassifier.predict: fallback to original Scikit-learn
sklearn.ensemble.RandomForestClassifier.predict_proba: fallback to original Scikit-learn
sklearn.ensemble.RandomForestClassifier.predict: fallback to original Scikit-learn
sklearn.ensemble.RandomForestClassifier.predict_proba: fallback to original Scikit-learn
Trial 23 finished with value: 0.9998609224942608 and parameters: {'rfc_criterion': 'entropy', 'rfc_n_estimators': 50, 'rfc_min_samples_split': 17, 'rfc_min_samples_leaf': 16, 'rfc_max_features': 5, 'rfc_bootstrap': False}. Best is trial 17 with value: 0.999963.
Trial 6 finished with value: 0.9995971950194087 and parameters: {'rfc_criterion': 'entropy', 'rfc_n_estimators': 150, 'rfc_min_samples_split': 18, 'rfc_min_samples_leaf': 32, 'rfc_max_features': 7, 'rfc_bootstrap': False}. Best is trial 17 with value: 0.999963.
sklearn.ensemble.RandomForestClassifier.predict: fallback to original Scikit-learn
sklearn.ensemble.RandomForestClassifier.predict_proba: fallback to original Scikit-learn
Trial 1 finished with value: 0.9998609051071997 and parameters: {'rfc_criterion': 'entropy', 'rfc_n_estimators': 200, 'rfc_min_samples_split': 43, 'rfc_min_samples_leaf': 16, 'rfc_max_features': 5, 'rfc_bootstrap': False}. Best is trial 17 with value: 0.999963.
A new study created in RDB with name: RidgeClassifier_f33849d8
Trial 5 finished with value: 0.6848996760022037 and parameters: {'rc_C': 0.017228899564998568, 'rc_tol': 0.0004999204197999624}. Best is trial 0 with value: 0.6849.
Trial 0 finished with value: 0.6848996760022037 and parameters: {'rc_C': 0.0001307732772186993, 'rc_tol': 0.00036279336194416673}. Best is trial 0 with value: 0.6849.
Trial 1 finished with value: 0.6848996760022037 and parameters: {'rc_C': 0.002697717888192462, 'rc_tol': 0.00031178383204810066}. Best is trial 0 with value: 0.6849.
Trial 3 finished with value: 0.6848996760022037 and parameters: {'rc_C': 0.02217023744712637, 'rc_tol': 0.0002177748341233967}. Best is trial 0 with value: 0.6849.
Trial 7 finished with value: 0.6848996760022037 and parameters: {'rc_C': 10.18821779823012, 'rc_tol': 0.0013243172134204556}. Best is trial 0 with value: 0.6849.
Trial 2 finished with value: 0.6848996760022037 and parameters: {'rc_C': 0.00019539234025880484, 'rc_tol': 0.007963583256494839}. Best is trial 0 with value: 0.6849.
Trial 6 finished with value: 0.6848996760022037 and parameters: {'rc_C': 85295.26823089589, 'rc_tol': 0.0013931180671719944}. Best is trial 0 with value: 0.6849.
Trial 4 finished with value: 0.6848996760022037 and parameters: {'rc_C': 125733.48585257972, 'rc_tol': 0.001446903142716679}. Best is trial 0 with value: 0.6849.
Trial 13 finished with value: 0.6848996760022037 and parameters: {'rc_C': 2910.2518031491736, 'rc_tol': 0.008403757701850695}. Best is trial 0 with value: 0.6849.
Trial 9 finished with value: 0.6848996760022037 and parameters: {'rc_C': 7.746147389083297, 'rc_tol': 0.00019352753394090552}. Best is trial 0 with value: 0.6849.
Trial 8 finished with value: 0.6848996760022037 and parameters: {'rc_C': 50.071707062795745, 'rc_tol': 0.00018487258752098278}. Best is trial 0 with value: 0.6849.
Trial 14 finished with value: 0.6848996760022037 and parameters: {'rc_C': 2.1498340192307364e-06, 'rc_tol': 0.006443732727936378}. Best is trial 0 with value: 0.6849.
Trial 11 finished with value: 0.6848996760022037 and parameters: {'rc_C': 0.0030648438064297466, 'rc_tol': 0.0031582242959797696}. Best is trial 0 with value: 0.6849.
Trial 10 finished with value: 0.6848996760022037 and parameters: {'rc_C': 2.136230228639951e-06, 'rc_tol': 0.00027253692008619824}. Best is trial 0 with value: 0.6849.
Trial 12 finished with value: 0.6848996760022037 and parameters: {'rc_C': 0.37188970740119764, 'rc_tol': 0.0001455045001909453}. Best is trial 0 with value: 0.6849.
Trial 15 finished with value: 0.6848996760022037 and parameters: {'rc_C': 5.998414753217432, 'rc_tol': 0.0009358808605639123}. Best is trial 0 with value: 0.6849.
Trial 16 finished with value: 0.6848996760022037 and parameters: {'rc_C': 0.00015411312427246316, 'rc_tol': 0.00042528659981660305}. Best is trial 0 with value: 0.6849.
Trial 18 finished with value: 0.6848996760022037 and parameters: {'rc_C': 0.00017248975927534668, 'rc_tol': 0.00037458757417310794}. Best is trial 0 with value: 0.6849.
Trial 20 finished with value: 0.6848996760022037 and parameters: {'rc_C': 8.724958016985068e-05, 'rc_tol': 0.0004504419272400996}. Best is trial 0 with value: 0.6849.
Trial 23 finished with value: 0.6848996760022037 and parameters: {'rc_C': 0.00013417616260037987, 'rc_tol': 0.0005126051558349444}. Best is trial 0 with value: 0.6849.
Trial 17 finished with value: 0.6848996760022037 and parameters: {'rc_C': 0.00018135988988200906, 'rc_tol': 0.0005093800314344236}. Best is trial 0 with value: 0.6849.
Trial 21 finished with value: 0.6848996760022037 and parameters: {'rc_C': 0.00010567097346821975, 'rc_tol': 0.0004667419965775631}. Best is trial 0 with value: 0.6849.
Trial 22 finished with value: 0.6848996760022037 and parameters: {'rc_C': 0.00018206098223993417, 'rc_tol': 0.0004395625481249286}. Best is trial 0 with value: 0.6849.
Trial 19 finished with value: 0.6848996760022037 and parameters: {'rc_C': 0.0001260719071005515, 'rc_tol': 0.0005461150069427262}. Best is trial 0 with value: 0.6849.
Trial 29 finished with value: 0.6848996760022037 and parameters: {'rc_C': 1.1197043436210564e-05, 'rc_tol': 0.0007470333669113164}. Best is trial 0 with value: 0.6849.
Trial 28 finished with value: 0.6848996760022037 and parameters: {'rc_C': 6.939207036044151e-06, 'rc_tol': 0.00011076667832348612}. Best is trial 0 with value: 0.6849.
Trial 27 finished with value: 0.6848996760022037 and parameters: {'rc_C': 7.048636411581635e-06, 'rc_tol': 0.0008930444212665259}. Best is trial 0 with value: 0.6849.
Trial 26 finished with value: 0.6848996760022037 and parameters: {'rc_C': 9.602936389940661e-06, 'rc_tol': 0.00011249587431015425}. Best is trial 0 with value: 0.6849.
Trial 25 finished with value: 0.6848996760022037 and parameters: {'rc_C': 3.2494738185101693e-06, 'rc_tol': 0.00010334361295185903}. Best is trial 0 with value: 0.6849.
Trial 31 finished with value: 0.6848996760022037 and parameters: {'rc_C': 4.9843121691159405e-06, 'rc_tol': 0.00010325702900576947}. Best is trial 0 with value: 0.6849.
Trial 24 finished with value: 0.6848996760022037 and parameters: {'rc_C': 9.51742612252401e-06, 'rc_tol': 0.0007437992383622112}. Best is trial 0 with value: 0.6849.
Trial 30 finished with value: 0.6848996760022037 and parameters: {'rc_C': 7.200228305731651e-06, 'rc_tol': 0.00010518913546162869}. Best is trial 0 with value: 0.6849.
Trial 33 finished with value: 0.6848996760022037 and parameters: {'rc_C': 0.0027638523264130813, 'rc_tol': 0.00244511240444676}. Best is trial 0 with value: 0.6849.
Trial 34 finished with value: 0.6848996760022037 and parameters: {'rc_C': 0.001995946895196945, 'rc_tol': 0.0019169588301756705}. Best is trial 0 with value: 0.6849.
Trial 32 finished with value: 0.6848996760022037 and parameters: {'rc_C': 0.0016302247393000513, 'rc_tol': 0.0023297999512273265}. Best is trial 0 with value: 0.6849.
A new study created in RDB with name: RUSBoostClassifier_f33849d8
Trial 3 finished with value: 0.0006044929990853171 and parameters: {'rusbc_n_estimators': 25, 'rusbc_learning_rate': 0.0014592538979183688, 'rusbc_sampling_strategy': 'not minority'}. Best is trial 3 with value: 0.000604493.
Trial 1 finished with value: 0.0063047772610780725 and parameters: {'rusbc_n_estimators': 25, 'rusbc_learning_rate': 0.03145554036647104, 'rusbc_sampling_strategy': 'not minority'}. Best is trial 1 with value: 0.00630478.
Trial 4 finished with value: 0.7533381079886495 and parameters: {'rusbc_n_estimators': 75, 'rusbc_learning_rate': 0.0484968302514775, 'rusbc_sampling_strategy': 'all'}. Best is trial 4 with value: 0.753338.
